Sheet: Sheet1
A1: 0 | B1: 1 | C1: 2 | D1: 3 | E1: 4 | F1: 5 | G1: 6 | H1: 7 | I1: 8
A2: =CELL("width",C ) -> 10 | B2: =CELL("width",C ) -> 11 | C2: =CELL("width",C ) -> 11 | D2: =CELL("width",C ) -> 11 | E2: =CELL("width",C ) -> 10 | F2: =CELL("width",C ) -> 10 | G2: =CELL("width",C ) -> 10 | H2: =CELL("width",C ) -> 10 | I2: =CELL("width",C ) -> 10