Sheet: Numbers
A1: Angle | B1: Sine | C1: Cosine
A2: 0 | B2: =SIN(RADIANS(RC[-1])) -> 0 | C2: =COS(RADIANS(RC[-2])) -> 1
A3: 1 | B3: =SIN(RADIANS(RC[-1])) -> 1.7452406437283512E-2 | C3: =COS(RADIANS(RC[-2])) -> 0.99984769515639127
A4: 2 | B4: =SIN(RADIANS(RC[-1])) -> 3.4899496702500969E-2 | C4: =COS(RADIANS(RC[-2])) -> 0.99939082701909576
A5: 3 | B5: =SIN(RADIANS(RC[-1])) -> 5.2335956242943835E-2 | C5: =COS(RADIANS(RC[-2])) -> 0.99862953475457383
A6: 4 | B6: =SIN(RADIANS(RC[-1])) -> 6.9756473744125302E-2 | C6: =COS(RADIANS(RC[-2])) -> 0.9975640502598242
A7: 5 | B7: =SIN(RADIANS(RC[-1])) -> 8.7155742747658166E-2 | C7: =COS(RADIANS(RC[-2])) -> 0.99619469809174555
A8: 6 | B8: =SIN(RADIANS(RC[-1])) -> 0.10452846326765347 | C8: =COS(RADIANS(RC[-2])) -> 0.99452189536827329
A9: 7 | B9: =SIN(RADIANS(RC[-1])) -> 0.12186934340514748 | C9: =COS(RADIANS(RC[-2])) -> 0.99254615164132198
A10: 8 | B10: =SIN(RADIANS(RC[-1])) -> 0.13917310096006544 | C10: =COS(RADIANS(RC[-2])) -> 0.99026806874157036
A11: 9 | B11: =SIN(RADIANS(RC[-1])) -> 0.15643446504023087 | C11: =COS(RADIANS(RC[-2])) -> 0.98768834059513777
A12: 10 | B12: =SIN(RADIANS(RC[-1])) -> 0.17364817766693033 | C12: =COS(RADIANS(RC[-2])) -> 0.98480775301220802
A13: 11 | B13: =SIN(RADIANS(RC[-1])) -> 0.1908089953765448 | C13: =COS(RADIANS(RC[-2])) -> 0.98162718344766398
A14: 12 | B14: =SIN(RADIANS(RC[-1])) -> 0.20791169081775934 | C14: =COS(RADIANS(RC[-2])) -> 0.97814760073380569
A15: 13 | B15: =SIN(RADIANS(RC[-1])) -> 0.224951054343865 | C15: =COS(RADIANS(RC[-2])) -> 0.97437006478523525
A16: 14 | B16: =SIN(RADIANS(RC[-1])) -> 0.24192189559966773 | C16: =COS(RADIANS(RC[-2])) -> 0.97029572627599647
A17: 15 | B17: =SIN(RADIANS(RC[-1])) -> 0.25881904510252074 | C17: =COS(RADIANS(RC[-2])) -> 0.96592582628906831
A18: 16 | B18: =SIN(RADIANS(RC[-1])) -> 0.27563735581699916 | C18: =COS(RADIANS(RC[-2])) -> 0.96126169593831889
A19: 17 | B19: =SIN(RADIANS(RC[-1])) -> 0.29237170472273677 | C19: =COS(RADIANS(RC[-2])) -> 0.95630475596303544
A20: 18 | B20: =SIN(RADIANS(RC[-1])) -> 0.3090169943749474 | C20: =COS(RADIANS(RC[-2])) -> 0.95105651629515353
A21: 19 | B21: =SIN(RADIANS(RC[-1])) -> 0.3255681544571567 | C21: =COS(RADIANS(RC[-2])) -> 0.94551857559931685
A22: 20 | B22: =SIN(RADIANS(RC[-1])) -> 0.34202014332566871 | C22: =COS(RADIANS(RC[-2])) -> 0.93969262078590843
A23: 21 | B23: =SIN(RADIANS(RC[-1])) -> 0.35836794954530027 | C23: =COS(RADIANS(RC[-2])) -> 0.93358042649720174
A24: 22 | B24: =SIN(RADIANS(RC[-1])) -> 0.37460659341591201 | C24: =COS(RADIANS(RC[-2])) -> 0.92718385456678742
A25: 23 | B25: =SIN(RADIANS(RC[-1])) -> 0.39073112848927377 | C25: =COS(RADIANS(RC[-2])) -> 0.92050485345244037
A26: 24 | B26: =SIN(RADIANS(RC[-1])) -> 0.40673664307580021 | C26: =COS(RADIANS(RC[-2])) -> 0.91354545764260087
A27: 25 | B27: =SIN(RADIANS(RC[-1])) -> 0.42261826174069944 | C27: =COS(RADIANS(RC[-2])) -> 0.90630778703664994
A28: 26 | B28: =SIN(RADIANS(RC[-1])) -> 0.4383711467890774 | C28: =COS(RADIANS(RC[-2])) -> 0.89879404629916704
A29: 27 | B29: =SIN(RADIANS(RC[-1])) -> 0.45399049973954675 | C29: =COS(RADIANS(RC[-2])) -> 0.8910065241883679
A30: 28 | B30: =SIN(RADIANS(RC[-1])) -> 0.46947156278589081 | C30: =COS(RADIANS(RC[-2])) -> 0.88294759285892699
A31: 29 | B31: =SIN(RADIANS(RC[-1])) -> 0.48480962024633706 | C31: =COS(RADIANS(RC[-2])) -> 0.87461970713939574
A32: 30 | B32: =SIN(RADIANS(RC[-1])) -> 0.49999999999999994 | C32: =COS(RADIANS(RC[-2])) -> 0.86602540378443871
A33: 31 | B33: =SIN(RADIANS(RC[-1])) -> 0.51503807491005416 | C33: =COS(RADIANS(RC[-2])) -> 0.85716730070211233
A34: 32 | B34: =SIN(RADIANS(RC[-1])) -> 0.5299192642332049 | C34: =COS(RADIANS(RC[-2])) -> 0.84804809615642596
A35: 33 | B35: =SIN(RADIANS(RC[-1])) -> 0.54463903501502708 | C35: =COS(RADIANS(RC[-2])) -> 0.83867056794542405
A36: 34 | B36: =SIN(RADIANS(RC[-1])) -> 0.5591929034707469 | C36: =COS(RADIANS(RC[-2])) -> 0.82903757255504162
A37: 35 | B37: =SIN(RADIANS(RC[-1])) -> 0.57357643635104605 | C37: =COS(RADIANS(RC[-2])) -> 0.8191520442889918
A38: 36 | B38: =SIN(RADIANS(RC[-1])) -> 0.58778525229247314 | C38: =COS(RADIANS(RC[-2])) -> 0.80901699437494745
A39: 37 | B39: =SIN(RADIANS(RC[-1])) -> 0.60181502315204827 | C39: =COS(RADIANS(RC[-2])) -> 0.79863551004729283
A40: 38 | B40: =SIN(RADIANS(RC[-1])) -> 0.61566147532565829 | C40: =COS(RADIANS(RC[-2])) -> 0.7880107536067219
A41: 39 | B41: =SIN(RADIANS(RC[-1])) -> 0.62932039104983739 | C41: =COS(RADIANS(RC[-2])) -> 0.7771459614569709
A42: 40 | B42: =SIN(RADIANS(RC[-1])) -> 0.64278760968653925 | C42: =COS(RADIANS(RC[-2])) -> 0.76604444311897801
A43: 41 | B43: =SIN(RADIANS(RC[-1])) -> 0.65605902899050728 | C43: =COS(RADIANS(RC[-2])) -> 0.75470958022277201
A44: 42 | B44: =SIN(RADIANS(RC[-1])) -> 0.66913060635885824 | C44: =COS(RADIANS(RC[-2])) -> 0.74314482547739424
A45: 43 | B45: =SIN(RADIANS(RC[-1])) -> 0.68199836006249848 | C45: =COS(RADIANS(RC[-2])) -> 0.73135370161917046
A46: 44 | B46: =SIN(RADIANS(RC[-1])) -> 0.69465837045899725 | C46: =COS(RADIANS(RC[-2])) -> 0.71933980033865119
A47: 45 | B47: =SIN(RADIANS(RC[-1])) -> 0.70710678118654746 | C47: =COS(RADIANS(RC[-2])) -> 0.70710678118654757
A48: 46 | B48: =SIN(RADIANS(RC[-1])) -> 0.71933980033865108 | C48: =COS(RADIANS(RC[-2])) -> 0.69465837045899725
A49: 47 | B49: =SIN(RADIANS(RC[-1])) -> 0.73135370161917046 | C49: =COS(RADIANS(RC[-2])) -> 0.68199836006249848
A50: 48 | B50: =SIN(RADIANS(RC[-1])) -> 0.74314482547739424 | C50: =COS(RADIANS(RC[-2])) -> 0.66913060635885824
A51: 49 | B51: =SIN(RADIANS(RC[-1])) -> 0.75470958022277201 | C51: =COS(RADIANS(RC[-2])) -> 0.65605902899050728
A52: 50 | B52: =SIN(RADIANS(RC[-1])) -> 0.76604444311897801 | C52: =COS(RADIANS(RC[-2])) -> 0.64278760968653936
A53: 51 | B53: =SIN(RADIANS(RC[-1])) -> 0.7771459614569709 | C53: =COS(RADIANS(RC[-2])) -> 0.6293203910498375
A54: 52 | B54: =SIN(RADIANS(RC[-1])) -> 0.78801075360672201 | C54: =COS(RADIANS(RC[-2])) -> 0.61566147532565829
A55: 53 | B55: =SIN(RADIANS(RC[-1])) -> 0.79863551004729283 | C55: =COS(RADIANS(RC[-2])) -> 0.60181502315204838
A56: 54 | B56: =SIN(RADIANS(RC[-1])) -> 0.80901699437494745 | C56: =COS(RADIANS(RC[-2])) -> 0.58778525229247314
A57: 55 | B57: =SIN(RADIANS(RC[-1])) -> 0.8191520442889918 | C57: =COS(RADIANS(RC[-2])) -> 0.57357643635104616
A58: 56 | B58: =SIN(RADIANS(RC[-1])) -> 0.82903757255504174 | C58: =COS(RADIANS(RC[-2])) -> 0.55919290347074679
A59: 57 | B59: =SIN(RADIANS(RC[-1])) -> 0.83867056794542405 | C59: =COS(RADIANS(RC[-2])) -> 0.54463903501502708
A60: 58 | B60: =SIN(RADIANS(RC[-1])) -> 0.84804809615642596 | C60: =COS(RADIANS(RC[-2])) -> 0.5299192642332049
A61: 59 | B61: =SIN(RADIANS(RC[-1])) -> 0.85716730070211233 | C61: =COS(RADIANS(RC[-2])) -> 0.51503807491005416
A62: 60 | B62: =SIN(RADIANS(RC[-1])) -> 0.8660254037844386 | C62: =COS(RADIANS(RC[-2])) -> 0.50000000000000011
A63: 61 | B63: =SIN(RADIANS(RC[-1])) -> 0.87461970713939574 | C63: =COS(RADIANS(RC[-2])) -> 0.48480962024633711
A64: 62 | B64: =SIN(RADIANS(RC[-1])) -> 0.88294759285892688 | C64: =COS(RADIANS(RC[-2])) -> 0.46947156278589086
A65: 63 | B65: =SIN(RADIANS(RC[-1])) -> 0.89100652418836779 | C65: =COS(RADIANS(RC[-2])) -> 0.4539904997395468
A66: 64 | B66: =SIN(RADIANS(RC[-1])) -> 0.89879404629916704 | C66: =COS(RADIANS(RC[-2])) -> 0.43837114678907746
A67: 65 | B67: =SIN(RADIANS(RC[-1])) -> 0.90630778703664994 | C67: =COS(RADIANS(RC[-2])) -> 0.42261826174069944
A68: 66 | B68: =SIN(RADIANS(RC[-1])) -> 0.91354545764260087 | C68: =COS(RADIANS(RC[-2])) -> 0.40673664307580021
A69: 67 | B69: =SIN(RADIANS(RC[-1])) -> 0.92050485345244037 | C69: =COS(RADIANS(RC[-2])) -> 0.39073112848927372
A70: 68 | B70: =SIN(RADIANS(RC[-1])) -> 0.92718385456678742 | C70: =COS(RADIANS(RC[-2])) -> 0.37460659341591196
A71: 69 | B71: =SIN(RADIANS(RC[-1])) -> 0.93358042649720174 | C71: =COS(RADIANS(RC[-2])) -> 0.35836794954530038
A72: 70 | B72: =SIN(RADIANS(RC[-1])) -> 0.93969262078590832 | C72: =COS(RADIANS(RC[-2])) -> 0.34202014332566882
A73: 71 | B73: =SIN(RADIANS(RC[-1])) -> 0.94551857559931674 | C73: =COS(RADIANS(RC[-2])) -> 0.32556815445715676
A74: 72 | B74: =SIN(RADIANS(RC[-1])) -> 0.95105651629515353 | C74: =COS(RADIANS(RC[-2])) -> 0.30901699437494745
A75: 73 | B75: =SIN(RADIANS(RC[-1])) -> 0.95630475596303544 | C75: =COS(RADIANS(RC[-2])) -> 0.29237170472273677
A76: 74 | B76: =SIN(RADIANS(RC[-1])) -> 0.96126169593831889 | C76: =COS(RADIANS(RC[-2])) -> 0.27563735581699916
A77: 75 | B77: =SIN(RADIANS(RC[-1])) -> 0.96592582628906831 | C77: =COS(RADIANS(RC[-2])) -> 0.25881904510252074
A78: 76 | B78: =SIN(RADIANS(RC[-1])) -> 0.97029572627599647 | C78: =COS(RADIANS(RC[-2])) -> 0.24192189559966767
A79: 77 | B79: =SIN(RADIANS(RC[-1])) -> 0.97437006478523525 | C79: =COS(RADIANS(RC[-2])) -> 0.22495105434386492
A80: 78 | B80: =SIN(RADIANS(RC[-1])) -> 0.97814760073380558 | C80: =COS(RADIANS(RC[-2])) -> 0.20791169081775945
A81: 79 | B81: =SIN(RADIANS(RC[-1])) -> 0.98162718344766398 | C81: =COS(RADIANS(RC[-2])) -> 0.19080899537654492
A82: 80 | B82: =SIN(RADIANS(RC[-1])) -> 0.98480775301220802 | C82: =COS(RADIANS(RC[-2])) -> 0.17364817766693041
A83: 81 | B83: =SIN(RADIANS(RC[-1])) -> 0.98768834059513777 | C83: =COS(RADIANS(RC[-2])) -> 0.15643446504023092
A84: 82 | B84: =SIN(RADIANS(RC[-1])) -> 0.99026806874157036 | C84: =COS(RADIANS(RC[-2])) -> 0.13917310096006547
A85: 83 | B85: =SIN(RADIANS(RC[-1])) -> 0.99254615164132198 | C85: =COS(RADIANS(RC[-2])) -> 0.12186934340514749
A86: 84 | B86: =SIN(RADIANS(RC[-1])) -> 0.99452189536827329 | C86: =COS(RADIANS(RC[-2])) -> 0.10452846326765346
A87: 85 | B87: =SIN(RADIANS(RC[-1])) -> 0.99619469809174555 | C87: =COS(RADIANS(RC[-2])) -> 8.7155742747658138E-2
A88: 86 | B88: =SIN(RADIANS(RC[-1])) -> 0.9975640502598242 | C88: =COS(RADIANS(RC[-2])) -> 6.9756473744125233E-2
A89: 87 | B89: =SIN(RADIANS(RC[-1])) -> 0.99862953475457383 | C89: =COS(RADIANS(RC[-2])) -> 5.2335956242943966E-2
A90: 88 | B90: =SIN(RADIANS(RC[-1])) -> 0.99939082701909576 | C90: =COS(RADIANS(RC[-2])) -> 3.489949670250108E-2
A91: 89 | B91: =SIN(RADIANS(RC[-1])) -> 0.99984769515639127 | C91: =COS(RADIANS(RC[-2])) -> 1.7452406437283598E-2
A92: 90 | B92: =SIN(RADIANS(RC[-1])) -> 1 | C92: =COS(RADIANS(RC[-2])) -> 6.1257422745431001E-17
A93: 91 | B93: =SIN(RADIANS(RC[-1])) -> 0.99984769515639127 | C93: =COS(RADIANS(RC[-2])) -> -1.7452406437283477E-2
A94: 92 | B94: =SIN(RADIANS(RC[-1])) -> 0.99939082701909576 | C94: =COS(RADIANS(RC[-2])) -> -3.4899496702500955E-2
A95: 93 | B95: =SIN(RADIANS(RC[-1])) -> 0.99862953475457383 | C95: =COS(RADIANS(RC[-2])) -> -5.2335956242943842E-2
A96: 94 | B96: =SIN(RADIANS(RC[-1])) -> 0.9975640502598242 | C96: =COS(RADIANS(RC[-2])) -> -6.975647374412533E-2
A97: 95 | B97: =SIN(RADIANS(RC[-1])) -> 0.99619469809174555 | C97: =COS(RADIANS(RC[-2])) -> -8.7155742747658235E-2
A98: 96 | B98: =SIN(RADIANS(RC[-1])) -> 0.99452189536827329 | C98: =COS(RADIANS(RC[-2])) -> -0.10452846326765355
A99: 97 | B99: =SIN(RADIANS(RC[-1])) -> 0.99254615164132209 | C99: =COS(RADIANS(RC[-2])) -> -0.12186934340514737
A100: 98 | B100: =SIN(RADIANS(RC[-1])) -> 0.99026806874157036 | C100: =COS(RADIANS(RC[-2])) -> -0.13917310096006535
A101: 99 | B101: =SIN(RADIANS(RC[-1])) -> 0.98768834059513777 | C101: =COS(RADIANS(RC[-2])) -> -0.15643446504023081
A102: 100 | B102: =SIN(RADIANS(RC[-1])) -> 0.98480775301220802 | C102: =COS(RADIANS(RC[-2])) -> -0.1736481776669303
A103: 101 | B103: =SIN(RADIANS(RC[-1])) -> 0.98162718344766398 | C103: =COS(RADIANS(RC[-2])) -> -0.1908089953765448
A104: 102 | B104: =SIN(RADIANS(RC[-1])) -> 0.97814760073380569 | C104: =COS(RADIANS(RC[-2])) -> -0.20791169081775934
A105: 103 | B105: =SIN(RADIANS(RC[-1])) -> 0.97437006478523525 | C105: =COS(RADIANS(RC[-2])) -> -0.22495105434386503
A106: 104 | B106: =SIN(RADIANS(RC[-1])) -> 0.97029572627599647 | C106: =COS(RADIANS(RC[-2])) -> -0.24192189559966779
A107: 105 | B107: =SIN(RADIANS(RC[-1])) -> 0.96592582628906831 | C107: =COS(RADIANS(RC[-2])) -> -0.25881904510252085
A108: 106 | B108: =SIN(RADIANS(RC[-1])) -> 0.96126169593831889 | C108: =COS(RADIANS(RC[-2])) -> -0.27563735581699905
A109: 107 | B109: =SIN(RADIANS(RC[-1])) -> 0.95630475596303555 | C109: =COS(RADIANS(RC[-2])) -> -0.29237170472273666
A110: 108 | B110: =SIN(RADIANS(RC[-1])) -> 0.95105651629515364 | C110: =COS(RADIANS(RC[-2])) -> -0.30901699437494734
A111: 109 | B111: =SIN(RADIANS(RC[-1])) -> 0.94551857559931685 | C111: =COS(RADIANS(RC[-2])) -> -0.32556815445715664
A112: 110 | B112: =SIN(RADIANS(RC[-1])) -> 0.93969262078590843 | C112: =COS(RADIANS(RC[-2])) -> -0.34202014332566871
A113: 111 | B113: =SIN(RADIANS(RC[-1])) -> 0.93358042649720174 | C113: =COS(RADIANS(RC[-2])) -> -0.35836794954530027
A114: 112 | B114: =SIN(RADIANS(RC[-1])) -> 0.92718385456678742 | C114: =COS(RADIANS(RC[-2])) -> -0.37460659341591207
A115: 113 | B115: =SIN(RADIANS(RC[-1])) -> 0.92050485345244026 | C115: =COS(RADIANS(RC[-2])) -> -0.39073112848927377
A116: 114 | B116: =SIN(RADIANS(RC[-1])) -> 0.91354545764260087 | C116: =COS(RADIANS(RC[-2])) -> -0.40673664307580026
A117: 115 | B117: =SIN(RADIANS(RC[-1])) -> 0.90630778703665005 | C117: =COS(RADIANS(RC[-2])) -> -0.42261826174069933
A118: 116 | B118: =SIN(RADIANS(RC[-1])) -> 0.89879404629916693 | C118: =COS(RADIANS(RC[-2])) -> -0.43837114678907751
A119: 117 | B119: =SIN(RADIANS(RC[-1])) -> 0.8910065241883679 | C119: =COS(RADIANS(RC[-2])) -> -0.45399049973954669
A120: 118 | B120: =SIN(RADIANS(RC[-1])) -> 0.88294759285892688 | C120: =COS(RADIANS(RC[-2])) -> -0.46947156278589092
A121: 119 | B121: =SIN(RADIANS(RC[-1])) -> 0.87461970713939585 | C121: =COS(RADIANS(RC[-2])) -> -0.484809620246337
A122: 120 | B122: =SIN(RADIANS(RC[-1])) -> 0.86602540378443871 | C122: =COS(RADIANS(RC[-2])) -> -0.49999999999999978
A123: 121 | B123: =SIN(RADIANS(RC[-1])) -> 0.85716730070211233 | C123: =COS(RADIANS(RC[-2])) -> -0.51503807491005427
A124: 122 | B124: =SIN(RADIANS(RC[-1])) -> 0.84804809615642607 | C124: =COS(RADIANS(RC[-2])) -> -0.52991926423320479
A125: 123 | B125: =SIN(RADIANS(RC[-1])) -> 0.83867056794542394 | C125: =COS(RADIANS(RC[-2])) -> -0.54463903501502708
A126: 124 | B126: =SIN(RADIANS(RC[-1])) -> 0.82903757255504174 | C126: =COS(RADIANS(RC[-2])) -> -0.55919290347074668
A127: 125 | B127: =SIN(RADIANS(RC[-1])) -> 0.81915204428899169 | C127: =COS(RADIANS(RC[-2])) -> -0.57357643635104616
A128: 126 | B128: =SIN(RADIANS(RC[-1])) -> 0.80901699437494745 | C128: =COS(RADIANS(RC[-2])) -> -0.58778525229247303
A129: 127 | B129: =SIN(RADIANS(RC[-1])) -> 0.79863551004729272 | C129: =COS(RADIANS(RC[-2])) -> -0.60181502315204838
A130: 128 | B130: =SIN(RADIANS(RC[-1])) -> 0.78801075360672201 | C130: =COS(RADIANS(RC[-2])) -> -0.61566147532565829
A131: 129 | B131: =SIN(RADIANS(RC[-1])) -> 0.77714596145697101 | C131: =COS(RADIANS(RC[-2])) -> -0.62932039104983728
A132: 130 | B132: =SIN(RADIANS(RC[-1])) -> 0.76604444311897801 | C132: =COS(RADIANS(RC[-2])) -> -0.64278760968653936
A133: 131 | B133: =SIN(RADIANS(RC[-1])) -> 0.75470958022277213 | C133: =COS(RADIANS(RC[-2])) -> -0.65605902899050716
A134: 132 | B134: =SIN(RADIANS(RC[-1])) -> 0.74314482547739424 | C134: =COS(RADIANS(RC[-2])) -> -0.66913060635885824
A135: 133 | B135: =SIN(RADIANS(RC[-1])) -> 0.73135370161917057 | C135: =COS(RADIANS(RC[-2])) -> -0.68199836006249837
A136: 134 | B136: =SIN(RADIANS(RC[-1])) -> 0.71933980033865108 | C136: =COS(RADIANS(RC[-2])) -> -0.69465837045899737
A137: 135 | B137: =SIN(RADIANS(RC[-1])) -> 0.70710678118654757 | C137: =COS(RADIANS(RC[-2])) -> -0.70710678118654746
A138: 136 | B138: =SIN(RADIANS(RC[-1])) -> 0.69465837045899714 | C138: =COS(RADIANS(RC[-2])) -> -0.71933980033865119
A139: 137 | B139: =SIN(RADIANS(RC[-1])) -> 0.68199836006249859 | C139: =COS(RADIANS(RC[-2])) -> -0.73135370161917046
A140: 138 | B140: =SIN(RADIANS(RC[-1])) -> 0.66913060635885835 | C140: =COS(RADIANS(RC[-2])) -> -0.74314482547739402
A141: 139 | B141: =SIN(RADIANS(RC[-1])) -> 0.65605902899050728 | C141: =COS(RADIANS(RC[-2])) -> -0.75470958022277201
A142: 140 | B142: =SIN(RADIANS(RC[-1])) -> 0.64278760968653947 | C142: =COS(RADIANS(RC[-2])) -> -0.7660444431189779
A143: 141 | B143: =SIN(RADIANS(RC[-1])) -> 0.62932039104983739 | C143: =COS(RADIANS(RC[-2])) -> -0.7771459614569709
A144: 142 | B144: =SIN(RADIANS(RC[-1])) -> 0.6156614753256584 | C144: =COS(RADIANS(RC[-2])) -> -0.7880107536067219
A145: 143 | B145: =SIN(RADIANS(RC[-1])) -> 0.60181502315204816 | C145: =COS(RADIANS(RC[-2])) -> -0.79863551004729294
A146: 144 | B146: =SIN(RADIANS(RC[-1])) -> 0.58778525229247325 | C146: =COS(RADIANS(RC[-2])) -> -0.80901699437494734
A147: 145 | B147: =SIN(RADIANS(RC[-1])) -> 0.57357643635104594 | C147: =COS(RADIANS(RC[-2])) -> -0.81915204428899191
A148: 146 | B148: =SIN(RADIANS(RC[-1])) -> 0.5591929034707469 | C148: =COS(RADIANS(RC[-2])) -> -0.82903757255504162
A149: 147 | B149: =SIN(RADIANS(RC[-1])) -> 0.54463903501502731 | C149: =COS(RADIANS(RC[-2])) -> -0.83867056794542394
A150: 148 | B150: =SIN(RADIANS(RC[-1])) -> 0.5299192642332049 | C150: =COS(RADIANS(RC[-2])) -> -0.84804809615642596
A151: 149 | B151: =SIN(RADIANS(RC[-1])) -> 0.51503807491005438 | C151: =COS(RADIANS(RC[-2])) -> -0.85716730070211222
A152: 150 | B152: =SIN(RADIANS(RC[-1])) -> 0.49999999999999994 | C152: =COS(RADIANS(RC[-2])) -> -0.86602540378443871
A153: 151 | B153: =SIN(RADIANS(RC[-1])) -> 0.48480962024633717 | C153: =COS(RADIANS(RC[-2])) -> -0.87461970713939574
A154: 152 | B154: =SIN(RADIANS(RC[-1])) -> 0.46947156278589069 | C154: =COS(RADIANS(RC[-2])) -> -0.88294759285892699
A155: 153 | B155: =SIN(RADIANS(RC[-1])) -> 0.45399049973954686 | C155: =COS(RADIANS(RC[-2])) -> -0.89100652418836779
A156: 154 | B156: =SIN(RADIANS(RC[-1])) -> 0.43837114678907729 | C156: =COS(RADIANS(RC[-2])) -> -0.89879404629916704
A157: 155 | B157: =SIN(RADIANS(RC[-1])) -> 0.4226182617406995 | C157: =COS(RADIANS(RC[-2])) -> -0.90630778703664994
A158: 156 | B158: =SIN(RADIANS(RC[-1])) -> 0.40673664307580043 | C158: =COS(RADIANS(RC[-2])) -> -0.91354545764260076
A159: 157 | B159: =SIN(RADIANS(RC[-1])) -> 0.39073112848927377 | C159: =COS(RADIANS(RC[-2])) -> -0.92050485345244037
A160: 158 | B160: =SIN(RADIANS(RC[-1])) -> 0.37460659341591224 | C160: =COS(RADIANS(RC[-2])) -> -0.92718385456678731
A161: 159 | B161: =SIN(RADIANS(RC[-1])) -> 0.35836794954530021 | C161: =COS(RADIANS(RC[-2])) -> -0.93358042649720174
A162: 160 | B162: =SIN(RADIANS(RC[-1])) -> 0.34202014332566888 | C162: =COS(RADIANS(RC[-2])) -> -0.93969262078590832
A163: 161 | B163: =SIN(RADIANS(RC[-1])) -> 0.32556815445715659 | C163: =COS(RADIANS(RC[-2])) -> -0.94551857559931685
A164: 162 | B164: =SIN(RADIANS(RC[-1])) -> 0.30901699437494751 | C164: =COS(RADIANS(RC[-2])) -> -0.95105651629515353
A165: 163 | B165: =SIN(RADIANS(RC[-1])) -> 0.2923717047227366 | C165: =COS(RADIANS(RC[-2])) -> -0.95630475596303555
A166: 164 | B166: =SIN(RADIANS(RC[-1])) -> 0.27563735581699922 | C166: =COS(RADIANS(RC[-2])) -> -0.96126169593831889
A167: 165 | B167: =SIN(RADIANS(RC[-1])) -> 0.25881904510252102 | C167: =COS(RADIANS(RC[-2])) -> -0.9659258262890682
A168: 166 | B168: =SIN(RADIANS(RC[-1])) -> 0.24192189559966773 | C168: =COS(RADIANS(RC[-2])) -> -0.97029572627599647
A169: 167 | B169: =SIN(RADIANS(RC[-1])) -> 0.2249510543438652 | C169: =COS(RADIANS(RC[-2])) -> -0.97437006478523513
A170: 168 | B170: =SIN(RADIANS(RC[-1])) -> 0.20791169081775931 | C170: =COS(RADIANS(RC[-2])) -> -0.97814760073380569
A171: 169 | B171: =SIN(RADIANS(RC[-1])) -> 0.19080899537654497 | C171: =COS(RADIANS(RC[-2])) -> -0.98162718344766398
A172: 170 | B172: =SIN(RADIANS(RC[-1])) -> 0.17364817766693028 | C172: =COS(RADIANS(RC[-2])) -> -0.98480775301220802
A173: 171 | B173: =SIN(RADIANS(RC[-1])) -> 0.15643446504023098 | C173: =COS(RADIANS(RC[-2])) -> -0.98768834059513766
A174: 172 | B174: =SIN(RADIANS(RC[-1])) -> 0.13917310096006533 | C174: =COS(RADIANS(RC[-2])) -> -0.99026806874157036
A175: 173 | B175: =SIN(RADIANS(RC[-1])) -> 0.12186934340514755 | C175: =COS(RADIANS(RC[-2])) -> -0.99254615164132198
A176: 174 | B176: =SIN(RADIANS(RC[-1])) -> 0.10452846326765373 | C176: =COS(RADIANS(RC[-2])) -> -0.99452189536827329
A177: 175 | B177: =SIN(RADIANS(RC[-1])) -> 8.7155742747658194E-2 | C177: =COS(RADIANS(RC[-2])) -> -0.99619469809174555
A178: 176 | B178: =SIN(RADIANS(RC[-1])) -> 6.9756473744125524E-2 | C178: =COS(RADIANS(RC[-2])) -> -0.9975640502598242
A179: 177 | B179: =SIN(RADIANS(RC[-1])) -> 5.2335956242943807E-2 | C179: =COS(RADIANS(RC[-2])) -> -0.99862953475457383
A180: 178 | B180: =SIN(RADIANS(RC[-1])) -> 3.4899496702501143E-2 | C180: =COS(RADIANS(RC[-2])) -> -0.99939082701909576
A181: 179 | B181: =SIN(RADIANS(RC[-1])) -> 1.7452406437283439E-2 | C181: =COS(RADIANS(RC[-2])) -> -0.99984769515639127
A182: 180 | B182: =SIN(RADIANS(RC[-1])) -> 1.22514845490862E-16 | C182: =COS(RADIANS(RC[-2])) -> -1
A183: 181 | B183: =SIN(RADIANS(RC[-1])) -> -1.7452406437283637E-2 | C183: =COS(RADIANS(RC[-2])) -> -0.99984769515639127
A184: 182 | B184: =SIN(RADIANS(RC[-1])) -> -3.48994967025009E-2 | C184: =COS(RADIANS(RC[-2])) -> -0.99939082701909576
A185: 183 | B185: =SIN(RADIANS(RC[-1])) -> -5.2335956242943557E-2 | C185: =COS(RADIANS(RC[-2])) -> -0.99862953475457383
A186: 184 | B186: =SIN(RADIANS(RC[-1])) -> -6.9756473744125275E-2 | C186: =COS(RADIANS(RC[-2])) -> -0.9975640502598242
A187: 185 | B187: =SIN(RADIANS(RC[-1])) -> -8.7155742747657944E-2 | C187: =COS(RADIANS(RC[-2])) -> -0.99619469809174555
A188: 186 | B188: =SIN(RADIANS(RC[-1])) -> -0.1045284632676535 | C188: =COS(RADIANS(RC[-2])) -> -0.99452189536827329
A189: 187 | B189: =SIN(RADIANS(RC[-1])) -> -0.12186934340514731 | C189: =COS(RADIANS(RC[-2])) -> -0.99254615164132209
A190: 188 | B190: =SIN(RADIANS(RC[-1])) -> -0.13917310096006552 | C190: =COS(RADIANS(RC[-2])) -> -0.99026806874157025
A191: 189 | B191: =SIN(RADIANS(RC[-1])) -> -0.15643446504023073 | C191: =COS(RADIANS(RC[-2])) -> -0.98768834059513777
A192: 190 | B192: =SIN(RADIANS(RC[-1])) -> -0.17364817766693047 | C192: =COS(RADIANS(RC[-2])) -> -0.98480775301220802
A193: 191 | B193: =SIN(RADIANS(RC[-1])) -> -0.19080899537654472 | C193: =COS(RADIANS(RC[-2])) -> -0.98162718344766398
A194: 192 | B194: =SIN(RADIANS(RC[-1])) -> -0.20791169081775951 | C194: =COS(RADIANS(RC[-2])) -> -0.97814760073380558
A195: 193 | B195: =SIN(RADIANS(RC[-1])) -> -0.22495105434386498 | C195: =COS(RADIANS(RC[-2])) -> -0.97437006478523525
A196: 194 | B196: =SIN(RADIANS(RC[-1])) -> -0.24192189559966751 | C196: =COS(RADIANS(RC[-2])) -> -0.97029572627599647
A197: 195 | B197: =SIN(RADIANS(RC[-1])) -> -0.25881904510252079 | C197: =COS(RADIANS(RC[-2])) -> -0.96592582628906831
A198: 196 | B198: =SIN(RADIANS(RC[-1])) -> -0.275637355816999 | C198: =COS(RADIANS(RC[-2])) -> -0.96126169593831889
A199: 197 | B199: =SIN(RADIANS(RC[-1])) -> -0.29237170472273677 | C199: =COS(RADIANS(RC[-2])) -> -0.95630475596303544
A200: 198 | B200: =SIN(RADIANS(RC[-1])) -> -0.30901699437494728 | C200: =COS(RADIANS(RC[-2])) -> -0.95105651629515364
A201: 199 | B201: =SIN(RADIANS(RC[-1])) -> -0.32556815445715676 | C201: =COS(RADIANS(RC[-2])) -> -0.94551857559931674
A202: 200 | B202: =SIN(RADIANS(RC[-1])) -> -0.34202014332566866 | C202: =COS(RADIANS(RC[-2])) -> -0.93969262078590843
A203: 201 | B203: =SIN(RADIANS(RC[-1])) -> -0.35836794954530043 | C203: =COS(RADIANS(RC[-2])) -> -0.93358042649720174
A204: 202 | B204: =SIN(RADIANS(RC[-1])) -> -0.37460659341591201 | C204: =COS(RADIANS(RC[-2])) -> -0.92718385456678742
A205: 203 | B205: =SIN(RADIANS(RC[-1])) -> -0.39073112848927355 | C205: =COS(RADIANS(RC[-2])) -> -0.92050485345244037
A206: 204 | B206: =SIN(RADIANS(RC[-1])) -> -0.40673664307580021 | C206: =COS(RADIANS(RC[-2])) -> -0.91354545764260087
A207: 205 | B207: =SIN(RADIANS(RC[-1])) -> -0.42261826174069927 | C207: =COS(RADIANS(RC[-2])) -> -0.90630778703665005
A208: 206 | B208: =SIN(RADIANS(RC[-1])) -> -0.43837114678907746 | C208: =COS(RADIANS(RC[-2])) -> -0.89879404629916693
A209: 207 | B209: =SIN(RADIANS(RC[-1])) -> -0.45399049973954669 | C209: =COS(RADIANS(RC[-2])) -> -0.8910065241883679
A210: 208 | B210: =SIN(RADIANS(RC[-1])) -> -0.46947156278589086 | C210: =COS(RADIANS(RC[-2])) -> -0.88294759285892688
A211: 209 | B211: =SIN(RADIANS(RC[-1])) -> -0.48480962024633695 | C211: =COS(RADIANS(RC[-2])) -> -0.87461970713939585
A212: 210 | B212: =SIN(RADIANS(RC[-1])) -> -0.50000000000000011 | C212: =COS(RADIANS(RC[-2])) -> -0.8660254037844386
A213: 211 | B213: =SIN(RADIANS(RC[-1])) -> -0.51503807491005416 | C213: =COS(RADIANS(RC[-2])) -> -0.85716730070211233
A214: 212 | B214: =SIN(RADIANS(RC[-1])) -> -0.52991926423320479 | C214: =COS(RADIANS(RC[-2])) -> -0.84804809615642607
A215: 213 | B215: =SIN(RADIANS(RC[-1])) -> -0.54463903501502708 | C215: =COS(RADIANS(RC[-2])) -> -0.83867056794542405
A216: 214 | B216: =SIN(RADIANS(RC[-1])) -> -0.55919290347074668 | C216: =COS(RADIANS(RC[-2])) -> -0.82903757255504185
A217: 215 | B217: =SIN(RADIANS(RC[-1])) -> -0.57357643635104616 | C217: =COS(RADIANS(RC[-2])) -> -0.8191520442889918
A218: 216 | B218: =SIN(RADIANS(RC[-1])) -> -0.58778525229247303 | C218: =COS(RADIANS(RC[-2])) -> -0.80901699437494756
A219: 217 | B219: =SIN(RADIANS(RC[-1])) -> -0.60181502315204838 | C219: =COS(RADIANS(RC[-2])) -> -0.79863551004729283
A220: 218 | B220: =SIN(RADIANS(RC[-1])) -> -0.61566147532565818 | C220: =COS(RADIANS(RC[-2])) -> -0.78801075360672201
A221: 219 | B221: =SIN(RADIANS(RC[-1])) -> -0.62932039104983761 | C221: =COS(RADIANS(RC[-2])) -> -0.77714596145697079
A222: 220 | B222: =SIN(RADIANS(RC[-1])) -> -0.64278760968653925 | C222: =COS(RADIANS(RC[-2])) -> -0.76604444311897801
A223: 221 | B223: =SIN(RADIANS(RC[-1])) -> -0.65605902899050705 | C223: =COS(RADIANS(RC[-2])) -> -0.75470958022277213
A224: 222 | B224: =SIN(RADIANS(RC[-1])) -> -0.66913060635885824 | C224: =COS(RADIANS(RC[-2])) -> -0.74314482547739424
A225: 223 | B225: =SIN(RADIANS(RC[-1])) -> -0.68199836006249837 | C225: =COS(RADIANS(RC[-2])) -> -0.73135370161917057
A226: 224 | B226: =SIN(RADIANS(RC[-1])) -> -0.69465837045899737 | C226: =COS(RADIANS(RC[-2])) -> -0.71933980033865108
A227: 225 | B227: =SIN(RADIANS(RC[-1])) -> -0.70710678118654746 | C227: =COS(RADIANS(RC[-2])) -> -0.70710678118654768
A228: 226 | B228: =SIN(RADIANS(RC[-1])) -> -0.71933980033865119 | C228: =COS(RADIANS(RC[-2])) -> -0.69465837045899725
A229: 227 | B229: =SIN(RADIANS(RC[-1])) -> -0.73135370161917046 | C229: =COS(RADIANS(RC[-2])) -> -0.68199836006249859
A230: 228 | B230: =SIN(RADIANS(RC[-1])) -> -0.74314482547739436 | C230: =COS(RADIANS(RC[-2])) -> -0.66913060635885813
A231: 229 | B231: =SIN(RADIANS(RC[-1])) -> -0.75470958022277201 | C231: =COS(RADIANS(RC[-2])) -> -0.65605902899050728
A232: 230 | B232: =SIN(RADIANS(RC[-1])) -> -0.7660444431189779 | C232: =COS(RADIANS(RC[-2])) -> -0.64278760968653947
A233: 231 | B233: =SIN(RADIANS(RC[-1])) -> -0.77714596145697057 | C233: =COS(RADIANS(RC[-2])) -> -0.62932039104983784
A234: 232 | B234: =SIN(RADIANS(RC[-1])) -> -0.78801075360672213 | C234: =COS(RADIANS(RC[-2])) -> -0.61566147532565807
A235: 233 | B235: =SIN(RADIANS(RC[-1])) -> -0.79863551004729283 | C235: =COS(RADIANS(RC[-2])) -> -0.60181502315204827
A236: 234 | B236: =SIN(RADIANS(RC[-1])) -> -0.80901699437494734 | C236: =COS(RADIANS(RC[-2])) -> -0.58778525229247325
A237: 235 | B237: =SIN(RADIANS(RC[-1])) -> -0.81915204428899158 | C237: =COS(RADIANS(RC[-2])) -> -0.57357643635104638
A238: 236 | B238: =SIN(RADIANS(RC[-1])) -> -0.82903757255504185 | C238: =COS(RADIANS(RC[-2])) -> -0.55919290347074657
A239: 237 | B239: =SIN(RADIANS(RC[-1])) -> -0.83867056794542405 | C239: =COS(RADIANS(RC[-2])) -> -0.54463903501502697
A240: 238 | B240: =SIN(RADIANS(RC[-1])) -> -0.84804809615642596 | C240: =COS(RADIANS(RC[-2])) -> -0.52991926423320501
A241: 239 | B241: =SIN(RADIANS(RC[-1])) -> -0.85716730070211211 | C241: =COS(RADIANS(RC[-2])) -> -0.51503807491005449
A242: 240 | B242: =SIN(RADIANS(RC[-1])) -> -0.86602540378443837 | C242: =COS(RADIANS(RC[-2])) -> -0.50000000000000044
A243: 241 | B243: =SIN(RADIANS(RC[-1])) -> -0.87461970713939596 | C243: =COS(RADIANS(RC[-2])) -> -0.48480962024633684
A244: 242 | B244: =SIN(RADIANS(RC[-1])) -> -0.88294759285892699 | C244: =COS(RADIANS(RC[-2])) -> -0.46947156278589075
A245: 243 | B245: =SIN(RADIANS(RC[-1])) -> -0.89100652418836779 | C245: =COS(RADIANS(RC[-2])) -> -0.45399049973954692
A246: 244 | B246: =SIN(RADIANS(RC[-1])) -> -0.89879404629916682 | C246: =COS(RADIANS(RC[-2])) -> -0.43837114678907774
A247: 245 | B247: =SIN(RADIANS(RC[-1])) -> -0.90630778703665005 | C247: =COS(RADIANS(RC[-2])) -> -0.42261826174069916
A248: 246 | B248: =SIN(RADIANS(RC[-1])) -> -0.91354545764260098 | C248: =COS(RADIANS(RC[-2])) -> -0.4067366430758001
A249: 247 | B249: =SIN(RADIANS(RC[-1])) -> -0.92050485345244026 | C249: =COS(RADIANS(RC[-2])) -> -0.39073112848927383
A250: 248 | B250: =SIN(RADIANS(RC[-1])) -> -0.92718385456678731 | C250: =COS(RADIANS(RC[-2])) -> -0.37460659341591229
A251: 249 | B251: =SIN(RADIANS(RC[-1])) -> -0.93358042649720163 | C251: =COS(RADIANS(RC[-2])) -> -0.35836794954530071
A252: 250 | B252: =SIN(RADIANS(RC[-1])) -> -0.93969262078590843 | C252: =COS(RADIANS(RC[-2])) -> -0.34202014332566855
A253: 251 | B253: =SIN(RADIANS(RC[-1])) -> -0.94551857559931685 | C253: =COS(RADIANS(RC[-2])) -> -0.32556815445715664
A254: 252 | B254: =SIN(RADIANS(RC[-1])) -> -0.95105651629515353 | C254: =COS(RADIANS(RC[-2])) -> -0.30901699437494756
A255: 253 | B255: =SIN(RADIANS(RC[-1])) -> -0.95630475596303532 | C255: =COS(RADIANS(RC[-2])) -> -0.2923717047227371
A256: 254 | B256: =SIN(RADIANS(RC[-1])) -> -0.96126169593831901 | C256: =COS(RADIANS(RC[-2])) -> -0.27563735581699889
A257: 255 | B257: =SIN(RADIANS(RC[-1])) -> -0.96592582628906831 | C257: =COS(RADIANS(RC[-2])) -> -0.25881904510252063
A258: 256 | B258: =SIN(RADIANS(RC[-1])) -> -0.97029572627599647 | C258: =COS(RADIANS(RC[-2])) -> -0.24192189559966779
A259: 257 | B259: =SIN(RADIANS(RC[-1])) -> -0.97437006478523513 | C259: =COS(RADIANS(RC[-2])) -> -0.22495105434386525
A260: 258 | B260: =SIN(RADIANS(RC[-1])) -> -0.97814760073380558 | C260: =COS(RADIANS(RC[-2])) -> -0.20791169081775979
A261: 259 | B261: =SIN(RADIANS(RC[-1])) -> -0.98162718344766398 | C261: =COS(RADIANS(RC[-2])) -> -0.19080899537654461
A262: 260 | B262: =SIN(RADIANS(RC[-1])) -> -0.98480775301220802 | C262: =COS(RADIANS(RC[-2])) -> -0.17364817766693033
A263: 261 | B263: =SIN(RADIANS(RC[-1])) -> -0.98768834059513766 | C263: =COS(RADIANS(RC[-2])) -> -0.15643446504023104
A264: 262 | B264: =SIN(RADIANS(RC[-1])) -> -0.99026806874157025 | C264: =COS(RADIANS(RC[-2])) -> -0.13917310096006583
A265: 263 | B265: =SIN(RADIANS(RC[-1])) -> -0.99254615164132209 | C265: =COS(RADIANS(RC[-2])) -> -0.12186934340514717
A266: 264 | B266: =SIN(RADIANS(RC[-1])) -> -0.9945218953682734 | C266: =COS(RADIANS(RC[-2])) -> -0.10452846326765336
A267: 265 | B267: =SIN(RADIANS(RC[-1])) -> -0.99619469809174555 | C267: =COS(RADIANS(RC[-2])) -> -8.7155742747658249E-2
A268: 266 | B268: =SIN(RADIANS(RC[-1])) -> -0.9975640502598242 | C268: =COS(RADIANS(RC[-2])) -> -6.975647374412558E-2
A269: 267 | B269: =SIN(RADIANS(RC[-1])) -> -0.99862953475457383 | C269: =COS(RADIANS(RC[-2])) -> -5.2335956242944306E-2
A270: 268 | B270: =SIN(RADIANS(RC[-1])) -> -0.99939082701909576 | C270: =COS(RADIANS(RC[-2])) -> -3.4899496702500761E-2
A271: 269 | B271: =SIN(RADIANS(RC[-1])) -> -0.99984769515639127 | C271: =COS(RADIANS(RC[-2])) -> -1.7452406437283498E-2
A272: 270 | B272: =SIN(RADIANS(RC[-1])) -> -1 | C272: =COS(RADIANS(RC[-2])) -> -1.83772268236293E-16
A273: 271 | B273: =SIN(RADIANS(RC[-1])) -> -0.99984769515639127 | C273: =COS(RADIANS(RC[-2])) -> 1.745240643728313E-2
A274: 272 | B274: =SIN(RADIANS(RC[-1])) -> -0.99939082701909576 | C274: =COS(RADIANS(RC[-2])) -> 3.4899496702501281E-2
A275: 273 | B275: =SIN(RADIANS(RC[-1])) -> -0.99862953475457383 | C275: =COS(RADIANS(RC[-2])) -> 5.2335956242943946E-2
A276: 274 | B276: =SIN(RADIANS(RC[-1])) -> -0.99756405025982431 | C276: =COS(RADIANS(RC[-2])) -> 6.9756473744125219E-2
A277: 275 | B277: =SIN(RADIANS(RC[-1])) -> -0.99619469809174555 | C277: =COS(RADIANS(RC[-2])) -> 8.7155742747657888E-2
A278: 276 | B278: =SIN(RADIANS(RC[-1])) -> -0.9945218953682734 | C278: =COS(RADIANS(RC[-2])) -> 0.10452846326765299
A279: 277 | B279: =SIN(RADIANS(RC[-1])) -> -0.99254615164132198 | C279: =COS(RADIANS(RC[-2])) -> 0.12186934340514768
A280: 278 | B280: =SIN(RADIANS(RC[-1])) -> -0.99026806874157036 | C280: =COS(RADIANS(RC[-2])) -> 0.13917310096006547
A281: 279 | B281: =SIN(RADIANS(RC[-1])) -> -0.98768834059513777 | C281: =COS(RADIANS(RC[-2])) -> 0.15643446504023067
A282: 280 | B282: =SIN(RADIANS(RC[-1])) -> -0.98480775301220813 | C282: =COS(RADIANS(RC[-2])) -> 0.17364817766692997
A283: 281 | B283: =SIN(RADIANS(RC[-1])) -> -0.98162718344766386 | C283: =COS(RADIANS(RC[-2])) -> 0.19080899537654511
A284: 282 | B284: =SIN(RADIANS(RC[-1])) -> -0.97814760073380558 | C284: =COS(RADIANS(RC[-2])) -> 0.20791169081775943
A285: 283 | B285: =SIN(RADIANS(RC[-1])) -> -0.97437006478523525 | C285: =COS(RADIANS(RC[-2])) -> 0.22495105434386492
A286: 284 | B286: =SIN(RADIANS(RC[-1])) -> -0.97029572627599658 | C286: =COS(RADIANS(RC[-2])) -> 0.24192189559966745
A287: 285 | B287: =SIN(RADIANS(RC[-1])) -> -0.96592582628906842 | C287: =COS(RADIANS(RC[-2])) -> 0.2588190451025203
A288: 286 | B288: =SIN(RADIANS(RC[-1])) -> -0.96126169593831878 | C288: =COS(RADIANS(RC[-2])) -> 0.27563735581699939
A289: 287 | B289: =SIN(RADIANS(RC[-1])) -> -0.95630475596303544 | C289: =COS(RADIANS(RC[-2])) -> 0.29237170472273671
A290: 288 | B290: =SIN(RADIANS(RC[-1])) -> -0.95105651629515364 | C290: =COS(RADIANS(RC[-2])) -> 0.30901699437494723
A291: 289 | B291: =SIN(RADIANS(RC[-1])) -> -0.94551857559931696 | C291: =COS(RADIANS(RC[-2])) -> 0.32556815445715631
A292: 290 | B292: =SIN(RADIANS(RC[-1])) -> -0.93969262078590832 | C292: =COS(RADIANS(RC[-2])) -> 0.34202014332566899
A293: 291 | B293: =SIN(RADIANS(RC[-1])) -> -0.93358042649720174 | C293: =COS(RADIANS(RC[-2])) -> 0.35836794954530038
A294: 292 | B294: =SIN(RADIANS(RC[-1])) -> -0.92718385456678742 | C294: =COS(RADIANS(RC[-2])) -> 0.37460659341591196
A295: 293 | B295: =SIN(RADIANS(RC[-1])) -> -0.92050485345244049 | C295: =COS(RADIANS(RC[-2])) -> 0.39073112848927349
A296: 294 | B296: =SIN(RADIANS(RC[-1])) -> -0.91354545764260109 | C296: =COS(RADIANS(RC[-2])) -> 0.40673664307579976
A297: 295 | B297: =SIN(RADIANS(RC[-1])) -> -0.90630778703664994 | C297: =COS(RADIANS(RC[-2])) -> 0.42261826174069961
A298: 296 | B298: =SIN(RADIANS(RC[-1])) -> -0.89879404629916704 | C298: =COS(RADIANS(RC[-2])) -> 0.4383711467890774
A299: 297 | B299: =SIN(RADIANS(RC[-1])) -> -0.8910065241883679 | C299: =COS(RADIANS(RC[-2])) -> 0.45399049973954664
A300: 298 | B300: =SIN(RADIANS(RC[-1])) -> -0.8829475928589271 | C300: =COS(RADIANS(RC[-2])) -> 0.46947156278589042
A301: 299 | B301: =SIN(RADIANS(RC[-1])) -> -0.87461970713939563 | C301: =COS(RADIANS(RC[-2])) -> 0.48480962024633728
A302: 300 | B302: =SIN(RADIANS(RC[-1])) -> -0.8660254037844386 | C302: =COS(RADIANS(RC[-2])) -> 0.50000000000000011
A303: 301 | B303: =SIN(RADIANS(RC[-1])) -> -0.85716730070211233 | C303: =COS(RADIANS(RC[-2])) -> 0.51503807491005416
A304: 302 | B304: =SIN(RADIANS(RC[-1])) -> -0.84804809615642618 | C304: =COS(RADIANS(RC[-2])) -> 0.52991926423320468
A305: 303 | B305: =SIN(RADIANS(RC[-1])) -> -0.83867056794542427 | C305: =COS(RADIANS(RC[-2])) -> 0.54463903501502664
A306: 304 | B306: =SIN(RADIANS(RC[-1])) -> -0.82903757255504162 | C306: =COS(RADIANS(RC[-2])) -> 0.55919290347074702
A307: 305 | B307: =SIN(RADIANS(RC[-1])) -> -0.8191520442889918 | C307: =COS(RADIANS(RC[-2])) -> 0.57357643635104605
A308: 306 | B308: =SIN(RADIANS(RC[-1])) -> -0.80901699437494756 | C308: =COS(RADIANS(RC[-2])) -> 0.58778525229247292
A309: 307 | B309: =SIN(RADIANS(RC[-1])) -> -0.79863551004729305 | C309: =COS(RADIANS(RC[-2])) -> 0.60181502315204793
A310: 308 | B310: =SIN(RADIANS(RC[-1])) -> -0.78801075360672179 | C310: =COS(RADIANS(RC[-2])) -> 0.61566147532565851
A311: 309 | B311: =SIN(RADIANS(RC[-1])) -> -0.77714596145697079 | C311: =COS(RADIANS(RC[-2])) -> 0.6293203910498375
A312: 310 | B312: =SIN(RADIANS(RC[-1])) -> -0.76604444311897812 | C312: =COS(RADIANS(RC[-2])) -> 0.64278760968653925
A313: 311 | B313: =SIN(RADIANS(RC[-1])) -> -0.75470958022277224 | C313: =COS(RADIANS(RC[-2])) -> 0.65605902899050705
A314: 312 | B314: =SIN(RADIANS(RC[-1])) -> -0.74314482547739458 | C314: =COS(RADIANS(RC[-2])) -> 0.66913060635885779
A315: 313 | B315: =SIN(RADIANS(RC[-1])) -> -0.73135370161917035 | C315: =COS(RADIANS(RC[-2])) -> 0.68199836006249859
A316: 314 | B316: =SIN(RADIANS(RC[-1])) -> -0.71933980033865119 | C316: =COS(RADIANS(RC[-2])) -> 0.69465837045899725
A317: 315 | B317: =SIN(RADIANS(RC[-1])) -> -0.70710678118654768 | C317: =COS(RADIANS(RC[-2])) -> 0.70710678118654735
A318: 316 | B318: =SIN(RADIANS(RC[-1])) -> -0.69465837045899759 | C318: =COS(RADIANS(RC[-2])) -> 0.71933980033865086
A319: 317 | B319: =SIN(RADIANS(RC[-1])) -> -0.68199836006249825 | C319: =COS(RADIANS(RC[-2])) -> 0.73135370161917068
A320: 318 | B320: =SIN(RADIANS(RC[-1])) -> -0.66913060635885813 | C320: =COS(RADIANS(RC[-2])) -> 0.74314482547739424
A321: 319 | B321: =SIN(RADIANS(RC[-1])) -> -0.65605902899050739 | C321: =COS(RADIANS(RC[-2])) -> 0.7547095802227719
A322: 320 | B322: =SIN(RADIANS(RC[-1])) -> -0.64278760968653958 | C322: =COS(RADIANS(RC[-2])) -> 0.76604444311897779
A323: 321 | B323: =SIN(RADIANS(RC[-1])) -> -0.62932039104983784 | C323: =COS(RADIANS(RC[-2])) -> 0.77714596145697057
A324: 322 | B324: =SIN(RADIANS(RC[-1])) -> -0.61566147532565818 | C324: =COS(RADIANS(RC[-2])) -> 0.78801075360672201
A325: 323 | B325: =SIN(RADIANS(RC[-1])) -> -0.60181502315204827 | C325: =COS(RADIANS(RC[-2])) -> 0.79863551004729283
A326: 324 | B326: =SIN(RADIANS(RC[-1])) -> -0.58778525229247336 | C326: =COS(RADIANS(RC[-2])) -> 0.80901699437494734
A327: 325 | B327: =SIN(RADIANS(RC[-1])) -> -0.57357643635104649 | C327: =COS(RADIANS(RC[-2])) -> 0.81915204428899158
A328: 326 | B328: =SIN(RADIANS(RC[-1])) -> -0.55919290347074657 | C328: =COS(RADIANS(RC[-2])) -> 0.82903757255504185
A329: 327 | B329: =SIN(RADIANS(RC[-1])) -> -0.54463903501502697 | C329: =COS(RADIANS(RC[-2])) -> 0.83867056794542405
A330: 328 | B330: =SIN(RADIANS(RC[-1])) -> -0.52991926423320501 | C330: =COS(RADIANS(RC[-2])) -> 0.84804809615642596
A331: 329 | B331: =SIN(RADIANS(RC[-1])) -> -0.51503807491005449 | C331: =COS(RADIANS(RC[-2])) -> 0.85716730070211211
A332: 330 | B332: =SIN(RADIANS(RC[-1])) -> -0.50000000000000044 | C332: =COS(RADIANS(RC[-2])) -> 0.86602540378443837
A333: 331 | B333: =SIN(RADIANS(RC[-1])) -> -0.48480962024633689 | C333: =COS(RADIANS(RC[-2])) -> 0.87461970713939585
A334: 332 | B334: =SIN(RADIANS(RC[-1])) -> -0.46947156278589081 | C334: =COS(RADIANS(RC[-2])) -> 0.88294759285892688
A335: 333 | B335: =SIN(RADIANS(RC[-1])) -> -0.45399049973954697 | C335: =COS(RADIANS(RC[-2])) -> 0.89100652418836779
A336: 334 | B336: =SIN(RADIANS(RC[-1])) -> -0.43837114678907779 | C336: =COS(RADIANS(RC[-2])) -> 0.89879404629916682
A337: 335 | B337: =SIN(RADIANS(RC[-1])) -> -0.42261826174069922 | C337: =COS(RADIANS(RC[-2])) -> 0.90630778703665005
A338: 336 | B338: =SIN(RADIANS(RC[-1])) -> -0.40673664307580015 | C338: =COS(RADIANS(RC[-2])) -> 0.91354545764260098
A339: 337 | B339: =SIN(RADIANS(RC[-1])) -> -0.39073112848927388 | C339: =COS(RADIANS(RC[-2])) -> 0.92050485345244026
A340: 338 | B340: =SIN(RADIANS(RC[-1])) -> -0.37460659341591235 | C340: =COS(RADIANS(RC[-2])) -> 0.92718385456678731
A341: 339 | B341: =SIN(RADIANS(RC[-1])) -> -0.35836794954530077 | C341: =COS(RADIANS(RC[-2])) -> 0.93358042649720152
A342: 340 | B342: =SIN(RADIANS(RC[-1])) -> -0.3420201433256686 | C342: =COS(RADIANS(RC[-2])) -> 0.93969262078590843
A343: 341 | B343: =SIN(RADIANS(RC[-1])) -> -0.3255681544571567 | C343: =COS(RADIANS(RC[-2])) -> 0.94551857559931685
A344: 342 | B344: =SIN(RADIANS(RC[-1])) -> -0.30901699437494762 | C344: =COS(RADIANS(RC[-2])) -> 0.95105651629515353
A345: 343 | B345: =SIN(RADIANS(RC[-1])) -> -0.29237170472273716 | C345: =COS(RADIANS(RC[-2])) -> 0.95630475596303532
A346: 344 | B346: =SIN(RADIANS(RC[-1])) -> -0.27563735581699894 | C346: =COS(RADIANS(RC[-2])) -> 0.96126169593831889
A347: 345 | B347: =SIN(RADIANS(RC[-1])) -> -0.25881904510252068 | C347: =COS(RADIANS(RC[-2])) -> 0.96592582628906831
A348: 346 | B348: =SIN(RADIANS(RC[-1])) -> -0.24192189559966787 | C348: =COS(RADIANS(RC[-2])) -> 0.97029572627599647
A349: 347 | B349: =SIN(RADIANS(RC[-1])) -> -0.22495105434386534 | C349: =COS(RADIANS(RC[-2])) -> 0.97437006478523513
A350: 348 | B350: =SIN(RADIANS(RC[-1])) -> -0.20791169081775987 | C350: =COS(RADIANS(RC[-2])) -> 0.97814760073380558
A351: 349 | B351: =SIN(RADIANS(RC[-1])) -> -0.19080899537654467 | C351: =COS(RADIANS(RC[-2])) -> 0.98162718344766398
A352: 350 | B352: =SIN(RADIANS(RC[-1])) -> -0.17364817766693039 | C352: =COS(RADIANS(RC[-2])) -> 0.98480775301220802
A353: 351 | B353: =SIN(RADIANS(RC[-1])) -> -0.15643446504023112 | C353: =COS(RADIANS(RC[-2])) -> 0.98768834059513766
A354: 352 | B354: =SIN(RADIANS(RC[-1])) -> -0.13917310096006588 | C354: =COS(RADIANS(RC[-2])) -> 0.99026806874157025
A355: 353 | B355: =SIN(RADIANS(RC[-1])) -> -0.12186934340514723 | C355: =COS(RADIANS(RC[-2])) -> 0.99254615164132209
A356: 354 | B356: =SIN(RADIANS(RC[-1])) -> -0.10452846326765342 | C356: =COS(RADIANS(RC[-2])) -> 0.99452189536827329
A357: 355 | B357: =SIN(RADIANS(RC[-1])) -> -8.7155742747658319E-2 | C357: =COS(RADIANS(RC[-2])) -> 0.99619469809174555
A358: 356 | B358: =SIN(RADIANS(RC[-1])) -> -6.9756473744125636E-2 | C358: =COS(RADIANS(RC[-2])) -> 0.9975640502598242
A359: 357 | B359: =SIN(RADIANS(RC[-1])) -> -5.2335956242944369E-2 | C359: =COS(RADIANS(RC[-2])) -> 0.99862953475457383
A360: 358 | B360: =SIN(RADIANS(RC[-1])) -> -3.4899496702500823E-2 | C360: =COS(RADIANS(RC[-2])) -> 0.99939082701909576
A361: 359 | B361: =SIN(RADIANS(RC[-1])) -> -1.745240643728356E-2 | C361: =COS(RADIANS(RC[-2])) -> 0.99984769515639127
A362: 360 | B362: =SIN(RADIANS(RC[-1])) -> -2.45029690981724E-16 | C362: =COS(RADIANS(RC[-2])) -> 1
A363: 361 | B363: =SIN(RADIANS(RC[-1])) -> 1.7452406437283071E-2 | C363: =COS(RADIANS(RC[-2])) -> 0.99984769515639127
A364: 362 | B364: =SIN(RADIANS(RC[-1])) -> 3.4899496702501219E-2 | C364: =COS(RADIANS(RC[-2])) -> 0.99939082701909576
A365: 363 | B365: =SIN(RADIANS(RC[-1])) -> 5.2335956242943883E-2 | C365: =COS(RADIANS(RC[-2])) -> 0.99862953475457383
A366: 364 | B366: =SIN(RADIANS(RC[-1])) -> 6.975647374412515E-2 | C366: =COS(RADIANS(RC[-2])) -> 0.99756405025982431
A367: 365 | B367: =SIN(RADIANS(RC[-1])) -> 8.7155742747657833E-2 | C367: =COS(RADIANS(RC[-2])) -> 0.99619469809174555
A368: 366 | B368: =SIN(RADIANS(RC[-1])) -> 0.10452846326765293 | C368: =COS(RADIANS(RC[-2])) -> 0.9945218953682734
A369: 367 | B369: =SIN(RADIANS(RC[-1])) -> 0.12186934340514763 | C369: =COS(RADIANS(RC[-2])) -> 0.99254615164132198
A370: 368 | B370: =SIN(RADIANS(RC[-1])) -> 0.13917310096006538 | C370: =COS(RADIANS(RC[-2])) -> 0.99026806874157036
A371: 369 | B371: =SIN(RADIANS(RC[-1])) -> 0.15643446504023062 | C371: =COS(RADIANS(RC[-2])) -> 0.98768834059513777
A372: 370 | B372: =SIN(RADIANS(RC[-1])) -> 0.17364817766692991 | C372: =COS(RADIANS(RC[-2])) -> 0.98480775301220813
A373: 371 | B373: =SIN(RADIANS(RC[-1])) -> 0.19080899537654505 | C373: =COS(RADIANS(RC[-2])) -> 0.98162718344766386
A374: 372 | B374: =SIN(RADIANS(RC[-1])) -> 0.20791169081775937 | C374: =COS(RADIANS(RC[-2])) -> 0.97814760073380558
A375: 373 | B375: =SIN(RADIANS(RC[-1])) -> 0.22495105434386484 | C375: =COS(RADIANS(RC[-2])) -> 0.97437006478523525
A376: 374 | B376: =SIN(RADIANS(RC[-1])) -> 0.24192189559966737 | C376: =COS(RADIANS(RC[-2])) -> 0.97029572627599658
A377: 375 | B377: =SIN(RADIANS(RC[-1])) -> 0.25881904510252024 | C377: =COS(RADIANS(RC[-2])) -> 0.96592582628906842
A378: 376 | B378: =SIN(RADIANS(RC[-1])) -> 0.27563735581699933 | C378: =COS(RADIANS(RC[-2])) -> 0.96126169593831878
A379: 377 | B379: =SIN(RADIANS(RC[-1])) -> 0.29237170472273666 | C379: =COS(RADIANS(RC[-2])) -> 0.95630475596303555
A380: 378 | B380: =SIN(RADIANS(RC[-1])) -> 0.30901699437494717 | C380: =COS(RADIANS(RC[-2])) -> 0.95105651629515364
A381: 379 | B381: =SIN(RADIANS(RC[-1])) -> 0.32556815445715626 | C381: =COS(RADIANS(RC[-2])) -> 0.94551857559931696
A382: 380 | B382: =SIN(RADIANS(RC[-1])) -> 0.34202014332566893 | C382: =COS(RADIANS(RC[-2])) -> 0.93969262078590832
A383: 381 | B383: =SIN(RADIANS(RC[-1])) -> 0.35836794954530032 | C383: =COS(RADIANS(RC[-2])) -> 0.93358042649720174
A384: 382 | B384: =SIN(RADIANS(RC[-1])) -> 0.3746065934159119 | C384: =COS(RADIANS(RC[-2])) -> 0.92718385456678742
A385: 383 | B385: =SIN(RADIANS(RC[-1])) -> 0.39073112848927344 | C385: =COS(RADIANS(RC[-2])) -> 0.92050485345244049
A386: 384 | B386: =SIN(RADIANS(RC[-1])) -> 0.40673664307580049 | C386: =COS(RADIANS(RC[-2])) -> 0.91354545764260076
A387: 385 | B387: =SIN(RADIANS(RC[-1])) -> 0.42261826174069955 | C387: =COS(RADIANS(RC[-2])) -> 0.90630778703664994
A388: 386 | B388: =SIN(RADIANS(RC[-1])) -> 0.43837114678907735 | C388: =COS(RADIANS(RC[-2])) -> 0.89879404629916704
A389: 387 | B389: =SIN(RADIANS(RC[-1])) -> 0.45399049973954658 | C389: =COS(RADIANS(RC[-2])) -> 0.89100652418836801
A390: 388 | B390: =SIN(RADIANS(RC[-1])) -> 0.46947156278589036 | C390: =COS(RADIANS(RC[-2])) -> 0.88294759285892721
A391: 389 | B391: =SIN(RADIANS(RC[-1])) -> 0.48480962024633723 | C391: =COS(RADIANS(RC[-2])) -> 0.87461970713939574
A392: 390 | B392: =SIN(RADIANS(RC[-1])) -> 0.5 | C392: =COS(RADIANS(RC[-2])) -> 0.8660254037844386
A393: 391 | B393: =SIN(RADIANS(RC[-1])) -> 0.51503807491005404 | C393: =COS(RADIANS(RC[-2])) -> 0.85716730070211233
A394: 392 | B394: =SIN(RADIANS(RC[-1])) -> 0.52991926423320468 | C394: =COS(RADIANS(RC[-2])) -> 0.84804809615642618
A395: 393 | B395: =SIN(RADIANS(RC[-1])) -> 0.54463903501502731 | C395: =COS(RADIANS(RC[-2])) -> 0.83867056794542383
A396: 394 | B396: =SIN(RADIANS(RC[-1])) -> 0.5591929034707469 | C396: =COS(RADIANS(RC[-2])) -> 0.82903757255504162
A397: 395 | B397: =SIN(RADIANS(RC[-1])) -> 0.57357643635104605 | C397: =COS(RADIANS(RC[-2])) -> 0.8191520442889918
A398: 396 | B398: =SIN(RADIANS(RC[-1])) -> 0.58778525229247292 | C398: =COS(RADIANS(RC[-2])) -> 0.80901699437494756
A399: 397 | B399: =SIN(RADIANS(RC[-1])) -> 0.60181502315204793 | C399: =COS(RADIANS(RC[-2])) -> 0.79863551004729316
A400: 398 | B400: =SIN(RADIANS(RC[-1])) -> 0.6156614753256584 | C400: =COS(RADIANS(RC[-2])) -> 0.78801075360672179
A401: 399 | B401: =SIN(RADIANS(RC[-1])) -> 0.6293203910498375 | C401: =COS(RADIANS(RC[-2])) -> 0.7771459614569709
A402: 400 | B402: =SIN(RADIANS(RC[-1])) -> 0.64278760968653914 | C402: =COS(RADIANS(RC[-2])) -> 0.76604444311897812
A403: 401 | B403: =SIN(RADIANS(RC[-1])) -> 0.65605902899050705 | C403: =COS(RADIANS(RC[-2])) -> 0.75470958022277224
A404: 402 | B404: =SIN(RADIANS(RC[-1])) -> 0.66913060635885846 | C404: =COS(RADIANS(RC[-2])) -> 0.74314482547739402
A405: 403 | B405: =SIN(RADIANS(RC[-1])) -> 0.68199836006249859 | C405: =COS(RADIANS(RC[-2])) -> 0.73135370161917035
A406: 404 | B406: =SIN(RADIANS(RC[-1])) -> 0.69465837045899725 | C406: =COS(RADIANS(RC[-2])) -> 0.71933980033865119
A407: 405 | B407: =SIN(RADIANS(RC[-1])) -> 0.70710678118654735 | C407: =COS(RADIANS(RC[-2])) -> 0.70710678118654768
A408: 406 | B408: =SIN(RADIANS(RC[-1])) -> 0.71933980033865086 | C408: =COS(RADIANS(RC[-2])) -> 0.69465837045899759
A409: 407 | B409: =SIN(RADIANS(RC[-1])) -> 0.73135370161917068 | C409: =COS(RADIANS(RC[-2])) -> 0.68199836006249837
A410: 408 | B410: =SIN(RADIANS(RC[-1])) -> 0.74314482547739424 | C410: =COS(RADIANS(RC[-2])) -> 0.66913060635885824
A411: 409 | B411: =SIN(RADIANS(RC[-1])) -> 0.7547095802227719 | C411: =COS(RADIANS(RC[-2])) -> 0.65605902899050739
A412: 410 | B412: =SIN(RADIANS(RC[-1])) -> 0.76604444311897779 | C412: =COS(RADIANS(RC[-2])) -> 0.64278760968653958
A413: 411 | B413: =SIN(RADIANS(RC[-1])) -> 0.77714596145697112 | C413: =COS(RADIANS(RC[-2])) -> 0.62932039104983717
A414: 412 | B414: =SIN(RADIANS(RC[-1])) -> 0.78801075360672201 | C414: =COS(RADIANS(RC[-2])) -> 0.61566147532565818
A415: 413 | B415: =SIN(RADIANS(RC[-1])) -> 0.79863551004729283 | C415: =COS(RADIANS(RC[-2])) -> 0.60181502315204838
A416: 414 | B416: =SIN(RADIANS(RC[-1])) -> 0.80901699437494723 | C416: =COS(RADIANS(RC[-2])) -> 0.58778525229247336
A417: 415 | B417: =SIN(RADIANS(RC[-1])) -> 0.81915204428899147 | C417: =COS(RADIANS(RC[-2])) -> 0.57357643635104649
A418: 416 | B418: =SIN(RADIANS(RC[-1])) -> 0.82903757255504185 | C418: =COS(RADIANS(RC[-2])) -> 0.55919290347074668
A419: 417 | B419: =SIN(RADIANS(RC[-1])) -> 0.83867056794542405 | C419: =COS(RADIANS(RC[-2])) -> 0.54463903501502708
A420: 418 | B420: =SIN(RADIANS(RC[-1])) -> 0.84804809615642585 | C420: =COS(RADIANS(RC[-2])) -> 0.52991926423320512
A421: 419 | B421: =SIN(RADIANS(RC[-1])) -> 0.85716730070211211 | C421: =COS(RADIANS(RC[-2])) -> 0.51503807491005449
A422: 420 | B422: =SIN(RADIANS(RC[-1])) -> 0.86602540378443882 | C422: =COS(RADIANS(RC[-2])) -> 0.49999999999999972
A423: 421 | B423: =SIN(RADIANS(RC[-1])) -> 0.87461970713939585 | C423: =COS(RADIANS(RC[-2])) -> 0.48480962024633695
A424: 422 | B424: =SIN(RADIANS(RC[-1])) -> 0.88294759285892688 | C424: =COS(RADIANS(RC[-2])) -> 0.46947156278589086
A425: 423 | B425: =SIN(RADIANS(RC[-1])) -> 0.89100652418836768 | C425: =COS(RADIANS(RC[-2])) -> 0.45399049973954703
A426: 424 | B426: =SIN(RADIANS(RC[-1])) -> 0.89879404629916682 | C426: =COS(RADIANS(RC[-2])) -> 0.43837114678907785
A427: 425 | B427: =SIN(RADIANS(RC[-1])) -> 0.90630778703665005 | C427: =COS(RADIANS(RC[-2])) -> 0.42261826174069927
A428: 426 | B428: =SIN(RADIANS(RC[-1])) -> 0.91354545764260087 | C428: =COS(RADIANS(RC[-2])) -> 0.40673664307580021
A429: 427 | B429: =SIN(RADIANS(RC[-1])) -> 0.92050485345244026 | C429: =COS(RADIANS(RC[-2])) -> 0.39073112848927394
A430: 428 | B430: =SIN(RADIANS(RC[-1])) -> 0.9271838545667872 | C430: =COS(RADIANS(RC[-2])) -> 0.3746065934159124
A431: 429 | B431: =SIN(RADIANS(RC[-1])) -> 0.93358042649720185 | C431: =COS(RADIANS(RC[-2])) -> 0.35836794954529999
A432: 430 | B432: =SIN(RADIANS(RC[-1])) -> 0.93969262078590843 | C432: =COS(RADIANS(RC[-2])) -> 0.34202014332566866
A433: 431 | B433: =SIN(RADIANS(RC[-1])) -> 0.94551857559931674 | C433: =COS(RADIANS(RC[-2])) -> 0.32556815445715676
A434: 432 | B434: =SIN(RADIANS(RC[-1])) -> 0.95105651629515353 | C434: =COS(RADIANS(RC[-2])) -> 0.30901699437494773
A435: 433 | B435: =SIN(RADIANS(RC[-1])) -> 0.95630475596303532 | C435: =COS(RADIANS(RC[-2])) -> 0.29237170472273721
A436: 434 | B436: =SIN(RADIANS(RC[-1])) -> 0.96126169593831889 | C436: =COS(RADIANS(RC[-2])) -> 0.275637355816999
A437: 435 | B437: =SIN(RADIANS(RC[-1])) -> 0.96592582628906831 | C437: =COS(RADIANS(RC[-2])) -> 0.25881904510252074
A438: 436 | B438: =SIN(RADIANS(RC[-1])) -> 0.97029572627599647 | C438: =COS(RADIANS(RC[-2])) -> 0.24192189559966792
A439: 437 | B439: =SIN(RADIANS(RC[-1])) -> 0.97437006478523513 | C439: =COS(RADIANS(RC[-2])) -> 0.22495105434386539
A440: 438 | B440: =SIN(RADIANS(RC[-1])) -> 0.97814760073380569 | C440: =COS(RADIANS(RC[-2])) -> 0.20791169081775904
A441: 439 | B441: =SIN(RADIANS(RC[-1])) -> 0.98162718344766398 | C441: =COS(RADIANS(RC[-2])) -> 0.19080899537654472
A442: 440 | B442: =SIN(RADIANS(RC[-1])) -> 0.98480775301220802 | C442: =COS(RADIANS(RC[-2])) -> 0.17364817766693044
A443: 441 | B443: =SIN(RADIANS(RC[-1])) -> 0.98768834059513766 | C443: =COS(RADIANS(RC[-2])) -> 0.15643446504023117
A444: 442 | B444: =SIN(RADIANS(RC[-1])) -> 0.99026806874157025 | C444: =COS(RADIANS(RC[-2])) -> 0.13917310096006594
A445: 443 | B445: =SIN(RADIANS(RC[-1])) -> 0.99254615164132209 | C445: =COS(RADIANS(RC[-2])) -> 0.1218693434051473
A446: 444 | B446: =SIN(RADIANS(RC[-1])) -> 0.99452189536827329 | C446: =COS(RADIANS(RC[-2])) -> 0.10452846326765347
A447: 445 | B447: =SIN(RADIANS(RC[-1])) -> 0.99619469809174555 | C447: =COS(RADIANS(RC[-2])) -> 8.7155742747658374E-2
A448: 446 | B448: =SIN(RADIANS(RC[-1])) -> 0.9975640502598242 | C448: =COS(RADIANS(RC[-2])) -> 6.9756473744125705E-2
A449: 447 | B449: =SIN(RADIANS(RC[-1])) -> 0.99862953475457394 | C449: =COS(RADIANS(RC[-2])) -> 5.2335956242943543E-2
A450: 448 | B450: =SIN(RADIANS(RC[-1])) -> 0.99939082701909576 | C450: =COS(RADIANS(RC[-2])) -> 3.4899496702500879E-2
A451: 449 | B451: =SIN(RADIANS(RC[-1])) -> 0.99984769515639127 | C451: =COS(RADIANS(RC[-2])) -> 1.7452406437283623E-2
A452: 450 | B452: =SIN(RADIANS(RC[-1])) -> 1 | C452: =COS(RADIANS(RC[-2])) -> 3.06287113727155E-16
A453: 451 | B453: =SIN(RADIANS(RC[-1])) -> 0.99984769515639127 | C453: =COS(RADIANS(RC[-2])) -> -1.7452406437283009E-2
A454: 452 | B454: =SIN(RADIANS(RC[-1])) -> 0.99939082701909576 | C454: =COS(RADIANS(RC[-2])) -> -3.4899496702501157E-2
A455: 453 | B455: =SIN(RADIANS(RC[-1])) -> 0.99862953475457383 | C455: =COS(RADIANS(RC[-2])) -> -5.2335956242943821E-2
A456: 454 | B456: =SIN(RADIANS(RC[-1])) -> 0.99756405025982431 | C456: =COS(RADIANS(RC[-2])) -> -6.9756473744125094E-2
A457: 455 | B457: =SIN(RADIANS(RC[-1])) -> 0.99619469809174555 | C457: =COS(RADIANS(RC[-2])) -> -8.7155742747657763E-2
A458: 456 | B458: =SIN(RADIANS(RC[-1])) -> 0.99452189536827329 | C458: =COS(RADIANS(RC[-2])) -> -0.10452846326765375
A459: 457 | B459: =SIN(RADIANS(RC[-1])) -> 0.99254615164132198 | C459: =COS(RADIANS(RC[-2])) -> -0.12186934340514756
A460: 458 | B460: =SIN(RADIANS(RC[-1])) -> 0.99026806874157036 | C460: =COS(RADIANS(RC[-2])) -> -0.13917310096006533
A461: 459 | B461: =SIN(RADIANS(RC[-1])) -> 0.98768834059513766 | C461: =COS(RADIANS(RC[-2])) -> -0.15643446504023142
A462: 460 | B462: =SIN(RADIANS(RC[-1])) -> 0.98480775301220813 | C462: =COS(RADIANS(RC[-2])) -> -0.17364817766692986
A463: 461 | B463: =SIN(RADIANS(RC[-1])) -> 0.98162718344766386 | C463: =COS(RADIANS(RC[-2])) -> -0.190808995376545
A464: 462 | B464: =SIN(RADIANS(RC[-1])) -> 0.9781476007338058 | C464: =COS(RADIANS(RC[-2])) -> -0.20791169081775845
A465: 463 | B465: =SIN(RADIANS(RC[-1])) -> 0.97437006478523525 | C465: =COS(RADIANS(RC[-2])) -> -0.22495105434386478
A466: 464 | B466: =SIN(RADIANS(RC[-1])) -> 0.97029572627599636 | C466: =COS(RADIANS(RC[-2])) -> -0.24192189559966817
A467: 465 | B467: =SIN(RADIANS(RC[-1])) -> 0.96592582628906842 | C467: =COS(RADIANS(RC[-2])) -> -0.25881904510252018
A468: 466 | B468: =SIN(RADIANS(RC[-1])) -> 0.96126169593831889 | C468: =COS(RADIANS(RC[-2])) -> -0.27563735581699927
A469: 467 | B469: =SIN(RADIANS(RC[-1])) -> 0.95630475596303577 | C469: =COS(RADIANS(RC[-2])) -> -0.29237170472273577
A470: 468 | B470: =SIN(RADIANS(RC[-1])) -> 0.95105651629515364 | C470: =COS(RADIANS(RC[-2])) -> -0.30901699437494712
A471: 469 | B471: =SIN(RADIANS(RC[-1])) -> 0.94551857559931674 | C471: =COS(RADIANS(RC[-2])) -> -0.32556815445715703
A472: 470 | B472: =SIN(RADIANS(RC[-1])) -> 0.93969262078590865 | C472: =COS(RADIANS(RC[-2])) -> -0.34202014332566805
A473: 471 | B473: =SIN(RADIANS(RC[-1])) -> 0.93358042649720174 | C473: =COS(RADIANS(RC[-2])) -> -0.35836794954530027
A474: 472 | B474: =SIN(RADIANS(RC[-1])) -> 0.9271838545667872 | C474: =COS(RADIANS(RC[-2])) -> -0.37460659341591263
A475: 473 | B475: =SIN(RADIANS(RC[-1])) -> 0.92050485345244049 | C475: =COS(RADIANS(RC[-2])) -> -0.39073112848927338
A476: 474 | B476: =SIN(RADIANS(RC[-1])) -> 0.91354545764260076 | C476: =COS(RADIANS(RC[-2])) -> -0.40673664307580043
A477: 475 | B477: =SIN(RADIANS(RC[-1])) -> 0.90630778703665027 | C477: =COS(RADIANS(RC[-2])) -> -0.42261826174069872
A478: 476 | B478: =SIN(RADIANS(RC[-1])) -> 0.89879404629916704 | C478: =COS(RADIANS(RC[-2])) -> -0.43837114678907729
A479: 477 | B479: =SIN(RADIANS(RC[-1])) -> 0.89100652418836757 | C479: =COS(RADIANS(RC[-2])) -> -0.4539904997395473
A480: 478 | B480: =SIN(RADIANS(RC[-1])) -> 0.88294759285892721 | C480: =COS(RADIANS(RC[-2])) -> -0.46947156278589031
A481: 479 | B481: =SIN(RADIANS(RC[-1])) -> 0.87461970713939574 | C481: =COS(RADIANS(RC[-2])) -> -0.48480962024633717
A482: 480 | B482: =SIN(RADIANS(RC[-1])) -> 0.86602540378443915 | C482: =COS(RADIANS(RC[-2])) -> -0.49999999999999922
A483: 481 | B483: =SIN(RADIANS(RC[-1])) -> 0.85716730070211244 | C483: =COS(RADIANS(RC[-2])) -> -0.51503807491005404
A484: 482 | B484: =SIN(RADIANS(RC[-1])) -> 0.84804809615642573 | C484: =COS(RADIANS(RC[-2])) -> -0.52991926423320534
A485: 483 | B485: =SIN(RADIANS(RC[-1])) -> 0.83867056794542438 | C485: =COS(RADIANS(RC[-2])) -> -0.54463903501502653
A486: 484 | B486: =SIN(RADIANS(RC[-1])) -> 0.82903757255504162 | C486: =COS(RADIANS(RC[-2])) -> -0.5591929034707469
A487: 485 | B487: =SIN(RADIANS(RC[-1])) -> 0.81915204428899235 | C487: =COS(RADIANS(RC[-2])) -> -0.57357643635104527
A488: 486 | B488: =SIN(RADIANS(RC[-1])) -> 0.80901699437494767 | C488: =COS(RADIANS(RC[-2])) -> -0.58778525229247292
A489: 487 | B489: =SIN(RADIANS(RC[-1])) -> 0.79863551004729261 | C489: =COS(RADIANS(RC[-2])) -> -0.6018150231520486
A490: 488 | B490: =SIN(RADIANS(RC[-1])) -> 0.78801075360672246 | C490: =COS(RADIANS(RC[-2])) -> -0.61566147532565774
A491: 489 | B491: =SIN(RADIANS(RC[-1])) -> 0.7771459614569709 | C491: =COS(RADIANS(RC[-2])) -> -0.62932039104983739
A492: 490 | B492: =SIN(RADIANS(RC[-1])) -> 0.76604444311897757 | C492: =COS(RADIANS(RC[-2])) -> -0.64278760968653981
A493: 491 | B493: =SIN(RADIANS(RC[-1])) -> 0.75470958022277224 | C493: =COS(RADIANS(RC[-2])) -> -0.65605902899050694
A494: 492 | B494: =SIN(RADIANS(RC[-1])) -> 0.74314482547739402 | C494: =COS(RADIANS(RC[-2])) -> -0.66913060635885846
A495: 493 | B495: =SIN(RADIANS(RC[-1])) -> 0.73135370161917101 | C495: =COS(RADIANS(RC[-2])) -> -0.68199836006249792
A496: 494 | B496: =SIN(RADIANS(RC[-1])) -> 0.71933980033865119 | C496: =COS(RADIANS(RC[-2])) -> -0.69465837045899714
A497: 495 | B497: =SIN(RADIANS(RC[-1])) -> 0.70710678118654713 | C497: =COS(RADIANS(RC[-2])) -> -0.70710678118654791
A498: 496 | B498: =SIN(RADIANS(RC[-1])) -> 0.6946583704589977 | C498: =COS(RADIANS(RC[-2])) -> -0.71933980033865075
A499: 497 | B499: =SIN(RADIANS(RC[-1])) -> 0.68199836006249837 | C499: =COS(RADIANS(RC[-2])) -> -0.73135370161917057
A500: 498 | B500: =SIN(RADIANS(RC[-1])) -> 0.6691306063588589 | C500: =COS(RADIANS(RC[-2])) -> -0.74314482547739358
A501: 499 | B501: =SIN(RADIANS(RC[-1])) -> 0.6560590289905075 | C501: =COS(RADIANS(RC[-2])) -> -0.75470958022277179
A502: 500 | B502: =SIN(RADIANS(RC[-1])) -> 0.64278760968653903 | C502: =COS(RADIANS(RC[-2])) -> -0.76604444311897835
A503: 501 | B503: =SIN(RADIANS(RC[-1])) -> 0.62932039104983795 | C503: =COS(RADIANS(RC[-2])) -> -0.77714596145697046
A504: 502 | B504: =SIN(RADIANS(RC[-1])) -> 0.61566147532565829 | C504: =COS(RADIANS(RC[-2])) -> -0.78801075360672201
A505: 503 | B505: =SIN(RADIANS(RC[-1])) -> 0.60181502315204916 | C505: =COS(RADIANS(RC[-2])) -> -0.79863551004729227
A506: 504 | B506: =SIN(RADIANS(RC[-1])) -> 0.58778525229247336 | C506: =COS(RADIANS(RC[-2])) -> -0.80901699437494723
A507: 505 | B507: =SIN(RADIANS(RC[-1])) -> 0.57357643635104583 | C507: =COS(RADIANS(RC[-2])) -> -0.81915204428899202
A508: 506 | B508: =SIN(RADIANS(RC[-1])) -> 0.55919290347074746 | C508: =COS(RADIANS(RC[-2])) -> -0.82903757255504129
A509: 507 | B509: =SIN(RADIANS(RC[-1])) -> 0.54463903501502708 | C509: =COS(RADIANS(RC[-2])) -> -0.83867056794542405
A510: 508 | B510: =SIN(RADIANS(RC[-1])) -> 0.52991926423320446 | C510: =COS(RADIANS(RC[-2])) -> -0.84804809615642629
A511: 509 | B511: =SIN(RADIANS(RC[-1])) -> 0.5150380749100546 | C511: =COS(RADIANS(RC[-2])) -> -0.85716730070211211
A512: 510 | B512: =SIN(RADIANS(RC[-1])) -> 0.49999999999999978 | C512: =COS(RADIANS(RC[-2])) -> -0.86602540378443882
A513: 511 | B513: =SIN(RADIANS(RC[-1])) -> 0.48480962024633778 | C513: =COS(RADIANS(RC[-2])) -> -0.87461970713939541
A514: 512 | B514: =SIN(RADIANS(RC[-1])) -> 0.46947156278589092 | C514: =COS(RADIANS(RC[-2])) -> -0.88294759285892688
A515: 513 | B515: =SIN(RADIANS(RC[-1])) -> 0.4539904997395463 | C515: =COS(RADIANS(RC[-2])) -> -0.89100652418836812
A516: 514 | B516: =SIN(RADIANS(RC[-1])) -> 0.4383711467890779 | C516: =COS(RADIANS(RC[-2])) -> -0.8987940462991667
A517: 515 | B517: =SIN(RADIANS(RC[-1])) -> 0.42261826174069933 | C517: =COS(RADIANS(RC[-2])) -> -0.90630778703665005
A518: 516 | B518: =SIN(RADIANS(RC[-1])) -> 0.4067366430758011 | C518: =COS(RADIANS(RC[-2])) -> -0.91354545764260053
A519: 517 | B519: =SIN(RADIANS(RC[-1])) -> 0.39073112848927399 | C519: =COS(RADIANS(RC[-2])) -> -0.92050485345244026
A520: 518 | B520: =SIN(RADIANS(RC[-1])) -> 0.37460659341591163 | C520: =COS(RADIANS(RC[-2])) -> -0.92718385456678754
A521: 519 | B521: =SIN(RADIANS(RC[-1])) -> 0.35836794954530088 | C521: =COS(RADIANS(RC[-2])) -> -0.93358042649720152
A522: 520 | B522: =SIN(RADIANS(RC[-1])) -> 0.34202014332566871 | C522: =COS(RADIANS(RC[-2])) -> -0.93969262078590843
A523: 521 | B523: =SIN(RADIANS(RC[-1])) -> 0.32556815445715598 | C523: =COS(RADIANS(RC[-2])) -> -0.94551857559931707
A524: 522 | B524: =SIN(RADIANS(RC[-1])) -> 0.30901699437494778 | C524: =COS(RADIANS(RC[-2])) -> -0.95105651629515342
A525: 523 | B525: =SIN(RADIANS(RC[-1])) -> 0.29237170472273638 | C525: =COS(RADIANS(RC[-2])) -> -0.95630475596303555
A526: 524 | B526: =SIN(RADIANS(RC[-1])) -> 0.27563735581699988 | C526: =COS(RADIANS(RC[-2])) -> -0.96126169593831867
A527: 525 | B527: =SIN(RADIANS(RC[-1])) -> 0.25881904510252079 | C527: =COS(RADIANS(RC[-2])) -> -0.96592582628906831
A528: 526 | B528: =SIN(RADIANS(RC[-1])) -> 0.24192189559966712 | C528: =COS(RADIANS(RC[-2])) -> -0.97029572627599658
A529: 527 | B529: =SIN(RADIANS(RC[-1])) -> 0.22495105434386545 | C529: =COS(RADIANS(RC[-2])) -> -0.97437006478523513
A530: 528 | B530: =SIN(RADIANS(RC[-1])) -> 0.20791169081775912 | C530: =COS(RADIANS(RC[-2])) -> -0.97814760073380569
A531: 529 | B531: =SIN(RADIANS(RC[-1])) -> 0.19080899537654564 | C531: =COS(RADIANS(RC[-2])) -> -0.98162718344766375
A532: 530 | B532: =SIN(RADIANS(RC[-1])) -> 0.1736481776669305 | C532: =COS(RADIANS(RC[-2])) -> -0.98480775301220802
A533: 531 | B533: =SIN(RADIANS(RC[-1])) -> 0.15643446504023034 | C533: =COS(RADIANS(RC[-2])) -> -0.98768834059513777
A534: 532 | B534: =SIN(RADIANS(RC[-1])) -> 0.13917310096006599 | C534: =COS(RADIANS(RC[-2])) -> -0.99026806874157025
A535: 533 | B535: =SIN(RADIANS(RC[-1])) -> 0.12186934340514735 | C535: =COS(RADIANS(RC[-2])) -> -0.99254615164132209
A536: 534 | B536: =SIN(RADIANS(RC[-1])) -> 0.10452846326765443 | C536: =COS(RADIANS(RC[-2])) -> -0.99452189536827329
A537: 535 | B537: =SIN(RADIANS(RC[-1])) -> 8.7155742747658443E-2 | C537: =COS(RADIANS(RC[-2])) -> -0.99619469809174555
A538: 536 | B538: =SIN(RADIANS(RC[-1])) -> 6.9756473744124872E-2 | C538: =COS(RADIANS(RC[-2])) -> -0.99756405025982431
A539: 537 | B539: =SIN(RADIANS(RC[-1])) -> 5.2335956242944494E-2 | C539: =COS(RADIANS(RC[-2])) -> -0.99862953475457383
A540: 538 | B540: =SIN(RADIANS(RC[-1])) -> 3.4899496702500941E-2 | C540: =COS(RADIANS(RC[-2])) -> -0.99939082701909576
A541: 539 | B541: =SIN(RADIANS(RC[-1])) -> 1.7452406437282793E-2 | C541: =COS(RADIANS(RC[-2])) -> -0.99984769515639127
A542: 540 | B542: =SIN(RADIANS(RC[-1])) -> 3.67544536472586E-16 | C542: =COS(RADIANS(RC[-2])) -> -1
A543: 541 | B543: =SIN(RADIANS(RC[-1])) -> -1.7452406437283834E-2 | C543: =COS(RADIANS(RC[-2])) -> -0.99984769515639127
A544: 542 | B544: =SIN(RADIANS(RC[-1])) -> -3.4899496702500206E-2 | C544: =COS(RADIANS(RC[-2])) -> -0.99939082701909576
A545: 543 | B545: =SIN(RADIANS(RC[-1])) -> -5.2335956242943758E-2 | C545: =COS(RADIANS(RC[-2])) -> -0.99862953475457383
A546: 544 | B546: =SIN(RADIANS(RC[-1])) -> -6.9756473744125913E-2 | C546: =COS(RADIANS(RC[-2])) -> -0.9975640502598242
A547: 545 | B547: =SIN(RADIANS(RC[-1])) -> -8.7155742747657708E-2 | C547: =COS(RADIANS(RC[-2])) -> -0.99619469809174555
A548: 546 | B548: =SIN(RADIANS(RC[-1])) -> -0.10452846326765369 | C548: =COS(RADIANS(RC[-2])) -> -0.99452189536827329
A549: 547 | B549: =SIN(RADIANS(RC[-1])) -> -0.12186934340514662 | C549: =COS(RADIANS(RC[-2])) -> -0.99254615164132209
A550: 548 | B550: =SIN(RADIANS(RC[-1])) -> -0.13917310096006527 | C550: =COS(RADIANS(RC[-2])) -> -0.99026806874157036
A551: 549 | B551: =SIN(RADIANS(RC[-1])) -> -0.15643446504023137 | C551: =COS(RADIANS(RC[-2])) -> -0.98768834059513766
A552: 550 | B552: =SIN(RADIANS(RC[-1])) -> -0.17364817766692978 | C552: =COS(RADIANS(RC[-2])) -> -0.98480775301220813
A553: 551 | B553: =SIN(RADIANS(RC[-1])) -> -0.19080899537654492 | C553: =COS(RADIANS(RC[-2])) -> -0.98162718344766398
A554: 552 | B554: =SIN(RADIANS(RC[-1])) -> -0.2079116908177584 | C554: =COS(RADIANS(RC[-2])) -> -0.9781476007338058
A555: 553 | B555: =SIN(RADIANS(RC[-1])) -> -0.22495105434386473 | C555: =COS(RADIANS(RC[-2])) -> -0.97437006478523525
A556: 554 | B556: =SIN(RADIANS(RC[-1])) -> -0.24192189559966812 | C556: =COS(RADIANS(RC[-2])) -> -0.97029572627599636
A557: 555 | B557: =SIN(RADIANS(RC[-1])) -> -0.25881904510252013 | C557: =COS(RADIANS(RC[-2])) -> -0.96592582628906842
A558: 556 | B558: =SIN(RADIANS(RC[-1])) -> -0.27563735581699922 | C558: =COS(RADIANS(RC[-2])) -> -0.96126169593831889
A559: 557 | B559: =SIN(RADIANS(RC[-1])) -> -0.29237170472273738 | C559: =COS(RADIANS(RC[-2])) -> -0.95630475596303532
A560: 558 | B560: =SIN(RADIANS(RC[-1])) -> -0.30901699437494706 | C560: =COS(RADIANS(RC[-2])) -> -0.95105651629515364
A561: 559 | B561: =SIN(RADIANS(RC[-1])) -> -0.32556815445715698 | C561: =COS(RADIANS(RC[-2])) -> -0.94551857559931674
A562: 560 | B562: =SIN(RADIANS(RC[-1])) -> -0.34202014332566799 | C562: =COS(RADIANS(RC[-2])) -> -0.93969262078590865
A563: 561 | B563: =SIN(RADIANS(RC[-1])) -> -0.35836794954530021 | C563: =COS(RADIANS(RC[-2])) -> -0.93358042649720174
A564: 562 | B564: =SIN(RADIANS(RC[-1])) -> -0.37460659341591257 | C564: =COS(RADIANS(RC[-2])) -> -0.9271838545667872
A565: 563 | B565: =SIN(RADIANS(RC[-1])) -> -0.39073112848927333 | C565: =COS(RADIANS(RC[-2])) -> -0.92050485345244049
A566: 564 | B566: =SIN(RADIANS(RC[-1])) -> -0.40673664307580037 | C566: =COS(RADIANS(RC[-2])) -> -0.91354545764260076
A567: 565 | B567: =SIN(RADIANS(RC[-1])) -> -0.42261826174069866 | C567: =COS(RADIANS(RC[-2])) -> -0.90630778703665038
A568: 566 | B568: =SIN(RADIANS(RC[-1])) -> -0.43837114678907724 | C568: =COS(RADIANS(RC[-2])) -> -0.89879404629916704
A569: 567 | B569: =SIN(RADIANS(RC[-1])) -> -0.45399049973954725 | C569: =COS(RADIANS(RC[-2])) -> -0.89100652418836768
A570: 568 | B570: =SIN(RADIANS(RC[-1])) -> -0.46947156278589025 | C570: =COS(RADIANS(RC[-2])) -> -0.88294759285892721
A571: 569 | B571: =SIN(RADIANS(RC[-1])) -> -0.48480962024633711 | C571: =COS(RADIANS(RC[-2])) -> -0.87461970713939574
A572: 570 | B572: =SIN(RADIANS(RC[-1])) -> -0.49999999999999917 | C572: =COS(RADIANS(RC[-2])) -> -0.86602540378443915
A573: 571 | B573: =SIN(RADIANS(RC[-1])) -> -0.51503807491005393 | C573: =COS(RADIANS(RC[-2])) -> -0.85716730070211244
A574: 572 | B574: =SIN(RADIANS(RC[-1])) -> -0.52991926423320534 | C574: =COS(RADIANS(RC[-2])) -> -0.84804809615642573
A575: 573 | B575: =SIN(RADIANS(RC[-1])) -> -0.54463903501502653 | C575: =COS(RADIANS(RC[-2])) -> -0.83867056794542438
A576: 574 | B576: =SIN(RADIANS(RC[-1])) -> -0.55919290347074679 | C576: =COS(RADIANS(RC[-2])) -> -0.82903757255504174
A577: 575 | B577: =SIN(RADIANS(RC[-1])) -> -0.57357643635104671 | C577: =COS(RADIANS(RC[-2])) -> -0.81915204428899135
A578: 576 | B578: =SIN(RADIANS(RC[-1])) -> -0.5877852522924728 | C578: =COS(RADIANS(RC[-2])) -> -0.80901699437494767
A579: 577 | B579: =SIN(RADIANS(RC[-1])) -> -0.60181502315204849 | C579: =COS(RADIANS(RC[-2])) -> -0.79863551004729272
A580: 578 | B580: =SIN(RADIANS(RC[-1])) -> -0.61566147532565763 | C580: =COS(RADIANS(RC[-2])) -> -0.78801075360672246
A581: 579 | B581: =SIN(RADIANS(RC[-1])) -> -0.62932039104983739 | C581: =COS(RADIANS(RC[-2])) -> -0.7771459614569709
A582: 580 | B582: =SIN(RADIANS(RC[-1])) -> -0.64278760968653981 | C582: =COS(RADIANS(RC[-2])) -> -0.76604444311897768
A583: 581 | B583: =SIN(RADIANS(RC[-1])) -> -0.65605902899050694 | C583: =COS(RADIANS(RC[-2])) -> -0.75470958022277235
A584: 582 | B584: =SIN(RADIANS(RC[-1])) -> -0.66913060635885835 | C584: =COS(RADIANS(RC[-2])) -> -0.74314482547739413
A585: 583 | B585: =SIN(RADIANS(RC[-1])) -> -0.68199836006249781 | C585: =COS(RADIANS(RC[-2])) -> -0.73135370161917113
A586: 584 | B586: =SIN(RADIANS(RC[-1])) -> -0.69465837045899714 | C586: =COS(RADIANS(RC[-2])) -> -0.7193398003386513
A587: 585 | B587: =SIN(RADIANS(RC[-1])) -> -0.70710678118654791 | C587: =COS(RADIANS(RC[-2])) -> -0.70710678118654713
A588: 586 | B588: =SIN(RADIANS(RC[-1])) -> -0.71933980033865075 | C588: =COS(RADIANS(RC[-2])) -> -0.6946583704589977
A589: 587 | B589: =SIN(RADIANS(RC[-1])) -> -0.73135370161917057 | C589: =COS(RADIANS(RC[-2])) -> -0.68199836006249848
A590: 588 | B590: =SIN(RADIANS(RC[-1])) -> -0.74314482547739358 | C590: =COS(RADIANS(RC[-2])) -> -0.6691306063588589
A591: 589 | B591: =SIN(RADIANS(RC[-1])) -> -0.75470958022277179 | C591: =COS(RADIANS(RC[-2])) -> -0.6560590289905075
A592: 590 | B592: =SIN(RADIANS(RC[-1])) -> -0.76604444311897824 | C592: =COS(RADIANS(RC[-2])) -> -0.64278760968653903
A593: 591 | B593: =SIN(RADIANS(RC[-1])) -> -0.77714596145697046 | C593: =COS(RADIANS(RC[-2])) -> -0.62932039104983795
A594: 592 | B594: =SIN(RADIANS(RC[-1])) -> -0.7880107536067219 | C594: =COS(RADIANS(RC[-2])) -> -0.61566147532565829
A595: 593 | B595: =SIN(RADIANS(RC[-1])) -> -0.79863551004729327 | C595: =COS(RADIANS(RC[-2])) -> -0.60181502315204771
A596: 594 | B596: =SIN(RADIANS(RC[-1])) -> -0.80901699437494723 | C596: =COS(RADIANS(RC[-2])) -> -0.58778525229247347
A597: 595 | B597: =SIN(RADIANS(RC[-1])) -> -0.81915204428899191 | C597: =COS(RADIANS(RC[-2])) -> -0.57357643635104583
A598: 596 | B598: =SIN(RADIANS(RC[-1])) -> -0.82903757255504129 | C598: =COS(RADIANS(RC[-2])) -> -0.55919290347074746
A599: 597 | B599: =SIN(RADIANS(RC[-1])) -> -0.83867056794542394 | C599: =COS(RADIANS(RC[-2])) -> -0.5446390350150272
A600: 598 | B600: =SIN(RADIANS(RC[-1])) -> -0.84804809615642629 | C600: =COS(RADIANS(RC[-2])) -> -0.52991926423320446
A601: 599 | B601: =SIN(RADIANS(RC[-1])) -> -0.857167300702112 | C601: =COS(RADIANS(RC[-2])) -> -0.5150380749100546
A602: 600 | B602: =SIN(RADIANS(RC[-1])) -> -0.86602540378443871 | C602: =COS(RADIANS(RC[-2])) -> -0.49999999999999983
A603: 601 | B603: =SIN(RADIANS(RC[-1])) -> -0.87461970713939541 | C603: =COS(RADIANS(RC[-2])) -> -0.48480962024633784
A604: 602 | B604: =SIN(RADIANS(RC[-1])) -> -0.88294759285892688 | C604: =COS(RADIANS(RC[-2])) -> -0.46947156278589097
A605: 603 | B605: =SIN(RADIANS(RC[-1])) -> -0.89100652418836812 | C605: =COS(RADIANS(RC[-2])) -> -0.45399049973954636
A606: 604 | B606: =SIN(RADIANS(RC[-1])) -> -0.8987940462991667 | C606: =COS(RADIANS(RC[-2])) -> -0.43837114678907796
A607: 605 | B607: =SIN(RADIANS(RC[-1])) -> -0.90630778703665005 | C607: =COS(RADIANS(RC[-2])) -> -0.42261826174069939
A608: 606 | B608: =SIN(RADIANS(RC[-1])) -> -0.91354545764260053 | C608: =COS(RADIANS(RC[-2])) -> -0.40673664307580115
A609: 607 | B609: =SIN(RADIANS(RC[-1])) -> -0.92050485345244015 | C609: =COS(RADIANS(RC[-2])) -> -0.39073112848927405
A610: 608 | B610: =SIN(RADIANS(RC[-1])) -> -0.92718385456678754 | C610: =COS(RADIANS(RC[-2])) -> -0.37460659341591168
A611: 609 | B611: =SIN(RADIANS(RC[-1])) -> -0.93358042649720152 | C611: =COS(RADIANS(RC[-2])) -> -0.35836794954530093
A612: 610 | B612: =SIN(RADIANS(RC[-1])) -> -0.93969262078590843 | C612: =COS(RADIANS(RC[-2])) -> -0.34202014332566877
A613: 611 | B613: =SIN(RADIANS(RC[-1])) -> -0.94551857559931707 | C613: =COS(RADIANS(RC[-2])) -> -0.32556815445715603
A614: 612 | B614: =SIN(RADIANS(RC[-1])) -> -0.95105651629515342 | C614: =COS(RADIANS(RC[-2])) -> -0.30901699437494784
A615: 613 | B615: =SIN(RADIANS(RC[-1])) -> -0.95630475596303555 | C615: =COS(RADIANS(RC[-2])) -> -0.29237170472273649
A616: 614 | B616: =SIN(RADIANS(RC[-1])) -> -0.96126169593831867 | C616: =COS(RADIANS(RC[-2])) -> -0.27563735581699994
A617: 615 | B617: =SIN(RADIANS(RC[-1])) -> -0.9659258262890682 | C617: =COS(RADIANS(RC[-2])) -> -0.25881904510252091
A618: 616 | B618: =SIN(RADIANS(RC[-1])) -> -0.97029572627599658 | C618: =COS(RADIANS(RC[-2])) -> -0.24192189559966717
A619: 617 | B619: =SIN(RADIANS(RC[-1])) -> -0.97437006478523513 | C619: =COS(RADIANS(RC[-2])) -> -0.2249510543438655
A620: 618 | B620: =SIN(RADIANS(RC[-1])) -> -0.97814760073380569 | C620: =COS(RADIANS(RC[-2])) -> -0.20791169081775918
A621: 619 | B621: =SIN(RADIANS(RC[-1])) -> -0.98162718344766375 | C621: =COS(RADIANS(RC[-2])) -> -0.19080899537654572
A622: 620 | B622: =SIN(RADIANS(RC[-1])) -> -0.98480775301220802 | C622: =COS(RADIANS(RC[-2])) -> -0.17364817766693058
A623: 621 | B623: =SIN(RADIANS(RC[-1])) -> -0.98768834059513777 | C623: =COS(RADIANS(RC[-2])) -> -0.1564344650402304
A624: 622 | B624: =SIN(RADIANS(RC[-1])) -> -0.99026806874157025 | C624: =COS(RADIANS(RC[-2])) -> -0.13917310096006605
A625: 623 | B625: =SIN(RADIANS(RC[-1])) -> -0.99254615164132209 | C625: =COS(RADIANS(RC[-2])) -> -0.12186934340514741
A626: 624 | B626: =SIN(RADIANS(RC[-1])) -> -0.99452189536827318 | C626: =COS(RADIANS(RC[-2])) -> -0.10452846326765448
A627: 625 | B627: =SIN(RADIANS(RC[-1])) -> -0.99619469809174555 | C627: =COS(RADIANS(RC[-2])) -> -8.7155742747658499E-2
A628: 626 | B628: =SIN(RADIANS(RC[-1])) -> -0.99756405025982431 | C628: =COS(RADIANS(RC[-2])) -> -6.9756473744124942E-2
A629: 627 | B629: =SIN(RADIANS(RC[-1])) -> -0.99862953475457383 | C629: =COS(RADIANS(RC[-2])) -> -5.2335956242944556E-2
A630: 628 | B630: =SIN(RADIANS(RC[-1])) -> -0.99939082701909576 | C630: =COS(RADIANS(RC[-2])) -> -3.4899496702501004E-2
A631: 629 | B631: =SIN(RADIANS(RC[-1])) -> -0.99984769515639127 | C631: =COS(RADIANS(RC[-2])) -> -1.7452406437282856E-2
A632: 630 | B632: =SIN(RADIANS(RC[-1])) -> -1 | C632: =COS(RADIANS(RC[-2])) -> -4.28801959218017E-16
A633: 631 | B633: =SIN(RADIANS(RC[-1])) -> -0.99984769515639127 | C633: =COS(RADIANS(RC[-2])) -> 1.7452406437283775E-2
A634: 632 | B634: =SIN(RADIANS(RC[-1])) -> -0.99939082701909576 | C634: =COS(RADIANS(RC[-2])) -> 3.489949670250015E-2
A635: 633 | B635: =SIN(RADIANS(RC[-1])) -> -0.99862953475457383 | C635: =COS(RADIANS(RC[-2])) -> 5.2335956242943696E-2
A636: 634 | B636: =SIN(RADIANS(RC[-1])) -> -0.9975640502598242 | C636: =COS(RADIANS(RC[-2])) -> 6.9756473744125858E-2
A637: 635 | B637: =SIN(RADIANS(RC[-1])) -> -0.99619469809174555 | C637: =COS(RADIANS(RC[-2])) -> 8.7155742747657639E-2
A638: 636 | B638: =SIN(RADIANS(RC[-1])) -> -0.99452189536827329 | C638: =COS(RADIANS(RC[-2])) -> 0.10452846326765362
A639: 637 | B639: =SIN(RADIANS(RC[-1])) -> -0.99254615164132209 | C639: =COS(RADIANS(RC[-2])) -> 0.12186934340514656
A640: 638 | B640: =SIN(RADIANS(RC[-1])) -> -0.99026806874157036 | C640: =COS(RADIANS(RC[-2])) -> 0.13917310096006522
A641: 639 | B641: =SIN(RADIANS(RC[-1])) -> -0.98768834059513766 | C641: =COS(RADIANS(RC[-2])) -> 0.15643446504023131
A642: 640 | B642: =SIN(RADIANS(RC[-1])) -> -0.98480775301220813 | C642: =COS(RADIANS(RC[-2])) -> 0.17364817766692972
A643: 641 | B643: =SIN(RADIANS(RC[-1])) -> -0.98162718344766398 | C643: =COS(RADIANS(RC[-2])) -> 0.19080899537654486
A644: 642 | B644: =SIN(RADIANS(RC[-1])) -> -0.9781476007338058 | C644: =COS(RADIANS(RC[-2])) -> 0.20791169081775834
A645: 643 | B645: =SIN(RADIANS(RC[-1])) -> -0.97437006478523536 | C645: =COS(RADIANS(RC[-2])) -> 0.22495105434386467
A646: 644 | B646: =SIN(RADIANS(RC[-1])) -> -0.97029572627599636 | C646: =COS(RADIANS(RC[-2])) -> 0.24192189559966806
A647: 645 | B647: =SIN(RADIANS(RC[-1])) -> -0.96592582628906842 | C647: =COS(RADIANS(RC[-2])) -> 0.25881904510252007
A648: 646 | B648: =SIN(RADIANS(RC[-1])) -> -0.96126169593831889 | C648: =COS(RADIANS(RC[-2])) -> 0.27563735581699916
A649: 647 | B649: =SIN(RADIANS(RC[-1])) -> -0.95630475596303532 | C649: =COS(RADIANS(RC[-2])) -> 0.29237170472273732
A650: 648 | B650: =SIN(RADIANS(RC[-1])) -> -0.95105651629515375 | C650: =COS(RADIANS(RC[-2])) -> 0.30901699437494701
A651: 649 | B651: =SIN(RADIANS(RC[-1])) -> -0.94551857559931674 | C651: =COS(RADIANS(RC[-2])) -> 0.32556815445715692
A652: 650 | B652: =SIN(RADIANS(RC[-1])) -> -0.93969262078590865 | C652: =COS(RADIANS(RC[-2])) -> 0.34202014332566794
A653: 651 | B653: =SIN(RADIANS(RC[-1])) -> -0.93358042649720185 | C653: =COS(RADIANS(RC[-2])) -> 0.35836794954530016
A654: 652 | B654: =SIN(RADIANS(RC[-1])) -> -0.9271838545667872 | C654: =COS(RADIANS(RC[-2])) -> 0.37460659341591251
A655: 653 | B655: =SIN(RADIANS(RC[-1])) -> -0.92050485345244049 | C655: =COS(RADIANS(RC[-2])) -> 0.39073112848927327
A656: 654 | B656: =SIN(RADIANS(RC[-1])) -> -0.91354545764260087 | C656: =COS(RADIANS(RC[-2])) -> 0.40673664307580032
A657: 655 | B657: =SIN(RADIANS(RC[-1])) -> -0.90630778703665038 | C657: =COS(RADIANS(RC[-2])) -> 0.42261826174069861
A658: 656 | B658: =SIN(RADIANS(RC[-1])) -> -0.89879404629916715 | C658: =COS(RADIANS(RC[-2])) -> 0.43837114678907718
A659: 657 | B659: =SIN(RADIANS(RC[-1])) -> -0.89100652418836768 | C659: =COS(RADIANS(RC[-2])) -> 0.45399049973954719
A660: 658 | B660: =SIN(RADIANS(RC[-1])) -> -0.88294759285892721 | C660: =COS(RADIANS(RC[-2])) -> 0.4694715627858902
A661: 659 | B661: =SIN(RADIANS(RC[-1])) -> -0.87461970713939574 | C661: =COS(RADIANS(RC[-2])) -> 0.48480962024633706
A662: 660 | B662: =SIN(RADIANS(RC[-1])) -> -0.86602540378443915 | C662: =COS(RADIANS(RC[-2])) -> 0.49999999999999911
A663: 661 | B663: =SIN(RADIANS(RC[-1])) -> -0.85716730070211244 | C663: =COS(RADIANS(RC[-2])) -> 0.51503807491005393
A664: 662 | B664: =SIN(RADIANS(RC[-1])) -> -0.84804809615642585 | C664: =COS(RADIANS(RC[-2])) -> 0.52991926423320523
A665: 663 | B665: =SIN(RADIANS(RC[-1])) -> -0.83867056794542438 | C665: =COS(RADIANS(RC[-2])) -> 0.54463903501502642
A666: 664 | B666: =SIN(RADIANS(RC[-1])) -> -0.82903757255504174 | C666: =COS(RADIANS(RC[-2])) -> 0.55919290347074679
A667: 665 | B667: =SIN(RADIANS(RC[-1])) -> -0.81915204428899147 | C667: =COS(RADIANS(RC[-2])) -> 0.5735764363510466
A668: 666 | B668: =SIN(RADIANS(RC[-1])) -> -0.80901699437494767 | C668: =COS(RADIANS(RC[-2])) -> 0.5877852522924728
A669: 667 | B669: =SIN(RADIANS(RC[-1])) -> -0.79863551004729272 | C669: =COS(RADIANS(RC[-2])) -> 0.60181502315204849
A670: 668 | B670: =SIN(RADIANS(RC[-1])) -> -0.78801075360672246 | C670: =COS(RADIANS(RC[-2])) -> 0.61566147532565763
A671: 669 | B671: =SIN(RADIANS(RC[-1])) -> -0.77714596145697101 | C671: =COS(RADIANS(RC[-2])) -> 0.62932039104983728
A672: 670 | B672: =SIN(RADIANS(RC[-1])) -> -0.76604444311897768 | C672: =COS(RADIANS(RC[-2])) -> 0.6427876096865397
A673: 671 | B673: =SIN(RADIANS(RC[-1])) -> -0.75470958022277235 | C673: =COS(RADIANS(RC[-2])) -> 0.65605902899050683
A674: 672 | B674: =SIN(RADIANS(RC[-1])) -> -0.74314482547739413 | C674: =COS(RADIANS(RC[-2])) -> 0.66913060635885835
A675: 673 | B675: =SIN(RADIANS(RC[-1])) -> -0.73135370161917113 | C675: =COS(RADIANS(RC[-2])) -> 0.68199836006249781
A676: 674 | B676: =SIN(RADIANS(RC[-1])) -> -0.7193398003386513 | C676: =COS(RADIANS(RC[-2])) -> 0.69465837045899714
A677: 675 | B677: =SIN(RADIANS(RC[-1])) -> -0.70710678118654724 | C677: =COS(RADIANS(RC[-2])) -> 0.70710678118654779
A678: 676 | B678: =SIN(RADIANS(RC[-1])) -> -0.69465837045899781 | C678: =COS(RADIANS(RC[-2])) -> 0.71933980033865064
A679: 677 | B679: =SIN(RADIANS(RC[-1])) -> -0.68199836006249848 | C679: =COS(RADIANS(RC[-2])) -> 0.73135370161917046
A680: 678 | B680: =SIN(RADIANS(RC[-1])) -> -0.66913060635885901 | C680: =COS(RADIANS(RC[-2])) -> 0.74314482547739358
A681: 679 | B681: =SIN(RADIANS(RC[-1])) -> -0.65605902899050761 | C681: =COS(RADIANS(RC[-2])) -> 0.75470958022277179
A682: 680 | B682: =SIN(RADIANS(RC[-1])) -> -0.64278760968653903 | C682: =COS(RADIANS(RC[-2])) -> 0.76604444311897824
A683: 681 | B683: =SIN(RADIANS(RC[-1])) -> -0.62932039104983806 | C683: =COS(RADIANS(RC[-2])) -> 0.77714596145697035
A684: 682 | B684: =SIN(RADIANS(RC[-1])) -> -0.61566147532565829 | C684: =COS(RADIANS(RC[-2])) -> 0.7880107536067219
A685: 683 | B685: =SIN(RADIANS(RC[-1])) -> -0.60181502315204782 | C685: =COS(RADIANS(RC[-2])) -> 0.79863551004729327
A686: 684 | B686: =SIN(RADIANS(RC[-1])) -> -0.58778525229247347 | C686: =COS(RADIANS(RC[-2])) -> 0.80901699437494712
A687: 685 | B687: =SIN(RADIANS(RC[-1])) -> -0.57357643635104594 | C687: =COS(RADIANS(RC[-2])) -> 0.81915204428899191
A688: 686 | B688: =SIN(RADIANS(RC[-1])) -> -0.55919290347074757 | C688: =COS(RADIANS(RC[-2])) -> 0.82903757255504118
A689: 687 | B689: =SIN(RADIANS(RC[-1])) -> -0.5446390350150272 | C689: =COS(RADIANS(RC[-2])) -> 0.83867056794542394
A690: 688 | B690: =SIN(RADIANS(RC[-1])) -> -0.52991926423320457 | C690: =COS(RADIANS(RC[-2])) -> 0.84804809615642629
A691: 689 | B691: =SIN(RADIANS(RC[-1])) -> -0.51503807491005471 | C691: =COS(RADIANS(RC[-2])) -> 0.857167300702112
A692: 690 | B692: =SIN(RADIANS(RC[-1])) -> -0.49999999999999989 | C692: =COS(RADIANS(RC[-2])) -> 0.86602540378443871
A693: 691 | B693: =SIN(RADIANS(RC[-1])) -> -0.48480962024633789 | C693: =COS(RADIANS(RC[-2])) -> 0.8746197071393953
A694: 692 | B694: =SIN(RADIANS(RC[-1])) -> -0.46947156278589103 | C694: =COS(RADIANS(RC[-2])) -> 0.88294759285892677
A695: 693 | B695: =SIN(RADIANS(RC[-1])) -> -0.45399049973954642 | C695: =COS(RADIANS(RC[-2])) -> 0.89100652418836801
A696: 694 | B696: =SIN(RADIANS(RC[-1])) -> -0.43837114678907801 | C696: =COS(RADIANS(RC[-2])) -> 0.8987940462991667
A697: 695 | B697: =SIN(RADIANS(RC[-1])) -> -0.42261826174069944 | C697: =COS(RADIANS(RC[-2])) -> 0.90630778703664994
A698: 696 | B698: =SIN(RADIANS(RC[-1])) -> -0.40673664307580121 | C698: =COS(RADIANS(RC[-2])) -> 0.91354545764260042
A699: 697 | B699: =SIN(RADIANS(RC[-1])) -> -0.3907311284892741 | C699: =COS(RADIANS(RC[-2])) -> 0.92050485345244015
A700: 698 | B700: =SIN(RADIANS(RC[-1])) -> -0.37460659341591174 | C700: =COS(RADIANS(RC[-2])) -> 0.92718385456678754
A701: 699 | B701: =SIN(RADIANS(RC[-1])) -> -0.35836794954530099 | C701: =COS(RADIANS(RC[-2])) -> 0.93358042649720152
A702: 700 | B702: =SIN(RADIANS(RC[-1])) -> -0.34202014332566882 | C702: =COS(RADIANS(RC[-2])) -> 0.93969262078590832
A703: 701 | B703: =SIN(RADIANS(RC[-1])) -> -0.32556815445715609 | C703: =COS(RADIANS(RC[-2])) -> 0.94551857559931696
A704: 702 | B704: =SIN(RADIANS(RC[-1])) -> -0.3090169943749479 | C704: =COS(RADIANS(RC[-2])) -> 0.95105651629515342
A705: 703 | B705: =SIN(RADIANS(RC[-1])) -> -0.29237170472273655 | C705: =COS(RADIANS(RC[-2])) -> 0.95630475596303555
A706: 704 | B706: =SIN(RADIANS(RC[-1])) -> -0.27563735581700005 | C706: =COS(RADIANS(RC[-2])) -> 0.96126169593831867
A707: 705 | B707: =SIN(RADIANS(RC[-1])) -> -0.25881904510252096 | C707: =COS(RADIANS(RC[-2])) -> 0.9659258262890682
A708: 706 | B708: =SIN(RADIANS(RC[-1])) -> -0.24192189559966723 | C708: =COS(RADIANS(RC[-2])) -> 0.97029572627599658
A709: 707 | B709: =SIN(RADIANS(RC[-1])) -> -0.22495105434386556 | C709: =COS(RADIANS(RC[-2])) -> 0.97437006478523513
A710: 708 | B710: =SIN(RADIANS(RC[-1])) -> -0.20791169081775923 | C710: =COS(RADIANS(RC[-2])) -> 0.97814760073380569
A711: 709 | B711: =SIN(RADIANS(RC[-1])) -> -0.19080899537654578 | C711: =COS(RADIANS(RC[-2])) -> 0.98162718344766375
A712: 710 | B712: =SIN(RADIANS(RC[-1])) -> -0.17364817766693064 | C712: =COS(RADIANS(RC[-2])) -> 0.98480775301220802
A713: 711 | B713: =SIN(RADIANS(RC[-1])) -> -0.15643446504023048 | C713: =COS(RADIANS(RC[-2])) -> 0.98768834059513777
A714: 712 | B714: =SIN(RADIANS(RC[-1])) -> -0.13917310096006613 | C714: =COS(RADIANS(RC[-2])) -> 0.99026806874157025
A715: 713 | B715: =SIN(RADIANS(RC[-1])) -> -0.12186934340514748 | C715: =COS(RADIANS(RC[-2])) -> 0.99254615164132198
A716: 714 | B716: =SIN(RADIANS(RC[-1])) -> -0.10452846326765454 | C716: =COS(RADIANS(RC[-2])) -> 0.99452189536827318
A717: 715 | B717: =SIN(RADIANS(RC[-1])) -> -8.7155742747658554E-2 | C717: =COS(RADIANS(RC[-2])) -> 0.99619469809174555
A718: 716 | B718: =SIN(RADIANS(RC[-1])) -> -6.9756473744124997E-2 | C718: =COS(RADIANS(RC[-2])) -> 0.99756405025982431
A719: 717 | B719: =SIN(RADIANS(RC[-1])) -> -5.2335956242944619E-2 | C719: =COS(RADIANS(RC[-2])) -> 0.99862953475457383
A720: 718 | B720: =SIN(RADIANS(RC[-1])) -> -3.4899496702501066E-2 | C720: =COS(RADIANS(RC[-2])) -> 0.99939082701909576
A721: 719 | B721: =SIN(RADIANS(RC[-1])) -> -1.7452406437282918E-2 | C721: =COS(RADIANS(RC[-2])) -> 0.99984769515639127

Sheet: SomeJunk
A1: Some random junk.