Sheet: LOAD.POD_HISTORIES
A1: RECORDER_ID | B1: TRANSACTION_DATE | C1: HOUR | D1: INTERVAL | E1: NET_KW | F1: NET_KVA | G1: POD_READING_ATI | H1: POD_METERING_POINT_ATI | I1: UNIT_TASK_EVENT_ATI | J1: POD_HISTORY_ATI | K1: RECORD_TYPE | L1: SEGMENT | M1: COMPANY | N1: NET_KWH | O1: NET_KWH_SOURCE | P1: NET_KVAR | Q1: NET_KVARH | R1: NET_KVARH_SOURCE | S1: NET_KVAH | T1: FILE_TRACKING_ATI | U1: DUPLICATE_FLAG | V1: MV90_READING_ATI | W1: DATA_STATE_ID | X1: SITE_ID | Y1: ASSET_ID | Z1: BACKED_OUT_FLAG
A2: ATPLAST | B2: 110404 | C2: 1 | D2: 1 | E2: 10133.76 | F2: 10389.120000000001 | G2: 1 | H2: 40414 | I2: 21662 | J2: 1 | K2: GEN | L2: 919032.25 | M2: EP | N2: =RC[-9]/4 -> 2533.44 | O2: ME | P2: =SQRT(RC[-10]^2-RC[-11]^2) -> 2289.262465686279 | Q2: =RC[-1]/4 -> 572.31561642156976 | R2: ME | S2: =RC[-13]/4 -> 2597.2800000000002 | T2: 1 | U2: 0 | V2: 1 | W2: P00 | X2: 30112487205 | Z2: 1
A3: ATPLAST | B3: 110404 | C3: 1 | D3: 2 | E3: 10053.120000000001 | F3: 10298.4 | G3: 2 | H3: 40415 | I3: 21662 | J3: 2 | K3: GEN | L3: 919032.5 | M3: EP | N3: =RC[-9]/4 -> 2513.2800000000002 | O3: ME | P3: =SQRT(RC[-10]^2-RC[-11]^2) -> 2234.2383099391991 | Q3: =RC[-1]/4 -> 558.55957748479977 | R3: ME | S3: =RC[-13]/4 -> 2574.6 | T3: 1 | U3: 0 | V3: 1 | W3: P00 | X3: 30112487205 | Z3: 1
A4: ATPLAST | B4: 110404 | C4: 1 | D4: 3 | E4: 10046.4 | F4: 10291.68 | G4: 3 | H4: 40416 | I4: 21662 | J4: 3 | K4: GEN | L4: 919032.75 | M4: EP | N4: =RC[-9]/4 -> 2511.6 | O4: ME | P4: =SQRT(RC[-10]^2-RC[-11]^2) -> 2233.5004505036518 | Q4: =RC[-1]/4 -> 558.37511262591295 | R4: ME | S4: =RC[-13]/4 -> 2572.92 | T4: 1 | U4: 0 | V4: 1 | W4: P00 | X4: 30112487205 | Z4: 1
A5: ATPLAST | B5: 110404 | C5: 1 | D5: 4 | E5: 10002.719999999999 | F5: 10241.280000000001 | G5: 4 | H5: 40417 | I5: 21662 | J5: 4 | K5: GEN | L5: 919033 | M5: EP | N5: =RC[-9]/4 -> 2500.6799999999998 | O5: ME | P5: =SQRT(RC[-10]^2-RC[-11]^2) -> 2197.5915544067816 | Q5: =RC[-1]/4 -> 549.3978886016954 | R5: ME | S5: =RC[-13]/4 -> 2560.3200000000002 | T5: 1 | U5: 0 | V5: 1 | W5: P00 | X5: 30112487205 | Z5: 1
A6: ATPLAST | B6: 110404 | C6: 2 | D6: 1 | E6: 10073.280000000001 | F6: 10321.92 | G6: 5 | H6: 40418 | I6: 21662 | J6: 5 | K6: GEN | L6: 919033.25 | M6: EP | N6: =RC[-9]/4 -> 2518.3200000000002 | O6: ME | P6: =SQRT(RC[-10]^2-RC[-11]^2) -> 2251.9019801048175 | Q6: =RC[-1]/4 -> 562.97549502620438 | R6: ME | S6: =RC[-13]/4 -> 2580.48 | T6: 1 | U6: 0 | V6: 1 | W6: P00 | X6: 30112487205 | Z6: 1
A7: ATPLAST | B7: 110404 | C7: 2 | D7: 2 | E7: 10019.52 | F7: 10261.44 | G7: 6 | H7: 40419 | I7: 21662 | J7: 6 | K7: GEN | L7: 919033.5 | M7: EP | N7: =RC[-9]/4 -> 2504.88 | O7: ME | P7: =SQRT(RC[-10]^2-RC[-11]^2) -> 2215.0326957406292 | Q7: =RC[-1]/4 -> 553.75817393515729 | R7: ME | S7: =RC[-13]/4 -> 2565.36 | T7: 1 | U7: 0 | V7: 1 | W7: P00 | X7: 30112487205 | Z7: 1
A8: ATPLAST | B8: 110404 | C8: 2 | D8: 3 | E8: 10012.799999999999 | F8: 10248 | G8: 7 | H8: 40420 | I8: 21662 | J8: 7 | K8: GEN | L8: 919033.75 | M8: EP | N8: =RC[-9]/4 -> 2503.1999999999998 | O8: ME | P8: =SQRT(RC[-10]^2-RC[-11]^2) -> 2182.9659090329401 | Q8: =RC[-1]/4 -> 545.74147725823502 | R8: ME | S8: =RC[-13]/4 -> 2562 | T8: 1 | U8: 0 | V8: 1 | W8: P00 | X8: 30112487205 | Z8: 1
A9: ATPLAST | B9: 110404 | C9: 2 | D9: 4 | E9: 9965.76 | F9: 10190.879999999999 | G9: 8 | H9: 40421 | I9: 21662 | J9: 8 | K9: GEN | L9: 919034 | M9: EP | N9: =RC[-9]/4 -> 2491.44 | O9: ME | P9: =SQRT(RC[-10]^2-RC[-11]^2) -> 2130.1790527558915 | Q9: =RC[-1]/4 -> 532.54476318897287 | R9: ME | S9: =RC[-13]/4 -> 2547.7199999999998 | T9: 1 | U9: 0 | V9: 1 | W9: P00 | X9: 30112487205 | Z9: 1
A10: ATPLAST | B10: 110404 | C10: 3 | D10: 1 | E10: 9948.9599999999991 | F10: 10174.08 | G10: 9 | H10: 40422 | I10: 21662 | J10: 9 | K10: GEN | L10: 919034.25 | M10: EP | N10: =RC[-9]/4 -> 2487.2399999999998 | O10: ME | P10: =SQRT(RC[-10]^2-RC[-11]^2) -> 2128.4028671283104 | Q10: =RC[-1]/4 -> 532.1007167820776 | R10: ME | S10: =RC[-13]/4 -> 2543.52 | T10: 1 | U10: 0 | V10: 1 | W10: P00 | X10: 30112487205 | Z10: 1
A11: ATPLAST | B11: 110404 | C11: 3 | D11: 2 | E11: 9938.8799999999992 | F11: 10164 | G11: 10 | H11: 40423 | I11: 21662 | J11: 10 | K11: GEN | L11: 919034.5 | M11: EP | N11: =RC[-9]/4 -> 2484.7199999999998 | O11: ME | P11: =SQRT(RC[-10]^2-RC[-11]^2) -> 2127.3364439129059 | Q11: =RC[-1]/4 -> 531.83411097822648 | R11: ME | S11: =RC[-13]/4 -> 2541 | T11: 1 | U11: 0 | V11: 1 | W11: P00 | X11: 30112487205 | Z11: 1
A12: ATPLAST | B12: 110404 | C12: 3 | D12: 3 | E12: 9948.9599999999991 | F12: 10177.44 | G12: 11 | H12: 40424 | I12: 21662 | J12: 11 | K12: GEN | L12: 919034.75 | M12: EP | N12: =RC[-9]/4 -> 2487.2399999999998 | O12: ME | P12: =SQRT(RC[-10]^2-RC[-11]^2) -> 2144.4066480031311 | Q12: =RC[-1]/4 -> 536.10166200078277 | R12: ME | S12: =RC[-13]/4 -> 2544.36 | T12: 1 | U12: 0 | V12: 1 | W12: P00 | X12: 30112487205 | Z12: 1
A13: ATPLAST | B13: 110404 | C13: 3 | D13: 4 | E13: 10147.200000000001 | F13: 10409.280000000001 | G13: 12 | H13: 40425 | I13: 21662 | J13: 12 | K13: GEN | L13: 919035 | M13: EP | N13: =RC[-9]/4 -> 2536.8000000000002 | O13: ME | P13: =SQRT(RC[-10]^2-RC[-11]^2) -> 2321.0864435431931 | Q13: =RC[-1]/4 -> 580.27161088579828 | R13: ME | S13: =RC[-13]/4 -> 2602.3200000000002 | T13: 1 | U13: 0 | V13: 1 | W13: P00 | X13: 30112487205 | Z13: 1
A14: ATPLAST | B14: 110404 | C14: 4 | D14: 1 | E14: 10184.16 | F14: 10442.879999999999 | G14: 13 | H14: 40426 | I14: 21662 | J14: 13 | K14: GEN | L14: 919035.25 | M14: EP | N14: =RC[-9]/4 -> 2546.04 | O14: ME | P14: =SQRT(RC[-10]^2-RC[-11]^2) -> 2310.1142371752931 | Q14: =RC[-1]/4 -> 577.52855929382326 | R14: ME | S14: =RC[-13]/4 -> 2610.7199999999998 | T14: 1 | U14: 0 | V14: 1 | W14: P00 | X14: 30112487205 | Z14: 1
A15: ATPLAST | B15: 110404 | C15: 4 | D15: 2 | E15: 10184.16 | F15: 10446.24 | G15: 14 | H15: 40427 | I15: 21662 | J15: 14 | K15: GEN | L15: 919035.5 | M15: EP | N15: =RC[-9]/4 -> 2546.04 | O15: ME | P15: =SQRT(RC[-10]^2-RC[-11]^2) -> 2325.2559497827315 | Q15: =RC[-1]/4 -> 581.31398744568287 | R15: ME | S15: =RC[-13]/4 -> 2611.56 | T15: 1 | U15: 0 | V15: 1 | W15: P00 | X15: 30112487205 | Z15: 1
A16: ATPLAST | B16: 110404 | C16: 4 | D16: 3 | E16: 10143.84 | F16: 10402.56 | G16: 15 | H16: 40428 | I16: 21662 | J16: 15 | K16: GEN | L16: 919035.75 | M16: EP | N16: =RC[-9]/4 -> 2535.96 | O16: ME | P16: =SQRT(RC[-10]^2-RC[-11]^2) -> 2305.5941984659789 | Q16: =RC[-1]/4 -> 576.39854961649473 | R16: ME | S16: =RC[-13]/4 -> 2600.64 | T16: 1 | U16: 0 | V16: 1 | W16: P00 | X16: 30112487205 | Z16: 1
A17: ATPLAST | B17: 110404 | C17: 4 | D17: 4 | E17: 10214.4 | F17: 10493.28 | G17: 16 | H17: 40429 | I17: 21662 | J17: 16 | K17: GEN | L17: 919036 | M17: EP | N17: =RC[-9]/4 -> 2553.6 | O17: ME | P17: =SQRT(RC[-10]^2-RC[-11]^2) -> 2403.1141875491508 | Q17: =RC[-1]/4 -> 600.77854688728769 | R17: ME | S17: =RC[-13]/4 -> 2623.32 | T17: 1 | U17: 0 | V17: 1 | W17: P00 | X17: 30112487205 | Z17: 1
A18: ATPLAST | B18: 110404 | C18: 5 | D18: 1 | E18: 10194.24 | F18: 10469.76 | G18: 17 | H18: 40430 | I18: 21662 | J18: 17 | K18: GEN | L18: 919036.25 | M18: EP | N18: =RC[-9]/4 -> 2548.56 | O18: ME | P18: =SQRT(RC[-10]^2-RC[-11]^2) -> 2386.0731925068858 | Q18: =RC[-1]/4 -> 596.51829812672145 | R18: ME | S18: =RC[-13]/4 -> 2617.44 | T18: 1 | U18: 0 | V18: 1 | W18: P00 | X18: 30112487205 | Z18: 1
A19: ATPLAST | B19: 110404 | C19: 5 | D19: 2 | E19: 10157.280000000001 | F19: 10436.16 | G19: 18 | H19: 40431 | I19: 21662 | J19: 18 | K19: GEN | L19: 919036.5 | M19: EP | N19: =RC[-9]/4 -> 2539.3200000000002 | O19: ME | P19: =SQRT(RC[-10]^2-RC[-11]^2) -> 2396.4762772036738 | Q19: =RC[-1]/4 -> 599.11906930091845 | R19: ME | S19: =RC[-13]/4 -> 2609.04 | T19: 1 | U19: 0 | V19: 1 | W19: P00 | X19: 30112487205 | Z19: 1
A20: ATPLAST | B20: 110404 | C20: 5 | D20: 3 | E20: 10174.08 | F20: 10436.16 | G20: 19 | H20: 40432 | I20: 21662 | J20: 19 | K20: GEN | L20: 919036.75 | M20: EP | N20: =RC[-9]/4 -> 2543.52 | O20: ME | P20: =SQRT(RC[-10]^2-RC[-11]^2) -> 2324.1195535514098 | Q20: =RC[-1]/4 -> 581.02988838785245 | R20: ME | S20: =RC[-13]/4 -> 2609.04 | T20: 1 | U20: 0 | V20: 1 | W20: P00 | X20: 30112487205 | Z20: 1
A21: ATPLAST | B21: 110404 | C21: 5 | D21: 4 | E21: 10164 | F21: 10432.799999999999 | G21: 20 | H21: 40433 | I21: 21662 | J21: 20 | K21: GEN | L21: 919037 | M21: EP | N21: =RC[-9]/4 -> 2541 | O21: ME | P21: =SQRT(RC[-10]^2-RC[-11]^2) -> 2352.9598041615563 | Q21: =RC[-1]/4 -> 588.23995104038909 | R21: ME | S21: =RC[-13]/4 -> 2608.1999999999998 | T21: 1 | U21: 0 | V21: 1 | W21: P00 | X21: 30112487205 | Z21: 1
A22: ATPLAST | B22: 110404 | C22: 6 | D22: 1 | E22: 10174.08 | F22: 10439.52 | G22: 21 | H22: 40434 | I22: 21662 | J22: 21 | K22: GEN | L22: 919037.25 | M22: EP | N22: =RC[-9]/4 -> 2543.52 | O22: ME | P22: =SQRT(RC[-10]^2-RC[-11]^2) -> 2339.1609572665179 | Q22: =RC[-1]/4 -> 584.79023931662948 | R22: ME | S22: =RC[-13]/4 -> 2609.88 | T22: 1 | U22: 0 | V22: 1 | W22: P00 | X22: 30112487205 | Z22: 1
A23: ATPLAST | B23: 110404 | C23: 6 | D23: 2 | E23: 9962.4 | F23: 10197.6 | G23: 22 | H23: 40435 | I23: 21662 | J23: 22 | K23: GEN | L23: 919037.5 | M23: EP | N23: =RC[-9]/4 -> 2490.6 | O23: ME | P23: =SQRT(RC[-10]^2-RC[-11]^2) -> 2177.5288746650444 | Q23: =RC[-1]/4 -> 544.38221866626111 | R23: ME | S23: =RC[-13]/4 -> 2549.4 | T23: 1 | U23: 0 | V23: 1 | W23: P00 | X23: 30112487205 | Z23: 1
A24: ATPLAST | B24: 110404 | C24: 6 | D24: 3 | E24: 9925.44 | F24: 10153.92 | G24: 23 | H24: 40436 | I24: 21662 | J24: 23 | K24: GEN | L24: 919037.75 | M24: EP | N24: =RC[-9]/4 -> 2481.36 | O24: ME | P24: =SQRT(RC[-10]^2-RC[-11]^2) -> 2141.8991976281213 | Q24: =RC[-1]/4 -> 535.47479940703033 | R24: ME | S24: =RC[-13]/4 -> 2538.48 | T24: 1 | U24: 0 | V24: 1 | W24: P00 | X24: 30112487205 | Z24: 1
A25: ATPLAST | B25: 110404 | C25: 6 | D25: 4 | E25: 9959.0400000000009 | F25: 10184.16 | G25: 24 | H25: 40437 | I25: 21662 | J25: 24 | K25: GEN | L25: 919038 | M25: EP | N25: =RC[-9]/4 -> 2489.7600000000002 | O25: ME | P25: =SQRT(RC[-10]^2-RC[-11]^2) -> 2129.4687562864092 | Q25: =RC[-1]/4 -> 532.3671890716023 | R25: ME | S25: =RC[-13]/4 -> 2546.04 | T25: 1 | U25: 0 | V25: 1 | W25: P00 | X25: 30112487205 | Z25: 1
A26: ATPLAST | B26: 110404 | C26: 7 | D26: 1 | E26: 9972.48 | F26: 10194.24 | G26: 25 | H26: 40414 | I26: 21662 | J26: 25 | K26: GEN | L26: 919038.25 | M26: EP | N26: =RC[-9]/4 -> 2493.12 | O26: ME | P26: =SQRT(RC[-10]^2-RC[-11]^2) -> 2114.7510083222587 | Q26: =RC[-1]/4 -> 528.68775208056468 | R26: ME | S26: =RC[-13]/4 -> 2548.56 | T26: 1 | U26: 0 | V26: 1 | W26: P00 | X26: 30112487205 | Z26: 1
A27: ATPLAST | B27: 110404 | C27: 7 | D27: 2 | E27: 9972.48 | F27: 10194.24 | G27: 26 | H27: 40415 | I27: 21662 | J27: 26 | K27: GEN | L27: 919038.5 | M27: EP | N27: =RC[-9]/4 -> 2493.12 | O27: ME | P27: =SQRT(RC[-10]^2-RC[-11]^2) -> 2114.7510083222587 | Q27: =RC[-1]/4 -> 528.68775208056468 | R27: ME | S27: =RC[-13]/4 -> 2548.56 | T27: 1 | U27: 0 | V27: 1 | W27: P00 | X27: 30112487205 | Z27: 1
A28: ATPLAST | B28: 110404 | C28: 7 | D28: 3 | E28: 10046.4 | F28: 10271.52 | G28: 27 | H28: 40416 | I28: 21662 | J28: 27 | K28: GEN | L28: 919038.75 | M28: EP | N28: =RC[-9]/4 -> 2511.6 | O28: ME | P28: =SQRT(RC[-10]^2-RC[-11]^2) -> 2138.6842100693625 | Q28: =RC[-1]/4 -> 534.67105251734063 | R28: ME | S28: =RC[-13]/4 -> 2567.88 | T28: 1 | U28: 0 | V28: 1 | W28: P00 | X28: 30112487205 | Z28: 1
A29: ATPLAST | B29: 110404 | C29: 7 | D29: 4 | E29: 10170.719999999999 | F29: 10419.36 | G29: 28 | H29: 40417 | I29: 21662 | J29: 28 | K29: GEN | L29: 919039 | M29: EP | N29: =RC[-9]/4 -> 2542.6799999999998 | O29: ME | P29: =SQRT(RC[-10]^2-RC[-11]^2) -> 2262.6350768959696 | Q29: =RC[-1]/4 -> 565.65876922399241 | R29: ME | S29: =RC[-13]/4 -> 2604.84 | T29: 1 | U29: 0 | V29: 1 | W29: P00 | X29: 30112487205 | Z29: 1
A30: ATPLAST | B30: 110404 | C30: 8 | D30: 1 | E30: 10190.879999999999 | F30: 10439.52 | G30: 29 | H30: 40418 | I30: 21662 | J30: 29 | K30: GEN | L30: 919039.25 | M30: EP | N30: =RC[-9]/4 -> 2547.7199999999998 | O30: ME | P30: =SQRT(RC[-10]^2-RC[-11]^2) -> 2264.84936717655 | Q30: =RC[-1]/4 -> 566.2123417941375 | R30: ME | S30: =RC[-13]/4 -> 2609.88 | T30: 1 | U30: 0 | V30: 1 | W30: P00 | X30: 30112487205 | Z30: 1
A31: ATPLAST | B31: 110404 | C31: 8 | D31: 2 | E31: 10116.959999999999 | F31: 10372.32 | G31: 30 | H31: 40419 | I31: 21662 | J31: 30 | K31: GEN | L31: 919039.5 | M31: EP | N31: =RC[-9]/4 -> 2529.2399999999998 | O31: ME | P31: =SQRT(RC[-10]^2-RC[-11]^2) -> 2287.3877110800445 | Q31: =RC[-1]/4 -> 571.84692777001112 | R31: ME | S31: =RC[-13]/4 -> 2593.08 | T31: 1 | U31: 0 | V31: 1 | W31: P00 | X31: 30112487205 | Z31: 1
A32: ATPLAST | B32: 110404 | C32: 8 | D32: 3 | E32: 10093.44 | F32: 10338.719999999999 | G32: 31 | H32: 40420 | I32: 21662 | J32: 31 | K32: GEN | L32: 919039.75 | M32: EP | N32: =RC[-9]/4 -> 2523.36 | O32: ME | P32: =SQRT(RC[-10]^2-RC[-11]^2) -> 2238.6603594113972 | Q32: =RC[-1]/4 -> 559.66508985284929 | R32: ME | S32: =RC[-13]/4 -> 2584.6799999999998 | T32: 1 | U32: 0 | V32: 1 | W32: P00 | X32: 30112487205 | Z32: 1
A33: ATPLAST | B33: 110404 | C33: 8 | D33: 4 | E33: 10063.200000000001 | F33: 10301.76 | G33: 32 | H33: 40421 | I33: 21662 | J33: 32 | K33: GEN | L33: 919040 | M33: EP | N33: =RC[-9]/4 -> 2515.8000000000002 | O33: ME | P33: =SQRT(RC[-10]^2-RC[-11]^2) -> 2204.147195084754 | Q33: =RC[-1]/4 -> 551.0367987711885 | R33: ME | S33: =RC[-13]/4 -> 2575.44 | T33: 1 | U33: 0 | V33: 1 | W33: P00 | X33: 30112487205 | Z33: 1
A34: ATPLAST | B34: 110404 | C34: 9 | D34: 1 | E34: 9999.36 | F34: 10234.56 | G34: 33 | H34: 40422 | I34: 21662 | J34: 33 | K34: GEN | L34: 919040.25 | M34: EP | N34: =RC[-9]/4 -> 2499.84 | O34: ME | P34: =SQRT(RC[-10]^2-RC[-11]^2) -> 2181.5173581706799 | Q34: =RC[-1]/4 -> 545.37933954266998 | R34: ME | S34: =RC[-13]/4 -> 2558.64 | T34: 1 | U34: 0 | V34: 1 | W34: P00 | X34: 30112487205 | Z34: 1
A35: ATPLAST | B35: 110404 | C35: 9 | D35: 2 | E35: 10043.040000000001 | F35: 10291.68 | G35: 34 | H35: 40423 | I35: 21662 | J35: 34 | K35: GEN | L35: 919040.5 | M35: EP | N35: =RC[-9]/4 -> 2510.7600000000002 | O35: ME | P35: =SQRT(RC[-10]^2-RC[-11]^2) -> 2248.5606019851866 | Q35: =RC[-1]/4 -> 562.14015049629666 | R35: ME | S35: =RC[-13]/4 -> 2572.92 | T35: 1 | U35: 0 | V35: 1 | W35: P00 | X35: 30112487205 | Z35: 1
A36: ATPLAST | B36: 110404 | C36: 9 | D36: 3 | E36: 10019.52 | F36: 10254.719999999999 | G36: 35 | H36: 40424 | I36: 21662 | J36: 35 | K36: GEN | L36: 919040.75 | M36: EP | N36: =RC[-9]/4 -> 2504.88 | O36: ME | P36: =SQRT(RC[-10]^2-RC[-11]^2) -> 2183.6898241279555 | Q36: =RC[-1]/4 -> 545.92245603198887 | R36: ME | S36: =RC[-13]/4 -> 2563.6799999999998 | T36: 1 | U36: 0 | V36: 1 | W36: P00 | X36: 30112487205 | Z36: 1
A37: ATPLAST | B37: 110404 | C37: 9 | D37: 4 | E37: 10036.32 | F37: 10288.32 | G37: 36 | H37: 40425 | I37: 21662 | J37: 36 | K37: GEN | L37: 919041 | M37: EP | N37: =RC[-9]/4 -> 2509.08 | O37: ME | P37: =SQRT(RC[-10]^2-RC[-11]^2) -> 2263.1414626576043 | Q37: =RC[-1]/4 -> 565.78536566440107 | R37: ME | S37: =RC[-13]/4 -> 2572.08 | T37: 1 | U37: 0 | V37: 1 | W37: P00 | X37: 30112487205 | Z37: 1
A38: ATPLAST | B38: 110404 | C38: 10 | D38: 1 | E38: 9945.6 | F38: 10177.44 | G38: 37 | H38: 40426 | I38: 21662 | J38: 37 | K38: GEN | L38: 919041.25 | M38: EP | N38: =RC[-9]/4 -> 2486.4 | O38: ME | P38: =SQRT(RC[-10]^2-RC[-11]^2) -> 2159.9364790659911 | Q38: =RC[-1]/4 -> 539.98411976649777 | R38: ME | S38: =RC[-13]/4 -> 2544.36 | T38: 1 | U38: 0 | V38: 1 | W38: P00 | X38: 30112487205 | Z38: 1
A39: ATPLAST | B39: 110404 | C39: 10 | D39: 2 | E39: 10059.84 | F39: 10311.84 | G39: 38 | H39: 40427 | I39: 21662 | J39: 38 | K39: GEN | L39: 919041.5 | M39: EP | N39: =RC[-9]/4 -> 2514.96 | O39: ME | P39: =SQRT(RC[-10]^2-RC[-11]^2) -> 2265.7588927332931 | Q39: =RC[-1]/4 -> 566.43972318332328 | R39: ME | S39: =RC[-13]/4 -> 2577.96 | T39: 1 | U39: 0 | V39: 1 | W39: P00 | X39: 30112487205 | Z39: 1
A40: ATPLAST | B40: 110404 | C40: 10 | D40: 3 | E40: 10032.959999999999 | F40: 10298.4 | G40: 39 | H40: 40428 | I40: 21662 | J40: 39 | K40: GEN | L40: 919041.75 | M40: EP | N40: =RC[-9]/4 -> 2508.2399999999998 | O40: ME | P40: =SQRT(RC[-10]^2-RC[-11]^2) -> 2323.091947900471 | Q40: =RC[-1]/4 -> 580.77298697511776 | R40: ME | S40: =RC[-13]/4 -> 2574.6 | T40: 1 | U40: 0 | V40: 1 | W40: P00 | X40: 30112487205 | Z40: 1
A41: ATPLAST | B41: 110404 | C41: 10 | D41: 4 | E41: 9999.36 | F41: 10248 | G41: 40 | H41: 40429 | I41: 21662 | J41: 40 | K41: GEN | L41: 919042 | M41: EP | N41: =RC[-9]/4 -> 2499.84 | O41: ME | P41: =SQRT(RC[-10]^2-RC[-11]^2) -> 2243.7253821267868 | Q41: =RC[-1]/4 -> 560.93134553169671 | R41: ME | S41: =RC[-13]/4 -> 2562 | T41: 1 | U41: 0 | V41: 1 | W41: P00 | X41: 30112487205 | Z41: 1
A42: ATPLAST | B42: 110404 | C42: 11 | D42: 1 | E42: 10029.6 | F42: 10288.32 | G42: 41 | H42: 40430 | I42: 21662 | J42: 41 | K42: GEN | L42: 919042.25 | M42: EP | N42: =RC[-9]/4 -> 2507.4 | O42: ME | P42: =SQRT(RC[-10]^2-RC[-11]^2) -> 2292.7390305920094 | Q42: =RC[-1]/4 -> 573.18475764800235 | R42: ME | S42: =RC[-13]/4 -> 2572.08 | T42: 1 | U42: 0 | V42: 1 | W42: P00 | X42: 30112487205 | Z42: 1
A43: ATPLAST | B43: 110404 | C43: 11 | D43: 2 | E43: 10069.92 | F43: 10318.56 | G43: 42 | H43: 40431 | I43: 21662 | J43: 42 | K43: GEN | L43: 919042.5 | M43: EP | N43: =RC[-9]/4 -> 2517.48 | O43: ME | P43: =SQRT(RC[-10]^2-RC[-11]^2) -> 2251.5309607464837 | Q43: =RC[-1]/4 -> 562.88274018662094 | R43: ME | S43: =RC[-13]/4 -> 2579.64 | T43: 1 | U43: 0 | V43: 1 | W43: P00 | X43: 30112487205 | Z43: 1
A44: ATPLAST | B44: 110404 | C44: 11 | D44: 3 | E44: 10043.040000000001 | F44: 10291.68 | G44: 43 | H44: 40432 | I44: 21662 | J44: 43 | K44: GEN | L44: 919042.75 | M44: EP | N44: =RC[-9]/4 -> 2510.7600000000002 | O44: ME | P44: =SQRT(RC[-10]^2-RC[-11]^2) -> 2248.5606019851866 | Q44: =RC[-1]/4 -> 562.14015049629666 | R44: ME | S44: =RC[-13]/4 -> 2572.92 | T44: 1 | U44: 0 | V44: 1 | W44: P00 | X44: 30112487205 | Z44: 1
A45: ATPLAST | B45: 110404 | C45: 11 | D45: 4 | E45: 10116.959999999999 | F45: 10368.959999999999 | G45: 44 | H45: 40433 | I45: 21662 | J45: 44 | K45: GEN | L45: 919043 | M45: EP | N45: =RC[-9]/4 -> 2529.2399999999998 | O45: ME | P45: =SQRT(RC[-10]^2-RC[-11]^2) -> 2272.1029554137735 | Q45: =RC[-1]/4 -> 568.02573885344339 | R45: ME | S45: =RC[-13]/4 -> 2592.2399999999998 | T45: 1 | U45: 0 | V45: 1 | W45: P00 | X45: 30112487205 | Z45: 1
A46: ATPLAST | B46: 110404 | C46: 12 | D46: 1 | E46: 10143.84 | F46: 10402.56 | G46: 45 | H46: 40434 | I46: 21662 | J46: 45 | K46: GEN | L46: 919043.25 | M46: EP | N46: =RC[-9]/4 -> 2535.96 | O46: ME | P46: =SQRT(RC[-10]^2-RC[-11]^2) -> 2305.5941984659789 | Q46: =RC[-1]/4 -> 576.39854961649473 | R46: ME | S46: =RC[-13]/4 -> 2600.64 | T46: 1 | U46: 0 | V46: 1 | W46: P00 | X46: 30112487205 | Z46: 1
A47: ATPLAST | B47: 110404 | C47: 12 | D47: 2 | E47: 10056.48 | F47: 10301.76 | G47: 46 | H47: 40435 | I47: 21662 | J47: 46 | K47: GEN | L47: 919043.5 | M47: EP | N47: =RC[-9]/4 -> 2514.12 | O47: ME | P47: =SQRT(RC[-10]^2-RC[-11]^2) -> 2234.6071482925163 | Q47: =RC[-1]/4 -> 558.65178707312907 | R47: ME | S47: =RC[-13]/4 -> 2575.44 | T47: 1 | U47: 0 | V47: 1 | W47: P00 | X47: 30112487205 | Z47: 1
A48: ATPLAST | B48: 110404 | C48: 12 | D48: 3 | E48: 10103.52 | F48: 10365.6 | G48: 47 | H48: 40436 | I48: 21662 | J48: 47 | K48: GEN | L48: 919043.75 | M48: EP | N48: =RC[-9]/4 -> 2525.88 | O48: ME | P48: =SQRT(RC[-10]^2-RC[-11]^2) -> 2316.1491682532037 | Q48: =RC[-1]/4 -> 579.03729206330092 | R48: ME | S48: =RC[-13]/4 -> 2591.4 | T48: 1 | U48: 0 | V48: 1 | W48: P00 | X48: 30112487205 | Z48: 1
A49: ATPLAST | B49: 110404 | C49: 12 | D49: 4 | E49: 10096.799999999999 | F49: 10355.52 | G49: 48 | H49: 40437 | I49: 21662 | J49: 48 | K49: GEN | L49: 919044 | M49: EP | N49: =RC[-9]/4 -> 2524.1999999999998 | O49: ME | P49: =SQRT(RC[-10]^2-RC[-11]^2) -> 2300.309594467672 | Q49: =RC[-1]/4 -> 575.077398616918 | R49: ME | S49: =RC[-13]/4 -> 2588.88 | T49: 1 | U49: 0 | V49: 1 | W49: P00 | X49: 30112487205 | Z49: 1
A50: ATPLAST | B50: 110404 | C50: 13 | D50: 1 | E50: 10120.32 | F50: 10382.4 | G50: 49 | H50: 40414 | I50: 21662 | J50: 49 | K50: GEN | L50: 919044.25 | M50: EP | N50: =RC[-9]/4 -> 2530.08 | O50: ME | P50: =SQRT(RC[-10]^2-RC[-11]^2) -> 2318.049364789284 | Q50: =RC[-1]/4 -> 579.51234119732101 | R50: ME | S50: =RC[-13]/4 -> 2595.6 | T50: 1 | U50: 0 | V50: 1 | W50: P00 | X50: 30112487205 | Z50: 1
A51: ATPLAST | B51: 110404 | C51: 13 | D51: 2 | E51: 10036.32 | F51: 10281.6 | G51: 50 | H51: 40415 | I51: 21662 | J51: 50 | K51: GEN | L51: 919044.5 | M51: EP | N51: =RC[-9]/4 -> 2509.08 | O51: ME | P51: =SQRT(RC[-10]^2-RC[-11]^2) -> 2232.3932040749464 | Q51: =RC[-1]/4 -> 558.09830101873661 | R51: ME | S51: =RC[-13]/4 -> 2570.4 | T51: 1 | U51: 0 | V51: 1 | W51: P00 | X51: 30112487205 | Z51: 1
A52: ATPLAST | B52: 110404 | C52: 13 | D52: 3 | E52: 9942.24 | F52: 10167.36 | G52: 51 | H52: 40416 | I52: 21662 | J52: 51 | K52: GEN | L52: 919044.75 | M52: EP | N52: =RC[-9]/4 -> 2485.56 | O52: ME | P52: =SQRT(RC[-10]^2-RC[-11]^2) -> 2127.6919777073022 | Q52: =RC[-1]/4 -> 531.92299442682554 | R52: ME | S52: =RC[-13]/4 -> 2541.84 | T52: 1 | U52: 0 | V52: 1 | W52: P00 | X52: 30112487205 | Z52: 1
A53: ATPLAST | B53: 110404 | C53: 13 | D53: 4 | E53: 9948.9599999999991 | F53: 10180.799999999999 | G53: 52 | H53: 40417 | I53: 21662 | J53: 52 | K53: GEN | L53: 919045 | M53: EP | N53: =RC[-9]/4 -> 2487.2399999999998 | O53: ME | P53: =SQRT(RC[-10]^2-RC[-11]^2) -> 2160.2970995675582 | Q53: =RC[-1]/4 -> 540.07427489188956 | R53: ME | S53: =RC[-13]/4 -> 2545.1999999999998 | T53: 1 | U53: 0 | V53: 1 | W53: P00 | X53: 30112487205 | Z53: 1
A54: ATPLAST | B54: 110404 | C54: 14 | D54: 1 | E54: 10036.32 | F54: 10281.6 | G54: 53 | H54: 40418 | I54: 21662 | J54: 53 | K54: GEN | L54: 919045.25 | M54: EP | N54: =RC[-9]/4 -> 2509.08 | O54: ME | P54: =SQRT(RC[-10]^2-RC[-11]^2) -> 2232.3932040749464 | Q54: =RC[-1]/4 -> 558.09830101873661 | R54: ME | S54: =RC[-13]/4 -> 2570.4 | T54: 1 | U54: 0 | V54: 1 | W54: P00 | X54: 30112487205 | Z54: 1
A55: ATPLAST | B55: 110404 | C55: 14 | D55: 2 | E55: 10133.76 | F55: 10395.84 | G55: 54 | H55: 40419 | I55: 21662 | J55: 54 | K55: GEN | L55: 919045.5 | M55: EP | N55: =RC[-9]/4 -> 2533.44 | O55: ME | P55: =SQRT(RC[-10]^2-RC[-11]^2) -> 2319.568401233299 | Q55: =RC[-1]/4 -> 579.89210030832476 | R55: ME | S55: =RC[-13]/4 -> 2598.96 | T55: 1 | U55: 0 | V55: 1 | W55: P00 | X55: 30112487205 | Z55: 1
A56: ATPLAST | B56: 110404 | C56: 14 | D56: 3 | E56: 10153.92 | F56: 10429.44 | G56: 55 | H56: 40420 | I56: 21662 | J56: 55 | K56: GEN | L56: 919045.75 | M56: EP | N56: =RC[-9]/4 -> 2538.48 | O56: ME | P56: =SQRT(RC[-10]^2-RC[-11]^2) -> 2381.4128888540108 | Q56: =RC[-1]/4 -> 595.3532222135027 | R56: ME | S56: =RC[-13]/4 -> 2607.36 | T56: 1 | U56: 0 | V56: 1 | W56: P00 | X56: 30112487205 | Z56: 1
A57: ATPLAST | B57: 110404 | C57: 14 | D57: 4 | E57: 10130.4 | F57: 10392.48 | G57: 56 | H57: 40421 | I57: 21662 | J57: 56 | K57: GEN | L57: 919046 | M57: EP | N57: =RC[-9]/4 -> 2532.6 | O57: ME | P57: =SQRT(RC[-10]^2-RC[-11]^2) -> 2319.1887353986508 | Q57: =RC[-1]/4 -> 579.7971838496627 | R57: ME | S57: =RC[-13]/4 -> 2598.12 | T57: 1 | U57: 0 | V57: 1 | W57: P00 | X57: 30112487205 | Z57: 1
A58: ATPLAST | B58: 110404 | C58: 15 | D58: 1 | E58: 10140.48 | F58: 10405.92 | G58: 57 | H58: 40422 | I58: 21662 | J58: 57 | K58: GEN | L58: 919046.25 | M58: EP | N58: =RC[-9]/4 -> 2535.12 | O58: ME | P58: =SQRT(RC[-10]^2-RC[-11]^2) -> 2335.3450314675151 | Q58: =RC[-1]/4 -> 583.83625786687878 | R58: ME | S58: =RC[-13]/4 -> 2601.48 | T58: 1 | U58: 0 | V58: 1 | W58: P00 | X58: 30112487205 | Z58: 1
A59: ATPLAST | B59: 110404 | C59: 15 | D59: 2 | E59: 10039.68 | F59: 10301.76 | G59: 58 | H59: 40423 | I59: 21662 | J59: 58 | K59: GEN | L59: 919046.5 | M59: EP | N59: =RC[-9]/4 -> 2509.92 | O59: ME | P59: =SQRT(RC[-10]^2-RC[-11]^2) -> 2308.9141593398372 | Q59: =RC[-1]/4 -> 577.22853983495929 | R59: ME | S59: =RC[-13]/4 -> 2575.44 | T59: 1 | U59: 0 | V59: 1 | W59: P00 | X59: 30112487205 | Z59: 1
A60: ATPLAST | B60: 110404 | C60: 15 | D60: 3 | E60: 10002.719999999999 | F60: 10254.719999999999 | G60: 59 | H60: 40424 | I60: 21662 | J60: 59 | K60: GEN | L60: 919046.75 | M60: EP | N60: =RC[-9]/4 -> 2500.6799999999998 | O60: ME | P60: =SQRT(RC[-10]^2-RC[-11]^2) -> 2259.3970169051731 | Q60: =RC[-1]/4 -> 564.84925422629328 | R60: ME | S60: =RC[-13]/4 -> 2563.6799999999998 | T60: 1 | U60: 0 | V60: 1 | W60: P00 | X60: 30112487205 | Z60: 1
A61: ATPLAST | B61: 110404 | C61: 15 | D61: 4 | E61: 10039.68 | F61: 10308.48 | G61: 60 | H61: 40425 | I61: 21662 | J61: 60 | K61: GEN | L61: 919047 | M61: EP | N61: =RC[-9]/4 -> 2509.92 | O61: ME | P61: =SQRT(RC[-10]^2-RC[-11]^2) -> 2338.7144776564705 | Q61: =RC[-1]/4 -> 584.67861941411763 | R61: ME | S61: =RC[-13]/4 -> 2577.12 | T61: 1 | U61: 0 | V61: 1 | W61: P00 | X61: 30112487205 | Z61: 1
A62: ATPLAST | B62: 110404 | C62: 16 | D62: 1 | E62: 10026.24 | F62: 10274.879999999999 | G62: 61 | H62: 40426 | I62: 21662 | J62: 61 | K62: GEN | L62: 919047.25 | M62: EP | N62: =RC[-9]/4 -> 2506.56 | O62: ME | P62: =SQRT(RC[-10]^2-RC[-11]^2) -> 2246.702133528162 | Q62: =RC[-1]/4 -> 561.6755333820405 | R62: ME | S62: =RC[-13]/4 -> 2568.7199999999998 | T62: 1 | U62: 0 | V62: 1 | W62: P00 | X62: 30112487205 | Z62: 1
A63: ATPLAST | B63: 110404 | C63: 16 | D63: 2 | E63: 10053.120000000001 | F63: 10318.56 | G63: 62 | H63: 40427 | I63: 21662 | J63: 62 | K63: GEN | L63: 919047.5 | M63: EP | N63: =RC[-9]/4 -> 2513.2800000000002 | O63: ME | P63: =SQRT(RC[-10]^2-RC[-11]^2) -> 2325.3943190779423 | Q63: =RC[-1]/4 -> 581.34857976948558 | R63: ME | S63: =RC[-13]/4 -> 2579.64 | T63: 1 | U63: 0 | V63: 1 | W63: P00 | X63: 30112487205 | Z63: 1
A64: ATPLAST | B64: 110404 | C64: 16 | D64: 3 | E64: 10036.32 | F64: 10298.4 | G64: 63 | H64: 40428 | I64: 21662 | J64: 63 | K64: GEN | L64: 919047.75 | M64: EP | N64: =RC[-9]/4 -> 2509.08 | O64: ME | P64: =SQRT(RC[-10]^2-RC[-11]^2) -> 2308.5327412882821 | Q64: =RC[-1]/4 -> 577.13318532207052 | R64: ME | S64: =RC[-13]/4 -> 2574.6 | T64: 1 | U64: 0 | V64: 1 | W64: P00 | X64: 30112487205 | Z64: 1
A65: ATPLAST | B65: 110404 | C65: 16 | D65: 4 | E65: 9891.84 | F65: 10120.32 | G65: 64 | H65: 40429 | I65: 21662 | J65: 64 | K65: GEN | L65: 919048 | M65: EP | N65: =RC[-9]/4 -> 2472.96 | O65: ME | P65: =SQRT(RC[-10]^2-RC[-11]^2) -> 2138.3120251263572 | Q65: =RC[-1]/4 -> 534.5780062815893 | R65: ME | S65: =RC[-13]/4 -> 2530.08 | T65: 1 | U65: 0 | V65: 1 | W65: P00 | X65: 30112487205 | Z65: 1
A66: ATPLAST | B66: 110404 | C66: 17 | D66: 1 | E66: 9915.36 | F66: 10147.200000000001 | G66: 65 | H66: 40430 | I66: 21662 | J66: 65 | K66: GEN | L66: 919048.25 | M66: EP | N66: =RC[-9]/4 -> 2478.84 | O66: ME | P66: =SQRT(RC[-10]^2-RC[-11]^2) -> 2156.6881810776454 | Q66: =RC[-1]/4 -> 539.17204526941134 | R66: ME | S66: =RC[-13]/4 -> 2536.8000000000002 | T66: 1 | U66: 0 | V66: 1 | W66: P00 | X66: 30112487205 | Z66: 1
A67: ATPLAST | B67: 110404 | C67: 17 | D67: 2 | E67: 9925.44 | F67: 10164 | G67: 66 | H67: 40431 | I67: 21662 | J67: 66 | K67: GEN | L67: 919048.5 | M67: EP | N67: =RC[-9]/4 -> 2481.36 | O67: ME | P67: =SQRT(RC[-10]^2-RC[-11]^2) -> 2189.1863343260634 | Q67: =RC[-1]/4 -> 547.29658358151585 | R67: ME | S67: =RC[-13]/4 -> 2541 | T67: 1 | U67: 0 | V67: 1 | W67: P00 | X67: 30112487205 | Z67: 1
A68: ATPLAST | B68: 110404 | C68: 17 | D68: 3 | E68: 9878.4 | F68: 10110.24 | G68: 67 | H68: 40432 | I68: 21662 | J68: 67 | K68: GEN | L68: 919048.75 | M68: EP | N68: =RC[-9]/4 -> 2469.6 | O68: ME | P68: =SQRT(RC[-10]^2-RC[-11]^2) -> 2152.7113827914791 | Q68: =RC[-1]/4 -> 538.17784569786977 | R68: ME | S68: =RC[-13]/4 -> 2527.56 | T68: 1 | U68: 0 | V68: 1 | W68: P00 | X68: 30112487205 | Z68: 1
A69: ATPLAST | B69: 110404 | C69: 17 | D69: 4 | E69: 8820 | F69: 9001.44 | G69: 68 | H69: 40433 | I69: 21662 | J69: 68 | K69: GEN | L69: 919049 | M69: EP | N69: =RC[-9]/4 -> 2205 | O69: ME | P69: =SQRT(RC[-10]^2-RC[-11]^2) -> 1798.1996756756489 | Q69: =RC[-1]/4 -> 449.54991891891223 | R69: ME | S69: =RC[-13]/4 -> 2250.36 | T69: 1 | U69: 0 | V69: 1 | W69: P00 | X69: 30112487205 | Z69: 1
A70: ATPLAST | B70: 110404 | C70: 18 | D70: 1 | E70: 8043.84 | F70: 8205.1200000000008 | G70: 69 | H70: 40434 | I70: 21662 | J70: 69 | K70: GEN | L70: 919049.25 | M70: EP | N70: =RC[-9]/4 -> 2010.96 | O70: ME | P70: =SQRT(RC[-10]^2-RC[-11]^2) -> 1618.8367023267065 | Q70: =RC[-1]/4 -> 404.70917558167662 | R70: ME | S70: =RC[-13]/4 -> 2051.2800000000002 | T70: 1 | U70: 0 | V70: 1 | W70: P00 | X70: 30112487205 | Z70: 1
A71: ATPLAST | B71: 110404 | C71: 18 | D71: 2 | E71: 7932.96 | F71: 8077.44 | G71: 70 | H71: 40435 | I71: 21662 | J71: 70 | K71: GEN | L71: 919049.5 | M71: EP | N71: =RC[-9]/4 -> 1983.24 | O71: ME | P71: =SQRT(RC[-10]^2-RC[-11]^2) -> 1520.9150508821961 | Q71: =RC[-1]/4 -> 380.22876272054901 | R71: ME | S71: =RC[-13]/4 -> 2019.36 | T71: 1 | U71: 0 | V71: 1 | W71: P00 | X71: 30112487205 | Z71: 1
A72: ATPLAST | B72: 110404 | C72: 18 | D72: 3 | E72: 8890.56 | F72: 9041.76 | G72: 71 | H72: 40436 | I72: 21662 | J72: 71 | K72: GEN | L72: 919049.75 | M72: EP | N72: =RC[-9]/4 -> 2222.64 | O72: ME | P72: =SQRT(RC[-10]^2-RC[-11]^2) -> 1646.6228420619047 | Q72: =RC[-1]/4 -> 411.65571051547619 | R72: ME | S72: =RC[-13]/4 -> 2260.44 | T72: 1 | U72: 0 | V72: 1 | W72: P00 | X72: 30112487205 | Z72: 1
A73: ATPLAST | B73: 110404 | C73: 18 | D73: 4 | E73: 10258.08 | F73: 10449.6 | G73: 72 | H73: 40437 | I73: 21662 | J73: 72 | K73: GEN | L73: 919050 | M73: EP | N73: =RC[-9]/4 -> 2564.52 | O73: ME | P73: =SQRT(RC[-10]^2-RC[-11]^2) -> 1991.4655090159122 | Q73: =RC[-1]/4 -> 497.86637725397804 | R73: ME | S73: =RC[-13]/4 -> 2612.4 | T73: 1 | U73: 0 | V73: 1 | W73: P00 | X73: 30112487205 | Z73: 1
A74: ATPLAST | B74: 110404 | C74: 19 | D74: 1 | E74: 10614.24 | F74: 10872.96 | G74: 73 | H74: 40414 | I74: 21662 | J74: 73 | K74: GEN | L74: 919050.25 | M74: EP | N74: =RC[-9]/4 -> 2653.56 | O74: ME | P74: =SQRT(RC[-10]^2-RC[-11]^2) -> 2357.7888760446699 | Q74: =RC[-1]/4 -> 589.44721901116748 | R74: ME | S74: =RC[-13]/4 -> 2718.24 | T74: 1 | U74: 0 | V74: 1 | W74: P00 | X74: 30112487205 | Z74: 1
A75: ATPLAST | B75: 110404 | C75: 19 | D75: 2 | E75: 10836 | F75: 11084.64 | G75: 74 | H75: 40415 | I75: 21662 | J75: 74 | K75: GEN | L75: 919050.5 | M75: EP | N75: =RC[-9]/4 -> 2709 | O75: ME | P75: =SQRT(RC[-10]^2-RC[-11]^2) -> 2334.5980231294607 | Q75: =RC[-1]/4 -> 583.64950578236517 | R75: ME | S75: =RC[-13]/4 -> 2771.16 | T75: 1 | U75: 0 | V75: 1 | W75: P00 | X75: 30112487205 | Z75: 1
A76: ATPLAST | B76: 110404 | C76: 19 | D76: 3 | E76: 10731.84 | F76: 10967.04 | G76: 75 | H76: 40416 | I76: 21662 | J76: 75 | K76: GEN | L76: 919050.75 | M76: EP | N76: =RC[-9]/4 -> 2682.96 | O76: ME | P76: =SQRT(RC[-10]^2-RC[-11]^2) -> 2259.109686580096 | Q76: =RC[-1]/4 -> 564.77742164502399 | R76: ME | S76: =RC[-13]/4 -> 2741.76 | T76: 1 | U76: 0 | V76: 1 | W76: P00 | X76: 30112487205 | Z76: 1
A77: ATPLAST | B77: 110404 | C77: 19 | D77: 4 | E77: 10809.12 | F77: 11094.72 | G77: 76 | H77: 40417 | I77: 21662 | J77: 76 | K77: GEN | L77: 919051 | M77: EP | N77: =RC[-9]/4 -> 2702.28 | O77: ME | P77: =SQRT(RC[-10]^2-RC[-11]^2) -> 2501.1470776425695 | Q77: =RC[-1]/4 -> 625.28676941064236 | R77: ME | S77: =RC[-13]/4 -> 2773.68 | T77: 1 | U77: 0 | V77: 1 | W77: P00 | X77: 30112487205 | Z77: 1
A78: ATPLAST | B78: 110404 | C78: 20 | D78: 1 | E78: 10782.24 | F78: 11020.8 | G78: 77 | H78: 40418 | I78: 21662 | J78: 77 | K78: GEN | L78: 919051.25 | M78: EP | N78: =RC[-9]/4 -> 2695.56 | O78: ME | P78: =SQRT(RC[-10]^2-RC[-11]^2) -> 2280.6431598125987 | Q78: =RC[-1]/4 -> 570.16078995314967 | R78: ME | S78: =RC[-13]/4 -> 2755.2 | T78: 1 | U78: 0 | V78: 1 | W78: P00 | X78: 30112487205 | Z78: 1
A79: ATPLAST | B79: 110404 | C79: 20 | D79: 2 | E79: 10799.04 | F79: 11074.56 | G79: 78 | H79: 40419 | I79: 21662 | J79: 78 | K79: GEN | L79: 919051.5 | M79: EP | N79: =RC[-9]/4 -> 2699.76 | O79: ME | P79: =SQRT(RC[-10]^2-RC[-11]^2) -> 2454.9163472509549 | Q79: =RC[-1]/4 -> 613.72908681273873 | R79: ME | S79: =RC[-13]/4 -> 2768.64 | T79: 1 | U79: 0 | V79: 1 | W79: P00 | X79: 30112487205 | Z79: 1
A80: ATPLAST | B80: 110404 | C80: 20 | D80: 3 | E80: 10812.48 | F80: 11098.08 | G80: 79 | H80: 40420 | I80: 21662 | J80: 79 | K80: GEN | L80: 919051.75 | M80: EP | N80: =RC[-9]/4 -> 2703.12 | O80: ME | P80: =SQRT(RC[-10]^2-RC[-11]^2) -> 2501.5307185801266 | Q80: =RC[-1]/4 -> 625.38267964503166 | R80: ME | S80: =RC[-13]/4 -> 2774.52 | T80: 1 | U80: 0 | V80: 1 | W80: P00 | X80: 30112487205 | Z80: 1
A81: ATPLAST | B81: 110404 | C81: 20 | D81: 4 | E81: 10829.28 | F81: 11108.16 | G81: 80 | H81: 40421 | I81: 21662 | J81: 80 | K81: GEN | L81: 919052 | M81: EP | N81: =RC[-9]/4 -> 2707.32 | O81: ME | P81: =SQRT(RC[-10]^2-RC[-11]^2) -> 2473.4415835430586 | Q81: =RC[-1]/4 -> 618.36039588576466 | R81: ME | S81: =RC[-13]/4 -> 2777.04 | T81: 1 | U81: 0 | V81: 1 | W81: P00 | X81: 30112487205 | Z81: 1
A82: ATPLAST | B82: 110404 | C82: 21 | D82: 1 | E82: 10862.88 | F82: 11138.4 | G82: 81 | H82: 40422 | I82: 21662 | J82: 81 | K82: GEN | L82: 919052.25 | M82: EP | N82: =RC[-9]/4 -> 2715.72 | O82: ME | P82: =SQRT(RC[-10]^2-RC[-11]^2) -> 2462.0708084049902 | Q82: =RC[-1]/4 -> 615.51770210124755 | R82: ME | S82: =RC[-13]/4 -> 2784.6 | T82: 1 | U82: 0 | V82: 1 | W82: P00 | X82: 30112487205 | Z82: 1
A83: ATPLAST | B83: 110404 | C83: 21 | D83: 2 | E83: 10859.52 | F83: 11141.76 | G83: 82 | H83: 40423 | I83: 21662 | J83: 82 | K83: GEN | L83: 919052.5 | M83: EP | N83: =RC[-9]/4 -> 2714.88 | O83: ME | P83: =SQRT(RC[-10]^2-RC[-11]^2) -> 2491.9151805789847 | Q83: =RC[-1]/4 -> 622.97879514474619 | R83: ME | S83: =RC[-13]/4 -> 2785.44 | T83: 1 | U83: 0 | V83: 1 | W83: P00 | X83: 30112487205 | Z83: 1
A84: ATPLAST | B84: 110404 | C84: 21 | D84: 3 | E84: 10899.84 | F84: 11185.44 | G84: 83 | H84: 40424 | I84: 21662 | J84: 83 | K84: GEN | L84: 919052.75 | M84: EP | N84: =RC[-9]/4 -> 2724.96 | O84: ME | P84: =SQRT(RC[-10]^2-RC[-11]^2) -> 2511.4848134121794 | Q84: =RC[-1]/4 -> 627.87120335304485 | R84: ME | S84: =RC[-13]/4 -> 2796.36 | T84: 1 | U84: 0 | V84: 1 | W84: P00 | X84: 30112487205 | Z84: 1
A85: ATPLAST | B85: 110404 | C85: 21 | D85: 4 | E85: 10852.8 | F85: 11138.4 | G85: 84 | H85: 40425 | I85: 21662 | J85: 84 | K85: GEN | L85: 919053 | M85: EP | N85: =RC[-9]/4 -> 2713.2 | O85: ME | P85: =SQRT(RC[-10]^2-RC[-11]^2) -> 2506.1298290391896 | Q85: =RC[-1]/4 -> 626.53245725979741 | R85: ME | S85: =RC[-13]/4 -> 2784.6 | T85: 1 | U85: 0 | V85: 1 | W85: P00 | X85: 30112487205 | Z85: 1
A86: ATPLAST | B86: 110404 | C86: 22 | D86: 1 | E86: 10862.88 | F86: 11145.12 | G86: 85 | H86: 40426 | I86: 21662 | J86: 85 | K86: GEN | L86: 919053.25 | M86: EP | N86: =RC[-9]/4 -> 2715.72 | O86: ME | P86: =SQRT(RC[-10]^2-RC[-11]^2) -> 2492.2957127917289 | Q86: =RC[-1]/4 -> 623.07392819793222 | R86: ME | S86: =RC[-13]/4 -> 2786.28 | T86: 1 | U86: 0 | V86: 1 | W86: P00 | X86: 30112487205 | Z86: 1
A87: ATPLAST | B87: 110404 | C87: 22 | D87: 2 | E87: 10785.6 | F87: 11057.76 | G87: 86 | H87: 40427 | I87: 21662 | J87: 86 | K87: GEN | L87: 919053.5 | M87: EP | N87: =RC[-9]/4 -> 2696.4 | O87: ME | P87: =SQRT(RC[-10]^2-RC[-11]^2) -> 2438.2142763916358 | Q87: =RC[-1]/4 -> 609.55356909790896 | R87: ME | S87: =RC[-13]/4 -> 2764.44 | T87: 1 | U87: 0 | V87: 1 | W87: P00 | X87: 30112487205 | Z87: 1
A88: ATPLAST | B88: 110404 | C88: 22 | D88: 3 | E88: 10755.36 | F88: 11004 | G88: 87 | H88: 40428 | I88: 21662 | J88: 87 | K88: GEN | L88: 919053.75 | M88: EP | N88: =RC[-9]/4 -> 2688.84 | O88: ME | P88: =SQRT(RC[-10]^2-RC[-11]^2) -> 2325.9938242394342 | Q88: =RC[-1]/4 -> 581.49845605985854 | R88: ME | S88: =RC[-13]/4 -> 2751 | T88: 1 | U88: 0 | V88: 1 | W88: P00 | X88: 30112487205 | Z88: 1
A89: ATPLAST | B89: 110404 | C89: 22 | D89: 4 | E89: 10795.68 | F89: 11034.24 | G89: 88 | H89: 40429 | I89: 21662 | J89: 88 | K89: GEN | L89: 919054 | M89: EP | N89: =RC[-9]/4 -> 2698.92 | O89: ME | P89: =SQRT(RC[-10]^2-RC[-11]^2) -> 2282.0485786240379 | Q89: =RC[-1]/4 -> 570.51214465600947 | R89: ME | S89: =RC[-13]/4 -> 2758.56 | T89: 1 | U89: 0 | V89: 1 | W89: P00 | X89: 30112487205 | Z89: 1
A90: ATPLAST | B90: 110404 | C90: 23 | D90: 1 | E90: 10775.52 | F90: 11020.8 | G90: 89 | H90: 40430 | I90: 21662 | J90: 89 | K90: GEN | L90: 919054.25 | M90: EP | N90: =RC[-9]/4 -> 2693.88 | O90: ME | P90: =SQRT(RC[-10]^2-RC[-11]^2) -> 2312.1854098666013 | Q90: =RC[-1]/4 -> 578.04635246665032 | R90: ME | S90: =RC[-13]/4 -> 2755.2 | T90: 1 | U90: 0 | V90: 1 | W90: P00 | X90: 30112487205 | Z90: 1
A91: ATPLAST | B91: 110404 | C91: 23 | D91: 2 | E91: 10765.44 | F91: 11014.08 | G91: 90 | H91: 40431 | I91: 21662 | J91: 90 | K91: GEN | L91: 919054.5 | M91: EP | N91: =RC[-9]/4 -> 2691.36 | O91: ME | P91: =SQRT(RC[-10]^2-RC[-11]^2) -> 2327.0710889012353 | Q91: =RC[-1]/4 -> 581.76777222530882 | R91: ME | S91: =RC[-13]/4 -> 2753.52 | T91: 1 | U91: 0 | V91: 1 | W91: P00 | X91: 30112487205 | Z91: 1
A92: ATPLAST | B92: 110404 | C92: 23 | D92: 3 | E92: 10718.4 | F92: 10960.32 | G92: 91 | H92: 40432 | I92: 21662 | J92: 91 | K92: GEN | L92: 919054.75 | M92: EP | N92: =RC[-9]/4 -> 2679.6 | O92: ME | P92: =SQRT(RC[-10]^2-RC[-11]^2) -> 2290.0908153171586 | Q92: =RC[-1]/4 -> 572.52270382928964 | R92: ME | S92: =RC[-13]/4 -> 2740.08 | T92: 1 | U92: 0 | V92: 1 | W92: P00 | X92: 30112487205 | Z92: 1
A93: ATPLAST | B93: 110404 | C93: 23 | D93: 4 | E93: 10792.32 | F93: 11040.96 | G93: 92 | H93: 40433 | I93: 21662 | J93: 92 | K93: GEN | L93: 919055 | M93: EP | N93: =RC[-9]/4 -> 2698.08 | O93: ME | P93: =SQRT(RC[-10]^2-RC[-11]^2) -> 2329.941359605426 | Q93: =RC[-1]/4 -> 582.4853399013565 | R93: ME | S93: =RC[-13]/4 -> 2760.24 | T93: 1 | U93: 0 | V93: 1 | W93: P00 | X93: 30112487205 | Z93: 1
A94: ATPLAST | B94: 110404 | C94: 24 | D94: 1 | E94: 10846.08 | F94: 11104.8 | G94: 93 | H94: 40434 | I94: 21662 | J94: 93 | K94: GEN | L94: 919055.25 | M94: EP | N94: =RC[-9]/4 -> 2711.52 | O94: ME | P94: =SQRT(RC[-10]^2-RC[-11]^2) -> 2383.0928797677975 | Q94: =RC[-1]/4 -> 595.77321994194938 | R94: ME | S94: =RC[-13]/4 -> 2776.2 | T94: 1 | U94: 0 | V94: 1 | W94: P00 | X94: 30112487205 | Z94: 1
A95: ATPLAST | B95: 110404 | C95: 24 | D95: 2 | E95: 10977.12 | F95: 11242.56 | G95: 94 | H95: 40435 | I95: 21662 | J95: 94 | K95: GEN | L95: 919055.5 | M95: EP | N95: =RC[-9]/4 -> 2744.28 | O95: ME | P95: =SQRT(RC[-10]^2-RC[-11]^2) -> 2428.5781558763906 | Q95: =RC[-1]/4 -> 607.14453896909765 | R95: ME | S95: =RC[-13]/4 -> 2810.64 | T95: 1 | U95: 0 | V95: 1 | W95: P00 | X95: 30112487205 | Z95: 1
A96: ATPLAST | B96: 110404 | C96: 24 | D96: 3 | E96: 10940.16 | F96: 11208.96 | G96: 95 | H96: 40436 | I96: 21662 | J96: 95 | K96: GEN | L96: 919055.75 | M96: EP | N96: =RC[-9]/4 -> 2735.04 | O96: ME | P96: =SQRT(RC[-10]^2-RC[-11]^2) -> 2440.0171015794099 | Q96: =RC[-1]/4 -> 610.00427539485247 | R96: ME | S96: =RC[-13]/4 -> 2802.24 | T96: 1 | U96: 0 | V96: 1 | W96: P00 | X96: 30112487205 | Z96: 1