Sheet: 0
A1: 1 | B1: =R1C[-1]*2 -> 2 | DY1: =RC[1]*2 -> 2 | DZ1: 1
A2: 2 | B2: =R1C[-1]*2 -> 2 | DY2: =RC[1]*2 -> 4 | DZ2: 2
A3: 3 | B3: =R1C[-1]*2 -> 2 | DY3: =RC[1]*2 -> 6 | DZ3: 3
A4: 4 | B4: =R1C[-1]*2 -> 2 | DY4: =RC[1]*2 -> 8 | DZ4: 4
A5: 5 | B5: =R1C[-1]*2 -> 2 | DY5: =RC[1]*2 -> 10 | DZ5: 5
A6: 6 | B6: =R1C[-1]*2 -> 2 | DY6: =RC[1]*2 -> 12 | DZ6: 6
A7: 7 | B7: =R1C[-1]*2 -> 2 | DY7: =RC[1]*2 -> 14 | DZ7: 7
A8: 8 | B8: =R1C[-1]*2 -> 2 | DY8: =RC[1]*2 -> 16 | DZ8: 8
A11: 1 | B11: 2 | C11: 3 | D11: 4 | E11: 5 | F11: 6 | G11: 7 | H11: 8
A12: =R[-1]C1*2 -> 2 | B12: =R[-1]C1*2 -> 2 | C12: =R[-1]C1*2 -> 2 | D12: =R[-1]C1*2 -> 2 | E12: =R[-1]C1*2 -> 2 | F12: =R[-1]C1*2 -> 2 | G12: =R[-1]C1*2 -> 2 | H12: =R[-1]C1*2 -> 2
A32769: =R[1]C*2 -> 2 | B32769: =R[1]C*2 -> 4 | C32769: =R[1]C*2 -> 6 | D32769: =R[1]C*2 -> 8 | E32769: =R[1]C*2 -> 10 | F32769: =R[1]C*2 -> 12 | G32769: =R[1]C*2 -> 14 | H32769: =R[1]C*2 -> 16
A32770: 1 | B32770: 2 | C32770: 3 | D32770: 4 | E32770: 5 | F32770: 6 | G32770: 7 | H32770: 8