Sheet: 1
K10: 5
K11: 5
K12: 5
K13: 5
K14: 5
K15: 5
K16: 5
K18: 5
K19: 5
K20: 5
K21: 5
K23: 55
K29: 6
K30: 6
K31: 6
K32: 6
K33: 6
K34: 6
K36: 6
EF37: =SUM(R[-8]C[-131]:R[-1]C[-131]) -> 0
K40: 6
K41: 6
K42: 6
K43: 6
K44: 6
K45: 6
K46: 6
K47: 6
K48: 6
K49: 6
K51: 66
F57: (F)3 | G57: (G)3 | H57: (H)3
F58: 2009-10
F59: 1 | G59: 2 | H59: 3
F60: 2000 | G60: 4000 | H60: =SUM(RC[-2]:RC[-1]) -> 6000 | K60: 7
F61: 3000 | G61: 5000 | H61: =SUM(RC[-2]:RC[-1]) -> 8000 | K61: 7
F62: 4000 | G62: 6000 | H62: =SUM(RC[-2]:RC[-1]) -> 10000 | K62: 7
F63: 5000 | G63: 7000 | H63: =SUM(RC[-2]:RC[-1]) -> 12000 | K63: 7
F64: 6000 | G64: 8000 | H64: =SUM(RC[-2]:RC[-1]) -> 14000 | K64: 7
F65: 7000 | G65: 9000 | H65: =SUM(RC[-2]:RC[-1]) -> 16000 | K65: 7
F66: 8000 | G66: 10000 | H66: =SUM(RC[-2]:RC[-1]) -> 18000 | K66: 7
F67: 9000 | G67: 11000 | H67: =SUM(RC[-2]:RC[-1]) -> 20000 | K67: 7
F68: 10000 | G68: 12000 | H68: =SUM(RC[-2]:RC[-1]) -> 22000 | K68: 7
F69: 11000 | G69: 13000 | H69: =SUM(RC[-2]:RC[-1]) -> 24000 | K69: 7
F70: 12000 | G70: 14000 | H70: =SUM(RC[-2]:RC[-1]) -> 26000 | K70: 7
F71: 13000 | G71: 15000 | H71: =SUM(RC[-2]:RC[-1]) -> 28000 | K71: 7
H72: =SUM(RC[-2]:RC[-1]) -> 0 | K72: 7
H73: =SUM(RC[-2]:RC[-1]) -> 0 | K73: 7
H74: =SUM(RC[-2]:RC[-1]) -> 0 | K74: 7
D75: Check = 0 | E75: =SUM(R[-15]C:R[-11]C)-SUM(R[-10]C:R[-5]C)+SUM(R[-4]C:R[-1]C) -> 0 | F75: =SUM(R[-15]C:R[-11]C)-SUM(R[-10]C:R[-5]C)+SUM(R[-4]C:R[-1]C) -> -24000 | G75: =SUM(R[-15]C:R[-11]C)-SUM(R[-10]C:R[-5]C)+SUM(R[-4]C:R[-1]C) -> -24000 | H75: =SUM(R[-15]C:R[-11]C)-SUM(R[-10]C:R[-5]C)+SUM(R[-4]C:R[-1]C) -> -48000 | K75: 7
AD102: Please Select………
AD103: YES
AD104: NO