Sheet: Sheet1
A1: =SUM(1,2) -> 3 | B1: 1
B2: 2
B3: =R[-2]C+R[-1]C -> 3
B4: =R[-2]C+R[-1]C -> 5
B5: =R[-2]C+R[-1]C -> 8
B6: =R[-2]C+R[-1]C -> 13
B7: =R[-2]C+R[-1]C -> 21
B8: =R[-2]C+R[-1]C -> 34
B9: =R[-2]C+R[-1]C -> 55
B10: =R[-2]C+R[-1]C -> 89