Sheet: Sheet1
A1: 0 | B1: 1 | C1: =1+RC[-1] -> 2 | D1: =1+RC[-1] -> 3 | E1: =1+RC[-1] -> 4 | F1: =1+RC[-1] -> 5 | G1: =1+RC[-1] -> 6 | H1: =1+RC[-1] -> 7 | I1: =1+RC[-1] -> 8 | J1: =1+RC[-1] -> 9 | K1: =1+RC[-1] -> 10 | L1: =1+RC[-1] -> 11 | M1: =1+RC[-1] -> 12 | N1: =1+RC[-1] -> 13 | O1: =1+RC[-1] -> 14 | P1: =1+RC[-1] -> 15 | Q1: =1+RC[-1] -> 16 | R1: =1+RC[-1] -> 17 | S1: =1+RC[-1] -> 18 | T1: =1+RC[-1] -> 19 | U1: =1+RC[-1] -> 20 | V1: =1+RC[-1] -> 21 | W1: =1+RC[-1] -> 22 | X1: =1+RC[-1] -> 23 | Y1: =1+RC[-1] -> 24 | Z1: =1+RC[-1] -> 25 | AA1: =1+RC[-1] -> 26 | AB1: =1+RC[-1] -> 27 | AC1: =1+RC[-1] -> 28 | AD1: =1+RC[-1] -> 29 | AE1: =1+RC[-1] -> 30
A2: 1 | B2: PINNACLE CODE | F2: CD | G2: CF | H2: CE | I2: DB | J2: DA | O2: CB | S2: CH | V2: RG
A3: =R[-1]C+1 -> 2 | C3: JAPAN | D3: M | E3: SHAPE | F3: BONNET | G3: FENDER | I3: DOOR | M3: SLIDE DOOR | O3: BUMPER | Q3: GRILL/ | R3: TRUNK/ | S3: LH | T3: RH | V3: TAIL | Y3: RADIATOR | AA3: A/C | AB3: RADIATOR | AC3: A/C | AD3: UPPER | AE3: LOWER
A4: =R[-1]C+1 -> 3 | C4: MODEL | G4: R | H4: L | I4: F/R | J4: F/L | K4: R/R | L4: R/L | M4: R | N4: L | O4: F | P4: R | Q4: MASK | R4: R/GATE | S4: HEAD | T4: HEAD | U4: TAIL | V4: LH | W4: TH | X4: CLEAR | Y4: AUTO | Z4: MAUAUL | AA4: CONDENSOR | AB4: FAN | AC4: FAN | AD4: PANEL | AE4: PANEL
A5: =R[-1]C+1 -> 4 | B5: COROLLA | C5: AE81 EARLY | D5: 0 | E5: 4D
A6: =R[-1]C+1 -> 5 | B6: " SECA | C6: AE81 EARLY | D6: 0 | E6: 5D
A7: =R[-1]C+1 -> 6 | B7: " | C7: AE81 LATE | D7: 1 | E7: 4D
A8: =R[-1]C+1 -> 7 | B8: CS-X H/B | C8: AE82** | D8: 0 | E8: 4D
A9: =R[-1]C+1 -> 8 | B9: SPRINTER | C9: AE86 | D9: 1 | E9: 3D
A10: =R[-1]C+1 -> 9 | B10: COROLLA | C10: AE91 | D10: 0/1 | E10: 4D
A11: =R[-1]C+1 -> 10 | B11: SECA L/B | C11: AE91* | D11: 0 | E11: 5D
A12: =R[-1]C+1 -> 11 | B12: NOVA | C12: AE91** FX | D12: 0/1 | E12: 3D
A13: =R[-1]C+1 -> 12 | B13: WAGON | C13: AE95** | D13: 0 | E13: 4V
A14: =R[-1]C+1 -> 13 | B14: COROLLA | C14: AE100 | D14: 0 | E14: 4D
A15: =R[-1]C+1 -> 14 | B15: " | C15: AE100 | D15: 1 | E15: 4D
A16: =R[-1]C+1 -> 15 | B16: COROLLA FX | C16: AE101 | D16: 0/1 | E16: 3DR
A17: =R[-1]C+1 -> 16 | B17: SPRINTER | C17: AE100* | D17: 0 | E17: 4D
A18: =R[-1]C+1 -> 17 | B18: MR2 | C18: AW11 | D18: 0/1 | E18: 2C
A19: =R[-1]C+1 -> 18 | B19: MR2 | C19: SW20 | D19: 0/1 | E19: 2C
A20: =R[-1]C+1 -> 19 | B20: PASEO | C20: EL44 | D20: 0 | E20: 2C
A21: =R[-1]C+1 -> 20 | B21: PASEO | C21: EL53 | E21: 2C
A22: =R[-1]C+1 -> 21 | B22: TARAGO | C22: YR21* | D22: 1 | E22: HV
A23: =R[-1]C+1 -> 22 | B23: TOWN ACE | C23: CR27 | D23: 3 | E23: HV
A24: =R[-1]C+1 -> 23 | B24: " SBV | C24: KR42 | D24: 0 | E24: HL
A25: =R[-1]C+1 -> 24 | B25: SPACIA | C25: SR40 | D25: 0 | E25: HL
A26: =R[-1]C+1 -> 25 | B26: STARLET | C26: EP91 | D26: 0 | E26: 3D
A27: =R[-1]C+1 -> 26 | B27: STARLET | C27: EP91 | D27: 0 | E27: 5D
A28: =R[-1]C+1 -> 27 | B28: SUPRA | C28: MA70 | D28: 0/1 | E28: 3D
A29: =R[-1]C+1 -> 28 | B29: TARAGO | C29: TCR11 | D29: 0 | E29: HL
A30: =R[-1]C+1 -> 29 | B30: ESTIMA IMPORT
A31: =R[-1]C+1 -> 30
A32: =R[-1]C+1 -> 31 | C32: JAPAN | D32: M | E32: SHAPE | F32: BONNET | G32: FENDER | I32: DOOR | M32: SLIDE DOOR | O32: BUMPER | Q32: GRILL/ | R32: TRUNK/ | S32: LAMP | T32: LAMP | Y32: RADIATOR | AA32: A/C | AB32: RADIATOR | AC32: A/C | AD32: UPPER | AE32: LOWER
A33: =R[-1]C+1 -> 32 | C33: MODEL | G33: R | H33: L | I33: F/R | J33: F/L | K33: R/R | L33: R/L | M33: R | N33: L | O33: F | P33: R | Q33: MASK | R33: R/GATE | S33: HEAD | T33: HEAD | U33: TAIL | W33: TAIL | X33: CLEAR | Y33: AUTO | Z33: MAUAUL | AA33: CONDENSOR | AB33: FAN | AC33: FAN | AD33: PANEL | AE33: PANEL
A34: =R[-1]C+1 -> 33 | B34: CELICA | C34: ST160** | D34: 0/1 | E34: 3D
A35: =R[-1]C+1 -> 34 | B35: " | C35: ST182** | D35: 0/1 | E35: 3D
A36: =R[-1]C+1 -> 35 | B36: " | C36: ST202** | D36: 0 | E36: 3D
A37: =R[-1]C+1 -> 36 | B37: CRESSIDA | C37: GX71 | D37: 0 | E37: 4D
A38: =R[-1]C+1 -> 37 | B38: MX73 | C38: GX71** | D38: 1 | E38: 4D
A39: =R[-1]C+1 -> 38 | B39: MX83 | C39: GX81 EARLY | D39: 0 | E39: 4D
A40: =R[-1]C+1 -> 39 | B40: MX83 | C40: GX81 LATE | D40: 1 | E40: 4D
A41: =R[-1]C+1 -> 40 | B41: SV21 CAMRY EARLY | C41: SV20 - SV21 | D41: 0 | E41: 4D
A42: =R[-1]C+1 -> 41 | B42: SV21 CAMRY LATE | C42: SV21 - SV22 | D42: 1 | E42: 4D
A43: =R[-1]C+1 -> 42 | B43: CAMRY SCEPTER | C43: VCV / SXV | D43: 0/1 | E43: 4D
A44: =R[-1]C+1 -> 43 | B44: CAMRY SCEPTER | C44: VCV / SXV | D44: 0/1 | E44: 4V
A45: =R[-1]C+1 -> 44 | B45: SXVC20 GRACIA | C45: SXV20 | E45: 4D
A46: =R[-1]C+1 -> 45 | B46: SXVC20 GRACIA | C46: SXV20 | E46: 4V
A47: =R[-1]C+1 -> 46 | B47: LEXUS ES300 | C47: VCV10* | D47: 0/1 | E47: 4H
A48: =R[-1]C+1 -> 47 | B48: LS400 90-94 MODEL | C48: UCF10 | D48: 0 | E48: 4D
A49: =R[-1]C+1 -> 48 | B49: LS400 94- | C49: UCF10 | D49: 1 | E49: 4D
A50: =R[-1]C+1 -> 49 | B50: 4 RUNNER | C50: LN130 | D50: 0 | E50: 2V/4V
A51: =R[-1]C+1 -> 50 | B51: HIACE | C51: LH61V | D51: 1 | E51: HV
A52: =R[-1]C+1 -> 51 | B52: HIACE | C52: LH113 | D52: 0 | E52: HV
A53: =R[-1]C+1 -> 52 | B53: RAV4 | C53: SXA10 | D53: 0 | E53: 4V
A54: =R[-1]C+1 -> 53 | B54: RAV4 | C54: SXA10 | D54: 1 | E54: 2V
A55: =R[-1]C+1 -> 54 | B55: RAV4 | C55: ACA | E55: 2V/4V
A56: =R[-1]C+1 -> 55 | B56: SOARER | C56: UZC30/31 | E56: 2C
A57: =R[-1]C+1 -> 56 | C57: JAPAN | D57: M | E57: SHAPE | F57: BONNET | G57: FENDER | I57: DOOR | M57: SLIDE DOOR | O57: BUMPER | Q57: GRILL/ | R57: TRUNK/ | S57: LAMP | T57: LAMP | Y57: RADIATOR | AA57: A/C | AB57: RADIATOR | AC57: A/C | AD57: UPPER | AE57: LOWER
A58: =R[-1]C+1 -> 57 | C58: MODEL | G58: R | H58: L | I58: F/R | J58: F/L | K58: R/R | L58: R/L | M58: R | N58: L | O58: F | P58: R | Q58: MASK | R58: R/GATE | S58: HEAD | T58: HEAD | U58: TAIL | W58: TAIL | X58: CLEAR | Y58: AUTO | Z58: MAUAUL | AA58: CONDENSOR | AB58: FAN | AC58: FAN | AD58: PANEL | AE58: PANEL
A59: =R[-1]C+1 -> 58 | B59: COROLLA-ZZE122 | E59: 5D
A60: =R[-1]C+1 -> 59 | C60: ZZE122 | E60: 4D
A61: =R[-1]C+1 -> 60 | E61: 4V
A62: =R[-1]C+1 -> 61 | B62: ECHO | C62: SCP10 | E62: 3D
A63: =R[-1]C+1 -> 62 | B63: ECHO | C63: SCP10 | E63: 5D
A64: =R[-1]C+1 -> 63 | B64: SPRINTER | C64: AE101** | E64: 5D
A65: =R[-1]C+1 -> 64 | B65: MR230S | C65: ZZW30
A66: =R[-1]C+1 -> 65 | B66: PASEO | C66: EL54 | E66: 2D
A67: =R[-1]C+1 -> 66 | B67: TARAGO | C67: AC22R | E67: 4V
A68: =R[-1]C+1 -> 67 | B68: TARAGO | C68: ACR10R | E68: 4V
A69: =R[-1]C+1 -> 68 | B69: SPACIA | C69: SR40 | E69: 4V
A70: =R[-1]C+1 -> 69 | B70: CELICA | C70: ZZT231 | E70: 3D
A71: =R[-1]C+1 -> 70 | B71: AVALON | E71: 4D
A72: =R[-1]C+1 -> 71 | B72: AVENSIS VERSO | C72: ACM20R | E72: 4V
A73: =R[-1]C+1 -> 72 | B73: CAMRY | C73: MCV21* | E73: 4D
A74: =R[-1]C+1 -> 73 | B74: CAMRY | C74: MCV21* | E74: 4V
A75: =R[-1]C+1 -> 74 | B75: CAMRY | C75: SXV20 | E75: 4D
A76: =R[-1]C+1 -> 75 | B76: CAMRY | C76: SXV20 | D76: 1 | E76: 4V
A77: =R[-1]C+1 -> 76 | B77: CAMRY | C77: ACV30 | D77: 1 | E77: 4D
A78: =R[-1]C+1 -> 77 | B78: HILUX | C78: LY80 | E78: 2D
A79: =R[-1]C+1 -> 78 | B79: HILUX | C79: LN106 | E79: 4D
A80: =R[-1]C+1 -> 79 | B80: HILUX | C80: LN112 | E80: 4D
A81: =R[-1]C+1 -> 80 | B81: HILUX | C81: RZN147 | E81: 4D
A82: =R[-1]C+1 -> 81 | B82: HILUX 4X2 | C82: RZN152 | E82: 2D
A83: =R[-1]C+1 -> 82 | B83: HILUX 4X4 | C83: RZN169 | E83: 4D
A84: =R[-1]C+1 -> 83 | B84: LANDCRUISER | C84: FJ80
A85: =R[-1]C+1 -> 84 | B85: LANDCRUISER | C85: HDJ81V
A86: =R[-1]C+1 -> 85 | B86: LANDCRUISER | C86: UZJ100W
A87: =R[-1]C+1 -> 86 | B87: LANDCRUISER | C87: VZJ90 | D87: 0
A88: =R[-1]C+1 -> 87 | B88: LANDCRUISER | C88: VZJ90 | D88: 1
A89: =R[-1]C+1 -> 88 | B89: LANDCRUISER | C89: VZJ121W
A90: =R[-1]C+1 -> 89 | B90: PRIUS | C90: NHW11
A91: =R[-1]C+1 -> 90 | B91: RAV4 | C91: SXA10
A92: =R[-1]C+1 -> 91
A93: =R[-1]C+1 -> 92
A94: =R[-1]C+1 -> 93
A95: =R[-1]C+1 -> 94 | C95: JAPAN | D95: M | E95: SHAPE | F95: BONNET | G95: FENDER | I95: DOOR | M95: SLIDE DOOR | O95: BUMPER | Q95: GRILL/ | R95: TRUNK/ | S95: LAMP | T95: LAMP | Y95: RADIATOR | AA95: A/C | AB95: RADIATOR | AC95: A/C | AD95: UPPER | AE95: LOWER
A96: =R[-1]C+1 -> 95 | C96: MODEL | G96: R | H96: L | I96: F/R | J96: F/L | K96: R/R | L96: R/L | M96: R | N96: L | O96: F | P96: R | Q96: MASK | R96: R/GATE | S96: HEAD | T96: HEAD | U96: TAIL | W96: TAIL | X96: CLEAR | Y96: AUTO | Z96: MAUAUL | AA96: CONDENSOR | AB96: FAN | AC96: FAN | AD96: PANEL | AE96: PANEL
A97: =R[-1]C+1 -> 96 | B97: NX COUPE | C97: EB13* | D97: 0 | E97: 3D
A98: =R[-1]C+1 -> 97 | B98: " | C98: HN12* | D98: 0 | E98: 5D
A99: =R[-1]C+1 -> 98 | B99: " EXA | C99: HN12*** | D99: 1 | E99: 2C
A100: =R[-1]C+1 -> 99 | B100: ASTRA LC | C100: PN12 | D100: 1 | E100: 5D
A101: =R[-1]C+1 -> 100 | B101: PULSAR N13 | C101: BEN13 | D101: 0 | E101: 4D
A102: =R[-1]C+1 -> 101 | B102: ASTRA LD | C102: HN13 | D102: 0 | E102: 5D
A103: =R[-1]C+1 -> 102 | B103: EXA COUPE | C103: KEN13 | D103: 0 | E103: 3D
A104: =R[-1]C+1 -> 103 | B104: PULSAR N14 | C104: HN14 | D104: 0/1 | E104: 4D
A105: =R[-1]C+1 -> 104 | B105: " | C105: HN14 | D105: 0/1 | E105: 5D
A106: =R[-1]C+1 -> 105 | B106: " N15 | C106: HN15 | D106: 0 | E106: 4D
A107: =R[-1]C+1 -> 106 | B107: " | C107: HN15 | D107: 0 | E107: 5D
A108: =R[-1]C+1 -> 107 | B108: " N15 LATE | C108: HN15 | D108: 1 | E108: 4D
A109: =R[-1]C+1 -> 108 | B109: " | C109: HN15 | D109: 1 | E109: 5D
A110: =R[-1]C+1 -> 109 | B110: BLUEBIRD SYLPHY | C110: QG10 | D110: 0 | E110: 4D
A111: =R[-1]C+1 -> 110 | B111: MICRA | C111: K11 | D111: 0 | E111: 3D/5D
A112: =R[-1]C+1 -> 111 | B112: NOMAD | C112: KHGC22 | D112: 0 | E112: HV
A113: =R[-1]C+1 -> 112 | B113: VANETTE | C113: VPJC22 | D113: 0 | E113: HV
A114: =R[-1]C+1 -> 113 | B114: SERENA C23 | C114: KBC23 | D114: 0 | E114: HL
A115: =R[-1]C+1 -> 114 | B115: PINTARA | C115: RU12 | D115: 0/1 | E115: 4D
A116: =R[-1]C+1 -> 115 | B116: BLUEBIRD | C116: EU13 | D116: 0/1 | E116: 4D
A117: =R[-1]C+1 -> 116 | B117: MAXIMA | C117: J30 | D117: 0 | E117: 4D
A118: =R[-1]C+1 -> 117 | B118: CEFIRO | C118: HA32 | D118: 0 | E118: 4D
A119: =R[-1]C+1 -> 118 | B119: CEFIRO/MAXIMA | C119: A33 | E119: 4D
A120: =R[-1]C+1 -> 119 | B120: SKYLINE R31 | C120: HR31 | D120: 0 | E120: 4D
A121: =R[-1]C+1 -> 120 | B121: " | C121: HR31 | D121: 1 | E121: 4D
A122: =R[-1]C+1 -> 121 | B122: " | C122: WFJR31 | D122: 1 | E122: 4V
A123: =R[-1]C+1 -> 122 | B123: SKYLINE R32 | C123: BNR32 | D123: 0 | E123: 2H
A124: =R[-1]C+1 -> 123 | B124: SKYLINE R33 | C124: HR33 | E124: 2H
A125: =R[-1]C+1 -> 124 | B125: SKYLINE R33 | C125: HR33 | D125: 1 | E125: 2H
A126: =R[-1]C+1 -> 125
A127: =R[-1]C+1 -> 126 | C127: JAPAN | D127: M | E127: SHAPE | F127: BONNET | G127: FENDER | I127: DOOR | M127: SLIDE DOOR | O127: BUMPER | Q127: GRILL/ | R127: TRUNK/ | S127: LAMP | T127: LAMP | Y127: RADIATOR | AA127: A/C | AB127: RADIATOR | AC127: A/C | AD127: UPPER | AE127: LOWER
A128: =R[-1]C+1 -> 127 | C128: MODEL | G128: R | H128: L | I128: F/R | J128: F/L | K128: R/R | L128: R/L | M128: R | N128: L | O128: F | P128: R | Q128: MASK | R128: R/GATE | S128: HEAD | T128: HEAD | U128: TAIL | W128: TAIL | X128: CLEAR | Y128: AUTO | Z128: MAUAUL | AA128: CONDENSOR | AB128: FAN | AC128: FAN | AD128: PANEL | AE128: PANEL
A129: =R[-1]C+1 -> 128 | B129: 200SX | C129: S15 | E129: 2C
A130: =R[-1]C+1 -> 129 | B130: 350Z | C130: Z33
A131: =R[-1]C+1 -> 130 | B131: MAXIMA | C131: A33
A132: =R[-1]C+1 -> 131 | B132: NAVARA | C132: LFMD22
A133: =R[-1]C+1 -> 132 | B133: NAVARA | C133: LFMD22
A134: =R[-1]C+1 -> 133 | B134: NAVARA
A135: =R[-1]C+1 -> 134 | B135: PATHFINDER | C135: WHYD21
A136: =R[-1]C+1 -> 135 | B136: PATHFINDER | C136: RR50 | D136: 0
A137: =R[-1]C+1 -> 136 | B137: PATHFINDER | C137: TR50 | D137: 1
A138: =R[-1]C+1 -> 137 | B138: PATROL | C138: VRY60 | D138: 0 | E138: 4V
A139: =R[-1]C+1 -> 138 | B139: PATROL | C139: WGY60 | D139: 1 | E139: 4V
A140: =R[-1]C+1 -> 139 | B140: PATROL | C140: VRGY61 | D140: 0
A141: =R[-1]C+1 -> 140 | B141: PATROL | C141: VRGY61 | D141: 1
A142: =R[-1]C+1 -> 141 | B142: PULSAR
A143: =R[-1]C+1 -> 142 | B143: PULSAR | C143: QG10
A144: =R[-1]C+1 -> 143 | B144: X TRAIL | C144: NT30
A145: =R[-1]C+1 -> 144 | B145: 300ZX Z31 | C145: HGZ31 | D145: 0/1 | E145: 3D
A146: =R[-1]C+1 -> 145 | B146: 300XZ Z32 | C146: GCZ32 | D146: 0 | E146: 3D
A147: =R[-1]C+1 -> 146 | B147: SILVIA | C147: S13 | E147: 2C
A148: =R[-1]C+1 -> 147 | B148: 180SX | C148: S13 | E148: 3DR
A149: =R[-1]C+1 -> 148 | B149: 200SX EARLY | C149: CS14 | D149: 0 | E149: 2H
A150: =R[-1]C+1 -> 149 | B150: 200SX LATE | C150: CS14 | D150: 1 | E150: 2H
A151: =R[-1]C+1 -> 150 | B151: 200SX | C151: S15 | D151: 0 | E151: 2H
A152: =R[-1]C+1 -> 151 | B152: NAVARA D21 | C152: PGD21 | D152: 0/1 | E152: 2D/4D
A153: =R[-1]C+1 -> 152 | B153: PATHFINDER | C153: WHYD21 | D153: 0/1 | E153: 2V/4V
A154: =R[-1]C+1 -> 153 | B154: URVAN | C154: VYE24 | D154: 0 | E154: HV
A155: =R[-1]C+1 -> 154 | B155: INFINITI | C155: HG50 | D155: 1 | E155: 4D
A156: =R[-1]C+1 -> 155
A157: =R[-1]C+1 -> 156 | C157: JAPAN | D157: M | E157: SHAPE | F157: BONNET | G157: FENDER | I157: DOOR | M157: SLIDE DOOR | O157: BUMPER | Q157: GRILL/ | R157: TRUNK/ | S157: LAMP | T157: LAMP | Y157: RADIATOR | AA157: A/C | AB157: RADIATOR | AC157: A/C | AD157: UPPER | AE157: LOWER
A158: =R[-1]C+1 -> 157 | C158: MODEL | G158: R | H158: L | I158: F/R | J158: F/L | K158: R/R | L158: R/L | M158: R | N158: L | O158: F | P158: R | Q158: MASK | R158: R/GATE | S158: HEAD | T158: HEAD | U158: TAIL | W158: TAIL | X158: CLEAR | Y158: AUTO | Z158: MAUAUL | AA158: CONDENSOR | AB158: FAN | AC158: FAN | AD158: PANEL | AE158: PANEL
A159: =R[-1]C+1 -> 158 | B159: 121 DB1031 | C159: DB3PA | D159: 0 | E159: 4D
A160: =R[-1]C+1 -> 159 | B160: METRO 96-00 /DEMIO | C160: DW5W | D160: 0 | E160: 5D
A161: =R[-1]C+1 -> 160 | B161: METRO 00-/DEMIO | C161: DW1032
A162: =R[-1]C+1 -> 161 | B162: 323 BF1052 | C162: BF7P | D162: 0 | E162: 4D/5D
A163: =R[-1]C+1 -> 162 | B163: SERIES 2 | C163: BF7P | D163: 1 | E163: 3D
A164: =R[-1]C+1 -> 163 | C164: BF7P | D164: 1 | E164: 4D/5D
A165: =R[-1]C+1 -> 164 | B165: WAGON | C165: BF7V | D165: 1 | E165: 4V
A166: =R[-1]C+1 -> 165 | B166: BG1061 | C166: BG5P | D166: 0/1 | E166: 4D
A167: =R[-1]C+1 -> 166 | B167: ASTINA BG | C167: BG5P* | D167: 0/1 | E167: 5D
A168: =R[-1]C+1 -> 167 | B168: ASTINA BA 4DR HT | C168: CBAEP | D168: 0 | E168: 4H
A169: =R[-1]C+1 -> 168 | B169: ASTINA BA 5DR | C169: CBAEP | D169: 0 | E169: 5D
A170: =R[-1]C+1 -> 169 | B170: 323 BH | C170: BHALP | D170: 0 | E170: 4D
A171: =R[-1]C+1 -> 170 | B171: 323 BH | C171: BHALP | D171: 1 | E171: 4D
A172: =R[-1]C+1 -> 171 | B172: 323 BJ | C172: BJ5P | D172: 0 | E172: 4D
A173: =R[-1]C+1 -> 172 | B173: 323 BJ | C173: BJ5P | D173: 0 | E173: 5D
A174: =R[-1]C+1 -> 173 | B174: GD1021 | C174: GD8P | D174: 0 | E174: 4D
A175: =R[-1]C+1 -> 174 | C175: GD8P | D175: 0 | E175: 5D
A176: =R[-1]C+1 -> 175 | B176: MX6 GD1021 | C176: GD8S | D176: 0/1 | E176: 2H
A177: =R[-1]C+1 -> 176 | B177: 626 GE10S1 | C177: GEEP | D177: 0 | E177: 4D
A178: =R[-1]C+1 -> 177 | C178: GEEP* | D178: 0 | E178: 5D
A179: =R[-1]C+1 -> 178 | B179: MX6 GE10L1 | C179: GEEB | D179: 0 | E179: 2H
A180: =R[-1]C+1 -> 179 | B180: 626 GF | C180: TAFP | D180: 0 | E180: 4D
A181: =R[-1]C+1 -> 180 | B181: 626 GW | C181: TAFP | D181: 0 | E181: 5D
A182: =R[-1]C+1 -> 181 | B182: 929 SEDAN | C182: HCEP | D182: 0 | E182: 4D
A183: =R[-1]C+1 -> 182 | B183: 929 HARD TOP | C183: HCEP | D183: 0 | E183: 4H
A184: =R[-1]C+1 -> 183 | B184: 929 HD10E1 | C184: HDES | D184: 0 | E184: 4H
A185: =R[-1]C+1 -> 184 | B185: HE10E1 | C185: HEEP | D185: 0 | E185: 4H
A186: =R[-1]C+1 -> 185 | B186: E SERIES | C186: SSF8V | D186: 0 | E186: HV
A187: =R[-1]C+1 -> 186 | B187: BRAWNY | C187: SR89V | D187: 0 | E187: HV
A188: =R[-1]C+1 -> 187 | C188: JAPAN | D188: M | E188: SHAPE | F188: BONNET | G188: FENDER | I188: DOOR | M188: SLIDE DOOR | O188: BUMPER | Q188: GRILL/ | R188: TRUNK/ | S188: LAMP | T188: LAMP | Y188: RADIATOR | AA188: A/C | AB188: RADIATOR | AC188: A/C | AD188: UPPER | AE188: LOWER
A189: =R[-1]C+1 -> 188 | C189: MODEL | G189: R | H189: L | I189: F/R | J189: F/L | K189: R/R | L189: R/L | M189: R | N189: L | O189: F | P189: R | Q189: MASK | R189: R/GATE | S189: HEAD | T189: HEAD | U189: TAIL | W189: TAIL | X189: CLEAR | Y189: AUTO | Z189: MAUAUL | AA189: CONDENSOR | AB189: FAN | AC189: FAN | AD189: PANEL | AE189: PANEL
A190: =R[-1]C+1 -> 189 | B190: EUNOS 30X | C190: ES8SE | D190: 0 | E190: 3D
A191: =R[-1]C+1 -> 190 | B191: " 500 | C191: CAEPE | D191: 0 | E191: 4D
A192: =R[-1]C+1 -> 191 | B192: " 800 | C192: TA5Y | D192: 0 | E192: 4D
A193: =R[-1]C+1 -> 192 | B193: MPV 93-96 | C193: LVEW | D193: 0 | E193: 4V
A194: =R[-1]C+1 -> 193 | B194: MPV 96-99 | C194: LVEW | E194: 4V
A195: =R[-1]C+1 -> 194 | B195: MPV 1999 - | C195: LVEW | D195: 1 | E195: 4V
A196: =R[-1]C+1 -> 195 | B196: MX5 ROADSTAR | C196: NA6CE | D196: 0 | E196: 2D
A197: =R[-1]C+1 -> 196 | B197: MX5 98- ROADSTAR | C197: NB30P1
A198: =R[-1]C+1 -> 197 | B198: RX7 | C198: SA22C | D198: 0 | E198: 3D
A199: =R[-1]C+1 -> 198 | B199: " | C199: FC3S | D199: 0 | E199: 3D
A200: =R[-1]C+1 -> 199 | B200: " | C200: FD3S | D200: 0 | E200: 3D
A201: =R[-1]C+1 -> 200 | B201: FESTIVA WA | C201: DA3PF | D201: 0 | E201: 3D
A202: =R[-1]C+1 -> 201 | B202: " WB | C202: D23PF | D202: 0 | E202: 3D
A203: =R[-1]C+1 -> 202 | B203: " WB | C203: D23PF | D203: 0 | E203: 5D
A204: =R[-1]C+1 -> 203 | B204: METEOR GC | C204: BF7PF | D204: 0 | E204: 4D
A205: =R[-1]C+1 -> 204 | B205: LASER KC | C205: BF7PF | D205: 0 | E205: 3D/5D
A206: =R[-1]C+1 -> 205 | B206: " KE | C206: BF7PF | D206: 1 | E206: 4D
A207: =R[-1]C+1 -> 206 | B207: " WAGON | C207: BF7VF | D207: 0 | E207: 4V
A208: =R[-1]C+1 -> 207 | B208: " KF | C208: BG5PF | D208: 0 | E208: 3D
A209: =R[-1]C+1 -> 208 | B209: " KH | C209: BG5PF | D209: 1 | E209: 4D
A210: =R[-1]C+1 -> 209 | B210: " KJ | C210: BHA5PF | D210: 0 | E210: 4D
A211: =R[-1]C+1 -> 210 | B211: " | C211: BHA5SF | D211: 0 | E211: 3D
A212: =R[-1]C+1 -> 211 | B212: PROBE ST | C212: 1ZVT | D212: 0 | E212: 3D
A213: =R[-1]C+1 -> 212 | B213: SPECTRON | C213: SS88WF | D213: 0 | E213: HV
A214: =R[-1]C+1 -> 213 | B214: " | C214: SS88WF | D214: 1 | E214: HV
A215: =R[-1]C+1 -> 214 | B215: TESTAR AT | C215: GD8PF | D215: 0 | E215: 4D
A216: =R[-1]C+1 -> 215 | B216: TX5 AV | C216: GD8PF | D216: 1 | E216: 5D
A217: =R[-1]C+1 -> 216 | B217: TELSTAR AX | C217: GEEPF | D217: 0 | E217: 4D
A218: =R[-1]C+1 -> 217 | B218: TELSTAR AX 5DR | C218: GEEPF | D218: 0 | E218: 5D
A219: =R[-1]C+1 -> 218 | B219: TELSTAR AX SEDAN | C219: GEEPF | D219: 1 | E219: 4D
A220: =R[-1]C+1 -> 219 | B220: TELSTAR AX 5DR | C220: GEEPF | D220: 1 | E220: 5D
A221: =R[-1]C+1 -> 220 | C221: JAPAN | D221: M | E221: SHAPE | F221: BONNET | G221: FENDER | I221: DOOR | M221: SLIDE DOOR | O221: BUMPER | Q221: GRILL/ | R221: TRUNK/ | S221: LAMP | T221: LAMP | Y221: RADIATOR | AA221: A/C | AB221: RADIATOR | AC221: A/C | AD221: UPPER | AE221: LOWER
A222: =R[-1]C+1 -> 221 | C222: MODEL | G222: R | H222: L | I222: F/R | J222: F/L | K222: R/R | L222: R/L | M222: R | N222: L | O222: F | P222: R | Q222: MASK | R222: R/GATE | S222: HEAD | T222: HEAD | U222: TAIL | W222: TAIL | X222: CLEAR | Y222: AUTO | Z222: MAUAUL | AA222: CONDENSOR | AB222: FAN | AC222: FAN | AD222: PANEL | AE222: PANEL
A223: =R[-1]C+1 -> 222 | B223: COUGAR
A224: =R[-1]C+1 -> 223 | B224: COURIER
A225: =R[-1]C+1 -> 224 | B225: COURIER
A226: =R[-1]C+1 -> 225 | B226: COURIER
A227: =R[-1]C+1 -> 226 | B227: ECONOVAN
A228: =R[-1]C+1 -> 227 | B228: ESCAPE
A229: =R[-1]C+1 -> 228 | B229: EXPLORER
A230: =R[-1]C+1 -> 229 | B230: EXPLORER
A231: =R[-1]C+1 -> 230 | B231: FESTIVA
A232: =R[-1]C+1 -> 231 | B232: FOCUS | E232: 3D
A233: =R[-1]C+1 -> 232 | B233: FOCUS | E233: 5D
A234: =R[-1]C+1 -> 233 | B234: KA
A235: =R[-1]C+1 -> 234 | B235: LASER
A236: =R[-1]C+1 -> 235 | B236: LASER
A237: =R[-1]C+1 -> 236 | B237: LASER | E237: 4D
A238: =R[-1]C+1 -> 237 | B238: LASER | E238: 5D
A239: =R[-1]C+1 -> 238 | B239: MONDEO | E239: 4V
A240: =R[-1]C+1 -> 239 | B240: MONDEO HA-B | E240: 4D
A241: =R[-1]C+1 -> 240 | B241: MONDEO HC- | E241: 4D
A242: =R[-1]C+1 -> 241 | B242: TAURUS | E242: 4D
A243: =R[-1]C+1 -> 242 | B243: 323 PROTÉGÉ | C243: BJ5P | E243: 4D
A244: =R[-1]C+1 -> 243 | B244: 323 PROTÉGÉ | C244: BJ5P | E244: 5D
A245: =R[-1]C+1 -> 244 | B245: 626 SEDAN | C245: GF8P
A246: =R[-1]C+1 -> 245 | B246: 6 LIMITED | C246: GY3W | E246: 4V
A247: =R[-1]C+1 -> 246 | B247: 6 LIMITED | C247: GG3S | E247: 4D
A248: =R[-1]C+1 -> 247 | B248: MILLENIA | C248: TAFP | E248: 4D
A249: =R[-1]C+1 -> 248 | B249: MPV | C249: LVEW | E249: 4V
A250: =R[-1]C+1 -> 249 | B250: MPV | C250: LWFW | E250: 4V
A251: =R[-1]C+1 -> 250 | B251: MX5 | C251: NB8C | E251: 2C
A252: =R[-1]C+1 -> 251 | B252: PREMACY | C252: CP8W | E252: 4V
A253: =R[-1]C+1 -> 252 | B253: TRIBUTE | C253: EPEW | E253: 4V
A254: =R[-1]C+1 -> 253 | C254: JAPAN | D254: M | E254: SHAPE | F254: BONNET | G254: FENDER | I254: DOOR | M254: SLIDE DOOR | O254: BUMPER | Q254: GRILL/ | R254: TRUNK/ | S254: LAMP | T254: LAMP | Y254: RADIATOR | AA254: A/C | AB254: RADIATOR | AC254: A/C | AD254: UPPER | AE254: LOWER
A255: =R[-1]C+1 -> 254 | C255: MODEL | G255: R | H255: L | I255: F/R | J255: F/L | K255: R/R | L255: R/L | M255: R | N255: L | O255: F | P255: R | Q255: MASK | R255: R/GATE | S255: HEAD | T255: HEAD | U255: TAIL | W255: TAIL | X255: CLEAR | Y255: AUTO | Z255: MAUAUL | AA255: CONDENSOR | AB255: FAN | AC255: FAN | AD255: PANEL | AE255: PANEL
A256: =R[-1]C+1 -> 255 | B256: LANCER CA-B | C256: C51A | D256: 0 | E256: 3D
A257: =R[-1]C+1 -> 256 | B257: " CA-B | C257: C61A | D257: 1 | E257: 4D
A258: =R[-1]C+1 -> 257 | B258: " CA-B | C258: C61A* | D258: 0 | E258: 5D
A259: =R[-1]C+1 -> 258 | B259: " CC | C259: CB1A* | D259: 0 | E259: 4D
A260: =R[-1]C+1 -> 259 | B260: " CC | C260: CB1A* | D260: 0 | E260: 2D
A261: =R[-1]C+1 -> 260 | B261: CC WAGON | C261: CB5W | D261: 0 | E261: 4V
A262: =R[-1]C+1 -> 261 | B262: LANCER | C262: CK2A | D262: 1
A263: =R[-1]C+1 -> 262 | B263: LANCER | C263: CS5A
A264: =R[-1]C+1 -> 263
A265: =R[-1]C+1 -> 264 | B265: PROTON M21 | C265: CA1A | D265: 0 | E265: 2C
A266: =R[-1]C+1 -> 265 | B266: WIRA | C266: CB1A | D266: 0 | E266: 4D
A267: =R[-1]C+1 -> 266 | B267: HATCH | C267: CA1A | D267: 0 | E267: 3D
A268: =R[-1]C+1 -> 267 | B268: LANCER SEDAN CE | C268: CK2A | D268: 0 | E268: 4D
A269: =R[-1]C+1 -> 268 | B269: LANCER CPE CE | C269: CK2A | D269: 0 | E269: 2D
A270: =R[-1]C+1 -> 269 | B270: LANCER SEDAN CE | C270: CK2A | D270: 1 | E270: 4D
A271: =R[-1]C+1 -> 270 | B271: LANCER CPE CE | C271: CK2A | D271: 1 | E271: 2D
A272: =R[-1]C+1 -> 271 | B272: MIRAGE CE | C272: CJ2A | D272: 0 | E272: 3D
A273: =R[-1]C+1 -> 272 | B273: MIRAGE CE | C273: CJ2A | D273: 1 | E273: 3D
A274: =R[-1]C+1 -> 273 | B274: NIMBUS UB | C274: D05W | D274: 0/1 | E274: 4V
A275: =R[-1]C+1 -> 274 | B275: NIMBUS UF EARLY | C275: N33W | D275: 0 | E275: 4V
A276: =R[-1]C+1 -> 275 | B276: NIMBUS UF LATE | C276: N33W | D276: 1 | E276: 4V
A277: =R[-1]C+1 -> 276 | B277: NIMBUS UG 98- | E277: 4V
A278: =R[-1]C+1 -> 277 | B278: NIMBUS | C278: N84W
A279: =R[-1]C+1 -> 278 | B279: L300 SF | C279: P01V | D279: 0 | E279: HV
A280: =R[-1]C+1 -> 279 | B280: L300 SH | C280: P05W | D280: 1 | E280: HV
A281: =R[-1]C+1 -> 280 | B281: STARWAGON WA | C281: PA4W | D281: 0 | E281: HL
A282: =R[-1]C+1 -> 281 | C282: JAPAN | D282: M | E282: SHAPE | F282: BONNET | G282: FENDER | I282: DOOR | M282: SLIDE DOOR | O282: BUMPER | Q282: GRILL/ | R282: TRUNK/ | S282: LAMP | T282: LAMP | Y282: RADIATOR | AA282: A/C | AB282: RADIATOR | AC282: A/C | AD282: UPPER | AE282: LOWER
A283: =R[-1]C+1 -> 282 | C283: MODEL | G283: R | H283: L | I283: F/R | J283: F/L | K283: R/R | L283: R/L | M283: R | N283: L | O283: F | P283: R | Q283: MASK | R283: R/GATE | S283: HEAD | T283: HEAD | U283: TAIL | W283: TAIL | X283: CLEAR | Y283: AUTO | Z283: MAUAUL | AA283: CONDENSOR | AB283: FAN | AC283: FAN | AD283: PANEL | AE283: PANEL
A284: =R[-1]C+1 -> 283 | B284: MAGNA TM | C284: E13A | D284: 0 | E284: 4D
A285: =R[-1]C+1 -> 284 | B285: GALANT HG | C285: E35A | D285: 0 | E285: 4D
A286: =R[-1]C+1 -> 285 | B286: GALANT HH | C286: E35A | D286: 1 | E286: 4D
A287: =R[-1]C+1 -> 286 | B287: GALANT H/B | C287: E39A* | D287: 0 | E287: 5D
A288: =R[-1]C+1 -> 287 | B288: GALANT HJ | C288: E54A | D288: 0 | E288: 5D
A289: =R[-1]C+1 -> 288 | B289: MAGNA TR | C289: F15A* | D289: 0 | E289: 4D
A290: =R[-1]C+1 -> 289 | B290: MAGNA TS | C290: F15A* | D290: 1 | E290: 4D
A291: =R[-1]C+1 -> 290 | B291: VERADA KS | C291: F15A | D291: 0 | E291: 4H
A292: =R[-1]C+1 -> 291 | B292: MAGNA TE | C292: F25A* | D292: 0 | E292: 4D
A293: =R[-1]C+1 -> 292 | B293: PAJERO NC | C293: L041G/46G | D293: 0 | E293: 2V/4V
A294: =R[-1]C+1 -> 293 | B294: PAJERO NF | C294: L041G/46G | D294: 1 | E294: 2V/4V
A295: =R[-1]C+1 -> 294 | B295: PAJERO NH | C295: V23# | D295: 0 | E295: 2V
A296: =R[-1]C+1 -> 295 | B296: PAJERO | C296: V43# | D296: 0 | E296: 4V
A297: =R[-1]C+1 -> 296 | B297: PAJERO NM | E297: 4V
A298: =R[-1]C+1 -> 297 | B298: PAJERO | C298: V26W | D298: 0 | E298: 2V
A299: =R[-1]C+1 -> 298 | B299: PAJERO | C299: V45W | D299: 0 | E299: 4V
A300: =R[-1]C+1 -> 299 | B300: PAJERO | C300: V45W | D300: 1
A301: =R[-1]C+1 -> 300 | B301: PAJERO | C301: V75W
A302: =R[-1]C+1 -> 301 | B302: PAJERO | C302: V73W
A303: =R[-1]C+1 -> 302 | B303: PAJERO IO | C303: H76W | E303: 4V
A304: =R[-1]C+1 -> 303 | B304: PAJERO IO | C304: H67W | E304: 2V
A305: =R[-1]C+1 -> 304 | B305: FTO | C305: DE3A | E305: 2DR
A306: =R[-1]C+1 -> 305 | B306: CHALLENGER | C306: K99W
A307: =R[-1]C+1 -> 306 | B307: OUTLANDER | C307: CU5W
A308: =R[-1]C+1 -> 307
A309: =R[-1]C+1 -> 308
A310: =R[-1]C+1 -> 309 | C310: JAPAN | D310: M | E310: SHAPE | F310: BONNET | G310: FENDER | I310: DOOR | M310: SLIDE DOOR | O310: BUMPER | Q310: GRILL/ | R310: TRUNK/ | S310: LAMP | T310: LAMP | Y310: RADIATOR | AA310: A/C | AB310: RADIATOR | AC310: A/C | AD310: UPPER | AE310: LOWER
A311: =R[-1]C+1 -> 310 | C311: MODEL | G311: R | H311: L | I311: F/R | J311: F/L | K311: R/R | L311: R/L | M311: R | N311: L | O311: F | P311: R | Q311: MASK | R311: R/GATE | S311: HEAD | T311: HEAD | U311: TAIL | W311: TAIL | X311: CLEAR | Y311: AUTO | Z311: MAUAUL | AA311: CONDENSOR | AB311: FAN | AC311: FAN | AD311: PANEL | AE311: PANEL
A312: =R[-1]C+1 -> 311 | B312: LEONE WAGON | C312: AM1 | D312: 0 | E312: 4V
A313: =R[-1]C+1 -> 312 | B313: LEONEL SERIES | C313: AA2 | D313: 0 | E313: 4H
A314: =R[-1]C+1 -> 313 | B314: LEONE WAGON | C314: AP2 | D314: 0 | E314: 4V
A315: =R[-1]C+1 -> 314 | B315: VORTEX | C315: AX4 | D315: 0 | E315: 2H
A316: =R[-1]C+1 -> 315 | B316: SVX | C316: CXD | D316: 0 | E316: 2H
A317: =R[-1]C+1 -> 316 | B317: LIBERTY | C317: BC2 | D317: 0 | E317: 4H
A318: =R[-1]C+1 -> 317 | B318: LIBERTY | C318: BC2 | D318: 1 | E318: 4H
A319: =R[-1]C+1 -> 318 | B319: LIBERTY | C319: BF3 | D319: 0 | E319: 4V
A320: =R[-1]C+1 -> 319 | B320: " SECOND | C320: BD4 | D320: 0 | E320: 4H
A321: =R[-1]C+1 -> 320 | B321: " WAGON | C321: BG4 | D321: 0 | E321: 4V
A322: =R[-1]C+1 -> 321 | B322: IMPREZA | C322: GC1 | D322: 0 | E322: 4H
A323: =R[-1]C+1 -> 322 | B323: IMPREZA | C323: GF3 | D323: 0 | E323: 5D
A324: =R[-1]C+1 -> 323 | B324: IMPREZA | C324: GC/GF WRX | D324: 0
A325: =R[-1]C+1 -> 324 | B325: IMPREZA | C325: 96-00 | D325: 1 | E325: 4H
A326: =R[-1]C+1 -> 325 | B326: IMPREZA | C326: 96-00 | D326: 1 | E326: 5D
A327: =R[-1]C+1 -> 326 | B327: IMPREZA | C327: 96-00 WRX | D327: 1
A328: =R[-1]C+1 -> 327 | B328: IMPREZA | C328: 00- | E328: 4H
A329: =R[-1]C+1 -> 328 | B329: IMPREZA | C329: 00- | E329: 5D
A330: =R[-1]C+1 -> 329
A331: =R[-1]C+1 -> 330
A332: =R[-1]C+1 -> 331
A333: =R[-1]C+1 -> 332 | B333: MIRA | C333: L200S | D333: 0 | E333: 2V
A334: =R[-1]C+1 -> 333 | B334: MIRA | C334: L200S | D334: 1 | E334: 4V
A335: =R[-1]C+1 -> 334 | B335: MOVE | C335: L600S | D335: 0 | E335: 4V
A336: =R[-1]C+1 -> 335 | B336: HI-JET | C336: S80V | D336: 0 | E336: HV
A337: =R[-1]C+1 -> 336 | B337: CHARADE G100 | C337: G100S | D337: 0 | E337: 5D
A338: =R[-1]C+1 -> 337 | B338: " | C338: G102S | D338: 1 | E338: 4D
A339: =R[-1]C+1 -> 338 | B339: " G200 | C339: G200S | D339: 0 | E339: 3D/5D
A340: =R[-1]C+1 -> 339 | B340: " | C340: G203S | D340: 0 | E340: 4D
A341: =R[-1]C+1 -> 340 | B341: G200 | C341: 96-00 | D341: 1 | E341: 3D/5D
A342: =R[-1]C+1 -> 341 | B342: G200 | C342: 96-00 | D342: 1 | E342: 4D
A343: =R[-1]C+1 -> 342 | B343: APPLAUSE | C343: A101S | D343: 0 | E343: 5D
A344: =R[-1]C+1 -> 343 | B344: " | C344: A101S | D344: 1 | E344: 5D
A345: =R[-1]C+1 -> 344 | B345: FEROZA | C345: F75 | D345: 0 | E345: 2V
A346: =R[-1]C+1 -> 345 | B346: TERIOS | C346: J100S
A347: =R[-1]C+1 -> 346
A348: =R[-1]C+1 -> 347 | C348: JAPAN | D348: M | E348: SHAPE | F348: BONNET | G348: FENDER | I348: DOOR | M348: SLIDE DOOR | O348: BUMPER | Q348: GRILL/ | R348: TRUNK/ | S348: LAMP | T348: LAMP | Y348: RADIATOR | AA348: A/C | AB348: RADIATOR | AC348: A/C | AD348: UPPER | AE348: LOWER
A349: =R[-1]C+1 -> 348 | C349: MODEL | G349: R | H349: L | I349: F/R | J349: F/L | K349: R/R | L349: R/L | M349: R | N349: L | O349: F | P349: R | Q349: MASK | R349: R/GATE | S349: HEAD | T349: HEAD | U349: TAIL | W349: TAIL | X349: CLEAR | Y349: AUTO | Z349: MAUAUL | AA349: CONDENSOR | AB349: FAN | AC349: FAN | AD349: PANEL | AE349: PANEL
A350: =R[-1]C+1 -> 349 | B350: CIVIC | C350: AH | D350: 0 | E350: 3D
A351: =R[-1]C+1 -> 350 | B351: " | C351: AK | D351: 0 | E351: 4D
A352: =R[-1]C+1 -> 351 | B352: " WAGON | C352: AK | D352: 0 | E352: 4V
A353: =R[-1]C+1 -> 352 | B353: CIVIC | C353: EF3 | D353: 0 | E353: 3D
A354: =R[-1]C+1 -> 353 | B354: CIVIC | C354: EF3 | D354: 0 | E354: 4D
A355: =R[-1]C+1 -> 354 | B355: CIVIC | C355: EF3 | D355: 1 | E355: 4D
A356: =R[-1]C+1 -> 355 | B356: CIVIC | C356: EF3 | D356: 0 | E356: 4V
A357: =R[-1]C+1 -> 356 | B357: CIVIC | C357: EG3 | D357: 0 | E357: 4D
A358: =R[-1]C+1 -> 357 | B358: CIVIC | C358: EG3 | D358: 0 | E358: 3D
A359: =R[-1]C+1 -> 358 | B359: CIVIC | C359: EG7 | D359: 0 | E359: 4D
A360: =R[-1]C+1 -> 359 | B360: " COUPE | C360: EJ1 | D360: 0 | E360: 2C
A361: =R[-1]C+1 -> 360 | B361: " | C361: EK3 | D361: 0 | E361: 3D
A362: =R[-1]C+1 -> 361 | B362: " | C362: EK3 | D362: 0 | E362: 4D
A363: =R[-1]C+1 -> 362 | B363: " | C363: EK3 | D363: 1 | E363: 3D
A364: =R[-1]C+1 -> 363 | B364: " | C364: EK3 | D364: 1 | E364: 4D
A365: =R[-1]C+1 -> 364 | B365: CIVIC | C365: ES1 | E365: 4D
A366: =R[-1]C+1 -> 365 | B366: CIVIC | C366: EU3 | E366: 5D
A367: =R[-1]C+1 -> 366 | B367: CRX | C367: EF7 | D367: 0 | E367: 3D
A368: =R[-1]C+1 -> 367 | B368: " | C368: EG1 | D368: 0 | E368: 2D
A369: =R[-1]C+1 -> 368 | B369: CONCERTO | C369: MA2 | D369: 1 | E369: 5D
A370: =R[-1]C+1 -> 369 | B370: " | C370: MA2 | D370: 2 | E370: 5D
A371: =R[-1]C+1 -> 370 | C371: JAPAN | D371: M | E371: SHAPE | F371: BONNET | G371: FENDER | I371: DOOR | M371: SLIDE DOOR | O371: BUMPER | Q371: GRILL/ | R371: TRUNK/ | S371: LAMP | T371: LAMP | Y371: RADIATOR | AA371: A/C | AB371: RADIATOR | AC371: A/C | AD371: UPPER | AE371: LOWER
A372: =R[-1]C+1 -> 371 | C372: MODEL | G372: R | H372: L | I372: F/R | J372: F/L | K372: R/R | L372: R/L | M372: R | N372: L | O372: F | P372: R | Q372: MASK | R372: R/GATE | S372: HEAD | T372: HEAD | U372: TAIL | W372: TAIL | X372: CLEAR | Y372: AUTO | Z372: MAUAUL | AA372: CONDENSOR | AB372: FAN | AC372: FAN | AD372: PANEL | AE372: PANEL
A373: =R[-1]C+1 -> 372 | B373: ACCORD | C373: CA1 | D373: 0 | E373: 4D
A374: =R[-1]C+1 -> 373 | B374: " | C374: CA1 | D374: 0 | E374: 3D
A375: =R[-1]C+1 -> 374 | B375: " | C375: CB1 | D375: 0 | E375: 4D
A376: =R[-1]C+1 -> 375 | B376: " | C376: CB1 | D376: 1 | E376: 4D
A377: =R[-1]C+1 -> 376 | B377: " | C377: CD3 | D377: 0 | E377: 4D
A378: =R[-1]C+1 -> 377 | C378: CD3 | D378: 1 | E378: 4D
A379: =R[-1]C+1 -> 378 | B379: ACCORD | C379: CD | E379: 4V
A380: =R[-1]C+1 -> 379 | B380: " | C380: CG | E380: 4D
A381: =R[-1]C+1 -> 380 | B381: ACCORD | C381: CF3 | E381: 4D
A382: =R[-1]C+1 -> 381 | B382: ACTY VAN | C382: VD | D382: 0 | E382: HV
A383: =R[-1]C+1 -> 382 | B383: CITY VAN | C383: AA | D383: 0 | E383: 3D
A384: =R[-1]C+1 -> 383 | B384: INTEGRA | C384: AV | D384: 0 | E384: 3D
A385: =R[-1]C+1 -> 384 | B385: ROVER 416i | C385: DA1 | D385: 0 | E385: 5D
A386: =R[-1]C+1 -> 385 | B386: INTEGRA | C386: DA5 | D386: 0 | E386: 3D
A387: =R[-1]C+1 -> 386 | B387: " | C387: DC1 | D387: 0 | E387: 3D
A388: =R[-1]C+1 -> 387 | B388: INTEGRA | C388: DC5 | E388: 3D
A389: =R[-1]C+1 -> 388 | B389: PRELUDE | C389: AB | D389: 0 | E389: 2C
A390: =R[-1]C+1 -> 389 | B390: " 4WS | C390: BA4 | D390: 0 | E390: 2C
A391: =R[-1]C+1 -> 390 | B391: PRELUDE | C391: BA4 | D391: 2 | E391: 2C
A392: =R[-1]C+1 -> 391 | B392: PRELUDE | C392: BA8 / BB1 | D392: 0 | E392: 2C
A393: =R[-1]C+1 -> 392 | B393: PRELUDE | C393: BB5 | D393: 0 | E393: 2C
A394: =R[-1]C+1 -> 393 | B394: PRELUDE | C394: BB5 | E394: 2C
A395: =R[-1]C+1 -> 394 | B395: LEGEND | C395: KA1 | D395: 0 | E395: 4D
A396: =R[-1]C+1 -> 395 | B396: " | C396: KA3 | D396: 1 | E396: 2H
A397: =R[-1]C+1 -> 396 | B397: " | C397: KA7# | D397: 0 | E397: 4D
A398: =R[-1]C+1 -> 397 | C398: KA8# | D398: 0 | E398: 2C
A399: =R[-1]C+1 -> 398 | B399: ODYSSEY | C399: RA1 | D399: 0 | E399: 5D
A400: =R[-1]C+1 -> 399 | B400: ODYSSEY | C400: RA6 | E400: 5D
A401: =R[-1]C+1 -> 400 | B401: CRV | C401: RD2 | E401: 4V
A402: =R[-1]C+1 -> 401 | B402: CRV | C402: RD5 | E402: 4V
A403: =R[-1]C+1 -> 402 | B403: HRV | C403: GH2 | E403: 3D
A404: =R[-1]C+1 -> 403 | B404: INSIGHT | C404: ZE1 | E404: 3D
A405: =R[-1]C+1 -> 404 | B405: JAZZ | C405: GD1 | E405: 4V
A406: =R[-1]C+1 -> 405 | B406: MDX | C406: YD1 | E406: 4V
A407: =R[-1]C+1 -> 406 | B407: NSX | C407: NA2 | D407: 1 | E407: 2D
A408: =R[-1]C+1 -> 407 | B408: S2000 | C408: AP1 | E408: 2D
A409: =R[-1]C+1 -> 408
A410: =R[-1]C+1 -> 409
A411: =R[-1]C+1 -> 410
A412: =R[-1]C+1 -> 411 | C412: JAPAN | D412: M | E412: SHAPE | F412: BONNET | G412: FENDER | I412: DOOR | M412: SLIDE DOOR | O412: BUMPER | Q412: GRILL/ | R412: TRUNK/ | S412: LAMP | T412: LAMP | Y412: RADIATOR | AA412: A/C | AB412: RADIATOR | AC412: A/C | AD412: UPPER | AE412: LOWER
A413: =R[-1]C+1 -> 412 | C413: MODEL | G413: R | H413: L | I413: F/R | J413: F/L | K413: R/R | L413: R/L | M413: R | N413: L | O413: F | P413: R | Q413: MASK | R413: R/GATE | S413: HEAD | T413: HEAD | U413: TAIL | W413: TAIL | X413: CLEAR | Y413: AUTO | Z413: MAUAUL | AA413: CONDENSOR | AB413: FAN | AC413: FAN | AD413: PANEL | AE413: PANEL
A414: =R[-1]C+1 -> 413 | B414: BALENO | C414: GC21S | D414: 0 | E414: 4D
A415: =R[-1]C+1 -> 414 | B415: " HATCH | C415: GA11S | D415: 0 | E415: 3D
A416: =R[-1]C+1 -> 415 | B416: " WAGON | C416: GC21W | D416: 0 | E416: 4V
A417: =R[-1]C+1 -> 416 | B417: BALENO | C417: GC21S | E417: 4D
A418: =R[-1]C+1 -> 417 | B418: BALENO | C418: GA11S | E418: 3D
A419: =R[-1]C+1 -> 418 | B419: BALENO | C419: GC41W | E419: 4V
A420: =R[-1]C+1 -> 419 | B420: BARINA ML | C420: AB43S | D420: 0 | E420: 5D
A421: =R[-1]C+1 -> 420 | B421: SWIFT | C421: AA34S | D421: 0 | E421: 3D
A422: =R[-1]C+1 -> 421 | B422: " | C422: AB34S | D422: 0 | E422: 4D
A423: =R[-1]C+1 -> 422 | B423: BARINA MF-H | C423: AB34S | D423: 0 | E423: 5D
A424: =R[-1]C+1 -> 423 | B424: SWIFT | C424: AA34S | D424: 1 | E424: 3D
A425: =R[-1]C+1 -> 424 | B425: " | C425: AB34S | D425: 1 | E425: 4D
A426: =R[-1]C+1 -> 425 | B426: " | C426: AB34S | D426: 1 | E426: 5D
A427: =R[-1]C+1 -> 426 | B427: ESCUDO | C427: TA01W | D427: 0 | E427: 2V
A428: =R[-1]C+1 -> 427 | B428: " | C428: TD01W | D428: 1 | E428: 4V
A429: =R[-1]C+1 -> 428 | B429: ESCUDO | C429: 98- | E429: 4V
A430: =R[-1]C+1 -> 429 | B430: WAGON R+ | C430: MA61S | D430: 0 | E430: HL
A431: =R[-1]C+1 -> 430 | B431: GRAND VITARA | C431: TD62W | E431: 4V
A432: =R[-1]C+1 -> 431 | B432: JIMNY | C432: JB23W | E432: 2D
A433: =R[-1]C+1 -> 432 | B433: LIANA | C433: RB21S | E433: 3D
A434: =R[-1]C+1 -> 433 | B434: LIANA | C434: RB21S | E434: 4D
A435: =R[-1]C+1 -> 434 | B435: XL-7 | C435: TX92W | E435: 4V
A436: =R[-1]C+1 -> 435
A437: =R[-1]C+1 -> 436
A438: =R[-1]C+1 -> 437 | C438: JAPAN | D438: M | E438: SHAPE | F438: BONNET | G438: FENDER | I438: DOOR | M438: SLIDE DOOR | O438: BUMPER | Q438: GRILL/ | R438: TRUNK/ | S438: LAMP | T438: LAMP | Y438: RADIATOR | AA438: A/C | AB438: RADIATOR | AC438: A/C | AD438: UPPER | AE438: LOWER
A439: =R[-1]C+1 -> 438 | C439: MODEL | G439: R | H439: L | I439: F/R | J439: F/L | K439: R/R | L439: R/L | M439: R | N439: L | O439: F | P439: R | Q439: MASK | R439: R/GATE | S439: HEAD | T439: HEAD | U439: TAIL | W439: TAIL | X439: CLEAR | Y439: AUTO | Z439: MAUAUL | AA439: CONDENSOR | AB439: FAN | AC439: FAN | AD439: PANEL | AE439: PANEL
A440: =R[-1]C+1 -> 439 | B440: PIAZZA | C440: JR130 | D440: 0 | E440: 3D
A441: =R[-1]C+1 -> 440 | B441: BIGHORN | C441: UBS52FK | D441: 0 | E441: 2V
A442: =R[-1]C+1 -> 441 | B442: BIGHORN | C442: UBS52FK | D442: 1 | E442: 4V
A443: =R[-1]C+1 -> 442 | B443: BIGHORN | C443: UBS25GW | E443: 4V
A444: =R[-1]C+1 -> 443 | B444: WIZARD | C444: EUER | E444: 4V
A445: =R[-1]C+1 -> 444 | B445: OPEL VITA | E445: 3D
A446: =R[-1]C+1 -> 445 | B446: OPEL VITA | E446: 5D