Sheet: EverythingTests
A6: DATA SECTION | B6: INTEGRAL | C6: DOUBLE | D6: BLANK | E6: STRING | F6: REF | G6: AREA (rows) | K6: AREA (cols) | P6: AREA (AREA) | T6: FINANCE DATA | AA6: ERRORS | AL6: IRR/NPV | AM6: MIRR | AR6: Percentile
B7: 0 | C7: 0 | E7: ="" ->  | F7: =RC[-4] -> 0 | G7: 1 | H7: 2 | I7: 3 | J7: 4 | K7: 1 | L7: 1.0009999999999999 | M7: alphanum | N7: blanksIncl | O7: E8 | P7: 1 | Q7: 2 | R7: 3 | S7: 4 | T7: r | U7: n | V7: y | W7: p | X7: t | Y7: f | AA7: #NULL! | AC7: 0 | AD7: 1 | AE7: 2 | AF7: 3 | AG7: 4 | AH7: 5 | AI7: 6 | AJ7: 7 | AK7: 8 | AL7: -70000 | AM7: -120000 | AN7: -7500 | AO7: -10000 | AP7: 10000 | AQ7: -10000 | AR7: 1
B8: 1 | C8: 1.0000000000000001E-5 | E8: nospaces | F8: =RC[-4] -> 1 | G8: 1.0009999999999999 | H8: 2.9990000000000001 | I8: 3.5 | J8: 4.5 | K8: 2 | L8: 2.9998999999999998 | M8: 3 | O8: 545 | P8: 9999.9999000000007 | Q8: 23.333300000000001 | R8: =2/3 -> 1899-12-31T16:00:00.000 | S8: 1000.001 | T8: 1 | U8: 10 | V8: 100 | W8: 10000 | X8: 0 | AA8: #DIV/0! | AC8: 8 | AD8: 9 | AE8: 10 | AF8: 11 | AG8: 12 | AH8: 13 | AI8: 14 | AJ8: 15 | AK8: 16 | AL8: 12000 | AM8: 39000 | AN8: 3000 | AO8: 3400 | AP8: 3400 | AQ8: -3400 | AR8: 3
B9: 2 | C9: 1.1000000000000001 | E9: sp ace s | F9: =R[2]C[-4] -> 9999999999 | G9: 2.3456000000000001 | H9: 3.4567000000000001 | I9: 5.6788999999999996 | J9: 6.7889999999999997 | K9: 3 | L9: 3.5 | M9: ric | N9: 345 | O9: 454 | P9: refsIncl | Q9: =R[-2]C[-9] -> 2 | R9: =R[-1]C[-9] -> 3.5 | S9: =R[-2]C[-14] ->  | T9: 1 | U9: 10 | V9: 100 | W9: 10000 | X9: 1 | AA9: #VALUE! | AC9: 16 | AD9: 17 | AE9: 18 | AF9: 19 | AG9: 20 | AH9: 21 | AI9: 22 | AJ9: 23 | AK9: 24 | AL9: 15000 | AM9: 30000 | AN9: 5000 | AO9: 6500 | AP9: 6500 | AQ9: -6500 | AR9: 2
B10: 534 | C10: 1.0000100000000001 | E10: endsWithSpace | F10: =R[-2]C[-3] -> 1.0000000000000001E-5 | G10: alphanum | H10: 3 | I10: ric | J10: row | K10: 4 | L10: 4.5 | M10: col | N10: 1.0000000000000001E-5 | O10: 0 | P10: blanksIncl | S10: endarea | T10: 2 | U10: 12 | V10: 120 | W10: 12000 | X10: 0 | AA10: #REF! | AC10: 24 | AD10: 25 | AE10: 26 | AF10: 27 | AG10: 28 | AH10: 29 | AI10: 30 | AJ10: 31 | AK10: 32 | AL10: 18000 | AM10: 21000 | AN10: 1200 | AO10: 1000 | AP10: 1000 | AQ10: -1000 | AR10: 4
B11: 9999999999 | C11: 2.9999899999999999 | E11: beginsWithSpace | F11: =R[-4]C[-2] -> 0 | G11: blanksIncl | I11: 345 | J11: 1.0000000000000001E-5 | T11: 2 | U11: 12 | V11: 120 | W11: 12000 | X11: 1 | AA11: #NAME? | AC11: 32 | AD11: 33 | AE11: 34 | AF11: 35 | AG11: 36 | AH11: 37 | AI11: 38 | AJ11: 39 | AK11: 40 | AL11: 12000 | AM11: 37000 | AN11: 4000 | AO11: 6.5000000000000002E-2 | AP11: 6.5000000000000002E-2 | AQ11: 7.0000000000000007E-2
B12: -9999999999 | C12: 999999.99999000004 | E12: non-numeric | F12: =R[-3]C[-1] -> sp ace s | G12: E8 | H12: 545 | I12: 454 | J12: 0 | T12: 0.66666666666666663 | U12: 23 | V12: 133.33000000000001 | W12: 34307 | X12: 0 | AA12: #NUM! | AC12: 40 | AD12: 41 | AE12: 42 | AF12: 43 | AG12: 44 | AH12: 45 | AI12: 46 | AJ12: 47 | AK12: 48 | AL12: 26000 | AM12: 46000 | AN12: 0.05 | AO12: 0.1 | AP12: 0.1 | AQ12: 0.01
B13: -534 | C13: -999999.99999000004 | E13: ="0" -> 0 | F13: =R[4]C[-1] -> 2.99999 | T13: 0.66666666666666663 | U13: 23 | V13: 133.33000000000001 | W13: 34307 | X13: 1 | AA13: #N/A | AM13: 0.1 | AN13: 0.08
B14: -2 | C14: -2.9999899999999999 | E14: ="0.000001" -> 0.000001 | F14: =R[5]C[-1] -> alph4Num3ric | T14: 0 | U14: 1 | V14: 100 | W14: 2300 | X14: 0 | AM14: 0.12
B15: -1 | C15: -1.0000100000000001 | E15: ="1" -> 1 | T15: 0 | U15: 1 | V15: 100 | W15: 2300 | X15: 1
B16: 1 | C16: -1.1000000000000001 | E16: ="1.1" -> 1.1 | T16: 0 | U16: 12 | V16: 120 | W16: 12000 | X16: 0
B17: 0 | C17: -1.0000000000000001E-5 | E17: ="2.99999" -> 2.99999 | T17: 0 | U17: 12 | V17: 120 | W17: 12000 | X17: 1
B18: ="TRUE" -> TRUE | E18: ="99999999" -> 99999999 | T18: 2.3332999999999999 | U18: 4 | V18: 334.5 | W18: 14323.45 | X18: 0
B19: ="FALSE" -> FALSE | E19: alph4Num3ric | T19: 2.3332999999999999 | U19: 4 | V19: 334.5 | W19: 14323.45 | X19: 1
C20: 2000-12-25T00:00:00.000 | F20: =R[-13]C[-2] -> 0
B23: Add | C23: FORMULA | D23: =0+0 -> 0 | E23: =999999+1.001 -> 1000000.001 | F23: =-8888+8887.9 -> -0.1000000000003638 | G23: =R[-14]C[-5]+R[-14]C[-4]+R[-13]C[-1] -> 3.1000100000000002 | H23: =R[-16]C[-6]+R[-16]C[-5]+R[-16]C[-4]+R[-16]C[-2] -> 0 | I23: =R[-16]C[-7]+R[-16]C[-6]+R[-16]C[-5]+R[-16]C[-4] -> #VALUE! | J23: =R[-16]C[-6]+R[-15]C[-6] -> 0 | K23: =R[-16]C[-8]+R[-16]C[-4]:R[-16]C[-1] -> #VALUE!
C24: EXPECTED VALUE | D24: 0 | E24: 1000000.001 | F24: -0.1000000000003638 | G24: 3.1000100000000002 | H24: 0 | I24: #VALUE! | J24: 0 | K24: #VALUE!
B27: ConcatEval | C27: FORMULA | D27: =0&1 -> 01 | E27: =2&"hello world" -> 2hello world | F27: ="its "&(2<3)&" blue" -> its TRUE blue | G27: =R[-18]C[-1]&R[-20]C[-5]&R[-20]C[-3]&R[-8]C[-2] -> 99999999990alph4Num3ric | H27: =R[-20]C[3]:R[-17]C[4]&R[-20]C[-4]&R[-20]C[-2] -> #VALUE! | I27: =R[-20]C[7]:R[-17]C[10]&"test" -> #VALUE!
C28: EXPECTED VALUE | D28: 01 | E28: 2hello world | F28: its TRUE blue | G28: 99999999990alph4Num3ric | H28: #VALUE! | I28: #VALUE!
B31: DivideEval | C31: FORMULA | D31: =0/1 -> 0 | E31: =R[-20]C[-3]/R[-19]C[-3] -> -1 | F31: =R[-18]C[-3]/R[-14]C[-3] -> 99999999999 | G31: =R[-21]C[-2]/R[-24]C[-3] -> #VALUE! | H31: =R[-22]C[-3]/R[-23]C[-5] -> #VALUE! | I31: =R[-23]C[-6]/R[-24]C[-5] -> #DIV/0! | J31: =R[-24]C[-4]/R[-14]C[-5] -> 0 | K31: =R[-24]C[-5]/R[-22]C[-6] -> #VALUE! | L31: =R[-22]C[-7]/R[-16]C[-7] -> #VALUE! | M31: =R[-14]C[-8]/R[-16]C[-8] -> 2.9999899999999999 | N31: =R[-16]C[-9]/R[-22]C[-11] -> 0.90909090909090906 | O31: =R[-24]C[-8]:R[-24]C[-5]/R[-23]C[-13] -> #VALUE! | P31: =R[-24]C[-5]:R[-21]C[-5]/R[-23]C[-14] -> #VALUE! | Q31: =R[-24]C[-1]:R[-23]C[2]/R[-23]C[-15] -> #VALUE!
C32: EXPECTED VALUE | D32: 0 | E32: -1 | F32: 99999999999 | G32: #VALUE! | H32: #VALUE! | I32: #DIV/0! | J32: 0 | K32: #VALUE! | L32: #VALUE! | M32: 2.9999899999999999 | N32: 0.90909090909090906 | O32: #VALUE! | P32: #VALUE! | Q32: #VALUE!
B35: EqualEval | C35: FORMULA | D35: =R[-27]C[-2]=R[-27]C[-2] -> 1 | E35: =1000000=999999.99 -> 0 | F35: =1.11111111111111=1.1111111111111 -> 0 | G35: =R[-27]C[-2]=R[-27]C[-2] -> 1 | H35: =R[-27]C[-3]=R[-26]C[-3] -> 0 | I35: ="1.1"=R[-26]C[-6] -> 0 | J35: =1.1=R[-19]C[-7] -> 0 | K35: =-200=200 -> 0 | L35: =""=R[-28]C[-8] -> 1 | M35: =0=R[-28]C[-9] -> 1 | N35: =FALSE=R[-28]C[-10] -> 1 | O35: =""=0 -> 0 | P35: =FALSE=0 -> 0
C36: EXPECTED VALUE | D36: 1 | E36: 0 | F36: 0 | G36: 1 | H36: 0 | I36: 0 | J36: 0 | K36: 0 | L36: 1 | M36: 1 | N36: 1 | O36: 0 | P36: 0
B39: GreaterEqualEval | C39: FORMULA | D39: =2>=2 -> 1 | E39: =R[-28]C[-3]>=R[-27]C[-2] -> 1 | F39: =R[-29]C[-3]>=1.00001 -> 1 | G39: =R[-32]C[-3]>=R[-31]C[-3] -> 1 | H39: =R[-31]C[-3]>=R[-29]C[-3] -> 1 | I39: =R[-29]C[-4]>=R[-31]C[-4] -> 0 | J39: =R[-30]C[-4]>=R[-30]C[-4] -> 1 | K39: =R[-32]C[-4]:R[-32]C[-1]>=R[-32]C[-4]:R[-32]C[-1] -> #VALUE! | L39: =R[-32]C[-1]:R[-29]C[-1]>=R[-32]C[-1]:R[-29]C[-1] -> #VALUE!
C40: EXPECTED VALUE | D40: 1 | E40: 1 | F40: 1 | G40: 1 | H40: 1 | I40: 0 | J40: 1 | K40: #VALUE! | L40: #VALUE!
B43: GreaterThanEval | C43: FORMULA | D43: =R[-36]C[-2]>R[-32]C[-2] -> 0 | E43: =R[-32]C[-3]>R[-36]C[-3] -> 1 | F43: =R[-36]C[-4]>R[-31]C[-4] -> 1 | G43: =R[-30]C[-5]>R[-28]C[-4] -> 0 | H43: =R[-36]C[-4]>R[-35]C[-5] -> 0 | I43: =R[-36]C[-5]>R[-26]C[-6] -> 1 | J43: =R[-29]C[-4]>R[-30]C[-4] -> 1 | K43: =R[-28]C[-6]>R[-34]C[-6] -> 0 | L43: =R[-36]C[-5]:R[-36]C[-2]>R[-35]C[-6] -> #VALUE! | M43: =R[-36]C[-2]:R[-33]C[-2]>R[-32]C[-7] -> #VALUE! | N43: =FALSE>"TRUE" -> 1 | O43: =TRUE>"TRUER" -> 1
C44: EXPECTED VALUE | D44: 0 | E44: 1 | F44: 1 | G44: 0 | H44: 0 | I44: 1 | J44: 1 | K44: 0 | L44: #VALUE! | M44: #VALUE! | N44: 1 | O44: 1
B47: IntersectionEval | C47: FORMULA | D47: =R[-38]C[3]:R[-38]C[7] R[-40]C[5]:R[-35]C[5] -> 5.6788999999999996 | E47: =SUM(C[3] R[-39]C[3]:R[-39]C[4]) -> 2.9990000000000001 | F47: =R[-39]C[-2]:(R[-40]C[-1]) (R[-38]C[-1]):R[-39]C -> nospaces | G47: =R[-39]C[-3]:(R[-40]C[-2]) (R[-37]C[-2]):R[-38]C[-1] -> #NULL! | H47: =R[-35] R[-37]C -> #NULL!
C48: EXPECTED VALUE | D48: 5.6788999999999996 | E48: 2.9990000000000001 | F48: nospaces | G48: #NULL! | H48: #NULL!
B51: LessEqualEval | C51: FORMULA | D51: =R[-44]C[-2]<=R[-44]C[-1] -> 1 | E51: =R[-43]C[-3]<=R[-42]C[-2] -> 1 | F51: =R[-43]C[-3]<=R[-35]C[-3] -> 0 | G51: =R[-43]C[-2]<=R[-42]C[-2] -> 1 | H51: =R[-42]C[-5]<=R[-40]C[-3] -> 1 | I51: =R[-41]C[-3]<=R[-40]C[-3] -> 0 | J51: =R[-39]C[-4]<=R[-39]C[-5] -> 0 | K51: =R[-34]C[-6]<=R[-40]C[-8] -> 0 | L51: =R[-44]C[-5]:R[-44]C[-2]<=R[-43]C[-6] -> #VALUE! | M51: =R[-44]C[-1]:R[-41]C[-1]<=R[-44]C[-11] -> #VALUE!
C52: EXPECTED VALUE | D52: 1 | E52: 1 | F52: 0 | G52: 1 | H52: 1 | I52: 0 | J52: 0 | K52: 0 | L52: #VALUE! | M52: #VALUE!
B55: LessThanEval | C55: FORMULA | D55: =R[-48]C[-2]<R[-47]C[-2] -> 1 | E55: =R[-47]C[-3]<R[-48]C[-3] -> 0 | F55: =R[-45]C[-3]<R[-46]C[-3] -> 1 | G55: =R[-47]C[-2]<R[-46]C[-2] -> 1 | H55: =R[-46]C[-5]<R[-39]C[-3] -> 1
C56: EXPECTED VALUE | D56: 1 | E56: 0 | F56: 1 | G56: 1 | H56: 1
B59: MultiplyEval | C59: FORMULA | D59: =1*0 -> 0 | E59: ="test"*0 -> #VALUE! | F59: =1.99999*0.033 -> 6.5999669999999996E-2 | G59: =R[-49]C[-5]*R[-48]C[-4] -> 1601.9946600000001 | H59: =R[-52]C[-4]*R[-51]C[-5] -> 0 | I59: =R[-52]C[-4]*R[-52]C[-6] -> #VALUE! | J59: =R[-52]C[-9]:R[-52]C*R[-44]C[-8] -> -4 | K59: =R[-52]C:R[-49]C*R[-49]C[-9] -> #VALUE! | L59: =R[-58]C[-2]:RC[-2]*R[-51]C[-10] -> -4 | M59: =""*"1" -> #VALUE! | N59: ="1"*1 -> 1 | O59: =TRUE*34 -> 34 | P59: =FALSE*2 -> 0 | Q59: =R[-41]C[-15]*R[-43]C[-15] -> #VALUE!
C60: EXPECTED VALUE | D60: 0 | E60: #VALUE! | F60: 6.5999669999999996E-2 | G60: 1601.9946600000001 | H60: 0 | I60: #VALUE! | J60: -4 | K60: #VALUE! | L60: -4 | M60: #VALUE! | N60: 1 | O60: 34 | P60: 0 | Q60: #VALUE!
B63: NotEqualEval | C63: FORMULA | D63: =R[-56]C[-2]<>R[-56]C[-2] -> 0 | E63: ="TRUE"<>R[-47]C[-3] -> 1 | F63: ="TRUE"<>R[-45]C[-4] -> 0 | G63: =FALSE<>R[-44]C[-5] -> 1 | H63: =R[-55]C[-5]<>0.00001001 -> 1 | I63: =R[-54]C[-4]<>"spaces" -> 1 | J63: =R[-52]C[-5]<>"beginsWithSpace" -> 1 | K63: =1<>R[-48]C[-6] -> 1 | L63: =R[-46]C[-7]<>R[-46]C[-9] -> 1 | M63: =R[-49]C[-7]<>R[-49]C[-7] -> 0 | N63: ="blanksIncl"<>R[-52]C[-7] -> 0 | O63: =R[-56]C[-8]:R[-56]C[-5]<>R[-56]C[-8]:R[-56]C[-5] -> #VALUE! | P63: =R[-56]C:R[-55]C[3]<>R[-56]C:R[-55]C[3] -> #VALUE! | Q63: =R[-56]C[-1]:R[-56]C[2]<>R[-56]C:R[-56]C[1] -> 0 | R63: =R[-56]C[-2]:R[-53]C[-2]<>R[-56]C[1]:R[-53]C[1] -> #VALUE! | S63: =""<>R[-56]C[-15] -> 0 | T63: =0<>R[-56]C[-16] -> 0
C64: EXPECTED VALUE | D64: 0 | E64: 1 | F64: 0 | G64: 1 | H64: 1 | I64: 1 | J64: 1 | K64: 1 | L64: 1 | M64: 0 | N64: 0 | O64: #VALUE! | P64: #VALUE! | Q64: 0 | R64: #VALUE! | S64: 0 | T64: 0
B67: PercentEval | C67: FORMULA | D67: =50% -> 0.5 | E67: ="250"% -> 2.5 | F67: =R[-51]C[-4]% -> 0.01 | G67: =R[-54]C[-1]% -> 2.9999899999999999E-2 | H67: =1000%% -> 0.1
C68: EXPECTED VALUE | D68: 0.5 | E68: 2.5 | F68: 0.01 | G68: 2.9999899999999999E-2 | H68: 0.1
B71: PowerEval | C71: FORMULA | D71: =2^5 -> 32 | E71: =1^99999 -> 1 | F71: =R[-58]C[-4]^0 -> 1 | G71: =R[-56]C[-4]^R[-62]C[-4] -> #NUM! | H71: =R[-63]C[-6]^R[-62]C[-5] -> 1 | I71: =R[-64]C[-6]^R[-62]C[-6] -> 0 | J71: =R[-62]C[-8]^R[-62]C[-7] -> 2.1435469250725863 | K71: =R[-56]C[-8]^R[-62]C[-9] -> 1.0000200001000001 | L71: =R[-61]C[-10]^R[-57]C[-10] -> 3.5068523895692182E-6 | M71: =R[-61]C[-6]^R[-64]C[-10] -> #VALUE! | N71: =R[-64]C[-9]^R[-64]C[-11] -> #VALUE! | O71: =R[-64]C[-7]:R[-64]C[-5]^R[-64]C[-12] -> #VALUE! | P71: =R[-64]C[-2]:R[-64]C[1]^R[-62]C[1] -> 1 | Q71: =R[-64]C[-1]:R[-62]C^R[-64]C[1] -> #VALUE! | R71: =R[-1]C[-2]:RC[-2]^R[-62]C -> 1
C72: EXPECTED VALUE | D72: 32 | E72: 1 | F72: 1 | G72: #NUM! | H72: 1 | I72: 0 | J72: 2.1435469250725863 | K72: 1.0000200001000001 | L72: 3.5068523895692182E-6 | M72: #VALUE! | N72: #VALUE! | O72: #VALUE! | P72: 1 | Q72: #VALUE! | R72: 1
B75: RangeEval | C75: FORMULA | D75: =(R[-3]C[-2]):R[3]C[-2] -> RangeEval | E75: =SUM(R[-68]C[5]:(R[-67]C[4])) -> 15
C76: EXPECTED VALUE | D76: RangeEval | E76: 15
B79: SubtractEval | C79: FORMULA | D79: =R[-69]C[-2]-R[-70]C[-1] -> 532.9 | E79: =9999-9999 -> 0 | F79: =R[-70]C[-3]-R[-63]C[-3] -> 2.2000000000000002 | G79: =R[-71]C[-3]-R[-72]C[-3] -> 0 | H79: =R[-72]C[-4]-R[-70]C[-5] -> -1.1000000000000001 | I79: =R[-72]C[-4]-R[-72]C[-6] -> #VALUE! | J79: =R[-63]C[-8]-R[-62]C[-8] -> 1 | K79: =R[-60]C[-9]-R[-61]C[-9] -> #VALUE! | L79: =R[-62]C[-10]-R[-63]C[-10] -> -1 | M79: =R[-72]C:R[-69]C-R[-72]C[1]:R[-69]C[1] -> #VALUE! | N79: =R[-69]C[-2]:R[-69]C[1]-R[-70]C -> -344.99999000000003 | O79: =R[-69]C[-1]:R[-69]C[1]-R[-71]C:R[-68]C -> #VALUE! | P79: =R[-72]C[-7]-R[-70]C[-3] -> #VALUE!
C80: EXPECTED VALUE | D80: 532.9 | E80: 0 | F80: 2.2000000000000002 | G80: 0 | H80: -1.1000000000000001 | I80: #VALUE! | J80: 1 | K80: #VALUE! | L80: -1 | M80: #VALUE! | N80: -344.99999000000003 | O80: #VALUE! | P80: #VALUE!
B83: UnaryMinusEval | C83: FORMULA | D83: =-R[-74]C[-2] -> -2 | E83: =-R[-71]C[-3] -> 9999999999 | F83: =-R[-67]C[-4] -> -1 | G83: =-R[-73]C[-1]:R[-73]C[1] -> #VALUE! | H83: =-R[-72]C[-1]:R[-72]C[1] -> 0 | I83: =-R[-73]C[-1]:R[-73]C[1] -> #VALUE! | J83: =-R[-76]C[-5] -> #VALUE! | K83: =-R[-73]C[-5] -> -1.0000000000000001E-5 | L83: =-R[-76]C[-1]:R[-75]C -> #VALUE! | M83: =-R[-76]C:R[-73]C -> #VALUE! | N83: =-R[-73]C[-3] -> -4 | O83: =-R[-65]C[-13] -> #VALUE!
C84: EXPECTED VALUE | D84: -2 | E84: 9999999999 | F84: -1 | G84: #VALUE! | H84: 0 | I84: #VALUE! | J84: #VALUE! | K84: -1.0000000000000001E-5 | L84: #VALUE! | M84: #VALUE! | N84: -4 | O84: #VALUE!
B87: UnaryPlusEval | C87: FORMULA | D87: =2 -> 2 | E87: =+R[-73]C[-2] -> -2.9999899999999999 | F87: =+R[-80]C[-2] -> 0 | G87: =+R[-78]C[-1]:R[-78]C[1] -> 2.3456000000000001 | H87: =+R[-2]C[-1]:RC[-1] -> 2.3456000000000001 | I87: =+R[-75]C[-1]:R[-75]C[1] -> 454 | J87: =+R[-80]C[-1]:R[-79]C -> #VALUE! | K87: =+R[-76]C[-1]:R[-76]C[1] -> 0 | L87: =+R[-80]C[-7] ->  | M87: =+R[-77]C[-1]:R[-77]C[1] -> col | N87: =-"hello" -> #VALUE!
C88: EXPECTED VALUE | D88: 2 | E88: -2.9999899999999999 | F88: 0 | G88: 2.3456000000000001 | H88: 2.3456000000000001 | I88: 454 | J88: #VALUE! | K88: 0 | M88: col | N88: #VALUE!
B91: <END-OF-FUNCTIONS>
B94: Excel functions
B96: Abs | C96: FORMULA | D96: =ABS(R[-89]C[-2]) -> 0 | E96: =ABS(R[-84]C[-3]) -> 9999999999 | F96: =ABS(R[-82]C[-3]) -> 2.9999899999999999 | G96: =ABS(R[-89]C[-3]) -> 0 | H96: =ABS(R[-89]C[-3]) -> #VALUE! | I96: =ABS("1") -> 1 | J96: =ABS(R[-86]C[-4]) -> 1.0000000000000001E-5 | K96: =ABS(R[-83]C[-5]) -> 2.9999899999999999 | L96: =ABS(R[-89]C[-5]:R[-84]C[-5]) -> #VALUE! | M96: =ABS(R[-89]C[-2]:R[-89]C[1]) -> #VALUE! | N96: =ABS(R[-87]C[-3]:R[-87]C) -> 345 | O96: =ABS(R[-8]C[-1]:RC[-1]) -> 345 | P96: =ABS(R[-78]C[-14]) -> #VALUE! | Q96: =ABS(R[-80]C[-15]) -> 1 | R96: =ABS(R[-79]C[-16]) -> 0
C97: EXPECTED VALUE | D97: 0 | E97: 9999999999 | F97: 2.9999899999999999 | G97: 0 | H97: #VALUE! | I97: 1 | J97: 1.0000000000000001E-5 | K97: 2.9999899999999999 | L97: #VALUE! | M97: #VALUE! | N97: 345 | O97: 345 | P97: #VALUE! | Q97: 1 | R97: 0
B100: Absref | C100: FORMULA
C101: EXPECTED VALUE
B104: Acos | C104: FORMULA | D104: =ACOS(0) -> 1.5707963267948966 | E104: =ACOS(R[-95]C[-3]) -> #NUM! | F104: =ACOS(R[-97]C[-4]) -> 1.5707963267948966 | G104: =ACOS(R[-88]C[-5]) -> 0 | H104: =ACOS(R[-87]C[-6]) -> 1.5707963267948966 | I104: =ACOS(R[-87]C[-6]) -> 1.5708063267948966 | J104: =ACOS(R[-97]C[-6]) -> 1.5707963267948966 | K104: =ACOS(R[-97]C[-6]) -> #VALUE! | L104: =ACOS(R[-96]C[-6]) -> 0 | M104: =ACOS(R[-95]C[-6]) -> #NUM! | N104: =ACOS(R[-96]C[-3]:R[-96]C) -> 1.5707963267948966 | O104: =ACOS(R[-2]C[-3]:R[1]C[-3]) -> 1.5707963267948966 | P104: =ACOS(R[-97]C[-1]:R[-96]C) -> #VALUE! | Q104: =ACOS("0.5") -> 1.0471975511965976
C105: EXPECTED VALUE | D105: 1.5707963267948966 | E105: #NUM! | F105: 1.5707963267948966 | G105: 0 | H105: 1.5707963267948966 | I105: 1.5708063267948966 | J105: 1.5707963267948966 | K105: #VALUE! | L105: 0 | M105: #NUM! | N105: 1.5707963267948966 | O105: 1.5707963267948966 | P105: #VALUE! | Q105: 1.0471975511965976
B108: Acosh | C108: FORMULA | D108: =ACOSH(R[-99]C[-2]) -> 1.3169578969248166 | E108: =ACOSH(R[-96]C[-3]) -> #NUM! | F108: =ACOSH(R[-95]C[-4]) -> #NUM! | G108: =ACOSH(R[-92]C[-5]) -> 0 | H108: =ACOSH(R[-90]C[-6]) -> #VALUE! | I108: =ACOSH(R[-101]C[-5]) -> #NUM! | J108: =ACOSH(R[-101]C[-7]) -> #NUM! | K108: =ACOSH(R[-94]C[-8]) -> #NUM! | L108: =ACOSH(R[-94]C[-7]) -> #NUM! | M108: =ACOSH(R[-100]C[-2]:R[-100]C[1]) -> 1.7627471740390861 | N108: =ACOSH(R[-2]C[-1]:R[1]C[-1]) -> 1.1676387512082018 | O108: =ACOSH(R[-99]C[-1]:R[-98]C) -> #VALUE!
C109: EXPECTED VALUE | D109: 1.3169578969248166 | E109: #NUM! | F109: #NUM! | G109: 0 | H109: #VALUE! | I109: #NUM! | J109: #NUM! | K109: #NUM! | L109: #NUM! | M109: 1.7627471740390861 | N109: 1.1676387512082018 | O109: #VALUE!
B112: Activecell | C112: FORMULA
C113: EXPECTED VALUE
B116: Addbar | C116: FORMULA | D116: WILL_NEVER_IMPLEMENT
C117: EXPECTED VALUE | D117: WILL_NEVER_IMPLEMENT
B120: Addcommand | C120: FORMULA | D120: WILL_NEVER_IMPLEMENT
C121: EXPECTED VALUE | D121: WILL_NEVER_IMPLEMENT
B124: Addmenu | C124: FORMULA | D124: WILL_NEVER_IMPLEMENT
C125: EXPECTED VALUE | D125: WILL_NEVER_IMPLEMENT
B128: Address | C128: FORMULA | D128: =ADDRESS(2,3) -> $C$2 | E128: =ADDRESS(2,3,2) -> C$2 | F128: =ADDRESS(2,3,3,TRUE,"[Book1]Sheet1") -> [Book1]Sheet1!$C2
C129: EXPECTED VALUE | D129: $C$2 | E129: C$2 | F129: '[Book1]Sheet1'!$C2
B132: Addtoolbar | C132: FORMULA | D132: WILL_NEVER_IMPLEMENT
C133: EXPECTED VALUE | D133: WILL_NEVER_IMPLEMENT
B136: And | C136: FORMULA | D136: =AND(R[-129]C[-2]:R[-127]C[-2],R[-127]C[-1],R[-129]C,R[-129]C[1]) -> 0 | E136: =AND(R[-127]C[-2],R[-121]C[-3]) -> 1 | F136: =AND(R[-129]C[-1]) -> #VALUE! | G136: =AND(R[-129]C[-5]:R[-126]C[-2]) -> 0 | H136: =AND(R[-124]C[-2]:R[-124]C[1]) -> 1 | I136: =AND(R[-122]C[-4],R[-119]C[-4],"1") -> #VALUE! | J136: =AND("1",1) -> #VALUE! | K136: =AND(R[-121]C[-6],R[-123]C[-4]) -> #VALUE! | L136: =AND(R[-121]C[-7]:R[-119]C[-7],R[-123]C[-9]:R[-121]C[-9],R[-127]C[-10]:R[-126]C[-10]) -> 1 | M136: =AND(R[-120]C[-11]:R[-119]C[-11]) -> 0 | N136: =AND(R[-121]C[-12]:R[-120]C[-12]) -> 1 | O136: =AND(R[-119]C[-13]:R[-118]C[-13]) -> 0 | P136: =AND(R[-118]C[-14]:R[-117]C[-14]) -> #VALUE!
C137: EXPECTED VALUE | D137: 0 | E137: 1 | F137: #VALUE! | G137: 0 | H137: 1 | I137: #VALUE! | J137: #VALUE! | K137: #VALUE! | L137: 1 | M137: 0 | N137: 1 | O137: 0 | P137: #VALUE!
B140: Apptitle | C140: FORMULA | D140: WILL_NEVER_IMPLEMENT
C141: EXPECTED VALUE | D141: WILL_NEVER_IMPLEMENT
B144: Areas | C144: FORMULA
C145: EXPECTED VALUE
B148: Argument | C148: FORMULA
C149: EXPECTED VALUE
B152: Asc | C152: FORMULA
C153: EXPECTED VALUE
B156: Asin | C156: FORMULA | D156: =ASIN(R[-149]C[-2]) -> 0 | E156: =ASIN(R[-148]C[-2]) -> 1.0000000000166668E-5 | F156: =ASIN(R[-146]C[-4]) -> #NUM! | G156: =ASIN(R[-143]C[-5]) -> #NUM! | H156: =ASIN(R[-139]C[-6]) -> 0 | I156: =ASIN(R[-140]C[-7]) -> 1.5707963267948966 | J156: =ASIN(R[-149]C[-6]) -> 0 | K156: =ASIN(R[-149]C[-6]) -> #VALUE! | L156: =ASIN(R[-148]C[-6]) -> 1.5707963267948966 | M156: =ASIN(R[-145]C[-4]:R[-145]C) -> 0 | N156: =ASIN(R[-144]C[-6]:R[-144]C[-4]) -> #VALUE! | O156: =ASIN(R[-2]C[-2]:R[1]C[-2]) -> 0 | P156: =ASIN("1") -> 1.5707963267948966
C157: EXPECTED VALUE | D157: 0 | E157: 1.0000000000166668E-5 | F157: #NUM! | G157: #NUM! | H157: 0 | I157: 1.5707963267948966 | J157: 0 | K157: #VALUE! | L157: 1.5707963267948966 | M157: 0 | N157: #VALUE! | O157: 0 | P157: 1.5707963267948966
B160: Asinh | C160: FORMULA | D160: =ASINH(R[-153]C[-2]) -> 0 | E160: =ASINH(R[-152]C[-3]) -> 0.88137358701954294 | F160: =ASINH(R[-149]C[-4]) -> 23.718998110400403 | G160: =ASINH(R[-147]C[-5]) -> -6.9735438962320844 | H160: =ASINH(R[-144]C[-6]) -> 0.88137358701954294 | I160: =ASINH(R[-153]C[-5]) -> 0 | J160: =ASINH(R[-153]C[-5]) -> #VALUE! | K160: =ASINH("") -> #VALUE! | L160: =ASINH("1") -> 0.88137358701954294 | M160: =ASINH(R[-150]C[-3]:R[-150]C) -> #VALUE! | N160: =ASINH(R[-149]C[-2]:R[-149]C[1]) -> 0 | O160: =ASINH(R[-2]C[-3]:R[1]C[-3]) -> 0.79495776876387869 | P160: =ASINH(R[-151]C[-1]:R[-149]C) -> #VALUE!
C161: EXPECTED VALUE | D161: 0 | E161: 0.88137358701954294 | F161: 23.718998110400403 | G161: -6.9735438962311251 | H161: 0.88137358701954294 | I161: 0 | J161: #VALUE! | K161: #VALUE! | L161: 0.88137358701954294 | M161: #VALUE! | N161: 0 | O161: 0.79495776876387869 | P161: #VALUE!
B164: Atan | C164: FORMULA | D164: =ATAN(R[-157]C[-2]) -> 0 | E164: =ATAN(R[-154]C[-3]) -> 1.5689236698079085 | F164: =ATAN(R[-148]C[-4]) -> 0.78539816339744828 | G164: =ATAN(R[-157]C[-3]) -> 0 | H164: =ATAN(R[-157]C[-3]) -> #VALUE! | I164: =ATAN(R[-149]C[-4]) -> 0.78539816339744828 | J164: =ATAN("1") -> 0.78539816339744828 | K164: =ATAN(R[-152]C[-5]) -> #VALUE! | L164: =ATAN(R[-154]C[-6]) -> 9.9999999996666679E-6 | M164: =ATAN(R[-154]C[-2]:R[-154]C[1]) -> #VALUE! | N164: =ATAN(R[-153]C[-2]:R[-153]C) -> 0 | O164: =ATAN(R[-2]C[-1]:R[1]C[-1]) -> 0 | P164: =ATAN(R[-157]C[-1]:R[-156]C) -> #VALUE!
C165: EXPECTED VALUE | D165: 0 | E165: 1.5689236698079085 | F165: 0.78539816339744828 | G165: 0 | H165: #VALUE! | I165: 0.78539816339744828 | J165: 0.78539816339744828 | K165: #VALUE! | L165: 9.9999999996666679E-6 | M165: #VALUE! | N165: 0 | O165: 0 | P165: #VALUE!
B168: Atan2 | C168: FORMULA | D168: =ATAN2(R[-161]C[-2],R[-161]C[-2]) -> #DIV/0! | E168: =ATAN2(R[-161]C[-3],R[-160]C[-3]) -> 1.5707963267948966 | F168: =ATAN2(R[-156]C[-4],R[-159]C[-3]) -> 3.1415926534797931 | G168: =ATAN2(R[-153]C[-5],R[-152]C[-5]) -> 2.3561944901923448 | H168: =ATAN2(R[-150]C[-6],R[-152]C[-6]) -> #VALUE! | I168: =ATAN2(R[-156]C[-2]:R[-156]C,R[-159]C[1]) -> 1.4952630018344298E-2 | J168: =ATAN2(R[-1]C[-1]:R[1]C[-1],R[-157]C[-1]:R[-157]C[1]) -> 6.6877856917807108E-4 | K168: =ATAN2(R[-161]C:R[-160]C,R[-159]C[-1]:R[-159]C) -> #VALUE! | L168: =ATAN2(R[-159]C[-1]:R[-158]C,2) -> #VALUE! | M168: =ATAN2("1",TRUE) -> 0.78539816339744828 | N168: =ATAN2(1,0) -> 0 | O168: =ATAN2(#N/A,#NAME?) -> #N/A
C169: EXPECTED VALUE | D169: #DIV/0! | E169: 1.5707963267948966 | F169: 3.1415926534797931 | G169: 2.3561944901923448 | H169: #VALUE! | I169: 1.4952630018344298E-2 | J169: 6.6877856917807108E-4 | K169: #VALUE! | L169: #VALUE! | M169: 0.78539816339744828 | N169: 0 | O169: #N/A
B172: Atanh | C172: FORMULA | D172: =ATANH(R[-165]C[-2]) -> 0 | E172: =ATANH(R[-163]C[-2]) -> #NUM! | F172: =ATANH(R[-159]C[-4]) -> #NUM! | G172: =ATANH(R[-156]C[-5]) -> #NUM! | H172: =ATANH(R[-155]C[-6]) -> 0 | I172: =ATANH(R[-165]C[-4]) -> #VALUE! | J172: =ATANH(R[-160]C[-4]) -> #VALUE! | K172: =ATANH(R[-165]C:R[-165]C[2]) -> #NUM! | L172: =ATANH(R[-161]C[-1]:R[-161]C[1]) -> 0 | M172: =ATANH(R[-1]C[-1]:R[1]C[-1]) -> 0 | N172: =ATANH(R[-163]C[-1]:R[-162]C[1]) -> #VALUE!
C173: EXPECTED VALUE | D173: 0 | E173: #NUM! | F173: #NUM! | G173: #NUM! | H173: 0 | I173: #VALUE! | J173: #VALUE! | K173: #NUM! | L173: 0 | M173: 0 | N173: #VALUE!
B176: Avedev | C176: FORMULA | D176: =AVEDEV(R[-169]C[-2]:R[-169]C[-1],R[-165]C[-1],R[-160]C[-2]:R[-159]C[-2]) -> 1.3333288888888888 | E176: =AVEDEV(R[-169]C[-2]:R[-167]C[-1]) -> 0.48888666666666669 | F176: =AVEDEV(R[-169]C[-2]:R[-167]C[-1]) -> #NUM! | G176: =AVEDEV(R[-163]C[-2]:R[-159]C[-2]) -> #NUM! | H176: =AVEDEV(R[-169]C[-5]:R[-165]C[-3]) -> 0.8239943999999999 | I176: =AVEDEV(R[-169]C[-6]:R[-165]C[-6]) -> 0.8239943999999999 | J176: =AVEDEV(R[-168]C[-4]:R[-166]C[-2]) -> 2187499999.3499279 | K176: =AVEDEV(R[-169]C[-3]:R[-166]C[-1]) -> 1.0796920000000001 | L176: =AVEDEV(TRUE, FALSE) -> 0.5
C177: EXPECTED VALUE | D177: 1.3333288888888888 | E177: 0.48888666666666669 | F177: #NUM! | G177: #NUM! | H177: 0.8239943999999999 | I177: 0.8239943999999999 | J177: 2187499999.3499279 | K177: 1.0796920000000001 | L177: 0.5
B180: Average | C180: FORMULA | D180: =AVERAGE(R[-173]C[-2]:R[-165]C[-1],R[-164]C[-2]:R[-163]C[-1],R[-172]C:R[-164]C) -> -4.0893554731909327E-9 | E180: =AVERAGE(R[-173]C[-1]:R[-165]C[-1]) -> #DIV/0! | F180: =AVERAGE(R[-171]C[-2]:R[-164]C[-1]) -> #DIV/0! | G180: =AVERAGE("1",R[-172]C[-5]:R[-171]C[-5]) -> 1.3333333333333333 | H180: =AVERAGE(R[-169]C[-2],R[-172]C[-1]) -> 0.50049999999999994 | I180: =AVERAGE(R[-172]C[-3]:R[-170]C[-1]) -> 1250000001.6002886 | J180: =AVERAGE(TRUE, FALSE) -> 0.5
C181: EXPECTED VALUE | D181: -4.0893554731909327E-9 | E181: #DIV/0! | F181: #DIV/0! | G181: 1.3333333333333333 | H181: 0.50049999999999994 | I181: 1250000001.6002886 | J181: 0.5
B184: Averagea | C184: FORMULA
C185: EXPECTED VALUE
B188: Betadist | C188: FORMULA
C189: EXPECTED VALUE
B192: Betainv | C192: FORMULA
C193: EXPECTED VALUE
B196: Binomdist | C196: FORMULA
C197: EXPECTED VALUE
B200: Bin2Dec | C200: FORMULA | D200: =BIN2DEC(1100100) -> 100 | E200: =BIN2DEC(1111111111) -> -1 | F200: =BIN2DEC(111111) -> 63 | G200: =BIN2DEC(101010101) -> 341 | H200: =BIN2DEC(11001001100100) -> #NUM!
C201: EXPECTED VALUE | D201: 100 | E201: -1 | F201: 63 | G201: 341 | H201: #NUM!
B204: Call | C204: FORMULA | D204: WILL_NEVER_IMPLEMENT
C205: EXPECTED VALUE | D205: WILL_NEVER_IMPLEMENT
B208: Caller | C208: FORMULA | D208: WILL_NEVER_IMPLEMENT
C209: EXPECTED VALUE | D209: WILL_NEVER_IMPLEMENT
B212: Cancelkey | C212: FORMULA
C213: EXPECTED VALUE
B216: Ceiling | C216: FORMULA | D216: =CEILING(R[-206]C[-2],R[-207]C[-2]) -> 534 | E216: =CEILING(R[-205]C[-2],R[-207]C[-2]) -> 3.3000000000000003 | F216: =CEILING(R[-207]C[-2],R[-206]C[-2]) -> 0 | G216: =CEILING(R[-204]C[-4],R[-205]C[-3]) -> 0 | H216: =CEILING(R[-199]C[-3],R[-201]C[-3]) -> 3 | I216: =CEILING(R[-203]C[-3],R[-206]C[-3]) -> 2.9999900000000004 | J216: =CEILING(R[-207]C[-1]:R[-207]C,R[-2]C[-2]:R[1]C[-2]) -> 9 | K216: =CEILING(R[-208]C[-1]:R[-207]C,1) -> #VALUE! | L216: =CEILING(R[-206]C[-5],R[-209]C[-5]) -> #VALUE! | M216: =CEILING(0,0) -> 0
C217: EXPECTED VALUE | D217: 534 | E217: 3.3 | F217: 0 | G217: 0 | H217: 3 | I217: 2.9999900000000004 | J217: 9 | K217: #VALUE! | L217: #VALUE! | M217: 0
B220: Cell | C220: FORMULA
C221: EXPECTED VALUE
B224: Char | C224: FORMULA | D224: =CHAR(65) -> A | E224: =CHAR(33) -> ! | F224: =CHAR(-1) -> #VALUE!
C225: EXPECTED VALUE | D225: A | E225: ! | F225: #VALUE!
B228: Checkcommand | C228: FORMULA | D228: WILL_NEVER_IMPLEMENT
C229: EXPECTED VALUE | D229: WILL_NEVER_IMPLEMENT
B232: Chidist | C232: FORMULA
C233: EXPECTED VALUE
B236: Chiinv | C236: FORMULA
C237: EXPECTED VALUE
B240: Chitest | C240: FORMULA
C241: EXPECTED VALUE
B244: Choose | C244: FORMULA | D244: =CHOOSE(1,2,3) -> 2 | E244: =CHOOSE(#REF!, 1) -> #REF! | F244: =CHOOSE(2,#N/A,#NULL!) -> #NULL! | G244: =CHOOSE(2,#REF!,3) -> 3 | H244: =CHOOSE(1.9,5,6) -> 5
C245: EXPECTED VALUE | D245: 2 | E245: #REF! | F245: #NULL! | G245: 3 | H245: 5
B248: Clean | C248: FORMULA | D248: =CLEAN(CHAR(7)&"text"&CHAR(7)) -> text
C249: EXPECTED VALUE | D249: text
B252: Code | C252: FORMULA
C253: EXPECTED VALUE
B256: Column | C256: FORMULA | D256: =COLUMN(R[-249]C[-1]) -> 3 | E256: =COLUMN(R[-255]:R[-254]) -> 1 | F256: =COLUMN(R[-249]C[-4]:R[-245]C[-4]) -> 2 | G256: =COLUMN(R[-245]C[-5]:R[-245]C[-3]) -> 2 | H256: =COLUMN(R[-241]C[-3]:R[-237]C[-1]) -> 5 | I256: =COLUMN(R[-239]C[-2]:R[-235]C[-1]) -> 7
C257: EXPECTED VALUE | D257: 3 | E257: 1 | F257: 2 | G257: 2 | H257: 5 | I257: 7
B260: Columns | C260: FORMULA | D260: =COLUMNS(R[-259]C[-1]:R[-256]C[1]) -> 3
C261: EXPECTED VALUE | D261: 3
B264: Combin | C264: FORMULA | D264: =COMBIN(R[-255]C[-2],R[-256]C[-2]) -> 2 | E264: =COMBIN(19,7) -> 50388.000000000007 | F264: =COMBIN(R[-251]C[-1]:R[-251]C[1],2) -> 1 | G264: =COMBIN(R[-251]C[-2]:R[-251]C[-1],1) -> #VALUE! | H264: =COMBIN(R[-249]C[-3],R[-247]C[-3]) -> #NUM! | I264: =COMBIN(R[-249]C[-6],R[-248]C[-6]) -> #NUM! | J264: =COMBIN(-23,12) -> #NUM! | K264: =COMBIN(99,1) -> 99 | L264: =COMBIN(23,R[-1]C[-8]:R[1]C[-8]) -> 253
C265: EXPECTED VALUE | D265: 2 | E265: 50388 | F265: 1 | G265: #VALUE! | H265: #NUM! | I265: #NUM! | J265: #NUM! | K265: 99 | L265: 253
B268: Concatenate | C268: FORMULA | D268: =CONCATENATE(R[-261]C[-2],R[-253]C[-2]) -> 0-1 | E268: =CONCATENATE(R[-252]C[-3],R[-250]C[-3]) -> TRUETRUE | F268: =CONCATENATE(R[-259]C[-3],R[-254]C[-2],R[-254]C[-4],R[-251]C[-4]) -> 1.1-2FALSE | G268: =CONCATENATE(R[-259]C[-2],R[-256]C[-1]) -> sp ace ssp ace s | H268: =CONCATENATE(R[-255]C[-2],R[-252]C[-3]) -> 2.999991.1 | I268: =CONCATENATE(R[-258]C[-2]:R[-258]C[1],R[-1]C[-3]:R[1]C[-3]) -> ric1.1-2FALSE | J268: =CONCATENATE(R[-255]C[-4]:R[-253]C[-3],R[-252]C[-5]) -> #VALUE! | K268: =CONCATENATE(R[-260]C:R[-259]C[1],R[-258]C) -> #VALUE!
C269: EXPECTED VALUE | D269: 0-1 | E269: TRUETRUE | F269: 1.1-2FALSE | G269: sp ace ssp ace s | H269: 2.999991.1 | I269: ric1.1-2FALSE | J269: #VALUE! | K269: #VALUE!
B272: Confidence | C272: FORMULA
C273: EXPECTED VALUE
B276: Correl | C276: FORMULA
C277: EXPECTED VALUE
B280: Cos | C280: FORMULA | D280: =COS(R[-273]C) -> 1 | E280: =COS(R[-273]C) -> #VALUE! | F280: =COS(R[-265]C[-1]) -> 0.54030230586813977 | G280: =COS("1") -> 0.54030230586813977 | H280: =COS(R[-264]C[-6]) -> 0.54030230586813977 | I280: =COS(R[-263]C[-7]) -> 1 | J280: =COS(R[-262]C[-8]) -> #VALUE! | K280: =COS(R[-268]C[-3]:R[-268]C[1]) -> 1 | L280: =COS(R[-2]C[-1]:R[1]C[-1]) -> 0.54030230586813977 | M280: =COS(R[-269]C[-7]) -> 1 | N280: =COS(R[-272]C[-5]:R[-272]C[-3]) -> #VALUE! | O280: =COS(R[-272]C[-4]:R[-270]C[-4]) -> #VALUE!
C281: EXPECTED VALUE | D281: 1 | E281: #VALUE! | F281: 0.54030230586813977 | G281: 0.54030230586813977 | H281: 0.54030230586813977 | I281: 1 | J281: #VALUE! | K281: 1 | L281: 0.54030230586813977 | M281: 1 | N281: #VALUE! | O281: #VALUE!
B284: Cosh | C284: FORMULA | D284: =COSH(R[-277]C[-2]) -> 1 | E284: =COSH(R[-276]C[-2]) -> 1.00000000005 | F284: =COSH(R[-271]C[-4]) -> 4.0947118061319582E+231 | G284: =COSH(R[-268]C[-5]) -> 1.5430806348152437 | H284: =COSH(R[-266]C[-6]) -> #VALUE! | I284: =COSH(R[-276]C[-5]) -> 1 | J284: =COSH(R[-277]C[-5]) -> #VALUE! | K284: =COSH(R[-269]C[-6]) -> 1.5430806348152437 | L284: =COSH(R[-274]C[-3]:R[-274]C) -> 45.014120148530026 | M284: =COSH(R[-1]C[-2]:R[1]C[-2]) -> 2.4463520074491623 | N284: =COSH(R[-276]C[-1]:R[-275]C) -> #VALUE!
C285: EXPECTED VALUE | D285: 1 | E285: 1.00000000005 | F285: 4.0947118061319582E+231 | G285: 1.5430806348152437 | H285: #VALUE! | I285: 1 | J285: #VALUE! | K285: 1.5430806348152437 | L285: 45.014120148530026 | M285: 2.4463520074491623 | N285: #VALUE!
B288: Count | C288: FORMULA | D288: =COUNT(R[-280]C[-2]:R[-279]C[1]) -> 4 | E288: =COUNT(R[-278]C:R[-275]C[1]) -> 2 | F288: =COUNT(2, "A",  "",#REF!, #DIV/0!) -> 1
C289: EXPECTED VALUE | D289: 4 | E289: 2 | F289: 1
B292: Counta | C292: FORMULA | D292: =COUNTA(R[-283]C[-1]:R[-281]C) -> 3 | E292: =COUNTA(R[-282]C:R[-279]C[1]) -> 8 | F292: =COUNTA(2, "A",  "",#REF!, #DIV/0!) -> 5
C293: EXPECTED VALUE | D293: 3 | E293: 8 | F293: 5
B296: Countblank | C296: FORMULA | D296: =COUNTBLANK(R[-288]C[-2]:R[-287]C[1]) -> 2 | E296: =COUNTBLANK(R[-286]C[2]:R[-278]C[2]) -> 6
C297: EXPECTED VALUE | D297: 2 | E297: 6
B300: Countif | C300: FORMULA | D300: =COUNTIF(R[-293]C[6]:R[-290]C[7], 4) -> 2 | E300: =COUNTIF(R[-293]C[22]:R[-287]C[22], 1/0) -> 1 | F300: =COUNTIF(R[-293]C[1]:R[-293]C[5],R[-292]C[-1]:R[-292]C[1]) -> 2
C301: EXPECTED VALUE | D301: 2 | E301: 1 | F301: 2
B304: Covar | C304: FORMULA
C305: EXPECTED VALUE
B308: Createobject | C308: FORMULA | D308: WILL_NEVER_IMPLEMENT
C309: EXPECTED VALUE | D309: WILL_NEVER_IMPLEMENT
B312: Critbinom | C312: FORMULA
C313: EXPECTED VALUE
B316: Customrepeat | C316: FORMULA
C317: EXPECTED VALUE
B320: Customundo | C320: FORMULA | D320: WILL_NEVER_IMPLEMENT
C321: EXPECTED VALUE | D321: WILL_NEVER_IMPLEMENT
B324: Date | C324: FORMULA | D324: =DATE(1900, 1, 1) -> 1 | E324: =DATE(1900, 1, 32) -> 32 | F324: =DATE(1900, 222, 1) -> 6727 | G324: =DATE(2007, 1, 1) -> 39083 | H324: =DATE(1900, 2, 29) -> 60 | I324: =DATE(1900, 1, 22222) -> 22222 | J324: =DATE(R[-316]C[-8],R[-315]C[-8],R[-314]C[-7]) -> 398 | K324: =DATE(R[-316]C[-8],R[-315]C[-8],R[-314]C[-8]) -> 1 | L324: =DATE(R[-316]C[-7],R[-315]C[-7],R[-314]C[-7]) -> #VALUE!
C325: EXPECTED VALUE | D325: 1 | E325: 32 | F325: 6727 | G325: 39083 | H325: 60 | I325: 22222 | J325: 398 | K325: 1 | L325: #VALUE!
B328: Datedif | C328: FORMULA
C329: EXPECTED VALUE
B332: Datestring | C332: FORMULA
C333: EXPECTED VALUE
B336: Datevalue | C336: FORMULA
C337: EXPECTED VALUE
B340: Daverage | C340: FORMULA
C341: EXPECTED VALUE
B344: Day | C344: FORMULA | D344: =DAY(R[-324]C[-1]) -> 25 | E344: =DAY(1) -> 1 | F344: =DAY(0) -> 0 | G344: =DAY(R[-328]C[-4]) -> #NUM! | H344: =DAY(#DIV/0!) -> #DIV/0!
C345: EXPECTED VALUE | D345: 25 | E345: 1 | F345: 0 | G345: #NUM! | H345: #DIV/0!
B348: Days360 | C348: FORMULA | D348: =DAYS360(R[-338]C[-2],R[-338]C[-1]) -> -526 | E348: =DAYS360(DATE(1972,2,16), DATE(2012,2,16)) -> 14400 | F348: =DAYS360(DATE(2008,1,16), DATE(2008,5,16)) -> 120
C349: EXPECTED VALUE | D349: -526 | E349: 14400 | F349: 120
B352: Db | C352: FORMULA | D352: WILL_NEVER_IMPLEMENT
C353: EXPECTED VALUE | D353: WILL_NEVER_IMPLEMENT
B356: Dbcs | C356: FORMULA | D356: WILL_NEVER_IMPLEMENT
C357: EXPECTED VALUE | D357: WILL_NEVER_IMPLEMENT
B360: Dcount | C360: FORMULA
C361: EXPECTED VALUE
B364: Dcounta | C364: FORMULA
C365: EXPECTED VALUE
B368: Ddb | C368: FORMULA
C369: EXPECTED VALUE
B372: Dec2Bin | C372: FORMULA | D372: =DEC2BIN(9, 4) -> 1001 | E372: =DEC2BIN(-100) -> 1110011100 | F372: =DEC2BIN(-513) -> #NUM! | G372: =DEC2BIN(-512) -> 1000000000 | H372: =DEC2BIN(513) -> #NUM! | I372: =DEC2BIN(511) -> 111111111 | J372: =DEC2BIN("ABCDEF") -> #VALUE! | K372: =DEC2BIN(511,9.5) -> 111111111 | L372: =DEC2BIN(511,"ABCDEF") -> #VALUE! | M372: =DEC2BIN(511,0) -> #NUM! | N372: =DEC2BIN(511,-1) -> #NUM! | O372: =DEC2BIN(511,5) -> #NUM!
C373: EXPECTED VALUE | D373: 1001 | E373: 1110011100 | F373: #NUM! | G373: 1000000000 | H373: #NUM! | I373: 111111111 | J373: #VALUE! | K373: 111111111 | L373: #VALUE! | M373: #NUM! | N373: #NUM! | O373: #NUM!
B376: De2cHex | C376: FORMULA | D376: =DEC2HEX(100,2) -> 64 | E376: =DEC2HEX(100,4) -> 0064 | F376: =DEC2HEX(100,5) -> 00064 | G376: =DEC2HEX(100,10) -> 0000000064 | H376: =DEC2HEX(-54) -> FFFFFFFFCA | I376: =DEC2HEX(-54, 2) -> FFFFFFFFCA | J376: =DEC2HEX(55678,10) -> 000000D97E | K376: =DEC2HEX(55678,4) -> D97E | L376: =DEC2HEX(55678) -> D97E | M376: =DEC2HEX(-549755813889) -> #NUM! | N376: =DEC2HEX(549755813888) -> #NUM! | O376: =DEC2HEX(549755813888, -10) -> #NUM! | P376: =DEC2HEX("ABCDEF") -> #VALUE!
C377: EXPECTED VALUE | D377: 64 | E377: 0064 | F377: 00064 | G377: 0000000064 | H377: FFFFFFFFCA | I377: FFFFFFFFCA | J377: 000000D97E | K377: D97E | L377: D97E | M377: #NUM! | N377: #NUM! | O377: #NUM! | P377: #VALUE!
B380: Degrees | C380: FORMULA | D380: =DEGREES(R[-373]C[-2]) -> 0 | E380: =DEGREES(R[-372]C[-3]) -> 57.295779513082323 | F380: =DEGREES(R[-367]C[-4]) -> -30595.946259985962 | G380: =DEGREES(R[-364]C[-5]) -> 57.295779513082323 | H380: =DEGREES(R[-373]C[-4]) -> 0 | I380: =DEGREES(R[-373]C[-4]) -> #VALUE! | J380: =DEGREES("1") -> 57.295779513082323 | K380: =DEGREES(R[-365]C[-6]) -> 57.295779513082323 | L380: =DEGREES(R[-369]C[-6]) -> 0 | M380: =DEGREES(R[-372]C[-2]:R[-372]C[1]) -> 171.88733853924697 | N380: =DEGREES(R[-10]C[-2]:R[1]C[-2]) -> 0 | O380: =DEGREES(R[-372]C[-1]:R[-371]C) -> #VALUE!
C381: EXPECTED VALUE | D381: 0 | E381: 57.295779513082323 | F381: -30595.946259985962 | G381: 57.295779513082323 | H381: 0 | I381: #VALUE! | J381: 57.295779513082323 | K381: 57.295779513082323 | L381: 0 | M381: 171.88733853924697 | N381: 0 | O381: #VALUE!
B384: Deletebar | C384: FORMULA | D384: WILL_NEVER_IMPLEMENT
C385: EXPECTED VALUE | D385: WILL_NEVER_IMPLEMENT
B388: Deletecommand | C388: FORMULA | D388: WILL_NEVER_IMPLEMENT
C389: EXPECTED VALUE | D389: WILL_NEVER_IMPLEMENT
B392: Deletemenu | C392: FORMULA | D392: WILL_NEVER_IMPLEMENT
C393: EXPECTED VALUE | D393: WILL_NEVER_IMPLEMENT
B396: Deletetoolbar | C396: FORMULA | D396: WILL_NEVER_IMPLEMENT
C397: EXPECTED VALUE | D397: WILL_NEVER_IMPLEMENT
B400: Deref | C400: FORMULA
C401: EXPECTED VALUE
B404: Devsq | C404: FORMULA | D404: =DEVSQ(R[-397]C[-2]:R[-395]C[-2]) -> 2 | E404: =DEVSQ(R[-397]C[-3]:R[-395]C[-3],R[-397]C[-2]:R[-395]C[-2],R[-389]C[-3]:R[-387]C[-3]) -> 5.8371340000857153 | F404: =DEVSQ(R[-391]C[-4]:R[-390]C[-2]) -> 749730712528.75537 | G404: =DEVSQ(R[-397]C[-3]:R[-395]C[-3],R[-395]C[-4]) -> 0 | H404: =DEVSQ(R[-389]C[-3]:R[-387]C[-3]) -> #NUM! | I404: =DEVSQ("1","2",2) -> 0.66666666666666663 | J404: =DEVSQ(R[-394]C[-4],R[-397]C[-1]) -> 4.4999700000499994
C405: EXPECTED VALUE | D405: 2 | E405: 5.8371340000857153 | F405: 749730712528.75537 | G405: 0 | H405: #NUM! | I405: 0.66666666666666663 | J405: 4.4999700000499994
B408: Dget | C408: FORMULA | D408: WILL_NEVER_IMPLEMENT
C409: EXPECTED VALUE | D409: WILL_NEVER_IMPLEMENT
B412: Dialogbox | C412: FORMULA | D412: WILL_NEVER_IMPLEMENT
C413: EXPECTED VALUE | D413: WILL_NEVER_IMPLEMENT
B416: Directory | C416: FORMULA
C417: EXPECTED VALUE
B420: Dmax | C420: FORMULA
C421: EXPECTED VALUE
B424: Dmin | C424: FORMULA
C425: EXPECTED VALUE
B428: Documents | C428: FORMULA | D428: WILL_NEVER_IMPLEMENT
C429: EXPECTED VALUE | D429: WILL_NEVER_IMPLEMENT
B432: Dollar | C432: FORMULA | D432: =DOLLAR(R[-425]C[-2]) -> $0.00 | E432: =DOLLAR(R[-424]C[-3]) -> $1.00 | F432: =DOLLAR(R[-416]C[-4]) -> $1.00 | G432: =DOLLAR(R[-425]C[-3]) -> $0.00 | H432: =DOLLAR(R[-417]C[-5]) -> ($1.00) | I432: =DOLLAR(R[-425]C[-4]) -> #VALUE! | J432: =DOLLAR(R[-417]C[-5]) -> $1.00 | K432: =DOLLAR(R[-423]C[-2]:R[-423]C[1]) -> $3.00 | L432: =DOLLAR(R[-2]C[-2]:R[1]C[-2]) -> $1.00 | M432: =DOLLAR(R[-423]C[-2]:R[-422]C[-1]) -> #VALUE! | N432: =DOLLAR(R[-422]C[-7]) -> #VALUE!
C433: EXPECTED VALUE | D433: 0 | E433: 1 | F433: 1 | G433: 0 | H433: -1.0000100000000001 | I433: #VALUE! | J433: 1 | K433: 3 | L433: 1 | M433: #VALUE! | N433: #VALUE!
B436: Dproduct | C436: FORMULA
C437: EXPECTED VALUE
B440: Dstdev | C440: FORMULA
C441: EXPECTED VALUE
B444: Dstdevp | C444: FORMULA
C445: EXPECTED VALUE
B448: Dsum | C448: FORMULA
C449: EXPECTED VALUE
B452: Dvar | C452: FORMULA
C453: EXPECTED VALUE
B456: Dvarp | C456: FORMULA
C457: EXPECTED VALUE
B460: Echo | C460: FORMULA
C461: EXPECTED VALUE
B464: Enablecommand | C464: FORMULA | D464: WILL_NEVER_IMPLEMENT
C465: EXPECTED VALUE | D465: WILL_NEVER_IMPLEMENT
B468: Enabletool | C468: FORMULA | D468: WILL_NEVER_IMPLEMENT
C469: EXPECTED VALUE | D469: WILL_NEVER_IMPLEMENT
B472: Error.type | C472: FORMULA | D472: =ERROR.TYPE(R[-465]C[23]) -> 1 | E472: =ERROR.TYPE(R[-464]C[22]) -> 2 | F472: =ERROR.TYPE(R[-463]C[21]) -> 3 | G472: =ERROR.TYPE(R[-462]C[20]) -> 4 | H472: =ERROR.TYPE(R[-461]C[19]) -> 5 | I472: =ERROR.TYPE(R[-460]C[18]) -> 6 | J472: =ERROR.TYPE(R[-459]C[17]) -> 7 | K472: =ERROR.TYPE(R[-458]C[-10]) -> #N/A
C473: EXPECTED VALUE | D473: 1 | E473: 2 | F473: 3 | G473: 4 | H473: 5 | I473: 6 | J473: 7 | K473: #N/A
B476: Errortype | C476: FORMULA
C477: EXPECTED VALUE
B480: Evaluate | C480: FORMULA
C481: EXPECTED VALUE
B484: Even | C484: FORMULA | D484: =EVEN(R[-477]C[-2]) -> 0 | E484: =EVEN(R[-477]C[-2]) -> 0 | F484: =EVEN(R[-475]C[-3]) -> 2 | G484: =EVEN(R[-469]C[-4]) -> -2 | H484: =EVEN(R[-467]C[-5]) -> -2 | I484: =EVEN(R[-477]C[-5]) -> 0 | J484: =EVEN(R[-477]C[-5]) -> #VALUE! | K484: =EVEN(R[-468]C[-6]) -> 2 | L484: =EVEN(R[-474]C[-6]) -> 2 | M484: =EVEN(R[-473]C[-3]:R[-473]C) -> 0 | N484: =EVEN(R[-2]C[-2]:R[1]C[-2]) -> 2
C485: EXPECTED VALUE | D485: 0 | E485: 0 | F485: 2 | G485: -2 | H485: -2 | I485: 0 | J485: #VALUE! | K485: 2 | L485: 2 | M485: 0 | N485: 2
B488: Exact | C488: FORMULA | D488: =EXACT(123,"123") -> 1 | E488: =EXACT(TRUE,R[-470]C[-3]) -> 1 | F488: =EXACT(R[-479]C[-3],R[-472]C[-3]) -> 0 | G488: =EXACT(R[-475]C[-2],R[-474]C[-2]) -> 0 | H488: =EXACT(R[-480]C[-4],R[-479]C[-4]) -> 1 | I488: =EXACT(R[-479]C[-4],R[-476]C[-3]) -> 1 | J488: =EXACT(R[-476]C[-4]:R[-476]C[-3],R[-476]C[-4]:R[-476]C[-3]) -> #VALUE! | K488: =EXACT(R[-479]C[-1]:R[-479]C[1],R[-479]C) -> 1 | L488: =EXACT(R[-1]C[-4]:R[1]C[-4],R[-470]C[-10]) -> 1
C489: EXPECTED VALUE | D489: 1 | E489: 1 | F489: 0 | G489: 0 | H489: 1 | I489: 1 | J489: #VALUE! | K489: 1 | L489: 1
B492: Exec | C492: FORMULA | D492: WILL_NEVER_IMPLEMENT
C493: EXPECTED VALUE | D493: WILL_NEVER_IMPLEMENT
B496: Execute | C496: FORMULA | D496: WILL_NEVER_IMPLEMENT
C497: EXPECTED VALUE | D497: WILL_NEVER_IMPLEMENT
B500: Exp | C500: FORMULA | D500: =EXP(R[-492]C[-2]) -> 2.7182818284590451 | E500: =EXP(R[-493]C[-3]) -> 1 | F500: =EXP(R[-483]C[-4]) -> 1 | G500: =EXP(R[-485]C[-5]) -> 0.36787944117144233 | H500: =EXP(R[-484]C[-6]) -> 2.7182818284590451 | I500: =EXP(R[-485]C[-4]) -> 2.7182818284590451 | J500: =EXP(R[-490]C[-5]) -> #VALUE! | K500: =EXP(R[-488]C[-3]:R[-488]C[1]) -> 1 | L500: =EXP(R[-2]C[-1]:R[1]C[-1]) -> 2.7182818284590451
C501: EXPECTED VALUE | D501: 2.7182818284590451 | E501: 1 | F501: 1 | G501: 0.36787944117144233 | H501: 2.7182818284590451 | I501: 2.7182818284590451 | J501: #VALUE! | K501: 1 | L501: 2.7182818284590451
B504: Expondist | C504: FORMULA
C505: EXPECTED VALUE
B508: Externalflag | C508: FORMULA | D508: NOT_A_FUNCTION
C509: EXPECTED VALUE | D509: NOT_A_FUNCTION
B512: Fact | C512: FORMULA | D512: =FACT(1) -> 1 | E512: =FACT(0) -> 1 | F512: =FACT(R[-503]C[-4]) -> 2 | G512: =FACT(R[-501]C[-4]) -> 2 | H512: =FACT(15) -> 1307674368000 | I512: =FACT(R[-496]C[-7]) -> 1 | J512: =FACT(R[-494]C[-8]) -> #VALUE! | K512: =FACT(R[-503]C[-7]) -> 1 | L512: =FACT(R[-497]C[-9]) -> #NUM! | M512: =FACT(R[-498]C[-11]) -> #NUM! | N512: =FACT(R[-495]C[-9]) -> 2 | P512: =FACT(R[-500]C[-9]) -> #VALUE! | Q512: =FACT(R[-504]C[-11]) -> 1 | R512: =FACT(R[-504]C[-11]) -> 1 | S512: =FACT(R[-2]C[-12]:R[1]C[-12]) -> 2 | T512: =FACT(R[-501]C[-11]:R[-501]C[-10]) -> #VALUE!
C513: EXPECTED VALUE | D513: 1 | E513: 1 | F513: 2 | G513: 2 | H513: 1307674368000 | I513: 1 | J513: #VALUE! | K513: 1 | L513: #NUM! | M513: #NUM! | N513: 2 | P513: #VALUE! | Q513: 1 | R513: 1 | S513: 2 | T513: #VALUE!
B516: FactDouble | C516: FORMULA | D516: =FACTDOUBLE(6) -> 48 | E516: =FACTDOUBLE(7) -> 105 | F516: =FACTDOUBLE(12) -> 46080 | G516: =FACTDOUBLE(20) -> 3715891200 | H516: =FACTDOUBLE(1) -> 1 | I516: =FACTDOUBLE(0) -> 1 | J516: =FACTDOUBLE(2) -> 2 | K516: =FACTDOUBLE("ABCDEFGHI") -> #VALUE! | L516: =FACTDOUBLE(-7) -> #NUM! | M516: =FACTDOUBLE(10.01) -> 3840
C517: EXPECTED VALUE | D517: 48 | E517: 105 | F517: 46080 | G517: 3715891200 | H517: 1 | I517: 1 | J517: 2 | K517: #VALUE! | L517: #NUM! | M517: 3840
B520: False | C520: FORMULA | D520: =FALSE() -> 0
C521: EXPECTED VALUE | D521: 0
B524: Fclose | C524: FORMULA | D524: WILL_NEVER_IMPLEMENT
C525: EXPECTED VALUE | D525: WILL_NEVER_IMPLEMENT
B528: Fdist | C528: FORMULA
C529: EXPECTED VALUE
B532: Files | C532: FORMULA | D532: WILL_NEVER_IMPLEMENT
C533: EXPECTED VALUE | D533: WILL_NEVER_IMPLEMENT
B536: Find | C536: FORMULA | D536: =FIND("o",R[-528]C[1]) -> 2 | E536: =FIND("O",R[-528]C) -> #VALUE! | F536: =FIND("Space",R[-526]C[-1]) -> 9 | G536: =FIND("s",R[-527]C[-2]) -> 1 | H536: =FIND("s",R[-527]C[-3],3) -> 8
C537: EXPECTED VALUE | D537: 2 | E537: #VALUE! | F537: 9 | G537: 1 | H537: 8
B540: Findb | C540: FORMULA
C541: EXPECTED VALUE
B544: Finv | C544: FORMULA
C545: EXPECTED VALUE
B548: Fisher | C548: FORMULA
C549: EXPECTED VALUE
B552: Fisherinv | C552: FORMULA
C553: EXPECTED VALUE
B556: Fixed | C556: FORMULA
C557: EXPECTED VALUE
B560: Floor | C560: FORMULA | D560: =FLOOR(1.002,2) -> 0 | E560: =FLOOR(R[-550]C[-3],R[-551]C[-3]) -> 534 | F560: =FLOOR(R[-546]C[-3],R[-544]C[-3]) -> -2.2000000000000002 | G560: =FLOOR(R[-544]C[-4],R[-545]C[-4]) -> -1.0000100000000001 | H560: =FLOOR(R[-543]C[-5],R[-544]C[-5]) -> 0 | I560: =FLOOR(0,0) -> 0 | J560: =FLOOR(1,0) -> #DIV/0! | K560: =FLOOR(R[-551]C:R[-551]C[1],R[-553]C) -> 3 | L560: =FLOOR(R[-2]C[-6]:R[1]C[-6],RC[-5]) -> -2.0000200000000001 | M560: =FLOOR(R[-553]C[-6]:R[-552]C[-5],R[-550]C[-5]) -> #VALUE!
C561: EXPECTED VALUE | D561: 0 | E561: 534 | F561: -2.2000000000000002 | G561: -1.0000100000000001 | H561: 0 | I561: 0 | J561: #DIV/0! | K561: 3 | L561: -2.0000200000000001 | M561: #VALUE!
B564: Fopen | C564: FORMULA | D564: WILL_NEVER_IMPLEMENT
C565: EXPECTED VALUE | D565: WILL_NEVER_IMPLEMENT
B568: Forecast | C568: FORMULA
C569: EXPECTED VALUE
B572: Formulaconvert | C572: FORMULA
C573: EXPECTED VALUE
B576: Fpos | C576: FORMULA
C577: EXPECTED VALUE
B580: Fread | C580: FORMULA | D580: WILL_NEVER_IMPLEMENT
C581: EXPECTED VALUE | D581: WILL_NEVER_IMPLEMENT
B584: Freadln | C584: FORMULA | D584: WILL_NEVER_IMPLEMENT
C585: EXPECTED VALUE | D585: WILL_NEVER_IMPLEMENT
B588: Frequency | C588: FORMULA
C589: EXPECTED VALUE
B592: Fsize | C592: FORMULA | D592: WILL_NEVER_IMPLEMENT
C593: EXPECTED VALUE | D593: WILL_NEVER_IMPLEMENT
B596: Ftest | C596: FORMULA
C597: EXPECTED VALUE
B600: Fv | C600: FORMULA | D600: =FV(0,0,0) -> 0 | E600: =FV(0.01,10,100) -> -1046.2212541120473 | F600: =FV(0.01,10,R[-584]C[-4]) -> -10.462212541120474
C601: EXPECTED VALUE | D601: 0 | E601: -1046.2212541120473 | F601: -10.462212541120474
B604: Fwrite | C604: FORMULA
C605: EXPECTED VALUE
B608: Fwriteln | C608: FORMULA
C609: EXPECTED VALUE
B612: Gammadist | C612: FORMULA
C613: EXPECTED VALUE
B616: Gammainv | C616: FORMULA
C617: EXPECTED VALUE
B620: Gammaln | C620: FORMULA
C621: EXPECTED VALUE
B624: Geomean | C624: FORMULA
C625: EXPECTED VALUE
B628: Getbar | C628: FORMULA | D628: WILL_NEVER_IMPLEMENT
C629: EXPECTED VALUE | D629: WILL_NEVER_IMPLEMENT
B632: Getcell | C632: FORMULA | D632: WILL_NEVER_IMPLEMENT
C633: EXPECTED VALUE | D633: WILL_NEVER_IMPLEMENT
B636: Getchartitem | C636: FORMULA | D636: WILL_NEVER_IMPLEMENT
C637: EXPECTED VALUE | D637: WILL_NEVER_IMPLEMENT
B640: Getdef | C640: FORMULA | D640: WILL_NEVER_IMPLEMENT
C641: EXPECTED VALUE | D641: WILL_NEVER_IMPLEMENT
B644: Getdocument | C644: FORMULA | D644: WILL_NEVER_IMPLEMENT
C645: EXPECTED VALUE | D645: WILL_NEVER_IMPLEMENT
B648: Getformula | C648: FORMULA | D648: WILL_NEVER_IMPLEMENT
C649: EXPECTED VALUE | D649: WILL_NEVER_IMPLEMENT
B652: Getlinkinfo | C652: FORMULA | D652: WILL_NEVER_IMPLEMENT
C653: EXPECTED VALUE | D653: WILL_NEVER_IMPLEMENT
B656: Getmovie | C656: FORMULA | D656: WILL_NEVER_IMPLEMENT
C657: EXPECTED VALUE | D657: WILL_NEVER_IMPLEMENT
B660: Getname | C660: FORMULA | D660: WILL_NEVER_IMPLEMENT
C661: EXPECTED VALUE | D661: WILL_NEVER_IMPLEMENT
B664: Getnote | C664: FORMULA | D664: WILL_NEVER_IMPLEMENT
C665: EXPECTED VALUE | D665: WILL_NEVER_IMPLEMENT
B668: Getobject | C668: FORMULA | D668: WILL_NEVER_IMPLEMENT
C669: EXPECTED VALUE | D669: WILL_NEVER_IMPLEMENT
B672: Getpivotdata | C672: FORMULA
C673: EXPECTED VALUE
B676: Getpivotfield | C676: FORMULA
C677: EXPECTED VALUE
B680: Getpivotitem | C680: FORMULA
C681: EXPECTED VALUE
B684: Getpivottable | C684: FORMULA
C685: EXPECTED VALUE
B688: Gettool | C688: FORMULA | D688: WILL_NEVER_IMPLEMENT
C689: EXPECTED VALUE | D689: WILL_NEVER_IMPLEMENT
B692: Gettoolbar | C692: FORMULA | D692: WILL_NEVER_IMPLEMENT
C693: EXPECTED VALUE | D693: WILL_NEVER_IMPLEMENT
B696: Getwindow | C696: FORMULA | D696: WILL_NEVER_IMPLEMENT
C697: EXPECTED VALUE | D697: WILL_NEVER_IMPLEMENT
B700: Getworkbook | C700: FORMULA | D700: WILL_NEVER_IMPLEMENT
C701: EXPECTED VALUE | D701: WILL_NEVER_IMPLEMENT
B704: Getworkspace | C704: FORMULA | D704: WILL_NEVER_IMPLEMENT
C705: EXPECTED VALUE | D705: WILL_NEVER_IMPLEMENT
B708: Goto | C708: FORMULA
C709: EXPECTED VALUE
B712: Group | C712: FORMULA
C713: EXPECTED VALUE
B716: Growth | C716: FORMULA
C717: EXPECTED VALUE
B720: Halt | C720: FORMULA
C721: EXPECTED VALUE
B724: Harmean | C724: FORMULA
C725: EXPECTED VALUE
B728: Help | C728: FORMULA
C729: EXPECTED VALUE
B732: Hex2Dec | C732: FORMULA | D732: =HEX2DEC("A5") -> 165 | E732: =HEX2DEC("FFFFFFFF5B") -> -165 | F732: =HEX2DEC("3DA408B9") -> 1034160313 | G732: =HEX2DEC("FFFF") -> 65535 | H732: =HEX2DEC("FF") -> 255 | I732: =HEX2DEC("F000000001") -> -68719476735 | J732: =HEX2DEC("0000250001") -> 2424833 | K732: =HEX2DEC("001") -> 1 | L732: =HEX2DEC("ABCDEFGHI") -> #NUM! | M732: =HEX2DEC(11001001100100) -> #NUM!
C733: EXPECTED VALUE | D733: 165 | E733: -165 | F733: 1034160313 | G733: 65535 | H733: 255 | I733: -68719476735 | J733: 2424833 | K733: 1 | L733: #NUM! | M733: #NUM!
B736: Hlookup | C736: FORMULA | D736: =HLOOKUP("DOUBLE",R6C2:R12C8,3, FALSE) -> 1.0000000000000001E-5 | E736: =HLOOKUP("DOUBLE",R6C2:R12C8,3, FALSE) -> 1.0000000000000001E-5 | F736: =HLOOKUP("STRing",R6C2:R12C8,3, FALSE) -> nospaces | G736: =HLOOKUP("STRING",R6C2:R12C8,6, TRUE) -> beginsWithSpace
C737: EXPECTED VALUE | D737: 1.0000000000000001E-5 | E737: 1.0000000000000001E-5 | F737: nospaces | G737: beginsWithSpace
B740: Hour | C740: FORMULA | D740: =HOUR(1) -> 0 | E740: =HOUR(0.75) -> 18 | F740: =HOUR(0.33) -> 7 | G740: =HOUR(R[-733]C[-3]) -> 0 | H740: =HOUR(R[-732]C[-3]) -> #VALUE!
C741: EXPECTED VALUE | D741: 0 | E741: 18 | F741: 7 | G741: 0 | H741: #VALUE!
B744: Hyperlink | C744: FORMULA | D744: =HYPERLINK("http://poi.apache.org") -> http://poi.apache.org
C745: EXPECTED VALUE | D745: http://poi.apache.org
B748: Hypgeomdist | C748: FORMULA
C749: EXPECTED VALUE
B752: If | C752: FORMULA | D752: =IF(1>2,3) -> 0 | E752: =IF(1>2,3,4) -> 4 | F752: =IF(R[-742]C[-4],3) -> 3 | G752: =IF(R[-745]C[-3],#VALUE!, 3) -> 3 | H752: =IF(ISERROR(R[-744]C[-6]/R[-745]C[-6]),"error detected") -> error detected | I752: =IF(ISERROR(R[-744]C[-7]/R[-744]C[-7]),1,IF(3>4,2,IF(R[-744]C[-7]>R[-745]C[-7],3,-1))) -> 3 | J752: =IF(ISERROR((R[-743]C[-8]+R[-744]C[-8])/(R[-745]C[-8]*R[-744]C[-7])),"error detected") -> error detected | K752: =IF(R[-745]C[-9]*R[-744]C[-9]/R[-744]C[-8]*R[-741]C[-8]>0,R[-736]C[-9],R[-735]C[-9]) -> 0 | L752: =IF(R[-741]C[15],1) -> #NAME? | M752: =IF("tRue", "A", "B") -> A
C753: EXPECTED VALUE | D753: 0 | E753: 4 | F753: 3 | G753: 3 | H753: error detected | I753: 3 | J753: error detected | K753: 0 | L753: #NAME? | M753: A
B756: Imaginary | C756: FORMULA | D756: 4 | E756: -1 | F756: 0 | G756: 0.88 | H756: -0.88 | I756: 1 | J756: -1 | K756: #NUM!
C757: EXPECTED VALUE | D757: 4 | E757: -1 | F757: 0 | G757: 0.88 | H757: -0.88 | I757: 1 | J757: -1 | K757: #NUM!
B760: ImReal | C760: FORMULA | D760: 3 | E760: 0 | F760: 4 | G760: 14 | H760: -0.88 | I760: 0 | J760: 0 | K760: #NUM!
C761: EXPECTED VALUE | D761: 3 | E761: 0 | F761: 4 | G761: 14 | H761: -0.88 | I761: 0 | J761: 0 | K761: #NUM!
B764: Index | C764: FORMULA | D764: =INDEX(R[-750]C[-2]:R[-749]C[-1],2,2) -> -1.0000100000000001 | E764: =INDEX(R[-750]C[-3]:R[-749]C[-2],R[-757]C[-1],2) -> #VALUE!
C765: EXPECTED VALUE | D765: -1.0000100000000001 | E765: #VALUE!
B768: Indirect | C768: FORMULA | D768: =INDIRECT("B9") -> 2 | E768: =INDIRECT("$B$9") -> 2 | F768: =INDIRECT(R[-758]C[-2]) -> #REF!
C769: EXPECTED VALUE | D769: 2 | E769: 2 | F769: #REF!
B772: Info | C772: FORMULA
C773: EXPECTED VALUE
B776: Initiate | C776: FORMULA
C777: EXPECTED VALUE
B780: Input | C780: FORMULA
C781: EXPECTED VALUE
B784: Int | C784: FORMULA | D784: =INT(R[-777]C[-2]) -> 0 | E784: =INT(R[-770]C[-3]) -> -2 | F784: =INT(R[-768]C[-4]) -> 1 | G784: =INT(R[-766]C[-5]) -> #VALUE! | H784: =INT(R[-775]C[-5]) -> 1 | I784: =INT(R[-767]C[-6]) -> -1 | J784: =INT(R[-770]C[-5]) -> 0 | K784: =INT(R[-777]C[-6]) -> #VALUE! | L784: =INT(R[-774]C[-6]) -> 0 | M784: =INT(R[-776]C[-3]:R[-776]C) -> 3 | N784: =INT(R[-2]C[-1]:R[1]C[-1]) -> 3 | O784: =INT(R[-776]C[-1]:R[-775]C) -> #VALUE!
C785: EXPECTED VALUE | D785: 0 | E785: -2 | F785: 1 | G785: #VALUE! | H785: 1 | I785: -1 | J785: 0 | K785: #VALUE! | L785: 0 | M785: 3 | N785: 3 | O785: #VALUE!
B788: Intercept | C788: FORMULA | D788: =INTERCEPT(R[-781]C[7]:R[-778]C[7],R[-781]C[8]:R[-778]C[8]) -> -3.9545123624894707E-2 | E788: =INTERCEPT(R[-781]C[7]:R[-778]C[7],R[-781]C[6]:R[-778]C[6]) -> 0.25094999999999956
C789: EXPECTED VALUE | D789: -3.9545123624894707E-2 | E789: 0.25094999999999956
B792: Ipmt | C792: FORMULA | D792: =IPMT(R[-784]C[-1], R[-785]C[4], R[-785]C[6]*R[-785]C[6], R[-779]C[-2]) -> 5.0062750305407844E-3 | E792: =IPMT(R[-784]C[-2], R[-785]C[3], R[-780]C[3], R[-780]C[3]*R[-780]C[4]) -> -2.4697723375626537
C793: EXPECTED VALUE | D793: 5.0062750000000001E-3 | E793: -2.46977234
B796: Irr | C796: FORMULA | D796: =TRUNC(IRR(R[-789]C[34]:R[-785]C[34]),4) -> -7.6799999999999993E-2 | E796: =TRUNC(IRR(R[-789]C[33]:R[-784]C[33]),4) -> 5.3800000000000001E-2 | F796: =TRUNC(IRR(R[-789]C[32]:R[-787]C[32], -10%),4) -> -0.44350000000000001
C797: EXPECTED VALUE | D797: -7.6799999999999993E-2 | E797: 5.3800000000000001E-2 | F797: -0.44350000000000001
B800: Isblank | C800: FORMULA | D800: =ISBLANK(R[-793]C[-2]) -> 0 | E800: =ISBLANK(R[-789]C[-3]) -> 0 | F800: =ISBLANK(R[-783]C[-4]) -> 0 | G800: =ISBLANK(R[-792]C[-3]) -> 1 | H800: =ISBLANK(R[-793]C[-3]) -> 0 | I800: =ISBLANK(R[-785]C[-3]) -> 1 | J800: =ISBLANK(R[-786]C:R[-786]C[1]) -> 1 | K800: =ISBLANK(R[-787]C:R[-786]C[1]) -> 0 | L800: =ISBLANK(R[-793]C[-8]:R[-793]C[-8]) -> 1
C801: EXPECTED VALUE | D801: 0 | E801: 0 | F801: 0 | G801: 1 | H801: 0 | I801: 1 | J801: 1 | K801: 0 | L801: 1
B804: Iserr | C804: FORMULA
C805: EXPECTED VALUE
B808: IsError | C808: FORMULA | D808: =ISERROR(R[-801]C[-2]) -> 0 | E808: =ISERROR(R[-791]C[-3]) -> 0 | F808: =ISERROR(R[-800]C[-4]/R[-801]C[-3]) -> 1 | G808: =ISERROR(R[-798]C[-4]:R[-795]C[-4]) -> 1 | H808: =ISERROR(R[-792]C[-5]:R[-792]C[-3]) -> 1 | I808: =ISERROR(R[-794]C[-3]) -> 0 | J808: =ISERROR(R[-797]C[-1]:R[-797]C[1]) -> 0 | K808: =ISERROR(R[-2]C[-2]:R[1]C[-2]) -> 0 | L808: =ISERROR(RC[-4]) -> 0
C809: EXPECTED VALUE | D809: 0 | E809: 0 | F809: 1 | G809: 1 | H809: 1 | I809: 0 | J809: 0 | K809: 0 | L809: 0
B812: Islogical | C812: FORMULA | D812: =ISLOGICAL(R[-805]C[-2]) -> 0 | E812: =ISLOGICAL(R[-796]C[-3]) -> 1 | F812: =ISLOGICAL(R[-795]C[-4]) -> 1 | G812: =ISLOGICAL(R[-794]C[-5]) -> 0 | H812: =ISLOGICAL(R[-793]C[-6]) -> 0 | I812: =ISLOGICAL(R[-794]C[-6]) -> 0 | J812: =ISLOGICAL(TRUE()) -> 1 | K812: =ISLOGICAL(TRUE) -> 1 | L812: =ISLOGICAL(R[-796]C[-10]:R[-795]C[-10]) -> 0
C813: EXPECTED VALUE | D813: 0 | E813: 1 | F813: 1 | G813: 0 | H813: 0 | I813: 0 | J813: 1 | K813: 1 | L813: 0
B816: IsNa | C816: FORMULA | D816: =ISNA(#N/A) -> 1 | E816: =ISNA(42) -> 0 | F816: =ISNA(R[-803]C[21]) -> 1 | G816: =ISNA(R[-808]C[20]) -> 0 | H816: =ISNA(R[-802]C[19]) -> 0 | I816: =ISNA(R[-800]C[-7]) -> 0
C817: EXPECTED VALUE | D817: 1 | E817: 0 | F817: 1 | G817: 0 | H817: 0 | I817: 0
B820: Isnontext | C820: FORMULA | D820: =ISNONTEXT(1) -> 1 | E820: =ISNONTEXT(TRUE) -> 1 | F820: =ISNONTEXT("1") -> 0 | G820: =ISNONTEXT("true") -> 0 | H820: =ISNONTEXT(R[-813]C[-6]) -> 1 | I820: =ISNONTEXT(R[-802]C[-7]) -> 0 | J820: =ISNONTEXT(R[-808]C[-4]) -> 0 | K820: =ISNONTEXT(R[-802]C[-9]:R[-801]C[-9]) -> 1 | L820: =ISNONTEXT(R[-813]C[-8]) -> 1
C821: EXPECTED VALUE | D821: 1 | E821: 1 | F821: 0 | G821: 0 | H821: 1 | I821: 0 | J821: 0 | K821: 1 | L821: 1
B824: Isnumber | C824: FORMULA | D824: =ISNUMBER(0) -> 1 | E824: =ISNUMBER("a") -> 0 | F824: =ISNUMBER(TRUE) -> 0 | G824: =ISNUMBER(R[-817]C[-5]) -> 1 | H824: =ISNUMBER(R[-806]C[-6]) -> 0 | I824: =ISNUMBER(R[-808]C[-7]) -> 0 | J824: =ISNUMBER(R[-814]C[-7]) -> 1 | K824: =ISNUMBER(R[-817]C[-7]) -> 0 | L824: =ISNUMBER(R[-817]C[-7]) -> 0 | M824: =ISNUMBER(R[-809]C[-8]) -> 0 | N824: =ISNUMBER(R[-817]C[-8]) -> 1 | O824: =ISNUMBER(R[-811]C[-9]) -> 0 | P824: =ISNUMBER(R[-817]C[-9]:R[-817]C[-6]) -> 0 | Q824: =ISNUMBER(R[-817]C[-6]:R[-815]C[-6]) -> 0
C825: EXPECTED VALUE | D825: 1 | E825: 0 | F825: 0 | G825: 1 | H825: 0 | I825: 0 | J825: 1 | K825: 0 | L825: 0 | M825: 0 | N825: 1 | O825: 0 | P825: 0 | Q825: 0
B828: Ispmt | C828: FORMULA
C829: EXPECTED VALUE
B832: Isref | C832: FORMULA | D832: =ISREF(0) -> 0 | E832: =ISREF("a17") -> 0 | F832: =ISREF(TRUE) -> 0 | G832: =ISREF(R[-825]C[-5]) -> 1 | H832: =ISREF(R[-825]C[-1]:R[-823]C[-1]) -> 1 | I832: =ISREF(R[-825]C[-2]:R[-823]C) -> 1 | J832: =ISREF(R[-825]C[-6]) -> 1 | K832: =ISREF("") -> 0
C833: EXPECTED VALUE | D833: 0 | E833: 0 | F833: 0 | G833: 1 | H833: 1 | I833: 1 | J833: 1 | K833: 0
B836: Istext | C836: FORMULA | D836: =ISTEXT(1) -> 0 | E836: =ISTEXT(TRUE) -> 0 | F836: =ISTEXT("1") -> 1 | G836: =ISTEXT("true") -> 1 | H836: =ISTEXT(R[-813]C[-6]) -> 1 | I836: =ISTEXT(R[-802]C[-7]) -> 0 | J836: =ISTEXT(R[-808]C[-4]) -> 1 | K836: =ISTEXT(R[-802]C[-9]:R[-801]C[-9]) -> 0 | L836: =ISTEXT(R[-813]C[-8]) -> 0
C837: EXPECTED VALUE | D837: 0 | E837: 0 | F837: 1 | G837: 1 | H837: 1 | I837: 0 | J837: 1 | K837: 0 | L837: 0
B840: Kurt | C840: FORMULA
C841: EXPECTED VALUE
B844: Large | C844: FORMULA | D844: =LARGE(R[-837]C[-2]:R[-830]C[-1],1) -> 9999999999 | E844: =LARGE(R[-836]C[-3]:R[-834]C[-3],3) -> 1 | F844: =LARGE(R[-835]C[-4]:R[-828]C[-4],4) -> -1 | G844: =LARGE(TRUE,1) -> 1 | H844: =LARGE("2.3",1) -> 2.2999999999999998 | I844: =LARGE(R[-836]C[-4]:R[-832]C[-4],3) -> #NUM! | J844: =LARGE(R[-837]C[-6]:R[-836]C[-6],1) -> #NUM! | K844: =LARGE(R[-837]C[-8]:R[-835]C[-6],3) -> 0 | L844: =LARGE(R[-836]C[-7]:R[-834]C[-6],2) -> 1 | M844: =LARGE(R[-834]C[-7]:R[-831]C[-4],3) -> 345
C845: EXPECTED VALUE | D845: 9999999999 | E845: 1 | F845: -1 | G845: 1 | H845: 2.2999999999999998 | I845: #NUM! | J845: #NUM! | K845: 0 | L845: 1 | M845: 345
B848: Lasterror | C848: FORMULA
C849: EXPECTED VALUE
B852: Left | C852: FORMULA | D852: =LEFT("a string",0) ->  | E852: =LEFT("a string","6") -> a stri | F852: =LEFT("a string",10) -> a string | G852: =LEFT("a string",R[-843]C[-5]) -> a | H852: =LEFT(R[-840]C[-3], R[-835]C[-3]) -> no | I852: =LEFT(TRUE,2) -> TR | J852: =LEFT(R[-845]C[-3]:R[-843]C[-2],R[-842]C[-2]) -> #VALUE! | K852: =LEFT("a string", TRUE) -> a
C853: EXPECTED VALUE | E853: a stri | F853: a string | G853: a | H853: no | I853: TR | J853: #VALUE! | K853: a
B856: Leftb | C856: FORMULA
C857: EXPECTED VALUE
B860: Len | C860: FORMULA | D860: =LEN(R[-850]C[-2]) -> 3 | E860: =LEN(R[-840]C[1]) -> 1 | F860: =LEN(R[-853]C[-2]) -> 0 | G860: =LEN(R[-846]C[-2]) -> 8 | H860: =LEN(R[-849]C[-1]) -> 10 | I860: =LEN(R[-849]C[-1]:R[-849]C[1]) -> 3 | J860: =LEN(R[-1]C[-3]:R[1]C[-3]) -> 1 | K860: =LEN(R[-852]C:R[-850]C[1]) -> #VALUE! | L860: =LEN(R[-848]C[15]) -> #NUM!
C861: EXPECTED VALUE | D861: 3 | E861: 1 | F861: 0 | G861: 8 | H861: 10 | I861: 3 | J861: 1 | K861: #VALUE! | L861: #NUM!
B864: Lenb | C864: FORMULA
C865: EXPECTED VALUE
B868: Linest | C868: FORMULA
C869: EXPECTED VALUE
B872: Links | C872: FORMULA
C873: EXPECTED VALUE
B876: Ln | C876: FORMULA | D876: =LN(R[-869]C[-2]) -> #NUM! | E876: =LN(R[-868]C[-3]) -> 0 | F876: =LN(R[-863]C[-4]) -> #NUM! | G876: =LN(R[-860]C[-5]) -> 0 | H876: =LN(R[-861]C[-6]) -> #NUM! | I876: =LN(R[-858]C[-7]) -> #VALUE! | J876: =LN(R[-867]C[-7]) -> 9.5310179804324935E-2 | K876: =LN(R[-869]C[-6]) -> #VALUE! | L876: =LN(R[-860]C[-7]) -> 9.5310179804324935E-2 | M876: =LN(R[-863]C[-6]) -> #NUM! | N876: =LN(R[-868]C[-3]:R[-868]C) -> #NUM! | O876: =LN(R[-867]C[-2]:R[-867]C) -> 6.1180971980413483 | P876: =LN(R[-2]C[-1]:R[1]C[-1]) -> 1.8112511328273146
C877: EXPECTED VALUE | D877: #NUM! | E877: 0 | F877: #NUM! | G877: 0 | H877: #NUM! | I877: #VALUE! | J877: 9.5310179804324935E-2 | K877: #VALUE! | L877: 9.5310179804324935E-2 | M877: #NUM! | N877: #NUM! | O877: 6.1180971980413483 | P877: 1.8112511328273146
B880: Log | C880: FORMULA | D880: =LOG(R[-873]C[-2]) -> #NUM! | E880: =LOG(R[-873]C[-3],2) -> #NUM! | F880: =LOG(R[-872]C[-4],2) -> 0 | G880: =LOG(R[-870]C[-5],534) -> 1 | H880: =LOG(R[-868]C[-6],20) -> #NUM! | I880: =LOG(R[-869]C[-7],12) -> 9.2662840802510242 | J880: =LOG(R[-871]C[-7],R[-870]C[-7]) -> 9531.0656353805316 | K880: =LOG(R[-863]C[-5],R[-865]C[-6]) -> #NUM! | L880: =LOG(R[-865]C[-6],R[-864]C[-6]) -> #NUM! | M880: =LOG(R[-870]C[-11],R[-871]C[-11]) -> 9.0606959316875546
C881: EXPECTED VALUE | D881: #NUM! | E881: #NUM! | F881: 0 | G881: 1 | H881: #NUM! | I881: 9.2662840802510242 | J881: 9531.0656353805316 | K881: #NUM! | L881: #NUM! | M881: 9.0606959316875546
B884: Log10 | C884: FORMULA | D884: =LOG10(R[-877]C[-2]) -> #NUM! | E884: =LOG10(R[-876]C[-3]) -> 0 | F884: =LOG10(R[-874]C[-4]) -> 2.7275412570285562 | G884: =LOG10(R[-871]C[-5]) -> #NUM! | H884: =LOG10(R[-868]C[-6]) -> 0 | I884: =LOG10(R[-867]C[-7]) -> #NUM! | J884: =LOG10(R[-866]C[-8]) -> #VALUE! | K884: =LOG10(R[-877]C[-6]) -> #VALUE! | L884: =LOG10(R[-869]C[-7]) -> 0 | M884: =LOG10(R[-871]C[-7]) -> 0.47711980706897666 | N884: =LOG10(R[-875]C[-2]:R[-875]C) -> 2.537819095073274 | O884: =LOG10(R[-1]C[-1]:R[1]C[-1]) -> 0.40446066078012233
C885: EXPECTED VALUE | D885: #NUM! | E885: 0 | F885: 2.7275412570285562 | G885: #NUM! | H885: 0 | I885: #NUM! | J885: #VALUE! | K885: #VALUE! | L885: 0 | M885: 0.47711980706897666 | N885: 2.537819095073274 | O885: 0.40446066078012233
B888: Logest | C888: FORMULA
C889: EXPECTED VALUE
B892: Loginv | C892: FORMULA
C893: EXPECTED VALUE
B896: Lognormdist | C896: FORMULA
C897: EXPECTED VALUE
B900: Lookup | C900: FORMULA | D900: =LOOKUP(534,R[-894]C[-2]:R[-885]C[-2],R[-894]C[1]:R[-885]C[1]) -> endsWithSpace | E900: =LOOKUP("DOUBLE",R[-894]C[-2]:R[-894]C[2],R[-891]C[-2]:R[-891]C[2]) -> 1.1000000000000001
C901: EXPECTED VALUE | D901: endsWithSpace | E901: 1.1000000000000001
B904: Lower | C904: FORMULA | D904: =LOWER("ALL UPPER") -> all upper | E904: =LOWER("MixedCase") -> mixedcase | F904: =LOWER(R[-894]C[-4]) -> 534 | G904: =LOWER(R[-888]C[-5]) -> true | H904: =LOWER(R[-886]C[-6]) -> true | I904: =LOWER(R[-893]C[-4]) -> beginswithspace | J904: =LOWER(R[-885]C[-5]) -> alph4num3ric | K904: =LOWER(R[-893]C[-6]:R[-893]C[-4]) -> #VALUE! | L904: =LOWER(R[-893]C[-6]:R[-890]C[-6]) -> #VALUE! | M904: =LOWER(R[-897]C[-2]:R[-897]C) -> alphanum | N904: =LOWER(R[-1]C[-1]:R[1]C[-1]) -> alphanum | O904: =LOWER(R[-896]C[-1]:R[-894]C) -> #VALUE! | P904: =LOWER(R[-896]C[11]) -> #DIV/0!
C905: EXPECTED VALUE | D905: all upper | E905: mixedcase | F905: 534 | G905: true | H905: true | I905: beginswithspace | J905: alph4num3ric | K905: #VALUE! | L905: #VALUE! | M905: alphanum | N905: alphanum | O905: #VALUE! | P905: #DIV/0!
B908: Match | C908: FORMULA | D908: =MATCH(5,R[-901]C[-2]:R[-898]C[-2]) -> 3 | E908: =MATCH(600, R[-901]C[-3]:R[-898]C[-3]) -> 4 | F908: =MATCH(-5, R[-901]C[-4]:R[-898]C[-4]) -> #N/A
C909: EXPECTED VALUE | D909: 3 | E909: 4 | F909: #N/A
B912: Max | C912: FORMULA | D912: =MAX(R[-905]C[-2]:R[-893]C[-2]) -> 9999999999 | E912: =MAX(R[-905]C[-2]:R[-893]C) -> 999999.99999000004 | F912: =MAX(R[-899]C[-3]:R[-897]C[-3],R[-893]C[-1],R[-895]C[-1]) -> -1.0000100000000001 | G912: =MAX(R[-896]C[-5]:R[-893]C[-5]) -> 0 | H912: =MAX(R[-898]C[-6]:R[-896]C[-6]) -> -1 | I912: =MAX(R[-903]C[-5]:R[-900]C) -> 9999999999 | J912: =MAX(R[-904]C[-3]:R[-903]C[-1]) -> 5.6788999999999996 | K912: =MAX(R[-901]C[-5],R[-901]C[-6],R[-899]C[-6]:R[-897]C[-6],R[-903]C[-3]:R[-901]C[-2],R[-904]C[1]) -> 345
C913: EXPECTED VALUE | D913: 9999999999 | E913: 999999.99999000004 | F913: -1.0000100000000001 | G913: 0 | H913: -1 | I913: 9999999999 | J913: 5.6788999999999996 | K913: 345
B916: Maxa | C916: FORMULA | D916: =MAXA(R[-909]C[-2]:R[-906]C[-2]) -> 534 | E916: =MAXA(R[-902]C[-2]:R[-899]C[-2]) -> -1.0000000000000001E-5 | F916: =MAXA(R[-902]C[-4]:R[-899]C[-4]) -> 1 | G916: =MAXA(R[-905]C[-5]:R[-897]C[-5],R[-903]C[-4]:R[-902]C[-4],R[-906]C[-4]:R[-905]C[-3],R[-906]C[-2]:R[-901]C[-2]) -> 9999999999 | H916: =MAXA(R[-901]C[-3]:R[-899]C[-3],R[-902]C[-5],R[-907]C[-1]) -> 2.3456000000000001 | I916: =MAXA(R[-908]C,R[-908]C[-2]:R[-907]C[-2],R[-904]C[-3]) -> 3.5 | J916: =MAXA(R[-902]C[-4],R[-897]C[-5],R[-904]C[-4]) -> 0
C917: EXPECTED VALUE | D917: 534 | E917: -1.0000000000000001E-5 | F917: 1 | G917: 9999999999 | H917: 2.3456000000000001 | I917: 3.5 | J917: 0
B920: Mdeterm | C920: FORMULA
C921: EXPECTED VALUE
B924: Median | C924: FORMULA | D924: =MEDIAN(R[-917]C[-2]:R[-915]C[-2],R[-914]C[-2]:R[-912]C[-2],R[-911]C[-2]:R[-909]C[-2],R[-908]C[-2]:R[-906]C[-2]) -> 0 | E924: =MEDIAN(R[-909]C[-3]:R[-907]C[-3]) -> -1 | F924: =MEDIAN(R[-908]C[-4]:R[-908]C[-2]) -> -1.1000000000000001 | G924: =MEDIAN(R[-917]C[-4]:R[-915]C[-3]) -> 1.0000000000000001E-5 | H924: =MEDIAN(R[-917]C[-3]:R[-914]C[-3]) -> #NUM! | I924: =MEDIAN(R[-915]C[-5]:R[-908]C[-5]) -> #NUM! | J924: =MEDIAN("2",2) -> 2 | K924: =MEDIAN(TRUE,2) -> 1.5 | L924: =MEDIAN(R[-915]C[-7]:R[-914]C[-5]) -> 2.3456000000000001
C925: EXPECTED VALUE | D925: 0 | E925: -1 | F925: -1.1000000000000001 | G925: 1.0000000000000001E-5 | H925: #NUM! | I925: #NUM! | J925: 2 | K925: 1.5 | L925: 2.3456000000000001
B928: Mid | C928: FORMULA | D928: =MID(R[-920]C[1],1,3) -> nos | E928: =MID(R[-920]C,2,4) -> ospa | F928: =MID(R[-919]C[-1],4,1) -> a | G928: =MID(R[-908]C[-2], 1, 2) -> 
C929: EXPECTED VALUE | D929: nos | E929: ospa | F929: a
B932: Midb | C932: FORMULA
C933: EXPECTED VALUE
B936: Min | C936: FORMULA | D936: =MIN(R[-929]C[-2]:R[-924]C[-2]) -> -9999999999 | E936: =MIN(R[-921]C[-3]:R[-917]C[-3]) -> -1 | F936: =MIN(R[-923]C[-4]:R[-919]C[-3]) -> -999999.99999000004 | G936: =MIN(R[-926]C[-4]:R[-924]C[-2]) -> 1.0000100000000001 | H936: =MIN(R[-929]C[-3]:R[-928]C[-1],R[-927]C[-1],R[-928]C,R[-926]C,R[-921]C[-3]) -> 0 | I936: =MIN(1,"-2",R[-922]C[-6],R[-917]C[-4],R[-920]C[-4]) -> -2.9999899999999999 | J936: =MIN("-100",R[-919]C[-5]) -> -100 | K936: =MIN(R[-920]C[-6],R[-927]C[-9]) -> 2 | L936: =MIN(R[-927]C[-5],R[-928]C[-5],R[-929]C[-5],R[-926]C[-6],R[-924]C[-6],R[-920]C[-7],"-20") -> -20 | M936: =MIN(R[-926]C[-8]:R[-924]C[-8]) -> 0
C937: EXPECTED VALUE | D937: -9999999999 | E937: -1 | F937: -999999.99999000004 | G937: 1.0000100000000001 | H937: 0 | I937: -2.9999899999999999 | J937: -100 | K937: 2 | L937: -20 | M937: 0
B940: Mina | C940: FORMULA | D940: =MINA(R[-932]C[-2]:R[-928]C) -> -9999999999 | E940: =MINA(R[-925]C:R[-923]C) -> 0 | F940: =MINA(R[-924]C[-4],R[-930]C[-4],R[-931]C[-4]) -> 1 | G940: =MINA(R[-931]C[-2]:R[-927]C,R[-929]C[2],R[-931]C[2],R[-932]C[1],R[-926]C[1]) -> 0 | H940: =MINA("-23",R[-927]C[-3],R[-933]C[11]) -> -23 | I940: =MINA(R[-931]C[-4]:R[-926]C[-4]) -> 0 | J940: =MINA(R[-928]C[-4]:R[-926]C[-4],R[-930]C[-4]) -> 0
C941: EXPECTED VALUE | D941: -9999999999 | E941: 0 | F941: 1 | G941: 0 | H941: -23 | I941: 0 | J941: 0
B944: Minute | C944: FORMULA | D944: =MINUTE(1) -> 0 | E944: =MINUTE(TIME(0,15,0)) -> 15 | F944: =MINUTE(R[-935]C[-1]) -> #VALUE!
C945: EXPECTED VALUE | D945: 0 | E945: 15 | F945: #VALUE!
B948: Minverse | C948: FORMULA
C949: EXPECTED VALUE
B952: Mirr | C952: FORMULA | D952: =MIRR(R[-945]C[35]:R[-940]C[35], R[-939]C[35], R[-938]C[35]) -> 0.12609413036590511 | E952: =MIRR(R[-945]C[35]:R[-941]C[35], R[-940]C[35], R[-939]C[35]) -> 0.18736225093283743 | F952: =MIRR(R[-945]C[35]:R[-942]C[35], R[-941]C[35], R[-940]C[35]) -> 7.0394939660276767E-2 | G952: =MIRR(R[-945]C[35]:R[-940]C[35], R[-941]C[35], R[-940]C[35]) -> #DIV/0! | H952: =MIRR(R[-945]C[35]:R[-942]C[35], R[-941]C[35], R[-940]C[35]) -> -1
C953: EXPECTED VALUE | D953: 0.126094130365905 | E953: 0.18736225093283701 | F953: 7.0394939660276698E-2 | G953: #DIV/0! | H953: -1
B956: Mmult | C956: FORMULA
C957: EXPECTED VALUE
B960: Mod | C960: FORMULA | D960: =MOD(R[-949]C[-1],R[-945]C[-1]) -> -4.0000000000262048E-5 | E960: =MOD(R[-951]C[-3],R[-946]C[-3]) -> 0 | F960: =MOD(R[-946]C[-4],R[-944]C[-4]) -> 0 | G960: =MOD("23","3") -> 2 | H960: =MOD(R[-943]C[-3],R[-944]C[-3]) -> 0.79998999999999976 | I960: =MOD(R[-943]C[-5],R[-944]C[-5]) -> #DIV/0! | J960: =MOD(R[-943]C[-6],R[-944]C[-5]) -> 0 | K960: =MOD(R[-949]C[-2]:R[-949]C[1],R[-953]C[-1]) -> 0 | L960: =MOD(R[-1]C[-5]:R[1]C[-5],3) -> 2 | M960: =MOD(R[-952]C[-4]:R[-951]C[-3],2) -> #VALUE! | N960: =MOD(700,R[-951]C[-1]:R[-951]C[1]) -> 10
C961: EXPECTED VALUE | D961: -4.0000000000262048E-5 | E961: 0 | F961: 0 | G961: 2 | H961: 0.79998999999999976 | I961: #DIV/0! | J961: 0 | K961: 0 | L961: 2 | M961: #VALUE! | N961: 10
B964: Mode | C964: FORMULA | D964: =MODE(R[-957]C[-2]:R[-949]C[-2]) -> #N/A | E964: =MODE(R[-956]C[-3]:R[-948]C[-3]) -> #N/A | F964: =MODE(R[-957]C[-4]:R[-955]C[-3]) -> 0 | G964: =MODE(R[-955]C[-4],R[-948]C[-2],"1",R[-956]C[-5]) -> #VALUE! | H964: =MODE(R[-956]C[-6],"1",2,3) -> #VALUE! | I964: =MODE(1,1,2,3) -> 1 | J964: =MODE(R[-957]C[-5]:R[-955]C[-3]) -> 1 | K964: =MODE("1",1,#DIV/0!,2,3) -> #VALUE! | L964: =MODE(R[-948]C[-9]:R[-948]C[-7],-1.1) -> -1.1000000000000001 | M964: =MODE(R[-955]C[-11],2,R[-957]C[-9]) -> #VALUE!
C965: EXPECTED VALUE | D965: #N/A | E965: #N/A | F965: 0 | G965: #VALUE! | H965: #VALUE! | I965: 1 | J965: 1 | K965: #VALUE! | L965: -1.1000000000000001 | M965: #VALUE!
B968: Month | C968: FORMULA | D968: =MONTH(R[-948]C[-1]) -> 12 | E968: =MONTH(1) -> 1 | F968: =MONTH(0) -> 1 | G968: =MONTH(-10) -> #NUM! | H968: =MONTH(#N/A) -> #N/A | I968: =MONTH(R[-948]C[-6]+60) -> 2
C969: EXPECTED VALUE | D969: 12 | E969: 1 | F969: 1 | G969: #NUM! | H969: #N/A | I969: 2
B972: Moviecommand | C972: FORMULA | D972: WILL_NEVER_IMPLEMENT
C973: EXPECTED VALUE | D973: WILL_NEVER_IMPLEMENT
B976: N | C976: FORMULA
C977: EXPECTED VALUE
B980: Na | C980: FORMULA | D980: =NA() -> #N/A
C981: EXPECTED VALUE | D981: #N/A
B984: Names | C984: FORMULA
C985: EXPECTED VALUE
B988: Negbinomdist | C988: FORMULA
C989: EXPECTED VALUE
B992: Normdist | C992: FORMULA
C993: EXPECTED VALUE
B996: Norminv | C996: FORMULA
C997: EXPECTED VALUE
B1000: Normsdist | C1000: FORMULA
C1001: EXPECTED VALUE
B1004: Normsinv | C1004: FORMULA
C1005: EXPECTED VALUE
B1008: Not | C1008: FORMULA | D1008: =NOT(0) -> 1 | E1008: =NOT(FALSE) -> 1 | F1008: =NOT(TRUE) -> 0 | G1008: =NOT(1+1=2) -> 0 | H1008: =NOT(R[-1000]C[-3]) -> #VALUE!
C1009: EXPECTED VALUE | D1009: 1 | E1009: 1 | F1009: 0 | G1009: 0 | H1009: #VALUE!
B1012: Note | C1012: FORMULA
C1013: EXPECTED VALUE
B1016: Now | C1016: FORMULA
C1017: EXPECTED VALUE
B1020: Nper | C1020: FORMULA | D1020: =NPER(0.01,1,10) -> -9.5785940398131615 | E1020: =NPER("0.01", TRUE, "10", -20) -> 8.7445712382444132 | F1020: =NPER(0.01, "100", "1000", -2000, TRUE) -> 8.6690930741204877 | G1020: =NPER(0.05,10, 100, -200,R[-1013]C[-3]) -> 5.8963128603698989 | H1020: =NPER(0.01, #N/A, -200, 300) -> #N/A | I1020: =NPER(12,4500,100000,100000) -> #NUM!
C1021: EXPECTED VALUE | D1021: -9.5785940398131615 | E1021: 8.7445712382444132 | F1021: 8.6690930741204877 | G1021: 5.8963128603698989 | H1021: #N/A | I1021: #NUM!
B1024: Npv | C1024: FORMULA | D1024: =TRUNC(NPV(5%,R[-1015]C[34]:R[-1012]C[34]),4) -> 62368.560400000002 | E1024: =TRUNC(NPV(10%,-10000,3000,4200,6800),2) -> 1188.44
C1025: EXPECTED VALUE | D1025: 62368.56 | E1025: 1188.44
B1028: Numberstring | C1028: FORMULA
C1029: EXPECTED VALUE
B1032: Oct2Dec | C1032: FORMULA | D1032: =OCT2DEC(0) -> 0 | E1032: =OCT2DEC(54) -> 44 | F1032: =OCT2DEC(7777777533) -> -165 | G1032: =OCT2DEC(7000000000) -> -134217728 | H1032: =OCT2DEC(7776667533) -> -299173 | I1032: =OCT2DEC("ABCDEFGH") -> #NUM! | J1032: =OCT2DEC(99999999) -> #NUM! | K1032: =OCT2DEC(3.14159) -> #NUM!
C1033: EXPECTED VALUE | D1033: 0 | E1033: 44 | F1033: -165 | G1033: -134217728 | H1033: -299173 | I1033: #NUM! | J1033: #NUM! | K1033: #NUM!
B1036: Odd | C1036: FORMULA | D1036: =ODD(R[-1029]C[-2]) -> 1 | E1036: =ODD(R[-1019]C[-2]) -> -1 | F1036: =ODD(R[-1023]C[-4]) -> -535 | G1036: =ODD(R[-1028]C[-5]) -> 1 | H1036: =ODD(R[-1019]C[-6]) -> 1 | I1036: =ODD(R[-1020]C[-7]) -> 1 | J1036: =ODD(R[-1025]C[-2]:R[-1025]C) -> 1 | K1036: =ODD(R[-5]C[-1]:R[1]C[-1]) -> 1 | L1036: =ODD(R[-1026]C[-1]:R[-1026]C[1]) -> 5 | M1036: =ODD(R[-1029]C[-1]:R[-1029]C[1]) -> #VALUE! | N1036: =ODD(R[-1028]C[-3]:R[-1027]C[-2]) -> #VALUE!
C1037: EXPECTED VALUE | D1037: 1 | E1037: -1 | F1037: -535 | G1037: 1 | H1037: 1 | I1037: 1 | J1037: 1 | K1037: 1 | L1037: 5 | M1037: #VALUE! | N1037: #VALUE!
B1040: Offset | C1040: FORMULA | D1040: =OFFSET(R[-1033]C[3], 2, 0) -> 2.3456000000000001 | E1040: =OFFSET(R[-1033]C[2], 0, 3) -> 4 | F1040: =OFFSET(R[-1033]C[1], "2.1", "1.9") -> 3.4567000000000001 | G1040: =OFFSET(R[-1033]C[-1], R[-1033]C[-2]:R[-1033]C[2], R[-1033]C[-2]:R[-1033]C[2]) -> 1.0009999999999999
C1041: EXPECTED VALUE | D1041: 2.3456000000000001 | E1041: 4 | F1041: 3.4567000000000001 | G1041: 1.0009999999999999
B1044: Opendialog | C1044: FORMULA | D1044: WILL_NEVER_IMPLEMENT
C1045: EXPECTED VALUE | D1045: WILL_NEVER_IMPLEMENT
B1048: Optionslistsget | C1048: FORMULA | D1048: WILL_NEVER_IMPLEMENT
C1049: EXPECTED VALUE | D1049: WILL_NEVER_IMPLEMENT
B1052: Or | C1052: FORMULA | D1052: =OR(R[-1045]C[-2]) -> 0 | E1052: =OR(R[-1045]C[-3]:R[-1043]C[-3],R[-1044]C[-2],R[-1045]C[-1],R[-1034]C[-3],R[-1035]C[-3],R[-1044]C,R[-1037]C,R[-1040]C[1]) -> 1 | F1052: =OR(R[-1045]C[-1]:R[-1036]C[-1],R[-1034]C[-1],R[-1033]C[-1],R[-1034]C[-4]) -> #VALUE! | G1052: =OR(R[-1045]C[-3],R[-1045]C[-2],R[-1044]C[-2],R[-1034]C[-5]) -> #VALUE! | H1052: =OR(R[-1040]C) -> 1 | I1052: =OR(R[-1039]C[-1]:R[-1039]C[1]) -> #VALUE! | J1052: =OR(R[-1040]C[-1]:R[-1040]C[1]) -> 1 | K1052: =OR(R[-1040]C[-1]:R[-1040]C[1]) -> 0
C1053: EXPECTED VALUE | D1053: 0 | E1053: 1 | F1053: #VALUE! | G1053: #VALUE! | H1053: 1 | I1053: #VALUE! | J1053: 1 | K1053: 0
B1056: Pause | C1056: FORMULA | D1056: WILL_NEVER_IMPLEMENT
C1057: EXPECTED VALUE | D1057: WILL_NEVER_IMPLEMENT
B1060: Pearson | C1060: FORMULA
C1061: EXPECTED VALUE
B1064: Percentile | C1064: FORMULA | D1064: =PERCENTILE(R[-1058]C[40]:R[-1054]C[40],0.3) -> 1.9 | E1064: =PERCENTILE(R[-1058]C[39]:R[-1054]C[39],"AA") -> #VALUE! | F1064: =PERCENTILE(R[-1058]C[38]:R[-1054]C[38],-0.3) -> #NUM! | G1064: =PERCENTILE(R[-1058]C[37]:R[-1054]C[37],1.3) -> #NUM! | H1064: =PERCENTILE(R[-1058]C[36]:R[-1058]C[36],0.3) -> #NUM! | I1064: =PERCENTILE(R[-1058]C[35]:R[-1054]C[35],0.1) -> 1.3 | J1064: =PERCENTILE(R[-1058]C[34]:R[-1054]C[34],0.2) -> 1.6 | K1064: =PERCENTILE(R[-1058]C[33]:R[-1054]C[33],0.4) -> 2.2000000000000002 | L1064: =PERCENTILE(R[-1058]C[32]:R[-1054]C[32],0.5) -> 2.5 | M1064: =PERCENTILE(R[-1058]C[31]:R[-1054]C[31],0) -> 1 | N1064: =PERCENTILE(R[-1058]C[30]:R[-1054]C[30],0.005) -> 1.0149999999999999
C1065: EXPECTED VALUE | D1065: 1.9 | E1065: #VALUE! | F1065: #NUM! | G1065: #NUM! | H1065: #NUM! | I1065: 1.3 | J1065: 1.6 | K1065: 2.2000000000000002 | L1065: 2.5 | M1065: 1 | N1065: 1.0149999999999999
B1068: Percentrank | C1068: FORMULA
C1069: EXPECTED VALUE
B1072: Permut | C1072: FORMULA
C1073: EXPECTED VALUE
B1076: Phonetic | C1076: FORMULA | D1076: WILL_NEVER_IMPLEMENT
C1077: EXPECTED VALUE | D1077: WILL_NEVER_IMPLEMENT
B1080: Pi | C1080: FORMULA | D1080: =PI() -> 3.1415926535897931
C1081: EXPECTED VALUE | D1081: 3.14159265358979
B1084: Pivotadddata | C1084: FORMULA | D1084: WILL_NEVER_IMPLEMENT
C1085: EXPECTED VALUE | D1085: WILL_NEVER_IMPLEMENT
B1088: Pmt | C1088: FORMULA | D1088: =PMT(0.01, 10, R[-1072]C[-2]) -> -0.10558207655117136 | E1088: =PMT("0.01", "12", "200", "-300", TRUE) -> 5.8266127404298702 | F1088: =PMT("0.01", "12", "200", "-300", "TRUE") -> #VALUE!
C1089: EXPECTED VALUE | D1089: -0.10558207655117115 | E1089: 5.8266127404298693 | F1089: #VALUE!
B1092: Poisson | C1092: FORMULA | D1092: =POISSON(2, 5, TRUE) -> 0.12465201948308113 | E1092: =POISSON(2, 5, FALSE) -> 8.4224337488568335E-2
C1093: EXPECTED VALUE | D1093: 0.124652019 | E1093: 8.4224336999999996E-2
B1096: Poke | C1096: FORMULA | D1096: WILL_NEVER_IMPLEMENT
C1097: EXPECTED VALUE | D1097: WILL_NEVER_IMPLEMENT
B1100: Power | C1100: FORMULA | D1100: =POWER(R[-1092]C[-2],R[-1091]C[-2]) -> 1 | E1100: =POWER(R[-1093]C[-3],R[-1091]C[-3]) -> 0 | F1100: =POWER(R[-1087]C[-4],R[-1085]C[-4]) -> -1.8726591760299626E-3 | G1100: =POWER(R[-1084]C[-5],R[-1086]C[-5]) -> 1 | H1100: =POWER(R[-1086]C[-6],R[-1084]C[-6]) -> -2 | I1100: =POWER(R[-1091]C[-6],R[-1093]C[-5]) -> 1 | J1100: =POWER(R[-1091]C[-7],R[-1093]C[-5]) -> #VALUE! | K1100: =POWER(R[-1093]C[-6],R[-1091]C[-8]) -> #VALUE! | L1100: =POWER(R[-1085]C[-7],R[-1084]C[-9]) -> 1 | M1100: =POWER(R[-1089]C[-3]:R[-1089]C,R[-1092]C[-1]:R[-1092]C) -> 0 | N1100: =POWER(R[-2]C[-6]:R[1]C[-6],RC[-2]) -> -2
C1101: EXPECTED VALUE | D1101: 1 | E1101: 0 | F1101: -1.8726591760299626E-3 | G1101: 1 | H1101: -2 | I1101: 1 | J1101: #VALUE! | K1101: #VALUE! | L1101: 1 | M1101: 0 | N1101: -2
B1104: Ppmt | C1104: FORMULA | D1104: =PPMT(R[-1095]C[-1],R[-1095]C[-2],R[-1095]C[-2],R[-1097]C[6]) -> -2.7096774193548385
C1105: EXPECTED VALUE | D1105: -2.7096774190000001
B1108: Presstool | C1108: FORMULA | D1108: WILL_NEVER_IMPLEMENT
C1109: EXPECTED VALUE | D1109: WILL_NEVER_IMPLEMENT
B1112: Prob | C1112: FORMULA
C1113: EXPECTED VALUE
B1116: Product | C1116: FORMULA | D1116: =PRODUCT("2",R[-1107]C[-2]:R[-1106]C[-2]) -> 2136 | E1116: =PRODUCT("0",R[-1107]C[-3]:R[-1101]C[-3]) -> 0 | F1116: =PRODUCT(R[-1109]C[-4]:R[-1099]C[-4]) -> 0 | G1116: =PRODUCT(0,2/0,7) -> #DIV/0! | H1116: =PRODUCT(R[-1098]C[-6],R[-1102]C[-5]) -> -2.9999899999999999 | I1116: =PRODUCT(R[-1107]C[-6]:R[-1107]C[-4]) -> 1.1000000000000001 | J1116: =PRODUCT(R[-1106]C[-4]:R[-1104]C[-3]) -> 0 | K1116: =PRODUCT(R[-1108]C[-6]:R[-1107]C[-6]) -> 0 | L1116: =PRODUCT(R[-1109]C[-8]:R[-1106]C[-8]) -> 0
C1117: EXPECTED VALUE | D1117: 2136 | E1117: 0 | F1117: 0 | G1117: #DIV/0! | H1117: -2.9999899999999999 | I1117: 1.1000000000000001 | J1117: 0 | K1117: 0 | L1117: 0
B1120: Proper | C1120: FORMULA
C1121: EXPECTED VALUE
B1124: Pv | C1124: FORMULA | D1124: =PV(0.1, 10, R[-1108]C[-2]) -> -6.1445671057046853
C1125: EXPECTED VALUE | D1125: -6.1445671057046853
B1128: Quartile | C1128: FORMULA
C1129: EXPECTED VALUE
B1132: Quotient | C1132: FORMULA | D1132: =QUOTIENT(5,2) -> 2 | E1132: =QUOTIENT(4.5,3.1) -> 1 | F1132: =QUOTIENT(-10,3) -> -3 | G1132: =QUOTIENT(-5.5,2) -> -2 | H1132: =QUOTIENT(3.14159,6.02214179E+23) -> 0 | I1132: =QUOTIENT("ABCD",2) -> #VALUE! | J1132: =QUOTIENT(5,"ABCD") -> #VALUE! | K1132: =QUOTIENT(3.14159,0) -> #DIV/0!
C1133: EXPECTED VALUE | D1133: 2 | E1133: 1 | F1133: -3 | G1133: -2 | H1133: 0 | I1133: #VALUE! | J1133: #VALUE! | K1133: #DIV/0!
B1136: Radians | C1136: FORMULA | D1136: =RADIANS(R[-1129]C[-2]) -> 0 | E1136: =RADIANS(R[-1127]C[-3]) -> 3.4906585039886591E-2 | F1136: =RADIANS(R[-1122]C[-4]) -> -3.4906585039886591E-2 | G1136: =RADIANS(R[-1121]C[-5]) -> -1.7453292519943295E-2 | H1136: =RADIANS(R[-1120]C[-6]) -> 1.7453292519943295E-2 | I1136: =RADIANS(R[-1129]C[-5]) -> 0 | J1136: =RADIANS(R[-1129]C[-5]) -> #VALUE! | K1136: =RADIANS(R[-1121]C[-6]) -> 1.7453292519943295E-2 | L1136: =RADIANS(R[-1126]C[-2]:R[-1126]C[1]) -> 7.8539816339744828E-2 | M1136: =RADIANS(R[-6]C[-4]:R[1]C[-4]) -> 0 | N1136: =RADIANS(R[-1128]C[-3]:R[-1127]C[-2]) -> #VALUE!
C1137: EXPECTED VALUE | D1137: 0 | E1137: 3.4906585039886591E-2 | F1137: -3.4906585039886591E-2 | G1137: -1.7453292519943295E-2 | H1137: 1.7453292519943295E-2 | I1137: 0 | J1137: #VALUE! | K1137: 1.7453292519943295E-2 | L1137: 7.8539816339744828E-2 | M1137: 0 | N1137: #VALUE!
B1140: Rand | C1140: FORMULA | D1140: CANNOT_TEST
C1141: EXPECTED VALUE | D1141: CANNOT_TEST
B1144: Rank | C1144: FORMULA | D1144: =RANK(R[-1137]C[3],R[-1137]C[4]:R[-1137]C[7]) -> 4 | E1144: =RANK(R[-1136]C[1],R[-1137]C[3]:R[-1135]C[7],0) -> 15 | F1144: =RANK(R[-1136]C,R[-1137]C[2]:R[-1135]C[6],1) -> 1 | G1144: =RANK(R[-1136]C[2],R[-1137]C[1]:R[-1135]C[5],1) -> 10 | H1144: =RANK(R[-1136]C[1],R[-1137]C:R[-1135]C[4],0) -> 5 | I1144: =RANK(R[-1135]C[-4],R[-1137]C[-1]:R[-1135]C[3],0) -> #VALUE!
C1145: EXPECTED VALUE | D1145: 4 | E1145: 15 | F1145: 1 | G1145: 10 | H1145: 5 | I1145: #VALUE!
B1148: Rate | C1148: FORMULA | D1148: =RATE(58,-200,8000) -> 1.3541257643259374E-2
C1149: EXPECTED VALUE | D1149: 1.35412576432592E-2
B1152: Reftext | C1152: FORMULA | D1152: WILL_NEVER_IMPLEMENT
C1153: EXPECTED VALUE | D1153: WILL_NEVER_IMPLEMENT
B1156: Register | C1156: FORMULA | D1156: WILL_NEVER_IMPLEMENT
C1157: EXPECTED VALUE | D1157: WILL_NEVER_IMPLEMENT
B1160: Registerid | C1160: FORMULA | D1160: WILL_NEVER_IMPLEMENT
C1161: EXPECTED VALUE | D1161: WILL_NEVER_IMPLEMENT
B1164: Relref | C1164: FORMULA | D1164: WILL_NEVER_IMPLEMENT
C1165: EXPECTED VALUE | D1165: WILL_NEVER_IMPLEMENT
B1168: Renamecommand | C1168: FORMULA | D1168: WILL_NEVER_IMPLEMENT
C1169: EXPECTED VALUE | D1169: WILL_NEVER_IMPLEMENT
B1172: Replace | C1172: FORMULA | D1172: =REPLACE("ABCDEFG", 2.3, 3.9, "xx") -> AxxEFG | E1172: =REPLACE("ABCDEF", TRUE, TRUE, "xxx") -> xxxBCDEF | F1172: =REPLACE("ABCDEF", "3.9", "40", "x") -> ABx | G1172: =REPLACE(12345, 3, 1, 9009) -> 12900945 | H1172: =REPLACE("ABCDEF", -3, 4, "xx") -> #VALUE! | I1172: =REPLACE("ABCDEF",#NAME?, 2, "xx") -> #NAME?
C1173: EXPECTED VALUE | D1173: AxxEFG | E1173: xxxBCDEF | F1173: ABx | G1173: 12900945 | H1173: #VALUE! | I1173: #NAME?
B1176: Replaceb | C1176: FORMULA
C1177: EXPECTED VALUE
B1180: Rept | C1180: FORMULA
C1181: EXPECTED VALUE
B1184: Request | C1184: FORMULA
C1185: EXPECTED VALUE
B1188: Resettoolbar | C1188: FORMULA | D1188: WILL_NEVER_IMPLEMENT
C1189: EXPECTED VALUE | D1189: WILL_NEVER_IMPLEMENT
B1192: Restart | C1192: FORMULA | D1192: WILL_NEVER_IMPLEMENT
C1193: EXPECTED VALUE | D1193: WILL_NEVER_IMPLEMENT
B1196: Result | C1196: FORMULA
C1197: EXPECTED VALUE
B1200: Resume | C1200: FORMULA | D1200: WILL_NEVER_IMPLEMENT
C1201: EXPECTED VALUE | D1201: WILL_NEVER_IMPLEMENT
B1204: Right | C1204: FORMULA | D1204: =RIGHT("a string",0) ->  | E1204: =RIGHT("a string","6") -> string | F1204: =RIGHT("a string",10) -> a string | G1204: =RIGHT("a string",R[-1195]C[-5]) -> ng | H1204: =RIGHT(R[-1193]C[-3], R[-1187]C[-3]) -> ce | I1204: =RIGHT(TRUE,2) -> UE | J1204: =RIGHT(R[-825]C[-3]:R[-823]C[-2],R[-822]C[-2]) -> #VALUE! | K1204: =RIGHT("a string", TRUE) -> g
C1205: EXPECTED VALUE | E1205: string | F1205: a string | G1205: ng | H1205: ce | I1205: UE | J1205: #VALUE! | K1205: g
B1208: Rightb | C1208: FORMULA
C1209: EXPECTED VALUE
B1212: Roman | C1212: FORMULA
C1213: EXPECTED VALUE
B1216: Round | C1216: FORMULA | D1216: =ROUND(R[-1207]C[-2],R[-1208]C[-2]) -> 2 | E1216: =ROUND(R[-1206]C[-2],R[-1207]C[-2]) -> 1 | F1216: =ROUND(R[-1201]C[-3],R[-1200]C[-3]) -> 0 | G1216: =ROUND(R[-1201]C[-4],R[-1207]C[-4]) -> -1 | H1216: =ROUND(R[-1205]C[-5],R[-1199]C[-5]) -> 3 | I1216: =ROUND(R[-1209]C[-6],R[-1209]C[-6]) -> 0 | J1216: =ROUND(R[-1209]C[-6],R[-1208]C[-6]) -> 0 | K1216: =ROUND(R[-1209]C[-6],R[-1209]C[-8]) -> #VALUE! | L1216: =ROUND(R[-1209]C[-9],R[-1209]C[-7]) -> #VALUE! | M1216: =ROUND(R[-1203]C[-7],R[-1208]C[-7]) -> 3 | N1216: =ROUND(R[-1207]C[-1]:R[-1207]C[1],R[-1206]C[-3]) -> 345 | O1216: =ROUND(R[-1206]C[-1],R[-1206]C[-4]) -> 0 | P1216: =ROUND(R[-2]C[-2]:R[1]C[-2],R[-1206]C[-1]) -> 345
C1217: EXPECTED VALUE | D1217: 2 | E1217: 1 | F1217: 0 | G1217: -1 | H1217: 3 | I1217: 0 | J1217: 0 | K1217: #VALUE! | L1217: #VALUE! | M1217: 3 | N1217: 345 | O1217: 0 | P1217: 345
B1220: Rounddown | C1220: FORMULA | D1220: =ROUNDDOWN(1.5,0) -> 1 | E1220: =ROUNDDOWN(1.567,2) -> 1.56 | F1220: =ROUNDDOWN(R[-1207]C[-4],-1) -> -530 | G1220: =ROUNDDOWN(R[-1209]C[-4],1) -> 2.9 | H1220: =ROUNDDOWN(R[-1213]C[-4],-1) -> 0 | I1220: =ROUNDDOWN(R[-1207]C[-4],0) -> 0 | J1220: =ROUNDDOWN(R[-1203]C[-5],2) -> 2.99 | K1220: =ROUNDDOWN(R[-1213]C[-6],1) -> #VALUE! | L1220: =ROUNDDOWN(R[-1207]C[-6],3) -> 2.9990000000000001 | M1220: =ROUNDDOWN(R[-1213]C[-6]:R[-1213]C[-4],3) -> #VALUE! | N1220: =ROUNDDOWN(R[-1211]C[-2]:R[-1211]C[1],-2) -> 300 | O1220: =ROUNDDOWN(RC[-1]:R[2]C[-1],-2) -> 300 | P1220: =ROUNDDOWN(R[-1212]C[-5]:R[-1211]C[-4],2) -> #VALUE!
C1221: EXPECTED VALUE | D1221: 1 | E1221: 1.56 | F1221: -530 | G1221: 2.9 | H1221: 0 | I1221: 0 | J1221: 2.99 | K1221: #VALUE! | L1221: 2.9990000000000001 | M1221: #VALUE! | N1221: 300 | O1221: 300 | P1221: #VALUE!
B1224: Roundup | C1224: FORMULA | D1224: =ROUNDUP(0,0) -> 0 | E1224: =ROUNDUP(R[-1214]C[-3],-2) -> 600 | F1224: =ROUNDUP(R[-1211]C[-4],-2) -> -600 | G1224: =ROUNDUP(R[-1208]C[-5],0) -> 1 | H1224: =ROUNDUP(R[-1207]C[-6],-1) -> 0 | I1224: =ROUNDUP(R[-1216]C[-6],-1) -> 10 | J1224: =ROUNDUP(R[-1217]C[-5],0) -> #VALUE! | K1224: =ROUNDUP(R[-1207]C[-6],3) -> 3 | L1224: =ROUNDUP(R[-1215]C[-5]:R[-1215]C[-3],2) -> #VALUE! | M1224: =ROUNDUP(R[-1216]C[-2]:R[-1216]C[1],2) -> 3 | N1224: =ROUNDUP(R[-1]C[-3]:R[1]C[-3],1) -> 3 | O1224: =ROUNDUP(R[-1216]C[-1]:R[-1214]C,0) -> #VALUE!
C1225: EXPECTED VALUE | D1225: 0 | E1225: 600 | F1225: -600 | G1225: 1 | H1225: 0 | I1225: 10 | J1225: #VALUE! | K1225: 3 | L1225: #VALUE! | M1225: 3 | N1225: 3 | O1225: #VALUE!
B1228: Row | C1228: FORMULA | D1228: =ROW(R[-1211]C[1]) -> 17 | E1228: =ROW(R[-1215]C[-2]) -> 13 | F1228: =ROW(R[-1226]:R[-1225]) -> 2 | G1228: =ROW(R[-1217]C[-4]:R[-1214]C[-4]) -> 11 | H1228: =ROW(R[-1215]C[-5]:R[-1215]C[-3]) -> 13 | I1228: =ROW(R[-1214]C[-6]:R[-1211]C[-4]) -> 14 | J1228: =ROW(R[-4]C) -> 1224 | K1228: =ROW(R[-1215]C[-7]:R[-1211]C[-6]) -> 13
C1229: EXPECTED VALUE | D1229: 17 | E1229: 13 | F1229: 2 | G1229: 11 | H1229: 13 | I1229: 14 | J1229: 1224 | K1229: 13
B1232: Rows | C1232: FORMULA | D1232: =ROWS(R[-1226]C[-2]:R[-1222]C) -> 5
C1233: EXPECTED VALUE | D1233: 5
B1236: Rsq | C1236: FORMULA
C1237: EXPECTED VALUE
B1240: Savedialog | C1240: FORMULA | D1240: WILL_NEVER_IMPLEMENT
C1241: EXPECTED VALUE | D1241: WILL_NEVER_IMPLEMENT
B1244: Savetoolbar | C1244: FORMULA | D1244: WILL_NEVER_IMPLEMENT
C1245: EXPECTED VALUE | D1245: WILL_NEVER_IMPLEMENT
B1248: Scenarioget | C1248: FORMULA | D1248: WILL_NEVER_IMPLEMENT
C1249: EXPECTED VALUE | D1249: WILL_NEVER_IMPLEMENT
B1252: Search | C1252: FORMULA | D1252: =SEARCH("n","printer") -> 4 | E1252: =SEARCH("s",R8C5) -> 3 | F1252: =SEARCH("S",R8C5) -> 3 | G1252: =SEARCH("S",R8C5, 4) -> 8 | H1252: =SEARCH(R[-1244]C[-6],R[-1244]C[-5]) -> 7
C1253: EXPECTED VALUE | D1253: 4 | E1253: 3 | F1253: 3 | G1253: 8 | H1253: 7
B1256: Searchb | C1256: FORMULA
C1257: EXPECTED VALUE
B1260: Second | C1260: FORMULA | D1260: =SECOND(0.5) -> 0 | E1260: =SECOND(TIME(0,0,15)) -> 15 | F1260: =SECOND(R[-1249]C[-1]) -> #VALUE!
C1261: EXPECTED VALUE | D1261: 0 | E1261: 15 | F1261: #VALUE!
B1264: Selection | C1264: FORMULA
C1265: EXPECTED VALUE
B1268: Series | C1268: FORMULA
C1269: EXPECTED VALUE
B1272: Setname | C1272: FORMULA | D1272: WILL_NEVER_IMPLEMENT
C1273: EXPECTED VALUE | D1273: WILL_NEVER_IMPLEMENT
B1276: Setvalue | C1276: FORMULA | D1276: WILL_NEVER_IMPLEMENT
C1277: EXPECTED VALUE | D1277: WILL_NEVER_IMPLEMENT
B1280: Showbar | C1280: FORMULA | D1280: WILL_NEVER_IMPLEMENT
C1281: EXPECTED VALUE | D1281: WILL_NEVER_IMPLEMENT
B1284: Sign | C1284: FORMULA | D1284: =SIGN(R[-1277]C[-2]) -> 0 | E1284: =SIGN(R[-1277]C[-1]) -> 0 | F1284: =SIGN(R[-1273]C[-4]) -> 1 | G1284: =SIGN(R[-1272]C[-5]) -> -1 | H1284: =SIGN(R[-1268]C[-6]) -> 1 | I1284: =SIGN(R[-1267]C[-7]) -> 0 | J1284: =SIGN(R[-1269]C[-7]) -> -1 | K1284: =SIGN(R[-1268]C[-6]) -> 1 | L1284: =SIGN(R[-1277]C[-7]) -> #VALUE! | M1284: =SIGN(R[-1276]C[-3]:R[-1276]C) -> 1 | N1284: =SIGN(R[-2]C[-4]:R[1]C[-4]) -> -1 | O1284: =SIGN(R[-1275]C[-1]:R[-1274]C) -> #VALUE!
C1285: EXPECTED VALUE | D1285: 0 | E1285: 0 | F1285: 1 | G1285: -1 | H1285: 1 | I1285: 0 | J1285: -1 | K1285: 1 | L1285: #VALUE! | M1285: 1 | N1285: -1 | O1285: #VALUE!
B1288: Sin | C1288: FORMULA | D1288: =SIN(R[-1281]C[-2]) -> 0 | E1288: =SIN(R[-1280]C[-3]) -> 0.8414709848078965 | F1288: =SIN(R[-1279]C[-4]) -> 0.90929742682568171 | G1288: =SIN(R[-1275]C[-5]) -> 7.0692098333373365E-2 | H1288: =SIN(R[-1272]C[-6]) -> 0.8414709848078965 | I1288: =SIN(R[-1270]C[-7]) -> #VALUE! | J1288: =SIN(R[-1273]C[-7]) -> -0.84147638778888156 | K1288: =SIN(R[-1281]C[-6]) -> #VALUE! | L1288: =SIN(R[-1272]C[-7]) -> 0.89120736006143542 | M1288: =SIN(R[-1280]C[-2]:R[-1280]C) -> 0.14112000805986721 | N1288: =SIN(R[-1]C[-2]:R[1]C[-2]) -> 0.77783110790947796 | O1288: =SIN(R[-1280]C[-1]:R[-1279]C) -> #VALUE! | P1288: =SIN(R[-1273]C[-11]) -> 0.8414709848078965
C1289: EXPECTED VALUE | D1289: 0 | E1289: 0.8414709848078965 | F1289: 0.90929742682568171 | G1289: 7.0692098333373365E-2 | H1289: 0.8414709848078965 | I1289: #VALUE! | J1289: -0.84147638778888156 | K1289: #VALUE! | L1289: 0.89120736006143542 | M1289: 0.14112000805986721 | N1289: 0.77783110790947796 | O1289: #VALUE! | P1289: 0.8414709848078965
B1292: Sinh | C1292: FORMULA | D1292: =SINH(R[-1285]C[-2]) -> 0 | E1292: =SINH(R[-1283]C[-3]) -> 3.626860407847019 | F1292: =SINH(R[-1278]C[-4]) -> -3.626860407847019 | G1292: =SINH(R[-1276]C[-5]) -> 1.1752011936438014 | H1292: =SINH(R[-1274]C[-6]) -> #VALUE! | I1292: =SINH(R[-1285]C[-5]) -> 0 | J1292: =SINH(R[-1285]C[-5]) -> #VALUE! | K1292: =SINH(R[-1277]C[-6]) -> 1.1752011936438014 | L1292: =SINH(R[-1284]C[-6]) -> 1.1752011936438014 | M1292: =SINH(R[-1284]C[-2]:R[-1284]C) -> 10.017874927409903 | N1292: =SINH(R[-1]C[-2]:R[1]C[-2]) -> 1.4650188248182272 | O1292: =SINH(R[-1284]C[-1]:R[-1283]C) -> #VALUE!
C1293: EXPECTED VALUE | D1293: 0 | E1293: 3.626860407847019 | F1293: -3.626860407847019 | G1293: 1.1752011936438014 | H1293: #VALUE! | I1293: 0 | J1293: #VALUE! | K1293: 1.1752011936438014 | L1293: 1.1752011936438014 | M1293: 10.017874927409903 | N1293: 1.4650188248182272 | O1293: #VALUE!
B1296: Skew | C1296: FORMULA
C1297: EXPECTED VALUE
B1300: Sln | C1300: FORMULA
C1301: EXPECTED VALUE
B1304: Slope | C1304: FORMULA | D1304: =SLOPE(R[-1297]C[7]:R[-1294]C[7],R[-1297]C[8]:R[-1294]C[8]) -> 0.84645155734149757 | E1304: =SLOPE(R[-1297]C[7]:R[-1294]C[7],R[-1297]C[6]:R[-1294]C[6]) -> 1.0997100000000002
C1305: EXPECTED VALUE | D1305: 0.84645155734149757 | E1305: 1.0997100000000002
B1308: Small | C1308: FORMULA | D1308: =SMALL(R[-1301]C[-2]:R[-1291]C[-2],5) -> 0 | E1308: =SMALL(R[-1301]C[-2]:R[-1294]C[-2],6) -> 1.1000000000000001 | F1308: =SMALL(R[-1301]C[-3]:R[-1297]C[-2],3) -> 1.0000100000000001 | G1308: =SMALL(R[-1301]C[-3]:R[-1298]C[-2],2) -> #NUM! | H1308: =SMALL(R[-1300]C[-3]:R[-1298]C[-2],3) -> 9999999999 | I1308: =SMALL(R[-1298]C[-6]:R[-1293]C[-5],4) -> 1.0000100000000001 | J1308: =SMALL(R[-1298]C[-5]:R[-1297]C[-4],1) -> 0 | K1308: =SMALL(R[-1301]C[-8]:R[-1298]C[-8],100) -> #NUM!
C1309: EXPECTED VALUE | D1309: 0 | E1309: 1.1000000000000001 | F1309: 1.0000100000000001 | G1309: #NUM! | H1309: 9999999999 | I1309: 1.0000100000000001 | J1309: 0 | K1309: #NUM!
B1312: Spellingcheck | C1312: FORMULA | D1312: WILL_NEVER_IMPLEMENT
C1313: EXPECTED VALUE | D1313: WILL_NEVER_IMPLEMENT
B1316: Sqrt | C1316: FORMULA | D1316: =SQRT(16) -> 4 | E1316: =SQRT(R[-1309]C[-3]) -> 0 | F1316: =SQRT(R[-1308]C[-4]) -> 1 | G1316: =SQRT(R[-1307]C[-4]) -> 1.0488088481701516 | H1316: =SQRT(R[-1300]C[-5]) -> #NUM! | I1316: =SQRT(-4) -> #NUM! | J1316: =SQRT(R[-1300]C[-8]) -> 1 | K1316: =SQRT(R[-1303]C[-6]) -> 0 | L1316: =SQRT(R[-1309]C[-7]) -> #VALUE! | M1316: =SQRT(R[-1303]C[-2]) -> 0 | N1316: =SQRT(R[-1306]C[-2]:R[-1306]C) -> 3.1622776601683794E-3 | O1316: =SQRT(R[-1]C[-5]:R[1]C[-5]) -> 1 | P1316: =SQRT(R[-1309]C[-1]:R[-1308]C) -> #VALUE!
C1317: EXPECTED VALUE | D1317: 4 | E1317: 0 | F1317: 1 | G1317: 1.0488088481701516 | H1317: #NUM! | I1317: #NUM! | J1317: 1 | K1317: 0 | L1317: #VALUE! | M1317: 0 | N1317: 3.1622776601683794E-3 | O1317: 1 | P1317: #VALUE!
B1320: Standardize | C1320: FORMULA
C1321: EXPECTED VALUE
B1324: Stdev | C1324: FORMULA | D1324: =STDEV(R[-1317]C[-2]:R[-1315]C[-2],R[-1317]C[-1]:R[-1315]C[-1],R[-1314]C[-1]:R[-1313]C[-1]) -> 1.0696254184317784 | E1324: =STDEV(R[-1310]C[-3]:R[-1308]C[-3],R[-1309]C[-1]:R[-1307]C[-1],R[-1309]C) -> 0.70710678118654757 | F1324: =STDEV(R[-1309]C[-1]:R[-1307]C[-1]) -> #DIV/0! | G1324: =STDEV("1","2") -> 0.70710678118654757 | H1324: =STDEV(R[-1310]C[-4]:R[-1309]C[-4],R[-1311]C[-3]) -> #DIV/0! | I1324: =STDEV(R[-1314]C[-3],R[-1316]C[-3]) -> 0.70709971011873562 | J1324: =STDEV(R[-1316]C[-4]:R[-1314]C[-3]) -> 4472135954.0664005 | K1324: =STDEV(TRUE, FALSE, TRUE) -> 0.57735026918962584 | L1324: =STDEV(1,2,3,R[-1304]C[-7]) -> 1
C1325: EXPECTED VALUE | D1325: 1.0696254184317784 | E1325: 0.70710678118654757 | F1325: #DIV/0! | G1325: 0.70710678118654757 | H1325: #DIV/0! | I1325: 0.70709971011873562 | J1325: 4472135954.0664005 | K1325: 0.57735026918962584 | L1325: 1
B1328: Stdeva | C1328: FORMULA
C1329: EXPECTED VALUE
B1332: Stdevp | C1332: FORMULA
C1333: EXPECTED VALUE
B1336: Stdevpa | C1336: FORMULA
C1337: EXPECTED VALUE
B1340: Step | C1340: FORMULA
C1341: EXPECTED VALUE
B1344: Steyx | C1344: FORMULA
C1345: EXPECTED VALUE
B1348: Substitute | C1348: FORMULA | D1348: =SUBSTITUTE(R[-1336]C[1],"n","N") -> NoN-Numeric | E1348: =SUBSTITUTE("ISCASESENSITIVE","case","CASE") -> ISCASESENSITIVE | F1348: =SUBSTITUTE("teststr","t","T",1.9) -> Teststr | G1348: =SUBSTITUTE("teststr","t","T",0) -> #VALUE! | H1348: =SUBSTITUTE("teststr","z","T",1) -> teststr | I1348: =SUBSTITUTE("testaatestbbtestcc","test","testtest") -> testtestaatesttestbbtesttestcc | K1348: =SUBSTITUTE("matchlastchar", "r", "R") -> matchlastchaR | L1348: =SUBSTITUTE("nomatch", "zzz", "ZZZ") -> nomatch | M1348: =SUBSTITUTE("regex**chars", "*", "T") -> regexTTchars | N1348: =SUBSTITUTE("1.11", "1", "2", 1) -> 2.11 | O1348: =SUBSTITUTE(R[-1341]C[-10], "1", "2", 1) ->  | P1348: =SUBSTITUTE("testblankmatch", "", "!", 1) -> testblankmatch | Q1348: =SUBSTITUTE("   ", " ", "*") -> *** | R1348: =SUBSTITUTE("testblanknewstr", "t", R[-1341]C[-13]) -> esblanknewsr | S1348: =SUBSTITUTE("   ", " ", "") ->  | T1348: =SUBSTITUTE("   ", " ", "", 1) ->  | U1348: =SUBSTITUTE("ABCBBDBEB", "B", "x", 1) -> AxCBBDBEB | V1348: =SUBSTITUTE("ABCBBDBEB", "B", "x", 0) -> #VALUE! | W1348: =SUBSTITUTE("ABCBBDBEB", "B", "x", -1) -> #VALUE! | X1348: =SUBSTITUTE("ABCBBDBEB", "B", "x", 3) -> ABCBxDBEB | Y1348: =SUBSTITUTE("ABCBBDBEB", "B", "x", 7) -> ABCBBDBEB
C1349: EXPECTED VALUE | D1349: NoN-Numeric | E1349: ISCASESENSITIVE | F1349: Teststr | G1349: #VALUE! | H1349: teststr | I1349: testtestaatesttestbbtesttestcc | K1349: matchlastchaR | L1349: nomatch | M1349: regexTTchars | N1349: 2.11 | P1349: testblankmatch | Q1349: *** | R1349: esblanknewsr | U1349: AxCBBDBEB | V1349: #VALUE! | W1349: #VALUE! | X1349: ABCBxDBEB | Y1349: ABCBBDBEB
B1352: Subtotal | C1352: FORMULA | D1352: =SUBTOTAL(9,R[-1345]C[-2]:R[-1343]C[-2]) -> 3 | E1352: =SUBTOTAL(1,R7C2:R9C2) -> 1 | F1352: =SUBTOTAL(2,R7C2:R9C2) -> 3 | G1352: =SUBTOTAL(4,R7C2:R9C2) -> 2 | H1352: =SUBTOTAL(5,R7C2:R9C2) -> 0
C1353: EXPECTED VALUE | D1353: 3 | E1353: 1 | F1353: 3 | G1353: 2 | H1353: 0
B1356: Sum | C1356: FORMULA | D1356: =SUM(R[-1348]C[-2]:R[-1345]C[-2],R[-1346]C[-1],R[-1339]C[1],R[-1342]C[1],R[-1340]C,R[-1340]C[-2],R[-1338]C[-2]) -> 10000000537.00001 | E1356: =SUM(R[-1348]C[-3]:R[-1346]C,R[-1347]C:R[-1340]C,R[-1344]C[2]) -> 539.10001999999997 | F1356: =SUM(R[-1343]C,R[-1346]C) -> 1.0000000000000001E-5 | G1356: =SUM(R[-1341]C[-2]:R[-1339]C[-2]) -> 0 | H1356: =SUM("-23",R[-1341]C[-3],R[-1343]C[-5]:R[-1341]C[-5],R[-1347]C[-6]:R[-1347]C[-4]) -> -1000023.8999900001 | I1356: =SUM(R[-1348]C[-2]:R[-1346]C,R[-1344]C,R[-1345]C[1],R[-1346]C[1]) -> 475.98120999999998 | J1356: =SUM("1", "1.1", "2.99999") -> 5.09999
C1357: EXPECTED VALUE | D1357: 10000000537.00001 | E1357: 539.10001999999997 | F1357: 1.0000000000000001E-5 | G1357: 0 | H1357: -1000023.8999900001 | I1357: 475.98120999999998 | J1357: 5.09999
B1360: Sumif | C1360: FORMULA | D1360: =SUMIF(R[-1353]C[3]:R[-1351]C[6], "<3") -> 9.345600000000001 | E1360: =SUMIF(R[-1353]C[22]:R[-1347]C[22],R[-1350]C[-2]:R[-1350]C[-1], R[-1353]C[-2]) -> 1.1000000000000001
C1361: EXPECTED VALUE | D1361: 9.3455999999999992 | E1361: 1.1000000000000001
B1364: Sumproduct | C1364: FORMULA | D1364: =SUMPRODUCT(R[-1356]C[-2]:R[-1355]C[-2]) -> 3 | E1364: =SUMPRODUCT(R[-1356]C[-3]:R[-1354]C[-3],R[-1356]C[-2]:R[-1354]C[-2]) -> 536.20535000000007 | F1364: =SUMPRODUCT(R[-1355]C[-4]:R[-1354]C[-4],R[-1355]C[-3]:R[-1354]C[-3]) -> 536.20534000000009 | G1364: =SUMPRODUCT(3,R[-1354]C[-5],R[-1355]C[-4]) -> 1762.2 | H1364: =SUMPRODUCT(R[-1355]C[-5]:R[-1355]C[-5],3,R[-1354]C[-6],R[-1355]C[-5]:R[-1355]C[-5]) -> 1938.4200000000003 | I1364: =SUMPRODUCT(2, R[-1354]C[-6]:R[-1353]C[-6]) -> #VALUE! | J1364: =SUMPRODUCT(R[2]C[-3]:R[2]C[-3],R[2]C[-1]:R[2]C[-1]) -> #VALUE! | K1364: =SUMPRODUCT(R[2]C[-2]:R[2]C[-1],R[2]C:R[2]C[1]) -> #REF! | L1364: =SUMPRODUCT(R[2]C[-1],R[2]C[-2]) -> #REF!
C1365: EXPECTED VALUE | D1365: 3 | E1365: 536.20535000000007 | F1365: 536.20534000000009 | G1365: 1762.2 | H1365: 1938.4200000000003 | I1365: #VALUE! | J1365: #VALUE! | K1365: #REF! | L1365: #REF!
G1366: 4 | I1366: 2 | J1366: 3 | K1366: =R[-1356]C[16] -> #REF! | L1366: 5
B1368: Sumsq | C1368: FORMULA | D1368: =SUMSQ(R[-1360]C[-2]:R[-1358]C[-2]) -> 285161 | E1368: =SUMSQ(R[-1361]C[-2]:R[-1357]C[-2]) -> 11.209960000299999 | F1368: =SUMSQ(R[-1361]C[-3]:R[-1359]C[-2]) -> 1.2100000001000002 | G1368: =SUMSQ(R[-1357]C[-4],R[-1358]C[-4],R[-1359]C[-4],R[-1353]C[-3]) -> 11.209960000199999 | H1368: =SUMSQ(R[-1360]C[-6]:R[-1359]C[-4],R[-1353]C[-3],R[-1355]C[-2]) -> 6.2100000001 | I1368: =SUMSQ(R[-1360]C[-2]:R[-1359]C) -> 71.94652146 | J1368: =SUMSQ(R[-1355]C[-5]:R[-1354]C[-4]) -> 0 | K1368: =SUMSQ(R[-1355]C[-6]:R[-1352]C[-6]) -> 0 | L1368: =SUMSQ(R[-1358]C[-6]:R[-1354]C[-3]) -> 622175.00000000012 | M1368: =SUMSQ(TRUE, TRUE, FALSE) -> 2 | N1368: =SUMSQ("2", "3", 4) -> 29
C1369: EXPECTED VALUE | D1369: 285161 | E1369: 11.209960000299999 | F1369: 1.2100000001000002 | G1369: 11.209960000199999 | H1369: 6.2100000001 | I1369: 71.94652146 | J1369: 0 | K1369: 0 | L1369: 622175 | M1369: 2 | N1369: 29
B1372: Sumx2my2 | C1372: FORMULA | D1372: =SUMX2MY2(R[-1365]C[-2]:R[-1362]C[-1],R[-1364]C[-1]:R[-1361]C) -> 285149.7900399997 | E1372: =SUMX2MY2(R[-1364]C[-1]:R[-1361]C,R[-1364]C[-2]:R[-1361]C[-1]) -> #DIV/0! | F1372: =SUMX2MY2(R[-1365]C[1]:R[-1363]C[3],R[-1365]C[2]:R[-1363]C[4]) -> -74.836680639999997 | G1372: =SUMX2MY2(R[-1364]C[-2]:R[-1358]C[-2],R[-1364]C[-1]:R[-1358]C[-1]) -> #DIV/0! | H1372: =SUMX2MY2(R[-1364]C[-6]:R[-1362]C[-6],R[-1364]C[-1]:R[-1364]C[1]) -> 285138.753998 | I1372: =SUMX2MY2(R[-1364]C[-2]:R[-1361]C[-2],R[-1364]C[-1]:R[-1361]C[-1]) -> -14.438935530000002 | J1372: =SUMX2MY2(R[-1364]C[-2]:R[-1362]C[-2],R[-1365]C[-3]:R[-1364]C[-3]) -> #N/A | K1372: =SUMX2MY2(R[-1364]C[-4],R[-1364]C[-3]) -> -7.9920000000000009 | L1372: =SUMX2MY2(R[-1365]C[17]:R[-1360]C[24],R[-1365]C[18]:R[-1360]C[25]) -> -2304 | M1372: =SUMX2MY2(R[-1362]C[14]:R[-1361]C[14],R[-1361]C[14]:R[-1360]C[14]) -> #REF!
C1373: EXPECTED VALUE | D1373: 285149.7900399997 | E1373: #DIV/0! | F1373: -74.836680639999997 | G1373: #DIV/0! | H1373: 285138.753998 | I1373: -14.438935530000002 | J1373: #N/A | K1373: -7.9920000000000009 | L1373: -2304 | M1373: #REF!
B1376: Sumx2py2 | C1376: FORMULA | D1376: =SUMX2PY2(R[-1369]C[-2]:R[-1366]C[-2],R[-1368]C[-1]:R[-1365]C[-1]) -> 285172.2099600003 | E1376: =SUMX2PY2(R[-1368]C[-2]:R[-1366]C[-2],R[-1361]C[-3]:R[-1361]C[-1]) -> 3.2100200002000001 | F1376: =SUMX2PY2(R[-1360]C[-4]:R[-1360]C[-2],R[-1360]C[-4]:R[-1358]C[-4]) -> #DIV/0! | G1376: =SUMX2PY2(R[-1362]C[-5]:R[-1360]C[-5],R[-1361]C[-2]:R[-1359]C[-2]) -> #DIV/0! | H1376: =SUMX2PY2(R[-1369]C[-6]:R[-1367]C[-6],R[-1360]C[-6]:R[-1360]C[-4]) -> 2.21 | I1376: =SUMX2PY2(R[-1369]C[-2]:R[-1367]C[-1],R[-1369]C[-1]:R[-1367]C) -> 110.88929734999999 | J1376: =SUMX2PY2(R[-1369]C[-3]:R[-1367]C[-2],R[-1369]C:R[-1364]C) -> 105.79313625010001 | K1376: =SUMX2PY2(R[-1369]C[-6]:R[-1366]C[-6],R[-1369]C[-7]:R[-1366]C[-7]) -> #DIV/0!
C1377: EXPECTED VALUE | D1377: 285172.2099600003 | E1377: 3.2100200002000001 | F1377: #DIV/0! | G1377: #DIV/0! | H1377: 2.21 | I1377: 110.88929734999999 | J1377: 105.79313625010001 | K1377: #DIV/0!
B1380: Sumxmy2 | C1380: FORMULA | D1380: =SUMXMY2(R[-1373]C[-2]:R[-1370]C[-2],R[-1373]C[-1]:R[-1370]C[-1]) -> 284090.79932000022 | E1380: =SUMXMY2(R[-1369]C[-2]:R[-1367]C[-2],R[-1367]C[-3]:R[-1365]C[-3]) -> 2000002288333.9893 | F1380: =SUMXMY2(2,4) -> 4 | G1380: =SUMXMY2(R[-1373]C[-3]:R[-1369]C[-3],R[-1372]C[-4]:R[-1368]C[-4]) -> #DIV/0! | H1380: =SUMXMY2(R[-1373]C[-5]:R[-1370]C[-5],R[-1373]C[-5]:R[-1371]C[-5]) -> #N/A | I1380: =SUMXMY2(R[-1366]C[-4]:R[-1363]C[-4],R[-1371]C[-6]:R[-1368]C[-6]) -> #DIV/0! | J1380: =SUMXMY2(R[-1365]C[-5]:R[-1364]C[-5],R[-1365]C[-7]:R[-1364]C[-7]) -> #DIV/0!
C1381: EXPECTED VALUE | D1381: 284090.79932000022 | E1381: 2000002288333.9893 | F1381: 4 | G1381: #DIV/0! | H1381: #N/A | I1381: #DIV/0! | J1381: #DIV/0!
B1384: Syd | C1384: FORMULA
C1385: EXPECTED VALUE
B1388: T | C1388: FORMULA | D1388: =T("") ->  | E1388: =T(R[-1378]C[-3]) ->  | F1388: =T(R[-1372]C[-4]) ->  | G1388: =T(R[-1370]C[-5]) -> TRUE | H1388: =T(R[-1380]C[-4]) ->  | I1388: =T(R[-1377]C[-6]) ->  | J1388: =T(R[-1376]C[-5]) -> non-numeric | K1388: =T(R[-1372]C[-6]) -> 1.1 | L1388: =T(R[-1375]C[-6]) -> 2.99999 | M1388: =T(R[-1376]C[-5]:R[-1376]C[-3]) ->  | N1388: =T(R[-1381]C[-2]:R[-1381]C) ->  | O1388: =T(R[-1]C[-5]:R[1]C[-5]) -> 
C1389: EXPECTED VALUE | G1389: TRUE | J1389: non-numeric | K1389: 1.1 | L1389: 2.99999
B1392: Tan | C1392: FORMULA | D1392: =TAN(R[-1385]C[-2]) -> 0 | E1392: =TAN(R[-1383]C[-2]) -> 1.9647596572486523 | F1392: =TAN(R[-1378]C[-4]) -> 2.1850398632615189 | G1392: =TAN(R[-1376]C[-5]) -> 1.5574077246549023 | H1392: =TAN(R[-1385]C[-4]) -> 0 | I1392: =TAN(R[-1385]C[-4]) -> #VALUE! | J1392: =TAN(R[-1377]C[-5]) -> 1.5574077246549023 | K1392: =TAN(R[-1385]C[-2]:R[-1385]C[1]) -> 1.5574077246549023 | L1392: =TAN(RC[-2]:R[1]C[-2]) -> 74.685933398765371 | M1392: =TAN(R[-1385]C[-1]:R[-1384]C) -> #VALUE!
C1393: EXPECTED VALUE | D1393: 0 | E1393: 1.9647596572486523 | F1393: 2.1850398632615189 | G1393: 1.5574077246549023 | H1393: 0 | I1393: #VALUE! | J1393: 1.5574077246549023 | K1393: 1.5574077246549023 | L1393: 74.685933398765371 | M1393: #VALUE!
B1396: Tanh | C1396: FORMULA | D1396: =TANH(R[-1389]C[-2]) -> 0 | E1396: =TANH(R[-1388]C[-3]:R[-1387]C[-2]) -> #VALUE! | F1396: =TANH(R[-1382]C[-3]) -> -0.99505465502537715 | G1396: =TANH(R[-2]C[-1]:R[1]C[-1]) -> -0.75950940305076076 | H1396: =TANH(R[-1389]C[-2]:R[-1389]C) -> 0.96402758007581701 | I1396: =TANH(R[-2]C[-1]:R[1]C[-1]) -> 0.74606799844559946 | J1396: =TANH(R[-1380]C[-5]) -> 0.8004990217606297 | K1396: =TANH(R[-1380]C[-9]) -> 0.76159415595576485 | L1396: =TANH(R[-1378]C[-10]) -> #VALUE! | M1396: =TANH(R[-1389]C[-2]:R[-1388]C[-1]) -> #VALUE! | N1396: =TANH(R[-1388]C[-5]:R[-1388]C[-3]) -> #VALUE!
C1397: EXPECTED VALUE | D1397: 0 | E1397: #VALUE! | F1397: -0.99505465502537715 | G1397: -0.75950940305076087 | H1397: 0.96402758007581701 | I1397: 0.74606799844559946 | J1397: 0.8004990217606297 | K1397: 0.76159415595576485 | L1397: #VALUE! | M1397: #VALUE! | N1397: #VALUE!
B1400: Tdist | C1400: FORMULA
C1401: EXPECTED VALUE
B1404: Terminate | C1404: FORMULA | D1404: WILL_NEVER_IMPLEMENT
C1405: EXPECTED VALUE | D1405: WILL_NEVER_IMPLEMENT
B1408: Text | C1408: FORMULA | D1408: =TEXT(R[-1399]C[-2],"0%")&"'" -> 200%' | E1408: =TEXT(321.321111111111,"#.##")&"'" -> 321.32' | F1408: =TEXT(R[-1398]C[-4],"$#,##0.00")&"'" -> $534.00'
C1409: EXPECTED VALUE | D1409: 200%' | E1409: 321.32' | F1409: $534.00'
B1412: Textbox | C1412: FORMULA | D1412: WILL_NEVER_IMPLEMENT
C1413: EXPECTED VALUE | D1413: WILL_NEVER_IMPLEMENT
B1416: Textref | C1416: FORMULA | D1416: WILL_NEVER_IMPLEMENT
C1417: EXPECTED VALUE | D1417: WILL_NEVER_IMPLEMENT
B1420: Time | C1420: FORMULA | D1420: =TIME(12,0,0) -> 0.5 | E1420: =TIME(27,0,0) -> 0.125
C1421: EXPECTED VALUE | D1421: 0.5 | E1421: 0.125
B1424: Timevalue | C1424: FORMULA
C1425: EXPECTED VALUE
B1428: Tinv | C1428: FORMULA
C1429: EXPECTED VALUE
B1432: Today | C1432: FORMULA
C1433: EXPECTED VALUE
B1436: Transpose | C1436: FORMULA
C1437: EXPECTED VALUE
B1440: Trend | C1440: FORMULA
C1441: EXPECTED VALUE
B1444: Trim | C1444: FORMULA | D1444: =TRIM(R[-1437]C[1]) ->  | E1444: =TRIM(R[-1436]C) -> nospaces | F1444: =TRIM(R[-1435]C[-1]) -> sp ace s | G1444: =TRIM(R[-1434]C[-2]) -> endsWithSpace | H1444: =TRIM(R[-1433]C[-3]) -> beginsWithSpace | I1444: =TRIM(R[-1432]C[-4]) -> non-numeric | J1444: =TRIM(R[-1431]C[-5]) -> 0 | K1444: =TRIM(R[-1430]C[-6]) -> 0.000001 | L1444: =TRIM(R[-1429]C[-7]) -> 1 | M1444: =TRIM(R[-1428]C[-8]) -> 1.1 | N1444: =TRIM(R[-1427]C[-9]) -> 2.99999 | O1444: =TRIM(R[-1426]C[-10]) -> 99999999 | P1444: =TRIM(R[-1425]C[-11]) -> alph4Num3ric | Q1444: =TRIM(R[-1424]C[-12]) ->  | R1444: =TRIM(R[-1437]C[-13]:R[-1436]C[-13]) -> #VALUE! | S1444: =TRIM(9) -> 9
C1445: EXPECTED VALUE | E1445: nospaces | F1445: sp ace s | G1445: endsWithSpace | H1445: beginsWithSpace | I1445: non-numeric | J1445: 0 | K1445: 0.000001 | L1445: 1 | M1445: 1.1 | N1445: 2.99999 | O1445: 99999999 | P1445: alph4Num3ric | R1445: #VALUE! | S1445: 9
B1448: Trimmean | C1448: FORMULA
C1449: EXPECTED VALUE
B1452: True | C1452: FORMULA | D1452: =TRUE() -> 1
C1453: EXPECTED VALUE | D1453: 1
B1456: Trunc | C1456: FORMULA | D1456: =TRUNC(8.9) -> 8 | E1456: =TRUNC(8.9,1) -> 8.9 | F1456: =TRUNC(-8.9) -> -8 | G1456: =TRUNC(PI()) -> 3
C1457: EXPECTED VALUE | D1457: 8 | E1457: 8.9 | F1457: -8 | G1457: 3
B1460: Ttest | C1460: FORMULA
C1461: EXPECTED VALUE
B1464: Type | C1464: FORMULA
C1465: EXPECTED VALUE
B1468: Unregister | C1468: FORMULA | D1468: WILL_NEVER_IMPLEMENT
C1469: EXPECTED VALUE | D1469: WILL_NEVER_IMPLEMENT
B1472: Upper | C1472: FORMULA | D1472: =UPPER("this is all lower") -> THIS IS ALL LOWER | E1472: =UPPER("123 456") -> 123 456 | F1472: =UPPER("ASDFGH") -> ASDFGH | G1472: =UPPER(123) -> 123 | H1472: =UPPER(R[-1462]C[-6]) -> 534 | I1472: =UPPER(R[-1456]C[-7]) -> TRUE | J1472: =UPPER(R[-1454]C[-8]) -> TRUE | K1472: =UPPER(R[-1461]C[-6]) -> BEGINSWITHSPACE | L1472: =UPPER(R[-1453]C[-7]) -> ALPH4NUM3RIC | M1472: =UPPER(R[-1465]C[-2]:R[-1465]C[1]) -> ALPHANUM | N1472: =UPPER(R[-2]C[-2]:R[1]C[-2]) -> ALPH4NUM3RIC | O1472: =UPPER(R[-1465]C[-1]:R[-1464]C[1]) -> #VALUE! | P1472: =UPPER(R[-1463]C[-3]:R[-1462]C[-2]) -> #VALUE! | Q1472: =UPPER(R[-1460]C[10]) -> #NUM! | R1472: =UPPER(misc!R[-472]C:R[528]C) -> 
C1473: EXPECTED VALUE | D1473: THIS IS ALL LOWER | E1473: 123 456 | F1473: ASDFGH | G1473: 123 | H1473: 534 | I1473: TRUE | J1473: TRUE | K1473: BEGINSWITHSPACE | L1473: ALPH4NUM3RIC | M1473: ALPHANUM | N1473: ALPH4NUM3RIC | O1473: #VALUE! | P1473: #VALUE! | Q1473: #NUM!
B1476: Usdollar | C1476: FORMULA
C1477: EXPECTED VALUE
B1480: Value | C1480: FORMULA | D1480: =VALUE("0.33") -> 0.33 | E1480: =VALUE("$1,000") -> 1000
C1481: EXPECTED VALUE | D1481: 0.33 | E1481: 1000
B1484: Var | C1484: FORMULA | D1484: =VAR(R[-1477]C[-2]:R[-1475]C[-2],R[-1477]C[-1]:R[-1475]C[-1],R[-1474]C[-1]:R[-1473]C[-1]) -> 1.1440985357553568 | E1484: =VAR(R[-1470]C[-3]:R[-1468]C[-3],R[-1469]C[-1]:R[-1467]C[-1],R[-1469]C) -> 0.5 | F1484: =VAR(R[-1469]C[-1]:R[-1467]C[-1]) -> #DIV/0! | G1484: =VAR("1","2") -> 0.5 | H1484: =VAR(R[-1470]C[-4]:R[-1469]C[-4],R[-1471]C[-3]) -> #DIV/0! | I1484: =VAR(R[-1474]C[-3],R[-1476]C[-3]) -> 0.49999000004999994 | J1484: =VAR(R[-1476]C[-4]:R[-1474]C[-3]) -> 1.9999999991653392E+19 | K1484: =VAR(TRUE, FALSE, TRUE) -> 0.33333333333333337 | L1484: =VAR(1,2,3,R[-1464]C[-7]) -> 1
C1485: EXPECTED VALUE | D1485: 1.144098536 | E1485: 0.5 | F1485: #DIV/0! | G1485: 0.5 | H1485: #DIV/0! | I1485: 0.49998999999999999 | J1485: 2E+19 | K1485: 0.33333333300000001 | L1485: 1
B1488: Vara | C1488: FORMULA
C1489: EXPECTED VALUE
B1492: Varp | C1492: FORMULA | D1492: =VARP(R[-1485]C[-2]:R[-1483]C[-2],R[-1485]C[-1]:R[-1483]C[-1],R[-1482]C[-1]:R[-1481]C[-1]) -> 1.0010862187859373 | E1492: =VARP(R[-1478]C[-3]:R[-1476]C[-3],R[-1477]C[-1]:R[-1475]C[-1],R[-1477]C) -> 0.25 | F1492: =VARP(R[-1477]C[-1]:R[-1475]C[-1]) -> #DIV/0! | G1492: =VARP("1","2") -> 0.25 | H1492: =VARP(R[-1478]C[-4]:R[-1477]C[-4],R[-1479]C[-3]) -> #DIV/0! | I1492: =VARP(R[-1482]C[-3],R[-1484]C[-3]) -> 0.24999500002499997 | J1492: =VARP(R[-1484]C[-4]:R[-1482]C[-3]) -> 1.5999999993322713E+19 | K1492: =VARP(TRUE, FALSE, TRUE) -> 0.22222222222222221 | L1492: =VARP(1,2,3,R[-1464]C[-7]) -> 0.66666666666666663
C1493: EXPECTED VALUE | D1493: 1.0010862190000001 | E1493: 0.25 | F1493: #DIV/0! | G1493: 0.25 | H1493: #DIV/0! | I1493: 0.24999499999999999 | J1493: 1.6E+19 | K1493: 0.222222222 | L1493: 0.66666666699999999
B1496: Varpa | C1496: FORMULA
C1497: EXPECTED VALUE
B1500: Vdb | C1500: FORMULA
C1501: EXPECTED VALUE
B1504: Viewget | C1504: FORMULA | D1504: WILL_NEVER_IMPLEMENT
C1505: EXPECTED VALUE | D1505: WILL_NEVER_IMPLEMENT
B1508: Vlookup | C1508: FORMULA | D1508: =VLOOKUP(534,R6C2:R12C8,2) -> 1.0000100000000001 | E1508: =VLOOKUP(534,R6C2:R12C8,4) -> endsWithSpace | F1508: =VLOOKUP(534,R6C2:R12C8,4, TRUE) -> endsWithSpace | G1508: =VLOOKUP(-1,R6C2:R12C8,4, TRUE) -> #N/A
C1509: EXPECTED VALUE | D1509: 1.0000100000000001 | E1509: endsWithSpace | F1509: endsWithSpace | G1509: #N/A
B1512: Volatile | C1512: FORMULA
C1513: EXPECTED VALUE
B1516: Weekday | C1516: FORMULA
C1517: EXPECTED VALUE
B1520: Weeknum | C1520: FORMULA | D1520: =WEEKNUM(DATE(2009, 11, 2),1) -> 45 | E1520: =WEEKNUM(DATE(2009, 3, 9),2) -> 11 | F1520: =WEEKNUM(DATE(2013, 1, 1),2) -> 1 | G1520: =WEEKNUM(DATE(2014, 3, 1),1) -> 9 | H1520: =WEEKNUM("ABCDEF",1) -> #VALUE! | I1520: =WEEKNUM(DATE(2013, 1, 1),-1) -> #NUM! | J1520: =WEEKNUM("99/9/2008",-1) -> #VALUE!
C1521: EXPECTED VALUE | D1521: 45 | E1521: 11 | F1521: 1 | G1521: 9 | H1521: #VALUE! | I1521: #NUM! | J1521: #VALUE!
B1524: Weibull | C1524: FORMULA
C1525: EXPECTED VALUE
B1528: Windows | C1528: FORMULA | D1528: WILL_NEVER_IMPLEMENT
C1529: EXPECTED VALUE | D1529: WILL_NEVER_IMPLEMENT
B1532: Windowtitle | C1532: FORMULA | D1532: WILL_NEVER_IMPLEMENT
C1533: EXPECTED VALUE | D1533: WILL_NEVER_IMPLEMENT
B1536: Year | C1536: FORMULA | D1536: =YEAR(R[-1516]C[-1]) -> 2000 | E1536: =YEAR(1) -> 1900 | F1536: =YEAR(0) -> 1900 | G1536: =YEAR(-10) -> #NUM! | H1536: =YEAR(#REF!) -> #REF! | I1536: =YEAR(R[-1516]C[-6]+2000) -> 2006
C1537: EXPECTED VALUE | D1537: 2000 | E1537: 1900 | F1537: 1900 | G1537: #NUM! | H1537: #REF! | I1537: 2006
B1540: Ztest | C1540: FORMULA
C1541: EXPECTED VALUE
B1544: <END-OF-FUNCTIONS>

Sheet: FinanceLibTests
O1: NPV | P1: r
A2: f | B2: r | C2: n | D2: y | E2: p | F2: t | H2: f | I2: p | J2: y | K2: n | O2: =NPV(RC[1],RC[3]:RC[6]) -> 162.5 | P2: 1 | Q2: v[] | R2: 100 | S2: 200 | T2: 300 | U2: 400
B3: 1 | C3: 10 | D3: 100 | E3: 10000 | F3: 0 | H3: =FV(RC[-6],RC[-5],RC[-4],RC[-3],RC[-2]) -> -10342300 | O3: =NPV(RC[1],RC[3]:RC[6]) -> 347.99232604148267 | P3: 2.5 | Q3: v[] | R3: 1000 | S3: 666.66665999999998 | T3: 333.33 | U3: 12.276841599999999
B4: 1 | C4: 10 | D4: 100 | E4: 10000 | F4: 1 | H4: =FV(RC[-6],RC[-5],RC[-4],RC[-3],RC[-2]) -> -10444600 | O4: =NPV(RC[1],RC[3]:RC[6]) -> 74.374243337706076 | P4: 12.33333 | Q4: v[] | R4: 1000 | S4: 0 | T4: -900 | U4: -7777.5765000000001
B5: 2 | C5: 12 | D5: 120 | E5: 12000 | F5: 0 | H5: =FV(RC[-6],RC[-5],RC[-4],RC[-3],RC[-2]) -> -6409178400 | O5: =NPV(RC[1],RC[3]:RC[9]) -> 11342283.4233124 | P5: 0.05 | Q5: v[] | R5: 200000 | S5: 300000.55 | T5: 400000 | U5: 1000000 | V5: 6000000 | W5: 7000000 | X5: -300000
B6: 2 | C6: 12 | D6: 120 | E6: 12000 | F6: 1 | H6: =FV(RC[-6],RC[-5],RC[-4],RC[-3],RC[-2]) -> -6472951200
B7: =2/3 -> 0.66666666666666663 | C7: 23 | D7: 133.33000000000001 | E7: 34307 | F7: 0 | H7: =FV(RC[-6],RC[-5],RC[-4],RC[-3],RC[-2]) -> -4369465978.7937231
B8: =2/3 -> 0.66666666666666663 | C8: 23 | D8: 133.33000000000001 | E8: 34307 | F8: 1 | H8: =FV(RC[-6],RC[-5],RC[-4],RC[-3],RC[-2]) -> -4386348826.0193434
B9: 0 | C9: 1 | D9: 100 | E9: 2300 | F9: 0 | H9: =FV(RC[-6],RC[-5],RC[-4],RC[-3],RC[-2]) -> -2400
B10: 0 | C10: 1 | D10: 100 | E10: 2300 | F10: 1 | H10: =FV(RC[-6],RC[-5],RC[-4],RC[-3],RC[-2]) -> -2400
B11: 0 | C11: 12 | D11: 120 | E11: 12000 | F11: 0 | H11: =FV(RC[-6],RC[-5],RC[-4],RC[-3],RC[-2]) -> -13440
B12: 0 | C12: 12 | D12: 120 | E12: 12000 | F12: 1 | H12: =FV(RC[-6],RC[-5],RC[-4],RC[-3],RC[-2]) -> -13440
B13: 2.3332999999999999 | C13: 4 | D13: 334.5 | E13: 14323.45 | F13: 0 | H13: =FV(RC[-6],RC[-5],RC[-4],RC[-3],RC[-2]) -> -1785811.0268780407
B14: 2.3332999999999999 | C14: 4 | D14: 334.5 | E14: 14323.45 | F14: 1 | H14: =FV(RC[-6],RC[-5],RC[-4],RC[-3],RC[-2]) -> -1826771.1713472628
A15: 10000 | B15: 1 | C15: 10 | D15: 100 | F15: 0 | I15: =PV(RC[-7],RC[-6],RC[-5],RC[-8],RC[-3]) -> -109.66796875
A16: 10000 | B16: 1 | C16: 10 | D16: 100 | F16: 1 | I16: =PV(RC[-7],RC[-6],RC[-5],RC[-8],RC[-3]) -> -209.5703125
A17: 333891.23 | B17: 2.95 | C17: 13 | D17: 13000 | F17: 0 | I17: =PV(RC[-7],RC[-6],RC[-5],RC[-8],RC[-3]) -> -4406.7854429449617
A18: 333891.23 | B18: 2.95 | C18: 13 | D18: 13000 | F18: 1 | I18: =PV(RC[-7],RC[-6],RC[-5],RC[-8],RC[-3]) -> -17406.785214815642
B19: 2.95 | C19: 13 | D19: 13000 | E19: -4406.7854429449617 | F19: 0 | H19: =FV(RC[-6],RC[-5],RC[-4],RC[-3],RC[-2]) -> 333891.23001098633
B20: 2.95 | C20: 13 | D20: 13000 | E20: -17406.785214815642 | F20: 1 | H20: =FV(RC[-6],RC[-5],RC[-4],RC[-3],RC[-2]) -> 333891.23010253906
A21: 10000 | B21: 1 | C21: 10 | E21: -109.66796875 | F21: 0 | J21: =PMT(RC[-8],RC[-7],RC[-5],RC[-9],RC[-4]) -> 100
A22: 10000 | B22: 1 | C22: 10 | E22: -209.5703125 | F22: 1 | J22: =PMT(RC[-8],RC[-7],RC[-5],RC[-9],RC[-4]) -> 100
A23: 10000 | B23: 1 | D23: 100 | E23: -109.66796875 | F23: 0 | K23: =NPER(RC[-9],RC[-7],RC[-6],RC[-10],RC[-5]) -> 10
A24: 10000 | B24: 1 | D24: 100 | E24: -209.5703125 | F24: 1
F25: 0
F26: 1
F27: 0
F28: 1
F29: 0
F30: 1
F31: 0
F32: 1
F33: 0
F34: 1

Sheet: StatsLibTests
B1: 1 | C1: 1 | D1: 0 | E1: 1 | F1: 123.12 | G1: =-1*RC[-5] -> -1
B2: 2 | C2: 1 | D2: 0 | E2: 2 | F2: 33.333300000000001 | G2: =-1*RC[-5] -> -2
B3: 3 | C3: 1 | D3: 0 | E3: 1 | F3: =2/3 -> 0.66666666666666663 | G3: =-1*RC[-5] -> -3
B4: 4 | C4: 1 | D4: 0 | E4: 2 | F4: 5.3782800000000002 | G4: =-1*RC[-5] -> -4
B5: 5 | C5: 1 | D5: 0 | E5: 1 | F5: 0.999 | G5: =-1*RC[-5] -> -5
B6: 6 | C6: 1 | D6: 0 | E6: 2 | G6: =-1*RC[-5] -> -6
B7: 7 | C7: 1 | D7: 0 | E7: 1 | G7: =-1*RC[-5] -> -7
B8: 8 | C8: 1 | D8: 0 | E8: 2 | G8: =-1*RC[-5] -> -8
B9: 9 | C9: 1 | D9: 0 | E9: 1 | G9: =-1*RC[-5] -> -9
B10: 10 | C10: 1 | D10: 0 | E10: 2 | G10: =-1*RC[-5] -> -10
A12: avedev | B12: =AVEDEV(R[-11]C:R[-2]C) -> 2.5 | C12: =AVEDEV(R[-11]C:R[-2]C) -> 0 | D12: =AVEDEV(R[-11]C:R[-2]C) -> 0 | E12: =AVEDEV(R[-11]C:R[-2]C) -> 0.5 | F12: =AVEDEV(R[-11]C:R[-2]C) -> 36.421760533333334 | G12: =AVEDEV(R[-11]C:R[-2]C) -> 2.5
A13: stdev | B13: =STDEV(R[-12]C:R[-3]C) -> 3.0276503540974917 | C13: =STDEV(R[-12]C:R[-3]C) -> 0 | D13: =STDEV(R[-12]C:R[-3]C) -> 0 | E13: =STDEV(R[-12]C:R[-3]C) -> 0.52704627669472992 | F13: =STDEV(R[-12]C:R[-3]C) -> 52.33006233652096 | G13: =STDEV(R[-12]C:R[-3]C) -> 3.0276503540974917
A14: devsq | B14: =DEVSQ(R[-13]C:R[-4]C) -> 82.5 | C14: =DEVSQ(R[-13]C:R[-4]C) -> 0 | D14: =DEVSQ(R[-13]C:R[-4]C) -> 0 | E14: =DEVSQ(R[-13]C:R[-4]C) -> 2.5 | F14: =DEVSQ(R[-13]C:R[-9]C) -> 10953.741696576677 | G14: =DEVSQ(R[-13]C:R[-4]C) -> 82.5
A15: large | B15: =LARGE(R[-14]C:R[-5]C,3) -> 8 | C15: =LARGE(R[-14]C:R[-5]C,3) -> 1 | D15: =LARGE(R[-14]C:R[-5]C,3) -> 0 | E15: =LARGE(R[-14]C:R[-5]C,3) -> 2 | F15: =LARGE(R[-14]C:R[-5]C,3) -> 5.3782800000000002 | G15: =LARGE(R[-14]C:R[-5]C,3) -> -3
A16: small | B16: =SMALL(R[-15]C:R[-6]C,3) -> 3 | C16: =SMALL(R[-15]C:R[-6]C,3) -> 1 | D16: =SMALL(R[-15]C:R[-6]C,3) -> 0 | E16: =SMALL(R[-15]C:R[-6]C,3) -> 1 | F16: =SMALL(R[-15]C:R[-6]C,3) -> 5.3782800000000002 | G16: =SMALL(R[-15]C:R[-6]C,3) -> -8
A17: median | B17: =MEDIAN(R[-16]C:R[-7]C) -> 5.5 | C17: =MEDIAN(R[-16]C:R[-7]C) -> 1 | D17: =MEDIAN(R[-16]C:R[-7]C) -> 0 | E17: =MEDIAN(R[-16]C:R[-7]C) -> 1.5 | F17: =MEDIAN(R[-16]C:R[-7]C) -> 5.3782800000000002 | G17: =MEDIAN(R[-16]C:R[-7]C) -> -5.5 | H17: =MEDIAN(R[-16]C[-6]:R[-8]C[-6]) -> 5 | I17: =MEDIAN(R[-15]C[-2]:R[-7]C[-2]) -> -6
A18: mode | B18: =MODE(R[-17]C:R[-8]C) -> #N/A | C18: =MODE(R[-17]C:R[-8]C) -> 1 | D18: =MODE(R[-17]C:R[-8]C) -> 0 | E18: =MODE(R[-17]C:R[-8]C) -> 1 | F18: =MODE(R[-17]C:R[-8]C) -> #N/A | G18: =MODE(R[-17]C:R[-8]C) -> #N/A | H18: =MODE(R[-17]C[-6]:R[-14]C[-4],R[-13]C[-4]) -> 1
A19: var | B19: =VAR(R[-18]C:R[-9]C) -> 9.1666666666666661 | C19: =VAR(R[-18]C:R[-9]C) -> 0 | D19: =VAR(R[-18]C:R[-9]C) -> 0 | E19: =VAR(R[-18]C:R[-9]C) -> 0.27777777777777779 | F19: =VAR(R[-18]C:R[-9]C) -> 2738.4354241441692 | G19: =VAR(R[-18]C:R[-9]C) -> 9.1666666666666661

Sheet: misc
A1: string | B1: ="1" -> 1 | C1: 1 | D1: 1 | E1: =RC[1] -> 0
A2: ="TRUE" -> TRUE | B2: ="2.3" -> 2.3 | C2: 123.23 | D2: 0 | E2: =SUM(1,2) -> 3 | F2: 1
A3: ="FALSE" -> FALSE | B3: =R[-1]C -> 2.3 | C3: -12 | D3: =R[-2]C -> 1
C5: 12
E6: =CONCATENATE(R[-4]C,"1") -> 31
A8: =LARGE(R[-4]C[2]:R[-1]C[2],2) -> #NUM! | E8: =R[-7]C[1] -> 0
E10: =MAX(R[-2]C,-1) -> 0
A12: ="TRUE" -> TRUE
A13: =AVERAGEA("TRUE",1) -> #VALUE!
A14: =AVERAGEA(R[-2]C,2) -> 1
A16: abc | B16: =RC[1] -> 0
A18: =AVERAGEA("1",1,R[-2]C,R[-2]C[1]) -> 0.5