Sheet: Sheet1
A1: =ROWS(1+ROUND(1,1)) -> 1 | B1: ROWS(1+ROUND(1,1))
A2: =ROWS(1+ROUND(ROUND(PI(),2),ROWS(SIN(3)))) -> 1 | B2: ROWS(1+ROUND(ROUND(PI(),2),ROWS(SIN(3))))
A3: =1+ROUND(ROUND(PI(),2),ROWS(SIN(3))) -> 4.0999999999999996 | B3: 1+ROUND(ROUND(PI(),2),ROWS(SIN(3))) | C3: 55
A4: =AVERAGE(PI(),ROUND(TRUE(),PI())) -> 2.0707963267948966 | B4: AVERAGE(PI(),ROUND(TRUE(),PI())) | D4: 66
A5: =MAX(MAX(PI())) -> 3.1415926535897931 | B5: MAX(MAX(PI()))
A6: =COUNT(AVERAGE(PI()),PI(),1+PI()) -> 3 | B6: COUNT(AVERAGE(pi()),PI(),1+PI())
A7: =ROUND(ROWS(ROUND(PI(),1+PI())),1+PI())+ROWS(ROWS(PI()+1))+1*ROUND(1,1) -> 3 | B7: ROUND(ROWS(ROUND(PI(),1+PI())),1+PI())+ROWS(ROWS(PI()+1))+1*ROUND(1,1)
A8: =MIN(PI()) -> 3.1415926535897931 | B8: MIN(PI())
A9: =MDETERM(MIN(PI())) -> 3.1415926535897931 | B9: MDETERM(MIN(PI()))
A10: =COLUMNS(PI()) -> 1 | B10: COLUMNS(PI())
A11: =NPV(2,PI()) -> 1.0471975511965976 | B11: NPV(2,PI())
A12: =SUMIF(R[-11]C,PI()) -> 0 | B12: SUMIF(A1,PI())
A13: =COLUMNS(IF(RC[2],SUMIF(RC[2],PI()),SIN(1))) -> 1 | B13: COLUMNS(IF(C13,SUMIF(C13,PI()),SIN(1)))
A14: =COLUMNS(SUMIF(R[-13]C,PI())) -> 1 | B14: COLUMNS(SUMIF(A1,PI()))
A15: =COLUMNS(IF(SIN(0),SIN(1),SIN(2))) -> 1 | B15: COLUMNS(IF(SIN(0),SIN(1),SIN(2)))
A16: =MDETERM(ABS(R[-15]C)) -> 1 | B16: MDETERM(ABS(A1))
A17: =ROWS(ROUND(INDEX(R[-16]C[2],1,ROUND(1,1)),PI())) -> 1 | B17: ROWS(ROUND(INDEX(C1,1,ROUND(1,1)),PI()))
A18: =INDEX(R[-17]C:R[-16]C[1],1,1) -> 1 | B18: INDEX(A1:B2,1,1)
A19: =ROUND(1,1) -> 1 | B19: ROUND(1,1)
A20: =MID(1,1,1) -> 1 | B20: MID(1,1,1)
A21: =1+1 -> 2 | B21: 1+1
A22: =COLUMNS(ROUND(R[-21]C,PI()+SIN(1))) -> 1 | B22: COLUMNS(ROUND(A1,PI()+SIN(1)))
A23: =COLUMNS(ROUND(INDEX(R[-22]C,PI()-2),PI())) -> 1 | B23: COLUMNS(ROUND(INDEX(A1,1),PI()))
A24: =OFFSET(R[-23]C,2,2) -> 55 | B24: OFFSET(A1,2,2)
A25: =OFFSET(INDEX(R[-24]C:R[-23]C[1],2,2),2,2) -> 66 | B25: OFFSET(INDEX(A1:B2,2,2),2,2)
A26: =IRR(PI(),0) -> #NUM! | B26: IRR(PI(),0)
A27: =COLUMNS(INDEX(R[-26]C:R[-25]C[1],2,2)) -> 1 | B27: COLUMNS(INDEX(A1:B2,2,2))
A28: =(1+IRR(SUMIF(C[3],ROW(INDIRECT(MIN(C[3])&":"&MAX(C[3]))),C[4]),0))^365-1 -> #NUM! | B28: (1+IRR(SUMIF(D:D,ROW(INDIRECT(MIN(D:D)&":"&MAX(D:D))),E:E),0))^365-1
A29: =MIRR(PI(),0.01,0.02) -> #DIV/0! | B29: MIRR(PI(),0.01,0.02) | I29: 2 | J29: a
A30: =VLOOKUP(1,PI(),1) -> #N/A | B30: VLOOKUP(1,PI(),1) | I30: 3 | J30: b
A31: =SUMPRODUCT((Sheet1!R[-28]C[2]:R[743]C[2]=Sheet1!R[-7]C[5])*(Sheet1!R[-28]C[3]:R[743]C[3]=Sheet1!R[-7]C[6]),Sheet1!R[-28]C[31]:R[743]C[31]) -> 0 | B31: SUMPRODUCT(('Sheet1'!C3:C751=Sheet1!F22)*('Sheet1'!D3:D751=Sheet1!G22),'SHEET1'!AF3:AF751)
A32: =COUNT(R[-31]C[2]:R[-30]C[2]) -> 0 | B32: COUNT(C1:C2)
A33: =COUNT(R[-32]C[2]*1) -> 1 | B33: COUNT(C1*1) | I33: 3
A34: =MODE({2,3,4;6,5,4}) -> 4 | B34: MODE({2.0,3.0,4.0;6.0,5.0,4.0}) | E34: 2 | G34: =IF(FREQUENCY(R34C5:R40C5,R34C5:R40C5)>0,1,0) -> 1 | I34: 4 | J34: =IF({TRUE,FALSE,FALSE;TRUE,TRUE,FALSE;FALSE,TRUE,FALSE},R33C9,{7,8,9,10}) -> 3 | K34: 8 | L34: 9
A35: =MMULT(R[-1]C[8]:RC[8],R[-1]C[9]:R[-1]C[10]) -> 12 | B35: MMULT(I33:I34,J33:K33) | E35: 2 | G35: 0 | I35: 5 | J35: 3 | K35: 3 | L35: 9
A36: =COLUMNS(SIN({2,3,4}+1)+1) -> 3 | B36: COLUMNS(SIN({2,3,4}+1)+1) | E36: 2 | G36: 0 | I36: 0 | J36: 7 | K36: 3 | L36: 9
A37: =ABS(FREQUENCY(R34C5:R40C5,R34C5:R40C5)) -> 4 | B37: ABS(FREQUENCY($E$32:$E$38,$E$32:$E$38)) | E37: 2 | G37: 0 | I37: 1
A38: =AVERAGE(FREQUENCY(R[-37]C1:R[-33]C1,R[-37]C1:R[-33]C1)) -> 0.83333333333333337 | B38: AVERAGE(FREQUENCY($E$32:$E$38,$E$32:$E$38)) | E38: 4 | G38: 1 | J38: =COUNTIF(R34C9:R35C9,{3,4,5}) -> 0 | K38: 1 | L38: 1
A39: =COUNT(ABS(FREQUENCY(R34C5:R40C5,R34C5:R40C5))) -> 8 | B39: COUNT(ABS(FREQUENCY($A1:$A5,$A1:$A5))) | E39: 4 | G39: 0
A40: =MODE(ABS(FREQUENCY(R34C5:R40C5,R34C5:R40C5))) -> 0 | B40: MODE(ABS(FREQUENCY($E$32:$E$38,$E$32:$E$38))) | E40: 4 | G40: 0 | J40: =MMULT(IF(R36C9,{2,3},{4,5}),IF(R37C9,{6;7},{8;9})) -> 59
A41: =ABS(FREQUENCY(R34C5:R40C5,R34C5:R40C5)+1) -> 5 | B41: ABS(FREQUENCY($E$32:$E$38,$E$32:$E$38)+1) | G41: 0
A42: =IF(RC[2],RC[3],RC[4]) -> 0 | B42: IF(C41,D41,E41) | J42: =VLOOKUP({2,3},R29C9:R31C10,2) -> a | K42: b
G43: =AVERAGE(R[-9]C:R[-2]C) -> 0.25
J44: =INDEX({1,2;3,4},{2,1},2) -> 4 | K44: 2
A48: Failing cases:
A51: =AVERAGE(ABS(IF((FREQUENCY(R34C5:R40C5,R34C5:R40C5)-1)>0,1))) -> 1 | B51: AVERAGE(ABS(IF((FREQUENCY($E$32:$E$38,$E$32:$E$38)-1)>0,1)))
A52: =AVERAGE(ABS(IF((FREQUENCY(R34C5:R40C5,R34C5:R40C5)-1)>0,1)+FREQUENCY(R34C5:R40C5,R34C5:R40C5))) -> 1.875 | B52: AVERAGE(ABS(IF((FREQUENCY($E$32:$E$38,$E$32:$E$38)-1)>0,1)+FREQUENCY($E$32:$E$38,$E$32:$E$38)))
A53: =COLUMNS(IF(R[1]C[2],R[-3]C[4]:R[-3]C[5],{5,6,7,8})) -> 2 | B53: COLUMNS(IF(C53,E49:F49,{5,6,7,8}))
A54: =COLUMNS(IF(RC[2],{3,4,5},{6,7})) -> 3 | B54: COLUMNS(IF(C53,{3,4,5},{6,7})) | C54: 1
A58: Excel encodes PI() as 'array'. Not sure what rule justifies this. POI encodes it as 'value' which Excel seems to tolerate
A59: =INDEX(PI(),1) -> 3.1415926535897931 | B59: INDEX(PI(),1)
A61: These formulas involve constant arrays (which POI 3.1 does not parse yet)
A62: =STDEV(2, ROUND({1,2,3},1)) -> 0.81649658092772603 | B62: STDEV(2,ROUND({1.0;2.0;3.0},1))
A63: =INDEX(MMULT({1,2;3,4},{5,6;7,8}) +PI(), R[-58]C[4], R[-57]C[4]) -> 22.141592653589793 | B63: INDEX(MMULT({1.0,2.0;3.0,4.0},{5.0,6.0;7.0,8.0})+PI(),K5,K6)
A64: =TRANSPOSE(MMULT({1,2;3,4},{5,6;7,8})) -> 19 | B64: TRANSPOSE(MMULT({1.0,2.0;3.0,4.0},{5.0,6.0;7.0,8.0}))
A65: =SUM(MMULT({1}, {1})) -> 1 | B65: SUM(MMULT({1.0},{1.0}))
A66: =SUM(MMULT({1,2;3,4},{5,6;7,8})) -> 134 | B66: SUM(MMULT({1.0,2.0;3.0,4.0},{5.0,6.0;7.0,8.0}))
A68: Something wierd going on with the TRANSPOSE function
A69: =TRANSPOSE(INDEX(R[-68]C[2],1,1)) -> 0 | B69: TRANSPOSE(INDEX(C1,1,1))
A70: =TRANSPOSE(PI()) -> 3.1415926535897931 | B70: TRANSPOSE(PI())
B72: SUM(VLOOKUP({"a","b","b"},C72:D75,2)) | C72: a | D72: 5
A73: =MODE(VLOOKUP({"a","b","b"},R[-1]C[2]:R[2]C[3],2)) -> #N/A | C73: b | D73: 4
A74: =AVERAGE(IF(FREQUENCY(R34C5:R40C5,R34C5:R40C5)>0,1,0)) -> 0.25 | B74: AVERAGE(IF(FREQUENCY($E$32:$E$38,$E$32:$E$38)>0,1,0)) | C74: c | D74: 2
A75: =AVERAGE(IF((FREQUENCY(R34C5:R40C5,R34C5:R40C5)-1)>0,1)) -> 1 | B75: AVERAGE(IF((FREQUENCY($E$32:$E$38,$E$32:$E$38)-1)>0,1)) | C75: d | D75: 1
A76: =MMULT(IF(R[-41]C[2],R[-42]C[8]:R[-42]C[9],R[-42]C[10]:R[-40]C[10]),IF(R[-41]C[2],R[-42]C[10]:R[-41]C[10],R[-41]C[8]:R[-41]C[10])) -> 40 | B76: MMULT(IF(C35,I34:J34,K34:K36),IF(C35,K34:K35,I35:K35))
A77: =MMULT(IF(R36C9,{2,3},{4,5}),IF(R37C9,{6;7},SIN(8))) -> 59 | B77: MMULT(IF($I$36,{2,3},{4,5}),IF($I$37,{6;7},SIN(8)))
A78: =INDEX(INDEX({1,2;3,4},{2,1},2),1,1) -> 4 | B78: INDEX(INDEX({1,2;3,4},{2,1},2),1,1)
A80: =SUM(IF(FREQUENCY(R34C5:R40C5,R34C5:R40C5)>0,1,0)) -> 2