Sheet: Example 1
A1: Data
A2: 7
A3: 3.5
A4: 3.5
A5: 1
A6: 2
A7: Formula | B7: Description (Result)
A8: =RANK(R[-5]C,R[-6]C:R[-2]C,1) -> 3 | B8: Rank of 3.5 in the list above (3)
A9: =RANK(R[-7]C,R[-7]C:R[-3]C,1) -> 5 | B9: Rank of 7 in the list above (5)

Sheet: Example 2
A1: Student | B1: Scores | C1: Rank
A2: Al | B2: 46 | C2: =RANK(RC[-1],R2C2:R11C2) -> 1
A3: Ben | B3: 31 | C3: =RANK(RC[-1],R2C2:R11C2) -> 8
A4: Cam | B4: 39 | C4: =RANK(RC[-1],R2C2:R11C2) -> 3
A5: Dee | B5: 32 | C5: =RANK(RC[-1],R2C2:R11C2) -> 7
A6: Ed | B6: 36 | C6: =RANK(RC[-1],R2C2:R11C2) -> 6
A7: Flo | B7: 20 | C7: =RANK(RC[-1],R2C2:R11C2) -> 10
A8: Gil | B8: 45 | C8: =RANK(RC[-1],R2C2:R11C2) -> 2
A9: Hal | B9: 23 | C9: =RANK(RC[-1],R2C2:R11C2) -> 9
A10: Ivy | B10: 38 | C10: =RANK(RC[-1],R2C2:R11C2) -> 4
A11: Joe | B11: 38 | C11: =RANK(RC[-1],R2C2:R11C2) -> 4

Sheet: Example 3
A1: Student | B1: Scores | C1: Time | D1: Rank | E1: TieBreak | F1: FinalRank
A2: Al | B2: 46 | C2: 22 | D2: =RANK(RC[-2],R2C2:R11C2) -> 1 | E2: =IF(COUNTIF(R2C2:R11C2,RC[-3])>1,RANK(RC[-2],R2C3:R11C3,1)/100,0) -> 0 | F2: =RC[-2]+RC[-1] -> 1
A3: Ben | B3: 31 | C3: 25 | D3: =RANK(RC[-2],R2C2:R11C2) -> 8 | E3: =IF(COUNTIF(R2C2:R11C2,RC[-3])>1,RANK(RC[-2],R2C3:R11C3,1)/100,0) -> 0 | F3: =RC[-2]+RC[-1] -> 8
A4: Cam | B4: 39 | C4: 28 | D4: =RANK(RC[-2],R2C2:R11C2) -> 3 | E4: =IF(COUNTIF(R2C2:R11C2,RC[-3])>1,RANK(RC[-2],R2C3:R11C3,1)/100,0) -> 0 | F4: =RC[-2]+RC[-1] -> 3
A5: Dee | B5: 32 | C5: 28 | D5: =RANK(RC[-2],R2C2:R11C2) -> 7 | E5: =IF(COUNTIF(R2C2:R11C2,RC[-3])>1,RANK(RC[-2],R2C3:R11C3,1)/100,0) -> 0 | F5: =RC[-2]+RC[-1] -> 7
A6: Ed | B6: 36 | C6: 27 | D6: =RANK(RC[-2],R2C2:R11C2) -> 6 | E6: =IF(COUNTIF(R2C2:R11C2,RC[-3])>1,RANK(RC[-2],R2C3:R11C3,1)/100,0) -> 0 | F6: =RC[-2]+RC[-1] -> 6
A7: Flo | B7: 20 | C7: 21 | D7: =RANK(RC[-2],R2C2:R11C2) -> 10 | E7: =IF(COUNTIF(R2C2:R11C2,RC[-3])>1,RANK(RC[-2],R2C3:R11C3,1)/100,0) -> 0 | F7: =RC[-2]+RC[-1] -> 10
A8: Gil | B8: 45 | C8: 29 | D8: =RANK(RC[-2],R2C2:R11C2) -> 2 | E8: =IF(COUNTIF(R2C2:R11C2,RC[-3])>1,RANK(RC[-2],R2C3:R11C3,1)/100,0) -> 0 | F8: =RC[-2]+RC[-1] -> 2
A9: Hal | B9: 23 | C9: 20 | D9: =RANK(RC[-2],R2C2:R11C2) -> 9 | E9: =IF(COUNTIF(R2C2:R11C2,RC[-3])>1,RANK(RC[-2],R2C3:R11C3,1)/100,0) -> 0 | F9: =RC[-2]+RC[-1] -> 9
A10: Ivy | B10: 38 | C10: 29 | D10: =RANK(RC[-2],R2C2:R11C2) -> 4 | E10: =IF(COUNTIF(R2C2:R11C2,RC[-3])>1,RANK(RC[-2],R2C3:R11C3,1)/100,0) -> 0.09 | F10: =RC[-2]+RC[-1] -> 4.09
A11: Joe | B11: 38 | C11: 27 | D11: =RANK(RC[-2],R2C2:R11C2) -> 4 | E11: =IF(COUNTIF(R2C2:R11C2,RC[-3])>1,RANK(RC[-2],R2C3:R11C3,1)/100,0) -> 0.05 | F11: =RC[-2]+RC[-1] -> 4.05