Sheet: Instance1
B1: Basic Operators and Functions
E2: Excel | F2: Melody | G2: Pass/Fail
A3: x1 | B3: 4 | D3: y1 (x1+x2) | E3: =RC[-3]+R[1]C[-3] -> 6
A4: x2 | B4: 2 | D4: y2 (x1-x2) | E4: =R[-1]C[-3]-RC[-3] -> 2
A5: x3 | B5: -2.2999999999999998 | D5: y3 (x1*x2) | E5: =R[-2]C[-3]*R[-1]C[-3] -> 8
A6: x4 | B6: 3.5 | D6: y4 (x1/x2) | E6: =R[-3]C[-3]/R[-2]C[-3] -> 2
A7: x5 | B7: 3 | D7: y5 (abs(x3)) | E7: =ABS(R[-2]C[-3]) -> 2.2999999999999998
A8: x6 | B8: 2 | D8: y6 (ceil(x4)) | E8: =CEILING(R[-2]C[-3],1) -> 4
A9: x7 | B9: 25 | D9: y7 (floor(x4)) | E9: =FLOOR(R[-3]C[-3],1) -> 3
D10: y8 (round(x4)) | E10: =IF(R[-4]C[-3]= (ROUNDUP(R[-4]C[-3],0) + ROUNDDOWN(R[-4]C[-3],0))/2, MROUND(R[-4]C[-3],2),ROUND(R[-4]C[-3],0)) -> 4
D11: y9 (mod(x5,x6)) | E11: =MOD(R[-4]C[-3],R[-3]C[-3]) -> 1
D12: y10 (pow(x5,x6)) | E12: =POWER(R[-5]C[-3],R[-4]C[-3]) -> 9
D14: y12 (sqrt(x7)) | E14: =SQRT(R[-5]C[-3]) -> 5
B17: Trignometric Functions
E18: Excel | F18: Melody | G18: Pass/Fail
A19: x1 | B19: =PI()/4 -> 0.78539816339744828 | D19: y1 (sin(x1)) | E19: =SIN(RC[-3]) -> 0.70710678118654746
A20: x2 | B20: 0.5 | D20: y2 (cos(x1)) | E20: =COS(R[-1]C[-3]) -> 0.70710678118654757
A21: x3 | B21: 0.5 | D21: y3 (tan(x1)) | E21: =TAN(R[-2]C[-3]) -> 0.99999999999999989
D22: y4 (asin(x2)) | E22: =ASIN(R[-2]C[-3]) -> 0.52359877559829893
D23: y5 (acos(x2)) | E23: =ACOS(R[-3]C[-3]) -> 1.0471975511965976
D24: y6 (atan(x2)) | E24: =ATAN(R[-4]C[-3]) -> 0.46364760900080609
D25: y7 (atan2(x2,x3)) | E25: =ATAN2(R[-5]C[-3],R[-4]C[-3]) -> 0.78539816339744828
B28: Stat Functions
E29: Excel | F29: Melody | G29: Pass/Fail
A30: x1 | B30: 1 | D30: y1 (avg(x1)) | E30: =AVERAGE(RC[-3]:R[9]C[-3]) -> 5.5
B31: 2 | D31: y2 (max(x1)) | E31: =MAX(R[-1]C[-3]:R[8]C[-3]) -> 10
B32: 3 | D32: y3 (min(x1)) | E32: =MIN(R[-2]C[-3]:R[7]C[-3]) -> 1
B33: 4 | D33: y4 (sum(x2)) | E33: =SUM(R[-3]C[-3]:R[6]C[-3]) -> 55
B34: 5 | D34: y5 (std(x2)) | E34: =STDEV(R[-4]C[-3]:R[5]C[-3]) -> 3.0276503540974917
B35: 6 | D35: y6 (var(x2)) | E35: =VAR(R[-5]C[-3]:R[4]C[-3]) -> 9.1666666666666661
B36: 7
B37: 8
B38: 9
B39: 10
A40: x2 | B40: 2 | D40: y7 (min(x2,..,x7)) | E40: =MIN(RC[-3]:R[5]C[-3]) -> 2
A41: x3 | B41: 4 | D41: y8 (min(x2,..,x7)) | E41: =MAX(R[-1]C[-3]:R[4]C[-3]) -> 12
A42: x4 | B42: 6
A43: x5 | B43: 8
A44: x6 | B44: 10
A45: x7 | B45: 12