Sheet: Sheet1
A1: =31+46 -> 77
A2: =30+53 -> 83
A3: =SUM(R[-2]C:R[-1]C) -> 160
A5: =32767+32768 -> 65535
A6: 3333333333
A7: =30000000/100 -> 300000
A8: =32744+42333 -> 75077
A9: =327680/32768 -> 10
A10: =32767+32769 -> 65536
A11: =35000+36000 -> 71000
A12: =-1000000-3000000 -> -4000000