Sheet: Sheet1
A1: 2011-03-25T11:39:54.000 | B1: Date | D1: 25/03/2011 11:39:54
A2: =R[-1]C -> 40627.486041666663 | B2: As Number | D2: 40627.49
A3: =YEAR(R[-2]C) -> 2011 | B3: Year | D3: 2001
A4: =MONTH(R[-3]C) -> 3 | B4: Month | D4: 3
A5: =DAY(R[-4]C) -> 25 | B5: Day | D5: 25
A6: =HOUR(R[-5]C) -> 11 | B6: Hour | D6: 11
A7: =MINUTE(R[-6]C) -> 39 | B7: Minute | D7: 39
A8: =SECOND(R[-7]C) -> 54 | B8: Second | D8: 54
A12: 1900-01-02T06:14:24.000 | B12: Date | D12: 02/01/1900 06:14:24
A13: =R[-1]C -> 2.2599999999999998 | B13: As Number | D13: 2.26
A14: =YEAR(R[-2]C) -> 1900 | B14: Year | D14: 1900
A15: =MONTH(R[-3]C) -> 1 | B15: Month | D15: 1
A16: =DAY(R[-4]C) -> 2 | B16: Day | D16: 2
A17: =HOUR(R[-5]C) -> 6 | B17: Hour | D17: 6
A18: =MINUTE(R[-6]C) -> 14 | B18: Minute | D18: 14
A19: =SECOND(R[-7]C) -> 24 | B19: Second | D19: 24
A22: 1899-12-31T06:14:24.000 | B22: Date | D22: 00/01/1900 06:14:24
A23: =R[-1]C -> 0.26 | B23: As Number | D23: 0.26
A24: =YEAR(R[-2]C) -> 1900 | B24: Year | D24: 1900
A25: =MONTH(R[-3]C) -> 1 | B25: Month | D25: 1
A26: =DAY(R[-4]C) -> 0 | B26: Day | D26: 0
A27: =HOUR(R[-5]C) -> 6 | B27: Hour | D27: 6
A28: =MINUTE(R[-6]C) -> 14 | B28: Minute | D28: 14
A29: =SECOND(R[-7]C) -> 24 | B29: Second | D29: 24