Sheet: POI Tests
A1: Criteria | B1: Range | C1: Actual | D1: Expected | E1: Comments
A2: >5 | B2: 4 | C2: =COUNTIF(RC[-1],RC[-2]) -> 0 | D2: 0
A3: >5 | B3: 5 | C3: =COUNTIF(RC[-1],RC[-2]) -> 0 | D3: 0
A4: >5 | B4: 6 | C4: =COUNTIF(RC[-1],RC[-2]) -> 1 | D4: 1
A5: >abc | B5: aba | C5: =COUNTIF(RC[-1],RC[-2]) -> 0 | D5: 0
A6: >abc | B6: abc | C6: =COUNTIF(RC[-1],RC[-2]) -> 0 | D6: 0
A7: >abc | B7: abd | C7: =COUNTIF(RC[-1],RC[-2]) -> 1 | D7: 1
A8: 1 | B8: 1 | C8: =COUNTIF(RC[-1],RC[-2]) -> 1 | D8: 1
A9: 1 | B9: 1 | C9: =COUNTIF(RC[-1],RC[-2]) -> 1 | D9: 1
A10: 1 | B10: 1 | C10: =COUNTIF(RC[-1],RC[-2]) -> 1 | D10: 1
A11: =22 | B11: 22 | C11: =COUNTIF(RC[-1],RC[-2]) -> 1 | D11: 1
A12: =22 | B12: 22 | C12: =COUNTIF(RC[-1],RC[-2]) -> 1 | D12: 1
A13: =1 -> 1 | B13: 1 | C13: =COUNTIF(RC[-1],RC[-2]) -> 1 | D13: 1
C14: =COUNTIF(RC[-1],RC[-2]) -> 0 | D14: 0 | E14: Blank criteria does not match blank value
C15: =COUNTIF(RC[-1],RC[-2]) -> 0 | D15: 0 | E15: Blank criteria does not match empty string
C16: =COUNTIF(RC[-1],RC[-2]) -> 1 | D16: 1 | E16: Empty string criteria matches blank value
C17: =COUNTIF(RC[-1],RC[-2]) -> 1 | D17: 1 | E17: Empty string criteria matches empty string value
A18: = | C18: =COUNTIF(RC[-1],RC[-2]) -> 1 | D18: 1 | E18: Explicit equals operator with empty string matches blank value
A19: = | C19: =COUNTIF(RC[-1],RC[-2]) -> 0 | D19: 0 | E19: Explicit equals operator with empty string does not match empty string value
A20: <> | C20: =COUNTIF(RC[-1],RC[-2]) -> 1 | D20: 1
A21: <> | C21: =COUNTIF(RC[-1],RC[-2]) -> 0 | D21: 0
A22: A*B | B22: A123BC | C22: =COUNTIF(RC[-1],RC[-2]) -> 0 | D22: 0
A23: <>A*B | B23: ABF | C23: =COUNTIF(RC[-1],RC[-2]) -> 1 | D23: 1
A24: A~?B | B24: A?B | C24: =COUNTIF(RC[-1],RC[-2]) -> 1 | D24: 1
A25: >A~*B | B25: A~+C | C25: =COUNTIF(RC[-1],RC[-2]) -> 1 | D25: 1
A26: 0 | B26: 0 | C26: =COUNTIF(RC[-1],RC[-2]) -> 1 | D26: 1
A27: 0 | B27: 0 | C27: =COUNTIF(RC[-1],RC[-2]) -> 1 | D27: 1
A28: 0 | C28: =COUNTIF(RC[-1],RC[-2]) -> 0 | D28: 0
A29: 0 | B29: 0 | C29: =COUNTIF(RC[-1],RC[-2]) -> 1 | D29: 1
A30: 0 | B30: 0 | C30: =COUNTIF(RC[-1],RC[-2]) -> 1 | D30: 1
A31: 0 | C31: =COUNTIF(RC[-1],RC[-2]) -> 0 | D31: 0
A32: 1*2 | B32: 12342 | C32: =COUNTIF(RC[-1],RC[-2]) -> 0 | D32: 0
A33: 1*2 | B33: 12322 | C33: =COUNTIF(RC[-1],RC[-2]) -> 1 | D33: 1
A34: * | C34: =COUNTIF(RC[-1],RC[-2]) -> 1 | D34: 1
A35: =* | C35: =COUNTIF(RC[-1],RC[-2]) -> 1 | D35: 1
A36: <> | C36: =COUNTIF(RC[-1],RC[-2]) -> 1 | D36: 1
A37: > | C37: =COUNTIF(RC[-1],RC[-2]) -> 0 | D37: 0
A38: < | C38: =COUNTIF(RC[-1],RC[-2]) -> 0 | D38: 0
A39: <= | C39: =COUNTIF(RC[-1],RC[-2]) -> 0 | D39: 0
A40: >= | C40: =COUNTIF(RC[-1],RC[-2]) -> 0 | D40: 0
A41: TRUE | B41: 1 | C41: =COUNTIF(RC[-1],RC[-2]) -> 1 | D41: 1
A42: <TRUE | B42: 0 | C42: =COUNTIF(RC[-1],RC[-2]) -> 1 | D42: 1
A43: <TRUE | B43: FALSE | C43: =COUNTIF(RC[-1],RC[-2]) -> 0 | D43: 0
A44: <TRUE | B44: TA | C44: =COUNTIF(RC[-1],RC[-2]) -> 0 | D44: 0 | E44: String 'TA' does not compare with boolean TRUE
A45: >FALSE | B45: FB | C45: =COUNTIF(RC[-1],RC[-2]) -> 0 | D45: 0
A46: >FALSE | B46: 1 | C46: =COUNTIF(RC[-1],RC[-2]) -> 1 | D46: 1
A47: >FALSE | B47: TRUE | C47: =COUNTIF(RC[-1],RC[-2]) -> 0 | D47: 0 | E47: String 'TRUE' does not compare with boolean FALSE
A48: >4t3 | B48: 500 | C48: =COUNTIF(RC[-1],RC[-2]) -> 0 | D48: 0
A49: >4t3 | B49: 500 | C49: =COUNTIF(RC[-1],RC[-2]) -> 1 | D49: 1
A50: 500 | B50: 500 | C50: =COUNTIF(RC[-1],RC[-2]) -> 1 | D50: 1
A51: TRUE | B51: TRUE | C51: =COUNTIF(RC[-1],RC[-2]) -> 0 | D51: 0
A52: a*b | B52: ab | C52: =COUNTIF(RC[-1],RC[-2]) -> 1 | D52: 1

Sheet: MSDN Example 1
A1: Data | B1: Data
A2: apples | B2: 32
A3: oranges | B3: 54
A4: peaches | B4: 75
A5: apples | B5: 86
A6: Formula | B6: Description | C6: Result
A7: =COUNTIF(R[-5]C:R[-2]C,"apples") -> 2 | B7: Number of cells with apples in cells A2 through A5. | C7: 2
A8: =COUNTIF(R[-6]C:R[-3]C,R[-4]C) -> 1 | B8: Number of cells with peaches in cells A2 through A5. | C8: 1
A9: =COUNTIF(R[-7]C:R[-4]C,R[-6]C)+COUNTIF(R[-7]C:R[-4]C,R[-7]C) -> 3 | B9: Number of cells with oranges and apples in cells A2 through A5. | C9: 3
A10: =COUNTIF(R[-8]C[1]:R[-5]C[1],">55") -> 2 | B10: Number of cells with a value greater than 55 in cells B2 through B5. | C10: 2
A11: =COUNTIF(R[-9]C[1]:R[-6]C[1],"<>"&R[-7]C[1]) -> 3 | B11: Number of cells with a value not equal to 75 in cells B2 through B5. | C11: 3
A12: =COUNTIF(R[-10]C[1]:R[-7]C[1],">=32")-COUNTIF(R[-10]C[1]:R[-7]C[1],">85") -> 3 | B12: Number of cells with a value greater than or equal to 32 and less than or equal to 85 in cells B2 through B5. | C12: 3

Sheet: MSDN Example 2
A1: Data | B1: Data
A2: apples | B2: Yes
A4: oranges | B4: NO
A5: peaches | B5: No
A7: apples | B7: yes
A8: Formula | B8: Description | C8: Result
A9: =COUNTIF(R[-7]C:R[-2]C,"*es") -> 4 | B9: Number of cells ending with the letters "es" in cells A2 through A7. | C9: 4
A10: =COUNTIF(R[-8]C:R[-3]C,"?????es") -> 2 | B10: Number of cells ending with the letters "les" and having exactly 7 letters in cells A2 through A7. | C10: 2
A11: =COUNTIF(R[-9]C:R[-4]C,"*") -> 4 | B11: Number of cells containing any text in cells A2 through A7. | C11: 4
A12: =COUNTIF(R[-10]C:R[-5]C,"") -> 2 | B12: Number of cells not containing text in cells A2 through A7. | C12: 2
A13: =COUNTIF(R[-11]C[1]:R[-6]C[1],"No") / ROWS(R[-11]C[1]:R[-6]C[1]) -> 0.33333333333333331 | B13: The average number of No votes (including blank cells) in cells B2 through B7. | C13: 0.33333333300000001
A14: =COUNTIF(R[-12]C[1]:R[-7]C[1],"Yes") / (ROWS(R[-12]C[1]:R[-7]C[1]) -COUNTIF(R[-12]C[1]:R[-7]C[1], "")) -> 0.5 | B14: The average number of Yes votes (excluding blank cells) in cells B2 through B7. | C14: 0.5