Sheet: Sheet1
C1: Start | F1: End | J1: Calculated Values
B2: basis | C2: y | D2: m | E2: d | F2: y | G2: m | H2: d | J2: Start | K2: End | L2: Actual | N2: Expected
B4: 1 | C4: 1999 | D4: 4 | E4: 4 | F4: 1999 | G4: 4 | H4: 5 | J4: =DATE(RC[-7], RC[-6], RC[-5]) -> 1999-04-04T00:00:00.000 | K4: =DATE(RC[-5], RC[-4], RC[-3]) -> 1999-04-05T00:00:00.000 | L4: =YEARFRAC(RC[-2],RC[-1], RC[-10]) -> 2.7397260273972603E-3 | N4: 2.7397260273972603E-3
B6: 1 | C6: 2005 | D6: 2 | E6: 1 | F6: 2005 | G6: 2 | H6: 2 | J6: =DATE(RC[-7], RC[-6], RC[-5]) -> 2005-02-01T00:00:00.000 | K6: =DATE(RC[-5], RC[-4], RC[-3]) -> 2005-02-02T00:00:00.000 | L6: =YEARFRAC(RC[-2],RC[-1], RC[-10]) -> 2.7397260273972603E-3 | N6: 2.7397260273972603E-3
B7: 1 | C7: 2004 | D7: 12 | E7: 31 | F7: 2005 | G7: 1 | H7: 1 | J7: =DATE(RC[-7], RC[-6], RC[-5]) -> 2004-12-31T00:00:00.000 | K7: =DATE(RC[-5], RC[-4], RC[-3]) -> 2005-01-01T00:00:00.000 | L7: =YEARFRAC(RC[-2],RC[-1], RC[-10]) -> 2.7397260273972603E-3 | N7: 2.7397260273972603E-3
B8: 1 | C8: 2005 | D8: 1 | E8: 1 | F8: 2004 | G8: 12 | H8: 31 | J8: =DATE(RC[-7], RC[-6], RC[-5]) -> 2005-01-01T00:00:00.000 | K8: =DATE(RC[-5], RC[-4], RC[-3]) -> 2004-12-31T00:00:00.000 | L8: =YEARFRAC(RC[-2],RC[-1], RC[-10]) -> 2.7397260273972603E-3 | N8: 2.7397260273972603E-3
B10: 1 | C10: 2003 | D10: 12 | E10: 30 | F10: 2003 | G10: 12 | H10: 31 | J10: =DATE(RC[-7], RC[-6], RC[-5]) -> 2003-12-30T00:00:00.000 | K10: =DATE(RC[-5], RC[-4], RC[-3]) -> 2003-12-31T00:00:00.000 | L10: =YEARFRAC(RC[-2],RC[-1], RC[-10]) -> 2.7397260273972603E-3 | N10: 2.7397260273972603E-3
B11: 1 | C11: 2004 | D11: 1 | E11: 1 | F11: 2004 | G11: 1 | H11: 2 | J11: =DATE(RC[-7], RC[-6], RC[-5]) -> 2004-01-01T00:00:00.000 | K11: =DATE(RC[-5], RC[-4], RC[-3]) -> 2004-01-02T00:00:00.000 | L11: =YEARFRAC(RC[-2],RC[-1], RC[-10]) -> 2.7322404371584699E-3 | N11: 2.7322404371584699E-3
B12: 1 | C12: 2004 | D12: 12 | E12: 30 | F12: 2004 | G12: 12 | H12: 31 | J12: =DATE(RC[-7], RC[-6], RC[-5]) -> 2004-12-30T00:00:00.000 | K12: =DATE(RC[-5], RC[-4], RC[-3]) -> 2004-12-31T00:00:00.000 | L12: =YEARFRAC(RC[-2],RC[-1], RC[-10]) -> 2.7322404371584699E-3 | N12: 2.7322404371584699E-3
B13: 1 | C13: 2005 | D13: 1 | E13: 1 | F13: 2005 | G13: 1 | H13: 2 | J13: =DATE(RC[-7], RC[-6], RC[-5]) -> 2005-01-01T00:00:00.000 | K13: =DATE(RC[-5], RC[-4], RC[-3]) -> 2005-01-02T00:00:00.000 | L13: =YEARFRAC(RC[-2],RC[-1], RC[-10]) -> 2.7397260273972603E-3 | N13: 2.7397260273972603E-3
B15: 1 | C15: 2003 | D15: 12 | E15: 30 | F15: 2003 | G15: 12 | H15: 31 | J15: =DATE(RC[-7], RC[-6], RC[-5]) -> 2003-12-30T00:00:00.000 | K15: =DATE(RC[-5], RC[-4], RC[-3]) -> 2003-12-31T00:00:00.000 | L15: =YEARFRAC(RC[-2],RC[-1], RC[-10]) -> 2.7397260273972603E-3 | N15: 2.7397260273972603E-3
B16: 1 | C16: 2004 | D16: 12 | E16: 30 | F16: 2004 | G16: 12 | H16: 31 | J16: =DATE(RC[-7], RC[-6], RC[-5]) -> 2004-12-30T00:00:00.000 | K16: =DATE(RC[-5], RC[-4], RC[-3]) -> 2004-12-31T00:00:00.000 | L16: =YEARFRAC(RC[-2],RC[-1], RC[-10]) -> 2.7322404371584699E-3 | N16: 2.7322404371584699E-3
B17: 1 | C17: 2005 | D17: 12 | E17: 30 | F17: 2005 | G17: 12 | H17: 31 | J17: =DATE(RC[-7], RC[-6], RC[-5]) -> 2005-12-30T00:00:00.000 | K17: =DATE(RC[-5], RC[-4], RC[-3]) -> 2005-12-31T00:00:00.000 | L17: =YEARFRAC(RC[-2],RC[-1], RC[-10]) -> 2.7397260273972603E-3 | N17: 2.7397260273972603E-3
B18: 1 | C18: 2006 | D18: 12 | E18: 30 | F18: 2006 | G18: 12 | H18: 31 | J18: =DATE(RC[-7], RC[-6], RC[-5]) -> 2006-12-30T00:00:00.000 | K18: =DATE(RC[-5], RC[-4], RC[-3]) -> 2006-12-31T00:00:00.000 | L18: =YEARFRAC(RC[-2],RC[-1], RC[-10]) -> 2.7397260273972603E-3 | N18: 2.7397260273972603E-3
B19: 1 | C19: 2007 | D19: 12 | E19: 30 | F19: 2007 | G19: 12 | H19: 31 | J19: =DATE(RC[-7], RC[-6], RC[-5]) -> 2007-12-30T00:00:00.000 | K19: =DATE(RC[-5], RC[-4], RC[-3]) -> 2007-12-31T00:00:00.000 | L19: =YEARFRAC(RC[-2],RC[-1], RC[-10]) -> 2.7397260273972603E-3 | N19: 2.7397260273972603E-3
B21: 1 | C21: 2003 | D21: 12 | E21: 30 | F21: 2004 | G21: 12 | H21: 31 | J21: =DATE(RC[-7], RC[-6], RC[-5]) -> 2003-12-30T00:00:00.000 | K21: =DATE(RC[-5], RC[-4], RC[-3]) -> 2004-12-31T00:00:00.000 | L21: =YEARFRAC(RC[-2],RC[-1], RC[-10]) -> 1.0041039671682626 | N21: 1.0041039671682626
B22: 1 | C22: 2004 | D22: 12 | E22: 30 | F22: 2005 | G22: 12 | H22: 31 | J22: =DATE(RC[-7], RC[-6], RC[-5]) -> 2004-12-30T00:00:00.000 | K22: =DATE(RC[-5], RC[-4], RC[-3]) -> 2005-12-31T00:00:00.000 | L22: =YEARFRAC(RC[-2],RC[-1], RC[-10]) -> 1.0013679890560876 | N22: 1.0013679890560876
B23: 1 | C23: 2005 | D23: 12 | E23: 30 | F23: 2006 | G23: 12 | H23: 31 | J23: =DATE(RC[-7], RC[-6], RC[-5]) -> 2005-12-30T00:00:00.000 | K23: =DATE(RC[-5], RC[-4], RC[-3]) -> 2006-12-31T00:00:00.000 | L23: =YEARFRAC(RC[-2],RC[-1], RC[-10]) -> 1.0027397260273974 | N23: 1.0027397260273974
B24: 1 | C24: 2006 | D24: 12 | E24: 30 | F24: 2007 | G24: 12 | H24: 31 | J24: =DATE(RC[-7], RC[-6], RC[-5]) -> 2006-12-30T00:00:00.000 | K24: =DATE(RC[-5], RC[-4], RC[-3]) -> 2007-12-31T00:00:00.000 | L24: =YEARFRAC(RC[-2],RC[-1], RC[-10]) -> 1.0027397260273974 | N24: 1.0027397260273974
B25: 1 | C25: 2007 | D25: 12 | E25: 30 | F25: 2008 | G25: 12 | H25: 31 | J25: =DATE(RC[-7], RC[-6], RC[-5]) -> 2007-12-30T00:00:00.000 | K25: =DATE(RC[-5], RC[-4], RC[-3]) -> 2008-12-31T00:00:00.000 | L25: =YEARFRAC(RC[-2],RC[-1], RC[-10]) -> 1.0041039671682626 | N25: 1.0041039671682626
B27: 1 | C27: 2004 | D27: 12 | E27: 30 | F27: 2006 | G27: 12 | H27: 31 | J27: =DATE(RC[-7], RC[-6], RC[-5]) -> 2004-12-30T00:00:00.000 | K27: =DATE(RC[-5], RC[-4], RC[-3]) -> 2006-12-31T00:00:00.000 | L27: =YEARFRAC(RC[-2],RC[-1], RC[-10]) -> 2.0009124087591244 | N27: 2.0009124087591244
B28: 1 | C28: 2005 | D28: 12 | E28: 30 | F28: 2007 | G28: 12 | H28: 31 | J28: =DATE(RC[-7], RC[-6], RC[-5]) -> 2005-12-30T00:00:00.000 | K28: =DATE(RC[-5], RC[-4], RC[-3]) -> 2007-12-31T00:00:00.000 | L28: =YEARFRAC(RC[-2],RC[-1], RC[-10]) -> 2.0027397260273974 | N28: 2.0027397260273974
B29: 1 | C29: 2006 | D29: 12 | E29: 30 | F29: 2008 | G29: 12 | H29: 31 | J29: =DATE(RC[-7], RC[-6], RC[-5]) -> 2006-12-30T00:00:00.000 | K29: =DATE(RC[-5], RC[-4], RC[-3]) -> 2008-12-31T00:00:00.000 | L29: =YEARFRAC(RC[-2],RC[-1], RC[-10]) -> 2.0036496350364965 | N29: 2.0036496350364965
B30: 1 | C30: 2007 | D30: 12 | E30: 30 | F30: 2009 | G30: 12 | H30: 31 | J30: =DATE(RC[-7], RC[-6], RC[-5]) -> 2007-12-30T00:00:00.000 | K30: =DATE(RC[-5], RC[-4], RC[-3]) -> 2009-12-31T00:00:00.000 | L30: =YEARFRAC(RC[-2],RC[-1], RC[-10]) -> 2.0036496350364965 | N30: 2.0036496350364965
B31: 1 | C31: 2008 | D31: 12 | E31: 30 | F31: 2010 | G31: 12 | H31: 31 | J31: =DATE(RC[-7], RC[-6], RC[-5]) -> 2008-12-30T00:00:00.000 | K31: =DATE(RC[-5], RC[-4], RC[-3]) -> 2010-12-31T00:00:00.000 | L31: =YEARFRAC(RC[-2],RC[-1], RC[-10]) -> 2.0009124087591244 | N31: 2.0009124087591244
B33: 1 | C33: 2004 | D33: 12 | E33: 30 | F33: 2007 | G33: 12 | H33: 31 | J33: =DATE(RC[-7], RC[-6], RC[-5]) -> 2004-12-30T00:00:00.000 | K33: =DATE(RC[-5], RC[-4], RC[-3]) -> 2007-12-31T00:00:00.000 | L33: =YEARFRAC(RC[-2],RC[-1], RC[-10]) -> 3.0006844626967832 | N33: 3.0006844626967832
B34: 1 | C34: 2005 | D34: 12 | E34: 30 | F34: 2008 | G34: 12 | H34: 31 | J34: =DATE(RC[-7], RC[-6], RC[-5]) -> 2005-12-30T00:00:00.000 | K34: =DATE(RC[-5], RC[-4], RC[-3]) -> 2008-12-31T00:00:00.000 | L34: =YEARFRAC(RC[-2],RC[-1], RC[-10]) -> 3.0034223134839153 | N34: 3.0034223134839153
B35: 1 | C35: 2006 | D35: 12 | E35: 30 | F35: 2009 | G35: 12 | H35: 31 | J35: =DATE(RC[-7], RC[-6], RC[-5]) -> 2006-12-30T00:00:00.000 | K35: =DATE(RC[-5], RC[-4], RC[-3]) -> 2009-12-31T00:00:00.000 | L35: =YEARFRAC(RC[-2],RC[-1], RC[-10]) -> 3.0034223134839153 | N35: 3.0034223134839153
B36: 1 | C36: 2007 | D36: 12 | E36: 30 | F36: 2010 | G36: 12 | H36: 31 | J36: =DATE(RC[-7], RC[-6], RC[-5]) -> 2007-12-30T00:00:00.000 | K36: =DATE(RC[-5], RC[-4], RC[-3]) -> 2010-12-31T00:00:00.000 | L36: =YEARFRAC(RC[-2],RC[-1], RC[-10]) -> 3.0034223134839153 | N36: 3.0034223134839153
B37: 1 | C37: 2008 | D37: 12 | E37: 30 | F37: 2011 | G37: 12 | H37: 31 | J37: =DATE(RC[-7], RC[-6], RC[-5]) -> 2008-12-30T00:00:00.000 | K37: =DATE(RC[-5], RC[-4], RC[-3]) -> 2011-12-31T00:00:00.000 | L37: =YEARFRAC(RC[-2],RC[-1], RC[-10]) -> 3.0006844626967832 | N37: 3.0006844626967832
B39: 1 | C39: 2004 | D39: 12 | E39: 30 | F39: 2008 | G39: 12 | H39: 31 | J39: =DATE(RC[-7], RC[-6], RC[-5]) -> 2004-12-30T00:00:00.000 | K39: =DATE(RC[-5], RC[-4], RC[-3]) -> 2008-12-31T00:00:00.000 | L39: =YEARFRAC(RC[-2],RC[-1], RC[-10]) -> 4.0010946907498637 | N39: 4.0010946907498637
B40: 1 | C40: 2005 | D40: 12 | E40: 30 | F40: 2009 | G40: 12 | H40: 31 | J40: =DATE(RC[-7], RC[-6], RC[-5]) -> 2005-12-30T00:00:00.000 | K40: =DATE(RC[-5], RC[-4], RC[-3]) -> 2009-12-31T00:00:00.000 | L40: =YEARFRAC(RC[-2],RC[-1], RC[-10]) -> 4.0032858707557502 | N40: 4.0032858707557502
B41: 1 | C41: 2006 | D41: 12 | E41: 30 | F41: 2010 | G41: 12 | H41: 31 | J41: =DATE(RC[-7], RC[-6], RC[-5]) -> 2006-12-30T00:00:00.000 | K41: =DATE(RC[-5], RC[-4], RC[-3]) -> 2010-12-31T00:00:00.000 | L41: =YEARFRAC(RC[-2],RC[-1], RC[-10]) -> 4.0032858707557502 | N41: 4.0032858707557502
B42: 1 | C42: 2007 | D42: 12 | E42: 30 | F42: 2011 | G42: 12 | H42: 31 | J42: =DATE(RC[-7], RC[-6], RC[-5]) -> 2007-12-30T00:00:00.000 | K42: =DATE(RC[-5], RC[-4], RC[-3]) -> 2011-12-31T00:00:00.000 | L42: =YEARFRAC(RC[-2],RC[-1], RC[-10]) -> 4.0032858707557502 | N42: 4.0032858707557502
B43: 1 | C43: 2008 | D43: 12 | E43: 30 | F43: 2012 | G43: 12 | H43: 31 | J43: =DATE(RC[-7], RC[-6], RC[-5]) -> 2008-12-30T00:00:00.000 | K43: =DATE(RC[-5], RC[-4], RC[-3]) -> 2012-12-31T00:00:00.000 | L43: =YEARFRAC(RC[-2],RC[-1], RC[-10]) -> 4.0010946907498637 | N43: 4.0010946907498637