Sheet: Flags
A1: Flag Name | B1: Value | C1: Description
A2: Title | B2: Date Format Tests
A3: Categories | C3: Run only tests that have this category
A4: AllColors | B4: True | C4: Run the test with all standard colors specified

Sheet: Tests
A1: Result (expected) | B1: Format | C1: Value | D1: Categories
A2: =TEXT(RC[2], RC[1]) -> 75:23:53.376 | B2: [h]:m:s.000 | C2: 3.1415899999999999 | D2: Elapsed
A3: =TEXT(RC[2], RC[1]) -> 4523:53.376 | B3: [m]:s.000 | C3: 3.1415899999999999 | D3: Elapsed
A4: =TEXT(RC[2], RC[1]) -> 271433.376 | B4: [s].000 | C4: 3.1415899999999999 | D4: Elapsed
A5: =TEXT(RC[2], RC[1]) -> 75:23:53.4 | B5: [hh]:mm:ss.0 | C5: 3.1415899999999999 | D5: Elapsed
A6: =TEXT(RC[2], RC[1]) -> 4523:53.4 | B6: [mm]:ss.0 | C6: 3.1415899999999999 | D6: Elapsed
A7: =TEXT(RC[2], RC[1]) -> 271433.376 | B7: [ss].000 | C7: 3.1415899999999999 | D7: Elapsed
A8: =TEXT(RC[2], RC[1]) -> 53:23 @ hour 1293 | B8: s:m" @ hour "[hh] | C8: 3.1415899999999999 | D8: Elapsed
A9: =TEXT(RC[2], RC[1]) -> 53 secs and 77581 mins | B9: s" secs and "[m]" mins" | C9: 3.1415899999999999 | D9: Elapsed
A10: =TEXT(RC[2], RC[1]) -> It was 75 [yes, 75] hours and 23:53 | B10: "It was "[h]" [yes, "h"] hours and "mm:ss | C10: 3.1415899999999999 | D10: Elapsed, Debug
A11: =TEXT(RC[2], RC[1]) -> 271433 [yes, 271433] seconds | B11: [s]" [yes, "ss"] seconds" | C11: 3.1415899999999999 | D11: Elapsed
A12: =TEXT(RC[2], RC[1]) -> 2:3:4.000 | B12: [h]:m:s.000 | C12: =2/24+3/(24*60)+4/(24*60*60) -> 8.5462962962962963E-2 | D12: Elapsed
A13: =TEXT(RC[2], RC[1]) -> 123:4.000 | B13: [m]:s.000 | C13: =2/24+3/(24*60)+4/(24*60*60) -> 8.5462962962962963E-2 | D13: Elapsed
A14: =TEXT(RC[2], RC[1]) -> 7384.000 | B14: [s].000 | C14: =2/24+3/(24*60)+4/(24*60*60) -> 8.5462962962962963E-2 | D14: Elapsed
A15: =TEXT(RC[2], RC[1]) -> 02:03:04.0 | B15: [hh]:mm:ss.0 | C15: =2/24+3/(24*60)+4/(24*60*60) -> 8.5462962962962963E-2 | D15: Elapsed
A16: =TEXT(RC[2], RC[1]) -> 123:04.0 | B16: [mm]:ss.0 | C16: =2/24+3/(24*60)+4/(24*60*60) -> 8.5462962962962963E-2 | D16: Elapsed
A17: =TEXT(RC[2], RC[1]) -> 7384.000 | B17: [ss].000 | C17: =2/24+3/(24*60)+4/(24*60*60) -> 8.5462962962962963E-2 | D17: Elapsed
A18: =TEXT(RC[2], RC[1]) -> 4:3 @ hour 108 | B18: s:m" @ hour "[hh] | C18: =2/24+3/(24*60)+4/(24*60*60) -> 8.5462962962962963E-2 | D18: Elapsed
A19: =TEXT(RC[2], RC[1]) -> 4 secs and 6480 mins | B19: s" secs and "[m]" mins" | C19: =2/24+3/(24*60)+4/(24*60*60) -> 8.5462962962962963E-2 | D19: Elapsed
A20: =TEXT(RC[2], RC[1]) -> It was 2 [yes, 2] hours and 03:04 | B20: "It was "[h]" [yes, "h"] hours and "mm:ss | C20: =2/24+3/(24*60)+4/(24*60*60) -> 8.5462962962962963E-2 | D20: Elapsed
A21: =TEXT(RC[2], RC[1]) -> 7384 [yes, 7384] seconds | B21: [s]" [yes, "ss"] seconds" | C21: =2/24+3/(24*60)+4/(24*60*60) -> 8.5462962962962963E-2 | D21: Elapsed
A22: =TEXT(RC[2], RC[1]) -> 0:0:0.000 | B22: [h]:m:s.000 | C22: 0 | D22: Elapsed
A23: =TEXT(RC[2], RC[1]) -> 0:0.000 | B23: [m]:s.000 | C23: 0 | D23: Elapsed
A24: =TEXT(RC[2], RC[1]) -> 0.000 | B24: [s].000 | C24: 0 | D24: Elapsed
A25: =TEXT(RC[2], RC[1]) -> 00:00:00.0 | B25: [hh]:mm:ss.0 | C25: 0 | D25: Elapsed
A26: =TEXT(RC[2], RC[1]) -> 00:00.0 | B26: [mm]:ss.0 | C26: 0 | D26: Elapsed
A27: =TEXT(RC[2], RC[1]) -> 00.000 | B27: [ss].000 | C27: 0 | D27: Elapsed
A28: =TEXT(RC[2], RC[1]) -> 0:0 @ hour 12 | B28: s:m" @ hour "[hh] | C28: 0 | D28: Elapsed
A29: =TEXT(RC[2], RC[1]) -> 0 secs and 720 mins | B29: s" secs and "[m]" mins" | C29: 0 | D29: Elapsed
A30: =TEXT(RC[2], RC[1]) -> It was 0 [yes, 0] hours and 00:00 | B30: "It was "[h]" [yes, "h"] hours and "mm:ss | C30: 0 | D30: Elapsed
A31: =TEXT(RC[2], RC[1]) -> 0 [yes, 00] seconds | B31: [s]" [yes, "ss"] seconds" | C31: 0 | D31: Elapsed
A32: =TEXT(RC[2], RC[1]) -> -2:3:4.000 | B32: [h]:m:s.000 | C32: =-(2/24+3/(24*60)+4/(24*60*60)) -> -8.5462962962962963E-2 | D32: Elapsed
A33: =TEXT(RC[2], RC[1]) -> -123:4.000 | B33: [m]:s.000 | C33: =-(2/24+3/(24*60)+4/(24*60*60)) -> -8.5462962962962963E-2 | D33: Elapsed
A34: =TEXT(RC[2], RC[1]) -> -7384.000 | B34: [s].000 | C34: =-(2/24+3/(24*60)+4/(24*60*60)) -> -8.5462962962962963E-2 | D34: Elapsed
A35: =TEXT(RC[2], RC[1]) -> -02:03:04.0 | B35: [hh]:mm:ss.0 | C35: =-(2/24+3/(24*60)+4/(24*60*60)) -> -8.5462962962962963E-2 | D35: Elapsed
A36: =TEXT(RC[2], RC[1]) -> -123:04.0 | B36: [mm]:ss.0 | C36: =-(2/24+3/(24*60)+4/(24*60*60)) -> -8.5462962962962963E-2 | D36: Elapsed
A37: =TEXT(RC[2], RC[1]) -> -7384.000 | B37: [ss].000 | C37: =-(2/24+3/(24*60)+4/(24*60*60)) -> -8.5462962962962963E-2 | D37: Elapsed
A38: =TEXT(RC[2], RC[1]) -> -4:3 @ hour 108 | B38: s:m" @ hour "[hh] | C38: =-(2/24+3/(24*60)+4/(24*60*60)) -> -8.5462962962962963E-2 | D38: Elapsed
A39: =TEXT(RC[2], RC[1]) -> -4 secs and 6480 mins | B39: s" secs and "[m]" mins" | C39: =-(2/24+3/(24*60)+4/(24*60*60)) -> -8.5462962962962963E-2 | D39: Elapsed
A40: =TEXT(RC[2], RC[1]) -> -It was 2 [yes, 2] hours and 03:04 | B40: "It was "[h]" [yes, "h"] hours and "mm:ss | C40: =-(2/24+3/(24*60)+4/(24*60*60)) -> -8.5462962962962963E-2 | D40: Elapsed
A41: =TEXT(RC[2], RC[1]) -> -7384 [yes, 7384] seconds | B41: [s]" [yes, "ss"] seconds" | C41: =-(2/24+3/(24*60)+4/(24*60*60)) -> -8.5462962962962963E-2 | D41: Elapsed
A42: =TEXT(RC[2], RC[1]) -> -75:23:53.376 | B42: [h]:m:s.000 | C42: -3.1415899999999999 | D42: Elapsed
A43: =TEXT(RC[2], RC[1]) -> -4523:53.376 | B43: [m]:s.000 | C43: -3.1415899999999999 | D43: Elapsed
A44: =TEXT(RC[2], RC[1]) -> -271433.376 | B44: [s].000 | C44: -3.1415899999999999 | D44: Elapsed
A45: =TEXT(RC[2], RC[1]) -> -75:23:53.4 | B45: [hh]:mm:ss.0 | C45: -3.1415899999999999 | D45: Elapsed
A46: =TEXT(RC[2], RC[1]) -> -4523:53.4 | B46: [mm]:ss.0 | C46: -3.1415899999999999 | D46: Elapsed
A47: =TEXT(RC[2], RC[1]) -> -271433.376 | B47: [ss].000 | C47: -3.1415899999999999 | D47: Elapsed
A48: =TEXT(RC[2], RC[1]) -> -53:23 @ hour 1293 | B48: s:m" @ hour "[hh] | C48: -3.1415899999999999 | D48: Elapsed
A49: =TEXT(RC[2], RC[1]) -> -53 secs and 77581 mins | B49: s" secs and "[m]" mins" | C49: -3.1415899999999999 | D49: Elapsed
A50: =TEXT(RC[2], RC[1]) -> -It was 75 [yes, 75] hours and 23:53 | B50: "It was "[h]" [yes, "h"] hours and "mm:ss | C50: -3.1415899999999999 | D50: Elapsed
A51: =TEXT(RC[2], RC[1]) -> -271433 [yes, 271433] seconds | B51: [s]" [yes, "ss"] seconds" | C51: -3.1415899999999999 | D51: Elapsed
A52: =TEXT(RC[2], RC[1]) -> 
A53: =TEXT(RC[2], RC[1]) -> 
A54: =TEXT(RC[2], RC[1]) -> 
A55: =TEXT(RC[2], RC[1]) -> 
A56: =TEXT(RC[2], RC[1]) -> 
A57: =TEXT(RC[2], RC[1]) -> 
A58: =TEXT(RC[2], RC[1]) -> 
A59: =TEXT(RC[2], RC[1]) -> 
A60: =TEXT(RC[2], RC[1]) -> 
A61: =TEXT(RC[2], RC[1]) -> 
A62: =TEXT(RC[2], RC[1]) -> 
A63: =TEXT(RC[2], RC[1]) -> 
A64: =TEXT(RC[2], RC[1]) -> 
A65: =TEXT(RC[2], RC[1]) -> 
A66: =TEXT(RC[2], RC[1]) -> 
A67: =TEXT(RC[2], RC[1]) -> 
A68: =TEXT(RC[2], RC[1]) -> 
A69: =TEXT(RC[2], RC[1]) -> 
A70: =TEXT(RC[2], RC[1]) -> 
A71: =TEXT(RC[2], RC[1]) -> 
A72: =TEXT(RC[2], RC[1]) -> 
A73: =TEXT(RC[2], RC[1]) -> 
A74: =TEXT(RC[2], RC[1]) -> 
A75: =TEXT(RC[2], RC[1]) -> 
A76: =TEXT(RC[2], RC[1]) -> 
A77: =TEXT(RC[2], RC[1]) -> 
A78: =TEXT(RC[2], RC[1]) -> 
A79: =TEXT(RC[2], RC[1]) -> 
A80: =TEXT(RC[2], RC[1]) -> 
A81: =TEXT(RC[2], RC[1]) -> 
A82: =TEXT(RC[2], RC[1]) -> 
A83: =TEXT(RC[2], RC[1]) -> 
A84: =TEXT(RC[2], RC[1]) -> 
A85: =TEXT(RC[2], RC[1]) -> 
A86: =TEXT(RC[2], RC[1]) -> 
A87: =TEXT(RC[2], RC[1]) -> 
A88: =TEXT(RC[2], RC[1]) -> 
A89: =TEXT(RC[2], RC[1]) -> 
A90: =TEXT(RC[2], RC[1]) -> 
A91: =TEXT(RC[2], RC[1]) -> 
A92: =TEXT(RC[2], RC[1]) -> 
A93: =TEXT(RC[2], RC[1]) -> 
A94: =TEXT(RC[2], RC[1]) -> 
A95: =TEXT(RC[2], RC[1]) -> 
A96: =TEXT(RC[2], RC[1]) -> 
A97: =TEXT(RC[2], RC[1]) -> 
A98: =TEXT(RC[2], RC[1]) -> 
A99: =TEXT(RC[2], RC[1]) -> 
A100: =TEXT(RC[2], RC[1]) -> 
A101: =TEXT(RC[2], RC[1]) -> 
A102: =TEXT(RC[2], RC[1]) -> 
A103: =TEXT(RC[2], RC[1]) -> 
A104: =TEXT(RC[2], RC[1]) -> 
A105: =TEXT(RC[2], RC[1]) -> 
A106: =TEXT(RC[2], RC[1]) -> 
A107: =TEXT(RC[2], RC[1]) -> 
A108: =TEXT(RC[2], RC[1]) -> 
A109: =TEXT(RC[2], RC[1]) -> 
A110: =TEXT(RC[2], RC[1]) -> 
A111: =TEXT(RC[2], RC[1]) -> 
A112: =TEXT(RC[2], RC[1]) -> 
A113: =TEXT(RC[2], RC[1]) -> 
A114: =TEXT(RC[2], RC[1]) -> 
A115: =TEXT(RC[2], RC[1]) -> 
A116: =TEXT(RC[2], RC[1]) -> 
A117: =TEXT(RC[2], RC[1]) -> 
A118: =TEXT(RC[2], RC[1]) -> 
A119: =TEXT(RC[2], RC[1]) -> 
A120: =TEXT(RC[2], RC[1]) -> 
A121: =TEXT(RC[2], RC[1]) -> 
A122: =TEXT(RC[2], RC[1]) -> 
A123: =TEXT(RC[2], RC[1]) -> 
A124: =TEXT(RC[2], RC[1]) -> 
A125: =TEXT(RC[2], RC[1]) -> 
A126: =TEXT(RC[2], RC[1]) -> 
A127: =TEXT(RC[2], RC[1]) -> 
A128: =TEXT(RC[2], RC[1]) -> 
A129: =TEXT(RC[2], RC[1]) -> 
A130: =TEXT(RC[2], RC[1]) -> 
A131: =TEXT(RC[2], RC[1]) -> 
A132: =TEXT(RC[2], RC[1]) -> 
A133: =TEXT(RC[2], RC[1]) -> 
A134: =TEXT(RC[2], RC[1]) -> 
A135: =TEXT(RC[2], RC[1]) -> 
A136: =TEXT(RC[2], RC[1]) -> 
A137: =TEXT(RC[2], RC[1]) -> 
A138: =TEXT(RC[2], RC[1]) -> 
A139: =TEXT(RC[2], RC[1]) -> 
A140: =TEXT(RC[2], RC[1]) -> 
A141: =TEXT(RC[2], RC[1]) -> 
A142: =TEXT(RC[2], RC[1]) -> 
A143: =TEXT(RC[2], RC[1]) -> 
A144: =TEXT(RC[2], RC[1]) -> 
A145: =TEXT(RC[2], RC[1]) -> 
A146: =TEXT(RC[2], RC[1]) -> 
A147: =TEXT(RC[2], RC[1]) -> 
A148: =TEXT(RC[2], RC[1]) -> 
A149: =TEXT(RC[2], RC[1]) -> 
A150: =TEXT(RC[2], RC[1]) -> 
A151: =TEXT(RC[2], RC[1]) -> 
A152: =TEXT(RC[2], RC[1]) -> 
A153: =TEXT(RC[2], RC[1]) -> 
A154: =TEXT(RC[2], RC[1]) -> 
A155: =TEXT(RC[2], RC[1]) -> 
A156: =TEXT(RC[2], RC[1]) -> 
A157: =TEXT(RC[2], RC[1]) -> 
A158: =TEXT(RC[2], RC[1]) -> 
A159: =TEXT(RC[2], RC[1]) -> 
A160: =TEXT(RC[2], RC[1]) -> 
A161: =TEXT(RC[2], RC[1]) -> 
A162: =TEXT(RC[2], RC[1]) -> 
A163: =TEXT(RC[2], RC[1]) -> 
A164: =TEXT(RC[2], RC[1]) -> 
A165: =TEXT(RC[2], RC[1]) -> 
A166: =TEXT(RC[2], RC[1]) -> 
A167: =TEXT(RC[2], RC[1]) -> 
A168: =TEXT(RC[2], RC[1]) -> 
A169: =TEXT(RC[2], RC[1]) -> 
A170: =TEXT(RC[2], RC[1]) -> 
A171: =TEXT(RC[2], RC[1]) -> 
A172: =TEXT(RC[2], RC[1]) -> 
A173: =TEXT(RC[2], RC[1]) -> 
A174: =TEXT(RC[2], RC[1]) -> 
A175: =TEXT(RC[2], RC[1]) -> 
A176: =TEXT(RC[2], RC[1]) -> 
A177: =TEXT(RC[2], RC[1]) -> 
A178: =TEXT(RC[2], RC[1]) -> 
A179: =TEXT(RC[2], RC[1]) -> 
A180: =TEXT(RC[2], RC[1]) -> 
A181: =TEXT(RC[2], RC[1]) -> 
A182: =TEXT(RC[2], RC[1]) -> 
A183: =TEXT(RC[2], RC[1]) -> 
A184: =TEXT(RC[2], RC[1]) -> 
A185: =TEXT(RC[2], RC[1]) -> 
A186: =TEXT(RC[2], RC[1]) -> 
A187: =TEXT(RC[2], RC[1]) -> 
A188: =TEXT(RC[2], RC[1]) -> 
A189: =TEXT(RC[2], RC[1]) -> 
A190: =TEXT(RC[2], RC[1]) -> 
A191: =TEXT(RC[2], RC[1]) -> 
A192: =TEXT(RC[2], RC[1]) -> 
A193: =TEXT(RC[2], RC[1]) -> 
A194: =TEXT(RC[2], RC[1]) -> 
A195: =TEXT(RC[2], RC[1]) -> 
A196: =TEXT(RC[2], RC[1]) -> 
A197: =TEXT(RC[2], RC[1]) -> 
A198: =TEXT(RC[2], RC[1]) -> 
A199: =TEXT(RC[2], RC[1]) -> 
A200: =TEXT(RC[2], RC[1]) -> 
A201: =TEXT(RC[2], RC[1]) -> 
A202: =TEXT(RC[2], RC[1]) -> 
A203: =TEXT(RC[2], RC[1]) -> 
A204: =TEXT(RC[2], RC[1]) -> 
A205: =TEXT(RC[2], RC[1]) -> 
A206: =TEXT(RC[2], RC[1]) -> 
A207: =TEXT(RC[2], RC[1]) -> 
A208: =TEXT(RC[2], RC[1]) -> 
A209: =TEXT(RC[2], RC[1]) -> 
A210: =TEXT(RC[2], RC[1]) -> 
A211: =TEXT(RC[2], RC[1]) -> 
A212: =TEXT(RC[2], RC[1]) -> 
A213: =TEXT(RC[2], RC[1]) -> 
A214: =TEXT(RC[2], RC[1]) -> 
A215: =TEXT(RC[2], RC[1]) -> 