Sheet: Sheet1
A1: 2001-07-01T00:00:00.000 | B1: =RC[1]+RC[3] -> 71 | C1: =RC[10]+RC[11]+RC[12]+RC[13]+RC[14]+RC[15]+RC[16]+RC[17]+RC[18]+RC[19]+RC[20]+RC[21]+RC[24]+RC[22]+RC[23]+RC[25]+RC[9]+RC[26]+RC[27] -> 39 | D1: =RC[-1]/RC[-2] -> 0.54929577464788737 | E1: =RC[2]+RC[3]+RC[4]+RC[5]+RC[6] -> 32 | F1: =RC[-1]/RC[-4] -> 0.45070422535211269 | G1: 1 | H1: 8 | I1: 1 | J1: 22 | L1: 0 | M1: 5 | N1: 1 | O1: 17 | Q1: 2 | R1: 5 | S1: 2 | T1: 2 | V1: 5 | Y1: 0 | Z1: 0 | AB1: 0 | AC1: 0 | AD1: 0 | AE1: 3 | AF1: 2 | AG1: 3 | AH1: 2001-07-01T00:00:00.000 | AI1: =RC[-33]+RC[-4]+RC[-3]+RC[-2] -> 79 | AJ1: =RC[-5]/RC[-1] -> 3.7974683544303799E-2 | AK1: =RC[-4]/RC[-2] -> 3.7974683544303799E-2
A2: 2001-08-31T00:00:00.000 | B2: =RC[1]+RC[3] -> 58 | C2: =RC[10]+RC[11]+RC[12]+RC[13]+RC[14]+RC[15]+RC[16]+RC[17]+RC[18]+RC[19]+RC[20]+RC[21]+RC[24]+RC[22]+RC[23]+RC[25]+RC[9]+RC[26]+RC[27] -> 34 | D2: =RC[-1]/RC[-2] -> 0.58620689655172409 | E2: =RC[2]+RC[3]+RC[4]+RC[5]+RC[6] -> 24 | F2: =RC[-1]/RC[-4] -> 0.41379310344827586 | G2: 4 | H2: 5 | I2: 6 | J2: 6 | K2: 3 | L2: 1 | M2: 1 | N2: 2 | O2: 8 | Q2: 2 | R2: 6 | S2: 1 | T2: 4 | V2: 2 | X2: 2 | Y2: 3 | AA2: 1 | AD2: 1 | AE2: 6 | AF2: 1 | AG2: 5 | AH2: 2001-08-31T00:00:00.000 | AI2: =RC[-33]+RC[-4]+RC[-3]+RC[-2] -> 70 | AJ2: =RC[-5]/RC[-1] -> 8.5714285714285715E-2 | AK2: =RC[-4]/RC[-2] -> 7.1428571428571425E-2
A3: 2001-09-28T00:00:00.000 | B3: =RC[1]+RC[3] -> 35 | C3: =RC[10]+RC[11]+RC[12]+RC[13]+RC[14]+RC[15]+RC[16]+RC[17]+RC[18]+RC[19]+RC[20]+RC[21]+RC[24]+RC[22]+RC[23]+RC[25]+RC[9]+RC[26]+RC[27] -> 29 | D3: =RC[-1]/RC[-2] -> 0.82857142857142863 | E3: =RC[2]+RC[3]+RC[4]+RC[5]+RC[6] -> 6 | F3: =RC[-1]/RC[-4] -> 0.17142857142857143 | G3: 1 | I3: 3 | J3: 2 | O3: 10 | Q3: 1 | R3: 6 | S3: 2 | T3: 3 | V3: 1 | W3: 2 | X3: 3 | AA3: 1 | AE3: 6 | AF3: 1 | AG3: 6 | AH3: 2001-09-28T00:00:00.000 | AI3: =RC[-33]+RC[-4]+RC[-3]+RC[-2] -> 48 | AJ3: =RC[-5]/RC[-1] -> 0.125 | AK3: =RC[-4]/RC[-2] -> 0.125
A4: 2001-10-26T00:00:00.000 | B4: =RC[1]+RC[3] -> 45 | C4: =RC[10]+RC[11]+RC[12]+RC[13]+RC[14]+RC[15]+RC[16]+RC[17]+RC[18]+RC[19]+RC[20]+RC[21]+RC[24]+RC[22]+RC[23]+RC[25]+RC[9]+RC[26]+RC[27] -> 34 | D4: =RC[-1]/RC[-2] -> 0.75555555555555554 | E4: =RC[2]+RC[3]+RC[4]+RC[5]+RC[6] -> 11 | F4: =RC[-1]/RC[-4] -> 0.24444444444444444 | G4: 2 | H4: 4 | I4: 1 | J4: 1 | K4: 3 | M4: 2 | N4: 2 | O4: 12 | P4: 1 | Q4: 4 | R4: 4 | S4: 5 | T4: 1 | U4: 1 | V4: 1 | X4: 1 | AE4: 8 | AF4: 1 | AG4: 10 | AH4: 2001-10-26T00:00:00.000 | AI4: =RC[-33]+RC[-4]+RC[-3]+RC[-2] -> 64 | AJ4: =RC[-5]/RC[-1] -> 0.125 | AK4: =RC[-4]/RC[-2] -> 0.15625
A5: 2001-11-30T00:00:00.000 | B5: =RC[1]+RC[3] -> 73 | C5: =RC[10]+RC[11]+RC[12]+RC[13]+RC[14]+RC[15]+RC[16]+RC[17]+RC[18]+RC[19]+RC[20]+RC[21]+RC[24]+RC[22]+RC[23]+RC[25]+RC[9]+RC[26]+RC[27] -> 54 | D5: =RC[-1]/RC[-2] -> 0.73972602739726023 | E5: =RC[2]+RC[3]+RC[4]+RC[5]+RC[6] -> 19 | F5: =RC[-1]/RC[-4] -> 0.26027397260273971 | G5: 3 | H5: 3 | I5: 7 | J5: 2 | K5: 4 | L5: 2 | N5: 1 | O5: 15 | P5: 1 | Q5: 3 | R5: 10 | S5: 3 | T5: 1 | V5: 5 | W5: 1 | X5: 3 | Y5: 4 | AA5: 1 | AD5: 4 | AE5: 20 | AF5: 1 | AG5: 11 | AH5: 2001-11-30T00:00:00.000 | AI5: =RC[-33]+RC[-4]+RC[-3]+RC[-2] -> 105 | AJ5: =RC[-5]/RC[-1] -> 0.19047619047619047 | AK5: =RC[-4]/RC[-2] -> 0.10476190476190476
A6: 2001-12-28T00:00:00.000 | B6: =RC[1]+RC[3] -> 49 | C6: =RC[10]+RC[11]+RC[12]+RC[13]+RC[14]+RC[15]+RC[16]+RC[17]+RC[18]+RC[19]+RC[20]+RC[21]+RC[24]+RC[22]+RC[23]+RC[25]+RC[9]+RC[26]+RC[27] -> 34 | D6: =RC[-1]/RC[-2] -> 0.69387755102040816 | E6: =RC[2]+RC[3]+RC[4]+RC[5]+RC[6] -> 15 | F6: =RC[-1]/RC[-4] -> 0.30612244897959184 | G6: 4 | H6: 4 | I6: 4 | J6: 1 | K6: 2 | L6: 1 | O6: 13 | Q6: 2 | R6: 8 | S6: 1 | T6: 1 | V6: 4 | X6: 1 | Y6: 1 | AA6: 1 | AC6: 1 | AE6: 6 | AG6: 9 | AH6: 2001-12-28T00:00:00.000 | AI6: =RC[-33]+RC[-4]+RC[-3]+RC[-2] -> 64 | AJ6: =RC[-5]/RC[-1] -> 9.375E-2 | AK6: =RC[-4]/RC[-2] -> 0.140625
A7: 2002-01-25T00:00:00.000 | B7: =RC[1]+RC[3] -> 51 | C7: =RC[10]+RC[11]+RC[12]+RC[13]+RC[14]+RC[15]+RC[16]+RC[17]+RC[18]+RC[19]+RC[20]+RC[21]+RC[24]+RC[22]+RC[23]+RC[25]+RC[9]+RC[26]+RC[27] -> 37 | D7: =RC[-1]/RC[-2] -> 0.72549019607843135 | E7: =RC[2]+RC[3]+RC[4]+RC[5]+RC[6] -> 14 | F7: =RC[-1]/RC[-4] -> 0.27450980392156865 | G7: 1 | H7: 6 | I7: 4 | J7: 2 | K7: 1 | L7: 2 | M7: 2 | N7: 2 | O7: 16 | Q7: 2 | R7: 2 | S7: 1 | T7: 2 | V7: 1 | X7: 1 | Y7: 1 | AA7: 3 | AC7: 1 | AD7: 1 | AE7: 7 | AG7: 2 | AH7: 2002-01-25T00:00:00.000 | AI7: =RC[-33]+RC[-4]+RC[-3]+RC[-2] -> 60 | AJ7: =RC[-5]/RC[-1] -> 0.11666666666666667 | AK7: =RC[-4]/RC[-2] -> 3.3333333333333333E-2
A8: 2002-02-22T00:00:00.000 | B8: =RC[1]+RC[3] -> 38 | C8: =RC[10]+RC[11]+RC[12]+RC[13]+RC[14]+RC[15]+RC[16]+RC[17]+RC[18]+RC[19]+RC[20]+RC[21]+RC[24]+RC[22]+RC[23]+RC[25]+RC[9]+RC[26]+RC[27] -> 24 | D8: =RC[-1]/RC[-2] -> 0.63157894736842102 | E8: =RC[2]+RC[3]+RC[4]+RC[5]+RC[6] -> 14 | F8: =RC[-1]/RC[-4] -> 0.36842105263157893 | G8: 2 | H8: 7 | I8: 5 | L8: 3 | N8: 3 | O8: 6 | Q8: 2 | R8: 4 | S8: 1 | V8: 1 | X8: 3 | Y8: 1 | AE8: 6 | AF8: 1 | AG8: 7 | AH8: 2002-02-22T00:00:00.000 | AI8: =RC[-33]+RC[-4]+RC[-3]+RC[-2] -> 52 | AJ8: =RC[-5]/RC[-1] -> 0.11538461538461539 | AK8: =RC[-4]/RC[-2] -> 0.13461538461538461
A9: 2002-03-29T00:00:00.000 | B9: =RC[1]+RC[3] -> 70 | C9: =RC[10]+RC[11]+RC[12]+RC[13]+RC[14]+RC[15]+RC[16]+RC[17]+RC[18]+RC[19]+RC[20]+RC[21]+RC[24]+RC[22]+RC[23]+RC[25]+RC[9]+RC[26]+RC[27] -> 52 | D9: =RC[-1]/RC[-2] -> 0.74285714285714288 | E9: =RC[2]+RC[3]+RC[4]+RC[5]+RC[6] -> 18 | F9: =RC[-1]/RC[-4] -> 0.25714285714285712 | G9: 6 | H9: 5 | I9: 6 | K9: 1 | L9: 3 | M9: 3 | N9: 9 | O9: 17 | Q9: 3 | R9: 7 | S9: 2 | V9: 3 | W9: 1 | X9: 1 | AA9: 2 | AD9: 1 | AE9: 17 | AF9: 2 | AG9: 17 | AH9: 2002-03-29T00:00:00.000 | AI9: =RC[-33]+RC[-4]+RC[-3]+RC[-2] -> 106 | AJ9: =RC[-5]/RC[-1] -> 0.16037735849056603 | AK9: =RC[-4]/RC[-2] -> 0.16037735849056603
A10: 2002-04-26T00:00:00.000 | B10: =RC[1]+RC[3] -> 45 | C10: =RC[10]+RC[11]+RC[12]+RC[13]+RC[14]+RC[15]+RC[16]+RC[17]+RC[18]+RC[19]+RC[20]+RC[21]+RC[24]+RC[22]+RC[23]+RC[25]+RC[9]+RC[26]+RC[27] -> 30 | D10: =RC[-1]/RC[-2] -> 0.66666666666666663 | E10: =RC[2]+RC[3]+RC[4]+RC[5]+RC[6] -> 15 | F10: =RC[-1]/RC[-4] -> 0.33333333333333331 | G10: 8 | H10: 4 | I10: 3 | L10: 1 | N10: 4 | O10: 7 | P10: 1 | R10: 1 | S10: 3 | V10: 7 | X10: 5 | AD10: 1 | AE10: 8 | AF10: 1 | AG10: 5 | AH10: 2002-04-26T00:00:00.000 | AI10: =RC[-33]+RC[-4]+RC[-3]+RC[-2] -> 59 | AJ10: =RC[-5]/RC[-1] -> 0.13559322033898305 | AK10: =RC[-4]/RC[-2] -> 8.4745762711864403E-2
A11: 2002-05-31T00:00:00.000 | B11: =RC[1]+RC[3] -> 73 | C11: =RC[10]+RC[11]+RC[12]+RC[13]+RC[14]+RC[15]+RC[16]+RC[17]+RC[18]+RC[19]+RC[20]+RC[21]+RC[24]+RC[22]+RC[23]+RC[25]+RC[9]+RC[26]+RC[27] -> 52 | D11: =RC[-1]/RC[-2] -> 0.71232876712328763 | E11: =RC[2]+RC[3]+RC[4]+RC[5]+RC[6] -> 21 | F11: =RC[-1]/RC[-4] -> 0.28767123287671231 | G11: 8 | H11: 4 | I11: 9 | L11: 1 | M11: 2 | N11: 12 | O11: 11 | P11: 4 | Q11: 1 | R11: 5 | S11: 2 | T11: 2 | U11: 2 | V11: 3 | W11: 1 | X11: 2 | Y11: 1 | AA11: 1 | AC11: 2 | AE11: 11 | AF11: 1 | AG11: 10 | AH11: 2002-05-31T00:00:00.000 | AI11: =RC[-33]+RC[-4]+RC[-3]+RC[-2] -> 95 | AJ11: =RC[-5]/RC[-1] -> 0.11578947368421053 | AK11: =RC[-4]/RC[-2] -> 0.10526315789473684
A12: 2002-06-28T00:00:00.000 | B12: =RC[1]+RC[3] -> 42 | C12: =RC[10]+RC[11]+RC[12]+RC[13]+RC[14]+RC[15]+RC[16]+RC[17]+RC[18]+RC[19]+RC[20]+RC[21]+RC[24]+RC[22]+RC[23]+RC[25]+RC[9]+RC[26]+RC[27] -> 28 | D12: =RC[-1]/RC[-2] -> 0.66666666666666663 | E12: =RC[2]+RC[3]+RC[4]+RC[5]+RC[6] -> 14 | F12: =RC[-1]/RC[-4] -> 0.33333333333333331 | G12: 4 | H12: 4 | I12: 3 | K12: 3 | L12: 1 | M12: 1 | N12: 3 | O12: 8 | R12: 7 | V12: 2 | W12: 1 | X12: 1 | Y12: 3 | AD12: 1 | AE12: 15 | AG12: 10 | AH12: 2002-06-28T00:00:00.000 | AI12: =RC[-33]+RC[-4]+RC[-3]+RC[-2] -> 67 | AJ12: =RC[-5]/RC[-1] -> 0.22388059701492538 | AK12: =RC[-4]/RC[-2] -> 0.14925373134328357
A13: 2002-07-26T00:00:00.000 | B13: =RC[1]+RC[3] -> 61 | C13: =RC[10]+RC[11]+RC[12]+RC[13]+RC[14]+RC[15]+RC[16]+RC[17]+RC[18]+RC[19]+RC[20]+RC[21]+RC[24]+RC[22]+RC[23]+RC[25]+RC[9]+RC[26]+RC[27] -> 37 | D13: =RC[-1]/RC[-2] -> 0.60655737704918034 | E13: =RC[2]+RC[3]+RC[4]+RC[5]+RC[6] -> 24 | F13: =RC[-1]/RC[-4] -> 0.39344262295081966 | G13: 8 | H13: 6 | I13: 7 | J13: 1 | K13: 2 | M13: 1 | N13: 1 | O13: 11 | Q13: 1 | R13: 3 | S13: 2 | T13: 1 | U13: 2 | W13: 1 | X13: 10 | Y13: 2 | AD13: 2 | AE13: 16 | AF13: 2 | AG13: 6 | AH13: 2002-07-26T00:00:00.000 | AI13: =RC[-33]+RC[-4]+RC[-3]+RC[-2] -> 85 | AJ13: =RC[-5]/RC[-1] -> 0.18823529411764706 | AK13: =RC[-4]/RC[-2] -> 7.0588235294117646E-2
A14: 2002-08-30T00:00:00.000 | B14: =RC[1]+RC[3] -> 57 | C14: =RC[10]+RC[11]+RC[12]+RC[13]+RC[14]+RC[15]+RC[16]+RC[17]+RC[18]+RC[19]+RC[20]+RC[21]+RC[24]+RC[22]+RC[23]+RC[25]+RC[9]+RC[26]+RC[27] -> 38 | D14: =RC[-1]/RC[-2] -> 0.66666666666666663 | E14: =RC[2]+RC[3]+RC[4]+RC[5]+RC[6] -> 19 | F14: =RC[-1]/RC[-4] -> 0.33333333333333331 | G14: 4 | H14: 6 | I14: 4 | J14: 3 | K14: 2 | M14: 1 | N14: 4 | O14: 6 | P14: 2 | Q14: 1 | R14: 4 | S14: 5 | T14: 1 | V14: 5 | X14: 5 | Y14: 1 | Z14: 1 | AA14: 1 | AD14: 1 | AE14: 12 | AG14: 12 | AH14: 2002-08-30T00:00:00.000 | AI14: =RC[-33]+RC[-4]+RC[-3]+RC[-2] -> 81 | AJ14: =RC[-5]/RC[-1] -> 0.14814814814814814 | AK14: =RC[-4]/RC[-2] -> 0.14814814814814814
A15: 2002-09-27T00:00:00.000 | B15: =RC[1]+RC[3] -> 41 | C15: =RC[10]+RC[11]+RC[12]+RC[13]+RC[14]+RC[15]+RC[16]+RC[17]+RC[18]+RC[19]+RC[20]+RC[21]+RC[24]+RC[22]+RC[23]+RC[25]+RC[9]+RC[26]+RC[27] -> 30 | D15: =RC[-1]/RC[-2] -> 0.73170731707317072 | E15: =RC[2]+RC[3]+RC[4]+RC[5]+RC[6] -> 11 | F15: =RC[-1]/RC[-4] -> 0.26829268292682928 | G15: 4 | H15: 5 | I15: 1 | K15: 1 | L15: 1 | M15: 1 | N15: 3 | O15: 8 | Q15: 1 | R15: 6 | U15: 1 | V15: 1 | W15: 1 | X15: 5 | Y15: 1 | AD15: 1 | AE15: 12 | AG15: 6 | AH15: 2002-09-27T00:00:00.000 | AI15: =RC[-33]+RC[-4]+RC[-3]+RC[-2] -> 59 | AJ15: =RC[-5]/RC[-1] -> 0.20338983050847459 | AK15: =RC[-4]/RC[-2] -> 0.10169491525423729
A16: 2002-10-25T00:00:00.000 | B16: =RC[1]+RC[3] -> 53 | C16: =RC[10]+RC[11]+RC[12]+RC[13]+RC[14]+RC[15]+RC[16]+RC[17]+RC[18]+RC[19]+RC[20]+RC[21]+RC[24]+RC[22]+RC[23]+RC[25]+RC[9]+RC[26]+RC[27] -> 39 | D16: =RC[-1]/RC[-2] -> 0.73584905660377353 | E16: =RC[2]+RC[3]+RC[4]+RC[5]+RC[6] -> 14 | F16: =RC[-1]/RC[-4] -> 0.26415094339622641 | G16: 5 | H16: 4 | I16: 3 | J16: 1 | K16: 1 | L16: 1 | N16: 5 | O16: 9 | P16: 2 | Q16: 1 | R16: 5 | S16: 3 | T16: 1 | U16: 1 | V16: 1 | W16: 3 | X16: 5 | Y16: 2 | AE16: 26 | AF16: 1 | AG16: 14 | AH16: 2002-10-25T00:00:00.000 | AI16: =RC[-33]+RC[-4]+RC[-3]+RC[-2] -> 94 | AJ16: =RC[-5]/RC[-1] -> 0.27659574468085107 | AK16: =RC[-4]/RC[-2] -> 0.14893617021276595
A17: 2002-11-29T00:00:00.000 | B17: =RC[1]+RC[3] -> 53 | C17: =RC[10]+RC[11]+RC[12]+RC[13]+RC[14]+RC[15]+RC[16]+RC[17]+RC[18]+RC[19]+RC[20]+RC[21]+RC[24]+RC[22]+RC[23]+RC[25]+RC[9]+RC[26]+RC[27] -> 36 | D17: =RC[-1]/RC[-2] -> 0.67924528301886788 | E17: =RC[2]+RC[3]+RC[4]+RC[5]+RC[6] -> 17 | F17: =RC[-1]/RC[-4] -> 0.32075471698113206 | G17: 5 | H17: 5 | I17: 6 | J17: 1 | L17: 1 | M17: 1 | N17: 1 | O17: 14 | Q17: 2 | R17: 8 | S17: 3 | V17: 2 | X17: 3 | AA17: 1 | AE17: 27 | AG17: 14 | AH17: 2002-11-29T00:00:00.000 | AI17: =RC[-33]+RC[-4]+RC[-3]+RC[-2] -> 94 | AJ17: =RC[-5]/RC[-1] -> 0.28723404255319152 | AK17: =RC[-4]/RC[-2] -> 0.14893617021276595
A18: 2002-12-27T00:00:00.000 | B18: =RC[1]+RC[3] -> 60 | C18: =RC[10]+RC[11]+RC[12]+RC[13]+RC[14]+RC[15]+RC[16]+RC[17]+RC[18]+RC[19]+RC[20]+RC[21]+RC[24]+RC[22]+RC[23]+RC[25]+RC[9]+RC[26]+RC[27] -> 38 | D18: =RC[-1]/RC[-2] -> 0.6333333333333333 | E18: =RC[2]+RC[3]+RC[4]+RC[5]+RC[6] -> 22 | F18: =RC[-1]/RC[-4] -> 0.36666666666666664 | G18: 8 | H18: 10 | I18: 4 | M18: 3 | O18: 16 | P18: 1 | Q18: 5 | S18: 2 | V18: 3 | W18: 1 | X18: 5 | Y18: 2 | AE18: 16 | AF18: 1 | AG18: 6 | AH18: 2002-12-27T00:00:00.000 | AI18: =RC[-33]+RC[-4]+RC[-3]+RC[-2] -> 83 | AJ18: =RC[-5]/RC[-1] -> 0.19277108433734941 | AK18: =RC[-4]/RC[-2] -> 7.2289156626506021E-2
A19: 2003-01-31T00:00:00.000 | B19: =RC[1]+RC[3] -> 84 | C19: =RC[10]+RC[11]+RC[12]+RC[13]+RC[14]+RC[15]+RC[16]+RC[17]+RC[18]+RC[19]+RC[20]+RC[21]+RC[24]+RC[22]+RC[23]+RC[25]+RC[9]+RC[26]+RC[27] -> 55 | D19: =RC[-1]/RC[-2] -> 0.65476190476190477 | E19: =RC[2]+RC[3]+RC[4]+RC[5]+RC[6] -> 29 | F19: =RC[-1]/RC[-4] -> 0.34523809523809523 | G19: 6 | H19: 11 | I19: 5 | J19: 3 | K19: 4 | N19: 2 | O19: 25 | P19: 1 | Q19: 1 | R19: 2 | S19: 8 | V19: 5 | X19: 4 | Y19: 4 | AC19: 2 | AD19: 1 | AE19: 19 | AF19: 6 | AG19: 6 | AH19: 2003-01-31T00:00:00.000 | AI19: =RC[-33]+RC[-4]+RC[-3]+RC[-2] -> 115 | AJ19: =RC[-5]/RC[-1] -> 0.16521739130434782 | AK19: =RC[-4]/RC[-2] -> 5.2173913043478258E-2
A20: 2003-02-28T00:00:00.000 | B20: =RC[1]+RC[3] -> 52 | C20: =RC[10]+RC[11]+RC[12]+RC[13]+RC[14]+RC[15]+RC[16]+RC[17]+RC[18]+RC[19]+RC[20]+RC[21]+RC[24]+RC[22]+RC[23]+RC[25]+RC[9]+RC[26]+RC[27] -> 34 | D20: =RC[-1]/RC[-2] -> 0.65384615384615385 | E20: =RC[2]+RC[3]+RC[4]+RC[5]+RC[6] -> 18 | F20: =RC[-1]/RC[-4] -> 0.34615384615384615 | G20: 5 | H20: 3 | I20: 7 | J20: 1 | K20: 2 | M20: 2 | O20: 12 | R20: 3 | S20: 1 | V20: 3 | W20: 1 | X20: 7 | Y20: 4 | AC20: 1 | AE20: 17 | AF20: 3 | AG20: 6 | AH20: 2003-02-28T00:00:00.000 | AI20: =RC[-33]+RC[-4]+RC[-3]+RC[-2] -> 78 | AJ20: =RC[-5]/RC[-1] -> 0.21794871794871795 | AK20: =RC[-4]/RC[-2] -> 7.6923076923076927E-2
A21: 2003-03-28T00:00:00.000 | B21: =RC[1]+RC[3] -> 50 | C21: =RC[10]+RC[11]+RC[12]+RC[13]+RC[14]+RC[15]+RC[16]+RC[17]+RC[18]+RC[19]+RC[20]+RC[21]+RC[24]+RC[22]+RC[23]+RC[25]+RC[9]+RC[26]+RC[27] -> 35 | D21: =RC[-1]/RC[-2] -> 0.7 | E21: =RC[2]+RC[3]+RC[4]+RC[5]+RC[6] -> 15 | F21: =RC[-1]/RC[-4] -> 0.3 | G21: 7 | H21: 4 | I21: 3 | J21: 1 | M21: 3 | N21: 1 | O21: 11 | R21: 3 | S21: 3 | V21: 2 | W21: 1 | X21: 5 | Y21: 4 | AA21: 2 | AE21: 17 | AF21: 3 | AG21: 9 | AH21: 2003-03-28T00:00:00.000 | AI21: =RC[-33]+RC[-4]+RC[-3]+RC[-2] -> 79 | AJ21: =RC[-5]/RC[-1] -> 0.21518987341772153 | AK21: =RC[-4]/RC[-2] -> 0.11392405063291139
A22: 2003-04-25T00:00:00.000 | B22: =RC[1]+RC[3] -> 35 | C22: =RC[10]+RC[11]+RC[12]+RC[13]+RC[14]+RC[15]+RC[16]+RC[17]+RC[18]+RC[19]+RC[20]+RC[21]+RC[24]+RC[22]+RC[23]+RC[25]+RC[9]+RC[26]+RC[27] -> 22 | D22: =RC[-1]/RC[-2] -> 0.62857142857142856 | E22: =RC[2]+RC[3]+RC[4]+RC[5]+RC[6] -> 13 | F22: =RC[-1]/RC[-4] -> 0.37142857142857144 | G22: 1 | H22: 5 | I22: 6 | J22: 1 | L22: 1 | M22: 2 | N22: 1 | O22: 4 | R22: 3 | S22: 2 | V22: 1 | X22: 6 | Y22: 2 | AE22: 10 | AG22: 9 | AH22: 2003-04-25T00:00:00.000 | AI22: =RC[-33]+RC[-4]+RC[-3]+RC[-2] -> 54 | AJ22: =RC[-5]/RC[-1] -> 0.18518518518518517 | AK22: =RC[-4]/RC[-2] -> 0.16666666666666666
A23: 2003-06-27T00:00:00.000 | B23: =RC[1]+RC[3] -> 36 | C23: =RC[10]+RC[11]+RC[12]+RC[13]+RC[14]+RC[15]+RC[16]+RC[17]+RC[18]+RC[19]+RC[20]+RC[21]+RC[24]+RC[22]+RC[23]+RC[25]+RC[9]+RC[26]+RC[27] -> 25 | D23: =RC[-1]/RC[-2] -> 0.69444444444444442 | E23: =RC[2]+RC[3]+RC[4]+RC[5]+RC[6] -> 11 | F23: =RC[-1]/RC[-4] -> 0.30555555555555558 | G23: 5 | H23: 4 | I23: 1 | K23: 1 | N23: 4 | O23: 2 | P23: 1 | Q23: 1 | R23: 1 | S23: 8 | V23: 4 | X23: 2 | Y23: 2 | AE23: 16 | AF23: 2 | AG23: 9 | AH23: 2003-06-27T00:00:00.000 | AI23: =RC[-33]+RC[-4]+RC[-3]+RC[-2] -> 63 | AJ23: =RC[-5]/RC[-1] -> 0.25396825396825395 | AK23: =RC[-4]/RC[-2] -> 0.14285714285714285
A24: 2003-06-27T00:00:00.000 | B24: =RC[1]+RC[3] -> 36 | C24: =RC[10]+RC[11]+RC[12]+RC[13]+RC[14]+RC[15]+RC[16]+RC[17]+RC[18]+RC[19]+RC[20]+RC[21]+RC[24]+RC[22]+RC[23]+RC[25]+RC[9]+RC[26]+RC[27] -> 25 | D24: =RC[-1]/RC[-2] -> 0.69444444444444442 | E24: =RC[2]+RC[3]+RC[4]+RC[5]+RC[6] -> 11 | F24: =RC[-1]/RC[-4] -> 0.30555555555555558 | G24: 5 | H24: 4 | I24: 1 | K24: 1 | N24: 4 | O24: 2 | P24: 1 | Q24: 1 | R24: 1 | S24: 8 | V24: 4 | X24: 2 | Y24: 2 | AE24: 16 | AF24: 2 | AG24: 9 | AH24: 2003-06-27T00:00:00.000 | AI24: =RC[-33]+RC[-4]+RC[-3]+RC[-2] -> 63 | AJ24: =RC[-5]/RC[-1] -> 0.25396825396825395 | AK24: =RC[-4]/RC[-2] -> 0.14285714285714285
A25: 2003-07-25T00:00:00.000 | B25: =RC[1]+RC[3] -> 39 | C25: =RC[10]+RC[11]+RC[12]+RC[13]+RC[14]+RC[15]+RC[16]+RC[17]+RC[18]+RC[19]+RC[20]+RC[21]+RC[24]+RC[22]+RC[23]+RC[25]+RC[9]+RC[26]+RC[27] -> 32 | D25: =RC[-1]/RC[-2] -> 0.82051282051282048 | E25: =RC[2]+RC[3]+RC[4]+RC[5]+RC[6] -> 7 | F25: =RC[-1]/RC[-4] -> 0.17948717948717949 | G25: 2 | H25: 1 | I25: 3 | J25: 1 | L25: 1 | M25: 3 | N25: 3 | O25: 6 | P25: 4 | R25: 4 | S25: 7 | W25: 1 | X25: 2 | AC25: 1 | AE25: 9 | AF25: 1 | AG25: 11 | AH25: 2003-07-25T00:00:00.000 | AI25: =RC[-33]+RC[-4]+RC[-3]+RC[-2] -> 60 | AJ25: =RC[-5]/RC[-1] -> 0.15 | AK25: =RC[-4]/RC[-2] -> 0.18333333333333332
A26: 2003-08-29T00:00:00.000 | B26: =RC[1]+RC[3] -> 61 | C26: =RC[10]+RC[11]+RC[12]+RC[13]+RC[14]+RC[15]+RC[16]+RC[17]+RC[18]+RC[19]+RC[20]+RC[21]+RC[24]+RC[22]+RC[23]+RC[25]+RC[9]+RC[26]+RC[27] -> 42 | D26: =RC[-1]/RC[-2] -> 0.68852459016393441 | E26: =RC[2]+RC[3]+RC[4]+RC[5]+RC[6] -> 19 | F26: =RC[-1]/RC[-4] -> 0.31147540983606559 | G26: 11 | H26: 2 | I26: 5 | K26: 1 | L26: 1 | N26: 2 | O26: 7 | R26: 1 | S26: 17 | U26: 1 | V26: 5 | W26: 1 | X26: 4 | Y26: 3 | AE26: 19 | AF26: 1 | AG26: 14 | AH26: 2003-08-29T00:00:00.000 | AI26: =RC[-33]+RC[-4]+RC[-3]+RC[-2] -> 95 | AJ26: =RC[-5]/RC[-1] -> 0.2 | AK26: =RC[-4]/RC[-2] -> 0.14736842105263157
A27: 2003-09-26T00:00:00.000 | B27: =RC[1]+RC[3] -> 45 | C27: =RC[10]+RC[11]+RC[12]+RC[13]+RC[14]+RC[15]+RC[16]+RC[17]+RC[18]+RC[19]+RC[20]+RC[21]+RC[24]+RC[22]+RC[23]+RC[25]+RC[9]+RC[26]+RC[27] -> 40 | D27: =RC[-1]/RC[-2] -> 0.88888888888888884 | E27: =RC[2]+RC[3]+RC[4]+RC[5]+RC[6] -> 5 | F27: =RC[-1]/RC[-4] -> 0.1111111111111111 | G27: 2 | H27: 3 | L27: 2 | M27: 1 | O27: 12 | P27: 1 | Q27: 6 | R27: 2 | S27: 7 | T27: 1 | V27: 1 | W27: 1 | X27: 3 | Y27: 1 | AD27: 2 | AE27: 14 | AF27: 3 | AG27: 7 | AH27: 2003-09-26T00:00:00.000 | AI27: =RC[-33]+RC[-4]+RC[-3]+RC[-2] -> 69 | AJ27: =RC[-5]/RC[-1] -> 0.20289855072463769 | AK27: =RC[-4]/RC[-2] -> 0.10144927536231885
A28: 2003-10-31T00:00:00.000 | B28: =RC[1]+RC[3] -> 51 | C28: =RC[10]+RC[11]+RC[12]+RC[13]+RC[14]+RC[15]+RC[16]+RC[17]+RC[18]+RC[19]+RC[20]+RC[21]+RC[24]+RC[22]+RC[23]+RC[25]+RC[9]+RC[26]+RC[27] -> 43 | D28: =RC[-1]/RC[-2] -> 0.84313725490196079 | E28: =RC[2]+RC[3]+RC[4]+RC[5]+RC[6] -> 8 | F28: =RC[-1]/RC[-4] -> 0.15686274509803921 | G28: 2 | H28: 2 | I28: 2 | J28: 1 | K28: 1 | L28: 1 | M28: 2 | N28: 4 | O28: 12 | P28: 1 | Q28: 2 | R28: 1 | S28: 5 | T28: 1 | V28: 5 | X28: 4 | Y28: 3 | AC28: 2 | AE28: 11 | AF28: 3 | AG28: 6 | AH28: 2003-10-31T00:00:00.000 | AI28: =RC[-33]+RC[-4]+RC[-3]+RC[-2] -> 71 | AJ28: =RC[-5]/RC[-1] -> 0.15492957746478872 | AK28: =RC[-4]/RC[-2] -> 8.4507042253521125E-2
A29: 2005-02-25T00:00:00.000 | B29: =RC[1]+RC[3] -> 46 | C29: =RC[10]+RC[11]+RC[12]+RC[13]+RC[14]+RC[15]+RC[16]+RC[17]+RC[18]+RC[19]+RC[20]+RC[21]+RC[24]+RC[22]+RC[23]+RC[25]+RC[9]+RC[26]+RC[27] -> 34 | D29: =RC[-1]/RC[-2] -> 0.73913043478260865 | E29: =RC[2]+RC[3]+RC[4]+RC[5]+RC[6] -> 12 | F29: =RC[-1]/RC[-4] -> 0.2608695652173913 | G29: 6 | H29: 4 | I29: 1 | J29: 1 | L29: 1 | M29: 1 | N29: 4 | O29: 14 | R29: 1 | S29: 4 | T29: 1 | V29: 4 | X29: 3 | Y29: 1 | AE29: 11 | AF29: 1 | AG29: 4 | AH29: 2005-02-25T00:00:00.000 | AI29: =RC[-33]+RC[-4]+RC[-3]+RC[-2] -> 62 | AJ29: =RC[-5]/RC[-1] -> 0.17741935483870969 | AK29: =RC[-4]/RC[-2] -> 6.4516129032258063E-2
A30: 2004-10-29T00:00:00.000 | B30: =RC[1]+RC[3] -> 84 | C30: =RC[10]+RC[11]+RC[12]+RC[13]+RC[14]+RC[15]+RC[16]+RC[17]+RC[18]+RC[19]+RC[20]+RC[21]+RC[24]+RC[22]+RC[23]+RC[25]+RC[9]+RC[26]+RC[27] -> 55 | D30: =RC[-1]/RC[-2] -> 0.65476190476190477 | E30: =RC[2]+RC[3]+RC[4]+RC[5]+RC[6] -> 29 | F30: =RC[-1]/RC[-4] -> 0.34523809523809523 | G30: 12 | H30: 8 | I30: 5 | J30: 2 | K30: 2 | N30: 14 | O30: 6 | P30: 2 | Q30: 2 | R30: 8 | S30: 11 | V30: 1 | X30: 10 | Y30: 1 | AE30: 19 | AF30: 2 | AG30: 12 | AH30: 2004-10-29T00:00:00.000 | AI30: =RC[-33]+RC[-4]+RC[-3]+RC[-2] -> 117 | AJ30: =RC[-5]/RC[-1] -> 0.1623931623931624 | AK30: =RC[-4]/RC[-2] -> 0.10256410256410256
A31: 2004-09-24T00:00:00.000 | B31: =RC[1]+RC[3] -> 53 | C31: =RC[10]+RC[11]+RC[12]+RC[13]+RC[14]+RC[15]+RC[16]+RC[17]+RC[18]+RC[19]+RC[20]+RC[21]+RC[24]+RC[22]+RC[23]+RC[25]+RC[9]+RC[26]+RC[27] -> 42 | D31: =RC[-1]/RC[-2] -> 0.79245283018867929 | E31: =RC[2]+RC[3]+RC[4]+RC[5]+RC[6] -> 11 | F31: =RC[-1]/RC[-4] -> 0.20754716981132076 | G31: 5 | H31: 5 | K31: 1 | L31: 1 | M31: 2 | N31: 9 | O31: 6 | Q31: 1 | R31: 9 | S31: 3 | V31: 4 | X31: 5 | Y31: 2 | AE31: 12 | AF31: 2 | AG31: 9 | AH31: 2004-09-24T00:00:00.000 | AI31: =RC[-33]+RC[-4]+RC[-3]+RC[-2] -> 76 | AJ31: =RC[-5]/RC[-1] -> 0.15789473684210525 | AK31: =RC[-4]/RC[-2] -> 0.11842105263157894
A32: 2004-08-27T00:00:00.000 | B32: =RC[1]+RC[3] -> 60 | C32: =RC[10]+RC[11]+RC[12]+RC[13]+RC[14]+RC[15]+RC[16]+RC[17]+RC[18]+RC[19]+RC[20]+RC[21]+RC[24]+RC[22]+RC[23]+RC[25]+RC[9]+RC[26]+RC[27] -> 45 | D32: =RC[-1]/RC[-2] -> 0.75 | E32: =RC[2]+RC[3]+RC[4]+RC[5]+RC[6] -> 15 | F32: =RC[-1]/RC[-4] -> 0.25 | G32: 5 | H32: 4 | I32: 2 | J32: 1 | K32: 3 | L32: 1 | M32: 2 | N32: 7 | O32: 9 | R32: 5 | S32: 5 | U32: 1 | V32: 4 | X32: 7 | Y32: 1 | AA32: 2 | AC32: 1 | AE32: 7 | AG32: 9 | AH32: 2004-08-27T00:00:00.000 | AI32: =RC[-33]+RC[-4]+RC[-3]+RC[-2] -> 76 | AJ32: =RC[-5]/RC[-1] -> 9.2105263157894732E-2 | AK32: =RC[-4]/RC[-2] -> 0.11842105263157894
A33: 2004-07-30T00:00:00.000 | B33: =RC[1]+RC[3] -> 55 | C33: =RC[10]+RC[11]+RC[12]+RC[13]+RC[14]+RC[15]+RC[16]+RC[17]+RC[18]+RC[19]+RC[20]+RC[21]+RC[24]+RC[22]+RC[23]+RC[25]+RC[9]+RC[26]+RC[27] -> 41 | D33: =RC[-1]/RC[-2] -> 0.74545454545454548 | E33: =RC[2]+RC[3]+RC[4]+RC[5]+RC[6] -> 14 | F33: =RC[-1]/RC[-4] -> 0.25454545454545452 | G33: 4 | H33: 6 | I33: 2 | J33: 1 | K33: 1 | L33: 1 | N33: 13 | O33: 4 | Q33: 1 | R33: 4 | S33: 3 | V33: 4 | X33: 4 | Y33: 2 | AC33: 4 | AD33: 1 | AE33: 19 | AF33: 2 | AG33: 8 | AH33: 2004-07-30T00:00:00.000 | AI33: =RC[-33]+RC[-4]+RC[-3]+RC[-2] -> 84 | AJ33: =RC[-5]/RC[-1] -> 0.22619047619047619 | AK33: =RC[-4]/RC[-2] -> 9.5238095238095233E-2
A34: 2004-06-25T00:00:00.000 | B34: =RC[1]+RC[3] -> 57 | C34: =RC[10]+RC[11]+RC[12]+RC[13]+RC[14]+RC[15]+RC[16]+RC[17]+RC[18]+RC[19]+RC[20]+RC[21]+RC[24]+RC[22]+RC[23]+RC[25]+RC[9]+RC[26]+RC[27] -> 43 | D34: =RC[-1]/RC[-2] -> 0.75438596491228072 | E34: =RC[2]+RC[3]+RC[4]+RC[5]+RC[6] -> 14 | F34: =RC[-1]/RC[-4] -> 0.24561403508771928 | G34: 1 | H34: 6 | I34: 6 | K34: 1 | M34: 5 | N34: 8 | O34: 4 | P34: 1 | R34: 6 | S34: 9 | T34: 1 | V34: 1 | X34: 4 | Y34: 2 | AA34: 1 | AC34: 1 | AE34: 17 | AF34: 1 | AG34: 12 | AH34: 2004-06-25T00:00:00.000 | AI34: =RC[-33]+RC[-4]+RC[-3]+RC[-2] -> 87 | AJ34: =RC[-5]/RC[-1] -> 0.19540229885057472 | AK34: =RC[-4]/RC[-2] -> 0.13793103448275862
A35: 2004-05-28T00:00:00.000 | B35: =RC[1]+RC[3] -> 56 | C35: =RC[10]+RC[11]+RC[12]+RC[13]+RC[14]+RC[15]+RC[16]+RC[17]+RC[18]+RC[19]+RC[20]+RC[21]+RC[24]+RC[22]+RC[23]+RC[25]+RC[9]+RC[26]+RC[27] -> 35 | D35: =RC[-1]/RC[-2] -> 0.625 | E35: =RC[2]+RC[3]+RC[4]+RC[5]+RC[6] -> 21 | F35: =RC[-1]/RC[-4] -> 0.375 | G35: 7 | H35: 5 | I35: 7 | J35: 2 | M35: 4 | N35: 6 | O35: 3 | R35: 5 | S35: 4 | V35: 5 | X35: 7 | AA35: 1 | AE35: 12 | AF35: 1 | AG35: 17 | AH35: 2004-05-28T00:00:00.000 | AI35: =RC[-33]+RC[-4]+RC[-3]+RC[-2] -> 86 | AJ35: =RC[-5]/RC[-1] -> 0.13953488372093023 | AK35: =RC[-4]/RC[-2] -> 0.19767441860465115
A36: 2004-04-30T00:00:00.000 | B36: =RC[1]+RC[3] -> 77 | C36: =RC[10]+RC[11]+RC[12]+RC[13]+RC[14]+RC[15]+RC[16]+RC[17]+RC[18]+RC[19]+RC[20]+RC[21]+RC[24]+RC[22]+RC[23]+RC[25]+RC[9]+RC[26]+RC[27] -> 53 | D36: =RC[-1]/RC[-2] -> 0.68831168831168832 | E36: =RC[2]+RC[3]+RC[4]+RC[5]+RC[6] -> 24 | F36: =RC[-1]/RC[-4] -> 0.31168831168831168 | G36: 6 | H36: 9 | I36: 7 | J36: 2 | L36: 2 | M36: 1 | N36: 6 | O36: 8 | Q36: 4 | R36: 6 | S36: 10 | T36: 1 | V36: 4 | X36: 8 | AC36: 3 | AE36: 21 | AF36: 2 | AG36: 12 | AH36: 2004-04-30T00:00:00.000 | AI36: =RC[-33]+RC[-4]+RC[-3]+RC[-2] -> 112 | AJ36: =RC[-5]/RC[-1] -> 0.1875 | AK36: =RC[-4]/RC[-2] -> 0.10714285714285714
A37: 2004-03-26T00:00:00.000 | B37: =RC[1]+RC[3] -> 66 | C37: =RC[10]+RC[11]+RC[12]+RC[13]+RC[14]+RC[15]+RC[16]+RC[17]+RC[18]+RC[19]+RC[20]+RC[21]+RC[24]+RC[22]+RC[23]+RC[25]+RC[9]+RC[26]+RC[27] -> 46 | D37: =RC[-1]/RC[-2] -> 0.69696969696969702 | E37: =RC[2]+RC[3]+RC[4]+RC[5]+RC[6] -> 20 | F37: =RC[-1]/RC[-4] -> 0.30303030303030304 | G37: 7 | H37: 3 | I37: 7 | J37: 2 | K37: 1 | L37: 2 | M37: 1 | N37: 6 | O37: 8 | P37: 1 | Q37: 4 | R37: 6 | S37: 2 | T37: 1 | U37: 1 | W37: 1 | X37: 5 | Y37: 3 | AA37: 4 | AC37: 1 | AE37: 15 | AF37: 2 | AG37: 16 | AH37: 2004-03-26T00:00:00.000 | AI37: =RC[-33]+RC[-4]+RC[-3]+RC[-2] -> 99 | AJ37: =RC[-5]/RC[-1] -> 0.15151515151515152 | AK37: =RC[-4]/RC[-2] -> 0.16161616161616163
A38: 2004-02-27T00:00:00.000 | B38: =RC[1]+RC[3] -> 67 | C38: =RC[10]+RC[11]+RC[12]+RC[13]+RC[14]+RC[15]+RC[16]+RC[17]+RC[18]+RC[19]+RC[20]+RC[21]+RC[24]+RC[22]+RC[23]+RC[25]+RC[9]+RC[26]+RC[27] -> 48 | D38: =RC[-1]/RC[-2] -> 0.71641791044776115 | E38: =RC[2]+RC[3]+RC[4]+RC[5]+RC[6] -> 19 | F38: =RC[-1]/RC[-4] -> 0.28358208955223879 | G38: 4 | H38: 3 | I38: 6 | J38: 3 | K38: 3 | M38: 2 | N38: 2 | O38: 14 | R38: 4 | S38: 6 | T38: 3 | V38: 5 | W38: 1 | X38: 4 | Y38: 2 | AA38: 3 | AC38: 1 | AD38: 1 | AE38: 12 | AF38: 2 | AG38: 8 | AH38: 2004-02-27T00:00:00.000 | AI38: =RC[-33]+RC[-4]+RC[-3]+RC[-2] -> 89 | AJ38: =RC[-5]/RC[-1] -> 0.1348314606741573 | AK38: =RC[-4]/RC[-2] -> 8.98876404494382E-2
A39: 2004-01-30T00:00:00.000 | B39: =RC[1]+RC[3] -> 54 | C39: =RC[10]+RC[11]+RC[12]+RC[13]+RC[14]+RC[15]+RC[16]+RC[17]+RC[18]+RC[19]+RC[20]+RC[21]+RC[24]+RC[22]+RC[23]+RC[25]+RC[9]+RC[26]+RC[27] -> 41 | D39: =RC[-1]/RC[-2] -> 0.7592592592592593 | E39: =RC[2]+RC[3]+RC[4]+RC[5]+RC[6] -> 13 | F39: =RC[-1]/RC[-4] -> 0.24074074074074073 | G39: 3 | H39: 1 | I39: 7 | J39: 2 | M39: 2 | N39: 7 | O39: 7 | Q39: 5 | R39: 3 | S39: 1 | T39: 1 | V39: 4 | X39: 8 | Y39: 3 | AE39: 19 | AF39: 1 | AG39: 16 | AH39: 2004-01-30T00:00:00.000 | AI39: =RC[-33]+RC[-4]+RC[-3]+RC[-2] -> 90 | AJ39: =RC[-5]/RC[-1] -> 0.21111111111111111 | AK39: =RC[-4]/RC[-2] -> 0.17777777777777778
A40: 2003-12-26T00:00:00.000 | B40: =RC[1]+RC[3] -> 49 | C40: =RC[10]+RC[11]+RC[12]+RC[13]+RC[14]+RC[15]+RC[16]+RC[17]+RC[18]+RC[19]+RC[20]+RC[21]+RC[24]+RC[22]+RC[23]+RC[25]+RC[9]+RC[26]+RC[27] -> 37 | D40: =RC[-1]/RC[-2] -> 0.75510204081632648 | E40: =RC[2]+RC[3]+RC[4]+RC[5]+RC[6] -> 12 | F40: =RC[-1]/RC[-4] -> 0.24489795918367346 | G40: 4 | H40: 3 | I40: 2 | K40: 3 | M40: 1 | N40: 1 | O40: 4 | Q40: 1 | R40: 3 | S40: 6 | V40: 2 | W40: 1 | X40: 14 | Y40: 1 | AA40: 3 | AE40: 8 | AG40: 16 | AH40: 2003-12-26T00:00:00.000 | AI40: =RC[-33]+RC[-4]+RC[-3]+RC[-2] -> 73 | AJ40: =RC[-5]/RC[-1] -> 0.1095890410958904 | AK40: =RC[-4]/RC[-2] -> 0.21917808219178081
A41: 2003-11-28T00:00:00.000 | B41: =RC[1]+RC[3] -> 38 | C41: =RC[10]+RC[11]+RC[12]+RC[13]+RC[14]+RC[15]+RC[16]+RC[17]+RC[18]+RC[19]+RC[20]+RC[21]+RC[24]+RC[22]+RC[23]+RC[25]+RC[9]+RC[26]+RC[27] -> 27 | D41: =RC[-1]/RC[-2] -> 0.71052631578947367 | E41: =RC[2]+RC[3]+RC[4]+RC[5]+RC[6] -> 11 | F41: =RC[-1]/RC[-4] -> 0.28947368421052633 | H41: 4 | I41: 1 | J41: 5 | K41: 1 | L41: 4 | M41: 1 | N41: 6 | O41: 5 | Q41: 1 | R41: 1 | S41: 3 | U41: 1 | V41: 1 | X41: 3 | Y41: 1 | AE41: 15 | AG41: 13 | AH41: 2003-11-28T00:00:00.000 | AI41: =RC[-33]+RC[-4]+RC[-3]+RC[-2] -> 66 | AJ41: =RC[-5]/RC[-1] -> 0.22727272727272727 | AK41: =RC[-4]/RC[-2] -> 0.19696969696969696
A42: Grand Total | B42: =SUM(R[-41]C:R[-1]C) -> 2226 | C42: =SUM(R[-41]C:R[-1]C) -> 1565 | D42: =RC[-1]/RC[-2] -> 0.70305480682839172 | E42: =SUM(R[-41]C:R[-1]C) -> 661 | F42: =RC[-1]/RC[-4] -> 0.29694519317160828 | G42: =SUM(R[-41]C:R[-1]C) -> 188 | H42: =SUM(R[-41]C:R[-1]C) -> 190 | I42: =SUM(R[-41]C:R[-1]C) -> 163 | J42: =SUM(R[-41]C:R[-1]C) -> 71 | K42: =SUM(R[-41]C:R[-1]C) -> 49 | L42: =SUM(R[-41]C:R[-1]C) -> 36 | M42: =SUM(R[-41]C:R[-1]C) -> 58 | N42: =SUM(R[-41]C:R[-1]C) -> 163 | O42: =SUM(R[-41]C:R[-1]C) -> 389 | P42: =SUM(R[-41]C:R[-1]C) -> 25 | Q42: =SUM(R[-41]C:R[-1]C) -> 63 | R42: =SUM(R[-41]C:R[-1]C) -> 173 | S42: =SUM(R[-41]C:R[-1]C) -> 171 | T42: =SUM(R[-41]C:R[-1]C) -> 29 | U42: =SUM(R[-41]C:R[-1]C) -> 11 | V42: =SUM(R[-41]C:R[-1]C) -> 116 | W42: =SUM(R[-41]C:R[-1]C) -> 20 | X42: =SUM(R[-41]C:R[-1]C) -> 177 | Y42: =SUM(R[-41]C:R[-1]C) -> 66 | Z42: =SUM(R[-41]C:R[-1]C) -> 1 | AA42: =SUM(R[-41]C:R[-1]C) -> 28 | AB42: =SUM(R[-41]C:R[-1]C) -> 0 | AC42: =SUM(R[-41]C:R[-1]C) -> 21 | AD42: =SUM(R[-41]C:R[-1]C) -> 18 | AE42: =SUM(R[-41]C:R[-1]C) -> 557 | AF42: =SUM(R[-41]C:R[-1]C) -> 55 | AG42: =SUM(R[-41]C:R[-1]C) -> 391 | AH42: Grand Total | AI42: =SUM(R[-41]C:R[-1]C) -> 3229 | AJ42: =RC[-5]/RC[-1] -> 0.17249922576649118 | AK42: =RC[-4]/RC[-2] -> 0.12109012078042737

Sheet: Pareto
A1: Month | B1: Total DR's Productive & Non-Productive | C1: Total Non-Productive DR's | D1: Non-Productive % | E1: Productive DR's | F1: Productive % | G1: Documentation | H1: Marketing Requirement Change | I1: Initial Release | J1: Design Review | K1: Obsolete Part | L1: DFM Improvement | M1: Cost Reduction | N1: Fix Supplier Problem | O1: Reliability | P1: Secondary DR | Q1: ACT | R1: Logic / Concept Error | S1: FBOM Error | T1: Certifications | U1: Tolerance Analysis | V1: DQT | W1: Spare Part Req | X1: Mfg Process Mismatch | Y1: Planned Process Change Notice | Z1: Service Other | AA1: Process Escape Other | AB1: Technology Upgrade | AC1: Requirement Error | AD1: Mfg Process Change Notice | AE1: Mfg Process Failure | AF1: Signal Quality Verification | AG1: Tool Failure | AH1: Month | AI1: Total Activity | AJ1: Marketing Requirements Change % | AK1: Initial Release %
A2: 2001-07-01T00:00:00.000 | B2: =RC[1]+RC[3] -> 71 | C2: =RC[17]+RC[7]+RC[4]+RC[19]+RC[16]+RC[11]+RC[15]+RC[21]+RC[28]+RC[12]+RC[26]+RC[13]+RC[18]+RC[23]+RC[29]+RC[30]+RC[14]+RC[22]+RC[24] -> 39 | D2: =RC[-1]/RC[-2] -> 0.54929577464788737 | E2: =RC[8]+RC[7]+RC[6]+RC[25]+RC[23] -> 32 | F2: =RC[-1]/RC[-4] -> 0.45070422535211269 | G2: 17 | H2: 3 | I2: 3 | J2: 1 | K2: 1 | L2: 8 | M2: 1 | N2: 5 | O2: 5 | Q2: 0 | R2: 2 | S2: 2 | T2: 5 | W2: 2 | X2: 2 | Y2: 0 | Z2: 0 | AA2: 0 | AD2: 22 | AF2: 0 | AG2: 0 | AH2: 2001-07-01T00:00:00.000 | AI2: =RC[-33]+RC[-27]+RC[-12]+RC[-26] -> 79 | AJ2: =RC[-28]/RC[-1] -> 3.7974683544303799E-2 | AK2: =RC[-28]/RC[-2] -> 3.7974683544303799E-2
A3: 2001-08-31T00:00:00.000 | B3: =RC[1]+RC[3] -> 58 | C3: =RC[17]+RC[7]+RC[4]+RC[19]+RC[16]+RC[11]+RC[15]+RC[21]+RC[28]+RC[12]+RC[26]+RC[13]+RC[18]+RC[23]+RC[29]+RC[30]+RC[14]+RC[22]+RC[24] -> 34 | D3: =RC[-1]/RC[-2] -> 0.58620689655172409 | E3: =RC[8]+RC[7]+RC[6]+RC[25]+RC[23] -> 24 | F3: =RC[-1]/RC[-4] -> 0.41379310344827586 | G3: 8 | H3: 6 | I3: 5 | J3: 2 | K3: 6 | L3: 5 | M3: 4 | N3: 6 | O3: 2 | P3: 2 | Q3: 1 | R3: 1 | S3: 2 | T3: 1 | U3: 1 | W3: 1 | X3: 4 | Z3: 3 | AA3: 1 | AB3: 3 | AD3: 6 | AH3: 2001-08-31T00:00:00.000 | AI3: =RC[-33]+RC[-27]+RC[-12]+RC[-26] -> 70 | AJ3: =RC[-28]/RC[-1] -> 8.5714285714285715E-2 | AK3: =RC[-28]/RC[-2] -> 7.1428571428571425E-2
A4: 2001-09-28T00:00:00.000 | B4: =RC[1]+RC[3] -> 35 | C4: =RC[17]+RC[7]+RC[4]+RC[19]+RC[16]+RC[11]+RC[15]+RC[21]+RC[28]+RC[12]+RC[26]+RC[13]+RC[18]+RC[23]+RC[29]+RC[30]+RC[14]+RC[22]+RC[24] -> 29 | D4: =RC[-1]/RC[-2] -> 0.82857142857142863 | E4: =RC[8]+RC[7]+RC[6]+RC[25]+RC[23] -> 6 | F4: =RC[-1]/RC[-4] -> 0.17142857142857143 | G4: 10 | H4: 6 | I4: 6 | K4: 3 | M4: 1 | N4: 6 | O4: 1 | P4: 3 | R4: 2 | S4: 1 | U4: 1 | W4: 1 | X4: 3 | AC4: 2 | AD4: 2 | AH4: 2001-09-28T00:00:00.000 | AI4: =RC[-33]+RC[-27]+RC[-12]+RC[-26] -> 48 | AJ4: =RC[-28]/RC[-1] -> 0.125 | AK4: =RC[-28]/RC[-2] -> 0.125
A5: 2001-10-26T00:00:00.000 | B5: =RC[1]+RC[3] -> 45 | C5: =RC[17]+RC[7]+RC[4]+RC[19]+RC[16]+RC[11]+RC[15]+RC[21]+RC[28]+RC[12]+RC[26]+RC[13]+RC[18]+RC[23]+RC[29]+RC[30]+RC[14]+RC[22]+RC[24] -> 34 | D5: =RC[-1]/RC[-2] -> 0.75555555555555554 | E5: =RC[8]+RC[7]+RC[6]+RC[25]+RC[23] -> 11 | F5: =RC[-1]/RC[-4] -> 0.24444444444444444 | G5: 12 | H5: 8 | I5: 10 | J5: 2 | K5: 1 | L5: 4 | M5: 2 | N5: 4 | O5: 1 | P5: 1 | R5: 5 | S5: 4 | T5: 2 | V5: 1 | W5: 1 | X5: 1 | AB5: 3 | AD5: 1 | AE5: 1 | AH5: 2001-10-26T00:00:00.000 | AI5: =RC[-33]+RC[-27]+RC[-12]+RC[-26] -> 64 | AJ5: =RC[-28]/RC[-1] -> 0.125 | AK5: =RC[-28]/RC[-2] -> 0.15625
A6: 2001-11-30T00:00:00.000 | B6: =RC[1]+RC[3] -> 73 | C6: =RC[17]+RC[7]+RC[4]+RC[19]+RC[16]+RC[11]+RC[15]+RC[21]+RC[28]+RC[12]+RC[26]+RC[13]+RC[18]+RC[23]+RC[29]+RC[30]+RC[14]+RC[22]+RC[24] -> 54 | D6: =RC[-1]/RC[-2] -> 0.73972602739726023 | E6: =RC[8]+RC[7]+RC[6]+RC[25]+RC[23] -> 19 | F6: =RC[-1]/RC[-4] -> 0.26027397260273971 | G6: 15 | H6: 20 | I6: 11 | J6: 1 | K6: 7 | L6: 3 | M6: 3 | N6: 10 | O6: 5 | P6: 3 | Q6: 2 | R6: 3 | S6: 3 | U6: 1 | V6: 1 | W6: 1 | X6: 1 | Z6: 4 | AA6: 4 | AB6: 4 | AC6: 1 | AD6: 2 | AH6: 2001-11-30T00:00:00.000 | AI6: =RC[-33]+RC[-27]+RC[-12]+RC[-26] -> 105 | AJ6: =RC[-28]/RC[-1] -> 0.19047619047619047 | AK6: =RC[-28]/RC[-2] -> 0.10476190476190476
A7: 2001-12-28T00:00:00.000 | B7: =RC[1]+RC[3] -> 49 | C7: =RC[17]+RC[7]+RC[4]+RC[19]+RC[16]+RC[11]+RC[15]+RC[21]+RC[28]+RC[12]+RC[26]+RC[13]+RC[18]+RC[23]+RC[29]+RC[30]+RC[14]+RC[22]+RC[24] -> 34 | D7: =RC[-1]/RC[-2] -> 0.69387755102040816 | E7: =RC[8]+RC[7]+RC[6]+RC[25]+RC[23] -> 15 | F7: =RC[-1]/RC[-4] -> 0.30612244897959184 | G7: 13 | H7: 6 | I7: 9 | K7: 4 | L7: 4 | M7: 4 | N7: 8 | O7: 4 | P7: 1 | Q7: 1 | R7: 1 | S7: 2 | U7: 1 | X7: 1 | Y7: 1 | Z7: 1 | AB7: 2 | AD7: 1 | AH7: 2001-12-28T00:00:00.000 | AI7: =RC[-33]+RC[-27]+RC[-12]+RC[-26] -> 64 | AJ7: =RC[-28]/RC[-1] -> 9.375E-2 | AK7: =RC[-28]/RC[-2] -> 0.140625
A8: 2002-01-25T00:00:00.000 | B8: =RC[1]+RC[3] -> 51 | C8: =RC[17]+RC[7]+RC[4]+RC[19]+RC[16]+RC[11]+RC[15]+RC[21]+RC[28]+RC[12]+RC[26]+RC[13]+RC[18]+RC[23]+RC[29]+RC[30]+RC[14]+RC[22]+RC[24] -> 37 | D8: =RC[-1]/RC[-2] -> 0.72549019607843135 | E8: =RC[8]+RC[7]+RC[6]+RC[25]+RC[23] -> 14 | F8: =RC[-1]/RC[-4] -> 0.27450980392156865 | G8: 16 | H8: 7 | I8: 2 | J8: 2 | K8: 4 | L8: 6 | M8: 1 | N8: 2 | O8: 1 | P8: 1 | Q8: 2 | R8: 1 | S8: 2 | T8: 2 | U8: 3 | X8: 2 | Y8: 1 | Z8: 1 | AA8: 1 | AB8: 1 | AD8: 2 | AH8: 2002-01-25T00:00:00.000 | AI8: =RC[-33]+RC[-27]+RC[-12]+RC[-26] -> 60 | AJ8: =RC[-28]/RC[-1] -> 0.11666666666666667 | AK8: =RC[-28]/RC[-2] -> 3.3333333333333333E-2
A9: 2002-02-22T00:00:00.000 | B9: =RC[1]+RC[3] -> 38 | C9: =RC[17]+RC[7]+RC[4]+RC[19]+RC[16]+RC[11]+RC[15]+RC[21]+RC[28]+RC[12]+RC[26]+RC[13]+RC[18]+RC[23]+RC[29]+RC[30]+RC[14]+RC[22]+RC[24] -> 24 | D9: =RC[-1]/RC[-2] -> 0.63157894736842102 | E9: =RC[8]+RC[7]+RC[6]+RC[25]+RC[23] -> 14 | F9: =RC[-1]/RC[-4] -> 0.36842105263157893 | G9: 6 | H9: 6 | I9: 7 | J9: 3 | K9: 5 | L9: 7 | M9: 2 | N9: 4 | O9: 1 | P9: 3 | Q9: 3 | R9: 1 | S9: 2 | W9: 1 | Z9: 1 | AH9: 2002-02-22T00:00:00.000 | AI9: =RC[-33]+RC[-27]+RC[-12]+RC[-26] -> 52 | AJ9: =RC[-28]/RC[-1] -> 0.11538461538461539 | AK9: =RC[-28]/RC[-2] -> 0.13461538461538461
A10: 2002-03-29T00:00:00.000 | B10: =RC[1]+RC[3] -> 70 | C10: =RC[17]+RC[7]+RC[4]+RC[19]+RC[16]+RC[11]+RC[15]+RC[21]+RC[28]+RC[12]+RC[26]+RC[13]+RC[18]+RC[23]+RC[29]+RC[30]+RC[14]+RC[22]+RC[24] -> 52 | D10: =RC[-1]/RC[-2] -> 0.74285714285714288 | E10: =RC[8]+RC[7]+RC[6]+RC[25]+RC[23] -> 18 | F10: =RC[-1]/RC[-4] -> 0.25714285714285712 | G10: 17 | H10: 17 | I10: 17 | J10: 9 | K10: 6 | L10: 5 | M10: 6 | N10: 7 | O10: 3 | P10: 1 | Q10: 3 | R10: 2 | S10: 3 | T10: 3 | U10: 2 | W10: 2 | AA10: 1 | AB10: 1 | AC10: 1 | AH10: 2002-03-29T00:00:00.000 | AI10: =RC[-33]+RC[-27]+RC[-12]+RC[-26] -> 106 | AJ10: =RC[-28]/RC[-1] -> 0.16037735849056603 | AK10: =RC[-28]/RC[-2] -> 0.16037735849056603
A11: 2002-04-26T00:00:00.000 | B11: =RC[1]+RC[3] -> 45 | C11: =RC[17]+RC[7]+RC[4]+RC[19]+RC[16]+RC[11]+RC[15]+RC[21]+RC[28]+RC[12]+RC[26]+RC[13]+RC[18]+RC[23]+RC[29]+RC[30]+RC[14]+RC[22]+RC[24] -> 30 | D11: =RC[-1]/RC[-2] -> 0.66666666666666663 | E11: =RC[8]+RC[7]+RC[6]+RC[25]+RC[23] -> 15 | F11: =RC[-1]/RC[-4] -> 0.33333333333333331 | G11: 7 | H11: 8 | I11: 5 | J11: 4 | K11: 3 | L11: 4 | M11: 8 | N11: 1 | O11: 7 | P11: 5 | Q11: 1 | R11: 3 | V11: 1 | W11: 1 | AA11: 1 | AH11: 2002-04-26T00:00:00.000 | AI11: =RC[-33]+RC[-27]+RC[-12]+RC[-26] -> 59 | AJ11: =RC[-28]/RC[-1] -> 0.13559322033898305 | AK11: =RC[-28]/RC[-2] -> 8.4745762711864403E-2
A12: 2002-05-31T00:00:00.000 | B12: =RC[1]+RC[3] -> 73 | C12: =RC[17]+RC[7]+RC[4]+RC[19]+RC[16]+RC[11]+RC[15]+RC[21]+RC[28]+RC[12]+RC[26]+RC[13]+RC[18]+RC[23]+RC[29]+RC[30]+RC[14]+RC[22]+RC[24] -> 52 | D12: =RC[-1]/RC[-2] -> 0.71232876712328763 | E12: =RC[8]+RC[7]+RC[6]+RC[25]+RC[23] -> 21 | F12: =RC[-1]/RC[-4] -> 0.28767123287671231 | G12: 11 | H12: 11 | I12: 10 | J12: 12 | K12: 9 | L12: 4 | M12: 8 | N12: 5 | O12: 3 | P12: 2 | Q12: 1 | R12: 2 | S12: 1 | T12: 2 | U12: 1 | V12: 4 | W12: 1 | X12: 2 | Y12: 2 | Z12: 1 | AC12: 1 | AE12: 2 | AH12: 2002-05-31T00:00:00.000 | AI12: =RC[-33]+RC[-27]+RC[-12]+RC[-26] -> 95 | AJ12: =RC[-28]/RC[-1] -> 0.11578947368421053 | AK12: =RC[-28]/RC[-2] -> 0.10526315789473684
Y13: 0 | Z13: 0 | AA13: 0 | AF13: 0 | AG13: 0
A14: Grand Total | B14: =SUM(R[-12]C:R[-1]C) -> 608 | C14: =SUM(R[-12]C:R[-1]C) -> 419 | D14: =RC[-1]/RC[-2] -> 0.68914473684210531 | E14: =SUM(R[-12]C:R[-1]C) -> 189 | F14: =RC[-1]/RC[-4] -> 0.31085526315789475 | G14: =SUM(R[-6]C:R[-1]C) -> 57 | H14: =SUM(R[-6]C:R[-1]C) -> 49 | I14: =SUM(R[-6]C:R[-1]C) -> 41 | J14: =SUM(R[-6]C:R[-1]C) -> 30 | K14: =SUM(R[-6]C:R[-1]C) -> 27 | L14: =SUM(R[-6]C:R[-1]C) -> 26 | M14: =SUM(R[-6]C:R[-1]C) -> 25 | N14: =SUM(R[-6]C:R[-1]C) -> 19 | O14: =SUM(R[-6]C:R[-1]C) -> 15 | P14: =SUM(R[-6]C:R[-1]C) -> 12 | Q14: =SUM(R[-6]C:R[-1]C) -> 10 | R14: =SUM(R[-6]C:R[-1]C) -> 9 | S14: =SUM(R[-6]C:R[-1]C) -> 8 | T14: =SUM(R[-6]C:R[-1]C) -> 7 | U14: =SUM(R[-6]C:R[-1]C) -> 6 | V14: =SUM(R[-6]C:R[-1]C) -> 5 | W14: =SUM(R[-6]C:R[-1]C) -> 5 | X14: =SUM(R[-6]C:R[-1]C) -> 4 | Y14: =SUM(R[-6]C:R[-1]C) -> 3 | Z14: =SUM(R[-6]C:R[-1]C) -> 3 | AA14: =SUM(R[-6]C:R[-1]C) -> 3 | AB14: =SUM(R[-6]C:R[-1]C) -> 2 | AC14: =SUM(R[-6]C:R[-1]C) -> 2 | AD14: =SUM(R[-6]C:R[-1]C) -> 2 | AE14: =SUM(R[-6]C:R[-1]C) -> 2 | AF14: =SUM(R[-6]C:R[-1]C) -> 0 | AG14: =SUM(R[-6]C:R[-1]C) -> 0 | AH14: Grand Total | AI14: =SUM(R[-12]C:R[-1]C) -> 802 | AJ14: =RC[-28]/RC[-1] -> 6.1097256857855359E-2 | AK14: =RC[-28]/RC[-2] -> 5.1122194513715712E-2

Sheet: Pareto (2)
A1: Month | B1: Total DR's Productive & Non-Productive | C1: Total Non-Productive DR's | D1: Non-Productive % | E1: Productive DR's | F1: Productive % | G1: Design Review | H1: Marketing Requirement Change | I1: Documentation | J1: Initial Release | K1: Obsolete Part | L1: Cost Reduction | M1: Fix Supplier Problem | N1: DFM Improvement | O1: DQT | P1: Reliability | Q1: Secondary DR | R1: Logic / Concept Error | S1: Certifications | T1: Mfg Process Mismatch | U1: Planned Process Change Notice | V1: Mfg Process Failure | W1: ACT | X1: FBOM Error | Y1: Spare Part Req | Z1: Tolerance Analysis | AA1: Service Other | AB1: Requirement Error | AC1: Process Escape Other | AD1: Technology Upgrade | AE1: Mfg Process Change Notice | AF1: Signal Quality Verification | AG1: Tool Failure | AH1: Month | AI1: Total Activity | AJ1: Marketing Requirements Change % | AK1: Initial Release %
A2: 2001-07-01T00:00:00.000 | B2: =RC[1]+RC[3] -> 71 | C2: =RC[16]+RC[4]+RC[6]+RC[12]+RC[21]+RC[10]+RC[15]+RC[17]+RC[19]+RC[13]+RC[25]+RC[14]+RC[23]+RC[24]+RC[29]+RC[30]+RC[20]+RC[18]+RC[26] -> 39 | D2: =RC[-1]/RC[-2] -> 0.54929577464788737 | E2: =RC[7]+RC[9]+RC[6]+RC[26]+RC[25] -> 32 | F2: =RC[-1]/RC[-4] -> 0.45070422535211269 | G2: 1 | H2: 3 | I2: 17 | J2: 3 | K2: 1 | L2: 1 | M2: 5 | N2: 8 | P2: 5 | R2: 2 | S2: 5 | T2: 2 | U2: 0 | W2: 0 | X2: 2 | Y2: 2 | AA2: 0 | AC2: 0 | AE2: 22 | AF2: 0 | AG2: 0 | AH2: 2001-07-01T00:00:00.000 | AI2: =RC[-33]+RC[-27]+RC[-10]+RC[-25] -> 79 | AJ2: =RC[-28]/RC[-1] -> 3.7974683544303799E-2 | AK2: =RC[-27]/RC[-2] -> 3.7974683544303799E-2
A3: 2001-08-31T00:00:00.000 | B3: =RC[1]+RC[3] -> 58 | C3: =RC[16]+RC[4]+RC[6]+RC[12]+RC[21]+RC[10]+RC[15]+RC[17]+RC[19]+RC[13]+RC[25]+RC[14]+RC[23]+RC[24]+RC[29]+RC[30]+RC[20]+RC[18]+RC[26] -> 34 | D3: =RC[-1]/RC[-2] -> 0.58620689655172409 | E3: =RC[7]+RC[9]+RC[6]+RC[26]+RC[25] -> 24 | F3: =RC[-1]/RC[-4] -> 0.41379310344827586 | G3: 2 | H3: 6 | I3: 8 | J3: 5 | K3: 6 | L3: 4 | M3: 6 | N3: 5 | P3: 2 | Q3: 2 | R3: 1 | S3: 1 | T3: 4 | W3: 1 | X3: 2 | Y3: 1 | Z3: 1 | AA3: 3 | AC3: 1 | AD3: 3 | AE3: 6 | AH3: 2001-08-31T00:00:00.000 | AI3: =RC[-33]+RC[-27]+RC[-10]+RC[-25] -> 70 | AJ3: =RC[-28]/RC[-1] -> 8.5714285714285715E-2 | AK3: =RC[-27]/RC[-2] -> 7.1428571428571425E-2
A4: 2001-09-28T00:00:00.000 | B4: =RC[1]+RC[3] -> 35 | C4: =RC[16]+RC[4]+RC[6]+RC[12]+RC[21]+RC[10]+RC[15]+RC[17]+RC[19]+RC[13]+RC[25]+RC[14]+RC[23]+RC[24]+RC[29]+RC[30]+RC[20]+RC[18]+RC[26] -> 29 | D4: =RC[-1]/RC[-2] -> 0.82857142857142863 | E4: =RC[7]+RC[9]+RC[6]+RC[26]+RC[25] -> 6 | F4: =RC[-1]/RC[-4] -> 0.17142857142857143 | H4: 6 | I4: 10 | J4: 6 | K4: 3 | L4: 1 | M4: 6 | P4: 1 | Q4: 3 | R4: 2 | T4: 3 | X4: 1 | Y4: 1 | Z4: 1 | AB4: 2 | AE4: 2 | AH4: 2001-09-28T00:00:00.000 | AI4: =RC[-33]+RC[-27]+RC[-10]+RC[-25] -> 48 | AJ4: =RC[-28]/RC[-1] -> 0.125 | AK4: =RC[-27]/RC[-2] -> 0.125
A5: 2001-10-26T00:00:00.000 | B5: =RC[1]+RC[3] -> 45 | C5: =RC[16]+RC[4]+RC[6]+RC[12]+RC[21]+RC[10]+RC[15]+RC[17]+RC[19]+RC[13]+RC[25]+RC[14]+RC[23]+RC[24]+RC[29]+RC[30]+RC[20]+RC[18]+RC[26] -> 34 | D5: =RC[-1]/RC[-2] -> 0.75555555555555554 | E5: =RC[7]+RC[9]+RC[6]+RC[26]+RC[25] -> 11 | F5: =RC[-1]/RC[-4] -> 0.24444444444444444 | G5: 2 | H5: 8 | I5: 12 | J5: 10 | K5: 1 | L5: 2 | M5: 4 | N5: 4 | O5: 1 | P5: 1 | Q5: 1 | R5: 5 | S5: 2 | T5: 1 | V5: 1 | X5: 4 | Y5: 1 | AD5: 3 | AE5: 1 | AH5: 2001-10-26T00:00:00.000 | AI5: =RC[-33]+RC[-27]+RC[-10]+RC[-25] -> 64 | AJ5: =RC[-28]/RC[-1] -> 0.125 | AK5: =RC[-27]/RC[-2] -> 0.15625
A6: 2001-11-30T00:00:00.000 | B6: =RC[1]+RC[3] -> 73 | C6: =RC[16]+RC[4]+RC[6]+RC[12]+RC[21]+RC[10]+RC[15]+RC[17]+RC[19]+RC[13]+RC[25]+RC[14]+RC[23]+RC[24]+RC[29]+RC[30]+RC[20]+RC[18]+RC[26] -> 54 | D6: =RC[-1]/RC[-2] -> 0.73972602739726023 | E6: =RC[7]+RC[9]+RC[6]+RC[26]+RC[25] -> 19 | F6: =RC[-1]/RC[-4] -> 0.26027397260273971 | G6: 1 | H6: 20 | I6: 15 | J6: 11 | K6: 7 | L6: 3 | M6: 10 | N6: 3 | O6: 1 | P6: 5 | Q6: 3 | R6: 3 | T6: 1 | W6: 2 | X6: 3 | Y6: 1 | Z6: 1 | AA6: 4 | AB6: 1 | AC6: 4 | AD6: 4 | AE6: 2 | AH6: 2001-11-30T00:00:00.000 | AI6: =RC[-33]+RC[-27]+RC[-10]+RC[-25] -> 105 | AJ6: =RC[-28]/RC[-1] -> 0.19047619047619047 | AK6: =RC[-27]/RC[-2] -> 0.10476190476190476
A7: 2001-12-28T00:00:00.000 | B7: =RC[1]+RC[3] -> 49 | C7: =RC[16]+RC[4]+RC[6]+RC[12]+RC[21]+RC[10]+RC[15]+RC[17]+RC[19]+RC[13]+RC[25]+RC[14]+RC[23]+RC[24]+RC[29]+RC[30]+RC[20]+RC[18]+RC[26] -> 34 | D7: =RC[-1]/RC[-2] -> 0.69387755102040816 | E7: =RC[7]+RC[9]+RC[6]+RC[26]+RC[25] -> 15 | F7: =RC[-1]/RC[-4] -> 0.30612244897959184 | H7: 6 | I7: 13 | J7: 9 | K7: 4 | L7: 4 | M7: 8 | N7: 4 | P7: 4 | Q7: 1 | R7: 1 | T7: 1 | U7: 1 | W7: 1 | X7: 2 | Z7: 1 | AA7: 1 | AD7: 2 | AE7: 1 | AH7: 2001-12-28T00:00:00.000 | AI7: =RC[-33]+RC[-27]+RC[-10]+RC[-25] -> 64 | AJ7: =RC[-28]/RC[-1] -> 9.375E-2 | AK7: =RC[-27]/RC[-2] -> 0.140625
A8: 2002-01-25T00:00:00.000 | B8: =RC[1]+RC[3] -> 51 | C8: =RC[16]+RC[4]+RC[6]+RC[12]+RC[21]+RC[10]+RC[15]+RC[17]+RC[19]+RC[13]+RC[25]+RC[14]+RC[23]+RC[24]+RC[29]+RC[30]+RC[20]+RC[18]+RC[26] -> 37 | D8: =RC[-1]/RC[-2] -> 0.72549019607843135 | E8: =RC[7]+RC[9]+RC[6]+RC[26]+RC[25] -> 14 | F8: =RC[-1]/RC[-4] -> 0.27450980392156865 | G8: 2 | H8: 7 | I8: 16 | J8: 2 | K8: 4 | L8: 1 | M8: 2 | N8: 6 | P8: 1 | Q8: 1 | R8: 1 | S8: 2 | T8: 2 | U8: 1 | W8: 2 | X8: 2 | Z8: 3 | AA8: 1 | AC8: 1 | AD8: 1 | AE8: 2 | AH8: 2002-01-25T00:00:00.000 | AI8: =RC[-33]+RC[-27]+RC[-10]+RC[-25] -> 60 | AJ8: =RC[-28]/RC[-1] -> 0.11666666666666667 | AK8: =RC[-27]/RC[-2] -> 3.3333333333333333E-2
A9: 2002-02-22T00:00:00.000 | B9: =RC[1]+RC[3] -> 38 | C9: =RC[16]+RC[4]+RC[6]+RC[12]+RC[21]+RC[10]+RC[15]+RC[17]+RC[19]+RC[13]+RC[25]+RC[14]+RC[23]+RC[24]+RC[29]+RC[30]+RC[20]+RC[18]+RC[26] -> 24 | D9: =RC[-1]/RC[-2] -> 0.63157894736842102 | E9: =RC[7]+RC[9]+RC[6]+RC[26]+RC[25] -> 14 | F9: =RC[-1]/RC[-4] -> 0.36842105263157893 | G9: 3 | H9: 6 | I9: 6 | J9: 7 | K9: 5 | L9: 2 | M9: 4 | N9: 7 | P9: 1 | Q9: 3 | R9: 1 | W9: 3 | X9: 2 | Y9: 1 | AA9: 1 | AH9: 2002-02-22T00:00:00.000 | AI9: =RC[-33]+RC[-27]+RC[-10]+RC[-25] -> 52 | AJ9: =RC[-28]/RC[-1] -> 0.11538461538461539 | AK9: =RC[-27]/RC[-2] -> 0.13461538461538461
A10: 2002-03-29T00:00:00.000 | B10: =RC[1]+RC[3] -> 70 | C10: =RC[16]+RC[4]+RC[6]+RC[12]+RC[21]+RC[10]+RC[15]+RC[17]+RC[19]+RC[13]+RC[25]+RC[14]+RC[23]+RC[24]+RC[29]+RC[30]+RC[20]+RC[18]+RC[26] -> 52 | D10: =RC[-1]/RC[-2] -> 0.74285714285714288 | E10: =RC[7]+RC[9]+RC[6]+RC[26]+RC[25] -> 18 | F10: =RC[-1]/RC[-4] -> 0.25714285714285712 | G10: 9 | H10: 17 | I10: 17 | J10: 17 | K10: 6 | L10: 6 | M10: 7 | N10: 5 | P10: 3 | Q10: 1 | R10: 2 | S10: 3 | W10: 3 | X10: 3 | Y10: 2 | Z10: 2 | AB10: 1 | AC10: 1 | AD10: 1 | AH10: 2002-03-29T00:00:00.000 | AI10: =RC[-33]+RC[-27]+RC[-10]+RC[-25] -> 106 | AJ10: =RC[-28]/RC[-1] -> 0.16037735849056603 | AK10: =RC[-27]/RC[-2] -> 0.16037735849056603
A11: 2002-04-26T00:00:00.000 | B11: =RC[1]+RC[3] -> 45 | C11: =RC[16]+RC[4]+RC[6]+RC[12]+RC[21]+RC[10]+RC[15]+RC[17]+RC[19]+RC[13]+RC[25]+RC[14]+RC[23]+RC[24]+RC[29]+RC[30]+RC[20]+RC[18]+RC[26] -> 30 | D11: =RC[-1]/RC[-2] -> 0.66666666666666663 | E11: =RC[7]+RC[9]+RC[6]+RC[26]+RC[25] -> 15 | F11: =RC[-1]/RC[-4] -> 0.33333333333333331 | G11: 4 | H11: 8 | I11: 7 | J11: 5 | K11: 3 | L11: 8 | M11: 1 | N11: 4 | O11: 1 | P11: 7 | Q11: 5 | R11: 3 | W11: 1 | Y11: 1 | AC11: 1 | AH11: 2002-04-26T00:00:00.000 | AI11: =RC[-33]+RC[-27]+RC[-10]+RC[-25] -> 59 | AJ11: =RC[-28]/RC[-1] -> 0.13559322033898305 | AK11: =RC[-27]/RC[-2] -> 8.4745762711864403E-2
A12: 2002-05-31T00:00:00.000 | B12: =RC[1]+RC[3] -> 73 | C12: =RC[16]+RC[4]+RC[6]+RC[12]+RC[21]+RC[10]+RC[15]+RC[17]+RC[19]+RC[13]+RC[25]+RC[14]+RC[23]+RC[24]+RC[29]+RC[30]+RC[20]+RC[18]+RC[26] -> 52 | D12: =RC[-1]/RC[-2] -> 0.71232876712328763 | E12: =RC[7]+RC[9]+RC[6]+RC[26]+RC[25] -> 21 | F12: =RC[-1]/RC[-4] -> 0.28767123287671231 | G12: 12 | H12: 11 | I12: 11 | J12: 10 | K12: 9 | L12: 8 | M12: 5 | N12: 4 | O12: 4 | P12: 3 | Q12: 2 | R12: 2 | S12: 2 | T12: 2 | U12: 2 | V12: 2 | W12: 1 | X12: 1 | Y12: 1 | Z12: 1 | AA12: 1 | AB12: 1 | AH12: 2002-05-31T00:00:00.000 | AI12: =RC[-33]+RC[-27]+RC[-10]+RC[-25] -> 95 | AJ12: =RC[-28]/RC[-1] -> 0.11578947368421053 | AK12: =RC[-27]/RC[-2] -> 0.10526315789473684
U13: 0 | AA13: 0 | AC13: 0 | AF13: 0 | AG13: 0
A14: Grand Total | B14: =SUM(R[-12]C:R[-1]C) -> 608 | C14: =SUM(R[-12]C:R[-1]C) -> 419 | D14: =RC[-1]/RC[-2] -> 0.68914473684210531 | E14: =SUM(R[-12]C:R[-1]C) -> 189 | F14: =RC[-1]/RC[-4] -> 0.31085526315789475 | G14: =SUM(R[-6]C:R[-1]C) -> 30 | H14: =SUM(R[-6]C:R[-1]C) -> 49 | I14: =SUM(R[-6]C:R[-1]C) -> 57 | J14: =SUM(R[-6]C:R[-1]C) -> 41 | K14: =SUM(R[-6]C:R[-1]C) -> 27 | L14: =SUM(R[-6]C:R[-1]C) -> 25 | M14: =SUM(R[-6]C:R[-1]C) -> 19 | N14: =SUM(R[-6]C:R[-1]C) -> 26 | O14: =SUM(R[-6]C:R[-1]C) -> 5 | P14: =SUM(R[-6]C:R[-1]C) -> 15 | Q14: =SUM(R[-6]C:R[-1]C) -> 12 | R14: =SUM(R[-6]C:R[-1]C) -> 9 | S14: =SUM(R[-6]C:R[-1]C) -> 7 | T14: =SUM(R[-6]C:R[-1]C) -> 4 | U14: =SUM(R[-6]C:R[-1]C) -> 3 | V14: =SUM(R[-6]C:R[-1]C) -> 2 | W14: =SUM(R[-6]C:R[-1]C) -> 10 | X14: =SUM(R[-6]C:R[-1]C) -> 8 | Y14: =SUM(R[-6]C:R[-1]C) -> 5 | Z14: =SUM(R[-6]C:R[-1]C) -> 6 | AA14: =SUM(R[-6]C:R[-1]C) -> 3 | AB14: =SUM(R[-6]C:R[-1]C) -> 2 | AC14: =SUM(R[-6]C:R[-1]C) -> 3 | AD14: =SUM(R[-6]C:R[-1]C) -> 2 | AE14: =SUM(R[-6]C:R[-1]C) -> 2 | AF14: =SUM(R[-6]C:R[-1]C) -> 0 | AG14: =SUM(R[-6]C:R[-1]C) -> 0 | AH14: Grand Total | AI14: =SUM(R[-12]C:R[-1]C) -> 802 | AJ14: =RC[-28]/RC[-1] -> 6.1097256857855359E-2 | AK14: =RC[-27]/RC[-2] -> 5.1122194513715712E-2
A15: Previous 3 months | G15: =SUM(R[-6]C:R[-4]C)/3 -> 5.333333333333333 | H15: =SUM(R[-6]C:R[-4]C)/3 -> 10.333333333333334 | I15: =SUM(R[-6]C:R[-4]C)/3 -> 10 | J15: =SUM(R[-6]C:R[-4]C)/3 -> 9.6666666666666661 | K15: =SUM(R[-6]C:R[-4]C)/3 -> 4.666666666666667 | L15: =SUM(R[-6]C:R[-4]C)/3 -> 5.333333333333333 | M15: =SUM(R[-6]C:R[-4]C)/3 -> 4 | N15: =SUM(R[-6]C:R[-4]C)/3 -> 5.333333333333333 | O15: =SUM(R[-6]C:R[-4]C)/3 -> 0.33333333333333331 | P15: =SUM(R[-6]C:R[-4]C)/3 -> 3.6666666666666665 | Q15: =SUM(R[-6]C:R[-4]C)/3 -> 3 | R15: =SUM(R[-6]C:R[-4]C)/3 -> 2 | S15: =SUM(R[-6]C:R[-4]C)/3 -> 1 | T15: =SUM(R[-6]C:R[-4]C)/3 -> 0 | U15: =SUM(R[-6]C:R[-4]C)/3 -> 0 | V15: =SUM(R[-6]C:R[-4]C)/3 -> 0 | W15: =SUM(R[-6]C:R[-4]C)/3 -> 2.3333333333333335 | X15: =SUM(R[-6]C:R[-4]C)/3 -> 1.6666666666666667 | Y15: =SUM(R[-6]C:R[-4]C)/3 -> 1.3333333333333333 | Z15: =SUM(R[-6]C:R[-4]C)/3 -> 0.66666666666666663 | AA15: =SUM(R[-6]C:R[-4]C)/3 -> 0.33333333333333331 | AB15: =SUM(R[-6]C:R[-4]C)/3 -> 0.33333333333333331 | AC15: =SUM(R[-6]C:R[-4]C)/3 -> 0.66666666666666663 | AD15: =SUM(R[-6]C:R[-4]C)/3 -> 0.33333333333333331 | AE15: =SUM(R[-6]C:R[-4]C)/3 -> 0 | AF15: =SUM(R[-6]C:R[-4]C)/3 -> 0 | AG15: =SUM(R[-6]C:R[-4]C)/3 -> 0