Sheet: Forecast
A1: hhhh | M1: 232.5 | N1: 4715 | O1: 5290.3 | P1: 291.39999999999998 | Q1: 41948.65 | R1: 26661.200000000001 | S1: 19416.88 | T1: 19416.88 | U1: $0 | V1: 8114.75 | W1: 50000 | X1: 5760.45 | Y1: 18648.25 | Z1: 232.5 | AA1: 4715 | AB1: 5290.3 | AC1: 291.39999999999998 | AD1: 41948.65 | AE1: 26661.200000000001 | AF1: 19416.88
A2: iiiii | M2: =SUM(R[-1]C)*0.8 -> 186 | N2: =SUM(R[-1]C)*0.8 -> 3772 | O2: =SUM(R[-1]C)*0.8 -> 4232.2400000000007 | P2: =SUM(R[-1]C)*0.8 -> 233.12 | Q2: =SUM(R[-1]C)*0.8 -> 33558.920000000006 | R2: =SUM(R[-1]C)*0.8 -> 21328.960000000003 | S2: =SUM(R[-1]C)*0.8 -> 15533.504000000001 | T2: =SUM(R[-1]C)*0.8 -> 15533.504000000001 | U2: =SUM(R[-1]C)*0.8 -> 0 | V2: =SUM(R[-1]C)*0.8 -> 6491.8 | W2: =SUM(R[-1]C)*0.8 -> 40000 | X2: =SUM(R[-1]C)*0.8 -> 4608.3599999999997 | Y2: =SUM(R[-1]C)*0.8 -> 14918.6 | Z2: =SUM(R[-1]C)*0.8 -> 186 | AA2: =SUM(R[-1]C)*0.8 -> 3772 | AB2: =SUM(R[-1]C)*0.8 -> 4232.2400000000007 | AC2: =SUM(R[-1]C)*0.8 -> 233.12 | AD2: =SUM(R[-1]C)*0.8 -> 33558.920000000006 | AE2: =SUM(R[-1]C)*0.8 -> 21328.960000000003 | AF2: =SUM(R[-1]C)*0.8 -> 15533.504000000001