Sheet: reporting
A1: =CONCATENATE("Etude du portefeuille '", data!R[1]C[1], "'") -> Etude du portefeuille 'Fonds JUMP LS'
A3: Répartition par pays | I3: La répartition pour les 10ers pays
I5: =data!RC[-8] -> France | L5: =data!RC[-10] -> 0.41088389480630511
I6: =data!RC[-8] -> Allemagne République Fédérale | L6: =data!RC[-10] -> 0.18177048342557725
I7: =data!RC[-8] -> Pays-Bas | L7: =data!RC[-10] -> 0.13138277454772884
I8: =data!RC[-8] -> Espagne | L8: =data!RC[-10] -> 8.0417370209374256E-2
I9: =data!RC[-8] -> Royaume-Uni | L9: =data!RC[-10] -> 6.9719813813536369E-2
I10: =data!RC[-8] -> Suisse | L10: =data!RC[-10] -> 4.1461766391471803E-2
I11: =data!RC[-8] -> Belgique | L11: =data!RC[-10] -> 3.2087439661406057E-2
I12: =data!RC[-8] -> Suède | L12: =data!RC[-10] -> 2.0750001469386305E-2
I13: =data!RC[-8] -> Brésil | L13: =data!RC[-10] -> 1.4532355441268362E-2
I14: =data!RC[-8] -> Finlande | L14: =data!RC[-10] -> 9.1490098183828524E-3
A16: Répartition par devise | I16: Les 10ères positions
I18: =data!R[14]C[-8] -> EURONEXT NV | L18: =data!R[14]C[-9] -> 9.8712670214795906E-2
I19: =data!R[14]C[-8] -> VOLKSWAGEN AG (XETR) | L19: =data!R[14]C[-9] -> 5.3483903908099692E-2
I20: =data!R[14]C[-8] -> ALTADIS | L20: =data!R[14]C[-9] -> 4.9391381741314404E-2
I21: =data!R[14]C[-8] -> CASINO GUICHARD | L21: =data!R[14]C[-9] -> 4.909071995865303E-2
I22: =data!R[14]C[-8] -> SUEZ SA | L22: =data!R[14]C[-9] -> 4.7644083978508174E-2
I23: =data!R[14]C[-8] -> CL-FR DYN OR | L23: =data!R[14]C[-9] -> 4.724754865339327E-2
I24: =data!R[14]C[-8] -> GEA GROUP AG (XETR) | L24: =data!R[14]C[-9] -> 4.6599837068443291E-2
I25: =data!R[14]C[-8] -> ACCOR SA | L25: =data!R[14]C[-9] -> 4.5232176305996838E-2
I26: =data!R[14]C[-8] -> RECKITT BENCKISE | L26: =data!R[14]C[-9] -> 4.4267305588575098E-2
I27: =data!R[14]C[-8] -> L'OREAL | L27: =data!R[14]C[-9] -> 3.2544867270811483E-2
A29: Performances mensuelles passées
B31: =data!R[-3]C[-1] -> 2007-04-01T00:00:00.000 | C31: =data!R[-3]C[-1] -> 2007-05-01T00:00:00.000 | D31: =data!R[-3]C[-1] -> 2007-06-01T00:00:00.000 | E31: =data!R[-3]C[-1] -> 2007-07-01T00:00:00.000 | F31: =data!R[-3]C[-1] -> 2007-08-01T00:00:00.000 | G31: =data!R[-3]C[-1] -> 2007-09-01T00:00:00.000 | H31: =data!R[-3]C[-1] -> 2007-10-01T00:00:00.000 | I31: =data!R[-3]C[-1] -> 2007-11-01T00:00:00.000 | J31: =data!R[-3]C[-1] -> 2007-12-01T00:00:00.000 | K31: =data!R[-3]C[-1] -> 2008-01-01T00:00:00.000 | L31: =data!R[-3]C[-1] -> 2008-02-01T00:00:00.000 | M31: =data!R[-3]C[-1] -> 2008-03-01T00:00:00.000 | N31: =data!R[-3]C[-1] -> 2008-04-01T00:00:00.000
B32: =data!R[-3]C[-1] -> 1.31262936342279E-2 | C32: =data!R[-3]C[-1] -> 4.8359567608572088E-2 | D32: =data!R[-3]C[-1] -> -4.0364754637547809E-2 | E32: =data!R[-3]C[-1] -> -7.6319329603194278E-2 | F32: =data!R[-3]C[-1] -> -2.1335807050092765E-2 | G32: =data!R[-3]C[-1] -> -5.4976303317535544E-2 | H32: =data!R[-3]C[-1] -> 8.826479438314945E-2 | I32: =data!R[-3]C[-1] -> 2.7649769585253456E-3 | J32: =data!R[-3]C[-1] -> -7.8125E-2 | K32: =data!R[-3]C[-1] -> -6.7661691542288557E-2 | L32: =data!R[-3]C[-1] -> -0.12700106723585913 | M32: =data!R[-3]C[-1] -> 1.4669926650366748E-2 | N32: =data!R[-3]C[-1] -> 6.1445783132530123E-2
K34: Le meilleur rendement mensuel : | N34: =MAX(data!R[-5]C[-13]:R[-5]C[-1]) -> 8.826479438314945E-2
K35: Rendement mensuel moyen : | N35: =AVERAGE(data!R[-6]C[-13]:R[-6]C[-1]) -> -1.8242508539934334E-2

Sheet: data
A2: Nom du fonds : | B2: Fonds JUMP LS
A4: Répartition par pays
A5: France | B5: 0.41088389480630511
A6: Allemagne République Fédérale | B6: 0.18177048342557725
A7: Pays-Bas | B7: 0.13138277454772884
A8: Espagne | B8: 8.0417370209374256E-2
A9: Royaume-Uni | B9: 6.9719813813536369E-2
A10: Suisse | B10: 4.1461766391471803E-2
A11: Belgique | B11: 3.2087439661406057E-2
A12: Suède | B12: 2.0750001469386305E-2
A13: Brésil | B13: 1.4532355441268362E-2
A14: Finlande | B14: 9.1490098183828524E-3
A15: Italie | B15: 7.8450904155628436E-3
A18: Répartition par devise
A19: GBp (p) | B19: 5.6467138996239626E-2
A20: GBP (₤) | B20: 1.4585128837214177E-2
A21: EUR (€) | B21: 0.7938550944527516
A22: USD ($) | B22: 1.0752134400647022E-5
A23: BRL (R$) | B23: 2.7091434792730937E-2
A24: CHF (S₣) | B24: 8.6614975261726943E-2
A27: Performances mensuelles
A28: 2007-04-01T00:00:00.000 | B28: 2007-05-01T00:00:00.000 | C28: 2007-06-01T00:00:00.000 | D28: 2007-07-01T00:00:00.000 | E28: 2007-08-01T00:00:00.000 | F28: 2007-09-01T00:00:00.000 | G28: 2007-10-01T00:00:00.000 | H28: 2007-11-01T00:00:00.000 | I28: 2007-12-01T00:00:00.000 | J28: 2008-01-01T00:00:00.000 | K28: 2008-02-01T00:00:00.000 | L28: 2008-03-01T00:00:00.000 | M28: 2008-04-01T00:00:00.000
A29: 1.31262936342279E-2 | B29: 4.8359567608572088E-2 | C29: -4.0364754637547809E-2 | D29: -7.6319329603194278E-2 | E29: -2.1335807050092765E-2 | F29: -5.4976303317535544E-2 | G29: 8.826479438314945E-2 | H29: 2.7649769585253456E-3 | I29: -7.8125E-2 | J29: -6.7661691542288557E-2 | K29: -0.12700106723585913 | L29: 1.4669926650366748E-2 | M29: 6.1445783132530123E-2
A31: Actif | B31: Montant | C31: % GAV
A32: EURONEXT NV | B32: 1509927.84 | C32: 9.8712670214795906E-2
A33: VOLKSWAGEN AG (XETR) | B33: 818100 | C33: 5.3483903908099692E-2
A34: ALTADIS | B34: 755500 | C34: 4.9391381741314404E-2
A35: CASINO GUICHARD | B35: 750901.02 | C35: 4.909071995865303E-2
A36: SUEZ SA | B36: 728773 | C36: 4.7644083978508174E-2
A37: CL-FR DYN OR | B37: 722707.52 | C37: 4.724754865339327E-2
A38: GEA GROUP AG (XETR) | B38: 712800 | C38: 4.6599837068443291E-2
A39: ACCOR SA | B39: 691880 | C39: 4.5232176305996838E-2
A40: RECKITT BENCKISE | B40: -677121.1533892689 | C40: 4.4267305588575098E-2
A41: L'OREAL | B41: -497812.5 | C41: 3.2544867270811483E-2
A42: SCHNEIDER ELECTR | B42: -403392.00000000006 | C42: 2.6372055940956061E-2
A43: PRAKTIKER BAU-UN (XETR) | B43: -394625 | C43: 2.5798906710345727E-2
A44: EDF | B44: 390313.2 | C44: 2.5517019536563861E-2
A45: DEUTSCHE BOERSE (XETR) | B45: 350250 | C45: 2.2897857650424052E-2
A46: ABB LTD-REG | B46: -345246.44 | C46: 2.2570746145426604E-2
A47: ALSTOM | B47: -320422.5 | C47: 2.0947862364005712E-2
A48: COLRUYT SA | B48: 295895.60000000003 | C48: 1.9344397796393478E-2
A49: HENNES & MAURI-B | B49: 285264.43199999997 | C49: 1.8649377178201487E-2
A50: MICHELIN-B | B50: -279576 | C50: 1.8277491650178314E-2
A51: SABMILLER PLC | B51: 273092.16860690486 | C51: 1.7853606287527513E-2
A52: BBVA | B52: -257744 | C52: 1.6850208200573581E-2
A53: CESP-PREF B | B53: 222289.6819 | C53: 1.4532355441268361E-2
A54: THALES SA | B54: -220662 | C54: 1.4425944510657736E-2
A55: BANCO POPULAR | B55: 216835.43999999997 | C55: 1.4175780267486266E-2
A56: TNT NV | B56: 195972.15 | C56: 1.28118269640187E-2
A57: DEXIA SA | B57: 194920 | C57: 1.2743041865012579E-2
A58: VINCI SA | B58: -187280 | C58: 1.2243571108555078E-2
A59: SAFRAN SA | B59: -187200 | C59: 1.2238341048278036E-2
A60: PPR | B60: -183468.79999999999 | C60: 1.1994411036956802E-2
A61: NEXANS SA | B61: 179560.99999999997 | C61: 1.1738935667573997E-2
A62: VALEO SA | B62: 163427.80000000002 | C62: 1.0684215561804346E-2
A63: JC DECAUX SA | B63: 156285.12 | C63: 1.0217257475059074E-2
A64: HEINEKEN NV | B64: 151640 | C64: 9.9135792551329135E-3
A65: NESTE OIL OYJ | B65: -139945 | C65: 9.1490098183828524E-3
A66: HENKEL KGAA-PFD (XETR) | B66: -139403 | C66: 9.1135761600058922E-3
A67: LINDE AG (XETR) | B67: -134270 | C67: 8.7780024174801928E-3
A68: NESTLE SA-REG | B68: -126807.34 | C68: 8.2901253971418235E-3
A69: HEIDELBERG DRUCK (XETR) | B69: 123410 | C69: 8.0680217348717553E-3
A70: ALITALIA | B70: -120000 | C70: 7.8450904155628436E-3
A71: CREDIT AGRICOLE | B71: 101950 | C71: 6.6650580655552658E-3
A72: TUI AG (XETR) | B72: -101036.00000000001 | C72: 6.6053046268900635E-3
A73: SODEXO | B73: 96486 | C73: 6.3078449486333047E-3
A74: BRITISH SKY BROA | B74: 92759.431308066472 | C74: 6.0642177125664358E-3
A75: EFG INTERNAT-REG | B75: -90708.557499999995 | C75: 5.9301402921065087E-3
A76: WESSANEN NV | B76: 87700 | C76: 5.7334535787071789E-3
A77: TOMTOM | B77: 64416 | C77: 4.2112445350741346E-3
A78: CIBA SPECIALTY-R | B78: 47285.01297617238 | C78: 3.0912933508261222E-3
A79: ERICSSON LM-B | B79: -32131.55 | C79: 2.100624291184819E-3
A80: SCHINDLER HLD-PC | B80: 24159.74 | C80: 1.5794612059707523E-3
A81: WOLSELEY PLC | B81: 23474.822752679029 | C81: 1.5346842248673235E-3
A82: CARREFOUR SA | B82: 22860 | C82: 1.4944897241647218E-3
A83: SAP AG (XETR) | B83: -6502 | C83: 4.250731490165801E-4