Sheet: Sheet1
A1: Numerator | B1: Denominator | C1: Double | D1: 1Digit | E1: 2Digit | F1: 3Digit | G1: Half | H1: Quarter | I1: Eight | J1: Sixteenth | K1: Tenth | L1: 100th | M1: Tika-1132
A2: 4051 | B2: 8750153 | C2: =RC[-2]/RC[-1] -> 4.6296333332685726E-4 | D2: =RC3 -> 4.6296333332685726E-4 | E2: =RC3 -> 4.6296333332685726E-4 | F2: =RC3 -> 4.6296333332685726E-4 | G2: =RC3 -> 4.6296333332685726E-4 | H2: =RC3 -> 4.6296333332685726E-4 | I2: =RC3 -> 4.6296333332685726E-4 | J2: =RC3 -> 4.6296333332685726E-4 | K2: =RC3 -> 4.6296333332685726E-4 | L2: =RC3 -> 4.6296333332685726E-4 | M2: =RC[-10] -> 4.6296333332685726E-4
A3: -105 | B3: 100 | C3: =RC[-2]/RC[-1] -> -1.05 | D3: =RC3 -> -1.05 | E3: =RC3 -> -1.05 | F3: =RC3 -> -1.05 | G3: =RC3 -> -1.05 | H3: =RC3 -> -1.05 | I3: =RC3 -> -1.05 | J3: =RC3 -> -1.05 | K3: =RC3 -> -1.05 | L3: =RC3 -> -1.05 | M3: =RC[-10] -> -1.05
A4: =R[-1]C+1 -> -104 | B4: 100 | C4: =RC[-2]/RC[-1] -> -1.04 | D4: =RC3 -> -1.04 | E4: =RC3 -> -1.04 | F4: =RC3 -> -1.04 | G4: =RC3 -> -1.04 | H4: =RC3 -> -1.04 | I4: =RC3 -> -1.04 | J4: =RC3 -> -1.04 | K4: =RC3 -> -1.04 | L4: =RC3 -> -1.04 | M4: =RC[-10] -> -1.04
A5: =R[-1]C+1 -> -103 | B5: 100 | C5: =RC[-2]/RC[-1] -> -1.03 | D5: =RC3 -> -1.03 | E5: =RC3 -> -1.03 | F5: =RC3 -> -1.03 | G5: =RC3 -> -1.03 | H5: =RC3 -> -1.03 | I5: =RC3 -> -1.03 | J5: =RC3 -> -1.03 | K5: =RC3 -> -1.03 | L5: =RC3 -> -1.03 | M5: =RC[-10] -> -1.03
A6: =R[-1]C+1 -> -102 | B6: 100 | C6: =RC[-2]/RC[-1] -> -1.02 | D6: =RC3 -> -1.02 | E6: =RC3 -> -1.02 | F6: =RC3 -> -1.02 | G6: =RC3 -> -1.02 | H6: =RC3 -> -1.02 | I6: =RC3 -> -1.02 | J6: =RC3 -> -1.02 | K6: =RC3 -> -1.02 | L6: =RC3 -> -1.02 | M6: =RC[-10] -> -1.02
A7: =R[-1]C+1 -> -101 | B7: 100 | C7: =RC[-2]/RC[-1] -> -1.01 | D7: =RC3 -> -1.01 | E7: =RC3 -> -1.01 | F7: =RC3 -> -1.01 | G7: =RC3 -> -1.01 | H7: =RC3 -> -1.01 | I7: =RC3 -> -1.01 | J7: =RC3 -> -1.01 | K7: =RC3 -> -1.01 | L7: =RC3 -> -1.01 | M7: =RC[-10] -> -1.01
A8: =R[-1]C+1 -> -100 | B8: 100 | C8: =RC[-2]/RC[-1] -> -1 | D8: =RC3 -> -1 | E8: =RC3 -> -1 | F8: =RC3 -> -1 | G8: =RC3 -> -1 | H8: =RC3 -> -1 | I8: =RC3 -> -1 | J8: =RC3 -> -1 | K8: =RC3 -> -1 | L8: =RC3 -> -1 | M8: =RC[-10] -> -1
A9: =R[-1]C+1 -> -99 | B9: 100 | C9: =RC[-2]/RC[-1] -> -0.99 | D9: =RC3 -> -0.99 | E9: =RC3 -> -0.99 | F9: =RC3 -> -0.99 | G9: =RC3 -> -0.99 | H9: =RC3 -> -0.99 | I9: =RC3 -> -0.99 | J9: =RC3 -> -0.99 | K9: =RC3 -> -0.99 | L9: =RC3 -> -0.99 | M9: =RC[-10] -> -0.99
A10: =R[-1]C+1 -> -98 | B10: 100 | C10: =RC[-2]/RC[-1] -> -0.98 | D10: =RC3 -> -0.98 | E10: =RC3 -> -0.98 | F10: =RC3 -> -0.98 | G10: =RC3 -> -0.98 | H10: =RC3 -> -0.98 | I10: =RC3 -> -0.98 | J10: =RC3 -> -0.98 | K10: =RC3 -> -0.98 | L10: =RC3 -> -0.98 | M10: =RC[-10] -> -0.98
A11: =R[-1]C+1 -> -97 | B11: 100 | C11: =RC[-2]/RC[-1] -> -0.97 | D11: =RC3 -> -0.97 | E11: =RC3 -> -0.97 | F11: =RC3 -> -0.97 | G11: =RC3 -> -0.97 | H11: =RC3 -> -0.97 | I11: =RC3 -> -0.97 | J11: =RC3 -> -0.97 | K11: =RC3 -> -0.97 | L11: =RC3 -> -0.97 | M11: =RC[-10] -> -0.97
A12: =R[-1]C+1 -> -96 | B12: 100 | C12: =RC[-2]/RC[-1] -> -0.96 | D12: =RC3 -> -0.96 | E12: =RC3 -> -0.96 | F12: =RC3 -> -0.96 | G12: =RC3 -> -0.96 | H12: =RC3 -> -0.96 | I12: =RC3 -> -0.96 | J12: =RC3 -> -0.96 | K12: =RC3 -> -0.96 | L12: =RC3 -> -0.96 | M12: =RC[-10] -> -0.96
A13: =R[-1]C+1 -> -95 | B13: 100 | C13: =RC[-2]/RC[-1] -> -0.95 | D13: =RC3 -> -0.95 | E13: =RC3 -> -0.95 | F13: =RC3 -> -0.95 | G13: =RC3 -> -0.95 | H13: =RC3 -> -0.95 | I13: =RC3 -> -0.95 | J13: =RC3 -> -0.95 | K13: =RC3 -> -0.95 | L13: =RC3 -> -0.95 | M13: =RC[-10] -> -0.95
A14: =R[-1]C+1 -> -94 | B14: 100 | C14: =RC[-2]/RC[-1] -> -0.94 | D14: =RC3 -> -0.94 | E14: =RC3 -> -0.94 | F14: =RC3 -> -0.94 | G14: =RC3 -> -0.94 | H14: =RC3 -> -0.94 | I14: =RC3 -> -0.94 | J14: =RC3 -> -0.94 | K14: =RC3 -> -0.94 | L14: =RC3 -> -0.94 | M14: =RC[-10] -> -0.94
A15: =R[-1]C+1 -> -93 | B15: 100 | C15: =RC[-2]/RC[-1] -> -0.93 | D15: =RC3 -> -0.93 | E15: =RC3 -> -0.93 | F15: =RC3 -> -0.93 | G15: =RC3 -> -0.93 | H15: =RC3 -> -0.93 | I15: =RC3 -> -0.93 | J15: =RC3 -> -0.93 | K15: =RC3 -> -0.93 | L15: =RC3 -> -0.93 | M15: =RC[-10] -> -0.93
A16: =R[-1]C+1 -> -92 | B16: 100 | C16: =RC[-2]/RC[-1] -> -0.92 | D16: =RC3 -> -0.92 | E16: =RC3 -> -0.92 | F16: =RC3 -> -0.92 | G16: =RC3 -> -0.92 | H16: =RC3 -> -0.92 | I16: =RC3 -> -0.92 | J16: =RC3 -> -0.92 | K16: =RC3 -> -0.92 | L16: =RC3 -> -0.92 | M16: =RC[-10] -> -0.92
A17: =R[-1]C+1 -> -91 | B17: 100 | C17: =RC[-2]/RC[-1] -> -0.91 | D17: =RC3 -> -0.91 | E17: =RC3 -> -0.91 | F17: =RC3 -> -0.91 | G17: =RC3 -> -0.91 | H17: =RC3 -> -0.91 | I17: =RC3 -> -0.91 | J17: =RC3 -> -0.91 | K17: =RC3 -> -0.91 | L17: =RC3 -> -0.91 | M17: =RC[-10] -> -0.91
A18: =R[-1]C+1 -> -90 | B18: 100 | C18: =RC[-2]/RC[-1] -> -0.9 | D18: =RC3 -> -0.9 | E18: =RC3 -> -0.9 | F18: =RC3 -> -0.9 | G18: =RC3 -> -0.9 | H18: =RC3 -> -0.9 | I18: =RC3 -> -0.9 | J18: =RC3 -> -0.9 | K18: =RC3 -> -0.9 | L18: =RC3 -> -0.9 | M18: =RC[-10] -> -0.9
A19: =R[-1]C+1 -> -89 | B19: 100 | C19: =RC[-2]/RC[-1] -> -0.89 | D19: =RC3 -> -0.89 | E19: =RC3 -> -0.89 | F19: =RC3 -> -0.89 | G19: =RC3 -> -0.89 | H19: =RC3 -> -0.89 | I19: =RC3 -> -0.89 | J19: =RC3 -> -0.89 | K19: =RC3 -> -0.89 | L19: =RC3 -> -0.89 | M19: =RC[-10] -> -0.89
A20: =R[-1]C+1 -> -88 | B20: 100 | C20: =RC[-2]/RC[-1] -> -0.88 | D20: =RC3 -> -0.88 | E20: =RC3 -> -0.88 | F20: =RC3 -> -0.88 | G20: =RC3 -> -0.88 | H20: =RC3 -> -0.88 | I20: =RC3 -> -0.88 | J20: =RC3 -> -0.88 | K20: =RC3 -> -0.88 | L20: =RC3 -> -0.88 | M20: =RC[-10] -> -0.88
A21: =R[-1]C+1 -> -87 | B21: 100 | C21: =RC[-2]/RC[-1] -> -0.87 | D21: =RC3 -> -0.87 | E21: =RC3 -> -0.87 | F21: =RC3 -> -0.87 | G21: =RC3 -> -0.87 | H21: =RC3 -> -0.87 | I21: =RC3 -> -0.87 | J21: =RC3 -> -0.87 | K21: =RC3 -> -0.87 | L21: =RC3 -> -0.87 | M21: =RC[-10] -> -0.87
A22: =R[-1]C+1 -> -86 | B22: 100 | C22: =RC[-2]/RC[-1] -> -0.86 | D22: =RC3 -> -0.86 | E22: =RC3 -> -0.86 | F22: =RC3 -> -0.86 | G22: =RC3 -> -0.86 | H22: =RC3 -> -0.86 | I22: =RC3 -> -0.86 | J22: =RC3 -> -0.86 | K22: =RC3 -> -0.86 | L22: =RC3 -> -0.86 | M22: =RC[-10] -> -0.86
A23: =R[-1]C+1 -> -85 | B23: 100 | C23: =RC[-2]/RC[-1] -> -0.85 | D23: =RC3 -> -0.85 | E23: =RC3 -> -0.85 | F23: =RC3 -> -0.85 | G23: =RC3 -> -0.85 | H23: =RC3 -> -0.85 | I23: =RC3 -> -0.85 | J23: =RC3 -> -0.85 | K23: =RC3 -> -0.85 | L23: =RC3 -> -0.85 | M23: =RC[-10] -> -0.85
A24: =R[-1]C+1 -> -84 | B24: 100 | C24: =RC[-2]/RC[-1] -> -0.84 | D24: =RC3 -> -0.84 | E24: =RC3 -> -0.84 | F24: =RC3 -> -0.84 | G24: =RC3 -> -0.84 | H24: =RC3 -> -0.84 | I24: =RC3 -> -0.84 | J24: =RC3 -> -0.84 | K24: =RC3 -> -0.84 | L24: =RC3 -> -0.84 | M24: =RC[-10] -> -0.84
A25: =R[-1]C+1 -> -83 | B25: 100 | C25: =RC[-2]/RC[-1] -> -0.83 | D25: =RC3 -> -0.83 | E25: =RC3 -> -0.83 | F25: =RC3 -> -0.83 | G25: =RC3 -> -0.83 | H25: =RC3 -> -0.83 | I25: =RC3 -> -0.83 | J25: =RC3 -> -0.83 | K25: =RC3 -> -0.83 | L25: =RC3 -> -0.83 | M25: =RC[-10] -> -0.83
A26: =R[-1]C+1 -> -82 | B26: 100 | C26: =RC[-2]/RC[-1] -> -0.82 | D26: =RC3 -> -0.82 | E26: =RC3 -> -0.82 | F26: =RC3 -> -0.82 | G26: =RC3 -> -0.82 | H26: =RC3 -> -0.82 | I26: =RC3 -> -0.82 | J26: =RC3 -> -0.82 | K26: =RC3 -> -0.82 | L26: =RC3 -> -0.82 | M26: =RC[-10] -> -0.82
A27: =R[-1]C+1 -> -81 | B27: 100 | C27: =RC[-2]/RC[-1] -> -0.81 | D27: =RC3 -> -0.81 | E27: =RC3 -> -0.81 | F27: =RC3 -> -0.81 | G27: =RC3 -> -0.81 | H27: =RC3 -> -0.81 | I27: =RC3 -> -0.81 | J27: =RC3 -> -0.81 | K27: =RC3 -> -0.81 | L27: =RC3 -> -0.81 | M27: =RC[-10] -> -0.81
A28: =R[-1]C+1 -> -80 | B28: 100 | C28: =RC[-2]/RC[-1] -> -0.8 | D28: =RC3 -> -0.8 | E28: =RC3 -> -0.8 | F28: =RC3 -> -0.8 | G28: =RC3 -> -0.8 | H28: =RC3 -> -0.8 | I28: =RC3 -> -0.8 | J28: =RC3 -> -0.8 | K28: =RC3 -> -0.8 | L28: =RC3 -> -0.8 | M28: =RC[-10] -> -0.8
A29: =R[-1]C+1 -> -79 | B29: 100 | C29: =RC[-2]/RC[-1] -> -0.79 | D29: =RC3 -> -0.79 | E29: =RC3 -> -0.79 | F29: =RC3 -> -0.79 | G29: =RC3 -> -0.79 | H29: =RC3 -> -0.79 | I29: =RC3 -> -0.79 | J29: =RC3 -> -0.79 | K29: =RC3 -> -0.79 | L29: =RC3 -> -0.79 | M29: =RC[-10] -> -0.79
A30: =R[-1]C+1 -> -78 | B30: 100 | C30: =RC[-2]/RC[-1] -> -0.78 | D30: =RC3 -> -0.78 | E30: =RC3 -> -0.78 | F30: =RC3 -> -0.78 | G30: =RC3 -> -0.78 | H30: =RC3 -> -0.78 | I30: =RC3 -> -0.78 | J30: =RC3 -> -0.78 | K30: =RC3 -> -0.78 | L30: =RC3 -> -0.78 | M30: =RC[-10] -> -0.78
A31: =R[-1]C+1 -> -77 | B31: 100 | C31: =RC[-2]/RC[-1] -> -0.77 | D31: =RC3 -> -0.77 | E31: =RC3 -> -0.77 | F31: =RC3 -> -0.77 | G31: =RC3 -> -0.77 | H31: =RC3 -> -0.77 | I31: =RC3 -> -0.77 | J31: =RC3 -> -0.77 | K31: =RC3 -> -0.77 | L31: =RC3 -> -0.77 | M31: =RC[-10] -> -0.77
A32: =R[-1]C+1 -> -76 | B32: 100 | C32: =RC[-2]/RC[-1] -> -0.76 | D32: =RC3 -> -0.76 | E32: =RC3 -> -0.76 | F32: =RC3 -> -0.76 | G32: =RC3 -> -0.76 | H32: =RC3 -> -0.76 | I32: =RC3 -> -0.76 | J32: =RC3 -> -0.76 | K32: =RC3 -> -0.76 | L32: =RC3 -> -0.76 | M32: =RC[-10] -> -0.76
A33: =R[-1]C+1 -> -75 | B33: 100 | C33: =RC[-2]/RC[-1] -> -0.75 | D33: =RC3 -> -0.75 | E33: =RC3 -> -0.75 | F33: =RC3 -> -0.75 | G33: =RC3 -> -0.75 | H33: =RC3 -> -0.75 | I33: =RC3 -> -0.75 | J33: =RC3 -> -0.75 | K33: =RC3 -> -0.75 | L33: =RC3 -> -0.75 | M33: =RC[-10] -> -0.75
A34: =R[-1]C+1 -> -74 | B34: 100 | C34: =RC[-2]/RC[-1] -> -0.74 | D34: =RC3 -> -0.74 | E34: =RC3 -> -0.74 | F34: =RC3 -> -0.74 | G34: =RC3 -> -0.74 | H34: =RC3 -> -0.74 | I34: =RC3 -> -0.74 | J34: =RC3 -> -0.74 | K34: =RC3 -> -0.74 | L34: =RC3 -> -0.74 | M34: =RC[-10] -> -0.74
A35: =R[-1]C+1 -> -73 | B35: 100 | C35: =RC[-2]/RC[-1] -> -0.73 | D35: =RC3 -> -0.73 | E35: =RC3 -> -0.73 | F35: =RC3 -> -0.73 | G35: =RC3 -> -0.73 | H35: =RC3 -> -0.73 | I35: =RC3 -> -0.73 | J35: =RC3 -> -0.73 | K35: =RC3 -> -0.73 | L35: =RC3 -> -0.73 | M35: =RC[-10] -> -0.73
A36: =R[-1]C+1 -> -72 | B36: 100 | C36: =RC[-2]/RC[-1] -> -0.72 | D36: =RC3 -> -0.72 | E36: =RC3 -> -0.72 | F36: =RC3 -> -0.72 | G36: =RC3 -> -0.72 | H36: =RC3 -> -0.72 | I36: =RC3 -> -0.72 | J36: =RC3 -> -0.72 | K36: =RC3 -> -0.72 | L36: =RC3 -> -0.72 | M36: =RC[-10] -> -0.72
A37: =R[-1]C+1 -> -71 | B37: 100 | C37: =RC[-2]/RC[-1] -> -0.71 | D37: =RC3 -> -0.71 | E37: =RC3 -> -0.71 | F37: =RC3 -> -0.71 | G37: =RC3 -> -0.71 | H37: =RC3 -> -0.71 | I37: =RC3 -> -0.71 | J37: =RC3 -> -0.71 | K37: =RC3 -> -0.71 | L37: =RC3 -> -0.71 | M37: =RC[-10] -> -0.71
A38: =R[-1]C+1 -> -70 | B38: 100 | C38: =RC[-2]/RC[-1] -> -0.7 | D38: =RC3 -> -0.7 | E38: =RC3 -> -0.7 | F38: =RC3 -> -0.7 | G38: =RC3 -> -0.7 | H38: =RC3 -> -0.7 | I38: =RC3 -> -0.7 | J38: =RC3 -> -0.7 | K38: =RC3 -> -0.7 | L38: =RC3 -> -0.7 | M38: =RC[-10] -> -0.7
A39: =R[-1]C+1 -> -69 | B39: 100 | C39: =RC[-2]/RC[-1] -> -0.69 | D39: =RC3 -> -0.69 | E39: =RC3 -> -0.69 | F39: =RC3 -> -0.69 | G39: =RC3 -> -0.69 | H39: =RC3 -> -0.69 | I39: =RC3 -> -0.69 | J39: =RC3 -> -0.69 | K39: =RC3 -> -0.69 | L39: =RC3 -> -0.69 | M39: =RC[-10] -> -0.69
A40: =R[-1]C+1 -> -68 | B40: 100 | C40: =RC[-2]/RC[-1] -> -0.68 | D40: =RC3 -> -0.68 | E40: =RC3 -> -0.68 | F40: =RC3 -> -0.68 | G40: =RC3 -> -0.68 | H40: =RC3 -> -0.68 | I40: =RC3 -> -0.68 | J40: =RC3 -> -0.68 | K40: =RC3 -> -0.68 | L40: =RC3 -> -0.68 | M40: =RC[-10] -> -0.68
A41: =R[-1]C+1 -> -67 | B41: 100 | C41: =RC[-2]/RC[-1] -> -0.67 | D41: =RC3 -> -0.67 | E41: =RC3 -> -0.67 | F41: =RC3 -> -0.67 | G41: =RC3 -> -0.67 | H41: =RC3 -> -0.67 | I41: =RC3 -> -0.67 | J41: =RC3 -> -0.67 | K41: =RC3 -> -0.67 | L41: =RC3 -> -0.67 | M41: =RC[-10] -> -0.67
A42: =R[-1]C+1 -> -66 | B42: 100 | C42: =RC[-2]/RC[-1] -> -0.66 | D42: =RC3 -> -0.66 | E42: =RC3 -> -0.66 | F42: =RC3 -> -0.66 | G42: =RC3 -> -0.66 | H42: =RC3 -> -0.66 | I42: =RC3 -> -0.66 | J42: =RC3 -> -0.66 | K42: =RC3 -> -0.66 | L42: =RC3 -> -0.66 | M42: =RC[-10] -> -0.66
A43: =R[-1]C+1 -> -65 | B43: 100 | C43: =RC[-2]/RC[-1] -> -0.65 | D43: =RC3 -> -0.65 | E43: =RC3 -> -0.65 | F43: =RC3 -> -0.65 | G43: =RC3 -> -0.65 | H43: =RC3 -> -0.65 | I43: =RC3 -> -0.65 | J43: =RC3 -> -0.65 | K43: =RC3 -> -0.65 | L43: =RC3 -> -0.65 | M43: =RC[-10] -> -0.65
A44: =R[-1]C+1 -> -64 | B44: 100 | C44: =RC[-2]/RC[-1] -> -0.64 | D44: =RC3 -> -0.64 | E44: =RC3 -> -0.64 | F44: =RC3 -> -0.64 | G44: =RC3 -> -0.64 | H44: =RC3 -> -0.64 | I44: =RC3 -> -0.64 | J44: =RC3 -> -0.64 | K44: =RC3 -> -0.64 | L44: =RC3 -> -0.64 | M44: =RC[-10] -> -0.64
A45: =R[-1]C+1 -> -63 | B45: 100 | C45: =RC[-2]/RC[-1] -> -0.63 | D45: =RC3 -> -0.63 | E45: =RC3 -> -0.63 | F45: =RC3 -> -0.63 | G45: =RC3 -> -0.63 | H45: =RC3 -> -0.63 | I45: =RC3 -> -0.63 | J45: =RC3 -> -0.63 | K45: =RC3 -> -0.63 | L45: =RC3 -> -0.63 | M45: =RC[-10] -> -0.63
A46: =R[-1]C+1 -> -62 | B46: 100 | C46: =RC[-2]/RC[-1] -> -0.62 | D46: =RC3 -> -0.62 | E46: =RC3 -> -0.62 | F46: =RC3 -> -0.62 | G46: =RC3 -> -0.62 | H46: =RC3 -> -0.62 | I46: =RC3 -> -0.62 | J46: =RC3 -> -0.62 | K46: =RC3 -> -0.62 | L46: =RC3 -> -0.62 | M46: =RC[-10] -> -0.62
A47: =R[-1]C+1 -> -61 | B47: 100 | C47: =RC[-2]/RC[-1] -> -0.61 | D47: =RC3 -> -0.61 | E47: =RC3 -> -0.61 | F47: =RC3 -> -0.61 | G47: =RC3 -> -0.61 | H47: =RC3 -> -0.61 | I47: =RC3 -> -0.61 | J47: =RC3 -> -0.61 | K47: =RC3 -> -0.61 | L47: =RC3 -> -0.61 | M47: =RC[-10] -> -0.61
A48: =R[-1]C+1 -> -60 | B48: 100 | C48: =RC[-2]/RC[-1] -> -0.6 | D48: =RC3 -> -0.6 | E48: =RC3 -> -0.6 | F48: =RC3 -> -0.6 | G48: =RC3 -> -0.6 | H48: =RC3 -> -0.6 | I48: =RC3 -> -0.6 | J48: =RC3 -> -0.6 | K48: =RC3 -> -0.6 | L48: =RC3 -> -0.6 | M48: =RC[-10] -> -0.6
A49: =R[-1]C+1 -> -59 | B49: 100 | C49: =RC[-2]/RC[-1] -> -0.59 | D49: =RC3 -> -0.59 | E49: =RC3 -> -0.59 | F49: =RC3 -> -0.59 | G49: =RC3 -> -0.59 | H49: =RC3 -> -0.59 | I49: =RC3 -> -0.59 | J49: =RC3 -> -0.59 | K49: =RC3 -> -0.59 | L49: =RC3 -> -0.59 | M49: =RC[-10] -> -0.59
A50: =R[-1]C+1 -> -58 | B50: 100 | C50: =RC[-2]/RC[-1] -> -0.57999999999999996 | D50: =RC3 -> -0.57999999999999996 | E50: =RC3 -> -0.57999999999999996 | F50: =RC3 -> -0.57999999999999996 | G50: =RC3 -> -0.57999999999999996 | H50: =RC3 -> -0.57999999999999996 | I50: =RC3 -> -0.57999999999999996 | J50: =RC3 -> -0.57999999999999996 | K50: =RC3 -> -0.57999999999999996 | L50: =RC3 -> -0.57999999999999996 | M50: =RC[-10] -> -0.57999999999999996
A51: =R[-1]C+1 -> -57 | B51: 100 | C51: =RC[-2]/RC[-1] -> -0.56999999999999995 | D51: =RC3 -> -0.56999999999999995 | E51: =RC3 -> -0.56999999999999995 | F51: =RC3 -> -0.56999999999999995 | G51: =RC3 -> -0.56999999999999995 | H51: =RC3 -> -0.56999999999999995 | I51: =RC3 -> -0.56999999999999995 | J51: =RC3 -> -0.56999999999999995 | K51: =RC3 -> -0.56999999999999995 | L51: =RC3 -> -0.56999999999999995 | M51: =RC[-10] -> -0.56999999999999995
A52: =R[-1]C+1 -> -56 | B52: 100 | C52: =RC[-2]/RC[-1] -> -0.56000000000000005 | D52: =RC3 -> -0.56000000000000005 | E52: =RC3 -> -0.56000000000000005 | F52: =RC3 -> -0.56000000000000005 | G52: =RC3 -> -0.56000000000000005 | H52: =RC3 -> -0.56000000000000005 | I52: =RC3 -> -0.56000000000000005 | J52: =RC3 -> -0.56000000000000005 | K52: =RC3 -> -0.56000000000000005 | L52: =RC3 -> -0.56000000000000005 | M52: =RC[-10] -> -0.56000000000000005
A53: =R[-1]C+1 -> -55 | B53: 100 | C53: =RC[-2]/RC[-1] -> -0.55000000000000004 | D53: =RC3 -> -0.55000000000000004 | E53: =RC3 -> -0.55000000000000004 | F53: =RC3 -> -0.55000000000000004 | G53: =RC3 -> -0.55000000000000004 | H53: =RC3 -> -0.55000000000000004 | I53: =RC3 -> -0.55000000000000004 | J53: =RC3 -> -0.55000000000000004 | K53: =RC3 -> -0.55000000000000004 | L53: =RC3 -> -0.55000000000000004 | M53: =RC[-10] -> -0.55000000000000004
A54: =R[-1]C+1 -> -54 | B54: 100 | C54: =RC[-2]/RC[-1] -> -0.54 | D54: =RC3 -> -0.54 | E54: =RC3 -> -0.54 | F54: =RC3 -> -0.54 | G54: =RC3 -> -0.54 | H54: =RC3 -> -0.54 | I54: =RC3 -> -0.54 | J54: =RC3 -> -0.54 | K54: =RC3 -> -0.54 | L54: =RC3 -> -0.54 | M54: =RC[-10] -> -0.54
A55: =R[-1]C+1 -> -53 | B55: 100 | C55: =RC[-2]/RC[-1] -> -0.53 | D55: =RC3 -> -0.53 | E55: =RC3 -> -0.53 | F55: =RC3 -> -0.53 | G55: =RC3 -> -0.53 | H55: =RC3 -> -0.53 | I55: =RC3 -> -0.53 | J55: =RC3 -> -0.53 | K55: =RC3 -> -0.53 | L55: =RC3 -> -0.53 | M55: =RC[-10] -> -0.53
A56: =R[-1]C+1 -> -52 | B56: 100 | C56: =RC[-2]/RC[-1] -> -0.52 | D56: =RC3 -> -0.52 | E56: =RC3 -> -0.52 | F56: =RC3 -> -0.52 | G56: =RC3 -> -0.52 | H56: =RC3 -> -0.52 | I56: =RC3 -> -0.52 | J56: =RC3 -> -0.52 | K56: =RC3 -> -0.52 | L56: =RC3 -> -0.52 | M56: =RC[-10] -> -0.52
A57: =R[-1]C+1 -> -51 | B57: 100 | C57: =RC[-2]/RC[-1] -> -0.51 | D57: =RC3 -> -0.51 | E57: =RC3 -> -0.51 | F57: =RC3 -> -0.51 | G57: =RC3 -> -0.51 | H57: =RC3 -> -0.51 | I57: =RC3 -> -0.51 | J57: =RC3 -> -0.51 | K57: =RC3 -> -0.51 | L57: =RC3 -> -0.51 | M57: =RC[-10] -> -0.51
A58: =R[-1]C+1 -> -50 | B58: 100 | C58: =RC[-2]/RC[-1] -> -0.5 | D58: =RC3 -> -0.5 | E58: =RC3 -> -0.5 | F58: =RC3 -> -0.5 | G58: =RC3 -> -0.5 | H58: =RC3 -> -0.5 | I58: =RC3 -> -0.5 | J58: =RC3 -> -0.5 | K58: =RC3 -> -0.5 | L58: =RC3 -> -0.5 | M58: =RC[-10] -> -0.5
A59: =R[-1]C+1 -> -49 | B59: 100 | C59: =RC[-2]/RC[-1] -> -0.49 | D59: =RC3 -> -0.49 | E59: =RC3 -> -0.49 | F59: =RC3 -> -0.49 | G59: =RC3 -> -0.49 | H59: =RC3 -> -0.49 | I59: =RC3 -> -0.49 | J59: =RC3 -> -0.49 | K59: =RC3 -> -0.49 | L59: =RC3 -> -0.49 | M59: =RC[-10] -> -0.49
A60: =R[-1]C+1 -> -48 | B60: 100 | C60: =RC[-2]/RC[-1] -> -0.48 | D60: =RC3 -> -0.48 | E60: =RC3 -> -0.48 | F60: =RC3 -> -0.48 | G60: =RC3 -> -0.48 | H60: =RC3 -> -0.48 | I60: =RC3 -> -0.48 | J60: =RC3 -> -0.48 | K60: =RC3 -> -0.48 | L60: =RC3 -> -0.48 | M60: =RC[-10] -> -0.48
A61: =R[-1]C+1 -> -47 | B61: 100 | C61: =RC[-2]/RC[-1] -> -0.47 | D61: =RC3 -> -0.47 | E61: =RC3 -> -0.47 | F61: =RC3 -> -0.47 | G61: =RC3 -> -0.47 | H61: =RC3 -> -0.47 | I61: =RC3 -> -0.47 | J61: =RC3 -> -0.47 | K61: =RC3 -> -0.47 | L61: =RC3 -> -0.47 | M61: =RC[-10] -> -0.47
A62: =R[-1]C+1 -> -46 | B62: 100 | C62: =RC[-2]/RC[-1] -> -0.46 | D62: =RC3 -> -0.46 | E62: =RC3 -> -0.46 | F62: =RC3 -> -0.46 | G62: =RC3 -> -0.46 | H62: =RC3 -> -0.46 | I62: =RC3 -> -0.46 | J62: =RC3 -> -0.46 | K62: =RC3 -> -0.46 | L62: =RC3 -> -0.46 | M62: =RC[-10] -> -0.46
A63: =R[-1]C+1 -> -45 | B63: 100 | C63: =RC[-2]/RC[-1] -> -0.45 | D63: =RC3 -> -0.45 | E63: =RC3 -> -0.45 | F63: =RC3 -> -0.45 | G63: =RC3 -> -0.45 | H63: =RC3 -> -0.45 | I63: =RC3 -> -0.45 | J63: =RC3 -> -0.45 | K63: =RC3 -> -0.45 | L63: =RC3 -> -0.45 | M63: =RC[-10] -> -0.45
A64: =R[-1]C+1 -> -44 | B64: 100 | C64: =RC[-2]/RC[-1] -> -0.44 | D64: =RC3 -> -0.44 | E64: =RC3 -> -0.44 | F64: =RC3 -> -0.44 | G64: =RC3 -> -0.44 | H64: =RC3 -> -0.44 | I64: =RC3 -> -0.44 | J64: =RC3 -> -0.44 | K64: =RC3 -> -0.44 | L64: =RC3 -> -0.44 | M64: =RC[-10] -> -0.44
A65: =R[-1]C+1 -> -43 | B65: 100 | C65: =RC[-2]/RC[-1] -> -0.43 | D65: =RC3 -> -0.43 | E65: =RC3 -> -0.43 | F65: =RC3 -> -0.43 | G65: =RC3 -> -0.43 | H65: =RC3 -> -0.43 | I65: =RC3 -> -0.43 | J65: =RC3 -> -0.43 | K65: =RC3 -> -0.43 | L65: =RC3 -> -0.43 | M65: =RC[-10] -> -0.43
A66: =R[-1]C+1 -> -42 | B66: 100 | C66: =RC[-2]/RC[-1] -> -0.42 | D66: =RC3 -> -0.42 | E66: =RC3 -> -0.42 | F66: =RC3 -> -0.42 | G66: =RC3 -> -0.42 | H66: =RC3 -> -0.42 | I66: =RC3 -> -0.42 | J66: =RC3 -> -0.42 | K66: =RC3 -> -0.42 | L66: =RC3 -> -0.42 | M66: =RC[-10] -> -0.42
A67: =R[-1]C+1 -> -41 | B67: 100 | C67: =RC[-2]/RC[-1] -> -0.41 | D67: =RC3 -> -0.41 | E67: =RC3 -> -0.41 | F67: =RC3 -> -0.41 | G67: =RC3 -> -0.41 | H67: =RC3 -> -0.41 | I67: =RC3 -> -0.41 | J67: =RC3 -> -0.41 | K67: =RC3 -> -0.41 | L67: =RC3 -> -0.41 | M67: =RC[-10] -> -0.41
A68: =R[-1]C+1 -> -40 | B68: 100 | C68: =RC[-2]/RC[-1] -> -0.4 | D68: =RC3 -> -0.4 | E68: =RC3 -> -0.4 | F68: =RC3 -> -0.4 | G68: =RC3 -> -0.4 | H68: =RC3 -> -0.4 | I68: =RC3 -> -0.4 | J68: =RC3 -> -0.4 | K68: =RC3 -> -0.4 | L68: =RC3 -> -0.4 | M68: =RC[-10] -> -0.4
A69: =R[-1]C+1 -> -39 | B69: 100 | C69: =RC[-2]/RC[-1] -> -0.39 | D69: =RC3 -> -0.39 | E69: =RC3 -> -0.39 | F69: =RC3 -> -0.39 | G69: =RC3 -> -0.39 | H69: =RC3 -> -0.39 | I69: =RC3 -> -0.39 | J69: =RC3 -> -0.39 | K69: =RC3 -> -0.39 | L69: =RC3 -> -0.39 | M69: =RC[-10] -> -0.39
A70: =R[-1]C+1 -> -38 | B70: 100 | C70: =RC[-2]/RC[-1] -> -0.38 | D70: =RC3 -> -0.38 | E70: =RC3 -> -0.38 | F70: =RC3 -> -0.38 | G70: =RC3 -> -0.38 | H70: =RC3 -> -0.38 | I70: =RC3 -> -0.38 | J70: =RC3 -> -0.38 | K70: =RC3 -> -0.38 | L70: =RC3 -> -0.38 | M70: =RC[-10] -> -0.38
A71: =R[-1]C+1 -> -37 | B71: 100 | C71: =RC[-2]/RC[-1] -> -0.37 | D71: =RC3 -> -0.37 | E71: =RC3 -> -0.37 | F71: =RC3 -> -0.37 | G71: =RC3 -> -0.37 | H71: =RC3 -> -0.37 | I71: =RC3 -> -0.37 | J71: =RC3 -> -0.37 | K71: =RC3 -> -0.37 | L71: =RC3 -> -0.37 | M71: =RC[-10] -> -0.37
A72: =R[-1]C+1 -> -36 | B72: 100 | C72: =RC[-2]/RC[-1] -> -0.36 | D72: =RC3 -> -0.36 | E72: =RC3 -> -0.36 | F72: =RC3 -> -0.36 | G72: =RC3 -> -0.36 | H72: =RC3 -> -0.36 | I72: =RC3 -> -0.36 | J72: =RC3 -> -0.36 | K72: =RC3 -> -0.36 | L72: =RC3 -> -0.36 | M72: =RC[-10] -> -0.36
A73: =R[-1]C+1 -> -35 | B73: 100 | C73: =RC[-2]/RC[-1] -> -0.35 | D73: =RC3 -> -0.35 | E73: =RC3 -> -0.35 | F73: =RC3 -> -0.35 | G73: =RC3 -> -0.35 | H73: =RC3 -> -0.35 | I73: =RC3 -> -0.35 | J73: =RC3 -> -0.35 | K73: =RC3 -> -0.35 | L73: =RC3 -> -0.35 | M73: =RC[-10] -> -0.35
A74: =R[-1]C+1 -> -34 | B74: 100 | C74: =RC[-2]/RC[-1] -> -0.34 | D74: =RC3 -> -0.34 | E74: =RC3 -> -0.34 | F74: =RC3 -> -0.34 | G74: =RC3 -> -0.34 | H74: =RC3 -> -0.34 | I74: =RC3 -> -0.34 | J74: =RC3 -> -0.34 | K74: =RC3 -> -0.34 | L74: =RC3 -> -0.34 | M74: =RC[-10] -> -0.34
A75: =R[-1]C+1 -> -33 | B75: 100 | C75: =RC[-2]/RC[-1] -> -0.33 | D75: =RC3 -> -0.33 | E75: =RC3 -> -0.33 | F75: =RC3 -> -0.33 | G75: =RC3 -> -0.33 | H75: =RC3 -> -0.33 | I75: =RC3 -> -0.33 | J75: =RC3 -> -0.33 | K75: =RC3 -> -0.33 | L75: =RC3 -> -0.33 | M75: =RC[-10] -> -0.33
A76: =R[-1]C+1 -> -32 | B76: 100 | C76: =RC[-2]/RC[-1] -> -0.32 | D76: =RC3 -> -0.32 | E76: =RC3 -> -0.32 | F76: =RC3 -> -0.32 | G76: =RC3 -> -0.32 | H76: =RC3 -> -0.32 | I76: =RC3 -> -0.32 | J76: =RC3 -> -0.32 | K76: =RC3 -> -0.32 | L76: =RC3 -> -0.32 | M76: =RC[-10] -> -0.32
A77: =R[-1]C+1 -> -31 | B77: 100 | C77: =RC[-2]/RC[-1] -> -0.31 | D77: =RC3 -> -0.31 | E77: =RC3 -> -0.31 | F77: =RC3 -> -0.31 | G77: =RC3 -> -0.31 | H77: =RC3 -> -0.31 | I77: =RC3 -> -0.31 | J77: =RC3 -> -0.31 | K77: =RC3 -> -0.31 | L77: =RC3 -> -0.31 | M77: =RC[-10] -> -0.31
A78: =R[-1]C+1 -> -30 | B78: 100 | C78: =RC[-2]/RC[-1] -> -0.3 | D78: =RC3 -> -0.3 | E78: =RC3 -> -0.3 | F78: =RC3 -> -0.3 | G78: =RC3 -> -0.3 | H78: =RC3 -> -0.3 | I78: =RC3 -> -0.3 | J78: =RC3 -> -0.3 | K78: =RC3 -> -0.3 | L78: =RC3 -> -0.3 | M78: =RC[-10] -> -0.3
A79: =R[-1]C+1 -> -29 | B79: 100 | C79: =RC[-2]/RC[-1] -> -0.28999999999999998 | D79: =RC3 -> -0.28999999999999998 | E79: =RC3 -> -0.28999999999999998 | F79: =RC3 -> -0.28999999999999998 | G79: =RC3 -> -0.28999999999999998 | H79: =RC3 -> -0.28999999999999998 | I79: =RC3 -> -0.28999999999999998 | J79: =RC3 -> -0.28999999999999998 | K79: =RC3 -> -0.28999999999999998 | L79: =RC3 -> -0.28999999999999998 | M79: =RC[-10] -> -0.28999999999999998
A80: =R[-1]C+1 -> -28 | B80: 100 | C80: =RC[-2]/RC[-1] -> -0.28000000000000003 | D80: =RC3 -> -0.28000000000000003 | E80: =RC3 -> -0.28000000000000003 | F80: =RC3 -> -0.28000000000000003 | G80: =RC3 -> -0.28000000000000003 | H80: =RC3 -> -0.28000000000000003 | I80: =RC3 -> -0.28000000000000003 | J80: =RC3 -> -0.28000000000000003 | K80: =RC3 -> -0.28000000000000003 | L80: =RC3 -> -0.28000000000000003 | M80: =RC[-10] -> -0.28000000000000003
A81: =R[-1]C+1 -> -27 | B81: 100 | C81: =RC[-2]/RC[-1] -> -0.27 | D81: =RC3 -> -0.27 | E81: =RC3 -> -0.27 | F81: =RC3 -> -0.27 | G81: =RC3 -> -0.27 | H81: =RC3 -> -0.27 | I81: =RC3 -> -0.27 | J81: =RC3 -> -0.27 | K81: =RC3 -> -0.27 | L81: =RC3 -> -0.27 | M81: =RC[-10] -> -0.27
A82: =R[-1]C+1 -> -26 | B82: 100 | C82: =RC[-2]/RC[-1] -> -0.26 | D82: =RC3 -> -0.26 | E82: =RC3 -> -0.26 | F82: =RC3 -> -0.26 | G82: =RC3 -> -0.26 | H82: =RC3 -> -0.26 | I82: =RC3 -> -0.26 | J82: =RC3 -> -0.26 | K82: =RC3 -> -0.26 | L82: =RC3 -> -0.26 | M82: =RC[-10] -> -0.26
A83: =R[-1]C+1 -> -25 | B83: 100 | C83: =RC[-2]/RC[-1] -> -0.25 | D83: =RC3 -> -0.25 | E83: =RC3 -> -0.25 | F83: =RC3 -> -0.25 | G83: =RC3 -> -0.25 | H83: =RC3 -> -0.25 | I83: =RC3 -> -0.25 | J83: =RC3 -> -0.25 | K83: =RC3 -> -0.25 | L83: =RC3 -> -0.25 | M83: =RC[-10] -> -0.25
A84: =R[-1]C+1 -> -24 | B84: 100 | C84: =RC[-2]/RC[-1] -> -0.24 | D84: =RC3 -> -0.24 | E84: =RC3 -> -0.24 | F84: =RC3 -> -0.24 | G84: =RC3 -> -0.24 | H84: =RC3 -> -0.24 | I84: =RC3 -> -0.24 | J84: =RC3 -> -0.24 | K84: =RC3 -> -0.24 | L84: =RC3 -> -0.24 | M84: =RC[-10] -> -0.24
A85: =R[-1]C+1 -> -23 | B85: 100 | C85: =RC[-2]/RC[-1] -> -0.23 | D85: =RC3 -> -0.23 | E85: =RC3 -> -0.23 | F85: =RC3 -> -0.23 | G85: =RC3 -> -0.23 | H85: =RC3 -> -0.23 | I85: =RC3 -> -0.23 | J85: =RC3 -> -0.23 | K85: =RC3 -> -0.23 | L85: =RC3 -> -0.23 | M85: =RC[-10] -> -0.23
A86: =R[-1]C+1 -> -22 | B86: 100 | C86: =RC[-2]/RC[-1] -> -0.22 | D86: =RC3 -> -0.22 | E86: =RC3 -> -0.22 | F86: =RC3 -> -0.22 | G86: =RC3 -> -0.22 | H86: =RC3 -> -0.22 | I86: =RC3 -> -0.22 | J86: =RC3 -> -0.22 | K86: =RC3 -> -0.22 | L86: =RC3 -> -0.22 | M86: =RC[-10] -> -0.22
A87: =R[-1]C+1 -> -21 | B87: 100 | C87: =RC[-2]/RC[-1] -> -0.21 | D87: =RC3 -> -0.21 | E87: =RC3 -> -0.21 | F87: =RC3 -> -0.21 | G87: =RC3 -> -0.21 | H87: =RC3 -> -0.21 | I87: =RC3 -> -0.21 | J87: =RC3 -> -0.21 | K87: =RC3 -> -0.21 | L87: =RC3 -> -0.21 | M87: =RC[-10] -> -0.21
A88: =R[-1]C+1 -> -20 | B88: 100 | C88: =RC[-2]/RC[-1] -> -0.2 | D88: =RC3 -> -0.2 | E88: =RC3 -> -0.2 | F88: =RC3 -> -0.2 | G88: =RC3 -> -0.2 | H88: =RC3 -> -0.2 | I88: =RC3 -> -0.2 | J88: =RC3 -> -0.2 | K88: =RC3 -> -0.2 | L88: =RC3 -> -0.2 | M88: =RC[-10] -> -0.2
A89: =R[-1]C+1 -> -19 | B89: 100 | C89: =RC[-2]/RC[-1] -> -0.19 | D89: =RC3 -> -0.19 | E89: =RC3 -> -0.19 | F89: =RC3 -> -0.19 | G89: =RC3 -> -0.19 | H89: =RC3 -> -0.19 | I89: =RC3 -> -0.19 | J89: =RC3 -> -0.19 | K89: =RC3 -> -0.19 | L89: =RC3 -> -0.19 | M89: =RC[-10] -> -0.19
A90: =R[-1]C+1 -> -18 | B90: 100 | C90: =RC[-2]/RC[-1] -> -0.18 | D90: =RC3 -> -0.18 | E90: =RC3 -> -0.18 | F90: =RC3 -> -0.18 | G90: =RC3 -> -0.18 | H90: =RC3 -> -0.18 | I90: =RC3 -> -0.18 | J90: =RC3 -> -0.18 | K90: =RC3 -> -0.18 | L90: =RC3 -> -0.18 | M90: =RC[-10] -> -0.18
A91: =R[-1]C+1 -> -17 | B91: 100 | C91: =RC[-2]/RC[-1] -> -0.17 | D91: =RC3 -> -0.17 | E91: =RC3 -> -0.17 | F91: =RC3 -> -0.17 | G91: =RC3 -> -0.17 | H91: =RC3 -> -0.17 | I91: =RC3 -> -0.17 | J91: =RC3 -> -0.17 | K91: =RC3 -> -0.17 | L91: =RC3 -> -0.17 | M91: =RC[-10] -> -0.17
A92: =R[-1]C+1 -> -16 | B92: 100 | C92: =RC[-2]/RC[-1] -> -0.16 | D92: =RC3 -> -0.16 | E92: =RC3 -> -0.16 | F92: =RC3 -> -0.16 | G92: =RC3 -> -0.16 | H92: =RC3 -> -0.16 | I92: =RC3 -> -0.16 | J92: =RC3 -> -0.16 | K92: =RC3 -> -0.16 | L92: =RC3 -> -0.16 | M92: =RC[-10] -> -0.16
A93: =R[-1]C+1 -> -15 | B93: 100 | C93: =RC[-2]/RC[-1] -> -0.15 | D93: =RC3 -> -0.15 | E93: =RC3 -> -0.15 | F93: =RC3 -> -0.15 | G93: =RC3 -> -0.15 | H93: =RC3 -> -0.15 | I93: =RC3 -> -0.15 | J93: =RC3 -> -0.15 | K93: =RC3 -> -0.15 | L93: =RC3 -> -0.15 | M93: =RC[-10] -> -0.15
A94: =R[-1]C+1 -> -14 | B94: 100 | C94: =RC[-2]/RC[-1] -> -0.14000000000000001 | D94: =RC3 -> -0.14000000000000001 | E94: =RC3 -> -0.14000000000000001 | F94: =RC3 -> -0.14000000000000001 | G94: =RC3 -> -0.14000000000000001 | H94: =RC3 -> -0.14000000000000001 | I94: =RC3 -> -0.14000000000000001 | J94: =RC3 -> -0.14000000000000001 | K94: =RC3 -> -0.14000000000000001 | L94: =RC3 -> -0.14000000000000001 | M94: =RC[-10] -> -0.14000000000000001
A95: =R[-1]C+1 -> -13 | B95: 100 | C95: =RC[-2]/RC[-1] -> -0.13 | D95: =RC3 -> -0.13 | E95: =RC3 -> -0.13 | F95: =RC3 -> -0.13 | G95: =RC3 -> -0.13 | H95: =RC3 -> -0.13 | I95: =RC3 -> -0.13 | J95: =RC3 -> -0.13 | K95: =RC3 -> -0.13 | L95: =RC3 -> -0.13 | M95: =RC[-10] -> -0.13
A96: =R[-1]C+1 -> -12 | B96: 100 | C96: =RC[-2]/RC[-1] -> -0.12 | D96: =RC3 -> -0.12 | E96: =RC3 -> -0.12 | F96: =RC3 -> -0.12 | G96: =RC3 -> -0.12 | H96: =RC3 -> -0.12 | I96: =RC3 -> -0.12 | J96: =RC3 -> -0.12 | K96: =RC3 -> -0.12 | L96: =RC3 -> -0.12 | M96: =RC[-10] -> -0.12
A97: =R[-1]C+1 -> -11 | B97: 100 | C97: =RC[-2]/RC[-1] -> -0.11 | D97: =RC3 -> -0.11 | E97: =RC3 -> -0.11 | F97: =RC3 -> -0.11 | G97: =RC3 -> -0.11 | H97: =RC3 -> -0.11 | I97: =RC3 -> -0.11 | J97: =RC3 -> -0.11 | K97: =RC3 -> -0.11 | L97: =RC3 -> -0.11 | M97: =RC[-10] -> -0.11
A98: =R[-1]C+1 -> -10 | B98: 100 | C98: =RC[-2]/RC[-1] -> -0.1 | D98: =RC3 -> -0.1 | E98: =RC3 -> -0.1 | F98: =RC3 -> -0.1 | G98: =RC3 -> -0.1 | H98: =RC3 -> -0.1 | I98: =RC3 -> -0.1 | J98: =RC3 -> -0.1 | K98: =RC3 -> -0.1 | L98: =RC3 -> -0.1 | M98: =RC[-10] -> -0.1
A99: =R[-1]C+1 -> -9 | B99: 100 | C99: =RC[-2]/RC[-1] -> -0.09 | D99: =RC3 -> -0.09 | E99: =RC3 -> -0.09 | F99: =RC3 -> -0.09 | G99: =RC3 -> -0.09 | H99: =RC3 -> -0.09 | I99: =RC3 -> -0.09 | J99: =RC3 -> -0.09 | K99: =RC3 -> -0.09 | L99: =RC3 -> -0.09 | M99: =RC[-10] -> -0.09
A100: =R[-1]C+1 -> -8 | B100: 100 | C100: =RC[-2]/RC[-1] -> -0.08 | D100: =RC3 -> -0.08 | E100: =RC3 -> -0.08 | F100: =RC3 -> -0.08 | G100: =RC3 -> -0.08 | H100: =RC3 -> -0.08 | I100: =RC3 -> -0.08 | J100: =RC3 -> -0.08 | K100: =RC3 -> -0.08 | L100: =RC3 -> -0.08 | M100: =RC[-10] -> -0.08
A101: =R[-1]C+1 -> -7 | B101: 100 | C101: =RC[-2]/RC[-1] -> -7.0000000000000007E-2 | D101: =RC3 -> -7.0000000000000007E-2 | E101: =RC3 -> -7.0000000000000007E-2 | F101: =RC3 -> -7.0000000000000007E-2 | G101: =RC3 -> -7.0000000000000007E-2 | H101: =RC3 -> -7.0000000000000007E-2 | I101: =RC3 -> -7.0000000000000007E-2 | J101: =RC3 -> -7.0000000000000007E-2 | K101: =RC3 -> -7.0000000000000007E-2 | L101: =RC3 -> -7.0000000000000007E-2 | M101: =RC[-10] -> -7.0000000000000007E-2
A102: =R[-1]C+1 -> -6 | B102: 100 | C102: =RC[-2]/RC[-1] -> -0.06 | D102: =RC3 -> -0.06 | E102: =RC3 -> -0.06 | F102: =RC3 -> -0.06 | G102: =RC3 -> -0.06 | H102: =RC3 -> -0.06 | I102: =RC3 -> -0.06 | J102: =RC3 -> -0.06 | K102: =RC3 -> -0.06 | L102: =RC3 -> -0.06 | M102: =RC[-10] -> -0.06
A103: =R[-1]C+1 -> -5 | B103: 100 | C103: =RC[-2]/RC[-1] -> -0.05 | D103: =RC3 -> -0.05 | E103: =RC3 -> -0.05 | F103: =RC3 -> -0.05 | G103: =RC3 -> -0.05 | H103: =RC3 -> -0.05 | I103: =RC3 -> -0.05 | J103: =RC3 -> -0.05 | K103: =RC3 -> -0.05 | L103: =RC3 -> -0.05 | M103: =RC[-10] -> -0.05
A104: =R[-1]C+1 -> -4 | B104: 100 | C104: =RC[-2]/RC[-1] -> -0.04 | D104: =RC3 -> -0.04 | E104: =RC3 -> -0.04 | F104: =RC3 -> -0.04 | G104: =RC3 -> -0.04 | H104: =RC3 -> -0.04 | I104: =RC3 -> -0.04 | J104: =RC3 -> -0.04 | K104: =RC3 -> -0.04 | L104: =RC3 -> -0.04 | M104: =RC[-10] -> -0.04
A105: =R[-1]C+1 -> -3 | B105: 100 | C105: =RC[-2]/RC[-1] -> -0.03 | D105: =RC3 -> -0.03 | E105: =RC3 -> -0.03 | F105: =RC3 -> -0.03 | G105: =RC3 -> -0.03 | H105: =RC3 -> -0.03 | I105: =RC3 -> -0.03 | J105: =RC3 -> -0.03 | K105: =RC3 -> -0.03 | L105: =RC3 -> -0.03 | M105: =RC[-10] -> -0.03
A106: =R[-1]C+1 -> -2 | B106: 100 | C106: =RC[-2]/RC[-1] -> -0.02 | D106: =RC3 -> -0.02 | E106: =RC3 -> -0.02 | F106: =RC3 -> -0.02 | G106: =RC3 -> -0.02 | H106: =RC3 -> -0.02 | I106: =RC3 -> -0.02 | J106: =RC3 -> -0.02 | K106: =RC3 -> -0.02 | L106: =RC3 -> -0.02 | M106: =RC[-10] -> -0.02
A107: =R[-1]C+1 -> -1 | B107: 100 | C107: =RC[-2]/RC[-1] -> -0.01 | D107: =RC3 -> -0.01 | E107: =RC3 -> -0.01 | F107: =RC3 -> -0.01 | G107: =RC3 -> -0.01 | H107: =RC3 -> -0.01 | I107: =RC3 -> -0.01 | J107: =RC3 -> -0.01 | K107: =RC3 -> -0.01 | L107: =RC3 -> -0.01 | M107: =RC[-10] -> -0.01
A108: =R[-1]C+1 -> 0 | B108: 100 | C108: =RC[-2]/RC[-1] -> 0 | D108: =RC3 -> 0 | E108: =RC3 -> 0 | F108: =RC3 -> 0 | G108: =RC3 -> 0 | H108: =RC3 -> 0 | I108: =RC3 -> 0 | J108: =RC3 -> 0 | K108: =RC3 -> 0 | L108: =RC3 -> 0 | M108: =RC[-10] -> 0
A109: =R[-1]C+1 -> 1 | B109: 100 | C109: =RC[-2]/RC[-1] -> 0.01 | D109: =RC3 -> 0.01 | E109: =RC3 -> 0.01 | F109: =RC3 -> 0.01 | G109: =RC3 -> 0.01 | H109: =RC3 -> 0.01 | I109: =RC3 -> 0.01 | J109: =RC3 -> 0.01 | K109: =RC3 -> 0.01 | L109: =RC3 -> 0.01 | M109: =RC[-10] -> 0.01
A110: =R[-1]C+1 -> 2 | B110: 100 | C110: =RC[-2]/RC[-1] -> 0.02 | D110: =RC3 -> 0.02 | E110: =RC3 -> 0.02 | F110: =RC3 -> 0.02 | G110: =RC3 -> 0.02 | H110: =RC3 -> 0.02 | I110: =RC3 -> 0.02 | J110: =RC3 -> 0.02 | K110: =RC3 -> 0.02 | L110: =RC3 -> 0.02 | M110: =RC[-10] -> 0.02
A111: =R[-1]C+1 -> 3 | B111: 100 | C111: =RC[-2]/RC[-1] -> 0.03 | D111: =RC3 -> 0.03 | E111: =RC3 -> 0.03 | F111: =RC3 -> 0.03 | G111: =RC3 -> 0.03 | H111: =RC3 -> 0.03 | I111: =RC3 -> 0.03 | J111: =RC3 -> 0.03 | K111: =RC3 -> 0.03 | L111: =RC3 -> 0.03 | M111: =RC[-10] -> 0.03
A112: =R[-1]C+1 -> 4 | B112: 100 | C112: =RC[-2]/RC[-1] -> 0.04 | D112: =RC3 -> 0.04 | E112: =RC3 -> 0.04 | F112: =RC3 -> 0.04 | G112: =RC3 -> 0.04 | H112: =RC3 -> 0.04 | I112: =RC3 -> 0.04 | J112: =RC3 -> 0.04 | K112: =RC3 -> 0.04 | L112: =RC3 -> 0.04 | M112: =RC[-10] -> 0.04
A113: =R[-1]C+1 -> 5 | B113: 100 | C113: =RC[-2]/RC[-1] -> 0.05 | D113: =RC3 -> 0.05 | E113: =RC3 -> 0.05 | F113: =RC3 -> 0.05 | G113: =RC3 -> 0.05 | H113: =RC3 -> 0.05 | I113: =RC3 -> 0.05 | J113: =RC3 -> 0.05 | K113: =RC3 -> 0.05 | L113: =RC3 -> 0.05 | M113: =RC[-10] -> 0.05
A114: =R[-1]C+1 -> 6 | B114: 100 | C114: =RC[-2]/RC[-1] -> 0.06 | D114: =RC3 -> 0.06 | E114: =RC3 -> 0.06 | F114: =RC3 -> 0.06 | G114: =RC3 -> 0.06 | H114: =RC3 -> 0.06 | I114: =RC3 -> 0.06 | J114: =RC3 -> 0.06 | K114: =RC3 -> 0.06 | L114: =RC3 -> 0.06 | M114: =RC[-10] -> 0.06
A115: =R[-1]C+1 -> 7 | B115: 100 | C115: =RC[-2]/RC[-1] -> 7.0000000000000007E-2 | D115: =RC3 -> 7.0000000000000007E-2 | E115: =RC3 -> 7.0000000000000007E-2 | F115: =RC3 -> 7.0000000000000007E-2 | G115: =RC3 -> 7.0000000000000007E-2 | H115: =RC3 -> 7.0000000000000007E-2 | I115: =RC3 -> 7.0000000000000007E-2 | J115: =RC3 -> 7.0000000000000007E-2 | K115: =RC3 -> 7.0000000000000007E-2 | L115: =RC3 -> 7.0000000000000007E-2 | M115: =RC[-10] -> 7.0000000000000007E-2
A116: =R[-1]C+1 -> 8 | B116: 100 | C116: =RC[-2]/RC[-1] -> 0.08 | D116: =RC3 -> 0.08 | E116: =RC3 -> 0.08 | F116: =RC3 -> 0.08 | G116: =RC3 -> 0.08 | H116: =RC3 -> 0.08 | I116: =RC3 -> 0.08 | J116: =RC3 -> 0.08 | K116: =RC3 -> 0.08 | L116: =RC3 -> 0.08 | M116: =RC[-10] -> 0.08
A117: =R[-1]C+1 -> 9 | B117: 100 | C117: =RC[-2]/RC[-1] -> 0.09 | D117: =RC3 -> 0.09 | E117: =RC3 -> 0.09 | F117: =RC3 -> 0.09 | G117: =RC3 -> 0.09 | H117: =RC3 -> 0.09 | I117: =RC3 -> 0.09 | J117: =RC3 -> 0.09 | K117: =RC3 -> 0.09 | L117: =RC3 -> 0.09 | M117: =RC[-10] -> 0.09
A118: =R[-1]C+1 -> 10 | B118: 100 | C118: =RC[-2]/RC[-1] -> 0.1 | D118: =RC3 -> 0.1 | E118: =RC3 -> 0.1 | F118: =RC3 -> 0.1 | G118: =RC3 -> 0.1 | H118: =RC3 -> 0.1 | I118: =RC3 -> 0.1 | J118: =RC3 -> 0.1 | K118: =RC3 -> 0.1 | L118: =RC3 -> 0.1 | M118: =RC[-10] -> 0.1
A119: =R[-1]C+1 -> 11 | B119: 100 | C119: =RC[-2]/RC[-1] -> 0.11 | D119: =RC3 -> 0.11 | E119: =RC3 -> 0.11 | F119: =RC3 -> 0.11 | G119: =RC3 -> 0.11 | H119: =RC3 -> 0.11 | I119: =RC3 -> 0.11 | J119: =RC3 -> 0.11 | K119: =RC3 -> 0.11 | L119: =RC3 -> 0.11 | M119: =RC[-10] -> 0.11
A120: =R[-1]C+1 -> 12 | B120: 100 | C120: =RC[-2]/RC[-1] -> 0.12 | D120: =RC3 -> 0.12 | E120: =RC3 -> 0.12 | F120: =RC3 -> 0.12 | G120: =RC3 -> 0.12 | H120: =RC3 -> 0.12 | I120: =RC3 -> 0.12 | J120: =RC3 -> 0.12 | K120: =RC3 -> 0.12 | L120: =RC3 -> 0.12 | M120: =RC[-10] -> 0.12
A121: =R[-1]C+1 -> 13 | B121: 100 | C121: =RC[-2]/RC[-1] -> 0.13 | D121: =RC3 -> 0.13 | E121: =RC3 -> 0.13 | F121: =RC3 -> 0.13 | G121: =RC3 -> 0.13 | H121: =RC3 -> 0.13 | I121: =RC3 -> 0.13 | J121: =RC3 -> 0.13 | K121: =RC3 -> 0.13 | L121: =RC3 -> 0.13 | M121: =RC[-10] -> 0.13
A122: =R[-1]C+1 -> 14 | B122: 100 | C122: =RC[-2]/RC[-1] -> 0.14000000000000001 | D122: =RC3 -> 0.14000000000000001 | E122: =RC3 -> 0.14000000000000001 | F122: =RC3 -> 0.14000000000000001 | G122: =RC3 -> 0.14000000000000001 | H122: =RC3 -> 0.14000000000000001 | I122: =RC3 -> 0.14000000000000001 | J122: =RC3 -> 0.14000000000000001 | K122: =RC3 -> 0.14000000000000001 | L122: =RC3 -> 0.14000000000000001 | M122: =RC[-10] -> 0.14000000000000001
A123: =R[-1]C+1 -> 15 | B123: 100 | C123: =RC[-2]/RC[-1] -> 0.15 | D123: =RC3 -> 0.15 | E123: =RC3 -> 0.15 | F123: =RC3 -> 0.15 | G123: =RC3 -> 0.15 | H123: =RC3 -> 0.15 | I123: =RC3 -> 0.15 | J123: =RC3 -> 0.15 | K123: =RC3 -> 0.15 | L123: =RC3 -> 0.15 | M123: =RC[-10] -> 0.15
A124: =R[-1]C+1 -> 16 | B124: 100 | C124: =RC[-2]/RC[-1] -> 0.16 | D124: =RC3 -> 0.16 | E124: =RC3 -> 0.16 | F124: =RC3 -> 0.16 | G124: =RC3 -> 0.16 | H124: =RC3 -> 0.16 | I124: =RC3 -> 0.16 | J124: =RC3 -> 0.16 | K124: =RC3 -> 0.16 | L124: =RC3 -> 0.16 | M124: =RC[-10] -> 0.16
A125: =R[-1]C+1 -> 17 | B125: 100 | C125: =RC[-2]/RC[-1] -> 0.17 | D125: =RC3 -> 0.17 | E125: =RC3 -> 0.17 | F125: =RC3 -> 0.17 | G125: =RC3 -> 0.17 | H125: =RC3 -> 0.17 | I125: =RC3 -> 0.17 | J125: =RC3 -> 0.17 | K125: =RC3 -> 0.17 | L125: =RC3 -> 0.17 | M125: =RC[-10] -> 0.17
A126: =R[-1]C+1 -> 18 | B126: 100 | C126: =RC[-2]/RC[-1] -> 0.18 | D126: =RC3 -> 0.18 | E126: =RC3 -> 0.18 | F126: =RC3 -> 0.18 | G126: =RC3 -> 0.18 | H126: =RC3 -> 0.18 | I126: =RC3 -> 0.18 | J126: =RC3 -> 0.18 | K126: =RC3 -> 0.18 | L126: =RC3 -> 0.18 | M126: =RC[-10] -> 0.18
A127: =R[-1]C+1 -> 19 | B127: 100 | C127: =RC[-2]/RC[-1] -> 0.19 | D127: =RC3 -> 0.19 | E127: =RC3 -> 0.19 | F127: =RC3 -> 0.19 | G127: =RC3 -> 0.19 | H127: =RC3 -> 0.19 | I127: =RC3 -> 0.19 | J127: =RC3 -> 0.19 | K127: =RC3 -> 0.19 | L127: =RC3 -> 0.19 | M127: =RC[-10] -> 0.19
A128: =R[-1]C+1 -> 20 | B128: 100 | C128: =RC[-2]/RC[-1] -> 0.2 | D128: =RC3 -> 0.2 | E128: =RC3 -> 0.2 | F128: =RC3 -> 0.2 | G128: =RC3 -> 0.2 | H128: =RC3 -> 0.2 | I128: =RC3 -> 0.2 | J128: =RC3 -> 0.2 | K128: =RC3 -> 0.2 | L128: =RC3 -> 0.2 | M128: =RC[-10] -> 0.2
A129: =R[-1]C+1 -> 21 | B129: 100 | C129: =RC[-2]/RC[-1] -> 0.21 | D129: =RC3 -> 0.21 | E129: =RC3 -> 0.21 | F129: =RC3 -> 0.21 | G129: =RC3 -> 0.21 | H129: =RC3 -> 0.21 | I129: =RC3 -> 0.21 | J129: =RC3 -> 0.21 | K129: =RC3 -> 0.21 | L129: =RC3 -> 0.21 | M129: =RC[-10] -> 0.21
A130: =R[-1]C+1 -> 22 | B130: 100 | C130: =RC[-2]/RC[-1] -> 0.22 | D130: =RC3 -> 0.22 | E130: =RC3 -> 0.22 | F130: =RC3 -> 0.22 | G130: =RC3 -> 0.22 | H130: =RC3 -> 0.22 | I130: =RC3 -> 0.22 | J130: =RC3 -> 0.22 | K130: =RC3 -> 0.22 | L130: =RC3 -> 0.22 | M130: =RC[-10] -> 0.22
A131: =R[-1]C+1 -> 23 | B131: 100 | C131: =RC[-2]/RC[-1] -> 0.23 | D131: =RC3 -> 0.23 | E131: =RC3 -> 0.23 | F131: =RC3 -> 0.23 | G131: =RC3 -> 0.23 | H131: =RC3 -> 0.23 | I131: =RC3 -> 0.23 | J131: =RC3 -> 0.23 | K131: =RC3 -> 0.23 | L131: =RC3 -> 0.23 | M131: =RC[-10] -> 0.23
A132: =R[-1]C+1 -> 24 | B132: 100 | C132: =RC[-2]/RC[-1] -> 0.24 | D132: =RC3 -> 0.24 | E132: =RC3 -> 0.24 | F132: =RC3 -> 0.24 | G132: =RC3 -> 0.24 | H132: =RC3 -> 0.24 | I132: =RC3 -> 0.24 | J132: =RC3 -> 0.24 | K132: =RC3 -> 0.24 | L132: =RC3 -> 0.24 | M132: =RC[-10] -> 0.24
A133: =R[-1]C+1 -> 25 | B133: 100 | C133: =RC[-2]/RC[-1] -> 0.25 | D133: =RC3 -> 0.25 | E133: =RC3 -> 0.25 | F133: =RC3 -> 0.25 | G133: =RC3 -> 0.25 | H133: =RC3 -> 0.25 | I133: =RC3 -> 0.25 | J133: =RC3 -> 0.25 | K133: =RC3 -> 0.25 | L133: =RC3 -> 0.25 | M133: =RC[-10] -> 0.25
A134: =R[-1]C+1 -> 26 | B134: 100 | C134: =RC[-2]/RC[-1] -> 0.26 | D134: =RC3 -> 0.26 | E134: =RC3 -> 0.26 | F134: =RC3 -> 0.26 | G134: =RC3 -> 0.26 | H134: =RC3 -> 0.26 | I134: =RC3 -> 0.26 | J134: =RC3 -> 0.26 | K134: =RC3 -> 0.26 | L134: =RC3 -> 0.26 | M134: =RC[-10] -> 0.26
A135: =R[-1]C+1 -> 27 | B135: 100 | C135: =RC[-2]/RC[-1] -> 0.27 | D135: =RC3 -> 0.27 | E135: =RC3 -> 0.27 | F135: =RC3 -> 0.27 | G135: =RC3 -> 0.27 | H135: =RC3 -> 0.27 | I135: =RC3 -> 0.27 | J135: =RC3 -> 0.27 | K135: =RC3 -> 0.27 | L135: =RC3 -> 0.27 | M135: =RC[-10] -> 0.27
A136: =R[-1]C+1 -> 28 | B136: 100 | C136: =RC[-2]/RC[-1] -> 0.28000000000000003 | D136: =RC3 -> 0.28000000000000003 | E136: =RC3 -> 0.28000000000000003 | F136: =RC3 -> 0.28000000000000003 | G136: =RC3 -> 0.28000000000000003 | H136: =RC3 -> 0.28000000000000003 | I136: =RC3 -> 0.28000000000000003 | J136: =RC3 -> 0.28000000000000003 | K136: =RC3 -> 0.28000000000000003 | L136: =RC3 -> 0.28000000000000003 | M136: =RC[-10] -> 0.28000000000000003
A137: =R[-1]C+1 -> 29 | B137: 100 | C137: =RC[-2]/RC[-1] -> 0.28999999999999998 | D137: =RC3 -> 0.28999999999999998 | E137: =RC3 -> 0.28999999999999998 | F137: =RC3 -> 0.28999999999999998 | G137: =RC3 -> 0.28999999999999998 | H137: =RC3 -> 0.28999999999999998 | I137: =RC3 -> 0.28999999999999998 | J137: =RC3 -> 0.28999999999999998 | K137: =RC3 -> 0.28999999999999998 | L137: =RC3 -> 0.28999999999999998 | M137: =RC[-10] -> 0.28999999999999998
A138: =R[-1]C+1 -> 30 | B138: 100 | C138: =RC[-2]/RC[-1] -> 0.3 | D138: =RC3 -> 0.3 | E138: =RC3 -> 0.3 | F138: =RC3 -> 0.3 | G138: =RC3 -> 0.3 | H138: =RC3 -> 0.3 | I138: =RC3 -> 0.3 | J138: =RC3 -> 0.3 | K138: =RC3 -> 0.3 | L138: =RC3 -> 0.3 | M138: =RC[-10] -> 0.3
A139: =R[-1]C+1 -> 31 | B139: 100 | C139: =RC[-2]/RC[-1] -> 0.31 | D139: =RC3 -> 0.31 | E139: =RC3 -> 0.31 | F139: =RC3 -> 0.31 | G139: =RC3 -> 0.31 | H139: =RC3 -> 0.31 | I139: =RC3 -> 0.31 | J139: =RC3 -> 0.31 | K139: =RC3 -> 0.31 | L139: =RC3 -> 0.31 | M139: =RC[-10] -> 0.31
A140: =R[-1]C+1 -> 32 | B140: 100 | C140: =RC[-2]/RC[-1] -> 0.32 | D140: =RC3 -> 0.32 | E140: =RC3 -> 0.32 | F140: =RC3 -> 0.32 | G140: =RC3 -> 0.32 | H140: =RC3 -> 0.32 | I140: =RC3 -> 0.32 | J140: =RC3 -> 0.32 | K140: =RC3 -> 0.32 | L140: =RC3 -> 0.32 | M140: =RC[-10] -> 0.32
A141: =R[-1]C+1 -> 33 | B141: 100 | C141: =RC[-2]/RC[-1] -> 0.33 | D141: =RC3 -> 0.33 | E141: =RC3 -> 0.33 | F141: =RC3 -> 0.33 | G141: =RC3 -> 0.33 | H141: =RC3 -> 0.33 | I141: =RC3 -> 0.33 | J141: =RC3 -> 0.33 | K141: =RC3 -> 0.33 | L141: =RC3 -> 0.33 | M141: =RC[-10] -> 0.33
A142: =R[-1]C+1 -> 34 | B142: 100 | C142: =RC[-2]/RC[-1] -> 0.34 | D142: =RC3 -> 0.34 | E142: =RC3 -> 0.34 | F142: =RC3 -> 0.34 | G142: =RC3 -> 0.34 | H142: =RC3 -> 0.34 | I142: =RC3 -> 0.34 | J142: =RC3 -> 0.34 | K142: =RC3 -> 0.34 | L142: =RC3 -> 0.34 | M142: =RC[-10] -> 0.34
A143: =R[-1]C+1 -> 35 | B143: 100 | C143: =RC[-2]/RC[-1] -> 0.35 | D143: =RC3 -> 0.35 | E143: =RC3 -> 0.35 | F143: =RC3 -> 0.35 | G143: =RC3 -> 0.35 | H143: =RC3 -> 0.35 | I143: =RC3 -> 0.35 | J143: =RC3 -> 0.35 | K143: =RC3 -> 0.35 | L143: =RC3 -> 0.35 | M143: =RC[-10] -> 0.35
A144: =R[-1]C+1 -> 36 | B144: 100 | C144: =RC[-2]/RC[-1] -> 0.36 | D144: =RC3 -> 0.36 | E144: =RC3 -> 0.36 | F144: =RC3 -> 0.36 | G144: =RC3 -> 0.36 | H144: =RC3 -> 0.36 | I144: =RC3 -> 0.36 | J144: =RC3 -> 0.36 | K144: =RC3 -> 0.36 | L144: =RC3 -> 0.36 | M144: =RC[-10] -> 0.36
A145: =R[-1]C+1 -> 37 | B145: 100 | C145: =RC[-2]/RC[-1] -> 0.37 | D145: =RC3 -> 0.37 | E145: =RC3 -> 0.37 | F145: =RC3 -> 0.37 | G145: =RC3 -> 0.37 | H145: =RC3 -> 0.37 | I145: =RC3 -> 0.37 | J145: =RC3 -> 0.37 | K145: =RC3 -> 0.37 | L145: =RC3 -> 0.37 | M145: =RC[-10] -> 0.37
A146: =R[-1]C+1 -> 38 | B146: 100 | C146: =RC[-2]/RC[-1] -> 0.38 | D146: =RC3 -> 0.38 | E146: =RC3 -> 0.38 | F146: =RC3 -> 0.38 | G146: =RC3 -> 0.38 | H146: =RC3 -> 0.38 | I146: =RC3 -> 0.38 | J146: =RC3 -> 0.38 | K146: =RC3 -> 0.38 | L146: =RC3 -> 0.38 | M146: =RC[-10] -> 0.38
A147: =R[-1]C+1 -> 39 | B147: 100 | C147: =RC[-2]/RC[-1] -> 0.39 | D147: =RC3 -> 0.39 | E147: =RC3 -> 0.39 | F147: =RC3 -> 0.39 | G147: =RC3 -> 0.39 | H147: =RC3 -> 0.39 | I147: =RC3 -> 0.39 | J147: =RC3 -> 0.39 | K147: =RC3 -> 0.39 | L147: =RC3 -> 0.39 | M147: =RC[-10] -> 0.39
A148: =R[-1]C+1 -> 40 | B148: 100 | C148: =RC[-2]/RC[-1] -> 0.4 | D148: =RC3 -> 0.4 | E148: =RC3 -> 0.4 | F148: =RC3 -> 0.4 | G148: =RC3 -> 0.4 | H148: =RC3 -> 0.4 | I148: =RC3 -> 0.4 | J148: =RC3 -> 0.4 | K148: =RC3 -> 0.4 | L148: =RC3 -> 0.4 | M148: =RC[-10] -> 0.4
A149: =R[-1]C+1 -> 41 | B149: 100 | C149: =RC[-2]/RC[-1] -> 0.41 | D149: =RC3 -> 0.41 | E149: =RC3 -> 0.41 | F149: =RC3 -> 0.41 | G149: =RC3 -> 0.41 | H149: =RC3 -> 0.41 | I149: =RC3 -> 0.41 | J149: =RC3 -> 0.41 | K149: =RC3 -> 0.41 | L149: =RC3 -> 0.41 | M149: =RC[-10] -> 0.41
A150: =R[-1]C+1 -> 42 | B150: 100 | C150: =RC[-2]/RC[-1] -> 0.42 | D150: =RC3 -> 0.42 | E150: =RC3 -> 0.42 | F150: =RC3 -> 0.42 | G150: =RC3 -> 0.42 | H150: =RC3 -> 0.42 | I150: =RC3 -> 0.42 | J150: =RC3 -> 0.42 | K150: =RC3 -> 0.42 | L150: =RC3 -> 0.42 | M150: =RC[-10] -> 0.42
A151: =R[-1]C+1 -> 43 | B151: 100 | C151: =RC[-2]/RC[-1] -> 0.43 | D151: =RC3 -> 0.43 | E151: =RC3 -> 0.43 | F151: =RC3 -> 0.43 | G151: =RC3 -> 0.43 | H151: =RC3 -> 0.43 | I151: =RC3 -> 0.43 | J151: =RC3 -> 0.43 | K151: =RC3 -> 0.43 | L151: =RC3 -> 0.43 | M151: =RC[-10] -> 0.43
A152: =R[-1]C+1 -> 44 | B152: 100 | C152: =RC[-2]/RC[-1] -> 0.44 | D152: =RC3 -> 0.44 | E152: =RC3 -> 0.44 | F152: =RC3 -> 0.44 | G152: =RC3 -> 0.44 | H152: =RC3 -> 0.44 | I152: =RC3 -> 0.44 | J152: =RC3 -> 0.44 | K152: =RC3 -> 0.44 | L152: =RC3 -> 0.44 | M152: =RC[-10] -> 0.44
A153: =R[-1]C+1 -> 45 | B153: 100 | C153: =RC[-2]/RC[-1] -> 0.45 | D153: =RC3 -> 0.45 | E153: =RC3 -> 0.45 | F153: =RC3 -> 0.45 | G153: =RC3 -> 0.45 | H153: =RC3 -> 0.45 | I153: =RC3 -> 0.45 | J153: =RC3 -> 0.45 | K153: =RC3 -> 0.45 | L153: =RC3 -> 0.45 | M153: =RC[-10] -> 0.45
A154: =R[-1]C+1 -> 46 | B154: 100 | C154: =RC[-2]/RC[-1] -> 0.46 | D154: =RC3 -> 0.46 | E154: =RC3 -> 0.46 | F154: =RC3 -> 0.46 | G154: =RC3 -> 0.46 | H154: =RC3 -> 0.46 | I154: =RC3 -> 0.46 | J154: =RC3 -> 0.46 | K154: =RC3 -> 0.46 | L154: =RC3 -> 0.46 | M154: =RC[-10] -> 0.46
A155: =R[-1]C+1 -> 47 | B155: 100 | C155: =RC[-2]/RC[-1] -> 0.47 | D155: =RC3 -> 0.47 | E155: =RC3 -> 0.47 | F155: =RC3 -> 0.47 | G155: =RC3 -> 0.47 | H155: =RC3 -> 0.47 | I155: =RC3 -> 0.47 | J155: =RC3 -> 0.47 | K155: =RC3 -> 0.47 | L155: =RC3 -> 0.47 | M155: =RC[-10] -> 0.47
A156: =R[-1]C+1 -> 48 | B156: 100 | C156: =RC[-2]/RC[-1] -> 0.48 | D156: =RC3 -> 0.48 | E156: =RC3 -> 0.48 | F156: =RC3 -> 0.48 | G156: =RC3 -> 0.48 | H156: =RC3 -> 0.48 | I156: =RC3 -> 0.48 | J156: =RC3 -> 0.48 | K156: =RC3 -> 0.48 | L156: =RC3 -> 0.48 | M156: =RC[-10] -> 0.48
A157: =R[-1]C+1 -> 49 | B157: 100 | C157: =RC[-2]/RC[-1] -> 0.49 | D157: =RC3 -> 0.49 | E157: =RC3 -> 0.49 | F157: =RC3 -> 0.49 | G157: =RC3 -> 0.49 | H157: =RC3 -> 0.49 | I157: =RC3 -> 0.49 | J157: =RC3 -> 0.49 | K157: =RC3 -> 0.49 | L157: =RC3 -> 0.49 | M157: =RC[-10] -> 0.49
A158: =R[-1]C+1 -> 50 | B158: 100 | C158: =RC[-2]/RC[-1] -> 0.5 | D158: =RC3 -> 0.5 | E158: =RC3 -> 0.5 | F158: =RC3 -> 0.5 | G158: =RC3 -> 0.5 | H158: =RC3 -> 0.5 | I158: =RC3 -> 0.5 | J158: =RC3 -> 0.5 | K158: =RC3 -> 0.5 | L158: =RC3 -> 0.5 | M158: =RC[-10] -> 0.5
A159: =R[-1]C+1 -> 51 | B159: 100 | C159: =RC[-2]/RC[-1] -> 0.51 | D159: =RC3 -> 0.51 | E159: =RC3 -> 0.51 | F159: =RC3 -> 0.51 | G159: =RC3 -> 0.51 | H159: =RC3 -> 0.51 | I159: =RC3 -> 0.51 | J159: =RC3 -> 0.51 | K159: =RC3 -> 0.51 | L159: =RC3 -> 0.51 | M159: =RC[-10] -> 0.51
A160: =R[-1]C+1 -> 52 | B160: 100 | C160: =RC[-2]/RC[-1] -> 0.52 | D160: =RC3 -> 0.52 | E160: =RC3 -> 0.52 | F160: =RC3 -> 0.52 | G160: =RC3 -> 0.52 | H160: =RC3 -> 0.52 | I160: =RC3 -> 0.52 | J160: =RC3 -> 0.52 | K160: =RC3 -> 0.52 | L160: =RC3 -> 0.52 | M160: =RC[-10] -> 0.52
A161: =R[-1]C+1 -> 53 | B161: 100 | C161: =RC[-2]/RC[-1] -> 0.53 | D161: =RC3 -> 0.53 | E161: =RC3 -> 0.53 | F161: =RC3 -> 0.53 | G161: =RC3 -> 0.53 | H161: =RC3 -> 0.53 | I161: =RC3 -> 0.53 | J161: =RC3 -> 0.53 | K161: =RC3 -> 0.53 | L161: =RC3 -> 0.53 | M161: =RC[-10] -> 0.53
A162: =R[-1]C+1 -> 54 | B162: 100 | C162: =RC[-2]/RC[-1] -> 0.54 | D162: =RC3 -> 0.54 | E162: =RC3 -> 0.54 | F162: =RC3 -> 0.54 | G162: =RC3 -> 0.54 | H162: =RC3 -> 0.54 | I162: =RC3 -> 0.54 | J162: =RC3 -> 0.54 | K162: =RC3 -> 0.54 | L162: =RC3 -> 0.54 | M162: =RC[-10] -> 0.54
A163: =R[-1]C+1 -> 55 | B163: 100 | C163: =RC[-2]/RC[-1] -> 0.55000000000000004 | D163: =RC3 -> 0.55000000000000004 | E163: =RC3 -> 0.55000000000000004 | F163: =RC3 -> 0.55000000000000004 | G163: =RC3 -> 0.55000000000000004 | H163: =RC3 -> 0.55000000000000004 | I163: =RC3 -> 0.55000000000000004 | J163: =RC3 -> 0.55000000000000004 | K163: =RC3 -> 0.55000000000000004 | L163: =RC3 -> 0.55000000000000004 | M163: =RC[-10] -> 0.55000000000000004
A164: =R[-1]C+1 -> 56 | B164: 100 | C164: =RC[-2]/RC[-1] -> 0.56000000000000005 | D164: =RC3 -> 0.56000000000000005 | E164: =RC3 -> 0.56000000000000005 | F164: =RC3 -> 0.56000000000000005 | G164: =RC3 -> 0.56000000000000005 | H164: =RC3 -> 0.56000000000000005 | I164: =RC3 -> 0.56000000000000005 | J164: =RC3 -> 0.56000000000000005 | K164: =RC3 -> 0.56000000000000005 | L164: =RC3 -> 0.56000000000000005 | M164: =RC[-10] -> 0.56000000000000005
A165: =R[-1]C+1 -> 57 | B165: 100 | C165: =RC[-2]/RC[-1] -> 0.56999999999999995 | D165: =RC3 -> 0.56999999999999995 | E165: =RC3 -> 0.56999999999999995 | F165: =RC3 -> 0.56999999999999995 | G165: =RC3 -> 0.56999999999999995 | H165: =RC3 -> 0.56999999999999995 | I165: =RC3 -> 0.56999999999999995 | J165: =RC3 -> 0.56999999999999995 | K165: =RC3 -> 0.56999999999999995 | L165: =RC3 -> 0.56999999999999995 | M165: =RC[-10] -> 0.56999999999999995
A166: =R[-1]C+1 -> 58 | B166: 100 | C166: =RC[-2]/RC[-1] -> 0.57999999999999996 | D166: =RC3 -> 0.57999999999999996 | E166: =RC3 -> 0.57999999999999996 | F166: =RC3 -> 0.57999999999999996 | G166: =RC3 -> 0.57999999999999996 | H166: =RC3 -> 0.57999999999999996 | I166: =RC3 -> 0.57999999999999996 | J166: =RC3 -> 0.57999999999999996 | K166: =RC3 -> 0.57999999999999996 | L166: =RC3 -> 0.57999999999999996 | M166: =RC[-10] -> 0.57999999999999996
A167: =R[-1]C+1 -> 59 | B167: 100 | C167: =RC[-2]/RC[-1] -> 0.59 | D167: =RC3 -> 0.59 | E167: =RC3 -> 0.59 | F167: =RC3 -> 0.59 | G167: =RC3 -> 0.59 | H167: =RC3 -> 0.59 | I167: =RC3 -> 0.59 | J167: =RC3 -> 0.59 | K167: =RC3 -> 0.59 | L167: =RC3 -> 0.59 | M167: =RC[-10] -> 0.59
A168: =R[-1]C+1 -> 60 | B168: 100 | C168: =RC[-2]/RC[-1] -> 0.6 | D168: =RC3 -> 0.6 | E168: =RC3 -> 0.6 | F168: =RC3 -> 0.6 | G168: =RC3 -> 0.6 | H168: =RC3 -> 0.6 | I168: =RC3 -> 0.6 | J168: =RC3 -> 0.6 | K168: =RC3 -> 0.6 | L168: =RC3 -> 0.6 | M168: =RC[-10] -> 0.6
A169: =R[-1]C+1 -> 61 | B169: 100 | C169: =RC[-2]/RC[-1] -> 0.61 | D169: =RC3 -> 0.61 | E169: =RC3 -> 0.61 | F169: =RC3 -> 0.61 | G169: =RC3 -> 0.61 | H169: =RC3 -> 0.61 | I169: =RC3 -> 0.61 | J169: =RC3 -> 0.61 | K169: =RC3 -> 0.61 | L169: =RC3 -> 0.61 | M169: =RC[-10] -> 0.61
A170: =R[-1]C+1 -> 62 | B170: 100 | C170: =RC[-2]/RC[-1] -> 0.62 | D170: =RC3 -> 0.62 | E170: =RC3 -> 0.62 | F170: =RC3 -> 0.62 | G170: =RC3 -> 0.62 | H170: =RC3 -> 0.62 | I170: =RC3 -> 0.62 | J170: =RC3 -> 0.62 | K170: =RC3 -> 0.62 | L170: =RC3 -> 0.62 | M170: =RC[-10] -> 0.62
A171: =R[-1]C+1 -> 63 | B171: 100 | C171: =RC[-2]/RC[-1] -> 0.63 | D171: =RC3 -> 0.63 | E171: =RC3 -> 0.63 | F171: =RC3 -> 0.63 | G171: =RC3 -> 0.63 | H171: =RC3 -> 0.63 | I171: =RC3 -> 0.63 | J171: =RC3 -> 0.63 | K171: =RC3 -> 0.63 | L171: =RC3 -> 0.63 | M171: =RC[-10] -> 0.63
A172: =R[-1]C+1 -> 64 | B172: 100 | C172: =RC[-2]/RC[-1] -> 0.64 | D172: =RC3 -> 0.64 | E172: =RC3 -> 0.64 | F172: =RC3 -> 0.64 | G172: =RC3 -> 0.64 | H172: =RC3 -> 0.64 | I172: =RC3 -> 0.64 | J172: =RC3 -> 0.64 | K172: =RC3 -> 0.64 | L172: =RC3 -> 0.64 | M172: =RC[-10] -> 0.64
A173: =R[-1]C+1 -> 65 | B173: 100 | C173: =RC[-2]/RC[-1] -> 0.65 | D173: =RC3 -> 0.65 | E173: =RC3 -> 0.65 | F173: =RC3 -> 0.65 | G173: =RC3 -> 0.65 | H173: =RC3 -> 0.65 | I173: =RC3 -> 0.65 | J173: =RC3 -> 0.65 | K173: =RC3 -> 0.65 | L173: =RC3 -> 0.65 | M173: =RC[-10] -> 0.65
A174: =R[-1]C+1 -> 66 | B174: 100 | C174: =RC[-2]/RC[-1] -> 0.66 | D174: =RC3 -> 0.66 | E174: =RC3 -> 0.66 | F174: =RC3 -> 0.66 | G174: =RC3 -> 0.66 | H174: =RC3 -> 0.66 | I174: =RC3 -> 0.66 | J174: =RC3 -> 0.66 | K174: =RC3 -> 0.66 | L174: =RC3 -> 0.66 | M174: =RC[-10] -> 0.66
A175: =R[-1]C+1 -> 67 | B175: 100 | C175: =RC[-2]/RC[-1] -> 0.67 | D175: =RC3 -> 0.67 | E175: =RC3 -> 0.67 | F175: =RC3 -> 0.67 | G175: =RC3 -> 0.67 | H175: =RC3 -> 0.67 | I175: =RC3 -> 0.67 | J175: =RC3 -> 0.67 | K175: =RC3 -> 0.67 | L175: =RC3 -> 0.67 | M175: =RC[-10] -> 0.67
A176: =R[-1]C+1 -> 68 | B176: 100 | C176: =RC[-2]/RC[-1] -> 0.68 | D176: =RC3 -> 0.68 | E176: =RC3 -> 0.68 | F176: =RC3 -> 0.68 | G176: =RC3 -> 0.68 | H176: =RC3 -> 0.68 | I176: =RC3 -> 0.68 | J176: =RC3 -> 0.68 | K176: =RC3 -> 0.68 | L176: =RC3 -> 0.68 | M176: =RC[-10] -> 0.68
A177: =R[-1]C+1 -> 69 | B177: 100 | C177: =RC[-2]/RC[-1] -> 0.69 | D177: =RC3 -> 0.69 | E177: =RC3 -> 0.69 | F177: =RC3 -> 0.69 | G177: =RC3 -> 0.69 | H177: =RC3 -> 0.69 | I177: =RC3 -> 0.69 | J177: =RC3 -> 0.69 | K177: =RC3 -> 0.69 | L177: =RC3 -> 0.69 | M177: =RC[-10] -> 0.69
A178: =R[-1]C+1 -> 70 | B178: 100 | C178: =RC[-2]/RC[-1] -> 0.7 | D178: =RC3 -> 0.7 | E178: =RC3 -> 0.7 | F178: =RC3 -> 0.7 | G178: =RC3 -> 0.7 | H178: =RC3 -> 0.7 | I178: =RC3 -> 0.7 | J178: =RC3 -> 0.7 | K178: =RC3 -> 0.7 | L178: =RC3 -> 0.7 | M178: =RC[-10] -> 0.7
A179: =R[-1]C+1 -> 71 | B179: 100 | C179: =RC[-2]/RC[-1] -> 0.71 | D179: =RC3 -> 0.71 | E179: =RC3 -> 0.71 | F179: =RC3 -> 0.71 | G179: =RC3 -> 0.71 | H179: =RC3 -> 0.71 | I179: =RC3 -> 0.71 | J179: =RC3 -> 0.71 | K179: =RC3 -> 0.71 | L179: =RC3 -> 0.71 | M179: =RC[-10] -> 0.71
A180: =R[-1]C+1 -> 72 | B180: 100 | C180: =RC[-2]/RC[-1] -> 0.72 | D180: =RC3 -> 0.72 | E180: =RC3 -> 0.72 | F180: =RC3 -> 0.72 | G180: =RC3 -> 0.72 | H180: =RC3 -> 0.72 | I180: =RC3 -> 0.72 | J180: =RC3 -> 0.72 | K180: =RC3 -> 0.72 | L180: =RC3 -> 0.72 | M180: =RC[-10] -> 0.72
A181: =R[-1]C+1 -> 73 | B181: 100 | C181: =RC[-2]/RC[-1] -> 0.73 | D181: =RC3 -> 0.73 | E181: =RC3 -> 0.73 | F181: =RC3 -> 0.73 | G181: =RC3 -> 0.73 | H181: =RC3 -> 0.73 | I181: =RC3 -> 0.73 | J181: =RC3 -> 0.73 | K181: =RC3 -> 0.73 | L181: =RC3 -> 0.73 | M181: =RC[-10] -> 0.73
A182: =R[-1]C+1 -> 74 | B182: 100 | C182: =RC[-2]/RC[-1] -> 0.74 | D182: =RC3 -> 0.74 | E182: =RC3 -> 0.74 | F182: =RC3 -> 0.74 | G182: =RC3 -> 0.74 | H182: =RC3 -> 0.74 | I182: =RC3 -> 0.74 | J182: =RC3 -> 0.74 | K182: =RC3 -> 0.74 | L182: =RC3 -> 0.74 | M182: =RC[-10] -> 0.74
A183: =R[-1]C+1 -> 75 | B183: 100 | C183: =RC[-2]/RC[-1] -> 0.75 | D183: =RC3 -> 0.75 | E183: =RC3 -> 0.75 | F183: =RC3 -> 0.75 | G183: =RC3 -> 0.75 | H183: =RC3 -> 0.75 | I183: =RC3 -> 0.75 | J183: =RC3 -> 0.75 | K183: =RC3 -> 0.75 | L183: =RC3 -> 0.75 | M183: =RC[-10] -> 0.75
A184: =R[-1]C+1 -> 76 | B184: 100 | C184: =RC[-2]/RC[-1] -> 0.76 | D184: =RC3 -> 0.76 | E184: =RC3 -> 0.76 | F184: =RC3 -> 0.76 | G184: =RC3 -> 0.76 | H184: =RC3 -> 0.76 | I184: =RC3 -> 0.76 | J184: =RC3 -> 0.76 | K184: =RC3 -> 0.76 | L184: =RC3 -> 0.76 | M184: =RC[-10] -> 0.76
A185: =R[-1]C+1 -> 77 | B185: 100 | C185: =RC[-2]/RC[-1] -> 0.77 | D185: =RC3 -> 0.77 | E185: =RC3 -> 0.77 | F185: =RC3 -> 0.77 | G185: =RC3 -> 0.77 | H185: =RC3 -> 0.77 | I185: =RC3 -> 0.77 | J185: =RC3 -> 0.77 | K185: =RC3 -> 0.77 | L185: =RC3 -> 0.77 | M185: =RC[-10] -> 0.77
A186: =R[-1]C+1 -> 78 | B186: 100 | C186: =RC[-2]/RC[-1] -> 0.78 | D186: =RC3 -> 0.78 | E186: =RC3 -> 0.78 | F186: =RC3 -> 0.78 | G186: =RC3 -> 0.78 | H186: =RC3 -> 0.78 | I186: =RC3 -> 0.78 | J186: =RC3 -> 0.78 | K186: =RC3 -> 0.78 | L186: =RC3 -> 0.78 | M186: =RC[-10] -> 0.78
A187: =R[-1]C+1 -> 79 | B187: 100 | C187: =RC[-2]/RC[-1] -> 0.79 | D187: =RC3 -> 0.79 | E187: =RC3 -> 0.79 | F187: =RC3 -> 0.79 | G187: =RC3 -> 0.79 | H187: =RC3 -> 0.79 | I187: =RC3 -> 0.79 | J187: =RC3 -> 0.79 | K187: =RC3 -> 0.79 | L187: =RC3 -> 0.79 | M187: =RC[-10] -> 0.79
A188: =R[-1]C+1 -> 80 | B188: 100 | C188: =RC[-2]/RC[-1] -> 0.8 | D188: =RC3 -> 0.8 | E188: =RC3 -> 0.8 | F188: =RC3 -> 0.8 | G188: =RC3 -> 0.8 | H188: =RC3 -> 0.8 | I188: =RC3 -> 0.8 | J188: =RC3 -> 0.8 | K188: =RC3 -> 0.8 | L188: =RC3 -> 0.8 | M188: =RC[-10] -> 0.8
A189: =R[-1]C+1 -> 81 | B189: 100 | C189: =RC[-2]/RC[-1] -> 0.81 | D189: =RC3 -> 0.81 | E189: =RC3 -> 0.81 | F189: =RC3 -> 0.81 | G189: =RC3 -> 0.81 | H189: =RC3 -> 0.81 | I189: =RC3 -> 0.81 | J189: =RC3 -> 0.81 | K189: =RC3 -> 0.81 | L189: =RC3 -> 0.81 | M189: =RC[-10] -> 0.81
A190: =R[-1]C+1 -> 82 | B190: 100 | C190: =RC[-2]/RC[-1] -> 0.82 | D190: =RC3 -> 0.82 | E190: =RC3 -> 0.82 | F190: =RC3 -> 0.82 | G190: =RC3 -> 0.82 | H190: =RC3 -> 0.82 | I190: =RC3 -> 0.82 | J190: =RC3 -> 0.82 | K190: =RC3 -> 0.82 | L190: =RC3 -> 0.82 | M190: =RC[-10] -> 0.82
A191: =R[-1]C+1 -> 83 | B191: 100 | C191: =RC[-2]/RC[-1] -> 0.83 | D191: =RC3 -> 0.83 | E191: =RC3 -> 0.83 | F191: =RC3 -> 0.83 | G191: =RC3 -> 0.83 | H191: =RC3 -> 0.83 | I191: =RC3 -> 0.83 | J191: =RC3 -> 0.83 | K191: =RC3 -> 0.83 | L191: =RC3 -> 0.83 | M191: =RC[-10] -> 0.83
A192: =R[-1]C+1 -> 84 | B192: 100 | C192: =RC[-2]/RC[-1] -> 0.84 | D192: =RC3 -> 0.84 | E192: =RC3 -> 0.84 | F192: =RC3 -> 0.84 | G192: =RC3 -> 0.84 | H192: =RC3 -> 0.84 | I192: =RC3 -> 0.84 | J192: =RC3 -> 0.84 | K192: =RC3 -> 0.84 | L192: =RC3 -> 0.84 | M192: =RC[-10] -> 0.84
A193: =R[-1]C+1 -> 85 | B193: 100 | C193: =RC[-2]/RC[-1] -> 0.85 | D193: =RC3 -> 0.85 | E193: =RC3 -> 0.85 | F193: =RC3 -> 0.85 | G193: =RC3 -> 0.85 | H193: =RC3 -> 0.85 | I193: =RC3 -> 0.85 | J193: =RC3 -> 0.85 | K193: =RC3 -> 0.85 | L193: =RC3 -> 0.85 | M193: =RC[-10] -> 0.85
A194: =R[-1]C+1 -> 86 | B194: 100 | C194: =RC[-2]/RC[-1] -> 0.86 | D194: =RC3 -> 0.86 | E194: =RC3 -> 0.86 | F194: =RC3 -> 0.86 | G194: =RC3 -> 0.86 | H194: =RC3 -> 0.86 | I194: =RC3 -> 0.86 | J194: =RC3 -> 0.86 | K194: =RC3 -> 0.86 | L194: =RC3 -> 0.86 | M194: =RC[-10] -> 0.86
A195: =R[-1]C+1 -> 87 | B195: 100 | C195: =RC[-2]/RC[-1] -> 0.87 | D195: =RC3 -> 0.87 | E195: =RC3 -> 0.87 | F195: =RC3 -> 0.87 | G195: =RC3 -> 0.87 | H195: =RC3 -> 0.87 | I195: =RC3 -> 0.87 | J195: =RC3 -> 0.87 | K195: =RC3 -> 0.87 | L195: =RC3 -> 0.87 | M195: =RC[-10] -> 0.87
A196: =R[-1]C+1 -> 88 | B196: 100 | C196: =RC[-2]/RC[-1] -> 0.88 | D196: =RC3 -> 0.88 | E196: =RC3 -> 0.88 | F196: =RC3 -> 0.88 | G196: =RC3 -> 0.88 | H196: =RC3 -> 0.88 | I196: =RC3 -> 0.88 | J196: =RC3 -> 0.88 | K196: =RC3 -> 0.88 | L196: =RC3 -> 0.88 | M196: =RC[-10] -> 0.88
A197: =R[-1]C+1 -> 89 | B197: 100 | C197: =RC[-2]/RC[-1] -> 0.89 | D197: =RC3 -> 0.89 | E197: =RC3 -> 0.89 | F197: =RC3 -> 0.89 | G197: =RC3 -> 0.89 | H197: =RC3 -> 0.89 | I197: =RC3 -> 0.89 | J197: =RC3 -> 0.89 | K197: =RC3 -> 0.89 | L197: =RC3 -> 0.89 | M197: =RC[-10] -> 0.89
A198: =R[-1]C+1 -> 90 | B198: 100 | C198: =RC[-2]/RC[-1] -> 0.9 | D198: =RC3 -> 0.9 | E198: =RC3 -> 0.9 | F198: =RC3 -> 0.9 | G198: =RC3 -> 0.9 | H198: =RC3 -> 0.9 | I198: =RC3 -> 0.9 | J198: =RC3 -> 0.9 | K198: =RC3 -> 0.9 | L198: =RC3 -> 0.9 | M198: =RC[-10] -> 0.9
A199: =R[-1]C+1 -> 91 | B199: 100 | C199: =RC[-2]/RC[-1] -> 0.91 | D199: =RC3 -> 0.91 | E199: =RC3 -> 0.91 | F199: =RC3 -> 0.91 | G199: =RC3 -> 0.91 | H199: =RC3 -> 0.91 | I199: =RC3 -> 0.91 | J199: =RC3 -> 0.91 | K199: =RC3 -> 0.91 | L199: =RC3 -> 0.91 | M199: =RC[-10] -> 0.91
A200: =R[-1]C+1 -> 92 | B200: 100 | C200: =RC[-2]/RC[-1] -> 0.92 | D200: =RC3 -> 0.92 | E200: =RC3 -> 0.92 | F200: =RC3 -> 0.92 | G200: =RC3 -> 0.92 | H200: =RC3 -> 0.92 | I200: =RC3 -> 0.92 | J200: =RC3 -> 0.92 | K200: =RC3 -> 0.92 | L200: =RC3 -> 0.92 | M200: =RC[-10] -> 0.92
A201: =R[-1]C+1 -> 93 | B201: 100 | C201: =RC[-2]/RC[-1] -> 0.93 | D201: =RC3 -> 0.93 | E201: =RC3 -> 0.93 | F201: =RC3 -> 0.93 | G201: =RC3 -> 0.93 | H201: =RC3 -> 0.93 | I201: =RC3 -> 0.93 | J201: =RC3 -> 0.93 | K201: =RC3 -> 0.93 | L201: =RC3 -> 0.93 | M201: =RC[-10] -> 0.93
A202: =R[-1]C+1 -> 94 | B202: 100 | C202: =RC[-2]/RC[-1] -> 0.94 | D202: =RC3 -> 0.94 | E202: =RC3 -> 0.94 | F202: =RC3 -> 0.94 | G202: =RC3 -> 0.94 | H202: =RC3 -> 0.94 | I202: =RC3 -> 0.94 | J202: =RC3 -> 0.94 | K202: =RC3 -> 0.94 | L202: =RC3 -> 0.94 | M202: =RC[-10] -> 0.94
A203: =R[-1]C+1 -> 95 | B203: 100 | C203: =RC[-2]/RC[-1] -> 0.95 | D203: =RC3 -> 0.95 | E203: =RC3 -> 0.95 | F203: =RC3 -> 0.95 | G203: =RC3 -> 0.95 | H203: =RC3 -> 0.95 | I203: =RC3 -> 0.95 | J203: =RC3 -> 0.95 | K203: =RC3 -> 0.95 | L203: =RC3 -> 0.95 | M203: =RC[-10] -> 0.95
A204: =R[-1]C+1 -> 96 | B204: 100 | C204: =RC[-2]/RC[-1] -> 0.96 | D204: =RC3 -> 0.96 | E204: =RC3 -> 0.96 | F204: =RC3 -> 0.96 | G204: =RC3 -> 0.96 | H204: =RC3 -> 0.96 | I204: =RC3 -> 0.96 | J204: =RC3 -> 0.96 | K204: =RC3 -> 0.96 | L204: =RC3 -> 0.96 | M204: =RC[-10] -> 0.96
A205: =R[-1]C+1 -> 97 | B205: 100 | C205: =RC[-2]/RC[-1] -> 0.97 | D205: =RC3 -> 0.97 | E205: =RC3 -> 0.97 | F205: =RC3 -> 0.97 | G205: =RC3 -> 0.97 | H205: =RC3 -> 0.97 | I205: =RC3 -> 0.97 | J205: =RC3 -> 0.97 | K205: =RC3 -> 0.97 | L205: =RC3 -> 0.97 | M205: =RC[-10] -> 0.97
A206: =R[-1]C+1 -> 98 | B206: 100 | C206: =RC[-2]/RC[-1] -> 0.98 | D206: =RC3 -> 0.98 | E206: =RC3 -> 0.98 | F206: =RC3 -> 0.98 | G206: =RC3 -> 0.98 | H206: =RC3 -> 0.98 | I206: =RC3 -> 0.98 | J206: =RC3 -> 0.98 | K206: =RC3 -> 0.98 | L206: =RC3 -> 0.98 | M206: =RC[-10] -> 0.98
A207: =R[-1]C+1 -> 99 | B207: 100 | C207: =RC[-2]/RC[-1] -> 0.99 | D207: =RC3 -> 0.99 | E207: =RC3 -> 0.99 | F207: =RC3 -> 0.99 | G207: =RC3 -> 0.99 | H207: =RC3 -> 0.99 | I207: =RC3 -> 0.99 | J207: =RC3 -> 0.99 | K207: =RC3 -> 0.99 | L207: =RC3 -> 0.99 | M207: =RC[-10] -> 0.99
A208: =R[-1]C+1 -> 100 | B208: 100 | C208: =RC[-2]/RC[-1] -> 1 | D208: =RC3 -> 1 | E208: =RC3 -> 1 | F208: =RC3 -> 1 | G208: =RC3 -> 1 | H208: =RC3 -> 1 | I208: =RC3 -> 1 | J208: =RC3 -> 1 | K208: =RC3 -> 1 | L208: =RC3 -> 1 | M208: =RC[-10] -> 1
A209: =R[-1]C+1 -> 101 | B209: 100 | C209: =RC[-2]/RC[-1] -> 1.01 | D209: =RC3 -> 1.01 | E209: =RC3 -> 1.01 | F209: =RC3 -> 1.01 | G209: =RC3 -> 1.01 | H209: =RC3 -> 1.01 | I209: =RC3 -> 1.01 | J209: =RC3 -> 1.01 | K209: =RC3 -> 1.01 | L209: =RC3 -> 1.01 | M209: =RC[-10] -> 1.01
A210: =R[-1]C+1 -> 102 | B210: 100 | C210: =RC[-2]/RC[-1] -> 1.02 | D210: =RC3 -> 1.02 | E210: =RC3 -> 1.02 | F210: =RC3 -> 1.02 | G210: =RC3 -> 1.02 | H210: =RC3 -> 1.02 | I210: =RC3 -> 1.02 | J210: =RC3 -> 1.02 | K210: =RC3 -> 1.02 | L210: =RC3 -> 1.02 | M210: =RC[-10] -> 1.02
A211: =R[-1]C+1 -> 103 | B211: 100 | C211: =RC[-2]/RC[-1] -> 1.03 | D211: =RC3 -> 1.03 | E211: =RC3 -> 1.03 | F211: =RC3 -> 1.03 | G211: =RC3 -> 1.03 | H211: =RC3 -> 1.03 | I211: =RC3 -> 1.03 | J211: =RC3 -> 1.03 | K211: =RC3 -> 1.03 | L211: =RC3 -> 1.03 | M211: =RC[-10] -> 1.03
A212: =R[-1]C+1 -> 104 | B212: 100 | C212: =RC[-2]/RC[-1] -> 1.04 | D212: =RC3 -> 1.04 | E212: =RC3 -> 1.04 | F212: =RC3 -> 1.04 | G212: =RC3 -> 1.04 | H212: =RC3 -> 1.04 | I212: =RC3 -> 1.04 | J212: =RC3 -> 1.04 | K212: =RC3 -> 1.04 | L212: =RC3 -> 1.04 | M212: =RC[-10] -> 1.04
A213: =R[-1]C+1 -> 105 | B213: 100 | C213: =RC[-2]/RC[-1] -> 1.05 | D213: =RC3 -> 1.05 | E213: =RC3 -> 1.05 | F213: =RC3 -> 1.05 | G213: =RC3 -> 1.05 | H213: =RC3 -> 1.05 | I213: =RC3 -> 1.05 | J213: =RC3 -> 1.05 | K213: =RC3 -> 1.05 | L213: =RC3 -> 1.05 | M213: =RC[-10] -> 1.05
A214: =R[-1]C+1 -> 106 | B214: 100 | C214: =RC[-2]/RC[-1] -> 1.06 | D214: =RC3 -> 1.06 | E214: =RC3 -> 1.06 | F214: =RC3 -> 1.06 | G214: =RC3 -> 1.06 | H214: =RC3 -> 1.06 | I214: =RC3 -> 1.06 | J214: =RC3 -> 1.06 | K214: =RC3 -> 1.06 | L214: =RC3 -> 1.06 | M214: =RC[-10] -> 1.06
A215: =R[-1]C+1 -> 107 | B215: 100 | C215: =RC[-2]/RC[-1] -> 1.07 | D215: =RC3 -> 1.07 | E215: =RC3 -> 1.07 | F215: =RC3 -> 1.07 | G215: =RC3 -> 1.07 | H215: =RC3 -> 1.07 | I215: =RC3 -> 1.07 | J215: =RC3 -> 1.07 | K215: =RC3 -> 1.07 | L215: =RC3 -> 1.07 | M215: =RC[-10] -> 1.07
A216: =R[-1]C+1 -> 108 | B216: 100 | C216: =RC[-2]/RC[-1] -> 1.08 | D216: =RC3 -> 1.08 | E216: =RC3 -> 1.08 | F216: =RC3 -> 1.08 | G216: =RC3 -> 1.08 | H216: =RC3 -> 1.08 | I216: =RC3 -> 1.08 | J216: =RC3 -> 1.08 | K216: =RC3 -> 1.08 | L216: =RC3 -> 1.08 | M216: =RC[-10] -> 1.08
A217: =R[-1]C+1 -> 109 | B217: 100 | C217: =RC[-2]/RC[-1] -> 1.0900000000000001 | D217: =RC3 -> 1.0900000000000001 | E217: =RC3 -> 1.0900000000000001 | F217: =RC3 -> 1.0900000000000001 | G217: =RC3 -> 1.0900000000000001 | H217: =RC3 -> 1.0900000000000001 | I217: =RC3 -> 1.0900000000000001 | J217: =RC3 -> 1.0900000000000001 | K217: =RC3 -> 1.0900000000000001 | L217: =RC3 -> 1.0900000000000001 | M217: =RC[-10] -> 1.0900000000000001
A218: =R[-1]C+1 -> 110 | B218: 100 | C218: =RC[-2]/RC[-1] -> 1.1000000000000001 | D218: =RC3 -> 1.1000000000000001 | E218: =RC3 -> 1.1000000000000001 | F218: =RC3 -> 1.1000000000000001 | G218: =RC3 -> 1.1000000000000001 | H218: =RC3 -> 1.1000000000000001 | I218: =RC3 -> 1.1000000000000001 | J218: =RC3 -> 1.1000000000000001 | K218: =RC3 -> 1.1000000000000001 | L218: =RC3 -> 1.1000000000000001 | M218: =RC[-10] -> 1.1000000000000001
A219: =R[-1]C+1 -> 111 | B219: 100 | C219: =RC[-2]/RC[-1] -> 1.1100000000000001 | D219: =RC3 -> 1.1100000000000001 | E219: =RC3 -> 1.1100000000000001 | F219: =RC3 -> 1.1100000000000001 | G219: =RC3 -> 1.1100000000000001 | H219: =RC3 -> 1.1100000000000001 | I219: =RC3 -> 1.1100000000000001 | J219: =RC3 -> 1.1100000000000001 | K219: =RC3 -> 1.1100000000000001 | L219: =RC3 -> 1.1100000000000001 | M219: =RC[-10] -> 1.1100000000000001
A220: =R[-1]C+1 -> 112 | B220: 100 | C220: =RC[-2]/RC[-1] -> 1.1200000000000001 | D220: =RC3 -> 1.1200000000000001 | E220: =RC3 -> 1.1200000000000001 | F220: =RC3 -> 1.1200000000000001 | G220: =RC3 -> 1.1200000000000001 | H220: =RC3 -> 1.1200000000000001 | I220: =RC3 -> 1.1200000000000001 | J220: =RC3 -> 1.1200000000000001 | K220: =RC3 -> 1.1200000000000001 | L220: =RC3 -> 1.1200000000000001 | M220: =RC[-10] -> 1.1200000000000001
A221: =R[-1]C+1 -> 113 | B221: 100 | C221: =RC[-2]/RC[-1] -> 1.1299999999999999 | D221: =RC3 -> 1.1299999999999999 | E221: =RC3 -> 1.1299999999999999 | F221: =RC3 -> 1.1299999999999999 | G221: =RC3 -> 1.1299999999999999 | H221: =RC3 -> 1.1299999999999999 | I221: =RC3 -> 1.1299999999999999 | J221: =RC3 -> 1.1299999999999999 | K221: =RC3 -> 1.1299999999999999 | L221: =RC3 -> 1.1299999999999999 | M221: =RC[-10] -> 1.1299999999999999
A222: =R[-1]C+1 -> 114 | B222: 100 | C222: =RC[-2]/RC[-1] -> 1.1399999999999999 | D222: =RC3 -> 1.1399999999999999 | E222: =RC3 -> 1.1399999999999999 | F222: =RC3 -> 1.1399999999999999 | G222: =RC3 -> 1.1399999999999999 | H222: =RC3 -> 1.1399999999999999 | I222: =RC3 -> 1.1399999999999999 | J222: =RC3 -> 1.1399999999999999 | K222: =RC3 -> 1.1399999999999999 | L222: =RC3 -> 1.1399999999999999 | M222: =RC[-10] -> 1.1399999999999999
A223: =R[-1]C+1 -> 115 | B223: 100 | C223: =RC[-2]/RC[-1] -> 1.1499999999999999 | D223: =RC3 -> 1.1499999999999999 | E223: =RC3 -> 1.1499999999999999 | F223: =RC3 -> 1.1499999999999999 | G223: =RC3 -> 1.1499999999999999 | H223: =RC3 -> 1.1499999999999999 | I223: =RC3 -> 1.1499999999999999 | J223: =RC3 -> 1.1499999999999999 | K223: =RC3 -> 1.1499999999999999 | L223: =RC3 -> 1.1499999999999999 | M223: =RC[-10] -> 1.1499999999999999
A224: =R[-1]C+1 -> 116 | B224: 100 | C224: =RC[-2]/RC[-1] -> 1.1599999999999999 | D224: =RC3 -> 1.1599999999999999 | E224: =RC3 -> 1.1599999999999999 | F224: =RC3 -> 1.1599999999999999 | G224: =RC3 -> 1.1599999999999999 | H224: =RC3 -> 1.1599999999999999 | I224: =RC3 -> 1.1599999999999999 | J224: =RC3 -> 1.1599999999999999 | K224: =RC3 -> 1.1599999999999999 | L224: =RC3 -> 1.1599999999999999 | M224: =RC[-10] -> 1.1599999999999999
A225: =R[-1]C+1 -> 117 | B225: 100 | C225: =RC[-2]/RC[-1] -> 1.17 | D225: =RC3 -> 1.17 | E225: =RC3 -> 1.17 | F225: =RC3 -> 1.17 | G225: =RC3 -> 1.17 | H225: =RC3 -> 1.17 | I225: =RC3 -> 1.17 | J225: =RC3 -> 1.17 | K225: =RC3 -> 1.17 | L225: =RC3 -> 1.17 | M225: =RC[-10] -> 1.17
A226: =R[-1]C+1 -> 118 | B226: 100 | C226: =RC[-2]/RC[-1] -> 1.18 | D226: =RC3 -> 1.18 | E226: =RC3 -> 1.18 | F226: =RC3 -> 1.18 | G226: =RC3 -> 1.18 | H226: =RC3 -> 1.18 | I226: =RC3 -> 1.18 | J226: =RC3 -> 1.18 | K226: =RC3 -> 1.18 | L226: =RC3 -> 1.18 | M226: =RC[-10] -> 1.18
A227: =R[-1]C+1 -> 119 | B227: 100 | C227: =RC[-2]/RC[-1] -> 1.19 | D227: =RC3 -> 1.19 | E227: =RC3 -> 1.19 | F227: =RC3 -> 1.19 | G227: =RC3 -> 1.19 | H227: =RC3 -> 1.19 | I227: =RC3 -> 1.19 | J227: =RC3 -> 1.19 | K227: =RC3 -> 1.19 | L227: =RC3 -> 1.19 | M227: =RC[-10] -> 1.19
A228: =R[-1]C+1 -> 120 | B228: 100 | C228: =RC[-2]/RC[-1] -> 1.2 | D228: =RC3 -> 1.2 | E228: =RC3 -> 1.2 | F228: =RC3 -> 1.2 | G228: =RC3 -> 1.2 | H228: =RC3 -> 1.2 | I228: =RC3 -> 1.2 | J228: =RC3 -> 1.2 | K228: =RC3 -> 1.2 | L228: =RC3 -> 1.2 | M228: =RC[-10] -> 1.2
A229: =R[-1]C+1 -> 121 | B229: 100 | C229: =RC[-2]/RC[-1] -> 1.21 | D229: =RC3 -> 1.21 | E229: =RC3 -> 1.21 | F229: =RC3 -> 1.21 | G229: =RC3 -> 1.21 | H229: =RC3 -> 1.21 | I229: =RC3 -> 1.21 | J229: =RC3 -> 1.21 | K229: =RC3 -> 1.21 | L229: =RC3 -> 1.21 | M229: =RC[-10] -> 1.21
A230: =R[-1]C+1 -> 122 | B230: 100 | C230: =RC[-2]/RC[-1] -> 1.22 | D230: =RC3 -> 1.22 | E230: =RC3 -> 1.22 | F230: =RC3 -> 1.22 | G230: =RC3 -> 1.22 | H230: =RC3 -> 1.22 | I230: =RC3 -> 1.22 | J230: =RC3 -> 1.22 | K230: =RC3 -> 1.22 | L230: =RC3 -> 1.22 | M230: =RC[-10] -> 1.22
A231: =R[-1]C+1 -> 123 | B231: 100 | C231: =RC[-2]/RC[-1] -> 1.23 | D231: =RC3 -> 1.23 | E231: =RC3 -> 1.23 | F231: =RC3 -> 1.23 | G231: =RC3 -> 1.23 | H231: =RC3 -> 1.23 | I231: =RC3 -> 1.23 | J231: =RC3 -> 1.23 | K231: =RC3 -> 1.23 | L231: =RC3 -> 1.23 | M231: =RC[-10] -> 1.23
A232: =R[-1]C+1 -> 124 | B232: 100 | C232: =RC[-2]/RC[-1] -> 1.24 | D232: =RC3 -> 1.24 | E232: =RC3 -> 1.24 | F232: =RC3 -> 1.24 | G232: =RC3 -> 1.24 | H232: =RC3 -> 1.24 | I232: =RC3 -> 1.24 | J232: =RC3 -> 1.24 | K232: =RC3 -> 1.24 | L232: =RC3 -> 1.24 | M232: =RC[-10] -> 1.24
A233: =R[-1]C+1 -> 125 | B233: 100 | C233: =RC[-2]/RC[-1] -> 1.25 | D233: =RC3 -> 1.25 | E233: =RC3 -> 1.25 | F233: =RC3 -> 1.25 | G233: =RC3 -> 1.25 | H233: =RC3 -> 1.25 | I233: =RC3 -> 1.25 | J233: =RC3 -> 1.25 | K233: =RC3 -> 1.25 | L233: =RC3 -> 1.25 | M233: =RC[-10] -> 1.25
A234: =R[-1]C+1 -> 126 | B234: 100 | C234: =RC[-2]/RC[-1] -> 1.26 | D234: =RC3 -> 1.26 | E234: =RC3 -> 1.26 | F234: =RC3 -> 1.26 | G234: =RC3 -> 1.26 | H234: =RC3 -> 1.26 | I234: =RC3 -> 1.26 | J234: =RC3 -> 1.26 | K234: =RC3 -> 1.26 | L234: =RC3 -> 1.26 | M234: =RC[-10] -> 1.26
A235: =R[-1]C+1 -> 127 | B235: 100 | C235: =RC[-2]/RC[-1] -> 1.27 | D235: =RC3 -> 1.27 | E235: =RC3 -> 1.27 | F235: =RC3 -> 1.27 | G235: =RC3 -> 1.27 | H235: =RC3 -> 1.27 | I235: =RC3 -> 1.27 | J235: =RC3 -> 1.27 | K235: =RC3 -> 1.27 | L235: =RC3 -> 1.27 | M235: =RC[-10] -> 1.27
A236: -103 | B236: 201 | C236: =RC[-2]/RC[-1] -> -0.51243781094527363 | D236: =RC3 -> -0.51243781094527363 | E236: =RC3 -> -0.51243781094527363 | F236: =RC3 -> -0.51243781094527363 | G236: =RC3 -> -0.51243781094527363 | H236: =RC3 -> -0.51243781094527363 | I236: =RC3 -> -0.51243781094527363 | J236: =RC3 -> -0.51243781094527363 | K236: =RC3 -> -0.51243781094527363 | L236: =RC3 -> -0.51243781094527363 | M236: =RC[-10] -> -0.51243781094527363
A237: =R[-1]C+3 -> -100 | B237: 201 | C237: =RC[-2]/RC[-1] -> -0.49751243781094528 | D237: =RC3 -> -0.49751243781094528 | E237: =RC3 -> -0.49751243781094528 | F237: =RC3 -> -0.49751243781094528 | G237: =RC3 -> -0.49751243781094528 | H237: =RC3 -> -0.49751243781094528 | I237: =RC3 -> -0.49751243781094528 | J237: =RC3 -> -0.49751243781094528 | K237: =RC3 -> -0.49751243781094528 | L237: =RC3 -> -0.49751243781094528 | M237: =RC[-10] -> -0.49751243781094528
A238: =R[-1]C+3 -> -97 | B238: 201 | C238: =RC[-2]/RC[-1] -> -0.48258706467661694 | D238: =RC3 -> -0.48258706467661694 | E238: =RC3 -> -0.48258706467661694 | F238: =RC3 -> -0.48258706467661694 | G238: =RC3 -> -0.48258706467661694 | H238: =RC3 -> -0.48258706467661694 | I238: =RC3 -> -0.48258706467661694 | J238: =RC3 -> -0.48258706467661694 | K238: =RC3 -> -0.48258706467661694 | L238: =RC3 -> -0.48258706467661694 | M238: =RC[-10] -> -0.48258706467661694
A239: =R[-1]C+3 -> -94 | B239: 201 | C239: =RC[-2]/RC[-1] -> -0.46766169154228854 | D239: =RC3 -> -0.46766169154228854 | E239: =RC3 -> -0.46766169154228854 | F239: =RC3 -> -0.46766169154228854 | G239: =RC3 -> -0.46766169154228854 | H239: =RC3 -> -0.46766169154228854 | I239: =RC3 -> -0.46766169154228854 | J239: =RC3 -> -0.46766169154228854 | K239: =RC3 -> -0.46766169154228854 | L239: =RC3 -> -0.46766169154228854 | M239: =RC[-10] -> -0.46766169154228854
A240: =R[-1]C+3 -> -91 | B240: 201 | C240: =RC[-2]/RC[-1] -> -0.45273631840796019 | D240: =RC3 -> -0.45273631840796019 | E240: =RC3 -> -0.45273631840796019 | F240: =RC3 -> -0.45273631840796019 | G240: =RC3 -> -0.45273631840796019 | H240: =RC3 -> -0.45273631840796019 | I240: =RC3 -> -0.45273631840796019 | J240: =RC3 -> -0.45273631840796019 | K240: =RC3 -> -0.45273631840796019 | L240: =RC3 -> -0.45273631840796019 | M240: =RC[-10] -> -0.45273631840796019
A241: =R[-1]C+3 -> -88 | B241: 201 | C241: =RC[-2]/RC[-1] -> -0.43781094527363185 | D241: =RC3 -> -0.43781094527363185 | E241: =RC3 -> -0.43781094527363185 | F241: =RC3 -> -0.43781094527363185 | G241: =RC3 -> -0.43781094527363185 | H241: =RC3 -> -0.43781094527363185 | I241: =RC3 -> -0.43781094527363185 | J241: =RC3 -> -0.43781094527363185 | K241: =RC3 -> -0.43781094527363185 | L241: =RC3 -> -0.43781094527363185 | M241: =RC[-10] -> -0.43781094527363185
A242: =R[-1]C+3 -> -85 | B242: 201 | C242: =RC[-2]/RC[-1] -> -0.4228855721393035 | D242: =RC3 -> -0.4228855721393035 | E242: =RC3 -> -0.4228855721393035 | F242: =RC3 -> -0.4228855721393035 | G242: =RC3 -> -0.4228855721393035 | H242: =RC3 -> -0.4228855721393035 | I242: =RC3 -> -0.4228855721393035 | J242: =RC3 -> -0.4228855721393035 | K242: =RC3 -> -0.4228855721393035 | L242: =RC3 -> -0.4228855721393035 | M242: =RC[-10] -> -0.4228855721393035
A243: =R[-1]C+3 -> -82 | B243: 201 | C243: =RC[-2]/RC[-1] -> -0.4079601990049751 | D243: =RC3 -> -0.4079601990049751 | E243: =RC3 -> -0.4079601990049751 | F243: =RC3 -> -0.4079601990049751 | G243: =RC3 -> -0.4079601990049751 | H243: =RC3 -> -0.4079601990049751 | I243: =RC3 -> -0.4079601990049751 | J243: =RC3 -> -0.4079601990049751 | K243: =RC3 -> -0.4079601990049751 | L243: =RC3 -> -0.4079601990049751 | M243: =RC[-10] -> -0.4079601990049751
A244: =R[-1]C+3 -> -79 | B244: 201 | C244: =RC[-2]/RC[-1] -> -0.39303482587064675 | D244: =RC3 -> -0.39303482587064675 | E244: =RC3 -> -0.39303482587064675 | F244: =RC3 -> -0.39303482587064675 | G244: =RC3 -> -0.39303482587064675 | H244: =RC3 -> -0.39303482587064675 | I244: =RC3 -> -0.39303482587064675 | J244: =RC3 -> -0.39303482587064675 | K244: =RC3 -> -0.39303482587064675 | L244: =RC3 -> -0.39303482587064675 | M244: =RC[-10] -> -0.39303482587064675
A245: =R[-1]C+3 -> -76 | B245: 201 | C245: =RC[-2]/RC[-1] -> -0.37810945273631841 | D245: =RC3 -> -0.37810945273631841 | E245: =RC3 -> -0.37810945273631841 | F245: =RC3 -> -0.37810945273631841 | G245: =RC3 -> -0.37810945273631841 | H245: =RC3 -> -0.37810945273631841 | I245: =RC3 -> -0.37810945273631841 | J245: =RC3 -> -0.37810945273631841 | K245: =RC3 -> -0.37810945273631841 | L245: =RC3 -> -0.37810945273631841 | M245: =RC[-10] -> -0.37810945273631841
A246: =R[-1]C+3 -> -73 | B246: 201 | C246: =RC[-2]/RC[-1] -> -0.36318407960199006 | D246: =RC3 -> -0.36318407960199006 | E246: =RC3 -> -0.36318407960199006 | F246: =RC3 -> -0.36318407960199006 | G246: =RC3 -> -0.36318407960199006 | H246: =RC3 -> -0.36318407960199006 | I246: =RC3 -> -0.36318407960199006 | J246: =RC3 -> -0.36318407960199006 | K246: =RC3 -> -0.36318407960199006 | L246: =RC3 -> -0.36318407960199006 | M246: =RC[-10] -> -0.36318407960199006
A247: =R[-1]C+3 -> -70 | B247: 201 | C247: =RC[-2]/RC[-1] -> -0.34825870646766172 | D247: =RC3 -> -0.34825870646766172 | E247: =RC3 -> -0.34825870646766172 | F247: =RC3 -> -0.34825870646766172 | G247: =RC3 -> -0.34825870646766172 | H247: =RC3 -> -0.34825870646766172 | I247: =RC3 -> -0.34825870646766172 | J247: =RC3 -> -0.34825870646766172 | K247: =RC3 -> -0.34825870646766172 | L247: =RC3 -> -0.34825870646766172 | M247: =RC[-10] -> -0.34825870646766172
A248: =R[-1]C+3 -> -67 | B248: 201 | C248: =RC[-2]/RC[-1] -> -0.33333333333333331 | D248: =RC3 -> -0.33333333333333331 | E248: =RC3 -> -0.33333333333333331 | F248: =RC3 -> -0.33333333333333331 | G248: =RC3 -> -0.33333333333333331 | H248: =RC3 -> -0.33333333333333331 | I248: =RC3 -> -0.33333333333333331 | J248: =RC3 -> -0.33333333333333331 | K248: =RC3 -> -0.33333333333333331 | L248: =RC3 -> -0.33333333333333331 | M248: =RC[-10] -> -0.33333333333333331
A249: =R[-1]C+3 -> -64 | B249: 201 | C249: =RC[-2]/RC[-1] -> -0.31840796019900497 | D249: =RC3 -> -0.31840796019900497 | E249: =RC3 -> -0.31840796019900497 | F249: =RC3 -> -0.31840796019900497 | G249: =RC3 -> -0.31840796019900497 | H249: =RC3 -> -0.31840796019900497 | I249: =RC3 -> -0.31840796019900497 | J249: =RC3 -> -0.31840796019900497 | K249: =RC3 -> -0.31840796019900497 | L249: =RC3 -> -0.31840796019900497 | M249: =RC[-10] -> -0.31840796019900497
A250: =R[-1]C+3 -> -61 | B250: 201 | C250: =RC[-2]/RC[-1] -> -0.30348258706467662 | D250: =RC3 -> -0.30348258706467662 | E250: =RC3 -> -0.30348258706467662 | F250: =RC3 -> -0.30348258706467662 | G250: =RC3 -> -0.30348258706467662 | H250: =RC3 -> -0.30348258706467662 | I250: =RC3 -> -0.30348258706467662 | J250: =RC3 -> -0.30348258706467662 | K250: =RC3 -> -0.30348258706467662 | L250: =RC3 -> -0.30348258706467662 | M250: =RC[-10] -> -0.30348258706467662
A251: =R[-1]C+3 -> -58 | B251: 201 | C251: =RC[-2]/RC[-1] -> -0.28855721393034828 | D251: =RC3 -> -0.28855721393034828 | E251: =RC3 -> -0.28855721393034828 | F251: =RC3 -> -0.28855721393034828 | G251: =RC3 -> -0.28855721393034828 | H251: =RC3 -> -0.28855721393034828 | I251: =RC3 -> -0.28855721393034828 | J251: =RC3 -> -0.28855721393034828 | K251: =RC3 -> -0.28855721393034828 | L251: =RC3 -> -0.28855721393034828 | M251: =RC[-10] -> -0.28855721393034828
A252: =R[-1]C+3 -> -55 | B252: 201 | C252: =RC[-2]/RC[-1] -> -0.27363184079601988 | D252: =RC3 -> -0.27363184079601988 | E252: =RC3 -> -0.27363184079601988 | F252: =RC3 -> -0.27363184079601988 | G252: =RC3 -> -0.27363184079601988 | H252: =RC3 -> -0.27363184079601988 | I252: =RC3 -> -0.27363184079601988 | J252: =RC3 -> -0.27363184079601988 | K252: =RC3 -> -0.27363184079601988 | L252: =RC3 -> -0.27363184079601988 | M252: =RC[-10] -> -0.27363184079601988
A253: =R[-1]C+3 -> -52 | B253: 201 | C253: =RC[-2]/RC[-1] -> -0.25870646766169153 | D253: =RC3 -> -0.25870646766169153 | E253: =RC3 -> -0.25870646766169153 | F253: =RC3 -> -0.25870646766169153 | G253: =RC3 -> -0.25870646766169153 | H253: =RC3 -> -0.25870646766169153 | I253: =RC3 -> -0.25870646766169153 | J253: =RC3 -> -0.25870646766169153 | K253: =RC3 -> -0.25870646766169153 | L253: =RC3 -> -0.25870646766169153 | M253: =RC[-10] -> -0.25870646766169153
A254: =R[-1]C+3 -> -49 | B254: 201 | C254: =RC[-2]/RC[-1] -> -0.24378109452736318 | D254: =RC3 -> -0.24378109452736318 | E254: =RC3 -> -0.24378109452736318 | F254: =RC3 -> -0.24378109452736318 | G254: =RC3 -> -0.24378109452736318 | H254: =RC3 -> -0.24378109452736318 | I254: =RC3 -> -0.24378109452736318 | J254: =RC3 -> -0.24378109452736318 | K254: =RC3 -> -0.24378109452736318 | L254: =RC3 -> -0.24378109452736318 | M254: =RC[-10] -> -0.24378109452736318
A255: =R[-1]C+3 -> -46 | B255: 201 | C255: =RC[-2]/RC[-1] -> -0.22885572139303484 | D255: =RC3 -> -0.22885572139303484 | E255: =RC3 -> -0.22885572139303484 | F255: =RC3 -> -0.22885572139303484 | G255: =RC3 -> -0.22885572139303484 | H255: =RC3 -> -0.22885572139303484 | I255: =RC3 -> -0.22885572139303484 | J255: =RC3 -> -0.22885572139303484 | K255: =RC3 -> -0.22885572139303484 | L255: =RC3 -> -0.22885572139303484 | M255: =RC[-10] -> -0.22885572139303484
A256: =R[-1]C+3 -> -43 | B256: 201 | C256: =RC[-2]/RC[-1] -> -0.21393034825870647 | D256: =RC3 -> -0.21393034825870647 | E256: =RC3 -> -0.21393034825870647 | F256: =RC3 -> -0.21393034825870647 | G256: =RC3 -> -0.21393034825870647 | H256: =RC3 -> -0.21393034825870647 | I256: =RC3 -> -0.21393034825870647 | J256: =RC3 -> -0.21393034825870647 | K256: =RC3 -> -0.21393034825870647 | L256: =RC3 -> -0.21393034825870647 | M256: =RC[-10] -> -0.21393034825870647
A257: =R[-1]C+3 -> -40 | B257: 201 | C257: =RC[-2]/RC[-1] -> -0.19900497512437812 | D257: =RC3 -> -0.19900497512437812 | E257: =RC3 -> -0.19900497512437812 | F257: =RC3 -> -0.19900497512437812 | G257: =RC3 -> -0.19900497512437812 | H257: =RC3 -> -0.19900497512437812 | I257: =RC3 -> -0.19900497512437812 | J257: =RC3 -> -0.19900497512437812 | K257: =RC3 -> -0.19900497512437812 | L257: =RC3 -> -0.19900497512437812 | M257: =RC[-10] -> -0.19900497512437812
A258: =R[-1]C+3 -> -37 | B258: 201 | C258: =RC[-2]/RC[-1] -> -0.18407960199004975 | D258: =RC3 -> -0.18407960199004975 | E258: =RC3 -> -0.18407960199004975 | F258: =RC3 -> -0.18407960199004975 | G258: =RC3 -> -0.18407960199004975 | H258: =RC3 -> -0.18407960199004975 | I258: =RC3 -> -0.18407960199004975 | J258: =RC3 -> -0.18407960199004975 | K258: =RC3 -> -0.18407960199004975 | L258: =RC3 -> -0.18407960199004975 | M258: =RC[-10] -> -0.18407960199004975
A259: =R[-1]C+3 -> -34 | B259: 201 | C259: =RC[-2]/RC[-1] -> -0.1691542288557214 | D259: =RC3 -> -0.1691542288557214 | E259: =RC3 -> -0.1691542288557214 | F259: =RC3 -> -0.1691542288557214 | G259: =RC3 -> -0.1691542288557214 | H259: =RC3 -> -0.1691542288557214 | I259: =RC3 -> -0.1691542288557214 | J259: =RC3 -> -0.1691542288557214 | K259: =RC3 -> -0.1691542288557214 | L259: =RC3 -> -0.1691542288557214 | M259: =RC[-10] -> -0.1691542288557214
A260: =R[-1]C+3 -> -31 | B260: 201 | C260: =RC[-2]/RC[-1] -> -0.15422885572139303 | D260: =RC3 -> -0.15422885572139303 | E260: =RC3 -> -0.15422885572139303 | F260: =RC3 -> -0.15422885572139303 | G260: =RC3 -> -0.15422885572139303 | H260: =RC3 -> -0.15422885572139303 | I260: =RC3 -> -0.15422885572139303 | J260: =RC3 -> -0.15422885572139303 | K260: =RC3 -> -0.15422885572139303 | L260: =RC3 -> -0.15422885572139303 | M260: =RC[-10] -> -0.15422885572139303
A261: =R[-1]C+3 -> -28 | B261: 201 | C261: =RC[-2]/RC[-1] -> -0.13930348258706468 | D261: =RC3 -> -0.13930348258706468 | E261: =RC3 -> -0.13930348258706468 | F261: =RC3 -> -0.13930348258706468 | G261: =RC3 -> -0.13930348258706468 | H261: =RC3 -> -0.13930348258706468 | I261: =RC3 -> -0.13930348258706468 | J261: =RC3 -> -0.13930348258706468 | K261: =RC3 -> -0.13930348258706468 | L261: =RC3 -> -0.13930348258706468 | M261: =RC[-10] -> -0.13930348258706468
A262: =R[-1]C+3 -> -25 | B262: 201 | C262: =RC[-2]/RC[-1] -> -0.12437810945273632 | D262: =RC3 -> -0.12437810945273632 | E262: =RC3 -> -0.12437810945273632 | F262: =RC3 -> -0.12437810945273632 | G262: =RC3 -> -0.12437810945273632 | H262: =RC3 -> -0.12437810945273632 | I262: =RC3 -> -0.12437810945273632 | J262: =RC3 -> -0.12437810945273632 | K262: =RC3 -> -0.12437810945273632 | L262: =RC3 -> -0.12437810945273632 | M262: =RC[-10] -> -0.12437810945273632
A263: =R[-1]C+3 -> -22 | B263: 201 | C263: =RC[-2]/RC[-1] -> -0.10945273631840796 | D263: =RC3 -> -0.10945273631840796 | E263: =RC3 -> -0.10945273631840796 | F263: =RC3 -> -0.10945273631840796 | G263: =RC3 -> -0.10945273631840796 | H263: =RC3 -> -0.10945273631840796 | I263: =RC3 -> -0.10945273631840796 | J263: =RC3 -> -0.10945273631840796 | K263: =RC3 -> -0.10945273631840796 | L263: =RC3 -> -0.10945273631840796 | M263: =RC[-10] -> -0.10945273631840796
A264: =R[-1]C+3 -> -19 | B264: 201 | C264: =RC[-2]/RC[-1] -> -9.4527363184079602E-2 | D264: =RC3 -> -9.4527363184079602E-2 | E264: =RC3 -> -9.4527363184079602E-2 | F264: =RC3 -> -9.4527363184079602E-2 | G264: =RC3 -> -9.4527363184079602E-2 | H264: =RC3 -> -9.4527363184079602E-2 | I264: =RC3 -> -9.4527363184079602E-2 | J264: =RC3 -> -9.4527363184079602E-2 | K264: =RC3 -> -9.4527363184079602E-2 | L264: =RC3 -> -9.4527363184079602E-2 | M264: =RC[-10] -> -9.4527363184079602E-2
A265: =R[-1]C+3 -> -16 | B265: 201 | C265: =RC[-2]/RC[-1] -> -7.9601990049751242E-2 | D265: =RC3 -> -7.9601990049751242E-2 | E265: =RC3 -> -7.9601990049751242E-2 | F265: =RC3 -> -7.9601990049751242E-2 | G265: =RC3 -> -7.9601990049751242E-2 | H265: =RC3 -> -7.9601990049751242E-2 | I265: =RC3 -> -7.9601990049751242E-2 | J265: =RC3 -> -7.9601990049751242E-2 | K265: =RC3 -> -7.9601990049751242E-2 | L265: =RC3 -> -7.9601990049751242E-2 | M265: =RC[-10] -> -7.9601990049751242E-2
A266: =R[-1]C+3 -> -13 | B266: 201 | C266: =RC[-2]/RC[-1] -> -6.4676616915422883E-2 | D266: =RC3 -> -6.4676616915422883E-2 | E266: =RC3 -> -6.4676616915422883E-2 | F266: =RC3 -> -6.4676616915422883E-2 | G266: =RC3 -> -6.4676616915422883E-2 | H266: =RC3 -> -6.4676616915422883E-2 | I266: =RC3 -> -6.4676616915422883E-2 | J266: =RC3 -> -6.4676616915422883E-2 | K266: =RC3 -> -6.4676616915422883E-2 | L266: =RC3 -> -6.4676616915422883E-2 | M266: =RC[-10] -> -6.4676616915422883E-2
A267: =R[-1]C+3 -> -10 | B267: 201 | C267: =RC[-2]/RC[-1] -> -4.975124378109453E-2 | D267: =RC3 -> -4.975124378109453E-2 | E267: =RC3 -> -4.975124378109453E-2 | F267: =RC3 -> -4.975124378109453E-2 | G267: =RC3 -> -4.975124378109453E-2 | H267: =RC3 -> -4.975124378109453E-2 | I267: =RC3 -> -4.975124378109453E-2 | J267: =RC3 -> -4.975124378109453E-2 | K267: =RC3 -> -4.975124378109453E-2 | L267: =RC3 -> -4.975124378109453E-2 | M267: =RC[-10] -> -4.975124378109453E-2
A268: =R[-1]C+3 -> -7 | B268: 201 | C268: =RC[-2]/RC[-1] -> -3.482587064676617E-2 | D268: =RC3 -> -3.482587064676617E-2 | E268: =RC3 -> -3.482587064676617E-2 | F268: =RC3 -> -3.482587064676617E-2 | G268: =RC3 -> -3.482587064676617E-2 | H268: =RC3 -> -3.482587064676617E-2 | I268: =RC3 -> -3.482587064676617E-2 | J268: =RC3 -> -3.482587064676617E-2 | K268: =RC3 -> -3.482587064676617E-2 | L268: =RC3 -> -3.482587064676617E-2 | M268: =RC[-10] -> -3.482587064676617E-2
A269: =R[-1]C+3 -> -4 | B269: 201 | C269: =RC[-2]/RC[-1] -> -1.9900497512437811E-2 | D269: =RC3 -> -1.9900497512437811E-2 | E269: =RC3 -> -1.9900497512437811E-2 | F269: =RC3 -> -1.9900497512437811E-2 | G269: =RC3 -> -1.9900497512437811E-2 | H269: =RC3 -> -1.9900497512437811E-2 | I269: =RC3 -> -1.9900497512437811E-2 | J269: =RC3 -> -1.9900497512437811E-2 | K269: =RC3 -> -1.9900497512437811E-2 | L269: =RC3 -> -1.9900497512437811E-2 | M269: =RC[-10] -> -1.9900497512437811E-2
A270: =R[-1]C+3 -> -1 | B270: 201 | C270: =RC[-2]/RC[-1] -> -4.9751243781094526E-3 | D270: =RC3 -> -4.9751243781094526E-3 | E270: =RC3 -> -4.9751243781094526E-3 | F270: =RC3 -> -4.9751243781094526E-3 | G270: =RC3 -> -4.9751243781094526E-3 | H270: =RC3 -> -4.9751243781094526E-3 | I270: =RC3 -> -4.9751243781094526E-3 | J270: =RC3 -> -4.9751243781094526E-3 | K270: =RC3 -> -4.9751243781094526E-3 | L270: =RC3 -> -4.9751243781094526E-3 | M270: =RC[-10] -> -4.9751243781094526E-3
A271: =R[-1]C+3 -> 2 | B271: 201 | C271: =RC[-2]/RC[-1] -> 9.9502487562189053E-3 | D271: =RC3 -> 9.9502487562189053E-3 | E271: =RC3 -> 9.9502487562189053E-3 | F271: =RC3 -> 9.9502487562189053E-3 | G271: =RC3 -> 9.9502487562189053E-3 | H271: =RC3 -> 9.9502487562189053E-3 | I271: =RC3 -> 9.9502487562189053E-3 | J271: =RC3 -> 9.9502487562189053E-3 | K271: =RC3 -> 9.9502487562189053E-3 | L271: =RC3 -> 9.9502487562189053E-3 | M271: =RC[-10] -> 9.9502487562189053E-3
A272: =R[-1]C+3 -> 5 | B272: 201 | C272: =RC[-2]/RC[-1] -> 2.4875621890547265E-2 | D272: =RC3 -> 2.4875621890547265E-2 | E272: =RC3 -> 2.4875621890547265E-2 | F272: =RC3 -> 2.4875621890547265E-2 | G272: =RC3 -> 2.4875621890547265E-2 | H272: =RC3 -> 2.4875621890547265E-2 | I272: =RC3 -> 2.4875621890547265E-2 | J272: =RC3 -> 2.4875621890547265E-2 | K272: =RC3 -> 2.4875621890547265E-2 | L272: =RC3 -> 2.4875621890547265E-2 | M272: =RC[-10] -> 2.4875621890547265E-2
A273: =R[-1]C+3 -> 8 | B273: 201 | C273: =RC[-2]/RC[-1] -> 3.9800995024875621E-2 | D273: =RC3 -> 3.9800995024875621E-2 | E273: =RC3 -> 3.9800995024875621E-2 | F273: =RC3 -> 3.9800995024875621E-2 | G273: =RC3 -> 3.9800995024875621E-2 | H273: =RC3 -> 3.9800995024875621E-2 | I273: =RC3 -> 3.9800995024875621E-2 | J273: =RC3 -> 3.9800995024875621E-2 | K273: =RC3 -> 3.9800995024875621E-2 | L273: =RC3 -> 3.9800995024875621E-2 | M273: =RC[-10] -> 3.9800995024875621E-2
A274: =R[-1]C+3 -> 11 | B274: 201 | C274: =RC[-2]/RC[-1] -> 5.4726368159203981E-2 | D274: =RC3 -> 5.4726368159203981E-2 | E274: =RC3 -> 5.4726368159203981E-2 | F274: =RC3 -> 5.4726368159203981E-2 | G274: =RC3 -> 5.4726368159203981E-2 | H274: =RC3 -> 5.4726368159203981E-2 | I274: =RC3 -> 5.4726368159203981E-2 | J274: =RC3 -> 5.4726368159203981E-2 | K274: =RC3 -> 5.4726368159203981E-2 | L274: =RC3 -> 5.4726368159203981E-2 | M274: =RC[-10] -> 5.4726368159203981E-2
A275: =R[-1]C+3 -> 14 | B275: 201 | C275: =RC[-2]/RC[-1] -> 6.965174129353234E-2 | D275: =RC3 -> 6.965174129353234E-2 | E275: =RC3 -> 6.965174129353234E-2 | F275: =RC3 -> 6.965174129353234E-2 | G275: =RC3 -> 6.965174129353234E-2 | H275: =RC3 -> 6.965174129353234E-2 | I275: =RC3 -> 6.965174129353234E-2 | J275: =RC3 -> 6.965174129353234E-2 | K275: =RC3 -> 6.965174129353234E-2 | L275: =RC3 -> 6.965174129353234E-2 | M275: =RC[-10] -> 6.965174129353234E-2
A276: =R[-1]C+3 -> 17 | B276: 201 | C276: =RC[-2]/RC[-1] -> 8.45771144278607E-2 | D276: =RC3 -> 8.45771144278607E-2 | E276: =RC3 -> 8.45771144278607E-2 | F276: =RC3 -> 8.45771144278607E-2 | G276: =RC3 -> 8.45771144278607E-2 | H276: =RC3 -> 8.45771144278607E-2 | I276: =RC3 -> 8.45771144278607E-2 | J276: =RC3 -> 8.45771144278607E-2 | K276: =RC3 -> 8.45771144278607E-2 | L276: =RC3 -> 8.45771144278607E-2 | M276: =RC[-10] -> 8.45771144278607E-2
A277: =R[-1]C+3 -> 20 | B277: 201 | C277: =RC[-2]/RC[-1] -> 9.950248756218906E-2 | D277: =RC3 -> 9.950248756218906E-2 | E277: =RC3 -> 9.950248756218906E-2 | F277: =RC3 -> 9.950248756218906E-2 | G277: =RC3 -> 9.950248756218906E-2 | H277: =RC3 -> 9.950248756218906E-2 | I277: =RC3 -> 9.950248756218906E-2 | J277: =RC3 -> 9.950248756218906E-2 | K277: =RC3 -> 9.950248756218906E-2 | L277: =RC3 -> 9.950248756218906E-2 | M277: =RC[-10] -> 9.950248756218906E-2
A278: =R[-1]C+3 -> 23 | B278: 201 | C278: =RC[-2]/RC[-1] -> 0.11442786069651742 | D278: =RC3 -> 0.11442786069651742 | E278: =RC3 -> 0.11442786069651742 | F278: =RC3 -> 0.11442786069651742 | G278: =RC3 -> 0.11442786069651742 | H278: =RC3 -> 0.11442786069651742 | I278: =RC3 -> 0.11442786069651742 | J278: =RC3 -> 0.11442786069651742 | K278: =RC3 -> 0.11442786069651742 | L278: =RC3 -> 0.11442786069651742 | M278: =RC[-10] -> 0.11442786069651742
A279: =R[-1]C+3 -> 26 | B279: 201 | C279: =RC[-2]/RC[-1] -> 0.12935323383084577 | D279: =RC3 -> 0.12935323383084577 | E279: =RC3 -> 0.12935323383084577 | F279: =RC3 -> 0.12935323383084577 | G279: =RC3 -> 0.12935323383084577 | H279: =RC3 -> 0.12935323383084577 | I279: =RC3 -> 0.12935323383084577 | J279: =RC3 -> 0.12935323383084577 | K279: =RC3 -> 0.12935323383084577 | L279: =RC3 -> 0.12935323383084577 | M279: =RC[-10] -> 0.12935323383084577
A280: =R[-1]C+3 -> 29 | B280: 201 | C280: =RC[-2]/RC[-1] -> 0.14427860696517414 | D280: =RC3 -> 0.14427860696517414 | E280: =RC3 -> 0.14427860696517414 | F280: =RC3 -> 0.14427860696517414 | G280: =RC3 -> 0.14427860696517414 | H280: =RC3 -> 0.14427860696517414 | I280: =RC3 -> 0.14427860696517414 | J280: =RC3 -> 0.14427860696517414 | K280: =RC3 -> 0.14427860696517414 | L280: =RC3 -> 0.14427860696517414 | M280: =RC[-10] -> 0.14427860696517414
A281: =R[-1]C+3 -> 32 | B281: 201 | C281: =RC[-2]/RC[-1] -> 0.15920398009950248 | D281: =RC3 -> 0.15920398009950248 | E281: =RC3 -> 0.15920398009950248 | F281: =RC3 -> 0.15920398009950248 | G281: =RC3 -> 0.15920398009950248 | H281: =RC3 -> 0.15920398009950248 | I281: =RC3 -> 0.15920398009950248 | J281: =RC3 -> 0.15920398009950248 | K281: =RC3 -> 0.15920398009950248 | L281: =RC3 -> 0.15920398009950248 | M281: =RC[-10] -> 0.15920398009950248
A282: =R[-1]C+3 -> 35 | B282: 201 | C282: =RC[-2]/RC[-1] -> 0.17412935323383086 | D282: =RC3 -> 0.17412935323383086 | E282: =RC3 -> 0.17412935323383086 | F282: =RC3 -> 0.17412935323383086 | G282: =RC3 -> 0.17412935323383086 | H282: =RC3 -> 0.17412935323383086 | I282: =RC3 -> 0.17412935323383086 | J282: =RC3 -> 0.17412935323383086 | K282: =RC3 -> 0.17412935323383086 | L282: =RC3 -> 0.17412935323383086 | M282: =RC[-10] -> 0.17412935323383086
A283: =R[-1]C+3 -> 38 | B283: 201 | C283: =RC[-2]/RC[-1] -> 0.1890547263681592 | D283: =RC3 -> 0.1890547263681592 | E283: =RC3 -> 0.1890547263681592 | F283: =RC3 -> 0.1890547263681592 | G283: =RC3 -> 0.1890547263681592 | H283: =RC3 -> 0.1890547263681592 | I283: =RC3 -> 0.1890547263681592 | J283: =RC3 -> 0.1890547263681592 | K283: =RC3 -> 0.1890547263681592 | L283: =RC3 -> 0.1890547263681592 | M283: =RC[-10] -> 0.1890547263681592
A284: =R[-1]C+3 -> 41 | B284: 201 | C284: =RC[-2]/RC[-1] -> 0.20398009950248755 | D284: =RC3 -> 0.20398009950248755 | E284: =RC3 -> 0.20398009950248755 | F284: =RC3 -> 0.20398009950248755 | G284: =RC3 -> 0.20398009950248755 | H284: =RC3 -> 0.20398009950248755 | I284: =RC3 -> 0.20398009950248755 | J284: =RC3 -> 0.20398009950248755 | K284: =RC3 -> 0.20398009950248755 | L284: =RC3 -> 0.20398009950248755 | M284: =RC[-10] -> 0.20398009950248755
A285: =R[-1]C+3 -> 44 | B285: 201 | C285: =RC[-2]/RC[-1] -> 0.21890547263681592 | D285: =RC3 -> 0.21890547263681592 | E285: =RC3 -> 0.21890547263681592 | F285: =RC3 -> 0.21890547263681592 | G285: =RC3 -> 0.21890547263681592 | H285: =RC3 -> 0.21890547263681592 | I285: =RC3 -> 0.21890547263681592 | J285: =RC3 -> 0.21890547263681592 | K285: =RC3 -> 0.21890547263681592 | L285: =RC3 -> 0.21890547263681592 | M285: =RC[-10] -> 0.21890547263681592
A286: =R[-1]C+3 -> 47 | B286: 201 | C286: =RC[-2]/RC[-1] -> 0.23383084577114427 | D286: =RC3 -> 0.23383084577114427 | E286: =RC3 -> 0.23383084577114427 | F286: =RC3 -> 0.23383084577114427 | G286: =RC3 -> 0.23383084577114427 | H286: =RC3 -> 0.23383084577114427 | I286: =RC3 -> 0.23383084577114427 | J286: =RC3 -> 0.23383084577114427 | K286: =RC3 -> 0.23383084577114427 | L286: =RC3 -> 0.23383084577114427 | M286: =RC[-10] -> 0.23383084577114427
A287: =R[-1]C+3 -> 50 | B287: 201 | C287: =RC[-2]/RC[-1] -> 0.24875621890547264 | D287: =RC3 -> 0.24875621890547264 | E287: =RC3 -> 0.24875621890547264 | F287: =RC3 -> 0.24875621890547264 | G287: =RC3 -> 0.24875621890547264 | H287: =RC3 -> 0.24875621890547264 | I287: =RC3 -> 0.24875621890547264 | J287: =RC3 -> 0.24875621890547264 | K287: =RC3 -> 0.24875621890547264 | L287: =RC3 -> 0.24875621890547264 | M287: =RC[-10] -> 0.24875621890547264
A288: =R[-1]C+3 -> 53 | B288: 201 | C288: =RC[-2]/RC[-1] -> 0.26368159203980102 | D288: =RC3 -> 0.26368159203980102 | E288: =RC3 -> 0.26368159203980102 | F288: =RC3 -> 0.26368159203980102 | G288: =RC3 -> 0.26368159203980102 | H288: =RC3 -> 0.26368159203980102 | I288: =RC3 -> 0.26368159203980102 | J288: =RC3 -> 0.26368159203980102 | K288: =RC3 -> 0.26368159203980102 | L288: =RC3 -> 0.26368159203980102 | M288: =RC[-10] -> 0.26368159203980102
A289: =R[-1]C+3 -> 56 | B289: 201 | C289: =RC[-2]/RC[-1] -> 0.27860696517412936 | D289: =RC3 -> 0.27860696517412936 | E289: =RC3 -> 0.27860696517412936 | F289: =RC3 -> 0.27860696517412936 | G289: =RC3 -> 0.27860696517412936 | H289: =RC3 -> 0.27860696517412936 | I289: =RC3 -> 0.27860696517412936 | J289: =RC3 -> 0.27860696517412936 | K289: =RC3 -> 0.27860696517412936 | L289: =RC3 -> 0.27860696517412936 | M289: =RC[-10] -> 0.27860696517412936
A290: =R[-1]C+3 -> 59 | B290: 201 | C290: =RC[-2]/RC[-1] -> 0.29353233830845771 | D290: =RC3 -> 0.29353233830845771 | E290: =RC3 -> 0.29353233830845771 | F290: =RC3 -> 0.29353233830845771 | G290: =RC3 -> 0.29353233830845771 | H290: =RC3 -> 0.29353233830845771 | I290: =RC3 -> 0.29353233830845771 | J290: =RC3 -> 0.29353233830845771 | K290: =RC3 -> 0.29353233830845771 | L290: =RC3 -> 0.29353233830845771 | M290: =RC[-10] -> 0.29353233830845771
A291: =R[-1]C+3 -> 62 | B291: 201 | C291: =RC[-2]/RC[-1] -> 0.30845771144278605 | D291: =RC3 -> 0.30845771144278605 | E291: =RC3 -> 0.30845771144278605 | F291: =RC3 -> 0.30845771144278605 | G291: =RC3 -> 0.30845771144278605 | H291: =RC3 -> 0.30845771144278605 | I291: =RC3 -> 0.30845771144278605 | J291: =RC3 -> 0.30845771144278605 | K291: =RC3 -> 0.30845771144278605 | L291: =RC3 -> 0.30845771144278605 | M291: =RC[-10] -> 0.30845771144278605
A292: =R[-1]C+3 -> 65 | B292: 201 | C292: =RC[-2]/RC[-1] -> 0.32338308457711445 | D292: =RC3 -> 0.32338308457711445 | E292: =RC3 -> 0.32338308457711445 | F292: =RC3 -> 0.32338308457711445 | G292: =RC3 -> 0.32338308457711445 | H292: =RC3 -> 0.32338308457711445 | I292: =RC3 -> 0.32338308457711445 | J292: =RC3 -> 0.32338308457711445 | K292: =RC3 -> 0.32338308457711445 | L292: =RC3 -> 0.32338308457711445 | M292: =RC[-10] -> 0.32338308457711445
A293: =R[-1]C+3 -> 68 | B293: 201 | C293: =RC[-2]/RC[-1] -> 0.3383084577114428 | D293: =RC3 -> 0.3383084577114428 | E293: =RC3 -> 0.3383084577114428 | F293: =RC3 -> 0.3383084577114428 | G293: =RC3 -> 0.3383084577114428 | H293: =RC3 -> 0.3383084577114428 | I293: =RC3 -> 0.3383084577114428 | J293: =RC3 -> 0.3383084577114428 | K293: =RC3 -> 0.3383084577114428 | L293: =RC3 -> 0.3383084577114428 | M293: =RC[-10] -> 0.3383084577114428
A294: =R[-1]C+3 -> 71 | B294: 201 | C294: =RC[-2]/RC[-1] -> 0.35323383084577115 | D294: =RC3 -> 0.35323383084577115 | E294: =RC3 -> 0.35323383084577115 | F294: =RC3 -> 0.35323383084577115 | G294: =RC3 -> 0.35323383084577115 | H294: =RC3 -> 0.35323383084577115 | I294: =RC3 -> 0.35323383084577115 | J294: =RC3 -> 0.35323383084577115 | K294: =RC3 -> 0.35323383084577115 | L294: =RC3 -> 0.35323383084577115 | M294: =RC[-10] -> 0.35323383084577115
A295: =R[-1]C+3 -> 74 | B295: 201 | C295: =RC[-2]/RC[-1] -> 0.36815920398009949 | D295: =RC3 -> 0.36815920398009949 | E295: =RC3 -> 0.36815920398009949 | F295: =RC3 -> 0.36815920398009949 | G295: =RC3 -> 0.36815920398009949 | H295: =RC3 -> 0.36815920398009949 | I295: =RC3 -> 0.36815920398009949 | J295: =RC3 -> 0.36815920398009949 | K295: =RC3 -> 0.36815920398009949 | L295: =RC3 -> 0.36815920398009949 | M295: =RC[-10] -> 0.36815920398009949
A296: =R[-1]C+3 -> 77 | B296: 201 | C296: =RC[-2]/RC[-1] -> 0.38308457711442784 | D296: =RC3 -> 0.38308457711442784 | E296: =RC3 -> 0.38308457711442784 | F296: =RC3 -> 0.38308457711442784 | G296: =RC3 -> 0.38308457711442784 | H296: =RC3 -> 0.38308457711442784 | I296: =RC3 -> 0.38308457711442784 | J296: =RC3 -> 0.38308457711442784 | K296: =RC3 -> 0.38308457711442784 | L296: =RC3 -> 0.38308457711442784 | M296: =RC[-10] -> 0.38308457711442784
A297: =R[-1]C+3 -> 80 | B297: 201 | C297: =RC[-2]/RC[-1] -> 0.39800995024875624 | D297: =RC3 -> 0.39800995024875624 | E297: =RC3 -> 0.39800995024875624 | F297: =RC3 -> 0.39800995024875624 | G297: =RC3 -> 0.39800995024875624 | H297: =RC3 -> 0.39800995024875624 | I297: =RC3 -> 0.39800995024875624 | J297: =RC3 -> 0.39800995024875624 | K297: =RC3 -> 0.39800995024875624 | L297: =RC3 -> 0.39800995024875624 | M297: =RC[-10] -> 0.39800995024875624
A298: =R[-1]C+3 -> 83 | B298: 201 | C298: =RC[-2]/RC[-1] -> 0.41293532338308458 | D298: =RC3 -> 0.41293532338308458 | E298: =RC3 -> 0.41293532338308458 | F298: =RC3 -> 0.41293532338308458 | G298: =RC3 -> 0.41293532338308458 | H298: =RC3 -> 0.41293532338308458 | I298: =RC3 -> 0.41293532338308458 | J298: =RC3 -> 0.41293532338308458 | K298: =RC3 -> 0.41293532338308458 | L298: =RC3 -> 0.41293532338308458 | M298: =RC[-10] -> 0.41293532338308458
A299: =R[-1]C+3 -> 86 | B299: 201 | C299: =RC[-2]/RC[-1] -> 0.42786069651741293 | D299: =RC3 -> 0.42786069651741293 | E299: =RC3 -> 0.42786069651741293 | F299: =RC3 -> 0.42786069651741293 | G299: =RC3 -> 0.42786069651741293 | H299: =RC3 -> 0.42786069651741293 | I299: =RC3 -> 0.42786069651741293 | J299: =RC3 -> 0.42786069651741293 | K299: =RC3 -> 0.42786069651741293 | L299: =RC3 -> 0.42786069651741293 | M299: =RC[-10] -> 0.42786069651741293
A300: =R[-1]C+3 -> 89 | B300: 201 | C300: =RC[-2]/RC[-1] -> 0.44278606965174128 | D300: =RC3 -> 0.44278606965174128 | E300: =RC3 -> 0.44278606965174128 | F300: =RC3 -> 0.44278606965174128 | G300: =RC3 -> 0.44278606965174128 | H300: =RC3 -> 0.44278606965174128 | I300: =RC3 -> 0.44278606965174128 | J300: =RC3 -> 0.44278606965174128 | K300: =RC3 -> 0.44278606965174128 | L300: =RC3 -> 0.44278606965174128 | M300: =RC[-10] -> 0.44278606965174128
A301: =R[-1]C+3 -> 92 | B301: 201 | C301: =RC[-2]/RC[-1] -> 0.45771144278606968 | D301: =RC3 -> 0.45771144278606968 | E301: =RC3 -> 0.45771144278606968 | F301: =RC3 -> 0.45771144278606968 | G301: =RC3 -> 0.45771144278606968 | H301: =RC3 -> 0.45771144278606968 | I301: =RC3 -> 0.45771144278606968 | J301: =RC3 -> 0.45771144278606968 | K301: =RC3 -> 0.45771144278606968 | L301: =RC3 -> 0.45771144278606968 | M301: =RC[-10] -> 0.45771144278606968
A302: =R[-1]C+3 -> 95 | B302: 201 | C302: =RC[-2]/RC[-1] -> 0.47263681592039802 | D302: =RC3 -> 0.47263681592039802 | E302: =RC3 -> 0.47263681592039802 | F302: =RC3 -> 0.47263681592039802 | G302: =RC3 -> 0.47263681592039802 | H302: =RC3 -> 0.47263681592039802 | I302: =RC3 -> 0.47263681592039802 | J302: =RC3 -> 0.47263681592039802 | K302: =RC3 -> 0.47263681592039802 | L302: =RC3 -> 0.47263681592039802 | M302: =RC[-10] -> 0.47263681592039802
A303: =R[-1]C+3 -> 98 | B303: 201 | C303: =RC[-2]/RC[-1] -> 0.48756218905472637 | D303: =RC3 -> 0.48756218905472637 | E303: =RC3 -> 0.48756218905472637 | F303: =RC3 -> 0.48756218905472637 | G303: =RC3 -> 0.48756218905472637 | H303: =RC3 -> 0.48756218905472637 | I303: =RC3 -> 0.48756218905472637 | J303: =RC3 -> 0.48756218905472637 | K303: =RC3 -> 0.48756218905472637 | L303: =RC3 -> 0.48756218905472637 | M303: =RC[-10] -> 0.48756218905472637
A304: =R[-1]C+3 -> 101 | B304: 201 | C304: =RC[-2]/RC[-1] -> 0.50248756218905477 | D304: =RC3 -> 0.50248756218905477 | E304: =RC3 -> 0.50248756218905477 | F304: =RC3 -> 0.50248756218905477 | G304: =RC3 -> 0.50248756218905477 | H304: =RC3 -> 0.50248756218905477 | I304: =RC3 -> 0.50248756218905477 | J304: =RC3 -> 0.50248756218905477 | K304: =RC3 -> 0.50248756218905477 | L304: =RC3 -> 0.50248756218905477 | M304: =RC[-10] -> 0.50248756218905477
A305: =R[-1]C+3 -> 104 | B305: 201 | C305: =RC[-2]/RC[-1] -> 0.51741293532338306 | D305: =RC3 -> 0.51741293532338306 | E305: =RC3 -> 0.51741293532338306 | F305: =RC3 -> 0.51741293532338306 | G305: =RC3 -> 0.51741293532338306 | H305: =RC3 -> 0.51741293532338306 | I305: =RC3 -> 0.51741293532338306 | J305: =RC3 -> 0.51741293532338306 | K305: =RC3 -> 0.51741293532338306 | L305: =RC3 -> 0.51741293532338306 | M305: =RC[-10] -> 0.51741293532338306
A306: =R[-1]C+3 -> 107 | B306: 201 | C306: =RC[-2]/RC[-1] -> 0.53233830845771146 | D306: =RC3 -> 0.53233830845771146 | E306: =RC3 -> 0.53233830845771146 | F306: =RC3 -> 0.53233830845771146 | G306: =RC3 -> 0.53233830845771146 | H306: =RC3 -> 0.53233830845771146 | I306: =RC3 -> 0.53233830845771146 | J306: =RC3 -> 0.53233830845771146 | K306: =RC3 -> 0.53233830845771146 | L306: =RC3 -> 0.53233830845771146 | M306: =RC[-10] -> 0.53233830845771146
A307: =R[-1]C+3 -> 110 | B307: 201 | C307: =RC[-2]/RC[-1] -> 0.54726368159203975 | D307: =RC3 -> 0.54726368159203975 | E307: =RC3 -> 0.54726368159203975 | F307: =RC3 -> 0.54726368159203975 | G307: =RC3 -> 0.54726368159203975 | H307: =RC3 -> 0.54726368159203975 | I307: =RC3 -> 0.54726368159203975 | J307: =RC3 -> 0.54726368159203975 | K307: =RC3 -> 0.54726368159203975 | L307: =RC3 -> 0.54726368159203975 | M307: =RC[-10] -> 0.54726368159203975
A308: =R[-1]C+3 -> 113 | B308: 201 | C308: =RC[-2]/RC[-1] -> 0.56218905472636815 | D308: =RC3 -> 0.56218905472636815 | E308: =RC3 -> 0.56218905472636815 | F308: =RC3 -> 0.56218905472636815 | G308: =RC3 -> 0.56218905472636815 | H308: =RC3 -> 0.56218905472636815 | I308: =RC3 -> 0.56218905472636815 | J308: =RC3 -> 0.56218905472636815 | K308: =RC3 -> 0.56218905472636815 | L308: =RC3 -> 0.56218905472636815 | M308: =RC[-10] -> 0.56218905472636815
A309: =R[-1]C+3 -> 116 | B309: 201 | C309: =RC[-2]/RC[-1] -> 0.57711442786069655 | D309: =RC3 -> 0.57711442786069655 | E309: =RC3 -> 0.57711442786069655 | F309: =RC3 -> 0.57711442786069655 | G309: =RC3 -> 0.57711442786069655 | H309: =RC3 -> 0.57711442786069655 | I309: =RC3 -> 0.57711442786069655 | J309: =RC3 -> 0.57711442786069655 | K309: =RC3 -> 0.57711442786069655 | L309: =RC3 -> 0.57711442786069655 | M309: =RC[-10] -> 0.57711442786069655
A310: =R[-1]C+3 -> 119 | B310: 201 | C310: =RC[-2]/RC[-1] -> 0.59203980099502485 | D310: =RC3 -> 0.59203980099502485 | E310: =RC3 -> 0.59203980099502485 | F310: =RC3 -> 0.59203980099502485 | G310: =RC3 -> 0.59203980099502485 | H310: =RC3 -> 0.59203980099502485 | I310: =RC3 -> 0.59203980099502485 | J310: =RC3 -> 0.59203980099502485 | K310: =RC3 -> 0.59203980099502485 | L310: =RC3 -> 0.59203980099502485 | M310: =RC[-10] -> 0.59203980099502485
A311: =R[-1]C+3 -> 122 | B311: 201 | C311: =RC[-2]/RC[-1] -> 0.60696517412935325 | D311: =RC3 -> 0.60696517412935325 | E311: =RC3 -> 0.60696517412935325 | F311: =RC3 -> 0.60696517412935325 | G311: =RC3 -> 0.60696517412935325 | H311: =RC3 -> 0.60696517412935325 | I311: =RC3 -> 0.60696517412935325 | J311: =RC3 -> 0.60696517412935325 | K311: =RC3 -> 0.60696517412935325 | L311: =RC3 -> 0.60696517412935325 | M311: =RC[-10] -> 0.60696517412935325
A312: =R[-1]C+3 -> 125 | B312: 201 | C312: =RC[-2]/RC[-1] -> 0.62189054726368154 | D312: =RC3 -> 0.62189054726368154 | E312: =RC3 -> 0.62189054726368154 | F312: =RC3 -> 0.62189054726368154 | G312: =RC3 -> 0.62189054726368154 | H312: =RC3 -> 0.62189054726368154 | I312: =RC3 -> 0.62189054726368154 | J312: =RC3 -> 0.62189054726368154 | K312: =RC3 -> 0.62189054726368154 | L312: =RC3 -> 0.62189054726368154 | M312: =RC[-10] -> 0.62189054726368154
A313: =R[-1]C+3 -> 128 | B313: 201 | C313: =RC[-2]/RC[-1] -> 0.63681592039800994 | D313: =RC3 -> 0.63681592039800994 | E313: =RC3 -> 0.63681592039800994 | F313: =RC3 -> 0.63681592039800994 | G313: =RC3 -> 0.63681592039800994 | H313: =RC3 -> 0.63681592039800994 | I313: =RC3 -> 0.63681592039800994 | J313: =RC3 -> 0.63681592039800994 | K313: =RC3 -> 0.63681592039800994 | L313: =RC3 -> 0.63681592039800994 | M313: =RC[-10] -> 0.63681592039800994
A314: =R[-1]C+3 -> 131 | B314: 201 | C314: =RC[-2]/RC[-1] -> 0.65174129353233834 | D314: =RC3 -> 0.65174129353233834 | E314: =RC3 -> 0.65174129353233834 | F314: =RC3 -> 0.65174129353233834 | G314: =RC3 -> 0.65174129353233834 | H314: =RC3 -> 0.65174129353233834 | I314: =RC3 -> 0.65174129353233834 | J314: =RC3 -> 0.65174129353233834 | K314: =RC3 -> 0.65174129353233834 | L314: =RC3 -> 0.65174129353233834 | M314: =RC[-10] -> 0.65174129353233834
A315: =R[-1]C+3 -> 134 | B315: 201 | C315: =RC[-2]/RC[-1] -> 0.66666666666666663 | D315: =RC3 -> 0.66666666666666663 | E315: =RC3 -> 0.66666666666666663 | F315: =RC3 -> 0.66666666666666663 | G315: =RC3 -> 0.66666666666666663 | H315: =RC3 -> 0.66666666666666663 | I315: =RC3 -> 0.66666666666666663 | J315: =RC3 -> 0.66666666666666663 | K315: =RC3 -> 0.66666666666666663 | L315: =RC3 -> 0.66666666666666663 | M315: =RC[-10] -> 0.66666666666666663
A316: =R[-1]C+3 -> 137 | B316: 201 | C316: =RC[-2]/RC[-1] -> 0.68159203980099503 | D316: =RC3 -> 0.68159203980099503 | E316: =RC3 -> 0.68159203980099503 | F316: =RC3 -> 0.68159203980099503 | G316: =RC3 -> 0.68159203980099503 | H316: =RC3 -> 0.68159203980099503 | I316: =RC3 -> 0.68159203980099503 | J316: =RC3 -> 0.68159203980099503 | K316: =RC3 -> 0.68159203980099503 | L316: =RC3 -> 0.68159203980099503 | M316: =RC[-10] -> 0.68159203980099503
A317: =R[-1]C+3 -> 140 | B317: 201 | C317: =RC[-2]/RC[-1] -> 0.69651741293532343 | D317: =RC3 -> 0.69651741293532343 | E317: =RC3 -> 0.69651741293532343 | F317: =RC3 -> 0.69651741293532343 | G317: =RC3 -> 0.69651741293532343 | H317: =RC3 -> 0.69651741293532343 | I317: =RC3 -> 0.69651741293532343 | J317: =RC3 -> 0.69651741293532343 | K317: =RC3 -> 0.69651741293532343 | L317: =RC3 -> 0.69651741293532343 | M317: =RC[-10] -> 0.69651741293532343
A318: =R[-1]C+3 -> 143 | B318: 201 | C318: =RC[-2]/RC[-1] -> 0.71144278606965172 | D318: =RC3 -> 0.71144278606965172 | E318: =RC3 -> 0.71144278606965172 | F318: =RC3 -> 0.71144278606965172 | G318: =RC3 -> 0.71144278606965172 | H318: =RC3 -> 0.71144278606965172 | I318: =RC3 -> 0.71144278606965172 | J318: =RC3 -> 0.71144278606965172 | K318: =RC3 -> 0.71144278606965172 | L318: =RC3 -> 0.71144278606965172 | M318: =RC[-10] -> 0.71144278606965172
A319: =R[-1]C+3 -> 146 | B319: 201 | C319: =RC[-2]/RC[-1] -> 0.72636815920398012 | D319: =RC3 -> 0.72636815920398012 | E319: =RC3 -> 0.72636815920398012 | F319: =RC3 -> 0.72636815920398012 | G319: =RC3 -> 0.72636815920398012 | H319: =RC3 -> 0.72636815920398012 | I319: =RC3 -> 0.72636815920398012 | J319: =RC3 -> 0.72636815920398012 | K319: =RC3 -> 0.72636815920398012 | L319: =RC3 -> 0.72636815920398012 | M319: =RC[-10] -> 0.72636815920398012
A320: =R[-1]C+3 -> 149 | B320: 201 | C320: =RC[-2]/RC[-1] -> 0.74129353233830841 | D320: =RC3 -> 0.74129353233830841 | E320: =RC3 -> 0.74129353233830841 | F320: =RC3 -> 0.74129353233830841 | G320: =RC3 -> 0.74129353233830841 | H320: =RC3 -> 0.74129353233830841 | I320: =RC3 -> 0.74129353233830841 | J320: =RC3 -> 0.74129353233830841 | K320: =RC3 -> 0.74129353233830841 | L320: =RC3 -> 0.74129353233830841 | M320: =RC[-10] -> 0.74129353233830841
A321: =R[-1]C+3 -> 152 | B321: 201 | C321: =RC[-2]/RC[-1] -> 0.75621890547263682 | D321: =RC3 -> 0.75621890547263682 | E321: =RC3 -> 0.75621890547263682 | F321: =RC3 -> 0.75621890547263682 | G321: =RC3 -> 0.75621890547263682 | H321: =RC3 -> 0.75621890547263682 | I321: =RC3 -> 0.75621890547263682 | J321: =RC3 -> 0.75621890547263682 | K321: =RC3 -> 0.75621890547263682 | L321: =RC3 -> 0.75621890547263682 | M321: =RC[-10] -> 0.75621890547263682
A322: =R[-1]C+3 -> 155 | B322: 201 | C322: =RC[-2]/RC[-1] -> 0.77114427860696522 | D322: =RC3 -> 0.77114427860696522 | E322: =RC3 -> 0.77114427860696522 | F322: =RC3 -> 0.77114427860696522 | G322: =RC3 -> 0.77114427860696522 | H322: =RC3 -> 0.77114427860696522 | I322: =RC3 -> 0.77114427860696522 | J322: =RC3 -> 0.77114427860696522 | K322: =RC3 -> 0.77114427860696522 | L322: =RC3 -> 0.77114427860696522 | M322: =RC[-10] -> 0.77114427860696522
A323: =R[-1]C+3 -> 158 | B323: 201 | C323: =RC[-2]/RC[-1] -> 0.78606965174129351 | D323: =RC3 -> 0.78606965174129351 | E323: =RC3 -> 0.78606965174129351 | F323: =RC3 -> 0.78606965174129351 | G323: =RC3 -> 0.78606965174129351 | H323: =RC3 -> 0.78606965174129351 | I323: =RC3 -> 0.78606965174129351 | J323: =RC3 -> 0.78606965174129351 | K323: =RC3 -> 0.78606965174129351 | L323: =RC3 -> 0.78606965174129351 | M323: =RC[-10] -> 0.78606965174129351
A324: =R[-1]C+3 -> 161 | B324: 201 | C324: =RC[-2]/RC[-1] -> 0.80099502487562191 | D324: =RC3 -> 0.80099502487562191 | E324: =RC3 -> 0.80099502487562191 | F324: =RC3 -> 0.80099502487562191 | G324: =RC3 -> 0.80099502487562191 | H324: =RC3 -> 0.80099502487562191 | I324: =RC3 -> 0.80099502487562191 | J324: =RC3 -> 0.80099502487562191 | K324: =RC3 -> 0.80099502487562191 | L324: =RC3 -> 0.80099502487562191 | M324: =RC[-10] -> 0.80099502487562191
A325: =R[-1]C+3 -> 164 | B325: 201 | C325: =RC[-2]/RC[-1] -> 0.8159203980099502 | D325: =RC3 -> 0.8159203980099502 | E325: =RC3 -> 0.8159203980099502 | F325: =RC3 -> 0.8159203980099502 | G325: =RC3 -> 0.8159203980099502 | H325: =RC3 -> 0.8159203980099502 | I325: =RC3 -> 0.8159203980099502 | J325: =RC3 -> 0.8159203980099502 | K325: =RC3 -> 0.8159203980099502 | L325: =RC3 -> 0.8159203980099502 | M325: =RC[-10] -> 0.8159203980099502
A326: =R[-1]C+3 -> 167 | B326: 201 | C326: =RC[-2]/RC[-1] -> 0.8308457711442786 | D326: =RC3 -> 0.8308457711442786 | E326: =RC3 -> 0.8308457711442786 | F326: =RC3 -> 0.8308457711442786 | G326: =RC3 -> 0.8308457711442786 | H326: =RC3 -> 0.8308457711442786 | I326: =RC3 -> 0.8308457711442786 | J326: =RC3 -> 0.8308457711442786 | K326: =RC3 -> 0.8308457711442786 | L326: =RC3 -> 0.8308457711442786 | M326: =RC[-10] -> 0.8308457711442786
A327: =R[-1]C+3 -> 170 | B327: 201 | C327: =RC[-2]/RC[-1] -> 0.845771144278607 | D327: =RC3 -> 0.845771144278607 | E327: =RC3 -> 0.845771144278607 | F327: =RC3 -> 0.845771144278607 | G327: =RC3 -> 0.845771144278607 | H327: =RC3 -> 0.845771144278607 | I327: =RC3 -> 0.845771144278607 | J327: =RC3 -> 0.845771144278607 | K327: =RC3 -> 0.845771144278607 | L327: =RC3 -> 0.845771144278607 | M327: =RC[-10] -> 0.845771144278607
A328: =R[-1]C+3 -> 173 | B328: 201 | C328: =RC[-2]/RC[-1] -> 0.86069651741293529 | D328: =RC3 -> 0.86069651741293529 | E328: =RC3 -> 0.86069651741293529 | F328: =RC3 -> 0.86069651741293529 | G328: =RC3 -> 0.86069651741293529 | H328: =RC3 -> 0.86069651741293529 | I328: =RC3 -> 0.86069651741293529 | J328: =RC3 -> 0.86069651741293529 | K328: =RC3 -> 0.86069651741293529 | L328: =RC3 -> 0.86069651741293529 | M328: =RC[-10] -> 0.86069651741293529
A329: =R[-1]C+3 -> 176 | B329: 201 | C329: =RC[-2]/RC[-1] -> 0.87562189054726369 | D329: =RC3 -> 0.87562189054726369 | E329: =RC3 -> 0.87562189054726369 | F329: =RC3 -> 0.87562189054726369 | G329: =RC3 -> 0.87562189054726369 | H329: =RC3 -> 0.87562189054726369 | I329: =RC3 -> 0.87562189054726369 | J329: =RC3 -> 0.87562189054726369 | K329: =RC3 -> 0.87562189054726369 | L329: =RC3 -> 0.87562189054726369 | M329: =RC[-10] -> 0.87562189054726369
A330: =R[-1]C+3 -> 179 | B330: 201 | C330: =RC[-2]/RC[-1] -> 0.89054726368159209 | D330: =RC3 -> 0.89054726368159209 | E330: =RC3 -> 0.89054726368159209 | F330: =RC3 -> 0.89054726368159209 | G330: =RC3 -> 0.89054726368159209 | H330: =RC3 -> 0.89054726368159209 | I330: =RC3 -> 0.89054726368159209 | J330: =RC3 -> 0.89054726368159209 | K330: =RC3 -> 0.89054726368159209 | L330: =RC3 -> 0.89054726368159209 | M330: =RC[-10] -> 0.89054726368159209
A331: =R[-1]C+3 -> 182 | B331: 201 | C331: =RC[-2]/RC[-1] -> 0.90547263681592038 | D331: =RC3 -> 0.90547263681592038 | E331: =RC3 -> 0.90547263681592038 | F331: =RC3 -> 0.90547263681592038 | G331: =RC3 -> 0.90547263681592038 | H331: =RC3 -> 0.90547263681592038 | I331: =RC3 -> 0.90547263681592038 | J331: =RC3 -> 0.90547263681592038 | K331: =RC3 -> 0.90547263681592038 | L331: =RC3 -> 0.90547263681592038 | M331: =RC[-10] -> 0.90547263681592038
A332: =R[-1]C+3 -> 185 | B332: 201 | C332: =RC[-2]/RC[-1] -> 0.92039800995024879 | D332: =RC3 -> 0.92039800995024879 | E332: =RC3 -> 0.92039800995024879 | F332: =RC3 -> 0.92039800995024879 | G332: =RC3 -> 0.92039800995024879 | H332: =RC3 -> 0.92039800995024879 | I332: =RC3 -> 0.92039800995024879 | J332: =RC3 -> 0.92039800995024879 | K332: =RC3 -> 0.92039800995024879 | L332: =RC3 -> 0.92039800995024879 | M332: =RC[-10] -> 0.92039800995024879
A333: =R[-1]C+3 -> 188 | B333: 201 | C333: =RC[-2]/RC[-1] -> 0.93532338308457708 | D333: =RC3 -> 0.93532338308457708 | E333: =RC3 -> 0.93532338308457708 | F333: =RC3 -> 0.93532338308457708 | G333: =RC3 -> 0.93532338308457708 | H333: =RC3 -> 0.93532338308457708 | I333: =RC3 -> 0.93532338308457708 | J333: =RC3 -> 0.93532338308457708 | K333: =RC3 -> 0.93532338308457708 | L333: =RC3 -> 0.93532338308457708 | M333: =RC[-10] -> 0.93532338308457708
A334: =R[-1]C+3 -> 191 | B334: 201 | C334: =RC[-2]/RC[-1] -> 0.95024875621890548 | D334: =RC3 -> 0.95024875621890548 | E334: =RC3 -> 0.95024875621890548 | F334: =RC3 -> 0.95024875621890548 | G334: =RC3 -> 0.95024875621890548 | H334: =RC3 -> 0.95024875621890548 | I334: =RC3 -> 0.95024875621890548 | J334: =RC3 -> 0.95024875621890548 | K334: =RC3 -> 0.95024875621890548 | L334: =RC3 -> 0.95024875621890548 | M334: =RC[-10] -> 0.95024875621890548
A335: =R[-1]C+3 -> 194 | B335: 201 | C335: =RC[-2]/RC[-1] -> 0.96517412935323388 | D335: =RC3 -> 0.96517412935323388 | E335: =RC3 -> 0.96517412935323388 | F335: =RC3 -> 0.96517412935323388 | G335: =RC3 -> 0.96517412935323388 | H335: =RC3 -> 0.96517412935323388 | I335: =RC3 -> 0.96517412935323388 | J335: =RC3 -> 0.96517412935323388 | K335: =RC3 -> 0.96517412935323388 | L335: =RC3 -> 0.96517412935323388 | M335: =RC[-10] -> 0.96517412935323388
A336: =R[-1]C+3 -> 197 | B336: 201 | C336: =RC[-2]/RC[-1] -> 0.98009950248756217 | D336: =RC3 -> 0.98009950248756217 | E336: =RC3 -> 0.98009950248756217 | F336: =RC3 -> 0.98009950248756217 | G336: =RC3 -> 0.98009950248756217 | H336: =RC3 -> 0.98009950248756217 | I336: =RC3 -> 0.98009950248756217 | J336: =RC3 -> 0.98009950248756217 | K336: =RC3 -> 0.98009950248756217 | L336: =RC3 -> 0.98009950248756217 | M336: =RC[-10] -> 0.98009950248756217
A337: =R[-1]C+3 -> 200 | B337: 201 | C337: =RC[-2]/RC[-1] -> 0.99502487562189057 | D337: =RC3 -> 0.99502487562189057 | E337: =RC3 -> 0.99502487562189057 | F337: =RC3 -> 0.99502487562189057 | G337: =RC3 -> 0.99502487562189057 | H337: =RC3 -> 0.99502487562189057 | I337: =RC3 -> 0.99502487562189057 | J337: =RC3 -> 0.99502487562189057 | K337: =RC3 -> 0.99502487562189057 | L337: =RC3 -> 0.99502487562189057 | M337: =RC[-10] -> 0.99502487562189057
A338: =R[-1]C+3 -> 203 | B338: 201 | C338: =RC[-2]/RC[-1] -> 1.0099502487562189 | D338: =RC3 -> 1.0099502487562189 | E338: =RC3 -> 1.0099502487562189 | F338: =RC3 -> 1.0099502487562189 | G338: =RC3 -> 1.0099502487562189 | H338: =RC3 -> 1.0099502487562189 | I338: =RC3 -> 1.0099502487562189 | J338: =RC3 -> 1.0099502487562189 | K338: =RC3 -> 1.0099502487562189 | L338: =RC3 -> 1.0099502487562189 | M338: =RC[-10] -> 1.0099502487562189
A339: =R[-1]C+3 -> 206 | B339: 201 | C339: =RC[-2]/RC[-1] -> 1.0248756218905473 | D339: =RC3 -> 1.0248756218905473 | E339: =RC3 -> 1.0248756218905473 | F339: =RC3 -> 1.0248756218905473 | G339: =RC3 -> 1.0248756218905473 | H339: =RC3 -> 1.0248756218905473 | I339: =RC3 -> 1.0248756218905473 | J339: =RC3 -> 1.0248756218905473 | K339: =RC3 -> 1.0248756218905473 | L339: =RC3 -> 1.0248756218905473 | M339: =RC[-10] -> 1.0248756218905473
A340: =R[-1]C+3 -> 209 | B340: 201 | C340: =RC[-2]/RC[-1] -> 1.0398009950248757 | D340: =RC3 -> 1.0398009950248757 | E340: =RC3 -> 1.0398009950248757 | F340: =RC3 -> 1.0398009950248757 | G340: =RC3 -> 1.0398009950248757 | H340: =RC3 -> 1.0398009950248757 | I340: =RC3 -> 1.0398009950248757 | J340: =RC3 -> 1.0398009950248757 | K340: =RC3 -> 1.0398009950248757 | L340: =RC3 -> 1.0398009950248757 | M340: =RC[-10] -> 1.0398009950248757
A341: =R[-1]C+3 -> 212 | B341: 201 | C341: =RC[-2]/RC[-1] -> 1.0547263681592041 | D341: =RC3 -> 1.0547263681592041 | E341: =RC3 -> 1.0547263681592041 | F341: =RC3 -> 1.0547263681592041 | G341: =RC3 -> 1.0547263681592041 | H341: =RC3 -> 1.0547263681592041 | I341: =RC3 -> 1.0547263681592041 | J341: =RC3 -> 1.0547263681592041 | K341: =RC3 -> 1.0547263681592041 | L341: =RC3 -> 1.0547263681592041 | M341: =RC[-10] -> 1.0547263681592041
A342: =R[-1]C+3 -> 215 | B342: 201 | C342: =RC[-2]/RC[-1] -> 1.0696517412935322 | D342: =RC3 -> 1.0696517412935322 | E342: =RC3 -> 1.0696517412935322 | F342: =RC3 -> 1.0696517412935322 | G342: =RC3 -> 1.0696517412935322 | H342: =RC3 -> 1.0696517412935322 | I342: =RC3 -> 1.0696517412935322 | J342: =RC3 -> 1.0696517412935322 | K342: =RC3 -> 1.0696517412935322 | L342: =RC3 -> 1.0696517412935322 | M342: =RC[-10] -> 1.0696517412935322
A343: =R[-1]C+3 -> 218 | B343: 201 | C343: =RC[-2]/RC[-1] -> 1.0845771144278606 | D343: =RC3 -> 1.0845771144278606 | E343: =RC3 -> 1.0845771144278606 | F343: =RC3 -> 1.0845771144278606 | G343: =RC3 -> 1.0845771144278606 | H343: =RC3 -> 1.0845771144278606 | I343: =RC3 -> 1.0845771144278606 | J343: =RC3 -> 1.0845771144278606 | K343: =RC3 -> 1.0845771144278606 | L343: =RC3 -> 1.0845771144278606 | M343: =RC[-10] -> 1.0845771144278606
A344: =R[-1]C+3 -> 221 | B344: 201 | C344: =RC[-2]/RC[-1] -> 1.099502487562189 | D344: =RC3 -> 1.099502487562189 | E344: =RC3 -> 1.099502487562189 | F344: =RC3 -> 1.099502487562189 | G344: =RC3 -> 1.099502487562189 | H344: =RC3 -> 1.099502487562189 | I344: =RC3 -> 1.099502487562189 | J344: =RC3 -> 1.099502487562189 | K344: =RC3 -> 1.099502487562189 | L344: =RC3 -> 1.099502487562189 | M344: =RC[-10] -> 1.099502487562189
A345: =R[-1]C+3 -> 224 | B345: 201 | C345: =RC[-2]/RC[-1] -> 1.1144278606965174 | D345: =RC3 -> 1.1144278606965174 | E345: =RC3 -> 1.1144278606965174 | F345: =RC3 -> 1.1144278606965174 | G345: =RC3 -> 1.1144278606965174 | H345: =RC3 -> 1.1144278606965174 | I345: =RC3 -> 1.1144278606965174 | J345: =RC3 -> 1.1144278606965174 | K345: =RC3 -> 1.1144278606965174 | L345: =RC3 -> 1.1144278606965174 | M345: =RC[-10] -> 1.1144278606965174
A346: =R[-1]C+3 -> 227 | B346: 201 | C346: =RC[-2]/RC[-1] -> 1.1293532338308458 | D346: =RC3 -> 1.1293532338308458 | E346: =RC3 -> 1.1293532338308458 | F346: =RC3 -> 1.1293532338308458 | G346: =RC3 -> 1.1293532338308458 | H346: =RC3 -> 1.1293532338308458 | I346: =RC3 -> 1.1293532338308458 | J346: =RC3 -> 1.1293532338308458 | K346: =RC3 -> 1.1293532338308458 | L346: =RC3 -> 1.1293532338308458 | M346: =RC[-10] -> 1.1293532338308458
A347: =R[-1]C+3 -> 230 | B347: 201 | C347: =RC[-2]/RC[-1] -> 1.144278606965174 | D347: =RC3 -> 1.144278606965174 | E347: =RC3 -> 1.144278606965174 | F347: =RC3 -> 1.144278606965174 | G347: =RC3 -> 1.144278606965174 | H347: =RC3 -> 1.144278606965174 | I347: =RC3 -> 1.144278606965174 | J347: =RC3 -> 1.144278606965174 | K347: =RC3 -> 1.144278606965174 | L347: =RC3 -> 1.144278606965174 | M347: =RC[-10] -> 1.144278606965174
A348: =R[-1]C+3 -> 233 | B348: 201 | C348: =RC[-2]/RC[-1] -> 1.1592039800995024 | D348: =RC3 -> 1.1592039800995024 | E348: =RC3 -> 1.1592039800995024 | F348: =RC3 -> 1.1592039800995024 | G348: =RC3 -> 1.1592039800995024 | H348: =RC3 -> 1.1592039800995024 | I348: =RC3 -> 1.1592039800995024 | J348: =RC3 -> 1.1592039800995024 | K348: =RC3 -> 1.1592039800995024 | L348: =RC3 -> 1.1592039800995024 | M348: =RC[-10] -> 1.1592039800995024
A349: =R[-1]C+3 -> 236 | B349: 201 | C349: =RC[-2]/RC[-1] -> 1.1741293532338308 | D349: =RC3 -> 1.1741293532338308 | E349: =RC3 -> 1.1741293532338308 | F349: =RC3 -> 1.1741293532338308 | G349: =RC3 -> 1.1741293532338308 | H349: =RC3 -> 1.1741293532338308 | I349: =RC3 -> 1.1741293532338308 | J349: =RC3 -> 1.1741293532338308 | K349: =RC3 -> 1.1741293532338308 | L349: =RC3 -> 1.1741293532338308 | M349: =RC[-10] -> 1.1741293532338308
A350: =R[-1]C+3 -> 239 | B350: 201 | C350: =RC[-2]/RC[-1] -> 1.1890547263681592 | D350: =RC3 -> 1.1890547263681592 | E350: =RC3 -> 1.1890547263681592 | F350: =RC3 -> 1.1890547263681592 | G350: =RC3 -> 1.1890547263681592 | H350: =RC3 -> 1.1890547263681592 | I350: =RC3 -> 1.1890547263681592 | J350: =RC3 -> 1.1890547263681592 | K350: =RC3 -> 1.1890547263681592 | L350: =RC3 -> 1.1890547263681592 | M350: =RC[-10] -> 1.1890547263681592
A351: =R[-1]C+3 -> 242 | B351: 201 | C351: =RC[-2]/RC[-1] -> 1.2039800995024876 | D351: =RC3 -> 1.2039800995024876 | E351: =RC3 -> 1.2039800995024876 | F351: =RC3 -> 1.2039800995024876 | G351: =RC3 -> 1.2039800995024876 | H351: =RC3 -> 1.2039800995024876 | I351: =RC3 -> 1.2039800995024876 | J351: =RC3 -> 1.2039800995024876 | K351: =RC3 -> 1.2039800995024876 | L351: =RC3 -> 1.2039800995024876 | M351: =RC[-10] -> 1.2039800995024876
A352: =R[-1]C+3 -> 245 | B352: 201 | C352: =RC[-2]/RC[-1] -> 1.2189054726368158 | D352: =RC3 -> 1.2189054726368158 | E352: =RC3 -> 1.2189054726368158 | F352: =RC3 -> 1.2189054726368158 | G352: =RC3 -> 1.2189054726368158 | H352: =RC3 -> 1.2189054726368158 | I352: =RC3 -> 1.2189054726368158 | J352: =RC3 -> 1.2189054726368158 | K352: =RC3 -> 1.2189054726368158 | L352: =RC3 -> 1.2189054726368158 | M352: =RC[-10] -> 1.2189054726368158
A353: =R[-1]C+3 -> 248 | B353: 201 | C353: =RC[-2]/RC[-1] -> 1.2338308457711442 | D353: =RC3 -> 1.2338308457711442 | E353: =RC3 -> 1.2338308457711442 | F353: =RC3 -> 1.2338308457711442 | G353: =RC3 -> 1.2338308457711442 | H353: =RC3 -> 1.2338308457711442 | I353: =RC3 -> 1.2338308457711442 | J353: =RC3 -> 1.2338308457711442 | K353: =RC3 -> 1.2338308457711442 | L353: =RC3 -> 1.2338308457711442 | M353: =RC[-10] -> 1.2338308457711442
A354: =R[-1]C+3 -> 251 | B354: 201 | C354: =RC[-2]/RC[-1] -> 1.2487562189054726 | D354: =RC3 -> 1.2487562189054726 | E354: =RC3 -> 1.2487562189054726 | F354: =RC3 -> 1.2487562189054726 | G354: =RC3 -> 1.2487562189054726 | H354: =RC3 -> 1.2487562189054726 | I354: =RC3 -> 1.2487562189054726 | J354: =RC3 -> 1.2487562189054726 | K354: =RC3 -> 1.2487562189054726 | L354: =RC3 -> 1.2487562189054726 | M354: =RC[-10] -> 1.2487562189054726
A355: =R[-1]C+3 -> 254 | B355: 201 | C355: =RC[-2]/RC[-1] -> 1.263681592039801 | D355: =RC3 -> 1.263681592039801 | E355: =RC3 -> 1.263681592039801 | F355: =RC3 -> 1.263681592039801 | G355: =RC3 -> 1.263681592039801 | H355: =RC3 -> 1.263681592039801 | I355: =RC3 -> 1.263681592039801 | J355: =RC3 -> 1.263681592039801 | K355: =RC3 -> 1.263681592039801 | L355: =RC3 -> 1.263681592039801 | M355: =RC[-10] -> 1.263681592039801