Sheet: Sheet1
A1: Numbers | B1: Strings | C1: Inline Strings | D1: Formulas
A2: 12 | B2: A | C2: 1st Inline String | D2: =RC[-3] -> 12
A3: 32 | B3: B | C3: 2nd Inline String | D3: =RC[-3]+R[-1]C[-3] -> 44
A4: 43 | B4: C | C4: More | D4: =RC[-3]-R2C[-3] -> 31
A5: 42 | B5: ABCDE | C5: B | D5: =RC[-3]-R2C[-3] -> 30
A6: 22 | B6: Long Text | C6: And More | D6: =RC[-3]-R2C[-3] -> 10
A7: 21 | B7: Longer Text | C7: The End | D7: =RC[-3]-R2C[-3] -> 9