Sheet: Sheet1
A2: 还原利润表
A4: 三农属性：
A5: 编制单位: | D5: 机构代号: | F5: 制表日期:
A6: 代码 | B6: 项目名称 | C6: 科目号 | D6: 金额 | E6: 代码 | F6: 项目名称 | G6: 科目号 | H6: 金额
A7: 01 | B7: 一、贷款利息收入类 | C7: A5010002 | E7: 07 | F7: 七、利息支出类 | G7: A5020002
A8: 77101 | B8: 房地产贷款利息收入 | C8: A5010004 | E8: 87101 | F8: 个人活期存款利息支出 | G8: A5020004
A9: 1 | B9: 短期单位房地产贷款利息收入 | C9: A5010005 | E9: 1 | F9: 个人结算存款利息支出 | G9: A5020005
A10: 2 | B10: 中期单位房地产贷款利息收入 | C10: A5010007 | E10: 2 | F10: 个人活期储蓄存款利息支出 | G10: A5020007
A11: 3 | B11: 长期单位房地产贷款利息收入 | C11: A5010009 | E11: 3 | F11: 个人借记卡存款利息支出 | G11: A5020009
A12: 4 | B12: 短期个人住房贷款利息收入 | C12: A5010011 | E12: 4 | F12: 个人准贷记卡存款利息支出 | G12: A5020011
A13: 5 | B13: 中期个人住房贷款利息收入 | C13: A5010013 | E13: 5 | F13: 其他个人活期存款利息支出 | G13: A5020013
A14: 6 | B14: 长期个人住房贷款利息收入 | C14: A5010015 | E14: 6 | F14: 惠农个人借记卡存款利息支出 | G14: A5020600
A15: 77102 | B15: 汽车贷款利息收入 | C15: A5010017 | E15: 7 | F15: 惠农个人结算存款利息支出 | G15: A5020602
A16: 1 | B16: 短期单位汽车贷款利息收入 | C16: A5010018 | E16: 8 | F16: 惠农其他活期存款利息支出 | G16: A5020604
A17: 2 | B17: 中期单位汽车贷款利息收入 | C17: A5010020 | E17: 9 | F17: 惠农个人活期储蓄存款利息支出 | G17: A5020606
A18: 3 | B18: 短期个人汽车消费贷款利息收入 | C18: A5010022 | E18: 87201 | F18: 单位活期存款利息支出 | G18: A5020016
A19: 4 | B19: 中期个人汽车消费贷款利息收入 | C19: A5010024 | E19: 1 | F19: 单位活期存款利息支出 | G19: A5020017
A20: 77103 | B20: 扶贫贷款利息收入 | C20: A5010026 | E20: 2 | F20: 单位借记卡存款利息支出 | G20: A5020019
A21: 1 | B21: 短期单位扶贫贷款利息收入 | C21: A5010027 | E21: 3 | F21: 单位准贷记卡存款利息支出 | G21: A5020021
A22: 2 | B22: 中期单位扶贫贷款利息收入 | C22: A5010029 | E22: 4 | F22: 其他单位活期存款利息支出 | G22: A5020023
A23: 3 | B23: 长期单位扶贫贷款利息收入 | C23: A5010031 | E23: 87301 | F23: 个人定期储蓄存款利息支出 | G23: A5020026
A24: 4 | B24: 短期个人扶贫贷款利息收入 | C24: A5010033 | E24: 1 | F24: 一个月定期储蓄存款利息支出 | G24: A5020027
A25: 5 | B25: 中期个人扶贫贷款利息收入 | C25: A5010035 | E25: 2 | F25: 三个月定期储蓄存款利息支出 | G25: A5020029
A26: 6 | B26: 长期个人扶贫贷款利息收入 | C26: A5010037 | E26: 3 | F26: 六个月定期储蓄存款利息支出 | G26: A5020031
A27: 77104 | B27: 项目融资贷款利息收入 | C27: A5010039 | E27: 4 | F27: 一年定期储蓄存款利息支出 | G27: A5020033
A28: 1 | B28: 短期项目融资贷款利息收入 | C28: A5010040 | E28: 5 | F28: 二年期定期储蓄存款利息支出 | G28: A5020035
A29: 2 | B29: 中期项目融资贷款利息收入 | C29: A5010042 | E29: 6 | F29: 三年期定期储蓄存款利息支出 | G29: A5020037
A30: 3 | B30: 长期项目融资贷款利息收入 | C30: A5010044 | E30: 7 | F30: 五年及以上定期储蓄存款利息支出 | G30: A5020039
A31: 77105 | B31: 其他一般固定资产贷款利息收入 | C31: A5010046 | E31: 87321 | F31: 惠农个人定期储蓄存款利息支出 | G31: A5020608
A32: 1 | B32: 短期其他固定资产贷款利息收入 | C32: A5010047 | E32: 1 | F32: 惠农一个月定期储蓄存款利息支出 | G32: A5020609
A33: 2 | B33: 中期其他固定资产贷款利息收入 | C33: A5010049 | E33: 2 | F33: 惠农三个月定期储蓄存款利息支出 | G33: A5020611
A34: 3 | B34: 长期其他固定资产贷款利息收入 | C34: A5010051 | E34: 3 | F34: 惠农六个月定期储蓄存款利息支出 | G34: A5020613
A35: 77106 | B35: 流动资金贷款利息收入 | C35: A5010053 | E35: 4 | F35: 惠农一年定期储蓄存款利息支出 | G35: A5020615
A36: 1 | B36: 短期流动资金贷款利息收入 | C36: A5010054 | E36: 5 | F36: 惠农二年定期储蓄存款利息支出 | G36: A5020617
A37: 2 | B37: 中期流动资金贷款利息收入 | C37: A5010056 | E37: 6 | F37: 惠农三年定期储蓄存款利息支出 | G37: A5020619
A38: 77107 | B38: 消费贷款利息收入 | C38: A5010058 | E38: 7 | F38: 惠农五年定期储蓄存款利息支出 | G38: A5020621
A39: 1 | B39: 短期个人一般消费贷款利息收入 | C39: A5010059 | E39: 87401 | F39: 单位定期存款利息支出 | G39: A5020042
A40: 2 | B40: 中期个人一般消费贷款利息收入 | C40: A5010061 | E40: 1 | F40: 一个月定期存款利息支出 | G40: A5020043
A41: 3 | B41: 长期个人一般消费贷款利息收入 | C41: A5010063 | E41: 2 | F41: 三个月定期存款利息支出 | G41: A5020045
A42: 77108 | B42: 助学贷款利息收入 | C42: A5010065 | E42: 3 | F42: 六个月定期存款利息支出 | G42: A5020047
A43: 1 | B43: 短期个人助学贷款利息收入 | C43: A5010066 | E43: 4 | F43: 一年期定期存款利息支出 | G43: A5020049
A44: 2 | B44: 中期个人助学贷款利息收入 | C44: A5010068 | E44: 5 | F44: 二年期定期存款利息支出 | G44: A5020051
A45: 3 | B45: 长期个人助学贷款利息收入 | C45: A5010070 | E45: 6 | F45: 三年期定期存款利息支出 | G45: A5020053
A46: 77109 | B46: 个人生产经营贷款利息收入 | C46: A5010072 | E46: 7 | F46: 五年期定期存款利息支出 | G46: A5020055
A47: 1 | B47: 短期个人生产经营贷款利息收入 | C47: A5010073 | E47: 87501 | F47: 其他利息支出 | G47: A5020058
A48: 2 | B48: 中期个人生产经营贷款利息收入 | C48: A5010075 | E48: 1 | F48: 保证金存款利息支出 | G48: A5020059
A49: 3 | B49: 长期个人生产经营贷款利息收入 | C49: A5010077 | E49: 2 | F49: 协议存款利息支出 | G49: A5020061
A50: 77110 | B50: 单位透支利息收入 | C50: A5010079 | E50: 3 | F50: 其他存款利息支出 | G50: A5020063
A51: 1 | B51: 单位活期存款透支利息收入 | C51: A5010080 | E51: 4 | F51: 发行债券利息支出 | G51: A5020065
A52: 2 | B52: 单位贷记卡透支利息收入 | C52: A5010082 | E52: 87502 | F52: 结构性产品超额利息支出 | G52: A5020067
A53: 3 | B53: 单位准贷记卡透支利息收入 | C53: A5010084 | E53: 1 | F53: 存贷双赢房贷理财超额利息支出 | G53: A5020068
A54: 77111 | B54: 个人透支利息收入 | C54: A5010086 | E54: 08 | F54: 八、金融机构往来支出类 | G54: A5020070
A55: 1 | B55: 个人贷记卡透支利息收入 | C55: A5010087 | E55: 88101 | F55: 央行往来利息支出 | G55: A5020072
A56: 2 | B56: 个人准贷记卡透支利息收入 | C56: A5010089 | E56: 1 | F56: 再贷款利息支出 | G56: A5020073
A57: 77112 | B57: 贸易融资贷款利息收入 | C57: A5010091 | E57: 2 | F57: 公开市场业务利息支出 | G57: A5020075
A58: 1 | B58: 进口押汇利息收入 | C58: A5010092 | E58: 88201 | F58: 同业存放款项利息支出 | G58: A5020078
A59: 2 | B59: 出口押汇利息收入 | C59: A5010094 | E59: 1 | F59: 同业存放结算性款项利息支出 | G59: A5020079
A60: 3 | B60: 打包贷款利息收入 | C60: A5010096 | E60: 2 | F60: 同业存放合作性款项利息支出 | G60: A5020081
A61: 4 | B61: 信用证融资利息收入 | C61: A5010098 | E61: 88301 | F61: 同业拆借款项利息支出 | G61: A5020084
A62: 5 | B62: 出口贴现利息收入 | C62: A5010100 | E62: 1 | F62: 同业拆入款项利息支出 | G62: A5020085
A63: 6 | B63: 其他贸易融资利息收入 | C63: A5010102 | E63: 2 | F63: 同业借入款项利息支出 | G63: A5020087
A64: 77113 | B64: 银团贷款利息收入 | C64: A5010104 | E64: 88401 | F64: 转贴现融资利息支出 | G64: A5020090
A65: 1 | B65: 短期银团贷款利息收入 | C65: A5010105 | E65: 1 | F65: 银行承兑汇票转贴现利息支出 | G65: A5020091
A66: 2 | B66: 中期银团贷款利息收入 | C66: A5010107 | E66: 2 | F66: 商业承兑汇票转贴现利息支出 | G66: A5020093
A67: 3 | B67: 长期银团贷款利息收入 | C67: A5010109 | E67: 88501 | F67: 卖出回购业务利息支出 | G67: A5020096
A68: 77114 | B68: 转贷款利息收入 | C68: A5010111 | E68: 1 | F68: 卖出回购证券利息支出 | G68: A5020097
A69: 1 | B69: 短期转贷款利息收入 | C69: A5010112 | E69: 2 | F69: 卖出回购票据利息支出 | G69: A5020099
A70: =R[-1]C+1 -> 2 | B70: 中期转贷款利息收入 | C70: A5010114 | E70: 3 | F70: 卖出回购信贷资产利息支出 | G70: A5020101
A71: =R[-1]C+1 -> 3 | B71: 长期转贷款利息收入 | C71: A5010116 | E71: 88601 | F71: 系统内资金往来利息支出 | G71: A5020104
A72: 77115 | B72: 贴现利息收入 | C72: A5010118 | E72: 1 | F72: 一级分行存入款项利息支出 | G72: A5020105
A73: 1 | B73: 银行承兑汇票贴现利息收入 | C73: A5010119 | E73: 2 | F73: 二级分行存入款项利息支出 | G73: A5020107
A74: 2 | B74: 商业承兑汇票贴现利息收入 | C74: A5010121 | E74: 3 | F74: 支行存入款项利息支出 | G74: A5020109
A75: 3 | B75: 买入票据利息收入 | C75: A5010123 | E75: 4 | F75: 营业网点存入款项利息支出 | G75: A5020111
A76: 4 | B76: 票据贴现垫款利息收入 | C76: A5010125 | E76: 5 | F76: 境外机构存入款项利息支出 | G76: A5020113
A77: 77116 | B77: 个人农业贷款利息收入 | C77: A5010127 | E77: 6 | F77: 下级行存放自动清算款项利息支出 | G77: A5020115
A78: 1 | B78: 短期个人农业贷款利息收入 | C78: A5010128 | E78: 7 | F78: 借入总行款项利息支出 | G78: A5020117
A79: 2 | B79: 中期个人农业贷款利息收入 | C79: A5010130 | E79: 8 | F79: 借入一级分行款项利息支出 | G79: A5020119
A80: 3 | B80: 长期个人农业贷款利息收入 | C80: A5010132 | E80: 9 | F80: 借入二级分行款项利息支出 | G80: A5020121
A81: 4 | B81: 短期农户普惠贷款利息收入 | C81: A5010657 | E81: 10 | F81: 借入支行款项利息支出 | G81: A5020123
A82: 77177 | B82: 个人综合授信贷款利息收入 | C82: A5010134 | E82: 11 | F82: 跨行往来款项利息支出 | G82: A5020125
A83: 1 | B83: 短期个人综合授信贷款利息收入 | C83: A5010135 | E83: 12 | F83: 系统内部资金和服务计价支出 | G83: A5020127
A84: 2 | B84: 中期个人综合授信贷款利息收入 | C84: A5010137 | E84: 13 | F84: 一级分行存入特种票据专项资金利息支出 | G84: A5020129
A85: 3 | B85: 长期个人综合授信贷款利息收入 | C85: A5010139 | E85: 09 | F85: 九、管理费用类 | G85: A5020140
A86: 77199 | B86: 其他贷款利息收入 | C86: A5010141 | E86: 89101 | F86: 人员费用 | G86: A5020142
A87: 1 | B87: 出口买方信贷利息收入 | C87: A5010142 | E87: 1 | F87: 工资 | G87: A5020143
A88: 2 | B88: 扶贫贷款利差补贴收入 | C88: A5010144 | E88: 2 | F88: 临时工工资 | G88: A5020145
A89: 3 | B89: 其他政策性贷款利差补贴收入 | C89: A5010146 | E89: 3 | F89: 内退职工基本生活费 | G89: A5020147
A90: 4 | B90: 财政性资金垫款利息收入 | C90: A5010148 | E90: 4 | F90: 职工福利费 | G90: A5020149
A91: 5 | B91: 财政支付额度垫款利息收入 | C91: A5010150 | E91: 5 | F91: 工会经费 | G91: A5020151
A92: 6 | B92: 其他贷款利息收入 | C92: A5010152 | E92: 6 | F92: 职工教育经费 | G92: A5020153
A93: 77201 | B93: 非应计贷款利息收入 | C93: A5010155 | E93: 7 | F93: 劳动保险费 | G93: A5020155
A94: 1 | B94: 非应计单位房地产贷款利息收入 | C94: A5010156 | E94: 8 | F94: 离退休劳动保险费 | G94: A5020157
A95: 2 | B95: 非应计个人住房贷款利息收入 | C95: A5010158 | E95: 9 | F95: 失业保险费 | G95: A5020159
A96: 3 | B96: 非应计单位汽车贷款利息收入 | C96: A5010160 | E96: 10 | F96: 医疗保险费 | G96: A5020161
A97: 4 | B97: 非应计个人汽车贷款利息收入 | C97: A5010162 | E97: 11 | F97: 住房公积金 | G97: A5020163
A98: 5 | B98: 非应计单位扶贫贷款利息收入 | C98: A5010164 | E98: 12 | F98: 住房补贴 | G98: A5020165
A99: 6 | B99: 非应计个人扶贫贷款利息收入 | C99: A5010166 | E99: 13 | F99: 基本养老保险 | G99: A5020549
A100: 7 | B100: 非应计项目融资贷款利息收入 | C100: A5010168 | E100: 14 | F100: 补充养老保险 | G100: A5020547
A101: 8 | B101: 非应计其他固定资产贷款利息收入 | C101: A5010170 | E101: 15 | F101: 补充医疗保险 | G101: A5020551
A102: 9 | B102: 非应计流动资金贷款利息收入 | C102: A5010172 | E102: 89201 | F102: 业务管理费用 | G102: A5020168
A103: 10 | B103: 非应计消费贷款利息收入 | C103: A5010174 | E103: 1 | F103: 公杂费 | G103: A5020169
A104: 11 | B104: 非应计个人综合授信贷款利息收入 | C104: A5010198 | E104: 2 | F104: 差旅费 | G104: A5020175
A105: 12 | B105: 非应计助学贷款利息收入 | C105: A5010176 | E105: 3 | F105: 会议费 | G105: A5020182
A106: 13 | B106: 非应计个人生产经营贷款利息收入 | C106: A5010178 | E106: 4 | F106: 外事费 | G106: A5020189
A107: 14 | B107: 非应计单位透支利息收入 | C107: A5010180 | E107: 5 | F107: 邮电费 | G107: A5020196
A108: 15 | B108: 非应计个人透支利息收入 | C108: A5010182 | E108: 6 | F108: 印刷费 | G108: A5020202
A109: 16 | B109: 非应计贸易融资利息收入 | C109: A5010184 | E109: 7 | F109: 水电费 | G109: A5020207
A110: 17 | B110: 非应计银团贷款利息收入 | C110: A5010186 | E110: 8 | F110: 劳动保护费 | G110: A5020211
A111: 18 | B111: 非应计转贷款利息收入 | C111: A5010188 | E111: 9 | F111: 车船使用费 | G111: A5020217
A112: 19 | B112: 非应计贴现垫款利息收入 | C112: A5010190 | E112: 10 | F112: 宣教费 | G112: A5020223
A113: 20 | B113: 非应计个人农业贷款利息收入 | C113: A5010196 | E113: 11 | F113: 取暖降温费 | G113: A5020228
A114: 21 | B114: 非应计单位其他贷款利息收入 | C114: A5010192 | E114: 12 | F114: 房屋租赁费 | G114: A5020233
A115: 22 | B115: 非应计个人其他贷款利息收入 | C115: A5010194 | E115: 13 | F115: 电子设备租赁费 | G115: A5020236
A116: 77301 | B116: 冲减贷款利息收入 | C116: A5010201 | E116: 14 | F116: 通讯线路租赁费 | G116: A5020239
A117: 1 | B117: 冲减单位房地产贷款利息收入 | C117: A5010202 | E117: 15 | F117: 其他租赁费 | G117: A5020242
A118: 2 | B118: 冲减个人住房贷款利息收入 | C118: A5010204 | E118: 16 | F118: 钞币运送费 | G118: A5020245
A119: 3 | B119: 冲减单位汽车贷款利息收入 | C119: A5010206 | E119: 17 | F119: 电子设备运转费 | G119: A5020253
A120: 4 | B120: 冲减个人汽车贷款利息收入 | C120: A5010208 | E120: 18 | F120: 安全防卫费 | G120: A5020259
A121: 5 | B121: 冲减单位扶贫贷款利息收入 | C121: A5010210 | E121: 19 | F121: 房屋修理费 | G121: A5020267
A122: 6 | B122: 冲减个人扶贫贷款利息收入 | C122: A5010212 | E122: 20 | F122: 机器设备修理费 | G122: A5020270
A123: 7 | B123: 冲减项目融资贷款利息收入 | C123: A5010214 | E123: 21 | F123: 车辆修理费 | G123: A5020273
A124: 8 | B124: 冲减其他固定资产贷款利息收入 | C124: A5010216 | E124: 22 | F124: 房产保险费 | G124: A5020276
A125: 9 | B125: 冲减流动资金贷款利息收入 | C125: A5010218 | E125: 23 | F125: 电子设备保险费 | G125: A5020279
A126: 10 | B126: 冲减消费贷款利息收入 | C126: A5010220 | E126: 24 | F126: 汽车保险费 | G126: A5020282
A127: 11 | B127: 冲减个人综合授信贷款利息收入 | C127: A5010244 | E127: 25 | F127: 其他财产保险费 | G127: A5020285
A128: 12 | B128: 冲减助学贷款利息收入 | C128: A5010222 | E128: 26 | F128: 法律事务费 | G128: A5020289
A129: 13 | B129: 冲减个人生产经营贷款利息收入 | C129: A5010224 | E129: 27 | F129: 审计费 | G129: A5020327
A130: 14 | B130: 冲减单位透支利息收入 | C130: A5010226 | E130: 28 | F130: 研究开发费 | G130: A5020332
A131: 15 | B131: 冲减个人透支利息收入 | C131: A5010228 | E131: 29 | F131: 咨询费 | G131: A5020294
A132: 16 | B132: 冲减贸易融资利息收入 | C132: A5010230 | E132: 30 | F132: 广告费 | G132: A5020297
A133: 17 | B133: 冲减银团贷款利息收入 | C133: A5010232 | E133: 31 | F133: 业务宣传费 | G133: A5020305
A134: 18 | B134: 冲减转贷款利息收入 | C134: A5010234 | E134: 32 | F134: 业务招待费 | G134: A5020310
A135: 19 | B135: 冲减贴现垫款利息收入 | C135: A5010236 | E135: 33 | F135: 物业管理费 | G135: A5020314
A136: 20 | B136: 冲减个人农业贷款利息收入 | C136: A5010242 | E136: 34 | F136: 税金 | G136: A5020317
A137: 21 | B137: 冲减单位其他贷款利息收入 | C137: A5010238 | E137: 35 | F137: 监管费 | G137: A5020324
A138: 22 | B138: 冲减个人其他贷款利息收入 | C138: A5010240 | E138: 36 | F138: 无形资产摊销 | G138: A5020337
A139: 77401 | B139: 消化贷款应收利息包袱 | C139: A5010247 | E139: 37 | F139: 房屋修理费摊销 | G139: A5020344
A140: 1 | B140: 消化贷款应收利息包袱 | C140: A5010248 | E140: 38 | F140: 房屋租赁费摊销 | G140: A5020349
A141: 02 | B141: 二、金融机构往来收入类 | C141: A5010250 | E141: 39 | F141: 电子设备租赁费摊销 | G141: A5020352
A142: 78101 | B142: 央行往来利息收入 | C142: A5010252 | E142: 40 | F142: 其他费用 | G142: A5020355
A143: 1 | B143: 法定准备金存款利息收入 | C143: A5010253 | E143: 10 | F143: 十、中间业务手续费支出类 | G143: A5020360
A144: 2 | B144: 超额准备金存款利息收入 | C144: A5010255 | E144: 90101 | F144: 银行卡手续费支出 | G144: A5020362
A145: 3 | B145: 公开市场业务利息收入 | C145: A5010257 | E145: 1 | F145: 借记卡银联手续费支出 | G145: A5020363
A146: 78201 | B146: 存放同业款项利息收入 | C146: A5010260 | E146: 2 | F146: 准贷记卡银联手续费支出 | G146: A5020365
A147: 1 | B147: 存放同业结算性款项利息收入 | C147: A5010261 | E147: 3 | F147: 贷记卡银联手续费支出 | G147: A5020367
A148: 2 | B148: 存放同业合作性款项利息收入 | C148: A5010263 | E148: 4 | F148: 借记卡国际组织手续费支出 | G148: A5020369
A149: 78202 | B149: 拆借同业款项利息收入 | C149: A5010266 | E149: 5 | F149: 准贷记卡国际组织手续费支出 | G149: A5020371
A150: 1 | B150: 拆放同业款项利息收入 | C150: A5010267 | E150: 6 | F150: 贷记卡国际组织手续费支出 | G150: A5020373
A151: 2 | B151: 同业借款利息收入 | C151: A5010269 | E151: 7 | F151: 借记卡其他手续费支出 | G151: A5020375
A152: 78301 | B152: 国家助学贷款补偿金收入 | C152: A5010272 | E152: 8 | F152: 准贷记卡其他手续费支出 | G152: A5020377
A153: 1 | B153: 国家助学贷款补偿金收入 | C153: A5010273 | E153: 9 | F153: 贷记卡其他手续费支出 | G153: A5020379
A154: 78401 | B154: 转贴现利息收入 | C154: A5010276 | E154: 10 | F154: 国际卡收单手续费支出 | G154: A5020381
A155: 1 | B155: 银行承兑汇票转贴现利息收入 | C155: A5010277 | E155: 11 | F155: 惠农借记卡银联手续费支出 | G155: A5020623
A156: 2 | B156: 商业承兑汇票转贴现利息收入 | C156: A5010279 | E156: 12 | F156: 惠农借记卡其他手续费支出 | G156: A5020625
A157: 78501 | B157: 买入返售业务利息收入 | C157: A5010282 | E157: 90102 | F157: 票据交换手续费支出 | G157: A5020383
A158: 1 | B158: 买入回售证券利息收入 | C158: A5010283 | E158: 1 | F158: 票据交换手续费支出 | G158: A5020384
A159: 2 | B159: 买入回售票据利息收入 | C159: A5010285 | E159: 90103 | F159: 国债手续费支出 | G159: A5020391
A160: 3 | B160: 买入回售信贷资产利息收入 | C160: A5010287 | E160: 1 | F160: 国债手续费支出 | G160: A5020392
A161: 78601 | B161: 系统内资金往来利息收入 | C161: A5010290 | E161: 90104 | F161: 贸易融资手续费支出 | G161: A5020394
A162: 1 | B162: 存放总行款项利息收入 | C162: A5010291 | E162: 1 | F162: 贸易融资手续费支出 | G162: A5020395
A163: 2 | B163: 存放一级分行款项利息收入 | C163: A5010293 | E163: 90199 | F163: 其他业务手续费支出 | G163: A5020397
A164: 3 | B164: 存放二级分行款项利息收入 | C164: A5010295 | E164: 1 | F164: 其他业务手续费支出 | G164: A5020398
A165: 4 | B165: 存放支行款项利息收入 | C165: A5010297 | E165: 2 | F165: 银团贷款手续费支出 | G165: A5020406
A166: 5 | B166: 存放上级行自动清算款项利息收入 | C166: A5010299 | E166: 11 | F166: 十一、其他营业支出类 | G166: A5020408
A167: 6 | B167: 借给一级分行款项利息收入 | C167: A5010301 | E167: 91101 | F167: 外汇买卖支出 | G167: A5020410
A168: 7 | B168: 借给二级分行款项利息收入 | C168: A5010303 | E168: 1 | F168: 结售汇业务支出 | G168: A5020411
A169: 8 | B169: 借给支行款项利息收入 | C169: A5010305 | E169: 2 | F169: 外汇买卖业务支出 | G169: A5020413
A170: 9 | B170: 借给营业网点款项利息收入 | C170: A5010307 | E170: 3 | F170: 外汇营运资金汇兑损益支出 | G170: A5020592
A171: 10 | B171: 借给境外机构款项利息收入 | C171: A5010309 | E171: 4 | F171: 其他外汇买卖业务支出 | G171: A5020415
A172: 11 | B172: 跨行往来款项利息收入 | C172: A5010311 | E172: 91102 | F172: 证券买卖支出 | G172: A5020417
A173: 12 | B173: 系统内部资金和服务计价收入 | C173: A5010313 | E173: 1 | F173: 经营性国债买卖损失 | G173: A5020418
A174: 13 | B174: 存放总行特种票据专项资金利息收入 | C174: A5010315 | E174: 2 | F174: 其他证券买卖损失 | G174: A5020420
A175: 78701 | B175: 金融机构往来表外利息收入 | C175: A5010318 | E175: 91103 | F175: 贵金属买卖支出 | G175: A5020422
A176: 1 | B176: 存放同业款项表外利息收入 | C176: A5010319 | E176: 1 | F176: 贵金属买卖支出 | G176: A5020423
A177: 2 | B177: 拆放同业款项表外利息收入 | C177: A5010321 | E177: 2 | F177: 实物黄金买卖损失 | G177: A5020627
A178: 3 | B178: 同业借款表外利息收入 | C178: A5010323 | E178: 91104 | F178: 自营金融衍生产品支出 | G178: A5020425
A179: 78801 | B179: 冲减金融机构往来利息收入 | C179: A5010326 | E179: 1 | F179: 远期合约业务支出 | G179: A5020426
A180: 1 | B180: 冲减存放同业款项利息收入 | C180: A5010327 | E180: 2 | F180: 期权业务支出 | G180: A5020428
A181: 2 | B181: 冲减拆放同业款项利息收入 | C181: A5010329 | E181: 3 | F181: 互换业务支出 | G181: A5020430
A182: 3 | B182: 冲减同业借款利息收入 | C182: A5010331 | E182: 4 | F182: 其他金融衍生产品支出 | G182: A5020432
A183: 78901 | B183: 消化金融机构往来应收利息包袱 | C183: A5010334 | E183: 91105 | F183: 固定资产折旧支出 | G183: A5020434
A184: 1 | B184: 消化金融机构往来应收利息包袱 | C184: A5010335 | E184: 1 | F184: 建筑物折旧支出 | G184: A5020435
A185: 03 | B185: 三、中间业务收入类 | C185: A5010337 | E185: 2 | F185: 机械设备折旧支出 | G185: A5020437
A186: 79101 | B186: 银行卡业务收入 | C186: A5010339 | E186: 3 | F186: 交通运输设备折旧支出 | G186: A5020439
A187: 1 | B187: 借记卡消费手续费收入 | C187: A5010340 | E187: 4 | F187: 其他固定资产折旧支出 | G187: A5020441
A188: 2 | B188: 准贷记卡消费手续费收入 | C188: A5010342 | E188: 5 | F188: 固定资产确权折旧支出 | G188: A5020575
A189: 3 | B189: 贷记卡消费手续费收入 | C189: A5010344 | E189: 6 | F189: 预估转固自有固定资产改良支出折旧支出 | G189: A5020596
A190: 4 | B190: 借记卡年费收入 | C190: A5010346 | E190: 7 | F190: 正式转固自有固定资产改良支出折旧支出 | G190: A5020598
A191: 5 | B191: 准贷记卡年费收入 | C191: A5010348 | E191: 12 | F191: 十二、营业税及附加 | G191: A5020443
A192: 6 | B192: 贷记卡年费收入 | C192: A5010350 | E192: 92101 | F192: 营业税及附加 | G192: A5020445
A193: 7 | B193: 借记卡现金及转账手续费收入 | C193: A5010352 | E193: 1 | F193: 营业税 | G193: A5020446
A194: 8 | B194: 准贷记卡现金及转账手续费收入 | C194: A5010354 | E194: 2 | F194: 城市维护建设税 | G194: A5020448
A195: 9 | B195: 贷记卡现金及转账手续费收入 | C195: A5010356 | E195: 3 | F195: 教育费附加 | G195: A5020450
A196: 10 | B196: 个人借记卡小额账户收费收入 | C196: A5010358 | E196: 4 | F196: 其他税费 | G196: A5020452
A197: 11 | B197: 借记卡其他手续费收入 | C197: A5010360 | E197: 13 | F197: 十三、营业外支出类 | G197: A5020454
A198: 12 | B198: 准贷记卡其他手续费收入 | C198: A5010362 | E198: 93101 | F198: 资产处置损失 | G198: A5020456
A199: 13 | B199: 贷记卡其他手续费收入 | C199: A5010364 | E199: 1 | F199: 固定资产清理净损失 | G199: A5020457
A200: 14 | B200: POS受理他行卡手续费收入 | C200: A5010366 | E200: 2 | F200: 非常损失 | G200: A5020459
A201: 15 | B201: ATM受理他行卡手续费收入 | C201: A5010368 | E201: =R[-1]C+1 -> 3 | F201: 案件损失 | G201: A5020461
A202: 16 | B202: 其他渠道受理他行卡手续费收入 | C202: A5010370 | E202: =R[-1]C+1 -> 4 | F202: 抵债资产处置损失 | G202: A5020463
A203: 17 | B203: 国际卡收单手续费收入 | C203: A5010372 | E203: =R[-1]C+1 -> 5 | F203: 房改职工住房清理损失 | G203: A5020465
A204: 18 | B204: 惠农借记卡消费手续费收入 | C204: A5010669 | E204: 6 | F204: 消化抵债资产处置损失 | G204: A5020467
A205: 19 | B205: 惠农借记卡年费收入 | C205: A5010671 | E205: 7 | F205: 消化案件损失 | G205: A5020469
A206: 20 | B206: 惠农借记卡现金及转账交易手续费收入 | C206: A5010673 | E206: 8 | F206: 资金清算损失 | G206: A5020594
A207: 21 | B207: 惠农借记卡其他手续费收入 | C207: A5010675 | E207: 93102 | F207: 固定资产盘亏 | G207: A5020472
A208: 79102 | B208: 代理保险业务收入 | C208: A5010374 | E208: 1 | F208: 固定资产盘亏 | G208: A5020473
A209: 1 | B209: 代理财险手续费收入 | C209: A5010375 | E209: 93201 | F209: 公益救济性捐赠支出 | G209: A5020476
A210: 2 | B210: 代理寿险手续费收入 | C210: A5010377 | E210: 1 | F210: 公益救济性捐赠支出 | G210: A5020477
A211: 3 | B211: 代收保费手续费收入 | C211: A5010379 | E211: 93301 | F211: 院校经费支出 | G211: A5020480
A212: 4 | B212: 代付保险金手续费收入 | C212: A5010381 | E212: 1 | F212: 院校经费支出 | G212: A5020481
A213: 5 | B213: 代理保险其他手续费收入 | C213: A5010383 | E213: 93401 | F213: 其他营业外支出 | G213: A5020484
A214: 79103 | B214: 代收代付业务收入 | C214: A5010385 | E214: 1 | F214: 下岗保障支出 | G214: A5020485
A215: 1 | B215: 代理发放工资手续费收入 | C215: A5010386 | E215: =R[-1]C+1 -> 2 | F215: 赔偿和违约支出 | G215: A5020487
A216: 2 | B216: 代收公用事业费手续费收入 | C216: A5010388 | E216: 3 | F216: 罚没支出 | G216: A5020489
A217: 3 | B217: 代收行政事业费手续费收入 | C217: A5010390 | E217: 4 | F217: 存款不动户支出 | G217: A5020491
A218: 4 | B218: 代收电讯费手续费收入 | C218: A5010392 | E218: 5 | F218: 其他支出 | G218: A5020493
A219: 5 | B219: 代扣代缴税金手续费收入 | C219: A5010394 | E219: 14 | F219: 十四、资产减值准备支出类 | G219: A5020495
A220: 6 | B220: 其他代收代付业务手续费收入 | C220: A5010396 | E220: 94101 | F220: 贷款损失基本准备支出 | G220: A5020497
A221: 79104 | B221: 代理金融机构业务收入 | C221: A5010398 | E221: 1 | F221: 贷款损失基本准备支出 | G221: A5020498
A222: 1 | B222: 代理商业银行业务手续费收入 | C222: A5010399 | E222: 94102 | F222: 贷款损失专项准备支出 | G222: A5020500
A223: 2 | B223: 代理政策性银行业务手续费收入 | C223: A5010401 | E223: 1 | F223: 贷款损失专项准备支出 | G223: A5020501
A224: 3 | B224: 代理资产管理公司业务手续费收入 | C224: A5010403 | E224: 94103 | F224: 卡透支损失准备支出 | G224: A5020503
A225: 4 | B225: 代理证券公司业务手续费收入 | C225: A5010405 | E225: 1 | F225: 卡透支损失准备支出 | G225: A5020504
A226: 5 | B226: 代理邮政储汇业务手续费收入 | C226: A5010407 | E226: 94104 | F226: 坏账准备支出 | G226: A5020506
A227: 6 | B227: 代理其他金融机构业务手续费收入 | C227: A5010409 | E227: 1 | F227: 坏账准备支出 | G227: A5020507
A228: 79105 | B228: 结算业务收入 | C228: A5010411 | E228: 94105 | F228: 长期投资减值准备支出 | G228: A5020509
A229: 1 | B229: 单位电子汇划手续费收入 | C229: A5010412 | E229: 1 | F229: 长期投资减值准备支出 | G229: A5020510
A230: 2 | B230: 个人电子汇划手续费收入 | C230: A5010414 | E230: 94106 | F230: 抵债资产减值准备支出 | G230: A5020512
A231: 3 | B231: 其他单位结算手续费收入 | C231: A5010416 | E231: 1 | F231: 抵债资产减值准备支出 | G231: A5020513
A232: 4 | B232: 其他个人结算手续费收入 | C232: A5010418 | E232: 94107 | F232: 待清理境外资产减值准备支出 | G232: A5020589
A233: 5 | B233: 外汇汇款手续费收入 | C233: A5010420 | E233: 1 | F233: 待清理境外资产减值准备支出 | G233: A5020590
A234: 6 | B234: 信用证手续费收入 | C234: A5010422 | E234: 15 | F234: 十五、所得税支出类 | G234: A5020518
A235: 7 | B235: 托收手续费收入 | C235: A5010424 | E235: 95101 | F235: 所得税支出 | G235: A5020520
A236: 8 | B236: 其他国际结算手续费收入 | C236: A5010426 | E236: 1 | F236: 预缴所得税 | G236: A5020521
A237: 79106 | B237: 代理基金业务收入 | C237: A5010428 | E237: 2 | F237: 就地查补所得税 | G237: A5020523
A238: 1 | B238: 开放式基金托管收入 | C238: A5010429
A239: 2 | B239: 封闭式基金托管收入 | C239: A5010431
A240: 3 | B240: 代理基金销售手续费收入 | C240: A5010433
A241: 4 | B241: 企业年金托管收入 | C241: A5010435
A242: 5 | B242: 社保基金托管收入 | C242: A5010437
A243: 6 | B243: 其他代理基金收入 | C243: A5010439
A244: 79107 | B244: 代客理财业务手续费收入 | C244: A5010441
A245: 1 | B245: 代客外汇买卖手续费收入 | C245: A5010442
A246: 2 | B246: 代客理财手续费收入 | C246: A5010444
A247: 3 | B247: 代客（个人）理财手续费收入 | C247: A5010446
A248: 4 | B248: 代客证券业务手续费收入 | C248: A5010448
A249: 5 | B249: 其他代客理财业务手续费收入 | C249: A5010450
A250: 79108 | B250: 融资手续费收入 | C250: A5010452
A251: 1 | B251: 贸易融资手续费收入 | C251: A5010453
A252: 2 | B252: 出口买方信贷手续费收入 | C252: A5010455
A253: 3 | B253: 银团贷款手续费收入 | C253: A5010457
A254: 4 | B254: 融券手续费收入 | C254: A5010459
A255: 5 | B255: 其他融资业务手续费收入 | C255: A5010461
A256: 79109 | B256: 国债手续费收入 | C256: A5010463
A257: 1 | B257: 代销及兑付国债手续费收入 | C257: A5010464
A258: 2 | B258: 其他国债手续费收入 | C258: A5010466
A259: 79110 | B259: 电子银行业务收入 | C259: A5010468
A260: 1 | B260: 网上银行工本费收入 | C260: A5010469
A261: =R[-1]C+1 -> 2 | B261: 电话银行工本费收入 | C261: A5010471
A262: =R[-1]C+1 -> 3 | B262: 网上银行年费收入 | C262: A5010473
A263: =R[-1]C+1 -> 4 | B263: 电话银行年费收入 | C263: A5010475
A264: =R[-1]C+1 -> 5 | B264: 网上银行交易手续费收入 | C264: A5010477
A265: =R[-1]C+1 -> 6 | B265: 电话银行交易手续费收入 | C265: A5010479
A266: =R[-1]C+1 -> 7 | B266: 手机银行年费收入 | C266: A5010663
A267: =R[-1]C+1 -> 8 | B267: 手机银行交易手续费收入 | C267: A5010665
A268: =R[-1]C+1 -> 9 | B268: 其他电子银行业务收入 | C268: A5010667
A269: 79111 | B269: 财务顾问业务收入 | C269: A5010481
A270: 1 | B270: 常年财务顾问收入 | C270: A5010482
A271: =R[-1]C+1 -> 2 | B271: 短期融资券财务顾问收入 | C271: A5010484
A272: =R[-1]C+1 -> 3 | B272: 境内企业境外上市财务顾问收入 | C272: A5010486
A273: =R[-1]C+1 -> 4 | B273: 企业债券财务顾问收入 | C273: A5010488
A274: =R[-1]C+1 -> 5 | B274: 资产证券化财务顾问收入 | C274: A5010490
A275: =R[-1]C+1 -> 6 | B275: 信托融资财务顾问收入 | C275: A5010492
A276: =R[-1]C+1 -> 7 | B276: 理财顾问收入 | C276: A5010494
A277: =R[-1]C+1 -> 8 | B277: 投融资顾问收入 | C277: A5010496
A278: =R[-1]C+1 -> 9 | B278: 其他专项财务顾问收入 | C278: A5010498
A279: 79112 | B279: 托管业务收入 | C279: A5010637
A280: 1 | B280: 证券投资基金托管费收入 | C280: A5010638
A281: =R[-1]C+1 -> 2 | B281: 养老金托管费收入 | C281: A5010640
A282: =R[-1]C+1 -> 3 | B282: 保险资金托管费收入 | C282: A5010642
A283: =R[-1]C+1 -> 4 | B283: 委托资产托管费收入 | C283: A5010644
A284: =R[-1]C+1 -> 5 | B284: 合格境外机构投资者托管费收入 | C284: A5010646
A285: =R[-1]C+1 -> 6 | B285: 合格境内机构投资者托管费收入 | C285: A5010648
A286: =R[-1]C+1 -> 7 | B286: 其他资产托管费收入 | C286: A5010650
A287: 79199 | B287: 其他中间业务收入 | C287: A5010500
A288: 1 | B288: 承诺业务收入 | C288: A5010501
A289: 2 | B289: 银行承兑汇票承兑手续费收入 | C289: A5010503
A290: 3 | B290: 担保业务手续费收入 | C290: A5010505
A291: 4 | B291: 代保管业务收入 | C291: A5010507
A292: 5 | B292: 咨询业务收入 | C292: A5010509
A293: 6 | B293: 债券托管业务收入 | C293: A5010511
A294: 7 | B294: 转贷款业务收入 | C294: A5010513
A295: 8 | B295: 选择权费收入 | C295: A5010515
A296: =R[-1]C+1 -> 9 | B296: 提前还款违约金收入 | C296: A5010517
A297: =R[-1]C+1 -> 10 | B297: 个人活期存折小额账户收费收入 | C297: A5010519
A298: =R[-1]C+1 -> 11 | B298: 个人存款证明书手续费收入 | C298: A5010521
A299: =R[-1]C+1 -> 12 | B299: 其他中间业务收入 | C299: A5010523
A300: 04 | B300: 四、其他营业收入类 | C300: A5010525
A301: 80101 | B301: 外汇买卖收入 | C301: A5010527
A302: 1 | B302: 结售汇业务收入 | C302: A5010530
A303: 2 | B303: 外汇买卖业务收入 | C303: A5010528
A304: 3 | B304: 其他外汇买卖业务收入 | C304: A5010532
A305: 4 | B305: 外汇营运资金汇兑损益收入 | C305: A5010659
A306: 80102 | B306: 证券买卖资本利得 | C306: A5010534
A307: 1 | B307: 经营性国债买卖资本利得 | C307: A5010535
A308: 2 | B308: 其他经营性证券买卖资本利得 | C308: A5010537
A309: 80103 | B309: 贵金属买卖收入 | C309: A5010539
A310: 1 | B310: 贵金属买卖收入 | C310: A5010540
A311: 2 | B311: 实物黄金买卖收入 | C311: A5010661
A312: 80104 | B312: 自营金融衍生产品收入 | C312: A5010542
A313: 1 | B313: 远期合约业务收入 | C313: A5010543
A314: 2 | B314: 期权业务收入 | C314: A5010545
A315: 3 | B315: 互换业务收入 | C315: A5010547
A316: 4 | B316: 其他金融衍生业务收入 | C316: A5010549
A317: 80105 | B317: 租赁收入 | C317: A5010551
A318: 1 | B318: 固定资产租赁收入 | C318: A5010552
A319: 2 | B319: 其他资产租赁收入 | C319: A5010554
A320: 80199 | B320: 其他收入 | C320: A5010556
A321: 1 | B321: 其他收入 | C321: A5010557
A322: 05 | B322: 五、投资收益类 | C322: A5010559
A323: 81101 | B323: 短期投资收益 | C323: A5010561
A324: 1 | B324: 境内短期国债投资收益 | C324: A5010562
A325: 2 | B325: 境内短期金融债券投资收益 | C325: A5010564
A326: 3 | B326: 境内其他短期投资收益 | C326: A5010566
A327: 4 | B327: 外国政府短期债权投资收益 | C327: A5010568
A328: 5 | B328: 境外短期金融机构债权投资收益 | C328: A5010570
A329: 6 | B329: 境外短期非金融机构债权投资收益 | C329: A5010572
A330: 7 | B330: 美国国债短期债权投资收益 | C330: A5010574
A331: 81102 | B331: 自营债券利息收入 | C331: A5010652
A332: 1 | B332: 自营国债利息收入 | C332: A5010653
A333: 2 | B333: 其他自营证券利息收入 | C333: A5010656
A334: 81201 | B334: 长期投资收益 | C334: A5010577
A335: 1 | B335: 境内股权投资收益 | C335: A5010578
A336: 2 | B336: 境内长期国债投资收益 | C336: A5010580
A337: 3 | B337: 境内长期金融债券投资收益 | C337: A5010582
A338: 4 | B338: 境内其他长期投资收益 | C338: A5010584
A339: 5 | B339: 外国政府长期债权投资收益 | C339: A5010586
A340: 6 | B340: 境外长期金融机构债权投资收益 | C340: A5010588
A341: 7 | B341: 境外长期非金融机构债权投资收益 | C341: A5010590
A342: 8 | B342: 美国国债长期债权投资收益 | C342: A5010592
A343: 06 | B343: 六、营业外收入类 | C343: A5010594
A344: 82101 | B344: 资产处置收益 | C344: A5010596
A345: 1 | B345: 固定资产清理净收益 | C345: A5010597
A346: 2 | B346: 抵债资产保管和处置收益 | C346: A5010599
A347: 3 | B347: 2004年以前接收的抵债资产保管和处置收益 | C347: A5010601
A348: 82102 | B348: 固定资产盘盈 | C348: A5010604
A349: 1 | B349: 固定资产盘盈 | C349: A5010605
A350: 82201 | B350: 其他营业外收入 | C350: A5010608
A351: 1 | B351: 收回已核销呆账收入 | C351: A5010609
A352: 2 | B352: 罚款收入 | C352: A5010611
A353: 3 | B353: 存款不动户清理收入 | C353: A5010613
A354: 4 | B354: 其他收入 | C354: A5010615
A356: 收入小计 | E356: 支出小计
A357: 税前亏损 | E357: 税前利润
A358: 净亏损 | E358: 净利润
A359: 总计 | E359: 总计
B360: FMIS本年利润(网点专用) | C360: F0000072 | F360: FMIS列支数与计提数差额 | G360: F0000058