Sheet: Sheet1
A1: 2882.82 | B1: 1 | C1: 2 | D1: =+RC[-1]/RC[-2]*RC[-3] -> 5765.64
A2: 4166.67 | B2: 1 | C2: 2 | D2: =+RC[-1]/RC[-2]*RC[-3] -> 8333.34
A3: 3125 | B3: 1 | C3: 2 | D3: =+RC[-1]/RC[-2]*RC[-3] -> 6250
A4: 3761.6 | B4: 1 | C4: 2 | D4: =+RC[-1]/RC[-2]*RC[-3] -> 7523.2
A5: 2416.67 | B5: 1 | C5: 2 | D5: =+RC[-1]/RC[-2]*RC[-3] -> 4833.34
A6: 3010.91 | B6: 1 | C6: 2 | D6: =+RC[-1]/RC[-2]*RC[-3] -> 6021.82