Sheet: Sheet1
A1: cell A1 | B1: 71 | E1: =ROW(RC[-1]) -> 1 | F1: =100+RC[-4] -> 171 | G1: =COUNT(RC[-3]:RC[-2]) -> 1 | I1: 11
A2: cell A2 | B2: 72 | E2: =ROW(RC[-1]) -> 2 | F2: =100+RC[-4] -> 172 | G2: =COUNT(RC[-3]:RC[-2]) -> 1 | I2: 12
A3: cell A3 | B3: 73 | E3: =ROW(RC[-1]) -> 3 | F3: =100+RC[-4] -> 173 | G3: =COUNT(RC[-3]:RC[-2]) -> 1 | I3: 13
A4: cell A4 | B4: 74 | E4: =ROW(RC[-1]) -> 4 | F4: =100+RC[-4] -> 174 | G4: =COUNT(RC[-3]:RC[-2]) -> 1 | I4: 14
A5: cell A5 | B5: 75 | E5: =ROW(RC[-1]) -> 5 | F5: =100+RC[-4] -> 175 | G5: =COUNT(RC[-3]:RC[-2]) -> 1 | I5: 15
B7: =200+R[-6]C -> 271
B8: =200+R[-6]C -> 272
B9: =200+R[-6]C -> 273
A15: =R[-3]C -> 0
A18: Range/Area formulas
A19: 1 to 2 | B19: 1 to 5 | C19: 2 to 5 | D19: 3 to 5
A20: =SUM(NR_1_2) -> 23 | B20: =SUM(NR_1_5) -> 65 | C20: =SUM(NR_2_5) -> 54 | D20: =SUM(NR_3_5) -> 42
A21: =SUM(R[-20]C[8]:R[-19]C[8]) -> 23 | B21: =SUM(R[-20]C[7]:R[-16]C[7]) -> 65 | C21: =SUM(R[-19]C[6]:R[-16]C[6]) -> 54 | D21: =SUM(R[-18]C[5]:R[-16]C[5]) -> 42

Sheet: Sheet2
A1: =300+Sheet1!RC[1] -> 371
A2: =300+Sheet1!RC[1] -> 372
A3: =300+Sheet1!RC[1] -> 373
A12: =300+Sheet1!RC[1] -> 300