Sheet: Exp1
A1: (ii) Examples Showing the Effects of the Budget changes on Different Categories of Single and Married Taxpayers
A4: EXAMPLE 1
A5: Married couple, one income, no children taxed under PAYE
A6: Full rate PRSI contributor
A7: GROSS | B7: PRSI Liability | D7: Levy Liability | F7: Tax Liability | H7: Total | I7: Total | J7: Gain as % of
A8: INCOME | B8: Existing | C8: Proposed | D8: Existing | E8: Proposed | F8: Existing | G8: Proposed | H8: Gain | I8: Gain | J8: Net Income
H9: (Per Year) | I9: (Per Week) (a)
A10: € | B10: € | C10: € | D10: € | E10: € | F10: € | G10: € | H10: € | I10: € | J10: %
A11: 17500 | B11: 435.84 | C11: 0 | D11: 0 | E11: 0 | F11: 0 | G11: 0 | H11: 435.84 | I11: 8.3815384615384652 | J11: 2.5541251371295171
A12: 25,000 (b) | B12: 734.24 | C12: 734.24 | D12: 499.2 | E12: 0 | F12: 242 | G12: 0 | H12: 741.20000000000073 | I12: 14.253846153846167 | J12: 3.1561161886788631
A13: 30000 | B13: 935.84 | C13: 935.84 | D13: 600 | E13: 600 | F13: 1250 | G13: 720 | H13: 530 | I13: 10.192307692307692 | J13: 1.9475155580771186
A14: 35000 | B14: 1135.8399999999999 | C14: 1135.8399999999999 | D14: 700 | E14: 700 | F14: 2250 | G14: 1720 | H14: 530 | I14: 10.192307692307692 | J14: 1.7144247166994024
A15: 40000 | B15: 1335.84 | C15: 1335.84 | D15: 800 | E15: 800 | F15: 3250 | G15: 2720 | H15: 530 | I15: 10.192307692307692 | J15: 1.5311652803361397
A16: 45000 | B16: 1535.84 | C16: 1535.84 | D16: 900 | E16: 900 | F16: 5130 | G16: 4140 | H16: 990 | I16: 19.03846153846154 | J16: 2.6446432883761783
A17: 50000 | B17: 1615.08 | C17: 1692.92 | D17: 1000 | E17: 1000 | F17: 7230 | G17: 6190 | H17: 962.16000000000349 | I17: 18.503076923076989 | J17: 2.3961198279065266
A18: 60000 | B18: 1655.72 | C18: 1733.56 | D18: 1200 | E18: 1200 | F18: 11430 | G18: 10290 | H18: 1062.1600000000001 | I18: 20.426153846153912 | J18: 2.3234752904344189
A19: 80000 | B19: 1706.52 | C19: 1789.44 | D19: 1600 | E19: 1600 | F19: 19830 | G19: 18490 | H19: 1257.08 | I19: 24.174615384615418 | J19: 2.210698325181649
A20: 100000 | B20: 1737 | C20: 1819.92 | D20: 2000 | E20: 2000 | F20: 28230 | G20: 26690 | H20: 1457.08 | I20: 28.020769230769265 | J20: 2.1417253391736391
A21: 120000 | B21: 1757.32 | C21: 1840.24 | D21: 2400 | E21: 2500 | F21: 36630 | G21: 34890 | H21: 1558 | I21: 29.943846153846188 | J21: 1.9656953911924224
A22: 200000 | B22: 1797.96 | C22: 1885.96 | D22: 4000 | E22: 4500 | F22: 70230 | G22: 67690 | H22: 1953 | I22: 37.53846153846154 | J22: 1.5745485836967756
A24: Variations can arise due to rounding
A25: (a) Gains per week are based on a 52 week year
A26: (b) Recte €24,960

Sheet: Exp2 (2)
A4: Example 2
A5: Married couple, one income, two children (under the age of six) taxed under PAYE
A6: Full rate PRSI contributor
A7: GROSS | B7: PRSI Liability | D7: Levy Liabilty | F7: Tax Liability | H7: Child Benefit | I7: Total | J7: Gain as % of | K7: Total Gain where | L7: Total Gain where | M7: Gain including FIS
A8: INCOME | B8: Existing | C8: Proposed | D8: Existing | E8: Proposed | F8: Existing | G8: Proposed | H8: Increase (a) | I8: Gain (b) | J8: Net Income (c) | K8: FIS applies (d) | L8: FIS applies (e) | M8: as % of Net Income (f)
K9: (Per Year) | L9: (Per Week)
A10: € | B10: € | C10: € | D10: € | E10: € | F10: € | G10: € | H10: € | I10: € | J10: % | K10: € | L10: € | M10: %
A11: 17500 | B11: 435.84 | C11: 0 | D11: 0 | E11: 0 | F11: 0 | G11: 0 | H11: 180 | I11: 1115.8399999999999 | J11: 5.045908068098778 | K11: 2103.84 | L11: 40.458461538461542 | M11: 7.5585907186093442
A12: 25,000 (g) | B12: 734.24 | C12: 734.24 | D12: 499.2 | E12: 0 | F12: 0 | G12: 0 | H12: 180 | I12: 1179.2 | J12: 4.0978365424712715 | K12: 2115.1999999999998 | L12: 40.676923076923089 | M12: 6.9368650826966709
A13: 30000 | B13: 935.84 | C13: 935.84 | D13: 600 | E13: 600 | F13: 480 | G13: 0 | H13: 180 | I13: 1160 | J13: 3.5115590837979092 | K13: 2200 | L13: 42.307692307692307 | M13: 6.659853434789138
A14: 35000 | B14: 1135.8399999999999 | C14: 1135.8399999999999 | D14: 700 | E14: 700 | F14: 1480 | G14: 950 | H14: 180 | I14: 1210 | J14: 3.2939726289930569 | K14: 1210 | L14: 23.26923076923077 | M14: 3.2939726289930569
A15: 40000 | B15: 1335.84 | C15: 1335.84 | D15: 800 | E15: 800 | F15: 2480 | G15: 1950 | H15: 180 | I15: 1210 | J15: 2.9925488008040806 | K15: 1210 | L15: 23.26923076923077 | M15: 2.9925488008040806
A16: 45000 | B16: 1535.84 | C16: 1535.84 | D16: 900 | E16: 900 | F16: 4360 | G16: 3370 | H16: 180 | I16: 1670 | J16: 3.8609360203598482 | K16: 1670 | L16: 32.115384615384613 | M16: 3.8609360203598482
A17: 50000 | B17: 1615.08 | C17: 1692.92 | D17: 1000 | E17: 1000 | F17: 6460 | G17: 5420 | H17: 180 | I17: 1642.16 | J17: 3.5718915608036874 | K17: 1642.16 | L17: 31.580000000000066 | M17: 3.5718915608036874
A18: 60000 | B18: 1655.72 | C18: 1733.56 | D18: 1200 | E18: 1200 | F18: 10660 | G18: 9520 | H18: 180 | I18: 1742.16 | J18: 3.3806109689392758 | K18: 1742.16 | L18: 33.503076923076989 | M18: 3.3806109689392758
A19: 80000 | B19: 1706.52 | C19: 1789.44 | D19: 1600 | E19: 1600 | F19: 19060 | G19: 17720 | H19: 180 | I19: 1937.08 | J19: 3.0902757171472781 | K19: 1937.08 | L19: 37.251538461538495 | M19: 3.0902757171472781
A20: 100000 | B20: 1737 | C20: 1819.92 | D20: 2000 | E20: 2000 | F20: 27460 | G20: 25920 | H20: 180 | I20: 2137.08 | J20: 2.8937099032396985 | K20: 2137.08 | L20: 41.097692307692341 | M20: 2.8937099032396985
A21: 120000 | B21: 1757.32 | C21: 1840.24 | D21: 2400 | E21: 2500 | F21: 35860 | G21: 34120 | H21: 180 | I21: 2238 | J21: 2.6308597158632012 | K21: 2238 | L21: 43.020769230769261 | M21: 2.6308597158632012
A22: 200000 | B22: 1797.96 | C22: 1885.96 | D22: 4000 | E22: 4500 | F22: 69460 | G22: 66920 | H22: 180 | I22: 2633 | J22: 2.0278655851794456 | K22: 2633 | L22: 50.615384615384613 | M22: 2.0278655851794456
A24: Variations can arise due to rounding
A25: (a) Value during 2007 of the increase in Child Benefit (CB) made in the Budget, which is effective from April, 2007 (i.e. assuming 9 months of CB increase).
A26: (b) Includes payment of an additional quarter of ECS (€250 per child) in 2007 as compared with 2006
A27: (c) Net income includes CB and ECS less deductions of tax, levy and PRSI (where appropriate) and so may be higher than the gross income.
A28: (d) The last three columns show the total gain where Family Income Supplement (FIS) is taken up in both years. The gain includes the value during 2007 of the
A29: improvement in FIS made in this Budget which takes effect from January, 2007.
A30: (e) Gains per week are based on a 52 week year
A31: (f) Net income includes CB, ECS and FIS (where relevant) less deductions of tax, levy and PRSI (where appropriate) and so may be higher than the gross income.
A32: (g) Recte €24,960

Sheet: Exp3 (2)
A1: Example 3
A2: Married couple, two incomes, two children (under the age of six) taxed under PAYE
A3: Full rate PRSI contributors
A4: GROSS | B4: PRSI liability | D4: Levy Liability | F4: Tax Liability | H4: Child Benefit | I4: Total | J4: Gain as % of | K4: Total Gain where | L4: Total Gain where | M4: Gain including FIS
A5: INCOME | B5: Existing | C5: Proposed | D5: Exisitng | E5: Proposed | F5: Existing | G5: Proposed | H5: Increase (a) | I5: Gain (b) | J5: Net Income (c) | K5: FIS applies (d) | L5: FIS applies | M5: as % of Net Income (f)
K6: (Per Year) | L6: (Per Week) (e)
A7: € | B7: € | C7: € | D7: € | E7: € | F7: € | G7: € | H7: € | I7: € | J7: % | K7: € | L7: € | M7: %
A8: 25000 | B8: 385.84 | C8: 0 | D8: 0 | E8: 0 | F8: 0 | G8: 0 | H8: 180 | I8: 1065.8399999999999 | J8: 3.5930711413522767 | K8: 2105.84 | L8: 4 1 | M8: 6.8354206862167199
A9: 30000 | B9: 515.84 | C9: 515.84 | D9: 0 | E9: 0 | F9: 0 | G9: 0 | H9: 180 | I9: 680 | J9: 1.9690876406160229 | K9: 680 | L9: 13.076923076923077 | M9: 1.9690876406160229
A10: 35000 | B10: 645.84 | C10: 645.84 | D10: 0 | E10: 0 | F10: 760 | G10: 0 | H10: 180 | I10: 1440 | J10: 3.7263454694884763 | K10: 1440 | L10: 27.692307692307693 | M10: 3.7263454694884763
A11: 40000 | B11: 775.84 | C11: 775.84 | D11: 520 | E11: 520 | F11: 1760 | G11: 960 | H11: 180 | I11: 1480 | J11: 3.5243331390187498 | K11: 1480 | L11: 28.46153846153846 | M11: 3.5243331390187498
A12: 45000 | B12: 1271.68 | C12: 905.84 | D12: 585 | E12: 585 | F12: 2760 | G12: 1960 | H12: 180 | I12: 1845.84 | J12: 4.0627809086451059 | K12: 1845.84 | L12: 36 | M12: 4.0627809086451059
A13: 50000 | B13: 1471.68 | C13: 1035.8399999999999 | D13: 650 | E13: 650 | F13: 3760 | G13: 2960 | H13: 180 | I13: 1915.84 | J13: 3.8965244004627491 | K13: 1915.84 | L13: 36.843076923076993 | M13: 3.8965244004627491
A14: 60000 | B14: 1871.68 | C14: 1871.68 | D14: 780 | E14: 780 | F14: 5760 | G14: 4960 | H14: 180 | I14: 1480 | J14: 2.6130903112261188 | K14: 1480 | L14: 28.46153846153846 | M14: 2.6130903112261188
A15: 70000 | B15: 2271.6799999999998 | C15: 2271.6799999999998 | D15: 1400 | E15: 910 | F15: 9080 | G15: 7485 | H15: 180 | I15: 2765 | J15: 4.4383504296772669 | K15: 2765 | L15: 53.17307692307692 | M15: 4.4383504296772669
A16: 80000 | B16: 2481.08 | C16: 2558.92 | D16: 1600 | E16: 1600 | F16: 13280 | G16: 11480 | H16: 180 | I16: 2402.16 | J16: 3.5488440284999632 | K16: 2402.16 | L16: 46.195384615384683 | M16: 3.5488440284999632
A17: 100000 | B17: 2806.8 | C17: 2887.72 | D17: 2000 | E17: 2000 | F17: 21680 | G17: 19680 | H17: 180 | I17: 2599.08 | J17: 3.3082833096580084 | K17: 2599.08 | L17: 49.982307692307728 | M17: 3.3082833096580084
A18: 120000 | B18: 3118.36 | C18: 3200.2 | D18: 2400 | E18: 2400 | F18: 30080 | G18: 27880 | H18: 180 | I18: 2798.16 | J18: 3.1281399788309288 | K18: 2798.16 | L18: 53.810769230769296 | M18: 3.1281399788309288
A19: 200000 | B19: 3453.68 | C19: 3614.44 | D19: 4000 | E19: 4150 | F19: 63680 | G19: 60680 | H19: 180 | I19: 3370 | J19: 2.5159368654600516 | K19: 3370 | L19: 64.79307692307674 | M19: 2.5159368654600516
A21: Variations can arise due to rounding
A22: This example assumes that the joint income is divided 65% and 35% between spouses.
A23: (a) Value during 2007 of the increase in Child Benefit (CB) made in the Budget, which is effective from April, 2007 (i.e. assuming 9 months of CB increase).
A24: (b) Includes payment of an additional quarter of ECS (€250 per child) in 2007 as compared with 2006
A25: (c) Net income includes CB and ECS less deductions of tax, levy and PRSI (where appropriate) and so may be higher than the gross income.
A26: (d) The last three columns show the total gain where Family Income Supplement (FIS) is taken up in both years. The gain includes the value during 2007 of the
A27: improvement in FIS made in this Budget which takes effect from January, 2007.
A28: (e) Gains per week are based on a 52 week year
A29: (f) Net income includes CB, ECS and FIS (where relevant) less deductions of tax, levy and PRSI (where appropriate) and so may be higher than the gross income.

Sheet: Exp4
A1: EXAMPLE 4
A2: Single person taxed under PAYE
A3: Full rate PRSI contributor
A4: GROSS | B4: PRSI Liability | D4: Levy Liability | F4: Tax Liability | H4: Total | I4: Total | J4: Gain as % of
A5: INCOME | B5: Existing | C5: Proposed | D5: Existing | E5: Proposed | F5: Existing | G5: Proposed | H5: Gain | I5: Gain | J5: Net Income
H6: (Per Year) | I6: (Per Week) (a)
A7: € | B7: € | C7: € | D7: € | E7: € | F7: € | G7: € | H7: € | I7: € | J7: %
A8: 17500 | B8: 435.84 | C8: 0 | D8: 0 | E8: 0 | F8: 380 | G8: 0 | H8: 815.84 | I8: 15.689230769230772 | J8: 4.8899075530323381
A9: 25,000 (b) | B9: 734.24 | C9: 734.24 | D9: 499.2 | E9: 0 | F9: 1872 | G9: 1472 | H9: 899.20000000000073 | I9: 17.292307692307705 | J9: 4.1144731351260369
A10: 30000 | B10: 935.84 | C10: 935.84 | D10: 600 | E10: 600 | F10: 2880 | G10: 2480 | H10: 400 | I10: =RC[-1]/52 -> 7.6923076923076925 | J10: 1.5634673954509353
A11: 35000 | B11: 1135.8399999999999 | C11: 1135.8399999999999 | D11: 700 | E11: 700 | F11: 4540 | G11: 3690 | H11: 850 | I11: =RC[-1]/52 -> 16.346153846153847 | J11: 2.9695194548940469
A12: 40000 | B12: 1335.84 | C12: 1335.84 | D12: 800 | E12: 800 | F12: 6640 | G12: 5740 | H12: 900 | I12: =RC[-1]/52 -> 17.307692307692307 | J12: 2.8823833851735321
A13: 45000 | B13: 1535.84 | C13: 1535.84 | D13: 900 | E13: 900 | F13: 8740 | G13: 7790 | H13: 950 | I13: =RC[-1]/52 -> 18.26923076923077 | J13: 2.8086432892938062
A14: 50000 | B14: 1615.08 | C14: 1692.92 | D14: 1000 | E14: 1000 | F14: 10840 | G14: 9840 | H14: 922.16000000000349 | I14: =RC[-1]/52 -> 17.733846153846223 | J14: 2.5233602919366183
A15: 55000 | B15: 1638.0184615384615 | C15: 1713.24 | D15: 1100 | E15: 1100 | F15: 12940 | G15: 11890 | H15: 974.77846153846622 | I15: =RC[-1]/52 -> 18.745739644970506 | J15: 2.4789657677475327
A16: 60000 | B16: 1655.72 | C16: 1733.56 | D16: 1200 | E16: 1200 | F16: 15040 | G16: 13940 | H16: 1022.16 | I16: =RC[-1]/52 -> 19.656923076923075 | J16: 2.4276866864841375
A17: 80000 | B17: 1706.52 | C17: 1789.44 | D17: 1600 | E17: 1600 | F17: 23440 | G17: 22140 | H17: 1217.08 | I17: =RC[-1]/52 -> 23.405384615384612 | J17: 2.2854468853490921
A18: 100000 | B18: 1737 | C18: 1819.92 | D18: 2000 | E18: 2000 | F18: 31840 | G18: 30340 | H18: 1417.08 | I18: =RC[-1]/52 -> 27.251538461538459 | J18: 2.1996491936109801
A19: 120000 | B19: 1757.32 | C19: 1840.24 | D19: 2400 | E19: 2499.5 | F19: 40240 | G19: 38540 | H19: 1517.58 | I19: =RC[-1]/52 -> 29.184230769230769 | J19: 2.0073097937797999
A20: 200000 | B20: 1797.96 | C20: 1885.96 | D20: 4000 | E20: 4499.5 | F20: 73840 | G20: 71340 | H20: 1912.5 | I20: =RC[-1]/52 -> 36.778846153846153 | J20: 1.588956119387807
A22: Variations can arise due to rounding
A23: (a) Gains per week are based on a 52 week year
A24: (b) Recte €24,960

Sheet: Exp5
A1: EXAMPLE 5
A2: Married couple, one income, no children taxed under PAYE
A3: Modified rate PRSI contributor
A4: GROSS | B4: PRSI Liability | D4: Levy Liability | F4: Tax Liability | H4: Total | I4: Total | J4: Gain as % of
A5: INCOME | B5: Existing | C5: Proposed | D5: Existing | E5: Proposed | F5: Existing | G5: Proposed | H5: Gain | I5: Gain | J5: Net Income
H6: (Per Year) | I6: (Per Week) (a)
A7: € | B7: € | C7: € | D7: € | E7: € | F7: € | G7: € | H7: € | I7: € | J7: %
A8: 17500 | B8: 145.33199999999999 | C8: 0 | D8: 0 | E8: 0 | F8: 0 | G8: 0 | H8: 145.33199999999852 | I8: 2.7948461538461253 | J8: 0.8374231071432684
A9: 25,000 (b) | B9: 212.47199999999998 | C9: 212.47199999999998 | D9: 499.2 | E9: 0 | F9: 242 | G9: 0 | H9: 741.20000000000073 | I9: 14.253846153846167 | J9: 3.0875192574224628
A10: 30000 | B10: 257.83199999999999 | C10: 257.83199999999999 | D10: 600 | E10: 600 | F10: 1170 | G10: 640 | H10: 530 | I10: =RC[-1]/52 -> 10.192307692307692 | J10: 1.894740514928982
A11: 35000 | B11: 302.83199999999999 | C11: 302.83199999999999 | D11: 700 | E11: 700 | F11: 2170 | G11: 1640 | H11: 530 | I11: =RC[-1]/52 -> 10.192307692307692 | J11: 1.6652439827508372
A12: 40000 | B12: 347.83199999999999 | C12: 347.83199999999999 | D12: 800 | E12: 800 | F12: 3170 | G12: 2640 | H12: 530 | I12: =RC[-1]/52 -> 10.192307692307692 | J12: 1.4853357565044816
A13: 45000 | B13: 392.83199999999994 | C13: 392.83199999999994 | D13: 900 | E13: 900 | F13: 5050 | G13: 4060 | H13: 990 | I13: =RC[-1]/52 -> 19.03846153846154 | J13: 2.5609739440819879
A14: 50000 | B14: 407.93399999999997 | C14: 427.26599999999996 | D14: 1000 | E14: 1000 | F14: 7150 | G14: 6110 | H14: 1020.6679999999978 | I14: =RC[-1]/52 -> 19.628230769230729 | J14: 2.4628791431392392
A15: 60000 | B15: 409.80599999999993 | C15: 429.13799999999998 | D15: 1200 | E15: 1200 | F15: 11350 | G15: 10210 | H15: 1120.6679999999978 | I15: =RC[-1]/52 -> 21.551307692307653 | J15: 2.3823626237595827
A16: 80000 | B16: 412.14599999999996 | C16: 431.71199999999999 | D16: 1600 | E16: 1600 | F16: 19750 | G16: 18410 | H16: 1320.4339999999938 | I16: =RC[-1]/52 -> 25.392961538461421 | J16: 2.2673122536417529
A17: 100000 | B17: 413.55 | C17: 433.11599999999987 | D17: 2000 | E17: 2000 | F17: 28150 | G17: 26610 | H17: 1520.4340000000084 | I17: =RC[-1]/52 -> 29.239115384615545 | J17: 2.189677035620353
A18: 120000 | B18: 414.48599999999993 | C18: 434.05200000000002 | D18: 2400 | E18: 2499.5 | F18: 36550 | G18: 34810 | H18: 1620 | I18: =RC[-1]/52 -> 31.153846153846153 | J18: 2.0101986328257402
A19: 200000 | B19: 416.35799999999995 | C19: 436.15799999999996 | D19: 4000 | E19: 4499.5 | F19: 70150 | G19: 67610 | H19: 2020 | I19: =RC[-1]/52 -> 38.846153846153847 | J19: 1.610971321393994
A21: Variations can arise due to rounding.
A22: (a) Gains per week are based on a 52 week year
A23: (b) Recte €24,960

Sheet: Exp6 (2)
A1: EXAMPLE 6
A2: Married couple, one income, two children (under the age of 6) taxed under PAYE
A3: Modified rate PRSI contributor
A4: GROSS | B4: PRSI Liability | D4: Levy Liability | F4: Tax Liability | H4: Child Benefit | I4: Total | J4: Gain as % of | K4: Total Gain where | L4: Total Gain where | M4: Gain including FIS
A5: INCOME | B5: Existing | C5: Proposed | D5: Existing | E5: Proposed | F5: Existing | G5: Proposed | H5: Increase (a) | I5: Gain (b) | J5: Net Income (c) | K5: FIS applies (d) | L5: FIS applies (e) | M5: as % of Net Income (f)
K6: (Per Year) | L6: (Per Week)
A7: € | B7: € | C7: € | D7: € | E7: € | F7: € | G7: € | H7: € | I7: € | J7: % | K7: € | L7: € | M7: %
A8: 17500 | B8: 145.33199999999999 | C8: 0 | D8: 0 | E8: 0 | F8: 0 | G8: 0 | H8: 180 | I8: 825.33199999999852 | J8: 3.6838159586378745 | K8: 2021.3319999999985 | L8: 38.871769230769203 | M8: 7.2406956402625111
A9: 25,000 (g) | B9: 212.47199999999998 | C9: 212.47199999999998 | D9: 499.2 | E9: 0 | F9: 0 | G9: 0 | H9: 180 | I9: 1179.2 | J9: 4.0248580036103609 | K9: 2115.1999999999998 | L9: 40.676923076923089 | M9: 6.8894696124621264
A10: 30000 | B10: 257.83199999999999 | C10: 257.83199999999999 | D10: 600 | E10: 600 | F10: 480 | G10: 0 | H10: 180 | I10: 1160 | J10: 3.4409349281236157 | K10: 1160 | L10: 22.307692307692307 | M10: 3.4409349281236157
A11: 35000 | B11: 302.83199999999999 | C11: 302.83199999999999 | D11: 700 | E11: 700 | F11: 1480 | G11: 950 | H11: 180 | I11: 1210 | J11: 3.2209318619051817 | K11: 1210 | L11: 23.26923076923077 | M11: 3.2209318619051817
A12: 40000 | B12: 347.83199999999999 | C12: 347.83199999999999 | D12: 800 | E12: 800 | F12: 2480 | G12: 1950 | H12: 180 | I12: 1210 | J12: 2.9211693716212213 | K12: 1210 | L12: 23.26923076923077 | M12: 2.9211693716212213
A13: 45000 | B13: 392.83199999999994 | C13: 392.83199999999994 | D13: 900 | E13: 900 | F13: 4360 | G13: 3370 | H13: 180 | I13: 1670 | J13: 3.7615350739044788 | K13: 1670 | L13: 32.115384615384613 | M13: 3.7615350739044788
A14: 50000 | B14: 407.93399999999997 | C14: 427.26599999999996 | D14: 1000 | E14: 1000 | F14: 6460 | G14: 5420 | H14: 180 | I14: 1700.6679999999978 | J14: 3.6045102773606974 | K14: 1700.6679999999978 | L14: 32.705153846153806 | M14: 3.6045102773606974
A15: 60000 | B15: 409.80599999999993 | C15: 429.13799999999998 | D15: 1200 | E15: 1200 | F15: 10660 | G15: 9520 | H15: 180 | I15: 1800.6679999999978 | J15: 3.4116616673418578 | K15: 1800.6679999999978 | L15: 34.628230769230726 | M15: 3.4116616673418578
A16: 80000 | B16: 412.14599999999996 | C16: 431.71199999999999 | D16: 1600 | E16: 1600 | F16: 19060 | G16: 17720 | H16: 180 | I16: 2000.4339999999938 | J16: 3.1267796308368156 | K16: 2000.4339999999938 | L16: 38.469884615384494 | M16: 3.1267796308368156
A17: 100000 | B17: 413.55 | C17: 433.11599999999987 | D17: 2000 | E17: 2000 | F17: 27460 | G17: 25920 | H17: 180 | I17: 2200.4340000000084 | J17: 2.9270412584859251 | K17: 2200.4340000000084 | L17: 42.316038461538625 | M17: 2.9270412584859251
A18: 120000 | B18: 414.48599999999993 | C18: 434.05200000000002 | D18: 2400 | E18: 2499.5 | F18: 35860 | G18: 34120 | H18: 180 | I18: 2300.9340000000084 | J18: 2.6638853408633514 | K18: 2300.9340000000084 | L18: 44.248730769230932 | M18: 2.6638853408633514
A19: 200000 | B19: 416.35799999999995 | C19: 436.15799999999996 | D19: 4000 | E19: 4499.5 | F19: 69460 | G19: 66920 | H19: 180 | I19: 2700.7000000000116 | J19: 2.0588802707186362 | K19: 2700.7000000000116 | L19: 51.936538461538689 | M19: 2.0588802707186362
A21: Variations can arise due to rounding
A22: (a) Value during 2007 of the increase in Child Benefit (CB) made in the Budget, which is effective from April, 2007 (i.e. assuming 9 months of CB increase).
A23: (b) Includes payment of an additional quarter of ECS (€250 per child) in 2007 as compared with 2006
A24: (c) Net income includes CB and ECS less deductions of tax, levy and PRSI (where appropriate) and so may be higher than the gross income.
A25: (d) The last three columns show the total gain where Family Income Supplement (FIS) is taken up in both years. The gain includes the value during 2007 of the
A26: improvement in FIS made in this Budget which takes effect from January, 2007.
A27: (e) Gains per week are based on a 52 week year
A28: (f) Net income includes CB, ECS and FIS (where relevant) less deductions of tax, levy and PRSI (where appropriate) and so may be higher than the gross income.
A29: (g) Recte €24,960

Sheet: Exp7 (2)
A1: EXAMPLE 7
A2: Married couple, two incomes, two children (under the age of 6)
A3: Modified rate PRSI contributors
A4: GROSS | B4: PRSI Liability | D4: Levy Liability | F4: Tax Liability | H4: Child Benefit | I4: Total | J4: Gain as % of | K4: Total Gain where | L4: Total Gain where | M4: Gain including FIS
A5: INCOME | B5: Existing | C5: Proposed | D5: Existing | E5: Proposed | F5: Existing | G5: Proposed | H5: Increase (a) | I5: Gain (b) | J5: Net Income (c) | K5: FIS applies (d) | L5: FIS applies (e) | M5: as % of Net Income (f)
K6: (Per Year) | L6: (Per Week)
A7: € | B7: € | C7: € | D7: € | E7: € | F7: € | G7: € | H7: € | I7: € | J7: % | K7: € | M7: %
A8: 20000 | B8: 0 | C8: 0 | D8: 0 | E8: 0 | F8: 0 | G8: 0 | H8: 180 | I8: 680 | J8: 2.7146142054164537 | K8: 1928 | L8: 37.07692307692308 | M8: 6.6479090808782964
A9: 30000 | B9: 163.33199999999999 | C9: 163.33199999999999 | D9: 0 | E9: 0 | F9: 0 | G9: 0 | H9: 180 | I9: 680 | J9: 1.9491910112024593 | K9: 680 | L9: 13.076923076923077 | M9: 1.9491910112024593
A10: 35000 | B10: 192.58199999999997 | C10: 192.58199999999997 | D10: 0 | E10: 0 | F10: 760 | G10: 0 | H10: 180 | I10: 1440 | J10: 3.6831453488345329 | K10: 1440 | L10: 27.692307692307693 | M10: 3.6831453488345329
A11: 40000 | B11: 221.83199999999997 | C11: 221.83199999999997 | D11: 520 | E11: 520 | F11: 1760 | G11: 960 | H11: 180 | I11: 1480 | J11: 3.4784433345598766 | K11: 1480 | L11: 28.46153846153846 | M11: 3.4784433345598766
A12: 45000 | B12: 380.66399999999999 | C12: 251.08199999999999 | D12: 585 | E12: 585 | F12: 2760 | G12: 1960 | H12: 180 | I12: 1609.5819999999949 | J12: 3.4746227090893025 | K12: 1609.5819999999949 | L12: 30.953499999999902 | M12: 3.4746227090893025
A13: 50000 | B13: 425.66399999999999 | C13: 280.33199999999999 | D13: 650 | E13: 650 | F13: 3760 | G13: 2960 | H13: 180 | I13: 1625.3319999999949 | J13: 3.2368145767342251 | K13: 1625.3319999999949 | L13: 31.256384615384516 | M13: 3.2368145767342251
A14: 60000 | B14: 515.66399999999999 | C14: 515.66399999999999 | D14: 780 | E14: 780 | F14: 5760 | G14: 4960 | H14: 180 | I14: 1480 | J14: 2.5519909529851534 | K14: 1480 | L14: 28.46153846153846 | M14: 2.5519909529851534
A15: 70000 | B15: 605.66399999999987 | C15: 605.66399999999987 | D15: 1400 | E15: 910 | F15: 9080 | G15: 7485 | H15: 180 | I15: 2765 | J15: 4.3227483687057662 | K15: 2765 | L15: 53.17307692307692 | M15: 4.3227483687057662
A16: 80000 | B16: 648.23399999999992 | C16: 667.56600000000003 | D16: 1600 | E16: 1600 | F16: 13280 | G16: 11480 | H16: 180 | I16: 2460.6679999999906 | J16: 3.5394413855446829 | K16: 2460.6679999999906 | L16: 47.320538461538277 | M16: 3.5394413855446829
A17: 100000 | B17: 713.34 | C17: 732.67200000000003 | D17: 2000 | E17: 2000 | F17: 21680 | G17: 19680 | H17: 180 | I17: 2660.6679999999906 | J17: 3.2987743294816672 | K17: 2660.6679999999906 | L17: 51.166692307692124 | M17: 3.2987743294816672
A18: 120000 | B18: 777.74399999999991 | C18: 797.31 | D18: 2400 | E18: 2400 | F18: 30080 | G18: 27880 | H18: 180 | I18: 2860.4340000000084 | J18: 3.116217630461692 | K18: 2860.4340000000084 | L18: 55.008346153846318 | M18: 3.116217630461692
A19: 200000 | B19: 826.16399999999987 | C19: 865.06200000000001 | D19: 4000 | E19: 4149.5 | F19: 63680 | G19: 60680 | H19: 180 | I19: 3491.6019999999844 | J19: 2.5571364704781443 | K19: 3491.6019999999844 | L19: 67.146192307692004 | M19: 2.5571364704781443
A21: Variations can arise due to rounding
A22: This example assumes that the joint income is divided 65% and 35% between spouses.
A23: (a) Value during 2007 of the increase in Child Benefit (CB) made in the Budget, which is effective from April, 2007 (i.e. assuming 9 months of CB increase).
A24: (b) Includes payment of an additional quarter of ECS (€250 per child) in 2007 as compared with 2006
A25: (c) Net income includes CB and ECS less deductions of tax, levy and PRSI (where appropriate) and so may be higher than the gross income.
A26: (d) The last three columns show the total gain where Family Income Supplement (FIS) is taken up in both years. The gain includes the value during 2007 of the
A27: improvement in FIS made in this Budget which takes effect from January, 2007.
A28: (e) Gains per week are based on a 52 week year
A29: (f) Net income includes CB, ECS and FIS (where relevant) less deductions of tax, levy and PRSI (where appropriate) and so may be higher than the gross income.

Sheet: Exp8
A1: EXAMPLE 8
A2: Single person taxed under PAYE
A3: Modified rate PRSI contributor
A4: GROSS | B4: PRSI Liability | D4: Levy Liability | F4: Tax Liability | H4: Total | I4: Total | J4: Gain as % of
A5: INCOME | B5: Existing | C5: Proposed | D5: Existing | E5: Proposed | F5: Existing | G5: Proposed | H5: Gain | I5: Gain | J5: Net Income
H6: (Per Year) | I6: (Per Week) (a)
A7: € | B7: € | C7: € | D7: € | E7: € | F7: € | G7: € | H7: € | I7: € | J7: %
A8: 17500 | B8: 145.33199999999999 | C8: 0 | D8: 0 | E8: 0 | F8: 380 | G8: 0 | H8: 525.33199999999852 | I8: 10.102538461538433 | J8: 3.0947998511664467
A9: 25,000 (b) | B9: 212.47199999999998 | C9: 212.47199999999998 | D9: 499.2 | E9: 0 | F9: 1872 | G9: 1472 | H9: 899.20000000000073 | I9: 17.292307692307705 | J9: 4.0185324419627779
A10: 30000 | B10: 257.83199999999999 | C10: 257.83199999999999 | D10: 600 | E10: 600 | F10: 2880 | G10: 2480 | H10: 400 | I10: 7.6923076923076925 | J10: 1.5231035000613811
A11: 35000 | B11: 302.83199999999999 | C11: 302.83199999999999 | D11: 700 | E11: 700 | F11: 4540 | G11: 3690 | H11: 850 | I11: 16.346153846153847 | J11: 2.8855455487099104
A12: 40000 | B12: 347.83199999999999 | C12: 347.83199999999999 | D12: 800 | E12: 800 | F12: 6640 | G12: 5740 | H12: 900 | I12: 17.307692307692307 | J12: 2.793975245627677
A13: 45000 | B13: 392.83199999999994 | C13: 392.83199999999994 | D13: 900 | E13: 900 | F13: 8740 | G13: 7790 | H13: 950 | I13: 18.26923076923077 | J13: 2.7168342600693318
A14: 50000 | B14: 407.93399999999997 | C14: 427.26599999999996 | D14: 1000 | E14: 1000 | F14: 10840 | G14: 9840 | H14: 980.66799999999785 | I14: 18.858999999999959 | J14: 2.5976538608509476
A15: 60000 | B15: 409.80599999999993 | C15: 429.13799999999998 | D15: 1200 | E15: 1200 | F15: 15040 | G15: 13940 | H15: 1080.6679999999978 | I15: 20.782076923076882 | J15: 2.4928792706210214
A16: 80000 | B16: 412.14599999999996 | C16: 431.71199999999999 | D16: 1600 | E16: 1600 | F16: 23440 | G16: 22140 | H16: 1280.4339999999938 | I16: 24.623730769230651 | J16: 2.3473590730077003
A17: 100000 | B17: 413.55 | C17: 433.11599999999987 | D17: 2000 | E17: 2000 | F17: 31840 | G17: 30340 | H17: 1480.4340000000084 | I17: 28.469884615384778 | J17: 2.2517322228044381
A18: 120000 | B18: 414.48599999999993 | C18: 434.05200000000002 | D18: 2400 | E18: 2499.5 | F18: 40240 | G18: 38540 | H18: 1580.9340000000084 | I18: 30.402576923077085 | J18: 2.0546149058150531
A19: 200000 | B19: 416.35799999999995 | C19: 436.15799999999996 | D19: 4000 | E19: 4499.5 | F19: 73840 | G19: 71340 | H19: 1980.7000000000116 | I19: 38.090384615384842 | J19: 1.6269432780727979
A21: Variations can arise due to rounding
A22: (a) Gains per week are based on a 52 week year
A23: (b) Recte €24,960

Sheet: Exp9
A1: EXAMPLE 9
A2: Married couple, one income, no children
A3: Taxed under Schedule D
A4: GROSS | B4: PRSI Liability | D4: Levy Liability | F4: Tax Liability | H4: Total | I4: Total | J4: Gain as % of
A5: INCOME | B5: Existing | C5: Proposed | D5: Existing | E5: Proposed | F5: Existing | G5: Proposed | H5: Gain | I5: Gain | J5: Net Income
H6: (Per Year) | I6: (Per Week) (a)
A7: € | B7: € | C7: € | D7: € | E7: € | F7: € | G7: € | H7: € | I7: € | J7: %
A8: 17500 | B8: 525 | C8: 525 | D8: 0 | E8: 0 | F8: 240 | G8: 0 | H8: 240 | I8: 4.615384615384615 | J8: 1.434120107559008
A9: 25,000 (b) | B9: 748.8 | C9: 748.8 | D9: 499.2 | E9: 0 | F9: 1732 | G9: 1472 | H9: 759.20000000000073 | I9: 14.6 | J9: 3.4540491355778009
A10: 30000 | B10: 900 | C10: 900 | D10: 600 | E10: 600 | F10: 2740 | G10: 2480 | H10: 260 | I10: 5 | J10: 1.0093167701863355
A11: 35000 | B11: 1050 | C11: 1050 | D11: 700 | E11: 700 | F11: 3740 | G11: 3480 | H11: 260 | I11: 5 | J11: 0.88105726872246704
A12: 40000 | B12: 1200 | C12: 1200 | D12: 800 | E12: 800 | F12: 4740 | G12: 4480 | H12: 260 | I12: 5 | J12: 0.78171978352375227
A13: 45000 | B13: 1350 | C13: 1350 | D13: 900 | E13: 900 | F13: 6620 | G13: 5900 | H13: 720 | I13: 13.846153846153847 | J13: 1.9928037641848879
A14: 50000 | B14: 1500 | C14: 1500 | D14: 1000 | E14: 1000 | F14: 8720 | G14: 7950 | H14: 770 | I14: 14.807692307692308 | J14: 1.9855595667870036
A15: 60000 | B15: 1800 | C15: 1800 | D15: 1200 | E15: 1200 | F15: 12920 | G15: 12050 | H15: 870 | I15: 16.73076923076923 | J15: 1.9736842105263157
A16: 80000 | B16: 2400 | C16: 2400 | D16: 1600 | E16: 1600 | F16: 21320 | G16: 20250 | H16: 1070 | I16: 20.576923076923077 | J16: 1.9568397951719094
A17: 100000 | B17: 3000 | C17: 3000 | D17: 2000 | E17: 2000 | F17: 29720 | G17: 28450 | H17: 1270 | I17: 24.423076923076923 | J17: 1.9454656862745099
A18: 120000 | B18: 3600 | C18: 3600 | D18: 2400 | E18: 2500 | F18: 38120 | G18: 36650 | H18: 1371 | I18: 26.346153846153847 | J18: 1.805482340537691
A19: 200000 | B19: 6000 | C19: 6000 | D19: 4000 | E19: 4500 | F19: 71720 | G19: 69450 | H19: 1771 | I19: 34.03846153846154 | J19: 1.4964491038214407
A21: Variations can arise due to rounding.
A22: (a) Gains per week are based on a 52 week year
A23: (b) Recte €24,960

Sheet: Exp10 (2)
A1: EXAMPLE 10
A2: Married couple, one income, two children (under the age of 6)
A3: Taxed under Schedule D
A4: GROSS | B4: PRSI Liability | D4: Levy Liability | F4: Tax Liability | H4: Child Benefit | I4: Total | J4: Total | K4: Gain as % of
A5: INCOME | B5: Existing | C5: Proposed | D5: Existing | E5: Proposed | F5: Existing | G5: Proposed | H5: Increase (a) | I5: Gain (b) | J5: Gain | K5: Net Income (d)
I6: (Per Year) | J6: (Per Week) ( c)
A7: € | B7: € | C7: € | D7: € | E7: € | F7: € | G7: € | H7: € | I7: € | J7: € | K7: %
A8: 17500 | B8: 525 | C8: 525 | D8: 0 | E8: 0 | F8: 0 | G8: 0 | H8: 180 | I8: 680 | J8: 13.076923076923077 | K8: 3.0874567529035715
A9: 25,000 (e) | B9: 748.8 | C9: 748.8 | D9: 499.2 | E9: 0 | F9: 962 | G9: 702 | H9: 180 | I9: 1439.2 | J9: 27.676923076923092 | K9: 5.177052907236078
A10: 30000 | B10: 900 | C10: 900 | D10: 600 | E10: 600 | F10: 1970 | G10: 1710 | H10: 180 | I10: 940 | J10: 18.076923076923077 | K10: 2.9766051501602302
A11: 35000 | B11: 1050 | C11: 1050 | D11: 700 | E11: 700 | F11: 2970 | G11: 2710 | H11: 180 | I11: 940 | J11: 18.076923076923077 | K11: 2.6606584846700785
A12: 40000 | B12: 1200 | C12: 1200 | D12: 800 | E12: 800 | F12: 3970 | G12: 3710 | H12: 180 | I12: 940 | J12: 18.076923076923077 | K12: 2.4053470352818351
A13: 45000 | B13: 1350 | C13: 1350 | D13: 900 | E13: 900 | F13: 5850 | G13: 5130 | H13: 180 | I13: 1400 | J13: 26.923076923076923 | K13: 3.3373381391002535
A14: 50000 | B14: 1500 | C14: 1500 | D14: 1000 | E14: 1000 | F14: 7950 | G14: 7180 | H14: 180 | I14: 1450 | J14: 27.884615384615383 | K14: 3.2511502345312513
A15: 60000 | B15: 1800 | C15: 1800 | D15: 1200 | E15: 1200 | F15: 12150 | G15: 11280 | H15: 180 | I15: 1550 | J15: 29.807692307692307 | K15: 3.1062373245476915
A16: 80000 | B16: 2400 | C16: 2400 | D16: 1600 | E16: 1600 | F16: 20550 | G16: 19480 | H16: 180 | I16: 1750 | J16: 33.653846153846153 | K16: 2.8925811079742676
A17: 100000 | B17: 3000 | C17: 3000 | D17: 2000 | E17: 2000 | F17: 28950 | G17: 27680 | H17: 180 | I17: 1950 | J17: 37.5 | K17: 2.742631463468149
A18: 120000 | B18: 3600 | C18: 3600 | D18: 2400 | E18: 2500 | F18: 37350 | G18: 35880 | H18: 180 | I18: 2051 | J18: 39.42307692307692 | K18: 2.5091922114673757
A19: 200000 | B19: 6000 | C19: 6000 | D19: 4000 | E19: 4500 | F19: 70950 | G19: 68680 | H19: 180 | I19: 2451 | J19: 47.115384615384613 | K19: 1.9742207065937358
A21: Variations can arise due to rounding
A22: (a) Value during 2007 of the increase in Child Benefit (CB) made in the Budget, which is effective from April, 2007 (i.e. assuming 9 months of CB increase).
A23: (b) Includes payment of an additional quarter of ECS (€250 per child) in 2007 as compared with 2006
A24: (c) Gains per week are based on a 52 week year
A25: (d) Net income includes CB and ECS less deductions of tax, levy and PRSI (where appropriate) and so may be higher than the gross income.
A26: (e) Recte €24,960

Sheet: Exp11 (2)
A1: EXAMPLE 11
A2: Married couple, two incomes, two children, (under the age of 6)
A3: Taxed under Schedule D
A4: GROSS | B4: PRSI Liability | D4: Levy Liability | F4: Tax Liability | H4: Child Benefit | I4: Total | J4: Total | K4: Gain as % of
A5: INCOME | B5: Existing | C5: Proposed | D5: Existing | E5: Proposed | F5: Existing | G5: Proposed | H5: Increase (a) | I5: Gain (b) | J5: Gain | K5: Net Income (d)
I6: (Per Year) | J6: (Per Week) (c )
A7: € | B7: € | C7: € | D7: € | E7: € | F7: € | G7: € | H7: € | I7: € | K7: %
A8: 20000 | B8: 643 | C8: 643 | D8: 0 | E8: 0 | F8: 740 | G8: 480 | H8: 180 | I8: 940 | J8: 18.076923076923077 | K8: 3.9718421742033079
A9: 30000 | B9: 900 | C9: 900 | D9: 0 | E9: 0 | F9: 2740 | G9: 2480 | H9: 180 | I9: 940 | J9: 18.076923076923077 | K9: 2.9927156028730071
A10: 35000 | B10: 1050 | C10: 1050 | D10: 0 | E10: 0 | F10: 3740 | G10: 3480 | H10: 180 | I10: 940 | J10: 18.076923076923077 | K10: 2.6659406232628848
A11: 40000 | B11: 1200 | C11: 1200 | D11: 520 | E11: 520 | F11: 4740 | G11: 4480 | H11: 180 | I11: 940 | J11: 18.076923076923077 | K11: 2.4358894624458403
A12: 45000 | B12: 1350 | C12: 1350 | D12: 585 | E12: 585 | F12: 5740 | G12: 5480 | H12: 180 | I12: 940 | J12: 18.076923076923077 | K12: 2.2183100253453722
A13: 50000 | B13: 1500 | C13: 1500 | D13: 650 | E13: 650 | F13: 6740 | G13: 6480 | H13: 180 | I13: 940 | J13: 18.076923076923077 | K13: 2.0364127938716976
A14: 60000 | B14: 1800 | C14: 1800 | D14: 780 | E14: 780 | F14: 8740 | G14: 8480 | H14: 180 | I14: 940 | J14: 18.076923076923077 | K14: 1.7495012060391293
A15: 70000 | B15: 2100 | C15: 2100 | D15: 1400 | E15: 910 | F15: 12060 | G15: 11005 | H15: 180 | I15: 2225 | J15: 42.78846153846154 | K15: 3.740149538742906
A16: 80000 | B16: 2400 | C16: 2400 | D16: 1600 | E16: 1600 | F16: 16260 | G16: 15000 | H16: 180 | I16: 1940 | J16: 37.307692307692307 | K16: 2.9943077284008544
A17: 100000 | B17: 3000 | C17: 3000 | D17: 2000 | E17: 2000 | F17: 24660 | G17: 23200 | H17: 180 | I17: 2140 | J17: 41.153846153846153 | K17: 2.8385878158260556
A18: 120000 | B18: 3600 | C18: 3600 | D18: 2400 | E18: 2400 | F18: 33060 | G18: 31400 | H18: 180 | I18: 2340 | J18: 45 | K18: 2.7212593150799629
A19: 200000 | B19: 6000 | C19: 6000 | D19: 4000 | E19: 4150 | F19: 66660 | G19: 64200 | H19: 180 | I19: 2991 | J19: 57.5 | K19: 2.3288490656564083
A21: This example assumes that the joint income is divided 65% and 35% between spouses.
A22: Variations can arise due to rounding
A23: (a) Value during 2007 of the increase in Child Benefit (CB) made in the Budget, which is effective from April, 2007 (i.e. assuming 9 months of CB increase).
A24: (b) Includes payment of an additional quarter of ECS (€250 per child) in 2007 as compared with 2006
A25: (c) Gains per week are based on a 52 week year
A26: (d) Net income includes CB and ECS less deductions of tax, levy and PRSI (where appropriate) and so may be higher than the gross income.

Sheet: Exp12
A1: EXAMPLE 12
A2: Single person
A3: Taxed under Schedule D
A4: GROSS | B4: PRSI Liability | D4: Levy Liability | F4: Tax Liability | H4: Total | I4: Total | J4: Gain as % of
A5: INCOME | B5: Existing | C5: Proposed | D5: Existing | E5: Proposed | F5: Existing | G5: Proposed | H5: Gain | I5: Gain | J5: Net Income
H6: (Per Month) | I6: (Per Week) (a)
A7: € | B7: € | C7: € | D7: € | E7: € | F7: € | G7: € | H7: € | I7: € | J7: %
A8: 17500 | B8: 525 | C8: 525 | D8: 0 | E8: 0 | F8: 1870 | G8: 1740 | H8: 130 | I8: 2.5 | J8: 0.86064217146640187
A9: 25,000 (b) | B9: 748.8 | C9: 748.8 | D9: 499.2 | E9: 0 | F9: 3362 | G9: 3232 | H9: 629.20000000000073 | I9: 12.1 | J9: 3.0918918918918954
A10: 30000 | B10: 900 | C10: 900 | D10: 600 | E10: 600 | F10: 4370 | G10: 4240 | H10: 130 | I10: 2.5 | J10: 0.53874844591794446
A11: 35000 | B11: 1050 | C11: 1050 | D11: 700 | E11: 700 | F11: 6030 | G11: 5450 | H11: 580 | I11: 11.153846153846153 | J11: 2.1307861866274798
A12: 40000 | B12: 1200 | C12: 1200 | D12: 800 | E12: 800 | F12: 8130 | G12: 7500 | H12: 630 | I12: 12.115384615384615 | J12: 2.1091396049548039
A13: 45000 | B13: 1350 | C13: 1350 | D13: 900 | E13: 900 | F13: 10230 | G13: 9550 | H13: 680 | I13: 13.076923076923077 | J13: 2.0910209102091022
A14: 50000 | B14: 1500 | C14: 1500 | D14: 1000 | E14: 1000 | F14: 12330 | G14: 11600 | H14: 730 | I14: 14.038461538461538 | J14: 2.0756326414557864
A15: 60000 | B15: 1800 | C15: 1800 | D15: 1200 | E15: 1200 | F15: 16530 | G15: 15700 | H15: 830 | I15: 15.961538461538462 | J15: 2.0509019026439335
A16: 80000 | B16: 2400 | C16: 2400 | D16: 1600 | E16: 1600 | F16: 24930 | G16: 23900 | H16: 1030 | I16: 19.807692307692307 | J16: 2.016839631877815
A17: 100000 | B17: 3000 | C17: 3000 | D17: 2000 | E17: 2000 | F17: 33330 | G17: 32100 | H17: 1230 | I17: 23.653846153846153 | J17: 1.9944867844981353
A18: 120000 | B18: 3600 | C18: 3600 | D18: 2400 | E18: 2500 | F18: 41730 | G18: 40300 | H18: 1331 | I18: 25.576923076923077 | J18: 1.8403210184032102
A19: 200000 | B19: 6000 | C19: 6000 | D19: 4000 | E19: 4500 | F19: 75330 | G19: 73100 | H19: 1731 | I19: 33.269230769230766 | J19: 1.5086770733408912
A21: Variations can arise due to rounding
A22: (a) Gains per week are based on a 52 week year
A23: (b) Recte €24,960