Sheet: Sheet1
A1: 0 | B1: =RADIANS(RC[-1]) -> 0 | C1: =SIN(RC[-1]:R[8]C[-1]) -> 0
A2: =R[-1]C+45 -> 45 | B2: =RADIANS(RC[-1]) -> 0.78539816339744828 | C2: 0.70710678118654746
A3: =R[-1]C+45 -> 90 | B3: =RADIANS(RC[-1]) -> 1.5707963267948966 | C3: 1
A4: =R[-1]C+45 -> 135 | B4: =RADIANS(RC[-1]) -> 2.3561944901923448 | C4: 0.70710678118654757
A5: =R[-1]C+45 -> 180 | B5: =RADIANS(RC[-1]) -> 3.1415926535897931 | C5: 1.22514845490862E-16
A6: =R[-1]C+45 -> 225 | B6: =RADIANS(RC[-1]) -> 3.9269908169872414 | C6: -0.70710678118654746
A7: =R[-1]C+45 -> 270 | B7: =RADIANS(RC[-1]) -> 4.7123889803846897 | C7: -1
A8: =R[-1]C+45 -> 315 | B8: =RADIANS(RC[-1]) -> 5.497787143782138 | C8: -0.70710678118654768
A9: =R[-1]C+45 -> 360 | B9: =RADIANS(RC[-1]) -> 6.2831853071795862 | C9: -2.45029690981724E-16