Sheet: Sheet1
B2: 10 | C2: 10 | D2: 10 | E2: 10 | F2: 10 | G2: 10 | H2: 10 | I2: 10 | J2: 10 | K2: 10 | L2: 10 | M2: 10
A3: 1 | B3: =RC1*R2C -> 10 | C3: =RC1*R2C -> 10 | D3: =RC1*R2C -> 10 | E3: =RC1*R2C -> 10 | F3: =RC1*R2C -> 10 | G3: =RC1*R2C -> 10 | H3: =RC1*R2C -> 10 | I3: =RC1*R2C -> 10 | J3: =RC1*R2C -> 10 | K3: =RC1*R2C -> 10 | L3: =RC1*R2C -> 10 | M3: =RC1*R2C -> 10
A4: 2 | B4: =RC1*R2C -> 20 | C4: =RC1*R2C -> 20 | D4: =RC1*R2C -> 20 | E4: =RC1*R2C -> 20 | F4: =RC1*R2C -> 20 | G4: =RC1*R2C -> 20 | H4: =RC1*R2C -> 20 | I4: =RC1*R2C -> 20 | J4: =RC1*R2C -> 20 | K4: =RC1*R2C -> 20 | L4: =RC1*R2C -> 20 | M4: =RC1*R2C -> 20
A5: 3 | B5: =RC1*R2C -> 30 | C5: =RC1*R2C -> 30 | D5: =RC1*R2C -> 30 | E5: =RC1*R2C -> 30 | F5: =RC1*R2C -> 30 | G5: =RC1*R2C -> 30 | H5: =RC1*R2C -> 30 | I5: =RC1*R2C -> 30 | J5: =RC1*R2C -> 30 | K5: =RC1*R2C -> 30 | L5: =RC1*R2C -> 30 | M5: =RC1*R2C -> 30
A6: 4 | B6: =RC1*R2C -> 40 | C6: =RC1*R2C -> 40 | D6: =RC1*R2C -> 40 | E6: =RC1*R2C -> 40 | F6: =RC1*R2C -> 40 | G6: =RC1*R2C -> 40 | H6: =RC1*R2C -> 40 | I6: =RC1*R2C -> 40 | J6: =RC1*R2C -> 40 | K6: =RC1*R2C -> 40 | L6: =RC1*R2C -> 40 | M6: =RC1*R2C -> 40
A7: 5 | B7: =RC1*R2C -> 50 | C7: =RC1*R2C -> 50 | D7: =RC1*R2C -> 50 | E7: =RC1*R2C -> 50 | F7: =RC1*R2C -> 50 | G7: =RC1*R2C -> 50 | H7: =RC1*R2C -> 50 | I7: =RC1*R2C -> 50 | J7: =RC1*R2C -> 50 | K7: =RC1*R2C -> 50 | L7: =RC1*R2C -> 50 | M7: =RC1*R2C -> 50
A8: 6 | B8: =RC1*R2C -> 60 | C8: =RC1*R2C -> 60 | D8: =RC1*R2C -> 60 | E8: =RC1*R2C -> 60 | F8: =RC1*R2C -> 60 | G8: =RC1*R2C -> 60 | H8: =RC1*R2C -> 60 | I8: =RC1*R2C -> 60 | J8: =RC1*R2C -> 60 | K8: =RC1*R2C -> 60 | L8: =RC1*R2C -> 60 | M8: =RC1*R2C -> 60
A9: 7 | B9: =RC1*R2C -> 70 | C9: =RC1*R2C -> 70 | D9: =RC1*R2C -> 70 | E9: =RC1*R2C -> 70 | F9: =RC1*R2C -> 70 | G9: =RC1*R2C -> 70 | H9: =RC1*R2C -> 70 | I9: =RC1*R2C -> 70 | J9: =RC1*R2C -> 70 | K9: =RC1*R2C -> 70 | L9: =RC1*R2C -> 70 | M9: =RC1*R2C -> 70
A10: 8 | B10: =RC1*R2C -> 80 | C10: =RC1*R2C -> 80 | D10: =RC1*R2C -> 80 | E10: =RC1*R2C -> 80 | F10: =RC1*R2C -> 80 | G10: =RC1*R2C -> 80 | H10: =RC1*R2C -> 80 | I10: =RC1*R2C -> 80 | J10: =RC1*R2C -> 80 | K10: =RC1*R2C -> 80 | L10: =RC1*R2C -> 80 | M10: =RC1*R2C -> 80
A11: 9 | B11: =RC1*R2C -> 90 | C11: =RC1*R2C -> 90 | D11: =RC1*R2C -> 90 | E11: =RC1*R2C -> 90 | F11: =RC1*R2C -> 90 | G11: =RC1*R2C -> 90 | H11: =RC1*R2C -> 90 | I11: =RC1*R2C -> 90 | J11: =RC1*R2C -> 90 | K11: =RC1*R2C -> 90 | L11: =RC1*R2C -> 90 | M11: =RC1*R2C -> 90
A12: 10 | B12: =RC1*R2C -> 100 | C12: =RC1*R2C -> 100 | D12: =RC1*R2C -> 100 | E12: =RC1*R2C -> 100 | F12: =RC1*R2C -> 100 | G12: =RC1*R2C -> 100 | H12: =RC1*R2C -> 100 | I12: =RC1*R2C -> 100 | J12: =RC1*R2C -> 100 | K12: =RC1*R2C -> 100 | L12: =RC1*R2C -> 100 | M12: =RC1*R2C -> 100
A13: 11 | B13: =RC1*R2C -> 110 | C13: =RC1*R2C -> 110 | D13: =RC1*R2C -> 110 | E13: =RC1*R2C -> 110 | F13: =RC1*R2C -> 110 | G13: =RC1*R2C -> 110 | H13: =RC1*R2C -> 110 | I13: =RC1*R2C -> 110 | J13: =RC1*R2C -> 110 | K13: =RC1*R2C -> 110 | L13: =RC1*R2C -> 110 | M13: =RC1*R2C -> 110
A14: 12 | B14: =RC1*R2C -> 120 | C14: =RC1*R2C -> 120 | D14: =RC1*R2C -> 120 | E14: =RC1*R2C -> 120 | F14: =RC1*R2C -> 120 | G14: =RC1*R2C -> 120 | H14: =RC1*R2C -> 120 | I14: =RC1*R2C -> 120 | J14: =RC1*R2C -> 120 | K14: =RC1*R2C -> 120 | L14: =RC1*R2C -> 120 | M14: =RC1*R2C -> 120
A15: 13 | B15: =RC1*R2C -> 130 | C15: =RC1*R2C -> 130 | D15: =RC1*R2C -> 130 | E15: =RC1*R2C -> 130 | F15: =RC1*R2C -> 130 | G15: =RC1*R2C -> 130 | H15: =RC1*R2C -> 130 | I15: =RC1*R2C -> 130 | J15: =RC1*R2C -> 130 | K15: =RC1*R2C -> 130 | L15: =RC1*R2C -> 130 | M15: =RC1*R2C -> 130
A16: 14 | B16: =RC1*R2C -> 140 | C16: =RC1*R2C -> 140 | D16: =RC1*R2C -> 140 | E16: =RC1*R2C -> 140 | F16: =RC1*R2C -> 140 | G16: =RC1*R2C -> 140 | H16: =RC1*R2C -> 140 | I16: =RC1*R2C -> 140 | J16: =RC1*R2C -> 140 | K16: =RC1*R2C -> 140 | L16: =RC1*R2C -> 140 | M16: =RC1*R2C -> 140
A17: 15 | B17: =RC1*R2C -> 150 | C17: =RC1*R2C -> 150 | D17: =RC1*R2C -> 150 | E17: =RC1*R2C -> 150 | F17: =RC1*R2C -> 150 | G17: =RC1*R2C -> 150 | H17: =RC1*R2C -> 150 | I17: =RC1*R2C -> 150 | J17: =RC1*R2C -> 150 | K17: =RC1*R2C -> 150 | L17: =RC1*R2C -> 150 | M17: =RC1*R2C -> 150
A18: 16 | B18: =RC1*R2C -> 160 | C18: =RC1*R2C -> 160 | D18: =RC1*R2C -> 160 | E18: =RC1*R2C -> 160 | F18: =RC1*R2C -> 160 | G18: =RC1*R2C -> 160 | H18: =RC1*R2C -> 160 | I18: =RC1*R2C -> 160 | J18: =RC1*R2C -> 160 | K18: =RC1*R2C -> 160 | L18: =RC1*R2C -> 160 | M18: =RC1*R2C -> 160
A19: 17 | B19: =RC1*R2C -> 170 | C19: =RC1*R2C -> 170 | D19: =RC1*R2C -> 170 | E19: =RC1*R2C -> 170 | F19: =RC1*R2C -> 170 | G19: =RC1*R2C -> 170 | H19: =RC1*R2C -> 170 | I19: =RC1*R2C -> 170 | J19: =RC1*R2C -> 170 | K19: =RC1*R2C -> 170 | L19: =RC1*R2C -> 170 | M19: =RC1*R2C -> 170
A20: 18 | B20: =RC1*R2C -> 180 | C20: =RC1*R2C -> 180 | D20: =RC1*R2C -> 180 | E20: =RC1*R2C -> 180 | F20: =RC1*R2C -> 180 | G20: =RC1*R2C -> 180 | H20: =RC1*R2C -> 180 | I20: =RC1*R2C -> 180 | J20: =RC1*R2C -> 180 | K20: =RC1*R2C -> 180 | L20: =RC1*R2C -> 180 | M20: =RC1*R2C -> 180
A21: 19 | B21: =RC1*R2C -> 190 | C21: =RC1*R2C -> 190 | D21: =RC1*R2C -> 190 | E21: =RC1*R2C -> 190 | F21: =RC1*R2C -> 190 | G21: =RC1*R2C -> 190 | H21: =RC1*R2C -> 190 | I21: =RC1*R2C -> 190 | J21: =RC1*R2C -> 190 | K21: =RC1*R2C -> 190 | L21: =RC1*R2C -> 190 | M21: =RC1*R2C -> 190
A22: 20 | B22: =RC1*R2C -> 200 | C22: =RC1*R2C -> 200 | D22: =RC1*R2C -> 200 | E22: =RC1*R2C -> 200 | F22: =RC1*R2C -> 200 | G22: =RC1*R2C -> 200 | H22: =RC1*R2C -> 200 | I22: =RC1*R2C -> 200 | J22: =RC1*R2C -> 200 | K22: =RC1*R2C -> 200 | L22: =RC1*R2C -> 200 | M22: =RC1*R2C -> 200
A23: 21 | B23: =RC1*R2C -> 210 | C23: =RC1*R2C -> 210 | D23: =RC1*R2C -> 210 | E23: =RC1*R2C -> 210 | F23: =RC1*R2C -> 210 | G23: =RC1*R2C -> 210 | H23: =RC1*R2C -> 210 | I23: =RC1*R2C -> 210 | J23: =RC1*R2C -> 210 | K23: =RC1*R2C -> 210 | L23: =RC1*R2C -> 210 | M23: =RC1*R2C -> 210
A24: 22 | B24: =RC1*R2C -> 220 | C24: =RC1*R2C -> 220 | D24: =RC1*R2C -> 220 | E24: =RC1*R2C -> 220 | F24: =RC1*R2C -> 220 | G24: =RC1*R2C -> 220 | H24: =RC1*R2C -> 220 | I24: =RC1*R2C -> 220 | J24: =RC1*R2C -> 220 | K24: =RC1*R2C -> 220 | L24: =RC1*R2C -> 220 | M24: =RC1*R2C -> 220
A25: 23 | B25: =RC1*R2C -> 230 | C25: =RC1*R2C -> 230 | D25: =RC1*R2C -> 230 | E25: =RC1*R2C -> 230 | F25: =RC1*R2C -> 230 | G25: =RC1*R2C -> 230 | H25: =RC1*R2C -> 230 | I25: =RC1*R2C -> 230 | J25: =RC1*R2C -> 230 | K25: =RC1*R2C -> 230 | L25: =RC1*R2C -> 230 | M25: =RC1*R2C -> 230
A26: 24 | B26: =RC1*R2C -> 240 | C26: =RC1*R2C -> 240 | D26: =RC1*R2C -> 240 | E26: =RC1*R2C -> 240 | F26: =RC1*R2C -> 240 | G26: =RC1*R2C -> 240 | H26: =RC1*R2C -> 240 | I26: =RC1*R2C -> 240 | J26: =RC1*R2C -> 240 | K26: =RC1*R2C -> 240 | L26: =RC1*R2C -> 240 | M26: =RC1*R2C -> 240
A27: 25 | B27: =RC1*R2C -> 250 | C27: =RC1*R2C -> 250 | D27: =RC1*R2C -> 250 | E27: =RC1*R2C -> 250 | F27: =RC1*R2C -> 250 | G27: =RC1*R2C -> 250 | H27: =RC1*R2C -> 250 | I27: =RC1*R2C -> 250 | J27: =RC1*R2C -> 250 | K27: =RC1*R2C -> 250 | L27: =RC1*R2C -> 250 | M27: =RC1*R2C -> 250
A28: 26 | B28: =RC1*R2C -> 260 | C28: =RC1*R2C -> 260 | D28: =RC1*R2C -> 260 | E28: =RC1*R2C -> 260 | F28: =RC1*R2C -> 260 | G28: =RC1*R2C -> 260 | H28: =RC1*R2C -> 260 | I28: =RC1*R2C -> 260 | J28: =RC1*R2C -> 260 | K28: =RC1*R2C -> 260 | L28: =RC1*R2C -> 260 | M28: =RC1*R2C -> 260
A29: 27 | B29: =RC1*R2C -> 270 | C29: =RC1*R2C -> 270 | D29: =RC1*R2C -> 270 | E29: =RC1*R2C -> 270 | F29: =RC1*R2C -> 270 | G29: =RC1*R2C -> 270 | H29: =RC1*R2C -> 270 | I29: =RC1*R2C -> 270 | J29: =RC1*R2C -> 270 | K29: =RC1*R2C -> 270 | L29: =RC1*R2C -> 270 | M29: =RC1*R2C -> 270
A30: 28 | B30: =RC1*R2C -> 280 | C30: =RC1*R2C -> 280 | D30: =RC1*R2C -> 280 | E30: =RC1*R2C -> 280 | F30: =RC1*R2C -> 280 | G30: =RC1*R2C -> 280 | H30: =RC1*R2C -> 280 | I30: =RC1*R2C -> 280 | J30: =RC1*R2C -> 280 | K30: =RC1*R2C -> 280 | L30: =RC1*R2C -> 280 | M30: =RC1*R2C -> 280
A31: 29 | B31: =RC1*R2C -> 290 | C31: =RC1*R2C -> 290 | D31: =RC1*R2C -> 290 | E31: =RC1*R2C -> 290 | F31: =RC1*R2C -> 290 | G31: =RC1*R2C -> 290 | H31: =RC1*R2C -> 290 | I31: =RC1*R2C -> 290 | J31: =RC1*R2C -> 290 | K31: =RC1*R2C -> 290 | L31: =RC1*R2C -> 290 | M31: =RC1*R2C -> 290
A32: 30 | B32: =RC1*R2C -> 300 | C32: =RC1*R2C -> 300 | D32: =RC1*R2C -> 300 | E32: =RC1*R2C -> 300 | F32: =RC1*R2C -> 300 | G32: =RC1*R2C -> 300 | H32: =RC1*R2C -> 300 | I32: =RC1*R2C -> 300 | J32: =RC1*R2C -> 300 | K32: =RC1*R2C -> 300 | L32: =RC1*R2C -> 300 | M32: =RC1*R2C -> 300
A33: 31 | B33: =RC1*R2C -> 310 | C33: =RC1*R2C -> 310 | D33: =RC1*R2C -> 310 | E33: =RC1*R2C -> 310 | F33: =RC1*R2C -> 310 | G33: =RC1*R2C -> 310 | H33: =RC1*R2C -> 310 | I33: =RC1*R2C -> 310 | J33: =RC1*R2C -> 310 | K33: =RC1*R2C -> 310 | L33: =RC1*R2C -> 310 | M33: =RC1*R2C -> 310
A34: 32 | B34: =RC1*R2C -> 320 | C34: =RC1*R2C -> 320 | D34: =RC1*R2C -> 320 | E34: =RC1*R2C -> 320 | F34: =RC1*R2C -> 320 | G34: =RC1*R2C -> 320 | H34: =RC1*R2C -> 320 | I34: =RC1*R2C -> 320 | J34: =RC1*R2C -> 320 | K34: =RC1*R2C -> 320 | L34: =RC1*R2C -> 320 | M34: =RC1*R2C -> 320
A35: 33 | B35: =RC1*R2C -> 330 | C35: =RC1*R2C -> 330 | D35: =RC1*R2C -> 330 | E35: =RC1*R2C -> 330 | F35: =RC1*R2C -> 330 | G35: =RC1*R2C -> 330 | H35: =RC1*R2C -> 330 | I35: =RC1*R2C -> 330 | J35: =RC1*R2C -> 330 | K35: =RC1*R2C -> 330 | L35: =RC1*R2C -> 330 | M35: =RC1*R2C -> 330
A36: 34 | B36: =RC1*R2C -> 340 | C36: =RC1*R2C -> 340 | D36: =RC1*R2C -> 340 | E36: =RC1*R2C -> 340 | F36: =RC1*R2C -> 340 | G36: =RC1*R2C -> 340 | H36: =RC1*R2C -> 340 | I36: =RC1*R2C -> 340 | J36: =RC1*R2C -> 340 | K36: =RC1*R2C -> 340 | L36: =RC1*R2C -> 340 | M36: =RC1*R2C -> 340
A37: 35 | B37: =RC1*R2C -> 350 | C37: =RC1*R2C -> 350 | D37: =RC1*R2C -> 350 | E37: =RC1*R2C -> 350 | F37: =RC1*R2C -> 350 | G37: =RC1*R2C -> 350 | H37: =RC1*R2C -> 350 | I37: =RC1*R2C -> 350 | J37: =RC1*R2C -> 350 | K37: =RC1*R2C -> 350 | L37: =RC1*R2C -> 350 | M37: =RC1*R2C -> 350
A38: 36 | B38: =RC1*R2C -> 360 | C38: =RC1*R2C -> 360 | D38: =RC1*R2C -> 360 | E38: =RC1*R2C -> 360 | F38: =RC1*R2C -> 360 | G38: =RC1*R2C -> 360 | H38: =RC1*R2C -> 360 | I38: =RC1*R2C -> 360 | J38: =RC1*R2C -> 360 | K38: =RC1*R2C -> 360 | L38: =RC1*R2C -> 360 | M38: =RC1*R2C -> 360
A39: 37 | B39: =RC1*R2C -> 370 | C39: =RC1*R2C -> 370 | D39: =RC1*R2C -> 370 | E39: =RC1*R2C -> 370 | F39: =RC1*R2C -> 370 | G39: =RC1*R2C -> 370 | H39: =RC1*R2C -> 370 | I39: =RC1*R2C -> 370 | J39: =RC1*R2C -> 370 | K39: =RC1*R2C -> 370 | L39: =RC1*R2C -> 370 | M39: =RC1*R2C -> 370
A40: 38 | B40: =RC1*R2C -> 380 | C40: =RC1*R2C -> 380 | D40: =RC1*R2C -> 380 | E40: =RC1*R2C -> 380 | F40: =RC1*R2C -> 380 | G40: =RC1*R2C -> 380 | H40: =RC1*R2C -> 380 | I40: =RC1*R2C -> 380 | J40: =RC1*R2C -> 380 | K40: =RC1*R2C -> 380 | L40: =RC1*R2C -> 380 | M40: =RC1*R2C -> 380
A41: 39 | B41: =RC1*R2C -> 390 | C41: =RC1*R2C -> 390 | D41: =RC1*R2C -> 390 | E41: =RC1*R2C -> 390 | F41: =RC1*R2C -> 390 | G41: =RC1*R2C -> 390 | H41: =RC1*R2C -> 390 | I41: =RC1*R2C -> 390 | J41: =RC1*R2C -> 390 | K41: =RC1*R2C -> 390 | L41: =RC1*R2C -> 390 | M41: =RC1*R2C -> 390
A42: 40 | B42: =RC1*R2C -> 400 | C42: =RC1*R2C -> 400 | D42: =RC1*R2C -> 400 | E42: =RC1*R2C -> 400 | F42: =RC1*R2C -> 400 | G42: =RC1*R2C -> 400 | H42: =RC1*R2C -> 400 | I42: =RC1*R2C -> 400 | J42: =RC1*R2C -> 400 | K42: =RC1*R2C -> 400 | L42: =RC1*R2C -> 400 | M42: =RC1*R2C -> 400
A43: 41 | B43: =RC1*R2C -> 410 | C43: =RC1*R2C -> 410 | D43: =RC1*R2C -> 410 | E43: =RC1*R2C -> 410 | F43: =RC1*R2C -> 410 | G43: =RC1*R2C -> 410 | H43: =RC1*R2C -> 410 | I43: =RC1*R2C -> 410 | J43: =RC1*R2C -> 410 | K43: =RC1*R2C -> 410 | L43: =RC1*R2C -> 410 | M43: =RC1*R2C -> 410
A44: 42 | B44: =RC1*R2C -> 420 | C44: =RC1*R2C -> 420 | D44: =RC1*R2C -> 420 | E44: =RC1*R2C -> 420 | F44: =RC1*R2C -> 420 | G44: =RC1*R2C -> 420 | H44: =RC1*R2C -> 420 | I44: =RC1*R2C -> 420 | J44: =RC1*R2C -> 420 | K44: =RC1*R2C -> 420 | L44: =RC1*R2C -> 420 | M44: =RC1*R2C -> 420
A45: 43 | B45: =RC1*R2C -> 430 | C45: =RC1*R2C -> 430 | D45: =RC1*R2C -> 430 | E45: =RC1*R2C -> 430 | F45: =RC1*R2C -> 430 | G45: =RC1*R2C -> 430 | H45: =RC1*R2C -> 430 | I45: =RC1*R2C -> 430 | J45: =RC1*R2C -> 430 | K45: =RC1*R2C -> 430 | L45: =RC1*R2C -> 430 | M45: =RC1*R2C -> 430
A46: 44 | B46: =RC1*R2C -> 440 | C46: =RC1*R2C -> 440 | D46: =RC1*R2C -> 440 | E46: =RC1*R2C -> 440 | F46: =RC1*R2C -> 440 | G46: =RC1*R2C -> 440 | H46: =RC1*R2C -> 440 | I46: =RC1*R2C -> 440 | J46: =RC1*R2C -> 440 | K46: =RC1*R2C -> 440 | L46: =RC1*R2C -> 440 | M46: =RC1*R2C -> 440
A47: 45 | B47: =RC1*R2C -> 450 | C47: =RC1*R2C -> 450 | D47: =RC1*R2C -> 450 | E47: =RC1*R2C -> 450 | F47: =RC1*R2C -> 450 | G47: =RC1*R2C -> 450 | H47: =RC1*R2C -> 450 | I47: =RC1*R2C -> 450 | J47: =RC1*R2C -> 450 | K47: =RC1*R2C -> 450 | L47: =RC1*R2C -> 450 | M47: =RC1*R2C -> 450
A48: 46 | B48: =RC1*R2C -> 460 | C48: =RC1*R2C -> 460 | D48: =RC1*R2C -> 460 | E48: =RC1*R2C -> 460 | F48: =RC1*R2C -> 460 | G48: =RC1*R2C -> 460 | H48: =RC1*R2C -> 460 | I48: =RC1*R2C -> 460 | J48: =RC1*R2C -> 460 | K48: =RC1*R2C -> 460 | L48: =RC1*R2C -> 460 | M48: =RC1*R2C -> 460
A49: 47 | B49: =RC1*R2C -> 470 | C49: =RC1*R2C -> 470 | D49: =RC1*R2C -> 470 | E49: =RC1*R2C -> 470 | F49: =RC1*R2C -> 470 | G49: =RC1*R2C -> 470 | H49: =RC1*R2C -> 470 | I49: =RC1*R2C -> 470 | J49: =RC1*R2C -> 470 | K49: =RC1*R2C -> 470 | L49: =RC1*R2C -> 470 | M49: =RC1*R2C -> 470
A50: 48 | B50: =RC1*R2C -> 480 | C50: =RC1*R2C -> 480 | D50: =RC1*R2C -> 480 | E50: =RC1*R2C -> 480 | F50: =RC1*R2C -> 480 | G50: =RC1*R2C -> 480 | H50: =RC1*R2C -> 480 | I50: =RC1*R2C -> 480 | J50: =RC1*R2C -> 480 | K50: =RC1*R2C -> 480 | L50: =RC1*R2C -> 480 | M50: =RC1*R2C -> 480
A51: 49 | B51: =RC1*R2C -> 490 | C51: =RC1*R2C -> 490 | D51: =RC1*R2C -> 490 | E51: =RC1*R2C -> 490 | F51: =RC1*R2C -> 490 | G51: =RC1*R2C -> 490 | H51: =RC1*R2C -> 490 | I51: =RC1*R2C -> 490 | J51: =RC1*R2C -> 490 | K51: =RC1*R2C -> 490 | L51: =RC1*R2C -> 490 | M51: =RC1*R2C -> 490
A52: 50 | B52: =RC1*R2C -> 500 | C52: =RC1*R2C -> 500 | D52: =RC1*R2C -> 500 | E52: =RC1*R2C -> 500 | F52: =RC1*R2C -> 500 | G52: =RC1*R2C -> 500 | H52: =RC1*R2C -> 500 | I52: =RC1*R2C -> 500 | J52: =RC1*R2C -> 500 | K52: =RC1*R2C -> 500 | L52: =RC1*R2C -> 500 | M52: =RC1*R2C -> 500
A53: 51 | B53: =RC1*R2C -> 510 | C53: =RC1*R2C -> 510 | D53: =RC1*R2C -> 510 | E53: =RC1*R2C -> 510 | F53: =RC1*R2C -> 510 | G53: =RC1*R2C -> 510 | H53: =RC1*R2C -> 510 | I53: =RC1*R2C -> 510 | J53: =RC1*R2C -> 510 | K53: =RC1*R2C -> 510 | L53: =RC1*R2C -> 510 | M53: =RC1*R2C -> 510
A54: 52 | B54: =RC1*R2C -> 520 | C54: =RC1*R2C -> 520 | D54: =RC1*R2C -> 520 | E54: =RC1*R2C -> 520 | F54: =RC1*R2C -> 520 | G54: =RC1*R2C -> 520 | H54: =RC1*R2C -> 520 | I54: =RC1*R2C -> 520 | J54: =RC1*R2C -> 520 | K54: =RC1*R2C -> 520 | L54: =RC1*R2C -> 520 | M54: =RC1*R2C -> 520
A55: 53 | B55: =RC1*R2C -> 530 | C55: =RC1*R2C -> 530 | D55: =RC1*R2C -> 530 | E55: =RC1*R2C -> 530 | F55: =RC1*R2C -> 530 | G55: =RC1*R2C -> 530 | H55: =RC1*R2C -> 530 | I55: =RC1*R2C -> 530 | J55: =RC1*R2C -> 530 | K55: =RC1*R2C -> 530 | L55: =RC1*R2C -> 530 | M55: =RC1*R2C -> 530
A56: 54 | B56: =RC1*R2C -> 540 | C56: =RC1*R2C -> 540 | D56: =RC1*R2C -> 540 | E56: =RC1*R2C -> 540 | F56: =RC1*R2C -> 540 | G56: =RC1*R2C -> 540 | H56: =RC1*R2C -> 540 | I56: =RC1*R2C -> 540 | J56: =RC1*R2C -> 540 | K56: =RC1*R2C -> 540 | L56: =RC1*R2C -> 540 | M56: =RC1*R2C -> 540
A57: 55 | B57: =RC1*R2C -> 550 | C57: =RC1*R2C -> 550 | D57: =RC1*R2C -> 550 | E57: =RC1*R2C -> 550 | F57: =RC1*R2C -> 550 | G57: =RC1*R2C -> 550 | H57: =RC1*R2C -> 550 | I57: =RC1*R2C -> 550 | J57: =RC1*R2C -> 550 | K57: =RC1*R2C -> 550 | L57: =RC1*R2C -> 550 | M57: =RC1*R2C -> 550
A58: 56 | B58: =RC1*R2C -> 560 | C58: =RC1*R2C -> 560 | D58: =RC1*R2C -> 560 | E58: =RC1*R2C -> 560 | F58: =RC1*R2C -> 560 | G58: =RC1*R2C -> 560 | H58: =RC1*R2C -> 560 | I58: =RC1*R2C -> 560 | J58: =RC1*R2C -> 560 | K58: =RC1*R2C -> 560 | L58: =RC1*R2C -> 560 | M58: =RC1*R2C -> 560
A59: 57 | B59: =RC1*R2C -> 570 | C59: =RC1*R2C -> 570 | D59: =RC1*R2C -> 570 | E59: =RC1*R2C -> 570 | F59: =RC1*R2C -> 570 | G59: =RC1*R2C -> 570 | H59: =RC1*R2C -> 570 | I59: =RC1*R2C -> 570 | J59: =RC1*R2C -> 570 | K59: =RC1*R2C -> 570 | L59: =RC1*R2C -> 570 | M59: =RC1*R2C -> 570
A60: 58 | B60: =RC1*R2C -> 580 | C60: =RC1*R2C -> 580 | D60: =RC1*R2C -> 580 | E60: =RC1*R2C -> 580 | F60: =RC1*R2C -> 580 | G60: =RC1*R2C -> 580 | H60: =RC1*R2C -> 580 | I60: =RC1*R2C -> 580 | J60: =RC1*R2C -> 580 | K60: =RC1*R2C -> 580 | L60: =RC1*R2C -> 580 | M60: =RC1*R2C -> 580
A61: 59 | B61: =RC1*R2C -> 590 | C61: =RC1*R2C -> 590 | D61: =RC1*R2C -> 590 | E61: =RC1*R2C -> 590 | F61: =RC1*R2C -> 590 | G61: =RC1*R2C -> 590 | H61: =RC1*R2C -> 590 | I61: =RC1*R2C -> 590 | J61: =RC1*R2C -> 590 | K61: =RC1*R2C -> 590 | L61: =RC1*R2C -> 590 | M61: =RC1*R2C -> 590
A62: 60 | B62: =RC1*R2C -> 600 | C62: =RC1*R2C -> 600 | D62: =RC1*R2C -> 600 | E62: =RC1*R2C -> 600 | F62: =RC1*R2C -> 600 | G62: =RC1*R2C -> 600 | H62: =RC1*R2C -> 600 | I62: =RC1*R2C -> 600 | J62: =RC1*R2C -> 600 | K62: =RC1*R2C -> 600 | L62: =RC1*R2C -> 600 | M62: =RC1*R2C -> 600
A63: 61 | B63: =RC1*R2C -> 610 | C63: =RC1*R2C -> 610 | D63: =RC1*R2C -> 610 | E63: =RC1*R2C -> 610 | F63: =RC1*R2C -> 610 | G63: =RC1*R2C -> 610 | H63: =RC1*R2C -> 610 | I63: =RC1*R2C -> 610 | J63: =RC1*R2C -> 610 | K63: =RC1*R2C -> 610 | L63: =RC1*R2C -> 610 | M63: =RC1*R2C -> 610
A64: 62 | B64: =RC1*R2C -> 620 | C64: =RC1*R2C -> 620 | D64: =RC1*R2C -> 620 | E64: =RC1*R2C -> 620 | F64: =RC1*R2C -> 620 | G64: =RC1*R2C -> 620 | H64: =RC1*R2C -> 620 | I64: =RC1*R2C -> 620 | J64: =RC1*R2C -> 620 | K64: =RC1*R2C -> 620 | L64: =RC1*R2C -> 620 | M64: =RC1*R2C -> 620
A65: 63 | B65: =RC1*R2C -> 630 | C65: =RC1*R2C -> 630 | D65: =RC1*R2C -> 630 | E65: =RC1*R2C -> 630 | F65: =RC1*R2C -> 630 | G65: =RC1*R2C -> 630 | H65: =RC1*R2C -> 630 | I65: =RC1*R2C -> 630 | J65: =RC1*R2C -> 630 | K65: =RC1*R2C -> 630 | L65: =RC1*R2C -> 630 | M65: =RC1*R2C -> 630
A66: 64 | B66: =RC1*R2C -> 640 | C66: =RC1*R2C -> 640 | D66: =RC1*R2C -> 640 | E66: =RC1*R2C -> 640 | F66: =RC1*R2C -> 640 | G66: =RC1*R2C -> 640 | H66: =RC1*R2C -> 640 | I66: =RC1*R2C -> 640 | J66: =RC1*R2C -> 640 | K66: =RC1*R2C -> 640 | L66: =RC1*R2C -> 640 | M66: =RC1*R2C -> 640
A67: 65 | B67: =RC1*R2C -> 650 | C67: =RC1*R2C -> 650 | D67: =RC1*R2C -> 650 | E67: =RC1*R2C -> 650 | F67: =RC1*R2C -> 650 | G67: =RC1*R2C -> 650 | H67: =RC1*R2C -> 650 | I67: =RC1*R2C -> 650 | J67: =RC1*R2C -> 650 | K67: =RC1*R2C -> 650 | L67: =RC1*R2C -> 650 | M67: =RC1*R2C -> 650
A68: 66 | B68: =RC1*R2C -> 660 | C68: =RC1*R2C -> 660 | D68: =RC1*R2C -> 660 | E68: =RC1*R2C -> 660 | F68: =RC1*R2C -> 660 | G68: =RC1*R2C -> 660 | H68: =RC1*R2C -> 660 | I68: =RC1*R2C -> 660 | J68: =RC1*R2C -> 660 | K68: =RC1*R2C -> 660 | L68: =RC1*R2C -> 660 | M68: =RC1*R2C -> 660
A69: 67 | B69: =RC1*R2C -> 670 | C69: =RC1*R2C -> 670 | D69: =RC1*R2C -> 670 | E69: =RC1*R2C -> 670 | F69: =RC1*R2C -> 670 | G69: =RC1*R2C -> 670 | H69: =RC1*R2C -> 670 | I69: =RC1*R2C -> 670 | J69: =RC1*R2C -> 670 | K69: =RC1*R2C -> 670 | L69: =RC1*R2C -> 670 | M69: =RC1*R2C -> 670
A70: 68 | B70: =RC1*R2C -> 680 | C70: =RC1*R2C -> 680 | D70: =RC1*R2C -> 680 | E70: =RC1*R2C -> 680 | F70: =RC1*R2C -> 680 | G70: =RC1*R2C -> 680 | H70: =RC1*R2C -> 680 | I70: =RC1*R2C -> 680 | J70: =RC1*R2C -> 680 | K70: =RC1*R2C -> 680 | L70: =RC1*R2C -> 680 | M70: =RC1*R2C -> 680
A71: 69 | B71: =RC1*R2C -> 690 | C71: =RC1*R2C -> 690 | D71: =RC1*R2C -> 690 | E71: =RC1*R2C -> 690 | F71: =RC1*R2C -> 690 | G71: =RC1*R2C -> 690 | H71: =RC1*R2C -> 690 | I71: =RC1*R2C -> 690 | J71: =RC1*R2C -> 690 | K71: =RC1*R2C -> 690 | L71: =RC1*R2C -> 690 | M71: =RC1*R2C -> 690
A72: 70 | B72: =RC1*R2C -> 700 | C72: =RC1*R2C -> 700 | D72: =RC1*R2C -> 700 | E72: =RC1*R2C -> 700 | F72: =RC1*R2C -> 700 | G72: =RC1*R2C -> 700 | H72: =RC1*R2C -> 700 | I72: =RC1*R2C -> 700 | J72: =RC1*R2C -> 700 | K72: =RC1*R2C -> 700 | L72: =RC1*R2C -> 700 | M72: =RC1*R2C -> 700
A73: 71 | B73: =RC1*R2C -> 710 | C73: =RC1*R2C -> 710 | D73: =RC1*R2C -> 710 | E73: =RC1*R2C -> 710 | F73: =RC1*R2C -> 710 | G73: =RC1*R2C -> 710 | H73: =RC1*R2C -> 710 | I73: =RC1*R2C -> 710 | J73: =RC1*R2C -> 710 | K73: =RC1*R2C -> 710 | L73: =RC1*R2C -> 710 | M73: =RC1*R2C -> 710
A74: 72 | B74: =RC1*R2C -> 720 | C74: =RC1*R2C -> 720 | D74: =RC1*R2C -> 720 | E74: =RC1*R2C -> 720 | F74: =RC1*R2C -> 720 | G74: =RC1*R2C -> 720 | H74: =RC1*R2C -> 720 | I74: =RC1*R2C -> 720 | J74: =RC1*R2C -> 720 | K74: =RC1*R2C -> 720 | L74: =RC1*R2C -> 720 | M74: =RC1*R2C -> 720
A75: 73 | B75: =RC1*R2C -> 730 | C75: =RC1*R2C -> 730 | D75: =RC1*R2C -> 730 | E75: =RC1*R2C -> 730 | F75: =RC1*R2C -> 730 | G75: =RC1*R2C -> 730 | H75: =RC1*R2C -> 730 | I75: =RC1*R2C -> 730 | J75: =RC1*R2C -> 730 | K75: =RC1*R2C -> 730 | L75: =RC1*R2C -> 730 | M75: =RC1*R2C -> 730
A76: 74 | B76: =RC1*R2C -> 740 | C76: =RC1*R2C -> 740 | D76: =RC1*R2C -> 740 | E76: =RC1*R2C -> 740 | F76: =RC1*R2C -> 740 | G76: =RC1*R2C -> 740 | H76: =RC1*R2C -> 740 | I76: =RC1*R2C -> 740 | J76: =RC1*R2C -> 740 | K76: =RC1*R2C -> 740 | L76: =RC1*R2C -> 740 | M76: =RC1*R2C -> 740
A77: 75 | B77: =RC1*R2C -> 750 | C77: =RC1*R2C -> 750 | D77: =RC1*R2C -> 750 | E77: =RC1*R2C -> 750 | F77: =RC1*R2C -> 750 | G77: =RC1*R2C -> 750 | H77: =RC1*R2C -> 750 | I77: =RC1*R2C -> 750 | J77: =RC1*R2C -> 750 | K77: =RC1*R2C -> 750 | L77: =RC1*R2C -> 750 | M77: =RC1*R2C -> 750
A78: 76 | B78: =RC1*R2C -> 760 | C78: =RC1*R2C -> 760 | D78: =RC1*R2C -> 760 | E78: =RC1*R2C -> 760 | F78: =RC1*R2C -> 760 | G78: =RC1*R2C -> 760 | H78: =RC1*R2C -> 760 | I78: =RC1*R2C -> 760 | J78: =RC1*R2C -> 760 | K78: =RC1*R2C -> 760 | L78: =RC1*R2C -> 760 | M78: =RC1*R2C -> 760
A79: 77 | B79: =RC1*R2C -> 770 | C79: =RC1*R2C -> 770 | D79: =RC1*R2C -> 770 | E79: =RC1*R2C -> 770 | F79: =RC1*R2C -> 770 | G79: =RC1*R2C -> 770 | H79: =RC1*R2C -> 770 | I79: =RC1*R2C -> 770 | J79: =RC1*R2C -> 770 | K79: =RC1*R2C -> 770 | L79: =RC1*R2C -> 770 | M79: =RC1*R2C -> 770
A80: 78 | B80: =RC1*R2C -> 780 | C80: =RC1*R2C -> 780 | D80: =RC1*R2C -> 780 | E80: =RC1*R2C -> 780 | F80: =RC1*R2C -> 780 | G80: =RC1*R2C -> 780 | H80: =RC1*R2C -> 780 | I80: =RC1*R2C -> 780 | J80: =RC1*R2C -> 780 | K80: =RC1*R2C -> 780 | L80: =RC1*R2C -> 780 | M80: =RC1*R2C -> 780
A81: 79 | B81: =RC1*R2C -> 790 | C81: =RC1*R2C -> 790 | D81: =RC1*R2C -> 790 | E81: =RC1*R2C -> 790 | F81: =RC1*R2C -> 790 | G81: =RC1*R2C -> 790 | H81: =RC1*R2C -> 790 | I81: =RC1*R2C -> 790 | J81: =RC1*R2C -> 790 | K81: =RC1*R2C -> 790 | L81: =RC1*R2C -> 790 | M81: =RC1*R2C -> 790
A82: 80 | B82: =RC1*R2C -> 800 | C82: =RC1*R2C -> 800 | D82: =RC1*R2C -> 800 | E82: =RC1*R2C -> 800 | F82: =RC1*R2C -> 800 | G82: =RC1*R2C -> 800 | H82: =RC1*R2C -> 800 | I82: =RC1*R2C -> 800 | J82: =RC1*R2C -> 800 | K82: =RC1*R2C -> 800 | L82: =RC1*R2C -> 800 | M82: =RC1*R2C -> 800
A83: 81 | B83: =RC1*R2C -> 810 | C83: =RC1*R2C -> 810 | D83: =RC1*R2C -> 810 | E83: =RC1*R2C -> 810 | F83: =RC1*R2C -> 810 | G83: =RC1*R2C -> 810 | H83: =RC1*R2C -> 810 | I83: =RC1*R2C -> 810 | J83: =RC1*R2C -> 810 | K83: =RC1*R2C -> 810 | L83: =RC1*R2C -> 810 | M83: =RC1*R2C -> 810
A84: 82 | B84: =RC1*R2C -> 820 | C84: =RC1*R2C -> 820 | D84: =RC1*R2C -> 820 | E84: =RC1*R2C -> 820 | F84: =RC1*R2C -> 820 | G84: =RC1*R2C -> 820 | H84: =RC1*R2C -> 820 | I84: =RC1*R2C -> 820 | J84: =RC1*R2C -> 820 | K84: =RC1*R2C -> 820 | L84: =RC1*R2C -> 820 | M84: =RC1*R2C -> 820
A85: 83 | B85: =RC1*R2C -> 830 | C85: =RC1*R2C -> 830 | D85: =RC1*R2C -> 830 | E85: =RC1*R2C -> 830 | F85: =RC1*R2C -> 830 | G85: =RC1*R2C -> 830 | H85: =RC1*R2C -> 830 | I85: =RC1*R2C -> 830 | J85: =RC1*R2C -> 830 | K85: =RC1*R2C -> 830 | L85: =RC1*R2C -> 830 | M85: =RC1*R2C -> 830
A86: 84 | B86: =RC1*R2C -> 840 | C86: =RC1*R2C -> 840 | D86: =RC1*R2C -> 840 | E86: =RC1*R2C -> 840 | F86: =RC1*R2C -> 840 | G86: =RC1*R2C -> 840 | H86: =RC1*R2C -> 840 | I86: =RC1*R2C -> 840 | J86: =RC1*R2C -> 840 | K86: =RC1*R2C -> 840 | L86: =RC1*R2C -> 840 | M86: =RC1*R2C -> 840
A87: 85 | B87: =RC1*R2C -> 850 | C87: =RC1*R2C -> 850 | D87: =RC1*R2C -> 850 | E87: =RC1*R2C -> 850 | F87: =RC1*R2C -> 850 | G87: =RC1*R2C -> 850 | H87: =RC1*R2C -> 850 | I87: =RC1*R2C -> 850 | J87: =RC1*R2C -> 850 | K87: =RC1*R2C -> 850 | L87: =RC1*R2C -> 850 | M87: =RC1*R2C -> 850
A88: 86 | B88: =RC1*R2C -> 860 | C88: =RC1*R2C -> 860 | D88: =RC1*R2C -> 860 | E88: =RC1*R2C -> 860 | F88: =RC1*R2C -> 860 | G88: =RC1*R2C -> 860 | H88: =RC1*R2C -> 860 | I88: =RC1*R2C -> 860 | J88: =RC1*R2C -> 860 | K88: =RC1*R2C -> 860 | L88: =RC1*R2C -> 860 | M88: =RC1*R2C -> 860
A89: 87 | B89: =RC1*R2C -> 870 | C89: =RC1*R2C -> 870 | D89: =RC1*R2C -> 870 | E89: =RC1*R2C -> 870 | F89: =RC1*R2C -> 870 | G89: =RC1*R2C -> 870 | H89: =RC1*R2C -> 870 | I89: =RC1*R2C -> 870 | J89: =RC1*R2C -> 870 | K89: =RC1*R2C -> 870 | L89: =RC1*R2C -> 870 | M89: =RC1*R2C -> 870
A90: 88 | B90: =RC1*R2C -> 880 | C90: =RC1*R2C -> 880 | D90: =RC1*R2C -> 880 | E90: =RC1*R2C -> 880 | F90: =RC1*R2C -> 880 | G90: =RC1*R2C -> 880 | H90: =RC1*R2C -> 880 | I90: =RC1*R2C -> 880 | J90: =RC1*R2C -> 880 | K90: =RC1*R2C -> 880 | L90: =RC1*R2C -> 880 | M90: =RC1*R2C -> 880
A91: 89 | B91: =RC1*R2C -> 890 | C91: =RC1*R2C -> 890 | D91: =RC1*R2C -> 890 | E91: =RC1*R2C -> 890 | F91: =RC1*R2C -> 890 | G91: =RC1*R2C -> 890 | H91: =RC1*R2C -> 890 | I91: =RC1*R2C -> 890 | J91: =RC1*R2C -> 890 | K91: =RC1*R2C -> 890 | L91: =RC1*R2C -> 890 | M91: =RC1*R2C -> 890
A92: 90 | B92: =RC1*R2C -> 900 | C92: =RC1*R2C -> 900 | D92: =RC1*R2C -> 900 | E92: =RC1*R2C -> 900 | F92: =RC1*R2C -> 900 | G92: =RC1*R2C -> 900 | H92: =RC1*R2C -> 900 | I92: =RC1*R2C -> 900 | J92: =RC1*R2C -> 900 | K92: =RC1*R2C -> 900 | L92: =RC1*R2C -> 900 | M92: =RC1*R2C -> 900
A93: 91 | B93: =RC1*R2C -> 910 | C93: =RC1*R2C -> 910 | D93: =RC1*R2C -> 910 | E93: =RC1*R2C -> 910 | F93: =RC1*R2C -> 910 | G93: =RC1*R2C -> 910 | H93: =RC1*R2C -> 910 | I93: =RC1*R2C -> 910 | J93: =RC1*R2C -> 910 | K93: =RC1*R2C -> 910 | L93: =RC1*R2C -> 910 | M93: =RC1*R2C -> 910
A94: 92 | B94: =RC1*R2C -> 920 | C94: =RC1*R2C -> 920 | D94: =RC1*R2C -> 920 | E94: =RC1*R2C -> 920 | F94: =RC1*R2C -> 920 | G94: =RC1*R2C -> 920 | H94: =RC1*R2C -> 920 | I94: =RC1*R2C -> 920 | J94: =RC1*R2C -> 920 | K94: =RC1*R2C -> 920 | L94: =RC1*R2C -> 920 | M94: =RC1*R2C -> 920
A95: 93 | B95: =RC1*R2C -> 930 | C95: =RC1*R2C -> 930 | D95: =RC1*R2C -> 930 | E95: =RC1*R2C -> 930 | F95: =RC1*R2C -> 930 | G95: =RC1*R2C -> 930 | H95: =RC1*R2C -> 930 | I95: =RC1*R2C -> 930 | J95: =RC1*R2C -> 930 | K95: =RC1*R2C -> 930 | L95: =RC1*R2C -> 930 | M95: =RC1*R2C -> 930
A96: 94 | B96: =RC1*R2C -> 940 | C96: =RC1*R2C -> 940 | D96: =RC1*R2C -> 940 | E96: =RC1*R2C -> 940 | F96: =RC1*R2C -> 940 | G96: =RC1*R2C -> 940 | H96: =RC1*R2C -> 940 | I96: =RC1*R2C -> 940 | J96: =RC1*R2C -> 940 | K96: =RC1*R2C -> 940 | L96: =RC1*R2C -> 940 | M96: =RC1*R2C -> 940
A97: 95 | B97: =RC1*R2C -> 950 | C97: =RC1*R2C -> 950 | D97: =RC1*R2C -> 950 | E97: =RC1*R2C -> 950 | F97: =RC1*R2C -> 950 | G97: =RC1*R2C -> 950 | H97: =RC1*R2C -> 950 | I97: =RC1*R2C -> 950 | J97: =RC1*R2C -> 950 | K97: =RC1*R2C -> 950 | L97: =RC1*R2C -> 950 | M97: =RC1*R2C -> 950
A98: 96 | B98: =RC1*R2C -> 960 | C98: =RC1*R2C -> 960 | D98: =RC1*R2C -> 960 | E98: =RC1*R2C -> 960 | F98: =RC1*R2C -> 960 | G98: =RC1*R2C -> 960 | H98: =RC1*R2C -> 960 | I98: =RC1*R2C -> 960 | J98: =RC1*R2C -> 960 | K98: =RC1*R2C -> 960 | L98: =RC1*R2C -> 960 | M98: =RC1*R2C -> 960
A99: 97 | B99: =RC1*R2C -> 970 | C99: =RC1*R2C -> 970 | D99: =RC1*R2C -> 970 | E99: =RC1*R2C -> 970 | F99: =RC1*R2C -> 970 | G99: =RC1*R2C -> 970 | H99: =RC1*R2C -> 970 | I99: =RC1*R2C -> 970 | J99: =RC1*R2C -> 970 | K99: =RC1*R2C -> 970 | L99: =RC1*R2C -> 970 | M99: =RC1*R2C -> 970
A100: 98 | B100: =RC1*R2C -> 980 | C100: =RC1*R2C -> 980 | D100: =RC1*R2C -> 980 | E100: =RC1*R2C -> 980 | F100: =RC1*R2C -> 980 | G100: =RC1*R2C -> 980 | H100: =RC1*R2C -> 980 | I100: =RC1*R2C -> 980 | J100: =RC1*R2C -> 980 | K100: =RC1*R2C -> 980 | L100: =RC1*R2C -> 980 | M100: =RC1*R2C -> 980
A101: 99 | B101: =RC1*R2C -> 990 | C101: =RC1*R2C -> 990 | D101: =RC1*R2C -> 990 | E101: =RC1*R2C -> 990 | F101: =RC1*R2C -> 990 | G101: =RC1*R2C -> 990 | H101: =RC1*R2C -> 990 | I101: =RC1*R2C -> 990 | J101: =RC1*R2C -> 990 | K101: =RC1*R2C -> 990 | L101: =RC1*R2C -> 990 | M101: =RC1*R2C -> 990
A102: 100 | B102: =RC1*R2C -> 1000 | C102: =RC1*R2C -> 1000 | D102: =RC1*R2C -> 1000 | E102: =RC1*R2C -> 1000 | F102: =RC1*R2C -> 1000 | G102: =RC1*R2C -> 1000 | H102: =RC1*R2C -> 1000 | I102: =RC1*R2C -> 1000 | J102: =RC1*R2C -> 1000 | K102: =RC1*R2C -> 1000 | L102: =RC1*R2C -> 1000 | M102: =RC1*R2C -> 1000
A103: 101 | B103: =RC1*R2C -> 1010 | C103: =RC1*R2C -> 1010 | D103: =RC1*R2C -> 1010 | E103: =RC1*R2C -> 1010 | F103: =RC1*R2C -> 1010 | G103: =RC1*R2C -> 1010 | H103: =RC1*R2C -> 1010 | I103: =RC1*R2C -> 1010 | J103: =RC1*R2C -> 1010 | K103: =RC1*R2C -> 1010 | L103: =RC1*R2C -> 1010 | M103: =RC1*R2C -> 1010
A104: 102 | B104: =RC1*R2C -> 1020 | C104: =RC1*R2C -> 1020 | D104: =RC1*R2C -> 1020 | E104: =RC1*R2C -> 1020 | F104: =RC1*R2C -> 1020 | G104: =RC1*R2C -> 1020 | H104: =RC1*R2C -> 1020 | I104: =RC1*R2C -> 1020 | J104: =RC1*R2C -> 1020 | K104: =RC1*R2C -> 1020 | L104: =RC1*R2C -> 1020 | M104: =RC1*R2C -> 1020
A105: 103 | B105: =RC1*R2C -> 1030 | C105: =RC1*R2C -> 1030 | D105: =RC1*R2C -> 1030 | E105: =RC1*R2C -> 1030 | F105: =RC1*R2C -> 1030 | G105: =RC1*R2C -> 1030 | H105: =RC1*R2C -> 1030 | I105: =RC1*R2C -> 1030 | J105: =RC1*R2C -> 1030 | K105: =RC1*R2C -> 1030 | L105: =RC1*R2C -> 1030 | M105: =RC1*R2C -> 1030
A106: 104 | B106: =RC1*R2C -> 1040 | C106: =RC1*R2C -> 1040 | D106: =RC1*R2C -> 1040 | E106: =RC1*R2C -> 1040 | F106: =RC1*R2C -> 1040 | G106: =RC1*R2C -> 1040 | H106: =RC1*R2C -> 1040 | I106: =RC1*R2C -> 1040 | J106: =RC1*R2C -> 1040 | K106: =RC1*R2C -> 1040 | L106: =RC1*R2C -> 1040 | M106: =RC1*R2C -> 1040
A107: 105 | B107: =RC1*R2C -> 1050 | C107: =RC1*R2C -> 1050 | D107: =RC1*R2C -> 1050 | E107: =RC1*R2C -> 1050 | F107: =RC1*R2C -> 1050 | G107: =RC1*R2C -> 1050 | H107: =RC1*R2C -> 1050 | I107: =RC1*R2C -> 1050 | J107: =RC1*R2C -> 1050 | K107: =RC1*R2C -> 1050 | L107: =RC1*R2C -> 1050 | M107: =RC1*R2C -> 1050
A108: 106 | B108: =RC1*R2C -> 1060 | C108: =RC1*R2C -> 1060 | D108: =RC1*R2C -> 1060 | E108: =RC1*R2C -> 1060 | F108: =RC1*R2C -> 1060 | G108: =RC1*R2C -> 1060 | H108: =RC1*R2C -> 1060 | I108: =RC1*R2C -> 1060 | J108: =RC1*R2C -> 1060 | K108: =RC1*R2C -> 1060 | L108: =RC1*R2C -> 1060 | M108: =RC1*R2C -> 1060
A109: 107 | B109: =RC1*R2C -> 1070 | C109: =RC1*R2C -> 1070 | D109: =RC1*R2C -> 1070 | E109: =RC1*R2C -> 1070 | F109: =RC1*R2C -> 1070 | G109: =RC1*R2C -> 1070 | H109: =RC1*R2C -> 1070 | I109: =RC1*R2C -> 1070 | J109: =RC1*R2C -> 1070 | K109: =RC1*R2C -> 1070 | L109: =RC1*R2C -> 1070 | M109: =RC1*R2C -> 1070
A110: 108 | B110: =RC1*R2C -> 1080 | C110: =RC1*R2C -> 1080 | D110: =RC1*R2C -> 1080 | E110: =RC1*R2C -> 1080 | F110: =RC1*R2C -> 1080 | G110: =RC1*R2C -> 1080 | H110: =RC1*R2C -> 1080 | I110: =RC1*R2C -> 1080 | J110: =RC1*R2C -> 1080 | K110: =RC1*R2C -> 1080 | L110: =RC1*R2C -> 1080 | M110: =RC1*R2C -> 1080
A111: 109 | B111: =RC1*R2C -> 1090 | C111: =RC1*R2C -> 1090 | D111: =RC1*R2C -> 1090 | E111: =RC1*R2C -> 1090 | F111: =RC1*R2C -> 1090 | G111: =RC1*R2C -> 1090 | H111: =RC1*R2C -> 1090 | I111: =RC1*R2C -> 1090 | J111: =RC1*R2C -> 1090 | K111: =RC1*R2C -> 1090 | L111: =RC1*R2C -> 1090 | M111: =RC1*R2C -> 1090
A112: 110 | B112: =RC1*R2C -> 1100 | C112: =RC1*R2C -> 1100 | D112: =RC1*R2C -> 1100 | E112: =RC1*R2C -> 1100 | F112: =RC1*R2C -> 1100 | G112: =RC1*R2C -> 1100 | H112: =RC1*R2C -> 1100 | I112: =RC1*R2C -> 1100 | J112: =RC1*R2C -> 1100 | K112: =RC1*R2C -> 1100 | L112: =RC1*R2C -> 1100 | M112: =RC1*R2C -> 1100
A113: 111 | B113: =RC1*R2C -> 1110 | C113: =RC1*R2C -> 1110 | D113: =RC1*R2C -> 1110 | E113: =RC1*R2C -> 1110 | F113: =RC1*R2C -> 1110 | G113: =RC1*R2C -> 1110 | H113: =RC1*R2C -> 1110 | I113: =RC1*R2C -> 1110 | J113: =RC1*R2C -> 1110 | K113: =RC1*R2C -> 1110 | L113: =RC1*R2C -> 1110 | M113: =RC1*R2C -> 1110
A114: 112 | B114: =RC1*R2C -> 1120 | C114: =RC1*R2C -> 1120 | D114: =RC1*R2C -> 1120 | E114: =RC1*R2C -> 1120 | F114: =RC1*R2C -> 1120 | G114: =RC1*R2C -> 1120 | H114: =RC1*R2C -> 1120 | I114: =RC1*R2C -> 1120 | J114: =RC1*R2C -> 1120 | K114: =RC1*R2C -> 1120 | L114: =RC1*R2C -> 1120 | M114: =RC1*R2C -> 1120
A115: 113 | B115: =RC1*R2C -> 1130 | C115: =RC1*R2C -> 1130 | D115: =RC1*R2C -> 1130 | E115: =RC1*R2C -> 1130 | F115: =RC1*R2C -> 1130 | G115: =RC1*R2C -> 1130 | H115: =RC1*R2C -> 1130 | I115: =RC1*R2C -> 1130 | J115: =RC1*R2C -> 1130 | K115: =RC1*R2C -> 1130 | L115: =RC1*R2C -> 1130 | M115: =RC1*R2C -> 1130
A116: 114 | B116: =RC1*R2C -> 1140 | C116: =RC1*R2C -> 1140 | D116: =RC1*R2C -> 1140 | E116: =RC1*R2C -> 1140 | F116: =RC1*R2C -> 1140 | G116: =RC1*R2C -> 1140 | H116: =RC1*R2C -> 1140 | I116: =RC1*R2C -> 1140 | J116: =RC1*R2C -> 1140 | K116: =RC1*R2C -> 1140 | L116: =RC1*R2C -> 1140 | M116: =RC1*R2C -> 1140
A117: 115 | B117: =RC1*R2C -> 1150 | C117: =RC1*R2C -> 1150 | D117: =RC1*R2C -> 1150 | E117: =RC1*R2C -> 1150 | F117: =RC1*R2C -> 1150 | G117: =RC1*R2C -> 1150 | H117: =RC1*R2C -> 1150 | I117: =RC1*R2C -> 1150 | J117: =RC1*R2C -> 1150 | K117: =RC1*R2C -> 1150 | L117: =RC1*R2C -> 1150 | M117: =RC1*R2C -> 1150
A118: 116 | B118: =RC1*R2C -> 1160 | C118: =RC1*R2C -> 1160 | D118: =RC1*R2C -> 1160 | E118: =RC1*R2C -> 1160 | F118: =RC1*R2C -> 1160 | G118: =RC1*R2C -> 1160 | H118: =RC1*R2C -> 1160 | I118: =RC1*R2C -> 1160 | J118: =RC1*R2C -> 1160 | K118: =RC1*R2C -> 1160 | L118: =RC1*R2C -> 1160 | M118: =RC1*R2C -> 1160
A119: 117 | B119: =RC1*R2C -> 1170 | C119: =RC1*R2C -> 1170 | D119: =RC1*R2C -> 1170 | E119: =RC1*R2C -> 1170 | F119: =RC1*R2C -> 1170 | G119: =RC1*R2C -> 1170 | H119: =RC1*R2C -> 1170 | I119: =RC1*R2C -> 1170 | J119: =RC1*R2C -> 1170 | K119: =RC1*R2C -> 1170 | L119: =RC1*R2C -> 1170 | M119: =RC1*R2C -> 1170
A120: 118 | B120: =RC1*R2C -> 1180 | C120: =RC1*R2C -> 1180 | D120: =RC1*R2C -> 1180 | E120: =RC1*R2C -> 1180 | F120: =RC1*R2C -> 1180 | G120: =RC1*R2C -> 1180 | H120: =RC1*R2C -> 1180 | I120: =RC1*R2C -> 1180 | J120: =RC1*R2C -> 1180 | K120: =RC1*R2C -> 1180 | L120: =RC1*R2C -> 1180 | M120: =RC1*R2C -> 1180
A121: 119 | B121: =RC1*R2C -> 1190 | C121: =RC1*R2C -> 1190 | D121: =RC1*R2C -> 1190 | E121: =RC1*R2C -> 1190 | F121: =RC1*R2C -> 1190 | G121: =RC1*R2C -> 1190 | H121: =RC1*R2C -> 1190 | I121: =RC1*R2C -> 1190 | J121: =RC1*R2C -> 1190 | K121: =RC1*R2C -> 1190 | L121: =RC1*R2C -> 1190 | M121: =RC1*R2C -> 1190
A122: 120 | B122: =RC1*R2C -> 1200 | C122: =RC1*R2C -> 1200 | D122: =RC1*R2C -> 1200 | E122: =RC1*R2C -> 1200 | F122: =RC1*R2C -> 1200 | G122: =RC1*R2C -> 1200 | H122: =RC1*R2C -> 1200 | I122: =RC1*R2C -> 1200 | J122: =RC1*R2C -> 1200 | K122: =RC1*R2C -> 1200 | L122: =RC1*R2C -> 1200 | M122: =RC1*R2C -> 1200
A123: 121 | B123: =RC1*R2C -> 1210 | C123: =RC1*R2C -> 1210 | D123: =RC1*R2C -> 1210 | E123: =RC1*R2C -> 1210 | F123: =RC1*R2C -> 1210 | G123: =RC1*R2C -> 1210 | H123: =RC1*R2C -> 1210 | I123: =RC1*R2C -> 1210 | J123: =RC1*R2C -> 1210 | K123: =RC1*R2C -> 1210 | L123: =RC1*R2C -> 1210 | M123: =RC1*R2C -> 1210
A124: 122 | B124: =RC1*R2C -> 1220 | C124: =RC1*R2C -> 1220 | D124: =RC1*R2C -> 1220 | E124: =RC1*R2C -> 1220 | F124: =RC1*R2C -> 1220 | G124: =RC1*R2C -> 1220 | H124: =RC1*R2C -> 1220 | I124: =RC1*R2C -> 1220 | J124: =RC1*R2C -> 1220 | K124: =RC1*R2C -> 1220 | L124: =RC1*R2C -> 1220 | M124: =RC1*R2C -> 1220
A125: 123 | B125: =RC1*R2C -> 1230 | C125: =RC1*R2C -> 1230 | D125: =RC1*R2C -> 1230 | E125: =RC1*R2C -> 1230 | F125: =RC1*R2C -> 1230 | G125: =RC1*R2C -> 1230 | H125: =RC1*R2C -> 1230 | I125: =RC1*R2C -> 1230 | J125: =RC1*R2C -> 1230 | K125: =RC1*R2C -> 1230 | L125: =RC1*R2C -> 1230 | M125: =RC1*R2C -> 1230
A126: 124 | B126: =RC1*R2C -> 1240 | C126: =RC1*R2C -> 1240 | D126: =RC1*R2C -> 1240 | E126: =RC1*R2C -> 1240 | F126: =RC1*R2C -> 1240 | G126: =RC1*R2C -> 1240 | H126: =RC1*R2C -> 1240 | I126: =RC1*R2C -> 1240 | J126: =RC1*R2C -> 1240 | K126: =RC1*R2C -> 1240 | L126: =RC1*R2C -> 1240 | M126: =RC1*R2C -> 1240
A127: 125 | B127: =RC1*R2C -> 1250 | C127: =RC1*R2C -> 1250 | D127: =RC1*R2C -> 1250 | E127: =RC1*R2C -> 1250 | F127: =RC1*R2C -> 1250 | G127: =RC1*R2C -> 1250 | H127: =RC1*R2C -> 1250 | I127: =RC1*R2C -> 1250 | J127: =RC1*R2C -> 1250 | K127: =RC1*R2C -> 1250 | L127: =RC1*R2C -> 1250 | M127: =RC1*R2C -> 1250
A128: 126 | B128: =RC1*R2C -> 1260 | C128: =RC1*R2C -> 1260 | D128: =RC1*R2C -> 1260 | E128: =RC1*R2C -> 1260 | F128: =RC1*R2C -> 1260 | G128: =RC1*R2C -> 1260 | H128: =RC1*R2C -> 1260 | I128: =RC1*R2C -> 1260 | J128: =RC1*R2C -> 1260 | K128: =RC1*R2C -> 1260 | L128: =RC1*R2C -> 1260 | M128: =RC1*R2C -> 1260
A129: 127 | B129: =RC1*R2C -> 1270 | C129: =RC1*R2C -> 1270 | D129: =RC1*R2C -> 1270 | E129: =RC1*R2C -> 1270 | F129: =RC1*R2C -> 1270 | G129: =RC1*R2C -> 1270 | H129: =RC1*R2C -> 1270 | I129: =RC1*R2C -> 1270 | J129: =RC1*R2C -> 1270 | K129: =RC1*R2C -> 1270 | L129: =RC1*R2C -> 1270 | M129: =RC1*R2C -> 1270
A130: 128 | B130: =RC1*R2C -> 1280 | C130: =RC1*R2C -> 1280 | D130: =RC1*R2C -> 1280 | E130: =RC1*R2C -> 1280 | F130: =RC1*R2C -> 1280 | G130: =RC1*R2C -> 1280 | H130: =RC1*R2C -> 1280 | I130: =RC1*R2C -> 1280 | J130: =RC1*R2C -> 1280 | K130: =RC1*R2C -> 1280 | L130: =RC1*R2C -> 1280 | M130: =RC1*R2C -> 1280
A131: 129 | B131: =RC1*R2C -> 1290 | C131: =RC1*R2C -> 1290 | D131: =RC1*R2C -> 1290 | E131: =RC1*R2C -> 1290 | F131: =RC1*R2C -> 1290 | G131: =RC1*R2C -> 1290 | H131: =RC1*R2C -> 1290 | I131: =RC1*R2C -> 1290 | J131: =RC1*R2C -> 1290 | K131: =RC1*R2C -> 1290 | L131: =RC1*R2C -> 1290 | M131: =RC1*R2C -> 1290
A132: 130 | B132: =RC1*R2C -> 1300 | C132: =RC1*R2C -> 1300 | D132: =RC1*R2C -> 1300 | E132: =RC1*R2C -> 1300 | F132: =RC1*R2C -> 1300 | G132: =RC1*R2C -> 1300 | H132: =RC1*R2C -> 1300 | I132: =RC1*R2C -> 1300 | J132: =RC1*R2C -> 1300 | K132: =RC1*R2C -> 1300 | L132: =RC1*R2C -> 1300 | M132: =RC1*R2C -> 1300
A133: 131 | B133: =RC1*R2C -> 1310 | C133: =RC1*R2C -> 1310 | D133: =RC1*R2C -> 1310 | E133: =RC1*R2C -> 1310 | F133: =RC1*R2C -> 1310 | G133: =RC1*R2C -> 1310 | H133: =RC1*R2C -> 1310 | I133: =RC1*R2C -> 1310 | J133: =RC1*R2C -> 1310 | K133: =RC1*R2C -> 1310 | L133: =RC1*R2C -> 1310 | M133: =RC1*R2C -> 1310
A134: 132 | B134: =RC1*R2C -> 1320 | C134: =RC1*R2C -> 1320 | D134: =RC1*R2C -> 1320 | E134: =RC1*R2C -> 1320 | F134: =RC1*R2C -> 1320 | G134: =RC1*R2C -> 1320 | H134: =RC1*R2C -> 1320 | I134: =RC1*R2C -> 1320 | J134: =RC1*R2C -> 1320 | K134: =RC1*R2C -> 1320 | L134: =RC1*R2C -> 1320 | M134: =RC1*R2C -> 1320
A135: 133 | B135: =RC1*R2C -> 1330 | C135: =RC1*R2C -> 1330 | D135: =RC1*R2C -> 1330 | E135: =RC1*R2C -> 1330 | F135: =RC1*R2C -> 1330 | G135: =RC1*R2C -> 1330 | H135: =RC1*R2C -> 1330 | I135: =RC1*R2C -> 1330 | J135: =RC1*R2C -> 1330 | K135: =RC1*R2C -> 1330 | L135: =RC1*R2C -> 1330 | M135: =RC1*R2C -> 1330
A136: 134 | B136: =RC1*R2C -> 1340 | C136: =RC1*R2C -> 1340 | D136: =RC1*R2C -> 1340 | E136: =RC1*R2C -> 1340 | F136: =RC1*R2C -> 1340 | G136: =RC1*R2C -> 1340 | H136: =RC1*R2C -> 1340 | I136: =RC1*R2C -> 1340 | J136: =RC1*R2C -> 1340 | K136: =RC1*R2C -> 1340 | L136: =RC1*R2C -> 1340 | M136: =RC1*R2C -> 1340
A137: 135 | B137: =RC1*R2C -> 1350 | C137: =RC1*R2C -> 1350 | D137: =RC1*R2C -> 1350 | E137: =RC1*R2C -> 1350 | F137: =RC1*R2C -> 1350 | G137: =RC1*R2C -> 1350 | H137: =RC1*R2C -> 1350 | I137: =RC1*R2C -> 1350 | J137: =RC1*R2C -> 1350 | K137: =RC1*R2C -> 1350 | L137: =RC1*R2C -> 1350 | M137: =RC1*R2C -> 1350
A138: 136 | B138: =RC1*R2C -> 1360 | C138: =RC1*R2C -> 1360 | D138: =RC1*R2C -> 1360 | E138: =RC1*R2C -> 1360 | F138: =RC1*R2C -> 1360 | G138: =RC1*R2C -> 1360 | H138: =RC1*R2C -> 1360 | I138: =RC1*R2C -> 1360 | J138: =RC1*R2C -> 1360 | K138: =RC1*R2C -> 1360 | L138: =RC1*R2C -> 1360 | M138: =RC1*R2C -> 1360
A139: 137 | B139: =RC1*R2C -> 1370 | C139: =RC1*R2C -> 1370 | D139: =RC1*R2C -> 1370 | E139: =RC1*R2C -> 1370 | F139: =RC1*R2C -> 1370 | G139: =RC1*R2C -> 1370 | H139: =RC1*R2C -> 1370 | I139: =RC1*R2C -> 1370 | J139: =RC1*R2C -> 1370 | K139: =RC1*R2C -> 1370 | L139: =RC1*R2C -> 1370 | M139: =RC1*R2C -> 1370
A140: 138 | B140: =RC1*R2C -> 1380 | C140: =RC1*R2C -> 1380 | D140: =RC1*R2C -> 1380 | E140: =RC1*R2C -> 1380 | F140: =RC1*R2C -> 1380 | G140: =RC1*R2C -> 1380 | H140: =RC1*R2C -> 1380 | I140: =RC1*R2C -> 1380 | J140: =RC1*R2C -> 1380 | K140: =RC1*R2C -> 1380 | L140: =RC1*R2C -> 1380 | M140: =RC1*R2C -> 1380
A141: 139 | B141: =RC1*R2C -> 1390 | C141: =RC1*R2C -> 1390 | D141: =RC1*R2C -> 1390 | E141: =RC1*R2C -> 1390 | F141: =RC1*R2C -> 1390 | G141: =RC1*R2C -> 1390 | H141: =RC1*R2C -> 1390 | I141: =RC1*R2C -> 1390 | J141: =RC1*R2C -> 1390 | K141: =RC1*R2C -> 1390 | L141: =RC1*R2C -> 1390 | M141: =RC1*R2C -> 1390
A142: 140 | B142: =RC1*R2C -> 1400 | C142: =RC1*R2C -> 1400 | D142: =RC1*R2C -> 1400 | E142: =RC1*R2C -> 1400 | F142: =RC1*R2C -> 1400 | G142: =RC1*R2C -> 1400 | H142: =RC1*R2C -> 1400 | I142: =RC1*R2C -> 1400 | J142: =RC1*R2C -> 1400 | K142: =RC1*R2C -> 1400 | L142: =RC1*R2C -> 1400 | M142: =RC1*R2C -> 1400
A143: 141 | B143: =RC1*R2C -> 1410 | C143: =RC1*R2C -> 1410 | D143: =RC1*R2C -> 1410 | E143: =RC1*R2C -> 1410 | F143: =RC1*R2C -> 1410 | G143: =RC1*R2C -> 1410 | H143: =RC1*R2C -> 1410 | I143: =RC1*R2C -> 1410 | J143: =RC1*R2C -> 1410 | K143: =RC1*R2C -> 1410 | L143: =RC1*R2C -> 1410 | M143: =RC1*R2C -> 1410
A144: 142 | B144: =RC1*R2C -> 1420 | C144: =RC1*R2C -> 1420 | D144: =RC1*R2C -> 1420 | E144: =RC1*R2C -> 1420 | F144: =RC1*R2C -> 1420 | G144: =RC1*R2C -> 1420 | H144: =RC1*R2C -> 1420 | I144: =RC1*R2C -> 1420 | J144: =RC1*R2C -> 1420 | K144: =RC1*R2C -> 1420 | L144: =RC1*R2C -> 1420 | M144: =RC1*R2C -> 1420
A145: 143 | B145: =RC1*R2C -> 1430 | C145: =RC1*R2C -> 1430 | D145: =RC1*R2C -> 1430 | E145: =RC1*R2C -> 1430 | F145: =RC1*R2C -> 1430 | G145: =RC1*R2C -> 1430 | H145: =RC1*R2C -> 1430 | I145: =RC1*R2C -> 1430 | J145: =RC1*R2C -> 1430 | K145: =RC1*R2C -> 1430 | L145: =RC1*R2C -> 1430 | M145: =RC1*R2C -> 1430
A146: 144 | B146: =RC1*R2C -> 1440 | C146: =RC1*R2C -> 1440 | D146: =RC1*R2C -> 1440 | E146: =RC1*R2C -> 1440 | F146: =RC1*R2C -> 1440 | G146: =RC1*R2C -> 1440 | H146: =RC1*R2C -> 1440 | I146: =RC1*R2C -> 1440 | J146: =RC1*R2C -> 1440 | K146: =RC1*R2C -> 1440 | L146: =RC1*R2C -> 1440 | M146: =RC1*R2C -> 1440
A147: 145 | B147: =RC1*R2C -> 1450 | C147: =RC1*R2C -> 1450 | D147: =RC1*R2C -> 1450 | E147: =RC1*R2C -> 1450 | F147: =RC1*R2C -> 1450 | G147: =RC1*R2C -> 1450 | H147: =RC1*R2C -> 1450 | I147: =RC1*R2C -> 1450 | J147: =RC1*R2C -> 1450 | K147: =RC1*R2C -> 1450 | L147: =RC1*R2C -> 1450 | M147: =RC1*R2C -> 1450
A148: 146 | B148: =RC1*R2C -> 1460 | C148: =RC1*R2C -> 1460 | D148: =RC1*R2C -> 1460 | E148: =RC1*R2C -> 1460 | F148: =RC1*R2C -> 1460 | G148: =RC1*R2C -> 1460 | H148: =RC1*R2C -> 1460 | I148: =RC1*R2C -> 1460 | J148: =RC1*R2C -> 1460 | K148: =RC1*R2C -> 1460 | L148: =RC1*R2C -> 1460 | M148: =RC1*R2C -> 1460
A149: 147 | B149: =RC1*R2C -> 1470 | C149: =RC1*R2C -> 1470 | D149: =RC1*R2C -> 1470 | E149: =RC1*R2C -> 1470 | F149: =RC1*R2C -> 1470 | G149: =RC1*R2C -> 1470 | H149: =RC1*R2C -> 1470 | I149: =RC1*R2C -> 1470 | J149: =RC1*R2C -> 1470 | K149: =RC1*R2C -> 1470 | L149: =RC1*R2C -> 1470 | M149: =RC1*R2C -> 1470
A150: 148 | B150: =RC1*R2C -> 1480 | C150: =RC1*R2C -> 1480 | D150: =RC1*R2C -> 1480 | E150: =RC1*R2C -> 1480 | F150: =RC1*R2C -> 1480 | G150: =RC1*R2C -> 1480 | H150: =RC1*R2C -> 1480 | I150: =RC1*R2C -> 1480 | J150: =RC1*R2C -> 1480 | K150: =RC1*R2C -> 1480 | L150: =RC1*R2C -> 1480 | M150: =RC1*R2C -> 1480
A151: 149 | B151: =RC1*R2C -> 1490 | C151: =RC1*R2C -> 1490 | D151: =RC1*R2C -> 1490 | E151: =RC1*R2C -> 1490 | F151: =RC1*R2C -> 1490 | G151: =RC1*R2C -> 1490 | H151: =RC1*R2C -> 1490 | I151: =RC1*R2C -> 1490 | J151: =RC1*R2C -> 1490 | K151: =RC1*R2C -> 1490 | L151: =RC1*R2C -> 1490 | M151: =RC1*R2C -> 1490
A152: 150 | B152: =RC1*R2C -> 1500 | C152: =RC1*R2C -> 1500 | D152: =RC1*R2C -> 1500 | E152: =RC1*R2C -> 1500 | F152: =RC1*R2C -> 1500 | G152: =RC1*R2C -> 1500 | H152: =RC1*R2C -> 1500 | I152: =RC1*R2C -> 1500 | J152: =RC1*R2C -> 1500 | K152: =RC1*R2C -> 1500 | L152: =RC1*R2C -> 1500 | M152: =RC1*R2C -> 1500
A153: 151 | B153: =RC1*R2C -> 1510 | C153: =RC1*R2C -> 1510 | D153: =RC1*R2C -> 1510 | E153: =RC1*R2C -> 1510 | F153: =RC1*R2C -> 1510 | G153: =RC1*R2C -> 1510 | H153: =RC1*R2C -> 1510 | I153: =RC1*R2C -> 1510 | J153: =RC1*R2C -> 1510 | K153: =RC1*R2C -> 1510 | L153: =RC1*R2C -> 1510 | M153: =RC1*R2C -> 1510
A154: 152 | B154: =RC1*R2C -> 1520 | C154: =RC1*R2C -> 1520 | D154: =RC1*R2C -> 1520 | E154: =RC1*R2C -> 1520 | F154: =RC1*R2C -> 1520 | G154: =RC1*R2C -> 1520 | H154: =RC1*R2C -> 1520 | I154: =RC1*R2C -> 1520 | J154: =RC1*R2C -> 1520 | K154: =RC1*R2C -> 1520 | L154: =RC1*R2C -> 1520 | M154: =RC1*R2C -> 1520
A155: 153 | B155: =RC1*R2C -> 1530 | C155: =RC1*R2C -> 1530 | D155: =RC1*R2C -> 1530 | E155: =RC1*R2C -> 1530 | F155: =RC1*R2C -> 1530 | G155: =RC1*R2C -> 1530 | H155: =RC1*R2C -> 1530 | I155: =RC1*R2C -> 1530 | J155: =RC1*R2C -> 1530 | K155: =RC1*R2C -> 1530 | L155: =RC1*R2C -> 1530 | M155: =RC1*R2C -> 1530
A156: 154 | B156: =RC1*R2C -> 1540 | C156: =RC1*R2C -> 1540 | D156: =RC1*R2C -> 1540 | E156: =RC1*R2C -> 1540 | F156: =RC1*R2C -> 1540 | G156: =RC1*R2C -> 1540 | H156: =RC1*R2C -> 1540 | I156: =RC1*R2C -> 1540 | J156: =RC1*R2C -> 1540 | K156: =RC1*R2C -> 1540 | L156: =RC1*R2C -> 1540 | M156: =RC1*R2C -> 1540
A157: 155 | B157: =RC1*R2C -> 1550 | C157: =RC1*R2C -> 1550 | D157: =RC1*R2C -> 1550 | E157: =RC1*R2C -> 1550 | F157: =RC1*R2C -> 1550 | G157: =RC1*R2C -> 1550 | H157: =RC1*R2C -> 1550 | I157: =RC1*R2C -> 1550 | J157: =RC1*R2C -> 1550 | K157: =RC1*R2C -> 1550 | L157: =RC1*R2C -> 1550 | M157: =RC1*R2C -> 1550
A158: 156 | B158: =RC1*R2C -> 1560 | C158: =RC1*R2C -> 1560 | D158: =RC1*R2C -> 1560 | E158: =RC1*R2C -> 1560 | F158: =RC1*R2C -> 1560 | G158: =RC1*R2C -> 1560 | H158: =RC1*R2C -> 1560 | I158: =RC1*R2C -> 1560 | J158: =RC1*R2C -> 1560 | K158: =RC1*R2C -> 1560 | L158: =RC1*R2C -> 1560 | M158: =RC1*R2C -> 1560
A159: 157 | B159: =RC1*R2C -> 1570 | C159: =RC1*R2C -> 1570 | D159: =RC1*R2C -> 1570 | E159: =RC1*R2C -> 1570 | F159: =RC1*R2C -> 1570 | G159: =RC1*R2C -> 1570 | H159: =RC1*R2C -> 1570 | I159: =RC1*R2C -> 1570 | J159: =RC1*R2C -> 1570 | K159: =RC1*R2C -> 1570 | L159: =RC1*R2C -> 1570 | M159: =RC1*R2C -> 1570
A160: 158 | B160: =RC1*R2C -> 1580 | C160: =RC1*R2C -> 1580 | D160: =RC1*R2C -> 1580 | E160: =RC1*R2C -> 1580 | F160: =RC1*R2C -> 1580 | G160: =RC1*R2C -> 1580 | H160: =RC1*R2C -> 1580 | I160: =RC1*R2C -> 1580 | J160: =RC1*R2C -> 1580 | K160: =RC1*R2C -> 1580 | L160: =RC1*R2C -> 1580 | M160: =RC1*R2C -> 1580
A161: 159 | B161: =RC1*R2C -> 1590 | C161: =RC1*R2C -> 1590 | D161: =RC1*R2C -> 1590 | E161: =RC1*R2C -> 1590 | F161: =RC1*R2C -> 1590 | G161: =RC1*R2C -> 1590 | H161: =RC1*R2C -> 1590 | I161: =RC1*R2C -> 1590 | J161: =RC1*R2C -> 1590 | K161: =RC1*R2C -> 1590 | L161: =RC1*R2C -> 1590 | M161: =RC1*R2C -> 1590
A162: 160 | B162: =RC1*R2C -> 1600 | C162: =RC1*R2C -> 1600 | D162: =RC1*R2C -> 1600 | E162: =RC1*R2C -> 1600 | F162: =RC1*R2C -> 1600 | G162: =RC1*R2C -> 1600 | H162: =RC1*R2C -> 1600 | I162: =RC1*R2C -> 1600 | J162: =RC1*R2C -> 1600 | K162: =RC1*R2C -> 1600 | L162: =RC1*R2C -> 1600 | M162: =RC1*R2C -> 1600
A163: 161 | B163: =RC1*R2C -> 1610 | C163: =RC1*R2C -> 1610 | D163: =RC1*R2C -> 1610 | E163: =RC1*R2C -> 1610 | F163: =RC1*R2C -> 1610 | G163: =RC1*R2C -> 1610 | H163: =RC1*R2C -> 1610 | I163: =RC1*R2C -> 1610 | J163: =RC1*R2C -> 1610 | K163: =RC1*R2C -> 1610 | L163: =RC1*R2C -> 1610 | M163: =RC1*R2C -> 1610
A164: 162 | B164: =RC1*R2C -> 1620 | C164: =RC1*R2C -> 1620 | D164: =RC1*R2C -> 1620 | E164: =RC1*R2C -> 1620 | F164: =RC1*R2C -> 1620 | G164: =RC1*R2C -> 1620 | H164: =RC1*R2C -> 1620 | I164: =RC1*R2C -> 1620 | J164: =RC1*R2C -> 1620 | K164: =RC1*R2C -> 1620 | L164: =RC1*R2C -> 1620 | M164: =RC1*R2C -> 1620
A165: 163 | B165: =RC1*R2C -> 1630 | C165: =RC1*R2C -> 1630 | D165: =RC1*R2C -> 1630 | E165: =RC1*R2C -> 1630 | F165: =RC1*R2C -> 1630 | G165: =RC1*R2C -> 1630 | H165: =RC1*R2C -> 1630 | I165: =RC1*R2C -> 1630 | J165: =RC1*R2C -> 1630 | K165: =RC1*R2C -> 1630 | L165: =RC1*R2C -> 1630 | M165: =RC1*R2C -> 1630
A166: 164 | B166: =RC1*R2C -> 1640 | C166: =RC1*R2C -> 1640 | D166: =RC1*R2C -> 1640 | E166: =RC1*R2C -> 1640 | F166: =RC1*R2C -> 1640 | G166: =RC1*R2C -> 1640 | H166: =RC1*R2C -> 1640 | I166: =RC1*R2C -> 1640 | J166: =RC1*R2C -> 1640 | K166: =RC1*R2C -> 1640 | L166: =RC1*R2C -> 1640 | M166: =RC1*R2C -> 1640
A167: 165 | B167: =RC1*R2C -> 1650 | C167: =RC1*R2C -> 1650 | D167: =RC1*R2C -> 1650 | E167: =RC1*R2C -> 1650 | F167: =RC1*R2C -> 1650 | G167: =RC1*R2C -> 1650 | H167: =RC1*R2C -> 1650 | I167: =RC1*R2C -> 1650 | J167: =RC1*R2C -> 1650 | K167: =RC1*R2C -> 1650 | L167: =RC1*R2C -> 1650 | M167: =RC1*R2C -> 1650
A168: 166 | B168: =RC1*R2C -> 1660 | C168: =RC1*R2C -> 1660 | D168: =RC1*R2C -> 1660 | E168: =RC1*R2C -> 1660 | F168: =RC1*R2C -> 1660 | G168: =RC1*R2C -> 1660 | H168: =RC1*R2C -> 1660 | I168: =RC1*R2C -> 1660 | J168: =RC1*R2C -> 1660 | K168: =RC1*R2C -> 1660 | L168: =RC1*R2C -> 1660 | M168: =RC1*R2C -> 1660
A169: 167 | B169: =RC1*R2C -> 1670 | C169: =RC1*R2C -> 1670 | D169: =RC1*R2C -> 1670 | E169: =RC1*R2C -> 1670 | F169: =RC1*R2C -> 1670 | G169: =RC1*R2C -> 1670 | H169: =RC1*R2C -> 1670 | I169: =RC1*R2C -> 1670 | J169: =RC1*R2C -> 1670 | K169: =RC1*R2C -> 1670 | L169: =RC1*R2C -> 1670 | M169: =RC1*R2C -> 1670
A170: 168 | B170: =RC1*R2C -> 1680 | C170: =RC1*R2C -> 1680 | D170: =RC1*R2C -> 1680 | E170: =RC1*R2C -> 1680 | F170: =RC1*R2C -> 1680 | G170: =RC1*R2C -> 1680 | H170: =RC1*R2C -> 1680 | I170: =RC1*R2C -> 1680 | J170: =RC1*R2C -> 1680 | K170: =RC1*R2C -> 1680 | L170: =RC1*R2C -> 1680 | M170: =RC1*R2C -> 1680
A171: 169 | B171: =RC1*R2C -> 1690 | C171: =RC1*R2C -> 1690 | D171: =RC1*R2C -> 1690 | E171: =RC1*R2C -> 1690 | F171: =RC1*R2C -> 1690 | G171: =RC1*R2C -> 1690 | H171: =RC1*R2C -> 1690 | I171: =RC1*R2C -> 1690 | J171: =RC1*R2C -> 1690 | K171: =RC1*R2C -> 1690 | L171: =RC1*R2C -> 1690 | M171: =RC1*R2C -> 1690
A172: 170 | B172: =RC1*R2C -> 1700 | C172: =RC1*R2C -> 1700 | D172: =RC1*R2C -> 1700 | E172: =RC1*R2C -> 1700 | F172: =RC1*R2C -> 1700 | G172: =RC1*R2C -> 1700 | H172: =RC1*R2C -> 1700 | I172: =RC1*R2C -> 1700 | J172: =RC1*R2C -> 1700 | K172: =RC1*R2C -> 1700 | L172: =RC1*R2C -> 1700 | M172: =RC1*R2C -> 1700
A173: 171 | B173: =RC1*R2C -> 1710 | C173: =RC1*R2C -> 1710 | D173: =RC1*R2C -> 1710 | E173: =RC1*R2C -> 1710 | F173: =RC1*R2C -> 1710 | G173: =RC1*R2C -> 1710 | H173: =RC1*R2C -> 1710 | I173: =RC1*R2C -> 1710 | J173: =RC1*R2C -> 1710 | K173: =RC1*R2C -> 1710 | L173: =RC1*R2C -> 1710 | M173: =RC1*R2C -> 1710
A174: 172 | B174: =RC1*R2C -> 1720 | C174: =RC1*R2C -> 1720 | D174: =RC1*R2C -> 1720 | E174: =RC1*R2C -> 1720 | F174: =RC1*R2C -> 1720 | G174: =RC1*R2C -> 1720 | H174: =RC1*R2C -> 1720 | I174: =RC1*R2C -> 1720 | J174: =RC1*R2C -> 1720 | K174: =RC1*R2C -> 1720 | L174: =RC1*R2C -> 1720 | M174: =RC1*R2C -> 1720
A175: 173 | B175: =RC1*R2C -> 1730 | C175: =RC1*R2C -> 1730 | D175: =RC1*R2C -> 1730 | E175: =RC1*R2C -> 1730 | F175: =RC1*R2C -> 1730 | G175: =RC1*R2C -> 1730 | H175: =RC1*R2C -> 1730 | I175: =RC1*R2C -> 1730 | J175: =RC1*R2C -> 1730 | K175: =RC1*R2C -> 1730 | L175: =RC1*R2C -> 1730 | M175: =RC1*R2C -> 1730
A176: 174 | B176: =RC1*R2C -> 1740 | C176: =RC1*R2C -> 1740 | D176: =RC1*R2C -> 1740 | E176: =RC1*R2C -> 1740 | F176: =RC1*R2C -> 1740 | G176: =RC1*R2C -> 1740 | H176: =RC1*R2C -> 1740 | I176: =RC1*R2C -> 1740 | J176: =RC1*R2C -> 1740 | K176: =RC1*R2C -> 1740 | L176: =RC1*R2C -> 1740 | M176: =RC1*R2C -> 1740
A177: 175 | B177: =RC1*R2C -> 1750 | C177: =RC1*R2C -> 1750 | D177: =RC1*R2C -> 1750 | E177: =RC1*R2C -> 1750 | F177: =RC1*R2C -> 1750 | G177: =RC1*R2C -> 1750 | H177: =RC1*R2C -> 1750 | I177: =RC1*R2C -> 1750 | J177: =RC1*R2C -> 1750 | K177: =RC1*R2C -> 1750 | L177: =RC1*R2C -> 1750 | M177: =RC1*R2C -> 1750
A178: 176 | B178: =RC1*R2C -> 1760 | C178: =RC1*R2C -> 1760 | D178: =RC1*R2C -> 1760 | E178: =RC1*R2C -> 1760 | F178: =RC1*R2C -> 1760 | G178: =RC1*R2C -> 1760 | H178: =RC1*R2C -> 1760 | I178: =RC1*R2C -> 1760 | J178: =RC1*R2C -> 1760 | K178: =RC1*R2C -> 1760 | L178: =RC1*R2C -> 1760 | M178: =RC1*R2C -> 1760
A179: 177 | B179: =RC1*R2C -> 1770 | C179: =RC1*R2C -> 1770 | D179: =RC1*R2C -> 1770 | E179: =RC1*R2C -> 1770 | F179: =RC1*R2C -> 1770 | G179: =RC1*R2C -> 1770 | H179: =RC1*R2C -> 1770 | I179: =RC1*R2C -> 1770 | J179: =RC1*R2C -> 1770 | K179: =RC1*R2C -> 1770 | L179: =RC1*R2C -> 1770 | M179: =RC1*R2C -> 1770
A180: 178 | B180: =RC1*R2C -> 1780 | C180: =RC1*R2C -> 1780 | D180: =RC1*R2C -> 1780 | E180: =RC1*R2C -> 1780 | F180: =RC1*R2C -> 1780 | G180: =RC1*R2C -> 1780 | H180: =RC1*R2C -> 1780 | I180: =RC1*R2C -> 1780 | J180: =RC1*R2C -> 1780 | K180: =RC1*R2C -> 1780 | L180: =RC1*R2C -> 1780 | M180: =RC1*R2C -> 1780
A181: 179 | B181: =RC1*R2C -> 1790 | C181: =RC1*R2C -> 1790 | D181: =RC1*R2C -> 1790 | E181: =RC1*R2C -> 1790 | F181: =RC1*R2C -> 1790 | G181: =RC1*R2C -> 1790 | H181: =RC1*R2C -> 1790 | I181: =RC1*R2C -> 1790 | J181: =RC1*R2C -> 1790 | K181: =RC1*R2C -> 1790 | L181: =RC1*R2C -> 1790 | M181: =RC1*R2C -> 1790
A182: 180 | B182: =RC1*R2C -> 1800 | C182: =RC1*R2C -> 1800 | D182: =RC1*R2C -> 1800 | E182: =RC1*R2C -> 1800 | F182: =RC1*R2C -> 1800 | G182: =RC1*R2C -> 1800 | H182: =RC1*R2C -> 1800 | I182: =RC1*R2C -> 1800 | J182: =RC1*R2C -> 1800 | K182: =RC1*R2C -> 1800 | L182: =RC1*R2C -> 1800 | M182: =RC1*R2C -> 1800
A183: 181 | B183: =RC1*R2C -> 1810 | C183: =RC1*R2C -> 1810 | D183: =RC1*R2C -> 1810 | E183: =RC1*R2C -> 1810 | F183: =RC1*R2C -> 1810 | G183: =RC1*R2C -> 1810 | H183: =RC1*R2C -> 1810 | I183: =RC1*R2C -> 1810 | J183: =RC1*R2C -> 1810 | K183: =RC1*R2C -> 1810 | L183: =RC1*R2C -> 1810 | M183: =RC1*R2C -> 1810
A184: 182 | B184: =RC1*R2C -> 1820 | C184: =RC1*R2C -> 1820 | D184: =RC1*R2C -> 1820 | E184: =RC1*R2C -> 1820 | F184: =RC1*R2C -> 1820 | G184: =RC1*R2C -> 1820 | H184: =RC1*R2C -> 1820 | I184: =RC1*R2C -> 1820 | J184: =RC1*R2C -> 1820 | K184: =RC1*R2C -> 1820 | L184: =RC1*R2C -> 1820 | M184: =RC1*R2C -> 1820
A185: 183 | B185: =RC1*R2C -> 1830 | C185: =RC1*R2C -> 1830 | D185: =RC1*R2C -> 1830 | E185: =RC1*R2C -> 1830 | F185: =RC1*R2C -> 1830 | G185: =RC1*R2C -> 1830 | H185: =RC1*R2C -> 1830 | I185: =RC1*R2C -> 1830 | J185: =RC1*R2C -> 1830 | K185: =RC1*R2C -> 1830 | L185: =RC1*R2C -> 1830 | M185: =RC1*R2C -> 1830
A186: 184 | B186: =RC1*R2C -> 1840 | C186: =RC1*R2C -> 1840 | D186: =RC1*R2C -> 1840 | E186: =RC1*R2C -> 1840 | F186: =RC1*R2C -> 1840 | G186: =RC1*R2C -> 1840 | H186: =RC1*R2C -> 1840 | I186: =RC1*R2C -> 1840 | J186: =RC1*R2C -> 1840 | K186: =RC1*R2C -> 1840 | L186: =RC1*R2C -> 1840 | M186: =RC1*R2C -> 1840
A187: 185 | B187: =RC1*R2C -> 1850 | C187: =RC1*R2C -> 1850 | D187: =RC1*R2C -> 1850 | E187: =RC1*R2C -> 1850 | F187: =RC1*R2C -> 1850 | G187: =RC1*R2C -> 1850 | H187: =RC1*R2C -> 1850 | I187: =RC1*R2C -> 1850 | J187: =RC1*R2C -> 1850 | K187: =RC1*R2C -> 1850 | L187: =RC1*R2C -> 1850 | M187: =RC1*R2C -> 1850
A188: 186 | B188: =RC1*R2C -> 1860 | C188: =RC1*R2C -> 1860 | D188: =RC1*R2C -> 1860 | E188: =RC1*R2C -> 1860 | F188: =RC1*R2C -> 1860 | G188: =RC1*R2C -> 1860 | H188: =RC1*R2C -> 1860 | I188: =RC1*R2C -> 1860 | J188: =RC1*R2C -> 1860 | K188: =RC1*R2C -> 1860 | L188: =RC1*R2C -> 1860 | M188: =RC1*R2C -> 1860
A189: 187 | B189: =RC1*R2C -> 1870 | C189: =RC1*R2C -> 1870 | D189: =RC1*R2C -> 1870 | E189: =RC1*R2C -> 1870 | F189: =RC1*R2C -> 1870 | G189: =RC1*R2C -> 1870 | H189: =RC1*R2C -> 1870 | I189: =RC1*R2C -> 1870 | J189: =RC1*R2C -> 1870 | K189: =RC1*R2C -> 1870 | L189: =RC1*R2C -> 1870 | M189: =RC1*R2C -> 1870
A190: 188 | B190: =RC1*R2C -> 1880 | C190: =RC1*R2C -> 1880 | D190: =RC1*R2C -> 1880 | E190: =RC1*R2C -> 1880 | F190: =RC1*R2C -> 1880 | G190: =RC1*R2C -> 1880 | H190: =RC1*R2C -> 1880 | I190: =RC1*R2C -> 1880 | J190: =RC1*R2C -> 1880 | K190: =RC1*R2C -> 1880 | L190: =RC1*R2C -> 1880 | M190: =RC1*R2C -> 1880
A191: 189 | B191: =RC1*R2C -> 1890 | C191: =RC1*R2C -> 1890 | D191: =RC1*R2C -> 1890 | E191: =RC1*R2C -> 1890 | F191: =RC1*R2C -> 1890 | G191: =RC1*R2C -> 1890 | H191: =RC1*R2C -> 1890 | I191: =RC1*R2C -> 1890 | J191: =RC1*R2C -> 1890 | K191: =RC1*R2C -> 1890 | L191: =RC1*R2C -> 1890 | M191: =RC1*R2C -> 1890
A192: 190 | B192: =RC1*R2C -> 1900 | C192: =RC1*R2C -> 1900 | D192: =RC1*R2C -> 1900 | E192: =RC1*R2C -> 1900 | F192: =RC1*R2C -> 1900 | G192: =RC1*R2C -> 1900 | H192: =RC1*R2C -> 1900 | I192: =RC1*R2C -> 1900 | J192: =RC1*R2C -> 1900 | K192: =RC1*R2C -> 1900 | L192: =RC1*R2C -> 1900 | M192: =RC1*R2C -> 1900
A193: 191 | B193: =RC1*R2C -> 1910 | C193: =RC1*R2C -> 1910 | D193: =RC1*R2C -> 1910 | E193: =RC1*R2C -> 1910 | F193: =RC1*R2C -> 1910 | G193: =RC1*R2C -> 1910 | H193: =RC1*R2C -> 1910 | I193: =RC1*R2C -> 1910 | J193: =RC1*R2C -> 1910 | K193: =RC1*R2C -> 1910 | L193: =RC1*R2C -> 1910 | M193: =RC1*R2C -> 1910
A194: 192 | B194: =RC1*R2C -> 1920 | C194: =RC1*R2C -> 1920 | D194: =RC1*R2C -> 1920 | E194: =RC1*R2C -> 1920 | F194: =RC1*R2C -> 1920 | G194: =RC1*R2C -> 1920 | H194: =RC1*R2C -> 1920 | I194: =RC1*R2C -> 1920 | J194: =RC1*R2C -> 1920 | K194: =RC1*R2C -> 1920 | L194: =RC1*R2C -> 1920 | M194: =RC1*R2C -> 1920
A195: 193 | B195: =RC1*R2C -> 1930 | C195: =RC1*R2C -> 1930 | D195: =RC1*R2C -> 1930 | E195: =RC1*R2C -> 1930 | F195: =RC1*R2C -> 1930 | G195: =RC1*R2C -> 1930 | H195: =RC1*R2C -> 1930 | I195: =RC1*R2C -> 1930 | J195: =RC1*R2C -> 1930 | K195: =RC1*R2C -> 1930 | L195: =RC1*R2C -> 1930 | M195: =RC1*R2C -> 1930
A196: 194 | B196: =RC1*R2C -> 1940 | C196: =RC1*R2C -> 1940 | D196: =RC1*R2C -> 1940 | E196: =RC1*R2C -> 1940 | F196: =RC1*R2C -> 1940 | G196: =RC1*R2C -> 1940 | H196: =RC1*R2C -> 1940 | I196: =RC1*R2C -> 1940 | J196: =RC1*R2C -> 1940 | K196: =RC1*R2C -> 1940 | L196: =RC1*R2C -> 1940 | M196: =RC1*R2C -> 1940
A197: 195 | B197: =RC1*R2C -> 1950 | C197: =RC1*R2C -> 1950 | D197: =RC1*R2C -> 1950 | E197: =RC1*R2C -> 1950 | F197: =RC1*R2C -> 1950 | G197: =RC1*R2C -> 1950 | H197: =RC1*R2C -> 1950 | I197: =RC1*R2C -> 1950 | J197: =RC1*R2C -> 1950 | K197: =RC1*R2C -> 1950 | L197: =RC1*R2C -> 1950 | M197: =RC1*R2C -> 1950
A198: 196 | B198: =RC1*R2C -> 1960 | C198: =RC1*R2C -> 1960 | D198: =RC1*R2C -> 1960 | E198: =RC1*R2C -> 1960 | F198: =RC1*R2C -> 1960 | G198: =RC1*R2C -> 1960 | H198: =RC1*R2C -> 1960 | I198: =RC1*R2C -> 1960 | J198: =RC1*R2C -> 1960 | K198: =RC1*R2C -> 1960 | L198: =RC1*R2C -> 1960 | M198: =RC1*R2C -> 1960
A199: 197 | B199: =RC1*R2C -> 1970 | C199: =RC1*R2C -> 1970 | D199: =RC1*R2C -> 1970 | E199: =RC1*R2C -> 1970 | F199: =RC1*R2C -> 1970 | G199: =RC1*R2C -> 1970 | H199: =RC1*R2C -> 1970 | I199: =RC1*R2C -> 1970 | J199: =RC1*R2C -> 1970 | K199: =RC1*R2C -> 1970 | L199: =RC1*R2C -> 1970 | M199: =RC1*R2C -> 1970
A200: 198 | B200: =RC1*R2C -> 1980 | C200: =RC1*R2C -> 1980 | D200: =RC1*R2C -> 1980 | E200: =RC1*R2C -> 1980 | F200: =RC1*R2C -> 1980 | G200: =RC1*R2C -> 1980 | H200: =RC1*R2C -> 1980 | I200: =RC1*R2C -> 1980 | J200: =RC1*R2C -> 1980 | K200: =RC1*R2C -> 1980 | L200: =RC1*R2C -> 1980 | M200: =RC1*R2C -> 1980
A201: 199 | B201: =RC1*R2C -> 1990 | C201: =RC1*R2C -> 1990 | D201: =RC1*R2C -> 1990 | E201: =RC1*R2C -> 1990 | F201: =RC1*R2C -> 1990 | G201: =RC1*R2C -> 1990 | H201: =RC1*R2C -> 1990 | I201: =RC1*R2C -> 1990 | J201: =RC1*R2C -> 1990 | K201: =RC1*R2C -> 1990 | L201: =RC1*R2C -> 1990 | M201: =RC1*R2C -> 1990
A202: 200 | B202: =RC1*R2C -> 2000 | C202: =RC1*R2C -> 2000 | D202: =RC1*R2C -> 2000 | E202: =RC1*R2C -> 2000 | F202: =RC1*R2C -> 2000 | G202: =RC1*R2C -> 2000 | H202: =RC1*R2C -> 2000 | I202: =RC1*R2C -> 2000 | J202: =RC1*R2C -> 2000 | K202: =RC1*R2C -> 2000 | L202: =RC1*R2C -> 2000 | M202: =RC1*R2C -> 2000
A203: 201 | B203: =RC1*R2C -> 2010 | C203: =RC1*R2C -> 2010 | D203: =RC1*R2C -> 2010 | E203: =RC1*R2C -> 2010 | F203: =RC1*R2C -> 2010 | G203: =RC1*R2C -> 2010 | H203: =RC1*R2C -> 2010 | I203: =RC1*R2C -> 2010 | J203: =RC1*R2C -> 2010 | K203: =RC1*R2C -> 2010 | L203: =RC1*R2C -> 2010 | M203: =RC1*R2C -> 2010
A204: 202 | B204: =RC1*R2C -> 2020 | C204: =RC1*R2C -> 2020 | D204: =RC1*R2C -> 2020 | E204: =RC1*R2C -> 2020 | F204: =RC1*R2C -> 2020 | G204: =RC1*R2C -> 2020 | H204: =RC1*R2C -> 2020 | I204: =RC1*R2C -> 2020 | J204: =RC1*R2C -> 2020 | K204: =RC1*R2C -> 2020 | L204: =RC1*R2C -> 2020 | M204: =RC1*R2C -> 2020
A205: 203 | B205: =RC1*R2C -> 2030 | C205: =RC1*R2C -> 2030 | D205: =RC1*R2C -> 2030 | E205: =RC1*R2C -> 2030 | F205: =RC1*R2C -> 2030 | G205: =RC1*R2C -> 2030 | H205: =RC1*R2C -> 2030 | I205: =RC1*R2C -> 2030 | J205: =RC1*R2C -> 2030 | K205: =RC1*R2C -> 2030 | L205: =RC1*R2C -> 2030 | M205: =RC1*R2C -> 2030
A206: 204 | B206: =RC1*R2C -> 2040 | C206: =RC1*R2C -> 2040 | D206: =RC1*R2C -> 2040 | E206: =RC1*R2C -> 2040 | F206: =RC1*R2C -> 2040 | G206: =RC1*R2C -> 2040 | H206: =RC1*R2C -> 2040 | I206: =RC1*R2C -> 2040 | J206: =RC1*R2C -> 2040 | K206: =RC1*R2C -> 2040 | L206: =RC1*R2C -> 2040 | M206: =RC1*R2C -> 2040
A207: 205 | B207: =RC1*R2C -> 2050 | C207: =RC1*R2C -> 2050 | D207: =RC1*R2C -> 2050 | E207: =RC1*R2C -> 2050 | F207: =RC1*R2C -> 2050 | G207: =RC1*R2C -> 2050 | H207: =RC1*R2C -> 2050 | I207: =RC1*R2C -> 2050 | J207: =RC1*R2C -> 2050 | K207: =RC1*R2C -> 2050 | L207: =RC1*R2C -> 2050 | M207: =RC1*R2C -> 2050
A208: 206 | B208: =RC1*R2C -> 2060 | C208: =RC1*R2C -> 2060 | D208: =RC1*R2C -> 2060 | E208: =RC1*R2C -> 2060 | F208: =RC1*R2C -> 2060 | G208: =RC1*R2C -> 2060 | H208: =RC1*R2C -> 2060 | I208: =RC1*R2C -> 2060 | J208: =RC1*R2C -> 2060 | K208: =RC1*R2C -> 2060 | L208: =RC1*R2C -> 2060 | M208: =RC1*R2C -> 2060
A209: 207 | B209: =RC1*R2C -> 2070 | C209: =RC1*R2C -> 2070 | D209: =RC1*R2C -> 2070 | E209: =RC1*R2C -> 2070 | F209: =RC1*R2C -> 2070 | G209: =RC1*R2C -> 2070 | H209: =RC1*R2C -> 2070 | I209: =RC1*R2C -> 2070 | J209: =RC1*R2C -> 2070 | K209: =RC1*R2C -> 2070 | L209: =RC1*R2C -> 2070 | M209: =RC1*R2C -> 2070
A210: 208 | B210: =RC1*R2C -> 2080 | C210: =RC1*R2C -> 2080 | D210: =RC1*R2C -> 2080 | E210: =RC1*R2C -> 2080 | F210: =RC1*R2C -> 2080 | G210: =RC1*R2C -> 2080 | H210: =RC1*R2C -> 2080 | I210: =RC1*R2C -> 2080 | J210: =RC1*R2C -> 2080 | K210: =RC1*R2C -> 2080 | L210: =RC1*R2C -> 2080 | M210: =RC1*R2C -> 2080
A211: 209 | B211: =RC1*R2C -> 2090 | C211: =RC1*R2C -> 2090 | D211: =RC1*R2C -> 2090 | E211: =RC1*R2C -> 2090 | F211: =RC1*R2C -> 2090 | G211: =RC1*R2C -> 2090 | H211: =RC1*R2C -> 2090 | I211: =RC1*R2C -> 2090 | J211: =RC1*R2C -> 2090 | K211: =RC1*R2C -> 2090 | L211: =RC1*R2C -> 2090 | M211: =RC1*R2C -> 2090
A212: 210 | B212: =RC1*R2C -> 2100 | C212: =RC1*R2C -> 2100 | D212: =RC1*R2C -> 2100 | E212: =RC1*R2C -> 2100 | F212: =RC1*R2C -> 2100 | G212: =RC1*R2C -> 2100 | H212: =RC1*R2C -> 2100 | I212: =RC1*R2C -> 2100 | J212: =RC1*R2C -> 2100 | K212: =RC1*R2C -> 2100 | L212: =RC1*R2C -> 2100 | M212: =RC1*R2C -> 2100
A213: 211 | B213: =RC1*R2C -> 2110 | C213: =RC1*R2C -> 2110 | D213: =RC1*R2C -> 2110 | E213: =RC1*R2C -> 2110 | F213: =RC1*R2C -> 2110 | G213: =RC1*R2C -> 2110 | H213: =RC1*R2C -> 2110 | I213: =RC1*R2C -> 2110 | J213: =RC1*R2C -> 2110 | K213: =RC1*R2C -> 2110 | L213: =RC1*R2C -> 2110 | M213: =RC1*R2C -> 2110
A214: 212 | B214: =RC1*R2C -> 2120 | C214: =RC1*R2C -> 2120 | D214: =RC1*R2C -> 2120 | E214: =RC1*R2C -> 2120 | F214: =RC1*R2C -> 2120 | G214: =RC1*R2C -> 2120 | H214: =RC1*R2C -> 2120 | I214: =RC1*R2C -> 2120 | J214: =RC1*R2C -> 2120 | K214: =RC1*R2C -> 2120 | L214: =RC1*R2C -> 2120 | M214: =RC1*R2C -> 2120
A215: 213 | B215: =RC1*R2C -> 2130 | C215: =RC1*R2C -> 2130 | D215: =RC1*R2C -> 2130 | E215: =RC1*R2C -> 2130 | F215: =RC1*R2C -> 2130 | G215: =RC1*R2C -> 2130 | H215: =RC1*R2C -> 2130 | I215: =RC1*R2C -> 2130 | J215: =RC1*R2C -> 2130 | K215: =RC1*R2C -> 2130 | L215: =RC1*R2C -> 2130 | M215: =RC1*R2C -> 2130
A216: 214 | B216: =RC1*R2C -> 2140 | C216: =RC1*R2C -> 2140 | D216: =RC1*R2C -> 2140 | E216: =RC1*R2C -> 2140 | F216: =RC1*R2C -> 2140 | G216: =RC1*R2C -> 2140 | H216: =RC1*R2C -> 2140 | I216: =RC1*R2C -> 2140 | J216: =RC1*R2C -> 2140 | K216: =RC1*R2C -> 2140 | L216: =RC1*R2C -> 2140 | M216: =RC1*R2C -> 2140
A217: 215 | B217: =RC1*R2C -> 2150 | C217: =RC1*R2C -> 2150 | D217: =RC1*R2C -> 2150 | E217: =RC1*R2C -> 2150 | F217: =RC1*R2C -> 2150 | G217: =RC1*R2C -> 2150 | H217: =RC1*R2C -> 2150 | I217: =RC1*R2C -> 2150 | J217: =RC1*R2C -> 2150 | K217: =RC1*R2C -> 2150 | L217: =RC1*R2C -> 2150 | M217: =RC1*R2C -> 2150
A218: 216 | B218: =RC1*R2C -> 2160 | C218: =RC1*R2C -> 2160 | D218: =RC1*R2C -> 2160 | E218: =RC1*R2C -> 2160 | F218: =RC1*R2C -> 2160 | G218: =RC1*R2C -> 2160 | H218: =RC1*R2C -> 2160 | I218: =RC1*R2C -> 2160 | J218: =RC1*R2C -> 2160 | K218: =RC1*R2C -> 2160 | L218: =RC1*R2C -> 2160 | M218: =RC1*R2C -> 2160
A219: 217 | B219: =RC1*R2C -> 2170 | C219: =RC1*R2C -> 2170 | D219: =RC1*R2C -> 2170 | E219: =RC1*R2C -> 2170 | F219: =RC1*R2C -> 2170 | G219: =RC1*R2C -> 2170 | H219: =RC1*R2C -> 2170 | I219: =RC1*R2C -> 2170 | J219: =RC1*R2C -> 2170 | K219: =RC1*R2C -> 2170 | L219: =RC1*R2C -> 2170 | M219: =RC1*R2C -> 2170
A220: 218 | B220: =RC1*R2C -> 2180 | C220: =RC1*R2C -> 2180 | D220: =RC1*R2C -> 2180 | E220: =RC1*R2C -> 2180 | F220: =RC1*R2C -> 2180 | G220: =RC1*R2C -> 2180 | H220: =RC1*R2C -> 2180 | I220: =RC1*R2C -> 2180 | J220: =RC1*R2C -> 2180 | K220: =RC1*R2C -> 2180 | L220: =RC1*R2C -> 2180 | M220: =RC1*R2C -> 2180
A221: 219 | B221: =RC1*R2C -> 2190 | C221: =RC1*R2C -> 2190 | D221: =RC1*R2C -> 2190 | E221: =RC1*R2C -> 2190 | F221: =RC1*R2C -> 2190 | G221: =RC1*R2C -> 2190 | H221: =RC1*R2C -> 2190 | I221: =RC1*R2C -> 2190 | J221: =RC1*R2C -> 2190 | K221: =RC1*R2C -> 2190 | L221: =RC1*R2C -> 2190 | M221: =RC1*R2C -> 2190
A222: 220 | B222: =RC1*R2C -> 2200 | C222: =RC1*R2C -> 2200 | D222: =RC1*R2C -> 2200 | E222: =RC1*R2C -> 2200 | F222: =RC1*R2C -> 2200 | G222: =RC1*R2C -> 2200 | H222: =RC1*R2C -> 2200 | I222: =RC1*R2C -> 2200 | J222: =RC1*R2C -> 2200 | K222: =RC1*R2C -> 2200 | L222: =RC1*R2C -> 2200 | M222: =RC1*R2C -> 2200
A223: 221 | B223: =RC1*R2C -> 2210 | C223: =RC1*R2C -> 2210 | D223: =RC1*R2C -> 2210 | E223: =RC1*R2C -> 2210 | F223: =RC1*R2C -> 2210 | G223: =RC1*R2C -> 2210 | H223: =RC1*R2C -> 2210 | I223: =RC1*R2C -> 2210 | J223: =RC1*R2C -> 2210 | K223: =RC1*R2C -> 2210 | L223: =RC1*R2C -> 2210 | M223: =RC1*R2C -> 2210
A224: 222 | B224: =RC1*R2C -> 2220 | C224: =RC1*R2C -> 2220 | D224: =RC1*R2C -> 2220 | E224: =RC1*R2C -> 2220 | F224: =RC1*R2C -> 2220 | G224: =RC1*R2C -> 2220 | H224: =RC1*R2C -> 2220 | I224: =RC1*R2C -> 2220 | J224: =RC1*R2C -> 2220 | K224: =RC1*R2C -> 2220 | L224: =RC1*R2C -> 2220 | M224: =RC1*R2C -> 2220
A225: 223 | B225: =RC1*R2C -> 2230 | C225: =RC1*R2C -> 2230 | D225: =RC1*R2C -> 2230 | E225: =RC1*R2C -> 2230 | F225: =RC1*R2C -> 2230 | G225: =RC1*R2C -> 2230 | H225: =RC1*R2C -> 2230 | I225: =RC1*R2C -> 2230 | J225: =RC1*R2C -> 2230 | K225: =RC1*R2C -> 2230 | L225: =RC1*R2C -> 2230 | M225: =RC1*R2C -> 2230
A226: 224 | B226: =RC1*R2C -> 2240 | C226: =RC1*R2C -> 2240 | D226: =RC1*R2C -> 2240 | E226: =RC1*R2C -> 2240 | F226: =RC1*R2C -> 2240 | G226: =RC1*R2C -> 2240 | H226: =RC1*R2C -> 2240 | I226: =RC1*R2C -> 2240 | J226: =RC1*R2C -> 2240 | K226: =RC1*R2C -> 2240 | L226: =RC1*R2C -> 2240 | M226: =RC1*R2C -> 2240
A227: 225 | B227: =RC1*R2C -> 2250 | C227: =RC1*R2C -> 2250 | D227: =RC1*R2C -> 2250 | E227: =RC1*R2C -> 2250 | F227: =RC1*R2C -> 2250 | G227: =RC1*R2C -> 2250 | H227: =RC1*R2C -> 2250 | I227: =RC1*R2C -> 2250 | J227: =RC1*R2C -> 2250 | K227: =RC1*R2C -> 2250 | L227: =RC1*R2C -> 2250 | M227: =RC1*R2C -> 2250
A228: 226 | B228: =RC1*R2C -> 2260 | C228: =RC1*R2C -> 2260 | D228: =RC1*R2C -> 2260 | E228: =RC1*R2C -> 2260 | F228: =RC1*R2C -> 2260 | G228: =RC1*R2C -> 2260 | H228: =RC1*R2C -> 2260 | I228: =RC1*R2C -> 2260 | J228: =RC1*R2C -> 2260 | K228: =RC1*R2C -> 2260 | L228: =RC1*R2C -> 2260 | M228: =RC1*R2C -> 2260
A229: 227 | B229: =RC1*R2C -> 2270 | C229: =RC1*R2C -> 2270 | D229: =RC1*R2C -> 2270 | E229: =RC1*R2C -> 2270 | F229: =RC1*R2C -> 2270 | G229: =RC1*R2C -> 2270 | H229: =RC1*R2C -> 2270 | I229: =RC1*R2C -> 2270 | J229: =RC1*R2C -> 2270 | K229: =RC1*R2C -> 2270 | L229: =RC1*R2C -> 2270 | M229: =RC1*R2C -> 2270
A230: 228 | B230: =RC1*R2C -> 2280 | C230: =RC1*R2C -> 2280 | D230: =RC1*R2C -> 2280 | E230: =RC1*R2C -> 2280 | F230: =RC1*R2C -> 2280 | G230: =RC1*R2C -> 2280 | H230: =RC1*R2C -> 2280 | I230: =RC1*R2C -> 2280 | J230: =RC1*R2C -> 2280 | K230: =RC1*R2C -> 2280 | L230: =RC1*R2C -> 2280 | M230: =RC1*R2C -> 2280
A231: 229 | B231: =RC1*R2C -> 2290 | C231: =RC1*R2C -> 2290 | D231: =RC1*R2C -> 2290 | E231: =RC1*R2C -> 2290 | F231: =RC1*R2C -> 2290 | G231: =RC1*R2C -> 2290 | H231: =RC1*R2C -> 2290 | I231: =RC1*R2C -> 2290 | J231: =RC1*R2C -> 2290 | K231: =RC1*R2C -> 2290 | L231: =RC1*R2C -> 2290 | M231: =RC1*R2C -> 2290
A232: 230 | B232: =RC1*R2C -> 2300 | C232: =RC1*R2C -> 2300 | D232: =RC1*R2C -> 2300 | E232: =RC1*R2C -> 2300 | F232: =RC1*R2C -> 2300 | G232: =RC1*R2C -> 2300 | H232: =RC1*R2C -> 2300 | I232: =RC1*R2C -> 2300 | J232: =RC1*R2C -> 2300 | K232: =RC1*R2C -> 2300 | L232: =RC1*R2C -> 2300 | M232: =RC1*R2C -> 2300
A233: 231 | B233: =RC1*R2C -> 2310 | C233: =RC1*R2C -> 2310 | D233: =RC1*R2C -> 2310 | E233: =RC1*R2C -> 2310 | F233: =RC1*R2C -> 2310 | G233: =RC1*R2C -> 2310 | H233: =RC1*R2C -> 2310 | I233: =RC1*R2C -> 2310 | J233: =RC1*R2C -> 2310 | K233: =RC1*R2C -> 2310 | L233: =RC1*R2C -> 2310 | M233: =RC1*R2C -> 2310
A234: 232 | B234: =RC1*R2C -> 2320 | C234: =RC1*R2C -> 2320 | D234: =RC1*R2C -> 2320 | E234: =RC1*R2C -> 2320 | F234: =RC1*R2C -> 2320 | G234: =RC1*R2C -> 2320 | H234: =RC1*R2C -> 2320 | I234: =RC1*R2C -> 2320 | J234: =RC1*R2C -> 2320 | K234: =RC1*R2C -> 2320 | L234: =RC1*R2C -> 2320 | M234: =RC1*R2C -> 2320
A235: 233 | B235: =RC1*R2C -> 2330 | C235: =RC1*R2C -> 2330 | D235: =RC1*R2C -> 2330 | E235: =RC1*R2C -> 2330 | F235: =RC1*R2C -> 2330 | G235: =RC1*R2C -> 2330 | H235: =RC1*R2C -> 2330 | I235: =RC1*R2C -> 2330 | J235: =RC1*R2C -> 2330 | K235: =RC1*R2C -> 2330 | L235: =RC1*R2C -> 2330 | M235: =RC1*R2C -> 2330
A236: 234 | B236: =RC1*R2C -> 2340 | C236: =RC1*R2C -> 2340 | D236: =RC1*R2C -> 2340 | E236: =RC1*R2C -> 2340 | F236: =RC1*R2C -> 2340 | G236: =RC1*R2C -> 2340 | H236: =RC1*R2C -> 2340 | I236: =RC1*R2C -> 2340 | J236: =RC1*R2C -> 2340 | K236: =RC1*R2C -> 2340 | L236: =RC1*R2C -> 2340 | M236: =RC1*R2C -> 2340
A237: 235 | B237: =RC1*R2C -> 2350 | C237: =RC1*R2C -> 2350 | D237: =RC1*R2C -> 2350 | E237: =RC1*R2C -> 2350 | F237: =RC1*R2C -> 2350 | G237: =RC1*R2C -> 2350 | H237: =RC1*R2C -> 2350 | I237: =RC1*R2C -> 2350 | J237: =RC1*R2C -> 2350 | K237: =RC1*R2C -> 2350 | L237: =RC1*R2C -> 2350 | M237: =RC1*R2C -> 2350
A238: 236 | B238: =RC1*R2C -> 2360 | C238: =RC1*R2C -> 2360 | D238: =RC1*R2C -> 2360 | E238: =RC1*R2C -> 2360 | F238: =RC1*R2C -> 2360 | G238: =RC1*R2C -> 2360 | H238: =RC1*R2C -> 2360 | I238: =RC1*R2C -> 2360 | J238: =RC1*R2C -> 2360 | K238: =RC1*R2C -> 2360 | L238: =RC1*R2C -> 2360 | M238: =RC1*R2C -> 2360
A239: 237 | B239: =RC1*R2C -> 2370 | C239: =RC1*R2C -> 2370 | D239: =RC1*R2C -> 2370 | E239: =RC1*R2C -> 2370 | F239: =RC1*R2C -> 2370 | G239: =RC1*R2C -> 2370 | H239: =RC1*R2C -> 2370 | I239: =RC1*R2C -> 2370 | J239: =RC1*R2C -> 2370 | K239: =RC1*R2C -> 2370 | L239: =RC1*R2C -> 2370 | M239: =RC1*R2C -> 2370
A240: 238 | B240: =RC1*R2C -> 2380 | C240: =RC1*R2C -> 2380 | D240: =RC1*R2C -> 2380 | E240: =RC1*R2C -> 2380 | F240: =RC1*R2C -> 2380 | G240: =RC1*R2C -> 2380 | H240: =RC1*R2C -> 2380 | I240: =RC1*R2C -> 2380 | J240: =RC1*R2C -> 2380 | K240: =RC1*R2C -> 2380 | L240: =RC1*R2C -> 2380 | M240: =RC1*R2C -> 2380
A241: 239 | B241: =RC1*R2C -> 2390 | C241: =RC1*R2C -> 2390 | D241: =RC1*R2C -> 2390 | E241: =RC1*R2C -> 2390 | F241: =RC1*R2C -> 2390 | G241: =RC1*R2C -> 2390 | H241: =RC1*R2C -> 2390 | I241: =RC1*R2C -> 2390 | J241: =RC1*R2C -> 2390 | K241: =RC1*R2C -> 2390 | L241: =RC1*R2C -> 2390 | M241: =RC1*R2C -> 2390
A242: 240 | B242: =RC1*R2C -> 2400 | C242: =RC1*R2C -> 2400 | D242: =RC1*R2C -> 2400 | E242: =RC1*R2C -> 2400 | F242: =RC1*R2C -> 2400 | G242: =RC1*R2C -> 2400 | H242: =RC1*R2C -> 2400 | I242: =RC1*R2C -> 2400 | J242: =RC1*R2C -> 2400 | K242: =RC1*R2C -> 2400 | L242: =RC1*R2C -> 2400 | M242: =RC1*R2C -> 2400
A243: 241 | B243: =RC1*R2C -> 2410 | C243: =RC1*R2C -> 2410 | D243: =RC1*R2C -> 2410 | E243: =RC1*R2C -> 2410 | F243: =RC1*R2C -> 2410 | G243: =RC1*R2C -> 2410 | H243: =RC1*R2C -> 2410 | I243: =RC1*R2C -> 2410 | J243: =RC1*R2C -> 2410 | K243: =RC1*R2C -> 2410 | L243: =RC1*R2C -> 2410 | M243: =RC1*R2C -> 2410
A244: 242 | B244: =RC1*R2C -> 2420 | C244: =RC1*R2C -> 2420 | D244: =RC1*R2C -> 2420 | E244: =RC1*R2C -> 2420 | F244: =RC1*R2C -> 2420 | G244: =RC1*R2C -> 2420 | H244: =RC1*R2C -> 2420 | I244: =RC1*R2C -> 2420 | J244: =RC1*R2C -> 2420 | K244: =RC1*R2C -> 2420 | L244: =RC1*R2C -> 2420 | M244: =RC1*R2C -> 2420
A245: 243 | B245: =RC1*R2C -> 2430 | C245: =RC1*R2C -> 2430 | D245: =RC1*R2C -> 2430 | E245: =RC1*R2C -> 2430 | F245: =RC1*R2C -> 2430 | G245: =RC1*R2C -> 2430 | H245: =RC1*R2C -> 2430 | I245: =RC1*R2C -> 2430 | J245: =RC1*R2C -> 2430 | K245: =RC1*R2C -> 2430 | L245: =RC1*R2C -> 2430 | M245: =RC1*R2C -> 2430
A246: 244 | B246: =RC1*R2C -> 2440 | C246: =RC1*R2C -> 2440 | D246: =RC1*R2C -> 2440 | E246: =RC1*R2C -> 2440 | F246: =RC1*R2C -> 2440 | G246: =RC1*R2C -> 2440 | H246: =RC1*R2C -> 2440 | I246: =RC1*R2C -> 2440 | J246: =RC1*R2C -> 2440 | K246: =RC1*R2C -> 2440 | L246: =RC1*R2C -> 2440 | M246: =RC1*R2C -> 2440
A247: 245 | B247: =RC1*R2C -> 2450 | C247: =RC1*R2C -> 2450 | D247: =RC1*R2C -> 2450 | E247: =RC1*R2C -> 2450 | F247: =RC1*R2C -> 2450 | G247: =RC1*R2C -> 2450 | H247: =RC1*R2C -> 2450 | I247: =RC1*R2C -> 2450 | J247: =RC1*R2C -> 2450 | K247: =RC1*R2C -> 2450 | L247: =RC1*R2C -> 2450 | M247: =RC1*R2C -> 2450
A248: 246 | B248: =RC1*R2C -> 2460 | C248: =RC1*R2C -> 2460 | D248: =RC1*R2C -> 2460 | E248: =RC1*R2C -> 2460 | F248: =RC1*R2C -> 2460 | G248: =RC1*R2C -> 2460 | H248: =RC1*R2C -> 2460 | I248: =RC1*R2C -> 2460 | J248: =RC1*R2C -> 2460 | K248: =RC1*R2C -> 2460 | L248: =RC1*R2C -> 2460 | M248: =RC1*R2C -> 2460
A249: 247 | B249: =RC1*R2C -> 2470 | C249: =RC1*R2C -> 2470 | D249: =RC1*R2C -> 2470 | E249: =RC1*R2C -> 2470 | F249: =RC1*R2C -> 2470 | G249: =RC1*R2C -> 2470 | H249: =RC1*R2C -> 2470 | I249: =RC1*R2C -> 2470 | J249: =RC1*R2C -> 2470 | K249: =RC1*R2C -> 2470 | L249: =RC1*R2C -> 2470 | M249: =RC1*R2C -> 2470
A250: 248 | B250: =RC1*R2C -> 2480 | C250: =RC1*R2C -> 2480 | D250: =RC1*R2C -> 2480 | E250: =RC1*R2C -> 2480 | F250: =RC1*R2C -> 2480 | G250: =RC1*R2C -> 2480 | H250: =RC1*R2C -> 2480 | I250: =RC1*R2C -> 2480 | J250: =RC1*R2C -> 2480 | K250: =RC1*R2C -> 2480 | L250: =RC1*R2C -> 2480 | M250: =RC1*R2C -> 2480
A251: 249 | B251: =RC1*R2C -> 2490 | C251: =RC1*R2C -> 2490 | D251: =RC1*R2C -> 2490 | E251: =RC1*R2C -> 2490 | F251: =RC1*R2C -> 2490 | G251: =RC1*R2C -> 2490 | H251: =RC1*R2C -> 2490 | I251: =RC1*R2C -> 2490 | J251: =RC1*R2C -> 2490 | K251: =RC1*R2C -> 2490 | L251: =RC1*R2C -> 2490 | M251: =RC1*R2C -> 2490
A252: 250 | B252: =RC1*R2C -> 2500 | C252: =RC1*R2C -> 2500 | D252: =RC1*R2C -> 2500 | E252: =RC1*R2C -> 2500 | F252: =RC1*R2C -> 2500 | G252: =RC1*R2C -> 2500 | H252: =RC1*R2C -> 2500 | I252: =RC1*R2C -> 2500 | J252: =RC1*R2C -> 2500 | K252: =RC1*R2C -> 2500 | L252: =RC1*R2C -> 2500 | M252: =RC1*R2C -> 2500
A253: 251 | B253: =RC1*R2C -> 2510 | C253: =RC1*R2C -> 2510 | D253: =RC1*R2C -> 2510 | E253: =RC1*R2C -> 2510 | F253: =RC1*R2C -> 2510 | G253: =RC1*R2C -> 2510 | H253: =RC1*R2C -> 2510 | I253: =RC1*R2C -> 2510 | J253: =RC1*R2C -> 2510 | K253: =RC1*R2C -> 2510 | L253: =RC1*R2C -> 2510 | M253: =RC1*R2C -> 2510
A254: 252 | B254: =RC1*R2C -> 2520 | C254: =RC1*R2C -> 2520 | D254: =RC1*R2C -> 2520 | E254: =RC1*R2C -> 2520 | F254: =RC1*R2C -> 2520 | G254: =RC1*R2C -> 2520 | H254: =RC1*R2C -> 2520 | I254: =RC1*R2C -> 2520 | J254: =RC1*R2C -> 2520 | K254: =RC1*R2C -> 2520 | L254: =RC1*R2C -> 2520 | M254: =RC1*R2C -> 2520
A255: 253 | B255: =RC1*R2C -> 2530 | C255: =RC1*R2C -> 2530 | D255: =RC1*R2C -> 2530 | E255: =RC1*R2C -> 2530 | F255: =RC1*R2C -> 2530 | G255: =RC1*R2C -> 2530 | H255: =RC1*R2C -> 2530 | I255: =RC1*R2C -> 2530 | J255: =RC1*R2C -> 2530 | K255: =RC1*R2C -> 2530 | L255: =RC1*R2C -> 2530 | M255: =RC1*R2C -> 2530
A256: 254 | B256: =RC1*R2C -> 2540 | C256: =RC1*R2C -> 2540 | D256: =RC1*R2C -> 2540 | E256: =RC1*R2C -> 2540 | F256: =RC1*R2C -> 2540 | G256: =RC1*R2C -> 2540 | H256: =RC1*R2C -> 2540 | I256: =RC1*R2C -> 2540 | J256: =RC1*R2C -> 2540 | K256: =RC1*R2C -> 2540 | L256: =RC1*R2C -> 2540 | M256: =RC1*R2C -> 2540
A257: 255 | B257: =RC1*R2C -> 2550 | C257: =RC1*R2C -> 2550 | D257: =RC1*R2C -> 2550 | E257: =RC1*R2C -> 2550 | F257: =RC1*R2C -> 2550 | G257: =RC1*R2C -> 2550 | H257: =RC1*R2C -> 2550 | I257: =RC1*R2C -> 2550 | J257: =RC1*R2C -> 2550 | K257: =RC1*R2C -> 2550 | L257: =RC1*R2C -> 2550 | M257: =RC1*R2C -> 2550
A258: 256 | B258: =RC1*R2C -> 2560 | C258: =RC1*R2C -> 2560 | D258: =RC1*R2C -> 2560 | E258: =RC1*R2C -> 2560 | F258: =RC1*R2C -> 2560 | G258: =RC1*R2C -> 2560 | H258: =RC1*R2C -> 2560 | I258: =RC1*R2C -> 2560 | J258: =RC1*R2C -> 2560 | K258: =RC1*R2C -> 2560 | L258: =RC1*R2C -> 2560 | M258: =RC1*R2C -> 2560
A259: 257 | B259: =RC1*R2C -> 2570 | C259: =RC1*R2C -> 2570 | D259: =RC1*R2C -> 2570 | E259: =RC1*R2C -> 2570 | F259: =RC1*R2C -> 2570 | G259: =RC1*R2C -> 2570 | H259: =RC1*R2C -> 2570 | I259: =RC1*R2C -> 2570 | J259: =RC1*R2C -> 2570 | K259: =RC1*R2C -> 2570 | L259: =RC1*R2C -> 2570 | M259: =RC1*R2C -> 2570
A260: 258 | B260: =RC1*R2C -> 2580 | C260: =RC1*R2C -> 2580 | D260: =RC1*R2C -> 2580 | E260: =RC1*R2C -> 2580 | F260: =RC1*R2C -> 2580 | G260: =RC1*R2C -> 2580 | H260: =RC1*R2C -> 2580 | I260: =RC1*R2C -> 2580 | J260: =RC1*R2C -> 2580 | K260: =RC1*R2C -> 2580 | L260: =RC1*R2C -> 2580 | M260: =RC1*R2C -> 2580
A261: 259 | B261: =RC1*R2C -> 2590 | C261: =RC1*R2C -> 2590 | D261: =RC1*R2C -> 2590 | E261: =RC1*R2C -> 2590 | F261: =RC1*R2C -> 2590 | G261: =RC1*R2C -> 2590 | H261: =RC1*R2C -> 2590 | I261: =RC1*R2C -> 2590 | J261: =RC1*R2C -> 2590 | K261: =RC1*R2C -> 2590 | L261: =RC1*R2C -> 2590 | M261: =RC1*R2C -> 2590
A262: 260 | B262: =RC1*R2C -> 2600 | C262: =RC1*R2C -> 2600 | D262: =RC1*R2C -> 2600 | E262: =RC1*R2C -> 2600 | F262: =RC1*R2C -> 2600 | G262: =RC1*R2C -> 2600 | H262: =RC1*R2C -> 2600 | I262: =RC1*R2C -> 2600 | J262: =RC1*R2C -> 2600 | K262: =RC1*R2C -> 2600 | L262: =RC1*R2C -> 2600 | M262: =RC1*R2C -> 2600
A263: 261 | B263: =RC1*R2C -> 2610 | C263: =RC1*R2C -> 2610 | D263: =RC1*R2C -> 2610 | E263: =RC1*R2C -> 2610 | F263: =RC1*R2C -> 2610 | G263: =RC1*R2C -> 2610 | H263: =RC1*R2C -> 2610 | I263: =RC1*R2C -> 2610 | J263: =RC1*R2C -> 2610 | K263: =RC1*R2C -> 2610 | L263: =RC1*R2C -> 2610 | M263: =RC1*R2C -> 2610
A264: 262 | B264: =RC1*R2C -> 2620 | C264: =RC1*R2C -> 2620 | D264: =RC1*R2C -> 2620 | E264: =RC1*R2C -> 2620 | F264: =RC1*R2C -> 2620 | G264: =RC1*R2C -> 2620 | H264: =RC1*R2C -> 2620 | I264: =RC1*R2C -> 2620 | J264: =RC1*R2C -> 2620 | K264: =RC1*R2C -> 2620 | L264: =RC1*R2C -> 2620 | M264: =RC1*R2C -> 2620
A265: 263 | B265: =RC1*R2C -> 2630 | C265: =RC1*R2C -> 2630 | D265: =RC1*R2C -> 2630 | E265: =RC1*R2C -> 2630 | F265: =RC1*R2C -> 2630 | G265: =RC1*R2C -> 2630 | H265: =RC1*R2C -> 2630 | I265: =RC1*R2C -> 2630 | J265: =RC1*R2C -> 2630 | K265: =RC1*R2C -> 2630 | L265: =RC1*R2C -> 2630 | M265: =RC1*R2C -> 2630
A266: 264 | B266: =RC1*R2C -> 2640 | C266: =RC1*R2C -> 2640 | D266: =RC1*R2C -> 2640 | E266: =RC1*R2C -> 2640 | F266: =RC1*R2C -> 2640 | G266: =RC1*R2C -> 2640 | H266: =RC1*R2C -> 2640 | I266: =RC1*R2C -> 2640 | J266: =RC1*R2C -> 2640 | K266: =RC1*R2C -> 2640 | L266: =RC1*R2C -> 2640 | M266: =RC1*R2C -> 2640
A267: 265 | B267: =RC1*R2C -> 2650 | C267: =RC1*R2C -> 2650 | D267: =RC1*R2C -> 2650 | E267: =RC1*R2C -> 2650 | F267: =RC1*R2C -> 2650 | G267: =RC1*R2C -> 2650 | H267: =RC1*R2C -> 2650 | I267: =RC1*R2C -> 2650 | J267: =RC1*R2C -> 2650 | K267: =RC1*R2C -> 2650 | L267: =RC1*R2C -> 2650 | M267: =RC1*R2C -> 2650
A268: 266 | B268: =RC1*R2C -> 2660 | C268: =RC1*R2C -> 2660 | D268: =RC1*R2C -> 2660 | E268: =RC1*R2C -> 2660 | F268: =RC1*R2C -> 2660 | G268: =RC1*R2C -> 2660 | H268: =RC1*R2C -> 2660 | I268: =RC1*R2C -> 2660 | J268: =RC1*R2C -> 2660 | K268: =RC1*R2C -> 2660 | L268: =RC1*R2C -> 2660 | M268: =RC1*R2C -> 2660
A269: 267 | B269: =RC1*R2C -> 2670 | C269: =RC1*R2C -> 2670 | D269: =RC1*R2C -> 2670 | E269: =RC1*R2C -> 2670 | F269: =RC1*R2C -> 2670 | G269: =RC1*R2C -> 2670 | H269: =RC1*R2C -> 2670 | I269: =RC1*R2C -> 2670 | J269: =RC1*R2C -> 2670 | K269: =RC1*R2C -> 2670 | L269: =RC1*R2C -> 2670 | M269: =RC1*R2C -> 2670
A270: 268 | B270: =RC1*R2C -> 2680 | C270: =RC1*R2C -> 2680 | D270: =RC1*R2C -> 2680 | E270: =RC1*R2C -> 2680 | F270: =RC1*R2C -> 2680 | G270: =RC1*R2C -> 2680 | H270: =RC1*R2C -> 2680 | I270: =RC1*R2C -> 2680 | J270: =RC1*R2C -> 2680 | K270: =RC1*R2C -> 2680 | L270: =RC1*R2C -> 2680 | M270: =RC1*R2C -> 2680
A271: 269 | B271: =RC1*R2C -> 2690 | C271: =RC1*R2C -> 2690 | D271: =RC1*R2C -> 2690 | E271: =RC1*R2C -> 2690 | F271: =RC1*R2C -> 2690 | G271: =RC1*R2C -> 2690 | H271: =RC1*R2C -> 2690 | I271: =RC1*R2C -> 2690 | J271: =RC1*R2C -> 2690 | K271: =RC1*R2C -> 2690 | L271: =RC1*R2C -> 2690 | M271: =RC1*R2C -> 2690
A272: 270 | B272: =RC1*R2C -> 2700 | C272: =RC1*R2C -> 2700 | D272: =RC1*R2C -> 2700 | E272: =RC1*R2C -> 2700 | F272: =RC1*R2C -> 2700 | G272: =RC1*R2C -> 2700 | H272: =RC1*R2C -> 2700 | I272: =RC1*R2C -> 2700 | J272: =RC1*R2C -> 2700 | K272: =RC1*R2C -> 2700 | L272: =RC1*R2C -> 2700 | M272: =RC1*R2C -> 2700
A273: 271 | B273: =RC1*R2C -> 2710 | C273: =RC1*R2C -> 2710 | D273: =RC1*R2C -> 2710 | E273: =RC1*R2C -> 2710 | F273: =RC1*R2C -> 2710 | G273: =RC1*R2C -> 2710 | H273: =RC1*R2C -> 2710 | I273: =RC1*R2C -> 2710 | J273: =RC1*R2C -> 2710 | K273: =RC1*R2C -> 2710 | L273: =RC1*R2C -> 2710 | M273: =RC1*R2C -> 2710
A274: 272 | B274: =RC1*R2C -> 2720 | C274: =RC1*R2C -> 2720 | D274: =RC1*R2C -> 2720 | E274: =RC1*R2C -> 2720 | F274: =RC1*R2C -> 2720 | G274: =RC1*R2C -> 2720 | H274: =RC1*R2C -> 2720 | I274: =RC1*R2C -> 2720 | J274: =RC1*R2C -> 2720 | K274: =RC1*R2C -> 2720 | L274: =RC1*R2C -> 2720 | M274: =RC1*R2C -> 2720
A275: 273 | B275: =RC1*R2C -> 2730 | C275: =RC1*R2C -> 2730 | D275: =RC1*R2C -> 2730 | E275: =RC1*R2C -> 2730 | F275: =RC1*R2C -> 2730 | G275: =RC1*R2C -> 2730 | H275: =RC1*R2C -> 2730 | I275: =RC1*R2C -> 2730 | J275: =RC1*R2C -> 2730 | K275: =RC1*R2C -> 2730 | L275: =RC1*R2C -> 2730 | M275: =RC1*R2C -> 2730
A276: 274 | B276: =RC1*R2C -> 2740 | C276: =RC1*R2C -> 2740 | D276: =RC1*R2C -> 2740 | E276: =RC1*R2C -> 2740 | F276: =RC1*R2C -> 2740 | G276: =RC1*R2C -> 2740 | H276: =RC1*R2C -> 2740 | I276: =RC1*R2C -> 2740 | J276: =RC1*R2C -> 2740 | K276: =RC1*R2C -> 2740 | L276: =RC1*R2C -> 2740 | M276: =RC1*R2C -> 2740
A277: 275 | B277: =RC1*R2C -> 2750 | C277: =RC1*R2C -> 2750 | D277: =RC1*R2C -> 2750 | E277: =RC1*R2C -> 2750 | F277: =RC1*R2C -> 2750 | G277: =RC1*R2C -> 2750 | H277: =RC1*R2C -> 2750 | I277: =RC1*R2C -> 2750 | J277: =RC1*R2C -> 2750 | K277: =RC1*R2C -> 2750 | L277: =RC1*R2C -> 2750 | M277: =RC1*R2C -> 2750
A278: 276 | B278: =RC1*R2C -> 2760 | C278: =RC1*R2C -> 2760 | D278: =RC1*R2C -> 2760 | E278: =RC1*R2C -> 2760 | F278: =RC1*R2C -> 2760 | G278: =RC1*R2C -> 2760 | H278: =RC1*R2C -> 2760 | I278: =RC1*R2C -> 2760 | J278: =RC1*R2C -> 2760 | K278: =RC1*R2C -> 2760 | L278: =RC1*R2C -> 2760 | M278: =RC1*R2C -> 2760
A279: 277 | B279: =RC1*R2C -> 2770 | C279: =RC1*R2C -> 2770 | D279: =RC1*R2C -> 2770 | E279: =RC1*R2C -> 2770 | F279: =RC1*R2C -> 2770 | G279: =RC1*R2C -> 2770 | H279: =RC1*R2C -> 2770 | I279: =RC1*R2C -> 2770 | J279: =RC1*R2C -> 2770 | K279: =RC1*R2C -> 2770 | L279: =RC1*R2C -> 2770 | M279: =RC1*R2C -> 2770
A280: 278 | B280: =RC1*R2C -> 2780 | C280: =RC1*R2C -> 2780 | D280: =RC1*R2C -> 2780 | E280: =RC1*R2C -> 2780 | F280: =RC1*R2C -> 2780 | G280: =RC1*R2C -> 2780 | H280: =RC1*R2C -> 2780 | I280: =RC1*R2C -> 2780 | J280: =RC1*R2C -> 2780 | K280: =RC1*R2C -> 2780 | L280: =RC1*R2C -> 2780 | M280: =RC1*R2C -> 2780
A281: 279 | B281: =RC1*R2C -> 2790 | C281: =RC1*R2C -> 2790 | D281: =RC1*R2C -> 2790 | E281: =RC1*R2C -> 2790 | F281: =RC1*R2C -> 2790 | G281: =RC1*R2C -> 2790 | H281: =RC1*R2C -> 2790 | I281: =RC1*R2C -> 2790 | J281: =RC1*R2C -> 2790 | K281: =RC1*R2C -> 2790 | L281: =RC1*R2C -> 2790 | M281: =RC1*R2C -> 2790
A282: 280 | B282: =RC1*R2C -> 2800 | C282: =RC1*R2C -> 2800 | D282: =RC1*R2C -> 2800 | E282: =RC1*R2C -> 2800 | F282: =RC1*R2C -> 2800 | G282: =RC1*R2C -> 2800 | H282: =RC1*R2C -> 2800 | I282: =RC1*R2C -> 2800 | J282: =RC1*R2C -> 2800 | K282: =RC1*R2C -> 2800 | L282: =RC1*R2C -> 2800 | M282: =RC1*R2C -> 2800
A283: 281 | B283: =RC1*R2C -> 2810 | C283: =RC1*R2C -> 2810 | D283: =RC1*R2C -> 2810 | E283: =RC1*R2C -> 2810 | F283: =RC1*R2C -> 2810 | G283: =RC1*R2C -> 2810 | H283: =RC1*R2C -> 2810 | I283: =RC1*R2C -> 2810 | J283: =RC1*R2C -> 2810 | K283: =RC1*R2C -> 2810 | L283: =RC1*R2C -> 2810 | M283: =RC1*R2C -> 2810
A284: 282 | B284: =RC1*R2C -> 2820 | C284: =RC1*R2C -> 2820 | D284: =RC1*R2C -> 2820 | E284: =RC1*R2C -> 2820 | F284: =RC1*R2C -> 2820 | G284: =RC1*R2C -> 2820 | H284: =RC1*R2C -> 2820 | I284: =RC1*R2C -> 2820 | J284: =RC1*R2C -> 2820 | K284: =RC1*R2C -> 2820 | L284: =RC1*R2C -> 2820 | M284: =RC1*R2C -> 2820
A285: 283 | B285: =RC1*R2C -> 2830 | C285: =RC1*R2C -> 2830 | D285: =RC1*R2C -> 2830 | E285: =RC1*R2C -> 2830 | F285: =RC1*R2C -> 2830 | G285: =RC1*R2C -> 2830 | H285: =RC1*R2C -> 2830 | I285: =RC1*R2C -> 2830 | J285: =RC1*R2C -> 2830 | K285: =RC1*R2C -> 2830 | L285: =RC1*R2C -> 2830 | M285: =RC1*R2C -> 2830
A286: 284 | B286: =RC1*R2C -> 2840 | C286: =RC1*R2C -> 2840 | D286: =RC1*R2C -> 2840 | E286: =RC1*R2C -> 2840 | F286: =RC1*R2C -> 2840 | G286: =RC1*R2C -> 2840 | H286: =RC1*R2C -> 2840 | I286: =RC1*R2C -> 2840 | J286: =RC1*R2C -> 2840 | K286: =RC1*R2C -> 2840 | L286: =RC1*R2C -> 2840 | M286: =RC1*R2C -> 2840
A287: 285 | B287: =RC1*R2C -> 2850 | C287: =RC1*R2C -> 2850 | D287: =RC1*R2C -> 2850 | E287: =RC1*R2C -> 2850 | F287: =RC1*R2C -> 2850 | G287: =RC1*R2C -> 2850 | H287: =RC1*R2C -> 2850 | I287: =RC1*R2C -> 2850 | J287: =RC1*R2C -> 2850 | K287: =RC1*R2C -> 2850 | L287: =RC1*R2C -> 2850 | M287: =RC1*R2C -> 2850
A288: 286 | B288: =RC1*R2C -> 2860 | C288: =RC1*R2C -> 2860 | D288: =RC1*R2C -> 2860 | E288: =RC1*R2C -> 2860 | F288: =RC1*R2C -> 2860 | G288: =RC1*R2C -> 2860 | H288: =RC1*R2C -> 2860 | I288: =RC1*R2C -> 2860 | J288: =RC1*R2C -> 2860 | K288: =RC1*R2C -> 2860 | L288: =RC1*R2C -> 2860 | M288: =RC1*R2C -> 2860
A289: 287 | B289: =RC1*R2C -> 2870 | C289: =RC1*R2C -> 2870 | D289: =RC1*R2C -> 2870 | E289: =RC1*R2C -> 2870 | F289: =RC1*R2C -> 2870 | G289: =RC1*R2C -> 2870 | H289: =RC1*R2C -> 2870 | I289: =RC1*R2C -> 2870 | J289: =RC1*R2C -> 2870 | K289: =RC1*R2C -> 2870 | L289: =RC1*R2C -> 2870 | M289: =RC1*R2C -> 2870
A290: 288 | B290: =RC1*R2C -> 2880 | C290: =RC1*R2C -> 2880 | D290: =RC1*R2C -> 2880 | E290: =RC1*R2C -> 2880 | F290: =RC1*R2C -> 2880 | G290: =RC1*R2C -> 2880 | H290: =RC1*R2C -> 2880 | I290: =RC1*R2C -> 2880 | J290: =RC1*R2C -> 2880 | K290: =RC1*R2C -> 2880 | L290: =RC1*R2C -> 2880 | M290: =RC1*R2C -> 2880
A291: 289 | B291: =RC1*R2C -> 2890 | C291: =RC1*R2C -> 2890 | D291: =RC1*R2C -> 2890 | E291: =RC1*R2C -> 2890 | F291: =RC1*R2C -> 2890 | G291: =RC1*R2C -> 2890 | H291: =RC1*R2C -> 2890 | I291: =RC1*R2C -> 2890 | J291: =RC1*R2C -> 2890 | K291: =RC1*R2C -> 2890 | L291: =RC1*R2C -> 2890 | M291: =RC1*R2C -> 2890
A292: 290 | B292: =RC1*R2C -> 2900 | C292: =RC1*R2C -> 2900 | D292: =RC1*R2C -> 2900 | E292: =RC1*R2C -> 2900 | F292: =RC1*R2C -> 2900 | G292: =RC1*R2C -> 2900 | H292: =RC1*R2C -> 2900 | I292: =RC1*R2C -> 2900 | J292: =RC1*R2C -> 2900 | K292: =RC1*R2C -> 2900 | L292: =RC1*R2C -> 2900 | M292: =RC1*R2C -> 2900
A293: 291 | B293: =RC1*R2C -> 2910 | C293: =RC1*R2C -> 2910 | D293: =RC1*R2C -> 2910 | E293: =RC1*R2C -> 2910 | F293: =RC1*R2C -> 2910 | G293: =RC1*R2C -> 2910 | H293: =RC1*R2C -> 2910 | I293: =RC1*R2C -> 2910 | J293: =RC1*R2C -> 2910 | K293: =RC1*R2C -> 2910 | L293: =RC1*R2C -> 2910 | M293: =RC1*R2C -> 2910
A294: 292 | B294: =RC1*R2C -> 2920 | C294: =RC1*R2C -> 2920 | D294: =RC1*R2C -> 2920 | E294: =RC1*R2C -> 2920 | F294: =RC1*R2C -> 2920 | G294: =RC1*R2C -> 2920 | H294: =RC1*R2C -> 2920 | I294: =RC1*R2C -> 2920 | J294: =RC1*R2C -> 2920 | K294: =RC1*R2C -> 2920 | L294: =RC1*R2C -> 2920 | M294: =RC1*R2C -> 2920
A295: 293 | B295: =RC1*R2C -> 2930 | C295: =RC1*R2C -> 2930 | D295: =RC1*R2C -> 2930 | E295: =RC1*R2C -> 2930 | F295: =RC1*R2C -> 2930 | G295: =RC1*R2C -> 2930 | H295: =RC1*R2C -> 2930 | I295: =RC1*R2C -> 2930 | J295: =RC1*R2C -> 2930 | K295: =RC1*R2C -> 2930 | L295: =RC1*R2C -> 2930 | M295: =RC1*R2C -> 2930
A296: 294 | B296: =RC1*R2C -> 2940 | C296: =RC1*R2C -> 2940 | D296: =RC1*R2C -> 2940 | E296: =RC1*R2C -> 2940 | F296: =RC1*R2C -> 2940 | G296: =RC1*R2C -> 2940 | H296: =RC1*R2C -> 2940 | I296: =RC1*R2C -> 2940 | J296: =RC1*R2C -> 2940 | K296: =RC1*R2C -> 2940 | L296: =RC1*R2C -> 2940 | M296: =RC1*R2C -> 2940
A297: 295 | B297: =RC1*R2C -> 2950 | C297: =RC1*R2C -> 2950 | D297: =RC1*R2C -> 2950 | E297: =RC1*R2C -> 2950 | F297: =RC1*R2C -> 2950 | G297: =RC1*R2C -> 2950 | H297: =RC1*R2C -> 2950 | I297: =RC1*R2C -> 2950 | J297: =RC1*R2C -> 2950 | K297: =RC1*R2C -> 2950 | L297: =RC1*R2C -> 2950 | M297: =RC1*R2C -> 2950
A298: 296 | B298: =RC1*R2C -> 2960 | C298: =RC1*R2C -> 2960 | D298: =RC1*R2C -> 2960 | E298: =RC1*R2C -> 2960 | F298: =RC1*R2C -> 2960 | G298: =RC1*R2C -> 2960 | H298: =RC1*R2C -> 2960 | I298: =RC1*R2C -> 2960 | J298: =RC1*R2C -> 2960 | K298: =RC1*R2C -> 2960 | L298: =RC1*R2C -> 2960 | M298: =RC1*R2C -> 2960
A299: 297 | B299: =RC1*R2C -> 2970 | C299: =RC1*R2C -> 2970 | D299: =RC1*R2C -> 2970 | E299: =RC1*R2C -> 2970 | F299: =RC1*R2C -> 2970 | G299: =RC1*R2C -> 2970 | H299: =RC1*R2C -> 2970 | I299: =RC1*R2C -> 2970 | J299: =RC1*R2C -> 2970 | K299: =RC1*R2C -> 2970 | L299: =RC1*R2C -> 2970 | M299: =RC1*R2C -> 2970
A300: 298 | B300: =RC1*R2C -> 2980 | C300: =RC1*R2C -> 2980 | D300: =RC1*R2C -> 2980 | E300: =RC1*R2C -> 2980 | F300: =RC1*R2C -> 2980 | G300: =RC1*R2C -> 2980 | H300: =RC1*R2C -> 2980 | I300: =RC1*R2C -> 2980 | J300: =RC1*R2C -> 2980 | K300: =RC1*R2C -> 2980 | L300: =RC1*R2C -> 2980 | M300: =RC1*R2C -> 2980
A301: 299 | B301: =RC1*R2C -> 2990 | C301: =RC1*R2C -> 2990 | D301: =RC1*R2C -> 2990 | E301: =RC1*R2C -> 2990 | F301: =RC1*R2C -> 2990 | G301: =RC1*R2C -> 2990 | H301: =RC1*R2C -> 2990 | I301: =RC1*R2C -> 2990 | J301: =RC1*R2C -> 2990 | K301: =RC1*R2C -> 2990 | L301: =RC1*R2C -> 2990 | M301: =RC1*R2C -> 2990
A302: 300 | B302: =RC1*R2C -> 3000 | C302: =RC1*R2C -> 3000 | D302: =RC1*R2C -> 3000 | E302: =RC1*R2C -> 3000 | F302: =RC1*R2C -> 3000 | G302: =RC1*R2C -> 3000 | H302: =RC1*R2C -> 3000 | I302: =RC1*R2C -> 3000 | J302: =RC1*R2C -> 3000 | K302: =RC1*R2C -> 3000 | L302: =RC1*R2C -> 3000 | M302: =RC1*R2C -> 3000
A303: 301 | B303: =RC1*R2C -> 3010 | C303: =RC1*R2C -> 3010 | D303: =RC1*R2C -> 3010 | E303: =RC1*R2C -> 3010 | F303: =RC1*R2C -> 3010 | G303: =RC1*R2C -> 3010 | H303: =RC1*R2C -> 3010 | I303: =RC1*R2C -> 3010 | J303: =RC1*R2C -> 3010 | K303: =RC1*R2C -> 3010 | L303: =RC1*R2C -> 3010 | M303: =RC1*R2C -> 3010
A304: 302 | B304: =RC1*R2C -> 3020 | C304: =RC1*R2C -> 3020 | D304: =RC1*R2C -> 3020 | E304: =RC1*R2C -> 3020 | F304: =RC1*R2C -> 3020 | G304: =RC1*R2C -> 3020 | H304: =RC1*R2C -> 3020 | I304: =RC1*R2C -> 3020 | J304: =RC1*R2C -> 3020 | K304: =RC1*R2C -> 3020 | L304: =RC1*R2C -> 3020 | M304: =RC1*R2C -> 3020
A305: 303 | B305: =RC1*R2C -> 3030 | C305: =RC1*R2C -> 3030 | D305: =RC1*R2C -> 3030 | E305: =RC1*R2C -> 3030 | F305: =RC1*R2C -> 3030 | G305: =RC1*R2C -> 3030 | H305: =RC1*R2C -> 3030 | I305: =RC1*R2C -> 3030 | J305: =RC1*R2C -> 3030 | K305: =RC1*R2C -> 3030 | L305: =RC1*R2C -> 3030 | M305: =RC1*R2C -> 3030
A306: 304 | B306: =RC1*R2C -> 3040 | C306: =RC1*R2C -> 3040 | D306: =RC1*R2C -> 3040 | E306: =RC1*R2C -> 3040 | F306: =RC1*R2C -> 3040 | G306: =RC1*R2C -> 3040 | H306: =RC1*R2C -> 3040 | I306: =RC1*R2C -> 3040 | J306: =RC1*R2C -> 3040 | K306: =RC1*R2C -> 3040 | L306: =RC1*R2C -> 3040 | M306: =RC1*R2C -> 3040
A307: 305 | B307: =RC1*R2C -> 3050 | C307: =RC1*R2C -> 3050 | D307: =RC1*R2C -> 3050 | E307: =RC1*R2C -> 3050 | F307: =RC1*R2C -> 3050 | G307: =RC1*R2C -> 3050 | H307: =RC1*R2C -> 3050 | I307: =RC1*R2C -> 3050 | J307: =RC1*R2C -> 3050 | K307: =RC1*R2C -> 3050 | L307: =RC1*R2C -> 3050 | M307: =RC1*R2C -> 3050
A308: 306 | B308: =RC1*R2C -> 3060 | C308: =RC1*R2C -> 3060 | D308: =RC1*R2C -> 3060 | E308: =RC1*R2C -> 3060 | F308: =RC1*R2C -> 3060 | G308: =RC1*R2C -> 3060 | H308: =RC1*R2C -> 3060 | I308: =RC1*R2C -> 3060 | J308: =RC1*R2C -> 3060 | K308: =RC1*R2C -> 3060 | L308: =RC1*R2C -> 3060 | M308: =RC1*R2C -> 3060
A309: 307 | B309: =RC1*R2C -> 3070 | C309: =RC1*R2C -> 3070 | D309: =RC1*R2C -> 3070 | E309: =RC1*R2C -> 3070 | F309: =RC1*R2C -> 3070 | G309: =RC1*R2C -> 3070 | H309: =RC1*R2C -> 3070 | I309: =RC1*R2C -> 3070 | J309: =RC1*R2C -> 3070 | K309: =RC1*R2C -> 3070 | L309: =RC1*R2C -> 3070 | M309: =RC1*R2C -> 3070
A310: 308 | B310: =RC1*R2C -> 3080 | C310: =RC1*R2C -> 3080 | D310: =RC1*R2C -> 3080 | E310: =RC1*R2C -> 3080 | F310: =RC1*R2C -> 3080 | G310: =RC1*R2C -> 3080 | H310: =RC1*R2C -> 3080 | I310: =RC1*R2C -> 3080 | J310: =RC1*R2C -> 3080 | K310: =RC1*R2C -> 3080 | L310: =RC1*R2C -> 3080 | M310: =RC1*R2C -> 3080
A311: 309 | B311: =RC1*R2C -> 3090 | C311: =RC1*R2C -> 3090 | D311: =RC1*R2C -> 3090 | E311: =RC1*R2C -> 3090 | F311: =RC1*R2C -> 3090 | G311: =RC1*R2C -> 3090 | H311: =RC1*R2C -> 3090 | I311: =RC1*R2C -> 3090 | J311: =RC1*R2C -> 3090 | K311: =RC1*R2C -> 3090 | L311: =RC1*R2C -> 3090 | M311: =RC1*R2C -> 3090
A312: 310 | B312: =RC1*R2C -> 3100 | C312: =RC1*R2C -> 3100 | D312: =RC1*R2C -> 3100 | E312: =RC1*R2C -> 3100 | F312: =RC1*R2C -> 3100 | G312: =RC1*R2C -> 3100 | H312: =RC1*R2C -> 3100 | I312: =RC1*R2C -> 3100 | J312: =RC1*R2C -> 3100 | K312: =RC1*R2C -> 3100 | L312: =RC1*R2C -> 3100 | M312: =RC1*R2C -> 3100
A313: 311 | B313: =RC1*R2C -> 3110 | C313: =RC1*R2C -> 3110 | D313: =RC1*R2C -> 3110 | E313: =RC1*R2C -> 3110 | F313: =RC1*R2C -> 3110 | G313: =RC1*R2C -> 3110 | H313: =RC1*R2C -> 3110 | I313: =RC1*R2C -> 3110 | J313: =RC1*R2C -> 3110 | K313: =RC1*R2C -> 3110 | L313: =RC1*R2C -> 3110 | M313: =RC1*R2C -> 3110
A314: 312 | B314: =RC1*R2C -> 3120 | C314: =RC1*R2C -> 3120 | D314: =RC1*R2C -> 3120 | E314: =RC1*R2C -> 3120 | F314: =RC1*R2C -> 3120 | G314: =RC1*R2C -> 3120 | H314: =RC1*R2C -> 3120 | I314: =RC1*R2C -> 3120 | J314: =RC1*R2C -> 3120 | K314: =RC1*R2C -> 3120 | L314: =RC1*R2C -> 3120 | M314: =RC1*R2C -> 3120
A315: 313 | B315: =RC1*R2C -> 3130 | C315: =RC1*R2C -> 3130 | D315: =RC1*R2C -> 3130 | E315: =RC1*R2C -> 3130 | F315: =RC1*R2C -> 3130 | G315: =RC1*R2C -> 3130 | H315: =RC1*R2C -> 3130 | I315: =RC1*R2C -> 3130 | J315: =RC1*R2C -> 3130 | K315: =RC1*R2C -> 3130 | L315: =RC1*R2C -> 3130 | M315: =RC1*R2C -> 3130
A316: 314 | B316: =RC1*R2C -> 3140 | C316: =RC1*R2C -> 3140 | D316: =RC1*R2C -> 3140 | E316: =RC1*R2C -> 3140 | F316: =RC1*R2C -> 3140 | G316: =RC1*R2C -> 3140 | H316: =RC1*R2C -> 3140 | I316: =RC1*R2C -> 3140 | J316: =RC1*R2C -> 3140 | K316: =RC1*R2C -> 3140 | L316: =RC1*R2C -> 3140 | M316: =RC1*R2C -> 3140
A317: 315 | B317: =RC1*R2C -> 3150 | C317: =RC1*R2C -> 3150 | D317: =RC1*R2C -> 3150 | E317: =RC1*R2C -> 3150 | F317: =RC1*R2C -> 3150 | G317: =RC1*R2C -> 3150 | H317: =RC1*R2C -> 3150 | I317: =RC1*R2C -> 3150 | J317: =RC1*R2C -> 3150 | K317: =RC1*R2C -> 3150 | L317: =RC1*R2C -> 3150 | M317: =RC1*R2C -> 3150
A318: 316 | B318: =RC1*R2C -> 3160 | C318: =RC1*R2C -> 3160 | D318: =RC1*R2C -> 3160 | E318: =RC1*R2C -> 3160 | F318: =RC1*R2C -> 3160 | G318: =RC1*R2C -> 3160 | H318: =RC1*R2C -> 3160 | I318: =RC1*R2C -> 3160 | J318: =RC1*R2C -> 3160 | K318: =RC1*R2C -> 3160 | L318: =RC1*R2C -> 3160 | M318: =RC1*R2C -> 3160
A319: 317 | B319: =RC1*R2C -> 3170 | C319: =RC1*R2C -> 3170 | D319: =RC1*R2C -> 3170 | E319: =RC1*R2C -> 3170 | F319: =RC1*R2C -> 3170 | G319: =RC1*R2C -> 3170 | H319: =RC1*R2C -> 3170 | I319: =RC1*R2C -> 3170 | J319: =RC1*R2C -> 3170 | K319: =RC1*R2C -> 3170 | L319: =RC1*R2C -> 3170 | M319: =RC1*R2C -> 3170
A320: 318 | B320: =RC1*R2C -> 3180 | C320: =RC1*R2C -> 3180 | D320: =RC1*R2C -> 3180 | E320: =RC1*R2C -> 3180 | F320: =RC1*R2C -> 3180 | G320: =RC1*R2C -> 3180 | H320: =RC1*R2C -> 3180 | I320: =RC1*R2C -> 3180 | J320: =RC1*R2C -> 3180 | K320: =RC1*R2C -> 3180 | L320: =RC1*R2C -> 3180 | M320: =RC1*R2C -> 3180
A321: 319 | B321: =RC1*R2C -> 3190 | C321: =RC1*R2C -> 3190 | D321: =RC1*R2C -> 3190 | E321: =RC1*R2C -> 3190 | F321: =RC1*R2C -> 3190 | G321: =RC1*R2C -> 3190 | H321: =RC1*R2C -> 3190 | I321: =RC1*R2C -> 3190 | J321: =RC1*R2C -> 3190 | K321: =RC1*R2C -> 3190 | L321: =RC1*R2C -> 3190 | M321: =RC1*R2C -> 3190
A322: 320 | B322: =RC1*R2C -> 3200 | C322: =RC1*R2C -> 3200 | D322: =RC1*R2C -> 3200 | E322: =RC1*R2C -> 3200 | F322: =RC1*R2C -> 3200 | G322: =RC1*R2C -> 3200 | H322: =RC1*R2C -> 3200 | I322: =RC1*R2C -> 3200 | J322: =RC1*R2C -> 3200 | K322: =RC1*R2C -> 3200 | L322: =RC1*R2C -> 3200 | M322: =RC1*R2C -> 3200
A323: 321 | B323: =RC1*R2C -> 3210 | C323: =RC1*R2C -> 3210 | D323: =RC1*R2C -> 3210 | E323: =RC1*R2C -> 3210 | F323: =RC1*R2C -> 3210 | G323: =RC1*R2C -> 3210 | H323: =RC1*R2C -> 3210 | I323: =RC1*R2C -> 3210 | J323: =RC1*R2C -> 3210 | K323: =RC1*R2C -> 3210 | L323: =RC1*R2C -> 3210 | M323: =RC1*R2C -> 3210
A324: 322 | B324: =RC1*R2C -> 3220 | C324: =RC1*R2C -> 3220 | D324: =RC1*R2C -> 3220 | E324: =RC1*R2C -> 3220 | F324: =RC1*R2C -> 3220 | G324: =RC1*R2C -> 3220 | H324: =RC1*R2C -> 3220 | I324: =RC1*R2C -> 3220 | J324: =RC1*R2C -> 3220 | K324: =RC1*R2C -> 3220 | L324: =RC1*R2C -> 3220 | M324: =RC1*R2C -> 3220
A325: 323 | B325: =RC1*R2C -> 3230 | C325: =RC1*R2C -> 3230 | D325: =RC1*R2C -> 3230 | E325: =RC1*R2C -> 3230 | F325: =RC1*R2C -> 3230 | G325: =RC1*R2C -> 3230 | H325: =RC1*R2C -> 3230 | I325: =RC1*R2C -> 3230 | J325: =RC1*R2C -> 3230 | K325: =RC1*R2C -> 3230 | L325: =RC1*R2C -> 3230 | M325: =RC1*R2C -> 3230
A326: 324 | B326: =RC1*R2C -> 3240 | C326: =RC1*R2C -> 3240 | D326: =RC1*R2C -> 3240 | E326: =RC1*R2C -> 3240 | F326: =RC1*R2C -> 3240 | G326: =RC1*R2C -> 3240 | H326: =RC1*R2C -> 3240 | I326: =RC1*R2C -> 3240 | J326: =RC1*R2C -> 3240 | K326: =RC1*R2C -> 3240 | L326: =RC1*R2C -> 3240 | M326: =RC1*R2C -> 3240
A327: 325 | B327: =RC1*R2C -> 3250 | C327: =RC1*R2C -> 3250 | D327: =RC1*R2C -> 3250 | E327: =RC1*R2C -> 3250 | F327: =RC1*R2C -> 3250 | G327: =RC1*R2C -> 3250 | H327: =RC1*R2C -> 3250 | I327: =RC1*R2C -> 3250 | J327: =RC1*R2C -> 3250 | K327: =RC1*R2C -> 3250 | L327: =RC1*R2C -> 3250 | M327: =RC1*R2C -> 3250
A328: 326 | B328: =RC1*R2C -> 3260 | C328: =RC1*R2C -> 3260 | D328: =RC1*R2C -> 3260 | E328: =RC1*R2C -> 3260 | F328: =RC1*R2C -> 3260 | G328: =RC1*R2C -> 3260 | H328: =RC1*R2C -> 3260 | I328: =RC1*R2C -> 3260 | J328: =RC1*R2C -> 3260 | K328: =RC1*R2C -> 3260 | L328: =RC1*R2C -> 3260 | M328: =RC1*R2C -> 3260
A329: 327 | B329: =RC1*R2C -> 3270 | C329: =RC1*R2C -> 3270 | D329: =RC1*R2C -> 3270 | E329: =RC1*R2C -> 3270 | F329: =RC1*R2C -> 3270 | G329: =RC1*R2C -> 3270 | H329: =RC1*R2C -> 3270 | I329: =RC1*R2C -> 3270 | J329: =RC1*R2C -> 3270 | K329: =RC1*R2C -> 3270 | L329: =RC1*R2C -> 3270 | M329: =RC1*R2C -> 3270
A330: 328 | B330: =RC1*R2C -> 3280 | C330: =RC1*R2C -> 3280 | D330: =RC1*R2C -> 3280 | E330: =RC1*R2C -> 3280 | F330: =RC1*R2C -> 3280 | G330: =RC1*R2C -> 3280 | H330: =RC1*R2C -> 3280 | I330: =RC1*R2C -> 3280 | J330: =RC1*R2C -> 3280 | K330: =RC1*R2C -> 3280 | L330: =RC1*R2C -> 3280 | M330: =RC1*R2C -> 3280
A331: 329 | B331: =RC1*R2C -> 3290 | C331: =RC1*R2C -> 3290 | D331: =RC1*R2C -> 3290 | E331: =RC1*R2C -> 3290 | F331: =RC1*R2C -> 3290 | G331: =RC1*R2C -> 3290 | H331: =RC1*R2C -> 3290 | I331: =RC1*R2C -> 3290 | J331: =RC1*R2C -> 3290 | K331: =RC1*R2C -> 3290 | L331: =RC1*R2C -> 3290 | M331: =RC1*R2C -> 3290
A332: 330 | B332: =RC1*R2C -> 3300 | C332: =RC1*R2C -> 3300 | D332: =RC1*R2C -> 3300 | E332: =RC1*R2C -> 3300 | F332: =RC1*R2C -> 3300 | G332: =RC1*R2C -> 3300 | H332: =RC1*R2C -> 3300 | I332: =RC1*R2C -> 3300 | J332: =RC1*R2C -> 3300 | K332: =RC1*R2C -> 3300 | L332: =RC1*R2C -> 3300 | M332: =RC1*R2C -> 3300
A333: 331 | B333: =RC1*R2C -> 3310 | C333: =RC1*R2C -> 3310 | D333: =RC1*R2C -> 3310 | E333: =RC1*R2C -> 3310 | F333: =RC1*R2C -> 3310 | G333: =RC1*R2C -> 3310 | H333: =RC1*R2C -> 3310 | I333: =RC1*R2C -> 3310 | J333: =RC1*R2C -> 3310 | K333: =RC1*R2C -> 3310 | L333: =RC1*R2C -> 3310 | M333: =RC1*R2C -> 3310
A334: 332 | B334: =RC1*R2C -> 3320 | C334: =RC1*R2C -> 3320 | D334: =RC1*R2C -> 3320 | E334: =RC1*R2C -> 3320 | F334: =RC1*R2C -> 3320 | G334: =RC1*R2C -> 3320 | H334: =RC1*R2C -> 3320 | I334: =RC1*R2C -> 3320 | J334: =RC1*R2C -> 3320 | K334: =RC1*R2C -> 3320 | L334: =RC1*R2C -> 3320 | M334: =RC1*R2C -> 3320
A335: 333 | B335: =RC1*R2C -> 3330 | C335: =RC1*R2C -> 3330 | D335: =RC1*R2C -> 3330 | E335: =RC1*R2C -> 3330 | F335: =RC1*R2C -> 3330 | G335: =RC1*R2C -> 3330 | H335: =RC1*R2C -> 3330 | I335: =RC1*R2C -> 3330 | J335: =RC1*R2C -> 3330 | K335: =RC1*R2C -> 3330 | L335: =RC1*R2C -> 3330 | M335: =RC1*R2C -> 3330
A336: 334 | B336: =RC1*R2C -> 3340 | C336: =RC1*R2C -> 3340 | D336: =RC1*R2C -> 3340 | E336: =RC1*R2C -> 3340 | F336: =RC1*R2C -> 3340 | G336: =RC1*R2C -> 3340 | H336: =RC1*R2C -> 3340 | I336: =RC1*R2C -> 3340 | J336: =RC1*R2C -> 3340 | K336: =RC1*R2C -> 3340 | L336: =RC1*R2C -> 3340 | M336: =RC1*R2C -> 3340
A337: 335 | B337: =RC1*R2C -> 3350 | C337: =RC1*R2C -> 3350 | D337: =RC1*R2C -> 3350 | E337: =RC1*R2C -> 3350 | F337: =RC1*R2C -> 3350 | G337: =RC1*R2C -> 3350 | H337: =RC1*R2C -> 3350 | I337: =RC1*R2C -> 3350 | J337: =RC1*R2C -> 3350 | K337: =RC1*R2C -> 3350 | L337: =RC1*R2C -> 3350 | M337: =RC1*R2C -> 3350
A338: 336 | B338: =RC1*R2C -> 3360 | C338: =RC1*R2C -> 3360 | D338: =RC1*R2C -> 3360 | E338: =RC1*R2C -> 3360 | F338: =RC1*R2C -> 3360 | G338: =RC1*R2C -> 3360 | H338: =RC1*R2C -> 3360 | I338: =RC1*R2C -> 3360 | J338: =RC1*R2C -> 3360 | K338: =RC1*R2C -> 3360 | L338: =RC1*R2C -> 3360 | M338: =RC1*R2C -> 3360
A339: 337 | B339: =RC1*R2C -> 3370 | C339: =RC1*R2C -> 3370 | D339: =RC1*R2C -> 3370 | E339: =RC1*R2C -> 3370 | F339: =RC1*R2C -> 3370 | G339: =RC1*R2C -> 3370 | H339: =RC1*R2C -> 3370 | I339: =RC1*R2C -> 3370 | J339: =RC1*R2C -> 3370 | K339: =RC1*R2C -> 3370 | L339: =RC1*R2C -> 3370 | M339: =RC1*R2C -> 3370
A340: 338 | B340: =RC1*R2C -> 3380 | C340: =RC1*R2C -> 3380 | D340: =RC1*R2C -> 3380 | E340: =RC1*R2C -> 3380 | F340: =RC1*R2C -> 3380 | G340: =RC1*R2C -> 3380 | H340: =RC1*R2C -> 3380 | I340: =RC1*R2C -> 3380 | J340: =RC1*R2C -> 3380 | K340: =RC1*R2C -> 3380 | L340: =RC1*R2C -> 3380 | M340: =RC1*R2C -> 3380
A341: 339 | B341: =RC1*R2C -> 3390 | C341: =RC1*R2C -> 3390 | D341: =RC1*R2C -> 3390 | E341: =RC1*R2C -> 3390 | F341: =RC1*R2C -> 3390 | G341: =RC1*R2C -> 3390 | H341: =RC1*R2C -> 3390 | I341: =RC1*R2C -> 3390 | J341: =RC1*R2C -> 3390 | K341: =RC1*R2C -> 3390 | L341: =RC1*R2C -> 3390 | M341: =RC1*R2C -> 3390
A342: 340 | B342: =RC1*R2C -> 3400 | C342: =RC1*R2C -> 3400 | D342: =RC1*R2C -> 3400 | E342: =RC1*R2C -> 3400 | F342: =RC1*R2C -> 3400 | G342: =RC1*R2C -> 3400 | H342: =RC1*R2C -> 3400 | I342: =RC1*R2C -> 3400 | J342: =RC1*R2C -> 3400 | K342: =RC1*R2C -> 3400 | L342: =RC1*R2C -> 3400 | M342: =RC1*R2C -> 3400
A343: 341 | B343: =RC1*R2C -> 3410 | C343: =RC1*R2C -> 3410 | D343: =RC1*R2C -> 3410 | E343: =RC1*R2C -> 3410 | F343: =RC1*R2C -> 3410 | G343: =RC1*R2C -> 3410 | H343: =RC1*R2C -> 3410 | I343: =RC1*R2C -> 3410 | J343: =RC1*R2C -> 3410 | K343: =RC1*R2C -> 3410 | L343: =RC1*R2C -> 3410 | M343: =RC1*R2C -> 3410
A344: 342 | B344: =RC1*R2C -> 3420 | C344: =RC1*R2C -> 3420 | D344: =RC1*R2C -> 3420 | E344: =RC1*R2C -> 3420 | F344: =RC1*R2C -> 3420 | G344: =RC1*R2C -> 3420 | H344: =RC1*R2C -> 3420 | I344: =RC1*R2C -> 3420 | J344: =RC1*R2C -> 3420 | K344: =RC1*R2C -> 3420 | L344: =RC1*R2C -> 3420 | M344: =RC1*R2C -> 3420
A345: 343 | B345: =RC1*R2C -> 3430 | C345: =RC1*R2C -> 3430 | D345: =RC1*R2C -> 3430 | E345: =RC1*R2C -> 3430 | F345: =RC1*R2C -> 3430 | G345: =RC1*R2C -> 3430 | H345: =RC1*R2C -> 3430 | I345: =RC1*R2C -> 3430 | J345: =RC1*R2C -> 3430 | K345: =RC1*R2C -> 3430 | L345: =RC1*R2C -> 3430 | M345: =RC1*R2C -> 3430
A346: 344 | B346: =RC1*R2C -> 3440 | C346: =RC1*R2C -> 3440 | D346: =RC1*R2C -> 3440 | E346: =RC1*R2C -> 3440 | F346: =RC1*R2C -> 3440 | G346: =RC1*R2C -> 3440 | H346: =RC1*R2C -> 3440 | I346: =RC1*R2C -> 3440 | J346: =RC1*R2C -> 3440 | K346: =RC1*R2C -> 3440 | L346: =RC1*R2C -> 3440 | M346: =RC1*R2C -> 3440
A347: 345 | B347: =RC1*R2C -> 3450 | C347: =RC1*R2C -> 3450 | D347: =RC1*R2C -> 3450 | E347: =RC1*R2C -> 3450 | F347: =RC1*R2C -> 3450 | G347: =RC1*R2C -> 3450 | H347: =RC1*R2C -> 3450 | I347: =RC1*R2C -> 3450 | J347: =RC1*R2C -> 3450 | K347: =RC1*R2C -> 3450 | L347: =RC1*R2C -> 3450 | M347: =RC1*R2C -> 3450
A348: 346 | B348: =RC1*R2C -> 3460 | C348: =RC1*R2C -> 3460 | D348: =RC1*R2C -> 3460 | E348: =RC1*R2C -> 3460 | F348: =RC1*R2C -> 3460 | G348: =RC1*R2C -> 3460 | H348: =RC1*R2C -> 3460 | I348: =RC1*R2C -> 3460 | J348: =RC1*R2C -> 3460 | K348: =RC1*R2C -> 3460 | L348: =RC1*R2C -> 3460 | M348: =RC1*R2C -> 3460
A349: 347 | B349: =RC1*R2C -> 3470 | C349: =RC1*R2C -> 3470 | D349: =RC1*R2C -> 3470 | E349: =RC1*R2C -> 3470 | F349: =RC1*R2C -> 3470 | G349: =RC1*R2C -> 3470 | H349: =RC1*R2C -> 3470 | I349: =RC1*R2C -> 3470 | J349: =RC1*R2C -> 3470 | K349: =RC1*R2C -> 3470 | L349: =RC1*R2C -> 3470 | M349: =RC1*R2C -> 3470
A350: 348 | B350: =RC1*R2C -> 3480 | C350: =RC1*R2C -> 3480 | D350: =RC1*R2C -> 3480 | E350: =RC1*R2C -> 3480 | F350: =RC1*R2C -> 3480 | G350: =RC1*R2C -> 3480 | H350: =RC1*R2C -> 3480 | I350: =RC1*R2C -> 3480 | J350: =RC1*R2C -> 3480 | K350: =RC1*R2C -> 3480 | L350: =RC1*R2C -> 3480 | M350: =RC1*R2C -> 3480
A351: 349 | B351: =RC1*R2C -> 3490 | C351: =RC1*R2C -> 3490 | D351: =RC1*R2C -> 3490 | E351: =RC1*R2C -> 3490 | F351: =RC1*R2C -> 3490 | G351: =RC1*R2C -> 3490 | H351: =RC1*R2C -> 3490 | I351: =RC1*R2C -> 3490 | J351: =RC1*R2C -> 3490 | K351: =RC1*R2C -> 3490 | L351: =RC1*R2C -> 3490 | M351: =RC1*R2C -> 3490
A352: 350 | B352: =RC1*R2C -> 3500 | C352: =RC1*R2C -> 3500 | D352: =RC1*R2C -> 3500 | E352: =RC1*R2C -> 3500 | F352: =RC1*R2C -> 3500 | G352: =RC1*R2C -> 3500 | H352: =RC1*R2C -> 3500 | I352: =RC1*R2C -> 3500 | J352: =RC1*R2C -> 3500 | K352: =RC1*R2C -> 3500 | L352: =RC1*R2C -> 3500 | M352: =RC1*R2C -> 3500
A353: 351 | B353: =RC1*R2C -> 3510 | C353: =RC1*R2C -> 3510 | D353: =RC1*R2C -> 3510 | E353: =RC1*R2C -> 3510 | F353: =RC1*R2C -> 3510 | G353: =RC1*R2C -> 3510 | H353: =RC1*R2C -> 3510 | I353: =RC1*R2C -> 3510 | J353: =RC1*R2C -> 3510 | K353: =RC1*R2C -> 3510 | L353: =RC1*R2C -> 3510 | M353: =RC1*R2C -> 3510
A354: 352 | B354: =RC1*R2C -> 3520 | C354: =RC1*R2C -> 3520 | D354: =RC1*R2C -> 3520 | E354: =RC1*R2C -> 3520 | F354: =RC1*R2C -> 3520 | G354: =RC1*R2C -> 3520 | H354: =RC1*R2C -> 3520 | I354: =RC1*R2C -> 3520 | J354: =RC1*R2C -> 3520 | K354: =RC1*R2C -> 3520 | L354: =RC1*R2C -> 3520 | M354: =RC1*R2C -> 3520
A355: 353 | B355: =RC1*R2C -> 3530 | C355: =RC1*R2C -> 3530 | D355: =RC1*R2C -> 3530 | E355: =RC1*R2C -> 3530 | F355: =RC1*R2C -> 3530 | G355: =RC1*R2C -> 3530 | H355: =RC1*R2C -> 3530 | I355: =RC1*R2C -> 3530 | J355: =RC1*R2C -> 3530 | K355: =RC1*R2C -> 3530 | L355: =RC1*R2C -> 3530 | M355: =RC1*R2C -> 3530
A356: 354 | B356: =RC1*R2C -> 3540 | C356: =RC1*R2C -> 3540 | D356: =RC1*R2C -> 3540 | E356: =RC1*R2C -> 3540 | F356: =RC1*R2C -> 3540 | G356: =RC1*R2C -> 3540 | H356: =RC1*R2C -> 3540 | I356: =RC1*R2C -> 3540 | J356: =RC1*R2C -> 3540 | K356: =RC1*R2C -> 3540 | L356: =RC1*R2C -> 3540 | M356: =RC1*R2C -> 3540
A357: 355 | B357: =RC1*R2C -> 3550 | C357: =RC1*R2C -> 3550 | D357: =RC1*R2C -> 3550 | E357: =RC1*R2C -> 3550 | F357: =RC1*R2C -> 3550 | G357: =RC1*R2C -> 3550 | H357: =RC1*R2C -> 3550 | I357: =RC1*R2C -> 3550 | J357: =RC1*R2C -> 3550 | K357: =RC1*R2C -> 3550 | L357: =RC1*R2C -> 3550 | M357: =RC1*R2C -> 3550
A358: 356 | B358: =RC1*R2C -> 3560 | C358: =RC1*R2C -> 3560 | D358: =RC1*R2C -> 3560 | E358: =RC1*R2C -> 3560 | F358: =RC1*R2C -> 3560 | G358: =RC1*R2C -> 3560 | H358: =RC1*R2C -> 3560 | I358: =RC1*R2C -> 3560 | J358: =RC1*R2C -> 3560 | K358: =RC1*R2C -> 3560 | L358: =RC1*R2C -> 3560 | M358: =RC1*R2C -> 3560
A359: 357 | B359: =RC1*R2C -> 3570 | C359: =RC1*R2C -> 3570 | D359: =RC1*R2C -> 3570 | E359: =RC1*R2C -> 3570 | F359: =RC1*R2C -> 3570 | G359: =RC1*R2C -> 3570 | H359: =RC1*R2C -> 3570 | I359: =RC1*R2C -> 3570 | J359: =RC1*R2C -> 3570 | K359: =RC1*R2C -> 3570 | L359: =RC1*R2C -> 3570 | M359: =RC1*R2C -> 3570
A360: 358 | B360: =RC1*R2C -> 3580 | C360: =RC1*R2C -> 3580 | D360: =RC1*R2C -> 3580 | E360: =RC1*R2C -> 3580 | F360: =RC1*R2C -> 3580 | G360: =RC1*R2C -> 3580 | H360: =RC1*R2C -> 3580 | I360: =RC1*R2C -> 3580 | J360: =RC1*R2C -> 3580 | K360: =RC1*R2C -> 3580 | L360: =RC1*R2C -> 3580 | M360: =RC1*R2C -> 3580
A361: 359 | B361: =RC1*R2C -> 3590 | C361: =RC1*R2C -> 3590 | D361: =RC1*R2C -> 3590 | E361: =RC1*R2C -> 3590 | F361: =RC1*R2C -> 3590 | G361: =RC1*R2C -> 3590 | H361: =RC1*R2C -> 3590 | I361: =RC1*R2C -> 3590 | J361: =RC1*R2C -> 3590 | K361: =RC1*R2C -> 3590 | L361: =RC1*R2C -> 3590 | M361: =RC1*R2C -> 3590
A362: 360 | B362: =RC1*R2C -> 3600 | C362: =RC1*R2C -> 3600 | D362: =RC1*R2C -> 3600 | E362: =RC1*R2C -> 3600 | F362: =RC1*R2C -> 3600 | G362: =RC1*R2C -> 3600 | H362: =RC1*R2C -> 3600 | I362: =RC1*R2C -> 3600 | J362: =RC1*R2C -> 3600 | K362: =RC1*R2C -> 3600 | L362: =RC1*R2C -> 3600 | M362: =RC1*R2C -> 3600
A363: 361 | B363: =RC1*R2C -> 3610 | C363: =RC1*R2C -> 3610 | D363: =RC1*R2C -> 3610 | E363: =RC1*R2C -> 3610 | F363: =RC1*R2C -> 3610 | G363: =RC1*R2C -> 3610 | H363: =RC1*R2C -> 3610 | I363: =RC1*R2C -> 3610 | J363: =RC1*R2C -> 3610 | K363: =RC1*R2C -> 3610 | L363: =RC1*R2C -> 3610 | M363: =RC1*R2C -> 3610
A364: 362 | B364: =RC1*R2C -> 3620 | C364: =RC1*R2C -> 3620 | D364: =RC1*R2C -> 3620 | E364: =RC1*R2C -> 3620 | F364: =RC1*R2C -> 3620 | G364: =RC1*R2C -> 3620 | H364: =RC1*R2C -> 3620 | I364: =RC1*R2C -> 3620 | J364: =RC1*R2C -> 3620 | K364: =RC1*R2C -> 3620 | L364: =RC1*R2C -> 3620 | M364: =RC1*R2C -> 3620
A365: 363 | B365: =RC1*R2C -> 3630 | C365: =RC1*R2C -> 3630 | D365: =RC1*R2C -> 3630 | E365: =RC1*R2C -> 3630 | F365: =RC1*R2C -> 3630 | G365: =RC1*R2C -> 3630 | H365: =RC1*R2C -> 3630 | I365: =RC1*R2C -> 3630 | J365: =RC1*R2C -> 3630 | K365: =RC1*R2C -> 3630 | L365: =RC1*R2C -> 3630 | M365: =RC1*R2C -> 3630
A366: 364 | B366: =RC1*R2C -> 3640 | C366: =RC1*R2C -> 3640 | D366: =RC1*R2C -> 3640 | E366: =RC1*R2C -> 3640 | F366: =RC1*R2C -> 3640 | G366: =RC1*R2C -> 3640 | H366: =RC1*R2C -> 3640 | I366: =RC1*R2C -> 3640 | J366: =RC1*R2C -> 3640 | K366: =RC1*R2C -> 3640 | L366: =RC1*R2C -> 3640 | M366: =RC1*R2C -> 3640
A367: 365 | B367: =RC1*R2C -> 3650 | C367: =RC1*R2C -> 3650 | D367: =RC1*R2C -> 3650 | E367: =RC1*R2C -> 3650 | F367: =RC1*R2C -> 3650 | G367: =RC1*R2C -> 3650 | H367: =RC1*R2C -> 3650 | I367: =RC1*R2C -> 3650 | J367: =RC1*R2C -> 3650 | K367: =RC1*R2C -> 3650 | L367: =RC1*R2C -> 3650 | M367: =RC1*R2C -> 3650
A368: 366 | B368: =RC1*R2C -> 3660 | C368: =RC1*R2C -> 3660 | D368: =RC1*R2C -> 3660 | E368: =RC1*R2C -> 3660 | F368: =RC1*R2C -> 3660 | G368: =RC1*R2C -> 3660 | H368: =RC1*R2C -> 3660 | I368: =RC1*R2C -> 3660 | J368: =RC1*R2C -> 3660 | K368: =RC1*R2C -> 3660 | L368: =RC1*R2C -> 3660 | M368: =RC1*R2C -> 3660
A369: 367 | B369: =RC1*R2C -> 3670 | C369: =RC1*R2C -> 3670 | D369: =RC1*R2C -> 3670 | E369: =RC1*R2C -> 3670 | F369: =RC1*R2C -> 3670 | G369: =RC1*R2C -> 3670 | H369: =RC1*R2C -> 3670 | I369: =RC1*R2C -> 3670 | J369: =RC1*R2C -> 3670 | K369: =RC1*R2C -> 3670 | L369: =RC1*R2C -> 3670 | M369: =RC1*R2C -> 3670
A370: 368 | B370: =RC1*R2C -> 3680 | C370: =RC1*R2C -> 3680 | D370: =RC1*R2C -> 3680 | E370: =RC1*R2C -> 3680 | F370: =RC1*R2C -> 3680 | G370: =RC1*R2C -> 3680 | H370: =RC1*R2C -> 3680 | I370: =RC1*R2C -> 3680 | J370: =RC1*R2C -> 3680 | K370: =RC1*R2C -> 3680 | L370: =RC1*R2C -> 3680 | M370: =RC1*R2C -> 3680
A371: 369 | B371: =RC1*R2C -> 3690 | C371: =RC1*R2C -> 3690 | D371: =RC1*R2C -> 3690 | E371: =RC1*R2C -> 3690 | F371: =RC1*R2C -> 3690 | G371: =RC1*R2C -> 3690 | H371: =RC1*R2C -> 3690 | I371: =RC1*R2C -> 3690 | J371: =RC1*R2C -> 3690 | K371: =RC1*R2C -> 3690 | L371: =RC1*R2C -> 3690 | M371: =RC1*R2C -> 3690
A372: 370 | B372: =RC1*R2C -> 3700 | C372: =RC1*R2C -> 3700 | D372: =RC1*R2C -> 3700 | E372: =RC1*R2C -> 3700 | F372: =RC1*R2C -> 3700 | G372: =RC1*R2C -> 3700 | H372: =RC1*R2C -> 3700 | I372: =RC1*R2C -> 3700 | J372: =RC1*R2C -> 3700 | K372: =RC1*R2C -> 3700 | L372: =RC1*R2C -> 3700 | M372: =RC1*R2C -> 3700
A373: 371 | B373: =RC1*R2C -> 3710 | C373: =RC1*R2C -> 3710 | D373: =RC1*R2C -> 3710 | E373: =RC1*R2C -> 3710 | F373: =RC1*R2C -> 3710 | G373: =RC1*R2C -> 3710 | H373: =RC1*R2C -> 3710 | I373: =RC1*R2C -> 3710 | J373: =RC1*R2C -> 3710 | K373: =RC1*R2C -> 3710 | L373: =RC1*R2C -> 3710 | M373: =RC1*R2C -> 3710
A374: 372 | B374: =RC1*R2C -> 3720 | C374: =RC1*R2C -> 3720 | D374: =RC1*R2C -> 3720 | E374: =RC1*R2C -> 3720 | F374: =RC1*R2C -> 3720 | G374: =RC1*R2C -> 3720 | H374: =RC1*R2C -> 3720 | I374: =RC1*R2C -> 3720 | J374: =RC1*R2C -> 3720 | K374: =RC1*R2C -> 3720 | L374: =RC1*R2C -> 3720 | M374: =RC1*R2C -> 3720
A375: 373 | B375: =RC1*R2C -> 3730 | C375: =RC1*R2C -> 3730 | D375: =RC1*R2C -> 3730 | E375: =RC1*R2C -> 3730 | F375: =RC1*R2C -> 3730 | G375: =RC1*R2C -> 3730 | H375: =RC1*R2C -> 3730 | I375: =RC1*R2C -> 3730 | J375: =RC1*R2C -> 3730 | K375: =RC1*R2C -> 3730 | L375: =RC1*R2C -> 3730 | M375: =RC1*R2C -> 3730
A376: 374 | B376: =RC1*R2C -> 3740 | C376: =RC1*R2C -> 3740 | D376: =RC1*R2C -> 3740 | E376: =RC1*R2C -> 3740 | F376: =RC1*R2C -> 3740 | G376: =RC1*R2C -> 3740 | H376: =RC1*R2C -> 3740 | I376: =RC1*R2C -> 3740 | J376: =RC1*R2C -> 3740 | K376: =RC1*R2C -> 3740 | L376: =RC1*R2C -> 3740 | M376: =RC1*R2C -> 3740
A377: 375 | B377: =RC1*R2C -> 3750 | C377: =RC1*R2C -> 3750 | D377: =RC1*R2C -> 3750 | E377: =RC1*R2C -> 3750 | F377: =RC1*R2C -> 3750 | G377: =RC1*R2C -> 3750 | H377: =RC1*R2C -> 3750 | I377: =RC1*R2C -> 3750 | J377: =RC1*R2C -> 3750 | K377: =RC1*R2C -> 3750 | L377: =RC1*R2C -> 3750 | M377: =RC1*R2C -> 3750
A378: 376 | B378: =RC1*R2C -> 3760 | C378: =RC1*R2C -> 3760 | D378: =RC1*R2C -> 3760 | E378: =RC1*R2C -> 3760 | F378: =RC1*R2C -> 3760 | G378: =RC1*R2C -> 3760 | H378: =RC1*R2C -> 3760 | I378: =RC1*R2C -> 3760 | J378: =RC1*R2C -> 3760 | K378: =RC1*R2C -> 3760 | L378: =RC1*R2C -> 3760 | M378: =RC1*R2C -> 3760
A379: 377 | B379: =RC1*R2C -> 3770 | C379: =RC1*R2C -> 3770 | D379: =RC1*R2C -> 3770 | E379: =RC1*R2C -> 3770 | F379: =RC1*R2C -> 3770 | G379: =RC1*R2C -> 3770 | H379: =RC1*R2C -> 3770 | I379: =RC1*R2C -> 3770 | J379: =RC1*R2C -> 3770 | K379: =RC1*R2C -> 3770 | L379: =RC1*R2C -> 3770 | M379: =RC1*R2C -> 3770
A380: 378 | B380: =RC1*R2C -> 3780 | C380: =RC1*R2C -> 3780 | D380: =RC1*R2C -> 3780 | E380: =RC1*R2C -> 3780 | F380: =RC1*R2C -> 3780 | G380: =RC1*R2C -> 3780 | H380: =RC1*R2C -> 3780 | I380: =RC1*R2C -> 3780 | J380: =RC1*R2C -> 3780 | K380: =RC1*R2C -> 3780 | L380: =RC1*R2C -> 3780 | M380: =RC1*R2C -> 3780
A381: 379 | B381: =RC1*R2C -> 3790 | C381: =RC1*R2C -> 3790 | D381: =RC1*R2C -> 3790 | E381: =RC1*R2C -> 3790 | F381: =RC1*R2C -> 3790 | G381: =RC1*R2C -> 3790 | H381: =RC1*R2C -> 3790 | I381: =RC1*R2C -> 3790 | J381: =RC1*R2C -> 3790 | K381: =RC1*R2C -> 3790 | L381: =RC1*R2C -> 3790 | M381: =RC1*R2C -> 3790
A382: 380 | B382: =RC1*R2C -> 3800 | C382: =RC1*R2C -> 3800 | D382: =RC1*R2C -> 3800 | E382: =RC1*R2C -> 3800 | F382: =RC1*R2C -> 3800 | G382: =RC1*R2C -> 3800 | H382: =RC1*R2C -> 3800 | I382: =RC1*R2C -> 3800 | J382: =RC1*R2C -> 3800 | K382: =RC1*R2C -> 3800 | L382: =RC1*R2C -> 3800 | M382: =RC1*R2C -> 3800
A383: 381 | B383: =RC1*R2C -> 3810 | C383: =RC1*R2C -> 3810 | D383: =RC1*R2C -> 3810 | E383: =RC1*R2C -> 3810 | F383: =RC1*R2C -> 3810 | G383: =RC1*R2C -> 3810 | H383: =RC1*R2C -> 3810 | I383: =RC1*R2C -> 3810 | J383: =RC1*R2C -> 3810 | K383: =RC1*R2C -> 3810 | L383: =RC1*R2C -> 3810 | M383: =RC1*R2C -> 3810
A384: 382 | B384: =RC1*R2C -> 3820 | C384: =RC1*R2C -> 3820 | D384: =RC1*R2C -> 3820 | E384: =RC1*R2C -> 3820 | F384: =RC1*R2C -> 3820 | G384: =RC1*R2C -> 3820 | H384: =RC1*R2C -> 3820 | I384: =RC1*R2C -> 3820 | J384: =RC1*R2C -> 3820 | K384: =RC1*R2C -> 3820 | L384: =RC1*R2C -> 3820 | M384: =RC1*R2C -> 3820
A385: 383 | B385: =RC1*R2C -> 3830 | C385: =RC1*R2C -> 3830 | D385: =RC1*R2C -> 3830 | E385: =RC1*R2C -> 3830 | F385: =RC1*R2C -> 3830 | G385: =RC1*R2C -> 3830 | H385: =RC1*R2C -> 3830 | I385: =RC1*R2C -> 3830 | J385: =RC1*R2C -> 3830 | K385: =RC1*R2C -> 3830 | L385: =RC1*R2C -> 3830 | M385: =RC1*R2C -> 3830
A386: 384 | B386: =RC1*R2C -> 3840 | C386: =RC1*R2C -> 3840 | D386: =RC1*R2C -> 3840 | E386: =RC1*R2C -> 3840 | F386: =RC1*R2C -> 3840 | G386: =RC1*R2C -> 3840 | H386: =RC1*R2C -> 3840 | I386: =RC1*R2C -> 3840 | J386: =RC1*R2C -> 3840 | K386: =RC1*R2C -> 3840 | L386: =RC1*R2C -> 3840 | M386: =RC1*R2C -> 3840
A387: 385 | B387: =RC1*R2C -> 3850 | C387: =RC1*R2C -> 3850 | D387: =RC1*R2C -> 3850 | E387: =RC1*R2C -> 3850 | F387: =RC1*R2C -> 3850 | G387: =RC1*R2C -> 3850 | H387: =RC1*R2C -> 3850 | I387: =RC1*R2C -> 3850 | J387: =RC1*R2C -> 3850 | K387: =RC1*R2C -> 3850 | L387: =RC1*R2C -> 3850 | M387: =RC1*R2C -> 3850
A388: 386 | B388: =RC1*R2C -> 3860 | C388: =RC1*R2C -> 3860 | D388: =RC1*R2C -> 3860 | E388: =RC1*R2C -> 3860 | F388: =RC1*R2C -> 3860 | G388: =RC1*R2C -> 3860 | H388: =RC1*R2C -> 3860 | I388: =RC1*R2C -> 3860 | J388: =RC1*R2C -> 3860 | K388: =RC1*R2C -> 3860 | L388: =RC1*R2C -> 3860 | M388: =RC1*R2C -> 3860
A389: 387 | B389: =RC1*R2C -> 3870 | C389: =RC1*R2C -> 3870 | D389: =RC1*R2C -> 3870 | E389: =RC1*R2C -> 3870 | F389: =RC1*R2C -> 3870 | G389: =RC1*R2C -> 3870 | H389: =RC1*R2C -> 3870 | I389: =RC1*R2C -> 3870 | J389: =RC1*R2C -> 3870 | K389: =RC1*R2C -> 3870 | L389: =RC1*R2C -> 3870 | M389: =RC1*R2C -> 3870
A390: 388 | B390: =RC1*R2C -> 3880 | C390: =RC1*R2C -> 3880 | D390: =RC1*R2C -> 3880 | E390: =RC1*R2C -> 3880 | F390: =RC1*R2C -> 3880 | G390: =RC1*R2C -> 3880 | H390: =RC1*R2C -> 3880 | I390: =RC1*R2C -> 3880 | J390: =RC1*R2C -> 3880 | K390: =RC1*R2C -> 3880 | L390: =RC1*R2C -> 3880 | M390: =RC1*R2C -> 3880
A391: 389 | B391: =RC1*R2C -> 3890 | C391: =RC1*R2C -> 3890 | D391: =RC1*R2C -> 3890 | E391: =RC1*R2C -> 3890 | F391: =RC1*R2C -> 3890 | G391: =RC1*R2C -> 3890 | H391: =RC1*R2C -> 3890 | I391: =RC1*R2C -> 3890 | J391: =RC1*R2C -> 3890 | K391: =RC1*R2C -> 3890 | L391: =RC1*R2C -> 3890 | M391: =RC1*R2C -> 3890
A392: 390 | B392: =RC1*R2C -> 3900 | C392: =RC1*R2C -> 3900 | D392: =RC1*R2C -> 3900 | E392: =RC1*R2C -> 3900 | F392: =RC1*R2C -> 3900 | G392: =RC1*R2C -> 3900 | H392: =RC1*R2C -> 3900 | I392: =RC1*R2C -> 3900 | J392: =RC1*R2C -> 3900 | K392: =RC1*R2C -> 3900 | L392: =RC1*R2C -> 3900 | M392: =RC1*R2C -> 3900
A393: 391 | B393: =RC1*R2C -> 3910 | C393: =RC1*R2C -> 3910 | D393: =RC1*R2C -> 3910 | E393: =RC1*R2C -> 3910 | F393: =RC1*R2C -> 3910 | G393: =RC1*R2C -> 3910 | H393: =RC1*R2C -> 3910 | I393: =RC1*R2C -> 3910 | J393: =RC1*R2C -> 3910 | K393: =RC1*R2C -> 3910 | L393: =RC1*R2C -> 3910 | M393: =RC1*R2C -> 3910
A394: 392 | B394: =RC1*R2C -> 3920 | C394: =RC1*R2C -> 3920 | D394: =RC1*R2C -> 3920 | E394: =RC1*R2C -> 3920 | F394: =RC1*R2C -> 3920 | G394: =RC1*R2C -> 3920 | H394: =RC1*R2C -> 3920 | I394: =RC1*R2C -> 3920 | J394: =RC1*R2C -> 3920 | K394: =RC1*R2C -> 3920 | L394: =RC1*R2C -> 3920 | M394: =RC1*R2C -> 3920
A395: 393 | B395: =RC1*R2C -> 3930 | C395: =RC1*R2C -> 3930 | D395: =RC1*R2C -> 3930 | E395: =RC1*R2C -> 3930 | F395: =RC1*R2C -> 3930 | G395: =RC1*R2C -> 3930 | H395: =RC1*R2C -> 3930 | I395: =RC1*R2C -> 3930 | J395: =RC1*R2C -> 3930 | K395: =RC1*R2C -> 3930 | L395: =RC1*R2C -> 3930 | M395: =RC1*R2C -> 3930
A396: 394 | B396: =RC1*R2C -> 3940 | C396: =RC1*R2C -> 3940 | D396: =RC1*R2C -> 3940 | E396: =RC1*R2C -> 3940 | F396: =RC1*R2C -> 3940 | G396: =RC1*R2C -> 3940 | H396: =RC1*R2C -> 3940 | I396: =RC1*R2C -> 3940 | J396: =RC1*R2C -> 3940 | K396: =RC1*R2C -> 3940 | L396: =RC1*R2C -> 3940 | M396: =RC1*R2C -> 3940
A397: 395 | B397: =RC1*R2C -> 3950 | C397: =RC1*R2C -> 3950 | D397: =RC1*R2C -> 3950 | E397: =RC1*R2C -> 3950 | F397: =RC1*R2C -> 3950 | G397: =RC1*R2C -> 3950 | H397: =RC1*R2C -> 3950 | I397: =RC1*R2C -> 3950 | J397: =RC1*R2C -> 3950 | K397: =RC1*R2C -> 3950 | L397: =RC1*R2C -> 3950 | M397: =RC1*R2C -> 3950
A398: 396 | B398: =RC1*R2C -> 3960 | C398: =RC1*R2C -> 3960 | D398: =RC1*R2C -> 3960 | E398: =RC1*R2C -> 3960 | F398: =RC1*R2C -> 3960 | G398: =RC1*R2C -> 3960 | H398: =RC1*R2C -> 3960 | I398: =RC1*R2C -> 3960 | J398: =RC1*R2C -> 3960 | K398: =RC1*R2C -> 3960 | L398: =RC1*R2C -> 3960 | M398: =RC1*R2C -> 3960
A399: 397 | B399: =RC1*R2C -> 3970 | C399: =RC1*R2C -> 3970 | D399: =RC1*R2C -> 3970 | E399: =RC1*R2C -> 3970 | F399: =RC1*R2C -> 3970 | G399: =RC1*R2C -> 3970 | H399: =RC1*R2C -> 3970 | I399: =RC1*R2C -> 3970 | J399: =RC1*R2C -> 3970 | K399: =RC1*R2C -> 3970 | L399: =RC1*R2C -> 3970 | M399: =RC1*R2C -> 3970
A400: 398 | B400: =RC1*R2C -> 3980 | C400: =RC1*R2C -> 3980 | D400: =RC1*R2C -> 3980 | E400: =RC1*R2C -> 3980 | F400: =RC1*R2C -> 3980 | G400: =RC1*R2C -> 3980 | H400: =RC1*R2C -> 3980 | I400: =RC1*R2C -> 3980 | J400: =RC1*R2C -> 3980 | K400: =RC1*R2C -> 3980 | L400: =RC1*R2C -> 3980 | M400: =RC1*R2C -> 3980
A401: 399 | B401: =RC1*R2C -> 3990 | C401: =RC1*R2C -> 3990 | D401: =RC1*R2C -> 3990 | E401: =RC1*R2C -> 3990 | F401: =RC1*R2C -> 3990 | G401: =RC1*R2C -> 3990 | H401: =RC1*R2C -> 3990 | I401: =RC1*R2C -> 3990 | J401: =RC1*R2C -> 3990 | K401: =RC1*R2C -> 3990 | L401: =RC1*R2C -> 3990 | M401: =RC1*R2C -> 3990
A402: 400 | B402: =RC1*R2C -> 4000 | C402: =RC1*R2C -> 4000 | D402: =RC1*R2C -> 4000 | E402: =RC1*R2C -> 4000 | F402: =RC1*R2C -> 4000 | G402: =RC1*R2C -> 4000 | H402: =RC1*R2C -> 4000 | I402: =RC1*R2C -> 4000 | J402: =RC1*R2C -> 4000 | K402: =RC1*R2C -> 4000 | L402: =RC1*R2C -> 4000 | M402: =RC1*R2C -> 4000
A403: 401 | B403: =RC1*R2C -> 4010 | C403: =RC1*R2C -> 4010 | D403: =RC1*R2C -> 4010 | E403: =RC1*R2C -> 4010 | F403: =RC1*R2C -> 4010 | G403: =RC1*R2C -> 4010 | H403: =RC1*R2C -> 4010 | I403: =RC1*R2C -> 4010 | J403: =RC1*R2C -> 4010 | K403: =RC1*R2C -> 4010 | L403: =RC1*R2C -> 4010 | M403: =RC1*R2C -> 4010
A404: 402 | B404: =RC1*R2C -> 4020 | C404: =RC1*R2C -> 4020 | D404: =RC1*R2C -> 4020 | E404: =RC1*R2C -> 4020 | F404: =RC1*R2C -> 4020 | G404: =RC1*R2C -> 4020 | H404: =RC1*R2C -> 4020 | I404: =RC1*R2C -> 4020 | J404: =RC1*R2C -> 4020 | K404: =RC1*R2C -> 4020 | L404: =RC1*R2C -> 4020 | M404: =RC1*R2C -> 4020
A405: 403 | B405: =RC1*R2C -> 4030 | C405: =RC1*R2C -> 4030 | D405: =RC1*R2C -> 4030 | E405: =RC1*R2C -> 4030 | F405: =RC1*R2C -> 4030 | G405: =RC1*R2C -> 4030 | H405: =RC1*R2C -> 4030 | I405: =RC1*R2C -> 4030 | J405: =RC1*R2C -> 4030 | K405: =RC1*R2C -> 4030 | L405: =RC1*R2C -> 4030 | M405: =RC1*R2C -> 4030
A406: 404 | B406: =RC1*R2C -> 4040 | C406: =RC1*R2C -> 4040 | D406: =RC1*R2C -> 4040 | E406: =RC1*R2C -> 4040 | F406: =RC1*R2C -> 4040 | G406: =RC1*R2C -> 4040 | H406: =RC1*R2C -> 4040 | I406: =RC1*R2C -> 4040 | J406: =RC1*R2C -> 4040 | K406: =RC1*R2C -> 4040 | L406: =RC1*R2C -> 4040 | M406: =RC1*R2C -> 4040
A407: 405 | B407: =RC1*R2C -> 4050 | C407: =RC1*R2C -> 4050 | D407: =RC1*R2C -> 4050 | E407: =RC1*R2C -> 4050 | F407: =RC1*R2C -> 4050 | G407: =RC1*R2C -> 4050 | H407: =RC1*R2C -> 4050 | I407: =RC1*R2C -> 4050 | J407: =RC1*R2C -> 4050 | K407: =RC1*R2C -> 4050 | L407: =RC1*R2C -> 4050 | M407: =RC1*R2C -> 4050
A408: 406 | B408: =RC1*R2C -> 4060 | C408: =RC1*R2C -> 4060 | D408: =RC1*R2C -> 4060 | E408: =RC1*R2C -> 4060 | F408: =RC1*R2C -> 4060 | G408: =RC1*R2C -> 4060 | H408: =RC1*R2C -> 4060 | I408: =RC1*R2C -> 4060 | J408: =RC1*R2C -> 4060 | K408: =RC1*R2C -> 4060 | L408: =RC1*R2C -> 4060 | M408: =RC1*R2C -> 4060
A409: 407 | B409: =RC1*R2C -> 4070 | C409: =RC1*R2C -> 4070 | D409: =RC1*R2C -> 4070 | E409: =RC1*R2C -> 4070 | F409: =RC1*R2C -> 4070 | G409: =RC1*R2C -> 4070 | H409: =RC1*R2C -> 4070 | I409: =RC1*R2C -> 4070 | J409: =RC1*R2C -> 4070 | K409: =RC1*R2C -> 4070 | L409: =RC1*R2C -> 4070 | M409: =RC1*R2C -> 4070
A410: 408 | B410: =RC1*R2C -> 4080 | C410: =RC1*R2C -> 4080 | D410: =RC1*R2C -> 4080 | E410: =RC1*R2C -> 4080 | F410: =RC1*R2C -> 4080 | G410: =RC1*R2C -> 4080 | H410: =RC1*R2C -> 4080 | I410: =RC1*R2C -> 4080 | J410: =RC1*R2C -> 4080 | K410: =RC1*R2C -> 4080 | L410: =RC1*R2C -> 4080 | M410: =RC1*R2C -> 4080
A411: 409 | B411: =RC1*R2C -> 4090 | C411: =RC1*R2C -> 4090 | D411: =RC1*R2C -> 4090 | E411: =RC1*R2C -> 4090 | F411: =RC1*R2C -> 4090 | G411: =RC1*R2C -> 4090 | H411: =RC1*R2C -> 4090 | I411: =RC1*R2C -> 4090 | J411: =RC1*R2C -> 4090 | K411: =RC1*R2C -> 4090 | L411: =RC1*R2C -> 4090 | M411: =RC1*R2C -> 4090
A412: 410 | B412: =RC1*R2C -> 4100 | C412: =RC1*R2C -> 4100 | D412: =RC1*R2C -> 4100 | E412: =RC1*R2C -> 4100 | F412: =RC1*R2C -> 4100 | G412: =RC1*R2C -> 4100 | H412: =RC1*R2C -> 4100 | I412: =RC1*R2C -> 4100 | J412: =RC1*R2C -> 4100 | K412: =RC1*R2C -> 4100 | L412: =RC1*R2C -> 4100 | M412: =RC1*R2C -> 4100
A413: 411 | B413: =RC1*R2C -> 4110 | C413: =RC1*R2C -> 4110 | D413: =RC1*R2C -> 4110 | E413: =RC1*R2C -> 4110 | F413: =RC1*R2C -> 4110 | G413: =RC1*R2C -> 4110 | H413: =RC1*R2C -> 4110 | I413: =RC1*R2C -> 4110 | J413: =RC1*R2C -> 4110 | K413: =RC1*R2C -> 4110 | L413: =RC1*R2C -> 4110 | M413: =RC1*R2C -> 4110
A414: 412 | B414: =RC1*R2C -> 4120 | C414: =RC1*R2C -> 4120 | D414: =RC1*R2C -> 4120 | E414: =RC1*R2C -> 4120 | F414: =RC1*R2C -> 4120 | G414: =RC1*R2C -> 4120 | H414: =RC1*R2C -> 4120 | I414: =RC1*R2C -> 4120 | J414: =RC1*R2C -> 4120 | K414: =RC1*R2C -> 4120 | L414: =RC1*R2C -> 4120 | M414: =RC1*R2C -> 4120
A415: 413 | B415: =RC1*R2C -> 4130 | C415: =RC1*R2C -> 4130 | D415: =RC1*R2C -> 4130 | E415: =RC1*R2C -> 4130 | F415: =RC1*R2C -> 4130 | G415: =RC1*R2C -> 4130 | H415: =RC1*R2C -> 4130 | I415: =RC1*R2C -> 4130 | J415: =RC1*R2C -> 4130 | K415: =RC1*R2C -> 4130 | L415: =RC1*R2C -> 4130 | M415: =RC1*R2C -> 4130
A416: 414 | B416: =RC1*R2C -> 4140 | C416: =RC1*R2C -> 4140 | D416: =RC1*R2C -> 4140 | E416: =RC1*R2C -> 4140 | F416: =RC1*R2C -> 4140 | G416: =RC1*R2C -> 4140 | H416: =RC1*R2C -> 4140 | I416: =RC1*R2C -> 4140 | J416: =RC1*R2C -> 4140 | K416: =RC1*R2C -> 4140 | L416: =RC1*R2C -> 4140 | M416: =RC1*R2C -> 4140
A417: 415 | B417: =RC1*R2C -> 4150 | C417: =RC1*R2C -> 4150 | D417: =RC1*R2C -> 4150 | E417: =RC1*R2C -> 4150 | F417: =RC1*R2C -> 4150 | G417: =RC1*R2C -> 4150 | H417: =RC1*R2C -> 4150 | I417: =RC1*R2C -> 4150 | J417: =RC1*R2C -> 4150 | K417: =RC1*R2C -> 4150 | L417: =RC1*R2C -> 4150 | M417: =RC1*R2C -> 4150
A418: 416 | B418: =RC1*R2C -> 4160 | C418: =RC1*R2C -> 4160 | D418: =RC1*R2C -> 4160 | E418: =RC1*R2C -> 4160 | F418: =RC1*R2C -> 4160 | G418: =RC1*R2C -> 4160 | H418: =RC1*R2C -> 4160 | I418: =RC1*R2C -> 4160 | J418: =RC1*R2C -> 4160 | K418: =RC1*R2C -> 4160 | L418: =RC1*R2C -> 4160 | M418: =RC1*R2C -> 4160
A419: 417 | B419: =RC1*R2C -> 4170 | C419: =RC1*R2C -> 4170 | D419: =RC1*R2C -> 4170 | E419: =RC1*R2C -> 4170 | F419: =RC1*R2C -> 4170 | G419: =RC1*R2C -> 4170 | H419: =RC1*R2C -> 4170 | I419: =RC1*R2C -> 4170 | J419: =RC1*R2C -> 4170 | K419: =RC1*R2C -> 4170 | L419: =RC1*R2C -> 4170 | M419: =RC1*R2C -> 4170
A420: 418 | B420: =RC1*R2C -> 4180 | C420: =RC1*R2C -> 4180 | D420: =RC1*R2C -> 4180 | E420: =RC1*R2C -> 4180 | F420: =RC1*R2C -> 4180 | G420: =RC1*R2C -> 4180 | H420: =RC1*R2C -> 4180 | I420: =RC1*R2C -> 4180 | J420: =RC1*R2C -> 4180 | K420: =RC1*R2C -> 4180 | L420: =RC1*R2C -> 4180 | M420: =RC1*R2C -> 4180
A421: 419 | B421: =RC1*R2C -> 4190 | C421: =RC1*R2C -> 4190 | D421: =RC1*R2C -> 4190 | E421: =RC1*R2C -> 4190 | F421: =RC1*R2C -> 4190 | G421: =RC1*R2C -> 4190 | H421: =RC1*R2C -> 4190 | I421: =RC1*R2C -> 4190 | J421: =RC1*R2C -> 4190 | K421: =RC1*R2C -> 4190 | L421: =RC1*R2C -> 4190 | M421: =RC1*R2C -> 4190
A422: 420 | B422: =RC1*R2C -> 4200 | C422: =RC1*R2C -> 4200 | D422: =RC1*R2C -> 4200 | E422: =RC1*R2C -> 4200 | F422: =RC1*R2C -> 4200 | G422: =RC1*R2C -> 4200 | H422: =RC1*R2C -> 4200 | I422: =RC1*R2C -> 4200 | J422: =RC1*R2C -> 4200 | K422: =RC1*R2C -> 4200 | L422: =RC1*R2C -> 4200 | M422: =RC1*R2C -> 4200
A423: 421 | B423: =RC1*R2C -> 4210 | C423: =RC1*R2C -> 4210 | D423: =RC1*R2C -> 4210 | E423: =RC1*R2C -> 4210 | F423: =RC1*R2C -> 4210 | G423: =RC1*R2C -> 4210 | H423: =RC1*R2C -> 4210 | I423: =RC1*R2C -> 4210 | J423: =RC1*R2C -> 4210 | K423: =RC1*R2C -> 4210 | L423: =RC1*R2C -> 4210 | M423: =RC1*R2C -> 4210
A424: 422 | B424: =RC1*R2C -> 4220 | C424: =RC1*R2C -> 4220 | D424: =RC1*R2C -> 4220 | E424: =RC1*R2C -> 4220 | F424: =RC1*R2C -> 4220 | G424: =RC1*R2C -> 4220 | H424: =RC1*R2C -> 4220 | I424: =RC1*R2C -> 4220 | J424: =RC1*R2C -> 4220 | K424: =RC1*R2C -> 4220 | L424: =RC1*R2C -> 4220 | M424: =RC1*R2C -> 4220
A425: 423 | B425: =RC1*R2C -> 4230 | C425: =RC1*R2C -> 4230 | D425: =RC1*R2C -> 4230 | E425: =RC1*R2C -> 4230 | F425: =RC1*R2C -> 4230 | G425: =RC1*R2C -> 4230 | H425: =RC1*R2C -> 4230 | I425: =RC1*R2C -> 4230 | J425: =RC1*R2C -> 4230 | K425: =RC1*R2C -> 4230 | L425: =RC1*R2C -> 4230 | M425: =RC1*R2C -> 4230
A426: 424 | B426: =RC1*R2C -> 4240 | C426: =RC1*R2C -> 4240 | D426: =RC1*R2C -> 4240 | E426: =RC1*R2C -> 4240 | F426: =RC1*R2C -> 4240 | G426: =RC1*R2C -> 4240 | H426: =RC1*R2C -> 4240 | I426: =RC1*R2C -> 4240 | J426: =RC1*R2C -> 4240 | K426: =RC1*R2C -> 4240 | L426: =RC1*R2C -> 4240 | M426: =RC1*R2C -> 4240
A427: 425 | B427: =RC1*R2C -> 4250 | C427: =RC1*R2C -> 4250 | D427: =RC1*R2C -> 4250 | E427: =RC1*R2C -> 4250 | F427: =RC1*R2C -> 4250 | G427: =RC1*R2C -> 4250 | H427: =RC1*R2C -> 4250 | I427: =RC1*R2C -> 4250 | J427: =RC1*R2C -> 4250 | K427: =RC1*R2C -> 4250 | L427: =RC1*R2C -> 4250 | M427: =RC1*R2C -> 4250
A428: 426 | B428: =RC1*R2C -> 4260 | C428: =RC1*R2C -> 4260 | D428: =RC1*R2C -> 4260 | E428: =RC1*R2C -> 4260 | F428: =RC1*R2C -> 4260 | G428: =RC1*R2C -> 4260 | H428: =RC1*R2C -> 4260 | I428: =RC1*R2C -> 4260 | J428: =RC1*R2C -> 4260 | K428: =RC1*R2C -> 4260 | L428: =RC1*R2C -> 4260 | M428: =RC1*R2C -> 4260
A429: 427 | B429: =RC1*R2C -> 4270 | C429: =RC1*R2C -> 4270 | D429: =RC1*R2C -> 4270 | E429: =RC1*R2C -> 4270 | F429: =RC1*R2C -> 4270 | G429: =RC1*R2C -> 4270 | H429: =RC1*R2C -> 4270 | I429: =RC1*R2C -> 4270 | J429: =RC1*R2C -> 4270 | K429: =RC1*R2C -> 4270 | L429: =RC1*R2C -> 4270 | M429: =RC1*R2C -> 4270
A430: 428 | B430: =RC1*R2C -> 4280 | C430: =RC1*R2C -> 4280 | D430: =RC1*R2C -> 4280 | E430: =RC1*R2C -> 4280 | F430: =RC1*R2C -> 4280 | G430: =RC1*R2C -> 4280 | H430: =RC1*R2C -> 4280 | I430: =RC1*R2C -> 4280 | J430: =RC1*R2C -> 4280 | K430: =RC1*R2C -> 4280 | L430: =RC1*R2C -> 4280 | M430: =RC1*R2C -> 4280
A431: 429 | B431: =RC1*R2C -> 4290 | C431: =RC1*R2C -> 4290 | D431: =RC1*R2C -> 4290 | E431: =RC1*R2C -> 4290 | F431: =RC1*R2C -> 4290 | G431: =RC1*R2C -> 4290 | H431: =RC1*R2C -> 4290 | I431: =RC1*R2C -> 4290 | J431: =RC1*R2C -> 4290 | K431: =RC1*R2C -> 4290 | L431: =RC1*R2C -> 4290 | M431: =RC1*R2C -> 4290
A432: 430 | B432: =RC1*R2C -> 4300 | C432: =RC1*R2C -> 4300 | D432: =RC1*R2C -> 4300 | E432: =RC1*R2C -> 4300 | F432: =RC1*R2C -> 4300 | G432: =RC1*R2C -> 4300 | H432: =RC1*R2C -> 4300 | I432: =RC1*R2C -> 4300 | J432: =RC1*R2C -> 4300 | K432: =RC1*R2C -> 4300 | L432: =RC1*R2C -> 4300 | M432: =RC1*R2C -> 4300
A433: 431 | B433: =RC1*R2C -> 4310 | C433: =RC1*R2C -> 4310 | D433: =RC1*R2C -> 4310 | E433: =RC1*R2C -> 4310 | F433: =RC1*R2C -> 4310 | G433: =RC1*R2C -> 4310 | H433: =RC1*R2C -> 4310 | I433: =RC1*R2C -> 4310 | J433: =RC1*R2C -> 4310 | K433: =RC1*R2C -> 4310 | L433: =RC1*R2C -> 4310 | M433: =RC1*R2C -> 4310
A434: 432 | B434: =RC1*R2C -> 4320 | C434: =RC1*R2C -> 4320 | D434: =RC1*R2C -> 4320 | E434: =RC1*R2C -> 4320 | F434: =RC1*R2C -> 4320 | G434: =RC1*R2C -> 4320 | H434: =RC1*R2C -> 4320 | I434: =RC1*R2C -> 4320 | J434: =RC1*R2C -> 4320 | K434: =RC1*R2C -> 4320 | L434: =RC1*R2C -> 4320 | M434: =RC1*R2C -> 4320
A435: 433 | B435: =RC1*R2C -> 4330 | C435: =RC1*R2C -> 4330 | D435: =RC1*R2C -> 4330 | E435: =RC1*R2C -> 4330 | F435: =RC1*R2C -> 4330 | G435: =RC1*R2C -> 4330 | H435: =RC1*R2C -> 4330 | I435: =RC1*R2C -> 4330 | J435: =RC1*R2C -> 4330 | K435: =RC1*R2C -> 4330 | L435: =RC1*R2C -> 4330 | M435: =RC1*R2C -> 4330
A436: 434 | B436: =RC1*R2C -> 4340 | C436: =RC1*R2C -> 4340 | D436: =RC1*R2C -> 4340 | E436: =RC1*R2C -> 4340 | F436: =RC1*R2C -> 4340 | G436: =RC1*R2C -> 4340 | H436: =RC1*R2C -> 4340 | I436: =RC1*R2C -> 4340 | J436: =RC1*R2C -> 4340 | K436: =RC1*R2C -> 4340 | L436: =RC1*R2C -> 4340 | M436: =RC1*R2C -> 4340
A437: 435 | B437: =RC1*R2C -> 4350 | C437: =RC1*R2C -> 4350 | D437: =RC1*R2C -> 4350 | E437: =RC1*R2C -> 4350 | F437: =RC1*R2C -> 4350 | G437: =RC1*R2C -> 4350 | H437: =RC1*R2C -> 4350 | I437: =RC1*R2C -> 4350 | J437: =RC1*R2C -> 4350 | K437: =RC1*R2C -> 4350 | L437: =RC1*R2C -> 4350 | M437: =RC1*R2C -> 4350
A438: 436 | B438: =RC1*R2C -> 4360 | C438: =RC1*R2C -> 4360 | D438: =RC1*R2C -> 4360 | E438: =RC1*R2C -> 4360 | F438: =RC1*R2C -> 4360 | G438: =RC1*R2C -> 4360 | H438: =RC1*R2C -> 4360 | I438: =RC1*R2C -> 4360 | J438: =RC1*R2C -> 4360 | K438: =RC1*R2C -> 4360 | L438: =RC1*R2C -> 4360 | M438: =RC1*R2C -> 4360
A439: 437 | B439: =RC1*R2C -> 4370 | C439: =RC1*R2C -> 4370 | D439: =RC1*R2C -> 4370 | E439: =RC1*R2C -> 4370 | F439: =RC1*R2C -> 4370 | G439: =RC1*R2C -> 4370 | H439: =RC1*R2C -> 4370 | I439: =RC1*R2C -> 4370 | J439: =RC1*R2C -> 4370 | K439: =RC1*R2C -> 4370 | L439: =RC1*R2C -> 4370 | M439: =RC1*R2C -> 4370
A440: 438 | B440: =RC1*R2C -> 4380 | C440: =RC1*R2C -> 4380 | D440: =RC1*R2C -> 4380 | E440: =RC1*R2C -> 4380 | F440: =RC1*R2C -> 4380 | G440: =RC1*R2C -> 4380 | H440: =RC1*R2C -> 4380 | I440: =RC1*R2C -> 4380 | J440: =RC1*R2C -> 4380 | K440: =RC1*R2C -> 4380 | L440: =RC1*R2C -> 4380 | M440: =RC1*R2C -> 4380
A441: 439 | B441: =RC1*R2C -> 4390 | C441: =RC1*R2C -> 4390 | D441: =RC1*R2C -> 4390 | E441: =RC1*R2C -> 4390 | F441: =RC1*R2C -> 4390 | G441: =RC1*R2C -> 4390 | H441: =RC1*R2C -> 4390 | I441: =RC1*R2C -> 4390 | J441: =RC1*R2C -> 4390 | K441: =RC1*R2C -> 4390 | L441: =RC1*R2C -> 4390 | M441: =RC1*R2C -> 4390
A442: 440 | B442: =RC1*R2C -> 4400 | C442: =RC1*R2C -> 4400 | D442: =RC1*R2C -> 4400 | E442: =RC1*R2C -> 4400 | F442: =RC1*R2C -> 4400 | G442: =RC1*R2C -> 4400 | H442: =RC1*R2C -> 4400 | I442: =RC1*R2C -> 4400 | J442: =RC1*R2C -> 4400 | K442: =RC1*R2C -> 4400 | L442: =RC1*R2C -> 4400 | M442: =RC1*R2C -> 4400
A443: 441 | B443: =RC1*R2C -> 4410 | C443: =RC1*R2C -> 4410 | D443: =RC1*R2C -> 4410 | E443: =RC1*R2C -> 4410 | F443: =RC1*R2C -> 4410 | G443: =RC1*R2C -> 4410 | H443: =RC1*R2C -> 4410 | I443: =RC1*R2C -> 4410 | J443: =RC1*R2C -> 4410 | K443: =RC1*R2C -> 4410 | L443: =RC1*R2C -> 4410 | M443: =RC1*R2C -> 4410
A444: 442 | B444: =RC1*R2C -> 4420 | C444: =RC1*R2C -> 4420 | D444: =RC1*R2C -> 4420 | E444: =RC1*R2C -> 4420 | F444: =RC1*R2C -> 4420 | G444: =RC1*R2C -> 4420 | H444: =RC1*R2C -> 4420 | I444: =RC1*R2C -> 4420 | J444: =RC1*R2C -> 4420 | K444: =RC1*R2C -> 4420 | L444: =RC1*R2C -> 4420 | M444: =RC1*R2C -> 4420
A445: 443 | B445: =RC1*R2C -> 4430 | C445: =RC1*R2C -> 4430 | D445: =RC1*R2C -> 4430 | E445: =RC1*R2C -> 4430 | F445: =RC1*R2C -> 4430 | G445: =RC1*R2C -> 4430 | H445: =RC1*R2C -> 4430 | I445: =RC1*R2C -> 4430 | J445: =RC1*R2C -> 4430 | K445: =RC1*R2C -> 4430 | L445: =RC1*R2C -> 4430 | M445: =RC1*R2C -> 4430
A446: 444 | B446: =RC1*R2C -> 4440 | C446: =RC1*R2C -> 4440 | D446: =RC1*R2C -> 4440 | E446: =RC1*R2C -> 4440 | F446: =RC1*R2C -> 4440 | G446: =RC1*R2C -> 4440 | H446: =RC1*R2C -> 4440 | I446: =RC1*R2C -> 4440 | J446: =RC1*R2C -> 4440 | K446: =RC1*R2C -> 4440 | L446: =RC1*R2C -> 4440 | M446: =RC1*R2C -> 4440
A447: 445 | B447: =RC1*R2C -> 4450 | C447: =RC1*R2C -> 4450 | D447: =RC1*R2C -> 4450 | E447: =RC1*R2C -> 4450 | F447: =RC1*R2C -> 4450 | G447: =RC1*R2C -> 4450 | H447: =RC1*R2C -> 4450 | I447: =RC1*R2C -> 4450 | J447: =RC1*R2C -> 4450 | K447: =RC1*R2C -> 4450 | L447: =RC1*R2C -> 4450 | M447: =RC1*R2C -> 4450
A448: 446 | B448: =RC1*R2C -> 4460 | C448: =RC1*R2C -> 4460 | D448: =RC1*R2C -> 4460 | E448: =RC1*R2C -> 4460 | F448: =RC1*R2C -> 4460 | G448: =RC1*R2C -> 4460 | H448: =RC1*R2C -> 4460 | I448: =RC1*R2C -> 4460 | J448: =RC1*R2C -> 4460 | K448: =RC1*R2C -> 4460 | L448: =RC1*R2C -> 4460 | M448: =RC1*R2C -> 4460
A449: 447 | B449: =RC1*R2C -> 4470 | C449: =RC1*R2C -> 4470 | D449: =RC1*R2C -> 4470 | E449: =RC1*R2C -> 4470 | F449: =RC1*R2C -> 4470 | G449: =RC1*R2C -> 4470 | H449: =RC1*R2C -> 4470 | I449: =RC1*R2C -> 4470 | J449: =RC1*R2C -> 4470 | K449: =RC1*R2C -> 4470 | L449: =RC1*R2C -> 4470 | M449: =RC1*R2C -> 4470
A450: 448 | B450: =RC1*R2C -> 4480 | C450: =RC1*R2C -> 4480 | D450: =RC1*R2C -> 4480 | E450: =RC1*R2C -> 4480 | F450: =RC1*R2C -> 4480 | G450: =RC1*R2C -> 4480 | H450: =RC1*R2C -> 4480 | I450: =RC1*R2C -> 4480 | J450: =RC1*R2C -> 4480 | K450: =RC1*R2C -> 4480 | L450: =RC1*R2C -> 4480 | M450: =RC1*R2C -> 4480
A451: 449 | B451: =RC1*R2C -> 4490 | C451: =RC1*R2C -> 4490 | D451: =RC1*R2C -> 4490 | E451: =RC1*R2C -> 4490 | F451: =RC1*R2C -> 4490 | G451: =RC1*R2C -> 4490 | H451: =RC1*R2C -> 4490 | I451: =RC1*R2C -> 4490 | J451: =RC1*R2C -> 4490 | K451: =RC1*R2C -> 4490 | L451: =RC1*R2C -> 4490 | M451: =RC1*R2C -> 4490
A452: 450 | B452: =RC1*R2C -> 4500 | C452: =RC1*R2C -> 4500 | D452: =RC1*R2C -> 4500 | E452: =RC1*R2C -> 4500 | F452: =RC1*R2C -> 4500 | G452: =RC1*R2C -> 4500 | H452: =RC1*R2C -> 4500 | I452: =RC1*R2C -> 4500 | J452: =RC1*R2C -> 4500 | K452: =RC1*R2C -> 4500 | L452: =RC1*R2C -> 4500 | M452: =RC1*R2C -> 4500
A453: 451 | B453: =RC1*R2C -> 4510 | C453: =RC1*R2C -> 4510 | D453: =RC1*R2C -> 4510 | E453: =RC1*R2C -> 4510 | F453: =RC1*R2C -> 4510 | G453: =RC1*R2C -> 4510 | H453: =RC1*R2C -> 4510 | I453: =RC1*R2C -> 4510 | J453: =RC1*R2C -> 4510 | K453: =RC1*R2C -> 4510 | L453: =RC1*R2C -> 4510 | M453: =RC1*R2C -> 4510
A454: 452 | B454: =RC1*R2C -> 4520 | C454: =RC1*R2C -> 4520 | D454: =RC1*R2C -> 4520 | E454: =RC1*R2C -> 4520 | F454: =RC1*R2C -> 4520 | G454: =RC1*R2C -> 4520 | H454: =RC1*R2C -> 4520 | I454: =RC1*R2C -> 4520 | J454: =RC1*R2C -> 4520 | K454: =RC1*R2C -> 4520 | L454: =RC1*R2C -> 4520 | M454: =RC1*R2C -> 4520
A455: 453 | B455: =RC1*R2C -> 4530 | C455: =RC1*R2C -> 4530 | D455: =RC1*R2C -> 4530 | E455: =RC1*R2C -> 4530 | F455: =RC1*R2C -> 4530 | G455: =RC1*R2C -> 4530 | H455: =RC1*R2C -> 4530 | I455: =RC1*R2C -> 4530 | J455: =RC1*R2C -> 4530 | K455: =RC1*R2C -> 4530 | L455: =RC1*R2C -> 4530 | M455: =RC1*R2C -> 4530
A456: 454 | B456: =RC1*R2C -> 4540 | C456: =RC1*R2C -> 4540 | D456: =RC1*R2C -> 4540 | E456: =RC1*R2C -> 4540 | F456: =RC1*R2C -> 4540 | G456: =RC1*R2C -> 4540 | H456: =RC1*R2C -> 4540 | I456: =RC1*R2C -> 4540 | J456: =RC1*R2C -> 4540 | K456: =RC1*R2C -> 4540 | L456: =RC1*R2C -> 4540 | M456: =RC1*R2C -> 4540
A457: 455 | B457: =RC1*R2C -> 4550 | C457: =RC1*R2C -> 4550 | D457: =RC1*R2C -> 4550 | E457: =RC1*R2C -> 4550 | F457: =RC1*R2C -> 4550 | G457: =RC1*R2C -> 4550 | H457: =RC1*R2C -> 4550 | I457: =RC1*R2C -> 4550 | J457: =RC1*R2C -> 4550 | K457: =RC1*R2C -> 4550 | L457: =RC1*R2C -> 4550 | M457: =RC1*R2C -> 4550
A458: 456 | B458: =RC1*R2C -> 4560 | C458: =RC1*R2C -> 4560 | D458: =RC1*R2C -> 4560 | E458: =RC1*R2C -> 4560 | F458: =RC1*R2C -> 4560 | G458: =RC1*R2C -> 4560 | H458: =RC1*R2C -> 4560 | I458: =RC1*R2C -> 4560 | J458: =RC1*R2C -> 4560 | K458: =RC1*R2C -> 4560 | L458: =RC1*R2C -> 4560 | M458: =RC1*R2C -> 4560
A459: 457 | B459: =RC1*R2C -> 4570 | C459: =RC1*R2C -> 4570 | D459: =RC1*R2C -> 4570 | E459: =RC1*R2C -> 4570 | F459: =RC1*R2C -> 4570 | G459: =RC1*R2C -> 4570 | H459: =RC1*R2C -> 4570 | I459: =RC1*R2C -> 4570 | J459: =RC1*R2C -> 4570 | K459: =RC1*R2C -> 4570 | L459: =RC1*R2C -> 4570 | M459: =RC1*R2C -> 4570
A460: 458 | B460: =RC1*R2C -> 4580 | C460: =RC1*R2C -> 4580 | D460: =RC1*R2C -> 4580 | E460: =RC1*R2C -> 4580 | F460: =RC1*R2C -> 4580 | G460: =RC1*R2C -> 4580 | H460: =RC1*R2C -> 4580 | I460: =RC1*R2C -> 4580 | J460: =RC1*R2C -> 4580 | K460: =RC1*R2C -> 4580 | L460: =RC1*R2C -> 4580 | M460: =RC1*R2C -> 4580
A461: 459 | B461: =RC1*R2C -> 4590 | C461: =RC1*R2C -> 4590 | D461: =RC1*R2C -> 4590 | E461: =RC1*R2C -> 4590 | F461: =RC1*R2C -> 4590 | G461: =RC1*R2C -> 4590 | H461: =RC1*R2C -> 4590 | I461: =RC1*R2C -> 4590 | J461: =RC1*R2C -> 4590 | K461: =RC1*R2C -> 4590 | L461: =RC1*R2C -> 4590 | M461: =RC1*R2C -> 4590
A462: 460 | B462: =RC1*R2C -> 4600 | C462: =RC1*R2C -> 4600 | D462: =RC1*R2C -> 4600 | E462: =RC1*R2C -> 4600 | F462: =RC1*R2C -> 4600 | G462: =RC1*R2C -> 4600 | H462: =RC1*R2C -> 4600 | I462: =RC1*R2C -> 4600 | J462: =RC1*R2C -> 4600 | K462: =RC1*R2C -> 4600 | L462: =RC1*R2C -> 4600 | M462: =RC1*R2C -> 4600
A463: 461 | B463: =RC1*R2C -> 4610 | C463: =RC1*R2C -> 4610 | D463: =RC1*R2C -> 4610 | E463: =RC1*R2C -> 4610 | F463: =RC1*R2C -> 4610 | G463: =RC1*R2C -> 4610 | H463: =RC1*R2C -> 4610 | I463: =RC1*R2C -> 4610 | J463: =RC1*R2C -> 4610 | K463: =RC1*R2C -> 4610 | L463: =RC1*R2C -> 4610 | M463: =RC1*R2C -> 4610
A464: 462 | B464: =RC1*R2C -> 4620 | C464: =RC1*R2C -> 4620 | D464: =RC1*R2C -> 4620 | E464: =RC1*R2C -> 4620 | F464: =RC1*R2C -> 4620 | G464: =RC1*R2C -> 4620 | H464: =RC1*R2C -> 4620 | I464: =RC1*R2C -> 4620 | J464: =RC1*R2C -> 4620 | K464: =RC1*R2C -> 4620 | L464: =RC1*R2C -> 4620 | M464: =RC1*R2C -> 4620
A465: 463 | B465: =RC1*R2C -> 4630 | C465: =RC1*R2C -> 4630 | D465: =RC1*R2C -> 4630 | E465: =RC1*R2C -> 4630 | F465: =RC1*R2C -> 4630 | G465: =RC1*R2C -> 4630 | H465: =RC1*R2C -> 4630 | I465: =RC1*R2C -> 4630 | J465: =RC1*R2C -> 4630 | K465: =RC1*R2C -> 4630 | L465: =RC1*R2C -> 4630 | M465: =RC1*R2C -> 4630
A466: 464 | B466: =RC1*R2C -> 4640 | C466: =RC1*R2C -> 4640 | D466: =RC1*R2C -> 4640 | E466: =RC1*R2C -> 4640 | F466: =RC1*R2C -> 4640 | G466: =RC1*R2C -> 4640 | H466: =RC1*R2C -> 4640 | I466: =RC1*R2C -> 4640 | J466: =RC1*R2C -> 4640 | K466: =RC1*R2C -> 4640 | L466: =RC1*R2C -> 4640 | M466: =RC1*R2C -> 4640
A467: 465 | B467: =RC1*R2C -> 4650 | C467: =RC1*R2C -> 4650 | D467: =RC1*R2C -> 4650 | E467: =RC1*R2C -> 4650 | F467: =RC1*R2C -> 4650 | G467: =RC1*R2C -> 4650 | H467: =RC1*R2C -> 4650 | I467: =RC1*R2C -> 4650 | J467: =RC1*R2C -> 4650 | K467: =RC1*R2C -> 4650 | L467: =RC1*R2C -> 4650 | M467: =RC1*R2C -> 4650
A468: 466 | B468: =RC1*R2C -> 4660 | C468: =RC1*R2C -> 4660 | D468: =RC1*R2C -> 4660 | E468: =RC1*R2C -> 4660 | F468: =RC1*R2C -> 4660 | G468: =RC1*R2C -> 4660 | H468: =RC1*R2C -> 4660 | I468: =RC1*R2C -> 4660 | J468: =RC1*R2C -> 4660 | K468: =RC1*R2C -> 4660 | L468: =RC1*R2C -> 4660 | M468: =RC1*R2C -> 4660
A469: 467 | B469: =RC1*R2C -> 4670 | C469: =RC1*R2C -> 4670 | D469: =RC1*R2C -> 4670 | E469: =RC1*R2C -> 4670 | F469: =RC1*R2C -> 4670 | G469: =RC1*R2C -> 4670 | H469: =RC1*R2C -> 4670 | I469: =RC1*R2C -> 4670 | J469: =RC1*R2C -> 4670 | K469: =RC1*R2C -> 4670 | L469: =RC1*R2C -> 4670 | M469: =RC1*R2C -> 4670
A470: 468 | B470: =RC1*R2C -> 4680 | C470: =RC1*R2C -> 4680 | D470: =RC1*R2C -> 4680 | E470: =RC1*R2C -> 4680 | F470: =RC1*R2C -> 4680 | G470: =RC1*R2C -> 4680 | H470: =RC1*R2C -> 4680 | I470: =RC1*R2C -> 4680 | J470: =RC1*R2C -> 4680 | K470: =RC1*R2C -> 4680 | L470: =RC1*R2C -> 4680 | M470: =RC1*R2C -> 4680
A471: 469 | B471: =RC1*R2C -> 4690 | C471: =RC1*R2C -> 4690 | D471: =RC1*R2C -> 4690 | E471: =RC1*R2C -> 4690 | F471: =RC1*R2C -> 4690 | G471: =RC1*R2C -> 4690 | H471: =RC1*R2C -> 4690 | I471: =RC1*R2C -> 4690 | J471: =RC1*R2C -> 4690 | K471: =RC1*R2C -> 4690 | L471: =RC1*R2C -> 4690 | M471: =RC1*R2C -> 4690
A472: 470 | B472: =RC1*R2C -> 4700 | C472: =RC1*R2C -> 4700 | D472: =RC1*R2C -> 4700 | E472: =RC1*R2C -> 4700 | F472: =RC1*R2C -> 4700 | G472: =RC1*R2C -> 4700 | H472: =RC1*R2C -> 4700 | I472: =RC1*R2C -> 4700 | J472: =RC1*R2C -> 4700 | K472: =RC1*R2C -> 4700 | L472: =RC1*R2C -> 4700 | M472: =RC1*R2C -> 4700
A473: 471 | B473: =RC1*R2C -> 4710 | C473: =RC1*R2C -> 4710 | D473: =RC1*R2C -> 4710 | E473: =RC1*R2C -> 4710 | F473: =RC1*R2C -> 4710 | G473: =RC1*R2C -> 4710 | H473: =RC1*R2C -> 4710 | I473: =RC1*R2C -> 4710 | J473: =RC1*R2C -> 4710 | K473: =RC1*R2C -> 4710 | L473: =RC1*R2C -> 4710 | M473: =RC1*R2C -> 4710
A474: 472 | B474: =RC1*R2C -> 4720 | C474: =RC1*R2C -> 4720 | D474: =RC1*R2C -> 4720 | E474: =RC1*R2C -> 4720 | F474: =RC1*R2C -> 4720 | G474: =RC1*R2C -> 4720 | H474: =RC1*R2C -> 4720 | I474: =RC1*R2C -> 4720 | J474: =RC1*R2C -> 4720 | K474: =RC1*R2C -> 4720 | L474: =RC1*R2C -> 4720 | M474: =RC1*R2C -> 4720
A475: 473 | B475: =RC1*R2C -> 4730 | C475: =RC1*R2C -> 4730 | D475: =RC1*R2C -> 4730 | E475: =RC1*R2C -> 4730 | F475: =RC1*R2C -> 4730 | G475: =RC1*R2C -> 4730 | H475: =RC1*R2C -> 4730 | I475: =RC1*R2C -> 4730 | J475: =RC1*R2C -> 4730 | K475: =RC1*R2C -> 4730 | L475: =RC1*R2C -> 4730 | M475: =RC1*R2C -> 4730
A476: 474 | B476: =RC1*R2C -> 4740 | C476: =RC1*R2C -> 4740 | D476: =RC1*R2C -> 4740 | E476: =RC1*R2C -> 4740 | F476: =RC1*R2C -> 4740 | G476: =RC1*R2C -> 4740 | H476: =RC1*R2C -> 4740 | I476: =RC1*R2C -> 4740 | J476: =RC1*R2C -> 4740 | K476: =RC1*R2C -> 4740 | L476: =RC1*R2C -> 4740 | M476: =RC1*R2C -> 4740
A477: 475 | B477: =RC1*R2C -> 4750 | C477: =RC1*R2C -> 4750 | D477: =RC1*R2C -> 4750 | E477: =RC1*R2C -> 4750 | F477: =RC1*R2C -> 4750 | G477: =RC1*R2C -> 4750 | H477: =RC1*R2C -> 4750 | I477: =RC1*R2C -> 4750 | J477: =RC1*R2C -> 4750 | K477: =RC1*R2C -> 4750 | L477: =RC1*R2C -> 4750 | M477: =RC1*R2C -> 4750
A478: 476 | B478: =RC1*R2C -> 4760 | C478: =RC1*R2C -> 4760 | D478: =RC1*R2C -> 4760 | E478: =RC1*R2C -> 4760 | F478: =RC1*R2C -> 4760 | G478: =RC1*R2C -> 4760 | H478: =RC1*R2C -> 4760 | I478: =RC1*R2C -> 4760 | J478: =RC1*R2C -> 4760 | K478: =RC1*R2C -> 4760 | L478: =RC1*R2C -> 4760 | M478: =RC1*R2C -> 4760
A479: 477 | B479: =RC1*R2C -> 4770 | C479: =RC1*R2C -> 4770 | D479: =RC1*R2C -> 4770 | E479: =RC1*R2C -> 4770 | F479: =RC1*R2C -> 4770 | G479: =RC1*R2C -> 4770 | H479: =RC1*R2C -> 4770 | I479: =RC1*R2C -> 4770 | J479: =RC1*R2C -> 4770 | K479: =RC1*R2C -> 4770 | L479: =RC1*R2C -> 4770 | M479: =RC1*R2C -> 4770
A480: 478 | B480: =RC1*R2C -> 4780 | C480: =RC1*R2C -> 4780 | D480: =RC1*R2C -> 4780 | E480: =RC1*R2C -> 4780 | F480: =RC1*R2C -> 4780 | G480: =RC1*R2C -> 4780 | H480: =RC1*R2C -> 4780 | I480: =RC1*R2C -> 4780 | J480: =RC1*R2C -> 4780 | K480: =RC1*R2C -> 4780 | L480: =RC1*R2C -> 4780 | M480: =RC1*R2C -> 4780
A481: 479 | B481: =RC1*R2C -> 4790 | C481: =RC1*R2C -> 4790 | D481: =RC1*R2C -> 4790 | E481: =RC1*R2C -> 4790 | F481: =RC1*R2C -> 4790 | G481: =RC1*R2C -> 4790 | H481: =RC1*R2C -> 4790 | I481: =RC1*R2C -> 4790 | J481: =RC1*R2C -> 4790 | K481: =RC1*R2C -> 4790 | L481: =RC1*R2C -> 4790 | M481: =RC1*R2C -> 4790
A482: 480 | B482: =RC1*R2C -> 4800 | C482: =RC1*R2C -> 4800 | D482: =RC1*R2C -> 4800 | E482: =RC1*R2C -> 4800 | F482: =RC1*R2C -> 4800 | G482: =RC1*R2C -> 4800 | H482: =RC1*R2C -> 4800 | I482: =RC1*R2C -> 4800 | J482: =RC1*R2C -> 4800 | K482: =RC1*R2C -> 4800 | L482: =RC1*R2C -> 4800 | M482: =RC1*R2C -> 4800
A483: 481 | B483: =RC1*R2C -> 4810 | C483: =RC1*R2C -> 4810 | D483: =RC1*R2C -> 4810 | E483: =RC1*R2C -> 4810 | F483: =RC1*R2C -> 4810 | G483: =RC1*R2C -> 4810 | H483: =RC1*R2C -> 4810 | I483: =RC1*R2C -> 4810 | J483: =RC1*R2C -> 4810 | K483: =RC1*R2C -> 4810 | L483: =RC1*R2C -> 4810 | M483: =RC1*R2C -> 4810
A484: 482 | B484: =RC1*R2C -> 4820 | C484: =RC1*R2C -> 4820 | D484: =RC1*R2C -> 4820 | E484: =RC1*R2C -> 4820 | F484: =RC1*R2C -> 4820 | G484: =RC1*R2C -> 4820 | H484: =RC1*R2C -> 4820 | I484: =RC1*R2C -> 4820 | J484: =RC1*R2C -> 4820 | K484: =RC1*R2C -> 4820 | L484: =RC1*R2C -> 4820 | M484: =RC1*R2C -> 4820
A485: 483 | B485: =RC1*R2C -> 4830 | C485: =RC1*R2C -> 4830 | D485: =RC1*R2C -> 4830 | E485: =RC1*R2C -> 4830 | F485: =RC1*R2C -> 4830 | G485: =RC1*R2C -> 4830 | H485: =RC1*R2C -> 4830 | I485: =RC1*R2C -> 4830 | J485: =RC1*R2C -> 4830 | K485: =RC1*R2C -> 4830 | L485: =RC1*R2C -> 4830 | M485: =RC1*R2C -> 4830
A486: 484 | B486: =RC1*R2C -> 4840 | C486: =RC1*R2C -> 4840 | D486: =RC1*R2C -> 4840 | E486: =RC1*R2C -> 4840 | F486: =RC1*R2C -> 4840 | G486: =RC1*R2C -> 4840 | H486: =RC1*R2C -> 4840 | I486: =RC1*R2C -> 4840 | J486: =RC1*R2C -> 4840 | K486: =RC1*R2C -> 4840 | L486: =RC1*R2C -> 4840 | M486: =RC1*R2C -> 4840
A487: 485 | B487: =RC1*R2C -> 4850 | C487: =RC1*R2C -> 4850 | D487: =RC1*R2C -> 4850 | E487: =RC1*R2C -> 4850 | F487: =RC1*R2C -> 4850 | G487: =RC1*R2C -> 4850 | H487: =RC1*R2C -> 4850 | I487: =RC1*R2C -> 4850 | J487: =RC1*R2C -> 4850 | K487: =RC1*R2C -> 4850 | L487: =RC1*R2C -> 4850 | M487: =RC1*R2C -> 4850
A488: 486 | B488: =RC1*R2C -> 4860 | C488: =RC1*R2C -> 4860 | D488: =RC1*R2C -> 4860 | E488: =RC1*R2C -> 4860 | F488: =RC1*R2C -> 4860 | G488: =RC1*R2C -> 4860 | H488: =RC1*R2C -> 4860 | I488: =RC1*R2C -> 4860 | J488: =RC1*R2C -> 4860 | K488: =RC1*R2C -> 4860 | L488: =RC1*R2C -> 4860 | M488: =RC1*R2C -> 4860
A489: 487 | B489: =RC1*R2C -> 4870 | C489: =RC1*R2C -> 4870 | D489: =RC1*R2C -> 4870 | E489: =RC1*R2C -> 4870 | F489: =RC1*R2C -> 4870 | G489: =RC1*R2C -> 4870 | H489: =RC1*R2C -> 4870 | I489: =RC1*R2C -> 4870 | J489: =RC1*R2C -> 4870 | K489: =RC1*R2C -> 4870 | L489: =RC1*R2C -> 4870 | M489: =RC1*R2C -> 4870
A490: 488 | B490: =RC1*R2C -> 4880 | C490: =RC1*R2C -> 4880 | D490: =RC1*R2C -> 4880 | E490: =RC1*R2C -> 4880 | F490: =RC1*R2C -> 4880 | G490: =RC1*R2C -> 4880 | H490: =RC1*R2C -> 4880 | I490: =RC1*R2C -> 4880 | J490: =RC1*R2C -> 4880 | K490: =RC1*R2C -> 4880 | L490: =RC1*R2C -> 4880 | M490: =RC1*R2C -> 4880
A491: 489 | B491: =RC1*R2C -> 4890 | C491: =RC1*R2C -> 4890 | D491: =RC1*R2C -> 4890 | E491: =RC1*R2C -> 4890 | F491: =RC1*R2C -> 4890 | G491: =RC1*R2C -> 4890 | H491: =RC1*R2C -> 4890 | I491: =RC1*R2C -> 4890 | J491: =RC1*R2C -> 4890 | K491: =RC1*R2C -> 4890 | L491: =RC1*R2C -> 4890 | M491: =RC1*R2C -> 4890
A492: 490 | B492: =RC1*R2C -> 4900 | C492: =RC1*R2C -> 4900 | D492: =RC1*R2C -> 4900 | E492: =RC1*R2C -> 4900 | F492: =RC1*R2C -> 4900 | G492: =RC1*R2C -> 4900 | H492: =RC1*R2C -> 4900 | I492: =RC1*R2C -> 4900 | J492: =RC1*R2C -> 4900 | K492: =RC1*R2C -> 4900 | L492: =RC1*R2C -> 4900 | M492: =RC1*R2C -> 4900
A493: 491 | B493: =RC1*R2C -> 4910 | C493: =RC1*R2C -> 4910 | D493: =RC1*R2C -> 4910 | E493: =RC1*R2C -> 4910 | F493: =RC1*R2C -> 4910 | G493: =RC1*R2C -> 4910 | H493: =RC1*R2C -> 4910 | I493: =RC1*R2C -> 4910 | J493: =RC1*R2C -> 4910 | K493: =RC1*R2C -> 4910 | L493: =RC1*R2C -> 4910 | M493: =RC1*R2C -> 4910
A494: 492 | B494: =RC1*R2C -> 4920 | C494: =RC1*R2C -> 4920 | D494: =RC1*R2C -> 4920 | E494: =RC1*R2C -> 4920 | F494: =RC1*R2C -> 4920 | G494: =RC1*R2C -> 4920 | H494: =RC1*R2C -> 4920 | I494: =RC1*R2C -> 4920 | J494: =RC1*R2C -> 4920 | K494: =RC1*R2C -> 4920 | L494: =RC1*R2C -> 4920 | M494: =RC1*R2C -> 4920
A495: 493 | B495: =RC1*R2C -> 4930 | C495: =RC1*R2C -> 4930 | D495: =RC1*R2C -> 4930 | E495: =RC1*R2C -> 4930 | F495: =RC1*R2C -> 4930 | G495: =RC1*R2C -> 4930 | H495: =RC1*R2C -> 4930 | I495: =RC1*R2C -> 4930 | J495: =RC1*R2C -> 4930 | K495: =RC1*R2C -> 4930 | L495: =RC1*R2C -> 4930 | M495: =RC1*R2C -> 4930
A496: 494 | B496: =RC1*R2C -> 4940 | C496: =RC1*R2C -> 4940 | D496: =RC1*R2C -> 4940 | E496: =RC1*R2C -> 4940 | F496: =RC1*R2C -> 4940 | G496: =RC1*R2C -> 4940 | H496: =RC1*R2C -> 4940 | I496: =RC1*R2C -> 4940 | J496: =RC1*R2C -> 4940 | K496: =RC1*R2C -> 4940 | L496: =RC1*R2C -> 4940 | M496: =RC1*R2C -> 4940
A497: 495 | B497: =RC1*R2C -> 4950 | C497: =RC1*R2C -> 4950 | D497: =RC1*R2C -> 4950 | E497: =RC1*R2C -> 4950 | F497: =RC1*R2C -> 4950 | G497: =RC1*R2C -> 4950 | H497: =RC1*R2C -> 4950 | I497: =RC1*R2C -> 4950 | J497: =RC1*R2C -> 4950 | K497: =RC1*R2C -> 4950 | L497: =RC1*R2C -> 4950 | M497: =RC1*R2C -> 4950
A498: 496 | B498: =RC1*R2C -> 4960 | C498: =RC1*R2C -> 4960 | D498: =RC1*R2C -> 4960 | E498: =RC1*R2C -> 4960 | F498: =RC1*R2C -> 4960 | G498: =RC1*R2C -> 4960 | H498: =RC1*R2C -> 4960 | I498: =RC1*R2C -> 4960 | J498: =RC1*R2C -> 4960 | K498: =RC1*R2C -> 4960 | L498: =RC1*R2C -> 4960 | M498: =RC1*R2C -> 4960
A499: 497 | B499: =RC1*R2C -> 4970 | C499: =RC1*R2C -> 4970 | D499: =RC1*R2C -> 4970 | E499: =RC1*R2C -> 4970 | F499: =RC1*R2C -> 4970 | G499: =RC1*R2C -> 4970 | H499: =RC1*R2C -> 4970 | I499: =RC1*R2C -> 4970 | J499: =RC1*R2C -> 4970 | K499: =RC1*R2C -> 4970 | L499: =RC1*R2C -> 4970 | M499: =RC1*R2C -> 4970
A500: 498 | B500: =RC1*R2C -> 4980 | C500: =RC1*R2C -> 4980 | D500: =RC1*R2C -> 4980 | E500: =RC1*R2C -> 4980 | F500: =RC1*R2C -> 4980 | G500: =RC1*R2C -> 4980 | H500: =RC1*R2C -> 4980 | I500: =RC1*R2C -> 4980 | J500: =RC1*R2C -> 4980 | K500: =RC1*R2C -> 4980 | L500: =RC1*R2C -> 4980 | M500: =RC1*R2C -> 4980
A501: 499 | B501: =RC1*R2C -> 4990 | C501: =RC1*R2C -> 4990 | D501: =RC1*R2C -> 4990 | E501: =RC1*R2C -> 4990 | F501: =RC1*R2C -> 4990 | G501: =RC1*R2C -> 4990 | H501: =RC1*R2C -> 4990 | I501: =RC1*R2C -> 4990 | J501: =RC1*R2C -> 4990 | K501: =RC1*R2C -> 4990 | L501: =RC1*R2C -> 4990 | M501: =RC1*R2C -> 4990
A502: 500 | B502: =RC1*R2C -> 5000 | C502: =RC1*R2C -> 5000 | D502: =RC1*R2C -> 5000 | E502: =RC1*R2C -> 5000 | F502: =RC1*R2C -> 5000 | G502: =RC1*R2C -> 5000 | H502: =RC1*R2C -> 5000 | I502: =RC1*R2C -> 5000 | J502: =RC1*R2C -> 5000 | K502: =RC1*R2C -> 5000 | L502: =RC1*R2C -> 5000 | M502: =RC1*R2C -> 5000
B503: =RC1*R2C -> 0 | C503: =RC1*R2C -> 0 | D503: =RC1*R2C -> 0 | E503: =RC1*R2C -> 0 | F503: =RC1*R2C -> 0 | G503: =RC1*R2C -> 0 | H503: =RC1*R2C -> 0 | I503: =RC1*R2C -> 0 | J503: =RC1*R2C -> 0 | K503: =RC1*R2C -> 0 | L503: =RC1*R2C -> 0 | M503: =RC1*R2C -> 0
B504: =RC1*R2C -> 0 | C504: =RC1*R2C -> 0 | D504: =RC1*R2C -> 0 | E504: =RC1*R2C -> 0 | F504: =RC1*R2C -> 0 | G504: =RC1*R2C -> 0 | H504: =RC1*R2C -> 0 | I504: =RC1*R2C -> 0 | J504: =RC1*R2C -> 0 | K504: =RC1*R2C -> 0 | L504: =RC1*R2C -> 0 | M504: =RC1*R2C -> 0
B505: =RC1*R2C -> 0 | C505: =RC1*R2C -> 0 | D505: =RC1*R2C -> 0 | E505: =RC1*R2C -> 0 | F505: =RC1*R2C -> 0 | G505: =RC1*R2C -> 0 | H505: =RC1*R2C -> 0 | I505: =RC1*R2C -> 0 | J505: =RC1*R2C -> 0 | K505: =RC1*R2C -> 0 | L505: =RC1*R2C -> 0 | M505: =RC1*R2C -> 0
B506: =RC1*R2C -> 0 | C506: =RC1*R2C -> 0 | D506: =RC1*R2C -> 0 | E506: =RC1*R2C -> 0 | F506: =RC1*R2C -> 0 | G506: =RC1*R2C -> 0 | H506: =RC1*R2C -> 0 | I506: =RC1*R2C -> 0 | J506: =RC1*R2C -> 0 | K506: =RC1*R2C -> 0 | L506: =RC1*R2C -> 0 | M506: =RC1*R2C -> 0
B507: =RC1*R2C -> 0 | C507: =RC1*R2C -> 0 | D507: =RC1*R2C -> 0 | E507: =RC1*R2C -> 0 | F507: =RC1*R2C -> 0 | G507: =RC1*R2C -> 0 | H507: =RC1*R2C -> 0 | I507: =RC1*R2C -> 0 | J507: =RC1*R2C -> 0 | K507: =RC1*R2C -> 0 | L507: =RC1*R2C -> 0 | M507: =RC1*R2C -> 0
B508: =RC1*R2C -> 0 | C508: =RC1*R2C -> 0 | D508: =RC1*R2C -> 0 | E508: =RC1*R2C -> 0 | F508: =RC1*R2C -> 0 | G508: =RC1*R2C -> 0 | H508: =RC1*R2C -> 0 | I508: =RC1*R2C -> 0 | J508: =RC1*R2C -> 0 | K508: =RC1*R2C -> 0 | L508: =RC1*R2C -> 0 | M508: =RC1*R2C -> 0
B509: =RC1*R2C -> 0 | C509: =RC1*R2C -> 0 | D509: =RC1*R2C -> 0 | E509: =RC1*R2C -> 0 | F509: =RC1*R2C -> 0 | G509: =RC1*R2C -> 0 | H509: =RC1*R2C -> 0 | I509: =RC1*R2C -> 0 | J509: =RC1*R2C -> 0 | K509: =RC1*R2C -> 0 | L509: =RC1*R2C -> 0 | M509: =RC1*R2C -> 0
B510: =RC1*R2C -> 0 | C510: =RC1*R2C -> 0 | D510: =RC1*R2C -> 0 | E510: =RC1*R2C -> 0 | F510: =RC1*R2C -> 0 | G510: =RC1*R2C -> 0 | H510: =RC1*R2C -> 0 | I510: =RC1*R2C -> 0 | J510: =RC1*R2C -> 0 | K510: =RC1*R2C -> 0 | L510: =RC1*R2C -> 0 | M510: =RC1*R2C -> 0
B511: =RC1*R2C -> 0 | C511: =RC1*R2C -> 0 | D511: =RC1*R2C -> 0 | E511: =RC1*R2C -> 0 | F511: =RC1*R2C -> 0 | G511: =RC1*R2C -> 0 | H511: =RC1*R2C -> 0 | I511: =RC1*R2C -> 0 | J511: =RC1*R2C -> 0 | K511: =RC1*R2C -> 0 | L511: =RC1*R2C -> 0 | M511: =RC1*R2C -> 0
B512: =RC1*R2C -> 0 | C512: =RC1*R2C -> 0 | D512: =RC1*R2C -> 0 | E512: =RC1*R2C -> 0 | F512: =RC1*R2C -> 0 | G512: =RC1*R2C -> 0 | H512: =RC1*R2C -> 0 | I512: =RC1*R2C -> 0 | J512: =RC1*R2C -> 0 | K512: =RC1*R2C -> 0 | L512: =RC1*R2C -> 0 | M512: =RC1*R2C -> 0
B513: =RC1*R2C -> 0 | C513: =RC1*R2C -> 0 | D513: =RC1*R2C -> 0 | E513: =RC1*R2C -> 0 | F513: =RC1*R2C -> 0 | G513: =RC1*R2C -> 0 | H513: =RC1*R2C -> 0 | I513: =RC1*R2C -> 0 | J513: =RC1*R2C -> 0 | K513: =RC1*R2C -> 0 | L513: =RC1*R2C -> 0 | M513: =RC1*R2C -> 0
B514: =RC1*R2C -> 0 | C514: =RC1*R2C -> 0 | D514: =RC1*R2C -> 0 | E514: =RC1*R2C -> 0 | F514: =RC1*R2C -> 0 | G514: =RC1*R2C -> 0 | H514: =RC1*R2C -> 0 | I514: =RC1*R2C -> 0 | J514: =RC1*R2C -> 0 | K514: =RC1*R2C -> 0 | L514: =RC1*R2C -> 0 | M514: =RC1*R2C -> 0
B515: =RC1*R2C -> 0 | C515: =RC1*R2C -> 0 | D515: =RC1*R2C -> 0 | E515: =RC1*R2C -> 0 | F515: =RC1*R2C -> 0 | G515: =RC1*R2C -> 0 | H515: =RC1*R2C -> 0 | I515: =RC1*R2C -> 0 | J515: =RC1*R2C -> 0 | K515: =RC1*R2C -> 0 | L515: =RC1*R2C -> 0 | M515: =RC1*R2C -> 0
B516: =RC1*R2C -> 0 | C516: =RC1*R2C -> 0 | D516: =RC1*R2C -> 0 | E516: =RC1*R2C -> 0 | F516: =RC1*R2C -> 0 | G516: =RC1*R2C -> 0 | H516: =RC1*R2C -> 0 | I516: =RC1*R2C -> 0 | J516: =RC1*R2C -> 0 | K516: =RC1*R2C -> 0 | L516: =RC1*R2C -> 0 | M516: =RC1*R2C -> 0
B517: =RC1*R2C -> 0 | C517: =RC1*R2C -> 0 | D517: =RC1*R2C -> 0 | E517: =RC1*R2C -> 0 | F517: =RC1*R2C -> 0 | G517: =RC1*R2C -> 0 | H517: =RC1*R2C -> 0 | I517: =RC1*R2C -> 0 | J517: =RC1*R2C -> 0 | K517: =RC1*R2C -> 0 | L517: =RC1*R2C -> 0 | M517: =RC1*R2C -> 0
B518: =RC1*R2C -> 0 | C518: =RC1*R2C -> 0 | D518: =RC1*R2C -> 0 | E518: =RC1*R2C -> 0 | F518: =RC1*R2C -> 0 | G518: =RC1*R2C -> 0 | H518: =RC1*R2C -> 0 | I518: =RC1*R2C -> 0 | J518: =RC1*R2C -> 0 | K518: =RC1*R2C -> 0 | L518: =RC1*R2C -> 0 | M518: =RC1*R2C -> 0
B519: =RC1*R2C -> 0 | C519: =RC1*R2C -> 0 | D519: =RC1*R2C -> 0 | E519: =RC1*R2C -> 0 | F519: =RC1*R2C -> 0 | G519: =RC1*R2C -> 0 | H519: =RC1*R2C -> 0 | I519: =RC1*R2C -> 0 | J519: =RC1*R2C -> 0 | K519: =RC1*R2C -> 0 | L519: =RC1*R2C -> 0 | M519: =RC1*R2C -> 0
B520: =RC1*R2C -> 0 | C520: =RC1*R2C -> 0 | D520: =RC1*R2C -> 0 | E520: =RC1*R2C -> 0 | F520: =RC1*R2C -> 0 | G520: =RC1*R2C -> 0 | H520: =RC1*R2C -> 0 | I520: =RC1*R2C -> 0 | J520: =RC1*R2C -> 0 | K520: =RC1*R2C -> 0 | L520: =RC1*R2C -> 0 | M520: =RC1*R2C -> 0
B521: =RC1*R2C -> 0 | C521: =RC1*R2C -> 0 | D521: =RC1*R2C -> 0 | E521: =RC1*R2C -> 0 | F521: =RC1*R2C -> 0 | G521: =RC1*R2C -> 0 | H521: =RC1*R2C -> 0 | I521: =RC1*R2C -> 0 | J521: =RC1*R2C -> 0 | K521: =RC1*R2C -> 0 | L521: =RC1*R2C -> 0 | M521: =RC1*R2C -> 0
B522: =RC1*R2C -> 0 | C522: =RC1*R2C -> 0 | D522: =RC1*R2C -> 0 | E522: =RC1*R2C -> 0 | F522: =RC1*R2C -> 0 | G522: =RC1*R2C -> 0 | H522: =RC1*R2C -> 0 | I522: =RC1*R2C -> 0 | J522: =RC1*R2C -> 0 | K522: =RC1*R2C -> 0 | L522: =RC1*R2C -> 0 | M522: =RC1*R2C -> 0
B523: =RC1*R2C -> 0 | C523: =RC1*R2C -> 0 | D523: =RC1*R2C -> 0 | E523: =RC1*R2C -> 0 | F523: =RC1*R2C -> 0 | G523: =RC1*R2C -> 0 | H523: =RC1*R2C -> 0 | I523: =RC1*R2C -> 0 | J523: =RC1*R2C -> 0 | K523: =RC1*R2C -> 0 | L523: =RC1*R2C -> 0 | M523: =RC1*R2C -> 0
B524: =RC1*R2C -> 0 | C524: =RC1*R2C -> 0 | D524: =RC1*R2C -> 0 | E524: =RC1*R2C -> 0 | F524: =RC1*R2C -> 0 | G524: =RC1*R2C -> 0 | H524: =RC1*R2C -> 0 | I524: =RC1*R2C -> 0 | J524: =RC1*R2C -> 0 | K524: =RC1*R2C -> 0 | L524: =RC1*R2C -> 0 | M524: =RC1*R2C -> 0
B525: =RC1*R2C -> 0 | C525: =RC1*R2C -> 0 | D525: =RC1*R2C -> 0 | E525: =RC1*R2C -> 0 | F525: =RC1*R2C -> 0 | G525: =RC1*R2C -> 0 | H525: =RC1*R2C -> 0 | I525: =RC1*R2C -> 0 | J525: =RC1*R2C -> 0 | K525: =RC1*R2C -> 0 | L525: =RC1*R2C -> 0 | M525: =RC1*R2C -> 0
B526: =RC1*R2C -> 0 | C526: =RC1*R2C -> 0 | D526: =RC1*R2C -> 0 | E526: =RC1*R2C -> 0 | F526: =RC1*R2C -> 0 | G526: =RC1*R2C -> 0 | H526: =RC1*R2C -> 0 | I526: =RC1*R2C -> 0 | J526: =RC1*R2C -> 0 | K526: =RC1*R2C -> 0 | L526: =RC1*R2C -> 0 | M526: =RC1*R2C -> 0
B527: =RC1*R2C -> 0 | C527: =RC1*R2C -> 0 | D527: =RC1*R2C -> 0 | E527: =RC1*R2C -> 0 | F527: =RC1*R2C -> 0 | G527: =RC1*R2C -> 0 | H527: =RC1*R2C -> 0 | I527: =RC1*R2C -> 0 | J527: =RC1*R2C -> 0 | K527: =RC1*R2C -> 0 | L527: =RC1*R2C -> 0 | M527: =RC1*R2C -> 0
B528: =RC1*R2C -> 0 | C528: =RC1*R2C -> 0 | D528: =RC1*R2C -> 0 | E528: =RC1*R2C -> 0 | F528: =RC1*R2C -> 0 | G528: =RC1*R2C -> 0 | H528: =RC1*R2C -> 0 | I528: =RC1*R2C -> 0 | J528: =RC1*R2C -> 0 | K528: =RC1*R2C -> 0 | L528: =RC1*R2C -> 0 | M528: =RC1*R2C -> 0
B529: =RC1*R2C -> 0 | C529: =RC1*R2C -> 0 | D529: =RC1*R2C -> 0 | E529: =RC1*R2C -> 0 | F529: =RC1*R2C -> 0 | G529: =RC1*R2C -> 0 | H529: =RC1*R2C -> 0 | I529: =RC1*R2C -> 0 | J529: =RC1*R2C -> 0 | K529: =RC1*R2C -> 0 | L529: =RC1*R2C -> 0 | M529: =RC1*R2C -> 0
B530: =RC1*R2C -> 0 | C530: =RC1*R2C -> 0 | D530: =RC1*R2C -> 0 | E530: =RC1*R2C -> 0 | F530: =RC1*R2C -> 0 | G530: =RC1*R2C -> 0 | H530: =RC1*R2C -> 0 | I530: =RC1*R2C -> 0 | J530: =RC1*R2C -> 0 | K530: =RC1*R2C -> 0 | L530: =RC1*R2C -> 0 | M530: =RC1*R2C -> 0
B531: =RC1*R2C -> 0 | C531: =RC1*R2C -> 0 | D531: =RC1*R2C -> 0 | E531: =RC1*R2C -> 0 | F531: =RC1*R2C -> 0 | G531: =RC1*R2C -> 0 | H531: =RC1*R2C -> 0 | I531: =RC1*R2C -> 0 | J531: =RC1*R2C -> 0 | K531: =RC1*R2C -> 0 | L531: =RC1*R2C -> 0 | M531: =RC1*R2C -> 0
B532: =RC1*R2C -> 0 | C532: =RC1*R2C -> 0 | D532: =RC1*R2C -> 0 | E532: =RC1*R2C -> 0 | F532: =RC1*R2C -> 0 | G532: =RC1*R2C -> 0 | H532: =RC1*R2C -> 0 | I532: =RC1*R2C -> 0 | J532: =RC1*R2C -> 0 | K532: =RC1*R2C -> 0 | L532: =RC1*R2C -> 0 | M532: =RC1*R2C -> 0
B533: =RC1*R2C -> 0 | C533: =RC1*R2C -> 0 | D533: =RC1*R2C -> 0 | E533: =RC1*R2C -> 0 | F533: =RC1*R2C -> 0 | G533: =RC1*R2C -> 0 | H533: =RC1*R2C -> 0 | I533: =RC1*R2C -> 0 | J533: =RC1*R2C -> 0 | K533: =RC1*R2C -> 0 | L533: =RC1*R2C -> 0 | M533: =RC1*R2C -> 0
B534: =RC1*R2C -> 0 | C534: =RC1*R2C -> 0 | D534: =RC1*R2C -> 0 | E534: =RC1*R2C -> 0 | F534: =RC1*R2C -> 0 | G534: =RC1*R2C -> 0 | H534: =RC1*R2C -> 0 | I534: =RC1*R2C -> 0 | J534: =RC1*R2C -> 0 | K534: =RC1*R2C -> 0 | L534: =RC1*R2C -> 0 | M534: =RC1*R2C -> 0
B535: =RC1*R2C -> 0 | C535: =RC1*R2C -> 0 | D535: =RC1*R2C -> 0 | E535: =RC1*R2C -> 0 | F535: =RC1*R2C -> 0 | G535: =RC1*R2C -> 0 | H535: =RC1*R2C -> 0 | I535: =RC1*R2C -> 0 | J535: =RC1*R2C -> 0 | K535: =RC1*R2C -> 0 | L535: =RC1*R2C -> 0 | M535: =RC1*R2C -> 0
B536: =RC1*R2C -> 0 | C536: =RC1*R2C -> 0 | D536: =RC1*R2C -> 0 | E536: =RC1*R2C -> 0 | F536: =RC1*R2C -> 0 | G536: =RC1*R2C -> 0 | H536: =RC1*R2C -> 0 | I536: =RC1*R2C -> 0 | J536: =RC1*R2C -> 0 | K536: =RC1*R2C -> 0 | L536: =RC1*R2C -> 0 | M536: =RC1*R2C -> 0
B537: =RC1*R2C -> 0 | C537: =RC1*R2C -> 0 | D537: =RC1*R2C -> 0 | E537: =RC1*R2C -> 0 | F537: =RC1*R2C -> 0 | G537: =RC1*R2C -> 0 | H537: =RC1*R2C -> 0 | I537: =RC1*R2C -> 0 | J537: =RC1*R2C -> 0 | K537: =RC1*R2C -> 0 | L537: =RC1*R2C -> 0 | M537: =RC1*R2C -> 0
B538: =RC1*R2C -> 0 | C538: =RC1*R2C -> 0 | D538: =RC1*R2C -> 0 | E538: =RC1*R2C -> 0 | F538: =RC1*R2C -> 0 | G538: =RC1*R2C -> 0 | H538: =RC1*R2C -> 0 | I538: =RC1*R2C -> 0 | J538: =RC1*R2C -> 0 | K538: =RC1*R2C -> 0 | L538: =RC1*R2C -> 0 | M538: =RC1*R2C -> 0
B539: =RC1*R2C -> 0 | C539: =RC1*R2C -> 0 | D539: =RC1*R2C -> 0 | E539: =RC1*R2C -> 0 | F539: =RC1*R2C -> 0 | G539: =RC1*R2C -> 0 | H539: =RC1*R2C -> 0 | I539: =RC1*R2C -> 0 | J539: =RC1*R2C -> 0 | K539: =RC1*R2C -> 0 | L539: =RC1*R2C -> 0 | M539: =RC1*R2C -> 0
B540: =RC1*R2C -> 0 | C540: =RC1*R2C -> 0 | D540: =RC1*R2C -> 0 | E540: =RC1*R2C -> 0 | F540: =RC1*R2C -> 0 | G540: =RC1*R2C -> 0 | H540: =RC1*R2C -> 0 | I540: =RC1*R2C -> 0 | J540: =RC1*R2C -> 0 | K540: =RC1*R2C -> 0 | L540: =RC1*R2C -> 0 | M540: =RC1*R2C -> 0
B541: =RC1*R2C -> 0 | C541: =RC1*R2C -> 0 | D541: =RC1*R2C -> 0 | E541: =RC1*R2C -> 0 | F541: =RC1*R2C -> 0 | G541: =RC1*R2C -> 0 | H541: =RC1*R2C -> 0 | I541: =RC1*R2C -> 0 | J541: =RC1*R2C -> 0 | K541: =RC1*R2C -> 0 | L541: =RC1*R2C -> 0 | M541: =RC1*R2C -> 0
B542: =RC1*R2C -> 0 | C542: =RC1*R2C -> 0 | D542: =RC1*R2C -> 0 | E542: =RC1*R2C -> 0 | F542: =RC1*R2C -> 0 | G542: =RC1*R2C -> 0 | H542: =RC1*R2C -> 0 | I542: =RC1*R2C -> 0 | J542: =RC1*R2C -> 0 | K542: =RC1*R2C -> 0 | L542: =RC1*R2C -> 0 | M542: =RC1*R2C -> 0
B543: =RC1*R2C -> 0 | C543: =RC1*R2C -> 0 | D543: =RC1*R2C -> 0 | E543: =RC1*R2C -> 0 | F543: =RC1*R2C -> 0 | G543: =RC1*R2C -> 0 | H543: =RC1*R2C -> 0 | I543: =RC1*R2C -> 0 | J543: =RC1*R2C -> 0 | K543: =RC1*R2C -> 0 | L543: =RC1*R2C -> 0 | M543: =RC1*R2C -> 0
B544: =RC1*R2C -> 0 | C544: =RC1*R2C -> 0 | D544: =RC1*R2C -> 0 | E544: =RC1*R2C -> 0 | F544: =RC1*R2C -> 0 | G544: =RC1*R2C -> 0 | H544: =RC1*R2C -> 0 | I544: =RC1*R2C -> 0 | J544: =RC1*R2C -> 0 | K544: =RC1*R2C -> 0 | L544: =RC1*R2C -> 0 | M544: =RC1*R2C -> 0
B545: =RC1*R2C -> 0 | C545: =RC1*R2C -> 0 | D545: =RC1*R2C -> 0 | E545: =RC1*R2C -> 0 | F545: =RC1*R2C -> 0 | G545: =RC1*R2C -> 0 | H545: =RC1*R2C -> 0 | I545: =RC1*R2C -> 0 | J545: =RC1*R2C -> 0 | K545: =RC1*R2C -> 0 | L545: =RC1*R2C -> 0 | M545: =RC1*R2C -> 0
B546: =RC1*R2C -> 0 | C546: =RC1*R2C -> 0 | D546: =RC1*R2C -> 0 | E546: =RC1*R2C -> 0 | F546: =RC1*R2C -> 0 | G546: =RC1*R2C -> 0 | H546: =RC1*R2C -> 0 | I546: =RC1*R2C -> 0 | J546: =RC1*R2C -> 0 | K546: =RC1*R2C -> 0 | L546: =RC1*R2C -> 0 | M546: =RC1*R2C -> 0
B547: =RC1*R2C -> 0 | C547: =RC1*R2C -> 0 | D547: =RC1*R2C -> 0 | E547: =RC1*R2C -> 0 | F547: =RC1*R2C -> 0 | G547: =RC1*R2C -> 0 | H547: =RC1*R2C -> 0 | I547: =RC1*R2C -> 0 | J547: =RC1*R2C -> 0 | K547: =RC1*R2C -> 0 | L547: =RC1*R2C -> 0 | M547: =RC1*R2C -> 0
B548: =RC1*R2C -> 0 | C548: =RC1*R2C -> 0 | D548: =RC1*R2C -> 0 | E548: =RC1*R2C -> 0 | F548: =RC1*R2C -> 0 | G548: =RC1*R2C -> 0 | H548: =RC1*R2C -> 0 | I548: =RC1*R2C -> 0 | J548: =RC1*R2C -> 0 | K548: =RC1*R2C -> 0 | L548: =RC1*R2C -> 0 | M548: =RC1*R2C -> 0
B549: =RC1*R2C -> 0 | C549: =RC1*R2C -> 0 | D549: =RC1*R2C -> 0 | E549: =RC1*R2C -> 0 | F549: =RC1*R2C -> 0 | G549: =RC1*R2C -> 0 | H549: =RC1*R2C -> 0 | I549: =RC1*R2C -> 0 | J549: =RC1*R2C -> 0 | K549: =RC1*R2C -> 0 | L549: =RC1*R2C -> 0 | M549: =RC1*R2C -> 0
B550: =RC1*R2C -> 0 | C550: =RC1*R2C -> 0 | D550: =RC1*R2C -> 0 | E550: =RC1*R2C -> 0 | F550: =RC1*R2C -> 0 | G550: =RC1*R2C -> 0 | H550: =RC1*R2C -> 0 | I550: =RC1*R2C -> 0 | J550: =RC1*R2C -> 0 | K550: =RC1*R2C -> 0 | L550: =RC1*R2C -> 0 | M550: =RC1*R2C -> 0
B551: =RC1*R2C -> 0 | C551: =RC1*R2C -> 0 | D551: =RC1*R2C -> 0 | E551: =RC1*R2C -> 0 | F551: =RC1*R2C -> 0 | G551: =RC1*R2C -> 0 | H551: =RC1*R2C -> 0 | I551: =RC1*R2C -> 0 | J551: =RC1*R2C -> 0 | K551: =RC1*R2C -> 0 | L551: =RC1*R2C -> 0 | M551: =RC1*R2C -> 0
B552: =RC1*R2C -> 0 | C552: =RC1*R2C -> 0 | D552: =RC1*R2C -> 0 | E552: =RC1*R2C -> 0 | F552: =RC1*R2C -> 0 | G552: =RC1*R2C -> 0 | H552: =RC1*R2C -> 0 | I552: =RC1*R2C -> 0 | J552: =RC1*R2C -> 0 | K552: =RC1*R2C -> 0 | L552: =RC1*R2C -> 0 | M552: =RC1*R2C -> 0
B553: =RC1*R2C -> 0 | C553: =RC1*R2C -> 0 | D553: =RC1*R2C -> 0 | E553: =RC1*R2C -> 0 | F553: =RC1*R2C -> 0 | G553: =RC1*R2C -> 0 | H553: =RC1*R2C -> 0 | I553: =RC1*R2C -> 0 | J553: =RC1*R2C -> 0 | K553: =RC1*R2C -> 0 | L553: =RC1*R2C -> 0 | M553: =RC1*R2C -> 0
B554: =RC1*R2C -> 0 | C554: =RC1*R2C -> 0 | D554: =RC1*R2C -> 0 | E554: =RC1*R2C -> 0 | F554: =RC1*R2C -> 0 | G554: =RC1*R2C -> 0 | H554: =RC1*R2C -> 0 | I554: =RC1*R2C -> 0 | J554: =RC1*R2C -> 0 | K554: =RC1*R2C -> 0 | L554: =RC1*R2C -> 0 | M554: =RC1*R2C -> 0
B555: =RC1*R2C -> 0 | C555: =RC1*R2C -> 0 | D555: =RC1*R2C -> 0 | E555: =RC1*R2C -> 0 | F555: =RC1*R2C -> 0 | G555: =RC1*R2C -> 0 | H555: =RC1*R2C -> 0 | I555: =RC1*R2C -> 0 | J555: =RC1*R2C -> 0 | K555: =RC1*R2C -> 0 | L555: =RC1*R2C -> 0 | M555: =RC1*R2C -> 0
B556: =RC1*R2C -> 0 | C556: =RC1*R2C -> 0 | D556: =RC1*R2C -> 0 | E556: =RC1*R2C -> 0 | F556: =RC1*R2C -> 0 | G556: =RC1*R2C -> 0 | H556: =RC1*R2C -> 0 | I556: =RC1*R2C -> 0 | J556: =RC1*R2C -> 0 | K556: =RC1*R2C -> 0 | L556: =RC1*R2C -> 0 | M556: =RC1*R2C -> 0
B557: =RC1*R2C -> 0 | C557: =RC1*R2C -> 0 | D557: =RC1*R2C -> 0 | E557: =RC1*R2C -> 0 | F557: =RC1*R2C -> 0 | G557: =RC1*R2C -> 0 | H557: =RC1*R2C -> 0 | I557: =RC1*R2C -> 0 | J557: =RC1*R2C -> 0 | K557: =RC1*R2C -> 0 | L557: =RC1*R2C -> 0 | M557: =RC1*R2C -> 0
B558: =RC1*R2C -> 0 | C558: =RC1*R2C -> 0 | D558: =RC1*R2C -> 0 | E558: =RC1*R2C -> 0 | F558: =RC1*R2C -> 0 | G558: =RC1*R2C -> 0 | H558: =RC1*R2C -> 0 | I558: =RC1*R2C -> 0 | J558: =RC1*R2C -> 0 | K558: =RC1*R2C -> 0 | L558: =RC1*R2C -> 0 | M558: =RC1*R2C -> 0
B559: =RC1*R2C -> 0 | C559: =RC1*R2C -> 0 | D559: =RC1*R2C -> 0 | E559: =RC1*R2C -> 0 | F559: =RC1*R2C -> 0 | G559: =RC1*R2C -> 0 | H559: =RC1*R2C -> 0 | I559: =RC1*R2C -> 0 | J559: =RC1*R2C -> 0 | K559: =RC1*R2C -> 0 | L559: =RC1*R2C -> 0 | M559: =RC1*R2C -> 0
B560: =RC1*R2C -> 0 | C560: =RC1*R2C -> 0 | D560: =RC1*R2C -> 0 | E560: =RC1*R2C -> 0 | F560: =RC1*R2C -> 0 | G560: =RC1*R2C -> 0 | H560: =RC1*R2C -> 0 | I560: =RC1*R2C -> 0 | J560: =RC1*R2C -> 0 | K560: =RC1*R2C -> 0 | L560: =RC1*R2C -> 0 | M560: =RC1*R2C -> 0
B561: =RC1*R2C -> 0 | C561: =RC1*R2C -> 0 | D561: =RC1*R2C -> 0 | E561: =RC1*R2C -> 0 | F561: =RC1*R2C -> 0 | G561: =RC1*R2C -> 0 | H561: =RC1*R2C -> 0 | I561: =RC1*R2C -> 0 | J561: =RC1*R2C -> 0 | K561: =RC1*R2C -> 0 | L561: =RC1*R2C -> 0 | M561: =RC1*R2C -> 0
B562: =RC1*R2C -> 0 | C562: =RC1*R2C -> 0 | D562: =RC1*R2C -> 0 | E562: =RC1*R2C -> 0 | F562: =RC1*R2C -> 0 | G562: =RC1*R2C -> 0 | H562: =RC1*R2C -> 0 | I562: =RC1*R2C -> 0 | J562: =RC1*R2C -> 0 | K562: =RC1*R2C -> 0 | L562: =RC1*R2C -> 0 | M562: =RC1*R2C -> 0
B563: =RC1*R2C -> 0 | C563: =RC1*R2C -> 0 | D563: =RC1*R2C -> 0 | E563: =RC1*R2C -> 0 | F563: =RC1*R2C -> 0 | G563: =RC1*R2C -> 0 | H563: =RC1*R2C -> 0 | I563: =RC1*R2C -> 0 | J563: =RC1*R2C -> 0 | K563: =RC1*R2C -> 0 | L563: =RC1*R2C -> 0 | M563: =RC1*R2C -> 0
B564: =RC1*R2C -> 0 | C564: =RC1*R2C -> 0 | D564: =RC1*R2C -> 0 | E564: =RC1*R2C -> 0 | F564: =RC1*R2C -> 0 | G564: =RC1*R2C -> 0 | H564: =RC1*R2C -> 0 | I564: =RC1*R2C -> 0 | J564: =RC1*R2C -> 0 | K564: =RC1*R2C -> 0 | L564: =RC1*R2C -> 0 | M564: =RC1*R2C -> 0
B565: =RC1*R2C -> 0 | C565: =RC1*R2C -> 0 | D565: =RC1*R2C -> 0 | E565: =RC1*R2C -> 0 | F565: =RC1*R2C -> 0 | G565: =RC1*R2C -> 0 | H565: =RC1*R2C -> 0 | I565: =RC1*R2C -> 0 | J565: =RC1*R2C -> 0 | K565: =RC1*R2C -> 0 | L565: =RC1*R2C -> 0 | M565: =RC1*R2C -> 0
B566: =RC1*R2C -> 0 | C566: =RC1*R2C -> 0 | D566: =RC1*R2C -> 0 | E566: =RC1*R2C -> 0 | F566: =RC1*R2C -> 0 | G566: =RC1*R2C -> 0 | H566: =RC1*R2C -> 0 | I566: =RC1*R2C -> 0 | J566: =RC1*R2C -> 0 | K566: =RC1*R2C -> 0 | L566: =RC1*R2C -> 0 | M566: =RC1*R2C -> 0
B567: =RC1*R2C -> 0 | C567: =RC1*R2C -> 0 | D567: =RC1*R2C -> 0 | E567: =RC1*R2C -> 0 | F567: =RC1*R2C -> 0 | G567: =RC1*R2C -> 0 | H567: =RC1*R2C -> 0 | I567: =RC1*R2C -> 0 | J567: =RC1*R2C -> 0 | K567: =RC1*R2C -> 0 | L567: =RC1*R2C -> 0 | M567: =RC1*R2C -> 0
B568: =RC1*R2C -> 0 | C568: =RC1*R2C -> 0 | D568: =RC1*R2C -> 0 | E568: =RC1*R2C -> 0 | F568: =RC1*R2C -> 0 | G568: =RC1*R2C -> 0 | H568: =RC1*R2C -> 0 | I568: =RC1*R2C -> 0 | J568: =RC1*R2C -> 0 | K568: =RC1*R2C -> 0 | L568: =RC1*R2C -> 0 | M568: =RC1*R2C -> 0
B569: =RC1*R2C -> 0 | C569: =RC1*R2C -> 0 | D569: =RC1*R2C -> 0 | E569: =RC1*R2C -> 0 | F569: =RC1*R2C -> 0 | G569: =RC1*R2C -> 0 | H569: =RC1*R2C -> 0 | I569: =RC1*R2C -> 0 | J569: =RC1*R2C -> 0 | K569: =RC1*R2C -> 0 | L569: =RC1*R2C -> 0 | M569: =RC1*R2C -> 0
B570: =RC1*R2C -> 0 | C570: =RC1*R2C -> 0 | D570: =RC1*R2C -> 0 | E570: =RC1*R2C -> 0 | F570: =RC1*R2C -> 0 | G570: =RC1*R2C -> 0 | H570: =RC1*R2C -> 0 | I570: =RC1*R2C -> 0 | J570: =RC1*R2C -> 0 | K570: =RC1*R2C -> 0 | L570: =RC1*R2C -> 0 | M570: =RC1*R2C -> 0
B571: =RC1*R2C -> 0 | C571: =RC1*R2C -> 0 | D571: =RC1*R2C -> 0 | E571: =RC1*R2C -> 0 | F571: =RC1*R2C -> 0 | G571: =RC1*R2C -> 0 | H571: =RC1*R2C -> 0 | I571: =RC1*R2C -> 0 | J571: =RC1*R2C -> 0 | K571: =RC1*R2C -> 0 | L571: =RC1*R2C -> 0 | M571: =RC1*R2C -> 0
B572: =RC1*R2C -> 0 | C572: =RC1*R2C -> 0 | D572: =RC1*R2C -> 0 | E572: =RC1*R2C -> 0 | F572: =RC1*R2C -> 0 | G572: =RC1*R2C -> 0 | H572: =RC1*R2C -> 0 | I572: =RC1*R2C -> 0 | J572: =RC1*R2C -> 0 | K572: =RC1*R2C -> 0 | L572: =RC1*R2C -> 0 | M572: =RC1*R2C -> 0
B573: =RC1*R2C -> 0 | C573: =RC1*R2C -> 0 | D573: =RC1*R2C -> 0 | E573: =RC1*R2C -> 0 | F573: =RC1*R2C -> 0 | G573: =RC1*R2C -> 0 | H573: =RC1*R2C -> 0 | I573: =RC1*R2C -> 0 | J573: =RC1*R2C -> 0 | K573: =RC1*R2C -> 0 | L573: =RC1*R2C -> 0 | M573: =RC1*R2C -> 0
B574: =RC1*R2C -> 0 | C574: =RC1*R2C -> 0 | D574: =RC1*R2C -> 0 | E574: =RC1*R2C -> 0 | F574: =RC1*R2C -> 0 | G574: =RC1*R2C -> 0 | H574: =RC1*R2C -> 0 | I574: =RC1*R2C -> 0 | J574: =RC1*R2C -> 0 | K574: =RC1*R2C -> 0 | L574: =RC1*R2C -> 0 | M574: =RC1*R2C -> 0
B575: =RC1*R2C -> 0 | C575: =RC1*R2C -> 0 | D575: =RC1*R2C -> 0 | E575: =RC1*R2C -> 0 | F575: =RC1*R2C -> 0 | G575: =RC1*R2C -> 0 | H575: =RC1*R2C -> 0 | I575: =RC1*R2C -> 0 | J575: =RC1*R2C -> 0 | K575: =RC1*R2C -> 0 | L575: =RC1*R2C -> 0 | M575: =RC1*R2C -> 0
B576: =RC1*R2C -> 0 | C576: =RC1*R2C -> 0 | D576: =RC1*R2C -> 0 | E576: =RC1*R2C -> 0 | F576: =RC1*R2C -> 0 | G576: =RC1*R2C -> 0 | H576: =RC1*R2C -> 0 | I576: =RC1*R2C -> 0 | J576: =RC1*R2C -> 0 | K576: =RC1*R2C -> 0 | L576: =RC1*R2C -> 0 | M576: =RC1*R2C -> 0
B577: =RC1*R2C -> 0 | C577: =RC1*R2C -> 0 | D577: =RC1*R2C -> 0 | E577: =RC1*R2C -> 0 | F577: =RC1*R2C -> 0 | G577: =RC1*R2C -> 0 | H577: =RC1*R2C -> 0 | I577: =RC1*R2C -> 0 | J577: =RC1*R2C -> 0 | K577: =RC1*R2C -> 0 | L577: =RC1*R2C -> 0 | M577: =RC1*R2C -> 0
B578: =RC1*R2C -> 0 | C578: =RC1*R2C -> 0 | D578: =RC1*R2C -> 0 | E578: =RC1*R2C -> 0 | F578: =RC1*R2C -> 0 | G578: =RC1*R2C -> 0 | H578: =RC1*R2C -> 0 | I578: =RC1*R2C -> 0 | J578: =RC1*R2C -> 0 | K578: =RC1*R2C -> 0 | L578: =RC1*R2C -> 0 | M578: =RC1*R2C -> 0
B579: =RC1*R2C -> 0 | C579: =RC1*R2C -> 0 | D579: =RC1*R2C -> 0 | E579: =RC1*R2C -> 0 | F579: =RC1*R2C -> 0 | G579: =RC1*R2C -> 0 | H579: =RC1*R2C -> 0 | I579: =RC1*R2C -> 0 | J579: =RC1*R2C -> 0 | K579: =RC1*R2C -> 0 | L579: =RC1*R2C -> 0 | M579: =RC1*R2C -> 0
B580: =RC1*R2C -> 0 | C580: =RC1*R2C -> 0 | D580: =RC1*R2C -> 0 | E580: =RC1*R2C -> 0 | F580: =RC1*R2C -> 0 | G580: =RC1*R2C -> 0 | H580: =RC1*R2C -> 0 | I580: =RC1*R2C -> 0 | J580: =RC1*R2C -> 0 | K580: =RC1*R2C -> 0 | L580: =RC1*R2C -> 0 | M580: =RC1*R2C -> 0
B581: =RC1*R2C -> 0 | C581: =RC1*R2C -> 0 | D581: =RC1*R2C -> 0 | E581: =RC1*R2C -> 0 | F581: =RC1*R2C -> 0 | G581: =RC1*R2C -> 0 | H581: =RC1*R2C -> 0 | I581: =RC1*R2C -> 0 | J581: =RC1*R2C -> 0 | K581: =RC1*R2C -> 0 | L581: =RC1*R2C -> 0 | M581: =RC1*R2C -> 0
B582: =RC1*R2C -> 0 | C582: =RC1*R2C -> 0 | D582: =RC1*R2C -> 0 | E582: =RC1*R2C -> 0 | F582: =RC1*R2C -> 0 | G582: =RC1*R2C -> 0 | H582: =RC1*R2C -> 0 | I582: =RC1*R2C -> 0 | J582: =RC1*R2C -> 0 | K582: =RC1*R2C -> 0 | L582: =RC1*R2C -> 0 | M582: =RC1*R2C -> 0
B583: =RC1*R2C -> 0 | C583: =RC1*R2C -> 0 | D583: =RC1*R2C -> 0 | E583: =RC1*R2C -> 0 | F583: =RC1*R2C -> 0 | G583: =RC1*R2C -> 0 | H583: =RC1*R2C -> 0 | I583: =RC1*R2C -> 0 | J583: =RC1*R2C -> 0 | K583: =RC1*R2C -> 0 | L583: =RC1*R2C -> 0 | M583: =RC1*R2C -> 0
B584: =RC1*R2C -> 0 | C584: =RC1*R2C -> 0 | D584: =RC1*R2C -> 0 | E584: =RC1*R2C -> 0 | F584: =RC1*R2C -> 0 | G584: =RC1*R2C -> 0 | H584: =RC1*R2C -> 0 | I584: =RC1*R2C -> 0 | J584: =RC1*R2C -> 0 | K584: =RC1*R2C -> 0 | L584: =RC1*R2C -> 0 | M584: =RC1*R2C -> 0
B585: =RC1*R2C -> 0 | C585: =RC1*R2C -> 0 | D585: =RC1*R2C -> 0 | E585: =RC1*R2C -> 0 | F585: =RC1*R2C -> 0 | G585: =RC1*R2C -> 0 | H585: =RC1*R2C -> 0 | I585: =RC1*R2C -> 0 | J585: =RC1*R2C -> 0 | K585: =RC1*R2C -> 0 | L585: =RC1*R2C -> 0 | M585: =RC1*R2C -> 0
B586: =RC1*R2C -> 0 | C586: =RC1*R2C -> 0 | D586: =RC1*R2C -> 0 | E586: =RC1*R2C -> 0 | F586: =RC1*R2C -> 0 | G586: =RC1*R2C -> 0 | H586: =RC1*R2C -> 0 | I586: =RC1*R2C -> 0 | J586: =RC1*R2C -> 0 | K586: =RC1*R2C -> 0 | L586: =RC1*R2C -> 0 | M586: =RC1*R2C -> 0
B587: =RC1*R2C -> 0 | C587: =RC1*R2C -> 0 | D587: =RC1*R2C -> 0 | E587: =RC1*R2C -> 0 | F587: =RC1*R2C -> 0 | G587: =RC1*R2C -> 0 | H587: =RC1*R2C -> 0 | I587: =RC1*R2C -> 0 | J587: =RC1*R2C -> 0 | K587: =RC1*R2C -> 0 | L587: =RC1*R2C -> 0 | M587: =RC1*R2C -> 0
B588: =RC1*R2C -> 0 | C588: =RC1*R2C -> 0 | D588: =RC1*R2C -> 0 | E588: =RC1*R2C -> 0 | F588: =RC1*R2C -> 0 | G588: =RC1*R2C -> 0 | H588: =RC1*R2C -> 0 | I588: =RC1*R2C -> 0 | J588: =RC1*R2C -> 0 | K588: =RC1*R2C -> 0 | L588: =RC1*R2C -> 0 | M588: =RC1*R2C -> 0
B589: =RC1*R2C -> 0 | C589: =RC1*R2C -> 0 | D589: =RC1*R2C -> 0 | E589: =RC1*R2C -> 0 | F589: =RC1*R2C -> 0 | G589: =RC1*R2C -> 0 | H589: =RC1*R2C -> 0 | I589: =RC1*R2C -> 0 | J589: =RC1*R2C -> 0 | K589: =RC1*R2C -> 0 | L589: =RC1*R2C -> 0 | M589: =RC1*R2C -> 0
B590: =RC1*R2C -> 0 | C590: =RC1*R2C -> 0 | D590: =RC1*R2C -> 0 | E590: =RC1*R2C -> 0 | F590: =RC1*R2C -> 0 | G590: =RC1*R2C -> 0 | H590: =RC1*R2C -> 0 | I590: =RC1*R2C -> 0 | J590: =RC1*R2C -> 0 | K590: =RC1*R2C -> 0 | L590: =RC1*R2C -> 0 | M590: =RC1*R2C -> 0
B591: =RC1*R2C -> 0 | C591: =RC1*R2C -> 0 | D591: =RC1*R2C -> 0 | E591: =RC1*R2C -> 0 | F591: =RC1*R2C -> 0 | G591: =RC1*R2C -> 0 | H591: =RC1*R2C -> 0 | I591: =RC1*R2C -> 0 | J591: =RC1*R2C -> 0 | K591: =RC1*R2C -> 0 | L591: =RC1*R2C -> 0 | M591: =RC1*R2C -> 0
B592: =RC1*R2C -> 0 | C592: =RC1*R2C -> 0 | D592: =RC1*R2C -> 0 | E592: =RC1*R2C -> 0 | F592: =RC1*R2C -> 0 | G592: =RC1*R2C -> 0 | H592: =RC1*R2C -> 0 | I592: =RC1*R2C -> 0 | J592: =RC1*R2C -> 0 | K592: =RC1*R2C -> 0 | L592: =RC1*R2C -> 0 | M592: =RC1*R2C -> 0
B593: =RC1*R2C -> 0 | C593: =RC1*R2C -> 0 | D593: =RC1*R2C -> 0 | E593: =RC1*R2C -> 0 | F593: =RC1*R2C -> 0 | G593: =RC1*R2C -> 0 | H593: =RC1*R2C -> 0 | I593: =RC1*R2C -> 0 | J593: =RC1*R2C -> 0 | K593: =RC1*R2C -> 0 | L593: =RC1*R2C -> 0 | M593: =RC1*R2C -> 0
B594: =RC1*R2C -> 0 | C594: =RC1*R2C -> 0 | D594: =RC1*R2C -> 0 | E594: =RC1*R2C -> 0 | F594: =RC1*R2C -> 0 | G594: =RC1*R2C -> 0 | H594: =RC1*R2C -> 0 | I594: =RC1*R2C -> 0 | J594: =RC1*R2C -> 0 | K594: =RC1*R2C -> 0 | L594: =RC1*R2C -> 0 | M594: =RC1*R2C -> 0
B595: =RC1*R2C -> 0 | C595: =RC1*R2C -> 0 | D595: =RC1*R2C -> 0 | E595: =RC1*R2C -> 0 | F595: =RC1*R2C -> 0 | G595: =RC1*R2C -> 0 | H595: =RC1*R2C -> 0 | I595: =RC1*R2C -> 0 | J595: =RC1*R2C -> 0 | K595: =RC1*R2C -> 0 | L595: =RC1*R2C -> 0 | M595: =RC1*R2C -> 0
B596: =RC1*R2C -> 0 | C596: =RC1*R2C -> 0 | D596: =RC1*R2C -> 0 | E596: =RC1*R2C -> 0 | F596: =RC1*R2C -> 0 | G596: =RC1*R2C -> 0 | H596: =RC1*R2C -> 0 | I596: =RC1*R2C -> 0 | J596: =RC1*R2C -> 0 | K596: =RC1*R2C -> 0 | L596: =RC1*R2C -> 0 | M596: =RC1*R2C -> 0
B597: =RC1*R2C -> 0 | C597: =RC1*R2C -> 0 | D597: =RC1*R2C -> 0 | E597: =RC1*R2C -> 0 | F597: =RC1*R2C -> 0 | G597: =RC1*R2C -> 0 | H597: =RC1*R2C -> 0 | I597: =RC1*R2C -> 0 | J597: =RC1*R2C -> 0 | K597: =RC1*R2C -> 0 | L597: =RC1*R2C -> 0 | M597: =RC1*R2C -> 0
B598: =RC1*R2C -> 0 | C598: =RC1*R2C -> 0 | D598: =RC1*R2C -> 0 | E598: =RC1*R2C -> 0 | F598: =RC1*R2C -> 0 | G598: =RC1*R2C -> 0 | H598: =RC1*R2C -> 0 | I598: =RC1*R2C -> 0 | J598: =RC1*R2C -> 0 | K598: =RC1*R2C -> 0 | L598: =RC1*R2C -> 0 | M598: =RC1*R2C -> 0
B599: =RC1*R2C -> 0 | C599: =RC1*R2C -> 0 | D599: =RC1*R2C -> 0 | E599: =RC1*R2C -> 0 | F599: =RC1*R2C -> 0 | G599: =RC1*R2C -> 0 | H599: =RC1*R2C -> 0 | I599: =RC1*R2C -> 0 | J599: =RC1*R2C -> 0 | K599: =RC1*R2C -> 0 | L599: =RC1*R2C -> 0 | M599: =RC1*R2C -> 0
B600: =RC1*R2C -> 0 | C600: =RC1*R2C -> 0 | D600: =RC1*R2C -> 0 | E600: =RC1*R2C -> 0 | F600: =RC1*R2C -> 0 | G600: =RC1*R2C -> 0 | H600: =RC1*R2C -> 0 | I600: =RC1*R2C -> 0 | J600: =RC1*R2C -> 0 | K600: =RC1*R2C -> 0 | L600: =RC1*R2C -> 0 | M600: =RC1*R2C -> 0
B601: =RC1*R2C -> 0 | C601: =RC1*R2C -> 0 | D601: =RC1*R2C -> 0 | E601: =RC1*R2C -> 0 | F601: =RC1*R2C -> 0 | G601: =RC1*R2C -> 0 | H601: =RC1*R2C -> 0 | I601: =RC1*R2C -> 0 | J601: =RC1*R2C -> 0 | K601: =RC1*R2C -> 0 | L601: =RC1*R2C -> 0 | M601: =RC1*R2C -> 0
B602: =RC1*R2C -> 0 | C602: =RC1*R2C -> 0 | D602: =RC1*R2C -> 0 | E602: =RC1*R2C -> 0 | F602: =RC1*R2C -> 0 | G602: =RC1*R2C -> 0 | H602: =RC1*R2C -> 0 | I602: =RC1*R2C -> 0 | J602: =RC1*R2C -> 0 | K602: =RC1*R2C -> 0 | L602: =RC1*R2C -> 0 | M602: =RC1*R2C -> 0
B603: =RC1*R2C -> 0 | C603: =RC1*R2C -> 0 | D603: =RC1*R2C -> 0 | E603: =RC1*R2C -> 0 | F603: =RC1*R2C -> 0 | G603: =RC1*R2C -> 0 | H603: =RC1*R2C -> 0 | I603: =RC1*R2C -> 0 | J603: =RC1*R2C -> 0 | K603: =RC1*R2C -> 0 | L603: =RC1*R2C -> 0 | M603: =RC1*R2C -> 0
B604: =RC1*R2C -> 0 | C604: =RC1*R2C -> 0 | D604: =RC1*R2C -> 0 | E604: =RC1*R2C -> 0 | F604: =RC1*R2C -> 0 | G604: =RC1*R2C -> 0 | H604: =RC1*R2C -> 0 | I604: =RC1*R2C -> 0 | J604: =RC1*R2C -> 0 | K604: =RC1*R2C -> 0 | L604: =RC1*R2C -> 0 | M604: =RC1*R2C -> 0
B605: =RC1*R2C -> 0 | C605: =RC1*R2C -> 0 | D605: =RC1*R2C -> 0 | E605: =RC1*R2C -> 0 | F605: =RC1*R2C -> 0 | G605: =RC1*R2C -> 0 | H605: =RC1*R2C -> 0 | I605: =RC1*R2C -> 0 | J605: =RC1*R2C -> 0 | K605: =RC1*R2C -> 0 | L605: =RC1*R2C -> 0 | M605: =RC1*R2C -> 0
B606: =RC1*R2C -> 0 | C606: =RC1*R2C -> 0 | D606: =RC1*R2C -> 0 | E606: =RC1*R2C -> 0 | F606: =RC1*R2C -> 0 | G606: =RC1*R2C -> 0 | H606: =RC1*R2C -> 0 | I606: =RC1*R2C -> 0 | J606: =RC1*R2C -> 0 | K606: =RC1*R2C -> 0 | L606: =RC1*R2C -> 0 | M606: =RC1*R2C -> 0
B607: =RC1*R2C -> 0 | C607: =RC1*R2C -> 0 | D607: =RC1*R2C -> 0 | E607: =RC1*R2C -> 0 | F607: =RC1*R2C -> 0 | G607: =RC1*R2C -> 0 | H607: =RC1*R2C -> 0 | I607: =RC1*R2C -> 0 | J607: =RC1*R2C -> 0 | K607: =RC1*R2C -> 0 | L607: =RC1*R2C -> 0 | M607: =RC1*R2C -> 0
B608: =RC1*R2C -> 0 | C608: =RC1*R2C -> 0 | D608: =RC1*R2C -> 0 | E608: =RC1*R2C -> 0 | F608: =RC1*R2C -> 0 | G608: =RC1*R2C -> 0 | H608: =RC1*R2C -> 0 | I608: =RC1*R2C -> 0 | J608: =RC1*R2C -> 0 | K608: =RC1*R2C -> 0 | L608: =RC1*R2C -> 0 | M608: =RC1*R2C -> 0
B609: =RC1*R2C -> 0 | C609: =RC1*R2C -> 0 | D609: =RC1*R2C -> 0 | E609: =RC1*R2C -> 0 | F609: =RC1*R2C -> 0 | G609: =RC1*R2C -> 0 | H609: =RC1*R2C -> 0 | I609: =RC1*R2C -> 0 | J609: =RC1*R2C -> 0 | K609: =RC1*R2C -> 0 | L609: =RC1*R2C -> 0 | M609: =RC1*R2C -> 0
B610: =RC1*R2C -> 0 | C610: =RC1*R2C -> 0 | D610: =RC1*R2C -> 0 | E610: =RC1*R2C -> 0 | F610: =RC1*R2C -> 0 | G610: =RC1*R2C -> 0 | H610: =RC1*R2C -> 0 | I610: =RC1*R2C -> 0 | J610: =RC1*R2C -> 0 | K610: =RC1*R2C -> 0 | L610: =RC1*R2C -> 0 | M610: =RC1*R2C -> 0
B611: =RC1*R2C -> 0 | C611: =RC1*R2C -> 0 | D611: =RC1*R2C -> 0 | E611: =RC1*R2C -> 0 | F611: =RC1*R2C -> 0 | G611: =RC1*R2C -> 0 | H611: =RC1*R2C -> 0 | I611: =RC1*R2C -> 0 | J611: =RC1*R2C -> 0 | K611: =RC1*R2C -> 0 | L611: =RC1*R2C -> 0 | M611: =RC1*R2C -> 0
B612: =RC1*R2C -> 0 | C612: =RC1*R2C -> 0 | D612: =RC1*R2C -> 0 | E612: =RC1*R2C -> 0 | F612: =RC1*R2C -> 0 | G612: =RC1*R2C -> 0 | H612: =RC1*R2C -> 0 | I612: =RC1*R2C -> 0 | J612: =RC1*R2C -> 0 | K612: =RC1*R2C -> 0 | L612: =RC1*R2C -> 0 | M612: =RC1*R2C -> 0
B613: =RC1*R2C -> 0 | C613: =RC1*R2C -> 0 | D613: =RC1*R2C -> 0 | E613: =RC1*R2C -> 0 | F613: =RC1*R2C -> 0 | G613: =RC1*R2C -> 0 | H613: =RC1*R2C -> 0 | I613: =RC1*R2C -> 0 | J613: =RC1*R2C -> 0 | K613: =RC1*R2C -> 0 | L613: =RC1*R2C -> 0 | M613: =RC1*R2C -> 0
B614: =RC1*R2C -> 0 | C614: =RC1*R2C -> 0 | D614: =RC1*R2C -> 0 | E614: =RC1*R2C -> 0 | F614: =RC1*R2C -> 0 | G614: =RC1*R2C -> 0 | H614: =RC1*R2C -> 0 | I614: =RC1*R2C -> 0 | J614: =RC1*R2C -> 0 | K614: =RC1*R2C -> 0 | L614: =RC1*R2C -> 0 | M614: =RC1*R2C -> 0
B615: =RC1*R2C -> 0 | C615: =RC1*R2C -> 0 | D615: =RC1*R2C -> 0 | E615: =RC1*R2C -> 0 | F615: =RC1*R2C -> 0 | G615: =RC1*R2C -> 0 | H615: =RC1*R2C -> 0 | I615: =RC1*R2C -> 0 | J615: =RC1*R2C -> 0 | K615: =RC1*R2C -> 0 | L615: =RC1*R2C -> 0 | M615: =RC1*R2C -> 0
B616: =RC1*R2C -> 0 | C616: =RC1*R2C -> 0 | D616: =RC1*R2C -> 0 | E616: =RC1*R2C -> 0 | F616: =RC1*R2C -> 0 | G616: =RC1*R2C -> 0 | H616: =RC1*R2C -> 0 | I616: =RC1*R2C -> 0 | J616: =RC1*R2C -> 0 | K616: =RC1*R2C -> 0 | L616: =RC1*R2C -> 0 | M616: =RC1*R2C -> 0
B617: =RC1*R2C -> 0 | C617: =RC1*R2C -> 0 | D617: =RC1*R2C -> 0 | E617: =RC1*R2C -> 0 | F617: =RC1*R2C -> 0 | G617: =RC1*R2C -> 0 | H617: =RC1*R2C -> 0 | I617: =RC1*R2C -> 0 | J617: =RC1*R2C -> 0 | K617: =RC1*R2C -> 0 | L617: =RC1*R2C -> 0 | M617: =RC1*R2C -> 0
B618: =RC1*R2C -> 0 | C618: =RC1*R2C -> 0 | D618: =RC1*R2C -> 0 | E618: =RC1*R2C -> 0 | F618: =RC1*R2C -> 0 | G618: =RC1*R2C -> 0 | H618: =RC1*R2C -> 0 | I618: =RC1*R2C -> 0 | J618: =RC1*R2C -> 0 | K618: =RC1*R2C -> 0 | L618: =RC1*R2C -> 0 | M618: =RC1*R2C -> 0
B619: =RC1*R2C -> 0 | C619: =RC1*R2C -> 0 | D619: =RC1*R2C -> 0 | E619: =RC1*R2C -> 0 | F619: =RC1*R2C -> 0 | G619: =RC1*R2C -> 0 | H619: =RC1*R2C -> 0 | I619: =RC1*R2C -> 0 | J619: =RC1*R2C -> 0 | K619: =RC1*R2C -> 0 | L619: =RC1*R2C -> 0 | M619: =RC1*R2C -> 0
B620: =RC1*R2C -> 0 | C620: =RC1*R2C -> 0 | D620: =RC1*R2C -> 0 | E620: =RC1*R2C -> 0 | F620: =RC1*R2C -> 0 | G620: =RC1*R2C -> 0 | H620: =RC1*R2C -> 0 | I620: =RC1*R2C -> 0 | J620: =RC1*R2C -> 0 | K620: =RC1*R2C -> 0 | L620: =RC1*R2C -> 0 | M620: =RC1*R2C -> 0
B621: =RC1*R2C -> 0 | C621: =RC1*R2C -> 0 | D621: =RC1*R2C -> 0 | E621: =RC1*R2C -> 0 | F621: =RC1*R2C -> 0 | G621: =RC1*R2C -> 0 | H621: =RC1*R2C -> 0 | I621: =RC1*R2C -> 0 | J621: =RC1*R2C -> 0 | K621: =RC1*R2C -> 0 | L621: =RC1*R2C -> 0 | M621: =RC1*R2C -> 0
B622: =RC1*R2C -> 0 | C622: =RC1*R2C -> 0 | D622: =RC1*R2C -> 0 | E622: =RC1*R2C -> 0 | F622: =RC1*R2C -> 0 | G622: =RC1*R2C -> 0 | H622: =RC1*R2C -> 0 | I622: =RC1*R2C -> 0 | J622: =RC1*R2C -> 0 | K622: =RC1*R2C -> 0 | L622: =RC1*R2C -> 0 | M622: =RC1*R2C -> 0
B623: =RC1*R2C -> 0 | C623: =RC1*R2C -> 0 | D623: =RC1*R2C -> 0 | E623: =RC1*R2C -> 0 | F623: =RC1*R2C -> 0 | G623: =RC1*R2C -> 0 | H623: =RC1*R2C -> 0 | I623: =RC1*R2C -> 0 | J623: =RC1*R2C -> 0 | K623: =RC1*R2C -> 0 | L623: =RC1*R2C -> 0 | M623: =RC1*R2C -> 0
B624: =RC1*R2C -> 0 | C624: =RC1*R2C -> 0 | D624: =RC1*R2C -> 0 | E624: =RC1*R2C -> 0 | F624: =RC1*R2C -> 0 | G624: =RC1*R2C -> 0 | H624: =RC1*R2C -> 0 | I624: =RC1*R2C -> 0 | J624: =RC1*R2C -> 0 | K624: =RC1*R2C -> 0 | L624: =RC1*R2C -> 0 | M624: =RC1*R2C -> 0
B625: =RC1*R2C -> 0 | C625: =RC1*R2C -> 0 | D625: =RC1*R2C -> 0 | E625: =RC1*R2C -> 0 | F625: =RC1*R2C -> 0 | G625: =RC1*R2C -> 0 | H625: =RC1*R2C -> 0 | I625: =RC1*R2C -> 0 | J625: =RC1*R2C -> 0 | K625: =RC1*R2C -> 0 | L625: =RC1*R2C -> 0 | M625: =RC1*R2C -> 0
B626: =RC1*R2C -> 0 | C626: =RC1*R2C -> 0 | D626: =RC1*R2C -> 0 | E626: =RC1*R2C -> 0 | F626: =RC1*R2C -> 0 | G626: =RC1*R2C -> 0 | H626: =RC1*R2C -> 0 | I626: =RC1*R2C -> 0 | J626: =RC1*R2C -> 0 | K626: =RC1*R2C -> 0 | L626: =RC1*R2C -> 0 | M626: =RC1*R2C -> 0
B627: =RC1*R2C -> 0 | C627: =RC1*R2C -> 0 | D627: =RC1*R2C -> 0 | E627: =RC1*R2C -> 0 | F627: =RC1*R2C -> 0 | G627: =RC1*R2C -> 0 | H627: =RC1*R2C -> 0 | I627: =RC1*R2C -> 0 | J627: =RC1*R2C -> 0 | K627: =RC1*R2C -> 0 | L627: =RC1*R2C -> 0 | M627: =RC1*R2C -> 0
B628: =RC1*R2C -> 0 | C628: =RC1*R2C -> 0 | D628: =RC1*R2C -> 0 | E628: =RC1*R2C -> 0 | F628: =RC1*R2C -> 0 | G628: =RC1*R2C -> 0 | H628: =RC1*R2C -> 0 | I628: =RC1*R2C -> 0 | J628: =RC1*R2C -> 0 | K628: =RC1*R2C -> 0 | L628: =RC1*R2C -> 0 | M628: =RC1*R2C -> 0
B629: =RC1*R2C -> 0 | C629: =RC1*R2C -> 0 | D629: =RC1*R2C -> 0 | E629: =RC1*R2C -> 0 | F629: =RC1*R2C -> 0 | G629: =RC1*R2C -> 0 | H629: =RC1*R2C -> 0 | I629: =RC1*R2C -> 0 | J629: =RC1*R2C -> 0 | K629: =RC1*R2C -> 0 | L629: =RC1*R2C -> 0 | M629: =RC1*R2C -> 0
B630: =RC1*R2C -> 0 | C630: =RC1*R2C -> 0 | D630: =RC1*R2C -> 0 | E630: =RC1*R2C -> 0 | F630: =RC1*R2C -> 0 | G630: =RC1*R2C -> 0 | H630: =RC1*R2C -> 0 | I630: =RC1*R2C -> 0 | J630: =RC1*R2C -> 0 | K630: =RC1*R2C -> 0 | L630: =RC1*R2C -> 0 | M630: =RC1*R2C -> 0
B631: =RC1*R2C -> 0 | C631: =RC1*R2C -> 0 | D631: =RC1*R2C -> 0 | E631: =RC1*R2C -> 0 | F631: =RC1*R2C -> 0 | G631: =RC1*R2C -> 0 | H631: =RC1*R2C -> 0 | I631: =RC1*R2C -> 0 | J631: =RC1*R2C -> 0 | K631: =RC1*R2C -> 0 | L631: =RC1*R2C -> 0 | M631: =RC1*R2C -> 0
B632: =RC1*R2C -> 0 | C632: =RC1*R2C -> 0 | D632: =RC1*R2C -> 0 | E632: =RC1*R2C -> 0 | F632: =RC1*R2C -> 0 | G632: =RC1*R2C -> 0 | H632: =RC1*R2C -> 0 | I632: =RC1*R2C -> 0 | J632: =RC1*R2C -> 0 | K632: =RC1*R2C -> 0 | L632: =RC1*R2C -> 0 | M632: =RC1*R2C -> 0
B633: =RC1*R2C -> 0 | C633: =RC1*R2C -> 0 | D633: =RC1*R2C -> 0 | E633: =RC1*R2C -> 0 | F633: =RC1*R2C -> 0 | G633: =RC1*R2C -> 0 | H633: =RC1*R2C -> 0 | I633: =RC1*R2C -> 0 | J633: =RC1*R2C -> 0 | K633: =RC1*R2C -> 0 | L633: =RC1*R2C -> 0 | M633: =RC1*R2C -> 0
B634: =RC1*R2C -> 0 | C634: =RC1*R2C -> 0 | D634: =RC1*R2C -> 0 | E634: =RC1*R2C -> 0 | F634: =RC1*R2C -> 0 | G634: =RC1*R2C -> 0 | H634: =RC1*R2C -> 0 | I634: =RC1*R2C -> 0 | J634: =RC1*R2C -> 0 | K634: =RC1*R2C -> 0 | L634: =RC1*R2C -> 0 | M634: =RC1*R2C -> 0
B635: =RC1*R2C -> 0 | C635: =RC1*R2C -> 0 | D635: =RC1*R2C -> 0 | E635: =RC1*R2C -> 0 | F635: =RC1*R2C -> 0 | G635: =RC1*R2C -> 0 | H635: =RC1*R2C -> 0 | I635: =RC1*R2C -> 0 | J635: =RC1*R2C -> 0 | K635: =RC1*R2C -> 0 | L635: =RC1*R2C -> 0 | M635: =RC1*R2C -> 0
B636: =RC1*R2C -> 0 | C636: =RC1*R2C -> 0 | D636: =RC1*R2C -> 0 | E636: =RC1*R2C -> 0 | F636: =RC1*R2C -> 0 | G636: =RC1*R2C -> 0 | H636: =RC1*R2C -> 0 | I636: =RC1*R2C -> 0 | J636: =RC1*R2C -> 0 | K636: =RC1*R2C -> 0 | L636: =RC1*R2C -> 0 | M636: =RC1*R2C -> 0
B637: =RC1*R2C -> 0 | C637: =RC1*R2C -> 0 | D637: =RC1*R2C -> 0 | E637: =RC1*R2C -> 0 | F637: =RC1*R2C -> 0 | G637: =RC1*R2C -> 0 | H637: =RC1*R2C -> 0 | I637: =RC1*R2C -> 0 | J637: =RC1*R2C -> 0 | K637: =RC1*R2C -> 0 | L637: =RC1*R2C -> 0 | M637: =RC1*R2C -> 0
B638: =RC1*R2C -> 0 | C638: =RC1*R2C -> 0 | D638: =RC1*R2C -> 0 | E638: =RC1*R2C -> 0 | F638: =RC1*R2C -> 0 | G638: =RC1*R2C -> 0 | H638: =RC1*R2C -> 0 | I638: =RC1*R2C -> 0 | J638: =RC1*R2C -> 0 | K638: =RC1*R2C -> 0 | L638: =RC1*R2C -> 0 | M638: =RC1*R2C -> 0
B639: =RC1*R2C -> 0 | C639: =RC1*R2C -> 0 | D639: =RC1*R2C -> 0 | E639: =RC1*R2C -> 0 | F639: =RC1*R2C -> 0 | G639: =RC1*R2C -> 0 | H639: =RC1*R2C -> 0 | I639: =RC1*R2C -> 0 | J639: =RC1*R2C -> 0 | K639: =RC1*R2C -> 0 | L639: =RC1*R2C -> 0 | M639: =RC1*R2C -> 0
B640: =RC1*R2C -> 0 | C640: =RC1*R2C -> 0 | D640: =RC1*R2C -> 0 | E640: =RC1*R2C -> 0 | F640: =RC1*R2C -> 0 | G640: =RC1*R2C -> 0 | H640: =RC1*R2C -> 0 | I640: =RC1*R2C -> 0 | J640: =RC1*R2C -> 0 | K640: =RC1*R2C -> 0 | L640: =RC1*R2C -> 0 | M640: =RC1*R2C -> 0
B641: =RC1*R2C -> 0 | C641: =RC1*R2C -> 0 | D641: =RC1*R2C -> 0 | E641: =RC1*R2C -> 0 | F641: =RC1*R2C -> 0 | G641: =RC1*R2C -> 0 | H641: =RC1*R2C -> 0 | I641: =RC1*R2C -> 0 | J641: =RC1*R2C -> 0 | K641: =RC1*R2C -> 0 | L641: =RC1*R2C -> 0 | M641: =RC1*R2C -> 0
B642: =RC1*R2C -> 0 | C642: =RC1*R2C -> 0 | D642: =RC1*R2C -> 0 | E642: =RC1*R2C -> 0 | F642: =RC1*R2C -> 0 | G642: =RC1*R2C -> 0 | H642: =RC1*R2C -> 0 | I642: =RC1*R2C -> 0 | J642: =RC1*R2C -> 0 | K642: =RC1*R2C -> 0 | L642: =RC1*R2C -> 0 | M642: =RC1*R2C -> 0
B643: =RC1*R2C -> 0 | C643: =RC1*R2C -> 0 | D643: =RC1*R2C -> 0 | E643: =RC1*R2C -> 0 | F643: =RC1*R2C -> 0 | G643: =RC1*R2C -> 0 | H643: =RC1*R2C -> 0 | I643: =RC1*R2C -> 0 | J643: =RC1*R2C -> 0 | K643: =RC1*R2C -> 0 | L643: =RC1*R2C -> 0 | M643: =RC1*R2C -> 0
B644: =RC1*R2C -> 0 | C644: =RC1*R2C -> 0 | D644: =RC1*R2C -> 0 | E644: =RC1*R2C -> 0 | F644: =RC1*R2C -> 0 | G644: =RC1*R2C -> 0 | H644: =RC1*R2C -> 0 | I644: =RC1*R2C -> 0 | J644: =RC1*R2C -> 0 | K644: =RC1*R2C -> 0 | L644: =RC1*R2C -> 0 | M644: =RC1*R2C -> 0
B645: =RC1*R2C -> 0 | C645: =RC1*R2C -> 0 | D645: =RC1*R2C -> 0 | E645: =RC1*R2C -> 0 | F645: =RC1*R2C -> 0 | G645: =RC1*R2C -> 0 | H645: =RC1*R2C -> 0 | I645: =RC1*R2C -> 0 | J645: =RC1*R2C -> 0 | K645: =RC1*R2C -> 0 | L645: =RC1*R2C -> 0 | M645: =RC1*R2C -> 0
B646: =RC1*R2C -> 0 | C646: =RC1*R2C -> 0 | D646: =RC1*R2C -> 0 | E646: =RC1*R2C -> 0 | F646: =RC1*R2C -> 0 | G646: =RC1*R2C -> 0 | H646: =RC1*R2C -> 0 | I646: =RC1*R2C -> 0 | J646: =RC1*R2C -> 0 | K646: =RC1*R2C -> 0 | L646: =RC1*R2C -> 0 | M646: =RC1*R2C -> 0
B647: =RC1*R2C -> 0 | C647: =RC1*R2C -> 0 | D647: =RC1*R2C -> 0 | E647: =RC1*R2C -> 0 | F647: =RC1*R2C -> 0 | G647: =RC1*R2C -> 0 | H647: =RC1*R2C -> 0 | I647: =RC1*R2C -> 0 | J647: =RC1*R2C -> 0 | K647: =RC1*R2C -> 0 | L647: =RC1*R2C -> 0 | M647: =RC1*R2C -> 0
B648: =RC1*R2C -> 0 | C648: =RC1*R2C -> 0 | D648: =RC1*R2C -> 0 | E648: =RC1*R2C -> 0 | F648: =RC1*R2C -> 0 | G648: =RC1*R2C -> 0 | H648: =RC1*R2C -> 0 | I648: =RC1*R2C -> 0 | J648: =RC1*R2C -> 0 | K648: =RC1*R2C -> 0 | L648: =RC1*R2C -> 0 | M648: =RC1*R2C -> 0
B649: =RC1*R2C -> 0 | C649: =RC1*R2C -> 0 | D649: =RC1*R2C -> 0 | E649: =RC1*R2C -> 0 | F649: =RC1*R2C -> 0 | G649: =RC1*R2C -> 0 | H649: =RC1*R2C -> 0 | I649: =RC1*R2C -> 0 | J649: =RC1*R2C -> 0 | K649: =RC1*R2C -> 0 | L649: =RC1*R2C -> 0 | M649: =RC1*R2C -> 0
B650: =RC1*R2C -> 0 | C650: =RC1*R2C -> 0 | D650: =RC1*R2C -> 0 | E650: =RC1*R2C -> 0 | F650: =RC1*R2C -> 0 | G650: =RC1*R2C -> 0 | H650: =RC1*R2C -> 0 | I650: =RC1*R2C -> 0 | J650: =RC1*R2C -> 0 | K650: =RC1*R2C -> 0 | L650: =RC1*R2C -> 0 | M650: =RC1*R2C -> 0
B651: =RC1*R2C -> 0 | C651: =RC1*R2C -> 0 | D651: =RC1*R2C -> 0 | E651: =RC1*R2C -> 0 | F651: =RC1*R2C -> 0 | G651: =RC1*R2C -> 0 | H651: =RC1*R2C -> 0 | I651: =RC1*R2C -> 0 | J651: =RC1*R2C -> 0 | K651: =RC1*R2C -> 0 | L651: =RC1*R2C -> 0 | M651: =RC1*R2C -> 0
B652: =RC1*R2C -> 0 | C652: =RC1*R2C -> 0 | D652: =RC1*R2C -> 0 | E652: =RC1*R2C -> 0 | F652: =RC1*R2C -> 0 | G652: =RC1*R2C -> 0 | H652: =RC1*R2C -> 0 | I652: =RC1*R2C -> 0 | J652: =RC1*R2C -> 0 | K652: =RC1*R2C -> 0 | L652: =RC1*R2C -> 0 | M652: =RC1*R2C -> 0
B653: =RC1*R2C -> 0 | C653: =RC1*R2C -> 0 | D653: =RC1*R2C -> 0 | E653: =RC1*R2C -> 0 | F653: =RC1*R2C -> 0 | G653: =RC1*R2C -> 0 | H653: =RC1*R2C -> 0 | I653: =RC1*R2C -> 0 | J653: =RC1*R2C -> 0 | K653: =RC1*R2C -> 0 | L653: =RC1*R2C -> 0 | M653: =RC1*R2C -> 0
B654: =RC1*R2C -> 0 | C654: =RC1*R2C -> 0 | D654: =RC1*R2C -> 0 | E654: =RC1*R2C -> 0 | F654: =RC1*R2C -> 0 | G654: =RC1*R2C -> 0 | H654: =RC1*R2C -> 0 | I654: =RC1*R2C -> 0 | J654: =RC1*R2C -> 0 | K654: =RC1*R2C -> 0 | L654: =RC1*R2C -> 0 | M654: =RC1*R2C -> 0
B655: =RC1*R2C -> 0 | C655: =RC1*R2C -> 0 | D655: =RC1*R2C -> 0 | E655: =RC1*R2C -> 0 | F655: =RC1*R2C -> 0 | G655: =RC1*R2C -> 0 | H655: =RC1*R2C -> 0 | I655: =RC1*R2C -> 0 | J655: =RC1*R2C -> 0 | K655: =RC1*R2C -> 0 | L655: =RC1*R2C -> 0 | M655: =RC1*R2C -> 0
B656: =RC1*R2C -> 0 | C656: =RC1*R2C -> 0 | D656: =RC1*R2C -> 0 | E656: =RC1*R2C -> 0 | F656: =RC1*R2C -> 0 | G656: =RC1*R2C -> 0 | H656: =RC1*R2C -> 0 | I656: =RC1*R2C -> 0 | J656: =RC1*R2C -> 0 | K656: =RC1*R2C -> 0 | L656: =RC1*R2C -> 0 | M656: =RC1*R2C -> 0
B657: =RC1*R2C -> 0 | C657: =RC1*R2C -> 0 | D657: =RC1*R2C -> 0 | E657: =RC1*R2C -> 0 | F657: =RC1*R2C -> 0 | G657: =RC1*R2C -> 0 | H657: =RC1*R2C -> 0 | I657: =RC1*R2C -> 0 | J657: =RC1*R2C -> 0 | K657: =RC1*R2C -> 0 | L657: =RC1*R2C -> 0 | M657: =RC1*R2C -> 0
B658: =RC1*R2C -> 0 | C658: =RC1*R2C -> 0 | D658: =RC1*R2C -> 0 | E658: =RC1*R2C -> 0 | F658: =RC1*R2C -> 0 | G658: =RC1*R2C -> 0 | H658: =RC1*R2C -> 0 | I658: =RC1*R2C -> 0 | J658: =RC1*R2C -> 0 | K658: =RC1*R2C -> 0 | L658: =RC1*R2C -> 0 | M658: =RC1*R2C -> 0
B659: =RC1*R2C -> 0 | C659: =RC1*R2C -> 0 | D659: =RC1*R2C -> 0 | E659: =RC1*R2C -> 0 | F659: =RC1*R2C -> 0 | G659: =RC1*R2C -> 0 | H659: =RC1*R2C -> 0 | I659: =RC1*R2C -> 0 | J659: =RC1*R2C -> 0 | K659: =RC1*R2C -> 0 | L659: =RC1*R2C -> 0 | M659: =RC1*R2C -> 0
B660: =RC1*R2C -> 0 | C660: =RC1*R2C -> 0 | D660: =RC1*R2C -> 0 | E660: =RC1*R2C -> 0 | F660: =RC1*R2C -> 0 | G660: =RC1*R2C -> 0 | H660: =RC1*R2C -> 0 | I660: =RC1*R2C -> 0 | J660: =RC1*R2C -> 0 | K660: =RC1*R2C -> 0 | L660: =RC1*R2C -> 0 | M660: =RC1*R2C -> 0
B661: =RC1*R2C -> 0 | C661: =RC1*R2C -> 0 | D661: =RC1*R2C -> 0 | E661: =RC1*R2C -> 0 | F661: =RC1*R2C -> 0 | G661: =RC1*R2C -> 0 | H661: =RC1*R2C -> 0 | I661: =RC1*R2C -> 0 | J661: =RC1*R2C -> 0 | K661: =RC1*R2C -> 0 | L661: =RC1*R2C -> 0 | M661: =RC1*R2C -> 0
B662: =RC1*R2C -> 0 | C662: =RC1*R2C -> 0 | D662: =RC1*R2C -> 0 | E662: =RC1*R2C -> 0 | F662: =RC1*R2C -> 0 | G662: =RC1*R2C -> 0 | H662: =RC1*R2C -> 0 | I662: =RC1*R2C -> 0 | J662: =RC1*R2C -> 0 | K662: =RC1*R2C -> 0 | L662: =RC1*R2C -> 0 | M662: =RC1*R2C -> 0
B663: =RC1*R2C -> 0 | C663: =RC1*R2C -> 0 | D663: =RC1*R2C -> 0 | E663: =RC1*R2C -> 0 | F663: =RC1*R2C -> 0 | G663: =RC1*R2C -> 0 | H663: =RC1*R2C -> 0 | I663: =RC1*R2C -> 0 | J663: =RC1*R2C -> 0 | K663: =RC1*R2C -> 0 | L663: =RC1*R2C -> 0 | M663: =RC1*R2C -> 0
B664: =RC1*R2C -> 0 | C664: =RC1*R2C -> 0 | D664: =RC1*R2C -> 0 | E664: =RC1*R2C -> 0 | F664: =RC1*R2C -> 0 | G664: =RC1*R2C -> 0 | H664: =RC1*R2C -> 0 | I664: =RC1*R2C -> 0 | J664: =RC1*R2C -> 0 | K664: =RC1*R2C -> 0 | L664: =RC1*R2C -> 0 | M664: =RC1*R2C -> 0
B665: =RC1*R2C -> 0 | C665: =RC1*R2C -> 0 | D665: =RC1*R2C -> 0 | E665: =RC1*R2C -> 0 | F665: =RC1*R2C -> 0 | G665: =RC1*R2C -> 0 | H665: =RC1*R2C -> 0 | I665: =RC1*R2C -> 0 | J665: =RC1*R2C -> 0 | K665: =RC1*R2C -> 0 | L665: =RC1*R2C -> 0 | M665: =RC1*R2C -> 0
B666: =RC1*R2C -> 0 | C666: =RC1*R2C -> 0 | D666: =RC1*R2C -> 0 | E666: =RC1*R2C -> 0 | F666: =RC1*R2C -> 0 | G666: =RC1*R2C -> 0 | H666: =RC1*R2C -> 0 | I666: =RC1*R2C -> 0 | J666: =RC1*R2C -> 0 | K666: =RC1*R2C -> 0 | L666: =RC1*R2C -> 0 | M666: =RC1*R2C -> 0
B667: =RC1*R2C -> 0 | C667: =RC1*R2C -> 0 | D667: =RC1*R2C -> 0 | E667: =RC1*R2C -> 0 | F667: =RC1*R2C -> 0 | G667: =RC1*R2C -> 0 | H667: =RC1*R2C -> 0 | I667: =RC1*R2C -> 0 | J667: =RC1*R2C -> 0 | K667: =RC1*R2C -> 0 | L667: =RC1*R2C -> 0 | M667: =RC1*R2C -> 0
B668: =RC1*R2C -> 0 | C668: =RC1*R2C -> 0 | D668: =RC1*R2C -> 0 | E668: =RC1*R2C -> 0 | F668: =RC1*R2C -> 0 | G668: =RC1*R2C -> 0 | H668: =RC1*R2C -> 0 | I668: =RC1*R2C -> 0 | J668: =RC1*R2C -> 0 | K668: =RC1*R2C -> 0 | L668: =RC1*R2C -> 0 | M668: =RC1*R2C -> 0
B669: =RC1*R2C -> 0 | C669: =RC1*R2C -> 0 | D669: =RC1*R2C -> 0 | E669: =RC1*R2C -> 0 | F669: =RC1*R2C -> 0 | G669: =RC1*R2C -> 0 | H669: =RC1*R2C -> 0 | I669: =RC1*R2C -> 0 | J669: =RC1*R2C -> 0 | K669: =RC1*R2C -> 0 | L669: =RC1*R2C -> 0 | M669: =RC1*R2C -> 0
B670: =RC1*R2C -> 0 | C670: =RC1*R2C -> 0 | D670: =RC1*R2C -> 0 | E670: =RC1*R2C -> 0 | F670: =RC1*R2C -> 0 | G670: =RC1*R2C -> 0 | H670: =RC1*R2C -> 0 | I670: =RC1*R2C -> 0 | J670: =RC1*R2C -> 0 | K670: =RC1*R2C -> 0 | L670: =RC1*R2C -> 0 | M670: =RC1*R2C -> 0
B671: =RC1*R2C -> 0 | C671: =RC1*R2C -> 0 | D671: =RC1*R2C -> 0 | E671: =RC1*R2C -> 0 | F671: =RC1*R2C -> 0 | G671: =RC1*R2C -> 0 | H671: =RC1*R2C -> 0 | I671: =RC1*R2C -> 0 | J671: =RC1*R2C -> 0 | K671: =RC1*R2C -> 0 | L671: =RC1*R2C -> 0 | M671: =RC1*R2C -> 0
B672: =RC1*R2C -> 0 | C672: =RC1*R2C -> 0 | D672: =RC1*R2C -> 0 | E672: =RC1*R2C -> 0 | F672: =RC1*R2C -> 0 | G672: =RC1*R2C -> 0 | H672: =RC1*R2C -> 0 | I672: =RC1*R2C -> 0 | J672: =RC1*R2C -> 0 | K672: =RC1*R2C -> 0 | L672: =RC1*R2C -> 0 | M672: =RC1*R2C -> 0
B673: =RC1*R2C -> 0 | C673: =RC1*R2C -> 0 | D673: =RC1*R2C -> 0 | E673: =RC1*R2C -> 0 | F673: =RC1*R2C -> 0 | G673: =RC1*R2C -> 0 | H673: =RC1*R2C -> 0 | I673: =RC1*R2C -> 0 | J673: =RC1*R2C -> 0 | K673: =RC1*R2C -> 0 | L673: =RC1*R2C -> 0 | M673: =RC1*R2C -> 0
B674: =RC1*R2C -> 0 | C674: =RC1*R2C -> 0 | D674: =RC1*R2C -> 0 | E674: =RC1*R2C -> 0 | F674: =RC1*R2C -> 0 | G674: =RC1*R2C -> 0 | H674: =RC1*R2C -> 0 | I674: =RC1*R2C -> 0 | J674: =RC1*R2C -> 0 | K674: =RC1*R2C -> 0 | L674: =RC1*R2C -> 0 | M674: =RC1*R2C -> 0
B675: =RC1*R2C -> 0 | C675: =RC1*R2C -> 0 | D675: =RC1*R2C -> 0 | E675: =RC1*R2C -> 0 | F675: =RC1*R2C -> 0 | G675: =RC1*R2C -> 0 | H675: =RC1*R2C -> 0 | I675: =RC1*R2C -> 0 | J675: =RC1*R2C -> 0 | K675: =RC1*R2C -> 0 | L675: =RC1*R2C -> 0 | M675: =RC1*R2C -> 0
B676: =RC1*R2C -> 0 | C676: =RC1*R2C -> 0 | D676: =RC1*R2C -> 0 | E676: =RC1*R2C -> 0 | F676: =RC1*R2C -> 0 | G676: =RC1*R2C -> 0 | H676: =RC1*R2C -> 0 | I676: =RC1*R2C -> 0 | J676: =RC1*R2C -> 0 | K676: =RC1*R2C -> 0 | L676: =RC1*R2C -> 0 | M676: =RC1*R2C -> 0
B677: =RC1*R2C -> 0 | C677: =RC1*R2C -> 0 | D677: =RC1*R2C -> 0 | E677: =RC1*R2C -> 0 | F677: =RC1*R2C -> 0 | G677: =RC1*R2C -> 0 | H677: =RC1*R2C -> 0 | I677: =RC1*R2C -> 0 | J677: =RC1*R2C -> 0 | K677: =RC1*R2C -> 0 | L677: =RC1*R2C -> 0 | M677: =RC1*R2C -> 0
B678: =RC1*R2C -> 0 | C678: =RC1*R2C -> 0 | D678: =RC1*R2C -> 0 | E678: =RC1*R2C -> 0 | F678: =RC1*R2C -> 0 | G678: =RC1*R2C -> 0 | H678: =RC1*R2C -> 0 | I678: =RC1*R2C -> 0 | J678: =RC1*R2C -> 0 | K678: =RC1*R2C -> 0 | L678: =RC1*R2C -> 0 | M678: =RC1*R2C -> 0
B679: =RC1*R2C -> 0 | C679: =RC1*R2C -> 0 | D679: =RC1*R2C -> 0 | E679: =RC1*R2C -> 0 | F679: =RC1*R2C -> 0 | G679: =RC1*R2C -> 0 | H679: =RC1*R2C -> 0 | I679: =RC1*R2C -> 0 | J679: =RC1*R2C -> 0 | K679: =RC1*R2C -> 0 | L679: =RC1*R2C -> 0 | M679: =RC1*R2C -> 0
B680: =RC1*R2C -> 0 | C680: =RC1*R2C -> 0 | D680: =RC1*R2C -> 0 | E680: =RC1*R2C -> 0 | F680: =RC1*R2C -> 0 | G680: =RC1*R2C -> 0 | H680: =RC1*R2C -> 0 | I680: =RC1*R2C -> 0 | J680: =RC1*R2C -> 0 | K680: =RC1*R2C -> 0 | L680: =RC1*R2C -> 0 | M680: =RC1*R2C -> 0
B681: =RC1*R2C -> 0 | C681: =RC1*R2C -> 0 | D681: =RC1*R2C -> 0 | E681: =RC1*R2C -> 0 | F681: =RC1*R2C -> 0 | G681: =RC1*R2C -> 0 | H681: =RC1*R2C -> 0 | I681: =RC1*R2C -> 0 | J681: =RC1*R2C -> 0 | K681: =RC1*R2C -> 0 | L681: =RC1*R2C -> 0 | M681: =RC1*R2C -> 0
B682: =RC1*R2C -> 0 | C682: =RC1*R2C -> 0 | D682: =RC1*R2C -> 0 | E682: =RC1*R2C -> 0 | F682: =RC1*R2C -> 0 | G682: =RC1*R2C -> 0 | H682: =RC1*R2C -> 0 | I682: =RC1*R2C -> 0 | J682: =RC1*R2C -> 0 | K682: =RC1*R2C -> 0 | L682: =RC1*R2C -> 0 | M682: =RC1*R2C -> 0
B683: =RC1*R2C -> 0 | C683: =RC1*R2C -> 0 | D683: =RC1*R2C -> 0 | E683: =RC1*R2C -> 0 | F683: =RC1*R2C -> 0 | G683: =RC1*R2C -> 0 | H683: =RC1*R2C -> 0 | I683: =RC1*R2C -> 0 | J683: =RC1*R2C -> 0 | K683: =RC1*R2C -> 0 | L683: =RC1*R2C -> 0 | M683: =RC1*R2C -> 0
B684: =RC1*R2C -> 0 | C684: =RC1*R2C -> 0 | D684: =RC1*R2C -> 0 | E684: =RC1*R2C -> 0 | F684: =RC1*R2C -> 0 | G684: =RC1*R2C -> 0 | H684: =RC1*R2C -> 0 | I684: =RC1*R2C -> 0 | J684: =RC1*R2C -> 0 | K684: =RC1*R2C -> 0 | L684: =RC1*R2C -> 0 | M684: =RC1*R2C -> 0
B685: =RC1*R2C -> 0 | C685: =RC1*R2C -> 0 | D685: =RC1*R2C -> 0 | E685: =RC1*R2C -> 0 | F685: =RC1*R2C -> 0 | G685: =RC1*R2C -> 0 | H685: =RC1*R2C -> 0 | I685: =RC1*R2C -> 0 | J685: =RC1*R2C -> 0 | K685: =RC1*R2C -> 0 | L685: =RC1*R2C -> 0 | M685: =RC1*R2C -> 0
B686: =RC1*R2C -> 0 | C686: =RC1*R2C -> 0 | D686: =RC1*R2C -> 0 | E686: =RC1*R2C -> 0 | F686: =RC1*R2C -> 0 | G686: =RC1*R2C -> 0 | H686: =RC1*R2C -> 0 | I686: =RC1*R2C -> 0 | J686: =RC1*R2C -> 0 | K686: =RC1*R2C -> 0 | L686: =RC1*R2C -> 0 | M686: =RC1*R2C -> 0
B687: =RC1*R2C -> 0 | C687: =RC1*R2C -> 0 | D687: =RC1*R2C -> 0 | E687: =RC1*R2C -> 0 | F687: =RC1*R2C -> 0 | G687: =RC1*R2C -> 0 | H687: =RC1*R2C -> 0 | I687: =RC1*R2C -> 0 | J687: =RC1*R2C -> 0 | K687: =RC1*R2C -> 0 | L687: =RC1*R2C -> 0 | M687: =RC1*R2C -> 0
B688: =RC1*R2C -> 0 | C688: =RC1*R2C -> 0 | D688: =RC1*R2C -> 0 | E688: =RC1*R2C -> 0 | F688: =RC1*R2C -> 0 | G688: =RC1*R2C -> 0 | H688: =RC1*R2C -> 0 | I688: =RC1*R2C -> 0 | J688: =RC1*R2C -> 0 | K688: =RC1*R2C -> 0 | L688: =RC1*R2C -> 0 | M688: =RC1*R2C -> 0
B689: =RC1*R2C -> 0 | C689: =RC1*R2C -> 0 | D689: =RC1*R2C -> 0 | E689: =RC1*R2C -> 0 | F689: =RC1*R2C -> 0 | G689: =RC1*R2C -> 0 | H689: =RC1*R2C -> 0 | I689: =RC1*R2C -> 0 | J689: =RC1*R2C -> 0 | K689: =RC1*R2C -> 0 | L689: =RC1*R2C -> 0 | M689: =RC1*R2C -> 0
B690: =RC1*R2C -> 0 | C690: =RC1*R2C -> 0 | D690: =RC1*R2C -> 0 | E690: =RC1*R2C -> 0 | F690: =RC1*R2C -> 0 | G690: =RC1*R2C -> 0 | H690: =RC1*R2C -> 0 | I690: =RC1*R2C -> 0 | J690: =RC1*R2C -> 0 | K690: =RC1*R2C -> 0 | L690: =RC1*R2C -> 0 | M690: =RC1*R2C -> 0
B691: =RC1*R2C -> 0 | C691: =RC1*R2C -> 0 | D691: =RC1*R2C -> 0 | E691: =RC1*R2C -> 0 | F691: =RC1*R2C -> 0 | G691: =RC1*R2C -> 0 | H691: =RC1*R2C -> 0 | I691: =RC1*R2C -> 0 | J691: =RC1*R2C -> 0 | K691: =RC1*R2C -> 0 | L691: =RC1*R2C -> 0 | M691: =RC1*R2C -> 0
B692: =RC1*R2C -> 0 | C692: =RC1*R2C -> 0 | D692: =RC1*R2C -> 0 | E692: =RC1*R2C -> 0 | F692: =RC1*R2C -> 0 | G692: =RC1*R2C -> 0 | H692: =RC1*R2C -> 0 | I692: =RC1*R2C -> 0 | J692: =RC1*R2C -> 0 | K692: =RC1*R2C -> 0 | L692: =RC1*R2C -> 0 | M692: =RC1*R2C -> 0
B693: =RC1*R2C -> 0 | C693: =RC1*R2C -> 0 | D693: =RC1*R2C -> 0 | E693: =RC1*R2C -> 0 | F693: =RC1*R2C -> 0 | G693: =RC1*R2C -> 0 | H693: =RC1*R2C -> 0 | I693: =RC1*R2C -> 0 | J693: =RC1*R2C -> 0 | K693: =RC1*R2C -> 0 | L693: =RC1*R2C -> 0 | M693: =RC1*R2C -> 0
B694: =RC1*R2C -> 0 | C694: =RC1*R2C -> 0 | D694: =RC1*R2C -> 0 | E694: =RC1*R2C -> 0 | F694: =RC1*R2C -> 0 | G694: =RC1*R2C -> 0 | H694: =RC1*R2C -> 0 | I694: =RC1*R2C -> 0 | J694: =RC1*R2C -> 0 | K694: =RC1*R2C -> 0 | L694: =RC1*R2C -> 0 | M694: =RC1*R2C -> 0
B695: =RC1*R2C -> 0 | C695: =RC1*R2C -> 0 | D695: =RC1*R2C -> 0 | E695: =RC1*R2C -> 0 | F695: =RC1*R2C -> 0 | G695: =RC1*R2C -> 0 | H695: =RC1*R2C -> 0 | I695: =RC1*R2C -> 0 | J695: =RC1*R2C -> 0 | K695: =RC1*R2C -> 0 | L695: =RC1*R2C -> 0 | M695: =RC1*R2C -> 0
B696: =RC1*R2C -> 0 | C696: =RC1*R2C -> 0 | D696: =RC1*R2C -> 0 | E696: =RC1*R2C -> 0 | F696: =RC1*R2C -> 0 | G696: =RC1*R2C -> 0 | H696: =RC1*R2C -> 0 | I696: =RC1*R2C -> 0 | J696: =RC1*R2C -> 0 | K696: =RC1*R2C -> 0 | L696: =RC1*R2C -> 0 | M696: =RC1*R2C -> 0
B697: =RC1*R2C -> 0 | C697: =RC1*R2C -> 0 | D697: =RC1*R2C -> 0 | E697: =RC1*R2C -> 0 | F697: =RC1*R2C -> 0 | G697: =RC1*R2C -> 0 | H697: =RC1*R2C -> 0 | I697: =RC1*R2C -> 0 | J697: =RC1*R2C -> 0 | K697: =RC1*R2C -> 0 | L697: =RC1*R2C -> 0 | M697: =RC1*R2C -> 0
B698: =RC1*R2C -> 0 | C698: =RC1*R2C -> 0 | D698: =RC1*R2C -> 0 | E698: =RC1*R2C -> 0 | F698: =RC1*R2C -> 0 | G698: =RC1*R2C -> 0 | H698: =RC1*R2C -> 0 | I698: =RC1*R2C -> 0 | J698: =RC1*R2C -> 0 | K698: =RC1*R2C -> 0 | L698: =RC1*R2C -> 0 | M698: =RC1*R2C -> 0
B699: =RC1*R2C -> 0 | C699: =RC1*R2C -> 0 | D699: =RC1*R2C -> 0 | E699: =RC1*R2C -> 0 | F699: =RC1*R2C -> 0 | G699: =RC1*R2C -> 0 | H699: =RC1*R2C -> 0 | I699: =RC1*R2C -> 0 | J699: =RC1*R2C -> 0 | K699: =RC1*R2C -> 0 | L699: =RC1*R2C -> 0 | M699: =RC1*R2C -> 0
B700: =RC1*R2C -> 0 | C700: =RC1*R2C -> 0 | D700: =RC1*R2C -> 0 | E700: =RC1*R2C -> 0 | F700: =RC1*R2C -> 0 | G700: =RC1*R2C -> 0 | H700: =RC1*R2C -> 0 | I700: =RC1*R2C -> 0 | J700: =RC1*R2C -> 0 | K700: =RC1*R2C -> 0 | L700: =RC1*R2C -> 0 | M700: =RC1*R2C -> 0
B701: =RC1*R2C -> 0 | C701: =RC1*R2C -> 0 | D701: =RC1*R2C -> 0 | E701: =RC1*R2C -> 0 | F701: =RC1*R2C -> 0 | G701: =RC1*R2C -> 0 | H701: =RC1*R2C -> 0 | I701: =RC1*R2C -> 0 | J701: =RC1*R2C -> 0 | K701: =RC1*R2C -> 0 | L701: =RC1*R2C -> 0 | M701: =RC1*R2C -> 0
B702: =RC1*R2C -> 0 | C702: =RC1*R2C -> 0 | D702: =RC1*R2C -> 0 | E702: =RC1*R2C -> 0 | F702: =RC1*R2C -> 0 | G702: =RC1*R2C -> 0 | H702: =RC1*R2C -> 0 | I702: =RC1*R2C -> 0 | J702: =RC1*R2C -> 0 | K702: =RC1*R2C -> 0 | L702: =RC1*R2C -> 0 | M702: =RC1*R2C -> 0
B703: =RC1*R2C -> 0 | C703: =RC1*R2C -> 0 | D703: =RC1*R2C -> 0 | E703: =RC1*R2C -> 0 | F703: =RC1*R2C -> 0 | G703: =RC1*R2C -> 0 | H703: =RC1*R2C -> 0 | I703: =RC1*R2C -> 0 | J703: =RC1*R2C -> 0 | K703: =RC1*R2C -> 0 | L703: =RC1*R2C -> 0 | M703: =RC1*R2C -> 0
B704: =RC1*R2C -> 0 | C704: =RC1*R2C -> 0 | D704: =RC1*R2C -> 0 | E704: =RC1*R2C -> 0 | F704: =RC1*R2C -> 0 | G704: =RC1*R2C -> 0 | H704: =RC1*R2C -> 0 | I704: =RC1*R2C -> 0 | J704: =RC1*R2C -> 0 | K704: =RC1*R2C -> 0 | L704: =RC1*R2C -> 0 | M704: =RC1*R2C -> 0
B705: =RC1*R2C -> 0 | C705: =RC1*R2C -> 0 | D705: =RC1*R2C -> 0 | E705: =RC1*R2C -> 0 | F705: =RC1*R2C -> 0 | G705: =RC1*R2C -> 0 | H705: =RC1*R2C -> 0 | I705: =RC1*R2C -> 0 | J705: =RC1*R2C -> 0 | K705: =RC1*R2C -> 0 | L705: =RC1*R2C -> 0 | M705: =RC1*R2C -> 0
B706: =RC1*R2C -> 0 | C706: =RC1*R2C -> 0 | D706: =RC1*R2C -> 0 | E706: =RC1*R2C -> 0 | F706: =RC1*R2C -> 0 | G706: =RC1*R2C -> 0 | H706: =RC1*R2C -> 0 | I706: =RC1*R2C -> 0 | J706: =RC1*R2C -> 0 | K706: =RC1*R2C -> 0 | L706: =RC1*R2C -> 0 | M706: =RC1*R2C -> 0
B707: =RC1*R2C -> 0 | C707: =RC1*R2C -> 0 | D707: =RC1*R2C -> 0 | E707: =RC1*R2C -> 0 | F707: =RC1*R2C -> 0 | G707: =RC1*R2C -> 0 | H707: =RC1*R2C -> 0 | I707: =RC1*R2C -> 0 | J707: =RC1*R2C -> 0 | K707: =RC1*R2C -> 0 | L707: =RC1*R2C -> 0 | M707: =RC1*R2C -> 0
B708: =RC1*R2C -> 0 | C708: =RC1*R2C -> 0 | D708: =RC1*R2C -> 0 | E708: =RC1*R2C -> 0 | F708: =RC1*R2C -> 0 | G708: =RC1*R2C -> 0 | H708: =RC1*R2C -> 0 | I708: =RC1*R2C -> 0 | J708: =RC1*R2C -> 0 | K708: =RC1*R2C -> 0 | L708: =RC1*R2C -> 0 | M708: =RC1*R2C -> 0
B709: =RC1*R2C -> 0 | C709: =RC1*R2C -> 0 | D709: =RC1*R2C -> 0 | E709: =RC1*R2C -> 0 | F709: =RC1*R2C -> 0 | G709: =RC1*R2C -> 0 | H709: =RC1*R2C -> 0 | I709: =RC1*R2C -> 0 | J709: =RC1*R2C -> 0 | K709: =RC1*R2C -> 0 | L709: =RC1*R2C -> 0 | M709: =RC1*R2C -> 0
B710: =RC1*R2C -> 0 | C710: =RC1*R2C -> 0 | D710: =RC1*R2C -> 0 | E710: =RC1*R2C -> 0 | F710: =RC1*R2C -> 0 | G710: =RC1*R2C -> 0 | H710: =RC1*R2C -> 0 | I710: =RC1*R2C -> 0 | J710: =RC1*R2C -> 0 | K710: =RC1*R2C -> 0 | L710: =RC1*R2C -> 0 | M710: =RC1*R2C -> 0
B711: =RC1*R2C -> 0 | C711: =RC1*R2C -> 0 | D711: =RC1*R2C -> 0 | E711: =RC1*R2C -> 0 | F711: =RC1*R2C -> 0 | G711: =RC1*R2C -> 0 | H711: =RC1*R2C -> 0 | I711: =RC1*R2C -> 0 | J711: =RC1*R2C -> 0 | K711: =RC1*R2C -> 0 | L711: =RC1*R2C -> 0 | M711: =RC1*R2C -> 0
B712: =RC1*R2C -> 0 | C712: =RC1*R2C -> 0 | D712: =RC1*R2C -> 0 | E712: =RC1*R2C -> 0 | F712: =RC1*R2C -> 0 | G712: =RC1*R2C -> 0 | H712: =RC1*R2C -> 0 | I712: =RC1*R2C -> 0 | J712: =RC1*R2C -> 0 | K712: =RC1*R2C -> 0 | L712: =RC1*R2C -> 0 | M712: =RC1*R2C -> 0
B713: =RC1*R2C -> 0 | C713: =RC1*R2C -> 0 | D713: =RC1*R2C -> 0 | E713: =RC1*R2C -> 0 | F713: =RC1*R2C -> 0 | G713: =RC1*R2C -> 0 | H713: =RC1*R2C -> 0 | I713: =RC1*R2C -> 0 | J713: =RC1*R2C -> 0 | K713: =RC1*R2C -> 0 | L713: =RC1*R2C -> 0 | M713: =RC1*R2C -> 0
B714: =RC1*R2C -> 0 | C714: =RC1*R2C -> 0 | D714: =RC1*R2C -> 0 | E714: =RC1*R2C -> 0 | F714: =RC1*R2C -> 0 | G714: =RC1*R2C -> 0 | H714: =RC1*R2C -> 0 | I714: =RC1*R2C -> 0 | J714: =RC1*R2C -> 0 | K714: =RC1*R2C -> 0 | L714: =RC1*R2C -> 0 | M714: =RC1*R2C -> 0
B715: =RC1*R2C -> 0 | C715: =RC1*R2C -> 0 | D715: =RC1*R2C -> 0 | E715: =RC1*R2C -> 0 | F715: =RC1*R2C -> 0 | G715: =RC1*R2C -> 0 | H715: =RC1*R2C -> 0 | I715: =RC1*R2C -> 0 | J715: =RC1*R2C -> 0 | K715: =RC1*R2C -> 0 | L715: =RC1*R2C -> 0 | M715: =RC1*R2C -> 0
B716: =RC1*R2C -> 0 | C716: =RC1*R2C -> 0 | D716: =RC1*R2C -> 0 | E716: =RC1*R2C -> 0 | F716: =RC1*R2C -> 0 | G716: =RC1*R2C -> 0 | H716: =RC1*R2C -> 0 | I716: =RC1*R2C -> 0 | J716: =RC1*R2C -> 0 | K716: =RC1*R2C -> 0 | L716: =RC1*R2C -> 0 | M716: =RC1*R2C -> 0
B717: =RC1*R2C -> 0 | C717: =RC1*R2C -> 0 | D717: =RC1*R2C -> 0 | E717: =RC1*R2C -> 0 | F717: =RC1*R2C -> 0 | G717: =RC1*R2C -> 0 | H717: =RC1*R2C -> 0 | I717: =RC1*R2C -> 0 | J717: =RC1*R2C -> 0 | K717: =RC1*R2C -> 0 | L717: =RC1*R2C -> 0 | M717: =RC1*R2C -> 0
B718: =RC1*R2C -> 0 | C718: =RC1*R2C -> 0 | D718: =RC1*R2C -> 0 | E718: =RC1*R2C -> 0 | F718: =RC1*R2C -> 0 | G718: =RC1*R2C -> 0 | H718: =RC1*R2C -> 0 | I718: =RC1*R2C -> 0 | J718: =RC1*R2C -> 0 | K718: =RC1*R2C -> 0 | L718: =RC1*R2C -> 0 | M718: =RC1*R2C -> 0
B719: =RC1*R2C -> 0 | C719: =RC1*R2C -> 0 | D719: =RC1*R2C -> 0 | E719: =RC1*R2C -> 0 | F719: =RC1*R2C -> 0 | G719: =RC1*R2C -> 0 | H719: =RC1*R2C -> 0 | I719: =RC1*R2C -> 0 | J719: =RC1*R2C -> 0 | K719: =RC1*R2C -> 0 | L719: =RC1*R2C -> 0 | M719: =RC1*R2C -> 0
B720: =RC1*R2C -> 0 | C720: =RC1*R2C -> 0 | D720: =RC1*R2C -> 0 | E720: =RC1*R2C -> 0 | F720: =RC1*R2C -> 0 | G720: =RC1*R2C -> 0 | H720: =RC1*R2C -> 0 | I720: =RC1*R2C -> 0 | J720: =RC1*R2C -> 0 | K720: =RC1*R2C -> 0 | L720: =RC1*R2C -> 0 | M720: =RC1*R2C -> 0
B721: =RC1*R2C -> 0 | C721: =RC1*R2C -> 0 | D721: =RC1*R2C -> 0 | E721: =RC1*R2C -> 0 | F721: =RC1*R2C -> 0 | G721: =RC1*R2C -> 0 | H721: =RC1*R2C -> 0 | I721: =RC1*R2C -> 0 | J721: =RC1*R2C -> 0 | K721: =RC1*R2C -> 0 | L721: =RC1*R2C -> 0 | M721: =RC1*R2C -> 0
B722: =RC1*R2C -> 0 | C722: =RC1*R2C -> 0 | D722: =RC1*R2C -> 0 | E722: =RC1*R2C -> 0 | F722: =RC1*R2C -> 0 | G722: =RC1*R2C -> 0 | H722: =RC1*R2C -> 0 | I722: =RC1*R2C -> 0 | J722: =RC1*R2C -> 0 | K722: =RC1*R2C -> 0 | L722: =RC1*R2C -> 0 | M722: =RC1*R2C -> 0
B723: =RC1*R2C -> 0 | C723: =RC1*R2C -> 0 | D723: =RC1*R2C -> 0 | E723: =RC1*R2C -> 0 | F723: =RC1*R2C -> 0 | G723: =RC1*R2C -> 0 | H723: =RC1*R2C -> 0 | I723: =RC1*R2C -> 0 | J723: =RC1*R2C -> 0 | K723: =RC1*R2C -> 0 | L723: =RC1*R2C -> 0 | M723: =RC1*R2C -> 0
B724: =RC1*R2C -> 0 | C724: =RC1*R2C -> 0 | D724: =RC1*R2C -> 0 | E724: =RC1*R2C -> 0 | F724: =RC1*R2C -> 0 | G724: =RC1*R2C -> 0 | H724: =RC1*R2C -> 0 | I724: =RC1*R2C -> 0 | J724: =RC1*R2C -> 0 | K724: =RC1*R2C -> 0 | L724: =RC1*R2C -> 0 | M724: =RC1*R2C -> 0
B725: =RC1*R2C -> 0 | C725: =RC1*R2C -> 0 | D725: =RC1*R2C -> 0 | E725: =RC1*R2C -> 0 | F725: =RC1*R2C -> 0 | G725: =RC1*R2C -> 0 | H725: =RC1*R2C -> 0 | I725: =RC1*R2C -> 0 | J725: =RC1*R2C -> 0 | K725: =RC1*R2C -> 0 | L725: =RC1*R2C -> 0 | M725: =RC1*R2C -> 0
B726: =RC1*R2C -> 0 | C726: =RC1*R2C -> 0 | D726: =RC1*R2C -> 0 | E726: =RC1*R2C -> 0 | F726: =RC1*R2C -> 0 | G726: =RC1*R2C -> 0 | H726: =RC1*R2C -> 0 | I726: =RC1*R2C -> 0 | J726: =RC1*R2C -> 0 | K726: =RC1*R2C -> 0 | L726: =RC1*R2C -> 0 | M726: =RC1*R2C -> 0
B727: =RC1*R2C -> 0 | C727: =RC1*R2C -> 0 | D727: =RC1*R2C -> 0 | E727: =RC1*R2C -> 0 | F727: =RC1*R2C -> 0 | G727: =RC1*R2C -> 0 | H727: =RC1*R2C -> 0 | I727: =RC1*R2C -> 0 | J727: =RC1*R2C -> 0 | K727: =RC1*R2C -> 0 | L727: =RC1*R2C -> 0 | M727: =RC1*R2C -> 0
B728: =RC1*R2C -> 0 | C728: =RC1*R2C -> 0 | D728: =RC1*R2C -> 0 | E728: =RC1*R2C -> 0 | F728: =RC1*R2C -> 0 | G728: =RC1*R2C -> 0 | H728: =RC1*R2C -> 0 | I728: =RC1*R2C -> 0 | J728: =RC1*R2C -> 0 | K728: =RC1*R2C -> 0 | L728: =RC1*R2C -> 0 | M728: =RC1*R2C -> 0
B729: =RC1*R2C -> 0 | C729: =RC1*R2C -> 0 | D729: =RC1*R2C -> 0 | E729: =RC1*R2C -> 0 | F729: =RC1*R2C -> 0 | G729: =RC1*R2C -> 0 | H729: =RC1*R2C -> 0 | I729: =RC1*R2C -> 0 | J729: =RC1*R2C -> 0 | K729: =RC1*R2C -> 0 | L729: =RC1*R2C -> 0 | M729: =RC1*R2C -> 0
B730: =RC1*R2C -> 0 | C730: =RC1*R2C -> 0 | D730: =RC1*R2C -> 0 | E730: =RC1*R2C -> 0 | F730: =RC1*R2C -> 0 | G730: =RC1*R2C -> 0 | H730: =RC1*R2C -> 0 | I730: =RC1*R2C -> 0 | J730: =RC1*R2C -> 0 | K730: =RC1*R2C -> 0 | L730: =RC1*R2C -> 0 | M730: =RC1*R2C -> 0
B731: =RC1*R2C -> 0 | C731: =RC1*R2C -> 0 | D731: =RC1*R2C -> 0 | E731: =RC1*R2C -> 0 | F731: =RC1*R2C -> 0 | G731: =RC1*R2C -> 0 | H731: =RC1*R2C -> 0 | I731: =RC1*R2C -> 0 | J731: =RC1*R2C -> 0 | K731: =RC1*R2C -> 0 | L731: =RC1*R2C -> 0 | M731: =RC1*R2C -> 0
B732: =RC1*R2C -> 0 | C732: =RC1*R2C -> 0 | D732: =RC1*R2C -> 0 | E732: =RC1*R2C -> 0 | F732: =RC1*R2C -> 0 | G732: =RC1*R2C -> 0 | H732: =RC1*R2C -> 0 | I732: =RC1*R2C -> 0 | J732: =RC1*R2C -> 0 | K732: =RC1*R2C -> 0 | L732: =RC1*R2C -> 0 | M732: =RC1*R2C -> 0
B733: =RC1*R2C -> 0 | C733: =RC1*R2C -> 0 | D733: =RC1*R2C -> 0 | E733: =RC1*R2C -> 0 | F733: =RC1*R2C -> 0 | G733: =RC1*R2C -> 0 | H733: =RC1*R2C -> 0 | I733: =RC1*R2C -> 0 | J733: =RC1*R2C -> 0 | K733: =RC1*R2C -> 0 | L733: =RC1*R2C -> 0 | M733: =RC1*R2C -> 0
B734: =RC1*R2C -> 0 | C734: =RC1*R2C -> 0 | D734: =RC1*R2C -> 0 | E734: =RC1*R2C -> 0 | F734: =RC1*R2C -> 0 | G734: =RC1*R2C -> 0 | H734: =RC1*R2C -> 0 | I734: =RC1*R2C -> 0 | J734: =RC1*R2C -> 0 | K734: =RC1*R2C -> 0 | L734: =RC1*R2C -> 0 | M734: =RC1*R2C -> 0
B735: =RC1*R2C -> 0 | C735: =RC1*R2C -> 0 | D735: =RC1*R2C -> 0 | E735: =RC1*R2C -> 0 | F735: =RC1*R2C -> 0 | G735: =RC1*R2C -> 0 | H735: =RC1*R2C -> 0 | I735: =RC1*R2C -> 0 | J735: =RC1*R2C -> 0 | K735: =RC1*R2C -> 0 | L735: =RC1*R2C -> 0 | M735: =RC1*R2C -> 0
B736: =RC1*R2C -> 0 | C736: =RC1*R2C -> 0 | D736: =RC1*R2C -> 0 | E736: =RC1*R2C -> 0 | F736: =RC1*R2C -> 0 | G736: =RC1*R2C -> 0 | H736: =RC1*R2C -> 0 | I736: =RC1*R2C -> 0 | J736: =RC1*R2C -> 0 | K736: =RC1*R2C -> 0 | L736: =RC1*R2C -> 0 | M736: =RC1*R2C -> 0
B737: =RC1*R2C -> 0 | C737: =RC1*R2C -> 0 | D737: =RC1*R2C -> 0 | E737: =RC1*R2C -> 0 | F737: =RC1*R2C -> 0 | G737: =RC1*R2C -> 0 | H737: =RC1*R2C -> 0 | I737: =RC1*R2C -> 0 | J737: =RC1*R2C -> 0 | K737: =RC1*R2C -> 0 | L737: =RC1*R2C -> 0 | M737: =RC1*R2C -> 0
B738: =RC1*R2C -> 0 | C738: =RC1*R2C -> 0 | D738: =RC1*R2C -> 0 | E738: =RC1*R2C -> 0 | F738: =RC1*R2C -> 0 | G738: =RC1*R2C -> 0 | H738: =RC1*R2C -> 0 | I738: =RC1*R2C -> 0 | J738: =RC1*R2C -> 0 | K738: =RC1*R2C -> 0 | L738: =RC1*R2C -> 0 | M738: =RC1*R2C -> 0
B739: =RC1*R2C -> 0 | C739: =RC1*R2C -> 0 | D739: =RC1*R2C -> 0 | E739: =RC1*R2C -> 0 | F739: =RC1*R2C -> 0 | G739: =RC1*R2C -> 0 | H739: =RC1*R2C -> 0 | I739: =RC1*R2C -> 0 | J739: =RC1*R2C -> 0 | K739: =RC1*R2C -> 0 | L739: =RC1*R2C -> 0 | M739: =RC1*R2C -> 0
B740: =RC1*R2C -> 0 | C740: =RC1*R2C -> 0 | D740: =RC1*R2C -> 0 | E740: =RC1*R2C -> 0 | F740: =RC1*R2C -> 0 | G740: =RC1*R2C -> 0 | H740: =RC1*R2C -> 0 | I740: =RC1*R2C -> 0 | J740: =RC1*R2C -> 0 | K740: =RC1*R2C -> 0 | L740: =RC1*R2C -> 0 | M740: =RC1*R2C -> 0
B741: =RC1*R2C -> 0 | C741: =RC1*R2C -> 0 | D741: =RC1*R2C -> 0 | E741: =RC1*R2C -> 0 | F741: =RC1*R2C -> 0 | G741: =RC1*R2C -> 0 | H741: =RC1*R2C -> 0 | I741: =RC1*R2C -> 0 | J741: =RC1*R2C -> 0 | K741: =RC1*R2C -> 0 | L741: =RC1*R2C -> 0 | M741: =RC1*R2C -> 0
B742: =RC1*R2C -> 0 | C742: =RC1*R2C -> 0 | D742: =RC1*R2C -> 0 | E742: =RC1*R2C -> 0 | F742: =RC1*R2C -> 0 | G742: =RC1*R2C -> 0 | H742: =RC1*R2C -> 0 | I742: =RC1*R2C -> 0 | J742: =RC1*R2C -> 0 | K742: =RC1*R2C -> 0 | L742: =RC1*R2C -> 0 | M742: =RC1*R2C -> 0
B743: =RC1*R2C -> 0 | C743: =RC1*R2C -> 0 | D743: =RC1*R2C -> 0 | E743: =RC1*R2C -> 0 | F743: =RC1*R2C -> 0 | G743: =RC1*R2C -> 0 | H743: =RC1*R2C -> 0 | I743: =RC1*R2C -> 0 | J743: =RC1*R2C -> 0 | K743: =RC1*R2C -> 0 | L743: =RC1*R2C -> 0 | M743: =RC1*R2C -> 0
B744: =RC1*R2C -> 0 | C744: =RC1*R2C -> 0 | D744: =RC1*R2C -> 0 | E744: =RC1*R2C -> 0 | F744: =RC1*R2C -> 0 | G744: =RC1*R2C -> 0 | H744: =RC1*R2C -> 0 | I744: =RC1*R2C -> 0 | J744: =RC1*R2C -> 0 | K744: =RC1*R2C -> 0 | L744: =RC1*R2C -> 0 | M744: =RC1*R2C -> 0
B745: =RC1*R2C -> 0 | C745: =RC1*R2C -> 0 | D745: =RC1*R2C -> 0 | E745: =RC1*R2C -> 0 | F745: =RC1*R2C -> 0 | G745: =RC1*R2C -> 0 | H745: =RC1*R2C -> 0 | I745: =RC1*R2C -> 0 | J745: =RC1*R2C -> 0 | K745: =RC1*R2C -> 0 | L745: =RC1*R2C -> 0 | M745: =RC1*R2C -> 0
B746: =RC1*R2C -> 0 | C746: =RC1*R2C -> 0 | D746: =RC1*R2C -> 0 | E746: =RC1*R2C -> 0 | F746: =RC1*R2C -> 0 | G746: =RC1*R2C -> 0 | H746: =RC1*R2C -> 0 | I746: =RC1*R2C -> 0 | J746: =RC1*R2C -> 0 | K746: =RC1*R2C -> 0 | L746: =RC1*R2C -> 0 | M746: =RC1*R2C -> 0
B747: =RC1*R2C -> 0 | C747: =RC1*R2C -> 0 | D747: =RC1*R2C -> 0 | E747: =RC1*R2C -> 0 | F747: =RC1*R2C -> 0 | G747: =RC1*R2C -> 0 | H747: =RC1*R2C -> 0 | I747: =RC1*R2C -> 0 | J747: =RC1*R2C -> 0 | K747: =RC1*R2C -> 0 | L747: =RC1*R2C -> 0 | M747: =RC1*R2C -> 0
B748: =RC1*R2C -> 0 | C748: =RC1*R2C -> 0 | D748: =RC1*R2C -> 0 | E748: =RC1*R2C -> 0 | F748: =RC1*R2C -> 0 | G748: =RC1*R2C -> 0 | H748: =RC1*R2C -> 0 | I748: =RC1*R2C -> 0 | J748: =RC1*R2C -> 0 | K748: =RC1*R2C -> 0 | L748: =RC1*R2C -> 0 | M748: =RC1*R2C -> 0
B749: =RC1*R2C -> 0 | C749: =RC1*R2C -> 0 | D749: =RC1*R2C -> 0 | E749: =RC1*R2C -> 0 | F749: =RC1*R2C -> 0 | G749: =RC1*R2C -> 0 | H749: =RC1*R2C -> 0 | I749: =RC1*R2C -> 0 | J749: =RC1*R2C -> 0 | K749: =RC1*R2C -> 0 | L749: =RC1*R2C -> 0 | M749: =RC1*R2C -> 0
B750: =RC1*R2C -> 0 | C750: =RC1*R2C -> 0 | D750: =RC1*R2C -> 0 | E750: =RC1*R2C -> 0 | F750: =RC1*R2C -> 0 | G750: =RC1*R2C -> 0 | H750: =RC1*R2C -> 0 | I750: =RC1*R2C -> 0 | J750: =RC1*R2C -> 0 | K750: =RC1*R2C -> 0 | L750: =RC1*R2C -> 0 | M750: =RC1*R2C -> 0
B751: =RC1*R2C -> 0 | C751: =RC1*R2C -> 0 | D751: =RC1*R2C -> 0 | E751: =RC1*R2C -> 0 | F751: =RC1*R2C -> 0 | G751: =RC1*R2C -> 0 | H751: =RC1*R2C -> 0 | I751: =RC1*R2C -> 0 | J751: =RC1*R2C -> 0 | K751: =RC1*R2C -> 0 | L751: =RC1*R2C -> 0 | M751: =RC1*R2C -> 0
B752: =RC1*R2C -> 0 | C752: =RC1*R2C -> 0 | D752: =RC1*R2C -> 0 | E752: =RC1*R2C -> 0 | F752: =RC1*R2C -> 0 | G752: =RC1*R2C -> 0 | H752: =RC1*R2C -> 0 | I752: =RC1*R2C -> 0 | J752: =RC1*R2C -> 0 | K752: =RC1*R2C -> 0 | L752: =RC1*R2C -> 0 | M752: =RC1*R2C -> 0
B753: =RC1*R2C -> 0 | C753: =RC1*R2C -> 0 | D753: =RC1*R2C -> 0 | E753: =RC1*R2C -> 0 | F753: =RC1*R2C -> 0 | G753: =RC1*R2C -> 0 | H753: =RC1*R2C -> 0 | I753: =RC1*R2C -> 0 | J753: =RC1*R2C -> 0 | K753: =RC1*R2C -> 0 | L753: =RC1*R2C -> 0 | M753: =RC1*R2C -> 0
B754: =RC1*R2C -> 0 | C754: =RC1*R2C -> 0 | D754: =RC1*R2C -> 0 | E754: =RC1*R2C -> 0 | F754: =RC1*R2C -> 0 | G754: =RC1*R2C -> 0 | H754: =RC1*R2C -> 0 | I754: =RC1*R2C -> 0 | J754: =RC1*R2C -> 0 | K754: =RC1*R2C -> 0 | L754: =RC1*R2C -> 0 | M754: =RC1*R2C -> 0
B755: =RC1*R2C -> 0 | C755: =RC1*R2C -> 0 | D755: =RC1*R2C -> 0 | E755: =RC1*R2C -> 0 | F755: =RC1*R2C -> 0 | G755: =RC1*R2C -> 0 | H755: =RC1*R2C -> 0 | I755: =RC1*R2C -> 0 | J755: =RC1*R2C -> 0 | K755: =RC1*R2C -> 0 | L755: =RC1*R2C -> 0 | M755: =RC1*R2C -> 0
B756: =RC1*R2C -> 0 | C756: =RC1*R2C -> 0 | D756: =RC1*R2C -> 0 | E756: =RC1*R2C -> 0 | F756: =RC1*R2C -> 0 | G756: =RC1*R2C -> 0 | H756: =RC1*R2C -> 0 | I756: =RC1*R2C -> 0 | J756: =RC1*R2C -> 0 | K756: =RC1*R2C -> 0 | L756: =RC1*R2C -> 0 | M756: =RC1*R2C -> 0
B757: =RC1*R2C -> 0 | C757: =RC1*R2C -> 0 | D757: =RC1*R2C -> 0 | E757: =RC1*R2C -> 0 | F757: =RC1*R2C -> 0 | G757: =RC1*R2C -> 0 | H757: =RC1*R2C -> 0 | I757: =RC1*R2C -> 0 | J757: =RC1*R2C -> 0 | K757: =RC1*R2C -> 0 | L757: =RC1*R2C -> 0 | M757: =RC1*R2C -> 0
B758: =RC1*R2C -> 0 | C758: =RC1*R2C -> 0 | D758: =RC1*R2C -> 0 | E758: =RC1*R2C -> 0 | F758: =RC1*R2C -> 0 | G758: =RC1*R2C -> 0 | H758: =RC1*R2C -> 0 | I758: =RC1*R2C -> 0 | J758: =RC1*R2C -> 0 | K758: =RC1*R2C -> 0 | L758: =RC1*R2C -> 0 | M758: =RC1*R2C -> 0
B759: =RC1*R2C -> 0 | C759: =RC1*R2C -> 0 | D759: =RC1*R2C -> 0 | E759: =RC1*R2C -> 0 | F759: =RC1*R2C -> 0 | G759: =RC1*R2C -> 0 | H759: =RC1*R2C -> 0 | I759: =RC1*R2C -> 0 | J759: =RC1*R2C -> 0 | K759: =RC1*R2C -> 0 | L759: =RC1*R2C -> 0 | M759: =RC1*R2C -> 0
B760: =RC1*R2C -> 0 | C760: =RC1*R2C -> 0 | D760: =RC1*R2C -> 0 | E760: =RC1*R2C -> 0 | F760: =RC1*R2C -> 0 | G760: =RC1*R2C -> 0 | H760: =RC1*R2C -> 0 | I760: =RC1*R2C -> 0 | J760: =RC1*R2C -> 0 | K760: =RC1*R2C -> 0 | L760: =RC1*R2C -> 0 | M760: =RC1*R2C -> 0
B761: =RC1*R2C -> 0 | C761: =RC1*R2C -> 0 | D761: =RC1*R2C -> 0 | E761: =RC1*R2C -> 0 | F761: =RC1*R2C -> 0 | G761: =RC1*R2C -> 0 | H761: =RC1*R2C -> 0 | I761: =RC1*R2C -> 0 | J761: =RC1*R2C -> 0 | K761: =RC1*R2C -> 0 | L761: =RC1*R2C -> 0 | M761: =RC1*R2C -> 0
B762: =RC1*R2C -> 0 | C762: =RC1*R2C -> 0 | D762: =RC1*R2C -> 0 | E762: =RC1*R2C -> 0 | F762: =RC1*R2C -> 0 | G762: =RC1*R2C -> 0 | H762: =RC1*R2C -> 0 | I762: =RC1*R2C -> 0 | J762: =RC1*R2C -> 0 | K762: =RC1*R2C -> 0 | L762: =RC1*R2C -> 0 | M762: =RC1*R2C -> 0
B763: =RC1*R2C -> 0 | C763: =RC1*R2C -> 0 | D763: =RC1*R2C -> 0 | E763: =RC1*R2C -> 0 | F763: =RC1*R2C -> 0 | G763: =RC1*R2C -> 0 | H763: =RC1*R2C -> 0 | I763: =RC1*R2C -> 0 | J763: =RC1*R2C -> 0 | K763: =RC1*R2C -> 0 | L763: =RC1*R2C -> 0 | M763: =RC1*R2C -> 0
B764: =RC1*R2C -> 0 | C764: =RC1*R2C -> 0 | D764: =RC1*R2C -> 0 | E764: =RC1*R2C -> 0 | F764: =RC1*R2C -> 0 | G764: =RC1*R2C -> 0 | H764: =RC1*R2C -> 0 | I764: =RC1*R2C -> 0 | J764: =RC1*R2C -> 0 | K764: =RC1*R2C -> 0 | L764: =RC1*R2C -> 0 | M764: =RC1*R2C -> 0
B765: =RC1*R2C -> 0 | C765: =RC1*R2C -> 0 | D765: =RC1*R2C -> 0 | E765: =RC1*R2C -> 0 | F765: =RC1*R2C -> 0 | G765: =RC1*R2C -> 0 | H765: =RC1*R2C -> 0 | I765: =RC1*R2C -> 0 | J765: =RC1*R2C -> 0 | K765: =RC1*R2C -> 0 | L765: =RC1*R2C -> 0 | M765: =RC1*R2C -> 0
B766: =RC1*R2C -> 0 | C766: =RC1*R2C -> 0 | D766: =RC1*R2C -> 0 | E766: =RC1*R2C -> 0 | F766: =RC1*R2C -> 0 | G766: =RC1*R2C -> 0 | H766: =RC1*R2C -> 0 | I766: =RC1*R2C -> 0 | J766: =RC1*R2C -> 0 | K766: =RC1*R2C -> 0 | L766: =RC1*R2C -> 0 | M766: =RC1*R2C -> 0
B767: =RC1*R2C -> 0 | C767: =RC1*R2C -> 0 | D767: =RC1*R2C -> 0 | E767: =RC1*R2C -> 0 | F767: =RC1*R2C -> 0 | G767: =RC1*R2C -> 0 | H767: =RC1*R2C -> 0 | I767: =RC1*R2C -> 0 | J767: =RC1*R2C -> 0 | K767: =RC1*R2C -> 0 | L767: =RC1*R2C -> 0 | M767: =RC1*R2C -> 0
B768: =RC1*R2C -> 0 | C768: =RC1*R2C -> 0 | D768: =RC1*R2C -> 0 | E768: =RC1*R2C -> 0 | F768: =RC1*R2C -> 0 | G768: =RC1*R2C -> 0 | H768: =RC1*R2C -> 0 | I768: =RC1*R2C -> 0 | J768: =RC1*R2C -> 0 | K768: =RC1*R2C -> 0 | L768: =RC1*R2C -> 0 | M768: =RC1*R2C -> 0
B769: =RC1*R2C -> 0 | C769: =RC1*R2C -> 0 | D769: =RC1*R2C -> 0 | E769: =RC1*R2C -> 0 | F769: =RC1*R2C -> 0 | G769: =RC1*R2C -> 0 | H769: =RC1*R2C -> 0 | I769: =RC1*R2C -> 0 | J769: =RC1*R2C -> 0 | K769: =RC1*R2C -> 0 | L769: =RC1*R2C -> 0 | M769: =RC1*R2C -> 0
B770: =RC1*R2C -> 0 | C770: =RC1*R2C -> 0 | D770: =RC1*R2C -> 0 | E770: =RC1*R2C -> 0 | F770: =RC1*R2C -> 0 | G770: =RC1*R2C -> 0 | H770: =RC1*R2C -> 0 | I770: =RC1*R2C -> 0 | J770: =RC1*R2C -> 0 | K770: =RC1*R2C -> 0 | L770: =RC1*R2C -> 0 | M770: =RC1*R2C -> 0
B771: =RC1*R2C -> 0 | C771: =RC1*R2C -> 0 | D771: =RC1*R2C -> 0 | E771: =RC1*R2C -> 0 | F771: =RC1*R2C -> 0 | G771: =RC1*R2C -> 0 | H771: =RC1*R2C -> 0 | I771: =RC1*R2C -> 0 | J771: =RC1*R2C -> 0 | K771: =RC1*R2C -> 0 | L771: =RC1*R2C -> 0 | M771: =RC1*R2C -> 0
B772: =RC1*R2C -> 0 | C772: =RC1*R2C -> 0 | D772: =RC1*R2C -> 0 | E772: =RC1*R2C -> 0 | F772: =RC1*R2C -> 0 | G772: =RC1*R2C -> 0 | H772: =RC1*R2C -> 0 | I772: =RC1*R2C -> 0 | J772: =RC1*R2C -> 0 | K772: =RC1*R2C -> 0 | L772: =RC1*R2C -> 0 | M772: =RC1*R2C -> 0
B773: =RC1*R2C -> 0 | C773: =RC1*R2C -> 0 | D773: =RC1*R2C -> 0 | E773: =RC1*R2C -> 0 | F773: =RC1*R2C -> 0 | G773: =RC1*R2C -> 0 | H773: =RC1*R2C -> 0 | I773: =RC1*R2C -> 0 | J773: =RC1*R2C -> 0 | K773: =RC1*R2C -> 0 | L773: =RC1*R2C -> 0 | M773: =RC1*R2C -> 0
B774: =RC1*R2C -> 0 | C774: =RC1*R2C -> 0 | D774: =RC1*R2C -> 0 | E774: =RC1*R2C -> 0 | F774: =RC1*R2C -> 0 | G774: =RC1*R2C -> 0 | H774: =RC1*R2C -> 0 | I774: =RC1*R2C -> 0 | J774: =RC1*R2C -> 0 | K774: =RC1*R2C -> 0 | L774: =RC1*R2C -> 0 | M774: =RC1*R2C -> 0
B775: =RC1*R2C -> 0 | C775: =RC1*R2C -> 0 | D775: =RC1*R2C -> 0 | E775: =RC1*R2C -> 0 | F775: =RC1*R2C -> 0 | G775: =RC1*R2C -> 0 | H775: =RC1*R2C -> 0 | I775: =RC1*R2C -> 0 | J775: =RC1*R2C -> 0 | K775: =RC1*R2C -> 0 | L775: =RC1*R2C -> 0 | M775: =RC1*R2C -> 0
B776: =RC1*R2C -> 0 | C776: =RC1*R2C -> 0 | D776: =RC1*R2C -> 0 | E776: =RC1*R2C -> 0 | F776: =RC1*R2C -> 0 | G776: =RC1*R2C -> 0 | H776: =RC1*R2C -> 0 | I776: =RC1*R2C -> 0 | J776: =RC1*R2C -> 0 | K776: =RC1*R2C -> 0 | L776: =RC1*R2C -> 0 | M776: =RC1*R2C -> 0
B777: =RC1*R2C -> 0 | C777: =RC1*R2C -> 0 | D777: =RC1*R2C -> 0 | E777: =RC1*R2C -> 0 | F777: =RC1*R2C -> 0 | G777: =RC1*R2C -> 0 | H777: =RC1*R2C -> 0 | I777: =RC1*R2C -> 0 | J777: =RC1*R2C -> 0 | K777: =RC1*R2C -> 0 | L777: =RC1*R2C -> 0 | M777: =RC1*R2C -> 0
B778: =RC1*R2C -> 0 | C778: =RC1*R2C -> 0 | D778: =RC1*R2C -> 0 | E778: =RC1*R2C -> 0 | F778: =RC1*R2C -> 0 | G778: =RC1*R2C -> 0 | H778: =RC1*R2C -> 0 | I778: =RC1*R2C -> 0 | J778: =RC1*R2C -> 0 | K778: =RC1*R2C -> 0 | L778: =RC1*R2C -> 0 | M778: =RC1*R2C -> 0
B779: =RC1*R2C -> 0 | C779: =RC1*R2C -> 0 | D779: =RC1*R2C -> 0 | E779: =RC1*R2C -> 0 | F779: =RC1*R2C -> 0 | G779: =RC1*R2C -> 0 | H779: =RC1*R2C -> 0 | I779: =RC1*R2C -> 0 | J779: =RC1*R2C -> 0 | K779: =RC1*R2C -> 0 | L779: =RC1*R2C -> 0 | M779: =RC1*R2C -> 0
B780: =RC1*R2C -> 0 | C780: =RC1*R2C -> 0 | D780: =RC1*R2C -> 0 | E780: =RC1*R2C -> 0 | F780: =RC1*R2C -> 0 | G780: =RC1*R2C -> 0 | H780: =RC1*R2C -> 0 | I780: =RC1*R2C -> 0 | J780: =RC1*R2C -> 0 | K780: =RC1*R2C -> 0 | L780: =RC1*R2C -> 0 | M780: =RC1*R2C -> 0
B781: =RC1*R2C -> 0 | C781: =RC1*R2C -> 0 | D781: =RC1*R2C -> 0 | E781: =RC1*R2C -> 0 | F781: =RC1*R2C -> 0 | G781: =RC1*R2C -> 0 | H781: =RC1*R2C -> 0 | I781: =RC1*R2C -> 0 | J781: =RC1*R2C -> 0 | K781: =RC1*R2C -> 0 | L781: =RC1*R2C -> 0 | M781: =RC1*R2C -> 0
B782: =RC1*R2C -> 0 | C782: =RC1*R2C -> 0 | D782: =RC1*R2C -> 0 | E782: =RC1*R2C -> 0 | F782: =RC1*R2C -> 0 | G782: =RC1*R2C -> 0 | H782: =RC1*R2C -> 0 | I782: =RC1*R2C -> 0 | J782: =RC1*R2C -> 0 | K782: =RC1*R2C -> 0 | L782: =RC1*R2C -> 0 | M782: =RC1*R2C -> 0
B783: =RC1*R2C -> 0 | C783: =RC1*R2C -> 0 | D783: =RC1*R2C -> 0 | E783: =RC1*R2C -> 0 | F783: =RC1*R2C -> 0 | G783: =RC1*R2C -> 0 | H783: =RC1*R2C -> 0 | I783: =RC1*R2C -> 0 | J783: =RC1*R2C -> 0 | K783: =RC1*R2C -> 0 | L783: =RC1*R2C -> 0 | M783: =RC1*R2C -> 0
B784: =RC1*R2C -> 0 | C784: =RC1*R2C -> 0 | D784: =RC1*R2C -> 0 | E784: =RC1*R2C -> 0 | F784: =RC1*R2C -> 0 | G784: =RC1*R2C -> 0 | H784: =RC1*R2C -> 0 | I784: =RC1*R2C -> 0 | J784: =RC1*R2C -> 0 | K784: =RC1*R2C -> 0 | L784: =RC1*R2C -> 0 | M784: =RC1*R2C -> 0
B785: =RC1*R2C -> 0 | C785: =RC1*R2C -> 0 | D785: =RC1*R2C -> 0 | E785: =RC1*R2C -> 0 | F785: =RC1*R2C -> 0 | G785: =RC1*R2C -> 0 | H785: =RC1*R2C -> 0 | I785: =RC1*R2C -> 0 | J785: =RC1*R2C -> 0 | K785: =RC1*R2C -> 0 | L785: =RC1*R2C -> 0 | M785: =RC1*R2C -> 0
B786: =RC1*R2C -> 0 | C786: =RC1*R2C -> 0 | D786: =RC1*R2C -> 0 | E786: =RC1*R2C -> 0 | F786: =RC1*R2C -> 0 | G786: =RC1*R2C -> 0 | H786: =RC1*R2C -> 0 | I786: =RC1*R2C -> 0 | J786: =RC1*R2C -> 0 | K786: =RC1*R2C -> 0 | L786: =RC1*R2C -> 0 | M786: =RC1*R2C -> 0
B787: =RC1*R2C -> 0 | C787: =RC1*R2C -> 0 | D787: =RC1*R2C -> 0 | E787: =RC1*R2C -> 0 | F787: =RC1*R2C -> 0 | G787: =RC1*R2C -> 0 | H787: =RC1*R2C -> 0 | I787: =RC1*R2C -> 0 | J787: =RC1*R2C -> 0 | K787: =RC1*R2C -> 0 | L787: =RC1*R2C -> 0 | M787: =RC1*R2C -> 0
B788: =RC1*R2C -> 0 | C788: =RC1*R2C -> 0 | D788: =RC1*R2C -> 0 | E788: =RC1*R2C -> 0 | F788: =RC1*R2C -> 0 | G788: =RC1*R2C -> 0 | H788: =RC1*R2C -> 0 | I788: =RC1*R2C -> 0 | J788: =RC1*R2C -> 0 | K788: =RC1*R2C -> 0 | L788: =RC1*R2C -> 0 | M788: =RC1*R2C -> 0
B789: =RC1*R2C -> 0 | C789: =RC1*R2C -> 0 | D789: =RC1*R2C -> 0 | E789: =RC1*R2C -> 0 | F789: =RC1*R2C -> 0 | G789: =RC1*R2C -> 0 | H789: =RC1*R2C -> 0 | I789: =RC1*R2C -> 0 | J789: =RC1*R2C -> 0 | K789: =RC1*R2C -> 0 | L789: =RC1*R2C -> 0 | M789: =RC1*R2C -> 0
B790: =RC1*R2C -> 0 | C790: =RC1*R2C -> 0 | D790: =RC1*R2C -> 0 | E790: =RC1*R2C -> 0 | F790: =RC1*R2C -> 0 | G790: =RC1*R2C -> 0 | H790: =RC1*R2C -> 0 | I790: =RC1*R2C -> 0 | J790: =RC1*R2C -> 0 | K790: =RC1*R2C -> 0 | L790: =RC1*R2C -> 0 | M790: =RC1*R2C -> 0
B791: =RC1*R2C -> 0 | C791: =RC1*R2C -> 0 | D791: =RC1*R2C -> 0 | E791: =RC1*R2C -> 0 | F791: =RC1*R2C -> 0 | G791: =RC1*R2C -> 0 | H791: =RC1*R2C -> 0 | I791: =RC1*R2C -> 0 | J791: =RC1*R2C -> 0 | K791: =RC1*R2C -> 0 | L791: =RC1*R2C -> 0 | M791: =RC1*R2C -> 0
B792: =RC1*R2C -> 0 | C792: =RC1*R2C -> 0 | D792: =RC1*R2C -> 0 | E792: =RC1*R2C -> 0 | F792: =RC1*R2C -> 0 | G792: =RC1*R2C -> 0 | H792: =RC1*R2C -> 0 | I792: =RC1*R2C -> 0 | J792: =RC1*R2C -> 0 | K792: =RC1*R2C -> 0 | L792: =RC1*R2C -> 0 | M792: =RC1*R2C -> 0
B793: =RC1*R2C -> 0 | C793: =RC1*R2C -> 0 | D793: =RC1*R2C -> 0 | E793: =RC1*R2C -> 0 | F793: =RC1*R2C -> 0 | G793: =RC1*R2C -> 0 | H793: =RC1*R2C -> 0 | I793: =RC1*R2C -> 0 | J793: =RC1*R2C -> 0 | K793: =RC1*R2C -> 0 | L793: =RC1*R2C -> 0 | M793: =RC1*R2C -> 0
B794: =RC1*R2C -> 0 | C794: =RC1*R2C -> 0 | D794: =RC1*R2C -> 0 | E794: =RC1*R2C -> 0 | F794: =RC1*R2C -> 0 | G794: =RC1*R2C -> 0 | H794: =RC1*R2C -> 0 | I794: =RC1*R2C -> 0 | J794: =RC1*R2C -> 0 | K794: =RC1*R2C -> 0 | L794: =RC1*R2C -> 0 | M794: =RC1*R2C -> 0
B795: =RC1*R2C -> 0 | C795: =RC1*R2C -> 0 | D795: =RC1*R2C -> 0 | E795: =RC1*R2C -> 0 | F795: =RC1*R2C -> 0 | G795: =RC1*R2C -> 0 | H795: =RC1*R2C -> 0 | I795: =RC1*R2C -> 0 | J795: =RC1*R2C -> 0 | K795: =RC1*R2C -> 0 | L795: =RC1*R2C -> 0 | M795: =RC1*R2C -> 0
B796: =RC1*R2C -> 0 | C796: =RC1*R2C -> 0 | D796: =RC1*R2C -> 0 | E796: =RC1*R2C -> 0 | F796: =RC1*R2C -> 0 | G796: =RC1*R2C -> 0 | H796: =RC1*R2C -> 0 | I796: =RC1*R2C -> 0 | J796: =RC1*R2C -> 0 | K796: =RC1*R2C -> 0 | L796: =RC1*R2C -> 0 | M796: =RC1*R2C -> 0
B797: =RC1*R2C -> 0 | C797: =RC1*R2C -> 0 | D797: =RC1*R2C -> 0 | E797: =RC1*R2C -> 0 | F797: =RC1*R2C -> 0 | G797: =RC1*R2C -> 0 | H797: =RC1*R2C -> 0 | I797: =RC1*R2C -> 0 | J797: =RC1*R2C -> 0 | K797: =RC1*R2C -> 0 | L797: =RC1*R2C -> 0 | M797: =RC1*R2C -> 0
B798: =RC1*R2C -> 0 | C798: =RC1*R2C -> 0 | D798: =RC1*R2C -> 0 | E798: =RC1*R2C -> 0 | F798: =RC1*R2C -> 0 | G798: =RC1*R2C -> 0 | H798: =RC1*R2C -> 0 | I798: =RC1*R2C -> 0 | J798: =RC1*R2C -> 0 | K798: =RC1*R2C -> 0 | L798: =RC1*R2C -> 0 | M798: =RC1*R2C -> 0
B799: =RC1*R2C -> 0 | C799: =RC1*R2C -> 0 | D799: =RC1*R2C -> 0 | E799: =RC1*R2C -> 0 | F799: =RC1*R2C -> 0 | G799: =RC1*R2C -> 0 | H799: =RC1*R2C -> 0 | I799: =RC1*R2C -> 0 | J799: =RC1*R2C -> 0 | K799: =RC1*R2C -> 0 | L799: =RC1*R2C -> 0 | M799: =RC1*R2C -> 0
B800: =RC1*R2C -> 0 | C800: =RC1*R2C -> 0 | D800: =RC1*R2C -> 0 | E800: =RC1*R2C -> 0 | F800: =RC1*R2C -> 0 | G800: =RC1*R2C -> 0 | H800: =RC1*R2C -> 0 | I800: =RC1*R2C -> 0 | J800: =RC1*R2C -> 0 | K800: =RC1*R2C -> 0 | L800: =RC1*R2C -> 0 | M800: =RC1*R2C -> 0
B801: =RC1*R2C -> 0 | C801: =RC1*R2C -> 0 | D801: =RC1*R2C -> 0 | E801: =RC1*R2C -> 0 | F801: =RC1*R2C -> 0 | G801: =RC1*R2C -> 0 | H801: =RC1*R2C -> 0 | I801: =RC1*R2C -> 0 | J801: =RC1*R2C -> 0 | K801: =RC1*R2C -> 0 | L801: =RC1*R2C -> 0 | M801: =RC1*R2C -> 0
B802: =RC1*R2C -> 0 | C802: =RC1*R2C -> 0 | D802: =RC1*R2C -> 0 | E802: =RC1*R2C -> 0 | F802: =RC1*R2C -> 0 | G802: =RC1*R2C -> 0 | H802: =RC1*R2C -> 0 | I802: =RC1*R2C -> 0 | J802: =RC1*R2C -> 0 | K802: =RC1*R2C -> 0 | L802: =RC1*R2C -> 0 | M802: =RC1*R2C -> 0
B803: =RC1*R2C -> 0 | C803: =RC1*R2C -> 0 | D803: =RC1*R2C -> 0 | E803: =RC1*R2C -> 0 | F803: =RC1*R2C -> 0 | G803: =RC1*R2C -> 0 | H803: =RC1*R2C -> 0 | I803: =RC1*R2C -> 0 | J803: =RC1*R2C -> 0 | K803: =RC1*R2C -> 0 | L803: =RC1*R2C -> 0 | M803: =RC1*R2C -> 0
B804: =RC1*R2C -> 0 | C804: =RC1*R2C -> 0 | D804: =RC1*R2C -> 0 | E804: =RC1*R2C -> 0 | F804: =RC1*R2C -> 0 | G804: =RC1*R2C -> 0 | H804: =RC1*R2C -> 0 | I804: =RC1*R2C -> 0 | J804: =RC1*R2C -> 0 | K804: =RC1*R2C -> 0 | L804: =RC1*R2C -> 0 | M804: =RC1*R2C -> 0
B805: =RC1*R2C -> 0 | C805: =RC1*R2C -> 0 | D805: =RC1*R2C -> 0 | E805: =RC1*R2C -> 0 | F805: =RC1*R2C -> 0 | G805: =RC1*R2C -> 0 | H805: =RC1*R2C -> 0 | I805: =RC1*R2C -> 0 | J805: =RC1*R2C -> 0 | K805: =RC1*R2C -> 0 | L805: =RC1*R2C -> 0 | M805: =RC1*R2C -> 0
B806: =RC1*R2C -> 0 | C806: =RC1*R2C -> 0 | D806: =RC1*R2C -> 0 | E806: =RC1*R2C -> 0 | F806: =RC1*R2C -> 0 | G806: =RC1*R2C -> 0 | H806: =RC1*R2C -> 0 | I806: =RC1*R2C -> 0 | J806: =RC1*R2C -> 0 | K806: =RC1*R2C -> 0 | L806: =RC1*R2C -> 0 | M806: =RC1*R2C -> 0
B807: =RC1*R2C -> 0 | C807: =RC1*R2C -> 0 | D807: =RC1*R2C -> 0 | E807: =RC1*R2C -> 0 | F807: =RC1*R2C -> 0 | G807: =RC1*R2C -> 0 | H807: =RC1*R2C -> 0 | I807: =RC1*R2C -> 0 | J807: =RC1*R2C -> 0 | K807: =RC1*R2C -> 0 | L807: =RC1*R2C -> 0 | M807: =RC1*R2C -> 0
B808: =RC1*R2C -> 0 | C808: =RC1*R2C -> 0 | D808: =RC1*R2C -> 0 | E808: =RC1*R2C -> 0 | F808: =RC1*R2C -> 0 | G808: =RC1*R2C -> 0 | H808: =RC1*R2C -> 0 | I808: =RC1*R2C -> 0 | J808: =RC1*R2C -> 0 | K808: =RC1*R2C -> 0 | L808: =RC1*R2C -> 0 | M808: =RC1*R2C -> 0
B809: =RC1*R2C -> 0 | C809: =RC1*R2C -> 0 | D809: =RC1*R2C -> 0 | E809: =RC1*R2C -> 0 | F809: =RC1*R2C -> 0 | G809: =RC1*R2C -> 0 | H809: =RC1*R2C -> 0 | I809: =RC1*R2C -> 0 | J809: =RC1*R2C -> 0 | K809: =RC1*R2C -> 0 | L809: =RC1*R2C -> 0 | M809: =RC1*R2C -> 0
B810: =RC1*R2C -> 0 | C810: =RC1*R2C -> 0 | D810: =RC1*R2C -> 0 | E810: =RC1*R2C -> 0 | F810: =RC1*R2C -> 0 | G810: =RC1*R2C -> 0 | H810: =RC1*R2C -> 0 | I810: =RC1*R2C -> 0 | J810: =RC1*R2C -> 0 | K810: =RC1*R2C -> 0 | L810: =RC1*R2C -> 0 | M810: =RC1*R2C -> 0
B811: =RC1*R2C -> 0 | C811: =RC1*R2C -> 0 | D811: =RC1*R2C -> 0 | E811: =RC1*R2C -> 0 | F811: =RC1*R2C -> 0 | G811: =RC1*R2C -> 0 | H811: =RC1*R2C -> 0 | I811: =RC1*R2C -> 0 | J811: =RC1*R2C -> 0 | K811: =RC1*R2C -> 0 | L811: =RC1*R2C -> 0 | M811: =RC1*R2C -> 0
B812: =RC1*R2C -> 0 | C812: =RC1*R2C -> 0 | D812: =RC1*R2C -> 0 | E812: =RC1*R2C -> 0 | F812: =RC1*R2C -> 0 | G812: =RC1*R2C -> 0 | H812: =RC1*R2C -> 0 | I812: =RC1*R2C -> 0 | J812: =RC1*R2C -> 0 | K812: =RC1*R2C -> 0 | L812: =RC1*R2C -> 0 | M812: =RC1*R2C -> 0
B813: =RC1*R2C -> 0 | C813: =RC1*R2C -> 0 | D813: =RC1*R2C -> 0 | E813: =RC1*R2C -> 0 | F813: =RC1*R2C -> 0 | G813: =RC1*R2C -> 0 | H813: =RC1*R2C -> 0 | I813: =RC1*R2C -> 0 | J813: =RC1*R2C -> 0 | K813: =RC1*R2C -> 0 | L813: =RC1*R2C -> 0 | M813: =RC1*R2C -> 0
B814: =RC1*R2C -> 0 | C814: =RC1*R2C -> 0 | D814: =RC1*R2C -> 0 | E814: =RC1*R2C -> 0 | F814: =RC1*R2C -> 0 | G814: =RC1*R2C -> 0 | H814: =RC1*R2C -> 0 | I814: =RC1*R2C -> 0 | J814: =RC1*R2C -> 0 | K814: =RC1*R2C -> 0 | L814: =RC1*R2C -> 0 | M814: =RC1*R2C -> 0
B815: =RC1*R2C -> 0 | C815: =RC1*R2C -> 0 | D815: =RC1*R2C -> 0 | E815: =RC1*R2C -> 0 | F815: =RC1*R2C -> 0 | G815: =RC1*R2C -> 0 | H815: =RC1*R2C -> 0 | I815: =RC1*R2C -> 0 | J815: =RC1*R2C -> 0 | K815: =RC1*R2C -> 0 | L815: =RC1*R2C -> 0 | M815: =RC1*R2C -> 0
B816: =RC1*R2C -> 0 | C816: =RC1*R2C -> 0 | D816: =RC1*R2C -> 0 | E816: =RC1*R2C -> 0 | F816: =RC1*R2C -> 0 | G816: =RC1*R2C -> 0 | H816: =RC1*R2C -> 0 | I816: =RC1*R2C -> 0 | J816: =RC1*R2C -> 0 | K816: =RC1*R2C -> 0 | L816: =RC1*R2C -> 0 | M816: =RC1*R2C -> 0
B817: =RC1*R2C -> 0 | C817: =RC1*R2C -> 0 | D817: =RC1*R2C -> 0 | E817: =RC1*R2C -> 0 | F817: =RC1*R2C -> 0 | G817: =RC1*R2C -> 0 | H817: =RC1*R2C -> 0 | I817: =RC1*R2C -> 0 | J817: =RC1*R2C -> 0 | K817: =RC1*R2C -> 0 | L817: =RC1*R2C -> 0 | M817: =RC1*R2C -> 0
B818: =RC1*R2C -> 0 | C818: =RC1*R2C -> 0 | D818: =RC1*R2C -> 0 | E818: =RC1*R2C -> 0 | F818: =RC1*R2C -> 0 | G818: =RC1*R2C -> 0 | H818: =RC1*R2C -> 0 | I818: =RC1*R2C -> 0 | J818: =RC1*R2C -> 0 | K818: =RC1*R2C -> 0 | L818: =RC1*R2C -> 0 | M818: =RC1*R2C -> 0
B819: =RC1*R2C -> 0 | C819: =RC1*R2C -> 0 | D819: =RC1*R2C -> 0 | E819: =RC1*R2C -> 0 | F819: =RC1*R2C -> 0 | G819: =RC1*R2C -> 0 | H819: =RC1*R2C -> 0 | I819: =RC1*R2C -> 0 | J819: =RC1*R2C -> 0 | K819: =RC1*R2C -> 0 | L819: =RC1*R2C -> 0 | M819: =RC1*R2C -> 0
B820: =RC1*R2C -> 0 | C820: =RC1*R2C -> 0 | D820: =RC1*R2C -> 0 | E820: =RC1*R2C -> 0 | F820: =RC1*R2C -> 0 | G820: =RC1*R2C -> 0 | H820: =RC1*R2C -> 0 | I820: =RC1*R2C -> 0 | J820: =RC1*R2C -> 0 | K820: =RC1*R2C -> 0 | L820: =RC1*R2C -> 0 | M820: =RC1*R2C -> 0
B821: =RC1*R2C -> 0 | C821: =RC1*R2C -> 0 | D821: =RC1*R2C -> 0 | E821: =RC1*R2C -> 0 | F821: =RC1*R2C -> 0 | G821: =RC1*R2C -> 0 | H821: =RC1*R2C -> 0 | I821: =RC1*R2C -> 0 | J821: =RC1*R2C -> 0 | K821: =RC1*R2C -> 0 | L821: =RC1*R2C -> 0 | M821: =RC1*R2C -> 0
B822: =RC1*R2C -> 0 | C822: =RC1*R2C -> 0 | D822: =RC1*R2C -> 0 | E822: =RC1*R2C -> 0 | F822: =RC1*R2C -> 0 | G822: =RC1*R2C -> 0 | H822: =RC1*R2C -> 0 | I822: =RC1*R2C -> 0 | J822: =RC1*R2C -> 0 | K822: =RC1*R2C -> 0 | L822: =RC1*R2C -> 0 | M822: =RC1*R2C -> 0
B823: =RC1*R2C -> 0 | C823: =RC1*R2C -> 0 | D823: =RC1*R2C -> 0 | E823: =RC1*R2C -> 0 | F823: =RC1*R2C -> 0 | G823: =RC1*R2C -> 0 | H823: =RC1*R2C -> 0 | I823: =RC1*R2C -> 0 | J823: =RC1*R2C -> 0 | K823: =RC1*R2C -> 0 | L823: =RC1*R2C -> 0 | M823: =RC1*R2C -> 0
B824: =RC1*R2C -> 0 | C824: =RC1*R2C -> 0 | D824: =RC1*R2C -> 0 | E824: =RC1*R2C -> 0 | F824: =RC1*R2C -> 0 | G824: =RC1*R2C -> 0 | H824: =RC1*R2C -> 0 | I824: =RC1*R2C -> 0 | J824: =RC1*R2C -> 0 | K824: =RC1*R2C -> 0 | L824: =RC1*R2C -> 0 | M824: =RC1*R2C -> 0
B825: =RC1*R2C -> 0 | C825: =RC1*R2C -> 0 | D825: =RC1*R2C -> 0 | E825: =RC1*R2C -> 0 | F825: =RC1*R2C -> 0 | G825: =RC1*R2C -> 0 | H825: =RC1*R2C -> 0 | I825: =RC1*R2C -> 0 | J825: =RC1*R2C -> 0 | K825: =RC1*R2C -> 0 | L825: =RC1*R2C -> 0 | M825: =RC1*R2C -> 0
B826: =RC1*R2C -> 0 | C826: =RC1*R2C -> 0 | D826: =RC1*R2C -> 0 | E826: =RC1*R2C -> 0 | F826: =RC1*R2C -> 0 | G826: =RC1*R2C -> 0 | H826: =RC1*R2C -> 0 | I826: =RC1*R2C -> 0 | J826: =RC1*R2C -> 0 | K826: =RC1*R2C -> 0 | L826: =RC1*R2C -> 0 | M826: =RC1*R2C -> 0
B827: =RC1*R2C -> 0 | C827: =RC1*R2C -> 0 | D827: =RC1*R2C -> 0 | E827: =RC1*R2C -> 0 | F827: =RC1*R2C -> 0 | G827: =RC1*R2C -> 0 | H827: =RC1*R2C -> 0 | I827: =RC1*R2C -> 0 | J827: =RC1*R2C -> 0 | K827: =RC1*R2C -> 0 | L827: =RC1*R2C -> 0 | M827: =RC1*R2C -> 0
B828: =RC1*R2C -> 0 | C828: =RC1*R2C -> 0 | D828: =RC1*R2C -> 0 | E828: =RC1*R2C -> 0 | F828: =RC1*R2C -> 0 | G828: =RC1*R2C -> 0 | H828: =RC1*R2C -> 0 | I828: =RC1*R2C -> 0 | J828: =RC1*R2C -> 0 | K828: =RC1*R2C -> 0 | L828: =RC1*R2C -> 0 | M828: =RC1*R2C -> 0
B829: =RC1*R2C -> 0 | C829: =RC1*R2C -> 0 | D829: =RC1*R2C -> 0 | E829: =RC1*R2C -> 0 | F829: =RC1*R2C -> 0 | G829: =RC1*R2C -> 0 | H829: =RC1*R2C -> 0 | I829: =RC1*R2C -> 0 | J829: =RC1*R2C -> 0 | K829: =RC1*R2C -> 0 | L829: =RC1*R2C -> 0 | M829: =RC1*R2C -> 0
B830: =RC1*R2C -> 0 | C830: =RC1*R2C -> 0 | D830: =RC1*R2C -> 0 | E830: =RC1*R2C -> 0 | F830: =RC1*R2C -> 0 | G830: =RC1*R2C -> 0 | H830: =RC1*R2C -> 0 | I830: =RC1*R2C -> 0 | J830: =RC1*R2C -> 0 | K830: =RC1*R2C -> 0 | L830: =RC1*R2C -> 0 | M830: =RC1*R2C -> 0
B831: =RC1*R2C -> 0 | C831: =RC1*R2C -> 0 | D831: =RC1*R2C -> 0 | E831: =RC1*R2C -> 0 | F831: =RC1*R2C -> 0 | G831: =RC1*R2C -> 0 | H831: =RC1*R2C -> 0 | I831: =RC1*R2C -> 0 | J831: =RC1*R2C -> 0 | K831: =RC1*R2C -> 0 | L831: =RC1*R2C -> 0 | M831: =RC1*R2C -> 0
B832: =RC1*R2C -> 0 | C832: =RC1*R2C -> 0 | D832: =RC1*R2C -> 0 | E832: =RC1*R2C -> 0 | F832: =RC1*R2C -> 0 | G832: =RC1*R2C -> 0 | H832: =RC1*R2C -> 0 | I832: =RC1*R2C -> 0 | J832: =RC1*R2C -> 0 | K832: =RC1*R2C -> 0 | L832: =RC1*R2C -> 0 | M832: =RC1*R2C -> 0
B833: =RC1*R2C -> 0 | C833: =RC1*R2C -> 0 | D833: =RC1*R2C -> 0 | E833: =RC1*R2C -> 0 | F833: =RC1*R2C -> 0 | G833: =RC1*R2C -> 0 | H833: =RC1*R2C -> 0 | I833: =RC1*R2C -> 0 | J833: =RC1*R2C -> 0 | K833: =RC1*R2C -> 0 | L833: =RC1*R2C -> 0 | M833: =RC1*R2C -> 0
B834: =RC1*R2C -> 0 | C834: =RC1*R2C -> 0 | D834: =RC1*R2C -> 0 | E834: =RC1*R2C -> 0 | F834: =RC1*R2C -> 0 | G834: =RC1*R2C -> 0 | H834: =RC1*R2C -> 0 | I834: =RC1*R2C -> 0 | J834: =RC1*R2C -> 0 | K834: =RC1*R2C -> 0 | L834: =RC1*R2C -> 0 | M834: =RC1*R2C -> 0
B835: =RC1*R2C -> 0 | C835: =RC1*R2C -> 0 | D835: =RC1*R2C -> 0 | E835: =RC1*R2C -> 0 | F835: =RC1*R2C -> 0 | G835: =RC1*R2C -> 0 | H835: =RC1*R2C -> 0 | I835: =RC1*R2C -> 0 | J835: =RC1*R2C -> 0 | K835: =RC1*R2C -> 0 | L835: =RC1*R2C -> 0 | M835: =RC1*R2C -> 0
B836: =RC1*R2C -> 0 | C836: =RC1*R2C -> 0 | D836: =RC1*R2C -> 0 | E836: =RC1*R2C -> 0 | F836: =RC1*R2C -> 0 | G836: =RC1*R2C -> 0 | H836: =RC1*R2C -> 0 | I836: =RC1*R2C -> 0 | J836: =RC1*R2C -> 0 | K836: =RC1*R2C -> 0 | L836: =RC1*R2C -> 0 | M836: =RC1*R2C -> 0
B837: =RC1*R2C -> 0 | C837: =RC1*R2C -> 0 | D837: =RC1*R2C -> 0 | E837: =RC1*R2C -> 0 | F837: =RC1*R2C -> 0 | G837: =RC1*R2C -> 0 | H837: =RC1*R2C -> 0 | I837: =RC1*R2C -> 0 | J837: =RC1*R2C -> 0 | K837: =RC1*R2C -> 0 | L837: =RC1*R2C -> 0 | M837: =RC1*R2C -> 0
B838: =RC1*R2C -> 0 | C838: =RC1*R2C -> 0 | D838: =RC1*R2C -> 0 | E838: =RC1*R2C -> 0 | F838: =RC1*R2C -> 0 | G838: =RC1*R2C -> 0 | H838: =RC1*R2C -> 0 | I838: =RC1*R2C -> 0 | J838: =RC1*R2C -> 0 | K838: =RC1*R2C -> 0 | L838: =RC1*R2C -> 0 | M838: =RC1*R2C -> 0
B839: =RC1*R2C -> 0 | C839: =RC1*R2C -> 0 | D839: =RC1*R2C -> 0 | E839: =RC1*R2C -> 0 | F839: =RC1*R2C -> 0 | G839: =RC1*R2C -> 0 | H839: =RC1*R2C -> 0 | I839: =RC1*R2C -> 0 | J839: =RC1*R2C -> 0 | K839: =RC1*R2C -> 0 | L839: =RC1*R2C -> 0 | M839: =RC1*R2C -> 0
B840: =RC1*R2C -> 0 | C840: =RC1*R2C -> 0 | D840: =RC1*R2C -> 0 | E840: =RC1*R2C -> 0 | F840: =RC1*R2C -> 0 | G840: =RC1*R2C -> 0 | H840: =RC1*R2C -> 0 | I840: =RC1*R2C -> 0 | J840: =RC1*R2C -> 0 | K840: =RC1*R2C -> 0 | L840: =RC1*R2C -> 0 | M840: =RC1*R2C -> 0
B841: =RC1*R2C -> 0 | C841: =RC1*R2C -> 0 | D841: =RC1*R2C -> 0 | E841: =RC1*R2C -> 0 | F841: =RC1*R2C -> 0 | G841: =RC1*R2C -> 0 | H841: =RC1*R2C -> 0 | I841: =RC1*R2C -> 0 | J841: =RC1*R2C -> 0 | K841: =RC1*R2C -> 0 | L841: =RC1*R2C -> 0 | M841: =RC1*R2C -> 0
B842: =RC1*R2C -> 0 | C842: =RC1*R2C -> 0 | D842: =RC1*R2C -> 0 | E842: =RC1*R2C -> 0 | F842: =RC1*R2C -> 0 | G842: =RC1*R2C -> 0 | H842: =RC1*R2C -> 0 | I842: =RC1*R2C -> 0 | J842: =RC1*R2C -> 0 | K842: =RC1*R2C -> 0 | L842: =RC1*R2C -> 0 | M842: =RC1*R2C -> 0
B843: =RC1*R2C -> 0 | C843: =RC1*R2C -> 0 | D843: =RC1*R2C -> 0 | E843: =RC1*R2C -> 0 | F843: =RC1*R2C -> 0 | G843: =RC1*R2C -> 0 | H843: =RC1*R2C -> 0 | I843: =RC1*R2C -> 0 | J843: =RC1*R2C -> 0 | K843: =RC1*R2C -> 0 | L843: =RC1*R2C -> 0 | M843: =RC1*R2C -> 0
B844: =RC1*R2C -> 0 | C844: =RC1*R2C -> 0 | D844: =RC1*R2C -> 0 | E844: =RC1*R2C -> 0 | F844: =RC1*R2C -> 0 | G844: =RC1*R2C -> 0 | H844: =RC1*R2C -> 0 | I844: =RC1*R2C -> 0 | J844: =RC1*R2C -> 0 | K844: =RC1*R2C -> 0 | L844: =RC1*R2C -> 0 | M844: =RC1*R2C -> 0
B845: =RC1*R2C -> 0 | C845: =RC1*R2C -> 0 | D845: =RC1*R2C -> 0 | E845: =RC1*R2C -> 0 | F845: =RC1*R2C -> 0 | G845: =RC1*R2C -> 0 | H845: =RC1*R2C -> 0 | I845: =RC1*R2C -> 0 | J845: =RC1*R2C -> 0 | K845: =RC1*R2C -> 0 | L845: =RC1*R2C -> 0 | M845: =RC1*R2C -> 0
B846: =RC1*R2C -> 0 | C846: =RC1*R2C -> 0 | D846: =RC1*R2C -> 0 | E846: =RC1*R2C -> 0 | F846: =RC1*R2C -> 0 | G846: =RC1*R2C -> 0 | H846: =RC1*R2C -> 0 | I846: =RC1*R2C -> 0 | J846: =RC1*R2C -> 0 | K846: =RC1*R2C -> 0 | L846: =RC1*R2C -> 0 | M846: =RC1*R2C -> 0
B847: =RC1*R2C -> 0 | C847: =RC1*R2C -> 0 | D847: =RC1*R2C -> 0 | E847: =RC1*R2C -> 0 | F847: =RC1*R2C -> 0 | G847: =RC1*R2C -> 0 | H847: =RC1*R2C -> 0 | I847: =RC1*R2C -> 0 | J847: =RC1*R2C -> 0 | K847: =RC1*R2C -> 0 | L847: =RC1*R2C -> 0 | M847: =RC1*R2C -> 0
B848: =RC1*R2C -> 0 | C848: =RC1*R2C -> 0 | D848: =RC1*R2C -> 0 | E848: =RC1*R2C -> 0 | F848: =RC1*R2C -> 0 | G848: =RC1*R2C -> 0 | H848: =RC1*R2C -> 0 | I848: =RC1*R2C -> 0 | J848: =RC1*R2C -> 0 | K848: =RC1*R2C -> 0 | L848: =RC1*R2C -> 0 | M848: =RC1*R2C -> 0
B849: =RC1*R2C -> 0 | C849: =RC1*R2C -> 0 | D849: =RC1*R2C -> 0 | E849: =RC1*R2C -> 0 | F849: =RC1*R2C -> 0 | G849: =RC1*R2C -> 0 | H849: =RC1*R2C -> 0 | I849: =RC1*R2C -> 0 | J849: =RC1*R2C -> 0 | K849: =RC1*R2C -> 0 | L849: =RC1*R2C -> 0 | M849: =RC1*R2C -> 0
B850: =RC1*R2C -> 0 | C850: =RC1*R2C -> 0 | D850: =RC1*R2C -> 0 | E850: =RC1*R2C -> 0 | F850: =RC1*R2C -> 0 | G850: =RC1*R2C -> 0 | H850: =RC1*R2C -> 0 | I850: =RC1*R2C -> 0 | J850: =RC1*R2C -> 0 | K850: =RC1*R2C -> 0 | L850: =RC1*R2C -> 0 | M850: =RC1*R2C -> 0
B851: =RC1*R2C -> 0 | C851: =RC1*R2C -> 0 | D851: =RC1*R2C -> 0 | E851: =RC1*R2C -> 0 | F851: =RC1*R2C -> 0 | G851: =RC1*R2C -> 0 | H851: =RC1*R2C -> 0 | I851: =RC1*R2C -> 0 | J851: =RC1*R2C -> 0 | K851: =RC1*R2C -> 0 | L851: =RC1*R2C -> 0 | M851: =RC1*R2C -> 0
B852: =RC1*R2C -> 0 | C852: =RC1*R2C -> 0 | D852: =RC1*R2C -> 0 | E852: =RC1*R2C -> 0 | F852: =RC1*R2C -> 0 | G852: =RC1*R2C -> 0 | H852: =RC1*R2C -> 0 | I852: =RC1*R2C -> 0 | J852: =RC1*R2C -> 0 | K852: =RC1*R2C -> 0 | L852: =RC1*R2C -> 0 | M852: =RC1*R2C -> 0
B853: =RC1*R2C -> 0 | C853: =RC1*R2C -> 0 | D853: =RC1*R2C -> 0 | E853: =RC1*R2C -> 0 | F853: =RC1*R2C -> 0 | G853: =RC1*R2C -> 0 | H853: =RC1*R2C -> 0 | I853: =RC1*R2C -> 0 | J853: =RC1*R2C -> 0 | K853: =RC1*R2C -> 0 | L853: =RC1*R2C -> 0 | M853: =RC1*R2C -> 0
B854: =RC1*R2C -> 0 | C854: =RC1*R2C -> 0 | D854: =RC1*R2C -> 0 | E854: =RC1*R2C -> 0 | F854: =RC1*R2C -> 0 | G854: =RC1*R2C -> 0 | H854: =RC1*R2C -> 0 | I854: =RC1*R2C -> 0 | J854: =RC1*R2C -> 0 | K854: =RC1*R2C -> 0 | L854: =RC1*R2C -> 0 | M854: =RC1*R2C -> 0
B855: =RC1*R2C -> 0 | C855: =RC1*R2C -> 0 | D855: =RC1*R2C -> 0 | E855: =RC1*R2C -> 0 | F855: =RC1*R2C -> 0 | G855: =RC1*R2C -> 0 | H855: =RC1*R2C -> 0 | I855: =RC1*R2C -> 0 | J855: =RC1*R2C -> 0 | K855: =RC1*R2C -> 0 | L855: =RC1*R2C -> 0 | M855: =RC1*R2C -> 0
B856: =RC1*R2C -> 0 | C856: =RC1*R2C -> 0 | D856: =RC1*R2C -> 0 | E856: =RC1*R2C -> 0 | F856: =RC1*R2C -> 0 | G856: =RC1*R2C -> 0 | H856: =RC1*R2C -> 0 | I856: =RC1*R2C -> 0 | J856: =RC1*R2C -> 0 | K856: =RC1*R2C -> 0 | L856: =RC1*R2C -> 0 | M856: =RC1*R2C -> 0
B857: =RC1*R2C -> 0 | C857: =RC1*R2C -> 0 | D857: =RC1*R2C -> 0 | E857: =RC1*R2C -> 0 | F857: =RC1*R2C -> 0 | G857: =RC1*R2C -> 0 | H857: =RC1*R2C -> 0 | I857: =RC1*R2C -> 0 | J857: =RC1*R2C -> 0 | K857: =RC1*R2C -> 0 | L857: =RC1*R2C -> 0 | M857: =RC1*R2C -> 0
B858: =RC1*R2C -> 0 | C858: =RC1*R2C -> 0 | D858: =RC1*R2C -> 0 | E858: =RC1*R2C -> 0 | F858: =RC1*R2C -> 0 | G858: =RC1*R2C -> 0 | H858: =RC1*R2C -> 0 | I858: =RC1*R2C -> 0 | J858: =RC1*R2C -> 0 | K858: =RC1*R2C -> 0 | L858: =RC1*R2C -> 0 | M858: =RC1*R2C -> 0
B859: =RC1*R2C -> 0 | C859: =RC1*R2C -> 0 | D859: =RC1*R2C -> 0 | E859: =RC1*R2C -> 0 | F859: =RC1*R2C -> 0 | G859: =RC1*R2C -> 0 | H859: =RC1*R2C -> 0 | I859: =RC1*R2C -> 0 | J859: =RC1*R2C -> 0 | K859: =RC1*R2C -> 0 | L859: =RC1*R2C -> 0 | M859: =RC1*R2C -> 0
B860: =RC1*R2C -> 0 | C860: =RC1*R2C -> 0 | D860: =RC1*R2C -> 0 | E860: =RC1*R2C -> 0 | F860: =RC1*R2C -> 0 | G860: =RC1*R2C -> 0 | H860: =RC1*R2C -> 0 | I860: =RC1*R2C -> 0 | J860: =RC1*R2C -> 0 | K860: =RC1*R2C -> 0 | L860: =RC1*R2C -> 0 | M860: =RC1*R2C -> 0
B861: =RC1*R2C -> 0 | C861: =RC1*R2C -> 0 | D861: =RC1*R2C -> 0 | E861: =RC1*R2C -> 0 | F861: =RC1*R2C -> 0 | G861: =RC1*R2C -> 0 | H861: =RC1*R2C -> 0 | I861: =RC1*R2C -> 0 | J861: =RC1*R2C -> 0 | K861: =RC1*R2C -> 0 | L861: =RC1*R2C -> 0 | M861: =RC1*R2C -> 0
B862: =RC1*R2C -> 0 | C862: =RC1*R2C -> 0 | D862: =RC1*R2C -> 0 | E862: =RC1*R2C -> 0 | F862: =RC1*R2C -> 0 | G862: =RC1*R2C -> 0 | H862: =RC1*R2C -> 0 | I862: =RC1*R2C -> 0 | J862: =RC1*R2C -> 0 | K862: =RC1*R2C -> 0 | L862: =RC1*R2C -> 0 | M862: =RC1*R2C -> 0
B863: =RC1*R2C -> 0 | C863: =RC1*R2C -> 0 | D863: =RC1*R2C -> 0 | E863: =RC1*R2C -> 0 | F863: =RC1*R2C -> 0 | G863: =RC1*R2C -> 0 | H863: =RC1*R2C -> 0 | I863: =RC1*R2C -> 0 | J863: =RC1*R2C -> 0 | K863: =RC1*R2C -> 0 | L863: =RC1*R2C -> 0 | M863: =RC1*R2C -> 0
B864: =RC1*R2C -> 0 | C864: =RC1*R2C -> 0 | D864: =RC1*R2C -> 0 | E864: =RC1*R2C -> 0 | F864: =RC1*R2C -> 0 | G864: =RC1*R2C -> 0 | H864: =RC1*R2C -> 0 | I864: =RC1*R2C -> 0 | J864: =RC1*R2C -> 0 | K864: =RC1*R2C -> 0 | L864: =RC1*R2C -> 0 | M864: =RC1*R2C -> 0
B865: =RC1*R2C -> 0 | C865: =RC1*R2C -> 0 | D865: =RC1*R2C -> 0 | E865: =RC1*R2C -> 0 | F865: =RC1*R2C -> 0 | G865: =RC1*R2C -> 0 | H865: =RC1*R2C -> 0 | I865: =RC1*R2C -> 0 | J865: =RC1*R2C -> 0 | K865: =RC1*R2C -> 0 | L865: =RC1*R2C -> 0 | M865: =RC1*R2C -> 0
B866: =RC1*R2C -> 0 | C866: =RC1*R2C -> 0 | D866: =RC1*R2C -> 0 | E866: =RC1*R2C -> 0 | F866: =RC1*R2C -> 0 | G866: =RC1*R2C -> 0 | H866: =RC1*R2C -> 0 | I866: =RC1*R2C -> 0 | J866: =RC1*R2C -> 0 | K866: =RC1*R2C -> 0 | L866: =RC1*R2C -> 0 | M866: =RC1*R2C -> 0
B867: =RC1*R2C -> 0 | C867: =RC1*R2C -> 0 | D867: =RC1*R2C -> 0 | E867: =RC1*R2C -> 0 | F867: =RC1*R2C -> 0 | G867: =RC1*R2C -> 0 | H867: =RC1*R2C -> 0 | I867: =RC1*R2C -> 0 | J867: =RC1*R2C -> 0 | K867: =RC1*R2C -> 0 | L867: =RC1*R2C -> 0 | M867: =RC1*R2C -> 0
B868: =RC1*R2C -> 0 | C868: =RC1*R2C -> 0 | D868: =RC1*R2C -> 0 | E868: =RC1*R2C -> 0 | F868: =RC1*R2C -> 0 | G868: =RC1*R2C -> 0 | H868: =RC1*R2C -> 0 | I868: =RC1*R2C -> 0 | J868: =RC1*R2C -> 0 | K868: =RC1*R2C -> 0 | L868: =RC1*R2C -> 0 | M868: =RC1*R2C -> 0
B869: =RC1*R2C -> 0 | C869: =RC1*R2C -> 0 | D869: =RC1*R2C -> 0 | E869: =RC1*R2C -> 0 | F869: =RC1*R2C -> 0 | G869: =RC1*R2C -> 0 | H869: =RC1*R2C -> 0 | I869: =RC1*R2C -> 0 | J869: =RC1*R2C -> 0 | K869: =RC1*R2C -> 0 | L869: =RC1*R2C -> 0 | M869: =RC1*R2C -> 0
B870: =RC1*R2C -> 0 | C870: =RC1*R2C -> 0 | D870: =RC1*R2C -> 0 | E870: =RC1*R2C -> 0 | F870: =RC1*R2C -> 0 | G870: =RC1*R2C -> 0 | H870: =RC1*R2C -> 0 | I870: =RC1*R2C -> 0 | J870: =RC1*R2C -> 0 | K870: =RC1*R2C -> 0 | L870: =RC1*R2C -> 0 | M870: =RC1*R2C -> 0
B871: =RC1*R2C -> 0 | C871: =RC1*R2C -> 0 | D871: =RC1*R2C -> 0 | E871: =RC1*R2C -> 0 | F871: =RC1*R2C -> 0 | G871: =RC1*R2C -> 0 | H871: =RC1*R2C -> 0 | I871: =RC1*R2C -> 0 | J871: =RC1*R2C -> 0 | K871: =RC1*R2C -> 0 | L871: =RC1*R2C -> 0 | M871: =RC1*R2C -> 0
B872: =RC1*R2C -> 0 | C872: =RC1*R2C -> 0 | D872: =RC1*R2C -> 0 | E872: =RC1*R2C -> 0 | F872: =RC1*R2C -> 0 | G872: =RC1*R2C -> 0 | H872: =RC1*R2C -> 0 | I872: =RC1*R2C -> 0 | J872: =RC1*R2C -> 0 | K872: =RC1*R2C -> 0 | L872: =RC1*R2C -> 0 | M872: =RC1*R2C -> 0
B873: =RC1*R2C -> 0 | C873: =RC1*R2C -> 0 | D873: =RC1*R2C -> 0 | E873: =RC1*R2C -> 0 | F873: =RC1*R2C -> 0 | G873: =RC1*R2C -> 0 | H873: =RC1*R2C -> 0 | I873: =RC1*R2C -> 0 | J873: =RC1*R2C -> 0 | K873: =RC1*R2C -> 0 | L873: =RC1*R2C -> 0 | M873: =RC1*R2C -> 0
B874: =RC1*R2C -> 0 | C874: =RC1*R2C -> 0 | D874: =RC1*R2C -> 0 | E874: =RC1*R2C -> 0 | F874: =RC1*R2C -> 0 | G874: =RC1*R2C -> 0 | H874: =RC1*R2C -> 0 | I874: =RC1*R2C -> 0 | J874: =RC1*R2C -> 0 | K874: =RC1*R2C -> 0 | L874: =RC1*R2C -> 0 | M874: =RC1*R2C -> 0
B875: =RC1*R2C -> 0 | C875: =RC1*R2C -> 0 | D875: =RC1*R2C -> 0 | E875: =RC1*R2C -> 0 | F875: =RC1*R2C -> 0 | G875: =RC1*R2C -> 0 | H875: =RC1*R2C -> 0 | I875: =RC1*R2C -> 0 | J875: =RC1*R2C -> 0 | K875: =RC1*R2C -> 0 | L875: =RC1*R2C -> 0 | M875: =RC1*R2C -> 0
B876: =RC1*R2C -> 0 | C876: =RC1*R2C -> 0 | D876: =RC1*R2C -> 0 | E876: =RC1*R2C -> 0 | F876: =RC1*R2C -> 0 | G876: =RC1*R2C -> 0 | H876: =RC1*R2C -> 0 | I876: =RC1*R2C -> 0 | J876: =RC1*R2C -> 0 | K876: =RC1*R2C -> 0 | L876: =RC1*R2C -> 0 | M876: =RC1*R2C -> 0
B877: =RC1*R2C -> 0 | C877: =RC1*R2C -> 0 | D877: =RC1*R2C -> 0 | E877: =RC1*R2C -> 0 | F877: =RC1*R2C -> 0 | G877: =RC1*R2C -> 0 | H877: =RC1*R2C -> 0 | I877: =RC1*R2C -> 0 | J877: =RC1*R2C -> 0 | K877: =RC1*R2C -> 0 | L877: =RC1*R2C -> 0 | M877: =RC1*R2C -> 0
B878: =RC1*R2C -> 0 | C878: =RC1*R2C -> 0 | D878: =RC1*R2C -> 0 | E878: =RC1*R2C -> 0 | F878: =RC1*R2C -> 0 | G878: =RC1*R2C -> 0 | H878: =RC1*R2C -> 0 | I878: =RC1*R2C -> 0 | J878: =RC1*R2C -> 0 | K878: =RC1*R2C -> 0 | L878: =RC1*R2C -> 0 | M878: =RC1*R2C -> 0
B879: =RC1*R2C -> 0 | C879: =RC1*R2C -> 0 | D879: =RC1*R2C -> 0 | E879: =RC1*R2C -> 0 | F879: =RC1*R2C -> 0 | G879: =RC1*R2C -> 0 | H879: =RC1*R2C -> 0 | I879: =RC1*R2C -> 0 | J879: =RC1*R2C -> 0 | K879: =RC1*R2C -> 0 | L879: =RC1*R2C -> 0 | M879: =RC1*R2C -> 0
B880: =RC1*R2C -> 0 | C880: =RC1*R2C -> 0 | D880: =RC1*R2C -> 0 | E880: =RC1*R2C -> 0 | F880: =RC1*R2C -> 0 | G880: =RC1*R2C -> 0 | H880: =RC1*R2C -> 0 | I880: =RC1*R2C -> 0 | J880: =RC1*R2C -> 0 | K880: =RC1*R2C -> 0 | L880: =RC1*R2C -> 0 | M880: =RC1*R2C -> 0
B881: =RC1*R2C -> 0 | C881: =RC1*R2C -> 0 | D881: =RC1*R2C -> 0 | E881: =RC1*R2C -> 0 | F881: =RC1*R2C -> 0 | G881: =RC1*R2C -> 0 | H881: =RC1*R2C -> 0 | I881: =RC1*R2C -> 0 | J881: =RC1*R2C -> 0 | K881: =RC1*R2C -> 0 | L881: =RC1*R2C -> 0 | M881: =RC1*R2C -> 0
B882: =RC1*R2C -> 0 | C882: =RC1*R2C -> 0 | D882: =RC1*R2C -> 0 | E882: =RC1*R2C -> 0 | F882: =RC1*R2C -> 0 | G882: =RC1*R2C -> 0 | H882: =RC1*R2C -> 0 | I882: =RC1*R2C -> 0 | J882: =RC1*R2C -> 0 | K882: =RC1*R2C -> 0 | L882: =RC1*R2C -> 0 | M882: =RC1*R2C -> 0
B883: =RC1*R2C -> 0 | C883: =RC1*R2C -> 0 | D883: =RC1*R2C -> 0 | E883: =RC1*R2C -> 0 | F883: =RC1*R2C -> 0 | G883: =RC1*R2C -> 0 | H883: =RC1*R2C -> 0 | I883: =RC1*R2C -> 0 | J883: =RC1*R2C -> 0 | K883: =RC1*R2C -> 0 | L883: =RC1*R2C -> 0 | M883: =RC1*R2C -> 0
B884: =RC1*R2C -> 0 | C884: =RC1*R2C -> 0 | D884: =RC1*R2C -> 0 | E884: =RC1*R2C -> 0 | F884: =RC1*R2C -> 0 | G884: =RC1*R2C -> 0 | H884: =RC1*R2C -> 0 | I884: =RC1*R2C -> 0 | J884: =RC1*R2C -> 0 | K884: =RC1*R2C -> 0 | L884: =RC1*R2C -> 0 | M884: =RC1*R2C -> 0
B885: =RC1*R2C -> 0 | C885: =RC1*R2C -> 0 | D885: =RC1*R2C -> 0 | E885: =RC1*R2C -> 0 | F885: =RC1*R2C -> 0 | G885: =RC1*R2C -> 0 | H885: =RC1*R2C -> 0 | I885: =RC1*R2C -> 0 | J885: =RC1*R2C -> 0 | K885: =RC1*R2C -> 0 | L885: =RC1*R2C -> 0 | M885: =RC1*R2C -> 0
B886: =RC1*R2C -> 0 | C886: =RC1*R2C -> 0 | D886: =RC1*R2C -> 0 | E886: =RC1*R2C -> 0 | F886: =RC1*R2C -> 0 | G886: =RC1*R2C -> 0 | H886: =RC1*R2C -> 0 | I886: =RC1*R2C -> 0 | J886: =RC1*R2C -> 0 | K886: =RC1*R2C -> 0 | L886: =RC1*R2C -> 0 | M886: =RC1*R2C -> 0
B887: =RC1*R2C -> 0 | C887: =RC1*R2C -> 0 | D887: =RC1*R2C -> 0 | E887: =RC1*R2C -> 0 | F887: =RC1*R2C -> 0 | G887: =RC1*R2C -> 0 | H887: =RC1*R2C -> 0 | I887: =RC1*R2C -> 0 | J887: =RC1*R2C -> 0 | K887: =RC1*R2C -> 0 | L887: =RC1*R2C -> 0 | M887: =RC1*R2C -> 0
B888: =RC1*R2C -> 0 | C888: =RC1*R2C -> 0 | D888: =RC1*R2C -> 0 | E888: =RC1*R2C -> 0 | F888: =RC1*R2C -> 0 | G888: =RC1*R2C -> 0 | H888: =RC1*R2C -> 0 | I888: =RC1*R2C -> 0 | J888: =RC1*R2C -> 0 | K888: =RC1*R2C -> 0 | L888: =RC1*R2C -> 0 | M888: =RC1*R2C -> 0
B889: =RC1*R2C -> 0 | C889: =RC1*R2C -> 0 | D889: =RC1*R2C -> 0 | E889: =RC1*R2C -> 0 | F889: =RC1*R2C -> 0 | G889: =RC1*R2C -> 0 | H889: =RC1*R2C -> 0 | I889: =RC1*R2C -> 0 | J889: =RC1*R2C -> 0 | K889: =RC1*R2C -> 0 | L889: =RC1*R2C -> 0 | M889: =RC1*R2C -> 0
B890: =RC1*R2C -> 0 | C890: =RC1*R2C -> 0 | D890: =RC1*R2C -> 0 | E890: =RC1*R2C -> 0 | F890: =RC1*R2C -> 0 | G890: =RC1*R2C -> 0 | H890: =RC1*R2C -> 0 | I890: =RC1*R2C -> 0 | J890: =RC1*R2C -> 0 | K890: =RC1*R2C -> 0 | L890: =RC1*R2C -> 0 | M890: =RC1*R2C -> 0
B891: =RC1*R2C -> 0 | C891: =RC1*R2C -> 0 | D891: =RC1*R2C -> 0 | E891: =RC1*R2C -> 0 | F891: =RC1*R2C -> 0 | G891: =RC1*R2C -> 0 | H891: =RC1*R2C -> 0 | I891: =RC1*R2C -> 0 | J891: =RC1*R2C -> 0 | K891: =RC1*R2C -> 0 | L891: =RC1*R2C -> 0 | M891: =RC1*R2C -> 0
B892: =RC1*R2C -> 0 | C892: =RC1*R2C -> 0 | D892: =RC1*R2C -> 0 | E892: =RC1*R2C -> 0 | F892: =RC1*R2C -> 0 | G892: =RC1*R2C -> 0 | H892: =RC1*R2C -> 0 | I892: =RC1*R2C -> 0 | J892: =RC1*R2C -> 0 | K892: =RC1*R2C -> 0 | L892: =RC1*R2C -> 0 | M892: =RC1*R2C -> 0
B893: =RC1*R2C -> 0 | C893: =RC1*R2C -> 0 | D893: =RC1*R2C -> 0 | E893: =RC1*R2C -> 0 | F893: =RC1*R2C -> 0 | G893: =RC1*R2C -> 0 | H893: =RC1*R2C -> 0 | I893: =RC1*R2C -> 0 | J893: =RC1*R2C -> 0 | K893: =RC1*R2C -> 0 | L893: =RC1*R2C -> 0 | M893: =RC1*R2C -> 0
B894: =RC1*R2C -> 0 | C894: =RC1*R2C -> 0 | D894: =RC1*R2C -> 0 | E894: =RC1*R2C -> 0 | F894: =RC1*R2C -> 0 | G894: =RC1*R2C -> 0 | H894: =RC1*R2C -> 0 | I894: =RC1*R2C -> 0 | J894: =RC1*R2C -> 0 | K894: =RC1*R2C -> 0 | L894: =RC1*R2C -> 0 | M894: =RC1*R2C -> 0
B895: =RC1*R2C -> 0 | C895: =RC1*R2C -> 0 | D895: =RC1*R2C -> 0 | E895: =RC1*R2C -> 0 | F895: =RC1*R2C -> 0 | G895: =RC1*R2C -> 0 | H895: =RC1*R2C -> 0 | I895: =RC1*R2C -> 0 | J895: =RC1*R2C -> 0 | K895: =RC1*R2C -> 0 | L895: =RC1*R2C -> 0 | M895: =RC1*R2C -> 0
B896: =RC1*R2C -> 0 | C896: =RC1*R2C -> 0 | D896: =RC1*R2C -> 0 | E896: =RC1*R2C -> 0 | F896: =RC1*R2C -> 0 | G896: =RC1*R2C -> 0 | H896: =RC1*R2C -> 0 | I896: =RC1*R2C -> 0 | J896: =RC1*R2C -> 0 | K896: =RC1*R2C -> 0 | L896: =RC1*R2C -> 0 | M896: =RC1*R2C -> 0
B897: =RC1*R2C -> 0 | C897: =RC1*R2C -> 0 | D897: =RC1*R2C -> 0 | E897: =RC1*R2C -> 0 | F897: =RC1*R2C -> 0 | G897: =RC1*R2C -> 0 | H897: =RC1*R2C -> 0 | I897: =RC1*R2C -> 0 | J897: =RC1*R2C -> 0 | K897: =RC1*R2C -> 0 | L897: =RC1*R2C -> 0 | M897: =RC1*R2C -> 0
B898: =RC1*R2C -> 0 | C898: =RC1*R2C -> 0 | D898: =RC1*R2C -> 0 | E898: =RC1*R2C -> 0 | F898: =RC1*R2C -> 0 | G898: =RC1*R2C -> 0 | H898: =RC1*R2C -> 0 | I898: =RC1*R2C -> 0 | J898: =RC1*R2C -> 0 | K898: =RC1*R2C -> 0 | L898: =RC1*R2C -> 0 | M898: =RC1*R2C -> 0
B899: =RC1*R2C -> 0 | C899: =RC1*R2C -> 0 | D899: =RC1*R2C -> 0 | E899: =RC1*R2C -> 0 | F899: =RC1*R2C -> 0 | G899: =RC1*R2C -> 0 | H899: =RC1*R2C -> 0 | I899: =RC1*R2C -> 0 | J899: =RC1*R2C -> 0 | K899: =RC1*R2C -> 0 | L899: =RC1*R2C -> 0 | M899: =RC1*R2C -> 0
B900: =RC1*R2C -> 0 | C900: =RC1*R2C -> 0 | D900: =RC1*R2C -> 0 | E900: =RC1*R2C -> 0 | F900: =RC1*R2C -> 0 | G900: =RC1*R2C -> 0 | H900: =RC1*R2C -> 0 | I900: =RC1*R2C -> 0 | J900: =RC1*R2C -> 0 | K900: =RC1*R2C -> 0 | L900: =RC1*R2C -> 0 | M900: =RC1*R2C -> 0
B901: =RC1*R2C -> 0 | C901: =RC1*R2C -> 0 | D901: =RC1*R2C -> 0 | E901: =RC1*R2C -> 0 | F901: =RC1*R2C -> 0 | G901: =RC1*R2C -> 0 | H901: =RC1*R2C -> 0 | I901: =RC1*R2C -> 0 | J901: =RC1*R2C -> 0 | K901: =RC1*R2C -> 0 | L901: =RC1*R2C -> 0 | M901: =RC1*R2C -> 0
B902: =RC1*R2C -> 0 | C902: =RC1*R2C -> 0 | D902: =RC1*R2C -> 0 | E902: =RC1*R2C -> 0 | F902: =RC1*R2C -> 0 | G902: =RC1*R2C -> 0 | H902: =RC1*R2C -> 0 | I902: =RC1*R2C -> 0 | J902: =RC1*R2C -> 0 | K902: =RC1*R2C -> 0 | L902: =RC1*R2C -> 0 | M902: =RC1*R2C -> 0
B903: =RC1*R2C -> 0 | C903: =RC1*R2C -> 0 | D903: =RC1*R2C -> 0 | E903: =RC1*R2C -> 0 | F903: =RC1*R2C -> 0 | G903: =RC1*R2C -> 0 | H903: =RC1*R2C -> 0 | I903: =RC1*R2C -> 0 | J903: =RC1*R2C -> 0 | K903: =RC1*R2C -> 0 | L903: =RC1*R2C -> 0 | M903: =RC1*R2C -> 0
B904: =RC1*R2C -> 0 | C904: =RC1*R2C -> 0 | D904: =RC1*R2C -> 0 | E904: =RC1*R2C -> 0 | F904: =RC1*R2C -> 0 | G904: =RC1*R2C -> 0 | H904: =RC1*R2C -> 0 | I904: =RC1*R2C -> 0 | J904: =RC1*R2C -> 0 | K904: =RC1*R2C -> 0 | L904: =RC1*R2C -> 0 | M904: =RC1*R2C -> 0
B905: =RC1*R2C -> 0 | C905: =RC1*R2C -> 0 | D905: =RC1*R2C -> 0 | E905: =RC1*R2C -> 0 | F905: =RC1*R2C -> 0 | G905: =RC1*R2C -> 0 | H905: =RC1*R2C -> 0 | I905: =RC1*R2C -> 0 | J905: =RC1*R2C -> 0 | K905: =RC1*R2C -> 0 | L905: =RC1*R2C -> 0 | M905: =RC1*R2C -> 0
B906: =RC1*R2C -> 0 | C906: =RC1*R2C -> 0 | D906: =RC1*R2C -> 0 | E906: =RC1*R2C -> 0 | F906: =RC1*R2C -> 0 | G906: =RC1*R2C -> 0 | H906: =RC1*R2C -> 0 | I906: =RC1*R2C -> 0 | J906: =RC1*R2C -> 0 | K906: =RC1*R2C -> 0 | L906: =RC1*R2C -> 0 | M906: =RC1*R2C -> 0
B907: =RC1*R2C -> 0 | C907: =RC1*R2C -> 0 | D907: =RC1*R2C -> 0 | E907: =RC1*R2C -> 0 | F907: =RC1*R2C -> 0 | G907: =RC1*R2C -> 0 | H907: =RC1*R2C -> 0 | I907: =RC1*R2C -> 0 | J907: =RC1*R2C -> 0 | K907: =RC1*R2C -> 0 | L907: =RC1*R2C -> 0 | M907: =RC1*R2C -> 0
B908: =RC1*R2C -> 0 | C908: =RC1*R2C -> 0 | D908: =RC1*R2C -> 0 | E908: =RC1*R2C -> 0 | F908: =RC1*R2C -> 0 | G908: =RC1*R2C -> 0 | H908: =RC1*R2C -> 0 | I908: =RC1*R2C -> 0 | J908: =RC1*R2C -> 0 | K908: =RC1*R2C -> 0 | L908: =RC1*R2C -> 0 | M908: =RC1*R2C -> 0
B909: =RC1*R2C -> 0 | C909: =RC1*R2C -> 0 | D909: =RC1*R2C -> 0 | E909: =RC1*R2C -> 0 | F909: =RC1*R2C -> 0 | G909: =RC1*R2C -> 0 | H909: =RC1*R2C -> 0 | I909: =RC1*R2C -> 0 | J909: =RC1*R2C -> 0 | K909: =RC1*R2C -> 0 | L909: =RC1*R2C -> 0 | M909: =RC1*R2C -> 0
B910: =RC1*R2C -> 0 | C910: =RC1*R2C -> 0 | D910: =RC1*R2C -> 0 | E910: =RC1*R2C -> 0 | F910: =RC1*R2C -> 0 | G910: =RC1*R2C -> 0 | H910: =RC1*R2C -> 0 | I910: =RC1*R2C -> 0 | J910: =RC1*R2C -> 0 | K910: =RC1*R2C -> 0 | L910: =RC1*R2C -> 0 | M910: =RC1*R2C -> 0
B911: =RC1*R2C -> 0 | C911: =RC1*R2C -> 0 | D911: =RC1*R2C -> 0 | E911: =RC1*R2C -> 0 | F911: =RC1*R2C -> 0 | G911: =RC1*R2C -> 0 | H911: =RC1*R2C -> 0 | I911: =RC1*R2C -> 0 | J911: =RC1*R2C -> 0 | K911: =RC1*R2C -> 0 | L911: =RC1*R2C -> 0 | M911: =RC1*R2C -> 0
B912: =RC1*R2C -> 0 | C912: =RC1*R2C -> 0 | D912: =RC1*R2C -> 0 | E912: =RC1*R2C -> 0 | F912: =RC1*R2C -> 0 | G912: =RC1*R2C -> 0 | H912: =RC1*R2C -> 0 | I912: =RC1*R2C -> 0 | J912: =RC1*R2C -> 0 | K912: =RC1*R2C -> 0 | L912: =RC1*R2C -> 0 | M912: =RC1*R2C -> 0
B913: =RC1*R2C -> 0 | C913: =RC1*R2C -> 0 | D913: =RC1*R2C -> 0 | E913: =RC1*R2C -> 0 | F913: =RC1*R2C -> 0 | G913: =RC1*R2C -> 0 | H913: =RC1*R2C -> 0 | I913: =RC1*R2C -> 0 | J913: =RC1*R2C -> 0 | K913: =RC1*R2C -> 0 | L913: =RC1*R2C -> 0 | M913: =RC1*R2C -> 0
B914: =RC1*R2C -> 0 | C914: =RC1*R2C -> 0 | D914: =RC1*R2C -> 0 | E914: =RC1*R2C -> 0 | F914: =RC1*R2C -> 0 | G914: =RC1*R2C -> 0 | H914: =RC1*R2C -> 0 | I914: =RC1*R2C -> 0 | J914: =RC1*R2C -> 0 | K914: =RC1*R2C -> 0 | L914: =RC1*R2C -> 0 | M914: =RC1*R2C -> 0
B915: =RC1*R2C -> 0 | C915: =RC1*R2C -> 0 | D915: =RC1*R2C -> 0 | E915: =RC1*R2C -> 0 | F915: =RC1*R2C -> 0 | G915: =RC1*R2C -> 0 | H915: =RC1*R2C -> 0 | I915: =RC1*R2C -> 0 | J915: =RC1*R2C -> 0 | K915: =RC1*R2C -> 0 | L915: =RC1*R2C -> 0 | M915: =RC1*R2C -> 0
B916: =RC1*R2C -> 0 | C916: =RC1*R2C -> 0 | D916: =RC1*R2C -> 0 | E916: =RC1*R2C -> 0 | F916: =RC1*R2C -> 0 | G916: =RC1*R2C -> 0 | H916: =RC1*R2C -> 0 | I916: =RC1*R2C -> 0 | J916: =RC1*R2C -> 0 | K916: =RC1*R2C -> 0 | L916: =RC1*R2C -> 0 | M916: =RC1*R2C -> 0
B917: =RC1*R2C -> 0 | C917: =RC1*R2C -> 0 | D917: =RC1*R2C -> 0 | E917: =RC1*R2C -> 0 | F917: =RC1*R2C -> 0 | G917: =RC1*R2C -> 0 | H917: =RC1*R2C -> 0 | I917: =RC1*R2C -> 0 | J917: =RC1*R2C -> 0 | K917: =RC1*R2C -> 0 | L917: =RC1*R2C -> 0 | M917: =RC1*R2C -> 0
B918: =RC1*R2C -> 0 | C918: =RC1*R2C -> 0 | D918: =RC1*R2C -> 0 | E918: =RC1*R2C -> 0 | F918: =RC1*R2C -> 0 | G918: =RC1*R2C -> 0 | H918: =RC1*R2C -> 0 | I918: =RC1*R2C -> 0 | J918: =RC1*R2C -> 0 | K918: =RC1*R2C -> 0 | L918: =RC1*R2C -> 0 | M918: =RC1*R2C -> 0
B919: =RC1*R2C -> 0 | C919: =RC1*R2C -> 0 | D919: =RC1*R2C -> 0 | E919: =RC1*R2C -> 0 | F919: =RC1*R2C -> 0 | G919: =RC1*R2C -> 0 | H919: =RC1*R2C -> 0 | I919: =RC1*R2C -> 0 | J919: =RC1*R2C -> 0 | K919: =RC1*R2C -> 0 | L919: =RC1*R2C -> 0 | M919: =RC1*R2C -> 0
B920: =RC1*R2C -> 0 | C920: =RC1*R2C -> 0 | D920: =RC1*R2C -> 0 | E920: =RC1*R2C -> 0 | F920: =RC1*R2C -> 0 | G920: =RC1*R2C -> 0 | H920: =RC1*R2C -> 0 | I920: =RC1*R2C -> 0 | J920: =RC1*R2C -> 0 | K920: =RC1*R2C -> 0 | L920: =RC1*R2C -> 0 | M920: =RC1*R2C -> 0
B921: =RC1*R2C -> 0 | C921: =RC1*R2C -> 0 | D921: =RC1*R2C -> 0 | E921: =RC1*R2C -> 0 | F921: =RC1*R2C -> 0 | G921: =RC1*R2C -> 0 | H921: =RC1*R2C -> 0 | I921: =RC1*R2C -> 0 | J921: =RC1*R2C -> 0 | K921: =RC1*R2C -> 0 | L921: =RC1*R2C -> 0 | M921: =RC1*R2C -> 0
B922: =RC1*R2C -> 0 | C922: =RC1*R2C -> 0 | D922: =RC1*R2C -> 0 | E922: =RC1*R2C -> 0 | F922: =RC1*R2C -> 0 | G922: =RC1*R2C -> 0 | H922: =RC1*R2C -> 0 | I922: =RC1*R2C -> 0 | J922: =RC1*R2C -> 0 | K922: =RC1*R2C -> 0 | L922: =RC1*R2C -> 0 | M922: =RC1*R2C -> 0
B923: =RC1*R2C -> 0 | C923: =RC1*R2C -> 0 | D923: =RC1*R2C -> 0 | E923: =RC1*R2C -> 0 | F923: =RC1*R2C -> 0 | G923: =RC1*R2C -> 0 | H923: =RC1*R2C -> 0 | I923: =RC1*R2C -> 0 | J923: =RC1*R2C -> 0 | K923: =RC1*R2C -> 0 | L923: =RC1*R2C -> 0 | M923: =RC1*R2C -> 0
B924: =RC1*R2C -> 0 | C924: =RC1*R2C -> 0 | D924: =RC1*R2C -> 0 | E924: =RC1*R2C -> 0 | F924: =RC1*R2C -> 0 | G924: =RC1*R2C -> 0 | H924: =RC1*R2C -> 0 | I924: =RC1*R2C -> 0 | J924: =RC1*R2C -> 0 | K924: =RC1*R2C -> 0 | L924: =RC1*R2C -> 0 | M924: =RC1*R2C -> 0
B925: =RC1*R2C -> 0 | C925: =RC1*R2C -> 0 | D925: =RC1*R2C -> 0 | E925: =RC1*R2C -> 0 | F925: =RC1*R2C -> 0 | G925: =RC1*R2C -> 0 | H925: =RC1*R2C -> 0 | I925: =RC1*R2C -> 0 | J925: =RC1*R2C -> 0 | K925: =RC1*R2C -> 0 | L925: =RC1*R2C -> 0 | M925: =RC1*R2C -> 0
B926: =RC1*R2C -> 0 | C926: =RC1*R2C -> 0 | D926: =RC1*R2C -> 0 | E926: =RC1*R2C -> 0 | F926: =RC1*R2C -> 0 | G926: =RC1*R2C -> 0 | H926: =RC1*R2C -> 0 | I926: =RC1*R2C -> 0 | J926: =RC1*R2C -> 0 | K926: =RC1*R2C -> 0 | L926: =RC1*R2C -> 0 | M926: =RC1*R2C -> 0
B927: =RC1*R2C -> 0 | C927: =RC1*R2C -> 0 | D927: =RC1*R2C -> 0 | E927: =RC1*R2C -> 0 | F927: =RC1*R2C -> 0 | G927: =RC1*R2C -> 0 | H927: =RC1*R2C -> 0 | I927: =RC1*R2C -> 0 | J927: =RC1*R2C -> 0 | K927: =RC1*R2C -> 0 | L927: =RC1*R2C -> 0 | M927: =RC1*R2C -> 0
B928: =RC1*R2C -> 0 | C928: =RC1*R2C -> 0 | D928: =RC1*R2C -> 0 | E928: =RC1*R2C -> 0 | F928: =RC1*R2C -> 0 | G928: =RC1*R2C -> 0 | H928: =RC1*R2C -> 0 | I928: =RC1*R2C -> 0 | J928: =RC1*R2C -> 0 | K928: =RC1*R2C -> 0 | L928: =RC1*R2C -> 0 | M928: =RC1*R2C -> 0
B929: =RC1*R2C -> 0 | C929: =RC1*R2C -> 0 | D929: =RC1*R2C -> 0 | E929: =RC1*R2C -> 0 | F929: =RC1*R2C -> 0 | G929: =RC1*R2C -> 0 | H929: =RC1*R2C -> 0 | I929: =RC1*R2C -> 0 | J929: =RC1*R2C -> 0 | K929: =RC1*R2C -> 0 | L929: =RC1*R2C -> 0 | M929: =RC1*R2C -> 0
B930: =RC1*R2C -> 0 | C930: =RC1*R2C -> 0 | D930: =RC1*R2C -> 0 | E930: =RC1*R2C -> 0 | F930: =RC1*R2C -> 0 | G930: =RC1*R2C -> 0 | H930: =RC1*R2C -> 0 | I930: =RC1*R2C -> 0 | J930: =RC1*R2C -> 0 | K930: =RC1*R2C -> 0 | L930: =RC1*R2C -> 0 | M930: =RC1*R2C -> 0
B931: =RC1*R2C -> 0 | C931: =RC1*R2C -> 0 | D931: =RC1*R2C -> 0 | E931: =RC1*R2C -> 0 | F931: =RC1*R2C -> 0 | G931: =RC1*R2C -> 0 | H931: =RC1*R2C -> 0 | I931: =RC1*R2C -> 0 | J931: =RC1*R2C -> 0 | K931: =RC1*R2C -> 0 | L931: =RC1*R2C -> 0 | M931: =RC1*R2C -> 0
B932: =RC1*R2C -> 0 | C932: =RC1*R2C -> 0 | D932: =RC1*R2C -> 0 | E932: =RC1*R2C -> 0 | F932: =RC1*R2C -> 0 | G932: =RC1*R2C -> 0 | H932: =RC1*R2C -> 0 | I932: =RC1*R2C -> 0 | J932: =RC1*R2C -> 0 | K932: =RC1*R2C -> 0 | L932: =RC1*R2C -> 0 | M932: =RC1*R2C -> 0
B933: =RC1*R2C -> 0 | C933: =RC1*R2C -> 0 | D933: =RC1*R2C -> 0 | E933: =RC1*R2C -> 0 | F933: =RC1*R2C -> 0 | G933: =RC1*R2C -> 0 | H933: =RC1*R2C -> 0 | I933: =RC1*R2C -> 0 | J933: =RC1*R2C -> 0 | K933: =RC1*R2C -> 0 | L933: =RC1*R2C -> 0 | M933: =RC1*R2C -> 0
B934: =RC1*R2C -> 0 | C934: =RC1*R2C -> 0 | D934: =RC1*R2C -> 0 | E934: =RC1*R2C -> 0 | F934: =RC1*R2C -> 0 | G934: =RC1*R2C -> 0 | H934: =RC1*R2C -> 0 | I934: =RC1*R2C -> 0 | J934: =RC1*R2C -> 0 | K934: =RC1*R2C -> 0 | L934: =RC1*R2C -> 0 | M934: =RC1*R2C -> 0
B935: =RC1*R2C -> 0 | C935: =RC1*R2C -> 0 | D935: =RC1*R2C -> 0 | E935: =RC1*R2C -> 0 | F935: =RC1*R2C -> 0 | G935: =RC1*R2C -> 0 | H935: =RC1*R2C -> 0 | I935: =RC1*R2C -> 0 | J935: =RC1*R2C -> 0 | K935: =RC1*R2C -> 0 | L935: =RC1*R2C -> 0 | M935: =RC1*R2C -> 0
B936: =RC1*R2C -> 0 | C936: =RC1*R2C -> 0 | D936: =RC1*R2C -> 0 | E936: =RC1*R2C -> 0 | F936: =RC1*R2C -> 0 | G936: =RC1*R2C -> 0 | H936: =RC1*R2C -> 0 | I936: =RC1*R2C -> 0 | J936: =RC1*R2C -> 0 | K936: =RC1*R2C -> 0 | L936: =RC1*R2C -> 0 | M936: =RC1*R2C -> 0
B937: =RC1*R2C -> 0 | C937: =RC1*R2C -> 0 | D937: =RC1*R2C -> 0 | E937: =RC1*R2C -> 0 | F937: =RC1*R2C -> 0 | G937: =RC1*R2C -> 0 | H937: =RC1*R2C -> 0 | I937: =RC1*R2C -> 0 | J937: =RC1*R2C -> 0 | K937: =RC1*R2C -> 0 | L937: =RC1*R2C -> 0 | M937: =RC1*R2C -> 0
B938: =RC1*R2C -> 0 | C938: =RC1*R2C -> 0 | D938: =RC1*R2C -> 0 | E938: =RC1*R2C -> 0 | F938: =RC1*R2C -> 0 | G938: =RC1*R2C -> 0 | H938: =RC1*R2C -> 0 | I938: =RC1*R2C -> 0 | J938: =RC1*R2C -> 0 | K938: =RC1*R2C -> 0 | L938: =RC1*R2C -> 0 | M938: =RC1*R2C -> 0
B939: =RC1*R2C -> 0 | C939: =RC1*R2C -> 0 | D939: =RC1*R2C -> 0 | E939: =RC1*R2C -> 0 | F939: =RC1*R2C -> 0 | G939: =RC1*R2C -> 0 | H939: =RC1*R2C -> 0 | I939: =RC1*R2C -> 0 | J939: =RC1*R2C -> 0 | K939: =RC1*R2C -> 0 | L939: =RC1*R2C -> 0 | M939: =RC1*R2C -> 0
B940: =RC1*R2C -> 0 | C940: =RC1*R2C -> 0 | D940: =RC1*R2C -> 0 | E940: =RC1*R2C -> 0 | F940: =RC1*R2C -> 0 | G940: =RC1*R2C -> 0 | H940: =RC1*R2C -> 0 | I940: =RC1*R2C -> 0 | J940: =RC1*R2C -> 0 | K940: =RC1*R2C -> 0 | L940: =RC1*R2C -> 0 | M940: =RC1*R2C -> 0
B941: =RC1*R2C -> 0 | C941: =RC1*R2C -> 0 | D941: =RC1*R2C -> 0 | E941: =RC1*R2C -> 0 | F941: =RC1*R2C -> 0 | G941: =RC1*R2C -> 0 | H941: =RC1*R2C -> 0 | I941: =RC1*R2C -> 0 | J941: =RC1*R2C -> 0 | K941: =RC1*R2C -> 0 | L941: =RC1*R2C -> 0 | M941: =RC1*R2C -> 0
B942: =RC1*R2C -> 0 | C942: =RC1*R2C -> 0 | D942: =RC1*R2C -> 0 | E942: =RC1*R2C -> 0 | F942: =RC1*R2C -> 0 | G942: =RC1*R2C -> 0 | H942: =RC1*R2C -> 0 | I942: =RC1*R2C -> 0 | J942: =RC1*R2C -> 0 | K942: =RC1*R2C -> 0 | L942: =RC1*R2C -> 0 | M942: =RC1*R2C -> 0
B943: =RC1*R2C -> 0 | C943: =RC1*R2C -> 0 | D943: =RC1*R2C -> 0 | E943: =RC1*R2C -> 0 | F943: =RC1*R2C -> 0 | G943: =RC1*R2C -> 0 | H943: =RC1*R2C -> 0 | I943: =RC1*R2C -> 0 | J943: =RC1*R2C -> 0 | K943: =RC1*R2C -> 0 | L943: =RC1*R2C -> 0 | M943: =RC1*R2C -> 0
B944: =RC1*R2C -> 0 | C944: =RC1*R2C -> 0 | D944: =RC1*R2C -> 0 | E944: =RC1*R2C -> 0 | F944: =RC1*R2C -> 0 | G944: =RC1*R2C -> 0 | H944: =RC1*R2C -> 0 | I944: =RC1*R2C -> 0 | J944: =RC1*R2C -> 0 | K944: =RC1*R2C -> 0 | L944: =RC1*R2C -> 0 | M944: =RC1*R2C -> 0
B945: =RC1*R2C -> 0 | C945: =RC1*R2C -> 0 | D945: =RC1*R2C -> 0 | E945: =RC1*R2C -> 0 | F945: =RC1*R2C -> 0 | G945: =RC1*R2C -> 0 | H945: =RC1*R2C -> 0 | I945: =RC1*R2C -> 0 | J945: =RC1*R2C -> 0 | K945: =RC1*R2C -> 0 | L945: =RC1*R2C -> 0 | M945: =RC1*R2C -> 0
B946: =RC1*R2C -> 0 | C946: =RC1*R2C -> 0 | D946: =RC1*R2C -> 0 | E946: =RC1*R2C -> 0 | F946: =RC1*R2C -> 0 | G946: =RC1*R2C -> 0 | H946: =RC1*R2C -> 0 | I946: =RC1*R2C -> 0 | J946: =RC1*R2C -> 0 | K946: =RC1*R2C -> 0 | L946: =RC1*R2C -> 0 | M946: =RC1*R2C -> 0
B947: =RC1*R2C -> 0 | C947: =RC1*R2C -> 0 | D947: =RC1*R2C -> 0 | E947: =RC1*R2C -> 0 | F947: =RC1*R2C -> 0 | G947: =RC1*R2C -> 0 | H947: =RC1*R2C -> 0 | I947: =RC1*R2C -> 0 | J947: =RC1*R2C -> 0 | K947: =RC1*R2C -> 0 | L947: =RC1*R2C -> 0 | M947: =RC1*R2C -> 0
B948: =RC1*R2C -> 0 | C948: =RC1*R2C -> 0 | D948: =RC1*R2C -> 0 | E948: =RC1*R2C -> 0 | F948: =RC1*R2C -> 0 | G948: =RC1*R2C -> 0 | H948: =RC1*R2C -> 0 | I948: =RC1*R2C -> 0 | J948: =RC1*R2C -> 0 | K948: =RC1*R2C -> 0 | L948: =RC1*R2C -> 0 | M948: =RC1*R2C -> 0
B949: =RC1*R2C -> 0 | C949: =RC1*R2C -> 0 | D949: =RC1*R2C -> 0 | E949: =RC1*R2C -> 0 | F949: =RC1*R2C -> 0 | G949: =RC1*R2C -> 0 | H949: =RC1*R2C -> 0 | I949: =RC1*R2C -> 0 | J949: =RC1*R2C -> 0 | K949: =RC1*R2C -> 0 | L949: =RC1*R2C -> 0 | M949: =RC1*R2C -> 0
B950: =RC1*R2C -> 0 | C950: =RC1*R2C -> 0 | D950: =RC1*R2C -> 0 | E950: =RC1*R2C -> 0 | F950: =RC1*R2C -> 0 | G950: =RC1*R2C -> 0 | H950: =RC1*R2C -> 0 | I950: =RC1*R2C -> 0 | J950: =RC1*R2C -> 0 | K950: =RC1*R2C -> 0 | L950: =RC1*R2C -> 0 | M950: =RC1*R2C -> 0
B951: =RC1*R2C -> 0 | C951: =RC1*R2C -> 0 | D951: =RC1*R2C -> 0 | E951: =RC1*R2C -> 0 | F951: =RC1*R2C -> 0 | G951: =RC1*R2C -> 0 | H951: =RC1*R2C -> 0 | I951: =RC1*R2C -> 0 | J951: =RC1*R2C -> 0 | K951: =RC1*R2C -> 0 | L951: =RC1*R2C -> 0 | M951: =RC1*R2C -> 0
B952: =RC1*R2C -> 0 | C952: =RC1*R2C -> 0 | D952: =RC1*R2C -> 0 | E952: =RC1*R2C -> 0 | F952: =RC1*R2C -> 0 | G952: =RC1*R2C -> 0 | H952: =RC1*R2C -> 0 | I952: =RC1*R2C -> 0 | J952: =RC1*R2C -> 0 | K952: =RC1*R2C -> 0 | L952: =RC1*R2C -> 0 | M952: =RC1*R2C -> 0
B953: =RC1*R2C -> 0 | C953: =RC1*R2C -> 0 | D953: =RC1*R2C -> 0 | E953: =RC1*R2C -> 0 | F953: =RC1*R2C -> 0 | G953: =RC1*R2C -> 0 | H953: =RC1*R2C -> 0 | I953: =RC1*R2C -> 0 | J953: =RC1*R2C -> 0 | K953: =RC1*R2C -> 0 | L953: =RC1*R2C -> 0 | M953: =RC1*R2C -> 0
B954: =RC1*R2C -> 0 | C954: =RC1*R2C -> 0 | D954: =RC1*R2C -> 0 | E954: =RC1*R2C -> 0 | F954: =RC1*R2C -> 0 | G954: =RC1*R2C -> 0 | H954: =RC1*R2C -> 0 | I954: =RC1*R2C -> 0 | J954: =RC1*R2C -> 0 | K954: =RC1*R2C -> 0 | L954: =RC1*R2C -> 0 | M954: =RC1*R2C -> 0
B955: =RC1*R2C -> 0 | C955: =RC1*R2C -> 0 | D955: =RC1*R2C -> 0 | E955: =RC1*R2C -> 0 | F955: =RC1*R2C -> 0 | G955: =RC1*R2C -> 0 | H955: =RC1*R2C -> 0 | I955: =RC1*R2C -> 0 | J955: =RC1*R2C -> 0 | K955: =RC1*R2C -> 0 | L955: =RC1*R2C -> 0 | M955: =RC1*R2C -> 0
B956: =RC1*R2C -> 0 | C956: =RC1*R2C -> 0 | D956: =RC1*R2C -> 0 | E956: =RC1*R2C -> 0 | F956: =RC1*R2C -> 0 | G956: =RC1*R2C -> 0 | H956: =RC1*R2C -> 0 | I956: =RC1*R2C -> 0 | J956: =RC1*R2C -> 0 | K956: =RC1*R2C -> 0 | L956: =RC1*R2C -> 0 | M956: =RC1*R2C -> 0
B957: =RC1*R2C -> 0 | C957: =RC1*R2C -> 0 | D957: =RC1*R2C -> 0 | E957: =RC1*R2C -> 0 | F957: =RC1*R2C -> 0 | G957: =RC1*R2C -> 0 | H957: =RC1*R2C -> 0 | I957: =RC1*R2C -> 0 | J957: =RC1*R2C -> 0 | K957: =RC1*R2C -> 0 | L957: =RC1*R2C -> 0 | M957: =RC1*R2C -> 0
B958: =RC1*R2C -> 0 | C958: =RC1*R2C -> 0 | D958: =RC1*R2C -> 0 | E958: =RC1*R2C -> 0 | F958: =RC1*R2C -> 0 | G958: =RC1*R2C -> 0 | H958: =RC1*R2C -> 0 | I958: =RC1*R2C -> 0 | J958: =RC1*R2C -> 0 | K958: =RC1*R2C -> 0 | L958: =RC1*R2C -> 0 | M958: =RC1*R2C -> 0
B959: =RC1*R2C -> 0 | C959: =RC1*R2C -> 0 | D959: =RC1*R2C -> 0 | E959: =RC1*R2C -> 0 | F959: =RC1*R2C -> 0 | G959: =RC1*R2C -> 0 | H959: =RC1*R2C -> 0 | I959: =RC1*R2C -> 0 | J959: =RC1*R2C -> 0 | K959: =RC1*R2C -> 0 | L959: =RC1*R2C -> 0 | M959: =RC1*R2C -> 0
B960: =RC1*R2C -> 0 | C960: =RC1*R2C -> 0 | D960: =RC1*R2C -> 0 | E960: =RC1*R2C -> 0 | F960: =RC1*R2C -> 0 | G960: =RC1*R2C -> 0 | H960: =RC1*R2C -> 0 | I960: =RC1*R2C -> 0 | J960: =RC1*R2C -> 0 | K960: =RC1*R2C -> 0 | L960: =RC1*R2C -> 0 | M960: =RC1*R2C -> 0
B961: =RC1*R2C -> 0 | C961: =RC1*R2C -> 0 | D961: =RC1*R2C -> 0 | E961: =RC1*R2C -> 0 | F961: =RC1*R2C -> 0 | G961: =RC1*R2C -> 0 | H961: =RC1*R2C -> 0 | I961: =RC1*R2C -> 0 | J961: =RC1*R2C -> 0 | K961: =RC1*R2C -> 0 | L961: =RC1*R2C -> 0 | M961: =RC1*R2C -> 0
B962: =RC1*R2C -> 0 | C962: =RC1*R2C -> 0 | D962: =RC1*R2C -> 0 | E962: =RC1*R2C -> 0 | F962: =RC1*R2C -> 0 | G962: =RC1*R2C -> 0 | H962: =RC1*R2C -> 0 | I962: =RC1*R2C -> 0 | J962: =RC1*R2C -> 0 | K962: =RC1*R2C -> 0 | L962: =RC1*R2C -> 0 | M962: =RC1*R2C -> 0
B963: =RC1*R2C -> 0 | C963: =RC1*R2C -> 0 | D963: =RC1*R2C -> 0 | E963: =RC1*R2C -> 0 | F963: =RC1*R2C -> 0 | G963: =RC1*R2C -> 0 | H963: =RC1*R2C -> 0 | I963: =RC1*R2C -> 0 | J963: =RC1*R2C -> 0 | K963: =RC1*R2C -> 0 | L963: =RC1*R2C -> 0 | M963: =RC1*R2C -> 0
B964: =RC1*R2C -> 0 | C964: =RC1*R2C -> 0 | D964: =RC1*R2C -> 0 | E964: =RC1*R2C -> 0 | F964: =RC1*R2C -> 0 | G964: =RC1*R2C -> 0 | H964: =RC1*R2C -> 0 | I964: =RC1*R2C -> 0 | J964: =RC1*R2C -> 0 | K964: =RC1*R2C -> 0 | L964: =RC1*R2C -> 0 | M964: =RC1*R2C -> 0
B965: =RC1*R2C -> 0 | C965: =RC1*R2C -> 0 | D965: =RC1*R2C -> 0 | E965: =RC1*R2C -> 0 | F965: =RC1*R2C -> 0 | G965: =RC1*R2C -> 0 | H965: =RC1*R2C -> 0 | I965: =RC1*R2C -> 0 | J965: =RC1*R2C -> 0 | K965: =RC1*R2C -> 0 | L965: =RC1*R2C -> 0 | M965: =RC1*R2C -> 0
B966: =RC1*R2C -> 0 | C966: =RC1*R2C -> 0 | D966: =RC1*R2C -> 0 | E966: =RC1*R2C -> 0 | F966: =RC1*R2C -> 0 | G966: =RC1*R2C -> 0 | H966: =RC1*R2C -> 0 | I966: =RC1*R2C -> 0 | J966: =RC1*R2C -> 0 | K966: =RC1*R2C -> 0 | L966: =RC1*R2C -> 0 | M966: =RC1*R2C -> 0
B967: =RC1*R2C -> 0 | C967: =RC1*R2C -> 0 | D967: =RC1*R2C -> 0 | E967: =RC1*R2C -> 0 | F967: =RC1*R2C -> 0 | G967: =RC1*R2C -> 0 | H967: =RC1*R2C -> 0 | I967: =RC1*R2C -> 0 | J967: =RC1*R2C -> 0 | K967: =RC1*R2C -> 0 | L967: =RC1*R2C -> 0 | M967: =RC1*R2C -> 0
B968: =RC1*R2C -> 0 | C968: =RC1*R2C -> 0 | D968: =RC1*R2C -> 0 | E968: =RC1*R2C -> 0 | F968: =RC1*R2C -> 0 | G968: =RC1*R2C -> 0 | H968: =RC1*R2C -> 0 | I968: =RC1*R2C -> 0 | J968: =RC1*R2C -> 0 | K968: =RC1*R2C -> 0 | L968: =RC1*R2C -> 0 | M968: =RC1*R2C -> 0
B969: =RC1*R2C -> 0 | C969: =RC1*R2C -> 0 | D969: =RC1*R2C -> 0 | E969: =RC1*R2C -> 0 | F969: =RC1*R2C -> 0 | G969: =RC1*R2C -> 0 | H969: =RC1*R2C -> 0 | I969: =RC1*R2C -> 0 | J969: =RC1*R2C -> 0 | K969: =RC1*R2C -> 0 | L969: =RC1*R2C -> 0 | M969: =RC1*R2C -> 0
B970: =RC1*R2C -> 0 | C970: =RC1*R2C -> 0 | D970: =RC1*R2C -> 0 | E970: =RC1*R2C -> 0 | F970: =RC1*R2C -> 0 | G970: =RC1*R2C -> 0 | H970: =RC1*R2C -> 0 | I970: =RC1*R2C -> 0 | J970: =RC1*R2C -> 0 | K970: =RC1*R2C -> 0 | L970: =RC1*R2C -> 0 | M970: =RC1*R2C -> 0
B971: =RC1*R2C -> 0 | C971: =RC1*R2C -> 0 | D971: =RC1*R2C -> 0 | E971: =RC1*R2C -> 0 | F971: =RC1*R2C -> 0 | G971: =RC1*R2C -> 0 | H971: =RC1*R2C -> 0 | I971: =RC1*R2C -> 0 | J971: =RC1*R2C -> 0 | K971: =RC1*R2C -> 0 | L971: =RC1*R2C -> 0 | M971: =RC1*R2C -> 0
B972: =RC1*R2C -> 0 | C972: =RC1*R2C -> 0 | D972: =RC1*R2C -> 0 | E972: =RC1*R2C -> 0 | F972: =RC1*R2C -> 0 | G972: =RC1*R2C -> 0 | H972: =RC1*R2C -> 0 | I972: =RC1*R2C -> 0 | J972: =RC1*R2C -> 0 | K972: =RC1*R2C -> 0 | L972: =RC1*R2C -> 0 | M972: =RC1*R2C -> 0
B973: =RC1*R2C -> 0 | C973: =RC1*R2C -> 0 | D973: =RC1*R2C -> 0 | E973: =RC1*R2C -> 0 | F973: =RC1*R2C -> 0 | G973: =RC1*R2C -> 0 | H973: =RC1*R2C -> 0 | I973: =RC1*R2C -> 0 | J973: =RC1*R2C -> 0 | K973: =RC1*R2C -> 0 | L973: =RC1*R2C -> 0 | M973: =RC1*R2C -> 0
B974: =RC1*R2C -> 0 | C974: =RC1*R2C -> 0 | D974: =RC1*R2C -> 0 | E974: =RC1*R2C -> 0 | F974: =RC1*R2C -> 0 | G974: =RC1*R2C -> 0 | H974: =RC1*R2C -> 0 | I974: =RC1*R2C -> 0 | J974: =RC1*R2C -> 0 | K974: =RC1*R2C -> 0 | L974: =RC1*R2C -> 0 | M974: =RC1*R2C -> 0
B975: =RC1*R2C -> 0 | C975: =RC1*R2C -> 0 | D975: =RC1*R2C -> 0 | E975: =RC1*R2C -> 0 | F975: =RC1*R2C -> 0 | G975: =RC1*R2C -> 0 | H975: =RC1*R2C -> 0 | I975: =RC1*R2C -> 0 | J975: =RC1*R2C -> 0 | K975: =RC1*R2C -> 0 | L975: =RC1*R2C -> 0 | M975: =RC1*R2C -> 0
B976: =RC1*R2C -> 0 | C976: =RC1*R2C -> 0 | D976: =RC1*R2C -> 0 | E976: =RC1*R2C -> 0 | F976: =RC1*R2C -> 0 | G976: =RC1*R2C -> 0 | H976: =RC1*R2C -> 0 | I976: =RC1*R2C -> 0 | J976: =RC1*R2C -> 0 | K976: =RC1*R2C -> 0 | L976: =RC1*R2C -> 0 | M976: =RC1*R2C -> 0
B977: =RC1*R2C -> 0 | C977: =RC1*R2C -> 0 | D977: =RC1*R2C -> 0 | E977: =RC1*R2C -> 0 | F977: =RC1*R2C -> 0 | G977: =RC1*R2C -> 0 | H977: =RC1*R2C -> 0 | I977: =RC1*R2C -> 0 | J977: =RC1*R2C -> 0 | K977: =RC1*R2C -> 0 | L977: =RC1*R2C -> 0 | M977: =RC1*R2C -> 0
B978: =RC1*R2C -> 0 | C978: =RC1*R2C -> 0 | D978: =RC1*R2C -> 0 | E978: =RC1*R2C -> 0 | F978: =RC1*R2C -> 0 | G978: =RC1*R2C -> 0 | H978: =RC1*R2C -> 0 | I978: =RC1*R2C -> 0 | J978: =RC1*R2C -> 0 | K978: =RC1*R2C -> 0 | L978: =RC1*R2C -> 0 | M978: =RC1*R2C -> 0
B979: =RC1*R2C -> 0 | C979: =RC1*R2C -> 0 | D979: =RC1*R2C -> 0 | E979: =RC1*R2C -> 0 | F979: =RC1*R2C -> 0 | G979: =RC1*R2C -> 0 | H979: =RC1*R2C -> 0 | I979: =RC1*R2C -> 0 | J979: =RC1*R2C -> 0 | K979: =RC1*R2C -> 0 | L979: =RC1*R2C -> 0 | M979: =RC1*R2C -> 0
B980: =RC1*R2C -> 0 | C980: =RC1*R2C -> 0 | D980: =RC1*R2C -> 0 | E980: =RC1*R2C -> 0 | F980: =RC1*R2C -> 0 | G980: =RC1*R2C -> 0 | H980: =RC1*R2C -> 0 | I980: =RC1*R2C -> 0 | J980: =RC1*R2C -> 0 | K980: =RC1*R2C -> 0 | L980: =RC1*R2C -> 0 | M980: =RC1*R2C -> 0
B981: =RC1*R2C -> 0 | C981: =RC1*R2C -> 0 | D981: =RC1*R2C -> 0 | E981: =RC1*R2C -> 0 | F981: =RC1*R2C -> 0 | G981: =RC1*R2C -> 0 | H981: =RC1*R2C -> 0 | I981: =RC1*R2C -> 0 | J981: =RC1*R2C -> 0 | K981: =RC1*R2C -> 0 | L981: =RC1*R2C -> 0 | M981: =RC1*R2C -> 0
B982: =RC1*R2C -> 0 | C982: =RC1*R2C -> 0 | D982: =RC1*R2C -> 0 | E982: =RC1*R2C -> 0 | F982: =RC1*R2C -> 0 | G982: =RC1*R2C -> 0 | H982: =RC1*R2C -> 0 | I982: =RC1*R2C -> 0 | J982: =RC1*R2C -> 0 | K982: =RC1*R2C -> 0 | L982: =RC1*R2C -> 0 | M982: =RC1*R2C -> 0
B983: =RC1*R2C -> 0 | C983: =RC1*R2C -> 0 | D983: =RC1*R2C -> 0 | E983: =RC1*R2C -> 0 | F983: =RC1*R2C -> 0 | G983: =RC1*R2C -> 0 | H983: =RC1*R2C -> 0 | I983: =RC1*R2C -> 0 | J983: =RC1*R2C -> 0 | K983: =RC1*R2C -> 0 | L983: =RC1*R2C -> 0 | M983: =RC1*R2C -> 0
B984: =RC1*R2C -> 0 | C984: =RC1*R2C -> 0 | D984: =RC1*R2C -> 0 | E984: =RC1*R2C -> 0 | F984: =RC1*R2C -> 0 | G984: =RC1*R2C -> 0 | H984: =RC1*R2C -> 0 | I984: =RC1*R2C -> 0 | J984: =RC1*R2C -> 0 | K984: =RC1*R2C -> 0 | L984: =RC1*R2C -> 0 | M984: =RC1*R2C -> 0
B985: =RC1*R2C -> 0 | C985: =RC1*R2C -> 0 | D985: =RC1*R2C -> 0 | E985: =RC1*R2C -> 0 | F985: =RC1*R2C -> 0 | G985: =RC1*R2C -> 0 | H985: =RC1*R2C -> 0 | I985: =RC1*R2C -> 0 | J985: =RC1*R2C -> 0 | K985: =RC1*R2C -> 0 | L985: =RC1*R2C -> 0 | M985: =RC1*R2C -> 0
B986: =RC1*R2C -> 0 | C986: =RC1*R2C -> 0 | D986: =RC1*R2C -> 0 | E986: =RC1*R2C -> 0 | F986: =RC1*R2C -> 0 | G986: =RC1*R2C -> 0 | H986: =RC1*R2C -> 0 | I986: =RC1*R2C -> 0 | J986: =RC1*R2C -> 0 | K986: =RC1*R2C -> 0 | L986: =RC1*R2C -> 0 | M986: =RC1*R2C -> 0
B987: =RC1*R2C -> 0 | C987: =RC1*R2C -> 0 | D987: =RC1*R2C -> 0 | E987: =RC1*R2C -> 0 | F987: =RC1*R2C -> 0 | G987: =RC1*R2C -> 0 | H987: =RC1*R2C -> 0 | I987: =RC1*R2C -> 0 | J987: =RC1*R2C -> 0 | K987: =RC1*R2C -> 0 | L987: =RC1*R2C -> 0 | M987: =RC1*R2C -> 0
B988: =RC1*R2C -> 0 | C988: =RC1*R2C -> 0 | D988: =RC1*R2C -> 0 | E988: =RC1*R2C -> 0 | F988: =RC1*R2C -> 0 | G988: =RC1*R2C -> 0 | H988: =RC1*R2C -> 0 | I988: =RC1*R2C -> 0 | J988: =RC1*R2C -> 0 | K988: =RC1*R2C -> 0 | L988: =RC1*R2C -> 0 | M988: =RC1*R2C -> 0
B989: =RC1*R2C -> 0 | C989: =RC1*R2C -> 0 | D989: =RC1*R2C -> 0 | E989: =RC1*R2C -> 0 | F989: =RC1*R2C -> 0 | G989: =RC1*R2C -> 0 | H989: =RC1*R2C -> 0 | I989: =RC1*R2C -> 0 | J989: =RC1*R2C -> 0 | K989: =RC1*R2C -> 0 | L989: =RC1*R2C -> 0 | M989: =RC1*R2C -> 0
B990: =RC1*R2C -> 0 | C990: =RC1*R2C -> 0 | D990: =RC1*R2C -> 0 | E990: =RC1*R2C -> 0 | F990: =RC1*R2C -> 0 | G990: =RC1*R2C -> 0 | H990: =RC1*R2C -> 0 | I990: =RC1*R2C -> 0 | J990: =RC1*R2C -> 0 | K990: =RC1*R2C -> 0 | L990: =RC1*R2C -> 0 | M990: =RC1*R2C -> 0
B991: =RC1*R2C -> 0 | C991: =RC1*R2C -> 0 | D991: =RC1*R2C -> 0 | E991: =RC1*R2C -> 0 | F991: =RC1*R2C -> 0 | G991: =RC1*R2C -> 0 | H991: =RC1*R2C -> 0 | I991: =RC1*R2C -> 0 | J991: =RC1*R2C -> 0 | K991: =RC1*R2C -> 0 | L991: =RC1*R2C -> 0 | M991: =RC1*R2C -> 0
B992: =RC1*R2C -> 0 | C992: =RC1*R2C -> 0 | D992: =RC1*R2C -> 0 | E992: =RC1*R2C -> 0 | F992: =RC1*R2C -> 0 | G992: =RC1*R2C -> 0 | H992: =RC1*R2C -> 0 | I992: =RC1*R2C -> 0 | J992: =RC1*R2C -> 0 | K992: =RC1*R2C -> 0 | L992: =RC1*R2C -> 0 | M992: =RC1*R2C -> 0
B993: =RC1*R2C -> 0 | C993: =RC1*R2C -> 0 | D993: =RC1*R2C -> 0 | E993: =RC1*R2C -> 0 | F993: =RC1*R2C -> 0 | G993: =RC1*R2C -> 0 | H993: =RC1*R2C -> 0 | I993: =RC1*R2C -> 0 | J993: =RC1*R2C -> 0 | K993: =RC1*R2C -> 0 | L993: =RC1*R2C -> 0 | M993: =RC1*R2C -> 0
B994: =RC1*R2C -> 0 | C994: =RC1*R2C -> 0 | D994: =RC1*R2C -> 0 | E994: =RC1*R2C -> 0 | F994: =RC1*R2C -> 0 | G994: =RC1*R2C -> 0 | H994: =RC1*R2C -> 0 | I994: =RC1*R2C -> 0 | J994: =RC1*R2C -> 0 | K994: =RC1*R2C -> 0 | L994: =RC1*R2C -> 0 | M994: =RC1*R2C -> 0
B995: =RC1*R2C -> 0 | C995: =RC1*R2C -> 0 | D995: =RC1*R2C -> 0 | E995: =RC1*R2C -> 0 | F995: =RC1*R2C -> 0 | G995: =RC1*R2C -> 0 | H995: =RC1*R2C -> 0 | I995: =RC1*R2C -> 0 | J995: =RC1*R2C -> 0 | K995: =RC1*R2C -> 0 | L995: =RC1*R2C -> 0 | M995: =RC1*R2C -> 0
B996: =RC1*R2C -> 0 | C996: =RC1*R2C -> 0 | D996: =RC1*R2C -> 0 | E996: =RC1*R2C -> 0 | F996: =RC1*R2C -> 0 | G996: =RC1*R2C -> 0 | H996: =RC1*R2C -> 0 | I996: =RC1*R2C -> 0 | J996: =RC1*R2C -> 0 | K996: =RC1*R2C -> 0 | L996: =RC1*R2C -> 0 | M996: =RC1*R2C -> 0
B997: =RC1*R2C -> 0 | C997: =RC1*R2C -> 0 | D997: =RC1*R2C -> 0 | E997: =RC1*R2C -> 0 | F997: =RC1*R2C -> 0 | G997: =RC1*R2C -> 0 | H997: =RC1*R2C -> 0 | I997: =RC1*R2C -> 0 | J997: =RC1*R2C -> 0 | K997: =RC1*R2C -> 0 | L997: =RC1*R2C -> 0 | M997: =RC1*R2C -> 0
B998: =RC1*R2C -> 0 | C998: =RC1*R2C -> 0 | D998: =RC1*R2C -> 0 | E998: =RC1*R2C -> 0 | F998: =RC1*R2C -> 0 | G998: =RC1*R2C -> 0 | H998: =RC1*R2C -> 0 | I998: =RC1*R2C -> 0 | J998: =RC1*R2C -> 0 | K998: =RC1*R2C -> 0 | L998: =RC1*R2C -> 0 | M998: =RC1*R2C -> 0
B999: =RC1*R2C -> 0 | C999: =RC1*R2C -> 0 | D999: =RC1*R2C -> 0 | E999: =RC1*R2C -> 0 | F999: =RC1*R2C -> 0 | G999: =RC1*R2C -> 0 | H999: =RC1*R2C -> 0 | I999: =RC1*R2C -> 0 | J999: =RC1*R2C -> 0 | K999: =RC1*R2C -> 0 | L999: =RC1*R2C -> 0 | M999: =RC1*R2C -> 0
B1000: =RC1*R2C -> 0 | C1000: =RC1*R2C -> 0 | D1000: =RC1*R2C -> 0 | E1000: =RC1*R2C -> 0 | F1000: =RC1*R2C -> 0 | G1000: =RC1*R2C -> 0 | H1000: =RC1*R2C -> 0 | I1000: =RC1*R2C -> 0 | J1000: =RC1*R2C -> 0 | K1000: =RC1*R2C -> 0 | L1000: =RC1*R2C -> 0 | M1000: =RC1*R2C -> 0
B1001: =RC1*R2C -> 0 | C1001: =RC1*R2C -> 0 | D1001: =RC1*R2C -> 0 | E1001: =RC1*R2C -> 0 | F1001: =RC1*R2C -> 0 | G1001: =RC1*R2C -> 0 | H1001: =RC1*R2C -> 0 | I1001: =RC1*R2C -> 0 | J1001: =RC1*R2C -> 0 | K1001: =RC1*R2C -> 0 | L1001: =RC1*R2C -> 0 | M1001: =RC1*R2C -> 0
B1002: =RC1*R2C -> 0 | C1002: =RC1*R2C -> 0 | D1002: =RC1*R2C -> 0 | E1002: =RC1*R2C -> 0 | F1002: =RC1*R2C -> 0 | G1002: =RC1*R2C -> 0 | H1002: =RC1*R2C -> 0 | I1002: =RC1*R2C -> 0 | J1002: =RC1*R2C -> 0 | K1002: =RC1*R2C -> 0 | L1002: =RC1*R2C -> 0 | M1002: =RC1*R2C -> 0
B1003: =RC1*R2C -> 0 | C1003: =RC1*R2C -> 0 | D1003: =RC1*R2C -> 0 | E1003: =RC1*R2C -> 0 | F1003: =RC1*R2C -> 0 | G1003: =RC1*R2C -> 0 | H1003: =RC1*R2C -> 0 | I1003: =RC1*R2C -> 0 | J1003: =RC1*R2C -> 0 | K1003: =RC1*R2C -> 0 | L1003: =RC1*R2C -> 0 | M1003: =RC1*R2C -> 0
B1004: =RC1*R2C -> 0 | C1004: =RC1*R2C -> 0 | D1004: =RC1*R2C -> 0 | E1004: =RC1*R2C -> 0 | F1004: =RC1*R2C -> 0 | G1004: =RC1*R2C -> 0 | H1004: =RC1*R2C -> 0 | I1004: =RC1*R2C -> 0 | J1004: =RC1*R2C -> 0 | K1004: =RC1*R2C -> 0 | L1004: =RC1*R2C -> 0 | M1004: =RC1*R2C -> 0
B1005: =RC1*R2C -> 0 | C1005: =RC1*R2C -> 0 | D1005: =RC1*R2C -> 0 | E1005: =RC1*R2C -> 0 | F1005: =RC1*R2C -> 0 | G1005: =RC1*R2C -> 0 | H1005: =RC1*R2C -> 0 | I1005: =RC1*R2C -> 0 | J1005: =RC1*R2C -> 0 | K1005: =RC1*R2C -> 0 | L1005: =RC1*R2C -> 0 | M1005: =RC1*R2C -> 0
B1006: =RC1*R2C -> 0 | C1006: =RC1*R2C -> 0 | D1006: =RC1*R2C -> 0 | E1006: =RC1*R2C -> 0 | F1006: =RC1*R2C -> 0 | G1006: =RC1*R2C -> 0 | H1006: =RC1*R2C -> 0 | I1006: =RC1*R2C -> 0 | J1006: =RC1*R2C -> 0 | K1006: =RC1*R2C -> 0 | L1006: =RC1*R2C -> 0 | M1006: =RC1*R2C -> 0
B1007: =RC1*R2C -> 0 | C1007: =RC1*R2C -> 0 | D1007: =RC1*R2C -> 0 | E1007: =RC1*R2C -> 0 | F1007: =RC1*R2C -> 0 | G1007: =RC1*R2C -> 0 | H1007: =RC1*R2C -> 0 | I1007: =RC1*R2C -> 0 | J1007: =RC1*R2C -> 0 | K1007: =RC1*R2C -> 0 | L1007: =RC1*R2C -> 0 | M1007: =RC1*R2C -> 0
B1008: =RC1*R2C -> 0 | C1008: =RC1*R2C -> 0 | D1008: =RC1*R2C -> 0 | E1008: =RC1*R2C -> 0 | F1008: =RC1*R2C -> 0 | G1008: =RC1*R2C -> 0 | H1008: =RC1*R2C -> 0 | I1008: =RC1*R2C -> 0 | J1008: =RC1*R2C -> 0 | K1008: =RC1*R2C -> 0 | L1008: =RC1*R2C -> 0 | M1008: =RC1*R2C -> 0
B1009: =RC1*R2C -> 0 | C1009: =RC1*R2C -> 0 | D1009: =RC1*R2C -> 0 | E1009: =RC1*R2C -> 0 | F1009: =RC1*R2C -> 0 | G1009: =RC1*R2C -> 0 | H1009: =RC1*R2C -> 0 | I1009: =RC1*R2C -> 0 | J1009: =RC1*R2C -> 0 | K1009: =RC1*R2C -> 0 | L1009: =RC1*R2C -> 0 | M1009: =RC1*R2C -> 0
B1010: =RC1*R2C -> 0 | C1010: =RC1*R2C -> 0 | D1010: =RC1*R2C -> 0 | E1010: =RC1*R2C -> 0 | F1010: =RC1*R2C -> 0 | G1010: =RC1*R2C -> 0 | H1010: =RC1*R2C -> 0 | I1010: =RC1*R2C -> 0 | J1010: =RC1*R2C -> 0 | K1010: =RC1*R2C -> 0 | L1010: =RC1*R2C -> 0 | M1010: =RC1*R2C -> 0
B1011: =RC1*R2C -> 0 | C1011: =RC1*R2C -> 0 | D1011: =RC1*R2C -> 0 | E1011: =RC1*R2C -> 0 | F1011: =RC1*R2C -> 0 | G1011: =RC1*R2C -> 0 | H1011: =RC1*R2C -> 0 | I1011: =RC1*R2C -> 0 | J1011: =RC1*R2C -> 0 | K1011: =RC1*R2C -> 0 | L1011: =RC1*R2C -> 0 | M1011: =RC1*R2C -> 0
B1012: =RC1*R2C -> 0 | C1012: =RC1*R2C -> 0 | D1012: =RC1*R2C -> 0 | E1012: =RC1*R2C -> 0 | F1012: =RC1*R2C -> 0 | G1012: =RC1*R2C -> 0 | H1012: =RC1*R2C -> 0 | I1012: =RC1*R2C -> 0 | J1012: =RC1*R2C -> 0 | K1012: =RC1*R2C -> 0 | L1012: =RC1*R2C -> 0 | M1012: =RC1*R2C -> 0
B1013: =RC1*R2C -> 0 | C1013: =RC1*R2C -> 0 | D1013: =RC1*R2C -> 0 | E1013: =RC1*R2C -> 0 | F1013: =RC1*R2C -> 0 | G1013: =RC1*R2C -> 0 | H1013: =RC1*R2C -> 0 | I1013: =RC1*R2C -> 0 | J1013: =RC1*R2C -> 0 | K1013: =RC1*R2C -> 0 | L1013: =RC1*R2C -> 0 | M1013: =RC1*R2C -> 0
B1014: =RC1*R2C -> 0 | C1014: =RC1*R2C -> 0 | D1014: =RC1*R2C -> 0 | E1014: =RC1*R2C -> 0 | F1014: =RC1*R2C -> 0 | G1014: =RC1*R2C -> 0 | H1014: =RC1*R2C -> 0 | I1014: =RC1*R2C -> 0 | J1014: =RC1*R2C -> 0 | K1014: =RC1*R2C -> 0 | L1014: =RC1*R2C -> 0 | M1014: =RC1*R2C -> 0
B1015: =RC1*R2C -> 0 | C1015: =RC1*R2C -> 0 | D1015: =RC1*R2C -> 0 | E1015: =RC1*R2C -> 0 | F1015: =RC1*R2C -> 0 | G1015: =RC1*R2C -> 0 | H1015: =RC1*R2C -> 0 | I1015: =RC1*R2C -> 0 | J1015: =RC1*R2C -> 0 | K1015: =RC1*R2C -> 0 | L1015: =RC1*R2C -> 0 | M1015: =RC1*R2C -> 0
B1016: =RC1*R2C -> 0 | C1016: =RC1*R2C -> 0 | D1016: =RC1*R2C -> 0 | E1016: =RC1*R2C -> 0 | F1016: =RC1*R2C -> 0 | G1016: =RC1*R2C -> 0 | H1016: =RC1*R2C -> 0 | I1016: =RC1*R2C -> 0 | J1016: =RC1*R2C -> 0 | K1016: =RC1*R2C -> 0 | L1016: =RC1*R2C -> 0 | M1016: =RC1*R2C -> 0
B1017: =RC1*R2C -> 0 | C1017: =RC1*R2C -> 0 | D1017: =RC1*R2C -> 0 | E1017: =RC1*R2C -> 0 | F1017: =RC1*R2C -> 0 | G1017: =RC1*R2C -> 0 | H1017: =RC1*R2C -> 0 | I1017: =RC1*R2C -> 0 | J1017: =RC1*R2C -> 0 | K1017: =RC1*R2C -> 0 | L1017: =RC1*R2C -> 0 | M1017: =RC1*R2C -> 0
B1018: =RC1*R2C -> 0 | C1018: =RC1*R2C -> 0 | D1018: =RC1*R2C -> 0 | E1018: =RC1*R2C -> 0 | F1018: =RC1*R2C -> 0 | G1018: =RC1*R2C -> 0 | H1018: =RC1*R2C -> 0 | I1018: =RC1*R2C -> 0 | J1018: =RC1*R2C -> 0 | K1018: =RC1*R2C -> 0 | L1018: =RC1*R2C -> 0 | M1018: =RC1*R2C -> 0
B1019: =RC1*R2C -> 0 | C1019: =RC1*R2C -> 0 | D1019: =RC1*R2C -> 0 | E1019: =RC1*R2C -> 0 | F1019: =RC1*R2C -> 0 | G1019: =RC1*R2C -> 0 | H1019: =RC1*R2C -> 0 | I1019: =RC1*R2C -> 0 | J1019: =RC1*R2C -> 0 | K1019: =RC1*R2C -> 0 | L1019: =RC1*R2C -> 0 | M1019: =RC1*R2C -> 0
B1020: =RC1*R2C -> 0 | C1020: =RC1*R2C -> 0 | D1020: =RC1*R2C -> 0 | E1020: =RC1*R2C -> 0 | F1020: =RC1*R2C -> 0 | G1020: =RC1*R2C -> 0 | H1020: =RC1*R2C -> 0 | I1020: =RC1*R2C -> 0 | J1020: =RC1*R2C -> 0 | K1020: =RC1*R2C -> 0 | L1020: =RC1*R2C -> 0 | M1020: =RC1*R2C -> 0
B1021: =RC1*R2C -> 0 | C1021: =RC1*R2C -> 0 | D1021: =RC1*R2C -> 0 | E1021: =RC1*R2C -> 0 | F1021: =RC1*R2C -> 0 | G1021: =RC1*R2C -> 0 | H1021: =RC1*R2C -> 0 | I1021: =RC1*R2C -> 0 | J1021: =RC1*R2C -> 0 | K1021: =RC1*R2C -> 0 | L1021: =RC1*R2C -> 0 | M1021: =RC1*R2C -> 0
B1022: =RC1*R2C -> 0 | C1022: =RC1*R2C -> 0 | D1022: =RC1*R2C -> 0 | E1022: =RC1*R2C -> 0 | F1022: =RC1*R2C -> 0 | G1022: =RC1*R2C -> 0 | H1022: =RC1*R2C -> 0 | I1022: =RC1*R2C -> 0 | J1022: =RC1*R2C -> 0 | K1022: =RC1*R2C -> 0 | L1022: =RC1*R2C -> 0 | M1022: =RC1*R2C -> 0
B1023: =RC1*R2C -> 0 | C1023: =RC1*R2C -> 0 | D1023: =RC1*R2C -> 0 | E1023: =RC1*R2C -> 0 | F1023: =RC1*R2C -> 0 | G1023: =RC1*R2C -> 0 | H1023: =RC1*R2C -> 0 | I1023: =RC1*R2C -> 0 | J1023: =RC1*R2C -> 0 | K1023: =RC1*R2C -> 0 | L1023: =RC1*R2C -> 0 | M1023: =RC1*R2C -> 0
B1024: =RC1*R2C -> 0 | C1024: =RC1*R2C -> 0 | D1024: =RC1*R2C -> 0 | E1024: =RC1*R2C -> 0 | F1024: =RC1*R2C -> 0 | G1024: =RC1*R2C -> 0 | H1024: =RC1*R2C -> 0 | I1024: =RC1*R2C -> 0 | J1024: =RC1*R2C -> 0 | K1024: =RC1*R2C -> 0 | L1024: =RC1*R2C -> 0 | M1024: =RC1*R2C -> 0
B1025: =RC1*R2C -> 0 | C1025: =RC1*R2C -> 0 | D1025: =RC1*R2C -> 0 | E1025: =RC1*R2C -> 0 | F1025: =RC1*R2C -> 0 | G1025: =RC1*R2C -> 0 | H1025: =RC1*R2C -> 0 | I1025: =RC1*R2C -> 0 | J1025: =RC1*R2C -> 0 | K1025: =RC1*R2C -> 0 | L1025: =RC1*R2C -> 0 | M1025: =RC1*R2C -> 0
B1026: =RC1*R2C -> 0 | C1026: =RC1*R2C -> 0 | D1026: =RC1*R2C -> 0 | E1026: =RC1*R2C -> 0 | F1026: =RC1*R2C -> 0 | G1026: =RC1*R2C -> 0 | H1026: =RC1*R2C -> 0 | I1026: =RC1*R2C -> 0 | J1026: =RC1*R2C -> 0 | K1026: =RC1*R2C -> 0 | L1026: =RC1*R2C -> 0 | M1026: =RC1*R2C -> 0
B1027: =RC1*R2C -> 0 | C1027: =RC1*R2C -> 0 | D1027: =RC1*R2C -> 0 | E1027: =RC1*R2C -> 0 | F1027: =RC1*R2C -> 0 | G1027: =RC1*R2C -> 0 | H1027: =RC1*R2C -> 0 | I1027: =RC1*R2C -> 0 | J1027: =RC1*R2C -> 0 | K1027: =RC1*R2C -> 0 | L1027: =RC1*R2C -> 0 | M1027: =RC1*R2C -> 0
B1028: =RC1*R2C -> 0 | C1028: =RC1*R2C -> 0 | D1028: =RC1*R2C -> 0 | E1028: =RC1*R2C -> 0 | F1028: =RC1*R2C -> 0 | G1028: =RC1*R2C -> 0 | H1028: =RC1*R2C -> 0 | I1028: =RC1*R2C -> 0 | J1028: =RC1*R2C -> 0 | K1028: =RC1*R2C -> 0 | L1028: =RC1*R2C -> 0 | M1028: =RC1*R2C -> 0
B1029: =RC1*R2C -> 0 | C1029: =RC1*R2C -> 0 | D1029: =RC1*R2C -> 0 | E1029: =RC1*R2C -> 0 | F1029: =RC1*R2C -> 0 | G1029: =RC1*R2C -> 0 | H1029: =RC1*R2C -> 0 | I1029: =RC1*R2C -> 0 | J1029: =RC1*R2C -> 0 | K1029: =RC1*R2C -> 0 | L1029: =RC1*R2C -> 0 | M1029: =RC1*R2C -> 0
B1030: =RC1*R2C -> 0 | C1030: =RC1*R2C -> 0 | D1030: =RC1*R2C -> 0 | E1030: =RC1*R2C -> 0 | F1030: =RC1*R2C -> 0 | G1030: =RC1*R2C -> 0 | H1030: =RC1*R2C -> 0 | I1030: =RC1*R2C -> 0 | J1030: =RC1*R2C -> 0 | K1030: =RC1*R2C -> 0 | L1030: =RC1*R2C -> 0 | M1030: =RC1*R2C -> 0
B1031: =RC1*R2C -> 0 | C1031: =RC1*R2C -> 0 | D1031: =RC1*R2C -> 0 | E1031: =RC1*R2C -> 0 | F1031: =RC1*R2C -> 0 | G1031: =RC1*R2C -> 0 | H1031: =RC1*R2C -> 0 | I1031: =RC1*R2C -> 0 | J1031: =RC1*R2C -> 0 | K1031: =RC1*R2C -> 0 | L1031: =RC1*R2C -> 0 | M1031: =RC1*R2C -> 0
B1032: =RC1*R2C -> 0 | C1032: =RC1*R2C -> 0 | D1032: =RC1*R2C -> 0 | E1032: =RC1*R2C -> 0 | F1032: =RC1*R2C -> 0 | G1032: =RC1*R2C -> 0 | H1032: =RC1*R2C -> 0 | I1032: =RC1*R2C -> 0 | J1032: =RC1*R2C -> 0 | K1032: =RC1*R2C -> 0 | L1032: =RC1*R2C -> 0 | M1032: =RC1*R2C -> 0
B1033: =RC1*R2C -> 0 | C1033: =RC1*R2C -> 0 | D1033: =RC1*R2C -> 0 | E1033: =RC1*R2C -> 0 | F1033: =RC1*R2C -> 0 | G1033: =RC1*R2C -> 0 | H1033: =RC1*R2C -> 0 | I1033: =RC1*R2C -> 0 | J1033: =RC1*R2C -> 0 | K1033: =RC1*R2C -> 0 | L1033: =RC1*R2C -> 0 | M1033: =RC1*R2C -> 0
B1034: =RC1*R2C -> 0 | C1034: =RC1*R2C -> 0 | D1034: =RC1*R2C -> 0 | E1034: =RC1*R2C -> 0 | F1034: =RC1*R2C -> 0 | G1034: =RC1*R2C -> 0 | H1034: =RC1*R2C -> 0 | I1034: =RC1*R2C -> 0 | J1034: =RC1*R2C -> 0 | K1034: =RC1*R2C -> 0 | L1034: =RC1*R2C -> 0 | M1034: =RC1*R2C -> 0
B1035: =RC1*R2C -> 0 | C1035: =RC1*R2C -> 0 | D1035: =RC1*R2C -> 0 | E1035: =RC1*R2C -> 0 | F1035: =RC1*R2C -> 0 | G1035: =RC1*R2C -> 0 | H1035: =RC1*R2C -> 0 | I1035: =RC1*R2C -> 0 | J1035: =RC1*R2C -> 0 | K1035: =RC1*R2C -> 0 | L1035: =RC1*R2C -> 0 | M1035: =RC1*R2C -> 0
B1036: =RC1*R2C -> 0 | C1036: =RC1*R2C -> 0 | D1036: =RC1*R2C -> 0 | E1036: =RC1*R2C -> 0 | F1036: =RC1*R2C -> 0 | G1036: =RC1*R2C -> 0 | H1036: =RC1*R2C -> 0 | I1036: =RC1*R2C -> 0 | J1036: =RC1*R2C -> 0 | K1036: =RC1*R2C -> 0 | L1036: =RC1*R2C -> 0 | M1036: =RC1*R2C -> 0
B1037: =RC1*R2C -> 0 | C1037: =RC1*R2C -> 0 | D1037: =RC1*R2C -> 0 | E1037: =RC1*R2C -> 0 | F1037: =RC1*R2C -> 0 | G1037: =RC1*R2C -> 0 | H1037: =RC1*R2C -> 0 | I1037: =RC1*R2C -> 0 | J1037: =RC1*R2C -> 0 | K1037: =RC1*R2C -> 0 | L1037: =RC1*R2C -> 0 | M1037: =RC1*R2C -> 0
B1038: =RC1*R2C -> 0 | C1038: =RC1*R2C -> 0 | D1038: =RC1*R2C -> 0 | E1038: =RC1*R2C -> 0 | F1038: =RC1*R2C -> 0 | G1038: =RC1*R2C -> 0 | H1038: =RC1*R2C -> 0 | I1038: =RC1*R2C -> 0 | J1038: =RC1*R2C -> 0 | K1038: =RC1*R2C -> 0 | L1038: =RC1*R2C -> 0 | M1038: =RC1*R2C -> 0
B1039: =RC1*R2C -> 0 | C1039: =RC1*R2C -> 0 | D1039: =RC1*R2C -> 0 | E1039: =RC1*R2C -> 0 | F1039: =RC1*R2C -> 0 | G1039: =RC1*R2C -> 0 | H1039: =RC1*R2C -> 0 | I1039: =RC1*R2C -> 0 | J1039: =RC1*R2C -> 0 | K1039: =RC1*R2C -> 0 | L1039: =RC1*R2C -> 0 | M1039: =RC1*R2C -> 0
B1040: =RC1*R2C -> 0 | C1040: =RC1*R2C -> 0 | D1040: =RC1*R2C -> 0 | E1040: =RC1*R2C -> 0 | F1040: =RC1*R2C -> 0 | G1040: =RC1*R2C -> 0 | H1040: =RC1*R2C -> 0 | I1040: =RC1*R2C -> 0 | J1040: =RC1*R2C -> 0 | K1040: =RC1*R2C -> 0 | L1040: =RC1*R2C -> 0 | M1040: =RC1*R2C -> 0
B1041: =RC1*R2C -> 0 | C1041: =RC1*R2C -> 0 | D1041: =RC1*R2C -> 0 | E1041: =RC1*R2C -> 0 | F1041: =RC1*R2C -> 0 | G1041: =RC1*R2C -> 0 | H1041: =RC1*R2C -> 0 | I1041: =RC1*R2C -> 0 | J1041: =RC1*R2C -> 0 | K1041: =RC1*R2C -> 0 | L1041: =RC1*R2C -> 0 | M1041: =RC1*R2C -> 0
B1042: =RC1*R2C -> 0 | C1042: =RC1*R2C -> 0 | D1042: =RC1*R2C -> 0 | E1042: =RC1*R2C -> 0 | F1042: =RC1*R2C -> 0 | G1042: =RC1*R2C -> 0 | H1042: =RC1*R2C -> 0 | I1042: =RC1*R2C -> 0 | J1042: =RC1*R2C -> 0 | K1042: =RC1*R2C -> 0 | L1042: =RC1*R2C -> 0 | M1042: =RC1*R2C -> 0
B1043: =RC1*R2C -> 0 | C1043: =RC1*R2C -> 0 | D1043: =RC1*R2C -> 0 | E1043: =RC1*R2C -> 0 | F1043: =RC1*R2C -> 0 | G1043: =RC1*R2C -> 0 | H1043: =RC1*R2C -> 0 | I1043: =RC1*R2C -> 0 | J1043: =RC1*R2C -> 0 | K1043: =RC1*R2C -> 0 | L1043: =RC1*R2C -> 0 | M1043: =RC1*R2C -> 0
B1044: =RC1*R2C -> 0 | C1044: =RC1*R2C -> 0 | D1044: =RC1*R2C -> 0 | E1044: =RC1*R2C -> 0 | F1044: =RC1*R2C -> 0 | G1044: =RC1*R2C -> 0 | H1044: =RC1*R2C -> 0 | I1044: =RC1*R2C -> 0 | J1044: =RC1*R2C -> 0 | K1044: =RC1*R2C -> 0 | L1044: =RC1*R2C -> 0 | M1044: =RC1*R2C -> 0
B1045: =RC1*R2C -> 0 | C1045: =RC1*R2C -> 0 | D1045: =RC1*R2C -> 0 | E1045: =RC1*R2C -> 0 | F1045: =RC1*R2C -> 0 | G1045: =RC1*R2C -> 0 | H1045: =RC1*R2C -> 0 | I1045: =RC1*R2C -> 0 | J1045: =RC1*R2C -> 0 | K1045: =RC1*R2C -> 0 | L1045: =RC1*R2C -> 0 | M1045: =RC1*R2C -> 0
B1046: =RC1*R2C -> 0 | C1046: =RC1*R2C -> 0 | D1046: =RC1*R2C -> 0 | E1046: =RC1*R2C -> 0 | F1046: =RC1*R2C -> 0 | G1046: =RC1*R2C -> 0 | H1046: =RC1*R2C -> 0 | I1046: =RC1*R2C -> 0 | J1046: =RC1*R2C -> 0 | K1046: =RC1*R2C -> 0 | L1046: =RC1*R2C -> 0 | M1046: =RC1*R2C -> 0
B1047: =RC1*R2C -> 0 | C1047: =RC1*R2C -> 0 | D1047: =RC1*R2C -> 0 | E1047: =RC1*R2C -> 0 | F1047: =RC1*R2C -> 0 | G1047: =RC1*R2C -> 0 | H1047: =RC1*R2C -> 0 | I1047: =RC1*R2C -> 0 | J1047: =RC1*R2C -> 0 | K1047: =RC1*R2C -> 0 | L1047: =RC1*R2C -> 0 | M1047: =RC1*R2C -> 0
B1048: =RC1*R2C -> 0 | C1048: =RC1*R2C -> 0 | D1048: =RC1*R2C -> 0 | E1048: =RC1*R2C -> 0 | F1048: =RC1*R2C -> 0 | G1048: =RC1*R2C -> 0 | H1048: =RC1*R2C -> 0 | I1048: =RC1*R2C -> 0 | J1048: =RC1*R2C -> 0 | K1048: =RC1*R2C -> 0 | L1048: =RC1*R2C -> 0 | M1048: =RC1*R2C -> 0
B1049: =RC1*R2C -> 0 | C1049: =RC1*R2C -> 0 | D1049: =RC1*R2C -> 0 | E1049: =RC1*R2C -> 0 | F1049: =RC1*R2C -> 0 | G1049: =RC1*R2C -> 0 | H1049: =RC1*R2C -> 0 | I1049: =RC1*R2C -> 0 | J1049: =RC1*R2C -> 0 | K1049: =RC1*R2C -> 0 | L1049: =RC1*R2C -> 0 | M1049: =RC1*R2C -> 0
B1050: =RC1*R2C -> 0 | C1050: =RC1*R2C -> 0 | D1050: =RC1*R2C -> 0 | E1050: =RC1*R2C -> 0 | F1050: =RC1*R2C -> 0 | G1050: =RC1*R2C -> 0 | H1050: =RC1*R2C -> 0 | I1050: =RC1*R2C -> 0 | J1050: =RC1*R2C -> 0 | K1050: =RC1*R2C -> 0 | L1050: =RC1*R2C -> 0 | M1050: =RC1*R2C -> 0
B1051: =RC1*R2C -> 0 | C1051: =RC1*R2C -> 0 | D1051: =RC1*R2C -> 0 | E1051: =RC1*R2C -> 0 | F1051: =RC1*R2C -> 0 | G1051: =RC1*R2C -> 0 | H1051: =RC1*R2C -> 0 | I1051: =RC1*R2C -> 0 | J1051: =RC1*R2C -> 0 | K1051: =RC1*R2C -> 0 | L1051: =RC1*R2C -> 0 | M1051: =RC1*R2C -> 0
B1052: =RC1*R2C -> 0 | C1052: =RC1*R2C -> 0 | D1052: =RC1*R2C -> 0 | E1052: =RC1*R2C -> 0 | F1052: =RC1*R2C -> 0 | G1052: =RC1*R2C -> 0 | H1052: =RC1*R2C -> 0 | I1052: =RC1*R2C -> 0 | J1052: =RC1*R2C -> 0 | K1052: =RC1*R2C -> 0 | L1052: =RC1*R2C -> 0 | M1052: =RC1*R2C -> 0
B1053: =RC1*R2C -> 0 | C1053: =RC1*R2C -> 0 | D1053: =RC1*R2C -> 0 | E1053: =RC1*R2C -> 0 | F1053: =RC1*R2C -> 0 | G1053: =RC1*R2C -> 0 | H1053: =RC1*R2C -> 0 | I1053: =RC1*R2C -> 0 | J1053: =RC1*R2C -> 0 | K1053: =RC1*R2C -> 0 | L1053: =RC1*R2C -> 0 | M1053: =RC1*R2C -> 0
B1054: =RC1*R2C -> 0 | C1054: =RC1*R2C -> 0 | D1054: =RC1*R2C -> 0 | E1054: =RC1*R2C -> 0 | F1054: =RC1*R2C -> 0 | G1054: =RC1*R2C -> 0 | H1054: =RC1*R2C -> 0 | I1054: =RC1*R2C -> 0 | J1054: =RC1*R2C -> 0 | K1054: =RC1*R2C -> 0 | L1054: =RC1*R2C -> 0 | M1054: =RC1*R2C -> 0
B1055: =RC1*R2C -> 0 | C1055: =RC1*R2C -> 0 | D1055: =RC1*R2C -> 0 | E1055: =RC1*R2C -> 0 | F1055: =RC1*R2C -> 0 | G1055: =RC1*R2C -> 0 | H1055: =RC1*R2C -> 0 | I1055: =RC1*R2C -> 0 | J1055: =RC1*R2C -> 0 | K1055: =RC1*R2C -> 0 | L1055: =RC1*R2C -> 0 | M1055: =RC1*R2C -> 0
B1056: =RC1*R2C -> 0 | C1056: =RC1*R2C -> 0 | D1056: =RC1*R2C -> 0 | E1056: =RC1*R2C -> 0 | F1056: =RC1*R2C -> 0 | G1056: =RC1*R2C -> 0 | H1056: =RC1*R2C -> 0 | I1056: =RC1*R2C -> 0 | J1056: =RC1*R2C -> 0 | K1056: =RC1*R2C -> 0 | L1056: =RC1*R2C -> 0 | M1056: =RC1*R2C -> 0
B1057: =RC1*R2C -> 0 | C1057: =RC1*R2C -> 0 | D1057: =RC1*R2C -> 0 | E1057: =RC1*R2C -> 0 | F1057: =RC1*R2C -> 0 | G1057: =RC1*R2C -> 0 | H1057: =RC1*R2C -> 0 | I1057: =RC1*R2C -> 0 | J1057: =RC1*R2C -> 0 | K1057: =RC1*R2C -> 0 | L1057: =RC1*R2C -> 0 | M1057: =RC1*R2C -> 0
B1058: =RC1*R2C -> 0 | C1058: =RC1*R2C -> 0 | D1058: =RC1*R2C -> 0 | E1058: =RC1*R2C -> 0 | F1058: =RC1*R2C -> 0 | G1058: =RC1*R2C -> 0 | H1058: =RC1*R2C -> 0 | I1058: =RC1*R2C -> 0 | J1058: =RC1*R2C -> 0 | K1058: =RC1*R2C -> 0 | L1058: =RC1*R2C -> 0 | M1058: =RC1*R2C -> 0
B1059: =RC1*R2C -> 0 | C1059: =RC1*R2C -> 0 | D1059: =RC1*R2C -> 0 | E1059: =RC1*R2C -> 0 | F1059: =RC1*R2C -> 0 | G1059: =RC1*R2C -> 0 | H1059: =RC1*R2C -> 0 | I1059: =RC1*R2C -> 0 | J1059: =RC1*R2C -> 0 | K1059: =RC1*R2C -> 0 | L1059: =RC1*R2C -> 0 | M1059: =RC1*R2C -> 0
B1060: =RC1*R2C -> 0 | C1060: =RC1*R2C -> 0 | D1060: =RC1*R2C -> 0 | E1060: =RC1*R2C -> 0 | F1060: =RC1*R2C -> 0 | G1060: =RC1*R2C -> 0 | H1060: =RC1*R2C -> 0 | I1060: =RC1*R2C -> 0 | J1060: =RC1*R2C -> 0 | K1060: =RC1*R2C -> 0 | L1060: =RC1*R2C -> 0 | M1060: =RC1*R2C -> 0
B1061: =RC1*R2C -> 0 | C1061: =RC1*R2C -> 0 | D1061: =RC1*R2C -> 0 | E1061: =RC1*R2C -> 0 | F1061: =RC1*R2C -> 0 | G1061: =RC1*R2C -> 0 | H1061: =RC1*R2C -> 0 | I1061: =RC1*R2C -> 0 | J1061: =RC1*R2C -> 0 | K1061: =RC1*R2C -> 0 | L1061: =RC1*R2C -> 0 | M1061: =RC1*R2C -> 0
B1062: =RC1*R2C -> 0 | C1062: =RC1*R2C -> 0 | D1062: =RC1*R2C -> 0 | E1062: =RC1*R2C -> 0 | F1062: =RC1*R2C -> 0 | G1062: =RC1*R2C -> 0 | H1062: =RC1*R2C -> 0 | I1062: =RC1*R2C -> 0 | J1062: =RC1*R2C -> 0 | K1062: =RC1*R2C -> 0 | L1062: =RC1*R2C -> 0 | M1062: =RC1*R2C -> 0
B1063: =RC1*R2C -> 0 | C1063: =RC1*R2C -> 0 | D1063: =RC1*R2C -> 0 | E1063: =RC1*R2C -> 0 | F1063: =RC1*R2C -> 0 | G1063: =RC1*R2C -> 0 | H1063: =RC1*R2C -> 0 | I1063: =RC1*R2C -> 0 | J1063: =RC1*R2C -> 0 | K1063: =RC1*R2C -> 0 | L1063: =RC1*R2C -> 0 | M1063: =RC1*R2C -> 0
B1064: =RC1*R2C -> 0 | C1064: =RC1*R2C -> 0 | D1064: =RC1*R2C -> 0 | E1064: =RC1*R2C -> 0 | F1064: =RC1*R2C -> 0 | G1064: =RC1*R2C -> 0 | H1064: =RC1*R2C -> 0 | I1064: =RC1*R2C -> 0 | J1064: =RC1*R2C -> 0 | K1064: =RC1*R2C -> 0 | L1064: =RC1*R2C -> 0 | M1064: =RC1*R2C -> 0
B1065: =RC1*R2C -> 0 | C1065: =RC1*R2C -> 0 | D1065: =RC1*R2C -> 0 | E1065: =RC1*R2C -> 0 | F1065: =RC1*R2C -> 0 | G1065: =RC1*R2C -> 0 | H1065: =RC1*R2C -> 0 | I1065: =RC1*R2C -> 0 | J1065: =RC1*R2C -> 0 | K1065: =RC1*R2C -> 0 | L1065: =RC1*R2C -> 0 | M1065: =RC1*R2C -> 0
B1066: =RC1*R2C -> 0 | C1066: =RC1*R2C -> 0 | D1066: =RC1*R2C -> 0 | E1066: =RC1*R2C -> 0 | F1066: =RC1*R2C -> 0 | G1066: =RC1*R2C -> 0 | H1066: =RC1*R2C -> 0 | I1066: =RC1*R2C -> 0 | J1066: =RC1*R2C -> 0 | K1066: =RC1*R2C -> 0 | L1066: =RC1*R2C -> 0 | M1066: =RC1*R2C -> 0
B1067: =RC1*R2C -> 0 | C1067: =RC1*R2C -> 0 | D1067: =RC1*R2C -> 0 | E1067: =RC1*R2C -> 0 | F1067: =RC1*R2C -> 0 | G1067: =RC1*R2C -> 0 | H1067: =RC1*R2C -> 0 | I1067: =RC1*R2C -> 0 | J1067: =RC1*R2C -> 0 | K1067: =RC1*R2C -> 0 | L1067: =RC1*R2C -> 0 | M1067: =RC1*R2C -> 0
B1068: =RC1*R2C -> 0 | C1068: =RC1*R2C -> 0 | D1068: =RC1*R2C -> 0 | E1068: =RC1*R2C -> 0 | F1068: =RC1*R2C -> 0 | G1068: =RC1*R2C -> 0 | H1068: =RC1*R2C -> 0 | I1068: =RC1*R2C -> 0 | J1068: =RC1*R2C -> 0 | K1068: =RC1*R2C -> 0 | L1068: =RC1*R2C -> 0 | M1068: =RC1*R2C -> 0
B1069: =RC1*R2C -> 0 | C1069: =RC1*R2C -> 0 | D1069: =RC1*R2C -> 0 | E1069: =RC1*R2C -> 0 | F1069: =RC1*R2C -> 0 | G1069: =RC1*R2C -> 0 | H1069: =RC1*R2C -> 0 | I1069: =RC1*R2C -> 0 | J1069: =RC1*R2C -> 0 | K1069: =RC1*R2C -> 0 | L1069: =RC1*R2C -> 0 | M1069: =RC1*R2C -> 0
B1070: =RC1*R2C -> 0 | C1070: =RC1*R2C -> 0 | D1070: =RC1*R2C -> 0 | E1070: =RC1*R2C -> 0 | F1070: =RC1*R2C -> 0 | G1070: =RC1*R2C -> 0 | H1070: =RC1*R2C -> 0 | I1070: =RC1*R2C -> 0 | J1070: =RC1*R2C -> 0 | K1070: =RC1*R2C -> 0 | L1070: =RC1*R2C -> 0 | M1070: =RC1*R2C -> 0
B1071: =RC1*R2C -> 0 | C1071: =RC1*R2C -> 0 | D1071: =RC1*R2C -> 0 | E1071: =RC1*R2C -> 0 | F1071: =RC1*R2C -> 0 | G1071: =RC1*R2C -> 0 | H1071: =RC1*R2C -> 0 | I1071: =RC1*R2C -> 0 | J1071: =RC1*R2C -> 0 | K1071: =RC1*R2C -> 0 | L1071: =RC1*R2C -> 0 | M1071: =RC1*R2C -> 0
B1072: =RC1*R2C -> 0 | C1072: =RC1*R2C -> 0 | D1072: =RC1*R2C -> 0 | E1072: =RC1*R2C -> 0 | F1072: =RC1*R2C -> 0 | G1072: =RC1*R2C -> 0 | H1072: =RC1*R2C -> 0 | I1072: =RC1*R2C -> 0 | J1072: =RC1*R2C -> 0 | K1072: =RC1*R2C -> 0 | L1072: =RC1*R2C -> 0 | M1072: =RC1*R2C -> 0
B1073: =RC1*R2C -> 0 | C1073: =RC1*R2C -> 0 | D1073: =RC1*R2C -> 0 | E1073: =RC1*R2C -> 0 | F1073: =RC1*R2C -> 0 | G1073: =RC1*R2C -> 0 | H1073: =RC1*R2C -> 0 | I1073: =RC1*R2C -> 0 | J1073: =RC1*R2C -> 0 | K1073: =RC1*R2C -> 0 | L1073: =RC1*R2C -> 0 | M1073: =RC1*R2C -> 0
B1074: =RC1*R2C -> 0 | C1074: =RC1*R2C -> 0 | D1074: =RC1*R2C -> 0 | E1074: =RC1*R2C -> 0 | F1074: =RC1*R2C -> 0 | G1074: =RC1*R2C -> 0 | H1074: =RC1*R2C -> 0 | I1074: =RC1*R2C -> 0 | J1074: =RC1*R2C -> 0 | K1074: =RC1*R2C -> 0 | L1074: =RC1*R2C -> 0 | M1074: =RC1*R2C -> 0
B1075: =RC1*R2C -> 0 | C1075: =RC1*R2C -> 0 | D1075: =RC1*R2C -> 0 | E1075: =RC1*R2C -> 0 | F1075: =RC1*R2C -> 0 | G1075: =RC1*R2C -> 0 | H1075: =RC1*R2C -> 0 | I1075: =RC1*R2C -> 0 | J1075: =RC1*R2C -> 0 | K1075: =RC1*R2C -> 0 | L1075: =RC1*R2C -> 0 | M1075: =RC1*R2C -> 0
B1076: =RC1*R2C -> 0 | C1076: =RC1*R2C -> 0 | D1076: =RC1*R2C -> 0 | E1076: =RC1*R2C -> 0 | F1076: =RC1*R2C -> 0 | G1076: =RC1*R2C -> 0 | H1076: =RC1*R2C -> 0 | I1076: =RC1*R2C -> 0 | J1076: =RC1*R2C -> 0 | K1076: =RC1*R2C -> 0 | L1076: =RC1*R2C -> 0 | M1076: =RC1*R2C -> 0
B1077: =RC1*R2C -> 0 | C1077: =RC1*R2C -> 0 | D1077: =RC1*R2C -> 0 | E1077: =RC1*R2C -> 0 | F1077: =RC1*R2C -> 0 | G1077: =RC1*R2C -> 0 | H1077: =RC1*R2C -> 0 | I1077: =RC1*R2C -> 0 | J1077: =RC1*R2C -> 0 | K1077: =RC1*R2C -> 0 | L1077: =RC1*R2C -> 0 | M1077: =RC1*R2C -> 0
B1078: =RC1*R2C -> 0 | C1078: =RC1*R2C -> 0 | D1078: =RC1*R2C -> 0 | E1078: =RC1*R2C -> 0 | F1078: =RC1*R2C -> 0 | G1078: =RC1*R2C -> 0 | H1078: =RC1*R2C -> 0 | I1078: =RC1*R2C -> 0 | J1078: =RC1*R2C -> 0 | K1078: =RC1*R2C -> 0 | L1078: =RC1*R2C -> 0 | M1078: =RC1*R2C -> 0
B1079: =RC1*R2C -> 0 | C1079: =RC1*R2C -> 0 | D1079: =RC1*R2C -> 0 | E1079: =RC1*R2C -> 0 | F1079: =RC1*R2C -> 0 | G1079: =RC1*R2C -> 0 | H1079: =RC1*R2C -> 0 | I1079: =RC1*R2C -> 0 | J1079: =RC1*R2C -> 0 | K1079: =RC1*R2C -> 0 | L1079: =RC1*R2C -> 0 | M1079: =RC1*R2C -> 0
B1080: =RC1*R2C -> 0 | C1080: =RC1*R2C -> 0 | D1080: =RC1*R2C -> 0 | E1080: =RC1*R2C -> 0 | F1080: =RC1*R2C -> 0 | G1080: =RC1*R2C -> 0 | H1080: =RC1*R2C -> 0 | I1080: =RC1*R2C -> 0 | J1080: =RC1*R2C -> 0 | K1080: =RC1*R2C -> 0 | L1080: =RC1*R2C -> 0 | M1080: =RC1*R2C -> 0
B1081: =RC1*R2C -> 0 | C1081: =RC1*R2C -> 0 | D1081: =RC1*R2C -> 0 | E1081: =RC1*R2C -> 0 | F1081: =RC1*R2C -> 0 | G1081: =RC1*R2C -> 0 | H1081: =RC1*R2C -> 0 | I1081: =RC1*R2C -> 0 | J1081: =RC1*R2C -> 0 | K1081: =RC1*R2C -> 0 | L1081: =RC1*R2C -> 0 | M1081: =RC1*R2C -> 0
B1082: =RC1*R2C -> 0 | C1082: =RC1*R2C -> 0 | D1082: =RC1*R2C -> 0 | E1082: =RC1*R2C -> 0 | F1082: =RC1*R2C -> 0 | G1082: =RC1*R2C -> 0 | H1082: =RC1*R2C -> 0 | I1082: =RC1*R2C -> 0 | J1082: =RC1*R2C -> 0 | K1082: =RC1*R2C -> 0 | L1082: =RC1*R2C -> 0 | M1082: =RC1*R2C -> 0
B1083: =RC1*R2C -> 0 | C1083: =RC1*R2C -> 0 | D1083: =RC1*R2C -> 0 | E1083: =RC1*R2C -> 0 | F1083: =RC1*R2C -> 0 | G1083: =RC1*R2C -> 0 | H1083: =RC1*R2C -> 0 | I1083: =RC1*R2C -> 0 | J1083: =RC1*R2C -> 0 | K1083: =RC1*R2C -> 0 | L1083: =RC1*R2C -> 0 | M1083: =RC1*R2C -> 0
B1084: =RC1*R2C -> 0 | C1084: =RC1*R2C -> 0 | D1084: =RC1*R2C -> 0 | E1084: =RC1*R2C -> 0 | F1084: =RC1*R2C -> 0 | G1084: =RC1*R2C -> 0 | H1084: =RC1*R2C -> 0 | I1084: =RC1*R2C -> 0 | J1084: =RC1*R2C -> 0 | K1084: =RC1*R2C -> 0 | L1084: =RC1*R2C -> 0 | M1084: =RC1*R2C -> 0
B1085: =RC1*R2C -> 0 | C1085: =RC1*R2C -> 0 | D1085: =RC1*R2C -> 0 | E1085: =RC1*R2C -> 0 | F1085: =RC1*R2C -> 0 | G1085: =RC1*R2C -> 0 | H1085: =RC1*R2C -> 0 | I1085: =RC1*R2C -> 0 | J1085: =RC1*R2C -> 0 | K1085: =RC1*R2C -> 0 | L1085: =RC1*R2C -> 0 | M1085: =RC1*R2C -> 0
B1086: =RC1*R2C -> 0 | C1086: =RC1*R2C -> 0 | D1086: =RC1*R2C -> 0 | E1086: =RC1*R2C -> 0 | F1086: =RC1*R2C -> 0 | G1086: =RC1*R2C -> 0 | H1086: =RC1*R2C -> 0 | I1086: =RC1*R2C -> 0 | J1086: =RC1*R2C -> 0 | K1086: =RC1*R2C -> 0 | L1086: =RC1*R2C -> 0 | M1086: =RC1*R2C -> 0
B1087: =RC1*R2C -> 0 | C1087: =RC1*R2C -> 0 | D1087: =RC1*R2C -> 0 | E1087: =RC1*R2C -> 0 | F1087: =RC1*R2C -> 0 | G1087: =RC1*R2C -> 0 | H1087: =RC1*R2C -> 0 | I1087: =RC1*R2C -> 0 | J1087: =RC1*R2C -> 0 | K1087: =RC1*R2C -> 0 | L1087: =RC1*R2C -> 0 | M1087: =RC1*R2C -> 0
B1088: =RC1*R2C -> 0 | C1088: =RC1*R2C -> 0 | D1088: =RC1*R2C -> 0 | E1088: =RC1*R2C -> 0 | F1088: =RC1*R2C -> 0 | G1088: =RC1*R2C -> 0 | H1088: =RC1*R2C -> 0 | I1088: =RC1*R2C -> 0 | J1088: =RC1*R2C -> 0 | K1088: =RC1*R2C -> 0 | L1088: =RC1*R2C -> 0 | M1088: =RC1*R2C -> 0
B1089: =RC1*R2C -> 0 | C1089: =RC1*R2C -> 0 | D1089: =RC1*R2C -> 0 | E1089: =RC1*R2C -> 0 | F1089: =RC1*R2C -> 0 | G1089: =RC1*R2C -> 0 | H1089: =RC1*R2C -> 0 | I1089: =RC1*R2C -> 0 | J1089: =RC1*R2C -> 0 | K1089: =RC1*R2C -> 0 | L1089: =RC1*R2C -> 0 | M1089: =RC1*R2C -> 0
B1090: =RC1*R2C -> 0 | C1090: =RC1*R2C -> 0 | D1090: =RC1*R2C -> 0 | E1090: =RC1*R2C -> 0 | F1090: =RC1*R2C -> 0 | G1090: =RC1*R2C -> 0 | H1090: =RC1*R2C -> 0 | I1090: =RC1*R2C -> 0 | J1090: =RC1*R2C -> 0 | K1090: =RC1*R2C -> 0 | L1090: =RC1*R2C -> 0 | M1090: =RC1*R2C -> 0
B1091: =RC1*R2C -> 0 | C1091: =RC1*R2C -> 0 | D1091: =RC1*R2C -> 0 | E1091: =RC1*R2C -> 0 | F1091: =RC1*R2C -> 0 | G1091: =RC1*R2C -> 0 | H1091: =RC1*R2C -> 0 | I1091: =RC1*R2C -> 0 | J1091: =RC1*R2C -> 0 | K1091: =RC1*R2C -> 0 | L1091: =RC1*R2C -> 0 | M1091: =RC1*R2C -> 0
B1092: =RC1*R2C -> 0 | C1092: =RC1*R2C -> 0 | D1092: =RC1*R2C -> 0 | E1092: =RC1*R2C -> 0 | F1092: =RC1*R2C -> 0 | G1092: =RC1*R2C -> 0 | H1092: =RC1*R2C -> 0 | I1092: =RC1*R2C -> 0 | J1092: =RC1*R2C -> 0 | K1092: =RC1*R2C -> 0 | L1092: =RC1*R2C -> 0 | M1092: =RC1*R2C -> 0
B1093: =RC1*R2C -> 0 | C1093: =RC1*R2C -> 0 | D1093: =RC1*R2C -> 0 | E1093: =RC1*R2C -> 0 | F1093: =RC1*R2C -> 0 | G1093: =RC1*R2C -> 0 | H1093: =RC1*R2C -> 0 | I1093: =RC1*R2C -> 0 | J1093: =RC1*R2C -> 0 | K1093: =RC1*R2C -> 0 | L1093: =RC1*R2C -> 0 | M1093: =RC1*R2C -> 0
B1094: =RC1*R2C -> 0 | C1094: =RC1*R2C -> 0 | D1094: =RC1*R2C -> 0 | E1094: =RC1*R2C -> 0 | F1094: =RC1*R2C -> 0 | G1094: =RC1*R2C -> 0 | H1094: =RC1*R2C -> 0 | I1094: =RC1*R2C -> 0 | J1094: =RC1*R2C -> 0 | K1094: =RC1*R2C -> 0 | L1094: =RC1*R2C -> 0 | M1094: =RC1*R2C -> 0
B1095: =RC1*R2C -> 0 | C1095: =RC1*R2C -> 0 | D1095: =RC1*R2C -> 0 | E1095: =RC1*R2C -> 0 | F1095: =RC1*R2C -> 0 | G1095: =RC1*R2C -> 0 | H1095: =RC1*R2C -> 0 | I1095: =RC1*R2C -> 0 | J1095: =RC1*R2C -> 0 | K1095: =RC1*R2C -> 0 | L1095: =RC1*R2C -> 0 | M1095: =RC1*R2C -> 0
B1096: =RC1*R2C -> 0 | C1096: =RC1*R2C -> 0 | D1096: =RC1*R2C -> 0 | E1096: =RC1*R2C -> 0 | F1096: =RC1*R2C -> 0 | G1096: =RC1*R2C -> 0 | H1096: =RC1*R2C -> 0 | I1096: =RC1*R2C -> 0 | J1096: =RC1*R2C -> 0 | K1096: =RC1*R2C -> 0 | L1096: =RC1*R2C -> 0 | M1096: =RC1*R2C -> 0
B1097: =RC1*R2C -> 0 | C1097: =RC1*R2C -> 0 | D1097: =RC1*R2C -> 0 | E1097: =RC1*R2C -> 0 | F1097: =RC1*R2C -> 0 | G1097: =RC1*R2C -> 0 | H1097: =RC1*R2C -> 0 | I1097: =RC1*R2C -> 0 | J1097: =RC1*R2C -> 0 | K1097: =RC1*R2C -> 0 | L1097: =RC1*R2C -> 0 | M1097: =RC1*R2C -> 0
B1098: =RC1*R2C -> 0 | C1098: =RC1*R2C -> 0 | D1098: =RC1*R2C -> 0 | E1098: =RC1*R2C -> 0 | F1098: =RC1*R2C -> 0 | G1098: =RC1*R2C -> 0 | H1098: =RC1*R2C -> 0 | I1098: =RC1*R2C -> 0 | J1098: =RC1*R2C -> 0 | K1098: =RC1*R2C -> 0 | L1098: =RC1*R2C -> 0 | M1098: =RC1*R2C -> 0
B1099: =RC1*R2C -> 0 | C1099: =RC1*R2C -> 0 | D1099: =RC1*R2C -> 0 | E1099: =RC1*R2C -> 0 | F1099: =RC1*R2C -> 0 | G1099: =RC1*R2C -> 0 | H1099: =RC1*R2C -> 0 | I1099: =RC1*R2C -> 0 | J1099: =RC1*R2C -> 0 | K1099: =RC1*R2C -> 0 | L1099: =RC1*R2C -> 0 | M1099: =RC1*R2C -> 0
B1100: =RC1*R2C -> 0 | C1100: =RC1*R2C -> 0 | D1100: =RC1*R2C -> 0 | E1100: =RC1*R2C -> 0 | F1100: =RC1*R2C -> 0 | G1100: =RC1*R2C -> 0 | H1100: =RC1*R2C -> 0 | I1100: =RC1*R2C -> 0 | J1100: =RC1*R2C -> 0 | K1100: =RC1*R2C -> 0 | L1100: =RC1*R2C -> 0 | M1100: =RC1*R2C -> 0