Sheet: 910617
A1: 中華電信網路容量及使用現況雙週報表
K2: 填表日期：91 年 06 月17日
B3: 項 目 | C3: 單位 | D3: 分公司 | E3: 至90年12月累計數 | F3: 91年預定建設數 | G3: 建設執行現況(%) | H3: 91年當月累計設備總量 | I3: 當週累計 使用總量 | J3: 使用率% | K3: 備註 | L3: 91實際累計建設量 | M3: 累計淨增
A4: 1 | B4: 市話交換機門號數(POTS) | C4: 門 | D4: 北分 | E4: 8253465 | F4: 1137000 | G4: =IF(RC[-1]>0,RC[5]/RC[-1],0) -> 8.0299032541776602E-2 | H4: 8269765 | I4: 6713076 | J4: =RC[-1]/RC[-2] -> 0.81176139829850058 | K4: 固網(資料取得截止日期91/05/31) | L4: 91300 | M4: 91300 | N4: 行銷處23445420吳碧芬
D5: 中分 | E5: 4082500 | F5: 79000 | G5: =IF(RC[-1]>0,RC[5]/RC[-1],0) -> 0.189873417721519 | H5: 4077500 | I5: 2872249 | J5: =RC[-1]/RC[-2] -> 0.70441422440220725 | L5: 15000 | M5: 15000
D6: 南分 | E6: 4823946 | F6: 512300 | G6: =IF(RC[-1]>0,RC[5]/RC[-1],0) -> 0.33827835252781574 | H6: 4810030 | I6: 3319732 | J6: =RC[-1]/RC[-2] -> 0.69016866838668367 | L6: 173300 | M6: 173300
A7: 2 | B7: ISDN BRA | C7: 埠 | D7: 北分 | E7: 79129 | F7: 832 | G7: =IF(RC[-1]>0,RC[5]/RC[-1],0) -> 0 | H7: =RC[-3]+RC[4] -> 79129 | I7: 18538 | J7: =RC[-1]/RC[-2] -> 0.23427567642710004 | L7: 0 | M7: 1912 | N7: 行銷處23442588周美玉
D8: 中分 | E8: 23590 | F8: 340 | G8: =IF(RC[-1]>0,RC[5]/RC[-1],0) -> 0.75294117647058822 | H8: =RC[-3]+RC[4] -> 23846 | I8: 3857 | J8: =RC[-1]/RC[-2] -> 0.16174620481422461 | L8: 256 | M8: 1024
D9: 南分 | E9: 41150 | F9: 1486 | G9: =IF(RC[-1]>0,RC[5]/RC[-1],0) -> 0.37685060565275907 | H9: =RC[-3]+RC[4] -> 41710 | I9: 5484 | J9: =RC[-1]/RC[-2] -> 0.13147926156796932 | L9: 560 | M9: 1592
A10: 3 | B10: ISDN T1-PRA | C10: 埠 | D10: 北分 | E10: 8177 | F10: 0 | G10: =IF(RC[-1]>0,RC[5]/RC[-1],0) -> 0 | H10: =RC[-3]+RC[4] -> 8177 | I10: 4603 | J10: =RC[-1]/RC[-2] -> 0.56292038644979825 | L10: 0 | M10: 2534
D11: 中分 | E11: 4486 | F11: 310 | G11: =IF(RC[-1]>0,RC[5]/RC[-1],0) -> 0.32258064516129031 | H11: =RC[-3]+RC[4] -> 4586 | I11: 1686 | J11: =RC[-1]/RC[-2] -> 0.36764064544265157 | L11: 100 | M11: 260
D12: 南分 | E12: 5614 | F12: 0 | G12: =IF(RC[-1]>0,RC[5]/RC[-1],0) -> 0 | H12: =RC[-3]+RC[4] -> 5614 | I12: 1687 | J12: =RC[-1]/RC[-2] -> 0.30049875311720697 | L12: 0 | M12: 3262
A13: 4 | B13: ISDN E1-PRA | C13: 埠 | D13: 北分 | E13: 3445 | F13: 2670 | G13: =IF(RC[-1]>0,RC[5]/RC[-1],0) -> 1.8726591760299626E-2 | H13: =RC[-3]+RC[4] -> 3495 | I13: 661 | J13: =RC[-1]/RC[-2] -> 0.18912732474964233 | L13: 50 | M13: 2910
D14: 中分 | E14: 1260 | F14: 0 | G14: =IF(RC[-1]>0,RC[5]/RC[-1],0) -> 0 | H14: =RC[-3]+RC[4] -> 1260 | I14: 67 | J14: =RC[-1]/RC[-2] -> 5.3174603174603173E-2 | L14: 0 | M14: 650
D15: 南分 | E15: 4605 | F15: 980 | G15: =IF(RC[-1]>0,RC[5]/RC[-1],0) -> 0.45918367346938777 | H15: =RC[-3]+RC[4] -> 5055 | I15: 249 | J15: =RC[-1]/RC[-2] -> 4.9258160237388722E-2 | L15: 450 | M15: 4000
A16: 5 | B16: 長話交換機門號數 | C16: 門 | D16: 長通 | E16: 2088000 | F16: 60000 | G16: 0 | H16: 2289480 | I16: 1325951 | J16: =RC[-1]/RC[-2] -> 0.5791494138406974 | K16: 固網(資料取得截止日期91/05/31)
A17: 6 | B17: 國際交換機門號數 | C17: 門 | D17: 國際 | E17: 74840 | F17: - | G17: - | H17: 74840 | I17: 55969 | J17: =RC[-1]/RC[-2] -> 0.7478487439871726 | K17: 國際(資料取得截止日期91/05/31)
B18: 國際IN交換機門號數 | C18: 門 | D18: 國際 | E18: 30000 | F18: - | G18: - | H18: 30000 | I18: 6997 | J18: =RC[-1]/RC[-2] -> 0.23323333333333332 | M18: 1968000 | N18: 擴充153480,102000,6000,POI四期60000尚未完工
A19: 7 | B19: 區域ATM寬頻接取網路 | C19: 套 | D19: 北分 | E19: 657555 | F19: - | G19: - | H19: 722653 | I19: 625784 | J19: =RC[-1]/RC[-2] -> 0.86595364580234224 | K19: 寬頻(PAMS資料取得截止日期91/06/17) | M19: 653985
D20: 中分 | E20: 327445 | F20: - | G20: - | H20: 380611 | I20: 256702 | J20: =RC[-1]/RC[-2] -> 0.67444713894238473 | M20: 322856
D21: 南分 | E21: 324702 | F21: - | G21: - | H21: 372742 | I21: 291371 | J21: =RC[-1]/RC[-2] -> 0.78169618663847917 | M21: 318770
A22: 8 | B22: 長途ATM寬頻網路 | C22: 套 | D22: 長通 | E22: -- | F22: - | G22: 1 | H22: 11 | I22: - | J22: - | K22: 驗收完成，北區分公司辦理遷裝議價中。 | M22: 11
A23: 9 | B23: 長途同步數位階層SDH網路 | C23: 部 | D23: 長通 | E23: 480 | F23: 14 | G23: =IF(RC[-1]>0,RC[5]/RC[-1],0) -> 0 | H23: 570 | I23: 270 | J23: =RC[-1]/RC[-2] -> 0.47368421052631576 | K23: 傳輸骨幹網路(資料取得截止日期91/06/17) | M23: 0
A24: 10 | B24: 區域同步數位階層SDH網路 | C24: 部 | D24: 全區 | E24: 875 | F24: 404 | G24: =IF(RC[-1]>0,RC[5]/RC[-1],0) -> 0.54455445544554459 | H24: =RC[-3]+RC[5] -> 875 | I24: 605 | J24: =RC[-1]/RC[-2] -> 0.69142857142857139 | L24: 220 | M24: 0
A25: 11 | B25: 寬頻上網ADSL設備 | C25: 路 | D25: 北分 | E25: 582263 | F25: 450000 | G25: 0.64849999999999997 | H25: 788148 | I25: 689043 | J25: 0.87429999999999997 | K25: 網際網路(資料取得截止日期91/06/17) | M25: 915010 | N25: 須考慮可用數
D26: 中分 | E26: 350232 | F26: 250000 | G26: 0.39079999999999998 | H26: 518681 | I26: 264998 | J26: 0.51090000000000002
D27: 南分 | E27: 311120 | F27: 200000 | G27: 0.29949999999999999 | H27: 400488 | I27: 292386 | J27: 0.73009999999999997
A28: 12 | B28: HiNet寬頻接取埠 | C28: 埠 | D28: 全區 | E28: 1000000 | F28: 900000 | G28: 1 | H28: 1900000 | I28: 977720 | J28: =RC[-1]/RC[-2] -> 0.51458947368421049 | M28: 800000 | N28: 23444600康崇原科長;23442307徐明山股長
A29: 13 | B29: 行動電話交換機 | C29: 門 | D29: 長通 | E29: 6500000 | F29: 700000 | G29: =IF(RC[-1]>0,(RC[1]-RC[-2])/RC[-1],0) -> 1.4285714285714286 | H29: 7500000 | I29: 6902561 | J29: =RC[-1]/RC[-2] -> 0.92034146666666672 | K29: 行動(資料取得截止日期91/06/17) | M29: 1597411
A30: 14 | B30: 行動電話基地臺 | C30: 座 | D30: 長通 | E30: 5165 | F30: 1430 | G30: =IF(RC[-1]>0,(RC[1]-RC[-2])/RC[-1],0) -> 0.57692307692307687 | H30: 5990 | I30: 5981 | J30: =RC[-1]/RC[-2] -> 0.99849749582637726 | M30: 1876
A31: 15 | B31: 局間中繼光纜 | C31: 心公里 | D31: 北分 | E31: 235320 | F31: 21000 | G31: 0.52159999999999995 | H31: 244610 | I31: 110634 | J31: =RC[-1]/RC[-2] -> 0.45228731450063364 | K31: 光纜(資料取得截止日期91/05/28) | L31: 7698
D32: 中分 | E32: 215317 | F32: 22600 | G32: 0.46250000000000002 | H32: 231558 | I32: 88777 | J32: =RC[-1]/RC[-2] -> 0.38338990663246358 | L32: 4416
D33: 南分 | E33: 198616 | F33: 17600 | G33: 0.44219999999999998 | H33: 205660 | I33: 80724 | J33: =RC[-1]/RC[-2] -> 0.39251191286589515 | L33: 4683
A34: 16 | B34: 用戶迴路光纜 | C34: 心公里 | D34: 北分 | E34: 223779 | F34: 18000 | G34: 0.59319999999999995 | H34: 233534 | I34: 41577 | J34: =RC[-1]/RC[-2] -> 0.17803403358825695 | L34: 5176
D35: 中分 | E35: 195607 | F35: 37100 | G35: 0.35470000000000002 | H35: 205498 | I35: 31134 | J35: =RC[-1]/RC[-2] -> 0.1515051241374612 | L35: 5623
D36: 南分 | E36: 134048 | F36: 28500 | G36: 0.24590000000000001 | H36: 142093 | I36: 26114 | J36: =RC[-1]/RC[-2] -> 0.18378104480868163 | L36: 1500
A37: 17 | B37: 市話線路 | C37: 對 | D37: 北分 | E37: 13652200 | F37: 55200 | G37: 0.78259999999999996 | H37: 13703600 | I37: 7304084 | J37: =RC[-1]/RC[-2] -> 0.53300475787384338 | K37: 線路(資料取得截止日期91/05/28) | L37: 22400
D38: 中分 | E38: 6472300 | F38: 59200 | G38: 0.60809999999999997 | H38: 6508300 | I38: 2968436 | J38: =RC[-1]/RC[-2] -> 0.45610005685048322 | L38: 10500
D39: 南分 | E39: 7902900 | F39: 75000 | G39: 0.38269999999999998 | H39: 7931600 | I39: 3632753 | J39: =RC[-1]/RC[-2] -> 0.45801011145292247 | L39: 13100
A40: 18 | B40: 國內海纜 | C40: Mbps | D40: 長通 | E40: 5825 | F40: - | G40: - | H40: 10665 | I40: 3570 | J40: =RC[-1]/RC[-2] -> 0.33473980309423346 | K40: 海纜(資料取得截止日期91/04/30)
A41: 19 | B41: 國際海纜 | C41: Mbps | D41: 國際 | E41: 28864 | F41: - | G41: - | H41: 28864 | I41: 9888 | J41: =RC[-1]/RC[-2] -> 0.34257206208425722

Sheet: 910701
A1: 中華電信網路容量及使用現況雙週報表
K2: 填表日期：91 年 07 月01日
B3: 項 目 | C3: 單位 | D3: 分公司 | E3: 至90年12月累計數 | F3: 91年預定建設數 | G3: 建設執行現況(%) | H3: 91年當月累計設備總量 | I3: 當週累計 使用總量 | J3: 使用率% | K3: 備註 | L3: 91實際累計建設量 | M3: 累計淨增
A4: 1 | B4: 市話交換機門號數(POTS) | C4: 門 | D4: 北分 | E4: 8253465 | F4: 1137000 | G4: =IF(RC[-1]>0,RC[5]/RC[-1],0) -> 0.21838170624450307 | H4: 8312765 | I4: 6714234 | J4: =RC[-1]/RC[-2] -> 0.80770164921058152 | K4: 固網(設備總量資料取得截止日期91/07/04，使用總量資料取得截止日期91/06/30) | L4: 248300 | M4: 91300 | N4: 行銷處23445420吳碧芬
D5: 中分 | E5: 4082500 | F5: 79000 | G5: =IF(RC[-1]>0,RC[5]/RC[-1],0) -> 0.46835443037974683 | H5: 4093500 | I5: 2876840 | J5: =RC[-1]/RC[-2] -> 0.70278245999755706 | L5: 37000 | M5: 15000
D6: 南分 | E6: 4823946 | F6: 512300 | G6: =IF(RC[-1]>0,RC[5]/RC[-1],0) -> 0.78118290064415385 | H6: 4979930 | I6: 3321086 | J6: =RC[-1]/RC[-2] -> 0.66689411296945944 | L6: 400200 | M6: 173300
A7: 2 | B7: ISDN BRA | C7: 埠 | D7: 北分 | E7: 79129 | F7: 832 | G7: =IF(RC[-1]>0,RC[5]/RC[-1],0) -> 0.15384615384615385 | H7: =RC[-3]+RC[4] -> 79257 | I7: 18428 | J7: =RC[-1]/RC[-2] -> 0.23250943134360372 | L7: 128 | M7: 1912 | N7: 行銷處23442588周美玉
D8: 中分 | E8: 23590 | F8: 340 | G8: =IF(RC[-1]>0,RC[5]/RC[-1],0) -> 0.87058823529411766 | H8: 23630 | I8: 3845 | J8: =RC[-1]/RC[-2] -> 0.1627168853152772 | L8: 296 | M8: 1024
D9: 南分 | E9: 41150 | F9: 1486 | G9: =IF(RC[-1]>0,RC[5]/RC[-1],0) -> 0.95827725437415878 | H9: =RC[-3]+RC[4] -> 42574 | I9: 5508 | J9: =RC[-1]/RC[-2] -> 0.12937473575421618 | L9: 1424 | M9: 1592
A10: 3 | B10: ISDN T1-PRA | C10: 埠 | D10: 北分 | E10: 8177 | F10: 0 | G10: =IF(RC[-1]>0,RC[5]/RC[-1],0) -> 0 | H10: =RC[-3]+RC[4] -> 8177 | I10: 4560 | J10: =RC[-1]/RC[-2] -> 0.55766173413232234 | L10: 0 | M10: 2534
D11: 中分 | E11: 4486 | F11: 310 | G11: =IF(RC[-1]>0,RC[5]/RC[-1],0) -> 0.5161290322580645 | H11: 4621 | I11: 1654 | J11: =RC[-1]/RC[-2] -> 0.35793118372646615 | L11: 160 | M11: 260
D12: 南分 | E12: 5614 | F12: 0 | G12: =IF(RC[-1]>0,RC[5]/RC[-1],0) -> 0 | H12: =RC[-3]+RC[4] -> 5629 | I12: 1687 | J12: =RC[-1]/RC[-2] -> 0.29969799253863921 | L12: 15 | M12: 3262
A13: 4 | B13: ISDN E1-PRA | C13: 埠 | D13: 北分 | E13: 3445 | F13: 2670 | G13: =IF(RC[-1]>0,RC[5]/RC[-1],0) -> 0.10486891385767791 | H13: =RC[-3]+RC[4] -> 3725 | I13: 700 | J13: =RC[-1]/RC[-2] -> 0.18791946308724833 | L13: 280 | M13: 2910
D14: 中分 | E14: 1260 | F14: 0 | G14: =IF(RC[-1]>0,RC[5]/RC[-1],0) -> 0 | H14: =RC[-3]+RC[4] -> 1260 | I14: 74 | J14: =RC[-1]/RC[-2] -> 5.873015873015873E-2 | L14: 0 | M14: 650
D15: 南分 | E15: 4605 | F15: 980 | G15: =IF(RC[-1]>0,RC[5]/RC[-1],0) -> 0.57040816326530608 | H15: 4810 | I15: 249 | J15: =RC[-1]/RC[-2] -> 5.176715176715177E-2 | L15: 559 | M15: 4000
A16: 5 | B16: 長話交換機門號數 | C16: 門 | D16: 長通 | E16: 2088000 | F16: 60000 | G16: 0 | H16: 2289480 | I16: 1333260 | J16: =RC[-1]/RC[-2] -> 0.58234184181560877 | K16: 固網(資料取得截止日期91/06/30)
A17: 6 | B17: 國際交換機門號數 | C17: 門 | D17: 國際 | E17: 74840 | F17: - | G17: - | H17: 74840 | I17: 56812 | J17: =RC[-1]/RC[-2] -> 0.75911277391769105 | K17: 國際(資料取得截止日期91/06/30)
B18: 國際IN交換機門號數 | C18: 門 | D18: 國際 | E18: 30000 | F18: - | G18: - | H18: 30000 | I18: 6997 | J18: =RC[-1]/RC[-2] -> 0.23323333333333332 | M18: 1968000 | N18: 擴充153480,102000,6000,POI四期60000尚未完工
A19: 7 | B19: 區域ATM寬頻接取網路 | C19: 套 | D19: 北分 | E19: 657555 | F19: - | G19: - | H19: 726314 | I19: 640434 | J19: =RC[-1]/RC[-2] -> 0.881759128971767 | K19: 寬頻(PAMS資料取得截止日期91/07/01) | M19: 653985
D20: 中分 | E20: 327445 | F20: - | G20: - | H20: 382094 | I20: 265324 | J20: =RC[-1]/RC[-2] -> 0.69439457306317298 | M20: 322856
D21: 南分 | E21: 324702 | F21: - | G21: - | H21: 383413 | I21: 299038 | J21: =RC[-1]/RC[-2] -> 0.77993703917185908 | M21: 318770
A22: 8 | B22: 長途ATM寬頻網路 | C22: 套 | D22: 長通 | E22: -- | F22: - | G22: 1 | H22: 11 | I22: - | J22: - | K22: 全部完工，北區分公司辦理遷裝議價中。 | M22: 11
A23: 9 | B23: 長途10G DWDM SDH網路 | C23: 部 | D23: 長通 | E23: -- | F23: 14 | G23: 0 | H23: -- | I23: -- | J23: 0 | K23: 高速 SDH
A24: 10 | B24: 長途同步數位階層SDH網路 | C24: 部 | D24: 長通 | E24: 480 | F24: 0 | G24: =IF(RC[-1]>0,RC[5]/RC[-1],0) -> 0 | H24: 570 | I24: 274 | J24: =RC[-1]/RC[-2] -> 0.48070175438596491 | K24: 傳輸骨幹網路(資料取得截止日期91/07/01) | M24: 0
A25: 11 | B25: 區域同步數位階層SDH網路 | C25: 部 | D25: 全區 | E25: 875 | F25: 404 | G25: =IF(RC[-1]>0,RC[5]/RC[-1],0) -> 0.54455445544554459 | H25: =RC[-3]+RC[5] -> 875 | I25: 608 | J25: =RC[-1]/RC[-2] -> 0.69485714285714284 | L25: 220 | M25: 0
A26: 12 | B26: 寬頻上網ADSL設備 | C26: 路 | D26: 北分 | E26: 582263 | F26: 450000 | G26: 0.64419999999999999 | H26: 799874 | I26: 704900 | J26: 0.88129999999999997 | K26: 網際網路(資料取得截止日期91/07/01) | M26: 915010 | N26: 須考慮可用數
D27: 中分 | E27: 350232 | F27: 250000 | G27: 0.64170000000000005 | H27: 524664 | I27: 273307 | J27: 0.52090000000000003
D28: 南分 | E28: 311120 | F28: 200000 | G28: 0.3251 | H28: 412642 | I28: 300009 | J28: 0.72699999999999998
A29: 13 | B29: HiNet寬頻接取埠 | C29: 埠 | D29: 全區 | E29: 1000000 | F29: 900000 | G29: 1 | H29: 1900000 | I29: 1005116 | J29: =RC[-1]/RC[-2] -> 0.52900842105263157 | M29: 800000 | N29: 23444600康崇原科長;23442307徐明山股長
A30: 14 | B30: 行動電話交換機 | C30: 門 | D30: 長通 | E30: 6500000 | F30: 700000 | G30: =IF(RC[-1]>0,(RC[1]-RC[-2])/RC[-1],0) -> 1.4285714285714286 | H30: 7500000 | I30: 6902561 | J30: =RC[-1]/RC[-2] -> 0.92034146666666672 | K30: 行動(資料取得截止日期91/06/30) | M30: 1597411
A31: 15 | B31: 行動電話基地臺 | C31: 座 | D31: 長通 | E31: 5165 | F31: 1430 | G31: =IF(RC[-1]>0,(RC[1]-RC[-2])/RC[-1],0) -> 0.63916083916083921 | H31: 6079 | I31: 6070 | J31: =RC[-1]/RC[-2] -> 0.99851949333772005 | M31: 1876
A32: 16 | B32: 局間中繼光纜 | C32: 心公里 | D32: 北分 | E32: 235320 | F32: 21000 | G32: 0.60619999999999996 | H32: 244326 | I32: 110629 | J32: =RC[-1]/RC[-2] -> 0.45279258040486892 | K32: 光纜(資料取得截止日期91/06/28) | L32: 7698
D33: 中分 | E33: 215317 | F33: 22600 | G33: 0.60089999999999999 | H33: 234656 | I33: 88555 | J33: =RC[-1]/RC[-2] -> 0.37738221055502524 | L33: 4416
D34: 南分 | E34: 198616 | F34: 17600 | G34: 0.45050000000000001 | H34: 209555 | I34: 78669 | J34: =RC[-1]/RC[-2] -> 0.37540979695068122 | L34: 4683
A35: 17 | B35: 用戶迴路光纜 | C35: 心公里 | D35: 北分 | E35: 223779 | F35: 18000 | G35: 0.79600000000000004 | H35: 234676 | I35: 42119 | J35: =RC[-1]/RC[-2] -> 0.17947723670081303 | L35: 5176
D36: 中分 | E36: 195607 | F36: 37100 | G36: 0.50229999999999997 | H36: 211446 | I36: 31305 | J36: =RC[-1]/RC[-2] -> 0.14805198490394711 | L36: 5623
D37: 南分 | E37: 134048 | F37: 28500 | G37: 0.36559999999999998 | H37: 144468 | I37: 26546 | J37: =RC[-1]/RC[-2] -> 0.18375003460974057 | L37: 1500
A38: 18 | B38: 市話線路 | C38: 對 | D38: 北分 | E38: 13652200 | F38: 55200 | G38: 0.78259999999999996 | H38: 13705200 | I38: 7309686 | J38: =RC[-1]/RC[-2] -> 0.53335128272480514 | K38: 線路(資料取得截止日期91/06/28) | L38: 22400
D39: 中分 | E39: 6472300 | F39: 59200 | G39: 0.65200000000000002 | H39: 6510900 | I39: 2968970 | J39: =RC[-1]/RC[-2] -> 0.45599993856456095 | L39: 10500
D40: 南分 | E40: 7902900 | F40: 75000 | G40: 0.45329999999999998 | H40: 7931600 | I40: 3632753 | J40: =RC[-1]/RC[-2] -> 0.45801011145292247 | L40: 13100
A41: 19 | B41: 國內海纜 | C41: Mbps | D41: 長通 | E41: 10665 | F41: - | G41: - | H41: 10665 | I41: 3600 | J41: =RC[-1]/RC[-2] -> 0.33755274261603374 | K41: 國內海纜(資料取得截止日期91/06/30)
A42: 20 | B42: 國際海纜 | C42: Mbps | D42: 國際 | E42: 28864 | F42: - | G42: - | H42: 28864 | I42: 10506 | J42: =RC[-1]/RC[-2] -> 0.36398281596452325 | K42: 國際海纜(資料取得截止日期91/06/30)

Sheet: 910715
A1: 中華電信網路容量及使用現況雙週報表
K2: 填表日期：91 年 07 月15日
B3: 項 目 | C3: 單位 | D3: 分公司 | E3: 至90年12月累計數 | F3: 91年預定建設數 | G3: 建設執行現況(%) | H3: 91年當月累計設備總量 | I3: 當週累計 使用總量 | J3: 使用率% | K3: 備註 | L3: 91實際累計建設量 | M3: 累計淨增
A4: 1 | B4: 市話交換機門號數(POTS) | C4: 門 | D4: 北分 | E4: 8253465 | F4: 1137000 | G4: =IF(RC[-1]>0,RC[5]/RC[-1],0) -> 0.21838170624450307 | H4: 8312765 | I4: 6714234 | J4: =RC[-1]/RC[-2] -> 0.80770164921058152 | K4: 固網(設備總量資料取得截止日期91/07/04，使用總量資料取得截止日期91/06/30) | L4: 248300 | M4: 91300 | N4: 行銷處23445420吳碧芬
D5: 中分 | E5: 4082500 | F5: 79000 | G5: =IF(RC[-1]>0,RC[5]/RC[-1],0) -> 0.46835443037974683 | H5: 4093500 | I5: 2876840 | J5: =RC[-1]/RC[-2] -> 0.70278245999755706 | L5: 37000 | M5: 15000
D6: 南分 | E6: 4823946 | F6: 512300 | G6: =IF(RC[-1]>0,RC[5]/RC[-1],0) -> 0.78118290064415385 | H6: 4979930 | I6: 3321086 | J6: =RC[-1]/RC[-2] -> 0.66689411296945944 | L6: 400200 | M6: 173300
A7: 2 | B7: ISDN BRA | C7: 埠 | D7: 北分 | E7: 79129 | F7: 832 | G7: =IF(RC[-1]>0,RC[5]/RC[-1],0) -> 0.15384615384615385 | H7: =RC[-3]+RC[4] -> 79257 | I7: 18428 | J7: =RC[-1]/RC[-2] -> 0.23250943134360372 | L7: 128 | M7: 1912 | N7: 行銷處23442588周美玉
D8: 中分 | E8: 23590 | F8: 340 | G8: =IF(RC[-1]>0,RC[5]/RC[-1],0) -> 0.87058823529411766 | H8: 23630 | I8: 3845 | J8: =RC[-1]/RC[-2] -> 0.1627168853152772 | L8: 296 | M8: 1024
D9: 南分 | E9: 41150 | F9: 1486 | G9: =IF(RC[-1]>0,RC[5]/RC[-1],0) -> 0.95827725437415878 | H9: =RC[-3]+RC[4] -> 42574 | I9: 5508 | J9: =RC[-1]/RC[-2] -> 0.12937473575421618 | L9: 1424 | M9: 1592
A10: 3 | B10: ISDN T1-PRA | C10: 埠 | D10: 北分 | E10: 8177 | F10: 0 | G10: =IF(RC[-1]>0,RC[5]/RC[-1],0) -> 0 | H10: =RC[-3]+RC[4] -> 8177 | I10: 4560 | J10: =RC[-1]/RC[-2] -> 0.55766173413232234 | L10: 0 | M10: 2534
D11: 中分 | E11: 4486 | F11: 310 | G11: =IF(RC[-1]>0,RC[5]/RC[-1],0) -> 0.5161290322580645 | H11: 4621 | I11: 1654 | J11: =RC[-1]/RC[-2] -> 0.35793118372646615 | L11: 160 | M11: 260
D12: 南分 | E12: 5614 | F12: 0 | G12: =IF(RC[-1]>0,RC[5]/RC[-1],0) -> 0 | H12: =RC[-3]+RC[4] -> 5629 | I12: 1687 | J12: =RC[-1]/RC[-2] -> 0.29969799253863921 | L12: 15 | M12: 3262
A13: 4 | B13: ISDN E1-PRA | C13: 埠 | D13: 北分 | E13: 3445 | F13: 2670 | G13: =IF(RC[-1]>0,RC[5]/RC[-1],0) -> 0.10486891385767791 | H13: =RC[-3]+RC[4] -> 3725 | I13: 700 | J13: =RC[-1]/RC[-2] -> 0.18791946308724833 | L13: 280 | M13: 2910
D14: 中分 | E14: 1260 | F14: 0 | G14: =IF(RC[-1]>0,RC[5]/RC[-1],0) -> 0 | H14: =RC[-3]+RC[4] -> 1260 | I14: 74 | J14: =RC[-1]/RC[-2] -> 5.873015873015873E-2 | L14: 0 | M14: 650
D15: 南分 | E15: 4605 | F15: 980 | G15: =IF(RC[-1]>0,RC[5]/RC[-1],0) -> 0.57040816326530608 | H15: 4810 | I15: 249 | J15: =RC[-1]/RC[-2] -> 5.176715176715177E-2 | L15: 559 | M15: 4000
A16: 5 | B16: 長話交換機門號數 | C16: 門 | D16: 長通 | E16: 2088000 | F16: 60000 | G16: 0 | H16: 2289480 | I16: 1333260 | J16: =RC[-1]/RC[-2] -> 0.58234184181560877 | K16: 固網(資料取得截止日期91/06/30)
A17: 6 | B17: 國際交換機門號數 | C17: 門 | D17: 國際 | E17: 74840 | F17: - | G17: - | H17: 74840 | I17: 56812 | J17: =RC[-1]/RC[-2] -> 0.75911277391769105 | K17: 國際(資料取得截止日期91/06/30)
B18: 國際IN交換機門號數 | C18: 門 | D18: 國際 | E18: 30000 | F18: - | G18: - | H18: 30000 | I18: 6997 | J18: =RC[-1]/RC[-2] -> 0.23323333333333332 | M18: 1968000 | N18: 擴充153480,102000,6000,POI四期60000尚未完工
A19: 7 | B19: 區域ATM寬頻接取網路 | C19: PVC數 | D19: 北分 | E19: 657555 | F19: - | G19: - | H19: 725528 | I19: 656068 | J19: =RC[-1]/RC[-2] -> 0.90426282652082346 | K19: 寬頻(PAMS資料取得截止日期91/07/15) | M19: 653985
D20: 中分 | E20: 327445 | F20: - | G20: - | H20: 381202 | I20: 276954 | J20: =RC[-1]/RC[-2] -> 0.72652819240192867 | M20: 322856
D21: 南分 | E21: 324702 | F21: - | G21: - | H21: 388023 | I21: 309845 | J21: =RC[-1]/RC[-2] -> 0.79852225254688514 | M21: 318770
A22: 8 | B22: 長途ATM寬頻網路 | C22: 套 | D22: 長通 | E22: -- | F22: - | G22: 1 | H22: 11 | I22: - | J22: - | K22: 全部完工，北區分公司辦理遷裝議價中。 | M22: 11
A23: 9 | B23: 長途10G DWDM SDH網路 | C23: 部 | D23: 長通 | E23: -- | F23: 14 | G23: 0 | H23: -- | I23: -- | J23: 0 | K23: 高速 SDH
A24: 10 | B24: 長途同步數位階層SDH網路 | C24: 部 | D24: 長通 | E24: 480 | F24: 0 | G24: =IF(RC[-1]>0,RC[5]/RC[-1],0) -> 0 | H24: 570 | I24: 277 | J24: =RC[-1]/RC[-2] -> 0.48596491228070177 | K24: 傳輸骨幹網路(資料取得截止日期91/07/15) | M24: 0
A25: 11 | B25: 區域同步數位階層SDH網路 | C25: 部 | D25: 全區 | E25: 875 | F25: 404 | G25: =IF(RC[-1]>0,RC[5]/RC[-1],0) -> 0.54455445544554459 | H25: =RC[-3]+RC[5] -> 875 | I25: 610 | J25: =RC[-1]/RC[-2] -> 0.69714285714285718 | L25: 220 | M25: 0
A26: 12 | B26: 寬頻上網ADSL設備 | C26: 路 | D26: 北分 | E26: 582263 | F26: 450000 | G26: 0.68020000000000003 | H26: 845254 | I26: 730222 | J26: =RC[-1]/RC[-2] -> 0.86390836363980528 | K26: 網際網路(資料取得截止日期91/07/15) | M26: 915010 | N26: 須考慮可用數
D27: 中分 | E27: 350232 | F27: 250000 | G27: 0.64170000000000005 | H27: 535936 | I27: 286156 | J27: =RC[-1]/RC[-2] -> 0.53393688798662531
D28: 南分 | E28: 311120 | F28: 200000 | G28: 0.3251 | H28: 427361 | I28: 311835 | J28: =RC[-1]/RC[-2] -> 0.72967584781952499
A29: 13 | B29: HiNet寬頻接取埠 | C29: 埠 | D29: 全區 | E29: 1000000 | F29: 900000 | G29: 1 | H29: 1900000 | I29: 1038348 | J29: =RC[-1]/RC[-2] -> 0.54649894736842108 | M29: 800000 | N29: 23444600康崇原科長;23442307徐明山股長
A30: 14 | B30: 行動電話交換機 | C30: 門 | D30: 長通 | E30: 6500000 | F30: 700000 | G30: =IF(RC[-1]>0,(RC[1]-RC[-2])/RC[-1],0) -> 1.4285714285714286 | H30: 7500000 | I30: 6983932 | J30: =RC[-1]/RC[-2] -> 0.93119093333333336 | K30: 行動(資料取得截止日期91/07/15) | M30: 1597411
A31: 15 | B31: 行動電話基地臺 | C31: 座 | D31: 長通 | E31: 5165 | F31: 1430 | G31: =IF(RC[-1]>0,(RC[1]-RC[-2])/RC[-1],0) -> 0.69020979020979023 | H31: 6152 | I31: 6144 | J31: =RC[-1]/RC[-2] -> 0.99869960988296491 | M31: 1876
A32: 16 | B32: 局間中繼光纜 | C32: 心公里 | D32: 北分 | E32: 235320 | F32: 21000 | G32: 0.60619999999999996 | H32: 248124 | I32: 110779 | J32: =RC[-1]/RC[-2] -> 0.44646628298753849 | K32: 光纜(資料取得截止日期91/07/15) | L32: 7698
D33: 中分 | E33: 215317 | F33: 22600 | G33: 0.60089999999999999 | H33: 238312 | I33: 90800 | J33: =RC[-1]/RC[-2] -> 0.38101312565040785 | L33: 4416
D34: 南分 | E34: 198616 | F34: 17600 | G34: 0.45050000000000001 | H34: 211274 | I34: 80066 | J34: =RC[-1]/RC[-2] -> 0.37896759658074347 | L34: 4683
A35: 17 | B35: 用戶迴路光纜 | C35: 心公里 | D35: 北分 | E35: 223779 | F35: 18000 | G35: 0.79600000000000004 | H35: 237053 | I35: 42633 | J35: =RC[-1]/RC[-2] -> 0.17984585725555044 | L35: 5176
D36: 中分 | E36: 195607 | F36: 37100 | G36: 0.50229999999999997 | H36: 231498 | I36: 33224 | J36: =RC[-1]/RC[-2] -> 0.14351743859558183 | L36: 5623
D37: 南分 | E37: 134048 | F37: 28500 | G37: 0.36559999999999998 | H37: 145488 | I37: 26809 | J37: =RC[-1]/RC[-2] -> 0.18426949301660617 | L37: 1500
A38: 18 | B38: 市話線路 | C38: 對 | D38: 北分 | E38: 13652200 | F38: 55200 | G38: 0.78259999999999996 | H38: 11746200 | I38: 7315673 | J38: =RC[-1]/RC[-2] -> 0.62281188809998123 | K38: 線路(資料取得截止日期91/07/15) | L38: 22400
D39: 中分 | E39: 6472300 | F39: 59200 | G39: 0.65200000000000002 | H39: 5183700 | I39: 2954709 | J39: =RC[-1]/RC[-2] -> 0.56999999999999995 | L39: 10500
D40: 南分 | E40: 7902900 | F40: 75000 | G40: 0.45329999999999998 | H40: 6315100 | I40: 3645051 | J40: =RC[-1]/RC[-2] -> 0.57719608557267499 | L40: 13100
A41: 19 | B41: 國內海纜 | C41: Mbps | D41: 長通 | E41: 10665 | F41: - | G41: - | H41: 10665 | I41: 3600 | J41: =RC[-1]/RC[-2] -> 0.33755274261603374 | K41: 國內海纜(資料取得截止日期91/06/30)
A42: 20 | B42: 國際海纜 | C42: Mbps | D42: 國際 | E42: 28864 | F42: - | G42: - | H42: 28864 | I42: 10506 | J42: =RC[-1]/RC[-2] -> 0.36398281596452325 | K42: 國際海纜(資料取得截止日期91/06/30)

Sheet: 910729
A1: 中華電信網路容量及使用現況雙週報表
K2: 填表日期：91 年 07 月29日
B3: 項 目 | C3: 單位 | D3: 分公司 | E3: 至90年12月累計數 | F3: 91年預定建設數 | G3: 建設執行現況(%) | H3: 91年當月累計設備總量 | I3: 當週累計 使用總量 | J3: 使用率% | K3: 備註 | L3: 91實際累計建設量 | M3: 累計淨增
A4: 1 | B4: 市話交換機門號數(POTS) | C4: 門 | D4: 北分 | E4: 8253465 | F4: 1137000 | G4: =IF(RC[-1]>0,RC[5]/RC[-1],0) -> 0.21838170624450307 | H4: 8312765 | I4: 6714234 | J4: =RC[-1]/RC[-2] -> 0.80770164921058152 | K4: 固網(設備總量資料取得截止日期91/07/04，使用總量資料取得截止日期91/06/30) | L4: 248300 | M4: 91300 | N4: 行銷處23445420吳碧芬
D5: 中分 | E5: 4082500 | F5: 79000 | G5: =IF(RC[-1]>0,RC[5]/RC[-1],0) -> 0.46835443037974683 | H5: 4093500 | I5: 2876840 | J5: =RC[-1]/RC[-2] -> 0.70278245999755706 | L5: 37000 | M5: 15000
D6: 南分 | E6: 4823946 | F6: 512300 | G6: =IF(RC[-1]>0,RC[5]/RC[-1],0) -> 0.78118290064415385 | H6: 4979930 | I6: 3321086 | J6: =RC[-1]/RC[-2] -> 0.66689411296945944 | L6: 400200 | M6: 173300
A7: 2 | B7: ISDN BRA | C7: 埠 | D7: 北分 | E7: 79129 | F7: 832 | G7: =IF(RC[-1]>0,RC[5]/RC[-1],0) -> 0.15384615384615385 | H7: =RC[-3]+RC[4] -> 79257 | I7: 18428 | J7: =RC[-1]/RC[-2] -> 0.23250943134360372 | L7: 128 | M7: 1912 | N7: 行銷處23442588周美玉
D8: 中分 | E8: 23590 | F8: 340 | G8: =IF(RC[-1]>0,RC[5]/RC[-1],0) -> 0.87058823529411766 | H8: 23630 | I8: 3845 | J8: =RC[-1]/RC[-2] -> 0.1627168853152772 | L8: 296 | M8: 1024
D9: 南分 | E9: 41150 | F9: 1486 | G9: =IF(RC[-1]>0,RC[5]/RC[-1],0) -> 0.95827725437415878 | H9: =RC[-3]+RC[4] -> 42574 | I9: 5508 | J9: =RC[-1]/RC[-2] -> 0.12937473575421618 | L9: 1424 | M9: 1592
A10: 3 | B10: ISDN T1-PRA | C10: 埠 | D10: 北分 | E10: 8177 | F10: 0 | G10: =IF(RC[-1]>0,RC[5]/RC[-1],0) -> 0 | H10: =RC[-3]+RC[4] -> 8177 | I10: 4560 | J10: =RC[-1]/RC[-2] -> 0.55766173413232234 | L10: 0 | M10: 2534
D11: 中分 | E11: 4486 | F11: 310 | G11: =IF(RC[-1]>0,RC[5]/RC[-1],0) -> 0.5161290322580645 | H11: 4621 | I11: 1654 | J11: =RC[-1]/RC[-2] -> 0.35793118372646615 | L11: 160 | M11: 260
D12: 南分 | E12: 5614 | F12: 0 | G12: =IF(RC[-1]>0,RC[5]/RC[-1],0) -> 0 | H12: =RC[-3]+RC[4] -> 5629 | I12: 1687 | J12: =RC[-1]/RC[-2] -> 0.29969799253863921 | L12: 15 | M12: 3262
A13: 4 | B13: ISDN E1-PRA | C13: 埠 | D13: 北分 | E13: 3445 | F13: 2670 | G13: =IF(RC[-1]>0,RC[5]/RC[-1],0) -> 0.10486891385767791 | H13: =RC[-3]+RC[4] -> 3725 | I13: 700 | J13: =RC[-1]/RC[-2] -> 0.18791946308724833 | L13: 280 | M13: 2910
D14: 中分 | E14: 1260 | F14: 0 | G14: =IF(RC[-1]>0,RC[5]/RC[-1],0) -> 0 | H14: =RC[-3]+RC[4] -> 1260 | I14: 74 | J14: =RC[-1]/RC[-2] -> 5.873015873015873E-2 | L14: 0 | M14: 650
D15: 南分 | E15: 4605 | F15: 980 | G15: =IF(RC[-1]>0,RC[5]/RC[-1],0) -> 0.57040816326530608 | H15: 4810 | I15: 249 | J15: =RC[-1]/RC[-2] -> 5.176715176715177E-2 | L15: 559 | M15: 4000
A16: 5 | B16: 長話交換機門號數 | C16: 門 | D16: 長通 | E16: 2088000 | F16: 60000 | G16: 0 | H16: 2289480 | I16: 1333260 | J16: =RC[-1]/RC[-2] -> 0.58234184181560877 | K16: 固網(資料取得截止日期91/06/30)
A17: 6 | B17: 國際交換機門號數 | C17: 門 | D17: 國際 | E17: 74840 | F17: - | G17: - | H17: 74840 | I17: 58542 | J17: =RC[-1]/RC[-2] -> 0.78222875467664355 | K17: 國際(資料取得截止日期91/07/30)
B18: 國際IN交換機門號數 | C18: 門 | D18: 國際 | E18: 30000 | F18: - | G18: - | H18: 30000 | I18: 6847 | J18: =RC[-1]/RC[-2] -> 0.22823333333333334 | M18: 1968000 | N18: 擴充153480,102000,6000,POI四期60000尚未完工
A19: 7 | B19: 區域ATM寬頻接取網路 | C19: 套 | D19: 北分 | E19: 657555 | F19: - | G19: - | H19: 726169 | I19: 665045 | J19: =RC[-1]/RC[-2] -> 0.91582675658145696 | K19: 寬頻(PAMS資料取得截止日期91/08/05) | M19: 653985
D20: 中分 | E20: 327445 | F20: - | G20: - | H20: 382018 | I20: 283667 | J20: =RC[-1]/RC[-2] -> 0.74254878042395911 | M20: 322856
D21: 南分 | E21: 324702 | F21: - | G21: - | H21: 394065 | I21: 323504 | J21: =RC[-1]/RC[-2] -> 0.82094070775125927 | M21: 318770
A22: 8 | B22: 長途ATM寬頻網路 | C22: 套 | D22: 長通 | E22: -- | F22: - | G22: 1 | H22: 11 | I22: - | J22: - | K22: 北區分公司辦理遷裝議價中，雖議價四次，但報價過高。 | M22: 11
A23: 9 | B23: 長途10G DWDM SDH網路 | C23: 部 | D23: 長通 | E23: -- | F23: 14 | G23: 0 | H23: -- | I23: -- | J23: 0 | K23: 高速 SDH
A24: 10 | B24: 長途同步數位階層SDH網路 | C24: 部 | D24: 長通 | E24: 480 | F24: 0 | G24: =IF(RC[-1]>0,RC[5]/RC[-1],0) -> 0 | H24: 570 | I24: 279 | J24: =RC[-1]/RC[-2] -> 0.48947368421052634 | K24: 傳輸骨幹網路(資料取得截止日期91/07/29) | M24: 0
A25: 11 | B25: 區域同步數位階層SDH網路 | C25: 部 | D25: 全區 | E25: 875 | F25: 404 | G25: =IF(RC[-1]>0,RC[5]/RC[-1],0) -> 0.54455445544554459 | H25: =RC[-3]+RC[5] -> 875 | I25: 612 | J25: =RC[-1]/RC[-2] -> 0.6994285714285714 | L25: 220 | M25: 0
A26: 12 | B26: 寬頻上網ADSL設備 | C26: 路 | D26: 北分 | E26: 582263 | F26: 450000 | G26: 1.0198 | H26: 891392 | I26: 749227 | J26: 0.84050000000000002 | K26: 網際網路(資料取得截止日期91/07/29) | M26: 915010 | N26: 須考慮可用數
D27: 中分 | E27: 350232 | F27: 250000 | G27: 0.64170000000000005 | H27: 537792 | I27: 292408 | J27: 0.54369999999999996
D28: 南分 | E28: 311120 | F28: 200000 | G28: 0.58940000000000003 | H28: 438036 | I28: 321090 | J28: 0.73299999999999998
A29: 13 | B29: HiNet寬頻接取埠 | C29: 埠 | D29: 全區 | E29: 1000000 | F29: 900000 | G29: 1 | H29: 1900000 | I29: 1070431 | J29: =RC[-1]/RC[-2] -> 0.56338473684210522 | M29: 800000 | N29: 23444600康崇原科長;23442307徐明山股長
A30: 14 | B30: 行動電話交換機 | C30: 門 | D30: 長通 | E30: 6500000 | F30: 700000 | G30: =IF(RC[-1]>0,(RC[1]-RC[-2])/RC[-1],0) -> 1.4285714285714286 | H30: 7500000 | I30: 7103734 | J30: =RC[-1]/RC[-2] -> 0.94716453333333328 | K30: 行動(資料取得截止日期91/06/30) | M30: 1597411
A31: 15 | B31: 行動電話基地臺 | C31: 座 | D31: 長通 | E31: 5165 | F31: 1430 | G31: =IF(RC[-1]>0,(RC[1]-RC[-2])/RC[-1],0) -> 0.81678321678321675 | H31: 6333 | I31: 6329 | J31: =RC[-1]/RC[-2] -> 0.99936838780988468 | M31: 1876
A32: 16 | B32: 局間中繼光纜 | C32: 心公里 | D32: 北分 | E32: 235320 | F32: 21000 | G32: 0.71140000000000003 | H32: 252684 | I32: 113609 | J32: =RC[-1]/RC[-2] -> 0.44960899779962327 | K32: 光纜(資料取得截止日期91/07/28) | L32: 7698
D33: 中分 | E33: 215317 | F33: 22600 | G33: 0.72260000000000002 | H33: 239529 | I33: 91716 | J33: =RC[-1]/RC[-2] -> 0.38290144408401489 | L33: 4416
D34: 南分 | E34: 198616 | F34: 17600 | G34: 0.57699999999999996 | H34: 203096 | I34: 79178 | J34: =RC[-1]/RC[-2] -> 0.38985504392011661 | L34: 4683
A35: 17 | B35: 用戶迴路光纜 | C35: 心公里 | D35: 北分 | E35: 223779 | F35: 18000 | G35: 0.79600000000000004 | H35: 239142 | I35: 43532 | J35: =RC[-1]/RC[-2] -> 0.18203410525963654 | L35: 5176
D36: 中分 | E36: 195607 | F36: 37100 | G36: 0.60619999999999996 | H36: 232311 | I36: 33612 | J36: =RC[-1]/RC[-2] -> 0.144685357129021 | L36: 5623
D37: 南分 | E37: 134048 | F37: 28500 | G37: 0.41310000000000002 | H37: 145821 | I37: 27131 | J37: =RC[-1]/RC[-2] -> 0.18605687795310688 | L37: 1500
A38: 18 | B38: 市話線路 | C38: 對 | D38: 北分 | E38: 13652200 | F38: 55200 | G38: 0.94930000000000003 | H38: 11759400 | I38: 7322644 | J38: =RC[-1]/RC[-2] -> 0.62270558021667777 | K38: 線路(資料取得截止日期91/07/28) | L38: 22400
D39: 中分 | E39: 6472300 | F39: 59200 | G39: 0.71619999999999995 | H39: 5185500 | I39: 2960921 | J39: =RC[-1]/RC[-2] -> 0.57100009642271721 | L39: 10500
D40: 南分 | E40: 7902900 | F40: 75000 | G40: 0.45329999999999998 | H40: 6317300 | I40: 3648435 | J40: =RC[-1]/RC[-2] -> 0.57753074889588907 | L40: 13100
A41: 19 | B41: 國內海纜 | C41: Mbps | D41: 長通 | E41: 10665 | F41: - | G41: - | H41: 10665 | I41: 3600 | J41: =RC[-1]/RC[-2] -> 0.33755274261603374 | K41: 國內海纜(資料取得截止日期91/06/30)
A42: 20 | B42: 國際海纜 | C42: Mbps | D42: 國際 | E42: 28864 | F42: - | G42: - | H42: 28864 | I42: 10506 | J42: =RC[-1]/RC[-2] -> 0.36398281596452325 | K42: 國際海纜(資料取得截止日期91/06/30)

Sheet: 910812
A1: 中華電信網路容量及使用現況雙週報表
K2: 填表日期：91 年 08 月12日
B3: 項 目 | C3: 單位 | D3: 分公司 | E3: 至90年12月累計數 | F3: 91年預定建設數 | G3: 建設執行現況(%) | H3: 91年當月累計設備總量 | I3: 當週累計 使用總量 | J3: 使用率% | K3: 備註 | L3: 91實際累計建設量 | M3: 累計淨增
A4: 1 | B4: 市話交換機門號數(POTS) | C4: 門 | D4: 北分 | E4: 8253465 | F4: 1137000 | G4: =IF(RC[-1]>0,RC[5]/RC[-1],0) -> 0.21838170624450307 | H4: 8463465 | I4: 6723991 | J4: =RC[-1]/RC[-2] -> 0.79447259485329003 | K4: 固網(資料取得截止日期91/07/31) | L4: 248300 | M4: 91300 | N4: 行銷處23445420吳碧芬
D5: 中分 | E5: 4082500 | F5: 79000 | G5: =IF(RC[-1]>0,RC[5]/RC[-1],0) -> 0.46835443037974683 | H5: 4118500 | I5: 2871990 | J5: =RC[-1]/RC[-2] -> 0.69733883695520216 | L5: 37000 | M5: 15000
D6: 南分 | E6: 4823946 | F6: 512300 | G6: =IF(RC[-1]>0,RC[5]/RC[-1],0) -> 0.78118290064415385 | H6: 4855606 | I6: 3326144 | J6: =RC[-1]/RC[-2] -> 0.68501109851169972 | L6: 400200 | M6: 173300
A7: 2 | B7: ISDN BRA | C7: 埠 | D7: 北分 | E7: 79129 | F7: 832 | G7: =IF(RC[-1]>0,RC[5]/RC[-1],0) -> 0.15384615384615385 | H7: =RC[-3]+RC[4] -> 79257 | I7: 18335 | J7: =RC[-1]/RC[-2] -> 0.23133603341029815 | L7: 128 | M7: 1912 | N7: 行銷處23442588周美玉
D8: 中分 | E8: 23590 | F8: 340 | G8: =IF(RC[-1]>0,RC[5]/RC[-1],0) -> 0.87058823529411766 | H8: 23630 | I8: 3869 | J8: =RC[-1]/RC[-2] -> 0.16373254337706306 | L8: 296 | M8: 1024
D9: 南分 | E9: 41150 | F9: 1486 | G9: =IF(RC[-1]>0,RC[5]/RC[-1],0) -> 0.95827725437415878 | H9: =RC[-3]+RC[4] -> 42574 | I9: 5511 | J9: =RC[-1]/RC[-2] -> 0.12944520129656598 | L9: 1424 | M9: 1592
A10: 3 | B10: ISDN T1-PRA | C10: 埠 | D10: 北分 | E10: 8177 | F10: 0 | G10: =IF(RC[-1]>0,RC[5]/RC[-1],0) -> 0 | H10: =RC[-3]+RC[4] -> 8177 | I10: 4286 | J10: =RC[-1]/RC[-2] -> 0.52415311238840656 | L10: 0 | M10: 2534
D11: 中分 | E11: 4486 | F11: 310 | G11: =IF(RC[-1]>0,RC[5]/RC[-1],0) -> 0.5161290322580645 | H11: 4621 | I11: 1599 | J11: =RC[-1]/RC[-2] -> 0.34602899805236964 | L11: 160 | M11: 260
D12: 南分 | E12: 5614 | F12: 0 | G12: =IF(RC[-1]>0,RC[5]/RC[-1],0) -> 0 | H12: =RC[-3]+RC[4] -> 5629 | I12: 1573 | J12: =RC[-1]/RC[-2] -> 0.27944572748267898 | L12: 15 | M12: 3262
A13: 4 | B13: ISDN E1-PRA | C13: 埠 | D13: 北分 | E13: 3445 | F13: 2670 | G13: =IF(RC[-1]>0,RC[5]/RC[-1],0) -> 0.10486891385767791 | H13: =RC[-3]+RC[4] -> 3725 | I13: 720 | J13: =RC[-1]/RC[-2] -> 0.19328859060402684 | L13: 280 | M13: 2910
D14: 中分 | E14: 1260 | F14: 0 | G14: =IF(RC[-1]>0,RC[5]/RC[-1],0) -> 0 | H14: =RC[-3]+RC[4] -> 1260 | I14: 77 | J14: =RC[-1]/RC[-2] -> 6.1111111111111109E-2 | L14: 0 | M14: 650
D15: 南分 | E15: 4605 | F15: 980 | G15: =IF(RC[-1]>0,RC[5]/RC[-1],0) -> 0.57040816326530608 | H15: 4810 | I15: 249 | J15: =RC[-1]/RC[-2] -> 5.176715176715177E-2 | L15: 559 | M15: 4000
A16: 5 | B16: 長話交換機門號數 | C16: 門 | D16: 長通 | E16: 2088000 | F16: 60000 | G16: 0 | H16: 2289480 | I16: 1321486 | J16: =RC[-1]/RC[-2] -> 0.57719918933556968 | K16: 固網(資料取得截止日期91/07/31)
A17: 6 | B17: 國際交換機門號數 | C17: 門 | D17: 國際 | E17: 74840 | F17: - | G17: - | H17: 74840 | I17: 58542 | J17: =RC[-1]/RC[-2] -> 0.78222875467664355 | K17: 國際(資料取得截止日期91/07/31)
B18: 國際IN交換機門號數 | C18: 門 | D18: 國際 | E18: 30000 | F18: - | G18: - | H18: 30000 | I18: 6847 | J18: =RC[-1]/RC[-2] -> 0.22823333333333334 | M18: 1968000 | N18: 擴充153480,102000,6000,POI四期60000尚未完工
A19: 7 | B19: 區域ATM寬頻接取網路 | C19: 套 | D19: 北分 | E19: 657555 | F19: - | G19: - | H19: 726153 | I19: 665222 | J19: =RC[-1]/RC[-2] -> 0.91609068612262157 | K19: 寬頻(PAMS資料取得截止日期91/08/12) | M19: 653985
D20: 中分 | E20: 327445 | F20: - | G20: - | H20: 382061 | I20: 285168 | J20: =RC[-1]/RC[-2] -> 0.74639390045045162 | M20: 322856
D21: 南分 | E21: 324702 | F21: - | G21: - | H21: 394704 | I21: 326826 | J21: =RC[-1]/RC[-2] -> 0.82802809193724913 | M21: 318770
A22: 8 | B22: 長途ATM寬頻網路 | C22: 套 | D22: 長通 | E22: -- | F22: - | G22: 1 | H22: 11 | I22: - | J22: - | K22: 北區分公司辦理遷裝議價中，雖議價四次，但報價過高。 | M22: 11
A23: 9 | B23: 長途10G DWDM SDH網路 | C23: 部 | D23: 長通 | E23: -- | F23: 14 | G23: 0 | H23: -- | I23: -- | J23: 0 | K23: 高速 SDH
A24: 10 | B24: 長途同步數位階層SDH網路 | C24: 部 | D24: 長通 | E24: 480 | F24: 0 | G24: =IF(RC[-1]>0,RC[5]/RC[-1],0) -> 0 | H24: 570 | I24: 284 | J24: =RC[-1]/RC[-2] -> 0.49824561403508771 | K24: 傳輸骨幹網路(資料取得截止日期91/08/12) | M24: 0
A25: 11 | B25: 區域同步數位階層SDH網路 | C25: 部 | D25: 全區 | E25: 875 | F25: 404 | G25: =IF(RC[-1]>0,RC[5]/RC[-1],0) -> 0.54455445544554459 | H25: =RC[-3]+RC[5] -> 875 | I25: 615 | J25: =RC[-1]/RC[-2] -> 0.70285714285714285 | L25: 220 | M25: 0
A26: 12 | B26: 寬頻上網ADSL設備 | C26: 路 | D26: 北分 | E26: 582263 | F26: 450000 | G26: 1.0283 | H26: 908298 | I26: 768904 | J26: 0.84650000000000003 | K26: 網際網路(資料取得截止日期91/08/12) | M26: 915010 | N26: 須考慮可用數
D27: 中分 | E27: 350232 | F27: 250000 | G27: 1.0306 | H27: 540655 | I27: 300557 | J27: 0.55589999999999995
D28: 南分 | E28: 311120 | F28: 200000 | G28: 0.58940000000000003 | H28: 443562 | I28: 330140 | J28: 0.74429999999999996
A29: 13 | B29: HiNet寬頻接取埠 | C29: 埠 | D29: 全區 | E29: 1000000 | F29: 900000 | G29: 1 | H29: 1900000 | I29: 1070431 | J29: =RC[-1]/RC[-2] -> 0.56338473684210522 | M29: 800000 | N29: 23444600康崇原科長;23442307徐明山股長
A30: 14 | B30: 行動電話交換機 | C30: 門 | D30: 長通 | E30: 6500000 | F30: 700000 | G30: =IF(RC[-1]>0,(RC[1]-RC[-2])/RC[-1],0) -> 1.4285714285714286 | H30: 7500000 | I30: 7116445 | J30: =RC[-1]/RC[-2] -> 0.94885933333333339 | K30: 行動(資料取得截止日期91/08/12) | M30: 1597411
A31: 15 | B31: 行動電話基地臺 | C31: 座 | D31: 長通 | E31: 5165 | F31: 1430 | G31: =IF(RC[-1]>0,(RC[1]-RC[-2])/RC[-1],0) -> 0.86223776223776227 | H31: 6398 | I31: 6389 | J31: =RC[-1]/RC[-2] -> 0.99859331040950294 | M31: 1876
A32: 16 | B32: 局間中繼光纜 | C32: 心公里 | D32: 北分 | E32: 235320 | F32: 21000 | G32: 0.71140000000000003 | H32: 252684 | I32: 113609 | J32: =RC[-1]/RC[-2] -> 0.44960899779962327 | K32: 光纜(資料取得截止日期91/07/28) | L32: 7698
D33: 中分 | E33: 215317 | F33: 22600 | G33: 0.72260000000000002 | H33: 239529 | I33: 91716 | J33: =RC[-1]/RC[-2] -> 0.38290144408401489 | L33: 4416
D34: 南分 | E34: 198616 | F34: 17600 | G34: 0.57699999999999996 | H34: 203096 | I34: 79178 | J34: =RC[-1]/RC[-2] -> 0.38985504392011661 | L34: 4683
A35: 17 | B35: 用戶迴路光纜 | C35: 心公里 | D35: 北分 | E35: 223779 | F35: 18000 | G35: 0.79600000000000004 | H35: 239142 | I35: 43532 | J35: =RC[-1]/RC[-2] -> 0.18203410525963654 | L35: 5176
D36: 中分 | E36: 195607 | F36: 37100 | G36: 0.60619999999999996 | H36: 232311 | I36: 33612 | J36: =RC[-1]/RC[-2] -> 0.144685357129021 | L36: 5623
D37: 南分 | E37: 134048 | F37: 28500 | G37: 0.41310000000000002 | H37: 145821 | I37: 27131 | J37: =RC[-1]/RC[-2] -> 0.18605687795310688 | L37: 1500
A38: 18 | B38: 市話線路 | C38: 對 | D38: 北分 | E38: 13652200 | F38: 55200 | G38: 0.94930000000000003 | H38: 11759400 | I38: 7322644 | J38: =RC[-1]/RC[-2] -> 0.62270558021667777 | K38: 線路(資料取得截止日期91/07/28) | L38: 22400
D39: 中分 | E39: 6472300 | F39: 59200 | G39: 0.71619999999999995 | H39: 5185500 | I39: 2960921 | J39: =RC[-1]/RC[-2] -> 0.57100009642271721 | L39: 10500
D40: 南分 | E40: 7902900 | F40: 75000 | G40: 0.45329999999999998 | H40: 6317300 | I40: 3648435 | J40: =RC[-1]/RC[-2] -> 0.57753074889588907 | L40: 13100
A41: 19 | B41: 國內海纜 | C41: Mbps | D41: 長通 | E41: 10665 | F41: - | G41: - | H41: 10665 | I41: 3610 | J41: =RC[-1]/RC[-2] -> 0.33849038912330054 | K41: 國內海纜(資料取得截止日期91/08/13) | N41: 910813劉金鳳股長電話通知本週使用量為3610
A42: 20 | B42: 國際海纜 | C42: Mbps | D42: 國際 | E42: 28864 | F42: - | G42: - | H42: 28864 | I42: 10774 | J42: =RC[-1]/RC[-2] -> 0.3732677383592018 | K42: 國際海纜(資料取得截止日期91/08/05)

Sheet: 910826
A1: 中華電信網路容量及使用現況雙週報表
K2: 填表日期：91 年 08 月26日
B3: 項 目 | C3: 單位 | D3: 分公司 | E3: 至90年12月累計數 | F3: 91年預定建設數 | G3: 建設執行現況(%) | H3: 91年當月累計設備總量 | I3: 當週累計 使用總量 | J3: 使用率% | K3: 備註 | L3: 91實際累計建設量 | M3: 累計淨增
A4: 1 | B4: 市話交換機門號數(POTS) | C4: 門 | D4: 北分 | E4: 8253465 | F4: 1137000 | G4: 0.21838170624450307 | H4: 8463465 | I4: 6723991 | J4: =RC[-1]/RC[-2] -> 0.79447259485329003 | K4: 固網(資料取得截止日期91/07/31) | L4: 248300 | M4: 91300 | N4: 行銷處23445420吳碧芬
D5: 中分 | E5: 4082500 | F5: 79000 | G5: 0.46835443037974683 | H5: 4118500 | I5: 2871990 | J5: =RC[-1]/RC[-2] -> 0.69733883695520216 | L5: 37000 | M5: 15000
D6: 南分 | E6: 4823946 | F6: 512300 | G6: 0.78118290064415385 | H6: 4855606 | I6: 3326144 | J6: =RC[-1]/RC[-2] -> 0.68501109851169972 | L6: 400200 | M6: 173300
A7: 2 | B7: ISDN BRA | C7: 埠 | D7: 北分 | E7: 79129 | F7: 832 | G7: 0.15384615384615385 | H7: 79257 | I7: 18335 | J7: =RC[-1]/RC[-2] -> 0.23133603341029815 | L7: 128 | M7: 1912 | N7: 行銷處23442588周美玉
D8: 中分 | E8: 23590 | F8: 340 | G8: 0.87058823529411766 | H8: 23630 | I8: 3869 | J8: =RC[-1]/RC[-2] -> 0.16373254337706306 | L8: 296 | M8: 1024
D9: 南分 | E9: 41150 | F9: 1486 | G9: 0.95827725437415878 | H9: 42574 | I9: 5511 | J9: =RC[-1]/RC[-2] -> 0.12944520129656598 | L9: 1424 | M9: 1592
A10: 3 | B10: ISDN T1-PRA | C10: 埠 | D10: 北分 | E10: 8177 | F10: 0 | G10: 0 | H10: 8177 | I10: 4286 | J10: =RC[-1]/RC[-2] -> 0.52415311238840656 | L10: 0 | M10: 2534
D11: 中分 | E11: 4486 | F11: 310 | G11: 0.5161290322580645 | H11: 4621 | I11: 1599 | J11: =RC[-1]/RC[-2] -> 0.34602899805236964 | L11: 160 | M11: 260
D12: 南分 | E12: 5614 | F12: 0 | G12: 0 | H12: 5629 | I12: 1573 | J12: =RC[-1]/RC[-2] -> 0.27944572748267898 | L12: 15 | M12: 3262
A13: 4 | B13: ISDN E1-PRA | C13: 埠 | D13: 北分 | E13: 3445 | F13: 2670 | G13: 0.10486891385767791 | H13: 3725 | I13: 720 | J13: =RC[-1]/RC[-2] -> 0.19328859060402684 | L13: 280 | M13: 2910
D14: 中分 | E14: 1260 | F14: 0 | G14: 0 | H14: 1260 | I14: 77 | J14: =RC[-1]/RC[-2] -> 6.1111111111111109E-2 | L14: 0 | M14: 650
D15: 南分 | E15: 4605 | F15: 980 | G15: 0.57040816326530608 | H15: 4810 | I15: 249 | J15: =RC[-1]/RC[-2] -> 5.176715176715177E-2 | L15: 559 | M15: 4000
A16: 5 | B16: 長話交換機門號數 | C16: 門 | D16: 長通 | E16: 2088000 | F16: 60000 | G16: 0 | H16: 2289480 | I16: 1321486 | J16: =RC[-1]/RC[-2] -> 0.57719918933556968 | K16: 固網(資料取得截止日期91/07/31)
A17: 6 | B17: 國際交換機門號數 | C17: 門 | D17: 國際 | E17: 74840 | F17: - | G17: - | H17: 74840 | I17: 57476 | J17: =RC[-1]/RC[-2] -> 0.76798503474078028 | K17: 國際(資料取得截止日期91/07/20)
B18: 國際IN交換機門號數 | C18: 門 | D18: 國際 | E18: 30000 | F18: - | G18: - | H18: 30000 | I18: 6556 | J18: =RC[-1]/RC[-2] -> 0.21853333333333333 | M18: 1968000 | N18: 擴充153480,102000,6000,POI四期60000尚未完工
A19: 7 | B19: 區域ATM寬頻接取網路 | C19: 套 | D19: 北分 | E19: 657555 | F19: - | G19: - | H19: 726963 | I19: 666848 | J19: =RC[-1]/RC[-2] -> 0.91730665797296429 | K19: 寬頻(PAMS資料取得截止日期91/08/26) | M19: 653985
D20: 中分 | E20: 327445 | F20: - | G20: - | H20: 378381 | I20: 290525 | J20: =RC[-1]/RC[-2] -> 0.76781075159693535 | M20: 322856
D21: 南分 | E21: 324702 | F21: - | G21: - | H21: 393973 | I21: 332409 | J21: 0.84373548441136825 | M21: 318770
A22: 8 | B22: 長途ATM寬頻網路 | C22: 套 | D22: 長通 | E22: -- | F22: - | G22: 1 | H22: 11 | I22: - | J22: - | K22: 北區分公司辦理遷裝，8/20第五次議價，以1699萬決標。 | M22: 11
A23: 9 | B23: 長途10G DWDM SDH網路 | C23: 部 | D23: 長通 | E23: -- | F23: 14 | G23: 0 | H23: -- | I23: -- | J23: 0 | K23: DWDM已於91/8/19決標,預計92/2完工
A24: 10 | B24: 長途同步數位階層SDH網路 | C24: 部 | D24: 長通 | E24: 480 | F24: 0 | G24: 0 | H24: 570 | I24: 288 | J24: =RC[-1]/RC[-2] -> 0.50526315789473686 | K24: 傳輸骨幹網路(資料取得截止日期91/08/26) | M24: 0
A25: 11 | B25: 區域同步數位階層SDH網路 | C25: 部 | D25: 全區 | E25: 875 | F25: 404 | G25: 0.54455445544554459 | H25: 875 | I25: 618 | J25: =RC[-1]/RC[-2] -> 0.70628571428571429 | L25: 220 | M25: 0
A26: 12 | B26: 寬頻上網ADSL設備 | C26: 路 | D26: 北分 | E26: 582263 | F26: 450000 | G26: 1.0351999999999999 | H26: 964978 | I26: 796863 | J26: =RC[-1]/RC[-2] -> 0.82578359299382986 | K26: 網際網路(資料取得截止日期91/09/02) | M26: 915010 | N26: 須考慮可用數
D27: 中分 | E27: 350232 | F27: 250000 | G27: 1.0344 | H27: 539990 | I27: 312979 | J27: =RC[-1]/RC[-2] -> 0.57960147410137219
D28: 南分 | E28: 311120 | F28: 200000 | G28: 0.60009999999999997 | H28: 458974 | I28: 342463 | J28: =RC[-1]/RC[-2] -> 0.74614901933442856
A29: 13 | B29: HiNet寬頻接取埠 | C29: 埠 | D29: 全區 | E29: 1000000 | F29: 900000 | G29: 1 | H29: 1900000 | I29: 1138712 | J29: =RC[-1]/RC[-2] -> 0.59932210526315788 | M29: 800000 | N29: 23444600康崇原科長;23442307徐明山股長
A30: 14 | B30: 行動電話交換機 | C30: 門 | D30: 長通 | E30: 6500000 | F30: 700000 | G30: 1.4285714285714286 | H30: 7500000 | I30: 7172329 | J30: =RC[-1]/RC[-2] -> 0.95631053333333338 | K30: 行動(資料取得截止日期91/08/26) | M30: 1597411
A31: 15 | B31: 行動電話基地臺 | C31: 座 | D31: 長通 | E31: 5165 | F31: 1430 | G31: 0.95594405594405596 | H31: 6532 | I31: 6513 | J31: =RC[-1]/RC[-2] -> 0.99709124311083897 | M31: 1876
A32: 16 | B32: 局間中繼光纜 | C32: 心公里 | D32: 北分 | E32: 235320 | F32: 21000 | G32: 0.71140000000000003 | H32: 257010 | I32: 115071 | J32: =RC[-1]/RC[-2] -> 0.44772966032450101 | K32: 光纜(資料取得截止日期91/08/28) | L32: 7698
D33: 中分 | E33: 215317 | F33: 22600 | G33: 0.72260000000000002 | H33: 240253 | I33: 90213 | J33: =RC[-1]/RC[-2] -> 0.37549166919871968 | L33: 4416
D34: 南分 | E34: 198616 | F34: 17600 | G34: 0.71389999999999998 | H34: 205506 | I34: 78427 | J34: =RC[-1]/RC[-2] -> 0.38162876023084485 | L34: 4683
A35: 17 | B35: 用戶迴路光纜 | C35: 心公里 | D35: 北分 | E35: 223779 | F35: 18000 | G35: 0.93159999999999998 | H35: 241917 | I35: 44911 | J35: =RC[-1]/RC[-2] -> 0.18564631671193013 | L35: 5176
D36: 中分 | E36: 195607 | F36: 37100 | G36: 0.60619999999999996 | H36: 231870 | I36: 34850 | J36: =RC[-1]/RC[-2] -> 0.15029973692155088 | L36: 5623
D37: 南分 | E37: 134048 | F37: 28500 | G37: 0.47060000000000002 | H37: 147459 | I37: 27886 | J37: =RC[-1]/RC[-2] -> 0.18911019334187809 | L37: 1500
A38: 18 | B38: 市話線路 | C38: 對 | D38: 北分 | E38: 13652200 | F38: 55200 | G38: 0.94930000000000003 | H38: 11787300 | I38: 7324290 | J38: =RC[-1]/RC[-2] -> 0.62137130640604721 | K38: 線路(資料取得截止日期91/08/13) | L38: 22400
D39: 中分 | E39: 6472300 | F39: 59200 | G39: 0.76519999999999999 | H39: 5195800 | I39: 2965123 | J39: =RC[-1]/RC[-2] -> 0.57067689287501444 | L39: 10500
D40: 南分 | E40: 7902900 | F40: 75000 | G40: 0.4733 | H40: 6328000 | I40: 3654694 | J40: =RC[-1]/RC[-2] -> 0.57754329962073325 | L40: 13100
A41: 19 | B41: 國內海纜 | C41: Mbps | D41: 長通 | E41: 10665 | F41: - | G41: - | H41: 10665 | I41: 3610 | J41: =RC[-1]/RC[-2] -> 0.33849038912330054 | K41: 國內海纜(資料取得截止日期91/08/13) | N41: 910813劉金鳳股長電話通知本週使用量為3610
A42: 20 | B42: 國際海纜 | C42: Mbps | D42: 國際 | E42: 28864 | F42: - | G42: - | H42: 28864 | I42: 10774 | J42: =RC[-1]/RC[-2] -> 0.3732677383592018 | K42: 國際海纜(資料取得截止日期91/08/13)

Sheet: POTS-表
A1: 三區分公司九十一年度市話數位交換機門號設備暨使用率統計表
A3: 月份 | B3: 一月 | C3: 二月 | D3: 三月 | E3: 四月 | F3: 五月 | G3: 六月 | H3: 七月 | I3: 八月 | J3: 九月 | K3: 十月 | L3: 十一月 | M3: 十二月
A4: 建設門號數 | B4: 0 | C4: 1500 | D4: 10000 | E4: 0 | F4: 79800
A5: 月份 | B5: 一月 | C5: 二月 | D5: 三月 | E5: 四月 | F5: 五月 | G5: 六月 | H5: 七月 | I5: 八月 | J5: 九月 | K5: 十月 | L5: 十一月 | M5: 十二月
A6: 北區現有設備數 | B6: 8253465 | C6: =RC[-1]+R[-2]C -> 8254965 | D6: =RC[-1]+R[-2]C -> 8264965 | E6: =RC[-1]+R[-2]C -> 8264965 | F6: 8269765 | G6: 8312765 | H6: 8463465
A7: 中區現有設備數 | B7: 4082500 | C7: 4082500 | D7: 4082500 | E7: 4082500 | F7: 4077500 | G7: 4093500 | H7: 4118500
A8: 南區現有設備數 | B8: 4797950 | C8: 4782950 | D8: 4720050 | E8: 4683950 | F8: 4810030 | G8: 4979930 | H8: 4855606
A9: 北區現有用戶數 | B9: 6683012 | C9: 6682337 | D9: 6697018 | E9: 6705914 | F9: 6713076 | G9: 6713076 | H9: 6723991
A10: 中區現有用戶數 | B10: 2862179 | C10: 2864465 | D10: 2866904 | E10: 2868409 | F10: 2872249 | G10: 2872249 | H10: 2871990
A11: 南區現有用戶數 | B11: 3300857 | C11: 3301255 | D11: 3313566 | E11: 3318883 | F11: 3319732 | G11: 3319732 | H11: 3326144
A12: 北區門號使用率 | B12: =R[-3]C/R[-6]C -> 0.80972197737556284 | C12: =R[-3]C/R[-6]C -> 0.80949307477378762 | D12: =R[-3]C/R[-6]C -> 0.81028994073175142 | E12: =R[-3]C/R[-6]C -> 0.81136629132730753 | F12: =R[-3]C/R[-6]C -> 0.81176139829850058 | G12: =R[-3]C/R[-6]C -> 0.80756234538086902 | H12: =R[-3]C/R[-6]C -> 0.79447259485329003
A13: 中區門號使用率 | B13: =R[-3]C/R[-6]C -> 0.70108487446417633 | C13: =R[-3]C/R[-6]C -> 0.70164482547458662 | D13: =R[-3]C/R[-6]C -> 0.70224225352112679 | E13: =R[-3]C/R[-6]C -> 0.70261090018371097 | F13: =R[-3]C/R[-6]C -> 0.70441422440220725 | G13: =R[-3]C/R[-6]C -> 0.70166092585806772 | H13: =R[-3]C/R[-6]C -> 0.69733883695520216
A14: 南區門號使用率 | B14: =R[-3]C/R[-6]C -> 0.68797236319678201 | C14: =R[-3]C/R[-6]C -> 0.69021315297044716 | D14: =R[-3]C/R[-6]C -> 0.70201925827056921 | E14: =R[-3]C/R[-6]C -> 0.7085649932215331 | F14: =R[-3]C/R[-6]C -> 0.69016866838668367 | G14: =R[-3]C/R[-6]C -> 0.66662222159749229 | H14: =R[-3]C/R[-6]C -> 0.68501109851169972
H17: =R[-8]C-R[-8]C[-1] -> 10915
H18: =R[-8]C-R[-8]C[-1] -> -259
H19: =R[-8]C-R[-8]C[-1] -> 6412

Sheet: BRA-表
A1: 三區分公司九十一年度ISDN-BRA設備暨使用率統計表
A3: 月份 | B3: 一月 | C3: 二月 | D3: 三月 | E3: 四月 | F3: 五月 | G3: 六月 | H3: 七月 | I3: 八月 | J3: 九月 | K3: 十月 | L3: 十一月 | M3: 十二月
A4: 建設門號數 | B4: 0 | C4: 1500 | D4: 10000 | E4: 0 | F4: 79800
A5: 月份 | B5: 一月 | C5: 二月 | D5: 三月 | E5: 四月 | F5: 五月 | G5: 六月 | H5: 七月 | I5: 八月 | J5: 九月 | K5: 十月 | L5: 十一月 | M5: 十二月
A6: 北區現有設備數 | B6: 79129 | C6: 79129 | D6: 79129 | E6: 79129 | F6: 79129 | G6: 79257 | H6: 79705
A7: 中區現有設備數 | B7: 23590 | C7: 23590 | D7: 23590 | E7: 23590 | F7: 23846 | G7: 23630 | H7: 23642
A8: 南區現有設備數 | B8: 41278 | C8: 41278 | D8: 41278 | E8: 41278 | F8: 41710 | G8: 42574 | H8: 42730
A9: 北區現有用戶數 | B9: 18893 | C9: 18884 | D9: 18738 | E9: 18630 | F9: 18538 | G9: 18428 | H9: 18335
A10: 中區現有用戶數 | B10: 3843 | C10: 3825 | D10: 3838 | E10: 3840 | F10: 3857 | G10: 3845 | H10: 3869
A11: 南區現有用戶數 | B11: 5503 | C11: 5462 | D11: 5440 | E11: 5430 | F11: 5484 | G11: 5508 | H11: 5511
A12: 北區門號使用率 | B12: =R[-3]C/R[-6]C -> 0.23876202150918122 | C12: =R[-3]C/R[-6]C -> 0.23864828318315662 | D12: =R[-3]C/R[-6]C -> 0.23680319478320211 | E12: =R[-3]C/R[-6]C -> 0.23543833487090701 | F12: =R[-3]C/R[-6]C -> 0.23427567642710004 | G12: =R[-3]C/R[-6]C -> 0.23250943134360372 | H12: =R[-3]C/R[-6]C -> 0.23003575685339689
A13: 中區門號使用率 | B13: =R[-3]C/R[-6]C -> 0.16290801186943621 | C13: =R[-3]C/R[-6]C -> 0.16214497668503602 | D13: =R[-3]C/R[-6]C -> 0.16269605765154727 | E13: =R[-3]C/R[-6]C -> 0.16278083933870285 | F13: =R[-3]C/R[-6]C -> 0.16174620481422461 | G13: =R[-3]C/R[-6]C -> 0.1627168853152772 | H13: =R[-3]C/R[-6]C -> 0.16364943744184079
A14: 南區門號使用率 | B14: =R[-3]C/R[-6]C -> 0.13331556761471003 | C14: =R[-3]C/R[-6]C -> 0.13232230243713358 | D14: =R[-3]C/R[-6]C -> 0.13178933087843403 | E14: =R[-3]C/R[-6]C -> 0.13154707107902514 | F14: =R[-3]C/R[-6]C -> 0.13147926156796932 | G14: =R[-3]C/R[-6]C -> 0.12937473575421618 | H14: =R[-3]C/R[-6]C -> 0.12897261876901475

Sheet: PRA-T-表
A1: 三區分公司九十一年度ISDN-T1-PRA設備暨使用率統計表
A3: 月份 | B3: 一月 | C3: 二月 | D3: 三月 | E3: 四月 | F3: 五月 | G3: 六月 | H3: 七月 | I3: 八月 | J3: 九月 | K3: 十月 | L3: 十一月 | M3: 十二月
A4: 建設門號數 | B4: 0 | C4: 1500 | D4: 10000 | E4: 0 | F4: 79800
A5: 月份 | B5: 一月 | C5: 二月 | D5: 三月 | E5: 四月 | F5: 五月 | G5: 六月 | H5: 七月 | I5: 八月 | J5: 九月 | K5: 十月 | L5: 十一月 | M5: 十二月
A6: 北區現有設備數 | B6: 8177 | C6: 8177 | D6: 8177 | E6: 8177 | F6: 8177 | G6: 8177 | H6: 8177
A7: 中區現有設備數 | B7: 4486 | C7: 4486 | D7: 4486 | E7: 4486 | F7: 4586 | G7: 4621 | H7: 4721
A8: 南區現有設備數 | B8: 5614 | C8: 5614 | D8: 5614 | E8: 5614 | F8: 5614 | G8: 5629 | H8: 5614
A9: 北區現有用戶數 | B9: 4710 | C9: 4687 | D9: 4643 | E9: 4631 | F9: 4603 | G9: 4560 | H9: 4286
A10: 中區現有用戶數 | B10: 1786 | C10: 1754 | D10: 1742 | E10: 1728 | F10: 1686 | G10: 1654 | H10: 1599
A11: 南區現有用戶數 | B11: 1668 | C11: 1651 | D11: 1658 | E11: 1641 | F11: 1687 | G11: 1687 | H11: 1573
A12: 北區門號使用率 | B12: =R[-3]C/R[-6]C -> 0.57600587012351723 | C12: =R[-3]C/R[-6]C -> 0.57319310260486733 | D12: =R[-3]C/R[-6]C -> 0.56781215604745017 | E12: =R[-3]C/R[-6]C -> 0.56634462516815454 | F12: =R[-3]C/R[-6]C -> 0.56292038644979825 | G12: =R[-3]C/R[-6]C -> 0.55766173413232234 | H12: =R[-3]C/R[-6]C -> 0.52415311238840656
A13: 中區門號使用率 | B13: =R[-3]C/R[-6]C -> 0.39812750780205081 | C13: =R[-3]C/R[-6]C -> 0.39099420419081587 | D13: =R[-3]C/R[-6]C -> 0.38831921533660274 | E13: =R[-3]C/R[-6]C -> 0.38519839500668746 | F13: =R[-3]C/R[-6]C -> 0.36764064544265157 | G13: =R[-3]C/R[-6]C -> 0.35793118372646615 | H13: =R[-3]C/R[-6]C -> 0.33869942808726966
A14: 南區門號使用率 | B14: =R[-3]C/R[-6]C -> 0.29711435696473104 | C14: =R[-3]C/R[-6]C -> 0.29408621303883148 | D14: =R[-3]C/R[-6]C -> 0.29533309583184897 | E14: =R[-3]C/R[-6]C -> 0.29230495190594941 | F14: =R[-3]C/R[-6]C -> 0.30049875311720697 | G14: =R[-3]C/R[-6]C -> 0.29969799253863921 | H14: =R[-3]C/R[-6]C -> 0.28019237620235127
G17: =R[-7]C[1]-R[-7]C -> -55

Sheet: PRA-E-表
A1: 三區分公司九十一年度ISDN-E1-PRA設備暨使用率統計表
A3: 月份 | B3: 一月 | C3: 二月 | D3: 三月 | E3: 四月 | F3: 五月 | G3: 六月 | H3: 七月 | I3: 八月 | J3: 九月 | K3: 十月 | L3: 十一月 | M3: 十二月
A4: 建設門號數 | B4: 0 | C4: 1500 | D4: 10000 | E4: 0 | F4: 79800
A5: 月份 | B5: 一月 | C5: 二月 | D5: 三月 | E5: 四月 | F5: 五月 | G5: 六月 | H5: 七月 | I5: 八月 | J5: 九月 | K5: 十月 | L5: 十一月 | M5: 十二月
A6: 北區現有設備數 | B6: 3445 | C6: 3445 | D6: 3445 | E6: 3445 | F6: 3495 | G6: 3725 | H6: 5125
A7: 中區現有設備數 | B7: 1260 | C7: 1260 | D7: 1260 | E7: 1260 | F7: 1260 | G7: 1260 | H7: 1260
A8: 南區現有設備數 | B8: 4605 | C8: 4605 | D8: 4605 | E8: 4605 | F8: 5055 | G8: 4810 | H8: 5555
A9: 北區現有用戶數 | B9: 587 | C9: 594 | D9: 650 | E9: 651 | F9: 661 | G9: 700 | H9: 720
A10: 中區現有用戶數 | B10: 65 | C10: 64 | D10: 66 | E10: 67 | F10: 67 | G10: 74 | H10: 77
A11: 南區現有用戶數 | B11: 230 | C11: 231 | D11: 230 | E11: 233 | F11: 249 | G11: 249 | H11: 249
A12: 北區門號使用率 | B12: =R[-3]C/R[-6]C -> 0.17039187227866473 | C12: =R[-3]C/R[-6]C -> 0.17242380261248186 | D12: =R[-3]C/R[-6]C -> 0.18867924528301888 | E12: =R[-3]C/R[-6]C -> 0.18896952104499273 | F12: =R[-3]C/R[-6]C -> 0.18912732474964233 | G12: =R[-3]C/R[-6]C -> 0.18791946308724833 | H12: =R[-3]C/R[-6]C -> 0.14048780487804879
A13: 中區門號使用率 | B13: =R[-3]C/R[-6]C -> 5.1587301587301584E-2 | C13: =R[-3]C/R[-6]C -> 5.0793650793650794E-2 | D13: =R[-3]C/R[-6]C -> 5.2380952380952382E-2 | E13: =R[-3]C/R[-6]C -> 5.3174603174603173E-2 | F13: =R[-3]C/R[-6]C -> 5.3174603174603173E-2 | G13: =R[-3]C/R[-6]C -> 5.873015873015873E-2 | H13: =R[-3]C/R[-6]C -> 6.1111111111111109E-2
A14: 南區門號使用率 | B14: =R[-3]C/R[-6]C -> 4.9945711183496201E-2 | C14: =R[-3]C/R[-6]C -> 5.0162866449511401E-2 | D14: =R[-3]C/R[-6]C -> 4.9945711183496201E-2 | E14: =R[-3]C/R[-6]C -> 5.05971769815418E-2 | F14: =R[-3]C/R[-6]C -> 4.9258160237388722E-2 | G14: =R[-3]C/R[-6]C -> 5.176715176715177E-2 | H14: =R[-3]C/R[-6]C -> 4.4824482448244822E-2

Sheet: LONG-表
A1: 長途及行動通信分公司九十一年度數位交換機門號設備暨使用率統計表
A3: 月份 | B3: 一月 | C3: 二月 | D3: 三月 | E3: 四月 | F3: 五月 | G3: 六月 | H3: 七月 | I3: 八月 | J3: 九月 | K3: 十月 | L3: 十一月 | M3: 十二月
A4: 建設門號數 | B4: 0 | C4: 1500 | D4: 10000 | E4: 0 | F4: 79800
A5: 月份 | B5: 一月 | C5: 二月 | D5: 三月 | E5: 四月 | F5: 五月 | G5: 六月 | H5: 七月 | I5: 八月 | J5: 九月 | K5: 十月 | L5: 十一月 | M5: 十二月
A6: 現有設備數 | B6: 2223480 | C6: 2223480 | D6: 2223480 | E6: 2289480 | F6: 2289480 | G6: 2289480 | H6: 2289480
A7: T1 設備數 | B7: 1025240 | C7: 1025240 | D7: 1025240 | E7: 1025240 | F7: 1025240 | G7: 1025240 | H7: 1025240
A8: E1 設備數 | B8: 1198240 | C8: 1198240 | D8: 1198240 | E8: 1264240 | F8: 1264240 | G8: 1264240 | H8: 1264240
A9: 設備開放數 | B9: 1302201 | C9: 1298941 | D9: 1314331 | E9: 1325951 | F9: 1339210 | G9: 1333260 | H9: 1321486
A10: T1 開放數 | B10: 645546 | C10: 642163 | D10: 641481 | E10: 633685 | F10: 628556 | G10: 626599 | H10: 622982
A11: E1 開放數 | B11: 656655 | C11: 656778 | D11: 672850 | E11: 692266 | F11: 710654 | G11: 706661 | H11: 698504
A12: 設備使用率 | B12: =R[-3]C/R[-6]C -> 0.58565896702466402 | C12: =R[-3]C/R[-6]C -> 0.58419279687696768 | D12: =R[-3]C/R[-6]C -> 0.59111437926133803 | E12: =R[-3]C/R[-6]C -> 0.5791494138406974 | F12: =R[-3]C/R[-6]C -> 0.58494068522109821 | G12: =R[-3]C/R[-6]C -> 0.58234184181560877 | H12: =R[-3]C/R[-6]C -> 0.57719918933556968
A13: T1 使用率 | B13: =R[-3]C/R[-6]C -> 0.62965354453591349 | C13: =R[-3]C/R[-6]C -> 0.62635382934727479 | D13: =R[-3]C/R[-6]C -> 0.62568861925012675 | E13: =R[-3]C/R[-6]C -> 0.61808454605750851 | F13: =R[-3]C/R[-6]C -> 0.61308181498966097 | G13: =R[-3]C/R[-6]C -> 0.61117299364051347 | H13: =R[-3]C/R[-6]C -> 0.60764503921033119
A14: E1 使用率 | B14: =R[-3]C/R[-6]C -> 0.54801625717719327 | C14: =R[-3]C/R[-6]C -> 0.54811890773133931 | D14: =R[-3]C/R[-6]C -> 0.56153191347309384 | E14: =R[-3]C/R[-6]C -> 0.54757482756438647 | F14: =R[-3]C/R[-6]C -> 0.56211953426564576 | G14: =R[-3]C/R[-6]C -> 0.55896111497816869 | H14: =R[-3]C/R[-6]C -> 0.55250901727520096

Sheet: INTL-表
A1: 國際分公司九十一年度國際交換機門號設備暨使用率統計表
A3: 月份 | B3: 一月 | C3: 二月 | D3: 三月 | E3: 四月 | F3: 五月 | G3: 六月 | H3: 七月 | I3: 八月 | J3: 九月 | K3: 十月 | L3: 十一月 | M3: 十二月
A4: 建設門號數 | B4: 0 | C4: 1500 | D4: 10000 | E4: 0 | F4: 79800
A5: 月份 | B5: 一月 | C5: 二月 | D5: 三月 | E5: 四月 | F5: 五月 | G5: 六月 | H5: 七月 | I5: 八月 | J5: 九月 | K5: 十月 | L5: 十一月 | M5: 十二月
A6: 現有設備數 | B6: 74840 | C6: 74840 | D6: 74840 | E6: 74840 | F6: 74840 | G6: 74840 | H6: 74840
A7: 開放門號數 | B7: 51482 | C7: 54223 | D7: 54323 | E7: 55331 | F7: 55969 | G7: 56812 | H7: 58542
A8: 門號使用率 | B8: =R[-1]C/R[-2]C -> 0.68789417423837518 | C8: =R[-1]C/R[-2]C -> 0.72451897381079633 | D8: =R[-1]C/R[-2]C -> 0.72585515766969533 | E8: =R[-1]C/R[-2]C -> 0.73932389096739715 | F8: =R[-1]C/R[-2]C -> 0.7478487439871726 | G8: =R[-1]C/R[-2]C -> 0.75911277391769105 | H8: =R[-1]C/R[-2]C -> 0.78222875467664355

Sheet: INTL-IN-表
A1: 國際分公司九十一年度IN交換機門號設備暨使用率統計表
A3: 月份 | B3: 一月 | C3: 二月 | D3: 三月 | E3: 四月 | F3: 五月 | G3: 六月 | H3: 七月 | I3: 八月 | J3: 九月 | K3: 十月 | L3: 十一月 | M3: 十二月
A4: 建設門號數 | B4: 0 | C4: 1500 | D4: 10000 | E4: 0 | F4: 79800
A5: 月份 | B5: 一月 | C5: 二月 | D5: 三月 | E5: 四月 | F5: 五月 | G5: 六月 | H5: 七月 | I5: 八月 | J5: 九月 | K5: 十月 | L5: 十一月 | M5: 十二月
A6: 現有設備數 | B6: 30000 | C6: 30000 | D6: 30000 | E6: 30000 | F6: 30000 | G6: 30000 | H6: 30000
A7: 開放門號數 | B7: 5819 | C7: 5788 | D7: 5955 | E7: 6949 | F7: 6997 | G7: 6997 | H7: 6847
A8: 門號使用率 | B8: 0.19396666666666668 | C8: 0.19293333333333335 | D8: 0.19850000000000001 | E8: 0.23163333333333333 | F8: 0.23323333333333332 | G8: =R[-1]C/R[-2]C -> 0.23323333333333332 | H8: =R[-1]C/R[-2]C -> 0.22823333333333334

Sheet: ATM-表
A1: 三區分公司九十一年度區域ATM寬頻接取網路設備暨使用率統計表
A3: 月份 | C3: 一月 | D3: 二月 | E3: 三月 | F3: 四月 | G3: 五月 | H3: 六月 | I3: 七月 | J3: 八月 | K3: 九月 | L3: 十月 | M3: 十一月 | N3: 十二月
A4: 建設門號數 | C4: 0 | D4: 1500 | E4: 10000 | F4: 0 | G4: 79800
A5: 月份 | B5: 2002-01-14T00:00:00.000 | C5: 2002-01-28T00:00:00.000 | D5: 2002-02-25T00:00:00.000 | E5: 2002-03-11T00:00:00.000 | F5: 2002-03-25T00:00:00.000 | G5: 2002-04-11T00:00:00.000 | H5: 2002-04-22T00:00:00.000 | I5: 2002-05-06T00:00:00.000 | J5: 2002-05-20T00:00:00.000 | K5: 2002-06-03T00:00:00.000 | L5: 2002-06-17T00:00:00.000 | M5: 2002-07-01T00:00:00.000 | N5: 2002-07-15T00:00:00.000 | O5: 2002-07-29T00:00:00.000 | P5: 2002-08-12T00:00:00.000 | Q5: 2002-08-26T00:00:00.000 | R5: 2002-09-09T00:00:00.000 | S5: 2002-09-23T00:00:00.000 | T5: 2002-10-07T00:00:00.000 | U5: 2002-10-21T00:00:00.000 | V5: 2002-11-04T00:00:00.000 | W5: 2002-11-18T00:00:00.000 | X5: 2002-12-02T00:00:00.000 | Y5: 2002-12-16T00:00:00.000 | Z5: 2002-12-30T00:00:00.000
A6: 北區現有設備數 | B6: 653985 | C6: 659664 | D6: 672532 | E6: 679704 | F6: 672532 | G6: 697611 | H6: 698934 | I6: 701038 | J6: 711072 | K6: 720497 | L6: 722653 | M6: 726314 | N6: 725528 | O6: 726169 | P6: 726153
A7: 中區現有設備數 | B7: 322856 | C7: 332736 | D7: 352013 | E7: 352904 | F7: 352013 | G7: 354175 | H7: 368468 | I7: 371692 | J7: 371714 | K7: 372600 | L7: 380611 | M7: 382094 | N7: 381202 | O7: 382018 | P7: 382061
A8: 南區現有設備數 | B8: 318770 | C8: 329733 | D8: 337988 | E8: 336514 | F8: 337988 | G8: 338759 | H8: 342527 | I8: 348800 | J8: 361003 | K8: 366338 | L8: 372742 | M8: 383413 | N8: 388023 | O8: 394065 | P8: 394704
A9: 北區現有用戶數 | B9: 438229 | C9: 471165 | D9: 492182 | E9: 511278 | F9: 492182 | G9: 550091 | H9: 560335 | I9: 574390 | J9: 592273 | K9: 611146 | L9: 625784 | M9: 640434 | N9: 656068 | O9: 665045 | P9: 665222
A10: 中區現有用戶數 | B10: 188991 | C10: 198879 | D10: 207476 | E10: 214469 | F10: 207476 | G10: 230829 | H10: 235581 | I10: 239795 | J10: 247302 | K10: 250116 | L10: 256702 | M10: 265324 | N10: 276954 | O10: 283667 | P10: 285168
A11: 南區現有用戶數 | B11: 215181 | C11: 231778 | D11: 240927 | E11: 248361 | F11: 240927 | G11: 256686 | H11: 262397 | I11: 270632 | J11: 278445 | K11: 285421 | L11: 291000 | M11: 299038 | N11: 309845 | O11: 323504 | P11: 326826
A12: 北區設備使用率 | B12: =R[-3]C/R[-6]C -> 0.67009029259080866 | C12: =R[-3]C/R[-6]C -> 0.71424998180892085 | D12: =R[-3]C/R[-6]C -> 0.73183432163822693 | E12: =R[-3]C/R[-6]C -> 0.75220684297870843 | F12: =R[-3]C/R[-6]C -> 0.73183432163822693 | G12: =R[-3]C/R[-6]C -> 0.78853544453857527 | H12: =R[-3]C/R[-6]C -> 0.80169944515505043 | I12: =R[-3]C/R[-6]C -> 0.81934217545981813 | J12: =R[-3]C/R[-6]C -> 0.83292971738445609 | K12: =R[-3]C/R[-6]C -> 0.84822837569066911 | L12: =R[-3]C/R[-6]C -> 0.86595364580234224 | M12: =R[-3]C/R[-6]C -> 0.881759128971767 | N12: =R[-3]C/R[-6]C -> 0.90426282652082346 | O12: =R[-3]C/R[-6]C -> 0.91582675658145696 | P12: =R[-3]C/R[-6]C -> 0.91609068612262157
A13: 中區設備使用率 | B13: =R[-3]C/R[-6]C -> 0.58537242609708351 | C13: =R[-3]C/R[-6]C -> 0.59770809290248128 | D13: =R[-3]C/R[-6]C -> 0.58939868698031039 | E13: =R[-3]C/R[-6]C -> 0.60772618049101168 | F13: =R[-3]C/R[-6]C -> 0.58939868698031039 | G13: =R[-3]C/R[-6]C -> 0.65173713559680946 | H13: =R[-3]C/R[-6]C -> 0.63935267105963067 | I13: =R[-3]C/R[-6]C -> 0.64514436684136323 | J13: =R[-3]C/R[-6]C -> 0.6653018180644259 | K13: =R[-3]C/R[-6]C -> 0.67127214170692429 | L13: =R[-3]C/R[-6]C -> 0.67444713894238473 | M13: =R[-3]C/R[-6]C -> 0.69439457306317298 | N13: =R[-3]C/R[-6]C -> 0.72652819240192867 | O13: =R[-3]C/R[-6]C -> 0.74254878042395911 | P13: =R[-3]C/R[-6]C -> 0.74639390045045162
A14: 南區設備使用率 | B14: =R[-3]C/R[-6]C -> 0.67503529190325318 | C14: =R[-3]C/R[-6]C -> 0.70292630704236458 | D14: =R[-3]C/R[-6]C -> 0.71282708261831784 | E14: =R[-3]C/R[-6]C -> 0.73804061643794905 | F14: =R[-3]C/R[-6]C -> 0.71282708261831784 | G14: =R[-3]C/R[-6]C -> 0.75772451802018548 | H14: =R[-3]C/R[-6]C -> 0.76606223742945811 | I14: =R[-3]C/R[-6]C -> 0.77589449541284405 | J14: =R[-3]C/R[-6]C -> 0.77130937970044566 | K14: =R[-3]C/R[-6]C -> 0.77911928328483526 | L14: =R[-3]C/R[-6]C -> 0.78070086011235651 | M14: =R[-3]C/R[-6]C -> 0.77993703917185908 | N14: =R[-3]C/R[-6]C -> 0.79852225254688514 | O14: =R[-3]C/R[-6]C -> 0.82094070775125927 | P14: =R[-3]C/R[-6]C -> 0.82802809193724913

Sheet: SDH-表
A1: 九十一年度同步數位階層SDH網路設備暨使用率統計表
A3: 月份 | C3: 一月 | D3: 二月 | E3: 三月 | F3: 四月 | G3: 五月 | H3: 六月 | I3: 七月 | J3: 八月 | K3: 九月 | L3: 十月 | M3: 十一月 | N3: 十二月
A4: 建設門號數 | C4: 0 | D4: 1500 | E4: 10000 | F4: 0 | G4: 79800
A5: 月份 | B5: 2002-01-14T00:00:00.000 | C5: 2002-01-28T00:00:00.000 | D5: 2002-02-25T00:00:00.000 | E5: 2002-03-11T00:00:00.000 | F5: 2002-03-25T00:00:00.000 | G5: 2002-04-11T00:00:00.000 | H5: 2002-04-22T00:00:00.000 | I5: 2002-05-06T00:00:00.000 | J5: 2002-05-20T00:00:00.000 | K5: 2002-06-03T00:00:00.000 | L5: 2002-06-17T00:00:00.000 | M5: 2002-07-01T00:00:00.000 | N5: 2002-07-15T00:00:00.000 | O5: 2002-07-29T00:00:00.000 | P5: 2002-08-12T00:00:00.000 | Q5: 2002-08-26T00:00:00.000 | R5: 2002-09-09T00:00:00.000 | S5: 2002-09-23T00:00:00.000 | T5: 2002-10-07T00:00:00.000 | U5: 2002-10-21T00:00:00.000 | V5: 2002-11-04T00:00:00.000 | W5: 2002-11-18T00:00:00.000 | X5: 2002-12-02T00:00:00.000 | Y5: 2002-12-16T00:00:00.000 | Z5: 2002-12-30T00:00:00.000
A6: 長途SDH現有設備數 | B6: 464 | C6: 480 | D6: 480 | E6: 480 | F6: 480 | G6: 480 | H6: 480 | I6: 480 | J6: 480 | K6: 480 | L6: 570 | M6: 570 | N6: 570 | O6: 570 | P6: 570
A7: 區域SDH現有設備數 | B7: 875 | C7: 875 | D7: 875 | E7: 875 | F7: 875 | G7: 875 | H7: 875 | I7: 875 | J7: 875 | K7: 875 | L7: 875 | M7: 875 | N7: 875 | O7: 875 | P7: 875
A8: 長途SDH現有使用數 | B8: 240 | C8: 247 | D8: 249 | E8: 250 | F8: 250 | G8: 254 | H8: 255 | I8: 258 | J8: 260 | K8: 264 | L8: 270 | M8: 274 | N8: 277 | O8: 279 | P8: 284
A9: 區域SDH現有使用數 | B9: 577 | C9: 583 | D9: 585 | E9: 586 | F9: 586 | G9: 589 | H9: 592 | I9: 594 | J9: 598 | K9: 603 | L9: 605 | M9: 608 | N9: 610 | O9: 612 | P9: 615
A10: 長途SDH設備使用率 | B10: =R[-2]C/R[-4]C -> 0.51724137931034486 | C10: =R[-2]C/R[-4]C -> 0.51458333333333328 | D10: =R[-2]C/R[-4]C -> 0.51875000000000004 | E10: =R[-2]C/R[-4]C -> 0.52083333333333337 | F10: =R[-2]C/R[-4]C -> 0.52083333333333337 | G10: =R[-2]C/R[-4]C -> 0.52916666666666667 | H10: =R[-2]C/R[-4]C -> 0.53125 | I10: =R[-2]C/R[-4]C -> 0.53749999999999998 | J10: =R[-2]C/R[-4]C -> 0.54166666666666663 | K10: =R[-2]C/R[-4]C -> 0.55000000000000004 | L10: =R[-2]C/R[-4]C -> 0.47368421052631576 | M10: =R[-2]C/R[-4]C -> 0.48070175438596491 | N10: =R[-2]C/R[-4]C -> 0.48596491228070177 | O10: =R[-2]C/R[-4]C -> 0.48947368421052634 | P10: =R[-2]C/R[-4]C -> 0.49824561403508771
A11: 區域SDH設備使用率 | B11: =R[-2]C/R[-4]C -> 0.65942857142857148 | C11: =R[-2]C/R[-4]C -> 0.66628571428571426 | D11: =R[-2]C/R[-4]C -> 0.66857142857142859 | E11: =R[-2]C/R[-4]C -> 0.66971428571428571 | F11: =R[-2]C/R[-4]C -> 0.66971428571428571 | G11: =R[-2]C/R[-4]C -> 0.67314285714285715 | H11: =R[-2]C/R[-4]C -> 0.6765714285714286 | I11: =R[-2]C/R[-4]C -> 0.67885714285714283 | J11: =R[-2]C/R[-4]C -> 0.68342857142857139 | K11: =R[-2]C/R[-4]C -> 0.68914285714285717 | L11: =R[-2]C/R[-4]C -> 0.69142857142857139 | M11: =R[-2]C/R[-4]C -> 0.69485714285714284 | N11: =R[-2]C/R[-4]C -> 0.69714285714285718 | O11: =R[-2]C/R[-4]C -> 0.6994285714285714 | P11: =R[-2]C/R[-4]C -> 0.70285714285714285

Sheet: ADSL-表
A1: 三區分公司九十一年度寬頻上網ADSL設備暨使用率統計表
A3: 月份 | C3: 一月 | D3: 二月 | E3: 三月 | F3: 四月 | G3: 五月 | H3: 六月 | I3: 七月 | J3: 八月 | K3: 九月 | L3: 十月 | M3: 十一月 | N3: 十二月
A4: 建設門號數 | C4: 0 | D4: 1500 | E4: 10000 | F4: 0 | G4: 79800
A5: 月份 | B5: 2002-01-14T00:00:00.000 | C5: 2002-01-28T00:00:00.000 | D5: 2002-02-25T00:00:00.000 | E5: 2002-03-11T00:00:00.000 | F5: 2002-03-25T00:00:00.000 | G5: 2002-04-11T00:00:00.000 | H5: 2002-04-22T00:00:00.000 | I5: 2002-05-06T00:00:00.000 | J5: 2002-05-20T00:00:00.000 | K5: 2002-06-03T00:00:00.000 | L5: 2002-06-17T00:00:00.000 | M5: 2002-07-01T00:00:00.000 | N5: 2002-07-15T00:00:00.000 | O5: 2002-07-29T00:00:00.000 | P5: 2002-08-12T00:00:00.000 | Q5: 2002-08-26T00:00:00.000 | R5: 2002-09-09T00:00:00.000 | S5: 2002-09-23T00:00:00.000 | T5: 2002-10-07T00:00:00.000 | U5: 2002-10-21T00:00:00.000 | V5: 2002-11-04T00:00:00.000 | W5: 2002-11-18T00:00:00.000 | X5: 2002-12-02T00:00:00.000 | Y5: 2002-12-16T00:00:00.000 | Z5: 2002-12-30T00:00:00.000
A6: 北區現有設備數 | B6: 582263 | C6: 633097 | D6: 672247 | E6: 685422 | F6: 685422 | G6: 717053 | H6: 730449 | I6: 749558 | J6: 765707 | K6: 787033 | L6: 788148 | M6: 799874 | N6: 845254 | O6: 891392 | P6: 908298
A7: 中區現有設備數 | B7: 350232 | C7: 361808 | D7: 381928 | E7: 383688 | F7: 383688 | G7: 417194 | H7: 438782 | I7: 488518 | J7: 498793 | K7: 504995 | L7: 518681 | M7: 524664 | N7: 535936 | O7: 537792 | P7: 540655
A8: 南區現有設備數 | B8: 311120 | C8: 321224 | D8: 334072 | E8: 333124 | F8: 333124 | G8: 348409 | H8: 361481 | I8: 366752 | J8: 376264 | K8: 381279 | L8: 400488 | M8: 412642 | N8: 427361 | O8: 438036 | P8: 443562
A9: 北區現有用戶數 | B9: 493818 | C9: 514120 | D9: 558011 | E9: 577030 | F9: 577030 | G9: 608469 | H9: 624903 | I9: 638880 | J9: 654324 | K9: 672112 | L9: 689043 | M9: 704900 | N9: 730222 | O9: 749227 | P9: 768904
A10: 中區現有用戶數 | B10: 207981 | C10: 211272 | D10: 227709 | E10: 234132 | F10: 234132 | G10: 236990 | H10: 243509 | I10: 248253 | J10: 254267 | K10: 257043 | L10: 264998 | M10: 273307 | N10: 286156 | O10: 292408 | P10: 300557
A11: 南區現有用戶數 | B11: 208630 | C11: 215385 | D11: 235944 | E11: 244039 | F11: 244039 | G11: 256669 | H11: 263464 | I11: 270854 | J11: 277674 | K11: 284727 | L11: 292386 | M11: 300009 | N11: 311835 | O11: 321090 | P11: 330140
A12: 北區設備使用率 | B12: =R[-3]C/R[-6]C -> 0.84810128756249326 | C12: =R[-3]C/R[-6]C -> 0.81207145192600816 | D12: =R[-3]C/R[-6]C -> 0.83006841235438755 | E12: =R[-3]C/R[-6]C -> 0.84186092655327671 | F12: =R[-3]C/R[-6]C -> 0.84186092655327671 | G12: =R[-3]C/R[-6]C -> 0.84856907369469203 | H12: =R[-3]C/R[-6]C -> 0.85550531248588202 | I12: =R[-3]C/R[-6]C -> 0.85234231373689562 | J12: =R[-3]C/R[-6]C -> 0.85453574278411981 | K12: =R[-3]C/R[-6]C -> 0.85398198042521722 | L12: =R[-3]C/R[-6]C -> 0.87425585042403209 | M12: =R[-3]C/R[-6]C -> 0.88126379904835006 | N12: =R[-3]C/R[-6]C -> 0.86390836363980528 | O12: =R[-3]C/R[-6]C -> 0.84051348901493395 | P12: =R[-3]C/R[-6]C -> 0.84653274586093996
A13: 中區設備使用率 | B13: =R[-3]C/R[-6]C -> 0.59383779894469957 | C13: =R[-3]C/R[-6]C -> 0.58393402025383634 | D13: =R[-3]C/R[-6]C -> 0.59620923315389285 | E13: =R[-3]C/R[-6]C -> 0.61021454932132357 | F13: =R[-3]C/R[-6]C -> 0.61021454932132357 | G13: =R[-3]C/R[-6]C -> 0.56805706697603509 | H13: =R[-3]C/R[-6]C -> 0.55496579166875581 | I13: =R[-3]C/R[-6]C -> 0.50817574787418274 | J13: =R[-3]C/R[-6]C -> 0.50976457167602596 | K13: =R[-3]C/R[-6]C -> 0.50900107921860616 | L13: =R[-3]C/R[-6]C -> 0.51090747492196553 | M13: =R[-3]C/R[-6]C -> 0.52091814952045501 | N13: =R[-3]C/R[-6]C -> 0.53393688798662531 | O13: =R[-3]C/R[-6]C -> 0.54371950493871235 | P13: =R[-3]C/R[-6]C -> 0.55591273547826248
A14: 南區設備使用率 | B14: =R[-3]C/R[-6]C -> 0.67057726922087946 | C14: =R[-3]C/R[-6]C -> 0.6705134112021518 | D14: =R[-3]C/R[-6]C -> 0.70626691252185159 | E14: =R[-3]C/R[-6]C -> 0.73257705839267062 | F14: =R[-3]C/R[-6]C -> 0.73257705839267062 | G14: =R[-3]C/R[-6]C -> 0.73668877669635402 | H14: =R[-3]C/R[-6]C -> 0.7288460527662588 | I14: =R[-3]C/R[-6]C -> 0.73852085332867989 | J14: =R[-3]C/R[-6]C -> 0.73797652711925665 | K14: =R[-3]C/R[-6]C -> 0.74676811468766968 | L14: =R[-3]C/R[-6]C -> 0.73007430934260198 | M14: =R[-3]C/R[-6]C -> 0.72704426597389504 | N14: =R[-3]C/R[-6]C -> 0.72967584781952499 | O14: =R[-3]C/R[-6]C -> 0.73302194340191218 | P14: =R[-3]C/R[-6]C -> 0.74429279334117893

Sheet: HiNet-表
A1: 數據分公司九十一年度HiNet寬頻接取埠設備暨使用率統計表
A3: 月份 | C3: 一月 | D3: 二月 | E3: 三月 | F3: 四月 | G3: 五月 | H3: 六月 | I3: 七月 | J3: 八月 | K3: 九月 | L3: 十月 | M3: 十一月 | N3: 十二月
A4: 建設門號數 | C4: 0 | D4: 1500 | E4: 10000 | F4: 0 | G4: 79800
A5: 月份 | B5: 2002-01-14T00:00:00.000 | C5: 2002-01-28T00:00:00.000 | D5: 2002-02-25T00:00:00.000 | E5: 2002-03-11T00:00:00.000 | F5: 2002-03-25T00:00:00.000 | G5: 2002-04-11T00:00:00.000 | H5: 2002-04-22T00:00:00.000 | I5: 2002-05-06T00:00:00.000 | J5: 2002-05-20T00:00:00.000 | K5: 2002-06-03T00:00:00.000 | L5: 2002-06-17T00:00:00.000 | M5: 2002-07-01T00:00:00.000 | N5: 2002-07-15T00:00:00.000 | O5: 2002-07-29T00:00:00.000 | P5: 2002-08-12T00:00:00.000 | Q5: 2002-08-26T00:00:00.000 | R5: 2002-09-09T00:00:00.000 | S5: 2002-09-23T00:00:00.000 | T5: 2002-10-07T00:00:00.000 | U5: 2002-10-21T00:00:00.000 | V5: 2002-11-04T00:00:00.000 | W5: 2002-11-18T00:00:00.000 | X5: 2002-12-02T00:00:00.000 | Y5: 2002-12-16T00:00:00.000 | Z5: 2002-12-30T00:00:00.000
A6: 現有設備數 | B6: 1000000 | C6: 1224000 | D6: 1624000 | E6: 1624000 | F6: 1624000 | G6: 1624000 | H6: 1624000 | I6: 1900000 | J6: 1900000 | K6: 1900000 | L6: 1900000 | M6: 1900000 | N6: 1900000 | O6: 1900000 | P6: 1900000
A7: 現有用戶數 | B7: 674204 | C7: 722960 | D7: 764672 | E7: 789657 | F7: 823967 | G7: 845129 | H7: 879364 | I7: 907383 | J7: 932395 | K7: 954391 | L7: 977720 | M7: 1005116 | N7: 1038348 | O7: 1070431 | P7: 1097578
A8: 設備使用率 | B8: =R[-1]C/R[-2]C -> 0.67420400000000003 | C8: =R[-1]C/R[-2]C -> 0.5906535947712418 | D8: =R[-1]C/R[-2]C -> 0.47085714285714286 | E8: =R[-1]C/R[-2]C -> 0.48624199507389165 | F8: =R[-1]C/R[-2]C -> 0.50736884236453206 | G8: =R[-1]C/R[-2]C -> 0.52039963054187188 | H8: =R[-1]C/R[-2]C -> 0.54148029556650246 | I8: =R[-1]C/R[-2]C -> 0.47756999999999999 | J8: =R[-1]C/R[-2]C -> 0.49073421052631577 | K8: =R[-1]C/R[-2]C -> 0.50231105263157894 | L8: =R[-1]C/R[-2]C -> 0.51458947368421049 | M8: =R[-1]C/R[-2]C -> 0.52900842105263157 | N8: =R[-1]C/R[-2]C -> 0.54649894736842108 | O8: =R[-1]C/R[-2]C -> 0.56338473684210522 | P8: =R[-1]C/R[-2]C -> 0.57767263157894733

Sheet: MBSW-表
A1: 長途及行動通信分公司九十一年度行動電話交換機設備暨使用率統計表
A3: 月份 | C3: 一月 | D3: 二月 | E3: 三月 | F3: 四月 | G3: 五月 | H3: 六月 | I3: 七月 | J3: 八月 | K3: 九月 | L3: 十月 | M3: 十一月 | N3: 十二月
A4: 建設門號數 | C4: 0 | D4: 1500 | E4: 10000 | F4: 0 | G4: 79800
A5: 月份 | B5: 2002-01-14T00:00:00.000 | C5: 2002-01-28T00:00:00.000 | D5: 2002-02-25T00:00:00.000 | E5: 2002-03-11T00:00:00.000 | F5: 2002-03-25T00:00:00.000 | G5: 2002-04-11T00:00:00.000 | H5: 2002-04-22T00:00:00.000 | I5: 2002-05-06T00:00:00.000 | J5: 2002-05-20T00:00:00.000 | K5: 2002-06-03T00:00:00.000 | L5: 2002-06-17T00:00:00.000 | M5: 2002-07-01T00:00:00.000 | N5: 2002-07-15T00:00:00.000 | O5: 2002-07-29T00:00:00.000 | P5: 2002-08-12T00:00:00.000 | Q5: 2002-08-26T00:00:00.000 | R5: 2002-09-09T00:00:00.000 | S5: 2002-09-23T00:00:00.000 | T5: 2002-10-07T00:00:00.000 | U5: 2002-10-21T00:00:00.000 | V5: 2002-11-04T00:00:00.000 | W5: 2002-11-18T00:00:00.000 | X5: 2002-12-02T00:00:00.000 | Y5: 2002-12-16T00:00:00.000 | Z5: 2002-12-30T00:00:00.000
A6: 現有設備數 | B6: 6500000 | C6: 6500000 | D6: 6500000 | E6: 6500000 | F6: 6500000 | G6: 6800000 | H6: 7500000 | I6: 7500000 | J6: 7500000 | K6: 7500000 | L6: 7500000 | M6: 7500000 | N6: 7500000 | O6: 7500000 | P6: 7500000
A7: 現有用戶數 | B7: 6216163 | C7: 6377293 | D7: 6465657 | E7: 6465657 | F7: 6465657 | G7: 6544309 | H7: 6577064 | I7: 6655753 | J7: 6704875 | K7: 6781496 | L7: 6902561 | M7: 6939719 | N7: 6983932 | O7: 7103734 | P7: 7116445
A8: 設備使用率 | B8: =R[-1]C/R[-2]C -> 0.95633276923076926 | C8: =R[-1]C/R[-2]C -> 0.98112200000000005 | D8: =R[-1]C/R[-2]C -> 0.99471646153846149 | E8: =R[-1]C/R[-2]C -> 0.99471646153846149 | F8: =R[-1]C/R[-2]C -> 0.99471646153846149 | G8: =R[-1]C/R[-2]C -> 0.96239838235294117 | H8: =R[-1]C/R[-2]C -> 0.87694186666666663 | I8: =R[-1]C/R[-2]C -> 0.88743373333333331 | J8: =R[-1]C/R[-2]C -> 0.89398333333333335 | K8: =R[-1]C/R[-2]C -> 0.90419946666666662 | L8: =R[-1]C/R[-2]C -> 0.92034146666666672 | M8: =R[-1]C/R[-2]C -> 0.92529586666666663 | N8: =R[-1]C/R[-2]C -> 0.93119093333333336 | O8: =R[-1]C/R[-2]C -> 0.94716453333333328 | P8: =R[-1]C/R[-2]C -> 0.94885933333333339

Sheet: MBBS-表
A1: 長途及行動通信分公司九十一年度行動電話基地台設備暨使用率統計表
A3: 月份 | C3: 一月 | D3: 二月 | E3: 三月 | F3: 四月 | G3: 五月 | H3: 六月 | I3: 七月 | J3: 八月 | K3: 九月 | L3: 十月 | M3: 十一月 | N3: 十二月
A4: 建設門號數 | C4: 0 | D4: 1500 | E4: 10000 | F4: 0 | G4: 79800
A5: 月份 | B5: 2002-01-14T00:00:00.000 | C5: 2002-01-28T00:00:00.000 | D5: 2002-02-25T00:00:00.000 | E5: 2002-03-11T00:00:00.000 | F5: 2002-03-25T00:00:00.000 | G5: 2002-04-11T00:00:00.000 | H5: 2002-04-22T00:00:00.000 | I5: 2002-05-06T00:00:00.000 | J5: 2002-05-20T00:00:00.000 | K5: 2002-06-03T00:00:00.000 | L5: 2002-06-17T00:00:00.000 | M5: 2002-07-01T00:00:00.000 | N5: 2002-07-15T00:00:00.000 | O5: 2002-07-29T00:00:00.000 | P5: 2002-08-12T00:00:00.000 | Q5: 2002-08-26T00:00:00.000 | R5: 2002-09-09T00:00:00.000 | S5: 2002-09-23T00:00:00.000 | T5: 2002-10-07T00:00:00.000 | U5: 2002-10-21T00:00:00.000 | V5: 2002-11-04T00:00:00.000 | W5: 2002-11-18T00:00:00.000 | X5: 2002-12-02T00:00:00.000 | Y5: 2002-12-16T00:00:00.000 | Z5: 2002-12-30T00:00:00.000
A6: 現有設備數 | B6: 5141 | C6: 5276 | D6: 5337 | E6: 5337 | F6: 5337 | G6: 5547 | H6: 5673 | I6: 5776 | J6: 5830 | K6: 5830 | L6: 5990 | M6: 6079 | N6: 6152 | O6: 6333 | P6: 6398
A7: 現有用戶數 | B7: 5127 | C7: 5263 | D7: 5298 | E7: 5298 | F7: 5298 | G7: 5538 | H7: 5661 | I7: 5758 | J7: 5821 | K7: 5821 | L7: 5981 | M7: 6070 | N7: 6144 | O7: 6329 | P7: 6389
A8: 設備使用率 | B8: =R[-1]C/R[-2]C -> 0.99727679439797701 | C8: =R[-1]C/R[-2]C -> 0.99753601213040177 | D8: =R[-1]C/R[-2]C -> 0.99269252388982576 | E8: =R[-1]C/R[-2]C -> 0.99269252388982576 | F8: =R[-1]C/R[-2]C -> 0.99269252388982576 | G8: =R[-1]C/R[-2]C -> 0.99837750135208225 | H8: =R[-1]C/R[-2]C -> 0.99788471708090953 | I8: =R[-1]C/R[-2]C -> 0.99688365650969524 | J8: =R[-1]C/R[-2]C -> 0.99845626072041171 | K8: =R[-1]C/R[-2]C -> 0.99845626072041171 | L8: =R[-1]C/R[-2]C -> 0.99849749582637726 | M8: =R[-1]C/R[-2]C -> 0.99851949333772005 | N8: =R[-1]C/R[-2]C -> 0.99869960988296491 | O8: =R[-1]C/R[-2]C -> 0.99936838780988468 | P8: =R[-1]C/R[-2]C -> 0.99859331040950294

Sheet: FIB-T-表
A1: 三區分公司九十一年度局間中繼光纜暨使用率統計表
A3: 月份 | C3: 一月 | D3: 二月 | E3: 三月 | F3: 四月 | G3: 五月 | H3: 六月 | I3: 七月 | J3: 八月 | K3: 九月 | L3: 十月 | M3: 十一月 | N3: 十二月
A4: 建設門號數 | C4: 0 | D4: 1500 | E4: 10000 | F4: 0 | G4: 79800
A5: 月份 | B5: 2002-01-14T00:00:00.000 | C5: 2002-01-28T00:00:00.000 | D5: 2002-02-25T00:00:00.000 | E5: 2002-03-11T00:00:00.000 | F5: 2002-03-25T00:00:00.000 | G5: 2002-04-11T00:00:00.000 | H5: 2002-04-22T00:00:00.000 | I5: 2002-05-06T00:00:00.000 | J5: 2002-05-20T00:00:00.000 | K5: 2002-06-03T00:00:00.000 | L5: 2002-06-17T00:00:00.000 | M5: 2002-07-01T00:00:00.000 | N5: 2002-07-15T00:00:00.000 | O5: 2002-07-29T00:00:00.000 | P5: 2002-08-12T00:00:00.000 | Q5: 2002-08-26T00:00:00.000 | R5: 2002-09-09T00:00:00.000 | S5: 2002-09-23T00:00:00.000 | T5: 2002-10-07T00:00:00.000 | U5: 2002-10-21T00:00:00.000 | V5: 2002-11-04T00:00:00.000 | W5: 2002-11-18T00:00:00.000 | X5: 2002-12-02T00:00:00.000 | Y5: 2002-12-16T00:00:00.000 | Z5: 2002-12-30T00:00:00.000
A6: 北區光纜心公里 | B6: 235040 | C6: 235040 | D6: 243179 | E6: 243179 | F6: 236929 | G6: 236929 | H6: 241215 | I6: 240062 | J6: 240857 | K6: 241212 | L6: 244610 | M6: 244326 | N6: 248124 | O6: 252684 | P6: 254696
A7: 中區光纜心公里 | B7: 209566 | C7: 209566 | D7: 214434 | E7: 214434 | F7: 210339 | G7: 210339 | H7: 211999 | I7: 213976 | J7: 219590 | K7: 222537 | L7: 231558 | M7: 234656 | N7: 238312 | O7: 239529 | P7: 241114
A8: 南區光纜心公里 | B8: 221353 | C8: 221353 | D8: 221949 | E8: 221949 | F8: 200116 | G8: 200116 | H8: 203163 | I8: 203561 | J8: 205147 | K8: 204620 | L8: 205660 | M8: 209555 | N8: 211274 | O8: 203096 | P8: 204822
A9: 北區現用心公里 | B9: 97624 | C9: 97624 | D9: 98377 | E9: 98377 | F9: 99552 | G9: 99552 | H9: 101001 | I9: 101331 | J9: 102559 | K9: 108557 | L9: 110634 | M9: 110629 | N9: 110779 | O9: 113609 | P9: 114541
A10: 中區現用心公里 | B10: 71722 | C10: 71722 | D10: 73768 | E10: 73768 | F10: 76160 | G10: 76160 | H10: 72631 | I10: 73330 | J10: 81588 | K10: 84546 | L10: 88777 | M10: 88555 | N10: 90800 | O10: 91716 | P10: 91630
A11: 南區現用心公里 | B11: 70102 | C11: 70102 | D11: 73768 | E11: 73768 | F11: 73744 | G11: 73744 | H11: 77336 | I11: 80381 | J11: 81192 | K11: 81604 | L11: 80724 | M11: 78669 | N11: 80066 | O11: 79178 | P11: 78072
A12: 北區光纜使用率 | B12: =R[-3]C/R[-6]C -> 0.41535057862491492 | C12: =R[-3]C/R[-6]C -> 0.41535057862491492 | D12: =R[-3]C/R[-6]C -> 0.40454562277170314 | E12: =R[-3]C/R[-6]C -> 0.40454562277170314 | F12: =R[-3]C/R[-6]C -> 0.42017650857429861 | G12: =R[-3]C/R[-6]C -> 0.42017650857429861 | H12: =R[-3]C/R[-6]C -> 0.41871774143399043 | I12: =R[-3]C/R[-6]C -> 0.42210345660704318 | J12: =R[-3]C/R[-6]C -> 0.4258086748568653 | K12: =R[-3]C/R[-6]C -> 0.45004809047642735 | L12: =R[-3]C/R[-6]C -> 0.45228731450063364 | M12: =R[-3]C/R[-6]C -> 0.45279258040486892 | N12: =R[-3]C/R[-6]C -> 0.44646628298753849 | O12: =R[-3]C/R[-6]C -> 0.44960899779962327 | P12: =R[-3]C/R[-6]C -> 0.4497165247981908
A13: 中區光纜使用率 | B13: =R[-3]C/R[-6]C -> 0.34224063063664906 | C13: =R[-3]C/R[-6]C -> 0.34224063063664906 | D13: =R[-3]C/R[-6]C -> 0.3440126099405878 | E13: =R[-3]C/R[-6]C -> 0.3440126099405878 | F13: =R[-3]C/R[-6]C -> 0.36208216260417708 | G13: =R[-3]C/R[-6]C -> 0.36208216260417708 | H13: =R[-3]C/R[-6]C -> 0.3426006726446823 | I13: =R[-3]C/R[-6]C -> 0.34270198526937601 | J13: =R[-3]C/R[-6]C -> 0.37154697390591557 | K13: =R[-3]C/R[-6]C -> 0.37991884495611966 | L13: =R[-3]C/R[-6]C -> 0.38338990663246358 | M13: =R[-3]C/R[-6]C -> 0.37738221055502524 | N13: =R[-3]C/R[-6]C -> 0.38101312565040785 | O13: =R[-3]C/R[-6]C -> 0.38290144408401489 | P13: =R[-3]C/R[-6]C -> 0.38002770473717828
A14: 南區光纜使用率 | B14: =R[-3]C/R[-6]C -> 0.31669776330115246 | C14: =R[-3]C/R[-6]C -> 0.31669776330115246 | D14: =R[-3]C/R[-6]C -> 0.33236464232774193 | E14: =R[-3]C/R[-6]C -> 0.33236464232774193 | F14: =R[-3]C/R[-6]C -> 0.36850626636550798 | G14: =R[-3]C/R[-6]C -> 0.36850626636550798 | H14: =R[-3]C/R[-6]C -> 0.38065986424693471 | I14: =R[-3]C/R[-6]C -> 0.39487426373421236 | J14: =R[-3]C/R[-6]C -> 0.39577473713970956 | K14: =R[-3]C/R[-6]C -> 0.39880754569445803 | L14: =R[-3]C/R[-6]C -> 0.39251191286589515 | M14: =R[-3]C/R[-6]C -> 0.37540979695068122 | N14: =R[-3]C/R[-6]C -> 0.37896759658074347 | O14: =R[-3]C/R[-6]C -> 0.38985504392011661 | P14: =R[-3]C/R[-6]C -> 0.38116999150481884

Sheet: FIB-S-表
A1: 三區分公司九十一年度用戶迴路光纜暨使用率統計表
A3: 月份 | C3: 一月 | D3: 二月 | E3: 三月 | F3: 四月 | G3: 五月 | H3: 六月 | I3: 七月 | J3: 八月 | K3: 九月 | L3: 十月 | M3: 十一月 | N3: 十二月
A4: 建設門號數 | C4: 0 | D4: 1500 | E4: 10000 | F4: 0 | G4: 79800
A5: 月份 | B5: 2002-01-14T00:00:00.000 | C5: 2002-01-28T00:00:00.000 | D5: 2002-02-25T00:00:00.000 | E5: 2002-03-11T00:00:00.000 | F5: 2002-03-25T00:00:00.000 | G5: 2002-04-11T00:00:00.000 | H5: 2002-04-22T00:00:00.000 | I5: 2002-05-06T00:00:00.000 | J5: 2002-05-20T00:00:00.000 | K5: 2002-06-03T00:00:00.000 | L5: 2002-06-17T00:00:00.000 | M5: 2002-07-01T00:00:00.000 | N5: 2002-07-15T00:00:00.000 | O5: 2002-07-29T00:00:00.000 | P5: 2002-08-12T00:00:00.000 | Q5: 2002-08-26T00:00:00.000 | R5: 2002-09-09T00:00:00.000 | S5: 2002-09-23T00:00:00.000 | T5: 2002-10-07T00:00:00.000 | U5: 2002-10-21T00:00:00.000 | V5: 2002-11-04T00:00:00.000 | W5: 2002-11-18T00:00:00.000 | X5: 2002-12-02T00:00:00.000 | Y5: 2002-12-16T00:00:00.000 | Z5: 2002-12-30T00:00:00.000
A6: 北區光纜心公里 | B6: 254173 | C6: 254173 | D6: 255048 | E6: 255048 | F6: 257002 | G6: 257002 | H6: 227289 | I6: 230648 | J6: 232245 | K6: 232936 | L6: 233534 | M6: 234676 | N6: 237053 | O6: 239142 | P6: 239468
A7: 中區光纜心公里 | B7: 285393 | C7: 285393 | D7: 282410 | E7: 282410 | F7: 283573 | G7: 283573 | H7: 288291 | I7: 283044 | J7: 204997 | K7: 205057 | L7: 205498 | M7: 211446 | N7: 231498 | O7: 232311 | P7: 231775
A8: 南區光纜心公里 | B8: 165802 | C8: 165802 | D8: 164547 | E8: 164547 | F8: 167298 | G8: 167298 | H8: 135548 | I8: 139534 | J8: 139522 | K8: 141056 | L8: 142093 | M8: 144468 | N8: 145488 | O8: 145821 | P8: 146903
A9: 北區現用心公里 | B9: 35162 | C9: 35162 | D9: 35917 | E9: 35917 | F9: 34487 | G9: 34487 | H9: 37376 | I9: 39251 | J9: 39887 | K9: 40679 | L9: 41577 | M9: 42119 | N9: 42633 | O9: 43532 | P9: 43440
A10: 中區現用心公里 | B10: 27182 | C10: 27182 | D10: 27640 | E10: 27640 | F10: 31307 | G10: 31307 | H10: 27647 | I10: 27172 | J10: 30568 | K10: 30881 | L10: 31134 | M10: 31305 | N10: 33224 | O10: 33612 | P10: 34131
A11: 南區現用心公里 | B11: 21944 | C11: 21944 | D11: 22242 | E11: 22242 | F11: 22918 | G11: 22918 | H11: 21038 | I11: 21449 | J11: 22705 | K11: 24363 | L11: 26114 | M11: 26546 | N11: 26809 | O11: 27131 | P11: 27573
A12: 北區光纜使用率 | B12: =R[-3]C/R[-6]C -> 0.1383388479500183 | C12: =R[-3]C/R[-6]C -> 0.1383388479500183 | D12: =R[-3]C/R[-6]C -> 0.14082447225620276 | E12: =R[-3]C/R[-6]C -> 0.14082447225620276 | F12: =R[-3]C/R[-6]C -> 0.13418961720142256 | G12: =R[-3]C/R[-6]C -> 0.13418961720142256 | H12: =R[-3]C/R[-6]C -> 0.164442625907985 | I12: =R[-3]C/R[-6]C -> 0.17017706635219035 | J12: =R[-3]C/R[-6]C -> 0.17174535512066999 | K12: =R[-3]C/R[-6]C -> 0.17463595150599306 | L12: =R[-3]C/R[-6]C -> 0.17803403358825695 | M12: =R[-3]C/R[-6]C -> 0.17947723670081303 | N12: =R[-3]C/R[-6]C -> 0.17984585725555044 | O12: =R[-3]C/R[-6]C -> 0.18203410525963654 | P12: =R[-3]C/R[-6]C -> 0.18140210800608014
A13: 中區光纜使用率 | B13: =R[-3]C/R[-6]C -> 9.5244101992690774E-2 | C13: =R[-3]C/R[-6]C -> 9.5244101992690774E-2 | D13: =R[-3]C/R[-6]C -> 9.787188838922134E-2 | E13: =R[-3]C/R[-6]C -> 9.787188838922134E-2 | F13: =R[-3]C/R[-6]C -> 0.11040190709270628 | G13: =R[-3]C/R[-6]C -> 0.11040190709270628 | H13: =R[-3]C/R[-6]C -> 9.5899629194112893E-2 | I13: =R[-3]C/R[-6]C -> 9.5999208603609332E-2 | J13: =R[-3]C/R[-6]C -> 0.14911437728356999 | K13: =R[-3]C/R[-6]C -> 0.15059715103605339 | L13: =R[-3]C/R[-6]C -> 0.1515051241374612 | M13: =R[-3]C/R[-6]C -> 0.14805198490394711 | N13: =R[-3]C/R[-6]C -> 0.14351743859558183 | O13: =R[-3]C/R[-6]C -> 0.144685357129021 | P13: =R[-3]C/R[-6]C -> 0.14725919534030849
A14: 南區光纜使用率 | B14: =R[-3]C/R[-6]C -> 0.13235063509487219 | C14: =R[-3]C/R[-6]C -> 0.13235063509487219 | D14: =R[-3]C/R[-6]C -> 0.1351711061277325 | E14: =R[-3]C/R[-6]C -> 0.1351711061277325 | F14: =R[-3]C/R[-6]C -> 0.13698908534471421 | G14: =R[-3]C/R[-6]C -> 0.13698908534471421 | H14: =R[-3]C/R[-6]C -> 0.15520701153834804 | I14: =R[-3]C/R[-6]C -> 0.15371880688577694 | J14: =R[-3]C/R[-6]C -> 0.16273419245710355 | K14: =R[-3]C/R[-6]C -> 0.17271863656987296 | L14: =R[-3]C/R[-6]C -> 0.18378104480868163 | M14: =R[-3]C/R[-6]C -> 0.18375003460974057 | N14: =R[-3]C/R[-6]C -> 0.18426949301660617 | O14: =R[-3]C/R[-6]C -> 0.18605687795310688 | P14: =R[-3]C/R[-6]C -> 0.18769528192072321

Sheet: WIRE-表
A1: 三區分公司九十一年度市話線路暨使用率統計表
A3: 月份 | C3: 一月 | D3: 二月 | E3: 三月 | F3: 四月 | G3: 五月 | H3: 六月 | I3: 七月 | J3: 八月 | K3: 九月 | L3: 十月 | M3: 十一月 | N3: 十二月
A4: 建設門號數 | C4: 0 | D4: 1500 | E4: 10000 | F4: 0 | G4: 79800
A5: 月份 | B5: 2002-01-14T00:00:00.000 | C5: 2002-01-28T00:00:00.000 | D5: 2002-02-25T00:00:00.000 | E5: 2002-03-11T00:00:00.000 | F5: 2002-03-25T00:00:00.000 | G5: 2002-04-11T00:00:00.000 | H5: 2002-04-22T00:00:00.000 | I5: 2002-05-06T00:00:00.000 | J5: 2002-05-20T00:00:00.000 | K5: 2002-06-03T00:00:00.000 | L5: 2002-06-17T00:00:00.000 | M5: 2002-07-01T00:00:00.000 | N5: 2002-07-15T00:00:00.000 | O5: 2002-07-29T00:00:00.000 | P5: 2002-08-12T00:00:00.000 | Q5: 2002-08-26T00:00:00.000 | R5: 2002-09-09T00:00:00.000 | S5: 2002-09-23T00:00:00.000 | T5: 2002-10-07T00:00:00.000 | U5: 2002-10-21T00:00:00.000 | V5: 2002-11-04T00:00:00.000 | W5: 2002-11-18T00:00:00.000 | X5: 2002-12-02T00:00:00.000 | Y5: 2002-12-16T00:00:00.000 | Z5: 2002-12-30T00:00:00.000
A6: 北區現有設備數 | B6: 13653500 | C6: 13653500 | D6: 13660700 | E6: 13660700 | F6: 13696400 | G6: 13696400 | H6: 13680600 | I6: 13697500 | J6: 13678400 | K6: 13678400 | L6: 13703600 | M6: 13705200 | N6: 11746200 | O6: 11759400 | P6: 11775200
A7: 中區現有設備數 | B7: 6475100 | C7: 6475100 | D7: 6475100 | E7: 6475100 | F7: 6475100 | G7: 6475100 | H7: 6475100 | I7: 6477960 | J7: 6508300 | K7: 6508300 | L7: 6508300 | M7: 6510900 | N7: 5183700 | O7: 5185500 | P7: 5185500
A8: 南區現有設備數 | B8: 7911500 | C8: 7911500 | D8: 7915650 | E8: 7915650 | F8: 7916000 | G8: 7916000 | H8: 7926000 | I8: 7931000 | J8: 7925600 | K8: 7931600 | L8: 7931600 | M8: 7931600 | N8: 6315100 | O8: 6317300 | P8: 6324000
A9: 北區現有用戶數 | B9: 7289811 | C9: 7289811 | D9: 7287918 | E9: 7287918 | F9: 7308741 | G9: 7308741 | H9: 7312854 | I9: 7312643 | J9: 7303078 | K9: 7303078 | L9: 7304084 | M9: 7309686 | N9: 7315673 | O9: 7322644 | P9: 7324514
A10: 中區現有用戶數 | B10: 2961063 | C10: 2961063 | D10: 2961711 | E10: 2961711 | F10: 2961711 | G10: 2961711 | H10: 2961711 | I10: 2963019 | J10: 2967785 | K10: 2968436 | L10: 2968436 | M10: 2968970 | N10: 2954709 | O10: 2960921 | P10: 2961135
A11: 南區現有用戶數 | B11: 3605939 | C11: 3605939 | D11: 3650178 | E11: 3650178 | F11: 3622478 | G11: 3622478 | H11: 3623241 | I11: 3624658 | J11: 3627814 | K11: 3632753 | L11: 3632753 | M11: 3632753 | N11: 3645051 | O11: 3648435 | P11: 3652555
A12: 北區設備使用率 | B12: =R[-3]C/R[-6]C -> 0.53391518658219506 | C12: =R[-3]C/R[-6]C -> 0.53391518658219506 | D12: =R[-3]C/R[-6]C -> 0.53349520888387858 | E12: =R[-3]C/R[-6]C -> 0.53349520888387858 | F12: =R[-3]C/R[-6]C -> 0.53362496714465113 | G12: =R[-3]C/R[-6]C -> 0.53362496714465113 | H12: =R[-3]C/R[-6]C -> 0.53454190605675189 | I12: =R[-3]C/R[-6]C -> 0.5338669830260997 | J12: =R[-3]C/R[-6]C -> 0.5339131769797637 | K12: =R[-3]C/R[-6]C -> 0.5339131769797637 | L12: =R[-3]C/R[-6]C -> 0.53300475787384338 | M12: =R[-3]C/R[-6]C -> 0.53335128272480514 | N12: =R[-3]C/R[-6]C -> 0.62281188809998123 | O12: =R[-3]C/R[-6]C -> 0.62270558021667777 | P12: =R[-3]C/R[-6]C -> 0.62202884027447514
A13: 中區設備使用率 | B13: =R[-3]C/R[-6]C -> 0.45729996447931304 | C13: =R[-3]C/R[-6]C -> 0.45729996447931304 | D13: =R[-3]C/R[-6]C -> 0.45740004015382002 | E13: =R[-3]C/R[-6]C -> 0.45740004015382002 | F13: =R[-3]C/R[-6]C -> 0.45740004015382002 | G13: =R[-3]C/R[-6]C -> 0.45740004015382002 | H13: =R[-3]C/R[-6]C -> 0.45740004015382002 | I13: =R[-3]C/R[-6]C -> 0.45740001481948023 | J13: =R[-3]C/R[-6]C -> 0.45600003072999096 | K13: =R[-3]C/R[-6]C -> 0.45610005685048322 | L13: =R[-3]C/R[-6]C -> 0.45610005685048322 | M13: =R[-3]C/R[-6]C -> 0.45599993856456095 | N13: =R[-3]C/R[-6]C -> 0.56999999999999995 | O13: =R[-3]C/R[-6]C -> 0.57100009642271721 | P13: =R[-3]C/R[-6]C -> 0.5710413653456754
A14: 南區設備使用率 | B14: =R[-3]C/R[-6]C -> 0.45578449093092333 | C14: =R[-3]C/R[-6]C -> 0.45578449093092333 | D14: =R[-3]C/R[-6]C -> 0.46113433514619773 | E14: =R[-3]C/R[-6]C -> 0.46113433514619773 | F14: =R[-3]C/R[-6]C -> 0.4576147043961597 | G14: =R[-3]C/R[-6]C -> 0.4576147043961597 | H14: =R[-3]C/R[-6]C -> 0.45713361090083271 | I14: =R[-3]C/R[-6]C -> 0.45702408271340311 | J14: =R[-3]C/R[-6]C -> 0.45773367316039165 | K14: =R[-3]C/R[-6]C -> 0.45801011145292247 | L14: =R[-3]C/R[-6]C -> 0.45801011145292247 | M14: =R[-3]C/R[-6]C -> 0.45801011145292247 | N14: =R[-3]C/R[-6]C -> 0.57719608557267499 | O14: =R[-3]C/R[-6]C -> 0.57753074889588907 | P14: =R[-3]C/R[-6]C -> 0.57757036685641994

Sheet: MARI-表
A1: 九十一年度國內國際海纜頻寬暨使用率統計表
A3: 月份 | B3: 一月 | C3: 二月 | D3: 三月 | E3: 四月 | F3: 五月 | G3: 六月 | H3: 七月 | I3: 八月 | J3: 九月 | K3: 十月 | L3: 十一月 | M3: 十二月
A4: 國內海纜頻寬總容量 | B4: 5825 | C4: 5825 | D4: 5825 | E4: 10665 | F4: 10665 | G4: 10665 | H4: ='910826'!R[37]C -> 10665
A5: 國際海纜頻寬總容量 | B5: 28864 | C5: 28864 | D5: 28864 | E5: 28864 | F5: 28864 | G5: 28864 | H5: ='910826'!R[37]C -> 28864
A6: 國內海纜頻寬使用量 | B6: 1805 | C6: 1850 | D6: 1860 | E6: 2825 | F6: 3570 | G6: 3600 | H6: ='910826'!R[35]C[1] -> 3610
A7: 國際海纜頻寬使用量 | B7: 8682 | C7: 8932 | D7: 9144 | E7: 9892 | F7: 9888 | G7: 10506 | H7: ='910826'!R[35]C[1] -> 10774
A8: 國內海纜頻寬使用率 | B8: =R[-2]C/R[-4]C -> 0.30987124463519311 | C8: =R[-2]C/R[-4]C -> 0.31759656652360513 | D8: =R[-2]C/R[-4]C -> 0.31931330472103003 | E8: =R[-2]C/R[-4]C -> 0.26488513830285981 | F8: =R[-2]C/R[-4]C -> 0.33473980309423346 | G8: =R[-2]C/R[-4]C -> 0.33755274261603374 | H8: =R[-2]C/R[-4]C -> 0.33849038912330054
A9: 國際海纜頻寬使用率 | B9: =R[-2]C/R[-4]C -> 0.30078991130820398 | C9: =R[-2]C/R[-4]C -> 0.30945121951219512 | D9: =R[-2]C/R[-4]C -> 0.31679600886917958 | E9: =R[-2]C/R[-4]C -> 0.34271064301552107 | F9: =R[-2]C/R[-4]C -> 0.34257206208425722 | G9: =R[-2]C/R[-4]C -> 0.36398281596452325 | H9: =R[-2]C/R[-4]C -> 0.3732677383592018