Sheet: EverythingTests
A6: DATA SECTION | B6: INTEGRAL | C6: DOUBLE | D6: BLANK | E6: STRING | F6: REF | G6: AREA (rows) | K6: AREA (cols) | P6: AREA (AREA) | T6: FINANCE DATA | AA6: ERRORS | AL6: IRR/NPV
B7: 0 | C7: 0 | E7: ="" ->  | F7: =RC[-4] -> 0 | G7: 1 | H7: 2 | I7: 3 | J7: 4 | K7: 1 | L7: 1.0009999999999999 | M7: alphanum | N7: blanksIncl | O7: E8 | P7: 1 | Q7: 2 | R7: 3 | S7: 4 | T7: r | U7: n | V7: y | W7: p | X7: t | Y7: f | AA7: #NULL! | AC7: 0 | AD7: 1 | AE7: 2 | AF7: 3 | AG7: 4 | AH7: 5 | AI7: 6 | AJ7: 7 | AK7: 8 | AL7: -70000
B8: 1 | C8: 1.0000000000000001E-5 | E8: nospaces | F8: =RC[-4] -> 1 | G8: 1.0009999999999999 | H8: 2.9990000000000001 | I8: 3.5 | J8: 4.5 | K8: 2 | L8: 2.9998999999999998 | M8: 3 | O8: 545 | P8: 9999.9999000000007 | Q8: 23.333300000000001 | R8: =2/3 -> 1899-12-31T16:00:00.000 | S8: 1000.001 | T8: 1 | U8: 10 | V8: 100 | W8: 10000 | X8: 0 | AA8: #DIV/0! | AC8: 8 | AD8: 9 | AE8: 10 | AF8: 11 | AG8: 12 | AH8: 13 | AI8: 14 | AJ8: 15 | AK8: 16 | AL8: 12000
B9: 2 | C9: 1.1000000000000001 | E9: sp ace s | F9: =R[2]C[-4] -> 9999999999 | G9: 2.3456000000000001 | H9: 3.4567000000000001 | I9: 5.6788999999999996 | J9: 6.7889999999999997 | K9: 3 | L9: 3.5 | M9: ric | N9: 345 | O9: 454 | P9: refsIncl | Q9: =R[-2]C[-9] -> 2 | R9: =R[-1]C[-9] -> 3.5 | S9: =R[-2]C[-14] ->  | T9: 1 | U9: 10 | V9: 100 | W9: 10000 | X9: 1 | AA9: #VALUE! | AC9: 16 | AD9: 17 | AE9: 18 | AF9: 19 | AG9: 20 | AH9: 21 | AI9: 22 | AJ9: 23 | AK9: 24 | AL9: 15000
B10: 534 | C10: 1.0000100000000001 | E10: endsWithSpace | F10: =R[-2]C[-3] -> 1.0000000000000001E-5 | G10: alphanum | H10: 3 | I10: ric | J10: row | K10: 4 | L10: 4.5 | M10: col | N10: 1.0000000000000001E-5 | O10: 0 | P10: blanksIncl | S10: endarea | T10: 2 | U10: 12 | V10: 120 | W10: 12000 | X10: 0 | AA10: #REF! | AC10: 24 | AD10: 25 | AE10: 26 | AF10: 27 | AG10: 28 | AH10: 29 | AI10: 30 | AJ10: 31 | AK10: 32 | AL10: 18000
B11: 9999999999 | C11: 2.9999899999999999 | E11: beginsWithSpace | F11: =R[-4]C[-2] -> 0 | G11: blanksIncl | I11: 345 | J11: 1.0000000000000001E-5 | T11: 2 | U11: 12 | V11: 120 | W11: 12000 | X11: 1 | AA11: #NAME? | AC11: 32 | AD11: 33 | AE11: 34 | AF11: 35 | AG11: 36 | AH11: 37 | AI11: 38 | AJ11: 39 | AK11: 40 | AL11: 12000
B12: -9999999999 | C12: 999999.99999000004 | E12: non-numeric | F12: =R[-3]C[-1] -> sp ace s | G12: E8 | H12: 545 | I12: 454 | J12: 0 | T12: 0.66666666666666663 | U12: 23 | V12: 133.33000000000001 | W12: 34307 | X12: 0 | AA12: #NUM! | AC12: 40 | AD12: 41 | AE12: 42 | AF12: 43 | AG12: 44 | AH12: 45 | AI12: 46 | AJ12: 47 | AK12: 48 | AL12: 26000
B13: -534 | C13: -999999.99999000004 | E13: ="0" -> 0 | F13: =R[4]C[-1] -> 2.99999 | T13: 0.66666666666666663 | U13: 23 | V13: 133.33000000000001 | W13: 34307 | X13: 1 | AA13: #N/A
B14: -2 | C14: -2.9999899999999999 | E14: ="0.000001" -> 0.000001 | F14: =R[5]C[-1] -> alph4Num3ric | T14: 0 | U14: 1 | V14: 100 | W14: 2300 | X14: 0
B15: -1 | C15: -1.0000100000000001 | E15: ="1" -> 1 | T15: 0 | U15: 1 | V15: 100 | W15: 2300 | X15: 1
B16: 1 | C16: -1.1000000000000001 | E16: ="1.1" -> 1.1 | T16: 0 | U16: 12 | V16: 120 | W16: 12000 | X16: 0
B17: 0 | C17: -1.0000000000000001E-5 | E17: ="2.99999" -> 2.99999 | T17: 0 | U17: 12 | V17: 120 | W17: 12000 | X17: 1
B18: ="TRUE" -> TRUE | E18: ="99999999" -> 99999999 | T18: 2.3332999999999999 | U18: 4 | V18: 334.5 | W18: 14323.45 | X18: 0
B19: ="FALSE" -> FALSE | E19: alph4Num3ric | T19: 2.3332999999999999 | U19: 4 | V19: 334.5 | W19: 14323.45 | X19: 1
C20: 2000-12-25T00:00:00.000 | F20: =R[-13]C[-2] -> 0
B23: Add | C23: FORMULA | D23: =0+0 -> 0 | E23: =999999+1.001 -> 1000000.001 | F23: =-8888+8887.9 -> -0.1000000000003638 | G23: =R[-14]C[-5]+R[-14]C[-4]+R[-13]C[-1] -> 3.1000100000000002 | H23: =R[-16]C[-6]+R[-16]C[-5]+R[-16]C[-4]+R[-16]C[-2] -> 0 | I23: =R[-16]C[-7]+R[-16]C[-6]+R[-16]C[-5]+R[-16]C[-4] -> #VALUE! | J23: =R[-16]C[-6]+R[-15]C[-6] -> 0 | K23: =R[-16]C[-8]+R[-16]C[-4]:R[-16]C[-1] -> #VALUE!
C24: EXPECTED VALUE | D24: 0 | E24: 1000000.001 | F24: -0.1000000000003638 | G24: 3.1000100000000002 | H24: 0 | I24: #VALUE! | J24: 0 | K24: #VALUE!
B27: ConcatEval | C27: FORMULA | D27: =0&1 -> 01 | E27: =2&"hello world" -> 2hello world | F27: ="its "&(2<3)&" blue" -> its TRUE blue | G27: =R[-18]C[-1]&R[-20]C[-5]&R[-20]C[-3]&R[-8]C[-2] -> 99999999990alph4Num3ric | H27: =R[-20]C[3]:R[-17]C[4]&R[-20]C[-4]&R[-20]C[-2] -> #VALUE! | I27: =R[-20]C[7]:R[-17]C[10]&"test" -> #VALUE!
C28: EXPECTED VALUE | D28: 01 | E28: 2hello world | F28: its TRUE blue | G28: 99999999990alph4Num3ric | H28: #VALUE! | I28: #VALUE!
B31: DivideEval | C31: FORMULA | D31: =0/1 -> 0 | E31: =R[-20]C[-3]/R[-19]C[-3] -> -1 | F31: =R[-18]C[-3]/R[-14]C[-3] -> 99999999999 | G31: =R[-21]C[-2]/R[-24]C[-3] -> #VALUE! | H31: =R[-22]C[-3]/R[-23]C[-5] -> #VALUE! | I31: =R[-23]C[-6]/R[-24]C[-5] -> #DIV/0! | J31: =R[-24]C[-4]/R[-14]C[-5] -> 0 | K31: =R[-24]C[-5]/R[-22]C[-6] -> #VALUE! | L31: =R[-22]C[-7]/R[-16]C[-7] -> #VALUE! | M31: =R[-14]C[-8]/R[-16]C[-8] -> 2.9999899999999999 | N31: =R[-16]C[-9]/R[-22]C[-11] -> 0.90909090909090906 | O31: =R[-24]C[-8]:R[-24]C[-5]/R[-23]C[-13] -> #VALUE! | P31: =R[-24]C[-5]:R[-21]C[-5]/R[-23]C[-14] -> #VALUE! | Q31: =R[-24]C[-1]:R[-23]C[2]/R[-23]C[-15] -> #VALUE!
C32: EXPECTED VALUE | D32: 0 | E32: -1 | F32: 99999999999 | G32: #VALUE! | H32: #VALUE! | I32: #DIV/0! | J32: 0 | K32: #VALUE! | L32: #VALUE! | M32: 2.9999899999999999 | N32: 0.90909090909090906 | O32: #VALUE! | P32: #VALUE! | Q32: #VALUE!
B35: EqualEval | C35: FORMULA | D35: =R[-27]C[-2]=R[-27]C[-2] -> 1 | E35: =1000000=999999.99 -> 0 | F35: =1.11111111111111=1.1111111111111 -> 0 | G35: =R[-27]C[-2]=R[-27]C[-2] -> 1 | H35: =R[-27]C[-3]=R[-26]C[-3] -> 0 | I35: ="1.1"=R[-26]C[-6] -> 0 | J35: =1.1=R[-19]C[-7] -> 0 | K35: =-200=200 -> 0 | L35: =""=R[-28]C[-8] -> 1 | M35: =0=R[-28]C[-9] -> 1 | N35: =FALSE=R[-28]C[-10] -> 1 | O35: =""=0 -> 0 | P35: =FALSE=0 -> 0
C36: EXPECTED VALUE | D36: 1 | E36: 0 | F36: 0 | G36: 1 | H36: 0 | I36: 0 | J36: 0 | K36: 0 | L36: 1 | M36: 1 | N36: 1 | O36: 0 | P36: 0
B39: GreaterEqualEval | C39: FORMULA | D39: =2>=2 -> 1 | E39: =R[-28]C[-3]>=R[-27]C[-2] -> 1 | F39: =R[-29]C[-3]>=1.00001 -> 1 | G39: =R[-32]C[-3]>=R[-31]C[-3] -> 1 | H39: =R[-31]C[-3]>=R[-29]C[-3] -> 1 | I39: =R[-29]C[-4]>=R[-31]C[-4] -> 0 | J39: =R[-30]C[-4]>=R[-30]C[-4] -> 1 | K39: =R[-32]C[-4]:R[-32]C[-1]>=R[-32]C[-4]:R[-32]C[-1] -> #VALUE! | L39: =R[-32]C[-1]:R[-29]C[-1]>=R[-32]C[-1]:R[-29]C[-1] -> #VALUE!
C40: EXPECTED VALUE | D40: 1 | E40: 1 | F40: 1 | G40: 1 | H40: 1 | I40: 0 | J40: 1 | K40: #VALUE! | L40: #VALUE!
B43: GreaterThanEval | C43: FORMULA | D43: =R[-36]C[-2]>R[-32]C[-2] -> 0 | E43: =R[-32]C[-3]>R[-36]C[-3] -> 1 | F43: =R[-36]C[-4]>R[-31]C[-4] -> 1 | G43: =R[-30]C[-5]>R[-28]C[-4] -> 0 | H43: =R[-36]C[-4]>R[-35]C[-5] -> 0 | I43: =R[-36]C[-5]>R[-26]C[-6] -> 1 | J43: =R[-29]C[-4]>R[-30]C[-4] -> 1 | K43: =R[-28]C[-6]>R[-34]C[-6] -> 0 | L43: =R[-36]C[-5]:R[-36]C[-2]>R[-35]C[-6] -> #VALUE! | M43: =R[-36]C[-2]:R[-33]C[-2]>R[-32]C[-7] -> #VALUE! | N43: =FALSE>"TRUE" -> 1 | O43: =TRUE>"TRUER" -> 1
C44: EXPECTED VALUE | D44: 0 | E44: 1 | F44: 1 | G44: 0 | H44: 0 | I44: 1 | J44: 1 | K44: 0 | L44: #VALUE! | M44: #VALUE! | N44: 1 | O44: 1
B47: IntersectionEval | C47: FORMULA | D47: Not supported by XSSF
C48: EXPECTED VALUE | D48: Not supported by XSSF
B51: LessEqualEval | C51: FORMULA | D51: =R[-44]C[-2]<=R[-44]C[-1] -> 1 | E51: =R[-43]C[-3]<=R[-42]C[-2] -> 1 | F51: =R[-43]C[-3]<=R[-35]C[-3] -> 0 | G51: =R[-43]C[-2]<=R[-42]C[-2] -> 1 | H51: =R[-42]C[-5]<=R[-40]C[-3] -> 1 | I51: =R[-41]C[-3]<=R[-40]C[-3] -> 0 | J51: =R[-39]C[-4]<=R[-39]C[-5] -> 0 | K51: =R[-34]C[-6]<=R[-40]C[-8] -> 0 | L51: =R[-44]C[-5]:R[-44]C[-2]<=R[-43]C[-6] -> #VALUE! | M51: =R[-44]C[-1]:R[-41]C[-1]<=R[-44]C[-11] -> #VALUE!
C52: EXPECTED VALUE | D52: 1 | E52: 1 | F52: 0 | G52: 1 | H52: 1 | I52: 0 | J52: 0 | K52: 0 | L52: #VALUE! | M52: #VALUE!
B55: LessThanEval | C55: FORMULA | D55: =R[-48]C[-2]<R[-47]C[-2] -> 1 | E55: =R[-47]C[-3]<R[-48]C[-3] -> 0 | F55: =R[-45]C[-3]<R[-46]C[-3] -> 1 | G55: =R[-47]C[-2]<R[-46]C[-2] -> 1 | H55: =R[-46]C[-5]<R[-39]C[-3] -> 1
C56: EXPECTED VALUE | D56: 1 | E56: 0 | F56: 1 | G56: 1 | H56: 1
B59: MultiplyEval | C59: FORMULA | D59: =1*0 -> 0 | E59: ="test"*0 -> #VALUE! | F59: =1.99999*0.033 -> 6.5999669999999996E-2 | G59: =R[-49]C[-5]*R[-48]C[-4] -> 1601.9946600000001 | H59: =R[-52]C[-4]*R[-51]C[-5] -> 0 | I59: =R[-52]C[-4]*R[-52]C[-6] -> #VALUE! | J59: =R[-52]C[-9]:R[-52]C*R[-44]C[-8] -> -4 | K59: =R[-52]C:R[-49]C*R[-49]C[-9] -> #VALUE! | L59: =R[-58]C[-2]:RC[-2]*R[-51]C[-10] -> -4 | M59: =""*"1" -> #VALUE! | N59: ="1"*1 -> 1 | O59: =TRUE*34 -> 34 | P59: =FALSE*2 -> 0 | Q59: =R[-41]C[-15]*R[-43]C[-15] -> #VALUE!
C60: EXPECTED VALUE | D60: 0 | E60: #VALUE! | F60: 6.5999669999999996E-2 | G60: 1601.9946600000001 | H60: 0 | I60: #VALUE! | J60: -4 | K60: #VALUE! | L60: -4 | M60: #VALUE! | N60: 1 | O60: 34 | P60: 0 | Q60: #VALUE!
B63: NotEqualEval | C63: FORMULA | D63: =R[-56]C[-2]<>R[-56]C[-2] -> 0 | E63: ="TRUE"<>R[-47]C[-3] -> 1 | F63: ="TRUE"<>R[-45]C[-4] -> 0 | G63: =FALSE<>R[-44]C[-5] -> 1 | H63: =R[-55]C[-5]<>0.00001001 -> 1 | I63: =R[-54]C[-4]<>"spaces" -> 1 | J63: =R[-52]C[-5]<>"beginsWithSpace" -> 1 | K63: =1<>R[-48]C[-6] -> 1 | L63: =R[-46]C[-7]<>R[-46]C[-9] -> 1 | M63: =R[-49]C[-7]<>R[-49]C[-7] -> 0 | N63: ="blanksIncl"<>R[-52]C[-7] -> 0 | O63: =R[-56]C[-8]:R[-56]C[-5]<>R[-56]C[-8]:R[-56]C[-5] -> #VALUE! | P63: =R[-56]C:R[-55]C[3]<>R[-56]C:R[-55]C[3] -> #VALUE! | Q63: =R[-56]C[-1]:R[-56]C[2]<>R[-56]C:R[-56]C[1] -> 0 | R63: =R[-56]C[-2]:R[-53]C[-2]<>R[-56]C[1]:R[-53]C[1] -> #VALUE! | S63: =""<>R[-56]C[-15] -> 0 | T63: =0<>R[-56]C[-16] -> 0
C64: EXPECTED VALUE | D64: 0 | E64: 1 | F64: 0 | G64: 1 | H64: 1 | I64: 1 | J64: 1 | K64: 1 | L64: 1 | M64: 0 | N64: 0 | O64: #VALUE! | P64: #VALUE! | Q64: 0 | R64: #VALUE! | S64: 0 | T64: 0
B67: PercentEval | C67: FORMULA | D67: =50% -> 0.5 | E67: ="250"% -> 2.5 | F67: =R[-51]C[-4]% -> 0.01 | G67: =R[-54]C[-1]% -> 2.9999899999999999E-2 | H67: =1000%% -> 0.1
C68: EXPECTED VALUE | D68: 0.5 | E68: 2.5 | F68: 0.01 | G68: 2.9999899999999999E-2 | H68: 0.1
B71: PowerEval | C71: FORMULA | D71: =2^5 -> 32 | E71: =1^99999 -> 1 | F71: =R[-58]C[-4]^0 -> 1 | G71: =R[-56]C[-4]^R[-62]C[-4] -> #NUM! | H71: =R[-63]C[-6]^R[-62]C[-5] -> 1 | I71: =R[-64]C[-6]^R[-62]C[-6] -> 0 | J71: =R[-62]C[-8]^R[-62]C[-7] -> 2.1435469250725863 | K71: =R[-56]C[-8]^R[-62]C[-9] -> 1.0000200001000001 | L71: =R[-61]C[-10]^R[-57]C[-10] -> 3.5068523895692182E-6 | M71: =R[-61]C[-6]^R[-64]C[-10] -> #VALUE! | N71: =R[-64]C[-9]^R[-64]C[-11] -> #VALUE! | O71: =R[-64]C[-7]:R[-64]C[-5]^R[-64]C[-12] -> #VALUE! | P71: =R[-64]C[-2]:R[-64]C[1]^R[-62]C[1] -> 1 | Q71: =R[-64]C[-1]:R[-62]C^R[-64]C[1] -> #VALUE! | R71: =R[-1]C[-2]:RC[-2]^R[-62]C -> 1
C72: EXPECTED VALUE | D72: 32 | E72: 1 | F72: 1 | G72: #NUM! | H72: 1 | I72: 0 | J72: 2.1435469250725863 | K72: 1.0000200001000001 | L72: 3.5068523895692182E-6 | M72: #VALUE! | N72: #VALUE! | O72: #VALUE! | P72: 1 | Q72: #VALUE! | R72: 1
B75: RangeEval | C75: FORMULA | D75: Not supported by XSSF
C76: EXPECTED VALUE | D76: Not supported by XSSF
B79: SubtractEval | C79: FORMULA | D79: =R[-69]C[-2]-R[-70]C[-1] -> 532.9 | E79: =9999-9999 -> 0 | F79: =R[-70]C[-3]-R[-63]C[-3] -> 2.2000000000000002 | G79: =R[-71]C[-3]-R[-72]C[-3] -> 0 | H79: =R[-72]C[-4]-R[-70]C[-5] -> -1.1000000000000001 | I79: =R[-72]C[-4]-R[-72]C[-6] -> #VALUE! | J79: =R[-63]C[-8]-R[-62]C[-8] -> 1 | K79: =R[-60]C[-9]-R[-61]C[-9] -> #VALUE! | L79: =R[-62]C[-10]-R[-63]C[-10] -> -1 | M79: =R[-72]C:R[-69]C-R[-72]C[1]:R[-69]C[1] -> #VALUE! | N79: =R[-69]C[-2]:R[-69]C[1]-R[-70]C -> -344.99999000000003 | O79: =R[-69]C[-1]:R[-69]C[1]-R[-71]C:R[-68]C -> #VALUE! | P79: =R[-72]C[-7]-R[-70]C[-3] -> #VALUE!
C80: EXPECTED VALUE | D80: 532.9 | E80: 0 | F80: 2.2000000000000002 | G80: 0 | H80: -1.1000000000000001 | I80: #VALUE! | J80: 1 | K80: #VALUE! | L80: -1 | M80: #VALUE! | N80: -344.99999000000003 | O80: #VALUE! | P80: #VALUE!
B83: UnaryMinusEval | C83: FORMULA | D83: =-R[-74]C[-2] -> -2 | E83: =-R[-71]C[-3] -> 9999999999 | F83: =-R[-67]C[-4] -> -1 | G83: =-R[-73]C[-1]:R[-73]C[1] -> #VALUE! | H83: =-R[-72]C[-1]:R[-72]C[1] -> 0 | I83: =-R[-73]C[-1]:R[-73]C[1] -> #VALUE! | J83: =-R[-76]C[-5] -> #VALUE! | K83: =-R[-73]C[-5] -> -1.0000000000000001E-5 | L83: =-R[-76]C[-1]:R[-75]C -> #VALUE! | M83: =-R[-76]C:R[-73]C -> #VALUE! | N83: =-R[-73]C[-3] -> -4 | O83: =-R[-65]C[-13] -> #VALUE!
C84: EXPECTED VALUE | D84: -2 | E84: 9999999999 | F84: -1 | G84: #VALUE! | H84: 0 | I84: #VALUE! | J84: #VALUE! | K84: -1.0000000000000001E-5 | L84: #VALUE! | M84: #VALUE! | N84: -4 | O84: #VALUE!
B87: UnaryPlusEval | C87: FORMULA | D87: =2 -> 2 | E87: =+R[-73]C[-2] -> -2.9999899999999999 | F87: =+R[-80]C[-2] -> 0 | G87: =+R[-78]C[-1]:R[-78]C[1] -> 2.3456000000000001 | H87: =+R[-2]C[-1]:RC[-1] -> 2.3456000000000001 | I87: =+R[-75]C[-1]:R[-75]C[1] -> 454 | J87: =+R[-80]C[-1]:R[-79]C -> #VALUE! | K87: =+R[-76]C[-1]:R[-76]C[1] -> 0 | L87: =+R[-80]C[-7] ->  | M87: =+R[-77]C[-1]:R[-77]C[1] -> col | N87: =-"hello" -> #VALUE!
C88: EXPECTED VALUE | D88: 2 | E88: -2.9999899999999999 | F88: 0 | G88: 2.3456000000000001 | H88: 2.3456000000000001 | I88: 454 | J88: #VALUE! | K88: 0 | M88: col | N88: #VALUE!
B91: <END-OF-FUNCTIONS>
B94: Excel functions
B96: Abs | C96: FORMULA | D96: =ABS(R[-89]C[-2]) -> 0 | E96: =ABS(R[-84]C[-3]) -> 9999999999 | F96: =ABS(R[-82]C[-3]) -> 2.9999899999999999 | G96: =ABS(R[-89]C[-3]) -> 0 | H96: =ABS(R[-89]C[-3]) -> #VALUE! | I96: =ABS("1") -> 1 | J96: =ABS(R[-86]C[-4]) -> 1.0000000000000001E-5 | K96: =ABS(R[-83]C[-5]) -> 2.9999899999999999 | L96: =ABS(R[-89]C[-5]:R[-84]C[-5]) -> #VALUE! | M96: =ABS(R[-89]C[-2]:R[-89]C[1]) -> #VALUE! | N96: =ABS(R[-87]C[-3]:R[-87]C) -> 345 | O96: =ABS(R[-8]C[-1]:RC[-1]) -> 345 | P96: =ABS(R[-78]C[-14]) -> #VALUE! | Q96: =ABS(R[-80]C[-15]) -> 1 | R96: =ABS(R[-79]C[-16]) -> 0
C97: EXPECTED VALUE | D97: 0 | E97: 9999999999 | F97: 2.9999899999999999 | G97: 0 | H97: #VALUE! | I97: 1 | J97: 1.0000000000000001E-5 | K97: 2.9999899999999999 | L97: #VALUE! | M97: #VALUE! | N97: 345 | O97: 345 | P97: #VALUE! | Q97: 1 | R97: 0
B100: Absref | C100: FORMULA
C101: EXPECTED VALUE
B104: Acos | C104: FORMULA | D104: =ACOS(0) -> 1.5707963267948966 | E104: =ACOS(R[-95]C[-3]) -> #NUM! | F104: =ACOS(R[-97]C[-4]) -> 1.5707963267948966 | G104: =ACOS(R[-88]C[-5]) -> 0 | H104: =ACOS(R[-87]C[-6]) -> 1.5707963267948966 | I104: =ACOS(R[-87]C[-6]) -> 1.5708063267948966 | J104: =ACOS(R[-97]C[-6]) -> 1.5707963267948966 | K104: =ACOS(R[-97]C[-6]) -> #VALUE! | L104: =ACOS(R[-96]C[-6]) -> 0 | M104: =ACOS(R[-95]C[-6]) -> #NUM! | N104: =ACOS(R[-96]C[-3]:R[-96]C) -> 1.5707963267948966 | O104: =ACOS(R[-2]C[-3]:R[1]C[-3]) -> 1.5707963267948966 | P104: =ACOS(R[-97]C[-1]:R[-96]C) -> #VALUE! | Q104: =ACOS("0.5") -> 1.0471975511965976
C105: EXPECTED VALUE | D105: 1.5707963267948966 | E105: #NUM! | F105: 1.5707963267948966 | G105: 0 | H105: 1.5707963267948966 | I105: 1.5708063267948966 | J105: 1.5707963267948966 | K105: #VALUE! | L105: 0 | M105: #NUM! | N105: 1.5707963267948966 | O105: 1.5707963267948966 | P105: #VALUE! | Q105: 1.0471975511965976
B108: Acosh | C108: FORMULA | D108: =ACOSH(R[-99]C[-2]) -> 1.3169578969248166 | E108: =ACOSH(R[-96]C[-3]) -> #NUM! | F108: =ACOSH(R[-95]C[-4]) -> #NUM! | G108: =ACOSH(R[-92]C[-5]) -> 0 | H108: =ACOSH(R[-90]C[-6]) -> #VALUE! | I108: =ACOSH(R[-101]C[-5]) -> #NUM! | J108: =ACOSH(R[-101]C[-7]) -> #NUM! | K108: =ACOSH(R[-94]C[-8]) -> #NUM! | L108: =ACOSH(R[-94]C[-7]) -> #NUM! | M108: =ACOSH(R[-100]C[-2]:R[-100]C[1]) -> 1.7627471740390861 | N108: =ACOSH(R[-2]C[-1]:R[1]C[-1]) -> 1.1676387512082018 | O108: =ACOSH(R[-99]C[-1]:R[-98]C) -> #VALUE!
C109: EXPECTED VALUE | D109: 1.3169578969248166 | E109: #NUM! | F109: #NUM! | G109: 0 | H109: #VALUE! | I109: #NUM! | J109: #NUM! | K109: #NUM! | L109: #NUM! | M109: 1.7627471740390861 | N109: 1.1676387512082018 | O109: #VALUE!
B112: Activecell | C112: FORMULA
C113: EXPECTED VALUE
B116: Addbar | C116: FORMULA | D116: WILL_NEVER_IMPLEMENT
C117: EXPECTED VALUE | D117: WILL_NEVER_IMPLEMENT
B120: Addcommand | C120: FORMULA | D120: WILL_NEVER_IMPLEMENT
C121: EXPECTED VALUE | D121: WILL_NEVER_IMPLEMENT
B124: Addmenu | C124: FORMULA | D124: WILL_NEVER_IMPLEMENT
C125: EXPECTED VALUE | D125: WILL_NEVER_IMPLEMENT
B128: Address | C128: FORMULA | D128: =ADDRESS(2,3) -> $C$2 | E128: =ADDRESS(2,3,2) -> C$2 | F128: =ADDRESS(2,3,3,TRUE,"[Book1]Sheet1") -> [Book1]Sheet1!$C2
C129: EXPECTED VALUE | D129: $C$2 | E129: C$2 | F129: '[Book1]Sheet1'!$C2
B132: Addtoolbar | C132: FORMULA | D132: WILL_NEVER_IMPLEMENT
C133: EXPECTED VALUE | D133: WILL_NEVER_IMPLEMENT
B136: And | C136: FORMULA | D136: =AND(R[-129]C[-2]:R[-127]C[-2],R[-127]C[-1],R[-129]C,R[-129]C[1]) -> 0 | E136: =AND(R[-127]C[-2],R[-121]C[-3]) -> 1 | F136: =AND(R[-129]C[-1]) -> #VALUE! | G136: =AND(R[-129]C[-5]:R[-126]C[-2]) -> 0 | H136: =AND(R[-124]C[-2]:R[-124]C[1]) -> 1 | I136: =AND(R[-122]C[-4],R[-119]C[-4],"1") -> #VALUE! | J136: =AND("1",1) -> #VALUE! | K136: =AND(R[-121]C[-6],R[-123]C[-4]) -> #VALUE! | L136: =AND(R[-121]C[-7]:R[-119]C[-7],R[-123]C[-9]:R[-121]C[-9],R[-127]C[-10]:R[-126]C[-10]) -> 1 | M136: =AND(R[-120]C[-11]:R[-119]C[-11]) -> 0 | N136: =AND(R[-121]C[-12]:R[-120]C[-12]) -> 1 | O136: =AND(R[-119]C[-13]:R[-118]C[-13]) -> 0 | P136: =AND(R[-118]C[-14]:R[-117]C[-14]) -> #VALUE!
C137: EXPECTED VALUE | D137: 0 | E137: 1 | F137: #VALUE! | G137: 0 | H137: 1 | I137: #VALUE! | J137: #VALUE! | K137: #VALUE! | L137: 1 | M137: 0 | N137: 1 | O137: 0 | P137: #VALUE!
B140: Apptitle | C140: FORMULA | D140: WILL_NEVER_IMPLEMENT
C141: EXPECTED VALUE | D141: WILL_NEVER_IMPLEMENT
B144: Areas | C144: FORMULA
C145: EXPECTED VALUE
B148: Argument | C148: FORMULA
C149: EXPECTED VALUE
B152: Asc | C152: FORMULA
C153: EXPECTED VALUE
B156: Asin | C156: FORMULA | D156: =ASIN(R[-149]C[-2]) -> 0 | E156: =ASIN(R[-148]C[-2]) -> 1.0000000000166668E-5 | F156: =ASIN(R[-146]C[-4]) -> #NUM! | G156: =ASIN(R[-143]C[-5]) -> #NUM! | H156: =ASIN(R[-139]C[-6]) -> 0 | I156: =ASIN(R[-140]C[-7]) -> 1.5707963267948966 | J156: =ASIN(R[-149]C[-6]) -> 0 | K156: =ASIN(R[-149]C[-6]) -> #VALUE! | L156: =ASIN(R[-148]C[-6]) -> 1.5707963267948966 | M156: =ASIN(R[-145]C[-4]:R[-145]C) -> 0 | N156: =ASIN(R[-144]C[-6]:R[-144]C[-4]) -> #VALUE! | O156: =ASIN(R[-2]C[-2]:R[1]C[-2]) -> 0 | P156: =ASIN("1") -> 1.5707963267948966
C157: EXPECTED VALUE | D157: 0 | E157: 1.0000000000166668E-5 | F157: #NUM! | G157: #NUM! | H157: 0 | I157: 1.5707963267948966 | J157: 0 | K157: #VALUE! | L157: 1.5707963267948966 | M157: 0 | N157: #VALUE! | O157: 0 | P157: 1.5707963267948966
B160: Asinh | C160: FORMULA | D160: =ASINH(R[-153]C[-2]) -> 0 | E160: =ASINH(R[-152]C[-3]) -> 0.88137358701954294 | F160: =ASINH(R[-149]C[-4]) -> 23.718998110400403 | G160: =ASINH(R[-147]C[-5]) -> -6.9735438962320844 | H160: =ASINH(R[-144]C[-6]) -> 0.88137358701954294 | I160: =ASINH(R[-153]C[-5]) -> 0 | J160: =ASINH(R[-153]C[-5]) -> #VALUE! | K160: =ASINH("") -> #VALUE! | L160: =ASINH("1") -> 0.88137358701954294 | M160: =ASINH(R[-150]C[-3]:R[-150]C) -> #VALUE! | N160: =ASINH(R[-149]C[-2]:R[-149]C[1]) -> 0 | O160: =ASINH(R[-2]C[-3]:R[1]C[-3]) -> 0.79495776876387869 | P160: =ASINH(R[-151]C[-1]:R[-149]C) -> #VALUE!
C161: EXPECTED VALUE | D161: 0 | E161: 0.88137358701954294 | F161: 23.718998110400403 | G161: -6.9735438962311251 | H161: 0.88137358701954294 | I161: 0 | J161: #VALUE! | K161: #VALUE! | L161: 0.88137358701954294 | M161: #VALUE! | N161: 0 | O161: 0.79495776876387869 | P161: #VALUE!
B164: Atan | C164: FORMULA | D164: =ATAN(R[-157]C[-2]) -> 0 | E164: =ATAN(R[-154]C[-3]) -> 1.5689236698079085 | F164: =ATAN(R[-148]C[-4]) -> 0.78539816339744828 | G164: =ATAN(R[-157]C[-3]) -> 0 | H164: =ATAN(R[-157]C[-3]) -> #VALUE! | I164: =ATAN(R[-149]C[-4]) -> 0.78539816339744828 | J164: =ATAN("1") -> 0.78539816339744828 | K164: =ATAN(R[-152]C[-5]) -> #VALUE! | L164: =ATAN(R[-154]C[-6]) -> 9.9999999996666679E-6 | M164: =ATAN(R[-154]C[-2]:R[-154]C[1]) -> #VALUE! | N164: =ATAN(R[-153]C[-2]:R[-153]C) -> 0 | O164: =ATAN(R[-2]C[-1]:R[1]C[-1]) -> 0 | P164: =ATAN(R[-157]C[-1]:R[-156]C) -> #VALUE!
C165: EXPECTED VALUE | D165: 0 | E165: 1.5689236698079085 | F165: 0.78539816339744828 | G165: 0 | H165: #VALUE! | I165: 0.78539816339744828 | J165: 0.78539816339744828 | K165: #VALUE! | L165: 9.9999999996666679E-6 | M165: #VALUE! | N165: 0 | O165: 0 | P165: #VALUE!
B168: Atan2 | C168: FORMULA | D168: =ATAN2(R[-161]C[-2],R[-161]C[-2]) -> #DIV/0! | E168: =ATAN2(R[-161]C[-3],R[-160]C[-3]) -> 1.5707963267948966 | F168: =ATAN2(R[-156]C[-4],R[-159]C[-3]) -> 3.1415926534797931 | G168: =ATAN2(R[-153]C[-5],R[-152]C[-5]) -> 2.3561944901923448 | H168: =ATAN2(R[-150]C[-6],R[-152]C[-6]) -> #VALUE! | I168: =ATAN2(R[-156]C[-2]:R[-156]C,R[-159]C[1]) -> 1.4952630018344298E-2 | J168: =ATAN2(R[-1]C[-1]:R[1]C[-1],R[-157]C[-1]:R[-157]C[1]) -> 6.6877856917807108E-4 | K168: =ATAN2(R[-161]C:R[-160]C,R[-159]C[-1]:R[-159]C) -> #VALUE! | L168: =ATAN2(R[-159]C[-1]:R[-158]C,2) -> #VALUE! | M168: =ATAN2("1",TRUE) -> 0.78539816339744828 | N168: =ATAN2(1,0) -> 0 | O168: =ATAN2(#N/A,#NAME?) -> #N/A
C169: EXPECTED VALUE | D169: #DIV/0! | E169: 1.5707963267948966 | F169: 3.1415926534797931 | G169: 2.3561944901923448 | H169: #VALUE! | I169: 1.4952630018344298E-2 | J169: 6.6877856917807108E-4 | K169: #VALUE! | L169: #VALUE! | M169: 0.78539816339744828 | N169: 0 | O169: #N/A
B172: Atanh | C172: FORMULA | D172: =ATANH(R[-165]C[-2]) -> 0 | E172: =ATANH(R[-163]C[-2]) -> #NUM! | F172: =ATANH(R[-159]C[-4]) -> #NUM! | G172: =ATANH(R[-156]C[-5]) -> #NUM! | H172: =ATANH(R[-155]C[-6]) -> 0 | I172: =ATANH(R[-165]C[-4]) -> #VALUE! | J172: =ATANH(R[-160]C[-4]) -> #VALUE! | K172: =ATANH(R[-165]C:R[-165]C[2]) -> #NUM! | L172: =ATANH(R[-161]C[-1]:R[-161]C[1]) -> 0 | M172: =ATANH(R[-1]C[-1]:R[1]C[-1]) -> 0 | N172: =ATANH(R[-163]C[-1]:R[-162]C[1]) -> #VALUE!
C173: EXPECTED VALUE | D173: 0 | E173: #NUM! | F173: #NUM! | G173: #NUM! | H173: 0 | I173: #VALUE! | J173: #VALUE! | K173: #NUM! | L173: 0 | M173: 0 | N173: #VALUE!
B176: Avedev | C176: FORMULA | D176: =AVEDEV(R[-169]C[-2]:R[-169]C[-1],R[-165]C[-1],R[-160]C[-2]:R[-159]C[-2]) -> 1.3333288888888888 | E176: =AVEDEV(R[-169]C[-2]:R[-167]C[-1]) -> 0.48888666666666669 | F176: =AVEDEV(R[-169]C[-2]:R[-167]C[-1]) -> #NUM! | G176: =AVEDEV(R[-163]C[-2]:R[-159]C[-2]) -> #NUM! | H176: =AVEDEV(R[-169]C[-5]:R[-165]C[-3]) -> 0.8239943999999999 | I176: =AVEDEV(R[-169]C[-6]:R[-165]C[-6]) -> 0.8239943999999999 | J176: =AVEDEV(R[-168]C[-4]:R[-166]C[-2]) -> 2187499999.3499279 | K176: =AVEDEV(R[-169]C[-3]:R[-166]C[-1]) -> 1.0796920000000001 | L176: =AVEDEV(TRUE, FALSE) -> 0.5
C177: EXPECTED VALUE | D177: 1.3333288888888888 | E177: 0.48888666666666669 | F177: #NUM! | G177: #NUM! | H177: 0.8239943999999999 | I177: 0.8239943999999999 | J177: 2187499999.3499279 | K177: 1.0796920000000001 | L177: 0.5
B180: Average | C180: FORMULA | D180: =AVERAGE(R[-173]C[-2]:R[-165]C[-1],R[-164]C[-2]:R[-163]C[-1],R[-172]C:R[-164]C) -> -4.0893554731909327E-9 | E180: =AVERAGE(R[-173]C[-1]:R[-165]C[-1]) -> #DIV/0! | F180: =AVERAGE(R[-171]C[-2]:R[-164]C[-1]) -> #DIV/0! | G180: =AVERAGE("1",R[-172]C[-5]:R[-171]C[-5]) -> 1.3333333333333333 | H180: =AVERAGE(R[-169]C[-2],R[-172]C[-1]) -> 0.50049999999999994 | I180: =AVERAGE(R[-172]C[-3]:R[-170]C[-1]) -> 1250000001.6002886 | J180: =AVERAGE(TRUE, FALSE) -> 0.5
C181: EXPECTED VALUE | D181: -4.0893554731909327E-9 | E181: #DIV/0! | F181: #DIV/0! | G181: 1.3333333333333333 | H181: 0.50049999999999994 | I181: 1250000001.6002886 | J181: 0.5
B184: Averagea | C184: FORMULA
C185: EXPECTED VALUE
B188: Betadist | C188: FORMULA
C189: EXPECTED VALUE
B192: Betainv | C192: FORMULA
C193: EXPECTED VALUE
B196: Binomdist | C196: FORMULA
C197: EXPECTED VALUE
B200: Call | C200: FORMULA | D200: WILL_NEVER_IMPLEMENT
C201: EXPECTED VALUE | D201: WILL_NEVER_IMPLEMENT
B204: Caller | C204: FORMULA | D204: WILL_NEVER_IMPLEMENT
C205: EXPECTED VALUE | D205: WILL_NEVER_IMPLEMENT
B208: Cancelkey | C208: FORMULA
C209: EXPECTED VALUE
B212: Ceiling | C212: FORMULA | D212: =CEILING(R[-202]C[-2],R[-203]C[-2]) -> 534 | E212: =CEILING(R[-201]C[-2],R[-203]C[-2]) -> 3.3000000000000003 | F212: =CEILING(R[-203]C[-2],R[-202]C[-2]) -> 0 | G212: =CEILING(R[-200]C[-4],R[-201]C[-3]) -> 0 | H212: =CEILING(R[-195]C[-3],R[-197]C[-3]) -> 3 | I212: =CEILING(R[-199]C[-3],R[-202]C[-3]) -> 2.9999900000000004 | J212: =CEILING(R[-203]C[-1]:R[-203]C,R[-2]C[-2]:R[1]C[-2]) -> 9 | K212: =CEILING(R[-204]C[-1]:R[-203]C,1) -> #VALUE! | L212: =CEILING(R[-202]C[-5],R[-205]C[-5]) -> #VALUE! | M212: =CEILING(0,0) -> 0
C213: EXPECTED VALUE | D213: 534 | E213: 3.3 | F213: 0 | G213: 0 | H213: 3 | I213: 2.9999900000000004 | J213: 9 | K213: #VALUE! | L213: #VALUE! | M213: 0
B216: Cell | C216: FORMULA
C217: EXPECTED VALUE
B220: Char | C220: FORMULA | D220: =CHAR(65) -> A | E220: =CHAR(33) -> ! | F220: =CHAR(-1) -> #VALUE!
C221: EXPECTED VALUE | D221: A | E221: ! | F221: #VALUE!
B224: Checkcommand | C224: FORMULA | D224: WILL_NEVER_IMPLEMENT
C225: EXPECTED VALUE | D225: WILL_NEVER_IMPLEMENT
B228: Chidist | C228: FORMULA
C229: EXPECTED VALUE
B232: Chiinv | C232: FORMULA
C233: EXPECTED VALUE
B236: Chitest | C236: FORMULA
C237: EXPECTED VALUE
B240: Choose | C240: FORMULA | D240: =CHOOSE(1,2,3) -> 2 | E240: =CHOOSE(#REF!, 1) -> #REF! | F240: =CHOOSE(2,#N/A,#NULL!) -> #NULL! | G240: =CHOOSE(2,#REF!,3) -> 3 | H240: =CHOOSE(1.9,5,6) -> 5
C241: EXPECTED VALUE | D241: 2 | E241: #REF! | F241: #NULL! | G241: 3 | H241: 5
B244: Clean | C244: FORMULA | D244: =CLEAN(CHAR(7)&"text"&CHAR(7)) -> text
C245: EXPECTED VALUE | D245: text
B248: Code | C248: FORMULA
C249: EXPECTED VALUE
B252: Column | C252: FORMULA | D252: =COLUMN(R[-245]C[-1]) -> 3 | E252: =COLUMN(R[-251]:R[-250]) -> 1 | F252: =COLUMN(R[-245]C[-4]:R[-241]C[-4]) -> 2 | G252: =COLUMN(R[-241]C[-5]:R[-241]C[-3]) -> 2 | H252: =COLUMN(R[-237]C[-3]:R[-233]C[-1]) -> 5 | I252: =COLUMN(R[-235]C[-2]:R[-231]C[-1]) -> 7
C253: EXPECTED VALUE | D253: 3 | E253: 1 | F253: 2 | G253: 2 | H253: 5 | I253: 7
B256: Columns | C256: FORMULA | D256: =COLUMNS(R[-255]C[-1]:R[-252]C[1]) -> 3
C257: EXPECTED VALUE | D257: 3
B260: Combin | C260: FORMULA | D260: =COMBIN(R[-251]C[-2],R[-252]C[-2]) -> 2 | E260: =COMBIN(19,7) -> 50388.000000000007 | F260: =COMBIN(R[-247]C[-1]:R[-247]C[1],2) -> 1 | G260: =COMBIN(R[-247]C[-2]:R[-247]C[-1],1) -> #VALUE! | H260: =COMBIN(R[-245]C[-3],R[-243]C[-3]) -> #NUM! | I260: =COMBIN(R[-245]C[-6],R[-244]C[-6]) -> #NUM! | J260: =COMBIN(-23,12) -> #NUM! | K260: =COMBIN(99,1) -> 99 | L260: =COMBIN(23,R[-1]C[-8]:R[1]C[-8]) -> 253
C261: EXPECTED VALUE | D261: 2 | E261: 50388 | F261: 1 | G261: #VALUE! | H261: #NUM! | I261: #NUM! | J261: #NUM! | K261: 99 | L261: 253
B264: Concatenate | C264: FORMULA | D264: =CONCATENATE(R[-257]C[-2],R[-249]C[-2]) -> 0-1 | E264: =CONCATENATE(R[-248]C[-3],R[-246]C[-3]) -> TRUETRUE | F264: =CONCATENATE(R[-255]C[-3],R[-250]C[-2],R[-250]C[-4],R[-247]C[-4]) -> 1.1-2FALSE | G264: =CONCATENATE(R[-255]C[-2],R[-252]C[-1]) -> sp ace ssp ace s | H264: =CONCATENATE(R[-251]C[-2],R[-248]C[-3]) -> 2.999991.1 | I264: =CONCATENATE(R[-254]C[-2]:R[-254]C[1],R[-1]C[-3]:R[1]C[-3]) -> ric1.1-2FALSE | J264: =CONCATENATE(R[-251]C[-4]:R[-249]C[-3],R[-248]C[-5]) -> #VALUE! | K264: =CONCATENATE(R[-256]C:R[-255]C[1],R[-254]C) -> #VALUE!
C265: EXPECTED VALUE | D265: 0-1 | E265: TRUETRUE | F265: 1.1-2FALSE | G265: sp ace ssp ace s | H265: 2.999991.1 | I265: ric1.1-2FALSE | J265: #VALUE! | K265: #VALUE!
B268: Confidence | C268: FORMULA
C269: EXPECTED VALUE
B272: Correl | C272: FORMULA
C273: EXPECTED VALUE
B276: Cos | C276: FORMULA | D276: =COS(R[-269]C) -> 1 | E276: =COS(R[-269]C) -> #VALUE! | F276: =COS(R[-261]C[-1]) -> 0.54030230586813977 | G276: =COS("1") -> 0.54030230586813977 | H276: =COS(R[-260]C[-6]) -> 0.54030230586813977 | I276: =COS(R[-259]C[-7]) -> 1 | J276: =COS(R[-258]C[-8]) -> #VALUE! | K276: =COS(R[-264]C[-3]:R[-264]C[1]) -> 1 | L276: =COS(R[-2]C[-1]:R[1]C[-1]) -> 0.54030230586813977 | M276: =COS(R[-265]C[-7]) -> 1 | N276: =COS(R[-268]C[-5]:R[-268]C[-3]) -> #VALUE! | O276: =COS(R[-268]C[-4]:R[-266]C[-4]) -> #VALUE!
C277: EXPECTED VALUE | D277: 1 | E277: #VALUE! | F277: 0.54030230586813977 | G277: 0.54030230586813977 | H277: 0.54030230586813977 | I277: 1 | J277: #VALUE! | K277: 1 | L277: 0.54030230586813977 | M277: 1 | N277: #VALUE! | O277: #VALUE!
B280: Cosh | C280: FORMULA | D280: =COSH(R[-273]C[-2]) -> 1 | E280: =COSH(R[-272]C[-2]) -> 1.00000000005 | F280: =COSH(R[-267]C[-4]) -> 4.0947118061319582E+231 | G280: =COSH(R[-264]C[-5]) -> 1.5430806348152437 | H280: =COSH(R[-262]C[-6]) -> #VALUE! | I280: =COSH(R[-272]C[-5]) -> 1 | J280: =COSH(R[-273]C[-5]) -> #VALUE! | K280: =COSH(R[-265]C[-6]) -> 1.5430806348152437 | L280: =COSH(R[-270]C[-3]:R[-270]C) -> 45.014120148530026 | M280: =COSH(R[-1]C[-2]:R[1]C[-2]) -> 2.4463520074491623 | N280: =COSH(R[-272]C[-1]:R[-271]C) -> #VALUE!
C281: EXPECTED VALUE | D281: 1 | E281: 1.00000000005 | F281: 4.0947118061319582E+231 | G281: 1.5430806348152437 | H281: #VALUE! | I281: 1 | J281: #VALUE! | K281: 1.5430806348152437 | L281: 45.014120148530026 | M281: 2.4463520074491623 | N281: #VALUE!
B284: Count | C284: FORMULA | D284: =COUNT(R[-276]C[-2]:R[-275]C[1]) -> 4 | E284: =COUNT(R[-274]C:R[-271]C[1]) -> 2 | F284: =COUNT(2, "A",  "",#REF!, #DIV/0!) -> 1
C285: EXPECTED VALUE | D285: 4 | E285: 2 | F285: 1
B288: Counta | C288: FORMULA | D288: =COUNTA(R[-279]C[-1]:R[-277]C) -> 3 | E288: =COUNTA(R[-278]C:R[-275]C[1]) -> 8 | F288: =COUNTA(2, "A",  "",#REF!, #DIV/0!) -> 5
C289: EXPECTED VALUE | D289: 3 | E289: 8 | F289: 5
B292: Countblank | C292: FORMULA | D292: =COUNTBLANK(R[-284]C[-2]:R[-283]C[1]) -> 2 | E292: =COUNTBLANK(R[-282]C[2]:R[-274]C[2]) -> 6
C293: EXPECTED VALUE | D293: 2 | E293: 6
B296: Countif | C296: FORMULA | D296: =COUNTIF(R[-289]C[6]:R[-286]C[7], 4) -> 2 | E296: =COUNTIF(R[-289]C[22]:R[-283]C[22], 1/0) -> 1 | F296: =COUNTIF(R[-289]C[1]:R[-289]C[5],R[-288]C[-1]:R[-288]C[1]) -> 2
C297: EXPECTED VALUE | D297: 2 | E297: 1 | F297: 2
B300: Covar | C300: FORMULA
C301: EXPECTED VALUE
B304: Createobject | C304: FORMULA | D304: WILL_NEVER_IMPLEMENT
C305: EXPECTED VALUE | D305: WILL_NEVER_IMPLEMENT
B308: Critbinom | C308: FORMULA
C309: EXPECTED VALUE
B312: Customrepeat | C312: FORMULA
C313: EXPECTED VALUE
B316: Customundo | C316: FORMULA | D316: WILL_NEVER_IMPLEMENT
C317: EXPECTED VALUE | D317: WILL_NEVER_IMPLEMENT
B320: Date | C320: FORMULA | D320: =DATE(1900, 1, 1) -> 1 | E320: =DATE(1900, 1, 32) -> 32 | F320: =DATE(1900, 222, 1) -> 6727 | G320: =DATE(2007, 1, 1) -> 39083 | H320: =DATE(1900, 2, 29) -> 60 | I320: =DATE(1900, 1, 22222) -> 22222 | J320: =DATE(R[-312]C[-8],R[-311]C[-8],R[-310]C[-7]) -> 398 | K320: =DATE(R[-312]C[-8],R[-311]C[-8],R[-310]C[-8]) -> 1 | L320: =DATE(R[-312]C[-7],R[-311]C[-7],R[-310]C[-7]) -> #VALUE!
C321: EXPECTED VALUE | D321: 1 | E321: 32 | F321: 6727 | G321: 39083 | H321: 60 | I321: 22222 | J321: 398 | K321: 1 | L321: #VALUE!
B324: Datedif | C324: FORMULA
C325: EXPECTED VALUE
B328: Datestring | C328: FORMULA
C329: EXPECTED VALUE
B332: Datevalue | C332: FORMULA
C333: EXPECTED VALUE
B336: Daverage | C336: FORMULA
C337: EXPECTED VALUE
B340: Day | C340: FORMULA | D340: =DAY(R[-320]C[-1]) -> 25 | E340: =DAY(1) -> 1 | F340: =DAY(0) -> 0 | G340: =DAY(R[-324]C[-4]) -> #NUM! | H340: =DAY(#DIV/0!) -> #DIV/0!
C341: EXPECTED VALUE | D341: 25 | E341: 1 | F341: 0 | G341: #NUM! | H341: #DIV/0!
B344: Days360 | C344: FORMULA | D344: =DAYS360(R[-334]C[-2],R[-334]C[-1]) -> -526 | E344: =DAYS360(DATE(1972,2,16), DATE(2012,2,16)) -> 14400 | F344: =DAYS360(DATE(2008,1,16), DATE(2008,5,16)) -> 120
C345: EXPECTED VALUE | D345: -526 | E345: 14400 | F345: 120
B348: Db | C348: FORMULA | D348: WILL_NEVER_IMPLEMENT
C349: EXPECTED VALUE | D349: WILL_NEVER_IMPLEMENT
B352: Dbcs | C352: FORMULA | D352: WILL_NEVER_IMPLEMENT
C353: EXPECTED VALUE | D353: WILL_NEVER_IMPLEMENT
B356: Dcount | C356: FORMULA
C357: EXPECTED VALUE
B360: Dcounta | C360: FORMULA
C361: EXPECTED VALUE
B364: Ddb | C364: FORMULA
C365: EXPECTED VALUE
B368: Degrees | C368: FORMULA | D368: =DEGREES(R[-361]C[-2]) -> 0 | E368: =DEGREES(R[-360]C[-3]) -> 57.295779513082323 | F368: =DEGREES(R[-355]C[-4]) -> -30595.946259985962 | G368: =DEGREES(R[-352]C[-5]) -> 57.295779513082323 | H368: =DEGREES(R[-361]C[-4]) -> 0 | I368: =DEGREES(R[-361]C[-4]) -> #VALUE! | J368: =DEGREES("1") -> 57.295779513082323 | K368: =DEGREES(R[-353]C[-6]) -> 57.295779513082323 | L368: =DEGREES(R[-357]C[-6]) -> 0 | M368: =DEGREES(R[-360]C[-2]:R[-360]C[1]) -> 171.88733853924697 | N368: =DEGREES(R[-2]C[-2]:R[1]C[-2]) -> 0 | O368: =DEGREES(R[-360]C[-1]:R[-359]C) -> #VALUE!
C369: EXPECTED VALUE | D369: 0 | E369: 57.295779513082323 | F369: -30595.946259985962 | G369: 57.295779513082323 | H369: 0 | I369: #VALUE! | J369: 57.295779513082323 | K369: 57.295779513082323 | L369: 0 | M369: 171.88733853924697 | N369: 0 | O369: #VALUE!
B372: Deletebar | C372: FORMULA | D372: WILL_NEVER_IMPLEMENT
C373: EXPECTED VALUE | D373: WILL_NEVER_IMPLEMENT
B376: Deletecommand | C376: FORMULA | D376: WILL_NEVER_IMPLEMENT
C377: EXPECTED VALUE | D377: WILL_NEVER_IMPLEMENT
B380: Deletemenu | C380: FORMULA | D380: WILL_NEVER_IMPLEMENT
C381: EXPECTED VALUE | D381: WILL_NEVER_IMPLEMENT
B384: Deletetoolbar | C384: FORMULA | D384: WILL_NEVER_IMPLEMENT
C385: EXPECTED VALUE | D385: WILL_NEVER_IMPLEMENT
B388: Deref | C388: FORMULA
C389: EXPECTED VALUE
B392: Devsq | C392: FORMULA | D392: =DEVSQ(R[-385]C[-2]:R[-383]C[-2]) -> 2 | E392: =DEVSQ(R[-385]C[-3]:R[-383]C[-3],R[-385]C[-2]:R[-383]C[-2],R[-377]C[-3]:R[-375]C[-3]) -> 5.8371340000857153 | F392: =DEVSQ(R[-379]C[-4]:R[-378]C[-2]) -> 749730712528.75537 | G392: =DEVSQ(R[-385]C[-3]:R[-383]C[-3],R[-383]C[-4]) -> 0 | H392: =DEVSQ(R[-377]C[-3]:R[-375]C[-3]) -> #NUM! | I392: =DEVSQ("1","2",2) -> 0.66666666666666663 | J392: =DEVSQ(R[-382]C[-4],R[-385]C[-1]) -> 4.4999700000499994
C393: EXPECTED VALUE | D393: 2 | E393: 5.8371340000857153 | F393: 749730712528.75537 | G393: 0 | H393: #NUM! | I393: 0.66666666666666663 | J393: 4.4999700000499994
B396: Dget | C396: FORMULA | D396: WILL_NEVER_IMPLEMENT
C397: EXPECTED VALUE | D397: WILL_NEVER_IMPLEMENT
B400: Dialogbox | C400: FORMULA | D400: WILL_NEVER_IMPLEMENT
C401: EXPECTED VALUE | D401: WILL_NEVER_IMPLEMENT
B404: Directory | C404: FORMULA
C405: EXPECTED VALUE
B408: Dmax | C408: FORMULA
C409: EXPECTED VALUE
B412: Dmin | C412: FORMULA
C413: EXPECTED VALUE
B416: Documents | C416: FORMULA | D416: WILL_NEVER_IMPLEMENT
C417: EXPECTED VALUE | D417: WILL_NEVER_IMPLEMENT
B420: Dollar | C420: FORMULA | D420: =DOLLAR(R[-413]C[-2]) -> $0.00 | E420: =DOLLAR(R[-412]C[-3]) -> $1.00 | F420: =DOLLAR(R[-404]C[-4]) -> $1.00 | G420: =DOLLAR(R[-413]C[-3]) -> $0.00 | H420: =DOLLAR(R[-405]C[-5]) -> ($1.00) | I420: =DOLLAR(R[-413]C[-4]) -> #VALUE! | J420: =DOLLAR(R[-405]C[-5]) -> $1.00 | K420: =DOLLAR(R[-411]C[-2]:R[-411]C[1]) -> $3.00 | L420: =DOLLAR(R[-2]C[-2]:R[1]C[-2]) -> $1.00 | M420: =DOLLAR(R[-411]C[-2]:R[-410]C[-1]) -> #VALUE! | N420: =DOLLAR(R[-410]C[-7]) -> #VALUE!
C421: EXPECTED VALUE | D421: 0 | E421: 1 | F421: 1 | G421: 0 | H421: -1.0000100000000001 | I421: #VALUE! | J421: 1 | K421: 3 | L421: 1 | M421: #VALUE! | N421: #VALUE!
B424: Dproduct | C424: FORMULA
C425: EXPECTED VALUE
B428: Dstdev | C428: FORMULA
C429: EXPECTED VALUE
B432: Dstdevp | C432: FORMULA
C433: EXPECTED VALUE
B436: Dsum | C436: FORMULA
C437: EXPECTED VALUE
B440: Dvar | C440: FORMULA
C441: EXPECTED VALUE
B444: Dvarp | C444: FORMULA
C445: EXPECTED VALUE
B448: Echo | C448: FORMULA
C449: EXPECTED VALUE
B452: Enablecommand | C452: FORMULA | D452: WILL_NEVER_IMPLEMENT
C453: EXPECTED VALUE | D453: WILL_NEVER_IMPLEMENT
B456: Enabletool | C456: FORMULA | D456: WILL_NEVER_IMPLEMENT
C457: EXPECTED VALUE | D457: WILL_NEVER_IMPLEMENT
B460: Error.type | C460: FORMULA | D460: =ERROR.TYPE(R[-453]C[23]) -> 1 | E460: =ERROR.TYPE(R[-452]C[22]) -> 2 | F460: =ERROR.TYPE(R[-451]C[21]) -> 3 | G460: =ERROR.TYPE(R[-450]C[20]) -> 4 | H460: =ERROR.TYPE(R[-449]C[19]) -> 5 | I460: =ERROR.TYPE(R[-448]C[18]) -> 6 | J460: =ERROR.TYPE(R[-447]C[17]) -> 7 | K460: =ERROR.TYPE(R[-446]C[-10]) -> #N/A
C461: EXPECTED VALUE | D461: 1 | E461: 2 | F461: 3 | G461: 4 | H461: 5 | I461: 6 | J461: 7 | K461: #N/A
B464: Errortype | C464: FORMULA
C465: EXPECTED VALUE
B468: Evaluate | C468: FORMULA
C469: EXPECTED VALUE
B472: Even | C472: FORMULA | D472: =EVEN(R[-465]C[-2]) -> 0 | E472: =EVEN(R[-465]C[-2]) -> 0 | F472: =EVEN(R[-463]C[-3]) -> 2 | G472: =EVEN(R[-457]C[-4]) -> -2 | H472: =EVEN(R[-455]C[-5]) -> -2 | I472: =EVEN(R[-465]C[-5]) -> 0 | J472: =EVEN(R[-465]C[-5]) -> #VALUE! | K472: =EVEN(R[-456]C[-6]) -> 2 | L472: =EVEN(R[-462]C[-6]) -> 2 | M472: =EVEN(R[-461]C[-3]:R[-461]C) -> 0 | N472: =EVEN(R[-2]C[-2]:R[1]C[-2]) -> 2
C473: EXPECTED VALUE | D473: 0 | E473: 0 | F473: 2 | G473: -2 | H473: -2 | I473: 0 | J473: #VALUE! | K473: 2 | L473: 2 | M473: 0 | N473: 2
B476: Exact | C476: FORMULA | D476: =EXACT(123,"123") -> 1 | E476: =EXACT(TRUE,R[-458]C[-3]) -> 1 | F476: =EXACT(R[-467]C[-3],R[-460]C[-3]) -> 0 | G476: =EXACT(R[-463]C[-2],R[-462]C[-2]) -> 0 | H476: =EXACT(R[-468]C[-4],R[-467]C[-4]) -> 1 | I476: =EXACT(R[-467]C[-4],R[-464]C[-3]) -> 1 | J476: =EXACT(R[-464]C[-4]:R[-464]C[-3],R[-464]C[-4]:R[-464]C[-3]) -> #VALUE! | K476: =EXACT(R[-467]C[-1]:R[-467]C[1],R[-467]C) -> 1 | L476: =EXACT(R[-1]C[-4]:R[1]C[-4],R[-458]C[-10]) -> 1
C477: EXPECTED VALUE | D477: 1 | E477: 1 | F477: 0 | G477: 0 | H477: 1 | I477: 1 | J477: #VALUE! | K477: 1 | L477: 1
B480: Exec | C480: FORMULA | D480: WILL_NEVER_IMPLEMENT
C481: EXPECTED VALUE | D481: WILL_NEVER_IMPLEMENT
B484: Execute | C484: FORMULA | D484: WILL_NEVER_IMPLEMENT
C485: EXPECTED VALUE | D485: WILL_NEVER_IMPLEMENT
B488: Exp | C488: FORMULA | D488: =EXP(R[-480]C[-2]) -> 2.7182818284590451 | E488: =EXP(R[-481]C[-3]) -> 1 | F488: =EXP(R[-471]C[-4]) -> 1 | G488: =EXP(R[-473]C[-5]) -> 0.36787944117144233 | H488: =EXP(R[-472]C[-6]) -> 2.7182818284590451 | I488: =EXP(R[-473]C[-4]) -> 2.7182818284590451 | J488: =EXP(R[-478]C[-5]) -> #VALUE! | K488: =EXP(R[-476]C[-3]:R[-476]C[1]) -> 1 | L488: =EXP(R[-2]C[-1]:R[1]C[-1]) -> 2.7182818284590451
C489: EXPECTED VALUE | D489: 2.7182818284590451 | E489: 1 | F489: 1 | G489: 0.36787944117144233 | H489: 2.7182818284590451 | I489: 2.7182818284590451 | J489: #VALUE! | K489: 1 | L489: 2.7182818284590451
B492: Expondist | C492: FORMULA
C493: EXPECTED VALUE
B496: Externalflag | C496: FORMULA | D496: NOT_A_FUNCTION
C497: EXPECTED VALUE | D497: NOT_A_FUNCTION
B500: Fact | C500: FORMULA | D500: =FACT(1) -> 1 | E500: =FACT(0) -> 1 | F500: =FACT(R[-491]C[-4]) -> 2 | G500: =FACT(R[-489]C[-4]) -> 2 | H500: =FACT(15) -> 1307674368000 | I500: =FACT(R[-484]C[-7]) -> 1 | J500: =FACT(R[-482]C[-8]) -> #VALUE! | K500: =FACT(R[-491]C[-7]) -> 1 | L500: =FACT(R[-485]C[-9]) -> #NUM! | M500: =FACT(R[-486]C[-11]) -> #NUM! | N500: =FACT(R[-483]C[-9]) -> 2 | P500: =FACT(R[-488]C[-9]) -> #VALUE! | Q500: =FACT(R[-492]C[-11]) -> 1 | R500: =FACT(R[-492]C[-11]) -> 1 | S500: =FACT(R[-2]C[-12]:R[1]C[-12]) -> 2 | T500: =FACT(R[-489]C[-11]:R[-489]C[-10]) -> #VALUE!
C501: EXPECTED VALUE | D501: 1 | E501: 1 | F501: 2 | G501: 2 | H501: 1307674368000 | I501: 1 | J501: #VALUE! | K501: 1 | L501: #NUM! | M501: #NUM! | N501: 2 | P501: #VALUE! | Q501: 1 | R501: 1 | S501: 2 | T501: #VALUE!
B504: False | C504: FORMULA | D504: =FALSE() -> 0
C505: EXPECTED VALUE | D505: 0
B508: Fclose | C508: FORMULA | D508: WILL_NEVER_IMPLEMENT
C509: EXPECTED VALUE | D509: WILL_NEVER_IMPLEMENT
B512: Fdist | C512: FORMULA
C513: EXPECTED VALUE
B516: Files | C516: FORMULA | D516: WILL_NEVER_IMPLEMENT
C517: EXPECTED VALUE | D517: WILL_NEVER_IMPLEMENT
B520: Find | C520: FORMULA | D520: =FIND("o",R[-512]C[1]) -> 2 | E520: =FIND("O",R[-512]C) -> #VALUE! | F520: =FIND("Space",R[-510]C[-1]) -> 9 | G520: =FIND("s",R[-511]C[-2]) -> 1 | H520: =FIND("s",R[-511]C[-3],3) -> 8
C521: EXPECTED VALUE | D521: 2 | E521: #VALUE! | F521: 9 | G521: 1 | H521: 8
B524: Findb | C524: FORMULA
C525: EXPECTED VALUE
B528: Finv | C528: FORMULA
C529: EXPECTED VALUE
B532: Fisher | C532: FORMULA
C533: EXPECTED VALUE
B536: Fisherinv | C536: FORMULA
C537: EXPECTED VALUE
B540: Fixed | C540: FORMULA
C541: EXPECTED VALUE
B544: Floor | C544: FORMULA | D544: =FLOOR(1.002,2) -> 0 | E544: =FLOOR(R[-534]C[-3],R[-535]C[-3]) -> 534 | F544: =FLOOR(R[-530]C[-3],R[-528]C[-3]) -> -2.2000000000000002 | G544: =FLOOR(R[-528]C[-4],R[-529]C[-4]) -> -1.0000100000000001 | H544: =FLOOR(R[-527]C[-5],R[-528]C[-5]) -> 0 | I544: =FLOOR(0,0) -> 0 | J544: =FLOOR(1,0) -> #DIV/0! | K544: =FLOOR(R[-535]C:R[-535]C[1],R[-537]C) -> 3 | L544: =FLOOR(R[-2]C[-6]:R[1]C[-6],RC[-5]) -> -2.0000200000000001 | M544: =FLOOR(R[-537]C[-6]:R[-536]C[-5],R[-534]C[-5]) -> #VALUE!
C545: EXPECTED VALUE | D545: 0 | E545: 534 | F545: -2.2000000000000002 | G545: -1.0000100000000001 | H545: 0 | I545: 0 | J545: #DIV/0! | K545: 3 | L545: -2.0000200000000001 | M545: #VALUE!
B548: Fopen | C548: FORMULA | D548: WILL_NEVER_IMPLEMENT
C549: EXPECTED VALUE | D549: WILL_NEVER_IMPLEMENT
B552: Forecast | C552: FORMULA
C553: EXPECTED VALUE
B556: Formulaconvert | C556: FORMULA
C557: EXPECTED VALUE
B560: Fpos | C560: FORMULA
C561: EXPECTED VALUE
B564: Fread | C564: FORMULA | D564: WILL_NEVER_IMPLEMENT
C565: EXPECTED VALUE | D565: WILL_NEVER_IMPLEMENT
B568: Freadln | C568: FORMULA | D568: WILL_NEVER_IMPLEMENT
C569: EXPECTED VALUE | D569: WILL_NEVER_IMPLEMENT
B572: Frequency | C572: FORMULA
C573: EXPECTED VALUE
B576: Fsize | C576: FORMULA | D576: WILL_NEVER_IMPLEMENT
C577: EXPECTED VALUE | D577: WILL_NEVER_IMPLEMENT
B580: Ftest | C580: FORMULA
C581: EXPECTED VALUE
B584: Fv | C584: FORMULA | D584: =FV(0,0,0) -> 0 | E584: =FV(0.01,10,100) -> -1046.2212541120473 | F584: =FV(0.01,10,R[-568]C[-4]) -> -10.462212541120474
C585: EXPECTED VALUE | D585: 0 | E585: -1046.2212541120473 | F585: -10.462212541120474
B588: Fwrite | C588: FORMULA
C589: EXPECTED VALUE
B592: Fwriteln | C592: FORMULA
C593: EXPECTED VALUE
B596: Gammadist | C596: FORMULA
C597: EXPECTED VALUE
B600: Gammainv | C600: FORMULA
C601: EXPECTED VALUE
B604: Gammaln | C604: FORMULA
C605: EXPECTED VALUE
B608: Geomean | C608: FORMULA
C609: EXPECTED VALUE
B612: Getbar | C612: FORMULA | D612: WILL_NEVER_IMPLEMENT
C613: EXPECTED VALUE | D613: WILL_NEVER_IMPLEMENT
B616: Getcell | C616: FORMULA | D616: WILL_NEVER_IMPLEMENT
C617: EXPECTED VALUE | D617: WILL_NEVER_IMPLEMENT
B620: Getchartitem | C620: FORMULA | D620: WILL_NEVER_IMPLEMENT
C621: EXPECTED VALUE | D621: WILL_NEVER_IMPLEMENT
B624: Getdef | C624: FORMULA | D624: WILL_NEVER_IMPLEMENT
C625: EXPECTED VALUE | D625: WILL_NEVER_IMPLEMENT
B628: Getdocument | C628: FORMULA | D628: WILL_NEVER_IMPLEMENT
C629: EXPECTED VALUE | D629: WILL_NEVER_IMPLEMENT
B632: Getformula | C632: FORMULA | D632: WILL_NEVER_IMPLEMENT
C633: EXPECTED VALUE | D633: WILL_NEVER_IMPLEMENT
B636: Getlinkinfo | C636: FORMULA | D636: WILL_NEVER_IMPLEMENT
C637: EXPECTED VALUE | D637: WILL_NEVER_IMPLEMENT
B640: Getmovie | C640: FORMULA | D640: WILL_NEVER_IMPLEMENT
C641: EXPECTED VALUE | D641: WILL_NEVER_IMPLEMENT
B644: Getname | C644: FORMULA | D644: WILL_NEVER_IMPLEMENT
C645: EXPECTED VALUE | D645: WILL_NEVER_IMPLEMENT
B648: Getnote | C648: FORMULA | D648: WILL_NEVER_IMPLEMENT
C649: EXPECTED VALUE | D649: WILL_NEVER_IMPLEMENT
B652: Getobject | C652: FORMULA | D652: WILL_NEVER_IMPLEMENT
C653: EXPECTED VALUE | D653: WILL_NEVER_IMPLEMENT
B656: Getpivotdata | C656: FORMULA
C657: EXPECTED VALUE
B660: Getpivotfield | C660: FORMULA
C661: EXPECTED VALUE
B664: Getpivotitem | C664: FORMULA
C665: EXPECTED VALUE
B668: Getpivottable | C668: FORMULA
C669: EXPECTED VALUE
B672: Gettool | C672: FORMULA | D672: WILL_NEVER_IMPLEMENT
C673: EXPECTED VALUE | D673: WILL_NEVER_IMPLEMENT
B676: Gettoolbar | C676: FORMULA | D676: WILL_NEVER_IMPLEMENT
C677: EXPECTED VALUE | D677: WILL_NEVER_IMPLEMENT
B680: Getwindow | C680: FORMULA | D680: WILL_NEVER_IMPLEMENT
C681: EXPECTED VALUE | D681: WILL_NEVER_IMPLEMENT
B684: Getworkbook | C684: FORMULA | D684: WILL_NEVER_IMPLEMENT
C685: EXPECTED VALUE | D685: WILL_NEVER_IMPLEMENT
B688: Getworkspace | C688: FORMULA | D688: WILL_NEVER_IMPLEMENT
C689: EXPECTED VALUE | D689: WILL_NEVER_IMPLEMENT
B692: Goto | C692: FORMULA
C693: EXPECTED VALUE
B696: Group | C696: FORMULA
C697: EXPECTED VALUE
B700: Growth | C700: FORMULA
C701: EXPECTED VALUE
B704: Halt | C704: FORMULA
C705: EXPECTED VALUE
B708: Harmean | C708: FORMULA
C709: EXPECTED VALUE
B712: Help | C712: FORMULA
C713: EXPECTED VALUE
B716: Hlookup | C716: FORMULA | D716: =HLOOKUP("DOUBLE",R6C2:R12C8,3, FALSE) -> 1.0000000000000001E-5 | E716: =HLOOKUP("DOUBLE",R6C2:R12C8,3, FALSE) -> 1.0000000000000001E-5 | F716: =HLOOKUP("STRing",R6C2:R12C8,3, FALSE) -> nospaces | G716: =HLOOKUP("STRING",R6C2:R12C8,6, TRUE) -> beginsWithSpace
C717: EXPECTED VALUE | D717: 1.0000000000000001E-5 | E717: 1.0000000000000001E-5 | F717: nospaces | G717: beginsWithSpace
B720: Hour | C720: FORMULA | D720: =HOUR(1) -> 0 | E720: =HOUR(0.75) -> 18 | F720: =HOUR(0.33) -> 7 | G720: =HOUR(R[-713]C[-3]) -> 0 | H720: =HOUR(R[-712]C[-3]) -> #VALUE!
C721: EXPECTED VALUE | D721: 0 | E721: 18 | F721: 7 | G721: 0 | H721: #VALUE!
B724: Hyperlink | C724: FORMULA | D724: =HYPERLINK("http://poi.apache.org") -> http://poi.apache.org
C725: EXPECTED VALUE | D725: http://poi.apache.org
B728: Hypgeomdist | C728: FORMULA
C729: EXPECTED VALUE
B732: If | C732: FORMULA | D732: =IF(1>2,3) -> 0 | E732: =IF(1>2,3,4) -> 4 | F732: =IF(R[-722]C[-4],3) -> 3 | G732: =IF(R[-725]C[-3],#VALUE!, 3) -> 3 | H732: =IF(ISERROR(R[-724]C[-6]/R[-725]C[-6]),"error detected") -> error detected | I732: =IF(ISERROR(R[-724]C[-7]/R[-724]C[-7]),1,IF(3>4,2,IF(R[-724]C[-7]>R[-725]C[-7],3,-1))) -> 3 | J732: =IF(ISERROR((R[-723]C[-8]+R[-724]C[-8])/(R[-725]C[-8]*R[-724]C[-7])),"error detected") -> error detected | K732: =IF(R[-725]C[-9]*R[-724]C[-9]/R[-724]C[-8]*R[-721]C[-8]>0,R[-716]C[-9],R[-715]C[-9]) -> 0 | L732: =IF(R[-721]C[15],1) -> #NAME? | M732: =IF("tRue", "A", "B") -> A
C733: EXPECTED VALUE | D733: 0 | E733: 4 | F733: 3 | G733: 3 | H733: error detected | I733: 3 | J733: error detected | K733: 0 | L733: #NAME? | M733: A
B736: Index | C736: FORMULA | D736: =INDEX(R[-722]C[-2]:R[-721]C[-1],2,2) -> -1.0000100000000001 | E736: =INDEX(R[-722]C[-3]:R[-721]C[-2],R[-729]C[-1],2) -> #VALUE!
C737: EXPECTED VALUE | D737: -1.0000100000000001 | E737: #VALUE!
B740: Indirect | C740: FORMULA | D740: =INDIRECT("B9") -> 2 | E740: =INDIRECT("$B$9") -> 2 | F740: =INDIRECT(R[-730]C[-2]) -> #REF!
C741: EXPECTED VALUE | D741: 2 | E741: 2 | F741: #REF!
B744: Info | C744: FORMULA
C745: EXPECTED VALUE
B748: Initiate | C748: FORMULA
C749: EXPECTED VALUE
B752: Input | C752: FORMULA
C753: EXPECTED VALUE
B756: Int | C756: FORMULA | D756: =INT(R[-749]C[-2]) -> 0 | E756: =INT(R[-742]C[-3]) -> -2 | F756: =INT(R[-740]C[-4]) -> 1 | G756: =INT(R[-738]C[-5]) -> #VALUE! | H756: =INT(R[-747]C[-5]) -> 1 | I756: =INT(R[-739]C[-6]) -> -1 | J756: =INT(R[-742]C[-5]) -> 0 | K756: =INT(R[-749]C[-6]) -> #VALUE! | L756: =INT(R[-746]C[-6]) -> 0 | M756: =INT(R[-748]C[-3]:R[-748]C) -> 3 | N756: =INT(R[-2]C[-1]:R[1]C[-1]) -> 3 | O756: =INT(R[-748]C[-1]:R[-747]C) -> #VALUE!
C757: EXPECTED VALUE | D757: 0 | E757: -2 | F757: 1 | G757: #VALUE! | H757: 1 | I757: -1 | J757: 0 | K757: #VALUE! | L757: 0 | M757: 3 | N757: 3 | O757: #VALUE!
B760: Intercept | C760: FORMULA
C761: EXPECTED VALUE
B764: Ipmt | C764: FORMULA
C765: EXPECTED VALUE
B768: Irr | C768: FORMULA | D768: =TRUNC(IRR(R[-761]C[34]:R[-757]C[34]),4) -> -7.6799999999999993E-2 | E768: =TRUNC(IRR(R[-761]C[33]:R[-756]C[33]),4) -> 5.3800000000000001E-2 | F768: =TRUNC(IRR(R[-761]C[32]:R[-759]C[32], -10%),4) -> -0.44350000000000001
C769: EXPECTED VALUE | D769: -7.6799999999999993E-2 | E769: 5.3800000000000001E-2 | F769: -0.44350000000000001
B772: Isblank | C772: FORMULA | D772: =ISBLANK(R[-765]C[-2]) -> 0 | E772: =ISBLANK(R[-761]C[-3]) -> 0 | F772: =ISBLANK(R[-755]C[-4]) -> 0 | G772: =ISBLANK(R[-764]C[-3]) -> 1 | H772: =ISBLANK(R[-765]C[-3]) -> 0 | I772: =ISBLANK(R[-757]C[-3]) -> 1 | J772: =ISBLANK(R[-758]C:R[-758]C[1]) -> 1 | K772: =ISBLANK(R[-759]C:R[-758]C[1]) -> 0 | L772: =ISBLANK(R[-765]C[-8]:R[-765]C[-8]) -> 1
C773: EXPECTED VALUE | D773: 0 | E773: 0 | F773: 0 | G773: 1 | H773: 0 | I773: 1 | J773: 1 | K773: 0 | L773: 1
B776: Iserr | C776: FORMULA
C777: EXPECTED VALUE
B780: IsError | C780: FORMULA | D780: =ISERROR(R[-773]C[-2]) -> 0 | E780: =ISERROR(R[-763]C[-3]) -> 0 | F780: =ISERROR(R[-772]C[-4]/R[-773]C[-3]) -> 1 | G780: =ISERROR(R[-770]C[-4]:R[-767]C[-4]) -> 1 | H780: =ISERROR(R[-764]C[-5]:R[-764]C[-3]) -> 1 | I780: =ISERROR(R[-766]C[-3]) -> 0 | J780: =ISERROR(R[-769]C[-1]:R[-769]C[1]) -> 0 | K780: =ISERROR(R[-2]C[-2]:R[1]C[-2]) -> 0 | L780: =ISERROR(RC[-4]) -> 0
C781: EXPECTED VALUE | D781: 0 | E781: 0 | F781: 1 | G781: 1 | H781: 1 | I781: 0 | J781: 0 | K781: 0 | L781: 0
B784: Islogical | C784: FORMULA | D784: =ISLOGICAL(R[-777]C[-2]) -> 0 | E784: =ISLOGICAL(R[-768]C[-3]) -> 1 | F784: =ISLOGICAL(R[-767]C[-4]) -> 1 | G784: =ISLOGICAL(R[-766]C[-5]) -> 0 | H784: =ISLOGICAL(R[-765]C[-6]) -> 0 | I784: =ISLOGICAL(R[-766]C[-6]) -> 0 | J784: =ISLOGICAL(TRUE()) -> 1 | K784: =ISLOGICAL(TRUE) -> 1 | L784: =ISLOGICAL(R[-768]C[-10]:R[-767]C[-10]) -> 0
C785: EXPECTED VALUE | D785: 0 | E785: 1 | F785: 1 | G785: 0 | H785: 0 | I785: 0 | J785: 1 | K785: 1 | L785: 0
B788: IsNa | C788: FORMULA | D788: =ISNA(#N/A) -> 1 | E788: =ISNA(42) -> 0 | F788: =ISNA(R[-775]C[21]) -> 1 | G788: =ISNA(R[-780]C[20]) -> 0 | H788: =ISNA(R[-774]C[19]) -> 0 | I788: =ISNA(R[-772]C[-7]) -> 0
C789: EXPECTED VALUE | D789: 1 | E789: 0 | F789: 1 | G789: 0 | H789: 0 | I789: 0
B792: Isnontext | C792: FORMULA | D792: =ISNONTEXT(1) -> 1 | E792: =ISNONTEXT(TRUE) -> 1 | F792: =ISNONTEXT("1") -> 0 | G792: =ISNONTEXT("true") -> 0 | H792: =ISNONTEXT(R[-785]C[-6]) -> 1 | I792: =ISNONTEXT(R[-774]C[-7]) -> 0 | J792: =ISNONTEXT(R[-780]C[-4]) -> 0 | K792: =ISNONTEXT(R[-774]C[-9]:R[-773]C[-9]) -> 1 | L792: =ISNONTEXT(R[-785]C[-8]) -> 1
C793: EXPECTED VALUE | D793: 1 | E793: 1 | F793: 0 | G793: 0 | H793: 1 | I793: 0 | J793: 0 | K793: 1 | L793: 1
B796: Isnumber | C796: FORMULA | D796: =ISNUMBER(0) -> 1 | E796: =ISNUMBER("a") -> 0 | F796: =ISNUMBER(TRUE) -> 0 | G796: =ISNUMBER(R[-789]C[-5]) -> 1 | H796: =ISNUMBER(R[-778]C[-6]) -> 0 | I796: =ISNUMBER(R[-780]C[-7]) -> 0 | J796: =ISNUMBER(R[-786]C[-7]) -> 1 | K796: =ISNUMBER(R[-789]C[-7]) -> 0 | L796: =ISNUMBER(R[-789]C[-7]) -> 0 | M796: =ISNUMBER(R[-781]C[-8]) -> 0 | N796: =ISNUMBER(R[-789]C[-8]) -> 1 | O796: =ISNUMBER(R[-783]C[-9]) -> 0 | P796: =ISNUMBER(R[-789]C[-9]:R[-789]C[-6]) -> 0 | Q796: =ISNUMBER(R[-789]C[-6]:R[-787]C[-6]) -> 0
C797: EXPECTED VALUE | D797: 1 | E797: 0 | F797: 0 | G797: 1 | H797: 0 | I797: 0 | J797: 1 | K797: 0 | L797: 0 | M797: 0 | N797: 1 | O797: 0 | P797: 0 | Q797: 0
B800: Ispmt | C800: FORMULA
C801: EXPECTED VALUE
B804: Isref | C804: FORMULA | D804: =ISREF(0) -> 0 | E804: =ISREF("a17") -> 0 | F804: =ISREF(TRUE) -> 0 | G804: =ISREF(R[-797]C[-5]) -> 1 | H804: =ISREF(R[-797]C[-1]:R[-795]C[-1]) -> 1 | I804: =ISREF(R[-797]C[-2]:R[-795]C) -> 1 | J804: =ISREF(R[-797]C[-6]) -> 1 | K804: =ISREF("") -> 0
C805: EXPECTED VALUE | D805: 0 | E805: 0 | F805: 0 | G805: 1 | H805: 1 | I805: 1 | J805: 1 | K805: 0
B808: Istext | C808: FORMULA | D808: =ISTEXT(1) -> 0 | E808: =ISTEXT(TRUE) -> 0 | F808: =ISTEXT("1") -> 1 | G808: =ISTEXT("true") -> 1 | H808: =ISTEXT(R[-785]C[-6]) -> 1 | I808: =ISTEXT(R[-774]C[-7]) -> 0 | J808: =ISTEXT(R[-780]C[-4]) -> 1 | K808: =ISTEXT(R[-774]C[-9]:R[-773]C[-9]) -> 0 | L808: =ISTEXT(R[-785]C[-8]) -> 0
C809: EXPECTED VALUE | D809: 0 | E809: 0 | F809: 1 | G809: 1 | H809: 1 | I809: 0 | J809: 1 | K809: 0 | L809: 0
B812: Kurt | C812: FORMULA
C813: EXPECTED VALUE
B816: Large | C816: FORMULA | D816: =LARGE(R[-809]C[-2]:R[-802]C[-1],1) -> 9999999999 | E816: =LARGE(R[-808]C[-3]:R[-806]C[-3],3) -> 1 | F816: =LARGE(R[-807]C[-4]:R[-800]C[-4],4) -> -1 | G816: =LARGE(TRUE,1) -> 1 | H816: =LARGE("2.3",1) -> 2.2999999999999998 | I816: =LARGE(R[-808]C[-4]:R[-804]C[-4],3) -> #NUM! | J816: =LARGE(R[-809]C[-6]:R[-808]C[-6],1) -> #NUM! | K816: =LARGE(R[-809]C[-8]:R[-807]C[-6],3) -> 0 | L816: =LARGE(R[-808]C[-7]:R[-806]C[-6],2) -> 1 | M816: =LARGE(R[-806]C[-7]:R[-803]C[-4],3) -> 345
C817: EXPECTED VALUE | D817: 9999999999 | E817: 1 | F817: -1 | G817: 1 | H817: 2.2999999999999998 | I817: #NUM! | J817: #NUM! | K817: 0 | L817: 1 | M817: 345
B820: Lasterror | C820: FORMULA
C821: EXPECTED VALUE
B824: Left | C824: FORMULA | D824: =LEFT("a string",0) ->  | E824: =LEFT("a string","6") -> a stri | F824: =LEFT("a string",10) -> a string | G824: =LEFT("a string",R[-815]C[-5]) -> a | H824: =LEFT(R[-812]C[-3], R[-807]C[-3]) -> no | I824: =LEFT(TRUE,2) -> TR | J824: =LEFT(R[-817]C[-3]:R[-815]C[-2],R[-814]C[-2]) -> #VALUE! | K824: =LEFT("a string", TRUE) -> a
C825: EXPECTED VALUE | E825: a stri | F825: a string | G825: a | H825: no | I825: TR | J825: #VALUE! | K825: a
B828: Leftb | C828: FORMULA
C829: EXPECTED VALUE
B832: Len | C832: FORMULA | D832: =LEN(R[-822]C[-2]) -> 3 | E832: =LEN(R[-812]C[1]) -> 1 | F832: =LEN(R[-825]C[-2]) -> 0 | G832: =LEN(R[-818]C[-2]) -> 8 | H832: =LEN(R[-821]C[-1]) -> 10 | I832: =LEN(R[-821]C[-1]:R[-821]C[1]) -> 3 | J832: =LEN(R[-1]C[-3]:R[1]C[-3]) -> 1 | K832: =LEN(R[-824]C:R[-822]C[1]) -> #VALUE! | L832: =LEN(R[-820]C[15]) -> #NUM!
C833: EXPECTED VALUE | D833: 3 | E833: 1 | F833: 0 | G833: 8 | H833: 10 | I833: 3 | J833: 1 | K833: #VALUE! | L833: #NUM!
B836: Lenb | C836: FORMULA
C837: EXPECTED VALUE
B840: Linest | C840: FORMULA
C841: EXPECTED VALUE
B844: Links | C844: FORMULA
C845: EXPECTED VALUE
B848: Ln | C848: FORMULA | D848: =LN(R[-841]C[-2]) -> #NUM! | E848: =LN(R[-840]C[-3]) -> 0 | F848: =LN(R[-835]C[-4]) -> #NUM! | G848: =LN(R[-832]C[-5]) -> 0 | H848: =LN(R[-833]C[-6]) -> #NUM! | I848: =LN(R[-830]C[-7]) -> #VALUE! | J848: =LN(R[-839]C[-7]) -> 9.5310179804324935E-2 | K848: =LN(R[-841]C[-6]) -> #VALUE! | L848: =LN(R[-832]C[-7]) -> 9.5310179804324935E-2 | M848: =LN(R[-835]C[-6]) -> #NUM! | N848: =LN(R[-840]C[-3]:R[-840]C) -> #NUM! | O848: =LN(R[-839]C[-2]:R[-839]C) -> 6.1180971980413483 | P848: =LN(R[-2]C[-1]:R[1]C[-1]) -> 1.8112511328273146
C849: EXPECTED VALUE | D849: #NUM! | E849: 0 | F849: #NUM! | G849: 0 | H849: #NUM! | I849: #VALUE! | J849: 9.5310179804324935E-2 | K849: #VALUE! | L849: 9.5310179804324935E-2 | M849: #NUM! | N849: #NUM! | O849: 6.1180971980413483 | P849: 1.8112511328273146
B852: Log | C852: FORMULA | D852: =LOG(R[-845]C[-2]) -> #NUM! | E852: =LOG(R[-845]C[-3],2) -> #NUM! | F852: =LOG(R[-844]C[-4],2) -> 0 | G852: =LOG(R[-842]C[-5],534) -> 1 | H852: =LOG(R[-840]C[-6],20) -> #NUM! | I852: =LOG(R[-841]C[-7],12) -> 9.2662840802510242 | J852: =LOG(R[-843]C[-7],R[-842]C[-7]) -> 9531.0656353805316 | K852: =LOG(R[-835]C[-5],R[-837]C[-6]) -> #NUM! | L852: =LOG(R[-837]C[-6],R[-836]C[-6]) -> #NUM! | M852: =LOG(R[-842]C[-11],R[-843]C[-11]) -> 9.0606959316875546
C853: EXPECTED VALUE | D853: #NUM! | E853: #NUM! | F853: 0 | G853: 1 | H853: #NUM! | I853: 9.2662840802510242 | J853: 9531.0656353805316 | K853: #NUM! | L853: #NUM! | M853: 9.0606959316875546
B856: Log10 | C856: FORMULA | D856: =LOG10(R[-849]C[-2]) -> #NUM! | E856: =LOG10(R[-848]C[-3]) -> 0 | F856: =LOG10(R[-846]C[-4]) -> 2.7275412570285562 | G856: =LOG10(R[-843]C[-5]) -> #NUM! | H856: =LOG10(R[-840]C[-6]) -> 0 | I856: =LOG10(R[-839]C[-7]) -> #NUM! | J856: =LOG10(R[-838]C[-8]) -> #VALUE! | K856: =LOG10(R[-849]C[-6]) -> #VALUE! | L856: =LOG10(R[-841]C[-7]) -> 0 | M856: =LOG10(R[-843]C[-7]) -> 0.47711980706897666 | N856: =LOG10(R[-847]C[-2]:R[-847]C) -> 2.537819095073274 | O856: =LOG10(R[-1]C[-1]:R[1]C[-1]) -> 0.40446066078012233
C857: EXPECTED VALUE | D857: #NUM! | E857: 0 | F857: 2.7275412570285562 | G857: #NUM! | H857: 0 | I857: #NUM! | J857: #VALUE! | K857: #VALUE! | L857: 0 | M857: 0.47711980706897666 | N857: 2.537819095073274 | O857: 0.40446066078012233
B860: Logest | C860: FORMULA
C861: EXPECTED VALUE
B864: Loginv | C864: FORMULA
C865: EXPECTED VALUE
B868: Lognormdist | C868: FORMULA
C869: EXPECTED VALUE
B872: Lookup | C872: FORMULA | D872: =LOOKUP(534,R[-866]C[-2]:R[-857]C[-2],R[-866]C[1]:R[-857]C[1]) -> endsWithSpace | E872: =LOOKUP("DOUBLE",R[-866]C[-2]:R[-866]C[2],R[-863]C[-2]:R[-863]C[2]) -> 1.1000000000000001
C873: EXPECTED VALUE | D873: endsWithSpace | E873: 1.1000000000000001
B876: Lower | C876: FORMULA | D876: =LOWER("ALL UPPER") -> all upper | E876: =LOWER("MixedCase") -> mixedcase | F876: =LOWER(R[-866]C[-4]) -> 534 | G876: =LOWER(R[-860]C[-5]) -> true | H876: =LOWER(R[-858]C[-6]) -> true | I876: =LOWER(R[-865]C[-4]) -> beginswithspace | J876: =LOWER(R[-857]C[-5]) -> alph4num3ric | K876: =LOWER(R[-865]C[-6]:R[-865]C[-4]) -> #VALUE! | L876: =LOWER(R[-865]C[-6]:R[-862]C[-6]) -> #VALUE! | M876: =LOWER(R[-869]C[-2]:R[-869]C) -> alphanum | N876: =LOWER(R[-1]C[-1]:R[1]C[-1]) -> alphanum | O876: =LOWER(R[-868]C[-1]:R[-866]C) -> #VALUE! | P876: =LOWER(R[-868]C[11]) -> #DIV/0!
C877: EXPECTED VALUE | D877: all upper | E877: mixedcase | F877: 534 | G877: true | H877: true | I877: beginswithspace | J877: alph4num3ric | K877: #VALUE! | L877: #VALUE! | M877: alphanum | N877: alphanum | O877: #VALUE! | P877: #DIV/0!
B880: Match | C880: FORMULA | D880: =MATCH(5,R[-873]C[-2]:R[-870]C[-2]) -> 3 | E880: =MATCH(600, R[-873]C[-3]:R[-870]C[-3]) -> 4 | F880: =MATCH(-5, R[-873]C[-4]:R[-870]C[-4]) -> #N/A
C881: EXPECTED VALUE | D881: 3 | E881: 4 | F881: #N/A
B884: Max | C884: FORMULA | D884: =MAX(R[-877]C[-2]:R[-865]C[-2]) -> 9999999999 | E884: =MAX(R[-877]C[-2]:R[-865]C) -> 999999.99999000004 | F884: =MAX(R[-871]C[-3]:R[-869]C[-3],R[-865]C[-1],R[-867]C[-1]) -> -1.0000100000000001 | G884: =MAX(R[-868]C[-5]:R[-865]C[-5]) -> 0 | H884: =MAX(R[-870]C[-6]:R[-868]C[-6]) -> -1 | I884: =MAX(R[-875]C[-5]:R[-872]C) -> 9999999999 | J884: =MAX(R[-876]C[-3]:R[-875]C[-1]) -> 5.6788999999999996 | K884: =MAX(R[-873]C[-5],R[-873]C[-6],R[-871]C[-6]:R[-869]C[-6],R[-875]C[-3]:R[-873]C[-2],R[-876]C[1]) -> 345
C885: EXPECTED VALUE | D885: 9999999999 | E885: 999999.99999000004 | F885: -1.0000100000000001 | G885: 0 | H885: -1 | I885: 9999999999 | J885: 5.6788999999999996 | K885: 345
B888: Maxa | C888: FORMULA | D888: =MAXA(R[-881]C[-2]:R[-878]C[-2]) -> 534 | E888: =MAXA(R[-874]C[-2]:R[-871]C[-2]) -> -1.0000000000000001E-5 | F888: =MAXA(R[-874]C[-4]:R[-871]C[-4]) -> 1 | G888: =MAXA(R[-877]C[-5]:R[-869]C[-5],R[-875]C[-4]:R[-874]C[-4],R[-878]C[-4]:R[-877]C[-3],R[-878]C[-2]:R[-873]C[-2]) -> 9999999999 | H888: =MAXA(R[-873]C[-3]:R[-871]C[-3],R[-874]C[-5],R[-879]C[-1]) -> 2.3456000000000001 | I888: =MAXA(R[-880]C,R[-880]C[-2]:R[-879]C[-2],R[-876]C[-3]) -> 3.5 | J888: =MAXA(R[-874]C[-4],R[-869]C[-5],R[-876]C[-4]) -> 0
C889: EXPECTED VALUE | D889: 534 | E889: -1.0000000000000001E-5 | F889: 1 | G889: 9999999999 | H889: 2.3456000000000001 | I889: 3.5 | J889: 0
B892: Mdeterm | C892: FORMULA
C893: EXPECTED VALUE
B896: Median | C896: FORMULA | D896: =MEDIAN(R[-889]C[-2]:R[-887]C[-2],R[-886]C[-2]:R[-884]C[-2],R[-883]C[-2]:R[-881]C[-2],R[-880]C[-2]:R[-878]C[-2]) -> 0 | E896: =MEDIAN(R[-881]C[-3]:R[-879]C[-3]) -> -1 | F896: =MEDIAN(R[-880]C[-4]:R[-880]C[-2]) -> -1.1000000000000001 | G896: =MEDIAN(R[-889]C[-4]:R[-887]C[-3]) -> 1.0000000000000001E-5 | H896: =MEDIAN(R[-889]C[-3]:R[-886]C[-3]) -> #NUM! | I896: =MEDIAN(R[-887]C[-5]:R[-880]C[-5]) -> #NUM! | J896: =MEDIAN("2",2) -> 2 | K896: =MEDIAN(TRUE,2) -> 1.5 | L896: =MEDIAN(R[-887]C[-7]:R[-886]C[-5]) -> 2.3456000000000001
C897: EXPECTED VALUE | D897: 0 | E897: -1 | F897: -1.1000000000000001 | G897: 1.0000000000000001E-5 | H897: #NUM! | I897: #NUM! | J897: 2 | K897: 1.5 | L897: 2.3456000000000001
B900: Mid | C900: FORMULA | D900: =MID(R[-892]C[1],1,3) -> nos | E900: =MID(R[-892]C,2,4) -> ospa | F900: =MID(R[-891]C[-1],4,1) -> a | G900: =MID(R[-880]C[-2], 1, 2) -> 
C901: EXPECTED VALUE | D901: nos | E901: ospa | F901: a
B904: Midb | C904: FORMULA
C905: EXPECTED VALUE
B908: Min | C908: FORMULA | D908: =MIN(R[-901]C[-2]:R[-896]C[-2]) -> -9999999999 | E908: =MIN(R[-893]C[-3]:R[-889]C[-3]) -> -1 | F908: =MIN(R[-895]C[-4]:R[-891]C[-3]) -> -999999.99999000004 | G908: =MIN(R[-898]C[-4]:R[-896]C[-2]) -> 1.0000100000000001 | H908: =MIN(R[-901]C[-3]:R[-900]C[-1],R[-899]C[-1],R[-900]C,R[-898]C,R[-893]C[-3]) -> 0 | I908: =MIN(1,"-2",R[-894]C[-6],R[-889]C[-4],R[-892]C[-4]) -> -2.9999899999999999 | J908: =MIN("-100",R[-891]C[-5]) -> -100 | K908: =MIN(R[-892]C[-6],R[-899]C[-9]) -> 2 | L908: =MIN(R[-899]C[-5],R[-900]C[-5],R[-901]C[-5],R[-898]C[-6],R[-896]C[-6],R[-892]C[-7],"-20") -> -20 | M908: =MIN(R[-898]C[-8]:R[-896]C[-8]) -> 0
C909: EXPECTED VALUE | D909: -9999999999 | E909: -1 | F909: -999999.99999000004 | G909: 1.0000100000000001 | H909: 0 | I909: -2.9999899999999999 | J909: -100 | K909: 2 | L909: -20 | M909: 0
B912: Mina | C912: FORMULA | D912: =MINA(R[-904]C[-2]:R[-900]C) -> -9999999999 | E912: =MINA(R[-897]C:R[-895]C) -> 0 | F912: =MINA(R[-896]C[-4],R[-902]C[-4],R[-903]C[-4]) -> 1 | G912: =MINA(R[-903]C[-2]:R[-899]C,R[-901]C[2],R[-903]C[2],R[-904]C[1],R[-898]C[1]) -> 0 | H912: =MINA("-23",R[-899]C[-3],R[-905]C[11]) -> -23 | I912: =MINA(R[-903]C[-4]:R[-898]C[-4]) -> 0 | J912: =MINA(R[-900]C[-4]:R[-898]C[-4],R[-902]C[-4]) -> 0
C913: EXPECTED VALUE | D913: -9999999999 | E913: 0 | F913: 1 | G913: 0 | H913: -23 | I913: 0 | J913: 0
B916: Minute | C916: FORMULA | D916: =MINUTE(1) -> 0 | E916: =MINUTE(TIME(0,15,0)) -> 15 | F916: =MINUTE(R[-907]C[-1]) -> #VALUE!
C917: EXPECTED VALUE | D917: 0 | E917: 15 | F917: #VALUE!
B920: Minverse | C920: FORMULA
C921: EXPECTED VALUE
B924: Mirr | C924: FORMULA
C925: EXPECTED VALUE
B928: Mmult | C928: FORMULA
C929: EXPECTED VALUE
B932: Mod | C932: FORMULA | D932: =MOD(R[-921]C[-1],R[-917]C[-1]) -> -4.0000000000262048E-5 | E932: =MOD(R[-923]C[-3],R[-918]C[-3]) -> 0 | F932: =MOD(R[-918]C[-4],R[-916]C[-4]) -> 0 | G932: =MOD("23","3") -> 2 | H932: =MOD(R[-915]C[-3],R[-916]C[-3]) -> 0.79998999999999976 | I932: =MOD(R[-915]C[-5],R[-916]C[-5]) -> #DIV/0! | J932: =MOD(R[-915]C[-6],R[-916]C[-5]) -> 0 | K932: =MOD(R[-921]C[-2]:R[-921]C[1],R[-925]C[-1]) -> 0 | L932: =MOD(R[-1]C[-5]:R[1]C[-5],3) -> 2 | M932: =MOD(R[-924]C[-4]:R[-923]C[-3],2) -> #VALUE! | N932: =MOD(700,R[-923]C[-1]:R[-923]C[1]) -> 10
C933: EXPECTED VALUE | D933: -4.0000000000262048E-5 | E933: 0 | F933: 0 | G933: 2 | H933: 0.79998999999999976 | I933: #DIV/0! | J933: 0 | K933: 0 | L933: 2 | M933: #VALUE! | N933: 10
B936: Mode | C936: FORMULA | D936: =MODE(R[-929]C[-2]:R[-921]C[-2]) -> #N/A | E936: =MODE(R[-928]C[-3]:R[-920]C[-3]) -> #N/A | F936: =MODE(R[-929]C[-4]:R[-927]C[-3]) -> 0 | G936: =MODE(R[-927]C[-4],R[-920]C[-2],"1",R[-928]C[-5]) -> #VALUE! | H936: =MODE(R[-928]C[-6],"1",2,3) -> #VALUE! | I936: =MODE(1,1,2,3) -> 1 | J936: =MODE(R[-929]C[-5]:R[-927]C[-3]) -> 1 | K936: =MODE("1",1,#DIV/0!,2,3) -> #VALUE! | L936: =MODE(R[-920]C[-9]:R[-920]C[-7],-1.1) -> -1.1000000000000001 | M936: =MODE(R[-927]C[-11],2,R[-929]C[-9]) -> #VALUE!
C937: EXPECTED VALUE | D937: #N/A | E937: #N/A | F937: 0 | G937: #VALUE! | H937: #VALUE! | I937: 1 | J937: 1 | K937: #VALUE! | L937: -1.1000000000000001 | M937: #VALUE!
B940: Month | C940: FORMULA | D940: =MONTH(R[-920]C[-1]) -> 12 | E940: =MONTH(1) -> 1 | F940: =MONTH(0) -> 1 | G940: =MONTH(-10) -> #NUM! | H940: =MONTH(#N/A) -> #N/A | I940: =MONTH(R[-920]C[-6]+60) -> 2
C941: EXPECTED VALUE | D941: 12 | E941: 1 | F941: 1 | G941: #NUM! | H941: #N/A | I941: 2
B944: Moviecommand | C944: FORMULA | D944: WILL_NEVER_IMPLEMENT
C945: EXPECTED VALUE | D945: WILL_NEVER_IMPLEMENT
B948: N | C948: FORMULA
C949: EXPECTED VALUE
B952: Na | C952: FORMULA | D952: =NA() -> #N/A
C953: EXPECTED VALUE | D953: #N/A
B956: Names | C956: FORMULA
C957: EXPECTED VALUE
B960: Negbinomdist | C960: FORMULA
C961: EXPECTED VALUE
B964: Normdist | C964: FORMULA
C965: EXPECTED VALUE
B968: Norminv | C968: FORMULA
C969: EXPECTED VALUE
B972: Normsdist | C972: FORMULA
C973: EXPECTED VALUE
B976: Normsinv | C976: FORMULA
C977: EXPECTED VALUE
B980: Not | C980: FORMULA | D980: =NOT(0) -> 1 | E980: =NOT(FALSE) -> 1 | F980: =NOT(TRUE) -> 0 | G980: =NOT(1+1=2) -> 0 | H980: =NOT(R[-972]C[-3]) -> #VALUE!
C981: EXPECTED VALUE | D981: 1 | E981: 1 | F981: 0 | G981: 0 | H981: #VALUE!
B984: Note | C984: FORMULA
C985: EXPECTED VALUE
B988: Now | C988: FORMULA
C989: EXPECTED VALUE
B992: Nper | C992: FORMULA | D992: =NPER(0.01,1,10) -> -9.5785940398131615 | E992: =NPER("0.01", TRUE, "10", -20) -> 8.7445712382444132 | F992: =NPER(0.01, "100", "1000", -2000, TRUE) -> 8.6690930741204877 | G992: =NPER(0.05,10, 100, -200,R[-985]C[-3]) -> 5.8963128603698989 | H992: =NPER(0.01, #N/A, -200, 300) -> #N/A | I992: =NPER(12,4500,100000,100000) -> #NUM!
C993: EXPECTED VALUE | D993: -9.5785940398131615 | E993: 8.7445712382444132 | F993: 8.6690930741204877 | G993: 5.8963128603698989 | H993: #N/A | I993: #NUM!
B996: Npv | C996: FORMULA | D996: =TRUNC(NPV(5%,R[-987]C[34]:R[-984]C[34]),4) -> 62368.560400000002 | E996: =TRUNC(NPV(10%,-10000,3000,4200,6800),2) -> 1188.44
C997: EXPECTED VALUE | D997: 62368.56 | E997: 1188.44
B1000: Numberstring | C1000: FORMULA
C1001: EXPECTED VALUE
B1004: Odd | C1004: FORMULA | D1004: =ODD(R[-997]C[-2]) -> 1 | E1004: =ODD(R[-987]C[-2]) -> -1 | F1004: =ODD(R[-991]C[-4]) -> -535 | G1004: =ODD(R[-996]C[-5]) -> 1 | H1004: =ODD(R[-987]C[-6]) -> 1 | I1004: =ODD(R[-988]C[-7]) -> 1 | J1004: =ODD(R[-993]C[-2]:R[-993]C) -> 1 | K1004: =ODD(R[-2]C[-1]:R[1]C[-1]) -> 1 | L1004: =ODD(R[-994]C[-1]:R[-994]C[1]) -> 5 | M1004: =ODD(R[-997]C[-1]:R[-997]C[1]) -> #VALUE! | N1004: =ODD(R[-996]C[-3]:R[-995]C[-2]) -> #VALUE!
C1005: EXPECTED VALUE | D1005: 1 | E1005: -1 | F1005: -535 | G1005: 1 | H1005: 1 | I1005: 1 | J1005: 1 | K1005: 1 | L1005: 5 | M1005: #VALUE! | N1005: #VALUE!
B1008: Offset | C1008: FORMULA | D1008: =OFFSET(R[-1001]C[3], 2, 0) -> 2.3456000000000001 | E1008: =OFFSET(R[-1001]C[2], 0, 3) -> 4 | F1008: =OFFSET(R[-1001]C[1], "2.1", "1.9") -> 3.4567000000000001 | G1008: =OFFSET(R[-1001]C[-1], R[-1001]C[-2]:R[-1001]C[2], R[-1001]C[-2]:R[-1001]C[2]) -> 1.0009999999999999
C1009: EXPECTED VALUE | D1009: 2.3456000000000001 | E1009: 4 | F1009: 3.4567000000000001 | G1009: 1.0009999999999999
B1012: Opendialog | C1012: FORMULA | D1012: WILL_NEVER_IMPLEMENT
C1013: EXPECTED VALUE | D1013: WILL_NEVER_IMPLEMENT
B1016: Optionslistsget | C1016: FORMULA | D1016: WILL_NEVER_IMPLEMENT
C1017: EXPECTED VALUE | D1017: WILL_NEVER_IMPLEMENT
B1020: Or | C1020: FORMULA | D1020: =OR(R[-1013]C[-2]) -> 0 | E1020: =OR(R[-1013]C[-3]:R[-1011]C[-3],R[-1012]C[-2],R[-1013]C[-1],R[-1002]C[-3],R[-1003]C[-3],R[-1012]C,R[-1005]C,R[-1008]C[1]) -> 1 | F1020: =OR(R[-1013]C[-1]:R[-1004]C[-1],R[-1002]C[-1],R[-1001]C[-1],R[-1002]C[-4]) -> #VALUE! | G1020: =OR(R[-1013]C[-3],R[-1013]C[-2],R[-1012]C[-2],R[-1002]C[-5]) -> #VALUE! | H1020: =OR(R[-1008]C) -> 1 | I1020: =OR(R[-1007]C[-1]:R[-1007]C[1]) -> #VALUE! | J1020: =OR(R[-1008]C[-1]:R[-1008]C[1]) -> 1 | K1020: =OR(R[-1008]C[-1]:R[-1008]C[1]) -> 0
C1021: EXPECTED VALUE | D1021: 0 | E1021: 1 | F1021: #VALUE! | G1021: #VALUE! | H1021: 1 | I1021: #VALUE! | J1021: 1 | K1021: 0
B1024: Pause | C1024: FORMULA | D1024: WILL_NEVER_IMPLEMENT
C1025: EXPECTED VALUE | D1025: WILL_NEVER_IMPLEMENT
B1028: Pearson | C1028: FORMULA
C1029: EXPECTED VALUE
B1032: Percentile | C1032: FORMULA
C1033: EXPECTED VALUE
B1036: Percentrank | C1036: FORMULA
C1037: EXPECTED VALUE
B1040: Permut | C1040: FORMULA
C1041: EXPECTED VALUE
B1044: Phonetic | C1044: FORMULA | D1044: WILL_NEVER_IMPLEMENT
C1045: EXPECTED VALUE | D1045: WILL_NEVER_IMPLEMENT
B1048: Pi | C1048: FORMULA | D1048: =PI() -> 3.1415926535897931
C1049: EXPECTED VALUE | D1049: 3.14159265358979
B1052: Pivotadddata | C1052: FORMULA | D1052: WILL_NEVER_IMPLEMENT
C1053: EXPECTED VALUE | D1053: WILL_NEVER_IMPLEMENT
B1056: Pmt | C1056: FORMULA | D1056: =PMT(0.01, 10, R[-1040]C[-2]) -> -0.10558207655117136 | E1056: =PMT("0.01", "12", "200", "-300", TRUE) -> 5.8266127404298702 | F1056: =PMT("0.01", "12", "200", "-300", "TRUE") -> #VALUE!
C1057: EXPECTED VALUE | D1057: -0.10558207655117115 | E1057: 5.8266127404298693 | F1057: #VALUE!
B1060: Poisson | C1060: FORMULA | D1060: =POISSON(2, 5, TRUE) -> 0.12465201948308113 | E1060: =POISSON(2, 5, FALSE) -> 8.4224337488568335E-2
C1061: EXPECTED VALUE | D1061: 0.124652019 | E1061: 8.4224336999999996E-2
B1064: Poke | C1064: FORMULA | D1064: WILL_NEVER_IMPLEMENT
C1065: EXPECTED VALUE | D1065: WILL_NEVER_IMPLEMENT
B1068: Power | C1068: FORMULA | D1068: =POWER(R[-1060]C[-2],R[-1059]C[-2]) -> 1 | E1068: =POWER(R[-1061]C[-3],R[-1059]C[-3]) -> 0 | F1068: =POWER(R[-1055]C[-4],R[-1053]C[-4]) -> -1.8726591760299626E-3 | G1068: =POWER(R[-1052]C[-5],R[-1054]C[-5]) -> 1 | H1068: =POWER(R[-1054]C[-6],R[-1052]C[-6]) -> -2 | I1068: =POWER(R[-1059]C[-6],R[-1061]C[-5]) -> 1 | J1068: =POWER(R[-1059]C[-7],R[-1061]C[-5]) -> #VALUE! | K1068: =POWER(R[-1061]C[-6],R[-1059]C[-8]) -> #VALUE! | L1068: =POWER(R[-1053]C[-7],R[-1052]C[-9]) -> 1 | M1068: =POWER(R[-1057]C[-3]:R[-1057]C,R[-1060]C[-1]:R[-1060]C) -> 0 | N1068: =POWER(R[-2]C[-6]:R[1]C[-6],RC[-2]) -> -2
C1069: EXPECTED VALUE | D1069: 1 | E1069: 0 | F1069: -1.8726591760299626E-3 | G1069: 1 | H1069: -2 | I1069: 1 | J1069: #VALUE! | K1069: #VALUE! | L1069: 1 | M1069: 0 | N1069: -2
B1072: Ppmt | C1072: FORMULA
C1073: EXPECTED VALUE
B1076: Presstool | C1076: FORMULA | D1076: WILL_NEVER_IMPLEMENT
C1077: EXPECTED VALUE | D1077: WILL_NEVER_IMPLEMENT
B1080: Prob | C1080: FORMULA
C1081: EXPECTED VALUE
B1084: Product | C1084: FORMULA | D1084: =PRODUCT("2",R[-1075]C[-2]:R[-1074]C[-2]) -> 2136 | E1084: =PRODUCT("0",R[-1075]C[-3]:R[-1069]C[-3]) -> 0 | F1084: =PRODUCT(R[-1077]C[-4]:R[-1067]C[-4]) -> 0 | G1084: =PRODUCT(0,2/0,7) -> #DIV/0! | H1084: =PRODUCT(R[-1066]C[-6],R[-1070]C[-5]) -> -2.9999899999999999 | I1084: =PRODUCT(R[-1075]C[-6]:R[-1075]C[-4]) -> 1.1000000000000001 | J1084: =PRODUCT(R[-1074]C[-4]:R[-1072]C[-3]) -> 0 | K1084: =PRODUCT(R[-1076]C[-6]:R[-1075]C[-6]) -> 0 | L1084: =PRODUCT(R[-1077]C[-8]:R[-1074]C[-8]) -> 0
C1085: EXPECTED VALUE | D1085: 2136 | E1085: 0 | F1085: 0 | G1085: #DIV/0! | H1085: -2.9999899999999999 | I1085: 1.1000000000000001 | J1085: 0 | K1085: 0 | L1085: 0
B1088: Proper | C1088: FORMULA
C1089: EXPECTED VALUE
B1092: Pv | C1092: FORMULA | D1092: =PV(0.1, 10, R[-1076]C[-2]) -> -6.1445671057046853
C1093: EXPECTED VALUE | D1093: -6.1445671057046853
B1096: Quartile | C1096: FORMULA
C1097: EXPECTED VALUE
B1100: Radians | C1100: FORMULA | D1100: =RADIANS(R[-1093]C[-2]) -> 0 | E1100: =RADIANS(R[-1091]C[-3]) -> 3.4906585039886591E-2 | F1100: =RADIANS(R[-1086]C[-4]) -> -3.4906585039886591E-2 | G1100: =RADIANS(R[-1085]C[-5]) -> -1.7453292519943295E-2 | H1100: =RADIANS(R[-1084]C[-6]) -> 1.7453292519943295E-2 | I1100: =RADIANS(R[-1093]C[-5]) -> 0 | J1100: =RADIANS(R[-1093]C[-5]) -> #VALUE! | K1100: =RADIANS(R[-1085]C[-6]) -> 1.7453292519943295E-2 | L1100: =RADIANS(R[-1090]C[-2]:R[-1090]C[1]) -> 7.8539816339744828E-2 | M1100: =RADIANS(R[-2]C[-4]:R[1]C[-4]) -> 0 | N1100: =RADIANS(R[-1092]C[-3]:R[-1091]C[-2]) -> #VALUE!
C1101: EXPECTED VALUE | D1101: 0 | E1101: 3.4906585039886591E-2 | F1101: -3.4906585039886591E-2 | G1101: -1.7453292519943295E-2 | H1101: 1.7453292519943295E-2 | I1101: 0 | J1101: #VALUE! | K1101: 1.7453292519943295E-2 | L1101: 7.8539816339744828E-2 | M1101: 0 | N1101: #VALUE!
B1104: Rand | C1104: FORMULA | D1104: CANNOT_TEST
C1105: EXPECTED VALUE | D1105: CANNOT_TEST
B1108: Rank | C1108: FORMULA
C1109: EXPECTED VALUE
B1112: Rate | C1112: FORMULA | D1112: =RATE(58,-200,8000) -> 1.3541257643259374E-2
C1113: EXPECTED VALUE | D1113: 1.35412576432592E-2
B1116: Reftext | C1116: FORMULA | D1116: WILL_NEVER_IMPLEMENT
C1117: EXPECTED VALUE | D1117: WILL_NEVER_IMPLEMENT
B1120: Register | C1120: FORMULA | D1120: WILL_NEVER_IMPLEMENT
C1121: EXPECTED VALUE | D1121: WILL_NEVER_IMPLEMENT
B1124: Registerid | C1124: FORMULA | D1124: WILL_NEVER_IMPLEMENT
C1125: EXPECTED VALUE | D1125: WILL_NEVER_IMPLEMENT
B1128: Relref | C1128: FORMULA | D1128: WILL_NEVER_IMPLEMENT
C1129: EXPECTED VALUE | D1129: WILL_NEVER_IMPLEMENT
B1132: Renamecommand | C1132: FORMULA | D1132: WILL_NEVER_IMPLEMENT
C1133: EXPECTED VALUE | D1133: WILL_NEVER_IMPLEMENT
B1136: Replace | C1136: FORMULA | D1136: =REPLACE("ABCDEFG", 2.3, 3.9, "xx") -> AxxEFG | E1136: =REPLACE("ABCDEF", TRUE, TRUE, "xxx") -> xxxBCDEF | F1136: =REPLACE("ABCDEF", "3.9", "40", "x") -> ABx | G1136: =REPLACE(12345, 3, 1, 9009) -> 12900945 | H1136: =REPLACE("ABCDEF", -3, 4, "xx") -> #VALUE! | I1136: =REPLACE("ABCDEF",#NAME?, 2, "xx") -> #NAME?
C1137: EXPECTED VALUE | D1137: AxxEFG | E1137: xxxBCDEF | F1137: ABx | G1137: 12900945 | H1137: #VALUE! | I1137: #NAME?
B1140: Replaceb | C1140: FORMULA
C1141: EXPECTED VALUE
B1144: Rept | C1144: FORMULA
C1145: EXPECTED VALUE
B1148: Request | C1148: FORMULA
C1149: EXPECTED VALUE
B1152: Resettoolbar | C1152: FORMULA | D1152: WILL_NEVER_IMPLEMENT
C1153: EXPECTED VALUE | D1153: WILL_NEVER_IMPLEMENT
B1156: Restart | C1156: FORMULA | D1156: WILL_NEVER_IMPLEMENT
C1157: EXPECTED VALUE | D1157: WILL_NEVER_IMPLEMENT
B1160: Result | C1160: FORMULA
C1161: EXPECTED VALUE
B1164: Resume | C1164: FORMULA | D1164: WILL_NEVER_IMPLEMENT
C1165: EXPECTED VALUE | D1165: WILL_NEVER_IMPLEMENT
B1168: Right | C1168: FORMULA | D1168: =RIGHT("a string",0) ->  | E1168: =RIGHT("a string","6") -> string | F1168: =RIGHT("a string",10) -> a string | G1168: =RIGHT("a string",R[-1159]C[-5]) -> ng | H1168: =RIGHT(R[-1157]C[-3], R[-1151]C[-3]) -> ce | I1168: =RIGHT(TRUE,2) -> UE | J1168: =RIGHT(R[-801]C[-3]:R[-799]C[-2],R[-798]C[-2]) -> #VALUE! | K1168: =RIGHT("a string", TRUE) -> g
C1169: EXPECTED VALUE | E1169: string | F1169: a string | G1169: ng | H1169: ce | I1169: UE | J1169: #VALUE! | K1169: g
B1172: Rightb | C1172: FORMULA
C1173: EXPECTED VALUE
B1176: Roman | C1176: FORMULA
C1177: EXPECTED VALUE
B1180: Round | C1180: FORMULA | D1180: =ROUND(R[-1171]C[-2],R[-1172]C[-2]) -> 2 | E1180: =ROUND(R[-1170]C[-2],R[-1171]C[-2]) -> 1 | F1180: =ROUND(R[-1165]C[-3],R[-1164]C[-3]) -> 0 | G1180: =ROUND(R[-1165]C[-4],R[-1171]C[-4]) -> -1 | H1180: =ROUND(R[-1169]C[-5],R[-1163]C[-5]) -> 3 | I1180: =ROUND(R[-1173]C[-6],R[-1173]C[-6]) -> 0 | J1180: =ROUND(R[-1173]C[-6],R[-1172]C[-6]) -> 0 | K1180: =ROUND(R[-1173]C[-6],R[-1173]C[-8]) -> #VALUE! | L1180: =ROUND(R[-1173]C[-9],R[-1173]C[-7]) -> #VALUE! | M1180: =ROUND(R[-1167]C[-7],R[-1172]C[-7]) -> 3 | N1180: =ROUND(R[-1171]C[-1]:R[-1171]C[1],R[-1170]C[-3]) -> 345 | O1180: =ROUND(R[-1170]C[-1],R[-1170]C[-4]) -> 0 | P1180: =ROUND(R[-2]C[-2]:R[1]C[-2],R[-1170]C[-1]) -> 345
C1181: EXPECTED VALUE | D1181: 2 | E1181: 1 | F1181: 0 | G1181: -1 | H1181: 3 | I1181: 0 | J1181: 0 | K1181: #VALUE! | L1181: #VALUE! | M1181: 3 | N1181: 345 | O1181: 0 | P1181: 345
B1184: Rounddown | C1184: FORMULA | D1184: =ROUNDDOWN(1.5,0) -> 1 | E1184: =ROUNDDOWN(1.567,2) -> 1.56 | F1184: =ROUNDDOWN(R[-1171]C[-4],-1) -> -530 | G1184: =ROUNDDOWN(R[-1173]C[-4],1) -> 2.9 | H1184: =ROUNDDOWN(R[-1177]C[-4],-1) -> 0 | I1184: =ROUNDDOWN(R[-1171]C[-4],0) -> 0 | J1184: =ROUNDDOWN(R[-1167]C[-5],2) -> 2.99 | K1184: =ROUNDDOWN(R[-1177]C[-6],1) -> #VALUE! | L1184: =ROUNDDOWN(R[-1171]C[-6],3) -> 2.9990000000000001 | M1184: =ROUNDDOWN(R[-1177]C[-6]:R[-1177]C[-4],3) -> #VALUE! | N1184: =ROUNDDOWN(R[-1175]C[-2]:R[-1175]C[1],-2) -> 300 | O1184: =ROUNDDOWN(RC[-1]:R[2]C[-1],-2) -> 300 | P1184: =ROUNDDOWN(R[-1176]C[-5]:R[-1175]C[-4],2) -> #VALUE!
C1185: EXPECTED VALUE | D1185: 1 | E1185: 1.56 | F1185: -530 | G1185: 2.9 | H1185: 0 | I1185: 0 | J1185: 2.99 | K1185: #VALUE! | L1185: 2.9990000000000001 | M1185: #VALUE! | N1185: 300 | O1185: 300 | P1185: #VALUE!
B1188: Roundup | C1188: FORMULA | D1188: =ROUNDUP(0,0) -> 0 | E1188: =ROUNDUP(R[-1178]C[-3],-2) -> 600 | F1188: =ROUNDUP(R[-1175]C[-4],-2) -> -600 | G1188: =ROUNDUP(R[-1172]C[-5],0) -> 1 | H1188: =ROUNDUP(R[-1171]C[-6],-1) -> 0 | I1188: =ROUNDUP(R[-1180]C[-6],-1) -> 10 | J1188: =ROUNDUP(R[-1181]C[-5],0) -> #VALUE! | K1188: =ROUNDUP(R[-1171]C[-6],3) -> 3 | L1188: =ROUNDUP(R[-1179]C[-5]:R[-1179]C[-3],2) -> #VALUE! | M1188: =ROUNDUP(R[-1180]C[-2]:R[-1180]C[1],2) -> 3 | N1188: =ROUNDUP(R[-1]C[-3]:R[1]C[-3],1) -> 3 | O1188: =ROUNDUP(R[-1180]C[-1]:R[-1178]C,0) -> #VALUE!
C1189: EXPECTED VALUE | D1189: 0 | E1189: 600 | F1189: -600 | G1189: 1 | H1189: 0 | I1189: 10 | J1189: #VALUE! | K1189: 3 | L1189: #VALUE! | M1189: 3 | N1189: 3 | O1189: #VALUE!
B1192: Row | C1192: FORMULA | D1192: =ROW(R[-1175]C[1]) -> 17 | E1192: =ROW(R[-1179]C[-2]) -> 13 | F1192: =ROW(R[-1190]:R[-1189]) -> 2 | G1192: =ROW(R[-1181]C[-4]:R[-1178]C[-4]) -> 11 | H1192: =ROW(R[-1179]C[-5]:R[-1179]C[-3]) -> 13 | I1192: =ROW(R[-1178]C[-6]:R[-1175]C[-4]) -> 14 | J1192: =ROW(R[-4]C) -> 1188 | K1192: =ROW(R[-1179]C[-7]:R[-1175]C[-6]) -> 13
C1193: EXPECTED VALUE | D1193: 17 | E1193: 13 | F1193: 2 | G1193: 11 | H1193: 13 | I1193: 14 | J1193: 1188 | K1193: 13
B1196: Rows | C1196: FORMULA | D1196: =ROWS(R[-1190]C[-2]:R[-1186]C) -> 5
C1197: EXPECTED VALUE | D1197: 5
B1200: Rsq | C1200: FORMULA
C1201: EXPECTED VALUE
B1204: Savedialog | C1204: FORMULA | D1204: WILL_NEVER_IMPLEMENT
C1205: EXPECTED VALUE | D1205: WILL_NEVER_IMPLEMENT
B1208: Savetoolbar | C1208: FORMULA | D1208: WILL_NEVER_IMPLEMENT
C1209: EXPECTED VALUE | D1209: WILL_NEVER_IMPLEMENT
B1212: Scenarioget | C1212: FORMULA | D1212: WILL_NEVER_IMPLEMENT
C1213: EXPECTED VALUE | D1213: WILL_NEVER_IMPLEMENT
B1216: Search | C1216: FORMULA | D1216: =SEARCH("n","printer") -> 4 | E1216: =SEARCH("s",R8C5) -> 3 | F1216: =SEARCH("S",R8C5) -> 3 | G1216: =SEARCH("S",R8C5, 4) -> 8 | H1216: =SEARCH(R[-1208]C[-6],R[-1208]C[-5]) -> 7
C1217: EXPECTED VALUE | D1217: 4 | E1217: 3 | F1217: 3 | G1217: 8 | H1217: 7
B1220: Searchb | C1220: FORMULA
C1221: EXPECTED VALUE
B1224: Second | C1224: FORMULA | D1224: =SECOND(0.5) -> 0 | E1224: =SECOND(TIME(0,0,15)) -> 15 | F1224: =SECOND(R[-1213]C[-1]) -> #VALUE!
C1225: EXPECTED VALUE | D1225: 0 | E1225: 15 | F1225: #VALUE!
B1228: Selection | C1228: FORMULA
C1229: EXPECTED VALUE
B1232: Series | C1232: FORMULA
C1233: EXPECTED VALUE
B1236: Setname | C1236: FORMULA | D1236: WILL_NEVER_IMPLEMENT
C1237: EXPECTED VALUE | D1237: WILL_NEVER_IMPLEMENT
B1240: Setvalue | C1240: FORMULA | D1240: WILL_NEVER_IMPLEMENT
C1241: EXPECTED VALUE | D1241: WILL_NEVER_IMPLEMENT
B1244: Showbar | C1244: FORMULA | D1244: WILL_NEVER_IMPLEMENT
C1245: EXPECTED VALUE | D1245: WILL_NEVER_IMPLEMENT
B1248: Sign | C1248: FORMULA | D1248: =SIGN(R[-1241]C[-2]) -> 0 | E1248: =SIGN(R[-1241]C[-1]) -> 0 | F1248: =SIGN(R[-1237]C[-4]) -> 1 | G1248: =SIGN(R[-1236]C[-5]) -> -1 | H1248: =SIGN(R[-1232]C[-6]) -> 1 | I1248: =SIGN(R[-1231]C[-7]) -> 0 | J1248: =SIGN(R[-1233]C[-7]) -> -1 | K1248: =SIGN(R[-1232]C[-6]) -> 1 | L1248: =SIGN(R[-1241]C[-7]) -> #VALUE! | M1248: =SIGN(R[-1240]C[-3]:R[-1240]C) -> 1 | N1248: =SIGN(R[-2]C[-4]:R[1]C[-4]) -> -1 | O1248: =SIGN(R[-1239]C[-1]:R[-1238]C) -> #VALUE!
C1249: EXPECTED VALUE | D1249: 0 | E1249: 0 | F1249: 1 | G1249: -1 | H1249: 1 | I1249: 0 | J1249: -1 | K1249: 1 | L1249: #VALUE! | M1249: 1 | N1249: -1 | O1249: #VALUE!
B1252: Sin | C1252: FORMULA | D1252: =SIN(R[-1245]C[-2]) -> 0 | E1252: =SIN(R[-1244]C[-3]) -> 0.8414709848078965 | F1252: =SIN(R[-1243]C[-4]) -> 0.90929742682568171 | G1252: =SIN(R[-1239]C[-5]) -> 7.0692098333373365E-2 | H1252: =SIN(R[-1236]C[-6]) -> 0.8414709848078965 | I1252: =SIN(R[-1234]C[-7]) -> #VALUE! | J1252: =SIN(R[-1237]C[-7]) -> -0.84147638778888156 | K1252: =SIN(R[-1245]C[-6]) -> #VALUE! | L1252: =SIN(R[-1236]C[-7]) -> 0.89120736006143542 | M1252: =SIN(R[-1244]C[-2]:R[-1244]C) -> 0.14112000805986721 | N1252: =SIN(R[-1]C[-2]:R[1]C[-2]) -> 0.77783110790947796 | O1252: =SIN(R[-1244]C[-1]:R[-1243]C) -> #VALUE! | P1252: =SIN(R[-1237]C[-11]) -> 0.8414709848078965
C1253: EXPECTED VALUE | D1253: 0 | E1253: 0.8414709848078965 | F1253: 0.90929742682568171 | G1253: 7.0692098333373365E-2 | H1253: 0.8414709848078965 | I1253: #VALUE! | J1253: -0.84147638778888156 | K1253: #VALUE! | L1253: 0.89120736006143542 | M1253: 0.14112000805986721 | N1253: 0.77783110790947796 | O1253: #VALUE! | P1253: 0.8414709848078965
B1256: Sinh | C1256: FORMULA | D1256: =SINH(R[-1249]C[-2]) -> 0 | E1256: =SINH(R[-1247]C[-3]) -> 3.626860407847019 | F1256: =SINH(R[-1242]C[-4]) -> -3.626860407847019 | G1256: =SINH(R[-1240]C[-5]) -> 1.1752011936438014 | H1256: =SINH(R[-1238]C[-6]) -> #VALUE! | I1256: =SINH(R[-1249]C[-5]) -> 0 | J1256: =SINH(R[-1249]C[-5]) -> #VALUE! | K1256: =SINH(R[-1241]C[-6]) -> 1.1752011936438014 | L1256: =SINH(R[-1248]C[-6]) -> 1.1752011936438014 | M1256: =SINH(R[-1248]C[-2]:R[-1248]C) -> 10.017874927409903 | N1256: =SINH(R[-1]C[-2]:R[1]C[-2]) -> 1.4650188248182272 | O1256: =SINH(R[-1248]C[-1]:R[-1247]C) -> #VALUE!
C1257: EXPECTED VALUE | D1257: 0 | E1257: 3.626860407847019 | F1257: -3.626860407847019 | G1257: 1.1752011936438014 | H1257: #VALUE! | I1257: 0 | J1257: #VALUE! | K1257: 1.1752011936438014 | L1257: 1.1752011936438014 | M1257: 10.017874927409903 | N1257: 1.4650188248182272 | O1257: #VALUE!
B1260: Skew | C1260: FORMULA
C1261: EXPECTED VALUE
B1264: Sln | C1264: FORMULA
C1265: EXPECTED VALUE
B1268: Slope | C1268: FORMULA
C1269: EXPECTED VALUE
B1272: Small | C1272: FORMULA | D1272: =SMALL(R[-1265]C[-2]:R[-1255]C[-2],5) -> 0 | E1272: =SMALL(R[-1265]C[-2]:R[-1258]C[-2],6) -> 1.1000000000000001 | F1272: =SMALL(R[-1265]C[-3]:R[-1261]C[-2],3) -> 1.0000100000000001 | G1272: =SMALL(R[-1265]C[-3]:R[-1262]C[-2],2) -> #NUM! | H1272: =SMALL(R[-1264]C[-3]:R[-1262]C[-2],3) -> 9999999999 | I1272: =SMALL(R[-1262]C[-6]:R[-1257]C[-5],4) -> 1.0000100000000001 | J1272: =SMALL(R[-1262]C[-5]:R[-1261]C[-4],1) -> 0 | K1272: =SMALL(R[-1265]C[-8]:R[-1262]C[-8],100) -> #NUM!
C1273: EXPECTED VALUE | D1273: 0 | E1273: 1.1000000000000001 | F1273: 1.0000100000000001 | G1273: #NUM! | H1273: 9999999999 | I1273: 1.0000100000000001 | J1273: 0 | K1273: #NUM!
B1276: Spellingcheck | C1276: FORMULA | D1276: WILL_NEVER_IMPLEMENT
C1277: EXPECTED VALUE | D1277: WILL_NEVER_IMPLEMENT
B1280: Sqrt | C1280: FORMULA | D1280: =SQRT(16) -> 4 | E1280: =SQRT(R[-1273]C[-3]) -> 0 | F1280: =SQRT(R[-1272]C[-4]) -> 1 | G1280: =SQRT(R[-1271]C[-4]) -> 1.0488088481701516 | H1280: =SQRT(R[-1264]C[-5]) -> #NUM! | I1280: =SQRT(-4) -> #NUM! | J1280: =SQRT(R[-1264]C[-8]) -> 1 | K1280: =SQRT(R[-1267]C[-6]) -> 0 | L1280: =SQRT(R[-1273]C[-7]) -> #VALUE! | M1280: =SQRT(R[-1267]C[-2]) -> 0 | N1280: =SQRT(R[-1270]C[-2]:R[-1270]C) -> 3.1622776601683794E-3 | O1280: =SQRT(R[-1]C[-5]:R[1]C[-5]) -> 1 | P1280: =SQRT(R[-1273]C[-1]:R[-1272]C) -> #VALUE!
C1281: EXPECTED VALUE | D1281: 4 | E1281: 0 | F1281: 1 | G1281: 1.0488088481701516 | H1281: #NUM! | I1281: #NUM! | J1281: 1 | K1281: 0 | L1281: #VALUE! | M1281: 0 | N1281: 3.1622776601683794E-3 | O1281: 1 | P1281: #VALUE!
B1284: Standardize | C1284: FORMULA
C1285: EXPECTED VALUE
B1288: Stdev | C1288: FORMULA | D1288: =STDEV(R[-1281]C[-2]:R[-1279]C[-2],R[-1281]C[-1]:R[-1279]C[-1],R[-1278]C[-1]:R[-1277]C[-1]) -> 1.0696254184317784 | E1288: =STDEV(R[-1274]C[-3]:R[-1272]C[-3],R[-1273]C[-1]:R[-1271]C[-1],R[-1273]C) -> 0.70710678118654757 | F1288: =STDEV(R[-1273]C[-1]:R[-1271]C[-1]) -> #DIV/0! | G1288: =STDEV("1","2") -> 0.70710678118654757 | H1288: =STDEV(R[-1274]C[-4]:R[-1273]C[-4],R[-1275]C[-3]) -> #DIV/0! | I1288: =STDEV(R[-1278]C[-3],R[-1280]C[-3]) -> 0.70709971011873562 | J1288: =STDEV(R[-1280]C[-4]:R[-1278]C[-3]) -> 4472135954.0664005 | K1288: =STDEV(TRUE, FALSE, TRUE) -> 0.57735026918962584 | L1288: =STDEV(1,2,3,R[-1268]C[-7]) -> 1
C1289: EXPECTED VALUE | D1289: 1.0696254184317784 | E1289: 0.70710678118654757 | F1289: #DIV/0! | G1289: 0.70710678118654757 | H1289: #DIV/0! | I1289: 0.70709971011873562 | J1289: 4472135954.0664005 | K1289: 0.57735026918962584 | L1289: 1
B1292: Stdeva | C1292: FORMULA
C1293: EXPECTED VALUE
B1296: Stdevp | C1296: FORMULA
C1297: EXPECTED VALUE
B1300: Stdevpa | C1300: FORMULA
C1301: EXPECTED VALUE
B1304: Step | C1304: FORMULA
C1305: EXPECTED VALUE
B1308: Steyx | C1308: FORMULA
C1309: EXPECTED VALUE
B1312: Substitute | C1312: FORMULA | D1312: =SUBSTITUTE(R[-1300]C[1],"n","N") -> NoN-Numeric | E1312: =SUBSTITUTE("ISCASESENSITIVE","case","CASE") -> ISCASESENSITIVE | F1312: =SUBSTITUTE("teststr","t","T",1.9) -> Teststr | G1312: =SUBSTITUTE("teststr","t","T",0) -> #VALUE! | H1312: =SUBSTITUTE("teststr","z","T",1) -> teststr | I1312: =SUBSTITUTE("testaatestbbtestcc","test","testtest") -> testtestaatesttestbbtesttestcc | K1312: =SUBSTITUTE("matchlastchar", "r", "R") -> matchlastchaR | L1312: =SUBSTITUTE("nomatch", "zzz", "ZZZ") -> nomatch | M1312: =SUBSTITUTE("regex**chars", "*", "T") -> regexTTchars | N1312: =SUBSTITUTE("1.11", "1", "2", 1) -> 2.11 | O1312: =SUBSTITUTE(R[-1305]C[-10], "1", "2", 1) ->  | P1312: =SUBSTITUTE("testblankmatch", "", "!", 1) -> testblankmatch | Q1312: =SUBSTITUTE("   ", " ", "*") -> *** | R1312: =SUBSTITUTE("testblanknewstr", "t", R[-1305]C[-13]) -> esblanknewsr | S1312: =SUBSTITUTE("   ", " ", "") ->  | T1312: =SUBSTITUTE("   ", " ", "", 1) ->  | U1312: =SUBSTITUTE("ABCBBDBEB", "B", "x", 1) -> AxCBBDBEB | V1312: =SUBSTITUTE("ABCBBDBEB", "B", "x", 0) -> #VALUE! | W1312: =SUBSTITUTE("ABCBBDBEB", "B", "x", -1) -> #VALUE! | X1312: =SUBSTITUTE("ABCBBDBEB", "B", "x", 3) -> ABCBxDBEB | Y1312: =SUBSTITUTE("ABCBBDBEB", "B", "x", 7) -> ABCBBDBEB
C1313: EXPECTED VALUE | D1313: NoN-Numeric | E1313: ISCASESENSITIVE | F1313: Teststr | G1313: #VALUE! | H1313: teststr | I1313: testtestaatesttestbbtesttestcc | K1313: matchlastchaR | L1313: nomatch | M1313: regexTTchars | N1313: 2.11 | P1313: testblankmatch | Q1313: *** | R1313: esblanknewsr | U1313: AxCBBDBEB | V1313: #VALUE! | W1313: #VALUE! | X1313: ABCBxDBEB | Y1313: ABCBBDBEB
B1316: Subtotal | C1316: FORMULA | D1316: =SUBTOTAL(9,R[-1309]C[-2]:R[-1307]C[-2]) -> 3 | E1316: =SUBTOTAL(1,R7C2:R9C2) -> 1 | F1316: =SUBTOTAL(2,R7C2:R9C2) -> 3 | G1316: =SUBTOTAL(4,R7C2:R9C2) -> 2 | H1316: =SUBTOTAL(5,R7C2:R9C2) -> 0
C1317: EXPECTED VALUE | D1317: 3 | E1317: 1 | F1317: 3 | G1317: 2 | H1317: 0
B1320: Sum | C1320: FORMULA | D1320: =SUM(R[-1312]C[-2]:R[-1309]C[-2],R[-1310]C[-1],R[-1303]C[1],R[-1306]C[1],R[-1304]C,R[-1304]C[-2],R[-1302]C[-2]) -> 10000000537.00001 | E1320: =SUM(R[-1312]C[-3]:R[-1310]C,R[-1311]C:R[-1304]C,R[-1308]C[2]) -> 539.10001999999997 | F1320: =SUM(R[-1307]C,R[-1310]C) -> 1.0000000000000001E-5 | G1320: =SUM(R[-1305]C[-2]:R[-1303]C[-2]) -> 0 | H1320: =SUM("-23",R[-1305]C[-3],R[-1307]C[-5]:R[-1305]C[-5],R[-1311]C[-6]:R[-1311]C[-4]) -> -1000023.8999900001 | I1320: =SUM(R[-1312]C[-2]:R[-1310]C,R[-1308]C,R[-1309]C[1],R[-1310]C[1]) -> 475.98120999999998 | J1320: =SUM("1", "1.1", "2.99999") -> 5.09999
C1321: EXPECTED VALUE | D1321: 10000000537.00001 | E1321: 539.10001999999997 | F1321: 1.0000000000000001E-5 | G1321: 0 | H1321: -1000023.8999900001 | I1321: 475.98120999999998 | J1321: 5.09999
B1324: Sumif | C1324: FORMULA | D1324: =SUMIF(R[-1317]C[3]:R[-1315]C[6], "<3") -> 9.345600000000001 | E1324: =SUMIF(R[-1317]C[22]:R[-1311]C[22],R[-1314]C[-2]:R[-1314]C[-1], R[-1317]C[-2]) -> 1.1000000000000001
C1325: EXPECTED VALUE | D1325: 9.3455999999999992 | E1325: 1.1000000000000001
B1328: Sumproduct | C1328: FORMULA | D1328: =SUMPRODUCT(R[-1320]C[-2]:R[-1319]C[-2]) -> 3 | E1328: =SUMPRODUCT(R[-1320]C[-3]:R[-1318]C[-3],R[-1320]C[-2]:R[-1318]C[-2]) -> 536.20535000000007 | F1328: =SUMPRODUCT(R[-1319]C[-4]:R[-1318]C[-4],R[-1319]C[-3]:R[-1318]C[-3]) -> 536.20534000000009 | G1328: =SUMPRODUCT(3,R[-1318]C[-5],R[-1319]C[-4]) -> 1762.2 | H1328: =SUMPRODUCT(R[-1319]C[-5]:R[-1319]C[-5],3,R[-1318]C[-6],R[-1319]C[-5]:R[-1319]C[-5]) -> 1938.4200000000003 | I1328: =SUMPRODUCT(2, R[-1318]C[-6]:R[-1317]C[-6]) -> #VALUE! | J1328: =SUMPRODUCT(R[2]C[-3]:R[2]C[-3],R[2]C[-1]:R[2]C[-1]) -> #VALUE! | K1328: =SUMPRODUCT(R[2]C[-2]:R[2]C[-1],R[2]C:R[2]C[1]) -> #REF! | L1328: =SUMPRODUCT(R[2]C[-1],R[2]C[-2]) -> #REF!
C1329: EXPECTED VALUE | D1329: 3 | E1329: 536.20535000000007 | F1329: 536.20534000000009 | G1329: 1762.2 | H1329: 1938.4200000000003 | I1329: #VALUE! | J1329: #VALUE! | K1329: #REF! | L1329: #REF!
G1330: 4 | I1330: 2 | J1330: 3 | K1330: =R[-1320]C[16] -> #REF! | L1330: 5
B1332: Sumsq | C1332: FORMULA | D1332: =SUMSQ(R[-1324]C[-2]:R[-1322]C[-2]) -> 285161 | E1332: =SUMSQ(R[-1325]C[-2]:R[-1321]C[-2]) -> 11.209960000299999 | F1332: =SUMSQ(R[-1325]C[-3]:R[-1323]C[-2]) -> 1.2100000001000002 | G1332: =SUMSQ(R[-1321]C[-4],R[-1322]C[-4],R[-1323]C[-4],R[-1317]C[-3]) -> 11.209960000199999 | H1332: =SUMSQ(R[-1324]C[-6]:R[-1323]C[-4],R[-1317]C[-3],R[-1319]C[-2]) -> 6.2100000001 | I1332: =SUMSQ(R[-1324]C[-2]:R[-1323]C) -> 71.94652146 | J1332: =SUMSQ(R[-1319]C[-5]:R[-1318]C[-4]) -> 0 | K1332: =SUMSQ(R[-1319]C[-6]:R[-1316]C[-6]) -> 0 | L1332: =SUMSQ(R[-1322]C[-6]:R[-1318]C[-3]) -> 622175.00000000012 | M1332: =SUMSQ(TRUE, TRUE, FALSE) -> 2 | N1332: =SUMSQ("2", "3", 4) -> 29
C1333: EXPECTED VALUE | D1333: 285161 | E1333: 11.209960000299999 | F1333: 1.2100000001000002 | G1333: 11.209960000199999 | H1333: 6.2100000001 | I1333: 71.94652146 | J1333: 0 | K1333: 0 | L1333: 622175 | M1333: 2 | N1333: 29
B1336: Sumx2my2 | C1336: FORMULA | D1336: =SUMX2MY2(R[-1329]C[-2]:R[-1326]C[-1],R[-1328]C[-1]:R[-1325]C) -> 285149.7900399997 | E1336: =SUMX2MY2(R[-1328]C[-1]:R[-1325]C,R[-1328]C[-2]:R[-1325]C[-1]) -> #DIV/0! | F1336: =SUMX2MY2(R[-1329]C[1]:R[-1327]C[3],R[-1329]C[2]:R[-1327]C[4]) -> -74.836680639999997 | G1336: =SUMX2MY2(R[-1328]C[-2]:R[-1322]C[-2],R[-1328]C[-1]:R[-1322]C[-1]) -> #DIV/0! | H1336: =SUMX2MY2(R[-1328]C[-6]:R[-1326]C[-6],R[-1328]C[-1]:R[-1328]C[1]) -> 285138.753998 | I1336: =SUMX2MY2(R[-1328]C[-2]:R[-1325]C[-2],R[-1328]C[-1]:R[-1325]C[-1]) -> -14.438935530000002 | J1336: =SUMX2MY2(R[-1328]C[-2]:R[-1326]C[-2],R[-1329]C[-3]:R[-1328]C[-3]) -> #N/A | K1336: =SUMX2MY2(R[-1328]C[-4],R[-1328]C[-3]) -> -7.9920000000000009 | L1336: =SUMX2MY2(R[-1329]C[17]:R[-1324]C[24],R[-1329]C[18]:R[-1324]C[25]) -> -2304 | M1336: =SUMX2MY2(R[-1326]C[14]:R[-1325]C[14],R[-1325]C[14]:R[-1324]C[14]) -> #REF!
C1337: EXPECTED VALUE | D1337: 285149.7900399997 | E1337: #DIV/0! | F1337: -74.836680639999997 | G1337: #DIV/0! | H1337: 285138.753998 | I1337: -14.438935530000002 | J1337: #N/A | K1337: -7.9920000000000009 | L1337: -2304 | M1337: #REF!
B1340: Sumx2py2 | C1340: FORMULA | D1340: =SUMX2PY2(R[-1333]C[-2]:R[-1330]C[-2],R[-1332]C[-1]:R[-1329]C[-1]) -> 285172.2099600003 | E1340: =SUMX2PY2(R[-1332]C[-2]:R[-1330]C[-2],R[-1325]C[-3]:R[-1325]C[-1]) -> 3.2100200002000001 | F1340: =SUMX2PY2(R[-1324]C[-4]:R[-1324]C[-2],R[-1324]C[-4]:R[-1322]C[-4]) -> #DIV/0! | G1340: =SUMX2PY2(R[-1326]C[-5]:R[-1324]C[-5],R[-1325]C[-2]:R[-1323]C[-2]) -> #DIV/0! | H1340: =SUMX2PY2(R[-1333]C[-6]:R[-1331]C[-6],R[-1324]C[-6]:R[-1324]C[-4]) -> 2.21 | I1340: =SUMX2PY2(R[-1333]C[-2]:R[-1331]C[-1],R[-1333]C[-1]:R[-1331]C) -> 110.88929734999999 | J1340: =SUMX2PY2(R[-1333]C[-3]:R[-1331]C[-2],R[-1333]C:R[-1328]C) -> 105.79313625010001 | K1340: =SUMX2PY2(R[-1333]C[-6]:R[-1330]C[-6],R[-1333]C[-7]:R[-1330]C[-7]) -> #DIV/0!
C1341: EXPECTED VALUE | D1341: 285172.2099600003 | E1341: 3.2100200002000001 | F1341: #DIV/0! | G1341: #DIV/0! | H1341: 2.21 | I1341: 110.88929734999999 | J1341: 105.79313625010001 | K1341: #DIV/0!
B1344: Sumxmy2 | C1344: FORMULA | D1344: =SUMXMY2(R[-1337]C[-2]:R[-1334]C[-2],R[-1337]C[-1]:R[-1334]C[-1]) -> 284090.79932000022 | E1344: =SUMXMY2(R[-1333]C[-2]:R[-1331]C[-2],R[-1331]C[-3]:R[-1329]C[-3]) -> 2000002288333.9893 | F1344: =SUMXMY2(2,4) -> 4 | G1344: =SUMXMY2(R[-1337]C[-3]:R[-1333]C[-3],R[-1336]C[-4]:R[-1332]C[-4]) -> #DIV/0! | H1344: =SUMXMY2(R[-1337]C[-5]:R[-1334]C[-5],R[-1337]C[-5]:R[-1335]C[-5]) -> #N/A | I1344: =SUMXMY2(R[-1330]C[-4]:R[-1327]C[-4],R[-1335]C[-6]:R[-1332]C[-6]) -> #DIV/0! | J1344: =SUMXMY2(R[-1329]C[-5]:R[-1328]C[-5],R[-1329]C[-7]:R[-1328]C[-7]) -> #DIV/0!
C1345: EXPECTED VALUE | D1345: 284090.79932000022 | E1345: 2000002288333.9893 | F1345: 4 | G1345: #DIV/0! | H1345: #N/A | I1345: #DIV/0! | J1345: #DIV/0!
B1348: Syd | C1348: FORMULA
C1349: EXPECTED VALUE
B1352: T | C1352: FORMULA | D1352: =T("") ->  | E1352: =T(R[-1342]C[-3]) ->  | F1352: =T(R[-1336]C[-4]) ->  | G1352: =T(R[-1334]C[-5]) -> TRUE | H1352: =T(R[-1344]C[-4]) ->  | I1352: =T(R[-1341]C[-6]) ->  | J1352: =T(R[-1340]C[-5]) -> non-numeric | K1352: =T(R[-1336]C[-6]) -> 1.1 | L1352: =T(R[-1339]C[-6]) -> 2.99999 | M1352: =T(R[-1340]C[-5]:R[-1340]C[-3]) ->  | N1352: =T(R[-1345]C[-2]:R[-1345]C) ->  | O1352: =T(R[-1]C[-5]:R[1]C[-5]) -> 
C1353: EXPECTED VALUE | G1353: TRUE | J1353: non-numeric | K1353: 1.1 | L1353: 2.99999
B1356: Tan | C1356: FORMULA | D1356: =TAN(R[-1349]C[-2]) -> 0 | E1356: =TAN(R[-1347]C[-2]) -> 1.9647596572486523 | F1356: =TAN(R[-1342]C[-4]) -> 2.1850398632615189 | G1356: =TAN(R[-1340]C[-5]) -> 1.5574077246549023 | H1356: =TAN(R[-1349]C[-4]) -> 0 | I1356: =TAN(R[-1349]C[-4]) -> #VALUE! | J1356: =TAN(R[-1341]C[-5]) -> 1.5574077246549023 | K1356: =TAN(R[-1349]C[-2]:R[-1349]C[1]) -> 1.5574077246549023 | L1356: =TAN(RC[-2]:R[1]C[-2]) -> 74.685933398765371 | M1356: =TAN(R[-1349]C[-1]:R[-1348]C) -> #VALUE!
C1357: EXPECTED VALUE | D1357: 0 | E1357: 1.9647596572486523 | F1357: 2.1850398632615189 | G1357: 1.5574077246549023 | H1357: 0 | I1357: #VALUE! | J1357: 1.5574077246549023 | K1357: 1.5574077246549023 | L1357: 74.685933398765371 | M1357: #VALUE!
B1360: Tanh | C1360: FORMULA | D1360: =TANH(R[-1353]C[-2]) -> 0 | E1360: =TANH(R[-1352]C[-3]:R[-1351]C[-2]) -> #VALUE! | F1360: =TANH(R[-1346]C[-3]) -> -0.99505465502537715 | G1360: =TANH(R[-2]C[-1]:R[1]C[-1]) -> -0.75950940305076076 | H1360: =TANH(R[-1353]C[-2]:R[-1353]C) -> 0.96402758007581701 | I1360: =TANH(R[-2]C[-1]:R[1]C[-1]) -> 0.74606799844559946 | J1360: =TANH(R[-1344]C[-5]) -> 0.8004990217606297 | K1360: =TANH(R[-1344]C[-9]) -> 0.76159415595576485 | L1360: =TANH(R[-1342]C[-10]) -> #VALUE! | M1360: =TANH(R[-1353]C[-2]:R[-1352]C[-1]) -> #VALUE! | N1360: =TANH(R[-1352]C[-5]:R[-1352]C[-3]) -> #VALUE!
C1361: EXPECTED VALUE | D1361: 0 | E1361: #VALUE! | F1361: -0.99505465502537715 | G1361: -0.75950940305076087 | H1361: 0.96402758007581701 | I1361: 0.74606799844559946 | J1361: 0.8004990217606297 | K1361: 0.76159415595576485 | L1361: #VALUE! | M1361: #VALUE! | N1361: #VALUE!
B1364: Tdist | C1364: FORMULA
C1365: EXPECTED VALUE
B1368: Terminate | C1368: FORMULA | D1368: WILL_NEVER_IMPLEMENT
C1369: EXPECTED VALUE | D1369: WILL_NEVER_IMPLEMENT
B1372: Text | C1372: FORMULA | D1372: =TEXT(R[-1363]C[-2],"0%")&"'" -> 200%' | E1372: =TEXT(321.321111111111,"#.##")&"'" -> 321.32' | F1372: =TEXT(R[-1362]C[-4],"$#,##0.00")&"'" -> $534.00'
C1373: EXPECTED VALUE | D1373: 200%' | E1373: 321.32' | F1373: $534.00'
B1376: Textbox | C1376: FORMULA | D1376: WILL_NEVER_IMPLEMENT
C1377: EXPECTED VALUE | D1377: WILL_NEVER_IMPLEMENT
B1380: Textref | C1380: FORMULA | D1380: WILL_NEVER_IMPLEMENT
C1381: EXPECTED VALUE | D1381: WILL_NEVER_IMPLEMENT
B1384: Time | C1384: FORMULA | D1384: =TIME(12,0,0) -> 0.5 | E1384: =TIME(27,0,0) -> 0.125
C1385: EXPECTED VALUE | D1385: 0.5 | E1385: 0.125
B1388: Timevalue | C1388: FORMULA
C1389: EXPECTED VALUE
B1392: Tinv | C1392: FORMULA
C1393: EXPECTED VALUE
B1396: Today | C1396: FORMULA
C1397: EXPECTED VALUE
B1400: Transpose | C1400: FORMULA
C1401: EXPECTED VALUE
B1404: Trend | C1404: FORMULA
C1405: EXPECTED VALUE
B1408: Trim | C1408: FORMULA | D1408: =TRIM(R[-1401]C[1]) ->  | E1408: =TRIM(R[-1400]C) -> nospaces | F1408: =TRIM(R[-1399]C[-1]) -> sp ace s | G1408: =TRIM(R[-1398]C[-2]) -> endsWithSpace | H1408: =TRIM(R[-1397]C[-3]) -> beginsWithSpace | I1408: =TRIM(R[-1396]C[-4]) -> non-numeric | J1408: =TRIM(R[-1395]C[-5]) -> 0 | K1408: =TRIM(R[-1394]C[-6]) -> 0.000001 | L1408: =TRIM(R[-1393]C[-7]) -> 1 | M1408: =TRIM(R[-1392]C[-8]) -> 1.1 | N1408: =TRIM(R[-1391]C[-9]) -> 2.99999 | O1408: =TRIM(R[-1390]C[-10]) -> 99999999 | P1408: =TRIM(R[-1389]C[-11]) -> alph4Num3ric | Q1408: =TRIM(R[-1388]C[-12]) ->  | R1408: =TRIM(R[-1401]C[-13]:R[-1400]C[-13]) -> #VALUE! | S1408: =TRIM(9) -> 9
C1409: EXPECTED VALUE | E1409: nospaces | F1409: sp ace s | G1409: endsWithSpace | H1409: beginsWithSpace | I1409: non-numeric | J1409: 0 | K1409: 0.000001 | L1409: 1 | M1409: 1.1 | N1409: 2.99999 | O1409: 99999999 | P1409: alph4Num3ric | R1409: #VALUE! | S1409: 9
B1412: Trimmean | C1412: FORMULA
C1413: EXPECTED VALUE
B1416: True | C1416: FORMULA | D1416: =TRUE() -> 1
C1417: EXPECTED VALUE | D1417: 1
B1420: Trunc | C1420: FORMULA | D1420: =TRUNC(8.9) -> 8 | E1420: =TRUNC(8.9,1) -> 8.9 | F1420: =TRUNC(-8.9) -> -8 | G1420: =TRUNC(PI()) -> 3
C1421: EXPECTED VALUE | D1421: 8 | E1421: 8.9 | F1421: -8 | G1421: 3
B1424: Ttest | C1424: FORMULA
C1425: EXPECTED VALUE
B1428: Type | C1428: FORMULA
C1429: EXPECTED VALUE
B1432: Unregister | C1432: FORMULA | D1432: WILL_NEVER_IMPLEMENT
C1433: EXPECTED VALUE | D1433: WILL_NEVER_IMPLEMENT
B1436: Upper | C1436: FORMULA | D1436: =UPPER("this is all lower") -> THIS IS ALL LOWER | E1436: =UPPER("123 456") -> 123 456 | F1436: =UPPER("ASDFGH") -> ASDFGH | G1436: =UPPER(123) -> 123 | H1436: =UPPER(R[-1426]C[-6]) -> 534 | I1436: =UPPER(R[-1420]C[-7]) -> TRUE | J1436: =UPPER(R[-1418]C[-8]) -> TRUE | K1436: =UPPER(R[-1425]C[-6]) -> BEGINSWITHSPACE | L1436: =UPPER(R[-1417]C[-7]) -> ALPH4NUM3RIC | M1436: =UPPER(R[-1429]C[-2]:R[-1429]C[1]) -> ALPHANUM | N1436: =UPPER(R[-2]C[-2]:R[1]C[-2]) -> ALPH4NUM3RIC | O1436: =UPPER(R[-1429]C[-1]:R[-1428]C[1]) -> #VALUE! | P1436: =UPPER(R[-1427]C[-3]:R[-1426]C[-2]) -> #VALUE! | Q1436: =UPPER(R[-1424]C[10]) -> #NUM! | R1436: =UPPER(misc!R[-436]C:R[564]C) -> 
C1437: EXPECTED VALUE | D1437: THIS IS ALL LOWER | E1437: 123 456 | F1437: ASDFGH | G1437: 123 | H1437: 534 | I1437: TRUE | J1437: TRUE | K1437: BEGINSWITHSPACE | L1437: ALPH4NUM3RIC | M1437: ALPHANUM | N1437: ALPH4NUM3RIC | O1437: #VALUE! | P1437: #VALUE! | Q1437: #NUM!
B1440: Usdollar | C1440: FORMULA
C1441: EXPECTED VALUE
B1444: Value | C1444: FORMULA | D1444: =VALUE("0.33") -> 0.33 | E1444: =VALUE("$1,000") -> 1000
C1445: EXPECTED VALUE | D1445: 0.33 | E1445: 1000
B1448: Var | C1448: FORMULA | D1448: =VAR(R[-1441]C[-2]:R[-1439]C[-2],R[-1441]C[-1]:R[-1439]C[-1],R[-1438]C[-1]:R[-1437]C[-1]) -> 1.1440985357553568 | E1448: =VAR(R[-1434]C[-3]:R[-1432]C[-3],R[-1433]C[-1]:R[-1431]C[-1],R[-1433]C) -> 0.5 | F1448: =VAR(R[-1433]C[-1]:R[-1431]C[-1]) -> #DIV/0! | G1448: =VAR("1","2") -> 0.5 | H1448: =VAR(R[-1434]C[-4]:R[-1433]C[-4],R[-1435]C[-3]) -> #DIV/0! | I1448: =VAR(R[-1438]C[-3],R[-1440]C[-3]) -> 0.49999000004999994 | J1448: =VAR(R[-1440]C[-4]:R[-1438]C[-3]) -> 1.9999999991653392E+19 | K1448: =VAR(TRUE, FALSE, TRUE) -> 0.33333333333333337 | L1448: =VAR(1,2,3,R[-1428]C[-7]) -> 1
C1449: EXPECTED VALUE | D1449: 1.144098536 | E1449: 0.5 | F1449: #DIV/0! | G1449: 0.5 | H1449: #DIV/0! | I1449: 0.49998999999999999 | J1449: 2E+19 | K1449: 0.33333333300000001 | L1449: 1
B1452: Vara | C1452: FORMULA
C1453: EXPECTED VALUE
B1456: Varp | C1456: FORMULA | D1456: =VARP(R[-1449]C[-2]:R[-1447]C[-2],R[-1449]C[-1]:R[-1447]C[-1],R[-1446]C[-1]:R[-1445]C[-1]) -> 1.0010862187859373 | E1456: =VARP(R[-1442]C[-3]:R[-1440]C[-3],R[-1441]C[-1]:R[-1439]C[-1],R[-1441]C) -> 0.25 | F1456: =VARP(R[-1441]C[-1]:R[-1439]C[-1]) -> #DIV/0! | G1456: =VARP("1","2") -> 0.25 | H1456: =VARP(R[-1442]C[-4]:R[-1441]C[-4],R[-1443]C[-3]) -> #DIV/0! | I1456: =VARP(R[-1446]C[-3],R[-1448]C[-3]) -> 0.24999500002499997 | J1456: =VARP(R[-1448]C[-4]:R[-1446]C[-3]) -> 1.5999999993322713E+19 | K1456: =VARP(TRUE, FALSE, TRUE) -> 0.22222222222222221 | L1456: =VARP(1,2,3,R[-1428]C[-7]) -> 0.66666666666666663
C1457: EXPECTED VALUE | D1457: 1.0010862190000001 | E1457: 0.25 | F1457: #DIV/0! | G1457: 0.25 | H1457: #DIV/0! | I1457: 0.24999499999999999 | J1457: 1.6E+19 | K1457: 0.222222222 | L1457: 0.66666666699999999
B1460: Varpa | C1460: FORMULA
C1461: EXPECTED VALUE
B1464: Vdb | C1464: FORMULA
C1465: EXPECTED VALUE
B1468: Viewget | C1468: FORMULA | D1468: WILL_NEVER_IMPLEMENT
C1469: EXPECTED VALUE | D1469: WILL_NEVER_IMPLEMENT
B1472: Vlookup | C1472: FORMULA | D1472: =VLOOKUP(534,R6C2:R12C8,2) -> 1.0000100000000001 | E1472: =VLOOKUP(534,R6C2:R12C8,4) -> endsWithSpace | F1472: =VLOOKUP(534,R6C2:R12C8,4, TRUE) -> endsWithSpace | G1472: =VLOOKUP(-1,R6C2:R12C8,4, TRUE) -> #N/A
C1473: EXPECTED VALUE | D1473: 1.0000100000000001 | E1473: endsWithSpace | F1473: endsWithSpace | G1473: #N/A
B1476: Volatile | C1476: FORMULA
C1477: EXPECTED VALUE
B1480: Weekday | C1480: FORMULA
C1481: EXPECTED VALUE
B1484: Weibull | C1484: FORMULA
C1485: EXPECTED VALUE
B1488: Windows | C1488: FORMULA | D1488: WILL_NEVER_IMPLEMENT
C1489: EXPECTED VALUE | D1489: WILL_NEVER_IMPLEMENT
B1492: Windowtitle | C1492: FORMULA | D1492: WILL_NEVER_IMPLEMENT
C1493: EXPECTED VALUE | D1493: WILL_NEVER_IMPLEMENT
B1496: Year | C1496: FORMULA | D1496: =YEAR(R[-1476]C[-1]) -> 2000 | E1496: =YEAR(1) -> 1900 | F1496: =YEAR(0) -> 1900 | G1496: =YEAR(-10) -> #NUM! | H1496: =YEAR(#REF!) -> #REF! | I1496: =YEAR(R[-1476]C[-6]+2000) -> 2006
C1497: EXPECTED VALUE | D1497: 2000 | E1497: 1900 | F1497: 1900 | G1497: #NUM! | H1497: #REF! | I1497: 2006
B1500: Ztest | C1500: FORMULA
C1501: EXPECTED VALUE
B1504: <END-OF-FUNCTIONS>

Sheet: FinanceLibTests
O1: NPV | P1: r
A2: f | B2: r | C2: n | D2: y | E2: p | F2: t | H2: f | I2: p | J2: y | K2: n | O2: =NPV(RC[1],RC[3]:RC[6]) -> 162.5 | P2: 1 | Q2: v[] | R2: 100 | S2: 200 | T2: 300 | U2: 400
B3: 1 | C3: 10 | D3: 100 | E3: 10000 | F3: 0 | H3: =FV(RC[-6],RC[-5],RC[-4],RC[-3],RC[-2]) -> -10342300 | O3: =NPV(RC[1],RC[3]:RC[6]) -> 347.99232604148267 | P3: 2.5 | Q3: v[] | R3: 1000 | S3: 666.66665999999998 | T3: 333.33 | U3: 12.276841599999999
B4: 1 | C4: 10 | D4: 100 | E4: 10000 | F4: 1 | H4: =FV(RC[-6],RC[-5],RC[-4],RC[-3],RC[-2]) -> -10444600 | O4: =NPV(RC[1],RC[3]:RC[6]) -> 74.374243337706076 | P4: 12.33333 | Q4: v[] | R4: 1000 | S4: 0 | T4: -900 | U4: -7777.5765000000001
B5: 2 | C5: 12 | D5: 120 | E5: 12000 | F5: 0 | H5: =FV(RC[-6],RC[-5],RC[-4],RC[-3],RC[-2]) -> -6409178400 | O5: =NPV(RC[1],RC[3]:RC[9]) -> 11342283.4233124 | P5: 0.05 | Q5: v[] | R5: 200000 | S5: 300000.55 | T5: 400000 | U5: 1000000 | V5: 6000000 | W5: 7000000 | X5: -300000
B6: 2 | C6: 12 | D6: 120 | E6: 12000 | F6: 1 | H6: =FV(RC[-6],RC[-5],RC[-4],RC[-3],RC[-2]) -> -6472951200
B7: =2/3 -> 0.66666666666666663 | C7: 23 | D7: 133.33000000000001 | E7: 34307 | F7: 0 | H7: =FV(RC[-6],RC[-5],RC[-4],RC[-3],RC[-2]) -> -4369465978.7937231
B8: =2/3 -> 0.66666666666666663 | C8: 23 | D8: 133.33000000000001 | E8: 34307 | F8: 1 | H8: =FV(RC[-6],RC[-5],RC[-4],RC[-3],RC[-2]) -> -4386348826.0193434
B9: 0 | C9: 1 | D9: 100 | E9: 2300 | F9: 0 | H9: =FV(RC[-6],RC[-5],RC[-4],RC[-3],RC[-2]) -> -2400
B10: 0 | C10: 1 | D10: 100 | E10: 2300 | F10: 1 | H10: =FV(RC[-6],RC[-5],RC[-4],RC[-3],RC[-2]) -> -2400
B11: 0 | C11: 12 | D11: 120 | E11: 12000 | F11: 0 | H11: =FV(RC[-6],RC[-5],RC[-4],RC[-3],RC[-2]) -> -13440
B12: 0 | C12: 12 | D12: 120 | E12: 12000 | F12: 1 | H12: =FV(RC[-6],RC[-5],RC[-4],RC[-3],RC[-2]) -> -13440
B13: 2.3332999999999999 | C13: 4 | D13: 334.5 | E13: 14323.45 | F13: 0 | H13: =FV(RC[-6],RC[-5],RC[-4],RC[-3],RC[-2]) -> -1785811.0268780407
B14: 2.3332999999999999 | C14: 4 | D14: 334.5 | E14: 14323.45 | F14: 1 | H14: =FV(RC[-6],RC[-5],RC[-4],RC[-3],RC[-2]) -> -1826771.1713472628
A15: 10000 | B15: 1 | C15: 10 | D15: 100 | F15: 0 | I15: =PV(RC[-7],RC[-6],RC[-5],RC[-8],RC[-3]) -> -109.66796875
A16: 10000 | B16: 1 | C16: 10 | D16: 100 | F16: 1 | I16: =PV(RC[-7],RC[-6],RC[-5],RC[-8],RC[-3]) -> -209.5703125
A17: 333891.23 | B17: 2.95 | C17: 13 | D17: 13000 | F17: 0 | I17: =PV(RC[-7],RC[-6],RC[-5],RC[-8],RC[-3]) -> -4406.7854429449617
A18: 333891.23 | B18: 2.95 | C18: 13 | D18: 13000 | F18: 1 | I18: =PV(RC[-7],RC[-6],RC[-5],RC[-8],RC[-3]) -> -17406.785214815642
B19: 2.95 | C19: 13 | D19: 13000 | E19: -4406.7854429449617 | F19: 0 | H19: =FV(RC[-6],RC[-5],RC[-4],RC[-3],RC[-2]) -> 333891.23001098633
B20: 2.95 | C20: 13 | D20: 13000 | E20: -17406.785214815642 | F20: 1 | H20: =FV(RC[-6],RC[-5],RC[-4],RC[-3],RC[-2]) -> 333891.23010253906
A21: 10000 | B21: 1 | C21: 10 | E21: -109.66796875 | F21: 0 | J21: =PMT(RC[-8],RC[-7],RC[-5],RC[-9],RC[-4]) -> 100
A22: 10000 | B22: 1 | C22: 10 | E22: -209.5703125 | F22: 1 | J22: =PMT(RC[-8],RC[-7],RC[-5],RC[-9],RC[-4]) -> 100
A23: 10000 | B23: 1 | D23: 100 | E23: -109.66796875 | F23: 0 | K23: =NPER(RC[-9],RC[-7],RC[-6],RC[-10],RC[-5]) -> 10
A24: 10000 | B24: 1 | D24: 100 | E24: -209.5703125 | F24: 1
F25: 0
F26: 1
F27: 0
F28: 1
F29: 0
F30: 1
F31: 0
F32: 1
F33: 0
F34: 1

Sheet: StatsLibTests
B1: 1 | C1: 1 | D1: 0 | E1: 1 | F1: 123.12 | G1: =-1*RC[-5] -> -1
B2: 2 | C2: 1 | D2: 0 | E2: 2 | F2: 33.333300000000001 | G2: =-1*RC[-5] -> -2
B3: 3 | C3: 1 | D3: 0 | E3: 1 | F3: =2/3 -> 0.66666666666666663 | G3: =-1*RC[-5] -> -3
B4: 4 | C4: 1 | D4: 0 | E4: 2 | F4: 5.3782800000000002 | G4: =-1*RC[-5] -> -4
B5: 5 | C5: 1 | D5: 0 | E5: 1 | F5: 0.999 | G5: =-1*RC[-5] -> -5
B6: 6 | C6: 1 | D6: 0 | E6: 2 | G6: =-1*RC[-5] -> -6
B7: 7 | C7: 1 | D7: 0 | E7: 1 | G7: =-1*RC[-5] -> -7
B8: 8 | C8: 1 | D8: 0 | E8: 2 | G8: =-1*RC[-5] -> -8
B9: 9 | C9: 1 | D9: 0 | E9: 1 | G9: =-1*RC[-5] -> -9
B10: 10 | C10: 1 | D10: 0 | E10: 2 | G10: =-1*RC[-5] -> -10
A12: avedev | B12: =AVEDEV(R[-11]C:R[-2]C) -> 2.5 | C12: =AVEDEV(R[-11]C:R[-2]C) -> 0 | D12: =AVEDEV(R[-11]C:R[-2]C) -> 0 | E12: =AVEDEV(R[-11]C:R[-2]C) -> 0.5 | F12: =AVEDEV(R[-11]C:R[-2]C) -> 36.421760533333334 | G12: =AVEDEV(R[-11]C:R[-2]C) -> 2.5
A13: stdev | B13: =STDEV(R[-12]C:R[-3]C) -> 3.0276503540974917 | C13: =STDEV(R[-12]C:R[-3]C) -> 0 | D13: =STDEV(R[-12]C:R[-3]C) -> 0 | E13: =STDEV(R[-12]C:R[-3]C) -> 0.52704627669472992 | F13: =STDEV(R[-12]C:R[-3]C) -> 52.33006233652096 | G13: =STDEV(R[-12]C:R[-3]C) -> 3.0276503540974917
A14: devsq | B14: =DEVSQ(R[-13]C:R[-4]C) -> 82.5 | C14: =DEVSQ(R[-13]C:R[-4]C) -> 0 | D14: =DEVSQ(R[-13]C:R[-4]C) -> 0 | E14: =DEVSQ(R[-13]C:R[-4]C) -> 2.5 | F14: =DEVSQ(R[-13]C:R[-9]C) -> 10953.741696576677 | G14: =DEVSQ(R[-13]C:R[-4]C) -> 82.5
A15: large | B15: =LARGE(R[-14]C:R[-5]C,3) -> 8 | C15: =LARGE(R[-14]C:R[-5]C,3) -> 1 | D15: =LARGE(R[-14]C:R[-5]C,3) -> 0 | E15: =LARGE(R[-14]C:R[-5]C,3) -> 2 | F15: =LARGE(R[-14]C:R[-5]C,3) -> 5.3782800000000002 | G15: =LARGE(R[-14]C:R[-5]C,3) -> -3
A16: small | B16: =SMALL(R[-15]C:R[-6]C,3) -> 3 | C16: =SMALL(R[-15]C:R[-6]C,3) -> 1 | D16: =SMALL(R[-15]C:R[-6]C,3) -> 0 | E16: =SMALL(R[-15]C:R[-6]C,3) -> 1 | F16: =SMALL(R[-15]C:R[-6]C,3) -> 5.3782800000000002 | G16: =SMALL(R[-15]C:R[-6]C,3) -> -8
A17: median | B17: =MEDIAN(R[-16]C:R[-7]C) -> 5.5 | C17: =MEDIAN(R[-16]C:R[-7]C) -> 1 | D17: =MEDIAN(R[-16]C:R[-7]C) -> 0 | E17: =MEDIAN(R[-16]C:R[-7]C) -> 1.5 | F17: =MEDIAN(R[-16]C:R[-7]C) -> 5.3782800000000002 | G17: =MEDIAN(R[-16]C:R[-7]C) -> -5.5 | H17: =MEDIAN(R[-16]C[-6]:R[-8]C[-6]) -> 5 | I17: =MEDIAN(R[-15]C[-2]:R[-7]C[-2]) -> -6
A18: mode | B18: =MODE(R[-17]C:R[-8]C) -> #N/A | C18: =MODE(R[-17]C:R[-8]C) -> 1 | D18: =MODE(R[-17]C:R[-8]C) -> 0 | E18: =MODE(R[-17]C:R[-8]C) -> 1 | F18: =MODE(R[-17]C:R[-8]C) -> #N/A | G18: =MODE(R[-17]C:R[-8]C) -> #N/A | H18: =MODE(R[-17]C[-6]:R[-14]C[-4],R[-13]C[-4]) -> 1
A19: var | B19: =VAR(R[-18]C:R[-9]C) -> 9.1666666666666661 | C19: =VAR(R[-18]C:R[-9]C) -> 0 | D19: =VAR(R[-18]C:R[-9]C) -> 0 | E19: =VAR(R[-18]C:R[-9]C) -> 0.27777777777777779 | F19: =VAR(R[-18]C:R[-9]C) -> 2738.4354241441692 | G19: =VAR(R[-18]C:R[-9]C) -> 9.1666666666666661

Sheet: misc
A1: string | B1: ="1" -> 1 | C1: 1 | D1: 1 | E1: =RC[1] -> 0
A2: ="TRUE" -> TRUE | B2: ="2.3" -> 2.3 | C2: 123.23 | D2: 0 | E2: =SUM(1,2) -> 3 | F2: 1
A3: ="FALSE" -> FALSE | B3: =R[-1]C -> 2.3 | C3: -12 | D3: =R[-2]C -> 1
C5: 12
E6: =CONCATENATE(R[-4]C,"1") -> 31
A8: =LARGE(R[-4]C[2]:R[-1]C[2],2) -> #NUM! | E8: =R[-7]C[1] -> 0
E10: =MAX(R[-2]C,-1) -> 0
A12: ="TRUE" -> TRUE
A13: =AVERAGEA("TRUE",1) -> #VALUE!
A14: =AVERAGEA(R[-2]C,2) -> 1
A16: abc | B16: =RC[1] -> 0
A18: =AVERAGEA("1",1,R[-2]C,R[-2]C[1]) -> 0.5