Sheet: general dump
B2: REFDATE | C2: TRENDFAC | E2: Title1 | F2: BLOCK CLAIM LIABILITY REPORT
B3: 1998-08-01T00:00:00.000 | C3: 0.84370000000000001 | E3: Title2 | F3: The Millennium-2000 Sample Life Insurance Company
B4: 1998-09-01T00:00:00.000 | C4: 0.8478 | E4: Title4 | F4: ="Experience Period:  "&TEXT(ExpDat,"dd-mmm-yyyy")&"  to  "&TEXT(ValDat,"dd-mmm-yyyy")&".  Runout Date:  "&TEXT(RunDat,"dd-mmm-yyyy") -> Experience Period: 01-Aug-1998 to 31-Jul-2001. Runout Date: 31-Jul-2001
B5: 1998-10-01T00:00:00.000 | C5: 0.85189999999999999
B6: 1998-11-01T00:00:00.000 | C6: 0.85609999999999997
B7: 1998-12-01T00:00:00.000 | C7: 0.86029999999999995 | E7: 6196 | F7: Scenario ID
B8: 1999-01-01T00:00:00.000 | C8: 0.86439999999999995 | E8: Arvind | F8: Scenario Name
B9: 1999-02-01T00:00:00.000 | C9: 0.86860000000000004 | E9: 332970 | F9: Total Current Premium
B10: 1999-03-01T00:00:00.000 | C10: 0.87290000000000001 | E10: IBNR | F10: Liability Basis 'IBNR','IBNP'
B11: 1999-04-01T00:00:00.000 | C11: 0.87709999999999999 | E11: 1998-08-01T00:00:00.000 | F11: Experience Date (ExpDat)
B12: 1999-05-01T00:00:00.000 | C12: 0.88139999999999996 | E12: 2001-07-31T00:00:00.000 | F12: Valuation Date (ValDat)
B13: 1999-06-01T00:00:00.000 | C13: 0.88570000000000004 | E13: 2001-07-31T00:00:00.000 | F13: Runout Date (RunDat)
B14: 1999-07-01T00:00:00.000 | C14: 0.89 | E14: 1 | F14: Claim Maturity Factor (CMF)
B15: 1999-08-01T00:00:00.000 | C15: 0.89429999999999998 | E15: 0.04 | F15: Discount Rate
B16: 1999-09-01T00:00:00.000 | C16: 0.89870000000000005 | E16: 0.02 | F16: Adjudication Expense Factor
B17: 1999-10-01T00:00:00.000 | C17: 0.90310000000000001
B18: 1999-11-01T00:00:00.000 | C18: 0.90749999999999997
B19: 1999-12-01T00:00:00.000 | C19: 0.91190000000000004 | E19: =YEAR(RunDat)*12+MONTH(RunDat)-YEAR(ValDat)*12-MONTH(ValDat) -> 0 | F19: Months of Runout (MRO)
B20: 2000-01-01T00:00:00.000 | C20: 0.9163 | E20: =YEAR(ValDat)*12+MONTH(ValDat)-YEAR(ExpDat)*12-MONTH(ExpDat)+1 -> 36 | F20: Months in Experience Period (MEP)
B21: 2000-02-01T00:00:00.000 | C21: 0.92079999999999995
B22: 2000-03-01T00:00:00.000 | C22: 0.92520000000000002 | E22: 12 | F22: Number of Months for Calculation of Average Claim (AvgNoClm)
B23: 2000-04-01T00:00:00.000 | C23: 0.92979999999999996 | E23: 36 | F23: Maximum Number of Rows (MNR)
B24: 2000-05-01T00:00:00.000 | C24: 0.93430000000000002 | E24: 4 | F24: Number of Months for Calculation Completion Factors (MCF)
B25: 2000-06-01T00:00:00.000 | C25: 0.93879999999999997
B26: 2000-07-01T00:00:00.000 | C26: 0.94340000000000002
B27: 2000-08-01T00:00:00.000 | C27: 0.94799999999999995
B28: 2000-09-01T00:00:00.000 | C28: 0.9526
B29: 2000-10-01T00:00:00.000 | C29: 0.95720000000000005
B30: 2000-11-01T00:00:00.000 | C30: 0.96189999999999998
B31: 2000-12-01T00:00:00.000 | C31: 0.96660000000000001
B32: 2001-01-01T00:00:00.000 | C32: 0.97130000000000005
B33: 2001-02-01T00:00:00.000 | C33: 0.97599999999999998
B34: 2001-03-01T00:00:00.000 | C34: 0.98080000000000001
B35: 2001-04-01T00:00:00.000 | C35: 0.98550000000000004
B36: 2001-05-01T00:00:00.000 | C36: 0.99029999999999996
B37: 2001-06-01T00:00:00.000 | C37: 0.99519999999999997
B38: 2001-07-01T00:00:00.000 | C38: 1
A70: 6196
A71: 887523-4476395452341293-82637-02
A72: ssss
A73: a0770-w2kp-engg
A74: wgates.csv

Sheet: reported claim lag dump
B2: REFDATE (Inc/Paid) | C2: LAG0 | D2: LAG1 | E2: LAG2 | F2: LAG3 | G2: LAG4 | H2: LAG5 | I2: LAG6 | J2: LAG7 | K2: LAG8 | L2: LAG9 | M2: LAG10 | N2: LAG11 | O2: LAG12 | P2: LAG13 | Q2: LAG14 | R2: LAG15 | S2: LAG16 | T2: LAG17 | U2: LAG18 | V2: LAG19 | W2: LAG20 | X2: LAG21 | Y2: LAG22 | Z2: LAG23 | AA2: LAG24 | AB2: LAG25 | AC2: LAG26 | AD2: LAG27 | AE2: LAG28 | AF2: LAG29 | AG2: LAG30 | AH2: LAG31 | AI2: LAG32 | AJ2: LAG33 | AK2: LAG34 | AL2: LAG35
B3: 1998-08-01T00:00:00.000 | C3: 25147 | D3: 74072 | E3: 0 | F3: 0 | G3: 0 | H3: 0 | I3: 0 | J3: 0 | K3: 0 | L3: 0 | M3: 0 | N3: 0 | O3: 0 | P3: 0 | Q3: 0 | R3: 0 | S3: 0 | T3: 0 | U3: 0 | V3: 0 | W3: 0 | X3: 0 | Y3: 0 | Z3: 0 | AA3: 0 | AB3: 0 | AC3: 0 | AD3: 0 | AE3: 0 | AF3: 0 | AG3: 0 | AH3: 0 | AI3: 0 | AJ3: 0 | AK3: 0 | AL3: 0 | AM3: IBNP
B4: 1998-09-01T00:00:00.000 | C4: 31253 | D4: 67966 | E4: 0 | F4: 0 | G4: 0 | H4: 0 | I4: 0 | J4: 0 | K4: 0 | L4: 0 | M4: 0 | N4: 0 | O4: 0 | P4: 0 | Q4: 0 | R4: 0 | S4: 0 | T4: 0 | U4: 0 | V4: 0 | W4: 0 | X4: 0 | Y4: 0 | Z4: 0 | AA4: 0 | AB4: 0 | AC4: 0 | AD4: 0 | AE4: 0 | AF4: 0 | AG4: 0 | AH4: 0 | AI4: 0 | AJ4: 0 | AK4: 0 | AL4: 0 | AM4: IBNR
B5: 1998-10-01T00:00:00.000 | C5: 30186 | D5: 157846 | E5: 54319 | F5: 49663 | G5: 0 | H5: 0 | I5: 0 | J5: 0 | K5: 0 | L5: 0 | M5: 0 | N5: 0 | O5: 0 | P5: 0 | Q5: 0 | R5: 0 | S5: 0 | T5: 0 | U5: 0 | V5: 0 | W5: 0 | X5: 0 | Y5: 0 | Z5: 0 | AA5: 0 | AB5: 0 | AC5: 0 | AD5: 0 | AE5: 0 | AF5: 0 | AG5: 0 | AH5: 0 | AI5: 0 | AJ5: 0 | AK5: 0 | AL5: 0 | AM5: IBNP
B6: 1998-11-01T00:00:00.000 | C6: 49927 | D6: 140535 | E6: 51889 | F6: 49663 | G6: 0 | H6: 0 | I6: 0 | J6: 0 | K6: 0 | L6: 0 | M6: 0 | N6: 0 | O6: 0 | P6: 0 | Q6: 0 | R6: 0 | S6: 0 | T6: 0 | U6: 0 | V6: 0 | W6: 0 | X6: 0 | Y6: 0 | Z6: 0 | AA6: 0 | AB6: 0 | AC6: 0 | AD6: 0 | AE6: 0 | AF6: 0 | AG6: 0 | AH6: 0 | AI6: 0 | AJ6: 0 | AK6: 0 | AL6: 0 | AM6: IBNR
B7: 1998-12-01T00:00:00.000 | C7: 6022 | D7: 55145 | E7: 17920 | F7: 25255 | G7: 5019 | H7: 402 | I7: 0 | J7: 0 | K7: 0 | L7: 0 | M7: 0 | N7: 0 | O7: 0 | P7: 0 | Q7: 0 | R7: 0 | S7: 0 | T7: 0 | U7: 0 | V7: 0 | W7: 0 | X7: 0 | Y7: 0 | Z7: 0 | AA7: 0 | AB7: 0 | AC7: 0 | AD7: 0 | AE7: 0 | AF7: 0 | AG7: 0 | AH7: 0 | AI7: 0 | AJ7: 0 | AK7: 0 | AL7: 0 | AM7: IBNP
B8: 1999-01-01T00:00:00.000 | C8: 31494 | D8: 39304 | E8: 24477 | F8: 9937 | G8: 4149 | H8: 402 | I8: 0 | J8: 0 | K8: 0 | L8: 0 | M8: 0 | N8: 0 | O8: 0 | P8: 0 | Q8: 0 | R8: 0 | S8: 0 | T8: 0 | U8: 0 | V8: 0 | W8: 0 | X8: 0 | Y8: 0 | Z8: 0 | AA8: 0 | AB8: 0 | AC8: 0 | AD8: 0 | AE8: 0 | AF8: 0 | AG8: 0 | AH8: 0 | AI8: 0 | AJ8: 0 | AK8: 0 | AL8: 0 | AM8: IBNR
B9: 1999-02-01T00:00:00.000 | C9: 13659 | D9: 80920 | E9: 40769 | F9: 15086 | G9: 8570 | H9: 4171 | I9: 913 | J9: 593 | K9: 0 | L9: 0 | M9: 0 | N9: 0 | O9: 0 | P9: 0 | Q9: 0 | R9: 0 | S9: 0 | T9: 0 | U9: 0 | V9: 0 | W9: 0 | X9: 0 | Y9: 0 | Z9: 0 | AA9: 0 | AB9: 0 | AC9: 0 | AD9: 0 | AE9: 0 | AF9: 0 | AG9: 0 | AH9: 0 | AI9: 0 | AJ9: 0 | AK9: 0 | AL9: 0 | AM9: IBNP
B10: 1999-03-01T00:00:00.000 | C10: 57935 | D10: 68120 | E10: 13660 | F10: 10719 | G10: 11697 | H10: 1703 | I10: 254 | J10: 593 | K10: 0 | L10: 0 | M10: 0 | N10: 0 | O10: 0 | P10: 0 | Q10: 0 | R10: 0 | S10: 0 | T10: 0 | U10: 0 | V10: 0 | W10: 0 | X10: 0 | Y10: 0 | Z10: 0 | AA10: 0 | AB10: 0 | AC10: 0 | AD10: 0 | AE10: 0 | AF10: 0 | AG10: 0 | AH10: 0 | AI10: 0 | AJ10: 0 | AK10: 0 | AL10: 0 | AM10: IBNR
B11: 1999-04-01T00:00:00.000 | C11: 16933 | D11: 64705 | E11: 35845 | F11: 36513 | G11: 13434 | H11: 1335 | I11: 1739 | J11: 150 | K11: 64 | L11: 1055 | M11: 0 | N11: 0 | O11: 0 | P11: 0 | Q11: 0 | R11: 0 | S11: 0 | T11: 0 | U11: 0 | V11: 0 | W11: 0 | X11: 0 | Y11: 0 | Z11: 0 | AA11: 0 | AB11: 0 | AC11: 0 | AD11: 0 | AE11: 0 | AF11: 0 | AG11: 0 | AH11: 0 | AI11: 0 | AJ11: 0 | AK11: 0 | AL11: 0 | AM11: IBNP
B12: 1999-05-01T00:00:00.000 | C12: 36127 | D12: 62953 | E12: 22027 | F12: 34250 | G12: 12905 | H12: 1541 | I12: 701 | J12: 150 | K12: 64 | L12: 1055 | M12: 0 | N12: 0 | O12: 0 | P12: 0 | Q12: 0 | R12: 0 | S12: 0 | T12: 0 | U12: 0 | V12: 0 | W12: 0 | X12: 0 | Y12: 0 | Z12: 0 | AA12: 0 | AB12: 0 | AC12: 0 | AD12: 0 | AE12: 0 | AF12: 0 | AG12: 0 | AH12: 0 | AI12: 0 | AJ12: 0 | AK12: 0 | AL12: 0 | AM12: IBNR
B13: 1999-06-01T00:00:00.000 | C13: 16631 | D13: 145028 | E13: 48307 | F13: 6744 | G13: 43499 | H13: 10999 | I13: 6831 | J13: 14862 | K13: 638 | L13: 86 | M13: 0 | N13: 420 | O13: 0 | P13: 0 | Q13: 0 | R13: 0 | S13: 0 | T13: 0 | U13: 0 | V13: 0 | W13: 0 | X13: 0 | Y13: 0 | Z13: 0 | AA13: 0 | AB13: 0 | AC13: 0 | AD13: 0 | AE13: 0 | AF13: 0 | AG13: 0 | AH13: 0 | AI13: 0 | AJ13: 0 | AK13: 0 | AL13: 0 | AM13: IBNP
B14: 1999-07-01T00:00:00.000 | C14: 98502 | D14: 96530 | E14: 25198 | F14: 25454 | G14: 21540 | H14: 10627 | I14: 188 | J14: 14862 | K14: 711 | L14: 13 | M14: 420 | N14: 0 | O14: 0 | P14: 0 | Q14: 0 | R14: 0 | S14: 0 | T14: 0 | U14: 0 | V14: 0 | W14: 0 | X14: 0 | Y14: 0 | Z14: 0 | AA14: 0 | AB14: 0 | AC14: 0 | AD14: 0 | AE14: 0 | AF14: 0 | AG14: 0 | AH14: 0 | AI14: 0 | AJ14: 0 | AK14: 0 | AL14: 0 | AM14: IBNR
B15: 1999-08-01T00:00:00.000 | C15: 8178 | D15: 50538 | E15: 21390 | F15: 25812 | G15: 3445 | H15: -482 | I15: 1182 | J15: 512 | K15: 61 | L15: -300 | M15: 0 | N15: 454 | O15: 286 | P15: 0 | Q15: 0 | R15: 0 | S15: 0 | T15: 0 | U15: 0 | V15: 0 | W15: 0 | X15: 0 | Y15: 0 | Z15: 0 | AA15: 0 | AB15: 0 | AC15: 0 | AD15: 0 | AE15: 0 | AF15: 0 | AG15: 0 | AH15: 0 | AI15: 0 | AJ15: 0 | AK15: 0 | AL15: 0 | AM15: IBNP
B16: 1999-09-01T00:00:00.000 | C16: 22133 | D16: 43202 | E16: 19233 | F16: 23721 | G16: 1187 | H16: -269 | I16: 856 | J16: 553 | K16: 20 | L16: -300 | M16: 374 | N16: 80 | O16: 286 | P16: 0 | Q16: 0 | R16: 0 | S16: 0 | T16: 0 | U16: 0 | V16: 0 | W16: 0 | X16: 0 | Y16: 0 | Z16: 0 | AA16: 0 | AB16: 0 | AC16: 0 | AD16: 0 | AE16: 0 | AF16: 0 | AG16: 0 | AH16: 0 | AI16: 0 | AJ16: 0 | AK16: 0 | AL16: 0 | AM16: IBNR
B17: 1999-10-01T00:00:00.000 | C17: 8887 | D17: 57900 | E17: 69592 | F17: 13073 | G17: 3966 | H17: 7382 | I17: 990 | J17: 1455 | K17: 1212 | L17: 252 | M17: -208 | N17: 4466 | O17: 924 | P17: 85 | Q17: 1460 | R17: 0 | S17: 0 | T17: 0 | U17: 0 | V17: 0 | W17: 0 | X17: 0 | Y17: 0 | Z17: 0 | AA17: 0 | AB17: 0 | AC17: 0 | AD17: 0 | AE17: 0 | AF17: 0 | AG17: 0 | AH17: 0 | AI17: 0 | AJ17: 0 | AK17: 0 | AL17: 0 | AM17: IBNP
B18: 1999-11-01T00:00:00.000 | C18: 31566 | D18: 83114 | E18: 23227 | F18: 13635 | G18: 5991 | H18: 3977 | I18: 323 | J18: 1412 | K18: 1242 | L18: 450 | M18: -376 | N18: 4430 | O18: 900 | P18: 85 | Q18: 1460 | R18: 0 | S18: 0 | T18: 0 | U18: 0 | V18: 0 | W18: 0 | X18: 0 | Y18: 0 | Z18: 0 | AA18: 0 | AB18: 0 | AC18: 0 | AD18: 0 | AE18: 0 | AF18: 0 | AG18: 0 | AH18: 0 | AI18: 0 | AJ18: 0 | AK18: 0 | AL18: 0 | AM18: IBNR
B19: 1999-12-01T00:00:00.000 | C19: 1321 | D19: 33300 | E19: 30097 | F19: 27921 | G19: 5276 | H19: 1752 | I19: 9245 | J19: 117 | K19: 216 | L19: 314 | M19: 204 | N19: 442 | O19: 561 | P19: 179 | Q19: 17 | R19: 273 | S19: 135 | T19: 168 | U19: 0 | V19: 0 | W19: 0 | X19: 0 | Y19: 0 | Z19: 0 | AA19: 0 | AB19: 0 | AC19: 0 | AD19: 0 | AE19: 0 | AF19: 0 | AG19: 0 | AH19: 0 | AI19: 0 | AJ19: 0 | AK19: 0 | AL19: 0 | AM19: IBNP
B20: 2000-01-01T00:00:00.000 | C20: 14982 | D20: 44836 | E20: 31946 | F20: 3681 | G20: 2985 | H20: 1328 | I20: 9314 | J20: 117 | K20: 56 | L20: 430 | M20: 88 | N20: 538 | O20: 508 | P20: 153 | Q20: 0 | R20: 273 | S20: 303 | T20: 0 | U20: 0 | V20: 0 | W20: 0 | X20: 0 | Y20: 0 | Z20: 0 | AA20: 0 | AB20: 0 | AC20: 0 | AD20: 0 | AE20: 0 | AF20: 0 | AG20: 0 | AH20: 0 | AI20: 0 | AJ20: 0 | AK20: 0 | AL20: 0 | AM20: IBNR
B21: 2000-02-01T00:00:00.000 | C21: 9736 | D21: 90376 | E21: 64236 | F21: 12899 | G21: 29961 | H21: 702 | I21: 1231 | J21: 530 | K21: 991 | L21: 30 | M21: 0 | N21: 0 | O21: 0 | P21: 0 | Q21: 0 | R21: 791 | S21: 0 | T21: 0 | U21: 0 | V21: 80 | W21: 0 | X21: 0 | Y21: 0 | Z21: 0 | AA21: 0 | AB21: 0 | AC21: 0 | AD21: 0 | AE21: 0 | AF21: 0 | AG21: 0 | AH21: 0 | AI21: 0 | AJ21: 0 | AK21: 0 | AL21: 0 | AM21: IBNP
B22: 2000-03-01T00:00:00.000 | C22: 68074 | D22: 108795 | E22: 22323 | F22: 1146 | G22: 6942 | H22: 821 | I22: 1096 | J22: 511 | K22: 954 | L22: 30 | M22: 0 | N22: 0 | O22: 0 | P22: 0 | Q22: 0 | R22: 791 | S22: 0 | T22: 0 | U22: 0 | V22: 80 | W22: 0 | X22: 0 | Y22: 0 | Z22: 0 | AA22: 0 | AB22: 0 | AC22: 0 | AD22: 0 | AE22: 0 | AF22: 0 | AG22: 0 | AH22: 0 | AI22: 0 | AJ22: 0 | AK22: 0 | AL22: 0 | AM22: IBNR
B23: 2000-04-01T00:00:00.000 | C23: 10201 | D23: 90658 | E23: 24213 | F23: 20107 | G23: 28866 | H23: 6492 | I23: 1428 | J23: 616 | K23: 53 | L23: 168 | M23: 0 | N23: 0 | O23: 0 | P23: 0 | Q23: 0 | R23: 0 | S23: 0 | T23: 392 | U23: 0 | V23: 0 | W23: 0 | X23: 0 | Y23: 0 | Z23: 0 | AA23: 0 | AB23: 0 | AC23: 0 | AD23: 0 | AE23: 0 | AF23: 0 | AG23: 0 | AH23: 0 | AI23: 0 | AJ23: 0 | AK23: 0 | AL23: 0 | AM23: IBNP
B24: 2000-05-01T00:00:00.000 | C24: 80043 | D24: 39941 | E24: 10905 | F24: 38977 | G24: 4745 | H24: 6586 | I24: 1310 | J24: 107 | K24: 20 | L24: 168 | M24: 0 | N24: 0 | O24: 0 | P24: 0 | Q24: 0 | R24: 0 | S24: 0 | T24: 392 | U24: 0 | V24: 0 | W24: 0 | X24: 0 | Y24: 0 | Z24: 0 | AA24: 0 | AB24: 0 | AC24: 0 | AD24: 0 | AE24: 0 | AF24: 0 | AG24: 0 | AH24: 0 | AI24: 0 | AJ24: 0 | AK24: 0 | AL24: 0 | AM24: IBNR
B25: 2000-06-01T00:00:00.000 | C25: 4501 | D25: 74638 | E25: 87955 | F25: 99302 | G25: 13877 | H25: 20118 | I25: 5661 | J25: 21364 | K25: 159 | L25: 480 | M25: 28 | N25: 693 | O25: 0 | P25: 0 | Q25: 131 | R25: 0 | S25: 294 | T25: 0 | U25: 0 | V25: 96 | W25: 0 | X25: 0 | Y25: 0 | Z25: 0 | AA25: 0 | AB25: 0 | AC25: 0 | AD25: 0 | AE25: 0 | AF25: 0 | AG25: 0 | AH25: 0 | AI25: 0 | AJ25: 0 | AK25: 0 | AL25: 0 | AM25: IBNP
B26: 2000-07-01T00:00:00.000 | C26: 45495 | D26: 81868 | E26: 96720 | F26: 55381 | G26: 3174 | H26: 17865 | I26: 5653 | J26: 21419 | K26: 0 | L26: 480 | M26: 702 | N26: 19 | O26: 0 | P26: 131 | Q26: 0 | R26: 0 | S26: 294 | T26: 0 | U26: 0 | V26: 96 | W26: 0 | X26: 0 | Y26: 0 | Z26: 0 | AA26: 0 | AB26: 0 | AC26: 0 | AD26: 0 | AE26: 0 | AF26: 0 | AG26: 0 | AH26: 0 | AI26: 0 | AJ26: 0 | AK26: 0 | AL26: 0 | AM26: IBNR
B27: 2000-08-01T00:00:00.000 | C27: 2952 | D27: 58928 | E27: 130303 | F27: 52128 | G27: 14870 | H27: 3898 | I27: 15681 | J27: 1013 | K27: 981 | L27: 121 | M27: 0 | N27: 84 | O27: 213 | P27: 53 | Q27: 0 | R27: 0 | S27: 0 | T27: 210 | U27: 75 | V27: 0 | W27: 0 | X27: 0 | Y27: 0 | Z27: 0 | AA27: 0 | AB27: 0 | AC27: 0 | AD27: 0 | AE27: 0 | AF27: 0 | AG27: 0 | AH27: 0 | AI27: 0 | AJ27: 0 | AK27: 0 | AL27: 0 | AM27: IBNP
B28: 2000-09-01T00:00:00.000 | C28: 22590 | D28: 127706 | E28: 52799 | F28: 53458 | G28: 8807 | H28: 2747 | I28: 11162 | J28: 581 | K28: 1025 | L28: 0 | M28: 0 | N28: 84 | O28: 213 | P28: 53 | Q28: 0 | R28: 0 | S28: 210 | T28: 0 | U28: 75 | V28: 0 | W28: 0 | X28: 0 | Y28: 0 | Z28: 0 | AA28: 0 | AB28: 0 | AC28: 0 | AD28: 0 | AE28: 0 | AF28: 0 | AG28: 0 | AH28: 0 | AI28: 0 | AJ28: 0 | AK28: 0 | AL28: 0 | AM28: IBNR
B29: 2000-10-01T00:00:00.000 | C29: 2217 | D29: 50074 | E29: 38342 | F29: 59896 | G29: 12140 | H29: 3146 | I29: 1154 | J29: 9723 | K29: 403 | L29: 0 | M29: 1132 | N29: 177 | O29: 160 | P29: 3268 | Q29: 288 | R29: 398 | S29: 57 | T29: 734 | U29: 0 | V29: 0 | W29: 0 | X29: 0 | Y29: 0 | Z29: 0 | AA29: 0 | AB29: 0 | AC29: 0 | AD29: 0 | AE29: 0 | AF29: 0 | AG29: 0 | AH29: 0 | AI29: 0 | AJ29: 0 | AK29: 0 | AL29: 0 | AM29: IBNP
B30: 2000-11-01T00:00:00.000 | C30: 19627 | D30: 78051 | E30: 32446 | F30: 30039 | G30: 3104 | H30: 8621 | I30: 1405 | J30: 3535 | K30: 707 | L30: 57 | M30: 692 | N30: 229 | O30: 3279 | P30: 40 | Q30: 328 | R30: 415 | S30: 0 | T30: 734 | U30: 0 | V30: 0 | W30: 0 | X30: 0 | Y30: 0 | Z30: 0 | AA30: 0 | AB30: 0 | AC30: 0 | AD30: 0 | AE30: 0 | AF30: 0 | AG30: 0 | AH30: 0 | AI30: 0 | AJ30: 0 | AK30: 0 | AL30: 0 | AM30: IBNR
B31: 2000-12-01T00:00:00.000 | C31: 5402 | D31: 16943 | E31: 34607 | F31: 6988 | G31: 3602 | H31: 2116 | I31: 7375 | J31: 474 | K31: 3162 | L31: 1388 | M31: 160 | N31: 284 | O31: 406 | P31: 788 | Q31: 0 | R31: 0 | S31: 0 | T31: 0 | U31: 0 | V31: 0 | W31: 0 | X31: 0 | Y31: 0 | Z31: 0 | AA31: 0 | AB31: 0 | AC31: 0 | AD31: 0 | AE31: 0 | AF31: 0 | AG31: 0 | AH31: 0 | AI31: 0 | AJ31: 0 | AK31: 0 | AL31: 0 | AM31: IBNP
B32: 2001-01-01T00:00:00.000 | C32: 15456 | D32: 19047 | E32: 26813 | F32: 7995 | G32: 520 | H32: 1792 | I32: 5685 | J32: 405 | K32: 4138 | L32: 206 | M32: 360 | N32: 188 | O32: 302 | P32: 788 | Q32: 0 | R32: 0 | S32: 0 | T32: 0 | U32: 0 | V32: 0 | W32: 0 | X32: 0 | Y32: 0 | Z32: 0 | AA32: 0 | AB32: 0 | AC32: 0 | AD32: 0 | AE32: 0 | AF32: 0 | AG32: 0 | AH32: 0 | AI32: 0 | AJ32: 0 | AK32: 0 | AL32: 0 | AM32: IBNR
B33: 2001-02-01T00:00:00.000 | C33: 544 | D33: 16998 | E33: 37793 | F33: 49731 | G33: 28448 | H33: 2175 | I33: 1814 | J33: 333 | K33: 718 | L33: 1341 | M33: 64 | N33: 28 | O33: 0 | P33: 0 | Q33: 256 | R33: 108 | S33: 70 | T33: 0 | U33: 0 | V33: 0 | W33: 0 | X33: 0 | Y33: 0 | Z33: 0 | AA33: 0 | AB33: 0 | AC33: 0 | AD33: 0 | AE33: 0 | AF33: 0 | AG33: 0 | AH33: 0 | AI33: 0 | AJ33: 0 | AK33: 0 | AL33: 0 | AM33: IBNP
B34: 2001-03-01T00:00:00.000 | C34: 8442 | D34: 51447 | E34: 16192 | F34: 58463 | G34: 1725 | H34: 1611 | I34: 455 | J34: 881 | K34: 679 | L34: 64 | M34: 28 | N34: 0 | O34: 0 | P34: 0 | Q34: 256 | R34: 108 | S34: 70 | T34: 0 | U34: 0 | V34: 0 | W34: 0 | X34: 0 | Y34: 0 | Z34: 0 | AA34: 0 | AB34: 0 | AC34: 0 | AD34: 0 | AE34: 0 | AF34: 0 | AG34: 0 | AH34: 0 | AI34: 0 | AJ34: 0 | AK34: 0 | AL34: 0 | AM34: IBNR
B35: 2001-04-01T00:00:00.000 | C35: 1180 | D35: 33425 | E35: 35398 | F35: 24109 | G35: 7879 | H35: 9007 | I35: 1278 | J35: 1250 | K35: 572 | L35: 253 | M35: 0 | N35: 0 | O35: -247 | P35: 266 | Q35: 7809 | R35: 0 | S35: 0 | T35: 0 | U35: 0 | V35: 0 | W35: 0 | X35: 0 | Y35: 0 | Z35: 0 | AA35: 0 | AB35: 0 | AC35: 0 | AD35: 0 | AE35: 0 | AF35: 0 | AG35: 0 | AH35: 0 | AI35: 0 | AJ35: 0 | AK35: 0 | AL35: 0 | AM35: IBNP
B36: 2001-05-01T00:00:00.000 | C36: 24336 | D36: 38853 | E36: 23133 | F36: 13306 | G36: 5789 | H36: 5946 | I36: 1041 | J36: 1381 | K36: 313 | L36: 253 | M36: 0 | N36: 0 | O36: -247 | P36: 266 | Q36: 7809 | R36: 0 | S36: 0 | T36: 0 | U36: 0 | V36: 0 | W36: 0 | X36: 0 | Y36: 0 | Z36: 0 | AA36: 0 | AB36: 0 | AC36: 0 | AD36: 0 | AE36: 0 | AF36: 0 | AG36: 0 | AH36: 0 | AI36: 0 | AJ36: 0 | AK36: 0 | AL36: 0 | AM36: IBNR
B37: 2001-06-01T00:00:00.000 | C37: 0 | D37: 0 | E37: 0 | F37: 0 | G37: 0 | H37: 0 | I37: 0 | J37: 0 | K37: 0 | L37: 0 | M37: 0 | N37: 0 | O37: 0 | P37: 0 | Q37: 0 | R37: 0 | S37: 0 | T37: 0 | U37: 0 | V37: 0 | W37: 0 | X37: 0 | Y37: 0 | Z37: 0 | AA37: 0 | AB37: 0 | AC37: 0 | AD37: 0 | AE37: 0 | AF37: 0 | AG37: 0 | AH37: 0 | AI37: 0 | AJ37: 0 | AK37: 0 | AL37: 0 | AM37: IBNP
B38: 2001-07-01T00:00:00.000 | C38: 0 | D38: 0 | E38: 0 | F38: 0 | G38: 0 | H38: 0 | I38: 0 | J38: 0 | K38: 0 | L38: 0 | M38: 0 | N38: 0 | O38: 0 | P38: 0 | Q38: 0 | R38: 0 | S38: 0 | T38: 0 | U38: 0 | V38: 0 | W38: 0 | X38: 0 | Y38: 0 | Z38: 0 | AA38: 0 | AB38: 0 | AC38: 0 | AD38: 0 | AE38: 0 | AF38: 0 | AG38: 0 | AH38: 0 | AI38: 0 | AJ38: 0 | AK38: 0 | AL38: 0 | AM38: IBNR

Sheet: paid claim lag dump
B2: REFDATE (Inc/Paid) | C2: LAG0 | D2: LAG1 | E2: LAG2 | F2: LAG3 | G2: LAG4 | H2: LAG5 | I2: LAG6 | J2: LAG7 | K2: LAG8 | L2: LAG9 | M2: LAG10 | N2: LAG11 | O2: LAG12 | P2: LAG13 | Q2: LAG14 | R2: LAG15 | S2: LAG16 | T2: LAG17 | U2: LAG18 | V2: LAG19 | W2: LAG20 | X2: LAG21 | Y2: LAG22 | Z2: LAG23 | AA2: LAG24 | AB2: LAG25 | AC2: LAG26 | AD2: LAG27 | AE2: LAG28 | AF2: LAG29 | AG2: LAG30 | AH2: LAG31 | AI2: LAG32 | AJ2: LAG33 | AK2: LAG34 | AL2: LAG35
B3: 1998-08-01T00:00:00.000 | C3: 50333 | D3: 0 | E3: 0 | F3: 0 | G3: 0 | H3: 0 | I3: 0 | J3: 0 | K3: 0 | L3: 0 | M3: 0 | N3: 0 | O3: 0 | P3: 0 | Q3: 0 | R3: 0 | S3: 0 | T3: 0 | U3: 0 | V3: 0 | W3: 0 | X3: 0 | Y3: 0 | Z3: 0 | AA3: 0 | AB3: 0 | AC3: 0 | AD3: 0 | AE3: 0 | AF3: 0 | AG3: 0 | AH3: 0 | AI3: 0 | AJ3: 0 | AK3: 0 | AL3: 0 | AM3: IBNP
B4: 1998-09-01T00:00:00.000 | C4: 50333 | D4: 0 | E4: 0 | F4: 0 | G4: 0 | H4: 0 | I4: 0 | J4: 0 | K4: 0 | L4: 0 | M4: 0 | N4: 0 | O4: 0 | P4: 0 | Q4: 0 | R4: 0 | S4: 0 | T4: 0 | U4: 0 | V4: 0 | W4: 0 | X4: 0 | Y4: 0 | Z4: 0 | AA4: 0 | AB4: 0 | AC4: 0 | AD4: 0 | AE4: 0 | AF4: 0 | AG4: 0 | AH4: 0 | AI4: 0 | AJ4: 0 | AK4: 0 | AL4: 0 | AM4: IBNR
B5: 1998-10-01T00:00:00.000 | C5: 20337 | D5: 176427 | E5: 24820 | F5: 0 | G5: 0 | H5: 0 | I5: 0 | J5: 0 | K5: 0 | L5: 0 | M5: 0 | N5: 0 | O5: 0 | P5: 0 | Q5: 0 | R5: 0 | S5: 0 | T5: 0 | U5: 0 | V5: 0 | W5: 0 | X5: 0 | Y5: 0 | Z5: 0 | AA5: 0 | AB5: 0 | AC5: 0 | AD5: 0 | AE5: 0 | AF5: 0 | AG5: 0 | AH5: 0 | AI5: 0 | AJ5: 0 | AK5: 0 | AL5: 0 | AM5: IBNP
B6: 1998-11-01T00:00:00.000 | C6: 40479 | D6: 159677 | E6: 21428 | F6: 0 | G6: 0 | H6: 0 | I6: 0 | J6: 0 | K6: 0 | L6: 0 | M6: 0 | N6: 0 | O6: 0 | P6: 0 | Q6: 0 | R6: 0 | S6: 0 | T6: 0 | U6: 0 | V6: 0 | W6: 0 | X6: 0 | Y6: 0 | Z6: 0 | AA6: 0 | AB6: 0 | AC6: 0 | AD6: 0 | AE6: 0 | AF6: 0 | AG6: 0 | AH6: 0 | AI6: 0 | AJ6: 0 | AK6: 0 | AL6: 0 | AM6: IBNR
B7: 1998-12-01T00:00:00.000 | C7: 15320 | D7: 109280 | E7: 64318 | F7: 8788 | G7: 850 | H7: 0 | I7: 0 | J7: 0 | K7: 0 | L7: 0 | M7: 0 | N7: 0 | O7: 0 | P7: 0 | Q7: 0 | R7: 0 | S7: 0 | T7: 0 | U7: 0 | V7: 0 | W7: 0 | X7: 0 | Y7: 0 | Z7: 0 | AA7: 0 | AB7: 0 | AC7: 0 | AD7: 0 | AE7: 0 | AF7: 0 | AG7: 0 | AH7: 0 | AI7: 0 | AJ7: 0 | AK7: 0 | AL7: 0 | AM7: IBNP
B8: 1999-01-01T00:00:00.000 | C8: 55099 | D8: 78962 | E8: 58105 | F8: 5540 | G8: 850 | H8: 0 | I8: 0 | J8: 0 | K8: 0 | L8: 0 | M8: 0 | N8: 0 | O8: 0 | P8: 0 | Q8: 0 | R8: 0 | S8: 0 | T8: 0 | U8: 0 | V8: 0 | W8: 0 | X8: 0 | Y8: 0 | Z8: 0 | AA8: 0 | AB8: 0 | AC8: 0 | AD8: 0 | AE8: 0 | AF8: 0 | AG8: 0 | AH8: 0 | AI8: 0 | AJ8: 0 | AK8: 0 | AL8: 0 | AM8: IBNR
B9: 1999-02-01T00:00:00.000 | C9: 724 | D9: 73514 | E9: 100846 | F9: 2952 | G9: 6434 | H9: 1354 | I9: 670 | J9: 0 | K9: 0 | L9: 0 | M9: 0 | N9: 0 | O9: 0 | P9: 0 | Q9: 0 | R9: 0 | S9: 0 | T9: 0 | U9: 0 | V9: 0 | W9: 0 | X9: 0 | Y9: 0 | Z9: 0 | AA9: 0 | AB9: 0 | AC9: 0 | AD9: 0 | AE9: 0 | AF9: 0 | AG9: 0 | AH9: 0 | AI9: 0 | AJ9: 0 | AK9: 0 | AL9: 0 | AM9: IBNP
B10: 1999-03-01T00:00:00.000 | C10: 22541 | D10: 122603 | E10: 33881 | F10: 1847 | G10: 3742 | H10: 1210 | I10: 670 | J10: 0 | K10: 0 | L10: 0 | M10: 0 | N10: 0 | O10: 0 | P10: 0 | Q10: 0 | R10: 0 | S10: 0 | T10: 0 | U10: 0 | V10: 0 | W10: 0 | X10: 0 | Y10: 0 | Z10: 0 | AA10: 0 | AB10: 0 | AC10: 0 | AD10: 0 | AE10: 0 | AF10: 0 | AG10: 0 | AH10: 0 | AI10: 0 | AJ10: 0 | AK10: 0 | AL10: 0 | AM10: IBNR
B11: 1999-04-01T00:00:00.000 | C11: 13576 | D11: 98490 | E11: 88390 | F11: 43589 | G11: 3662 | H11: 1893 | I11: 2160 | J11: 72 | K11: 4154 | L11: 0 | M11: 0 | N11: 0 | O11: 0 | P11: 0 | Q11: 0 | R11: 0 | S11: 0 | T11: 0 | U11: 0 | V11: 0 | W11: 0 | X11: 0 | Y11: 0 | Z11: 0 | AA11: 0 | AB11: 0 | AC11: 0 | AD11: 0 | AE11: 0 | AF11: 0 | AG11: 0 | AH11: 0 | AI11: 0 | AJ11: 0 | AK11: 0 | AL11: 0 | AM11: IBNP
B12: 1999-05-01T00:00:00.000 | C12: 33308 | D12: 90083 | E12: 107509 | F12: 13397 | G12: 3572 | H12: 3399 | I12: 492 | J12: 72 | K12: 4154 | L12: 0 | M12: 0 | N12: 0 | O12: 0 | P12: 0 | Q12: 0 | R12: 0 | S12: 0 | T12: 0 | U12: 0 | V12: 0 | W12: 0 | X12: 0 | Y12: 0 | Z12: 0 | AA12: 0 | AB12: 0 | AC12: 0 | AD12: 0 | AE12: 0 | AF12: 0 | AG12: 0 | AH12: 0 | AI12: 0 | AJ12: 0 | AK12: 0 | AL12: 0 | AM12: IBNR
B13: 1999-06-01T00:00:00.000 | C13: 6555 | D13: 111208 | E13: 44850 | F13: 15516 | G13: 14096 | H13: 20812 | I13: 1119 | J13: 484 | K13: 5922 | L13: -2017 | M13: 0 | N13: 0 | O13: 0 | P13: 0 | Q13: 0 | R13: 0 | S13: 0 | T13: 0 | U13: 0 | V13: 0 | W13: 0 | X13: 0 | Y13: 0 | Z13: 0 | AA13: 0 | AB13: 0 | AC13: 0 | AD13: 0 | AE13: 0 | AF13: 0 | AG13: 0 | AH13: 0 | AI13: 0 | AJ13: 0 | AK13: 0 | AL13: 0 | AM13: IBNP
B14: 1999-07-01T00:00:00.000 | C14: 57812 | D14: 73515 | E14: 57928 | F14: 10474 | G14: 13276 | H14: 141 | I14: 1010 | J14: 484 | K14: 6162 | L14: -2257 | M14: 0 | N14: 0 | O14: 0 | P14: 0 | Q14: 0 | R14: 0 | S14: 0 | T14: 0 | U14: 0 | V14: 0 | W14: 0 | X14: 0 | Y14: 0 | Z14: 0 | AA14: 0 | AB14: 0 | AC14: 0 | AD14: 0 | AE14: 0 | AF14: 0 | AG14: 0 | AH14: 0 | AI14: 0 | AJ14: 0 | AK14: 0 | AL14: 0 | AM14: IBNR
B15: 1999-08-01T00:00:00.000 | C15: 17973 | D15: 92380 | E15: 33087 | F15: 19224 | G15: 2579 | H15: 2463 | I15: 34006 | J15: -80 | K15: 309 | L15: 3572 | M15: 13 | N15: 1432 | O15: 0 | P15: 0 | Q15: 0 | R15: 0 | S15: 0 | T15: 0 | U15: 0 | V15: 0 | W15: 0 | X15: 0 | Y15: 0 | Z15: 0 | AA15: 0 | AB15: 0 | AC15: 0 | AD15: 0 | AE15: 0 | AF15: 0 | AG15: 0 | AH15: 0 | AI15: 0 | AJ15: 0 | AK15: 0 | AL15: 0 | AM15: IBNP
B16: 1999-09-01T00:00:00.000 | C16: 35600 | D16: 88108 | E16: 29728 | F16: 10188 | G16: 5698 | H16: 1709 | I16: 30681 | J16: -80 | K16: 3589 | L16: 292 | M16: 13 | N16: 1432 | O16: 0 | P16: 0 | Q16: 0 | R16: 0 | S16: 0 | T16: 0 | U16: 0 | V16: 0 | W16: 0 | X16: 0 | Y16: 0 | Z16: 0 | AA16: 0 | AB16: 0 | AC16: 0 | AD16: 0 | AE16: 0 | AF16: 0 | AG16: 0 | AH16: 0 | AI16: 0 | AJ16: 0 | AK16: 0 | AL16: 0 | AM16: IBNR
B17: 1999-10-01T00:00:00.000 | C17: 9177 | D17: 52091 | E17: 8840 | F17: 4870 | G17: 4827 | H17: 13323 | I17: -7175 | J17: 1423 | K17: 384 | L17: 278 | M17: 6985 | N17: 227 | O17: 240 | P17: 56 | Q17: 0 | R17: 0 | S17: 0 | T17: 0 | U17: 0 | V17: 0 | W17: 0 | X17: 0 | Y17: 0 | Z17: 0 | AA17: 0 | AB17: 0 | AC17: 0 | AD17: 0 | AE17: 0 | AF17: 0 | AG17: 0 | AH17: 0 | AI17: 0 | AJ17: 0 | AK17: 0 | AL17: 0 | AM17: IBNP
B18: 1999-11-01T00:00:00.000 | C18: 21566 | D18: 44918 | E18: 5794 | F18: 3493 | G18: 4941 | H18: 13013 | I18: -7298 | J18: 949 | K18: 492 | L18: 213 | M18: 6942 | N18: 227 | O18: 240 | P18: 56 | Q18: 0 | R18: 0 | S18: 0 | T18: 0 | U18: 0 | V18: 0 | W18: 0 | X18: 0 | Y18: 0 | Z18: 0 | AA18: 0 | AB18: 0 | AC18: 0 | AD18: 0 | AE18: 0 | AF18: 0 | AG18: 0 | AH18: 0 | AI18: 0 | AJ18: 0 | AK18: 0 | AL18: 0 | AM18: IBNR
B19: 1999-12-01T00:00:00.000 | C19: 9334 | D19: 90775 | E19: 92161 | F19: 12514 | G19: 4501 | H19: 3851 | I19: 655 | J19: 828 | K19: 203 | L19: 3333 | M19: 581 | N19: 90 | O19: 167 | P19: 0 | Q19: 0 | R19: 179 | S19: 196 | T19: 0 | U19: 0 | V19: 0 | W19: 0 | X19: 0 | Y19: 0 | Z19: 0 | AA19: 0 | AB19: 0 | AC19: 0 | AD19: 0 | AE19: 0 | AF19: 0 | AG19: 0 | AH19: 0 | AI19: 0 | AJ19: 0 | AK19: 0 | AL19: 0 | AM19: IBNP
B20: 2000-01-01T00:00:00.000 | C20: 51587 | D20: 137822 | E20: 7018 | F20: 12343 | G20: 1008 | H20: 3609 | I20: 703 | J20: 732 | K20: 127 | L20: 3206 | M20: 581 | N20: 115 | O20: 142 | P20: 0 | Q20: 0 | R20: 375 | S20: 0 | T20: 0 | U20: 0 | V20: 0 | W20: 0 | X20: 0 | Y20: 0 | Z20: 0 | AA20: 0 | AB20: 0 | AC20: 0 | AD20: 0 | AE20: 0 | AF20: 0 | AG20: 0 | AH20: 0 | AI20: 0 | AJ20: 0 | AK20: 0 | AL20: 0 | AM20: IBNR
B21: 2000-02-01T00:00:00.000 | C21: 8561 | D21: 60370 | E21: 167781 | F21: 11758 | G21: 26014 | H21: 2620 | I21: 22338 | J21: -1676 | K21: 677 | L21: 280 | M21: 799 | N21: 6427 | O21: 11304 | P21: 519 | Q21: 19 | R21: 0 | S21: 97 | T21: 9 | U21: 224 | V21: 0 | W21: 0 | X21: 0 | Y21: 0 | Z21: 0 | AA21: 0 | AB21: 0 | AC21: 0 | AD21: 0 | AE21: 0 | AF21: 0 | AG21: 0 | AH21: 0 | AI21: 0 | AJ21: 0 | AK21: 0 | AL21: 0 | AM21: IBNP
B22: 2000-03-01T00:00:00.000 | C22: 24902 | D22: 72373 | E22: 149464 | F22: 8997 | G22: 19057 | H22: 2477 | I22: 22318 | J22: -1662 | K22: 677 | L22: 779 | M22: 195 | N22: 16998 | O22: 678 | P22: 538 | Q22: 0 | R22: 84 | S22: 13 | T22: 233 | U22: 0 | V22: 0 | W22: 0 | X22: 0 | Y22: 0 | Z22: 0 | AA22: 0 | AB22: 0 | AC22: 0 | AD22: 0 | AE22: 0 | AF22: 0 | AG22: 0 | AH22: 0 | AI22: 0 | AJ22: 0 | AK22: 0 | AL22: 0 | AM22: IBNR
B23: 2000-04-01T00:00:00.000 | C23: 5744 | D23: 88812 | E23: 73915 | F23: 6913 | G23: 10480 | H23: -259 | I23: 5261 | J23: 430 | K23: 116 | L23: 1600 | M23: 112 | N23: 166 | O23: 152 | P23: 0 | Q23: 282 | R23: 75 | S23: 0 | T23: 0 | U23: 492 | V23: 0 | W23: 0 | X23: 0 | Y23: 0 | Z23: 0 | AA23: 0 | AB23: 0 | AC23: 0 | AD23: 0 | AE23: 0 | AF23: 0 | AG23: 0 | AH23: 0 | AI23: 0 | AJ23: 0 | AK23: 0 | AL23: 0 | AM23: IBNP
B24: 2000-05-01T00:00:00.000 | C24: 33042 | D24: 115076 | E24: 22022 | F24: 7991 | G24: 8209 | H24: -471 | I24: 4997 | J24: 430 | K24: 116 | L24: 1712 | M24: 166 | N24: 0 | O24: 152 | P24: 0 | Q24: 282 | R24: 75 | S24: 0 | T24: 492 | U24: 0 | V24: 0 | W24: 0 | X24: 0 | Y24: 0 | Z24: 0 | AA24: 0 | AB24: 0 | AC24: 0 | AD24: 0 | AE24: 0 | AF24: 0 | AG24: 0 | AH24: 0 | AI24: 0 | AJ24: 0 | AK24: 0 | AL24: 0 | AM24: IBNR
B25: 2000-06-01T00:00:00.000 | C25: 9146 | D25: 126060 | E25: 101785 | F25: 23437 | G25: 14176 | H25: 11759 | I25: 7297 | J25: 472 | K25: 32 | L25: 239 | M25: 124 | N25: 0 | O25: 7 | P25: 460 | Q25: 176 | R25: 128 | S25: 10 | T25: 0 | U25: 0 | V25: 0 | W25: 300 | X25: 0 | Y25: 0 | Z25: 0 | AA25: 0 | AB25: 0 | AC25: 0 | AD25: 0 | AE25: 0 | AF25: 0 | AG25: 0 | AH25: 0 | AI25: 0 | AJ25: 0 | AK25: 0 | AL25: 0 | AM25: IBNP
B26: 2000-07-01T00:00:00.000 | C26: 95821 | D26: 139851 | E26: 32541 | F26: 7864 | G26: 8316 | H26: 2179 | I26: 7260 | J26: 300 | K26: 32 | L26: 239 | M26: 124 | N26: 211 | O26: -204 | P26: 460 | Q26: 176 | R26: 128 | S26: 10 | T26: 0 | U26: 0 | V26: 0 | W26: 300 | X26: 0 | Y26: 0 | Z26: 0 | AA26: 0 | AB26: 0 | AC26: 0 | AD26: 0 | AE26: 0 | AF26: 0 | AG26: 0 | AH26: 0 | AI26: 0 | AJ26: 0 | AK26: 0 | AL26: 0 | AM26: IBNR
B27: 2000-08-01T00:00:00.000 | C27: 9415 | D27: 48503 | E27: 127444 | F27: 9062 | G27: 2904 | H27: 14411 | I27: 14223 | J27: -3390 | K27: 662 | L27: 6212 | M27: 33 | N27: 0 | O27: 0 | P27: 90 | Q27: 0 | R27: 0 | S27: 230 | T27: 0 | U27: 0 | V27: 0 | W27: 803 | X27: 0 | Y27: 0 | Z27: 0 | AA27: 0 | AB27: 0 | AC27: 0 | AD27: 0 | AE27: 0 | AF27: 0 | AG27: 0 | AH27: 0 | AI27: 0 | AJ27: 0 | AK27: 0 | AL27: 0 | AM27: IBNP
B28: 2000-09-01T00:00:00.000 | C28: 31473 | D28: 178666 | E28: 9928 | F28: -5630 | G28: 1840 | H28: 934 | I28: 13701 | J28: -3004 | K28: 306 | L28: 1265 | M28: 0 | N28: 0 | O28: 0 | P28: 90 | Q28: 0 | R28: 0 | S28: 230 | T28: 0 | U28: 0 | V28: 0 | W28: 803 | X28: 0 | Y28: 0 | Z28: 0 | AA28: 0 | AB28: 0 | AC28: 0 | AD28: 0 | AE28: 0 | AF28: 0 | AG28: 0 | AH28: 0 | AI28: 0 | AJ28: 0 | AK28: 0 | AL28: 0 | AM28: IBNR
B29: 2000-10-01T00:00:00.000 | C29: 4419 | D29: 34068 | E29: 91527 | F29: 34631 | G29: 9161 | H29: 5596 | I29: 4375 | J29: 412 | K29: 1128 | L29: 1357 | M29: 291 | N29: 11 | O29: 0 | P29: 0 | Q29: 0 | R29: 0 | S29: 0 | T29: 0 | U29: 0 | V29: 0 | W29: 0 | X29: 0 | Y29: 0 | Z29: 0 | AA29: 0 | AB29: 0 | AC29: 0 | AD29: 0 | AE29: 0 | AF29: 0 | AG29: 0 | AH29: 0 | AI29: 0 | AJ29: 0 | AK29: 0 | AL29: 0 | AM29: IBNP
B30: 2000-11-01T00:00:00.000 | C30: 31361 | D30: 76026 | E30: 56350 | F30: 6484 | G30: 7803 | H30: 5412 | I30: 341 | J30: 1097 | K30: 517 | L30: 1343 | M30: 231 | N30: 11 | O30: 0 | P30: 0 | Q30: 0 | R30: 0 | S30: 0 | T30: 0 | U30: 0 | V30: 0 | W30: 0 | X30: 0 | Y30: 0 | Z30: 0 | AA30: 0 | AB30: 0 | AC30: 0 | AD30: 0 | AE30: 0 | AF30: 0 | AG30: 0 | AH30: 0 | AI30: 0 | AJ30: 0 | AK30: 0 | AL30: 0 | AM30: IBNR
B31: 2000-12-01T00:00:00.000 | C31: 1804 | D31: 66303 | E31: 37667 | F31: 17053 | G31: 2170 | H31: 13856 | I31: 1103 | J31: 1737 | K31: 266 | L31: 115 | M31: 231 | N31: 271 | O31: 2907 | P31: 0 | Q31: 0 | R31: 0 | S31: 130 | T31: 0 | U31: 0 | V31: 0 | W31: 0 | X31: 0 | Y31: 0 | Z31: 96 | AA31: 0 | AB31: 329 | AC31: 0 | AD31: 0 | AE31: 0 | AF31: 0 | AG31: 0 | AH31: 0 | AI31: 0 | AJ31: 0 | AK31: 0 | AL31: 0 | AM31: IBNP
B32: 2001-01-01T00:00:00.000 | C32: 19993 | D32: 59964 | E32: 35539 | F32: 9556 | G32: 13627 | H32: 342 | I32: 1024 | J32: 1821 | K32: 208 | L32: 533 | M32: 148 | N32: 392 | O32: 2336 | P32: 0 | Q32: 0 | R32: 40 | S32: 90 | T32: 0 | U32: 0 | V32: 0 | W32: 0 | X32: 0 | Y32: 96 | Z32: 0 | AA32: 0 | AB32: 329 | AC32: 0 | AD32: 0 | AE32: 0 | AF32: 0 | AG32: 0 | AH32: 0 | AI32: 0 | AJ32: 0 | AK32: 0 | AL32: 0 | AM32: IBNR
B33: 2001-02-01T00:00:00.000 | C33: 240 | D33: 15910 | E33: 39608 | F33: 6673 | G33: 2288 | H33: 4935 | I33: 3876 | J33: 239 | K33: 985 | L33: 304 | M33: 5839 | N33: 52 | O33: 101 | P33: 1201 | Q33: 452 | R33: 0 | S33: 0 | T33: 0 | U33: 0 | V33: 0 | W33: 0 | X33: 0 | Y33: 0 | Z33: 0 | AA33: 0 | AB33: 0 | AC33: 0 | AD33: 0 | AE33: 0 | AF33: 0 | AG33: 0 | AH33: 0 | AI33: 0 | AJ33: 0 | AK33: 0 | AL33: 0 | AM33: IBNP
B34: 2001-03-01T00:00:00.000 | C34: 9046 | D34: 43493 | E34: 7571 | F34: 5995 | G34: 3715 | H34: 3670 | I34: 279 | J34: 596 | K34: 578 | L34: 932 | M34: 5022 | N34: 119 | O34: 251 | P34: 1037 | Q34: 399 | R34: 0 | S34: 0 | T34: 0 | U34: 0 | V34: 0 | W34: 0 | X34: 0 | Y34: 0 | Z34: 0 | AA34: 0 | AB34: 0 | AC34: 0 | AD34: 0 | AE34: 0 | AF34: 0 | AG34: 0 | AH34: 0 | AI34: 0 | AJ34: 0 | AK34: 0 | AL34: 0 | AM34: IBNR
B35: 2001-04-01T00:00:00.000 | C35: 753 | D35: 13772 | E35: 13968 | F35: 12573 | G35: 2779 | H35: 5650 | I35: 674 | J35: 1530 | K35: 322 | L35: 0 | M35: 92 | N35: 0 | O35: 0 | P35: 0 | Q35: 0 | R35: 0 | S35: 30 | T35: 0 | U35: 0 | V35: 0 | W35: 0 | X35: 0 | Y35: 0 | Z35: 0 | AA35: 0 | AB35: 0 | AC35: 0 | AD35: 0 | AE35: 0 | AF35: 0 | AG35: 0 | AH35: 0 | AI35: 0 | AJ35: 0 | AK35: 0 | AL35: 0 | AM35: IBNP
B36: 2001-05-01T00:00:00.000 | C36: 12673 | D36: 20961 | E36: 6855 | F36: 5064 | G36: 3297 | H36: 1391 | I36: 1458 | J36: 126 | K36: 196 | L36: 0 | M36: 92 | N36: 0 | O36: 0 | P36: 0 | Q36: 0 | R36: 0 | S36: 30 | T36: 0 | U36: 0 | V36: 0 | W36: 0 | X36: 0 | Y36: 0 | Z36: 0 | AA36: 0 | AB36: 0 | AC36: 0 | AD36: 0 | AE36: 0 | AF36: 0 | AG36: 0 | AH36: 0 | AI36: 0 | AJ36: 0 | AK36: 0 | AL36: 0 | AM36: IBNR
B37: 2001-06-01T00:00:00.000 | C37: 0 | D37: 0 | E37: 0 | F37: 0 | G37: 0 | H37: 0 | I37: 0 | J37: 0 | K37: 0 | L37: 0 | M37: 0 | N37: 0 | O37: 0 | P37: 0 | Q37: 0 | R37: 0 | S37: 0 | T37: 0 | U37: 0 | V37: 0 | W37: 0 | X37: 0 | Y37: 0 | Z37: 0 | AA37: 0 | AB37: 0 | AC37: 0 | AD37: 0 | AE37: 0 | AF37: 0 | AG37: 0 | AH37: 0 | AI37: 0 | AJ37: 0 | AK37: 0 | AL37: 0 | AM37: IBNP
B38: 2001-07-01T00:00:00.000 | C38: 0 | D38: 0 | E38: 0 | F38: 0 | G38: 0 | H38: 0 | I38: 0 | J38: 0 | K38: 0 | L38: 0 | M38: 0 | N38: 0 | O38: 0 | P38: 0 | Q38: 0 | R38: 0 | S38: 0 | T38: 0 | U38: 0 | V38: 0 | W38: 0 | X38: 0 | Y38: 0 | Z38: 0 | AA38: 0 | AB38: 0 | AC38: 0 | AD38: 0 | AE38: 0 | AF38: 0 | AG38: 0 | AH38: 0 | AI38: 0 | AJ38: 0 | AK38: 0 | AL38: 0 | AM38: IBNR

Sheet: aux
B2: REFDATE (Inc) | C2: LAG0 | D2: LAG1 | E2: LAG2 | F2: LAG3 | G2: LAG4 | H2: LAG5 | I2: LAG6 | J2: LAG7 | K2: LAG8 | L2: LAG9 | M2: LAG10 | N2: LAG11 | O2: LAG12 | P2: LAG13 | Q2: LAG14 | R2: LAG15 | S2: LAG16 | T2: LAG17 | U2: LAG18 | V2: LAG19 | W2: LAG20 | X2: LAG21 | Y2: LAG22 | Z2: LAG23 | AA2: LAG24 | AB2: LAG25 | AC2: LAG26 | AD2: LAG27 | AE2: LAG28 | AF2: LAG29 | AG2: LAG30 | AH2: LAG31 | AI2: LAG32 | AJ2: LAG33 | AK2: LAG34 | AL2: LAG35
B3: ='general dump'!RC -> 1998-08-01T00:00:00.000 | C3: =IF(LOWER(Basis)="ibnp",'paid claim lag dump'!RC,'reported claim lag dump'!RC) -> 25147 | D3: =IF(LOWER(Basis)="ibnp",'paid claim lag dump'!RC,'reported claim lag dump'!RC) -> 74072 | E3: =IF(LOWER(Basis)="ibnp",'paid claim lag dump'!RC,'reported claim lag dump'!RC) -> 0 | F3: =IF(LOWER(Basis)="ibnp",'paid claim lag dump'!RC,'reported claim lag dump'!RC) -> 0 | G3: =IF(LOWER(Basis)="ibnp",'paid claim lag dump'!RC,'reported claim lag dump'!RC) -> 0 | H3: =IF(LOWER(Basis)="ibnp",'paid claim lag dump'!RC,'reported claim lag dump'!RC) -> 0 | I3: =IF(LOWER(Basis)="ibnp",'paid claim lag dump'!RC,'reported claim lag dump'!RC) -> 0 | J3: =IF(LOWER(Basis)="ibnp",'paid claim lag dump'!RC,'reported claim lag dump'!RC) -> 0 | K3: =IF(LOWER(Basis)="ibnp",'paid claim lag dump'!RC,'reported claim lag dump'!RC) -> 0 | L3: =IF(LOWER(Basis)="ibnp",'paid claim lag dump'!RC,'reported claim lag dump'!RC) -> 0 | M3: =IF(LOWER(Basis)="ibnp",'paid claim lag dump'!RC,'reported claim lag dump'!RC) -> 0 | N3: =IF(LOWER(Basis)="ibnp",'paid claim lag dump'!RC,'reported claim lag dump'!RC) -> 0 | O3: =IF(LOWER(Basis)="ibnp",'paid claim lag dump'!RC,'reported claim lag dump'!RC) -> 0 | P3: =IF(LOWER(Basis)="ibnp",'paid claim lag dump'!RC,'reported claim lag dump'!RC) -> 0 | Q3: =IF(LOWER(Basis)="ibnp",'paid claim lag dump'!RC,'reported claim lag dump'!RC) -> 0 | R3: =IF(LOWER(Basis)="ibnp",'paid claim lag dump'!RC,'reported claim lag dump'!RC) -> 0 | S3: =IF(LOWER(Basis)="ibnp",'paid claim lag dump'!RC,'reported claim lag dump'!RC) -> 0 | T3: =IF(LOWER(Basis)="ibnp",'paid claim lag dump'!RC,'reported claim lag dump'!RC) -> 0 | U3: =IF(LOWER(Basis)="ibnp",'paid claim lag dump'!RC,'reported claim lag dump'!RC) -> 0 | V3: =IF(LOWER(Basis)="ibnp",'paid claim lag dump'!RC,'reported claim lag dump'!RC) -> 0 | W3: =IF(LOWER(Basis)="ibnp",'paid claim lag dump'!RC,'reported claim lag dump'!RC) -> 0 | X3: =IF(LOWER(Basis)="ibnp",'paid claim lag dump'!RC,'reported claim lag dump'!RC) -> 0 | Y3: =IF(LOWER(Basis)="ibnp",'paid claim lag dump'!RC,'reported claim lag dump'!RC) -> 0 | Z3: =IF(LOWER(Basis)="ibnp",'paid claim lag dump'!RC,'reported claim lag dump'!RC) -> 0 | AA3: =IF(LOWER(Basis)="ibnp",'paid claim lag dump'!RC,'reported claim lag dump'!RC) -> 0 | AB3: =IF(LOWER(Basis)="ibnp",'paid claim lag dump'!RC,'reported claim lag dump'!RC) -> 0 | AC3: =IF(LOWER(Basis)="ibnp",'paid claim lag dump'!RC,'reported claim lag dump'!RC) -> 0 | AD3: =IF(LOWER(Basis)="ibnp",'paid claim lag dump'!RC,'reported claim lag dump'!RC) -> 0 | AE3: =IF(LOWER(Basis)="ibnp",'paid claim lag dump'!RC,'reported claim lag dump'!RC) -> 0 | AF3: =IF(LOWER(Basis)="ibnp",'paid claim lag dump'!RC,'reported claim lag dump'!RC) -> 0 | AG3: =IF(LOWER(Basis)="ibnp",'paid claim lag dump'!RC,'reported claim lag dump'!RC) -> 0 | AH3: =IF(LOWER(Basis)="ibnp",'paid claim lag dump'!RC,'reported claim lag dump'!RC) -> 0 | AI3: =IF(LOWER(Basis)="ibnp",'paid claim lag dump'!RC,'reported claim lag dump'!RC) -> 0 | AJ3: =IF(LOWER(Basis)="ibnp",'paid claim lag dump'!RC,'reported claim lag dump'!RC) -> 0 | AK3: =IF(LOWER(Basis)="ibnp",'paid claim lag dump'!RC,'reported claim lag dump'!RC) -> 0 | AL3: =IF(LOWER(Basis)="ibnp",'paid claim lag dump'!RC,'reported claim lag dump'!RC) -> 0
B4: ='general dump'!RC -> 1998-09-01T00:00:00.000 | C4: =IF(LOWER(Basis)="ibnp",'paid claim lag dump'!RC,'reported claim lag dump'!RC) -> 31253 | D4: =IF(LOWER(Basis)="ibnp",'paid claim lag dump'!RC,'reported claim lag dump'!RC) -> 67966 | E4: =IF(LOWER(Basis)="ibnp",'paid claim lag dump'!RC,'reported claim lag dump'!RC) -> 0 | F4: =IF(LOWER(Basis)="ibnp",'paid claim lag dump'!RC,'reported claim lag dump'!RC) -> 0 | G4: =IF(LOWER(Basis)="ibnp",'paid claim lag dump'!RC,'reported claim lag dump'!RC) -> 0 | H4: =IF(LOWER(Basis)="ibnp",'paid claim lag dump'!RC,'reported claim lag dump'!RC) -> 0 | I4: =IF(LOWER(Basis)="ibnp",'paid claim lag dump'!RC,'reported claim lag dump'!RC) -> 0 | J4: =IF(LOWER(Basis)="ibnp",'paid claim lag dump'!RC,'reported claim lag dump'!RC) -> 0 | K4: =IF(LOWER(Basis)="ibnp",'paid claim lag dump'!RC,'reported claim lag dump'!RC) -> 0 | L4: =IF(LOWER(Basis)="ibnp",'paid claim lag dump'!RC,'reported claim lag dump'!RC) -> 0 | M4: =IF(LOWER(Basis)="ibnp",'paid claim lag dump'!RC,'reported claim lag dump'!RC) -> 0 | N4: =IF(LOWER(Basis)="ibnp",'paid claim lag dump'!RC,'reported claim lag dump'!RC) -> 0 | O4: =IF(LOWER(Basis)="ibnp",'paid claim lag dump'!RC,'reported claim lag dump'!RC) -> 0 | P4: =IF(LOWER(Basis)="ibnp",'paid claim lag dump'!RC,'reported claim lag dump'!RC) -> 0 | Q4: =IF(LOWER(Basis)="ibnp",'paid claim lag dump'!RC,'reported claim lag dump'!RC) -> 0 | R4: =IF(LOWER(Basis)="ibnp",'paid claim lag dump'!RC,'reported claim lag dump'!RC) -> 0 | S4: =IF(LOWER(Basis)="ibnp",'paid claim lag dump'!RC,'reported claim lag dump'!RC) -> 0 | T4: =IF(LOWER(Basis)="ibnp",'paid claim lag dump'!RC,'reported claim lag dump'!RC) -> 0 | U4: =IF(LOWER(Basis)="ibnp",'paid claim lag dump'!RC,'reported claim lag dump'!RC) -> 0 | V4: =IF(LOWER(Basis)="ibnp",'paid claim lag dump'!RC,'reported claim lag dump'!RC) -> 0 | W4: =IF(LOWER(Basis)="ibnp",'paid claim lag dump'!RC,'reported claim lag dump'!RC) -> 0 | X4: =IF(LOWER(Basis)="ibnp",'paid claim lag dump'!RC,'reported claim lag dump'!RC) -> 0 | Y4: =IF(LOWER(Basis)="ibnp",'paid claim lag dump'!RC,'reported claim lag dump'!RC) -> 0 | Z4: =IF(LOWER(Basis)="ibnp",'paid claim lag dump'!RC,'reported claim lag dump'!RC) -> 0 | AA4: =IF(LOWER(Basis)="ibnp",'paid claim lag dump'!RC,'reported claim lag dump'!RC) -> 0 | AB4: =IF(LOWER(Basis)="ibnp",'paid claim lag dump'!RC,'reported claim lag dump'!RC) -> 0 | AC4: =IF(LOWER(Basis)="ibnp",'paid claim lag dump'!RC,'reported claim lag dump'!RC) -> 0 | AD4: =IF(LOWER(Basis)="ibnp",'paid claim lag dump'!RC,'reported claim lag dump'!RC) -> 0 | AE4: =IF(LOWER(Basis)="ibnp",'paid claim lag dump'!RC,'reported claim lag dump'!RC) -> 0 | AF4: =IF(LOWER(Basis)="ibnp",'paid claim lag dump'!RC,'reported claim lag dump'!RC) -> 0 | AG4: =IF(LOWER(Basis)="ibnp",'paid claim lag dump'!RC,'reported claim lag dump'!RC) -> 0 | AH4: =IF(LOWER(Basis)="ibnp",'paid claim lag dump'!RC,'reported claim lag dump'!RC) -> 0 | AI4: =IF(LOWER(Basis)="ibnp",'paid claim lag dump'!RC,'reported claim lag dump'!RC) -> 0 | AJ4: =IF(LOWER(Basis)="ibnp",'paid claim lag dump'!RC,'reported claim lag dump'!RC) -> 0 | AK4: =IF(LOWER(Basis)="ibnp",'paid claim lag dump'!RC,'reported claim lag dump'!RC) -> 0 | AL4: =IF(LOWER(Basis)="ibnp",'paid claim lag dump'!RC,'reported claim lag dump'!RC) -> 0
B5: ='general dump'!RC -> 1998-10-01T00:00:00.000 | C5: =IF(LOWER(Basis)="ibnp",'paid claim lag dump'!RC,'reported claim lag dump'!RC) -> 30186 | D5: =IF(LOWER(Basis)="ibnp",'paid claim lag dump'!RC,'reported claim lag dump'!RC) -> 157846 | E5: =IF(LOWER(Basis)="ibnp",'paid claim lag dump'!RC,'reported claim lag dump'!RC) -> 54319 | F5: =IF(LOWER(Basis)="ibnp",'paid claim lag dump'!RC,'reported claim lag dump'!RC) -> 49663 | G5: =IF(LOWER(Basis)="ibnp",'paid claim lag dump'!RC,'reported claim lag dump'!RC) -> 0 | H5: =IF(LOWER(Basis)="ibnp",'paid claim lag dump'!RC,'reported claim lag dump'!RC) -> 0 | I5: =IF(LOWER(Basis)="ibnp",'paid claim lag dump'!RC,'reported claim lag dump'!RC) -> 0 | J5: =IF(LOWER(Basis)="ibnp",'paid claim lag dump'!RC,'reported claim lag dump'!RC) -> 0 | K5: =IF(LOWER(Basis)="ibnp",'paid claim lag dump'!RC,'reported claim lag dump'!RC) -> 0 | L5: =IF(LOWER(Basis)="ibnp",'paid claim lag dump'!RC,'reported claim lag dump'!RC) -> 0 | M5: =IF(LOWER(Basis)="ibnp",'paid claim lag dump'!RC,'reported claim lag dump'!RC) -> 0 | N5: =IF(LOWER(Basis)="ibnp",'paid claim lag dump'!RC,'reported claim lag dump'!RC) -> 0 | O5: =IF(LOWER(Basis)="ibnp",'paid claim lag dump'!RC,'reported claim lag dump'!RC) -> 0 | P5: =IF(LOWER(Basis)="ibnp",'paid claim lag dump'!RC,'reported claim lag dump'!RC) -> 0 | Q5: =IF(LOWER(Basis)="ibnp",'paid claim lag dump'!RC,'reported claim lag dump'!RC) -> 0 | R5: =IF(LOWER(Basis)="ibnp",'paid claim lag dump'!RC,'reported claim lag dump'!RC) -> 0 | S5: =IF(LOWER(Basis)="ibnp",'paid claim lag dump'!RC,'reported claim lag dump'!RC) -> 0 | T5: =IF(LOWER(Basis)="ibnp",'paid claim lag dump'!RC,'reported claim lag dump'!RC) -> 0 | U5: =IF(LOWER(Basis)="ibnp",'paid claim lag dump'!RC,'reported claim lag dump'!RC) -> 0 | V5: =IF(LOWER(Basis)="ibnp",'paid claim lag dump'!RC,'reported claim lag dump'!RC) -> 0 | W5: =IF(LOWER(Basis)="ibnp",'paid claim lag dump'!RC,'reported claim lag dump'!RC) -> 0 | X5: =IF(LOWER(Basis)="ibnp",'paid claim lag dump'!RC,'reported claim lag dump'!RC) -> 0 | Y5: =IF(LOWER(Basis)="ibnp",'paid claim lag dump'!RC,'reported claim lag dump'!RC) -> 0 | Z5: =IF(LOWER(Basis)="ibnp",'paid claim lag dump'!RC,'reported claim lag dump'!RC) -> 0 | AA5: =IF(LOWER(Basis)="ibnp",'paid claim lag dump'!RC,'reported claim lag dump'!RC) -> 0 | AB5: =IF(LOWER(Basis)="ibnp",'paid claim lag dump'!RC,'reported claim lag dump'!RC) -> 0 | AC5: =IF(LOWER(Basis)="ibnp",'paid claim lag dump'!RC,'reported claim lag dump'!RC) -> 0 | AD5: =IF(LOWER(Basis)="ibnp",'paid claim lag dump'!RC,'reported claim lag dump'!RC) -> 0 | AE5: =IF(LOWER(Basis)="ibnp",'paid claim lag dump'!RC,'reported claim lag dump'!RC) -> 0 | AF5: =IF(LOWER(Basis)="ibnp",'paid claim lag dump'!RC,'reported claim lag dump'!RC) -> 0 | AG5: =IF(LOWER(Basis)="ibnp",'paid claim lag dump'!RC,'reported claim lag dump'!RC) -> 0 | AH5: =IF(LOWER(Basis)="ibnp",'paid claim lag dump'!RC,'reported claim lag dump'!RC) -> 0 | AI5: =IF(LOWER(Basis)="ibnp",'paid claim lag dump'!RC,'reported claim lag dump'!RC) -> 0 | AJ5: =IF(LOWER(Basis)="ibnp",'paid claim lag dump'!RC,'reported claim lag dump'!RC) -> 0 | AK5: =IF(LOWER(Basis)="ibnp",'paid claim lag dump'!RC,'reported claim lag dump'!RC) -> 0 | AL5: =IF(LOWER(Basis)="ibnp",'paid claim lag dump'!RC,'reported claim lag dump'!RC) -> 0
B6: ='general dump'!RC -> 1998-11-01T00:00:00.000 | C6: =IF(LOWER(Basis)="ibnp",'paid claim lag dump'!RC,'reported claim lag dump'!RC) -> 49927 | D6: =IF(LOWER(Basis)="ibnp",'paid claim lag dump'!RC,'reported claim lag dump'!RC) -> 140535 | E6: =IF(LOWER(Basis)="ibnp",'paid claim lag dump'!RC,'reported claim lag dump'!RC) -> 51889 | F6: =IF(LOWER(Basis)="ibnp",'paid claim lag dump'!RC,'reported claim lag dump'!RC) -> 49663 | G6: =IF(LOWER(Basis)="ibnp",'paid claim lag dump'!RC,'reported claim lag dump'!RC) -> 0 | H6: =IF(LOWER(Basis)="ibnp",'paid claim lag dump'!RC,'reported claim lag dump'!RC) -> 0 | I6: =IF(LOWER(Basis)="ibnp",'paid claim lag dump'!RC,'reported claim lag dump'!RC) -> 0 | J6: =IF(LOWER(Basis)="ibnp",'paid claim lag dump'!RC,'reported claim lag dump'!RC) -> 0 | K6: =IF(LOWER(Basis)="ibnp",'paid claim lag dump'!RC,'reported claim lag dump'!RC) -> 0 | L6: =IF(LOWER(Basis)="ibnp",'paid claim lag dump'!RC,'reported claim lag dump'!RC) -> 0 | M6: =IF(LOWER(Basis)="ibnp",'paid claim lag dump'!RC,'reported claim lag dump'!RC) -> 0 | N6: =IF(LOWER(Basis)="ibnp",'paid claim lag dump'!RC,'reported claim lag dump'!RC) -> 0 | O6: =IF(LOWER(Basis)="ibnp",'paid claim lag dump'!RC,'reported claim lag dump'!RC) -> 0 | P6: =IF(LOWER(Basis)="ibnp",'paid claim lag dump'!RC,'reported claim lag dump'!RC) -> 0 | Q6: =IF(LOWER(Basis)="ibnp",'paid claim lag dump'!RC,'reported claim lag dump'!RC) -> 0 | R6: =IF(LOWER(Basis)="ibnp",'paid claim lag dump'!RC,'reported claim lag dump'!RC) -> 0 | S6: =IF(LOWER(Basis)="ibnp",'paid claim lag dump'!RC,'reported claim lag dump'!RC) -> 0 | T6: =IF(LOWER(Basis)="ibnp",'paid claim lag dump'!RC,'reported claim lag dump'!RC) -> 0 | U6: =IF(LOWER(Basis)="ibnp",'paid claim lag dump'!RC,'reported claim lag dump'!RC) -> 0 | V6: =IF(LOWER(Basis)="ibnp",'paid claim lag dump'!RC,'reported claim lag dump'!RC) -> 0 | W6: =IF(LOWER(Basis)="ibnp",'paid claim lag dump'!RC,'reported claim lag dump'!RC) -> 0 | X6: =IF(LOWER(Basis)="ibnp",'paid claim lag dump'!RC,'reported claim lag dump'!RC) -> 0 | Y6: =IF(LOWER(Basis)="ibnp",'paid claim lag dump'!RC,'reported claim lag dump'!RC) -> 0 | Z6: =IF(LOWER(Basis)="ibnp",'paid claim lag dump'!RC,'reported claim lag dump'!RC) -> 0 | AA6: =IF(LOWER(Basis)="ibnp",'paid claim lag dump'!RC,'reported claim lag dump'!RC) -> 0 | AB6: =IF(LOWER(Basis)="ibnp",'paid claim lag dump'!RC,'reported claim lag dump'!RC) -> 0 | AC6: =IF(LOWER(Basis)="ibnp",'paid claim lag dump'!RC,'reported claim lag dump'!RC) -> 0 | AD6: =IF(LOWER(Basis)="ibnp",'paid claim lag dump'!RC,'reported claim lag dump'!RC) -> 0 | AE6: =IF(LOWER(Basis)="ibnp",'paid claim lag dump'!RC,'reported claim lag dump'!RC) -> 0 | AF6: =IF(LOWER(Basis)="ibnp",'paid claim lag dump'!RC,'reported claim lag dump'!RC) -> 0 | AG6: =IF(LOWER(Basis)="ibnp",'paid claim lag dump'!RC,'reported claim lag dump'!RC) -> 0 | AH6: =IF(LOWER(Basis)="ibnp",'paid claim lag dump'!RC,'reported claim lag dump'!RC) -> 0 | AI6: =IF(LOWER(Basis)="ibnp",'paid claim lag dump'!RC,'reported claim lag dump'!RC) -> 0 | AJ6: =IF(LOWER(Basis)="ibnp",'paid claim lag dump'!RC,'reported claim lag dump'!RC) -> 0 | AK6: =IF(LOWER(Basis)="ibnp",'paid claim lag dump'!RC,'reported claim lag dump'!RC) -> 0 | AL6: =IF(LOWER(Basis)="ibnp",'paid claim lag dump'!RC,'reported claim lag dump'!RC) -> 0
B7: ='general dump'!RC -> 1998-12-01T00:00:00.000 | C7: =IF(LOWER(Basis)="ibnp",'paid claim lag dump'!RC,'reported claim lag dump'!RC) -> 6022 | D7: =IF(LOWER(Basis)="ibnp",'paid claim lag dump'!RC,'reported claim lag dump'!RC) -> 55145 | E7: =IF(LOWER(Basis)="ibnp",'paid claim lag dump'!RC,'reported claim lag dump'!RC) -> 17920 | F7: =IF(LOWER(Basis)="ibnp",'paid claim lag dump'!RC,'reported claim lag dump'!RC) -> 25255 | G7: =IF(LOWER(Basis)="ibnp",'paid claim lag dump'!RC,'reported claim lag dump'!RC) -> 5019 | H7: =IF(LOWER(Basis)="ibnp",'paid claim lag dump'!RC,'reported claim lag dump'!RC) -> 402 | I7: =IF(LOWER(Basis)="ibnp",'paid claim lag dump'!RC,'reported claim lag dump'!RC) -> 0 | J7: =IF(LOWER(Basis)="ibnp",'paid claim lag dump'!RC,'reported claim lag dump'!RC) -> 0 | K7: =IF(LOWER(Basis)="ibnp",'paid claim lag dump'!RC,'reported claim lag dump'!RC) -> 0 | L7: =IF(LOWER(Basis)="ibnp",'paid claim lag dump'!RC,'reported claim lag dump'!RC) -> 0 | M7: =IF(LOWER(Basis)="ibnp",'paid claim lag dump'!RC,'reported claim lag dump'!RC) -> 0 | N7: =IF(LOWER(Basis)="ibnp",'paid claim lag dump'!RC,'reported claim lag dump'!RC) -> 0 | O7: =IF(LOWER(Basis)="ibnp",'paid claim lag dump'!RC,'reported claim lag dump'!RC) -> 0 | P7: =IF(LOWER(Basis)="ibnp",'paid claim lag dump'!RC,'reported claim lag dump'!RC) -> 0 | Q7: =IF(LOWER(Basis)="ibnp",'paid claim lag dump'!RC,'reported claim lag dump'!RC) -> 0 | R7: =IF(LOWER(Basis)="ibnp",'paid claim lag dump'!RC,'reported claim lag dump'!RC) -> 0 | S7: =IF(LOWER(Basis)="ibnp",'paid claim lag dump'!RC,'reported claim lag dump'!RC) -> 0 | T7: =IF(LOWER(Basis)="ibnp",'paid claim lag dump'!RC,'reported claim lag dump'!RC) -> 0 | U7: =IF(LOWER(Basis)="ibnp",'paid claim lag dump'!RC,'reported claim lag dump'!RC) -> 0 | V7: =IF(LOWER(Basis)="ibnp",'paid claim lag dump'!RC,'reported claim lag dump'!RC) -> 0 | W7: =IF(LOWER(Basis)="ibnp",'paid claim lag dump'!RC,'reported claim lag dump'!RC) -> 0 | X7: =IF(LOWER(Basis)="ibnp",'paid claim lag dump'!RC,'reported claim lag dump'!RC) -> 0 | Y7: =IF(LOWER(Basis)="ibnp",'paid claim lag dump'!RC,'reported claim lag dump'!RC) -> 0 | Z7: =IF(LOWER(Basis)="ibnp",'paid claim lag dump'!RC,'reported claim lag dump'!RC) -> 0 | AA7: =IF(LOWER(Basis)="ibnp",'paid claim lag dump'!RC,'reported claim lag dump'!RC) -> 0 | AB7: =IF(LOWER(Basis)="ibnp",'paid claim lag dump'!RC,'reported claim lag dump'!RC) -> 0 | AC7: =IF(LOWER(Basis)="ibnp",'paid claim lag dump'!RC,'reported claim lag dump'!RC) -> 0 | AD7: =IF(LOWER(Basis)="ibnp",'paid claim lag dump'!RC,'reported claim lag dump'!RC) -> 0 | AE7: =IF(LOWER(Basis)="ibnp",'paid claim lag dump'!RC,'reported claim lag dump'!RC) -> 0 | AF7: =IF(LOWER(Basis)="ibnp",'paid claim lag dump'!RC,'reported claim lag dump'!RC) -> 0 | AG7: =IF(LOWER(Basis)="ibnp",'paid claim lag dump'!RC,'reported claim lag dump'!RC) -> 0 | AH7: =IF(LOWER(Basis)="ibnp",'paid claim lag dump'!RC,'reported claim lag dump'!RC) -> 0 | AI7: =IF(LOWER(Basis)="ibnp",'paid claim lag dump'!RC,'reported claim lag dump'!RC) -> 0 | AJ7: =IF(LOWER(Basis)="ibnp",'paid claim lag dump'!RC,'reported claim lag dump'!RC) -> 0 | AK7: =IF(LOWER(Basis)="ibnp",'paid claim lag dump'!RC,'reported claim lag dump'!RC) -> 0 | AL7: =IF(LOWER(Basis)="ibnp",'paid claim lag dump'!RC,'reported claim lag dump'!RC) -> 0
B8: ='general dump'!RC -> 1999-01-01T00:00:00.000 | C8: =IF(LOWER(Basis)="ibnp",'paid claim lag dump'!RC,'reported claim lag dump'!RC) -> 31494 | D8: =IF(LOWER(Basis)="ibnp",'paid claim lag dump'!RC,'reported claim lag dump'!RC) -> 39304 | E8: =IF(LOWER(Basis)="ibnp",'paid claim lag dump'!RC,'reported claim lag dump'!RC) -> 24477 | F8: =IF(LOWER(Basis)="ibnp",'paid claim lag dump'!RC,'reported claim lag dump'!RC) -> 9937 | G8: =IF(LOWER(Basis)="ibnp",'paid claim lag dump'!RC,'reported claim lag dump'!RC) -> 4149 | H8: =IF(LOWER(Basis)="ibnp",'paid claim lag dump'!RC,'reported claim lag dump'!RC) -> 402 | I8: =IF(LOWER(Basis)="ibnp",'paid claim lag dump'!RC,'reported claim lag dump'!RC) -> 0 | J8: =IF(LOWER(Basis)="ibnp",'paid claim lag dump'!RC,'reported claim lag dump'!RC) -> 0 | K8: =IF(LOWER(Basis)="ibnp",'paid claim lag dump'!RC,'reported claim lag dump'!RC) -> 0 | L8: =IF(LOWER(Basis)="ibnp",'paid claim lag dump'!RC,'reported claim lag dump'!RC) -> 0 | M8: =IF(LOWER(Basis)="ibnp",'paid claim lag dump'!RC,'reported claim lag dump'!RC) -> 0 | N8: =IF(LOWER(Basis)="ibnp",'paid claim lag dump'!RC,'reported claim lag dump'!RC) -> 0 | O8: =IF(LOWER(Basis)="ibnp",'paid claim lag dump'!RC,'reported claim lag dump'!RC) -> 0 | P8: =IF(LOWER(Basis)="ibnp",'paid claim lag dump'!RC,'reported claim lag dump'!RC) -> 0 | Q8: =IF(LOWER(Basis)="ibnp",'paid claim lag dump'!RC,'reported claim lag dump'!RC) -> 0 | R8: =IF(LOWER(Basis)="ibnp",'paid claim lag dump'!RC,'reported claim lag dump'!RC) -> 0 | S8: =IF(LOWER(Basis)="ibnp",'paid claim lag dump'!RC,'reported claim lag dump'!RC) -> 0 | T8: =IF(LOWER(Basis)="ibnp",'paid claim lag dump'!RC,'reported claim lag dump'!RC) -> 0 | U8: =IF(LOWER(Basis)="ibnp",'paid claim lag dump'!RC,'reported claim lag dump'!RC) -> 0 | V8: =IF(LOWER(Basis)="ibnp",'paid claim lag dump'!RC,'reported claim lag dump'!RC) -> 0 | W8: =IF(LOWER(Basis)="ibnp",'paid claim lag dump'!RC,'reported claim lag dump'!RC) -> 0 | X8: =IF(LOWER(Basis)="ibnp",'paid claim lag dump'!RC,'reported claim lag dump'!RC) -> 0 | Y8: =IF(LOWER(Basis)="ibnp",'paid claim lag dump'!RC,'reported claim lag dump'!RC) -> 0 | Z8: =IF(LOWER(Basis)="ibnp",'paid claim lag dump'!RC,'reported claim lag dump'!RC) -> 0 | AA8: =IF(LOWER(Basis)="ibnp",'paid claim lag dump'!RC,'reported claim lag dump'!RC) -> 0 | AB8: =IF(LOWER(Basis)="ibnp",'paid claim lag dump'!RC,'reported claim lag dump'!RC) -> 0 | AC8: =IF(LOWER(Basis)="ibnp",'paid claim lag dump'!RC,'reported claim lag dump'!RC) -> 0 | AD8: =IF(LOWER(Basis)="ibnp",'paid claim lag dump'!RC,'reported claim lag dump'!RC) -> 0 | AE8: =IF(LOWER(Basis)="ibnp",'paid claim lag dump'!RC,'reported claim lag dump'!RC) -> 0 | AF8: =IF(LOWER(Basis)="ibnp",'paid claim lag dump'!RC,'reported claim lag dump'!RC) -> 0 | AG8: =IF(LOWER(Basis)="ibnp",'paid claim lag dump'!RC,'reported claim lag dump'!RC) -> 0 | AH8: =IF(LOWER(Basis)="ibnp",'paid claim lag dump'!RC,'reported claim lag dump'!RC) -> 0 | AI8: =IF(LOWER(Basis)="ibnp",'paid claim lag dump'!RC,'reported claim lag dump'!RC) -> 0 | AJ8: =IF(LOWER(Basis)="ibnp",'paid claim lag dump'!RC,'reported claim lag dump'!RC) -> 0 | AK8: =IF(LOWER(Basis)="ibnp",'paid claim lag dump'!RC,'reported claim lag dump'!RC) -> 0 | AL8: =IF(LOWER(Basis)="ibnp",'paid claim lag dump'!RC,'reported claim lag dump'!RC) -> 0
B9: ='general dump'!RC -> 1999-02-01T00:00:00.000 | C9: =IF(LOWER(Basis)="ibnp",'paid claim lag dump'!RC,'reported claim lag dump'!RC) -> 13659 | D9: =IF(LOWER(Basis)="ibnp",'paid claim lag dump'!RC,'reported claim lag dump'!RC) -> 80920 | E9: =IF(LOWER(Basis)="ibnp",'paid claim lag dump'!RC,'reported claim lag dump'!RC) -> 40769 | F9: =IF(LOWER(Basis)="ibnp",'paid claim lag dump'!RC,'reported claim lag dump'!RC) -> 15086 | G9: =IF(LOWER(Basis)="ibnp",'paid claim lag dump'!RC,'reported claim lag dump'!RC) -> 8570 | H9: =IF(LOWER(Basis)="ibnp",'paid claim lag dump'!RC,'reported claim lag dump'!RC) -> 4171 | I9: =IF(LOWER(Basis)="ibnp",'paid claim lag dump'!RC,'reported claim lag dump'!RC) -> 913 | J9: =IF(LOWER(Basis)="ibnp",'paid claim lag dump'!RC,'reported claim lag dump'!RC) -> 593 | K9: =IF(LOWER(Basis)="ibnp",'paid claim lag dump'!RC,'reported claim lag dump'!RC) -> 0 | L9: =IF(LOWER(Basis)="ibnp",'paid claim lag dump'!RC,'reported claim lag dump'!RC) -> 0 | M9: =IF(LOWER(Basis)="ibnp",'paid claim lag dump'!RC,'reported claim lag dump'!RC) -> 0 | N9: =IF(LOWER(Basis)="ibnp",'paid claim lag dump'!RC,'reported claim lag dump'!RC) -> 0 | O9: =IF(LOWER(Basis)="ibnp",'paid claim lag dump'!RC,'reported claim lag dump'!RC) -> 0 | P9: =IF(LOWER(Basis)="ibnp",'paid claim lag dump'!RC,'reported claim lag dump'!RC) -> 0 | Q9: =IF(LOWER(Basis)="ibnp",'paid claim lag dump'!RC,'reported claim lag dump'!RC) -> 0 | R9: =IF(LOWER(Basis)="ibnp",'paid claim lag dump'!RC,'reported claim lag dump'!RC) -> 0 | S9: =IF(LOWER(Basis)="ibnp",'paid claim lag dump'!RC,'reported claim lag dump'!RC) -> 0 | T9: =IF(LOWER(Basis)="ibnp",'paid claim lag dump'!RC,'reported claim lag dump'!RC) -> 0 | U9: =IF(LOWER(Basis)="ibnp",'paid claim lag dump'!RC,'reported claim lag dump'!RC) -> 0 | V9: =IF(LOWER(Basis)="ibnp",'paid claim lag dump'!RC,'reported claim lag dump'!RC) -> 0 | W9: =IF(LOWER(Basis)="ibnp",'paid claim lag dump'!RC,'reported claim lag dump'!RC) -> 0 | X9: =IF(LOWER(Basis)="ibnp",'paid claim lag dump'!RC,'reported claim lag dump'!RC) -> 0 | Y9: =IF(LOWER(Basis)="ibnp",'paid claim lag dump'!RC,'reported claim lag dump'!RC) -> 0 | Z9: =IF(LOWER(Basis)="ibnp",'paid claim lag dump'!RC,'reported claim lag dump'!RC) -> 0 | AA9: =IF(LOWER(Basis)="ibnp",'paid claim lag dump'!RC,'reported claim lag dump'!RC) -> 0 | AB9: =IF(LOWER(Basis)="ibnp",'paid claim lag dump'!RC,'reported claim lag dump'!RC) -> 0 | AC9: =IF(LOWER(Basis)="ibnp",'paid claim lag dump'!RC,'reported claim lag dump'!RC) -> 0 | AD9: =IF(LOWER(Basis)="ibnp",'paid claim lag dump'!RC,'reported claim lag dump'!RC) -> 0 | AE9: =IF(LOWER(Basis)="ibnp",'paid claim lag dump'!RC,'reported claim lag dump'!RC) -> 0 | AF9: =IF(LOWER(Basis)="ibnp",'paid claim lag dump'!RC,'reported claim lag dump'!RC) -> 0 | AG9: =IF(LOWER(Basis)="ibnp",'paid claim lag dump'!RC,'reported claim lag dump'!RC) -> 0 | AH9: =IF(LOWER(Basis)="ibnp",'paid claim lag dump'!RC,'reported claim lag dump'!RC) -> 0 | AI9: =IF(LOWER(Basis)="ibnp",'paid claim lag dump'!RC,'reported claim lag dump'!RC) -> 0 | AJ9: =IF(LOWER(Basis)="ibnp",'paid claim lag dump'!RC,'reported claim lag dump'!RC) -> 0 | AK9: =IF(LOWER(Basis)="ibnp",'paid claim lag dump'!RC,'reported claim lag dump'!RC) -> 0 | AL9: =IF(LOWER(Basis)="ibnp",'paid claim lag dump'!RC,'reported claim lag dump'!RC) -> 0
B10: ='general dump'!RC -> 1999-03-01T00:00:00.000 | C10: =IF(LOWER(Basis)="ibnp",'paid claim lag dump'!RC,'reported claim lag dump'!RC) -> 57935 | D10: =IF(LOWER(Basis)="ibnp",'paid claim lag dump'!RC,'reported claim lag dump'!RC) -> 68120 | E10: =IF(LOWER(Basis)="ibnp",'paid claim lag dump'!RC,'reported claim lag dump'!RC) -> 13660 | F10: =IF(LOWER(Basis)="ibnp",'paid claim lag dump'!RC,'reported claim lag dump'!RC) -> 10719 | G10: =IF(LOWER(Basis)="ibnp",'paid claim lag dump'!RC,'reported claim lag dump'!RC) -> 11697 | H10: =IF(LOWER(Basis)="ibnp",'paid claim lag dump'!RC,'reported claim lag dump'!RC) -> 1703 | I10: =IF(LOWER(Basis)="ibnp",'paid claim lag dump'!RC,'reported claim lag dump'!RC) -> 254 | J10: =IF(LOWER(Basis)="ibnp",'paid claim lag dump'!RC,'reported claim lag dump'!RC) -> 593 | K10: =IF(LOWER(Basis)="ibnp",'paid claim lag dump'!RC,'reported claim lag dump'!RC) -> 0 | L10: =IF(LOWER(Basis)="ibnp",'paid claim lag dump'!RC,'reported claim lag dump'!RC) -> 0 | M10: =IF(LOWER(Basis)="ibnp",'paid claim lag dump'!RC,'reported claim lag dump'!RC) -> 0 | N10: =IF(LOWER(Basis)="ibnp",'paid claim lag dump'!RC,'reported claim lag dump'!RC) -> 0 | O10: =IF(LOWER(Basis)="ibnp",'paid claim lag dump'!RC,'reported claim lag dump'!RC) -> 0 | P10: =IF(LOWER(Basis)="ibnp",'paid claim lag dump'!RC,'reported claim lag dump'!RC) -> 0 | Q10: =IF(LOWER(Basis)="ibnp",'paid claim lag dump'!RC,'reported claim lag dump'!RC) -> 0 | R10: =IF(LOWER(Basis)="ibnp",'paid claim lag dump'!RC,'reported claim lag dump'!RC) -> 0 | S10: =IF(LOWER(Basis)="ibnp",'paid claim lag dump'!RC,'reported claim lag dump'!RC) -> 0 | T10: =IF(LOWER(Basis)="ibnp",'paid claim lag dump'!RC,'reported claim lag dump'!RC) -> 0 | U10: =IF(LOWER(Basis)="ibnp",'paid claim lag dump'!RC,'reported claim lag dump'!RC) -> 0 | V10: =IF(LOWER(Basis)="ibnp",'paid claim lag dump'!RC,'reported claim lag dump'!RC) -> 0 | W10: =IF(LOWER(Basis)="ibnp",'paid claim lag dump'!RC,'reported claim lag dump'!RC) -> 0 | X10: =IF(LOWER(Basis)="ibnp",'paid claim lag dump'!RC,'reported claim lag dump'!RC) -> 0 | Y10: =IF(LOWER(Basis)="ibnp",'paid claim lag dump'!RC,'reported claim lag dump'!RC) -> 0 | Z10: =IF(LOWER(Basis)="ibnp",'paid claim lag dump'!RC,'reported claim lag dump'!RC) -> 0 | AA10: =IF(LOWER(Basis)="ibnp",'paid claim lag dump'!RC,'reported claim lag dump'!RC) -> 0 | AB10: =IF(LOWER(Basis)="ibnp",'paid claim lag dump'!RC,'reported claim lag dump'!RC) -> 0 | AC10: =IF(LOWER(Basis)="ibnp",'paid claim lag dump'!RC,'reported claim lag dump'!RC) -> 0 | AD10: =IF(LOWER(Basis)="ibnp",'paid claim lag dump'!RC,'reported claim lag dump'!RC) -> 0 | AE10: =IF(LOWER(Basis)="ibnp",'paid claim lag dump'!RC,'reported claim lag dump'!RC) -> 0 | AF10: =IF(LOWER(Basis)="ibnp",'paid claim lag dump'!RC,'reported claim lag dump'!RC) -> 0 | AG10: =IF(LOWER(Basis)="ibnp",'paid claim lag dump'!RC,'reported claim lag dump'!RC) -> 0 | AH10: =IF(LOWER(Basis)="ibnp",'paid claim lag dump'!RC,'reported claim lag dump'!RC) -> 0 | AI10: =IF(LOWER(Basis)="ibnp",'paid claim lag dump'!RC,'reported claim lag dump'!RC) -> 0 | AJ10: =IF(LOWER(Basis)="ibnp",'paid claim lag dump'!RC,'reported claim lag dump'!RC) -> 0 | AK10: =IF(LOWER(Basis)="ibnp",'paid claim lag dump'!RC,'reported claim lag dump'!RC) -> 0 | AL10: =IF(LOWER(Basis)="ibnp",'paid claim lag dump'!RC,'reported claim lag dump'!RC) -> 0
B11: ='general dump'!RC -> 1999-04-01T00:00:00.000 | C11: =IF(LOWER(Basis)="ibnp",'paid claim lag dump'!RC,'reported claim lag dump'!RC) -> 16933 | D11: =IF(LOWER(Basis)="ibnp",'paid claim lag dump'!RC,'reported claim lag dump'!RC) -> 64705 | E11: =IF(LOWER(Basis)="ibnp",'paid claim lag dump'!RC,'reported claim lag dump'!RC) -> 35845 | F11: =IF(LOWER(Basis)="ibnp",'paid claim lag dump'!RC,'reported claim lag dump'!RC) -> 36513 | G11: =IF(LOWER(Basis)="ibnp",'paid claim lag dump'!RC,'reported claim lag dump'!RC) -> 13434 | H11: =IF(LOWER(Basis)="ibnp",'paid claim lag dump'!RC,'reported claim lag dump'!RC) -> 1335 | I11: =IF(LOWER(Basis)="ibnp",'paid claim lag dump'!RC,'reported claim lag dump'!RC) -> 1739 | J11: =IF(LOWER(Basis)="ibnp",'paid claim lag dump'!RC,'reported claim lag dump'!RC) -> 150 | K11: =IF(LOWER(Basis)="ibnp",'paid claim lag dump'!RC,'reported claim lag dump'!RC) -> 64 | L11: =IF(LOWER(Basis)="ibnp",'paid claim lag dump'!RC,'reported claim lag dump'!RC) -> 1055 | M11: =IF(LOWER(Basis)="ibnp",'paid claim lag dump'!RC,'reported claim lag dump'!RC) -> 0 | N11: =IF(LOWER(Basis)="ibnp",'paid claim lag dump'!RC,'reported claim lag dump'!RC) -> 0 | O11: =IF(LOWER(Basis)="ibnp",'paid claim lag dump'!RC,'reported claim lag dump'!RC) -> 0 | P11: =IF(LOWER(Basis)="ibnp",'paid claim lag dump'!RC,'reported claim lag dump'!RC) -> 0 | Q11: =IF(LOWER(Basis)="ibnp",'paid claim lag dump'!RC,'reported claim lag dump'!RC) -> 0 | R11: =IF(LOWER(Basis)="ibnp",'paid claim lag dump'!RC,'reported claim lag dump'!RC) -> 0 | S11: =IF(LOWER(Basis)="ibnp",'paid claim lag dump'!RC,'reported claim lag dump'!RC) -> 0 | T11: =IF(LOWER(Basis)="ibnp",'paid claim lag dump'!RC,'reported claim lag dump'!RC) -> 0 | U11: =IF(LOWER(Basis)="ibnp",'paid claim lag dump'!RC,'reported claim lag dump'!RC) -> 0 | V11: =IF(LOWER(Basis)="ibnp",'paid claim lag dump'!RC,'reported claim lag dump'!RC) -> 0 | W11: =IF(LOWER(Basis)="ibnp",'paid claim lag dump'!RC,'reported claim lag dump'!RC) -> 0 | X11: =IF(LOWER(Basis)="ibnp",'paid claim lag dump'!RC,'reported claim lag dump'!RC) -> 0 | Y11: =IF(LOWER(Basis)="ibnp",'paid claim lag dump'!RC,'reported claim lag dump'!RC) -> 0 | Z11: =IF(LOWER(Basis)="ibnp",'paid claim lag dump'!RC,'reported claim lag dump'!RC) -> 0 | AA11: =IF(LOWER(Basis)="ibnp",'paid claim lag dump'!RC,'reported claim lag dump'!RC) -> 0 | AB11: =IF(LOWER(Basis)="ibnp",'paid claim lag dump'!RC,'reported claim lag dump'!RC) -> 0 | AC11: =IF(LOWER(Basis)="ibnp",'paid claim lag dump'!RC,'reported claim lag dump'!RC) -> 0 | AD11: =IF(LOWER(Basis)="ibnp",'paid claim lag dump'!RC,'reported claim lag dump'!RC) -> 0 | AE11: =IF(LOWER(Basis)="ibnp",'paid claim lag dump'!RC,'reported claim lag dump'!RC) -> 0 | AF11: =IF(LOWER(Basis)="ibnp",'paid claim lag dump'!RC,'reported claim lag dump'!RC) -> 0 | AG11: =IF(LOWER(Basis)="ibnp",'paid claim lag dump'!RC,'reported claim lag dump'!RC) -> 0 | AH11: =IF(LOWER(Basis)="ibnp",'paid claim lag dump'!RC,'reported claim lag dump'!RC) -> 0 | AI11: =IF(LOWER(Basis)="ibnp",'paid claim lag dump'!RC,'reported claim lag dump'!RC) -> 0 | AJ11: =IF(LOWER(Basis)="ibnp",'paid claim lag dump'!RC,'reported claim lag dump'!RC) -> 0 | AK11: =IF(LOWER(Basis)="ibnp",'paid claim lag dump'!RC,'reported claim lag dump'!RC) -> 0 | AL11: =IF(LOWER(Basis)="ibnp",'paid claim lag dump'!RC,'reported claim lag dump'!RC) -> 0
B12: ='general dump'!RC -> 1999-05-01T00:00:00.000 | C12: =IF(LOWER(Basis)="ibnp",'paid claim lag dump'!RC,'reported claim lag dump'!RC) -> 36127 | D12: =IF(LOWER(Basis)="ibnp",'paid claim lag dump'!RC,'reported claim lag dump'!RC) -> 62953 | E12: =IF(LOWER(Basis)="ibnp",'paid claim lag dump'!RC,'reported claim lag dump'!RC) -> 22027 | F12: =IF(LOWER(Basis)="ibnp",'paid claim lag dump'!RC,'reported claim lag dump'!RC) -> 34250 | G12: =IF(LOWER(Basis)="ibnp",'paid claim lag dump'!RC,'reported claim lag dump'!RC) -> 12905 | H12: =IF(LOWER(Basis)="ibnp",'paid claim lag dump'!RC,'reported claim lag dump'!RC) -> 1541 | I12: =IF(LOWER(Basis)="ibnp",'paid claim lag dump'!RC,'reported claim lag dump'!RC) -> 701 | J12: =IF(LOWER(Basis)="ibnp",'paid claim lag dump'!RC,'reported claim lag dump'!RC) -> 150 | K12: =IF(LOWER(Basis)="ibnp",'paid claim lag dump'!RC,'reported claim lag dump'!RC) -> 64 | L12: =IF(LOWER(Basis)="ibnp",'paid claim lag dump'!RC,'reported claim lag dump'!RC) -> 1055 | M12: =IF(LOWER(Basis)="ibnp",'paid claim lag dump'!RC,'reported claim lag dump'!RC) -> 0 | N12: =IF(LOWER(Basis)="ibnp",'paid claim lag dump'!RC,'reported claim lag dump'!RC) -> 0 | O12: =IF(LOWER(Basis)="ibnp",'paid claim lag dump'!RC,'reported claim lag dump'!RC) -> 0 | P12: =IF(LOWER(Basis)="ibnp",'paid claim lag dump'!RC,'reported claim lag dump'!RC) -> 0 | Q12: =IF(LOWER(Basis)="ibnp",'paid claim lag dump'!RC,'reported claim lag dump'!RC) -> 0 | R12: =IF(LOWER(Basis)="ibnp",'paid claim lag dump'!RC,'reported claim lag dump'!RC) -> 0 | S12: =IF(LOWER(Basis)="ibnp",'paid claim lag dump'!RC,'reported claim lag dump'!RC) -> 0 | T12: =IF(LOWER(Basis)="ibnp",'paid claim lag dump'!RC,'reported claim lag dump'!RC) -> 0 | U12: =IF(LOWER(Basis)="ibnp",'paid claim lag dump'!RC,'reported claim lag dump'!RC) -> 0 | V12: =IF(LOWER(Basis)="ibnp",'paid claim lag dump'!RC,'reported claim lag dump'!RC) -> 0 | W12: =IF(LOWER(Basis)="ibnp",'paid claim lag dump'!RC,'reported claim lag dump'!RC) -> 0 | X12: =IF(LOWER(Basis)="ibnp",'paid claim lag dump'!RC,'reported claim lag dump'!RC) -> 0 | Y12: =IF(LOWER(Basis)="ibnp",'paid claim lag dump'!RC,'reported claim lag dump'!RC) -> 0 | Z12: =IF(LOWER(Basis)="ibnp",'paid claim lag dump'!RC,'reported claim lag dump'!RC) -> 0 | AA12: =IF(LOWER(Basis)="ibnp",'paid claim lag dump'!RC,'reported claim lag dump'!RC) -> 0 | AB12: =IF(LOWER(Basis)="ibnp",'paid claim lag dump'!RC,'reported claim lag dump'!RC) -> 0 | AC12: =IF(LOWER(Basis)="ibnp",'paid claim lag dump'!RC,'reported claim lag dump'!RC) -> 0 | AD12: =IF(LOWER(Basis)="ibnp",'paid claim lag dump'!RC,'reported claim lag dump'!RC) -> 0 | AE12: =IF(LOWER(Basis)="ibnp",'paid claim lag dump'!RC,'reported claim lag dump'!RC) -> 0 | AF12: =IF(LOWER(Basis)="ibnp",'paid claim lag dump'!RC,'reported claim lag dump'!RC) -> 0 | AG12: =IF(LOWER(Basis)="ibnp",'paid claim lag dump'!RC,'reported claim lag dump'!RC) -> 0 | AH12: =IF(LOWER(Basis)="ibnp",'paid claim lag dump'!RC,'reported claim lag dump'!RC) -> 0 | AI12: =IF(LOWER(Basis)="ibnp",'paid claim lag dump'!RC,'reported claim lag dump'!RC) -> 0 | AJ12: =IF(LOWER(Basis)="ibnp",'paid claim lag dump'!RC,'reported claim lag dump'!RC) -> 0 | AK12: =IF(LOWER(Basis)="ibnp",'paid claim lag dump'!RC,'reported claim lag dump'!RC) -> 0 | AL12: =IF(LOWER(Basis)="ibnp",'paid claim lag dump'!RC,'reported claim lag dump'!RC) -> 0
B13: ='general dump'!RC -> 1999-06-01T00:00:00.000 | C13: =IF(LOWER(Basis)="ibnp",'paid claim lag dump'!RC,'reported claim lag dump'!RC) -> 16631 | D13: =IF(LOWER(Basis)="ibnp",'paid claim lag dump'!RC,'reported claim lag dump'!RC) -> 145028 | E13: =IF(LOWER(Basis)="ibnp",'paid claim lag dump'!RC,'reported claim lag dump'!RC) -> 48307 | F13: =IF(LOWER(Basis)="ibnp",'paid claim lag dump'!RC,'reported claim lag dump'!RC) -> 6744 | G13: =IF(LOWER(Basis)="ibnp",'paid claim lag dump'!RC,'reported claim lag dump'!RC) -> 43499 | H13: =IF(LOWER(Basis)="ibnp",'paid claim lag dump'!RC,'reported claim lag dump'!RC) -> 10999 | I13: =IF(LOWER(Basis)="ibnp",'paid claim lag dump'!RC,'reported claim lag dump'!RC) -> 6831 | J13: =IF(LOWER(Basis)="ibnp",'paid claim lag dump'!RC,'reported claim lag dump'!RC) -> 14862 | K13: =IF(LOWER(Basis)="ibnp",'paid claim lag dump'!RC,'reported claim lag dump'!RC) -> 638 | L13: =IF(LOWER(Basis)="ibnp",'paid claim lag dump'!RC,'reported claim lag dump'!RC) -> 86 | M13: =IF(LOWER(Basis)="ibnp",'paid claim lag dump'!RC,'reported claim lag dump'!RC) -> 0 | N13: =IF(LOWER(Basis)="ibnp",'paid claim lag dump'!RC,'reported claim lag dump'!RC) -> 420 | O13: =IF(LOWER(Basis)="ibnp",'paid claim lag dump'!RC,'reported claim lag dump'!RC) -> 0 | P13: =IF(LOWER(Basis)="ibnp",'paid claim lag dump'!RC,'reported claim lag dump'!RC) -> 0 | Q13: =IF(LOWER(Basis)="ibnp",'paid claim lag dump'!RC,'reported claim lag dump'!RC) -> 0 | R13: =IF(LOWER(Basis)="ibnp",'paid claim lag dump'!RC,'reported claim lag dump'!RC) -> 0 | S13: =IF(LOWER(Basis)="ibnp",'paid claim lag dump'!RC,'reported claim lag dump'!RC) -> 0 | T13: =IF(LOWER(Basis)="ibnp",'paid claim lag dump'!RC,'reported claim lag dump'!RC) -> 0 | U13: =IF(LOWER(Basis)="ibnp",'paid claim lag dump'!RC,'reported claim lag dump'!RC) -> 0 | V13: =IF(LOWER(Basis)="ibnp",'paid claim lag dump'!RC,'reported claim lag dump'!RC) -> 0 | W13: =IF(LOWER(Basis)="ibnp",'paid claim lag dump'!RC,'reported claim lag dump'!RC) -> 0 | X13: =IF(LOWER(Basis)="ibnp",'paid claim lag dump'!RC,'reported claim lag dump'!RC) -> 0 | Y13: =IF(LOWER(Basis)="ibnp",'paid claim lag dump'!RC,'reported claim lag dump'!RC) -> 0 | Z13: =IF(LOWER(Basis)="ibnp",'paid claim lag dump'!RC,'reported claim lag dump'!RC) -> 0 | AA13: =IF(LOWER(Basis)="ibnp",'paid claim lag dump'!RC,'reported claim lag dump'!RC) -> 0 | AB13: =IF(LOWER(Basis)="ibnp",'paid claim lag dump'!RC,'reported claim lag dump'!RC) -> 0 | AC13: =IF(LOWER(Basis)="ibnp",'paid claim lag dump'!RC,'reported claim lag dump'!RC) -> 0 | AD13: =IF(LOWER(Basis)="ibnp",'paid claim lag dump'!RC,'reported claim lag dump'!RC) -> 0 | AE13: =IF(LOWER(Basis)="ibnp",'paid claim lag dump'!RC,'reported claim lag dump'!RC) -> 0 | AF13: =IF(LOWER(Basis)="ibnp",'paid claim lag dump'!RC,'reported claim lag dump'!RC) -> 0 | AG13: =IF(LOWER(Basis)="ibnp",'paid claim lag dump'!RC,'reported claim lag dump'!RC) -> 0 | AH13: =IF(LOWER(Basis)="ibnp",'paid claim lag dump'!RC,'reported claim lag dump'!RC) -> 0 | AI13: =IF(LOWER(Basis)="ibnp",'paid claim lag dump'!RC,'reported claim lag dump'!RC) -> 0 | AJ13: =IF(LOWER(Basis)="ibnp",'paid claim lag dump'!RC,'reported claim lag dump'!RC) -> 0 | AK13: =IF(LOWER(Basis)="ibnp",'paid claim lag dump'!RC,'reported claim lag dump'!RC) -> 0 | AL13: =IF(LOWER(Basis)="ibnp",'paid claim lag dump'!RC,'reported claim lag dump'!RC) -> 0
B14: ='general dump'!RC -> 1999-07-01T00:00:00.000 | C14: =IF(LOWER(Basis)="ibnp",'paid claim lag dump'!RC,'reported claim lag dump'!RC) -> 98502 | D14: =IF(LOWER(Basis)="ibnp",'paid claim lag dump'!RC,'reported claim lag dump'!RC) -> 96530 | E14: =IF(LOWER(Basis)="ibnp",'paid claim lag dump'!RC,'reported claim lag dump'!RC) -> 25198 | F14: =IF(LOWER(Basis)="ibnp",'paid claim lag dump'!RC,'reported claim lag dump'!RC) -> 25454 | G14: =IF(LOWER(Basis)="ibnp",'paid claim lag dump'!RC,'reported claim lag dump'!RC) -> 21540 | H14: =IF(LOWER(Basis)="ibnp",'paid claim lag dump'!RC,'reported claim lag dump'!RC) -> 10627 | I14: =IF(LOWER(Basis)="ibnp",'paid claim lag dump'!RC,'reported claim lag dump'!RC) -> 188 | J14: =IF(LOWER(Basis)="ibnp",'paid claim lag dump'!RC,'reported claim lag dump'!RC) -> 14862 | K14: =IF(LOWER(Basis)="ibnp",'paid claim lag dump'!RC,'reported claim lag dump'!RC) -> 711 | L14: =IF(LOWER(Basis)="ibnp",'paid claim lag dump'!RC,'reported claim lag dump'!RC) -> 13 | M14: =IF(LOWER(Basis)="ibnp",'paid claim lag dump'!RC,'reported claim lag dump'!RC) -> 420 | N14: =IF(LOWER(Basis)="ibnp",'paid claim lag dump'!RC,'reported claim lag dump'!RC) -> 0 | O14: =IF(LOWER(Basis)="ibnp",'paid claim lag dump'!RC,'reported claim lag dump'!RC) -> 0 | P14: =IF(LOWER(Basis)="ibnp",'paid claim lag dump'!RC,'reported claim lag dump'!RC) -> 0 | Q14: =IF(LOWER(Basis)="ibnp",'paid claim lag dump'!RC,'reported claim lag dump'!RC) -> 0 | R14: =IF(LOWER(Basis)="ibnp",'paid claim lag dump'!RC,'reported claim lag dump'!RC) -> 0 | S14: =IF(LOWER(Basis)="ibnp",'paid claim lag dump'!RC,'reported claim lag dump'!RC) -> 0 | T14: =IF(LOWER(Basis)="ibnp",'paid claim lag dump'!RC,'reported claim lag dump'!RC) -> 0 | U14: =IF(LOWER(Basis)="ibnp",'paid claim lag dump'!RC,'reported claim lag dump'!RC) -> 0 | V14: =IF(LOWER(Basis)="ibnp",'paid claim lag dump'!RC,'reported claim lag dump'!RC) -> 0 | W14: =IF(LOWER(Basis)="ibnp",'paid claim lag dump'!RC,'reported claim lag dump'!RC) -> 0 | X14: =IF(LOWER(Basis)="ibnp",'paid claim lag dump'!RC,'reported claim lag dump'!RC) -> 0 | Y14: =IF(LOWER(Basis)="ibnp",'paid claim lag dump'!RC,'reported claim lag dump'!RC) -> 0 | Z14: =IF(LOWER(Basis)="ibnp",'paid claim lag dump'!RC,'reported claim lag dump'!RC) -> 0 | AA14: =IF(LOWER(Basis)="ibnp",'paid claim lag dump'!RC,'reported claim lag dump'!RC) -> 0 | AB14: =IF(LOWER(Basis)="ibnp",'paid claim lag dump'!RC,'reported claim lag dump'!RC) -> 0 | AC14: =IF(LOWER(Basis)="ibnp",'paid claim lag dump'!RC,'reported claim lag dump'!RC) -> 0 | AD14: =IF(LOWER(Basis)="ibnp",'paid claim lag dump'!RC,'reported claim lag dump'!RC) -> 0 | AE14: =IF(LOWER(Basis)="ibnp",'paid claim lag dump'!RC,'reported claim lag dump'!RC) -> 0 | AF14: =IF(LOWER(Basis)="ibnp",'paid claim lag dump'!RC,'reported claim lag dump'!RC) -> 0 | AG14: =IF(LOWER(Basis)="ibnp",'paid claim lag dump'!RC,'reported claim lag dump'!RC) -> 0 | AH14: =IF(LOWER(Basis)="ibnp",'paid claim lag dump'!RC,'reported claim lag dump'!RC) -> 0 | AI14: =IF(LOWER(Basis)="ibnp",'paid claim lag dump'!RC,'reported claim lag dump'!RC) -> 0 | AJ14: =IF(LOWER(Basis)="ibnp",'paid claim lag dump'!RC,'reported claim lag dump'!RC) -> 0 | AK14: =IF(LOWER(Basis)="ibnp",'paid claim lag dump'!RC,'reported claim lag dump'!RC) -> 0 | AL14: =IF(LOWER(Basis)="ibnp",'paid claim lag dump'!RC,'reported claim lag dump'!RC) -> 0
B15: ='general dump'!RC -> 1999-08-01T00:00:00.000 | C15: =IF(LOWER(Basis)="ibnp",'paid claim lag dump'!RC,'reported claim lag dump'!RC) -> 8178 | D15: =IF(LOWER(Basis)="ibnp",'paid claim lag dump'!RC,'reported claim lag dump'!RC) -> 50538 | E15: =IF(LOWER(Basis)="ibnp",'paid claim lag dump'!RC,'reported claim lag dump'!RC) -> 21390 | F15: =IF(LOWER(Basis)="ibnp",'paid claim lag dump'!RC,'reported claim lag dump'!RC) -> 25812 | G15: =IF(LOWER(Basis)="ibnp",'paid claim lag dump'!RC,'reported claim lag dump'!RC) -> 3445 | H15: =IF(LOWER(Basis)="ibnp",'paid claim lag dump'!RC,'reported claim lag dump'!RC) -> -482 | I15: =IF(LOWER(Basis)="ibnp",'paid claim lag dump'!RC,'reported claim lag dump'!RC) -> 1182 | J15: =IF(LOWER(Basis)="ibnp",'paid claim lag dump'!RC,'reported claim lag dump'!RC) -> 512 | K15: =IF(LOWER(Basis)="ibnp",'paid claim lag dump'!RC,'reported claim lag dump'!RC) -> 61 | L15: =IF(LOWER(Basis)="ibnp",'paid claim lag dump'!RC,'reported claim lag dump'!RC) -> -300 | M15: =IF(LOWER(Basis)="ibnp",'paid claim lag dump'!RC,'reported claim lag dump'!RC) -> 0 | N15: =IF(LOWER(Basis)="ibnp",'paid claim lag dump'!RC,'reported claim lag dump'!RC) -> 454 | O15: =IF(LOWER(Basis)="ibnp",'paid claim lag dump'!RC,'reported claim lag dump'!RC) -> 286 | P15: =IF(LOWER(Basis)="ibnp",'paid claim lag dump'!RC,'reported claim lag dump'!RC) -> 0 | Q15: =IF(LOWER(Basis)="ibnp",'paid claim lag dump'!RC,'reported claim lag dump'!RC) -> 0 | R15: =IF(LOWER(Basis)="ibnp",'paid claim lag dump'!RC,'reported claim lag dump'!RC) -> 0 | S15: =IF(LOWER(Basis)="ibnp",'paid claim lag dump'!RC,'reported claim lag dump'!RC) -> 0 | T15: =IF(LOWER(Basis)="ibnp",'paid claim lag dump'!RC,'reported claim lag dump'!RC) -> 0 | U15: =IF(LOWER(Basis)="ibnp",'paid claim lag dump'!RC,'reported claim lag dump'!RC) -> 0 | V15: =IF(LOWER(Basis)="ibnp",'paid claim lag dump'!RC,'reported claim lag dump'!RC) -> 0 | W15: =IF(LOWER(Basis)="ibnp",'paid claim lag dump'!RC,'reported claim lag dump'!RC) -> 0 | X15: =IF(LOWER(Basis)="ibnp",'paid claim lag dump'!RC,'reported claim lag dump'!RC) -> 0 | Y15: =IF(LOWER(Basis)="ibnp",'paid claim lag dump'!RC,'reported claim lag dump'!RC) -> 0 | Z15: =IF(LOWER(Basis)="ibnp",'paid claim lag dump'!RC,'reported claim lag dump'!RC) -> 0 | AA15: =IF(LOWER(Basis)="ibnp",'paid claim lag dump'!RC,'reported claim lag dump'!RC) -> 0 | AB15: =IF(LOWER(Basis)="ibnp",'paid claim lag dump'!RC,'reported claim lag dump'!RC) -> 0 | AC15: =IF(LOWER(Basis)="ibnp",'paid claim lag dump'!RC,'reported claim lag dump'!RC) -> 0 | AD15: =IF(LOWER(Basis)="ibnp",'paid claim lag dump'!RC,'reported claim lag dump'!RC) -> 0 | AE15: =IF(LOWER(Basis)="ibnp",'paid claim lag dump'!RC,'reported claim lag dump'!RC) -> 0 | AF15: =IF(LOWER(Basis)="ibnp",'paid claim lag dump'!RC,'reported claim lag dump'!RC) -> 0 | AG15: =IF(LOWER(Basis)="ibnp",'paid claim lag dump'!RC,'reported claim lag dump'!RC) -> 0 | AH15: =IF(LOWER(Basis)="ibnp",'paid claim lag dump'!RC,'reported claim lag dump'!RC) -> 0 | AI15: =IF(LOWER(Basis)="ibnp",'paid claim lag dump'!RC,'reported claim lag dump'!RC) -> 0 | AJ15: =IF(LOWER(Basis)="ibnp",'paid claim lag dump'!RC,'reported claim lag dump'!RC) -> 0 | AK15: =IF(LOWER(Basis)="ibnp",'paid claim lag dump'!RC,'reported claim lag dump'!RC) -> 0 | AL15: =IF(LOWER(Basis)="ibnp",'paid claim lag dump'!RC,'reported claim lag dump'!RC) -> 0
B16: ='general dump'!RC -> 1999-09-01T00:00:00.000 | C16: =IF(LOWER(Basis)="ibnp",'paid claim lag dump'!RC,'reported claim lag dump'!RC) -> 22133 | D16: =IF(LOWER(Basis)="ibnp",'paid claim lag dump'!RC,'reported claim lag dump'!RC) -> 43202 | E16: =IF(LOWER(Basis)="ibnp",'paid claim lag dump'!RC,'reported claim lag dump'!RC) -> 19233 | F16: =IF(LOWER(Basis)="ibnp",'paid claim lag dump'!RC,'reported claim lag dump'!RC) -> 23721 | G16: =IF(LOWER(Basis)="ibnp",'paid claim lag dump'!RC,'reported claim lag dump'!RC) -> 1187 | H16: =IF(LOWER(Basis)="ibnp",'paid claim lag dump'!RC,'reported claim lag dump'!RC) -> -269 | I16: =IF(LOWER(Basis)="ibnp",'paid claim lag dump'!RC,'reported claim lag dump'!RC) -> 856 | J16: =IF(LOWER(Basis)="ibnp",'paid claim lag dump'!RC,'reported claim lag dump'!RC) -> 553 | K16: =IF(LOWER(Basis)="ibnp",'paid claim lag dump'!RC,'reported claim lag dump'!RC) -> 20 | L16: =IF(LOWER(Basis)="ibnp",'paid claim lag dump'!RC,'reported claim lag dump'!RC) -> -300 | M16: =IF(LOWER(Basis)="ibnp",'paid claim lag dump'!RC,'reported claim lag dump'!RC) -> 374 | N16: =IF(LOWER(Basis)="ibnp",'paid claim lag dump'!RC,'reported claim lag dump'!RC) -> 80 | O16: =IF(LOWER(Basis)="ibnp",'paid claim lag dump'!RC,'reported claim lag dump'!RC) -> 286 | P16: =IF(LOWER(Basis)="ibnp",'paid claim lag dump'!RC,'reported claim lag dump'!RC) -> 0 | Q16: =IF(LOWER(Basis)="ibnp",'paid claim lag dump'!RC,'reported claim lag dump'!RC) -> 0 | R16: =IF(LOWER(Basis)="ibnp",'paid claim lag dump'!RC,'reported claim lag dump'!RC) -> 0 | S16: =IF(LOWER(Basis)="ibnp",'paid claim lag dump'!RC,'reported claim lag dump'!RC) -> 0 | T16: =IF(LOWER(Basis)="ibnp",'paid claim lag dump'!RC,'reported claim lag dump'!RC) -> 0 | U16: =IF(LOWER(Basis)="ibnp",'paid claim lag dump'!RC,'reported claim lag dump'!RC) -> 0 | V16: =IF(LOWER(Basis)="ibnp",'paid claim lag dump'!RC,'reported claim lag dump'!RC) -> 0 | W16: =IF(LOWER(Basis)="ibnp",'paid claim lag dump'!RC,'reported claim lag dump'!RC) -> 0 | X16: =IF(LOWER(Basis)="ibnp",'paid claim lag dump'!RC,'reported claim lag dump'!RC) -> 0 | Y16: =IF(LOWER(Basis)="ibnp",'paid claim lag dump'!RC,'reported claim lag dump'!RC) -> 0 | Z16: =IF(LOWER(Basis)="ibnp",'paid claim lag dump'!RC,'reported claim lag dump'!RC) -> 0 | AA16: =IF(LOWER(Basis)="ibnp",'paid claim lag dump'!RC,'reported claim lag dump'!RC) -> 0 | AB16: =IF(LOWER(Basis)="ibnp",'paid claim lag dump'!RC,'reported claim lag dump'!RC) -> 0 | AC16: =IF(LOWER(Basis)="ibnp",'paid claim lag dump'!RC,'reported claim lag dump'!RC) -> 0 | AD16: =IF(LOWER(Basis)="ibnp",'paid claim lag dump'!RC,'reported claim lag dump'!RC) -> 0 | AE16: =IF(LOWER(Basis)="ibnp",'paid claim lag dump'!RC,'reported claim lag dump'!RC) -> 0 | AF16: =IF(LOWER(Basis)="ibnp",'paid claim lag dump'!RC,'reported claim lag dump'!RC) -> 0 | AG16: =IF(LOWER(Basis)="ibnp",'paid claim lag dump'!RC,'reported claim lag dump'!RC) -> 0 | AH16: =IF(LOWER(Basis)="ibnp",'paid claim lag dump'!RC,'reported claim lag dump'!RC) -> 0 | AI16: =IF(LOWER(Basis)="ibnp",'paid claim lag dump'!RC,'reported claim lag dump'!RC) -> 0 | AJ16: =IF(LOWER(Basis)="ibnp",'paid claim lag dump'!RC,'reported claim lag dump'!RC) -> 0 | AK16: =IF(LOWER(Basis)="ibnp",'paid claim lag dump'!RC,'reported claim lag dump'!RC) -> 0 | AL16: =IF(LOWER(Basis)="ibnp",'paid claim lag dump'!RC,'reported claim lag dump'!RC) -> 0
B17: ='general dump'!RC -> 1999-10-01T00:00:00.000 | C17: =IF(LOWER(Basis)="ibnp",'paid claim lag dump'!RC,'reported claim lag dump'!RC) -> 8887 | D17: =IF(LOWER(Basis)="ibnp",'paid claim lag dump'!RC,'reported claim lag dump'!RC) -> 57900 | E17: =IF(LOWER(Basis)="ibnp",'paid claim lag dump'!RC,'reported claim lag dump'!RC) -> 69592 | F17: =IF(LOWER(Basis)="ibnp",'paid claim lag dump'!RC,'reported claim lag dump'!RC) -> 13073 | G17: =IF(LOWER(Basis)="ibnp",'paid claim lag dump'!RC,'reported claim lag dump'!RC) -> 3966 | H17: =IF(LOWER(Basis)="ibnp",'paid claim lag dump'!RC,'reported claim lag dump'!RC) -> 7382 | I17: =IF(LOWER(Basis)="ibnp",'paid claim lag dump'!RC,'reported claim lag dump'!RC) -> 990 | J17: =IF(LOWER(Basis)="ibnp",'paid claim lag dump'!RC,'reported claim lag dump'!RC) -> 1455 | K17: =IF(LOWER(Basis)="ibnp",'paid claim lag dump'!RC,'reported claim lag dump'!RC) -> 1212 | L17: =IF(LOWER(Basis)="ibnp",'paid claim lag dump'!RC,'reported claim lag dump'!RC) -> 252 | M17: =IF(LOWER(Basis)="ibnp",'paid claim lag dump'!RC,'reported claim lag dump'!RC) -> -208 | N17: =IF(LOWER(Basis)="ibnp",'paid claim lag dump'!RC,'reported claim lag dump'!RC) -> 4466 | O17: =IF(LOWER(Basis)="ibnp",'paid claim lag dump'!RC,'reported claim lag dump'!RC) -> 924 | P17: =IF(LOWER(Basis)="ibnp",'paid claim lag dump'!RC,'reported claim lag dump'!RC) -> 85 | Q17: =IF(LOWER(Basis)="ibnp",'paid claim lag dump'!RC,'reported claim lag dump'!RC) -> 1460 | R17: =IF(LOWER(Basis)="ibnp",'paid claim lag dump'!RC,'reported claim lag dump'!RC) -> 0 | S17: =IF(LOWER(Basis)="ibnp",'paid claim lag dump'!RC,'reported claim lag dump'!RC) -> 0 | T17: =IF(LOWER(Basis)="ibnp",'paid claim lag dump'!RC,'reported claim lag dump'!RC) -> 0 | U17: =IF(LOWER(Basis)="ibnp",'paid claim lag dump'!RC,'reported claim lag dump'!RC) -> 0 | V17: =IF(LOWER(Basis)="ibnp",'paid claim lag dump'!RC,'reported claim lag dump'!RC) -> 0 | W17: =IF(LOWER(Basis)="ibnp",'paid claim lag dump'!RC,'reported claim lag dump'!RC) -> 0 | X17: =IF(LOWER(Basis)="ibnp",'paid claim lag dump'!RC,'reported claim lag dump'!RC) -> 0 | Y17: =IF(LOWER(Basis)="ibnp",'paid claim lag dump'!RC,'reported claim lag dump'!RC) -> 0 | Z17: =IF(LOWER(Basis)="ibnp",'paid claim lag dump'!RC,'reported claim lag dump'!RC) -> 0 | AA17: =IF(LOWER(Basis)="ibnp",'paid claim lag dump'!RC,'reported claim lag dump'!RC) -> 0 | AB17: =IF(LOWER(Basis)="ibnp",'paid claim lag dump'!RC,'reported claim lag dump'!RC) -> 0 | AC17: =IF(LOWER(Basis)="ibnp",'paid claim lag dump'!RC,'reported claim lag dump'!RC) -> 0 | AD17: =IF(LOWER(Basis)="ibnp",'paid claim lag dump'!RC,'reported claim lag dump'!RC) -> 0 | AE17: =IF(LOWER(Basis)="ibnp",'paid claim lag dump'!RC,'reported claim lag dump'!RC) -> 0 | AF17: =IF(LOWER(Basis)="ibnp",'paid claim lag dump'!RC,'reported claim lag dump'!RC) -> 0 | AG17: =IF(LOWER(Basis)="ibnp",'paid claim lag dump'!RC,'reported claim lag dump'!RC) -> 0 | AH17: =IF(LOWER(Basis)="ibnp",'paid claim lag dump'!RC,'reported claim lag dump'!RC) -> 0 | AI17: =IF(LOWER(Basis)="ibnp",'paid claim lag dump'!RC,'reported claim lag dump'!RC) -> 0 | AJ17: =IF(LOWER(Basis)="ibnp",'paid claim lag dump'!RC,'reported claim lag dump'!RC) -> 0 | AK17: =IF(LOWER(Basis)="ibnp",'paid claim lag dump'!RC,'reported claim lag dump'!RC) -> 0 | AL17: =IF(LOWER(Basis)="ibnp",'paid claim lag dump'!RC,'reported claim lag dump'!RC) -> 0
B18: ='general dump'!RC -> 1999-11-01T00:00:00.000 | C18: =IF(LOWER(Basis)="ibnp",'paid claim lag dump'!RC,'reported claim lag dump'!RC) -> 31566 | D18: =IF(LOWER(Basis)="ibnp",'paid claim lag dump'!RC,'reported claim lag dump'!RC) -> 83114 | E18: =IF(LOWER(Basis)="ibnp",'paid claim lag dump'!RC,'reported claim lag dump'!RC) -> 23227 | F18: =IF(LOWER(Basis)="ibnp",'paid claim lag dump'!RC,'reported claim lag dump'!RC) -> 13635 | G18: =IF(LOWER(Basis)="ibnp",'paid claim lag dump'!RC,'reported claim lag dump'!RC) -> 5991 | H18: =IF(LOWER(Basis)="ibnp",'paid claim lag dump'!RC,'reported claim lag dump'!RC) -> 3977 | I18: =IF(LOWER(Basis)="ibnp",'paid claim lag dump'!RC,'reported claim lag dump'!RC) -> 323 | J18: =IF(LOWER(Basis)="ibnp",'paid claim lag dump'!RC,'reported claim lag dump'!RC) -> 1412 | K18: =IF(LOWER(Basis)="ibnp",'paid claim lag dump'!RC,'reported claim lag dump'!RC) -> 1242 | L18: =IF(LOWER(Basis)="ibnp",'paid claim lag dump'!RC,'reported claim lag dump'!RC) -> 450 | M18: =IF(LOWER(Basis)="ibnp",'paid claim lag dump'!RC,'reported claim lag dump'!RC) -> -376 | N18: =IF(LOWER(Basis)="ibnp",'paid claim lag dump'!RC,'reported claim lag dump'!RC) -> 4430 | O18: =IF(LOWER(Basis)="ibnp",'paid claim lag dump'!RC,'reported claim lag dump'!RC) -> 900 | P18: =IF(LOWER(Basis)="ibnp",'paid claim lag dump'!RC,'reported claim lag dump'!RC) -> 85 | Q18: =IF(LOWER(Basis)="ibnp",'paid claim lag dump'!RC,'reported claim lag dump'!RC) -> 1460 | R18: =IF(LOWER(Basis)="ibnp",'paid claim lag dump'!RC,'reported claim lag dump'!RC) -> 0 | S18: =IF(LOWER(Basis)="ibnp",'paid claim lag dump'!RC,'reported claim lag dump'!RC) -> 0 | T18: =IF(LOWER(Basis)="ibnp",'paid claim lag dump'!RC,'reported claim lag dump'!RC) -> 0 | U18: =IF(LOWER(Basis)="ibnp",'paid claim lag dump'!RC,'reported claim lag dump'!RC) -> 0 | V18: =IF(LOWER(Basis)="ibnp",'paid claim lag dump'!RC,'reported claim lag dump'!RC) -> 0 | W18: =IF(LOWER(Basis)="ibnp",'paid claim lag dump'!RC,'reported claim lag dump'!RC) -> 0 | X18: =IF(LOWER(Basis)="ibnp",'paid claim lag dump'!RC,'reported claim lag dump'!RC) -> 0 | Y18: =IF(LOWER(Basis)="ibnp",'paid claim lag dump'!RC,'reported claim lag dump'!RC) -> 0 | Z18: =IF(LOWER(Basis)="ibnp",'paid claim lag dump'!RC,'reported claim lag dump'!RC) -> 0 | AA18: =IF(LOWER(Basis)="ibnp",'paid claim lag dump'!RC,'reported claim lag dump'!RC) -> 0 | AB18: =IF(LOWER(Basis)="ibnp",'paid claim lag dump'!RC,'reported claim lag dump'!RC) -> 0 | AC18: =IF(LOWER(Basis)="ibnp",'paid claim lag dump'!RC,'reported claim lag dump'!RC) -> 0 | AD18: =IF(LOWER(Basis)="ibnp",'paid claim lag dump'!RC,'reported claim lag dump'!RC) -> 0 | AE18: =IF(LOWER(Basis)="ibnp",'paid claim lag dump'!RC,'reported claim lag dump'!RC) -> 0 | AF18: =IF(LOWER(Basis)="ibnp",'paid claim lag dump'!RC,'reported claim lag dump'!RC) -> 0 | AG18: =IF(LOWER(Basis)="ibnp",'paid claim lag dump'!RC,'reported claim lag dump'!RC) -> 0 | AH18: =IF(LOWER(Basis)="ibnp",'paid claim lag dump'!RC,'reported claim lag dump'!RC) -> 0 | AI18: =IF(LOWER(Basis)="ibnp",'paid claim lag dump'!RC,'reported claim lag dump'!RC) -> 0 | AJ18: =IF(LOWER(Basis)="ibnp",'paid claim lag dump'!RC,'reported claim lag dump'!RC) -> 0 | AK18: =IF(LOWER(Basis)="ibnp",'paid claim lag dump'!RC,'reported claim lag dump'!RC) -> 0 | AL18: =IF(LOWER(Basis)="ibnp",'paid claim lag dump'!RC,'reported claim lag dump'!RC) -> 0
B19: ='general dump'!RC -> 1999-12-01T00:00:00.000 | C19: =IF(LOWER(Basis)="ibnp",'paid claim lag dump'!RC,'reported claim lag dump'!RC) -> 1321 | D19: =IF(LOWER(Basis)="ibnp",'paid claim lag dump'!RC,'reported claim lag dump'!RC) -> 33300 | E19: =IF(LOWER(Basis)="ibnp",'paid claim lag dump'!RC,'reported claim lag dump'!RC) -> 30097 | F19: =IF(LOWER(Basis)="ibnp",'paid claim lag dump'!RC,'reported claim lag dump'!RC) -> 27921 | G19: =IF(LOWER(Basis)="ibnp",'paid claim lag dump'!RC,'reported claim lag dump'!RC) -> 5276 | H19: =IF(LOWER(Basis)="ibnp",'paid claim lag dump'!RC,'reported claim lag dump'!RC) -> 1752 | I19: =IF(LOWER(Basis)="ibnp",'paid claim lag dump'!RC,'reported claim lag dump'!RC) -> 9245 | J19: =IF(LOWER(Basis)="ibnp",'paid claim lag dump'!RC,'reported claim lag dump'!RC) -> 117 | K19: =IF(LOWER(Basis)="ibnp",'paid claim lag dump'!RC,'reported claim lag dump'!RC) -> 216 | L19: =IF(LOWER(Basis)="ibnp",'paid claim lag dump'!RC,'reported claim lag dump'!RC) -> 314 | M19: =IF(LOWER(Basis)="ibnp",'paid claim lag dump'!RC,'reported claim lag dump'!RC) -> 204 | N19: =IF(LOWER(Basis)="ibnp",'paid claim lag dump'!RC,'reported claim lag dump'!RC) -> 442 | O19: =IF(LOWER(Basis)="ibnp",'paid claim lag dump'!RC,'reported claim lag dump'!RC) -> 561 | P19: =IF(LOWER(Basis)="ibnp",'paid claim lag dump'!RC,'reported claim lag dump'!RC) -> 179 | Q19: =IF(LOWER(Basis)="ibnp",'paid claim lag dump'!RC,'reported claim lag dump'!RC) -> 17 | R19: =IF(LOWER(Basis)="ibnp",'paid claim lag dump'!RC,'reported claim lag dump'!RC) -> 273 | S19: =IF(LOWER(Basis)="ibnp",'paid claim lag dump'!RC,'reported claim lag dump'!RC) -> 135 | T19: =IF(LOWER(Basis)="ibnp",'paid claim lag dump'!RC,'reported claim lag dump'!RC) -> 168 | U19: =IF(LOWER(Basis)="ibnp",'paid claim lag dump'!RC,'reported claim lag dump'!RC) -> 0 | V19: =IF(LOWER(Basis)="ibnp",'paid claim lag dump'!RC,'reported claim lag dump'!RC) -> 0 | W19: =IF(LOWER(Basis)="ibnp",'paid claim lag dump'!RC,'reported claim lag dump'!RC) -> 0 | X19: =IF(LOWER(Basis)="ibnp",'paid claim lag dump'!RC,'reported claim lag dump'!RC) -> 0 | Y19: =IF(LOWER(Basis)="ibnp",'paid claim lag dump'!RC,'reported claim lag dump'!RC) -> 0 | Z19: =IF(LOWER(Basis)="ibnp",'paid claim lag dump'!RC,'reported claim lag dump'!RC) -> 0 | AA19: =IF(LOWER(Basis)="ibnp",'paid claim lag dump'!RC,'reported claim lag dump'!RC) -> 0 | AB19: =IF(LOWER(Basis)="ibnp",'paid claim lag dump'!RC,'reported claim lag dump'!RC) -> 0 | AC19: =IF(LOWER(Basis)="ibnp",'paid claim lag dump'!RC,'reported claim lag dump'!RC) -> 0 | AD19: =IF(LOWER(Basis)="ibnp",'paid claim lag dump'!RC,'reported claim lag dump'!RC) -> 0 | AE19: =IF(LOWER(Basis)="ibnp",'paid claim lag dump'!RC,'reported claim lag dump'!RC) -> 0 | AF19: =IF(LOWER(Basis)="ibnp",'paid claim lag dump'!RC,'reported claim lag dump'!RC) -> 0 | AG19: =IF(LOWER(Basis)="ibnp",'paid claim lag dump'!RC,'reported claim lag dump'!RC) -> 0 | AH19: =IF(LOWER(Basis)="ibnp",'paid claim lag dump'!RC,'reported claim lag dump'!RC) -> 0 | AI19: =IF(LOWER(Basis)="ibnp",'paid claim lag dump'!RC,'reported claim lag dump'!RC) -> 0 | AJ19: =IF(LOWER(Basis)="ibnp",'paid claim lag dump'!RC,'reported claim lag dump'!RC) -> 0 | AK19: =IF(LOWER(Basis)="ibnp",'paid claim lag dump'!RC,'reported claim lag dump'!RC) -> 0 | AL19: =IF(LOWER(Basis)="ibnp",'paid claim lag dump'!RC,'reported claim lag dump'!RC) -> 0
B20: ='general dump'!RC -> 2000-01-01T00:00:00.000 | C20: =IF(LOWER(Basis)="ibnp",'paid claim lag dump'!RC,'reported claim lag dump'!RC) -> 14982 | D20: =IF(LOWER(Basis)="ibnp",'paid claim lag dump'!RC,'reported claim lag dump'!RC) -> 44836 | E20: =IF(LOWER(Basis)="ibnp",'paid claim lag dump'!RC,'reported claim lag dump'!RC) -> 31946 | F20: =IF(LOWER(Basis)="ibnp",'paid claim lag dump'!RC,'reported claim lag dump'!RC) -> 3681 | G20: =IF(LOWER(Basis)="ibnp",'paid claim lag dump'!RC,'reported claim lag dump'!RC) -> 2985 | H20: =IF(LOWER(Basis)="ibnp",'paid claim lag dump'!RC,'reported claim lag dump'!RC) -> 1328 | I20: =IF(LOWER(Basis)="ibnp",'paid claim lag dump'!RC,'reported claim lag dump'!RC) -> 9314 | J20: =IF(LOWER(Basis)="ibnp",'paid claim lag dump'!RC,'reported claim lag dump'!RC) -> 117 | K20: =IF(LOWER(Basis)="ibnp",'paid claim lag dump'!RC,'reported claim lag dump'!RC) -> 56 | L20: =IF(LOWER(Basis)="ibnp",'paid claim lag dump'!RC,'reported claim lag dump'!RC) -> 430 | M20: =IF(LOWER(Basis)="ibnp",'paid claim lag dump'!RC,'reported claim lag dump'!RC) -> 88 | N20: =IF(LOWER(Basis)="ibnp",'paid claim lag dump'!RC,'reported claim lag dump'!RC) -> 538 | O20: =IF(LOWER(Basis)="ibnp",'paid claim lag dump'!RC,'reported claim lag dump'!RC) -> 508 | P20: =IF(LOWER(Basis)="ibnp",'paid claim lag dump'!RC,'reported claim lag dump'!RC) -> 153 | Q20: =IF(LOWER(Basis)="ibnp",'paid claim lag dump'!RC,'reported claim lag dump'!RC) -> 0 | R20: =IF(LOWER(Basis)="ibnp",'paid claim lag dump'!RC,'reported claim lag dump'!RC) -> 273 | S20: =IF(LOWER(Basis)="ibnp",'paid claim lag dump'!RC,'reported claim lag dump'!RC) -> 303 | T20: =IF(LOWER(Basis)="ibnp",'paid claim lag dump'!RC,'reported claim lag dump'!RC) -> 0 | U20: =IF(LOWER(Basis)="ibnp",'paid claim lag dump'!RC,'reported claim lag dump'!RC) -> 0 | V20: =IF(LOWER(Basis)="ibnp",'paid claim lag dump'!RC,'reported claim lag dump'!RC) -> 0 | W20: =IF(LOWER(Basis)="ibnp",'paid claim lag dump'!RC,'reported claim lag dump'!RC) -> 0 | X20: =IF(LOWER(Basis)="ibnp",'paid claim lag dump'!RC,'reported claim lag dump'!RC) -> 0 | Y20: =IF(LOWER(Basis)="ibnp",'paid claim lag dump'!RC,'reported claim lag dump'!RC) -> 0 | Z20: =IF(LOWER(Basis)="ibnp",'paid claim lag dump'!RC,'reported claim lag dump'!RC) -> 0 | AA20: =IF(LOWER(Basis)="ibnp",'paid claim lag dump'!RC,'reported claim lag dump'!RC) -> 0 | AB20: =IF(LOWER(Basis)="ibnp",'paid claim lag dump'!RC,'reported claim lag dump'!RC) -> 0 | AC20: =IF(LOWER(Basis)="ibnp",'paid claim lag dump'!RC,'reported claim lag dump'!RC) -> 0 | AD20: =IF(LOWER(Basis)="ibnp",'paid claim lag dump'!RC,'reported claim lag dump'!RC) -> 0 | AE20: =IF(LOWER(Basis)="ibnp",'paid claim lag dump'!RC,'reported claim lag dump'!RC) -> 0 | AF20: =IF(LOWER(Basis)="ibnp",'paid claim lag dump'!RC,'reported claim lag dump'!RC) -> 0 | AG20: =IF(LOWER(Basis)="ibnp",'paid claim lag dump'!RC,'reported claim lag dump'!RC) -> 0 | AH20: =IF(LOWER(Basis)="ibnp",'paid claim lag dump'!RC,'reported claim lag dump'!RC) -> 0 | AI20: =IF(LOWER(Basis)="ibnp",'paid claim lag dump'!RC,'reported claim lag dump'!RC) -> 0 | AJ20: =IF(LOWER(Basis)="ibnp",'paid claim lag dump'!RC,'reported claim lag dump'!RC) -> 0 | AK20: =IF(LOWER(Basis)="ibnp",'paid claim lag dump'!RC,'reported claim lag dump'!RC) -> 0 | AL20: =IF(LOWER(Basis)="ibnp",'paid claim lag dump'!RC,'reported claim lag dump'!RC) -> 0
B21: ='general dump'!RC -> 2000-02-01T00:00:00.000 | C21: =IF(LOWER(Basis)="ibnp",'paid claim lag dump'!RC,'reported claim lag dump'!RC) -> 9736 | D21: =IF(LOWER(Basis)="ibnp",'paid claim lag dump'!RC,'reported claim lag dump'!RC) -> 90376 | E21: =IF(LOWER(Basis)="ibnp",'paid claim lag dump'!RC,'reported claim lag dump'!RC) -> 64236 | F21: =IF(LOWER(Basis)="ibnp",'paid claim lag dump'!RC,'reported claim lag dump'!RC) -> 12899 | G21: =IF(LOWER(Basis)="ibnp",'paid claim lag dump'!RC,'reported claim lag dump'!RC) -> 29961 | H21: =IF(LOWER(Basis)="ibnp",'paid claim lag dump'!RC,'reported claim lag dump'!RC) -> 702 | I21: =IF(LOWER(Basis)="ibnp",'paid claim lag dump'!RC,'reported claim lag dump'!RC) -> 1231 | J21: =IF(LOWER(Basis)="ibnp",'paid claim lag dump'!RC,'reported claim lag dump'!RC) -> 530 | K21: =IF(LOWER(Basis)="ibnp",'paid claim lag dump'!RC,'reported claim lag dump'!RC) -> 991 | L21: =IF(LOWER(Basis)="ibnp",'paid claim lag dump'!RC,'reported claim lag dump'!RC) -> 30 | M21: =IF(LOWER(Basis)="ibnp",'paid claim lag dump'!RC,'reported claim lag dump'!RC) -> 0 | N21: =IF(LOWER(Basis)="ibnp",'paid claim lag dump'!RC,'reported claim lag dump'!RC) -> 0 | O21: =IF(LOWER(Basis)="ibnp",'paid claim lag dump'!RC,'reported claim lag dump'!RC) -> 0 | P21: =IF(LOWER(Basis)="ibnp",'paid claim lag dump'!RC,'reported claim lag dump'!RC) -> 0 | Q21: =IF(LOWER(Basis)="ibnp",'paid claim lag dump'!RC,'reported claim lag dump'!RC) -> 0 | R21: =IF(LOWER(Basis)="ibnp",'paid claim lag dump'!RC,'reported claim lag dump'!RC) -> 791 | S21: =IF(LOWER(Basis)="ibnp",'paid claim lag dump'!RC,'reported claim lag dump'!RC) -> 0 | T21: =IF(LOWER(Basis)="ibnp",'paid claim lag dump'!RC,'reported claim lag dump'!RC) -> 0 | U21: =IF(LOWER(Basis)="ibnp",'paid claim lag dump'!RC,'reported claim lag dump'!RC) -> 0 | V21: =IF(LOWER(Basis)="ibnp",'paid claim lag dump'!RC,'reported claim lag dump'!RC) -> 80 | W21: =IF(LOWER(Basis)="ibnp",'paid claim lag dump'!RC,'reported claim lag dump'!RC) -> 0 | X21: =IF(LOWER(Basis)="ibnp",'paid claim lag dump'!RC,'reported claim lag dump'!RC) -> 0 | Y21: =IF(LOWER(Basis)="ibnp",'paid claim lag dump'!RC,'reported claim lag dump'!RC) -> 0 | Z21: =IF(LOWER(Basis)="ibnp",'paid claim lag dump'!RC,'reported claim lag dump'!RC) -> 0 | AA21: =IF(LOWER(Basis)="ibnp",'paid claim lag dump'!RC,'reported claim lag dump'!RC) -> 0 | AB21: =IF(LOWER(Basis)="ibnp",'paid claim lag dump'!RC,'reported claim lag dump'!RC) -> 0 | AC21: =IF(LOWER(Basis)="ibnp",'paid claim lag dump'!RC,'reported claim lag dump'!RC) -> 0 | AD21: =IF(LOWER(Basis)="ibnp",'paid claim lag dump'!RC,'reported claim lag dump'!RC) -> 0 | AE21: =IF(LOWER(Basis)="ibnp",'paid claim lag dump'!RC,'reported claim lag dump'!RC) -> 0 | AF21: =IF(LOWER(Basis)="ibnp",'paid claim lag dump'!RC,'reported claim lag dump'!RC) -> 0 | AG21: =IF(LOWER(Basis)="ibnp",'paid claim lag dump'!RC,'reported claim lag dump'!RC) -> 0 | AH21: =IF(LOWER(Basis)="ibnp",'paid claim lag dump'!RC,'reported claim lag dump'!RC) -> 0 | AI21: =IF(LOWER(Basis)="ibnp",'paid claim lag dump'!RC,'reported claim lag dump'!RC) -> 0 | AJ21: =IF(LOWER(Basis)="ibnp",'paid claim lag dump'!RC,'reported claim lag dump'!RC) -> 0 | AK21: =IF(LOWER(Basis)="ibnp",'paid claim lag dump'!RC,'reported claim lag dump'!RC) -> 0 | AL21: =IF(LOWER(Basis)="ibnp",'paid claim lag dump'!RC,'reported claim lag dump'!RC) -> 0
B22: ='general dump'!RC -> 2000-03-01T00:00:00.000 | C22: =IF(LOWER(Basis)="ibnp",'paid claim lag dump'!RC,'reported claim lag dump'!RC) -> 68074 | D22: =IF(LOWER(Basis)="ibnp",'paid claim lag dump'!RC,'reported claim lag dump'!RC) -> 108795 | E22: =IF(LOWER(Basis)="ibnp",'paid claim lag dump'!RC,'reported claim lag dump'!RC) -> 22323 | F22: =IF(LOWER(Basis)="ibnp",'paid claim lag dump'!RC,'reported claim lag dump'!RC) -> 1146 | G22: =IF(LOWER(Basis)="ibnp",'paid claim lag dump'!RC,'reported claim lag dump'!RC) -> 6942 | H22: =IF(LOWER(Basis)="ibnp",'paid claim lag dump'!RC,'reported claim lag dump'!RC) -> 821 | I22: =IF(LOWER(Basis)="ibnp",'paid claim lag dump'!RC,'reported claim lag dump'!RC) -> 1096 | J22: =IF(LOWER(Basis)="ibnp",'paid claim lag dump'!RC,'reported claim lag dump'!RC) -> 511 | K22: =IF(LOWER(Basis)="ibnp",'paid claim lag dump'!RC,'reported claim lag dump'!RC) -> 954 | L22: =IF(LOWER(Basis)="ibnp",'paid claim lag dump'!RC,'reported claim lag dump'!RC) -> 30 | M22: =IF(LOWER(Basis)="ibnp",'paid claim lag dump'!RC,'reported claim lag dump'!RC) -> 0 | N22: =IF(LOWER(Basis)="ibnp",'paid claim lag dump'!RC,'reported claim lag dump'!RC) -> 0 | O22: =IF(LOWER(Basis)="ibnp",'paid claim lag dump'!RC,'reported claim lag dump'!RC) -> 0 | P22: =IF(LOWER(Basis)="ibnp",'paid claim lag dump'!RC,'reported claim lag dump'!RC) -> 0 | Q22: =IF(LOWER(Basis)="ibnp",'paid claim lag dump'!RC,'reported claim lag dump'!RC) -> 0 | R22: =IF(LOWER(Basis)="ibnp",'paid claim lag dump'!RC,'reported claim lag dump'!RC) -> 791 | S22: =IF(LOWER(Basis)="ibnp",'paid claim lag dump'!RC,'reported claim lag dump'!RC) -> 0 | T22: =IF(LOWER(Basis)="ibnp",'paid claim lag dump'!RC,'reported claim lag dump'!RC) -> 0 | U22: =IF(LOWER(Basis)="ibnp",'paid claim lag dump'!RC,'reported claim lag dump'!RC) -> 0 | V22: =IF(LOWER(Basis)="ibnp",'paid claim lag dump'!RC,'reported claim lag dump'!RC) -> 80 | W22: =IF(LOWER(Basis)="ibnp",'paid claim lag dump'!RC,'reported claim lag dump'!RC) -> 0 | X22: =IF(LOWER(Basis)="ibnp",'paid claim lag dump'!RC,'reported claim lag dump'!RC) -> 0 | Y22: =IF(LOWER(Basis)="ibnp",'paid claim lag dump'!RC,'reported claim lag dump'!RC) -> 0 | Z22: =IF(LOWER(Basis)="ibnp",'paid claim lag dump'!RC,'reported claim lag dump'!RC) -> 0 | AA22: =IF(LOWER(Basis)="ibnp",'paid claim lag dump'!RC,'reported claim lag dump'!RC) -> 0 | AB22: =IF(LOWER(Basis)="ibnp",'paid claim lag dump'!RC,'reported claim lag dump'!RC) -> 0 | AC22: =IF(LOWER(Basis)="ibnp",'paid claim lag dump'!RC,'reported claim lag dump'!RC) -> 0 | AD22: =IF(LOWER(Basis)="ibnp",'paid claim lag dump'!RC,'reported claim lag dump'!RC) -> 0 | AE22: =IF(LOWER(Basis)="ibnp",'paid claim lag dump'!RC,'reported claim lag dump'!RC) -> 0 | AF22: =IF(LOWER(Basis)="ibnp",'paid claim lag dump'!RC,'reported claim lag dump'!RC) -> 0 | AG22: =IF(LOWER(Basis)="ibnp",'paid claim lag dump'!RC,'reported claim lag dump'!RC) -> 0 | AH22: =IF(LOWER(Basis)="ibnp",'paid claim lag dump'!RC,'reported claim lag dump'!RC) -> 0 | AI22: =IF(LOWER(Basis)="ibnp",'paid claim lag dump'!RC,'reported claim lag dump'!RC) -> 0 | AJ22: =IF(LOWER(Basis)="ibnp",'paid claim lag dump'!RC,'reported claim lag dump'!RC) -> 0 | AK22: =IF(LOWER(Basis)="ibnp",'paid claim lag dump'!RC,'reported claim lag dump'!RC) -> 0 | AL22: =IF(LOWER(Basis)="ibnp",'paid claim lag dump'!RC,'reported claim lag dump'!RC) -> 0
B23: ='general dump'!RC -> 2000-04-01T00:00:00.000 | C23: =IF(LOWER(Basis)="ibnp",'paid claim lag dump'!RC,'reported claim lag dump'!RC) -> 10201 | D23: =IF(LOWER(Basis)="ibnp",'paid claim lag dump'!RC,'reported claim lag dump'!RC) -> 90658 | E23: =IF(LOWER(Basis)="ibnp",'paid claim lag dump'!RC,'reported claim lag dump'!RC) -> 24213 | F23: =IF(LOWER(Basis)="ibnp",'paid claim lag dump'!RC,'reported claim lag dump'!RC) -> 20107 | G23: =IF(LOWER(Basis)="ibnp",'paid claim lag dump'!RC,'reported claim lag dump'!RC) -> 28866 | H23: =IF(LOWER(Basis)="ibnp",'paid claim lag dump'!RC,'reported claim lag dump'!RC) -> 6492 | I23: =IF(LOWER(Basis)="ibnp",'paid claim lag dump'!RC,'reported claim lag dump'!RC) -> 1428 | J23: =IF(LOWER(Basis)="ibnp",'paid claim lag dump'!RC,'reported claim lag dump'!RC) -> 616 | K23: =IF(LOWER(Basis)="ibnp",'paid claim lag dump'!RC,'reported claim lag dump'!RC) -> 53 | L23: =IF(LOWER(Basis)="ibnp",'paid claim lag dump'!RC,'reported claim lag dump'!RC) -> 168 | M23: =IF(LOWER(Basis)="ibnp",'paid claim lag dump'!RC,'reported claim lag dump'!RC) -> 0 | N23: =IF(LOWER(Basis)="ibnp",'paid claim lag dump'!RC,'reported claim lag dump'!RC) -> 0 | O23: =IF(LOWER(Basis)="ibnp",'paid claim lag dump'!RC,'reported claim lag dump'!RC) -> 0 | P23: =IF(LOWER(Basis)="ibnp",'paid claim lag dump'!RC,'reported claim lag dump'!RC) -> 0 | Q23: =IF(LOWER(Basis)="ibnp",'paid claim lag dump'!RC,'reported claim lag dump'!RC) -> 0 | R23: =IF(LOWER(Basis)="ibnp",'paid claim lag dump'!RC,'reported claim lag dump'!RC) -> 0 | S23: =IF(LOWER(Basis)="ibnp",'paid claim lag dump'!RC,'reported claim lag dump'!RC) -> 0 | T23: =IF(LOWER(Basis)="ibnp",'paid claim lag dump'!RC,'reported claim lag dump'!RC) -> 392 | U23: =IF(LOWER(Basis)="ibnp",'paid claim lag dump'!RC,'reported claim lag dump'!RC) -> 0 | V23: =IF(LOWER(Basis)="ibnp",'paid claim lag dump'!RC,'reported claim lag dump'!RC) -> 0 | W23: =IF(LOWER(Basis)="ibnp",'paid claim lag dump'!RC,'reported claim lag dump'!RC) -> 0 | X23: =IF(LOWER(Basis)="ibnp",'paid claim lag dump'!RC,'reported claim lag dump'!RC) -> 0 | Y23: =IF(LOWER(Basis)="ibnp",'paid claim lag dump'!RC,'reported claim lag dump'!RC) -> 0 | Z23: =IF(LOWER(Basis)="ibnp",'paid claim lag dump'!RC,'reported claim lag dump'!RC) -> 0 | AA23: =IF(LOWER(Basis)="ibnp",'paid claim lag dump'!RC,'reported claim lag dump'!RC) -> 0 | AB23: =IF(LOWER(Basis)="ibnp",'paid claim lag dump'!RC,'reported claim lag dump'!RC) -> 0 | AC23: =IF(LOWER(Basis)="ibnp",'paid claim lag dump'!RC,'reported claim lag dump'!RC) -> 0 | AD23: =IF(LOWER(Basis)="ibnp",'paid claim lag dump'!RC,'reported claim lag dump'!RC) -> 0 | AE23: =IF(LOWER(Basis)="ibnp",'paid claim lag dump'!RC,'reported claim lag dump'!RC) -> 0 | AF23: =IF(LOWER(Basis)="ibnp",'paid claim lag dump'!RC,'reported claim lag dump'!RC) -> 0 | AG23: =IF(LOWER(Basis)="ibnp",'paid claim lag dump'!RC,'reported claim lag dump'!RC) -> 0 | AH23: =IF(LOWER(Basis)="ibnp",'paid claim lag dump'!RC,'reported claim lag dump'!RC) -> 0 | AI23: =IF(LOWER(Basis)="ibnp",'paid claim lag dump'!RC,'reported claim lag dump'!RC) -> 0 | AJ23: =IF(LOWER(Basis)="ibnp",'paid claim lag dump'!RC,'reported claim lag dump'!RC) -> 0 | AK23: =IF(LOWER(Basis)="ibnp",'paid claim lag dump'!RC,'reported claim lag dump'!RC) -> 0 | AL23: =IF(LOWER(Basis)="ibnp",'paid claim lag dump'!RC,'reported claim lag dump'!RC) -> 0
B24: ='general dump'!RC -> 2000-05-01T00:00:00.000 | C24: =IF(LOWER(Basis)="ibnp",'paid claim lag dump'!RC,'reported claim lag dump'!RC) -> 80043 | D24: =IF(LOWER(Basis)="ibnp",'paid claim lag dump'!RC,'reported claim lag dump'!RC) -> 39941 | E24: =IF(LOWER(Basis)="ibnp",'paid claim lag dump'!RC,'reported claim lag dump'!RC) -> 10905 | F24: =IF(LOWER(Basis)="ibnp",'paid claim lag dump'!RC,'reported claim lag dump'!RC) -> 38977 | G24: =IF(LOWER(Basis)="ibnp",'paid claim lag dump'!RC,'reported claim lag dump'!RC) -> 4745 | H24: =IF(LOWER(Basis)="ibnp",'paid claim lag dump'!RC,'reported claim lag dump'!RC) -> 6586 | I24: =IF(LOWER(Basis)="ibnp",'paid claim lag dump'!RC,'reported claim lag dump'!RC) -> 1310 | J24: =IF(LOWER(Basis)="ibnp",'paid claim lag dump'!RC,'reported claim lag dump'!RC) -> 107 | K24: =IF(LOWER(Basis)="ibnp",'paid claim lag dump'!RC,'reported claim lag dump'!RC) -> 20 | L24: =IF(LOWER(Basis)="ibnp",'paid claim lag dump'!RC,'reported claim lag dump'!RC) -> 168 | M24: =IF(LOWER(Basis)="ibnp",'paid claim lag dump'!RC,'reported claim lag dump'!RC) -> 0 | N24: =IF(LOWER(Basis)="ibnp",'paid claim lag dump'!RC,'reported claim lag dump'!RC) -> 0 | O24: =IF(LOWER(Basis)="ibnp",'paid claim lag dump'!RC,'reported claim lag dump'!RC) -> 0 | P24: =IF(LOWER(Basis)="ibnp",'paid claim lag dump'!RC,'reported claim lag dump'!RC) -> 0 | Q24: =IF(LOWER(Basis)="ibnp",'paid claim lag dump'!RC,'reported claim lag dump'!RC) -> 0 | R24: =IF(LOWER(Basis)="ibnp",'paid claim lag dump'!RC,'reported claim lag dump'!RC) -> 0 | S24: =IF(LOWER(Basis)="ibnp",'paid claim lag dump'!RC,'reported claim lag dump'!RC) -> 0 | T24: =IF(LOWER(Basis)="ibnp",'paid claim lag dump'!RC,'reported claim lag dump'!RC) -> 392 | U24: =IF(LOWER(Basis)="ibnp",'paid claim lag dump'!RC,'reported claim lag dump'!RC) -> 0 | V24: =IF(LOWER(Basis)="ibnp",'paid claim lag dump'!RC,'reported claim lag dump'!RC) -> 0 | W24: =IF(LOWER(Basis)="ibnp",'paid claim lag dump'!RC,'reported claim lag dump'!RC) -> 0 | X24: =IF(LOWER(Basis)="ibnp",'paid claim lag dump'!RC,'reported claim lag dump'!RC) -> 0 | Y24: =IF(LOWER(Basis)="ibnp",'paid claim lag dump'!RC,'reported claim lag dump'!RC) -> 0 | Z24: =IF(LOWER(Basis)="ibnp",'paid claim lag dump'!RC,'reported claim lag dump'!RC) -> 0 | AA24: =IF(LOWER(Basis)="ibnp",'paid claim lag dump'!RC,'reported claim lag dump'!RC) -> 0 | AB24: =IF(LOWER(Basis)="ibnp",'paid claim lag dump'!RC,'reported claim lag dump'!RC) -> 0 | AC24: =IF(LOWER(Basis)="ibnp",'paid claim lag dump'!RC,'reported claim lag dump'!RC) -> 0 | AD24: =IF(LOWER(Basis)="ibnp",'paid claim lag dump'!RC,'reported claim lag dump'!RC) -> 0 | AE24: =IF(LOWER(Basis)="ibnp",'paid claim lag dump'!RC,'reported claim lag dump'!RC) -> 0 | AF24: =IF(LOWER(Basis)="ibnp",'paid claim lag dump'!RC,'reported claim lag dump'!RC) -> 0 | AG24: =IF(LOWER(Basis)="ibnp",'paid claim lag dump'!RC,'reported claim lag dump'!RC) -> 0 | AH24: =IF(LOWER(Basis)="ibnp",'paid claim lag dump'!RC,'reported claim lag dump'!RC) -> 0 | AI24: =IF(LOWER(Basis)="ibnp",'paid claim lag dump'!RC,'reported claim lag dump'!RC) -> 0 | AJ24: =IF(LOWER(Basis)="ibnp",'paid claim lag dump'!RC,'reported claim lag dump'!RC) -> 0 | AK24: =IF(LOWER(Basis)="ibnp",'paid claim lag dump'!RC,'reported claim lag dump'!RC) -> 0 | AL24: =IF(LOWER(Basis)="ibnp",'paid claim lag dump'!RC,'reported claim lag dump'!RC) -> 0
B25: ='general dump'!RC -> 2000-06-01T00:00:00.000 | C25: =IF(LOWER(Basis)="ibnp",'paid claim lag dump'!RC,'reported claim lag dump'!RC) -> 4501 | D25: =IF(LOWER(Basis)="ibnp",'paid claim lag dump'!RC,'reported claim lag dump'!RC) -> 74638 | E25: =IF(LOWER(Basis)="ibnp",'paid claim lag dump'!RC,'reported claim lag dump'!RC) -> 87955 | F25: =IF(LOWER(Basis)="ibnp",'paid claim lag dump'!RC,'reported claim lag dump'!RC) -> 99302 | G25: =IF(LOWER(Basis)="ibnp",'paid claim lag dump'!RC,'reported claim lag dump'!RC) -> 13877 | H25: =IF(LOWER(Basis)="ibnp",'paid claim lag dump'!RC,'reported claim lag dump'!RC) -> 20118 | I25: =IF(LOWER(Basis)="ibnp",'paid claim lag dump'!RC,'reported claim lag dump'!RC) -> 5661 | J25: =IF(LOWER(Basis)="ibnp",'paid claim lag dump'!RC,'reported claim lag dump'!RC) -> 21364 | K25: =IF(LOWER(Basis)="ibnp",'paid claim lag dump'!RC,'reported claim lag dump'!RC) -> 159 | L25: =IF(LOWER(Basis)="ibnp",'paid claim lag dump'!RC,'reported claim lag dump'!RC) -> 480 | M25: =IF(LOWER(Basis)="ibnp",'paid claim lag dump'!RC,'reported claim lag dump'!RC) -> 28 | N25: =IF(LOWER(Basis)="ibnp",'paid claim lag dump'!RC,'reported claim lag dump'!RC) -> 693 | O25: =IF(LOWER(Basis)="ibnp",'paid claim lag dump'!RC,'reported claim lag dump'!RC) -> 0 | P25: =IF(LOWER(Basis)="ibnp",'paid claim lag dump'!RC,'reported claim lag dump'!RC) -> 0 | Q25: =IF(LOWER(Basis)="ibnp",'paid claim lag dump'!RC,'reported claim lag dump'!RC) -> 131 | R25: =IF(LOWER(Basis)="ibnp",'paid claim lag dump'!RC,'reported claim lag dump'!RC) -> 0 | S25: =IF(LOWER(Basis)="ibnp",'paid claim lag dump'!RC,'reported claim lag dump'!RC) -> 294 | T25: =IF(LOWER(Basis)="ibnp",'paid claim lag dump'!RC,'reported claim lag dump'!RC) -> 0 | U25: =IF(LOWER(Basis)="ibnp",'paid claim lag dump'!RC,'reported claim lag dump'!RC) -> 0 | V25: =IF(LOWER(Basis)="ibnp",'paid claim lag dump'!RC,'reported claim lag dump'!RC) -> 96 | W25: =IF(LOWER(Basis)="ibnp",'paid claim lag dump'!RC,'reported claim lag dump'!RC) -> 0 | X25: =IF(LOWER(Basis)="ibnp",'paid claim lag dump'!RC,'reported claim lag dump'!RC) -> 0 | Y25: =IF(LOWER(Basis)="ibnp",'paid claim lag dump'!RC,'reported claim lag dump'!RC) -> 0 | Z25: =IF(LOWER(Basis)="ibnp",'paid claim lag dump'!RC,'reported claim lag dump'!RC) -> 0 | AA25: =IF(LOWER(Basis)="ibnp",'paid claim lag dump'!RC,'reported claim lag dump'!RC) -> 0 | AB25: =IF(LOWER(Basis)="ibnp",'paid claim lag dump'!RC,'reported claim lag dump'!RC) -> 0 | AC25: =IF(LOWER(Basis)="ibnp",'paid claim lag dump'!RC,'reported claim lag dump'!RC) -> 0 | AD25: =IF(LOWER(Basis)="ibnp",'paid claim lag dump'!RC,'reported claim lag dump'!RC) -> 0 | AE25: =IF(LOWER(Basis)="ibnp",'paid claim lag dump'!RC,'reported claim lag dump'!RC) -> 0 | AF25: =IF(LOWER(Basis)="ibnp",'paid claim lag dump'!RC,'reported claim lag dump'!RC) -> 0 | AG25: =IF(LOWER(Basis)="ibnp",'paid claim lag dump'!RC,'reported claim lag dump'!RC) -> 0 | AH25: =IF(LOWER(Basis)="ibnp",'paid claim lag dump'!RC,'reported claim lag dump'!RC) -> 0 | AI25: =IF(LOWER(Basis)="ibnp",'paid claim lag dump'!RC,'reported claim lag dump'!RC) -> 0 | AJ25: =IF(LOWER(Basis)="ibnp",'paid claim lag dump'!RC,'reported claim lag dump'!RC) -> 0 | AK25: =IF(LOWER(Basis)="ibnp",'paid claim lag dump'!RC,'reported claim lag dump'!RC) -> 0 | AL25: =IF(LOWER(Basis)="ibnp",'paid claim lag dump'!RC,'reported claim lag dump'!RC) -> 0
B26: ='general dump'!RC -> 2000-07-01T00:00:00.000 | C26: =IF(LOWER(Basis)="ibnp",'paid claim lag dump'!RC,'reported claim lag dump'!RC) -> 45495 | D26: =IF(LOWER(Basis)="ibnp",'paid claim lag dump'!RC,'reported claim lag dump'!RC) -> 81868 | E26: =IF(LOWER(Basis)="ibnp",'paid claim lag dump'!RC,'reported claim lag dump'!RC) -> 96720 | F26: =IF(LOWER(Basis)="ibnp",'paid claim lag dump'!RC,'reported claim lag dump'!RC) -> 55381 | G26: =IF(LOWER(Basis)="ibnp",'paid claim lag dump'!RC,'reported claim lag dump'!RC) -> 3174 | H26: =IF(LOWER(Basis)="ibnp",'paid claim lag dump'!RC,'reported claim lag dump'!RC) -> 17865 | I26: =IF(LOWER(Basis)="ibnp",'paid claim lag dump'!RC,'reported claim lag dump'!RC) -> 5653 | J26: =IF(LOWER(Basis)="ibnp",'paid claim lag dump'!RC,'reported claim lag dump'!RC) -> 21419 | K26: =IF(LOWER(Basis)="ibnp",'paid claim lag dump'!RC,'reported claim lag dump'!RC) -> 0 | L26: =IF(LOWER(Basis)="ibnp",'paid claim lag dump'!RC,'reported claim lag dump'!RC) -> 480 | M26: =IF(LOWER(Basis)="ibnp",'paid claim lag dump'!RC,'reported claim lag dump'!RC) -> 702 | N26: =IF(LOWER(Basis)="ibnp",'paid claim lag dump'!RC,'reported claim lag dump'!RC) -> 19 | O26: =IF(LOWER(Basis)="ibnp",'paid claim lag dump'!RC,'reported claim lag dump'!RC) -> 0 | P26: =IF(LOWER(Basis)="ibnp",'paid claim lag dump'!RC,'reported claim lag dump'!RC) -> 131 | Q26: =IF(LOWER(Basis)="ibnp",'paid claim lag dump'!RC,'reported claim lag dump'!RC) -> 0 | R26: =IF(LOWER(Basis)="ibnp",'paid claim lag dump'!RC,'reported claim lag dump'!RC) -> 0 | S26: =IF(LOWER(Basis)="ibnp",'paid claim lag dump'!RC,'reported claim lag dump'!RC) -> 294 | T26: =IF(LOWER(Basis)="ibnp",'paid claim lag dump'!RC,'reported claim lag dump'!RC) -> 0 | U26: =IF(LOWER(Basis)="ibnp",'paid claim lag dump'!RC,'reported claim lag dump'!RC) -> 0 | V26: =IF(LOWER(Basis)="ibnp",'paid claim lag dump'!RC,'reported claim lag dump'!RC) -> 96 | W26: =IF(LOWER(Basis)="ibnp",'paid claim lag dump'!RC,'reported claim lag dump'!RC) -> 0 | X26: =IF(LOWER(Basis)="ibnp",'paid claim lag dump'!RC,'reported claim lag dump'!RC) -> 0 | Y26: =IF(LOWER(Basis)="ibnp",'paid claim lag dump'!RC,'reported claim lag dump'!RC) -> 0 | Z26: =IF(LOWER(Basis)="ibnp",'paid claim lag dump'!RC,'reported claim lag dump'!RC) -> 0 | AA26: =IF(LOWER(Basis)="ibnp",'paid claim lag dump'!RC,'reported claim lag dump'!RC) -> 0 | AB26: =IF(LOWER(Basis)="ibnp",'paid claim lag dump'!RC,'reported claim lag dump'!RC) -> 0 | AC26: =IF(LOWER(Basis)="ibnp",'paid claim lag dump'!RC,'reported claim lag dump'!RC) -> 0 | AD26: =IF(LOWER(Basis)="ibnp",'paid claim lag dump'!RC,'reported claim lag dump'!RC) -> 0 | AE26: =IF(LOWER(Basis)="ibnp",'paid claim lag dump'!RC,'reported claim lag dump'!RC) -> 0 | AF26: =IF(LOWER(Basis)="ibnp",'paid claim lag dump'!RC,'reported claim lag dump'!RC) -> 0 | AG26: =IF(LOWER(Basis)="ibnp",'paid claim lag dump'!RC,'reported claim lag dump'!RC) -> 0 | AH26: =IF(LOWER(Basis)="ibnp",'paid claim lag dump'!RC,'reported claim lag dump'!RC) -> 0 | AI26: =IF(LOWER(Basis)="ibnp",'paid claim lag dump'!RC,'reported claim lag dump'!RC) -> 0 | AJ26: =IF(LOWER(Basis)="ibnp",'paid claim lag dump'!RC,'reported claim lag dump'!RC) -> 0 | AK26: =IF(LOWER(Basis)="ibnp",'paid claim lag dump'!RC,'reported claim lag dump'!RC) -> 0 | AL26: =IF(LOWER(Basis)="ibnp",'paid claim lag dump'!RC,'reported claim lag dump'!RC) -> 0
B27: ='general dump'!RC -> 2000-08-01T00:00:00.000 | C27: =IF(LOWER(Basis)="ibnp",'paid claim lag dump'!RC,'reported claim lag dump'!RC) -> 2952 | D27: =IF(LOWER(Basis)="ibnp",'paid claim lag dump'!RC,'reported claim lag dump'!RC) -> 58928 | E27: =IF(LOWER(Basis)="ibnp",'paid claim lag dump'!RC,'reported claim lag dump'!RC) -> 130303 | F27: =IF(LOWER(Basis)="ibnp",'paid claim lag dump'!RC,'reported claim lag dump'!RC) -> 52128 | G27: =IF(LOWER(Basis)="ibnp",'paid claim lag dump'!RC,'reported claim lag dump'!RC) -> 14870 | H27: =IF(LOWER(Basis)="ibnp",'paid claim lag dump'!RC,'reported claim lag dump'!RC) -> 3898 | I27: =IF(LOWER(Basis)="ibnp",'paid claim lag dump'!RC,'reported claim lag dump'!RC) -> 15681 | J27: =IF(LOWER(Basis)="ibnp",'paid claim lag dump'!RC,'reported claim lag dump'!RC) -> 1013 | K27: =IF(LOWER(Basis)="ibnp",'paid claim lag dump'!RC,'reported claim lag dump'!RC) -> 981 | L27: =IF(LOWER(Basis)="ibnp",'paid claim lag dump'!RC,'reported claim lag dump'!RC) -> 121 | M27: =IF(LOWER(Basis)="ibnp",'paid claim lag dump'!RC,'reported claim lag dump'!RC) -> 0 | N27: =IF(LOWER(Basis)="ibnp",'paid claim lag dump'!RC,'reported claim lag dump'!RC) -> 84 | O27: =IF(LOWER(Basis)="ibnp",'paid claim lag dump'!RC,'reported claim lag dump'!RC) -> 213 | P27: =IF(LOWER(Basis)="ibnp",'paid claim lag dump'!RC,'reported claim lag dump'!RC) -> 53 | Q27: =IF(LOWER(Basis)="ibnp",'paid claim lag dump'!RC,'reported claim lag dump'!RC) -> 0 | R27: =IF(LOWER(Basis)="ibnp",'paid claim lag dump'!RC,'reported claim lag dump'!RC) -> 0 | S27: =IF(LOWER(Basis)="ibnp",'paid claim lag dump'!RC,'reported claim lag dump'!RC) -> 0 | T27: =IF(LOWER(Basis)="ibnp",'paid claim lag dump'!RC,'reported claim lag dump'!RC) -> 210 | U27: =IF(LOWER(Basis)="ibnp",'paid claim lag dump'!RC,'reported claim lag dump'!RC) -> 75 | V27: =IF(LOWER(Basis)="ibnp",'paid claim lag dump'!RC,'reported claim lag dump'!RC) -> 0 | W27: =IF(LOWER(Basis)="ibnp",'paid claim lag dump'!RC,'reported claim lag dump'!RC) -> 0 | X27: =IF(LOWER(Basis)="ibnp",'paid claim lag dump'!RC,'reported claim lag dump'!RC) -> 0 | Y27: =IF(LOWER(Basis)="ibnp",'paid claim lag dump'!RC,'reported claim lag dump'!RC) -> 0 | Z27: =IF(LOWER(Basis)="ibnp",'paid claim lag dump'!RC,'reported claim lag dump'!RC) -> 0 | AA27: =IF(LOWER(Basis)="ibnp",'paid claim lag dump'!RC,'reported claim lag dump'!RC) -> 0 | AB27: =IF(LOWER(Basis)="ibnp",'paid claim lag dump'!RC,'reported claim lag dump'!RC) -> 0 | AC27: =IF(LOWER(Basis)="ibnp",'paid claim lag dump'!RC,'reported claim lag dump'!RC) -> 0 | AD27: =IF(LOWER(Basis)="ibnp",'paid claim lag dump'!RC,'reported claim lag dump'!RC) -> 0 | AE27: =IF(LOWER(Basis)="ibnp",'paid claim lag dump'!RC,'reported claim lag dump'!RC) -> 0 | AF27: =IF(LOWER(Basis)="ibnp",'paid claim lag dump'!RC,'reported claim lag dump'!RC) -> 0 | AG27: =IF(LOWER(Basis)="ibnp",'paid claim lag dump'!RC,'reported claim lag dump'!RC) -> 0 | AH27: =IF(LOWER(Basis)="ibnp",'paid claim lag dump'!RC,'reported claim lag dump'!RC) -> 0 | AI27: =IF(LOWER(Basis)="ibnp",'paid claim lag dump'!RC,'reported claim lag dump'!RC) -> 0 | AJ27: =IF(LOWER(Basis)="ibnp",'paid claim lag dump'!RC,'reported claim lag dump'!RC) -> 0 | AK27: =IF(LOWER(Basis)="ibnp",'paid claim lag dump'!RC,'reported claim lag dump'!RC) -> 0 | AL27: =IF(LOWER(Basis)="ibnp",'paid claim lag dump'!RC,'reported claim lag dump'!RC) -> 0
B28: ='general dump'!RC -> 2000-09-01T00:00:00.000 | C28: =IF(LOWER(Basis)="ibnp",'paid claim lag dump'!RC,'reported claim lag dump'!RC) -> 22590 | D28: =IF(LOWER(Basis)="ibnp",'paid claim lag dump'!RC,'reported claim lag dump'!RC) -> 127706 | E28: =IF(LOWER(Basis)="ibnp",'paid claim lag dump'!RC,'reported claim lag dump'!RC) -> 52799 | F28: =IF(LOWER(Basis)="ibnp",'paid claim lag dump'!RC,'reported claim lag dump'!RC) -> 53458 | G28: =IF(LOWER(Basis)="ibnp",'paid claim lag dump'!RC,'reported claim lag dump'!RC) -> 8807 | H28: =IF(LOWER(Basis)="ibnp",'paid claim lag dump'!RC,'reported claim lag dump'!RC) -> 2747 | I28: =IF(LOWER(Basis)="ibnp",'paid claim lag dump'!RC,'reported claim lag dump'!RC) -> 11162 | J28: =IF(LOWER(Basis)="ibnp",'paid claim lag dump'!RC,'reported claim lag dump'!RC) -> 581 | K28: =IF(LOWER(Basis)="ibnp",'paid claim lag dump'!RC,'reported claim lag dump'!RC) -> 1025 | L28: =IF(LOWER(Basis)="ibnp",'paid claim lag dump'!RC,'reported claim lag dump'!RC) -> 0 | M28: =IF(LOWER(Basis)="ibnp",'paid claim lag dump'!RC,'reported claim lag dump'!RC) -> 0 | N28: =IF(LOWER(Basis)="ibnp",'paid claim lag dump'!RC,'reported claim lag dump'!RC) -> 84 | O28: =IF(LOWER(Basis)="ibnp",'paid claim lag dump'!RC,'reported claim lag dump'!RC) -> 213 | P28: =IF(LOWER(Basis)="ibnp",'paid claim lag dump'!RC,'reported claim lag dump'!RC) -> 53 | Q28: =IF(LOWER(Basis)="ibnp",'paid claim lag dump'!RC,'reported claim lag dump'!RC) -> 0 | R28: =IF(LOWER(Basis)="ibnp",'paid claim lag dump'!RC,'reported claim lag dump'!RC) -> 0 | S28: =IF(LOWER(Basis)="ibnp",'paid claim lag dump'!RC,'reported claim lag dump'!RC) -> 210 | T28: =IF(LOWER(Basis)="ibnp",'paid claim lag dump'!RC,'reported claim lag dump'!RC) -> 0 | U28: =IF(LOWER(Basis)="ibnp",'paid claim lag dump'!RC,'reported claim lag dump'!RC) -> 75 | V28: =IF(LOWER(Basis)="ibnp",'paid claim lag dump'!RC,'reported claim lag dump'!RC) -> 0 | W28: =IF(LOWER(Basis)="ibnp",'paid claim lag dump'!RC,'reported claim lag dump'!RC) -> 0 | X28: =IF(LOWER(Basis)="ibnp",'paid claim lag dump'!RC,'reported claim lag dump'!RC) -> 0 | Y28: =IF(LOWER(Basis)="ibnp",'paid claim lag dump'!RC,'reported claim lag dump'!RC) -> 0 | Z28: =IF(LOWER(Basis)="ibnp",'paid claim lag dump'!RC,'reported claim lag dump'!RC) -> 0 | AA28: =IF(LOWER(Basis)="ibnp",'paid claim lag dump'!RC,'reported claim lag dump'!RC) -> 0 | AB28: =IF(LOWER(Basis)="ibnp",'paid claim lag dump'!RC,'reported claim lag dump'!RC) -> 0 | AC28: =IF(LOWER(Basis)="ibnp",'paid claim lag dump'!RC,'reported claim lag dump'!RC) -> 0 | AD28: =IF(LOWER(Basis)="ibnp",'paid claim lag dump'!RC,'reported claim lag dump'!RC) -> 0 | AE28: =IF(LOWER(Basis)="ibnp",'paid claim lag dump'!RC,'reported claim lag dump'!RC) -> 0 | AF28: =IF(LOWER(Basis)="ibnp",'paid claim lag dump'!RC,'reported claim lag dump'!RC) -> 0 | AG28: =IF(LOWER(Basis)="ibnp",'paid claim lag dump'!RC,'reported claim lag dump'!RC) -> 0 | AH28: =IF(LOWER(Basis)="ibnp",'paid claim lag dump'!RC,'reported claim lag dump'!RC) -> 0 | AI28: =IF(LOWER(Basis)="ibnp",'paid claim lag dump'!RC,'reported claim lag dump'!RC) -> 0 | AJ28: =IF(LOWER(Basis)="ibnp",'paid claim lag dump'!RC,'reported claim lag dump'!RC) -> 0 | AK28: =IF(LOWER(Basis)="ibnp",'paid claim lag dump'!RC,'reported claim lag dump'!RC) -> 0 | AL28: =IF(LOWER(Basis)="ibnp",'paid claim lag dump'!RC,'reported claim lag dump'!RC) -> 0
B29: ='general dump'!RC -> 2000-10-01T00:00:00.000 | C29: =IF(LOWER(Basis)="ibnp",'paid claim lag dump'!RC,'reported claim lag dump'!RC) -> 2217 | D29: =IF(LOWER(Basis)="ibnp",'paid claim lag dump'!RC,'reported claim lag dump'!RC) -> 50074 | E29: =IF(LOWER(Basis)="ibnp",'paid claim lag dump'!RC,'reported claim lag dump'!RC) -> 38342 | F29: =IF(LOWER(Basis)="ibnp",'paid claim lag dump'!RC,'reported claim lag dump'!RC) -> 59896 | G29: =IF(LOWER(Basis)="ibnp",'paid claim lag dump'!RC,'reported claim lag dump'!RC) -> 12140 | H29: =IF(LOWER(Basis)="ibnp",'paid claim lag dump'!RC,'reported claim lag dump'!RC) -> 3146 | I29: =IF(LOWER(Basis)="ibnp",'paid claim lag dump'!RC,'reported claim lag dump'!RC) -> 1154 | J29: =IF(LOWER(Basis)="ibnp",'paid claim lag dump'!RC,'reported claim lag dump'!RC) -> 9723 | K29: =IF(LOWER(Basis)="ibnp",'paid claim lag dump'!RC,'reported claim lag dump'!RC) -> 403 | L29: =IF(LOWER(Basis)="ibnp",'paid claim lag dump'!RC,'reported claim lag dump'!RC) -> 0 | M29: =IF(LOWER(Basis)="ibnp",'paid claim lag dump'!RC,'reported claim lag dump'!RC) -> 1132 | N29: =IF(LOWER(Basis)="ibnp",'paid claim lag dump'!RC,'reported claim lag dump'!RC) -> 177 | O29: =IF(LOWER(Basis)="ibnp",'paid claim lag dump'!RC,'reported claim lag dump'!RC) -> 160 | P29: =IF(LOWER(Basis)="ibnp",'paid claim lag dump'!RC,'reported claim lag dump'!RC) -> 3268 | Q29: =IF(LOWER(Basis)="ibnp",'paid claim lag dump'!RC,'reported claim lag dump'!RC) -> 288 | R29: =IF(LOWER(Basis)="ibnp",'paid claim lag dump'!RC,'reported claim lag dump'!RC) -> 398 | S29: =IF(LOWER(Basis)="ibnp",'paid claim lag dump'!RC,'reported claim lag dump'!RC) -> 57 | T29: =IF(LOWER(Basis)="ibnp",'paid claim lag dump'!RC,'reported claim lag dump'!RC) -> 734 | U29: =IF(LOWER(Basis)="ibnp",'paid claim lag dump'!RC,'reported claim lag dump'!RC) -> 0 | V29: =IF(LOWER(Basis)="ibnp",'paid claim lag dump'!RC,'reported claim lag dump'!RC) -> 0 | W29: =IF(LOWER(Basis)="ibnp",'paid claim lag dump'!RC,'reported claim lag dump'!RC) -> 0 | X29: =IF(LOWER(Basis)="ibnp",'paid claim lag dump'!RC,'reported claim lag dump'!RC) -> 0 | Y29: =IF(LOWER(Basis)="ibnp",'paid claim lag dump'!RC,'reported claim lag dump'!RC) -> 0 | Z29: =IF(LOWER(Basis)="ibnp",'paid claim lag dump'!RC,'reported claim lag dump'!RC) -> 0 | AA29: =IF(LOWER(Basis)="ibnp",'paid claim lag dump'!RC,'reported claim lag dump'!RC) -> 0 | AB29: =IF(LOWER(Basis)="ibnp",'paid claim lag dump'!RC,'reported claim lag dump'!RC) -> 0 | AC29: =IF(LOWER(Basis)="ibnp",'paid claim lag dump'!RC,'reported claim lag dump'!RC) -> 0 | AD29: =IF(LOWER(Basis)="ibnp",'paid claim lag dump'!RC,'reported claim lag dump'!RC) -> 0 | AE29: =IF(LOWER(Basis)="ibnp",'paid claim lag dump'!RC,'reported claim lag dump'!RC) -> 0 | AF29: =IF(LOWER(Basis)="ibnp",'paid claim lag dump'!RC,'reported claim lag dump'!RC) -> 0 | AG29: =IF(LOWER(Basis)="ibnp",'paid claim lag dump'!RC,'reported claim lag dump'!RC) -> 0 | AH29: =IF(LOWER(Basis)="ibnp",'paid claim lag dump'!RC,'reported claim lag dump'!RC) -> 0 | AI29: =IF(LOWER(Basis)="ibnp",'paid claim lag dump'!RC,'reported claim lag dump'!RC) -> 0 | AJ29: =IF(LOWER(Basis)="ibnp",'paid claim lag dump'!RC,'reported claim lag dump'!RC) -> 0 | AK29: =IF(LOWER(Basis)="ibnp",'paid claim lag dump'!RC,'reported claim lag dump'!RC) -> 0 | AL29: =IF(LOWER(Basis)="ibnp",'paid claim lag dump'!RC,'reported claim lag dump'!RC) -> 0
B30: ='general dump'!RC -> 2000-11-01T00:00:00.000 | C30: =IF(LOWER(Basis)="ibnp",'paid claim lag dump'!RC,'reported claim lag dump'!RC) -> 19627 | D30: =IF(LOWER(Basis)="ibnp",'paid claim lag dump'!RC,'reported claim lag dump'!RC) -> 78051 | E30: =IF(LOWER(Basis)="ibnp",'paid claim lag dump'!RC,'reported claim lag dump'!RC) -> 32446 | F30: =IF(LOWER(Basis)="ibnp",'paid claim lag dump'!RC,'reported claim lag dump'!RC) -> 30039 | G30: =IF(LOWER(Basis)="ibnp",'paid claim lag dump'!RC,'reported claim lag dump'!RC) -> 3104 | H30: =IF(LOWER(Basis)="ibnp",'paid claim lag dump'!RC,'reported claim lag dump'!RC) -> 8621 | I30: =IF(LOWER(Basis)="ibnp",'paid claim lag dump'!RC,'reported claim lag dump'!RC) -> 1405 | J30: =IF(LOWER(Basis)="ibnp",'paid claim lag dump'!RC,'reported claim lag dump'!RC) -> 3535 | K30: =IF(LOWER(Basis)="ibnp",'paid claim lag dump'!RC,'reported claim lag dump'!RC) -> 707 | L30: =IF(LOWER(Basis)="ibnp",'paid claim lag dump'!RC,'reported claim lag dump'!RC) -> 57 | M30: =IF(LOWER(Basis)="ibnp",'paid claim lag dump'!RC,'reported claim lag dump'!RC) -> 692 | N30: =IF(LOWER(Basis)="ibnp",'paid claim lag dump'!RC,'reported claim lag dump'!RC) -> 229 | O30: =IF(LOWER(Basis)="ibnp",'paid claim lag dump'!RC,'reported claim lag dump'!RC) -> 3279 | P30: =IF(LOWER(Basis)="ibnp",'paid claim lag dump'!RC,'reported claim lag dump'!RC) -> 40 | Q30: =IF(LOWER(Basis)="ibnp",'paid claim lag dump'!RC,'reported claim lag dump'!RC) -> 328 | R30: =IF(LOWER(Basis)="ibnp",'paid claim lag dump'!RC,'reported claim lag dump'!RC) -> 415 | S30: =IF(LOWER(Basis)="ibnp",'paid claim lag dump'!RC,'reported claim lag dump'!RC) -> 0 | T30: =IF(LOWER(Basis)="ibnp",'paid claim lag dump'!RC,'reported claim lag dump'!RC) -> 734 | U30: =IF(LOWER(Basis)="ibnp",'paid claim lag dump'!RC,'reported claim lag dump'!RC) -> 0 | V30: =IF(LOWER(Basis)="ibnp",'paid claim lag dump'!RC,'reported claim lag dump'!RC) -> 0 | W30: =IF(LOWER(Basis)="ibnp",'paid claim lag dump'!RC,'reported claim lag dump'!RC) -> 0 | X30: =IF(LOWER(Basis)="ibnp",'paid claim lag dump'!RC,'reported claim lag dump'!RC) -> 0 | Y30: =IF(LOWER(Basis)="ibnp",'paid claim lag dump'!RC,'reported claim lag dump'!RC) -> 0 | Z30: =IF(LOWER(Basis)="ibnp",'paid claim lag dump'!RC,'reported claim lag dump'!RC) -> 0 | AA30: =IF(LOWER(Basis)="ibnp",'paid claim lag dump'!RC,'reported claim lag dump'!RC) -> 0 | AB30: =IF(LOWER(Basis)="ibnp",'paid claim lag dump'!RC,'reported claim lag dump'!RC) -> 0 | AC30: =IF(LOWER(Basis)="ibnp",'paid claim lag dump'!RC,'reported claim lag dump'!RC) -> 0 | AD30: =IF(LOWER(Basis)="ibnp",'paid claim lag dump'!RC,'reported claim lag dump'!RC) -> 0 | AE30: =IF(LOWER(Basis)="ibnp",'paid claim lag dump'!RC,'reported claim lag dump'!RC) -> 0 | AF30: =IF(LOWER(Basis)="ibnp",'paid claim lag dump'!RC,'reported claim lag dump'!RC) -> 0 | AG30: =IF(LOWER(Basis)="ibnp",'paid claim lag dump'!RC,'reported claim lag dump'!RC) -> 0 | AH30: =IF(LOWER(Basis)="ibnp",'paid claim lag dump'!RC,'reported claim lag dump'!RC) -> 0 | AI30: =IF(LOWER(Basis)="ibnp",'paid claim lag dump'!RC,'reported claim lag dump'!RC) -> 0 | AJ30: =IF(LOWER(Basis)="ibnp",'paid claim lag dump'!RC,'reported claim lag dump'!RC) -> 0 | AK30: =IF(LOWER(Basis)="ibnp",'paid claim lag dump'!RC,'reported claim lag dump'!RC) -> 0 | AL30: =IF(LOWER(Basis)="ibnp",'paid claim lag dump'!RC,'reported claim lag dump'!RC) -> 0
B31: ='general dump'!RC -> 2000-12-01T00:00:00.000 | C31: =IF(LOWER(Basis)="ibnp",'paid claim lag dump'!RC,'reported claim lag dump'!RC) -> 5402 | D31: =IF(LOWER(Basis)="ibnp",'paid claim lag dump'!RC,'reported claim lag dump'!RC) -> 16943 | E31: =IF(LOWER(Basis)="ibnp",'paid claim lag dump'!RC,'reported claim lag dump'!RC) -> 34607 | F31: =IF(LOWER(Basis)="ibnp",'paid claim lag dump'!RC,'reported claim lag dump'!RC) -> 6988 | G31: =IF(LOWER(Basis)="ibnp",'paid claim lag dump'!RC,'reported claim lag dump'!RC) -> 3602 | H31: =IF(LOWER(Basis)="ibnp",'paid claim lag dump'!RC,'reported claim lag dump'!RC) -> 2116 | I31: =IF(LOWER(Basis)="ibnp",'paid claim lag dump'!RC,'reported claim lag dump'!RC) -> 7375 | J31: =IF(LOWER(Basis)="ibnp",'paid claim lag dump'!RC,'reported claim lag dump'!RC) -> 474 | K31: =IF(LOWER(Basis)="ibnp",'paid claim lag dump'!RC,'reported claim lag dump'!RC) -> 3162 | L31: =IF(LOWER(Basis)="ibnp",'paid claim lag dump'!RC,'reported claim lag dump'!RC) -> 1388 | M31: =IF(LOWER(Basis)="ibnp",'paid claim lag dump'!RC,'reported claim lag dump'!RC) -> 160 | N31: =IF(LOWER(Basis)="ibnp",'paid claim lag dump'!RC,'reported claim lag dump'!RC) -> 284 | O31: =IF(LOWER(Basis)="ibnp",'paid claim lag dump'!RC,'reported claim lag dump'!RC) -> 406 | P31: =IF(LOWER(Basis)="ibnp",'paid claim lag dump'!RC,'reported claim lag dump'!RC) -> 788 | Q31: =IF(LOWER(Basis)="ibnp",'paid claim lag dump'!RC,'reported claim lag dump'!RC) -> 0 | R31: =IF(LOWER(Basis)="ibnp",'paid claim lag dump'!RC,'reported claim lag dump'!RC) -> 0 | S31: =IF(LOWER(Basis)="ibnp",'paid claim lag dump'!RC,'reported claim lag dump'!RC) -> 0 | T31: =IF(LOWER(Basis)="ibnp",'paid claim lag dump'!RC,'reported claim lag dump'!RC) -> 0 | U31: =IF(LOWER(Basis)="ibnp",'paid claim lag dump'!RC,'reported claim lag dump'!RC) -> 0 | V31: =IF(LOWER(Basis)="ibnp",'paid claim lag dump'!RC,'reported claim lag dump'!RC) -> 0 | W31: =IF(LOWER(Basis)="ibnp",'paid claim lag dump'!RC,'reported claim lag dump'!RC) -> 0 | X31: =IF(LOWER(Basis)="ibnp",'paid claim lag dump'!RC,'reported claim lag dump'!RC) -> 0 | Y31: =IF(LOWER(Basis)="ibnp",'paid claim lag dump'!RC,'reported claim lag dump'!RC) -> 0 | Z31: =IF(LOWER(Basis)="ibnp",'paid claim lag dump'!RC,'reported claim lag dump'!RC) -> 0 | AA31: =IF(LOWER(Basis)="ibnp",'paid claim lag dump'!RC,'reported claim lag dump'!RC) -> 0 | AB31: =IF(LOWER(Basis)="ibnp",'paid claim lag dump'!RC,'reported claim lag dump'!RC) -> 0 | AC31: =IF(LOWER(Basis)="ibnp",'paid claim lag dump'!RC,'reported claim lag dump'!RC) -> 0 | AD31: =IF(LOWER(Basis)="ibnp",'paid claim lag dump'!RC,'reported claim lag dump'!RC) -> 0 | AE31: =IF(LOWER(Basis)="ibnp",'paid claim lag dump'!RC,'reported claim lag dump'!RC) -> 0 | AF31: =IF(LOWER(Basis)="ibnp",'paid claim lag dump'!RC,'reported claim lag dump'!RC) -> 0 | AG31: =IF(LOWER(Basis)="ibnp",'paid claim lag dump'!RC,'reported claim lag dump'!RC) -> 0 | AH31: =IF(LOWER(Basis)="ibnp",'paid claim lag dump'!RC,'reported claim lag dump'!RC) -> 0 | AI31: =IF(LOWER(Basis)="ibnp",'paid claim lag dump'!RC,'reported claim lag dump'!RC) -> 0 | AJ31: =IF(LOWER(Basis)="ibnp",'paid claim lag dump'!RC,'reported claim lag dump'!RC) -> 0 | AK31: =IF(LOWER(Basis)="ibnp",'paid claim lag dump'!RC,'reported claim lag dump'!RC) -> 0 | AL31: =IF(LOWER(Basis)="ibnp",'paid claim lag dump'!RC,'reported claim lag dump'!RC) -> 0
B32: ='general dump'!RC -> 2001-01-01T00:00:00.000 | C32: =IF(LOWER(Basis)="ibnp",'paid claim lag dump'!RC,'reported claim lag dump'!RC) -> 15456 | D32: =IF(LOWER(Basis)="ibnp",'paid claim lag dump'!RC,'reported claim lag dump'!RC) -> 19047 | E32: =IF(LOWER(Basis)="ibnp",'paid claim lag dump'!RC,'reported claim lag dump'!RC) -> 26813 | F32: =IF(LOWER(Basis)="ibnp",'paid claim lag dump'!RC,'reported claim lag dump'!RC) -> 7995 | G32: =IF(LOWER(Basis)="ibnp",'paid claim lag dump'!RC,'reported claim lag dump'!RC) -> 520 | H32: =IF(LOWER(Basis)="ibnp",'paid claim lag dump'!RC,'reported claim lag dump'!RC) -> 1792 | I32: =IF(LOWER(Basis)="ibnp",'paid claim lag dump'!RC,'reported claim lag dump'!RC) -> 5685 | J32: =IF(LOWER(Basis)="ibnp",'paid claim lag dump'!RC,'reported claim lag dump'!RC) -> 405 | K32: =IF(LOWER(Basis)="ibnp",'paid claim lag dump'!RC,'reported claim lag dump'!RC) -> 4138 | L32: =IF(LOWER(Basis)="ibnp",'paid claim lag dump'!RC,'reported claim lag dump'!RC) -> 206 | M32: =IF(LOWER(Basis)="ibnp",'paid claim lag dump'!RC,'reported claim lag dump'!RC) -> 360 | N32: =IF(LOWER(Basis)="ibnp",'paid claim lag dump'!RC,'reported claim lag dump'!RC) -> 188 | O32: =IF(LOWER(Basis)="ibnp",'paid claim lag dump'!RC,'reported claim lag dump'!RC) -> 302 | P32: =IF(LOWER(Basis)="ibnp",'paid claim lag dump'!RC,'reported claim lag dump'!RC) -> 788 | Q32: =IF(LOWER(Basis)="ibnp",'paid claim lag dump'!RC,'reported claim lag dump'!RC) -> 0 | R32: =IF(LOWER(Basis)="ibnp",'paid claim lag dump'!RC,'reported claim lag dump'!RC) -> 0 | S32: =IF(LOWER(Basis)="ibnp",'paid claim lag dump'!RC,'reported claim lag dump'!RC) -> 0 | T32: =IF(LOWER(Basis)="ibnp",'paid claim lag dump'!RC,'reported claim lag dump'!RC) -> 0 | U32: =IF(LOWER(Basis)="ibnp",'paid claim lag dump'!RC,'reported claim lag dump'!RC) -> 0 | V32: =IF(LOWER(Basis)="ibnp",'paid claim lag dump'!RC,'reported claim lag dump'!RC) -> 0 | W32: =IF(LOWER(Basis)="ibnp",'paid claim lag dump'!RC,'reported claim lag dump'!RC) -> 0 | X32: =IF(LOWER(Basis)="ibnp",'paid claim lag dump'!RC,'reported claim lag dump'!RC) -> 0 | Y32: =IF(LOWER(Basis)="ibnp",'paid claim lag dump'!RC,'reported claim lag dump'!RC) -> 0 | Z32: =IF(LOWER(Basis)="ibnp",'paid claim lag dump'!RC,'reported claim lag dump'!RC) -> 0 | AA32: =IF(LOWER(Basis)="ibnp",'paid claim lag dump'!RC,'reported claim lag dump'!RC) -> 0 | AB32: =IF(LOWER(Basis)="ibnp",'paid claim lag dump'!RC,'reported claim lag dump'!RC) -> 0 | AC32: =IF(LOWER(Basis)="ibnp",'paid claim lag dump'!RC,'reported claim lag dump'!RC) -> 0 | AD32: =IF(LOWER(Basis)="ibnp",'paid claim lag dump'!RC,'reported claim lag dump'!RC) -> 0 | AE32: =IF(LOWER(Basis)="ibnp",'paid claim lag dump'!RC,'reported claim lag dump'!RC) -> 0 | AF32: =IF(LOWER(Basis)="ibnp",'paid claim lag dump'!RC,'reported claim lag dump'!RC) -> 0 | AG32: =IF(LOWER(Basis)="ibnp",'paid claim lag dump'!RC,'reported claim lag dump'!RC) -> 0 | AH32: =IF(LOWER(Basis)="ibnp",'paid claim lag dump'!RC,'reported claim lag dump'!RC) -> 0 | AI32: =IF(LOWER(Basis)="ibnp",'paid claim lag dump'!RC,'reported claim lag dump'!RC) -> 0 | AJ32: =IF(LOWER(Basis)="ibnp",'paid claim lag dump'!RC,'reported claim lag dump'!RC) -> 0 | AK32: =IF(LOWER(Basis)="ibnp",'paid claim lag dump'!RC,'reported claim lag dump'!RC) -> 0 | AL32: =IF(LOWER(Basis)="ibnp",'paid claim lag dump'!RC,'reported claim lag dump'!RC) -> 0
B33: ='general dump'!RC -> 2001-02-01T00:00:00.000 | C33: =IF(LOWER(Basis)="ibnp",'paid claim lag dump'!RC,'reported claim lag dump'!RC) -> 544 | D33: =IF(LOWER(Basis)="ibnp",'paid claim lag dump'!RC,'reported claim lag dump'!RC) -> 16998 | E33: =IF(LOWER(Basis)="ibnp",'paid claim lag dump'!RC,'reported claim lag dump'!RC) -> 37793 | F33: =IF(LOWER(Basis)="ibnp",'paid claim lag dump'!RC,'reported claim lag dump'!RC) -> 49731 | G33: =IF(LOWER(Basis)="ibnp",'paid claim lag dump'!RC,'reported claim lag dump'!RC) -> 28448 | H33: =IF(LOWER(Basis)="ibnp",'paid claim lag dump'!RC,'reported claim lag dump'!RC) -> 2175 | I33: =IF(LOWER(Basis)="ibnp",'paid claim lag dump'!RC,'reported claim lag dump'!RC) -> 1814 | J33: =IF(LOWER(Basis)="ibnp",'paid claim lag dump'!RC,'reported claim lag dump'!RC) -> 333 | K33: =IF(LOWER(Basis)="ibnp",'paid claim lag dump'!RC,'reported claim lag dump'!RC) -> 718 | L33: =IF(LOWER(Basis)="ibnp",'paid claim lag dump'!RC,'reported claim lag dump'!RC) -> 1341 | M33: =IF(LOWER(Basis)="ibnp",'paid claim lag dump'!RC,'reported claim lag dump'!RC) -> 64 | N33: =IF(LOWER(Basis)="ibnp",'paid claim lag dump'!RC,'reported claim lag dump'!RC) -> 28 | O33: =IF(LOWER(Basis)="ibnp",'paid claim lag dump'!RC,'reported claim lag dump'!RC) -> 0 | P33: =IF(LOWER(Basis)="ibnp",'paid claim lag dump'!RC,'reported claim lag dump'!RC) -> 0 | Q33: =IF(LOWER(Basis)="ibnp",'paid claim lag dump'!RC,'reported claim lag dump'!RC) -> 256 | R33: =IF(LOWER(Basis)="ibnp",'paid claim lag dump'!RC,'reported claim lag dump'!RC) -> 108 | S33: =IF(LOWER(Basis)="ibnp",'paid claim lag dump'!RC,'reported claim lag dump'!RC) -> 70 | T33: =IF(LOWER(Basis)="ibnp",'paid claim lag dump'!RC,'reported claim lag dump'!RC) -> 0 | U33: =IF(LOWER(Basis)="ibnp",'paid claim lag dump'!RC,'reported claim lag dump'!RC) -> 0 | V33: =IF(LOWER(Basis)="ibnp",'paid claim lag dump'!RC,'reported claim lag dump'!RC) -> 0 | W33: =IF(LOWER(Basis)="ibnp",'paid claim lag dump'!RC,'reported claim lag dump'!RC) -> 0 | X33: =IF(LOWER(Basis)="ibnp",'paid claim lag dump'!RC,'reported claim lag dump'!RC) -> 0 | Y33: =IF(LOWER(Basis)="ibnp",'paid claim lag dump'!RC,'reported claim lag dump'!RC) -> 0 | Z33: =IF(LOWER(Basis)="ibnp",'paid claim lag dump'!RC,'reported claim lag dump'!RC) -> 0 | AA33: =IF(LOWER(Basis)="ibnp",'paid claim lag dump'!RC,'reported claim lag dump'!RC) -> 0 | AB33: =IF(LOWER(Basis)="ibnp",'paid claim lag dump'!RC,'reported claim lag dump'!RC) -> 0 | AC33: =IF(LOWER(Basis)="ibnp",'paid claim lag dump'!RC,'reported claim lag dump'!RC) -> 0 | AD33: =IF(LOWER(Basis)="ibnp",'paid claim lag dump'!RC,'reported claim lag dump'!RC) -> 0 | AE33: =IF(LOWER(Basis)="ibnp",'paid claim lag dump'!RC,'reported claim lag dump'!RC) -> 0 | AF33: =IF(LOWER(Basis)="ibnp",'paid claim lag dump'!RC,'reported claim lag dump'!RC) -> 0 | AG33: =IF(LOWER(Basis)="ibnp",'paid claim lag dump'!RC,'reported claim lag dump'!RC) -> 0 | AH33: =IF(LOWER(Basis)="ibnp",'paid claim lag dump'!RC,'reported claim lag dump'!RC) -> 0 | AI33: =IF(LOWER(Basis)="ibnp",'paid claim lag dump'!RC,'reported claim lag dump'!RC) -> 0 | AJ33: =IF(LOWER(Basis)="ibnp",'paid claim lag dump'!RC,'reported claim lag dump'!RC) -> 0 | AK33: =IF(LOWER(Basis)="ibnp",'paid claim lag dump'!RC,'reported claim lag dump'!RC) -> 0 | AL33: =IF(LOWER(Basis)="ibnp",'paid claim lag dump'!RC,'reported claim lag dump'!RC) -> 0
B34: ='general dump'!RC -> 2001-03-01T00:00:00.000 | C34: =IF(LOWER(Basis)="ibnp",'paid claim lag dump'!RC,'reported claim lag dump'!RC) -> 8442 | D34: =IF(LOWER(Basis)="ibnp",'paid claim lag dump'!RC,'reported claim lag dump'!RC) -> 51447 | E34: =IF(LOWER(Basis)="ibnp",'paid claim lag dump'!RC,'reported claim lag dump'!RC) -> 16192 | F34: =IF(LOWER(Basis)="ibnp",'paid claim lag dump'!RC,'reported claim lag dump'!RC) -> 58463 | G34: =IF(LOWER(Basis)="ibnp",'paid claim lag dump'!RC,'reported claim lag dump'!RC) -> 1725 | H34: =IF(LOWER(Basis)="ibnp",'paid claim lag dump'!RC,'reported claim lag dump'!RC) -> 1611 | I34: =IF(LOWER(Basis)="ibnp",'paid claim lag dump'!RC,'reported claim lag dump'!RC) -> 455 | J34: =IF(LOWER(Basis)="ibnp",'paid claim lag dump'!RC,'reported claim lag dump'!RC) -> 881 | K34: =IF(LOWER(Basis)="ibnp",'paid claim lag dump'!RC,'reported claim lag dump'!RC) -> 679 | L34: =IF(LOWER(Basis)="ibnp",'paid claim lag dump'!RC,'reported claim lag dump'!RC) -> 64 | M34: =IF(LOWER(Basis)="ibnp",'paid claim lag dump'!RC,'reported claim lag dump'!RC) -> 28 | N34: =IF(LOWER(Basis)="ibnp",'paid claim lag dump'!RC,'reported claim lag dump'!RC) -> 0 | O34: =IF(LOWER(Basis)="ibnp",'paid claim lag dump'!RC,'reported claim lag dump'!RC) -> 0 | P34: =IF(LOWER(Basis)="ibnp",'paid claim lag dump'!RC,'reported claim lag dump'!RC) -> 0 | Q34: =IF(LOWER(Basis)="ibnp",'paid claim lag dump'!RC,'reported claim lag dump'!RC) -> 256 | R34: =IF(LOWER(Basis)="ibnp",'paid claim lag dump'!RC,'reported claim lag dump'!RC) -> 108 | S34: =IF(LOWER(Basis)="ibnp",'paid claim lag dump'!RC,'reported claim lag dump'!RC) -> 70 | T34: =IF(LOWER(Basis)="ibnp",'paid claim lag dump'!RC,'reported claim lag dump'!RC) -> 0 | U34: =IF(LOWER(Basis)="ibnp",'paid claim lag dump'!RC,'reported claim lag dump'!RC) -> 0 | V34: =IF(LOWER(Basis)="ibnp",'paid claim lag dump'!RC,'reported claim lag dump'!RC) -> 0 | W34: =IF(LOWER(Basis)="ibnp",'paid claim lag dump'!RC,'reported claim lag dump'!RC) -> 0 | X34: =IF(LOWER(Basis)="ibnp",'paid claim lag dump'!RC,'reported claim lag dump'!RC) -> 0 | Y34: =IF(LOWER(Basis)="ibnp",'paid claim lag dump'!RC,'reported claim lag dump'!RC) -> 0 | Z34: =IF(LOWER(Basis)="ibnp",'paid claim lag dump'!RC,'reported claim lag dump'!RC) -> 0 | AA34: =IF(LOWER(Basis)="ibnp",'paid claim lag dump'!RC,'reported claim lag dump'!RC) -> 0 | AB34: =IF(LOWER(Basis)="ibnp",'paid claim lag dump'!RC,'reported claim lag dump'!RC) -> 0 | AC34: =IF(LOWER(Basis)="ibnp",'paid claim lag dump'!RC,'reported claim lag dump'!RC) -> 0 | AD34: =IF(LOWER(Basis)="ibnp",'paid claim lag dump'!RC,'reported claim lag dump'!RC) -> 0 | AE34: =IF(LOWER(Basis)="ibnp",'paid claim lag dump'!RC,'reported claim lag dump'!RC) -> 0 | AF34: =IF(LOWER(Basis)="ibnp",'paid claim lag dump'!RC,'reported claim lag dump'!RC) -> 0 | AG34: =IF(LOWER(Basis)="ibnp",'paid claim lag dump'!RC,'reported claim lag dump'!RC) -> 0 | AH34: =IF(LOWER(Basis)="ibnp",'paid claim lag dump'!RC,'reported claim lag dump'!RC) -> 0 | AI34: =IF(LOWER(Basis)="ibnp",'paid claim lag dump'!RC,'reported claim lag dump'!RC) -> 0 | AJ34: =IF(LOWER(Basis)="ibnp",'paid claim lag dump'!RC,'reported claim lag dump'!RC) -> 0 | AK34: =IF(LOWER(Basis)="ibnp",'paid claim lag dump'!RC,'reported claim lag dump'!RC) -> 0 | AL34: =IF(LOWER(Basis)="ibnp",'paid claim lag dump'!RC,'reported claim lag dump'!RC) -> 0
B35: ='general dump'!RC -> 2001-04-01T00:00:00.000 | C35: =IF(LOWER(Basis)="ibnp",'paid claim lag dump'!RC,'reported claim lag dump'!RC) -> 1180 | D35: =IF(LOWER(Basis)="ibnp",'paid claim lag dump'!RC,'reported claim lag dump'!RC) -> 33425 | E35: =IF(LOWER(Basis)="ibnp",'paid claim lag dump'!RC,'reported claim lag dump'!RC) -> 35398 | F35: =IF(LOWER(Basis)="ibnp",'paid claim lag dump'!RC,'reported claim lag dump'!RC) -> 24109 | G35: =IF(LOWER(Basis)="ibnp",'paid claim lag dump'!RC,'reported claim lag dump'!RC) -> 7879 | H35: =IF(LOWER(Basis)="ibnp",'paid claim lag dump'!RC,'reported claim lag dump'!RC) -> 9007 | I35: =IF(LOWER(Basis)="ibnp",'paid claim lag dump'!RC,'reported claim lag dump'!RC) -> 1278 | J35: =IF(LOWER(Basis)="ibnp",'paid claim lag dump'!RC,'reported claim lag dump'!RC) -> 1250 | K35: =IF(LOWER(Basis)="ibnp",'paid claim lag dump'!RC,'reported claim lag dump'!RC) -> 572 | L35: =IF(LOWER(Basis)="ibnp",'paid claim lag dump'!RC,'reported claim lag dump'!RC) -> 253 | M35: =IF(LOWER(Basis)="ibnp",'paid claim lag dump'!RC,'reported claim lag dump'!RC) -> 0 | N35: =IF(LOWER(Basis)="ibnp",'paid claim lag dump'!RC,'reported claim lag dump'!RC) -> 0 | O35: =IF(LOWER(Basis)="ibnp",'paid claim lag dump'!RC,'reported claim lag dump'!RC) -> -247 | P35: =IF(LOWER(Basis)="ibnp",'paid claim lag dump'!RC,'reported claim lag dump'!RC) -> 266 | Q35: =IF(LOWER(Basis)="ibnp",'paid claim lag dump'!RC,'reported claim lag dump'!RC) -> 7809 | R35: =IF(LOWER(Basis)="ibnp",'paid claim lag dump'!RC,'reported claim lag dump'!RC) -> 0 | S35: =IF(LOWER(Basis)="ibnp",'paid claim lag dump'!RC,'reported claim lag dump'!RC) -> 0 | T35: =IF(LOWER(Basis)="ibnp",'paid claim lag dump'!RC,'reported claim lag dump'!RC) -> 0 | U35: =IF(LOWER(Basis)="ibnp",'paid claim lag dump'!RC,'reported claim lag dump'!RC) -> 0 | V35: =IF(LOWER(Basis)="ibnp",'paid claim lag dump'!RC,'reported claim lag dump'!RC) -> 0 | W35: =IF(LOWER(Basis)="ibnp",'paid claim lag dump'!RC,'reported claim lag dump'!RC) -> 0 | X35: =IF(LOWER(Basis)="ibnp",'paid claim lag dump'!RC,'reported claim lag dump'!RC) -> 0 | Y35: =IF(LOWER(Basis)="ibnp",'paid claim lag dump'!RC,'reported claim lag dump'!RC) -> 0 | Z35: =IF(LOWER(Basis)="ibnp",'paid claim lag dump'!RC,'reported claim lag dump'!RC) -> 0 | AA35: =IF(LOWER(Basis)="ibnp",'paid claim lag dump'!RC,'reported claim lag dump'!RC) -> 0 | AB35: =IF(LOWER(Basis)="ibnp",'paid claim lag dump'!RC,'reported claim lag dump'!RC) -> 0 | AC35: =IF(LOWER(Basis)="ibnp",'paid claim lag dump'!RC,'reported claim lag dump'!RC) -> 0 | AD35: =IF(LOWER(Basis)="ibnp",'paid claim lag dump'!RC,'reported claim lag dump'!RC) -> 0 | AE35: =IF(LOWER(Basis)="ibnp",'paid claim lag dump'!RC,'reported claim lag dump'!RC) -> 0 | AF35: =IF(LOWER(Basis)="ibnp",'paid claim lag dump'!RC,'reported claim lag dump'!RC) -> 0 | AG35: =IF(LOWER(Basis)="ibnp",'paid claim lag dump'!RC,'reported claim lag dump'!RC) -> 0 | AH35: =IF(LOWER(Basis)="ibnp",'paid claim lag dump'!RC,'reported claim lag dump'!RC) -> 0 | AI35: =IF(LOWER(Basis)="ibnp",'paid claim lag dump'!RC,'reported claim lag dump'!RC) -> 0 | AJ35: =IF(LOWER(Basis)="ibnp",'paid claim lag dump'!RC,'reported claim lag dump'!RC) -> 0 | AK35: =IF(LOWER(Basis)="ibnp",'paid claim lag dump'!RC,'reported claim lag dump'!RC) -> 0 | AL35: =IF(LOWER(Basis)="ibnp",'paid claim lag dump'!RC,'reported claim lag dump'!RC) -> 0
B36: ='general dump'!RC -> 2001-05-01T00:00:00.000 | C36: =IF(LOWER(Basis)="ibnp",'paid claim lag dump'!RC,'reported claim lag dump'!RC) -> 24336 | D36: =IF(LOWER(Basis)="ibnp",'paid claim lag dump'!RC,'reported claim lag dump'!RC) -> 38853 | E36: =IF(LOWER(Basis)="ibnp",'paid claim lag dump'!RC,'reported claim lag dump'!RC) -> 23133 | F36: =IF(LOWER(Basis)="ibnp",'paid claim lag dump'!RC,'reported claim lag dump'!RC) -> 13306 | G36: =IF(LOWER(Basis)="ibnp",'paid claim lag dump'!RC,'reported claim lag dump'!RC) -> 5789 | H36: =IF(LOWER(Basis)="ibnp",'paid claim lag dump'!RC,'reported claim lag dump'!RC) -> 5946 | I36: =IF(LOWER(Basis)="ibnp",'paid claim lag dump'!RC,'reported claim lag dump'!RC) -> 1041 | J36: =IF(LOWER(Basis)="ibnp",'paid claim lag dump'!RC,'reported claim lag dump'!RC) -> 1381 | K36: =IF(LOWER(Basis)="ibnp",'paid claim lag dump'!RC,'reported claim lag dump'!RC) -> 313 | L36: =IF(LOWER(Basis)="ibnp",'paid claim lag dump'!RC,'reported claim lag dump'!RC) -> 253 | M36: =IF(LOWER(Basis)="ibnp",'paid claim lag dump'!RC,'reported claim lag dump'!RC) -> 0 | N36: =IF(LOWER(Basis)="ibnp",'paid claim lag dump'!RC,'reported claim lag dump'!RC) -> 0 | O36: =IF(LOWER(Basis)="ibnp",'paid claim lag dump'!RC,'reported claim lag dump'!RC) -> -247 | P36: =IF(LOWER(Basis)="ibnp",'paid claim lag dump'!RC,'reported claim lag dump'!RC) -> 266 | Q36: =IF(LOWER(Basis)="ibnp",'paid claim lag dump'!RC,'reported claim lag dump'!RC) -> 7809 | R36: =IF(LOWER(Basis)="ibnp",'paid claim lag dump'!RC,'reported claim lag dump'!RC) -> 0 | S36: =IF(LOWER(Basis)="ibnp",'paid claim lag dump'!RC,'reported claim lag dump'!RC) -> 0 | T36: =IF(LOWER(Basis)="ibnp",'paid claim lag dump'!RC,'reported claim lag dump'!RC) -> 0 | U36: =IF(LOWER(Basis)="ibnp",'paid claim lag dump'!RC,'reported claim lag dump'!RC) -> 0 | V36: =IF(LOWER(Basis)="ibnp",'paid claim lag dump'!RC,'reported claim lag dump'!RC) -> 0 | W36: =IF(LOWER(Basis)="ibnp",'paid claim lag dump'!RC,'reported claim lag dump'!RC) -> 0 | X36: =IF(LOWER(Basis)="ibnp",'paid claim lag dump'!RC,'reported claim lag dump'!RC) -> 0 | Y36: =IF(LOWER(Basis)="ibnp",'paid claim lag dump'!RC,'reported claim lag dump'!RC) -> 0 | Z36: =IF(LOWER(Basis)="ibnp",'paid claim lag dump'!RC,'reported claim lag dump'!RC) -> 0 | AA36: =IF(LOWER(Basis)="ibnp",'paid claim lag dump'!RC,'reported claim lag dump'!RC) -> 0 | AB36: =IF(LOWER(Basis)="ibnp",'paid claim lag dump'!RC,'reported claim lag dump'!RC) -> 0 | AC36: =IF(LOWER(Basis)="ibnp",'paid claim lag dump'!RC,'reported claim lag dump'!RC) -> 0 | AD36: =IF(LOWER(Basis)="ibnp",'paid claim lag dump'!RC,'reported claim lag dump'!RC) -> 0 | AE36: =IF(LOWER(Basis)="ibnp",'paid claim lag dump'!RC,'reported claim lag dump'!RC) -> 0 | AF36: =IF(LOWER(Basis)="ibnp",'paid claim lag dump'!RC,'reported claim lag dump'!RC) -> 0 | AG36: =IF(LOWER(Basis)="ibnp",'paid claim lag dump'!RC,'reported claim lag dump'!RC) -> 0 | AH36: =IF(LOWER(Basis)="ibnp",'paid claim lag dump'!RC,'reported claim lag dump'!RC) -> 0 | AI36: =IF(LOWER(Basis)="ibnp",'paid claim lag dump'!RC,'reported claim lag dump'!RC) -> 0 | AJ36: =IF(LOWER(Basis)="ibnp",'paid claim lag dump'!RC,'reported claim lag dump'!RC) -> 0 | AK36: =IF(LOWER(Basis)="ibnp",'paid claim lag dump'!RC,'reported claim lag dump'!RC) -> 0 | AL36: =IF(LOWER(Basis)="ibnp",'paid claim lag dump'!RC,'reported claim lag dump'!RC) -> 0
B37: ='general dump'!RC -> 2001-06-01T00:00:00.000 | C37: =IF(LOWER(Basis)="ibnp",'paid claim lag dump'!RC,'reported claim lag dump'!RC) -> 0 | D37: =IF(LOWER(Basis)="ibnp",'paid claim lag dump'!RC,'reported claim lag dump'!RC) -> 0 | E37: =IF(LOWER(Basis)="ibnp",'paid claim lag dump'!RC,'reported claim lag dump'!RC) -> 0 | F37: =IF(LOWER(Basis)="ibnp",'paid claim lag dump'!RC,'reported claim lag dump'!RC) -> 0 | G37: =IF(LOWER(Basis)="ibnp",'paid claim lag dump'!RC,'reported claim lag dump'!RC) -> 0 | H37: =IF(LOWER(Basis)="ibnp",'paid claim lag dump'!RC,'reported claim lag dump'!RC) -> 0 | I37: =IF(LOWER(Basis)="ibnp",'paid claim lag dump'!RC,'reported claim lag dump'!RC) -> 0 | J37: =IF(LOWER(Basis)="ibnp",'paid claim lag dump'!RC,'reported claim lag dump'!RC) -> 0 | K37: =IF(LOWER(Basis)="ibnp",'paid claim lag dump'!RC,'reported claim lag dump'!RC) -> 0 | L37: =IF(LOWER(Basis)="ibnp",'paid claim lag dump'!RC,'reported claim lag dump'!RC) -> 0 | M37: =IF(LOWER(Basis)="ibnp",'paid claim lag dump'!RC,'reported claim lag dump'!RC) -> 0 | N37: =IF(LOWER(Basis)="ibnp",'paid claim lag dump'!RC,'reported claim lag dump'!RC) -> 0 | O37: =IF(LOWER(Basis)="ibnp",'paid claim lag dump'!RC,'reported claim lag dump'!RC) -> 0 | P37: =IF(LOWER(Basis)="ibnp",'paid claim lag dump'!RC,'reported claim lag dump'!RC) -> 0 | Q37: =IF(LOWER(Basis)="ibnp",'paid claim lag dump'!RC,'reported claim lag dump'!RC) -> 0 | R37: =IF(LOWER(Basis)="ibnp",'paid claim lag dump'!RC,'reported claim lag dump'!RC) -> 0 | S37: =IF(LOWER(Basis)="ibnp",'paid claim lag dump'!RC,'reported claim lag dump'!RC) -> 0 | T37: =IF(LOWER(Basis)="ibnp",'paid claim lag dump'!RC,'reported claim lag dump'!RC) -> 0 | U37: =IF(LOWER(Basis)="ibnp",'paid claim lag dump'!RC,'reported claim lag dump'!RC) -> 0 | V37: =IF(LOWER(Basis)="ibnp",'paid claim lag dump'!RC,'reported claim lag dump'!RC) -> 0 | W37: =IF(LOWER(Basis)="ibnp",'paid claim lag dump'!RC,'reported claim lag dump'!RC) -> 0 | X37: =IF(LOWER(Basis)="ibnp",'paid claim lag dump'!RC,'reported claim lag dump'!RC) -> 0 | Y37: =IF(LOWER(Basis)="ibnp",'paid claim lag dump'!RC,'reported claim lag dump'!RC) -> 0 | Z37: =IF(LOWER(Basis)="ibnp",'paid claim lag dump'!RC,'reported claim lag dump'!RC) -> 0 | AA37: =IF(LOWER(Basis)="ibnp",'paid claim lag dump'!RC,'reported claim lag dump'!RC) -> 0 | AB37: =IF(LOWER(Basis)="ibnp",'paid claim lag dump'!RC,'reported claim lag dump'!RC) -> 0 | AC37: =IF(LOWER(Basis)="ibnp",'paid claim lag dump'!RC,'reported claim lag dump'!RC) -> 0 | AD37: =IF(LOWER(Basis)="ibnp",'paid claim lag dump'!RC,'reported claim lag dump'!RC) -> 0 | AE37: =IF(LOWER(Basis)="ibnp",'paid claim lag dump'!RC,'reported claim lag dump'!RC) -> 0 | AF37: =IF(LOWER(Basis)="ibnp",'paid claim lag dump'!RC,'reported claim lag dump'!RC) -> 0 | AG37: =IF(LOWER(Basis)="ibnp",'paid claim lag dump'!RC,'reported claim lag dump'!RC) -> 0 | AH37: =IF(LOWER(Basis)="ibnp",'paid claim lag dump'!RC,'reported claim lag dump'!RC) -> 0 | AI37: =IF(LOWER(Basis)="ibnp",'paid claim lag dump'!RC,'reported claim lag dump'!RC) -> 0 | AJ37: =IF(LOWER(Basis)="ibnp",'paid claim lag dump'!RC,'reported claim lag dump'!RC) -> 0 | AK37: =IF(LOWER(Basis)="ibnp",'paid claim lag dump'!RC,'reported claim lag dump'!RC) -> 0 | AL37: =IF(LOWER(Basis)="ibnp",'paid claim lag dump'!RC,'reported claim lag dump'!RC) -> 0
B38: ='general dump'!RC -> 2001-07-01T00:00:00.000 | C38: =IF(LOWER(Basis)="ibnp",'paid claim lag dump'!RC,'reported claim lag dump'!RC) -> 0 | D38: =IF(LOWER(Basis)="ibnp",'paid claim lag dump'!RC,'reported claim lag dump'!RC) -> 0 | E38: =IF(LOWER(Basis)="ibnp",'paid claim lag dump'!RC,'reported claim lag dump'!RC) -> 0 | F38: =IF(LOWER(Basis)="ibnp",'paid claim lag dump'!RC,'reported claim lag dump'!RC) -> 0 | G38: =IF(LOWER(Basis)="ibnp",'paid claim lag dump'!RC,'reported claim lag dump'!RC) -> 0 | H38: =IF(LOWER(Basis)="ibnp",'paid claim lag dump'!RC,'reported claim lag dump'!RC) -> 0 | I38: =IF(LOWER(Basis)="ibnp",'paid claim lag dump'!RC,'reported claim lag dump'!RC) -> 0 | J38: =IF(LOWER(Basis)="ibnp",'paid claim lag dump'!RC,'reported claim lag dump'!RC) -> 0 | K38: =IF(LOWER(Basis)="ibnp",'paid claim lag dump'!RC,'reported claim lag dump'!RC) -> 0 | L38: =IF(LOWER(Basis)="ibnp",'paid claim lag dump'!RC,'reported claim lag dump'!RC) -> 0 | M38: =IF(LOWER(Basis)="ibnp",'paid claim lag dump'!RC,'reported claim lag dump'!RC) -> 0 | N38: =IF(LOWER(Basis)="ibnp",'paid claim lag dump'!RC,'reported claim lag dump'!RC) -> 0 | O38: =IF(LOWER(Basis)="ibnp",'paid claim lag dump'!RC,'reported claim lag dump'!RC) -> 0 | P38: =IF(LOWER(Basis)="ibnp",'paid claim lag dump'!RC,'reported claim lag dump'!RC) -> 0 | Q38: =IF(LOWER(Basis)="ibnp",'paid claim lag dump'!RC,'reported claim lag dump'!RC) -> 0 | R38: =IF(LOWER(Basis)="ibnp",'paid claim lag dump'!RC,'reported claim lag dump'!RC) -> 0 | S38: =IF(LOWER(Basis)="ibnp",'paid claim lag dump'!RC,'reported claim lag dump'!RC) -> 0 | T38: =IF(LOWER(Basis)="ibnp",'paid claim lag dump'!RC,'reported claim lag dump'!RC) -> 0 | U38: =IF(LOWER(Basis)="ibnp",'paid claim lag dump'!RC,'reported claim lag dump'!RC) -> 0 | V38: =IF(LOWER(Basis)="ibnp",'paid claim lag dump'!RC,'reported claim lag dump'!RC) -> 0 | W38: =IF(LOWER(Basis)="ibnp",'paid claim lag dump'!RC,'reported claim lag dump'!RC) -> 0 | X38: =IF(LOWER(Basis)="ibnp",'paid claim lag dump'!RC,'reported claim lag dump'!RC) -> 0 | Y38: =IF(LOWER(Basis)="ibnp",'paid claim lag dump'!RC,'reported claim lag dump'!RC) -> 0 | Z38: =IF(LOWER(Basis)="ibnp",'paid claim lag dump'!RC,'reported claim lag dump'!RC) -> 0 | AA38: =IF(LOWER(Basis)="ibnp",'paid claim lag dump'!RC,'reported claim lag dump'!RC) -> 0 | AB38: =IF(LOWER(Basis)="ibnp",'paid claim lag dump'!RC,'reported claim lag dump'!RC) -> 0 | AC38: =IF(LOWER(Basis)="ibnp",'paid claim lag dump'!RC,'reported claim lag dump'!RC) -> 0 | AD38: =IF(LOWER(Basis)="ibnp",'paid claim lag dump'!RC,'reported claim lag dump'!RC) -> 0 | AE38: =IF(LOWER(Basis)="ibnp",'paid claim lag dump'!RC,'reported claim lag dump'!RC) -> 0 | AF38: =IF(LOWER(Basis)="ibnp",'paid claim lag dump'!RC,'reported claim lag dump'!RC) -> 0 | AG38: =IF(LOWER(Basis)="ibnp",'paid claim lag dump'!RC,'reported claim lag dump'!RC) -> 0 | AH38: =IF(LOWER(Basis)="ibnp",'paid claim lag dump'!RC,'reported claim lag dump'!RC) -> 0 | AI38: =IF(LOWER(Basis)="ibnp",'paid claim lag dump'!RC,'reported claim lag dump'!RC) -> 0 | AJ38: =IF(LOWER(Basis)="ibnp",'paid claim lag dump'!RC,'reported claim lag dump'!RC) -> 0 | AK38: =IF(LOWER(Basis)="ibnp",'paid claim lag dump'!RC,'reported claim lag dump'!RC) -> 0 | AL38: =IF(LOWER(Basis)="ibnp",'paid claim lag dump'!RC,'reported claim lag dump'!RC) -> 0

Sheet: exposure dump
B2: INCMONTH | C2: LIVES | D2: ISSUED | E2: LAPSED | F2: EXPNOAGINGNOPM | G2: EXPNOAGING | H2: EXPOSUREORIG | I2: EXPOSUREREMAININGVD
B3: 1998-08-01T00:00:00.000 | C3: 1333 | D3: 93.116 | E3: 0 | F3: 2341.96 | G3: 2341.96 | H3: 2576.1559999999999 | I3: 1449.45
B4: 1998-09-01T00:00:00.000 | C4: 1378.3330000000001 | D4: 80.817999999999998 | E4: 0 | F4: 2422.7779999999998 | G4: 2421.6060000000002 | H4: 2663.7669999999998 | I4: 1484.588
B5: 1998-10-01T00:00:00.000 | C5: 1411.6769999999999 | D5: 72.033000000000001 | E5: 63.249000000000002 | F5: 2431.5619999999999 | G5: 2480.1889999999999 | H5: 2728.2080000000001 | I5: 1521.4829999999999
B6: 1998-11-01T00:00:00.000 | C6: 1438.867 | D6: 101.901 | E6: 33.381 | F6: 2500.0819999999999 | G6: 2527.9580000000001 | H6: 2780.7539999999999 | I6: 1556.6210000000001
B7: 1998-12-01T00:00:00.000 | C7: 1462.5160000000001 | D7: 75.546999999999997 | E7: 40.408999999999999 | F7: 2535.2199999999998 | G7: 2569.5079999999998 | H7: 2826.4589999999998 | I7: 1579.461
B8: 1999-01-01T00:00:00.000 | C8: 1466.9680000000001 | D8: 42.165999999999997 | E8: 56.220999999999997 | F8: 2521.165 | G8: 2577.3290000000002 | H8: 2835.0619999999999 | I8: 1586.489
B9: 1999-02-01T00:00:00.000 | C9: 1457.4290000000001 | D9: 47.436999999999998 | E9: 28.111000000000001 | F9: 2540.491 | G9: 2560.569 | H9: 2816.6260000000002 | I9: 1607.5719999999999
B10: 1999-03-01T00:00:00.000 | C10: 1464.1289999999999 | D10: 36.895000000000003 | E10: 47.436999999999998 | F10: 2529.9490000000001 | G10: 2572.3420000000001 | H10: 2829.576 | I10: 1623.384
B11: 1999-04-01T00:00:00.000 | C11: 1505.933 | D11: 121.227 | E11: 91.358999999999995 | F11: 2559.817 | G11: 2645.788 | H11: 2910.3670000000002 | I11: 1676.0909999999999
B12: 1999-05-01T00:00:00.000 | C12: 1487.1289999999999 | D12: 59.734999999999999 | E12: 73.790000000000006 | F12: 2545.761 | G12: 2612.75 | H12: 2874.0259999999998 | I12: 1704.202
B13: 1999-06-01T00:00:00.000 | C13: 1470 | D13: 36.895000000000003 | E13: 50.95 | F13: 2531.7060000000001 | G13: 2582.6559999999999 | H13: 2840.922 | I13: 1720.0139999999999
B14: 1999-07-01T00:00:00.000 | C14: 1464.548 | D14: 43.923000000000002 | E14: 61.491999999999997 | F14: 2514.1370000000002 | G14: 2573.078 | H14: 2830.386 | I14: 1734.069
B15: 1999-08-01T00:00:00.000 | C15: 1530.4839999999999 | D15: 187.989 | E15: 47.436999999999998 | F15: 2654.69 | G15: 2688.9209999999998 | H15: 2957.8130000000001 | I15: 1858.81
B16: 1999-09-01T00:00:00.000 | C16: 1538.8 | D16: 49.192999999999998 | E16: 50.95 | F16: 2652.933 | G16: 2703.5320000000002 | H16: 2973.8850000000002 | I16: 1879.893
B17: 1999-10-01T00:00:00.000 | C17: 1523 | D17: 24.597000000000001 | E17: 49.192999999999998 | F17: 2628.3359999999998 | G17: 2675.7730000000001 | H17: 2943.35 | I17: 1893.9480000000001
B18: 1999-11-01T00:00:00.000 | C18: 1559.6 | D18: 112.44199999999999 | E18: 22.84 | F18: 2717.9380000000001 | G18: 2740.0749999999998 | H18: 3014.0830000000001 | I18: 1973.009
B19: 1999-12-01T00:00:00.000 | C19: 1562 | D19: 33.381 | E19: 79.061000000000007 | F19: 2672.259 | G19: 2744.2919999999999 | H19: 3018.721 | I19: 1990.578
B20: 2000-01-01T00:00:00.000 | C20: 1554.0319999999999 | D20: 59.734999999999999 | E20: 35.137999999999998 | F20: 2696.855 | G20: 2730.2930000000001 | H20: 3003.3229999999999 | I20: 2020.4449999999999
B21: 2000-02-01T00:00:00.000 | C21: 1555.4480000000001 | D21: 38.652000000000001 | E21: 56.220999999999997 | F21: 2679.2860000000001 | G21: 2732.7809999999999 | H21: 3006.0590000000002 | I21: 2032.7439999999999
B22: 2000-03-01T00:00:00.000 | C22: 1553.0319999999999 | D22: 54.463999999999999 | E22: 66.763000000000005 | F22: 2666.9879999999998 | G22: 2728.5360000000001 | H22: 3001.39 | I22: 2059.0970000000002
B23: 2000-04-01T00:00:00.000 | C23: 1566.7 | D23: 86.088999999999999 | E23: 56.220999999999997 | F23: 2696.855 | G23: 2752.549 | H23: 3027.8040000000001 | I23: 2087.2080000000001
B24: 2000-05-01T00:00:00.000 | C24: 1579.8710000000001 | D24: 82.575000000000003 | E24: 57.978000000000002 | F24: 2721.4520000000002 | G24: 2775.69 | H24: 3053.259 | I24: 2145.1860000000001
B25: 2000-06-01T00:00:00.000 | C25: 1562.4 | D25: 24.597000000000001 | E25: 57.978000000000002 | F25: 2688.0709999999999 | G25: 2744.9949999999999 | H25: 3019.4940000000001 | I25: 2160.998
B26: 2000-07-01T00:00:00.000 | C26: 1555.452 | D26: 47.436999999999998 | E26: 47.436999999999998 | F26: 2688.0709999999999 | G26: 2732.7869999999998 | H26: 3006.0659999999998 | I26: 2192.623
B27: 2000-08-01T00:00:00.000 | C27: 1545.7739999999999 | D27: 33.381 | E27: 49.192999999999998 | F27: 2672.259 | G27: 2715.7849999999999 | H27: 2987.3629999999998 | I27: 2208.4349999999999
B28: 2000-09-01T00:00:00.000 | C28: 1528.1669999999999 | D28: 21.082999999999998 | E28: 68.519000000000005 | F28: 2624.8220000000001 | G28: 2684.85 | H28: 2953.335 | I28: 2217.2190000000001
B29: 2000-10-01T00:00:00.000 | C29: 1514.6769999999999 | D29: 40.408999999999999 | E29: 61.491999999999997 | F29: 2603.739 | G29: 2661.1509999999998 | H29: 2927.2660000000001 | I29: 2240.0590000000002
B30: 2000-11-01T00:00:00.000 | C30: 1499.133 | D30: 35.137999999999998 | E30: 36.895000000000003 | F30: 2601.982 | G30: 2633.8409999999999 | H30: 2897.2249999999999 | I30: 2261.1419999999998
B31: 2000-12-01T00:00:00.000 | C31: 1493.9349999999999 | D31: 24.597000000000001 | E31: 31.623999999999999 | F31: 2594.9549999999999 | G31: 2624.7089999999998 | H31: 2887.18 | I31: 2269.9270000000001
B32: 2001-01-01T00:00:00.000 | C32: 1494.258 | D32: 35.137999999999998 | E32: 40.408999999999999 | F32: 2589.6840000000002 | G32: 2625.2750000000001 | H32: 2887.8029999999999 | I32: 2299.7939999999999
B33: 2001-02-01T00:00:00.000 | C33: 1493.857 | D33: 38.652000000000001 | E33: 70.275999999999996 | F33: 2558.06 | G33: 2624.5709999999999 | H33: 2887.0279999999998 | I33: 2338.4459999999999
B34: 2001-03-01T00:00:00.000 | C34: 1473.8389999999999 | D34: 33.381 | E34: 59.734999999999999 | F34: 2531.7060000000001 | G34: 2589.4009999999998 | H34: 2848.3409999999999 | I34: 2368.3130000000001
B35: 2001-04-01T00:00:00.000 | C35: 1453.933 | D35: 28.111000000000001 | E35: 45.68 | F35: 2514.1370000000002 | G35: 2554.4290000000001 | H35: 2809.8719999999998 | I35: 2394.6669999999999
B36: 2001-05-01T00:00:00.000 | C36: 1456.903 | D36: 49.192999999999998 | E36: 40.408999999999999 | F36: 2522.9209999999998 | G36: 2559.6469999999999 | H36: 2815.6109999999999 | I36: 2442.1039999999998
B37: 2001-06-01T00:00:00.000 | C37: 1454.2670000000001 | D37: 38.652000000000001 | E37: 36.895000000000003 | F37: 2524.6779999999999 | G37: 2555.0140000000001 | H37: 2810.5160000000001 | I37: 2477.2420000000002
B38: 2001-07-01T00:00:00.000 | C38: 1464.3869999999999 | D38: 57.978000000000002 | E38: 49.192999999999998 | F38: 2533.4630000000002 | G38: 2572.7950000000001 | H38: 2830.0740000000001 | I38: 2533.4630000000002

Sheet: ncco dump
B2: REFDATE | C2: WEIGHTFAC
B3: 1998-08-01T00:00:00.000 | C3: 1
B4: 1998-09-01T00:00:00.000 | C4: 1
B5: 1998-10-01T00:00:00.000 | C5: 1
B6: 1998-11-01T00:00:00.000 | C6: 1
B7: 1998-12-01T00:00:00.000 | C7: 1
B8: 1999-01-01T00:00:00.000 | C8: 1
B9: 1999-02-01T00:00:00.000 | C9: 1
B10: 1999-03-01T00:00:00.000 | C10: 1
B11: 1999-04-01T00:00:00.000 | C11: 1
B12: 1999-05-01T00:00:00.000 | C12: 1
B13: 1999-06-01T00:00:00.000 | C13: 1
B14: 1999-07-01T00:00:00.000 | C14: 1
B15: 1999-08-01T00:00:00.000 | C15: 1
B16: 1999-09-01T00:00:00.000 | C16: 1
B17: 1999-10-01T00:00:00.000 | C17: 1
B18: 1999-11-01T00:00:00.000 | C18: 1
B19: 1999-12-01T00:00:00.000 | C19: 1
B20: 2000-01-01T00:00:00.000 | C20: 1
B21: 2000-02-01T00:00:00.000 | C21: 1
B22: 2000-03-01T00:00:00.000 | C22: 1
B23: 2000-04-01T00:00:00.000 | C23: 1
B24: 2000-05-01T00:00:00.000 | C24: 1
B25: 2000-06-01T00:00:00.000 | C25: 1
B26: 2000-07-01T00:00:00.000 | C26: 1
B27: 2000-08-01T00:00:00.000 | C27: 1
B28: 2000-09-01T00:00:00.000 | C28: 1
B29: 2000-10-01T00:00:00.000 | C29: 1
B30: 2000-11-01T00:00:00.000 | C30: 1
B31: 2000-12-01T00:00:00.000 | C31: 1
B32: 2001-01-01T00:00:00.000 | C32: 1
B33: 2001-02-01T00:00:00.000 | C33: 1
B34: 2001-03-01T00:00:00.000 | C34: 1
B35: 2001-04-01T00:00:00.000 | C35: 1
B36: 2001-05-01T00:00:00.000 | C36: 1
B37: 2001-06-01T00:00:00.000 | C37: 1
B38: 2001-07-01T00:00:00.000 | C38: 1

Sheet: LinearLag
A1: =title1&" - Linear Lag"&IF(Basis="ibnp", " (reported = paid)","") -> BLOCK CLAIM LIABILITY REPORT - Linear Lag
A2: =title2 -> The Millennium-2000 Sample Life Insurance Company
A3: =title3 -> Arvind
A4: =title4 -> Experience Period: 01-Aug-1998 to 31-Jul-2001. Runout Date: 31-Jul-2001
B6: LINEAR LAG SUMMARY BY INCURRED MONTH | H6: LINEAR LAG SUMMARY BY REPORTED MONTH
A7: Incurred Month | B7: Paid Claims | D7: Reported Claims | G7: Reported Month | H7: Paid Claims | J7: Reported Claims
B8: Per Month | C8: Cumulative | D8: Per Month | E8: Cumulative | H8: Per Month | I8: Cumulative | J8: Per Month | K8: Cumulative
A9: =ExpDat -> 1998-08-01T00:00:00.000 | B9: =IF(RC1="","",IF(ISNA(VLOOKUP(RC1,TriPaidLag,4,FALSE))=TRUE,"",VLOOKUP(RC1,TriPaidLag,4,FALSE))) -> 50333 | C9: =IF(RC1="","",SUM(R9C[-1]:RC[-1])) -> 50333 | D9: =IF(RC1="","",IF(ISNA(VLOOKUP(RC1,TriRepLag,4,FALSE))=TRUE, "", VLOOKUP(RC1,TriRepLag,4,FALSE))) -> 99219 | E9: =IF(RC1="","",SUM(R9C[-1]:RC[-1])) -> 99219 | G9: =ExpDat -> 1998-08-01T00:00:00.000 | H9: =IF(RC1="","",VLOOKUP(RC7,RunoutPaid,4,FALSE)) -> 50333 | I9: =IF(RC1="","",SUM(R9C[-1]:RC[-1])) -> 50333 | J9: =IF(RC1="","",VLOOKUP(RC7,RunoutRep,4,FALSE)) -> 25147 | K9: =IF(RC1="","",SUM(R9C[-1]:RC[-1])) -> 25147
A10: =IF(R[-1]C1="","",IF(DATE(YEAR(R[-1]C),MONTH(R[-1]C)+1,1)>RunDat,"",DATE(YEAR(R[-1]C),MONTH(R[-1]C)+1,1))) -> 1998-09-01T00:00:00.000 | B10: =IF(RC1="","",IF(ISNA(VLOOKUP(RC1,TriPaidLag,4,FALSE))=TRUE,"",VLOOKUP(RC1,TriPaidLag,4,FALSE))) -> 50333 | C10: =IF(RC1="","",SUM(R9C[-1]:RC[-1])) -> 100666 | D10: =IF(RC1="","",IF(ISNA(VLOOKUP(RC1,TriRepLag,4,FALSE))=TRUE, "", VLOOKUP(RC1,TriRepLag,4,FALSE))) -> 99219 | E10: =IF(RC1="","",SUM(R9C[-1]:RC[-1])) -> 198438 | G10: =IF(R[-1]C1="","",IF(DATE(YEAR(R[-1]C),MONTH(R[-1]C)+1,1)>RunDat,"",DATE(YEAR(R[-1]C),MONTH(R[-1]C)+1,1))) -> 1998-09-01T00:00:00.000 | H10: =IF(RC1="","",VLOOKUP(RC7,RunoutPaid,4,FALSE)) -> 50333 | I10: =IF(RC1="","",SUM(R9C[-1]:RC[-1])) -> 100666 | J10: =IF(RC1="","",VLOOKUP(RC7,RunoutRep,4,FALSE)) -> 105325 | K10: =IF(RC1="","",SUM(R9C[-1]:RC[-1])) -> 130472
A11: =IF(R[-1]C1="","",IF(DATE(YEAR(R[-1]C),MONTH(R[-1]C)+1,1)>RunDat,"",DATE(YEAR(R[-1]C),MONTH(R[-1]C)+1,1))) -> 1998-10-01T00:00:00.000 | B11: =IF(RC1="","",IF(ISNA(VLOOKUP(RC1,TriPaidLag,4,FALSE))=TRUE,"",VLOOKUP(RC1,TriPaidLag,4,FALSE))) -> 221584 | C11: =IF(RC1="","",SUM(R9C[-1]:RC[-1])) -> 322250 | D11: =IF(RC1="","",IF(ISNA(VLOOKUP(RC1,TriRepLag,4,FALSE))=TRUE, "", VLOOKUP(RC1,TriRepLag,4,FALSE))) -> 292014 | E11: =IF(RC1="","",SUM(R9C[-1]:RC[-1])) -> 490452 | G11: =IF(R[-1]C1="","",IF(DATE(YEAR(R[-1]C),MONTH(R[-1]C)+1,1)>RunDat,"",DATE(YEAR(R[-1]C),MONTH(R[-1]C)+1,1))) -> 1998-10-01T00:00:00.000 | H11: =IF(RC1="","",VLOOKUP(RC7,RunoutPaid,4,FALSE)) -> 20337 | I11: =IF(RC1="","",SUM(R9C[-1]:RC[-1])) -> 121003 | J11: =IF(RC1="","",VLOOKUP(RC7,RunoutRep,4,FALSE)) -> 98152 | K11: =IF(RC1="","",SUM(R9C[-1]:RC[-1])) -> 228624
A12: =IF(R[-1]C1="","",IF(DATE(YEAR(R[-1]C),MONTH(R[-1]C)+1,1)>RunDat,"",DATE(YEAR(R[-1]C),MONTH(R[-1]C)+1,1))) -> 1998-11-01T00:00:00.000 | B12: =IF(RC1="","",IF(ISNA(VLOOKUP(RC1,TriPaidLag,4,FALSE))=TRUE,"",VLOOKUP(RC1,TriPaidLag,4,FALSE))) -> 221584 | C12: =IF(RC1="","",SUM(R9C[-1]:RC[-1])) -> 543834 | D12: =IF(RC1="","",IF(ISNA(VLOOKUP(RC1,TriRepLag,4,FALSE))=TRUE, "", VLOOKUP(RC1,TriRepLag,4,FALSE))) -> 292014 | E12: =IF(RC1="","",SUM(R9C[-1]:RC[-1])) -> 782466 | G12: =IF(R[-1]C1="","",IF(DATE(YEAR(R[-1]C),MONTH(R[-1]C)+1,1)>RunDat,"",DATE(YEAR(R[-1]C),MONTH(R[-1]C)+1,1))) -> 1998-11-01T00:00:00.000 | H12: =IF(RC1="","",VLOOKUP(RC7,RunoutPaid,4,FALSE)) -> 216906 | I12: =IF(RC1="","",SUM(R9C[-1]:RC[-1])) -> 337909 | J12: =IF(RC1="","",VLOOKUP(RC7,RunoutRep,4,FALSE)) -> 207773 | K12: =IF(RC1="","",SUM(R9C[-1]:RC[-1])) -> 436397
A13: =IF(R[-1]C1="","",IF(DATE(YEAR(R[-1]C),MONTH(R[-1]C)+1,1)>RunDat,"",DATE(YEAR(R[-1]C),MONTH(R[-1]C)+1,1))) -> 1998-12-01T00:00:00.000 | B13: =IF(RC1="","",IF(ISNA(VLOOKUP(RC1,TriPaidLag,4,FALSE))=TRUE,"",VLOOKUP(RC1,TriPaidLag,4,FALSE))) -> 198556 | C13: =IF(RC1="","",SUM(R9C[-1]:RC[-1])) -> 742390 | D13: =IF(RC1="","",IF(ISNA(VLOOKUP(RC1,TriRepLag,4,FALSE))=TRUE, "", VLOOKUP(RC1,TriRepLag,4,FALSE))) -> 109763 | E13: =IF(RC1="","",SUM(R9C[-1]:RC[-1])) -> 892229 | G13: =IF(R[-1]C1="","",IF(DATE(YEAR(R[-1]C),MONTH(R[-1]C)+1,1)>RunDat,"",DATE(YEAR(R[-1]C),MONTH(R[-1]C)+1,1))) -> 1998-12-01T00:00:00.000 | H13: =IF(RC1="","",VLOOKUP(RC7,RunoutPaid,4,FALSE)) -> 199817 | I13: =IF(RC1="","",SUM(R9C[-1]:RC[-1])) -> 537726 | J13: =IF(RC1="","",VLOOKUP(RC7,RunoutRep,4,FALSE)) -> 200876 | K13: =IF(RC1="","",SUM(R9C[-1]:RC[-1])) -> 637273
A14: =IF(R[-1]C1="","",IF(DATE(YEAR(R[-1]C),MONTH(R[-1]C)+1,1)>RunDat,"",DATE(YEAR(R[-1]C),MONTH(R[-1]C)+1,1))) -> 1999-01-01T00:00:00.000 | B14: =IF(RC1="","",IF(ISNA(VLOOKUP(RC1,TriPaidLag,4,FALSE))=TRUE,"",VLOOKUP(RC1,TriPaidLag,4,FALSE))) -> 198556 | C14: =IF(RC1="","",SUM(R9C[-1]:RC[-1])) -> 940946 | D14: =IF(RC1="","",IF(ISNA(VLOOKUP(RC1,TriRepLag,4,FALSE))=TRUE, "", VLOOKUP(RC1,TriRepLag,4,FALSE))) -> 109763 | E14: =IF(RC1="","",SUM(R9C[-1]:RC[-1])) -> 1001992 | G14: =IF(R[-1]C1="","",IF(DATE(YEAR(R[-1]C),MONTH(R[-1]C)+1,1)>RunDat,"",DATE(YEAR(R[-1]C),MONTH(R[-1]C)+1,1))) -> 1999-01-01T00:00:00.000 | H14: =IF(RC1="","",VLOOKUP(RC7,RunoutPaid,4,FALSE)) -> 185807 | I14: =IF(RC1="","",SUM(R9C[-1]:RC[-1])) -> 723533 | J14: =IF(RC1="","",VLOOKUP(RC7,RunoutRep,4,FALSE)) -> 188191 | K14: =IF(RC1="","",SUM(R9C[-1]:RC[-1])) -> 825464
A15: =IF(R[-1]C1="","",IF(DATE(YEAR(R[-1]C),MONTH(R[-1]C)+1,1)>RunDat,"",DATE(YEAR(R[-1]C),MONTH(R[-1]C)+1,1))) -> 1999-02-01T00:00:00.000 | B15: =IF(RC1="","",IF(ISNA(VLOOKUP(RC1,TriPaidLag,4,FALSE))=TRUE,"",VLOOKUP(RC1,TriPaidLag,4,FALSE))) -> 186494 | C15: =IF(RC1="","",SUM(R9C[-1]:RC[-1])) -> 1127440 | D15: =IF(RC1="","",IF(ISNA(VLOOKUP(RC1,TriRepLag,4,FALSE))=TRUE, "", VLOOKUP(RC1,TriRepLag,4,FALSE))) -> 164681 | E15: =IF(RC1="","",SUM(R9C[-1]:RC[-1])) -> 1166673 | G15: =IF(R[-1]C1="","",IF(DATE(YEAR(R[-1]C),MONTH(R[-1]C)+1,1)>RunDat,"",DATE(YEAR(R[-1]C),MONTH(R[-1]C)+1,1))) -> 1999-02-01T00:00:00.000 | H15: =IF(RC1="","",VLOOKUP(RC7,RunoutPaid,4,FALSE)) -> 144004 | I15: =IF(RC1="","",SUM(R9C[-1]:RC[-1])) -> 867537 | J15: =IF(RC1="","",VLOOKUP(RC7,RunoutRep,4,FALSE)) -> 120546 | K15: =IF(RC1="","",SUM(R9C[-1]:RC[-1])) -> 946010
A16: =IF(R[-1]C1="","",IF(DATE(YEAR(R[-1]C),MONTH(R[-1]C)+1,1)>RunDat,"",DATE(YEAR(R[-1]C),MONTH(R[-1]C)+1,1))) -> 1999-03-01T00:00:00.000 | B16: =IF(RC1="","",IF(ISNA(VLOOKUP(RC1,TriPaidLag,4,FALSE))=TRUE,"",VLOOKUP(RC1,TriPaidLag,4,FALSE))) -> 186494 | C16: =IF(RC1="","",SUM(R9C[-1]:RC[-1])) -> 1313934 | D16: =IF(RC1="","",IF(ISNA(VLOOKUP(RC1,TriRepLag,4,FALSE))=TRUE, "", VLOOKUP(RC1,TriRepLag,4,FALSE))) -> 164681 | E16: =IF(RC1="","",SUM(R9C[-1]:RC[-1])) -> 1331354 | G16: =IF(R[-1]C1="","",IF(DATE(YEAR(R[-1]C),MONTH(R[-1]C)+1,1)>RunDat,"",DATE(YEAR(R[-1]C),MONTH(R[-1]C)+1,1))) -> 1999-03-01T00:00:00.000 | H16: =IF(RC1="","",VLOOKUP(RC7,RunoutPaid,4,FALSE)) -> 162948 | I16: =IF(RC1="","",SUM(R9C[-1]:RC[-1])) -> 1030485 | J16: =IF(RC1="","",VLOOKUP(RC7,RunoutRep,4,FALSE)) -> 188587 | K16: =IF(RC1="","",SUM(R9C[-1]:RC[-1])) -> 1134597
A17: =IF(R[-1]C1="","",IF(DATE(YEAR(R[-1]C),MONTH(R[-1]C)+1,1)>RunDat,"",DATE(YEAR(R[-1]C),MONTH(R[-1]C)+1,1))) -> 1999-04-01T00:00:00.000 | B17: =IF(RC1="","",IF(ISNA(VLOOKUP(RC1,TriPaidLag,4,FALSE))=TRUE,"",VLOOKUP(RC1,TriPaidLag,4,FALSE))) -> 255986 | C17: =IF(RC1="","",SUM(R9C[-1]:RC[-1])) -> 1569920 | D17: =IF(RC1="","",IF(ISNA(VLOOKUP(RC1,TriRepLag,4,FALSE))=TRUE, "", VLOOKUP(RC1,TriRepLag,4,FALSE))) -> 171773 | E17: =IF(RC1="","",SUM(R9C[-1]:RC[-1])) -> 1503127 | G17: =IF(R[-1]C1="","",IF(DATE(YEAR(R[-1]C),MONTH(R[-1]C)+1,1)>RunDat,"",DATE(YEAR(R[-1]C),MONTH(R[-1]C)+1,1))) -> 1999-04-01T00:00:00.000 | H17: =IF(RC1="","",VLOOKUP(RC7,RunoutPaid,4,FALSE)) -> 243415 | I17: =IF(RC1="","",SUM(R9C[-1]:RC[-1])) -> 1273900 | J17: =IF(RC1="","",VLOOKUP(RC7,RunoutRep,4,FALSE)) -> 140778 | K17: =IF(RC1="","",SUM(R9C[-1]:RC[-1])) -> 1275375
A18: =IF(R[-1]C1="","",IF(DATE(YEAR(R[-1]C),MONTH(R[-1]C)+1,1)>RunDat,"",DATE(YEAR(R[-1]C),MONTH(R[-1]C)+1,1))) -> 1999-05-01T00:00:00.000 | B18: =IF(RC1="","",IF(ISNA(VLOOKUP(RC1,TriPaidLag,4,FALSE))=TRUE,"",VLOOKUP(RC1,TriPaidLag,4,FALSE))) -> 255986 | C18: =IF(RC1="","",SUM(R9C[-1]:RC[-1])) -> 1825906 | D18: =IF(RC1="","",IF(ISNA(VLOOKUP(RC1,TriRepLag,4,FALSE))=TRUE, "", VLOOKUP(RC1,TriRepLag,4,FALSE))) -> 171773 | E18: =IF(RC1="","",SUM(R9C[-1]:RC[-1])) -> 1674900 | G18: =IF(R[-1]C1="","",IF(DATE(YEAR(R[-1]C),MONTH(R[-1]C)+1,1)>RunDat,"",DATE(YEAR(R[-1]C),MONTH(R[-1]C)+1,1))) -> 1999-05-01T00:00:00.000 | H18: =IF(RC1="","",VLOOKUP(RC7,RunoutPaid,4,FALSE)) -> 169481 | I18: =IF(RC1="","",SUM(R9C[-1]:RC[-1])) -> 1443381 | J18: =IF(RC1="","",VLOOKUP(RC7,RunoutRep,4,FALSE)) -> 134129 | K18: =IF(RC1="","",SUM(R9C[-1]:RC[-1])) -> 1409504
A19: =IF(R[-1]C1="","",IF(DATE(YEAR(R[-1]C),MONTH(R[-1]C)+1,1)>RunDat,"",DATE(YEAR(R[-1]C),MONTH(R[-1]C)+1,1))) -> 1999-06-01T00:00:00.000 | B19: =IF(RC1="","",IF(ISNA(VLOOKUP(RC1,TriPaidLag,4,FALSE))=TRUE,"",VLOOKUP(RC1,TriPaidLag,4,FALSE))) -> 218545 | C19: =IF(RC1="","",SUM(R9C[-1]:RC[-1])) -> 2044451 | D19: =IF(RC1="","",IF(ISNA(VLOOKUP(RC1,TriRepLag,4,FALSE))=TRUE, "", VLOOKUP(RC1,TriRepLag,4,FALSE))) -> 294045 | E19: =IF(RC1="","",SUM(R9C[-1]:RC[-1])) -> 1968945 | G19: =IF(R[-1]C1="","",IF(DATE(YEAR(R[-1]C),MONTH(R[-1]C)+1,1)>RunDat,"",DATE(YEAR(R[-1]C),MONTH(R[-1]C)+1,1))) -> 1999-06-01T00:00:00.000 | H19: =IF(RC1="","",VLOOKUP(RC7,RunoutPaid,4,FALSE)) -> 193309 | I19: =IF(RC1="","",SUM(R9C[-1]:RC[-1])) -> 1636690 | J19: =IF(RC1="","",VLOOKUP(RC7,RunoutRep,4,FALSE)) -> 135120 | K19: =IF(RC1="","",SUM(R9C[-1]:RC[-1])) -> 1544624
A20: =IF(R[-1]C1="","",IF(DATE(YEAR(R[-1]C),MONTH(R[-1]C)+1,1)>RunDat,"",DATE(YEAR(R[-1]C),MONTH(R[-1]C)+1,1))) -> 1999-07-01T00:00:00.000 | B20: =IF(RC1="","",IF(ISNA(VLOOKUP(RC1,TriPaidLag,4,FALSE))=TRUE,"",VLOOKUP(RC1,TriPaidLag,4,FALSE))) -> 218545 | C20: =IF(RC1="","",SUM(R9C[-1]:RC[-1])) -> 2262996 | D20: =IF(RC1="","",IF(ISNA(VLOOKUP(RC1,TriRepLag,4,FALSE))=TRUE, "", VLOOKUP(RC1,TriRepLag,4,FALSE))) -> 294045 | E20: =IF(RC1="","",SUM(R9C[-1]:RC[-1])) -> 2262990 | G20: =IF(R[-1]C1="","",IF(DATE(YEAR(R[-1]C),MONTH(R[-1]C)+1,1)>RunDat,"",DATE(YEAR(R[-1]C),MONTH(R[-1]C)+1,1))) -> 1999-07-01T00:00:00.000 | H20: =IF(RC1="","",VLOOKUP(RC7,RunoutPaid,4,FALSE)) -> 325214 | I20: =IF(RC1="","",SUM(R9C[-1]:RC[-1])) -> 1961904 | J20: =IF(RC1="","",VLOOKUP(RC7,RunoutRep,4,FALSE)) -> 317938 | K20: =IF(RC1="","",SUM(R9C[-1]:RC[-1])) -> 1862562
A21: =IF(R[-1]C1="","",IF(DATE(YEAR(R[-1]C),MONTH(R[-1]C)+1,1)>RunDat,"",DATE(YEAR(R[-1]C),MONTH(R[-1]C)+1,1))) -> 1999-08-01T00:00:00.000 | B21: =IF(RC1="","",IF(ISNA(VLOOKUP(RC1,TriPaidLag,4,FALSE))=TRUE,"",VLOOKUP(RC1,TriPaidLag,4,FALSE))) -> 206958 | C21: =IF(RC1="","",SUM(R9C[-1]:RC[-1])) -> 2469954 | D21: =IF(RC1="","",IF(ISNA(VLOOKUP(RC1,TriRepLag,4,FALSE))=TRUE, "", VLOOKUP(RC1,TriRepLag,4,FALSE))) -> 111076 | E21: =IF(RC1="","",SUM(R9C[-1]:RC[-1])) -> 2374066 | G21: =IF(R[-1]C1="","",IF(DATE(YEAR(R[-1]C),MONTH(R[-1]C)+1,1)>RunDat,"",DATE(YEAR(R[-1]C),MONTH(R[-1]C)+1,1))) -> 1999-08-01T00:00:00.000 | H21: =IF(RC1="","",VLOOKUP(RC7,RunoutPaid,4,FALSE)) -> 155277 | I21: =IF(RC1="","",SUM(R9C[-1]:RC[-1])) -> 2117181 | J21: =IF(RC1="","",VLOOKUP(RC7,RunoutRep,4,FALSE)) -> 203315 | K21: =IF(RC1="","",SUM(R9C[-1]:RC[-1])) -> 2065877
A22: =IF(R[-1]C1="","",IF(DATE(YEAR(R[-1]C),MONTH(R[-1]C)+1,1)>RunDat,"",DATE(YEAR(R[-1]C),MONTH(R[-1]C)+1,1))) -> 1999-09-01T00:00:00.000 | B22: =IF(RC1="","",IF(ISNA(VLOOKUP(RC1,TriPaidLag,4,FALSE))=TRUE,"",VLOOKUP(RC1,TriPaidLag,4,FALSE))) -> 206958 | C22: =IF(RC1="","",SUM(R9C[-1]:RC[-1])) -> 2676912 | D22: =IF(RC1="","",IF(ISNA(VLOOKUP(RC1,TriRepLag,4,FALSE))=TRUE, "", VLOOKUP(RC1,TriRepLag,4,FALSE))) -> 111076 | E22: =IF(RC1="","",SUM(R9C[-1]:RC[-1])) -> 2485142 | G22: =IF(R[-1]C1="","",IF(DATE(YEAR(R[-1]C),MONTH(R[-1]C)+1,1)>RunDat,"",DATE(YEAR(R[-1]C),MONTH(R[-1]C)+1,1))) -> 1999-09-01T00:00:00.000 | H22: =IF(RC1="","",VLOOKUP(RC7,RunoutPaid,4,FALSE)) -> 207559 | I22: =IF(RC1="","",SUM(R9C[-1]:RC[-1])) -> 2324740 | J22: =IF(RC1="","",VLOOKUP(RC7,RunoutRep,4,FALSE)) -> 119700 | K22: =IF(RC1="","",SUM(R9C[-1]:RC[-1])) -> 2185577
A23: =IF(R[-1]C1="","",IF(DATE(YEAR(R[-1]C),MONTH(R[-1]C)+1,1)>RunDat,"",DATE(YEAR(R[-1]C),MONTH(R[-1]C)+1,1))) -> 1999-10-01T00:00:00.000 | B23: =IF(RC1="","",IF(ISNA(VLOOKUP(RC1,TriPaidLag,4,FALSE))=TRUE,"",VLOOKUP(RC1,TriPaidLag,4,FALSE))) -> 95546 | C23: =IF(RC1="","",SUM(R9C[-1]:RC[-1])) -> 2772458 | D23: =IF(RC1="","",IF(ISNA(VLOOKUP(RC1,TriRepLag,4,FALSE))=TRUE, "", VLOOKUP(RC1,TriRepLag,4,FALSE))) -> 171436 | E23: =IF(RC1="","",SUM(R9C[-1]:RC[-1])) -> 2656578 | G23: =IF(R[-1]C1="","",IF(DATE(YEAR(R[-1]C),MONTH(R[-1]C)+1,1)>RunDat,"",DATE(YEAR(R[-1]C),MONTH(R[-1]C)+1,1))) -> 1999-10-01T00:00:00.000 | H23: =IF(RC1="","",VLOOKUP(RC7,RunoutPaid,4,FALSE)) -> 160501 | I23: =IF(RC1="","",SUM(R9C[-1]:RC[-1])) -> 2485241 | J23: =IF(RC1="","",VLOOKUP(RC7,RunoutRep,4,FALSE)) -> 146305 | K23: =IF(RC1="","",SUM(R9C[-1]:RC[-1])) -> 2331882
A24: =IF(R[-1]C1="","",IF(DATE(YEAR(R[-1]C),MONTH(R[-1]C)+1,1)>RunDat,"",DATE(YEAR(R[-1]C),MONTH(R[-1]C)+1,1))) -> 1999-11-01T00:00:00.000 | B24: =IF(RC1="","",IF(ISNA(VLOOKUP(RC1,TriPaidLag,4,FALSE))=TRUE,"",VLOOKUP(RC1,TriPaidLag,4,FALSE))) -> 95546 | C24: =IF(RC1="","",SUM(R9C[-1]:RC[-1])) -> 2868004 | D24: =IF(RC1="","",IF(ISNA(VLOOKUP(RC1,TriRepLag,4,FALSE))=TRUE, "", VLOOKUP(RC1,TriRepLag,4,FALSE))) -> 171436 | E24: =IF(RC1="","",SUM(R9C[-1]:RC[-1])) -> 2828014 | G24: =IF(R[-1]C1="","",IF(DATE(YEAR(R[-1]C),MONTH(R[-1]C)+1,1)>RunDat,"",DATE(YEAR(R[-1]C),MONTH(R[-1]C)+1,1))) -> 1999-11-01T00:00:00.000 | H24: =IF(RC1="","",VLOOKUP(RC7,RunoutPaid,4,FALSE)) -> 157261 | I24: =IF(RC1="","",SUM(R9C[-1]:RC[-1])) -> 2642502 | J24: =IF(RC1="","",VLOOKUP(RC7,RunoutRep,4,FALSE)) -> 167901 | K24: =IF(RC1="","",SUM(R9C[-1]:RC[-1])) -> 2499783
A25: =IF(R[-1]C1="","",IF(DATE(YEAR(R[-1]C),MONTH(R[-1]C)+1,1)>RunDat,"",DATE(YEAR(R[-1]C),MONTH(R[-1]C)+1,1))) -> 1999-12-01T00:00:00.000 | B25: =IF(RC1="","",IF(ISNA(VLOOKUP(RC1,TriPaidLag,4,FALSE))=TRUE,"",VLOOKUP(RC1,TriPaidLag,4,FALSE))) -> 219368 | C25: =IF(RC1="","",SUM(R9C[-1]:RC[-1])) -> 3087372 | D25: =IF(RC1="","",IF(ISNA(VLOOKUP(RC1,TriRepLag,4,FALSE))=TRUE, "", VLOOKUP(RC1,TriRepLag,4,FALSE))) -> 111538 | E25: =IF(RC1="","",SUM(R9C[-1]:RC[-1])) -> 2939552 | G25: =IF(R[-1]C1="","",IF(DATE(YEAR(R[-1]C),MONTH(R[-1]C)+1,1)>RunDat,"",DATE(YEAR(R[-1]C),MONTH(R[-1]C)+1,1))) -> 1999-12-01T00:00:00.000 | H25: =IF(RC1="","",VLOOKUP(RC7,RunoutPaid,4,FALSE)) -> 81345 | I25: =IF(RC1="","",SUM(R9C[-1]:RC[-1])) -> 2723847 | J25: =IF(RC1="","",VLOOKUP(RC7,RunoutRep,4,FALSE)) -> 198865 | K25: =IF(RC1="","",SUM(R9C[-1]:RC[-1])) -> 2698648
A26: =IF(R[-1]C1="","",IF(DATE(YEAR(R[-1]C),MONTH(R[-1]C)+1,1)>RunDat,"",DATE(YEAR(R[-1]C),MONTH(R[-1]C)+1,1))) -> 2000-01-01T00:00:00.000 | B26: =IF(RC1="","",IF(ISNA(VLOOKUP(RC1,TriPaidLag,4,FALSE))=TRUE,"",VLOOKUP(RC1,TriPaidLag,4,FALSE))) -> 219368 | C26: =IF(RC1="","",SUM(R9C[-1]:RC[-1])) -> 3306740 | D26: =IF(RC1="","",IF(ISNA(VLOOKUP(RC1,TriRepLag,4,FALSE))=TRUE, "", VLOOKUP(RC1,TriRepLag,4,FALSE))) -> 111538 | E26: =IF(RC1="","",SUM(R9C[-1]:RC[-1])) -> 3051090 | G26: =IF(R[-1]C1="","",IF(DATE(YEAR(R[-1]C),MONTH(R[-1]C)+1,1)>RunDat,"",DATE(YEAR(R[-1]C),MONTH(R[-1]C)+1,1))) -> 2000-01-01T00:00:00.000 | H26: =IF(RC1="","",VLOOKUP(RC7,RunoutPaid,4,FALSE)) -> 166835 | I26: =IF(RC1="","",SUM(R9C[-1]:RC[-1])) -> 2890682 | J26: =IF(RC1="","",VLOOKUP(RC7,RunoutRep,4,FALSE)) -> 101456 | K26: =IF(RC1="","",SUM(R9C[-1]:RC[-1])) -> 2800104
A27: =IF(R[-1]C1="","",IF(DATE(YEAR(R[-1]C),MONTH(R[-1]C)+1,1)>RunDat,"",DATE(YEAR(R[-1]C),MONTH(R[-1]C)+1,1))) -> 2000-02-01T00:00:00.000 | B27: =IF(RC1="","",IF(ISNA(VLOOKUP(RC1,TriPaidLag,4,FALSE))=TRUE,"",VLOOKUP(RC1,TriPaidLag,4,FALSE))) -> 318121 | C27: =IF(RC1="","",SUM(R9C[-1]:RC[-1])) -> 3624861 | D27: =IF(RC1="","",IF(ISNA(VLOOKUP(RC1,TriRepLag,4,FALSE))=TRUE, "", VLOOKUP(RC1,TriRepLag,4,FALSE))) -> 211563 | E27: =IF(RC1="","",SUM(R9C[-1]:RC[-1])) -> 3262653 | G27: =IF(R[-1]C1="","",IF(DATE(YEAR(R[-1]C),MONTH(R[-1]C)+1,1)>RunDat,"",DATE(YEAR(R[-1]C),MONTH(R[-1]C)+1,1))) -> 2000-02-01T00:00:00.000 | H27: =IF(RC1="","",VLOOKUP(RC7,RunoutPaid,4,FALSE)) -> 288985 | I27: =IF(RC1="","",SUM(R9C[-1]:RC[-1])) -> 3179667 | J27: =IF(RC1="","",VLOOKUP(RC7,RunoutRep,4,FALSE)) -> 119738 | K27: =IF(RC1="","",SUM(R9C[-1]:RC[-1])) -> 2919842
A28: =IF(R[-1]C1="","",IF(DATE(YEAR(R[-1]C),MONTH(R[-1]C)+1,1)>RunDat,"",DATE(YEAR(R[-1]C),MONTH(R[-1]C)+1,1))) -> 2000-03-01T00:00:00.000 | B28: =IF(RC1="","",IF(ISNA(VLOOKUP(RC1,TriPaidLag,4,FALSE))=TRUE,"",VLOOKUP(RC1,TriPaidLag,4,FALSE))) -> 318121 | C28: =IF(RC1="","",SUM(R9C[-1]:RC[-1])) -> 3942982 | D28: =IF(RC1="","",IF(ISNA(VLOOKUP(RC1,TriRepLag,4,FALSE))=TRUE, "", VLOOKUP(RC1,TriRepLag,4,FALSE))) -> 211563 | E28: =IF(RC1="","",SUM(R9C[-1]:RC[-1])) -> 3474216 | G28: =IF(R[-1]C1="","",IF(DATE(YEAR(R[-1]C),MONTH(R[-1]C)+1,1)>RunDat,"",DATE(YEAR(R[-1]C),MONTH(R[-1]C)+1,1))) -> 2000-03-01T00:00:00.000 | H28: =IF(RC1="","",VLOOKUP(RC7,RunoutPaid,4,FALSE)) -> 157814 | I28: =IF(RC1="","",SUM(R9C[-1]:RC[-1])) -> 3337481 | J28: =IF(RC1="","",VLOOKUP(RC7,RunoutRep,4,FALSE)) -> 233855 | K28: =IF(RC1="","",SUM(R9C[-1]:RC[-1])) -> 3153697
A29: =IF(R[-1]C1="","",IF(DATE(YEAR(R[-1]C),MONTH(R[-1]C)+1,1)>RunDat,"",DATE(YEAR(R[-1]C),MONTH(R[-1]C)+1,1))) -> 2000-04-01T00:00:00.000 | B29: =IF(RC1="","",IF(ISNA(VLOOKUP(RC1,TriPaidLag,4,FALSE))=TRUE,"",VLOOKUP(RC1,TriPaidLag,4,FALSE))) -> 194291 | C29: =IF(RC1="","",SUM(R9C[-1]:RC[-1])) -> 4137273 | D29: =IF(RC1="","",IF(ISNA(VLOOKUP(RC1,TriRepLag,4,FALSE))=TRUE, "", VLOOKUP(RC1,TriRepLag,4,FALSE))) -> 183194 | E29: =IF(RC1="","",SUM(R9C[-1]:RC[-1])) -> 3657410 | G29: =IF(R[-1]C1="","",IF(DATE(YEAR(R[-1]C),MONTH(R[-1]C)+1,1)>RunDat,"",DATE(YEAR(R[-1]C),MONTH(R[-1]C)+1,1))) -> 2000-04-01T00:00:00.000 | H29: =IF(RC1="","",VLOOKUP(RC7,RunoutPaid,4,FALSE)) -> 266552 | I29: =IF(RC1="","",SUM(R9C[-1]:RC[-1])) -> 3604033 | J29: =IF(RC1="","",VLOOKUP(RC7,RunoutRep,4,FALSE)) -> 197783 | K29: =IF(RC1="","",SUM(R9C[-1]:RC[-1])) -> 3351480
A30: =IF(R[-1]C1="","",IF(DATE(YEAR(R[-1]C),MONTH(R[-1]C)+1,1)>RunDat,"",DATE(YEAR(R[-1]C),MONTH(R[-1]C)+1,1))) -> 2000-05-01T00:00:00.000 | B30: =IF(RC1="","",IF(ISNA(VLOOKUP(RC1,TriPaidLag,4,FALSE))=TRUE,"",VLOOKUP(RC1,TriPaidLag,4,FALSE))) -> 194291 | C30: =IF(RC1="","",SUM(R9C[-1]:RC[-1])) -> 4331564 | D30: =IF(RC1="","",IF(ISNA(VLOOKUP(RC1,TriRepLag,4,FALSE))=TRUE, "", VLOOKUP(RC1,TriRepLag,4,FALSE))) -> 183194 | E30: =IF(RC1="","",SUM(R9C[-1]:RC[-1])) -> 3840604 | G30: =IF(R[-1]C1="","",IF(DATE(YEAR(R[-1]C),MONTH(R[-1]C)+1,1)>RunDat,"",DATE(YEAR(R[-1]C),MONTH(R[-1]C)+1,1))) -> 2000-05-01T00:00:00.000 | H30: =IF(RC1="","",VLOOKUP(RC7,RunoutPaid,4,FALSE)) -> 289221 | I30: =IF(RC1="","",SUM(R9C[-1]:RC[-1])) -> 3893254 | J30: =IF(RC1="","",VLOOKUP(RC7,RunoutRep,4,FALSE)) -> 212998 | K30: =IF(RC1="","",SUM(R9C[-1]:RC[-1])) -> 3564478
A31: =IF(R[-1]C1="","",IF(DATE(YEAR(R[-1]C),MONTH(R[-1]C)+1,1)>RunDat,"",DATE(YEAR(R[-1]C),MONTH(R[-1]C)+1,1))) -> 2000-06-01T00:00:00.000 | B31: =IF(RC1="","",IF(ISNA(VLOOKUP(RC1,TriPaidLag,4,FALSE))=TRUE,"",VLOOKUP(RC1,TriPaidLag,4,FALSE))) -> 295608 | C31: =IF(RC1="","",SUM(R9C[-1]:RC[-1])) -> 4627172 | D31: =IF(RC1="","",IF(ISNA(VLOOKUP(RC1,TriRepLag,4,FALSE))=TRUE, "", VLOOKUP(RC1,TriRepLag,4,FALSE))) -> 329297 | E31: =IF(RC1="","",SUM(R9C[-1]:RC[-1])) -> 4169901 | G31: =IF(R[-1]C1="","",IF(DATE(YEAR(R[-1]C),MONTH(R[-1]C)+1,1)>RunDat,"",DATE(YEAR(R[-1]C),MONTH(R[-1]C)+1,1))) -> 2000-06-01T00:00:00.000 | H31: =IF(RC1="","",VLOOKUP(RC7,RunoutPaid,4,FALSE)) -> 239050 | I31: =IF(RC1="","",SUM(R9C[-1]:RC[-1])) -> 4132304 | J31: =IF(RC1="","",VLOOKUP(RC7,RunoutRep,4,FALSE)) -> 112659 | K31: =IF(RC1="","",SUM(R9C[-1]:RC[-1])) -> 3677137
A32: =IF(R[-1]C1="","",IF(DATE(YEAR(R[-1]C),MONTH(R[-1]C)+1,1)>RunDat,"",DATE(YEAR(R[-1]C),MONTH(R[-1]C)+1,1))) -> 2000-07-01T00:00:00.000 | B32: =IF(RC1="","",IF(ISNA(VLOOKUP(RC1,TriPaidLag,4,FALSE))=TRUE,"",VLOOKUP(RC1,TriPaidLag,4,FALSE))) -> 295608 | C32: =IF(RC1="","",SUM(R9C[-1]:RC[-1])) -> 4922780 | D32: =IF(RC1="","",IF(ISNA(VLOOKUP(RC1,TriRepLag,4,FALSE))=TRUE, "", VLOOKUP(RC1,TriRepLag,4,FALSE))) -> 329297 | E32: =IF(RC1="","",SUM(R9C[-1]:RC[-1])) -> 4499198 | G32: =IF(R[-1]C1="","",IF(DATE(YEAR(R[-1]C),MONTH(R[-1]C)+1,1)>RunDat,"",DATE(YEAR(R[-1]C),MONTH(R[-1]C)+1,1))) -> 2000-07-01T00:00:00.000 | H32: =IF(RC1="","",VLOOKUP(RC7,RunoutPaid,4,FALSE)) -> 276239 | I32: =IF(RC1="","",SUM(R9C[-1]:RC[-1])) -> 4408543 | J32: =IF(RC1="","",VLOOKUP(RC7,RunoutRep,4,FALSE)) -> 170542 | K32: =IF(RC1="","",SUM(R9C[-1]:RC[-1])) -> 3847679
A33: =IF(R[-1]C1="","",IF(DATE(YEAR(R[-1]C),MONTH(R[-1]C)+1,1)>RunDat,"",DATE(YEAR(R[-1]C),MONTH(R[-1]C)+1,1))) -> 2000-08-01T00:00:00.000 | B33: =IF(RC1="","",IF(ISNA(VLOOKUP(RC1,TriPaidLag,4,FALSE))=TRUE,"",VLOOKUP(RC1,TriPaidLag,4,FALSE))) -> 230602 | C33: =IF(RC1="","",SUM(R9C[-1]:RC[-1])) -> 5153382 | D33: =IF(RC1="","",IF(ISNA(VLOOKUP(RC1,TriRepLag,4,FALSE))=TRUE, "", VLOOKUP(RC1,TriRepLag,4,FALSE))) -> 281510 | E33: =IF(RC1="","",SUM(R9C[-1]:RC[-1])) -> 4780708 | G33: =IF(R[-1]C1="","",IF(DATE(YEAR(R[-1]C),MONTH(R[-1]C)+1,1)>RunDat,"",DATE(YEAR(R[-1]C),MONTH(R[-1]C)+1,1))) -> 2000-08-01T00:00:00.000 | H33: =IF(RC1="","",VLOOKUP(RC7,RunoutPaid,4,FALSE)) -> 303902 | I33: =IF(RC1="","",SUM(R9C[-1]:RC[-1])) -> 4712445 | J33: =IF(RC1="","",VLOOKUP(RC7,RunoutRep,4,FALSE)) -> 243611 | K33: =IF(RC1="","",SUM(R9C[-1]:RC[-1])) -> 4091290
A34: =IF(R[-1]C1="","",IF(DATE(YEAR(R[-1]C),MONTH(R[-1]C)+1,1)>RunDat,"",DATE(YEAR(R[-1]C),MONTH(R[-1]C)+1,1))) -> 2000-09-01T00:00:00.000 | B34: =IF(RC1="","",IF(ISNA(VLOOKUP(RC1,TriPaidLag,4,FALSE))=TRUE,"",VLOOKUP(RC1,TriPaidLag,4,FALSE))) -> 230602 | C34: =IF(RC1="","",SUM(R9C[-1]:RC[-1])) -> 5383984 | D34: =IF(RC1="","",IF(ISNA(VLOOKUP(RC1,TriRepLag,4,FALSE))=TRUE, "", VLOOKUP(RC1,TriRepLag,4,FALSE))) -> 281510 | E34: =IF(RC1="","",SUM(R9C[-1]:RC[-1])) -> 5062218 | G34: =IF(R[-1]C1="","",IF(DATE(YEAR(R[-1]C),MONTH(R[-1]C)+1,1)>RunDat,"",DATE(YEAR(R[-1]C),MONTH(R[-1]C)+1,1))) -> 2000-09-01T00:00:00.000 | H34: =IF(RC1="","",VLOOKUP(RC7,RunoutPaid,4,FALSE)) -> 175175 | I34: =IF(RC1="","",SUM(R9C[-1]:RC[-1])) -> 4887620 | J34: =IF(RC1="","",VLOOKUP(RC7,RunoutRep,4,FALSE)) -> 295149 | K34: =IF(RC1="","",SUM(R9C[-1]:RC[-1])) -> 4386439
A35: =IF(R[-1]C1="","",IF(DATE(YEAR(R[-1]C),MONTH(R[-1]C)+1,1)>RunDat,"",DATE(YEAR(R[-1]C),MONTH(R[-1]C)+1,1))) -> 2000-10-01T00:00:00.000 | B35: =IF(RC1="","",IF(ISNA(VLOOKUP(RC1,TriPaidLag,4,FALSE))=TRUE,"",VLOOKUP(RC1,TriPaidLag,4,FALSE))) -> 186976 | C35: =IF(RC1="","",SUM(R9C[-1]:RC[-1])) -> 5570960 | D35: =IF(RC1="","",IF(ISNA(VLOOKUP(RC1,TriRepLag,4,FALSE))=TRUE, "", VLOOKUP(RC1,TriRepLag,4,FALSE))) -> 183309 | E35: =IF(RC1="","",SUM(R9C[-1]:RC[-1])) -> 5245527 | G35: =IF(R[-1]C1="","",IF(DATE(YEAR(R[-1]C),MONTH(R[-1]C)+1,1)>RunDat,"",DATE(YEAR(R[-1]C),MONTH(R[-1]C)+1,1))) -> 2000-10-01T00:00:00.000 | H35: =IF(RC1="","",VLOOKUP(RC7,RunoutPaid,4,FALSE)) -> 340628 | I35: =IF(RC1="","",SUM(R9C[-1]:RC[-1])) -> 5228248 | J35: =IF(RC1="","",VLOOKUP(RC7,RunoutRep,4,FALSE)) -> 344988 | K35: =IF(RC1="","",SUM(R9C[-1]:RC[-1])) -> 4731427
A36: =IF(R[-1]C1="","",IF(DATE(YEAR(R[-1]C),MONTH(R[-1]C)+1,1)>RunDat,"",DATE(YEAR(R[-1]C),MONTH(R[-1]C)+1,1))) -> 2000-11-01T00:00:00.000 | B36: =IF(RC1="","",IF(ISNA(VLOOKUP(RC1,TriPaidLag,4,FALSE))=TRUE,"",VLOOKUP(RC1,TriPaidLag,4,FALSE))) -> 186976 | C36: =IF(RC1="","",SUM(R9C[-1]:RC[-1])) -> 5757936 | D36: =IF(RC1="","",IF(ISNA(VLOOKUP(RC1,TriRepLag,4,FALSE))=TRUE, "", VLOOKUP(RC1,TriRepLag,4,FALSE))) -> 183309 | E36: =IF(RC1="","",SUM(R9C[-1]:RC[-1])) -> 5428836 | G36: =IF(R[-1]C1="","",IF(DATE(YEAR(R[-1]C),MONTH(R[-1]C)+1,1)>RunDat,"",DATE(YEAR(R[-1]C),MONTH(R[-1]C)+1,1))) -> 2000-11-01T00:00:00.000 | H36: =IF(RC1="","",VLOOKUP(RC7,RunoutPaid,4,FALSE)) -> 111845 | I36: =IF(RC1="","",SUM(R9C[-1]:RC[-1])) -> 5340093 | J36: =IF(RC1="","",VLOOKUP(RC7,RunoutRep,4,FALSE)) -> 202345 | K36: =IF(RC1="","",SUM(R9C[-1]:RC[-1])) -> 4933772
A37: =IF(R[-1]C1="","",IF(DATE(YEAR(R[-1]C),MONTH(R[-1]C)+1,1)>RunDat,"",DATE(YEAR(R[-1]C),MONTH(R[-1]C)+1,1))) -> 2000-12-01T00:00:00.000 | B37: =IF(RC1="","",IF(ISNA(VLOOKUP(RC1,TriPaidLag,4,FALSE))=TRUE,"",VLOOKUP(RC1,TriPaidLag,4,FALSE))) -> 146038 | C37: =IF(RC1="","",SUM(R9C[-1]:RC[-1])) -> 5903974 | D37: =IF(RC1="","",IF(ISNA(VLOOKUP(RC1,TriRepLag,4,FALSE))=TRUE, "", VLOOKUP(RC1,TriRepLag,4,FALSE))) -> 83695 | E37: =IF(RC1="","",SUM(R9C[-1]:RC[-1])) -> 5512531 | G37: =IF(R[-1]C1="","",IF(DATE(YEAR(R[-1]C),MONTH(R[-1]C)+1,1)>RunDat,"",DATE(YEAR(R[-1]C),MONTH(R[-1]C)+1,1))) -> 2000-12-01T00:00:00.000 | H37: =IF(RC1="","",VLOOKUP(RC7,RunoutPaid,4,FALSE)) -> 178569 | I37: =IF(RC1="","",SUM(R9C[-1]:RC[-1])) -> 5518662 | J37: =IF(RC1="","",VLOOKUP(RC7,RunoutRep,4,FALSE)) -> 216483 | K37: =IF(RC1="","",SUM(R9C[-1]:RC[-1])) -> 5150255
A38: =IF(R[-1]C1="","",IF(DATE(YEAR(R[-1]C),MONTH(R[-1]C)+1,1)>RunDat,"",DATE(YEAR(R[-1]C),MONTH(R[-1]C)+1,1))) -> 2001-01-01T00:00:00.000 | B38: =IF(RC1="","",IF(ISNA(VLOOKUP(RC1,TriPaidLag,4,FALSE))=TRUE,"",VLOOKUP(RC1,TriPaidLag,4,FALSE))) -> 146038 | C38: =IF(RC1="","",SUM(R9C[-1]:RC[-1])) -> 6050012 | D38: =IF(RC1="","",IF(ISNA(VLOOKUP(RC1,TriRepLag,4,FALSE))=TRUE, "", VLOOKUP(RC1,TriRepLag,4,FALSE))) -> 83695 | E38: =IF(RC1="","",SUM(R9C[-1]:RC[-1])) -> 5596226 | G38: =IF(R[-1]C1="","",IF(DATE(YEAR(R[-1]C),MONTH(R[-1]C)+1,1)>RunDat,"",DATE(YEAR(R[-1]C),MONTH(R[-1]C)+1,1))) -> 2001-01-01T00:00:00.000 | H38: =IF(RC1="","",VLOOKUP(RC7,RunoutPaid,4,FALSE)) -> 209740 | I38: =IF(RC1="","",SUM(R9C[-1]:RC[-1])) -> 5728402 | J38: =IF(RC1="","",VLOOKUP(RC7,RunoutRep,4,FALSE)) -> 166798 | K38: =IF(RC1="","",SUM(R9C[-1]:RC[-1])) -> 5317053
A39: =IF(R[-1]C1="","",IF(DATE(YEAR(R[-1]C),MONTH(R[-1]C)+1,1)>RunDat,"",DATE(YEAR(R[-1]C),MONTH(R[-1]C)+1,1))) -> 2001-02-01T00:00:00.000 | B39: =IF(RC1="","",IF(ISNA(VLOOKUP(RC1,TriPaidLag,4,FALSE))=TRUE,"",VLOOKUP(RC1,TriPaidLag,4,FALSE))) -> 82703 | C39: =IF(RC1="","",SUM(R9C[-1]:RC[-1])) -> 6132715 | D39: =IF(RC1="","",IF(ISNA(VLOOKUP(RC1,TriRepLag,4,FALSE))=TRUE, "", VLOOKUP(RC1,TriRepLag,4,FALSE))) -> 140421 | E39: =IF(RC1="","",SUM(R9C[-1]:RC[-1])) -> 5736647 | G39: =IF(R[-1]C1="","",IF(DATE(YEAR(R[-1]C),MONTH(R[-1]C)+1,1)>RunDat,"",DATE(YEAR(R[-1]C),MONTH(R[-1]C)+1,1))) -> 2001-02-01T00:00:00.000 | H39: =IF(RC1="","",VLOOKUP(RC7,RunoutPaid,4,FALSE)) -> 159131 | I39: =IF(RC1="","",SUM(R9C[-1]:RC[-1])) -> 5887533 | J39: =IF(RC1="","",VLOOKUP(RC7,RunoutRep,4,FALSE)) -> 136721 | K39: =IF(RC1="","",SUM(R9C[-1]:RC[-1])) -> 5453774
A40: =IF(R[-1]C1="","",IF(DATE(YEAR(R[-1]C),MONTH(R[-1]C)+1,1)>RunDat,"",DATE(YEAR(R[-1]C),MONTH(R[-1]C)+1,1))) -> 2001-03-01T00:00:00.000 | B40: =IF(RC1="","",IF(ISNA(VLOOKUP(RC1,TriPaidLag,4,FALSE))=TRUE,"",VLOOKUP(RC1,TriPaidLag,4,FALSE))) -> 82703 | C40: =IF(RC1="","",SUM(R9C[-1]:RC[-1])) -> 6215418 | D40: =IF(RC1="","",IF(ISNA(VLOOKUP(RC1,TriRepLag,4,FALSE))=TRUE, "", VLOOKUP(RC1,TriRepLag,4,FALSE))) -> 140421 | E40: =IF(RC1="","",SUM(R9C[-1]:RC[-1])) -> 5877068 | G40: =IF(R[-1]C1="","",IF(DATE(YEAR(R[-1]C),MONTH(R[-1]C)+1,1)>RunDat,"",DATE(YEAR(R[-1]C),MONTH(R[-1]C)+1,1))) -> 2001-03-01T00:00:00.000 | H40: =IF(RC1="","",VLOOKUP(RC7,RunoutPaid,4,FALSE)) -> 103237 | I40: =IF(RC1="","",SUM(R9C[-1]:RC[-1])) -> 5990770 | J40: =IF(RC1="","",VLOOKUP(RC7,RunoutRep,4,FALSE)) -> 78419 | K40: =IF(RC1="","",SUM(R9C[-1]:RC[-1])) -> 5532193
A41: =IF(R[-1]C1="","",IF(DATE(YEAR(R[-1]C),MONTH(R[-1]C)+1,1)>RunDat,"",DATE(YEAR(R[-1]C),MONTH(R[-1]C)+1,1))) -> 2001-04-01T00:00:00.000 | B41: =IF(RC1="","",IF(ISNA(VLOOKUP(RC1,TriPaidLag,4,FALSE))=TRUE,"",VLOOKUP(RC1,TriPaidLag,4,FALSE))) -> 52143 | C41: =IF(RC1="","",SUM(R9C[-1]:RC[-1])) -> 6267561 | D41: =IF(RC1="","",IF(ISNA(VLOOKUP(RC1,TriRepLag,4,FALSE))=TRUE, "", VLOOKUP(RC1,TriRepLag,4,FALSE))) -> 122179 | E41: =IF(RC1="","",SUM(R9C[-1]:RC[-1])) -> 5999247 | G41: =IF(R[-1]C1="","",IF(DATE(YEAR(R[-1]C),MONTH(R[-1]C)+1,1)>RunDat,"",DATE(YEAR(R[-1]C),MONTH(R[-1]C)+1,1))) -> 2001-04-01T00:00:00.000 | H41: =IF(RC1="","",VLOOKUP(RC7,RunoutPaid,4,FALSE)) -> 104668 | I41: =IF(RC1="","",SUM(R9C[-1]:RC[-1])) -> 6095438 | J41: =IF(RC1="","",VLOOKUP(RC7,RunoutRep,4,FALSE)) -> 114270 | K41: =IF(RC1="","",SUM(R9C[-1]:RC[-1])) -> 5646463
A42: =IF(R[-1]C1="","",IF(DATE(YEAR(R[-1]C),MONTH(R[-1]C)+1,1)>RunDat,"",DATE(YEAR(R[-1]C),MONTH(R[-1]C)+1,1))) -> 2001-05-01T00:00:00.000 | B42: =IF(RC1="","",IF(ISNA(VLOOKUP(RC1,TriPaidLag,4,FALSE))=TRUE,"",VLOOKUP(RC1,TriPaidLag,4,FALSE))) -> 52143 | C42: =IF(RC1="","",SUM(R9C[-1]:RC[-1])) -> 6319704 | D42: =IF(RC1="","",IF(ISNA(VLOOKUP(RC1,TriRepLag,4,FALSE))=TRUE, "", VLOOKUP(RC1,TriRepLag,4,FALSE))) -> 122179 | E42: =IF(RC1="","",SUM(R9C[-1]:RC[-1])) -> 6121426 | G42: =IF(R[-1]C1="","",IF(DATE(YEAR(R[-1]C),MONTH(R[-1]C)+1,1)>RunDat,"",DATE(YEAR(R[-1]C),MONTH(R[-1]C)+1,1))) -> 2001-05-01T00:00:00.000 | H42: =IF(RC1="","",VLOOKUP(RC7,RunoutPaid,4,FALSE)) -> 75719 | I42: =IF(RC1="","",SUM(R9C[-1]:RC[-1])) -> 6171157 | J42: =IF(RC1="","",VLOOKUP(RC7,RunoutRep,4,FALSE)) -> 141251 | K42: =IF(RC1="","",SUM(R9C[-1]:RC[-1])) -> 5787714
A43: =IF(R[-1]C1="","",IF(DATE(YEAR(R[-1]C),MONTH(R[-1]C)+1,1)>RunDat,"",DATE(YEAR(R[-1]C),MONTH(R[-1]C)+1,1))) -> 2001-06-01T00:00:00.000 | B43: =IF(RC1="","",IF(ISNA(VLOOKUP(RC1,TriPaidLag,4,FALSE))=TRUE,"",VLOOKUP(RC1,TriPaidLag,4,FALSE))) -> 0 | C43: =IF(RC1="","",SUM(R9C[-1]:RC[-1])) -> 6319704 | D43: =IF(RC1="","",IF(ISNA(VLOOKUP(RC1,TriRepLag,4,FALSE))=TRUE, "", VLOOKUP(RC1,TriRepLag,4,FALSE))) -> 0 | E43: =IF(RC1="","",SUM(R9C[-1]:RC[-1])) -> 6121426 | G43: =IF(R[-1]C1="","",IF(DATE(YEAR(R[-1]C),MONTH(R[-1]C)+1,1)>RunDat,"",DATE(YEAR(R[-1]C),MONTH(R[-1]C)+1,1))) -> 2001-06-01T00:00:00.000 | H43: =IF(RC1="","",VLOOKUP(RC7,RunoutPaid,4,FALSE)) -> 48861 | I43: =IF(RC1="","",SUM(R9C[-1]:RC[-1])) -> 6220018 | J43: =IF(RC1="","",VLOOKUP(RC7,RunoutRep,4,FALSE)) -> 175077 | K43: =IF(RC1="","",SUM(R9C[-1]:RC[-1])) -> 5962791
A44: =IF(R[-1]C1="","",IF(DATE(YEAR(R[-1]C),MONTH(R[-1]C)+1,1)>RunDat,"",DATE(YEAR(R[-1]C),MONTH(R[-1]C)+1,1))) -> 2001-07-01T00:00:00.000 | B44: =IF(RC1="","",IF(ISNA(VLOOKUP(RC1,TriPaidLag,4,FALSE))=TRUE,"",VLOOKUP(RC1,TriPaidLag,4,FALSE))) -> 0 | C44: =IF(RC1="","",SUM(R9C[-1]:RC[-1])) -> 6319704 | D44: =IF(RC1="","",IF(ISNA(VLOOKUP(RC1,TriRepLag,4,FALSE))=TRUE, "", VLOOKUP(RC1,TriRepLag,4,FALSE))) -> 0 | E44: =IF(RC1="","",SUM(R9C[-1]:RC[-1])) -> 6121426 | G44: =IF(R[-1]C1="","",IF(DATE(YEAR(R[-1]C),MONTH(R[-1]C)+1,1)>RunDat,"",DATE(YEAR(R[-1]C),MONTH(R[-1]C)+1,1))) -> 2001-07-01T00:00:00.000 | H44: =IF(RC1="","",VLOOKUP(RC7,RunoutPaid,4,FALSE)) -> 33348 | I44: =IF(RC1="","",SUM(R9C[-1]:RC[-1])) -> 6253366 | J44: =IF(RC1="","",VLOOKUP(RC7,RunoutRep,4,FALSE)) -> 58092 | K44: =IF(RC1="","",SUM(R9C[-1]:RC[-1])) -> 6020883
A45: =IF(R[-1]C1="","",IF(DATE(YEAR(R[-1]C),MONTH(R[-1]C)+1,1)>RunDat,"",DATE(YEAR(R[-1]C),MONTH(R[-1]C)+1,1))) ->  | B45: =IF(RC1="","",IF(ISNA(VLOOKUP(RC1,TriPaidLag,4,FALSE))=TRUE,"",VLOOKUP(RC1,TriPaidLag,4,FALSE))) ->  | C45: =IF(RC1="","",SUM(R9C[-1]:RC[-1])) ->  | D45: =IF(RC1="","",IF(ISNA(VLOOKUP(RC1,TriRepLag,4,FALSE))=TRUE, "", VLOOKUP(RC1,TriRepLag,4,FALSE))) ->  | E45: =IF(RC1="","",SUM(R9C[-1]:RC[-1])) ->  | G45: =IF(R[-1]C1="","",IF(DATE(YEAR(R[-1]C),MONTH(R[-1]C)+1,1)>RunDat,"",DATE(YEAR(R[-1]C),MONTH(R[-1]C)+1,1))) ->  | H45: =IF(RC1="","",VLOOKUP(RC7,RunoutPaid,4,FALSE)) ->  | I45: =IF(RC1="","",SUM(R9C[-1]:RC[-1])) ->  | J45: =IF(RC1="","",VLOOKUP(RC7,RunoutRep,4,FALSE)) ->  | K45: =IF(RC1="","",SUM(R9C[-1]:RC[-1])) -> 
A46: =IF(R[-1]C1="","",IF(DATE(YEAR(R[-1]C),MONTH(R[-1]C)+1,1)>RunDat,"",DATE(YEAR(R[-1]C),MONTH(R[-1]C)+1,1))) ->  | B46: =IF(RC1="","",IF(ISNA(VLOOKUP(RC1,TriPaidLag,4,FALSE))=TRUE,"",VLOOKUP(RC1,TriPaidLag,4,FALSE))) ->  | C46: =IF(RC1="","",SUM(R9C[-1]:RC[-1])) ->  | D46: =IF(RC1="","",IF(ISNA(VLOOKUP(RC1,TriRepLag,4,FALSE))=TRUE, "", VLOOKUP(RC1,TriRepLag,4,FALSE))) ->  | E46: =IF(RC1="","",SUM(R9C[-1]:RC[-1])) ->  | G46: =IF(R[-1]C1="","",IF(DATE(YEAR(R[-1]C),MONTH(R[-1]C)+1,1)>RunDat,"",DATE(YEAR(R[-1]C),MONTH(R[-1]C)+1,1))) ->  | H46: =IF(RC1="","",VLOOKUP(RC7,RunoutPaid,4,FALSE)) ->  | I46: =IF(RC1="","",SUM(R9C[-1]:RC[-1])) ->  | J46: =IF(RC1="","",VLOOKUP(RC7,RunoutRep,4,FALSE)) ->  | K46: =IF(RC1="","",SUM(R9C[-1]:RC[-1])) -> 
A47: =IF(R[-1]C1="","",IF(DATE(YEAR(R[-1]C),MONTH(R[-1]C)+1,1)>RunDat,"",DATE(YEAR(R[-1]C),MONTH(R[-1]C)+1,1))) ->  | B47: =IF(RC1="","",IF(ISNA(VLOOKUP(RC1,TriPaidLag,4,FALSE))=TRUE,"",VLOOKUP(RC1,TriPaidLag,4,FALSE))) ->  | C47: =IF(RC1="","",SUM(R9C[-1]:RC[-1])) ->  | D47: =IF(RC1="","",IF(ISNA(VLOOKUP(RC1,TriRepLag,4,FALSE))=TRUE, "", VLOOKUP(RC1,TriRepLag,4,FALSE))) ->  | E47: =IF(RC1="","",SUM(R9C[-1]:RC[-1])) ->  | G47: =IF(R[-1]C1="","",IF(DATE(YEAR(R[-1]C),MONTH(R[-1]C)+1,1)>RunDat,"",DATE(YEAR(R[-1]C),MONTH(R[-1]C)+1,1))) ->  | H47: =IF(RC1="","",VLOOKUP(RC7,RunoutPaid,4,FALSE)) ->  | I47: =IF(RC1="","",SUM(R9C[-1]:RC[-1])) ->  | J47: =IF(RC1="","",VLOOKUP(RC7,RunoutRep,4,FALSE)) ->  | K47: =IF(RC1="","",SUM(R9C[-1]:RC[-1])) -> 
A48: =IF(R[-1]C1="","",IF(DATE(YEAR(R[-1]C),MONTH(R[-1]C)+1,1)>RunDat,"",DATE(YEAR(R[-1]C),MONTH(R[-1]C)+1,1))) ->  | B48: =IF(RC1="","",IF(ISNA(VLOOKUP(RC1,TriPaidLag,4,FALSE))=TRUE,"",VLOOKUP(RC1,TriPaidLag,4,FALSE))) ->  | C48: =IF(RC1="","",SUM(R9C[-1]:RC[-1])) ->  | D48: =IF(RC1="","",IF(ISNA(VLOOKUP(RC1,TriRepLag,4,FALSE))=TRUE, "", VLOOKUP(RC1,TriRepLag,4,FALSE))) ->  | E48: =IF(RC1="","",SUM(R9C[-1]:RC[-1])) ->  | G48: =IF(R[-1]C1="","",IF(DATE(YEAR(R[-1]C),MONTH(R[-1]C)+1,1)>RunDat,"",DATE(YEAR(R[-1]C),MONTH(R[-1]C)+1,1))) ->  | H48: =IF(RC1="","",VLOOKUP(RC7,RunoutPaid,4,FALSE)) ->  | I48: =IF(RC1="","",SUM(R9C[-1]:RC[-1])) ->  | J48: =IF(RC1="","",VLOOKUP(RC7,RunoutRep,4,FALSE)) ->  | K48: =IF(RC1="","",SUM(R9C[-1]:RC[-1])) -> 
A49: =IF(R[-1]C1="","",IF(DATE(YEAR(R[-1]C),MONTH(R[-1]C)+1,1)>RunDat,"",DATE(YEAR(R[-1]C),MONTH(R[-1]C)+1,1))) ->  | B49: =IF(RC1="","",IF(ISNA(VLOOKUP(RC1,TriPaidLag,4,FALSE))=TRUE,"",VLOOKUP(RC1,TriPaidLag,4,FALSE))) ->  | C49: =IF(RC1="","",SUM(R9C[-1]:RC[-1])) ->  | D49: =IF(RC1="","",IF(ISNA(VLOOKUP(RC1,TriRepLag,4,FALSE))=TRUE, "", VLOOKUP(RC1,TriRepLag,4,FALSE))) ->  | E49: =IF(RC1="","",SUM(R9C[-1]:RC[-1])) ->  | G49: =IF(R[-1]C1="","",IF(DATE(YEAR(R[-1]C),MONTH(R[-1]C)+1,1)>RunDat,"",DATE(YEAR(R[-1]C),MONTH(R[-1]C)+1,1))) ->  | H49: =IF(RC1="","",VLOOKUP(RC7,RunoutPaid,4,FALSE)) ->  | I49: =IF(RC1="","",SUM(R9C[-1]:RC[-1])) ->  | J49: =IF(RC1="","",VLOOKUP(RC7,RunoutRep,4,FALSE)) ->  | K49: =IF(RC1="","",SUM(R9C[-1]:RC[-1])) -> 
A50: =IF(R[-1]C1="","",IF(DATE(YEAR(R[-1]C),MONTH(R[-1]C)+1,1)>RunDat,"",DATE(YEAR(R[-1]C),MONTH(R[-1]C)+1,1))) ->  | B50: =IF(RC1="","",IF(ISNA(VLOOKUP(RC1,TriPaidLag,4,FALSE))=TRUE,"",VLOOKUP(RC1,TriPaidLag,4,FALSE))) ->  | C50: =IF(RC1="","",SUM(R9C[-1]:RC[-1])) ->  | D50: =IF(RC1="","",IF(ISNA(VLOOKUP(RC1,TriRepLag,4,FALSE))=TRUE, "", VLOOKUP(RC1,TriRepLag,4,FALSE))) ->  | E50: =IF(RC1="","",SUM(R9C[-1]:RC[-1])) ->  | G50: =IF(R[-1]C1="","",IF(DATE(YEAR(R[-1]C),MONTH(R[-1]C)+1,1)>RunDat,"",DATE(YEAR(R[-1]C),MONTH(R[-1]C)+1,1))) ->  | H50: =IF(RC1="","",VLOOKUP(RC7,RunoutPaid,4,FALSE)) ->  | I50: =IF(RC1="","",SUM(R9C[-1]:RC[-1])) ->  | J50: =IF(RC1="","",VLOOKUP(RC7,RunoutRep,4,FALSE)) ->  | K50: =IF(RC1="","",SUM(R9C[-1]:RC[-1])) -> 
A51: =IF(R[-1]C1="","",IF(DATE(YEAR(R[-1]C),MONTH(R[-1]C)+1,1)>RunDat,"",DATE(YEAR(R[-1]C),MONTH(R[-1]C)+1,1))) ->  | B51: =IF(RC1="","",IF(ISNA(VLOOKUP(RC1,TriPaidLag,4,FALSE))=TRUE,"",VLOOKUP(RC1,TriPaidLag,4,FALSE))) ->  | C51: =IF(RC1="","",SUM(R9C[-1]:RC[-1])) ->  | D51: =IF(RC1="","",IF(ISNA(VLOOKUP(RC1,TriRepLag,4,FALSE))=TRUE, "", VLOOKUP(RC1,TriRepLag,4,FALSE))) ->  | E51: =IF(RC1="","",SUM(R9C[-1]:RC[-1])) ->  | G51: =IF(R[-1]C1="","",IF(DATE(YEAR(R[-1]C),MONTH(R[-1]C)+1,1)>RunDat,"",DATE(YEAR(R[-1]C),MONTH(R[-1]C)+1,1))) ->  | H51: =IF(RC1="","",VLOOKUP(RC7,RunoutPaid,4,FALSE)) ->  | I51: =IF(RC1="","",SUM(R9C[-1]:RC[-1])) ->  | J51: =IF(RC1="","",VLOOKUP(RC7,RunoutRep,4,FALSE)) ->  | K51: =IF(RC1="","",SUM(R9C[-1]:RC[-1])) -> 
A52: =IF(R[-1]C1="","",IF(DATE(YEAR(R[-1]C),MONTH(R[-1]C)+1,1)>RunDat,"",DATE(YEAR(R[-1]C),MONTH(R[-1]C)+1,1))) ->  | B52: =IF(RC1="","",IF(ISNA(VLOOKUP(RC1,TriPaidLag,4,FALSE))=TRUE,"",VLOOKUP(RC1,TriPaidLag,4,FALSE))) ->  | C52: =IF(RC1="","",SUM(R9C[-1]:RC[-1])) ->  | D52: =IF(RC1="","",IF(ISNA(VLOOKUP(RC1,TriRepLag,4,FALSE))=TRUE, "", VLOOKUP(RC1,TriRepLag,4,FALSE))) ->  | E52: =IF(RC1="","",SUM(R9C[-1]:RC[-1])) ->  | G52: =IF(R[-1]C1="","",IF(DATE(YEAR(R[-1]C),MONTH(R[-1]C)+1,1)>RunDat,"",DATE(YEAR(R[-1]C),MONTH(R[-1]C)+1,1))) ->  | H52: =IF(RC1="","",VLOOKUP(RC7,RunoutPaid,4,FALSE)) ->  | I52: =IF(RC1="","",SUM(R9C[-1]:RC[-1])) ->  | J52: =IF(RC1="","",VLOOKUP(RC7,RunoutRep,4,FALSE)) ->  | K52: =IF(RC1="","",SUM(R9C[-1]:RC[-1])) -> 
A53: =IF(R[-1]C1="","",IF(DATE(YEAR(R[-1]C),MONTH(R[-1]C)+1,1)>RunDat,"",DATE(YEAR(R[-1]C),MONTH(R[-1]C)+1,1))) ->  | B53: =IF(RC1="","",IF(ISNA(VLOOKUP(RC1,TriPaidLag,4,FALSE))=TRUE,"",VLOOKUP(RC1,TriPaidLag,4,FALSE))) ->  | C53: =IF(RC1="","",SUM(R9C[-1]:RC[-1])) ->  | D53: =IF(RC1="","",IF(ISNA(VLOOKUP(RC1,TriRepLag,4,FALSE))=TRUE, "", VLOOKUP(RC1,TriRepLag,4,FALSE))) ->  | E53: =IF(RC1="","",SUM(R9C[-1]:RC[-1])) ->  | G53: =IF(R[-1]C1="","",IF(DATE(YEAR(R[-1]C),MONTH(R[-1]C)+1,1)>RunDat,"",DATE(YEAR(R[-1]C),MONTH(R[-1]C)+1,1))) ->  | H53: =IF(RC1="","",VLOOKUP(RC7,RunoutPaid,4,FALSE)) ->  | I53: =IF(RC1="","",SUM(R9C[-1]:RC[-1])) ->  | J53: =IF(RC1="","",VLOOKUP(RC7,RunoutRep,4,FALSE)) ->  | K53: =IF(RC1="","",SUM(R9C[-1]:RC[-1])) -> 
A54: =IF(R[-1]C1="","",IF(DATE(YEAR(R[-1]C),MONTH(R[-1]C)+1,1)>RunDat,"",DATE(YEAR(R[-1]C),MONTH(R[-1]C)+1,1))) ->  | B54: =IF(RC1="","",IF(ISNA(VLOOKUP(RC1,TriPaidLag,4,FALSE))=TRUE,"",VLOOKUP(RC1,TriPaidLag,4,FALSE))) ->  | C54: =IF(RC1="","",SUM(R9C[-1]:RC[-1])) ->  | D54: =IF(RC1="","",IF(ISNA(VLOOKUP(RC1,TriRepLag,4,FALSE))=TRUE, "", VLOOKUP(RC1,TriRepLag,4,FALSE))) ->  | E54: =IF(RC1="","",SUM(R9C[-1]:RC[-1])) ->  | G54: =IF(R[-1]C1="","",IF(DATE(YEAR(R[-1]C),MONTH(R[-1]C)+1,1)>RunDat,"",DATE(YEAR(R[-1]C),MONTH(R[-1]C)+1,1))) ->  | H54: =IF(RC1="","",VLOOKUP(RC7,RunoutPaid,4,FALSE)) ->  | I54: =IF(RC1="","",SUM(R9C[-1]:RC[-1])) ->  | J54: =IF(RC1="","",VLOOKUP(RC7,RunoutRep,4,FALSE)) ->  | K54: =IF(RC1="","",SUM(R9C[-1]:RC[-1])) -> 
A55: =IF(R[-1]C1="","",IF(DATE(YEAR(R[-1]C),MONTH(R[-1]C)+1,1)>RunDat,"",DATE(YEAR(R[-1]C),MONTH(R[-1]C)+1,1))) ->  | B55: =IF(RC1="","",IF(ISNA(VLOOKUP(RC1,TriPaidLag,4,FALSE))=TRUE,"",VLOOKUP(RC1,TriPaidLag,4,FALSE))) ->  | C55: =IF(RC1="","",SUM(R9C[-1]:RC[-1])) ->  | D55: =IF(RC1="","",IF(ISNA(VLOOKUP(RC1,TriRepLag,4,FALSE))=TRUE, "", VLOOKUP(RC1,TriRepLag,4,FALSE))) ->  | E55: =IF(RC1="","",SUM(R9C[-1]:RC[-1])) ->  | G55: =IF(R[-1]C1="","",IF(DATE(YEAR(R[-1]C),MONTH(R[-1]C)+1,1)>RunDat,"",DATE(YEAR(R[-1]C),MONTH(R[-1]C)+1,1))) ->  | H55: =IF(RC1="","",VLOOKUP(RC7,RunoutPaid,4,FALSE)) ->  | I55: =IF(RC1="","",SUM(R9C[-1]:RC[-1])) ->  | J55: =IF(RC1="","",VLOOKUP(RC7,RunoutRep,4,FALSE)) ->  | K55: =IF(RC1="","",SUM(R9C[-1]:RC[-1])) -> 
A56: =IF(R[-1]C1="","",IF(DATE(YEAR(R[-1]C),MONTH(R[-1]C)+1,1)>RunDat,"",DATE(YEAR(R[-1]C),MONTH(R[-1]C)+1,1))) ->  | B56: =IF(RC1="","",IF(ISNA(VLOOKUP(RC1,TriPaidLag,4,FALSE))=TRUE,"",VLOOKUP(RC1,TriPaidLag,4,FALSE))) ->  | C56: =IF(RC1="","",SUM(R9C[-1]:RC[-1])) ->  | D56: =IF(RC1="","",IF(ISNA(VLOOKUP(RC1,TriRepLag,4,FALSE))=TRUE, "", VLOOKUP(RC1,TriRepLag,4,FALSE))) ->  | E56: =IF(RC1="","",SUM(R9C[-1]:RC[-1])) ->  | G56: =IF(R[-1]C1="","",IF(DATE(YEAR(R[-1]C),MONTH(R[-1]C)+1,1)>RunDat,"",DATE(YEAR(R[-1]C),MONTH(R[-1]C)+1,1))) ->  | H56: =IF(RC1="","",VLOOKUP(RC7,RunoutPaid,4,FALSE)) ->  | I56: =IF(RC1="","",SUM(R9C[-1]:RC[-1])) ->  | J56: =IF(RC1="","",VLOOKUP(RC7,RunoutRep,4,FALSE)) ->  | K56: =IF(RC1="","",SUM(R9C[-1]:RC[-1])) -> 
A57: =IF(R[-1]C1="","",IF(DATE(YEAR(R[-1]C),MONTH(R[-1]C)+1,1)>RunDat,"",DATE(YEAR(R[-1]C),MONTH(R[-1]C)+1,1))) ->  | B57: =IF(RC1="","",IF(ISNA(VLOOKUP(RC1,TriPaidLag,4,FALSE))=TRUE,"",VLOOKUP(RC1,TriPaidLag,4,FALSE))) ->  | C57: =IF(RC1="","",SUM(R9C[-1]:RC[-1])) ->  | D57: =IF(RC1="","",IF(ISNA(VLOOKUP(RC1,TriRepLag,4,FALSE))=TRUE, "", VLOOKUP(RC1,TriRepLag,4,FALSE))) ->  | E57: =IF(RC1="","",SUM(R9C[-1]:RC[-1])) ->  | G57: =IF(R[-1]C1="","",IF(DATE(YEAR(R[-1]C),MONTH(R[-1]C)+1,1)>RunDat,"",DATE(YEAR(R[-1]C),MONTH(R[-1]C)+1,1))) ->  | H57: =IF(RC1="","",VLOOKUP(RC7,RunoutPaid,4,FALSE)) ->  | I57: =IF(RC1="","",SUM(R9C[-1]:RC[-1])) ->  | J57: =IF(RC1="","",VLOOKUP(RC7,RunoutRep,4,FALSE)) ->  | K57: =IF(RC1="","",SUM(R9C[-1]:RC[-1])) -> 
B58: =SUM(R[-49]C:R[-1]C) -> 6319704 | D58: =SUM(R[-49]C:R[-1]C) -> 6121426 | H58: =SUM(R[-49]C:R[-1]C) -> 6253366 | J58: =SUM(R[-49]C:R[-1]C) -> 6020883

Sheet: BlockExposure
A1: =title1&"- Block Exposure" -> BLOCK CLAIM LIABILITY REPORT- Block Exposure
A2: =title2 -> The Millennium-2000 Sample Life Insurance Company
A3: =title3 -> Arvind
A4: =title4 -> Experience Period: 01-Aug-1998 to 31-Jul-2001. Runout Date: 31-Jul-2001
A6: (A) | B6: (B) | C6: (C) | D6: (D) | E6: (E) | F6: (F) | G6: (G) | H6: (H) | I6: (I) | J6: (J) | K6: (K) | L6: (L)
A7: Inforce Month | B7: Lives | C7: Changes In Exposure - No Aging Full Month Credit | G7: Exposure (Partial Month Adjustment) | J7: Graphical Representation of Aging | K7: Valuation Date Remaining Inforce | L7: Persistency to Valuation Date
C8: Issued | D8: Lapsed | E8: Gain / (Loss) | F8: Inforce | G8: Without Aging | H8: With Aging | I8: Average Aging Factor
A9: =ExpDat -> 1998-08-01T00:00:00.000 | B9: =IF(RC1="","",VLOOKUP(RC1,ExpDump,2,FALSE)) -> 1333 | C9: =IF(RC1="","",VLOOKUP(RC1,ExpDump,3,FALSE)) -> 93.116 | D9: =IF(RC1="","",VLOOKUP(RC1,ExpDump,4,FALSE)) -> 0 | E9: =IF(OR(RC1="",RC1=ExpDat),"",RC[1]-RC[-2]+RC[-1]-IF(ISNUMBER(R[-1]C[1])=TRUE(),R[-1]C[1],0)) ->  | F9: =IF(RC1="","",VLOOKUP(RC1,ExpDump,5,FALSE)) -> 2341.96 | G9: =IF(RC1="","",VLOOKUP(RC1,ExpDump,6,FALSE)) -> 2341.96 | H9: =IF(RC1="","",VLOOKUP(RC1,ExpDump,7,FALSE)) -> 2576.1559999999999 | I9: =IF(RC1="","",IF(RC[-2]=0,0,RC[-1]/RC[-2])) -> 1.0999999999999999 | J9: =IF(RC1="","",IF(RC[-1]=0,0,REPT("*",100*(RC[-1]-1)))) -> ********* | K9: =IF(RC1="","",VLOOKUP(RC1,ExpDump,8,FALSE)) -> 1449.45 | L9: =IF(RC1="","",IF(RC[-6]=0,0,RC[-1]/RC[-6])) -> 0.618904678132846
A10: =IF(R[-1]C1="","",IF(DATE(YEAR(R[-1]C),MONTH(R[-1]C)+1,1)>ValDat,"",DATE(YEAR(R[-1]C),MONTH(R[-1]C)+1,1))) -> 1998-09-01T00:00:00.000 | B10: =IF(RC1="","",VLOOKUP(RC1,ExpDump,2,FALSE)) -> 1378.3330000000001 | C10: =IF(RC1="","",VLOOKUP(RC1,ExpDump,3,FALSE)) -> 80.817999999999998 | D10: =IF(RC1="","",VLOOKUP(RC1,ExpDump,4,FALSE)) -> 0 | E10: =IF(OR(RC1="",RC1=ExpDat),"",RC[1]-RC[-2]+RC[-1]-IF(ISNUMBER(R[-1]C[1])=TRUE(),R[-1]C[1],0)) -> -4.5474735088646412E-13 | F10: =IF(RC1="","",VLOOKUP(RC1,ExpDump,5,FALSE)) -> 2422.7779999999998 | G10: =IF(RC1="","",VLOOKUP(RC1,ExpDump,6,FALSE)) -> 2421.6060000000002 | H10: =IF(RC1="","",VLOOKUP(RC1,ExpDump,7,FALSE)) -> 2663.7669999999998 | I10: =IF(RC1="","",IF(RC[-2]=0,0,RC[-1]/RC[-2])) -> 1.1000001651796367 | J10: =IF(RC1="","",IF(RC[-1]=0,0,REPT("*",100*(RC[-1]-1)))) -> ********** | K10: =IF(RC1="","",VLOOKUP(RC1,ExpDump,8,FALSE)) -> 1484.588 | L10: =IF(RC1="","",IF(RC[-6]=0,0,RC[-1]/RC[-6])) -> 0.61276270463079985
A11: =IF(R[-1]C1="","",IF(DATE(YEAR(R[-1]C),MONTH(R[-1]C)+1,1)>ValDat,"",DATE(YEAR(R[-1]C),MONTH(R[-1]C)+1,1))) -> 1998-10-01T00:00:00.000 | B11: =IF(RC1="","",VLOOKUP(RC1,ExpDump,2,FALSE)) -> 1411.6769999999999 | C11: =IF(RC1="","",VLOOKUP(RC1,ExpDump,3,FALSE)) -> 72.033000000000001 | D11: =IF(RC1="","",VLOOKUP(RC1,ExpDump,4,FALSE)) -> 63.249000000000002 | E11: =IF(OR(RC1="",RC1=ExpDat),"",RC[1]-RC[-2]+RC[-1]-IF(ISNUMBER(R[-1]C[1])=TRUE(),R[-1]C[1],0)) -> 0 | F11: =IF(RC1="","",VLOOKUP(RC1,ExpDump,5,FALSE)) -> 2431.5619999999999 | G11: =IF(RC1="","",VLOOKUP(RC1,ExpDump,6,FALSE)) -> 2480.1889999999999 | H11: =IF(RC1="","",VLOOKUP(RC1,ExpDump,7,FALSE)) -> 2728.2080000000001 | I11: =IF(RC1="","",IF(RC[-2]=0,0,RC[-1]/RC[-2])) -> 1.100000040319508 | J11: =IF(RC1="","",IF(RC[-1]=0,0,REPT("*",100*(RC[-1]-1)))) -> ********** | K11: =IF(RC1="","",VLOOKUP(RC1,ExpDump,8,FALSE)) -> 1521.4829999999999 | L11: =IF(RC1="","",IF(RC[-6]=0,0,RC[-1]/RC[-6])) -> 0.62572247797917557
A12: =IF(R[-1]C1="","",IF(DATE(YEAR(R[-1]C),MONTH(R[-1]C)+1,1)>ValDat,"",DATE(YEAR(R[-1]C),MONTH(R[-1]C)+1,1))) -> 1998-11-01T00:00:00.000 | B12: =IF(RC1="","",VLOOKUP(RC1,ExpDump,2,FALSE)) -> 1438.867 | C12: =IF(RC1="","",VLOOKUP(RC1,ExpDump,3,FALSE)) -> 101.901 | D12: =IF(RC1="","",VLOOKUP(RC1,ExpDump,4,FALSE)) -> 33.381 | E12: =IF(OR(RC1="",RC1=ExpDat),"",RC[1]-RC[-2]+RC[-1]-IF(ISNUMBER(R[-1]C[1])=TRUE(),R[-1]C[1],0)) -> 0 | F12: =IF(RC1="","",VLOOKUP(RC1,ExpDump,5,FALSE)) -> 2500.0819999999999 | G12: =IF(RC1="","",VLOOKUP(RC1,ExpDump,6,FALSE)) -> 2527.9580000000001 | H12: =IF(RC1="","",VLOOKUP(RC1,ExpDump,7,FALSE)) -> 2780.7539999999999 | I12: =IF(RC1="","",IF(RC[-2]=0,0,RC[-1]/RC[-2])) -> 1.1000000791152384 | J12: =IF(RC1="","",IF(RC[-1]=0,0,REPT("*",100*(RC[-1]-1)))) -> ********** | K12: =IF(RC1="","",VLOOKUP(RC1,ExpDump,8,FALSE)) -> 1556.6210000000001 | L12: =IF(RC1="","",IF(RC[-6]=0,0,RC[-1]/RC[-6])) -> 0.62262797780232815
A13: =IF(R[-1]C1="","",IF(DATE(YEAR(R[-1]C),MONTH(R[-1]C)+1,1)>ValDat,"",DATE(YEAR(R[-1]C),MONTH(R[-1]C)+1,1))) -> 1998-12-01T00:00:00.000 | B13: =IF(RC1="","",VLOOKUP(RC1,ExpDump,2,FALSE)) -> 1462.5160000000001 | C13: =IF(RC1="","",VLOOKUP(RC1,ExpDump,3,FALSE)) -> 75.546999999999997 | D13: =IF(RC1="","",VLOOKUP(RC1,ExpDump,4,FALSE)) -> 40.408999999999999 | E13: =IF(OR(RC1="",RC1=ExpDat),"",RC[1]-RC[-2]+RC[-1]-IF(ISNUMBER(R[-1]C[1])=TRUE(),R[-1]C[1],0)) -> 0 | F13: =IF(RC1="","",VLOOKUP(RC1,ExpDump,5,FALSE)) -> 2535.2199999999998 | G13: =IF(RC1="","",VLOOKUP(RC1,ExpDump,6,FALSE)) -> 2569.5079999999998 | H13: =IF(RC1="","",VLOOKUP(RC1,ExpDump,7,FALSE)) -> 2826.4589999999998 | I13: =IF(RC1="","",IF(RC[-2]=0,0,RC[-1]/RC[-2])) -> 1.1000000778359125 | J13: =IF(RC1="","",IF(RC[-1]=0,0,REPT("*",100*(RC[-1]-1)))) -> ********** | K13: =IF(RC1="","",VLOOKUP(RC1,ExpDump,8,FALSE)) -> 1579.461 | L13: =IF(RC1="","",IF(RC[-6]=0,0,RC[-1]/RC[-6])) -> 0.62300747075204521
A14: =IF(R[-1]C1="","",IF(DATE(YEAR(R[-1]C),MONTH(R[-1]C)+1,1)>ValDat,"",DATE(YEAR(R[-1]C),MONTH(R[-1]C)+1,1))) -> 1999-01-01T00:00:00.000 | B14: =IF(RC1="","",VLOOKUP(RC1,ExpDump,2,FALSE)) -> 1466.9680000000001 | C14: =IF(RC1="","",VLOOKUP(RC1,ExpDump,3,FALSE)) -> 42.165999999999997 | D14: =IF(RC1="","",VLOOKUP(RC1,ExpDump,4,FALSE)) -> 56.220999999999997 | E14: =IF(OR(RC1="",RC1=ExpDat),"",RC[1]-RC[-2]+RC[-1]-IF(ISNUMBER(R[-1]C[1])=TRUE(),R[-1]C[1],0)) -> 0 | F14: =IF(RC1="","",VLOOKUP(RC1,ExpDump,5,FALSE)) -> 2521.165 | G14: =IF(RC1="","",VLOOKUP(RC1,ExpDump,6,FALSE)) -> 2577.3290000000002 | H14: =IF(RC1="","",VLOOKUP(RC1,ExpDump,7,FALSE)) -> 2835.0619999999999 | I14: =IF(RC1="","",IF(RC[-2]=0,0,RC[-1]/RC[-2])) -> 1.1000000387998581 | J14: =IF(RC1="","",IF(RC[-1]=0,0,REPT("*",100*(RC[-1]-1)))) -> ********** | K14: =IF(RC1="","",VLOOKUP(RC1,ExpDump,8,FALSE)) -> 1586.489 | L14: =IF(RC1="","",IF(RC[-6]=0,0,RC[-1]/RC[-6])) -> 0.62926821528936028
A15: =IF(R[-1]C1="","",IF(DATE(YEAR(R[-1]C),MONTH(R[-1]C)+1,1)>ValDat,"",DATE(YEAR(R[-1]C),MONTH(R[-1]C)+1,1))) -> 1999-02-01T00:00:00.000 | B15: =IF(RC1="","",VLOOKUP(RC1,ExpDump,2,FALSE)) -> 1457.4290000000001 | C15: =IF(RC1="","",VLOOKUP(RC1,ExpDump,3,FALSE)) -> 47.436999999999998 | D15: =IF(RC1="","",VLOOKUP(RC1,ExpDump,4,FALSE)) -> 28.111000000000001 | E15: =IF(OR(RC1="",RC1=ExpDat),"",RC[1]-RC[-2]+RC[-1]-IF(ISNUMBER(R[-1]C[1])=TRUE(),R[-1]C[1],0)) -> 0 | F15: =IF(RC1="","",VLOOKUP(RC1,ExpDump,5,FALSE)) -> 2540.491 | G15: =IF(RC1="","",VLOOKUP(RC1,ExpDump,6,FALSE)) -> 2560.569 | H15: =IF(RC1="","",VLOOKUP(RC1,ExpDump,7,FALSE)) -> 2816.6260000000002 | I15: =IF(RC1="","",IF(RC[-2]=0,0,RC[-1]/RC[-2])) -> 1.1000000390538198 | J15: =IF(RC1="","",IF(RC[-1]=0,0,REPT("*",100*(RC[-1]-1)))) -> ********** | K15: =IF(RC1="","",VLOOKUP(RC1,ExpDump,8,FALSE)) -> 1607.5719999999999 | L15: =IF(RC1="","",IF(RC[-6]=0,0,RC[-1]/RC[-6])) -> 0.63278004133846566
A16: =IF(R[-1]C1="","",IF(DATE(YEAR(R[-1]C),MONTH(R[-1]C)+1,1)>ValDat,"",DATE(YEAR(R[-1]C),MONTH(R[-1]C)+1,1))) -> 1999-03-01T00:00:00.000 | B16: =IF(RC1="","",VLOOKUP(RC1,ExpDump,2,FALSE)) -> 1464.1289999999999 | C16: =IF(RC1="","",VLOOKUP(RC1,ExpDump,3,FALSE)) -> 36.895000000000003 | D16: =IF(RC1="","",VLOOKUP(RC1,ExpDump,4,FALSE)) -> 47.436999999999998 | E16: =IF(OR(RC1="",RC1=ExpDat),"",RC[1]-RC[-2]+RC[-1]-IF(ISNUMBER(R[-1]C[1])=TRUE(),R[-1]C[1],0)) -> 0 | F16: =IF(RC1="","",VLOOKUP(RC1,ExpDump,5,FALSE)) -> 2529.9490000000001 | G16: =IF(RC1="","",VLOOKUP(RC1,ExpDump,6,FALSE)) -> 2572.3420000000001 | H16: =IF(RC1="","",VLOOKUP(RC1,ExpDump,7,FALSE)) -> 2829.576 | I16: =IF(RC1="","",IF(RC[-2]=0,0,RC[-1]/RC[-2])) -> 1.0999999222498407 | J16: =IF(RC1="","",IF(RC[-1]=0,0,REPT("*",100*(RC[-1]-1)))) -> ********* | K16: =IF(RC1="","",VLOOKUP(RC1,ExpDump,8,FALSE)) -> 1623.384 | L16: =IF(RC1="","",IF(RC[-6]=0,0,RC[-1]/RC[-6])) -> 0.64166668972378493
A17: =IF(R[-1]C1="","",IF(DATE(YEAR(R[-1]C),MONTH(R[-1]C)+1,1)>ValDat,"",DATE(YEAR(R[-1]C),MONTH(R[-1]C)+1,1))) -> 1999-04-01T00:00:00.000 | B17: =IF(RC1="","",VLOOKUP(RC1,ExpDump,2,FALSE)) -> 1505.933 | C17: =IF(RC1="","",VLOOKUP(RC1,ExpDump,3,FALSE)) -> 121.227 | D17: =IF(RC1="","",VLOOKUP(RC1,ExpDump,4,FALSE)) -> 91.358999999999995 | E17: =IF(OR(RC1="",RC1=ExpDat),"",RC[1]-RC[-2]+RC[-1]-IF(ISNUMBER(R[-1]C[1])=TRUE(),R[-1]C[1],0)) -> 0 | F17: =IF(RC1="","",VLOOKUP(RC1,ExpDump,5,FALSE)) -> 2559.817 | G17: =IF(RC1="","",VLOOKUP(RC1,ExpDump,6,FALSE)) -> 2645.788 | H17: =IF(RC1="","",VLOOKUP(RC1,ExpDump,7,FALSE)) -> 2910.3670000000002 | I17: =IF(RC1="","",IF(RC[-2]=0,0,RC[-1]/RC[-2])) -> 1.1000000755918464 | J17: =IF(RC1="","",IF(RC[-1]=0,0,REPT("*",100*(RC[-1]-1)))) -> ********** | K17: =IF(RC1="","",VLOOKUP(RC1,ExpDump,8,FALSE)) -> 1676.0909999999999 | L17: =IF(RC1="","",IF(RC[-6]=0,0,RC[-1]/RC[-6])) -> 0.65476985268868826
A18: =IF(R[-1]C1="","",IF(DATE(YEAR(R[-1]C),MONTH(R[-1]C)+1,1)>ValDat,"",DATE(YEAR(R[-1]C),MONTH(R[-1]C)+1,1))) -> 1999-05-01T00:00:00.000 | B18: =IF(RC1="","",VLOOKUP(RC1,ExpDump,2,FALSE)) -> 1487.1289999999999 | C18: =IF(RC1="","",VLOOKUP(RC1,ExpDump,3,FALSE)) -> 59.734999999999999 | D18: =IF(RC1="","",VLOOKUP(RC1,ExpDump,4,FALSE)) -> 73.790000000000006 | E18: =IF(OR(RC1="",RC1=ExpDat),"",RC[1]-RC[-2]+RC[-1]-IF(ISNUMBER(R[-1]C[1])=TRUE(),R[-1]C[1],0)) -> -1.0000000002037268E-3 | F18: =IF(RC1="","",VLOOKUP(RC1,ExpDump,5,FALSE)) -> 2545.761 | G18: =IF(RC1="","",VLOOKUP(RC1,ExpDump,6,FALSE)) -> 2612.75 | H18: =IF(RC1="","",VLOOKUP(RC1,ExpDump,7,FALSE)) -> 2874.0259999999998 | I18: =IF(RC1="","",IF(RC[-2]=0,0,RC[-1]/RC[-2])) -> 1.1000003827384939 | J18: =IF(RC1="","",IF(RC[-1]=0,0,REPT("*",100*(RC[-1]-1)))) -> ********** | K18: =IF(RC1="","",VLOOKUP(RC1,ExpDump,8,FALSE)) -> 1704.202 | L18: =IF(RC1="","",IF(RC[-6]=0,0,RC[-1]/RC[-6])) -> 0.66942733430200241
A19: =IF(R[-1]C1="","",IF(DATE(YEAR(R[-1]C),MONTH(R[-1]C)+1,1)>ValDat,"",DATE(YEAR(R[-1]C),MONTH(R[-1]C)+1,1))) -> 1999-06-01T00:00:00.000 | B19: =IF(RC1="","",VLOOKUP(RC1,ExpDump,2,FALSE)) -> 1470 | C19: =IF(RC1="","",VLOOKUP(RC1,ExpDump,3,FALSE)) -> 36.895000000000003 | D19: =IF(RC1="","",VLOOKUP(RC1,ExpDump,4,FALSE)) -> 50.95 | E19: =IF(OR(RC1="",RC1=ExpDat),"",RC[1]-RC[-2]+RC[-1]-IF(ISNUMBER(R[-1]C[1])=TRUE(),R[-1]C[1],0)) -> 0 | F19: =IF(RC1="","",VLOOKUP(RC1,ExpDump,5,FALSE)) -> 2531.7060000000001 | G19: =IF(RC1="","",VLOOKUP(RC1,ExpDump,6,FALSE)) -> 2582.6559999999999 | H19: =IF(RC1="","",VLOOKUP(RC1,ExpDump,7,FALSE)) -> 2840.922 | I19: =IF(RC1="","",IF(RC[-2]=0,0,RC[-1]/RC[-2])) -> 1.1000001548793181 | J19: =IF(RC1="","",IF(RC[-1]=0,0,REPT("*",100*(RC[-1]-1)))) -> ********** | K19: =IF(RC1="","",VLOOKUP(RC1,ExpDump,8,FALSE)) -> 1720.0139999999999 | L19: =IF(RC1="","",IF(RC[-6]=0,0,RC[-1]/RC[-6])) -> 0.67938931297709915
A20: =IF(R[-1]C1="","",IF(DATE(YEAR(R[-1]C),MONTH(R[-1]C)+1,1)>ValDat,"",DATE(YEAR(R[-1]C),MONTH(R[-1]C)+1,1))) -> 1999-07-01T00:00:00.000 | B20: =IF(RC1="","",VLOOKUP(RC1,ExpDump,2,FALSE)) -> 1464.548 | C20: =IF(RC1="","",VLOOKUP(RC1,ExpDump,3,FALSE)) -> 43.923000000000002 | D20: =IF(RC1="","",VLOOKUP(RC1,ExpDump,4,FALSE)) -> 61.491999999999997 | E20: =IF(OR(RC1="",RC1=ExpDat),"",RC[1]-RC[-2]+RC[-1]-IF(ISNUMBER(R[-1]C[1])=TRUE(),R[-1]C[1],0)) -> 0 | F20: =IF(RC1="","",VLOOKUP(RC1,ExpDump,5,FALSE)) -> 2514.1370000000002 | G20: =IF(RC1="","",VLOOKUP(RC1,ExpDump,6,FALSE)) -> 2573.078 | H20: =IF(RC1="","",VLOOKUP(RC1,ExpDump,7,FALSE)) -> 2830.386 | I20: =IF(RC1="","",IF(RC[-2]=0,0,RC[-1]/RC[-2])) -> 1.1000000777279195 | J20: =IF(RC1="","",IF(RC[-1]=0,0,REPT("*",100*(RC[-1]-1)))) -> ********** | K20: =IF(RC1="","",VLOOKUP(RC1,ExpDump,8,FALSE)) -> 1734.069 | L20: =IF(RC1="","",IF(RC[-6]=0,0,RC[-1]/RC[-6])) -> 0.68972732989491015
A21: =IF(R[-1]C1="","",IF(DATE(YEAR(R[-1]C),MONTH(R[-1]C)+1,1)>ValDat,"",DATE(YEAR(R[-1]C),MONTH(R[-1]C)+1,1))) -> 1999-08-01T00:00:00.000 | B21: =IF(RC1="","",VLOOKUP(RC1,ExpDump,2,FALSE)) -> 1530.4839999999999 | C21: =IF(RC1="","",VLOOKUP(RC1,ExpDump,3,FALSE)) -> 187.989 | D21: =IF(RC1="","",VLOOKUP(RC1,ExpDump,4,FALSE)) -> 47.436999999999998 | E21: =IF(OR(RC1="",RC1=ExpDat),"",RC[1]-RC[-2]+RC[-1]-IF(ISNUMBER(R[-1]C[1])=TRUE(),R[-1]C[1],0)) -> 9.9999999974897946E-4 | F21: =IF(RC1="","",VLOOKUP(RC1,ExpDump,5,FALSE)) -> 2654.69 | G21: =IF(RC1="","",VLOOKUP(RC1,ExpDump,6,FALSE)) -> 2688.9209999999998 | H21: =IF(RC1="","",VLOOKUP(RC1,ExpDump,7,FALSE)) -> 2957.8130000000001 | I21: =IF(RC1="","",IF(RC[-2]=0,0,RC[-1]/RC[-2])) -> 1.0999999628103616 | J21: =IF(RC1="","",IF(RC[-1]=0,0,REPT("*",100*(RC[-1]-1)))) -> ********* | K21: =IF(RC1="","",VLOOKUP(RC1,ExpDump,8,FALSE)) -> 1858.81 | L21: =IF(RC1="","",IF(RC[-6]=0,0,RC[-1]/RC[-6])) -> 0.70019851658762411
A22: =IF(R[-1]C1="","",IF(DATE(YEAR(R[-1]C),MONTH(R[-1]C)+1,1)>ValDat,"",DATE(YEAR(R[-1]C),MONTH(R[-1]C)+1,1))) -> 1999-09-01T00:00:00.000 | B22: =IF(RC1="","",VLOOKUP(RC1,ExpDump,2,FALSE)) -> 1538.8 | C22: =IF(RC1="","",VLOOKUP(RC1,ExpDump,3,FALSE)) -> 49.192999999999998 | D22: =IF(RC1="","",VLOOKUP(RC1,ExpDump,4,FALSE)) -> 50.95 | E22: =IF(OR(RC1="",RC1=ExpDat),"",RC[1]-RC[-2]+RC[-1]-IF(ISNUMBER(R[-1]C[1])=TRUE(),R[-1]C[1],0)) -> -4.5474735088646412E-13 | F22: =IF(RC1="","",VLOOKUP(RC1,ExpDump,5,FALSE)) -> 2652.933 | G22: =IF(RC1="","",VLOOKUP(RC1,ExpDump,6,FALSE)) -> 2703.5320000000002 | H22: =IF(RC1="","",VLOOKUP(RC1,ExpDump,7,FALSE)) -> 2973.8850000000002 | I22: =IF(RC1="","",IF(RC[-2]=0,0,RC[-1]/RC[-2])) -> 1.0999999260226991 | J22: =IF(RC1="","",IF(RC[-1]=0,0,REPT("*",100*(RC[-1]-1)))) -> ********* | K22: =IF(RC1="","",VLOOKUP(RC1,ExpDump,8,FALSE)) -> 1879.893 | L22: =IF(RC1="","",IF(RC[-6]=0,0,RC[-1]/RC[-6])) -> 0.70860930147877843
A23: =IF(R[-1]C1="","",IF(DATE(YEAR(R[-1]C),MONTH(R[-1]C)+1,1)>ValDat,"",DATE(YEAR(R[-1]C),MONTH(R[-1]C)+1,1))) -> 1999-10-01T00:00:00.000 | B23: =IF(RC1="","",VLOOKUP(RC1,ExpDump,2,FALSE)) -> 1523 | C23: =IF(RC1="","",VLOOKUP(RC1,ExpDump,3,FALSE)) -> 24.597000000000001 | D23: =IF(RC1="","",VLOOKUP(RC1,ExpDump,4,FALSE)) -> 49.192999999999998 | E23: =IF(OR(RC1="",RC1=ExpDat),"",RC[1]-RC[-2]+RC[-1]-IF(ISNUMBER(R[-1]C[1])=TRUE(),R[-1]C[1],0)) -> -1.0000000002037268E-3 | F23: =IF(RC1="","",VLOOKUP(RC1,ExpDump,5,FALSE)) -> 2628.3359999999998 | G23: =IF(RC1="","",VLOOKUP(RC1,ExpDump,6,FALSE)) -> 2675.7730000000001 | H23: =IF(RC1="","",VLOOKUP(RC1,ExpDump,7,FALSE)) -> 2943.35 | I23: =IF(RC1="","",IF(RC[-2]=0,0,RC[-1]/RC[-2])) -> 1.0999998878828658 | J23: =IF(RC1="","",IF(RC[-1]=0,0,REPT("*",100*(RC[-1]-1)))) -> ********* | K23: =IF(RC1="","",VLOOKUP(RC1,ExpDump,8,FALSE)) -> 1893.9480000000001 | L23: =IF(RC1="","",IF(RC[-6]=0,0,RC[-1]/RC[-6])) -> 0.72058823529411775
A24: =IF(R[-1]C1="","",IF(DATE(YEAR(R[-1]C),MONTH(R[-1]C)+1,1)>ValDat,"",DATE(YEAR(R[-1]C),MONTH(R[-1]C)+1,1))) -> 1999-11-01T00:00:00.000 | B24: =IF(RC1="","",VLOOKUP(RC1,ExpDump,2,FALSE)) -> 1559.6 | C24: =IF(RC1="","",VLOOKUP(RC1,ExpDump,3,FALSE)) -> 112.44199999999999 | D24: =IF(RC1="","",VLOOKUP(RC1,ExpDump,4,FALSE)) -> 22.84 | E24: =IF(OR(RC1="",RC1=ExpDat),"",RC[1]-RC[-2]+RC[-1]-IF(ISNUMBER(R[-1]C[1])=TRUE(),R[-1]C[1],0)) -> 4.5474735088646412E-13 | F24: =IF(RC1="","",VLOOKUP(RC1,ExpDump,5,FALSE)) -> 2717.9380000000001 | G24: =IF(RC1="","",VLOOKUP(RC1,ExpDump,6,FALSE)) -> 2740.0749999999998 | H24: =IF(RC1="","",VLOOKUP(RC1,ExpDump,7,FALSE)) -> 3014.0830000000001 | I24: =IF(RC1="","",IF(RC[-2]=0,0,RC[-1]/RC[-2])) -> 1.1000001824767571 | J24: =IF(RC1="","",IF(RC[-1]=0,0,REPT("*",100*(RC[-1]-1)))) -> ********** | K24: =IF(RC1="","",VLOOKUP(RC1,ExpDump,8,FALSE)) -> 1973.009 | L24: =IF(RC1="","",IF(RC[-6]=0,0,RC[-1]/RC[-6])) -> 0.72592126825556724
A25: =IF(R[-1]C1="","",IF(DATE(YEAR(R[-1]C),MONTH(R[-1]C)+1,1)>ValDat,"",DATE(YEAR(R[-1]C),MONTH(R[-1]C)+1,1))) -> 1999-12-01T00:00:00.000 | B25: =IF(RC1="","",VLOOKUP(RC1,ExpDump,2,FALSE)) -> 1562 | C25: =IF(RC1="","",VLOOKUP(RC1,ExpDump,3,FALSE)) -> 33.381 | D25: =IF(RC1="","",VLOOKUP(RC1,ExpDump,4,FALSE)) -> 79.061000000000007 | E25: =IF(OR(RC1="",RC1=ExpDat),"",RC[1]-RC[-2]+RC[-1]-IF(ISNUMBER(R[-1]C[1])=TRUE(),R[-1]C[1],0)) -> 1.0000000002037268E-3 | F25: =IF(RC1="","",VLOOKUP(RC1,ExpDump,5,FALSE)) -> 2672.259 | G25: =IF(RC1="","",VLOOKUP(RC1,ExpDump,6,FALSE)) -> 2744.2919999999999 | H25: =IF(RC1="","",VLOOKUP(RC1,ExpDump,7,FALSE)) -> 3018.721 | I25: =IF(RC1="","",IF(RC[-2]=0,0,RC[-1]/RC[-2])) -> 1.099999927121458 | J25: =IF(RC1="","",IF(RC[-1]=0,0,REPT("*",100*(RC[-1]-1)))) -> ********* | K25: =IF(RC1="","",VLOOKUP(RC1,ExpDump,8,FALSE)) -> 1990.578 | L25: =IF(RC1="","",IF(RC[-6]=0,0,RC[-1]/RC[-6])) -> 0.74490459195759096
A26: =IF(R[-1]C1="","",IF(DATE(YEAR(R[-1]C),MONTH(R[-1]C)+1,1)>ValDat,"",DATE(YEAR(R[-1]C),MONTH(R[-1]C)+1,1))) -> 2000-01-01T00:00:00.000 | B26: =IF(RC1="","",VLOOKUP(RC1,ExpDump,2,FALSE)) -> 1554.0319999999999 | C26: =IF(RC1="","",VLOOKUP(RC1,ExpDump,3,FALSE)) -> 59.734999999999999 | D26: =IF(RC1="","",VLOOKUP(RC1,ExpDump,4,FALSE)) -> 35.137999999999998 | E26: =IF(OR(RC1="",RC1=ExpDat),"",RC[1]-RC[-2]+RC[-1]-IF(ISNUMBER(R[-1]C[1])=TRUE(),R[-1]C[1],0)) -> -1.0000000002037268E-3 | F26: =IF(RC1="","",VLOOKUP(RC1,ExpDump,5,FALSE)) -> 2696.855 | G26: =IF(RC1="","",VLOOKUP(RC1,ExpDump,6,FALSE)) -> 2730.2930000000001 | H26: =IF(RC1="","",VLOOKUP(RC1,ExpDump,7,FALSE)) -> 3003.3229999999999 | I26: =IF(RC1="","",IF(RC[-2]=0,0,RC[-1]/RC[-2])) -> 1.1000002563827398 | J26: =IF(RC1="","",IF(RC[-1]=0,0,REPT("*",100*(RC[-1]-1)))) -> ********** | K26: =IF(RC1="","",VLOOKUP(RC1,ExpDump,8,FALSE)) -> 2020.4449999999999 | L26: =IF(RC1="","",IF(RC[-6]=0,0,RC[-1]/RC[-6])) -> 0.74918562547856671
A27: =IF(R[-1]C1="","",IF(DATE(YEAR(R[-1]C),MONTH(R[-1]C)+1,1)>ValDat,"",DATE(YEAR(R[-1]C),MONTH(R[-1]C)+1,1))) -> 2000-02-01T00:00:00.000 | B27: =IF(RC1="","",VLOOKUP(RC1,ExpDump,2,FALSE)) -> 1555.4480000000001 | C27: =IF(RC1="","",VLOOKUP(RC1,ExpDump,3,FALSE)) -> 38.652000000000001 | D27: =IF(RC1="","",VLOOKUP(RC1,ExpDump,4,FALSE)) -> 56.220999999999997 | E27: =IF(OR(RC1="",RC1=ExpDat),"",RC[1]-RC[-2]+RC[-1]-IF(ISNUMBER(R[-1]C[1])=TRUE(),R[-1]C[1],0)) -> 0 | F27: =IF(RC1="","",VLOOKUP(RC1,ExpDump,5,FALSE)) -> 2679.2860000000001 | G27: =IF(RC1="","",VLOOKUP(RC1,ExpDump,6,FALSE)) -> 2732.7809999999999 | H27: =IF(RC1="","",VLOOKUP(RC1,ExpDump,7,FALSE)) -> 3006.0590000000002 | I27: =IF(RC1="","",IF(RC[-2]=0,0,RC[-1]/RC[-2])) -> 1.0999999634072399 | J27: =IF(RC1="","",IF(RC[-1]=0,0,REPT("*",100*(RC[-1]-1)))) -> ********* | K27: =IF(RC1="","",VLOOKUP(RC1,ExpDump,8,FALSE)) -> 2032.7439999999999 | L27: =IF(RC1="","",IF(RC[-6]=0,0,RC[-1]/RC[-6])) -> 0.75868869542109352
A28: =IF(R[-1]C1="","",IF(DATE(YEAR(R[-1]C),MONTH(R[-1]C)+1,1)>ValDat,"",DATE(YEAR(R[-1]C),MONTH(R[-1]C)+1,1))) -> 2000-03-01T00:00:00.000 | B28: =IF(RC1="","",VLOOKUP(RC1,ExpDump,2,FALSE)) -> 1553.0319999999999 | C28: =IF(RC1="","",VLOOKUP(RC1,ExpDump,3,FALSE)) -> 54.463999999999999 | D28: =IF(RC1="","",VLOOKUP(RC1,ExpDump,4,FALSE)) -> 66.763000000000005 | E28: =IF(OR(RC1="",RC1=ExpDat),"",RC[1]-RC[-2]+RC[-1]-IF(ISNUMBER(R[-1]C[1])=TRUE(),R[-1]C[1],0)) -> 9.9999999974897946E-4 | F28: =IF(RC1="","",VLOOKUP(RC1,ExpDump,5,FALSE)) -> 2666.9879999999998 | G28: =IF(RC1="","",VLOOKUP(RC1,ExpDump,6,FALSE)) -> 2728.5360000000001 | H28: =IF(RC1="","",VLOOKUP(RC1,ExpDump,7,FALSE)) -> 3001.39 | I28: =IF(RC1="","",IF(RC[-2]=0,0,RC[-1]/RC[-2])) -> 1.1000001465987621 | J28: =IF(RC1="","",IF(RC[-1]=0,0,REPT("*",100*(RC[-1]-1)))) -> ********** | K28: =IF(RC1="","",VLOOKUP(RC1,ExpDump,8,FALSE)) -> 2059.0970000000002 | L28: =IF(RC1="","",IF(RC[-6]=0,0,RC[-1]/RC[-6])) -> 0.77206834076493791
A29: =IF(R[-1]C1="","",IF(DATE(YEAR(R[-1]C),MONTH(R[-1]C)+1,1)>ValDat,"",DATE(YEAR(R[-1]C),MONTH(R[-1]C)+1,1))) -> 2000-04-01T00:00:00.000 | B29: =IF(RC1="","",VLOOKUP(RC1,ExpDump,2,FALSE)) -> 1566.7 | C29: =IF(RC1="","",VLOOKUP(RC1,ExpDump,3,FALSE)) -> 86.088999999999999 | D29: =IF(RC1="","",VLOOKUP(RC1,ExpDump,4,FALSE)) -> 56.220999999999997 | E29: =IF(OR(RC1="",RC1=ExpDat),"",RC[1]-RC[-2]+RC[-1]-IF(ISNUMBER(R[-1]C[1])=TRUE(),R[-1]C[1],0)) -> -9.9999999974897946E-4 | F29: =IF(RC1="","",VLOOKUP(RC1,ExpDump,5,FALSE)) -> 2696.855 | G29: =IF(RC1="","",VLOOKUP(RC1,ExpDump,6,FALSE)) -> 2752.549 | H29: =IF(RC1="","",VLOOKUP(RC1,ExpDump,7,FALSE)) -> 3027.8040000000001 | I29: =IF(RC1="","",IF(RC[-2]=0,0,RC[-1]/RC[-2])) -> 1.1000000363299618 | J29: =IF(RC1="","",IF(RC[-1]=0,0,REPT("*",100*(RC[-1]-1)))) -> ********** | K29: =IF(RC1="","",VLOOKUP(RC1,ExpDump,8,FALSE)) -> 2087.2080000000001 | L29: =IF(RC1="","",IF(RC[-6]=0,0,RC[-1]/RC[-6])) -> 0.77394149852327987
A30: =IF(R[-1]C1="","",IF(DATE(YEAR(R[-1]C),MONTH(R[-1]C)+1,1)>ValDat,"",DATE(YEAR(R[-1]C),MONTH(R[-1]C)+1,1))) -> 2000-05-01T00:00:00.000 | B30: =IF(RC1="","",VLOOKUP(RC1,ExpDump,2,FALSE)) -> 1579.8710000000001 | C30: =IF(RC1="","",VLOOKUP(RC1,ExpDump,3,FALSE)) -> 82.575000000000003 | D30: =IF(RC1="","",VLOOKUP(RC1,ExpDump,4,FALSE)) -> 57.978000000000002 | E30: =IF(OR(RC1="",RC1=ExpDat),"",RC[1]-RC[-2]+RC[-1]-IF(ISNUMBER(R[-1]C[1])=TRUE(),R[-1]C[1],0)) -> 4.5474735088646412E-13 | F30: =IF(RC1="","",VLOOKUP(RC1,ExpDump,5,FALSE)) -> 2721.4520000000002 | G30: =IF(RC1="","",VLOOKUP(RC1,ExpDump,6,FALSE)) -> 2775.69 | H30: =IF(RC1="","",VLOOKUP(RC1,ExpDump,7,FALSE)) -> 3053.259 | I30: =IF(RC1="","",IF(RC[-2]=0,0,RC[-1]/RC[-2])) -> 1.1000000000000001 | J30: =IF(RC1="","",IF(RC[-1]=0,0,REPT("*",100*(RC[-1]-1)))) -> ********** | K30: =IF(RC1="","",VLOOKUP(RC1,ExpDump,8,FALSE)) -> 2145.1860000000001 | L30: =IF(RC1="","",IF(RC[-6]=0,0,RC[-1]/RC[-6])) -> 0.78825053684577207
A31: =IF(R[-1]C1="","",IF(DATE(YEAR(R[-1]C),MONTH(R[-1]C)+1,1)>ValDat,"",DATE(YEAR(R[-1]C),MONTH(R[-1]C)+1,1))) -> 2000-06-01T00:00:00.000 | B31: =IF(RC1="","",VLOOKUP(RC1,ExpDump,2,FALSE)) -> 1562.4 | C31: =IF(RC1="","",VLOOKUP(RC1,ExpDump,3,FALSE)) -> 24.597000000000001 | D31: =IF(RC1="","",VLOOKUP(RC1,ExpDump,4,FALSE)) -> 57.978000000000002 | E31: =IF(OR(RC1="",RC1=ExpDat),"",RC[1]-RC[-2]+RC[-1]-IF(ISNUMBER(R[-1]C[1])=TRUE(),R[-1]C[1],0)) -> -4.5474735088646412E-13 | F31: =IF(RC1="","",VLOOKUP(RC1,ExpDump,5,FALSE)) -> 2688.0709999999999 | G31: =IF(RC1="","",VLOOKUP(RC1,ExpDump,6,FALSE)) -> 2744.9949999999999 | H31: =IF(RC1="","",VLOOKUP(RC1,ExpDump,7,FALSE)) -> 3019.4940000000001 | I31: =IF(RC1="","",IF(RC[-2]=0,0,RC[-1]/RC[-2])) -> 1.0999998178503059 | J31: =IF(RC1="","",IF(RC[-1]=0,0,REPT("*",100*(RC[-1]-1)))) -> ********* | K31: =IF(RC1="","",VLOOKUP(RC1,ExpDump,8,FALSE)) -> 2160.998 | L31: =IF(RC1="","",IF(RC[-6]=0,0,RC[-1]/RC[-6])) -> 0.80392147380035728
A32: =IF(R[-1]C1="","",IF(DATE(YEAR(R[-1]C),MONTH(R[-1]C)+1,1)>ValDat,"",DATE(YEAR(R[-1]C),MONTH(R[-1]C)+1,1))) -> 2000-07-01T00:00:00.000 | B32: =IF(RC1="","",VLOOKUP(RC1,ExpDump,2,FALSE)) -> 1555.452 | C32: =IF(RC1="","",VLOOKUP(RC1,ExpDump,3,FALSE)) -> 47.436999999999998 | D32: =IF(RC1="","",VLOOKUP(RC1,ExpDump,4,FALSE)) -> 47.436999999999998 | E32: =IF(OR(RC1="",RC1=ExpDat),"",RC[1]-RC[-2]+RC[-1]-IF(ISNUMBER(R[-1]C[1])=TRUE(),R[-1]C[1],0)) -> 0 | F32: =IF(RC1="","",VLOOKUP(RC1,ExpDump,5,FALSE)) -> 2688.0709999999999 | G32: =IF(RC1="","",VLOOKUP(RC1,ExpDump,6,FALSE)) -> 2732.7869999999998 | H32: =IF(RC1="","",VLOOKUP(RC1,ExpDump,7,FALSE)) -> 3006.0659999999998 | I32: =IF(RC1="","",IF(RC[-2]=0,0,RC[-1]/RC[-2])) -> 1.1000001097780399 | J32: =IF(RC1="","",IF(RC[-1]=0,0,REPT("*",100*(RC[-1]-1)))) -> ********** | K32: =IF(RC1="","",VLOOKUP(RC1,ExpDump,8,FALSE)) -> 2192.623 | L32: =IF(RC1="","",IF(RC[-6]=0,0,RC[-1]/RC[-6])) -> 0.81568641602100544
A33: =IF(R[-1]C1="","",IF(DATE(YEAR(R[-1]C),MONTH(R[-1]C)+1,1)>ValDat,"",DATE(YEAR(R[-1]C),MONTH(R[-1]C)+1,1))) -> 2000-08-01T00:00:00.000 | B33: =IF(RC1="","",VLOOKUP(RC1,ExpDump,2,FALSE)) -> 1545.7739999999999 | C33: =IF(RC1="","",VLOOKUP(RC1,ExpDump,3,FALSE)) -> 33.381 | D33: =IF(RC1="","",VLOOKUP(RC1,ExpDump,4,FALSE)) -> 49.192999999999998 | E33: =IF(OR(RC1="",RC1=ExpDat),"",RC[1]-RC[-2]+RC[-1]-IF(ISNUMBER(R[-1]C[1])=TRUE(),R[-1]C[1],0)) -> 4.5474735088646412E-13 | F33: =IF(RC1="","",VLOOKUP(RC1,ExpDump,5,FALSE)) -> 2672.259 | G33: =IF(RC1="","",VLOOKUP(RC1,ExpDump,6,FALSE)) -> 2715.7849999999999 | H33: =IF(RC1="","",VLOOKUP(RC1,ExpDump,7,FALSE)) -> 2987.3629999999998 | I33: =IF(RC1="","",IF(RC[-2]=0,0,RC[-1]/RC[-2])) -> 1.0999998158911697 | J33: =IF(RC1="","",IF(RC[-1]=0,0,REPT("*",100*(RC[-1]-1)))) -> ********* | K33: =IF(RC1="","",VLOOKUP(RC1,ExpDump,8,FALSE)) -> 2208.4349999999999 | L33: =IF(RC1="","",IF(RC[-6]=0,0,RC[-1]/RC[-6])) -> 0.82642999799046424
A34: =IF(R[-1]C1="","",IF(DATE(YEAR(R[-1]C),MONTH(R[-1]C)+1,1)>ValDat,"",DATE(YEAR(R[-1]C),MONTH(R[-1]C)+1,1))) -> 2000-09-01T00:00:00.000 | B34: =IF(RC1="","",VLOOKUP(RC1,ExpDump,2,FALSE)) -> 1528.1669999999999 | C34: =IF(RC1="","",VLOOKUP(RC1,ExpDump,3,FALSE)) -> 21.082999999999998 | D34: =IF(RC1="","",VLOOKUP(RC1,ExpDump,4,FALSE)) -> 68.519000000000005 | E34: =IF(OR(RC1="",RC1=ExpDat),"",RC[1]-RC[-2]+RC[-1]-IF(ISNUMBER(R[-1]C[1])=TRUE(),R[-1]C[1],0)) -> -1.0000000002037268E-3 | F34: =IF(RC1="","",VLOOKUP(RC1,ExpDump,5,FALSE)) -> 2624.8220000000001 | G34: =IF(RC1="","",VLOOKUP(RC1,ExpDump,6,FALSE)) -> 2684.85 | H34: =IF(RC1="","",VLOOKUP(RC1,ExpDump,7,FALSE)) -> 2953.335 | I34: =IF(RC1="","",IF(RC[-2]=0,0,RC[-1]/RC[-2])) -> 1.1000000000000001 | J34: =IF(RC1="","",IF(RC[-1]=0,0,REPT("*",100*(RC[-1]-1)))) -> ********** | K34: =IF(RC1="","",VLOOKUP(RC1,ExpDump,8,FALSE)) -> 2217.2190000000001 | L34: =IF(RC1="","",IF(RC[-6]=0,0,RC[-1]/RC[-6])) -> 0.84471213667060085
A35: =IF(R[-1]C1="","",IF(DATE(YEAR(R[-1]C),MONTH(R[-1]C)+1,1)>ValDat,"",DATE(YEAR(R[-1]C),MONTH(R[-1]C)+1,1))) -> 2000-10-01T00:00:00.000 | B35: =IF(RC1="","",VLOOKUP(RC1,ExpDump,2,FALSE)) -> 1514.6769999999999 | C35: =IF(RC1="","",VLOOKUP(RC1,ExpDump,3,FALSE)) -> 40.408999999999999 | D35: =IF(RC1="","",VLOOKUP(RC1,ExpDump,4,FALSE)) -> 61.491999999999997 | E35: =IF(OR(RC1="",RC1=ExpDat),"",RC[1]-RC[-2]+RC[-1]-IF(ISNUMBER(R[-1]C[1])=TRUE(),R[-1]C[1],0)) -> 0 | F35: =IF(RC1="","",VLOOKUP(RC1,ExpDump,5,FALSE)) -> 2603.739 | G35: =IF(RC1="","",VLOOKUP(RC1,ExpDump,6,FALSE)) -> 2661.1509999999998 | H35: =IF(RC1="","",VLOOKUP(RC1,ExpDump,7,FALSE)) -> 2927.2660000000001 | I35: =IF(RC1="","",IF(RC[-2]=0,0,RC[-1]/RC[-2])) -> 1.0999999624222754 | J35: =IF(RC1="","",IF(RC[-1]=0,0,REPT("*",100*(RC[-1]-1)))) -> ********* | K35: =IF(RC1="","",VLOOKUP(RC1,ExpDump,8,FALSE)) -> 2240.0590000000002 | L35: =IF(RC1="","",IF(RC[-6]=0,0,RC[-1]/RC[-6])) -> 0.86032394183902461
A36: =IF(R[-1]C1="","",IF(DATE(YEAR(R[-1]C),MONTH(R[-1]C)+1,1)>ValDat,"",DATE(YEAR(R[-1]C),MONTH(R[-1]C)+1,1))) -> 2000-11-01T00:00:00.000 | B36: =IF(RC1="","",VLOOKUP(RC1,ExpDump,2,FALSE)) -> 1499.133 | C36: =IF(RC1="","",VLOOKUP(RC1,ExpDump,3,FALSE)) -> 35.137999999999998 | D36: =IF(RC1="","",VLOOKUP(RC1,ExpDump,4,FALSE)) -> 36.895000000000003 | E36: =IF(OR(RC1="",RC1=ExpDat),"",RC[1]-RC[-2]+RC[-1]-IF(ISNUMBER(R[-1]C[1])=TRUE(),R[-1]C[1],0)) -> 0 | F36: =IF(RC1="","",VLOOKUP(RC1,ExpDump,5,FALSE)) -> 2601.982 | G36: =IF(RC1="","",VLOOKUP(RC1,ExpDump,6,FALSE)) -> 2633.8409999999999 | H36: =IF(RC1="","",VLOOKUP(RC1,ExpDump,7,FALSE)) -> 2897.2249999999999 | I36: =IF(RC1="","",IF(RC[-2]=0,0,RC[-1]/RC[-2])) -> 1.0999999620326359 | J36: =IF(RC1="","",IF(RC[-1]=0,0,REPT("*",100*(RC[-1]-1)))) -> ********* | K36: =IF(RC1="","",VLOOKUP(RC1,ExpDump,8,FALSE)) -> 2261.1419999999998 | L36: =IF(RC1="","",IF(RC[-6]=0,0,RC[-1]/RC[-6])) -> 0.86900754886082987
A37: =IF(R[-1]C1="","",IF(DATE(YEAR(R[-1]C),MONTH(R[-1]C)+1,1)>ValDat,"",DATE(YEAR(R[-1]C),MONTH(R[-1]C)+1,1))) -> 2000-12-01T00:00:00.000 | B37: =IF(RC1="","",VLOOKUP(RC1,ExpDump,2,FALSE)) -> 1493.9349999999999 | C37: =IF(RC1="","",VLOOKUP(RC1,ExpDump,3,FALSE)) -> 24.597000000000001 | D37: =IF(RC1="","",VLOOKUP(RC1,ExpDump,4,FALSE)) -> 31.623999999999999 | E37: =IF(OR(RC1="",RC1=ExpDat),"",RC[1]-RC[-2]+RC[-1]-IF(ISNUMBER(R[-1]C[1])=TRUE(),R[-1]C[1],0)) -> -4.5474735088646412E-13 | F37: =IF(RC1="","",VLOOKUP(RC1,ExpDump,5,FALSE)) -> 2594.9549999999999 | G37: =IF(RC1="","",VLOOKUP(RC1,ExpDump,6,FALSE)) -> 2624.7089999999998 | H37: =IF(RC1="","",VLOOKUP(RC1,ExpDump,7,FALSE)) -> 2887.18 | I37: =IF(RC1="","",IF(RC[-2]=0,0,RC[-1]/RC[-2])) -> 1.1000000380994617 | J37: =IF(RC1="","",IF(RC[-1]=0,0,REPT("*",100*(RC[-1]-1)))) -> ********** | K37: =IF(RC1="","",VLOOKUP(RC1,ExpDump,8,FALSE)) -> 2269.9270000000001 | L37: =IF(RC1="","",IF(RC[-6]=0,0,RC[-1]/RC[-6])) -> 0.87474619020368372
A38: =IF(R[-1]C1="","",IF(DATE(YEAR(R[-1]C),MONTH(R[-1]C)+1,1)>ValDat,"",DATE(YEAR(R[-1]C),MONTH(R[-1]C)+1,1))) -> 2001-01-01T00:00:00.000 | B38: =IF(RC1="","",VLOOKUP(RC1,ExpDump,2,FALSE)) -> 1494.258 | C38: =IF(RC1="","",VLOOKUP(RC1,ExpDump,3,FALSE)) -> 35.137999999999998 | D38: =IF(RC1="","",VLOOKUP(RC1,ExpDump,4,FALSE)) -> 40.408999999999999 | E38: =IF(OR(RC1="",RC1=ExpDat),"",RC[1]-RC[-2]+RC[-1]-IF(ISNUMBER(R[-1]C[1])=TRUE(),R[-1]C[1],0)) -> 4.5474735088646412E-13 | F38: =IF(RC1="","",VLOOKUP(RC1,ExpDump,5,FALSE)) -> 2589.6840000000002 | G38: =IF(RC1="","",VLOOKUP(RC1,ExpDump,6,FALSE)) -> 2625.2750000000001 | H38: =IF(RC1="","",VLOOKUP(RC1,ExpDump,7,FALSE)) -> 2887.8029999999999 | I38: =IF(RC1="","",IF(RC[-2]=0,0,RC[-1]/RC[-2])) -> 1.1000001904562378 | J38: =IF(RC1="","",IF(RC[-1]=0,0,REPT("*",100*(RC[-1]-1)))) -> ********** | K38: =IF(RC1="","",VLOOKUP(RC1,ExpDump,8,FALSE)) -> 2299.7939999999999 | L38: =IF(RC1="","",IF(RC[-6]=0,0,RC[-1]/RC[-6])) -> 0.88805970149253721
A39: =IF(R[-1]C1="","",IF(DATE(YEAR(R[-1]C),MONTH(R[-1]C)+1,1)>ValDat,"",DATE(YEAR(R[-1]C),MONTH(R[-1]C)+1,1))) -> 2001-02-01T00:00:00.000 | B39: =IF(RC1="","",VLOOKUP(RC1,ExpDump,2,FALSE)) -> 1493.857 | C39: =IF(RC1="","",VLOOKUP(RC1,ExpDump,3,FALSE)) -> 38.652000000000001 | D39: =IF(RC1="","",VLOOKUP(RC1,ExpDump,4,FALSE)) -> 70.275999999999996 | E39: =IF(OR(RC1="",RC1=ExpDat),"",RC[1]-RC[-2]+RC[-1]-IF(ISNUMBER(R[-1]C[1])=TRUE(),R[-1]C[1],0)) -> -4.5474735088646412E-13 | F39: =IF(RC1="","",VLOOKUP(RC1,ExpDump,5,FALSE)) -> 2558.06 | G39: =IF(RC1="","",VLOOKUP(RC1,ExpDump,6,FALSE)) -> 2624.5709999999999 | H39: =IF(RC1="","",VLOOKUP(RC1,ExpDump,7,FALSE)) -> 2887.0279999999998 | I39: =IF(RC1="","",IF(RC[-2]=0,0,RC[-1]/RC[-2])) -> 1.099999961898535 | J39: =IF(RC1="","",IF(RC[-1]=0,0,REPT("*",100*(RC[-1]-1)))) -> ********* | K39: =IF(RC1="","",VLOOKUP(RC1,ExpDump,8,FALSE)) -> 2338.4459999999999 | L39: =IF(RC1="","",IF(RC[-6]=0,0,RC[-1]/RC[-6])) -> 0.91414822169925647
A40: =IF(R[-1]C1="","",IF(DATE(YEAR(R[-1]C),MONTH(R[-1]C)+1,1)>ValDat,"",DATE(YEAR(R[-1]C),MONTH(R[-1]C)+1,1))) -> 2001-03-01T00:00:00.000 | B40: =IF(RC1="","",VLOOKUP(RC1,ExpDump,2,FALSE)) -> 1473.8389999999999 | C40: =IF(RC1="","",VLOOKUP(RC1,ExpDump,3,FALSE)) -> 33.381 | D40: =IF(RC1="","",VLOOKUP(RC1,ExpDump,4,FALSE)) -> 59.734999999999999 | E40: =IF(OR(RC1="",RC1=ExpDat),"",RC[1]-RC[-2]+RC[-1]-IF(ISNUMBER(R[-1]C[1])=TRUE(),R[-1]C[1],0)) -> 4.5474735088646412E-13 | F40: =IF(RC1="","",VLOOKUP(RC1,ExpDump,5,FALSE)) -> 2531.7060000000001 | G40: =IF(RC1="","",VLOOKUP(RC1,ExpDump,6,FALSE)) -> 2589.4009999999998 | H40: =IF(RC1="","",VLOOKUP(RC1,ExpDump,7,FALSE)) -> 2848.3409999999999 | I40: =IF(RC1="","",IF(RC[-2]=0,0,RC[-1]/RC[-2])) -> 1.0999999613810298 | J40: =IF(RC1="","",IF(RC[-1]=0,0,REPT("*",100*(RC[-1]-1)))) -> ********* | K40: =IF(RC1="","",VLOOKUP(RC1,ExpDump,8,FALSE)) -> 2368.3130000000001 | L40: =IF(RC1="","",IF(RC[-6]=0,0,RC[-1]/RC[-6])) -> 0.93546130553863682
A41: =IF(R[-1]C1="","",IF(DATE(YEAR(R[-1]C),MONTH(R[-1]C)+1,1)>ValDat,"",DATE(YEAR(R[-1]C),MONTH(R[-1]C)+1,1))) -> 2001-04-01T00:00:00.000 | B41: =IF(RC1="","",VLOOKUP(RC1,ExpDump,2,FALSE)) -> 1453.933 | C41: =IF(RC1="","",VLOOKUP(RC1,ExpDump,3,FALSE)) -> 28.111000000000001 | D41: =IF(RC1="","",VLOOKUP(RC1,ExpDump,4,FALSE)) -> 45.68 | E41: =IF(OR(RC1="",RC1=ExpDat),"",RC[1]-RC[-2]+RC[-1]-IF(ISNUMBER(R[-1]C[1])=TRUE(),R[-1]C[1],0)) -> 0 | F41: =IF(RC1="","",VLOOKUP(RC1,ExpDump,5,FALSE)) -> 2514.1370000000002 | G41: =IF(RC1="","",VLOOKUP(RC1,ExpDump,6,FALSE)) -> 2554.4290000000001 | H41: =IF(RC1="","",VLOOKUP(RC1,ExpDump,7,FALSE)) -> 2809.8719999999998 | I41: =IF(RC1="","",IF(RC[-2]=0,0,RC[-1]/RC[-2])) -> 1.1000000391476921 | J41: =IF(RC1="","",IF(RC[-1]=0,0,REPT("*",100*(RC[-1]-1)))) -> ********** | K41: =IF(RC1="","",VLOOKUP(RC1,ExpDump,8,FALSE)) -> 2394.6669999999999 | L41: =IF(RC1="","",IF(RC[-6]=0,0,RC[-1]/RC[-6])) -> 0.95248071206938989
A42: =IF(R[-1]C1="","",IF(DATE(YEAR(R[-1]C),MONTH(R[-1]C)+1,1)>ValDat,"",DATE(YEAR(R[-1]C),MONTH(R[-1]C)+1,1))) -> 2001-05-01T00:00:00.000 | B42: =IF(RC1="","",VLOOKUP(RC1,ExpDump,2,FALSE)) -> 1456.903 | C42: =IF(RC1="","",VLOOKUP(RC1,ExpDump,3,FALSE)) -> 49.192999999999998 | D42: =IF(RC1="","",VLOOKUP(RC1,ExpDump,4,FALSE)) -> 40.408999999999999 | E42: =IF(OR(RC1="",RC1=ExpDat),"",RC[1]-RC[-2]+RC[-1]-IF(ISNUMBER(R[-1]C[1])=TRUE(),R[-1]C[1],0)) -> -4.5474735088646412E-13 | F42: =IF(RC1="","",VLOOKUP(RC1,ExpDump,5,FALSE)) -> 2522.9209999999998 | G42: =IF(RC1="","",VLOOKUP(RC1,ExpDump,6,FALSE)) -> 2559.6469999999999 | H42: =IF(RC1="","",VLOOKUP(RC1,ExpDump,7,FALSE)) -> 2815.6109999999999 | I42: =IF(RC1="","",IF(RC[-2]=0,0,RC[-1]/RC[-2])) -> 1.0999997265247903 | J42: =IF(RC1="","",IF(RC[-1]=0,0,REPT("*",100*(RC[-1]-1)))) -> ********* | K42: =IF(RC1="","",VLOOKUP(RC1,ExpDump,8,FALSE)) -> 2442.1039999999998 | L42: =IF(RC1="","",IF(RC[-6]=0,0,RC[-1]/RC[-6])) -> 0.96796689234423117
A43: =IF(R[-1]C1="","",IF(DATE(YEAR(R[-1]C),MONTH(R[-1]C)+1,1)>ValDat,"",DATE(YEAR(R[-1]C),MONTH(R[-1]C)+1,1))) -> 2001-06-01T00:00:00.000 | B43: =IF(RC1="","",VLOOKUP(RC1,ExpDump,2,FALSE)) -> 1454.2670000000001 | C43: =IF(RC1="","",VLOOKUP(RC1,ExpDump,3,FALSE)) -> 38.652000000000001 | D43: =IF(RC1="","",VLOOKUP(RC1,ExpDump,4,FALSE)) -> 36.895000000000003 | E43: =IF(OR(RC1="",RC1=ExpDat),"",RC[1]-RC[-2]+RC[-1]-IF(ISNUMBER(R[-1]C[1])=TRUE(),R[-1]C[1],0)) -> 0 | F43: =IF(RC1="","",VLOOKUP(RC1,ExpDump,5,FALSE)) -> 2524.6779999999999 | G43: =IF(RC1="","",VLOOKUP(RC1,ExpDump,6,FALSE)) -> 2555.0140000000001 | H43: =IF(RC1="","",VLOOKUP(RC1,ExpDump,7,FALSE)) -> 2810.5160000000001 | I43: =IF(RC1="","",IF(RC[-2]=0,0,RC[-1]/RC[-2])) -> 1.1000002348323727 | J43: =IF(RC1="","",IF(RC[-1]=0,0,REPT("*",100*(RC[-1]-1)))) -> ********** | K43: =IF(RC1="","",VLOOKUP(RC1,ExpDump,8,FALSE)) -> 2477.2420000000002 | L43: =IF(RC1="","",IF(RC[-6]=0,0,RC[-1]/RC[-6])) -> 0.98121106929279711
A44: =IF(R[-1]C1="","",IF(DATE(YEAR(R[-1]C),MONTH(R[-1]C)+1,1)>ValDat,"",DATE(YEAR(R[-1]C),MONTH(R[-1]C)+1,1))) -> 2001-07-01T00:00:00.000 | B44: =IF(RC1="","",VLOOKUP(RC1,ExpDump,2,FALSE)) -> 1464.3869999999999 | C44: =IF(RC1="","",VLOOKUP(RC1,ExpDump,3,FALSE)) -> 57.978000000000002 | D44: =IF(RC1="","",VLOOKUP(RC1,ExpDump,4,FALSE)) -> 49.192999999999998 | E44: =IF(OR(RC1="",RC1=ExpDat),"",RC[1]-RC[-2]+RC[-1]-IF(ISNUMBER(R[-1]C[1])=TRUE(),R[-1]C[1],0)) -> 4.5474735088646412E-13 | F44: =IF(RC1="","",VLOOKUP(RC1,ExpDump,5,FALSE)) -> 2533.4630000000002 | G44: =IF(RC1="","",VLOOKUP(RC1,ExpDump,6,FALSE)) -> 2572.7950000000001 | H44: =IF(RC1="","",VLOOKUP(RC1,ExpDump,7,FALSE)) -> 2830.0740000000001 | I44: =IF(RC1="","",IF(RC[-2]=0,0,RC[-1]/RC[-2])) -> 1.0999998056588263 | J44: =IF(RC1="","",IF(RC[-1]=0,0,REPT("*",100*(RC[-1]-1)))) -> ********* | K44: =IF(RC1="","",VLOOKUP(RC1,ExpDump,8,FALSE)) -> 2533.4630000000002 | L44: =IF(RC1="","",IF(RC[-6]=0,0,RC[-1]/RC[-6])) -> 1
B45: =SUM(R[-36]C:R[-1]C) -> 53854.478000000003 | C45: =SUM(R[-36]C:R[-1]C) -> 2048.5570000000002 | D45: =SUM(R[-36]C:R[-1]C) -> 1763.9360000000004 | E45: =SUM(R[-36]C:R[-1]C) -> -2.000000000862201E-3 | F45: =SUM(R[-36]C:R[-1]C) -> 93010.768000000011 | G45: =SUM(R[-36]C:R[-1]C) -> 94617.424999999988 | H45: =SUM(R[-36]C:R[-1]C) -> 104079.17000000001 | I45: =IF(RC[-2]=0,0,RC[-1]/RC[-2]) -> 1.1000000264221947 | J45: =IF(RC[-1]=0,0,REPT("*",100*(RC[-1]-1))) -> ********** | K45: =SUM(R[-36]C:R[-1]C) -> 71588.774000000005 | L45: = IF(RC[-5]=0,0,RC[-1]/RC[-5]) -> 0.75661300230903572
A47: EXPLANATION:
B48: (A) In Force Month: All months during experience period, starting with month of experience Month ending on month of valuation Month.
B49: (B) Number of active insureds with fraction of month credit.
B50: (C) Weighted insureds issued during the month, unadjusted for aging, full month credited.
B51: (D) Weighted insureds terminated during the month, unadjusted for aging, full month credited.
B52: (E) Gain or Loss of weighted insureds due to changes in benefit richness, age, area, etc.; unadjusted for aging. Full month credited. This also includes weighted insureds in-force prior to the Experience Period.
B53: (F) Weighted insureds in-force at the end of the month, unadjusted for aging, full month credited.
B54: (G) Weighted insureds inforce during month with fraction of month inforce, unadjusted for aging.
B55: (H) Weighted insureds inforce during month with fraction of month inforce, adjusted for underwriting aging factor.
B56: (I) Weighted average aging factor for weighted lives in force during the month = (H) / (G)
B57: (J) Graphic representation of the aging factor in (I), a "*" is shown for each percentage point over 1.00.
B58: (K) Of the weighted lives in force at the end of the month, those that are still in force as of the valuation date.
B59: (L) Percentage of Weighted Lives in force at the end of the month that are still in force as of the valuation date = (G) / (F)

Sheet: RepLag
B1: =title1&" Reported Lag Triangle"&IF(Basis="ibnp", " (reported = paid)","") -> BLOCK CLAIM LIABILITY REPORT Reported Lag Triangle
B2: =title2 -> The Millennium-2000 Sample Life Insurance Company
B3: =title3 -> Arvind
B4: =title4 -> Experience Period: 01-Aug-1998 to 31-Jul-2001. Runout Date: 31-Jul-2001
F7: REPORTED CLAIMS / NUMBER OF MONTHS BETWEEN INCURRED AND REPORTED DATES
A8: Incurred Month | B8: Trend to Valuation Month | C8: Exposure | D8: Total Incurred and Reported Claims | E8: Inc&Rep as of the end of Each Month | F8: 0 | G8: =RC[-1]+1 -> 1 | H8: =RC[-1]+1 -> 2 | I8: =RC[-1]+1 -> 3 | J8: =RC[-1]+1 -> 4 | K8: =RC[-1]+1 -> 5 | L8: =RC[-1]+1 -> 6 | M8: =RC[-1]+1 -> 7 | N8: =RC[-1]+1 -> 8 | O8: =RC[-1]+1 -> 9 | P8: =RC[-1]+1 -> 10 | Q8: =RC[-1]+1 -> 11 | R8: =RC[-1]+1 -> 12 | S8: =RC[-1]+1 -> 13 | T8: =RC[-1]+1 -> 14 | U8: =RC[-1]+1 -> 15 | V8: =RC[-1]+1 -> 16 | W8: =RC[-1]+1 -> 17 | X8: =RC[-1]+1 -> 18 | Y8: =RC[-1]+1 -> 19 | Z8: =RC[-1]+1 -> 20 | AA8: =RC[-1]+1 -> 21 | AB8: =RC[-1]+1 -> 22 | AC8: =RC[-1]+1 -> 23 | AD8: =RC[-1]+1 -> 24 | AE8: =RC[-1]+1 -> 25 | AF8: =RC[-1]+1 -> 26 | AG8: =RC[-1]+1 -> 27 | AH8: =RC[-1]+1 -> 28 | AI8: =RC[-1]+1 -> 29 | AJ8: =RC[-1]+1 -> 30 | AK8: =RC[-1]+1 -> 31 | AL8: =RC[-1]+1 -> 32 | AM8: =RC[-1]+1 -> 33 | AN8: =RC[-1]+1 -> 34 | AO8: =RC[-1]+1 -> 35
A9: =ExpDat -> 1998-08-01T00:00:00.000 | B9: =IF(RC1="","",IF(VLOOKUP(RC1,TrendFacDump,2,FALSE)=0,0,VLOOKUP(EOMONTH(ValDat,-1)+1,TrendFacDump,2,FALSE)/VLOOKUP(RC1,TrendFacDump,2,FALSE))) -> 1.1852554225435581 | C9: =IF(RC1="","",VLOOKUP(RC1,ExpDump,7,FALSE)) -> 2576.1559999999999 | D9: =IF(RC1="","",SUM(RC[2]:RC[37])) -> 99219 | E9: =IF(RC1="","",RC[1]) -> 25147 | F9: =IF(RC1="","",VLOOKUP(RC1,ReportedDump,R8C+2,FALSE)) -> 25147 | G9: =IF(RC1="","",VLOOKUP(RC1,ReportedDump,R8C+2,FALSE)) -> 74072 | H9: =IF(RC1="","",VLOOKUP(RC1,ReportedDump,R8C+2,FALSE)) -> 0 | I9: =IF(RC1="","",VLOOKUP(RC1,ReportedDump,R8C+2,FALSE)) -> 0 | J9: =IF(RC1="","",VLOOKUP(RC1,ReportedDump,R8C+2,FALSE)) -> 0 | K9: =IF(RC1="","",VLOOKUP(RC1,ReportedDump,R8C+2,FALSE)) -> 0 | L9: =IF(RC1="","",VLOOKUP(RC1,ReportedDump,R8C+2,FALSE)) -> 0 | M9: =IF(RC1="","",VLOOKUP(RC1,ReportedDump,R8C+2,FALSE)) -> 0 | N9: =IF(RC1="","",VLOOKUP(RC1,ReportedDump,R8C+2,FALSE)) -> 0 | O9: =IF(RC1="","",VLOOKUP(RC1,ReportedDump,R8C+2,FALSE)) -> 0 | P9: =IF(RC1="","",VLOOKUP(RC1,ReportedDump,R8C+2,FALSE)) -> 0 | Q9: =IF(RC1="","",VLOOKUP(RC1,ReportedDump,R8C+2,FALSE)) -> 0 | R9: =IF(RC1="","",VLOOKUP(RC1,ReportedDump,R8C+2,FALSE)) -> 0 | S9: =IF(RC1="","",VLOOKUP(RC1,ReportedDump,R8C+2,FALSE)) -> 0 | T9: =IF(RC1="","",VLOOKUP(RC1,ReportedDump,R8C+2,FALSE)) -> 0 | U9: =IF(RC1="","",VLOOKUP(RC1,ReportedDump,R8C+2,FALSE)) -> 0 | V9: =IF(RC1="","",VLOOKUP(RC1,ReportedDump,R8C+2,FALSE)) -> 0 | W9: =IF(RC1="","",VLOOKUP(RC1,ReportedDump,R8C+2,FALSE)) -> 0 | X9: =IF(RC1="","",VLOOKUP(RC1,ReportedDump,R8C+2,FALSE)) -> 0 | Y9: =IF(RC1="","",VLOOKUP(RC1,ReportedDump,R8C+2,FALSE)) -> 0 | Z9: =IF(RC1="","",VLOOKUP(RC1,ReportedDump,R8C+2,FALSE)) -> 0 | AA9: =IF(RC1="","",VLOOKUP(RC1,ReportedDump,R8C+2,FALSE)) -> 0 | AB9: =IF(RC1="","",VLOOKUP(RC1,ReportedDump,R8C+2,FALSE)) -> 0 | AC9: =IF(RC1="","",VLOOKUP(RC1,ReportedDump,R8C+2,FALSE)) -> 0 | AD9: =IF(RC1="","",VLOOKUP(RC1,ReportedDump,R8C+2,FALSE)) -> 0 | AE9: =IF(RC1="","",VLOOKUP(RC1,ReportedDump,R8C+2,FALSE)) -> 0 | AF9: =IF(RC1="","",VLOOKUP(RC1,ReportedDump,R8C+2,FALSE)) -> 0 | AG9: =IF(RC1="","",VLOOKUP(RC1,ReportedDump,R8C+2,FALSE)) -> 0 | AH9: =IF(RC1="","",VLOOKUP(RC1,ReportedDump,R8C+2,FALSE)) -> 0 | AI9: =IF(RC1="","",VLOOKUP(RC1,ReportedDump,R8C+2,FALSE)) -> 0 | AJ9: =IF(RC1="","",VLOOKUP(RC1,ReportedDump,R8C+2,FALSE)) -> 0 | AK9: =IF(RC1="","",VLOOKUP(RC1,ReportedDump,R8C+2,FALSE)) -> 0 | AL9: =IF(RC1="","",VLOOKUP(RC1,ReportedDump,R8C+2,FALSE)) -> 0 | AM9: =IF(RC1="","",VLOOKUP(RC1,ReportedDump,R8C+2,FALSE)) -> 0 | AN9: =IF(RC1="","",VLOOKUP(RC1,ReportedDump,R8C+2,FALSE)) -> 0 | AO9: =IF(RC1="","",VLOOKUP(RC1,ReportedDump,R8C+2,FALSE)) -> 0
A10: =IF(R[-1]C1="","",IF(DATE(YEAR(R[-1]C),MONTH(R[-1]C)+1,1)>ValDat,"",DATE(YEAR(R[-1]C),MONTH(R[-1]C)+1,1))) -> 1998-09-01T00:00:00.000 | B10: =IF(RC1="","",IF(VLOOKUP(RC1,TrendFacDump,2,FALSE)=0,0,VLOOKUP(EOMONTH(ValDat,-1)+1,TrendFacDump,2,FALSE)/VLOOKUP(RC1,TrendFacDump,2,FALSE))) -> 1.1795234725171031 | C10: =IF(RC1="","",VLOOKUP(RC1,ExpDump,7,FALSE)) -> 2663.7669999999998 | D10: =IF(RC1="","",SUM(RC[2]:RC[37])) -> 99219 | E10: =IF(RC1="","",R[-1]C+RC[1]+R[-1]C[2]) -> 130472 | F10: =IF(RC1="","",VLOOKUP(RC1,ReportedDump,R8C+2,FALSE)) -> 31253 | G10: =IF(RC1="","",VLOOKUP(RC1,ReportedDump,R8C+2,FALSE)) -> 67966 | H10: =IF(RC1="","",VLOOKUP(RC1,ReportedDump,R8C+2,FALSE)) -> 0 | I10: =IF(RC1="","",VLOOKUP(RC1,ReportedDump,R8C+2,FALSE)) -> 0 | J10: =IF(RC1="","",VLOOKUP(RC1,ReportedDump,R8C+2,FALSE)) -> 0 | K10: =IF(RC1="","",VLOOKUP(RC1,ReportedDump,R8C+2,FALSE)) -> 0 | L10: =IF(RC1="","",VLOOKUP(RC1,ReportedDump,R8C+2,FALSE)) -> 0 | M10: =IF(RC1="","",VLOOKUP(RC1,ReportedDump,R8C+2,FALSE)) -> 0 | N10: =IF(RC1="","",VLOOKUP(RC1,ReportedDump,R8C+2,FALSE)) -> 0 | O10: =IF(RC1="","",VLOOKUP(RC1,ReportedDump,R8C+2,FALSE)) -> 0 | P10: =IF(RC1="","",VLOOKUP(RC1,ReportedDump,R8C+2,FALSE)) -> 0 | Q10: =IF(RC1="","",VLOOKUP(RC1,ReportedDump,R8C+2,FALSE)) -> 0 | R10: =IF(RC1="","",VLOOKUP(RC1,ReportedDump,R8C+2,FALSE)) -> 0 | S10: =IF(RC1="","",VLOOKUP(RC1,ReportedDump,R8C+2,FALSE)) -> 0 | T10: =IF(RC1="","",VLOOKUP(RC1,ReportedDump,R8C+2,FALSE)) -> 0 | U10: =IF(RC1="","",VLOOKUP(RC1,ReportedDump,R8C+2,FALSE)) -> 0 | V10: =IF(RC1="","",VLOOKUP(RC1,ReportedDump,R8C+2,FALSE)) -> 0 | W10: =IF(RC1="","",VLOOKUP(RC1,ReportedDump,R8C+2,FALSE)) -> 0 | X10: =IF(RC1="","",VLOOKUP(RC1,ReportedDump,R8C+2,FALSE)) -> 0 | Y10: =IF(RC1="","",VLOOKUP(RC1,ReportedDump,R8C+2,FALSE)) -> 0 | Z10: =IF(RC1="","",VLOOKUP(RC1,ReportedDump,R8C+2,FALSE)) -> 0 | AA10: =IF(RC1="","",VLOOKUP(RC1,ReportedDump,R8C+2,FALSE)) -> 0 | AB10: =IF(RC1="","",VLOOKUP(RC1,ReportedDump,R8C+2,FALSE)) -> 0 | AC10: =IF(RC1="","",VLOOKUP(RC1,ReportedDump,R8C+2,FALSE)) -> 0 | AD10: =IF(RC1="","",VLOOKUP(RC1,ReportedDump,R8C+2,FALSE)) -> 0 | AE10: =IF(RC1="","",VLOOKUP(RC1,ReportedDump,R8C+2,FALSE)) -> 0 | AF10: =IF(RC1="","",VLOOKUP(RC1,ReportedDump,R8C+2,FALSE)) -> 0 | AG10: =IF(RC1="","",VLOOKUP(RC1,ReportedDump,R8C+2,FALSE)) -> 0 | AH10: =IF(RC1="","",VLOOKUP(RC1,ReportedDump,R8C+2,FALSE)) -> 0 | AI10: =IF(RC1="","",VLOOKUP(RC1,ReportedDump,R8C+2,FALSE)) -> 0 | AJ10: =IF(RC1="","",VLOOKUP(RC1,ReportedDump,R8C+2,FALSE)) -> 0 | AK10: =IF(RC1="","",VLOOKUP(RC1,ReportedDump,R8C+2,FALSE)) -> 0 | AL10: =IF(RC1="","",VLOOKUP(RC1,ReportedDump,R8C+2,FALSE)) -> 0 | AM10: =IF(RC1="","",VLOOKUP(RC1,ReportedDump,R8C+2,FALSE)) -> 0 | AN10: =IF(RC1="","",VLOOKUP(RC1,ReportedDump,R8C+2,FALSE)) -> 0 | AO10: =IF(RC1="","",VLOOKUP(RC1,ReportedDump,R8C+2,FALSE)) -> 0
A11: =IF(R[-1]C1="","",IF(DATE(YEAR(R[-1]C),MONTH(R[-1]C)+1,1)>ValDat,"",DATE(YEAR(R[-1]C),MONTH(R[-1]C)+1,1))) -> 1998-10-01T00:00:00.000 | B11: =IF(RC1="","",IF(VLOOKUP(RC1,TrendFacDump,2,FALSE)=0,0,VLOOKUP(EOMONTH(ValDat,-1)+1,TrendFacDump,2,FALSE)/VLOOKUP(RC1,TrendFacDump,2,FALSE))) -> 1.1738466956215519 | C11: =IF(RC1="","",VLOOKUP(RC1,ExpDump,7,FALSE)) -> 2728.2080000000001 | D11: =IF(RC1="","",SUM(RC[2]:RC[37])) -> 292014 | E11: =IF(RC1="","",R[-1]C+RC[1]+R[-1]C[2]+R[-2]C[3]) -> 228624 | F11: =IF(RC1="","",VLOOKUP(RC1,ReportedDump,R8C+2,FALSE)) -> 30186 | G11: =IF(RC1="","",VLOOKUP(RC1,ReportedDump,R8C+2,FALSE)) -> 157846 | H11: =IF(RC1="","",VLOOKUP(RC1,ReportedDump,R8C+2,FALSE)) -> 54319 | I11: =IF(RC1="","",VLOOKUP(RC1,ReportedDump,R8C+2,FALSE)) -> 49663 | J11: =IF(RC1="","",VLOOKUP(RC1,ReportedDump,R8C+2,FALSE)) -> 0 | K11: =IF(RC1="","",VLOOKUP(RC1,ReportedDump,R8C+2,FALSE)) -> 0 | L11: =IF(RC1="","",VLOOKUP(RC1,ReportedDump,R8C+2,FALSE)) -> 0 | M11: =IF(RC1="","",VLOOKUP(RC1,ReportedDump,R8C+2,FALSE)) -> 0 | N11: =IF(RC1="","",VLOOKUP(RC1,ReportedDump,R8C+2,FALSE)) -> 0 | O11: =IF(RC1="","",VLOOKUP(RC1,ReportedDump,R8C+2,FALSE)) -> 0 | P11: =IF(RC1="","",VLOOKUP(RC1,ReportedDump,R8C+2,FALSE)) -> 0 | Q11: =IF(RC1="","",VLOOKUP(RC1,ReportedDump,R8C+2,FALSE)) -> 0 | R11: =IF(RC1="","",VLOOKUP(RC1,ReportedDump,R8C+2,FALSE)) -> 0 | S11: =IF(RC1="","",VLOOKUP(RC1,ReportedDump,R8C+2,FALSE)) -> 0 | T11: =IF(RC1="","",VLOOKUP(RC1,ReportedDump,R8C+2,FALSE)) -> 0 | U11: =IF(RC1="","",VLOOKUP(RC1,ReportedDump,R8C+2,FALSE)) -> 0 | V11: =IF(RC1="","",VLOOKUP(RC1,ReportedDump,R8C+2,FALSE)) -> 0 | W11: =IF(RC1="","",VLOOKUP(RC1,ReportedDump,R8C+2,FALSE)) -> 0 | X11: =IF(RC1="","",VLOOKUP(RC1,ReportedDump,R8C+2,FALSE)) -> 0 | Y11: =IF(RC1="","",VLOOKUP(RC1,ReportedDump,R8C+2,FALSE)) -> 0 | Z11: =IF(RC1="","",VLOOKUP(RC1,ReportedDump,R8C+2,FALSE)) -> 0 | AA11: =IF(RC1="","",VLOOKUP(RC1,ReportedDump,R8C+2,FALSE)) -> 0 | AB11: =IF(RC1="","",VLOOKUP(RC1,ReportedDump,R8C+2,FALSE)) -> 0 | AC11: =IF(RC1="","",VLOOKUP(RC1,ReportedDump,R8C+2,FALSE)) -> 0 | AD11: =IF(RC1="","",VLOOKUP(RC1,ReportedDump,R8C+2,FALSE)) -> 0 | AE11: =IF(RC1="","",VLOOKUP(RC1,ReportedDump,R8C+2,FALSE)) -> 0 | AF11: =IF(RC1="","",VLOOKUP(RC1,ReportedDump,R8C+2,FALSE)) -> 0 | AG11: =IF(RC1="","",VLOOKUP(RC1,ReportedDump,R8C+2,FALSE)) -> 0 | AH11: =IF(RC1="","",VLOOKUP(RC1,ReportedDump,R8C+2,FALSE)) -> 0 | AI11: =IF(RC1="","",VLOOKUP(RC1,ReportedDump,R8C+2,FALSE)) -> 0 | AJ11: =IF(RC1="","",VLOOKUP(RC1,ReportedDump,R8C+2,FALSE)) -> 0 | AK11: =IF(RC1="","",VLOOKUP(RC1,ReportedDump,R8C+2,FALSE)) -> 0 | AL11: =IF(RC1="","",VLOOKUP(RC1,ReportedDump,R8C+2,FALSE)) -> 0 | AM11: =IF(RC1="","",VLOOKUP(RC1,ReportedDump,R8C+2,FALSE)) -> 0 | AN11: =IF(RC1="","",VLOOKUP(RC1,ReportedDump,R8C+2,FALSE)) -> 0 | AO11: =IF(RC1="","",VLOOKUP(RC1,ReportedDump,R8C+2,FALSE)) -> 0
A12: =IF(R[-1]C1="","",IF(DATE(YEAR(R[-1]C),MONTH(R[-1]C)+1,1)>ValDat,"",DATE(YEAR(R[-1]C),MONTH(R[-1]C)+1,1))) -> 1998-11-01T00:00:00.000 | B12: =IF(RC1="","",IF(VLOOKUP(RC1,TrendFacDump,2,FALSE)=0,0,VLOOKUP(EOMONTH(ValDat,-1)+1,TrendFacDump,2,FALSE)/VLOOKUP(RC1,TrendFacDump,2,FALSE))) -> 1.1680878402055834 | C12: =IF(RC1="","",VLOOKUP(RC1,ExpDump,7,FALSE)) -> 2780.7539999999999 | D12: =IF(RC1="","",SUM(RC[2]:RC[37])) -> 292014 | E12: =IF(RC1="","",R[-1]C+RC[1]+R[-1]C[2]+R[-2]C[3]+R[-3]C[4]) -> 436397 | F12: =IF(RC1="","",VLOOKUP(RC1,ReportedDump,R8C+2,FALSE)) -> 49927 | G12: =IF(RC1="","",VLOOKUP(RC1,ReportedDump,R8C+2,FALSE)) -> 140535 | H12: =IF(RC1="","",VLOOKUP(RC1,ReportedDump,R8C+2,FALSE)) -> 51889 | I12: =IF(RC1="","",VLOOKUP(RC1,ReportedDump,R8C+2,FALSE)) -> 49663 | J12: =IF(RC1="","",VLOOKUP(RC1,ReportedDump,R8C+2,FALSE)) -> 0 | K12: =IF(RC1="","",VLOOKUP(RC1,ReportedDump,R8C+2,FALSE)) -> 0 | L12: =IF(RC1="","",VLOOKUP(RC1,ReportedDump,R8C+2,FALSE)) -> 0 | M12: =IF(RC1="","",VLOOKUP(RC1,ReportedDump,R8C+2,FALSE)) -> 0 | N12: =IF(RC1="","",VLOOKUP(RC1,ReportedDump,R8C+2,FALSE)) -> 0 | O12: =IF(RC1="","",VLOOKUP(RC1,ReportedDump,R8C+2,FALSE)) -> 0 | P12: =IF(RC1="","",VLOOKUP(RC1,ReportedDump,R8C+2,FALSE)) -> 0 | Q12: =IF(RC1="","",VLOOKUP(RC1,ReportedDump,R8C+2,FALSE)) -> 0 | R12: =IF(RC1="","",VLOOKUP(RC1,ReportedDump,R8C+2,FALSE)) -> 0 | S12: =IF(RC1="","",VLOOKUP(RC1,ReportedDump,R8C+2,FALSE)) -> 0 | T12: =IF(RC1="","",VLOOKUP(RC1,ReportedDump,R8C+2,FALSE)) -> 0 | U12: =IF(RC1="","",VLOOKUP(RC1,ReportedDump,R8C+2,FALSE)) -> 0 | V12: =IF(RC1="","",VLOOKUP(RC1,ReportedDump,R8C+2,FALSE)) -> 0 | W12: =IF(RC1="","",VLOOKUP(RC1,ReportedDump,R8C+2,FALSE)) -> 0 | X12: =IF(RC1="","",VLOOKUP(RC1,ReportedDump,R8C+2,FALSE)) -> 0 | Y12: =IF(RC1="","",VLOOKUP(RC1,ReportedDump,R8C+2,FALSE)) -> 0 | Z12: =IF(RC1="","",VLOOKUP(RC1,ReportedDump,R8C+2,FALSE)) -> 0 | AA12: =IF(RC1="","",VLOOKUP(RC1,ReportedDump,R8C+2,FALSE)) -> 0 | AB12: =IF(RC1="","",VLOOKUP(RC1,ReportedDump,R8C+2,FALSE)) -> 0 | AC12: =IF(RC1="","",VLOOKUP(RC1,ReportedDump,R8C+2,FALSE)) -> 0 | AD12: =IF(RC1="","",VLOOKUP(RC1,ReportedDump,R8C+2,FALSE)) -> 0 | AE12: =IF(RC1="","",VLOOKUP(RC1,ReportedDump,R8C+2,FALSE)) -> 0 | AF12: =IF(RC1="","",VLOOKUP(RC1,ReportedDump,R8C+2,FALSE)) -> 0 | AG12: =IF(RC1="","",VLOOKUP(RC1,ReportedDump,R8C+2,FALSE)) -> 0 | AH12: =IF(RC1="","",VLOOKUP(RC1,ReportedDump,R8C+2,FALSE)) -> 0 | AI12: =IF(RC1="","",VLOOKUP(RC1,ReportedDump,R8C+2,FALSE)) -> 0 | AJ12: =IF(RC1="","",VLOOKUP(RC1,ReportedDump,R8C+2,FALSE)) -> 0 | AK12: =IF(RC1="","",VLOOKUP(RC1,ReportedDump,R8C+2,FALSE)) -> 0 | AL12: =IF(RC1="","",VLOOKUP(RC1,ReportedDump,R8C+2,FALSE)) -> 0 | AM12: =IF(RC1="","",VLOOKUP(RC1,ReportedDump,R8C+2,FALSE)) -> 0 | AN12: =IF(RC1="","",VLOOKUP(RC1,ReportedDump,R8C+2,FALSE)) -> 0 | AO12: =IF(RC1="","",VLOOKUP(RC1,ReportedDump,R8C+2,FALSE)) -> 0
A13: =IF(R[-1]C1="","",IF(DATE(YEAR(R[-1]C),MONTH(R[-1]C)+1,1)>ValDat,"",DATE(YEAR(R[-1]C),MONTH(R[-1]C)+1,1))) -> 1998-12-01T00:00:00.000 | B13: =IF(RC1="","",IF(VLOOKUP(RC1,TrendFacDump,2,FALSE)=0,0,VLOOKUP(EOMONTH(ValDat,-1)+1,TrendFacDump,2,FALSE)/VLOOKUP(RC1,TrendFacDump,2,FALSE))) -> 1.1623852144600721 | C13: =IF(RC1="","",VLOOKUP(RC1,ExpDump,7,FALSE)) -> 2826.4589999999998 | D13: =IF(RC1="","",SUM(RC[2]:RC[37])) -> 109763 | E13: =IF(RC1="","",R[-1]C+RC[1]+R[-1]C[2]+R[-2]C[3]+R[-3]C[4]+R[-4]C[5]) -> 637273 | F13: =IF(RC1="","",VLOOKUP(RC1,ReportedDump,R8C+2,FALSE)) -> 6022 | G13: =IF(RC1="","",VLOOKUP(RC1,ReportedDump,R8C+2,FALSE)) -> 55145 | H13: =IF(RC1="","",VLOOKUP(RC1,ReportedDump,R8C+2,FALSE)) -> 17920 | I13: =IF(RC1="","",VLOOKUP(RC1,ReportedDump,R8C+2,FALSE)) -> 25255 | J13: =IF(RC1="","",VLOOKUP(RC1,ReportedDump,R8C+2,FALSE)) -> 5019 | K13: =IF(RC1="","",VLOOKUP(RC1,ReportedDump,R8C+2,FALSE)) -> 402 | L13: =IF(RC1="","",VLOOKUP(RC1,ReportedDump,R8C+2,FALSE)) -> 0 | M13: =IF(RC1="","",VLOOKUP(RC1,ReportedDump,R8C+2,FALSE)) -> 0 | N13: =IF(RC1="","",VLOOKUP(RC1,ReportedDump,R8C+2,FALSE)) -> 0 | O13: =IF(RC1="","",VLOOKUP(RC1,ReportedDump,R8C+2,FALSE)) -> 0 | P13: =IF(RC1="","",VLOOKUP(RC1,ReportedDump,R8C+2,FALSE)) -> 0 | Q13: =IF(RC1="","",VLOOKUP(RC1,ReportedDump,R8C+2,FALSE)) -> 0 | R13: =IF(RC1="","",VLOOKUP(RC1,ReportedDump,R8C+2,FALSE)) -> 0 | S13: =IF(RC1="","",VLOOKUP(RC1,ReportedDump,R8C+2,FALSE)) -> 0 | T13: =IF(RC1="","",VLOOKUP(RC1,ReportedDump,R8C+2,FALSE)) -> 0 | U13: =IF(RC1="","",VLOOKUP(RC1,ReportedDump,R8C+2,FALSE)) -> 0 | V13: =IF(RC1="","",VLOOKUP(RC1,ReportedDump,R8C+2,FALSE)) -> 0 | W13: =IF(RC1="","",VLOOKUP(RC1,ReportedDump,R8C+2,FALSE)) -> 0 | X13: =IF(RC1="","",VLOOKUP(RC1,ReportedDump,R8C+2,FALSE)) -> 0 | Y13: =IF(RC1="","",VLOOKUP(RC1,ReportedDump,R8C+2,FALSE)) -> 0 | Z13: =IF(RC1="","",VLOOKUP(RC1,ReportedDump,R8C+2,FALSE)) -> 0 | AA13: =IF(RC1="","",VLOOKUP(RC1,ReportedDump,R8C+2,FALSE)) -> 0 | AB13: =IF(RC1="","",VLOOKUP(RC1,ReportedDump,R8C+2,FALSE)) -> 0 | AC13: =IF(RC1="","",VLOOKUP(RC1,ReportedDump,R8C+2,FALSE)) -> 0 | AD13: =IF(RC1="","",VLOOKUP(RC1,ReportedDump,R8C+2,FALSE)) -> 0 | AE13: =IF(RC1="","",VLOOKUP(RC1,ReportedDump,R8C+2,FALSE)) -> 0 | AF13: =IF(RC1="","",VLOOKUP(RC1,ReportedDump,R8C+2,FALSE)) -> 0 | AG13: =IF(RC1="","",VLOOKUP(RC1,ReportedDump,R8C+2,FALSE)) -> 0 | AH13: =IF(RC1="","",VLOOKUP(RC1,ReportedDump,R8C+2,FALSE)) -> 0 | AI13: =IF(RC1="","",VLOOKUP(RC1,ReportedDump,R8C+2,FALSE)) -> 0 | AJ13: =IF(RC1="","",VLOOKUP(RC1,ReportedDump,R8C+2,FALSE)) -> 0 | AK13: =IF(RC1="","",VLOOKUP(RC1,ReportedDump,R8C+2,FALSE)) -> 0 | AL13: =IF(RC1="","",VLOOKUP(RC1,ReportedDump,R8C+2,FALSE)) -> 0 | AM13: =IF(RC1="","",VLOOKUP(RC1,ReportedDump,R8C+2,FALSE)) -> 0 | AN13: =IF(RC1="","",VLOOKUP(RC1,ReportedDump,R8C+2,FALSE)) -> 0 | AO13: =IF(RC1="","",VLOOKUP(RC1,ReportedDump,R8C+2,FALSE)) -> 0
A14: =IF(R[-1]C1="","",IF(DATE(YEAR(R[-1]C),MONTH(R[-1]C)+1,1)>ValDat,"",DATE(YEAR(R[-1]C),MONTH(R[-1]C)+1,1))) -> 1999-01-01T00:00:00.000 | B14: =IF(RC1="","",IF(VLOOKUP(RC1,TrendFacDump,2,FALSE)=0,0,VLOOKUP(EOMONTH(ValDat,-1)+1,TrendFacDump,2,FALSE)/VLOOKUP(RC1,TrendFacDump,2,FALSE))) -> 1.1568718186024989 | C14: =IF(RC1="","",VLOOKUP(RC1,ExpDump,7,FALSE)) -> 2835.0619999999999 | D14: =IF(RC1="","",SUM(RC[2]:RC[37])) -> 109763 | E14: =IF(RC1="","",R[-1]C+RC[1]+R[-1]C[2]+R[-2]C[3]+R[-3]C[4]+R[-4]C[5]+R[-5]C[6]) -> 825464 | F14: =IF(RC1="","",VLOOKUP(RC1,ReportedDump,R8C+2,FALSE)) -> 31494 | G14: =IF(RC1="","",VLOOKUP(RC1,ReportedDump,R8C+2,FALSE)) -> 39304 | H14: =IF(RC1="","",VLOOKUP(RC1,ReportedDump,R8C+2,FALSE)) -> 24477 | I14: =IF(RC1="","",VLOOKUP(RC1,ReportedDump,R8C+2,FALSE)) -> 9937 | J14: =IF(RC1="","",VLOOKUP(RC1,ReportedDump,R8C+2,FALSE)) -> 4149 | K14: =IF(RC1="","",VLOOKUP(RC1,ReportedDump,R8C+2,FALSE)) -> 402 | L14: =IF(RC1="","",VLOOKUP(RC1,ReportedDump,R8C+2,FALSE)) -> 0 | M14: =IF(RC1="","",VLOOKUP(RC1,ReportedDump,R8C+2,FALSE)) -> 0 | N14: =IF(RC1="","",VLOOKUP(RC1,ReportedDump,R8C+2,FALSE)) -> 0 | O14: =IF(RC1="","",VLOOKUP(RC1,ReportedDump,R8C+2,FALSE)) -> 0 | P14: =IF(RC1="","",VLOOKUP(RC1,ReportedDump,R8C+2,FALSE)) -> 0 | Q14: =IF(RC1="","",VLOOKUP(RC1,ReportedDump,R8C+2,FALSE)) -> 0 | R14: =IF(RC1="","",VLOOKUP(RC1,ReportedDump,R8C+2,FALSE)) -> 0 | S14: =IF(RC1="","",VLOOKUP(RC1,ReportedDump,R8C+2,FALSE)) -> 0 | T14: =IF(RC1="","",VLOOKUP(RC1,ReportedDump,R8C+2,FALSE)) -> 0 | U14: =IF(RC1="","",VLOOKUP(RC1,ReportedDump,R8C+2,FALSE)) -> 0 | V14: =IF(RC1="","",VLOOKUP(RC1,ReportedDump,R8C+2,FALSE)) -> 0 | W14: =IF(RC1="","",VLOOKUP(RC1,ReportedDump,R8C+2,FALSE)) -> 0 | X14: =IF(RC1="","",VLOOKUP(RC1,ReportedDump,R8C+2,FALSE)) -> 0 | Y14: =IF(RC1="","",VLOOKUP(RC1,ReportedDump,R8C+2,FALSE)) -> 0 | Z14: =IF(RC1="","",VLOOKUP(RC1,ReportedDump,R8C+2,FALSE)) -> 0 | AA14: =IF(RC1="","",VLOOKUP(RC1,ReportedDump,R8C+2,FALSE)) -> 0 | AB14: =IF(RC1="","",VLOOKUP(RC1,ReportedDump,R8C+2,FALSE)) -> 0 | AC14: =IF(RC1="","",VLOOKUP(RC1,ReportedDump,R8C+2,FALSE)) -> 0 | AD14: =IF(RC1="","",VLOOKUP(RC1,ReportedDump,R8C+2,FALSE)) -> 0 | AE14: =IF(RC1="","",VLOOKUP(RC1,ReportedDump,R8C+2,FALSE)) -> 0 | AF14: =IF(RC1="","",VLOOKUP(RC1,ReportedDump,R8C+2,FALSE)) -> 0 | AG14: =IF(RC1="","",VLOOKUP(RC1,ReportedDump,R8C+2,FALSE)) -> 0 | AH14: =IF(RC1="","",VLOOKUP(RC1,ReportedDump,R8C+2,FALSE)) -> 0 | AI14: =IF(RC1="","",VLOOKUP(RC1,ReportedDump,R8C+2,FALSE)) -> 0 | AJ14: =IF(RC1="","",VLOOKUP(RC1,ReportedDump,R8C+2,FALSE)) -> 0 | AK14: =IF(RC1="","",VLOOKUP(RC1,ReportedDump,R8C+2,FALSE)) -> 0 | AL14: =IF(RC1="","",VLOOKUP(RC1,ReportedDump,R8C+2,FALSE)) -> 0 | AM14: =IF(RC1="","",VLOOKUP(RC1,ReportedDump,R8C+2,FALSE)) -> 0 | AN14: =IF(RC1="","",VLOOKUP(RC1,ReportedDump,R8C+2,FALSE)) -> 0 | AO14: =IF(RC1="","",VLOOKUP(RC1,ReportedDump,R8C+2,FALSE)) -> 0
A15: =IF(R[-1]C1="","",IF(DATE(YEAR(R[-1]C),MONTH(R[-1]C)+1,1)>ValDat,"",DATE(YEAR(R[-1]C),MONTH(R[-1]C)+1,1))) -> 1999-02-01T00:00:00.000 | B15: =IF(RC1="","",IF(VLOOKUP(RC1,TrendFacDump,2,FALSE)=0,0,VLOOKUP(EOMONTH(ValDat,-1)+1,TrendFacDump,2,FALSE)/VLOOKUP(RC1,TrendFacDump,2,FALSE))) -> 1.1512779184895232 | C15: =IF(RC1="","",VLOOKUP(RC1,ExpDump,7,FALSE)) -> 2816.6260000000002 | D15: =IF(RC1="","",SUM(RC[2]:RC[37])) -> 164681 | E15: =IF(R[-1]C1="","",R[-1]C+RC[1]+R[-1]C[2]+R[-2]C[3]+R[-3]C[4]+R[-4]C[5]+R[-5]C[6]+R[-6]C[7]) -> 946010 | F15: =IF(RC1="","",VLOOKUP(RC1,ReportedDump,R8C+2,FALSE)) -> 13659 | G15: =IF(RC1="","",VLOOKUP(RC1,ReportedDump,R8C+2,FALSE)) -> 80920 | H15: =IF(RC1="","",VLOOKUP(RC1,ReportedDump,R8C+2,FALSE)) -> 40769 | I15: =IF(RC1="","",VLOOKUP(RC1,ReportedDump,R8C+2,FALSE)) -> 15086 | J15: =IF(RC1="","",VLOOKUP(RC1,ReportedDump,R8C+2,FALSE)) -> 8570 | K15: =IF(RC1="","",VLOOKUP(RC1,ReportedDump,R8C+2,FALSE)) -> 4171 | L15: =IF(RC1="","",VLOOKUP(RC1,ReportedDump,R8C+2,FALSE)) -> 913 | M15: =IF(RC1="","",VLOOKUP(RC1,ReportedDump,R8C+2,FALSE)) -> 593 | N15: =IF(RC1="","",VLOOKUP(RC1,ReportedDump,R8C+2,FALSE)) -> 0 | O15: =IF(RC1="","",VLOOKUP(RC1,ReportedDump,R8C+2,FALSE)) -> 0 | P15: =IF(RC1="","",VLOOKUP(RC1,ReportedDump,R8C+2,FALSE)) -> 0 | Q15: =IF(RC1="","",VLOOKUP(RC1,ReportedDump,R8C+2,FALSE)) -> 0 | R15: =IF(RC1="","",VLOOKUP(RC1,ReportedDump,R8C+2,FALSE)) -> 0 | S15: =IF(RC1="","",VLOOKUP(RC1,ReportedDump,R8C+2,FALSE)) -> 0 | T15: =IF(RC1="","",VLOOKUP(RC1,ReportedDump,R8C+2,FALSE)) -> 0 | U15: =IF(RC1="","",VLOOKUP(RC1,ReportedDump,R8C+2,FALSE)) -> 0 | V15: =IF(RC1="","",VLOOKUP(RC1,ReportedDump,R8C+2,FALSE)) -> 0 | W15: =IF(RC1="","",VLOOKUP(RC1,ReportedDump,R8C+2,FALSE)) -> 0 | X15: =IF(RC1="","",VLOOKUP(RC1,ReportedDump,R8C+2,FALSE)) -> 0 | Y15: =IF(RC1="","",VLOOKUP(RC1,ReportedDump,R8C+2,FALSE)) -> 0 | Z15: =IF(RC1="","",VLOOKUP(RC1,ReportedDump,R8C+2,FALSE)) -> 0 | AA15: =IF(RC1="","",VLOOKUP(RC1,ReportedDump,R8C+2,FALSE)) -> 0 | AB15: =IF(RC1="","",VLOOKUP(RC1,ReportedDump,R8C+2,FALSE)) -> 0 | AC15: =IF(RC1="","",VLOOKUP(RC1,ReportedDump,R8C+2,FALSE)) -> 0 | AD15: =IF(RC1="","",VLOOKUP(RC1,ReportedDump,R8C+2,FALSE)) -> 0 | AE15: =IF(RC1="","",VLOOKUP(RC1,ReportedDump,R8C+2,FALSE)) -> 0 | AF15: =IF(RC1="","",VLOOKUP(RC1,ReportedDump,R8C+2,FALSE)) -> 0 | AG15: =IF(RC1="","",VLOOKUP(RC1,ReportedDump,R8C+2,FALSE)) -> 0 | AH15: =IF(RC1="","",VLOOKUP(RC1,ReportedDump,R8C+2,FALSE)) -> 0 | AI15: =IF(RC1="","",VLOOKUP(RC1,ReportedDump,R8C+2,FALSE)) -> 0 | AJ15: =IF(RC1="","",VLOOKUP(RC1,ReportedDump,R8C+2,FALSE)) -> 0 | AK15: =IF(RC1="","",VLOOKUP(RC1,ReportedDump,R8C+2,FALSE)) -> 0 | AL15: =IF(RC1="","",VLOOKUP(RC1,ReportedDump,R8C+2,FALSE)) -> 0 | AM15: =IF(RC1="","",VLOOKUP(RC1,ReportedDump,R8C+2,FALSE)) -> 0 | AN15: =IF(RC1="","",VLOOKUP(RC1,ReportedDump,R8C+2,FALSE)) -> 0 | AO15: =IF(RC1="","",VLOOKUP(RC1,ReportedDump,R8C+2,FALSE)) -> 0
A16: =IF(R[-1]C1="","",IF(DATE(YEAR(R[-1]C),MONTH(R[-1]C)+1,1)>ValDat,"",DATE(YEAR(R[-1]C),MONTH(R[-1]C)+1,1))) -> 1999-03-01T00:00:00.000 | B16: =IF(RC1="","",IF(VLOOKUP(RC1,TrendFacDump,2,FALSE)=0,0,VLOOKUP(EOMONTH(ValDat,-1)+1,TrendFacDump,2,FALSE)/VLOOKUP(RC1,TrendFacDump,2,FALSE))) -> 1.1456065986940085 | C16: =IF(RC1="","",VLOOKUP(RC1,ExpDump,7,FALSE)) -> 2829.576 | D16: =IF(RC1="","",SUM(RC[2]:RC[37])) -> 164681 | E16: =IF(RC1="","",R[-1]C+RC[1]+R[-1]C[2]+R[-2]C[3]+R[-3]C[4]+R[-4]C[5]+R[-5]C[6]+R[-6]C[7]+R[-7]C[8]) -> 1134597 | F16: =IF(RC1="","",VLOOKUP(RC1,ReportedDump,R8C+2,FALSE)) -> 57935 | G16: =IF(RC1="","",VLOOKUP(RC1,ReportedDump,R8C+2,FALSE)) -> 68120 | H16: =IF(RC1="","",VLOOKUP(RC1,ReportedDump,R8C+2,FALSE)) -> 13660 | I16: =IF(RC1="","",VLOOKUP(RC1,ReportedDump,R8C+2,FALSE)) -> 10719 | J16: =IF(RC1="","",VLOOKUP(RC1,ReportedDump,R8C+2,FALSE)) -> 11697 | K16: =IF(RC1="","",VLOOKUP(RC1,ReportedDump,R8C+2,FALSE)) -> 1703 | L16: =IF(RC1="","",VLOOKUP(RC1,ReportedDump,R8C+2,FALSE)) -> 254 | M16: =IF(RC1="","",VLOOKUP(RC1,ReportedDump,R8C+2,FALSE)) -> 593 | N16: =IF(RC1="","",VLOOKUP(RC1,ReportedDump,R8C+2,FALSE)) -> 0 | O16: =IF(RC1="","",VLOOKUP(RC1,ReportedDump,R8C+2,FALSE)) -> 0 | P16: =IF(RC1="","",VLOOKUP(RC1,ReportedDump,R8C+2,FALSE)) -> 0 | Q16: =IF(RC1="","",VLOOKUP(RC1,ReportedDump,R8C+2,FALSE)) -> 0 | R16: =IF(RC1="","",VLOOKUP(RC1,ReportedDump,R8C+2,FALSE)) -> 0 | S16: =IF(RC1="","",VLOOKUP(RC1,ReportedDump,R8C+2,FALSE)) -> 0 | T16: =IF(RC1="","",VLOOKUP(RC1,ReportedDump,R8C+2,FALSE)) -> 0 | U16: =IF(RC1="","",VLOOKUP(RC1,ReportedDump,R8C+2,FALSE)) -> 0 | V16: =IF(RC1="","",VLOOKUP(RC1,ReportedDump,R8C+2,FALSE)) -> 0 | W16: =IF(RC1="","",VLOOKUP(RC1,ReportedDump,R8C+2,FALSE)) -> 0 | X16: =IF(RC1="","",VLOOKUP(RC1,ReportedDump,R8C+2,FALSE)) -> 0 | Y16: =IF(RC1="","",VLOOKUP(RC1,ReportedDump,R8C+2,FALSE)) -> 0 | Z16: =IF(RC1="","",VLOOKUP(RC1,ReportedDump,R8C+2,FALSE)) -> 0 | AA16: =IF(RC1="","",VLOOKUP(RC1,ReportedDump,R8C+2,FALSE)) -> 0 | AB16: =IF(RC1="","",VLOOKUP(RC1,ReportedDump,R8C+2,FALSE)) -> 0 | AC16: =IF(RC1="","",VLOOKUP(RC1,ReportedDump,R8C+2,FALSE)) -> 0 | AD16: =IF(RC1="","",VLOOKUP(RC1,ReportedDump,R8C+2,FALSE)) -> 0 | AE16: =IF(RC1="","",VLOOKUP(RC1,ReportedDump,R8C+2,FALSE)) -> 0 | AF16: =IF(RC1="","",VLOOKUP(RC1,ReportedDump,R8C+2,FALSE)) -> 0 | AG16: =IF(RC1="","",VLOOKUP(RC1,ReportedDump,R8C+2,FALSE)) -> 0 | AH16: =IF(RC1="","",VLOOKUP(RC1,ReportedDump,R8C+2,FALSE)) -> 0 | AI16: =IF(RC1="","",VLOOKUP(RC1,ReportedDump,R8C+2,FALSE)) -> 0 | AJ16: =IF(RC1="","",VLOOKUP(RC1,ReportedDump,R8C+2,FALSE)) -> 0 | AK16: =IF(RC1="","",VLOOKUP(RC1,ReportedDump,R8C+2,FALSE)) -> 0 | AL16: =IF(RC1="","",VLOOKUP(RC1,ReportedDump,R8C+2,FALSE)) -> 0 | AM16: =IF(RC1="","",VLOOKUP(RC1,ReportedDump,R8C+2,FALSE)) -> 0 | AN16: =IF(RC1="","",VLOOKUP(RC1,ReportedDump,R8C+2,FALSE)) -> 0 | AO16: =IF(RC1="","",VLOOKUP(RC1,ReportedDump,R8C+2,FALSE)) -> 0
A17: =IF(R[-1]C1="","",IF(DATE(YEAR(R[-1]C),MONTH(R[-1]C)+1,1)>ValDat,"",DATE(YEAR(R[-1]C),MONTH(R[-1]C)+1,1))) -> 1999-04-01T00:00:00.000 | B17: =IF(RC1="","",IF(VLOOKUP(RC1,TrendFacDump,2,FALSE)=0,0,VLOOKUP(EOMONTH(ValDat,-1)+1,TrendFacDump,2,FALSE)/VLOOKUP(RC1,TrendFacDump,2,FALSE))) -> 1.1401208528103979 | C17: =IF(RC1="","",VLOOKUP(RC1,ExpDump,7,FALSE)) -> 2910.3670000000002 | D17: =IF(RC1="","",SUM(RC[2]:RC[37])) -> 171773 | E17: =IF(RC1="","",R[-1]C+RC[1]+R[-1]C[2]+R[-2]C[3]+R[-3]C[4]+R[-4]C[5]+R[-5]C[6]+R[-6]C[7]+R[-7]C[8]+R[-8]C[9]) -> 1275375 | F17: =IF(RC1="","",VLOOKUP(RC1,ReportedDump,R8C+2,FALSE)) -> 16933 | G17: =IF(RC1="","",VLOOKUP(RC1,ReportedDump,R8C+2,FALSE)) -> 64705 | H17: =IF(RC1="","",VLOOKUP(RC1,ReportedDump,R8C+2,FALSE)) -> 35845 | I17: =IF(RC1="","",VLOOKUP(RC1,ReportedDump,R8C+2,FALSE)) -> 36513 | J17: =IF(RC1="","",VLOOKUP(RC1,ReportedDump,R8C+2,FALSE)) -> 13434 | K17: =IF(RC1="","",VLOOKUP(RC1,ReportedDump,R8C+2,FALSE)) -> 1335 | L17: =IF(RC1="","",VLOOKUP(RC1,ReportedDump,R8C+2,FALSE)) -> 1739 | M17: =IF(RC1="","",VLOOKUP(RC1,ReportedDump,R8C+2,FALSE)) -> 150 | N17: =IF(RC1="","",VLOOKUP(RC1,ReportedDump,R8C+2,FALSE)) -> 64 | O17: =IF(RC1="","",VLOOKUP(RC1,ReportedDump,R8C+2,FALSE)) -> 1055 | P17: =IF(RC1="","",VLOOKUP(RC1,ReportedDump,R8C+2,FALSE)) -> 0 | Q17: =IF(RC1="","",VLOOKUP(RC1,ReportedDump,R8C+2,FALSE)) -> 0 | R17: =IF(RC1="","",VLOOKUP(RC1,ReportedDump,R8C+2,FALSE)) -> 0 | S17: =IF(RC1="","",VLOOKUP(RC1,ReportedDump,R8C+2,FALSE)) -> 0 | T17: =IF(RC1="","",VLOOKUP(RC1,ReportedDump,R8C+2,FALSE)) -> 0 | U17: =IF(RC1="","",VLOOKUP(RC1,ReportedDump,R8C+2,FALSE)) -> 0 | V17: =IF(RC1="","",VLOOKUP(RC1,ReportedDump,R8C+2,FALSE)) -> 0 | W17: =IF(RC1="","",VLOOKUP(RC1,ReportedDump,R8C+2,FALSE)) -> 0 | X17: =IF(RC1="","",VLOOKUP(RC1,ReportedDump,R8C+2,FALSE)) -> 0 | Y17: =IF(RC1="","",VLOOKUP(RC1,ReportedDump,R8C+2,FALSE)) -> 0 | Z17: =IF(RC1="","",VLOOKUP(RC1,ReportedDump,R8C+2,FALSE)) -> 0 | AA17: =IF(RC1="","",VLOOKUP(RC1,ReportedDump,R8C+2,FALSE)) -> 0 | AB17: =IF(RC1="","",VLOOKUP(RC1,ReportedDump,R8C+2,FALSE)) -> 0 | AC17: =IF(RC1="","",VLOOKUP(RC1,ReportedDump,R8C+2,FALSE)) -> 0 | AD17: =IF(RC1="","",VLOOKUP(RC1,ReportedDump,R8C+2,FALSE)) -> 0 | AE17: =IF(RC1="","",VLOOKUP(RC1,ReportedDump,R8C+2,FALSE)) -> 0 | AF17: =IF(RC1="","",VLOOKUP(RC1,ReportedDump,R8C+2,FALSE)) -> 0 | AG17: =IF(RC1="","",VLOOKUP(RC1,ReportedDump,R8C+2,FALSE)) -> 0 | AH17: =IF(RC1="","",VLOOKUP(RC1,ReportedDump,R8C+2,FALSE)) -> 0 | AI17: =IF(RC1="","",VLOOKUP(RC1,ReportedDump,R8C+2,FALSE)) -> 0 | AJ17: =IF(RC1="","",VLOOKUP(RC1,ReportedDump,R8C+2,FALSE)) -> 0 | AK17: =IF(RC1="","",VLOOKUP(RC1,ReportedDump,R8C+2,FALSE)) -> 0 | AL17: =IF(RC1="","",VLOOKUP(RC1,ReportedDump,R8C+2,FALSE)) -> 0 | AM17: =IF(RC1="","",VLOOKUP(RC1,ReportedDump,R8C+2,FALSE)) -> 0 | AN17: =IF(RC1="","",VLOOKUP(RC1,ReportedDump,R8C+2,FALSE)) -> 0 | AO17: =IF(RC1="","",VLOOKUP(RC1,ReportedDump,R8C+2,FALSE)) -> 0
A18: =IF(R[-1]C1="","",IF(DATE(YEAR(R[-1]C),MONTH(R[-1]C)+1,1)>ValDat,"",DATE(YEAR(R[-1]C),MONTH(R[-1]C)+1,1))) -> 1999-05-01T00:00:00.000 | B18: =IF(RC1="","",IF(VLOOKUP(RC1,TrendFacDump,2,FALSE)=0,0,VLOOKUP(EOMONTH(ValDat,-1)+1,TrendFacDump,2,FALSE)/VLOOKUP(RC1,TrendFacDump,2,FALSE))) -> 1.1345586566825505 | C18: =IF(RC1="","",VLOOKUP(RC1,ExpDump,7,FALSE)) -> 2874.0259999999998 | D18: =IF(RC1="","",SUM(RC[2]:RC[37])) -> 171773 | E18: =IF(RC1="","",R[-1]C+RC[1]+R[-1]C[2]+R[-2]C[3]+R[-3]C[4]+R[-4]C[5]+R[-5]C[6]+R[-6]C[7]+R[-7]C[8]+R[-8]C[9]+R[-9]C[10]) -> 1409504 | F18: =IF(RC1="","",VLOOKUP(RC1,ReportedDump,R8C+2,FALSE)) -> 36127 | G18: =IF(RC1="","",VLOOKUP(RC1,ReportedDump,R8C+2,FALSE)) -> 62953 | H18: =IF(RC1="","",VLOOKUP(RC1,ReportedDump,R8C+2,FALSE)) -> 22027 | I18: =IF(RC1="","",VLOOKUP(RC1,ReportedDump,R8C+2,FALSE)) -> 34250 | J18: =IF(RC1="","",VLOOKUP(RC1,ReportedDump,R8C+2,FALSE)) -> 12905 | K18: =IF(RC1="","",VLOOKUP(RC1,ReportedDump,R8C+2,FALSE)) -> 1541 | L18: =IF(RC1="","",VLOOKUP(RC1,ReportedDump,R8C+2,FALSE)) -> 701 | M18: =IF(RC1="","",VLOOKUP(RC1,ReportedDump,R8C+2,FALSE)) -> 150 | N18: =IF(RC1="","",VLOOKUP(RC1,ReportedDump,R8C+2,FALSE)) -> 64 | O18: =IF(RC1="","",VLOOKUP(RC1,ReportedDump,R8C+2,FALSE)) -> 1055 | P18: =IF(RC1="","",VLOOKUP(RC1,ReportedDump,R8C+2,FALSE)) -> 0 | Q18: =IF(RC1="","",VLOOKUP(RC1,ReportedDump,R8C+2,FALSE)) -> 0 | R18: =IF(RC1="","",VLOOKUP(RC1,ReportedDump,R8C+2,FALSE)) -> 0 | S18: =IF(RC1="","",VLOOKUP(RC1,ReportedDump,R8C+2,FALSE)) -> 0 | T18: =IF(RC1="","",VLOOKUP(RC1,ReportedDump,R8C+2,FALSE)) -> 0 | U18: =IF(RC1="","",VLOOKUP(RC1,ReportedDump,R8C+2,FALSE)) -> 0 | V18: =IF(RC1="","",VLOOKUP(RC1,ReportedDump,R8C+2,FALSE)) -> 0 | W18: =IF(RC1="","",VLOOKUP(RC1,ReportedDump,R8C+2,FALSE)) -> 0 | X18: =IF(RC1="","",VLOOKUP(RC1,ReportedDump,R8C+2,FALSE)) -> 0 | Y18: =IF(RC1="","",VLOOKUP(RC1,ReportedDump,R8C+2,FALSE)) -> 0 | Z18: =IF(RC1="","",VLOOKUP(RC1,ReportedDump,R8C+2,FALSE)) -> 0 | AA18: =IF(RC1="","",VLOOKUP(RC1,ReportedDump,R8C+2,FALSE)) -> 0 | AB18: =IF(RC1="","",VLOOKUP(RC1,ReportedDump,R8C+2,FALSE)) -> 0 | AC18: =IF(RC1="","",VLOOKUP(RC1,ReportedDump,R8C+2,FALSE)) -> 0 | AD18: =IF(RC1="","",VLOOKUP(RC1,ReportedDump,R8C+2,FALSE)) -> 0 | AE18: =IF(RC1="","",VLOOKUP(RC1,ReportedDump,R8C+2,FALSE)) -> 0 | AF18: =IF(RC1="","",VLOOKUP(RC1,ReportedDump,R8C+2,FALSE)) -> 0 | AG18: =IF(RC1="","",VLOOKUP(RC1,ReportedDump,R8C+2,FALSE)) -> 0 | AH18: =IF(RC1="","",VLOOKUP(RC1,ReportedDump,R8C+2,FALSE)) -> 0 | AI18: =IF(RC1="","",VLOOKUP(RC1,ReportedDump,R8C+2,FALSE)) -> 0 | AJ18: =IF(RC1="","",VLOOKUP(RC1,ReportedDump,R8C+2,FALSE)) -> 0 | AK18: =IF(RC1="","",VLOOKUP(RC1,ReportedDump,R8C+2,FALSE)) -> 0 | AL18: =IF(RC1="","",VLOOKUP(RC1,ReportedDump,R8C+2,FALSE)) -> 0 | AM18: =IF(RC1="","",VLOOKUP(RC1,ReportedDump,R8C+2,FALSE)) -> 0 | AN18: =IF(RC1="","",VLOOKUP(RC1,ReportedDump,R8C+2,FALSE)) -> 0 | AO18: =IF(RC1="","",VLOOKUP(RC1,ReportedDump,R8C+2,FALSE)) -> 0
A19: =IF(R[-1]C1="","",IF(DATE(YEAR(R[-1]C),MONTH(R[-1]C)+1,1)>ValDat,"",DATE(YEAR(R[-1]C),MONTH(R[-1]C)+1,1))) -> 1999-06-01T00:00:00.000 | B19: =IF(RC1="","",IF(VLOOKUP(RC1,TrendFacDump,2,FALSE)=0,0,VLOOKUP(EOMONTH(ValDat,-1)+1,TrendFacDump,2,FALSE)/VLOOKUP(RC1,TrendFacDump,2,FALSE))) -> 1.1290504685559444 | C19: =IF(RC1="","",VLOOKUP(RC1,ExpDump,7,FALSE)) -> 2840.922 | D19: =IF(RC1="","",SUM(RC[2]:RC[37])) -> 294045 | E19: =IF(RC1="","",R[-1]C+RC[1]+R[-1]C[2]+R[-2]C[3]+R[-3]C[4]+R[-4]C[5]+R[-5]C[6]+R[-6]C[7]+R[-7]C[8]+R[-8]C[9]+R[-9]C[10]+R[-10]C[11]) -> 1544624 | F19: =IF(RC1="","",VLOOKUP(RC1,ReportedDump,R8C+2,FALSE)) -> 16631 | G19: =IF(RC1="","",VLOOKUP(RC1,ReportedDump,R8C+2,FALSE)) -> 145028 | H19: =IF(RC1="","",VLOOKUP(RC1,ReportedDump,R8C+2,FALSE)) -> 48307 | I19: =IF(RC1="","",VLOOKUP(RC1,ReportedDump,R8C+2,FALSE)) -> 6744 | J19: =IF(RC1="","",VLOOKUP(RC1,ReportedDump,R8C+2,FALSE)) -> 43499 | K19: =IF(RC1="","",VLOOKUP(RC1,ReportedDump,R8C+2,FALSE)) -> 10999 | L19: =IF(RC1="","",VLOOKUP(RC1,ReportedDump,R8C+2,FALSE)) -> 6831 | M19: =IF(RC1="","",VLOOKUP(RC1,ReportedDump,R8C+2,FALSE)) -> 14862 | N19: =IF(RC1="","",VLOOKUP(RC1,ReportedDump,R8C+2,FALSE)) -> 638 | O19: =IF(RC1="","",VLOOKUP(RC1,ReportedDump,R8C+2,FALSE)) -> 86 | P19: =IF(RC1="","",VLOOKUP(RC1,ReportedDump,R8C+2,FALSE)) -> 0 | Q19: =IF(RC1="","",VLOOKUP(RC1,ReportedDump,R8C+2,FALSE)) -> 420 | R19: =IF(RC1="","",VLOOKUP(RC1,ReportedDump,R8C+2,FALSE)) -> 0 | S19: =IF(RC1="","",VLOOKUP(RC1,ReportedDump,R8C+2,FALSE)) -> 0 | T19: =IF(RC1="","",VLOOKUP(RC1,ReportedDump,R8C+2,FALSE)) -> 0 | U19: =IF(RC1="","",VLOOKUP(RC1,ReportedDump,R8C+2,FALSE)) -> 0 | V19: =IF(RC1="","",VLOOKUP(RC1,ReportedDump,R8C+2,FALSE)) -> 0 | W19: =IF(RC1="","",VLOOKUP(RC1,ReportedDump,R8C+2,FALSE)) -> 0 | X19: =IF(RC1="","",VLOOKUP(RC1,ReportedDump,R8C+2,FALSE)) -> 0 | Y19: =IF(RC1="","",VLOOKUP(RC1,ReportedDump,R8C+2,FALSE)) -> 0 | Z19: =IF(RC1="","",VLOOKUP(RC1,ReportedDump,R8C+2,FALSE)) -> 0 | AA19: =IF(RC1="","",VLOOKUP(RC1,ReportedDump,R8C+2,FALSE)) -> 0 | AB19: =IF(RC1="","",VLOOKUP(RC1,ReportedDump,R8C+2,FALSE)) -> 0 | AC19: =IF(RC1="","",VLOOKUP(RC1,ReportedDump,R8C+2,FALSE)) -> 0 | AD19: =IF(RC1="","",VLOOKUP(RC1,ReportedDump,R8C+2,FALSE)) -> 0 | AE19: =IF(RC1="","",VLOOKUP(RC1,ReportedDump,R8C+2,FALSE)) -> 0 | AF19: =IF(RC1="","",VLOOKUP(RC1,ReportedDump,R8C+2,FALSE)) -> 0 | AG19: =IF(RC1="","",VLOOKUP(RC1,ReportedDump,R8C+2,FALSE)) -> 0 | AH19: =IF(RC1="","",VLOOKUP(RC1,ReportedDump,R8C+2,FALSE)) -> 0 | AI19: =IF(RC1="","",VLOOKUP(RC1,ReportedDump,R8C+2,FALSE)) -> 0 | AJ19: =IF(RC1="","",VLOOKUP(RC1,ReportedDump,R8C+2,FALSE)) -> 0 | AK19: =IF(RC1="","",VLOOKUP(RC1,ReportedDump,R8C+2,FALSE)) -> 0 | AL19: =IF(RC1="","",VLOOKUP(RC1,ReportedDump,R8C+2,FALSE)) -> 0 | AM19: =IF(RC1="","",VLOOKUP(RC1,ReportedDump,R8C+2,FALSE)) -> 0 | AN19: =IF(RC1="","",VLOOKUP(RC1,ReportedDump,R8C+2,FALSE)) -> 0 | AO19: =IF(RC1="","",VLOOKUP(RC1,ReportedDump,R8C+2,FALSE)) -> 0
A20: =IF(R[-1]C1="","",IF(DATE(YEAR(R[-1]C),MONTH(R[-1]C)+1,1)>ValDat,"",DATE(YEAR(R[-1]C),MONTH(R[-1]C)+1,1))) -> 1999-07-01T00:00:00.000 | B20: =IF(RC1="","",IF(VLOOKUP(RC1,TrendFacDump,2,FALSE)=0,0,VLOOKUP(EOMONTH(ValDat,-1)+1,TrendFacDump,2,FALSE)/VLOOKUP(RC1,TrendFacDump,2,FALSE))) -> 1.1235955056179776 | C20: =IF(RC1="","",VLOOKUP(RC1,ExpDump,7,FALSE)) -> 2830.386 | D20: =IF(RC1="","",SUM(RC[2]:RC[37])) -> 294045 | E20: =IF(RC1="","",R[-1]C+RC[1]+R[-1]C[2]+R[-2]C[3]+R[-3]C[4]+R[-4]C[5]+R[-5]C[6]+R[-6]C[7]+R[-7]C[8]+R[-8]C[9]+R[-9]C[10]+R[-10]C[11]+R[-11]C[12]) -> 1862562 | F20: =IF(RC1="","",VLOOKUP(RC1,ReportedDump,R8C+2,FALSE)) -> 98502 | G20: =IF(RC1="","",VLOOKUP(RC1,ReportedDump,R8C+2,FALSE)) -> 96530 | H20: =IF(RC1="","",VLOOKUP(RC1,ReportedDump,R8C+2,FALSE)) -> 25198 | I20: =IF(RC1="","",VLOOKUP(RC1,ReportedDump,R8C+2,FALSE)) -> 25454 | J20: =IF(RC1="","",VLOOKUP(RC1,ReportedDump,R8C+2,FALSE)) -> 21540 | K20: =IF(RC1="","",VLOOKUP(RC1,ReportedDump,R8C+2,FALSE)) -> 10627 | L20: =IF(RC1="","",VLOOKUP(RC1,ReportedDump,R8C+2,FALSE)) -> 188 | M20: =IF(RC1="","",VLOOKUP(RC1,ReportedDump,R8C+2,FALSE)) -> 14862 | N20: =IF(RC1="","",VLOOKUP(RC1,ReportedDump,R8C+2,FALSE)) -> 711 | O20: =IF(RC1="","",VLOOKUP(RC1,ReportedDump,R8C+2,FALSE)) -> 13 | P20: =IF(RC1="","",VLOOKUP(RC1,ReportedDump,R8C+2,FALSE)) -> 420 | Q20: =IF(RC1="","",VLOOKUP(RC1,ReportedDump,R8C+2,FALSE)) -> 0 | R20: =IF(RC1="","",VLOOKUP(RC1,ReportedDump,R8C+2,FALSE)) -> 0 | S20: =IF(RC1="","",VLOOKUP(RC1,ReportedDump,R8C+2,FALSE)) -> 0 | T20: =IF(RC1="","",VLOOKUP(RC1,ReportedDump,R8C+2,FALSE)) -> 0 | U20: =IF(RC1="","",VLOOKUP(RC1,ReportedDump,R8C+2,FALSE)) -> 0 | V20: =IF(RC1="","",VLOOKUP(RC1,ReportedDump,R8C+2,FALSE)) -> 0 | W20: =IF(RC1="","",VLOOKUP(RC1,ReportedDump,R8C+2,FALSE)) -> 0 | X20: =IF(RC1="","",VLOOKUP(RC1,ReportedDump,R8C+2,FALSE)) -> 0 | Y20: =IF(RC1="","",VLOOKUP(RC1,ReportedDump,R8C+2,FALSE)) -> 0 | Z20: =IF(RC1="","",VLOOKUP(RC1,ReportedDump,R8C+2,FALSE)) -> 0 | AA20: =IF(RC1="","",VLOOKUP(RC1,ReportedDump,R8C+2,FALSE)) -> 0 | AB20: =IF(RC1="","",VLOOKUP(RC1,ReportedDump,R8C+2,FALSE)) -> 0 | AC20: =IF(RC1="","",VLOOKUP(RC1,ReportedDump,R8C+2,FALSE)) -> 0 | AD20: =IF(RC1="","",VLOOKUP(RC1,ReportedDump,R8C+2,FALSE)) -> 0 | AE20: =IF(RC1="","",VLOOKUP(RC1,ReportedDump,R8C+2,FALSE)) -> 0 | AF20: =IF(RC1="","",VLOOKUP(RC1,ReportedDump,R8C+2,FALSE)) -> 0 | AG20: =IF(RC1="","",VLOOKUP(RC1,ReportedDump,R8C+2,FALSE)) -> 0 | AH20: =IF(RC1="","",VLOOKUP(RC1,ReportedDump,R8C+2,FALSE)) -> 0 | AI20: =IF(RC1="","",VLOOKUP(RC1,ReportedDump,R8C+2,FALSE)) -> 0 | AJ20: =IF(RC1="","",VLOOKUP(RC1,ReportedDump,R8C+2,FALSE)) -> 0 | AK20: =IF(RC1="","",VLOOKUP(RC1,ReportedDump,R8C+2,FALSE)) -> 0 | AL20: =IF(RC1="","",VLOOKUP(RC1,ReportedDump,R8C+2,FALSE)) -> 0 | AM20: =IF(RC1="","",VLOOKUP(RC1,ReportedDump,R8C+2,FALSE)) -> 0 | AN20: =IF(RC1="","",VLOOKUP(RC1,ReportedDump,R8C+2,FALSE)) -> 0 | AO20: =IF(RC1="","",VLOOKUP(RC1,ReportedDump,R8C+2,FALSE)) -> 0
A21: =IF(R[-1]C1="","",IF(DATE(YEAR(R[-1]C),MONTH(R[-1]C)+1,1)>ValDat,"",DATE(YEAR(R[-1]C),MONTH(R[-1]C)+1,1))) -> 1999-08-01T00:00:00.000 | B21: =IF(RC1="","",IF(VLOOKUP(RC1,TrendFacDump,2,FALSE)=0,0,VLOOKUP(EOMONTH(ValDat,-1)+1,TrendFacDump,2,FALSE)/VLOOKUP(RC1,TrendFacDump,2,FALSE))) -> 1.1181930001118192 | C21: =IF(RC1="","",VLOOKUP(RC1,ExpDump,7,FALSE)) -> 2957.8130000000001 | D21: =IF(RC1="","",SUM(RC[2]:RC[37])) -> 111076 | E21: =IF(RC1="","",R[-1]C+RC[1]+R[-1]C[2]+R[-2]C[3]+R[-3]C[4]+R[-4]C[5]+R[-5]C[6]+R[-6]C[7]+R[-7]C[8]+R[-8]C[9]+R[-9]C[10]+R[-10]C[11]+R[-11]C[12]+R[-12]C[13]) -> 2065877 | F21: =IF(RC1="","",VLOOKUP(RC1,ReportedDump,R8C+2,FALSE)) -> 8178 | G21: =IF(RC1="","",VLOOKUP(RC1,ReportedDump,R8C+2,FALSE)) -> 50538 | H21: =IF(RC1="","",VLOOKUP(RC1,ReportedDump,R8C+2,FALSE)) -> 21390 | I21: =IF(RC1="","",VLOOKUP(RC1,ReportedDump,R8C+2,FALSE)) -> 25812 | J21: =IF(RC1="","",VLOOKUP(RC1,ReportedDump,R8C+2,FALSE)) -> 3445 | K21: =IF(RC1="","",VLOOKUP(RC1,ReportedDump,R8C+2,FALSE)) -> -482 | L21: =IF(RC1="","",VLOOKUP(RC1,ReportedDump,R8C+2,FALSE)) -> 1182 | M21: =IF(RC1="","",VLOOKUP(RC1,ReportedDump,R8C+2,FALSE)) -> 512 | N21: =IF(RC1="","",VLOOKUP(RC1,ReportedDump,R8C+2,FALSE)) -> 61 | O21: =IF(RC1="","",VLOOKUP(RC1,ReportedDump,R8C+2,FALSE)) -> -300 | P21: =IF(RC1="","",VLOOKUP(RC1,ReportedDump,R8C+2,FALSE)) -> 0 | Q21: =IF(RC1="","",VLOOKUP(RC1,ReportedDump,R8C+2,FALSE)) -> 454 | R21: =IF(RC1="","",VLOOKUP(RC1,ReportedDump,R8C+2,FALSE)) -> 286 | S21: =IF(RC1="","",VLOOKUP(RC1,ReportedDump,R8C+2,FALSE)) -> 0 | T21: =IF(RC1="","",VLOOKUP(RC1,ReportedDump,R8C+2,FALSE)) -> 0 | U21: =IF(RC1="","",VLOOKUP(RC1,ReportedDump,R8C+2,FALSE)) -> 0 | V21: =IF(RC1="","",VLOOKUP(RC1,ReportedDump,R8C+2,FALSE)) -> 0 | W21: =IF(RC1="","",VLOOKUP(RC1,ReportedDump,R8C+2,FALSE)) -> 0 | X21: =IF(RC1="","",VLOOKUP(RC1,ReportedDump,R8C+2,FALSE)) -> 0 | Y21: =IF(RC1="","",VLOOKUP(RC1,ReportedDump,R8C+2,FALSE)) -> 0 | Z21: =IF(RC1="","",VLOOKUP(RC1,ReportedDump,R8C+2,FALSE)) -> 0 | AA21: =IF(RC1="","",VLOOKUP(RC1,ReportedDump,R8C+2,FALSE)) -> 0 | AB21: =IF(RC1="","",VLOOKUP(RC1,ReportedDump,R8C+2,FALSE)) -> 0 | AC21: =IF(RC1="","",VLOOKUP(RC1,ReportedDump,R8C+2,FALSE)) -> 0 | AD21: =IF(RC1="","",VLOOKUP(RC1,ReportedDump,R8C+2,FALSE)) -> 0 | AE21: =IF(RC1="","",VLOOKUP(RC1,ReportedDump,R8C+2,FALSE)) -> 0 | AF21: =IF(RC1="","",VLOOKUP(RC1,ReportedDump,R8C+2,FALSE)) -> 0 | AG21: =IF(RC1="","",VLOOKUP(RC1,ReportedDump,R8C+2,FALSE)) -> 0 | AH21: =IF(RC1="","",VLOOKUP(RC1,ReportedDump,R8C+2,FALSE)) -> 0 | AI21: =IF(RC1="","",VLOOKUP(RC1,ReportedDump,R8C+2,FALSE)) -> 0 | AJ21: =IF(RC1="","",VLOOKUP(RC1,ReportedDump,R8C+2,FALSE)) -> 0 | AK21: =IF(RC1="","",VLOOKUP(RC1,ReportedDump,R8C+2,FALSE)) -> 0 | AL21: =IF(RC1="","",VLOOKUP(RC1,ReportedDump,R8C+2,FALSE)) -> 0 | AM21: =IF(RC1="","",VLOOKUP(RC1,ReportedDump,R8C+2,FALSE)) -> 0 | AN21: =IF(RC1="","",VLOOKUP(RC1,ReportedDump,R8C+2,FALSE)) -> 0 | AO21: =IF(RC1="","",VLOOKUP(RC1,ReportedDump,R8C+2,FALSE)) -> 0
A22: =IF(R[-1]C1="","",IF(DATE(YEAR(R[-1]C),MONTH(R[-1]C)+1,1)>ValDat,"",DATE(YEAR(R[-1]C),MONTH(R[-1]C)+1,1))) -> 1999-09-01T00:00:00.000 | B22: =IF(RC1="","",IF(VLOOKUP(RC1,TrendFacDump,2,FALSE)=0,0,VLOOKUP(EOMONTH(ValDat,-1)+1,TrendFacDump,2,FALSE)/VLOOKUP(RC1,TrendFacDump,2,FALSE))) -> 1.1127183709803048 | C22: =IF(RC1="","",VLOOKUP(RC1,ExpDump,7,FALSE)) -> 2973.8850000000002 | D22: =IF(RC1="","",SUM(RC[2]:RC[37])) -> 111076 | E22: =IF(RC1="","",R[-1]C+RC[1]+R[-1]C[2]+R[-2]C[3]+R[-3]C[4]+R[-4]C[5]+R[-5]C[6]+R[-6]C[7]+R[-7]C[8]+R[-8]C[9]+R[-9]C[10]+R[-10]C[11]+R[-11]C[12]+R[-12]C[13]+R[-13]C[14]) -> 2185577 | F22: =IF(RC1="","",VLOOKUP(RC1,ReportedDump,R8C+2,FALSE)) -> 22133 | G22: =IF(RC1="","",VLOOKUP(RC1,ReportedDump,R8C+2,FALSE)) -> 43202 | H22: =IF(RC1="","",VLOOKUP(RC1,ReportedDump,R8C+2,FALSE)) -> 19233 | I22: =IF(RC1="","",VLOOKUP(RC1,ReportedDump,R8C+2,FALSE)) -> 23721 | J22: =IF(RC1="","",VLOOKUP(RC1,ReportedDump,R8C+2,FALSE)) -> 1187 | K22: =IF(RC1="","",VLOOKUP(RC1,ReportedDump,R8C+2,FALSE)) -> -269 | L22: =IF(RC1="","",VLOOKUP(RC1,ReportedDump,R8C+2,FALSE)) -> 856 | M22: =IF(RC1="","",VLOOKUP(RC1,ReportedDump,R8C+2,FALSE)) -> 553 | N22: =IF(RC1="","",VLOOKUP(RC1,ReportedDump,R8C+2,FALSE)) -> 20 | O22: =IF(RC1="","",VLOOKUP(RC1,ReportedDump,R8C+2,FALSE)) -> -300 | P22: =IF(RC1="","",VLOOKUP(RC1,ReportedDump,R8C+2,FALSE)) -> 374 | Q22: =IF(RC1="","",VLOOKUP(RC1,ReportedDump,R8C+2,FALSE)) -> 80 | R22: =IF(RC1="","",VLOOKUP(RC1,ReportedDump,R8C+2,FALSE)) -> 286 | S22: =IF(RC1="","",VLOOKUP(RC1,ReportedDump,R8C+2,FALSE)) -> 0 | T22: =IF(RC1="","",VLOOKUP(RC1,ReportedDump,R8C+2,FALSE)) -> 0 | U22: =IF(RC1="","",VLOOKUP(RC1,ReportedDump,R8C+2,FALSE)) -> 0 | V22: =IF(RC1="","",VLOOKUP(RC1,ReportedDump,R8C+2,FALSE)) -> 0 | W22: =IF(RC1="","",VLOOKUP(RC1,ReportedDump,R8C+2,FALSE)) -> 0 | X22: =IF(RC1="","",VLOOKUP(RC1,ReportedDump,R8C+2,FALSE)) -> 0 | Y22: =IF(RC1="","",VLOOKUP(RC1,ReportedDump,R8C+2,FALSE)) -> 0 | Z22: =IF(RC1="","",VLOOKUP(RC1,ReportedDump,R8C+2,FALSE)) -> 0 | AA22: =IF(RC1="","",VLOOKUP(RC1,ReportedDump,R8C+2,FALSE)) -> 0 | AB22: =IF(RC1="","",VLOOKUP(RC1,ReportedDump,R8C+2,FALSE)) -> 0 | AC22: =IF(RC1="","",VLOOKUP(RC1,ReportedDump,R8C+2,FALSE)) -> 0 | AD22: =IF(RC1="","",VLOOKUP(RC1,ReportedDump,R8C+2,FALSE)) -> 0 | AE22: =IF(RC1="","",VLOOKUP(RC1,ReportedDump,R8C+2,FALSE)) -> 0 | AF22: =IF(RC1="","",VLOOKUP(RC1,ReportedDump,R8C+2,FALSE)) -> 0 | AG22: =IF(RC1="","",VLOOKUP(RC1,ReportedDump,R8C+2,FALSE)) -> 0 | AH22: =IF(RC1="","",VLOOKUP(RC1,ReportedDump,R8C+2,FALSE)) -> 0 | AI22: =IF(RC1="","",VLOOKUP(RC1,ReportedDump,R8C+2,FALSE)) -> 0 | AJ22: =IF(RC1="","",VLOOKUP(RC1,ReportedDump,R8C+2,FALSE)) -> 0 | AK22: =IF(RC1="","",VLOOKUP(RC1,ReportedDump,R8C+2,FALSE)) -> 0 | AL22: =IF(RC1="","",VLOOKUP(RC1,ReportedDump,R8C+2,FALSE)) -> 0 | AM22: =IF(RC1="","",VLOOKUP(RC1,ReportedDump,R8C+2,FALSE)) -> 0 | AN22: =IF(RC1="","",VLOOKUP(RC1,ReportedDump,R8C+2,FALSE)) -> 0 | AO22: =IF(RC1="","",VLOOKUP(RC1,ReportedDump,R8C+2,FALSE)) -> 0
A23: =IF(R[-1]C1="","",IF(DATE(YEAR(R[-1]C),MONTH(R[-1]C)+1,1)>ValDat,"",DATE(YEAR(R[-1]C),MONTH(R[-1]C)+1,1))) -> 1999-10-01T00:00:00.000 | B23: =IF(RC1="","",IF(VLOOKUP(RC1,TrendFacDump,2,FALSE)=0,0,VLOOKUP(EOMONTH(ValDat,-1)+1,TrendFacDump,2,FALSE)/VLOOKUP(RC1,TrendFacDump,2,FALSE))) -> 1.107297087808659 | C23: =IF(RC1="","",VLOOKUP(RC1,ExpDump,7,FALSE)) -> 2943.35 | D23: =IF(RC1="","",SUM(RC[2]:RC[37])) -> 171436 | E23: =IF(RC1="","",R[-1]C+RC[1]+R[-1]C[2]+R[-2]C[3]+R[-3]C[4]+R[-4]C[5]+R[-5]C[6]+R[-6]C[7]+R[-7]C[8]+R[-8]C[9]+R[-9]C[10]+R[-10]C[11]+R[-11]C[12]+R[-12]C[13]+R[-13]C[14]+R[-14]C[15]) -> 2331882 | F23: =IF(RC1="","",VLOOKUP(RC1,ReportedDump,R8C+2,FALSE)) -> 8887 | G23: =IF(RC1="","",VLOOKUP(RC1,ReportedDump,R8C+2,FALSE)) -> 57900 | H23: =IF(RC1="","",VLOOKUP(RC1,ReportedDump,R8C+2,FALSE)) -> 69592 | I23: =IF(RC1="","",VLOOKUP(RC1,ReportedDump,R8C+2,FALSE)) -> 13073 | J23: =IF(RC1="","",VLOOKUP(RC1,ReportedDump,R8C+2,FALSE)) -> 3966 | K23: =IF(RC1="","",VLOOKUP(RC1,ReportedDump,R8C+2,FALSE)) -> 7382 | L23: =IF(RC1="","",VLOOKUP(RC1,ReportedDump,R8C+2,FALSE)) -> 990 | M23: =IF(RC1="","",VLOOKUP(RC1,ReportedDump,R8C+2,FALSE)) -> 1455 | N23: =IF(RC1="","",VLOOKUP(RC1,ReportedDump,R8C+2,FALSE)) -> 1212 | O23: =IF(RC1="","",VLOOKUP(RC1,ReportedDump,R8C+2,FALSE)) -> 252 | P23: =IF(RC1="","",VLOOKUP(RC1,ReportedDump,R8C+2,FALSE)) -> -208 | Q23: =IF(RC1="","",VLOOKUP(RC1,ReportedDump,R8C+2,FALSE)) -> 4466 | R23: =IF(RC1="","",VLOOKUP(RC1,ReportedDump,R8C+2,FALSE)) -> 924 | S23: =IF(RC1="","",VLOOKUP(RC1,ReportedDump,R8C+2,FALSE)) -> 85 | T23: =IF(RC1="","",VLOOKUP(RC1,ReportedDump,R8C+2,FALSE)) -> 1460 | U23: =IF(RC1="","",VLOOKUP(RC1,ReportedDump,R8C+2,FALSE)) -> 0 | V23: =IF(RC1="","",VLOOKUP(RC1,ReportedDump,R8C+2,FALSE)) -> 0 | W23: =IF(RC1="","",VLOOKUP(RC1,ReportedDump,R8C+2,FALSE)) -> 0 | X23: =IF(RC1="","",VLOOKUP(RC1,ReportedDump,R8C+2,FALSE)) -> 0 | Y23: =IF(RC1="","",VLOOKUP(RC1,ReportedDump,R8C+2,FALSE)) -> 0 | Z23: =IF(RC1="","",VLOOKUP(RC1,ReportedDump,R8C+2,FALSE)) -> 0 | AA23: =IF(RC1="","",VLOOKUP(RC1,ReportedDump,R8C+2,FALSE)) -> 0 | AB23: =IF(RC1="","",VLOOKUP(RC1,ReportedDump,R8C+2,FALSE)) -> 0 | AC23: =IF(RC1="","",VLOOKUP(RC1,ReportedDump,R8C+2,FALSE)) -> 0 | AD23: =IF(RC1="","",VLOOKUP(RC1,ReportedDump,R8C+2,FALSE)) -> 0 | AE23: =IF(RC1="","",VLOOKUP(RC1,ReportedDump,R8C+2,FALSE)) -> 0 | AF23: =IF(RC1="","",VLOOKUP(RC1,ReportedDump,R8C+2,FALSE)) -> 0 | AG23: =IF(RC1="","",VLOOKUP(RC1,ReportedDump,R8C+2,FALSE)) -> 0 | AH23: =IF(RC1="","",VLOOKUP(RC1,ReportedDump,R8C+2,FALSE)) -> 0 | AI23: =IF(RC1="","",VLOOKUP(RC1,ReportedDump,R8C+2,FALSE)) -> 0 | AJ23: =IF(RC1="","",VLOOKUP(RC1,ReportedDump,R8C+2,FALSE)) -> 0 | AK23: =IF(RC1="","",VLOOKUP(RC1,ReportedDump,R8C+2,FALSE)) -> 0 | AL23: =IF(RC1="","",VLOOKUP(RC1,ReportedDump,R8C+2,FALSE)) -> 0 | AM23: =IF(RC1="","",VLOOKUP(RC1,ReportedDump,R8C+2,FALSE)) -> 0 | AN23: =IF(RC1="","",VLOOKUP(RC1,ReportedDump,R8C+2,FALSE)) -> 0 | AO23: =IF(RC1="","",VLOOKUP(RC1,ReportedDump,R8C+2,FALSE)) -> 0
A24: =IF(R[-1]C1="","",IF(DATE(YEAR(R[-1]C),MONTH(R[-1]C)+1,1)>ValDat,"",DATE(YEAR(R[-1]C),MONTH(R[-1]C)+1,1))) -> 1999-11-01T00:00:00.000 | B24: =IF(RC1="","",IF(VLOOKUP(RC1,TrendFacDump,2,FALSE)=0,0,VLOOKUP(EOMONTH(ValDat,-1)+1,TrendFacDump,2,FALSE)/VLOOKUP(RC1,TrendFacDump,2,FALSE))) -> 1.1019283746556474 | C24: =IF(RC1="","",VLOOKUP(RC1,ExpDump,7,FALSE)) -> 3014.0830000000001 | D24: =IF(RC1="","",SUM(RC[2]:RC[37])) -> 171436 | E24: =IF(RC1="","",R[-1]C+RC[1]+R[-1]C[2]+R[-2]C[3]+R[-3]C[4]+R[-4]C[5]+R[-5]C[6]+R[-6]C[7]+R[-7]C[8]+R[-8]C[9]+R[-9]C[10]+R[-10]C[11]+R[-11]C[12]+R[-12]C[13]+R[-13]C[14]+R[-14]C[15]+R[-15]C[16]) -> 2499783 | F24: =IF(RC1="","",VLOOKUP(RC1,ReportedDump,R8C+2,FALSE)) -> 31566 | G24: =IF(RC1="","",VLOOKUP(RC1,ReportedDump,R8C+2,FALSE)) -> 83114 | H24: =IF(RC1="","",VLOOKUP(RC1,ReportedDump,R8C+2,FALSE)) -> 23227 | I24: =IF(RC1="","",VLOOKUP(RC1,ReportedDump,R8C+2,FALSE)) -> 13635 | J24: =IF(RC1="","",VLOOKUP(RC1,ReportedDump,R8C+2,FALSE)) -> 5991 | K24: =IF(RC1="","",VLOOKUP(RC1,ReportedDump,R8C+2,FALSE)) -> 3977 | L24: =IF(RC1="","",VLOOKUP(RC1,ReportedDump,R8C+2,FALSE)) -> 323 | M24: =IF(RC1="","",VLOOKUP(RC1,ReportedDump,R8C+2,FALSE)) -> 1412 | N24: =IF(RC1="","",VLOOKUP(RC1,ReportedDump,R8C+2,FALSE)) -> 1242 | O24: =IF(RC1="","",VLOOKUP(RC1,ReportedDump,R8C+2,FALSE)) -> 450 | P24: =IF(RC1="","",VLOOKUP(RC1,ReportedDump,R8C+2,FALSE)) -> -376 | Q24: =IF(RC1="","",VLOOKUP(RC1,ReportedDump,R8C+2,FALSE)) -> 4430 | R24: =IF(RC1="","",VLOOKUP(RC1,ReportedDump,R8C+2,FALSE)) -> 900 | S24: =IF(RC1="","",VLOOKUP(RC1,ReportedDump,R8C+2,FALSE)) -> 85 | T24: =IF(RC1="","",VLOOKUP(RC1,ReportedDump,R8C+2,FALSE)) -> 1460 | U24: =IF(RC1="","",VLOOKUP(RC1,ReportedDump,R8C+2,FALSE)) -> 0 | V24: =IF(RC1="","",VLOOKUP(RC1,ReportedDump,R8C+2,FALSE)) -> 0 | W24: =IF(RC1="","",VLOOKUP(RC1,ReportedDump,R8C+2,FALSE)) -> 0 | X24: =IF(RC1="","",VLOOKUP(RC1,ReportedDump,R8C+2,FALSE)) -> 0 | Y24: =IF(RC1="","",VLOOKUP(RC1,ReportedDump,R8C+2,FALSE)) -> 0 | Z24: =IF(RC1="","",VLOOKUP(RC1,ReportedDump,R8C+2,FALSE)) -> 0 | AA24: =IF(RC1="","",VLOOKUP(RC1,ReportedDump,R8C+2,FALSE)) -> 0 | AB24: =IF(RC1="","",VLOOKUP(RC1,ReportedDump,R8C+2,FALSE)) -> 0 | AC24: =IF(RC1="","",VLOOKUP(RC1,ReportedDump,R8C+2,FALSE)) -> 0 | AD24: =IF(RC1="","",VLOOKUP(RC1,ReportedDump,R8C+2,FALSE)) -> 0 | AE24: =IF(RC1="","",VLOOKUP(RC1,ReportedDump,R8C+2,FALSE)) -> 0 | AF24: =IF(RC1="","",VLOOKUP(RC1,ReportedDump,R8C+2,FALSE)) -> 0 | AG24: =IF(RC1="","",VLOOKUP(RC1,ReportedDump,R8C+2,FALSE)) -> 0 | AH24: =IF(RC1="","",VLOOKUP(RC1,ReportedDump,R8C+2,FALSE)) -> 0 | AI24: =IF(RC1="","",VLOOKUP(RC1,ReportedDump,R8C+2,FALSE)) -> 0 | AJ24: =IF(RC1="","",VLOOKUP(RC1,ReportedDump,R8C+2,FALSE)) -> 0 | AK24: =IF(RC1="","",VLOOKUP(RC1,ReportedDump,R8C+2,FALSE)) -> 0 | AL24: =IF(RC1="","",VLOOKUP(RC1,ReportedDump,R8C+2,FALSE)) -> 0 | AM24: =IF(RC1="","",VLOOKUP(RC1,ReportedDump,R8C+2,FALSE)) -> 0 | AN24: =IF(RC1="","",VLOOKUP(RC1,ReportedDump,R8C+2,FALSE)) -> 0 | AO24: =IF(RC1="","",VLOOKUP(RC1,ReportedDump,R8C+2,FALSE)) -> 0
A25: =IF(R[-1]C1="","",IF(DATE(YEAR(R[-1]C),MONTH(R[-1]C)+1,1)>ValDat,"",DATE(YEAR(R[-1]C),MONTH(R[-1]C)+1,1))) -> 1999-12-01T00:00:00.000 | B25: =IF(RC1="","",IF(VLOOKUP(RC1,TrendFacDump,2,FALSE)=0,0,VLOOKUP(EOMONTH(ValDat,-1)+1,TrendFacDump,2,FALSE)/VLOOKUP(RC1,TrendFacDump,2,FALSE))) -> 1.096611470555982 | C25: =IF(RC1="","",VLOOKUP(RC1,ExpDump,7,FALSE)) -> 3018.721 | D25: =IF(RC1="","",SUM(RC[2]:RC[37])) -> 111538 | E25: =IF(RC1="","",R[-1]C+RC[1]+R[-1]C[2]+R[-2]C[3]+R[-3]C[4]+R[-4]C[5]+R[-5]C[6]+R[-6]C[7]+R[-7]C[8]+R[-8]C[9]+R[-9]C[10]+R[-10]C[11]+R[-11]C[12]+R[-12]C[13]+R[-13]C[14]+R[-14]C[15]+R[-15]C[16]+R[-16]C[17]) -> 2698648 | F25: =IF(RC1="","",VLOOKUP(RC1,ReportedDump,R8C+2,FALSE)) -> 1321 | G25: =IF(RC1="","",VLOOKUP(RC1,ReportedDump,R8C+2,FALSE)) -> 33300 | H25: =IF(RC1="","",VLOOKUP(RC1,ReportedDump,R8C+2,FALSE)) -> 30097 | I25: =IF(RC1="","",VLOOKUP(RC1,ReportedDump,R8C+2,FALSE)) -> 27921 | J25: =IF(RC1="","",VLOOKUP(RC1,ReportedDump,R8C+2,FALSE)) -> 5276 | K25: =IF(RC1="","",VLOOKUP(RC1,ReportedDump,R8C+2,FALSE)) -> 1752 | L25: =IF(RC1="","",VLOOKUP(RC1,ReportedDump,R8C+2,FALSE)) -> 9245 | M25: =IF(RC1="","",VLOOKUP(RC1,ReportedDump,R8C+2,FALSE)) -> 117 | N25: =IF(RC1="","",VLOOKUP(RC1,ReportedDump,R8C+2,FALSE)) -> 216 | O25: =IF(RC1="","",VLOOKUP(RC1,ReportedDump,R8C+2,FALSE)) -> 314 | P25: =IF(RC1="","",VLOOKUP(RC1,ReportedDump,R8C+2,FALSE)) -> 204 | Q25: =IF(RC1="","",VLOOKUP(RC1,ReportedDump,R8C+2,FALSE)) -> 442 | R25: =IF(RC1="","",VLOOKUP(RC1,ReportedDump,R8C+2,FALSE)) -> 561 | S25: =IF(RC1="","",VLOOKUP(RC1,ReportedDump,R8C+2,FALSE)) -> 179 | T25: =IF(RC1="","",VLOOKUP(RC1,ReportedDump,R8C+2,FALSE)) -> 17 | U25: =IF(RC1="","",VLOOKUP(RC1,ReportedDump,R8C+2,FALSE)) -> 273 | V25: =IF(RC1="","",VLOOKUP(RC1,ReportedDump,R8C+2,FALSE)) -> 135 | W25: =IF(RC1="","",VLOOKUP(RC1,ReportedDump,R8C+2,FALSE)) -> 168 | X25: =IF(RC1="","",VLOOKUP(RC1,ReportedDump,R8C+2,FALSE)) -> 0 | Y25: =IF(RC1="","",VLOOKUP(RC1,ReportedDump,R8C+2,FALSE)) -> 0 | Z25: =IF(RC1="","",VLOOKUP(RC1,ReportedDump,R8C+2,FALSE)) -> 0 | AA25: =IF(RC1="","",VLOOKUP(RC1,ReportedDump,R8C+2,FALSE)) -> 0 | AB25: =IF(RC1="","",VLOOKUP(RC1,ReportedDump,R8C+2,FALSE)) -> 0 | AC25: =IF(RC1="","",VLOOKUP(RC1,ReportedDump,R8C+2,FALSE)) -> 0 | AD25: =IF(RC1="","",VLOOKUP(RC1,ReportedDump,R8C+2,FALSE)) -> 0 | AE25: =IF(RC1="","",VLOOKUP(RC1,ReportedDump,R8C+2,FALSE)) -> 0 | AF25: =IF(RC1="","",VLOOKUP(RC1,ReportedDump,R8C+2,FALSE)) -> 0 | AG25: =IF(RC1="","",VLOOKUP(RC1,ReportedDump,R8C+2,FALSE)) -> 0 | AH25: =IF(RC1="","",VLOOKUP(RC1,ReportedDump,R8C+2,FALSE)) -> 0 | AI25: =IF(RC1="","",VLOOKUP(RC1,ReportedDump,R8C+2,FALSE)) -> 0 | AJ25: =IF(RC1="","",VLOOKUP(RC1,ReportedDump,R8C+2,FALSE)) -> 0 | AK25: =IF(RC1="","",VLOOKUP(RC1,ReportedDump,R8C+2,FALSE)) -> 0 | AL25: =IF(RC1="","",VLOOKUP(RC1,ReportedDump,R8C+2,FALSE)) -> 0 | AM25: =IF(RC1="","",VLOOKUP(RC1,ReportedDump,R8C+2,FALSE)) -> 0 | AN25: =IF(RC1="","",VLOOKUP(RC1,ReportedDump,R8C+2,FALSE)) -> 0 | AO25: =IF(RC1="","",VLOOKUP(RC1,ReportedDump,R8C+2,FALSE)) -> 0
A26: =IF(R[-1]C1="","",IF(DATE(YEAR(R[-1]C),MONTH(R[-1]C)+1,1)>ValDat,"",DATE(YEAR(R[-1]C),MONTH(R[-1]C)+1,1))) -> 2000-01-01T00:00:00.000 | B26: =IF(RC1="","",IF(VLOOKUP(RC1,TrendFacDump,2,FALSE)=0,0,VLOOKUP(EOMONTH(ValDat,-1)+1,TrendFacDump,2,FALSE)/VLOOKUP(RC1,TrendFacDump,2,FALSE))) -> 1.0913456291607553 | C26: =IF(RC1="","",VLOOKUP(RC1,ExpDump,7,FALSE)) -> 3003.3229999999999 | D26: =IF(RC1="","",SUM(RC[2]:RC[37])) -> 111538 | E26: =IF(RC1="","",R[-1]C+RC[1]+R[-1]C[2]+R[-2]C[3]+R[-3]C[4]+R[-4]C[5]+R[-5]C[6]+R[-6]C[7]+R[-7]C[8]+R[-8]C[9]+R[-9]C[10]+R[-10]C[11]+R[-11]C[12]+R[-12]C[13]+R[-13]C[14]+R[-14]C[15]+R[-15]C[16]+R[-16]C[17]+R[-17]C[18]) -> 2800104 | F26: =IF(RC1="","",VLOOKUP(RC1,ReportedDump,R8C+2,FALSE)) -> 14982 | G26: =IF(RC1="","",VLOOKUP(RC1,ReportedDump,R8C+2,FALSE)) -> 44836 | H26: =IF(RC1="","",VLOOKUP(RC1,ReportedDump,R8C+2,FALSE)) -> 31946 | I26: =IF(RC1="","",VLOOKUP(RC1,ReportedDump,R8C+2,FALSE)) -> 3681 | J26: =IF(RC1="","",VLOOKUP(RC1,ReportedDump,R8C+2,FALSE)) -> 2985 | K26: =IF(RC1="","",VLOOKUP(RC1,ReportedDump,R8C+2,FALSE)) -> 1328 | L26: =IF(RC1="","",VLOOKUP(RC1,ReportedDump,R8C+2,FALSE)) -> 9314 | M26: =IF(RC1="","",VLOOKUP(RC1,ReportedDump,R8C+2,FALSE)) -> 117 | N26: =IF(RC1="","",VLOOKUP(RC1,ReportedDump,R8C+2,FALSE)) -> 56 | O26: =IF(RC1="","",VLOOKUP(RC1,ReportedDump,R8C+2,FALSE)) -> 430 | P26: =IF(RC1="","",VLOOKUP(RC1,ReportedDump,R8C+2,FALSE)) -> 88 | Q26: =IF(RC1="","",VLOOKUP(RC1,ReportedDump,R8C+2,FALSE)) -> 538 | R26: =IF(RC1="","",VLOOKUP(RC1,ReportedDump,R8C+2,FALSE)) -> 508 | S26: =IF(RC1="","",VLOOKUP(RC1,ReportedDump,R8C+2,FALSE)) -> 153 | T26: =IF(RC1="","",VLOOKUP(RC1,ReportedDump,R8C+2,FALSE)) -> 0 | U26: =IF(RC1="","",VLOOKUP(RC1,ReportedDump,R8C+2,FALSE)) -> 273 | V26: =IF(RC1="","",VLOOKUP(RC1,ReportedDump,R8C+2,FALSE)) -> 303 | W26: =IF(RC1="","",VLOOKUP(RC1,ReportedDump,R8C+2,FALSE)) -> 0 | X26: =IF(RC1="","",VLOOKUP(RC1,ReportedDump,R8C+2,FALSE)) -> 0 | Y26: =IF(RC1="","",VLOOKUP(RC1,ReportedDump,R8C+2,FALSE)) -> 0 | Z26: =IF(RC1="","",VLOOKUP(RC1,ReportedDump,R8C+2,FALSE)) -> 0 | AA26: =IF(RC1="","",VLOOKUP(RC1,ReportedDump,R8C+2,FALSE)) -> 0 | AB26: =IF(RC1="","",VLOOKUP(RC1,ReportedDump,R8C+2,FALSE)) -> 0 | AC26: =IF(RC1="","",VLOOKUP(RC1,ReportedDump,R8C+2,FALSE)) -> 0 | AD26: =IF(RC1="","",VLOOKUP(RC1,ReportedDump,R8C+2,FALSE)) -> 0 | AE26: =IF(RC1="","",VLOOKUP(RC1,ReportedDump,R8C+2,FALSE)) -> 0 | AF26: =IF(RC1="","",VLOOKUP(RC1,ReportedDump,R8C+2,FALSE)) -> 0 | AG26: =IF(RC1="","",VLOOKUP(RC1,ReportedDump,R8C+2,FALSE)) -> 0 | AH26: =IF(RC1="","",VLOOKUP(RC1,ReportedDump,R8C+2,FALSE)) -> 0 | AI26: =IF(RC1="","",VLOOKUP(RC1,ReportedDump,R8C+2,FALSE)) -> 0 | AJ26: =IF(RC1="","",VLOOKUP(RC1,ReportedDump,R8C+2,FALSE)) -> 0 | AK26: =IF(RC1="","",VLOOKUP(RC1,ReportedDump,R8C+2,FALSE)) -> 0 | AL26: =IF(RC1="","",VLOOKUP(RC1,ReportedDump,R8C+2,FALSE)) -> 0 | AM26: =IF(RC1="","",VLOOKUP(RC1,ReportedDump,R8C+2,FALSE)) -> 0 | AN26: =IF(RC1="","",VLOOKUP(RC1,ReportedDump,R8C+2,FALSE)) -> 0 | AO26: =IF(RC1="","",VLOOKUP(RC1,ReportedDump,R8C+2,FALSE)) -> 0
A27: =IF(R[-1]C1="","",IF(DATE(YEAR(R[-1]C),MONTH(R[-1]C)+1,1)>ValDat,"",DATE(YEAR(R[-1]C),MONTH(R[-1]C)+1,1))) -> 2000-02-01T00:00:00.000 | B27: =IF(RC1="","",IF(VLOOKUP(RC1,TrendFacDump,2,FALSE)=0,0,VLOOKUP(EOMONTH(ValDat,-1)+1,TrendFacDump,2,FALSE)/VLOOKUP(RC1,TrendFacDump,2,FALSE))) -> 1.0860121633362294 | C27: =IF(RC1="","",VLOOKUP(RC1,ExpDump,7,FALSE)) -> 3006.0590000000002 | D27: =IF(RC1="","",SUM(RC[2]:RC[37])) -> 211563 | E27: =IF(RC1="","",R[-1]C+RC[1]+R[-1]C[2]+R[-2]C[3]+R[-3]C[4]+R[-4]C[5]+R[-5]C[6]+R[-6]C[7]+R[-7]C[8]+R[-8]C[9]+R[-9]C[10]+R[-10]C[11]+R[-11]C[12]+R[-12]C[13]+R[-13]C[14]+R[-14]C[15]+R[-15]C[16]+R[-16]C[17]+R[-17]C[18]+R[-18]C[19]) -> 2919842 | F27: =IF(RC1="","",VLOOKUP(RC1,ReportedDump,R8C+2,FALSE)) -> 9736 | G27: =IF(RC1="","",VLOOKUP(RC1,ReportedDump,R8C+2,FALSE)) -> 90376 | H27: =IF(RC1="","",VLOOKUP(RC1,ReportedDump,R8C+2,FALSE)) -> 64236 | I27: =IF(RC1="","",VLOOKUP(RC1,ReportedDump,R8C+2,FALSE)) -> 12899 | J27: =IF(RC1="","",VLOOKUP(RC1,ReportedDump,R8C+2,FALSE)) -> 29961 | K27: =IF(RC1="","",VLOOKUP(RC1,ReportedDump,R8C+2,FALSE)) -> 702 | L27: =IF(RC1="","",VLOOKUP(RC1,ReportedDump,R8C+2,FALSE)) -> 1231 | M27: =IF(RC1="","",VLOOKUP(RC1,ReportedDump,R8C+2,FALSE)) -> 530 | N27: =IF(RC1="","",VLOOKUP(RC1,ReportedDump,R8C+2,FALSE)) -> 991 | O27: =IF(RC1="","",VLOOKUP(RC1,ReportedDump,R8C+2,FALSE)) -> 30 | P27: =IF(RC1="","",VLOOKUP(RC1,ReportedDump,R8C+2,FALSE)) -> 0 | Q27: =IF(RC1="","",VLOOKUP(RC1,ReportedDump,R8C+2,FALSE)) -> 0 | R27: =IF(RC1="","",VLOOKUP(RC1,ReportedDump,R8C+2,FALSE)) -> 0 | S27: =IF(RC1="","",VLOOKUP(RC1,ReportedDump,R8C+2,FALSE)) -> 0 | T27: =IF(RC1="","",VLOOKUP(RC1,ReportedDump,R8C+2,FALSE)) -> 0 | U27: =IF(RC1="","",VLOOKUP(RC1,ReportedDump,R8C+2,FALSE)) -> 791 | V27: =IF(RC1="","",VLOOKUP(RC1,ReportedDump,R8C+2,FALSE)) -> 0 | W27: =IF(RC1="","",VLOOKUP(RC1,ReportedDump,R8C+2,FALSE)) -> 0 | X27: =IF(RC1="","",VLOOKUP(RC1,ReportedDump,R8C+2,FALSE)) -> 0 | Y27: =IF(RC1="","",VLOOKUP(RC1,ReportedDump,R8C+2,FALSE)) -> 80 | Z27: =IF(RC1="","",VLOOKUP(RC1,ReportedDump,R8C+2,FALSE)) -> 0 | AA27: =IF(RC1="","",VLOOKUP(RC1,ReportedDump,R8C+2,FALSE)) -> 0 | AB27: =IF(RC1="","",VLOOKUP(RC1,ReportedDump,R8C+2,FALSE)) -> 0 | AC27: =IF(RC1="","",VLOOKUP(RC1,ReportedDump,R8C+2,FALSE)) -> 0 | AD27: =IF(RC1="","",VLOOKUP(RC1,ReportedDump,R8C+2,FALSE)) -> 0 | AE27: =IF(RC1="","",VLOOKUP(RC1,ReportedDump,R8C+2,FALSE)) -> 0 | AF27: =IF(RC1="","",VLOOKUP(RC1,ReportedDump,R8C+2,FALSE)) -> 0 | AG27: =IF(RC1="","",VLOOKUP(RC1,ReportedDump,R8C+2,FALSE)) -> 0 | AH27: =IF(RC1="","",VLOOKUP(RC1,ReportedDump,R8C+2,FALSE)) -> 0 | AI27: =IF(RC1="","",VLOOKUP(RC1,ReportedDump,R8C+2,FALSE)) -> 0 | AJ27: =IF(RC1="","",VLOOKUP(RC1,ReportedDump,R8C+2,FALSE)) -> 0 | AK27: =IF(RC1="","",VLOOKUP(RC1,ReportedDump,R8C+2,FALSE)) -> 0 | AL27: =IF(RC1="","",VLOOKUP(RC1,ReportedDump,R8C+2,FALSE)) -> 0 | AM27: =IF(RC1="","",VLOOKUP(RC1,ReportedDump,R8C+2,FALSE)) -> 0 | AN27: =IF(RC1="","",VLOOKUP(RC1,ReportedDump,R8C+2,FALSE)) -> 0 | AO27: =IF(RC1="","",VLOOKUP(RC1,ReportedDump,R8C+2,FALSE)) -> 0
A28: =IF(R[-1]C1="","",IF(DATE(YEAR(R[-1]C),MONTH(R[-1]C)+1,1)>ValDat,"",DATE(YEAR(R[-1]C),MONTH(R[-1]C)+1,1))) -> 2000-03-01T00:00:00.000 | B28: =IF(RC1="","",IF(VLOOKUP(RC1,TrendFacDump,2,FALSE)=0,0,VLOOKUP(EOMONTH(ValDat,-1)+1,TrendFacDump,2,FALSE)/VLOOKUP(RC1,TrendFacDump,2,FALSE))) -> 1.0808473843493298 | C28: =IF(RC1="","",VLOOKUP(RC1,ExpDump,7,FALSE)) -> 3001.39 | D28: =IF(RC1="","",SUM(RC[2]:RC[37])) -> 211563 | E28: =IF(RC1="","",R[-1]C+RC[1]+R[-1]C[2]+R[-2]C[3]+R[-3]C[4]+R[-4]C[5]+R[-5]C[6]+R[-6]C[7]+R[-7]C[8]+R[-8]C[9]+R[-9]C[10]+R[-10]C[11]+R[-11]C[12]+R[-12]C[13]+R[-13]C[14]+R[-14]C[15]+R[-15]C[16]+R[-16]C[17]+R[-17]C[18]+R[-18]C[19]+R[-19]C[20]) -> 3153697 | F28: =IF(RC1="","",VLOOKUP(RC1,ReportedDump,R8C+2,FALSE)) -> 68074 | G28: =IF(RC1="","",VLOOKUP(RC1,ReportedDump,R8C+2,FALSE)) -> 108795 | H28: =IF(RC1="","",VLOOKUP(RC1,ReportedDump,R8C+2,FALSE)) -> 22323 | I28: =IF(RC1="","",VLOOKUP(RC1,ReportedDump,R8C+2,FALSE)) -> 1146 | J28: =IF(RC1="","",VLOOKUP(RC1,ReportedDump,R8C+2,FALSE)) -> 6942 | K28: =IF(RC1="","",VLOOKUP(RC1,ReportedDump,R8C+2,FALSE)) -> 821 | L28: =IF(RC1="","",VLOOKUP(RC1,ReportedDump,R8C+2,FALSE)) -> 1096 | M28: =IF(RC1="","",VLOOKUP(RC1,ReportedDump,R8C+2,FALSE)) -> 511 | N28: =IF(RC1="","",VLOOKUP(RC1,ReportedDump,R8C+2,FALSE)) -> 954 | O28: =IF(RC1="","",VLOOKUP(RC1,ReportedDump,R8C+2,FALSE)) -> 30 | P28: =IF(RC1="","",VLOOKUP(RC1,ReportedDump,R8C+2,FALSE)) -> 0 | Q28: =IF(RC1="","",VLOOKUP(RC1,ReportedDump,R8C+2,FALSE)) -> 0 | R28: =IF(RC1="","",VLOOKUP(RC1,ReportedDump,R8C+2,FALSE)) -> 0 | S28: =IF(RC1="","",VLOOKUP(RC1,ReportedDump,R8C+2,FALSE)) -> 0 | T28: =IF(RC1="","",VLOOKUP(RC1,ReportedDump,R8C+2,FALSE)) -> 0 | U28: =IF(RC1="","",VLOOKUP(RC1,ReportedDump,R8C+2,FALSE)) -> 791 | V28: =IF(RC1="","",VLOOKUP(RC1,ReportedDump,R8C+2,FALSE)) -> 0 | W28: =IF(RC1="","",VLOOKUP(RC1,ReportedDump,R8C+2,FALSE)) -> 0 | X28: =IF(RC1="","",VLOOKUP(RC1,ReportedDump,R8C+2,FALSE)) -> 0 | Y28: =IF(RC1="","",VLOOKUP(RC1,ReportedDump,R8C+2,FALSE)) -> 80 | Z28: =IF(RC1="","",VLOOKUP(RC1,ReportedDump,R8C+2,FALSE)) -> 0 | AA28: =IF(RC1="","",VLOOKUP(RC1,ReportedDump,R8C+2,FALSE)) -> 0 | AB28: =IF(RC1="","",VLOOKUP(RC1,ReportedDump,R8C+2,FALSE)) -> 0 | AC28: =IF(RC1="","",VLOOKUP(RC1,ReportedDump,R8C+2,FALSE)) -> 0 | AD28: =IF(RC1="","",VLOOKUP(RC1,ReportedDump,R8C+2,FALSE)) -> 0 | AE28: =IF(RC1="","",VLOOKUP(RC1,ReportedDump,R8C+2,FALSE)) -> 0 | AF28: =IF(RC1="","",VLOOKUP(RC1,ReportedDump,R8C+2,FALSE)) -> 0 | AG28: =IF(RC1="","",VLOOKUP(RC1,ReportedDump,R8C+2,FALSE)) -> 0 | AH28: =IF(RC1="","",VLOOKUP(RC1,ReportedDump,R8C+2,FALSE)) -> 0 | AI28: =IF(RC1="","",VLOOKUP(RC1,ReportedDump,R8C+2,FALSE)) -> 0 | AJ28: =IF(RC1="","",VLOOKUP(RC1,ReportedDump,R8C+2,FALSE)) -> 0 | AK28: =IF(RC1="","",VLOOKUP(RC1,ReportedDump,R8C+2,FALSE)) -> 0 | AL28: =IF(RC1="","",VLOOKUP(RC1,ReportedDump,R8C+2,FALSE)) -> 0 | AM28: =IF(RC1="","",VLOOKUP(RC1,ReportedDump,R8C+2,FALSE)) -> 0 | AN28: =IF(RC1="","",VLOOKUP(RC1,ReportedDump,R8C+2,FALSE)) -> 0 | AO28: =IF(RC1="","",VLOOKUP(RC1,ReportedDump,R8C+2,FALSE)) -> 0
A29: =IF(R[-1]C1="","",IF(DATE(YEAR(R[-1]C),MONTH(R[-1]C)+1,1)>ValDat,"",DATE(YEAR(R[-1]C),MONTH(R[-1]C)+1,1))) -> 2000-04-01T00:00:00.000 | B29: =IF(RC1="","",IF(VLOOKUP(RC1,TrendFacDump,2,FALSE)=0,0,VLOOKUP(EOMONTH(ValDat,-1)+1,TrendFacDump,2,FALSE)/VLOOKUP(RC1,TrendFacDump,2,FALSE))) -> 1.0755001075500108 | C29: =IF(RC1="","",VLOOKUP(RC1,ExpDump,7,FALSE)) -> 3027.8040000000001 | D29: =IF(RC1="","",SUM(RC[2]:RC[37])) -> 183194 | E29: =IF(RC1="","",R[-1]C+RC[1]+R[-1]C[2]+R[-2]C[3]+R[-3]C[4]+R[-4]C[5]+R[-5]C[6]+R[-6]C[7]+R[-7]C[8]+R[-8]C[9]+R[-9]C[10]+R[-10]C[11]+R[-11]C[12]+R[-12]C[13]+R[-13]C[14]+R[-14]C[15]+R[-15]C[16]+R[-16]C[17]+R[-17]C[18]+R[-18]C[19]+R[-19]C[20]+R[-20]C[21]) -> 3351480 | F29: =IF(RC1="","",VLOOKUP(RC1,ReportedDump,R8C+2,FALSE)) -> 10201 | G29: =IF(RC1="","",VLOOKUP(RC1,ReportedDump,R8C+2,FALSE)) -> 90658 | H29: =IF(RC1="","",VLOOKUP(RC1,ReportedDump,R8C+2,FALSE)) -> 24213 | I29: =IF(RC1="","",VLOOKUP(RC1,ReportedDump,R8C+2,FALSE)) -> 20107 | J29: =IF(RC1="","",VLOOKUP(RC1,ReportedDump,R8C+2,FALSE)) -> 28866 | K29: =IF(RC1="","",VLOOKUP(RC1,ReportedDump,R8C+2,FALSE)) -> 6492 | L29: =IF(RC1="","",VLOOKUP(RC1,ReportedDump,R8C+2,FALSE)) -> 1428 | M29: =IF(RC1="","",VLOOKUP(RC1,ReportedDump,R8C+2,FALSE)) -> 616 | N29: =IF(RC1="","",VLOOKUP(RC1,ReportedDump,R8C+2,FALSE)) -> 53 | O29: =IF(RC1="","",VLOOKUP(RC1,ReportedDump,R8C+2,FALSE)) -> 168 | P29: =IF(RC1="","",VLOOKUP(RC1,ReportedDump,R8C+2,FALSE)) -> 0 | Q29: =IF(RC1="","",VLOOKUP(RC1,ReportedDump,R8C+2,FALSE)) -> 0 | R29: =IF(RC1="","",VLOOKUP(RC1,ReportedDump,R8C+2,FALSE)) -> 0 | S29: =IF(RC1="","",VLOOKUP(RC1,ReportedDump,R8C+2,FALSE)) -> 0 | T29: =IF(RC1="","",VLOOKUP(RC1,ReportedDump,R8C+2,FALSE)) -> 0 | U29: =IF(RC1="","",VLOOKUP(RC1,ReportedDump,R8C+2,FALSE)) -> 0 | V29: =IF(RC1="","",VLOOKUP(RC1,ReportedDump,R8C+2,FALSE)) -> 0 | W29: =IF(RC1="","",VLOOKUP(RC1,ReportedDump,R8C+2,FALSE)) -> 392 | X29: =IF(RC1="","",VLOOKUP(RC1,ReportedDump,R8C+2,FALSE)) -> 0 | Y29: =IF(RC1="","",VLOOKUP(RC1,ReportedDump,R8C+2,FALSE)) -> 0 | Z29: =IF(RC1="","",VLOOKUP(RC1,ReportedDump,R8C+2,FALSE)) -> 0 | AA29: =IF(RC1="","",VLOOKUP(RC1,ReportedDump,R8C+2,FALSE)) -> 0 | AB29: =IF(RC1="","",VLOOKUP(RC1,ReportedDump,R8C+2,FALSE)) -> 0 | AC29: =IF(RC1="","",VLOOKUP(RC1,ReportedDump,R8C+2,FALSE)) -> 0 | AD29: =IF(RC1="","",VLOOKUP(RC1,ReportedDump,R8C+2,FALSE)) -> 0 | AE29: =IF(RC1="","",VLOOKUP(RC1,ReportedDump,R8C+2,FALSE)) -> 0 | AF29: =IF(RC1="","",VLOOKUP(RC1,ReportedDump,R8C+2,FALSE)) -> 0 | AG29: =IF(RC1="","",VLOOKUP(RC1,ReportedDump,R8C+2,FALSE)) -> 0 | AH29: =IF(RC1="","",VLOOKUP(RC1,ReportedDump,R8C+2,FALSE)) -> 0 | AI29: =IF(RC1="","",VLOOKUP(RC1,ReportedDump,R8C+2,FALSE)) -> 0 | AJ29: =IF(RC1="","",VLOOKUP(RC1,ReportedDump,R8C+2,FALSE)) -> 0 | AK29: =IF(RC1="","",VLOOKUP(RC1,ReportedDump,R8C+2,FALSE)) -> 0 | AL29: =IF(RC1="","",VLOOKUP(RC1,ReportedDump,R8C+2,FALSE)) -> 0 | AM29: =IF(RC1="","",VLOOKUP(RC1,ReportedDump,R8C+2,FALSE)) -> 0 | AN29: =IF(RC1="","",VLOOKUP(RC1,ReportedDump,R8C+2,FALSE)) -> 0 | AO29: =IF(RC1="","",VLOOKUP(RC1,ReportedDump,R8C+2,FALSE)) -> 0
A30: =IF(R[-1]C1="","",IF(DATE(YEAR(R[-1]C),MONTH(R[-1]C)+1,1)>ValDat,"",DATE(YEAR(R[-1]C),MONTH(R[-1]C)+1,1))) -> 2000-05-01T00:00:00.000 | B30: =IF(RC1="","",IF(VLOOKUP(RC1,TrendFacDump,2,FALSE)=0,0,VLOOKUP(EOMONTH(ValDat,-1)+1,TrendFacDump,2,FALSE)/VLOOKUP(RC1,TrendFacDump,2,FALSE))) -> 1.0703200256876806 | C30: =IF(RC1="","",VLOOKUP(RC1,ExpDump,7,FALSE)) -> 3053.259 | D30: =IF(RC1="","",SUM(RC[2]:RC[37])) -> 183194 | E30: =IF(RC1="","",R[-1]C+RC[1]+R[-1]C[2]+R[-2]C[3]+R[-3]C[4]+R[-4]C[5]+R[-5]C[6]+R[-6]C[7]+R[-7]C[8]+R[-8]C[9]+R[-9]C[10]+R[-10]C[11]+R[-11]C[12]+R[-12]C[13]+R[-13]C[14]+R[-14]C[15]+R[-15]C[16]+R[-16]C[17]+R[-17]C[18]+R[-18]C[19]+R[-19]C[20]+R[-20]C[21]+R[-21]C[22]) -> 3564478 | F30: =IF(RC1="","",VLOOKUP(RC1,ReportedDump,R8C+2,FALSE)) -> 80043 | G30: =IF(RC1="","",VLOOKUP(RC1,ReportedDump,R8C+2,FALSE)) -> 39941 | H30: =IF(RC1="","",VLOOKUP(RC1,ReportedDump,R8C+2,FALSE)) -> 10905 | I30: =IF(RC1="","",VLOOKUP(RC1,ReportedDump,R8C+2,FALSE)) -> 38977 | J30: =IF(RC1="","",VLOOKUP(RC1,ReportedDump,R8C+2,FALSE)) -> 4745 | K30: =IF(RC1="","",VLOOKUP(RC1,ReportedDump,R8C+2,FALSE)) -> 6586 | L30: =IF(RC1="","",VLOOKUP(RC1,ReportedDump,R8C+2,FALSE)) -> 1310 | M30: =IF(RC1="","",VLOOKUP(RC1,ReportedDump,R8C+2,FALSE)) -> 107 | N30: =IF(RC1="","",VLOOKUP(RC1,ReportedDump,R8C+2,FALSE)) -> 20 | O30: =IF(RC1="","",VLOOKUP(RC1,ReportedDump,R8C+2,FALSE)) -> 168 | P30: =IF(RC1="","",VLOOKUP(RC1,ReportedDump,R8C+2,FALSE)) -> 0 | Q30: =IF(RC1="","",VLOOKUP(RC1,ReportedDump,R8C+2,FALSE)) -> 0 | R30: =IF(RC1="","",VLOOKUP(RC1,ReportedDump,R8C+2,FALSE)) -> 0 | S30: =IF(RC1="","",VLOOKUP(RC1,ReportedDump,R8C+2,FALSE)) -> 0 | T30: =IF(RC1="","",VLOOKUP(RC1,ReportedDump,R8C+2,FALSE)) -> 0 | U30: =IF(RC1="","",VLOOKUP(RC1,ReportedDump,R8C+2,FALSE)) -> 0 | V30: =IF(RC1="","",VLOOKUP(RC1,ReportedDump,R8C+2,FALSE)) -> 0 | W30: =IF(RC1="","",VLOOKUP(RC1,ReportedDump,R8C+2,FALSE)) -> 392 | X30: =IF(RC1="","",VLOOKUP(RC1,ReportedDump,R8C+2,FALSE)) -> 0 | Y30: =IF(RC1="","",VLOOKUP(RC1,ReportedDump,R8C+2,FALSE)) -> 0 | Z30: =IF(RC1="","",VLOOKUP(RC1,ReportedDump,R8C+2,FALSE)) -> 0 | AA30: =IF(RC1="","",VLOOKUP(RC1,ReportedDump,R8C+2,FALSE)) -> 0 | AB30: =IF(RC1="","",VLOOKUP(RC1,ReportedDump,R8C+2,FALSE)) -> 0 | AC30: =IF(RC1="","",VLOOKUP(RC1,ReportedDump,R8C+2,FALSE)) -> 0 | AD30: =IF(RC1="","",VLOOKUP(RC1,ReportedDump,R8C+2,FALSE)) -> 0 | AE30: =IF(RC1="","",VLOOKUP(RC1,ReportedDump,R8C+2,FALSE)) -> 0 | AF30: =IF(RC1="","",VLOOKUP(RC1,ReportedDump,R8C+2,FALSE)) -> 0 | AG30: =IF(RC1="","",VLOOKUP(RC1,ReportedDump,R8C+2,FALSE)) -> 0 | AH30: =IF(RC1="","",VLOOKUP(RC1,ReportedDump,R8C+2,FALSE)) -> 0 | AI30: =IF(RC1="","",VLOOKUP(RC1,ReportedDump,R8C+2,FALSE)) -> 0 | AJ30: =IF(RC1="","",VLOOKUP(RC1,ReportedDump,R8C+2,FALSE)) -> 0 | AK30: =IF(RC1="","",VLOOKUP(RC1,ReportedDump,R8C+2,FALSE)) -> 0 | AL30: =IF(RC1="","",VLOOKUP(RC1,ReportedDump,R8C+2,FALSE)) -> 0 | AM30: =IF(RC1="","",VLOOKUP(RC1,ReportedDump,R8C+2,FALSE)) -> 0 | AN30: =IF(RC1="","",VLOOKUP(RC1,ReportedDump,R8C+2,FALSE)) -> 0 | AO30: =IF(RC1="","",VLOOKUP(RC1,ReportedDump,R8C+2,FALSE)) -> 0
A31: =IF(R[-1]C1="","",IF(DATE(YEAR(R[-1]C),MONTH(R[-1]C)+1,1)>ValDat,"",DATE(YEAR(R[-1]C),MONTH(R[-1]C)+1,1))) -> 2000-06-01T00:00:00.000 | B31: =IF(RC1="","",IF(VLOOKUP(RC1,TrendFacDump,2,FALSE)=0,0,VLOOKUP(EOMONTH(ValDat,-1)+1,TrendFacDump,2,FALSE)/VLOOKUP(RC1,TrendFacDump,2,FALSE))) -> 1.0651896037494675 | C31: =IF(RC1="","",VLOOKUP(RC1,ExpDump,7,FALSE)) -> 3019.4940000000001 | D31: =IF(RC1="","",SUM(RC[2]:RC[37])) -> 329297 | E31: =IF(RC1="","",R[-1]C+RC[1]+R[-1]C[2]+R[-2]C[3]+R[-3]C[4]+R[-4]C[5]+R[-5]C[6]+R[-6]C[7]+R[-7]C[8]+R[-8]C[9]+R[-9]C[10]+R[-10]C[11]+R[-11]C[12]+R[-12]C[13]+R[-13]C[14]+R[-14]C[15]+R[-15]C[16]+R[-16]C[17]+R[-17]C[18]+R[-18]C[19]+R[-19]C[20]+R[-20]C[21]+R[-21]C[22]+R[-22]C[23]) -> 3677137 | F31: =IF(RC1="","",VLOOKUP(RC1,ReportedDump,R8C+2,FALSE)) -> 4501 | G31: =IF(RC1="","",VLOOKUP(RC1,ReportedDump,R8C+2,FALSE)) -> 74638 | H31: =IF(RC1="","",VLOOKUP(RC1,ReportedDump,R8C+2,FALSE)) -> 87955 | I31: =IF(RC1="","",VLOOKUP(RC1,ReportedDump,R8C+2,FALSE)) -> 99302 | J31: =IF(RC1="","",VLOOKUP(RC1,ReportedDump,R8C+2,FALSE)) -> 13877 | K31: =IF(RC1="","",VLOOKUP(RC1,ReportedDump,R8C+2,FALSE)) -> 20118 | L31: =IF(RC1="","",VLOOKUP(RC1,ReportedDump,R8C+2,FALSE)) -> 5661 | M31: =IF(RC1="","",VLOOKUP(RC1,ReportedDump,R8C+2,FALSE)) -> 21364 | N31: =IF(RC1="","",VLOOKUP(RC1,ReportedDump,R8C+2,FALSE)) -> 159 | O31: =IF(RC1="","",VLOOKUP(RC1,ReportedDump,R8C+2,FALSE)) -> 480 | P31: =IF(RC1="","",VLOOKUP(RC1,ReportedDump,R8C+2,FALSE)) -> 28 | Q31: =IF(RC1="","",VLOOKUP(RC1,ReportedDump,R8C+2,FALSE)) -> 693 | R31: =IF(RC1="","",VLOOKUP(RC1,ReportedDump,R8C+2,FALSE)) -> 0 | S31: =IF(RC1="","",VLOOKUP(RC1,ReportedDump,R8C+2,FALSE)) -> 0 | T31: =IF(RC1="","",VLOOKUP(RC1,ReportedDump,R8C+2,FALSE)) -> 131 | U31: =IF(RC1="","",VLOOKUP(RC1,ReportedDump,R8C+2,FALSE)) -> 0 | V31: =IF(RC1="","",VLOOKUP(RC1,ReportedDump,R8C+2,FALSE)) -> 294 | W31: =IF(RC1="","",VLOOKUP(RC1,ReportedDump,R8C+2,FALSE)) -> 0 | X31: =IF(RC1="","",VLOOKUP(RC1,ReportedDump,R8C+2,FALSE)) -> 0 | Y31: =IF(RC1="","",VLOOKUP(RC1,ReportedDump,R8C+2,FALSE)) -> 96 | Z31: =IF(RC1="","",VLOOKUP(RC1,ReportedDump,R8C+2,FALSE)) -> 0 | AA31: =IF(RC1="","",VLOOKUP(RC1,ReportedDump,R8C+2,FALSE)) -> 0 | AB31: =IF(RC1="","",VLOOKUP(RC1,ReportedDump,R8C+2,FALSE)) -> 0 | AC31: =IF(RC1="","",VLOOKUP(RC1,ReportedDump,R8C+2,FALSE)) -> 0 | AD31: =IF(RC1="","",VLOOKUP(RC1,ReportedDump,R8C+2,FALSE)) -> 0 | AE31: =IF(RC1="","",VLOOKUP(RC1,ReportedDump,R8C+2,FALSE)) -> 0 | AF31: =IF(RC1="","",VLOOKUP(RC1,ReportedDump,R8C+2,FALSE)) -> 0 | AG31: =IF(RC1="","",VLOOKUP(RC1,ReportedDump,R8C+2,FALSE)) -> 0 | AH31: =IF(RC1="","",VLOOKUP(RC1,ReportedDump,R8C+2,FALSE)) -> 0 | AI31: =IF(RC1="","",VLOOKUP(RC1,ReportedDump,R8C+2,FALSE)) -> 0 | AJ31: =IF(RC1="","",VLOOKUP(RC1,ReportedDump,R8C+2,FALSE)) -> 0 | AK31: =IF(RC1="","",VLOOKUP(RC1,ReportedDump,R8C+2,FALSE)) -> 0 | AL31: =IF(RC1="","",VLOOKUP(RC1,ReportedDump,R8C+2,FALSE)) -> 0 | AM31: =IF(RC1="","",VLOOKUP(RC1,ReportedDump,R8C+2,FALSE)) -> 0 | AN31: =IF(RC1="","",VLOOKUP(RC1,ReportedDump,R8C+2,FALSE)) -> 0 | AO31: =IF(RC1="","",VLOOKUP(RC1,ReportedDump,R8C+2,FALSE)) -> 0
A32: =IF(R[-1]C1="","",IF(DATE(YEAR(R[-1]C),MONTH(R[-1]C)+1,1)>ValDat,"",DATE(YEAR(R[-1]C),MONTH(R[-1]C)+1,1))) -> 2000-07-01T00:00:00.000 | B32: =IF(RC1="","",IF(VLOOKUP(RC1,TrendFacDump,2,FALSE)=0,0,VLOOKUP(EOMONTH(ValDat,-1)+1,TrendFacDump,2,FALSE)/VLOOKUP(RC1,TrendFacDump,2,FALSE))) -> 1.0599957600169598 | C32: =IF(RC1="","",VLOOKUP(RC1,ExpDump,7,FALSE)) -> 3006.0659999999998 | D32: =IF(RC1="","",SUM(RC[2]:RC[37])) -> 329297 | E32: =IF(RC1="","",R[-1]C+RC[1]+R[-1]C[2]+R[-2]C[3]+R[-3]C[4]+R[-4]C[5]+R[-5]C[6]+R[-6]C[7]+R[-7]C[8]+R[-8]C[9]+R[-9]C[10]+R[-10]C[11]+R[-11]C[12]+R[-12]C[13]+R[-13]C[14]+R[-14]C[15]+R[-15]C[16]+R[-16]C[17]+R[-17]C[18]+R[-18]C[19]+R[-19]C[20]+R[-20]C[21]+R[-21]C[22]+R[-22]C[23]+R[-23]C[24]) -> 3847679 | F32: =IF(RC1="","",VLOOKUP(RC1,ReportedDump,R8C+2,FALSE)) -> 45495 | G32: =IF(RC1="","",VLOOKUP(RC1,ReportedDump,R8C+2,FALSE)) -> 81868 | H32: =IF(RC1="","",VLOOKUP(RC1,ReportedDump,R8C+2,FALSE)) -> 96720 | I32: =IF(RC1="","",VLOOKUP(RC1,ReportedDump,R8C+2,FALSE)) -> 55381 | J32: =IF(RC1="","",VLOOKUP(RC1,ReportedDump,R8C+2,FALSE)) -> 3174 | K32: =IF(RC1="","",VLOOKUP(RC1,ReportedDump,R8C+2,FALSE)) -> 17865 | L32: =IF(RC1="","",VLOOKUP(RC1,ReportedDump,R8C+2,FALSE)) -> 5653 | M32: =IF(RC1="","",VLOOKUP(RC1,ReportedDump,R8C+2,FALSE)) -> 21419 | N32: =IF(RC1="","",VLOOKUP(RC1,ReportedDump,R8C+2,FALSE)) -> 0 | O32: =IF(RC1="","",VLOOKUP(RC1,ReportedDump,R8C+2,FALSE)) -> 480 | P32: =IF(RC1="","",VLOOKUP(RC1,ReportedDump,R8C+2,FALSE)) -> 702 | Q32: =IF(RC1="","",VLOOKUP(RC1,ReportedDump,R8C+2,FALSE)) -> 19 | R32: =IF(RC1="","",VLOOKUP(RC1,ReportedDump,R8C+2,FALSE)) -> 0 | S32: =IF(RC1="","",VLOOKUP(RC1,ReportedDump,R8C+2,FALSE)) -> 131 | T32: =IF(RC1="","",VLOOKUP(RC1,ReportedDump,R8C+2,FALSE)) -> 0 | U32: =IF(RC1="","",VLOOKUP(RC1,ReportedDump,R8C+2,FALSE)) -> 0 | V32: =IF(RC1="","",VLOOKUP(RC1,ReportedDump,R8C+2,FALSE)) -> 294 | W32: =IF(RC1="","",VLOOKUP(RC1,ReportedDump,R8C+2,FALSE)) -> 0 | X32: =IF(RC1="","",VLOOKUP(RC1,ReportedDump,R8C+2,FALSE)) -> 0 | Y32: =IF(RC1="","",VLOOKUP(RC1,ReportedDump,R8C+2,FALSE)) -> 96 | Z32: =IF(RC1="","",VLOOKUP(RC1,ReportedDump,R8C+2,FALSE)) -> 0 | AA32: =IF(RC1="","",VLOOKUP(RC1,ReportedDump,R8C+2,FALSE)) -> 0 | AB32: =IF(RC1="","",VLOOKUP(RC1,ReportedDump,R8C+2,FALSE)) -> 0 | AC32: =IF(RC1="","",VLOOKUP(RC1,ReportedDump,R8C+2,FALSE)) -> 0 | AD32: =IF(RC1="","",VLOOKUP(RC1,ReportedDump,R8C+2,FALSE)) -> 0 | AE32: =IF(RC1="","",VLOOKUP(RC1,ReportedDump,R8C+2,FALSE)) -> 0 | AF32: =IF(RC1="","",VLOOKUP(RC1,ReportedDump,R8C+2,FALSE)) -> 0 | AG32: =IF(RC1="","",VLOOKUP(RC1,ReportedDump,R8C+2,FALSE)) -> 0 | AH32: =IF(RC1="","",VLOOKUP(RC1,ReportedDump,R8C+2,FALSE)) -> 0 | AI32: =IF(RC1="","",VLOOKUP(RC1,ReportedDump,R8C+2,FALSE)) -> 0 | AJ32: =IF(RC1="","",VLOOKUP(RC1,ReportedDump,R8C+2,FALSE)) -> 0 | AK32: =IF(RC1="","",VLOOKUP(RC1,ReportedDump,R8C+2,FALSE)) -> 0 | AL32: =IF(RC1="","",VLOOKUP(RC1,ReportedDump,R8C+2,FALSE)) -> 0 | AM32: =IF(RC1="","",VLOOKUP(RC1,ReportedDump,R8C+2,FALSE)) -> 0 | AN32: =IF(RC1="","",VLOOKUP(RC1,ReportedDump,R8C+2,FALSE)) -> 0 | AO32: =IF(RC1="","",VLOOKUP(RC1,ReportedDump,R8C+2,FALSE)) -> 0
A33: =IF(R[-1]C1="","",IF(DATE(YEAR(R[-1]C),MONTH(R[-1]C)+1,1)>ValDat,"",DATE(YEAR(R[-1]C),MONTH(R[-1]C)+1,1))) -> 2000-08-01T00:00:00.000 | B33: =IF(RC1="","",IF(VLOOKUP(RC1,TrendFacDump,2,FALSE)=0,0,VLOOKUP(EOMONTH(ValDat,-1)+1,TrendFacDump,2,FALSE)/VLOOKUP(RC1,TrendFacDump,2,FALSE))) -> 1.0548523206751055 | C33: =IF(RC1="","",VLOOKUP(RC1,ExpDump,7,FALSE)) -> 2987.3629999999998 | D33: =IF(RC1="","",SUM(RC[2]:RC[37])) -> 281510 | E33: =IF(RC1="","",R[-1]C+RC[1]+R[-1]C[2]+R[-2]C[3]+R[-3]C[4]+R[-4]C[5]+R[-5]C[6]+R[-6]C[7]+R[-7]C[8]+R[-8]C[9]+R[-9]C[10]+R[-10]C[11]+R[-11]C[12]+R[-12]C[13]+R[-13]C[14]+R[-14]C[15]+R[-15]C[16]+R[-16]C[17]+R[-17]C[18]+R[-18]C[19]+R[-19]C[20]+R[-20]C[21]+R[-21]C[22]+R[-22]C[23]+R[-23]C[24]+R[-24]C[25]) -> 4091290 | F33: =IF(RC1="","",VLOOKUP(RC1,ReportedDump,R8C+2,FALSE)) -> 2952 | G33: =IF(RC1="","",VLOOKUP(RC1,ReportedDump,R8C+2,FALSE)) -> 58928 | H33: =IF(RC1="","",VLOOKUP(RC1,ReportedDump,R8C+2,FALSE)) -> 130303 | I33: =IF(RC1="","",VLOOKUP(RC1,ReportedDump,R8C+2,FALSE)) -> 52128 | J33: =IF(RC1="","",VLOOKUP(RC1,ReportedDump,R8C+2,FALSE)) -> 14870 | K33: =IF(RC1="","",VLOOKUP(RC1,ReportedDump,R8C+2,FALSE)) -> 3898 | L33: =IF(RC1="","",VLOOKUP(RC1,ReportedDump,R8C+2,FALSE)) -> 15681 | M33: =IF(RC1="","",VLOOKUP(RC1,ReportedDump,R8C+2,FALSE)) -> 1013 | N33: =IF(RC1="","",VLOOKUP(RC1,ReportedDump,R8C+2,FALSE)) -> 981 | O33: =IF(RC1="","",VLOOKUP(RC1,ReportedDump,R8C+2,FALSE)) -> 121 | P33: =IF(RC1="","",VLOOKUP(RC1,ReportedDump,R8C+2,FALSE)) -> 0 | Q33: =IF(RC1="","",VLOOKUP(RC1,ReportedDump,R8C+2,FALSE)) -> 84 | R33: =IF(RC1="","",VLOOKUP(RC1,ReportedDump,R8C+2,FALSE)) -> 213 | S33: =IF(RC1="","",VLOOKUP(RC1,ReportedDump,R8C+2,FALSE)) -> 53 | T33: =IF(RC1="","",VLOOKUP(RC1,ReportedDump,R8C+2,FALSE)) -> 0 | U33: =IF(RC1="","",VLOOKUP(RC1,ReportedDump,R8C+2,FALSE)) -> 0 | V33: =IF(RC1="","",VLOOKUP(RC1,ReportedDump,R8C+2,FALSE)) -> 0 | W33: =IF(RC1="","",VLOOKUP(RC1,ReportedDump,R8C+2,FALSE)) -> 210 | X33: =IF(RC1="","",VLOOKUP(RC1,ReportedDump,R8C+2,FALSE)) -> 75 | Y33: =IF(RC1="","",VLOOKUP(RC1,ReportedDump,R8C+2,FALSE)) -> 0 | Z33: =IF(RC1="","",VLOOKUP(RC1,ReportedDump,R8C+2,FALSE)) -> 0 | AA33: =IF(RC1="","",VLOOKUP(RC1,ReportedDump,R8C+2,FALSE)) -> 0 | AB33: =IF(RC1="","",VLOOKUP(RC1,ReportedDump,R8C+2,FALSE)) -> 0 | AC33: =IF(RC1="","",VLOOKUP(RC1,ReportedDump,R8C+2,FALSE)) -> 0 | AD33: =IF(RC1="","",VLOOKUP(RC1,ReportedDump,R8C+2,FALSE)) -> 0 | AE33: =IF(RC1="","",VLOOKUP(RC1,ReportedDump,R8C+2,FALSE)) -> 0 | AF33: =IF(RC1="","",VLOOKUP(RC1,ReportedDump,R8C+2,FALSE)) -> 0 | AG33: =IF(RC1="","",VLOOKUP(RC1,ReportedDump,R8C+2,FALSE)) -> 0 | AH33: =IF(RC1="","",VLOOKUP(RC1,ReportedDump,R8C+2,FALSE)) -> 0 | AI33: =IF(RC1="","",VLOOKUP(RC1,ReportedDump,R8C+2,FALSE)) -> 0 | AJ33: =IF(RC1="","",VLOOKUP(RC1,ReportedDump,R8C+2,FALSE)) -> 0 | AK33: =IF(RC1="","",VLOOKUP(RC1,ReportedDump,R8C+2,FALSE)) -> 0 | AL33: =IF(RC1="","",VLOOKUP(RC1,ReportedDump,R8C+2,FALSE)) -> 0 | AM33: =IF(RC1="","",VLOOKUP(RC1,ReportedDump,R8C+2,FALSE)) -> 0 | AN33: =IF(RC1="","",VLOOKUP(RC1,ReportedDump,R8C+2,FALSE)) -> 0 | AO33: =IF(RC1="","",VLOOKUP(RC1,ReportedDump,R8C+2,FALSE)) -> 0
A34: =IF(R[-1]C1="","",IF(DATE(YEAR(R[-1]C),MONTH(R[-1]C)+1,1)>ValDat,"",DATE(YEAR(R[-1]C),MONTH(R[-1]C)+1,1))) -> 2000-09-01T00:00:00.000 | B34: =IF(RC1="","",IF(VLOOKUP(RC1,TrendFacDump,2,FALSE)=0,0,VLOOKUP(EOMONTH(ValDat,-1)+1,TrendFacDump,2,FALSE)/VLOOKUP(RC1,TrendFacDump,2,FALSE))) -> 1.0497585555322275 | C34: =IF(RC1="","",VLOOKUP(RC1,ExpDump,7,FALSE)) -> 2953.335 | D34: =IF(RC1="","",SUM(RC[2]:RC[37])) -> 281510 | E34: =IF(RC1="","",R[-1]C+RC[1]+R[-1]C[2]+R[-2]C[3]+R[-3]C[4]+R[-4]C[5]+R[-5]C[6]+R[-6]C[7]+R[-7]C[8]+R[-8]C[9]+R[-9]C[10]+R[-10]C[11]+R[-11]C[12]+R[-12]C[13]+R[-13]C[14]+R[-14]C[15]+R[-15]C[16]+R[-16]C[17]+R[-17]C[18]+R[-18]C[19]+R[-19]C[20]+R[-20]C[21]+R[-21]C[22]+R[-22]C[23]+R[-23]C[24]+R[-24]C[25]+R[-25]C[26]) -> 4386439 | F34: =IF(RC1="","",VLOOKUP(RC1,ReportedDump,R8C+2,FALSE)) -> 22590 | G34: =IF(RC1="","",VLOOKUP(RC1,ReportedDump,R8C+2,FALSE)) -> 127706 | H34: =IF(RC1="","",VLOOKUP(RC1,ReportedDump,R8C+2,FALSE)) -> 52799 | I34: =IF(RC1="","",VLOOKUP(RC1,ReportedDump,R8C+2,FALSE)) -> 53458 | J34: =IF(RC1="","",VLOOKUP(RC1,ReportedDump,R8C+2,FALSE)) -> 8807 | K34: =IF(RC1="","",VLOOKUP(RC1,ReportedDump,R8C+2,FALSE)) -> 2747 | L34: =IF(RC1="","",VLOOKUP(RC1,ReportedDump,R8C+2,FALSE)) -> 11162 | M34: =IF(RC1="","",VLOOKUP(RC1,ReportedDump,R8C+2,FALSE)) -> 581 | N34: =IF(RC1="","",VLOOKUP(RC1,ReportedDump,R8C+2,FALSE)) -> 1025 | O34: =IF(RC1="","",VLOOKUP(RC1,ReportedDump,R8C+2,FALSE)) -> 0 | P34: =IF(RC1="","",VLOOKUP(RC1,ReportedDump,R8C+2,FALSE)) -> 0 | Q34: =IF(RC1="","",VLOOKUP(RC1,ReportedDump,R8C+2,FALSE)) -> 84 | R34: =IF(RC1="","",VLOOKUP(RC1,ReportedDump,R8C+2,FALSE)) -> 213 | S34: =IF(RC1="","",VLOOKUP(RC1,ReportedDump,R8C+2,FALSE)) -> 53 | T34: =IF(RC1="","",VLOOKUP(RC1,ReportedDump,R8C+2,FALSE)) -> 0 | U34: =IF(RC1="","",VLOOKUP(RC1,ReportedDump,R8C+2,FALSE)) -> 0 | V34: =IF(RC1="","",VLOOKUP(RC1,ReportedDump,R8C+2,FALSE)) -> 210 | W34: =IF(RC1="","",VLOOKUP(RC1,ReportedDump,R8C+2,FALSE)) -> 0 | X34: =IF(RC1="","",VLOOKUP(RC1,ReportedDump,R8C+2,FALSE)) -> 75 | Y34: =IF(RC1="","",VLOOKUP(RC1,ReportedDump,R8C+2,FALSE)) -> 0 | Z34: =IF(RC1="","",VLOOKUP(RC1,ReportedDump,R8C+2,FALSE)) -> 0 | AA34: =IF(RC1="","",VLOOKUP(RC1,ReportedDump,R8C+2,FALSE)) -> 0 | AB34: =IF(RC1="","",VLOOKUP(RC1,ReportedDump,R8C+2,FALSE)) -> 0 | AC34: =IF(RC1="","",VLOOKUP(RC1,ReportedDump,R8C+2,FALSE)) -> 0 | AD34: =IF(RC1="","",VLOOKUP(RC1,ReportedDump,R8C+2,FALSE)) -> 0 | AE34: =IF(RC1="","",VLOOKUP(RC1,ReportedDump,R8C+2,FALSE)) -> 0 | AF34: =IF(RC1="","",VLOOKUP(RC1,ReportedDump,R8C+2,FALSE)) -> 0 | AG34: =IF(RC1="","",VLOOKUP(RC1,ReportedDump,R8C+2,FALSE)) -> 0 | AH34: =IF(RC1="","",VLOOKUP(RC1,ReportedDump,R8C+2,FALSE)) -> 0 | AI34: =IF(RC1="","",VLOOKUP(RC1,ReportedDump,R8C+2,FALSE)) -> 0 | AJ34: =IF(RC1="","",VLOOKUP(RC1,ReportedDump,R8C+2,FALSE)) -> 0 | AK34: =IF(RC1="","",VLOOKUP(RC1,ReportedDump,R8C+2,FALSE)) -> 0 | AL34: =IF(RC1="","",VLOOKUP(RC1,ReportedDump,R8C+2,FALSE)) -> 0 | AM34: =IF(RC1="","",VLOOKUP(RC1,ReportedDump,R8C+2,FALSE)) -> 0 | AN34: =IF(RC1="","",VLOOKUP(RC1,ReportedDump,R8C+2,FALSE)) -> 0 | AO34: =IF(RC1="","",VLOOKUP(RC1,ReportedDump,R8C+2,FALSE)) -> 0
A35: =IF(R[-1]C1="","",IF(DATE(YEAR(R[-1]C),MONTH(R[-1]C)+1,1)>ValDat,"",DATE(YEAR(R[-1]C),MONTH(R[-1]C)+1,1))) -> 2000-10-01T00:00:00.000 | B35: =IF(RC1="","",IF(VLOOKUP(RC1,TrendFacDump,2,FALSE)=0,0,VLOOKUP(EOMONTH(ValDat,-1)+1,TrendFacDump,2,FALSE)/VLOOKUP(RC1,TrendFacDump,2,FALSE))) -> 1.0447137484329294 | C35: =IF(RC1="","",VLOOKUP(RC1,ExpDump,7,FALSE)) -> 2927.2660000000001 | D35: =IF(RC1="","",SUM(RC[2]:RC[37])) -> 183309 | E35: =IF(RC1="","",R[-1]C+RC[1]+R[-1]C[2]+R[-2]C[3]+R[-3]C[4]+R[-4]C[5]+R[-5]C[6]+R[-6]C[7]+R[-7]C[8]+R[-8]C[9]+R[-9]C[10]+R[-10]C[11]+R[-11]C[12]+R[-12]C[13]+R[-13]C[14]+R[-14]C[15]+R[-15]C[16]+R[-16]C[17]+R[-17]C[18]+R[-18]C[19]+R[-19]C[20]+R[-20]C[21]+R[-21]C[22]+R[-22]C[23]+R[-23]C[24]+R[-24]C[25]+R[-25]C[26]+R[-26]C[27]) -> 4731427 | F35: =IF(RC1="","",VLOOKUP(RC1,ReportedDump,R8C+2,FALSE)) -> 2217 | G35: =IF(RC1="","",VLOOKUP(RC1,ReportedDump,R8C+2,FALSE)) -> 50074 | H35: =IF(RC1="","",VLOOKUP(RC1,ReportedDump,R8C+2,FALSE)) -> 38342 | I35: =IF(RC1="","",VLOOKUP(RC1,ReportedDump,R8C+2,FALSE)) -> 59896 | J35: =IF(RC1="","",VLOOKUP(RC1,ReportedDump,R8C+2,FALSE)) -> 12140 | K35: =IF(RC1="","",VLOOKUP(RC1,ReportedDump,R8C+2,FALSE)) -> 3146 | L35: =IF(RC1="","",VLOOKUP(RC1,ReportedDump,R8C+2,FALSE)) -> 1154 | M35: =IF(RC1="","",VLOOKUP(RC1,ReportedDump,R8C+2,FALSE)) -> 9723 | N35: =IF(RC1="","",VLOOKUP(RC1,ReportedDump,R8C+2,FALSE)) -> 403 | O35: =IF(RC1="","",VLOOKUP(RC1,ReportedDump,R8C+2,FALSE)) -> 0 | P35: =IF(RC1="","",VLOOKUP(RC1,ReportedDump,R8C+2,FALSE)) -> 1132 | Q35: =IF(RC1="","",VLOOKUP(RC1,ReportedDump,R8C+2,FALSE)) -> 177 | R35: =IF(RC1="","",VLOOKUP(RC1,ReportedDump,R8C+2,FALSE)) -> 160 | S35: =IF(RC1="","",VLOOKUP(RC1,ReportedDump,R8C+2,FALSE)) -> 3268 | T35: =IF(RC1="","",VLOOKUP(RC1,ReportedDump,R8C+2,FALSE)) -> 288 | U35: =IF(RC1="","",VLOOKUP(RC1,ReportedDump,R8C+2,FALSE)) -> 398 | V35: =IF(RC1="","",VLOOKUP(RC1,ReportedDump,R8C+2,FALSE)) -> 57 | W35: =IF(RC1="","",VLOOKUP(RC1,ReportedDump,R8C+2,FALSE)) -> 734 | X35: =IF(RC1="","",VLOOKUP(RC1,ReportedDump,R8C+2,FALSE)) -> 0 | Y35: =IF(RC1="","",VLOOKUP(RC1,ReportedDump,R8C+2,FALSE)) -> 0 | Z35: =IF(RC1="","",VLOOKUP(RC1,ReportedDump,R8C+2,FALSE)) -> 0 | AA35: =IF(RC1="","",VLOOKUP(RC1,ReportedDump,R8C+2,FALSE)) -> 0 | AB35: =IF(RC1="","",VLOOKUP(RC1,ReportedDump,R8C+2,FALSE)) -> 0 | AC35: =IF(RC1="","",VLOOKUP(RC1,ReportedDump,R8C+2,FALSE)) -> 0 | AD35: =IF(RC1="","",VLOOKUP(RC1,ReportedDump,R8C+2,FALSE)) -> 0 | AE35: =IF(RC1="","",VLOOKUP(RC1,ReportedDump,R8C+2,FALSE)) -> 0 | AF35: =IF(RC1="","",VLOOKUP(RC1,ReportedDump,R8C+2,FALSE)) -> 0 | AG35: =IF(RC1="","",VLOOKUP(RC1,ReportedDump,R8C+2,FALSE)) -> 0 | AH35: =IF(RC1="","",VLOOKUP(RC1,ReportedDump,R8C+2,FALSE)) -> 0 | AI35: =IF(RC1="","",VLOOKUP(RC1,ReportedDump,R8C+2,FALSE)) -> 0 | AJ35: =IF(RC1="","",VLOOKUP(RC1,ReportedDump,R8C+2,FALSE)) -> 0 | AK35: =IF(RC1="","",VLOOKUP(RC1,ReportedDump,R8C+2,FALSE)) -> 0 | AL35: =IF(RC1="","",VLOOKUP(RC1,ReportedDump,R8C+2,FALSE)) -> 0 | AM35: =IF(RC1="","",VLOOKUP(RC1,ReportedDump,R8C+2,FALSE)) -> 0 | AN35: =IF(RC1="","",VLOOKUP(RC1,ReportedDump,R8C+2,FALSE)) -> 0 | AO35: =IF(RC1="","",VLOOKUP(RC1,ReportedDump,R8C+2,FALSE)) -> 0
A36: =IF(R[-1]C1="","",IF(DATE(YEAR(R[-1]C),MONTH(R[-1]C)+1,1)>ValDat,"",DATE(YEAR(R[-1]C),MONTH(R[-1]C)+1,1))) -> 2000-11-01T00:00:00.000 | B36: =IF(RC1="","",IF(VLOOKUP(RC1,TrendFacDump,2,FALSE)=0,0,VLOOKUP(EOMONTH(ValDat,-1)+1,TrendFacDump,2,FALSE)/VLOOKUP(RC1,TrendFacDump,2,FALSE))) -> 1.0396091069757771 | C36: =IF(RC1="","",VLOOKUP(RC1,ExpDump,7,FALSE)) -> 2897.2249999999999 | D36: =IF(RC1="","",SUM(RC[2]:RC[37])) -> 183309 | E36: =IF(RC1="","",R[-1]C+RC[1]+R[-1]C[2]+R[-2]C[3]+R[-3]C[4]+R[-4]C[5]+R[-5]C[6]+R[-6]C[7]+R[-7]C[8]+R[-8]C[9]+R[-9]C[10]+R[-10]C[11]+R[-11]C[12]+R[-12]C[13]+R[-13]C[14]+R[-14]C[15]+R[-15]C[16]+R[-16]C[17]+R[-17]C[18]+R[-18]C[19]+R[-19]C[20]+R[-20]C[21]+R[-21]C[22]+R[-22]C[23]+R[-23]C[24]+R[-24]C[25]+R[-25]C[26]+R[-26]C[27]+R[-27]C[28]) -> 4933772 | F36: =IF(RC1="","",VLOOKUP(RC1,ReportedDump,R8C+2,FALSE)) -> 19627 | G36: =IF(RC1="","",VLOOKUP(RC1,ReportedDump,R8C+2,FALSE)) -> 78051 | H36: =IF(RC1="","",VLOOKUP(RC1,ReportedDump,R8C+2,FALSE)) -> 32446 | I36: =IF(RC1="","",VLOOKUP(RC1,ReportedDump,R8C+2,FALSE)) -> 30039 | J36: =IF(RC1="","",VLOOKUP(RC1,ReportedDump,R8C+2,FALSE)) -> 3104 | K36: =IF(RC1="","",VLOOKUP(RC1,ReportedDump,R8C+2,FALSE)) -> 8621 | L36: =IF(RC1="","",VLOOKUP(RC1,ReportedDump,R8C+2,FALSE)) -> 1405 | M36: =IF(RC1="","",VLOOKUP(RC1,ReportedDump,R8C+2,FALSE)) -> 3535 | N36: =IF(RC1="","",VLOOKUP(RC1,ReportedDump,R8C+2,FALSE)) -> 707 | O36: =IF(RC1="","",VLOOKUP(RC1,ReportedDump,R8C+2,FALSE)) -> 57 | P36: =IF(RC1="","",VLOOKUP(RC1,ReportedDump,R8C+2,FALSE)) -> 692 | Q36: =IF(RC1="","",VLOOKUP(RC1,ReportedDump,R8C+2,FALSE)) -> 229 | R36: =IF(RC1="","",VLOOKUP(RC1,ReportedDump,R8C+2,FALSE)) -> 3279 | S36: =IF(RC1="","",VLOOKUP(RC1,ReportedDump,R8C+2,FALSE)) -> 40 | T36: =IF(RC1="","",VLOOKUP(RC1,ReportedDump,R8C+2,FALSE)) -> 328 | U36: =IF(RC1="","",VLOOKUP(RC1,ReportedDump,R8C+2,FALSE)) -> 415 | V36: =IF(RC1="","",VLOOKUP(RC1,ReportedDump,R8C+2,FALSE)) -> 0 | W36: =IF(RC1="","",VLOOKUP(RC1,ReportedDump,R8C+2,FALSE)) -> 734 | X36: =IF(RC1="","",VLOOKUP(RC1,ReportedDump,R8C+2,FALSE)) -> 0 | Y36: =IF(RC1="","",VLOOKUP(RC1,ReportedDump,R8C+2,FALSE)) -> 0 | Z36: =IF(RC1="","",VLOOKUP(RC1,ReportedDump,R8C+2,FALSE)) -> 0 | AA36: =IF(RC1="","",VLOOKUP(RC1,ReportedDump,R8C+2,FALSE)) -> 0 | AB36: =IF(RC1="","",VLOOKUP(RC1,ReportedDump,R8C+2,FALSE)) -> 0 | AC36: =IF(RC1="","",VLOOKUP(RC1,ReportedDump,R8C+2,FALSE)) -> 0 | AD36: =IF(RC1="","",VLOOKUP(RC1,ReportedDump,R8C+2,FALSE)) -> 0 | AE36: =IF(RC1="","",VLOOKUP(RC1,ReportedDump,R8C+2,FALSE)) -> 0 | AF36: =IF(RC1="","",VLOOKUP(RC1,ReportedDump,R8C+2,FALSE)) -> 0 | AG36: =IF(RC1="","",VLOOKUP(RC1,ReportedDump,R8C+2,FALSE)) -> 0 | AH36: =IF(RC1="","",VLOOKUP(RC1,ReportedDump,R8C+2,FALSE)) -> 0 | AI36: =IF(RC1="","",VLOOKUP(RC1,ReportedDump,R8C+2,FALSE)) -> 0 | AJ36: =IF(RC1="","",VLOOKUP(RC1,ReportedDump,R8C+2,FALSE)) -> 0 | AK36: =IF(RC1="","",VLOOKUP(RC1,ReportedDump,R8C+2,FALSE)) -> 0 | AL36: =IF(RC1="","",VLOOKUP(RC1,ReportedDump,R8C+2,FALSE)) -> 0 | AM36: =IF(RC1="","",VLOOKUP(RC1,ReportedDump,R8C+2,FALSE)) -> 0 | AN36: =IF(RC1="","",VLOOKUP(RC1,ReportedDump,R8C+2,FALSE)) -> 0 | AO36: =IF(RC1="","",VLOOKUP(RC1,ReportedDump,R8C+2,FALSE)) -> 0
A37: =IF(R[-1]C1="","",IF(DATE(YEAR(R[-1]C),MONTH(R[-1]C)+1,1)>ValDat,"",DATE(YEAR(R[-1]C),MONTH(R[-1]C)+1,1))) -> 2000-12-01T00:00:00.000 | B37: =IF(RC1="","",IF(VLOOKUP(RC1,TrendFacDump,2,FALSE)=0,0,VLOOKUP(EOMONTH(ValDat,-1)+1,TrendFacDump,2,FALSE)/VLOOKUP(RC1,TrendFacDump,2,FALSE))) -> 1.0345541071798054 | C37: =IF(RC1="","",VLOOKUP(RC1,ExpDump,7,FALSE)) -> 2887.18 | D37: =IF(RC1="","",SUM(RC[2]:RC[37])) -> 83695 | E37: =IF(RC1="","",R[-1]C+RC[1]+R[-1]C[2]+R[-2]C[3]+R[-3]C[4]+R[-4]C[5]+R[-5]C[6]+R[-6]C[7]+R[-7]C[8]+R[-8]C[9]+R[-9]C[10]+R[-10]C[11]+R[-11]C[12]+R[-12]C[13]+R[-13]C[14]+R[-14]C[15]+R[-15]C[16]+R[-16]C[17]+R[-17]C[18]+R[-18]C[19]+R[-19]C[20]+R[-20]C[21]+R[-21]C[22]+R[-22]C[23]+R[-23]C[24]+R[-24]C[25]+R[-25]C[26]+R[-26]C[27]+R[-27]C[28]+R[-28]C[29]) -> 5150255 | F37: =IF(RC1="","",VLOOKUP(RC1,ReportedDump,R8C+2,FALSE)) -> 5402 | G37: =IF(RC1="","",VLOOKUP(RC1,ReportedDump,R8C+2,FALSE)) -> 16943 | H37: =IF(RC1="","",VLOOKUP(RC1,ReportedDump,R8C+2,FALSE)) -> 34607 | I37: =IF(RC1="","",VLOOKUP(RC1,ReportedDump,R8C+2,FALSE)) -> 6988 | J37: =IF(RC1="","",VLOOKUP(RC1,ReportedDump,R8C+2,FALSE)) -> 3602 | K37: =IF(RC1="","",VLOOKUP(RC1,ReportedDump,R8C+2,FALSE)) -> 2116 | L37: =IF(RC1="","",VLOOKUP(RC1,ReportedDump,R8C+2,FALSE)) -> 7375 | M37: =IF(RC1="","",VLOOKUP(RC1,ReportedDump,R8C+2,FALSE)) -> 474 | N37: =IF(RC1="","",VLOOKUP(RC1,ReportedDump,R8C+2,FALSE)) -> 3162 | O37: =IF(RC1="","",VLOOKUP(RC1,ReportedDump,R8C+2,FALSE)) -> 1388 | P37: =IF(RC1="","",VLOOKUP(RC1,ReportedDump,R8C+2,FALSE)) -> 160 | Q37: =IF(RC1="","",VLOOKUP(RC1,ReportedDump,R8C+2,FALSE)) -> 284 | R37: =IF(RC1="","",VLOOKUP(RC1,ReportedDump,R8C+2,FALSE)) -> 406 | S37: =IF(RC1="","",VLOOKUP(RC1,ReportedDump,R8C+2,FALSE)) -> 788 | T37: =IF(RC1="","",VLOOKUP(RC1,ReportedDump,R8C+2,FALSE)) -> 0 | U37: =IF(RC1="","",VLOOKUP(RC1,ReportedDump,R8C+2,FALSE)) -> 0 | V37: =IF(RC1="","",VLOOKUP(RC1,ReportedDump,R8C+2,FALSE)) -> 0 | W37: =IF(RC1="","",VLOOKUP(RC1,ReportedDump,R8C+2,FALSE)) -> 0 | X37: =IF(RC1="","",VLOOKUP(RC1,ReportedDump,R8C+2,FALSE)) -> 0 | Y37: =IF(RC1="","",VLOOKUP(RC1,ReportedDump,R8C+2,FALSE)) -> 0 | Z37: =IF(RC1="","",VLOOKUP(RC1,ReportedDump,R8C+2,FALSE)) -> 0 | AA37: =IF(RC1="","",VLOOKUP(RC1,ReportedDump,R8C+2,FALSE)) -> 0 | AB37: =IF(RC1="","",VLOOKUP(RC1,ReportedDump,R8C+2,FALSE)) -> 0 | AC37: =IF(RC1="","",VLOOKUP(RC1,ReportedDump,R8C+2,FALSE)) -> 0 | AD37: =IF(RC1="","",VLOOKUP(RC1,ReportedDump,R8C+2,FALSE)) -> 0 | AE37: =IF(RC1="","",VLOOKUP(RC1,ReportedDump,R8C+2,FALSE)) -> 0 | AF37: =IF(RC1="","",VLOOKUP(RC1,ReportedDump,R8C+2,FALSE)) -> 0 | AG37: =IF(RC1="","",VLOOKUP(RC1,ReportedDump,R8C+2,FALSE)) -> 0 | AH37: =IF(RC1="","",VLOOKUP(RC1,ReportedDump,R8C+2,FALSE)) -> 0 | AI37: =IF(RC1="","",VLOOKUP(RC1,ReportedDump,R8C+2,FALSE)) -> 0 | AJ37: =IF(RC1="","",VLOOKUP(RC1,ReportedDump,R8C+2,FALSE)) -> 0 | AK37: =IF(RC1="","",VLOOKUP(RC1,ReportedDump,R8C+2,FALSE)) -> 0 | AL37: =IF(RC1="","",VLOOKUP(RC1,ReportedDump,R8C+2,FALSE)) -> 0 | AM37: =IF(RC1="","",VLOOKUP(RC1,ReportedDump,R8C+2,FALSE)) -> 0 | AN37: =IF(RC1="","",VLOOKUP(RC1,ReportedDump,R8C+2,FALSE)) -> 0 | AO37: =IF(RC1="","",VLOOKUP(RC1,ReportedDump,R8C+2,FALSE)) -> 0
A38: =IF(R[-1]C1="","",IF(DATE(YEAR(R[-1]C),MONTH(R[-1]C)+1,1)>ValDat,"",DATE(YEAR(R[-1]C),MONTH(R[-1]C)+1,1))) -> 2001-01-01T00:00:00.000 | B38: =IF(RC1="","",IF(VLOOKUP(RC1,TrendFacDump,2,FALSE)=0,0,VLOOKUP(EOMONTH(ValDat,-1)+1,TrendFacDump,2,FALSE)/VLOOKUP(RC1,TrendFacDump,2,FALSE))) -> 1.0295480284155256 | C38: =IF(RC1="","",VLOOKUP(RC1,ExpDump,7,FALSE)) -> 2887.8029999999999 | D38: =IF(RC1="","",SUM(RC[2]:RC[37])) -> 83695 | E38: =IF(RC1="","",R[-1]C+RC[1]+R[-1]C[2]+R[-2]C[3]+R[-3]C[4]+R[-4]C[5]+R[-5]C[6]+R[-6]C[7]+R[-7]C[8]+R[-8]C[9]+R[-9]C[10]+R[-10]C[11]+R[-11]C[12]+R[-12]C[13]+R[-13]C[14]+R[-14]C[15]+R[-15]C[16]+R[-16]C[17]+R[-17]C[18]+R[-18]C[19]+R[-19]C[20]+R[-20]C[21]+R[-21]C[22]+R[-22]C[23]+R[-23]C[24]+R[-24]C[25]+R[-25]C[26]+R[-26]C[27]+R[-27]C[28]+R[-28]C[29]+R[-29]C[30]) -> 5317053 | F38: =IF(RC1="","",VLOOKUP(RC1,ReportedDump,R8C+2,FALSE)) -> 15456 | G38: =IF(RC1="","",VLOOKUP(RC1,ReportedDump,R8C+2,FALSE)) -> 19047 | H38: =IF(RC1="","",VLOOKUP(RC1,ReportedDump,R8C+2,FALSE)) -> 26813 | I38: =IF(RC1="","",VLOOKUP(RC1,ReportedDump,R8C+2,FALSE)) -> 7995 | J38: =IF(RC1="","",VLOOKUP(RC1,ReportedDump,R8C+2,FALSE)) -> 520 | K38: =IF(RC1="","",VLOOKUP(RC1,ReportedDump,R8C+2,FALSE)) -> 1792 | L38: =IF(RC1="","",VLOOKUP(RC1,ReportedDump,R8C+2,FALSE)) -> 5685 | M38: =IF(RC1="","",VLOOKUP(RC1,ReportedDump,R8C+2,FALSE)) -> 405 | N38: =IF(RC1="","",VLOOKUP(RC1,ReportedDump,R8C+2,FALSE)) -> 4138 | O38: =IF(RC1="","",VLOOKUP(RC1,ReportedDump,R8C+2,FALSE)) -> 206 | P38: =IF(RC1="","",VLOOKUP(RC1,ReportedDump,R8C+2,FALSE)) -> 360 | Q38: =IF(RC1="","",VLOOKUP(RC1,ReportedDump,R8C+2,FALSE)) -> 188 | R38: =IF(RC1="","",VLOOKUP(RC1,ReportedDump,R8C+2,FALSE)) -> 302 | S38: =IF(RC1="","",VLOOKUP(RC1,ReportedDump,R8C+2,FALSE)) -> 788 | T38: =IF(RC1="","",VLOOKUP(RC1,ReportedDump,R8C+2,FALSE)) -> 0 | U38: =IF(RC1="","",VLOOKUP(RC1,ReportedDump,R8C+2,FALSE)) -> 0 | V38: =IF(RC1="","",VLOOKUP(RC1,ReportedDump,R8C+2,FALSE)) -> 0 | W38: =IF(RC1="","",VLOOKUP(RC1,ReportedDump,R8C+2,FALSE)) -> 0 | X38: =IF(RC1="","",VLOOKUP(RC1,ReportedDump,R8C+2,FALSE)) -> 0 | Y38: =IF(RC1="","",VLOOKUP(RC1,ReportedDump,R8C+2,FALSE)) -> 0 | Z38: =IF(RC1="","",VLOOKUP(RC1,ReportedDump,R8C+2,FALSE)) -> 0 | AA38: =IF(RC1="","",VLOOKUP(RC1,ReportedDump,R8C+2,FALSE)) -> 0 | AB38: =IF(RC1="","",VLOOKUP(RC1,ReportedDump,R8C+2,FALSE)) -> 0 | AC38: =IF(RC1="","",VLOOKUP(RC1,ReportedDump,R8C+2,FALSE)) -> 0 | AD38: =IF(RC1="","",VLOOKUP(RC1,ReportedDump,R8C+2,FALSE)) -> 0 | AE38: =IF(RC1="","",VLOOKUP(RC1,ReportedDump,R8C+2,FALSE)) -> 0 | AF38: =IF(RC1="","",VLOOKUP(RC1,ReportedDump,R8C+2,FALSE)) -> 0 | AG38: =IF(RC1="","",VLOOKUP(RC1,ReportedDump,R8C+2,FALSE)) -> 0 | AH38: =IF(RC1="","",VLOOKUP(RC1,ReportedDump,R8C+2,FALSE)) -> 0 | AI38: =IF(RC1="","",VLOOKUP(RC1,ReportedDump,R8C+2,FALSE)) -> 0 | AJ38: =IF(RC1="","",VLOOKUP(RC1,ReportedDump,R8C+2,FALSE)) -> 0 | AK38: =IF(RC1="","",VLOOKUP(RC1,ReportedDump,R8C+2,FALSE)) -> 0 | AL38: =IF(RC1="","",VLOOKUP(RC1,ReportedDump,R8C+2,FALSE)) -> 0 | AM38: =IF(RC1="","",VLOOKUP(RC1,ReportedDump,R8C+2,FALSE)) -> 0 | AN38: =IF(RC1="","",VLOOKUP(RC1,ReportedDump,R8C+2,FALSE)) -> 0 | AO38: =IF(RC1="","",VLOOKUP(RC1,ReportedDump,R8C+2,FALSE)) -> 0
A39: =IF(R[-1]C1="","",IF(DATE(YEAR(R[-1]C),MONTH(R[-1]C)+1,1)>ValDat,"",DATE(YEAR(R[-1]C),MONTH(R[-1]C)+1,1))) -> 2001-02-01T00:00:00.000 | B39: =IF(RC1="","",IF(VLOOKUP(RC1,TrendFacDump,2,FALSE)=0,0,VLOOKUP(EOMONTH(ValDat,-1)+1,TrendFacDump,2,FALSE)/VLOOKUP(RC1,TrendFacDump,2,FALSE))) -> 1.0245901639344261 | C39: =IF(RC1="","",VLOOKUP(RC1,ExpDump,7,FALSE)) -> 2887.0279999999998 | D39: =IF(RC1="","",SUM(RC[2]:RC[37])) -> 140421 | E39: =IF(RC1="","",R[-1]C+RC[1]+R[-1]C[2]+R[-2]C[3]+R[-3]C[4]+R[-4]C[5]+R[-5]C[6]+R[-6]C[7]+R[-7]C[8]+R[-8]C[9]+R[-9]C[10]+R[-10]C[11]+R[-11]C[12]+R[-12]C[13]+R[-13]C[14]+R[-14]C[15]+R[-15]C[16]+R[-16]C[17]+R[-17]C[18]+R[-18]C[19]+R[-19]C[20]+R[-20]C[21]+R[-21]C[22]+R[-22]C[23]+R[-23]C[24]+R[-24]C[25]+R[-25]C[26]+R[-26]C[27]+R[-27]C[28]+R[-28]C[29]+R[-29]C[30]+R[-30]C[31]) -> 5453774 | F39: =IF(RC1="","",VLOOKUP(RC1,ReportedDump,R8C+2,FALSE)) -> 544 | G39: =IF(RC1="","",VLOOKUP(RC1,ReportedDump,R8C+2,FALSE)) -> 16998 | H39: =IF(RC1="","",VLOOKUP(RC1,ReportedDump,R8C+2,FALSE)) -> 37793 | I39: =IF(RC1="","",VLOOKUP(RC1,ReportedDump,R8C+2,FALSE)) -> 49731 | J39: =IF(RC1="","",VLOOKUP(RC1,ReportedDump,R8C+2,FALSE)) -> 28448 | K39: =IF(RC1="","",VLOOKUP(RC1,ReportedDump,R8C+2,FALSE)) -> 2175 | L39: =IF(RC1="","",VLOOKUP(RC1,ReportedDump,R8C+2,FALSE)) -> 1814 | M39: =IF(RC1="","",VLOOKUP(RC1,ReportedDump,R8C+2,FALSE)) -> 333 | N39: =IF(RC1="","",VLOOKUP(RC1,ReportedDump,R8C+2,FALSE)) -> 718 | O39: =IF(RC1="","",VLOOKUP(RC1,ReportedDump,R8C+2,FALSE)) -> 1341 | P39: =IF(RC1="","",VLOOKUP(RC1,ReportedDump,R8C+2,FALSE)) -> 64 | Q39: =IF(RC1="","",VLOOKUP(RC1,ReportedDump,R8C+2,FALSE)) -> 28 | R39: =IF(RC1="","",VLOOKUP(RC1,ReportedDump,R8C+2,FALSE)) -> 0 | S39: =IF(RC1="","",VLOOKUP(RC1,ReportedDump,R8C+2,FALSE)) -> 0 | T39: =IF(RC1="","",VLOOKUP(RC1,ReportedDump,R8C+2,FALSE)) -> 256 | U39: =IF(RC1="","",VLOOKUP(RC1,ReportedDump,R8C+2,FALSE)) -> 108 | V39: =IF(RC1="","",VLOOKUP(RC1,ReportedDump,R8C+2,FALSE)) -> 70 | W39: =IF(RC1="","",VLOOKUP(RC1,ReportedDump,R8C+2,FALSE)) -> 0 | X39: =IF(RC1="","",VLOOKUP(RC1,ReportedDump,R8C+2,FALSE)) -> 0 | Y39: =IF(RC1="","",VLOOKUP(RC1,ReportedDump,R8C+2,FALSE)) -> 0 | Z39: =IF(RC1="","",VLOOKUP(RC1,ReportedDump,R8C+2,FALSE)) -> 0 | AA39: =IF(RC1="","",VLOOKUP(RC1,ReportedDump,R8C+2,FALSE)) -> 0 | AB39: =IF(RC1="","",VLOOKUP(RC1,ReportedDump,R8C+2,FALSE)) -> 0 | AC39: =IF(RC1="","",VLOOKUP(RC1,ReportedDump,R8C+2,FALSE)) -> 0 | AD39: =IF(RC1="","",VLOOKUP(RC1,ReportedDump,R8C+2,FALSE)) -> 0 | AE39: =IF(RC1="","",VLOOKUP(RC1,ReportedDump,R8C+2,FALSE)) -> 0 | AF39: =IF(RC1="","",VLOOKUP(RC1,ReportedDump,R8C+2,FALSE)) -> 0 | AG39: =IF(RC1="","",VLOOKUP(RC1,ReportedDump,R8C+2,FALSE)) -> 0 | AH39: =IF(RC1="","",VLOOKUP(RC1,ReportedDump,R8C+2,FALSE)) -> 0 | AI39: =IF(RC1="","",VLOOKUP(RC1,ReportedDump,R8C+2,FALSE)) -> 0 | AJ39: =IF(RC1="","",VLOOKUP(RC1,ReportedDump,R8C+2,FALSE)) -> 0 | AK39: =IF(RC1="","",VLOOKUP(RC1,ReportedDump,R8C+2,FALSE)) -> 0 | AL39: =IF(RC1="","",VLOOKUP(RC1,ReportedDump,R8C+2,FALSE)) -> 0 | AM39: =IF(RC1="","",VLOOKUP(RC1,ReportedDump,R8C+2,FALSE)) -> 0 | AN39: =IF(RC1="","",VLOOKUP(RC1,ReportedDump,R8C+2,FALSE)) -> 0 | AO39: =IF(RC1="","",VLOOKUP(RC1,ReportedDump,R8C+2,FALSE)) -> 0
A40: =IF(R[-1]C1="","",IF(DATE(YEAR(R[-1]C),MONTH(R[-1]C)+1,1)>ValDat,"",DATE(YEAR(R[-1]C),MONTH(R[-1]C)+1,1))) -> 2001-03-01T00:00:00.000 | B40: =IF(RC1="","",IF(VLOOKUP(RC1,TrendFacDump,2,FALSE)=0,0,VLOOKUP(EOMONTH(ValDat,-1)+1,TrendFacDump,2,FALSE)/VLOOKUP(RC1,TrendFacDump,2,FALSE))) -> 1.0195758564437194 | C40: =IF(RC1="","",VLOOKUP(RC1,ExpDump,7,FALSE)) -> 2848.3409999999999 | D40: =IF(RC1="","",SUM(RC[2]:RC[37])) -> 140421 | E40: =IF(RC1="","",R[-1]C+RC[1]+R[-1]C[2]+R[-2]C[3]+R[-3]C[4]+R[-4]C[5]+R[-5]C[6]+R[-6]C[7]+R[-7]C[8]+R[-8]C[9]+R[-9]C[10]+R[-10]C[11]+R[-11]C[12]+R[-12]C[13]+R[-13]C[14]+R[-14]C[15]+R[-15]C[16]+R[-16]C[17]+R[-17]C[18]+R[-18]C[19]+R[-19]C[20]+R[-20]C[21]+R[-21]C[22]+R[-22]C[23]+R[-23]C[24]+R[-24]C[25]+R[-25]C[26]+R[-26]C[27]+R[-27]C[28]+R[-28]C[29]+R[-29]C[30]+R[-30]C[31]+R[-31]C[32]) -> 5532193 | F40: =IF(RC1="","",VLOOKUP(RC1,ReportedDump,R8C+2,FALSE)) -> 8442 | G40: =IF(RC1="","",VLOOKUP(RC1,ReportedDump,R8C+2,FALSE)) -> 51447 | H40: =IF(RC1="","",VLOOKUP(RC1,ReportedDump,R8C+2,FALSE)) -> 16192 | I40: =IF(RC1="","",VLOOKUP(RC1,ReportedDump,R8C+2,FALSE)) -> 58463 | J40: =IF(RC1="","",VLOOKUP(RC1,ReportedDump,R8C+2,FALSE)) -> 1725 | K40: =IF(RC1="","",VLOOKUP(RC1,ReportedDump,R8C+2,FALSE)) -> 1611 | L40: =IF(RC1="","",VLOOKUP(RC1,ReportedDump,R8C+2,FALSE)) -> 455 | M40: =IF(RC1="","",VLOOKUP(RC1,ReportedDump,R8C+2,FALSE)) -> 881 | N40: =IF(RC1="","",VLOOKUP(RC1,ReportedDump,R8C+2,FALSE)) -> 679 | O40: =IF(RC1="","",VLOOKUP(RC1,ReportedDump,R8C+2,FALSE)) -> 64 | P40: =IF(RC1="","",VLOOKUP(RC1,ReportedDump,R8C+2,FALSE)) -> 28 | Q40: =IF(RC1="","",VLOOKUP(RC1,ReportedDump,R8C+2,FALSE)) -> 0 | R40: =IF(RC1="","",VLOOKUP(RC1,ReportedDump,R8C+2,FALSE)) -> 0 | S40: =IF(RC1="","",VLOOKUP(RC1,ReportedDump,R8C+2,FALSE)) -> 0 | T40: =IF(RC1="","",VLOOKUP(RC1,ReportedDump,R8C+2,FALSE)) -> 256 | U40: =IF(RC1="","",VLOOKUP(RC1,ReportedDump,R8C+2,FALSE)) -> 108 | V40: =IF(RC1="","",VLOOKUP(RC1,ReportedDump,R8C+2,FALSE)) -> 70 | W40: =IF(RC1="","",VLOOKUP(RC1,ReportedDump,R8C+2,FALSE)) -> 0 | X40: =IF(RC1="","",VLOOKUP(RC1,ReportedDump,R8C+2,FALSE)) -> 0 | Y40: =IF(RC1="","",VLOOKUP(RC1,ReportedDump,R8C+2,FALSE)) -> 0 | Z40: =IF(RC1="","",VLOOKUP(RC1,ReportedDump,R8C+2,FALSE)) -> 0 | AA40: =IF(RC1="","",VLOOKUP(RC1,ReportedDump,R8C+2,FALSE)) -> 0 | AB40: =IF(RC1="","",VLOOKUP(RC1,ReportedDump,R8C+2,FALSE)) -> 0 | AC40: =IF(RC1="","",VLOOKUP(RC1,ReportedDump,R8C+2,FALSE)) -> 0 | AD40: =IF(RC1="","",VLOOKUP(RC1,ReportedDump,R8C+2,FALSE)) -> 0 | AE40: =IF(RC1="","",VLOOKUP(RC1,ReportedDump,R8C+2,FALSE)) -> 0 | AF40: =IF(RC1="","",VLOOKUP(RC1,ReportedDump,R8C+2,FALSE)) -> 0 | AG40: =IF(RC1="","",VLOOKUP(RC1,ReportedDump,R8C+2,FALSE)) -> 0 | AH40: =IF(RC1="","",VLOOKUP(RC1,ReportedDump,R8C+2,FALSE)) -> 0 | AI40: =IF(RC1="","",VLOOKUP(RC1,ReportedDump,R8C+2,FALSE)) -> 0 | AJ40: =IF(RC1="","",VLOOKUP(RC1,ReportedDump,R8C+2,FALSE)) -> 0 | AK40: =IF(RC1="","",VLOOKUP(RC1,ReportedDump,R8C+2,FALSE)) -> 0 | AL40: =IF(RC1="","",VLOOKUP(RC1,ReportedDump,R8C+2,FALSE)) -> 0 | AM40: =IF(RC1="","",VLOOKUP(RC1,ReportedDump,R8C+2,FALSE)) -> 0 | AN40: =IF(RC1="","",VLOOKUP(RC1,ReportedDump,R8C+2,FALSE)) -> 0 | AO40: =IF(RC1="","",VLOOKUP(RC1,ReportedDump,R8C+2,FALSE)) -> 0
A41: =IF(R[-1]C1="","",IF(DATE(YEAR(R[-1]C),MONTH(R[-1]C)+1,1)>ValDat,"",DATE(YEAR(R[-1]C),MONTH(R[-1]C)+1,1))) -> 2001-04-01T00:00:00.000 | B41: =IF(RC1="","",IF(VLOOKUP(RC1,TrendFacDump,2,FALSE)=0,0,VLOOKUP(EOMONTH(ValDat,-1)+1,TrendFacDump,2,FALSE)/VLOOKUP(RC1,TrendFacDump,2,FALSE))) -> 1.0147133434804667 | C41: =IF(RC1="","",VLOOKUP(RC1,ExpDump,7,FALSE)) -> 2809.8719999999998 | D41: =IF(RC1="","",SUM(RC[2]:RC[37])) -> 122179 | E41: =IF(RC1="","",R[-1]C+RC[1]+R[-1]C[2]+R[-2]C[3]+R[-3]C[4]+R[-4]C[5]+R[-5]C[6]+R[-6]C[7]+R[-7]C[8]+R[-8]C[9]+R[-9]C[10]+R[-10]C[11]+R[-11]C[12]+R[-12]C[13]+R[-13]C[14]+R[-14]C[15]+R[-15]C[16]+R[-16]C[17]+R[-17]C[18]+R[-18]C[19]+R[-19]C[20]+R[-20]C[21]+R[-21]C[22]+R[-22]C[23]+R[-23]C[24]+R[-24]C[25]+R[-25]C[26]+R[-26]C[27]+R[-27]C[28]+R[-28]C[29]+R[-29]C[30]+R[-30]C[31]+R[-31]C[32]+R[-32]C[33]) -> 5646463 | F41: =IF(RC1="","",VLOOKUP(RC1,ReportedDump,R8C+2,FALSE)) -> 1180 | G41: =IF(RC1="","",VLOOKUP(RC1,ReportedDump,R8C+2,FALSE)) -> 33425 | H41: =IF(RC1="","",VLOOKUP(RC1,ReportedDump,R8C+2,FALSE)) -> 35398 | I41: =IF(RC1="","",VLOOKUP(RC1,ReportedDump,R8C+2,FALSE)) -> 24109 | J41: =IF(RC1="","",VLOOKUP(RC1,ReportedDump,R8C+2,FALSE)) -> 7879 | K41: =IF(RC1="","",VLOOKUP(RC1,ReportedDump,R8C+2,FALSE)) -> 9007 | L41: =IF(RC1="","",VLOOKUP(RC1,ReportedDump,R8C+2,FALSE)) -> 1278 | M41: =IF(RC1="","",VLOOKUP(RC1,ReportedDump,R8C+2,FALSE)) -> 1250 | N41: =IF(RC1="","",VLOOKUP(RC1,ReportedDump,R8C+2,FALSE)) -> 572 | O41: =IF(RC1="","",VLOOKUP(RC1,ReportedDump,R8C+2,FALSE)) -> 253 | P41: =IF(RC1="","",VLOOKUP(RC1,ReportedDump,R8C+2,FALSE)) -> 0 | Q41: =IF(RC1="","",VLOOKUP(RC1,ReportedDump,R8C+2,FALSE)) -> 0 | R41: =IF(RC1="","",VLOOKUP(RC1,ReportedDump,R8C+2,FALSE)) -> -247 | S41: =IF(RC1="","",VLOOKUP(RC1,ReportedDump,R8C+2,FALSE)) -> 266 | T41: =IF(RC1="","",VLOOKUP(RC1,ReportedDump,R8C+2,FALSE)) -> 7809 | U41: =IF(RC1="","",VLOOKUP(RC1,ReportedDump,R8C+2,FALSE)) -> 0 | V41: =IF(RC1="","",VLOOKUP(RC1,ReportedDump,R8C+2,FALSE)) -> 0 | W41: =IF(RC1="","",VLOOKUP(RC1,ReportedDump,R8C+2,FALSE)) -> 0 | X41: =IF(RC1="","",VLOOKUP(RC1,ReportedDump,R8C+2,FALSE)) -> 0 | Y41: =IF(RC1="","",VLOOKUP(RC1,ReportedDump,R8C+2,FALSE)) -> 0 | Z41: =IF(RC1="","",VLOOKUP(RC1,ReportedDump,R8C+2,FALSE)) -> 0 | AA41: =IF(RC1="","",VLOOKUP(RC1,ReportedDump,R8C+2,FALSE)) -> 0 | AB41: =IF(RC1="","",VLOOKUP(RC1,ReportedDump,R8C+2,FALSE)) -> 0 | AC41: =IF(RC1="","",VLOOKUP(RC1,ReportedDump,R8C+2,FALSE)) -> 0 | AD41: =IF(RC1="","",VLOOKUP(RC1,ReportedDump,R8C+2,FALSE)) -> 0 | AE41: =IF(RC1="","",VLOOKUP(RC1,ReportedDump,R8C+2,FALSE)) -> 0 | AF41: =IF(RC1="","",VLOOKUP(RC1,ReportedDump,R8C+2,FALSE)) -> 0 | AG41: =IF(RC1="","",VLOOKUP(RC1,ReportedDump,R8C+2,FALSE)) -> 0 | AH41: =IF(RC1="","",VLOOKUP(RC1,ReportedDump,R8C+2,FALSE)) -> 0 | AI41: =IF(RC1="","",VLOOKUP(RC1,ReportedDump,R8C+2,FALSE)) -> 0 | AJ41: =IF(RC1="","",VLOOKUP(RC1,ReportedDump,R8C+2,FALSE)) -> 0 | AK41: =IF(RC1="","",VLOOKUP(RC1,ReportedDump,R8C+2,FALSE)) -> 0 | AL41: =IF(RC1="","",VLOOKUP(RC1,ReportedDump,R8C+2,FALSE)) -> 0 | AM41: =IF(RC1="","",VLOOKUP(RC1,ReportedDump,R8C+2,FALSE)) -> 0 | AN41: =IF(RC1="","",VLOOKUP(RC1,ReportedDump,R8C+2,FALSE)) -> 0 | AO41: =IF(RC1="","",VLOOKUP(RC1,ReportedDump,R8C+2,FALSE)) -> 0
A42: =IF(R[-1]C1="","",IF(DATE(YEAR(R[-1]C),MONTH(R[-1]C)+1,1)>ValDat,"",DATE(YEAR(R[-1]C),MONTH(R[-1]C)+1,1))) -> 2001-05-01T00:00:00.000 | B42: =IF(RC1="","",IF(VLOOKUP(RC1,TrendFacDump,2,FALSE)=0,0,VLOOKUP(EOMONTH(ValDat,-1)+1,TrendFacDump,2,FALSE)/VLOOKUP(RC1,TrendFacDump,2,FALSE))) -> 1.0097950116126426 | C42: =IF(RC1="","",VLOOKUP(RC1,ExpDump,7,FALSE)) -> 2815.6109999999999 | D42: =IF(RC1="","",SUM(RC[2]:RC[37])) -> 122179 | E42: =IF(RC1="","",R[-1]C+RC[1]+R[-1]C[2]+R[-2]C[3]+R[-3]C[4]+R[-4]C[5]+R[-5]C[6]+R[-6]C[7]+R[-7]C[8]+R[-8]C[9]+R[-9]C[10]+R[-10]C[11]+R[-11]C[12]+R[-12]C[13]+R[-13]C[14]+R[-14]C[15]+R[-15]C[16]+R[-16]C[17]+R[-17]C[18]+R[-18]C[19]+R[-19]C[20]+R[-20]C[21]+R[-21]C[22]+R[-22]C[23]+R[-23]C[24]+R[-24]C[25]+R[-25]C[26]+R[-26]C[27]+R[-27]C[28]+R[-28]C[29]+R[-29]C[30]+R[-30]C[31]+R[-31]C[32]+R[-32]C[33]+R[-33]C[34]) -> 5787714 | F42: =IF(RC1="","",VLOOKUP(RC1,ReportedDump,R8C+2,FALSE)) -> 24336 | G42: =IF(RC1="","",VLOOKUP(RC1,ReportedDump,R8C+2,FALSE)) -> 38853 | H42: =IF(RC1="","",VLOOKUP(RC1,ReportedDump,R8C+2,FALSE)) -> 23133 | I42: =IF(RC1="","",VLOOKUP(RC1,ReportedDump,R8C+2,FALSE)) -> 13306 | J42: =IF(RC1="","",VLOOKUP(RC1,ReportedDump,R8C+2,FALSE)) -> 5789 | K42: =IF(RC1="","",VLOOKUP(RC1,ReportedDump,R8C+2,FALSE)) -> 5946 | L42: =IF(RC1="","",VLOOKUP(RC1,ReportedDump,R8C+2,FALSE)) -> 1041 | M42: =IF(RC1="","",VLOOKUP(RC1,ReportedDump,R8C+2,FALSE)) -> 1381 | N42: =IF(RC1="","",VLOOKUP(RC1,ReportedDump,R8C+2,FALSE)) -> 313 | O42: =IF(RC1="","",VLOOKUP(RC1,ReportedDump,R8C+2,FALSE)) -> 253 | P42: =IF(RC1="","",VLOOKUP(RC1,ReportedDump,R8C+2,FALSE)) -> 0 | Q42: =IF(RC1="","",VLOOKUP(RC1,ReportedDump,R8C+2,FALSE)) -> 0 | R42: =IF(RC1="","",VLOOKUP(RC1,ReportedDump,R8C+2,FALSE)) -> -247 | S42: =IF(RC1="","",VLOOKUP(RC1,ReportedDump,R8C+2,FALSE)) -> 266 | T42: =IF(RC1="","",VLOOKUP(RC1,ReportedDump,R8C+2,FALSE)) -> 7809 | U42: =IF(RC1="","",VLOOKUP(RC1,ReportedDump,R8C+2,FALSE)) -> 0 | V42: =IF(RC1="","",VLOOKUP(RC1,ReportedDump,R8C+2,FALSE)) -> 0 | W42: =IF(RC1="","",VLOOKUP(RC1,ReportedDump,R8C+2,FALSE)) -> 0 | X42: =IF(RC1="","",VLOOKUP(RC1,ReportedDump,R8C+2,FALSE)) -> 0 | Y42: =IF(RC1="","",VLOOKUP(RC1,ReportedDump,R8C+2,FALSE)) -> 0 | Z42: =IF(RC1="","",VLOOKUP(RC1,ReportedDump,R8C+2,FALSE)) -> 0 | AA42: =IF(RC1="","",VLOOKUP(RC1,ReportedDump,R8C+2,FALSE)) -> 0 | AB42: =IF(RC1="","",VLOOKUP(RC1,ReportedDump,R8C+2,FALSE)) -> 0 | AC42: =IF(RC1="","",VLOOKUP(RC1,ReportedDump,R8C+2,FALSE)) -> 0 | AD42: =IF(RC1="","",VLOOKUP(RC1,ReportedDump,R8C+2,FALSE)) -> 0 | AE42: =IF(RC1="","",VLOOKUP(RC1,ReportedDump,R8C+2,FALSE)) -> 0 | AF42: =IF(RC1="","",VLOOKUP(RC1,ReportedDump,R8C+2,FALSE)) -> 0 | AG42: =IF(RC1="","",VLOOKUP(RC1,ReportedDump,R8C+2,FALSE)) -> 0 | AH42: =IF(RC1="","",VLOOKUP(RC1,ReportedDump,R8C+2,FALSE)) -> 0 | AI42: =IF(RC1="","",VLOOKUP(RC1,ReportedDump,R8C+2,FALSE)) -> 0 | AJ42: =IF(RC1="","",VLOOKUP(RC1,ReportedDump,R8C+2,FALSE)) -> 0 | AK42: =IF(RC1="","",VLOOKUP(RC1,ReportedDump,R8C+2,FALSE)) -> 0 | AL42: =IF(RC1="","",VLOOKUP(RC1,ReportedDump,R8C+2,FALSE)) -> 0 | AM42: =IF(RC1="","",VLOOKUP(RC1,ReportedDump,R8C+2,FALSE)) -> 0 | AN42: =IF(RC1="","",VLOOKUP(RC1,ReportedDump,R8C+2,FALSE)) -> 0 | AO42: =IF(RC1="","",VLOOKUP(RC1,ReportedDump,R8C+2,FALSE)) -> 0
A43: =IF(R[-1]C1="","",IF(DATE(YEAR(R[-1]C),MONTH(R[-1]C)+1,1)>ValDat,"",DATE(YEAR(R[-1]C),MONTH(R[-1]C)+1,1))) -> 2001-06-01T00:00:00.000 | B43: =IF(RC1="","",IF(VLOOKUP(RC1,TrendFacDump,2,FALSE)=0,0,VLOOKUP(EOMONTH(ValDat,-1)+1,TrendFacDump,2,FALSE)/VLOOKUP(RC1,TrendFacDump,2,FALSE))) -> 1.004823151125402 | C43: =IF(RC1="","",VLOOKUP(RC1,ExpDump,7,FALSE)) -> 2810.5160000000001 | D43: =IF(RC1="","",SUM(RC[2]:RC[37])) -> 0 | E43: =IF(RC1="","",R[-1]C+RC[1]+R[-1]C[2]+R[-2]C[3]+R[-3]C[4]+R[-4]C[5]+R[-5]C[6]+R[-6]C[7]+R[-7]C[8]+R[-8]C[9]+R[-9]C[10]+R[-10]C[11]+R[-11]C[12]+R[-12]C[13]+R[-13]C[14]+R[-14]C[15]+R[-15]C[16]+R[-16]C[17]+R[-17]C[18]+R[-18]C[19]+R[-19]C[20]+R[-20]C[21]+R[-21]C[22]+R[-22]C[23]+R[-23]C[24]+R[-24]C[25]+R[-25]C[26]+R[-26]C[27]+R[-27]C[28]+R[-28]C[29]+R[-29]C[30]+R[-30]C[31]+R[-31]C[32]+R[-32]C[33]+R[-33]C[34]+R[-34]C[35]) -> 5962791 | F43: =IF(RC1="","",VLOOKUP(RC1,ReportedDump,R8C+2,FALSE)) -> 0 | G43: =IF(RC1="","",VLOOKUP(RC1,ReportedDump,R8C+2,FALSE)) -> 0 | H43: =IF(RC1="","",VLOOKUP(RC1,ReportedDump,R8C+2,FALSE)) -> 0 | I43: =IF(RC1="","",VLOOKUP(RC1,ReportedDump,R8C+2,FALSE)) -> 0 | J43: =IF(RC1="","",VLOOKUP(RC1,ReportedDump,R8C+2,FALSE)) -> 0 | K43: =IF(RC1="","",VLOOKUP(RC1,ReportedDump,R8C+2,FALSE)) -> 0 | L43: =IF(RC1="","",VLOOKUP(RC1,ReportedDump,R8C+2,FALSE)) -> 0 | M43: =IF(RC1="","",VLOOKUP(RC1,ReportedDump,R8C+2,FALSE)) -> 0 | N43: =IF(RC1="","",VLOOKUP(RC1,ReportedDump,R8C+2,FALSE)) -> 0 | O43: =IF(RC1="","",VLOOKUP(RC1,ReportedDump,R8C+2,FALSE)) -> 0 | P43: =IF(RC1="","",VLOOKUP(RC1,ReportedDump,R8C+2,FALSE)) -> 0 | Q43: =IF(RC1="","",VLOOKUP(RC1,ReportedDump,R8C+2,FALSE)) -> 0 | R43: =IF(RC1="","",VLOOKUP(RC1,ReportedDump,R8C+2,FALSE)) -> 0 | S43: =IF(RC1="","",VLOOKUP(RC1,ReportedDump,R8C+2,FALSE)) -> 0 | T43: =IF(RC1="","",VLOOKUP(RC1,ReportedDump,R8C+2,FALSE)) -> 0 | U43: =IF(RC1="","",VLOOKUP(RC1,ReportedDump,R8C+2,FALSE)) -> 0 | V43: =IF(RC1="","",VLOOKUP(RC1,ReportedDump,R8C+2,FALSE)) -> 0 | W43: =IF(RC1="","",VLOOKUP(RC1,ReportedDump,R8C+2,FALSE)) -> 0 | X43: =IF(RC1="","",VLOOKUP(RC1,ReportedDump,R8C+2,FALSE)) -> 0 | Y43: =IF(RC1="","",VLOOKUP(RC1,ReportedDump,R8C+2,FALSE)) -> 0 | Z43: =IF(RC1="","",VLOOKUP(RC1,ReportedDump,R8C+2,FALSE)) -> 0 | AA43: =IF(RC1="","",VLOOKUP(RC1,ReportedDump,R8C+2,FALSE)) -> 0 | AB43: =IF(RC1="","",VLOOKUP(RC1,ReportedDump,R8C+2,FALSE)) -> 0 | AC43: =IF(RC1="","",VLOOKUP(RC1,ReportedDump,R8C+2,FALSE)) -> 0 | AD43: =IF(RC1="","",VLOOKUP(RC1,ReportedDump,R8C+2,FALSE)) -> 0 | AE43: =IF(RC1="","",VLOOKUP(RC1,ReportedDump,R8C+2,FALSE)) -> 0 | AF43: =IF(RC1="","",VLOOKUP(RC1,ReportedDump,R8C+2,FALSE)) -> 0 | AG43: =IF(RC1="","",VLOOKUP(RC1,ReportedDump,R8C+2,FALSE)) -> 0 | AH43: =IF(RC1="","",VLOOKUP(RC1,ReportedDump,R8C+2,FALSE)) -> 0 | AI43: =IF(RC1="","",VLOOKUP(RC1,ReportedDump,R8C+2,FALSE)) -> 0 | AJ43: =IF(RC1="","",VLOOKUP(RC1,ReportedDump,R8C+2,FALSE)) -> 0 | AK43: =IF(RC1="","",VLOOKUP(RC1,ReportedDump,R8C+2,FALSE)) -> 0 | AL43: =IF(RC1="","",VLOOKUP(RC1,ReportedDump,R8C+2,FALSE)) -> 0 | AM43: =IF(RC1="","",VLOOKUP(RC1,ReportedDump,R8C+2,FALSE)) -> 0 | AN43: =IF(RC1="","",VLOOKUP(RC1,ReportedDump,R8C+2,FALSE)) -> 0 | AO43: =IF(RC1="","",VLOOKUP(RC1,ReportedDump,R8C+2,FALSE)) -> 0
A44: =IF(R[-1]C1="","",IF(DATE(YEAR(R[-1]C),MONTH(R[-1]C)+1,1)>ValDat,"",DATE(YEAR(R[-1]C),MONTH(R[-1]C)+1,1))) -> 2001-07-01T00:00:00.000 | B44: =IF(RC1="","",IF(VLOOKUP(RC1,TrendFacDump,2,FALSE)=0,0,VLOOKUP(EOMONTH(ValDat,-1)+1,TrendFacDump,2,FALSE)/VLOOKUP(RC1,TrendFacDump,2,FALSE))) -> 1 | C44: =IF(RC1="","",VLOOKUP(RC1,ExpDump,7,FALSE)) -> 2830.0740000000001 | D44: =IF(RC1="","",SUM(RC[2]:RC[37])) -> 0 | E44: =IF(RC1="","",R[-1]C+RC[1]+R[-1]C[2]+R[-2]C[3]+R[-3]C[4]+R[-4]C[5]+R[-5]C[6]+R[-6]C[7]+R[-7]C[8]+R[-8]C[9]+R[-9]C[10]+R[-10]C[11]+R[-11]C[12]+R[-12]C[13]+R[-13]C[14]+R[-14]C[15]+R[-15]C[16]+R[-16]C[17]+R[-17]C[18]+R[-18]C[19]+R[-19]C[20]+R[-20]C[21]+R[-21]C[22]+R[-22]C[23]+R[-23]C[24]+R[-24]C[25]+R[-25]C[26]+R[-26]C[27]+R[-27]C[28]+R[-28]C[29]+R[-29]C[30]+R[-30]C[31]+R[-31]C[32]+R[-32]C[33]+R[-33]C[34]+R[-34]C[35]+R[-35]C[36]) -> 6020883 | F44: =IF(RC1="","",VLOOKUP(RC1,ReportedDump,R8C+2,FALSE)) -> 0 | G44: =IF(RC1="","",VLOOKUP(RC1,ReportedDump,R8C+2,FALSE)) -> 0 | H44: =IF(RC1="","",VLOOKUP(RC1,ReportedDump,R8C+2,FALSE)) -> 0 | I44: =IF(RC1="","",VLOOKUP(RC1,ReportedDump,R8C+2,FALSE)) -> 0 | J44: =IF(RC1="","",VLOOKUP(RC1,ReportedDump,R8C+2,FALSE)) -> 0 | K44: =IF(RC1="","",VLOOKUP(RC1,ReportedDump,R8C+2,FALSE)) -> 0 | L44: =IF(RC1="","",VLOOKUP(RC1,ReportedDump,R8C+2,FALSE)) -> 0 | M44: =IF(RC1="","",VLOOKUP(RC1,ReportedDump,R8C+2,FALSE)) -> 0 | N44: =IF(RC1="","",VLOOKUP(RC1,ReportedDump,R8C+2,FALSE)) -> 0 | O44: =IF(RC1="","",VLOOKUP(RC1,ReportedDump,R8C+2,FALSE)) -> 0 | P44: =IF(RC1="","",VLOOKUP(RC1,ReportedDump,R8C+2,FALSE)) -> 0 | Q44: =IF(RC1="","",VLOOKUP(RC1,ReportedDump,R8C+2,FALSE)) -> 0 | R44: =IF(RC1="","",VLOOKUP(RC1,ReportedDump,R8C+2,FALSE)) -> 0 | S44: =IF(RC1="","",VLOOKUP(RC1,ReportedDump,R8C+2,FALSE)) -> 0 | T44: =IF(RC1="","",VLOOKUP(RC1,ReportedDump,R8C+2,FALSE)) -> 0 | U44: =IF(RC1="","",VLOOKUP(RC1,ReportedDump,R8C+2,FALSE)) -> 0 | V44: =IF(RC1="","",VLOOKUP(RC1,ReportedDump,R8C+2,FALSE)) -> 0 | W44: =IF(RC1="","",VLOOKUP(RC1,ReportedDump,R8C+2,FALSE)) -> 0 | X44: =IF(RC1="","",VLOOKUP(RC1,ReportedDump,R8C+2,FALSE)) -> 0 | Y44: =IF(RC1="","",VLOOKUP(RC1,ReportedDump,R8C+2,FALSE)) -> 0 | Z44: =IF(RC1="","",VLOOKUP(RC1,ReportedDump,R8C+2,FALSE)) -> 0 | AA44: =IF(RC1="","",VLOOKUP(RC1,ReportedDump,R8C+2,FALSE)) -> 0 | AB44: =IF(RC1="","",VLOOKUP(RC1,ReportedDump,R8C+2,FALSE)) -> 0 | AC44: =IF(RC1="","",VLOOKUP(RC1,ReportedDump,R8C+2,FALSE)) -> 0 | AD44: =IF(RC1="","",VLOOKUP(RC1,ReportedDump,R8C+2,FALSE)) -> 0 | AE44: =IF(RC1="","",VLOOKUP(RC1,ReportedDump,R8C+2,FALSE)) -> 0 | AF44: =IF(RC1="","",VLOOKUP(RC1,ReportedDump,R8C+2,FALSE)) -> 0 | AG44: =IF(RC1="","",VLOOKUP(RC1,ReportedDump,R8C+2,FALSE)) -> 0 | AH44: =IF(RC1="","",VLOOKUP(RC1,ReportedDump,R8C+2,FALSE)) -> 0 | AI44: =IF(RC1="","",VLOOKUP(RC1,ReportedDump,R8C+2,FALSE)) -> 0 | AJ44: =IF(RC1="","",VLOOKUP(RC1,ReportedDump,R8C+2,FALSE)) -> 0 | AK44: =IF(RC1="","",VLOOKUP(RC1,ReportedDump,R8C+2,FALSE)) -> 0 | AL44: =IF(RC1="","",VLOOKUP(RC1,ReportedDump,R8C+2,FALSE)) -> 0 | AM44: =IF(RC1="","",VLOOKUP(RC1,ReportedDump,R8C+2,FALSE)) -> 0 | AN44: =IF(RC1="","",VLOOKUP(RC1,ReportedDump,R8C+2,FALSE)) -> 0 | AO44: =IF(RC1="","",VLOOKUP(RC1,ReportedDump,R8C+2,FALSE)) -> 0
C45: =SUM(R[-36]C:R[-1]C) -> 104079.17000000001 | D45: =SUM(R[-36]C:R[-1]C) -> 6121426 | F45: =SUM(R[-36]C:R[-1]C) -> 821679 | G45: =SUM(R[-36]C:R[-1]C) -> 2343762 | H45: =SUM(R[-36]C:R[-1]C) -> 1264074 | I45: =SUM(R[-36]C:R[-1]C) -> 955052 | J45: =SUM(R[-36]C:R[-1]C) -> 318112 | K45: =SUM(R[-36]C:R[-1]C) -> 138511 | L45: =SUM(R[-36]C:R[-1]C) -> 95965 | M45: =SUM(R[-36]C:R[-1]C) -> 99499 | N45: =SUM(R[-36]C:R[-1]C) -> 19159 | O45: =SUM(R[-36]C:R[-1]C) -> 8094 | P45: =SUM(R[-36]C:R[-1]C) -> 3668 | Q45: =SUM(R[-36]C:R[-1]C) -> 12616 | R45: =SUM(R[-36]C:R[-1]C) -> 7544 | S45: =SUM(R[-36]C:R[-1]C) -> 6155 | T45: =SUM(R[-36]C:R[-1]C) -> 19814 | U45: =SUM(R[-36]C:R[-1]C) -> 3157 | V45: =SUM(R[-36]C:R[-1]C) -> 1433 | W45: =SUM(R[-36]C:R[-1]C) -> 2630 | X45: =SUM(R[-36]C:R[-1]C) -> 150 | Y45: =SUM(R[-36]C:R[-1]C) -> 352 | Z45: =SUM(R[-36]C:R[-1]C) -> 0 | AA45: =SUM(R[-36]C:R[-1]C) -> 0 | AB45: =SUM(R[-36]C:R[-1]C) -> 0 | AC45: =SUM(R[-36]C:R[-1]C) -> 0 | AD45: =SUM(R[-36]C:R[-1]C) -> 0 | AE45: =SUM(R[-36]C:R[-1]C) -> 0 | AF45: =SUM(R[-36]C:R[-1]C) -> 0 | AG45: =SUM(R[-36]C:R[-1]C) -> 0 | AH45: =SUM(R[-36]C:R[-1]C) -> 0 | AI45: =SUM(R[-36]C:R[-1]C) -> 0 | AJ45: =SUM(R[-36]C:R[-1]C) -> 0 | AK45: =SUM(R[-36]C:R[-1]C) -> 0 | AL45: =SUM(R[-36]C:R[-1]C) -> 0 | AM45: =SUM(R[-36]C:R[-1]C) -> 0 | AN45: =SUM(R[-36]C:R[-1]C) -> 0 | AO45: =SUM(R[-36]C:R[-1]C) -> 0
F47: Completion Factor Development Based on the Last k Months of Data For Each Lag Month Column
E48: k = | F48: =MCF -> 4 | G48: =RC[-1] -> 4 | H48: =RC[-1] -> 4 | I48: =RC[-1] -> 4 | J48: =RC[-1] -> 4 | K48: =RC[-1] -> 4 | L48: =RC[-1] -> 4 | M48: =RC[-1] -> 4 | N48: =RC[-1] -> 4 | O48: =RC[-1] -> 4 | P48: =RC[-1] -> 4 | Q48: =RC[-1] -> 4 | R48: =RC[-1] -> 4 | S48: =RC[-1] -> 4 | T48: =RC[-1] -> 4 | U48: =RC[-1] -> 4 | V48: =RC[-1] -> 4 | W48: =RC[-1] -> 4 | X48: =RC[-1] -> 4 | Y48: =RC[-1] -> 4 | Z48: =RC[-1] -> 4 | AA48: =RC[-1] -> 4 | AB48: =RC[-1] -> 4 | AC48: =RC[-1] -> 4 | AD48: =RC[-1] -> 4 | AE48: =RC[-1] -> 4 | AF48: =RC[-1] -> 4 | AG48: =RC[-1] -> 4 | AH48: =RC[-1] -> 4 | AI48: =RC[-1] -> 4 | AJ48: =RC[-1] -> 4 | AK48: =RC[-1] -> 4 | AL48: =RC[-1] -> 4 | AM48: =RC[-1] -> 4 | AN48: =RC[-1] -> 4 | AO48: =RC[-1] -> 4
A49: A. Claims …………………………………………… | E49: =SUM(RC[1]:RC[36]) -> 488690 | F49: =IF(R8C>MEP-1,0,SUM(OFFSET(R[-4]C,MAX(-R[-1]C-(ABS(R[-41]C-MRO)+(R[-41]C-MRO))/2,-MEP)-(MNR-MEP),0,MIN(R[-1]C,MEP-R[-41]C),1))) -> 25516 | G49: =IF(R8C>MEP-1,0,SUM(OFFSET(R[-4]C,MAX(-R[-1]C-(ABS(R[-41]C-MRO)+(R[-41]C-MRO))/2,-MEP)-(MNR-MEP),0,MIN(R[-1]C,MEP-R[-41]C),1))) -> 123725 | H49: =IF(R8C>MEP-1,0,SUM(OFFSET(R[-4]C,MAX(-R[-1]C-(ABS(R[-41]C-MRO)+(R[-41]C-MRO))/2,-MEP)-(MNR-MEP),0,MIN(R[-1]C,MEP-R[-41]C),1))) -> 112516 | I49: =IF(R8C>MEP-1,0,SUM(OFFSET(R[-4]C,MAX(-R[-1]C-(ABS(R[-41]C-MRO)+(R[-41]C-MRO))/2,-MEP)-(MNR-MEP),0,MIN(R[-1]C,MEP-R[-41]C),1))) -> 140298 | J49: =IF(R8C>MEP-1,0,SUM(OFFSET(R[-4]C,MAX(-R[-1]C-(ABS(R[-41]C-MRO)+(R[-41]C-MRO))/2,-MEP)-(MNR-MEP),0,MIN(R[-1]C,MEP-R[-41]C),1))) -> 34295 | K49: =IF(R8C>MEP-1,0,SUM(OFFSET(R[-4]C,MAX(-R[-1]C-(ABS(R[-41]C-MRO)+(R[-41]C-MRO))/2,-MEP)-(MNR-MEP),0,MIN(R[-1]C,MEP-R[-41]C),1))) -> 14704 | L49: =IF(R8C>MEP-1,0,SUM(OFFSET(R[-4]C,MAX(-R[-1]C-(ABS(R[-41]C-MRO)+(R[-41]C-MRO))/2,-MEP)-(MNR-MEP),0,MIN(R[-1]C,MEP-R[-41]C),1))) -> 15619 | M49: =IF(R8C>MEP-1,0,SUM(OFFSET(R[-4]C,MAX(-R[-1]C-(ABS(R[-41]C-MRO)+(R[-41]C-MRO))/2,-MEP)-(MNR-MEP),0,MIN(R[-1]C,MEP-R[-41]C),1))) -> 14313 | N49: =IF(R8C>MEP-1,0,SUM(OFFSET(R[-4]C,MAX(-R[-1]C-(ABS(R[-41]C-MRO)+(R[-41]C-MRO))/2,-MEP)-(MNR-MEP),0,MIN(R[-1]C,MEP-R[-41]C),1))) -> 3116 | O49: =IF(R8C>MEP-1,0,SUM(OFFSET(R[-4]C,MAX(-R[-1]C-(ABS(R[-41]C-MRO)+(R[-41]C-MRO))/2,-MEP)-(MNR-MEP),0,MIN(R[-1]C,MEP-R[-41]C),1))) -> 601 | P49: =IF(R8C>MEP-1,0,SUM(OFFSET(R[-4]C,MAX(-R[-1]C-(ABS(R[-41]C-MRO)+(R[-41]C-MRO))/2,-MEP)-(MNR-MEP),0,MIN(R[-1]C,MEP-R[-41]C),1))) -> 730 | Q49: =IF(R8C>MEP-1,0,SUM(OFFSET(R[-4]C,MAX(-R[-1]C-(ABS(R[-41]C-MRO)+(R[-41]C-MRO))/2,-MEP)-(MNR-MEP),0,MIN(R[-1]C,MEP-R[-41]C),1))) -> 796 | R49: =IF(R8C>MEP-1,0,SUM(OFFSET(R[-4]C,MAX(-R[-1]C-(ABS(R[-41]C-MRO)+(R[-41]C-MRO))/2,-MEP)-(MNR-MEP),0,MIN(R[-1]C,MEP-R[-41]C),1))) -> 0 | S49: =IF(R8C>MEP-1,0,SUM(OFFSET(R[-4]C,MAX(-R[-1]C-(ABS(R[-41]C-MRO)+(R[-41]C-MRO))/2,-MEP)-(MNR-MEP),0,MIN(R[-1]C,MEP-R[-41]C),1))) -> 0 | T49: =IF(R8C>MEP-1,0,SUM(OFFSET(R[-4]C,MAX(-R[-1]C-(ABS(R[-41]C-MRO)+(R[-41]C-MRO))/2,-MEP)-(MNR-MEP),0,MIN(R[-1]C,MEP-R[-41]C),1))) -> 0 | U49: =IF(R8C>MEP-1,0,SUM(OFFSET(R[-4]C,MAX(-R[-1]C-(ABS(R[-41]C-MRO)+(R[-41]C-MRO))/2,-MEP)-(MNR-MEP),0,MIN(R[-1]C,MEP-R[-41]C),1))) -> 1855 | V49: =IF(R8C>MEP-1,0,SUM(OFFSET(R[-4]C,MAX(-R[-1]C-(ABS(R[-41]C-MRO)+(R[-41]C-MRO))/2,-MEP)-(MNR-MEP),0,MIN(R[-1]C,MEP-R[-41]C),1))) -> 438 | W49: =IF(R8C>MEP-1,0,SUM(OFFSET(R[-4]C,MAX(-R[-1]C-(ABS(R[-41]C-MRO)+(R[-41]C-MRO))/2,-MEP)-(MNR-MEP),0,MIN(R[-1]C,MEP-R[-41]C),1))) -> 168 | X49: =IF(R8C>MEP-1,0,SUM(OFFSET(R[-4]C,MAX(-R[-1]C-(ABS(R[-41]C-MRO)+(R[-41]C-MRO))/2,-MEP)-(MNR-MEP),0,MIN(R[-1]C,MEP-R[-41]C),1))) -> 0 | Y49: =IF(R8C>MEP-1,0,SUM(OFFSET(R[-4]C,MAX(-R[-1]C-(ABS(R[-41]C-MRO)+(R[-41]C-MRO))/2,-MEP)-(MNR-MEP),0,MIN(R[-1]C,MEP-R[-41]C),1))) -> 0 | Z49: =IF(R8C>MEP-1,0,SUM(OFFSET(R[-4]C,MAX(-R[-1]C-(ABS(R[-41]C-MRO)+(R[-41]C-MRO))/2,-MEP)-(MNR-MEP),0,MIN(R[-1]C,MEP-R[-41]C),1))) -> 0 | AA49: =IF(R8C>MEP-1,0,SUM(OFFSET(R[-4]C,MAX(-R[-1]C-(ABS(R[-41]C-MRO)+(R[-41]C-MRO))/2,-MEP)-(MNR-MEP),0,MIN(R[-1]C,MEP-R[-41]C),1))) -> 0 | AB49: =IF(R8C>MEP-1,0,SUM(OFFSET(R[-4]C,MAX(-R[-1]C-(ABS(R[-41]C-MRO)+(R[-41]C-MRO))/2,-MEP)-(MNR-MEP),0,MIN(R[-1]C,MEP-R[-41]C),1))) -> 0 | AC49: =IF(R8C>MEP-1,0,SUM(OFFSET(R[-4]C,MAX(-R[-1]C-(ABS(R[-41]C-MRO)+(R[-41]C-MRO))/2,-MEP)-(MNR-MEP),0,MIN(R[-1]C,MEP-R[-41]C),1))) -> 0 | AD49: =IF(R8C>MEP-1,0,SUM(OFFSET(R[-4]C,MAX(-R[-1]C-(ABS(R[-41]C-MRO)+(R[-41]C-MRO))/2,-MEP)-(MNR-MEP),0,MIN(R[-1]C,MEP-R[-41]C),1))) -> 0 | AE49: =IF(R8C>MEP-1,0,SUM(OFFSET(R[-4]C,MAX(-R[-1]C-(ABS(R[-41]C-MRO)+(R[-41]C-MRO))/2,-MEP)-(MNR-MEP),0,MIN(R[-1]C,MEP-R[-41]C),1))) -> 0 | AF49: =IF(R8C>MEP-1,0,SUM(OFFSET(R[-4]C,MAX(-R[-1]C-(ABS(R[-41]C-MRO)+(R[-41]C-MRO))/2,-MEP)-(MNR-MEP),0,MIN(R[-1]C,MEP-R[-41]C),1))) -> 0 | AG49: =IF(R8C>MEP-1,0,SUM(OFFSET(R[-4]C,MAX(-R[-1]C-(ABS(R[-41]C-MRO)+(R[-41]C-MRO))/2,-MEP)-(MNR-MEP),0,MIN(R[-1]C,MEP-R[-41]C),1))) -> 0 | AH49: =IF(R8C>MEP-1,0,SUM(OFFSET(R[-4]C,MAX(-R[-1]C-(ABS(R[-41]C-MRO)+(R[-41]C-MRO))/2,-MEP)-(MNR-MEP),0,MIN(R[-1]C,MEP-R[-41]C),1))) -> 0 | AI49: =IF(R8C>MEP-1,0,SUM(OFFSET(R[-4]C,MAX(-R[-1]C-(ABS(R[-41]C-MRO)+(R[-41]C-MRO))/2,-MEP)-(MNR-MEP),0,MIN(R[-1]C,MEP-R[-41]C),1))) -> 0 | AJ49: =IF(R8C>MEP-1,0,SUM(OFFSET(R[-4]C,MAX(-R[-1]C-(ABS(R[-41]C-MRO)+(R[-41]C-MRO))/2,-MEP)-(MNR-MEP),0,MIN(R[-1]C,MEP-R[-41]C),1))) -> 0 | AK49: =IF(R8C>MEP-1,0,SUM(OFFSET(R[-4]C,MAX(-R[-1]C-(ABS(R[-41]C-MRO)+(R[-41]C-MRO))/2,-MEP)-(MNR-MEP),0,MIN(R[-1]C,MEP-R[-41]C),1))) -> 0 | AL49: =IF(R8C>MEP-1,0,SUM(OFFSET(R[-4]C,MAX(-R[-1]C-(ABS(R[-41]C-MRO)+(R[-41]C-MRO))/2,-MEP)-(MNR-MEP),0,MIN(R[-1]C,MEP-R[-41]C),1))) -> 0 | AM49: =IF(R8C>MEP-1,0,SUM(OFFSET(R[-4]C,MAX(-R[-1]C-(ABS(R[-41]C-MRO)+(R[-41]C-MRO))/2,-MEP)-(MNR-MEP),0,MIN(R[-1]C,MEP-R[-41]C),1))) -> 0 | AN49: =IF(R8C>MEP-1,0,SUM(OFFSET(R[-4]C,MAX(-R[-1]C-(ABS(R[-41]C-MRO)+(R[-41]C-MRO))/2,-MEP)-(MNR-MEP),0,MIN(R[-1]C,MEP-R[-41]C),1))) -> 0 | AO49: =IF(R8C>MEP-1,0,SUM(OFFSET(R[-4]C,MAX(-R[-1]C-(ABS(R[-41]C-MRO)+(R[-41]C-MRO))/2,-MEP)-(MNR-MEP),0,MIN(R[-1]C,MEP-R[-41]C),1))) -> 0
A50: B. Trended Claims ………………………………… | E50: =SUM(RC[1]:RC[36]) -> 498816.54370201897 | F50: =IF(R8C>MEP-1,0,SUMPRODUCT(OFFSET(R[-5]C,MAX(-R[-2]C-(ABS(R[-42]C-MRO)+(R[-42]C-MRO))/2,-MEP)-(MNR-MEP),0,MIN(R[-2]C,MEP-R[-42]C),1),OFFSET(R[-5]C2,MAX(-R[-2]C-(ABS(R[-42]C-MRO)+(R[-42]C-MRO))/2,-MEP)-(MNR-MEP),0,MIN(R[-2]C,MEP-R[-42]C),1))) -> 25771.733147912219 | G50: =IF(R8C>MEP-1,0,SUMPRODUCT(OFFSET(R[-5]C,MAX(-R[-2]C-(ABS(R[-42]C-MRO)+(R[-42]C-MRO))/2,-MEP)-(MNR-MEP),0,MIN(R[-2]C,MEP-R[-42]C),1),OFFSET(R[-5]C2,MAX(-R[-2]C-(ABS(R[-42]C-MRO)+(R[-42]C-MRO))/2,-MEP)-(MNR-MEP),0,MIN(R[-2]C,MEP-R[-42]C),1))) -> 125604.47817848064 | H50: =IF(R8C>MEP-1,0,SUMPRODUCT(OFFSET(R[-5]C,MAX(-R[-2]C-(ABS(R[-42]C-MRO)+(R[-42]C-MRO))/2,-MEP)-(MNR-MEP),0,MIN(R[-2]C,MEP-R[-42]C),1),OFFSET(R[-5]C2,MAX(-R[-2]C-(ABS(R[-42]C-MRO)+(R[-42]C-MRO))/2,-MEP)-(MNR-MEP),0,MIN(R[-2]C,MEP-R[-42]C),1))) -> 114509.71926926728 | I50: =IF(R8C>MEP-1,0,SUMPRODUCT(OFFSET(R[-5]C,MAX(-R[-2]C-(ABS(R[-42]C-MRO)+(R[-42]C-MRO))/2,-MEP)-(MNR-MEP),0,MIN(R[-2]C,MEP-R[-42]C),1),OFFSET(R[-5]C2,MAX(-R[-2]C-(ABS(R[-42]C-MRO)+(R[-42]C-MRO))/2,-MEP)-(MNR-MEP),0,MIN(R[-2]C,MEP-R[-42]C),1))) -> 143256.31722304481 | J50: =IF(R8C>MEP-1,0,SUMPRODUCT(OFFSET(R[-5]C,MAX(-R[-2]C-(ABS(R[-42]C-MRO)+(R[-42]C-MRO))/2,-MEP)-(MNR-MEP),0,MIN(R[-2]C,MEP-R[-42]C),1),OFFSET(R[-5]C2,MAX(-R[-2]C-(ABS(R[-42]C-MRO)+(R[-42]C-MRO))/2,-MEP)-(MNR-MEP),0,MIN(R[-2]C,MEP-R[-42]C),1))) -> 35168.1382048097 | K50: =IF(R8C>MEP-1,0,SUMPRODUCT(OFFSET(R[-5]C,MAX(-R[-2]C-(ABS(R[-42]C-MRO)+(R[-42]C-MRO))/2,-MEP)-(MNR-MEP),0,MIN(R[-2]C,MEP-R[-42]C),1),OFFSET(R[-5]C2,MAX(-R[-2]C-(ABS(R[-42]C-MRO)+(R[-42]C-MRO))/2,-MEP)-(MNR-MEP),0,MIN(R[-2]C,MEP-R[-42]C),1))) -> 15225.020275508643 | L50: =IF(R8C>MEP-1,0,SUMPRODUCT(OFFSET(R[-5]C,MAX(-R[-2]C-(ABS(R[-42]C-MRO)+(R[-42]C-MRO))/2,-MEP)-(MNR-MEP),0,MIN(R[-2]C,MEP-R[-42]C),1),OFFSET(R[-5]C2,MAX(-R[-2]C-(ABS(R[-42]C-MRO)+(R[-42]C-MRO))/2,-MEP)-(MNR-MEP),0,MIN(R[-2]C,MEP-R[-42]C),1))) -> 16149.067542985897 | M50: =IF(R8C>MEP-1,0,SUMPRODUCT(OFFSET(R[-5]C,MAX(-R[-2]C-(ABS(R[-42]C-MRO)+(R[-42]C-MRO))/2,-MEP)-(MNR-MEP),0,MIN(R[-2]C,MEP-R[-42]C),1),OFFSET(R[-5]C2,MAX(-R[-2]C-(ABS(R[-42]C-MRO)+(R[-42]C-MRO))/2,-MEP)-(MNR-MEP),0,MIN(R[-2]C,MEP-R[-42]C),1))) -> 14933.058336740198 | N50: =IF(R8C>MEP-1,0,SUMPRODUCT(OFFSET(R[-5]C,MAX(-R[-2]C-(ABS(R[-42]C-MRO)+(R[-42]C-MRO))/2,-MEP)-(MNR-MEP),0,MIN(R[-2]C,MEP-R[-42]C),1),OFFSET(R[-5]C2,MAX(-R[-2]C-(ABS(R[-42]C-MRO)+(R[-42]C-MRO))/2,-MEP)-(MNR-MEP),0,MIN(R[-2]C,MEP-R[-42]C),1))) -> 3266.8359252531563 | O50: =IF(R8C>MEP-1,0,SUMPRODUCT(OFFSET(R[-5]C,MAX(-R[-2]C-(ABS(R[-42]C-MRO)+(R[-42]C-MRO))/2,-MEP)-(MNR-MEP),0,MIN(R[-2]C,MEP-R[-42]C),1),OFFSET(R[-5]C2,MAX(-R[-2]C-(ABS(R[-42]C-MRO)+(R[-42]C-MRO))/2,-MEP)-(MNR-MEP),0,MIN(R[-2]C,MEP-R[-42]C),1))) -> 636.43509560982852 | P50: =IF(R8C>MEP-1,0,SUMPRODUCT(OFFSET(R[-5]C,MAX(-R[-2]C-(ABS(R[-42]C-MRO)+(R[-42]C-MRO))/2,-MEP)-(MNR-MEP),0,MIN(R[-2]C,MEP-R[-42]C),1),OFFSET(R[-5]C2,MAX(-R[-2]C-(ABS(R[-42]C-MRO)+(R[-42]C-MRO))/2,-MEP)-(MNR-MEP),0,MIN(R[-2]C,MEP-R[-42]C),1))) -> 773.94233243689087 | Q50: =IF(R8C>MEP-1,0,SUMPRODUCT(OFFSET(R[-5]C,MAX(-R[-2]C-(ABS(R[-42]C-MRO)+(R[-42]C-MRO))/2,-MEP)-(MNR-MEP),0,MIN(R[-2]C,MEP-R[-42]C),1),OFFSET(R[-5]C2,MAX(-R[-2]C-(ABS(R[-42]C-MRO)+(R[-42]C-MRO))/2,-MEP)-(MNR-MEP),0,MIN(R[-2]C,MEP-R[-42]C),1))) -> 846.92390977541208 | R50: =IF(R8C>MEP-1,0,SUMPRODUCT(OFFSET(R[-5]C,MAX(-R[-2]C-(ABS(R[-42]C-MRO)+(R[-42]C-MRO))/2,-MEP)-(MNR-MEP),0,MIN(R[-2]C,MEP-R[-42]C),1),OFFSET(R[-5]C2,MAX(-R[-2]C-(ABS(R[-42]C-MRO)+(R[-42]C-MRO))/2,-MEP)-(MNR-MEP),0,MIN(R[-2]C,MEP-R[-42]C),1))) -> 0 | S50: =IF(R8C>MEP-1,0,SUMPRODUCT(OFFSET(R[-5]C,MAX(-R[-2]C-(ABS(R[-42]C-MRO)+(R[-42]C-MRO))/2,-MEP)-(MNR-MEP),0,MIN(R[-2]C,MEP-R[-42]C),1),OFFSET(R[-5]C2,MAX(-R[-2]C-(ABS(R[-42]C-MRO)+(R[-42]C-MRO))/2,-MEP)-(MNR-MEP),0,MIN(R[-2]C,MEP-R[-42]C),1))) -> 0 | T50: =IF(R8C>MEP-1,0,SUMPRODUCT(OFFSET(R[-5]C,MAX(-R[-2]C-(ABS(R[-42]C-MRO)+(R[-42]C-MRO))/2,-MEP)-(MNR-MEP),0,MIN(R[-2]C,MEP-R[-42]C),1),OFFSET(R[-5]C2,MAX(-R[-2]C-(ABS(R[-42]C-MRO)+(R[-42]C-MRO))/2,-MEP)-(MNR-MEP),0,MIN(R[-2]C,MEP-R[-42]C),1))) -> 0 | U50: =IF(R8C>MEP-1,0,SUMPRODUCT(OFFSET(R[-5]C,MAX(-R[-2]C-(ABS(R[-42]C-MRO)+(R[-42]C-MRO))/2,-MEP)-(MNR-MEP),0,MIN(R[-2]C,MEP-R[-42]C),1),OFFSET(R[-5]C2,MAX(-R[-2]C-(ABS(R[-42]C-MRO)+(R[-42]C-MRO))/2,-MEP)-(MNR-MEP),0,MIN(R[-2]C,MEP-R[-42]C),1))) -> 2011.9232589801634 | V50: =IF(R8C>MEP-1,0,SUMPRODUCT(OFFSET(R[-5]C,MAX(-R[-2]C-(ABS(R[-42]C-MRO)+(R[-42]C-MRO))/2,-MEP)-(MNR-MEP),0,MIN(R[-2]C,MEP-R[-42]C),1),OFFSET(R[-5]C2,MAX(-R[-2]C-(ABS(R[-42]C-MRO)+(R[-42]C-MRO))/2,-MEP)-(MNR-MEP),0,MIN(R[-2]C,MEP-R[-42]C),1))) -> 478.72027416076639 | W50: =IF(R8C>MEP-1,0,SUMPRODUCT(OFFSET(R[-5]C,MAX(-R[-2]C-(ABS(R[-42]C-MRO)+(R[-42]C-MRO))/2,-MEP)-(MNR-MEP),0,MIN(R[-2]C,MEP-R[-42]C),1),OFFSET(R[-5]C2,MAX(-R[-2]C-(ABS(R[-42]C-MRO)+(R[-42]C-MRO))/2,-MEP)-(MNR-MEP),0,MIN(R[-2]C,MEP-R[-42]C),1))) -> 184.23072705340496 | X50: =IF(R8C>MEP-1,0,SUMPRODUCT(OFFSET(R[-5]C,MAX(-R[-2]C-(ABS(R[-42]C-MRO)+(R[-42]C-MRO))/2,-MEP)-(MNR-MEP),0,MIN(R[-2]C,MEP-R[-42]C),1),OFFSET(R[-5]C2,MAX(-R[-2]C-(ABS(R[-42]C-MRO)+(R[-42]C-MRO))/2,-MEP)-(MNR-MEP),0,MIN(R[-2]C,MEP-R[-42]C),1))) -> 0 | Y50: =IF(R8C>MEP-1,0,SUMPRODUCT(OFFSET(R[-5]C,MAX(-R[-2]C-(ABS(R[-42]C-MRO)+(R[-42]C-MRO))/2,-MEP)-(MNR-MEP),0,MIN(R[-2]C,MEP-R[-42]C),1),OFFSET(R[-5]C2,MAX(-R[-2]C-(ABS(R[-42]C-MRO)+(R[-42]C-MRO))/2,-MEP)-(MNR-MEP),0,MIN(R[-2]C,MEP-R[-42]C),1))) -> 0 | Z50: =IF(R8C>MEP-1,0,SUMPRODUCT(OFFSET(R[-5]C,MAX(-R[-2]C-(ABS(R[-42]C-MRO)+(R[-42]C-MRO))/2,-MEP)-(MNR-MEP),0,MIN(R[-2]C,MEP-R[-42]C),1),OFFSET(R[-5]C2,MAX(-R[-2]C-(ABS(R[-42]C-MRO)+(R[-42]C-MRO))/2,-MEP)-(MNR-MEP),0,MIN(R[-2]C,MEP-R[-42]C),1))) -> 0 | AA50: =IF(R8C>MEP-1,0,SUMPRODUCT(OFFSET(R[-5]C,MAX(-R[-2]C-(ABS(R[-42]C-MRO)+(R[-42]C-MRO))/2,-MEP)-(MNR-MEP),0,MIN(R[-2]C,MEP-R[-42]C),1),OFFSET(R[-5]C2,MAX(-R[-2]C-(ABS(R[-42]C-MRO)+(R[-42]C-MRO))/2,-MEP)-(MNR-MEP),0,MIN(R[-2]C,MEP-R[-42]C),1))) -> 0 | AB50: =IF(R8C>MEP-1,0,SUMPRODUCT(OFFSET(R[-5]C,MAX(-R[-2]C-(ABS(R[-42]C-MRO)+(R[-42]C-MRO))/2,-MEP)-(MNR-MEP),0,MIN(R[-2]C,MEP-R[-42]C),1),OFFSET(R[-5]C2,MAX(-R[-2]C-(ABS(R[-42]C-MRO)+(R[-42]C-MRO))/2,-MEP)-(MNR-MEP),0,MIN(R[-2]C,MEP-R[-42]C),1))) -> 0 | AC50: =IF(R8C>MEP-1,0,SUMPRODUCT(OFFSET(R[-5]C,MAX(-R[-2]C-(ABS(R[-42]C-MRO)+(R[-42]C-MRO))/2,-MEP)-(MNR-MEP),0,MIN(R[-2]C,MEP-R[-42]C),1),OFFSET(R[-5]C2,MAX(-R[-2]C-(ABS(R[-42]C-MRO)+(R[-42]C-MRO))/2,-MEP)-(MNR-MEP),0,MIN(R[-2]C,MEP-R[-42]C),1))) -> 0 | AD50: =IF(R8C>MEP-1,0,SUMPRODUCT(OFFSET(R[-5]C,MAX(-R[-2]C-(ABS(R[-42]C-MRO)+(R[-42]C-MRO))/2,-MEP)-(MNR-MEP),0,MIN(R[-2]C,MEP-R[-42]C),1),OFFSET(R[-5]C2,MAX(-R[-2]C-(ABS(R[-42]C-MRO)+(R[-42]C-MRO))/2,-MEP)-(MNR-MEP),0,MIN(R[-2]C,MEP-R[-42]C),1))) -> 0 | AE50: =IF(R8C>MEP-1,0,SUMPRODUCT(OFFSET(R[-5]C,MAX(-R[-2]C-(ABS(R[-42]C-MRO)+(R[-42]C-MRO))/2,-MEP)-(MNR-MEP),0,MIN(R[-2]C,MEP-R[-42]C),1),OFFSET(R[-5]C2,MAX(-R[-2]C-(ABS(R[-42]C-MRO)+(R[-42]C-MRO))/2,-MEP)-(MNR-MEP),0,MIN(R[-2]C,MEP-R[-42]C),1))) -> 0 | AF50: =IF(R8C>MEP-1,0,SUMPRODUCT(OFFSET(R[-5]C,MAX(-R[-2]C-(ABS(R[-42]C-MRO)+(R[-42]C-MRO))/2,-MEP)-(MNR-MEP),0,MIN(R[-2]C,MEP-R[-42]C),1),OFFSET(R[-5]C2,MAX(-R[-2]C-(ABS(R[-42]C-MRO)+(R[-42]C-MRO))/2,-MEP)-(MNR-MEP),0,MIN(R[-2]C,MEP-R[-42]C),1))) -> 0 | AG50: =IF(R8C>MEP-1,0,SUMPRODUCT(OFFSET(R[-5]C,MAX(-R[-2]C-(ABS(R[-42]C-MRO)+(R[-42]C-MRO))/2,-MEP)-(MNR-MEP),0,MIN(R[-2]C,MEP-R[-42]C),1),OFFSET(R[-5]C2,MAX(-R[-2]C-(ABS(R[-42]C-MRO)+(R[-42]C-MRO))/2,-MEP)-(MNR-MEP),0,MIN(R[-2]C,MEP-R[-42]C),1))) -> 0 | AH50: =IF(R8C>MEP-1,0,SUMPRODUCT(OFFSET(R[-5]C,MAX(-R[-2]C-(ABS(R[-42]C-MRO)+(R[-42]C-MRO))/2,-MEP)-(MNR-MEP),0,MIN(R[-2]C,MEP-R[-42]C),1),OFFSET(R[-5]C2,MAX(-R[-2]C-(ABS(R[-42]C-MRO)+(R[-42]C-MRO))/2,-MEP)-(MNR-MEP),0,MIN(R[-2]C,MEP-R[-42]C),1))) -> 0 | AI50: =IF(R8C>MEP-1,0,SUMPRODUCT(OFFSET(R[-5]C,MAX(-R[-2]C-(ABS(R[-42]C-MRO)+(R[-42]C-MRO))/2,-MEP)-(MNR-MEP),0,MIN(R[-2]C,MEP-R[-42]C),1),OFFSET(R[-5]C2,MAX(-R[-2]C-(ABS(R[-42]C-MRO)+(R[-42]C-MRO))/2,-MEP)-(MNR-MEP),0,MIN(R[-2]C,MEP-R[-42]C),1))) -> 0 | AJ50: =IF(R8C>MEP-1,0,SUMPRODUCT(OFFSET(R[-5]C,MAX(-R[-2]C-(ABS(R[-42]C-MRO)+(R[-42]C-MRO))/2,-MEP)-(MNR-MEP),0,MIN(R[-2]C,MEP-R[-42]C),1),OFFSET(R[-5]C2,MAX(-R[-2]C-(ABS(R[-42]C-MRO)+(R[-42]C-MRO))/2,-MEP)-(MNR-MEP),0,MIN(R[-2]C,MEP-R[-42]C),1))) -> 0 | AK50: =IF(R8C>MEP-1,0,SUMPRODUCT(OFFSET(R[-5]C,MAX(-R[-2]C-(ABS(R[-42]C-MRO)+(R[-42]C-MRO))/2,-MEP)-(MNR-MEP),0,MIN(R[-2]C,MEP-R[-42]C),1),OFFSET(R[-5]C2,MAX(-R[-2]C-(ABS(R[-42]C-MRO)+(R[-42]C-MRO))/2,-MEP)-(MNR-MEP),0,MIN(R[-2]C,MEP-R[-42]C),1))) -> 0 | AL50: =IF(R8C>MEP-1,0,SUMPRODUCT(OFFSET(R[-5]C,MAX(-R[-2]C-(ABS(R[-42]C-MRO)+(R[-42]C-MRO))/2,-MEP)-(MNR-MEP),0,MIN(R[-2]C,MEP-R[-42]C),1),OFFSET(R[-5]C2,MAX(-R[-2]C-(ABS(R[-42]C-MRO)+(R[-42]C-MRO))/2,-MEP)-(MNR-MEP),0,MIN(R[-2]C,MEP-R[-42]C),1))) -> 0 | AM50: =IF(R8C>MEP-1,0,SUMPRODUCT(OFFSET(R[-5]C,MAX(-R[-2]C-(ABS(R[-42]C-MRO)+(R[-42]C-MRO))/2,-MEP)-(MNR-MEP),0,MIN(R[-2]C,MEP-R[-42]C),1),OFFSET(R[-5]C2,MAX(-R[-2]C-(ABS(R[-42]C-MRO)+(R[-42]C-MRO))/2,-MEP)-(MNR-MEP),0,MIN(R[-2]C,MEP-R[-42]C),1))) -> 0 | AN50: =IF(R8C>MEP-1,0,SUMPRODUCT(OFFSET(R[-5]C,MAX(-R[-2]C-(ABS(R[-42]C-MRO)+(R[-42]C-MRO))/2,-MEP)-(MNR-MEP),0,MIN(R[-2]C,MEP-R[-42]C),1),OFFSET(R[-5]C2,MAX(-R[-2]C-(ABS(R[-42]C-MRO)+(R[-42]C-MRO))/2,-MEP)-(MNR-MEP),0,MIN(R[-2]C,MEP-R[-42]C),1))) -> 0 | AO50: =IF(R8C>MEP-1,0,SUMPRODUCT(OFFSET(R[-5]C,MAX(-R[-2]C-(ABS(R[-42]C-MRO)+(R[-42]C-MRO))/2,-MEP)-(MNR-MEP),0,MIN(R[-2]C,MEP-R[-42]C),1),OFFSET(R[-5]C2,MAX(-R[-2]C-(ABS(R[-42]C-MRO)+(R[-42]C-MRO))/2,-MEP)-(MNR-MEP),0,MIN(R[-2]C,MEP-R[-42]C),1))) -> 0
A51: C. Exposure ………………………………………… | F51: =IF(R8C>MEP-1,0,SUM(OFFSET(R[-6]C3,MAX(-R[-3]C-(ABS(R[-43]C-MRO)+(R[-43]C-MRO))/2,-MEP)-(MNR-MEP),0,MIN(R[-3]C,MEP-R[-43]C),1))) -> 11266.073 | G51: =IF(R8C>MEP-1,0,SUM(OFFSET(R[-6]C3,MAX(-R[-3]C-(ABS(R[-43]C-MRO)+(R[-43]C-MRO))/2,-MEP)-(MNR-MEP),0,MIN(R[-3]C,MEP-R[-43]C),1))) -> 11284.34 | H51: =IF(R8C>MEP-1,0,SUM(OFFSET(R[-6]C3,MAX(-R[-3]C-(ABS(R[-43]C-MRO)+(R[-43]C-MRO))/2,-MEP)-(MNR-MEP),0,MIN(R[-3]C,MEP-R[-43]C),1))) -> 11360.851999999999 | I51: =IF(R8C>MEP-1,0,SUM(OFFSET(R[-6]C3,MAX(-R[-3]C-(ABS(R[-43]C-MRO)+(R[-43]C-MRO))/2,-MEP)-(MNR-MEP),0,MIN(R[-3]C,MEP-R[-43]C),1))) -> 11433.044 | J51: =IF(R8C>MEP-1,0,SUM(OFFSET(R[-6]C3,MAX(-R[-3]C-(ABS(R[-43]C-MRO)+(R[-43]C-MRO))/2,-MEP)-(MNR-MEP),0,MIN(R[-3]C,MEP-R[-43]C),1))) -> 11510.352000000001 | K51: =IF(R8C>MEP-1,0,SUM(OFFSET(R[-6]C3,MAX(-R[-3]C-(ABS(R[-43]C-MRO)+(R[-43]C-MRO))/2,-MEP)-(MNR-MEP),0,MIN(R[-3]C,MEP-R[-43]C),1))) -> 11559.235999999999 | L51: =IF(R8C>MEP-1,0,SUM(OFFSET(R[-6]C3,MAX(-R[-3]C-(ABS(R[-43]C-MRO)+(R[-43]C-MRO))/2,-MEP)-(MNR-MEP),0,MIN(R[-3]C,MEP-R[-43]C),1))) -> 11599.474 | M51: =IF(R8C>MEP-1,0,SUM(OFFSET(R[-6]C3,MAX(-R[-3]C-(ABS(R[-43]C-MRO)+(R[-43]C-MRO))/2,-MEP)-(MNR-MEP),0,MIN(R[-3]C,MEP-R[-43]C),1))) -> 11665.006000000001 | N51: =IF(R8C>MEP-1,0,SUM(OFFSET(R[-6]C3,MAX(-R[-3]C-(ABS(R[-43]C-MRO)+(R[-43]C-MRO))/2,-MEP)-(MNR-MEP),0,MIN(R[-3]C,MEP-R[-43]C),1))) -> 11765.189 | O51: =IF(R8C>MEP-1,0,SUM(OFFSET(R[-6]C3,MAX(-R[-3]C-(ABS(R[-43]C-MRO)+(R[-43]C-MRO))/2,-MEP)-(MNR-MEP),0,MIN(R[-3]C,MEP-R[-43]C),1))) -> 11874.029999999999 | P51: =IF(R8C>MEP-1,0,SUM(OFFSET(R[-6]C3,MAX(-R[-3]C-(ABS(R[-43]C-MRO)+(R[-43]C-MRO))/2,-MEP)-(MNR-MEP),0,MIN(R[-3]C,MEP-R[-43]C),1))) -> 11966.257999999998 | Q51: =IF(R8C>MEP-1,0,SUM(OFFSET(R[-6]C3,MAX(-R[-3]C-(ABS(R[-43]C-MRO)+(R[-43]C-MRO))/2,-MEP)-(MNR-MEP),0,MIN(R[-3]C,MEP-R[-43]C),1))) -> 12066.181999999999 | R51: =IF(R8C>MEP-1,0,SUM(OFFSET(R[-6]C3,MAX(-R[-3]C-(ABS(R[-43]C-MRO)+(R[-43]C-MRO))/2,-MEP)-(MNR-MEP),0,MIN(R[-3]C,MEP-R[-43]C),1))) -> 12106.623 | S51: =IF(R8C>MEP-1,0,SUM(OFFSET(R[-6]C3,MAX(-R[-3]C-(ABS(R[-43]C-MRO)+(R[-43]C-MRO))/2,-MEP)-(MNR-MEP),0,MIN(R[-3]C,MEP-R[-43]C),1))) -> 12101.947 | T51: =IF(R8C>MEP-1,0,SUM(OFFSET(R[-6]C3,MAX(-R[-3]C-(ABS(R[-43]C-MRO)+(R[-43]C-MRO))/2,-MEP)-(MNR-MEP),0,MIN(R[-3]C,MEP-R[-43]C),1))) -> 12088.512000000001 | U51: =IF(R8C>MEP-1,0,SUM(OFFSET(R[-6]C3,MAX(-R[-3]C-(ABS(R[-43]C-MRO)+(R[-43]C-MRO))/2,-MEP)-(MNR-MEP),0,MIN(R[-3]C,MEP-R[-43]C),1))) -> 12038.575999999999 | V51: =IF(R8C>MEP-1,0,SUM(OFFSET(R[-6]C3,MAX(-R[-3]C-(ABS(R[-43]C-MRO)+(R[-43]C-MRO))/2,-MEP)-(MNR-MEP),0,MIN(R[-3]C,MEP-R[-43]C),1))) -> 12029.492999999999 | W51: =IF(R8C>MEP-1,0,SUM(OFFSET(R[-6]C3,MAX(-R[-3]C-(ABS(R[-43]C-MRO)+(R[-43]C-MRO))/2,-MEP)-(MNR-MEP),0,MIN(R[-3]C,MEP-R[-43]C),1))) -> 12042.186000000002 | X51: =IF(R8C>MEP-1,0,SUM(OFFSET(R[-6]C3,MAX(-R[-3]C-(ABS(R[-43]C-MRO)+(R[-43]C-MRO))/2,-MEP)-(MNR-MEP),0,MIN(R[-3]C,MEP-R[-43]C),1))) -> 11979.477000000001 | Y51: =IF(R8C>MEP-1,0,SUM(OFFSET(R[-6]C3,MAX(-R[-3]C-(ABS(R[-43]C-MRO)+(R[-43]C-MRO))/2,-MEP)-(MNR-MEP),0,MIN(R[-3]C,MEP-R[-43]C),1))) -> 11950.039000000001 | Z51: =IF(R8C>MEP-1,0,SUM(OFFSET(R[-6]C3,MAX(-R[-3]C-(ABS(R[-43]C-MRO)+(R[-43]C-MRO))/2,-MEP)-(MNR-MEP),0,MIN(R[-3]C,MEP-R[-43]C),1))) -> 11889.131000000001 | AA51: =IF(R8C>MEP-1,0,SUM(OFFSET(R[-6]C3,MAX(-R[-3]C-(ABS(R[-43]C-MRO)+(R[-43]C-MRO))/2,-MEP)-(MNR-MEP),0,MIN(R[-3]C,MEP-R[-43]C),1))) -> 11705.434000000001 | AB51: =IF(R8C>MEP-1,0,SUM(OFFSET(R[-6]C3,MAX(-R[-3]C-(ABS(R[-43]C-MRO)+(R[-43]C-MRO))/2,-MEP)-(MNR-MEP),0,MIN(R[-3]C,MEP-R[-43]C),1))) -> 11603.005999999999 | AC51: =IF(R8C>MEP-1,0,SUM(OFFSET(R[-6]C3,MAX(-R[-3]C-(ABS(R[-43]C-MRO)+(R[-43]C-MRO))/2,-MEP)-(MNR-MEP),0,MIN(R[-3]C,MEP-R[-43]C),1))) -> 11503.147000000001 | AD51: =IF(R8C>MEP-1,0,SUM(OFFSET(R[-6]C3,MAX(-R[-3]C-(ABS(R[-43]C-MRO)+(R[-43]C-MRO))/2,-MEP)-(MNR-MEP),0,MIN(R[-3]C,MEP-R[-43]C),1))) -> 11455.701000000001 | AE51: =IF(R8C>MEP-1,0,SUM(OFFSET(R[-6]C3,MAX(-R[-3]C-(ABS(R[-43]C-MRO)+(R[-43]C-MRO))/2,-MEP)-(MNR-MEP),0,MIN(R[-3]C,MEP-R[-43]C),1))) -> 11454.891000000001 | AF51: =IF(R8C>MEP-1,0,SUM(OFFSET(R[-6]C3,MAX(-R[-3]C-(ABS(R[-43]C-MRO)+(R[-43]C-MRO))/2,-MEP)-(MNR-MEP),0,MIN(R[-3]C,MEP-R[-43]C),1))) -> 11430.594999999999 | AG51: =IF(R8C>MEP-1,0,SUM(OFFSET(R[-6]C3,MAX(-R[-3]C-(ABS(R[-43]C-MRO)+(R[-43]C-MRO))/2,-MEP)-(MNR-MEP),0,MIN(R[-3]C,MEP-R[-43]C),1))) -> 11391.630999999999 | AH51: =IF(R8C>MEP-1,0,SUM(OFFSET(R[-6]C3,MAX(-R[-3]C-(ABS(R[-43]C-MRO)+(R[-43]C-MRO))/2,-MEP)-(MNR-MEP),0,MIN(R[-3]C,MEP-R[-43]C),1))) -> 11307.723000000002 | AI51: =IF(R8C>MEP-1,0,SUM(OFFSET(R[-6]C3,MAX(-R[-3]C-(ABS(R[-43]C-MRO)+(R[-43]C-MRO))/2,-MEP)-(MNR-MEP),0,MIN(R[-3]C,MEP-R[-43]C),1))) -> 11258.901 | AJ51: =IF(R8C>MEP-1,0,SUM(OFFSET(R[-6]C3,MAX(-R[-3]C-(ABS(R[-43]C-MRO)+(R[-43]C-MRO))/2,-MEP)-(MNR-MEP),0,MIN(R[-3]C,MEP-R[-43]C),1))) -> 11170.482999999998 | AK51: =IF(R8C>MEP-1,0,SUM(OFFSET(R[-6]C3,MAX(-R[-3]C-(ABS(R[-43]C-MRO)+(R[-43]C-MRO))/2,-MEP)-(MNR-MEP),0,MIN(R[-3]C,MEP-R[-43]C),1))) -> 10999.188 | AL51: =IF(R8C>MEP-1,0,SUM(OFFSET(R[-6]C3,MAX(-R[-3]C-(ABS(R[-43]C-MRO)+(R[-43]C-MRO))/2,-MEP)-(MNR-MEP),0,MIN(R[-3]C,MEP-R[-43]C),1))) -> 10748.884999999998 | AM51: =IF(R8C>MEP-1,0,SUM(OFFSET(R[-6]C3,MAX(-R[-3]C-(ABS(R[-43]C-MRO)+(R[-43]C-MRO))/2,-MEP)-(MNR-MEP),0,MIN(R[-3]C,MEP-R[-43]C),1))) -> 7968.1309999999994 | AN51: =IF(R8C>MEP-1,0,SUM(OFFSET(R[-6]C3,MAX(-R[-3]C-(ABS(R[-43]C-MRO)+(R[-43]C-MRO))/2,-MEP)-(MNR-MEP),0,MIN(R[-3]C,MEP-R[-43]C),1))) -> 5239.9229999999998 | AO51: =IF(R8C>MEP-1,0,SUM(OFFSET(R[-6]C3,MAX(-R[-3]C-(ABS(R[-43]C-MRO)+(R[-43]C-MRO))/2,-MEP)-(MNR-MEP),0,MIN(R[-3]C,MEP-R[-43]C),1))) -> 2576.1559999999999
A52: D. Monthly Claim Costs …………………………… | E52: =SUM(RC[1]:RC[36]) -> 43.760982317293269 | F52: =IF(R[-1]C=0,0,R[-2]C/R[-1]C) -> 2.2875524726239762 | G52: =IF(R[-1]C=0,0,R[-2]C/R[-1]C) -> 11.130866154199593 | H52: =IF(R[-1]C=0,0,R[-2]C/R[-1]C) -> 10.079324972217515 | I52: =IF(R[-1]C=0,0,R[-2]C/R[-1]C) -> 12.530024132072334 | J52: =IF(R[-1]C=0,0,R[-2]C/R[-1]C) -> 3.0553486292000192 | K52: =IF(R[-1]C=0,0,R[-2]C/R[-1]C) -> 1.3171303255257221 | L52: =IF(R[-1]C=0,0,R[-2]C/R[-1]C) -> 1.3922241252479117 | M52: =IF(R[-1]C=0,0,R[-2]C/R[-1]C) -> 1.2801586503033258 | N52: =IF(R[-1]C=0,0,R[-2]C/R[-1]C) -> 0.27766965114229414 | O52: =IF(R[-1]C=0,0,R[-2]C/R[-1]C) -> 5.359891255200034E-2 | P52: =IF(R[-1]C=0,0,R[-2]C/R[-1]C) -> 6.4677055470213907E-2 | Q52: =IF(R[-1]C=0,0,R[-2]C/R[-1]C) -> 7.0189883575053999E-2 | R52: =IF(R[-1]C=0,0,R[-2]C/R[-1]C) -> 0 | S52: =IF(R[-1]C=0,0,R[-2]C/R[-1]C) -> 0 | T52: =IF(R[-1]C=0,0,R[-2]C/R[-1]C) -> 0 | U52: =IF(R[-1]C=0,0,R[-2]C/R[-1]C) -> 0.16712302675832785 | V52: =IF(R[-1]C=0,0,R[-2]C/R[-1]C) -> 3.979554867031939E-2 | W52: =IF(R[-1]C=0,0,R[-2]C/R[-1]C) -> 1.5298777734657557E-2 | X52: =IF(R[-1]C=0,0,R[-2]C/R[-1]C) -> 0 | Y52: =IF(R[-1]C=0,0,R[-2]C/R[-1]C) -> 0 | Z52: =IF(R[-1]C=0,0,R[-2]C/R[-1]C) -> 0 | AA52: =IF(R[-1]C=0,0,R[-2]C/R[-1]C) -> 0 | AB52: =IF(R[-1]C=0,0,R[-2]C/R[-1]C) -> 0 | AC52: =IF(R[-1]C=0,0,R[-2]C/R[-1]C) -> 0 | AD52: =IF(R[-1]C=0,0,R[-2]C/R[-1]C) -> 0 | AE52: =IF(R[-1]C=0,0,R[-2]C/R[-1]C) -> 0 | AF52: =IF(R[-1]C=0,0,R[-2]C/R[-1]C) -> 0 | AG52: =IF(R[-1]C=0,0,R[-2]C/R[-1]C) -> 0 | AH52: =IF(R[-1]C=0,0,R[-2]C/R[-1]C) -> 0 | AI52: =IF(R[-1]C=0,0,R[-2]C/R[-1]C) -> 0 | AJ52: =IF(R[-1]C=0,0,R[-2]C/R[-1]C) -> 0 | AK52: =IF(R[-1]C=0,0,R[-2]C/R[-1]C) -> 0 | AL52: =IF(R[-1]C=0,0,R[-2]C/R[-1]C) -> 0 | AM52: =IF(R[-1]C=0,0,R[-2]C/R[-1]C) -> 0 | AN52: =IF(R[-1]C=0,0,R[-2]C/R[-1]C) -> 0 | AO52: =IF(R[-1]C=0,0,R[-2]C/R[-1]C) -> 0
A53: E. Cumulative Costs ……………………………… | F53: =RC[-1]+R[-1]C -> 2.2875524726239762 | G53: =RC[-1]+R[-1]C -> 13.41841862682357 | H53: =RC[-1]+R[-1]C -> 23.497743599041087 | I53: =RC[-1]+R[-1]C -> 36.027767731113421 | J53: =RC[-1]+R[-1]C -> 39.08311636031344 | K53: =RC[-1]+R[-1]C -> 40.400246685839164 | L53: =RC[-1]+R[-1]C -> 41.792470811087078 | M53: =RC[-1]+R[-1]C -> 43.072629461390406 | N53: =RC[-1]+R[-1]C -> 43.350299112532703 | O53: =RC[-1]+R[-1]C -> 43.4038980250847 | P53: =RC[-1]+R[-1]C -> 43.468575080554913 | Q53: =RC[-1]+R[-1]C -> 43.538764964129967 | R53: =RC[-1]+R[-1]C -> 43.538764964129967 | S53: =RC[-1]+R[-1]C -> 43.538764964129967 | T53: =RC[-1]+R[-1]C -> 43.538764964129967 | U53: =RC[-1]+R[-1]C -> 43.705887990888293 | V53: =RC[-1]+R[-1]C -> 43.745683539558613 | W53: =RC[-1]+R[-1]C -> 43.760982317293269 | X53: =RC[-1]+R[-1]C -> 43.760982317293269 | Y53: =RC[-1]+R[-1]C -> 43.760982317293269 | Z53: =RC[-1]+R[-1]C -> 43.760982317293269 | AA53: =RC[-1]+R[-1]C -> 43.760982317293269 | AB53: =RC[-1]+R[-1]C -> 43.760982317293269 | AC53: =RC[-1]+R[-1]C -> 43.760982317293269 | AD53: =RC[-1]+R[-1]C -> 43.760982317293269 | AE53: =RC[-1]+R[-1]C -> 43.760982317293269 | AF53: =RC[-1]+R[-1]C -> 43.760982317293269 | AG53: =RC[-1]+R[-1]C -> 43.760982317293269 | AH53: =RC[-1]+R[-1]C -> 43.760982317293269 | AI53: =RC[-1]+R[-1]C -> 43.760982317293269 | AJ53: =RC[-1]+R[-1]C -> 43.760982317293269 | AK53: =RC[-1]+R[-1]C -> 43.760982317293269 | AL53: =RC[-1]+R[-1]C -> 43.760982317293269 | AM53: =RC[-1]+R[-1]C -> 43.760982317293269 | AN53: =RC[-1]+R[-1]C -> 43.760982317293269 | AO53: =RC[-1]+R[-1]C -> 43.760982317293269
A54: F. Completion Factors …………………………… | F54: =IF(R[-2]C5=0,0,ROUND(R[-1]C/R[-2]C5,5)*CMF) -> 5.2269999999999997E-2 | G54: =IF(R[-2]C5=0,0,ROUND(R[-1]C/R[-2]C5,5)*CMF) -> 0.30663000000000001 | H54: =IF(R[-2]C5=0,0,ROUND(R[-1]C/R[-2]C5,5)*CMF) -> 0.53695999999999999 | I54: =IF(R[-2]C5=0,0,ROUND(R[-1]C/R[-2]C5,5)*CMF) -> 0.82328999999999997 | J54: =IF(R[-2]C5=0,0,ROUND(R[-1]C/R[-2]C5,5)*CMF) -> 0.8931 | K54: =IF(R[-2]C5=0,0,ROUND(R[-1]C/R[-2]C5,5)*CMF) -> 0.92320000000000002 | L54: =IF(R[-2]C5=0,0,ROUND(R[-1]C/R[-2]C5,5)*CMF) -> 0.95501999999999998 | M54: =IF(R[-2]C5=0,0,ROUND(R[-1]C/R[-2]C5,5)*CMF) -> 0.98426999999999998 | N54: =IF(R[-2]C5=0,0,ROUND(R[-1]C/R[-2]C5,5)*CMF) -> 0.99061999999999995 | O54: =IF(R[-2]C5=0,0,ROUND(R[-1]C/R[-2]C5,5)*CMF) -> 0.99184000000000005 | P54: =IF(R[-2]C5=0,0,ROUND(R[-1]C/R[-2]C5,5)*CMF) -> 0.99331999999999998 | Q54: =IF(R[-2]C5=0,0,ROUND(R[-1]C/R[-2]C5,5)*CMF) -> 0.99492000000000003 | R54: =IF(R[-2]C5=0,0,ROUND(R[-1]C/R[-2]C5,5)*CMF) -> 0.99492000000000003 | S54: =IF(R[-2]C5=0,0,ROUND(R[-1]C/R[-2]C5,5)*CMF) -> 0.99492000000000003 | T54: =IF(R[-2]C5=0,0,ROUND(R[-1]C/R[-2]C5,5)*CMF) -> 0.99492000000000003 | U54: =IF(R[-2]C5=0,0,ROUND(R[-1]C/R[-2]C5,5)*CMF) -> 0.99873999999999996 | V54: =IF(R[-2]C5=0,0,ROUND(R[-1]C/R[-2]C5,5)*CMF) -> 0.99965000000000004 | W54: =IF(R[-2]C5=0,0,ROUND(R[-1]C/R[-2]C5,5)*CMF) -> 1 | X54: =IF(R[-2]C5=0,0,ROUND(R[-1]C/R[-2]C5,5)*CMF) -> 1 | Y54: =IF(R[-2]C5=0,0,ROUND(R[-1]C/R[-2]C5,5)*CMF) -> 1 | Z54: =IF(R[-2]C5=0,0,ROUND(R[-1]C/R[-2]C5,5)*CMF) -> 1 | AA54: =IF(R[-2]C5=0,0,ROUND(R[-1]C/R[-2]C5,5)*CMF) -> 1 | AB54: =IF(R[-2]C5=0,0,ROUND(R[-1]C/R[-2]C5,5)*CMF) -> 1 | AC54: =IF(R[-2]C5=0,0,ROUND(R[-1]C/R[-2]C5,5)*CMF) -> 1 | AD54: =IF(R[-2]C5=0,0,ROUND(R[-1]C/R[-2]C5,5)*CMF) -> 1 | AE54: =IF(R[-2]C5=0,0,ROUND(R[-1]C/R[-2]C5,5)*CMF) -> 1 | AF54: =IF(R[-2]C5=0,0,ROUND(R[-1]C/R[-2]C5,5)*CMF) -> 1 | AG54: =IF(R[-2]C5=0,0,ROUND(R[-1]C/R[-2]C5,5)*CMF) -> 1 | AH54: =IF(R[-2]C5=0,0,ROUND(R[-1]C/R[-2]C5,5)*CMF) -> 1 | AI54: =IF(R[-2]C5=0,0,ROUND(R[-1]C/R[-2]C5,5)*CMF) -> 1 | AJ54: =IF(R[-2]C5=0,0,ROUND(R[-1]C/R[-2]C5,5)*CMF) -> 1 | AK54: =IF(R[-2]C5=0,0,ROUND(R[-1]C/R[-2]C5,5)*CMF) -> 1 | AL54: =IF(R[-2]C5=0,0,ROUND(R[-1]C/R[-2]C5,5)*CMF) -> 1 | AM54: =IF(R[-2]C5=0,0,ROUND(R[-1]C/R[-2]C5,5)*CMF) -> 1 | AN54: =IF(R[-2]C5=0,0,ROUND(R[-1]C/R[-2]C5,5)*CMF) -> 1 | AO54: =IF(R[-2]C5=0,0,ROUND(R[-1]C/R[-2]C5,5)*CMF) -> 1
F56: =R[-49]C -> REPORTED CLAIMS / NUMBER OF MONTHS BETWEEN INCURRED AND REPORTED DATES
A57: Reported | D57: Total Paid | F57: =R[-49]C -> 0 | G57: =R[-49]C -> 1 | H57: =R[-49]C -> 2 | I57: =R[-49]C -> 3 | J57: =R[-49]C -> 4 | K57: =R[-49]C -> 5 | L57: =R[-49]C -> 6 | M57: =R[-49]C -> 7 | N57: =R[-49]C -> 8 | O57: =R[-49]C -> 9 | P57: =R[-49]C -> 10 | Q57: =R[-49]C -> 11 | R57: =R[-49]C -> 12 | S57: =R[-49]C -> 13 | T57: =R[-49]C -> 14 | U57: =R[-49]C -> 15 | V57: =R[-49]C -> 16 | W57: =R[-49]C -> 17 | X57: =R[-49]C -> 18 | Y57: =R[-49]C -> 19 | Z57: =R[-49]C -> 20 | AA57: =R[-49]C -> 21 | AB57: =R[-49]C -> 22 | AC57: =R[-49]C -> 23 | AD57: =R[-49]C -> 24 | AE57: =R[-49]C -> 25 | AF57: =R[-49]C -> 26 | AG57: =R[-49]C -> 27 | AH57: =R[-49]C -> 28 | AI57: =R[-49]C -> 29 | AJ57: =R[-49]C -> 30 | AK57: =R[-49]C -> 31 | AL57: =R[-49]C -> 32 | AM57: =R[-49]C -> 33 | AN57: =R[-49]C -> 34 | AO57: =R[-49]C -> 35
A58: =ExpDat -> 1998-08-01T00:00:00.000 | D58: =IF(RC1="","",SUM(RC[2]:RC[37])) -> 25147 | F58: =IF(RC1="","",IF(OR(R8C<=ROUND(DAYS360(ValDat,RC1,0)/30,0),R8C>ROUND(DAYS360(ExpDat,RC1,0)/30,0)),0,OFFSET(R45C,MAX(-MNR,ROUND(DAYS360(ValDat,RC1,0)/30,0)-R8C+MEP-MNR),0,1,1))) -> 25147 | G58: =IF(RC1="","",IF(OR(R8C<=ROUND(DAYS360(ValDat,RC1,0)/30,0),R8C>ROUND(DAYS360(ExpDat,RC1,0)/30,0)),0,OFFSET(R45C,MAX(-MNR,ROUND(DAYS360(ValDat,RC1,0)/30,0)-R8C+MEP-MNR),0,1,1))) -> 0 | H58: =IF(RC1="","",IF(OR(R8C<=ROUND(DAYS360(ValDat,RC1,0)/30,0),R8C>ROUND(DAYS360(ExpDat,RC1,0)/30,0)),0,OFFSET(R45C,MAX(-MNR,ROUND(DAYS360(ValDat,RC1,0)/30,0)-R8C+MEP-MNR),0,1,1))) -> 0 | I58: =IF(RC1="","",IF(OR(R8C<=ROUND(DAYS360(ValDat,RC1,0)/30,0),R8C>ROUND(DAYS360(ExpDat,RC1,0)/30,0)),0,OFFSET(R45C,MAX(-MNR,ROUND(DAYS360(ValDat,RC1,0)/30,0)-R8C+MEP-MNR),0,1,1))) -> 0 | J58: =IF(RC1="","",IF(OR(R8C<=ROUND(DAYS360(ValDat,RC1,0)/30,0),R8C>ROUND(DAYS360(ExpDat,RC1,0)/30,0)),0,OFFSET(R45C,MAX(-MNR,ROUND(DAYS360(ValDat,RC1,0)/30,0)-R8C+MEP-MNR),0,1,1))) -> 0 | K58: =IF(RC1="","",IF(OR(R8C<=ROUND(DAYS360(ValDat,RC1,0)/30,0),R8C>ROUND(DAYS360(ExpDat,RC1,0)/30,0)),0,OFFSET(R45C,MAX(-MNR,ROUND(DAYS360(ValDat,RC1,0)/30,0)-R8C+MEP-MNR),0,1,1))) -> 0 | L58: =IF(RC1="","",IF(OR(R8C<=ROUND(DAYS360(ValDat,RC1,0)/30,0),R8C>ROUND(DAYS360(ExpDat,RC1,0)/30,0)),0,OFFSET(R45C,MAX(-MNR,ROUND(DAYS360(ValDat,RC1,0)/30,0)-R8C+MEP-MNR),0,1,1))) -> 0 | M58: =IF(RC1="","",IF(OR(R8C<=ROUND(DAYS360(ValDat,RC1,0)/30,0),R8C>ROUND(DAYS360(ExpDat,RC1,0)/30,0)),0,OFFSET(R45C,MAX(-MNR,ROUND(DAYS360(ValDat,RC1,0)/30,0)-R8C+MEP-MNR),0,1,1))) -> 0 | N58: =IF(RC1="","",IF(OR(R8C<=ROUND(DAYS360(ValDat,RC1,0)/30,0),R8C>ROUND(DAYS360(ExpDat,RC1,0)/30,0)),0,OFFSET(R45C,MAX(-MNR,ROUND(DAYS360(ValDat,RC1,0)/30,0)-R8C+MEP-MNR),0,1,1))) -> 0 | O58: =IF(RC1="","",IF(OR(R8C<=ROUND(DAYS360(ValDat,RC1,0)/30,0),R8C>ROUND(DAYS360(ExpDat,RC1,0)/30,0)),0,OFFSET(R45C,MAX(-MNR,ROUND(DAYS360(ValDat,RC1,0)/30,0)-R8C+MEP-MNR),0,1,1))) -> 0 | P58: =IF(RC1="","",IF(OR(R8C<=ROUND(DAYS360(ValDat,RC1,0)/30,0),R8C>ROUND(DAYS360(ExpDat,RC1,0)/30,0)),0,OFFSET(R45C,MAX(-MNR,ROUND(DAYS360(ValDat,RC1,0)/30,0)-R8C+MEP-MNR),0,1,1))) -> 0 | Q58: =IF(RC1="","",IF(OR(R8C<=ROUND(DAYS360(ValDat,RC1,0)/30,0),R8C>ROUND(DAYS360(ExpDat,RC1,0)/30,0)),0,OFFSET(R45C,MAX(-MNR,ROUND(DAYS360(ValDat,RC1,0)/30,0)-R8C+MEP-MNR),0,1,1))) -> 0 | R58: =IF(RC1="","",IF(OR(R8C<=ROUND(DAYS360(ValDat,RC1,0)/30,0),R8C>ROUND(DAYS360(ExpDat,RC1,0)/30,0)),0,OFFSET(R45C,MAX(-MNR,ROUND(DAYS360(ValDat,RC1,0)/30,0)-R8C+MEP-MNR),0,1,1))) -> 0 | S58: =IF(RC1="","",IF(OR(R8C<=ROUND(DAYS360(ValDat,RC1,0)/30,0),R8C>ROUND(DAYS360(ExpDat,RC1,0)/30,0)),0,OFFSET(R45C,MAX(-MNR,ROUND(DAYS360(ValDat,RC1,0)/30,0)-R8C+MEP-MNR),0,1,1))) -> 0 | T58: =IF(RC1="","",IF(OR(R8C<=ROUND(DAYS360(ValDat,RC1,0)/30,0),R8C>ROUND(DAYS360(ExpDat,RC1,0)/30,0)),0,OFFSET(R45C,MAX(-MNR,ROUND(DAYS360(ValDat,RC1,0)/30,0)-R8C+MEP-MNR),0,1,1))) -> 0 | U58: =IF(RC1="","",IF(OR(R8C<=ROUND(DAYS360(ValDat,RC1,0)/30,0),R8C>ROUND(DAYS360(ExpDat,RC1,0)/30,0)),0,OFFSET(R45C,MAX(-MNR,ROUND(DAYS360(ValDat,RC1,0)/30,0)-R8C+MEP-MNR),0,1,1))) -> 0 | V58: =IF(RC1="","",IF(OR(R8C<=ROUND(DAYS360(ValDat,RC1,0)/30,0),R8C>ROUND(DAYS360(ExpDat,RC1,0)/30,0)),0,OFFSET(R45C,MAX(-MNR,ROUND(DAYS360(ValDat,RC1,0)/30,0)-R8C+MEP-MNR),0,1,1))) -> 0 | W58: =IF(RC1="","",IF(OR(R8C<=ROUND(DAYS360(ValDat,RC1,0)/30,0),R8C>ROUND(DAYS360(ExpDat,RC1,0)/30,0)),0,OFFSET(R45C,MAX(-MNR,ROUND(DAYS360(ValDat,RC1,0)/30,0)-R8C+MEP-MNR),0,1,1))) -> 0 | X58: =IF(RC1="","",IF(OR(R8C<=ROUND(DAYS360(ValDat,RC1,0)/30,0),R8C>ROUND(DAYS360(ExpDat,RC1,0)/30,0)),0,OFFSET(R45C,MAX(-MNR,ROUND(DAYS360(ValDat,RC1,0)/30,0)-R8C+MEP-MNR),0,1,1))) -> 0 | Y58: =IF(RC1="","",IF(OR(R8C<=ROUND(DAYS360(ValDat,RC1,0)/30,0),R8C>ROUND(DAYS360(ExpDat,RC1,0)/30,0)),0,OFFSET(R45C,MAX(-MNR,ROUND(DAYS360(ValDat,RC1,0)/30,0)-R8C+MEP-MNR),0,1,1))) -> 0 | Z58: =IF(RC1="","",IF(OR(R8C<=ROUND(DAYS360(ValDat,RC1,0)/30,0),R8C>ROUND(DAYS360(ExpDat,RC1,0)/30,0)),0,OFFSET(R45C,MAX(-MNR,ROUND(DAYS360(ValDat,RC1,0)/30,0)-R8C+MEP-MNR),0,1,1))) -> 0 | AA58: =IF(RC1="","",IF(OR(R8C<=ROUND(DAYS360(ValDat,RC1,0)/30,0),R8C>ROUND(DAYS360(ExpDat,RC1,0)/30,0)),0,OFFSET(R45C,MAX(-MNR,ROUND(DAYS360(ValDat,RC1,0)/30,0)-R8C+MEP-MNR),0,1,1))) -> 0 | AB58: =IF(RC1="","",IF(OR(R8C<=ROUND(DAYS360(ValDat,RC1,0)/30,0),R8C>ROUND(DAYS360(ExpDat,RC1,0)/30,0)),0,OFFSET(R45C,MAX(-MNR,ROUND(DAYS360(ValDat,RC1,0)/30,0)-R8C+MEP-MNR),0,1,1))) -> 0 | AC58: =IF(RC1="","",IF(OR(R8C<=ROUND(DAYS360(ValDat,RC1,0)/30,0),R8C>ROUND(DAYS360(ExpDat,RC1,0)/30,0)),0,OFFSET(R45C,MAX(-MNR,ROUND(DAYS360(ValDat,RC1,0)/30,0)-R8C+MEP-MNR),0,1,1))) -> 0 | AD58: =IF(RC1="","",IF(OR(R8C<=ROUND(DAYS360(ValDat,RC1,0)/30,0),R8C>ROUND(DAYS360(ExpDat,RC1,0)/30,0)),0,OFFSET(R45C,MAX(-MNR,ROUND(DAYS360(ValDat,RC1,0)/30,0)-R8C+MEP-MNR),0,1,1))) -> 0 | AE58: =IF(RC1="","",IF(OR(R8C<=ROUND(DAYS360(ValDat,RC1,0)/30,0),R8C>ROUND(DAYS360(ExpDat,RC1,0)/30,0)),0,OFFSET(R45C,MAX(-MNR,ROUND(DAYS360(ValDat,RC1,0)/30,0)-R8C+MEP-MNR),0,1,1))) -> 0 | AF58: =IF(RC1="","",IF(OR(R8C<=ROUND(DAYS360(ValDat,RC1,0)/30,0),R8C>ROUND(DAYS360(ExpDat,RC1,0)/30,0)),0,OFFSET(R45C,MAX(-MNR,ROUND(DAYS360(ValDat,RC1,0)/30,0)-R8C+MEP-MNR),0,1,1))) -> 0 | AG58: =IF(RC1="","",IF(OR(R8C<=ROUND(DAYS360(ValDat,RC1,0)/30,0),R8C>ROUND(DAYS360(ExpDat,RC1,0)/30,0)),0,OFFSET(R45C,MAX(-MNR,ROUND(DAYS360(ValDat,RC1,0)/30,0)-R8C+MEP-MNR),0,1,1))) -> 0 | AH58: =IF(RC1="","",IF(OR(R8C<=ROUND(DAYS360(ValDat,RC1,0)/30,0),R8C>ROUND(DAYS360(ExpDat,RC1,0)/30,0)),0,OFFSET(R45C,MAX(-MNR,ROUND(DAYS360(ValDat,RC1,0)/30,0)-R8C+MEP-MNR),0,1,1))) -> 0 | AI58: =IF(RC1="","",IF(OR(R8C<=ROUND(DAYS360(ValDat,RC1,0)/30,0),R8C>ROUND(DAYS360(ExpDat,RC1,0)/30,0)),0,OFFSET(R45C,MAX(-MNR,ROUND(DAYS360(ValDat,RC1,0)/30,0)-R8C+MEP-MNR),0,1,1))) -> 0 | AJ58: =IF(RC1="","",IF(OR(R8C<=ROUND(DAYS360(ValDat,RC1,0)/30,0),R8C>ROUND(DAYS360(ExpDat,RC1,0)/30,0)),0,OFFSET(R45C,MAX(-MNR,ROUND(DAYS360(ValDat,RC1,0)/30,0)-R8C+MEP-MNR),0,1,1))) -> 0 | AK58: =IF(RC1="","",IF(OR(R8C<=ROUND(DAYS360(ValDat,RC1,0)/30,0),R8C>ROUND(DAYS360(ExpDat,RC1,0)/30,0)),0,OFFSET(R45C,MAX(-MNR,ROUND(DAYS360(ValDat,RC1,0)/30,0)-R8C+MEP-MNR),0,1,1))) -> 0 | AL58: =IF(RC1="","",IF(OR(R8C<=ROUND(DAYS360(ValDat,RC1,0)/30,0),R8C>ROUND(DAYS360(ExpDat,RC1,0)/30,0)),0,OFFSET(R45C,MAX(-MNR,ROUND(DAYS360(ValDat,RC1,0)/30,0)-R8C+MEP-MNR),0,1,1))) -> 0 | AM58: =IF(RC1="","",IF(OR(R8C<=ROUND(DAYS360(ValDat,RC1,0)/30,0),R8C>ROUND(DAYS360(ExpDat,RC1,0)/30,0)),0,OFFSET(R45C,MAX(-MNR,ROUND(DAYS360(ValDat,RC1,0)/30,0)-R8C+MEP-MNR),0,1,1))) -> 0 | AN58: =IF(RC1="","",IF(OR(R8C<=ROUND(DAYS360(ValDat,RC1,0)/30,0),R8C>ROUND(DAYS360(ExpDat,RC1,0)/30,0)),0,OFFSET(R45C,MAX(-MNR,ROUND(DAYS360(ValDat,RC1,0)/30,0)-R8C+MEP-MNR),0,1,1))) -> 0 | AO58: =IF(RC1="","",IF(OR(R8C<=ROUND(DAYS360(ValDat,RC1,0)/30,0),R8C>ROUND(DAYS360(ExpDat,RC1,0)/30,0)),0,OFFSET(R45C,MAX(-MNR,ROUND(DAYS360(ValDat,RC1,0)/30,0)-R8C+MEP-MNR),0,1,1))) -> 0
A59: =IF(R[-1]C="","",IF(DATE(YEAR(R[-1]C),MONTH(R[-1]C)+1,1)>RunDat,"",DATE(YEAR(R[-1]C),MONTH(R[-1]C)+1,1))) -> 1998-09-01T00:00:00.000 | D59: =IF(RC1="","",SUM(RC[2]:RC[37])) -> 105325 | F59: =IF(RC1="","",IF(OR(R8C<=ROUND(DAYS360(ValDat,RC1,0)/30,0),R8C>ROUND(DAYS360(ExpDat,RC1,0)/30,0)),0,OFFSET(R45C,MAX(-MNR,ROUND(DAYS360(ValDat,RC1,0)/30,0)-R8C+MEP-MNR),0,1,1))) -> 31253 | G59: =IF(RC1="","",IF(OR(R8C<=ROUND(DAYS360(ValDat,RC1,0)/30,0),R8C>ROUND(DAYS360(ExpDat,RC1,0)/30,0)),0,OFFSET(R45C,MAX(-MNR,ROUND(DAYS360(ValDat,RC1,0)/30,0)-R8C+MEP-MNR),0,1,1))) -> 74072 | H59: =IF(RC1="","",IF(OR(R8C<=ROUND(DAYS360(ValDat,RC1,0)/30,0),R8C>ROUND(DAYS360(ExpDat,RC1,0)/30,0)),0,OFFSET(R45C,MAX(-MNR,ROUND(DAYS360(ValDat,RC1,0)/30,0)-R8C+MEP-MNR),0,1,1))) -> 0 | I59: =IF(RC1="","",IF(OR(R8C<=ROUND(DAYS360(ValDat,RC1,0)/30,0),R8C>ROUND(DAYS360(ExpDat,RC1,0)/30,0)),0,OFFSET(R45C,MAX(-MNR,ROUND(DAYS360(ValDat,RC1,0)/30,0)-R8C+MEP-MNR),0,1,1))) -> 0 | J59: =IF(RC1="","",IF(OR(R8C<=ROUND(DAYS360(ValDat,RC1,0)/30,0),R8C>ROUND(DAYS360(ExpDat,RC1,0)/30,0)),0,OFFSET(R45C,MAX(-MNR,ROUND(DAYS360(ValDat,RC1,0)/30,0)-R8C+MEP-MNR),0,1,1))) -> 0 | K59: =IF(RC1="","",IF(OR(R8C<=ROUND(DAYS360(ValDat,RC1,0)/30,0),R8C>ROUND(DAYS360(ExpDat,RC1,0)/30,0)),0,OFFSET(R45C,MAX(-MNR,ROUND(DAYS360(ValDat,RC1,0)/30,0)-R8C+MEP-MNR),0,1,1))) -> 0 | L59: =IF(RC1="","",IF(OR(R8C<=ROUND(DAYS360(ValDat,RC1,0)/30,0),R8C>ROUND(DAYS360(ExpDat,RC1,0)/30,0)),0,OFFSET(R45C,MAX(-MNR,ROUND(DAYS360(ValDat,RC1,0)/30,0)-R8C+MEP-MNR),0,1,1))) -> 0 | M59: =IF(RC1="","",IF(OR(R8C<=ROUND(DAYS360(ValDat,RC1,0)/30,0),R8C>ROUND(DAYS360(ExpDat,RC1,0)/30,0)),0,OFFSET(R45C,MAX(-MNR,ROUND(DAYS360(ValDat,RC1,0)/30,0)-R8C+MEP-MNR),0,1,1))) -> 0 | N59: =IF(RC1="","",IF(OR(R8C<=ROUND(DAYS360(ValDat,RC1,0)/30,0),R8C>ROUND(DAYS360(ExpDat,RC1,0)/30,0)),0,OFFSET(R45C,MAX(-MNR,ROUND(DAYS360(ValDat,RC1,0)/30,0)-R8C+MEP-MNR),0,1,1))) -> 0 | O59: =IF(RC1="","",IF(OR(R8C<=ROUND(DAYS360(ValDat,RC1,0)/30,0),R8C>ROUND(DAYS360(ExpDat,RC1,0)/30,0)),0,OFFSET(R45C,MAX(-MNR,ROUND(DAYS360(ValDat,RC1,0)/30,0)-R8C+MEP-MNR),0,1,1))) -> 0 | P59: =IF(RC1="","",IF(OR(R8C<=ROUND(DAYS360(ValDat,RC1,0)/30,0),R8C>ROUND(DAYS360(ExpDat,RC1,0)/30,0)),0,OFFSET(R45C,MAX(-MNR,ROUND(DAYS360(ValDat,RC1,0)/30,0)-R8C+MEP-MNR),0,1,1))) -> 0 | Q59: =IF(RC1="","",IF(OR(R8C<=ROUND(DAYS360(ValDat,RC1,0)/30,0),R8C>ROUND(DAYS360(ExpDat,RC1,0)/30,0)),0,OFFSET(R45C,MAX(-MNR,ROUND(DAYS360(ValDat,RC1,0)/30,0)-R8C+MEP-MNR),0,1,1))) -> 0 | R59: =IF(RC1="","",IF(OR(R8C<=ROUND(DAYS360(ValDat,RC1,0)/30,0),R8C>ROUND(DAYS360(ExpDat,RC1,0)/30,0)),0,OFFSET(R45C,MAX(-MNR,ROUND(DAYS360(ValDat,RC1,0)/30,0)-R8C+MEP-MNR),0,1,1))) -> 0 | S59: =IF(RC1="","",IF(OR(R8C<=ROUND(DAYS360(ValDat,RC1,0)/30,0),R8C>ROUND(DAYS360(ExpDat,RC1,0)/30,0)),0,OFFSET(R45C,MAX(-MNR,ROUND(DAYS360(ValDat,RC1,0)/30,0)-R8C+MEP-MNR),0,1,1))) -> 0 | T59: =IF(RC1="","",IF(OR(R8C<=ROUND(DAYS360(ValDat,RC1,0)/30,0),R8C>ROUND(DAYS360(ExpDat,RC1,0)/30,0)),0,OFFSET(R45C,MAX(-MNR,ROUND(DAYS360(ValDat,RC1,0)/30,0)-R8C+MEP-MNR),0,1,1))) -> 0 | U59: =IF(RC1="","",IF(OR(R8C<=ROUND(DAYS360(ValDat,RC1,0)/30,0),R8C>ROUND(DAYS360(ExpDat,RC1,0)/30,0)),0,OFFSET(R45C,MAX(-MNR,ROUND(DAYS360(ValDat,RC1,0)/30,0)-R8C+MEP-MNR),0,1,1))) -> 0 | V59: =IF(RC1="","",IF(OR(R8C<=ROUND(DAYS360(ValDat,RC1,0)/30,0),R8C>ROUND(DAYS360(ExpDat,RC1,0)/30,0)),0,OFFSET(R45C,MAX(-MNR,ROUND(DAYS360(ValDat,RC1,0)/30,0)-R8C+MEP-MNR),0,1,1))) -> 0 | W59: =IF(RC1="","",IF(OR(R8C<=ROUND(DAYS360(ValDat,RC1,0)/30,0),R8C>ROUND(DAYS360(ExpDat,RC1,0)/30,0)),0,OFFSET(R45C,MAX(-MNR,ROUND(DAYS360(ValDat,RC1,0)/30,0)-R8C+MEP-MNR),0,1,1))) -> 0 | X59: =IF(RC1="","",IF(OR(R8C<=ROUND(DAYS360(ValDat,RC1,0)/30,0),R8C>ROUND(DAYS360(ExpDat,RC1,0)/30,0)),0,OFFSET(R45C,MAX(-MNR,ROUND(DAYS360(ValDat,RC1,0)/30,0)-R8C+MEP-MNR),0,1,1))) -> 0 | Y59: =IF(RC1="","",IF(OR(R8C<=ROUND(DAYS360(ValDat,RC1,0)/30,0),R8C>ROUND(DAYS360(ExpDat,RC1,0)/30,0)),0,OFFSET(R45C,MAX(-MNR,ROUND(DAYS360(ValDat,RC1,0)/30,0)-R8C+MEP-MNR),0,1,1))) -> 0 | Z59: =IF(RC1="","",IF(OR(R8C<=ROUND(DAYS360(ValDat,RC1,0)/30,0),R8C>ROUND(DAYS360(ExpDat,RC1,0)/30,0)),0,OFFSET(R45C,MAX(-MNR,ROUND(DAYS360(ValDat,RC1,0)/30,0)-R8C+MEP-MNR),0,1,1))) -> 0 | AA59: =IF(RC1="","",IF(OR(R8C<=ROUND(DAYS360(ValDat,RC1,0)/30,0),R8C>ROUND(DAYS360(ExpDat,RC1,0)/30,0)),0,OFFSET(R45C,MAX(-MNR,ROUND(DAYS360(ValDat,RC1,0)/30,0)-R8C+MEP-MNR),0,1,1))) -> 0 | AB59: =IF(RC1="","",IF(OR(R8C<=ROUND(DAYS360(ValDat,RC1,0)/30,0),R8C>ROUND(DAYS360(ExpDat,RC1,0)/30,0)),0,OFFSET(R45C,MAX(-MNR,ROUND(DAYS360(ValDat,RC1,0)/30,0)-R8C+MEP-MNR),0,1,1))) -> 0 | AC59: =IF(RC1="","",IF(OR(R8C<=ROUND(DAYS360(ValDat,RC1,0)/30,0),R8C>ROUND(DAYS360(ExpDat,RC1,0)/30,0)),0,OFFSET(R45C,MAX(-MNR,ROUND(DAYS360(ValDat,RC1,0)/30,0)-R8C+MEP-MNR),0,1,1))) -> 0 | AD59: =IF(RC1="","",IF(OR(R8C<=ROUND(DAYS360(ValDat,RC1,0)/30,0),R8C>ROUND(DAYS360(ExpDat,RC1,0)/30,0)),0,OFFSET(R45C,MAX(-MNR,ROUND(DAYS360(ValDat,RC1,0)/30,0)-R8C+MEP-MNR),0,1,1))) -> 0 | AE59: =IF(RC1="","",IF(OR(R8C<=ROUND(DAYS360(ValDat,RC1,0)/30,0),R8C>ROUND(DAYS360(ExpDat,RC1,0)/30,0)),0,OFFSET(R45C,MAX(-MNR,ROUND(DAYS360(ValDat,RC1,0)/30,0)-R8C+MEP-MNR),0,1,1))) -> 0 | AF59: =IF(RC1="","",IF(OR(R8C<=ROUND(DAYS360(ValDat,RC1,0)/30,0),R8C>ROUND(DAYS360(ExpDat,RC1,0)/30,0)),0,OFFSET(R45C,MAX(-MNR,ROUND(DAYS360(ValDat,RC1,0)/30,0)-R8C+MEP-MNR),0,1,1))) -> 0 | AG59: =IF(RC1="","",IF(OR(R8C<=ROUND(DAYS360(ValDat,RC1,0)/30,0),R8C>ROUND(DAYS360(ExpDat,RC1,0)/30,0)),0,OFFSET(R45C,MAX(-MNR,ROUND(DAYS360(ValDat,RC1,0)/30,0)-R8C+MEP-MNR),0,1,1))) -> 0 | AH59: =IF(RC1="","",IF(OR(R8C<=ROUND(DAYS360(ValDat,RC1,0)/30,0),R8C>ROUND(DAYS360(ExpDat,RC1,0)/30,0)),0,OFFSET(R45C,MAX(-MNR,ROUND(DAYS360(ValDat,RC1,0)/30,0)-R8C+MEP-MNR),0,1,1))) -> 0 | AI59: =IF(RC1="","",IF(OR(R8C<=ROUND(DAYS360(ValDat,RC1,0)/30,0),R8C>ROUND(DAYS360(ExpDat,RC1,0)/30,0)),0,OFFSET(R45C,MAX(-MNR,ROUND(DAYS360(ValDat,RC1,0)/30,0)-R8C+MEP-MNR),0,1,1))) -> 0 | AJ59: =IF(RC1="","",IF(OR(R8C<=ROUND(DAYS360(ValDat,RC1,0)/30,0),R8C>ROUND(DAYS360(ExpDat,RC1,0)/30,0)),0,OFFSET(R45C,MAX(-MNR,ROUND(DAYS360(ValDat,RC1,0)/30,0)-R8C+MEP-MNR),0,1,1))) -> 0 | AK59: =IF(RC1="","",IF(OR(R8C<=ROUND(DAYS360(ValDat,RC1,0)/30,0),R8C>ROUND(DAYS360(ExpDat,RC1,0)/30,0)),0,OFFSET(R45C,MAX(-MNR,ROUND(DAYS360(ValDat,RC1,0)/30,0)-R8C+MEP-MNR),0,1,1))) -> 0 | AL59: =IF(RC1="","",IF(OR(R8C<=ROUND(DAYS360(ValDat,RC1,0)/30,0),R8C>ROUND(DAYS360(ExpDat,RC1,0)/30,0)),0,OFFSET(R45C,MAX(-MNR,ROUND(DAYS360(ValDat,RC1,0)/30,0)-R8C+MEP-MNR),0,1,1))) -> 0 | AM59: =IF(RC1="","",IF(OR(R8C<=ROUND(DAYS360(ValDat,RC1,0)/30,0),R8C>ROUND(DAYS360(ExpDat,RC1,0)/30,0)),0,OFFSET(R45C,MAX(-MNR,ROUND(DAYS360(ValDat,RC1,0)/30,0)-R8C+MEP-MNR),0,1,1))) -> 0 | AN59: =IF(RC1="","",IF(OR(R8C<=ROUND(DAYS360(ValDat,RC1,0)/30,0),R8C>ROUND(DAYS360(ExpDat,RC1,0)/30,0)),0,OFFSET(R45C,MAX(-MNR,ROUND(DAYS360(ValDat,RC1,0)/30,0)-R8C+MEP-MNR),0,1,1))) -> 0 | AO59: =IF(RC1="","",IF(OR(R8C<=ROUND(DAYS360(ValDat,RC1,0)/30,0),R8C>ROUND(DAYS360(ExpDat,RC1,0)/30,0)),0,OFFSET(R45C,MAX(-MNR,ROUND(DAYS360(ValDat,RC1,0)/30,0)-R8C+MEP-MNR),0,1,1))) -> 0
A60: =IF(R[-1]C="","",IF(DATE(YEAR(R[-1]C),MONTH(R[-1]C)+1,1)>RunDat,"",DATE(YEAR(R[-1]C),MONTH(R[-1]C)+1,1))) -> 1998-10-01T00:00:00.000 | D60: =IF(RC1="","",SUM(RC[2]:RC[37])) -> 98152 | F60: =IF(RC1="","",IF(OR(R8C<=ROUND(DAYS360(ValDat,RC1,0)/30,0),R8C>ROUND(DAYS360(ExpDat,RC1,0)/30,0)),0,OFFSET(R45C,MAX(-MNR,ROUND(DAYS360(ValDat,RC1,0)/30,0)-R8C+MEP-MNR),0,1,1))) -> 30186 | G60: =IF(RC1="","",IF(OR(R8C<=ROUND(DAYS360(ValDat,RC1,0)/30,0),R8C>ROUND(DAYS360(ExpDat,RC1,0)/30,0)),0,OFFSET(R45C,MAX(-MNR,ROUND(DAYS360(ValDat,RC1,0)/30,0)-R8C+MEP-MNR),0,1,1))) -> 67966 | H60: =IF(RC1="","",IF(OR(R8C<=ROUND(DAYS360(ValDat,RC1,0)/30,0),R8C>ROUND(DAYS360(ExpDat,RC1,0)/30,0)),0,OFFSET(R45C,MAX(-MNR,ROUND(DAYS360(ValDat,RC1,0)/30,0)-R8C+MEP-MNR),0,1,1))) -> 0 | I60: =IF(RC1="","",IF(OR(R8C<=ROUND(DAYS360(ValDat,RC1,0)/30,0),R8C>ROUND(DAYS360(ExpDat,RC1,0)/30,0)),0,OFFSET(R45C,MAX(-MNR,ROUND(DAYS360(ValDat,RC1,0)/30,0)-R8C+MEP-MNR),0,1,1))) -> 0 | J60: =IF(RC1="","",IF(OR(R8C<=ROUND(DAYS360(ValDat,RC1,0)/30,0),R8C>ROUND(DAYS360(ExpDat,RC1,0)/30,0)),0,OFFSET(R45C,MAX(-MNR,ROUND(DAYS360(ValDat,RC1,0)/30,0)-R8C+MEP-MNR),0,1,1))) -> 0 | K60: =IF(RC1="","",IF(OR(R8C<=ROUND(DAYS360(ValDat,RC1,0)/30,0),R8C>ROUND(DAYS360(ExpDat,RC1,0)/30,0)),0,OFFSET(R45C,MAX(-MNR,ROUND(DAYS360(ValDat,RC1,0)/30,0)-R8C+MEP-MNR),0,1,1))) -> 0 | L60: =IF(RC1="","",IF(OR(R8C<=ROUND(DAYS360(ValDat,RC1,0)/30,0),R8C>ROUND(DAYS360(ExpDat,RC1,0)/30,0)),0,OFFSET(R45C,MAX(-MNR,ROUND(DAYS360(ValDat,RC1,0)/30,0)-R8C+MEP-MNR),0,1,1))) -> 0 | M60: =IF(RC1="","",IF(OR(R8C<=ROUND(DAYS360(ValDat,RC1,0)/30,0),R8C>ROUND(DAYS360(ExpDat,RC1,0)/30,0)),0,OFFSET(R45C,MAX(-MNR,ROUND(DAYS360(ValDat,RC1,0)/30,0)-R8C+MEP-MNR),0,1,1))) -> 0 | N60: =IF(RC1="","",IF(OR(R8C<=ROUND(DAYS360(ValDat,RC1,0)/30,0),R8C>ROUND(DAYS360(ExpDat,RC1,0)/30,0)),0,OFFSET(R45C,MAX(-MNR,ROUND(DAYS360(ValDat,RC1,0)/30,0)-R8C+MEP-MNR),0,1,1))) -> 0 | O60: =IF(RC1="","",IF(OR(R8C<=ROUND(DAYS360(ValDat,RC1,0)/30,0),R8C>ROUND(DAYS360(ExpDat,RC1,0)/30,0)),0,OFFSET(R45C,MAX(-MNR,ROUND(DAYS360(ValDat,RC1,0)/30,0)-R8C+MEP-MNR),0,1,1))) -> 0 | P60: =IF(RC1="","",IF(OR(R8C<=ROUND(DAYS360(ValDat,RC1,0)/30,0),R8C>ROUND(DAYS360(ExpDat,RC1,0)/30,0)),0,OFFSET(R45C,MAX(-MNR,ROUND(DAYS360(ValDat,RC1,0)/30,0)-R8C+MEP-MNR),0,1,1))) -> 0 | Q60: =IF(RC1="","",IF(OR(R8C<=ROUND(DAYS360(ValDat,RC1,0)/30,0),R8C>ROUND(DAYS360(ExpDat,RC1,0)/30,0)),0,OFFSET(R45C,MAX(-MNR,ROUND(DAYS360(ValDat,RC1,0)/30,0)-R8C+MEP-MNR),0,1,1))) -> 0 | R60: =IF(RC1="","",IF(OR(R8C<=ROUND(DAYS360(ValDat,RC1,0)/30,0),R8C>ROUND(DAYS360(ExpDat,RC1,0)/30,0)),0,OFFSET(R45C,MAX(-MNR,ROUND(DAYS360(ValDat,RC1,0)/30,0)-R8C+MEP-MNR),0,1,1))) -> 0 | S60: =IF(RC1="","",IF(OR(R8C<=ROUND(DAYS360(ValDat,RC1,0)/30,0),R8C>ROUND(DAYS360(ExpDat,RC1,0)/30,0)),0,OFFSET(R45C,MAX(-MNR,ROUND(DAYS360(ValDat,RC1,0)/30,0)-R8C+MEP-MNR),0,1,1))) -> 0 | T60: =IF(RC1="","",IF(OR(R8C<=ROUND(DAYS360(ValDat,RC1,0)/30,0),R8C>ROUND(DAYS360(ExpDat,RC1,0)/30,0)),0,OFFSET(R45C,MAX(-MNR,ROUND(DAYS360(ValDat,RC1,0)/30,0)-R8C+MEP-MNR),0,1,1))) -> 0 | U60: =IF(RC1="","",IF(OR(R8C<=ROUND(DAYS360(ValDat,RC1,0)/30,0),R8C>ROUND(DAYS360(ExpDat,RC1,0)/30,0)),0,OFFSET(R45C,MAX(-MNR,ROUND(DAYS360(ValDat,RC1,0)/30,0)-R8C+MEP-MNR),0,1,1))) -> 0 | V60: =IF(RC1="","",IF(OR(R8C<=ROUND(DAYS360(ValDat,RC1,0)/30,0),R8C>ROUND(DAYS360(ExpDat,RC1,0)/30,0)),0,OFFSET(R45C,MAX(-MNR,ROUND(DAYS360(ValDat,RC1,0)/30,0)-R8C+MEP-MNR),0,1,1))) -> 0 | W60: =IF(RC1="","",IF(OR(R8C<=ROUND(DAYS360(ValDat,RC1,0)/30,0),R8C>ROUND(DAYS360(ExpDat,RC1,0)/30,0)),0,OFFSET(R45C,MAX(-MNR,ROUND(DAYS360(ValDat,RC1,0)/30,0)-R8C+MEP-MNR),0,1,1))) -> 0 | X60: =IF(RC1="","",IF(OR(R8C<=ROUND(DAYS360(ValDat,RC1,0)/30,0),R8C>ROUND(DAYS360(ExpDat,RC1,0)/30,0)),0,OFFSET(R45C,MAX(-MNR,ROUND(DAYS360(ValDat,RC1,0)/30,0)-R8C+MEP-MNR),0,1,1))) -> 0 | Y60: =IF(RC1="","",IF(OR(R8C<=ROUND(DAYS360(ValDat,RC1,0)/30,0),R8C>ROUND(DAYS360(ExpDat,RC1,0)/30,0)),0,OFFSET(R45C,MAX(-MNR,ROUND(DAYS360(ValDat,RC1,0)/30,0)-R8C+MEP-MNR),0,1,1))) -> 0 | Z60: =IF(RC1="","",IF(OR(R8C<=ROUND(DAYS360(ValDat,RC1,0)/30,0),R8C>ROUND(DAYS360(ExpDat,RC1,0)/30,0)),0,OFFSET(R45C,MAX(-MNR,ROUND(DAYS360(ValDat,RC1,0)/30,0)-R8C+MEP-MNR),0,1,1))) -> 0 | AA60: =IF(RC1="","",IF(OR(R8C<=ROUND(DAYS360(ValDat,RC1,0)/30,0),R8C>ROUND(DAYS360(ExpDat,RC1,0)/30,0)),0,OFFSET(R45C,MAX(-MNR,ROUND(DAYS360(ValDat,RC1,0)/30,0)-R8C+MEP-MNR),0,1,1))) -> 0 | AB60: =IF(RC1="","",IF(OR(R8C<=ROUND(DAYS360(ValDat,RC1,0)/30,0),R8C>ROUND(DAYS360(ExpDat,RC1,0)/30,0)),0,OFFSET(R45C,MAX(-MNR,ROUND(DAYS360(ValDat,RC1,0)/30,0)-R8C+MEP-MNR),0,1,1))) -> 0 | AC60: =IF(RC1="","",IF(OR(R8C<=ROUND(DAYS360(ValDat,RC1,0)/30,0),R8C>ROUND(DAYS360(ExpDat,RC1,0)/30,0)),0,OFFSET(R45C,MAX(-MNR,ROUND(DAYS360(ValDat,RC1,0)/30,0)-R8C+MEP-MNR),0,1,1))) -> 0 | AD60: =IF(RC1="","",IF(OR(R8C<=ROUND(DAYS360(ValDat,RC1,0)/30,0),R8C>ROUND(DAYS360(ExpDat,RC1,0)/30,0)),0,OFFSET(R45C,MAX(-MNR,ROUND(DAYS360(ValDat,RC1,0)/30,0)-R8C+MEP-MNR),0,1,1))) -> 0 | AE60: =IF(RC1="","",IF(OR(R8C<=ROUND(DAYS360(ValDat,RC1,0)/30,0),R8C>ROUND(DAYS360(ExpDat,RC1,0)/30,0)),0,OFFSET(R45C,MAX(-MNR,ROUND(DAYS360(ValDat,RC1,0)/30,0)-R8C+MEP-MNR),0,1,1))) -> 0 | AF60: =IF(RC1="","",IF(OR(R8C<=ROUND(DAYS360(ValDat,RC1,0)/30,0),R8C>ROUND(DAYS360(ExpDat,RC1,0)/30,0)),0,OFFSET(R45C,MAX(-MNR,ROUND(DAYS360(ValDat,RC1,0)/30,0)-R8C+MEP-MNR),0,1,1))) -> 0 | AG60: =IF(RC1="","",IF(OR(R8C<=ROUND(DAYS360(ValDat,RC1,0)/30,0),R8C>ROUND(DAYS360(ExpDat,RC1,0)/30,0)),0,OFFSET(R45C,MAX(-MNR,ROUND(DAYS360(ValDat,RC1,0)/30,0)-R8C+MEP-MNR),0,1,1))) -> 0 | AH60: =IF(RC1="","",IF(OR(R8C<=ROUND(DAYS360(ValDat,RC1,0)/30,0),R8C>ROUND(DAYS360(ExpDat,RC1,0)/30,0)),0,OFFSET(R45C,MAX(-MNR,ROUND(DAYS360(ValDat,RC1,0)/30,0)-R8C+MEP-MNR),0,1,1))) -> 0 | AI60: =IF(RC1="","",IF(OR(R8C<=ROUND(DAYS360(ValDat,RC1,0)/30,0),R8C>ROUND(DAYS360(ExpDat,RC1,0)/30,0)),0,OFFSET(R45C,MAX(-MNR,ROUND(DAYS360(ValDat,RC1,0)/30,0)-R8C+MEP-MNR),0,1,1))) -> 0 | AJ60: =IF(RC1="","",IF(OR(R8C<=ROUND(DAYS360(ValDat,RC1,0)/30,0),R8C>ROUND(DAYS360(ExpDat,RC1,0)/30,0)),0,OFFSET(R45C,MAX(-MNR,ROUND(DAYS360(ValDat,RC1,0)/30,0)-R8C+MEP-MNR),0,1,1))) -> 0 | AK60: =IF(RC1="","",IF(OR(R8C<=ROUND(DAYS360(ValDat,RC1,0)/30,0),R8C>ROUND(DAYS360(ExpDat,RC1,0)/30,0)),0,OFFSET(R45C,MAX(-MNR,ROUND(DAYS360(ValDat,RC1,0)/30,0)-R8C+MEP-MNR),0,1,1))) -> 0 | AL60: =IF(RC1="","",IF(OR(R8C<=ROUND(DAYS360(ValDat,RC1,0)/30,0),R8C>ROUND(DAYS360(ExpDat,RC1,0)/30,0)),0,OFFSET(R45C,MAX(-MNR,ROUND(DAYS360(ValDat,RC1,0)/30,0)-R8C+MEP-MNR),0,1,1))) -> 0 | AM60: =IF(RC1="","",IF(OR(R8C<=ROUND(DAYS360(ValDat,RC1,0)/30,0),R8C>ROUND(DAYS360(ExpDat,RC1,0)/30,0)),0,OFFSET(R45C,MAX(-MNR,ROUND(DAYS360(ValDat,RC1,0)/30,0)-R8C+MEP-MNR),0,1,1))) -> 0 | AN60: =IF(RC1="","",IF(OR(R8C<=ROUND(DAYS360(ValDat,RC1,0)/30,0),R8C>ROUND(DAYS360(ExpDat,RC1,0)/30,0)),0,OFFSET(R45C,MAX(-MNR,ROUND(DAYS360(ValDat,RC1,0)/30,0)-R8C+MEP-MNR),0,1,1))) -> 0 | AO60: =IF(RC1="","",IF(OR(R8C<=ROUND(DAYS360(ValDat,RC1,0)/30,0),R8C>ROUND(DAYS360(ExpDat,RC1,0)/30,0)),0,OFFSET(R45C,MAX(-MNR,ROUND(DAYS360(ValDat,RC1,0)/30,0)-R8C+MEP-MNR),0,1,1))) -> 0
A61: =IF(R[-1]C="","",IF(DATE(YEAR(R[-1]C),MONTH(R[-1]C)+1,1)>RunDat,"",DATE(YEAR(R[-1]C),MONTH(R[-1]C)+1,1))) -> 1998-11-01T00:00:00.000 | D61: =IF(RC1="","",SUM(RC[2]:RC[37])) -> 207773 | F61: =IF(RC1="","",IF(OR(R8C<=ROUND(DAYS360(ValDat,RC1,0)/30,0),R8C>ROUND(DAYS360(ExpDat,RC1,0)/30,0)),0,OFFSET(R45C,MAX(-MNR,ROUND(DAYS360(ValDat,RC1,0)/30,0)-R8C+MEP-MNR),0,1,1))) -> 49927 | G61: =IF(RC1="","",IF(OR(R8C<=ROUND(DAYS360(ValDat,RC1,0)/30,0),R8C>ROUND(DAYS360(ExpDat,RC1,0)/30,0)),0,OFFSET(R45C,MAX(-MNR,ROUND(DAYS360(ValDat,RC1,0)/30,0)-R8C+MEP-MNR),0,1,1))) -> 157846 | H61: =IF(RC1="","",IF(OR(R8C<=ROUND(DAYS360(ValDat,RC1,0)/30,0),R8C>ROUND(DAYS360(ExpDat,RC1,0)/30,0)),0,OFFSET(R45C,MAX(-MNR,ROUND(DAYS360(ValDat,RC1,0)/30,0)-R8C+MEP-MNR),0,1,1))) -> 0 | I61: =IF(RC1="","",IF(OR(R8C<=ROUND(DAYS360(ValDat,RC1,0)/30,0),R8C>ROUND(DAYS360(ExpDat,RC1,0)/30,0)),0,OFFSET(R45C,MAX(-MNR,ROUND(DAYS360(ValDat,RC1,0)/30,0)-R8C+MEP-MNR),0,1,1))) -> 0 | J61: =IF(RC1="","",IF(OR(R8C<=ROUND(DAYS360(ValDat,RC1,0)/30,0),R8C>ROUND(DAYS360(ExpDat,RC1,0)/30,0)),0,OFFSET(R45C,MAX(-MNR,ROUND(DAYS360(ValDat,RC1,0)/30,0)-R8C+MEP-MNR),0,1,1))) -> 0 | K61: =IF(RC1="","",IF(OR(R8C<=ROUND(DAYS360(ValDat,RC1,0)/30,0),R8C>ROUND(DAYS360(ExpDat,RC1,0)/30,0)),0,OFFSET(R45C,MAX(-MNR,ROUND(DAYS360(ValDat,RC1,0)/30,0)-R8C+MEP-MNR),0,1,1))) -> 0 | L61: =IF(RC1="","",IF(OR(R8C<=ROUND(DAYS360(ValDat,RC1,0)/30,0),R8C>ROUND(DAYS360(ExpDat,RC1,0)/30,0)),0,OFFSET(R45C,MAX(-MNR,ROUND(DAYS360(ValDat,RC1,0)/30,0)-R8C+MEP-MNR),0,1,1))) -> 0 | M61: =IF(RC1="","",IF(OR(R8C<=ROUND(DAYS360(ValDat,RC1,0)/30,0),R8C>ROUND(DAYS360(ExpDat,RC1,0)/30,0)),0,OFFSET(R45C,MAX(-MNR,ROUND(DAYS360(ValDat,RC1,0)/30,0)-R8C+MEP-MNR),0,1,1))) -> 0 | N61: =IF(RC1="","",IF(OR(R8C<=ROUND(DAYS360(ValDat,RC1,0)/30,0),R8C>ROUND(DAYS360(ExpDat,RC1,0)/30,0)),0,OFFSET(R45C,MAX(-MNR,ROUND(DAYS360(ValDat,RC1,0)/30,0)-R8C+MEP-MNR),0,1,1))) -> 0 | O61: =IF(RC1="","",IF(OR(R8C<=ROUND(DAYS360(ValDat,RC1,0)/30,0),R8C>ROUND(DAYS360(ExpDat,RC1,0)/30,0)),0,OFFSET(R45C,MAX(-MNR,ROUND(DAYS360(ValDat,RC1,0)/30,0)-R8C+MEP-MNR),0,1,1))) -> 0 | P61: =IF(RC1="","",IF(OR(R8C<=ROUND(DAYS360(ValDat,RC1,0)/30,0),R8C>ROUND(DAYS360(ExpDat,RC1,0)/30,0)),0,OFFSET(R45C,MAX(-MNR,ROUND(DAYS360(ValDat,RC1,0)/30,0)-R8C+MEP-MNR),0,1,1))) -> 0 | Q61: =IF(RC1="","",IF(OR(R8C<=ROUND(DAYS360(ValDat,RC1,0)/30,0),R8C>ROUND(DAYS360(ExpDat,RC1,0)/30,0)),0,OFFSET(R45C,MAX(-MNR,ROUND(DAYS360(ValDat,RC1,0)/30,0)-R8C+MEP-MNR),0,1,1))) -> 0 | R61: =IF(RC1="","",IF(OR(R8C<=ROUND(DAYS360(ValDat,RC1,0)/30,0),R8C>ROUND(DAYS360(ExpDat,RC1,0)/30,0)),0,OFFSET(R45C,MAX(-MNR,ROUND(DAYS360(ValDat,RC1,0)/30,0)-R8C+MEP-MNR),0,1,1))) -> 0 | S61: =IF(RC1="","",IF(OR(R8C<=ROUND(DAYS360(ValDat,RC1,0)/30,0),R8C>ROUND(DAYS360(ExpDat,RC1,0)/30,0)),0,OFFSET(R45C,MAX(-MNR,ROUND(DAYS360(ValDat,RC1,0)/30,0)-R8C+MEP-MNR),0,1,1))) -> 0 | T61: =IF(RC1="","",IF(OR(R8C<=ROUND(DAYS360(ValDat,RC1,0)/30,0),R8C>ROUND(DAYS360(ExpDat,RC1,0)/30,0)),0,OFFSET(R45C,MAX(-MNR,ROUND(DAYS360(ValDat,RC1,0)/30,0)-R8C+MEP-MNR),0,1,1))) -> 0 | U61: =IF(RC1="","",IF(OR(R8C<=ROUND(DAYS360(ValDat,RC1,0)/30,0),R8C>ROUND(DAYS360(ExpDat,RC1,0)/30,0)),0,OFFSET(R45C,MAX(-MNR,ROUND(DAYS360(ValDat,RC1,0)/30,0)-R8C+MEP-MNR),0,1,1))) -> 0 | V61: =IF(RC1="","",IF(OR(R8C<=ROUND(DAYS360(ValDat,RC1,0)/30,0),R8C>ROUND(DAYS360(ExpDat,RC1,0)/30,0)),0,OFFSET(R45C,MAX(-MNR,ROUND(DAYS360(ValDat,RC1,0)/30,0)-R8C+MEP-MNR),0,1,1))) -> 0 | W61: =IF(RC1="","",IF(OR(R8C<=ROUND(DAYS360(ValDat,RC1,0)/30,0),R8C>ROUND(DAYS360(ExpDat,RC1,0)/30,0)),0,OFFSET(R45C,MAX(-MNR,ROUND(DAYS360(ValDat,RC1,0)/30,0)-R8C+MEP-MNR),0,1,1))) -> 0 | X61: =IF(RC1="","",IF(OR(R8C<=ROUND(DAYS360(ValDat,RC1,0)/30,0),R8C>ROUND(DAYS360(ExpDat,RC1,0)/30,0)),0,OFFSET(R45C,MAX(-MNR,ROUND(DAYS360(ValDat,RC1,0)/30,0)-R8C+MEP-MNR),0,1,1))) -> 0 | Y61: =IF(RC1="","",IF(OR(R8C<=ROUND(DAYS360(ValDat,RC1,0)/30,0),R8C>ROUND(DAYS360(ExpDat,RC1,0)/30,0)),0,OFFSET(R45C,MAX(-MNR,ROUND(DAYS360(ValDat,RC1,0)/30,0)-R8C+MEP-MNR),0,1,1))) -> 0 | Z61: =IF(RC1="","",IF(OR(R8C<=ROUND(DAYS360(ValDat,RC1,0)/30,0),R8C>ROUND(DAYS360(ExpDat,RC1,0)/30,0)),0,OFFSET(R45C,MAX(-MNR,ROUND(DAYS360(ValDat,RC1,0)/30,0)-R8C+MEP-MNR),0,1,1))) -> 0 | AA61: =IF(RC1="","",IF(OR(R8C<=ROUND(DAYS360(ValDat,RC1,0)/30,0),R8C>ROUND(DAYS360(ExpDat,RC1,0)/30,0)),0,OFFSET(R45C,MAX(-MNR,ROUND(DAYS360(ValDat,RC1,0)/30,0)-R8C+MEP-MNR),0,1,1))) -> 0 | AB61: =IF(RC1="","",IF(OR(R8C<=ROUND(DAYS360(ValDat,RC1,0)/30,0),R8C>ROUND(DAYS360(ExpDat,RC1,0)/30,0)),0,OFFSET(R45C,MAX(-MNR,ROUND(DAYS360(ValDat,RC1,0)/30,0)-R8C+MEP-MNR),0,1,1))) -> 0 | AC61: =IF(RC1="","",IF(OR(R8C<=ROUND(DAYS360(ValDat,RC1,0)/30,0),R8C>ROUND(DAYS360(ExpDat,RC1,0)/30,0)),0,OFFSET(R45C,MAX(-MNR,ROUND(DAYS360(ValDat,RC1,0)/30,0)-R8C+MEP-MNR),0,1,1))) -> 0 | AD61: =IF(RC1="","",IF(OR(R8C<=ROUND(DAYS360(ValDat,RC1,0)/30,0),R8C>ROUND(DAYS360(ExpDat,RC1,0)/30,0)),0,OFFSET(R45C,MAX(-MNR,ROUND(DAYS360(ValDat,RC1,0)/30,0)-R8C+MEP-MNR),0,1,1))) -> 0 | AE61: =IF(RC1="","",IF(OR(R8C<=ROUND(DAYS360(ValDat,RC1,0)/30,0),R8C>ROUND(DAYS360(ExpDat,RC1,0)/30,0)),0,OFFSET(R45C,MAX(-MNR,ROUND(DAYS360(ValDat,RC1,0)/30,0)-R8C+MEP-MNR),0,1,1))) -> 0 | AF61: =IF(RC1="","",IF(OR(R8C<=ROUND(DAYS360(ValDat,RC1,0)/30,0),R8C>ROUND(DAYS360(ExpDat,RC1,0)/30,0)),0,OFFSET(R45C,MAX(-MNR,ROUND(DAYS360(ValDat,RC1,0)/30,0)-R8C+MEP-MNR),0,1,1))) -> 0 | AG61: =IF(RC1="","",IF(OR(R8C<=ROUND(DAYS360(ValDat,RC1,0)/30,0),R8C>ROUND(DAYS360(ExpDat,RC1,0)/30,0)),0,OFFSET(R45C,MAX(-MNR,ROUND(DAYS360(ValDat,RC1,0)/30,0)-R8C+MEP-MNR),0,1,1))) -> 0 | AH61: =IF(RC1="","",IF(OR(R8C<=ROUND(DAYS360(ValDat,RC1,0)/30,0),R8C>ROUND(DAYS360(ExpDat,RC1,0)/30,0)),0,OFFSET(R45C,MAX(-MNR,ROUND(DAYS360(ValDat,RC1,0)/30,0)-R8C+MEP-MNR),0,1,1))) -> 0 | AI61: =IF(RC1="","",IF(OR(R8C<=ROUND(DAYS360(ValDat,RC1,0)/30,0),R8C>ROUND(DAYS360(ExpDat,RC1,0)/30,0)),0,OFFSET(R45C,MAX(-MNR,ROUND(DAYS360(ValDat,RC1,0)/30,0)-R8C+MEP-MNR),0,1,1))) -> 0 | AJ61: =IF(RC1="","",IF(OR(R8C<=ROUND(DAYS360(ValDat,RC1,0)/30,0),R8C>ROUND(DAYS360(ExpDat,RC1,0)/30,0)),0,OFFSET(R45C,MAX(-MNR,ROUND(DAYS360(ValDat,RC1,0)/30,0)-R8C+MEP-MNR),0,1,1))) -> 0 | AK61: =IF(RC1="","",IF(OR(R8C<=ROUND(DAYS360(ValDat,RC1,0)/30,0),R8C>ROUND(DAYS360(ExpDat,RC1,0)/30,0)),0,OFFSET(R45C,MAX(-MNR,ROUND(DAYS360(ValDat,RC1,0)/30,0)-R8C+MEP-MNR),0,1,1))) -> 0 | AL61: =IF(RC1="","",IF(OR(R8C<=ROUND(DAYS360(ValDat,RC1,0)/30,0),R8C>ROUND(DAYS360(ExpDat,RC1,0)/30,0)),0,OFFSET(R45C,MAX(-MNR,ROUND(DAYS360(ValDat,RC1,0)/30,0)-R8C+MEP-MNR),0,1,1))) -> 0 | AM61: =IF(RC1="","",IF(OR(R8C<=ROUND(DAYS360(ValDat,RC1,0)/30,0),R8C>ROUND(DAYS360(ExpDat,RC1,0)/30,0)),0,OFFSET(R45C,MAX(-MNR,ROUND(DAYS360(ValDat,RC1,0)/30,0)-R8C+MEP-MNR),0,1,1))) -> 0 | AN61: =IF(RC1="","",IF(OR(R8C<=ROUND(DAYS360(ValDat,RC1,0)/30,0),R8C>ROUND(DAYS360(ExpDat,RC1,0)/30,0)),0,OFFSET(R45C,MAX(-MNR,ROUND(DAYS360(ValDat,RC1,0)/30,0)-R8C+MEP-MNR),0,1,1))) -> 0 | AO61: =IF(RC1="","",IF(OR(R8C<=ROUND(DAYS360(ValDat,RC1,0)/30,0),R8C>ROUND(DAYS360(ExpDat,RC1,0)/30,0)),0,OFFSET(R45C,MAX(-MNR,ROUND(DAYS360(ValDat,RC1,0)/30,0)-R8C+MEP-MNR),0,1,1))) -> 0
A62: =IF(R[-1]C="","",IF(DATE(YEAR(R[-1]C),MONTH(R[-1]C)+1,1)>RunDat,"",DATE(YEAR(R[-1]C),MONTH(R[-1]C)+1,1))) -> 1998-12-01T00:00:00.000 | D62: =IF(RC1="","",SUM(RC[2]:RC[37])) -> 200876 | F62: =IF(RC1="","",IF(OR(R8C<=ROUND(DAYS360(ValDat,RC1,0)/30,0),R8C>ROUND(DAYS360(ExpDat,RC1,0)/30,0)),0,OFFSET(R45C,MAX(-MNR,ROUND(DAYS360(ValDat,RC1,0)/30,0)-R8C+MEP-MNR),0,1,1))) -> 6022 | G62: =IF(RC1="","",IF(OR(R8C<=ROUND(DAYS360(ValDat,RC1,0)/30,0),R8C>ROUND(DAYS360(ExpDat,RC1,0)/30,0)),0,OFFSET(R45C,MAX(-MNR,ROUND(DAYS360(ValDat,RC1,0)/30,0)-R8C+MEP-MNR),0,1,1))) -> 140535 | H62: =IF(RC1="","",IF(OR(R8C<=ROUND(DAYS360(ValDat,RC1,0)/30,0),R8C>ROUND(DAYS360(ExpDat,RC1,0)/30,0)),0,OFFSET(R45C,MAX(-MNR,ROUND(DAYS360(ValDat,RC1,0)/30,0)-R8C+MEP-MNR),0,1,1))) -> 54319 | I62: =IF(RC1="","",IF(OR(R8C<=ROUND(DAYS360(ValDat,RC1,0)/30,0),R8C>ROUND(DAYS360(ExpDat,RC1,0)/30,0)),0,OFFSET(R45C,MAX(-MNR,ROUND(DAYS360(ValDat,RC1,0)/30,0)-R8C+MEP-MNR),0,1,1))) -> 0 | J62: =IF(RC1="","",IF(OR(R8C<=ROUND(DAYS360(ValDat,RC1,0)/30,0),R8C>ROUND(DAYS360(ExpDat,RC1,0)/30,0)),0,OFFSET(R45C,MAX(-MNR,ROUND(DAYS360(ValDat,RC1,0)/30,0)-R8C+MEP-MNR),0,1,1))) -> 0 | K62: =IF(RC1="","",IF(OR(R8C<=ROUND(DAYS360(ValDat,RC1,0)/30,0),R8C>ROUND(DAYS360(ExpDat,RC1,0)/30,0)),0,OFFSET(R45C,MAX(-MNR,ROUND(DAYS360(ValDat,RC1,0)/30,0)-R8C+MEP-MNR),0,1,1))) -> 0 | L62: =IF(RC1="","",IF(OR(R8C<=ROUND(DAYS360(ValDat,RC1,0)/30,0),R8C>ROUND(DAYS360(ExpDat,RC1,0)/30,0)),0,OFFSET(R45C,MAX(-MNR,ROUND(DAYS360(ValDat,RC1,0)/30,0)-R8C+MEP-MNR),0,1,1))) -> 0 | M62: =IF(RC1="","",IF(OR(R8C<=ROUND(DAYS360(ValDat,RC1,0)/30,0),R8C>ROUND(DAYS360(ExpDat,RC1,0)/30,0)),0,OFFSET(R45C,MAX(-MNR,ROUND(DAYS360(ValDat,RC1,0)/30,0)-R8C+MEP-MNR),0,1,1))) -> 0 | N62: =IF(RC1="","",IF(OR(R8C<=ROUND(DAYS360(ValDat,RC1,0)/30,0),R8C>ROUND(DAYS360(ExpDat,RC1,0)/30,0)),0,OFFSET(R45C,MAX(-MNR,ROUND(DAYS360(ValDat,RC1,0)/30,0)-R8C+MEP-MNR),0,1,1))) -> 0 | O62: =IF(RC1="","",IF(OR(R8C<=ROUND(DAYS360(ValDat,RC1,0)/30,0),R8C>ROUND(DAYS360(ExpDat,RC1,0)/30,0)),0,OFFSET(R45C,MAX(-MNR,ROUND(DAYS360(ValDat,RC1,0)/30,0)-R8C+MEP-MNR),0,1,1))) -> 0 | P62: =IF(RC1="","",IF(OR(R8C<=ROUND(DAYS360(ValDat,RC1,0)/30,0),R8C>ROUND(DAYS360(ExpDat,RC1,0)/30,0)),0,OFFSET(R45C,MAX(-MNR,ROUND(DAYS360(ValDat,RC1,0)/30,0)-R8C+MEP-MNR),0,1,1))) -> 0 | Q62: =IF(RC1="","",IF(OR(R8C<=ROUND(DAYS360(ValDat,RC1,0)/30,0),R8C>ROUND(DAYS360(ExpDat,RC1,0)/30,0)),0,OFFSET(R45C,MAX(-MNR,ROUND(DAYS360(ValDat,RC1,0)/30,0)-R8C+MEP-MNR),0,1,1))) -> 0 | R62: =IF(RC1="","",IF(OR(R8C<=ROUND(DAYS360(ValDat,RC1,0)/30,0),R8C>ROUND(DAYS360(ExpDat,RC1,0)/30,0)),0,OFFSET(R45C,MAX(-MNR,ROUND(DAYS360(ValDat,RC1,0)/30,0)-R8C+MEP-MNR),0,1,1))) -> 0 | S62: =IF(RC1="","",IF(OR(R8C<=ROUND(DAYS360(ValDat,RC1,0)/30,0),R8C>ROUND(DAYS360(ExpDat,RC1,0)/30,0)),0,OFFSET(R45C,MAX(-MNR,ROUND(DAYS360(ValDat,RC1,0)/30,0)-R8C+MEP-MNR),0,1,1))) -> 0 | T62: =IF(RC1="","",IF(OR(R8C<=ROUND(DAYS360(ValDat,RC1,0)/30,0),R8C>ROUND(DAYS360(ExpDat,RC1,0)/30,0)),0,OFFSET(R45C,MAX(-MNR,ROUND(DAYS360(ValDat,RC1,0)/30,0)-R8C+MEP-MNR),0,1,1))) -> 0 | U62: =IF(RC1="","",IF(OR(R8C<=ROUND(DAYS360(ValDat,RC1,0)/30,0),R8C>ROUND(DAYS360(ExpDat,RC1,0)/30,0)),0,OFFSET(R45C,MAX(-MNR,ROUND(DAYS360(ValDat,RC1,0)/30,0)-R8C+MEP-MNR),0,1,1))) -> 0 | V62: =IF(RC1="","",IF(OR(R8C<=ROUND(DAYS360(ValDat,RC1,0)/30,0),R8C>ROUND(DAYS360(ExpDat,RC1,0)/30,0)),0,OFFSET(R45C,MAX(-MNR,ROUND(DAYS360(ValDat,RC1,0)/30,0)-R8C+MEP-MNR),0,1,1))) -> 0 | W62: =IF(RC1="","",IF(OR(R8C<=ROUND(DAYS360(ValDat,RC1,0)/30,0),R8C>ROUND(DAYS360(ExpDat,RC1,0)/30,0)),0,OFFSET(R45C,MAX(-MNR,ROUND(DAYS360(ValDat,RC1,0)/30,0)-R8C+MEP-MNR),0,1,1))) -> 0 | X62: =IF(RC1="","",IF(OR(R8C<=ROUND(DAYS360(ValDat,RC1,0)/30,0),R8C>ROUND(DAYS360(ExpDat,RC1,0)/30,0)),0,OFFSET(R45C,MAX(-MNR,ROUND(DAYS360(ValDat,RC1,0)/30,0)-R8C+MEP-MNR),0,1,1))) -> 0 | Y62: =IF(RC1="","",IF(OR(R8C<=ROUND(DAYS360(ValDat,RC1,0)/30,0),R8C>ROUND(DAYS360(ExpDat,RC1,0)/30,0)),0,OFFSET(R45C,MAX(-MNR,ROUND(DAYS360(ValDat,RC1,0)/30,0)-R8C+MEP-MNR),0,1,1))) -> 0 | Z62: =IF(RC1="","",IF(OR(R8C<=ROUND(DAYS360(ValDat,RC1,0)/30,0),R8C>ROUND(DAYS360(ExpDat,RC1,0)/30,0)),0,OFFSET(R45C,MAX(-MNR,ROUND(DAYS360(ValDat,RC1,0)/30,0)-R8C+MEP-MNR),0,1,1))) -> 0 | AA62: =IF(RC1="","",IF(OR(R8C<=ROUND(DAYS360(ValDat,RC1,0)/30,0),R8C>ROUND(DAYS360(ExpDat,RC1,0)/30,0)),0,OFFSET(R45C,MAX(-MNR,ROUND(DAYS360(ValDat,RC1,0)/30,0)-R8C+MEP-MNR),0,1,1))) -> 0 | AB62: =IF(RC1="","",IF(OR(R8C<=ROUND(DAYS360(ValDat,RC1,0)/30,0),R8C>ROUND(DAYS360(ExpDat,RC1,0)/30,0)),0,OFFSET(R45C,MAX(-MNR,ROUND(DAYS360(ValDat,RC1,0)/30,0)-R8C+MEP-MNR),0,1,1))) -> 0 | AC62: =IF(RC1="","",IF(OR(R8C<=ROUND(DAYS360(ValDat,RC1,0)/30,0),R8C>ROUND(DAYS360(ExpDat,RC1,0)/30,0)),0,OFFSET(R45C,MAX(-MNR,ROUND(DAYS360(ValDat,RC1,0)/30,0)-R8C+MEP-MNR),0,1,1))) -> 0 | AD62: =IF(RC1="","",IF(OR(R8C<=ROUND(DAYS360(ValDat,RC1,0)/30,0),R8C>ROUND(DAYS360(ExpDat,RC1,0)/30,0)),0,OFFSET(R45C,MAX(-MNR,ROUND(DAYS360(ValDat,RC1,0)/30,0)-R8C+MEP-MNR),0,1,1))) -> 0 | AE62: =IF(RC1="","",IF(OR(R8C<=ROUND(DAYS360(ValDat,RC1,0)/30,0),R8C>ROUND(DAYS360(ExpDat,RC1,0)/30,0)),0,OFFSET(R45C,MAX(-MNR,ROUND(DAYS360(ValDat,RC1,0)/30,0)-R8C+MEP-MNR),0,1,1))) -> 0 | AF62: =IF(RC1="","",IF(OR(R8C<=ROUND(DAYS360(ValDat,RC1,0)/30,0),R8C>ROUND(DAYS360(ExpDat,RC1,0)/30,0)),0,OFFSET(R45C,MAX(-MNR,ROUND(DAYS360(ValDat,RC1,0)/30,0)-R8C+MEP-MNR),0,1,1))) -> 0 | AG62: =IF(RC1="","",IF(OR(R8C<=ROUND(DAYS360(ValDat,RC1,0)/30,0),R8C>ROUND(DAYS360(ExpDat,RC1,0)/30,0)),0,OFFSET(R45C,MAX(-MNR,ROUND(DAYS360(ValDat,RC1,0)/30,0)-R8C+MEP-MNR),0,1,1))) -> 0 | AH62: =IF(RC1="","",IF(OR(R8C<=ROUND(DAYS360(ValDat,RC1,0)/30,0),R8C>ROUND(DAYS360(ExpDat,RC1,0)/30,0)),0,OFFSET(R45C,MAX(-MNR,ROUND(DAYS360(ValDat,RC1,0)/30,0)-R8C+MEP-MNR),0,1,1))) -> 0 | AI62: =IF(RC1="","",IF(OR(R8C<=ROUND(DAYS360(ValDat,RC1,0)/30,0),R8C>ROUND(DAYS360(ExpDat,RC1,0)/30,0)),0,OFFSET(R45C,MAX(-MNR,ROUND(DAYS360(ValDat,RC1,0)/30,0)-R8C+MEP-MNR),0,1,1))) -> 0 | AJ62: =IF(RC1="","",IF(OR(R8C<=ROUND(DAYS360(ValDat,RC1,0)/30,0),R8C>ROUND(DAYS360(ExpDat,RC1,0)/30,0)),0,OFFSET(R45C,MAX(-MNR,ROUND(DAYS360(ValDat,RC1,0)/30,0)-R8C+MEP-MNR),0,1,1))) -> 0 | AK62: =IF(RC1="","",IF(OR(R8C<=ROUND(DAYS360(ValDat,RC1,0)/30,0),R8C>ROUND(DAYS360(ExpDat,RC1,0)/30,0)),0,OFFSET(R45C,MAX(-MNR,ROUND(DAYS360(ValDat,RC1,0)/30,0)-R8C+MEP-MNR),0,1,1))) -> 0 | AL62: =IF(RC1="","",IF(OR(R8C<=ROUND(DAYS360(ValDat,RC1,0)/30,0),R8C>ROUND(DAYS360(ExpDat,RC1,0)/30,0)),0,OFFSET(R45C,MAX(-MNR,ROUND(DAYS360(ValDat,RC1,0)/30,0)-R8C+MEP-MNR),0,1,1))) -> 0 | AM62: =IF(RC1="","",IF(OR(R8C<=ROUND(DAYS360(ValDat,RC1,0)/30,0),R8C>ROUND(DAYS360(ExpDat,RC1,0)/30,0)),0,OFFSET(R45C,MAX(-MNR,ROUND(DAYS360(ValDat,RC1,0)/30,0)-R8C+MEP-MNR),0,1,1))) -> 0 | AN62: =IF(RC1="","",IF(OR(R8C<=ROUND(DAYS360(ValDat,RC1,0)/30,0),R8C>ROUND(DAYS360(ExpDat,RC1,0)/30,0)),0,OFFSET(R45C,MAX(-MNR,ROUND(DAYS360(ValDat,RC1,0)/30,0)-R8C+MEP-MNR),0,1,1))) -> 0 | AO62: =IF(RC1="","",IF(OR(R8C<=ROUND(DAYS360(ValDat,RC1,0)/30,0),R8C>ROUND(DAYS360(ExpDat,RC1,0)/30,0)),0,OFFSET(R45C,MAX(-MNR,ROUND(DAYS360(ValDat,RC1,0)/30,0)-R8C+MEP-MNR),0,1,1))) -> 0
A63: =IF(R[-1]C="","",IF(DATE(YEAR(R[-1]C),MONTH(R[-1]C)+1,1)>RunDat,"",DATE(YEAR(R[-1]C),MONTH(R[-1]C)+1,1))) -> 1999-01-01T00:00:00.000 | D63: =IF(RC1="","",SUM(RC[2]:RC[37])) -> 188191 | F63: =IF(RC1="","",IF(OR(R8C<=ROUND(DAYS360(ValDat,RC1,0)/30,0),R8C>ROUND(DAYS360(ExpDat,RC1,0)/30,0)),0,OFFSET(R45C,MAX(-MNR,ROUND(DAYS360(ValDat,RC1,0)/30,0)-R8C+MEP-MNR),0,1,1))) -> 31494 | G63: =IF(RC1="","",IF(OR(R8C<=ROUND(DAYS360(ValDat,RC1,0)/30,0),R8C>ROUND(DAYS360(ExpDat,RC1,0)/30,0)),0,OFFSET(R45C,MAX(-MNR,ROUND(DAYS360(ValDat,RC1,0)/30,0)-R8C+MEP-MNR),0,1,1))) -> 55145 | H63: =IF(RC1="","",IF(OR(R8C<=ROUND(DAYS360(ValDat,RC1,0)/30,0),R8C>ROUND(DAYS360(ExpDat,RC1,0)/30,0)),0,OFFSET(R45C,MAX(-MNR,ROUND(DAYS360(ValDat,RC1,0)/30,0)-R8C+MEP-MNR),0,1,1))) -> 51889 | I63: =IF(RC1="","",IF(OR(R8C<=ROUND(DAYS360(ValDat,RC1,0)/30,0),R8C>ROUND(DAYS360(ExpDat,RC1,0)/30,0)),0,OFFSET(R45C,MAX(-MNR,ROUND(DAYS360(ValDat,RC1,0)/30,0)-R8C+MEP-MNR),0,1,1))) -> 49663 | J63: =IF(RC1="","",IF(OR(R8C<=ROUND(DAYS360(ValDat,RC1,0)/30,0),R8C>ROUND(DAYS360(ExpDat,RC1,0)/30,0)),0,OFFSET(R45C,MAX(-MNR,ROUND(DAYS360(ValDat,RC1,0)/30,0)-R8C+MEP-MNR),0,1,1))) -> 0 | K63: =IF(RC1="","",IF(OR(R8C<=ROUND(DAYS360(ValDat,RC1,0)/30,0),R8C>ROUND(DAYS360(ExpDat,RC1,0)/30,0)),0,OFFSET(R45C,MAX(-MNR,ROUND(DAYS360(ValDat,RC1,0)/30,0)-R8C+MEP-MNR),0,1,1))) -> 0 | L63: =IF(RC1="","",IF(OR(R8C<=ROUND(DAYS360(ValDat,RC1,0)/30,0),R8C>ROUND(DAYS360(ExpDat,RC1,0)/30,0)),0,OFFSET(R45C,MAX(-MNR,ROUND(DAYS360(ValDat,RC1,0)/30,0)-R8C+MEP-MNR),0,1,1))) -> 0 | M63: =IF(RC1="","",IF(OR(R8C<=ROUND(DAYS360(ValDat,RC1,0)/30,0),R8C>ROUND(DAYS360(ExpDat,RC1,0)/30,0)),0,OFFSET(R45C,MAX(-MNR,ROUND(DAYS360(ValDat,RC1,0)/30,0)-R8C+MEP-MNR),0,1,1))) -> 0 | N63: =IF(RC1="","",IF(OR(R8C<=ROUND(DAYS360(ValDat,RC1,0)/30,0),R8C>ROUND(DAYS360(ExpDat,RC1,0)/30,0)),0,OFFSET(R45C,MAX(-MNR,ROUND(DAYS360(ValDat,RC1,0)/30,0)-R8C+MEP-MNR),0,1,1))) -> 0 | O63: =IF(RC1="","",IF(OR(R8C<=ROUND(DAYS360(ValDat,RC1,0)/30,0),R8C>ROUND(DAYS360(ExpDat,RC1,0)/30,0)),0,OFFSET(R45C,MAX(-MNR,ROUND(DAYS360(ValDat,RC1,0)/30,0)-R8C+MEP-MNR),0,1,1))) -> 0 | P63: =IF(RC1="","",IF(OR(R8C<=ROUND(DAYS360(ValDat,RC1,0)/30,0),R8C>ROUND(DAYS360(ExpDat,RC1,0)/30,0)),0,OFFSET(R45C,MAX(-MNR,ROUND(DAYS360(ValDat,RC1,0)/30,0)-R8C+MEP-MNR),0,1,1))) -> 0 | Q63: =IF(RC1="","",IF(OR(R8C<=ROUND(DAYS360(ValDat,RC1,0)/30,0),R8C>ROUND(DAYS360(ExpDat,RC1,0)/30,0)),0,OFFSET(R45C,MAX(-MNR,ROUND(DAYS360(ValDat,RC1,0)/30,0)-R8C+MEP-MNR),0,1,1))) -> 0 | R63: =IF(RC1="","",IF(OR(R8C<=ROUND(DAYS360(ValDat,RC1,0)/30,0),R8C>ROUND(DAYS360(ExpDat,RC1,0)/30,0)),0,OFFSET(R45C,MAX(-MNR,ROUND(DAYS360(ValDat,RC1,0)/30,0)-R8C+MEP-MNR),0,1,1))) -> 0 | S63: =IF(RC1="","",IF(OR(R8C<=ROUND(DAYS360(ValDat,RC1,0)/30,0),R8C>ROUND(DAYS360(ExpDat,RC1,0)/30,0)),0,OFFSET(R45C,MAX(-MNR,ROUND(DAYS360(ValDat,RC1,0)/30,0)-R8C+MEP-MNR),0,1,1))) -> 0 | T63: =IF(RC1="","",IF(OR(R8C<=ROUND(DAYS360(ValDat,RC1,0)/30,0),R8C>ROUND(DAYS360(ExpDat,RC1,0)/30,0)),0,OFFSET(R45C,MAX(-MNR,ROUND(DAYS360(ValDat,RC1,0)/30,0)-R8C+MEP-MNR),0,1,1))) -> 0 | U63: =IF(RC1="","",IF(OR(R8C<=ROUND(DAYS360(ValDat,RC1,0)/30,0),R8C>ROUND(DAYS360(ExpDat,RC1,0)/30,0)),0,OFFSET(R45C,MAX(-MNR,ROUND(DAYS360(ValDat,RC1,0)/30,0)-R8C+MEP-MNR),0,1,1))) -> 0 | V63: =IF(RC1="","",IF(OR(R8C<=ROUND(DAYS360(ValDat,RC1,0)/30,0),R8C>ROUND(DAYS360(ExpDat,RC1,0)/30,0)),0,OFFSET(R45C,MAX(-MNR,ROUND(DAYS360(ValDat,RC1,0)/30,0)-R8C+MEP-MNR),0,1,1))) -> 0 | W63: =IF(RC1="","",IF(OR(R8C<=ROUND(DAYS360(ValDat,RC1,0)/30,0),R8C>ROUND(DAYS360(ExpDat,RC1,0)/30,0)),0,OFFSET(R45C,MAX(-MNR,ROUND(DAYS360(ValDat,RC1,0)/30,0)-R8C+MEP-MNR),0,1,1))) -> 0 | X63: =IF(RC1="","",IF(OR(R8C<=ROUND(DAYS360(ValDat,RC1,0)/30,0),R8C>ROUND(DAYS360(ExpDat,RC1,0)/30,0)),0,OFFSET(R45C,MAX(-MNR,ROUND(DAYS360(ValDat,RC1,0)/30,0)-R8C+MEP-MNR),0,1,1))) -> 0 | Y63: =IF(RC1="","",IF(OR(R8C<=ROUND(DAYS360(ValDat,RC1,0)/30,0),R8C>ROUND(DAYS360(ExpDat,RC1,0)/30,0)),0,OFFSET(R45C,MAX(-MNR,ROUND(DAYS360(ValDat,RC1,0)/30,0)-R8C+MEP-MNR),0,1,1))) -> 0 | Z63: =IF(RC1="","",IF(OR(R8C<=ROUND(DAYS360(ValDat,RC1,0)/30,0),R8C>ROUND(DAYS360(ExpDat,RC1,0)/30,0)),0,OFFSET(R45C,MAX(-MNR,ROUND(DAYS360(ValDat,RC1,0)/30,0)-R8C+MEP-MNR),0,1,1))) -> 0 | AA63: =IF(RC1="","",IF(OR(R8C<=ROUND(DAYS360(ValDat,RC1,0)/30,0),R8C>ROUND(DAYS360(ExpDat,RC1,0)/30,0)),0,OFFSET(R45C,MAX(-MNR,ROUND(DAYS360(ValDat,RC1,0)/30,0)-R8C+MEP-MNR),0,1,1))) -> 0 | AB63: =IF(RC1="","",IF(OR(R8C<=ROUND(DAYS360(ValDat,RC1,0)/30,0),R8C>ROUND(DAYS360(ExpDat,RC1,0)/30,0)),0,OFFSET(R45C,MAX(-MNR,ROUND(DAYS360(ValDat,RC1,0)/30,0)-R8C+MEP-MNR),0,1,1))) -> 0 | AC63: =IF(RC1="","",IF(OR(R8C<=ROUND(DAYS360(ValDat,RC1,0)/30,0),R8C>ROUND(DAYS360(ExpDat,RC1,0)/30,0)),0,OFFSET(R45C,MAX(-MNR,ROUND(DAYS360(ValDat,RC1,0)/30,0)-R8C+MEP-MNR),0,1,1))) -> 0 | AD63: =IF(RC1="","",IF(OR(R8C<=ROUND(DAYS360(ValDat,RC1,0)/30,0),R8C>ROUND(DAYS360(ExpDat,RC1,0)/30,0)),0,OFFSET(R45C,MAX(-MNR,ROUND(DAYS360(ValDat,RC1,0)/30,0)-R8C+MEP-MNR),0,1,1))) -> 0 | AE63: =IF(RC1="","",IF(OR(R8C<=ROUND(DAYS360(ValDat,RC1,0)/30,0),R8C>ROUND(DAYS360(ExpDat,RC1,0)/30,0)),0,OFFSET(R45C,MAX(-MNR,ROUND(DAYS360(ValDat,RC1,0)/30,0)-R8C+MEP-MNR),0,1,1))) -> 0 | AF63: =IF(RC1="","",IF(OR(R8C<=ROUND(DAYS360(ValDat,RC1,0)/30,0),R8C>ROUND(DAYS360(ExpDat,RC1,0)/30,0)),0,OFFSET(R45C,MAX(-MNR,ROUND(DAYS360(ValDat,RC1,0)/30,0)-R8C+MEP-MNR),0,1,1))) -> 0 | AG63: =IF(RC1="","",IF(OR(R8C<=ROUND(DAYS360(ValDat,RC1,0)/30,0),R8C>ROUND(DAYS360(ExpDat,RC1,0)/30,0)),0,OFFSET(R45C,MAX(-MNR,ROUND(DAYS360(ValDat,RC1,0)/30,0)-R8C+MEP-MNR),0,1,1))) -> 0 | AH63: =IF(RC1="","",IF(OR(R8C<=ROUND(DAYS360(ValDat,RC1,0)/30,0),R8C>ROUND(DAYS360(ExpDat,RC1,0)/30,0)),0,OFFSET(R45C,MAX(-MNR,ROUND(DAYS360(ValDat,RC1,0)/30,0)-R8C+MEP-MNR),0,1,1))) -> 0 | AI63: =IF(RC1="","",IF(OR(R8C<=ROUND(DAYS360(ValDat,RC1,0)/30,0),R8C>ROUND(DAYS360(ExpDat,RC1,0)/30,0)),0,OFFSET(R45C,MAX(-MNR,ROUND(DAYS360(ValDat,RC1,0)/30,0)-R8C+MEP-MNR),0,1,1))) -> 0 | AJ63: =IF(RC1="","",IF(OR(R8C<=ROUND(DAYS360(ValDat,RC1,0)/30,0),R8C>ROUND(DAYS360(ExpDat,RC1,0)/30,0)),0,OFFSET(R45C,MAX(-MNR,ROUND(DAYS360(ValDat,RC1,0)/30,0)-R8C+MEP-MNR),0,1,1))) -> 0 | AK63: =IF(RC1="","",IF(OR(R8C<=ROUND(DAYS360(ValDat,RC1,0)/30,0),R8C>ROUND(DAYS360(ExpDat,RC1,0)/30,0)),0,OFFSET(R45C,MAX(-MNR,ROUND(DAYS360(ValDat,RC1,0)/30,0)-R8C+MEP-MNR),0,1,1))) -> 0 | AL63: =IF(RC1="","",IF(OR(R8C<=ROUND(DAYS360(ValDat,RC1,0)/30,0),R8C>ROUND(DAYS360(ExpDat,RC1,0)/30,0)),0,OFFSET(R45C,MAX(-MNR,ROUND(DAYS360(ValDat,RC1,0)/30,0)-R8C+MEP-MNR),0,1,1))) -> 0 | AM63: =IF(RC1="","",IF(OR(R8C<=ROUND(DAYS360(ValDat,RC1,0)/30,0),R8C>ROUND(DAYS360(ExpDat,RC1,0)/30,0)),0,OFFSET(R45C,MAX(-MNR,ROUND(DAYS360(ValDat,RC1,0)/30,0)-R8C+MEP-MNR),0,1,1))) -> 0 | AN63: =IF(RC1="","",IF(OR(R8C<=ROUND(DAYS360(ValDat,RC1,0)/30,0),R8C>ROUND(DAYS360(ExpDat,RC1,0)/30,0)),0,OFFSET(R45C,MAX(-MNR,ROUND(DAYS360(ValDat,RC1,0)/30,0)-R8C+MEP-MNR),0,1,1))) -> 0 | AO63: =IF(RC1="","",IF(OR(R8C<=ROUND(DAYS360(ValDat,RC1,0)/30,0),R8C>ROUND(DAYS360(ExpDat,RC1,0)/30,0)),0,OFFSET(R45C,MAX(-MNR,ROUND(DAYS360(ValDat,RC1,0)/30,0)-R8C+MEP-MNR),0,1,1))) -> 0
A64: =IF(R[-1]C="","",IF(DATE(YEAR(R[-1]C),MONTH(R[-1]C)+1,1)>RunDat,"",DATE(YEAR(R[-1]C),MONTH(R[-1]C)+1,1))) -> 1999-02-01T00:00:00.000 | D64: =IF(RC1="","",SUM(RC[2]:RC[37])) -> 120546 | F64: =IF(RC1="","",IF(OR(R8C<=ROUND(DAYS360(ValDat,RC1,0)/30,0),R8C>ROUND(DAYS360(ExpDat,RC1,0)/30,0)),0,OFFSET(R45C,MAX(-MNR,ROUND(DAYS360(ValDat,RC1,0)/30,0)-R8C+MEP-MNR),0,1,1))) -> 13659 | G64: =IF(RC1="","",IF(OR(R8C<=ROUND(DAYS360(ValDat,RC1,0)/30,0),R8C>ROUND(DAYS360(ExpDat,RC1,0)/30,0)),0,OFFSET(R45C,MAX(-MNR,ROUND(DAYS360(ValDat,RC1,0)/30,0)-R8C+MEP-MNR),0,1,1))) -> 39304 | H64: =IF(RC1="","",IF(OR(R8C<=ROUND(DAYS360(ValDat,RC1,0)/30,0),R8C>ROUND(DAYS360(ExpDat,RC1,0)/30,0)),0,OFFSET(R45C,MAX(-MNR,ROUND(DAYS360(ValDat,RC1,0)/30,0)-R8C+MEP-MNR),0,1,1))) -> 17920 | I64: =IF(RC1="","",IF(OR(R8C<=ROUND(DAYS360(ValDat,RC1,0)/30,0),R8C>ROUND(DAYS360(ExpDat,RC1,0)/30,0)),0,OFFSET(R45C,MAX(-MNR,ROUND(DAYS360(ValDat,RC1,0)/30,0)-R8C+MEP-MNR),0,1,1))) -> 49663 | J64: =IF(RC1="","",IF(OR(R8C<=ROUND(DAYS360(ValDat,RC1,0)/30,0),R8C>ROUND(DAYS360(ExpDat,RC1,0)/30,0)),0,OFFSET(R45C,MAX(-MNR,ROUND(DAYS360(ValDat,RC1,0)/30,0)-R8C+MEP-MNR),0,1,1))) -> 0 | K64: =IF(RC1="","",IF(OR(R8C<=ROUND(DAYS360(ValDat,RC1,0)/30,0),R8C>ROUND(DAYS360(ExpDat,RC1,0)/30,0)),0,OFFSET(R45C,MAX(-MNR,ROUND(DAYS360(ValDat,RC1,0)/30,0)-R8C+MEP-MNR),0,1,1))) -> 0 | L64: =IF(RC1="","",IF(OR(R8C<=ROUND(DAYS360(ValDat,RC1,0)/30,0),R8C>ROUND(DAYS360(ExpDat,RC1,0)/30,0)),0,OFFSET(R45C,MAX(-MNR,ROUND(DAYS360(ValDat,RC1,0)/30,0)-R8C+MEP-MNR),0,1,1))) -> 0 | M64: =IF(RC1="","",IF(OR(R8C<=ROUND(DAYS360(ValDat,RC1,0)/30,0),R8C>ROUND(DAYS360(ExpDat,RC1,0)/30,0)),0,OFFSET(R45C,MAX(-MNR,ROUND(DAYS360(ValDat,RC1,0)/30,0)-R8C+MEP-MNR),0,1,1))) -> 0 | N64: =IF(RC1="","",IF(OR(R8C<=ROUND(DAYS360(ValDat,RC1,0)/30,0),R8C>ROUND(DAYS360(ExpDat,RC1,0)/30,0)),0,OFFSET(R45C,MAX(-MNR,ROUND(DAYS360(ValDat,RC1,0)/30,0)-R8C+MEP-MNR),0,1,1))) -> 0 | O64: =IF(RC1="","",IF(OR(R8C<=ROUND(DAYS360(ValDat,RC1,0)/30,0),R8C>ROUND(DAYS360(ExpDat,RC1,0)/30,0)),0,OFFSET(R45C,MAX(-MNR,ROUND(DAYS360(ValDat,RC1,0)/30,0)-R8C+MEP-MNR),0,1,1))) -> 0 | P64: =IF(RC1="","",IF(OR(R8C<=ROUND(DAYS360(ValDat,RC1,0)/30,0),R8C>ROUND(DAYS360(ExpDat,RC1,0)/30,0)),0,OFFSET(R45C,MAX(-MNR,ROUND(DAYS360(ValDat,RC1,0)/30,0)-R8C+MEP-MNR),0,1,1))) -> 0 | Q64: =IF(RC1="","",IF(OR(R8C<=ROUND(DAYS360(ValDat,RC1,0)/30,0),R8C>ROUND(DAYS360(ExpDat,RC1,0)/30,0)),0,OFFSET(R45C,MAX(-MNR,ROUND(DAYS360(ValDat,RC1,0)/30,0)-R8C+MEP-MNR),0,1,1))) -> 0 | R64: =IF(RC1="","",IF(OR(R8C<=ROUND(DAYS360(ValDat,RC1,0)/30,0),R8C>ROUND(DAYS360(ExpDat,RC1,0)/30,0)),0,OFFSET(R45C,MAX(-MNR,ROUND(DAYS360(ValDat,RC1,0)/30,0)-R8C+MEP-MNR),0,1,1))) -> 0 | S64: =IF(RC1="","",IF(OR(R8C<=ROUND(DAYS360(ValDat,RC1,0)/30,0),R8C>ROUND(DAYS360(ExpDat,RC1,0)/30,0)),0,OFFSET(R45C,MAX(-MNR,ROUND(DAYS360(ValDat,RC1,0)/30,0)-R8C+MEP-MNR),0,1,1))) -> 0 | T64: =IF(RC1="","",IF(OR(R8C<=ROUND(DAYS360(ValDat,RC1,0)/30,0),R8C>ROUND(DAYS360(ExpDat,RC1,0)/30,0)),0,OFFSET(R45C,MAX(-MNR,ROUND(DAYS360(ValDat,RC1,0)/30,0)-R8C+MEP-MNR),0,1,1))) -> 0 | U64: =IF(RC1="","",IF(OR(R8C<=ROUND(DAYS360(ValDat,RC1,0)/30,0),R8C>ROUND(DAYS360(ExpDat,RC1,0)/30,0)),0,OFFSET(R45C,MAX(-MNR,ROUND(DAYS360(ValDat,RC1,0)/30,0)-R8C+MEP-MNR),0,1,1))) -> 0 | V64: =IF(RC1="","",IF(OR(R8C<=ROUND(DAYS360(ValDat,RC1,0)/30,0),R8C>ROUND(DAYS360(ExpDat,RC1,0)/30,0)),0,OFFSET(R45C,MAX(-MNR,ROUND(DAYS360(ValDat,RC1,0)/30,0)-R8C+MEP-MNR),0,1,1))) -> 0 | W64: =IF(RC1="","",IF(OR(R8C<=ROUND(DAYS360(ValDat,RC1,0)/30,0),R8C>ROUND(DAYS360(ExpDat,RC1,0)/30,0)),0,OFFSET(R45C,MAX(-MNR,ROUND(DAYS360(ValDat,RC1,0)/30,0)-R8C+MEP-MNR),0,1,1))) -> 0 | X64: =IF(RC1="","",IF(OR(R8C<=ROUND(DAYS360(ValDat,RC1,0)/30,0),R8C>ROUND(DAYS360(ExpDat,RC1,0)/30,0)),0,OFFSET(R45C,MAX(-MNR,ROUND(DAYS360(ValDat,RC1,0)/30,0)-R8C+MEP-MNR),0,1,1))) -> 0 | Y64: =IF(RC1="","",IF(OR(R8C<=ROUND(DAYS360(ValDat,RC1,0)/30,0),R8C>ROUND(DAYS360(ExpDat,RC1,0)/30,0)),0,OFFSET(R45C,MAX(-MNR,ROUND(DAYS360(ValDat,RC1,0)/30,0)-R8C+MEP-MNR),0,1,1))) -> 0 | Z64: =IF(RC1="","",IF(OR(R8C<=ROUND(DAYS360(ValDat,RC1,0)/30,0),R8C>ROUND(DAYS360(ExpDat,RC1,0)/30,0)),0,OFFSET(R45C,MAX(-MNR,ROUND(DAYS360(ValDat,RC1,0)/30,0)-R8C+MEP-MNR),0,1,1))) -> 0 | AA64: =IF(RC1="","",IF(OR(R8C<=ROUND(DAYS360(ValDat,RC1,0)/30,0),R8C>ROUND(DAYS360(ExpDat,RC1,0)/30,0)),0,OFFSET(R45C,MAX(-MNR,ROUND(DAYS360(ValDat,RC1,0)/30,0)-R8C+MEP-MNR),0,1,1))) -> 0 | AB64: =IF(RC1="","",IF(OR(R8C<=ROUND(DAYS360(ValDat,RC1,0)/30,0),R8C>ROUND(DAYS360(ExpDat,RC1,0)/30,0)),0,OFFSET(R45C,MAX(-MNR,ROUND(DAYS360(ValDat,RC1,0)/30,0)-R8C+MEP-MNR),0,1,1))) -> 0 | AC64: =IF(RC1="","",IF(OR(R8C<=ROUND(DAYS360(ValDat,RC1,0)/30,0),R8C>ROUND(DAYS360(ExpDat,RC1,0)/30,0)),0,OFFSET(R45C,MAX(-MNR,ROUND(DAYS360(ValDat,RC1,0)/30,0)-R8C+MEP-MNR),0,1,1))) -> 0 | AD64: =IF(RC1="","",IF(OR(R8C<=ROUND(DAYS360(ValDat,RC1,0)/30,0),R8C>ROUND(DAYS360(ExpDat,RC1,0)/30,0)),0,OFFSET(R45C,MAX(-MNR,ROUND(DAYS360(ValDat,RC1,0)/30,0)-R8C+MEP-MNR),0,1,1))) -> 0 | AE64: =IF(RC1="","",IF(OR(R8C<=ROUND(DAYS360(ValDat,RC1,0)/30,0),R8C>ROUND(DAYS360(ExpDat,RC1,0)/30,0)),0,OFFSET(R45C,MAX(-MNR,ROUND(DAYS360(ValDat,RC1,0)/30,0)-R8C+MEP-MNR),0,1,1))) -> 0 | AF64: =IF(RC1="","",IF(OR(R8C<=ROUND(DAYS360(ValDat,RC1,0)/30,0),R8C>ROUND(DAYS360(ExpDat,RC1,0)/30,0)),0,OFFSET(R45C,MAX(-MNR,ROUND(DAYS360(ValDat,RC1,0)/30,0)-R8C+MEP-MNR),0,1,1))) -> 0 | AG64: =IF(RC1="","",IF(OR(R8C<=ROUND(DAYS360(ValDat,RC1,0)/30,0),R8C>ROUND(DAYS360(ExpDat,RC1,0)/30,0)),0,OFFSET(R45C,MAX(-MNR,ROUND(DAYS360(ValDat,RC1,0)/30,0)-R8C+MEP-MNR),0,1,1))) -> 0 | AH64: =IF(RC1="","",IF(OR(R8C<=ROUND(DAYS360(ValDat,RC1,0)/30,0),R8C>ROUND(DAYS360(ExpDat,RC1,0)/30,0)),0,OFFSET(R45C,MAX(-MNR,ROUND(DAYS360(ValDat,RC1,0)/30,0)-R8C+MEP-MNR),0,1,1))) -> 0 | AI64: =IF(RC1="","",IF(OR(R8C<=ROUND(DAYS360(ValDat,RC1,0)/30,0),R8C>ROUND(DAYS360(ExpDat,RC1,0)/30,0)),0,OFFSET(R45C,MAX(-MNR,ROUND(DAYS360(ValDat,RC1,0)/30,0)-R8C+MEP-MNR),0,1,1))) -> 0 | AJ64: =IF(RC1="","",IF(OR(R8C<=ROUND(DAYS360(ValDat,RC1,0)/30,0),R8C>ROUND(DAYS360(ExpDat,RC1,0)/30,0)),0,OFFSET(R45C,MAX(-MNR,ROUND(DAYS360(ValDat,RC1,0)/30,0)-R8C+MEP-MNR),0,1,1))) -> 0 | AK64: =IF(RC1="","",IF(OR(R8C<=ROUND(DAYS360(ValDat,RC1,0)/30,0),R8C>ROUND(DAYS360(ExpDat,RC1,0)/30,0)),0,OFFSET(R45C,MAX(-MNR,ROUND(DAYS360(ValDat,RC1,0)/30,0)-R8C+MEP-MNR),0,1,1))) -> 0 | AL64: =IF(RC1="","",IF(OR(R8C<=ROUND(DAYS360(ValDat,RC1,0)/30,0),R8C>ROUND(DAYS360(ExpDat,RC1,0)/30,0)),0,OFFSET(R45C,MAX(-MNR,ROUND(DAYS360(ValDat,RC1,0)/30,0)-R8C+MEP-MNR),0,1,1))) -> 0 | AM64: =IF(RC1="","",IF(OR(R8C<=ROUND(DAYS360(ValDat,RC1,0)/30,0),R8C>ROUND(DAYS360(ExpDat,RC1,0)/30,0)),0,OFFSET(R45C,MAX(-MNR,ROUND(DAYS360(ValDat,RC1,0)/30,0)-R8C+MEP-MNR),0,1,1))) -> 0 | AN64: =IF(RC1="","",IF(OR(R8C<=ROUND(DAYS360(ValDat,RC1,0)/30,0),R8C>ROUND(DAYS360(ExpDat,RC1,0)/30,0)),0,OFFSET(R45C,MAX(-MNR,ROUND(DAYS360(ValDat,RC1,0)/30,0)-R8C+MEP-MNR),0,1,1))) -> 0 | AO64: =IF(RC1="","",IF(OR(R8C<=ROUND(DAYS360(ValDat,RC1,0)/30,0),R8C>ROUND(DAYS360(ExpDat,RC1,0)/30,0)),0,OFFSET(R45C,MAX(-MNR,ROUND(DAYS360(ValDat,RC1,0)/30,0)-R8C+MEP-MNR),0,1,1))) -> 0
A65: =IF(R[-1]C="","",IF(DATE(YEAR(R[-1]C),MONTH(R[-1]C)+1,1)>RunDat,"",DATE(YEAR(R[-1]C),MONTH(R[-1]C)+1,1))) -> 1999-03-01T00:00:00.000 | D65: =IF(RC1="","",SUM(RC[2]:RC[37])) -> 188587 | F65: =IF(RC1="","",IF(OR(R8C<=ROUND(DAYS360(ValDat,RC1,0)/30,0),R8C>ROUND(DAYS360(ExpDat,RC1,0)/30,0)),0,OFFSET(R45C,MAX(-MNR,ROUND(DAYS360(ValDat,RC1,0)/30,0)-R8C+MEP-MNR),0,1,1))) -> 57935 | G65: =IF(RC1="","",IF(OR(R8C<=ROUND(DAYS360(ValDat,RC1,0)/30,0),R8C>ROUND(DAYS360(ExpDat,RC1,0)/30,0)),0,OFFSET(R45C,MAX(-MNR,ROUND(DAYS360(ValDat,RC1,0)/30,0)-R8C+MEP-MNR),0,1,1))) -> 80920 | H65: =IF(RC1="","",IF(OR(R8C<=ROUND(DAYS360(ValDat,RC1,0)/30,0),R8C>ROUND(DAYS360(ExpDat,RC1,0)/30,0)),0,OFFSET(R45C,MAX(-MNR,ROUND(DAYS360(ValDat,RC1,0)/30,0)-R8C+MEP-MNR),0,1,1))) -> 24477 | I65: =IF(RC1="","",IF(OR(R8C<=ROUND(DAYS360(ValDat,RC1,0)/30,0),R8C>ROUND(DAYS360(ExpDat,RC1,0)/30,0)),0,OFFSET(R45C,MAX(-MNR,ROUND(DAYS360(ValDat,RC1,0)/30,0)-R8C+MEP-MNR),0,1,1))) -> 25255 | J65: =IF(RC1="","",IF(OR(R8C<=ROUND(DAYS360(ValDat,RC1,0)/30,0),R8C>ROUND(DAYS360(ExpDat,RC1,0)/30,0)),0,OFFSET(R45C,MAX(-MNR,ROUND(DAYS360(ValDat,RC1,0)/30,0)-R8C+MEP-MNR),0,1,1))) -> 0 | K65: =IF(RC1="","",IF(OR(R8C<=ROUND(DAYS360(ValDat,RC1,0)/30,0),R8C>ROUND(DAYS360(ExpDat,RC1,0)/30,0)),0,OFFSET(R45C,MAX(-MNR,ROUND(DAYS360(ValDat,RC1,0)/30,0)-R8C+MEP-MNR),0,1,1))) -> 0 | L65: =IF(RC1="","",IF(OR(R8C<=ROUND(DAYS360(ValDat,RC1,0)/30,0),R8C>ROUND(DAYS360(ExpDat,RC1,0)/30,0)),0,OFFSET(R45C,MAX(-MNR,ROUND(DAYS360(ValDat,RC1,0)/30,0)-R8C+MEP-MNR),0,1,1))) -> 0 | M65: =IF(RC1="","",IF(OR(R8C<=ROUND(DAYS360(ValDat,RC1,0)/30,0),R8C>ROUND(DAYS360(ExpDat,RC1,0)/30,0)),0,OFFSET(R45C,MAX(-MNR,ROUND(DAYS360(ValDat,RC1,0)/30,0)-R8C+MEP-MNR),0,1,1))) -> 0 | N65: =IF(RC1="","",IF(OR(R8C<=ROUND(DAYS360(ValDat,RC1,0)/30,0),R8C>ROUND(DAYS360(ExpDat,RC1,0)/30,0)),0,OFFSET(R45C,MAX(-MNR,ROUND(DAYS360(ValDat,RC1,0)/30,0)-R8C+MEP-MNR),0,1,1))) -> 0 | O65: =IF(RC1="","",IF(OR(R8C<=ROUND(DAYS360(ValDat,RC1,0)/30,0),R8C>ROUND(DAYS360(ExpDat,RC1,0)/30,0)),0,OFFSET(R45C,MAX(-MNR,ROUND(DAYS360(ValDat,RC1,0)/30,0)-R8C+MEP-MNR),0,1,1))) -> 0 | P65: =IF(RC1="","",IF(OR(R8C<=ROUND(DAYS360(ValDat,RC1,0)/30,0),R8C>ROUND(DAYS360(ExpDat,RC1,0)/30,0)),0,OFFSET(R45C,MAX(-MNR,ROUND(DAYS360(ValDat,RC1,0)/30,0)-R8C+MEP-MNR),0,1,1))) -> 0 | Q65: =IF(RC1="","",IF(OR(R8C<=ROUND(DAYS360(ValDat,RC1,0)/30,0),R8C>ROUND(DAYS360(ExpDat,RC1,0)/30,0)),0,OFFSET(R45C,MAX(-MNR,ROUND(DAYS360(ValDat,RC1,0)/30,0)-R8C+MEP-MNR),0,1,1))) -> 0 | R65: =IF(RC1="","",IF(OR(R8C<=ROUND(DAYS360(ValDat,RC1,0)/30,0),R8C>ROUND(DAYS360(ExpDat,RC1,0)/30,0)),0,OFFSET(R45C,MAX(-MNR,ROUND(DAYS360(ValDat,RC1,0)/30,0)-R8C+MEP-MNR),0,1,1))) -> 0 | S65: =IF(RC1="","",IF(OR(R8C<=ROUND(DAYS360(ValDat,RC1,0)/30,0),R8C>ROUND(DAYS360(ExpDat,RC1,0)/30,0)),0,OFFSET(R45C,MAX(-MNR,ROUND(DAYS360(ValDat,RC1,0)/30,0)-R8C+MEP-MNR),0,1,1))) -> 0 | T65: =IF(RC1="","",IF(OR(R8C<=ROUND(DAYS360(ValDat,RC1,0)/30,0),R8C>ROUND(DAYS360(ExpDat,RC1,0)/30,0)),0,OFFSET(R45C,MAX(-MNR,ROUND(DAYS360(ValDat,RC1,0)/30,0)-R8C+MEP-MNR),0,1,1))) -> 0 | U65: =IF(RC1="","",IF(OR(R8C<=ROUND(DAYS360(ValDat,RC1,0)/30,0),R8C>ROUND(DAYS360(ExpDat,RC1,0)/30,0)),0,OFFSET(R45C,MAX(-MNR,ROUND(DAYS360(ValDat,RC1,0)/30,0)-R8C+MEP-MNR),0,1,1))) -> 0 | V65: =IF(RC1="","",IF(OR(R8C<=ROUND(DAYS360(ValDat,RC1,0)/30,0),R8C>ROUND(DAYS360(ExpDat,RC1,0)/30,0)),0,OFFSET(R45C,MAX(-MNR,ROUND(DAYS360(ValDat,RC1,0)/30,0)-R8C+MEP-MNR),0,1,1))) -> 0 | W65: =IF(RC1="","",IF(OR(R8C<=ROUND(DAYS360(ValDat,RC1,0)/30,0),R8C>ROUND(DAYS360(ExpDat,RC1,0)/30,0)),0,OFFSET(R45C,MAX(-MNR,ROUND(DAYS360(ValDat,RC1,0)/30,0)-R8C+MEP-MNR),0,1,1))) -> 0 | X65: =IF(RC1="","",IF(OR(R8C<=ROUND(DAYS360(ValDat,RC1,0)/30,0),R8C>ROUND(DAYS360(ExpDat,RC1,0)/30,0)),0,OFFSET(R45C,MAX(-MNR,ROUND(DAYS360(ValDat,RC1,0)/30,0)-R8C+MEP-MNR),0,1,1))) -> 0 | Y65: =IF(RC1="","",IF(OR(R8C<=ROUND(DAYS360(ValDat,RC1,0)/30,0),R8C>ROUND(DAYS360(ExpDat,RC1,0)/30,0)),0,OFFSET(R45C,MAX(-MNR,ROUND(DAYS360(ValDat,RC1,0)/30,0)-R8C+MEP-MNR),0,1,1))) -> 0 | Z65: =IF(RC1="","",IF(OR(R8C<=ROUND(DAYS360(ValDat,RC1,0)/30,0),R8C>ROUND(DAYS360(ExpDat,RC1,0)/30,0)),0,OFFSET(R45C,MAX(-MNR,ROUND(DAYS360(ValDat,RC1,0)/30,0)-R8C+MEP-MNR),0,1,1))) -> 0 | AA65: =IF(RC1="","",IF(OR(R8C<=ROUND(DAYS360(ValDat,RC1,0)/30,0),R8C>ROUND(DAYS360(ExpDat,RC1,0)/30,0)),0,OFFSET(R45C,MAX(-MNR,ROUND(DAYS360(ValDat,RC1,0)/30,0)-R8C+MEP-MNR),0,1,1))) -> 0 | AB65: =IF(RC1="","",IF(OR(R8C<=ROUND(DAYS360(ValDat,RC1,0)/30,0),R8C>ROUND(DAYS360(ExpDat,RC1,0)/30,0)),0,OFFSET(R45C,MAX(-MNR,ROUND(DAYS360(ValDat,RC1,0)/30,0)-R8C+MEP-MNR),0,1,1))) -> 0 | AC65: =IF(RC1="","",IF(OR(R8C<=ROUND(DAYS360(ValDat,RC1,0)/30,0),R8C>ROUND(DAYS360(ExpDat,RC1,0)/30,0)),0,OFFSET(R45C,MAX(-MNR,ROUND(DAYS360(ValDat,RC1,0)/30,0)-R8C+MEP-MNR),0,1,1))) -> 0 | AD65: =IF(RC1="","",IF(OR(R8C<=ROUND(DAYS360(ValDat,RC1,0)/30,0),R8C>ROUND(DAYS360(ExpDat,RC1,0)/30,0)),0,OFFSET(R45C,MAX(-MNR,ROUND(DAYS360(ValDat,RC1,0)/30,0)-R8C+MEP-MNR),0,1,1))) -> 0 | AE65: =IF(RC1="","",IF(OR(R8C<=ROUND(DAYS360(ValDat,RC1,0)/30,0),R8C>ROUND(DAYS360(ExpDat,RC1,0)/30,0)),0,OFFSET(R45C,MAX(-MNR,ROUND(DAYS360(ValDat,RC1,0)/30,0)-R8C+MEP-MNR),0,1,1))) -> 0 | AF65: =IF(RC1="","",IF(OR(R8C<=ROUND(DAYS360(ValDat,RC1,0)/30,0),R8C>ROUND(DAYS360(ExpDat,RC1,0)/30,0)),0,OFFSET(R45C,MAX(-MNR,ROUND(DAYS360(ValDat,RC1,0)/30,0)-R8C+MEP-MNR),0,1,1))) -> 0 | AG65: =IF(RC1="","",IF(OR(R8C<=ROUND(DAYS360(ValDat,RC1,0)/30,0),R8C>ROUND(DAYS360(ExpDat,RC1,0)/30,0)),0,OFFSET(R45C,MAX(-MNR,ROUND(DAYS360(ValDat,RC1,0)/30,0)-R8C+MEP-MNR),0,1,1))) -> 0 | AH65: =IF(RC1="","",IF(OR(R8C<=ROUND(DAYS360(ValDat,RC1,0)/30,0),R8C>ROUND(DAYS360(ExpDat,RC1,0)/30,0)),0,OFFSET(R45C,MAX(-MNR,ROUND(DAYS360(ValDat,RC1,0)/30,0)-R8C+MEP-MNR),0,1,1))) -> 0 | AI65: =IF(RC1="","",IF(OR(R8C<=ROUND(DAYS360(ValDat,RC1,0)/30,0),R8C>ROUND(DAYS360(ExpDat,RC1,0)/30,0)),0,OFFSET(R45C,MAX(-MNR,ROUND(DAYS360(ValDat,RC1,0)/30,0)-R8C+MEP-MNR),0,1,1))) -> 0 | AJ65: =IF(RC1="","",IF(OR(R8C<=ROUND(DAYS360(ValDat,RC1,0)/30,0),R8C>ROUND(DAYS360(ExpDat,RC1,0)/30,0)),0,OFFSET(R45C,MAX(-MNR,ROUND(DAYS360(ValDat,RC1,0)/30,0)-R8C+MEP-MNR),0,1,1))) -> 0 | AK65: =IF(RC1="","",IF(OR(R8C<=ROUND(DAYS360(ValDat,RC1,0)/30,0),R8C>ROUND(DAYS360(ExpDat,RC1,0)/30,0)),0,OFFSET(R45C,MAX(-MNR,ROUND(DAYS360(ValDat,RC1,0)/30,0)-R8C+MEP-MNR),0,1,1))) -> 0 | AL65: =IF(RC1="","",IF(OR(R8C<=ROUND(DAYS360(ValDat,RC1,0)/30,0),R8C>ROUND(DAYS360(ExpDat,RC1,0)/30,0)),0,OFFSET(R45C,MAX(-MNR,ROUND(DAYS360(ValDat,RC1,0)/30,0)-R8C+MEP-MNR),0,1,1))) -> 0 | AM65: =IF(RC1="","",IF(OR(R8C<=ROUND(DAYS360(ValDat,RC1,0)/30,0),R8C>ROUND(DAYS360(ExpDat,RC1,0)/30,0)),0,OFFSET(R45C,MAX(-MNR,ROUND(DAYS360(ValDat,RC1,0)/30,0)-R8C+MEP-MNR),0,1,1))) -> 0 | AN65: =IF(RC1="","",IF(OR(R8C<=ROUND(DAYS360(ValDat,RC1,0)/30,0),R8C>ROUND(DAYS360(ExpDat,RC1,0)/30,0)),0,OFFSET(R45C,MAX(-MNR,ROUND(DAYS360(ValDat,RC1,0)/30,0)-R8C+MEP-MNR),0,1,1))) -> 0 | AO65: =IF(RC1="","",IF(OR(R8C<=ROUND(DAYS360(ValDat,RC1,0)/30,0),R8C>ROUND(DAYS360(ExpDat,RC1,0)/30,0)),0,OFFSET(R45C,MAX(-MNR,ROUND(DAYS360(ValDat,RC1,0)/30,0)-R8C+MEP-MNR),0,1,1))) -> 0
A66: =IF(R[-1]C="","",IF(DATE(YEAR(R[-1]C),MONTH(R[-1]C)+1,1)>RunDat,"",DATE(YEAR(R[-1]C),MONTH(R[-1]C)+1,1))) -> 1999-04-01T00:00:00.000 | D66: =IF(RC1="","",SUM(RC[2]:RC[37])) -> 140778 | F66: =IF(RC1="","",IF(OR(R8C<=ROUND(DAYS360(ValDat,RC1,0)/30,0),R8C>ROUND(DAYS360(ExpDat,RC1,0)/30,0)),0,OFFSET(R45C,MAX(-MNR,ROUND(DAYS360(ValDat,RC1,0)/30,0)-R8C+MEP-MNR),0,1,1))) -> 16933 | G66: =IF(RC1="","",IF(OR(R8C<=ROUND(DAYS360(ValDat,RC1,0)/30,0),R8C>ROUND(DAYS360(ExpDat,RC1,0)/30,0)),0,OFFSET(R45C,MAX(-MNR,ROUND(DAYS360(ValDat,RC1,0)/30,0)-R8C+MEP-MNR),0,1,1))) -> 68120 | H66: =IF(RC1="","",IF(OR(R8C<=ROUND(DAYS360(ValDat,RC1,0)/30,0),R8C>ROUND(DAYS360(ExpDat,RC1,0)/30,0)),0,OFFSET(R45C,MAX(-MNR,ROUND(DAYS360(ValDat,RC1,0)/30,0)-R8C+MEP-MNR),0,1,1))) -> 40769 | I66: =IF(RC1="","",IF(OR(R8C<=ROUND(DAYS360(ValDat,RC1,0)/30,0),R8C>ROUND(DAYS360(ExpDat,RC1,0)/30,0)),0,OFFSET(R45C,MAX(-MNR,ROUND(DAYS360(ValDat,RC1,0)/30,0)-R8C+MEP-MNR),0,1,1))) -> 9937 | J66: =IF(RC1="","",IF(OR(R8C<=ROUND(DAYS360(ValDat,RC1,0)/30,0),R8C>ROUND(DAYS360(ExpDat,RC1,0)/30,0)),0,OFFSET(R45C,MAX(-MNR,ROUND(DAYS360(ValDat,RC1,0)/30,0)-R8C+MEP-MNR),0,1,1))) -> 5019 | K66: =IF(RC1="","",IF(OR(R8C<=ROUND(DAYS360(ValDat,RC1,0)/30,0),R8C>ROUND(DAYS360(ExpDat,RC1,0)/30,0)),0,OFFSET(R45C,MAX(-MNR,ROUND(DAYS360(ValDat,RC1,0)/30,0)-R8C+MEP-MNR),0,1,1))) -> 0 | L66: =IF(RC1="","",IF(OR(R8C<=ROUND(DAYS360(ValDat,RC1,0)/30,0),R8C>ROUND(DAYS360(ExpDat,RC1,0)/30,0)),0,OFFSET(R45C,MAX(-MNR,ROUND(DAYS360(ValDat,RC1,0)/30,0)-R8C+MEP-MNR),0,1,1))) -> 0 | M66: =IF(RC1="","",IF(OR(R8C<=ROUND(DAYS360(ValDat,RC1,0)/30,0),R8C>ROUND(DAYS360(ExpDat,RC1,0)/30,0)),0,OFFSET(R45C,MAX(-MNR,ROUND(DAYS360(ValDat,RC1,0)/30,0)-R8C+MEP-MNR),0,1,1))) -> 0 | N66: =IF(RC1="","",IF(OR(R8C<=ROUND(DAYS360(ValDat,RC1,0)/30,0),R8C>ROUND(DAYS360(ExpDat,RC1,0)/30,0)),0,OFFSET(R45C,MAX(-MNR,ROUND(DAYS360(ValDat,RC1,0)/30,0)-R8C+MEP-MNR),0,1,1))) -> 0 | O66: =IF(RC1="","",IF(OR(R8C<=ROUND(DAYS360(ValDat,RC1,0)/30,0),R8C>ROUND(DAYS360(ExpDat,RC1,0)/30,0)),0,OFFSET(R45C,MAX(-MNR,ROUND(DAYS360(ValDat,RC1,0)/30,0)-R8C+MEP-MNR),0,1,1))) -> 0 | P66: =IF(RC1="","",IF(OR(R8C<=ROUND(DAYS360(ValDat,RC1,0)/30,0),R8C>ROUND(DAYS360(ExpDat,RC1,0)/30,0)),0,OFFSET(R45C,MAX(-MNR,ROUND(DAYS360(ValDat,RC1,0)/30,0)-R8C+MEP-MNR),0,1,1))) -> 0 | Q66: =IF(RC1="","",IF(OR(R8C<=ROUND(DAYS360(ValDat,RC1,0)/30,0),R8C>ROUND(DAYS360(ExpDat,RC1,0)/30,0)),0,OFFSET(R45C,MAX(-MNR,ROUND(DAYS360(ValDat,RC1,0)/30,0)-R8C+MEP-MNR),0,1,1))) -> 0 | R66: =IF(RC1="","",IF(OR(R8C<=ROUND(DAYS360(ValDat,RC1,0)/30,0),R8C>ROUND(DAYS360(ExpDat,RC1,0)/30,0)),0,OFFSET(R45C,MAX(-MNR,ROUND(DAYS360(ValDat,RC1,0)/30,0)-R8C+MEP-MNR),0,1,1))) -> 0 | S66: =IF(RC1="","",IF(OR(R8C<=ROUND(DAYS360(ValDat,RC1,0)/30,0),R8C>ROUND(DAYS360(ExpDat,RC1,0)/30,0)),0,OFFSET(R45C,MAX(-MNR,ROUND(DAYS360(ValDat,RC1,0)/30,0)-R8C+MEP-MNR),0,1,1))) -> 0 | T66: =IF(RC1="","",IF(OR(R8C<=ROUND(DAYS360(ValDat,RC1,0)/30,0),R8C>ROUND(DAYS360(ExpDat,RC1,0)/30,0)),0,OFFSET(R45C,MAX(-MNR,ROUND(DAYS360(ValDat,RC1,0)/30,0)-R8C+MEP-MNR),0,1,1))) -> 0 | U66: =IF(RC1="","",IF(OR(R8C<=ROUND(DAYS360(ValDat,RC1,0)/30,0),R8C>ROUND(DAYS360(ExpDat,RC1,0)/30,0)),0,OFFSET(R45C,MAX(-MNR,ROUND(DAYS360(ValDat,RC1,0)/30,0)-R8C+MEP-MNR),0,1,1))) -> 0 | V66: =IF(RC1="","",IF(OR(R8C<=ROUND(DAYS360(ValDat,RC1,0)/30,0),R8C>ROUND(DAYS360(ExpDat,RC1,0)/30,0)),0,OFFSET(R45C,MAX(-MNR,ROUND(DAYS360(ValDat,RC1,0)/30,0)-R8C+MEP-MNR),0,1,1))) -> 0 | W66: =IF(RC1="","",IF(OR(R8C<=ROUND(DAYS360(ValDat,RC1,0)/30,0),R8C>ROUND(DAYS360(ExpDat,RC1,0)/30,0)),0,OFFSET(R45C,MAX(-MNR,ROUND(DAYS360(ValDat,RC1,0)/30,0)-R8C+MEP-MNR),0,1,1))) -> 0 | X66: =IF(RC1="","",IF(OR(R8C<=ROUND(DAYS360(ValDat,RC1,0)/30,0),R8C>ROUND(DAYS360(ExpDat,RC1,0)/30,0)),0,OFFSET(R45C,MAX(-MNR,ROUND(DAYS360(ValDat,RC1,0)/30,0)-R8C+MEP-MNR),0,1,1))) -> 0 | Y66: =IF(RC1="","",IF(OR(R8C<=ROUND(DAYS360(ValDat,RC1,0)/30,0),R8C>ROUND(DAYS360(ExpDat,RC1,0)/30,0)),0,OFFSET(R45C,MAX(-MNR,ROUND(DAYS360(ValDat,RC1,0)/30,0)-R8C+MEP-MNR),0,1,1))) -> 0 | Z66: =IF(RC1="","",IF(OR(R8C<=ROUND(DAYS360(ValDat,RC1,0)/30,0),R8C>ROUND(DAYS360(ExpDat,RC1,0)/30,0)),0,OFFSET(R45C,MAX(-MNR,ROUND(DAYS360(ValDat,RC1,0)/30,0)-R8C+MEP-MNR),0,1,1))) -> 0 | AA66: =IF(RC1="","",IF(OR(R8C<=ROUND(DAYS360(ValDat,RC1,0)/30,0),R8C>ROUND(DAYS360(ExpDat,RC1,0)/30,0)),0,OFFSET(R45C,MAX(-MNR,ROUND(DAYS360(ValDat,RC1,0)/30,0)-R8C+MEP-MNR),0,1,1))) -> 0 | AB66: =IF(RC1="","",IF(OR(R8C<=ROUND(DAYS360(ValDat,RC1,0)/30,0),R8C>ROUND(DAYS360(ExpDat,RC1,0)/30,0)),0,OFFSET(R45C,MAX(-MNR,ROUND(DAYS360(ValDat,RC1,0)/30,0)-R8C+MEP-MNR),0,1,1))) -> 0 | AC66: =IF(RC1="","",IF(OR(R8C<=ROUND(DAYS360(ValDat,RC1,0)/30,0),R8C>ROUND(DAYS360(ExpDat,RC1,0)/30,0)),0,OFFSET(R45C,MAX(-MNR,ROUND(DAYS360(ValDat,RC1,0)/30,0)-R8C+MEP-MNR),0,1,1))) -> 0 | AD66: =IF(RC1="","",IF(OR(R8C<=ROUND(DAYS360(ValDat,RC1,0)/30,0),R8C>ROUND(DAYS360(ExpDat,RC1,0)/30,0)),0,OFFSET(R45C,MAX(-MNR,ROUND(DAYS360(ValDat,RC1,0)/30,0)-R8C+MEP-MNR),0,1,1))) -> 0 | AE66: =IF(RC1="","",IF(OR(R8C<=ROUND(DAYS360(ValDat,RC1,0)/30,0),R8C>ROUND(DAYS360(ExpDat,RC1,0)/30,0)),0,OFFSET(R45C,MAX(-MNR,ROUND(DAYS360(ValDat,RC1,0)/30,0)-R8C+MEP-MNR),0,1,1))) -> 0 | AF66: =IF(RC1="","",IF(OR(R8C<=ROUND(DAYS360(ValDat,RC1,0)/30,0),R8C>ROUND(DAYS360(ExpDat,RC1,0)/30,0)),0,OFFSET(R45C,MAX(-MNR,ROUND(DAYS360(ValDat,RC1,0)/30,0)-R8C+MEP-MNR),0,1,1))) -> 0 | AG66: =IF(RC1="","",IF(OR(R8C<=ROUND(DAYS360(ValDat,RC1,0)/30,0),R8C>ROUND(DAYS360(ExpDat,RC1,0)/30,0)),0,OFFSET(R45C,MAX(-MNR,ROUND(DAYS360(ValDat,RC1,0)/30,0)-R8C+MEP-MNR),0,1,1))) -> 0 | AH66: =IF(RC1="","",IF(OR(R8C<=ROUND(DAYS360(ValDat,RC1,0)/30,0),R8C>ROUND(DAYS360(ExpDat,RC1,0)/30,0)),0,OFFSET(R45C,MAX(-MNR,ROUND(DAYS360(ValDat,RC1,0)/30,0)-R8C+MEP-MNR),0,1,1))) -> 0 | AI66: =IF(RC1="","",IF(OR(R8C<=ROUND(DAYS360(ValDat,RC1,0)/30,0),R8C>ROUND(DAYS360(ExpDat,RC1,0)/30,0)),0,OFFSET(R45C,MAX(-MNR,ROUND(DAYS360(ValDat,RC1,0)/30,0)-R8C+MEP-MNR),0,1,1))) -> 0 | AJ66: =IF(RC1="","",IF(OR(R8C<=ROUND(DAYS360(ValDat,RC1,0)/30,0),R8C>ROUND(DAYS360(ExpDat,RC1,0)/30,0)),0,OFFSET(R45C,MAX(-MNR,ROUND(DAYS360(ValDat,RC1,0)/30,0)-R8C+MEP-MNR),0,1,1))) -> 0 | AK66: =IF(RC1="","",IF(OR(R8C<=ROUND(DAYS360(ValDat,RC1,0)/30,0),R8C>ROUND(DAYS360(ExpDat,RC1,0)/30,0)),0,OFFSET(R45C,MAX(-MNR,ROUND(DAYS360(ValDat,RC1,0)/30,0)-R8C+MEP-MNR),0,1,1))) -> 0 | AL66: =IF(RC1="","",IF(OR(R8C<=ROUND(DAYS360(ValDat,RC1,0)/30,0),R8C>ROUND(DAYS360(ExpDat,RC1,0)/30,0)),0,OFFSET(R45C,MAX(-MNR,ROUND(DAYS360(ValDat,RC1,0)/30,0)-R8C+MEP-MNR),0,1,1))) -> 0 | AM66: =IF(RC1="","",IF(OR(R8C<=ROUND(DAYS360(ValDat,RC1,0)/30,0),R8C>ROUND(DAYS360(ExpDat,RC1,0)/30,0)),0,OFFSET(R45C,MAX(-MNR,ROUND(DAYS360(ValDat,RC1,0)/30,0)-R8C+MEP-MNR),0,1,1))) -> 0 | AN66: =IF(RC1="","",IF(OR(R8C<=ROUND(DAYS360(ValDat,RC1,0)/30,0),R8C>ROUND(DAYS360(ExpDat,RC1,0)/30,0)),0,OFFSET(R45C,MAX(-MNR,ROUND(DAYS360(ValDat,RC1,0)/30,0)-R8C+MEP-MNR),0,1,1))) -> 0 | AO66: =IF(RC1="","",IF(OR(R8C<=ROUND(DAYS360(ValDat,RC1,0)/30,0),R8C>ROUND(DAYS360(ExpDat,RC1,0)/30,0)),0,OFFSET(R45C,MAX(-MNR,ROUND(DAYS360(ValDat,RC1,0)/30,0)-R8C+MEP-MNR),0,1,1))) -> 0
A67: =IF(R[-1]C="","",IF(DATE(YEAR(R[-1]C),MONTH(R[-1]C)+1,1)>RunDat,"",DATE(YEAR(R[-1]C),MONTH(R[-1]C)+1,1))) -> 1999-05-01T00:00:00.000 | D67: =IF(RC1="","",SUM(RC[2]:RC[37])) -> 134129 | F67: =IF(RC1="","",IF(OR(R8C<=ROUND(DAYS360(ValDat,RC1,0)/30,0),R8C>ROUND(DAYS360(ExpDat,RC1,0)/30,0)),0,OFFSET(R45C,MAX(-MNR,ROUND(DAYS360(ValDat,RC1,0)/30,0)-R8C+MEP-MNR),0,1,1))) -> 36127 | G67: =IF(RC1="","",IF(OR(R8C<=ROUND(DAYS360(ValDat,RC1,0)/30,0),R8C>ROUND(DAYS360(ExpDat,RC1,0)/30,0)),0,OFFSET(R45C,MAX(-MNR,ROUND(DAYS360(ValDat,RC1,0)/30,0)-R8C+MEP-MNR),0,1,1))) -> 64705 | H67: =IF(RC1="","",IF(OR(R8C<=ROUND(DAYS360(ValDat,RC1,0)/30,0),R8C>ROUND(DAYS360(ExpDat,RC1,0)/30,0)),0,OFFSET(R45C,MAX(-MNR,ROUND(DAYS360(ValDat,RC1,0)/30,0)-R8C+MEP-MNR),0,1,1))) -> 13660 | I67: =IF(RC1="","",IF(OR(R8C<=ROUND(DAYS360(ValDat,RC1,0)/30,0),R8C>ROUND(DAYS360(ExpDat,RC1,0)/30,0)),0,OFFSET(R45C,MAX(-MNR,ROUND(DAYS360(ValDat,RC1,0)/30,0)-R8C+MEP-MNR),0,1,1))) -> 15086 | J67: =IF(RC1="","",IF(OR(R8C<=ROUND(DAYS360(ValDat,RC1,0)/30,0),R8C>ROUND(DAYS360(ExpDat,RC1,0)/30,0)),0,OFFSET(R45C,MAX(-MNR,ROUND(DAYS360(ValDat,RC1,0)/30,0)-R8C+MEP-MNR),0,1,1))) -> 4149 | K67: =IF(RC1="","",IF(OR(R8C<=ROUND(DAYS360(ValDat,RC1,0)/30,0),R8C>ROUND(DAYS360(ExpDat,RC1,0)/30,0)),0,OFFSET(R45C,MAX(-MNR,ROUND(DAYS360(ValDat,RC1,0)/30,0)-R8C+MEP-MNR),0,1,1))) -> 402 | L67: =IF(RC1="","",IF(OR(R8C<=ROUND(DAYS360(ValDat,RC1,0)/30,0),R8C>ROUND(DAYS360(ExpDat,RC1,0)/30,0)),0,OFFSET(R45C,MAX(-MNR,ROUND(DAYS360(ValDat,RC1,0)/30,0)-R8C+MEP-MNR),0,1,1))) -> 0 | M67: =IF(RC1="","",IF(OR(R8C<=ROUND(DAYS360(ValDat,RC1,0)/30,0),R8C>ROUND(DAYS360(ExpDat,RC1,0)/30,0)),0,OFFSET(R45C,MAX(-MNR,ROUND(DAYS360(ValDat,RC1,0)/30,0)-R8C+MEP-MNR),0,1,1))) -> 0 | N67: =IF(RC1="","",IF(OR(R8C<=ROUND(DAYS360(ValDat,RC1,0)/30,0),R8C>ROUND(DAYS360(ExpDat,RC1,0)/30,0)),0,OFFSET(R45C,MAX(-MNR,ROUND(DAYS360(ValDat,RC1,0)/30,0)-R8C+MEP-MNR),0,1,1))) -> 0 | O67: =IF(RC1="","",IF(OR(R8C<=ROUND(DAYS360(ValDat,RC1,0)/30,0),R8C>ROUND(DAYS360(ExpDat,RC1,0)/30,0)),0,OFFSET(R45C,MAX(-MNR,ROUND(DAYS360(ValDat,RC1,0)/30,0)-R8C+MEP-MNR),0,1,1))) -> 0 | P67: =IF(RC1="","",IF(OR(R8C<=ROUND(DAYS360(ValDat,RC1,0)/30,0),R8C>ROUND(DAYS360(ExpDat,RC1,0)/30,0)),0,OFFSET(R45C,MAX(-MNR,ROUND(DAYS360(ValDat,RC1,0)/30,0)-R8C+MEP-MNR),0,1,1))) -> 0 | Q67: =IF(RC1="","",IF(OR(R8C<=ROUND(DAYS360(ValDat,RC1,0)/30,0),R8C>ROUND(DAYS360(ExpDat,RC1,0)/30,0)),0,OFFSET(R45C,MAX(-MNR,ROUND(DAYS360(ValDat,RC1,0)/30,0)-R8C+MEP-MNR),0,1,1))) -> 0 | R67: =IF(RC1="","",IF(OR(R8C<=ROUND(DAYS360(ValDat,RC1,0)/30,0),R8C>ROUND(DAYS360(ExpDat,RC1,0)/30,0)),0,OFFSET(R45C,MAX(-MNR,ROUND(DAYS360(ValDat,RC1,0)/30,0)-R8C+MEP-MNR),0,1,1))) -> 0 | S67: =IF(RC1="","",IF(OR(R8C<=ROUND(DAYS360(ValDat,RC1,0)/30,0),R8C>ROUND(DAYS360(ExpDat,RC1,0)/30,0)),0,OFFSET(R45C,MAX(-MNR,ROUND(DAYS360(ValDat,RC1,0)/30,0)-R8C+MEP-MNR),0,1,1))) -> 0 | T67: =IF(RC1="","",IF(OR(R8C<=ROUND(DAYS360(ValDat,RC1,0)/30,0),R8C>ROUND(DAYS360(ExpDat,RC1,0)/30,0)),0,OFFSET(R45C,MAX(-MNR,ROUND(DAYS360(ValDat,RC1,0)/30,0)-R8C+MEP-MNR),0,1,1))) -> 0 | U67: =IF(RC1="","",IF(OR(R8C<=ROUND(DAYS360(ValDat,RC1,0)/30,0),R8C>ROUND(DAYS360(ExpDat,RC1,0)/30,0)),0,OFFSET(R45C,MAX(-MNR,ROUND(DAYS360(ValDat,RC1,0)/30,0)-R8C+MEP-MNR),0,1,1))) -> 0 | V67: =IF(RC1="","",IF(OR(R8C<=ROUND(DAYS360(ValDat,RC1,0)/30,0),R8C>ROUND(DAYS360(ExpDat,RC1,0)/30,0)),0,OFFSET(R45C,MAX(-MNR,ROUND(DAYS360(ValDat,RC1,0)/30,0)-R8C+MEP-MNR),0,1,1))) -> 0 | W67: =IF(RC1="","",IF(OR(R8C<=ROUND(DAYS360(ValDat,RC1,0)/30,0),R8C>ROUND(DAYS360(ExpDat,RC1,0)/30,0)),0,OFFSET(R45C,MAX(-MNR,ROUND(DAYS360(ValDat,RC1,0)/30,0)-R8C+MEP-MNR),0,1,1))) -> 0 | X67: =IF(RC1="","",IF(OR(R8C<=ROUND(DAYS360(ValDat,RC1,0)/30,0),R8C>ROUND(DAYS360(ExpDat,RC1,0)/30,0)),0,OFFSET(R45C,MAX(-MNR,ROUND(DAYS360(ValDat,RC1,0)/30,0)-R8C+MEP-MNR),0,1,1))) -> 0 | Y67: =IF(RC1="","",IF(OR(R8C<=ROUND(DAYS360(ValDat,RC1,0)/30,0),R8C>ROUND(DAYS360(ExpDat,RC1,0)/30,0)),0,OFFSET(R45C,MAX(-MNR,ROUND(DAYS360(ValDat,RC1,0)/30,0)-R8C+MEP-MNR),0,1,1))) -> 0 | Z67: =IF(RC1="","",IF(OR(R8C<=ROUND(DAYS360(ValDat,RC1,0)/30,0),R8C>ROUND(DAYS360(ExpDat,RC1,0)/30,0)),0,OFFSET(R45C,MAX(-MNR,ROUND(DAYS360(ValDat,RC1,0)/30,0)-R8C+MEP-MNR),0,1,1))) -> 0 | AA67: =IF(RC1="","",IF(OR(R8C<=ROUND(DAYS360(ValDat,RC1,0)/30,0),R8C>ROUND(DAYS360(ExpDat,RC1,0)/30,0)),0,OFFSET(R45C,MAX(-MNR,ROUND(DAYS360(ValDat,RC1,0)/30,0)-R8C+MEP-MNR),0,1,1))) -> 0 | AB67: =IF(RC1="","",IF(OR(R8C<=ROUND(DAYS360(ValDat,RC1,0)/30,0),R8C>ROUND(DAYS360(ExpDat,RC1,0)/30,0)),0,OFFSET(R45C,MAX(-MNR,ROUND(DAYS360(ValDat,RC1,0)/30,0)-R8C+MEP-MNR),0,1,1))) -> 0 | AC67: =IF(RC1="","",IF(OR(R8C<=ROUND(DAYS360(ValDat,RC1,0)/30,0),R8C>ROUND(DAYS360(ExpDat,RC1,0)/30,0)),0,OFFSET(R45C,MAX(-MNR,ROUND(DAYS360(ValDat,RC1,0)/30,0)-R8C+MEP-MNR),0,1,1))) -> 0 | AD67: =IF(RC1="","",IF(OR(R8C<=ROUND(DAYS360(ValDat,RC1,0)/30,0),R8C>ROUND(DAYS360(ExpDat,RC1,0)/30,0)),0,OFFSET(R45C,MAX(-MNR,ROUND(DAYS360(ValDat,RC1,0)/30,0)-R8C+MEP-MNR),0,1,1))) -> 0 | AE67: =IF(RC1="","",IF(OR(R8C<=ROUND(DAYS360(ValDat,RC1,0)/30,0),R8C>ROUND(DAYS360(ExpDat,RC1,0)/30,0)),0,OFFSET(R45C,MAX(-MNR,ROUND(DAYS360(ValDat,RC1,0)/30,0)-R8C+MEP-MNR),0,1,1))) -> 0 | AF67: =IF(RC1="","",IF(OR(R8C<=ROUND(DAYS360(ValDat,RC1,0)/30,0),R8C>ROUND(DAYS360(ExpDat,RC1,0)/30,0)),0,OFFSET(R45C,MAX(-MNR,ROUND(DAYS360(ValDat,RC1,0)/30,0)-R8C+MEP-MNR),0,1,1))) -> 0 | AG67: =IF(RC1="","",IF(OR(R8C<=ROUND(DAYS360(ValDat,RC1,0)/30,0),R8C>ROUND(DAYS360(ExpDat,RC1,0)/30,0)),0,OFFSET(R45C,MAX(-MNR,ROUND(DAYS360(ValDat,RC1,0)/30,0)-R8C+MEP-MNR),0,1,1))) -> 0 | AH67: =IF(RC1="","",IF(OR(R8C<=ROUND(DAYS360(ValDat,RC1,0)/30,0),R8C>ROUND(DAYS360(ExpDat,RC1,0)/30,0)),0,OFFSET(R45C,MAX(-MNR,ROUND(DAYS360(ValDat,RC1,0)/30,0)-R8C+MEP-MNR),0,1,1))) -> 0 | AI67: =IF(RC1="","",IF(OR(R8C<=ROUND(DAYS360(ValDat,RC1,0)/30,0),R8C>ROUND(DAYS360(ExpDat,RC1,0)/30,0)),0,OFFSET(R45C,MAX(-MNR,ROUND(DAYS360(ValDat,RC1,0)/30,0)-R8C+MEP-MNR),0,1,1))) -> 0 | AJ67: =IF(RC1="","",IF(OR(R8C<=ROUND(DAYS360(ValDat,RC1,0)/30,0),R8C>ROUND(DAYS360(ExpDat,RC1,0)/30,0)),0,OFFSET(R45C,MAX(-MNR,ROUND(DAYS360(ValDat,RC1,0)/30,0)-R8C+MEP-MNR),0,1,1))) -> 0 | AK67: =IF(RC1="","",IF(OR(R8C<=ROUND(DAYS360(ValDat,RC1,0)/30,0),R8C>ROUND(DAYS360(ExpDat,RC1,0)/30,0)),0,OFFSET(R45C,MAX(-MNR,ROUND(DAYS360(ValDat,RC1,0)/30,0)-R8C+MEP-MNR),0,1,1))) -> 0 | AL67: =IF(RC1="","",IF(OR(R8C<=ROUND(DAYS360(ValDat,RC1,0)/30,0),R8C>ROUND(DAYS360(ExpDat,RC1,0)/30,0)),0,OFFSET(R45C,MAX(-MNR,ROUND(DAYS360(ValDat,RC1,0)/30,0)-R8C+MEP-MNR),0,1,1))) -> 0 | AM67: =IF(RC1="","",IF(OR(R8C<=ROUND(DAYS360(ValDat,RC1,0)/30,0),R8C>ROUND(DAYS360(ExpDat,RC1,0)/30,0)),0,OFFSET(R45C,MAX(-MNR,ROUND(DAYS360(ValDat,RC1,0)/30,0)-R8C+MEP-MNR),0,1,1))) -> 0 | AN67: =IF(RC1="","",IF(OR(R8C<=ROUND(DAYS360(ValDat,RC1,0)/30,0),R8C>ROUND(DAYS360(ExpDat,RC1,0)/30,0)),0,OFFSET(R45C,MAX(-MNR,ROUND(DAYS360(ValDat,RC1,0)/30,0)-R8C+MEP-MNR),0,1,1))) -> 0 | AO67: =IF(RC1="","",IF(OR(R8C<=ROUND(DAYS360(ValDat,RC1,0)/30,0),R8C>ROUND(DAYS360(ExpDat,RC1,0)/30,0)),0,OFFSET(R45C,MAX(-MNR,ROUND(DAYS360(ValDat,RC1,0)/30,0)-R8C+MEP-MNR),0,1,1))) -> 0
A68: =IF(R[-1]C="","",IF(DATE(YEAR(R[-1]C),MONTH(R[-1]C)+1,1)>RunDat,"",DATE(YEAR(R[-1]C),MONTH(R[-1]C)+1,1))) -> 1999-06-01T00:00:00.000 | D68: =IF(RC1="","",SUM(RC[2]:RC[37])) -> 135120 | F68: =IF(RC1="","",IF(OR(R8C<=ROUND(DAYS360(ValDat,RC1,0)/30,0),R8C>ROUND(DAYS360(ExpDat,RC1,0)/30,0)),0,OFFSET(R45C,MAX(-MNR,ROUND(DAYS360(ValDat,RC1,0)/30,0)-R8C+MEP-MNR),0,1,1))) -> 16631 | G68: =IF(RC1="","",IF(OR(R8C<=ROUND(DAYS360(ValDat,RC1,0)/30,0),R8C>ROUND(DAYS360(ExpDat,RC1,0)/30,0)),0,OFFSET(R45C,MAX(-MNR,ROUND(DAYS360(ValDat,RC1,0)/30,0)-R8C+MEP-MNR),0,1,1))) -> 62953 | H68: =IF(RC1="","",IF(OR(R8C<=ROUND(DAYS360(ValDat,RC1,0)/30,0),R8C>ROUND(DAYS360(ExpDat,RC1,0)/30,0)),0,OFFSET(R45C,MAX(-MNR,ROUND(DAYS360(ValDat,RC1,0)/30,0)-R8C+MEP-MNR),0,1,1))) -> 35845 | I68: =IF(RC1="","",IF(OR(R8C<=ROUND(DAYS360(ValDat,RC1,0)/30,0),R8C>ROUND(DAYS360(ExpDat,RC1,0)/30,0)),0,OFFSET(R45C,MAX(-MNR,ROUND(DAYS360(ValDat,RC1,0)/30,0)-R8C+MEP-MNR),0,1,1))) -> 10719 | J68: =IF(RC1="","",IF(OR(R8C<=ROUND(DAYS360(ValDat,RC1,0)/30,0),R8C>ROUND(DAYS360(ExpDat,RC1,0)/30,0)),0,OFFSET(R45C,MAX(-MNR,ROUND(DAYS360(ValDat,RC1,0)/30,0)-R8C+MEP-MNR),0,1,1))) -> 8570 | K68: =IF(RC1="","",IF(OR(R8C<=ROUND(DAYS360(ValDat,RC1,0)/30,0),R8C>ROUND(DAYS360(ExpDat,RC1,0)/30,0)),0,OFFSET(R45C,MAX(-MNR,ROUND(DAYS360(ValDat,RC1,0)/30,0)-R8C+MEP-MNR),0,1,1))) -> 402 | L68: =IF(RC1="","",IF(OR(R8C<=ROUND(DAYS360(ValDat,RC1,0)/30,0),R8C>ROUND(DAYS360(ExpDat,RC1,0)/30,0)),0,OFFSET(R45C,MAX(-MNR,ROUND(DAYS360(ValDat,RC1,0)/30,0)-R8C+MEP-MNR),0,1,1))) -> 0 | M68: =IF(RC1="","",IF(OR(R8C<=ROUND(DAYS360(ValDat,RC1,0)/30,0),R8C>ROUND(DAYS360(ExpDat,RC1,0)/30,0)),0,OFFSET(R45C,MAX(-MNR,ROUND(DAYS360(ValDat,RC1,0)/30,0)-R8C+MEP-MNR),0,1,1))) -> 0 | N68: =IF(RC1="","",IF(OR(R8C<=ROUND(DAYS360(ValDat,RC1,0)/30,0),R8C>ROUND(DAYS360(ExpDat,RC1,0)/30,0)),0,OFFSET(R45C,MAX(-MNR,ROUND(DAYS360(ValDat,RC1,0)/30,0)-R8C+MEP-MNR),0,1,1))) -> 0 | O68: =IF(RC1="","",IF(OR(R8C<=ROUND(DAYS360(ValDat,RC1,0)/30,0),R8C>ROUND(DAYS360(ExpDat,RC1,0)/30,0)),0,OFFSET(R45C,MAX(-MNR,ROUND(DAYS360(ValDat,RC1,0)/30,0)-R8C+MEP-MNR),0,1,1))) -> 0 | P68: =IF(RC1="","",IF(OR(R8C<=ROUND(DAYS360(ValDat,RC1,0)/30,0),R8C>ROUND(DAYS360(ExpDat,RC1,0)/30,0)),0,OFFSET(R45C,MAX(-MNR,ROUND(DAYS360(ValDat,RC1,0)/30,0)-R8C+MEP-MNR),0,1,1))) -> 0 | Q68: =IF(RC1="","",IF(OR(R8C<=ROUND(DAYS360(ValDat,RC1,0)/30,0),R8C>ROUND(DAYS360(ExpDat,RC1,0)/30,0)),0,OFFSET(R45C,MAX(-MNR,ROUND(DAYS360(ValDat,RC1,0)/30,0)-R8C+MEP-MNR),0,1,1))) -> 0 | R68: =IF(RC1="","",IF(OR(R8C<=ROUND(DAYS360(ValDat,RC1,0)/30,0),R8C>ROUND(DAYS360(ExpDat,RC1,0)/30,0)),0,OFFSET(R45C,MAX(-MNR,ROUND(DAYS360(ValDat,RC1,0)/30,0)-R8C+MEP-MNR),0,1,1))) -> 0 | S68: =IF(RC1="","",IF(OR(R8C<=ROUND(DAYS360(ValDat,RC1,0)/30,0),R8C>ROUND(DAYS360(ExpDat,RC1,0)/30,0)),0,OFFSET(R45C,MAX(-MNR,ROUND(DAYS360(ValDat,RC1,0)/30,0)-R8C+MEP-MNR),0,1,1))) -> 0 | T68: =IF(RC1="","",IF(OR(R8C<=ROUND(DAYS360(ValDat,RC1,0)/30,0),R8C>ROUND(DAYS360(ExpDat,RC1,0)/30,0)),0,OFFSET(R45C,MAX(-MNR,ROUND(DAYS360(ValDat,RC1,0)/30,0)-R8C+MEP-MNR),0,1,1))) -> 0 | U68: =IF(RC1="","",IF(OR(R8C<=ROUND(DAYS360(ValDat,RC1,0)/30,0),R8C>ROUND(DAYS360(ExpDat,RC1,0)/30,0)),0,OFFSET(R45C,MAX(-MNR,ROUND(DAYS360(ValDat,RC1,0)/30,0)-R8C+MEP-MNR),0,1,1))) -> 0 | V68: =IF(RC1="","",IF(OR(R8C<=ROUND(DAYS360(ValDat,RC1,0)/30,0),R8C>ROUND(DAYS360(ExpDat,RC1,0)/30,0)),0,OFFSET(R45C,MAX(-MNR,ROUND(DAYS360(ValDat,RC1,0)/30,0)-R8C+MEP-MNR),0,1,1))) -> 0 | W68: =IF(RC1="","",IF(OR(R8C<=ROUND(DAYS360(ValDat,RC1,0)/30,0),R8C>ROUND(DAYS360(ExpDat,RC1,0)/30,0)),0,OFFSET(R45C,MAX(-MNR,ROUND(DAYS360(ValDat,RC1,0)/30,0)-R8C+MEP-MNR),0,1,1))) -> 0 | X68: =IF(RC1="","",IF(OR(R8C<=ROUND(DAYS360(ValDat,RC1,0)/30,0),R8C>ROUND(DAYS360(ExpDat,RC1,0)/30,0)),0,OFFSET(R45C,MAX(-MNR,ROUND(DAYS360(ValDat,RC1,0)/30,0)-R8C+MEP-MNR),0,1,1))) -> 0 | Y68: =IF(RC1="","",IF(OR(R8C<=ROUND(DAYS360(ValDat,RC1,0)/30,0),R8C>ROUND(DAYS360(ExpDat,RC1,0)/30,0)),0,OFFSET(R45C,MAX(-MNR,ROUND(DAYS360(ValDat,RC1,0)/30,0)-R8C+MEP-MNR),0,1,1))) -> 0 | Z68: =IF(RC1="","",IF(OR(R8C<=ROUND(DAYS360(ValDat,RC1,0)/30,0),R8C>ROUND(DAYS360(ExpDat,RC1,0)/30,0)),0,OFFSET(R45C,MAX(-MNR,ROUND(DAYS360(ValDat,RC1,0)/30,0)-R8C+MEP-MNR),0,1,1))) -> 0 | AA68: =IF(RC1="","",IF(OR(R8C<=ROUND(DAYS360(ValDat,RC1,0)/30,0),R8C>ROUND(DAYS360(ExpDat,RC1,0)/30,0)),0,OFFSET(R45C,MAX(-MNR,ROUND(DAYS360(ValDat,RC1,0)/30,0)-R8C+MEP-MNR),0,1,1))) -> 0 | AB68: =IF(RC1="","",IF(OR(R8C<=ROUND(DAYS360(ValDat,RC1,0)/30,0),R8C>ROUND(DAYS360(ExpDat,RC1,0)/30,0)),0,OFFSET(R45C,MAX(-MNR,ROUND(DAYS360(ValDat,RC1,0)/30,0)-R8C+MEP-MNR),0,1,1))) -> 0 | AC68: =IF(RC1="","",IF(OR(R8C<=ROUND(DAYS360(ValDat,RC1,0)/30,0),R8C>ROUND(DAYS360(ExpDat,RC1,0)/30,0)),0,OFFSET(R45C,MAX(-MNR,ROUND(DAYS360(ValDat,RC1,0)/30,0)-R8C+MEP-MNR),0,1,1))) -> 0 | AD68: =IF(RC1="","",IF(OR(R8C<=ROUND(DAYS360(ValDat,RC1,0)/30,0),R8C>ROUND(DAYS360(ExpDat,RC1,0)/30,0)),0,OFFSET(R45C,MAX(-MNR,ROUND(DAYS360(ValDat,RC1,0)/30,0)-R8C+MEP-MNR),0,1,1))) -> 0 | AE68: =IF(RC1="","",IF(OR(R8C<=ROUND(DAYS360(ValDat,RC1,0)/30,0),R8C>ROUND(DAYS360(ExpDat,RC1,0)/30,0)),0,OFFSET(R45C,MAX(-MNR,ROUND(DAYS360(ValDat,RC1,0)/30,0)-R8C+MEP-MNR),0,1,1))) -> 0 | AF68: =IF(RC1="","",IF(OR(R8C<=ROUND(DAYS360(ValDat,RC1,0)/30,0),R8C>ROUND(DAYS360(ExpDat,RC1,0)/30,0)),0,OFFSET(R45C,MAX(-MNR,ROUND(DAYS360(ValDat,RC1,0)/30,0)-R8C+MEP-MNR),0,1,1))) -> 0 | AG68: =IF(RC1="","",IF(OR(R8C<=ROUND(DAYS360(ValDat,RC1,0)/30,0),R8C>ROUND(DAYS360(ExpDat,RC1,0)/30,0)),0,OFFSET(R45C,MAX(-MNR,ROUND(DAYS360(ValDat,RC1,0)/30,0)-R8C+MEP-MNR),0,1,1))) -> 0 | AH68: =IF(RC1="","",IF(OR(R8C<=ROUND(DAYS360(ValDat,RC1,0)/30,0),R8C>ROUND(DAYS360(ExpDat,RC1,0)/30,0)),0,OFFSET(R45C,MAX(-MNR,ROUND(DAYS360(ValDat,RC1,0)/30,0)-R8C+MEP-MNR),0,1,1))) -> 0 | AI68: =IF(RC1="","",IF(OR(R8C<=ROUND(DAYS360(ValDat,RC1,0)/30,0),R8C>ROUND(DAYS360(ExpDat,RC1,0)/30,0)),0,OFFSET(R45C,MAX(-MNR,ROUND(DAYS360(ValDat,RC1,0)/30,0)-R8C+MEP-MNR),0,1,1))) -> 0 | AJ68: =IF(RC1="","",IF(OR(R8C<=ROUND(DAYS360(ValDat,RC1,0)/30,0),R8C>ROUND(DAYS360(ExpDat,RC1,0)/30,0)),0,OFFSET(R45C,MAX(-MNR,ROUND(DAYS360(ValDat,RC1,0)/30,0)-R8C+MEP-MNR),0,1,1))) -> 0 | AK68: =IF(RC1="","",IF(OR(R8C<=ROUND(DAYS360(ValDat,RC1,0)/30,0),R8C>ROUND(DAYS360(ExpDat,RC1,0)/30,0)),0,OFFSET(R45C,MAX(-MNR,ROUND(DAYS360(ValDat,RC1,0)/30,0)-R8C+MEP-MNR),0,1,1))) -> 0 | AL68: =IF(RC1="","",IF(OR(R8C<=ROUND(DAYS360(ValDat,RC1,0)/30,0),R8C>ROUND(DAYS360(ExpDat,RC1,0)/30,0)),0,OFFSET(R45C,MAX(-MNR,ROUND(DAYS360(ValDat,RC1,0)/30,0)-R8C+MEP-MNR),0,1,1))) -> 0 | AM68: =IF(RC1="","",IF(OR(R8C<=ROUND(DAYS360(ValDat,RC1,0)/30,0),R8C>ROUND(DAYS360(ExpDat,RC1,0)/30,0)),0,OFFSET(R45C,MAX(-MNR,ROUND(DAYS360(ValDat,RC1,0)/30,0)-R8C+MEP-MNR),0,1,1))) -> 0 | AN68: =IF(RC1="","",IF(OR(R8C<=ROUND(DAYS360(ValDat,RC1,0)/30,0),R8C>ROUND(DAYS360(ExpDat,RC1,0)/30,0)),0,OFFSET(R45C,MAX(-MNR,ROUND(DAYS360(ValDat,RC1,0)/30,0)-R8C+MEP-MNR),0,1,1))) -> 0 | AO68: =IF(RC1="","",IF(OR(R8C<=ROUND(DAYS360(ValDat,RC1,0)/30,0),R8C>ROUND(DAYS360(ExpDat,RC1,0)/30,0)),0,OFFSET(R45C,MAX(-MNR,ROUND(DAYS360(ValDat,RC1,0)/30,0)-R8C+MEP-MNR),0,1,1))) -> 0
A69: =IF(R[-1]C="","",IF(DATE(YEAR(R[-1]C),MONTH(R[-1]C)+1,1)>RunDat,"",DATE(YEAR(R[-1]C),MONTH(R[-1]C)+1,1))) -> 1999-07-01T00:00:00.000 | D69: =IF(RC1="","",SUM(RC[2]:RC[37])) -> 317938 | F69: =IF(RC1="","",IF(OR(R8C<=ROUND(DAYS360(ValDat,RC1,0)/30,0),R8C>ROUND(DAYS360(ExpDat,RC1,0)/30,0)),0,OFFSET(R45C,MAX(-MNR,ROUND(DAYS360(ValDat,RC1,0)/30,0)-R8C+MEP-MNR),0,1,1))) -> 98502 | G69: =IF(RC1="","",IF(OR(R8C<=ROUND(DAYS360(ValDat,RC1,0)/30,0),R8C>ROUND(DAYS360(ExpDat,RC1,0)/30,0)),0,OFFSET(R45C,MAX(-MNR,ROUND(DAYS360(ValDat,RC1,0)/30,0)-R8C+MEP-MNR),0,1,1))) -> 145028 | H69: =IF(RC1="","",IF(OR(R8C<=ROUND(DAYS360(ValDat,RC1,0)/30,0),R8C>ROUND(DAYS360(ExpDat,RC1,0)/30,0)),0,OFFSET(R45C,MAX(-MNR,ROUND(DAYS360(ValDat,RC1,0)/30,0)-R8C+MEP-MNR),0,1,1))) -> 22027 | I69: =IF(RC1="","",IF(OR(R8C<=ROUND(DAYS360(ValDat,RC1,0)/30,0),R8C>ROUND(DAYS360(ExpDat,RC1,0)/30,0)),0,OFFSET(R45C,MAX(-MNR,ROUND(DAYS360(ValDat,RC1,0)/30,0)-R8C+MEP-MNR),0,1,1))) -> 36513 | J69: =IF(RC1="","",IF(OR(R8C<=ROUND(DAYS360(ValDat,RC1,0)/30,0),R8C>ROUND(DAYS360(ExpDat,RC1,0)/30,0)),0,OFFSET(R45C,MAX(-MNR,ROUND(DAYS360(ValDat,RC1,0)/30,0)-R8C+MEP-MNR),0,1,1))) -> 11697 | K69: =IF(RC1="","",IF(OR(R8C<=ROUND(DAYS360(ValDat,RC1,0)/30,0),R8C>ROUND(DAYS360(ExpDat,RC1,0)/30,0)),0,OFFSET(R45C,MAX(-MNR,ROUND(DAYS360(ValDat,RC1,0)/30,0)-R8C+MEP-MNR),0,1,1))) -> 4171 | L69: =IF(RC1="","",IF(OR(R8C<=ROUND(DAYS360(ValDat,RC1,0)/30,0),R8C>ROUND(DAYS360(ExpDat,RC1,0)/30,0)),0,OFFSET(R45C,MAX(-MNR,ROUND(DAYS360(ValDat,RC1,0)/30,0)-R8C+MEP-MNR),0,1,1))) -> 0 | M69: =IF(RC1="","",IF(OR(R8C<=ROUND(DAYS360(ValDat,RC1,0)/30,0),R8C>ROUND(DAYS360(ExpDat,RC1,0)/30,0)),0,OFFSET(R45C,MAX(-MNR,ROUND(DAYS360(ValDat,RC1,0)/30,0)-R8C+MEP-MNR),0,1,1))) -> 0 | N69: =IF(RC1="","",IF(OR(R8C<=ROUND(DAYS360(ValDat,RC1,0)/30,0),R8C>ROUND(DAYS360(ExpDat,RC1,0)/30,0)),0,OFFSET(R45C,MAX(-MNR,ROUND(DAYS360(ValDat,RC1,0)/30,0)-R8C+MEP-MNR),0,1,1))) -> 0 | O69: =IF(RC1="","",IF(OR(R8C<=ROUND(DAYS360(ValDat,RC1,0)/30,0),R8C>ROUND(DAYS360(ExpDat,RC1,0)/30,0)),0,OFFSET(R45C,MAX(-MNR,ROUND(DAYS360(ValDat,RC1,0)/30,0)-R8C+MEP-MNR),0,1,1))) -> 0 | P69: =IF(RC1="","",IF(OR(R8C<=ROUND(DAYS360(ValDat,RC1,0)/30,0),R8C>ROUND(DAYS360(ExpDat,RC1,0)/30,0)),0,OFFSET(R45C,MAX(-MNR,ROUND(DAYS360(ValDat,RC1,0)/30,0)-R8C+MEP-MNR),0,1,1))) -> 0 | Q69: =IF(RC1="","",IF(OR(R8C<=ROUND(DAYS360(ValDat,RC1,0)/30,0),R8C>ROUND(DAYS360(ExpDat,RC1,0)/30,0)),0,OFFSET(R45C,MAX(-MNR,ROUND(DAYS360(ValDat,RC1,0)/30,0)-R8C+MEP-MNR),0,1,1))) -> 0 | R69: =IF(RC1="","",IF(OR(R8C<=ROUND(DAYS360(ValDat,RC1,0)/30,0),R8C>ROUND(DAYS360(ExpDat,RC1,0)/30,0)),0,OFFSET(R45C,MAX(-MNR,ROUND(DAYS360(ValDat,RC1,0)/30,0)-R8C+MEP-MNR),0,1,1))) -> 0 | S69: =IF(RC1="","",IF(OR(R8C<=ROUND(DAYS360(ValDat,RC1,0)/30,0),R8C>ROUND(DAYS360(ExpDat,RC1,0)/30,0)),0,OFFSET(R45C,MAX(-MNR,ROUND(DAYS360(ValDat,RC1,0)/30,0)-R8C+MEP-MNR),0,1,1))) -> 0 | T69: =IF(RC1="","",IF(OR(R8C<=ROUND(DAYS360(ValDat,RC1,0)/30,0),R8C>ROUND(DAYS360(ExpDat,RC1,0)/30,0)),0,OFFSET(R45C,MAX(-MNR,ROUND(DAYS360(ValDat,RC1,0)/30,0)-R8C+MEP-MNR),0,1,1))) -> 0 | U69: =IF(RC1="","",IF(OR(R8C<=ROUND(DAYS360(ValDat,RC1,0)/30,0),R8C>ROUND(DAYS360(ExpDat,RC1,0)/30,0)),0,OFFSET(R45C,MAX(-MNR,ROUND(DAYS360(ValDat,RC1,0)/30,0)-R8C+MEP-MNR),0,1,1))) -> 0 | V69: =IF(RC1="","",IF(OR(R8C<=ROUND(DAYS360(ValDat,RC1,0)/30,0),R8C>ROUND(DAYS360(ExpDat,RC1,0)/30,0)),0,OFFSET(R45C,MAX(-MNR,ROUND(DAYS360(ValDat,RC1,0)/30,0)-R8C+MEP-MNR),0,1,1))) -> 0 | W69: =IF(RC1="","",IF(OR(R8C<=ROUND(DAYS360(ValDat,RC1,0)/30,0),R8C>ROUND(DAYS360(ExpDat,RC1,0)/30,0)),0,OFFSET(R45C,MAX(-MNR,ROUND(DAYS360(ValDat,RC1,0)/30,0)-R8C+MEP-MNR),0,1,1))) -> 0 | X69: =IF(RC1="","",IF(OR(R8C<=ROUND(DAYS360(ValDat,RC1,0)/30,0),R8C>ROUND(DAYS360(ExpDat,RC1,0)/30,0)),0,OFFSET(R45C,MAX(-MNR,ROUND(DAYS360(ValDat,RC1,0)/30,0)-R8C+MEP-MNR),0,1,1))) -> 0 | Y69: =IF(RC1="","",IF(OR(R8C<=ROUND(DAYS360(ValDat,RC1,0)/30,0),R8C>ROUND(DAYS360(ExpDat,RC1,0)/30,0)),0,OFFSET(R45C,MAX(-MNR,ROUND(DAYS360(ValDat,RC1,0)/30,0)-R8C+MEP-MNR),0,1,1))) -> 0 | Z69: =IF(RC1="","",IF(OR(R8C<=ROUND(DAYS360(ValDat,RC1,0)/30,0),R8C>ROUND(DAYS360(ExpDat,RC1,0)/30,0)),0,OFFSET(R45C,MAX(-MNR,ROUND(DAYS360(ValDat,RC1,0)/30,0)-R8C+MEP-MNR),0,1,1))) -> 0 | AA69: =IF(RC1="","",IF(OR(R8C<=ROUND(DAYS360(ValDat,RC1,0)/30,0),R8C>ROUND(DAYS360(ExpDat,RC1,0)/30,0)),0,OFFSET(R45C,MAX(-MNR,ROUND(DAYS360(ValDat,RC1,0)/30,0)-R8C+MEP-MNR),0,1,1))) -> 0 | AB69: =IF(RC1="","",IF(OR(R8C<=ROUND(DAYS360(ValDat,RC1,0)/30,0),R8C>ROUND(DAYS360(ExpDat,RC1,0)/30,0)),0,OFFSET(R45C,MAX(-MNR,ROUND(DAYS360(ValDat,RC1,0)/30,0)-R8C+MEP-MNR),0,1,1))) -> 0 | AC69: =IF(RC1="","",IF(OR(R8C<=ROUND(DAYS360(ValDat,RC1,0)/30,0),R8C>ROUND(DAYS360(ExpDat,RC1,0)/30,0)),0,OFFSET(R45C,MAX(-MNR,ROUND(DAYS360(ValDat,RC1,0)/30,0)-R8C+MEP-MNR),0,1,1))) -> 0 | AD69: =IF(RC1="","",IF(OR(R8C<=ROUND(DAYS360(ValDat,RC1,0)/30,0),R8C>ROUND(DAYS360(ExpDat,RC1,0)/30,0)),0,OFFSET(R45C,MAX(-MNR,ROUND(DAYS360(ValDat,RC1,0)/30,0)-R8C+MEP-MNR),0,1,1))) -> 0 | AE69: =IF(RC1="","",IF(OR(R8C<=ROUND(DAYS360(ValDat,RC1,0)/30,0),R8C>ROUND(DAYS360(ExpDat,RC1,0)/30,0)),0,OFFSET(R45C,MAX(-MNR,ROUND(DAYS360(ValDat,RC1,0)/30,0)-R8C+MEP-MNR),0,1,1))) -> 0 | AF69: =IF(RC1="","",IF(OR(R8C<=ROUND(DAYS360(ValDat,RC1,0)/30,0),R8C>ROUND(DAYS360(ExpDat,RC1,0)/30,0)),0,OFFSET(R45C,MAX(-MNR,ROUND(DAYS360(ValDat,RC1,0)/30,0)-R8C+MEP-MNR),0,1,1))) -> 0 | AG69: =IF(RC1="","",IF(OR(R8C<=ROUND(DAYS360(ValDat,RC1,0)/30,0),R8C>ROUND(DAYS360(ExpDat,RC1,0)/30,0)),0,OFFSET(R45C,MAX(-MNR,ROUND(DAYS360(ValDat,RC1,0)/30,0)-R8C+MEP-MNR),0,1,1))) -> 0 | AH69: =IF(RC1="","",IF(OR(R8C<=ROUND(DAYS360(ValDat,RC1,0)/30,0),R8C>ROUND(DAYS360(ExpDat,RC1,0)/30,0)),0,OFFSET(R45C,MAX(-MNR,ROUND(DAYS360(ValDat,RC1,0)/30,0)-R8C+MEP-MNR),0,1,1))) -> 0 | AI69: =IF(RC1="","",IF(OR(R8C<=ROUND(DAYS360(ValDat,RC1,0)/30,0),R8C>ROUND(DAYS360(ExpDat,RC1,0)/30,0)),0,OFFSET(R45C,MAX(-MNR,ROUND(DAYS360(ValDat,RC1,0)/30,0)-R8C+MEP-MNR),0,1,1))) -> 0 | AJ69: =IF(RC1="","",IF(OR(R8C<=ROUND(DAYS360(ValDat,RC1,0)/30,0),R8C>ROUND(DAYS360(ExpDat,RC1,0)/30,0)),0,OFFSET(R45C,MAX(-MNR,ROUND(DAYS360(ValDat,RC1,0)/30,0)-R8C+MEP-MNR),0,1,1))) -> 0 | AK69: =IF(RC1="","",IF(OR(R8C<=ROUND(DAYS360(ValDat,RC1,0)/30,0),R8C>ROUND(DAYS360(ExpDat,RC1,0)/30,0)),0,OFFSET(R45C,MAX(-MNR,ROUND(DAYS360(ValDat,RC1,0)/30,0)-R8C+MEP-MNR),0,1,1))) -> 0 | AL69: =IF(RC1="","",IF(OR(R8C<=ROUND(DAYS360(ValDat,RC1,0)/30,0),R8C>ROUND(DAYS360(ExpDat,RC1,0)/30,0)),0,OFFSET(R45C,MAX(-MNR,ROUND(DAYS360(ValDat,RC1,0)/30,0)-R8C+MEP-MNR),0,1,1))) -> 0 | AM69: =IF(RC1="","",IF(OR(R8C<=ROUND(DAYS360(ValDat,RC1,0)/30,0),R8C>ROUND(DAYS360(ExpDat,RC1,0)/30,0)),0,OFFSET(R45C,MAX(-MNR,ROUND(DAYS360(ValDat,RC1,0)/30,0)-R8C+MEP-MNR),0,1,1))) -> 0 | AN69: =IF(RC1="","",IF(OR(R8C<=ROUND(DAYS360(ValDat,RC1,0)/30,0),R8C>ROUND(DAYS360(ExpDat,RC1,0)/30,0)),0,OFFSET(R45C,MAX(-MNR,ROUND(DAYS360(ValDat,RC1,0)/30,0)-R8C+MEP-MNR),0,1,1))) -> 0 | AO69: =IF(RC1="","",IF(OR(R8C<=ROUND(DAYS360(ValDat,RC1,0)/30,0),R8C>ROUND(DAYS360(ExpDat,RC1,0)/30,0)),0,OFFSET(R45C,MAX(-MNR,ROUND(DAYS360(ValDat,RC1,0)/30,0)-R8C+MEP-MNR),0,1,1))) -> 0
A70: =IF(R[-1]C="","",IF(DATE(YEAR(R[-1]C),MONTH(R[-1]C)+1,1)>RunDat,"",DATE(YEAR(R[-1]C),MONTH(R[-1]C)+1,1))) -> 1999-08-01T00:00:00.000 | D70: =IF(RC1="","",SUM(RC[2]:RC[37])) -> 203315 | F70: =IF(RC1="","",IF(OR(R8C<=ROUND(DAYS360(ValDat,RC1,0)/30,0),R8C>ROUND(DAYS360(ExpDat,RC1,0)/30,0)),0,OFFSET(R45C,MAX(-MNR,ROUND(DAYS360(ValDat,RC1,0)/30,0)-R8C+MEP-MNR),0,1,1))) -> 8178 | G70: =IF(RC1="","",IF(OR(R8C<=ROUND(DAYS360(ValDat,RC1,0)/30,0),R8C>ROUND(DAYS360(ExpDat,RC1,0)/30,0)),0,OFFSET(R45C,MAX(-MNR,ROUND(DAYS360(ValDat,RC1,0)/30,0)-R8C+MEP-MNR),0,1,1))) -> 96530 | H70: =IF(RC1="","",IF(OR(R8C<=ROUND(DAYS360(ValDat,RC1,0)/30,0),R8C>ROUND(DAYS360(ExpDat,RC1,0)/30,0)),0,OFFSET(R45C,MAX(-MNR,ROUND(DAYS360(ValDat,RC1,0)/30,0)-R8C+MEP-MNR),0,1,1))) -> 48307 | I70: =IF(RC1="","",IF(OR(R8C<=ROUND(DAYS360(ValDat,RC1,0)/30,0),R8C>ROUND(DAYS360(ExpDat,RC1,0)/30,0)),0,OFFSET(R45C,MAX(-MNR,ROUND(DAYS360(ValDat,RC1,0)/30,0)-R8C+MEP-MNR),0,1,1))) -> 34250 | J70: =IF(RC1="","",IF(OR(R8C<=ROUND(DAYS360(ValDat,RC1,0)/30,0),R8C>ROUND(DAYS360(ExpDat,RC1,0)/30,0)),0,OFFSET(R45C,MAX(-MNR,ROUND(DAYS360(ValDat,RC1,0)/30,0)-R8C+MEP-MNR),0,1,1))) -> 13434 | K70: =IF(RC1="","",IF(OR(R8C<=ROUND(DAYS360(ValDat,RC1,0)/30,0),R8C>ROUND(DAYS360(ExpDat,RC1,0)/30,0)),0,OFFSET(R45C,MAX(-MNR,ROUND(DAYS360(ValDat,RC1,0)/30,0)-R8C+MEP-MNR),0,1,1))) -> 1703 | L70: =IF(RC1="","",IF(OR(R8C<=ROUND(DAYS360(ValDat,RC1,0)/30,0),R8C>ROUND(DAYS360(ExpDat,RC1,0)/30,0)),0,OFFSET(R45C,MAX(-MNR,ROUND(DAYS360(ValDat,RC1,0)/30,0)-R8C+MEP-MNR),0,1,1))) -> 913 | M70: =IF(RC1="","",IF(OR(R8C<=ROUND(DAYS360(ValDat,RC1,0)/30,0),R8C>ROUND(DAYS360(ExpDat,RC1,0)/30,0)),0,OFFSET(R45C,MAX(-MNR,ROUND(DAYS360(ValDat,RC1,0)/30,0)-R8C+MEP-MNR),0,1,1))) -> 0 | N70: =IF(RC1="","",IF(OR(R8C<=ROUND(DAYS360(ValDat,RC1,0)/30,0),R8C>ROUND(DAYS360(ExpDat,RC1,0)/30,0)),0,OFFSET(R45C,MAX(-MNR,ROUND(DAYS360(ValDat,RC1,0)/30,0)-R8C+MEP-MNR),0,1,1))) -> 0 | O70: =IF(RC1="","",IF(OR(R8C<=ROUND(DAYS360(ValDat,RC1,0)/30,0),R8C>ROUND(DAYS360(ExpDat,RC1,0)/30,0)),0,OFFSET(R45C,MAX(-MNR,ROUND(DAYS360(ValDat,RC1,0)/30,0)-R8C+MEP-MNR),0,1,1))) -> 0 | P70: =IF(RC1="","",IF(OR(R8C<=ROUND(DAYS360(ValDat,RC1,0)/30,0),R8C>ROUND(DAYS360(ExpDat,RC1,0)/30,0)),0,OFFSET(R45C,MAX(-MNR,ROUND(DAYS360(ValDat,RC1,0)/30,0)-R8C+MEP-MNR),0,1,1))) -> 0 | Q70: =IF(RC1="","",IF(OR(R8C<=ROUND(DAYS360(ValDat,RC1,0)/30,0),R8C>ROUND(DAYS360(ExpDat,RC1,0)/30,0)),0,OFFSET(R45C,MAX(-MNR,ROUND(DAYS360(ValDat,RC1,0)/30,0)-R8C+MEP-MNR),0,1,1))) -> 0 | R70: =IF(RC1="","",IF(OR(R8C<=ROUND(DAYS360(ValDat,RC1,0)/30,0),R8C>ROUND(DAYS360(ExpDat,RC1,0)/30,0)),0,OFFSET(R45C,MAX(-MNR,ROUND(DAYS360(ValDat,RC1,0)/30,0)-R8C+MEP-MNR),0,1,1))) -> 0 | S70: =IF(RC1="","",IF(OR(R8C<=ROUND(DAYS360(ValDat,RC1,0)/30,0),R8C>ROUND(DAYS360(ExpDat,RC1,0)/30,0)),0,OFFSET(R45C,MAX(-MNR,ROUND(DAYS360(ValDat,RC1,0)/30,0)-R8C+MEP-MNR),0,1,1))) -> 0 | T70: =IF(RC1="","",IF(OR(R8C<=ROUND(DAYS360(ValDat,RC1,0)/30,0),R8C>ROUND(DAYS360(ExpDat,RC1,0)/30,0)),0,OFFSET(R45C,MAX(-MNR,ROUND(DAYS360(ValDat,RC1,0)/30,0)-R8C+MEP-MNR),0,1,1))) -> 0 | U70: =IF(RC1="","",IF(OR(R8C<=ROUND(DAYS360(ValDat,RC1,0)/30,0),R8C>ROUND(DAYS360(ExpDat,RC1,0)/30,0)),0,OFFSET(R45C,MAX(-MNR,ROUND(DAYS360(ValDat,RC1,0)/30,0)-R8C+MEP-MNR),0,1,1))) -> 0 | V70: =IF(RC1="","",IF(OR(R8C<=ROUND(DAYS360(ValDat,RC1,0)/30,0),R8C>ROUND(DAYS360(ExpDat,RC1,0)/30,0)),0,OFFSET(R45C,MAX(-MNR,ROUND(DAYS360(ValDat,RC1,0)/30,0)-R8C+MEP-MNR),0,1,1))) -> 0 | W70: =IF(RC1="","",IF(OR(R8C<=ROUND(DAYS360(ValDat,RC1,0)/30,0),R8C>ROUND(DAYS360(ExpDat,RC1,0)/30,0)),0,OFFSET(R45C,MAX(-MNR,ROUND(DAYS360(ValDat,RC1,0)/30,0)-R8C+MEP-MNR),0,1,1))) -> 0 | X70: =IF(RC1="","",IF(OR(R8C<=ROUND(DAYS360(ValDat,RC1,0)/30,0),R8C>ROUND(DAYS360(ExpDat,RC1,0)/30,0)),0,OFFSET(R45C,MAX(-MNR,ROUND(DAYS360(ValDat,RC1,0)/30,0)-R8C+MEP-MNR),0,1,1))) -> 0 | Y70: =IF(RC1="","",IF(OR(R8C<=ROUND(DAYS360(ValDat,RC1,0)/30,0),R8C>ROUND(DAYS360(ExpDat,RC1,0)/30,0)),0,OFFSET(R45C,MAX(-MNR,ROUND(DAYS360(ValDat,RC1,0)/30,0)-R8C+MEP-MNR),0,1,1))) -> 0 | Z70: =IF(RC1="","",IF(OR(R8C<=ROUND(DAYS360(ValDat,RC1,0)/30,0),R8C>ROUND(DAYS360(ExpDat,RC1,0)/30,0)),0,OFFSET(R45C,MAX(-MNR,ROUND(DAYS360(ValDat,RC1,0)/30,0)-R8C+MEP-MNR),0,1,1))) -> 0 | AA70: =IF(RC1="","",IF(OR(R8C<=ROUND(DAYS360(ValDat,RC1,0)/30,0),R8C>ROUND(DAYS360(ExpDat,RC1,0)/30,0)),0,OFFSET(R45C,MAX(-MNR,ROUND(DAYS360(ValDat,RC1,0)/30,0)-R8C+MEP-MNR),0,1,1))) -> 0 | AB70: =IF(RC1="","",IF(OR(R8C<=ROUND(DAYS360(ValDat,RC1,0)/30,0),R8C>ROUND(DAYS360(ExpDat,RC1,0)/30,0)),0,OFFSET(R45C,MAX(-MNR,ROUND(DAYS360(ValDat,RC1,0)/30,0)-R8C+MEP-MNR),0,1,1))) -> 0 | AC70: =IF(RC1="","",IF(OR(R8C<=ROUND(DAYS360(ValDat,RC1,0)/30,0),R8C>ROUND(DAYS360(ExpDat,RC1,0)/30,0)),0,OFFSET(R45C,MAX(-MNR,ROUND(DAYS360(ValDat,RC1,0)/30,0)-R8C+MEP-MNR),0,1,1))) -> 0 | AD70: =IF(RC1="","",IF(OR(R8C<=ROUND(DAYS360(ValDat,RC1,0)/30,0),R8C>ROUND(DAYS360(ExpDat,RC1,0)/30,0)),0,OFFSET(R45C,MAX(-MNR,ROUND(DAYS360(ValDat,RC1,0)/30,0)-R8C+MEP-MNR),0,1,1))) -> 0 | AE70: =IF(RC1="","",IF(OR(R8C<=ROUND(DAYS360(ValDat,RC1,0)/30,0),R8C>ROUND(DAYS360(ExpDat,RC1,0)/30,0)),0,OFFSET(R45C,MAX(-MNR,ROUND(DAYS360(ValDat,RC1,0)/30,0)-R8C+MEP-MNR),0,1,1))) -> 0 | AF70: =IF(RC1="","",IF(OR(R8C<=ROUND(DAYS360(ValDat,RC1,0)/30,0),R8C>ROUND(DAYS360(ExpDat,RC1,0)/30,0)),0,OFFSET(R45C,MAX(-MNR,ROUND(DAYS360(ValDat,RC1,0)/30,0)-R8C+MEP-MNR),0,1,1))) -> 0 | AG70: =IF(RC1="","",IF(OR(R8C<=ROUND(DAYS360(ValDat,RC1,0)/30,0),R8C>ROUND(DAYS360(ExpDat,RC1,0)/30,0)),0,OFFSET(R45C,MAX(-MNR,ROUND(DAYS360(ValDat,RC1,0)/30,0)-R8C+MEP-MNR),0,1,1))) -> 0 | AH70: =IF(RC1="","",IF(OR(R8C<=ROUND(DAYS360(ValDat,RC1,0)/30,0),R8C>ROUND(DAYS360(ExpDat,RC1,0)/30,0)),0,OFFSET(R45C,MAX(-MNR,ROUND(DAYS360(ValDat,RC1,0)/30,0)-R8C+MEP-MNR),0,1,1))) -> 0 | AI70: =IF(RC1="","",IF(OR(R8C<=ROUND(DAYS360(ValDat,RC1,0)/30,0),R8C>ROUND(DAYS360(ExpDat,RC1,0)/30,0)),0,OFFSET(R45C,MAX(-MNR,ROUND(DAYS360(ValDat,RC1,0)/30,0)-R8C+MEP-MNR),0,1,1))) -> 0 | AJ70: =IF(RC1="","",IF(OR(R8C<=ROUND(DAYS360(ValDat,RC1,0)/30,0),R8C>ROUND(DAYS360(ExpDat,RC1,0)/30,0)),0,OFFSET(R45C,MAX(-MNR,ROUND(DAYS360(ValDat,RC1,0)/30,0)-R8C+MEP-MNR),0,1,1))) -> 0 | AK70: =IF(RC1="","",IF(OR(R8C<=ROUND(DAYS360(ValDat,RC1,0)/30,0),R8C>ROUND(DAYS360(ExpDat,RC1,0)/30,0)),0,OFFSET(R45C,MAX(-MNR,ROUND(DAYS360(ValDat,RC1,0)/30,0)-R8C+MEP-MNR),0,1,1))) -> 0 | AL70: =IF(RC1="","",IF(OR(R8C<=ROUND(DAYS360(ValDat,RC1,0)/30,0),R8C>ROUND(DAYS360(ExpDat,RC1,0)/30,0)),0,OFFSET(R45C,MAX(-MNR,ROUND(DAYS360(ValDat,RC1,0)/30,0)-R8C+MEP-MNR),0,1,1))) -> 0 | AM70: =IF(RC1="","",IF(OR(R8C<=ROUND(DAYS360(ValDat,RC1,0)/30,0),R8C>ROUND(DAYS360(ExpDat,RC1,0)/30,0)),0,OFFSET(R45C,MAX(-MNR,ROUND(DAYS360(ValDat,RC1,0)/30,0)-R8C+MEP-MNR),0,1,1))) -> 0 | AN70: =IF(RC1="","",IF(OR(R8C<=ROUND(DAYS360(ValDat,RC1,0)/30,0),R8C>ROUND(DAYS360(ExpDat,RC1,0)/30,0)),0,OFFSET(R45C,MAX(-MNR,ROUND(DAYS360(ValDat,RC1,0)/30,0)-R8C+MEP-MNR),0,1,1))) -> 0 | AO70: =IF(RC1="","",IF(OR(R8C<=ROUND(DAYS360(ValDat,RC1,0)/30,0),R8C>ROUND(DAYS360(ExpDat,RC1,0)/30,0)),0,OFFSET(R45C,MAX(-MNR,ROUND(DAYS360(ValDat,RC1,0)/30,0)-R8C+MEP-MNR),0,1,1))) -> 0
A71: =IF(R[-1]C="","",IF(DATE(YEAR(R[-1]C),MONTH(R[-1]C)+1,1)>RunDat,"",DATE(YEAR(R[-1]C),MONTH(R[-1]C)+1,1))) -> 1999-09-01T00:00:00.000 | D71: =IF(RC1="","",SUM(RC[2]:RC[37])) -> 119700 | F71: =IF(RC1="","",IF(OR(R8C<=ROUND(DAYS360(ValDat,RC1,0)/30,0),R8C>ROUND(DAYS360(ExpDat,RC1,0)/30,0)),0,OFFSET(R45C,MAX(-MNR,ROUND(DAYS360(ValDat,RC1,0)/30,0)-R8C+MEP-MNR),0,1,1))) -> 22133 | G71: =IF(RC1="","",IF(OR(R8C<=ROUND(DAYS360(ValDat,RC1,0)/30,0),R8C>ROUND(DAYS360(ExpDat,RC1,0)/30,0)),0,OFFSET(R45C,MAX(-MNR,ROUND(DAYS360(ValDat,RC1,0)/30,0)-R8C+MEP-MNR),0,1,1))) -> 50538 | H71: =IF(RC1="","",IF(OR(R8C<=ROUND(DAYS360(ValDat,RC1,0)/30,0),R8C>ROUND(DAYS360(ExpDat,RC1,0)/30,0)),0,OFFSET(R45C,MAX(-MNR,ROUND(DAYS360(ValDat,RC1,0)/30,0)-R8C+MEP-MNR),0,1,1))) -> 25198 | I71: =IF(RC1="","",IF(OR(R8C<=ROUND(DAYS360(ValDat,RC1,0)/30,0),R8C>ROUND(DAYS360(ExpDat,RC1,0)/30,0)),0,OFFSET(R45C,MAX(-MNR,ROUND(DAYS360(ValDat,RC1,0)/30,0)-R8C+MEP-MNR),0,1,1))) -> 6744 | J71: =IF(RC1="","",IF(OR(R8C<=ROUND(DAYS360(ValDat,RC1,0)/30,0),R8C>ROUND(DAYS360(ExpDat,RC1,0)/30,0)),0,OFFSET(R45C,MAX(-MNR,ROUND(DAYS360(ValDat,RC1,0)/30,0)-R8C+MEP-MNR),0,1,1))) -> 12905 | K71: =IF(RC1="","",IF(OR(R8C<=ROUND(DAYS360(ValDat,RC1,0)/30,0),R8C>ROUND(DAYS360(ExpDat,RC1,0)/30,0)),0,OFFSET(R45C,MAX(-MNR,ROUND(DAYS360(ValDat,RC1,0)/30,0)-R8C+MEP-MNR),0,1,1))) -> 1335 | L71: =IF(RC1="","",IF(OR(R8C<=ROUND(DAYS360(ValDat,RC1,0)/30,0),R8C>ROUND(DAYS360(ExpDat,RC1,0)/30,0)),0,OFFSET(R45C,MAX(-MNR,ROUND(DAYS360(ValDat,RC1,0)/30,0)-R8C+MEP-MNR),0,1,1))) -> 254 | M71: =IF(RC1="","",IF(OR(R8C<=ROUND(DAYS360(ValDat,RC1,0)/30,0),R8C>ROUND(DAYS360(ExpDat,RC1,0)/30,0)),0,OFFSET(R45C,MAX(-MNR,ROUND(DAYS360(ValDat,RC1,0)/30,0)-R8C+MEP-MNR),0,1,1))) -> 593 | N71: =IF(RC1="","",IF(OR(R8C<=ROUND(DAYS360(ValDat,RC1,0)/30,0),R8C>ROUND(DAYS360(ExpDat,RC1,0)/30,0)),0,OFFSET(R45C,MAX(-MNR,ROUND(DAYS360(ValDat,RC1,0)/30,0)-R8C+MEP-MNR),0,1,1))) -> 0 | O71: =IF(RC1="","",IF(OR(R8C<=ROUND(DAYS360(ValDat,RC1,0)/30,0),R8C>ROUND(DAYS360(ExpDat,RC1,0)/30,0)),0,OFFSET(R45C,MAX(-MNR,ROUND(DAYS360(ValDat,RC1,0)/30,0)-R8C+MEP-MNR),0,1,1))) -> 0 | P71: =IF(RC1="","",IF(OR(R8C<=ROUND(DAYS360(ValDat,RC1,0)/30,0),R8C>ROUND(DAYS360(ExpDat,RC1,0)/30,0)),0,OFFSET(R45C,MAX(-MNR,ROUND(DAYS360(ValDat,RC1,0)/30,0)-R8C+MEP-MNR),0,1,1))) -> 0 | Q71: =IF(RC1="","",IF(OR(R8C<=ROUND(DAYS360(ValDat,RC1,0)/30,0),R8C>ROUND(DAYS360(ExpDat,RC1,0)/30,0)),0,OFFSET(R45C,MAX(-MNR,ROUND(DAYS360(ValDat,RC1,0)/30,0)-R8C+MEP-MNR),0,1,1))) -> 0 | R71: =IF(RC1="","",IF(OR(R8C<=ROUND(DAYS360(ValDat,RC1,0)/30,0),R8C>ROUND(DAYS360(ExpDat,RC1,0)/30,0)),0,OFFSET(R45C,MAX(-MNR,ROUND(DAYS360(ValDat,RC1,0)/30,0)-R8C+MEP-MNR),0,1,1))) -> 0 | S71: =IF(RC1="","",IF(OR(R8C<=ROUND(DAYS360(ValDat,RC1,0)/30,0),R8C>ROUND(DAYS360(ExpDat,RC1,0)/30,0)),0,OFFSET(R45C,MAX(-MNR,ROUND(DAYS360(ValDat,RC1,0)/30,0)-R8C+MEP-MNR),0,1,1))) -> 0 | T71: =IF(RC1="","",IF(OR(R8C<=ROUND(DAYS360(ValDat,RC1,0)/30,0),R8C>ROUND(DAYS360(ExpDat,RC1,0)/30,0)),0,OFFSET(R45C,MAX(-MNR,ROUND(DAYS360(ValDat,RC1,0)/30,0)-R8C+MEP-MNR),0,1,1))) -> 0 | U71: =IF(RC1="","",IF(OR(R8C<=ROUND(DAYS360(ValDat,RC1,0)/30,0),R8C>ROUND(DAYS360(ExpDat,RC1,0)/30,0)),0,OFFSET(R45C,MAX(-MNR,ROUND(DAYS360(ValDat,RC1,0)/30,0)-R8C+MEP-MNR),0,1,1))) -> 0 | V71: =IF(RC1="","",IF(OR(R8C<=ROUND(DAYS360(ValDat,RC1,0)/30,0),R8C>ROUND(DAYS360(ExpDat,RC1,0)/30,0)),0,OFFSET(R45C,MAX(-MNR,ROUND(DAYS360(ValDat,RC1,0)/30,0)-R8C+MEP-MNR),0,1,1))) -> 0 | W71: =IF(RC1="","",IF(OR(R8C<=ROUND(DAYS360(ValDat,RC1,0)/30,0),R8C>ROUND(DAYS360(ExpDat,RC1,0)/30,0)),0,OFFSET(R45C,MAX(-MNR,ROUND(DAYS360(ValDat,RC1,0)/30,0)-R8C+MEP-MNR),0,1,1))) -> 0 | X71: =IF(RC1="","",IF(OR(R8C<=ROUND(DAYS360(ValDat,RC1,0)/30,0),R8C>ROUND(DAYS360(ExpDat,RC1,0)/30,0)),0,OFFSET(R45C,MAX(-MNR,ROUND(DAYS360(ValDat,RC1,0)/30,0)-R8C+MEP-MNR),0,1,1))) -> 0 | Y71: =IF(RC1="","",IF(OR(R8C<=ROUND(DAYS360(ValDat,RC1,0)/30,0),R8C>ROUND(DAYS360(ExpDat,RC1,0)/30,0)),0,OFFSET(R45C,MAX(-MNR,ROUND(DAYS360(ValDat,RC1,0)/30,0)-R8C+MEP-MNR),0,1,1))) -> 0 | Z71: =IF(RC1="","",IF(OR(R8C<=ROUND(DAYS360(ValDat,RC1,0)/30,0),R8C>ROUND(DAYS360(ExpDat,RC1,0)/30,0)),0,OFFSET(R45C,MAX(-MNR,ROUND(DAYS360(ValDat,RC1,0)/30,0)-R8C+MEP-MNR),0,1,1))) -> 0 | AA71: =IF(RC1="","",IF(OR(R8C<=ROUND(DAYS360(ValDat,RC1,0)/30,0),R8C>ROUND(DAYS360(ExpDat,RC1,0)/30,0)),0,OFFSET(R45C,MAX(-MNR,ROUND(DAYS360(ValDat,RC1,0)/30,0)-R8C+MEP-MNR),0,1,1))) -> 0 | AB71: =IF(RC1="","",IF(OR(R8C<=ROUND(DAYS360(ValDat,RC1,0)/30,0),R8C>ROUND(DAYS360(ExpDat,RC1,0)/30,0)),0,OFFSET(R45C,MAX(-MNR,ROUND(DAYS360(ValDat,RC1,0)/30,0)-R8C+MEP-MNR),0,1,1))) -> 0 | AC71: =IF(RC1="","",IF(OR(R8C<=ROUND(DAYS360(ValDat,RC1,0)/30,0),R8C>ROUND(DAYS360(ExpDat,RC1,0)/30,0)),0,OFFSET(R45C,MAX(-MNR,ROUND(DAYS360(ValDat,RC1,0)/30,0)-R8C+MEP-MNR),0,1,1))) -> 0 | AD71: =IF(RC1="","",IF(OR(R8C<=ROUND(DAYS360(ValDat,RC1,0)/30,0),R8C>ROUND(DAYS360(ExpDat,RC1,0)/30,0)),0,OFFSET(R45C,MAX(-MNR,ROUND(DAYS360(ValDat,RC1,0)/30,0)-R8C+MEP-MNR),0,1,1))) -> 0 | AE71: =IF(RC1="","",IF(OR(R8C<=ROUND(DAYS360(ValDat,RC1,0)/30,0),R8C>ROUND(DAYS360(ExpDat,RC1,0)/30,0)),0,OFFSET(R45C,MAX(-MNR,ROUND(DAYS360(ValDat,RC1,0)/30,0)-R8C+MEP-MNR),0,1,1))) -> 0 | AF71: =IF(RC1="","",IF(OR(R8C<=ROUND(DAYS360(ValDat,RC1,0)/30,0),R8C>ROUND(DAYS360(ExpDat,RC1,0)/30,0)),0,OFFSET(R45C,MAX(-MNR,ROUND(DAYS360(ValDat,RC1,0)/30,0)-R8C+MEP-MNR),0,1,1))) -> 0 | AG71: =IF(RC1="","",IF(OR(R8C<=ROUND(DAYS360(ValDat,RC1,0)/30,0),R8C>ROUND(DAYS360(ExpDat,RC1,0)/30,0)),0,OFFSET(R45C,MAX(-MNR,ROUND(DAYS360(ValDat,RC1,0)/30,0)-R8C+MEP-MNR),0,1,1))) -> 0 | AH71: =IF(RC1="","",IF(OR(R8C<=ROUND(DAYS360(ValDat,RC1,0)/30,0),R8C>ROUND(DAYS360(ExpDat,RC1,0)/30,0)),0,OFFSET(R45C,MAX(-MNR,ROUND(DAYS360(ValDat,RC1,0)/30,0)-R8C+MEP-MNR),0,1,1))) -> 0 | AI71: =IF(RC1="","",IF(OR(R8C<=ROUND(DAYS360(ValDat,RC1,0)/30,0),R8C>ROUND(DAYS360(ExpDat,RC1,0)/30,0)),0,OFFSET(R45C,MAX(-MNR,ROUND(DAYS360(ValDat,RC1,0)/30,0)-R8C+MEP-MNR),0,1,1))) -> 0 | AJ71: =IF(RC1="","",IF(OR(R8C<=ROUND(DAYS360(ValDat,RC1,0)/30,0),R8C>ROUND(DAYS360(ExpDat,RC1,0)/30,0)),0,OFFSET(R45C,MAX(-MNR,ROUND(DAYS360(ValDat,RC1,0)/30,0)-R8C+MEP-MNR),0,1,1))) -> 0 | AK71: =IF(RC1="","",IF(OR(R8C<=ROUND(DAYS360(ValDat,RC1,0)/30,0),R8C>ROUND(DAYS360(ExpDat,RC1,0)/30,0)),0,OFFSET(R45C,MAX(-MNR,ROUND(DAYS360(ValDat,RC1,0)/30,0)-R8C+MEP-MNR),0,1,1))) -> 0 | AL71: =IF(RC1="","",IF(OR(R8C<=ROUND(DAYS360(ValDat,RC1,0)/30,0),R8C>ROUND(DAYS360(ExpDat,RC1,0)/30,0)),0,OFFSET(R45C,MAX(-MNR,ROUND(DAYS360(ValDat,RC1,0)/30,0)-R8C+MEP-MNR),0,1,1))) -> 0 | AM71: =IF(RC1="","",IF(OR(R8C<=ROUND(DAYS360(ValDat,RC1,0)/30,0),R8C>ROUND(DAYS360(ExpDat,RC1,0)/30,0)),0,OFFSET(R45C,MAX(-MNR,ROUND(DAYS360(ValDat,RC1,0)/30,0)-R8C+MEP-MNR),0,1,1))) -> 0 | AN71: =IF(RC1="","",IF(OR(R8C<=ROUND(DAYS360(ValDat,RC1,0)/30,0),R8C>ROUND(DAYS360(ExpDat,RC1,0)/30,0)),0,OFFSET(R45C,MAX(-MNR,ROUND(DAYS360(ValDat,RC1,0)/30,0)-R8C+MEP-MNR),0,1,1))) -> 0 | AO71: =IF(RC1="","",IF(OR(R8C<=ROUND(DAYS360(ValDat,RC1,0)/30,0),R8C>ROUND(DAYS360(ExpDat,RC1,0)/30,0)),0,OFFSET(R45C,MAX(-MNR,ROUND(DAYS360(ValDat,RC1,0)/30,0)-R8C+MEP-MNR),0,1,1))) -> 0
A72: =IF(R[-1]C="","",IF(DATE(YEAR(R[-1]C),MONTH(R[-1]C)+1,1)>RunDat,"",DATE(YEAR(R[-1]C),MONTH(R[-1]C)+1,1))) -> 1999-10-01T00:00:00.000 | D72: =IF(RC1="","",SUM(RC[2]:RC[37])) -> 146305 | F72: =IF(RC1="","",IF(OR(R8C<=ROUND(DAYS360(ValDat,RC1,0)/30,0),R8C>ROUND(DAYS360(ExpDat,RC1,0)/30,0)),0,OFFSET(R45C,MAX(-MNR,ROUND(DAYS360(ValDat,RC1,0)/30,0)-R8C+MEP-MNR),0,1,1))) -> 8887 | G72: =IF(RC1="","",IF(OR(R8C<=ROUND(DAYS360(ValDat,RC1,0)/30,0),R8C>ROUND(DAYS360(ExpDat,RC1,0)/30,0)),0,OFFSET(R45C,MAX(-MNR,ROUND(DAYS360(ValDat,RC1,0)/30,0)-R8C+MEP-MNR),0,1,1))) -> 43202 | H72: =IF(RC1="","",IF(OR(R8C<=ROUND(DAYS360(ValDat,RC1,0)/30,0),R8C>ROUND(DAYS360(ExpDat,RC1,0)/30,0)),0,OFFSET(R45C,MAX(-MNR,ROUND(DAYS360(ValDat,RC1,0)/30,0)-R8C+MEP-MNR),0,1,1))) -> 21390 | I72: =IF(RC1="","",IF(OR(R8C<=ROUND(DAYS360(ValDat,RC1,0)/30,0),R8C>ROUND(DAYS360(ExpDat,RC1,0)/30,0)),0,OFFSET(R45C,MAX(-MNR,ROUND(DAYS360(ValDat,RC1,0)/30,0)-R8C+MEP-MNR),0,1,1))) -> 25454 | J72: =IF(RC1="","",IF(OR(R8C<=ROUND(DAYS360(ValDat,RC1,0)/30,0),R8C>ROUND(DAYS360(ExpDat,RC1,0)/30,0)),0,OFFSET(R45C,MAX(-MNR,ROUND(DAYS360(ValDat,RC1,0)/30,0)-R8C+MEP-MNR),0,1,1))) -> 43499 | K72: =IF(RC1="","",IF(OR(R8C<=ROUND(DAYS360(ValDat,RC1,0)/30,0),R8C>ROUND(DAYS360(ExpDat,RC1,0)/30,0)),0,OFFSET(R45C,MAX(-MNR,ROUND(DAYS360(ValDat,RC1,0)/30,0)-R8C+MEP-MNR),0,1,1))) -> 1541 | L72: =IF(RC1="","",IF(OR(R8C<=ROUND(DAYS360(ValDat,RC1,0)/30,0),R8C>ROUND(DAYS360(ExpDat,RC1,0)/30,0)),0,OFFSET(R45C,MAX(-MNR,ROUND(DAYS360(ValDat,RC1,0)/30,0)-R8C+MEP-MNR),0,1,1))) -> 1739 | M72: =IF(RC1="","",IF(OR(R8C<=ROUND(DAYS360(ValDat,RC1,0)/30,0),R8C>ROUND(DAYS360(ExpDat,RC1,0)/30,0)),0,OFFSET(R45C,MAX(-MNR,ROUND(DAYS360(ValDat,RC1,0)/30,0)-R8C+MEP-MNR),0,1,1))) -> 593 | N72: =IF(RC1="","",IF(OR(R8C<=ROUND(DAYS360(ValDat,RC1,0)/30,0),R8C>ROUND(DAYS360(ExpDat,RC1,0)/30,0)),0,OFFSET(R45C,MAX(-MNR,ROUND(DAYS360(ValDat,RC1,0)/30,0)-R8C+MEP-MNR),0,1,1))) -> 0 | O72: =IF(RC1="","",IF(OR(R8C<=ROUND(DAYS360(ValDat,RC1,0)/30,0),R8C>ROUND(DAYS360(ExpDat,RC1,0)/30,0)),0,OFFSET(R45C,MAX(-MNR,ROUND(DAYS360(ValDat,RC1,0)/30,0)-R8C+MEP-MNR),0,1,1))) -> 0 | P72: =IF(RC1="","",IF(OR(R8C<=ROUND(DAYS360(ValDat,RC1,0)/30,0),R8C>ROUND(DAYS360(ExpDat,RC1,0)/30,0)),0,OFFSET(R45C,MAX(-MNR,ROUND(DAYS360(ValDat,RC1,0)/30,0)-R8C+MEP-MNR),0,1,1))) -> 0 | Q72: =IF(RC1="","",IF(OR(R8C<=ROUND(DAYS360(ValDat,RC1,0)/30,0),R8C>ROUND(DAYS360(ExpDat,RC1,0)/30,0)),0,OFFSET(R45C,MAX(-MNR,ROUND(DAYS360(ValDat,RC1,0)/30,0)-R8C+MEP-MNR),0,1,1))) -> 0 | R72: =IF(RC1="","",IF(OR(R8C<=ROUND(DAYS360(ValDat,RC1,0)/30,0),R8C>ROUND(DAYS360(ExpDat,RC1,0)/30,0)),0,OFFSET(R45C,MAX(-MNR,ROUND(DAYS360(ValDat,RC1,0)/30,0)-R8C+MEP-MNR),0,1,1))) -> 0 | S72: =IF(RC1="","",IF(OR(R8C<=ROUND(DAYS360(ValDat,RC1,0)/30,0),R8C>ROUND(DAYS360(ExpDat,RC1,0)/30,0)),0,OFFSET(R45C,MAX(-MNR,ROUND(DAYS360(ValDat,RC1,0)/30,0)-R8C+MEP-MNR),0,1,1))) -> 0 | T72: =IF(RC1="","",IF(OR(R8C<=ROUND(DAYS360(ValDat,RC1,0)/30,0),R8C>ROUND(DAYS360(ExpDat,RC1,0)/30,0)),0,OFFSET(R45C,MAX(-MNR,ROUND(DAYS360(ValDat,RC1,0)/30,0)-R8C+MEP-MNR),0,1,1))) -> 0 | U72: =IF(RC1="","",IF(OR(R8C<=ROUND(DAYS360(ValDat,RC1,0)/30,0),R8C>ROUND(DAYS360(ExpDat,RC1,0)/30,0)),0,OFFSET(R45C,MAX(-MNR,ROUND(DAYS360(ValDat,RC1,0)/30,0)-R8C+MEP-MNR),0,1,1))) -> 0 | V72: =IF(RC1="","",IF(OR(R8C<=ROUND(DAYS360(ValDat,RC1,0)/30,0),R8C>ROUND(DAYS360(ExpDat,RC1,0)/30,0)),0,OFFSET(R45C,MAX(-MNR,ROUND(DAYS360(ValDat,RC1,0)/30,0)-R8C+MEP-MNR),0,1,1))) -> 0 | W72: =IF(RC1="","",IF(OR(R8C<=ROUND(DAYS360(ValDat,RC1,0)/30,0),R8C>ROUND(DAYS360(ExpDat,RC1,0)/30,0)),0,OFFSET(R45C,MAX(-MNR,ROUND(DAYS360(ValDat,RC1,0)/30,0)-R8C+MEP-MNR),0,1,1))) -> 0 | X72: =IF(RC1="","",IF(OR(R8C<=ROUND(DAYS360(ValDat,RC1,0)/30,0),R8C>ROUND(DAYS360(ExpDat,RC1,0)/30,0)),0,OFFSET(R45C,MAX(-MNR,ROUND(DAYS360(ValDat,RC1,0)/30,0)-R8C+MEP-MNR),0,1,1))) -> 0 | Y72: =IF(RC1="","",IF(OR(R8C<=ROUND(DAYS360(ValDat,RC1,0)/30,0),R8C>ROUND(DAYS360(ExpDat,RC1,0)/30,0)),0,OFFSET(R45C,MAX(-MNR,ROUND(DAYS360(ValDat,RC1,0)/30,0)-R8C+MEP-MNR),0,1,1))) -> 0 | Z72: =IF(RC1="","",IF(OR(R8C<=ROUND(DAYS360(ValDat,RC1,0)/30,0),R8C>ROUND(DAYS360(ExpDat,RC1,0)/30,0)),0,OFFSET(R45C,MAX(-MNR,ROUND(DAYS360(ValDat,RC1,0)/30,0)-R8C+MEP-MNR),0,1,1))) -> 0 | AA72: =IF(RC1="","",IF(OR(R8C<=ROUND(DAYS360(ValDat,RC1,0)/30,0),R8C>ROUND(DAYS360(ExpDat,RC1,0)/30,0)),0,OFFSET(R45C,MAX(-MNR,ROUND(DAYS360(ValDat,RC1,0)/30,0)-R8C+MEP-MNR),0,1,1))) -> 0 | AB72: =IF(RC1="","",IF(OR(R8C<=ROUND(DAYS360(ValDat,RC1,0)/30,0),R8C>ROUND(DAYS360(ExpDat,RC1,0)/30,0)),0,OFFSET(R45C,MAX(-MNR,ROUND(DAYS360(ValDat,RC1,0)/30,0)-R8C+MEP-MNR),0,1,1))) -> 0 | AC72: =IF(RC1="","",IF(OR(R8C<=ROUND(DAYS360(ValDat,RC1,0)/30,0),R8C>ROUND(DAYS360(ExpDat,RC1,0)/30,0)),0,OFFSET(R45C,MAX(-MNR,ROUND(DAYS360(ValDat,RC1,0)/30,0)-R8C+MEP-MNR),0,1,1))) -> 0 | AD72: =IF(RC1="","",IF(OR(R8C<=ROUND(DAYS360(ValDat,RC1,0)/30,0),R8C>ROUND(DAYS360(ExpDat,RC1,0)/30,0)),0,OFFSET(R45C,MAX(-MNR,ROUND(DAYS360(ValDat,RC1,0)/30,0)-R8C+MEP-MNR),0,1,1))) -> 0 | AE72: =IF(RC1="","",IF(OR(R8C<=ROUND(DAYS360(ValDat,RC1,0)/30,0),R8C>ROUND(DAYS360(ExpDat,RC1,0)/30,0)),0,OFFSET(R45C,MAX(-MNR,ROUND(DAYS360(ValDat,RC1,0)/30,0)-R8C+MEP-MNR),0,1,1))) -> 0 | AF72: =IF(RC1="","",IF(OR(R8C<=ROUND(DAYS360(ValDat,RC1,0)/30,0),R8C>ROUND(DAYS360(ExpDat,RC1,0)/30,0)),0,OFFSET(R45C,MAX(-MNR,ROUND(DAYS360(ValDat,RC1,0)/30,0)-R8C+MEP-MNR),0,1,1))) -> 0 | AG72: =IF(RC1="","",IF(OR(R8C<=ROUND(DAYS360(ValDat,RC1,0)/30,0),R8C>ROUND(DAYS360(ExpDat,RC1,0)/30,0)),0,OFFSET(R45C,MAX(-MNR,ROUND(DAYS360(ValDat,RC1,0)/30,0)-R8C+MEP-MNR),0,1,1))) -> 0 | AH72: =IF(RC1="","",IF(OR(R8C<=ROUND(DAYS360(ValDat,RC1,0)/30,0),R8C>ROUND(DAYS360(ExpDat,RC1,0)/30,0)),0,OFFSET(R45C,MAX(-MNR,ROUND(DAYS360(ValDat,RC1,0)/30,0)-R8C+MEP-MNR),0,1,1))) -> 0 | AI72: =IF(RC1="","",IF(OR(R8C<=ROUND(DAYS360(ValDat,RC1,0)/30,0),R8C>ROUND(DAYS360(ExpDat,RC1,0)/30,0)),0,OFFSET(R45C,MAX(-MNR,ROUND(DAYS360(ValDat,RC1,0)/30,0)-R8C+MEP-MNR),0,1,1))) -> 0 | AJ72: =IF(RC1="","",IF(OR(R8C<=ROUND(DAYS360(ValDat,RC1,0)/30,0),R8C>ROUND(DAYS360(ExpDat,RC1,0)/30,0)),0,OFFSET(R45C,MAX(-MNR,ROUND(DAYS360(ValDat,RC1,0)/30,0)-R8C+MEP-MNR),0,1,1))) -> 0 | AK72: =IF(RC1="","",IF(OR(R8C<=ROUND(DAYS360(ValDat,RC1,0)/30,0),R8C>ROUND(DAYS360(ExpDat,RC1,0)/30,0)),0,OFFSET(R45C,MAX(-MNR,ROUND(DAYS360(ValDat,RC1,0)/30,0)-R8C+MEP-MNR),0,1,1))) -> 0 | AL72: =IF(RC1="","",IF(OR(R8C<=ROUND(DAYS360(ValDat,RC1,0)/30,0),R8C>ROUND(DAYS360(ExpDat,RC1,0)/30,0)),0,OFFSET(R45C,MAX(-MNR,ROUND(DAYS360(ValDat,RC1,0)/30,0)-R8C+MEP-MNR),0,1,1))) -> 0 | AM72: =IF(RC1="","",IF(OR(R8C<=ROUND(DAYS360(ValDat,RC1,0)/30,0),R8C>ROUND(DAYS360(ExpDat,RC1,0)/30,0)),0,OFFSET(R45C,MAX(-MNR,ROUND(DAYS360(ValDat,RC1,0)/30,0)-R8C+MEP-MNR),0,1,1))) -> 0 | AN72: =IF(RC1="","",IF(OR(R8C<=ROUND(DAYS360(ValDat,RC1,0)/30,0),R8C>ROUND(DAYS360(ExpDat,RC1,0)/30,0)),0,OFFSET(R45C,MAX(-MNR,ROUND(DAYS360(ValDat,RC1,0)/30,0)-R8C+MEP-MNR),0,1,1))) -> 0 | AO72: =IF(RC1="","",IF(OR(R8C<=ROUND(DAYS360(ValDat,RC1,0)/30,0),R8C>ROUND(DAYS360(ExpDat,RC1,0)/30,0)),0,OFFSET(R45C,MAX(-MNR,ROUND(DAYS360(ValDat,RC1,0)/30,0)-R8C+MEP-MNR),0,1,1))) -> 0
A73: =IF(R[-1]C="","",IF(DATE(YEAR(R[-1]C),MONTH(R[-1]C)+1,1)>RunDat,"",DATE(YEAR(R[-1]C),MONTH(R[-1]C)+1,1))) -> 1999-11-01T00:00:00.000 | D73: =IF(RC1="","",SUM(RC[2]:RC[37])) -> 167901 | F73: =IF(RC1="","",IF(OR(R8C<=ROUND(DAYS360(ValDat,RC1,0)/30,0),R8C>ROUND(DAYS360(ExpDat,RC1,0)/30,0)),0,OFFSET(R45C,MAX(-MNR,ROUND(DAYS360(ValDat,RC1,0)/30,0)-R8C+MEP-MNR),0,1,1))) -> 31566 | G73: =IF(RC1="","",IF(OR(R8C<=ROUND(DAYS360(ValDat,RC1,0)/30,0),R8C>ROUND(DAYS360(ExpDat,RC1,0)/30,0)),0,OFFSET(R45C,MAX(-MNR,ROUND(DAYS360(ValDat,RC1,0)/30,0)-R8C+MEP-MNR),0,1,1))) -> 57900 | H73: =IF(RC1="","",IF(OR(R8C<=ROUND(DAYS360(ValDat,RC1,0)/30,0),R8C>ROUND(DAYS360(ExpDat,RC1,0)/30,0)),0,OFFSET(R45C,MAX(-MNR,ROUND(DAYS360(ValDat,RC1,0)/30,0)-R8C+MEP-MNR),0,1,1))) -> 19233 | I73: =IF(RC1="","",IF(OR(R8C<=ROUND(DAYS360(ValDat,RC1,0)/30,0),R8C>ROUND(DAYS360(ExpDat,RC1,0)/30,0)),0,OFFSET(R45C,MAX(-MNR,ROUND(DAYS360(ValDat,RC1,0)/30,0)-R8C+MEP-MNR),0,1,1))) -> 25812 | J73: =IF(RC1="","",IF(OR(R8C<=ROUND(DAYS360(ValDat,RC1,0)/30,0),R8C>ROUND(DAYS360(ExpDat,RC1,0)/30,0)),0,OFFSET(R45C,MAX(-MNR,ROUND(DAYS360(ValDat,RC1,0)/30,0)-R8C+MEP-MNR),0,1,1))) -> 21540 | K73: =IF(RC1="","",IF(OR(R8C<=ROUND(DAYS360(ValDat,RC1,0)/30,0),R8C>ROUND(DAYS360(ExpDat,RC1,0)/30,0)),0,OFFSET(R45C,MAX(-MNR,ROUND(DAYS360(ValDat,RC1,0)/30,0)-R8C+MEP-MNR),0,1,1))) -> 10999 | L73: =IF(RC1="","",IF(OR(R8C<=ROUND(DAYS360(ValDat,RC1,0)/30,0),R8C>ROUND(DAYS360(ExpDat,RC1,0)/30,0)),0,OFFSET(R45C,MAX(-MNR,ROUND(DAYS360(ValDat,RC1,0)/30,0)-R8C+MEP-MNR),0,1,1))) -> 701 | M73: =IF(RC1="","",IF(OR(R8C<=ROUND(DAYS360(ValDat,RC1,0)/30,0),R8C>ROUND(DAYS360(ExpDat,RC1,0)/30,0)),0,OFFSET(R45C,MAX(-MNR,ROUND(DAYS360(ValDat,RC1,0)/30,0)-R8C+MEP-MNR),0,1,1))) -> 150 | N73: =IF(RC1="","",IF(OR(R8C<=ROUND(DAYS360(ValDat,RC1,0)/30,0),R8C>ROUND(DAYS360(ExpDat,RC1,0)/30,0)),0,OFFSET(R45C,MAX(-MNR,ROUND(DAYS360(ValDat,RC1,0)/30,0)-R8C+MEP-MNR),0,1,1))) -> 0 | O73: =IF(RC1="","",IF(OR(R8C<=ROUND(DAYS360(ValDat,RC1,0)/30,0),R8C>ROUND(DAYS360(ExpDat,RC1,0)/30,0)),0,OFFSET(R45C,MAX(-MNR,ROUND(DAYS360(ValDat,RC1,0)/30,0)-R8C+MEP-MNR),0,1,1))) -> 0 | P73: =IF(RC1="","",IF(OR(R8C<=ROUND(DAYS360(ValDat,RC1,0)/30,0),R8C>ROUND(DAYS360(ExpDat,RC1,0)/30,0)),0,OFFSET(R45C,MAX(-MNR,ROUND(DAYS360(ValDat,RC1,0)/30,0)-R8C+MEP-MNR),0,1,1))) -> 0 | Q73: =IF(RC1="","",IF(OR(R8C<=ROUND(DAYS360(ValDat,RC1,0)/30,0),R8C>ROUND(DAYS360(ExpDat,RC1,0)/30,0)),0,OFFSET(R45C,MAX(-MNR,ROUND(DAYS360(ValDat,RC1,0)/30,0)-R8C+MEP-MNR),0,1,1))) -> 0 | R73: =IF(RC1="","",IF(OR(R8C<=ROUND(DAYS360(ValDat,RC1,0)/30,0),R8C>ROUND(DAYS360(ExpDat,RC1,0)/30,0)),0,OFFSET(R45C,MAX(-MNR,ROUND(DAYS360(ValDat,RC1,0)/30,0)-R8C+MEP-MNR),0,1,1))) -> 0 | S73: =IF(RC1="","",IF(OR(R8C<=ROUND(DAYS360(ValDat,RC1,0)/30,0),R8C>ROUND(DAYS360(ExpDat,RC1,0)/30,0)),0,OFFSET(R45C,MAX(-MNR,ROUND(DAYS360(ValDat,RC1,0)/30,0)-R8C+MEP-MNR),0,1,1))) -> 0 | T73: =IF(RC1="","",IF(OR(R8C<=ROUND(DAYS360(ValDat,RC1,0)/30,0),R8C>ROUND(DAYS360(ExpDat,RC1,0)/30,0)),0,OFFSET(R45C,MAX(-MNR,ROUND(DAYS360(ValDat,RC1,0)/30,0)-R8C+MEP-MNR),0,1,1))) -> 0 | U73: =IF(RC1="","",IF(OR(R8C<=ROUND(DAYS360(ValDat,RC1,0)/30,0),R8C>ROUND(DAYS360(ExpDat,RC1,0)/30,0)),0,OFFSET(R45C,MAX(-MNR,ROUND(DAYS360(ValDat,RC1,0)/30,0)-R8C+MEP-MNR),0,1,1))) -> 0 | V73: =IF(RC1="","",IF(OR(R8C<=ROUND(DAYS360(ValDat,RC1,0)/30,0),R8C>ROUND(DAYS360(ExpDat,RC1,0)/30,0)),0,OFFSET(R45C,MAX(-MNR,ROUND(DAYS360(ValDat,RC1,0)/30,0)-R8C+MEP-MNR),0,1,1))) -> 0 | W73: =IF(RC1="","",IF(OR(R8C<=ROUND(DAYS360(ValDat,RC1,0)/30,0),R8C>ROUND(DAYS360(ExpDat,RC1,0)/30,0)),0,OFFSET(R45C,MAX(-MNR,ROUND(DAYS360(ValDat,RC1,0)/30,0)-R8C+MEP-MNR),0,1,1))) -> 0 | X73: =IF(RC1="","",IF(OR(R8C<=ROUND(DAYS360(ValDat,RC1,0)/30,0),R8C>ROUND(DAYS360(ExpDat,RC1,0)/30,0)),0,OFFSET(R45C,MAX(-MNR,ROUND(DAYS360(ValDat,RC1,0)/30,0)-R8C+MEP-MNR),0,1,1))) -> 0 | Y73: =IF(RC1="","",IF(OR(R8C<=ROUND(DAYS360(ValDat,RC1,0)/30,0),R8C>ROUND(DAYS360(ExpDat,RC1,0)/30,0)),0,OFFSET(R45C,MAX(-MNR,ROUND(DAYS360(ValDat,RC1,0)/30,0)-R8C+MEP-MNR),0,1,1))) -> 0 | Z73: =IF(RC1="","",IF(OR(R8C<=ROUND(DAYS360(ValDat,RC1,0)/30,0),R8C>ROUND(DAYS360(ExpDat,RC1,0)/30,0)),0,OFFSET(R45C,MAX(-MNR,ROUND(DAYS360(ValDat,RC1,0)/30,0)-R8C+MEP-MNR),0,1,1))) -> 0 | AA73: =IF(RC1="","",IF(OR(R8C<=ROUND(DAYS360(ValDat,RC1,0)/30,0),R8C>ROUND(DAYS360(ExpDat,RC1,0)/30,0)),0,OFFSET(R45C,MAX(-MNR,ROUND(DAYS360(ValDat,RC1,0)/30,0)-R8C+MEP-MNR),0,1,1))) -> 0 | AB73: =IF(RC1="","",IF(OR(R8C<=ROUND(DAYS360(ValDat,RC1,0)/30,0),R8C>ROUND(DAYS360(ExpDat,RC1,0)/30,0)),0,OFFSET(R45C,MAX(-MNR,ROUND(DAYS360(ValDat,RC1,0)/30,0)-R8C+MEP-MNR),0,1,1))) -> 0 | AC73: =IF(RC1="","",IF(OR(R8C<=ROUND(DAYS360(ValDat,RC1,0)/30,0),R8C>ROUND(DAYS360(ExpDat,RC1,0)/30,0)),0,OFFSET(R45C,MAX(-MNR,ROUND(DAYS360(ValDat,RC1,0)/30,0)-R8C+MEP-MNR),0,1,1))) -> 0 | AD73: =IF(RC1="","",IF(OR(R8C<=ROUND(DAYS360(ValDat,RC1,0)/30,0),R8C>ROUND(DAYS360(ExpDat,RC1,0)/30,0)),0,OFFSET(R45C,MAX(-MNR,ROUND(DAYS360(ValDat,RC1,0)/30,0)-R8C+MEP-MNR),0,1,1))) -> 0 | AE73: =IF(RC1="","",IF(OR(R8C<=ROUND(DAYS360(ValDat,RC1,0)/30,0),R8C>ROUND(DAYS360(ExpDat,RC1,0)/30,0)),0,OFFSET(R45C,MAX(-MNR,ROUND(DAYS360(ValDat,RC1,0)/30,0)-R8C+MEP-MNR),0,1,1))) -> 0 | AF73: =IF(RC1="","",IF(OR(R8C<=ROUND(DAYS360(ValDat,RC1,0)/30,0),R8C>ROUND(DAYS360(ExpDat,RC1,0)/30,0)),0,OFFSET(R45C,MAX(-MNR,ROUND(DAYS360(ValDat,RC1,0)/30,0)-R8C+MEP-MNR),0,1,1))) -> 0 | AG73: =IF(RC1="","",IF(OR(R8C<=ROUND(DAYS360(ValDat,RC1,0)/30,0),R8C>ROUND(DAYS360(ExpDat,RC1,0)/30,0)),0,OFFSET(R45C,MAX(-MNR,ROUND(DAYS360(ValDat,RC1,0)/30,0)-R8C+MEP-MNR),0,1,1))) -> 0 | AH73: =IF(RC1="","",IF(OR(R8C<=ROUND(DAYS360(ValDat,RC1,0)/30,0),R8C>ROUND(DAYS360(ExpDat,RC1,0)/30,0)),0,OFFSET(R45C,MAX(-MNR,ROUND(DAYS360(ValDat,RC1,0)/30,0)-R8C+MEP-MNR),0,1,1))) -> 0 | AI73: =IF(RC1="","",IF(OR(R8C<=ROUND(DAYS360(ValDat,RC1,0)/30,0),R8C>ROUND(DAYS360(ExpDat,RC1,0)/30,0)),0,OFFSET(R45C,MAX(-MNR,ROUND(DAYS360(ValDat,RC1,0)/30,0)-R8C+MEP-MNR),0,1,1))) -> 0 | AJ73: =IF(RC1="","",IF(OR(R8C<=ROUND(DAYS360(ValDat,RC1,0)/30,0),R8C>ROUND(DAYS360(ExpDat,RC1,0)/30,0)),0,OFFSET(R45C,MAX(-MNR,ROUND(DAYS360(ValDat,RC1,0)/30,0)-R8C+MEP-MNR),0,1,1))) -> 0 | AK73: =IF(RC1="","",IF(OR(R8C<=ROUND(DAYS360(ValDat,RC1,0)/30,0),R8C>ROUND(DAYS360(ExpDat,RC1,0)/30,0)),0,OFFSET(R45C,MAX(-MNR,ROUND(DAYS360(ValDat,RC1,0)/30,0)-R8C+MEP-MNR),0,1,1))) -> 0 | AL73: =IF(RC1="","",IF(OR(R8C<=ROUND(DAYS360(ValDat,RC1,0)/30,0),R8C>ROUND(DAYS360(ExpDat,RC1,0)/30,0)),0,OFFSET(R45C,MAX(-MNR,ROUND(DAYS360(ValDat,RC1,0)/30,0)-R8C+MEP-MNR),0,1,1))) -> 0 | AM73: =IF(RC1="","",IF(OR(R8C<=ROUND(DAYS360(ValDat,RC1,0)/30,0),R8C>ROUND(DAYS360(ExpDat,RC1,0)/30,0)),0,OFFSET(R45C,MAX(-MNR,ROUND(DAYS360(ValDat,RC1,0)/30,0)-R8C+MEP-MNR),0,1,1))) -> 0 | AN73: =IF(RC1="","",IF(OR(R8C<=ROUND(DAYS360(ValDat,RC1,0)/30,0),R8C>ROUND(DAYS360(ExpDat,RC1,0)/30,0)),0,OFFSET(R45C,MAX(-MNR,ROUND(DAYS360(ValDat,RC1,0)/30,0)-R8C+MEP-MNR),0,1,1))) -> 0 | AO73: =IF(RC1="","",IF(OR(R8C<=ROUND(DAYS360(ValDat,RC1,0)/30,0),R8C>ROUND(DAYS360(ExpDat,RC1,0)/30,0)),0,OFFSET(R45C,MAX(-MNR,ROUND(DAYS360(ValDat,RC1,0)/30,0)-R8C+MEP-MNR),0,1,1))) -> 0
A74: =IF(R[-1]C="","",IF(DATE(YEAR(R[-1]C),MONTH(R[-1]C)+1,1)>RunDat,"",DATE(YEAR(R[-1]C),MONTH(R[-1]C)+1,1))) -> 1999-12-01T00:00:00.000 | D74: =IF(RC1="","",SUM(RC[2]:RC[37])) -> 198865 | F74: =IF(RC1="","",IF(OR(R8C<=ROUND(DAYS360(ValDat,RC1,0)/30,0),R8C>ROUND(DAYS360(ExpDat,RC1,0)/30,0)),0,OFFSET(R45C,MAX(-MNR,ROUND(DAYS360(ValDat,RC1,0)/30,0)-R8C+MEP-MNR),0,1,1))) -> 1321 | G74: =IF(RC1="","",IF(OR(R8C<=ROUND(DAYS360(ValDat,RC1,0)/30,0),R8C>ROUND(DAYS360(ExpDat,RC1,0)/30,0)),0,OFFSET(R45C,MAX(-MNR,ROUND(DAYS360(ValDat,RC1,0)/30,0)-R8C+MEP-MNR),0,1,1))) -> 83114 | H74: =IF(RC1="","",IF(OR(R8C<=ROUND(DAYS360(ValDat,RC1,0)/30,0),R8C>ROUND(DAYS360(ExpDat,RC1,0)/30,0)),0,OFFSET(R45C,MAX(-MNR,ROUND(DAYS360(ValDat,RC1,0)/30,0)-R8C+MEP-MNR),0,1,1))) -> 69592 | I74: =IF(RC1="","",IF(OR(R8C<=ROUND(DAYS360(ValDat,RC1,0)/30,0),R8C>ROUND(DAYS360(ExpDat,RC1,0)/30,0)),0,OFFSET(R45C,MAX(-MNR,ROUND(DAYS360(ValDat,RC1,0)/30,0)-R8C+MEP-MNR),0,1,1))) -> 23721 | J74: =IF(RC1="","",IF(OR(R8C<=ROUND(DAYS360(ValDat,RC1,0)/30,0),R8C>ROUND(DAYS360(ExpDat,RC1,0)/30,0)),0,OFFSET(R45C,MAX(-MNR,ROUND(DAYS360(ValDat,RC1,0)/30,0)-R8C+MEP-MNR),0,1,1))) -> 3445 | K74: =IF(RC1="","",IF(OR(R8C<=ROUND(DAYS360(ValDat,RC1,0)/30,0),R8C>ROUND(DAYS360(ExpDat,RC1,0)/30,0)),0,OFFSET(R45C,MAX(-MNR,ROUND(DAYS360(ValDat,RC1,0)/30,0)-R8C+MEP-MNR),0,1,1))) -> 10627 | L74: =IF(RC1="","",IF(OR(R8C<=ROUND(DAYS360(ValDat,RC1,0)/30,0),R8C>ROUND(DAYS360(ExpDat,RC1,0)/30,0)),0,OFFSET(R45C,MAX(-MNR,ROUND(DAYS360(ValDat,RC1,0)/30,0)-R8C+MEP-MNR),0,1,1))) -> 6831 | M74: =IF(RC1="","",IF(OR(R8C<=ROUND(DAYS360(ValDat,RC1,0)/30,0),R8C>ROUND(DAYS360(ExpDat,RC1,0)/30,0)),0,OFFSET(R45C,MAX(-MNR,ROUND(DAYS360(ValDat,RC1,0)/30,0)-R8C+MEP-MNR),0,1,1))) -> 150 | N74: =IF(RC1="","",IF(OR(R8C<=ROUND(DAYS360(ValDat,RC1,0)/30,0),R8C>ROUND(DAYS360(ExpDat,RC1,0)/30,0)),0,OFFSET(R45C,MAX(-MNR,ROUND(DAYS360(ValDat,RC1,0)/30,0)-R8C+MEP-MNR),0,1,1))) -> 64 | O74: =IF(RC1="","",IF(OR(R8C<=ROUND(DAYS360(ValDat,RC1,0)/30,0),R8C>ROUND(DAYS360(ExpDat,RC1,0)/30,0)),0,OFFSET(R45C,MAX(-MNR,ROUND(DAYS360(ValDat,RC1,0)/30,0)-R8C+MEP-MNR),0,1,1))) -> 0 | P74: =IF(RC1="","",IF(OR(R8C<=ROUND(DAYS360(ValDat,RC1,0)/30,0),R8C>ROUND(DAYS360(ExpDat,RC1,0)/30,0)),0,OFFSET(R45C,MAX(-MNR,ROUND(DAYS360(ValDat,RC1,0)/30,0)-R8C+MEP-MNR),0,1,1))) -> 0 | Q74: =IF(RC1="","",IF(OR(R8C<=ROUND(DAYS360(ValDat,RC1,0)/30,0),R8C>ROUND(DAYS360(ExpDat,RC1,0)/30,0)),0,OFFSET(R45C,MAX(-MNR,ROUND(DAYS360(ValDat,RC1,0)/30,0)-R8C+MEP-MNR),0,1,1))) -> 0 | R74: =IF(RC1="","",IF(OR(R8C<=ROUND(DAYS360(ValDat,RC1,0)/30,0),R8C>ROUND(DAYS360(ExpDat,RC1,0)/30,0)),0,OFFSET(R45C,MAX(-MNR,ROUND(DAYS360(ValDat,RC1,0)/30,0)-R8C+MEP-MNR),0,1,1))) -> 0 | S74: =IF(RC1="","",IF(OR(R8C<=ROUND(DAYS360(ValDat,RC1,0)/30,0),R8C>ROUND(DAYS360(ExpDat,RC1,0)/30,0)),0,OFFSET(R45C,MAX(-MNR,ROUND(DAYS360(ValDat,RC1,0)/30,0)-R8C+MEP-MNR),0,1,1))) -> 0 | T74: =IF(RC1="","",IF(OR(R8C<=ROUND(DAYS360(ValDat,RC1,0)/30,0),R8C>ROUND(DAYS360(ExpDat,RC1,0)/30,0)),0,OFFSET(R45C,MAX(-MNR,ROUND(DAYS360(ValDat,RC1,0)/30,0)-R8C+MEP-MNR),0,1,1))) -> 0 | U74: =IF(RC1="","",IF(OR(R8C<=ROUND(DAYS360(ValDat,RC1,0)/30,0),R8C>ROUND(DAYS360(ExpDat,RC1,0)/30,0)),0,OFFSET(R45C,MAX(-MNR,ROUND(DAYS360(ValDat,RC1,0)/30,0)-R8C+MEP-MNR),0,1,1))) -> 0 | V74: =IF(RC1="","",IF(OR(R8C<=ROUND(DAYS360(ValDat,RC1,0)/30,0),R8C>ROUND(DAYS360(ExpDat,RC1,0)/30,0)),0,OFFSET(R45C,MAX(-MNR,ROUND(DAYS360(ValDat,RC1,0)/30,0)-R8C+MEP-MNR),0,1,1))) -> 0 | W74: =IF(RC1="","",IF(OR(R8C<=ROUND(DAYS360(ValDat,RC1,0)/30,0),R8C>ROUND(DAYS360(ExpDat,RC1,0)/30,0)),0,OFFSET(R45C,MAX(-MNR,ROUND(DAYS360(ValDat,RC1,0)/30,0)-R8C+MEP-MNR),0,1,1))) -> 0 | X74: =IF(RC1="","",IF(OR(R8C<=ROUND(DAYS360(ValDat,RC1,0)/30,0),R8C>ROUND(DAYS360(ExpDat,RC1,0)/30,0)),0,OFFSET(R45C,MAX(-MNR,ROUND(DAYS360(ValDat,RC1,0)/30,0)-R8C+MEP-MNR),0,1,1))) -> 0 | Y74: =IF(RC1="","",IF(OR(R8C<=ROUND(DAYS360(ValDat,RC1,0)/30,0),R8C>ROUND(DAYS360(ExpDat,RC1,0)/30,0)),0,OFFSET(R45C,MAX(-MNR,ROUND(DAYS360(ValDat,RC1,0)/30,0)-R8C+MEP-MNR),0,1,1))) -> 0 | Z74: =IF(RC1="","",IF(OR(R8C<=ROUND(DAYS360(ValDat,RC1,0)/30,0),R8C>ROUND(DAYS360(ExpDat,RC1,0)/30,0)),0,OFFSET(R45C,MAX(-MNR,ROUND(DAYS360(ValDat,RC1,0)/30,0)-R8C+MEP-MNR),0,1,1))) -> 0 | AA74: =IF(RC1="","",IF(OR(R8C<=ROUND(DAYS360(ValDat,RC1,0)/30,0),R8C>ROUND(DAYS360(ExpDat,RC1,0)/30,0)),0,OFFSET(R45C,MAX(-MNR,ROUND(DAYS360(ValDat,RC1,0)/30,0)-R8C+MEP-MNR),0,1,1))) -> 0 | AB74: =IF(RC1="","",IF(OR(R8C<=ROUND(DAYS360(ValDat,RC1,0)/30,0),R8C>ROUND(DAYS360(ExpDat,RC1,0)/30,0)),0,OFFSET(R45C,MAX(-MNR,ROUND(DAYS360(ValDat,RC1,0)/30,0)-R8C+MEP-MNR),0,1,1))) -> 0 | AC74: =IF(RC1="","",IF(OR(R8C<=ROUND(DAYS360(ValDat,RC1,0)/30,0),R8C>ROUND(DAYS360(ExpDat,RC1,0)/30,0)),0,OFFSET(R45C,MAX(-MNR,ROUND(DAYS360(ValDat,RC1,0)/30,0)-R8C+MEP-MNR),0,1,1))) -> 0 | AD74: =IF(RC1="","",IF(OR(R8C<=ROUND(DAYS360(ValDat,RC1,0)/30,0),R8C>ROUND(DAYS360(ExpDat,RC1,0)/30,0)),0,OFFSET(R45C,MAX(-MNR,ROUND(DAYS360(ValDat,RC1,0)/30,0)-R8C+MEP-MNR),0,1,1))) -> 0 | AE74: =IF(RC1="","",IF(OR(R8C<=ROUND(DAYS360(ValDat,RC1,0)/30,0),R8C>ROUND(DAYS360(ExpDat,RC1,0)/30,0)),0,OFFSET(R45C,MAX(-MNR,ROUND(DAYS360(ValDat,RC1,0)/30,0)-R8C+MEP-MNR),0,1,1))) -> 0 | AF74: =IF(RC1="","",IF(OR(R8C<=ROUND(DAYS360(ValDat,RC1,0)/30,0),R8C>ROUND(DAYS360(ExpDat,RC1,0)/30,0)),0,OFFSET(R45C,MAX(-MNR,ROUND(DAYS360(ValDat,RC1,0)/30,0)-R8C+MEP-MNR),0,1,1))) -> 0 | AG74: =IF(RC1="","",IF(OR(R8C<=ROUND(DAYS360(ValDat,RC1,0)/30,0),R8C>ROUND(DAYS360(ExpDat,RC1,0)/30,0)),0,OFFSET(R45C,MAX(-MNR,ROUND(DAYS360(ValDat,RC1,0)/30,0)-R8C+MEP-MNR),0,1,1))) -> 0 | AH74: =IF(RC1="","",IF(OR(R8C<=ROUND(DAYS360(ValDat,RC1,0)/30,0),R8C>ROUND(DAYS360(ExpDat,RC1,0)/30,0)),0,OFFSET(R45C,MAX(-MNR,ROUND(DAYS360(ValDat,RC1,0)/30,0)-R8C+MEP-MNR),0,1,1))) -> 0 | AI74: =IF(RC1="","",IF(OR(R8C<=ROUND(DAYS360(ValDat,RC1,0)/30,0),R8C>ROUND(DAYS360(ExpDat,RC1,0)/30,0)),0,OFFSET(R45C,MAX(-MNR,ROUND(DAYS360(ValDat,RC1,0)/30,0)-R8C+MEP-MNR),0,1,1))) -> 0 | AJ74: =IF(RC1="","",IF(OR(R8C<=ROUND(DAYS360(ValDat,RC1,0)/30,0),R8C>ROUND(DAYS360(ExpDat,RC1,0)/30,0)),0,OFFSET(R45C,MAX(-MNR,ROUND(DAYS360(ValDat,RC1,0)/30,0)-R8C+MEP-MNR),0,1,1))) -> 0 | AK74: =IF(RC1="","",IF(OR(R8C<=ROUND(DAYS360(ValDat,RC1,0)/30,0),R8C>ROUND(DAYS360(ExpDat,RC1,0)/30,0)),0,OFFSET(R45C,MAX(-MNR,ROUND(DAYS360(ValDat,RC1,0)/30,0)-R8C+MEP-MNR),0,1,1))) -> 0 | AL74: =IF(RC1="","",IF(OR(R8C<=ROUND(DAYS360(ValDat,RC1,0)/30,0),R8C>ROUND(DAYS360(ExpDat,RC1,0)/30,0)),0,OFFSET(R45C,MAX(-MNR,ROUND(DAYS360(ValDat,RC1,0)/30,0)-R8C+MEP-MNR),0,1,1))) -> 0 | AM74: =IF(RC1="","",IF(OR(R8C<=ROUND(DAYS360(ValDat,RC1,0)/30,0),R8C>ROUND(DAYS360(ExpDat,RC1,0)/30,0)),0,OFFSET(R45C,MAX(-MNR,ROUND(DAYS360(ValDat,RC1,0)/30,0)-R8C+MEP-MNR),0,1,1))) -> 0 | AN74: =IF(RC1="","",IF(OR(R8C<=ROUND(DAYS360(ValDat,RC1,0)/30,0),R8C>ROUND(DAYS360(ExpDat,RC1,0)/30,0)),0,OFFSET(R45C,MAX(-MNR,ROUND(DAYS360(ValDat,RC1,0)/30,0)-R8C+MEP-MNR),0,1,1))) -> 0 | AO74: =IF(RC1="","",IF(OR(R8C<=ROUND(DAYS360(ValDat,RC1,0)/30,0),R8C>ROUND(DAYS360(ExpDat,RC1,0)/30,0)),0,OFFSET(R45C,MAX(-MNR,ROUND(DAYS360(ValDat,RC1,0)/30,0)-R8C+MEP-MNR),0,1,1))) -> 0
A75: =IF(R[-1]C="","",IF(DATE(YEAR(R[-1]C),MONTH(R[-1]C)+1,1)>RunDat,"",DATE(YEAR(R[-1]C),MONTH(R[-1]C)+1,1))) -> 2000-01-01T00:00:00.000 | D75: =IF(RC1="","",SUM(RC[2]:RC[37])) -> 101456 | F75: =IF(RC1="","",IF(OR(R8C<=ROUND(DAYS360(ValDat,RC1,0)/30,0),R8C>ROUND(DAYS360(ExpDat,RC1,0)/30,0)),0,OFFSET(R45C,MAX(-MNR,ROUND(DAYS360(ValDat,RC1,0)/30,0)-R8C+MEP-MNR),0,1,1))) -> 14982 | G75: =IF(RC1="","",IF(OR(R8C<=ROUND(DAYS360(ValDat,RC1,0)/30,0),R8C>ROUND(DAYS360(ExpDat,RC1,0)/30,0)),0,OFFSET(R45C,MAX(-MNR,ROUND(DAYS360(ValDat,RC1,0)/30,0)-R8C+MEP-MNR),0,1,1))) -> 33300 | H75: =IF(RC1="","",IF(OR(R8C<=ROUND(DAYS360(ValDat,RC1,0)/30,0),R8C>ROUND(DAYS360(ExpDat,RC1,0)/30,0)),0,OFFSET(R45C,MAX(-MNR,ROUND(DAYS360(ValDat,RC1,0)/30,0)-R8C+MEP-MNR),0,1,1))) -> 23227 | I75: =IF(RC1="","",IF(OR(R8C<=ROUND(DAYS360(ValDat,RC1,0)/30,0),R8C>ROUND(DAYS360(ExpDat,RC1,0)/30,0)),0,OFFSET(R45C,MAX(-MNR,ROUND(DAYS360(ValDat,RC1,0)/30,0)-R8C+MEP-MNR),0,1,1))) -> 13073 | J75: =IF(RC1="","",IF(OR(R8C<=ROUND(DAYS360(ValDat,RC1,0)/30,0),R8C>ROUND(DAYS360(ExpDat,RC1,0)/30,0)),0,OFFSET(R45C,MAX(-MNR,ROUND(DAYS360(ValDat,RC1,0)/30,0)-R8C+MEP-MNR),0,1,1))) -> 1187 | K75: =IF(RC1="","",IF(OR(R8C<=ROUND(DAYS360(ValDat,RC1,0)/30,0),R8C>ROUND(DAYS360(ExpDat,RC1,0)/30,0)),0,OFFSET(R45C,MAX(-MNR,ROUND(DAYS360(ValDat,RC1,0)/30,0)-R8C+MEP-MNR),0,1,1))) -> -482 | L75: =IF(RC1="","",IF(OR(R8C<=ROUND(DAYS360(ValDat,RC1,0)/30,0),R8C>ROUND(DAYS360(ExpDat,RC1,0)/30,0)),0,OFFSET(R45C,MAX(-MNR,ROUND(DAYS360(ValDat,RC1,0)/30,0)-R8C+MEP-MNR),0,1,1))) -> 188 | M75: =IF(RC1="","",IF(OR(R8C<=ROUND(DAYS360(ValDat,RC1,0)/30,0),R8C>ROUND(DAYS360(ExpDat,RC1,0)/30,0)),0,OFFSET(R45C,MAX(-MNR,ROUND(DAYS360(ValDat,RC1,0)/30,0)-R8C+MEP-MNR),0,1,1))) -> 14862 | N75: =IF(RC1="","",IF(OR(R8C<=ROUND(DAYS360(ValDat,RC1,0)/30,0),R8C>ROUND(DAYS360(ExpDat,RC1,0)/30,0)),0,OFFSET(R45C,MAX(-MNR,ROUND(DAYS360(ValDat,RC1,0)/30,0)-R8C+MEP-MNR),0,1,1))) -> 64 | O75: =IF(RC1="","",IF(OR(R8C<=ROUND(DAYS360(ValDat,RC1,0)/30,0),R8C>ROUND(DAYS360(ExpDat,RC1,0)/30,0)),0,OFFSET(R45C,MAX(-MNR,ROUND(DAYS360(ValDat,RC1,0)/30,0)-R8C+MEP-MNR),0,1,1))) -> 1055 | P75: =IF(RC1="","",IF(OR(R8C<=ROUND(DAYS360(ValDat,RC1,0)/30,0),R8C>ROUND(DAYS360(ExpDat,RC1,0)/30,0)),0,OFFSET(R45C,MAX(-MNR,ROUND(DAYS360(ValDat,RC1,0)/30,0)-R8C+MEP-MNR),0,1,1))) -> 0 | Q75: =IF(RC1="","",IF(OR(R8C<=ROUND(DAYS360(ValDat,RC1,0)/30,0),R8C>ROUND(DAYS360(ExpDat,RC1,0)/30,0)),0,OFFSET(R45C,MAX(-MNR,ROUND(DAYS360(ValDat,RC1,0)/30,0)-R8C+MEP-MNR),0,1,1))) -> 0 | R75: =IF(RC1="","",IF(OR(R8C<=ROUND(DAYS360(ValDat,RC1,0)/30,0),R8C>ROUND(DAYS360(ExpDat,RC1,0)/30,0)),0,OFFSET(R45C,MAX(-MNR,ROUND(DAYS360(ValDat,RC1,0)/30,0)-R8C+MEP-MNR),0,1,1))) -> 0 | S75: =IF(RC1="","",IF(OR(R8C<=ROUND(DAYS360(ValDat,RC1,0)/30,0),R8C>ROUND(DAYS360(ExpDat,RC1,0)/30,0)),0,OFFSET(R45C,MAX(-MNR,ROUND(DAYS360(ValDat,RC1,0)/30,0)-R8C+MEP-MNR),0,1,1))) -> 0 | T75: =IF(RC1="","",IF(OR(R8C<=ROUND(DAYS360(ValDat,RC1,0)/30,0),R8C>ROUND(DAYS360(ExpDat,RC1,0)/30,0)),0,OFFSET(R45C,MAX(-MNR,ROUND(DAYS360(ValDat,RC1,0)/30,0)-R8C+MEP-MNR),0,1,1))) -> 0 | U75: =IF(RC1="","",IF(OR(R8C<=ROUND(DAYS360(ValDat,RC1,0)/30,0),R8C>ROUND(DAYS360(ExpDat,RC1,0)/30,0)),0,OFFSET(R45C,MAX(-MNR,ROUND(DAYS360(ValDat,RC1,0)/30,0)-R8C+MEP-MNR),0,1,1))) -> 0 | V75: =IF(RC1="","",IF(OR(R8C<=ROUND(DAYS360(ValDat,RC1,0)/30,0),R8C>ROUND(DAYS360(ExpDat,RC1,0)/30,0)),0,OFFSET(R45C,MAX(-MNR,ROUND(DAYS360(ValDat,RC1,0)/30,0)-R8C+MEP-MNR),0,1,1))) -> 0 | W75: =IF(RC1="","",IF(OR(R8C<=ROUND(DAYS360(ValDat,RC1,0)/30,0),R8C>ROUND(DAYS360(ExpDat,RC1,0)/30,0)),0,OFFSET(R45C,MAX(-MNR,ROUND(DAYS360(ValDat,RC1,0)/30,0)-R8C+MEP-MNR),0,1,1))) -> 0 | X75: =IF(RC1="","",IF(OR(R8C<=ROUND(DAYS360(ValDat,RC1,0)/30,0),R8C>ROUND(DAYS360(ExpDat,RC1,0)/30,0)),0,OFFSET(R45C,MAX(-MNR,ROUND(DAYS360(ValDat,RC1,0)/30,0)-R8C+MEP-MNR),0,1,1))) -> 0 | Y75: =IF(RC1="","",IF(OR(R8C<=ROUND(DAYS360(ValDat,RC1,0)/30,0),R8C>ROUND(DAYS360(ExpDat,RC1,0)/30,0)),0,OFFSET(R45C,MAX(-MNR,ROUND(DAYS360(ValDat,RC1,0)/30,0)-R8C+MEP-MNR),0,1,1))) -> 0 | Z75: =IF(RC1="","",IF(OR(R8C<=ROUND(DAYS360(ValDat,RC1,0)/30,0),R8C>ROUND(DAYS360(ExpDat,RC1,0)/30,0)),0,OFFSET(R45C,MAX(-MNR,ROUND(DAYS360(ValDat,RC1,0)/30,0)-R8C+MEP-MNR),0,1,1))) -> 0 | AA75: =IF(RC1="","",IF(OR(R8C<=ROUND(DAYS360(ValDat,RC1,0)/30,0),R8C>ROUND(DAYS360(ExpDat,RC1,0)/30,0)),0,OFFSET(R45C,MAX(-MNR,ROUND(DAYS360(ValDat,RC1,0)/30,0)-R8C+MEP-MNR),0,1,1))) -> 0 | AB75: =IF(RC1="","",IF(OR(R8C<=ROUND(DAYS360(ValDat,RC1,0)/30,0),R8C>ROUND(DAYS360(ExpDat,RC1,0)/30,0)),0,OFFSET(R45C,MAX(-MNR,ROUND(DAYS360(ValDat,RC1,0)/30,0)-R8C+MEP-MNR),0,1,1))) -> 0 | AC75: =IF(RC1="","",IF(OR(R8C<=ROUND(DAYS360(ValDat,RC1,0)/30,0),R8C>ROUND(DAYS360(ExpDat,RC1,0)/30,0)),0,OFFSET(R45C,MAX(-MNR,ROUND(DAYS360(ValDat,RC1,0)/30,0)-R8C+MEP-MNR),0,1,1))) -> 0 | AD75: =IF(RC1="","",IF(OR(R8C<=ROUND(DAYS360(ValDat,RC1,0)/30,0),R8C>ROUND(DAYS360(ExpDat,RC1,0)/30,0)),0,OFFSET(R45C,MAX(-MNR,ROUND(DAYS360(ValDat,RC1,0)/30,0)-R8C+MEP-MNR),0,1,1))) -> 0 | AE75: =IF(RC1="","",IF(OR(R8C<=ROUND(DAYS360(ValDat,RC1,0)/30,0),R8C>ROUND(DAYS360(ExpDat,RC1,0)/30,0)),0,OFFSET(R45C,MAX(-MNR,ROUND(DAYS360(ValDat,RC1,0)/30,0)-R8C+MEP-MNR),0,1,1))) -> 0 | AF75: =IF(RC1="","",IF(OR(R8C<=ROUND(DAYS360(ValDat,RC1,0)/30,0),R8C>ROUND(DAYS360(ExpDat,RC1,0)/30,0)),0,OFFSET(R45C,MAX(-MNR,ROUND(DAYS360(ValDat,RC1,0)/30,0)-R8C+MEP-MNR),0,1,1))) -> 0 | AG75: =IF(RC1="","",IF(OR(R8C<=ROUND(DAYS360(ValDat,RC1,0)/30,0),R8C>ROUND(DAYS360(ExpDat,RC1,0)/30,0)),0,OFFSET(R45C,MAX(-MNR,ROUND(DAYS360(ValDat,RC1,0)/30,0)-R8C+MEP-MNR),0,1,1))) -> 0 | AH75: =IF(RC1="","",IF(OR(R8C<=ROUND(DAYS360(ValDat,RC1,0)/30,0),R8C>ROUND(DAYS360(ExpDat,RC1,0)/30,0)),0,OFFSET(R45C,MAX(-MNR,ROUND(DAYS360(ValDat,RC1,0)/30,0)-R8C+MEP-MNR),0,1,1))) -> 0 | AI75: =IF(RC1="","",IF(OR(R8C<=ROUND(DAYS360(ValDat,RC1,0)/30,0),R8C>ROUND(DAYS360(ExpDat,RC1,0)/30,0)),0,OFFSET(R45C,MAX(-MNR,ROUND(DAYS360(ValDat,RC1,0)/30,0)-R8C+MEP-MNR),0,1,1))) -> 0 | AJ75: =IF(RC1="","",IF(OR(R8C<=ROUND(DAYS360(ValDat,RC1,0)/30,0),R8C>ROUND(DAYS360(ExpDat,RC1,0)/30,0)),0,OFFSET(R45C,MAX(-MNR,ROUND(DAYS360(ValDat,RC1,0)/30,0)-R8C+MEP-MNR),0,1,1))) -> 0 | AK75: =IF(RC1="","",IF(OR(R8C<=ROUND(DAYS360(ValDat,RC1,0)/30,0),R8C>ROUND(DAYS360(ExpDat,RC1,0)/30,0)),0,OFFSET(R45C,MAX(-MNR,ROUND(DAYS360(ValDat,RC1,0)/30,0)-R8C+MEP-MNR),0,1,1))) -> 0 | AL75: =IF(RC1="","",IF(OR(R8C<=ROUND(DAYS360(ValDat,RC1,0)/30,0),R8C>ROUND(DAYS360(ExpDat,RC1,0)/30,0)),0,OFFSET(R45C,MAX(-MNR,ROUND(DAYS360(ValDat,RC1,0)/30,0)-R8C+MEP-MNR),0,1,1))) -> 0 | AM75: =IF(RC1="","",IF(OR(R8C<=ROUND(DAYS360(ValDat,RC1,0)/30,0),R8C>ROUND(DAYS360(ExpDat,RC1,0)/30,0)),0,OFFSET(R45C,MAX(-MNR,ROUND(DAYS360(ValDat,RC1,0)/30,0)-R8C+MEP-MNR),0,1,1))) -> 0 | AN75: =IF(RC1="","",IF(OR(R8C<=ROUND(DAYS360(ValDat,RC1,0)/30,0),R8C>ROUND(DAYS360(ExpDat,RC1,0)/30,0)),0,OFFSET(R45C,MAX(-MNR,ROUND(DAYS360(ValDat,RC1,0)/30,0)-R8C+MEP-MNR),0,1,1))) -> 0 | AO75: =IF(RC1="","",IF(OR(R8C<=ROUND(DAYS360(ValDat,RC1,0)/30,0),R8C>ROUND(DAYS360(ExpDat,RC1,0)/30,0)),0,OFFSET(R45C,MAX(-MNR,ROUND(DAYS360(ValDat,RC1,0)/30,0)-R8C+MEP-MNR),0,1,1))) -> 0
A76: =IF(R[-1]C="","",IF(DATE(YEAR(R[-1]C),MONTH(R[-1]C)+1,1)>RunDat,"",DATE(YEAR(R[-1]C),MONTH(R[-1]C)+1,1))) -> 2000-02-01T00:00:00.000 | D76: =IF(RC1="","",SUM(RC[2]:RC[37])) -> 119738 | F76: =IF(RC1="","",IF(OR(R8C<=ROUND(DAYS360(ValDat,RC1,0)/30,0),R8C>ROUND(DAYS360(ExpDat,RC1,0)/30,0)),0,OFFSET(R45C,MAX(-MNR,ROUND(DAYS360(ValDat,RC1,0)/30,0)-R8C+MEP-MNR),0,1,1))) -> 9736 | G76: =IF(RC1="","",IF(OR(R8C<=ROUND(DAYS360(ValDat,RC1,0)/30,0),R8C>ROUND(DAYS360(ExpDat,RC1,0)/30,0)),0,OFFSET(R45C,MAX(-MNR,ROUND(DAYS360(ValDat,RC1,0)/30,0)-R8C+MEP-MNR),0,1,1))) -> 44836 | H76: =IF(RC1="","",IF(OR(R8C<=ROUND(DAYS360(ValDat,RC1,0)/30,0),R8C>ROUND(DAYS360(ExpDat,RC1,0)/30,0)),0,OFFSET(R45C,MAX(-MNR,ROUND(DAYS360(ValDat,RC1,0)/30,0)-R8C+MEP-MNR),0,1,1))) -> 30097 | I76: =IF(RC1="","",IF(OR(R8C<=ROUND(DAYS360(ValDat,RC1,0)/30,0),R8C>ROUND(DAYS360(ExpDat,RC1,0)/30,0)),0,OFFSET(R45C,MAX(-MNR,ROUND(DAYS360(ValDat,RC1,0)/30,0)-R8C+MEP-MNR),0,1,1))) -> 13635 | J76: =IF(RC1="","",IF(OR(R8C<=ROUND(DAYS360(ValDat,RC1,0)/30,0),R8C>ROUND(DAYS360(ExpDat,RC1,0)/30,0)),0,OFFSET(R45C,MAX(-MNR,ROUND(DAYS360(ValDat,RC1,0)/30,0)-R8C+MEP-MNR),0,1,1))) -> 3966 | K76: =IF(RC1="","",IF(OR(R8C<=ROUND(DAYS360(ValDat,RC1,0)/30,0),R8C>ROUND(DAYS360(ExpDat,RC1,0)/30,0)),0,OFFSET(R45C,MAX(-MNR,ROUND(DAYS360(ValDat,RC1,0)/30,0)-R8C+MEP-MNR),0,1,1))) -> -269 | L76: =IF(RC1="","",IF(OR(R8C<=ROUND(DAYS360(ValDat,RC1,0)/30,0),R8C>ROUND(DAYS360(ExpDat,RC1,0)/30,0)),0,OFFSET(R45C,MAX(-MNR,ROUND(DAYS360(ValDat,RC1,0)/30,0)-R8C+MEP-MNR),0,1,1))) -> 1182 | M76: =IF(RC1="","",IF(OR(R8C<=ROUND(DAYS360(ValDat,RC1,0)/30,0),R8C>ROUND(DAYS360(ExpDat,RC1,0)/30,0)),0,OFFSET(R45C,MAX(-MNR,ROUND(DAYS360(ValDat,RC1,0)/30,0)-R8C+MEP-MNR),0,1,1))) -> 14862 | N76: =IF(RC1="","",IF(OR(R8C<=ROUND(DAYS360(ValDat,RC1,0)/30,0),R8C>ROUND(DAYS360(ExpDat,RC1,0)/30,0)),0,OFFSET(R45C,MAX(-MNR,ROUND(DAYS360(ValDat,RC1,0)/30,0)-R8C+MEP-MNR),0,1,1))) -> 638 | O76: =IF(RC1="","",IF(OR(R8C<=ROUND(DAYS360(ValDat,RC1,0)/30,0),R8C>ROUND(DAYS360(ExpDat,RC1,0)/30,0)),0,OFFSET(R45C,MAX(-MNR,ROUND(DAYS360(ValDat,RC1,0)/30,0)-R8C+MEP-MNR),0,1,1))) -> 1055 | P76: =IF(RC1="","",IF(OR(R8C<=ROUND(DAYS360(ValDat,RC1,0)/30,0),R8C>ROUND(DAYS360(ExpDat,RC1,0)/30,0)),0,OFFSET(R45C,MAX(-MNR,ROUND(DAYS360(ValDat,RC1,0)/30,0)-R8C+MEP-MNR),0,1,1))) -> 0 | Q76: =IF(RC1="","",IF(OR(R8C<=ROUND(DAYS360(ValDat,RC1,0)/30,0),R8C>ROUND(DAYS360(ExpDat,RC1,0)/30,0)),0,OFFSET(R45C,MAX(-MNR,ROUND(DAYS360(ValDat,RC1,0)/30,0)-R8C+MEP-MNR),0,1,1))) -> 0 | R76: =IF(RC1="","",IF(OR(R8C<=ROUND(DAYS360(ValDat,RC1,0)/30,0),R8C>ROUND(DAYS360(ExpDat,RC1,0)/30,0)),0,OFFSET(R45C,MAX(-MNR,ROUND(DAYS360(ValDat,RC1,0)/30,0)-R8C+MEP-MNR),0,1,1))) -> 0 | S76: =IF(RC1="","",IF(OR(R8C<=ROUND(DAYS360(ValDat,RC1,0)/30,0),R8C>ROUND(DAYS360(ExpDat,RC1,0)/30,0)),0,OFFSET(R45C,MAX(-MNR,ROUND(DAYS360(ValDat,RC1,0)/30,0)-R8C+MEP-MNR),0,1,1))) -> 0 | T76: =IF(RC1="","",IF(OR(R8C<=ROUND(DAYS360(ValDat,RC1,0)/30,0),R8C>ROUND(DAYS360(ExpDat,RC1,0)/30,0)),0,OFFSET(R45C,MAX(-MNR,ROUND(DAYS360(ValDat,RC1,0)/30,0)-R8C+MEP-MNR),0,1,1))) -> 0 | U76: =IF(RC1="","",IF(OR(R8C<=ROUND(DAYS360(ValDat,RC1,0)/30,0),R8C>ROUND(DAYS360(ExpDat,RC1,0)/30,0)),0,OFFSET(R45C,MAX(-MNR,ROUND(DAYS360(ValDat,RC1,0)/30,0)-R8C+MEP-MNR),0,1,1))) -> 0 | V76: =IF(RC1="","",IF(OR(R8C<=ROUND(DAYS360(ValDat,RC1,0)/30,0),R8C>ROUND(DAYS360(ExpDat,RC1,0)/30,0)),0,OFFSET(R45C,MAX(-MNR,ROUND(DAYS360(ValDat,RC1,0)/30,0)-R8C+MEP-MNR),0,1,1))) -> 0 | W76: =IF(RC1="","",IF(OR(R8C<=ROUND(DAYS360(ValDat,RC1,0)/30,0),R8C>ROUND(DAYS360(ExpDat,RC1,0)/30,0)),0,OFFSET(R45C,MAX(-MNR,ROUND(DAYS360(ValDat,RC1,0)/30,0)-R8C+MEP-MNR),0,1,1))) -> 0 | X76: =IF(RC1="","",IF(OR(R8C<=ROUND(DAYS360(ValDat,RC1,0)/30,0),R8C>ROUND(DAYS360(ExpDat,RC1,0)/30,0)),0,OFFSET(R45C,MAX(-MNR,ROUND(DAYS360(ValDat,RC1,0)/30,0)-R8C+MEP-MNR),0,1,1))) -> 0 | Y76: =IF(RC1="","",IF(OR(R8C<=ROUND(DAYS360(ValDat,RC1,0)/30,0),R8C>ROUND(DAYS360(ExpDat,RC1,0)/30,0)),0,OFFSET(R45C,MAX(-MNR,ROUND(DAYS360(ValDat,RC1,0)/30,0)-R8C+MEP-MNR),0,1,1))) -> 0 | Z76: =IF(RC1="","",IF(OR(R8C<=ROUND(DAYS360(ValDat,RC1,0)/30,0),R8C>ROUND(DAYS360(ExpDat,RC1,0)/30,0)),0,OFFSET(R45C,MAX(-MNR,ROUND(DAYS360(ValDat,RC1,0)/30,0)-R8C+MEP-MNR),0,1,1))) -> 0 | AA76: =IF(RC1="","",IF(OR(R8C<=ROUND(DAYS360(ValDat,RC1,0)/30,0),R8C>ROUND(DAYS360(ExpDat,RC1,0)/30,0)),0,OFFSET(R45C,MAX(-MNR,ROUND(DAYS360(ValDat,RC1,0)/30,0)-R8C+MEP-MNR),0,1,1))) -> 0 | AB76: =IF(RC1="","",IF(OR(R8C<=ROUND(DAYS360(ValDat,RC1,0)/30,0),R8C>ROUND(DAYS360(ExpDat,RC1,0)/30,0)),0,OFFSET(R45C,MAX(-MNR,ROUND(DAYS360(ValDat,RC1,0)/30,0)-R8C+MEP-MNR),0,1,1))) -> 0 | AC76: =IF(RC1="","",IF(OR(R8C<=ROUND(DAYS360(ValDat,RC1,0)/30,0),R8C>ROUND(DAYS360(ExpDat,RC1,0)/30,0)),0,OFFSET(R45C,MAX(-MNR,ROUND(DAYS360(ValDat,RC1,0)/30,0)-R8C+MEP-MNR),0,1,1))) -> 0 | AD76: =IF(RC1="","",IF(OR(R8C<=ROUND(DAYS360(ValDat,RC1,0)/30,0),R8C>ROUND(DAYS360(ExpDat,RC1,0)/30,0)),0,OFFSET(R45C,MAX(-MNR,ROUND(DAYS360(ValDat,RC1,0)/30,0)-R8C+MEP-MNR),0,1,1))) -> 0 | AE76: =IF(RC1="","",IF(OR(R8C<=ROUND(DAYS360(ValDat,RC1,0)/30,0),R8C>ROUND(DAYS360(ExpDat,RC1,0)/30,0)),0,OFFSET(R45C,MAX(-MNR,ROUND(DAYS360(ValDat,RC1,0)/30,0)-R8C+MEP-MNR),0,1,1))) -> 0 | AF76: =IF(RC1="","",IF(OR(R8C<=ROUND(DAYS360(ValDat,RC1,0)/30,0),R8C>ROUND(DAYS360(ExpDat,RC1,0)/30,0)),0,OFFSET(R45C,MAX(-MNR,ROUND(DAYS360(ValDat,RC1,0)/30,0)-R8C+MEP-MNR),0,1,1))) -> 0 | AG76: =IF(RC1="","",IF(OR(R8C<=ROUND(DAYS360(ValDat,RC1,0)/30,0),R8C>ROUND(DAYS360(ExpDat,RC1,0)/30,0)),0,OFFSET(R45C,MAX(-MNR,ROUND(DAYS360(ValDat,RC1,0)/30,0)-R8C+MEP-MNR),0,1,1))) -> 0 | AH76: =IF(RC1="","",IF(OR(R8C<=ROUND(DAYS360(ValDat,RC1,0)/30,0),R8C>ROUND(DAYS360(ExpDat,RC1,0)/30,0)),0,OFFSET(R45C,MAX(-MNR,ROUND(DAYS360(ValDat,RC1,0)/30,0)-R8C+MEP-MNR),0,1,1))) -> 0 | AI76: =IF(RC1="","",IF(OR(R8C<=ROUND(DAYS360(ValDat,RC1,0)/30,0),R8C>ROUND(DAYS360(ExpDat,RC1,0)/30,0)),0,OFFSET(R45C,MAX(-MNR,ROUND(DAYS360(ValDat,RC1,0)/30,0)-R8C+MEP-MNR),0,1,1))) -> 0 | AJ76: =IF(RC1="","",IF(OR(R8C<=ROUND(DAYS360(ValDat,RC1,0)/30,0),R8C>ROUND(DAYS360(ExpDat,RC1,0)/30,0)),0,OFFSET(R45C,MAX(-MNR,ROUND(DAYS360(ValDat,RC1,0)/30,0)-R8C+MEP-MNR),0,1,1))) -> 0 | AK76: =IF(RC1="","",IF(OR(R8C<=ROUND(DAYS360(ValDat,RC1,0)/30,0),R8C>ROUND(DAYS360(ExpDat,RC1,0)/30,0)),0,OFFSET(R45C,MAX(-MNR,ROUND(DAYS360(ValDat,RC1,0)/30,0)-R8C+MEP-MNR),0,1,1))) -> 0 | AL76: =IF(RC1="","",IF(OR(R8C<=ROUND(DAYS360(ValDat,RC1,0)/30,0),R8C>ROUND(DAYS360(ExpDat,RC1,0)/30,0)),0,OFFSET(R45C,MAX(-MNR,ROUND(DAYS360(ValDat,RC1,0)/30,0)-R8C+MEP-MNR),0,1,1))) -> 0 | AM76: =IF(RC1="","",IF(OR(R8C<=ROUND(DAYS360(ValDat,RC1,0)/30,0),R8C>ROUND(DAYS360(ExpDat,RC1,0)/30,0)),0,OFFSET(R45C,MAX(-MNR,ROUND(DAYS360(ValDat,RC1,0)/30,0)-R8C+MEP-MNR),0,1,1))) -> 0 | AN76: =IF(RC1="","",IF(OR(R8C<=ROUND(DAYS360(ValDat,RC1,0)/30,0),R8C>ROUND(DAYS360(ExpDat,RC1,0)/30,0)),0,OFFSET(R45C,MAX(-MNR,ROUND(DAYS360(ValDat,RC1,0)/30,0)-R8C+MEP-MNR),0,1,1))) -> 0 | AO76: =IF(RC1="","",IF(OR(R8C<=ROUND(DAYS360(ValDat,RC1,0)/30,0),R8C>ROUND(DAYS360(ExpDat,RC1,0)/30,0)),0,OFFSET(R45C,MAX(-MNR,ROUND(DAYS360(ValDat,RC1,0)/30,0)-R8C+MEP-MNR),0,1,1))) -> 0
A77: =IF(R[-1]C="","",IF(DATE(YEAR(R[-1]C),MONTH(R[-1]C)+1,1)>RunDat,"",DATE(YEAR(R[-1]C),MONTH(R[-1]C)+1,1))) -> 2000-03-01T00:00:00.000 | D77: =IF(RC1="","",SUM(RC[2]:RC[37])) -> 233855 | F77: =IF(RC1="","",IF(OR(R8C<=ROUND(DAYS360(ValDat,RC1,0)/30,0),R8C>ROUND(DAYS360(ExpDat,RC1,0)/30,0)),0,OFFSET(R45C,MAX(-MNR,ROUND(DAYS360(ValDat,RC1,0)/30,0)-R8C+MEP-MNR),0,1,1))) -> 68074 | G77: =IF(RC1="","",IF(OR(R8C<=ROUND(DAYS360(ValDat,RC1,0)/30,0),R8C>ROUND(DAYS360(ExpDat,RC1,0)/30,0)),0,OFFSET(R45C,MAX(-MNR,ROUND(DAYS360(ValDat,RC1,0)/30,0)-R8C+MEP-MNR),0,1,1))) -> 90376 | H77: =IF(RC1="","",IF(OR(R8C<=ROUND(DAYS360(ValDat,RC1,0)/30,0),R8C>ROUND(DAYS360(ExpDat,RC1,0)/30,0)),0,OFFSET(R45C,MAX(-MNR,ROUND(DAYS360(ValDat,RC1,0)/30,0)-R8C+MEP-MNR),0,1,1))) -> 31946 | I77: =IF(RC1="","",IF(OR(R8C<=ROUND(DAYS360(ValDat,RC1,0)/30,0),R8C>ROUND(DAYS360(ExpDat,RC1,0)/30,0)),0,OFFSET(R45C,MAX(-MNR,ROUND(DAYS360(ValDat,RC1,0)/30,0)-R8C+MEP-MNR),0,1,1))) -> 27921 | J77: =IF(RC1="","",IF(OR(R8C<=ROUND(DAYS360(ValDat,RC1,0)/30,0),R8C>ROUND(DAYS360(ExpDat,RC1,0)/30,0)),0,OFFSET(R45C,MAX(-MNR,ROUND(DAYS360(ValDat,RC1,0)/30,0)-R8C+MEP-MNR),0,1,1))) -> 5991 | K77: =IF(RC1="","",IF(OR(R8C<=ROUND(DAYS360(ValDat,RC1,0)/30,0),R8C>ROUND(DAYS360(ExpDat,RC1,0)/30,0)),0,OFFSET(R45C,MAX(-MNR,ROUND(DAYS360(ValDat,RC1,0)/30,0)-R8C+MEP-MNR),0,1,1))) -> 7382 | L77: =IF(RC1="","",IF(OR(R8C<=ROUND(DAYS360(ValDat,RC1,0)/30,0),R8C>ROUND(DAYS360(ExpDat,RC1,0)/30,0)),0,OFFSET(R45C,MAX(-MNR,ROUND(DAYS360(ValDat,RC1,0)/30,0)-R8C+MEP-MNR),0,1,1))) -> 856 | M77: =IF(RC1="","",IF(OR(R8C<=ROUND(DAYS360(ValDat,RC1,0)/30,0),R8C>ROUND(DAYS360(ExpDat,RC1,0)/30,0)),0,OFFSET(R45C,MAX(-MNR,ROUND(DAYS360(ValDat,RC1,0)/30,0)-R8C+MEP-MNR),0,1,1))) -> 512 | N77: =IF(RC1="","",IF(OR(R8C<=ROUND(DAYS360(ValDat,RC1,0)/30,0),R8C>ROUND(DAYS360(ExpDat,RC1,0)/30,0)),0,OFFSET(R45C,MAX(-MNR,ROUND(DAYS360(ValDat,RC1,0)/30,0)-R8C+MEP-MNR),0,1,1))) -> 711 | O77: =IF(RC1="","",IF(OR(R8C<=ROUND(DAYS360(ValDat,RC1,0)/30,0),R8C>ROUND(DAYS360(ExpDat,RC1,0)/30,0)),0,OFFSET(R45C,MAX(-MNR,ROUND(DAYS360(ValDat,RC1,0)/30,0)-R8C+MEP-MNR),0,1,1))) -> 86 | P77: =IF(RC1="","",IF(OR(R8C<=ROUND(DAYS360(ValDat,RC1,0)/30,0),R8C>ROUND(DAYS360(ExpDat,RC1,0)/30,0)),0,OFFSET(R45C,MAX(-MNR,ROUND(DAYS360(ValDat,RC1,0)/30,0)-R8C+MEP-MNR),0,1,1))) -> 0 | Q77: =IF(RC1="","",IF(OR(R8C<=ROUND(DAYS360(ValDat,RC1,0)/30,0),R8C>ROUND(DAYS360(ExpDat,RC1,0)/30,0)),0,OFFSET(R45C,MAX(-MNR,ROUND(DAYS360(ValDat,RC1,0)/30,0)-R8C+MEP-MNR),0,1,1))) -> 0 | R77: =IF(RC1="","",IF(OR(R8C<=ROUND(DAYS360(ValDat,RC1,0)/30,0),R8C>ROUND(DAYS360(ExpDat,RC1,0)/30,0)),0,OFFSET(R45C,MAX(-MNR,ROUND(DAYS360(ValDat,RC1,0)/30,0)-R8C+MEP-MNR),0,1,1))) -> 0 | S77: =IF(RC1="","",IF(OR(R8C<=ROUND(DAYS360(ValDat,RC1,0)/30,0),R8C>ROUND(DAYS360(ExpDat,RC1,0)/30,0)),0,OFFSET(R45C,MAX(-MNR,ROUND(DAYS360(ValDat,RC1,0)/30,0)-R8C+MEP-MNR),0,1,1))) -> 0 | T77: =IF(RC1="","",IF(OR(R8C<=ROUND(DAYS360(ValDat,RC1,0)/30,0),R8C>ROUND(DAYS360(ExpDat,RC1,0)/30,0)),0,OFFSET(R45C,MAX(-MNR,ROUND(DAYS360(ValDat,RC1,0)/30,0)-R8C+MEP-MNR),0,1,1))) -> 0 | U77: =IF(RC1="","",IF(OR(R8C<=ROUND(DAYS360(ValDat,RC1,0)/30,0),R8C>ROUND(DAYS360(ExpDat,RC1,0)/30,0)),0,OFFSET(R45C,MAX(-MNR,ROUND(DAYS360(ValDat,RC1,0)/30,0)-R8C+MEP-MNR),0,1,1))) -> 0 | V77: =IF(RC1="","",IF(OR(R8C<=ROUND(DAYS360(ValDat,RC1,0)/30,0),R8C>ROUND(DAYS360(ExpDat,RC1,0)/30,0)),0,OFFSET(R45C,MAX(-MNR,ROUND(DAYS360(ValDat,RC1,0)/30,0)-R8C+MEP-MNR),0,1,1))) -> 0 | W77: =IF(RC1="","",IF(OR(R8C<=ROUND(DAYS360(ValDat,RC1,0)/30,0),R8C>ROUND(DAYS360(ExpDat,RC1,0)/30,0)),0,OFFSET(R45C,MAX(-MNR,ROUND(DAYS360(ValDat,RC1,0)/30,0)-R8C+MEP-MNR),0,1,1))) -> 0 | X77: =IF(RC1="","",IF(OR(R8C<=ROUND(DAYS360(ValDat,RC1,0)/30,0),R8C>ROUND(DAYS360(ExpDat,RC1,0)/30,0)),0,OFFSET(R45C,MAX(-MNR,ROUND(DAYS360(ValDat,RC1,0)/30,0)-R8C+MEP-MNR),0,1,1))) -> 0 | Y77: =IF(RC1="","",IF(OR(R8C<=ROUND(DAYS360(ValDat,RC1,0)/30,0),R8C>ROUND(DAYS360(ExpDat,RC1,0)/30,0)),0,OFFSET(R45C,MAX(-MNR,ROUND(DAYS360(ValDat,RC1,0)/30,0)-R8C+MEP-MNR),0,1,1))) -> 0 | Z77: =IF(RC1="","",IF(OR(R8C<=ROUND(DAYS360(ValDat,RC1,0)/30,0),R8C>ROUND(DAYS360(ExpDat,RC1,0)/30,0)),0,OFFSET(R45C,MAX(-MNR,ROUND(DAYS360(ValDat,RC1,0)/30,0)-R8C+MEP-MNR),0,1,1))) -> 0 | AA77: =IF(RC1="","",IF(OR(R8C<=ROUND(DAYS360(ValDat,RC1,0)/30,0),R8C>ROUND(DAYS360(ExpDat,RC1,0)/30,0)),0,OFFSET(R45C,MAX(-MNR,ROUND(DAYS360(ValDat,RC1,0)/30,0)-R8C+MEP-MNR),0,1,1))) -> 0 | AB77: =IF(RC1="","",IF(OR(R8C<=ROUND(DAYS360(ValDat,RC1,0)/30,0),R8C>ROUND(DAYS360(ExpDat,RC1,0)/30,0)),0,OFFSET(R45C,MAX(-MNR,ROUND(DAYS360(ValDat,RC1,0)/30,0)-R8C+MEP-MNR),0,1,1))) -> 0 | AC77: =IF(RC1="","",IF(OR(R8C<=ROUND(DAYS360(ValDat,RC1,0)/30,0),R8C>ROUND(DAYS360(ExpDat,RC1,0)/30,0)),0,OFFSET(R45C,MAX(-MNR,ROUND(DAYS360(ValDat,RC1,0)/30,0)-R8C+MEP-MNR),0,1,1))) -> 0 | AD77: =IF(RC1="","",IF(OR(R8C<=ROUND(DAYS360(ValDat,RC1,0)/30,0),R8C>ROUND(DAYS360(ExpDat,RC1,0)/30,0)),0,OFFSET(R45C,MAX(-MNR,ROUND(DAYS360(ValDat,RC1,0)/30,0)-R8C+MEP-MNR),0,1,1))) -> 0 | AE77: =IF(RC1="","",IF(OR(R8C<=ROUND(DAYS360(ValDat,RC1,0)/30,0),R8C>ROUND(DAYS360(ExpDat,RC1,0)/30,0)),0,OFFSET(R45C,MAX(-MNR,ROUND(DAYS360(ValDat,RC1,0)/30,0)-R8C+MEP-MNR),0,1,1))) -> 0 | AF77: =IF(RC1="","",IF(OR(R8C<=ROUND(DAYS360(ValDat,RC1,0)/30,0),R8C>ROUND(DAYS360(ExpDat,RC1,0)/30,0)),0,OFFSET(R45C,MAX(-MNR,ROUND(DAYS360(ValDat,RC1,0)/30,0)-R8C+MEP-MNR),0,1,1))) -> 0 | AG77: =IF(RC1="","",IF(OR(R8C<=ROUND(DAYS360(ValDat,RC1,0)/30,0),R8C>ROUND(DAYS360(ExpDat,RC1,0)/30,0)),0,OFFSET(R45C,MAX(-MNR,ROUND(DAYS360(ValDat,RC1,0)/30,0)-R8C+MEP-MNR),0,1,1))) -> 0 | AH77: =IF(RC1="","",IF(OR(R8C<=ROUND(DAYS360(ValDat,RC1,0)/30,0),R8C>ROUND(DAYS360(ExpDat,RC1,0)/30,0)),0,OFFSET(R45C,MAX(-MNR,ROUND(DAYS360(ValDat,RC1,0)/30,0)-R8C+MEP-MNR),0,1,1))) -> 0 | AI77: =IF(RC1="","",IF(OR(R8C<=ROUND(DAYS360(ValDat,RC1,0)/30,0),R8C>ROUND(DAYS360(ExpDat,RC1,0)/30,0)),0,OFFSET(R45C,MAX(-MNR,ROUND(DAYS360(ValDat,RC1,0)/30,0)-R8C+MEP-MNR),0,1,1))) -> 0 | AJ77: =IF(RC1="","",IF(OR(R8C<=ROUND(DAYS360(ValDat,RC1,0)/30,0),R8C>ROUND(DAYS360(ExpDat,RC1,0)/30,0)),0,OFFSET(R45C,MAX(-MNR,ROUND(DAYS360(ValDat,RC1,0)/30,0)-R8C+MEP-MNR),0,1,1))) -> 0 | AK77: =IF(RC1="","",IF(OR(R8C<=ROUND(DAYS360(ValDat,RC1,0)/30,0),R8C>ROUND(DAYS360(ExpDat,RC1,0)/30,0)),0,OFFSET(R45C,MAX(-MNR,ROUND(DAYS360(ValDat,RC1,0)/30,0)-R8C+MEP-MNR),0,1,1))) -> 0 | AL77: =IF(RC1="","",IF(OR(R8C<=ROUND(DAYS360(ValDat,RC1,0)/30,0),R8C>ROUND(DAYS360(ExpDat,RC1,0)/30,0)),0,OFFSET(R45C,MAX(-MNR,ROUND(DAYS360(ValDat,RC1,0)/30,0)-R8C+MEP-MNR),0,1,1))) -> 0 | AM77: =IF(RC1="","",IF(OR(R8C<=ROUND(DAYS360(ValDat,RC1,0)/30,0),R8C>ROUND(DAYS360(ExpDat,RC1,0)/30,0)),0,OFFSET(R45C,MAX(-MNR,ROUND(DAYS360(ValDat,RC1,0)/30,0)-R8C+MEP-MNR),0,1,1))) -> 0 | AN77: =IF(RC1="","",IF(OR(R8C<=ROUND(DAYS360(ValDat,RC1,0)/30,0),R8C>ROUND(DAYS360(ExpDat,RC1,0)/30,0)),0,OFFSET(R45C,MAX(-MNR,ROUND(DAYS360(ValDat,RC1,0)/30,0)-R8C+MEP-MNR),0,1,1))) -> 0 | AO77: =IF(RC1="","",IF(OR(R8C<=ROUND(DAYS360(ValDat,RC1,0)/30,0),R8C>ROUND(DAYS360(ExpDat,RC1,0)/30,0)),0,OFFSET(R45C,MAX(-MNR,ROUND(DAYS360(ValDat,RC1,0)/30,0)-R8C+MEP-MNR),0,1,1))) -> 0
A78: =IF(R[-1]C="","",IF(DATE(YEAR(R[-1]C),MONTH(R[-1]C)+1,1)>RunDat,"",DATE(YEAR(R[-1]C),MONTH(R[-1]C)+1,1))) -> 2000-04-01T00:00:00.000 | D78: =IF(RC1="","",SUM(RC[2]:RC[37])) -> 197783 | F78: =IF(RC1="","",IF(OR(R8C<=ROUND(DAYS360(ValDat,RC1,0)/30,0),R8C>ROUND(DAYS360(ExpDat,RC1,0)/30,0)),0,OFFSET(R45C,MAX(-MNR,ROUND(DAYS360(ValDat,RC1,0)/30,0)-R8C+MEP-MNR),0,1,1))) -> 10201 | G78: =IF(RC1="","",IF(OR(R8C<=ROUND(DAYS360(ValDat,RC1,0)/30,0),R8C>ROUND(DAYS360(ExpDat,RC1,0)/30,0)),0,OFFSET(R45C,MAX(-MNR,ROUND(DAYS360(ValDat,RC1,0)/30,0)-R8C+MEP-MNR),0,1,1))) -> 108795 | H78: =IF(RC1="","",IF(OR(R8C<=ROUND(DAYS360(ValDat,RC1,0)/30,0),R8C>ROUND(DAYS360(ExpDat,RC1,0)/30,0)),0,OFFSET(R45C,MAX(-MNR,ROUND(DAYS360(ValDat,RC1,0)/30,0)-R8C+MEP-MNR),0,1,1))) -> 64236 | I78: =IF(RC1="","",IF(OR(R8C<=ROUND(DAYS360(ValDat,RC1,0)/30,0),R8C>ROUND(DAYS360(ExpDat,RC1,0)/30,0)),0,OFFSET(R45C,MAX(-MNR,ROUND(DAYS360(ValDat,RC1,0)/30,0)-R8C+MEP-MNR),0,1,1))) -> 3681 | J78: =IF(RC1="","",IF(OR(R8C<=ROUND(DAYS360(ValDat,RC1,0)/30,0),R8C>ROUND(DAYS360(ExpDat,RC1,0)/30,0)),0,OFFSET(R45C,MAX(-MNR,ROUND(DAYS360(ValDat,RC1,0)/30,0)-R8C+MEP-MNR),0,1,1))) -> 5276 | K78: =IF(RC1="","",IF(OR(R8C<=ROUND(DAYS360(ValDat,RC1,0)/30,0),R8C>ROUND(DAYS360(ExpDat,RC1,0)/30,0)),0,OFFSET(R45C,MAX(-MNR,ROUND(DAYS360(ValDat,RC1,0)/30,0)-R8C+MEP-MNR),0,1,1))) -> 3977 | L78: =IF(RC1="","",IF(OR(R8C<=ROUND(DAYS360(ValDat,RC1,0)/30,0),R8C>ROUND(DAYS360(ExpDat,RC1,0)/30,0)),0,OFFSET(R45C,MAX(-MNR,ROUND(DAYS360(ValDat,RC1,0)/30,0)-R8C+MEP-MNR),0,1,1))) -> 990 | M78: =IF(RC1="","",IF(OR(R8C<=ROUND(DAYS360(ValDat,RC1,0)/30,0),R8C>ROUND(DAYS360(ExpDat,RC1,0)/30,0)),0,OFFSET(R45C,MAX(-MNR,ROUND(DAYS360(ValDat,RC1,0)/30,0)-R8C+MEP-MNR),0,1,1))) -> 553 | N78: =IF(RC1="","",IF(OR(R8C<=ROUND(DAYS360(ValDat,RC1,0)/30,0),R8C>ROUND(DAYS360(ExpDat,RC1,0)/30,0)),0,OFFSET(R45C,MAX(-MNR,ROUND(DAYS360(ValDat,RC1,0)/30,0)-R8C+MEP-MNR),0,1,1))) -> 61 | O78: =IF(RC1="","",IF(OR(R8C<=ROUND(DAYS360(ValDat,RC1,0)/30,0),R8C>ROUND(DAYS360(ExpDat,RC1,0)/30,0)),0,OFFSET(R45C,MAX(-MNR,ROUND(DAYS360(ValDat,RC1,0)/30,0)-R8C+MEP-MNR),0,1,1))) -> 13 | P78: =IF(RC1="","",IF(OR(R8C<=ROUND(DAYS360(ValDat,RC1,0)/30,0),R8C>ROUND(DAYS360(ExpDat,RC1,0)/30,0)),0,OFFSET(R45C,MAX(-MNR,ROUND(DAYS360(ValDat,RC1,0)/30,0)-R8C+MEP-MNR),0,1,1))) -> 0 | Q78: =IF(RC1="","",IF(OR(R8C<=ROUND(DAYS360(ValDat,RC1,0)/30,0),R8C>ROUND(DAYS360(ExpDat,RC1,0)/30,0)),0,OFFSET(R45C,MAX(-MNR,ROUND(DAYS360(ValDat,RC1,0)/30,0)-R8C+MEP-MNR),0,1,1))) -> 0 | R78: =IF(RC1="","",IF(OR(R8C<=ROUND(DAYS360(ValDat,RC1,0)/30,0),R8C>ROUND(DAYS360(ExpDat,RC1,0)/30,0)),0,OFFSET(R45C,MAX(-MNR,ROUND(DAYS360(ValDat,RC1,0)/30,0)-R8C+MEP-MNR),0,1,1))) -> 0 | S78: =IF(RC1="","",IF(OR(R8C<=ROUND(DAYS360(ValDat,RC1,0)/30,0),R8C>ROUND(DAYS360(ExpDat,RC1,0)/30,0)),0,OFFSET(R45C,MAX(-MNR,ROUND(DAYS360(ValDat,RC1,0)/30,0)-R8C+MEP-MNR),0,1,1))) -> 0 | T78: =IF(RC1="","",IF(OR(R8C<=ROUND(DAYS360(ValDat,RC1,0)/30,0),R8C>ROUND(DAYS360(ExpDat,RC1,0)/30,0)),0,OFFSET(R45C,MAX(-MNR,ROUND(DAYS360(ValDat,RC1,0)/30,0)-R8C+MEP-MNR),0,1,1))) -> 0 | U78: =IF(RC1="","",IF(OR(R8C<=ROUND(DAYS360(ValDat,RC1,0)/30,0),R8C>ROUND(DAYS360(ExpDat,RC1,0)/30,0)),0,OFFSET(R45C,MAX(-MNR,ROUND(DAYS360(ValDat,RC1,0)/30,0)-R8C+MEP-MNR),0,1,1))) -> 0 | V78: =IF(RC1="","",IF(OR(R8C<=ROUND(DAYS360(ValDat,RC1,0)/30,0),R8C>ROUND(DAYS360(ExpDat,RC1,0)/30,0)),0,OFFSET(R45C,MAX(-MNR,ROUND(DAYS360(ValDat,RC1,0)/30,0)-R8C+MEP-MNR),0,1,1))) -> 0 | W78: =IF(RC1="","",IF(OR(R8C<=ROUND(DAYS360(ValDat,RC1,0)/30,0),R8C>ROUND(DAYS360(ExpDat,RC1,0)/30,0)),0,OFFSET(R45C,MAX(-MNR,ROUND(DAYS360(ValDat,RC1,0)/30,0)-R8C+MEP-MNR),0,1,1))) -> 0 | X78: =IF(RC1="","",IF(OR(R8C<=ROUND(DAYS360(ValDat,RC1,0)/30,0),R8C>ROUND(DAYS360(ExpDat,RC1,0)/30,0)),0,OFFSET(R45C,MAX(-MNR,ROUND(DAYS360(ValDat,RC1,0)/30,0)-R8C+MEP-MNR),0,1,1))) -> 0 | Y78: =IF(RC1="","",IF(OR(R8C<=ROUND(DAYS360(ValDat,RC1,0)/30,0),R8C>ROUND(DAYS360(ExpDat,RC1,0)/30,0)),0,OFFSET(R45C,MAX(-MNR,ROUND(DAYS360(ValDat,RC1,0)/30,0)-R8C+MEP-MNR),0,1,1))) -> 0 | Z78: =IF(RC1="","",IF(OR(R8C<=ROUND(DAYS360(ValDat,RC1,0)/30,0),R8C>ROUND(DAYS360(ExpDat,RC1,0)/30,0)),0,OFFSET(R45C,MAX(-MNR,ROUND(DAYS360(ValDat,RC1,0)/30,0)-R8C+MEP-MNR),0,1,1))) -> 0 | AA78: =IF(RC1="","",IF(OR(R8C<=ROUND(DAYS360(ValDat,RC1,0)/30,0),R8C>ROUND(DAYS360(ExpDat,RC1,0)/30,0)),0,OFFSET(R45C,MAX(-MNR,ROUND(DAYS360(ValDat,RC1,0)/30,0)-R8C+MEP-MNR),0,1,1))) -> 0 | AB78: =IF(RC1="","",IF(OR(R8C<=ROUND(DAYS360(ValDat,RC1,0)/30,0),R8C>ROUND(DAYS360(ExpDat,RC1,0)/30,0)),0,OFFSET(R45C,MAX(-MNR,ROUND(DAYS360(ValDat,RC1,0)/30,0)-R8C+MEP-MNR),0,1,1))) -> 0 | AC78: =IF(RC1="","",IF(OR(R8C<=ROUND(DAYS360(ValDat,RC1,0)/30,0),R8C>ROUND(DAYS360(ExpDat,RC1,0)/30,0)),0,OFFSET(R45C,MAX(-MNR,ROUND(DAYS360(ValDat,RC1,0)/30,0)-R8C+MEP-MNR),0,1,1))) -> 0 | AD78: =IF(RC1="","",IF(OR(R8C<=ROUND(DAYS360(ValDat,RC1,0)/30,0),R8C>ROUND(DAYS360(ExpDat,RC1,0)/30,0)),0,OFFSET(R45C,MAX(-MNR,ROUND(DAYS360(ValDat,RC1,0)/30,0)-R8C+MEP-MNR),0,1,1))) -> 0 | AE78: =IF(RC1="","",IF(OR(R8C<=ROUND(DAYS360(ValDat,RC1,0)/30,0),R8C>ROUND(DAYS360(ExpDat,RC1,0)/30,0)),0,OFFSET(R45C,MAX(-MNR,ROUND(DAYS360(ValDat,RC1,0)/30,0)-R8C+MEP-MNR),0,1,1))) -> 0 | AF78: =IF(RC1="","",IF(OR(R8C<=ROUND(DAYS360(ValDat,RC1,0)/30,0),R8C>ROUND(DAYS360(ExpDat,RC1,0)/30,0)),0,OFFSET(R45C,MAX(-MNR,ROUND(DAYS360(ValDat,RC1,0)/30,0)-R8C+MEP-MNR),0,1,1))) -> 0 | AG78: =IF(RC1="","",IF(OR(R8C<=ROUND(DAYS360(ValDat,RC1,0)/30,0),R8C>ROUND(DAYS360(ExpDat,RC1,0)/30,0)),0,OFFSET(R45C,MAX(-MNR,ROUND(DAYS360(ValDat,RC1,0)/30,0)-R8C+MEP-MNR),0,1,1))) -> 0 | AH78: =IF(RC1="","",IF(OR(R8C<=ROUND(DAYS360(ValDat,RC1,0)/30,0),R8C>ROUND(DAYS360(ExpDat,RC1,0)/30,0)),0,OFFSET(R45C,MAX(-MNR,ROUND(DAYS360(ValDat,RC1,0)/30,0)-R8C+MEP-MNR),0,1,1))) -> 0 | AI78: =IF(RC1="","",IF(OR(R8C<=ROUND(DAYS360(ValDat,RC1,0)/30,0),R8C>ROUND(DAYS360(ExpDat,RC1,0)/30,0)),0,OFFSET(R45C,MAX(-MNR,ROUND(DAYS360(ValDat,RC1,0)/30,0)-R8C+MEP-MNR),0,1,1))) -> 0 | AJ78: =IF(RC1="","",IF(OR(R8C<=ROUND(DAYS360(ValDat,RC1,0)/30,0),R8C>ROUND(DAYS360(ExpDat,RC1,0)/30,0)),0,OFFSET(R45C,MAX(-MNR,ROUND(DAYS360(ValDat,RC1,0)/30,0)-R8C+MEP-MNR),0,1,1))) -> 0 | AK78: =IF(RC1="","",IF(OR(R8C<=ROUND(DAYS360(ValDat,RC1,0)/30,0),R8C>ROUND(DAYS360(ExpDat,RC1,0)/30,0)),0,OFFSET(R45C,MAX(-MNR,ROUND(DAYS360(ValDat,RC1,0)/30,0)-R8C+MEP-MNR),0,1,1))) -> 0 | AL78: =IF(RC1="","",IF(OR(R8C<=ROUND(DAYS360(ValDat,RC1,0)/30,0),R8C>ROUND(DAYS360(ExpDat,RC1,0)/30,0)),0,OFFSET(R45C,MAX(-MNR,ROUND(DAYS360(ValDat,RC1,0)/30,0)-R8C+MEP-MNR),0,1,1))) -> 0 | AM78: =IF(RC1="","",IF(OR(R8C<=ROUND(DAYS360(ValDat,RC1,0)/30,0),R8C>ROUND(DAYS360(ExpDat,RC1,0)/30,0)),0,OFFSET(R45C,MAX(-MNR,ROUND(DAYS360(ValDat,RC1,0)/30,0)-R8C+MEP-MNR),0,1,1))) -> 0 | AN78: =IF(RC1="","",IF(OR(R8C<=ROUND(DAYS360(ValDat,RC1,0)/30,0),R8C>ROUND(DAYS360(ExpDat,RC1,0)/30,0)),0,OFFSET(R45C,MAX(-MNR,ROUND(DAYS360(ValDat,RC1,0)/30,0)-R8C+MEP-MNR),0,1,1))) -> 0 | AO78: =IF(RC1="","",IF(OR(R8C<=ROUND(DAYS360(ValDat,RC1,0)/30,0),R8C>ROUND(DAYS360(ExpDat,RC1,0)/30,0)),0,OFFSET(R45C,MAX(-MNR,ROUND(DAYS360(ValDat,RC1,0)/30,0)-R8C+MEP-MNR),0,1,1))) -> 0
A79: =IF(R[-1]C="","",IF(DATE(YEAR(R[-1]C),MONTH(R[-1]C)+1,1)>RunDat,"",DATE(YEAR(R[-1]C),MONTH(R[-1]C)+1,1))) -> 2000-05-01T00:00:00.000 | D79: =IF(RC1="","",SUM(RC[2]:RC[37])) -> 212998 | F79: =IF(RC1="","",IF(OR(R8C<=ROUND(DAYS360(ValDat,RC1,0)/30,0),R8C>ROUND(DAYS360(ExpDat,RC1,0)/30,0)),0,OFFSET(R45C,MAX(-MNR,ROUND(DAYS360(ValDat,RC1,0)/30,0)-R8C+MEP-MNR),0,1,1))) -> 80043 | G79: =IF(RC1="","",IF(OR(R8C<=ROUND(DAYS360(ValDat,RC1,0)/30,0),R8C>ROUND(DAYS360(ExpDat,RC1,0)/30,0)),0,OFFSET(R45C,MAX(-MNR,ROUND(DAYS360(ValDat,RC1,0)/30,0)-R8C+MEP-MNR),0,1,1))) -> 90658 | H79: =IF(RC1="","",IF(OR(R8C<=ROUND(DAYS360(ValDat,RC1,0)/30,0),R8C>ROUND(DAYS360(ExpDat,RC1,0)/30,0)),0,OFFSET(R45C,MAX(-MNR,ROUND(DAYS360(ValDat,RC1,0)/30,0)-R8C+MEP-MNR),0,1,1))) -> 22323 | I79: =IF(RC1="","",IF(OR(R8C<=ROUND(DAYS360(ValDat,RC1,0)/30,0),R8C>ROUND(DAYS360(ExpDat,RC1,0)/30,0)),0,OFFSET(R45C,MAX(-MNR,ROUND(DAYS360(ValDat,RC1,0)/30,0)-R8C+MEP-MNR),0,1,1))) -> 12899 | J79: =IF(RC1="","",IF(OR(R8C<=ROUND(DAYS360(ValDat,RC1,0)/30,0),R8C>ROUND(DAYS360(ExpDat,RC1,0)/30,0)),0,OFFSET(R45C,MAX(-MNR,ROUND(DAYS360(ValDat,RC1,0)/30,0)-R8C+MEP-MNR),0,1,1))) -> 2985 | K79: =IF(RC1="","",IF(OR(R8C<=ROUND(DAYS360(ValDat,RC1,0)/30,0),R8C>ROUND(DAYS360(ExpDat,RC1,0)/30,0)),0,OFFSET(R45C,MAX(-MNR,ROUND(DAYS360(ValDat,RC1,0)/30,0)-R8C+MEP-MNR),0,1,1))) -> 1752 | L79: =IF(RC1="","",IF(OR(R8C<=ROUND(DAYS360(ValDat,RC1,0)/30,0),R8C>ROUND(DAYS360(ExpDat,RC1,0)/30,0)),0,OFFSET(R45C,MAX(-MNR,ROUND(DAYS360(ValDat,RC1,0)/30,0)-R8C+MEP-MNR),0,1,1))) -> 323 | M79: =IF(RC1="","",IF(OR(R8C<=ROUND(DAYS360(ValDat,RC1,0)/30,0),R8C>ROUND(DAYS360(ExpDat,RC1,0)/30,0)),0,OFFSET(R45C,MAX(-MNR,ROUND(DAYS360(ValDat,RC1,0)/30,0)-R8C+MEP-MNR),0,1,1))) -> 1455 | N79: =IF(RC1="","",IF(OR(R8C<=ROUND(DAYS360(ValDat,RC1,0)/30,0),R8C>ROUND(DAYS360(ExpDat,RC1,0)/30,0)),0,OFFSET(R45C,MAX(-MNR,ROUND(DAYS360(ValDat,RC1,0)/30,0)-R8C+MEP-MNR),0,1,1))) -> 20 | O79: =IF(RC1="","",IF(OR(R8C<=ROUND(DAYS360(ValDat,RC1,0)/30,0),R8C>ROUND(DAYS360(ExpDat,RC1,0)/30,0)),0,OFFSET(R45C,MAX(-MNR,ROUND(DAYS360(ValDat,RC1,0)/30,0)-R8C+MEP-MNR),0,1,1))) -> -300 | P79: =IF(RC1="","",IF(OR(R8C<=ROUND(DAYS360(ValDat,RC1,0)/30,0),R8C>ROUND(DAYS360(ExpDat,RC1,0)/30,0)),0,OFFSET(R45C,MAX(-MNR,ROUND(DAYS360(ValDat,RC1,0)/30,0)-R8C+MEP-MNR),0,1,1))) -> 420 | Q79: =IF(RC1="","",IF(OR(R8C<=ROUND(DAYS360(ValDat,RC1,0)/30,0),R8C>ROUND(DAYS360(ExpDat,RC1,0)/30,0)),0,OFFSET(R45C,MAX(-MNR,ROUND(DAYS360(ValDat,RC1,0)/30,0)-R8C+MEP-MNR),0,1,1))) -> 420 | R79: =IF(RC1="","",IF(OR(R8C<=ROUND(DAYS360(ValDat,RC1,0)/30,0),R8C>ROUND(DAYS360(ExpDat,RC1,0)/30,0)),0,OFFSET(R45C,MAX(-MNR,ROUND(DAYS360(ValDat,RC1,0)/30,0)-R8C+MEP-MNR),0,1,1))) -> 0 | S79: =IF(RC1="","",IF(OR(R8C<=ROUND(DAYS360(ValDat,RC1,0)/30,0),R8C>ROUND(DAYS360(ExpDat,RC1,0)/30,0)),0,OFFSET(R45C,MAX(-MNR,ROUND(DAYS360(ValDat,RC1,0)/30,0)-R8C+MEP-MNR),0,1,1))) -> 0 | T79: =IF(RC1="","",IF(OR(R8C<=ROUND(DAYS360(ValDat,RC1,0)/30,0),R8C>ROUND(DAYS360(ExpDat,RC1,0)/30,0)),0,OFFSET(R45C,MAX(-MNR,ROUND(DAYS360(ValDat,RC1,0)/30,0)-R8C+MEP-MNR),0,1,1))) -> 0 | U79: =IF(RC1="","",IF(OR(R8C<=ROUND(DAYS360(ValDat,RC1,0)/30,0),R8C>ROUND(DAYS360(ExpDat,RC1,0)/30,0)),0,OFFSET(R45C,MAX(-MNR,ROUND(DAYS360(ValDat,RC1,0)/30,0)-R8C+MEP-MNR),0,1,1))) -> 0 | V79: =IF(RC1="","",IF(OR(R8C<=ROUND(DAYS360(ValDat,RC1,0)/30,0),R8C>ROUND(DAYS360(ExpDat,RC1,0)/30,0)),0,OFFSET(R45C,MAX(-MNR,ROUND(DAYS360(ValDat,RC1,0)/30,0)-R8C+MEP-MNR),0,1,1))) -> 0 | W79: =IF(RC1="","",IF(OR(R8C<=ROUND(DAYS360(ValDat,RC1,0)/30,0),R8C>ROUND(DAYS360(ExpDat,RC1,0)/30,0)),0,OFFSET(R45C,MAX(-MNR,ROUND(DAYS360(ValDat,RC1,0)/30,0)-R8C+MEP-MNR),0,1,1))) -> 0 | X79: =IF(RC1="","",IF(OR(R8C<=ROUND(DAYS360(ValDat,RC1,0)/30,0),R8C>ROUND(DAYS360(ExpDat,RC1,0)/30,0)),0,OFFSET(R45C,MAX(-MNR,ROUND(DAYS360(ValDat,RC1,0)/30,0)-R8C+MEP-MNR),0,1,1))) -> 0 | Y79: =IF(RC1="","",IF(OR(R8C<=ROUND(DAYS360(ValDat,RC1,0)/30,0),R8C>ROUND(DAYS360(ExpDat,RC1,0)/30,0)),0,OFFSET(R45C,MAX(-MNR,ROUND(DAYS360(ValDat,RC1,0)/30,0)-R8C+MEP-MNR),0,1,1))) -> 0 | Z79: =IF(RC1="","",IF(OR(R8C<=ROUND(DAYS360(ValDat,RC1,0)/30,0),R8C>ROUND(DAYS360(ExpDat,RC1,0)/30,0)),0,OFFSET(R45C,MAX(-MNR,ROUND(DAYS360(ValDat,RC1,0)/30,0)-R8C+MEP-MNR),0,1,1))) -> 0 | AA79: =IF(RC1="","",IF(OR(R8C<=ROUND(DAYS360(ValDat,RC1,0)/30,0),R8C>ROUND(DAYS360(ExpDat,RC1,0)/30,0)),0,OFFSET(R45C,MAX(-MNR,ROUND(DAYS360(ValDat,RC1,0)/30,0)-R8C+MEP-MNR),0,1,1))) -> 0 | AB79: =IF(RC1="","",IF(OR(R8C<=ROUND(DAYS360(ValDat,RC1,0)/30,0),R8C>ROUND(DAYS360(ExpDat,RC1,0)/30,0)),0,OFFSET(R45C,MAX(-MNR,ROUND(DAYS360(ValDat,RC1,0)/30,0)-R8C+MEP-MNR),0,1,1))) -> 0 | AC79: =IF(RC1="","",IF(OR(R8C<=ROUND(DAYS360(ValDat,RC1,0)/30,0),R8C>ROUND(DAYS360(ExpDat,RC1,0)/30,0)),0,OFFSET(R45C,MAX(-MNR,ROUND(DAYS360(ValDat,RC1,0)/30,0)-R8C+MEP-MNR),0,1,1))) -> 0 | AD79: =IF(RC1="","",IF(OR(R8C<=ROUND(DAYS360(ValDat,RC1,0)/30,0),R8C>ROUND(DAYS360(ExpDat,RC1,0)/30,0)),0,OFFSET(R45C,MAX(-MNR,ROUND(DAYS360(ValDat,RC1,0)/30,0)-R8C+MEP-MNR),0,1,1))) -> 0 | AE79: =IF(RC1="","",IF(OR(R8C<=ROUND(DAYS360(ValDat,RC1,0)/30,0),R8C>ROUND(DAYS360(ExpDat,RC1,0)/30,0)),0,OFFSET(R45C,MAX(-MNR,ROUND(DAYS360(ValDat,RC1,0)/30,0)-R8C+MEP-MNR),0,1,1))) -> 0 | AF79: =IF(RC1="","",IF(OR(R8C<=ROUND(DAYS360(ValDat,RC1,0)/30,0),R8C>ROUND(DAYS360(ExpDat,RC1,0)/30,0)),0,OFFSET(R45C,MAX(-MNR,ROUND(DAYS360(ValDat,RC1,0)/30,0)-R8C+MEP-MNR),0,1,1))) -> 0 | AG79: =IF(RC1="","",IF(OR(R8C<=ROUND(DAYS360(ValDat,RC1,0)/30,0),R8C>ROUND(DAYS360(ExpDat,RC1,0)/30,0)),0,OFFSET(R45C,MAX(-MNR,ROUND(DAYS360(ValDat,RC1,0)/30,0)-R8C+MEP-MNR),0,1,1))) -> 0 | AH79: =IF(RC1="","",IF(OR(R8C<=ROUND(DAYS360(ValDat,RC1,0)/30,0),R8C>ROUND(DAYS360(ExpDat,RC1,0)/30,0)),0,OFFSET(R45C,MAX(-MNR,ROUND(DAYS360(ValDat,RC1,0)/30,0)-R8C+MEP-MNR),0,1,1))) -> 0 | AI79: =IF(RC1="","",IF(OR(R8C<=ROUND(DAYS360(ValDat,RC1,0)/30,0),R8C>ROUND(DAYS360(ExpDat,RC1,0)/30,0)),0,OFFSET(R45C,MAX(-MNR,ROUND(DAYS360(ValDat,RC1,0)/30,0)-R8C+MEP-MNR),0,1,1))) -> 0 | AJ79: =IF(RC1="","",IF(OR(R8C<=ROUND(DAYS360(ValDat,RC1,0)/30,0),R8C>ROUND(DAYS360(ExpDat,RC1,0)/30,0)),0,OFFSET(R45C,MAX(-MNR,ROUND(DAYS360(ValDat,RC1,0)/30,0)-R8C+MEP-MNR),0,1,1))) -> 0 | AK79: =IF(RC1="","",IF(OR(R8C<=ROUND(DAYS360(ValDat,RC1,0)/30,0),R8C>ROUND(DAYS360(ExpDat,RC1,0)/30,0)),0,OFFSET(R45C,MAX(-MNR,ROUND(DAYS360(ValDat,RC1,0)/30,0)-R8C+MEP-MNR),0,1,1))) -> 0 | AL79: =IF(RC1="","",IF(OR(R8C<=ROUND(DAYS360(ValDat,RC1,0)/30,0),R8C>ROUND(DAYS360(ExpDat,RC1,0)/30,0)),0,OFFSET(R45C,MAX(-MNR,ROUND(DAYS360(ValDat,RC1,0)/30,0)-R8C+MEP-MNR),0,1,1))) -> 0 | AM79: =IF(RC1="","",IF(OR(R8C<=ROUND(DAYS360(ValDat,RC1,0)/30,0),R8C>ROUND(DAYS360(ExpDat,RC1,0)/30,0)),0,OFFSET(R45C,MAX(-MNR,ROUND(DAYS360(ValDat,RC1,0)/30,0)-R8C+MEP-MNR),0,1,1))) -> 0 | AN79: =IF(RC1="","",IF(OR(R8C<=ROUND(DAYS360(ValDat,RC1,0)/30,0),R8C>ROUND(DAYS360(ExpDat,RC1,0)/30,0)),0,OFFSET(R45C,MAX(-MNR,ROUND(DAYS360(ValDat,RC1,0)/30,0)-R8C+MEP-MNR),0,1,1))) -> 0 | AO79: =IF(RC1="","",IF(OR(R8C<=ROUND(DAYS360(ValDat,RC1,0)/30,0),R8C>ROUND(DAYS360(ExpDat,RC1,0)/30,0)),0,OFFSET(R45C,MAX(-MNR,ROUND(DAYS360(ValDat,RC1,0)/30,0)-R8C+MEP-MNR),0,1,1))) -> 0
A80: =IF(R[-1]C="","",IF(DATE(YEAR(R[-1]C),MONTH(R[-1]C)+1,1)>RunDat,"",DATE(YEAR(R[-1]C),MONTH(R[-1]C)+1,1))) -> 2000-06-01T00:00:00.000 | D80: =IF(RC1="","",SUM(RC[2]:RC[37])) -> 112659 | F80: =IF(RC1="","",IF(OR(R8C<=ROUND(DAYS360(ValDat,RC1,0)/30,0),R8C>ROUND(DAYS360(ExpDat,RC1,0)/30,0)),0,OFFSET(R45C,MAX(-MNR,ROUND(DAYS360(ValDat,RC1,0)/30,0)-R8C+MEP-MNR),0,1,1))) -> 4501 | G80: =IF(RC1="","",IF(OR(R8C<=ROUND(DAYS360(ValDat,RC1,0)/30,0),R8C>ROUND(DAYS360(ExpDat,RC1,0)/30,0)),0,OFFSET(R45C,MAX(-MNR,ROUND(DAYS360(ValDat,RC1,0)/30,0)-R8C+MEP-MNR),0,1,1))) -> 39941 | H80: =IF(RC1="","",IF(OR(R8C<=ROUND(DAYS360(ValDat,RC1,0)/30,0),R8C>ROUND(DAYS360(ExpDat,RC1,0)/30,0)),0,OFFSET(R45C,MAX(-MNR,ROUND(DAYS360(ValDat,RC1,0)/30,0)-R8C+MEP-MNR),0,1,1))) -> 24213 | I80: =IF(RC1="","",IF(OR(R8C<=ROUND(DAYS360(ValDat,RC1,0)/30,0),R8C>ROUND(DAYS360(ExpDat,RC1,0)/30,0)),0,OFFSET(R45C,MAX(-MNR,ROUND(DAYS360(ValDat,RC1,0)/30,0)-R8C+MEP-MNR),0,1,1))) -> 1146 | J80: =IF(RC1="","",IF(OR(R8C<=ROUND(DAYS360(ValDat,RC1,0)/30,0),R8C>ROUND(DAYS360(ExpDat,RC1,0)/30,0)),0,OFFSET(R45C,MAX(-MNR,ROUND(DAYS360(ValDat,RC1,0)/30,0)-R8C+MEP-MNR),0,1,1))) -> 29961 | K80: =IF(RC1="","",IF(OR(R8C<=ROUND(DAYS360(ValDat,RC1,0)/30,0),R8C>ROUND(DAYS360(ExpDat,RC1,0)/30,0)),0,OFFSET(R45C,MAX(-MNR,ROUND(DAYS360(ValDat,RC1,0)/30,0)-R8C+MEP-MNR),0,1,1))) -> 1328 | L80: =IF(RC1="","",IF(OR(R8C<=ROUND(DAYS360(ValDat,RC1,0)/30,0),R8C>ROUND(DAYS360(ExpDat,RC1,0)/30,0)),0,OFFSET(R45C,MAX(-MNR,ROUND(DAYS360(ValDat,RC1,0)/30,0)-R8C+MEP-MNR),0,1,1))) -> 9245 | M80: =IF(RC1="","",IF(OR(R8C<=ROUND(DAYS360(ValDat,RC1,0)/30,0),R8C>ROUND(DAYS360(ExpDat,RC1,0)/30,0)),0,OFFSET(R45C,MAX(-MNR,ROUND(DAYS360(ValDat,RC1,0)/30,0)-R8C+MEP-MNR),0,1,1))) -> 1412 | N80: =IF(RC1="","",IF(OR(R8C<=ROUND(DAYS360(ValDat,RC1,0)/30,0),R8C>ROUND(DAYS360(ExpDat,RC1,0)/30,0)),0,OFFSET(R45C,MAX(-MNR,ROUND(DAYS360(ValDat,RC1,0)/30,0)-R8C+MEP-MNR),0,1,1))) -> 1212 | O80: =IF(RC1="","",IF(OR(R8C<=ROUND(DAYS360(ValDat,RC1,0)/30,0),R8C>ROUND(DAYS360(ExpDat,RC1,0)/30,0)),0,OFFSET(R45C,MAX(-MNR,ROUND(DAYS360(ValDat,RC1,0)/30,0)-R8C+MEP-MNR),0,1,1))) -> -300 | P80: =IF(RC1="","",IF(OR(R8C<=ROUND(DAYS360(ValDat,RC1,0)/30,0),R8C>ROUND(DAYS360(ExpDat,RC1,0)/30,0)),0,OFFSET(R45C,MAX(-MNR,ROUND(DAYS360(ValDat,RC1,0)/30,0)-R8C+MEP-MNR),0,1,1))) -> 0 | Q80: =IF(RC1="","",IF(OR(R8C<=ROUND(DAYS360(ValDat,RC1,0)/30,0),R8C>ROUND(DAYS360(ExpDat,RC1,0)/30,0)),0,OFFSET(R45C,MAX(-MNR,ROUND(DAYS360(ValDat,RC1,0)/30,0)-R8C+MEP-MNR),0,1,1))) -> 0 | R80: =IF(RC1="","",IF(OR(R8C<=ROUND(DAYS360(ValDat,RC1,0)/30,0),R8C>ROUND(DAYS360(ExpDat,RC1,0)/30,0)),0,OFFSET(R45C,MAX(-MNR,ROUND(DAYS360(ValDat,RC1,0)/30,0)-R8C+MEP-MNR),0,1,1))) -> 0 | S80: =IF(RC1="","",IF(OR(R8C<=ROUND(DAYS360(ValDat,RC1,0)/30,0),R8C>ROUND(DAYS360(ExpDat,RC1,0)/30,0)),0,OFFSET(R45C,MAX(-MNR,ROUND(DAYS360(ValDat,RC1,0)/30,0)-R8C+MEP-MNR),0,1,1))) -> 0 | T80: =IF(RC1="","",IF(OR(R8C<=ROUND(DAYS360(ValDat,RC1,0)/30,0),R8C>ROUND(DAYS360(ExpDat,RC1,0)/30,0)),0,OFFSET(R45C,MAX(-MNR,ROUND(DAYS360(ValDat,RC1,0)/30,0)-R8C+MEP-MNR),0,1,1))) -> 0 | U80: =IF(RC1="","",IF(OR(R8C<=ROUND(DAYS360(ValDat,RC1,0)/30,0),R8C>ROUND(DAYS360(ExpDat,RC1,0)/30,0)),0,OFFSET(R45C,MAX(-MNR,ROUND(DAYS360(ValDat,RC1,0)/30,0)-R8C+MEP-MNR),0,1,1))) -> 0 | V80: =IF(RC1="","",IF(OR(R8C<=ROUND(DAYS360(ValDat,RC1,0)/30,0),R8C>ROUND(DAYS360(ExpDat,RC1,0)/30,0)),0,OFFSET(R45C,MAX(-MNR,ROUND(DAYS360(ValDat,RC1,0)/30,0)-R8C+MEP-MNR),0,1,1))) -> 0 | W80: =IF(RC1="","",IF(OR(R8C<=ROUND(DAYS360(ValDat,RC1,0)/30,0),R8C>ROUND(DAYS360(ExpDat,RC1,0)/30,0)),0,OFFSET(R45C,MAX(-MNR,ROUND(DAYS360(ValDat,RC1,0)/30,0)-R8C+MEP-MNR),0,1,1))) -> 0 | X80: =IF(RC1="","",IF(OR(R8C<=ROUND(DAYS360(ValDat,RC1,0)/30,0),R8C>ROUND(DAYS360(ExpDat,RC1,0)/30,0)),0,OFFSET(R45C,MAX(-MNR,ROUND(DAYS360(ValDat,RC1,0)/30,0)-R8C+MEP-MNR),0,1,1))) -> 0 | Y80: =IF(RC1="","",IF(OR(R8C<=ROUND(DAYS360(ValDat,RC1,0)/30,0),R8C>ROUND(DAYS360(ExpDat,RC1,0)/30,0)),0,OFFSET(R45C,MAX(-MNR,ROUND(DAYS360(ValDat,RC1,0)/30,0)-R8C+MEP-MNR),0,1,1))) -> 0 | Z80: =IF(RC1="","",IF(OR(R8C<=ROUND(DAYS360(ValDat,RC1,0)/30,0),R8C>ROUND(DAYS360(ExpDat,RC1,0)/30,0)),0,OFFSET(R45C,MAX(-MNR,ROUND(DAYS360(ValDat,RC1,0)/30,0)-R8C+MEP-MNR),0,1,1))) -> 0 | AA80: =IF(RC1="","",IF(OR(R8C<=ROUND(DAYS360(ValDat,RC1,0)/30,0),R8C>ROUND(DAYS360(ExpDat,RC1,0)/30,0)),0,OFFSET(R45C,MAX(-MNR,ROUND(DAYS360(ValDat,RC1,0)/30,0)-R8C+MEP-MNR),0,1,1))) -> 0 | AB80: =IF(RC1="","",IF(OR(R8C<=ROUND(DAYS360(ValDat,RC1,0)/30,0),R8C>ROUND(DAYS360(ExpDat,RC1,0)/30,0)),0,OFFSET(R45C,MAX(-MNR,ROUND(DAYS360(ValDat,RC1,0)/30,0)-R8C+MEP-MNR),0,1,1))) -> 0 | AC80: =IF(RC1="","",IF(OR(R8C<=ROUND(DAYS360(ValDat,RC1,0)/30,0),R8C>ROUND(DAYS360(ExpDat,RC1,0)/30,0)),0,OFFSET(R45C,MAX(-MNR,ROUND(DAYS360(ValDat,RC1,0)/30,0)-R8C+MEP-MNR),0,1,1))) -> 0 | AD80: =IF(RC1="","",IF(OR(R8C<=ROUND(DAYS360(ValDat,RC1,0)/30,0),R8C>ROUND(DAYS360(ExpDat,RC1,0)/30,0)),0,OFFSET(R45C,MAX(-MNR,ROUND(DAYS360(ValDat,RC1,0)/30,0)-R8C+MEP-MNR),0,1,1))) -> 0 | AE80: =IF(RC1="","",IF(OR(R8C<=ROUND(DAYS360(ValDat,RC1,0)/30,0),R8C>ROUND(DAYS360(ExpDat,RC1,0)/30,0)),0,OFFSET(R45C,MAX(-MNR,ROUND(DAYS360(ValDat,RC1,0)/30,0)-R8C+MEP-MNR),0,1,1))) -> 0 | AF80: =IF(RC1="","",IF(OR(R8C<=ROUND(DAYS360(ValDat,RC1,0)/30,0),R8C>ROUND(DAYS360(ExpDat,RC1,0)/30,0)),0,OFFSET(R45C,MAX(-MNR,ROUND(DAYS360(ValDat,RC1,0)/30,0)-R8C+MEP-MNR),0,1,1))) -> 0 | AG80: =IF(RC1="","",IF(OR(R8C<=ROUND(DAYS360(ValDat,RC1,0)/30,0),R8C>ROUND(DAYS360(ExpDat,RC1,0)/30,0)),0,OFFSET(R45C,MAX(-MNR,ROUND(DAYS360(ValDat,RC1,0)/30,0)-R8C+MEP-MNR),0,1,1))) -> 0 | AH80: =IF(RC1="","",IF(OR(R8C<=ROUND(DAYS360(ValDat,RC1,0)/30,0),R8C>ROUND(DAYS360(ExpDat,RC1,0)/30,0)),0,OFFSET(R45C,MAX(-MNR,ROUND(DAYS360(ValDat,RC1,0)/30,0)-R8C+MEP-MNR),0,1,1))) -> 0 | AI80: =IF(RC1="","",IF(OR(R8C<=ROUND(DAYS360(ValDat,RC1,0)/30,0),R8C>ROUND(DAYS360(ExpDat,RC1,0)/30,0)),0,OFFSET(R45C,MAX(-MNR,ROUND(DAYS360(ValDat,RC1,0)/30,0)-R8C+MEP-MNR),0,1,1))) -> 0 | AJ80: =IF(RC1="","",IF(OR(R8C<=ROUND(DAYS360(ValDat,RC1,0)/30,0),R8C>ROUND(DAYS360(ExpDat,RC1,0)/30,0)),0,OFFSET(R45C,MAX(-MNR,ROUND(DAYS360(ValDat,RC1,0)/30,0)-R8C+MEP-MNR),0,1,1))) -> 0 | AK80: =IF(RC1="","",IF(OR(R8C<=ROUND(DAYS360(ValDat,RC1,0)/30,0),R8C>ROUND(DAYS360(ExpDat,RC1,0)/30,0)),0,OFFSET(R45C,MAX(-MNR,ROUND(DAYS360(ValDat,RC1,0)/30,0)-R8C+MEP-MNR),0,1,1))) -> 0 | AL80: =IF(RC1="","",IF(OR(R8C<=ROUND(DAYS360(ValDat,RC1,0)/30,0),R8C>ROUND(DAYS360(ExpDat,RC1,0)/30,0)),0,OFFSET(R45C,MAX(-MNR,ROUND(DAYS360(ValDat,RC1,0)/30,0)-R8C+MEP-MNR),0,1,1))) -> 0 | AM80: =IF(RC1="","",IF(OR(R8C<=ROUND(DAYS360(ValDat,RC1,0)/30,0),R8C>ROUND(DAYS360(ExpDat,RC1,0)/30,0)),0,OFFSET(R45C,MAX(-MNR,ROUND(DAYS360(ValDat,RC1,0)/30,0)-R8C+MEP-MNR),0,1,1))) -> 0 | AN80: =IF(RC1="","",IF(OR(R8C<=ROUND(DAYS360(ValDat,RC1,0)/30,0),R8C>ROUND(DAYS360(ExpDat,RC1,0)/30,0)),0,OFFSET(R45C,MAX(-MNR,ROUND(DAYS360(ValDat,RC1,0)/30,0)-R8C+MEP-MNR),0,1,1))) -> 0 | AO80: =IF(RC1="","",IF(OR(R8C<=ROUND(DAYS360(ValDat,RC1,0)/30,0),R8C>ROUND(DAYS360(ExpDat,RC1,0)/30,0)),0,OFFSET(R45C,MAX(-MNR,ROUND(DAYS360(ValDat,RC1,0)/30,0)-R8C+MEP-MNR),0,1,1))) -> 0
A81: =IF(R[-1]C="","",IF(DATE(YEAR(R[-1]C),MONTH(R[-1]C)+1,1)>RunDat,"",DATE(YEAR(R[-1]C),MONTH(R[-1]C)+1,1))) -> 2000-07-01T00:00:00.000 | D81: =IF(RC1="","",SUM(RC[2]:RC[37])) -> 170542 | F81: =IF(RC1="","",IF(OR(R8C<=ROUND(DAYS360(ValDat,RC1,0)/30,0),R8C>ROUND(DAYS360(ExpDat,RC1,0)/30,0)),0,OFFSET(R45C,MAX(-MNR,ROUND(DAYS360(ValDat,RC1,0)/30,0)-R8C+MEP-MNR),0,1,1))) -> 45495 | G81: =IF(RC1="","",IF(OR(R8C<=ROUND(DAYS360(ValDat,RC1,0)/30,0),R8C>ROUND(DAYS360(ExpDat,RC1,0)/30,0)),0,OFFSET(R45C,MAX(-MNR,ROUND(DAYS360(ValDat,RC1,0)/30,0)-R8C+MEP-MNR),0,1,1))) -> 74638 | H81: =IF(RC1="","",IF(OR(R8C<=ROUND(DAYS360(ValDat,RC1,0)/30,0),R8C>ROUND(DAYS360(ExpDat,RC1,0)/30,0)),0,OFFSET(R45C,MAX(-MNR,ROUND(DAYS360(ValDat,RC1,0)/30,0)-R8C+MEP-MNR),0,1,1))) -> 10905 | I81: =IF(RC1="","",IF(OR(R8C<=ROUND(DAYS360(ValDat,RC1,0)/30,0),R8C>ROUND(DAYS360(ExpDat,RC1,0)/30,0)),0,OFFSET(R45C,MAX(-MNR,ROUND(DAYS360(ValDat,RC1,0)/30,0)-R8C+MEP-MNR),0,1,1))) -> 20107 | J81: =IF(RC1="","",IF(OR(R8C<=ROUND(DAYS360(ValDat,RC1,0)/30,0),R8C>ROUND(DAYS360(ExpDat,RC1,0)/30,0)),0,OFFSET(R45C,MAX(-MNR,ROUND(DAYS360(ValDat,RC1,0)/30,0)-R8C+MEP-MNR),0,1,1))) -> 6942 | K81: =IF(RC1="","",IF(OR(R8C<=ROUND(DAYS360(ValDat,RC1,0)/30,0),R8C>ROUND(DAYS360(ExpDat,RC1,0)/30,0)),0,OFFSET(R45C,MAX(-MNR,ROUND(DAYS360(ValDat,RC1,0)/30,0)-R8C+MEP-MNR),0,1,1))) -> 702 | L81: =IF(RC1="","",IF(OR(R8C<=ROUND(DAYS360(ValDat,RC1,0)/30,0),R8C>ROUND(DAYS360(ExpDat,RC1,0)/30,0)),0,OFFSET(R45C,MAX(-MNR,ROUND(DAYS360(ValDat,RC1,0)/30,0)-R8C+MEP-MNR),0,1,1))) -> 9314 | M81: =IF(RC1="","",IF(OR(R8C<=ROUND(DAYS360(ValDat,RC1,0)/30,0),R8C>ROUND(DAYS360(ExpDat,RC1,0)/30,0)),0,OFFSET(R45C,MAX(-MNR,ROUND(DAYS360(ValDat,RC1,0)/30,0)-R8C+MEP-MNR),0,1,1))) -> 117 | N81: =IF(RC1="","",IF(OR(R8C<=ROUND(DAYS360(ValDat,RC1,0)/30,0),R8C>ROUND(DAYS360(ExpDat,RC1,0)/30,0)),0,OFFSET(R45C,MAX(-MNR,ROUND(DAYS360(ValDat,RC1,0)/30,0)-R8C+MEP-MNR),0,1,1))) -> 1242 | O81: =IF(RC1="","",IF(OR(R8C<=ROUND(DAYS360(ValDat,RC1,0)/30,0),R8C>ROUND(DAYS360(ExpDat,RC1,0)/30,0)),0,OFFSET(R45C,MAX(-MNR,ROUND(DAYS360(ValDat,RC1,0)/30,0)-R8C+MEP-MNR),0,1,1))) -> 252 | P81: =IF(RC1="","",IF(OR(R8C<=ROUND(DAYS360(ValDat,RC1,0)/30,0),R8C>ROUND(DAYS360(ExpDat,RC1,0)/30,0)),0,OFFSET(R45C,MAX(-MNR,ROUND(DAYS360(ValDat,RC1,0)/30,0)-R8C+MEP-MNR),0,1,1))) -> 374 | Q81: =IF(RC1="","",IF(OR(R8C<=ROUND(DAYS360(ValDat,RC1,0)/30,0),R8C>ROUND(DAYS360(ExpDat,RC1,0)/30,0)),0,OFFSET(R45C,MAX(-MNR,ROUND(DAYS360(ValDat,RC1,0)/30,0)-R8C+MEP-MNR),0,1,1))) -> 454 | R81: =IF(RC1="","",IF(OR(R8C<=ROUND(DAYS360(ValDat,RC1,0)/30,0),R8C>ROUND(DAYS360(ExpDat,RC1,0)/30,0)),0,OFFSET(R45C,MAX(-MNR,ROUND(DAYS360(ValDat,RC1,0)/30,0)-R8C+MEP-MNR),0,1,1))) -> 0 | S81: =IF(RC1="","",IF(OR(R8C<=ROUND(DAYS360(ValDat,RC1,0)/30,0),R8C>ROUND(DAYS360(ExpDat,RC1,0)/30,0)),0,OFFSET(R45C,MAX(-MNR,ROUND(DAYS360(ValDat,RC1,0)/30,0)-R8C+MEP-MNR),0,1,1))) -> 0 | T81: =IF(RC1="","",IF(OR(R8C<=ROUND(DAYS360(ValDat,RC1,0)/30,0),R8C>ROUND(DAYS360(ExpDat,RC1,0)/30,0)),0,OFFSET(R45C,MAX(-MNR,ROUND(DAYS360(ValDat,RC1,0)/30,0)-R8C+MEP-MNR),0,1,1))) -> 0 | U81: =IF(RC1="","",IF(OR(R8C<=ROUND(DAYS360(ValDat,RC1,0)/30,0),R8C>ROUND(DAYS360(ExpDat,RC1,0)/30,0)),0,OFFSET(R45C,MAX(-MNR,ROUND(DAYS360(ValDat,RC1,0)/30,0)-R8C+MEP-MNR),0,1,1))) -> 0 | V81: =IF(RC1="","",IF(OR(R8C<=ROUND(DAYS360(ValDat,RC1,0)/30,0),R8C>ROUND(DAYS360(ExpDat,RC1,0)/30,0)),0,OFFSET(R45C,MAX(-MNR,ROUND(DAYS360(ValDat,RC1,0)/30,0)-R8C+MEP-MNR),0,1,1))) -> 0 | W81: =IF(RC1="","",IF(OR(R8C<=ROUND(DAYS360(ValDat,RC1,0)/30,0),R8C>ROUND(DAYS360(ExpDat,RC1,0)/30,0)),0,OFFSET(R45C,MAX(-MNR,ROUND(DAYS360(ValDat,RC1,0)/30,0)-R8C+MEP-MNR),0,1,1))) -> 0 | X81: =IF(RC1="","",IF(OR(R8C<=ROUND(DAYS360(ValDat,RC1,0)/30,0),R8C>ROUND(DAYS360(ExpDat,RC1,0)/30,0)),0,OFFSET(R45C,MAX(-MNR,ROUND(DAYS360(ValDat,RC1,0)/30,0)-R8C+MEP-MNR),0,1,1))) -> 0 | Y81: =IF(RC1="","",IF(OR(R8C<=ROUND(DAYS360(ValDat,RC1,0)/30,0),R8C>ROUND(DAYS360(ExpDat,RC1,0)/30,0)),0,OFFSET(R45C,MAX(-MNR,ROUND(DAYS360(ValDat,RC1,0)/30,0)-R8C+MEP-MNR),0,1,1))) -> 0 | Z81: =IF(RC1="","",IF(OR(R8C<=ROUND(DAYS360(ValDat,RC1,0)/30,0),R8C>ROUND(DAYS360(ExpDat,RC1,0)/30,0)),0,OFFSET(R45C,MAX(-MNR,ROUND(DAYS360(ValDat,RC1,0)/30,0)-R8C+MEP-MNR),0,1,1))) -> 0 | AA81: =IF(RC1="","",IF(OR(R8C<=ROUND(DAYS360(ValDat,RC1,0)/30,0),R8C>ROUND(DAYS360(ExpDat,RC1,0)/30,0)),0,OFFSET(R45C,MAX(-MNR,ROUND(DAYS360(ValDat,RC1,0)/30,0)-R8C+MEP-MNR),0,1,1))) -> 0 | AB81: =IF(RC1="","",IF(OR(R8C<=ROUND(DAYS360(ValDat,RC1,0)/30,0),R8C>ROUND(DAYS360(ExpDat,RC1,0)/30,0)),0,OFFSET(R45C,MAX(-MNR,ROUND(DAYS360(ValDat,RC1,0)/30,0)-R8C+MEP-MNR),0,1,1))) -> 0 | AC81: =IF(RC1="","",IF(OR(R8C<=ROUND(DAYS360(ValDat,RC1,0)/30,0),R8C>ROUND(DAYS360(ExpDat,RC1,0)/30,0)),0,OFFSET(R45C,MAX(-MNR,ROUND(DAYS360(ValDat,RC1,0)/30,0)-R8C+MEP-MNR),0,1,1))) -> 0 | AD81: =IF(RC1="","",IF(OR(R8C<=ROUND(DAYS360(ValDat,RC1,0)/30,0),R8C>ROUND(DAYS360(ExpDat,RC1,0)/30,0)),0,OFFSET(R45C,MAX(-MNR,ROUND(DAYS360(ValDat,RC1,0)/30,0)-R8C+MEP-MNR),0,1,1))) -> 0 | AE81: =IF(RC1="","",IF(OR(R8C<=ROUND(DAYS360(ValDat,RC1,0)/30,0),R8C>ROUND(DAYS360(ExpDat,RC1,0)/30,0)),0,OFFSET(R45C,MAX(-MNR,ROUND(DAYS360(ValDat,RC1,0)/30,0)-R8C+MEP-MNR),0,1,1))) -> 0 | AF81: =IF(RC1="","",IF(OR(R8C<=ROUND(DAYS360(ValDat,RC1,0)/30,0),R8C>ROUND(DAYS360(ExpDat,RC1,0)/30,0)),0,OFFSET(R45C,MAX(-MNR,ROUND(DAYS360(ValDat,RC1,0)/30,0)-R8C+MEP-MNR),0,1,1))) -> 0 | AG81: =IF(RC1="","",IF(OR(R8C<=ROUND(DAYS360(ValDat,RC1,0)/30,0),R8C>ROUND(DAYS360(ExpDat,RC1,0)/30,0)),0,OFFSET(R45C,MAX(-MNR,ROUND(DAYS360(ValDat,RC1,0)/30,0)-R8C+MEP-MNR),0,1,1))) -> 0 | AH81: =IF(RC1="","",IF(OR(R8C<=ROUND(DAYS360(ValDat,RC1,0)/30,0),R8C>ROUND(DAYS360(ExpDat,RC1,0)/30,0)),0,OFFSET(R45C,MAX(-MNR,ROUND(DAYS360(ValDat,RC1,0)/30,0)-R8C+MEP-MNR),0,1,1))) -> 0 | AI81: =IF(RC1="","",IF(OR(R8C<=ROUND(DAYS360(ValDat,RC1,0)/30,0),R8C>ROUND(DAYS360(ExpDat,RC1,0)/30,0)),0,OFFSET(R45C,MAX(-MNR,ROUND(DAYS360(ValDat,RC1,0)/30,0)-R8C+MEP-MNR),0,1,1))) -> 0 | AJ81: =IF(RC1="","",IF(OR(R8C<=ROUND(DAYS360(ValDat,RC1,0)/30,0),R8C>ROUND(DAYS360(ExpDat,RC1,0)/30,0)),0,OFFSET(R45C,MAX(-MNR,ROUND(DAYS360(ValDat,RC1,0)/30,0)-R8C+MEP-MNR),0,1,1))) -> 0 | AK81: =IF(RC1="","",IF(OR(R8C<=ROUND(DAYS360(ValDat,RC1,0)/30,0),R8C>ROUND(DAYS360(ExpDat,RC1,0)/30,0)),0,OFFSET(R45C,MAX(-MNR,ROUND(DAYS360(ValDat,RC1,0)/30,0)-R8C+MEP-MNR),0,1,1))) -> 0 | AL81: =IF(RC1="","",IF(OR(R8C<=ROUND(DAYS360(ValDat,RC1,0)/30,0),R8C>ROUND(DAYS360(ExpDat,RC1,0)/30,0)),0,OFFSET(R45C,MAX(-MNR,ROUND(DAYS360(ValDat,RC1,0)/30,0)-R8C+MEP-MNR),0,1,1))) -> 0 | AM81: =IF(RC1="","",IF(OR(R8C<=ROUND(DAYS360(ValDat,RC1,0)/30,0),R8C>ROUND(DAYS360(ExpDat,RC1,0)/30,0)),0,OFFSET(R45C,MAX(-MNR,ROUND(DAYS360(ValDat,RC1,0)/30,0)-R8C+MEP-MNR),0,1,1))) -> 0 | AN81: =IF(RC1="","",IF(OR(R8C<=ROUND(DAYS360(ValDat,RC1,0)/30,0),R8C>ROUND(DAYS360(ExpDat,RC1,0)/30,0)),0,OFFSET(R45C,MAX(-MNR,ROUND(DAYS360(ValDat,RC1,0)/30,0)-R8C+MEP-MNR),0,1,1))) -> 0 | AO81: =IF(RC1="","",IF(OR(R8C<=ROUND(DAYS360(ValDat,RC1,0)/30,0),R8C>ROUND(DAYS360(ExpDat,RC1,0)/30,0)),0,OFFSET(R45C,MAX(-MNR,ROUND(DAYS360(ValDat,RC1,0)/30,0)-R8C+MEP-MNR),0,1,1))) -> 0
A82: =IF(R[-1]C="","",IF(DATE(YEAR(R[-1]C),MONTH(R[-1]C)+1,1)>RunDat,"",DATE(YEAR(R[-1]C),MONTH(R[-1]C)+1,1))) -> 2000-08-01T00:00:00.000 | D82: =IF(RC1="","",SUM(RC[2]:RC[37])) -> 243611 | F82: =IF(RC1="","",IF(OR(R8C<=ROUND(DAYS360(ValDat,RC1,0)/30,0),R8C>ROUND(DAYS360(ExpDat,RC1,0)/30,0)),0,OFFSET(R45C,MAX(-MNR,ROUND(DAYS360(ValDat,RC1,0)/30,0)-R8C+MEP-MNR),0,1,1))) -> 2952 | G82: =IF(RC1="","",IF(OR(R8C<=ROUND(DAYS360(ValDat,RC1,0)/30,0),R8C>ROUND(DAYS360(ExpDat,RC1,0)/30,0)),0,OFFSET(R45C,MAX(-MNR,ROUND(DAYS360(ValDat,RC1,0)/30,0)-R8C+MEP-MNR),0,1,1))) -> 81868 | H82: =IF(RC1="","",IF(OR(R8C<=ROUND(DAYS360(ValDat,RC1,0)/30,0),R8C>ROUND(DAYS360(ExpDat,RC1,0)/30,0)),0,OFFSET(R45C,MAX(-MNR,ROUND(DAYS360(ValDat,RC1,0)/30,0)-R8C+MEP-MNR),0,1,1))) -> 87955 | I82: =IF(RC1="","",IF(OR(R8C<=ROUND(DAYS360(ValDat,RC1,0)/30,0),R8C>ROUND(DAYS360(ExpDat,RC1,0)/30,0)),0,OFFSET(R45C,MAX(-MNR,ROUND(DAYS360(ValDat,RC1,0)/30,0)-R8C+MEP-MNR),0,1,1))) -> 38977 | J82: =IF(RC1="","",IF(OR(R8C<=ROUND(DAYS360(ValDat,RC1,0)/30,0),R8C>ROUND(DAYS360(ExpDat,RC1,0)/30,0)),0,OFFSET(R45C,MAX(-MNR,ROUND(DAYS360(ValDat,RC1,0)/30,0)-R8C+MEP-MNR),0,1,1))) -> 28866 | K82: =IF(RC1="","",IF(OR(R8C<=ROUND(DAYS360(ValDat,RC1,0)/30,0),R8C>ROUND(DAYS360(ExpDat,RC1,0)/30,0)),0,OFFSET(R45C,MAX(-MNR,ROUND(DAYS360(ValDat,RC1,0)/30,0)-R8C+MEP-MNR),0,1,1))) -> 821 | L82: =IF(RC1="","",IF(OR(R8C<=ROUND(DAYS360(ValDat,RC1,0)/30,0),R8C>ROUND(DAYS360(ExpDat,RC1,0)/30,0)),0,OFFSET(R45C,MAX(-MNR,ROUND(DAYS360(ValDat,RC1,0)/30,0)-R8C+MEP-MNR),0,1,1))) -> 1231 | M82: =IF(RC1="","",IF(OR(R8C<=ROUND(DAYS360(ValDat,RC1,0)/30,0),R8C>ROUND(DAYS360(ExpDat,RC1,0)/30,0)),0,OFFSET(R45C,MAX(-MNR,ROUND(DAYS360(ValDat,RC1,0)/30,0)-R8C+MEP-MNR),0,1,1))) -> 117 | N82: =IF(RC1="","",IF(OR(R8C<=ROUND(DAYS360(ValDat,RC1,0)/30,0),R8C>ROUND(DAYS360(ExpDat,RC1,0)/30,0)),0,OFFSET(R45C,MAX(-MNR,ROUND(DAYS360(ValDat,RC1,0)/30,0)-R8C+MEP-MNR),0,1,1))) -> 216 | O82: =IF(RC1="","",IF(OR(R8C<=ROUND(DAYS360(ValDat,RC1,0)/30,0),R8C>ROUND(DAYS360(ExpDat,RC1,0)/30,0)),0,OFFSET(R45C,MAX(-MNR,ROUND(DAYS360(ValDat,RC1,0)/30,0)-R8C+MEP-MNR),0,1,1))) -> 450 | P82: =IF(RC1="","",IF(OR(R8C<=ROUND(DAYS360(ValDat,RC1,0)/30,0),R8C>ROUND(DAYS360(ExpDat,RC1,0)/30,0)),0,OFFSET(R45C,MAX(-MNR,ROUND(DAYS360(ValDat,RC1,0)/30,0)-R8C+MEP-MNR),0,1,1))) -> -208 | Q82: =IF(RC1="","",IF(OR(R8C<=ROUND(DAYS360(ValDat,RC1,0)/30,0),R8C>ROUND(DAYS360(ExpDat,RC1,0)/30,0)),0,OFFSET(R45C,MAX(-MNR,ROUND(DAYS360(ValDat,RC1,0)/30,0)-R8C+MEP-MNR),0,1,1))) -> 80 | R82: =IF(RC1="","",IF(OR(R8C<=ROUND(DAYS360(ValDat,RC1,0)/30,0),R8C>ROUND(DAYS360(ExpDat,RC1,0)/30,0)),0,OFFSET(R45C,MAX(-MNR,ROUND(DAYS360(ValDat,RC1,0)/30,0)-R8C+MEP-MNR),0,1,1))) -> 286 | S82: =IF(RC1="","",IF(OR(R8C<=ROUND(DAYS360(ValDat,RC1,0)/30,0),R8C>ROUND(DAYS360(ExpDat,RC1,0)/30,0)),0,OFFSET(R45C,MAX(-MNR,ROUND(DAYS360(ValDat,RC1,0)/30,0)-R8C+MEP-MNR),0,1,1))) -> 0 | T82: =IF(RC1="","",IF(OR(R8C<=ROUND(DAYS360(ValDat,RC1,0)/30,0),R8C>ROUND(DAYS360(ExpDat,RC1,0)/30,0)),0,OFFSET(R45C,MAX(-MNR,ROUND(DAYS360(ValDat,RC1,0)/30,0)-R8C+MEP-MNR),0,1,1))) -> 0 | U82: =IF(RC1="","",IF(OR(R8C<=ROUND(DAYS360(ValDat,RC1,0)/30,0),R8C>ROUND(DAYS360(ExpDat,RC1,0)/30,0)),0,OFFSET(R45C,MAX(-MNR,ROUND(DAYS360(ValDat,RC1,0)/30,0)-R8C+MEP-MNR),0,1,1))) -> 0 | V82: =IF(RC1="","",IF(OR(R8C<=ROUND(DAYS360(ValDat,RC1,0)/30,0),R8C>ROUND(DAYS360(ExpDat,RC1,0)/30,0)),0,OFFSET(R45C,MAX(-MNR,ROUND(DAYS360(ValDat,RC1,0)/30,0)-R8C+MEP-MNR),0,1,1))) -> 0 | W82: =IF(RC1="","",IF(OR(R8C<=ROUND(DAYS360(ValDat,RC1,0)/30,0),R8C>ROUND(DAYS360(ExpDat,RC1,0)/30,0)),0,OFFSET(R45C,MAX(-MNR,ROUND(DAYS360(ValDat,RC1,0)/30,0)-R8C+MEP-MNR),0,1,1))) -> 0 | X82: =IF(RC1="","",IF(OR(R8C<=ROUND(DAYS360(ValDat,RC1,0)/30,0),R8C>ROUND(DAYS360(ExpDat,RC1,0)/30,0)),0,OFFSET(R45C,MAX(-MNR,ROUND(DAYS360(ValDat,RC1,0)/30,0)-R8C+MEP-MNR),0,1,1))) -> 0 | Y82: =IF(RC1="","",IF(OR(R8C<=ROUND(DAYS360(ValDat,RC1,0)/30,0),R8C>ROUND(DAYS360(ExpDat,RC1,0)/30,0)),0,OFFSET(R45C,MAX(-MNR,ROUND(DAYS360(ValDat,RC1,0)/30,0)-R8C+MEP-MNR),0,1,1))) -> 0 | Z82: =IF(RC1="","",IF(OR(R8C<=ROUND(DAYS360(ValDat,RC1,0)/30,0),R8C>ROUND(DAYS360(ExpDat,RC1,0)/30,0)),0,OFFSET(R45C,MAX(-MNR,ROUND(DAYS360(ValDat,RC1,0)/30,0)-R8C+MEP-MNR),0,1,1))) -> 0 | AA82: =IF(RC1="","",IF(OR(R8C<=ROUND(DAYS360(ValDat,RC1,0)/30,0),R8C>ROUND(DAYS360(ExpDat,RC1,0)/30,0)),0,OFFSET(R45C,MAX(-MNR,ROUND(DAYS360(ValDat,RC1,0)/30,0)-R8C+MEP-MNR),0,1,1))) -> 0 | AB82: =IF(RC1="","",IF(OR(R8C<=ROUND(DAYS360(ValDat,RC1,0)/30,0),R8C>ROUND(DAYS360(ExpDat,RC1,0)/30,0)),0,OFFSET(R45C,MAX(-MNR,ROUND(DAYS360(ValDat,RC1,0)/30,0)-R8C+MEP-MNR),0,1,1))) -> 0 | AC82: =IF(RC1="","",IF(OR(R8C<=ROUND(DAYS360(ValDat,RC1,0)/30,0),R8C>ROUND(DAYS360(ExpDat,RC1,0)/30,0)),0,OFFSET(R45C,MAX(-MNR,ROUND(DAYS360(ValDat,RC1,0)/30,0)-R8C+MEP-MNR),0,1,1))) -> 0 | AD82: =IF(RC1="","",IF(OR(R8C<=ROUND(DAYS360(ValDat,RC1,0)/30,0),R8C>ROUND(DAYS360(ExpDat,RC1,0)/30,0)),0,OFFSET(R45C,MAX(-MNR,ROUND(DAYS360(ValDat,RC1,0)/30,0)-R8C+MEP-MNR),0,1,1))) -> 0 | AE82: =IF(RC1="","",IF(OR(R8C<=ROUND(DAYS360(ValDat,RC1,0)/30,0),R8C>ROUND(DAYS360(ExpDat,RC1,0)/30,0)),0,OFFSET(R45C,MAX(-MNR,ROUND(DAYS360(ValDat,RC1,0)/30,0)-R8C+MEP-MNR),0,1,1))) -> 0 | AF82: =IF(RC1="","",IF(OR(R8C<=ROUND(DAYS360(ValDat,RC1,0)/30,0),R8C>ROUND(DAYS360(ExpDat,RC1,0)/30,0)),0,OFFSET(R45C,MAX(-MNR,ROUND(DAYS360(ValDat,RC1,0)/30,0)-R8C+MEP-MNR),0,1,1))) -> 0 | AG82: =IF(RC1="","",IF(OR(R8C<=ROUND(DAYS360(ValDat,RC1,0)/30,0),R8C>ROUND(DAYS360(ExpDat,RC1,0)/30,0)),0,OFFSET(R45C,MAX(-MNR,ROUND(DAYS360(ValDat,RC1,0)/30,0)-R8C+MEP-MNR),0,1,1))) -> 0 | AH82: =IF(RC1="","",IF(OR(R8C<=ROUND(DAYS360(ValDat,RC1,0)/30,0),R8C>ROUND(DAYS360(ExpDat,RC1,0)/30,0)),0,OFFSET(R45C,MAX(-MNR,ROUND(DAYS360(ValDat,RC1,0)/30,0)-R8C+MEP-MNR),0,1,1))) -> 0 | AI82: =IF(RC1="","",IF(OR(R8C<=ROUND(DAYS360(ValDat,RC1,0)/30,0),R8C>ROUND(DAYS360(ExpDat,RC1,0)/30,0)),0,OFFSET(R45C,MAX(-MNR,ROUND(DAYS360(ValDat,RC1,0)/30,0)-R8C+MEP-MNR),0,1,1))) -> 0 | AJ82: =IF(RC1="","",IF(OR(R8C<=ROUND(DAYS360(ValDat,RC1,0)/30,0),R8C>ROUND(DAYS360(ExpDat,RC1,0)/30,0)),0,OFFSET(R45C,MAX(-MNR,ROUND(DAYS360(ValDat,RC1,0)/30,0)-R8C+MEP-MNR),0,1,1))) -> 0 | AK82: =IF(RC1="","",IF(OR(R8C<=ROUND(DAYS360(ValDat,RC1,0)/30,0),R8C>ROUND(DAYS360(ExpDat,RC1,0)/30,0)),0,OFFSET(R45C,MAX(-MNR,ROUND(DAYS360(ValDat,RC1,0)/30,0)-R8C+MEP-MNR),0,1,1))) -> 0 | AL82: =IF(RC1="","",IF(OR(R8C<=ROUND(DAYS360(ValDat,RC1,0)/30,0),R8C>ROUND(DAYS360(ExpDat,RC1,0)/30,0)),0,OFFSET(R45C,MAX(-MNR,ROUND(DAYS360(ValDat,RC1,0)/30,0)-R8C+MEP-MNR),0,1,1))) -> 0 | AM82: =IF(RC1="","",IF(OR(R8C<=ROUND(DAYS360(ValDat,RC1,0)/30,0),R8C>ROUND(DAYS360(ExpDat,RC1,0)/30,0)),0,OFFSET(R45C,MAX(-MNR,ROUND(DAYS360(ValDat,RC1,0)/30,0)-R8C+MEP-MNR),0,1,1))) -> 0 | AN82: =IF(RC1="","",IF(OR(R8C<=ROUND(DAYS360(ValDat,RC1,0)/30,0),R8C>ROUND(DAYS360(ExpDat,RC1,0)/30,0)),0,OFFSET(R45C,MAX(-MNR,ROUND(DAYS360(ValDat,RC1,0)/30,0)-R8C+MEP-MNR),0,1,1))) -> 0 | AO82: =IF(RC1="","",IF(OR(R8C<=ROUND(DAYS360(ValDat,RC1,0)/30,0),R8C>ROUND(DAYS360(ExpDat,RC1,0)/30,0)),0,OFFSET(R45C,MAX(-MNR,ROUND(DAYS360(ValDat,RC1,0)/30,0)-R8C+MEP-MNR),0,1,1))) -> 0
A83: =IF(R[-1]C="","",IF(DATE(YEAR(R[-1]C),MONTH(R[-1]C)+1,1)>RunDat,"",DATE(YEAR(R[-1]C),MONTH(R[-1]C)+1,1))) -> 2000-09-01T00:00:00.000 | D83: =IF(RC1="","",SUM(RC[2]:RC[37])) -> 295149 | F83: =IF(RC1="","",IF(OR(R8C<=ROUND(DAYS360(ValDat,RC1,0)/30,0),R8C>ROUND(DAYS360(ExpDat,RC1,0)/30,0)),0,OFFSET(R45C,MAX(-MNR,ROUND(DAYS360(ValDat,RC1,0)/30,0)-R8C+MEP-MNR),0,1,1))) -> 22590 | G83: =IF(RC1="","",IF(OR(R8C<=ROUND(DAYS360(ValDat,RC1,0)/30,0),R8C>ROUND(DAYS360(ExpDat,RC1,0)/30,0)),0,OFFSET(R45C,MAX(-MNR,ROUND(DAYS360(ValDat,RC1,0)/30,0)-R8C+MEP-MNR),0,1,1))) -> 58928 | H83: =IF(RC1="","",IF(OR(R8C<=ROUND(DAYS360(ValDat,RC1,0)/30,0),R8C>ROUND(DAYS360(ExpDat,RC1,0)/30,0)),0,OFFSET(R45C,MAX(-MNR,ROUND(DAYS360(ValDat,RC1,0)/30,0)-R8C+MEP-MNR),0,1,1))) -> 96720 | I83: =IF(RC1="","",IF(OR(R8C<=ROUND(DAYS360(ValDat,RC1,0)/30,0),R8C>ROUND(DAYS360(ExpDat,RC1,0)/30,0)),0,OFFSET(R45C,MAX(-MNR,ROUND(DAYS360(ValDat,RC1,0)/30,0)-R8C+MEP-MNR),0,1,1))) -> 99302 | J83: =IF(RC1="","",IF(OR(R8C<=ROUND(DAYS360(ValDat,RC1,0)/30,0),R8C>ROUND(DAYS360(ExpDat,RC1,0)/30,0)),0,OFFSET(R45C,MAX(-MNR,ROUND(DAYS360(ValDat,RC1,0)/30,0)-R8C+MEP-MNR),0,1,1))) -> 4745 | K83: =IF(RC1="","",IF(OR(R8C<=ROUND(DAYS360(ValDat,RC1,0)/30,0),R8C>ROUND(DAYS360(ExpDat,RC1,0)/30,0)),0,OFFSET(R45C,MAX(-MNR,ROUND(DAYS360(ValDat,RC1,0)/30,0)-R8C+MEP-MNR),0,1,1))) -> 6492 | L83: =IF(RC1="","",IF(OR(R8C<=ROUND(DAYS360(ValDat,RC1,0)/30,0),R8C>ROUND(DAYS360(ExpDat,RC1,0)/30,0)),0,OFFSET(R45C,MAX(-MNR,ROUND(DAYS360(ValDat,RC1,0)/30,0)-R8C+MEP-MNR),0,1,1))) -> 1096 | M83: =IF(RC1="","",IF(OR(R8C<=ROUND(DAYS360(ValDat,RC1,0)/30,0),R8C>ROUND(DAYS360(ExpDat,RC1,0)/30,0)),0,OFFSET(R45C,MAX(-MNR,ROUND(DAYS360(ValDat,RC1,0)/30,0)-R8C+MEP-MNR),0,1,1))) -> 530 | N83: =IF(RC1="","",IF(OR(R8C<=ROUND(DAYS360(ValDat,RC1,0)/30,0),R8C>ROUND(DAYS360(ExpDat,RC1,0)/30,0)),0,OFFSET(R45C,MAX(-MNR,ROUND(DAYS360(ValDat,RC1,0)/30,0)-R8C+MEP-MNR),0,1,1))) -> 56 | O83: =IF(RC1="","",IF(OR(R8C<=ROUND(DAYS360(ValDat,RC1,0)/30,0),R8C>ROUND(DAYS360(ExpDat,RC1,0)/30,0)),0,OFFSET(R45C,MAX(-MNR,ROUND(DAYS360(ValDat,RC1,0)/30,0)-R8C+MEP-MNR),0,1,1))) -> 314 | P83: =IF(RC1="","",IF(OR(R8C<=ROUND(DAYS360(ValDat,RC1,0)/30,0),R8C>ROUND(DAYS360(ExpDat,RC1,0)/30,0)),0,OFFSET(R45C,MAX(-MNR,ROUND(DAYS360(ValDat,RC1,0)/30,0)-R8C+MEP-MNR),0,1,1))) -> -376 | Q83: =IF(RC1="","",IF(OR(R8C<=ROUND(DAYS360(ValDat,RC1,0)/30,0),R8C>ROUND(DAYS360(ExpDat,RC1,0)/30,0)),0,OFFSET(R45C,MAX(-MNR,ROUND(DAYS360(ValDat,RC1,0)/30,0)-R8C+MEP-MNR),0,1,1))) -> 4466 | R83: =IF(RC1="","",IF(OR(R8C<=ROUND(DAYS360(ValDat,RC1,0)/30,0),R8C>ROUND(DAYS360(ExpDat,RC1,0)/30,0)),0,OFFSET(R45C,MAX(-MNR,ROUND(DAYS360(ValDat,RC1,0)/30,0)-R8C+MEP-MNR),0,1,1))) -> 286 | S83: =IF(RC1="","",IF(OR(R8C<=ROUND(DAYS360(ValDat,RC1,0)/30,0),R8C>ROUND(DAYS360(ExpDat,RC1,0)/30,0)),0,OFFSET(R45C,MAX(-MNR,ROUND(DAYS360(ValDat,RC1,0)/30,0)-R8C+MEP-MNR),0,1,1))) -> 0 | T83: =IF(RC1="","",IF(OR(R8C<=ROUND(DAYS360(ValDat,RC1,0)/30,0),R8C>ROUND(DAYS360(ExpDat,RC1,0)/30,0)),0,OFFSET(R45C,MAX(-MNR,ROUND(DAYS360(ValDat,RC1,0)/30,0)-R8C+MEP-MNR),0,1,1))) -> 0 | U83: =IF(RC1="","",IF(OR(R8C<=ROUND(DAYS360(ValDat,RC1,0)/30,0),R8C>ROUND(DAYS360(ExpDat,RC1,0)/30,0)),0,OFFSET(R45C,MAX(-MNR,ROUND(DAYS360(ValDat,RC1,0)/30,0)-R8C+MEP-MNR),0,1,1))) -> 0 | V83: =IF(RC1="","",IF(OR(R8C<=ROUND(DAYS360(ValDat,RC1,0)/30,0),R8C>ROUND(DAYS360(ExpDat,RC1,0)/30,0)),0,OFFSET(R45C,MAX(-MNR,ROUND(DAYS360(ValDat,RC1,0)/30,0)-R8C+MEP-MNR),0,1,1))) -> 0 | W83: =IF(RC1="","",IF(OR(R8C<=ROUND(DAYS360(ValDat,RC1,0)/30,0),R8C>ROUND(DAYS360(ExpDat,RC1,0)/30,0)),0,OFFSET(R45C,MAX(-MNR,ROUND(DAYS360(ValDat,RC1,0)/30,0)-R8C+MEP-MNR),0,1,1))) -> 0 | X83: =IF(RC1="","",IF(OR(R8C<=ROUND(DAYS360(ValDat,RC1,0)/30,0),R8C>ROUND(DAYS360(ExpDat,RC1,0)/30,0)),0,OFFSET(R45C,MAX(-MNR,ROUND(DAYS360(ValDat,RC1,0)/30,0)-R8C+MEP-MNR),0,1,1))) -> 0 | Y83: =IF(RC1="","",IF(OR(R8C<=ROUND(DAYS360(ValDat,RC1,0)/30,0),R8C>ROUND(DAYS360(ExpDat,RC1,0)/30,0)),0,OFFSET(R45C,MAX(-MNR,ROUND(DAYS360(ValDat,RC1,0)/30,0)-R8C+MEP-MNR),0,1,1))) -> 0 | Z83: =IF(RC1="","",IF(OR(R8C<=ROUND(DAYS360(ValDat,RC1,0)/30,0),R8C>ROUND(DAYS360(ExpDat,RC1,0)/30,0)),0,OFFSET(R45C,MAX(-MNR,ROUND(DAYS360(ValDat,RC1,0)/30,0)-R8C+MEP-MNR),0,1,1))) -> 0 | AA83: =IF(RC1="","",IF(OR(R8C<=ROUND(DAYS360(ValDat,RC1,0)/30,0),R8C>ROUND(DAYS360(ExpDat,RC1,0)/30,0)),0,OFFSET(R45C,MAX(-MNR,ROUND(DAYS360(ValDat,RC1,0)/30,0)-R8C+MEP-MNR),0,1,1))) -> 0 | AB83: =IF(RC1="","",IF(OR(R8C<=ROUND(DAYS360(ValDat,RC1,0)/30,0),R8C>ROUND(DAYS360(ExpDat,RC1,0)/30,0)),0,OFFSET(R45C,MAX(-MNR,ROUND(DAYS360(ValDat,RC1,0)/30,0)-R8C+MEP-MNR),0,1,1))) -> 0 | AC83: =IF(RC1="","",IF(OR(R8C<=ROUND(DAYS360(ValDat,RC1,0)/30,0),R8C>ROUND(DAYS360(ExpDat,RC1,0)/30,0)),0,OFFSET(R45C,MAX(-MNR,ROUND(DAYS360(ValDat,RC1,0)/30,0)-R8C+MEP-MNR),0,1,1))) -> 0 | AD83: =IF(RC1="","",IF(OR(R8C<=ROUND(DAYS360(ValDat,RC1,0)/30,0),R8C>ROUND(DAYS360(ExpDat,RC1,0)/30,0)),0,OFFSET(R45C,MAX(-MNR,ROUND(DAYS360(ValDat,RC1,0)/30,0)-R8C+MEP-MNR),0,1,1))) -> 0 | AE83: =IF(RC1="","",IF(OR(R8C<=ROUND(DAYS360(ValDat,RC1,0)/30,0),R8C>ROUND(DAYS360(ExpDat,RC1,0)/30,0)),0,OFFSET(R45C,MAX(-MNR,ROUND(DAYS360(ValDat,RC1,0)/30,0)-R8C+MEP-MNR),0,1,1))) -> 0 | AF83: =IF(RC1="","",IF(OR(R8C<=ROUND(DAYS360(ValDat,RC1,0)/30,0),R8C>ROUND(DAYS360(ExpDat,RC1,0)/30,0)),0,OFFSET(R45C,MAX(-MNR,ROUND(DAYS360(ValDat,RC1,0)/30,0)-R8C+MEP-MNR),0,1,1))) -> 0 | AG83: =IF(RC1="","",IF(OR(R8C<=ROUND(DAYS360(ValDat,RC1,0)/30,0),R8C>ROUND(DAYS360(ExpDat,RC1,0)/30,0)),0,OFFSET(R45C,MAX(-MNR,ROUND(DAYS360(ValDat,RC1,0)/30,0)-R8C+MEP-MNR),0,1,1))) -> 0 | AH83: =IF(RC1="","",IF(OR(R8C<=ROUND(DAYS360(ValDat,RC1,0)/30,0),R8C>ROUND(DAYS360(ExpDat,RC1,0)/30,0)),0,OFFSET(R45C,MAX(-MNR,ROUND(DAYS360(ValDat,RC1,0)/30,0)-R8C+MEP-MNR),0,1,1))) -> 0 | AI83: =IF(RC1="","",IF(OR(R8C<=ROUND(DAYS360(ValDat,RC1,0)/30,0),R8C>ROUND(DAYS360(ExpDat,RC1,0)/30,0)),0,OFFSET(R45C,MAX(-MNR,ROUND(DAYS360(ValDat,RC1,0)/30,0)-R8C+MEP-MNR),0,1,1))) -> 0 | AJ83: =IF(RC1="","",IF(OR(R8C<=ROUND(DAYS360(ValDat,RC1,0)/30,0),R8C>ROUND(DAYS360(ExpDat,RC1,0)/30,0)),0,OFFSET(R45C,MAX(-MNR,ROUND(DAYS360(ValDat,RC1,0)/30,0)-R8C+MEP-MNR),0,1,1))) -> 0 | AK83: =IF(RC1="","",IF(OR(R8C<=ROUND(DAYS360(ValDat,RC1,0)/30,0),R8C>ROUND(DAYS360(ExpDat,RC1,0)/30,0)),0,OFFSET(R45C,MAX(-MNR,ROUND(DAYS360(ValDat,RC1,0)/30,0)-R8C+MEP-MNR),0,1,1))) -> 0 | AL83: =IF(RC1="","",IF(OR(R8C<=ROUND(DAYS360(ValDat,RC1,0)/30,0),R8C>ROUND(DAYS360(ExpDat,RC1,0)/30,0)),0,OFFSET(R45C,MAX(-MNR,ROUND(DAYS360(ValDat,RC1,0)/30,0)-R8C+MEP-MNR),0,1,1))) -> 0 | AM83: =IF(RC1="","",IF(OR(R8C<=ROUND(DAYS360(ValDat,RC1,0)/30,0),R8C>ROUND(DAYS360(ExpDat,RC1,0)/30,0)),0,OFFSET(R45C,MAX(-MNR,ROUND(DAYS360(ValDat,RC1,0)/30,0)-R8C+MEP-MNR),0,1,1))) -> 0 | AN83: =IF(RC1="","",IF(OR(R8C<=ROUND(DAYS360(ValDat,RC1,0)/30,0),R8C>ROUND(DAYS360(ExpDat,RC1,0)/30,0)),0,OFFSET(R45C,MAX(-MNR,ROUND(DAYS360(ValDat,RC1,0)/30,0)-R8C+MEP-MNR),0,1,1))) -> 0 | AO83: =IF(RC1="","",IF(OR(R8C<=ROUND(DAYS360(ValDat,RC1,0)/30,0),R8C>ROUND(DAYS360(ExpDat,RC1,0)/30,0)),0,OFFSET(R45C,MAX(-MNR,ROUND(DAYS360(ValDat,RC1,0)/30,0)-R8C+MEP-MNR),0,1,1))) -> 0
A84: =IF(R[-1]C="","",IF(DATE(YEAR(R[-1]C),MONTH(R[-1]C)+1,1)>RunDat,"",DATE(YEAR(R[-1]C),MONTH(R[-1]C)+1,1))) -> 2000-10-01T00:00:00.000 | D84: =IF(RC1="","",SUM(RC[2]:RC[37])) -> 344988 | F84: =IF(RC1="","",IF(OR(R8C<=ROUND(DAYS360(ValDat,RC1,0)/30,0),R8C>ROUND(DAYS360(ExpDat,RC1,0)/30,0)),0,OFFSET(R45C,MAX(-MNR,ROUND(DAYS360(ValDat,RC1,0)/30,0)-R8C+MEP-MNR),0,1,1))) -> 2217 | G84: =IF(RC1="","",IF(OR(R8C<=ROUND(DAYS360(ValDat,RC1,0)/30,0),R8C>ROUND(DAYS360(ExpDat,RC1,0)/30,0)),0,OFFSET(R45C,MAX(-MNR,ROUND(DAYS360(ValDat,RC1,0)/30,0)-R8C+MEP-MNR),0,1,1))) -> 127706 | H84: =IF(RC1="","",IF(OR(R8C<=ROUND(DAYS360(ValDat,RC1,0)/30,0),R8C>ROUND(DAYS360(ExpDat,RC1,0)/30,0)),0,OFFSET(R45C,MAX(-MNR,ROUND(DAYS360(ValDat,RC1,0)/30,0)-R8C+MEP-MNR),0,1,1))) -> 130303 | I84: =IF(RC1="","",IF(OR(R8C<=ROUND(DAYS360(ValDat,RC1,0)/30,0),R8C>ROUND(DAYS360(ExpDat,RC1,0)/30,0)),0,OFFSET(R45C,MAX(-MNR,ROUND(DAYS360(ValDat,RC1,0)/30,0)-R8C+MEP-MNR),0,1,1))) -> 55381 | J84: =IF(RC1="","",IF(OR(R8C<=ROUND(DAYS360(ValDat,RC1,0)/30,0),R8C>ROUND(DAYS360(ExpDat,RC1,0)/30,0)),0,OFFSET(R45C,MAX(-MNR,ROUND(DAYS360(ValDat,RC1,0)/30,0)-R8C+MEP-MNR),0,1,1))) -> 13877 | K84: =IF(RC1="","",IF(OR(R8C<=ROUND(DAYS360(ValDat,RC1,0)/30,0),R8C>ROUND(DAYS360(ExpDat,RC1,0)/30,0)),0,OFFSET(R45C,MAX(-MNR,ROUND(DAYS360(ValDat,RC1,0)/30,0)-R8C+MEP-MNR),0,1,1))) -> 6586 | L84: =IF(RC1="","",IF(OR(R8C<=ROUND(DAYS360(ValDat,RC1,0)/30,0),R8C>ROUND(DAYS360(ExpDat,RC1,0)/30,0)),0,OFFSET(R45C,MAX(-MNR,ROUND(DAYS360(ValDat,RC1,0)/30,0)-R8C+MEP-MNR),0,1,1))) -> 1428 | M84: =IF(RC1="","",IF(OR(R8C<=ROUND(DAYS360(ValDat,RC1,0)/30,0),R8C>ROUND(DAYS360(ExpDat,RC1,0)/30,0)),0,OFFSET(R45C,MAX(-MNR,ROUND(DAYS360(ValDat,RC1,0)/30,0)-R8C+MEP-MNR),0,1,1))) -> 511 | N84: =IF(RC1="","",IF(OR(R8C<=ROUND(DAYS360(ValDat,RC1,0)/30,0),R8C>ROUND(DAYS360(ExpDat,RC1,0)/30,0)),0,OFFSET(R45C,MAX(-MNR,ROUND(DAYS360(ValDat,RC1,0)/30,0)-R8C+MEP-MNR),0,1,1))) -> 991 | O84: =IF(RC1="","",IF(OR(R8C<=ROUND(DAYS360(ValDat,RC1,0)/30,0),R8C>ROUND(DAYS360(ExpDat,RC1,0)/30,0)),0,OFFSET(R45C,MAX(-MNR,ROUND(DAYS360(ValDat,RC1,0)/30,0)-R8C+MEP-MNR),0,1,1))) -> 430 | P84: =IF(RC1="","",IF(OR(R8C<=ROUND(DAYS360(ValDat,RC1,0)/30,0),R8C>ROUND(DAYS360(ExpDat,RC1,0)/30,0)),0,OFFSET(R45C,MAX(-MNR,ROUND(DAYS360(ValDat,RC1,0)/30,0)-R8C+MEP-MNR),0,1,1))) -> 204 | Q84: =IF(RC1="","",IF(OR(R8C<=ROUND(DAYS360(ValDat,RC1,0)/30,0),R8C>ROUND(DAYS360(ExpDat,RC1,0)/30,0)),0,OFFSET(R45C,MAX(-MNR,ROUND(DAYS360(ValDat,RC1,0)/30,0)-R8C+MEP-MNR),0,1,1))) -> 4430 | R84: =IF(RC1="","",IF(OR(R8C<=ROUND(DAYS360(ValDat,RC1,0)/30,0),R8C>ROUND(DAYS360(ExpDat,RC1,0)/30,0)),0,OFFSET(R45C,MAX(-MNR,ROUND(DAYS360(ValDat,RC1,0)/30,0)-R8C+MEP-MNR),0,1,1))) -> 924 | S84: =IF(RC1="","",IF(OR(R8C<=ROUND(DAYS360(ValDat,RC1,0)/30,0),R8C>ROUND(DAYS360(ExpDat,RC1,0)/30,0)),0,OFFSET(R45C,MAX(-MNR,ROUND(DAYS360(ValDat,RC1,0)/30,0)-R8C+MEP-MNR),0,1,1))) -> 0 | T84: =IF(RC1="","",IF(OR(R8C<=ROUND(DAYS360(ValDat,RC1,0)/30,0),R8C>ROUND(DAYS360(ExpDat,RC1,0)/30,0)),0,OFFSET(R45C,MAX(-MNR,ROUND(DAYS360(ValDat,RC1,0)/30,0)-R8C+MEP-MNR),0,1,1))) -> 0 | U84: =IF(RC1="","",IF(OR(R8C<=ROUND(DAYS360(ValDat,RC1,0)/30,0),R8C>ROUND(DAYS360(ExpDat,RC1,0)/30,0)),0,OFFSET(R45C,MAX(-MNR,ROUND(DAYS360(ValDat,RC1,0)/30,0)-R8C+MEP-MNR),0,1,1))) -> 0 | V84: =IF(RC1="","",IF(OR(R8C<=ROUND(DAYS360(ValDat,RC1,0)/30,0),R8C>ROUND(DAYS360(ExpDat,RC1,0)/30,0)),0,OFFSET(R45C,MAX(-MNR,ROUND(DAYS360(ValDat,RC1,0)/30,0)-R8C+MEP-MNR),0,1,1))) -> 0 | W84: =IF(RC1="","",IF(OR(R8C<=ROUND(DAYS360(ValDat,RC1,0)/30,0),R8C>ROUND(DAYS360(ExpDat,RC1,0)/30,0)),0,OFFSET(R45C,MAX(-MNR,ROUND(DAYS360(ValDat,RC1,0)/30,0)-R8C+MEP-MNR),0,1,1))) -> 0 | X84: =IF(RC1="","",IF(OR(R8C<=ROUND(DAYS360(ValDat,RC1,0)/30,0),R8C>ROUND(DAYS360(ExpDat,RC1,0)/30,0)),0,OFFSET(R45C,MAX(-MNR,ROUND(DAYS360(ValDat,RC1,0)/30,0)-R8C+MEP-MNR),0,1,1))) -> 0 | Y84: =IF(RC1="","",IF(OR(R8C<=ROUND(DAYS360(ValDat,RC1,0)/30,0),R8C>ROUND(DAYS360(ExpDat,RC1,0)/30,0)),0,OFFSET(R45C,MAX(-MNR,ROUND(DAYS360(ValDat,RC1,0)/30,0)-R8C+MEP-MNR),0,1,1))) -> 0 | Z84: =IF(RC1="","",IF(OR(R8C<=ROUND(DAYS360(ValDat,RC1,0)/30,0),R8C>ROUND(DAYS360(ExpDat,RC1,0)/30,0)),0,OFFSET(R45C,MAX(-MNR,ROUND(DAYS360(ValDat,RC1,0)/30,0)-R8C+MEP-MNR),0,1,1))) -> 0 | AA84: =IF(RC1="","",IF(OR(R8C<=ROUND(DAYS360(ValDat,RC1,0)/30,0),R8C>ROUND(DAYS360(ExpDat,RC1,0)/30,0)),0,OFFSET(R45C,MAX(-MNR,ROUND(DAYS360(ValDat,RC1,0)/30,0)-R8C+MEP-MNR),0,1,1))) -> 0 | AB84: =IF(RC1="","",IF(OR(R8C<=ROUND(DAYS360(ValDat,RC1,0)/30,0),R8C>ROUND(DAYS360(ExpDat,RC1,0)/30,0)),0,OFFSET(R45C,MAX(-MNR,ROUND(DAYS360(ValDat,RC1,0)/30,0)-R8C+MEP-MNR),0,1,1))) -> 0 | AC84: =IF(RC1="","",IF(OR(R8C<=ROUND(DAYS360(ValDat,RC1,0)/30,0),R8C>ROUND(DAYS360(ExpDat,RC1,0)/30,0)),0,OFFSET(R45C,MAX(-MNR,ROUND(DAYS360(ValDat,RC1,0)/30,0)-R8C+MEP-MNR),0,1,1))) -> 0 | AD84: =IF(RC1="","",IF(OR(R8C<=ROUND(DAYS360(ValDat,RC1,0)/30,0),R8C>ROUND(DAYS360(ExpDat,RC1,0)/30,0)),0,OFFSET(R45C,MAX(-MNR,ROUND(DAYS360(ValDat,RC1,0)/30,0)-R8C+MEP-MNR),0,1,1))) -> 0 | AE84: =IF(RC1="","",IF(OR(R8C<=ROUND(DAYS360(ValDat,RC1,0)/30,0),R8C>ROUND(DAYS360(ExpDat,RC1,0)/30,0)),0,OFFSET(R45C,MAX(-MNR,ROUND(DAYS360(ValDat,RC1,0)/30,0)-R8C+MEP-MNR),0,1,1))) -> 0 | AF84: =IF(RC1="","",IF(OR(R8C<=ROUND(DAYS360(ValDat,RC1,0)/30,0),R8C>ROUND(DAYS360(ExpDat,RC1,0)/30,0)),0,OFFSET(R45C,MAX(-MNR,ROUND(DAYS360(ValDat,RC1,0)/30,0)-R8C+MEP-MNR),0,1,1))) -> 0 | AG84: =IF(RC1="","",IF(OR(R8C<=ROUND(DAYS360(ValDat,RC1,0)/30,0),R8C>ROUND(DAYS360(ExpDat,RC1,0)/30,0)),0,OFFSET(R45C,MAX(-MNR,ROUND(DAYS360(ValDat,RC1,0)/30,0)-R8C+MEP-MNR),0,1,1))) -> 0 | AH84: =IF(RC1="","",IF(OR(R8C<=ROUND(DAYS360(ValDat,RC1,0)/30,0),R8C>ROUND(DAYS360(ExpDat,RC1,0)/30,0)),0,OFFSET(R45C,MAX(-MNR,ROUND(DAYS360(ValDat,RC1,0)/30,0)-R8C+MEP-MNR),0,1,1))) -> 0 | AI84: =IF(RC1="","",IF(OR(R8C<=ROUND(DAYS360(ValDat,RC1,0)/30,0),R8C>ROUND(DAYS360(ExpDat,RC1,0)/30,0)),0,OFFSET(R45C,MAX(-MNR,ROUND(DAYS360(ValDat,RC1,0)/30,0)-R8C+MEP-MNR),0,1,1))) -> 0 | AJ84: =IF(RC1="","",IF(OR(R8C<=ROUND(DAYS360(ValDat,RC1,0)/30,0),R8C>ROUND(DAYS360(ExpDat,RC1,0)/30,0)),0,OFFSET(R45C,MAX(-MNR,ROUND(DAYS360(ValDat,RC1,0)/30,0)-R8C+MEP-MNR),0,1,1))) -> 0 | AK84: =IF(RC1="","",IF(OR(R8C<=ROUND(DAYS360(ValDat,RC1,0)/30,0),R8C>ROUND(DAYS360(ExpDat,RC1,0)/30,0)),0,OFFSET(R45C,MAX(-MNR,ROUND(DAYS360(ValDat,RC1,0)/30,0)-R8C+MEP-MNR),0,1,1))) -> 0 | AL84: =IF(RC1="","",IF(OR(R8C<=ROUND(DAYS360(ValDat,RC1,0)/30,0),R8C>ROUND(DAYS360(ExpDat,RC1,0)/30,0)),0,OFFSET(R45C,MAX(-MNR,ROUND(DAYS360(ValDat,RC1,0)/30,0)-R8C+MEP-MNR),0,1,1))) -> 0 | AM84: =IF(RC1="","",IF(OR(R8C<=ROUND(DAYS360(ValDat,RC1,0)/30,0),R8C>ROUND(DAYS360(ExpDat,RC1,0)/30,0)),0,OFFSET(R45C,MAX(-MNR,ROUND(DAYS360(ValDat,RC1,0)/30,0)-R8C+MEP-MNR),0,1,1))) -> 0 | AN84: =IF(RC1="","",IF(OR(R8C<=ROUND(DAYS360(ValDat,RC1,0)/30,0),R8C>ROUND(DAYS360(ExpDat,RC1,0)/30,0)),0,OFFSET(R45C,MAX(-MNR,ROUND(DAYS360(ValDat,RC1,0)/30,0)-R8C+MEP-MNR),0,1,1))) -> 0 | AO84: =IF(RC1="","",IF(OR(R8C<=ROUND(DAYS360(ValDat,RC1,0)/30,0),R8C>ROUND(DAYS360(ExpDat,RC1,0)/30,0)),0,OFFSET(R45C,MAX(-MNR,ROUND(DAYS360(ValDat,RC1,0)/30,0)-R8C+MEP-MNR),0,1,1))) -> 0
A85: =IF(R[-1]C="","",IF(DATE(YEAR(R[-1]C),MONTH(R[-1]C)+1,1)>RunDat,"",DATE(YEAR(R[-1]C),MONTH(R[-1]C)+1,1))) -> 2000-11-01T00:00:00.000 | D85: =IF(RC1="","",SUM(RC[2]:RC[37])) -> 202345 | F85: =IF(RC1="","",IF(OR(R8C<=ROUND(DAYS360(ValDat,RC1,0)/30,0),R8C>ROUND(DAYS360(ExpDat,RC1,0)/30,0)),0,OFFSET(R45C,MAX(-MNR,ROUND(DAYS360(ValDat,RC1,0)/30,0)-R8C+MEP-MNR),0,1,1))) -> 19627 | G85: =IF(RC1="","",IF(OR(R8C<=ROUND(DAYS360(ValDat,RC1,0)/30,0),R8C>ROUND(DAYS360(ExpDat,RC1,0)/30,0)),0,OFFSET(R45C,MAX(-MNR,ROUND(DAYS360(ValDat,RC1,0)/30,0)-R8C+MEP-MNR),0,1,1))) -> 50074 | H85: =IF(RC1="","",IF(OR(R8C<=ROUND(DAYS360(ValDat,RC1,0)/30,0),R8C>ROUND(DAYS360(ExpDat,RC1,0)/30,0)),0,OFFSET(R45C,MAX(-MNR,ROUND(DAYS360(ValDat,RC1,0)/30,0)-R8C+MEP-MNR),0,1,1))) -> 52799 | I85: =IF(RC1="","",IF(OR(R8C<=ROUND(DAYS360(ValDat,RC1,0)/30,0),R8C>ROUND(DAYS360(ExpDat,RC1,0)/30,0)),0,OFFSET(R45C,MAX(-MNR,ROUND(DAYS360(ValDat,RC1,0)/30,0)-R8C+MEP-MNR),0,1,1))) -> 52128 | J85: =IF(RC1="","",IF(OR(R8C<=ROUND(DAYS360(ValDat,RC1,0)/30,0),R8C>ROUND(DAYS360(ExpDat,RC1,0)/30,0)),0,OFFSET(R45C,MAX(-MNR,ROUND(DAYS360(ValDat,RC1,0)/30,0)-R8C+MEP-MNR),0,1,1))) -> 3174 | K85: =IF(RC1="","",IF(OR(R8C<=ROUND(DAYS360(ValDat,RC1,0)/30,0),R8C>ROUND(DAYS360(ExpDat,RC1,0)/30,0)),0,OFFSET(R45C,MAX(-MNR,ROUND(DAYS360(ValDat,RC1,0)/30,0)-R8C+MEP-MNR),0,1,1))) -> 20118 | L85: =IF(RC1="","",IF(OR(R8C<=ROUND(DAYS360(ValDat,RC1,0)/30,0),R8C>ROUND(DAYS360(ExpDat,RC1,0)/30,0)),0,OFFSET(R45C,MAX(-MNR,ROUND(DAYS360(ValDat,RC1,0)/30,0)-R8C+MEP-MNR),0,1,1))) -> 1310 | M85: =IF(RC1="","",IF(OR(R8C<=ROUND(DAYS360(ValDat,RC1,0)/30,0),R8C>ROUND(DAYS360(ExpDat,RC1,0)/30,0)),0,OFFSET(R45C,MAX(-MNR,ROUND(DAYS360(ValDat,RC1,0)/30,0)-R8C+MEP-MNR),0,1,1))) -> 616 | N85: =IF(RC1="","",IF(OR(R8C<=ROUND(DAYS360(ValDat,RC1,0)/30,0),R8C>ROUND(DAYS360(ExpDat,RC1,0)/30,0)),0,OFFSET(R45C,MAX(-MNR,ROUND(DAYS360(ValDat,RC1,0)/30,0)-R8C+MEP-MNR),0,1,1))) -> 954 | O85: =IF(RC1="","",IF(OR(R8C<=ROUND(DAYS360(ValDat,RC1,0)/30,0),R8C>ROUND(DAYS360(ExpDat,RC1,0)/30,0)),0,OFFSET(R45C,MAX(-MNR,ROUND(DAYS360(ValDat,RC1,0)/30,0)-R8C+MEP-MNR),0,1,1))) -> 30 | P85: =IF(RC1="","",IF(OR(R8C<=ROUND(DAYS360(ValDat,RC1,0)/30,0),R8C>ROUND(DAYS360(ExpDat,RC1,0)/30,0)),0,OFFSET(R45C,MAX(-MNR,ROUND(DAYS360(ValDat,RC1,0)/30,0)-R8C+MEP-MNR),0,1,1))) -> 88 | Q85: =IF(RC1="","",IF(OR(R8C<=ROUND(DAYS360(ValDat,RC1,0)/30,0),R8C>ROUND(DAYS360(ExpDat,RC1,0)/30,0)),0,OFFSET(R45C,MAX(-MNR,ROUND(DAYS360(ValDat,RC1,0)/30,0)-R8C+MEP-MNR),0,1,1))) -> 442 | R85: =IF(RC1="","",IF(OR(R8C<=ROUND(DAYS360(ValDat,RC1,0)/30,0),R8C>ROUND(DAYS360(ExpDat,RC1,0)/30,0)),0,OFFSET(R45C,MAX(-MNR,ROUND(DAYS360(ValDat,RC1,0)/30,0)-R8C+MEP-MNR),0,1,1))) -> 900 | S85: =IF(RC1="","",IF(OR(R8C<=ROUND(DAYS360(ValDat,RC1,0)/30,0),R8C>ROUND(DAYS360(ExpDat,RC1,0)/30,0)),0,OFFSET(R45C,MAX(-MNR,ROUND(DAYS360(ValDat,RC1,0)/30,0)-R8C+MEP-MNR),0,1,1))) -> 85 | T85: =IF(RC1="","",IF(OR(R8C<=ROUND(DAYS360(ValDat,RC1,0)/30,0),R8C>ROUND(DAYS360(ExpDat,RC1,0)/30,0)),0,OFFSET(R45C,MAX(-MNR,ROUND(DAYS360(ValDat,RC1,0)/30,0)-R8C+MEP-MNR),0,1,1))) -> 0 | U85: =IF(RC1="","",IF(OR(R8C<=ROUND(DAYS360(ValDat,RC1,0)/30,0),R8C>ROUND(DAYS360(ExpDat,RC1,0)/30,0)),0,OFFSET(R45C,MAX(-MNR,ROUND(DAYS360(ValDat,RC1,0)/30,0)-R8C+MEP-MNR),0,1,1))) -> 0 | V85: =IF(RC1="","",IF(OR(R8C<=ROUND(DAYS360(ValDat,RC1,0)/30,0),R8C>ROUND(DAYS360(ExpDat,RC1,0)/30,0)),0,OFFSET(R45C,MAX(-MNR,ROUND(DAYS360(ValDat,RC1,0)/30,0)-R8C+MEP-MNR),0,1,1))) -> 0 | W85: =IF(RC1="","",IF(OR(R8C<=ROUND(DAYS360(ValDat,RC1,0)/30,0),R8C>ROUND(DAYS360(ExpDat,RC1,0)/30,0)),0,OFFSET(R45C,MAX(-MNR,ROUND(DAYS360(ValDat,RC1,0)/30,0)-R8C+MEP-MNR),0,1,1))) -> 0 | X85: =IF(RC1="","",IF(OR(R8C<=ROUND(DAYS360(ValDat,RC1,0)/30,0),R8C>ROUND(DAYS360(ExpDat,RC1,0)/30,0)),0,OFFSET(R45C,MAX(-MNR,ROUND(DAYS360(ValDat,RC1,0)/30,0)-R8C+MEP-MNR),0,1,1))) -> 0 | Y85: =IF(RC1="","",IF(OR(R8C<=ROUND(DAYS360(ValDat,RC1,0)/30,0),R8C>ROUND(DAYS360(ExpDat,RC1,0)/30,0)),0,OFFSET(R45C,MAX(-MNR,ROUND(DAYS360(ValDat,RC1,0)/30,0)-R8C+MEP-MNR),0,1,1))) -> 0 | Z85: =IF(RC1="","",IF(OR(R8C<=ROUND(DAYS360(ValDat,RC1,0)/30,0),R8C>ROUND(DAYS360(ExpDat,RC1,0)/30,0)),0,OFFSET(R45C,MAX(-MNR,ROUND(DAYS360(ValDat,RC1,0)/30,0)-R8C+MEP-MNR),0,1,1))) -> 0 | AA85: =IF(RC1="","",IF(OR(R8C<=ROUND(DAYS360(ValDat,RC1,0)/30,0),R8C>ROUND(DAYS360(ExpDat,RC1,0)/30,0)),0,OFFSET(R45C,MAX(-MNR,ROUND(DAYS360(ValDat,RC1,0)/30,0)-R8C+MEP-MNR),0,1,1))) -> 0 | AB85: =IF(RC1="","",IF(OR(R8C<=ROUND(DAYS360(ValDat,RC1,0)/30,0),R8C>ROUND(DAYS360(ExpDat,RC1,0)/30,0)),0,OFFSET(R45C,MAX(-MNR,ROUND(DAYS360(ValDat,RC1,0)/30,0)-R8C+MEP-MNR),0,1,1))) -> 0 | AC85: =IF(RC1="","",IF(OR(R8C<=ROUND(DAYS360(ValDat,RC1,0)/30,0),R8C>ROUND(DAYS360(ExpDat,RC1,0)/30,0)),0,OFFSET(R45C,MAX(-MNR,ROUND(DAYS360(ValDat,RC1,0)/30,0)-R8C+MEP-MNR),0,1,1))) -> 0 | AD85: =IF(RC1="","",IF(OR(R8C<=ROUND(DAYS360(ValDat,RC1,0)/30,0),R8C>ROUND(DAYS360(ExpDat,RC1,0)/30,0)),0,OFFSET(R45C,MAX(-MNR,ROUND(DAYS360(ValDat,RC1,0)/30,0)-R8C+MEP-MNR),0,1,1))) -> 0 | AE85: =IF(RC1="","",IF(OR(R8C<=ROUND(DAYS360(ValDat,RC1,0)/30,0),R8C>ROUND(DAYS360(ExpDat,RC1,0)/30,0)),0,OFFSET(R45C,MAX(-MNR,ROUND(DAYS360(ValDat,RC1,0)/30,0)-R8C+MEP-MNR),0,1,1))) -> 0 | AF85: =IF(RC1="","",IF(OR(R8C<=ROUND(DAYS360(ValDat,RC1,0)/30,0),R8C>ROUND(DAYS360(ExpDat,RC1,0)/30,0)),0,OFFSET(R45C,MAX(-MNR,ROUND(DAYS360(ValDat,RC1,0)/30,0)-R8C+MEP-MNR),0,1,1))) -> 0 | AG85: =IF(RC1="","",IF(OR(R8C<=ROUND(DAYS360(ValDat,RC1,0)/30,0),R8C>ROUND(DAYS360(ExpDat,RC1,0)/30,0)),0,OFFSET(R45C,MAX(-MNR,ROUND(DAYS360(ValDat,RC1,0)/30,0)-R8C+MEP-MNR),0,1,1))) -> 0 | AH85: =IF(RC1="","",IF(OR(R8C<=ROUND(DAYS360(ValDat,RC1,0)/30,0),R8C>ROUND(DAYS360(ExpDat,RC1,0)/30,0)),0,OFFSET(R45C,MAX(-MNR,ROUND(DAYS360(ValDat,RC1,0)/30,0)-R8C+MEP-MNR),0,1,1))) -> 0 | AI85: =IF(RC1="","",IF(OR(R8C<=ROUND(DAYS360(ValDat,RC1,0)/30,0),R8C>ROUND(DAYS360(ExpDat,RC1,0)/30,0)),0,OFFSET(R45C,MAX(-MNR,ROUND(DAYS360(ValDat,RC1,0)/30,0)-R8C+MEP-MNR),0,1,1))) -> 0 | AJ85: =IF(RC1="","",IF(OR(R8C<=ROUND(DAYS360(ValDat,RC1,0)/30,0),R8C>ROUND(DAYS360(ExpDat,RC1,0)/30,0)),0,OFFSET(R45C,MAX(-MNR,ROUND(DAYS360(ValDat,RC1,0)/30,0)-R8C+MEP-MNR),0,1,1))) -> 0 | AK85: =IF(RC1="","",IF(OR(R8C<=ROUND(DAYS360(ValDat,RC1,0)/30,0),R8C>ROUND(DAYS360(ExpDat,RC1,0)/30,0)),0,OFFSET(R45C,MAX(-MNR,ROUND(DAYS360(ValDat,RC1,0)/30,0)-R8C+MEP-MNR),0,1,1))) -> 0 | AL85: =IF(RC1="","",IF(OR(R8C<=ROUND(DAYS360(ValDat,RC1,0)/30,0),R8C>ROUND(DAYS360(ExpDat,RC1,0)/30,0)),0,OFFSET(R45C,MAX(-MNR,ROUND(DAYS360(ValDat,RC1,0)/30,0)-R8C+MEP-MNR),0,1,1))) -> 0 | AM85: =IF(RC1="","",IF(OR(R8C<=ROUND(DAYS360(ValDat,RC1,0)/30,0),R8C>ROUND(DAYS360(ExpDat,RC1,0)/30,0)),0,OFFSET(R45C,MAX(-MNR,ROUND(DAYS360(ValDat,RC1,0)/30,0)-R8C+MEP-MNR),0,1,1))) -> 0 | AN85: =IF(RC1="","",IF(OR(R8C<=ROUND(DAYS360(ValDat,RC1,0)/30,0),R8C>ROUND(DAYS360(ExpDat,RC1,0)/30,0)),0,OFFSET(R45C,MAX(-MNR,ROUND(DAYS360(ValDat,RC1,0)/30,0)-R8C+MEP-MNR),0,1,1))) -> 0 | AO85: =IF(RC1="","",IF(OR(R8C<=ROUND(DAYS360(ValDat,RC1,0)/30,0),R8C>ROUND(DAYS360(ExpDat,RC1,0)/30,0)),0,OFFSET(R45C,MAX(-MNR,ROUND(DAYS360(ValDat,RC1,0)/30,0)-R8C+MEP-MNR),0,1,1))) -> 0
A86: =IF(R[-1]C="","",IF(DATE(YEAR(R[-1]C),MONTH(R[-1]C)+1,1)>RunDat,"",DATE(YEAR(R[-1]C),MONTH(R[-1]C)+1,1))) -> 2000-12-01T00:00:00.000 | D86: =IF(RC1="","",SUM(RC[2]:RC[37])) -> 216483 | F86: =IF(RC1="","",IF(OR(R8C<=ROUND(DAYS360(ValDat,RC1,0)/30,0),R8C>ROUND(DAYS360(ExpDat,RC1,0)/30,0)),0,OFFSET(R45C,MAX(-MNR,ROUND(DAYS360(ValDat,RC1,0)/30,0)-R8C+MEP-MNR),0,1,1))) -> 5402 | G86: =IF(RC1="","",IF(OR(R8C<=ROUND(DAYS360(ValDat,RC1,0)/30,0),R8C>ROUND(DAYS360(ExpDat,RC1,0)/30,0)),0,OFFSET(R45C,MAX(-MNR,ROUND(DAYS360(ValDat,RC1,0)/30,0)-R8C+MEP-MNR),0,1,1))) -> 78051 | H86: =IF(RC1="","",IF(OR(R8C<=ROUND(DAYS360(ValDat,RC1,0)/30,0),R8C>ROUND(DAYS360(ExpDat,RC1,0)/30,0)),0,OFFSET(R45C,MAX(-MNR,ROUND(DAYS360(ValDat,RC1,0)/30,0)-R8C+MEP-MNR),0,1,1))) -> 38342 | I86: =IF(RC1="","",IF(OR(R8C<=ROUND(DAYS360(ValDat,RC1,0)/30,0),R8C>ROUND(DAYS360(ExpDat,RC1,0)/30,0)),0,OFFSET(R45C,MAX(-MNR,ROUND(DAYS360(ValDat,RC1,0)/30,0)-R8C+MEP-MNR),0,1,1))) -> 53458 | J86: =IF(RC1="","",IF(OR(R8C<=ROUND(DAYS360(ValDat,RC1,0)/30,0),R8C>ROUND(DAYS360(ExpDat,RC1,0)/30,0)),0,OFFSET(R45C,MAX(-MNR,ROUND(DAYS360(ValDat,RC1,0)/30,0)-R8C+MEP-MNR),0,1,1))) -> 14870 | K86: =IF(RC1="","",IF(OR(R8C<=ROUND(DAYS360(ValDat,RC1,0)/30,0),R8C>ROUND(DAYS360(ExpDat,RC1,0)/30,0)),0,OFFSET(R45C,MAX(-MNR,ROUND(DAYS360(ValDat,RC1,0)/30,0)-R8C+MEP-MNR),0,1,1))) -> 17865 | L86: =IF(RC1="","",IF(OR(R8C<=ROUND(DAYS360(ValDat,RC1,0)/30,0),R8C>ROUND(DAYS360(ExpDat,RC1,0)/30,0)),0,OFFSET(R45C,MAX(-MNR,ROUND(DAYS360(ValDat,RC1,0)/30,0)-R8C+MEP-MNR),0,1,1))) -> 5661 | M86: =IF(RC1="","",IF(OR(R8C<=ROUND(DAYS360(ValDat,RC1,0)/30,0),R8C>ROUND(DAYS360(ExpDat,RC1,0)/30,0)),0,OFFSET(R45C,MAX(-MNR,ROUND(DAYS360(ValDat,RC1,0)/30,0)-R8C+MEP-MNR),0,1,1))) -> 107 | N86: =IF(RC1="","",IF(OR(R8C<=ROUND(DAYS360(ValDat,RC1,0)/30,0),R8C>ROUND(DAYS360(ExpDat,RC1,0)/30,0)),0,OFFSET(R45C,MAX(-MNR,ROUND(DAYS360(ValDat,RC1,0)/30,0)-R8C+MEP-MNR),0,1,1))) -> 53 | O86: =IF(RC1="","",IF(OR(R8C<=ROUND(DAYS360(ValDat,RC1,0)/30,0),R8C>ROUND(DAYS360(ExpDat,RC1,0)/30,0)),0,OFFSET(R45C,MAX(-MNR,ROUND(DAYS360(ValDat,RC1,0)/30,0)-R8C+MEP-MNR),0,1,1))) -> 30 | P86: =IF(RC1="","",IF(OR(R8C<=ROUND(DAYS360(ValDat,RC1,0)/30,0),R8C>ROUND(DAYS360(ExpDat,RC1,0)/30,0)),0,OFFSET(R45C,MAX(-MNR,ROUND(DAYS360(ValDat,RC1,0)/30,0)-R8C+MEP-MNR),0,1,1))) -> 0 | Q86: =IF(RC1="","",IF(OR(R8C<=ROUND(DAYS360(ValDat,RC1,0)/30,0),R8C>ROUND(DAYS360(ExpDat,RC1,0)/30,0)),0,OFFSET(R45C,MAX(-MNR,ROUND(DAYS360(ValDat,RC1,0)/30,0)-R8C+MEP-MNR),0,1,1))) -> 538 | R86: =IF(RC1="","",IF(OR(R8C<=ROUND(DAYS360(ValDat,RC1,0)/30,0),R8C>ROUND(DAYS360(ExpDat,RC1,0)/30,0)),0,OFFSET(R45C,MAX(-MNR,ROUND(DAYS360(ValDat,RC1,0)/30,0)-R8C+MEP-MNR),0,1,1))) -> 561 | S86: =IF(RC1="","",IF(OR(R8C<=ROUND(DAYS360(ValDat,RC1,0)/30,0),R8C>ROUND(DAYS360(ExpDat,RC1,0)/30,0)),0,OFFSET(R45C,MAX(-MNR,ROUND(DAYS360(ValDat,RC1,0)/30,0)-R8C+MEP-MNR),0,1,1))) -> 85 | T86: =IF(RC1="","",IF(OR(R8C<=ROUND(DAYS360(ValDat,RC1,0)/30,0),R8C>ROUND(DAYS360(ExpDat,RC1,0)/30,0)),0,OFFSET(R45C,MAX(-MNR,ROUND(DAYS360(ValDat,RC1,0)/30,0)-R8C+MEP-MNR),0,1,1))) -> 1460 | U86: =IF(RC1="","",IF(OR(R8C<=ROUND(DAYS360(ValDat,RC1,0)/30,0),R8C>ROUND(DAYS360(ExpDat,RC1,0)/30,0)),0,OFFSET(R45C,MAX(-MNR,ROUND(DAYS360(ValDat,RC1,0)/30,0)-R8C+MEP-MNR),0,1,1))) -> 0 | V86: =IF(RC1="","",IF(OR(R8C<=ROUND(DAYS360(ValDat,RC1,0)/30,0),R8C>ROUND(DAYS360(ExpDat,RC1,0)/30,0)),0,OFFSET(R45C,MAX(-MNR,ROUND(DAYS360(ValDat,RC1,0)/30,0)-R8C+MEP-MNR),0,1,1))) -> 0 | W86: =IF(RC1="","",IF(OR(R8C<=ROUND(DAYS360(ValDat,RC1,0)/30,0),R8C>ROUND(DAYS360(ExpDat,RC1,0)/30,0)),0,OFFSET(R45C,MAX(-MNR,ROUND(DAYS360(ValDat,RC1,0)/30,0)-R8C+MEP-MNR),0,1,1))) -> 0 | X86: =IF(RC1="","",IF(OR(R8C<=ROUND(DAYS360(ValDat,RC1,0)/30,0),R8C>ROUND(DAYS360(ExpDat,RC1,0)/30,0)),0,OFFSET(R45C,MAX(-MNR,ROUND(DAYS360(ValDat,RC1,0)/30,0)-R8C+MEP-MNR),0,1,1))) -> 0 | Y86: =IF(RC1="","",IF(OR(R8C<=ROUND(DAYS360(ValDat,RC1,0)/30,0),R8C>ROUND(DAYS360(ExpDat,RC1,0)/30,0)),0,OFFSET(R45C,MAX(-MNR,ROUND(DAYS360(ValDat,RC1,0)/30,0)-R8C+MEP-MNR),0,1,1))) -> 0 | Z86: =IF(RC1="","",IF(OR(R8C<=ROUND(DAYS360(ValDat,RC1,0)/30,0),R8C>ROUND(DAYS360(ExpDat,RC1,0)/30,0)),0,OFFSET(R45C,MAX(-MNR,ROUND(DAYS360(ValDat,RC1,0)/30,0)-R8C+MEP-MNR),0,1,1))) -> 0 | AA86: =IF(RC1="","",IF(OR(R8C<=ROUND(DAYS360(ValDat,RC1,0)/30,0),R8C>ROUND(DAYS360(ExpDat,RC1,0)/30,0)),0,OFFSET(R45C,MAX(-MNR,ROUND(DAYS360(ValDat,RC1,0)/30,0)-R8C+MEP-MNR),0,1,1))) -> 0 | AB86: =IF(RC1="","",IF(OR(R8C<=ROUND(DAYS360(ValDat,RC1,0)/30,0),R8C>ROUND(DAYS360(ExpDat,RC1,0)/30,0)),0,OFFSET(R45C,MAX(-MNR,ROUND(DAYS360(ValDat,RC1,0)/30,0)-R8C+MEP-MNR),0,1,1))) -> 0 | AC86: =IF(RC1="","",IF(OR(R8C<=ROUND(DAYS360(ValDat,RC1,0)/30,0),R8C>ROUND(DAYS360(ExpDat,RC1,0)/30,0)),0,OFFSET(R45C,MAX(-MNR,ROUND(DAYS360(ValDat,RC1,0)/30,0)-R8C+MEP-MNR),0,1,1))) -> 0 | AD86: =IF(RC1="","",IF(OR(R8C<=ROUND(DAYS360(ValDat,RC1,0)/30,0),R8C>ROUND(DAYS360(ExpDat,RC1,0)/30,0)),0,OFFSET(R45C,MAX(-MNR,ROUND(DAYS360(ValDat,RC1,0)/30,0)-R8C+MEP-MNR),0,1,1))) -> 0 | AE86: =IF(RC1="","",IF(OR(R8C<=ROUND(DAYS360(ValDat,RC1,0)/30,0),R8C>ROUND(DAYS360(ExpDat,RC1,0)/30,0)),0,OFFSET(R45C,MAX(-MNR,ROUND(DAYS360(ValDat,RC1,0)/30,0)-R8C+MEP-MNR),0,1,1))) -> 0 | AF86: =IF(RC1="","",IF(OR(R8C<=ROUND(DAYS360(ValDat,RC1,0)/30,0),R8C>ROUND(DAYS360(ExpDat,RC1,0)/30,0)),0,OFFSET(R45C,MAX(-MNR,ROUND(DAYS360(ValDat,RC1,0)/30,0)-R8C+MEP-MNR),0,1,1))) -> 0 | AG86: =IF(RC1="","",IF(OR(R8C<=ROUND(DAYS360(ValDat,RC1,0)/30,0),R8C>ROUND(DAYS360(ExpDat,RC1,0)/30,0)),0,OFFSET(R45C,MAX(-MNR,ROUND(DAYS360(ValDat,RC1,0)/30,0)-R8C+MEP-MNR),0,1,1))) -> 0 | AH86: =IF(RC1="","",IF(OR(R8C<=ROUND(DAYS360(ValDat,RC1,0)/30,0),R8C>ROUND(DAYS360(ExpDat,RC1,0)/30,0)),0,OFFSET(R45C,MAX(-MNR,ROUND(DAYS360(ValDat,RC1,0)/30,0)-R8C+MEP-MNR),0,1,1))) -> 0 | AI86: =IF(RC1="","",IF(OR(R8C<=ROUND(DAYS360(ValDat,RC1,0)/30,0),R8C>ROUND(DAYS360(ExpDat,RC1,0)/30,0)),0,OFFSET(R45C,MAX(-MNR,ROUND(DAYS360(ValDat,RC1,0)/30,0)-R8C+MEP-MNR),0,1,1))) -> 0 | AJ86: =IF(RC1="","",IF(OR(R8C<=ROUND(DAYS360(ValDat,RC1,0)/30,0),R8C>ROUND(DAYS360(ExpDat,RC1,0)/30,0)),0,OFFSET(R45C,MAX(-MNR,ROUND(DAYS360(ValDat,RC1,0)/30,0)-R8C+MEP-MNR),0,1,1))) -> 0 | AK86: =IF(RC1="","",IF(OR(R8C<=ROUND(DAYS360(ValDat,RC1,0)/30,0),R8C>ROUND(DAYS360(ExpDat,RC1,0)/30,0)),0,OFFSET(R45C,MAX(-MNR,ROUND(DAYS360(ValDat,RC1,0)/30,0)-R8C+MEP-MNR),0,1,1))) -> 0 | AL86: =IF(RC1="","",IF(OR(R8C<=ROUND(DAYS360(ValDat,RC1,0)/30,0),R8C>ROUND(DAYS360(ExpDat,RC1,0)/30,0)),0,OFFSET(R45C,MAX(-MNR,ROUND(DAYS360(ValDat,RC1,0)/30,0)-R8C+MEP-MNR),0,1,1))) -> 0 | AM86: =IF(RC1="","",IF(OR(R8C<=ROUND(DAYS360(ValDat,RC1,0)/30,0),R8C>ROUND(DAYS360(ExpDat,RC1,0)/30,0)),0,OFFSET(R45C,MAX(-MNR,ROUND(DAYS360(ValDat,RC1,0)/30,0)-R8C+MEP-MNR),0,1,1))) -> 0 | AN86: =IF(RC1="","",IF(OR(R8C<=ROUND(DAYS360(ValDat,RC1,0)/30,0),R8C>ROUND(DAYS360(ExpDat,RC1,0)/30,0)),0,OFFSET(R45C,MAX(-MNR,ROUND(DAYS360(ValDat,RC1,0)/30,0)-R8C+MEP-MNR),0,1,1))) -> 0 | AO86: =IF(RC1="","",IF(OR(R8C<=ROUND(DAYS360(ValDat,RC1,0)/30,0),R8C>ROUND(DAYS360(ExpDat,RC1,0)/30,0)),0,OFFSET(R45C,MAX(-MNR,ROUND(DAYS360(ValDat,RC1,0)/30,0)-R8C+MEP-MNR),0,1,1))) -> 0
A87: =IF(R[-1]C="","",IF(DATE(YEAR(R[-1]C),MONTH(R[-1]C)+1,1)>RunDat,"",DATE(YEAR(R[-1]C),MONTH(R[-1]C)+1,1))) -> 2001-01-01T00:00:00.000 | D87: =IF(RC1="","",SUM(RC[2]:RC[37])) -> 166798 | F87: =IF(RC1="","",IF(OR(R8C<=ROUND(DAYS360(ValDat,RC1,0)/30,0),R8C>ROUND(DAYS360(ExpDat,RC1,0)/30,0)),0,OFFSET(R45C,MAX(-MNR,ROUND(DAYS360(ValDat,RC1,0)/30,0)-R8C+MEP-MNR),0,1,1))) -> 15456 | G87: =IF(RC1="","",IF(OR(R8C<=ROUND(DAYS360(ValDat,RC1,0)/30,0),R8C>ROUND(DAYS360(ExpDat,RC1,0)/30,0)),0,OFFSET(R45C,MAX(-MNR,ROUND(DAYS360(ValDat,RC1,0)/30,0)-R8C+MEP-MNR),0,1,1))) -> 16943 | H87: =IF(RC1="","",IF(OR(R8C<=ROUND(DAYS360(ValDat,RC1,0)/30,0),R8C>ROUND(DAYS360(ExpDat,RC1,0)/30,0)),0,OFFSET(R45C,MAX(-MNR,ROUND(DAYS360(ValDat,RC1,0)/30,0)-R8C+MEP-MNR),0,1,1))) -> 32446 | I87: =IF(RC1="","",IF(OR(R8C<=ROUND(DAYS360(ValDat,RC1,0)/30,0),R8C>ROUND(DAYS360(ExpDat,RC1,0)/30,0)),0,OFFSET(R45C,MAX(-MNR,ROUND(DAYS360(ValDat,RC1,0)/30,0)-R8C+MEP-MNR),0,1,1))) -> 59896 | J87: =IF(RC1="","",IF(OR(R8C<=ROUND(DAYS360(ValDat,RC1,0)/30,0),R8C>ROUND(DAYS360(ExpDat,RC1,0)/30,0)),0,OFFSET(R45C,MAX(-MNR,ROUND(DAYS360(ValDat,RC1,0)/30,0)-R8C+MEP-MNR),0,1,1))) -> 8807 | K87: =IF(RC1="","",IF(OR(R8C<=ROUND(DAYS360(ValDat,RC1,0)/30,0),R8C>ROUND(DAYS360(ExpDat,RC1,0)/30,0)),0,OFFSET(R45C,MAX(-MNR,ROUND(DAYS360(ValDat,RC1,0)/30,0)-R8C+MEP-MNR),0,1,1))) -> 3898 | L87: =IF(RC1="","",IF(OR(R8C<=ROUND(DAYS360(ValDat,RC1,0)/30,0),R8C>ROUND(DAYS360(ExpDat,RC1,0)/30,0)),0,OFFSET(R45C,MAX(-MNR,ROUND(DAYS360(ValDat,RC1,0)/30,0)-R8C+MEP-MNR),0,1,1))) -> 5653 | M87: =IF(RC1="","",IF(OR(R8C<=ROUND(DAYS360(ValDat,RC1,0)/30,0),R8C>ROUND(DAYS360(ExpDat,RC1,0)/30,0)),0,OFFSET(R45C,MAX(-MNR,ROUND(DAYS360(ValDat,RC1,0)/30,0)-R8C+MEP-MNR),0,1,1))) -> 21364 | N87: =IF(RC1="","",IF(OR(R8C<=ROUND(DAYS360(ValDat,RC1,0)/30,0),R8C>ROUND(DAYS360(ExpDat,RC1,0)/30,0)),0,OFFSET(R45C,MAX(-MNR,ROUND(DAYS360(ValDat,RC1,0)/30,0)-R8C+MEP-MNR),0,1,1))) -> 20 | O87: =IF(RC1="","",IF(OR(R8C<=ROUND(DAYS360(ValDat,RC1,0)/30,0),R8C>ROUND(DAYS360(ExpDat,RC1,0)/30,0)),0,OFFSET(R45C,MAX(-MNR,ROUND(DAYS360(ValDat,RC1,0)/30,0)-R8C+MEP-MNR),0,1,1))) -> 168 | P87: =IF(RC1="","",IF(OR(R8C<=ROUND(DAYS360(ValDat,RC1,0)/30,0),R8C>ROUND(DAYS360(ExpDat,RC1,0)/30,0)),0,OFFSET(R45C,MAX(-MNR,ROUND(DAYS360(ValDat,RC1,0)/30,0)-R8C+MEP-MNR),0,1,1))) -> 0 | Q87: =IF(RC1="","",IF(OR(R8C<=ROUND(DAYS360(ValDat,RC1,0)/30,0),R8C>ROUND(DAYS360(ExpDat,RC1,0)/30,0)),0,OFFSET(R45C,MAX(-MNR,ROUND(DAYS360(ValDat,RC1,0)/30,0)-R8C+MEP-MNR),0,1,1))) -> 0 | R87: =IF(RC1="","",IF(OR(R8C<=ROUND(DAYS360(ValDat,RC1,0)/30,0),R8C>ROUND(DAYS360(ExpDat,RC1,0)/30,0)),0,OFFSET(R45C,MAX(-MNR,ROUND(DAYS360(ValDat,RC1,0)/30,0)-R8C+MEP-MNR),0,1,1))) -> 508 | S87: =IF(RC1="","",IF(OR(R8C<=ROUND(DAYS360(ValDat,RC1,0)/30,0),R8C>ROUND(DAYS360(ExpDat,RC1,0)/30,0)),0,OFFSET(R45C,MAX(-MNR,ROUND(DAYS360(ValDat,RC1,0)/30,0)-R8C+MEP-MNR),0,1,1))) -> 179 | T87: =IF(RC1="","",IF(OR(R8C<=ROUND(DAYS360(ValDat,RC1,0)/30,0),R8C>ROUND(DAYS360(ExpDat,RC1,0)/30,0)),0,OFFSET(R45C,MAX(-MNR,ROUND(DAYS360(ValDat,RC1,0)/30,0)-R8C+MEP-MNR),0,1,1))) -> 1460 | U87: =IF(RC1="","",IF(OR(R8C<=ROUND(DAYS360(ValDat,RC1,0)/30,0),R8C>ROUND(DAYS360(ExpDat,RC1,0)/30,0)),0,OFFSET(R45C,MAX(-MNR,ROUND(DAYS360(ValDat,RC1,0)/30,0)-R8C+MEP-MNR),0,1,1))) -> 0 | V87: =IF(RC1="","",IF(OR(R8C<=ROUND(DAYS360(ValDat,RC1,0)/30,0),R8C>ROUND(DAYS360(ExpDat,RC1,0)/30,0)),0,OFFSET(R45C,MAX(-MNR,ROUND(DAYS360(ValDat,RC1,0)/30,0)-R8C+MEP-MNR),0,1,1))) -> 0 | W87: =IF(RC1="","",IF(OR(R8C<=ROUND(DAYS360(ValDat,RC1,0)/30,0),R8C>ROUND(DAYS360(ExpDat,RC1,0)/30,0)),0,OFFSET(R45C,MAX(-MNR,ROUND(DAYS360(ValDat,RC1,0)/30,0)-R8C+MEP-MNR),0,1,1))) -> 0 | X87: =IF(RC1="","",IF(OR(R8C<=ROUND(DAYS360(ValDat,RC1,0)/30,0),R8C>ROUND(DAYS360(ExpDat,RC1,0)/30,0)),0,OFFSET(R45C,MAX(-MNR,ROUND(DAYS360(ValDat,RC1,0)/30,0)-R8C+MEP-MNR),0,1,1))) -> 0 | Y87: =IF(RC1="","",IF(OR(R8C<=ROUND(DAYS360(ValDat,RC1,0)/30,0),R8C>ROUND(DAYS360(ExpDat,RC1,0)/30,0)),0,OFFSET(R45C,MAX(-MNR,ROUND(DAYS360(ValDat,RC1,0)/30,0)-R8C+MEP-MNR),0,1,1))) -> 0 | Z87: =IF(RC1="","",IF(OR(R8C<=ROUND(DAYS360(ValDat,RC1,0)/30,0),R8C>ROUND(DAYS360(ExpDat,RC1,0)/30,0)),0,OFFSET(R45C,MAX(-MNR,ROUND(DAYS360(ValDat,RC1,0)/30,0)-R8C+MEP-MNR),0,1,1))) -> 0 | AA87: =IF(RC1="","",IF(OR(R8C<=ROUND(DAYS360(ValDat,RC1,0)/30,0),R8C>ROUND(DAYS360(ExpDat,RC1,0)/30,0)),0,OFFSET(R45C,MAX(-MNR,ROUND(DAYS360(ValDat,RC1,0)/30,0)-R8C+MEP-MNR),0,1,1))) -> 0 | AB87: =IF(RC1="","",IF(OR(R8C<=ROUND(DAYS360(ValDat,RC1,0)/30,0),R8C>ROUND(DAYS360(ExpDat,RC1,0)/30,0)),0,OFFSET(R45C,MAX(-MNR,ROUND(DAYS360(ValDat,RC1,0)/30,0)-R8C+MEP-MNR),0,1,1))) -> 0 | AC87: =IF(RC1="","",IF(OR(R8C<=ROUND(DAYS360(ValDat,RC1,0)/30,0),R8C>ROUND(DAYS360(ExpDat,RC1,0)/30,0)),0,OFFSET(R45C,MAX(-MNR,ROUND(DAYS360(ValDat,RC1,0)/30,0)-R8C+MEP-MNR),0,1,1))) -> 0 | AD87: =IF(RC1="","",IF(OR(R8C<=ROUND(DAYS360(ValDat,RC1,0)/30,0),R8C>ROUND(DAYS360(ExpDat,RC1,0)/30,0)),0,OFFSET(R45C,MAX(-MNR,ROUND(DAYS360(ValDat,RC1,0)/30,0)-R8C+MEP-MNR),0,1,1))) -> 0 | AE87: =IF(RC1="","",IF(OR(R8C<=ROUND(DAYS360(ValDat,RC1,0)/30,0),R8C>ROUND(DAYS360(ExpDat,RC1,0)/30,0)),0,OFFSET(R45C,MAX(-MNR,ROUND(DAYS360(ValDat,RC1,0)/30,0)-R8C+MEP-MNR),0,1,1))) -> 0 | AF87: =IF(RC1="","",IF(OR(R8C<=ROUND(DAYS360(ValDat,RC1,0)/30,0),R8C>ROUND(DAYS360(ExpDat,RC1,0)/30,0)),0,OFFSET(R45C,MAX(-MNR,ROUND(DAYS360(ValDat,RC1,0)/30,0)-R8C+MEP-MNR),0,1,1))) -> 0 | AG87: =IF(RC1="","",IF(OR(R8C<=ROUND(DAYS360(ValDat,RC1,0)/30,0),R8C>ROUND(DAYS360(ExpDat,RC1,0)/30,0)),0,OFFSET(R45C,MAX(-MNR,ROUND(DAYS360(ValDat,RC1,0)/30,0)-R8C+MEP-MNR),0,1,1))) -> 0 | AH87: =IF(RC1="","",IF(OR(R8C<=ROUND(DAYS360(ValDat,RC1,0)/30,0),R8C>ROUND(DAYS360(ExpDat,RC1,0)/30,0)),0,OFFSET(R45C,MAX(-MNR,ROUND(DAYS360(ValDat,RC1,0)/30,0)-R8C+MEP-MNR),0,1,1))) -> 0 | AI87: =IF(RC1="","",IF(OR(R8C<=ROUND(DAYS360(ValDat,RC1,0)/30,0),R8C>ROUND(DAYS360(ExpDat,RC1,0)/30,0)),0,OFFSET(R45C,MAX(-MNR,ROUND(DAYS360(ValDat,RC1,0)/30,0)-R8C+MEP-MNR),0,1,1))) -> 0 | AJ87: =IF(RC1="","",IF(OR(R8C<=ROUND(DAYS360(ValDat,RC1,0)/30,0),R8C>ROUND(DAYS360(ExpDat,RC1,0)/30,0)),0,OFFSET(R45C,MAX(-MNR,ROUND(DAYS360(ValDat,RC1,0)/30,0)-R8C+MEP-MNR),0,1,1))) -> 0 | AK87: =IF(RC1="","",IF(OR(R8C<=ROUND(DAYS360(ValDat,RC1,0)/30,0),R8C>ROUND(DAYS360(ExpDat,RC1,0)/30,0)),0,OFFSET(R45C,MAX(-MNR,ROUND(DAYS360(ValDat,RC1,0)/30,0)-R8C+MEP-MNR),0,1,1))) -> 0 | AL87: =IF(RC1="","",IF(OR(R8C<=ROUND(DAYS360(ValDat,RC1,0)/30,0),R8C>ROUND(DAYS360(ExpDat,RC1,0)/30,0)),0,OFFSET(R45C,MAX(-MNR,ROUND(DAYS360(ValDat,RC1,0)/30,0)-R8C+MEP-MNR),0,1,1))) -> 0 | AM87: =IF(RC1="","",IF(OR(R8C<=ROUND(DAYS360(ValDat,RC1,0)/30,0),R8C>ROUND(DAYS360(ExpDat,RC1,0)/30,0)),0,OFFSET(R45C,MAX(-MNR,ROUND(DAYS360(ValDat,RC1,0)/30,0)-R8C+MEP-MNR),0,1,1))) -> 0 | AN87: =IF(RC1="","",IF(OR(R8C<=ROUND(DAYS360(ValDat,RC1,0)/30,0),R8C>ROUND(DAYS360(ExpDat,RC1,0)/30,0)),0,OFFSET(R45C,MAX(-MNR,ROUND(DAYS360(ValDat,RC1,0)/30,0)-R8C+MEP-MNR),0,1,1))) -> 0 | AO87: =IF(RC1="","",IF(OR(R8C<=ROUND(DAYS360(ValDat,RC1,0)/30,0),R8C>ROUND(DAYS360(ExpDat,RC1,0)/30,0)),0,OFFSET(R45C,MAX(-MNR,ROUND(DAYS360(ValDat,RC1,0)/30,0)-R8C+MEP-MNR),0,1,1))) -> 0
A88: =IF(R[-1]C="","",IF(DATE(YEAR(R[-1]C),MONTH(R[-1]C)+1,1)>RunDat,"",DATE(YEAR(R[-1]C),MONTH(R[-1]C)+1,1))) -> 2001-02-01T00:00:00.000 | D88: =IF(RC1="","",SUM(RC[2]:RC[37])) -> 136721 | F88: =IF(RC1="","",IF(OR(R8C<=ROUND(DAYS360(ValDat,RC1,0)/30,0),R8C>ROUND(DAYS360(ExpDat,RC1,0)/30,0)),0,OFFSET(R45C,MAX(-MNR,ROUND(DAYS360(ValDat,RC1,0)/30,0)-R8C+MEP-MNR),0,1,1))) -> 544 | G88: =IF(RC1="","",IF(OR(R8C<=ROUND(DAYS360(ValDat,RC1,0)/30,0),R8C>ROUND(DAYS360(ExpDat,RC1,0)/30,0)),0,OFFSET(R45C,MAX(-MNR,ROUND(DAYS360(ValDat,RC1,0)/30,0)-R8C+MEP-MNR),0,1,1))) -> 19047 | H88: =IF(RC1="","",IF(OR(R8C<=ROUND(DAYS360(ValDat,RC1,0)/30,0),R8C>ROUND(DAYS360(ExpDat,RC1,0)/30,0)),0,OFFSET(R45C,MAX(-MNR,ROUND(DAYS360(ValDat,RC1,0)/30,0)-R8C+MEP-MNR),0,1,1))) -> 34607 | I88: =IF(RC1="","",IF(OR(R8C<=ROUND(DAYS360(ValDat,RC1,0)/30,0),R8C>ROUND(DAYS360(ExpDat,RC1,0)/30,0)),0,OFFSET(R45C,MAX(-MNR,ROUND(DAYS360(ValDat,RC1,0)/30,0)-R8C+MEP-MNR),0,1,1))) -> 30039 | J88: =IF(RC1="","",IF(OR(R8C<=ROUND(DAYS360(ValDat,RC1,0)/30,0),R8C>ROUND(DAYS360(ExpDat,RC1,0)/30,0)),0,OFFSET(R45C,MAX(-MNR,ROUND(DAYS360(ValDat,RC1,0)/30,0)-R8C+MEP-MNR),0,1,1))) -> 12140 | K88: =IF(RC1="","",IF(OR(R8C<=ROUND(DAYS360(ValDat,RC1,0)/30,0),R8C>ROUND(DAYS360(ExpDat,RC1,0)/30,0)),0,OFFSET(R45C,MAX(-MNR,ROUND(DAYS360(ValDat,RC1,0)/30,0)-R8C+MEP-MNR),0,1,1))) -> 2747 | L88: =IF(RC1="","",IF(OR(R8C<=ROUND(DAYS360(ValDat,RC1,0)/30,0),R8C>ROUND(DAYS360(ExpDat,RC1,0)/30,0)),0,OFFSET(R45C,MAX(-MNR,ROUND(DAYS360(ValDat,RC1,0)/30,0)-R8C+MEP-MNR),0,1,1))) -> 15681 | M88: =IF(RC1="","",IF(OR(R8C<=ROUND(DAYS360(ValDat,RC1,0)/30,0),R8C>ROUND(DAYS360(ExpDat,RC1,0)/30,0)),0,OFFSET(R45C,MAX(-MNR,ROUND(DAYS360(ValDat,RC1,0)/30,0)-R8C+MEP-MNR),0,1,1))) -> 21419 | N88: =IF(RC1="","",IF(OR(R8C<=ROUND(DAYS360(ValDat,RC1,0)/30,0),R8C>ROUND(DAYS360(ExpDat,RC1,0)/30,0)),0,OFFSET(R45C,MAX(-MNR,ROUND(DAYS360(ValDat,RC1,0)/30,0)-R8C+MEP-MNR),0,1,1))) -> 159 | O88: =IF(RC1="","",IF(OR(R8C<=ROUND(DAYS360(ValDat,RC1,0)/30,0),R8C>ROUND(DAYS360(ExpDat,RC1,0)/30,0)),0,OFFSET(R45C,MAX(-MNR,ROUND(DAYS360(ValDat,RC1,0)/30,0)-R8C+MEP-MNR),0,1,1))) -> 168 | P88: =IF(RC1="","",IF(OR(R8C<=ROUND(DAYS360(ValDat,RC1,0)/30,0),R8C>ROUND(DAYS360(ExpDat,RC1,0)/30,0)),0,OFFSET(R45C,MAX(-MNR,ROUND(DAYS360(ValDat,RC1,0)/30,0)-R8C+MEP-MNR),0,1,1))) -> 0 | Q88: =IF(RC1="","",IF(OR(R8C<=ROUND(DAYS360(ValDat,RC1,0)/30,0),R8C>ROUND(DAYS360(ExpDat,RC1,0)/30,0)),0,OFFSET(R45C,MAX(-MNR,ROUND(DAYS360(ValDat,RC1,0)/30,0)-R8C+MEP-MNR),0,1,1))) -> 0 | R88: =IF(RC1="","",IF(OR(R8C<=ROUND(DAYS360(ValDat,RC1,0)/30,0),R8C>ROUND(DAYS360(ExpDat,RC1,0)/30,0)),0,OFFSET(R45C,MAX(-MNR,ROUND(DAYS360(ValDat,RC1,0)/30,0)-R8C+MEP-MNR),0,1,1))) -> 0 | S88: =IF(RC1="","",IF(OR(R8C<=ROUND(DAYS360(ValDat,RC1,0)/30,0),R8C>ROUND(DAYS360(ExpDat,RC1,0)/30,0)),0,OFFSET(R45C,MAX(-MNR,ROUND(DAYS360(ValDat,RC1,0)/30,0)-R8C+MEP-MNR),0,1,1))) -> 153 | T88: =IF(RC1="","",IF(OR(R8C<=ROUND(DAYS360(ValDat,RC1,0)/30,0),R8C>ROUND(DAYS360(ExpDat,RC1,0)/30,0)),0,OFFSET(R45C,MAX(-MNR,ROUND(DAYS360(ValDat,RC1,0)/30,0)-R8C+MEP-MNR),0,1,1))) -> 17 | U88: =IF(RC1="","",IF(OR(R8C<=ROUND(DAYS360(ValDat,RC1,0)/30,0),R8C>ROUND(DAYS360(ExpDat,RC1,0)/30,0)),0,OFFSET(R45C,MAX(-MNR,ROUND(DAYS360(ValDat,RC1,0)/30,0)-R8C+MEP-MNR),0,1,1))) -> 0 | V88: =IF(RC1="","",IF(OR(R8C<=ROUND(DAYS360(ValDat,RC1,0)/30,0),R8C>ROUND(DAYS360(ExpDat,RC1,0)/30,0)),0,OFFSET(R45C,MAX(-MNR,ROUND(DAYS360(ValDat,RC1,0)/30,0)-R8C+MEP-MNR),0,1,1))) -> 0 | W88: =IF(RC1="","",IF(OR(R8C<=ROUND(DAYS360(ValDat,RC1,0)/30,0),R8C>ROUND(DAYS360(ExpDat,RC1,0)/30,0)),0,OFFSET(R45C,MAX(-MNR,ROUND(DAYS360(ValDat,RC1,0)/30,0)-R8C+MEP-MNR),0,1,1))) -> 0 | X88: =IF(RC1="","",IF(OR(R8C<=ROUND(DAYS360(ValDat,RC1,0)/30,0),R8C>ROUND(DAYS360(ExpDat,RC1,0)/30,0)),0,OFFSET(R45C,MAX(-MNR,ROUND(DAYS360(ValDat,RC1,0)/30,0)-R8C+MEP-MNR),0,1,1))) -> 0 | Y88: =IF(RC1="","",IF(OR(R8C<=ROUND(DAYS360(ValDat,RC1,0)/30,0),R8C>ROUND(DAYS360(ExpDat,RC1,0)/30,0)),0,OFFSET(R45C,MAX(-MNR,ROUND(DAYS360(ValDat,RC1,0)/30,0)-R8C+MEP-MNR),0,1,1))) -> 0 | Z88: =IF(RC1="","",IF(OR(R8C<=ROUND(DAYS360(ValDat,RC1,0)/30,0),R8C>ROUND(DAYS360(ExpDat,RC1,0)/30,0)),0,OFFSET(R45C,MAX(-MNR,ROUND(DAYS360(ValDat,RC1,0)/30,0)-R8C+MEP-MNR),0,1,1))) -> 0 | AA88: =IF(RC1="","",IF(OR(R8C<=ROUND(DAYS360(ValDat,RC1,0)/30,0),R8C>ROUND(DAYS360(ExpDat,RC1,0)/30,0)),0,OFFSET(R45C,MAX(-MNR,ROUND(DAYS360(ValDat,RC1,0)/30,0)-R8C+MEP-MNR),0,1,1))) -> 0 | AB88: =IF(RC1="","",IF(OR(R8C<=ROUND(DAYS360(ValDat,RC1,0)/30,0),R8C>ROUND(DAYS360(ExpDat,RC1,0)/30,0)),0,OFFSET(R45C,MAX(-MNR,ROUND(DAYS360(ValDat,RC1,0)/30,0)-R8C+MEP-MNR),0,1,1))) -> 0 | AC88: =IF(RC1="","",IF(OR(R8C<=ROUND(DAYS360(ValDat,RC1,0)/30,0),R8C>ROUND(DAYS360(ExpDat,RC1,0)/30,0)),0,OFFSET(R45C,MAX(-MNR,ROUND(DAYS360(ValDat,RC1,0)/30,0)-R8C+MEP-MNR),0,1,1))) -> 0 | AD88: =IF(RC1="","",IF(OR(R8C<=ROUND(DAYS360(ValDat,RC1,0)/30,0),R8C>ROUND(DAYS360(ExpDat,RC1,0)/30,0)),0,OFFSET(R45C,MAX(-MNR,ROUND(DAYS360(ValDat,RC1,0)/30,0)-R8C+MEP-MNR),0,1,1))) -> 0 | AE88: =IF(RC1="","",IF(OR(R8C<=ROUND(DAYS360(ValDat,RC1,0)/30,0),R8C>ROUND(DAYS360(ExpDat,RC1,0)/30,0)),0,OFFSET(R45C,MAX(-MNR,ROUND(DAYS360(ValDat,RC1,0)/30,0)-R8C+MEP-MNR),0,1,1))) -> 0 | AF88: =IF(RC1="","",IF(OR(R8C<=ROUND(DAYS360(ValDat,RC1,0)/30,0),R8C>ROUND(DAYS360(ExpDat,RC1,0)/30,0)),0,OFFSET(R45C,MAX(-MNR,ROUND(DAYS360(ValDat,RC1,0)/30,0)-R8C+MEP-MNR),0,1,1))) -> 0 | AG88: =IF(RC1="","",IF(OR(R8C<=ROUND(DAYS360(ValDat,RC1,0)/30,0),R8C>ROUND(DAYS360(ExpDat,RC1,0)/30,0)),0,OFFSET(R45C,MAX(-MNR,ROUND(DAYS360(ValDat,RC1,0)/30,0)-R8C+MEP-MNR),0,1,1))) -> 0 | AH88: =IF(RC1="","",IF(OR(R8C<=ROUND(DAYS360(ValDat,RC1,0)/30,0),R8C>ROUND(DAYS360(ExpDat,RC1,0)/30,0)),0,OFFSET(R45C,MAX(-MNR,ROUND(DAYS360(ValDat,RC1,0)/30,0)-R8C+MEP-MNR),0,1,1))) -> 0 | AI88: =IF(RC1="","",IF(OR(R8C<=ROUND(DAYS360(ValDat,RC1,0)/30,0),R8C>ROUND(DAYS360(ExpDat,RC1,0)/30,0)),0,OFFSET(R45C,MAX(-MNR,ROUND(DAYS360(ValDat,RC1,0)/30,0)-R8C+MEP-MNR),0,1,1))) -> 0 | AJ88: =IF(RC1="","",IF(OR(R8C<=ROUND(DAYS360(ValDat,RC1,0)/30,0),R8C>ROUND(DAYS360(ExpDat,RC1,0)/30,0)),0,OFFSET(R45C,MAX(-MNR,ROUND(DAYS360(ValDat,RC1,0)/30,0)-R8C+MEP-MNR),0,1,1))) -> 0 | AK88: =IF(RC1="","",IF(OR(R8C<=ROUND(DAYS360(ValDat,RC1,0)/30,0),R8C>ROUND(DAYS360(ExpDat,RC1,0)/30,0)),0,OFFSET(R45C,MAX(-MNR,ROUND(DAYS360(ValDat,RC1,0)/30,0)-R8C+MEP-MNR),0,1,1))) -> 0 | AL88: =IF(RC1="","",IF(OR(R8C<=ROUND(DAYS360(ValDat,RC1,0)/30,0),R8C>ROUND(DAYS360(ExpDat,RC1,0)/30,0)),0,OFFSET(R45C,MAX(-MNR,ROUND(DAYS360(ValDat,RC1,0)/30,0)-R8C+MEP-MNR),0,1,1))) -> 0 | AM88: =IF(RC1="","",IF(OR(R8C<=ROUND(DAYS360(ValDat,RC1,0)/30,0),R8C>ROUND(DAYS360(ExpDat,RC1,0)/30,0)),0,OFFSET(R45C,MAX(-MNR,ROUND(DAYS360(ValDat,RC1,0)/30,0)-R8C+MEP-MNR),0,1,1))) -> 0 | AN88: =IF(RC1="","",IF(OR(R8C<=ROUND(DAYS360(ValDat,RC1,0)/30,0),R8C>ROUND(DAYS360(ExpDat,RC1,0)/30,0)),0,OFFSET(R45C,MAX(-MNR,ROUND(DAYS360(ValDat,RC1,0)/30,0)-R8C+MEP-MNR),0,1,1))) -> 0 | AO88: =IF(RC1="","",IF(OR(R8C<=ROUND(DAYS360(ValDat,RC1,0)/30,0),R8C>ROUND(DAYS360(ExpDat,RC1,0)/30,0)),0,OFFSET(R45C,MAX(-MNR,ROUND(DAYS360(ValDat,RC1,0)/30,0)-R8C+MEP-MNR),0,1,1))) -> 0
A89: =IF(R[-1]C="","",IF(DATE(YEAR(R[-1]C),MONTH(R[-1]C)+1,1)>RunDat,"",DATE(YEAR(R[-1]C),MONTH(R[-1]C)+1,1))) -> 2001-03-01T00:00:00.000 | D89: =IF(RC1="","",SUM(RC[2]:RC[37])) -> 78419 | F89: =IF(RC1="","",IF(OR(R8C<=ROUND(DAYS360(ValDat,RC1,0)/30,0),R8C>ROUND(DAYS360(ExpDat,RC1,0)/30,0)),0,OFFSET(R45C,MAX(-MNR,ROUND(DAYS360(ValDat,RC1,0)/30,0)-R8C+MEP-MNR),0,1,1))) -> 8442 | G89: =IF(RC1="","",IF(OR(R8C<=ROUND(DAYS360(ValDat,RC1,0)/30,0),R8C>ROUND(DAYS360(ExpDat,RC1,0)/30,0)),0,OFFSET(R45C,MAX(-MNR,ROUND(DAYS360(ValDat,RC1,0)/30,0)-R8C+MEP-MNR),0,1,1))) -> 16998 | H89: =IF(RC1="","",IF(OR(R8C<=ROUND(DAYS360(ValDat,RC1,0)/30,0),R8C>ROUND(DAYS360(ExpDat,RC1,0)/30,0)),0,OFFSET(R45C,MAX(-MNR,ROUND(DAYS360(ValDat,RC1,0)/30,0)-R8C+MEP-MNR),0,1,1))) -> 26813 | I89: =IF(RC1="","",IF(OR(R8C<=ROUND(DAYS360(ValDat,RC1,0)/30,0),R8C>ROUND(DAYS360(ExpDat,RC1,0)/30,0)),0,OFFSET(R45C,MAX(-MNR,ROUND(DAYS360(ValDat,RC1,0)/30,0)-R8C+MEP-MNR),0,1,1))) -> 6988 | J89: =IF(RC1="","",IF(OR(R8C<=ROUND(DAYS360(ValDat,RC1,0)/30,0),R8C>ROUND(DAYS360(ExpDat,RC1,0)/30,0)),0,OFFSET(R45C,MAX(-MNR,ROUND(DAYS360(ValDat,RC1,0)/30,0)-R8C+MEP-MNR),0,1,1))) -> 3104 | K89: =IF(RC1="","",IF(OR(R8C<=ROUND(DAYS360(ValDat,RC1,0)/30,0),R8C>ROUND(DAYS360(ExpDat,RC1,0)/30,0)),0,OFFSET(R45C,MAX(-MNR,ROUND(DAYS360(ValDat,RC1,0)/30,0)-R8C+MEP-MNR),0,1,1))) -> 3146 | L89: =IF(RC1="","",IF(OR(R8C<=ROUND(DAYS360(ValDat,RC1,0)/30,0),R8C>ROUND(DAYS360(ExpDat,RC1,0)/30,0)),0,OFFSET(R45C,MAX(-MNR,ROUND(DAYS360(ValDat,RC1,0)/30,0)-R8C+MEP-MNR),0,1,1))) -> 11162 | M89: =IF(RC1="","",IF(OR(R8C<=ROUND(DAYS360(ValDat,RC1,0)/30,0),R8C>ROUND(DAYS360(ExpDat,RC1,0)/30,0)),0,OFFSET(R45C,MAX(-MNR,ROUND(DAYS360(ValDat,RC1,0)/30,0)-R8C+MEP-MNR),0,1,1))) -> 1013 | N89: =IF(RC1="","",IF(OR(R8C<=ROUND(DAYS360(ValDat,RC1,0)/30,0),R8C>ROUND(DAYS360(ExpDat,RC1,0)/30,0)),0,OFFSET(R45C,MAX(-MNR,ROUND(DAYS360(ValDat,RC1,0)/30,0)-R8C+MEP-MNR),0,1,1))) -> 0 | O89: =IF(RC1="","",IF(OR(R8C<=ROUND(DAYS360(ValDat,RC1,0)/30,0),R8C>ROUND(DAYS360(ExpDat,RC1,0)/30,0)),0,OFFSET(R45C,MAX(-MNR,ROUND(DAYS360(ValDat,RC1,0)/30,0)-R8C+MEP-MNR),0,1,1))) -> 480 | P89: =IF(RC1="","",IF(OR(R8C<=ROUND(DAYS360(ValDat,RC1,0)/30,0),R8C>ROUND(DAYS360(ExpDat,RC1,0)/30,0)),0,OFFSET(R45C,MAX(-MNR,ROUND(DAYS360(ValDat,RC1,0)/30,0)-R8C+MEP-MNR),0,1,1))) -> 0 | Q89: =IF(RC1="","",IF(OR(R8C<=ROUND(DAYS360(ValDat,RC1,0)/30,0),R8C>ROUND(DAYS360(ExpDat,RC1,0)/30,0)),0,OFFSET(R45C,MAX(-MNR,ROUND(DAYS360(ValDat,RC1,0)/30,0)-R8C+MEP-MNR),0,1,1))) -> 0 | R89: =IF(RC1="","",IF(OR(R8C<=ROUND(DAYS360(ValDat,RC1,0)/30,0),R8C>ROUND(DAYS360(ExpDat,RC1,0)/30,0)),0,OFFSET(R45C,MAX(-MNR,ROUND(DAYS360(ValDat,RC1,0)/30,0)-R8C+MEP-MNR),0,1,1))) -> 0 | S89: =IF(RC1="","",IF(OR(R8C<=ROUND(DAYS360(ValDat,RC1,0)/30,0),R8C>ROUND(DAYS360(ExpDat,RC1,0)/30,0)),0,OFFSET(R45C,MAX(-MNR,ROUND(DAYS360(ValDat,RC1,0)/30,0)-R8C+MEP-MNR),0,1,1))) -> 0 | T89: =IF(RC1="","",IF(OR(R8C<=ROUND(DAYS360(ValDat,RC1,0)/30,0),R8C>ROUND(DAYS360(ExpDat,RC1,0)/30,0)),0,OFFSET(R45C,MAX(-MNR,ROUND(DAYS360(ValDat,RC1,0)/30,0)-R8C+MEP-MNR),0,1,1))) -> 0 | U89: =IF(RC1="","",IF(OR(R8C<=ROUND(DAYS360(ValDat,RC1,0)/30,0),R8C>ROUND(DAYS360(ExpDat,RC1,0)/30,0)),0,OFFSET(R45C,MAX(-MNR,ROUND(DAYS360(ValDat,RC1,0)/30,0)-R8C+MEP-MNR),0,1,1))) -> 273 | V89: =IF(RC1="","",IF(OR(R8C<=ROUND(DAYS360(ValDat,RC1,0)/30,0),R8C>ROUND(DAYS360(ExpDat,RC1,0)/30,0)),0,OFFSET(R45C,MAX(-MNR,ROUND(DAYS360(ValDat,RC1,0)/30,0)-R8C+MEP-MNR),0,1,1))) -> 0 | W89: =IF(RC1="","",IF(OR(R8C<=ROUND(DAYS360(ValDat,RC1,0)/30,0),R8C>ROUND(DAYS360(ExpDat,RC1,0)/30,0)),0,OFFSET(R45C,MAX(-MNR,ROUND(DAYS360(ValDat,RC1,0)/30,0)-R8C+MEP-MNR),0,1,1))) -> 0 | X89: =IF(RC1="","",IF(OR(R8C<=ROUND(DAYS360(ValDat,RC1,0)/30,0),R8C>ROUND(DAYS360(ExpDat,RC1,0)/30,0)),0,OFFSET(R45C,MAX(-MNR,ROUND(DAYS360(ValDat,RC1,0)/30,0)-R8C+MEP-MNR),0,1,1))) -> 0 | Y89: =IF(RC1="","",IF(OR(R8C<=ROUND(DAYS360(ValDat,RC1,0)/30,0),R8C>ROUND(DAYS360(ExpDat,RC1,0)/30,0)),0,OFFSET(R45C,MAX(-MNR,ROUND(DAYS360(ValDat,RC1,0)/30,0)-R8C+MEP-MNR),0,1,1))) -> 0 | Z89: =IF(RC1="","",IF(OR(R8C<=ROUND(DAYS360(ValDat,RC1,0)/30,0),R8C>ROUND(DAYS360(ExpDat,RC1,0)/30,0)),0,OFFSET(R45C,MAX(-MNR,ROUND(DAYS360(ValDat,RC1,0)/30,0)-R8C+MEP-MNR),0,1,1))) -> 0 | AA89: =IF(RC1="","",IF(OR(R8C<=ROUND(DAYS360(ValDat,RC1,0)/30,0),R8C>ROUND(DAYS360(ExpDat,RC1,0)/30,0)),0,OFFSET(R45C,MAX(-MNR,ROUND(DAYS360(ValDat,RC1,0)/30,0)-R8C+MEP-MNR),0,1,1))) -> 0 | AB89: =IF(RC1="","",IF(OR(R8C<=ROUND(DAYS360(ValDat,RC1,0)/30,0),R8C>ROUND(DAYS360(ExpDat,RC1,0)/30,0)),0,OFFSET(R45C,MAX(-MNR,ROUND(DAYS360(ValDat,RC1,0)/30,0)-R8C+MEP-MNR),0,1,1))) -> 0 | AC89: =IF(RC1="","",IF(OR(R8C<=ROUND(DAYS360(ValDat,RC1,0)/30,0),R8C>ROUND(DAYS360(ExpDat,RC1,0)/30,0)),0,OFFSET(R45C,MAX(-MNR,ROUND(DAYS360(ValDat,RC1,0)/30,0)-R8C+MEP-MNR),0,1,1))) -> 0 | AD89: =IF(RC1="","",IF(OR(R8C<=ROUND(DAYS360(ValDat,RC1,0)/30,0),R8C>ROUND(DAYS360(ExpDat,RC1,0)/30,0)),0,OFFSET(R45C,MAX(-MNR,ROUND(DAYS360(ValDat,RC1,0)/30,0)-R8C+MEP-MNR),0,1,1))) -> 0 | AE89: =IF(RC1="","",IF(OR(R8C<=ROUND(DAYS360(ValDat,RC1,0)/30,0),R8C>ROUND(DAYS360(ExpDat,RC1,0)/30,0)),0,OFFSET(R45C,MAX(-MNR,ROUND(DAYS360(ValDat,RC1,0)/30,0)-R8C+MEP-MNR),0,1,1))) -> 0 | AF89: =IF(RC1="","",IF(OR(R8C<=ROUND(DAYS360(ValDat,RC1,0)/30,0),R8C>ROUND(DAYS360(ExpDat,RC1,0)/30,0)),0,OFFSET(R45C,MAX(-MNR,ROUND(DAYS360(ValDat,RC1,0)/30,0)-R8C+MEP-MNR),0,1,1))) -> 0 | AG89: =IF(RC1="","",IF(OR(R8C<=ROUND(DAYS360(ValDat,RC1,0)/30,0),R8C>ROUND(DAYS360(ExpDat,RC1,0)/30,0)),0,OFFSET(R45C,MAX(-MNR,ROUND(DAYS360(ValDat,RC1,0)/30,0)-R8C+MEP-MNR),0,1,1))) -> 0 | AH89: =IF(RC1="","",IF(OR(R8C<=ROUND(DAYS360(ValDat,RC1,0)/30,0),R8C>ROUND(DAYS360(ExpDat,RC1,0)/30,0)),0,OFFSET(R45C,MAX(-MNR,ROUND(DAYS360(ValDat,RC1,0)/30,0)-R8C+MEP-MNR),0,1,1))) -> 0 | AI89: =IF(RC1="","",IF(OR(R8C<=ROUND(DAYS360(ValDat,RC1,0)/30,0),R8C>ROUND(DAYS360(ExpDat,RC1,0)/30,0)),0,OFFSET(R45C,MAX(-MNR,ROUND(DAYS360(ValDat,RC1,0)/30,0)-R8C+MEP-MNR),0,1,1))) -> 0 | AJ89: =IF(RC1="","",IF(OR(R8C<=ROUND(DAYS360(ValDat,RC1,0)/30,0),R8C>ROUND(DAYS360(ExpDat,RC1,0)/30,0)),0,OFFSET(R45C,MAX(-MNR,ROUND(DAYS360(ValDat,RC1,0)/30,0)-R8C+MEP-MNR),0,1,1))) -> 0 | AK89: =IF(RC1="","",IF(OR(R8C<=ROUND(DAYS360(ValDat,RC1,0)/30,0),R8C>ROUND(DAYS360(ExpDat,RC1,0)/30,0)),0,OFFSET(R45C,MAX(-MNR,ROUND(DAYS360(ValDat,RC1,0)/30,0)-R8C+MEP-MNR),0,1,1))) -> 0 | AL89: =IF(RC1="","",IF(OR(R8C<=ROUND(DAYS360(ValDat,RC1,0)/30,0),R8C>ROUND(DAYS360(ExpDat,RC1,0)/30,0)),0,OFFSET(R45C,MAX(-MNR,ROUND(DAYS360(ValDat,RC1,0)/30,0)-R8C+MEP-MNR),0,1,1))) -> 0 | AM89: =IF(RC1="","",IF(OR(R8C<=ROUND(DAYS360(ValDat,RC1,0)/30,0),R8C>ROUND(DAYS360(ExpDat,RC1,0)/30,0)),0,OFFSET(R45C,MAX(-MNR,ROUND(DAYS360(ValDat,RC1,0)/30,0)-R8C+MEP-MNR),0,1,1))) -> 0 | AN89: =IF(RC1="","",IF(OR(R8C<=ROUND(DAYS360(ValDat,RC1,0)/30,0),R8C>ROUND(DAYS360(ExpDat,RC1,0)/30,0)),0,OFFSET(R45C,MAX(-MNR,ROUND(DAYS360(ValDat,RC1,0)/30,0)-R8C+MEP-MNR),0,1,1))) -> 0 | AO89: =IF(RC1="","",IF(OR(R8C<=ROUND(DAYS360(ValDat,RC1,0)/30,0),R8C>ROUND(DAYS360(ExpDat,RC1,0)/30,0)),0,OFFSET(R45C,MAX(-MNR,ROUND(DAYS360(ValDat,RC1,0)/30,0)-R8C+MEP-MNR),0,1,1))) -> 0
A90: =IF(R[-1]C="","",IF(DATE(YEAR(R[-1]C),MONTH(R[-1]C)+1,1)>RunDat,"",DATE(YEAR(R[-1]C),MONTH(R[-1]C)+1,1))) -> 2001-04-01T00:00:00.000 | D90: =IF(RC1="","",SUM(RC[2]:RC[37])) -> 114270 | F90: =IF(RC1="","",IF(OR(R8C<=ROUND(DAYS360(ValDat,RC1,0)/30,0),R8C>ROUND(DAYS360(ExpDat,RC1,0)/30,0)),0,OFFSET(R45C,MAX(-MNR,ROUND(DAYS360(ValDat,RC1,0)/30,0)-R8C+MEP-MNR),0,1,1))) -> 1180 | G90: =IF(RC1="","",IF(OR(R8C<=ROUND(DAYS360(ValDat,RC1,0)/30,0),R8C>ROUND(DAYS360(ExpDat,RC1,0)/30,0)),0,OFFSET(R45C,MAX(-MNR,ROUND(DAYS360(ValDat,RC1,0)/30,0)-R8C+MEP-MNR),0,1,1))) -> 51447 | H90: =IF(RC1="","",IF(OR(R8C<=ROUND(DAYS360(ValDat,RC1,0)/30,0),R8C>ROUND(DAYS360(ExpDat,RC1,0)/30,0)),0,OFFSET(R45C,MAX(-MNR,ROUND(DAYS360(ValDat,RC1,0)/30,0)-R8C+MEP-MNR),0,1,1))) -> 37793 | I90: =IF(RC1="","",IF(OR(R8C<=ROUND(DAYS360(ValDat,RC1,0)/30,0),R8C>ROUND(DAYS360(ExpDat,RC1,0)/30,0)),0,OFFSET(R45C,MAX(-MNR,ROUND(DAYS360(ValDat,RC1,0)/30,0)-R8C+MEP-MNR),0,1,1))) -> 7995 | J90: =IF(RC1="","",IF(OR(R8C<=ROUND(DAYS360(ValDat,RC1,0)/30,0),R8C>ROUND(DAYS360(ExpDat,RC1,0)/30,0)),0,OFFSET(R45C,MAX(-MNR,ROUND(DAYS360(ValDat,RC1,0)/30,0)-R8C+MEP-MNR),0,1,1))) -> 3602 | K90: =IF(RC1="","",IF(OR(R8C<=ROUND(DAYS360(ValDat,RC1,0)/30,0),R8C>ROUND(DAYS360(ExpDat,RC1,0)/30,0)),0,OFFSET(R45C,MAX(-MNR,ROUND(DAYS360(ValDat,RC1,0)/30,0)-R8C+MEP-MNR),0,1,1))) -> 8621 | L90: =IF(RC1="","",IF(OR(R8C<=ROUND(DAYS360(ValDat,RC1,0)/30,0),R8C>ROUND(DAYS360(ExpDat,RC1,0)/30,0)),0,OFFSET(R45C,MAX(-MNR,ROUND(DAYS360(ValDat,RC1,0)/30,0)-R8C+MEP-MNR),0,1,1))) -> 1154 | M90: =IF(RC1="","",IF(OR(R8C<=ROUND(DAYS360(ValDat,RC1,0)/30,0),R8C>ROUND(DAYS360(ExpDat,RC1,0)/30,0)),0,OFFSET(R45C,MAX(-MNR,ROUND(DAYS360(ValDat,RC1,0)/30,0)-R8C+MEP-MNR),0,1,1))) -> 581 | N90: =IF(RC1="","",IF(OR(R8C<=ROUND(DAYS360(ValDat,RC1,0)/30,0),R8C>ROUND(DAYS360(ExpDat,RC1,0)/30,0)),0,OFFSET(R45C,MAX(-MNR,ROUND(DAYS360(ValDat,RC1,0)/30,0)-R8C+MEP-MNR),0,1,1))) -> 981 | O90: =IF(RC1="","",IF(OR(R8C<=ROUND(DAYS360(ValDat,RC1,0)/30,0),R8C>ROUND(DAYS360(ExpDat,RC1,0)/30,0)),0,OFFSET(R45C,MAX(-MNR,ROUND(DAYS360(ValDat,RC1,0)/30,0)-R8C+MEP-MNR),0,1,1))) -> 480 | P90: =IF(RC1="","",IF(OR(R8C<=ROUND(DAYS360(ValDat,RC1,0)/30,0),R8C>ROUND(DAYS360(ExpDat,RC1,0)/30,0)),0,OFFSET(R45C,MAX(-MNR,ROUND(DAYS360(ValDat,RC1,0)/30,0)-R8C+MEP-MNR),0,1,1))) -> 28 | Q90: =IF(RC1="","",IF(OR(R8C<=ROUND(DAYS360(ValDat,RC1,0)/30,0),R8C>ROUND(DAYS360(ExpDat,RC1,0)/30,0)),0,OFFSET(R45C,MAX(-MNR,ROUND(DAYS360(ValDat,RC1,0)/30,0)-R8C+MEP-MNR),0,1,1))) -> 0 | R90: =IF(RC1="","",IF(OR(R8C<=ROUND(DAYS360(ValDat,RC1,0)/30,0),R8C>ROUND(DAYS360(ExpDat,RC1,0)/30,0)),0,OFFSET(R45C,MAX(-MNR,ROUND(DAYS360(ValDat,RC1,0)/30,0)-R8C+MEP-MNR),0,1,1))) -> 0 | S90: =IF(RC1="","",IF(OR(R8C<=ROUND(DAYS360(ValDat,RC1,0)/30,0),R8C>ROUND(DAYS360(ExpDat,RC1,0)/30,0)),0,OFFSET(R45C,MAX(-MNR,ROUND(DAYS360(ValDat,RC1,0)/30,0)-R8C+MEP-MNR),0,1,1))) -> 0 | T90: =IF(RC1="","",IF(OR(R8C<=ROUND(DAYS360(ValDat,RC1,0)/30,0),R8C>ROUND(DAYS360(ExpDat,RC1,0)/30,0)),0,OFFSET(R45C,MAX(-MNR,ROUND(DAYS360(ValDat,RC1,0)/30,0)-R8C+MEP-MNR),0,1,1))) -> 0 | U90: =IF(RC1="","",IF(OR(R8C<=ROUND(DAYS360(ValDat,RC1,0)/30,0),R8C>ROUND(DAYS360(ExpDat,RC1,0)/30,0)),0,OFFSET(R45C,MAX(-MNR,ROUND(DAYS360(ValDat,RC1,0)/30,0)-R8C+MEP-MNR),0,1,1))) -> 273 | V90: =IF(RC1="","",IF(OR(R8C<=ROUND(DAYS360(ValDat,RC1,0)/30,0),R8C>ROUND(DAYS360(ExpDat,RC1,0)/30,0)),0,OFFSET(R45C,MAX(-MNR,ROUND(DAYS360(ValDat,RC1,0)/30,0)-R8C+MEP-MNR),0,1,1))) -> 135 | W90: =IF(RC1="","",IF(OR(R8C<=ROUND(DAYS360(ValDat,RC1,0)/30,0),R8C>ROUND(DAYS360(ExpDat,RC1,0)/30,0)),0,OFFSET(R45C,MAX(-MNR,ROUND(DAYS360(ValDat,RC1,0)/30,0)-R8C+MEP-MNR),0,1,1))) -> 0 | X90: =IF(RC1="","",IF(OR(R8C<=ROUND(DAYS360(ValDat,RC1,0)/30,0),R8C>ROUND(DAYS360(ExpDat,RC1,0)/30,0)),0,OFFSET(R45C,MAX(-MNR,ROUND(DAYS360(ValDat,RC1,0)/30,0)-R8C+MEP-MNR),0,1,1))) -> 0 | Y90: =IF(RC1="","",IF(OR(R8C<=ROUND(DAYS360(ValDat,RC1,0)/30,0),R8C>ROUND(DAYS360(ExpDat,RC1,0)/30,0)),0,OFFSET(R45C,MAX(-MNR,ROUND(DAYS360(ValDat,RC1,0)/30,0)-R8C+MEP-MNR),0,1,1))) -> 0 | Z90: =IF(RC1="","",IF(OR(R8C<=ROUND(DAYS360(ValDat,RC1,0)/30,0),R8C>ROUND(DAYS360(ExpDat,RC1,0)/30,0)),0,OFFSET(R45C,MAX(-MNR,ROUND(DAYS360(ValDat,RC1,0)/30,0)-R8C+MEP-MNR),0,1,1))) -> 0 | AA90: =IF(RC1="","",IF(OR(R8C<=ROUND(DAYS360(ValDat,RC1,0)/30,0),R8C>ROUND(DAYS360(ExpDat,RC1,0)/30,0)),0,OFFSET(R45C,MAX(-MNR,ROUND(DAYS360(ValDat,RC1,0)/30,0)-R8C+MEP-MNR),0,1,1))) -> 0 | AB90: =IF(RC1="","",IF(OR(R8C<=ROUND(DAYS360(ValDat,RC1,0)/30,0),R8C>ROUND(DAYS360(ExpDat,RC1,0)/30,0)),0,OFFSET(R45C,MAX(-MNR,ROUND(DAYS360(ValDat,RC1,0)/30,0)-R8C+MEP-MNR),0,1,1))) -> 0 | AC90: =IF(RC1="","",IF(OR(R8C<=ROUND(DAYS360(ValDat,RC1,0)/30,0),R8C>ROUND(DAYS360(ExpDat,RC1,0)/30,0)),0,OFFSET(R45C,MAX(-MNR,ROUND(DAYS360(ValDat,RC1,0)/30,0)-R8C+MEP-MNR),0,1,1))) -> 0 | AD90: =IF(RC1="","",IF(OR(R8C<=ROUND(DAYS360(ValDat,RC1,0)/30,0),R8C>ROUND(DAYS360(ExpDat,RC1,0)/30,0)),0,OFFSET(R45C,MAX(-MNR,ROUND(DAYS360(ValDat,RC1,0)/30,0)-R8C+MEP-MNR),0,1,1))) -> 0 | AE90: =IF(RC1="","",IF(OR(R8C<=ROUND(DAYS360(ValDat,RC1,0)/30,0),R8C>ROUND(DAYS360(ExpDat,RC1,0)/30,0)),0,OFFSET(R45C,MAX(-MNR,ROUND(DAYS360(ValDat,RC1,0)/30,0)-R8C+MEP-MNR),0,1,1))) -> 0 | AF90: =IF(RC1="","",IF(OR(R8C<=ROUND(DAYS360(ValDat,RC1,0)/30,0),R8C>ROUND(DAYS360(ExpDat,RC1,0)/30,0)),0,OFFSET(R45C,MAX(-MNR,ROUND(DAYS360(ValDat,RC1,0)/30,0)-R8C+MEP-MNR),0,1,1))) -> 0 | AG90: =IF(RC1="","",IF(OR(R8C<=ROUND(DAYS360(ValDat,RC1,0)/30,0),R8C>ROUND(DAYS360(ExpDat,RC1,0)/30,0)),0,OFFSET(R45C,MAX(-MNR,ROUND(DAYS360(ValDat,RC1,0)/30,0)-R8C+MEP-MNR),0,1,1))) -> 0 | AH90: =IF(RC1="","",IF(OR(R8C<=ROUND(DAYS360(ValDat,RC1,0)/30,0),R8C>ROUND(DAYS360(ExpDat,RC1,0)/30,0)),0,OFFSET(R45C,MAX(-MNR,ROUND(DAYS360(ValDat,RC1,0)/30,0)-R8C+MEP-MNR),0,1,1))) -> 0 | AI90: =IF(RC1="","",IF(OR(R8C<=ROUND(DAYS360(ValDat,RC1,0)/30,0),R8C>ROUND(DAYS360(ExpDat,RC1,0)/30,0)),0,OFFSET(R45C,MAX(-MNR,ROUND(DAYS360(ValDat,RC1,0)/30,0)-R8C+MEP-MNR),0,1,1))) -> 0 | AJ90: =IF(RC1="","",IF(OR(R8C<=ROUND(DAYS360(ValDat,RC1,0)/30,0),R8C>ROUND(DAYS360(ExpDat,RC1,0)/30,0)),0,OFFSET(R45C,MAX(-MNR,ROUND(DAYS360(ValDat,RC1,0)/30,0)-R8C+MEP-MNR),0,1,1))) -> 0 | AK90: =IF(RC1="","",IF(OR(R8C<=ROUND(DAYS360(ValDat,RC1,0)/30,0),R8C>ROUND(DAYS360(ExpDat,RC1,0)/30,0)),0,OFFSET(R45C,MAX(-MNR,ROUND(DAYS360(ValDat,RC1,0)/30,0)-R8C+MEP-MNR),0,1,1))) -> 0 | AL90: =IF(RC1="","",IF(OR(R8C<=ROUND(DAYS360(ValDat,RC1,0)/30,0),R8C>ROUND(DAYS360(ExpDat,RC1,0)/30,0)),0,OFFSET(R45C,MAX(-MNR,ROUND(DAYS360(ValDat,RC1,0)/30,0)-R8C+MEP-MNR),0,1,1))) -> 0 | AM90: =IF(RC1="","",IF(OR(R8C<=ROUND(DAYS360(ValDat,RC1,0)/30,0),R8C>ROUND(DAYS360(ExpDat,RC1,0)/30,0)),0,OFFSET(R45C,MAX(-MNR,ROUND(DAYS360(ValDat,RC1,0)/30,0)-R8C+MEP-MNR),0,1,1))) -> 0 | AN90: =IF(RC1="","",IF(OR(R8C<=ROUND(DAYS360(ValDat,RC1,0)/30,0),R8C>ROUND(DAYS360(ExpDat,RC1,0)/30,0)),0,OFFSET(R45C,MAX(-MNR,ROUND(DAYS360(ValDat,RC1,0)/30,0)-R8C+MEP-MNR),0,1,1))) -> 0 | AO90: =IF(RC1="","",IF(OR(R8C<=ROUND(DAYS360(ValDat,RC1,0)/30,0),R8C>ROUND(DAYS360(ExpDat,RC1,0)/30,0)),0,OFFSET(R45C,MAX(-MNR,ROUND(DAYS360(ValDat,RC1,0)/30,0)-R8C+MEP-MNR),0,1,1))) -> 0
A91: =IF(R[-1]C="","",IF(DATE(YEAR(R[-1]C),MONTH(R[-1]C)+1,1)>RunDat,"",DATE(YEAR(R[-1]C),MONTH(R[-1]C)+1,1))) -> 2001-05-01T00:00:00.000 | D91: =IF(RC1="","",SUM(RC[2]:RC[37])) -> 141251 | F91: =IF(RC1="","",IF(OR(R8C<=ROUND(DAYS360(ValDat,RC1,0)/30,0),R8C>ROUND(DAYS360(ExpDat,RC1,0)/30,0)),0,OFFSET(R45C,MAX(-MNR,ROUND(DAYS360(ValDat,RC1,0)/30,0)-R8C+MEP-MNR),0,1,1))) -> 24336 | G91: =IF(RC1="","",IF(OR(R8C<=ROUND(DAYS360(ValDat,RC1,0)/30,0),R8C>ROUND(DAYS360(ExpDat,RC1,0)/30,0)),0,OFFSET(R45C,MAX(-MNR,ROUND(DAYS360(ValDat,RC1,0)/30,0)-R8C+MEP-MNR),0,1,1))) -> 33425 | H91: =IF(RC1="","",IF(OR(R8C<=ROUND(DAYS360(ValDat,RC1,0)/30,0),R8C>ROUND(DAYS360(ExpDat,RC1,0)/30,0)),0,OFFSET(R45C,MAX(-MNR,ROUND(DAYS360(ValDat,RC1,0)/30,0)-R8C+MEP-MNR),0,1,1))) -> 16192 | I91: =IF(RC1="","",IF(OR(R8C<=ROUND(DAYS360(ValDat,RC1,0)/30,0),R8C>ROUND(DAYS360(ExpDat,RC1,0)/30,0)),0,OFFSET(R45C,MAX(-MNR,ROUND(DAYS360(ValDat,RC1,0)/30,0)-R8C+MEP-MNR),0,1,1))) -> 49731 | J91: =IF(RC1="","",IF(OR(R8C<=ROUND(DAYS360(ValDat,RC1,0)/30,0),R8C>ROUND(DAYS360(ExpDat,RC1,0)/30,0)),0,OFFSET(R45C,MAX(-MNR,ROUND(DAYS360(ValDat,RC1,0)/30,0)-R8C+MEP-MNR),0,1,1))) -> 520 | K91: =IF(RC1="","",IF(OR(R8C<=ROUND(DAYS360(ValDat,RC1,0)/30,0),R8C>ROUND(DAYS360(ExpDat,RC1,0)/30,0)),0,OFFSET(R45C,MAX(-MNR,ROUND(DAYS360(ValDat,RC1,0)/30,0)-R8C+MEP-MNR),0,1,1))) -> 2116 | L91: =IF(RC1="","",IF(OR(R8C<=ROUND(DAYS360(ValDat,RC1,0)/30,0),R8C>ROUND(DAYS360(ExpDat,RC1,0)/30,0)),0,OFFSET(R45C,MAX(-MNR,ROUND(DAYS360(ValDat,RC1,0)/30,0)-R8C+MEP-MNR),0,1,1))) -> 1405 | M91: =IF(RC1="","",IF(OR(R8C<=ROUND(DAYS360(ValDat,RC1,0)/30,0),R8C>ROUND(DAYS360(ExpDat,RC1,0)/30,0)),0,OFFSET(R45C,MAX(-MNR,ROUND(DAYS360(ValDat,RC1,0)/30,0)-R8C+MEP-MNR),0,1,1))) -> 9723 | N91: =IF(RC1="","",IF(OR(R8C<=ROUND(DAYS360(ValDat,RC1,0)/30,0),R8C>ROUND(DAYS360(ExpDat,RC1,0)/30,0)),0,OFFSET(R45C,MAX(-MNR,ROUND(DAYS360(ValDat,RC1,0)/30,0)-R8C+MEP-MNR),0,1,1))) -> 1025 | O91: =IF(RC1="","",IF(OR(R8C<=ROUND(DAYS360(ValDat,RC1,0)/30,0),R8C>ROUND(DAYS360(ExpDat,RC1,0)/30,0)),0,OFFSET(R45C,MAX(-MNR,ROUND(DAYS360(ValDat,RC1,0)/30,0)-R8C+MEP-MNR),0,1,1))) -> 121 | P91: =IF(RC1="","",IF(OR(R8C<=ROUND(DAYS360(ValDat,RC1,0)/30,0),R8C>ROUND(DAYS360(ExpDat,RC1,0)/30,0)),0,OFFSET(R45C,MAX(-MNR,ROUND(DAYS360(ValDat,RC1,0)/30,0)-R8C+MEP-MNR),0,1,1))) -> 702 | Q91: =IF(RC1="","",IF(OR(R8C<=ROUND(DAYS360(ValDat,RC1,0)/30,0),R8C>ROUND(DAYS360(ExpDat,RC1,0)/30,0)),0,OFFSET(R45C,MAX(-MNR,ROUND(DAYS360(ValDat,RC1,0)/30,0)-R8C+MEP-MNR),0,1,1))) -> 693 | R91: =IF(RC1="","",IF(OR(R8C<=ROUND(DAYS360(ValDat,RC1,0)/30,0),R8C>ROUND(DAYS360(ExpDat,RC1,0)/30,0)),0,OFFSET(R45C,MAX(-MNR,ROUND(DAYS360(ValDat,RC1,0)/30,0)-R8C+MEP-MNR),0,1,1))) -> 0 | S91: =IF(RC1="","",IF(OR(R8C<=ROUND(DAYS360(ValDat,RC1,0)/30,0),R8C>ROUND(DAYS360(ExpDat,RC1,0)/30,0)),0,OFFSET(R45C,MAX(-MNR,ROUND(DAYS360(ValDat,RC1,0)/30,0)-R8C+MEP-MNR),0,1,1))) -> 0 | T91: =IF(RC1="","",IF(OR(R8C<=ROUND(DAYS360(ValDat,RC1,0)/30,0),R8C>ROUND(DAYS360(ExpDat,RC1,0)/30,0)),0,OFFSET(R45C,MAX(-MNR,ROUND(DAYS360(ValDat,RC1,0)/30,0)-R8C+MEP-MNR),0,1,1))) -> 0 | U91: =IF(RC1="","",IF(OR(R8C<=ROUND(DAYS360(ValDat,RC1,0)/30,0),R8C>ROUND(DAYS360(ExpDat,RC1,0)/30,0)),0,OFFSET(R45C,MAX(-MNR,ROUND(DAYS360(ValDat,RC1,0)/30,0)-R8C+MEP-MNR),0,1,1))) -> 791 | V91: =IF(RC1="","",IF(OR(R8C<=ROUND(DAYS360(ValDat,RC1,0)/30,0),R8C>ROUND(DAYS360(ExpDat,RC1,0)/30,0)),0,OFFSET(R45C,MAX(-MNR,ROUND(DAYS360(ValDat,RC1,0)/30,0)-R8C+MEP-MNR),0,1,1))) -> 303 | W91: =IF(RC1="","",IF(OR(R8C<=ROUND(DAYS360(ValDat,RC1,0)/30,0),R8C>ROUND(DAYS360(ExpDat,RC1,0)/30,0)),0,OFFSET(R45C,MAX(-MNR,ROUND(DAYS360(ValDat,RC1,0)/30,0)-R8C+MEP-MNR),0,1,1))) -> 168 | X91: =IF(RC1="","",IF(OR(R8C<=ROUND(DAYS360(ValDat,RC1,0)/30,0),R8C>ROUND(DAYS360(ExpDat,RC1,0)/30,0)),0,OFFSET(R45C,MAX(-MNR,ROUND(DAYS360(ValDat,RC1,0)/30,0)-R8C+MEP-MNR),0,1,1))) -> 0 | Y91: =IF(RC1="","",IF(OR(R8C<=ROUND(DAYS360(ValDat,RC1,0)/30,0),R8C>ROUND(DAYS360(ExpDat,RC1,0)/30,0)),0,OFFSET(R45C,MAX(-MNR,ROUND(DAYS360(ValDat,RC1,0)/30,0)-R8C+MEP-MNR),0,1,1))) -> 0 | Z91: =IF(RC1="","",IF(OR(R8C<=ROUND(DAYS360(ValDat,RC1,0)/30,0),R8C>ROUND(DAYS360(ExpDat,RC1,0)/30,0)),0,OFFSET(R45C,MAX(-MNR,ROUND(DAYS360(ValDat,RC1,0)/30,0)-R8C+MEP-MNR),0,1,1))) -> 0 | AA91: =IF(RC1="","",IF(OR(R8C<=ROUND(DAYS360(ValDat,RC1,0)/30,0),R8C>ROUND(DAYS360(ExpDat,RC1,0)/30,0)),0,OFFSET(R45C,MAX(-MNR,ROUND(DAYS360(ValDat,RC1,0)/30,0)-R8C+MEP-MNR),0,1,1))) -> 0 | AB91: =IF(RC1="","",IF(OR(R8C<=ROUND(DAYS360(ValDat,RC1,0)/30,0),R8C>ROUND(DAYS360(ExpDat,RC1,0)/30,0)),0,OFFSET(R45C,MAX(-MNR,ROUND(DAYS360(ValDat,RC1,0)/30,0)-R8C+MEP-MNR),0,1,1))) -> 0 | AC91: =IF(RC1="","",IF(OR(R8C<=ROUND(DAYS360(ValDat,RC1,0)/30,0),R8C>ROUND(DAYS360(ExpDat,RC1,0)/30,0)),0,OFFSET(R45C,MAX(-MNR,ROUND(DAYS360(ValDat,RC1,0)/30,0)-R8C+MEP-MNR),0,1,1))) -> 0 | AD91: =IF(RC1="","",IF(OR(R8C<=ROUND(DAYS360(ValDat,RC1,0)/30,0),R8C>ROUND(DAYS360(ExpDat,RC1,0)/30,0)),0,OFFSET(R45C,MAX(-MNR,ROUND(DAYS360(ValDat,RC1,0)/30,0)-R8C+MEP-MNR),0,1,1))) -> 0 | AE91: =IF(RC1="","",IF(OR(R8C<=ROUND(DAYS360(ValDat,RC1,0)/30,0),R8C>ROUND(DAYS360(ExpDat,RC1,0)/30,0)),0,OFFSET(R45C,MAX(-MNR,ROUND(DAYS360(ValDat,RC1,0)/30,0)-R8C+MEP-MNR),0,1,1))) -> 0 | AF91: =IF(RC1="","",IF(OR(R8C<=ROUND(DAYS360(ValDat,RC1,0)/30,0),R8C>ROUND(DAYS360(ExpDat,RC1,0)/30,0)),0,OFFSET(R45C,MAX(-MNR,ROUND(DAYS360(ValDat,RC1,0)/30,0)-R8C+MEP-MNR),0,1,1))) -> 0 | AG91: =IF(RC1="","",IF(OR(R8C<=ROUND(DAYS360(ValDat,RC1,0)/30,0),R8C>ROUND(DAYS360(ExpDat,RC1,0)/30,0)),0,OFFSET(R45C,MAX(-MNR,ROUND(DAYS360(ValDat,RC1,0)/30,0)-R8C+MEP-MNR),0,1,1))) -> 0 | AH91: =IF(RC1="","",IF(OR(R8C<=ROUND(DAYS360(ValDat,RC1,0)/30,0),R8C>ROUND(DAYS360(ExpDat,RC1,0)/30,0)),0,OFFSET(R45C,MAX(-MNR,ROUND(DAYS360(ValDat,RC1,0)/30,0)-R8C+MEP-MNR),0,1,1))) -> 0 | AI91: =IF(RC1="","",IF(OR(R8C<=ROUND(DAYS360(ValDat,RC1,0)/30,0),R8C>ROUND(DAYS360(ExpDat,RC1,0)/30,0)),0,OFFSET(R45C,MAX(-MNR,ROUND(DAYS360(ValDat,RC1,0)/30,0)-R8C+MEP-MNR),0,1,1))) -> 0 | AJ91: =IF(RC1="","",IF(OR(R8C<=ROUND(DAYS360(ValDat,RC1,0)/30,0),R8C>ROUND(DAYS360(ExpDat,RC1,0)/30,0)),0,OFFSET(R45C,MAX(-MNR,ROUND(DAYS360(ValDat,RC1,0)/30,0)-R8C+MEP-MNR),0,1,1))) -> 0 | AK91: =IF(RC1="","",IF(OR(R8C<=ROUND(DAYS360(ValDat,RC1,0)/30,0),R8C>ROUND(DAYS360(ExpDat,RC1,0)/30,0)),0,OFFSET(R45C,MAX(-MNR,ROUND(DAYS360(ValDat,RC1,0)/30,0)-R8C+MEP-MNR),0,1,1))) -> 0 | AL91: =IF(RC1="","",IF(OR(R8C<=ROUND(DAYS360(ValDat,RC1,0)/30,0),R8C>ROUND(DAYS360(ExpDat,RC1,0)/30,0)),0,OFFSET(R45C,MAX(-MNR,ROUND(DAYS360(ValDat,RC1,0)/30,0)-R8C+MEP-MNR),0,1,1))) -> 0 | AM91: =IF(RC1="","",IF(OR(R8C<=ROUND(DAYS360(ValDat,RC1,0)/30,0),R8C>ROUND(DAYS360(ExpDat,RC1,0)/30,0)),0,OFFSET(R45C,MAX(-MNR,ROUND(DAYS360(ValDat,RC1,0)/30,0)-R8C+MEP-MNR),0,1,1))) -> 0 | AN91: =IF(RC1="","",IF(OR(R8C<=ROUND(DAYS360(ValDat,RC1,0)/30,0),R8C>ROUND(DAYS360(ExpDat,RC1,0)/30,0)),0,OFFSET(R45C,MAX(-MNR,ROUND(DAYS360(ValDat,RC1,0)/30,0)-R8C+MEP-MNR),0,1,1))) -> 0 | AO91: =IF(RC1="","",IF(OR(R8C<=ROUND(DAYS360(ValDat,RC1,0)/30,0),R8C>ROUND(DAYS360(ExpDat,RC1,0)/30,0)),0,OFFSET(R45C,MAX(-MNR,ROUND(DAYS360(ValDat,RC1,0)/30,0)-R8C+MEP-MNR),0,1,1))) -> 0
A92: =IF(R[-1]C="","",IF(DATE(YEAR(R[-1]C),MONTH(R[-1]C)+1,1)>RunDat,"",DATE(YEAR(R[-1]C),MONTH(R[-1]C)+1,1))) -> 2001-06-01T00:00:00.000 | D92: =IF(RC1="","",SUM(RC[2]:RC[37])) -> 175077 | F92: =IF(RC1="","",IF(OR(R8C<=ROUND(DAYS360(ValDat,RC1,0)/30,0),R8C>ROUND(DAYS360(ExpDat,RC1,0)/30,0)),0,OFFSET(R45C,MAX(-MNR,ROUND(DAYS360(ValDat,RC1,0)/30,0)-R8C+MEP-MNR),0,1,1))) -> 0 | G92: =IF(RC1="","",IF(OR(R8C<=ROUND(DAYS360(ValDat,RC1,0)/30,0),R8C>ROUND(DAYS360(ExpDat,RC1,0)/30,0)),0,OFFSET(R45C,MAX(-MNR,ROUND(DAYS360(ValDat,RC1,0)/30,0)-R8C+MEP-MNR),0,1,1))) -> 38853 | H92: =IF(RC1="","",IF(OR(R8C<=ROUND(DAYS360(ValDat,RC1,0)/30,0),R8C>ROUND(DAYS360(ExpDat,RC1,0)/30,0)),0,OFFSET(R45C,MAX(-MNR,ROUND(DAYS360(ValDat,RC1,0)/30,0)-R8C+MEP-MNR),0,1,1))) -> 35398 | I92: =IF(RC1="","",IF(OR(R8C<=ROUND(DAYS360(ValDat,RC1,0)/30,0),R8C>ROUND(DAYS360(ExpDat,RC1,0)/30,0)),0,OFFSET(R45C,MAX(-MNR,ROUND(DAYS360(ValDat,RC1,0)/30,0)-R8C+MEP-MNR),0,1,1))) -> 58463 | J92: =IF(RC1="","",IF(OR(R8C<=ROUND(DAYS360(ValDat,RC1,0)/30,0),R8C>ROUND(DAYS360(ExpDat,RC1,0)/30,0)),0,OFFSET(R45C,MAX(-MNR,ROUND(DAYS360(ValDat,RC1,0)/30,0)-R8C+MEP-MNR),0,1,1))) -> 28448 | K92: =IF(RC1="","",IF(OR(R8C<=ROUND(DAYS360(ValDat,RC1,0)/30,0),R8C>ROUND(DAYS360(ExpDat,RC1,0)/30,0)),0,OFFSET(R45C,MAX(-MNR,ROUND(DAYS360(ValDat,RC1,0)/30,0)-R8C+MEP-MNR),0,1,1))) -> 1792 | L92: =IF(RC1="","",IF(OR(R8C<=ROUND(DAYS360(ValDat,RC1,0)/30,0),R8C>ROUND(DAYS360(ExpDat,RC1,0)/30,0)),0,OFFSET(R45C,MAX(-MNR,ROUND(DAYS360(ValDat,RC1,0)/30,0)-R8C+MEP-MNR),0,1,1))) -> 7375 | M92: =IF(RC1="","",IF(OR(R8C<=ROUND(DAYS360(ValDat,RC1,0)/30,0),R8C>ROUND(DAYS360(ExpDat,RC1,0)/30,0)),0,OFFSET(R45C,MAX(-MNR,ROUND(DAYS360(ValDat,RC1,0)/30,0)-R8C+MEP-MNR),0,1,1))) -> 3535 | N92: =IF(RC1="","",IF(OR(R8C<=ROUND(DAYS360(ValDat,RC1,0)/30,0),R8C>ROUND(DAYS360(ExpDat,RC1,0)/30,0)),0,OFFSET(R45C,MAX(-MNR,ROUND(DAYS360(ValDat,RC1,0)/30,0)-R8C+MEP-MNR),0,1,1))) -> 403 | O92: =IF(RC1="","",IF(OR(R8C<=ROUND(DAYS360(ValDat,RC1,0)/30,0),R8C>ROUND(DAYS360(ExpDat,RC1,0)/30,0)),0,OFFSET(R45C,MAX(-MNR,ROUND(DAYS360(ValDat,RC1,0)/30,0)-R8C+MEP-MNR),0,1,1))) -> 0 | P92: =IF(RC1="","",IF(OR(R8C<=ROUND(DAYS360(ValDat,RC1,0)/30,0),R8C>ROUND(DAYS360(ExpDat,RC1,0)/30,0)),0,OFFSET(R45C,MAX(-MNR,ROUND(DAYS360(ValDat,RC1,0)/30,0)-R8C+MEP-MNR),0,1,1))) -> 0 | Q92: =IF(RC1="","",IF(OR(R8C<=ROUND(DAYS360(ValDat,RC1,0)/30,0),R8C>ROUND(DAYS360(ExpDat,RC1,0)/30,0)),0,OFFSET(R45C,MAX(-MNR,ROUND(DAYS360(ValDat,RC1,0)/30,0)-R8C+MEP-MNR),0,1,1))) -> 19 | R92: =IF(RC1="","",IF(OR(R8C<=ROUND(DAYS360(ValDat,RC1,0)/30,0),R8C>ROUND(DAYS360(ExpDat,RC1,0)/30,0)),0,OFFSET(R45C,MAX(-MNR,ROUND(DAYS360(ValDat,RC1,0)/30,0)-R8C+MEP-MNR),0,1,1))) -> 0 | S92: =IF(RC1="","",IF(OR(R8C<=ROUND(DAYS360(ValDat,RC1,0)/30,0),R8C>ROUND(DAYS360(ExpDat,RC1,0)/30,0)),0,OFFSET(R45C,MAX(-MNR,ROUND(DAYS360(ValDat,RC1,0)/30,0)-R8C+MEP-MNR),0,1,1))) -> 0 | T92: =IF(RC1="","",IF(OR(R8C<=ROUND(DAYS360(ValDat,RC1,0)/30,0),R8C>ROUND(DAYS360(ExpDat,RC1,0)/30,0)),0,OFFSET(R45C,MAX(-MNR,ROUND(DAYS360(ValDat,RC1,0)/30,0)-R8C+MEP-MNR),0,1,1))) -> 0 | U92: =IF(RC1="","",IF(OR(R8C<=ROUND(DAYS360(ValDat,RC1,0)/30,0),R8C>ROUND(DAYS360(ExpDat,RC1,0)/30,0)),0,OFFSET(R45C,MAX(-MNR,ROUND(DAYS360(ValDat,RC1,0)/30,0)-R8C+MEP-MNR),0,1,1))) -> 791 | V92: =IF(RC1="","",IF(OR(R8C<=ROUND(DAYS360(ValDat,RC1,0)/30,0),R8C>ROUND(DAYS360(ExpDat,RC1,0)/30,0)),0,OFFSET(R45C,MAX(-MNR,ROUND(DAYS360(ValDat,RC1,0)/30,0)-R8C+MEP-MNR),0,1,1))) -> 0 | W92: =IF(RC1="","",IF(OR(R8C<=ROUND(DAYS360(ValDat,RC1,0)/30,0),R8C>ROUND(DAYS360(ExpDat,RC1,0)/30,0)),0,OFFSET(R45C,MAX(-MNR,ROUND(DAYS360(ValDat,RC1,0)/30,0)-R8C+MEP-MNR),0,1,1))) -> 0 | X92: =IF(RC1="","",IF(OR(R8C<=ROUND(DAYS360(ValDat,RC1,0)/30,0),R8C>ROUND(DAYS360(ExpDat,RC1,0)/30,0)),0,OFFSET(R45C,MAX(-MNR,ROUND(DAYS360(ValDat,RC1,0)/30,0)-R8C+MEP-MNR),0,1,1))) -> 0 | Y92: =IF(RC1="","",IF(OR(R8C<=ROUND(DAYS360(ValDat,RC1,0)/30,0),R8C>ROUND(DAYS360(ExpDat,RC1,0)/30,0)),0,OFFSET(R45C,MAX(-MNR,ROUND(DAYS360(ValDat,RC1,0)/30,0)-R8C+MEP-MNR),0,1,1))) -> 0 | Z92: =IF(RC1="","",IF(OR(R8C<=ROUND(DAYS360(ValDat,RC1,0)/30,0),R8C>ROUND(DAYS360(ExpDat,RC1,0)/30,0)),0,OFFSET(R45C,MAX(-MNR,ROUND(DAYS360(ValDat,RC1,0)/30,0)-R8C+MEP-MNR),0,1,1))) -> 0 | AA92: =IF(RC1="","",IF(OR(R8C<=ROUND(DAYS360(ValDat,RC1,0)/30,0),R8C>ROUND(DAYS360(ExpDat,RC1,0)/30,0)),0,OFFSET(R45C,MAX(-MNR,ROUND(DAYS360(ValDat,RC1,0)/30,0)-R8C+MEP-MNR),0,1,1))) -> 0 | AB92: =IF(RC1="","",IF(OR(R8C<=ROUND(DAYS360(ValDat,RC1,0)/30,0),R8C>ROUND(DAYS360(ExpDat,RC1,0)/30,0)),0,OFFSET(R45C,MAX(-MNR,ROUND(DAYS360(ValDat,RC1,0)/30,0)-R8C+MEP-MNR),0,1,1))) -> 0 | AC92: =IF(RC1="","",IF(OR(R8C<=ROUND(DAYS360(ValDat,RC1,0)/30,0),R8C>ROUND(DAYS360(ExpDat,RC1,0)/30,0)),0,OFFSET(R45C,MAX(-MNR,ROUND(DAYS360(ValDat,RC1,0)/30,0)-R8C+MEP-MNR),0,1,1))) -> 0 | AD92: =IF(RC1="","",IF(OR(R8C<=ROUND(DAYS360(ValDat,RC1,0)/30,0),R8C>ROUND(DAYS360(ExpDat,RC1,0)/30,0)),0,OFFSET(R45C,MAX(-MNR,ROUND(DAYS360(ValDat,RC1,0)/30,0)-R8C+MEP-MNR),0,1,1))) -> 0 | AE92: =IF(RC1="","",IF(OR(R8C<=ROUND(DAYS360(ValDat,RC1,0)/30,0),R8C>ROUND(DAYS360(ExpDat,RC1,0)/30,0)),0,OFFSET(R45C,MAX(-MNR,ROUND(DAYS360(ValDat,RC1,0)/30,0)-R8C+MEP-MNR),0,1,1))) -> 0 | AF92: =IF(RC1="","",IF(OR(R8C<=ROUND(DAYS360(ValDat,RC1,0)/30,0),R8C>ROUND(DAYS360(ExpDat,RC1,0)/30,0)),0,OFFSET(R45C,MAX(-MNR,ROUND(DAYS360(ValDat,RC1,0)/30,0)-R8C+MEP-MNR),0,1,1))) -> 0 | AG92: =IF(RC1="","",IF(OR(R8C<=ROUND(DAYS360(ValDat,RC1,0)/30,0),R8C>ROUND(DAYS360(ExpDat,RC1,0)/30,0)),0,OFFSET(R45C,MAX(-MNR,ROUND(DAYS360(ValDat,RC1,0)/30,0)-R8C+MEP-MNR),0,1,1))) -> 0 | AH92: =IF(RC1="","",IF(OR(R8C<=ROUND(DAYS360(ValDat,RC1,0)/30,0),R8C>ROUND(DAYS360(ExpDat,RC1,0)/30,0)),0,OFFSET(R45C,MAX(-MNR,ROUND(DAYS360(ValDat,RC1,0)/30,0)-R8C+MEP-MNR),0,1,1))) -> 0 | AI92: =IF(RC1="","",IF(OR(R8C<=ROUND(DAYS360(ValDat,RC1,0)/30,0),R8C>ROUND(DAYS360(ExpDat,RC1,0)/30,0)),0,OFFSET(R45C,MAX(-MNR,ROUND(DAYS360(ValDat,RC1,0)/30,0)-R8C+MEP-MNR),0,1,1))) -> 0 | AJ92: =IF(RC1="","",IF(OR(R8C<=ROUND(DAYS360(ValDat,RC1,0)/30,0),R8C>ROUND(DAYS360(ExpDat,RC1,0)/30,0)),0,OFFSET(R45C,MAX(-MNR,ROUND(DAYS360(ValDat,RC1,0)/30,0)-R8C+MEP-MNR),0,1,1))) -> 0 | AK92: =IF(RC1="","",IF(OR(R8C<=ROUND(DAYS360(ValDat,RC1,0)/30,0),R8C>ROUND(DAYS360(ExpDat,RC1,0)/30,0)),0,OFFSET(R45C,MAX(-MNR,ROUND(DAYS360(ValDat,RC1,0)/30,0)-R8C+MEP-MNR),0,1,1))) -> 0 | AL92: =IF(RC1="","",IF(OR(R8C<=ROUND(DAYS360(ValDat,RC1,0)/30,0),R8C>ROUND(DAYS360(ExpDat,RC1,0)/30,0)),0,OFFSET(R45C,MAX(-MNR,ROUND(DAYS360(ValDat,RC1,0)/30,0)-R8C+MEP-MNR),0,1,1))) -> 0 | AM92: =IF(RC1="","",IF(OR(R8C<=ROUND(DAYS360(ValDat,RC1,0)/30,0),R8C>ROUND(DAYS360(ExpDat,RC1,0)/30,0)),0,OFFSET(R45C,MAX(-MNR,ROUND(DAYS360(ValDat,RC1,0)/30,0)-R8C+MEP-MNR),0,1,1))) -> 0 | AN92: =IF(RC1="","",IF(OR(R8C<=ROUND(DAYS360(ValDat,RC1,0)/30,0),R8C>ROUND(DAYS360(ExpDat,RC1,0)/30,0)),0,OFFSET(R45C,MAX(-MNR,ROUND(DAYS360(ValDat,RC1,0)/30,0)-R8C+MEP-MNR),0,1,1))) -> 0 | AO92: =IF(RC1="","",IF(OR(R8C<=ROUND(DAYS360(ValDat,RC1,0)/30,0),R8C>ROUND(DAYS360(ExpDat,RC1,0)/30,0)),0,OFFSET(R45C,MAX(-MNR,ROUND(DAYS360(ValDat,RC1,0)/30,0)-R8C+MEP-MNR),0,1,1))) -> 0
A93: =IF(R[-1]C="","",IF(DATE(YEAR(R[-1]C),MONTH(R[-1]C)+1,1)>RunDat,"",DATE(YEAR(R[-1]C),MONTH(R[-1]C)+1,1))) -> 2001-07-01T00:00:00.000 | D93: =IF(RC1="","",SUM(RC[2]:RC[37])) -> 58092 | F93: =IF(RC1="","",IF(OR(R8C<=ROUND(DAYS360(ValDat,RC1,0)/30,0),R8C>ROUND(DAYS360(ExpDat,RC1,0)/30,0)),0,OFFSET(R45C,MAX(-MNR,ROUND(DAYS360(ValDat,RC1,0)/30,0)-R8C+MEP-MNR),0,1,1))) -> 0 | G93: =IF(RC1="","",IF(OR(R8C<=ROUND(DAYS360(ValDat,RC1,0)/30,0),R8C>ROUND(DAYS360(ExpDat,RC1,0)/30,0)),0,OFFSET(R45C,MAX(-MNR,ROUND(DAYS360(ValDat,RC1,0)/30,0)-R8C+MEP-MNR),0,1,1))) -> 0 | H93: =IF(RC1="","",IF(OR(R8C<=ROUND(DAYS360(ValDat,RC1,0)/30,0),R8C>ROUND(DAYS360(ExpDat,RC1,0)/30,0)),0,OFFSET(R45C,MAX(-MNR,ROUND(DAYS360(ValDat,RC1,0)/30,0)-R8C+MEP-MNR),0,1,1))) -> 23133 | I93: =IF(RC1="","",IF(OR(R8C<=ROUND(DAYS360(ValDat,RC1,0)/30,0),R8C>ROUND(DAYS360(ExpDat,RC1,0)/30,0)),0,OFFSET(R45C,MAX(-MNR,ROUND(DAYS360(ValDat,RC1,0)/30,0)-R8C+MEP-MNR),0,1,1))) -> 24109 | J93: =IF(RC1="","",IF(OR(R8C<=ROUND(DAYS360(ValDat,RC1,0)/30,0),R8C>ROUND(DAYS360(ExpDat,RC1,0)/30,0)),0,OFFSET(R45C,MAX(-MNR,ROUND(DAYS360(ValDat,RC1,0)/30,0)-R8C+MEP-MNR),0,1,1))) -> 1725 | K93: =IF(RC1="","",IF(OR(R8C<=ROUND(DAYS360(ValDat,RC1,0)/30,0),R8C>ROUND(DAYS360(ExpDat,RC1,0)/30,0)),0,OFFSET(R45C,MAX(-MNR,ROUND(DAYS360(ValDat,RC1,0)/30,0)-R8C+MEP-MNR),0,1,1))) -> 2175 | L93: =IF(RC1="","",IF(OR(R8C<=ROUND(DAYS360(ValDat,RC1,0)/30,0),R8C>ROUND(DAYS360(ExpDat,RC1,0)/30,0)),0,OFFSET(R45C,MAX(-MNR,ROUND(DAYS360(ValDat,RC1,0)/30,0)-R8C+MEP-MNR),0,1,1))) -> 5685 | M93: =IF(RC1="","",IF(OR(R8C<=ROUND(DAYS360(ValDat,RC1,0)/30,0),R8C>ROUND(DAYS360(ExpDat,RC1,0)/30,0)),0,OFFSET(R45C,MAX(-MNR,ROUND(DAYS360(ValDat,RC1,0)/30,0)-R8C+MEP-MNR),0,1,1))) -> 474 | N93: =IF(RC1="","",IF(OR(R8C<=ROUND(DAYS360(ValDat,RC1,0)/30,0),R8C>ROUND(DAYS360(ExpDat,RC1,0)/30,0)),0,OFFSET(R45C,MAX(-MNR,ROUND(DAYS360(ValDat,RC1,0)/30,0)-R8C+MEP-MNR),0,1,1))) -> 707 | O93: =IF(RC1="","",IF(OR(R8C<=ROUND(DAYS360(ValDat,RC1,0)/30,0),R8C>ROUND(DAYS360(ExpDat,RC1,0)/30,0)),0,OFFSET(R45C,MAX(-MNR,ROUND(DAYS360(ValDat,RC1,0)/30,0)-R8C+MEP-MNR),0,1,1))) -> 0 | P93: =IF(RC1="","",IF(OR(R8C<=ROUND(DAYS360(ValDat,RC1,0)/30,0),R8C>ROUND(DAYS360(ExpDat,RC1,0)/30,0)),0,OFFSET(R45C,MAX(-MNR,ROUND(DAYS360(ValDat,RC1,0)/30,0)-R8C+MEP-MNR),0,1,1))) -> 0 | Q93: =IF(RC1="","",IF(OR(R8C<=ROUND(DAYS360(ValDat,RC1,0)/30,0),R8C>ROUND(DAYS360(ExpDat,RC1,0)/30,0)),0,OFFSET(R45C,MAX(-MNR,ROUND(DAYS360(ValDat,RC1,0)/30,0)-R8C+MEP-MNR),0,1,1))) -> 84 | R93: =IF(RC1="","",IF(OR(R8C<=ROUND(DAYS360(ValDat,RC1,0)/30,0),R8C>ROUND(DAYS360(ExpDat,RC1,0)/30,0)),0,OFFSET(R45C,MAX(-MNR,ROUND(DAYS360(ValDat,RC1,0)/30,0)-R8C+MEP-MNR),0,1,1))) -> 0 | S93: =IF(RC1="","",IF(OR(R8C<=ROUND(DAYS360(ValDat,RC1,0)/30,0),R8C>ROUND(DAYS360(ExpDat,RC1,0)/30,0)),0,OFFSET(R45C,MAX(-MNR,ROUND(DAYS360(ValDat,RC1,0)/30,0)-R8C+MEP-MNR),0,1,1))) -> 0 | T93: =IF(RC1="","",IF(OR(R8C<=ROUND(DAYS360(ValDat,RC1,0)/30,0),R8C>ROUND(DAYS360(ExpDat,RC1,0)/30,0)),0,OFFSET(R45C,MAX(-MNR,ROUND(DAYS360(ValDat,RC1,0)/30,0)-R8C+MEP-MNR),0,1,1))) -> 0 | U93: =IF(RC1="","",IF(OR(R8C<=ROUND(DAYS360(ValDat,RC1,0)/30,0),R8C>ROUND(DAYS360(ExpDat,RC1,0)/30,0)),0,OFFSET(R45C,MAX(-MNR,ROUND(DAYS360(ValDat,RC1,0)/30,0)-R8C+MEP-MNR),0,1,1))) -> 0 | V93: =IF(RC1="","",IF(OR(R8C<=ROUND(DAYS360(ValDat,RC1,0)/30,0),R8C>ROUND(DAYS360(ExpDat,RC1,0)/30,0)),0,OFFSET(R45C,MAX(-MNR,ROUND(DAYS360(ValDat,RC1,0)/30,0)-R8C+MEP-MNR),0,1,1))) -> 0 | W93: =IF(RC1="","",IF(OR(R8C<=ROUND(DAYS360(ValDat,RC1,0)/30,0),R8C>ROUND(DAYS360(ExpDat,RC1,0)/30,0)),0,OFFSET(R45C,MAX(-MNR,ROUND(DAYS360(ValDat,RC1,0)/30,0)-R8C+MEP-MNR),0,1,1))) -> 0 | X93: =IF(RC1="","",IF(OR(R8C<=ROUND(DAYS360(ValDat,RC1,0)/30,0),R8C>ROUND(DAYS360(ExpDat,RC1,0)/30,0)),0,OFFSET(R45C,MAX(-MNR,ROUND(DAYS360(ValDat,RC1,0)/30,0)-R8C+MEP-MNR),0,1,1))) -> 0 | Y93: =IF(RC1="","",IF(OR(R8C<=ROUND(DAYS360(ValDat,RC1,0)/30,0),R8C>ROUND(DAYS360(ExpDat,RC1,0)/30,0)),0,OFFSET(R45C,MAX(-MNR,ROUND(DAYS360(ValDat,RC1,0)/30,0)-R8C+MEP-MNR),0,1,1))) -> 0 | Z93: =IF(RC1="","",IF(OR(R8C<=ROUND(DAYS360(ValDat,RC1,0)/30,0),R8C>ROUND(DAYS360(ExpDat,RC1,0)/30,0)),0,OFFSET(R45C,MAX(-MNR,ROUND(DAYS360(ValDat,RC1,0)/30,0)-R8C+MEP-MNR),0,1,1))) -> 0 | AA93: =IF(RC1="","",IF(OR(R8C<=ROUND(DAYS360(ValDat,RC1,0)/30,0),R8C>ROUND(DAYS360(ExpDat,RC1,0)/30,0)),0,OFFSET(R45C,MAX(-MNR,ROUND(DAYS360(ValDat,RC1,0)/30,0)-R8C+MEP-MNR),0,1,1))) -> 0 | AB93: =IF(RC1="","",IF(OR(R8C<=ROUND(DAYS360(ValDat,RC1,0)/30,0),R8C>ROUND(DAYS360(ExpDat,RC1,0)/30,0)),0,OFFSET(R45C,MAX(-MNR,ROUND(DAYS360(ValDat,RC1,0)/30,0)-R8C+MEP-MNR),0,1,1))) -> 0 | AC93: =IF(RC1="","",IF(OR(R8C<=ROUND(DAYS360(ValDat,RC1,0)/30,0),R8C>ROUND(DAYS360(ExpDat,RC1,0)/30,0)),0,OFFSET(R45C,MAX(-MNR,ROUND(DAYS360(ValDat,RC1,0)/30,0)-R8C+MEP-MNR),0,1,1))) -> 0 | AD93: =IF(RC1="","",IF(OR(R8C<=ROUND(DAYS360(ValDat,RC1,0)/30,0),R8C>ROUND(DAYS360(ExpDat,RC1,0)/30,0)),0,OFFSET(R45C,MAX(-MNR,ROUND(DAYS360(ValDat,RC1,0)/30,0)-R8C+MEP-MNR),0,1,1))) -> 0 | AE93: =IF(RC1="","",IF(OR(R8C<=ROUND(DAYS360(ValDat,RC1,0)/30,0),R8C>ROUND(DAYS360(ExpDat,RC1,0)/30,0)),0,OFFSET(R45C,MAX(-MNR,ROUND(DAYS360(ValDat,RC1,0)/30,0)-R8C+MEP-MNR),0,1,1))) -> 0 | AF93: =IF(RC1="","",IF(OR(R8C<=ROUND(DAYS360(ValDat,RC1,0)/30,0),R8C>ROUND(DAYS360(ExpDat,RC1,0)/30,0)),0,OFFSET(R45C,MAX(-MNR,ROUND(DAYS360(ValDat,RC1,0)/30,0)-R8C+MEP-MNR),0,1,1))) -> 0 | AG93: =IF(RC1="","",IF(OR(R8C<=ROUND(DAYS360(ValDat,RC1,0)/30,0),R8C>ROUND(DAYS360(ExpDat,RC1,0)/30,0)),0,OFFSET(R45C,MAX(-MNR,ROUND(DAYS360(ValDat,RC1,0)/30,0)-R8C+MEP-MNR),0,1,1))) -> 0 | AH93: =IF(RC1="","",IF(OR(R8C<=ROUND(DAYS360(ValDat,RC1,0)/30,0),R8C>ROUND(DAYS360(ExpDat,RC1,0)/30,0)),0,OFFSET(R45C,MAX(-MNR,ROUND(DAYS360(ValDat,RC1,0)/30,0)-R8C+MEP-MNR),0,1,1))) -> 0 | AI93: =IF(RC1="","",IF(OR(R8C<=ROUND(DAYS360(ValDat,RC1,0)/30,0),R8C>ROUND(DAYS360(ExpDat,RC1,0)/30,0)),0,OFFSET(R45C,MAX(-MNR,ROUND(DAYS360(ValDat,RC1,0)/30,0)-R8C+MEP-MNR),0,1,1))) -> 0 | AJ93: =IF(RC1="","",IF(OR(R8C<=ROUND(DAYS360(ValDat,RC1,0)/30,0),R8C>ROUND(DAYS360(ExpDat,RC1,0)/30,0)),0,OFFSET(R45C,MAX(-MNR,ROUND(DAYS360(ValDat,RC1,0)/30,0)-R8C+MEP-MNR),0,1,1))) -> 0 | AK93: =IF(RC1="","",IF(OR(R8C<=ROUND(DAYS360(ValDat,RC1,0)/30,0),R8C>ROUND(DAYS360(ExpDat,RC1,0)/30,0)),0,OFFSET(R45C,MAX(-MNR,ROUND(DAYS360(ValDat,RC1,0)/30,0)-R8C+MEP-MNR),0,1,1))) -> 0 | AL93: =IF(RC1="","",IF(OR(R8C<=ROUND(DAYS360(ValDat,RC1,0)/30,0),R8C>ROUND(DAYS360(ExpDat,RC1,0)/30,0)),0,OFFSET(R45C,MAX(-MNR,ROUND(DAYS360(ValDat,RC1,0)/30,0)-R8C+MEP-MNR),0,1,1))) -> 0 | AM93: =IF(RC1="","",IF(OR(R8C<=ROUND(DAYS360(ValDat,RC1,0)/30,0),R8C>ROUND(DAYS360(ExpDat,RC1,0)/30,0)),0,OFFSET(R45C,MAX(-MNR,ROUND(DAYS360(ValDat,RC1,0)/30,0)-R8C+MEP-MNR),0,1,1))) -> 0 | AN93: =IF(RC1="","",IF(OR(R8C<=ROUND(DAYS360(ValDat,RC1,0)/30,0),R8C>ROUND(DAYS360(ExpDat,RC1,0)/30,0)),0,OFFSET(R45C,MAX(-MNR,ROUND(DAYS360(ValDat,RC1,0)/30,0)-R8C+MEP-MNR),0,1,1))) -> 0 | AO93: =IF(RC1="","",IF(OR(R8C<=ROUND(DAYS360(ValDat,RC1,0)/30,0),R8C>ROUND(DAYS360(ExpDat,RC1,0)/30,0)),0,OFFSET(R45C,MAX(-MNR,ROUND(DAYS360(ValDat,RC1,0)/30,0)-R8C+MEP-MNR),0,1,1))) -> 0
A94: =IF(R[-1]C="","",IF(DATE(YEAR(R[-1]C),MONTH(R[-1]C)+1,1)>RunDat,"",DATE(YEAR(R[-1]C),MONTH(R[-1]C)+1,1))) ->  | D94: =IF(RC1="","",SUM(RC[2]:RC[37])) ->  | F94: =IF(RC1="","",IF(OR(R8C<=ROUND(DAYS360(ValDat,RC1,0)/30,0),R8C>ROUND(DAYS360(ExpDat,RC1,0)/30,0)),0,OFFSET(R45C,MAX(-MNR,ROUND(DAYS360(ValDat,RC1,0)/30,0)-R8C+MEP-MNR),0,1,1))) ->  | G94: =IF(RC1="","",IF(OR(R8C<=ROUND(DAYS360(ValDat,RC1,0)/30,0),R8C>ROUND(DAYS360(ExpDat,RC1,0)/30,0)),0,OFFSET(R45C,MAX(-MNR,ROUND(DAYS360(ValDat,RC1,0)/30,0)-R8C+MEP-MNR),0,1,1))) ->  | H94: =IF(RC1="","",IF(OR(R8C<=ROUND(DAYS360(ValDat,RC1,0)/30,0),R8C>ROUND(DAYS360(ExpDat,RC1,0)/30,0)),0,OFFSET(R45C,MAX(-MNR,ROUND(DAYS360(ValDat,RC1,0)/30,0)-R8C+MEP-MNR),0,1,1))) ->  | I94: =IF(RC1="","",IF(OR(R8C<=ROUND(DAYS360(ValDat,RC1,0)/30,0),R8C>ROUND(DAYS360(ExpDat,RC1,0)/30,0)),0,OFFSET(R45C,MAX(-MNR,ROUND(DAYS360(ValDat,RC1,0)/30,0)-R8C+MEP-MNR),0,1,1))) ->  | J94: =IF(RC1="","",IF(OR(R8C<=ROUND(DAYS360(ValDat,RC1,0)/30,0),R8C>ROUND(DAYS360(ExpDat,RC1,0)/30,0)),0,OFFSET(R45C,MAX(-MNR,ROUND(DAYS360(ValDat,RC1,0)/30,0)-R8C+MEP-MNR),0,1,1))) ->  | K94: =IF(RC1="","",IF(OR(R8C<=ROUND(DAYS360(ValDat,RC1,0)/30,0),R8C>ROUND(DAYS360(ExpDat,RC1,0)/30,0)),0,OFFSET(R45C,MAX(-MNR,ROUND(DAYS360(ValDat,RC1,0)/30,0)-R8C+MEP-MNR),0,1,1))) ->  | L94: =IF(RC1="","",IF(OR(R8C<=ROUND(DAYS360(ValDat,RC1,0)/30,0),R8C>ROUND(DAYS360(ExpDat,RC1,0)/30,0)),0,OFFSET(R45C,MAX(-MNR,ROUND(DAYS360(ValDat,RC1,0)/30,0)-R8C+MEP-MNR),0,1,1))) ->  | M94: =IF(RC1="","",IF(OR(R8C<=ROUND(DAYS360(ValDat,RC1,0)/30,0),R8C>ROUND(DAYS360(ExpDat,RC1,0)/30,0)),0,OFFSET(R45C,MAX(-MNR,ROUND(DAYS360(ValDat,RC1,0)/30,0)-R8C+MEP-MNR),0,1,1))) ->  | N94: =IF(RC1="","",IF(OR(R8C<=ROUND(DAYS360(ValDat,RC1,0)/30,0),R8C>ROUND(DAYS360(ExpDat,RC1,0)/30,0)),0,OFFSET(R45C,MAX(-MNR,ROUND(DAYS360(ValDat,RC1,0)/30,0)-R8C+MEP-MNR),0,1,1))) ->  | O94: =IF(RC1="","",IF(OR(R8C<=ROUND(DAYS360(ValDat,RC1,0)/30,0),R8C>ROUND(DAYS360(ExpDat,RC1,0)/30,0)),0,OFFSET(R45C,MAX(-MNR,ROUND(DAYS360(ValDat,RC1,0)/30,0)-R8C+MEP-MNR),0,1,1))) ->  | P94: =IF(RC1="","",IF(OR(R8C<=ROUND(DAYS360(ValDat,RC1,0)/30,0),R8C>ROUND(DAYS360(ExpDat,RC1,0)/30,0)),0,OFFSET(R45C,MAX(-MNR,ROUND(DAYS360(ValDat,RC1,0)/30,0)-R8C+MEP-MNR),0,1,1))) ->  | Q94: =IF(RC1="","",IF(OR(R8C<=ROUND(DAYS360(ValDat,RC1,0)/30,0),R8C>ROUND(DAYS360(ExpDat,RC1,0)/30,0)),0,OFFSET(R45C,MAX(-MNR,ROUND(DAYS360(ValDat,RC1,0)/30,0)-R8C+MEP-MNR),0,1,1))) ->  | R94: =IF(RC1="","",IF(OR(R8C<=ROUND(DAYS360(ValDat,RC1,0)/30,0),R8C>ROUND(DAYS360(ExpDat,RC1,0)/30,0)),0,OFFSET(R45C,MAX(-MNR,ROUND(DAYS360(ValDat,RC1,0)/30,0)-R8C+MEP-MNR),0,1,1))) ->  | S94: =IF(RC1="","",IF(OR(R8C<=ROUND(DAYS360(ValDat,RC1,0)/30,0),R8C>ROUND(DAYS360(ExpDat,RC1,0)/30,0)),0,OFFSET(R45C,MAX(-MNR,ROUND(DAYS360(ValDat,RC1,0)/30,0)-R8C+MEP-MNR),0,1,1))) ->  | T94: =IF(RC1="","",IF(OR(R8C<=ROUND(DAYS360(ValDat,RC1,0)/30,0),R8C>ROUND(DAYS360(ExpDat,RC1,0)/30,0)),0,OFFSET(R45C,MAX(-MNR,ROUND(DAYS360(ValDat,RC1,0)/30,0)-R8C+MEP-MNR),0,1,1))) ->  | U94: =IF(RC1="","",IF(OR(R8C<=ROUND(DAYS360(ValDat,RC1,0)/30,0),R8C>ROUND(DAYS360(ExpDat,RC1,0)/30,0)),0,OFFSET(R45C,MAX(-MNR,ROUND(DAYS360(ValDat,RC1,0)/30,0)-R8C+MEP-MNR),0,1,1))) ->  | V94: =IF(RC1="","",IF(OR(R8C<=ROUND(DAYS360(ValDat,RC1,0)/30,0),R8C>ROUND(DAYS360(ExpDat,RC1,0)/30,0)),0,OFFSET(R45C,MAX(-MNR,ROUND(DAYS360(ValDat,RC1,0)/30,0)-R8C+MEP-MNR),0,1,1))) ->  | W94: =IF(RC1="","",IF(OR(R8C<=ROUND(DAYS360(ValDat,RC1,0)/30,0),R8C>ROUND(DAYS360(ExpDat,RC1,0)/30,0)),0,OFFSET(R45C,MAX(-MNR,ROUND(DAYS360(ValDat,RC1,0)/30,0)-R8C+MEP-MNR),0,1,1))) ->  | X94: =IF(RC1="","",IF(OR(R8C<=ROUND(DAYS360(ValDat,RC1,0)/30,0),R8C>ROUND(DAYS360(ExpDat,RC1,0)/30,0)),0,OFFSET(R45C,MAX(-MNR,ROUND(DAYS360(ValDat,RC1,0)/30,0)-R8C+MEP-MNR),0,1,1))) ->  | Y94: =IF(RC1="","",IF(OR(R8C<=ROUND(DAYS360(ValDat,RC1,0)/30,0),R8C>ROUND(DAYS360(ExpDat,RC1,0)/30,0)),0,OFFSET(R45C,MAX(-MNR,ROUND(DAYS360(ValDat,RC1,0)/30,0)-R8C+MEP-MNR),0,1,1))) ->  | Z94: =IF(RC1="","",IF(OR(R8C<=ROUND(DAYS360(ValDat,RC1,0)/30,0),R8C>ROUND(DAYS360(ExpDat,RC1,0)/30,0)),0,OFFSET(R45C,MAX(-MNR,ROUND(DAYS360(ValDat,RC1,0)/30,0)-R8C+MEP-MNR),0,1,1))) ->  | AA94: =IF(RC1="","",IF(OR(R8C<=ROUND(DAYS360(ValDat,RC1,0)/30,0),R8C>ROUND(DAYS360(ExpDat,RC1,0)/30,0)),0,OFFSET(R45C,MAX(-MNR,ROUND(DAYS360(ValDat,RC1,0)/30,0)-R8C+MEP-MNR),0,1,1))) ->  | AB94: =IF(RC1="","",IF(OR(R8C<=ROUND(DAYS360(ValDat,RC1,0)/30,0),R8C>ROUND(DAYS360(ExpDat,RC1,0)/30,0)),0,OFFSET(R45C,MAX(-MNR,ROUND(DAYS360(ValDat,RC1,0)/30,0)-R8C+MEP-MNR),0,1,1))) ->  | AC94: =IF(RC1="","",IF(OR(R8C<=ROUND(DAYS360(ValDat,RC1,0)/30,0),R8C>ROUND(DAYS360(ExpDat,RC1,0)/30,0)),0,OFFSET(R45C,MAX(-MNR,ROUND(DAYS360(ValDat,RC1,0)/30,0)-R8C+MEP-MNR),0,1,1))) ->  | AD94: =IF(RC1="","",IF(OR(R8C<=ROUND(DAYS360(ValDat,RC1,0)/30,0),R8C>ROUND(DAYS360(ExpDat,RC1,0)/30,0)),0,OFFSET(R45C,MAX(-MNR,ROUND(DAYS360(ValDat,RC1,0)/30,0)-R8C+MEP-MNR),0,1,1))) ->  | AE94: =IF(RC1="","",IF(OR(R8C<=ROUND(DAYS360(ValDat,RC1,0)/30,0),R8C>ROUND(DAYS360(ExpDat,RC1,0)/30,0)),0,OFFSET(R45C,MAX(-MNR,ROUND(DAYS360(ValDat,RC1,0)/30,0)-R8C+MEP-MNR),0,1,1))) ->  | AF94: =IF(RC1="","",IF(OR(R8C<=ROUND(DAYS360(ValDat,RC1,0)/30,0),R8C>ROUND(DAYS360(ExpDat,RC1,0)/30,0)),0,OFFSET(R45C,MAX(-MNR,ROUND(DAYS360(ValDat,RC1,0)/30,0)-R8C+MEP-MNR),0,1,1))) ->  | AG94: =IF(RC1="","",IF(OR(R8C<=ROUND(DAYS360(ValDat,RC1,0)/30,0),R8C>ROUND(DAYS360(ExpDat,RC1,0)/30,0)),0,OFFSET(R45C,MAX(-MNR,ROUND(DAYS360(ValDat,RC1,0)/30,0)-R8C+MEP-MNR),0,1,1))) ->  | AH94: =IF(RC1="","",IF(OR(R8C<=ROUND(DAYS360(ValDat,RC1,0)/30,0),R8C>ROUND(DAYS360(ExpDat,RC1,0)/30,0)),0,OFFSET(R45C,MAX(-MNR,ROUND(DAYS360(ValDat,RC1,0)/30,0)-R8C+MEP-MNR),0,1,1))) ->  | AI94: =IF(RC1="","",IF(OR(R8C<=ROUND(DAYS360(ValDat,RC1,0)/30,0),R8C>ROUND(DAYS360(ExpDat,RC1,0)/30,0)),0,OFFSET(R45C,MAX(-MNR,ROUND(DAYS360(ValDat,RC1,0)/30,0)-R8C+MEP-MNR),0,1,1))) ->  | AJ94: =IF(RC1="","",IF(OR(R8C<=ROUND(DAYS360(ValDat,RC1,0)/30,0),R8C>ROUND(DAYS360(ExpDat,RC1,0)/30,0)),0,OFFSET(R45C,MAX(-MNR,ROUND(DAYS360(ValDat,RC1,0)/30,0)-R8C+MEP-MNR),0,1,1))) ->  | AK94: =IF(RC1="","",IF(OR(R8C<=ROUND(DAYS360(ValDat,RC1,0)/30,0),R8C>ROUND(DAYS360(ExpDat,RC1,0)/30,0)),0,OFFSET(R45C,MAX(-MNR,ROUND(DAYS360(ValDat,RC1,0)/30,0)-R8C+MEP-MNR),0,1,1))) ->  | AL94: =IF(RC1="","",IF(OR(R8C<=ROUND(DAYS360(ValDat,RC1,0)/30,0),R8C>ROUND(DAYS360(ExpDat,RC1,0)/30,0)),0,OFFSET(R45C,MAX(-MNR,ROUND(DAYS360(ValDat,RC1,0)/30,0)-R8C+MEP-MNR),0,1,1))) ->  | AM94: =IF(RC1="","",IF(OR(R8C<=ROUND(DAYS360(ValDat,RC1,0)/30,0),R8C>ROUND(DAYS360(ExpDat,RC1,0)/30,0)),0,OFFSET(R45C,MAX(-MNR,ROUND(DAYS360(ValDat,RC1,0)/30,0)-R8C+MEP-MNR),0,1,1))) ->  | AN94: =IF(RC1="","",IF(OR(R8C<=ROUND(DAYS360(ValDat,RC1,0)/30,0),R8C>ROUND(DAYS360(ExpDat,RC1,0)/30,0)),0,OFFSET(R45C,MAX(-MNR,ROUND(DAYS360(ValDat,RC1,0)/30,0)-R8C+MEP-MNR),0,1,1))) ->  | AO94: =IF(RC1="","",IF(OR(R8C<=ROUND(DAYS360(ValDat,RC1,0)/30,0),R8C>ROUND(DAYS360(ExpDat,RC1,0)/30,0)),0,OFFSET(R45C,MAX(-MNR,ROUND(DAYS360(ValDat,RC1,0)/30,0)-R8C+MEP-MNR),0,1,1))) -> 
A95: =IF(R[-1]C="","",IF(DATE(YEAR(R[-1]C),MONTH(R[-1]C)+1,1)>RunDat,"",DATE(YEAR(R[-1]C),MONTH(R[-1]C)+1,1))) ->  | D95: =IF(RC1="","",SUM(RC[2]:RC[37])) ->  | F95: =IF(RC1="","",IF(OR(R8C<=ROUND(DAYS360(ValDat,RC1,0)/30,0),R8C>ROUND(DAYS360(ExpDat,RC1,0)/30,0)),0,OFFSET(R45C,MAX(-MNR,ROUND(DAYS360(ValDat,RC1,0)/30,0)-R8C+MEP-MNR),0,1,1))) ->  | G95: =IF(RC1="","",IF(OR(R8C<=ROUND(DAYS360(ValDat,RC1,0)/30,0),R8C>ROUND(DAYS360(ExpDat,RC1,0)/30,0)),0,OFFSET(R45C,MAX(-MNR,ROUND(DAYS360(ValDat,RC1,0)/30,0)-R8C+MEP-MNR),0,1,1))) ->  | H95: =IF(RC1="","",IF(OR(R8C<=ROUND(DAYS360(ValDat,RC1,0)/30,0),R8C>ROUND(DAYS360(ExpDat,RC1,0)/30,0)),0,OFFSET(R45C,MAX(-MNR,ROUND(DAYS360(ValDat,RC1,0)/30,0)-R8C+MEP-MNR),0,1,1))) ->  | I95: =IF(RC1="","",IF(OR(R8C<=ROUND(DAYS360(ValDat,RC1,0)/30,0),R8C>ROUND(DAYS360(ExpDat,RC1,0)/30,0)),0,OFFSET(R45C,MAX(-MNR,ROUND(DAYS360(ValDat,RC1,0)/30,0)-R8C+MEP-MNR),0,1,1))) ->  | J95: =IF(RC1="","",IF(OR(R8C<=ROUND(DAYS360(ValDat,RC1,0)/30,0),R8C>ROUND(DAYS360(ExpDat,RC1,0)/30,0)),0,OFFSET(R45C,MAX(-MNR,ROUND(DAYS360(ValDat,RC1,0)/30,0)-R8C+MEP-MNR),0,1,1))) ->  | K95: =IF(RC1="","",IF(OR(R8C<=ROUND(DAYS360(ValDat,RC1,0)/30,0),R8C>ROUND(DAYS360(ExpDat,RC1,0)/30,0)),0,OFFSET(R45C,MAX(-MNR,ROUND(DAYS360(ValDat,RC1,0)/30,0)-R8C+MEP-MNR),0,1,1))) ->  | L95: =IF(RC1="","",IF(OR(R8C<=ROUND(DAYS360(ValDat,RC1,0)/30,0),R8C>ROUND(DAYS360(ExpDat,RC1,0)/30,0)),0,OFFSET(R45C,MAX(-MNR,ROUND(DAYS360(ValDat,RC1,0)/30,0)-R8C+MEP-MNR),0,1,1))) ->  | M95: =IF(RC1="","",IF(OR(R8C<=ROUND(DAYS360(ValDat,RC1,0)/30,0),R8C>ROUND(DAYS360(ExpDat,RC1,0)/30,0)),0,OFFSET(R45C,MAX(-MNR,ROUND(DAYS360(ValDat,RC1,0)/30,0)-R8C+MEP-MNR),0,1,1))) ->  | N95: =IF(RC1="","",IF(OR(R8C<=ROUND(DAYS360(ValDat,RC1,0)/30,0),R8C>ROUND(DAYS360(ExpDat,RC1,0)/30,0)),0,OFFSET(R45C,MAX(-MNR,ROUND(DAYS360(ValDat,RC1,0)/30,0)-R8C+MEP-MNR),0,1,1))) ->  | O95: =IF(RC1="","",IF(OR(R8C<=ROUND(DAYS360(ValDat,RC1,0)/30,0),R8C>ROUND(DAYS360(ExpDat,RC1,0)/30,0)),0,OFFSET(R45C,MAX(-MNR,ROUND(DAYS360(ValDat,RC1,0)/30,0)-R8C+MEP-MNR),0,1,1))) ->  | P95: =IF(RC1="","",IF(OR(R8C<=ROUND(DAYS360(ValDat,RC1,0)/30,0),R8C>ROUND(DAYS360(ExpDat,RC1,0)/30,0)),0,OFFSET(R45C,MAX(-MNR,ROUND(DAYS360(ValDat,RC1,0)/30,0)-R8C+MEP-MNR),0,1,1))) ->  | Q95: =IF(RC1="","",IF(OR(R8C<=ROUND(DAYS360(ValDat,RC1,0)/30,0),R8C>ROUND(DAYS360(ExpDat,RC1,0)/30,0)),0,OFFSET(R45C,MAX(-MNR,ROUND(DAYS360(ValDat,RC1,0)/30,0)-R8C+MEP-MNR),0,1,1))) ->  | R95: =IF(RC1="","",IF(OR(R8C<=ROUND(DAYS360(ValDat,RC1,0)/30,0),R8C>ROUND(DAYS360(ExpDat,RC1,0)/30,0)),0,OFFSET(R45C,MAX(-MNR,ROUND(DAYS360(ValDat,RC1,0)/30,0)-R8C+MEP-MNR),0,1,1))) ->  | S95: =IF(RC1="","",IF(OR(R8C<=ROUND(DAYS360(ValDat,RC1,0)/30,0),R8C>ROUND(DAYS360(ExpDat,RC1,0)/30,0)),0,OFFSET(R45C,MAX(-MNR,ROUND(DAYS360(ValDat,RC1,0)/30,0)-R8C+MEP-MNR),0,1,1))) ->  | T95: =IF(RC1="","",IF(OR(R8C<=ROUND(DAYS360(ValDat,RC1,0)/30,0),R8C>ROUND(DAYS360(ExpDat,RC1,0)/30,0)),0,OFFSET(R45C,MAX(-MNR,ROUND(DAYS360(ValDat,RC1,0)/30,0)-R8C+MEP-MNR),0,1,1))) ->  | U95: =IF(RC1="","",IF(OR(R8C<=ROUND(DAYS360(ValDat,RC1,0)/30,0),R8C>ROUND(DAYS360(ExpDat,RC1,0)/30,0)),0,OFFSET(R45C,MAX(-MNR,ROUND(DAYS360(ValDat,RC1,0)/30,0)-R8C+MEP-MNR),0,1,1))) ->  | V95: =IF(RC1="","",IF(OR(R8C<=ROUND(DAYS360(ValDat,RC1,0)/30,0),R8C>ROUND(DAYS360(ExpDat,RC1,0)/30,0)),0,OFFSET(R45C,MAX(-MNR,ROUND(DAYS360(ValDat,RC1,0)/30,0)-R8C+MEP-MNR),0,1,1))) ->  | W95: =IF(RC1="","",IF(OR(R8C<=ROUND(DAYS360(ValDat,RC1,0)/30,0),R8C>ROUND(DAYS360(ExpDat,RC1,0)/30,0)),0,OFFSET(R45C,MAX(-MNR,ROUND(DAYS360(ValDat,RC1,0)/30,0)-R8C+MEP-MNR),0,1,1))) ->  | X95: =IF(RC1="","",IF(OR(R8C<=ROUND(DAYS360(ValDat,RC1,0)/30,0),R8C>ROUND(DAYS360(ExpDat,RC1,0)/30,0)),0,OFFSET(R45C,MAX(-MNR,ROUND(DAYS360(ValDat,RC1,0)/30,0)-R8C+MEP-MNR),0,1,1))) ->  | Y95: =IF(RC1="","",IF(OR(R8C<=ROUND(DAYS360(ValDat,RC1,0)/30,0),R8C>ROUND(DAYS360(ExpDat,RC1,0)/30,0)),0,OFFSET(R45C,MAX(-MNR,ROUND(DAYS360(ValDat,RC1,0)/30,0)-R8C+MEP-MNR),0,1,1))) ->  | Z95: =IF(RC1="","",IF(OR(R8C<=ROUND(DAYS360(ValDat,RC1,0)/30,0),R8C>ROUND(DAYS360(ExpDat,RC1,0)/30,0)),0,OFFSET(R45C,MAX(-MNR,ROUND(DAYS360(ValDat,RC1,0)/30,0)-R8C+MEP-MNR),0,1,1))) ->  | AA95: =IF(RC1="","",IF(OR(R8C<=ROUND(DAYS360(ValDat,RC1,0)/30,0),R8C>ROUND(DAYS360(ExpDat,RC1,0)/30,0)),0,OFFSET(R45C,MAX(-MNR,ROUND(DAYS360(ValDat,RC1,0)/30,0)-R8C+MEP-MNR),0,1,1))) ->  | AB95: =IF(RC1="","",IF(OR(R8C<=ROUND(DAYS360(ValDat,RC1,0)/30,0),R8C>ROUND(DAYS360(ExpDat,RC1,0)/30,0)),0,OFFSET(R45C,MAX(-MNR,ROUND(DAYS360(ValDat,RC1,0)/30,0)-R8C+MEP-MNR),0,1,1))) ->  | AC95: =IF(RC1="","",IF(OR(R8C<=ROUND(DAYS360(ValDat,RC1,0)/30,0),R8C>ROUND(DAYS360(ExpDat,RC1,0)/30,0)),0,OFFSET(R45C,MAX(-MNR,ROUND(DAYS360(ValDat,RC1,0)/30,0)-R8C+MEP-MNR),0,1,1))) ->  | AD95: =IF(RC1="","",IF(OR(R8C<=ROUND(DAYS360(ValDat,RC1,0)/30,0),R8C>ROUND(DAYS360(ExpDat,RC1,0)/30,0)),0,OFFSET(R45C,MAX(-MNR,ROUND(DAYS360(ValDat,RC1,0)/30,0)-R8C+MEP-MNR),0,1,1))) ->  | AE95: =IF(RC1="","",IF(OR(R8C<=ROUND(DAYS360(ValDat,RC1,0)/30,0),R8C>ROUND(DAYS360(ExpDat,RC1,0)/30,0)),0,OFFSET(R45C,MAX(-MNR,ROUND(DAYS360(ValDat,RC1,0)/30,0)-R8C+MEP-MNR),0,1,1))) ->  | AF95: =IF(RC1="","",IF(OR(R8C<=ROUND(DAYS360(ValDat,RC1,0)/30,0),R8C>ROUND(DAYS360(ExpDat,RC1,0)/30,0)),0,OFFSET(R45C,MAX(-MNR,ROUND(DAYS360(ValDat,RC1,0)/30,0)-R8C+MEP-MNR),0,1,1))) ->  | AG95: =IF(RC1="","",IF(OR(R8C<=ROUND(DAYS360(ValDat,RC1,0)/30,0),R8C>ROUND(DAYS360(ExpDat,RC1,0)/30,0)),0,OFFSET(R45C,MAX(-MNR,ROUND(DAYS360(ValDat,RC1,0)/30,0)-R8C+MEP-MNR),0,1,1))) ->  | AH95: =IF(RC1="","",IF(OR(R8C<=ROUND(DAYS360(ValDat,RC1,0)/30,0),R8C>ROUND(DAYS360(ExpDat,RC1,0)/30,0)),0,OFFSET(R45C,MAX(-MNR,ROUND(DAYS360(ValDat,RC1,0)/30,0)-R8C+MEP-MNR),0,1,1))) ->  | AI95: =IF(RC1="","",IF(OR(R8C<=ROUND(DAYS360(ValDat,RC1,0)/30,0),R8C>ROUND(DAYS360(ExpDat,RC1,0)/30,0)),0,OFFSET(R45C,MAX(-MNR,ROUND(DAYS360(ValDat,RC1,0)/30,0)-R8C+MEP-MNR),0,1,1))) ->  | AJ95: =IF(RC1="","",IF(OR(R8C<=ROUND(DAYS360(ValDat,RC1,0)/30,0),R8C>ROUND(DAYS360(ExpDat,RC1,0)/30,0)),0,OFFSET(R45C,MAX(-MNR,ROUND(DAYS360(ValDat,RC1,0)/30,0)-R8C+MEP-MNR),0,1,1))) ->  | AK95: =IF(RC1="","",IF(OR(R8C<=ROUND(DAYS360(ValDat,RC1,0)/30,0),R8C>ROUND(DAYS360(ExpDat,RC1,0)/30,0)),0,OFFSET(R45C,MAX(-MNR,ROUND(DAYS360(ValDat,RC1,0)/30,0)-R8C+MEP-MNR),0,1,1))) ->  | AL95: =IF(RC1="","",IF(OR(R8C<=ROUND(DAYS360(ValDat,RC1,0)/30,0),R8C>ROUND(DAYS360(ExpDat,RC1,0)/30,0)),0,OFFSET(R45C,MAX(-MNR,ROUND(DAYS360(ValDat,RC1,0)/30,0)-R8C+MEP-MNR),0,1,1))) ->  | AM95: =IF(RC1="","",IF(OR(R8C<=ROUND(DAYS360(ValDat,RC1,0)/30,0),R8C>ROUND(DAYS360(ExpDat,RC1,0)/30,0)),0,OFFSET(R45C,MAX(-MNR,ROUND(DAYS360(ValDat,RC1,0)/30,0)-R8C+MEP-MNR),0,1,1))) ->  | AN95: =IF(RC1="","",IF(OR(R8C<=ROUND(DAYS360(ValDat,RC1,0)/30,0),R8C>ROUND(DAYS360(ExpDat,RC1,0)/30,0)),0,OFFSET(R45C,MAX(-MNR,ROUND(DAYS360(ValDat,RC1,0)/30,0)-R8C+MEP-MNR),0,1,1))) ->  | AO95: =IF(RC1="","",IF(OR(R8C<=ROUND(DAYS360(ValDat,RC1,0)/30,0),R8C>ROUND(DAYS360(ExpDat,RC1,0)/30,0)),0,OFFSET(R45C,MAX(-MNR,ROUND(DAYS360(ValDat,RC1,0)/30,0)-R8C+MEP-MNR),0,1,1))) -> 
A96: =IF(R[-1]C="","",IF(DATE(YEAR(R[-1]C),MONTH(R[-1]C)+1,1)>RunDat,"",DATE(YEAR(R[-1]C),MONTH(R[-1]C)+1,1))) ->  | D96: =IF(RC1="","",SUM(RC[2]:RC[37])) ->  | F96: =IF(RC1="","",IF(OR(R8C<=ROUND(DAYS360(ValDat,RC1,0)/30,0),R8C>ROUND(DAYS360(ExpDat,RC1,0)/30,0)),0,OFFSET(R45C,MAX(-MNR,ROUND(DAYS360(ValDat,RC1,0)/30,0)-R8C+MEP-MNR),0,1,1))) ->  | G96: =IF(RC1="","",IF(OR(R8C<=ROUND(DAYS360(ValDat,RC1,0)/30,0),R8C>ROUND(DAYS360(ExpDat,RC1,0)/30,0)),0,OFFSET(R45C,MAX(-MNR,ROUND(DAYS360(ValDat,RC1,0)/30,0)-R8C+MEP-MNR),0,1,1))) ->  | H96: =IF(RC1="","",IF(OR(R8C<=ROUND(DAYS360(ValDat,RC1,0)/30,0),R8C>ROUND(DAYS360(ExpDat,RC1,0)/30,0)),0,OFFSET(R45C,MAX(-MNR,ROUND(DAYS360(ValDat,RC1,0)/30,0)-R8C+MEP-MNR),0,1,1))) ->  | I96: =IF(RC1="","",IF(OR(R8C<=ROUND(DAYS360(ValDat,RC1,0)/30,0),R8C>ROUND(DAYS360(ExpDat,RC1,0)/30,0)),0,OFFSET(R45C,MAX(-MNR,ROUND(DAYS360(ValDat,RC1,0)/30,0)-R8C+MEP-MNR),0,1,1))) ->  | J96: =IF(RC1="","",IF(OR(R8C<=ROUND(DAYS360(ValDat,RC1,0)/30,0),R8C>ROUND(DAYS360(ExpDat,RC1,0)/30,0)),0,OFFSET(R45C,MAX(-MNR,ROUND(DAYS360(ValDat,RC1,0)/30,0)-R8C+MEP-MNR),0,1,1))) ->  | K96: =IF(RC1="","",IF(OR(R8C<=ROUND(DAYS360(ValDat,RC1,0)/30,0),R8C>ROUND(DAYS360(ExpDat,RC1,0)/30,0)),0,OFFSET(R45C,MAX(-MNR,ROUND(DAYS360(ValDat,RC1,0)/30,0)-R8C+MEP-MNR),0,1,1))) ->  | L96: =IF(RC1="","",IF(OR(R8C<=ROUND(DAYS360(ValDat,RC1,0)/30,0),R8C>ROUND(DAYS360(ExpDat,RC1,0)/30,0)),0,OFFSET(R45C,MAX(-MNR,ROUND(DAYS360(ValDat,RC1,0)/30,0)-R8C+MEP-MNR),0,1,1))) ->  | M96: =IF(RC1="","",IF(OR(R8C<=ROUND(DAYS360(ValDat,RC1,0)/30,0),R8C>ROUND(DAYS360(ExpDat,RC1,0)/30,0)),0,OFFSET(R45C,MAX(-MNR,ROUND(DAYS360(ValDat,RC1,0)/30,0)-R8C+MEP-MNR),0,1,1))) ->  | N96: =IF(RC1="","",IF(OR(R8C<=ROUND(DAYS360(ValDat,RC1,0)/30,0),R8C>ROUND(DAYS360(ExpDat,RC1,0)/30,0)),0,OFFSET(R45C,MAX(-MNR,ROUND(DAYS360(ValDat,RC1,0)/30,0)-R8C+MEP-MNR),0,1,1))) ->  | O96: =IF(RC1="","",IF(OR(R8C<=ROUND(DAYS360(ValDat,RC1,0)/30,0),R8C>ROUND(DAYS360(ExpDat,RC1,0)/30,0)),0,OFFSET(R45C,MAX(-MNR,ROUND(DAYS360(ValDat,RC1,0)/30,0)-R8C+MEP-MNR),0,1,1))) ->  | P96: =IF(RC1="","",IF(OR(R8C<=ROUND(DAYS360(ValDat,RC1,0)/30,0),R8C>ROUND(DAYS360(ExpDat,RC1,0)/30,0)),0,OFFSET(R45C,MAX(-MNR,ROUND(DAYS360(ValDat,RC1,0)/30,0)-R8C+MEP-MNR),0,1,1))) ->  | Q96: =IF(RC1="","",IF(OR(R8C<=ROUND(DAYS360(ValDat,RC1,0)/30,0),R8C>ROUND(DAYS360(ExpDat,RC1,0)/30,0)),0,OFFSET(R45C,MAX(-MNR,ROUND(DAYS360(ValDat,RC1,0)/30,0)-R8C+MEP-MNR),0,1,1))) ->  | R96: =IF(RC1="","",IF(OR(R8C<=ROUND(DAYS360(ValDat,RC1,0)/30,0),R8C>ROUND(DAYS360(ExpDat,RC1,0)/30,0)),0,OFFSET(R45C,MAX(-MNR,ROUND(DAYS360(ValDat,RC1,0)/30,0)-R8C+MEP-MNR),0,1,1))) ->  | S96: =IF(RC1="","",IF(OR(R8C<=ROUND(DAYS360(ValDat,RC1,0)/30,0),R8C>ROUND(DAYS360(ExpDat,RC1,0)/30,0)),0,OFFSET(R45C,MAX(-MNR,ROUND(DAYS360(ValDat,RC1,0)/30,0)-R8C+MEP-MNR),0,1,1))) ->  | T96: =IF(RC1="","",IF(OR(R8C<=ROUND(DAYS360(ValDat,RC1,0)/30,0),R8C>ROUND(DAYS360(ExpDat,RC1,0)/30,0)),0,OFFSET(R45C,MAX(-MNR,ROUND(DAYS360(ValDat,RC1,0)/30,0)-R8C+MEP-MNR),0,1,1))) ->  | U96: =IF(RC1="","",IF(OR(R8C<=ROUND(DAYS360(ValDat,RC1,0)/30,0),R8C>ROUND(DAYS360(ExpDat,RC1,0)/30,0)),0,OFFSET(R45C,MAX(-MNR,ROUND(DAYS360(ValDat,RC1,0)/30,0)-R8C+MEP-MNR),0,1,1))) ->  | V96: =IF(RC1="","",IF(OR(R8C<=ROUND(DAYS360(ValDat,RC1,0)/30,0),R8C>ROUND(DAYS360(ExpDat,RC1,0)/30,0)),0,OFFSET(R45C,MAX(-MNR,ROUND(DAYS360(ValDat,RC1,0)/30,0)-R8C+MEP-MNR),0,1,1))) ->  | W96: =IF(RC1="","",IF(OR(R8C<=ROUND(DAYS360(ValDat,RC1,0)/30,0),R8C>ROUND(DAYS360(ExpDat,RC1,0)/30,0)),0,OFFSET(R45C,MAX(-MNR,ROUND(DAYS360(ValDat,RC1,0)/30,0)-R8C+MEP-MNR),0,1,1))) ->  | X96: =IF(RC1="","",IF(OR(R8C<=ROUND(DAYS360(ValDat,RC1,0)/30,0),R8C>ROUND(DAYS360(ExpDat,RC1,0)/30,0)),0,OFFSET(R45C,MAX(-MNR,ROUND(DAYS360(ValDat,RC1,0)/30,0)-R8C+MEP-MNR),0,1,1))) ->  | Y96: =IF(RC1="","",IF(OR(R8C<=ROUND(DAYS360(ValDat,RC1,0)/30,0),R8C>ROUND(DAYS360(ExpDat,RC1,0)/30,0)),0,OFFSET(R45C,MAX(-MNR,ROUND(DAYS360(ValDat,RC1,0)/30,0)-R8C+MEP-MNR),0,1,1))) ->  | Z96: =IF(RC1="","",IF(OR(R8C<=ROUND(DAYS360(ValDat,RC1,0)/30,0),R8C>ROUND(DAYS360(ExpDat,RC1,0)/30,0)),0,OFFSET(R45C,MAX(-MNR,ROUND(DAYS360(ValDat,RC1,0)/30,0)-R8C+MEP-MNR),0,1,1))) ->  | AA96: =IF(RC1="","",IF(OR(R8C<=ROUND(DAYS360(ValDat,RC1,0)/30,0),R8C>ROUND(DAYS360(ExpDat,RC1,0)/30,0)),0,OFFSET(R45C,MAX(-MNR,ROUND(DAYS360(ValDat,RC1,0)/30,0)-R8C+MEP-MNR),0,1,1))) ->  | AB96: =IF(RC1="","",IF(OR(R8C<=ROUND(DAYS360(ValDat,RC1,0)/30,0),R8C>ROUND(DAYS360(ExpDat,RC1,0)/30,0)),0,OFFSET(R45C,MAX(-MNR,ROUND(DAYS360(ValDat,RC1,0)/30,0)-R8C+MEP-MNR),0,1,1))) ->  | AC96: =IF(RC1="","",IF(OR(R8C<=ROUND(DAYS360(ValDat,RC1,0)/30,0),R8C>ROUND(DAYS360(ExpDat,RC1,0)/30,0)),0,OFFSET(R45C,MAX(-MNR,ROUND(DAYS360(ValDat,RC1,0)/30,0)-R8C+MEP-MNR),0,1,1))) ->  | AD96: =IF(RC1="","",IF(OR(R8C<=ROUND(DAYS360(ValDat,RC1,0)/30,0),R8C>ROUND(DAYS360(ExpDat,RC1,0)/30,0)),0,OFFSET(R45C,MAX(-MNR,ROUND(DAYS360(ValDat,RC1,0)/30,0)-R8C+MEP-MNR),0,1,1))) ->  | AE96: =IF(RC1="","",IF(OR(R8C<=ROUND(DAYS360(ValDat,RC1,0)/30,0),R8C>ROUND(DAYS360(ExpDat,RC1,0)/30,0)),0,OFFSET(R45C,MAX(-MNR,ROUND(DAYS360(ValDat,RC1,0)/30,0)-R8C+MEP-MNR),0,1,1))) ->  | AF96: =IF(RC1="","",IF(OR(R8C<=ROUND(DAYS360(ValDat,RC1,0)/30,0),R8C>ROUND(DAYS360(ExpDat,RC1,0)/30,0)),0,OFFSET(R45C,MAX(-MNR,ROUND(DAYS360(ValDat,RC1,0)/30,0)-R8C+MEP-MNR),0,1,1))) ->  | AG96: =IF(RC1="","",IF(OR(R8C<=ROUND(DAYS360(ValDat,RC1,0)/30,0),R8C>ROUND(DAYS360(ExpDat,RC1,0)/30,0)),0,OFFSET(R45C,MAX(-MNR,ROUND(DAYS360(ValDat,RC1,0)/30,0)-R8C+MEP-MNR),0,1,1))) ->  | AH96: =IF(RC1="","",IF(OR(R8C<=ROUND(DAYS360(ValDat,RC1,0)/30,0),R8C>ROUND(DAYS360(ExpDat,RC1,0)/30,0)),0,OFFSET(R45C,MAX(-MNR,ROUND(DAYS360(ValDat,RC1,0)/30,0)-R8C+MEP-MNR),0,1,1))) ->  | AI96: =IF(RC1="","",IF(OR(R8C<=ROUND(DAYS360(ValDat,RC1,0)/30,0),R8C>ROUND(DAYS360(ExpDat,RC1,0)/30,0)),0,OFFSET(R45C,MAX(-MNR,ROUND(DAYS360(ValDat,RC1,0)/30,0)-R8C+MEP-MNR),0,1,1))) ->  | AJ96: =IF(RC1="","",IF(OR(R8C<=ROUND(DAYS360(ValDat,RC1,0)/30,0),R8C>ROUND(DAYS360(ExpDat,RC1,0)/30,0)),0,OFFSET(R45C,MAX(-MNR,ROUND(DAYS360(ValDat,RC1,0)/30,0)-R8C+MEP-MNR),0,1,1))) ->  | AK96: =IF(RC1="","",IF(OR(R8C<=ROUND(DAYS360(ValDat,RC1,0)/30,0),R8C>ROUND(DAYS360(ExpDat,RC1,0)/30,0)),0,OFFSET(R45C,MAX(-MNR,ROUND(DAYS360(ValDat,RC1,0)/30,0)-R8C+MEP-MNR),0,1,1))) ->  | AL96: =IF(RC1="","",IF(OR(R8C<=ROUND(DAYS360(ValDat,RC1,0)/30,0),R8C>ROUND(DAYS360(ExpDat,RC1,0)/30,0)),0,OFFSET(R45C,MAX(-MNR,ROUND(DAYS360(ValDat,RC1,0)/30,0)-R8C+MEP-MNR),0,1,1))) ->  | AM96: =IF(RC1="","",IF(OR(R8C<=ROUND(DAYS360(ValDat,RC1,0)/30,0),R8C>ROUND(DAYS360(ExpDat,RC1,0)/30,0)),0,OFFSET(R45C,MAX(-MNR,ROUND(DAYS360(ValDat,RC1,0)/30,0)-R8C+MEP-MNR),0,1,1))) ->  | AN96: =IF(RC1="","",IF(OR(R8C<=ROUND(DAYS360(ValDat,RC1,0)/30,0),R8C>ROUND(DAYS360(ExpDat,RC1,0)/30,0)),0,OFFSET(R45C,MAX(-MNR,ROUND(DAYS360(ValDat,RC1,0)/30,0)-R8C+MEP-MNR),0,1,1))) ->  | AO96: =IF(RC1="","",IF(OR(R8C<=ROUND(DAYS360(ValDat,RC1,0)/30,0),R8C>ROUND(DAYS360(ExpDat,RC1,0)/30,0)),0,OFFSET(R45C,MAX(-MNR,ROUND(DAYS360(ValDat,RC1,0)/30,0)-R8C+MEP-MNR),0,1,1))) -> 
A97: =IF(R[-1]C="","",IF(DATE(YEAR(R[-1]C),MONTH(R[-1]C)+1,1)>RunDat,"",DATE(YEAR(R[-1]C),MONTH(R[-1]C)+1,1))) ->  | D97: =IF(RC1="","",SUM(RC[2]:RC[37])) ->  | F97: =IF(RC1="","",IF(OR(R8C<=ROUND(DAYS360(ValDat,RC1,0)/30,0),R8C>ROUND(DAYS360(ExpDat,RC1,0)/30,0)),0,OFFSET(R45C,MAX(-MNR,ROUND(DAYS360(ValDat,RC1,0)/30,0)-R8C+MEP-MNR),0,1,1))) ->  | G97: =IF(RC1="","",IF(OR(R8C<=ROUND(DAYS360(ValDat,RC1,0)/30,0),R8C>ROUND(DAYS360(ExpDat,RC1,0)/30,0)),0,OFFSET(R45C,MAX(-MNR,ROUND(DAYS360(ValDat,RC1,0)/30,0)-R8C+MEP-MNR),0,1,1))) ->  | H97: =IF(RC1="","",IF(OR(R8C<=ROUND(DAYS360(ValDat,RC1,0)/30,0),R8C>ROUND(DAYS360(ExpDat,RC1,0)/30,0)),0,OFFSET(R45C,MAX(-MNR,ROUND(DAYS360(ValDat,RC1,0)/30,0)-R8C+MEP-MNR),0,1,1))) ->  | I97: =IF(RC1="","",IF(OR(R8C<=ROUND(DAYS360(ValDat,RC1,0)/30,0),R8C>ROUND(DAYS360(ExpDat,RC1,0)/30,0)),0,OFFSET(R45C,MAX(-MNR,ROUND(DAYS360(ValDat,RC1,0)/30,0)-R8C+MEP-MNR),0,1,1))) ->  | J97: =IF(RC1="","",IF(OR(R8C<=ROUND(DAYS360(ValDat,RC1,0)/30,0),R8C>ROUND(DAYS360(ExpDat,RC1,0)/30,0)),0,OFFSET(R45C,MAX(-MNR,ROUND(DAYS360(ValDat,RC1,0)/30,0)-R8C+MEP-MNR),0,1,1))) ->  | K97: =IF(RC1="","",IF(OR(R8C<=ROUND(DAYS360(ValDat,RC1,0)/30,0),R8C>ROUND(DAYS360(ExpDat,RC1,0)/30,0)),0,OFFSET(R45C,MAX(-MNR,ROUND(DAYS360(ValDat,RC1,0)/30,0)-R8C+MEP-MNR),0,1,1))) ->  | L97: =IF(RC1="","",IF(OR(R8C<=ROUND(DAYS360(ValDat,RC1,0)/30,0),R8C>ROUND(DAYS360(ExpDat,RC1,0)/30,0)),0,OFFSET(R45C,MAX(-MNR,ROUND(DAYS360(ValDat,RC1,0)/30,0)-R8C+MEP-MNR),0,1,1))) ->  | M97: =IF(RC1="","",IF(OR(R8C<=ROUND(DAYS360(ValDat,RC1,0)/30,0),R8C>ROUND(DAYS360(ExpDat,RC1,0)/30,0)),0,OFFSET(R45C,MAX(-MNR,ROUND(DAYS360(ValDat,RC1,0)/30,0)-R8C+MEP-MNR),0,1,1))) ->  | N97: =IF(RC1="","",IF(OR(R8C<=ROUND(DAYS360(ValDat,RC1,0)/30,0),R8C>ROUND(DAYS360(ExpDat,RC1,0)/30,0)),0,OFFSET(R45C,MAX(-MNR,ROUND(DAYS360(ValDat,RC1,0)/30,0)-R8C+MEP-MNR),0,1,1))) ->  | O97: =IF(RC1="","",IF(OR(R8C<=ROUND(DAYS360(ValDat,RC1,0)/30,0),R8C>ROUND(DAYS360(ExpDat,RC1,0)/30,0)),0,OFFSET(R45C,MAX(-MNR,ROUND(DAYS360(ValDat,RC1,0)/30,0)-R8C+MEP-MNR),0,1,1))) ->  | P97: =IF(RC1="","",IF(OR(R8C<=ROUND(DAYS360(ValDat,RC1,0)/30,0),R8C>ROUND(DAYS360(ExpDat,RC1,0)/30,0)),0,OFFSET(R45C,MAX(-MNR,ROUND(DAYS360(ValDat,RC1,0)/30,0)-R8C+MEP-MNR),0,1,1))) ->  | Q97: =IF(RC1="","",IF(OR(R8C<=ROUND(DAYS360(ValDat,RC1,0)/30,0),R8C>ROUND(DAYS360(ExpDat,RC1,0)/30,0)),0,OFFSET(R45C,MAX(-MNR,ROUND(DAYS360(ValDat,RC1,0)/30,0)-R8C+MEP-MNR),0,1,1))) ->  | R97: =IF(RC1="","",IF(OR(R8C<=ROUND(DAYS360(ValDat,RC1,0)/30,0),R8C>ROUND(DAYS360(ExpDat,RC1,0)/30,0)),0,OFFSET(R45C,MAX(-MNR,ROUND(DAYS360(ValDat,RC1,0)/30,0)-R8C+MEP-MNR),0,1,1))) ->  | S97: =IF(RC1="","",IF(OR(R8C<=ROUND(DAYS360(ValDat,RC1,0)/30,0),R8C>ROUND(DAYS360(ExpDat,RC1,0)/30,0)),0,OFFSET(R45C,MAX(-MNR,ROUND(DAYS360(ValDat,RC1,0)/30,0)-R8C+MEP-MNR),0,1,1))) ->  | T97: =IF(RC1="","",IF(OR(R8C<=ROUND(DAYS360(ValDat,RC1,0)/30,0),R8C>ROUND(DAYS360(ExpDat,RC1,0)/30,0)),0,OFFSET(R45C,MAX(-MNR,ROUND(DAYS360(ValDat,RC1,0)/30,0)-R8C+MEP-MNR),0,1,1))) ->  | U97: =IF(RC1="","",IF(OR(R8C<=ROUND(DAYS360(ValDat,RC1,0)/30,0),R8C>ROUND(DAYS360(ExpDat,RC1,0)/30,0)),0,OFFSET(R45C,MAX(-MNR,ROUND(DAYS360(ValDat,RC1,0)/30,0)-R8C+MEP-MNR),0,1,1))) ->  | V97: =IF(RC1="","",IF(OR(R8C<=ROUND(DAYS360(ValDat,RC1,0)/30,0),R8C>ROUND(DAYS360(ExpDat,RC1,0)/30,0)),0,OFFSET(R45C,MAX(-MNR,ROUND(DAYS360(ValDat,RC1,0)/30,0)-R8C+MEP-MNR),0,1,1))) ->  | W97: =IF(RC1="","",IF(OR(R8C<=ROUND(DAYS360(ValDat,RC1,0)/30,0),R8C>ROUND(DAYS360(ExpDat,RC1,0)/30,0)),0,OFFSET(R45C,MAX(-MNR,ROUND(DAYS360(ValDat,RC1,0)/30,0)-R8C+MEP-MNR),0,1,1))) ->  | X97: =IF(RC1="","",IF(OR(R8C<=ROUND(DAYS360(ValDat,RC1,0)/30,0),R8C>ROUND(DAYS360(ExpDat,RC1,0)/30,0)),0,OFFSET(R45C,MAX(-MNR,ROUND(DAYS360(ValDat,RC1,0)/30,0)-R8C+MEP-MNR),0,1,1))) ->  | Y97: =IF(RC1="","",IF(OR(R8C<=ROUND(DAYS360(ValDat,RC1,0)/30,0),R8C>ROUND(DAYS360(ExpDat,RC1,0)/30,0)),0,OFFSET(R45C,MAX(-MNR,ROUND(DAYS360(ValDat,RC1,0)/30,0)-R8C+MEP-MNR),0,1,1))) ->  | Z97: =IF(RC1="","",IF(OR(R8C<=ROUND(DAYS360(ValDat,RC1,0)/30,0),R8C>ROUND(DAYS360(ExpDat,RC1,0)/30,0)),0,OFFSET(R45C,MAX(-MNR,ROUND(DAYS360(ValDat,RC1,0)/30,0)-R8C+MEP-MNR),0,1,1))) ->  | AA97: =IF(RC1="","",IF(OR(R8C<=ROUND(DAYS360(ValDat,RC1,0)/30,0),R8C>ROUND(DAYS360(ExpDat,RC1,0)/30,0)),0,OFFSET(R45C,MAX(-MNR,ROUND(DAYS360(ValDat,RC1,0)/30,0)-R8C+MEP-MNR),0,1,1))) ->  | AB97: =IF(RC1="","",IF(OR(R8C<=ROUND(DAYS360(ValDat,RC1,0)/30,0),R8C>ROUND(DAYS360(ExpDat,RC1,0)/30,0)),0,OFFSET(R45C,MAX(-MNR,ROUND(DAYS360(ValDat,RC1,0)/30,0)-R8C+MEP-MNR),0,1,1))) ->  | AC97: =IF(RC1="","",IF(OR(R8C<=ROUND(DAYS360(ValDat,RC1,0)/30,0),R8C>ROUND(DAYS360(ExpDat,RC1,0)/30,0)),0,OFFSET(R45C,MAX(-MNR,ROUND(DAYS360(ValDat,RC1,0)/30,0)-R8C+MEP-MNR),0,1,1))) ->  | AD97: =IF(RC1="","",IF(OR(R8C<=ROUND(DAYS360(ValDat,RC1,0)/30,0),R8C>ROUND(DAYS360(ExpDat,RC1,0)/30,0)),0,OFFSET(R45C,MAX(-MNR,ROUND(DAYS360(ValDat,RC1,0)/30,0)-R8C+MEP-MNR),0,1,1))) ->  | AE97: =IF(RC1="","",IF(OR(R8C<=ROUND(DAYS360(ValDat,RC1,0)/30,0),R8C>ROUND(DAYS360(ExpDat,RC1,0)/30,0)),0,OFFSET(R45C,MAX(-MNR,ROUND(DAYS360(ValDat,RC1,0)/30,0)-R8C+MEP-MNR),0,1,1))) ->  | AF97: =IF(RC1="","",IF(OR(R8C<=ROUND(DAYS360(ValDat,RC1,0)/30,0),R8C>ROUND(DAYS360(ExpDat,RC1,0)/30,0)),0,OFFSET(R45C,MAX(-MNR,ROUND(DAYS360(ValDat,RC1,0)/30,0)-R8C+MEP-MNR),0,1,1))) ->  | AG97: =IF(RC1="","",IF(OR(R8C<=ROUND(DAYS360(ValDat,RC1,0)/30,0),R8C>ROUND(DAYS360(ExpDat,RC1,0)/30,0)),0,OFFSET(R45C,MAX(-MNR,ROUND(DAYS360(ValDat,RC1,0)/30,0)-R8C+MEP-MNR),0,1,1))) ->  | AH97: =IF(RC1="","",IF(OR(R8C<=ROUND(DAYS360(ValDat,RC1,0)/30,0),R8C>ROUND(DAYS360(ExpDat,RC1,0)/30,0)),0,OFFSET(R45C,MAX(-MNR,ROUND(DAYS360(ValDat,RC1,0)/30,0)-R8C+MEP-MNR),0,1,1))) ->  | AI97: =IF(RC1="","",IF(OR(R8C<=ROUND(DAYS360(ValDat,RC1,0)/30,0),R8C>ROUND(DAYS360(ExpDat,RC1,0)/30,0)),0,OFFSET(R45C,MAX(-MNR,ROUND(DAYS360(ValDat,RC1,0)/30,0)-R8C+MEP-MNR),0,1,1))) ->  | AJ97: =IF(RC1="","",IF(OR(R8C<=ROUND(DAYS360(ValDat,RC1,0)/30,0),R8C>ROUND(DAYS360(ExpDat,RC1,0)/30,0)),0,OFFSET(R45C,MAX(-MNR,ROUND(DAYS360(ValDat,RC1,0)/30,0)-R8C+MEP-MNR),0,1,1))) ->  | AK97: =IF(RC1="","",IF(OR(R8C<=ROUND(DAYS360(ValDat,RC1,0)/30,0),R8C>ROUND(DAYS360(ExpDat,RC1,0)/30,0)),0,OFFSET(R45C,MAX(-MNR,ROUND(DAYS360(ValDat,RC1,0)/30,0)-R8C+MEP-MNR),0,1,1))) ->  | AL97: =IF(RC1="","",IF(OR(R8C<=ROUND(DAYS360(ValDat,RC1,0)/30,0),R8C>ROUND(DAYS360(ExpDat,RC1,0)/30,0)),0,OFFSET(R45C,MAX(-MNR,ROUND(DAYS360(ValDat,RC1,0)/30,0)-R8C+MEP-MNR),0,1,1))) ->  | AM97: =IF(RC1="","",IF(OR(R8C<=ROUND(DAYS360(ValDat,RC1,0)/30,0),R8C>ROUND(DAYS360(ExpDat,RC1,0)/30,0)),0,OFFSET(R45C,MAX(-MNR,ROUND(DAYS360(ValDat,RC1,0)/30,0)-R8C+MEP-MNR),0,1,1))) ->  | AN97: =IF(RC1="","",IF(OR(R8C<=ROUND(DAYS360(ValDat,RC1,0)/30,0),R8C>ROUND(DAYS360(ExpDat,RC1,0)/30,0)),0,OFFSET(R45C,MAX(-MNR,ROUND(DAYS360(ValDat,RC1,0)/30,0)-R8C+MEP-MNR),0,1,1))) ->  | AO97: =IF(RC1="","",IF(OR(R8C<=ROUND(DAYS360(ValDat,RC1,0)/30,0),R8C>ROUND(DAYS360(ExpDat,RC1,0)/30,0)),0,OFFSET(R45C,MAX(-MNR,ROUND(DAYS360(ValDat,RC1,0)/30,0)-R8C+MEP-MNR),0,1,1))) -> 
A98: =IF(R[-1]C="","",IF(DATE(YEAR(R[-1]C),MONTH(R[-1]C)+1,1)>RunDat,"",DATE(YEAR(R[-1]C),MONTH(R[-1]C)+1,1))) ->  | D98: =IF(RC1="","",SUM(RC[2]:RC[37])) ->  | F98: =IF(RC1="","",IF(OR(R8C<=ROUND(DAYS360(ValDat,RC1,0)/30,0),R8C>ROUND(DAYS360(ExpDat,RC1,0)/30,0)),0,OFFSET(R45C,MAX(-MNR,ROUND(DAYS360(ValDat,RC1,0)/30,0)-R8C+MEP-MNR),0,1,1))) ->  | G98: =IF(RC1="","",IF(OR(R8C<=ROUND(DAYS360(ValDat,RC1,0)/30,0),R8C>ROUND(DAYS360(ExpDat,RC1,0)/30,0)),0,OFFSET(R45C,MAX(-MNR,ROUND(DAYS360(ValDat,RC1,0)/30,0)-R8C+MEP-MNR),0,1,1))) ->  | H98: =IF(RC1="","",IF(OR(R8C<=ROUND(DAYS360(ValDat,RC1,0)/30,0),R8C>ROUND(DAYS360(ExpDat,RC1,0)/30,0)),0,OFFSET(R45C,MAX(-MNR,ROUND(DAYS360(ValDat,RC1,0)/30,0)-R8C+MEP-MNR),0,1,1))) ->  | I98: =IF(RC1="","",IF(OR(R8C<=ROUND(DAYS360(ValDat,RC1,0)/30,0),R8C>ROUND(DAYS360(ExpDat,RC1,0)/30,0)),0,OFFSET(R45C,MAX(-MNR,ROUND(DAYS360(ValDat,RC1,0)/30,0)-R8C+MEP-MNR),0,1,1))) ->  | J98: =IF(RC1="","",IF(OR(R8C<=ROUND(DAYS360(ValDat,RC1,0)/30,0),R8C>ROUND(DAYS360(ExpDat,RC1,0)/30,0)),0,OFFSET(R45C,MAX(-MNR,ROUND(DAYS360(ValDat,RC1,0)/30,0)-R8C+MEP-MNR),0,1,1))) ->  | K98: =IF(RC1="","",IF(OR(R8C<=ROUND(DAYS360(ValDat,RC1,0)/30,0),R8C>ROUND(DAYS360(ExpDat,RC1,0)/30,0)),0,OFFSET(R45C,MAX(-MNR,ROUND(DAYS360(ValDat,RC1,0)/30,0)-R8C+MEP-MNR),0,1,1))) ->  | L98: =IF(RC1="","",IF(OR(R8C<=ROUND(DAYS360(ValDat,RC1,0)/30,0),R8C>ROUND(DAYS360(ExpDat,RC1,0)/30,0)),0,OFFSET(R45C,MAX(-MNR,ROUND(DAYS360(ValDat,RC1,0)/30,0)-R8C+MEP-MNR),0,1,1))) ->  | M98: =IF(RC1="","",IF(OR(R8C<=ROUND(DAYS360(ValDat,RC1,0)/30,0),R8C>ROUND(DAYS360(ExpDat,RC1,0)/30,0)),0,OFFSET(R45C,MAX(-MNR,ROUND(DAYS360(ValDat,RC1,0)/30,0)-R8C+MEP-MNR),0,1,1))) ->  | N98: =IF(RC1="","",IF(OR(R8C<=ROUND(DAYS360(ValDat,RC1,0)/30,0),R8C>ROUND(DAYS360(ExpDat,RC1,0)/30,0)),0,OFFSET(R45C,MAX(-MNR,ROUND(DAYS360(ValDat,RC1,0)/30,0)-R8C+MEP-MNR),0,1,1))) ->  | O98: =IF(RC1="","",IF(OR(R8C<=ROUND(DAYS360(ValDat,RC1,0)/30,0),R8C>ROUND(DAYS360(ExpDat,RC1,0)/30,0)),0,OFFSET(R45C,MAX(-MNR,ROUND(DAYS360(ValDat,RC1,0)/30,0)-R8C+MEP-MNR),0,1,1))) ->  | P98: =IF(RC1="","",IF(OR(R8C<=ROUND(DAYS360(ValDat,RC1,0)/30,0),R8C>ROUND(DAYS360(ExpDat,RC1,0)/30,0)),0,OFFSET(R45C,MAX(-MNR,ROUND(DAYS360(ValDat,RC1,0)/30,0)-R8C+MEP-MNR),0,1,1))) ->  | Q98: =IF(RC1="","",IF(OR(R8C<=ROUND(DAYS360(ValDat,RC1,0)/30,0),R8C>ROUND(DAYS360(ExpDat,RC1,0)/30,0)),0,OFFSET(R45C,MAX(-MNR,ROUND(DAYS360(ValDat,RC1,0)/30,0)-R8C+MEP-MNR),0,1,1))) ->  | R98: =IF(RC1="","",IF(OR(R8C<=ROUND(DAYS360(ValDat,RC1,0)/30,0),R8C>ROUND(DAYS360(ExpDat,RC1,0)/30,0)),0,OFFSET(R45C,MAX(-MNR,ROUND(DAYS360(ValDat,RC1,0)/30,0)-R8C+MEP-MNR),0,1,1))) ->  | S98: =IF(RC1="","",IF(OR(R8C<=ROUND(DAYS360(ValDat,RC1,0)/30,0),R8C>ROUND(DAYS360(ExpDat,RC1,0)/30,0)),0,OFFSET(R45C,MAX(-MNR,ROUND(DAYS360(ValDat,RC1,0)/30,0)-R8C+MEP-MNR),0,1,1))) ->  | T98: =IF(RC1="","",IF(OR(R8C<=ROUND(DAYS360(ValDat,RC1,0)/30,0),R8C>ROUND(DAYS360(ExpDat,RC1,0)/30,0)),0,OFFSET(R45C,MAX(-MNR,ROUND(DAYS360(ValDat,RC1,0)/30,0)-R8C+MEP-MNR),0,1,1))) ->  | U98: =IF(RC1="","",IF(OR(R8C<=ROUND(DAYS360(ValDat,RC1,0)/30,0),R8C>ROUND(DAYS360(ExpDat,RC1,0)/30,0)),0,OFFSET(R45C,MAX(-MNR,ROUND(DAYS360(ValDat,RC1,0)/30,0)-R8C+MEP-MNR),0,1,1))) ->  | V98: =IF(RC1="","",IF(OR(R8C<=ROUND(DAYS360(ValDat,RC1,0)/30,0),R8C>ROUND(DAYS360(ExpDat,RC1,0)/30,0)),0,OFFSET(R45C,MAX(-MNR,ROUND(DAYS360(ValDat,RC1,0)/30,0)-R8C+MEP-MNR),0,1,1))) ->  | W98: =IF(RC1="","",IF(OR(R8C<=ROUND(DAYS360(ValDat,RC1,0)/30,0),R8C>ROUND(DAYS360(ExpDat,RC1,0)/30,0)),0,OFFSET(R45C,MAX(-MNR,ROUND(DAYS360(ValDat,RC1,0)/30,0)-R8C+MEP-MNR),0,1,1))) ->  | X98: =IF(RC1="","",IF(OR(R8C<=ROUND(DAYS360(ValDat,RC1,0)/30,0),R8C>ROUND(DAYS360(ExpDat,RC1,0)/30,0)),0,OFFSET(R45C,MAX(-MNR,ROUND(DAYS360(ValDat,RC1,0)/30,0)-R8C+MEP-MNR),0,1,1))) ->  | Y98: =IF(RC1="","",IF(OR(R8C<=ROUND(DAYS360(ValDat,RC1,0)/30,0),R8C>ROUND(DAYS360(ExpDat,RC1,0)/30,0)),0,OFFSET(R45C,MAX(-MNR,ROUND(DAYS360(ValDat,RC1,0)/30,0)-R8C+MEP-MNR),0,1,1))) ->  | Z98: =IF(RC1="","",IF(OR(R8C<=ROUND(DAYS360(ValDat,RC1,0)/30,0),R8C>ROUND(DAYS360(ExpDat,RC1,0)/30,0)),0,OFFSET(R45C,MAX(-MNR,ROUND(DAYS360(ValDat,RC1,0)/30,0)-R8C+MEP-MNR),0,1,1))) ->  | AA98: =IF(RC1="","",IF(OR(R8C<=ROUND(DAYS360(ValDat,RC1,0)/30,0),R8C>ROUND(DAYS360(ExpDat,RC1,0)/30,0)),0,OFFSET(R45C,MAX(-MNR,ROUND(DAYS360(ValDat,RC1,0)/30,0)-R8C+MEP-MNR),0,1,1))) ->  | AB98: =IF(RC1="","",IF(OR(R8C<=ROUND(DAYS360(ValDat,RC1,0)/30,0),R8C>ROUND(DAYS360(ExpDat,RC1,0)/30,0)),0,OFFSET(R45C,MAX(-MNR,ROUND(DAYS360(ValDat,RC1,0)/30,0)-R8C+MEP-MNR),0,1,1))) ->  | AC98: =IF(RC1="","",IF(OR(R8C<=ROUND(DAYS360(ValDat,RC1,0)/30,0),R8C>ROUND(DAYS360(ExpDat,RC1,0)/30,0)),0,OFFSET(R45C,MAX(-MNR,ROUND(DAYS360(ValDat,RC1,0)/30,0)-R8C+MEP-MNR),0,1,1))) ->  | AD98: =IF(RC1="","",IF(OR(R8C<=ROUND(DAYS360(ValDat,RC1,0)/30,0),R8C>ROUND(DAYS360(ExpDat,RC1,0)/30,0)),0,OFFSET(R45C,MAX(-MNR,ROUND(DAYS360(ValDat,RC1,0)/30,0)-R8C+MEP-MNR),0,1,1))) ->  | AE98: =IF(RC1="","",IF(OR(R8C<=ROUND(DAYS360(ValDat,RC1,0)/30,0),R8C>ROUND(DAYS360(ExpDat,RC1,0)/30,0)),0,OFFSET(R45C,MAX(-MNR,ROUND(DAYS360(ValDat,RC1,0)/30,0)-R8C+MEP-MNR),0,1,1))) ->  | AF98: =IF(RC1="","",IF(OR(R8C<=ROUND(DAYS360(ValDat,RC1,0)/30,0),R8C>ROUND(DAYS360(ExpDat,RC1,0)/30,0)),0,OFFSET(R45C,MAX(-MNR,ROUND(DAYS360(ValDat,RC1,0)/30,0)-R8C+MEP-MNR),0,1,1))) ->  | AG98: =IF(RC1="","",IF(OR(R8C<=ROUND(DAYS360(ValDat,RC1,0)/30,0),R8C>ROUND(DAYS360(ExpDat,RC1,0)/30,0)),0,OFFSET(R45C,MAX(-MNR,ROUND(DAYS360(ValDat,RC1,0)/30,0)-R8C+MEP-MNR),0,1,1))) ->  | AH98: =IF(RC1="","",IF(OR(R8C<=ROUND(DAYS360(ValDat,RC1,0)/30,0),R8C>ROUND(DAYS360(ExpDat,RC1,0)/30,0)),0,OFFSET(R45C,MAX(-MNR,ROUND(DAYS360(ValDat,RC1,0)/30,0)-R8C+MEP-MNR),0,1,1))) ->  | AI98: =IF(RC1="","",IF(OR(R8C<=ROUND(DAYS360(ValDat,RC1,0)/30,0),R8C>ROUND(DAYS360(ExpDat,RC1,0)/30,0)),0,OFFSET(R45C,MAX(-MNR,ROUND(DAYS360(ValDat,RC1,0)/30,0)-R8C+MEP-MNR),0,1,1))) ->  | AJ98: =IF(RC1="","",IF(OR(R8C<=ROUND(DAYS360(ValDat,RC1,0)/30,0),R8C>ROUND(DAYS360(ExpDat,RC1,0)/30,0)),0,OFFSET(R45C,MAX(-MNR,ROUND(DAYS360(ValDat,RC1,0)/30,0)-R8C+MEP-MNR),0,1,1))) ->  | AK98: =IF(RC1="","",IF(OR(R8C<=ROUND(DAYS360(ValDat,RC1,0)/30,0),R8C>ROUND(DAYS360(ExpDat,RC1,0)/30,0)),0,OFFSET(R45C,MAX(-MNR,ROUND(DAYS360(ValDat,RC1,0)/30,0)-R8C+MEP-MNR),0,1,1))) ->  | AL98: =IF(RC1="","",IF(OR(R8C<=ROUND(DAYS360(ValDat,RC1,0)/30,0),R8C>ROUND(DAYS360(ExpDat,RC1,0)/30,0)),0,OFFSET(R45C,MAX(-MNR,ROUND(DAYS360(ValDat,RC1,0)/30,0)-R8C+MEP-MNR),0,1,1))) ->  | AM98: =IF(RC1="","",IF(OR(R8C<=ROUND(DAYS360(ValDat,RC1,0)/30,0),R8C>ROUND(DAYS360(ExpDat,RC1,0)/30,0)),0,OFFSET(R45C,MAX(-MNR,ROUND(DAYS360(ValDat,RC1,0)/30,0)-R8C+MEP-MNR),0,1,1))) ->  | AN98: =IF(RC1="","",IF(OR(R8C<=ROUND(DAYS360(ValDat,RC1,0)/30,0),R8C>ROUND(DAYS360(ExpDat,RC1,0)/30,0)),0,OFFSET(R45C,MAX(-MNR,ROUND(DAYS360(ValDat,RC1,0)/30,0)-R8C+MEP-MNR),0,1,1))) ->  | AO98: =IF(RC1="","",IF(OR(R8C<=ROUND(DAYS360(ValDat,RC1,0)/30,0),R8C>ROUND(DAYS360(ExpDat,RC1,0)/30,0)),0,OFFSET(R45C,MAX(-MNR,ROUND(DAYS360(ValDat,RC1,0)/30,0)-R8C+MEP-MNR),0,1,1))) -> 
A99: =IF(R[-1]C="","",IF(DATE(YEAR(R[-1]C),MONTH(R[-1]C)+1,1)>RunDat,"",DATE(YEAR(R[-1]C),MONTH(R[-1]C)+1,1))) ->  | D99: =IF(RC1="","",SUM(RC[2]:RC[37])) ->  | F99: =IF(RC1="","",IF(OR(R8C<=ROUND(DAYS360(ValDat,RC1,0)/30,0),R8C>ROUND(DAYS360(ExpDat,RC1,0)/30,0)),0,OFFSET(R45C,MAX(-MNR,ROUND(DAYS360(ValDat,RC1,0)/30,0)-R8C+MEP-MNR),0,1,1))) ->  | G99: =IF(RC1="","",IF(OR(R8C<=ROUND(DAYS360(ValDat,RC1,0)/30,0),R8C>ROUND(DAYS360(ExpDat,RC1,0)/30,0)),0,OFFSET(R45C,MAX(-MNR,ROUND(DAYS360(ValDat,RC1,0)/30,0)-R8C+MEP-MNR),0,1,1))) ->  | H99: =IF(RC1="","",IF(OR(R8C<=ROUND(DAYS360(ValDat,RC1,0)/30,0),R8C>ROUND(DAYS360(ExpDat,RC1,0)/30,0)),0,OFFSET(R45C,MAX(-MNR,ROUND(DAYS360(ValDat,RC1,0)/30,0)-R8C+MEP-MNR),0,1,1))) ->  | I99: =IF(RC1="","",IF(OR(R8C<=ROUND(DAYS360(ValDat,RC1,0)/30,0),R8C>ROUND(DAYS360(ExpDat,RC1,0)/30,0)),0,OFFSET(R45C,MAX(-MNR,ROUND(DAYS360(ValDat,RC1,0)/30,0)-R8C+MEP-MNR),0,1,1))) ->  | J99: =IF(RC1="","",IF(OR(R8C<=ROUND(DAYS360(ValDat,RC1,0)/30,0),R8C>ROUND(DAYS360(ExpDat,RC1,0)/30,0)),0,OFFSET(R45C,MAX(-MNR,ROUND(DAYS360(ValDat,RC1,0)/30,0)-R8C+MEP-MNR),0,1,1))) ->  | K99: =IF(RC1="","",IF(OR(R8C<=ROUND(DAYS360(ValDat,RC1,0)/30,0),R8C>ROUND(DAYS360(ExpDat,RC1,0)/30,0)),0,OFFSET(R45C,MAX(-MNR,ROUND(DAYS360(ValDat,RC1,0)/30,0)-R8C+MEP-MNR),0,1,1))) ->  | L99: =IF(RC1="","",IF(OR(R8C<=ROUND(DAYS360(ValDat,RC1,0)/30,0),R8C>ROUND(DAYS360(ExpDat,RC1,0)/30,0)),0,OFFSET(R45C,MAX(-MNR,ROUND(DAYS360(ValDat,RC1,0)/30,0)-R8C+MEP-MNR),0,1,1))) ->  | M99: =IF(RC1="","",IF(OR(R8C<=ROUND(DAYS360(ValDat,RC1,0)/30,0),R8C>ROUND(DAYS360(ExpDat,RC1,0)/30,0)),0,OFFSET(R45C,MAX(-MNR,ROUND(DAYS360(ValDat,RC1,0)/30,0)-R8C+MEP-MNR),0,1,1))) ->  | N99: =IF(RC1="","",IF(OR(R8C<=ROUND(DAYS360(ValDat,RC1,0)/30,0),R8C>ROUND(DAYS360(ExpDat,RC1,0)/30,0)),0,OFFSET(R45C,MAX(-MNR,ROUND(DAYS360(ValDat,RC1,0)/30,0)-R8C+MEP-MNR),0,1,1))) ->  | O99: =IF(RC1="","",IF(OR(R8C<=ROUND(DAYS360(ValDat,RC1,0)/30,0),R8C>ROUND(DAYS360(ExpDat,RC1,0)/30,0)),0,OFFSET(R45C,MAX(-MNR,ROUND(DAYS360(ValDat,RC1,0)/30,0)-R8C+MEP-MNR),0,1,1))) ->  | P99: =IF(RC1="","",IF(OR(R8C<=ROUND(DAYS360(ValDat,RC1,0)/30,0),R8C>ROUND(DAYS360(ExpDat,RC1,0)/30,0)),0,OFFSET(R45C,MAX(-MNR,ROUND(DAYS360(ValDat,RC1,0)/30,0)-R8C+MEP-MNR),0,1,1))) ->  | Q99: =IF(RC1="","",IF(OR(R8C<=ROUND(DAYS360(ValDat,RC1,0)/30,0),R8C>ROUND(DAYS360(ExpDat,RC1,0)/30,0)),0,OFFSET(R45C,MAX(-MNR,ROUND(DAYS360(ValDat,RC1,0)/30,0)-R8C+MEP-MNR),0,1,1))) ->  | R99: =IF(RC1="","",IF(OR(R8C<=ROUND(DAYS360(ValDat,RC1,0)/30,0),R8C>ROUND(DAYS360(ExpDat,RC1,0)/30,0)),0,OFFSET(R45C,MAX(-MNR,ROUND(DAYS360(ValDat,RC1,0)/30,0)-R8C+MEP-MNR),0,1,1))) ->  | S99: =IF(RC1="","",IF(OR(R8C<=ROUND(DAYS360(ValDat,RC1,0)/30,0),R8C>ROUND(DAYS360(ExpDat,RC1,0)/30,0)),0,OFFSET(R45C,MAX(-MNR,ROUND(DAYS360(ValDat,RC1,0)/30,0)-R8C+MEP-MNR),0,1,1))) ->  | T99: =IF(RC1="","",IF(OR(R8C<=ROUND(DAYS360(ValDat,RC1,0)/30,0),R8C>ROUND(DAYS360(ExpDat,RC1,0)/30,0)),0,OFFSET(R45C,MAX(-MNR,ROUND(DAYS360(ValDat,RC1,0)/30,0)-R8C+MEP-MNR),0,1,1))) ->  | U99: =IF(RC1="","",IF(OR(R8C<=ROUND(DAYS360(ValDat,RC1,0)/30,0),R8C>ROUND(DAYS360(ExpDat,RC1,0)/30,0)),0,OFFSET(R45C,MAX(-MNR,ROUND(DAYS360(ValDat,RC1,0)/30,0)-R8C+MEP-MNR),0,1,1))) ->  | V99: =IF(RC1="","",IF(OR(R8C<=ROUND(DAYS360(ValDat,RC1,0)/30,0),R8C>ROUND(DAYS360(ExpDat,RC1,0)/30,0)),0,OFFSET(R45C,MAX(-MNR,ROUND(DAYS360(ValDat,RC1,0)/30,0)-R8C+MEP-MNR),0,1,1))) ->  | W99: =IF(RC1="","",IF(OR(R8C<=ROUND(DAYS360(ValDat,RC1,0)/30,0),R8C>ROUND(DAYS360(ExpDat,RC1,0)/30,0)),0,OFFSET(R45C,MAX(-MNR,ROUND(DAYS360(ValDat,RC1,0)/30,0)-R8C+MEP-MNR),0,1,1))) ->  | X99: =IF(RC1="","",IF(OR(R8C<=ROUND(DAYS360(ValDat,RC1,0)/30,0),R8C>ROUND(DAYS360(ExpDat,RC1,0)/30,0)),0,OFFSET(R45C,MAX(-MNR,ROUND(DAYS360(ValDat,RC1,0)/30,0)-R8C+MEP-MNR),0,1,1))) ->  | Y99: =IF(RC1="","",IF(OR(R8C<=ROUND(DAYS360(ValDat,RC1,0)/30,0),R8C>ROUND(DAYS360(ExpDat,RC1,0)/30,0)),0,OFFSET(R45C,MAX(-MNR,ROUND(DAYS360(ValDat,RC1,0)/30,0)-R8C+MEP-MNR),0,1,1))) ->  | Z99: =IF(RC1="","",IF(OR(R8C<=ROUND(DAYS360(ValDat,RC1,0)/30,0),R8C>ROUND(DAYS360(ExpDat,RC1,0)/30,0)),0,OFFSET(R45C,MAX(-MNR,ROUND(DAYS360(ValDat,RC1,0)/30,0)-R8C+MEP-MNR),0,1,1))) ->  | AA99: =IF(RC1="","",IF(OR(R8C<=ROUND(DAYS360(ValDat,RC1,0)/30,0),R8C>ROUND(DAYS360(ExpDat,RC1,0)/30,0)),0,OFFSET(R45C,MAX(-MNR,ROUND(DAYS360(ValDat,RC1,0)/30,0)-R8C+MEP-MNR),0,1,1))) ->  | AB99: =IF(RC1="","",IF(OR(R8C<=ROUND(DAYS360(ValDat,RC1,0)/30,0),R8C>ROUND(DAYS360(ExpDat,RC1,0)/30,0)),0,OFFSET(R45C,MAX(-MNR,ROUND(DAYS360(ValDat,RC1,0)/30,0)-R8C+MEP-MNR),0,1,1))) ->  | AC99: =IF(RC1="","",IF(OR(R8C<=ROUND(DAYS360(ValDat,RC1,0)/30,0),R8C>ROUND(DAYS360(ExpDat,RC1,0)/30,0)),0,OFFSET(R45C,MAX(-MNR,ROUND(DAYS360(ValDat,RC1,0)/30,0)-R8C+MEP-MNR),0,1,1))) ->  | AD99: =IF(RC1="","",IF(OR(R8C<=ROUND(DAYS360(ValDat,RC1,0)/30,0),R8C>ROUND(DAYS360(ExpDat,RC1,0)/30,0)),0,OFFSET(R45C,MAX(-MNR,ROUND(DAYS360(ValDat,RC1,0)/30,0)-R8C+MEP-MNR),0,1,1))) ->  | AE99: =IF(RC1="","",IF(OR(R8C<=ROUND(DAYS360(ValDat,RC1,0)/30,0),R8C>ROUND(DAYS360(ExpDat,RC1,0)/30,0)),0,OFFSET(R45C,MAX(-MNR,ROUND(DAYS360(ValDat,RC1,0)/30,0)-R8C+MEP-MNR),0,1,1))) ->  | AF99: =IF(RC1="","",IF(OR(R8C<=ROUND(DAYS360(ValDat,RC1,0)/30,0),R8C>ROUND(DAYS360(ExpDat,RC1,0)/30,0)),0,OFFSET(R45C,MAX(-MNR,ROUND(DAYS360(ValDat,RC1,0)/30,0)-R8C+MEP-MNR),0,1,1))) ->  | AG99: =IF(RC1="","",IF(OR(R8C<=ROUND(DAYS360(ValDat,RC1,0)/30,0),R8C>ROUND(DAYS360(ExpDat,RC1,0)/30,0)),0,OFFSET(R45C,MAX(-MNR,ROUND(DAYS360(ValDat,RC1,0)/30,0)-R8C+MEP-MNR),0,1,1))) ->  | AH99: =IF(RC1="","",IF(OR(R8C<=ROUND(DAYS360(ValDat,RC1,0)/30,0),R8C>ROUND(DAYS360(ExpDat,RC1,0)/30,0)),0,OFFSET(R45C,MAX(-MNR,ROUND(DAYS360(ValDat,RC1,0)/30,0)-R8C+MEP-MNR),0,1,1))) ->  | AI99: =IF(RC1="","",IF(OR(R8C<=ROUND(DAYS360(ValDat,RC1,0)/30,0),R8C>ROUND(DAYS360(ExpDat,RC1,0)/30,0)),0,OFFSET(R45C,MAX(-MNR,ROUND(DAYS360(ValDat,RC1,0)/30,0)-R8C+MEP-MNR),0,1,1))) ->  | AJ99: =IF(RC1="","",IF(OR(R8C<=ROUND(DAYS360(ValDat,RC1,0)/30,0),R8C>ROUND(DAYS360(ExpDat,RC1,0)/30,0)),0,OFFSET(R45C,MAX(-MNR,ROUND(DAYS360(ValDat,RC1,0)/30,0)-R8C+MEP-MNR),0,1,1))) ->  | AK99: =IF(RC1="","",IF(OR(R8C<=ROUND(DAYS360(ValDat,RC1,0)/30,0),R8C>ROUND(DAYS360(ExpDat,RC1,0)/30,0)),0,OFFSET(R45C,MAX(-MNR,ROUND(DAYS360(ValDat,RC1,0)/30,0)-R8C+MEP-MNR),0,1,1))) ->  | AL99: =IF(RC1="","",IF(OR(R8C<=ROUND(DAYS360(ValDat,RC1,0)/30,0),R8C>ROUND(DAYS360(ExpDat,RC1,0)/30,0)),0,OFFSET(R45C,MAX(-MNR,ROUND(DAYS360(ValDat,RC1,0)/30,0)-R8C+MEP-MNR),0,1,1))) ->  | AM99: =IF(RC1="","",IF(OR(R8C<=ROUND(DAYS360(ValDat,RC1,0)/30,0),R8C>ROUND(DAYS360(ExpDat,RC1,0)/30,0)),0,OFFSET(R45C,MAX(-MNR,ROUND(DAYS360(ValDat,RC1,0)/30,0)-R8C+MEP-MNR),0,1,1))) ->  | AN99: =IF(RC1="","",IF(OR(R8C<=ROUND(DAYS360(ValDat,RC1,0)/30,0),R8C>ROUND(DAYS360(ExpDat,RC1,0)/30,0)),0,OFFSET(R45C,MAX(-MNR,ROUND(DAYS360(ValDat,RC1,0)/30,0)-R8C+MEP-MNR),0,1,1))) ->  | AO99: =IF(RC1="","",IF(OR(R8C<=ROUND(DAYS360(ValDat,RC1,0)/30,0),R8C>ROUND(DAYS360(ExpDat,RC1,0)/30,0)),0,OFFSET(R45C,MAX(-MNR,ROUND(DAYS360(ValDat,RC1,0)/30,0)-R8C+MEP-MNR),0,1,1))) -> 
A100: =IF(R[-1]C="","",IF(DATE(YEAR(R[-1]C),MONTH(R[-1]C)+1,1)>RunDat,"",DATE(YEAR(R[-1]C),MONTH(R[-1]C)+1,1))) ->  | D100: =IF(RC1="","",SUM(RC[2]:RC[37])) ->  | F100: =IF(RC1="","",IF(OR(R8C<=ROUND(DAYS360(ValDat,RC1,0)/30,0),R8C>ROUND(DAYS360(ExpDat,RC1,0)/30,0)),0,OFFSET(R45C,MAX(-MNR,ROUND(DAYS360(ValDat,RC1,0)/30,0)-R8C+MEP-MNR),0,1,1))) ->  | G100: =IF(RC1="","",IF(OR(R8C<=ROUND(DAYS360(ValDat,RC1,0)/30,0),R8C>ROUND(DAYS360(ExpDat,RC1,0)/30,0)),0,OFFSET(R45C,MAX(-MNR,ROUND(DAYS360(ValDat,RC1,0)/30,0)-R8C+MEP-MNR),0,1,1))) ->  | H100: =IF(RC1="","",IF(OR(R8C<=ROUND(DAYS360(ValDat,RC1,0)/30,0),R8C>ROUND(DAYS360(ExpDat,RC1,0)/30,0)),0,OFFSET(R45C,MAX(-MNR,ROUND(DAYS360(ValDat,RC1,0)/30,0)-R8C+MEP-MNR),0,1,1))) ->  | I100: =IF(RC1="","",IF(OR(R8C<=ROUND(DAYS360(ValDat,RC1,0)/30,0),R8C>ROUND(DAYS360(ExpDat,RC1,0)/30,0)),0,OFFSET(R45C,MAX(-MNR,ROUND(DAYS360(ValDat,RC1,0)/30,0)-R8C+MEP-MNR),0,1,1))) ->  | J100: =IF(RC1="","",IF(OR(R8C<=ROUND(DAYS360(ValDat,RC1,0)/30,0),R8C>ROUND(DAYS360(ExpDat,RC1,0)/30,0)),0,OFFSET(R45C,MAX(-MNR,ROUND(DAYS360(ValDat,RC1,0)/30,0)-R8C+MEP-MNR),0,1,1))) ->  | K100: =IF(RC1="","",IF(OR(R8C<=ROUND(DAYS360(ValDat,RC1,0)/30,0),R8C>ROUND(DAYS360(ExpDat,RC1,0)/30,0)),0,OFFSET(R45C,MAX(-MNR,ROUND(DAYS360(ValDat,RC1,0)/30,0)-R8C+MEP-MNR),0,1,1))) ->  | L100: =IF(RC1="","",IF(OR(R8C<=ROUND(DAYS360(ValDat,RC1,0)/30,0),R8C>ROUND(DAYS360(ExpDat,RC1,0)/30,0)),0,OFFSET(R45C,MAX(-MNR,ROUND(DAYS360(ValDat,RC1,0)/30,0)-R8C+MEP-MNR),0,1,1))) ->  | M100: =IF(RC1="","",IF(OR(R8C<=ROUND(DAYS360(ValDat,RC1,0)/30,0),R8C>ROUND(DAYS360(ExpDat,RC1,0)/30,0)),0,OFFSET(R45C,MAX(-MNR,ROUND(DAYS360(ValDat,RC1,0)/30,0)-R8C+MEP-MNR),0,1,1))) ->  | N100: =IF(RC1="","",IF(OR(R8C<=ROUND(DAYS360(ValDat,RC1,0)/30,0),R8C>ROUND(DAYS360(ExpDat,RC1,0)/30,0)),0,OFFSET(R45C,MAX(-MNR,ROUND(DAYS360(ValDat,RC1,0)/30,0)-R8C+MEP-MNR),0,1,1))) ->  | O100: =IF(RC1="","",IF(OR(R8C<=ROUND(DAYS360(ValDat,RC1,0)/30,0),R8C>ROUND(DAYS360(ExpDat,RC1,0)/30,0)),0,OFFSET(R45C,MAX(-MNR,ROUND(DAYS360(ValDat,RC1,0)/30,0)-R8C+MEP-MNR),0,1,1))) ->  | P100: =IF(RC1="","",IF(OR(R8C<=ROUND(DAYS360(ValDat,RC1,0)/30,0),R8C>ROUND(DAYS360(ExpDat,RC1,0)/30,0)),0,OFFSET(R45C,MAX(-MNR,ROUND(DAYS360(ValDat,RC1,0)/30,0)-R8C+MEP-MNR),0,1,1))) ->  | Q100: =IF(RC1="","",IF(OR(R8C<=ROUND(DAYS360(ValDat,RC1,0)/30,0),R8C>ROUND(DAYS360(ExpDat,RC1,0)/30,0)),0,OFFSET(R45C,MAX(-MNR,ROUND(DAYS360(ValDat,RC1,0)/30,0)-R8C+MEP-MNR),0,1,1))) ->  | R100: =IF(RC1="","",IF(OR(R8C<=ROUND(DAYS360(ValDat,RC1,0)/30,0),R8C>ROUND(DAYS360(ExpDat,RC1,0)/30,0)),0,OFFSET(R45C,MAX(-MNR,ROUND(DAYS360(ValDat,RC1,0)/30,0)-R8C+MEP-MNR),0,1,1))) ->  | S100: =IF(RC1="","",IF(OR(R8C<=ROUND(DAYS360(ValDat,RC1,0)/30,0),R8C>ROUND(DAYS360(ExpDat,RC1,0)/30,0)),0,OFFSET(R45C,MAX(-MNR,ROUND(DAYS360(ValDat,RC1,0)/30,0)-R8C+MEP-MNR),0,1,1))) ->  | T100: =IF(RC1="","",IF(OR(R8C<=ROUND(DAYS360(ValDat,RC1,0)/30,0),R8C>ROUND(DAYS360(ExpDat,RC1,0)/30,0)),0,OFFSET(R45C,MAX(-MNR,ROUND(DAYS360(ValDat,RC1,0)/30,0)-R8C+MEP-MNR),0,1,1))) ->  | U100: =IF(RC1="","",IF(OR(R8C<=ROUND(DAYS360(ValDat,RC1,0)/30,0),R8C>ROUND(DAYS360(ExpDat,RC1,0)/30,0)),0,OFFSET(R45C,MAX(-MNR,ROUND(DAYS360(ValDat,RC1,0)/30,0)-R8C+MEP-MNR),0,1,1))) ->  | V100: =IF(RC1="","",IF(OR(R8C<=ROUND(DAYS360(ValDat,RC1,0)/30,0),R8C>ROUND(DAYS360(ExpDat,RC1,0)/30,0)),0,OFFSET(R45C,MAX(-MNR,ROUND(DAYS360(ValDat,RC1,0)/30,0)-R8C+MEP-MNR),0,1,1))) ->  | W100: =IF(RC1="","",IF(OR(R8C<=ROUND(DAYS360(ValDat,RC1,0)/30,0),R8C>ROUND(DAYS360(ExpDat,RC1,0)/30,0)),0,OFFSET(R45C,MAX(-MNR,ROUND(DAYS360(ValDat,RC1,0)/30,0)-R8C+MEP-MNR),0,1,1))) ->  | X100: =IF(RC1="","",IF(OR(R8C<=ROUND(DAYS360(ValDat,RC1,0)/30,0),R8C>ROUND(DAYS360(ExpDat,RC1,0)/30,0)),0,OFFSET(R45C,MAX(-MNR,ROUND(DAYS360(ValDat,RC1,0)/30,0)-R8C+MEP-MNR),0,1,1))) ->  | Y100: =IF(RC1="","",IF(OR(R8C<=ROUND(DAYS360(ValDat,RC1,0)/30,0),R8C>ROUND(DAYS360(ExpDat,RC1,0)/30,0)),0,OFFSET(R45C,MAX(-MNR,ROUND(DAYS360(ValDat,RC1,0)/30,0)-R8C+MEP-MNR),0,1,1))) ->  | Z100: =IF(RC1="","",IF(OR(R8C<=ROUND(DAYS360(ValDat,RC1,0)/30,0),R8C>ROUND(DAYS360(ExpDat,RC1,0)/30,0)),0,OFFSET(R45C,MAX(-MNR,ROUND(DAYS360(ValDat,RC1,0)/30,0)-R8C+MEP-MNR),0,1,1))) ->  | AA100: =IF(RC1="","",IF(OR(R8C<=ROUND(DAYS360(ValDat,RC1,0)/30,0),R8C>ROUND(DAYS360(ExpDat,RC1,0)/30,0)),0,OFFSET(R45C,MAX(-MNR,ROUND(DAYS360(ValDat,RC1,0)/30,0)-R8C+MEP-MNR),0,1,1))) ->  | AB100: =IF(RC1="","",IF(OR(R8C<=ROUND(DAYS360(ValDat,RC1,0)/30,0),R8C>ROUND(DAYS360(ExpDat,RC1,0)/30,0)),0,OFFSET(R45C,MAX(-MNR,ROUND(DAYS360(ValDat,RC1,0)/30,0)-R8C+MEP-MNR),0,1,1))) ->  | AC100: =IF(RC1="","",IF(OR(R8C<=ROUND(DAYS360(ValDat,RC1,0)/30,0),R8C>ROUND(DAYS360(ExpDat,RC1,0)/30,0)),0,OFFSET(R45C,MAX(-MNR,ROUND(DAYS360(ValDat,RC1,0)/30,0)-R8C+MEP-MNR),0,1,1))) ->  | AD100: =IF(RC1="","",IF(OR(R8C<=ROUND(DAYS360(ValDat,RC1,0)/30,0),R8C>ROUND(DAYS360(ExpDat,RC1,0)/30,0)),0,OFFSET(R45C,MAX(-MNR,ROUND(DAYS360(ValDat,RC1,0)/30,0)-R8C+MEP-MNR),0,1,1))) ->  | AE100: =IF(RC1="","",IF(OR(R8C<=ROUND(DAYS360(ValDat,RC1,0)/30,0),R8C>ROUND(DAYS360(ExpDat,RC1,0)/30,0)),0,OFFSET(R45C,MAX(-MNR,ROUND(DAYS360(ValDat,RC1,0)/30,0)-R8C+MEP-MNR),0,1,1))) ->  | AF100: =IF(RC1="","",IF(OR(R8C<=ROUND(DAYS360(ValDat,RC1,0)/30,0),R8C>ROUND(DAYS360(ExpDat,RC1,0)/30,0)),0,OFFSET(R45C,MAX(-MNR,ROUND(DAYS360(ValDat,RC1,0)/30,0)-R8C+MEP-MNR),0,1,1))) ->  | AG100: =IF(RC1="","",IF(OR(R8C<=ROUND(DAYS360(ValDat,RC1,0)/30,0),R8C>ROUND(DAYS360(ExpDat,RC1,0)/30,0)),0,OFFSET(R45C,MAX(-MNR,ROUND(DAYS360(ValDat,RC1,0)/30,0)-R8C+MEP-MNR),0,1,1))) ->  | AH100: =IF(RC1="","",IF(OR(R8C<=ROUND(DAYS360(ValDat,RC1,0)/30,0),R8C>ROUND(DAYS360(ExpDat,RC1,0)/30,0)),0,OFFSET(R45C,MAX(-MNR,ROUND(DAYS360(ValDat,RC1,0)/30,0)-R8C+MEP-MNR),0,1,1))) ->  | AI100: =IF(RC1="","",IF(OR(R8C<=ROUND(DAYS360(ValDat,RC1,0)/30,0),R8C>ROUND(DAYS360(ExpDat,RC1,0)/30,0)),0,OFFSET(R45C,MAX(-MNR,ROUND(DAYS360(ValDat,RC1,0)/30,0)-R8C+MEP-MNR),0,1,1))) ->  | AJ100: =IF(RC1="","",IF(OR(R8C<=ROUND(DAYS360(ValDat,RC1,0)/30,0),R8C>ROUND(DAYS360(ExpDat,RC1,0)/30,0)),0,OFFSET(R45C,MAX(-MNR,ROUND(DAYS360(ValDat,RC1,0)/30,0)-R8C+MEP-MNR),0,1,1))) ->  | AK100: =IF(RC1="","",IF(OR(R8C<=ROUND(DAYS360(ValDat,RC1,0)/30,0),R8C>ROUND(DAYS360(ExpDat,RC1,0)/30,0)),0,OFFSET(R45C,MAX(-MNR,ROUND(DAYS360(ValDat,RC1,0)/30,0)-R8C+MEP-MNR),0,1,1))) ->  | AL100: =IF(RC1="","",IF(OR(R8C<=ROUND(DAYS360(ValDat,RC1,0)/30,0),R8C>ROUND(DAYS360(ExpDat,RC1,0)/30,0)),0,OFFSET(R45C,MAX(-MNR,ROUND(DAYS360(ValDat,RC1,0)/30,0)-R8C+MEP-MNR),0,1,1))) ->  | AM100: =IF(RC1="","",IF(OR(R8C<=ROUND(DAYS360(ValDat,RC1,0)/30,0),R8C>ROUND(DAYS360(ExpDat,RC1,0)/30,0)),0,OFFSET(R45C,MAX(-MNR,ROUND(DAYS360(ValDat,RC1,0)/30,0)-R8C+MEP-MNR),0,1,1))) ->  | AN100: =IF(RC1="","",IF(OR(R8C<=ROUND(DAYS360(ValDat,RC1,0)/30,0),R8C>ROUND(DAYS360(ExpDat,RC1,0)/30,0)),0,OFFSET(R45C,MAX(-MNR,ROUND(DAYS360(ValDat,RC1,0)/30,0)-R8C+MEP-MNR),0,1,1))) ->  | AO100: =IF(RC1="","",IF(OR(R8C<=ROUND(DAYS360(ValDat,RC1,0)/30,0),R8C>ROUND(DAYS360(ExpDat,RC1,0)/30,0)),0,OFFSET(R45C,MAX(-MNR,ROUND(DAYS360(ValDat,RC1,0)/30,0)-R8C+MEP-MNR),0,1,1))) -> 
A101: =IF(R[-1]C="","",IF(DATE(YEAR(R[-1]C),MONTH(R[-1]C)+1,1)>RunDat,"",DATE(YEAR(R[-1]C),MONTH(R[-1]C)+1,1))) ->  | D101: =IF(RC1="","",SUM(RC[2]:RC[37])) ->  | F101: =IF(RC1="","",IF(OR(R8C<=ROUND(DAYS360(ValDat,RC1,0)/30,0),R8C>ROUND(DAYS360(ExpDat,RC1,0)/30,0)),0,OFFSET(R45C,MAX(-MNR,ROUND(DAYS360(ValDat,RC1,0)/30,0)-R8C+MEP-MNR),0,1,1))) ->  | G101: =IF(RC1="","",IF(OR(R8C<=ROUND(DAYS360(ValDat,RC1,0)/30,0),R8C>ROUND(DAYS360(ExpDat,RC1,0)/30,0)),0,OFFSET(R45C,MAX(-MNR,ROUND(DAYS360(ValDat,RC1,0)/30,0)-R8C+MEP-MNR),0,1,1))) ->  | H101: =IF(RC1="","",IF(OR(R8C<=ROUND(DAYS360(ValDat,RC1,0)/30,0),R8C>ROUND(DAYS360(ExpDat,RC1,0)/30,0)),0,OFFSET(R45C,MAX(-MNR,ROUND(DAYS360(ValDat,RC1,0)/30,0)-R8C+MEP-MNR),0,1,1))) ->  | I101: =IF(RC1="","",IF(OR(R8C<=ROUND(DAYS360(ValDat,RC1,0)/30,0),R8C>ROUND(DAYS360(ExpDat,RC1,0)/30,0)),0,OFFSET(R45C,MAX(-MNR,ROUND(DAYS360(ValDat,RC1,0)/30,0)-R8C+MEP-MNR),0,1,1))) ->  | J101: =IF(RC1="","",IF(OR(R8C<=ROUND(DAYS360(ValDat,RC1,0)/30,0),R8C>ROUND(DAYS360(ExpDat,RC1,0)/30,0)),0,OFFSET(R45C,MAX(-MNR,ROUND(DAYS360(ValDat,RC1,0)/30,0)-R8C+MEP-MNR),0,1,1))) ->  | K101: =IF(RC1="","",IF(OR(R8C<=ROUND(DAYS360(ValDat,RC1,0)/30,0),R8C>ROUND(DAYS360(ExpDat,RC1,0)/30,0)),0,OFFSET(R45C,MAX(-MNR,ROUND(DAYS360(ValDat,RC1,0)/30,0)-R8C+MEP-MNR),0,1,1))) ->  | L101: =IF(RC1="","",IF(OR(R8C<=ROUND(DAYS360(ValDat,RC1,0)/30,0),R8C>ROUND(DAYS360(ExpDat,RC1,0)/30,0)),0,OFFSET(R45C,MAX(-MNR,ROUND(DAYS360(ValDat,RC1,0)/30,0)-R8C+MEP-MNR),0,1,1))) ->  | M101: =IF(RC1="","",IF(OR(R8C<=ROUND(DAYS360(ValDat,RC1,0)/30,0),R8C>ROUND(DAYS360(ExpDat,RC1,0)/30,0)),0,OFFSET(R45C,MAX(-MNR,ROUND(DAYS360(ValDat,RC1,0)/30,0)-R8C+MEP-MNR),0,1,1))) ->  | N101: =IF(RC1="","",IF(OR(R8C<=ROUND(DAYS360(ValDat,RC1,0)/30,0),R8C>ROUND(DAYS360(ExpDat,RC1,0)/30,0)),0,OFFSET(R45C,MAX(-MNR,ROUND(DAYS360(ValDat,RC1,0)/30,0)-R8C+MEP-MNR),0,1,1))) ->  | O101: =IF(RC1="","",IF(OR(R8C<=ROUND(DAYS360(ValDat,RC1,0)/30,0),R8C>ROUND(DAYS360(ExpDat,RC1,0)/30,0)),0,OFFSET(R45C,MAX(-MNR,ROUND(DAYS360(ValDat,RC1,0)/30,0)-R8C+MEP-MNR),0,1,1))) ->  | P101: =IF(RC1="","",IF(OR(R8C<=ROUND(DAYS360(ValDat,RC1,0)/30,0),R8C>ROUND(DAYS360(ExpDat,RC1,0)/30,0)),0,OFFSET(R45C,MAX(-MNR,ROUND(DAYS360(ValDat,RC1,0)/30,0)-R8C+MEP-MNR),0,1,1))) ->  | Q101: =IF(RC1="","",IF(OR(R8C<=ROUND(DAYS360(ValDat,RC1,0)/30,0),R8C>ROUND(DAYS360(ExpDat,RC1,0)/30,0)),0,OFFSET(R45C,MAX(-MNR,ROUND(DAYS360(ValDat,RC1,0)/30,0)-R8C+MEP-MNR),0,1,1))) ->  | R101: =IF(RC1="","",IF(OR(R8C<=ROUND(DAYS360(ValDat,RC1,0)/30,0),R8C>ROUND(DAYS360(ExpDat,RC1,0)/30,0)),0,OFFSET(R45C,MAX(-MNR,ROUND(DAYS360(ValDat,RC1,0)/30,0)-R8C+MEP-MNR),0,1,1))) ->  | S101: =IF(RC1="","",IF(OR(R8C<=ROUND(DAYS360(ValDat,RC1,0)/30,0),R8C>ROUND(DAYS360(ExpDat,RC1,0)/30,0)),0,OFFSET(R45C,MAX(-MNR,ROUND(DAYS360(ValDat,RC1,0)/30,0)-R8C+MEP-MNR),0,1,1))) ->  | T101: =IF(RC1="","",IF(OR(R8C<=ROUND(DAYS360(ValDat,RC1,0)/30,0),R8C>ROUND(DAYS360(ExpDat,RC1,0)/30,0)),0,OFFSET(R45C,MAX(-MNR,ROUND(DAYS360(ValDat,RC1,0)/30,0)-R8C+MEP-MNR),0,1,1))) ->  | U101: =IF(RC1="","",IF(OR(R8C<=ROUND(DAYS360(ValDat,RC1,0)/30,0),R8C>ROUND(DAYS360(ExpDat,RC1,0)/30,0)),0,OFFSET(R45C,MAX(-MNR,ROUND(DAYS360(ValDat,RC1,0)/30,0)-R8C+MEP-MNR),0,1,1))) ->  | V101: =IF(RC1="","",IF(OR(R8C<=ROUND(DAYS360(ValDat,RC1,0)/30,0),R8C>ROUND(DAYS360(ExpDat,RC1,0)/30,0)),0,OFFSET(R45C,MAX(-MNR,ROUND(DAYS360(ValDat,RC1,0)/30,0)-R8C+MEP-MNR),0,1,1))) ->  | W101: =IF(RC1="","",IF(OR(R8C<=ROUND(DAYS360(ValDat,RC1,0)/30,0),R8C>ROUND(DAYS360(ExpDat,RC1,0)/30,0)),0,OFFSET(R45C,MAX(-MNR,ROUND(DAYS360(ValDat,RC1,0)/30,0)-R8C+MEP-MNR),0,1,1))) ->  | X101: =IF(RC1="","",IF(OR(R8C<=ROUND(DAYS360(ValDat,RC1,0)/30,0),R8C>ROUND(DAYS360(ExpDat,RC1,0)/30,0)),0,OFFSET(R45C,MAX(-MNR,ROUND(DAYS360(ValDat,RC1,0)/30,0)-R8C+MEP-MNR),0,1,1))) ->  | Y101: =IF(RC1="","",IF(OR(R8C<=ROUND(DAYS360(ValDat,RC1,0)/30,0),R8C>ROUND(DAYS360(ExpDat,RC1,0)/30,0)),0,OFFSET(R45C,MAX(-MNR,ROUND(DAYS360(ValDat,RC1,0)/30,0)-R8C+MEP-MNR),0,1,1))) ->  | Z101: =IF(RC1="","",IF(OR(R8C<=ROUND(DAYS360(ValDat,RC1,0)/30,0),R8C>ROUND(DAYS360(ExpDat,RC1,0)/30,0)),0,OFFSET(R45C,MAX(-MNR,ROUND(DAYS360(ValDat,RC1,0)/30,0)-R8C+MEP-MNR),0,1,1))) ->  | AA101: =IF(RC1="","",IF(OR(R8C<=ROUND(DAYS360(ValDat,RC1,0)/30,0),R8C>ROUND(DAYS360(ExpDat,RC1,0)/30,0)),0,OFFSET(R45C,MAX(-MNR,ROUND(DAYS360(ValDat,RC1,0)/30,0)-R8C+MEP-MNR),0,1,1))) ->  | AB101: =IF(RC1="","",IF(OR(R8C<=ROUND(DAYS360(ValDat,RC1,0)/30,0),R8C>ROUND(DAYS360(ExpDat,RC1,0)/30,0)),0,OFFSET(R45C,MAX(-MNR,ROUND(DAYS360(ValDat,RC1,0)/30,0)-R8C+MEP-MNR),0,1,1))) ->  | AC101: =IF(RC1="","",IF(OR(R8C<=ROUND(DAYS360(ValDat,RC1,0)/30,0),R8C>ROUND(DAYS360(ExpDat,RC1,0)/30,0)),0,OFFSET(R45C,MAX(-MNR,ROUND(DAYS360(ValDat,RC1,0)/30,0)-R8C+MEP-MNR),0,1,1))) ->  | AD101: =IF(RC1="","",IF(OR(R8C<=ROUND(DAYS360(ValDat,RC1,0)/30,0),R8C>ROUND(DAYS360(ExpDat,RC1,0)/30,0)),0,OFFSET(R45C,MAX(-MNR,ROUND(DAYS360(ValDat,RC1,0)/30,0)-R8C+MEP-MNR),0,1,1))) ->  | AE101: =IF(RC1="","",IF(OR(R8C<=ROUND(DAYS360(ValDat,RC1,0)/30,0),R8C>ROUND(DAYS360(ExpDat,RC1,0)/30,0)),0,OFFSET(R45C,MAX(-MNR,ROUND(DAYS360(ValDat,RC1,0)/30,0)-R8C+MEP-MNR),0,1,1))) ->  | AF101: =IF(RC1="","",IF(OR(R8C<=ROUND(DAYS360(ValDat,RC1,0)/30,0),R8C>ROUND(DAYS360(ExpDat,RC1,0)/30,0)),0,OFFSET(R45C,MAX(-MNR,ROUND(DAYS360(ValDat,RC1,0)/30,0)-R8C+MEP-MNR),0,1,1))) ->  | AG101: =IF(RC1="","",IF(OR(R8C<=ROUND(DAYS360(ValDat,RC1,0)/30,0),R8C>ROUND(DAYS360(ExpDat,RC1,0)/30,0)),0,OFFSET(R45C,MAX(-MNR,ROUND(DAYS360(ValDat,RC1,0)/30,0)-R8C+MEP-MNR),0,1,1))) ->  | AH101: =IF(RC1="","",IF(OR(R8C<=ROUND(DAYS360(ValDat,RC1,0)/30,0),R8C>ROUND(DAYS360(ExpDat,RC1,0)/30,0)),0,OFFSET(R45C,MAX(-MNR,ROUND(DAYS360(ValDat,RC1,0)/30,0)-R8C+MEP-MNR),0,1,1))) ->  | AI101: =IF(RC1="","",IF(OR(R8C<=ROUND(DAYS360(ValDat,RC1,0)/30,0),R8C>ROUND(DAYS360(ExpDat,RC1,0)/30,0)),0,OFFSET(R45C,MAX(-MNR,ROUND(DAYS360(ValDat,RC1,0)/30,0)-R8C+MEP-MNR),0,1,1))) ->  | AJ101: =IF(RC1="","",IF(OR(R8C<=ROUND(DAYS360(ValDat,RC1,0)/30,0),R8C>ROUND(DAYS360(ExpDat,RC1,0)/30,0)),0,OFFSET(R45C,MAX(-MNR,ROUND(DAYS360(ValDat,RC1,0)/30,0)-R8C+MEP-MNR),0,1,1))) ->  | AK101: =IF(RC1="","",IF(OR(R8C<=ROUND(DAYS360(ValDat,RC1,0)/30,0),R8C>ROUND(DAYS360(ExpDat,RC1,0)/30,0)),0,OFFSET(R45C,MAX(-MNR,ROUND(DAYS360(ValDat,RC1,0)/30,0)-R8C+MEP-MNR),0,1,1))) ->  | AL101: =IF(RC1="","",IF(OR(R8C<=ROUND(DAYS360(ValDat,RC1,0)/30,0),R8C>ROUND(DAYS360(ExpDat,RC1,0)/30,0)),0,OFFSET(R45C,MAX(-MNR,ROUND(DAYS360(ValDat,RC1,0)/30,0)-R8C+MEP-MNR),0,1,1))) ->  | AM101: =IF(RC1="","",IF(OR(R8C<=ROUND(DAYS360(ValDat,RC1,0)/30,0),R8C>ROUND(DAYS360(ExpDat,RC1,0)/30,0)),0,OFFSET(R45C,MAX(-MNR,ROUND(DAYS360(ValDat,RC1,0)/30,0)-R8C+MEP-MNR),0,1,1))) ->  | AN101: =IF(RC1="","",IF(OR(R8C<=ROUND(DAYS360(ValDat,RC1,0)/30,0),R8C>ROUND(DAYS360(ExpDat,RC1,0)/30,0)),0,OFFSET(R45C,MAX(-MNR,ROUND(DAYS360(ValDat,RC1,0)/30,0)-R8C+MEP-MNR),0,1,1))) ->  | AO101: =IF(RC1="","",IF(OR(R8C<=ROUND(DAYS360(ValDat,RC1,0)/30,0),R8C>ROUND(DAYS360(ExpDat,RC1,0)/30,0)),0,OFFSET(R45C,MAX(-MNR,ROUND(DAYS360(ValDat,RC1,0)/30,0)-R8C+MEP-MNR),0,1,1))) -> 
A102: =IF(R[-1]C="","",IF(DATE(YEAR(R[-1]C),MONTH(R[-1]C)+1,1)>RunDat,"",DATE(YEAR(R[-1]C),MONTH(R[-1]C)+1,1))) ->  | D102: =IF(RC1="","",SUM(RC[2]:RC[37])) ->  | F102: =IF(RC1="","",IF(OR(R8C<=ROUND(DAYS360(ValDat,RC1,0)/30,0),R8C>ROUND(DAYS360(ExpDat,RC1,0)/30,0)),0,OFFSET(R45C,MAX(-MNR,ROUND(DAYS360(ValDat,RC1,0)/30,0)-R8C+MEP-MNR),0,1,1))) ->  | G102: =IF(RC1="","",IF(OR(R8C<=ROUND(DAYS360(ValDat,RC1,0)/30,0),R8C>ROUND(DAYS360(ExpDat,RC1,0)/30,0)),0,OFFSET(R45C,MAX(-MNR,ROUND(DAYS360(ValDat,RC1,0)/30,0)-R8C+MEP-MNR),0,1,1))) ->  | H102: =IF(RC1="","",IF(OR(R8C<=ROUND(DAYS360(ValDat,RC1,0)/30,0),R8C>ROUND(DAYS360(ExpDat,RC1,0)/30,0)),0,OFFSET(R45C,MAX(-MNR,ROUND(DAYS360(ValDat,RC1,0)/30,0)-R8C+MEP-MNR),0,1,1))) ->  | I102: =IF(RC1="","",IF(OR(R8C<=ROUND(DAYS360(ValDat,RC1,0)/30,0),R8C>ROUND(DAYS360(ExpDat,RC1,0)/30,0)),0,OFFSET(R45C,MAX(-MNR,ROUND(DAYS360(ValDat,RC1,0)/30,0)-R8C+MEP-MNR),0,1,1))) ->  | J102: =IF(RC1="","",IF(OR(R8C<=ROUND(DAYS360(ValDat,RC1,0)/30,0),R8C>ROUND(DAYS360(ExpDat,RC1,0)/30,0)),0,OFFSET(R45C,MAX(-MNR,ROUND(DAYS360(ValDat,RC1,0)/30,0)-R8C+MEP-MNR),0,1,1))) ->  | K102: =IF(RC1="","",IF(OR(R8C<=ROUND(DAYS360(ValDat,RC1,0)/30,0),R8C>ROUND(DAYS360(ExpDat,RC1,0)/30,0)),0,OFFSET(R45C,MAX(-MNR,ROUND(DAYS360(ValDat,RC1,0)/30,0)-R8C+MEP-MNR),0,1,1))) ->  | L102: =IF(RC1="","",IF(OR(R8C<=ROUND(DAYS360(ValDat,RC1,0)/30,0),R8C>ROUND(DAYS360(ExpDat,RC1,0)/30,0)),0,OFFSET(R45C,MAX(-MNR,ROUND(DAYS360(ValDat,RC1,0)/30,0)-R8C+MEP-MNR),0,1,1))) ->  | M102: =IF(RC1="","",IF(OR(R8C<=ROUND(DAYS360(ValDat,RC1,0)/30,0),R8C>ROUND(DAYS360(ExpDat,RC1,0)/30,0)),0,OFFSET(R45C,MAX(-MNR,ROUND(DAYS360(ValDat,RC1,0)/30,0)-R8C+MEP-MNR),0,1,1))) ->  | N102: =IF(RC1="","",IF(OR(R8C<=ROUND(DAYS360(ValDat,RC1,0)/30,0),R8C>ROUND(DAYS360(ExpDat,RC1,0)/30,0)),0,OFFSET(R45C,MAX(-MNR,ROUND(DAYS360(ValDat,RC1,0)/30,0)-R8C+MEP-MNR),0,1,1))) ->  | O102: =IF(RC1="","",IF(OR(R8C<=ROUND(DAYS360(ValDat,RC1,0)/30,0),R8C>ROUND(DAYS360(ExpDat,RC1,0)/30,0)),0,OFFSET(R45C,MAX(-MNR,ROUND(DAYS360(ValDat,RC1,0)/30,0)-R8C+MEP-MNR),0,1,1))) ->  | P102: =IF(RC1="","",IF(OR(R8C<=ROUND(DAYS360(ValDat,RC1,0)/30,0),R8C>ROUND(DAYS360(ExpDat,RC1,0)/30,0)),0,OFFSET(R45C,MAX(-MNR,ROUND(DAYS360(ValDat,RC1,0)/30,0)-R8C+MEP-MNR),0,1,1))) ->  | Q102: =IF(RC1="","",IF(OR(R8C<=ROUND(DAYS360(ValDat,RC1,0)/30,0),R8C>ROUND(DAYS360(ExpDat,RC1,0)/30,0)),0,OFFSET(R45C,MAX(-MNR,ROUND(DAYS360(ValDat,RC1,0)/30,0)-R8C+MEP-MNR),0,1,1))) ->  | R102: =IF(RC1="","",IF(OR(R8C<=ROUND(DAYS360(ValDat,RC1,0)/30,0),R8C>ROUND(DAYS360(ExpDat,RC1,0)/30,0)),0,OFFSET(R45C,MAX(-MNR,ROUND(DAYS360(ValDat,RC1,0)/30,0)-R8C+MEP-MNR),0,1,1))) ->  | S102: =IF(RC1="","",IF(OR(R8C<=ROUND(DAYS360(ValDat,RC1,0)/30,0),R8C>ROUND(DAYS360(ExpDat,RC1,0)/30,0)),0,OFFSET(R45C,MAX(-MNR,ROUND(DAYS360(ValDat,RC1,0)/30,0)-R8C+MEP-MNR),0,1,1))) ->  | T102: =IF(RC1="","",IF(OR(R8C<=ROUND(DAYS360(ValDat,RC1,0)/30,0),R8C>ROUND(DAYS360(ExpDat,RC1,0)/30,0)),0,OFFSET(R45C,MAX(-MNR,ROUND(DAYS360(ValDat,RC1,0)/30,0)-R8C+MEP-MNR),0,1,1))) ->  | U102: =IF(RC1="","",IF(OR(R8C<=ROUND(DAYS360(ValDat,RC1,0)/30,0),R8C>ROUND(DAYS360(ExpDat,RC1,0)/30,0)),0,OFFSET(R45C,MAX(-MNR,ROUND(DAYS360(ValDat,RC1,0)/30,0)-R8C+MEP-MNR),0,1,1))) ->  | V102: =IF(RC1="","",IF(OR(R8C<=ROUND(DAYS360(ValDat,RC1,0)/30,0),R8C>ROUND(DAYS360(ExpDat,RC1,0)/30,0)),0,OFFSET(R45C,MAX(-MNR,ROUND(DAYS360(ValDat,RC1,0)/30,0)-R8C+MEP-MNR),0,1,1))) ->  | W102: =IF(RC1="","",IF(OR(R8C<=ROUND(DAYS360(ValDat,RC1,0)/30,0),R8C>ROUND(DAYS360(ExpDat,RC1,0)/30,0)),0,OFFSET(R45C,MAX(-MNR,ROUND(DAYS360(ValDat,RC1,0)/30,0)-R8C+MEP-MNR),0,1,1))) ->  | X102: =IF(RC1="","",IF(OR(R8C<=ROUND(DAYS360(ValDat,RC1,0)/30,0),R8C>ROUND(DAYS360(ExpDat,RC1,0)/30,0)),0,OFFSET(R45C,MAX(-MNR,ROUND(DAYS360(ValDat,RC1,0)/30,0)-R8C+MEP-MNR),0,1,1))) ->  | Y102: =IF(RC1="","",IF(OR(R8C<=ROUND(DAYS360(ValDat,RC1,0)/30,0),R8C>ROUND(DAYS360(ExpDat,RC1,0)/30,0)),0,OFFSET(R45C,MAX(-MNR,ROUND(DAYS360(ValDat,RC1,0)/30,0)-R8C+MEP-MNR),0,1,1))) ->  | Z102: =IF(RC1="","",IF(OR(R8C<=ROUND(DAYS360(ValDat,RC1,0)/30,0),R8C>ROUND(DAYS360(ExpDat,RC1,0)/30,0)),0,OFFSET(R45C,MAX(-MNR,ROUND(DAYS360(ValDat,RC1,0)/30,0)-R8C+MEP-MNR),0,1,1))) ->  | AA102: =IF(RC1="","",IF(OR(R8C<=ROUND(DAYS360(ValDat,RC1,0)/30,0),R8C>ROUND(DAYS360(ExpDat,RC1,0)/30,0)),0,OFFSET(R45C,MAX(-MNR,ROUND(DAYS360(ValDat,RC1,0)/30,0)-R8C+MEP-MNR),0,1,1))) ->  | AB102: =IF(RC1="","",IF(OR(R8C<=ROUND(DAYS360(ValDat,RC1,0)/30,0),R8C>ROUND(DAYS360(ExpDat,RC1,0)/30,0)),0,OFFSET(R45C,MAX(-MNR,ROUND(DAYS360(ValDat,RC1,0)/30,0)-R8C+MEP-MNR),0,1,1))) ->  | AC102: =IF(RC1="","",IF(OR(R8C<=ROUND(DAYS360(ValDat,RC1,0)/30,0),R8C>ROUND(DAYS360(ExpDat,RC1,0)/30,0)),0,OFFSET(R45C,MAX(-MNR,ROUND(DAYS360(ValDat,RC1,0)/30,0)-R8C+MEP-MNR),0,1,1))) ->  | AD102: =IF(RC1="","",IF(OR(R8C<=ROUND(DAYS360(ValDat,RC1,0)/30,0),R8C>ROUND(DAYS360(ExpDat,RC1,0)/30,0)),0,OFFSET(R45C,MAX(-MNR,ROUND(DAYS360(ValDat,RC1,0)/30,0)-R8C+MEP-MNR),0,1,1))) ->  | AE102: =IF(RC1="","",IF(OR(R8C<=ROUND(DAYS360(ValDat,RC1,0)/30,0),R8C>ROUND(DAYS360(ExpDat,RC1,0)/30,0)),0,OFFSET(R45C,MAX(-MNR,ROUND(DAYS360(ValDat,RC1,0)/30,0)-R8C+MEP-MNR),0,1,1))) ->  | AF102: =IF(RC1="","",IF(OR(R8C<=ROUND(DAYS360(ValDat,RC1,0)/30,0),R8C>ROUND(DAYS360(ExpDat,RC1,0)/30,0)),0,OFFSET(R45C,MAX(-MNR,ROUND(DAYS360(ValDat,RC1,0)/30,0)-R8C+MEP-MNR),0,1,1))) ->  | AG102: =IF(RC1="","",IF(OR(R8C<=ROUND(DAYS360(ValDat,RC1,0)/30,0),R8C>ROUND(DAYS360(ExpDat,RC1,0)/30,0)),0,OFFSET(R45C,MAX(-MNR,ROUND(DAYS360(ValDat,RC1,0)/30,0)-R8C+MEP-MNR),0,1,1))) ->  | AH102: =IF(RC1="","",IF(OR(R8C<=ROUND(DAYS360(ValDat,RC1,0)/30,0),R8C>ROUND(DAYS360(ExpDat,RC1,0)/30,0)),0,OFFSET(R45C,MAX(-MNR,ROUND(DAYS360(ValDat,RC1,0)/30,0)-R8C+MEP-MNR),0,1,1))) ->  | AI102: =IF(RC1="","",IF(OR(R8C<=ROUND(DAYS360(ValDat,RC1,0)/30,0),R8C>ROUND(DAYS360(ExpDat,RC1,0)/30,0)),0,OFFSET(R45C,MAX(-MNR,ROUND(DAYS360(ValDat,RC1,0)/30,0)-R8C+MEP-MNR),0,1,1))) ->  | AJ102: =IF(RC1="","",IF(OR(R8C<=ROUND(DAYS360(ValDat,RC1,0)/30,0),R8C>ROUND(DAYS360(ExpDat,RC1,0)/30,0)),0,OFFSET(R45C,MAX(-MNR,ROUND(DAYS360(ValDat,RC1,0)/30,0)-R8C+MEP-MNR),0,1,1))) ->  | AK102: =IF(RC1="","",IF(OR(R8C<=ROUND(DAYS360(ValDat,RC1,0)/30,0),R8C>ROUND(DAYS360(ExpDat,RC1,0)/30,0)),0,OFFSET(R45C,MAX(-MNR,ROUND(DAYS360(ValDat,RC1,0)/30,0)-R8C+MEP-MNR),0,1,1))) ->  | AL102: =IF(RC1="","",IF(OR(R8C<=ROUND(DAYS360(ValDat,RC1,0)/30,0),R8C>ROUND(DAYS360(ExpDat,RC1,0)/30,0)),0,OFFSET(R45C,MAX(-MNR,ROUND(DAYS360(ValDat,RC1,0)/30,0)-R8C+MEP-MNR),0,1,1))) ->  | AM102: =IF(RC1="","",IF(OR(R8C<=ROUND(DAYS360(ValDat,RC1,0)/30,0),R8C>ROUND(DAYS360(ExpDat,RC1,0)/30,0)),0,OFFSET(R45C,MAX(-MNR,ROUND(DAYS360(ValDat,RC1,0)/30,0)-R8C+MEP-MNR),0,1,1))) ->  | AN102: =IF(RC1="","",IF(OR(R8C<=ROUND(DAYS360(ValDat,RC1,0)/30,0),R8C>ROUND(DAYS360(ExpDat,RC1,0)/30,0)),0,OFFSET(R45C,MAX(-MNR,ROUND(DAYS360(ValDat,RC1,0)/30,0)-R8C+MEP-MNR),0,1,1))) ->  | AO102: =IF(RC1="","",IF(OR(R8C<=ROUND(DAYS360(ValDat,RC1,0)/30,0),R8C>ROUND(DAYS360(ExpDat,RC1,0)/30,0)),0,OFFSET(R45C,MAX(-MNR,ROUND(DAYS360(ValDat,RC1,0)/30,0)-R8C+MEP-MNR),0,1,1))) -> 
A103: =IF(R[-1]C="","",IF(DATE(YEAR(R[-1]C),MONTH(R[-1]C)+1,1)>RunDat,"",DATE(YEAR(R[-1]C),MONTH(R[-1]C)+1,1))) ->  | D103: =IF(RC1="","",SUM(RC[2]:RC[37])) ->  | F103: =IF(RC1="","",IF(OR(R8C<=ROUND(DAYS360(ValDat,RC1,0)/30,0),R8C>ROUND(DAYS360(ExpDat,RC1,0)/30,0)),0,OFFSET(R45C,MAX(-MNR,ROUND(DAYS360(ValDat,RC1,0)/30,0)-R8C+MEP-MNR),0,1,1))) ->  | G103: =IF(RC1="","",IF(OR(R8C<=ROUND(DAYS360(ValDat,RC1,0)/30,0),R8C>ROUND(DAYS360(ExpDat,RC1,0)/30,0)),0,OFFSET(R45C,MAX(-MNR,ROUND(DAYS360(ValDat,RC1,0)/30,0)-R8C+MEP-MNR),0,1,1))) ->  | H103: =IF(RC1="","",IF(OR(R8C<=ROUND(DAYS360(ValDat,RC1,0)/30,0),R8C>ROUND(DAYS360(ExpDat,RC1,0)/30,0)),0,OFFSET(R45C,MAX(-MNR,ROUND(DAYS360(ValDat,RC1,0)/30,0)-R8C+MEP-MNR),0,1,1))) ->  | I103: =IF(RC1="","",IF(OR(R8C<=ROUND(DAYS360(ValDat,RC1,0)/30,0),R8C>ROUND(DAYS360(ExpDat,RC1,0)/30,0)),0,OFFSET(R45C,MAX(-MNR,ROUND(DAYS360(ValDat,RC1,0)/30,0)-R8C+MEP-MNR),0,1,1))) ->  | J103: =IF(RC1="","",IF(OR(R8C<=ROUND(DAYS360(ValDat,RC1,0)/30,0),R8C>ROUND(DAYS360(ExpDat,RC1,0)/30,0)),0,OFFSET(R45C,MAX(-MNR,ROUND(DAYS360(ValDat,RC1,0)/30,0)-R8C+MEP-MNR),0,1,1))) ->  | K103: =IF(RC1="","",IF(OR(R8C<=ROUND(DAYS360(ValDat,RC1,0)/30,0),R8C>ROUND(DAYS360(ExpDat,RC1,0)/30,0)),0,OFFSET(R45C,MAX(-MNR,ROUND(DAYS360(ValDat,RC1,0)/30,0)-R8C+MEP-MNR),0,1,1))) ->  | L103: =IF(RC1="","",IF(OR(R8C<=ROUND(DAYS360(ValDat,RC1,0)/30,0),R8C>ROUND(DAYS360(ExpDat,RC1,0)/30,0)),0,OFFSET(R45C,MAX(-MNR,ROUND(DAYS360(ValDat,RC1,0)/30,0)-R8C+MEP-MNR),0,1,1))) ->  | M103: =IF(RC1="","",IF(OR(R8C<=ROUND(DAYS360(ValDat,RC1,0)/30,0),R8C>ROUND(DAYS360(ExpDat,RC1,0)/30,0)),0,OFFSET(R45C,MAX(-MNR,ROUND(DAYS360(ValDat,RC1,0)/30,0)-R8C+MEP-MNR),0,1,1))) ->  | N103: =IF(RC1="","",IF(OR(R8C<=ROUND(DAYS360(ValDat,RC1,0)/30,0),R8C>ROUND(DAYS360(ExpDat,RC1,0)/30,0)),0,OFFSET(R45C,MAX(-MNR,ROUND(DAYS360(ValDat,RC1,0)/30,0)-R8C+MEP-MNR),0,1,1))) ->  | O103: =IF(RC1="","",IF(OR(R8C<=ROUND(DAYS360(ValDat,RC1,0)/30,0),R8C>ROUND(DAYS360(ExpDat,RC1,0)/30,0)),0,OFFSET(R45C,MAX(-MNR,ROUND(DAYS360(ValDat,RC1,0)/30,0)-R8C+MEP-MNR),0,1,1))) ->  | P103: =IF(RC1="","",IF(OR(R8C<=ROUND(DAYS360(ValDat,RC1,0)/30,0),R8C>ROUND(DAYS360(ExpDat,RC1,0)/30,0)),0,OFFSET(R45C,MAX(-MNR,ROUND(DAYS360(ValDat,RC1,0)/30,0)-R8C+MEP-MNR),0,1,1))) ->  | Q103: =IF(RC1="","",IF(OR(R8C<=ROUND(DAYS360(ValDat,RC1,0)/30,0),R8C>ROUND(DAYS360(ExpDat,RC1,0)/30,0)),0,OFFSET(R45C,MAX(-MNR,ROUND(DAYS360(ValDat,RC1,0)/30,0)-R8C+MEP-MNR),0,1,1))) ->  | R103: =IF(RC1="","",IF(OR(R8C<=ROUND(DAYS360(ValDat,RC1,0)/30,0),R8C>ROUND(DAYS360(ExpDat,RC1,0)/30,0)),0,OFFSET(R45C,MAX(-MNR,ROUND(DAYS360(ValDat,RC1,0)/30,0)-R8C+MEP-MNR),0,1,1))) ->  | S103: =IF(RC1="","",IF(OR(R8C<=ROUND(DAYS360(ValDat,RC1,0)/30,0),R8C>ROUND(DAYS360(ExpDat,RC1,0)/30,0)),0,OFFSET(R45C,MAX(-MNR,ROUND(DAYS360(ValDat,RC1,0)/30,0)-R8C+MEP-MNR),0,1,1))) ->  | T103: =IF(RC1="","",IF(OR(R8C<=ROUND(DAYS360(ValDat,RC1,0)/30,0),R8C>ROUND(DAYS360(ExpDat,RC1,0)/30,0)),0,OFFSET(R45C,MAX(-MNR,ROUND(DAYS360(ValDat,RC1,0)/30,0)-R8C+MEP-MNR),0,1,1))) ->  | U103: =IF(RC1="","",IF(OR(R8C<=ROUND(DAYS360(ValDat,RC1,0)/30,0),R8C>ROUND(DAYS360(ExpDat,RC1,0)/30,0)),0,OFFSET(R45C,MAX(-MNR,ROUND(DAYS360(ValDat,RC1,0)/30,0)-R8C+MEP-MNR),0,1,1))) ->  | V103: =IF(RC1="","",IF(OR(R8C<=ROUND(DAYS360(ValDat,RC1,0)/30,0),R8C>ROUND(DAYS360(ExpDat,RC1,0)/30,0)),0,OFFSET(R45C,MAX(-MNR,ROUND(DAYS360(ValDat,RC1,0)/30,0)-R8C+MEP-MNR),0,1,1))) ->  | W103: =IF(RC1="","",IF(OR(R8C<=ROUND(DAYS360(ValDat,RC1,0)/30,0),R8C>ROUND(DAYS360(ExpDat,RC1,0)/30,0)),0,OFFSET(R45C,MAX(-MNR,ROUND(DAYS360(ValDat,RC1,0)/30,0)-R8C+MEP-MNR),0,1,1))) ->  | X103: =IF(RC1="","",IF(OR(R8C<=ROUND(DAYS360(ValDat,RC1,0)/30,0),R8C>ROUND(DAYS360(ExpDat,RC1,0)/30,0)),0,OFFSET(R45C,MAX(-MNR,ROUND(DAYS360(ValDat,RC1,0)/30,0)-R8C+MEP-MNR),0,1,1))) ->  | Y103: =IF(RC1="","",IF(OR(R8C<=ROUND(DAYS360(ValDat,RC1,0)/30,0),R8C>ROUND(DAYS360(ExpDat,RC1,0)/30,0)),0,OFFSET(R45C,MAX(-MNR,ROUND(DAYS360(ValDat,RC1,0)/30,0)-R8C+MEP-MNR),0,1,1))) ->  | Z103: =IF(RC1="","",IF(OR(R8C<=ROUND(DAYS360(ValDat,RC1,0)/30,0),R8C>ROUND(DAYS360(ExpDat,RC1,0)/30,0)),0,OFFSET(R45C,MAX(-MNR,ROUND(DAYS360(ValDat,RC1,0)/30,0)-R8C+MEP-MNR),0,1,1))) ->  | AA103: =IF(RC1="","",IF(OR(R8C<=ROUND(DAYS360(ValDat,RC1,0)/30,0),R8C>ROUND(DAYS360(ExpDat,RC1,0)/30,0)),0,OFFSET(R45C,MAX(-MNR,ROUND(DAYS360(ValDat,RC1,0)/30,0)-R8C+MEP-MNR),0,1,1))) ->  | AB103: =IF(RC1="","",IF(OR(R8C<=ROUND(DAYS360(ValDat,RC1,0)/30,0),R8C>ROUND(DAYS360(ExpDat,RC1,0)/30,0)),0,OFFSET(R45C,MAX(-MNR,ROUND(DAYS360(ValDat,RC1,0)/30,0)-R8C+MEP-MNR),0,1,1))) ->  | AC103: =IF(RC1="","",IF(OR(R8C<=ROUND(DAYS360(ValDat,RC1,0)/30,0),R8C>ROUND(DAYS360(ExpDat,RC1,0)/30,0)),0,OFFSET(R45C,MAX(-MNR,ROUND(DAYS360(ValDat,RC1,0)/30,0)-R8C+MEP-MNR),0,1,1))) ->  | AD103: =IF(RC1="","",IF(OR(R8C<=ROUND(DAYS360(ValDat,RC1,0)/30,0),R8C>ROUND(DAYS360(ExpDat,RC1,0)/30,0)),0,OFFSET(R45C,MAX(-MNR,ROUND(DAYS360(ValDat,RC1,0)/30,0)-R8C+MEP-MNR),0,1,1))) ->  | AE103: =IF(RC1="","",IF(OR(R8C<=ROUND(DAYS360(ValDat,RC1,0)/30,0),R8C>ROUND(DAYS360(ExpDat,RC1,0)/30,0)),0,OFFSET(R45C,MAX(-MNR,ROUND(DAYS360(ValDat,RC1,0)/30,0)-R8C+MEP-MNR),0,1,1))) ->  | AF103: =IF(RC1="","",IF(OR(R8C<=ROUND(DAYS360(ValDat,RC1,0)/30,0),R8C>ROUND(DAYS360(ExpDat,RC1,0)/30,0)),0,OFFSET(R45C,MAX(-MNR,ROUND(DAYS360(ValDat,RC1,0)/30,0)-R8C+MEP-MNR),0,1,1))) ->  | AG103: =IF(RC1="","",IF(OR(R8C<=ROUND(DAYS360(ValDat,RC1,0)/30,0),R8C>ROUND(DAYS360(ExpDat,RC1,0)/30,0)),0,OFFSET(R45C,MAX(-MNR,ROUND(DAYS360(ValDat,RC1,0)/30,0)-R8C+MEP-MNR),0,1,1))) ->  | AH103: =IF(RC1="","",IF(OR(R8C<=ROUND(DAYS360(ValDat,RC1,0)/30,0),R8C>ROUND(DAYS360(ExpDat,RC1,0)/30,0)),0,OFFSET(R45C,MAX(-MNR,ROUND(DAYS360(ValDat,RC1,0)/30,0)-R8C+MEP-MNR),0,1,1))) ->  | AI103: =IF(RC1="","",IF(OR(R8C<=ROUND(DAYS360(ValDat,RC1,0)/30,0),R8C>ROUND(DAYS360(ExpDat,RC1,0)/30,0)),0,OFFSET(R45C,MAX(-MNR,ROUND(DAYS360(ValDat,RC1,0)/30,0)-R8C+MEP-MNR),0,1,1))) ->  | AJ103: =IF(RC1="","",IF(OR(R8C<=ROUND(DAYS360(ValDat,RC1,0)/30,0),R8C>ROUND(DAYS360(ExpDat,RC1,0)/30,0)),0,OFFSET(R45C,MAX(-MNR,ROUND(DAYS360(ValDat,RC1,0)/30,0)-R8C+MEP-MNR),0,1,1))) ->  | AK103: =IF(RC1="","",IF(OR(R8C<=ROUND(DAYS360(ValDat,RC1,0)/30,0),R8C>ROUND(DAYS360(ExpDat,RC1,0)/30,0)),0,OFFSET(R45C,MAX(-MNR,ROUND(DAYS360(ValDat,RC1,0)/30,0)-R8C+MEP-MNR),0,1,1))) ->  | AL103: =IF(RC1="","",IF(OR(R8C<=ROUND(DAYS360(ValDat,RC1,0)/30,0),R8C>ROUND(DAYS360(ExpDat,RC1,0)/30,0)),0,OFFSET(R45C,MAX(-MNR,ROUND(DAYS360(ValDat,RC1,0)/30,0)-R8C+MEP-MNR),0,1,1))) ->  | AM103: =IF(RC1="","",IF(OR(R8C<=ROUND(DAYS360(ValDat,RC1,0)/30,0),R8C>ROUND(DAYS360(ExpDat,RC1,0)/30,0)),0,OFFSET(R45C,MAX(-MNR,ROUND(DAYS360(ValDat,RC1,0)/30,0)-R8C+MEP-MNR),0,1,1))) ->  | AN103: =IF(RC1="","",IF(OR(R8C<=ROUND(DAYS360(ValDat,RC1,0)/30,0),R8C>ROUND(DAYS360(ExpDat,RC1,0)/30,0)),0,OFFSET(R45C,MAX(-MNR,ROUND(DAYS360(ValDat,RC1,0)/30,0)-R8C+MEP-MNR),0,1,1))) ->  | AO103: =IF(RC1="","",IF(OR(R8C<=ROUND(DAYS360(ValDat,RC1,0)/30,0),R8C>ROUND(DAYS360(ExpDat,RC1,0)/30,0)),0,OFFSET(R45C,MAX(-MNR,ROUND(DAYS360(ValDat,RC1,0)/30,0)-R8C+MEP-MNR),0,1,1))) -> 
A104: =IF(R[-1]C="","",IF(DATE(YEAR(R[-1]C),MONTH(R[-1]C)+1,1)>RunDat,"",DATE(YEAR(R[-1]C),MONTH(R[-1]C)+1,1))) ->  | D104: =IF(RC1="","",SUM(RC[2]:RC[37])) ->  | F104: =IF(RC1="","",IF(OR(R8C<=ROUND(DAYS360(ValDat,RC1,0)/30,0),R8C>ROUND(DAYS360(ExpDat,RC1,0)/30,0)),0,OFFSET(R45C,MAX(-MNR,ROUND(DAYS360(ValDat,RC1,0)/30,0)-R8C+MEP-MNR),0,1,1))) ->  | G104: =IF(RC1="","",IF(OR(R8C<=ROUND(DAYS360(ValDat,RC1,0)/30,0),R8C>ROUND(DAYS360(ExpDat,RC1,0)/30,0)),0,OFFSET(R45C,MAX(-MNR,ROUND(DAYS360(ValDat,RC1,0)/30,0)-R8C+MEP-MNR),0,1,1))) ->  | H104: =IF(RC1="","",IF(OR(R8C<=ROUND(DAYS360(ValDat,RC1,0)/30,0),R8C>ROUND(DAYS360(ExpDat,RC1,0)/30,0)),0,OFFSET(R45C,MAX(-MNR,ROUND(DAYS360(ValDat,RC1,0)/30,0)-R8C+MEP-MNR),0,1,1))) ->  | I104: =IF(RC1="","",IF(OR(R8C<=ROUND(DAYS360(ValDat,RC1,0)/30,0),R8C>ROUND(DAYS360(ExpDat,RC1,0)/30,0)),0,OFFSET(R45C,MAX(-MNR,ROUND(DAYS360(ValDat,RC1,0)/30,0)-R8C+MEP-MNR),0,1,1))) ->  | J104: =IF(RC1="","",IF(OR(R8C<=ROUND(DAYS360(ValDat,RC1,0)/30,0),R8C>ROUND(DAYS360(ExpDat,RC1,0)/30,0)),0,OFFSET(R45C,MAX(-MNR,ROUND(DAYS360(ValDat,RC1,0)/30,0)-R8C+MEP-MNR),0,1,1))) ->  | K104: =IF(RC1="","",IF(OR(R8C<=ROUND(DAYS360(ValDat,RC1,0)/30,0),R8C>ROUND(DAYS360(ExpDat,RC1,0)/30,0)),0,OFFSET(R45C,MAX(-MNR,ROUND(DAYS360(ValDat,RC1,0)/30,0)-R8C+MEP-MNR),0,1,1))) ->  | L104: =IF(RC1="","",IF(OR(R8C<=ROUND(DAYS360(ValDat,RC1,0)/30,0),R8C>ROUND(DAYS360(ExpDat,RC1,0)/30,0)),0,OFFSET(R45C,MAX(-MNR,ROUND(DAYS360(ValDat,RC1,0)/30,0)-R8C+MEP-MNR),0,1,1))) ->  | M104: =IF(RC1="","",IF(OR(R8C<=ROUND(DAYS360(ValDat,RC1,0)/30,0),R8C>ROUND(DAYS360(ExpDat,RC1,0)/30,0)),0,OFFSET(R45C,MAX(-MNR,ROUND(DAYS360(ValDat,RC1,0)/30,0)-R8C+MEP-MNR),0,1,1))) ->  | N104: =IF(RC1="","",IF(OR(R8C<=ROUND(DAYS360(ValDat,RC1,0)/30,0),R8C>ROUND(DAYS360(ExpDat,RC1,0)/30,0)),0,OFFSET(R45C,MAX(-MNR,ROUND(DAYS360(ValDat,RC1,0)/30,0)-R8C+MEP-MNR),0,1,1))) ->  | O104: =IF(RC1="","",IF(OR(R8C<=ROUND(DAYS360(ValDat,RC1,0)/30,0),R8C>ROUND(DAYS360(ExpDat,RC1,0)/30,0)),0,OFFSET(R45C,MAX(-MNR,ROUND(DAYS360(ValDat,RC1,0)/30,0)-R8C+MEP-MNR),0,1,1))) ->  | P104: =IF(RC1="","",IF(OR(R8C<=ROUND(DAYS360(ValDat,RC1,0)/30,0),R8C>ROUND(DAYS360(ExpDat,RC1,0)/30,0)),0,OFFSET(R45C,MAX(-MNR,ROUND(DAYS360(ValDat,RC1,0)/30,0)-R8C+MEP-MNR),0,1,1))) ->  | Q104: =IF(RC1="","",IF(OR(R8C<=ROUND(DAYS360(ValDat,RC1,0)/30,0),R8C>ROUND(DAYS360(ExpDat,RC1,0)/30,0)),0,OFFSET(R45C,MAX(-MNR,ROUND(DAYS360(ValDat,RC1,0)/30,0)-R8C+MEP-MNR),0,1,1))) ->  | R104: =IF(RC1="","",IF(OR(R8C<=ROUND(DAYS360(ValDat,RC1,0)/30,0),R8C>ROUND(DAYS360(ExpDat,RC1,0)/30,0)),0,OFFSET(R45C,MAX(-MNR,ROUND(DAYS360(ValDat,RC1,0)/30,0)-R8C+MEP-MNR),0,1,1))) ->  | S104: =IF(RC1="","",IF(OR(R8C<=ROUND(DAYS360(ValDat,RC1,0)/30,0),R8C>ROUND(DAYS360(ExpDat,RC1,0)/30,0)),0,OFFSET(R45C,MAX(-MNR,ROUND(DAYS360(ValDat,RC1,0)/30,0)-R8C+MEP-MNR),0,1,1))) ->  | T104: =IF(RC1="","",IF(OR(R8C<=ROUND(DAYS360(ValDat,RC1,0)/30,0),R8C>ROUND(DAYS360(ExpDat,RC1,0)/30,0)),0,OFFSET(R45C,MAX(-MNR,ROUND(DAYS360(ValDat,RC1,0)/30,0)-R8C+MEP-MNR),0,1,1))) ->  | U104: =IF(RC1="","",IF(OR(R8C<=ROUND(DAYS360(ValDat,RC1,0)/30,0),R8C>ROUND(DAYS360(ExpDat,RC1,0)/30,0)),0,OFFSET(R45C,MAX(-MNR,ROUND(DAYS360(ValDat,RC1,0)/30,0)-R8C+MEP-MNR),0,1,1))) ->  | V104: =IF(RC1="","",IF(OR(R8C<=ROUND(DAYS360(ValDat,RC1,0)/30,0),R8C>ROUND(DAYS360(ExpDat,RC1,0)/30,0)),0,OFFSET(R45C,MAX(-MNR,ROUND(DAYS360(ValDat,RC1,0)/30,0)-R8C+MEP-MNR),0,1,1))) ->  | W104: =IF(RC1="","",IF(OR(R8C<=ROUND(DAYS360(ValDat,RC1,0)/30,0),R8C>ROUND(DAYS360(ExpDat,RC1,0)/30,0)),0,OFFSET(R45C,MAX(-MNR,ROUND(DAYS360(ValDat,RC1,0)/30,0)-R8C+MEP-MNR),0,1,1))) ->  | X104: =IF(RC1="","",IF(OR(R8C<=ROUND(DAYS360(ValDat,RC1,0)/30,0),R8C>ROUND(DAYS360(ExpDat,RC1,0)/30,0)),0,OFFSET(R45C,MAX(-MNR,ROUND(DAYS360(ValDat,RC1,0)/30,0)-R8C+MEP-MNR),0,1,1))) ->  | Y104: =IF(RC1="","",IF(OR(R8C<=ROUND(DAYS360(ValDat,RC1,0)/30,0),R8C>ROUND(DAYS360(ExpDat,RC1,0)/30,0)),0,OFFSET(R45C,MAX(-MNR,ROUND(DAYS360(ValDat,RC1,0)/30,0)-R8C+MEP-MNR),0,1,1))) ->  | Z104: =IF(RC1="","",IF(OR(R8C<=ROUND(DAYS360(ValDat,RC1,0)/30,0),R8C>ROUND(DAYS360(ExpDat,RC1,0)/30,0)),0,OFFSET(R45C,MAX(-MNR,ROUND(DAYS360(ValDat,RC1,0)/30,0)-R8C+MEP-MNR),0,1,1))) ->  | AA104: =IF(RC1="","",IF(OR(R8C<=ROUND(DAYS360(ValDat,RC1,0)/30,0),R8C>ROUND(DAYS360(ExpDat,RC1,0)/30,0)),0,OFFSET(R45C,MAX(-MNR,ROUND(DAYS360(ValDat,RC1,0)/30,0)-R8C+MEP-MNR),0,1,1))) ->  | AB104: =IF(RC1="","",IF(OR(R8C<=ROUND(DAYS360(ValDat,RC1,0)/30,0),R8C>ROUND(DAYS360(ExpDat,RC1,0)/30,0)),0,OFFSET(R45C,MAX(-MNR,ROUND(DAYS360(ValDat,RC1,0)/30,0)-R8C+MEP-MNR),0,1,1))) ->  | AC104: =IF(RC1="","",IF(OR(R8C<=ROUND(DAYS360(ValDat,RC1,0)/30,0),R8C>ROUND(DAYS360(ExpDat,RC1,0)/30,0)),0,OFFSET(R45C,MAX(-MNR,ROUND(DAYS360(ValDat,RC1,0)/30,0)-R8C+MEP-MNR),0,1,1))) ->  | AD104: =IF(RC1="","",IF(OR(R8C<=ROUND(DAYS360(ValDat,RC1,0)/30,0),R8C>ROUND(DAYS360(ExpDat,RC1,0)/30,0)),0,OFFSET(R45C,MAX(-MNR,ROUND(DAYS360(ValDat,RC1,0)/30,0)-R8C+MEP-MNR),0,1,1))) ->  | AE104: =IF(RC1="","",IF(OR(R8C<=ROUND(DAYS360(ValDat,RC1,0)/30,0),R8C>ROUND(DAYS360(ExpDat,RC1,0)/30,0)),0,OFFSET(R45C,MAX(-MNR,ROUND(DAYS360(ValDat,RC1,0)/30,0)-R8C+MEP-MNR),0,1,1))) ->  | AF104: =IF(RC1="","",IF(OR(R8C<=ROUND(DAYS360(ValDat,RC1,0)/30,0),R8C>ROUND(DAYS360(ExpDat,RC1,0)/30,0)),0,OFFSET(R45C,MAX(-MNR,ROUND(DAYS360(ValDat,RC1,0)/30,0)-R8C+MEP-MNR),0,1,1))) ->  | AG104: =IF(RC1="","",IF(OR(R8C<=ROUND(DAYS360(ValDat,RC1,0)/30,0),R8C>ROUND(DAYS360(ExpDat,RC1,0)/30,0)),0,OFFSET(R45C,MAX(-MNR,ROUND(DAYS360(ValDat,RC1,0)/30,0)-R8C+MEP-MNR),0,1,1))) ->  | AH104: =IF(RC1="","",IF(OR(R8C<=ROUND(DAYS360(ValDat,RC1,0)/30,0),R8C>ROUND(DAYS360(ExpDat,RC1,0)/30,0)),0,OFFSET(R45C,MAX(-MNR,ROUND(DAYS360(ValDat,RC1,0)/30,0)-R8C+MEP-MNR),0,1,1))) ->  | AI104: =IF(RC1="","",IF(OR(R8C<=ROUND(DAYS360(ValDat,RC1,0)/30,0),R8C>ROUND(DAYS360(ExpDat,RC1,0)/30,0)),0,OFFSET(R45C,MAX(-MNR,ROUND(DAYS360(ValDat,RC1,0)/30,0)-R8C+MEP-MNR),0,1,1))) ->  | AJ104: =IF(RC1="","",IF(OR(R8C<=ROUND(DAYS360(ValDat,RC1,0)/30,0),R8C>ROUND(DAYS360(ExpDat,RC1,0)/30,0)),0,OFFSET(R45C,MAX(-MNR,ROUND(DAYS360(ValDat,RC1,0)/30,0)-R8C+MEP-MNR),0,1,1))) ->  | AK104: =IF(RC1="","",IF(OR(R8C<=ROUND(DAYS360(ValDat,RC1,0)/30,0),R8C>ROUND(DAYS360(ExpDat,RC1,0)/30,0)),0,OFFSET(R45C,MAX(-MNR,ROUND(DAYS360(ValDat,RC1,0)/30,0)-R8C+MEP-MNR),0,1,1))) ->  | AL104: =IF(RC1="","",IF(OR(R8C<=ROUND(DAYS360(ValDat,RC1,0)/30,0),R8C>ROUND(DAYS360(ExpDat,RC1,0)/30,0)),0,OFFSET(R45C,MAX(-MNR,ROUND(DAYS360(ValDat,RC1,0)/30,0)-R8C+MEP-MNR),0,1,1))) ->  | AM104: =IF(RC1="","",IF(OR(R8C<=ROUND(DAYS360(ValDat,RC1,0)/30,0),R8C>ROUND(DAYS360(ExpDat,RC1,0)/30,0)),0,OFFSET(R45C,MAX(-MNR,ROUND(DAYS360(ValDat,RC1,0)/30,0)-R8C+MEP-MNR),0,1,1))) ->  | AN104: =IF(RC1="","",IF(OR(R8C<=ROUND(DAYS360(ValDat,RC1,0)/30,0),R8C>ROUND(DAYS360(ExpDat,RC1,0)/30,0)),0,OFFSET(R45C,MAX(-MNR,ROUND(DAYS360(ValDat,RC1,0)/30,0)-R8C+MEP-MNR),0,1,1))) ->  | AO104: =IF(RC1="","",IF(OR(R8C<=ROUND(DAYS360(ValDat,RC1,0)/30,0),R8C>ROUND(DAYS360(ExpDat,RC1,0)/30,0)),0,OFFSET(R45C,MAX(-MNR,ROUND(DAYS360(ValDat,RC1,0)/30,0)-R8C+MEP-MNR),0,1,1))) -> 
A105: =IF(R[-1]C="","",IF(DATE(YEAR(R[-1]C),MONTH(R[-1]C)+1,1)>RunDat,"",DATE(YEAR(R[-1]C),MONTH(R[-1]C)+1,1))) ->  | D105: =IF(RC1="","",SUM(RC[2]:RC[37])) ->  | F105: =IF(RC1="","",IF(OR(R8C<=ROUND(DAYS360(ValDat,RC1,0)/30,0),R8C>ROUND(DAYS360(ExpDat,RC1,0)/30,0)),0,OFFSET(R45C,MAX(-MNR,ROUND(DAYS360(ValDat,RC1,0)/30,0)-R8C+MEP-MNR),0,1,1))) ->  | G105: =IF(RC1="","",IF(OR(R8C<=ROUND(DAYS360(ValDat,RC1,0)/30,0),R8C>ROUND(DAYS360(ExpDat,RC1,0)/30,0)),0,OFFSET(R45C,MAX(-MNR,ROUND(DAYS360(ValDat,RC1,0)/30,0)-R8C+MEP-MNR),0,1,1))) ->  | H105: =IF(RC1="","",IF(OR(R8C<=ROUND(DAYS360(ValDat,RC1,0)/30,0),R8C>ROUND(DAYS360(ExpDat,RC1,0)/30,0)),0,OFFSET(R45C,MAX(-MNR,ROUND(DAYS360(ValDat,RC1,0)/30,0)-R8C+MEP-MNR),0,1,1))) ->  | I105: =IF(RC1="","",IF(OR(R8C<=ROUND(DAYS360(ValDat,RC1,0)/30,0),R8C>ROUND(DAYS360(ExpDat,RC1,0)/30,0)),0,OFFSET(R45C,MAX(-MNR,ROUND(DAYS360(ValDat,RC1,0)/30,0)-R8C+MEP-MNR),0,1,1))) ->  | J105: =IF(RC1="","",IF(OR(R8C<=ROUND(DAYS360(ValDat,RC1,0)/30,0),R8C>ROUND(DAYS360(ExpDat,RC1,0)/30,0)),0,OFFSET(R45C,MAX(-MNR,ROUND(DAYS360(ValDat,RC1,0)/30,0)-R8C+MEP-MNR),0,1,1))) ->  | K105: =IF(RC1="","",IF(OR(R8C<=ROUND(DAYS360(ValDat,RC1,0)/30,0),R8C>ROUND(DAYS360(ExpDat,RC1,0)/30,0)),0,OFFSET(R45C,MAX(-MNR,ROUND(DAYS360(ValDat,RC1,0)/30,0)-R8C+MEP-MNR),0,1,1))) ->  | L105: =IF(RC1="","",IF(OR(R8C<=ROUND(DAYS360(ValDat,RC1,0)/30,0),R8C>ROUND(DAYS360(ExpDat,RC1,0)/30,0)),0,OFFSET(R45C,MAX(-MNR,ROUND(DAYS360(ValDat,RC1,0)/30,0)-R8C+MEP-MNR),0,1,1))) ->  | M105: =IF(RC1="","",IF(OR(R8C<=ROUND(DAYS360(ValDat,RC1,0)/30,0),R8C>ROUND(DAYS360(ExpDat,RC1,0)/30,0)),0,OFFSET(R45C,MAX(-MNR,ROUND(DAYS360(ValDat,RC1,0)/30,0)-R8C+MEP-MNR),0,1,1))) ->  | N105: =IF(RC1="","",IF(OR(R8C<=ROUND(DAYS360(ValDat,RC1,0)/30,0),R8C>ROUND(DAYS360(ExpDat,RC1,0)/30,0)),0,OFFSET(R45C,MAX(-MNR,ROUND(DAYS360(ValDat,RC1,0)/30,0)-R8C+MEP-MNR),0,1,1))) ->  | O105: =IF(RC1="","",IF(OR(R8C<=ROUND(DAYS360(ValDat,RC1,0)/30,0),R8C>ROUND(DAYS360(ExpDat,RC1,0)/30,0)),0,OFFSET(R45C,MAX(-MNR,ROUND(DAYS360(ValDat,RC1,0)/30,0)-R8C+MEP-MNR),0,1,1))) ->  | P105: =IF(RC1="","",IF(OR(R8C<=ROUND(DAYS360(ValDat,RC1,0)/30,0),R8C>ROUND(DAYS360(ExpDat,RC1,0)/30,0)),0,OFFSET(R45C,MAX(-MNR,ROUND(DAYS360(ValDat,RC1,0)/30,0)-R8C+MEP-MNR),0,1,1))) ->  | Q105: =IF(RC1="","",IF(OR(R8C<=ROUND(DAYS360(ValDat,RC1,0)/30,0),R8C>ROUND(DAYS360(ExpDat,RC1,0)/30,0)),0,OFFSET(R45C,MAX(-MNR,ROUND(DAYS360(ValDat,RC1,0)/30,0)-R8C+MEP-MNR),0,1,1))) ->  | R105: =IF(RC1="","",IF(OR(R8C<=ROUND(DAYS360(ValDat,RC1,0)/30,0),R8C>ROUND(DAYS360(ExpDat,RC1,0)/30,0)),0,OFFSET(R45C,MAX(-MNR,ROUND(DAYS360(ValDat,RC1,0)/30,0)-R8C+MEP-MNR),0,1,1))) ->  | S105: =IF(RC1="","",IF(OR(R8C<=ROUND(DAYS360(ValDat,RC1,0)/30,0),R8C>ROUND(DAYS360(ExpDat,RC1,0)/30,0)),0,OFFSET(R45C,MAX(-MNR,ROUND(DAYS360(ValDat,RC1,0)/30,0)-R8C+MEP-MNR),0,1,1))) ->  | T105: =IF(RC1="","",IF(OR(R8C<=ROUND(DAYS360(ValDat,RC1,0)/30,0),R8C>ROUND(DAYS360(ExpDat,RC1,0)/30,0)),0,OFFSET(R45C,MAX(-MNR,ROUND(DAYS360(ValDat,RC1,0)/30,0)-R8C+MEP-MNR),0,1,1))) ->  | U105: =IF(RC1="","",IF(OR(R8C<=ROUND(DAYS360(ValDat,RC1,0)/30,0),R8C>ROUND(DAYS360(ExpDat,RC1,0)/30,0)),0,OFFSET(R45C,MAX(-MNR,ROUND(DAYS360(ValDat,RC1,0)/30,0)-R8C+MEP-MNR),0,1,1))) ->  | V105: =IF(RC1="","",IF(OR(R8C<=ROUND(DAYS360(ValDat,RC1,0)/30,0),R8C>ROUND(DAYS360(ExpDat,RC1,0)/30,0)),0,OFFSET(R45C,MAX(-MNR,ROUND(DAYS360(ValDat,RC1,0)/30,0)-R8C+MEP-MNR),0,1,1))) ->  | W105: =IF(RC1="","",IF(OR(R8C<=ROUND(DAYS360(ValDat,RC1,0)/30,0),R8C>ROUND(DAYS360(ExpDat,RC1,0)/30,0)),0,OFFSET(R45C,MAX(-MNR,ROUND(DAYS360(ValDat,RC1,0)/30,0)-R8C+MEP-MNR),0,1,1))) ->  | X105: =IF(RC1="","",IF(OR(R8C<=ROUND(DAYS360(ValDat,RC1,0)/30,0),R8C>ROUND(DAYS360(ExpDat,RC1,0)/30,0)),0,OFFSET(R45C,MAX(-MNR,ROUND(DAYS360(ValDat,RC1,0)/30,0)-R8C+MEP-MNR),0,1,1))) ->  | Y105: =IF(RC1="","",IF(OR(R8C<=ROUND(DAYS360(ValDat,RC1,0)/30,0),R8C>ROUND(DAYS360(ExpDat,RC1,0)/30,0)),0,OFFSET(R45C,MAX(-MNR,ROUND(DAYS360(ValDat,RC1,0)/30,0)-R8C+MEP-MNR),0,1,1))) ->  | Z105: =IF(RC1="","",IF(OR(R8C<=ROUND(DAYS360(ValDat,RC1,0)/30,0),R8C>ROUND(DAYS360(ExpDat,RC1,0)/30,0)),0,OFFSET(R45C,MAX(-MNR,ROUND(DAYS360(ValDat,RC1,0)/30,0)-R8C+MEP-MNR),0,1,1))) ->  | AA105: =IF(RC1="","",IF(OR(R8C<=ROUND(DAYS360(ValDat,RC1,0)/30,0),R8C>ROUND(DAYS360(ExpDat,RC1,0)/30,0)),0,OFFSET(R45C,MAX(-MNR,ROUND(DAYS360(ValDat,RC1,0)/30,0)-R8C+MEP-MNR),0,1,1))) ->  | AB105: =IF(RC1="","",IF(OR(R8C<=ROUND(DAYS360(ValDat,RC1,0)/30,0),R8C>ROUND(DAYS360(ExpDat,RC1,0)/30,0)),0,OFFSET(R45C,MAX(-MNR,ROUND(DAYS360(ValDat,RC1,0)/30,0)-R8C+MEP-MNR),0,1,1))) ->  | AC105: =IF(RC1="","",IF(OR(R8C<=ROUND(DAYS360(ValDat,RC1,0)/30,0),R8C>ROUND(DAYS360(ExpDat,RC1,0)/30,0)),0,OFFSET(R45C,MAX(-MNR,ROUND(DAYS360(ValDat,RC1,0)/30,0)-R8C+MEP-MNR),0,1,1))) ->  | AD105: =IF(RC1="","",IF(OR(R8C<=ROUND(DAYS360(ValDat,RC1,0)/30,0),R8C>ROUND(DAYS360(ExpDat,RC1,0)/30,0)),0,OFFSET(R45C,MAX(-MNR,ROUND(DAYS360(ValDat,RC1,0)/30,0)-R8C+MEP-MNR),0,1,1))) ->  | AE105: =IF(RC1="","",IF(OR(R8C<=ROUND(DAYS360(ValDat,RC1,0)/30,0),R8C>ROUND(DAYS360(ExpDat,RC1,0)/30,0)),0,OFFSET(R45C,MAX(-MNR,ROUND(DAYS360(ValDat,RC1,0)/30,0)-R8C+MEP-MNR),0,1,1))) ->  | AF105: =IF(RC1="","",IF(OR(R8C<=ROUND(DAYS360(ValDat,RC1,0)/30,0),R8C>ROUND(DAYS360(ExpDat,RC1,0)/30,0)),0,OFFSET(R45C,MAX(-MNR,ROUND(DAYS360(ValDat,RC1,0)/30,0)-R8C+MEP-MNR),0,1,1))) ->  | AG105: =IF(RC1="","",IF(OR(R8C<=ROUND(DAYS360(ValDat,RC1,0)/30,0),R8C>ROUND(DAYS360(ExpDat,RC1,0)/30,0)),0,OFFSET(R45C,MAX(-MNR,ROUND(DAYS360(ValDat,RC1,0)/30,0)-R8C+MEP-MNR),0,1,1))) ->  | AH105: =IF(RC1="","",IF(OR(R8C<=ROUND(DAYS360(ValDat,RC1,0)/30,0),R8C>ROUND(DAYS360(ExpDat,RC1,0)/30,0)),0,OFFSET(R45C,MAX(-MNR,ROUND(DAYS360(ValDat,RC1,0)/30,0)-R8C+MEP-MNR),0,1,1))) ->  | AI105: =IF(RC1="","",IF(OR(R8C<=ROUND(DAYS360(ValDat,RC1,0)/30,0),R8C>ROUND(DAYS360(ExpDat,RC1,0)/30,0)),0,OFFSET(R45C,MAX(-MNR,ROUND(DAYS360(ValDat,RC1,0)/30,0)-R8C+MEP-MNR),0,1,1))) ->  | AJ105: =IF(RC1="","",IF(OR(R8C<=ROUND(DAYS360(ValDat,RC1,0)/30,0),R8C>ROUND(DAYS360(ExpDat,RC1,0)/30,0)),0,OFFSET(R45C,MAX(-MNR,ROUND(DAYS360(ValDat,RC1,0)/30,0)-R8C+MEP-MNR),0,1,1))) ->  | AK105: =IF(RC1="","",IF(OR(R8C<=ROUND(DAYS360(ValDat,RC1,0)/30,0),R8C>ROUND(DAYS360(ExpDat,RC1,0)/30,0)),0,OFFSET(R45C,MAX(-MNR,ROUND(DAYS360(ValDat,RC1,0)/30,0)-R8C+MEP-MNR),0,1,1))) ->  | AL105: =IF(RC1="","",IF(OR(R8C<=ROUND(DAYS360(ValDat,RC1,0)/30,0),R8C>ROUND(DAYS360(ExpDat,RC1,0)/30,0)),0,OFFSET(R45C,MAX(-MNR,ROUND(DAYS360(ValDat,RC1,0)/30,0)-R8C+MEP-MNR),0,1,1))) ->  | AM105: =IF(RC1="","",IF(OR(R8C<=ROUND(DAYS360(ValDat,RC1,0)/30,0),R8C>ROUND(DAYS360(ExpDat,RC1,0)/30,0)),0,OFFSET(R45C,MAX(-MNR,ROUND(DAYS360(ValDat,RC1,0)/30,0)-R8C+MEP-MNR),0,1,1))) ->  | AN105: =IF(RC1="","",IF(OR(R8C<=ROUND(DAYS360(ValDat,RC1,0)/30,0),R8C>ROUND(DAYS360(ExpDat,RC1,0)/30,0)),0,OFFSET(R45C,MAX(-MNR,ROUND(DAYS360(ValDat,RC1,0)/30,0)-R8C+MEP-MNR),0,1,1))) ->  | AO105: =IF(RC1="","",IF(OR(R8C<=ROUND(DAYS360(ValDat,RC1,0)/30,0),R8C>ROUND(DAYS360(ExpDat,RC1,0)/30,0)),0,OFFSET(R45C,MAX(-MNR,ROUND(DAYS360(ValDat,RC1,0)/30,0)-R8C+MEP-MNR),0,1,1))) -> 

Sheet: PaidLag
B1: =title1&" - Paid Lag Triangle" -> BLOCK CLAIM LIABILITY REPORT - Paid Lag Triangle
B2: =title2 -> The Millennium-2000 Sample Life Insurance Company
B3: =title3 -> Arvind
B4: =title4 -> Experience Period: 01-Aug-1998 to 31-Jul-2001. Runout Date: 31-Jul-2001
F7: PAID CLAIMS / NUMBER OF MONTHS BETWEEN INCURRED AND PAID DATES
A8: Incurred Month | B8: Trend to Valuation Month | C8: Exposure | D8: Total Incurred and Paid Claims | E8: Inc&Paid as of the end of Each Month | F8: 0 | G8: =RC[-1]+1 -> 1 | H8: =RC[-1]+1 -> 2 | I8: =RC[-1]+1 -> 3 | J8: =RC[-1]+1 -> 4 | K8: =RC[-1]+1 -> 5 | L8: =RC[-1]+1 -> 6 | M8: =RC[-1]+1 -> 7 | N8: =RC[-1]+1 -> 8 | O8: =RC[-1]+1 -> 9 | P8: =RC[-1]+1 -> 10 | Q8: =RC[-1]+1 -> 11 | R8: =RC[-1]+1 -> 12 | S8: =RC[-1]+1 -> 13 | T8: =RC[-1]+1 -> 14 | U8: =RC[-1]+1 -> 15 | V8: =RC[-1]+1 -> 16 | W8: =RC[-1]+1 -> 17 | X8: =RC[-1]+1 -> 18 | Y8: =RC[-1]+1 -> 19 | Z8: =RC[-1]+1 -> 20 | AA8: =RC[-1]+1 -> 21 | AB8: =RC[-1]+1 -> 22 | AC8: =RC[-1]+1 -> 23 | AD8: =RC[-1]+1 -> 24 | AE8: =RC[-1]+1 -> 25 | AF8: =RC[-1]+1 -> 26 | AG8: =RC[-1]+1 -> 27 | AH8: =RC[-1]+1 -> 28 | AI8: =RC[-1]+1 -> 29 | AJ8: =RC[-1]+1 -> 30 | AK8: =RC[-1]+1 -> 31 | AL8: =RC[-1]+1 -> 32 | AM8: =RC[-1]+1 -> 33 | AN8: =RC[-1]+1 -> 34 | AO8: =RC[-1]+1 -> 35
A9: =ExpDat -> 1998-08-01T00:00:00.000 | B9: =IF(RC1="","",IF(VLOOKUP(RC1,TrendFacDump,2,FALSE)=0,0,VLOOKUP(EOMONTH(ValDat,-1)+1,TrendFacDump,2,FALSE)/VLOOKUP(RC1,TrendFacDump,2,FALSE))) -> 1.1852554225435581 | C9: =IF(RC1="","",VLOOKUP(RC1,ExpDump,7,FALSE)) -> 2576.1559999999999 | D9: =IF(RC1="","",SUM(RC[2]:RC[37])) -> 50333 | E9: =IF(RC1="","",RC[1]) -> 50333 | F9: =IF(RC1="","",VLOOKUP(RC1,PaidDump,R8C+2,FALSE)) -> 50333 | G9: =IF(RC1="","",VLOOKUP(RC1,PaidDump,R8C+2,FALSE)) -> 0 | H9: =IF(RC1="","",VLOOKUP(RC1,PaidDump,R8C+2,FALSE)) -> 0 | I9: =IF(RC1="","",VLOOKUP(RC1,PaidDump,R8C+2,FALSE)) -> 0 | J9: =IF(RC1="","",VLOOKUP(RC1,PaidDump,R8C+2,FALSE)) -> 0 | K9: =IF(RC1="","",VLOOKUP(RC1,PaidDump,R8C+2,FALSE)) -> 0 | L9: =IF(RC1="","",VLOOKUP(RC1,PaidDump,R8C+2,FALSE)) -> 0 | M9: =IF(RC1="","",VLOOKUP(RC1,PaidDump,R8C+2,FALSE)) -> 0 | N9: =IF(RC1="","",VLOOKUP(RC1,PaidDump,R8C+2,FALSE)) -> 0 | O9: =IF(RC1="","",VLOOKUP(RC1,PaidDump,R8C+2,FALSE)) -> 0 | P9: =IF(RC1="","",VLOOKUP(RC1,PaidDump,R8C+2,FALSE)) -> 0 | Q9: =IF(RC1="","",VLOOKUP(RC1,PaidDump,R8C+2,FALSE)) -> 0 | R9: =IF(RC1="","",VLOOKUP(RC1,PaidDump,R8C+2,FALSE)) -> 0 | S9: =IF(RC1="","",VLOOKUP(RC1,PaidDump,R8C+2,FALSE)) -> 0 | T9: =IF(RC1="","",VLOOKUP(RC1,PaidDump,R8C+2,FALSE)) -> 0 | U9: =IF(RC1="","",VLOOKUP(RC1,PaidDump,R8C+2,FALSE)) -> 0 | V9: =IF(RC1="","",VLOOKUP(RC1,PaidDump,R8C+2,FALSE)) -> 0 | W9: =IF(RC1="","",VLOOKUP(RC1,PaidDump,R8C+2,FALSE)) -> 0 | X9: =IF(RC1="","",VLOOKUP(RC1,PaidDump,R8C+2,FALSE)) -> 0 | Y9: =IF(RC1="","",VLOOKUP(RC1,PaidDump,R8C+2,FALSE)) -> 0 | Z9: =IF(RC1="","",VLOOKUP(RC1,PaidDump,R8C+2,FALSE)) -> 0 | AA9: =IF(RC1="","",VLOOKUP(RC1,PaidDump,R8C+2,FALSE)) -> 0 | AB9: =IF(RC1="","",VLOOKUP(RC1,PaidDump,R8C+2,FALSE)) -> 0 | AC9: =IF(RC1="","",VLOOKUP(RC1,PaidDump,R8C+2,FALSE)) -> 0 | AD9: =IF(RC1="","",VLOOKUP(RC1,PaidDump,R8C+2,FALSE)) -> 0 | AE9: =IF(RC1="","",VLOOKUP(RC1,PaidDump,R8C+2,FALSE)) -> 0 | AF9: =IF(RC1="","",VLOOKUP(RC1,PaidDump,R8C+2,FALSE)) -> 0 | AG9: =IF(RC1="","",VLOOKUP(RC1,PaidDump,R8C+2,FALSE)) -> 0 | AH9: =IF(RC1="","",VLOOKUP(RC1,PaidDump,R8C+2,FALSE)) -> 0 | AI9: =IF(RC1="","",VLOOKUP(RC1,PaidDump,R8C+2,FALSE)) -> 0 | AJ9: =IF(RC1="","",VLOOKUP(RC1,PaidDump,R8C+2,FALSE)) -> 0 | AK9: =IF(RC1="","",VLOOKUP(RC1,PaidDump,R8C+2,FALSE)) -> 0 | AL9: =IF(RC1="","",VLOOKUP(RC1,PaidDump,R8C+2,FALSE)) -> 0 | AM9: =IF(RC1="","",VLOOKUP(RC1,PaidDump,R8C+2,FALSE)) -> 0 | AN9: =IF(RC1="","",VLOOKUP(RC1,PaidDump,R8C+2,FALSE)) -> 0 | AO9: =IF(RC1="","",VLOOKUP(RC1,PaidDump,R8C+2,FALSE)) -> 0
A10: =IF(R[-1]C1="","",IF(DATE(YEAR(R[-1]C),MONTH(R[-1]C)+1,1)>ValDat,"",DATE(YEAR(R[-1]C),MONTH(R[-1]C)+1,1))) -> 1998-09-01T00:00:00.000 | B10: =IF(RC1="","",IF(VLOOKUP(RC1,TrendFacDump,2,FALSE)=0,0,VLOOKUP(EOMONTH(ValDat,-1)+1,TrendFacDump,2,FALSE)/VLOOKUP(RC1,TrendFacDump,2,FALSE))) -> 1.1795234725171031 | C10: =IF(RC1="","",VLOOKUP(RC1,ExpDump,7,FALSE)) -> 2663.7669999999998 | D10: =IF(RC1="","",SUM(RC[2]:RC[37])) -> 50333 | E10: =IF(RC1="","",R[-1]C+RC[1]+R[-1]C[2]) -> 100666 | F10: =IF(RC1="","",VLOOKUP(RC1,PaidDump,R8C+2,FALSE)) -> 50333 | G10: =IF(RC1="","",VLOOKUP(RC1,PaidDump,R8C+2,FALSE)) -> 0 | H10: =IF(RC1="","",VLOOKUP(RC1,PaidDump,R8C+2,FALSE)) -> 0 | I10: =IF(RC1="","",VLOOKUP(RC1,PaidDump,R8C+2,FALSE)) -> 0 | J10: =IF(RC1="","",VLOOKUP(RC1,PaidDump,R8C+2,FALSE)) -> 0 | K10: =IF(RC1="","",VLOOKUP(RC1,PaidDump,R8C+2,FALSE)) -> 0 | L10: =IF(RC1="","",VLOOKUP(RC1,PaidDump,R8C+2,FALSE)) -> 0 | M10: =IF(RC1="","",VLOOKUP(RC1,PaidDump,R8C+2,FALSE)) -> 0 | N10: =IF(RC1="","",VLOOKUP(RC1,PaidDump,R8C+2,FALSE)) -> 0 | O10: =IF(RC1="","",VLOOKUP(RC1,PaidDump,R8C+2,FALSE)) -> 0 | P10: =IF(RC1="","",VLOOKUP(RC1,PaidDump,R8C+2,FALSE)) -> 0 | Q10: =IF(RC1="","",VLOOKUP(RC1,PaidDump,R8C+2,FALSE)) -> 0 | R10: =IF(RC1="","",VLOOKUP(RC1,PaidDump,R8C+2,FALSE)) -> 0 | S10: =IF(RC1="","",VLOOKUP(RC1,PaidDump,R8C+2,FALSE)) -> 0 | T10: =IF(RC1="","",VLOOKUP(RC1,PaidDump,R8C+2,FALSE)) -> 0 | U10: =IF(RC1="","",VLOOKUP(RC1,PaidDump,R8C+2,FALSE)) -> 0 | V10: =IF(RC1="","",VLOOKUP(RC1,PaidDump,R8C+2,FALSE)) -> 0 | W10: =IF(RC1="","",VLOOKUP(RC1,PaidDump,R8C+2,FALSE)) -> 0 | X10: =IF(RC1="","",VLOOKUP(RC1,PaidDump,R8C+2,FALSE)) -> 0 | Y10: =IF(RC1="","",VLOOKUP(RC1,PaidDump,R8C+2,FALSE)) -> 0 | Z10: =IF(RC1="","",VLOOKUP(RC1,PaidDump,R8C+2,FALSE)) -> 0 | AA10: =IF(RC1="","",VLOOKUP(RC1,PaidDump,R8C+2,FALSE)) -> 0 | AB10: =IF(RC1="","",VLOOKUP(RC1,PaidDump,R8C+2,FALSE)) -> 0 | AC10: =IF(RC1="","",VLOOKUP(RC1,PaidDump,R8C+2,FALSE)) -> 0 | AD10: =IF(RC1="","",VLOOKUP(RC1,PaidDump,R8C+2,FALSE)) -> 0 | AE10: =IF(RC1="","",VLOOKUP(RC1,PaidDump,R8C+2,FALSE)) -> 0 | AF10: =IF(RC1="","",VLOOKUP(RC1,PaidDump,R8C+2,FALSE)) -> 0 | AG10: =IF(RC1="","",VLOOKUP(RC1,PaidDump,R8C+2,FALSE)) -> 0 | AH10: =IF(RC1="","",VLOOKUP(RC1,PaidDump,R8C+2,FALSE)) -> 0 | AI10: =IF(RC1="","",VLOOKUP(RC1,PaidDump,R8C+2,FALSE)) -> 0 | AJ10: =IF(RC1="","",VLOOKUP(RC1,PaidDump,R8C+2,FALSE)) -> 0 | AK10: =IF(RC1="","",VLOOKUP(RC1,PaidDump,R8C+2,FALSE)) -> 0 | AL10: =IF(RC1="","",VLOOKUP(RC1,PaidDump,R8C+2,FALSE)) -> 0 | AM10: =IF(RC1="","",VLOOKUP(RC1,PaidDump,R8C+2,FALSE)) -> 0 | AN10: =IF(RC1="","",VLOOKUP(RC1,PaidDump,R8C+2,FALSE)) -> 0 | AO10: =IF(RC1="","",VLOOKUP(RC1,PaidDump,R8C+2,FALSE)) -> 0
A11: =IF(R[-1]C1="","",IF(DATE(YEAR(R[-1]C),MONTH(R[-1]C)+1,1)>ValDat,"",DATE(YEAR(R[-1]C),MONTH(R[-1]C)+1,1))) -> 1998-10-01T00:00:00.000 | B11: =IF(RC1="","",IF(VLOOKUP(RC1,TrendFacDump,2,FALSE)=0,0,VLOOKUP(EOMONTH(ValDat,-1)+1,TrendFacDump,2,FALSE)/VLOOKUP(RC1,TrendFacDump,2,FALSE))) -> 1.1738466956215519 | C11: =IF(RC1="","",VLOOKUP(RC1,ExpDump,7,FALSE)) -> 2728.2080000000001 | D11: =IF(RC1="","",SUM(RC[2]:RC[37])) -> 221584 | E11: =IF(RC1="","",R[-1]C+RC[1]+R[-1]C[2]+R[-2]C[3]) -> 121003 | F11: =IF(RC1="","",VLOOKUP(RC1,PaidDump,R8C+2,FALSE)) -> 20337 | G11: =IF(RC1="","",VLOOKUP(RC1,PaidDump,R8C+2,FALSE)) -> 176427 | H11: =IF(RC1="","",VLOOKUP(RC1,PaidDump,R8C+2,FALSE)) -> 24820 | I11: =IF(RC1="","",VLOOKUP(RC1,PaidDump,R8C+2,FALSE)) -> 0 | J11: =IF(RC1="","",VLOOKUP(RC1,PaidDump,R8C+2,FALSE)) -> 0 | K11: =IF(RC1="","",VLOOKUP(RC1,PaidDump,R8C+2,FALSE)) -> 0 | L11: =IF(RC1="","",VLOOKUP(RC1,PaidDump,R8C+2,FALSE)) -> 0 | M11: =IF(RC1="","",VLOOKUP(RC1,PaidDump,R8C+2,FALSE)) -> 0 | N11: =IF(RC1="","",VLOOKUP(RC1,PaidDump,R8C+2,FALSE)) -> 0 | O11: =IF(RC1="","",VLOOKUP(RC1,PaidDump,R8C+2,FALSE)) -> 0 | P11: =IF(RC1="","",VLOOKUP(RC1,PaidDump,R8C+2,FALSE)) -> 0 | Q11: =IF(RC1="","",VLOOKUP(RC1,PaidDump,R8C+2,FALSE)) -> 0 | R11: =IF(RC1="","",VLOOKUP(RC1,PaidDump,R8C+2,FALSE)) -> 0 | S11: =IF(RC1="","",VLOOKUP(RC1,PaidDump,R8C+2,FALSE)) -> 0 | T11: =IF(RC1="","",VLOOKUP(RC1,PaidDump,R8C+2,FALSE)) -> 0 | U11: =IF(RC1="","",VLOOKUP(RC1,PaidDump,R8C+2,FALSE)) -> 0 | V11: =IF(RC1="","",VLOOKUP(RC1,PaidDump,R8C+2,FALSE)) -> 0 | W11: =IF(RC1="","",VLOOKUP(RC1,PaidDump,R8C+2,FALSE)) -> 0 | X11: =IF(RC1="","",VLOOKUP(RC1,PaidDump,R8C+2,FALSE)) -> 0 | Y11: =IF(RC1="","",VLOOKUP(RC1,PaidDump,R8C+2,FALSE)) -> 0 | Z11: =IF(RC1="","",VLOOKUP(RC1,PaidDump,R8C+2,FALSE)) -> 0 | AA11: =IF(RC1="","",VLOOKUP(RC1,PaidDump,R8C+2,FALSE)) -> 0 | AB11: =IF(RC1="","",VLOOKUP(RC1,PaidDump,R8C+2,FALSE)) -> 0 | AC11: =IF(RC1="","",VLOOKUP(RC1,PaidDump,R8C+2,FALSE)) -> 0 | AD11: =IF(RC1="","",VLOOKUP(RC1,PaidDump,R8C+2,FALSE)) -> 0 | AE11: =IF(RC1="","",VLOOKUP(RC1,PaidDump,R8C+2,FALSE)) -> 0 | AF11: =IF(RC1="","",VLOOKUP(RC1,PaidDump,R8C+2,FALSE)) -> 0 | AG11: =IF(RC1="","",VLOOKUP(RC1,PaidDump,R8C+2,FALSE)) -> 0 | AH11: =IF(RC1="","",VLOOKUP(RC1,PaidDump,R8C+2,FALSE)) -> 0 | AI11: =IF(RC1="","",VLOOKUP(RC1,PaidDump,R8C+2,FALSE)) -> 0 | AJ11: =IF(RC1="","",VLOOKUP(RC1,PaidDump,R8C+2,FALSE)) -> 0 | AK11: =IF(RC1="","",VLOOKUP(RC1,PaidDump,R8C+2,FALSE)) -> 0 | AL11: =IF(RC1="","",VLOOKUP(RC1,PaidDump,R8C+2,FALSE)) -> 0 | AM11: =IF(RC1="","",VLOOKUP(RC1,PaidDump,R8C+2,FALSE)) -> 0 | AN11: =IF(RC1="","",VLOOKUP(RC1,PaidDump,R8C+2,FALSE)) -> 0 | AO11: =IF(RC1="","",VLOOKUP(RC1,PaidDump,R8C+2,FALSE)) -> 0
A12: =IF(R[-1]C1="","",IF(DATE(YEAR(R[-1]C),MONTH(R[-1]C)+1,1)>ValDat,"",DATE(YEAR(R[-1]C),MONTH(R[-1]C)+1,1))) -> 1998-11-01T00:00:00.000 | B12: =IF(RC1="","",IF(VLOOKUP(RC1,TrendFacDump,2,FALSE)=0,0,VLOOKUP(EOMONTH(ValDat,-1)+1,TrendFacDump,2,FALSE)/VLOOKUP(RC1,TrendFacDump,2,FALSE))) -> 1.1680878402055834 | C12: =IF(RC1="","",VLOOKUP(RC1,ExpDump,7,FALSE)) -> 2780.7539999999999 | D12: =IF(RC1="","",SUM(RC[2]:RC[37])) -> 221584 | E12: =IF(RC1="","",R[-1]C+RC[1]+R[-1]C[2]+R[-2]C[3]+R[-3]C[4]) -> 337909 | F12: =IF(RC1="","",VLOOKUP(RC1,PaidDump,R8C+2,FALSE)) -> 40479 | G12: =IF(RC1="","",VLOOKUP(RC1,PaidDump,R8C+2,FALSE)) -> 159677 | H12: =IF(RC1="","",VLOOKUP(RC1,PaidDump,R8C+2,FALSE)) -> 21428 | I12: =IF(RC1="","",VLOOKUP(RC1,PaidDump,R8C+2,FALSE)) -> 0 | J12: =IF(RC1="","",VLOOKUP(RC1,PaidDump,R8C+2,FALSE)) -> 0 | K12: =IF(RC1="","",VLOOKUP(RC1,PaidDump,R8C+2,FALSE)) -> 0 | L12: =IF(RC1="","",VLOOKUP(RC1,PaidDump,R8C+2,FALSE)) -> 0 | M12: =IF(RC1="","",VLOOKUP(RC1,PaidDump,R8C+2,FALSE)) -> 0 | N12: =IF(RC1="","",VLOOKUP(RC1,PaidDump,R8C+2,FALSE)) -> 0 | O12: =IF(RC1="","",VLOOKUP(RC1,PaidDump,R8C+2,FALSE)) -> 0 | P12: =IF(RC1="","",VLOOKUP(RC1,PaidDump,R8C+2,FALSE)) -> 0 | Q12: =IF(RC1="","",VLOOKUP(RC1,PaidDump,R8C+2,FALSE)) -> 0 | R12: =IF(RC1="","",VLOOKUP(RC1,PaidDump,R8C+2,FALSE)) -> 0 | S12: =IF(RC1="","",VLOOKUP(RC1,PaidDump,R8C+2,FALSE)) -> 0 | T12: =IF(RC1="","",VLOOKUP(RC1,PaidDump,R8C+2,FALSE)) -> 0 | U12: =IF(RC1="","",VLOOKUP(RC1,PaidDump,R8C+2,FALSE)) -> 0 | V12: =IF(RC1="","",VLOOKUP(RC1,PaidDump,R8C+2,FALSE)) -> 0 | W12: =IF(RC1="","",VLOOKUP(RC1,PaidDump,R8C+2,FALSE)) -> 0 | X12: =IF(RC1="","",VLOOKUP(RC1,PaidDump,R8C+2,FALSE)) -> 0 | Y12: =IF(RC1="","",VLOOKUP(RC1,PaidDump,R8C+2,FALSE)) -> 0 | Z12: =IF(RC1="","",VLOOKUP(RC1,PaidDump,R8C+2,FALSE)) -> 0 | AA12: =IF(RC1="","",VLOOKUP(RC1,PaidDump,R8C+2,FALSE)) -> 0 | AB12: =IF(RC1="","",VLOOKUP(RC1,PaidDump,R8C+2,FALSE)) -> 0 | AC12: =IF(RC1="","",VLOOKUP(RC1,PaidDump,R8C+2,FALSE)) -> 0 | AD12: =IF(RC1="","",VLOOKUP(RC1,PaidDump,R8C+2,FALSE)) -> 0 | AE12: =IF(RC1="","",VLOOKUP(RC1,PaidDump,R8C+2,FALSE)) -> 0 | AF12: =IF(RC1="","",VLOOKUP(RC1,PaidDump,R8C+2,FALSE)) -> 0 | AG12: =IF(RC1="","",VLOOKUP(RC1,PaidDump,R8C+2,FALSE)) -> 0 | AH12: =IF(RC1="","",VLOOKUP(RC1,PaidDump,R8C+2,FALSE)) -> 0 | AI12: =IF(RC1="","",VLOOKUP(RC1,PaidDump,R8C+2,FALSE)) -> 0 | AJ12: =IF(RC1="","",VLOOKUP(RC1,PaidDump,R8C+2,FALSE)) -> 0 | AK12: =IF(RC1="","",VLOOKUP(RC1,PaidDump,R8C+2,FALSE)) -> 0 | AL12: =IF(RC1="","",VLOOKUP(RC1,PaidDump,R8C+2,FALSE)) -> 0 | AM12: =IF(RC1="","",VLOOKUP(RC1,PaidDump,R8C+2,FALSE)) -> 0 | AN12: =IF(RC1="","",VLOOKUP(RC1,PaidDump,R8C+2,FALSE)) -> 0 | AO12: =IF(RC1="","",VLOOKUP(RC1,PaidDump,R8C+2,FALSE)) -> 0
A13: =IF(R[-1]C1="","",IF(DATE(YEAR(R[-1]C),MONTH(R[-1]C)+1,1)>ValDat,"",DATE(YEAR(R[-1]C),MONTH(R[-1]C)+1,1))) -> 1998-12-01T00:00:00.000 | B13: =IF(RC1="","",IF(VLOOKUP(RC1,TrendFacDump,2,FALSE)=0,0,VLOOKUP(EOMONTH(ValDat,-1)+1,TrendFacDump,2,FALSE)/VLOOKUP(RC1,TrendFacDump,2,FALSE))) -> 1.1623852144600721 | C13: =IF(RC1="","",VLOOKUP(RC1,ExpDump,7,FALSE)) -> 2826.4589999999998 | D13: =IF(RC1="","",SUM(RC[2]:RC[37])) -> 198556 | E13: =IF(RC1="","",R[-1]C+RC[1]+R[-1]C[2]+R[-2]C[3]+R[-3]C[4]+R[-4]C[5]) -> 537726 | F13: =IF(RC1="","",VLOOKUP(RC1,PaidDump,R8C+2,FALSE)) -> 15320 | G13: =IF(RC1="","",VLOOKUP(RC1,PaidDump,R8C+2,FALSE)) -> 109280 | H13: =IF(RC1="","",VLOOKUP(RC1,PaidDump,R8C+2,FALSE)) -> 64318 | I13: =IF(RC1="","",VLOOKUP(RC1,PaidDump,R8C+2,FALSE)) -> 8788 | J13: =IF(RC1="","",VLOOKUP(RC1,PaidDump,R8C+2,FALSE)) -> 850 | K13: =IF(RC1="","",VLOOKUP(RC1,PaidDump,R8C+2,FALSE)) -> 0 | L13: =IF(RC1="","",VLOOKUP(RC1,PaidDump,R8C+2,FALSE)) -> 0 | M13: =IF(RC1="","",VLOOKUP(RC1,PaidDump,R8C+2,FALSE)) -> 0 | N13: =IF(RC1="","",VLOOKUP(RC1,PaidDump,R8C+2,FALSE)) -> 0 | O13: =IF(RC1="","",VLOOKUP(RC1,PaidDump,R8C+2,FALSE)) -> 0 | P13: =IF(RC1="","",VLOOKUP(RC1,PaidDump,R8C+2,FALSE)) -> 0 | Q13: =IF(RC1="","",VLOOKUP(RC1,PaidDump,R8C+2,FALSE)) -> 0 | R13: =IF(RC1="","",VLOOKUP(RC1,PaidDump,R8C+2,FALSE)) -> 0 | S13: =IF(RC1="","",VLOOKUP(RC1,PaidDump,R8C+2,FALSE)) -> 0 | T13: =IF(RC1="","",VLOOKUP(RC1,PaidDump,R8C+2,FALSE)) -> 0 | U13: =IF(RC1="","",VLOOKUP(RC1,PaidDump,R8C+2,FALSE)) -> 0 | V13: =IF(RC1="","",VLOOKUP(RC1,PaidDump,R8C+2,FALSE)) -> 0 | W13: =IF(RC1="","",VLOOKUP(RC1,PaidDump,R8C+2,FALSE)) -> 0 | X13: =IF(RC1="","",VLOOKUP(RC1,PaidDump,R8C+2,FALSE)) -> 0 | Y13: =IF(RC1="","",VLOOKUP(RC1,PaidDump,R8C+2,FALSE)) -> 0 | Z13: =IF(RC1="","",VLOOKUP(RC1,PaidDump,R8C+2,FALSE)) -> 0 | AA13: =IF(RC1="","",VLOOKUP(RC1,PaidDump,R8C+2,FALSE)) -> 0 | AB13: =IF(RC1="","",VLOOKUP(RC1,PaidDump,R8C+2,FALSE)) -> 0 | AC13: =IF(RC1="","",VLOOKUP(RC1,PaidDump,R8C+2,FALSE)) -> 0 | AD13: =IF(RC1="","",VLOOKUP(RC1,PaidDump,R8C+2,FALSE)) -> 0 | AE13: =IF(RC1="","",VLOOKUP(RC1,PaidDump,R8C+2,FALSE)) -> 0 | AF13: =IF(RC1="","",VLOOKUP(RC1,PaidDump,R8C+2,FALSE)) -> 0 | AG13: =IF(RC1="","",VLOOKUP(RC1,PaidDump,R8C+2,FALSE)) -> 0 | AH13: =IF(RC1="","",VLOOKUP(RC1,PaidDump,R8C+2,FALSE)) -> 0 | AI13: =IF(RC1="","",VLOOKUP(RC1,PaidDump,R8C+2,FALSE)) -> 0 | AJ13: =IF(RC1="","",VLOOKUP(RC1,PaidDump,R8C+2,FALSE)) -> 0 | AK13: =IF(RC1="","",VLOOKUP(RC1,PaidDump,R8C+2,FALSE)) -> 0 | AL13: =IF(RC1="","",VLOOKUP(RC1,PaidDump,R8C+2,FALSE)) -> 0 | AM13: =IF(RC1="","",VLOOKUP(RC1,PaidDump,R8C+2,FALSE)) -> 0 | AN13: =IF(RC1="","",VLOOKUP(RC1,PaidDump,R8C+2,FALSE)) -> 0 | AO13: =IF(RC1="","",VLOOKUP(RC1,PaidDump,R8C+2,FALSE)) -> 0
A14: =IF(R[-1]C1="","",IF(DATE(YEAR(R[-1]C),MONTH(R[-1]C)+1,1)>ValDat,"",DATE(YEAR(R[-1]C),MONTH(R[-1]C)+1,1))) -> 1999-01-01T00:00:00.000 | B14: =IF(RC1="","",IF(VLOOKUP(RC1,TrendFacDump,2,FALSE)=0,0,VLOOKUP(EOMONTH(ValDat,-1)+1,TrendFacDump,2,FALSE)/VLOOKUP(RC1,TrendFacDump,2,FALSE))) -> 1.1568718186024989 | C14: =IF(RC1="","",VLOOKUP(RC1,ExpDump,7,FALSE)) -> 2835.0619999999999 | D14: =IF(RC1="","",SUM(RC[2]:RC[37])) -> 198556 | E14: =IF(RC1="","",R[-1]C+RC[1]+R[-1]C[2]+R[-2]C[3]+R[-3]C[4]+R[-4]C[5]+R[-5]C[6]) -> 723533 | F14: =IF(RC1="","",VLOOKUP(RC1,PaidDump,R8C+2,FALSE)) -> 55099 | G14: =IF(RC1="","",VLOOKUP(RC1,PaidDump,R8C+2,FALSE)) -> 78962 | H14: =IF(RC1="","",VLOOKUP(RC1,PaidDump,R8C+2,FALSE)) -> 58105 | I14: =IF(RC1="","",VLOOKUP(RC1,PaidDump,R8C+2,FALSE)) -> 5540 | J14: =IF(RC1="","",VLOOKUP(RC1,PaidDump,R8C+2,FALSE)) -> 850 | K14: =IF(RC1="","",VLOOKUP(RC1,PaidDump,R8C+2,FALSE)) -> 0 | L14: =IF(RC1="","",VLOOKUP(RC1,PaidDump,R8C+2,FALSE)) -> 0 | M14: =IF(RC1="","",VLOOKUP(RC1,PaidDump,R8C+2,FALSE)) -> 0 | N14: =IF(RC1="","",VLOOKUP(RC1,PaidDump,R8C+2,FALSE)) -> 0 | O14: =IF(RC1="","",VLOOKUP(RC1,PaidDump,R8C+2,FALSE)) -> 0 | P14: =IF(RC1="","",VLOOKUP(RC1,PaidDump,R8C+2,FALSE)) -> 0 | Q14: =IF(RC1="","",VLOOKUP(RC1,PaidDump,R8C+2,FALSE)) -> 0 | R14: =IF(RC1="","",VLOOKUP(RC1,PaidDump,R8C+2,FALSE)) -> 0 | S14: =IF(RC1="","",VLOOKUP(RC1,PaidDump,R8C+2,FALSE)) -> 0 | T14: =IF(RC1="","",VLOOKUP(RC1,PaidDump,R8C+2,FALSE)) -> 0 | U14: =IF(RC1="","",VLOOKUP(RC1,PaidDump,R8C+2,FALSE)) -> 0 | V14: =IF(RC1="","",VLOOKUP(RC1,PaidDump,R8C+2,FALSE)) -> 0 | W14: =IF(RC1="","",VLOOKUP(RC1,PaidDump,R8C+2,FALSE)) -> 0 | X14: =IF(RC1="","",VLOOKUP(RC1,PaidDump,R8C+2,FALSE)) -> 0 | Y14: =IF(RC1="","",VLOOKUP(RC1,PaidDump,R8C+2,FALSE)) -> 0 | Z14: =IF(RC1="","",VLOOKUP(RC1,PaidDump,R8C+2,FALSE)) -> 0 | AA14: =IF(RC1="","",VLOOKUP(RC1,PaidDump,R8C+2,FALSE)) -> 0 | AB14: =IF(RC1="","",VLOOKUP(RC1,PaidDump,R8C+2,FALSE)) -> 0 | AC14: =IF(RC1="","",VLOOKUP(RC1,PaidDump,R8C+2,FALSE)) -> 0 | AD14: =IF(RC1="","",VLOOKUP(RC1,PaidDump,R8C+2,FALSE)) -> 0 | AE14: =IF(RC1="","",VLOOKUP(RC1,PaidDump,R8C+2,FALSE)) -> 0 | AF14: =IF(RC1="","",VLOOKUP(RC1,PaidDump,R8C+2,FALSE)) -> 0 | AG14: =IF(RC1="","",VLOOKUP(RC1,PaidDump,R8C+2,FALSE)) -> 0 | AH14: =IF(RC1="","",VLOOKUP(RC1,PaidDump,R8C+2,FALSE)) -> 0 | AI14: =IF(RC1="","",VLOOKUP(RC1,PaidDump,R8C+2,FALSE)) -> 0 | AJ14: =IF(RC1="","",VLOOKUP(RC1,PaidDump,R8C+2,FALSE)) -> 0 | AK14: =IF(RC1="","",VLOOKUP(RC1,PaidDump,R8C+2,FALSE)) -> 0 | AL14: =IF(RC1="","",VLOOKUP(RC1,PaidDump,R8C+2,FALSE)) -> 0 | AM14: =IF(RC1="","",VLOOKUP(RC1,PaidDump,R8C+2,FALSE)) -> 0 | AN14: =IF(RC1="","",VLOOKUP(RC1,PaidDump,R8C+2,FALSE)) -> 0 | AO14: =IF(RC1="","",VLOOKUP(RC1,PaidDump,R8C+2,FALSE)) -> 0
A15: =IF(R[-1]C1="","",IF(DATE(YEAR(R[-1]C),MONTH(R[-1]C)+1,1)>ValDat,"",DATE(YEAR(R[-1]C),MONTH(R[-1]C)+1,1))) -> 1999-02-01T00:00:00.000 | B15: =IF(RC1="","",IF(VLOOKUP(RC1,TrendFacDump,2,FALSE)=0,0,VLOOKUP(EOMONTH(ValDat,-1)+1,TrendFacDump,2,FALSE)/VLOOKUP(RC1,TrendFacDump,2,FALSE))) -> 1.1512779184895232 | C15: =IF(RC1="","",VLOOKUP(RC1,ExpDump,7,FALSE)) -> 2816.6260000000002 | D15: =IF(RC1="","",SUM(RC[2]:RC[37])) -> 186494 | E15: =IF(R[-1]C1="","",R[-1]C+RC[1]+R[-1]C[2]+R[-2]C[3]+R[-3]C[4]+R[-4]C[5]+R[-5]C[6]+R[-6]C[7]) -> 867537 | F15: =IF(RC1="","",VLOOKUP(RC1,PaidDump,R8C+2,FALSE)) -> 724 | G15: =IF(RC1="","",VLOOKUP(RC1,PaidDump,R8C+2,FALSE)) -> 73514 | H15: =IF(RC1="","",VLOOKUP(RC1,PaidDump,R8C+2,FALSE)) -> 100846 | I15: =IF(RC1="","",VLOOKUP(RC1,PaidDump,R8C+2,FALSE)) -> 2952 | J15: =IF(RC1="","",VLOOKUP(RC1,PaidDump,R8C+2,FALSE)) -> 6434 | K15: =IF(RC1="","",VLOOKUP(RC1,PaidDump,R8C+2,FALSE)) -> 1354 | L15: =IF(RC1="","",VLOOKUP(RC1,PaidDump,R8C+2,FALSE)) -> 670 | M15: =IF(RC1="","",VLOOKUP(RC1,PaidDump,R8C+2,FALSE)) -> 0 | N15: =IF(RC1="","",VLOOKUP(RC1,PaidDump,R8C+2,FALSE)) -> 0 | O15: =IF(RC1="","",VLOOKUP(RC1,PaidDump,R8C+2,FALSE)) -> 0 | P15: =IF(RC1="","",VLOOKUP(RC1,PaidDump,R8C+2,FALSE)) -> 0 | Q15: =IF(RC1="","",VLOOKUP(RC1,PaidDump,R8C+2,FALSE)) -> 0 | R15: =IF(RC1="","",VLOOKUP(RC1,PaidDump,R8C+2,FALSE)) -> 0 | S15: =IF(RC1="","",VLOOKUP(RC1,PaidDump,R8C+2,FALSE)) -> 0 | T15: =IF(RC1="","",VLOOKUP(RC1,PaidDump,R8C+2,FALSE)) -> 0 | U15: =IF(RC1="","",VLOOKUP(RC1,PaidDump,R8C+2,FALSE)) -> 0 | V15: =IF(RC1="","",VLOOKUP(RC1,PaidDump,R8C+2,FALSE)) -> 0 | W15: =IF(RC1="","",VLOOKUP(RC1,PaidDump,R8C+2,FALSE)) -> 0 | X15: =IF(RC1="","",VLOOKUP(RC1,PaidDump,R8C+2,FALSE)) -> 0 | Y15: =IF(RC1="","",VLOOKUP(RC1,PaidDump,R8C+2,FALSE)) -> 0 | Z15: =IF(RC1="","",VLOOKUP(RC1,PaidDump,R8C+2,FALSE)) -> 0 | AA15: =IF(RC1="","",VLOOKUP(RC1,PaidDump,R8C+2,FALSE)) -> 0 | AB15: =IF(RC1="","",VLOOKUP(RC1,PaidDump,R8C+2,FALSE)) -> 0 | AC15: =IF(RC1="","",VLOOKUP(RC1,PaidDump,R8C+2,FALSE)) -> 0 | AD15: =IF(RC1="","",VLOOKUP(RC1,PaidDump,R8C+2,FALSE)) -> 0 | AE15: =IF(RC1="","",VLOOKUP(RC1,PaidDump,R8C+2,FALSE)) -> 0 | AF15: =IF(RC1="","",VLOOKUP(RC1,PaidDump,R8C+2,FALSE)) -> 0 | AG15: =IF(RC1="","",VLOOKUP(RC1,PaidDump,R8C+2,FALSE)) -> 0 | AH15: =IF(RC1="","",VLOOKUP(RC1,PaidDump,R8C+2,FALSE)) -> 0 | AI15: =IF(RC1="","",VLOOKUP(RC1,PaidDump,R8C+2,FALSE)) -> 0 | AJ15: =IF(RC1="","",VLOOKUP(RC1,PaidDump,R8C+2,FALSE)) -> 0 | AK15: =IF(RC1="","",VLOOKUP(RC1,PaidDump,R8C+2,FALSE)) -> 0 | AL15: =IF(RC1="","",VLOOKUP(RC1,PaidDump,R8C+2,FALSE)) -> 0 | AM15: =IF(RC1="","",VLOOKUP(RC1,PaidDump,R8C+2,FALSE)) -> 0 | AN15: =IF(RC1="","",VLOOKUP(RC1,PaidDump,R8C+2,FALSE)) -> 0 | AO15: =IF(RC1="","",VLOOKUP(RC1,PaidDump,R8C+2,FALSE)) -> 0
A16: =IF(R[-1]C1="","",IF(DATE(YEAR(R[-1]C),MONTH(R[-1]C)+1,1)>ValDat,"",DATE(YEAR(R[-1]C),MONTH(R[-1]C)+1,1))) -> 1999-03-01T00:00:00.000 | B16: =IF(RC1="","",IF(VLOOKUP(RC1,TrendFacDump,2,FALSE)=0,0,VLOOKUP(EOMONTH(ValDat,-1)+1,TrendFacDump,2,FALSE)/VLOOKUP(RC1,TrendFacDump,2,FALSE))) -> 1.1456065986940085 | C16: =IF(RC1="","",VLOOKUP(RC1,ExpDump,7,FALSE)) -> 2829.576 | D16: =IF(RC1="","",SUM(RC[2]:RC[37])) -> 186494 | E16: =IF(RC1="","",R[-1]C+RC[1]+R[-1]C[2]+R[-2]C[3]+R[-3]C[4]+R[-4]C[5]+R[-5]C[6]+R[-6]C[7]+R[-7]C[8]) -> 1030485 | F16: =IF(RC1="","",VLOOKUP(RC1,PaidDump,R8C+2,FALSE)) -> 22541 | G16: =IF(RC1="","",VLOOKUP(RC1,PaidDump,R8C+2,FALSE)) -> 122603 | H16: =IF(RC1="","",VLOOKUP(RC1,PaidDump,R8C+2,FALSE)) -> 33881 | I16: =IF(RC1="","",VLOOKUP(RC1,PaidDump,R8C+2,FALSE)) -> 1847 | J16: =IF(RC1="","",VLOOKUP(RC1,PaidDump,R8C+2,FALSE)) -> 3742 | K16: =IF(RC1="","",VLOOKUP(RC1,PaidDump,R8C+2,FALSE)) -> 1210 | L16: =IF(RC1="","",VLOOKUP(RC1,PaidDump,R8C+2,FALSE)) -> 670 | M16: =IF(RC1="","",VLOOKUP(RC1,PaidDump,R8C+2,FALSE)) -> 0 | N16: =IF(RC1="","",VLOOKUP(RC1,PaidDump,R8C+2,FALSE)) -> 0 | O16: =IF(RC1="","",VLOOKUP(RC1,PaidDump,R8C+2,FALSE)) -> 0 | P16: =IF(RC1="","",VLOOKUP(RC1,PaidDump,R8C+2,FALSE)) -> 0 | Q16: =IF(RC1="","",VLOOKUP(RC1,PaidDump,R8C+2,FALSE)) -> 0 | R16: =IF(RC1="","",VLOOKUP(RC1,PaidDump,R8C+2,FALSE)) -> 0 | S16: =IF(RC1="","",VLOOKUP(RC1,PaidDump,R8C+2,FALSE)) -> 0 | T16: =IF(RC1="","",VLOOKUP(RC1,PaidDump,R8C+2,FALSE)) -> 0 | U16: =IF(RC1="","",VLOOKUP(RC1,PaidDump,R8C+2,FALSE)) -> 0 | V16: =IF(RC1="","",VLOOKUP(RC1,PaidDump,R8C+2,FALSE)) -> 0 | W16: =IF(RC1="","",VLOOKUP(RC1,PaidDump,R8C+2,FALSE)) -> 0 | X16: =IF(RC1="","",VLOOKUP(RC1,PaidDump,R8C+2,FALSE)) -> 0 | Y16: =IF(RC1="","",VLOOKUP(RC1,PaidDump,R8C+2,FALSE)) -> 0 | Z16: =IF(RC1="","",VLOOKUP(RC1,PaidDump,R8C+2,FALSE)) -> 0 | AA16: =IF(RC1="","",VLOOKUP(RC1,PaidDump,R8C+2,FALSE)) -> 0 | AB16: =IF(RC1="","",VLOOKUP(RC1,PaidDump,R8C+2,FALSE)) -> 0 | AC16: =IF(RC1="","",VLOOKUP(RC1,PaidDump,R8C+2,FALSE)) -> 0 | AD16: =IF(RC1="","",VLOOKUP(RC1,PaidDump,R8C+2,FALSE)) -> 0 | AE16: =IF(RC1="","",VLOOKUP(RC1,PaidDump,R8C+2,FALSE)) -> 0 | AF16: =IF(RC1="","",VLOOKUP(RC1,PaidDump,R8C+2,FALSE)) -> 0 | AG16: =IF(RC1="","",VLOOKUP(RC1,PaidDump,R8C+2,FALSE)) -> 0 | AH16: =IF(RC1="","",VLOOKUP(RC1,PaidDump,R8C+2,FALSE)) -> 0 | AI16: =IF(RC1="","",VLOOKUP(RC1,PaidDump,R8C+2,FALSE)) -> 0 | AJ16: =IF(RC1="","",VLOOKUP(RC1,PaidDump,R8C+2,FALSE)) -> 0 | AK16: =IF(RC1="","",VLOOKUP(RC1,PaidDump,R8C+2,FALSE)) -> 0 | AL16: =IF(RC1="","",VLOOKUP(RC1,PaidDump,R8C+2,FALSE)) -> 0 | AM16: =IF(RC1="","",VLOOKUP(RC1,PaidDump,R8C+2,FALSE)) -> 0 | AN16: =IF(RC1="","",VLOOKUP(RC1,PaidDump,R8C+2,FALSE)) -> 0 | AO16: =IF(RC1="","",VLOOKUP(RC1,PaidDump,R8C+2,FALSE)) -> 0
A17: =IF(R[-1]C1="","",IF(DATE(YEAR(R[-1]C),MONTH(R[-1]C)+1,1)>ValDat,"",DATE(YEAR(R[-1]C),MONTH(R[-1]C)+1,1))) -> 1999-04-01T00:00:00.000 | B17: =IF(RC1="","",IF(VLOOKUP(RC1,TrendFacDump,2,FALSE)=0,0,VLOOKUP(EOMONTH(ValDat,-1)+1,TrendFacDump,2,FALSE)/VLOOKUP(RC1,TrendFacDump,2,FALSE))) -> 1.1401208528103979 | C17: =IF(RC1="","",VLOOKUP(RC1,ExpDump,7,FALSE)) -> 2910.3670000000002 | D17: =IF(RC1="","",SUM(RC[2]:RC[37])) -> 255986 | E17: =IF(RC1="","",R[-1]C+RC[1]+R[-1]C[2]+R[-2]C[3]+R[-3]C[4]+R[-4]C[5]+R[-5]C[6]+R[-6]C[7]+R[-7]C[8]+R[-8]C[9]) -> 1273900 | F17: =IF(RC1="","",VLOOKUP(RC1,PaidDump,R8C+2,FALSE)) -> 13576 | G17: =IF(RC1="","",VLOOKUP(RC1,PaidDump,R8C+2,FALSE)) -> 98490 | H17: =IF(RC1="","",VLOOKUP(RC1,PaidDump,R8C+2,FALSE)) -> 88390 | I17: =IF(RC1="","",VLOOKUP(RC1,PaidDump,R8C+2,FALSE)) -> 43589 | J17: =IF(RC1="","",VLOOKUP(RC1,PaidDump,R8C+2,FALSE)) -> 3662 | K17: =IF(RC1="","",VLOOKUP(RC1,PaidDump,R8C+2,FALSE)) -> 1893 | L17: =IF(RC1="","",VLOOKUP(RC1,PaidDump,R8C+2,FALSE)) -> 2160 | M17: =IF(RC1="","",VLOOKUP(RC1,PaidDump,R8C+2,FALSE)) -> 72 | N17: =IF(RC1="","",VLOOKUP(RC1,PaidDump,R8C+2,FALSE)) -> 4154 | O17: =IF(RC1="","",VLOOKUP(RC1,PaidDump,R8C+2,FALSE)) -> 0 | P17: =IF(RC1="","",VLOOKUP(RC1,PaidDump,R8C+2,FALSE)) -> 0 | Q17: =IF(RC1="","",VLOOKUP(RC1,PaidDump,R8C+2,FALSE)) -> 0 | R17: =IF(RC1="","",VLOOKUP(RC1,PaidDump,R8C+2,FALSE)) -> 0 | S17: =IF(RC1="","",VLOOKUP(RC1,PaidDump,R8C+2,FALSE)) -> 0 | T17: =IF(RC1="","",VLOOKUP(RC1,PaidDump,R8C+2,FALSE)) -> 0 | U17: =IF(RC1="","",VLOOKUP(RC1,PaidDump,R8C+2,FALSE)) -> 0 | V17: =IF(RC1="","",VLOOKUP(RC1,PaidDump,R8C+2,FALSE)) -> 0 | W17: =IF(RC1="","",VLOOKUP(RC1,PaidDump,R8C+2,FALSE)) -> 0 | X17: =IF(RC1="","",VLOOKUP(RC1,PaidDump,R8C+2,FALSE)) -> 0 | Y17: =IF(RC1="","",VLOOKUP(RC1,PaidDump,R8C+2,FALSE)) -> 0 | Z17: =IF(RC1="","",VLOOKUP(RC1,PaidDump,R8C+2,FALSE)) -> 0 | AA17: =IF(RC1="","",VLOOKUP(RC1,PaidDump,R8C+2,FALSE)) -> 0 | AB17: =IF(RC1="","",VLOOKUP(RC1,PaidDump,R8C+2,FALSE)) -> 0 | AC17: =IF(RC1="","",VLOOKUP(RC1,PaidDump,R8C+2,FALSE)) -> 0 | AD17: =IF(RC1="","",VLOOKUP(RC1,PaidDump,R8C+2,FALSE)) -> 0 | AE17: =IF(RC1="","",VLOOKUP(RC1,PaidDump,R8C+2,FALSE)) -> 0 | AF17: =IF(RC1="","",VLOOKUP(RC1,PaidDump,R8C+2,FALSE)) -> 0 | AG17: =IF(RC1="","",VLOOKUP(RC1,PaidDump,R8C+2,FALSE)) -> 0 | AH17: =IF(RC1="","",VLOOKUP(RC1,PaidDump,R8C+2,FALSE)) -> 0 | AI17: =IF(RC1="","",VLOOKUP(RC1,PaidDump,R8C+2,FALSE)) -> 0 | AJ17: =IF(RC1="","",VLOOKUP(RC1,PaidDump,R8C+2,FALSE)) -> 0 | AK17: =IF(RC1="","",VLOOKUP(RC1,PaidDump,R8C+2,FALSE)) -> 0 | AL17: =IF(RC1="","",VLOOKUP(RC1,PaidDump,R8C+2,FALSE)) -> 0 | AM17: =IF(RC1="","",VLOOKUP(RC1,PaidDump,R8C+2,FALSE)) -> 0 | AN17: =IF(RC1="","",VLOOKUP(RC1,PaidDump,R8C+2,FALSE)) -> 0 | AO17: =IF(RC1="","",VLOOKUP(RC1,PaidDump,R8C+2,FALSE)) -> 0
A18: =IF(R[-1]C1="","",IF(DATE(YEAR(R[-1]C),MONTH(R[-1]C)+1,1)>ValDat,"",DATE(YEAR(R[-1]C),MONTH(R[-1]C)+1,1))) -> 1999-05-01T00:00:00.000 | B18: =IF(RC1="","",IF(VLOOKUP(RC1,TrendFacDump,2,FALSE)=0,0,VLOOKUP(EOMONTH(ValDat,-1)+1,TrendFacDump,2,FALSE)/VLOOKUP(RC1,TrendFacDump,2,FALSE))) -> 1.1345586566825505 | C18: =IF(RC1="","",VLOOKUP(RC1,ExpDump,7,FALSE)) -> 2874.0259999999998 | D18: =IF(RC1="","",SUM(RC[2]:RC[37])) -> 255986 | E18: =IF(RC1="","",R[-1]C+RC[1]+R[-1]C[2]+R[-2]C[3]+R[-3]C[4]+R[-4]C[5]+R[-5]C[6]+R[-6]C[7]+R[-7]C[8]+R[-8]C[9]+R[-9]C[10]) -> 1443381 | F18: =IF(RC1="","",VLOOKUP(RC1,PaidDump,R8C+2,FALSE)) -> 33308 | G18: =IF(RC1="","",VLOOKUP(RC1,PaidDump,R8C+2,FALSE)) -> 90083 | H18: =IF(RC1="","",VLOOKUP(RC1,PaidDump,R8C+2,FALSE)) -> 107509 | I18: =IF(RC1="","",VLOOKUP(RC1,PaidDump,R8C+2,FALSE)) -> 13397 | J18: =IF(RC1="","",VLOOKUP(RC1,PaidDump,R8C+2,FALSE)) -> 3572 | K18: =IF(RC1="","",VLOOKUP(RC1,PaidDump,R8C+2,FALSE)) -> 3399 | L18: =IF(RC1="","",VLOOKUP(RC1,PaidDump,R8C+2,FALSE)) -> 492 | M18: =IF(RC1="","",VLOOKUP(RC1,PaidDump,R8C+2,FALSE)) -> 72 | N18: =IF(RC1="","",VLOOKUP(RC1,PaidDump,R8C+2,FALSE)) -> 4154 | O18: =IF(RC1="","",VLOOKUP(RC1,PaidDump,R8C+2,FALSE)) -> 0 | P18: =IF(RC1="","",VLOOKUP(RC1,PaidDump,R8C+2,FALSE)) -> 0 | Q18: =IF(RC1="","",VLOOKUP(RC1,PaidDump,R8C+2,FALSE)) -> 0 | R18: =IF(RC1="","",VLOOKUP(RC1,PaidDump,R8C+2,FALSE)) -> 0 | S18: =IF(RC1="","",VLOOKUP(RC1,PaidDump,R8C+2,FALSE)) -> 0 | T18: =IF(RC1="","",VLOOKUP(RC1,PaidDump,R8C+2,FALSE)) -> 0 | U18: =IF(RC1="","",VLOOKUP(RC1,PaidDump,R8C+2,FALSE)) -> 0 | V18: =IF(RC1="","",VLOOKUP(RC1,PaidDump,R8C+2,FALSE)) -> 0 | W18: =IF(RC1="","",VLOOKUP(RC1,PaidDump,R8C+2,FALSE)) -> 0 | X18: =IF(RC1="","",VLOOKUP(RC1,PaidDump,R8C+2,FALSE)) -> 0 | Y18: =IF(RC1="","",VLOOKUP(RC1,PaidDump,R8C+2,FALSE)) -> 0 | Z18: =IF(RC1="","",VLOOKUP(RC1,PaidDump,R8C+2,FALSE)) -> 0 | AA18: =IF(RC1="","",VLOOKUP(RC1,PaidDump,R8C+2,FALSE)) -> 0 | AB18: =IF(RC1="","",VLOOKUP(RC1,PaidDump,R8C+2,FALSE)) -> 0 | AC18: =IF(RC1="","",VLOOKUP(RC1,PaidDump,R8C+2,FALSE)) -> 0 | AD18: =IF(RC1="","",VLOOKUP(RC1,PaidDump,R8C+2,FALSE)) -> 0 | AE18: =IF(RC1="","",VLOOKUP(RC1,PaidDump,R8C+2,FALSE)) -> 0 | AF18: =IF(RC1="","",VLOOKUP(RC1,PaidDump,R8C+2,FALSE)) -> 0 | AG18: =IF(RC1="","",VLOOKUP(RC1,PaidDump,R8C+2,FALSE)) -> 0 | AH18: =IF(RC1="","",VLOOKUP(RC1,PaidDump,R8C+2,FALSE)) -> 0 | AI18: =IF(RC1="","",VLOOKUP(RC1,PaidDump,R8C+2,FALSE)) -> 0 | AJ18: =IF(RC1="","",VLOOKUP(RC1,PaidDump,R8C+2,FALSE)) -> 0 | AK18: =IF(RC1="","",VLOOKUP(RC1,PaidDump,R8C+2,FALSE)) -> 0 | AL18: =IF(RC1="","",VLOOKUP(RC1,PaidDump,R8C+2,FALSE)) -> 0 | AM18: =IF(RC1="","",VLOOKUP(RC1,PaidDump,R8C+2,FALSE)) -> 0 | AN18: =IF(RC1="","",VLOOKUP(RC1,PaidDump,R8C+2,FALSE)) -> 0 | AO18: =IF(RC1="","",VLOOKUP(RC1,PaidDump,R8C+2,FALSE)) -> 0
A19: =IF(R[-1]C1="","",IF(DATE(YEAR(R[-1]C),MONTH(R[-1]C)+1,1)>ValDat,"",DATE(YEAR(R[-1]C),MONTH(R[-1]C)+1,1))) -> 1999-06-01T00:00:00.000 | B19: =IF(RC1="","",IF(VLOOKUP(RC1,TrendFacDump,2,FALSE)=0,0,VLOOKUP(EOMONTH(ValDat,-1)+1,TrendFacDump,2,FALSE)/VLOOKUP(RC1,TrendFacDump,2,FALSE))) -> 1.1290504685559444 | C19: =IF(RC1="","",VLOOKUP(RC1,ExpDump,7,FALSE)) -> 2840.922 | D19: =IF(RC1="","",SUM(RC[2]:RC[37])) -> 218545 | E19: =IF(RC1="","",R[-1]C+RC[1]+R[-1]C[2]+R[-2]C[3]+R[-3]C[4]+R[-4]C[5]+R[-5]C[6]+R[-6]C[7]+R[-7]C[8]+R[-8]C[9]+R[-9]C[10]+R[-10]C[11]) -> 1636690 | F19: =IF(RC1="","",VLOOKUP(RC1,PaidDump,R8C+2,FALSE)) -> 6555 | G19: =IF(RC1="","",VLOOKUP(RC1,PaidDump,R8C+2,FALSE)) -> 111208 | H19: =IF(RC1="","",VLOOKUP(RC1,PaidDump,R8C+2,FALSE)) -> 44850 | I19: =IF(RC1="","",VLOOKUP(RC1,PaidDump,R8C+2,FALSE)) -> 15516 | J19: =IF(RC1="","",VLOOKUP(RC1,PaidDump,R8C+2,FALSE)) -> 14096 | K19: =IF(RC1="","",VLOOKUP(RC1,PaidDump,R8C+2,FALSE)) -> 20812 | L19: =IF(RC1="","",VLOOKUP(RC1,PaidDump,R8C+2,FALSE)) -> 1119 | M19: =IF(RC1="","",VLOOKUP(RC1,PaidDump,R8C+2,FALSE)) -> 484 | N19: =IF(RC1="","",VLOOKUP(RC1,PaidDump,R8C+2,FALSE)) -> 5922 | O19: =IF(RC1="","",VLOOKUP(RC1,PaidDump,R8C+2,FALSE)) -> -2017 | P19: =IF(RC1="","",VLOOKUP(RC1,PaidDump,R8C+2,FALSE)) -> 0 | Q19: =IF(RC1="","",VLOOKUP(RC1,PaidDump,R8C+2,FALSE)) -> 0 | R19: =IF(RC1="","",VLOOKUP(RC1,PaidDump,R8C+2,FALSE)) -> 0 | S19: =IF(RC1="","",VLOOKUP(RC1,PaidDump,R8C+2,FALSE)) -> 0 | T19: =IF(RC1="","",VLOOKUP(RC1,PaidDump,R8C+2,FALSE)) -> 0 | U19: =IF(RC1="","",VLOOKUP(RC1,PaidDump,R8C+2,FALSE)) -> 0 | V19: =IF(RC1="","",VLOOKUP(RC1,PaidDump,R8C+2,FALSE)) -> 0 | W19: =IF(RC1="","",VLOOKUP(RC1,PaidDump,R8C+2,FALSE)) -> 0 | X19: =IF(RC1="","",VLOOKUP(RC1,PaidDump,R8C+2,FALSE)) -> 0 | Y19: =IF(RC1="","",VLOOKUP(RC1,PaidDump,R8C+2,FALSE)) -> 0 | Z19: =IF(RC1="","",VLOOKUP(RC1,PaidDump,R8C+2,FALSE)) -> 0 | AA19: =IF(RC1="","",VLOOKUP(RC1,PaidDump,R8C+2,FALSE)) -> 0 | AB19: =IF(RC1="","",VLOOKUP(RC1,PaidDump,R8C+2,FALSE)) -> 0 | AC19: =IF(RC1="","",VLOOKUP(RC1,PaidDump,R8C+2,FALSE)) -> 0 | AD19: =IF(RC1="","",VLOOKUP(RC1,PaidDump,R8C+2,FALSE)) -> 0 | AE19: =IF(RC1="","",VLOOKUP(RC1,PaidDump,R8C+2,FALSE)) -> 0 | AF19: =IF(RC1="","",VLOOKUP(RC1,PaidDump,R8C+2,FALSE)) -> 0 | AG19: =IF(RC1="","",VLOOKUP(RC1,PaidDump,R8C+2,FALSE)) -> 0 | AH19: =IF(RC1="","",VLOOKUP(RC1,PaidDump,R8C+2,FALSE)) -> 0 | AI19: =IF(RC1="","",VLOOKUP(RC1,PaidDump,R8C+2,FALSE)) -> 0 | AJ19: =IF(RC1="","",VLOOKUP(RC1,PaidDump,R8C+2,FALSE)) -> 0 | AK19: =IF(RC1="","",VLOOKUP(RC1,PaidDump,R8C+2,FALSE)) -> 0 | AL19: =IF(RC1="","",VLOOKUP(RC1,PaidDump,R8C+2,FALSE)) -> 0 | AM19: =IF(RC1="","",VLOOKUP(RC1,PaidDump,R8C+2,FALSE)) -> 0 | AN19: =IF(RC1="","",VLOOKUP(RC1,PaidDump,R8C+2,FALSE)) -> 0 | AO19: =IF(RC1="","",VLOOKUP(RC1,PaidDump,R8C+2,FALSE)) -> 0
A20: =IF(R[-1]C1="","",IF(DATE(YEAR(R[-1]C),MONTH(R[-1]C)+1,1)>ValDat,"",DATE(YEAR(R[-1]C),MONTH(R[-1]C)+1,1))) -> 1999-07-01T00:00:00.000 | B20: =IF(RC1="","",IF(VLOOKUP(RC1,TrendFacDump,2,FALSE)=0,0,VLOOKUP(EOMONTH(ValDat,-1)+1,TrendFacDump,2,FALSE)/VLOOKUP(RC1,TrendFacDump,2,FALSE))) -> 1.1235955056179776 | C20: =IF(RC1="","",VLOOKUP(RC1,ExpDump,7,FALSE)) -> 2830.386 | D20: =IF(RC1="","",SUM(RC[2]:RC[37])) -> 218545 | E20: =IF(RC1="","",R[-1]C+RC[1]+R[-1]C[2]+R[-2]C[3]+R[-3]C[4]+R[-4]C[5]+R[-5]C[6]+R[-6]C[7]+R[-7]C[8]+R[-8]C[9]+R[-9]C[10]+R[-10]C[11]+R[-11]C[12]) -> 1961904 | F20: =IF(RC1="","",VLOOKUP(RC1,PaidDump,R8C+2,FALSE)) -> 57812 | G20: =IF(RC1="","",VLOOKUP(RC1,PaidDump,R8C+2,FALSE)) -> 73515 | H20: =IF(RC1="","",VLOOKUP(RC1,PaidDump,R8C+2,FALSE)) -> 57928 | I20: =IF(RC1="","",VLOOKUP(RC1,PaidDump,R8C+2,FALSE)) -> 10474 | J20: =IF(RC1="","",VLOOKUP(RC1,PaidDump,R8C+2,FALSE)) -> 13276 | K20: =IF(RC1="","",VLOOKUP(RC1,PaidDump,R8C+2,FALSE)) -> 141 | L20: =IF(RC1="","",VLOOKUP(RC1,PaidDump,R8C+2,FALSE)) -> 1010 | M20: =IF(RC1="","",VLOOKUP(RC1,PaidDump,R8C+2,FALSE)) -> 484 | N20: =IF(RC1="","",VLOOKUP(RC1,PaidDump,R8C+2,FALSE)) -> 6162 | O20: =IF(RC1="","",VLOOKUP(RC1,PaidDump,R8C+2,FALSE)) -> -2257 | P20: =IF(RC1="","",VLOOKUP(RC1,PaidDump,R8C+2,FALSE)) -> 0 | Q20: =IF(RC1="","",VLOOKUP(RC1,PaidDump,R8C+2,FALSE)) -> 0 | R20: =IF(RC1="","",VLOOKUP(RC1,PaidDump,R8C+2,FALSE)) -> 0 | S20: =IF(RC1="","",VLOOKUP(RC1,PaidDump,R8C+2,FALSE)) -> 0 | T20: =IF(RC1="","",VLOOKUP(RC1,PaidDump,R8C+2,FALSE)) -> 0 | U20: =IF(RC1="","",VLOOKUP(RC1,PaidDump,R8C+2,FALSE)) -> 0 | V20: =IF(RC1="","",VLOOKUP(RC1,PaidDump,R8C+2,FALSE)) -> 0 | W20: =IF(RC1="","",VLOOKUP(RC1,PaidDump,R8C+2,FALSE)) -> 0 | X20: =IF(RC1="","",VLOOKUP(RC1,PaidDump,R8C+2,FALSE)) -> 0 | Y20: =IF(RC1="","",VLOOKUP(RC1,PaidDump,R8C+2,FALSE)) -> 0 | Z20: =IF(RC1="","",VLOOKUP(RC1,PaidDump,R8C+2,FALSE)) -> 0 | AA20: =IF(RC1="","",VLOOKUP(RC1,PaidDump,R8C+2,FALSE)) -> 0 | AB20: =IF(RC1="","",VLOOKUP(RC1,PaidDump,R8C+2,FALSE)) -> 0 | AC20: =IF(RC1="","",VLOOKUP(RC1,PaidDump,R8C+2,FALSE)) -> 0 | AD20: =IF(RC1="","",VLOOKUP(RC1,PaidDump,R8C+2,FALSE)) -> 0 | AE20: =IF(RC1="","",VLOOKUP(RC1,PaidDump,R8C+2,FALSE)) -> 0 | AF20: =IF(RC1="","",VLOOKUP(RC1,PaidDump,R8C+2,FALSE)) -> 0 | AG20: =IF(RC1="","",VLOOKUP(RC1,PaidDump,R8C+2,FALSE)) -> 0 | AH20: =IF(RC1="","",VLOOKUP(RC1,PaidDump,R8C+2,FALSE)) -> 0 | AI20: =IF(RC1="","",VLOOKUP(RC1,PaidDump,R8C+2,FALSE)) -> 0 | AJ20: =IF(RC1="","",VLOOKUP(RC1,PaidDump,R8C+2,FALSE)) -> 0 | AK20: =IF(RC1="","",VLOOKUP(RC1,PaidDump,R8C+2,FALSE)) -> 0 | AL20: =IF(RC1="","",VLOOKUP(RC1,PaidDump,R8C+2,FALSE)) -> 0 | AM20: =IF(RC1="","",VLOOKUP(RC1,PaidDump,R8C+2,FALSE)) -> 0 | AN20: =IF(RC1="","",VLOOKUP(RC1,PaidDump,R8C+2,FALSE)) -> 0 | AO20: =IF(RC1="","",VLOOKUP(RC1,PaidDump,R8C+2,FALSE)) -> 0
A21: =IF(R[-1]C1="","",IF(DATE(YEAR(R[-1]C),MONTH(R[-1]C)+1,1)>ValDat,"",DATE(YEAR(R[-1]C),MONTH(R[-1]C)+1,1))) -> 1999-08-01T00:00:00.000 | B21: =IF(RC1="","",IF(VLOOKUP(RC1,TrendFacDump,2,FALSE)=0,0,VLOOKUP(EOMONTH(ValDat,-1)+1,TrendFacDump,2,FALSE)/VLOOKUP(RC1,TrendFacDump,2,FALSE))) -> 1.1181930001118192 | C21: =IF(RC1="","",VLOOKUP(RC1,ExpDump,7,FALSE)) -> 2957.8130000000001 | D21: =IF(RC1="","",SUM(RC[2]:RC[37])) -> 206958 | E21: =IF(RC1="","",R[-1]C+RC[1]+R[-1]C[2]+R[-2]C[3]+R[-3]C[4]+R[-4]C[5]+R[-5]C[6]+R[-6]C[7]+R[-7]C[8]+R[-8]C[9]+R[-9]C[10]+R[-10]C[11]+R[-11]C[12]+R[-12]C[13]) -> 2117181 | F21: =IF(RC1="","",VLOOKUP(RC1,PaidDump,R8C+2,FALSE)) -> 17973 | G21: =IF(RC1="","",VLOOKUP(RC1,PaidDump,R8C+2,FALSE)) -> 92380 | H21: =IF(RC1="","",VLOOKUP(RC1,PaidDump,R8C+2,FALSE)) -> 33087 | I21: =IF(RC1="","",VLOOKUP(RC1,PaidDump,R8C+2,FALSE)) -> 19224 | J21: =IF(RC1="","",VLOOKUP(RC1,PaidDump,R8C+2,FALSE)) -> 2579 | K21: =IF(RC1="","",VLOOKUP(RC1,PaidDump,R8C+2,FALSE)) -> 2463 | L21: =IF(RC1="","",VLOOKUP(RC1,PaidDump,R8C+2,FALSE)) -> 34006 | M21: =IF(RC1="","",VLOOKUP(RC1,PaidDump,R8C+2,FALSE)) -> -80 | N21: =IF(RC1="","",VLOOKUP(RC1,PaidDump,R8C+2,FALSE)) -> 309 | O21: =IF(RC1="","",VLOOKUP(RC1,PaidDump,R8C+2,FALSE)) -> 3572 | P21: =IF(RC1="","",VLOOKUP(RC1,PaidDump,R8C+2,FALSE)) -> 13 | Q21: =IF(RC1="","",VLOOKUP(RC1,PaidDump,R8C+2,FALSE)) -> 1432 | R21: =IF(RC1="","",VLOOKUP(RC1,PaidDump,R8C+2,FALSE)) -> 0 | S21: =IF(RC1="","",VLOOKUP(RC1,PaidDump,R8C+2,FALSE)) -> 0 | T21: =IF(RC1="","",VLOOKUP(RC1,PaidDump,R8C+2,FALSE)) -> 0 | U21: =IF(RC1="","",VLOOKUP(RC1,PaidDump,R8C+2,FALSE)) -> 0 | V21: =IF(RC1="","",VLOOKUP(RC1,PaidDump,R8C+2,FALSE)) -> 0 | W21: =IF(RC1="","",VLOOKUP(RC1,PaidDump,R8C+2,FALSE)) -> 0 | X21: =IF(RC1="","",VLOOKUP(RC1,PaidDump,R8C+2,FALSE)) -> 0 | Y21: =IF(RC1="","",VLOOKUP(RC1,PaidDump,R8C+2,FALSE)) -> 0 | Z21: =IF(RC1="","",VLOOKUP(RC1,PaidDump,R8C+2,FALSE)) -> 0 | AA21: =IF(RC1="","",VLOOKUP(RC1,PaidDump,R8C+2,FALSE)) -> 0 | AB21: =IF(RC1="","",VLOOKUP(RC1,PaidDump,R8C+2,FALSE)) -> 0 | AC21: =IF(RC1="","",VLOOKUP(RC1,PaidDump,R8C+2,FALSE)) -> 0 | AD21: =IF(RC1="","",VLOOKUP(RC1,PaidDump,R8C+2,FALSE)) -> 0 | AE21: =IF(RC1="","",VLOOKUP(RC1,PaidDump,R8C+2,FALSE)) -> 0 | AF21: =IF(RC1="","",VLOOKUP(RC1,PaidDump,R8C+2,FALSE)) -> 0 | AG21: =IF(RC1="","",VLOOKUP(RC1,PaidDump,R8C+2,FALSE)) -> 0 | AH21: =IF(RC1="","",VLOOKUP(RC1,PaidDump,R8C+2,FALSE)) -> 0 | AI21: =IF(RC1="","",VLOOKUP(RC1,PaidDump,R8C+2,FALSE)) -> 0 | AJ21: =IF(RC1="","",VLOOKUP(RC1,PaidDump,R8C+2,FALSE)) -> 0 | AK21: =IF(RC1="","",VLOOKUP(RC1,PaidDump,R8C+2,FALSE)) -> 0 | AL21: =IF(RC1="","",VLOOKUP(RC1,PaidDump,R8C+2,FALSE)) -> 0 | AM21: =IF(RC1="","",VLOOKUP(RC1,PaidDump,R8C+2,FALSE)) -> 0 | AN21: =IF(RC1="","",VLOOKUP(RC1,PaidDump,R8C+2,FALSE)) -> 0 | AO21: =IF(RC1="","",VLOOKUP(RC1,PaidDump,R8C+2,FALSE)) -> 0
A22: =IF(R[-1]C1="","",IF(DATE(YEAR(R[-1]C),MONTH(R[-1]C)+1,1)>ValDat,"",DATE(YEAR(R[-1]C),MONTH(R[-1]C)+1,1))) -> 1999-09-01T00:00:00.000 | B22: =IF(RC1="","",IF(VLOOKUP(RC1,TrendFacDump,2,FALSE)=0,0,VLOOKUP(EOMONTH(ValDat,-1)+1,TrendFacDump,2,FALSE)/VLOOKUP(RC1,TrendFacDump,2,FALSE))) -> 1.1127183709803048 | C22: =IF(RC1="","",VLOOKUP(RC1,ExpDump,7,FALSE)) -> 2973.8850000000002 | D22: =IF(RC1="","",SUM(RC[2]:RC[37])) -> 206958 | E22: =IF(RC1="","",R[-1]C+RC[1]+R[-1]C[2]+R[-2]C[3]+R[-3]C[4]+R[-4]C[5]+R[-5]C[6]+R[-6]C[7]+R[-7]C[8]+R[-8]C[9]+R[-9]C[10]+R[-10]C[11]+R[-11]C[12]+R[-12]C[13]+R[-13]C[14]) -> 2324740 | F22: =IF(RC1="","",VLOOKUP(RC1,PaidDump,R8C+2,FALSE)) -> 35600 | G22: =IF(RC1="","",VLOOKUP(RC1,PaidDump,R8C+2,FALSE)) -> 88108 | H22: =IF(RC1="","",VLOOKUP(RC1,PaidDump,R8C+2,FALSE)) -> 29728 | I22: =IF(RC1="","",VLOOKUP(RC1,PaidDump,R8C+2,FALSE)) -> 10188 | J22: =IF(RC1="","",VLOOKUP(RC1,PaidDump,R8C+2,FALSE)) -> 5698 | K22: =IF(RC1="","",VLOOKUP(RC1,PaidDump,R8C+2,FALSE)) -> 1709 | L22: =IF(RC1="","",VLOOKUP(RC1,PaidDump,R8C+2,FALSE)) -> 30681 | M22: =IF(RC1="","",VLOOKUP(RC1,PaidDump,R8C+2,FALSE)) -> -80 | N22: =IF(RC1="","",VLOOKUP(RC1,PaidDump,R8C+2,FALSE)) -> 3589 | O22: =IF(RC1="","",VLOOKUP(RC1,PaidDump,R8C+2,FALSE)) -> 292 | P22: =IF(RC1="","",VLOOKUP(RC1,PaidDump,R8C+2,FALSE)) -> 13 | Q22: =IF(RC1="","",VLOOKUP(RC1,PaidDump,R8C+2,FALSE)) -> 1432 | R22: =IF(RC1="","",VLOOKUP(RC1,PaidDump,R8C+2,FALSE)) -> 0 | S22: =IF(RC1="","",VLOOKUP(RC1,PaidDump,R8C+2,FALSE)) -> 0 | T22: =IF(RC1="","",VLOOKUP(RC1,PaidDump,R8C+2,FALSE)) -> 0 | U22: =IF(RC1="","",VLOOKUP(RC1,PaidDump,R8C+2,FALSE)) -> 0 | V22: =IF(RC1="","",VLOOKUP(RC1,PaidDump,R8C+2,FALSE)) -> 0 | W22: =IF(RC1="","",VLOOKUP(RC1,PaidDump,R8C+2,FALSE)) -> 0 | X22: =IF(RC1="","",VLOOKUP(RC1,PaidDump,R8C+2,FALSE)) -> 0 | Y22: =IF(RC1="","",VLOOKUP(RC1,PaidDump,R8C+2,FALSE)) -> 0 | Z22: =IF(RC1="","",VLOOKUP(RC1,PaidDump,R8C+2,FALSE)) -> 0 | AA22: =IF(RC1="","",VLOOKUP(RC1,PaidDump,R8C+2,FALSE)) -> 0 | AB22: =IF(RC1="","",VLOOKUP(RC1,PaidDump,R8C+2,FALSE)) -> 0 | AC22: =IF(RC1="","",VLOOKUP(RC1,PaidDump,R8C+2,FALSE)) -> 0 | AD22: =IF(RC1="","",VLOOKUP(RC1,PaidDump,R8C+2,FALSE)) -> 0 | AE22: =IF(RC1="","",VLOOKUP(RC1,PaidDump,R8C+2,FALSE)) -> 0 | AF22: =IF(RC1="","",VLOOKUP(RC1,PaidDump,R8C+2,FALSE)) -> 0 | AG22: =IF(RC1="","",VLOOKUP(RC1,PaidDump,R8C+2,FALSE)) -> 0 | AH22: =IF(RC1="","",VLOOKUP(RC1,PaidDump,R8C+2,FALSE)) -> 0 | AI22: =IF(RC1="","",VLOOKUP(RC1,PaidDump,R8C+2,FALSE)) -> 0 | AJ22: =IF(RC1="","",VLOOKUP(RC1,PaidDump,R8C+2,FALSE)) -> 0 | AK22: =IF(RC1="","",VLOOKUP(RC1,PaidDump,R8C+2,FALSE)) -> 0 | AL22: =IF(RC1="","",VLOOKUP(RC1,PaidDump,R8C+2,FALSE)) -> 0 | AM22: =IF(RC1="","",VLOOKUP(RC1,PaidDump,R8C+2,FALSE)) -> 0 | AN22: =IF(RC1="","",VLOOKUP(RC1,PaidDump,R8C+2,FALSE)) -> 0 | AO22: =IF(RC1="","",VLOOKUP(RC1,PaidDump,R8C+2,FALSE)) -> 0
A23: =IF(R[-1]C1="","",IF(DATE(YEAR(R[-1]C),MONTH(R[-1]C)+1,1)>ValDat,"",DATE(YEAR(R[-1]C),MONTH(R[-1]C)+1,1))) -> 1999-10-01T00:00:00.000 | B23: =IF(RC1="","",IF(VLOOKUP(RC1,TrendFacDump,2,FALSE)=0,0,VLOOKUP(EOMONTH(ValDat,-1)+1,TrendFacDump,2,FALSE)/VLOOKUP(RC1,TrendFacDump,2,FALSE))) -> 1.107297087808659 | C23: =IF(RC1="","",VLOOKUP(RC1,ExpDump,7,FALSE)) -> 2943.35 | D23: =IF(RC1="","",SUM(RC[2]:RC[37])) -> 95546 | E23: =IF(RC1="","",R[-1]C+RC[1]+R[-1]C[2]+R[-2]C[3]+R[-3]C[4]+R[-4]C[5]+R[-5]C[6]+R[-6]C[7]+R[-7]C[8]+R[-8]C[9]+R[-9]C[10]+R[-10]C[11]+R[-11]C[12]+R[-12]C[13]+R[-13]C[14]+R[-14]C[15]) -> 2485241 | F23: =IF(RC1="","",VLOOKUP(RC1,PaidDump,R8C+2,FALSE)) -> 9177 | G23: =IF(RC1="","",VLOOKUP(RC1,PaidDump,R8C+2,FALSE)) -> 52091 | H23: =IF(RC1="","",VLOOKUP(RC1,PaidDump,R8C+2,FALSE)) -> 8840 | I23: =IF(RC1="","",VLOOKUP(RC1,PaidDump,R8C+2,FALSE)) -> 4870 | J23: =IF(RC1="","",VLOOKUP(RC1,PaidDump,R8C+2,FALSE)) -> 4827 | K23: =IF(RC1="","",VLOOKUP(RC1,PaidDump,R8C+2,FALSE)) -> 13323 | L23: =IF(RC1="","",VLOOKUP(RC1,PaidDump,R8C+2,FALSE)) -> -7175 | M23: =IF(RC1="","",VLOOKUP(RC1,PaidDump,R8C+2,FALSE)) -> 1423 | N23: =IF(RC1="","",VLOOKUP(RC1,PaidDump,R8C+2,FALSE)) -> 384 | O23: =IF(RC1="","",VLOOKUP(RC1,PaidDump,R8C+2,FALSE)) -> 278 | P23: =IF(RC1="","",VLOOKUP(RC1,PaidDump,R8C+2,FALSE)) -> 6985 | Q23: =IF(RC1="","",VLOOKUP(RC1,PaidDump,R8C+2,FALSE)) -> 227 | R23: =IF(RC1="","",VLOOKUP(RC1,PaidDump,R8C+2,FALSE)) -> 240 | S23: =IF(RC1="","",VLOOKUP(RC1,PaidDump,R8C+2,FALSE)) -> 56 | T23: =IF(RC1="","",VLOOKUP(RC1,PaidDump,R8C+2,FALSE)) -> 0 | U23: =IF(RC1="","",VLOOKUP(RC1,PaidDump,R8C+2,FALSE)) -> 0 | V23: =IF(RC1="","",VLOOKUP(RC1,PaidDump,R8C+2,FALSE)) -> 0 | W23: =IF(RC1="","",VLOOKUP(RC1,PaidDump,R8C+2,FALSE)) -> 0 | X23: =IF(RC1="","",VLOOKUP(RC1,PaidDump,R8C+2,FALSE)) -> 0 | Y23: =IF(RC1="","",VLOOKUP(RC1,PaidDump,R8C+2,FALSE)) -> 0 | Z23: =IF(RC1="","",VLOOKUP(RC1,PaidDump,R8C+2,FALSE)) -> 0 | AA23: =IF(RC1="","",VLOOKUP(RC1,PaidDump,R8C+2,FALSE)) -> 0 | AB23: =IF(RC1="","",VLOOKUP(RC1,PaidDump,R8C+2,FALSE)) -> 0 | AC23: =IF(RC1="","",VLOOKUP(RC1,PaidDump,R8C+2,FALSE)) -> 0 | AD23: =IF(RC1="","",VLOOKUP(RC1,PaidDump,R8C+2,FALSE)) -> 0 | AE23: =IF(RC1="","",VLOOKUP(RC1,PaidDump,R8C+2,FALSE)) -> 0 | AF23: =IF(RC1="","",VLOOKUP(RC1,PaidDump,R8C+2,FALSE)) -> 0 | AG23: =IF(RC1="","",VLOOKUP(RC1,PaidDump,R8C+2,FALSE)) -> 0 | AH23: =IF(RC1="","",VLOOKUP(RC1,PaidDump,R8C+2,FALSE)) -> 0 | AI23: =IF(RC1="","",VLOOKUP(RC1,PaidDump,R8C+2,FALSE)) -> 0 | AJ23: =IF(RC1="","",VLOOKUP(RC1,PaidDump,R8C+2,FALSE)) -> 0 | AK23: =IF(RC1="","",VLOOKUP(RC1,PaidDump,R8C+2,FALSE)) -> 0 | AL23: =IF(RC1="","",VLOOKUP(RC1,PaidDump,R8C+2,FALSE)) -> 0 | AM23: =IF(RC1="","",VLOOKUP(RC1,PaidDump,R8C+2,FALSE)) -> 0 | AN23: =IF(RC1="","",VLOOKUP(RC1,PaidDump,R8C+2,FALSE)) -> 0 | AO23: =IF(RC1="","",VLOOKUP(RC1,PaidDump,R8C+2,FALSE)) -> 0
A24: =IF(R[-1]C1="","",IF(DATE(YEAR(R[-1]C),MONTH(R[-1]C)+1,1)>ValDat,"",DATE(YEAR(R[-1]C),MONTH(R[-1]C)+1,1))) -> 1999-11-01T00:00:00.000 | B24: =IF(RC1="","",IF(VLOOKUP(RC1,TrendFacDump,2,FALSE)=0,0,VLOOKUP(EOMONTH(ValDat,-1)+1,TrendFacDump,2,FALSE)/VLOOKUP(RC1,TrendFacDump,2,FALSE))) -> 1.1019283746556474 | C24: =IF(RC1="","",VLOOKUP(RC1,ExpDump,7,FALSE)) -> 3014.0830000000001 | D24: =IF(RC1="","",SUM(RC[2]:RC[37])) -> 95546 | E24: =IF(RC1="","",R[-1]C+RC[1]+R[-1]C[2]+R[-2]C[3]+R[-3]C[4]+R[-4]C[5]+R[-5]C[6]+R[-6]C[7]+R[-7]C[8]+R[-8]C[9]+R[-9]C[10]+R[-10]C[11]+R[-11]C[12]+R[-12]C[13]+R[-13]C[14]+R[-14]C[15]+R[-15]C[16]) -> 2642502 | F24: =IF(RC1="","",VLOOKUP(RC1,PaidDump,R8C+2,FALSE)) -> 21566 | G24: =IF(RC1="","",VLOOKUP(RC1,PaidDump,R8C+2,FALSE)) -> 44918 | H24: =IF(RC1="","",VLOOKUP(RC1,PaidDump,R8C+2,FALSE)) -> 5794 | I24: =IF(RC1="","",VLOOKUP(RC1,PaidDump,R8C+2,FALSE)) -> 3493 | J24: =IF(RC1="","",VLOOKUP(RC1,PaidDump,R8C+2,FALSE)) -> 4941 | K24: =IF(RC1="","",VLOOKUP(RC1,PaidDump,R8C+2,FALSE)) -> 13013 | L24: =IF(RC1="","",VLOOKUP(RC1,PaidDump,R8C+2,FALSE)) -> -7298 | M24: =IF(RC1="","",VLOOKUP(RC1,PaidDump,R8C+2,FALSE)) -> 949 | N24: =IF(RC1="","",VLOOKUP(RC1,PaidDump,R8C+2,FALSE)) -> 492 | O24: =IF(RC1="","",VLOOKUP(RC1,PaidDump,R8C+2,FALSE)) -> 213 | P24: =IF(RC1="","",VLOOKUP(RC1,PaidDump,R8C+2,FALSE)) -> 6942 | Q24: =IF(RC1="","",VLOOKUP(RC1,PaidDump,R8C+2,FALSE)) -> 227 | R24: =IF(RC1="","",VLOOKUP(RC1,PaidDump,R8C+2,FALSE)) -> 240 | S24: =IF(RC1="","",VLOOKUP(RC1,PaidDump,R8C+2,FALSE)) -> 56 | T24: =IF(RC1="","",VLOOKUP(RC1,PaidDump,R8C+2,FALSE)) -> 0 | U24: =IF(RC1="","",VLOOKUP(RC1,PaidDump,R8C+2,FALSE)) -> 0 | V24: =IF(RC1="","",VLOOKUP(RC1,PaidDump,R8C+2,FALSE)) -> 0 | W24: =IF(RC1="","",VLOOKUP(RC1,PaidDump,R8C+2,FALSE)) -> 0 | X24: =IF(RC1="","",VLOOKUP(RC1,PaidDump,R8C+2,FALSE)) -> 0 | Y24: =IF(RC1="","",VLOOKUP(RC1,PaidDump,R8C+2,FALSE)) -> 0 | Z24: =IF(RC1="","",VLOOKUP(RC1,PaidDump,R8C+2,FALSE)) -> 0 | AA24: =IF(RC1="","",VLOOKUP(RC1,PaidDump,R8C+2,FALSE)) -> 0 | AB24: =IF(RC1="","",VLOOKUP(RC1,PaidDump,R8C+2,FALSE)) -> 0 | AC24: =IF(RC1="","",VLOOKUP(RC1,PaidDump,R8C+2,FALSE)) -> 0 | AD24: =IF(RC1="","",VLOOKUP(RC1,PaidDump,R8C+2,FALSE)) -> 0 | AE24: =IF(RC1="","",VLOOKUP(RC1,PaidDump,R8C+2,FALSE)) -> 0 | AF24: =IF(RC1="","",VLOOKUP(RC1,PaidDump,R8C+2,FALSE)) -> 0 | AG24: =IF(RC1="","",VLOOKUP(RC1,PaidDump,R8C+2,FALSE)) -> 0 | AH24: =IF(RC1="","",VLOOKUP(RC1,PaidDump,R8C+2,FALSE)) -> 0 | AI24: =IF(RC1="","",VLOOKUP(RC1,PaidDump,R8C+2,FALSE)) -> 0 | AJ24: =IF(RC1="","",VLOOKUP(RC1,PaidDump,R8C+2,FALSE)) -> 0 | AK24: =IF(RC1="","",VLOOKUP(RC1,PaidDump,R8C+2,FALSE)) -> 0 | AL24: =IF(RC1="","",VLOOKUP(RC1,PaidDump,R8C+2,FALSE)) -> 0 | AM24: =IF(RC1="","",VLOOKUP(RC1,PaidDump,R8C+2,FALSE)) -> 0 | AN24: =IF(RC1="","",VLOOKUP(RC1,PaidDump,R8C+2,FALSE)) -> 0 | AO24: =IF(RC1="","",VLOOKUP(RC1,PaidDump,R8C+2,FALSE)) -> 0
A25: =IF(R[-1]C1="","",IF(DATE(YEAR(R[-1]C),MONTH(R[-1]C)+1,1)>ValDat,"",DATE(YEAR(R[-1]C),MONTH(R[-1]C)+1,1))) -> 1999-12-01T00:00:00.000 | B25: =IF(RC1="","",IF(VLOOKUP(RC1,TrendFacDump,2,FALSE)=0,0,VLOOKUP(EOMONTH(ValDat,-1)+1,TrendFacDump,2,FALSE)/VLOOKUP(RC1,TrendFacDump,2,FALSE))) -> 1.096611470555982 | C25: =IF(RC1="","",VLOOKUP(RC1,ExpDump,7,FALSE)) -> 3018.721 | D25: =IF(RC1="","",SUM(RC[2]:RC[37])) -> 219368 | E25: =IF(RC1="","",R[-1]C+RC[1]+R[-1]C[2]+R[-2]C[3]+R[-3]C[4]+R[-4]C[5]+R[-5]C[6]+R[-6]C[7]+R[-7]C[8]+R[-8]C[9]+R[-9]C[10]+R[-10]C[11]+R[-11]C[12]+R[-12]C[13]+R[-13]C[14]+R[-14]C[15]+R[-15]C[16]+R[-16]C[17]) -> 2723847 | F25: =IF(RC1="","",VLOOKUP(RC1,PaidDump,R8C+2,FALSE)) -> 9334 | G25: =IF(RC1="","",VLOOKUP(RC1,PaidDump,R8C+2,FALSE)) -> 90775 | H25: =IF(RC1="","",VLOOKUP(RC1,PaidDump,R8C+2,FALSE)) -> 92161 | I25: =IF(RC1="","",VLOOKUP(RC1,PaidDump,R8C+2,FALSE)) -> 12514 | J25: =IF(RC1="","",VLOOKUP(RC1,PaidDump,R8C+2,FALSE)) -> 4501 | K25: =IF(RC1="","",VLOOKUP(RC1,PaidDump,R8C+2,FALSE)) -> 3851 | L25: =IF(RC1="","",VLOOKUP(RC1,PaidDump,R8C+2,FALSE)) -> 655 | M25: =IF(RC1="","",VLOOKUP(RC1,PaidDump,R8C+2,FALSE)) -> 828 | N25: =IF(RC1="","",VLOOKUP(RC1,PaidDump,R8C+2,FALSE)) -> 203 | O25: =IF(RC1="","",VLOOKUP(RC1,PaidDump,R8C+2,FALSE)) -> 3333 | P25: =IF(RC1="","",VLOOKUP(RC1,PaidDump,R8C+2,FALSE)) -> 581 | Q25: =IF(RC1="","",VLOOKUP(RC1,PaidDump,R8C+2,FALSE)) -> 90 | R25: =IF(RC1="","",VLOOKUP(RC1,PaidDump,R8C+2,FALSE)) -> 167 | S25: =IF(RC1="","",VLOOKUP(RC1,PaidDump,R8C+2,FALSE)) -> 0 | T25: =IF(RC1="","",VLOOKUP(RC1,PaidDump,R8C+2,FALSE)) -> 0 | U25: =IF(RC1="","",VLOOKUP(RC1,PaidDump,R8C+2,FALSE)) -> 179 | V25: =IF(RC1="","",VLOOKUP(RC1,PaidDump,R8C+2,FALSE)) -> 196 | W25: =IF(RC1="","",VLOOKUP(RC1,PaidDump,R8C+2,FALSE)) -> 0 | X25: =IF(RC1="","",VLOOKUP(RC1,PaidDump,R8C+2,FALSE)) -> 0 | Y25: =IF(RC1="","",VLOOKUP(RC1,PaidDump,R8C+2,FALSE)) -> 0 | Z25: =IF(RC1="","",VLOOKUP(RC1,PaidDump,R8C+2,FALSE)) -> 0 | AA25: =IF(RC1="","",VLOOKUP(RC1,PaidDump,R8C+2,FALSE)) -> 0 | AB25: =IF(RC1="","",VLOOKUP(RC1,PaidDump,R8C+2,FALSE)) -> 0 | AC25: =IF(RC1="","",VLOOKUP(RC1,PaidDump,R8C+2,FALSE)) -> 0 | AD25: =IF(RC1="","",VLOOKUP(RC1,PaidDump,R8C+2,FALSE)) -> 0 | AE25: =IF(RC1="","",VLOOKUP(RC1,PaidDump,R8C+2,FALSE)) -> 0 | AF25: =IF(RC1="","",VLOOKUP(RC1,PaidDump,R8C+2,FALSE)) -> 0 | AG25: =IF(RC1="","",VLOOKUP(RC1,PaidDump,R8C+2,FALSE)) -> 0 | AH25: =IF(RC1="","",VLOOKUP(RC1,PaidDump,R8C+2,FALSE)) -> 0 | AI25: =IF(RC1="","",VLOOKUP(RC1,PaidDump,R8C+2,FALSE)) -> 0 | AJ25: =IF(RC1="","",VLOOKUP(RC1,PaidDump,R8C+2,FALSE)) -> 0 | AK25: =IF(RC1="","",VLOOKUP(RC1,PaidDump,R8C+2,FALSE)) -> 0 | AL25: =IF(RC1="","",VLOOKUP(RC1,PaidDump,R8C+2,FALSE)) -> 0 | AM25: =IF(RC1="","",VLOOKUP(RC1,PaidDump,R8C+2,FALSE)) -> 0 | AN25: =IF(RC1="","",VLOOKUP(RC1,PaidDump,R8C+2,FALSE)) -> 0 | AO25: =IF(RC1="","",VLOOKUP(RC1,PaidDump,R8C+2,FALSE)) -> 0
A26: =IF(R[-1]C1="","",IF(DATE(YEAR(R[-1]C),MONTH(R[-1]C)+1,1)>ValDat,"",DATE(YEAR(R[-1]C),MONTH(R[-1]C)+1,1))) -> 2000-01-01T00:00:00.000 | B26: =IF(RC1="","",IF(VLOOKUP(RC1,TrendFacDump,2,FALSE)=0,0,VLOOKUP(EOMONTH(ValDat,-1)+1,TrendFacDump,2,FALSE)/VLOOKUP(RC1,TrendFacDump,2,FALSE))) -> 1.0913456291607553 | C26: =IF(RC1="","",VLOOKUP(RC1,ExpDump,7,FALSE)) -> 3003.3229999999999 | D26: =IF(RC1="","",SUM(RC[2]:RC[37])) -> 219368 | E26: =IF(RC1="","",R[-1]C+RC[1]+R[-1]C[2]+R[-2]C[3]+R[-3]C[4]+R[-4]C[5]+R[-5]C[6]+R[-6]C[7]+R[-7]C[8]+R[-8]C[9]+R[-9]C[10]+R[-10]C[11]+R[-11]C[12]+R[-12]C[13]+R[-13]C[14]+R[-14]C[15]+R[-15]C[16]+R[-16]C[17]+R[-17]C[18]) -> 2890682 | F26: =IF(RC1="","",VLOOKUP(RC1,PaidDump,R8C+2,FALSE)) -> 51587 | G26: =IF(RC1="","",VLOOKUP(RC1,PaidDump,R8C+2,FALSE)) -> 137822 | H26: =IF(RC1="","",VLOOKUP(RC1,PaidDump,R8C+2,FALSE)) -> 7018 | I26: =IF(RC1="","",VLOOKUP(RC1,PaidDump,R8C+2,FALSE)) -> 12343 | J26: =IF(RC1="","",VLOOKUP(RC1,PaidDump,R8C+2,FALSE)) -> 1008 | K26: =IF(RC1="","",VLOOKUP(RC1,PaidDump,R8C+2,FALSE)) -> 3609 | L26: =IF(RC1="","",VLOOKUP(RC1,PaidDump,R8C+2,FALSE)) -> 703 | M26: =IF(RC1="","",VLOOKUP(RC1,PaidDump,R8C+2,FALSE)) -> 732 | N26: =IF(RC1="","",VLOOKUP(RC1,PaidDump,R8C+2,FALSE)) -> 127 | O26: =IF(RC1="","",VLOOKUP(RC1,PaidDump,R8C+2,FALSE)) -> 3206 | P26: =IF(RC1="","",VLOOKUP(RC1,PaidDump,R8C+2,FALSE)) -> 581 | Q26: =IF(RC1="","",VLOOKUP(RC1,PaidDump,R8C+2,FALSE)) -> 115 | R26: =IF(RC1="","",VLOOKUP(RC1,PaidDump,R8C+2,FALSE)) -> 142 | S26: =IF(RC1="","",VLOOKUP(RC1,PaidDump,R8C+2,FALSE)) -> 0 | T26: =IF(RC1="","",VLOOKUP(RC1,PaidDump,R8C+2,FALSE)) -> 0 | U26: =IF(RC1="","",VLOOKUP(RC1,PaidDump,R8C+2,FALSE)) -> 375 | V26: =IF(RC1="","",VLOOKUP(RC1,PaidDump,R8C+2,FALSE)) -> 0 | W26: =IF(RC1="","",VLOOKUP(RC1,PaidDump,R8C+2,FALSE)) -> 0 | X26: =IF(RC1="","",VLOOKUP(RC1,PaidDump,R8C+2,FALSE)) -> 0 | Y26: =IF(RC1="","",VLOOKUP(RC1,PaidDump,R8C+2,FALSE)) -> 0 | Z26: =IF(RC1="","",VLOOKUP(RC1,PaidDump,R8C+2,FALSE)) -> 0 | AA26: =IF(RC1="","",VLOOKUP(RC1,PaidDump,R8C+2,FALSE)) -> 0 | AB26: =IF(RC1="","",VLOOKUP(RC1,PaidDump,R8C+2,FALSE)) -> 0 | AC26: =IF(RC1="","",VLOOKUP(RC1,PaidDump,R8C+2,FALSE)) -> 0 | AD26: =IF(RC1="","",VLOOKUP(RC1,PaidDump,R8C+2,FALSE)) -> 0 | AE26: =IF(RC1="","",VLOOKUP(RC1,PaidDump,R8C+2,FALSE)) -> 0 | AF26: =IF(RC1="","",VLOOKUP(RC1,PaidDump,R8C+2,FALSE)) -> 0 | AG26: =IF(RC1="","",VLOOKUP(RC1,PaidDump,R8C+2,FALSE)) -> 0 | AH26: =IF(RC1="","",VLOOKUP(RC1,PaidDump,R8C+2,FALSE)) -> 0 | AI26: =IF(RC1="","",VLOOKUP(RC1,PaidDump,R8C+2,FALSE)) -> 0 | AJ26: =IF(RC1="","",VLOOKUP(RC1,PaidDump,R8C+2,FALSE)) -> 0 | AK26: =IF(RC1="","",VLOOKUP(RC1,PaidDump,R8C+2,FALSE)) -> 0 | AL26: =IF(RC1="","",VLOOKUP(RC1,PaidDump,R8C+2,FALSE)) -> 0 | AM26: =IF(RC1="","",VLOOKUP(RC1,PaidDump,R8C+2,FALSE)) -> 0 | AN26: =IF(RC1="","",VLOOKUP(RC1,PaidDump,R8C+2,FALSE)) -> 0 | AO26: =IF(RC1="","",VLOOKUP(RC1,PaidDump,R8C+2,FALSE)) -> 0
A27: =IF(R[-1]C1="","",IF(DATE(YEAR(R[-1]C),MONTH(R[-1]C)+1,1)>ValDat,"",DATE(YEAR(R[-1]C),MONTH(R[-1]C)+1,1))) -> 2000-02-01T00:00:00.000 | B27: =IF(RC1="","",IF(VLOOKUP(RC1,TrendFacDump,2,FALSE)=0,0,VLOOKUP(EOMONTH(ValDat,-1)+1,TrendFacDump,2,FALSE)/VLOOKUP(RC1,TrendFacDump,2,FALSE))) -> 1.0860121633362294 | C27: =IF(RC1="","",VLOOKUP(RC1,ExpDump,7,FALSE)) -> 3006.0590000000002 | D27: =IF(RC1="","",SUM(RC[2]:RC[37])) -> 318121 | E27: =IF(RC1="","",R[-1]C+RC[1]+R[-1]C[2]+R[-2]C[3]+R[-3]C[4]+R[-4]C[5]+R[-5]C[6]+R[-6]C[7]+R[-7]C[8]+R[-8]C[9]+R[-9]C[10]+R[-10]C[11]+R[-11]C[12]+R[-12]C[13]+R[-13]C[14]+R[-14]C[15]+R[-15]C[16]+R[-16]C[17]+R[-17]C[18]+R[-18]C[19]) -> 3179667 | F27: =IF(RC1="","",VLOOKUP(RC1,PaidDump,R8C+2,FALSE)) -> 8561 | G27: =IF(RC1="","",VLOOKUP(RC1,PaidDump,R8C+2,FALSE)) -> 60370 | H27: =IF(RC1="","",VLOOKUP(RC1,PaidDump,R8C+2,FALSE)) -> 167781 | I27: =IF(RC1="","",VLOOKUP(RC1,PaidDump,R8C+2,FALSE)) -> 11758 | J27: =IF(RC1="","",VLOOKUP(RC1,PaidDump,R8C+2,FALSE)) -> 26014 | K27: =IF(RC1="","",VLOOKUP(RC1,PaidDump,R8C+2,FALSE)) -> 2620 | L27: =IF(RC1="","",VLOOKUP(RC1,PaidDump,R8C+2,FALSE)) -> 22338 | M27: =IF(RC1="","",VLOOKUP(RC1,PaidDump,R8C+2,FALSE)) -> -1676 | N27: =IF(RC1="","",VLOOKUP(RC1,PaidDump,R8C+2,FALSE)) -> 677 | O27: =IF(RC1="","",VLOOKUP(RC1,PaidDump,R8C+2,FALSE)) -> 280 | P27: =IF(RC1="","",VLOOKUP(RC1,PaidDump,R8C+2,FALSE)) -> 799 | Q27: =IF(RC1="","",VLOOKUP(RC1,PaidDump,R8C+2,FALSE)) -> 6427 | R27: =IF(RC1="","",VLOOKUP(RC1,PaidDump,R8C+2,FALSE)) -> 11304 | S27: =IF(RC1="","",VLOOKUP(RC1,PaidDump,R8C+2,FALSE)) -> 519 | T27: =IF(RC1="","",VLOOKUP(RC1,PaidDump,R8C+2,FALSE)) -> 19 | U27: =IF(RC1="","",VLOOKUP(RC1,PaidDump,R8C+2,FALSE)) -> 0 | V27: =IF(RC1="","",VLOOKUP(RC1,PaidDump,R8C+2,FALSE)) -> 97 | W27: =IF(RC1="","",VLOOKUP(RC1,PaidDump,R8C+2,FALSE)) -> 9 | X27: =IF(RC1="","",VLOOKUP(RC1,PaidDump,R8C+2,FALSE)) -> 224 | Y27: =IF(RC1="","",VLOOKUP(RC1,PaidDump,R8C+2,FALSE)) -> 0 | Z27: =IF(RC1="","",VLOOKUP(RC1,PaidDump,R8C+2,FALSE)) -> 0 | AA27: =IF(RC1="","",VLOOKUP(RC1,PaidDump,R8C+2,FALSE)) -> 0 | AB27: =IF(RC1="","",VLOOKUP(RC1,PaidDump,R8C+2,FALSE)) -> 0 | AC27: =IF(RC1="","",VLOOKUP(RC1,PaidDump,R8C+2,FALSE)) -> 0 | AD27: =IF(RC1="","",VLOOKUP(RC1,PaidDump,R8C+2,FALSE)) -> 0 | AE27: =IF(RC1="","",VLOOKUP(RC1,PaidDump,R8C+2,FALSE)) -> 0 | AF27: =IF(RC1="","",VLOOKUP(RC1,PaidDump,R8C+2,FALSE)) -> 0 | AG27: =IF(RC1="","",VLOOKUP(RC1,PaidDump,R8C+2,FALSE)) -> 0 | AH27: =IF(RC1="","",VLOOKUP(RC1,PaidDump,R8C+2,FALSE)) -> 0 | AI27: =IF(RC1="","",VLOOKUP(RC1,PaidDump,R8C+2,FALSE)) -> 0 | AJ27: =IF(RC1="","",VLOOKUP(RC1,PaidDump,R8C+2,FALSE)) -> 0 | AK27: =IF(RC1="","",VLOOKUP(RC1,PaidDump,R8C+2,FALSE)) -> 0 | AL27: =IF(RC1="","",VLOOKUP(RC1,PaidDump,R8C+2,FALSE)) -> 0 | AM27: =IF(RC1="","",VLOOKUP(RC1,PaidDump,R8C+2,FALSE)) -> 0 | AN27: =IF(RC1="","",VLOOKUP(RC1,PaidDump,R8C+2,FALSE)) -> 0 | AO27: =IF(RC1="","",VLOOKUP(RC1,PaidDump,R8C+2,FALSE)) -> 0
A28: =IF(R[-1]C1="","",IF(DATE(YEAR(R[-1]C),MONTH(R[-1]C)+1,1)>ValDat,"",DATE(YEAR(R[-1]C),MONTH(R[-1]C)+1,1))) -> 2000-03-01T00:00:00.000 | B28: =IF(RC1="","",IF(VLOOKUP(RC1,TrendFacDump,2,FALSE)=0,0,VLOOKUP(EOMONTH(ValDat,-1)+1,TrendFacDump,2,FALSE)/VLOOKUP(RC1,TrendFacDump,2,FALSE))) -> 1.0808473843493298 | C28: =IF(RC1="","",VLOOKUP(RC1,ExpDump,7,FALSE)) -> 3001.39 | D28: =IF(RC1="","",SUM(RC[2]:RC[37])) -> 318121 | E28: =IF(RC1="","",R[-1]C+RC[1]+R[-1]C[2]+R[-2]C[3]+R[-3]C[4]+R[-4]C[5]+R[-5]C[6]+R[-6]C[7]+R[-7]C[8]+R[-8]C[9]+R[-9]C[10]+R[-10]C[11]+R[-11]C[12]+R[-12]C[13]+R[-13]C[14]+R[-14]C[15]+R[-15]C[16]+R[-16]C[17]+R[-17]C[18]+R[-18]C[19]+R[-19]C[20]) -> 3337481 | F28: =IF(RC1="","",VLOOKUP(RC1,PaidDump,R8C+2,FALSE)) -> 24902 | G28: =IF(RC1="","",VLOOKUP(RC1,PaidDump,R8C+2,FALSE)) -> 72373 | H28: =IF(RC1="","",VLOOKUP(RC1,PaidDump,R8C+2,FALSE)) -> 149464 | I28: =IF(RC1="","",VLOOKUP(RC1,PaidDump,R8C+2,FALSE)) -> 8997 | J28: =IF(RC1="","",VLOOKUP(RC1,PaidDump,R8C+2,FALSE)) -> 19057 | K28: =IF(RC1="","",VLOOKUP(RC1,PaidDump,R8C+2,FALSE)) -> 2477 | L28: =IF(RC1="","",VLOOKUP(RC1,PaidDump,R8C+2,FALSE)) -> 22318 | M28: =IF(RC1="","",VLOOKUP(RC1,PaidDump,R8C+2,FALSE)) -> -1662 | N28: =IF(RC1="","",VLOOKUP(RC1,PaidDump,R8C+2,FALSE)) -> 677 | O28: =IF(RC1="","",VLOOKUP(RC1,PaidDump,R8C+2,FALSE)) -> 779 | P28: =IF(RC1="","",VLOOKUP(RC1,PaidDump,R8C+2,FALSE)) -> 195 | Q28: =IF(RC1="","",VLOOKUP(RC1,PaidDump,R8C+2,FALSE)) -> 16998 | R28: =IF(RC1="","",VLOOKUP(RC1,PaidDump,R8C+2,FALSE)) -> 678 | S28: =IF(RC1="","",VLOOKUP(RC1,PaidDump,R8C+2,FALSE)) -> 538 | T28: =IF(RC1="","",VLOOKUP(RC1,PaidDump,R8C+2,FALSE)) -> 0 | U28: =IF(RC1="","",VLOOKUP(RC1,PaidDump,R8C+2,FALSE)) -> 84 | V28: =IF(RC1="","",VLOOKUP(RC1,PaidDump,R8C+2,FALSE)) -> 13 | W28: =IF(RC1="","",VLOOKUP(RC1,PaidDump,R8C+2,FALSE)) -> 233 | X28: =IF(RC1="","",VLOOKUP(RC1,PaidDump,R8C+2,FALSE)) -> 0 | Y28: =IF(RC1="","",VLOOKUP(RC1,PaidDump,R8C+2,FALSE)) -> 0 | Z28: =IF(RC1="","",VLOOKUP(RC1,PaidDump,R8C+2,FALSE)) -> 0 | AA28: =IF(RC1="","",VLOOKUP(RC1,PaidDump,R8C+2,FALSE)) -> 0 | AB28: =IF(RC1="","",VLOOKUP(RC1,PaidDump,R8C+2,FALSE)) -> 0 | AC28: =IF(RC1="","",VLOOKUP(RC1,PaidDump,R8C+2,FALSE)) -> 0 | AD28: =IF(RC1="","",VLOOKUP(RC1,PaidDump,R8C+2,FALSE)) -> 0 | AE28: =IF(RC1="","",VLOOKUP(RC1,PaidDump,R8C+2,FALSE)) -> 0 | AF28: =IF(RC1="","",VLOOKUP(RC1,PaidDump,R8C+2,FALSE)) -> 0 | AG28: =IF(RC1="","",VLOOKUP(RC1,PaidDump,R8C+2,FALSE)) -> 0 | AH28: =IF(RC1="","",VLOOKUP(RC1,PaidDump,R8C+2,FALSE)) -> 0 | AI28: =IF(RC1="","",VLOOKUP(RC1,PaidDump,R8C+2,FALSE)) -> 0 | AJ28: =IF(RC1="","",VLOOKUP(RC1,PaidDump,R8C+2,FALSE)) -> 0 | AK28: =IF(RC1="","",VLOOKUP(RC1,PaidDump,R8C+2,FALSE)) -> 0 | AL28: =IF(RC1="","",VLOOKUP(RC1,PaidDump,R8C+2,FALSE)) -> 0 | AM28: =IF(RC1="","",VLOOKUP(RC1,PaidDump,R8C+2,FALSE)) -> 0 | AN28: =IF(RC1="","",VLOOKUP(RC1,PaidDump,R8C+2,FALSE)) -> 0 | AO28: =IF(RC1="","",VLOOKUP(RC1,PaidDump,R8C+2,FALSE)) -> 0
A29: =IF(R[-1]C1="","",IF(DATE(YEAR(R[-1]C),MONTH(R[-1]C)+1,1)>ValDat,"",DATE(YEAR(R[-1]C),MONTH(R[-1]C)+1,1))) -> 2000-04-01T00:00:00.000 | B29: =IF(RC1="","",IF(VLOOKUP(RC1,TrendFacDump,2,FALSE)=0,0,VLOOKUP(EOMONTH(ValDat,-1)+1,TrendFacDump,2,FALSE)/VLOOKUP(RC1,TrendFacDump,2,FALSE))) -> 1.0755001075500108 | C29: =IF(RC1="","",VLOOKUP(RC1,ExpDump,7,FALSE)) -> 3027.8040000000001 | D29: =IF(RC1="","",SUM(RC[2]:RC[37])) -> 194291 | E29: =IF(RC1="","",R[-1]C+RC[1]+R[-1]C[2]+R[-2]C[3]+R[-3]C[4]+R[-4]C[5]+R[-5]C[6]+R[-6]C[7]+R[-7]C[8]+R[-8]C[9]+R[-9]C[10]+R[-10]C[11]+R[-11]C[12]+R[-12]C[13]+R[-13]C[14]+R[-14]C[15]+R[-15]C[16]+R[-16]C[17]+R[-17]C[18]+R[-18]C[19]+R[-19]C[20]+R[-20]C[21]) -> 3604033 | F29: =IF(RC1="","",VLOOKUP(RC1,PaidDump,R8C+2,FALSE)) -> 5744 | G29: =IF(RC1="","",VLOOKUP(RC1,PaidDump,R8C+2,FALSE)) -> 88812 | H29: =IF(RC1="","",VLOOKUP(RC1,PaidDump,R8C+2,FALSE)) -> 73915 | I29: =IF(RC1="","",VLOOKUP(RC1,PaidDump,R8C+2,FALSE)) -> 6913 | J29: =IF(RC1="","",VLOOKUP(RC1,PaidDump,R8C+2,FALSE)) -> 10480 | K29: =IF(RC1="","",VLOOKUP(RC1,PaidDump,R8C+2,FALSE)) -> -259 | L29: =IF(RC1="","",VLOOKUP(RC1,PaidDump,R8C+2,FALSE)) -> 5261 | M29: =IF(RC1="","",VLOOKUP(RC1,PaidDump,R8C+2,FALSE)) -> 430 | N29: =IF(RC1="","",VLOOKUP(RC1,PaidDump,R8C+2,FALSE)) -> 116 | O29: =IF(RC1="","",VLOOKUP(RC1,PaidDump,R8C+2,FALSE)) -> 1600 | P29: =IF(RC1="","",VLOOKUP(RC1,PaidDump,R8C+2,FALSE)) -> 112 | Q29: =IF(RC1="","",VLOOKUP(RC1,PaidDump,R8C+2,FALSE)) -> 166 | R29: =IF(RC1="","",VLOOKUP(RC1,PaidDump,R8C+2,FALSE)) -> 152 | S29: =IF(RC1="","",VLOOKUP(RC1,PaidDump,R8C+2,FALSE)) -> 0 | T29: =IF(RC1="","",VLOOKUP(RC1,PaidDump,R8C+2,FALSE)) -> 282 | U29: =IF(RC1="","",VLOOKUP(RC1,PaidDump,R8C+2,FALSE)) -> 75 | V29: =IF(RC1="","",VLOOKUP(RC1,PaidDump,R8C+2,FALSE)) -> 0 | W29: =IF(RC1="","",VLOOKUP(RC1,PaidDump,R8C+2,FALSE)) -> 0 | X29: =IF(RC1="","",VLOOKUP(RC1,PaidDump,R8C+2,FALSE)) -> 492 | Y29: =IF(RC1="","",VLOOKUP(RC1,PaidDump,R8C+2,FALSE)) -> 0 | Z29: =IF(RC1="","",VLOOKUP(RC1,PaidDump,R8C+2,FALSE)) -> 0 | AA29: =IF(RC1="","",VLOOKUP(RC1,PaidDump,R8C+2,FALSE)) -> 0 | AB29: =IF(RC1="","",VLOOKUP(RC1,PaidDump,R8C+2,FALSE)) -> 0 | AC29: =IF(RC1="","",VLOOKUP(RC1,PaidDump,R8C+2,FALSE)) -> 0 | AD29: =IF(RC1="","",VLOOKUP(RC1,PaidDump,R8C+2,FALSE)) -> 0 | AE29: =IF(RC1="","",VLOOKUP(RC1,PaidDump,R8C+2,FALSE)) -> 0 | AF29: =IF(RC1="","",VLOOKUP(RC1,PaidDump,R8C+2,FALSE)) -> 0 | AG29: =IF(RC1="","",VLOOKUP(RC1,PaidDump,R8C+2,FALSE)) -> 0 | AH29: =IF(RC1="","",VLOOKUP(RC1,PaidDump,R8C+2,FALSE)) -> 0 | AI29: =IF(RC1="","",VLOOKUP(RC1,PaidDump,R8C+2,FALSE)) -> 0 | AJ29: =IF(RC1="","",VLOOKUP(RC1,PaidDump,R8C+2,FALSE)) -> 0 | AK29: =IF(RC1="","",VLOOKUP(RC1,PaidDump,R8C+2,FALSE)) -> 0 | AL29: =IF(RC1="","",VLOOKUP(RC1,PaidDump,R8C+2,FALSE)) -> 0 | AM29: =IF(RC1="","",VLOOKUP(RC1,PaidDump,R8C+2,FALSE)) -> 0 | AN29: =IF(RC1="","",VLOOKUP(RC1,PaidDump,R8C+2,FALSE)) -> 0 | AO29: =IF(RC1="","",VLOOKUP(RC1,PaidDump,R8C+2,FALSE)) -> 0
A30: =IF(R[-1]C1="","",IF(DATE(YEAR(R[-1]C),MONTH(R[-1]C)+1,1)>ValDat,"",DATE(YEAR(R[-1]C),MONTH(R[-1]C)+1,1))) -> 2000-05-01T00:00:00.000 | B30: =IF(RC1="","",IF(VLOOKUP(RC1,TrendFacDump,2,FALSE)=0,0,VLOOKUP(EOMONTH(ValDat,-1)+1,TrendFacDump,2,FALSE)/VLOOKUP(RC1,TrendFacDump,2,FALSE))) -> 1.0703200256876806 | C30: =IF(RC1="","",VLOOKUP(RC1,ExpDump,7,FALSE)) -> 3053.259 | D30: =IF(RC1="","",SUM(RC[2]:RC[37])) -> 194291 | E30: =IF(RC1="","",R[-1]C+RC[1]+R[-1]C[2]+R[-2]C[3]+R[-3]C[4]+R[-4]C[5]+R[-5]C[6]+R[-6]C[7]+R[-7]C[8]+R[-8]C[9]+R[-9]C[10]+R[-10]C[11]+R[-11]C[12]+R[-12]C[13]+R[-13]C[14]+R[-14]C[15]+R[-15]C[16]+R[-16]C[17]+R[-17]C[18]+R[-18]C[19]+R[-19]C[20]+R[-20]C[21]+R[-21]C[22]) -> 3893254 | F30: =IF(RC1="","",VLOOKUP(RC1,PaidDump,R8C+2,FALSE)) -> 33042 | G30: =IF(RC1="","",VLOOKUP(RC1,PaidDump,R8C+2,FALSE)) -> 115076 | H30: =IF(RC1="","",VLOOKUP(RC1,PaidDump,R8C+2,FALSE)) -> 22022 | I30: =IF(RC1="","",VLOOKUP(RC1,PaidDump,R8C+2,FALSE)) -> 7991 | J30: =IF(RC1="","",VLOOKUP(RC1,PaidDump,R8C+2,FALSE)) -> 8209 | K30: =IF(RC1="","",VLOOKUP(RC1,PaidDump,R8C+2,FALSE)) -> -471 | L30: =IF(RC1="","",VLOOKUP(RC1,PaidDump,R8C+2,FALSE)) -> 4997 | M30: =IF(RC1="","",VLOOKUP(RC1,PaidDump,R8C+2,FALSE)) -> 430 | N30: =IF(RC1="","",VLOOKUP(RC1,PaidDump,R8C+2,FALSE)) -> 116 | O30: =IF(RC1="","",VLOOKUP(RC1,PaidDump,R8C+2,FALSE)) -> 1712 | P30: =IF(RC1="","",VLOOKUP(RC1,PaidDump,R8C+2,FALSE)) -> 166 | Q30: =IF(RC1="","",VLOOKUP(RC1,PaidDump,R8C+2,FALSE)) -> 0 | R30: =IF(RC1="","",VLOOKUP(RC1,PaidDump,R8C+2,FALSE)) -> 152 | S30: =IF(RC1="","",VLOOKUP(RC1,PaidDump,R8C+2,FALSE)) -> 0 | T30: =IF(RC1="","",VLOOKUP(RC1,PaidDump,R8C+2,FALSE)) -> 282 | U30: =IF(RC1="","",VLOOKUP(RC1,PaidDump,R8C+2,FALSE)) -> 75 | V30: =IF(RC1="","",VLOOKUP(RC1,PaidDump,R8C+2,FALSE)) -> 0 | W30: =IF(RC1="","",VLOOKUP(RC1,PaidDump,R8C+2,FALSE)) -> 492 | X30: =IF(RC1="","",VLOOKUP(RC1,PaidDump,R8C+2,FALSE)) -> 0 | Y30: =IF(RC1="","",VLOOKUP(RC1,PaidDump,R8C+2,FALSE)) -> 0 | Z30: =IF(RC1="","",VLOOKUP(RC1,PaidDump,R8C+2,FALSE)) -> 0 | AA30: =IF(RC1="","",VLOOKUP(RC1,PaidDump,R8C+2,FALSE)) -> 0 | AB30: =IF(RC1="","",VLOOKUP(RC1,PaidDump,R8C+2,FALSE)) -> 0 | AC30: =IF(RC1="","",VLOOKUP(RC1,PaidDump,R8C+2,FALSE)) -> 0 | AD30: =IF(RC1="","",VLOOKUP(RC1,PaidDump,R8C+2,FALSE)) -> 0 | AE30: =IF(RC1="","",VLOOKUP(RC1,PaidDump,R8C+2,FALSE)) -> 0 | AF30: =IF(RC1="","",VLOOKUP(RC1,PaidDump,R8C+2,FALSE)) -> 0 | AG30: =IF(RC1="","",VLOOKUP(RC1,PaidDump,R8C+2,FALSE)) -> 0 | AH30: =IF(RC1="","",VLOOKUP(RC1,PaidDump,R8C+2,FALSE)) -> 0 | AI30: =IF(RC1="","",VLOOKUP(RC1,PaidDump,R8C+2,FALSE)) -> 0 | AJ30: =IF(RC1="","",VLOOKUP(RC1,PaidDump,R8C+2,FALSE)) -> 0 | AK30: =IF(RC1="","",VLOOKUP(RC1,PaidDump,R8C+2,FALSE)) -> 0 | AL30: =IF(RC1="","",VLOOKUP(RC1,PaidDump,R8C+2,FALSE)) -> 0 | AM30: =IF(RC1="","",VLOOKUP(RC1,PaidDump,R8C+2,FALSE)) -> 0 | AN30: =IF(RC1="","",VLOOKUP(RC1,PaidDump,R8C+2,FALSE)) -> 0 | AO30: =IF(RC1="","",VLOOKUP(RC1,PaidDump,R8C+2,FALSE)) -> 0
A31: =IF(R[-1]C1="","",IF(DATE(YEAR(R[-1]C),MONTH(R[-1]C)+1,1)>ValDat,"",DATE(YEAR(R[-1]C),MONTH(R[-1]C)+1,1))) -> 2000-06-01T00:00:00.000 | B31: =IF(RC1="","",IF(VLOOKUP(RC1,TrendFacDump,2,FALSE)=0,0,VLOOKUP(EOMONTH(ValDat,-1)+1,TrendFacDump,2,FALSE)/VLOOKUP(RC1,TrendFacDump,2,FALSE))) -> 1.0651896037494675 | C31: =IF(RC1="","",VLOOKUP(RC1,ExpDump,7,FALSE)) -> 3019.4940000000001 | D31: =IF(RC1="","",SUM(RC[2]:RC[37])) -> 295608 | E31: =IF(RC1="","",R[-1]C+RC[1]+R[-1]C[2]+R[-2]C[3]+R[-3]C[4]+R[-4]C[5]+R[-5]C[6]+R[-6]C[7]+R[-7]C[8]+R[-8]C[9]+R[-9]C[10]+R[-10]C[11]+R[-11]C[12]+R[-12]C[13]+R[-13]C[14]+R[-14]C[15]+R[-15]C[16]+R[-16]C[17]+R[-17]C[18]+R[-18]C[19]+R[-19]C[20]+R[-20]C[21]+R[-21]C[22]+R[-22]C[23]) -> 4132304 | F31: =IF(RC1="","",VLOOKUP(RC1,PaidDump,R8C+2,FALSE)) -> 9146 | G31: =IF(RC1="","",VLOOKUP(RC1,PaidDump,R8C+2,FALSE)) -> 126060 | H31: =IF(RC1="","",VLOOKUP(RC1,PaidDump,R8C+2,FALSE)) -> 101785 | I31: =IF(RC1="","",VLOOKUP(RC1,PaidDump,R8C+2,FALSE)) -> 23437 | J31: =IF(RC1="","",VLOOKUP(RC1,PaidDump,R8C+2,FALSE)) -> 14176 | K31: =IF(RC1="","",VLOOKUP(RC1,PaidDump,R8C+2,FALSE)) -> 11759 | L31: =IF(RC1="","",VLOOKUP(RC1,PaidDump,R8C+2,FALSE)) -> 7297 | M31: =IF(RC1="","",VLOOKUP(RC1,PaidDump,R8C+2,FALSE)) -> 472 | N31: =IF(RC1="","",VLOOKUP(RC1,PaidDump,R8C+2,FALSE)) -> 32 | O31: =IF(RC1="","",VLOOKUP(RC1,PaidDump,R8C+2,FALSE)) -> 239 | P31: =IF(RC1="","",VLOOKUP(RC1,PaidDump,R8C+2,FALSE)) -> 124 | Q31: =IF(RC1="","",VLOOKUP(RC1,PaidDump,R8C+2,FALSE)) -> 0 | R31: =IF(RC1="","",VLOOKUP(RC1,PaidDump,R8C+2,FALSE)) -> 7 | S31: =IF(RC1="","",VLOOKUP(RC1,PaidDump,R8C+2,FALSE)) -> 460 | T31: =IF(RC1="","",VLOOKUP(RC1,PaidDump,R8C+2,FALSE)) -> 176 | U31: =IF(RC1="","",VLOOKUP(RC1,PaidDump,R8C+2,FALSE)) -> 128 | V31: =IF(RC1="","",VLOOKUP(RC1,PaidDump,R8C+2,FALSE)) -> 10 | W31: =IF(RC1="","",VLOOKUP(RC1,PaidDump,R8C+2,FALSE)) -> 0 | X31: =IF(RC1="","",VLOOKUP(RC1,PaidDump,R8C+2,FALSE)) -> 0 | Y31: =IF(RC1="","",VLOOKUP(RC1,PaidDump,R8C+2,FALSE)) -> 0 | Z31: =IF(RC1="","",VLOOKUP(RC1,PaidDump,R8C+2,FALSE)) -> 300 | AA31: =IF(RC1="","",VLOOKUP(RC1,PaidDump,R8C+2,FALSE)) -> 0 | AB31: =IF(RC1="","",VLOOKUP(RC1,PaidDump,R8C+2,FALSE)) -> 0 | AC31: =IF(RC1="","",VLOOKUP(RC1,PaidDump,R8C+2,FALSE)) -> 0 | AD31: =IF(RC1="","",VLOOKUP(RC1,PaidDump,R8C+2,FALSE)) -> 0 | AE31: =IF(RC1="","",VLOOKUP(RC1,PaidDump,R8C+2,FALSE)) -> 0 | AF31: =IF(RC1="","",VLOOKUP(RC1,PaidDump,R8C+2,FALSE)) -> 0 | AG31: =IF(RC1="","",VLOOKUP(RC1,PaidDump,R8C+2,FALSE)) -> 0 | AH31: =IF(RC1="","",VLOOKUP(RC1,PaidDump,R8C+2,FALSE)) -> 0 | AI31: =IF(RC1="","",VLOOKUP(RC1,PaidDump,R8C+2,FALSE)) -> 0 | AJ31: =IF(RC1="","",VLOOKUP(RC1,PaidDump,R8C+2,FALSE)) -> 0 | AK31: =IF(RC1="","",VLOOKUP(RC1,PaidDump,R8C+2,FALSE)) -> 0 | AL31: =IF(RC1="","",VLOOKUP(RC1,PaidDump,R8C+2,FALSE)) -> 0 | AM31: =IF(RC1="","",VLOOKUP(RC1,PaidDump,R8C+2,FALSE)) -> 0 | AN31: =IF(RC1="","",VLOOKUP(RC1,PaidDump,R8C+2,FALSE)) -> 0 | AO31: =IF(RC1="","",VLOOKUP(RC1,PaidDump,R8C+2,FALSE)) -> 0
A32: =IF(R[-1]C1="","",IF(DATE(YEAR(R[-1]C),MONTH(R[-1]C)+1,1)>ValDat,"",DATE(YEAR(R[-1]C),MONTH(R[-1]C)+1,1))) -> 2000-07-01T00:00:00.000 | B32: =IF(RC1="","",IF(VLOOKUP(RC1,TrendFacDump,2,FALSE)=0,0,VLOOKUP(EOMONTH(ValDat,-1)+1,TrendFacDump,2,FALSE)/VLOOKUP(RC1,TrendFacDump,2,FALSE))) -> 1.0599957600169598 | C32: =IF(RC1="","",VLOOKUP(RC1,ExpDump,7,FALSE)) -> 3006.0659999999998 | D32: =IF(RC1="","",SUM(RC[2]:RC[37])) -> 295608 | E32: =IF(RC1="","",R[-1]C+RC[1]+R[-1]C[2]+R[-2]C[3]+R[-3]C[4]+R[-4]C[5]+R[-5]C[6]+R[-6]C[7]+R[-7]C[8]+R[-8]C[9]+R[-9]C[10]+R[-10]C[11]+R[-11]C[12]+R[-12]C[13]+R[-13]C[14]+R[-14]C[15]+R[-15]C[16]+R[-16]C[17]+R[-17]C[18]+R[-18]C[19]+R[-19]C[20]+R[-20]C[21]+R[-21]C[22]+R[-22]C[23]+R[-23]C[24]) -> 4408543 | F32: =IF(RC1="","",VLOOKUP(RC1,PaidDump,R8C+2,FALSE)) -> 95821 | G32: =IF(RC1="","",VLOOKUP(RC1,PaidDump,R8C+2,FALSE)) -> 139851 | H32: =IF(RC1="","",VLOOKUP(RC1,PaidDump,R8C+2,FALSE)) -> 32541 | I32: =IF(RC1="","",VLOOKUP(RC1,PaidDump,R8C+2,FALSE)) -> 7864 | J32: =IF(RC1="","",VLOOKUP(RC1,PaidDump,R8C+2,FALSE)) -> 8316 | K32: =IF(RC1="","",VLOOKUP(RC1,PaidDump,R8C+2,FALSE)) -> 2179 | L32: =IF(RC1="","",VLOOKUP(RC1,PaidDump,R8C+2,FALSE)) -> 7260 | M32: =IF(RC1="","",VLOOKUP(RC1,PaidDump,R8C+2,FALSE)) -> 300 | N32: =IF(RC1="","",VLOOKUP(RC1,PaidDump,R8C+2,FALSE)) -> 32 | O32: =IF(RC1="","",VLOOKUP(RC1,PaidDump,R8C+2,FALSE)) -> 239 | P32: =IF(RC1="","",VLOOKUP(RC1,PaidDump,R8C+2,FALSE)) -> 124 | Q32: =IF(RC1="","",VLOOKUP(RC1,PaidDump,R8C+2,FALSE)) -> 211 | R32: =IF(RC1="","",VLOOKUP(RC1,PaidDump,R8C+2,FALSE)) -> -204 | S32: =IF(RC1="","",VLOOKUP(RC1,PaidDump,R8C+2,FALSE)) -> 460 | T32: =IF(RC1="","",VLOOKUP(RC1,PaidDump,R8C+2,FALSE)) -> 176 | U32: =IF(RC1="","",VLOOKUP(RC1,PaidDump,R8C+2,FALSE)) -> 128 | V32: =IF(RC1="","",VLOOKUP(RC1,PaidDump,R8C+2,FALSE)) -> 10 | W32: =IF(RC1="","",VLOOKUP(RC1,PaidDump,R8C+2,FALSE)) -> 0 | X32: =IF(RC1="","",VLOOKUP(RC1,PaidDump,R8C+2,FALSE)) -> 0 | Y32: =IF(RC1="","",VLOOKUP(RC1,PaidDump,R8C+2,FALSE)) -> 0 | Z32: =IF(RC1="","",VLOOKUP(RC1,PaidDump,R8C+2,FALSE)) -> 300 | AA32: =IF(RC1="","",VLOOKUP(RC1,PaidDump,R8C+2,FALSE)) -> 0 | AB32: =IF(RC1="","",VLOOKUP(RC1,PaidDump,R8C+2,FALSE)) -> 0 | AC32: =IF(RC1="","",VLOOKUP(RC1,PaidDump,R8C+2,FALSE)) -> 0 | AD32: =IF(RC1="","",VLOOKUP(RC1,PaidDump,R8C+2,FALSE)) -> 0 | AE32: =IF(RC1="","",VLOOKUP(RC1,PaidDump,R8C+2,FALSE)) -> 0 | AF32: =IF(RC1="","",VLOOKUP(RC1,PaidDump,R8C+2,FALSE)) -> 0 | AG32: =IF(RC1="","",VLOOKUP(RC1,PaidDump,R8C+2,FALSE)) -> 0 | AH32: =IF(RC1="","",VLOOKUP(RC1,PaidDump,R8C+2,FALSE)) -> 0 | AI32: =IF(RC1="","",VLOOKUP(RC1,PaidDump,R8C+2,FALSE)) -> 0 | AJ32: =IF(RC1="","",VLOOKUP(RC1,PaidDump,R8C+2,FALSE)) -> 0 | AK32: =IF(RC1="","",VLOOKUP(RC1,PaidDump,R8C+2,FALSE)) -> 0 | AL32: =IF(RC1="","",VLOOKUP(RC1,PaidDump,R8C+2,FALSE)) -> 0 | AM32: =IF(RC1="","",VLOOKUP(RC1,PaidDump,R8C+2,FALSE)) -> 0 | AN32: =IF(RC1="","",VLOOKUP(RC1,PaidDump,R8C+2,FALSE)) -> 0 | AO32: =IF(RC1="","",VLOOKUP(RC1,PaidDump,R8C+2,FALSE)) -> 0
A33: =IF(R[-1]C1="","",IF(DATE(YEAR(R[-1]C),MONTH(R[-1]C)+1,1)>ValDat,"",DATE(YEAR(R[-1]C),MONTH(R[-1]C)+1,1))) -> 2000-08-01T00:00:00.000 | B33: =IF(RC1="","",IF(VLOOKUP(RC1,TrendFacDump,2,FALSE)=0,0,VLOOKUP(EOMONTH(ValDat,-1)+1,TrendFacDump,2,FALSE)/VLOOKUP(RC1,TrendFacDump,2,FALSE))) -> 1.0548523206751055 | C33: =IF(RC1="","",VLOOKUP(RC1,ExpDump,7,FALSE)) -> 2987.3629999999998 | D33: =IF(RC1="","",SUM(RC[2]:RC[37])) -> 230602 | E33: =IF(RC1="","",R[-1]C+RC[1]+R[-1]C[2]+R[-2]C[3]+R[-3]C[4]+R[-4]C[5]+R[-5]C[6]+R[-6]C[7]+R[-7]C[8]+R[-8]C[9]+R[-9]C[10]+R[-10]C[11]+R[-11]C[12]+R[-12]C[13]+R[-13]C[14]+R[-14]C[15]+R[-15]C[16]+R[-16]C[17]+R[-17]C[18]+R[-18]C[19]+R[-19]C[20]+R[-20]C[21]+R[-21]C[22]+R[-22]C[23]+R[-23]C[24]+R[-24]C[25]) -> 4712445 | F33: =IF(RC1="","",VLOOKUP(RC1,PaidDump,R8C+2,FALSE)) -> 9415 | G33: =IF(RC1="","",VLOOKUP(RC1,PaidDump,R8C+2,FALSE)) -> 48503 | H33: =IF(RC1="","",VLOOKUP(RC1,PaidDump,R8C+2,FALSE)) -> 127444 | I33: =IF(RC1="","",VLOOKUP(RC1,PaidDump,R8C+2,FALSE)) -> 9062 | J33: =IF(RC1="","",VLOOKUP(RC1,PaidDump,R8C+2,FALSE)) -> 2904 | K33: =IF(RC1="","",VLOOKUP(RC1,PaidDump,R8C+2,FALSE)) -> 14411 | L33: =IF(RC1="","",VLOOKUP(RC1,PaidDump,R8C+2,FALSE)) -> 14223 | M33: =IF(RC1="","",VLOOKUP(RC1,PaidDump,R8C+2,FALSE)) -> -3390 | N33: =IF(RC1="","",VLOOKUP(RC1,PaidDump,R8C+2,FALSE)) -> 662 | O33: =IF(RC1="","",VLOOKUP(RC1,PaidDump,R8C+2,FALSE)) -> 6212 | P33: =IF(RC1="","",VLOOKUP(RC1,PaidDump,R8C+2,FALSE)) -> 33 | Q33: =IF(RC1="","",VLOOKUP(RC1,PaidDump,R8C+2,FALSE)) -> 0 | R33: =IF(RC1="","",VLOOKUP(RC1,PaidDump,R8C+2,FALSE)) -> 0 | S33: =IF(RC1="","",VLOOKUP(RC1,PaidDump,R8C+2,FALSE)) -> 90 | T33: =IF(RC1="","",VLOOKUP(RC1,PaidDump,R8C+2,FALSE)) -> 0 | U33: =IF(RC1="","",VLOOKUP(RC1,PaidDump,R8C+2,FALSE)) -> 0 | V33: =IF(RC1="","",VLOOKUP(RC1,PaidDump,R8C+2,FALSE)) -> 230 | W33: =IF(RC1="","",VLOOKUP(RC1,PaidDump,R8C+2,FALSE)) -> 0 | X33: =IF(RC1="","",VLOOKUP(RC1,PaidDump,R8C+2,FALSE)) -> 0 | Y33: =IF(RC1="","",VLOOKUP(RC1,PaidDump,R8C+2,FALSE)) -> 0 | Z33: =IF(RC1="","",VLOOKUP(RC1,PaidDump,R8C+2,FALSE)) -> 803 | AA33: =IF(RC1="","",VLOOKUP(RC1,PaidDump,R8C+2,FALSE)) -> 0 | AB33: =IF(RC1="","",VLOOKUP(RC1,PaidDump,R8C+2,FALSE)) -> 0 | AC33: =IF(RC1="","",VLOOKUP(RC1,PaidDump,R8C+2,FALSE)) -> 0 | AD33: =IF(RC1="","",VLOOKUP(RC1,PaidDump,R8C+2,FALSE)) -> 0 | AE33: =IF(RC1="","",VLOOKUP(RC1,PaidDump,R8C+2,FALSE)) -> 0 | AF33: =IF(RC1="","",VLOOKUP(RC1,PaidDump,R8C+2,FALSE)) -> 0 | AG33: =IF(RC1="","",VLOOKUP(RC1,PaidDump,R8C+2,FALSE)) -> 0 | AH33: =IF(RC1="","",VLOOKUP(RC1,PaidDump,R8C+2,FALSE)) -> 0 | AI33: =IF(RC1="","",VLOOKUP(RC1,PaidDump,R8C+2,FALSE)) -> 0 | AJ33: =IF(RC1="","",VLOOKUP(RC1,PaidDump,R8C+2,FALSE)) -> 0 | AK33: =IF(RC1="","",VLOOKUP(RC1,PaidDump,R8C+2,FALSE)) -> 0 | AL33: =IF(RC1="","",VLOOKUP(RC1,PaidDump,R8C+2,FALSE)) -> 0 | AM33: =IF(RC1="","",VLOOKUP(RC1,PaidDump,R8C+2,FALSE)) -> 0 | AN33: =IF(RC1="","",VLOOKUP(RC1,PaidDump,R8C+2,FALSE)) -> 0 | AO33: =IF(RC1="","",VLOOKUP(RC1,PaidDump,R8C+2,FALSE)) -> 0
A34: =IF(R[-1]C1="","",IF(DATE(YEAR(R[-1]C),MONTH(R[-1]C)+1,1)>ValDat,"",DATE(YEAR(R[-1]C),MONTH(R[-1]C)+1,1))) -> 2000-09-01T00:00:00.000 | B34: =IF(RC1="","",IF(VLOOKUP(RC1,TrendFacDump,2,FALSE)=0,0,VLOOKUP(EOMONTH(ValDat,-1)+1,TrendFacDump,2,FALSE)/VLOOKUP(RC1,TrendFacDump,2,FALSE))) -> 1.0497585555322275 | C34: =IF(RC1="","",VLOOKUP(RC1,ExpDump,7,FALSE)) -> 2953.335 | D34: =IF(RC1="","",SUM(RC[2]:RC[37])) -> 230602 | E34: =IF(RC1="","",R[-1]C+RC[1]+R[-1]C[2]+R[-2]C[3]+R[-3]C[4]+R[-4]C[5]+R[-5]C[6]+R[-6]C[7]+R[-7]C[8]+R[-8]C[9]+R[-9]C[10]+R[-10]C[11]+R[-11]C[12]+R[-12]C[13]+R[-13]C[14]+R[-14]C[15]+R[-15]C[16]+R[-16]C[17]+R[-17]C[18]+R[-18]C[19]+R[-19]C[20]+R[-20]C[21]+R[-21]C[22]+R[-22]C[23]+R[-23]C[24]+R[-24]C[25]+R[-25]C[26]) -> 4887620 | F34: =IF(RC1="","",VLOOKUP(RC1,PaidDump,R8C+2,FALSE)) -> 31473 | G34: =IF(RC1="","",VLOOKUP(RC1,PaidDump,R8C+2,FALSE)) -> 178666 | H34: =IF(RC1="","",VLOOKUP(RC1,PaidDump,R8C+2,FALSE)) -> 9928 | I34: =IF(RC1="","",VLOOKUP(RC1,PaidDump,R8C+2,FALSE)) -> -5630 | J34: =IF(RC1="","",VLOOKUP(RC1,PaidDump,R8C+2,FALSE)) -> 1840 | K34: =IF(RC1="","",VLOOKUP(RC1,PaidDump,R8C+2,FALSE)) -> 934 | L34: =IF(RC1="","",VLOOKUP(RC1,PaidDump,R8C+2,FALSE)) -> 13701 | M34: =IF(RC1="","",VLOOKUP(RC1,PaidDump,R8C+2,FALSE)) -> -3004 | N34: =IF(RC1="","",VLOOKUP(RC1,PaidDump,R8C+2,FALSE)) -> 306 | O34: =IF(RC1="","",VLOOKUP(RC1,PaidDump,R8C+2,FALSE)) -> 1265 | P34: =IF(RC1="","",VLOOKUP(RC1,PaidDump,R8C+2,FALSE)) -> 0 | Q34: =IF(RC1="","",VLOOKUP(RC1,PaidDump,R8C+2,FALSE)) -> 0 | R34: =IF(RC1="","",VLOOKUP(RC1,PaidDump,R8C+2,FALSE)) -> 0 | S34: =IF(RC1="","",VLOOKUP(RC1,PaidDump,R8C+2,FALSE)) -> 90 | T34: =IF(RC1="","",VLOOKUP(RC1,PaidDump,R8C+2,FALSE)) -> 0 | U34: =IF(RC1="","",VLOOKUP(RC1,PaidDump,R8C+2,FALSE)) -> 0 | V34: =IF(RC1="","",VLOOKUP(RC1,PaidDump,R8C+2,FALSE)) -> 230 | W34: =IF(RC1="","",VLOOKUP(RC1,PaidDump,R8C+2,FALSE)) -> 0 | X34: =IF(RC1="","",VLOOKUP(RC1,PaidDump,R8C+2,FALSE)) -> 0 | Y34: =IF(RC1="","",VLOOKUP(RC1,PaidDump,R8C+2,FALSE)) -> 0 | Z34: =IF(RC1="","",VLOOKUP(RC1,PaidDump,R8C+2,FALSE)) -> 803 | AA34: =IF(RC1="","",VLOOKUP(RC1,PaidDump,R8C+2,FALSE)) -> 0 | AB34: =IF(RC1="","",VLOOKUP(RC1,PaidDump,R8C+2,FALSE)) -> 0 | AC34: =IF(RC1="","",VLOOKUP(RC1,PaidDump,R8C+2,FALSE)) -> 0 | AD34: =IF(RC1="","",VLOOKUP(RC1,PaidDump,R8C+2,FALSE)) -> 0 | AE34: =IF(RC1="","",VLOOKUP(RC1,PaidDump,R8C+2,FALSE)) -> 0 | AF34: =IF(RC1="","",VLOOKUP(RC1,PaidDump,R8C+2,FALSE)) -> 0 | AG34: =IF(RC1="","",VLOOKUP(RC1,PaidDump,R8C+2,FALSE)) -> 0 | AH34: =IF(RC1="","",VLOOKUP(RC1,PaidDump,R8C+2,FALSE)) -> 0 | AI34: =IF(RC1="","",VLOOKUP(RC1,PaidDump,R8C+2,FALSE)) -> 0 | AJ34: =IF(RC1="","",VLOOKUP(RC1,PaidDump,R8C+2,FALSE)) -> 0 | AK34: =IF(RC1="","",VLOOKUP(RC1,PaidDump,R8C+2,FALSE)) -> 0 | AL34: =IF(RC1="","",VLOOKUP(RC1,PaidDump,R8C+2,FALSE)) -> 0 | AM34: =IF(RC1="","",VLOOKUP(RC1,PaidDump,R8C+2,FALSE)) -> 0 | AN34: =IF(RC1="","",VLOOKUP(RC1,PaidDump,R8C+2,FALSE)) -> 0 | AO34: =IF(RC1="","",VLOOKUP(RC1,PaidDump,R8C+2,FALSE)) -> 0
A35: =IF(R[-1]C1="","",IF(DATE(YEAR(R[-1]C),MONTH(R[-1]C)+1,1)>ValDat,"",DATE(YEAR(R[-1]C),MONTH(R[-1]C)+1,1))) -> 2000-10-01T00:00:00.000 | B35: =IF(RC1="","",IF(VLOOKUP(RC1,TrendFacDump,2,FALSE)=0,0,VLOOKUP(EOMONTH(ValDat,-1)+1,TrendFacDump,2,FALSE)/VLOOKUP(RC1,TrendFacDump,2,FALSE))) -> 1.0447137484329294 | C35: =IF(RC1="","",VLOOKUP(RC1,ExpDump,7,FALSE)) -> 2927.2660000000001 | D35: =IF(RC1="","",SUM(RC[2]:RC[37])) -> 186976 | E35: =IF(RC1="","",R[-1]C+RC[1]+R[-1]C[2]+R[-2]C[3]+R[-3]C[4]+R[-4]C[5]+R[-5]C[6]+R[-6]C[7]+R[-7]C[8]+R[-8]C[9]+R[-9]C[10]+R[-10]C[11]+R[-11]C[12]+R[-12]C[13]+R[-13]C[14]+R[-14]C[15]+R[-15]C[16]+R[-16]C[17]+R[-17]C[18]+R[-18]C[19]+R[-19]C[20]+R[-20]C[21]+R[-21]C[22]+R[-22]C[23]+R[-23]C[24]+R[-24]C[25]+R[-25]C[26]+R[-26]C[27]) -> 5228248 | F35: =IF(RC1="","",VLOOKUP(RC1,PaidDump,R8C+2,FALSE)) -> 4419 | G35: =IF(RC1="","",VLOOKUP(RC1,PaidDump,R8C+2,FALSE)) -> 34068 | H35: =IF(RC1="","",VLOOKUP(RC1,PaidDump,R8C+2,FALSE)) -> 91527 | I35: =IF(RC1="","",VLOOKUP(RC1,PaidDump,R8C+2,FALSE)) -> 34631 | J35: =IF(RC1="","",VLOOKUP(RC1,PaidDump,R8C+2,FALSE)) -> 9161 | K35: =IF(RC1="","",VLOOKUP(RC1,PaidDump,R8C+2,FALSE)) -> 5596 | L35: =IF(RC1="","",VLOOKUP(RC1,PaidDump,R8C+2,FALSE)) -> 4375 | M35: =IF(RC1="","",VLOOKUP(RC1,PaidDump,R8C+2,FALSE)) -> 412 | N35: =IF(RC1="","",VLOOKUP(RC1,PaidDump,R8C+2,FALSE)) -> 1128 | O35: =IF(RC1="","",VLOOKUP(RC1,PaidDump,R8C+2,FALSE)) -> 1357 | P35: =IF(RC1="","",VLOOKUP(RC1,PaidDump,R8C+2,FALSE)) -> 291 | Q35: =IF(RC1="","",VLOOKUP(RC1,PaidDump,R8C+2,FALSE)) -> 11 | R35: =IF(RC1="","",VLOOKUP(RC1,PaidDump,R8C+2,FALSE)) -> 0 | S35: =IF(RC1="","",VLOOKUP(RC1,PaidDump,R8C+2,FALSE)) -> 0 | T35: =IF(RC1="","",VLOOKUP(RC1,PaidDump,R8C+2,FALSE)) -> 0 | U35: =IF(RC1="","",VLOOKUP(RC1,PaidDump,R8C+2,FALSE)) -> 0 | V35: =IF(RC1="","",VLOOKUP(RC1,PaidDump,R8C+2,FALSE)) -> 0 | W35: =IF(RC1="","",VLOOKUP(RC1,PaidDump,R8C+2,FALSE)) -> 0 | X35: =IF(RC1="","",VLOOKUP(RC1,PaidDump,R8C+2,FALSE)) -> 0 | Y35: =IF(RC1="","",VLOOKUP(RC1,PaidDump,R8C+2,FALSE)) -> 0 | Z35: =IF(RC1="","",VLOOKUP(RC1,PaidDump,R8C+2,FALSE)) -> 0 | AA35: =IF(RC1="","",VLOOKUP(RC1,PaidDump,R8C+2,FALSE)) -> 0 | AB35: =IF(RC1="","",VLOOKUP(RC1,PaidDump,R8C+2,FALSE)) -> 0 | AC35: =IF(RC1="","",VLOOKUP(RC1,PaidDump,R8C+2,FALSE)) -> 0 | AD35: =IF(RC1="","",VLOOKUP(RC1,PaidDump,R8C+2,FALSE)) -> 0 | AE35: =IF(RC1="","",VLOOKUP(RC1,PaidDump,R8C+2,FALSE)) -> 0 | AF35: =IF(RC1="","",VLOOKUP(RC1,PaidDump,R8C+2,FALSE)) -> 0 | AG35: =IF(RC1="","",VLOOKUP(RC1,PaidDump,R8C+2,FALSE)) -> 0 | AH35: =IF(RC1="","",VLOOKUP(RC1,PaidDump,R8C+2,FALSE)) -> 0 | AI35: =IF(RC1="","",VLOOKUP(RC1,PaidDump,R8C+2,FALSE)) -> 0 | AJ35: =IF(RC1="","",VLOOKUP(RC1,PaidDump,R8C+2,FALSE)) -> 0 | AK35: =IF(RC1="","",VLOOKUP(RC1,PaidDump,R8C+2,FALSE)) -> 0 | AL35: =IF(RC1="","",VLOOKUP(RC1,PaidDump,R8C+2,FALSE)) -> 0 | AM35: =IF(RC1="","",VLOOKUP(RC1,PaidDump,R8C+2,FALSE)) -> 0 | AN35: =IF(RC1="","",VLOOKUP(RC1,PaidDump,R8C+2,FALSE)) -> 0 | AO35: =IF(RC1="","",VLOOKUP(RC1,PaidDump,R8C+2,FALSE)) -> 0
A36: =IF(R[-1]C1="","",IF(DATE(YEAR(R[-1]C),MONTH(R[-1]C)+1,1)>ValDat,"",DATE(YEAR(R[-1]C),MONTH(R[-1]C)+1,1))) -> 2000-11-01T00:00:00.000 | B36: =IF(RC1="","",IF(VLOOKUP(RC1,TrendFacDump,2,FALSE)=0,0,VLOOKUP(EOMONTH(ValDat,-1)+1,TrendFacDump,2,FALSE)/VLOOKUP(RC1,TrendFacDump,2,FALSE))) -> 1.0396091069757771 | C36: =IF(RC1="","",VLOOKUP(RC1,ExpDump,7,FALSE)) -> 2897.2249999999999 | D36: =IF(RC1="","",SUM(RC[2]:RC[37])) -> 186976 | E36: =IF(RC1="","",R[-1]C+RC[1]+R[-1]C[2]+R[-2]C[3]+R[-3]C[4]+R[-4]C[5]+R[-5]C[6]+R[-6]C[7]+R[-7]C[8]+R[-8]C[9]+R[-9]C[10]+R[-10]C[11]+R[-11]C[12]+R[-12]C[13]+R[-13]C[14]+R[-14]C[15]+R[-15]C[16]+R[-16]C[17]+R[-17]C[18]+R[-18]C[19]+R[-19]C[20]+R[-20]C[21]+R[-21]C[22]+R[-22]C[23]+R[-23]C[24]+R[-24]C[25]+R[-25]C[26]+R[-26]C[27]+R[-27]C[28]) -> 5340093 | F36: =IF(RC1="","",VLOOKUP(RC1,PaidDump,R8C+2,FALSE)) -> 31361 | G36: =IF(RC1="","",VLOOKUP(RC1,PaidDump,R8C+2,FALSE)) -> 76026 | H36: =IF(RC1="","",VLOOKUP(RC1,PaidDump,R8C+2,FALSE)) -> 56350 | I36: =IF(RC1="","",VLOOKUP(RC1,PaidDump,R8C+2,FALSE)) -> 6484 | J36: =IF(RC1="","",VLOOKUP(RC1,PaidDump,R8C+2,FALSE)) -> 7803 | K36: =IF(RC1="","",VLOOKUP(RC1,PaidDump,R8C+2,FALSE)) -> 5412 | L36: =IF(RC1="","",VLOOKUP(RC1,PaidDump,R8C+2,FALSE)) -> 341 | M36: =IF(RC1="","",VLOOKUP(RC1,PaidDump,R8C+2,FALSE)) -> 1097 | N36: =IF(RC1="","",VLOOKUP(RC1,PaidDump,R8C+2,FALSE)) -> 517 | O36: =IF(RC1="","",VLOOKUP(RC1,PaidDump,R8C+2,FALSE)) -> 1343 | P36: =IF(RC1="","",VLOOKUP(RC1,PaidDump,R8C+2,FALSE)) -> 231 | Q36: =IF(RC1="","",VLOOKUP(RC1,PaidDump,R8C+2,FALSE)) -> 11 | R36: =IF(RC1="","",VLOOKUP(RC1,PaidDump,R8C+2,FALSE)) -> 0 | S36: =IF(RC1="","",VLOOKUP(RC1,PaidDump,R8C+2,FALSE)) -> 0 | T36: =IF(RC1="","",VLOOKUP(RC1,PaidDump,R8C+2,FALSE)) -> 0 | U36: =IF(RC1="","",VLOOKUP(RC1,PaidDump,R8C+2,FALSE)) -> 0 | V36: =IF(RC1="","",VLOOKUP(RC1,PaidDump,R8C+2,FALSE)) -> 0 | W36: =IF(RC1="","",VLOOKUP(RC1,PaidDump,R8C+2,FALSE)) -> 0 | X36: =IF(RC1="","",VLOOKUP(RC1,PaidDump,R8C+2,FALSE)) -> 0 | Y36: =IF(RC1="","",VLOOKUP(RC1,PaidDump,R8C+2,FALSE)) -> 0 | Z36: =IF(RC1="","",VLOOKUP(RC1,PaidDump,R8C+2,FALSE)) -> 0 | AA36: =IF(RC1="","",VLOOKUP(RC1,PaidDump,R8C+2,FALSE)) -> 0 | AB36: =IF(RC1="","",VLOOKUP(RC1,PaidDump,R8C+2,FALSE)) -> 0 | AC36: =IF(RC1="","",VLOOKUP(RC1,PaidDump,R8C+2,FALSE)) -> 0 | AD36: =IF(RC1="","",VLOOKUP(RC1,PaidDump,R8C+2,FALSE)) -> 0 | AE36: =IF(RC1="","",VLOOKUP(RC1,PaidDump,R8C+2,FALSE)) -> 0 | AF36: =IF(RC1="","",VLOOKUP(RC1,PaidDump,R8C+2,FALSE)) -> 0 | AG36: =IF(RC1="","",VLOOKUP(RC1,PaidDump,R8C+2,FALSE)) -> 0 | AH36: =IF(RC1="","",VLOOKUP(RC1,PaidDump,R8C+2,FALSE)) -> 0 | AI36: =IF(RC1="","",VLOOKUP(RC1,PaidDump,R8C+2,FALSE)) -> 0 | AJ36: =IF(RC1="","",VLOOKUP(RC1,PaidDump,R8C+2,FALSE)) -> 0 | AK36: =IF(RC1="","",VLOOKUP(RC1,PaidDump,R8C+2,FALSE)) -> 0 | AL36: =IF(RC1="","",VLOOKUP(RC1,PaidDump,R8C+2,FALSE)) -> 0 | AM36: =IF(RC1="","",VLOOKUP(RC1,PaidDump,R8C+2,FALSE)) -> 0 | AN36: =IF(RC1="","",VLOOKUP(RC1,PaidDump,R8C+2,FALSE)) -> 0 | AO36: =IF(RC1="","",VLOOKUP(RC1,PaidDump,R8C+2,FALSE)) -> 0
A37: =IF(R[-1]C1="","",IF(DATE(YEAR(R[-1]C),MONTH(R[-1]C)+1,1)>ValDat,"",DATE(YEAR(R[-1]C),MONTH(R[-1]C)+1,1))) -> 2000-12-01T00:00:00.000 | B37: =IF(RC1="","",IF(VLOOKUP(RC1,TrendFacDump,2,FALSE)=0,0,VLOOKUP(EOMONTH(ValDat,-1)+1,TrendFacDump,2,FALSE)/VLOOKUP(RC1,TrendFacDump,2,FALSE))) -> 1.0345541071798054 | C37: =IF(RC1="","",VLOOKUP(RC1,ExpDump,7,FALSE)) -> 2887.18 | D37: =IF(RC1="","",SUM(RC[2]:RC[37])) -> 146038 | E37: =IF(RC1="","",R[-1]C+RC[1]+R[-1]C[2]+R[-2]C[3]+R[-3]C[4]+R[-4]C[5]+R[-5]C[6]+R[-6]C[7]+R[-7]C[8]+R[-8]C[9]+R[-9]C[10]+R[-10]C[11]+R[-11]C[12]+R[-12]C[13]+R[-13]C[14]+R[-14]C[15]+R[-15]C[16]+R[-16]C[17]+R[-17]C[18]+R[-18]C[19]+R[-19]C[20]+R[-20]C[21]+R[-21]C[22]+R[-22]C[23]+R[-23]C[24]+R[-24]C[25]+R[-25]C[26]+R[-26]C[27]+R[-27]C[28]+R[-28]C[29]) -> 5518662 | F37: =IF(RC1="","",VLOOKUP(RC1,PaidDump,R8C+2,FALSE)) -> 1804 | G37: =IF(RC1="","",VLOOKUP(RC1,PaidDump,R8C+2,FALSE)) -> 66303 | H37: =IF(RC1="","",VLOOKUP(RC1,PaidDump,R8C+2,FALSE)) -> 37667 | I37: =IF(RC1="","",VLOOKUP(RC1,PaidDump,R8C+2,FALSE)) -> 17053 | J37: =IF(RC1="","",VLOOKUP(RC1,PaidDump,R8C+2,FALSE)) -> 2170 | K37: =IF(RC1="","",VLOOKUP(RC1,PaidDump,R8C+2,FALSE)) -> 13856 | L37: =IF(RC1="","",VLOOKUP(RC1,PaidDump,R8C+2,FALSE)) -> 1103 | M37: =IF(RC1="","",VLOOKUP(RC1,PaidDump,R8C+2,FALSE)) -> 1737 | N37: =IF(RC1="","",VLOOKUP(RC1,PaidDump,R8C+2,FALSE)) -> 266 | O37: =IF(RC1="","",VLOOKUP(RC1,PaidDump,R8C+2,FALSE)) -> 115 | P37: =IF(RC1="","",VLOOKUP(RC1,PaidDump,R8C+2,FALSE)) -> 231 | Q37: =IF(RC1="","",VLOOKUP(RC1,PaidDump,R8C+2,FALSE)) -> 271 | R37: =IF(RC1="","",VLOOKUP(RC1,PaidDump,R8C+2,FALSE)) -> 2907 | S37: =IF(RC1="","",VLOOKUP(RC1,PaidDump,R8C+2,FALSE)) -> 0 | T37: =IF(RC1="","",VLOOKUP(RC1,PaidDump,R8C+2,FALSE)) -> 0 | U37: =IF(RC1="","",VLOOKUP(RC1,PaidDump,R8C+2,FALSE)) -> 0 | V37: =IF(RC1="","",VLOOKUP(RC1,PaidDump,R8C+2,FALSE)) -> 130 | W37: =IF(RC1="","",VLOOKUP(RC1,PaidDump,R8C+2,FALSE)) -> 0 | X37: =IF(RC1="","",VLOOKUP(RC1,PaidDump,R8C+2,FALSE)) -> 0 | Y37: =IF(RC1="","",VLOOKUP(RC1,PaidDump,R8C+2,FALSE)) -> 0 | Z37: =IF(RC1="","",VLOOKUP(RC1,PaidDump,R8C+2,FALSE)) -> 0 | AA37: =IF(RC1="","",VLOOKUP(RC1,PaidDump,R8C+2,FALSE)) -> 0 | AB37: =IF(RC1="","",VLOOKUP(RC1,PaidDump,R8C+2,FALSE)) -> 0 | AC37: =IF(RC1="","",VLOOKUP(RC1,PaidDump,R8C+2,FALSE)) -> 96 | AD37: =IF(RC1="","",VLOOKUP(RC1,PaidDump,R8C+2,FALSE)) -> 0 | AE37: =IF(RC1="","",VLOOKUP(RC1,PaidDump,R8C+2,FALSE)) -> 329 | AF37: =IF(RC1="","",VLOOKUP(RC1,PaidDump,R8C+2,FALSE)) -> 0 | AG37: =IF(RC1="","",VLOOKUP(RC1,PaidDump,R8C+2,FALSE)) -> 0 | AH37: =IF(RC1="","",VLOOKUP(RC1,PaidDump,R8C+2,FALSE)) -> 0 | AI37: =IF(RC1="","",VLOOKUP(RC1,PaidDump,R8C+2,FALSE)) -> 0 | AJ37: =IF(RC1="","",VLOOKUP(RC1,PaidDump,R8C+2,FALSE)) -> 0 | AK37: =IF(RC1="","",VLOOKUP(RC1,PaidDump,R8C+2,FALSE)) -> 0 | AL37: =IF(RC1="","",VLOOKUP(RC1,PaidDump,R8C+2,FALSE)) -> 0 | AM37: =IF(RC1="","",VLOOKUP(RC1,PaidDump,R8C+2,FALSE)) -> 0 | AN37: =IF(RC1="","",VLOOKUP(RC1,PaidDump,R8C+2,FALSE)) -> 0 | AO37: =IF(RC1="","",VLOOKUP(RC1,PaidDump,R8C+2,FALSE)) -> 0
A38: =IF(R[-1]C1="","",IF(DATE(YEAR(R[-1]C),MONTH(R[-1]C)+1,1)>ValDat,"",DATE(YEAR(R[-1]C),MONTH(R[-1]C)+1,1))) -> 2001-01-01T00:00:00.000 | B38: =IF(RC1="","",IF(VLOOKUP(RC1,TrendFacDump,2,FALSE)=0,0,VLOOKUP(EOMONTH(ValDat,-1)+1,TrendFacDump,2,FALSE)/VLOOKUP(RC1,TrendFacDump,2,FALSE))) -> 1.0295480284155256 | C38: =IF(RC1="","",VLOOKUP(RC1,ExpDump,7,FALSE)) -> 2887.8029999999999 | D38: =IF(RC1="","",SUM(RC[2]:RC[37])) -> 146038 | E38: =IF(RC1="","",R[-1]C+RC[1]+R[-1]C[2]+R[-2]C[3]+R[-3]C[4]+R[-4]C[5]+R[-5]C[6]+R[-6]C[7]+R[-7]C[8]+R[-8]C[9]+R[-9]C[10]+R[-10]C[11]+R[-11]C[12]+R[-12]C[13]+R[-13]C[14]+R[-14]C[15]+R[-15]C[16]+R[-16]C[17]+R[-17]C[18]+R[-18]C[19]+R[-19]C[20]+R[-20]C[21]+R[-21]C[22]+R[-22]C[23]+R[-23]C[24]+R[-24]C[25]+R[-25]C[26]+R[-26]C[27]+R[-27]C[28]+R[-28]C[29]+R[-29]C[30]) -> 5728402 | F38: =IF(RC1="","",VLOOKUP(RC1,PaidDump,R8C+2,FALSE)) -> 19993 | G38: =IF(RC1="","",VLOOKUP(RC1,PaidDump,R8C+2,FALSE)) -> 59964 | H38: =IF(RC1="","",VLOOKUP(RC1,PaidDump,R8C+2,FALSE)) -> 35539 | I38: =IF(RC1="","",VLOOKUP(RC1,PaidDump,R8C+2,FALSE)) -> 9556 | J38: =IF(RC1="","",VLOOKUP(RC1,PaidDump,R8C+2,FALSE)) -> 13627 | K38: =IF(RC1="","",VLOOKUP(RC1,PaidDump,R8C+2,FALSE)) -> 342 | L38: =IF(RC1="","",VLOOKUP(RC1,PaidDump,R8C+2,FALSE)) -> 1024 | M38: =IF(RC1="","",VLOOKUP(RC1,PaidDump,R8C+2,FALSE)) -> 1821 | N38: =IF(RC1="","",VLOOKUP(RC1,PaidDump,R8C+2,FALSE)) -> 208 | O38: =IF(RC1="","",VLOOKUP(RC1,PaidDump,R8C+2,FALSE)) -> 533 | P38: =IF(RC1="","",VLOOKUP(RC1,PaidDump,R8C+2,FALSE)) -> 148 | Q38: =IF(RC1="","",VLOOKUP(RC1,PaidDump,R8C+2,FALSE)) -> 392 | R38: =IF(RC1="","",VLOOKUP(RC1,PaidDump,R8C+2,FALSE)) -> 2336 | S38: =IF(RC1="","",VLOOKUP(RC1,PaidDump,R8C+2,FALSE)) -> 0 | T38: =IF(RC1="","",VLOOKUP(RC1,PaidDump,R8C+2,FALSE)) -> 0 | U38: =IF(RC1="","",VLOOKUP(RC1,PaidDump,R8C+2,FALSE)) -> 40 | V38: =IF(RC1="","",VLOOKUP(RC1,PaidDump,R8C+2,FALSE)) -> 90 | W38: =IF(RC1="","",VLOOKUP(RC1,PaidDump,R8C+2,FALSE)) -> 0 | X38: =IF(RC1="","",VLOOKUP(RC1,PaidDump,R8C+2,FALSE)) -> 0 | Y38: =IF(RC1="","",VLOOKUP(RC1,PaidDump,R8C+2,FALSE)) -> 0 | Z38: =IF(RC1="","",VLOOKUP(RC1,PaidDump,R8C+2,FALSE)) -> 0 | AA38: =IF(RC1="","",VLOOKUP(RC1,PaidDump,R8C+2,FALSE)) -> 0 | AB38: =IF(RC1="","",VLOOKUP(RC1,PaidDump,R8C+2,FALSE)) -> 96 | AC38: =IF(RC1="","",VLOOKUP(RC1,PaidDump,R8C+2,FALSE)) -> 0 | AD38: =IF(RC1="","",VLOOKUP(RC1,PaidDump,R8C+2,FALSE)) -> 0 | AE38: =IF(RC1="","",VLOOKUP(RC1,PaidDump,R8C+2,FALSE)) -> 329 | AF38: =IF(RC1="","",VLOOKUP(RC1,PaidDump,R8C+2,FALSE)) -> 0 | AG38: =IF(RC1="","",VLOOKUP(RC1,PaidDump,R8C+2,FALSE)) -> 0 | AH38: =IF(RC1="","",VLOOKUP(RC1,PaidDump,R8C+2,FALSE)) -> 0 | AI38: =IF(RC1="","",VLOOKUP(RC1,PaidDump,R8C+2,FALSE)) -> 0 | AJ38: =IF(RC1="","",VLOOKUP(RC1,PaidDump,R8C+2,FALSE)) -> 0 | AK38: =IF(RC1="","",VLOOKUP(RC1,PaidDump,R8C+2,FALSE)) -> 0 | AL38: =IF(RC1="","",VLOOKUP(RC1,PaidDump,R8C+2,FALSE)) -> 0 | AM38: =IF(RC1="","",VLOOKUP(RC1,PaidDump,R8C+2,FALSE)) -> 0 | AN38: =IF(RC1="","",VLOOKUP(RC1,PaidDump,R8C+2,FALSE)) -> 0 | AO38: =IF(RC1="","",VLOOKUP(RC1,PaidDump,R8C+2,FALSE)) -> 0
A39: =IF(R[-1]C1="","",IF(DATE(YEAR(R[-1]C),MONTH(R[-1]C)+1,1)>ValDat,"",DATE(YEAR(R[-1]C),MONTH(R[-1]C)+1,1))) -> 2001-02-01T00:00:00.000 | B39: =IF(RC1="","",IF(VLOOKUP(RC1,TrendFacDump,2,FALSE)=0,0,VLOOKUP(EOMONTH(ValDat,-1)+1,TrendFacDump,2,FALSE)/VLOOKUP(RC1,TrendFacDump,2,FALSE))) -> 1.0245901639344261 | C39: =IF(RC1="","",VLOOKUP(RC1,ExpDump,7,FALSE)) -> 2887.0279999999998 | D39: =IF(RC1="","",SUM(RC[2]:RC[37])) -> 82703 | E39: =IF(RC1="","",R[-1]C+RC[1]+R[-1]C[2]+R[-2]C[3]+R[-3]C[4]+R[-4]C[5]+R[-5]C[6]+R[-6]C[7]+R[-7]C[8]+R[-8]C[9]+R[-9]C[10]+R[-10]C[11]+R[-11]C[12]+R[-12]C[13]+R[-13]C[14]+R[-14]C[15]+R[-15]C[16]+R[-16]C[17]+R[-17]C[18]+R[-18]C[19]+R[-19]C[20]+R[-20]C[21]+R[-21]C[22]+R[-22]C[23]+R[-23]C[24]+R[-24]C[25]+R[-25]C[26]+R[-26]C[27]+R[-27]C[28]+R[-28]C[29]+R[-29]C[30]+R[-30]C[31]) -> 5887533 | F39: =IF(RC1="","",VLOOKUP(RC1,PaidDump,R8C+2,FALSE)) -> 240 | G39: =IF(RC1="","",VLOOKUP(RC1,PaidDump,R8C+2,FALSE)) -> 15910 | H39: =IF(RC1="","",VLOOKUP(RC1,PaidDump,R8C+2,FALSE)) -> 39608 | I39: =IF(RC1="","",VLOOKUP(RC1,PaidDump,R8C+2,FALSE)) -> 6673 | J39: =IF(RC1="","",VLOOKUP(RC1,PaidDump,R8C+2,FALSE)) -> 2288 | K39: =IF(RC1="","",VLOOKUP(RC1,PaidDump,R8C+2,FALSE)) -> 4935 | L39: =IF(RC1="","",VLOOKUP(RC1,PaidDump,R8C+2,FALSE)) -> 3876 | M39: =IF(RC1="","",VLOOKUP(RC1,PaidDump,R8C+2,FALSE)) -> 239 | N39: =IF(RC1="","",VLOOKUP(RC1,PaidDump,R8C+2,FALSE)) -> 985 | O39: =IF(RC1="","",VLOOKUP(RC1,PaidDump,R8C+2,FALSE)) -> 304 | P39: =IF(RC1="","",VLOOKUP(RC1,PaidDump,R8C+2,FALSE)) -> 5839 | Q39: =IF(RC1="","",VLOOKUP(RC1,PaidDump,R8C+2,FALSE)) -> 52 | R39: =IF(RC1="","",VLOOKUP(RC1,PaidDump,R8C+2,FALSE)) -> 101 | S39: =IF(RC1="","",VLOOKUP(RC1,PaidDump,R8C+2,FALSE)) -> 1201 | T39: =IF(RC1="","",VLOOKUP(RC1,PaidDump,R8C+2,FALSE)) -> 452 | U39: =IF(RC1="","",VLOOKUP(RC1,PaidDump,R8C+2,FALSE)) -> 0 | V39: =IF(RC1="","",VLOOKUP(RC1,PaidDump,R8C+2,FALSE)) -> 0 | W39: =IF(RC1="","",VLOOKUP(RC1,PaidDump,R8C+2,FALSE)) -> 0 | X39: =IF(RC1="","",VLOOKUP(RC1,PaidDump,R8C+2,FALSE)) -> 0 | Y39: =IF(RC1="","",VLOOKUP(RC1,PaidDump,R8C+2,FALSE)) -> 0 | Z39: =IF(RC1="","",VLOOKUP(RC1,PaidDump,R8C+2,FALSE)) -> 0 | AA39: =IF(RC1="","",VLOOKUP(RC1,PaidDump,R8C+2,FALSE)) -> 0 | AB39: =IF(RC1="","",VLOOKUP(RC1,PaidDump,R8C+2,FALSE)) -> 0 | AC39: =IF(RC1="","",VLOOKUP(RC1,PaidDump,R8C+2,FALSE)) -> 0 | AD39: =IF(RC1="","",VLOOKUP(RC1,PaidDump,R8C+2,FALSE)) -> 0 | AE39: =IF(RC1="","",VLOOKUP(RC1,PaidDump,R8C+2,FALSE)) -> 0 | AF39: =IF(RC1="","",VLOOKUP(RC1,PaidDump,R8C+2,FALSE)) -> 0 | AG39: =IF(RC1="","",VLOOKUP(RC1,PaidDump,R8C+2,FALSE)) -> 0 | AH39: =IF(RC1="","",VLOOKUP(RC1,PaidDump,R8C+2,FALSE)) -> 0 | AI39: =IF(RC1="","",VLOOKUP(RC1,PaidDump,R8C+2,FALSE)) -> 0 | AJ39: =IF(RC1="","",VLOOKUP(RC1,PaidDump,R8C+2,FALSE)) -> 0 | AK39: =IF(RC1="","",VLOOKUP(RC1,PaidDump,R8C+2,FALSE)) -> 0 | AL39: =IF(RC1="","",VLOOKUP(RC1,PaidDump,R8C+2,FALSE)) -> 0 | AM39: =IF(RC1="","",VLOOKUP(RC1,PaidDump,R8C+2,FALSE)) -> 0 | AN39: =IF(RC1="","",VLOOKUP(RC1,PaidDump,R8C+2,FALSE)) -> 0 | AO39: =IF(RC1="","",VLOOKUP(RC1,PaidDump,R8C+2,FALSE)) -> 0
A40: =IF(R[-1]C1="","",IF(DATE(YEAR(R[-1]C),MONTH(R[-1]C)+1,1)>ValDat,"",DATE(YEAR(R[-1]C),MONTH(R[-1]C)+1,1))) -> 2001-03-01T00:00:00.000 | B40: =IF(RC1="","",IF(VLOOKUP(RC1,TrendFacDump,2,FALSE)=0,0,VLOOKUP(EOMONTH(ValDat,-1)+1,TrendFacDump,2,FALSE)/VLOOKUP(RC1,TrendFacDump,2,FALSE))) -> 1.0195758564437194 | C40: =IF(RC1="","",VLOOKUP(RC1,ExpDump,7,FALSE)) -> 2848.3409999999999 | D40: =IF(RC1="","",SUM(RC[2]:RC[37])) -> 82703 | E40: =IF(RC1="","",R[-1]C+RC[1]+R[-1]C[2]+R[-2]C[3]+R[-3]C[4]+R[-4]C[5]+R[-5]C[6]+R[-6]C[7]+R[-7]C[8]+R[-8]C[9]+R[-9]C[10]+R[-10]C[11]+R[-11]C[12]+R[-12]C[13]+R[-13]C[14]+R[-14]C[15]+R[-15]C[16]+R[-16]C[17]+R[-17]C[18]+R[-18]C[19]+R[-19]C[20]+R[-20]C[21]+R[-21]C[22]+R[-22]C[23]+R[-23]C[24]+R[-24]C[25]+R[-25]C[26]+R[-26]C[27]+R[-27]C[28]+R[-28]C[29]+R[-29]C[30]+R[-30]C[31]+R[-31]C[32]) -> 5990770 | F40: =IF(RC1="","",VLOOKUP(RC1,PaidDump,R8C+2,FALSE)) -> 9046 | G40: =IF(RC1="","",VLOOKUP(RC1,PaidDump,R8C+2,FALSE)) -> 43493 | H40: =IF(RC1="","",VLOOKUP(RC1,PaidDump,R8C+2,FALSE)) -> 7571 | I40: =IF(RC1="","",VLOOKUP(RC1,PaidDump,R8C+2,FALSE)) -> 5995 | J40: =IF(RC1="","",VLOOKUP(RC1,PaidDump,R8C+2,FALSE)) -> 3715 | K40: =IF(RC1="","",VLOOKUP(RC1,PaidDump,R8C+2,FALSE)) -> 3670 | L40: =IF(RC1="","",VLOOKUP(RC1,PaidDump,R8C+2,FALSE)) -> 279 | M40: =IF(RC1="","",VLOOKUP(RC1,PaidDump,R8C+2,FALSE)) -> 596 | N40: =IF(RC1="","",VLOOKUP(RC1,PaidDump,R8C+2,FALSE)) -> 578 | O40: =IF(RC1="","",VLOOKUP(RC1,PaidDump,R8C+2,FALSE)) -> 932 | P40: =IF(RC1="","",VLOOKUP(RC1,PaidDump,R8C+2,FALSE)) -> 5022 | Q40: =IF(RC1="","",VLOOKUP(RC1,PaidDump,R8C+2,FALSE)) -> 119 | R40: =IF(RC1="","",VLOOKUP(RC1,PaidDump,R8C+2,FALSE)) -> 251 | S40: =IF(RC1="","",VLOOKUP(RC1,PaidDump,R8C+2,FALSE)) -> 1037 | T40: =IF(RC1="","",VLOOKUP(RC1,PaidDump,R8C+2,FALSE)) -> 399 | U40: =IF(RC1="","",VLOOKUP(RC1,PaidDump,R8C+2,FALSE)) -> 0 | V40: =IF(RC1="","",VLOOKUP(RC1,PaidDump,R8C+2,FALSE)) -> 0 | W40: =IF(RC1="","",VLOOKUP(RC1,PaidDump,R8C+2,FALSE)) -> 0 | X40: =IF(RC1="","",VLOOKUP(RC1,PaidDump,R8C+2,FALSE)) -> 0 | Y40: =IF(RC1="","",VLOOKUP(RC1,PaidDump,R8C+2,FALSE)) -> 0 | Z40: =IF(RC1="","",VLOOKUP(RC1,PaidDump,R8C+2,FALSE)) -> 0 | AA40: =IF(RC1="","",VLOOKUP(RC1,PaidDump,R8C+2,FALSE)) -> 0 | AB40: =IF(RC1="","",VLOOKUP(RC1,PaidDump,R8C+2,FALSE)) -> 0 | AC40: =IF(RC1="","",VLOOKUP(RC1,PaidDump,R8C+2,FALSE)) -> 0 | AD40: =IF(RC1="","",VLOOKUP(RC1,PaidDump,R8C+2,FALSE)) -> 0 | AE40: =IF(RC1="","",VLOOKUP(RC1,PaidDump,R8C+2,FALSE)) -> 0 | AF40: =IF(RC1="","",VLOOKUP(RC1,PaidDump,R8C+2,FALSE)) -> 0 | AG40: =IF(RC1="","",VLOOKUP(RC1,PaidDump,R8C+2,FALSE)) -> 0 | AH40: =IF(RC1="","",VLOOKUP(RC1,PaidDump,R8C+2,FALSE)) -> 0 | AI40: =IF(RC1="","",VLOOKUP(RC1,PaidDump,R8C+2,FALSE)) -> 0 | AJ40: =IF(RC1="","",VLOOKUP(RC1,PaidDump,R8C+2,FALSE)) -> 0 | AK40: =IF(RC1="","",VLOOKUP(RC1,PaidDump,R8C+2,FALSE)) -> 0 | AL40: =IF(RC1="","",VLOOKUP(RC1,PaidDump,R8C+2,FALSE)) -> 0 | AM40: =IF(RC1="","",VLOOKUP(RC1,PaidDump,R8C+2,FALSE)) -> 0 | AN40: =IF(RC1="","",VLOOKUP(RC1,PaidDump,R8C+2,FALSE)) -> 0 | AO40: =IF(RC1="","",VLOOKUP(RC1,PaidDump,R8C+2,FALSE)) -> 0
A41: =IF(R[-1]C1="","",IF(DATE(YEAR(R[-1]C),MONTH(R[-1]C)+1,1)>ValDat,"",DATE(YEAR(R[-1]C),MONTH(R[-1]C)+1,1))) -> 2001-04-01T00:00:00.000 | B41: =IF(RC1="","",IF(VLOOKUP(RC1,TrendFacDump,2,FALSE)=0,0,VLOOKUP(EOMONTH(ValDat,-1)+1,TrendFacDump,2,FALSE)/VLOOKUP(RC1,TrendFacDump,2,FALSE))) -> 1.0147133434804667 | C41: =IF(RC1="","",VLOOKUP(RC1,ExpDump,7,FALSE)) -> 2809.8719999999998 | D41: =IF(RC1="","",SUM(RC[2]:RC[37])) -> 52143 | E41: =IF(RC1="","",R[-1]C+RC[1]+R[-1]C[2]+R[-2]C[3]+R[-3]C[4]+R[-4]C[5]+R[-5]C[6]+R[-6]C[7]+R[-7]C[8]+R[-8]C[9]+R[-9]C[10]+R[-10]C[11]+R[-11]C[12]+R[-12]C[13]+R[-13]C[14]+R[-14]C[15]+R[-15]C[16]+R[-16]C[17]+R[-17]C[18]+R[-18]C[19]+R[-19]C[20]+R[-20]C[21]+R[-21]C[22]+R[-22]C[23]+R[-23]C[24]+R[-24]C[25]+R[-25]C[26]+R[-26]C[27]+R[-27]C[28]+R[-28]C[29]+R[-29]C[30]+R[-30]C[31]+R[-31]C[32]+R[-32]C[33]) -> 6095438 | F41: =IF(RC1="","",VLOOKUP(RC1,PaidDump,R8C+2,FALSE)) -> 753 | G41: =IF(RC1="","",VLOOKUP(RC1,PaidDump,R8C+2,FALSE)) -> 13772 | H41: =IF(RC1="","",VLOOKUP(RC1,PaidDump,R8C+2,FALSE)) -> 13968 | I41: =IF(RC1="","",VLOOKUP(RC1,PaidDump,R8C+2,FALSE)) -> 12573 | J41: =IF(RC1="","",VLOOKUP(RC1,PaidDump,R8C+2,FALSE)) -> 2779 | K41: =IF(RC1="","",VLOOKUP(RC1,PaidDump,R8C+2,FALSE)) -> 5650 | L41: =IF(RC1="","",VLOOKUP(RC1,PaidDump,R8C+2,FALSE)) -> 674 | M41: =IF(RC1="","",VLOOKUP(RC1,PaidDump,R8C+2,FALSE)) -> 1530 | N41: =IF(RC1="","",VLOOKUP(RC1,PaidDump,R8C+2,FALSE)) -> 322 | O41: =IF(RC1="","",VLOOKUP(RC1,PaidDump,R8C+2,FALSE)) -> 0 | P41: =IF(RC1="","",VLOOKUP(RC1,PaidDump,R8C+2,FALSE)) -> 92 | Q41: =IF(RC1="","",VLOOKUP(RC1,PaidDump,R8C+2,FALSE)) -> 0 | R41: =IF(RC1="","",VLOOKUP(RC1,PaidDump,R8C+2,FALSE)) -> 0 | S41: =IF(RC1="","",VLOOKUP(RC1,PaidDump,R8C+2,FALSE)) -> 0 | T41: =IF(RC1="","",VLOOKUP(RC1,PaidDump,R8C+2,FALSE)) -> 0 | U41: =IF(RC1="","",VLOOKUP(RC1,PaidDump,R8C+2,FALSE)) -> 0 | V41: =IF(RC1="","",VLOOKUP(RC1,PaidDump,R8C+2,FALSE)) -> 30 | W41: =IF(RC1="","",VLOOKUP(RC1,PaidDump,R8C+2,FALSE)) -> 0 | X41: =IF(RC1="","",VLOOKUP(RC1,PaidDump,R8C+2,FALSE)) -> 0 | Y41: =IF(RC1="","",VLOOKUP(RC1,PaidDump,R8C+2,FALSE)) -> 0 | Z41: =IF(RC1="","",VLOOKUP(RC1,PaidDump,R8C+2,FALSE)) -> 0 | AA41: =IF(RC1="","",VLOOKUP(RC1,PaidDump,R8C+2,FALSE)) -> 0 | AB41: =IF(RC1="","",VLOOKUP(RC1,PaidDump,R8C+2,FALSE)) -> 0 | AC41: =IF(RC1="","",VLOOKUP(RC1,PaidDump,R8C+2,FALSE)) -> 0 | AD41: =IF(RC1="","",VLOOKUP(RC1,PaidDump,R8C+2,FALSE)) -> 0 | AE41: =IF(RC1="","",VLOOKUP(RC1,PaidDump,R8C+2,FALSE)) -> 0 | AF41: =IF(RC1="","",VLOOKUP(RC1,PaidDump,R8C+2,FALSE)) -> 0 | AG41: =IF(RC1="","",VLOOKUP(RC1,PaidDump,R8C+2,FALSE)) -> 0 | AH41: =IF(RC1="","",VLOOKUP(RC1,PaidDump,R8C+2,FALSE)) -> 0 | AI41: =IF(RC1="","",VLOOKUP(RC1,PaidDump,R8C+2,FALSE)) -> 0 | AJ41: =IF(RC1="","",VLOOKUP(RC1,PaidDump,R8C+2,FALSE)) -> 0 | AK41: =IF(RC1="","",VLOOKUP(RC1,PaidDump,R8C+2,FALSE)) -> 0 | AL41: =IF(RC1="","",VLOOKUP(RC1,PaidDump,R8C+2,FALSE)) -> 0 | AM41: =IF(RC1="","",VLOOKUP(RC1,PaidDump,R8C+2,FALSE)) -> 0 | AN41: =IF(RC1="","",VLOOKUP(RC1,PaidDump,R8C+2,FALSE)) -> 0 | AO41: =IF(RC1="","",VLOOKUP(RC1,PaidDump,R8C+2,FALSE)) -> 0
A42: =IF(R[-1]C1="","",IF(DATE(YEAR(R[-1]C),MONTH(R[-1]C)+1,1)>ValDat,"",DATE(YEAR(R[-1]C),MONTH(R[-1]C)+1,1))) -> 2001-05-01T00:00:00.000 | B42: =IF(RC1="","",IF(VLOOKUP(RC1,TrendFacDump,2,FALSE)=0,0,VLOOKUP(EOMONTH(ValDat,-1)+1,TrendFacDump,2,FALSE)/VLOOKUP(RC1,TrendFacDump,2,FALSE))) -> 1.0097950116126426 | C42: =IF(RC1="","",VLOOKUP(RC1,ExpDump,7,FALSE)) -> 2815.6109999999999 | D42: =IF(RC1="","",SUM(RC[2]:RC[37])) -> 52143 | E42: =IF(RC1="","",R[-1]C+RC[1]+R[-1]C[2]+R[-2]C[3]+R[-3]C[4]+R[-4]C[5]+R[-5]C[6]+R[-6]C[7]+R[-7]C[8]+R[-8]C[9]+R[-9]C[10]+R[-10]C[11]+R[-11]C[12]+R[-12]C[13]+R[-13]C[14]+R[-14]C[15]+R[-15]C[16]+R[-16]C[17]+R[-17]C[18]+R[-18]C[19]+R[-19]C[20]+R[-20]C[21]+R[-21]C[22]+R[-22]C[23]+R[-23]C[24]+R[-24]C[25]+R[-25]C[26]+R[-26]C[27]+R[-27]C[28]+R[-28]C[29]+R[-29]C[30]+R[-30]C[31]+R[-31]C[32]+R[-32]C[33]+R[-33]C[34]) -> 6171157 | F42: =IF(RC1="","",VLOOKUP(RC1,PaidDump,R8C+2,FALSE)) -> 12673 | G42: =IF(RC1="","",VLOOKUP(RC1,PaidDump,R8C+2,FALSE)) -> 20961 | H42: =IF(RC1="","",VLOOKUP(RC1,PaidDump,R8C+2,FALSE)) -> 6855 | I42: =IF(RC1="","",VLOOKUP(RC1,PaidDump,R8C+2,FALSE)) -> 5064 | J42: =IF(RC1="","",VLOOKUP(RC1,PaidDump,R8C+2,FALSE)) -> 3297 | K42: =IF(RC1="","",VLOOKUP(RC1,PaidDump,R8C+2,FALSE)) -> 1391 | L42: =IF(RC1="","",VLOOKUP(RC1,PaidDump,R8C+2,FALSE)) -> 1458 | M42: =IF(RC1="","",VLOOKUP(RC1,PaidDump,R8C+2,FALSE)) -> 126 | N42: =IF(RC1="","",VLOOKUP(RC1,PaidDump,R8C+2,FALSE)) -> 196 | O42: =IF(RC1="","",VLOOKUP(RC1,PaidDump,R8C+2,FALSE)) -> 0 | P42: =IF(RC1="","",VLOOKUP(RC1,PaidDump,R8C+2,FALSE)) -> 92 | Q42: =IF(RC1="","",VLOOKUP(RC1,PaidDump,R8C+2,FALSE)) -> 0 | R42: =IF(RC1="","",VLOOKUP(RC1,PaidDump,R8C+2,FALSE)) -> 0 | S42: =IF(RC1="","",VLOOKUP(RC1,PaidDump,R8C+2,FALSE)) -> 0 | T42: =IF(RC1="","",VLOOKUP(RC1,PaidDump,R8C+2,FALSE)) -> 0 | U42: =IF(RC1="","",VLOOKUP(RC1,PaidDump,R8C+2,FALSE)) -> 0 | V42: =IF(RC1="","",VLOOKUP(RC1,PaidDump,R8C+2,FALSE)) -> 30 | W42: =IF(RC1="","",VLOOKUP(RC1,PaidDump,R8C+2,FALSE)) -> 0 | X42: =IF(RC1="","",VLOOKUP(RC1,PaidDump,R8C+2,FALSE)) -> 0 | Y42: =IF(RC1="","",VLOOKUP(RC1,PaidDump,R8C+2,FALSE)) -> 0 | Z42: =IF(RC1="","",VLOOKUP(RC1,PaidDump,R8C+2,FALSE)) -> 0 | AA42: =IF(RC1="","",VLOOKUP(RC1,PaidDump,R8C+2,FALSE)) -> 0 | AB42: =IF(RC1="","",VLOOKUP(RC1,PaidDump,R8C+2,FALSE)) -> 0 | AC42: =IF(RC1="","",VLOOKUP(RC1,PaidDump,R8C+2,FALSE)) -> 0 | AD42: =IF(RC1="","",VLOOKUP(RC1,PaidDump,R8C+2,FALSE)) -> 0 | AE42: =IF(RC1="","",VLOOKUP(RC1,PaidDump,R8C+2,FALSE)) -> 0 | AF42: =IF(RC1="","",VLOOKUP(RC1,PaidDump,R8C+2,FALSE)) -> 0 | AG42: =IF(RC1="","",VLOOKUP(RC1,PaidDump,R8C+2,FALSE)) -> 0 | AH42: =IF(RC1="","",VLOOKUP(RC1,PaidDump,R8C+2,FALSE)) -> 0 | AI42: =IF(RC1="","",VLOOKUP(RC1,PaidDump,R8C+2,FALSE)) -> 0 | AJ42: =IF(RC1="","",VLOOKUP(RC1,PaidDump,R8C+2,FALSE)) -> 0 | AK42: =IF(RC1="","",VLOOKUP(RC1,PaidDump,R8C+2,FALSE)) -> 0 | AL42: =IF(RC1="","",VLOOKUP(RC1,PaidDump,R8C+2,FALSE)) -> 0 | AM42: =IF(RC1="","",VLOOKUP(RC1,PaidDump,R8C+2,FALSE)) -> 0 | AN42: =IF(RC1="","",VLOOKUP(RC1,PaidDump,R8C+2,FALSE)) -> 0 | AO42: =IF(RC1="","",VLOOKUP(RC1,PaidDump,R8C+2,FALSE)) -> 0
A43: =IF(R[-1]C1="","",IF(DATE(YEAR(R[-1]C),MONTH(R[-1]C)+1,1)>ValDat,"",DATE(YEAR(R[-1]C),MONTH(R[-1]C)+1,1))) -> 2001-06-01T00:00:00.000 | B43: =IF(RC1="","",IF(VLOOKUP(RC1,TrendFacDump,2,FALSE)=0,0,VLOOKUP(EOMONTH(ValDat,-1)+1,TrendFacDump,2,FALSE)/VLOOKUP(RC1,TrendFacDump,2,FALSE))) -> 1.004823151125402 | C43: =IF(RC1="","",VLOOKUP(RC1,ExpDump,7,FALSE)) -> 2810.5160000000001 | D43: =IF(RC1="","",SUM(RC[2]:RC[37])) -> 0 | E43: =IF(RC1="","",R[-1]C+RC[1]+R[-1]C[2]+R[-2]C[3]+R[-3]C[4]+R[-4]C[5]+R[-5]C[6]+R[-6]C[7]+R[-7]C[8]+R[-8]C[9]+R[-9]C[10]+R[-10]C[11]+R[-11]C[12]+R[-12]C[13]+R[-13]C[14]+R[-14]C[15]+R[-15]C[16]+R[-16]C[17]+R[-17]C[18]+R[-18]C[19]+R[-19]C[20]+R[-20]C[21]+R[-21]C[22]+R[-22]C[23]+R[-23]C[24]+R[-24]C[25]+R[-25]C[26]+R[-26]C[27]+R[-27]C[28]+R[-28]C[29]+R[-29]C[30]+R[-30]C[31]+R[-31]C[32]+R[-32]C[33]+R[-33]C[34]+R[-34]C[35]) -> 6220018 | F43: =IF(RC1="","",VLOOKUP(RC1,PaidDump,R8C+2,FALSE)) -> 0 | G43: =IF(RC1="","",VLOOKUP(RC1,PaidDump,R8C+2,FALSE)) -> 0 | H43: =IF(RC1="","",VLOOKUP(RC1,PaidDump,R8C+2,FALSE)) -> 0 | I43: =IF(RC1="","",VLOOKUP(RC1,PaidDump,R8C+2,FALSE)) -> 0 | J43: =IF(RC1="","",VLOOKUP(RC1,PaidDump,R8C+2,FALSE)) -> 0 | K43: =IF(RC1="","",VLOOKUP(RC1,PaidDump,R8C+2,FALSE)) -> 0 | L43: =IF(RC1="","",VLOOKUP(RC1,PaidDump,R8C+2,FALSE)) -> 0 | M43: =IF(RC1="","",VLOOKUP(RC1,PaidDump,R8C+2,FALSE)) -> 0 | N43: =IF(RC1="","",VLOOKUP(RC1,PaidDump,R8C+2,FALSE)) -> 0 | O43: =IF(RC1="","",VLOOKUP(RC1,PaidDump,R8C+2,FALSE)) -> 0 | P43: =IF(RC1="","",VLOOKUP(RC1,PaidDump,R8C+2,FALSE)) -> 0 | Q43: =IF(RC1="","",VLOOKUP(RC1,PaidDump,R8C+2,FALSE)) -> 0 | R43: =IF(RC1="","",VLOOKUP(RC1,PaidDump,R8C+2,FALSE)) -> 0 | S43: =IF(RC1="","",VLOOKUP(RC1,PaidDump,R8C+2,FALSE)) -> 0 | T43: =IF(RC1="","",VLOOKUP(RC1,PaidDump,R8C+2,FALSE)) -> 0 | U43: =IF(RC1="","",VLOOKUP(RC1,PaidDump,R8C+2,FALSE)) -> 0 | V43: =IF(RC1="","",VLOOKUP(RC1,PaidDump,R8C+2,FALSE)) -> 0 | W43: =IF(RC1="","",VLOOKUP(RC1,PaidDump,R8C+2,FALSE)) -> 0 | X43: =IF(RC1="","",VLOOKUP(RC1,PaidDump,R8C+2,FALSE)) -> 0 | Y43: =IF(RC1="","",VLOOKUP(RC1,PaidDump,R8C+2,FALSE)) -> 0 | Z43: =IF(RC1="","",VLOOKUP(RC1,PaidDump,R8C+2,FALSE)) -> 0 | AA43: =IF(RC1="","",VLOOKUP(RC1,PaidDump,R8C+2,FALSE)) -> 0 | AB43: =IF(RC1="","",VLOOKUP(RC1,PaidDump,R8C+2,FALSE)) -> 0 | AC43: =IF(RC1="","",VLOOKUP(RC1,PaidDump,R8C+2,FALSE)) -> 0 | AD43: =IF(RC1="","",VLOOKUP(RC1,PaidDump,R8C+2,FALSE)) -> 0 | AE43: =IF(RC1="","",VLOOKUP(RC1,PaidDump,R8C+2,FALSE)) -> 0 | AF43: =IF(RC1="","",VLOOKUP(RC1,PaidDump,R8C+2,FALSE)) -> 0 | AG43: =IF(RC1="","",VLOOKUP(RC1,PaidDump,R8C+2,FALSE)) -> 0 | AH43: =IF(RC1="","",VLOOKUP(RC1,PaidDump,R8C+2,FALSE)) -> 0 | AI43: =IF(RC1="","",VLOOKUP(RC1,PaidDump,R8C+2,FALSE)) -> 0 | AJ43: =IF(RC1="","",VLOOKUP(RC1,PaidDump,R8C+2,FALSE)) -> 0 | AK43: =IF(RC1="","",VLOOKUP(RC1,PaidDump,R8C+2,FALSE)) -> 0 | AL43: =IF(RC1="","",VLOOKUP(RC1,PaidDump,R8C+2,FALSE)) -> 0 | AM43: =IF(RC1="","",VLOOKUP(RC1,PaidDump,R8C+2,FALSE)) -> 0 | AN43: =IF(RC1="","",VLOOKUP(RC1,PaidDump,R8C+2,FALSE)) -> 0 | AO43: =IF(RC1="","",VLOOKUP(RC1,PaidDump,R8C+2,FALSE)) -> 0
A44: =IF(R[-1]C1="","",IF(DATE(YEAR(R[-1]C),MONTH(R[-1]C)+1,1)>ValDat,"",DATE(YEAR(R[-1]C),MONTH(R[-1]C)+1,1))) -> 2001-07-01T00:00:00.000 | B44: =IF(RC1="","",IF(VLOOKUP(RC1,TrendFacDump,2,FALSE)=0,0,VLOOKUP(EOMONTH(ValDat,-1)+1,TrendFacDump,2,FALSE)/VLOOKUP(RC1,TrendFacDump,2,FALSE))) -> 1 | C44: =IF(RC1="","",VLOOKUP(RC1,ExpDump,7,FALSE)) -> 2830.0740000000001 | D44: =IF(RC1="","",SUM(RC[2]:RC[37])) -> 0 | E44: =IF(RC1="","",R[-1]C+RC[1]+R[-1]C[2]+R[-2]C[3]+R[-3]C[4]+R[-4]C[5]+R[-5]C[6]+R[-6]C[7]+R[-7]C[8]+R[-8]C[9]+R[-9]C[10]+R[-10]C[11]+R[-11]C[12]+R[-12]C[13]+R[-13]C[14]+R[-14]C[15]+R[-15]C[16]+R[-16]C[17]+R[-17]C[18]+R[-18]C[19]+R[-19]C[20]+R[-20]C[21]+R[-21]C[22]+R[-22]C[23]+R[-23]C[24]+R[-24]C[25]+R[-25]C[26]+R[-26]C[27]+R[-27]C[28]+R[-28]C[29]+R[-29]C[30]+R[-30]C[31]+R[-31]C[32]+R[-32]C[33]+R[-33]C[34]+R[-34]C[35]+R[-35]C[36]) -> 6253366 | F44: =IF(RC1="","",VLOOKUP(RC1,PaidDump,R8C+2,FALSE)) -> 0 | G44: =IF(RC1="","",VLOOKUP(RC1,PaidDump,R8C+2,FALSE)) -> 0 | H44: =IF(RC1="","",VLOOKUP(RC1,PaidDump,R8C+2,FALSE)) -> 0 | I44: =IF(RC1="","",VLOOKUP(RC1,PaidDump,R8C+2,FALSE)) -> 0 | J44: =IF(RC1="","",VLOOKUP(RC1,PaidDump,R8C+2,FALSE)) -> 0 | K44: =IF(RC1="","",VLOOKUP(RC1,PaidDump,R8C+2,FALSE)) -> 0 | L44: =IF(RC1="","",VLOOKUP(RC1,PaidDump,R8C+2,FALSE)) -> 0 | M44: =IF(RC1="","",VLOOKUP(RC1,PaidDump,R8C+2,FALSE)) -> 0 | N44: =IF(RC1="","",VLOOKUP(RC1,PaidDump,R8C+2,FALSE)) -> 0 | O44: =IF(RC1="","",VLOOKUP(RC1,PaidDump,R8C+2,FALSE)) -> 0 | P44: =IF(RC1="","",VLOOKUP(RC1,PaidDump,R8C+2,FALSE)) -> 0 | Q44: =IF(RC1="","",VLOOKUP(RC1,PaidDump,R8C+2,FALSE)) -> 0 | R44: =IF(RC1="","",VLOOKUP(RC1,PaidDump,R8C+2,FALSE)) -> 0 | S44: =IF(RC1="","",VLOOKUP(RC1,PaidDump,R8C+2,FALSE)) -> 0 | T44: =IF(RC1="","",VLOOKUP(RC1,PaidDump,R8C+2,FALSE)) -> 0 | U44: =IF(RC1="","",VLOOKUP(RC1,PaidDump,R8C+2,FALSE)) -> 0 | V44: =IF(RC1="","",VLOOKUP(RC1,PaidDump,R8C+2,FALSE)) -> 0 | W44: =IF(RC1="","",VLOOKUP(RC1,PaidDump,R8C+2,FALSE)) -> 0 | X44: =IF(RC1="","",VLOOKUP(RC1,PaidDump,R8C+2,FALSE)) -> 0 | Y44: =IF(RC1="","",VLOOKUP(RC1,PaidDump,R8C+2,FALSE)) -> 0 | Z44: =IF(RC1="","",VLOOKUP(RC1,PaidDump,R8C+2,FALSE)) -> 0 | AA44: =IF(RC1="","",VLOOKUP(RC1,PaidDump,R8C+2,FALSE)) -> 0 | AB44: =IF(RC1="","",VLOOKUP(RC1,PaidDump,R8C+2,FALSE)) -> 0 | AC44: =IF(RC1="","",VLOOKUP(RC1,PaidDump,R8C+2,FALSE)) -> 0 | AD44: =IF(RC1="","",VLOOKUP(RC1,PaidDump,R8C+2,FALSE)) -> 0 | AE44: =IF(RC1="","",VLOOKUP(RC1,PaidDump,R8C+2,FALSE)) -> 0 | AF44: =IF(RC1="","",VLOOKUP(RC1,PaidDump,R8C+2,FALSE)) -> 0 | AG44: =IF(RC1="","",VLOOKUP(RC1,PaidDump,R8C+2,FALSE)) -> 0 | AH44: =IF(RC1="","",VLOOKUP(RC1,PaidDump,R8C+2,FALSE)) -> 0 | AI44: =IF(RC1="","",VLOOKUP(RC1,PaidDump,R8C+2,FALSE)) -> 0 | AJ44: =IF(RC1="","",VLOOKUP(RC1,PaidDump,R8C+2,FALSE)) -> 0 | AK44: =IF(RC1="","",VLOOKUP(RC1,PaidDump,R8C+2,FALSE)) -> 0 | AL44: =IF(RC1="","",VLOOKUP(RC1,PaidDump,R8C+2,FALSE)) -> 0 | AM44: =IF(RC1="","",VLOOKUP(RC1,PaidDump,R8C+2,FALSE)) -> 0 | AN44: =IF(RC1="","",VLOOKUP(RC1,PaidDump,R8C+2,FALSE)) -> 0 | AO44: =IF(RC1="","",VLOOKUP(RC1,PaidDump,R8C+2,FALSE)) -> 0
C45: =SUM(R[-36]C:R[-1]C) -> 104079.17000000001 | D45: =SUM(R[-36]C:R[-1]C) -> 6319704 | F45: =SUM(R[-36]C:R[-1]C) -> 810047 | G45: =SUM(R[-36]C:R[-1]C) -> 2760061 | H45: =SUM(R[-36]C:R[-1]C) -> 1752668 | I45: =SUM(R[-36]C:R[-1]C) -> 333156 | J45: =SUM(R[-36]C:R[-1]C) -> 205872 | K45: =SUM(R[-36]C:R[-1]C) -> 141279 | L45: =SUM(R[-36]C:R[-1]C) -> 168218 | M45: =SUM(R[-36]C:R[-1]C) -> 4342 | N45: =SUM(R[-36]C:R[-1]C) -> 32314 | O45: =SUM(R[-36]C:R[-1]C) -> 23530 | P45: =SUM(R[-36]C:R[-1]C) -> 28614 | Q45: =SUM(R[-36]C:R[-1]C) -> 28181 | R45: =SUM(R[-36]C:R[-1]C) -> 18473 | S45: =SUM(R[-36]C:R[-1]C) -> 4507 | T45: =SUM(R[-36]C:R[-1]C) -> 1786 | U45: =SUM(R[-36]C:R[-1]C) -> 1084 | V45: =SUM(R[-36]C:R[-1]C) -> 1066 | W45: =SUM(R[-36]C:R[-1]C) -> 734 | X45: =SUM(R[-36]C:R[-1]C) -> 716 | Y45: =SUM(R[-36]C:R[-1]C) -> 0 | Z45: =SUM(R[-36]C:R[-1]C) -> 2206 | AA45: =SUM(R[-36]C:R[-1]C) -> 0 | AB45: =SUM(R[-36]C:R[-1]C) -> 96 | AC45: =SUM(R[-36]C:R[-1]C) -> 96 | AD45: =SUM(R[-36]C:R[-1]C) -> 0 | AE45: =SUM(R[-36]C:R[-1]C) -> 658 | AF45: =SUM(R[-36]C:R[-1]C) -> 0 | AG45: =SUM(R[-36]C:R[-1]C) -> 0 | AH45: =SUM(R[-36]C:R[-1]C) -> 0 | AI45: =SUM(R[-36]C:R[-1]C) -> 0 | AJ45: =SUM(R[-36]C:R[-1]C) -> 0 | AK45: =SUM(R[-36]C:R[-1]C) -> 0 | AL45: =SUM(R[-36]C:R[-1]C) -> 0 | AM45: =SUM(R[-36]C:R[-1]C) -> 0 | AN45: =SUM(R[-36]C:R[-1]C) -> 0 | AO45: =SUM(R[-36]C:R[-1]C) -> 0
F47: Completion Factor Development Based on the Last k Months of Data For Each Lag Month Column
E48: k = | F48: =MCF -> 4 | G48: =RC[-1] -> 4 | H48: =RC[-1] -> 4 | I48: =RC[-1] -> 4 | J48: =RC[-1] -> 4 | K48: =RC[-1] -> 4 | L48: =RC[-1] -> 4 | M48: =RC[-1] -> 4 | N48: =RC[-1] -> 4 | O48: =RC[-1] -> 4 | P48: =RC[-1] -> 4 | Q48: =RC[-1] -> 4 | R48: =RC[-1] -> 4 | S48: =RC[-1] -> 4 | T48: =RC[-1] -> 4 | U48: =RC[-1] -> 4 | V48: =RC[-1] -> 4 | W48: =RC[-1] -> 4 | X48: =RC[-1] -> 4 | Y48: =RC[-1] -> 4 | Z48: =RC[-1] -> 4 | AA48: =RC[-1] -> 4 | AB48: =RC[-1] -> 4 | AC48: =RC[-1] -> 4 | AD48: =RC[-1] -> 4 | AE48: =RC[-1] -> 4 | AF48: =RC[-1] -> 4 | AG48: =RC[-1] -> 4 | AH48: =RC[-1] -> 4 | AI48: =RC[-1] -> 4 | AJ48: =RC[-1] -> 4 | AK48: =RC[-1] -> 4 | AL48: =RC[-1] -> 4 | AM48: =RC[-1] -> 4 | AN48: =RC[-1] -> 4 | AO48: =RC[-1] -> 4
A49: A. Claims …………………………………………… | E49: =SUM(RC[1]:RC[36]) -> 262596 | F49: =IF(R8C>MEP-1,0,SUM(OFFSET(R[-4]C,MAX(-R[-1]C-(ABS(R[-41]C-MRO)+(R[-41]C-MRO))/2,-MEP)-(MNR-MEP),0,MIN(R[-1]C,MEP-R[-41]C),1))) -> 13426 | G49: =IF(R8C>MEP-1,0,SUM(OFFSET(R[-4]C,MAX(-R[-1]C-(ABS(R[-41]C-MRO)+(R[-41]C-MRO))/2,-MEP)-(MNR-MEP),0,MIN(R[-1]C,MEP-R[-41]C),1))) -> 78226 | H49: =IF(R8C>MEP-1,0,SUM(OFFSET(R[-4]C,MAX(-R[-1]C-(ABS(R[-41]C-MRO)+(R[-41]C-MRO))/2,-MEP)-(MNR-MEP),0,MIN(R[-1]C,MEP-R[-41]C),1))) -> 68002 | I49: =IF(R8C>MEP-1,0,SUM(OFFSET(R[-4]C,MAX(-R[-1]C-(ABS(R[-41]C-MRO)+(R[-41]C-MRO))/2,-MEP)-(MNR-MEP),0,MIN(R[-1]C,MEP-R[-41]C),1))) -> 34797 | J49: =IF(R8C>MEP-1,0,SUM(OFFSET(R[-4]C,MAX(-R[-1]C-(ABS(R[-41]C-MRO)+(R[-41]C-MRO))/2,-MEP)-(MNR-MEP),0,MIN(R[-1]C,MEP-R[-41]C),1))) -> 21800 | K49: =IF(R8C>MEP-1,0,SUM(OFFSET(R[-4]C,MAX(-R[-1]C-(ABS(R[-41]C-MRO)+(R[-41]C-MRO))/2,-MEP)-(MNR-MEP),0,MIN(R[-1]C,MEP-R[-41]C),1))) -> 24545 | L49: =IF(R8C>MEP-1,0,SUM(OFFSET(R[-4]C,MAX(-R[-1]C-(ABS(R[-41]C-MRO)+(R[-41]C-MRO))/2,-MEP)-(MNR-MEP),0,MIN(R[-1]C,MEP-R[-41]C),1))) -> 6843 | M49: =IF(R8C>MEP-1,0,SUM(OFFSET(R[-4]C,MAX(-R[-1]C-(ABS(R[-41]C-MRO)+(R[-41]C-MRO))/2,-MEP)-(MNR-MEP),0,MIN(R[-1]C,MEP-R[-41]C),1))) -> 242 | N49: =IF(R8C>MEP-1,0,SUM(OFFSET(R[-4]C,MAX(-R[-1]C-(ABS(R[-41]C-MRO)+(R[-41]C-MRO))/2,-MEP)-(MNR-MEP),0,MIN(R[-1]C,MEP-R[-41]C),1))) -> 2613 | O49: =IF(R8C>MEP-1,0,SUM(OFFSET(R[-4]C,MAX(-R[-1]C-(ABS(R[-41]C-MRO)+(R[-41]C-MRO))/2,-MEP)-(MNR-MEP),0,MIN(R[-1]C,MEP-R[-41]C),1))) -> 9073 | P49: =IF(R8C>MEP-1,0,SUM(OFFSET(R[-4]C,MAX(-R[-1]C-(ABS(R[-41]C-MRO)+(R[-41]C-MRO))/2,-MEP)-(MNR-MEP),0,MIN(R[-1]C,MEP-R[-41]C),1))) -> 281 | Q49: =IF(R8C>MEP-1,0,SUM(OFFSET(R[-4]C,MAX(-R[-1]C-(ABS(R[-41]C-MRO)+(R[-41]C-MRO))/2,-MEP)-(MNR-MEP),0,MIN(R[-1]C,MEP-R[-41]C),1))) -> 211 | R49: =IF(R8C>MEP-1,0,SUM(OFFSET(R[-4]C,MAX(-R[-1]C-(ABS(R[-41]C-MRO)+(R[-41]C-MRO))/2,-MEP)-(MNR-MEP),0,MIN(R[-1]C,MEP-R[-41]C),1))) -> 107 | S49: =IF(R8C>MEP-1,0,SUM(OFFSET(R[-4]C,MAX(-R[-1]C-(ABS(R[-41]C-MRO)+(R[-41]C-MRO))/2,-MEP)-(MNR-MEP),0,MIN(R[-1]C,MEP-R[-41]C),1))) -> 998 | T49: =IF(R8C>MEP-1,0,SUM(OFFSET(R[-4]C,MAX(-R[-1]C-(ABS(R[-41]C-MRO)+(R[-41]C-MRO))/2,-MEP)-(MNR-MEP),0,MIN(R[-1]C,MEP-R[-41]C),1))) -> 583 | U49: =IF(R8C>MEP-1,0,SUM(OFFSET(R[-4]C,MAX(-R[-1]C-(ABS(R[-41]C-MRO)+(R[-41]C-MRO))/2,-MEP)-(MNR-MEP),0,MIN(R[-1]C,MEP-R[-41]C),1))) -> 534 | V49: =IF(R8C>MEP-1,0,SUM(OFFSET(R[-4]C,MAX(-R[-1]C-(ABS(R[-41]C-MRO)+(R[-41]C-MRO))/2,-MEP)-(MNR-MEP),0,MIN(R[-1]C,MEP-R[-41]C),1))) -> 306 | W49: =IF(R8C>MEP-1,0,SUM(OFFSET(R[-4]C,MAX(-R[-1]C-(ABS(R[-41]C-MRO)+(R[-41]C-MRO))/2,-MEP)-(MNR-MEP),0,MIN(R[-1]C,MEP-R[-41]C),1))) -> 9 | X49: =IF(R8C>MEP-1,0,SUM(OFFSET(R[-4]C,MAX(-R[-1]C-(ABS(R[-41]C-MRO)+(R[-41]C-MRO))/2,-MEP)-(MNR-MEP),0,MIN(R[-1]C,MEP-R[-41]C),1))) -> 0 | Y49: =IF(R8C>MEP-1,0,SUM(OFFSET(R[-4]C,MAX(-R[-1]C-(ABS(R[-41]C-MRO)+(R[-41]C-MRO))/2,-MEP)-(MNR-MEP),0,MIN(R[-1]C,MEP-R[-41]C),1))) -> 0 | Z49: =IF(R8C>MEP-1,0,SUM(OFFSET(R[-4]C,MAX(-R[-1]C-(ABS(R[-41]C-MRO)+(R[-41]C-MRO))/2,-MEP)-(MNR-MEP),0,MIN(R[-1]C,MEP-R[-41]C),1))) -> 0 | AA49: =IF(R8C>MEP-1,0,SUM(OFFSET(R[-4]C,MAX(-R[-1]C-(ABS(R[-41]C-MRO)+(R[-41]C-MRO))/2,-MEP)-(MNR-MEP),0,MIN(R[-1]C,MEP-R[-41]C),1))) -> 0 | AB49: =IF(R8C>MEP-1,0,SUM(OFFSET(R[-4]C,MAX(-R[-1]C-(ABS(R[-41]C-MRO)+(R[-41]C-MRO))/2,-MEP)-(MNR-MEP),0,MIN(R[-1]C,MEP-R[-41]C),1))) -> 0 | AC49: =IF(R8C>MEP-1,0,SUM(OFFSET(R[-4]C,MAX(-R[-1]C-(ABS(R[-41]C-MRO)+(R[-41]C-MRO))/2,-MEP)-(MNR-MEP),0,MIN(R[-1]C,MEP-R[-41]C),1))) -> 0 | AD49: =IF(R8C>MEP-1,0,SUM(OFFSET(R[-4]C,MAX(-R[-1]C-(ABS(R[-41]C-MRO)+(R[-41]C-MRO))/2,-MEP)-(MNR-MEP),0,MIN(R[-1]C,MEP-R[-41]C),1))) -> 0 | AE49: =IF(R8C>MEP-1,0,SUM(OFFSET(R[-4]C,MAX(-R[-1]C-(ABS(R[-41]C-MRO)+(R[-41]C-MRO))/2,-MEP)-(MNR-MEP),0,MIN(R[-1]C,MEP-R[-41]C),1))) -> 0 | AF49: =IF(R8C>MEP-1,0,SUM(OFFSET(R[-4]C,MAX(-R[-1]C-(ABS(R[-41]C-MRO)+(R[-41]C-MRO))/2,-MEP)-(MNR-MEP),0,MIN(R[-1]C,MEP-R[-41]C),1))) -> 0 | AG49: =IF(R8C>MEP-1,0,SUM(OFFSET(R[-4]C,MAX(-R[-1]C-(ABS(R[-41]C-MRO)+(R[-41]C-MRO))/2,-MEP)-(MNR-MEP),0,MIN(R[-1]C,MEP-R[-41]C),1))) -> 0 | AH49: =IF(R8C>MEP-1,0,SUM(OFFSET(R[-4]C,MAX(-R[-1]C-(ABS(R[-41]C-MRO)+(R[-41]C-MRO))/2,-MEP)-(MNR-MEP),0,MIN(R[-1]C,MEP-R[-41]C),1))) -> 0 | AI49: =IF(R8C>MEP-1,0,SUM(OFFSET(R[-4]C,MAX(-R[-1]C-(ABS(R[-41]C-MRO)+(R[-41]C-MRO))/2,-MEP)-(MNR-MEP),0,MIN(R[-1]C,MEP-R[-41]C),1))) -> 0 | AJ49: =IF(R8C>MEP-1,0,SUM(OFFSET(R[-4]C,MAX(-R[-1]C-(ABS(R[-41]C-MRO)+(R[-41]C-MRO))/2,-MEP)-(MNR-MEP),0,MIN(R[-1]C,MEP-R[-41]C),1))) -> 0 | AK49: =IF(R8C>MEP-1,0,SUM(OFFSET(R[-4]C,MAX(-R[-1]C-(ABS(R[-41]C-MRO)+(R[-41]C-MRO))/2,-MEP)-(MNR-MEP),0,MIN(R[-1]C,MEP-R[-41]C),1))) -> 0 | AL49: =IF(R8C>MEP-1,0,SUM(OFFSET(R[-4]C,MAX(-R[-1]C-(ABS(R[-41]C-MRO)+(R[-41]C-MRO))/2,-MEP)-(MNR-MEP),0,MIN(R[-1]C,MEP-R[-41]C),1))) -> 0 | AM49: =IF(R8C>MEP-1,0,SUM(OFFSET(R[-4]C,MAX(-R[-1]C-(ABS(R[-41]C-MRO)+(R[-41]C-MRO))/2,-MEP)-(MNR-MEP),0,MIN(R[-1]C,MEP-R[-41]C),1))) -> 0 | AN49: =IF(R8C>MEP-1,0,SUM(OFFSET(R[-4]C,MAX(-R[-1]C-(ABS(R[-41]C-MRO)+(R[-41]C-MRO))/2,-MEP)-(MNR-MEP),0,MIN(R[-1]C,MEP-R[-41]C),1))) -> 0 | AO49: =IF(R8C>MEP-1,0,SUM(OFFSET(R[-4]C,MAX(-R[-1]C-(ABS(R[-41]C-MRO)+(R[-41]C-MRO))/2,-MEP)-(MNR-MEP),0,MIN(R[-1]C,MEP-R[-41]C),1))) -> 0
A50: B. Trended Claims ………………………………… | E50: =SUM(RC[1]:RC[36]) -> 268648.92959491507 | F50: =IF(R8C>MEP-1,0,SUMPRODUCT(OFFSET(R[-5]C,MAX(-R[-2]C-(ABS(R[-42]C-MRO)+(R[-42]C-MRO))/2,-MEP)-(MNR-MEP),0,MIN(R[-2]C,MEP-R[-42]C),1),OFFSET(R[-5]C2,MAX(-R[-2]C-(ABS(R[-42]C-MRO)+(R[-42]C-MRO))/2,-MEP)-(MNR-MEP),0,MIN(R[-2]C,MEP-R[-42]C),1))) -> 13561.211329807813 | G50: =IF(R8C>MEP-1,0,SUMPRODUCT(OFFSET(R[-5]C,MAX(-R[-2]C-(ABS(R[-42]C-MRO)+(R[-42]C-MRO))/2,-MEP)-(MNR-MEP),0,MIN(R[-2]C,MEP-R[-42]C),1),OFFSET(R[-5]C2,MAX(-R[-2]C-(ABS(R[-42]C-MRO)+(R[-42]C-MRO))/2,-MEP)-(MNR-MEP),0,MIN(R[-2]C,MEP-R[-42]C),1))) -> 79485.358129132277 | H50: =IF(R8C>MEP-1,0,SUMPRODUCT(OFFSET(R[-5]C,MAX(-R[-2]C-(ABS(R[-42]C-MRO)+(R[-42]C-MRO))/2,-MEP)-(MNR-MEP),0,MIN(R[-2]C,MEP-R[-42]C),1),OFFSET(R[-5]C2,MAX(-R[-2]C-(ABS(R[-42]C-MRO)+(R[-42]C-MRO))/2,-MEP)-(MNR-MEP),0,MIN(R[-2]C,MEP-R[-42]C),1))) -> 69396.836808589986 | I50: =IF(R8C>MEP-1,0,SUMPRODUCT(OFFSET(R[-5]C,MAX(-R[-2]C-(ABS(R[-42]C-MRO)+(R[-42]C-MRO))/2,-MEP)-(MNR-MEP),0,MIN(R[-2]C,MEP-R[-42]C),1),OFFSET(R[-5]C2,MAX(-R[-2]C-(ABS(R[-42]C-MRO)+(R[-42]C-MRO))/2,-MEP)-(MNR-MEP),0,MIN(R[-2]C,MEP-R[-42]C),1))) -> 35545.799250433192 | J50: =IF(R8C>MEP-1,0,SUMPRODUCT(OFFSET(R[-5]C,MAX(-R[-2]C-(ABS(R[-42]C-MRO)+(R[-42]C-MRO))/2,-MEP)-(MNR-MEP),0,MIN(R[-2]C,MEP-R[-42]C),1),OFFSET(R[-5]C2,MAX(-R[-2]C-(ABS(R[-42]C-MRO)+(R[-42]C-MRO))/2,-MEP)-(MNR-MEP),0,MIN(R[-2]C,MEP-R[-42]C),1))) -> 22406.619997568931 | K50: =IF(R8C>MEP-1,0,SUMPRODUCT(OFFSET(R[-5]C,MAX(-R[-2]C-(ABS(R[-42]C-MRO)+(R[-42]C-MRO))/2,-MEP)-(MNR-MEP),0,MIN(R[-2]C,MEP-R[-42]C),1),OFFSET(R[-5]C2,MAX(-R[-2]C-(ABS(R[-42]C-MRO)+(R[-42]C-MRO))/2,-MEP)-(MNR-MEP),0,MIN(R[-2]C,MEP-R[-42]C),1))) -> 25369.604080770794 | L50: =IF(R8C>MEP-1,0,SUMPRODUCT(OFFSET(R[-5]C,MAX(-R[-2]C-(ABS(R[-42]C-MRO)+(R[-42]C-MRO))/2,-MEP)-(MNR-MEP),0,MIN(R[-2]C,MEP-R[-42]C),1),OFFSET(R[-5]C2,MAX(-R[-2]C-(ABS(R[-42]C-MRO)+(R[-42]C-MRO))/2,-MEP)-(MNR-MEP),0,MIN(R[-2]C,MEP-R[-42]C),1))) -> 7120.4997161896299 | M50: =IF(R8C>MEP-1,0,SUMPRODUCT(OFFSET(R[-5]C,MAX(-R[-2]C-(ABS(R[-42]C-MRO)+(R[-42]C-MRO))/2,-MEP)-(MNR-MEP),0,MIN(R[-2]C,MEP-R[-42]C),1),OFFSET(R[-5]C2,MAX(-R[-2]C-(ABS(R[-42]C-MRO)+(R[-42]C-MRO))/2,-MEP)-(MNR-MEP),0,MIN(R[-2]C,MEP-R[-42]C),1))) -> 214.41903805930497 | N50: =IF(R8C>MEP-1,0,SUMPRODUCT(OFFSET(R[-5]C,MAX(-R[-2]C-(ABS(R[-42]C-MRO)+(R[-42]C-MRO))/2,-MEP)-(MNR-MEP),0,MIN(R[-2]C,MEP-R[-42]C),1),OFFSET(R[-5]C2,MAX(-R[-2]C-(ABS(R[-42]C-MRO)+(R[-42]C-MRO))/2,-MEP)-(MNR-MEP),0,MIN(R[-2]C,MEP-R[-42]C),1))) -> 2735.4533708186027 | O50: =IF(R8C>MEP-1,0,SUMPRODUCT(OFFSET(R[-5]C,MAX(-R[-2]C-(ABS(R[-42]C-MRO)+(R[-42]C-MRO))/2,-MEP)-(MNR-MEP),0,MIN(R[-2]C,MEP-R[-42]C),1),OFFSET(R[-5]C2,MAX(-R[-2]C-(ABS(R[-42]C-MRO)+(R[-42]C-MRO))/2,-MEP)-(MNR-MEP),0,MIN(R[-2]C,MEP-R[-42]C),1))) -> 9551.7027320495617 | P50: =IF(R8C>MEP-1,0,SUMPRODUCT(OFFSET(R[-5]C,MAX(-R[-2]C-(ABS(R[-42]C-MRO)+(R[-42]C-MRO))/2,-MEP)-(MNR-MEP),0,MIN(R[-2]C,MEP-R[-42]C),1),OFFSET(R[-5]C2,MAX(-R[-2]C-(ABS(R[-42]C-MRO)+(R[-42]C-MRO))/2,-MEP)-(MNR-MEP),0,MIN(R[-2]C,MEP-R[-42]C),1))) -> 298.3331116893155 | Q50: =IF(R8C>MEP-1,0,SUMPRODUCT(OFFSET(R[-5]C,MAX(-R[-2]C-(ABS(R[-42]C-MRO)+(R[-42]C-MRO))/2,-MEP)-(MNR-MEP),0,MIN(R[-2]C,MEP-R[-42]C),1),OFFSET(R[-5]C2,MAX(-R[-2]C-(ABS(R[-42]C-MRO)+(R[-42]C-MRO))/2,-MEP)-(MNR-MEP),0,MIN(R[-2]C,MEP-R[-42]C),1))) -> 223.65910536357853 | R50: =IF(R8C>MEP-1,0,SUMPRODUCT(OFFSET(R[-5]C,MAX(-R[-2]C-(ABS(R[-42]C-MRO)+(R[-42]C-MRO))/2,-MEP)-(MNR-MEP),0,MIN(R[-2]C,MEP-R[-42]C),1),OFFSET(R[-5]C2,MAX(-R[-2]C-(ABS(R[-42]C-MRO)+(R[-42]C-MRO))/2,-MEP)-(MNR-MEP),0,MIN(R[-2]C,MEP-R[-42]C),1))) -> 117.3818524349156 | S50: =IF(R8C>MEP-1,0,SUMPRODUCT(OFFSET(R[-5]C,MAX(-R[-2]C-(ABS(R[-42]C-MRO)+(R[-42]C-MRO))/2,-MEP)-(MNR-MEP),0,MIN(R[-2]C,MEP-R[-42]C),1),OFFSET(R[-5]C2,MAX(-R[-2]C-(ABS(R[-42]C-MRO)+(R[-42]C-MRO))/2,-MEP)-(MNR-MEP),0,MIN(R[-2]C,MEP-R[-42]C),1))) -> 1071.4831105046947 | T50: =IF(R8C>MEP-1,0,SUMPRODUCT(OFFSET(R[-5]C,MAX(-R[-2]C-(ABS(R[-42]C-MRO)+(R[-42]C-MRO))/2,-MEP)-(MNR-MEP),0,MIN(R[-2]C,MEP-R[-42]C),1),OFFSET(R[-5]C2,MAX(-R[-2]C-(ABS(R[-42]C-MRO)+(R[-42]C-MRO))/2,-MEP)-(MNR-MEP),0,MIN(R[-2]C,MEP-R[-42]C),1))) -> 625.75550867641732 | U50: =IF(R8C>MEP-1,0,SUMPRODUCT(OFFSET(R[-5]C,MAX(-R[-2]C-(ABS(R[-42]C-MRO)+(R[-42]C-MRO))/2,-MEP)-(MNR-MEP),0,MIN(R[-2]C,MEP-R[-42]C),1),OFFSET(R[-5]C2,MAX(-R[-2]C-(ABS(R[-42]C-MRO)+(R[-42]C-MRO))/2,-MEP)-(MNR-MEP),0,MIN(R[-2]C,MEP-R[-42]C),1))) -> 580.70829928687772 | V50: =IF(R8C>MEP-1,0,SUMPRODUCT(OFFSET(R[-5]C,MAX(-R[-2]C-(ABS(R[-42]C-MRO)+(R[-42]C-MRO))/2,-MEP)-(MNR-MEP),0,MIN(R[-2]C,MEP-R[-42]C),1),OFFSET(R[-5]C2,MAX(-R[-2]C-(ABS(R[-42]C-MRO)+(R[-42]C-MRO))/2,-MEP)-(MNR-MEP),0,MIN(R[-2]C,MEP-R[-42]C),1))) -> 334.33004406912801 | W50: =IF(R8C>MEP-1,0,SUMPRODUCT(OFFSET(R[-5]C,MAX(-R[-2]C-(ABS(R[-42]C-MRO)+(R[-42]C-MRO))/2,-MEP)-(MNR-MEP),0,MIN(R[-2]C,MEP-R[-42]C),1),OFFSET(R[-5]C2,MAX(-R[-2]C-(ABS(R[-42]C-MRO)+(R[-42]C-MRO))/2,-MEP)-(MNR-MEP),0,MIN(R[-2]C,MEP-R[-42]C),1))) -> 9.7741094700260653 | X50: =IF(R8C>MEP-1,0,SUMPRODUCT(OFFSET(R[-5]C,MAX(-R[-2]C-(ABS(R[-42]C-MRO)+(R[-42]C-MRO))/2,-MEP)-(MNR-MEP),0,MIN(R[-2]C,MEP-R[-42]C),1),OFFSET(R[-5]C2,MAX(-R[-2]C-(ABS(R[-42]C-MRO)+(R[-42]C-MRO))/2,-MEP)-(MNR-MEP),0,MIN(R[-2]C,MEP-R[-42]C),1))) -> 0 | Y50: =IF(R8C>MEP-1,0,SUMPRODUCT(OFFSET(R[-5]C,MAX(-R[-2]C-(ABS(R[-42]C-MRO)+(R[-42]C-MRO))/2,-MEP)-(MNR-MEP),0,MIN(R[-2]C,MEP-R[-42]C),1),OFFSET(R[-5]C2,MAX(-R[-2]C-(ABS(R[-42]C-MRO)+(R[-42]C-MRO))/2,-MEP)-(MNR-MEP),0,MIN(R[-2]C,MEP-R[-42]C),1))) -> 0 | Z50: =IF(R8C>MEP-1,0,SUMPRODUCT(OFFSET(R[-5]C,MAX(-R[-2]C-(ABS(R[-42]C-MRO)+(R[-42]C-MRO))/2,-MEP)-(MNR-MEP),0,MIN(R[-2]C,MEP-R[-42]C),1),OFFSET(R[-5]C2,MAX(-R[-2]C-(ABS(R[-42]C-MRO)+(R[-42]C-MRO))/2,-MEP)-(MNR-MEP),0,MIN(R[-2]C,MEP-R[-42]C),1))) -> 0 | AA50: =IF(R8C>MEP-1,0,SUMPRODUCT(OFFSET(R[-5]C,MAX(-R[-2]C-(ABS(R[-42]C-MRO)+(R[-42]C-MRO))/2,-MEP)-(MNR-MEP),0,MIN(R[-2]C,MEP-R[-42]C),1),OFFSET(R[-5]C2,MAX(-R[-2]C-(ABS(R[-42]C-MRO)+(R[-42]C-MRO))/2,-MEP)-(MNR-MEP),0,MIN(R[-2]C,MEP-R[-42]C),1))) -> 0 | AB50: =IF(R8C>MEP-1,0,SUMPRODUCT(OFFSET(R[-5]C,MAX(-R[-2]C-(ABS(R[-42]C-MRO)+(R[-42]C-MRO))/2,-MEP)-(MNR-MEP),0,MIN(R[-2]C,MEP-R[-42]C),1),OFFSET(R[-5]C2,MAX(-R[-2]C-(ABS(R[-42]C-MRO)+(R[-42]C-MRO))/2,-MEP)-(MNR-MEP),0,MIN(R[-2]C,MEP-R[-42]C),1))) -> 0 | AC50: =IF(R8C>MEP-1,0,SUMPRODUCT(OFFSET(R[-5]C,MAX(-R[-2]C-(ABS(R[-42]C-MRO)+(R[-42]C-MRO))/2,-MEP)-(MNR-MEP),0,MIN(R[-2]C,MEP-R[-42]C),1),OFFSET(R[-5]C2,MAX(-R[-2]C-(ABS(R[-42]C-MRO)+(R[-42]C-MRO))/2,-MEP)-(MNR-MEP),0,MIN(R[-2]C,MEP-R[-42]C),1))) -> 0 | AD50: =IF(R8C>MEP-1,0,SUMPRODUCT(OFFSET(R[-5]C,MAX(-R[-2]C-(ABS(R[-42]C-MRO)+(R[-42]C-MRO))/2,-MEP)-(MNR-MEP),0,MIN(R[-2]C,MEP-R[-42]C),1),OFFSET(R[-5]C2,MAX(-R[-2]C-(ABS(R[-42]C-MRO)+(R[-42]C-MRO))/2,-MEP)-(MNR-MEP),0,MIN(R[-2]C,MEP-R[-42]C),1))) -> 0 | AE50: =IF(R8C>MEP-1,0,SUMPRODUCT(OFFSET(R[-5]C,MAX(-R[-2]C-(ABS(R[-42]C-MRO)+(R[-42]C-MRO))/2,-MEP)-(MNR-MEP),0,MIN(R[-2]C,MEP-R[-42]C),1),OFFSET(R[-5]C2,MAX(-R[-2]C-(ABS(R[-42]C-MRO)+(R[-42]C-MRO))/2,-MEP)-(MNR-MEP),0,MIN(R[-2]C,MEP-R[-42]C),1))) -> 0 | AF50: =IF(R8C>MEP-1,0,SUMPRODUCT(OFFSET(R[-5]C,MAX(-R[-2]C-(ABS(R[-42]C-MRO)+(R[-42]C-MRO))/2,-MEP)-(MNR-MEP),0,MIN(R[-2]C,MEP-R[-42]C),1),OFFSET(R[-5]C2,MAX(-R[-2]C-(ABS(R[-42]C-MRO)+(R[-42]C-MRO))/2,-MEP)-(MNR-MEP),0,MIN(R[-2]C,MEP-R[-42]C),1))) -> 0 | AG50: =IF(R8C>MEP-1,0,SUMPRODUCT(OFFSET(R[-5]C,MAX(-R[-2]C-(ABS(R[-42]C-MRO)+(R[-42]C-MRO))/2,-MEP)-(MNR-MEP),0,MIN(R[-2]C,MEP-R[-42]C),1),OFFSET(R[-5]C2,MAX(-R[-2]C-(ABS(R[-42]C-MRO)+(R[-42]C-MRO))/2,-MEP)-(MNR-MEP),0,MIN(R[-2]C,MEP-R[-42]C),1))) -> 0 | AH50: =IF(R8C>MEP-1,0,SUMPRODUCT(OFFSET(R[-5]C,MAX(-R[-2]C-(ABS(R[-42]C-MRO)+(R[-42]C-MRO))/2,-MEP)-(MNR-MEP),0,MIN(R[-2]C,MEP-R[-42]C),1),OFFSET(R[-5]C2,MAX(-R[-2]C-(ABS(R[-42]C-MRO)+(R[-42]C-MRO))/2,-MEP)-(MNR-MEP),0,MIN(R[-2]C,MEP-R[-42]C),1))) -> 0 | AI50: =IF(R8C>MEP-1,0,SUMPRODUCT(OFFSET(R[-5]C,MAX(-R[-2]C-(ABS(R[-42]C-MRO)+(R[-42]C-MRO))/2,-MEP)-(MNR-MEP),0,MIN(R[-2]C,MEP-R[-42]C),1),OFFSET(R[-5]C2,MAX(-R[-2]C-(ABS(R[-42]C-MRO)+(R[-42]C-MRO))/2,-MEP)-(MNR-MEP),0,MIN(R[-2]C,MEP-R[-42]C),1))) -> 0 | AJ50: =IF(R8C>MEP-1,0,SUMPRODUCT(OFFSET(R[-5]C,MAX(-R[-2]C-(ABS(R[-42]C-MRO)+(R[-42]C-MRO))/2,-MEP)-(MNR-MEP),0,MIN(R[-2]C,MEP-R[-42]C),1),OFFSET(R[-5]C2,MAX(-R[-2]C-(ABS(R[-42]C-MRO)+(R[-42]C-MRO))/2,-MEP)-(MNR-MEP),0,MIN(R[-2]C,MEP-R[-42]C),1))) -> 0 | AK50: =IF(R8C>MEP-1,0,SUMPRODUCT(OFFSET(R[-5]C,MAX(-R[-2]C-(ABS(R[-42]C-MRO)+(R[-42]C-MRO))/2,-MEP)-(MNR-MEP),0,MIN(R[-2]C,MEP-R[-42]C),1),OFFSET(R[-5]C2,MAX(-R[-2]C-(ABS(R[-42]C-MRO)+(R[-42]C-MRO))/2,-MEP)-(MNR-MEP),0,MIN(R[-2]C,MEP-R[-42]C),1))) -> 0 | AL50: =IF(R8C>MEP-1,0,SUMPRODUCT(OFFSET(R[-5]C,MAX(-R[-2]C-(ABS(R[-42]C-MRO)+(R[-42]C-MRO))/2,-MEP)-(MNR-MEP),0,MIN(R[-2]C,MEP-R[-42]C),1),OFFSET(R[-5]C2,MAX(-R[-2]C-(ABS(R[-42]C-MRO)+(R[-42]C-MRO))/2,-MEP)-(MNR-MEP),0,MIN(R[-2]C,MEP-R[-42]C),1))) -> 0 | AM50: =IF(R8C>MEP-1,0,SUMPRODUCT(OFFSET(R[-5]C,MAX(-R[-2]C-(ABS(R[-42]C-MRO)+(R[-42]C-MRO))/2,-MEP)-(MNR-MEP),0,MIN(R[-2]C,MEP-R[-42]C),1),OFFSET(R[-5]C2,MAX(-R[-2]C-(ABS(R[-42]C-MRO)+(R[-42]C-MRO))/2,-MEP)-(MNR-MEP),0,MIN(R[-2]C,MEP-R[-42]C),1))) -> 0 | AN50: =IF(R8C>MEP-1,0,SUMPRODUCT(OFFSET(R[-5]C,MAX(-R[-2]C-(ABS(R[-42]C-MRO)+(R[-42]C-MRO))/2,-MEP)-(MNR-MEP),0,MIN(R[-2]C,MEP-R[-42]C),1),OFFSET(R[-5]C2,MAX(-R[-2]C-(ABS(R[-42]C-MRO)+(R[-42]C-MRO))/2,-MEP)-(MNR-MEP),0,MIN(R[-2]C,MEP-R[-42]C),1))) -> 0 | AO50: =IF(R8C>MEP-1,0,SUMPRODUCT(OFFSET(R[-5]C,MAX(-R[-2]C-(ABS(R[-42]C-MRO)+(R[-42]C-MRO))/2,-MEP)-(MNR-MEP),0,MIN(R[-2]C,MEP-R[-42]C),1),OFFSET(R[-5]C2,MAX(-R[-2]C-(ABS(R[-42]C-MRO)+(R[-42]C-MRO))/2,-MEP)-(MNR-MEP),0,MIN(R[-2]C,MEP-R[-42]C),1))) -> 0
A51: C. Exposure ………………………………………… | F51: =IF(R8C>MEP-1,0,SUM(OFFSET(R[-6]C3,MAX(-R[-3]C-(ABS(R[-43]C-MRO)+(R[-43]C-MRO))/2,-MEP)-(MNR-MEP),0,MIN(R[-3]C,MEP-R[-43]C),1))) -> 11266.073 | G51: =IF(R8C>MEP-1,0,SUM(OFFSET(R[-6]C3,MAX(-R[-3]C-(ABS(R[-43]C-MRO)+(R[-43]C-MRO))/2,-MEP)-(MNR-MEP),0,MIN(R[-3]C,MEP-R[-43]C),1))) -> 11284.34 | H51: =IF(R8C>MEP-1,0,SUM(OFFSET(R[-6]C3,MAX(-R[-3]C-(ABS(R[-43]C-MRO)+(R[-43]C-MRO))/2,-MEP)-(MNR-MEP),0,MIN(R[-3]C,MEP-R[-43]C),1))) -> 11360.851999999999 | I51: =IF(R8C>MEP-1,0,SUM(OFFSET(R[-6]C3,MAX(-R[-3]C-(ABS(R[-43]C-MRO)+(R[-43]C-MRO))/2,-MEP)-(MNR-MEP),0,MIN(R[-3]C,MEP-R[-43]C),1))) -> 11433.044 | J51: =IF(R8C>MEP-1,0,SUM(OFFSET(R[-6]C3,MAX(-R[-3]C-(ABS(R[-43]C-MRO)+(R[-43]C-MRO))/2,-MEP)-(MNR-MEP),0,MIN(R[-3]C,MEP-R[-43]C),1))) -> 11510.352000000001 | K51: =IF(R8C>MEP-1,0,SUM(OFFSET(R[-6]C3,MAX(-R[-3]C-(ABS(R[-43]C-MRO)+(R[-43]C-MRO))/2,-MEP)-(MNR-MEP),0,MIN(R[-3]C,MEP-R[-43]C),1))) -> 11559.235999999999 | L51: =IF(R8C>MEP-1,0,SUM(OFFSET(R[-6]C3,MAX(-R[-3]C-(ABS(R[-43]C-MRO)+(R[-43]C-MRO))/2,-MEP)-(MNR-MEP),0,MIN(R[-3]C,MEP-R[-43]C),1))) -> 11599.474 | M51: =IF(R8C>MEP-1,0,SUM(OFFSET(R[-6]C3,MAX(-R[-3]C-(ABS(R[-43]C-MRO)+(R[-43]C-MRO))/2,-MEP)-(MNR-MEP),0,MIN(R[-3]C,MEP-R[-43]C),1))) -> 11665.006000000001 | N51: =IF(R8C>MEP-1,0,SUM(OFFSET(R[-6]C3,MAX(-R[-3]C-(ABS(R[-43]C-MRO)+(R[-43]C-MRO))/2,-MEP)-(MNR-MEP),0,MIN(R[-3]C,MEP-R[-43]C),1))) -> 11765.189 | O51: =IF(R8C>MEP-1,0,SUM(OFFSET(R[-6]C3,MAX(-R[-3]C-(ABS(R[-43]C-MRO)+(R[-43]C-MRO))/2,-MEP)-(MNR-MEP),0,MIN(R[-3]C,MEP-R[-43]C),1))) -> 11874.029999999999 | P51: =IF(R8C>MEP-1,0,SUM(OFFSET(R[-6]C3,MAX(-R[-3]C-(ABS(R[-43]C-MRO)+(R[-43]C-MRO))/2,-MEP)-(MNR-MEP),0,MIN(R[-3]C,MEP-R[-43]C),1))) -> 11966.257999999998 | Q51: =IF(R8C>MEP-1,0,SUM(OFFSET(R[-6]C3,MAX(-R[-3]C-(ABS(R[-43]C-MRO)+(R[-43]C-MRO))/2,-MEP)-(MNR-MEP),0,MIN(R[-3]C,MEP-R[-43]C),1))) -> 12066.181999999999 | R51: =IF(R8C>MEP-1,0,SUM(OFFSET(R[-6]C3,MAX(-R[-3]C-(ABS(R[-43]C-MRO)+(R[-43]C-MRO))/2,-MEP)-(MNR-MEP),0,MIN(R[-3]C,MEP-R[-43]C),1))) -> 12106.623 | S51: =IF(R8C>MEP-1,0,SUM(OFFSET(R[-6]C3,MAX(-R[-3]C-(ABS(R[-43]C-MRO)+(R[-43]C-MRO))/2,-MEP)-(MNR-MEP),0,MIN(R[-3]C,MEP-R[-43]C),1))) -> 12101.947 | T51: =IF(R8C>MEP-1,0,SUM(OFFSET(R[-6]C3,MAX(-R[-3]C-(ABS(R[-43]C-MRO)+(R[-43]C-MRO))/2,-MEP)-(MNR-MEP),0,MIN(R[-3]C,MEP-R[-43]C),1))) -> 12088.512000000001 | U51: =IF(R8C>MEP-1,0,SUM(OFFSET(R[-6]C3,MAX(-R[-3]C-(ABS(R[-43]C-MRO)+(R[-43]C-MRO))/2,-MEP)-(MNR-MEP),0,MIN(R[-3]C,MEP-R[-43]C),1))) -> 12038.575999999999 | V51: =IF(R8C>MEP-1,0,SUM(OFFSET(R[-6]C3,MAX(-R[-3]C-(ABS(R[-43]C-MRO)+(R[-43]C-MRO))/2,-MEP)-(MNR-MEP),0,MIN(R[-3]C,MEP-R[-43]C),1))) -> 12029.492999999999 | W51: =IF(R8C>MEP-1,0,SUM(OFFSET(R[-6]C3,MAX(-R[-3]C-(ABS(R[-43]C-MRO)+(R[-43]C-MRO))/2,-MEP)-(MNR-MEP),0,MIN(R[-3]C,MEP-R[-43]C),1))) -> 12042.186000000002 | X51: =IF(R8C>MEP-1,0,SUM(OFFSET(R[-6]C3,MAX(-R[-3]C-(ABS(R[-43]C-MRO)+(R[-43]C-MRO))/2,-MEP)-(MNR-MEP),0,MIN(R[-3]C,MEP-R[-43]C),1))) -> 11979.477000000001 | Y51: =IF(R8C>MEP-1,0,SUM(OFFSET(R[-6]C3,MAX(-R[-3]C-(ABS(R[-43]C-MRO)+(R[-43]C-MRO))/2,-MEP)-(MNR-MEP),0,MIN(R[-3]C,MEP-R[-43]C),1))) -> 11950.039000000001 | Z51: =IF(R8C>MEP-1,0,SUM(OFFSET(R[-6]C3,MAX(-R[-3]C-(ABS(R[-43]C-MRO)+(R[-43]C-MRO))/2,-MEP)-(MNR-MEP),0,MIN(R[-3]C,MEP-R[-43]C),1))) -> 11889.131000000001 | AA51: =IF(R8C>MEP-1,0,SUM(OFFSET(R[-6]C3,MAX(-R[-3]C-(ABS(R[-43]C-MRO)+(R[-43]C-MRO))/2,-MEP)-(MNR-MEP),0,MIN(R[-3]C,MEP-R[-43]C),1))) -> 11705.434000000001 | AB51: =IF(R8C>MEP-1,0,SUM(OFFSET(R[-6]C3,MAX(-R[-3]C-(ABS(R[-43]C-MRO)+(R[-43]C-MRO))/2,-MEP)-(MNR-MEP),0,MIN(R[-3]C,MEP-R[-43]C),1))) -> 11603.005999999999 | AC51: =IF(R8C>MEP-1,0,SUM(OFFSET(R[-6]C3,MAX(-R[-3]C-(ABS(R[-43]C-MRO)+(R[-43]C-MRO))/2,-MEP)-(MNR-MEP),0,MIN(R[-3]C,MEP-R[-43]C),1))) -> 11503.147000000001 | AD51: =IF(R8C>MEP-1,0,SUM(OFFSET(R[-6]C3,MAX(-R[-3]C-(ABS(R[-43]C-MRO)+(R[-43]C-MRO))/2,-MEP)-(MNR-MEP),0,MIN(R[-3]C,MEP-R[-43]C),1))) -> 11455.701000000001 | AE51: =IF(R8C>MEP-1,0,SUM(OFFSET(R[-6]C3,MAX(-R[-3]C-(ABS(R[-43]C-MRO)+(R[-43]C-MRO))/2,-MEP)-(MNR-MEP),0,MIN(R[-3]C,MEP-R[-43]C),1))) -> 11454.891000000001 | AF51: =IF(R8C>MEP-1,0,SUM(OFFSET(R[-6]C3,MAX(-R[-3]C-(ABS(R[-43]C-MRO)+(R[-43]C-MRO))/2,-MEP)-(MNR-MEP),0,MIN(R[-3]C,MEP-R[-43]C),1))) -> 11430.594999999999 | AG51: =IF(R8C>MEP-1,0,SUM(OFFSET(R[-6]C3,MAX(-R[-3]C-(ABS(R[-43]C-MRO)+(R[-43]C-MRO))/2,-MEP)-(MNR-MEP),0,MIN(R[-3]C,MEP-R[-43]C),1))) -> 11391.630999999999 | AH51: =IF(R8C>MEP-1,0,SUM(OFFSET(R[-6]C3,MAX(-R[-3]C-(ABS(R[-43]C-MRO)+(R[-43]C-MRO))/2,-MEP)-(MNR-MEP),0,MIN(R[-3]C,MEP-R[-43]C),1))) -> 11307.723000000002 | AI51: =IF(R8C>MEP-1,0,SUM(OFFSET(R[-6]C3,MAX(-R[-3]C-(ABS(R[-43]C-MRO)+(R[-43]C-MRO))/2,-MEP)-(MNR-MEP),0,MIN(R[-3]C,MEP-R[-43]C),1))) -> 11258.901 | AJ51: =IF(R8C>MEP-1,0,SUM(OFFSET(R[-6]C3,MAX(-R[-3]C-(ABS(R[-43]C-MRO)+(R[-43]C-MRO))/2,-MEP)-(MNR-MEP),0,MIN(R[-3]C,MEP-R[-43]C),1))) -> 11170.482999999998 | AK51: =IF(R8C>MEP-1,0,SUM(OFFSET(R[-6]C3,MAX(-R[-3]C-(ABS(R[-43]C-MRO)+(R[-43]C-MRO))/2,-MEP)-(MNR-MEP),0,MIN(R[-3]C,MEP-R[-43]C),1))) -> 10999.188 | AL51: =IF(R8C>MEP-1,0,SUM(OFFSET(R[-6]C3,MAX(-R[-3]C-(ABS(R[-43]C-MRO)+(R[-43]C-MRO))/2,-MEP)-(MNR-MEP),0,MIN(R[-3]C,MEP-R[-43]C),1))) -> 10748.884999999998 | AM51: =IF(R8C>MEP-1,0,SUM(OFFSET(R[-6]C3,MAX(-R[-3]C-(ABS(R[-43]C-MRO)+(R[-43]C-MRO))/2,-MEP)-(MNR-MEP),0,MIN(R[-3]C,MEP-R[-43]C),1))) -> 7968.1309999999994 | AN51: =IF(R8C>MEP-1,0,SUM(OFFSET(R[-6]C3,MAX(-R[-3]C-(ABS(R[-43]C-MRO)+(R[-43]C-MRO))/2,-MEP)-(MNR-MEP),0,MIN(R[-3]C,MEP-R[-43]C),1))) -> 5239.9229999999998 | AO51: =IF(R8C>MEP-1,0,SUM(OFFSET(R[-6]C3,MAX(-R[-3]C-(ABS(R[-43]C-MRO)+(R[-43]C-MRO))/2,-MEP)-(MNR-MEP),0,MIN(R[-3]C,MEP-R[-43]C),1))) -> 2576.1559999999999
A52: D. Monthly Claim Costs …………………………… | E52: =SUM(RC[1]:RC[36]) -> 23.545917304512518 | F52: =IF(R[-1]C=0,0,R[-2]C/R[-1]C) -> 1.2037212371877772 | G52: =IF(R[-1]C=0,0,R[-2]C/R[-1]C) -> 7.043864163002203 | H52: =IF(R[-1]C=0,0,R[-2]C/R[-1]C) -> 6.1084183482532817 | I52: =IF(R[-1]C=0,0,R[-2]C/R[-1]C) -> 3.109040711330525 | J52: =IF(R[-1]C=0,0,R[-2]C/R[-1]C) -> 1.9466494158970056 | K52: =IF(R[-1]C=0,0,R[-2]C/R[-1]C) -> 2.1947474799174267 | L52: =IF(R[-1]C=0,0,R[-2]C/R[-1]C) -> 0.61386401798819756 | M52: =IF(R[-1]C=0,0,R[-2]C/R[-1]C) -> 1.8381391150532195E-2 | N52: =IF(R[-1]C=0,0,R[-2]C/R[-1]C) -> 0.23250398874328349 | O52: =IF(R[-1]C=0,0,R[-2]C/R[-1]C) -> 0.80441962265966671 | P52: =IF(R[-1]C=0,0,R[-2]C/R[-1]C) -> 2.4931195005933816E-2 | Q52: =IF(R[-1]C=0,0,R[-2]C/R[-1]C) -> 1.8536029488331815E-2 | R52: =IF(R[-1]C=0,0,R[-2]C/R[-1]C) -> 9.6956725616148785E-3 | S52: =IF(R[-1]C=0,0,R[-2]C/R[-1]C) -> 8.8538076600789495E-2 | T52: =IF(R[-1]C=0,0,R[-2]C/R[-1]C) -> 5.1764477602902433E-2 | U52: =IF(R[-1]C=0,0,R[-2]C/R[-1]C) -> 4.8237291460956656E-2 | V52: =IF(R[-1]C=0,0,R[-2]C/R[-1]C) -> 2.7792529915361193E-2 | W52: =IF(R[-1]C=0,0,R[-2]C/R[-1]C) -> 8.1165574672456184E-4 | X52: =IF(R[-1]C=0,0,R[-2]C/R[-1]C) -> 0 | Y52: =IF(R[-1]C=0,0,R[-2]C/R[-1]C) -> 0 | Z52: =IF(R[-1]C=0,0,R[-2]C/R[-1]C) -> 0 | AA52: =IF(R[-1]C=0,0,R[-2]C/R[-1]C) -> 0 | AB52: =IF(R[-1]C=0,0,R[-2]C/R[-1]C) -> 0 | AC52: =IF(R[-1]C=0,0,R[-2]C/R[-1]C) -> 0 | AD52: =IF(R[-1]C=0,0,R[-2]C/R[-1]C) -> 0 | AE52: =IF(R[-1]C=0,0,R[-2]C/R[-1]C) -> 0 | AF52: =IF(R[-1]C=0,0,R[-2]C/R[-1]C) -> 0 | AG52: =IF(R[-1]C=0,0,R[-2]C/R[-1]C) -> 0 | AH52: =IF(R[-1]C=0,0,R[-2]C/R[-1]C) -> 0 | AI52: =IF(R[-1]C=0,0,R[-2]C/R[-1]C) -> 0 | AJ52: =IF(R[-1]C=0,0,R[-2]C/R[-1]C) -> 0 | AK52: =IF(R[-1]C=0,0,R[-2]C/R[-1]C) -> 0 | AL52: =IF(R[-1]C=0,0,R[-2]C/R[-1]C) -> 0 | AM52: =IF(R[-1]C=0,0,R[-2]C/R[-1]C) -> 0 | AN52: =IF(R[-1]C=0,0,R[-2]C/R[-1]C) -> 0 | AO52: =IF(R[-1]C=0,0,R[-2]C/R[-1]C) -> 0
A53: E. Cumulative Costs ……………………………… | F53: =RC[-1]+R[-1]C -> 1.2037212371877772 | G53: =RC[-1]+R[-1]C -> 8.2475854001899798 | H53: =RC[-1]+R[-1]C -> 14.356003748443261 | I53: =RC[-1]+R[-1]C -> 17.465044459773786 | J53: =RC[-1]+R[-1]C -> 19.411693875670792 | K53: =RC[-1]+R[-1]C -> 21.60644135558822 | L53: =RC[-1]+R[-1]C -> 22.220305373576419 | M53: =RC[-1]+R[-1]C -> 22.238686764726953 | N53: =RC[-1]+R[-1]C -> 22.471190753470236 | O53: =RC[-1]+R[-1]C -> 23.275610376129901 | P53: =RC[-1]+R[-1]C -> 23.300541571135835 | Q53: =RC[-1]+R[-1]C -> 23.319077600624166 | R53: =RC[-1]+R[-1]C -> 23.328773273185782 | S53: =RC[-1]+R[-1]C -> 23.417311349786573 | T53: =RC[-1]+R[-1]C -> 23.469075827389474 | U53: =RC[-1]+R[-1]C -> 23.517313118850431 | V53: =RC[-1]+R[-1]C -> 23.545105648765794 | W53: =RC[-1]+R[-1]C -> 23.545917304512518 | X53: =RC[-1]+R[-1]C -> 23.545917304512518 | Y53: =RC[-1]+R[-1]C -> 23.545917304512518 | Z53: =RC[-1]+R[-1]C -> 23.545917304512518 | AA53: =RC[-1]+R[-1]C -> 23.545917304512518 | AB53: =RC[-1]+R[-1]C -> 23.545917304512518 | AC53: =RC[-1]+R[-1]C -> 23.545917304512518 | AD53: =RC[-1]+R[-1]C -> 23.545917304512518 | AE53: =RC[-1]+R[-1]C -> 23.545917304512518 | AF53: =RC[-1]+R[-1]C -> 23.545917304512518 | AG53: =RC[-1]+R[-1]C -> 23.545917304512518 | AH53: =RC[-1]+R[-1]C -> 23.545917304512518 | AI53: =RC[-1]+R[-1]C -> 23.545917304512518 | AJ53: =RC[-1]+R[-1]C -> 23.545917304512518 | AK53: =RC[-1]+R[-1]C -> 23.545917304512518 | AL53: =RC[-1]+R[-1]C -> 23.545917304512518 | AM53: =RC[-1]+R[-1]C -> 23.545917304512518 | AN53: =RC[-1]+R[-1]C -> 23.545917304512518 | AO53: =RC[-1]+R[-1]C -> 23.545917304512518
A54: F. Completion Factors …………………………… | F54: =IF(R[-2]C5=0,0,ROUND(R[-1]C/R[-2]C5,5)*CMF) -> 5.1119999999999999E-2 | G54: =IF(R[-2]C5=0,0,ROUND(R[-1]C/R[-2]C5,5)*CMF) -> 0.35027999999999998 | H54: =IF(R[-2]C5=0,0,ROUND(R[-1]C/R[-2]C5,5)*CMF) -> 0.60970000000000002 | I54: =IF(R[-2]C5=0,0,ROUND(R[-1]C/R[-2]C5,5)*CMF) -> 0.74173999999999995 | J54: =IF(R[-2]C5=0,0,ROUND(R[-1]C/R[-2]C5,5)*CMF) -> 0.82442000000000004 | K54: =IF(R[-2]C5=0,0,ROUND(R[-1]C/R[-2]C5,5)*CMF) -> 0.91762999999999995 | L54: =IF(R[-2]C5=0,0,ROUND(R[-1]C/R[-2]C5,5)*CMF) -> 0.94369999999999998 | M54: =IF(R[-2]C5=0,0,ROUND(R[-1]C/R[-2]C5,5)*CMF) -> 0.94447999999999999 | N54: =IF(R[-2]C5=0,0,ROUND(R[-1]C/R[-2]C5,5)*CMF) -> 0.95435999999999999 | O54: =IF(R[-2]C5=0,0,ROUND(R[-1]C/R[-2]C5,5)*CMF) -> 0.98851999999999995 | P54: =IF(R[-2]C5=0,0,ROUND(R[-1]C/R[-2]C5,5)*CMF) -> 0.98958000000000002 | Q54: =IF(R[-2]C5=0,0,ROUND(R[-1]C/R[-2]C5,5)*CMF) -> 0.99036999999999997 | R54: =IF(R[-2]C5=0,0,ROUND(R[-1]C/R[-2]C5,5)*CMF) -> 0.99077999999999999 | S54: =IF(R[-2]C5=0,0,ROUND(R[-1]C/R[-2]C5,5)*CMF) -> 0.99453999999999998 | T54: =IF(R[-2]C5=0,0,ROUND(R[-1]C/R[-2]C5,5)*CMF) -> 0.99673999999999996 | U54: =IF(R[-2]C5=0,0,ROUND(R[-1]C/R[-2]C5,5)*CMF) -> 0.99878999999999996 | V54: =IF(R[-2]C5=0,0,ROUND(R[-1]C/R[-2]C5,5)*CMF) -> 0.99997000000000003 | W54: =IF(R[-2]C5=0,0,ROUND(R[-1]C/R[-2]C5,5)*CMF) -> 1 | X54: =IF(R[-2]C5=0,0,ROUND(R[-1]C/R[-2]C5,5)*CMF) -> 1 | Y54: =IF(R[-2]C5=0,0,ROUND(R[-1]C/R[-2]C5,5)*CMF) -> 1 | Z54: =IF(R[-2]C5=0,0,ROUND(R[-1]C/R[-2]C5,5)*CMF) -> 1 | AA54: =IF(R[-2]C5=0,0,ROUND(R[-1]C/R[-2]C5,5)*CMF) -> 1 | AB54: =IF(R[-2]C5=0,0,ROUND(R[-1]C/R[-2]C5,5)*CMF) -> 1 | AC54: =IF(R[-2]C5=0,0,ROUND(R[-1]C/R[-2]C5,5)*CMF) -> 1 | AD54: =IF(R[-2]C5=0,0,ROUND(R[-1]C/R[-2]C5,5)*CMF) -> 1 | AE54: =IF(R[-2]C5=0,0,ROUND(R[-1]C/R[-2]C5,5)*CMF) -> 1 | AF54: =IF(R[-2]C5=0,0,ROUND(R[-1]C/R[-2]C5,5)*CMF) -> 1 | AG54: =IF(R[-2]C5=0,0,ROUND(R[-1]C/R[-2]C5,5)*CMF) -> 1 | AH54: =IF(R[-2]C5=0,0,ROUND(R[-1]C/R[-2]C5,5)*CMF) -> 1 | AI54: =IF(R[-2]C5=0,0,ROUND(R[-1]C/R[-2]C5,5)*CMF) -> 1 | AJ54: =IF(R[-2]C5=0,0,ROUND(R[-1]C/R[-2]C5,5)*CMF) -> 1 | AK54: =IF(R[-2]C5=0,0,ROUND(R[-1]C/R[-2]C5,5)*CMF) -> 1 | AL54: =IF(R[-2]C5=0,0,ROUND(R[-1]C/R[-2]C5,5)*CMF) -> 1 | AM54: =IF(R[-2]C5=0,0,ROUND(R[-1]C/R[-2]C5,5)*CMF) -> 1 | AN54: =IF(R[-2]C5=0,0,ROUND(R[-1]C/R[-2]C5,5)*CMF) -> 1 | AO54: =IF(R[-2]C5=0,0,ROUND(R[-1]C/R[-2]C5,5)*CMF) -> 1
F56: =R[-49]C -> PAID CLAIMS / NUMBER OF MONTHS BETWEEN INCURRED AND PAID DATES
A57: Paid Month | D57: Total Paid | F57: =R[-49]C -> 0 | G57: =R[-49]C -> 1 | H57: =R[-49]C -> 2 | I57: =R[-49]C -> 3 | J57: =R[-49]C -> 4 | K57: =R[-49]C -> 5 | L57: =R[-49]C -> 6 | M57: =R[-49]C -> 7 | N57: =R[-49]C -> 8 | O57: =R[-49]C -> 9 | P57: =R[-49]C -> 10 | Q57: =R[-49]C -> 11 | R57: =R[-49]C -> 12 | S57: =R[-49]C -> 13 | T57: =R[-49]C -> 14 | U57: =R[-49]C -> 15 | V57: =R[-49]C -> 16 | W57: =R[-49]C -> 17 | X57: =R[-49]C -> 18 | Y57: =R[-49]C -> 19 | Z57: =R[-49]C -> 20 | AA57: =R[-49]C -> 21 | AB57: =R[-49]C -> 22 | AC57: =R[-49]C -> 23 | AD57: =R[-49]C -> 24 | AE57: =R[-49]C -> 25 | AF57: =R[-49]C -> 26 | AG57: =R[-49]C -> 27 | AH57: =R[-49]C -> 28 | AI57: =R[-49]C -> 29 | AJ57: =R[-49]C -> 30 | AK57: =R[-49]C -> 31 | AL57: =R[-49]C -> 32 | AM57: =R[-49]C -> 33 | AN57: =R[-49]C -> 34 | AO57: =R[-49]C -> 35
A58: =ExpDat -> 1998-08-01T00:00:00.000 | D58: =IF(RC1="","",SUM(RC[2]:RC[37])) -> 50333 | F58: =IF(RC1="","",IF(OR(R8C<=ROUND(DAYS360(ValDat,RC1,0)/30,0),R8C>ROUND(DAYS360(ExpDat,RC1,0)/30,0)),0,OFFSET(R45C,MAX(-MNR,ROUND(DAYS360(ValDat,RC1,0)/30,0)-R8C+MEP-MNR),0,1,1))) -> 50333 | G58: =IF(RC1="","",IF(OR(R8C<=ROUND(DAYS360(ValDat,RC1,0)/30,0),R8C>ROUND(DAYS360(ExpDat,RC1,0)/30,0)),0,OFFSET(R45C,MAX(-MNR,ROUND(DAYS360(ValDat,RC1,0)/30,0)-R8C+MEP-MNR),0,1,1))) -> 0 | H58: =IF(RC1="","",IF(OR(R8C<=ROUND(DAYS360(ValDat,RC1,0)/30,0),R8C>ROUND(DAYS360(ExpDat,RC1,0)/30,0)),0,OFFSET(R45C,MAX(-MNR,ROUND(DAYS360(ValDat,RC1,0)/30,0)-R8C+MEP-MNR),0,1,1))) -> 0 | I58: =IF(RC1="","",IF(OR(R8C<=ROUND(DAYS360(ValDat,RC1,0)/30,0),R8C>ROUND(DAYS360(ExpDat,RC1,0)/30,0)),0,OFFSET(R45C,MAX(-MNR,ROUND(DAYS360(ValDat,RC1,0)/30,0)-R8C+MEP-MNR),0,1,1))) -> 0 | J58: =IF(RC1="","",IF(OR(R8C<=ROUND(DAYS360(ValDat,RC1,0)/30,0),R8C>ROUND(DAYS360(ExpDat,RC1,0)/30,0)),0,OFFSET(R45C,MAX(-MNR,ROUND(DAYS360(ValDat,RC1,0)/30,0)-R8C+MEP-MNR),0,1,1))) -> 0 | K58: =IF(RC1="","",IF(OR(R8C<=ROUND(DAYS360(ValDat,RC1,0)/30,0),R8C>ROUND(DAYS360(ExpDat,RC1,0)/30,0)),0,OFFSET(R45C,MAX(-MNR,ROUND(DAYS360(ValDat,RC1,0)/30,0)-R8C+MEP-MNR),0,1,1))) -> 0 | L58: =IF(RC1="","",IF(OR(R8C<=ROUND(DAYS360(ValDat,RC1,0)/30,0),R8C>ROUND(DAYS360(ExpDat,RC1,0)/30,0)),0,OFFSET(R45C,MAX(-MNR,ROUND(DAYS360(ValDat,RC1,0)/30,0)-R8C+MEP-MNR),0,1,1))) -> 0 | M58: =IF(RC1="","",IF(OR(R8C<=ROUND(DAYS360(ValDat,RC1,0)/30,0),R8C>ROUND(DAYS360(ExpDat,RC1,0)/30,0)),0,OFFSET(R45C,MAX(-MNR,ROUND(DAYS360(ValDat,RC1,0)/30,0)-R8C+MEP-MNR),0,1,1))) -> 0 | N58: =IF(RC1="","",IF(OR(R8C<=ROUND(DAYS360(ValDat,RC1,0)/30,0),R8C>ROUND(DAYS360(ExpDat,RC1,0)/30,0)),0,OFFSET(R45C,MAX(-MNR,ROUND(DAYS360(ValDat,RC1,0)/30,0)-R8C+MEP-MNR),0,1,1))) -> 0 | O58: =IF(RC1="","",IF(OR(R8C<=ROUND(DAYS360(ValDat,RC1,0)/30,0),R8C>ROUND(DAYS360(ExpDat,RC1,0)/30,0)),0,OFFSET(R45C,MAX(-MNR,ROUND(DAYS360(ValDat,RC1,0)/30,0)-R8C+MEP-MNR),0,1,1))) -> 0 | P58: =IF(RC1="","",IF(OR(R8C<=ROUND(DAYS360(ValDat,RC1,0)/30,0),R8C>ROUND(DAYS360(ExpDat,RC1,0)/30,0)),0,OFFSET(R45C,MAX(-MNR,ROUND(DAYS360(ValDat,RC1,0)/30,0)-R8C+MEP-MNR),0,1,1))) -> 0 | Q58: =IF(RC1="","",IF(OR(R8C<=ROUND(DAYS360(ValDat,RC1,0)/30,0),R8C>ROUND(DAYS360(ExpDat,RC1,0)/30,0)),0,OFFSET(R45C,MAX(-MNR,ROUND(DAYS360(ValDat,RC1,0)/30,0)-R8C+MEP-MNR),0,1,1))) -> 0 | R58: =IF(RC1="","",IF(OR(R8C<=ROUND(DAYS360(ValDat,RC1,0)/30,0),R8C>ROUND(DAYS360(ExpDat,RC1,0)/30,0)),0,OFFSET(R45C,MAX(-MNR,ROUND(DAYS360(ValDat,RC1,0)/30,0)-R8C+MEP-MNR),0,1,1))) -> 0 | S58: =IF(RC1="","",IF(OR(R8C<=ROUND(DAYS360(ValDat,RC1,0)/30,0),R8C>ROUND(DAYS360(ExpDat,RC1,0)/30,0)),0,OFFSET(R45C,MAX(-MNR,ROUND(DAYS360(ValDat,RC1,0)/30,0)-R8C+MEP-MNR),0,1,1))) -> 0 | T58: =IF(RC1="","",IF(OR(R8C<=ROUND(DAYS360(ValDat,RC1,0)/30,0),R8C>ROUND(DAYS360(ExpDat,RC1,0)/30,0)),0,OFFSET(R45C,MAX(-MNR,ROUND(DAYS360(ValDat,RC1,0)/30,0)-R8C+MEP-MNR),0,1,1))) -> 0 | U58: =IF(RC1="","",IF(OR(R8C<=ROUND(DAYS360(ValDat,RC1,0)/30,0),R8C>ROUND(DAYS360(ExpDat,RC1,0)/30,0)),0,OFFSET(R45C,MAX(-MNR,ROUND(DAYS360(ValDat,RC1,0)/30,0)-R8C+MEP-MNR),0,1,1))) -> 0 | V58: =IF(RC1="","",IF(OR(R8C<=ROUND(DAYS360(ValDat,RC1,0)/30,0),R8C>ROUND(DAYS360(ExpDat,RC1,0)/30,0)),0,OFFSET(R45C,MAX(-MNR,ROUND(DAYS360(ValDat,RC1,0)/30,0)-R8C+MEP-MNR),0,1,1))) -> 0 | W58: =IF(RC1="","",IF(OR(R8C<=ROUND(DAYS360(ValDat,RC1,0)/30,0),R8C>ROUND(DAYS360(ExpDat,RC1,0)/30,0)),0,OFFSET(R45C,MAX(-MNR,ROUND(DAYS360(ValDat,RC1,0)/30,0)-R8C+MEP-MNR),0,1,1))) -> 0 | X58: =IF(RC1="","",IF(OR(R8C<=ROUND(DAYS360(ValDat,RC1,0)/30,0),R8C>ROUND(DAYS360(ExpDat,RC1,0)/30,0)),0,OFFSET(R45C,MAX(-MNR,ROUND(DAYS360(ValDat,RC1,0)/30,0)-R8C+MEP-MNR),0,1,1))) -> 0 | Y58: =IF(RC1="","",IF(OR(R8C<=ROUND(DAYS360(ValDat,RC1,0)/30,0),R8C>ROUND(DAYS360(ExpDat,RC1,0)/30,0)),0,OFFSET(R45C,MAX(-MNR,ROUND(DAYS360(ValDat,RC1,0)/30,0)-R8C+MEP-MNR),0,1,1))) -> 0 | Z58: =IF(RC1="","",IF(OR(R8C<=ROUND(DAYS360(ValDat,RC1,0)/30,0),R8C>ROUND(DAYS360(ExpDat,RC1,0)/30,0)),0,OFFSET(R45C,MAX(-MNR,ROUND(DAYS360(ValDat,RC1,0)/30,0)-R8C+MEP-MNR),0,1,1))) -> 0 | AA58: =IF(RC1="","",IF(OR(R8C<=ROUND(DAYS360(ValDat,RC1,0)/30,0),R8C>ROUND(DAYS360(ExpDat,RC1,0)/30,0)),0,OFFSET(R45C,MAX(-MNR,ROUND(DAYS360(ValDat,RC1,0)/30,0)-R8C+MEP-MNR),0,1,1))) -> 0 | AB58: =IF(RC1="","",IF(OR(R8C<=ROUND(DAYS360(ValDat,RC1,0)/30,0),R8C>ROUND(DAYS360(ExpDat,RC1,0)/30,0)),0,OFFSET(R45C,MAX(-MNR,ROUND(DAYS360(ValDat,RC1,0)/30,0)-R8C+MEP-MNR),0,1,1))) -> 0 | AC58: =IF(RC1="","",IF(OR(R8C<=ROUND(DAYS360(ValDat,RC1,0)/30,0),R8C>ROUND(DAYS360(ExpDat,RC1,0)/30,0)),0,OFFSET(R45C,MAX(-MNR,ROUND(DAYS360(ValDat,RC1,0)/30,0)-R8C+MEP-MNR),0,1,1))) -> 0 | AD58: =IF(RC1="","",IF(OR(R8C<=ROUND(DAYS360(ValDat,RC1,0)/30,0),R8C>ROUND(DAYS360(ExpDat,RC1,0)/30,0)),0,OFFSET(R45C,MAX(-MNR,ROUND(DAYS360(ValDat,RC1,0)/30,0)-R8C+MEP-MNR),0,1,1))) -> 0 | AE58: =IF(RC1="","",IF(OR(R8C<=ROUND(DAYS360(ValDat,RC1,0)/30,0),R8C>ROUND(DAYS360(ExpDat,RC1,0)/30,0)),0,OFFSET(R45C,MAX(-MNR,ROUND(DAYS360(ValDat,RC1,0)/30,0)-R8C+MEP-MNR),0,1,1))) -> 0 | AF58: =IF(RC1="","",IF(OR(R8C<=ROUND(DAYS360(ValDat,RC1,0)/30,0),R8C>ROUND(DAYS360(ExpDat,RC1,0)/30,0)),0,OFFSET(R45C,MAX(-MNR,ROUND(DAYS360(ValDat,RC1,0)/30,0)-R8C+MEP-MNR),0,1,1))) -> 0 | AG58: =IF(RC1="","",IF(OR(R8C<=ROUND(DAYS360(ValDat,RC1,0)/30,0),R8C>ROUND(DAYS360(ExpDat,RC1,0)/30,0)),0,OFFSET(R45C,MAX(-MNR,ROUND(DAYS360(ValDat,RC1,0)/30,0)-R8C+MEP-MNR),0,1,1))) -> 0 | AH58: =IF(RC1="","",IF(OR(R8C<=ROUND(DAYS360(ValDat,RC1,0)/30,0),R8C>ROUND(DAYS360(ExpDat,RC1,0)/30,0)),0,OFFSET(R45C,MAX(-MNR,ROUND(DAYS360(ValDat,RC1,0)/30,0)-R8C+MEP-MNR),0,1,1))) -> 0 | AI58: =IF(RC1="","",IF(OR(R8C<=ROUND(DAYS360(ValDat,RC1,0)/30,0),R8C>ROUND(DAYS360(ExpDat,RC1,0)/30,0)),0,OFFSET(R45C,MAX(-MNR,ROUND(DAYS360(ValDat,RC1,0)/30,0)-R8C+MEP-MNR),0,1,1))) -> 0 | AJ58: =IF(RC1="","",IF(OR(R8C<=ROUND(DAYS360(ValDat,RC1,0)/30,0),R8C>ROUND(DAYS360(ExpDat,RC1,0)/30,0)),0,OFFSET(R45C,MAX(-MNR,ROUND(DAYS360(ValDat,RC1,0)/30,0)-R8C+MEP-MNR),0,1,1))) -> 0 | AK58: =IF(RC1="","",IF(OR(R8C<=ROUND(DAYS360(ValDat,RC1,0)/30,0),R8C>ROUND(DAYS360(ExpDat,RC1,0)/30,0)),0,OFFSET(R45C,MAX(-MNR,ROUND(DAYS360(ValDat,RC1,0)/30,0)-R8C+MEP-MNR),0,1,1))) -> 0 | AL58: =IF(RC1="","",IF(OR(R8C<=ROUND(DAYS360(ValDat,RC1,0)/30,0),R8C>ROUND(DAYS360(ExpDat,RC1,0)/30,0)),0,OFFSET(R45C,MAX(-MNR,ROUND(DAYS360(ValDat,RC1,0)/30,0)-R8C+MEP-MNR),0,1,1))) -> 0 | AM58: =IF(RC1="","",IF(OR(R8C<=ROUND(DAYS360(ValDat,RC1,0)/30,0),R8C>ROUND(DAYS360(ExpDat,RC1,0)/30,0)),0,OFFSET(R45C,MAX(-MNR,ROUND(DAYS360(ValDat,RC1,0)/30,0)-R8C+MEP-MNR),0,1,1))) -> 0 | AN58: =IF(RC1="","",IF(OR(R8C<=ROUND(DAYS360(ValDat,RC1,0)/30,0),R8C>ROUND(DAYS360(ExpDat,RC1,0)/30,0)),0,OFFSET(R45C,MAX(-MNR,ROUND(DAYS360(ValDat,RC1,0)/30,0)-R8C+MEP-MNR),0,1,1))) -> 0 | AO58: =IF(RC1="","",IF(OR(R8C<=ROUND(DAYS360(ValDat,RC1,0)/30,0),R8C>ROUND(DAYS360(ExpDat,RC1,0)/30,0)),0,OFFSET(R45C,MAX(-MNR,ROUND(DAYS360(ValDat,RC1,0)/30,0)-R8C+MEP-MNR),0,1,1))) -> 0
A59: =IF(R[-1]C="","",IF(EOMONTH(R[-1]C,0)+1>RunDat,"",EOMONTH(R[-1]C,0)+1)) -> 1998-09-01T00:00:00.000 | D59: =IF(RC1="","",SUM(RC[2]:RC[37])) -> 50333 | F59: =IF(RC1="","",IF(OR(R8C<=ROUND(DAYS360(ValDat,RC1,0)/30,0),R8C>ROUND(DAYS360(ExpDat,RC1,0)/30,0)),0,OFFSET(R45C,MAX(-MNR,ROUND(DAYS360(ValDat,RC1,0)/30,0)-R8C+MEP-MNR),0,1,1))) -> 50333 | G59: =IF(RC1="","",IF(OR(R8C<=ROUND(DAYS360(ValDat,RC1,0)/30,0),R8C>ROUND(DAYS360(ExpDat,RC1,0)/30,0)),0,OFFSET(R45C,MAX(-MNR,ROUND(DAYS360(ValDat,RC1,0)/30,0)-R8C+MEP-MNR),0,1,1))) -> 0 | H59: =IF(RC1="","",IF(OR(R8C<=ROUND(DAYS360(ValDat,RC1,0)/30,0),R8C>ROUND(DAYS360(ExpDat,RC1,0)/30,0)),0,OFFSET(R45C,MAX(-MNR,ROUND(DAYS360(ValDat,RC1,0)/30,0)-R8C+MEP-MNR),0,1,1))) -> 0 | I59: =IF(RC1="","",IF(OR(R8C<=ROUND(DAYS360(ValDat,RC1,0)/30,0),R8C>ROUND(DAYS360(ExpDat,RC1,0)/30,0)),0,OFFSET(R45C,MAX(-MNR,ROUND(DAYS360(ValDat,RC1,0)/30,0)-R8C+MEP-MNR),0,1,1))) -> 0 | J59: =IF(RC1="","",IF(OR(R8C<=ROUND(DAYS360(ValDat,RC1,0)/30,0),R8C>ROUND(DAYS360(ExpDat,RC1,0)/30,0)),0,OFFSET(R45C,MAX(-MNR,ROUND(DAYS360(ValDat,RC1,0)/30,0)-R8C+MEP-MNR),0,1,1))) -> 0 | K59: =IF(RC1="","",IF(OR(R8C<=ROUND(DAYS360(ValDat,RC1,0)/30,0),R8C>ROUND(DAYS360(ExpDat,RC1,0)/30,0)),0,OFFSET(R45C,MAX(-MNR,ROUND(DAYS360(ValDat,RC1,0)/30,0)-R8C+MEP-MNR),0,1,1))) -> 0 | L59: =IF(RC1="","",IF(OR(R8C<=ROUND(DAYS360(ValDat,RC1,0)/30,0),R8C>ROUND(DAYS360(ExpDat,RC1,0)/30,0)),0,OFFSET(R45C,MAX(-MNR,ROUND(DAYS360(ValDat,RC1,0)/30,0)-R8C+MEP-MNR),0,1,1))) -> 0 | M59: =IF(RC1="","",IF(OR(R8C<=ROUND(DAYS360(ValDat,RC1,0)/30,0),R8C>ROUND(DAYS360(ExpDat,RC1,0)/30,0)),0,OFFSET(R45C,MAX(-MNR,ROUND(DAYS360(ValDat,RC1,0)/30,0)-R8C+MEP-MNR),0,1,1))) -> 0 | N59: =IF(RC1="","",IF(OR(R8C<=ROUND(DAYS360(ValDat,RC1,0)/30,0),R8C>ROUND(DAYS360(ExpDat,RC1,0)/30,0)),0,OFFSET(R45C,MAX(-MNR,ROUND(DAYS360(ValDat,RC1,0)/30,0)-R8C+MEP-MNR),0,1,1))) -> 0 | O59: =IF(RC1="","",IF(OR(R8C<=ROUND(DAYS360(ValDat,RC1,0)/30,0),R8C>ROUND(DAYS360(ExpDat,RC1,0)/30,0)),0,OFFSET(R45C,MAX(-MNR,ROUND(DAYS360(ValDat,RC1,0)/30,0)-R8C+MEP-MNR),0,1,1))) -> 0 | P59: =IF(RC1="","",IF(OR(R8C<=ROUND(DAYS360(ValDat,RC1,0)/30,0),R8C>ROUND(DAYS360(ExpDat,RC1,0)/30,0)),0,OFFSET(R45C,MAX(-MNR,ROUND(DAYS360(ValDat,RC1,0)/30,0)-R8C+MEP-MNR),0,1,1))) -> 0 | Q59: =IF(RC1="","",IF(OR(R8C<=ROUND(DAYS360(ValDat,RC1,0)/30,0),R8C>ROUND(DAYS360(ExpDat,RC1,0)/30,0)),0,OFFSET(R45C,MAX(-MNR,ROUND(DAYS360(ValDat,RC1,0)/30,0)-R8C+MEP-MNR),0,1,1))) -> 0 | R59: =IF(RC1="","",IF(OR(R8C<=ROUND(DAYS360(ValDat,RC1,0)/30,0),R8C>ROUND(DAYS360(ExpDat,RC1,0)/30,0)),0,OFFSET(R45C,MAX(-MNR,ROUND(DAYS360(ValDat,RC1,0)/30,0)-R8C+MEP-MNR),0,1,1))) -> 0 | S59: =IF(RC1="","",IF(OR(R8C<=ROUND(DAYS360(ValDat,RC1,0)/30,0),R8C>ROUND(DAYS360(ExpDat,RC1,0)/30,0)),0,OFFSET(R45C,MAX(-MNR,ROUND(DAYS360(ValDat,RC1,0)/30,0)-R8C+MEP-MNR),0,1,1))) -> 0 | T59: =IF(RC1="","",IF(OR(R8C<=ROUND(DAYS360(ValDat,RC1,0)/30,0),R8C>ROUND(DAYS360(ExpDat,RC1,0)/30,0)),0,OFFSET(R45C,MAX(-MNR,ROUND(DAYS360(ValDat,RC1,0)/30,0)-R8C+MEP-MNR),0,1,1))) -> 0 | U59: =IF(RC1="","",IF(OR(R8C<=ROUND(DAYS360(ValDat,RC1,0)/30,0),R8C>ROUND(DAYS360(ExpDat,RC1,0)/30,0)),0,OFFSET(R45C,MAX(-MNR,ROUND(DAYS360(ValDat,RC1,0)/30,0)-R8C+MEP-MNR),0,1,1))) -> 0 | V59: =IF(RC1="","",IF(OR(R8C<=ROUND(DAYS360(ValDat,RC1,0)/30,0),R8C>ROUND(DAYS360(ExpDat,RC1,0)/30,0)),0,OFFSET(R45C,MAX(-MNR,ROUND(DAYS360(ValDat,RC1,0)/30,0)-R8C+MEP-MNR),0,1,1))) -> 0 | W59: =IF(RC1="","",IF(OR(R8C<=ROUND(DAYS360(ValDat,RC1,0)/30,0),R8C>ROUND(DAYS360(ExpDat,RC1,0)/30,0)),0,OFFSET(R45C,MAX(-MNR,ROUND(DAYS360(ValDat,RC1,0)/30,0)-R8C+MEP-MNR),0,1,1))) -> 0 | X59: =IF(RC1="","",IF(OR(R8C<=ROUND(DAYS360(ValDat,RC1,0)/30,0),R8C>ROUND(DAYS360(ExpDat,RC1,0)/30,0)),0,OFFSET(R45C,MAX(-MNR,ROUND(DAYS360(ValDat,RC1,0)/30,0)-R8C+MEP-MNR),0,1,1))) -> 0 | Y59: =IF(RC1="","",IF(OR(R8C<=ROUND(DAYS360(ValDat,RC1,0)/30,0),R8C>ROUND(DAYS360(ExpDat,RC1,0)/30,0)),0,OFFSET(R45C,MAX(-MNR,ROUND(DAYS360(ValDat,RC1,0)/30,0)-R8C+MEP-MNR),0,1,1))) -> 0 | Z59: =IF(RC1="","",IF(OR(R8C<=ROUND(DAYS360(ValDat,RC1,0)/30,0),R8C>ROUND(DAYS360(ExpDat,RC1,0)/30,0)),0,OFFSET(R45C,MAX(-MNR,ROUND(DAYS360(ValDat,RC1,0)/30,0)-R8C+MEP-MNR),0,1,1))) -> 0 | AA59: =IF(RC1="","",IF(OR(R8C<=ROUND(DAYS360(ValDat,RC1,0)/30,0),R8C>ROUND(DAYS360(ExpDat,RC1,0)/30,0)),0,OFFSET(R45C,MAX(-MNR,ROUND(DAYS360(ValDat,RC1,0)/30,0)-R8C+MEP-MNR),0,1,1))) -> 0 | AB59: =IF(RC1="","",IF(OR(R8C<=ROUND(DAYS360(ValDat,RC1,0)/30,0),R8C>ROUND(DAYS360(ExpDat,RC1,0)/30,0)),0,OFFSET(R45C,MAX(-MNR,ROUND(DAYS360(ValDat,RC1,0)/30,0)-R8C+MEP-MNR),0,1,1))) -> 0 | AC59: =IF(RC1="","",IF(OR(R8C<=ROUND(DAYS360(ValDat,RC1,0)/30,0),R8C>ROUND(DAYS360(ExpDat,RC1,0)/30,0)),0,OFFSET(R45C,MAX(-MNR,ROUND(DAYS360(ValDat,RC1,0)/30,0)-R8C+MEP-MNR),0,1,1))) -> 0 | AD59: =IF(RC1="","",IF(OR(R8C<=ROUND(DAYS360(ValDat,RC1,0)/30,0),R8C>ROUND(DAYS360(ExpDat,RC1,0)/30,0)),0,OFFSET(R45C,MAX(-MNR,ROUND(DAYS360(ValDat,RC1,0)/30,0)-R8C+MEP-MNR),0,1,1))) -> 0 | AE59: =IF(RC1="","",IF(OR(R8C<=ROUND(DAYS360(ValDat,RC1,0)/30,0),R8C>ROUND(DAYS360(ExpDat,RC1,0)/30,0)),0,OFFSET(R45C,MAX(-MNR,ROUND(DAYS360(ValDat,RC1,0)/30,0)-R8C+MEP-MNR),0,1,1))) -> 0 | AF59: =IF(RC1="","",IF(OR(R8C<=ROUND(DAYS360(ValDat,RC1,0)/30,0),R8C>ROUND(DAYS360(ExpDat,RC1,0)/30,0)),0,OFFSET(R45C,MAX(-MNR,ROUND(DAYS360(ValDat,RC1,0)/30,0)-R8C+MEP-MNR),0,1,1))) -> 0 | AG59: =IF(RC1="","",IF(OR(R8C<=ROUND(DAYS360(ValDat,RC1,0)/30,0),R8C>ROUND(DAYS360(ExpDat,RC1,0)/30,0)),0,OFFSET(R45C,MAX(-MNR,ROUND(DAYS360(ValDat,RC1,0)/30,0)-R8C+MEP-MNR),0,1,1))) -> 0 | AH59: =IF(RC1="","",IF(OR(R8C<=ROUND(DAYS360(ValDat,RC1,0)/30,0),R8C>ROUND(DAYS360(ExpDat,RC1,0)/30,0)),0,OFFSET(R45C,MAX(-MNR,ROUND(DAYS360(ValDat,RC1,0)/30,0)-R8C+MEP-MNR),0,1,1))) -> 0 | AI59: =IF(RC1="","",IF(OR(R8C<=ROUND(DAYS360(ValDat,RC1,0)/30,0),R8C>ROUND(DAYS360(ExpDat,RC1,0)/30,0)),0,OFFSET(R45C,MAX(-MNR,ROUND(DAYS360(ValDat,RC1,0)/30,0)-R8C+MEP-MNR),0,1,1))) -> 0 | AJ59: =IF(RC1="","",IF(OR(R8C<=ROUND(DAYS360(ValDat,RC1,0)/30,0),R8C>ROUND(DAYS360(ExpDat,RC1,0)/30,0)),0,OFFSET(R45C,MAX(-MNR,ROUND(DAYS360(ValDat,RC1,0)/30,0)-R8C+MEP-MNR),0,1,1))) -> 0 | AK59: =IF(RC1="","",IF(OR(R8C<=ROUND(DAYS360(ValDat,RC1,0)/30,0),R8C>ROUND(DAYS360(ExpDat,RC1,0)/30,0)),0,OFFSET(R45C,MAX(-MNR,ROUND(DAYS360(ValDat,RC1,0)/30,0)-R8C+MEP-MNR),0,1,1))) -> 0 | AL59: =IF(RC1="","",IF(OR(R8C<=ROUND(DAYS360(ValDat,RC1,0)/30,0),R8C>ROUND(DAYS360(ExpDat,RC1,0)/30,0)),0,OFFSET(R45C,MAX(-MNR,ROUND(DAYS360(ValDat,RC1,0)/30,0)-R8C+MEP-MNR),0,1,1))) -> 0 | AM59: =IF(RC1="","",IF(OR(R8C<=ROUND(DAYS360(ValDat,RC1,0)/30,0),R8C>ROUND(DAYS360(ExpDat,RC1,0)/30,0)),0,OFFSET(R45C,MAX(-MNR,ROUND(DAYS360(ValDat,RC1,0)/30,0)-R8C+MEP-MNR),0,1,1))) -> 0 | AN59: =IF(RC1="","",IF(OR(R8C<=ROUND(DAYS360(ValDat,RC1,0)/30,0),R8C>ROUND(DAYS360(ExpDat,RC1,0)/30,0)),0,OFFSET(R45C,MAX(-MNR,ROUND(DAYS360(ValDat,RC1,0)/30,0)-R8C+MEP-MNR),0,1,1))) -> 0 | AO59: =IF(RC1="","",IF(OR(R8C<=ROUND(DAYS360(ValDat,RC1,0)/30,0),R8C>ROUND(DAYS360(ExpDat,RC1,0)/30,0)),0,OFFSET(R45C,MAX(-MNR,ROUND(DAYS360(ValDat,RC1,0)/30,0)-R8C+MEP-MNR),0,1,1))) -> 0
A60: =IF(R[-1]C="","",IF(EOMONTH(R[-1]C,0)+1>RunDat,"",EOMONTH(R[-1]C,0)+1)) -> 1998-10-01T00:00:00.000 | D60: =IF(RC1="","",SUM(RC[2]:RC[37])) -> 20337 | F60: =IF(RC1="","",IF(OR(R8C<=ROUND(DAYS360(ValDat,RC1,0)/30,0),R8C>ROUND(DAYS360(ExpDat,RC1,0)/30,0)),0,OFFSET(R45C,MAX(-MNR,ROUND(DAYS360(ValDat,RC1,0)/30,0)-R8C+MEP-MNR),0,1,1))) -> 20337 | G60: =IF(RC1="","",IF(OR(R8C<=ROUND(DAYS360(ValDat,RC1,0)/30,0),R8C>ROUND(DAYS360(ExpDat,RC1,0)/30,0)),0,OFFSET(R45C,MAX(-MNR,ROUND(DAYS360(ValDat,RC1,0)/30,0)-R8C+MEP-MNR),0,1,1))) -> 0 | H60: =IF(RC1="","",IF(OR(R8C<=ROUND(DAYS360(ValDat,RC1,0)/30,0),R8C>ROUND(DAYS360(ExpDat,RC1,0)/30,0)),0,OFFSET(R45C,MAX(-MNR,ROUND(DAYS360(ValDat,RC1,0)/30,0)-R8C+MEP-MNR),0,1,1))) -> 0 | I60: =IF(RC1="","",IF(OR(R8C<=ROUND(DAYS360(ValDat,RC1,0)/30,0),R8C>ROUND(DAYS360(ExpDat,RC1,0)/30,0)),0,OFFSET(R45C,MAX(-MNR,ROUND(DAYS360(ValDat,RC1,0)/30,0)-R8C+MEP-MNR),0,1,1))) -> 0 | J60: =IF(RC1="","",IF(OR(R8C<=ROUND(DAYS360(ValDat,RC1,0)/30,0),R8C>ROUND(DAYS360(ExpDat,RC1,0)/30,0)),0,OFFSET(R45C,MAX(-MNR,ROUND(DAYS360(ValDat,RC1,0)/30,0)-R8C+MEP-MNR),0,1,1))) -> 0 | K60: =IF(RC1="","",IF(OR(R8C<=ROUND(DAYS360(ValDat,RC1,0)/30,0),R8C>ROUND(DAYS360(ExpDat,RC1,0)/30,0)),0,OFFSET(R45C,MAX(-MNR,ROUND(DAYS360(ValDat,RC1,0)/30,0)-R8C+MEP-MNR),0,1,1))) -> 0 | L60: =IF(RC1="","",IF(OR(R8C<=ROUND(DAYS360(ValDat,RC1,0)/30,0),R8C>ROUND(DAYS360(ExpDat,RC1,0)/30,0)),0,OFFSET(R45C,MAX(-MNR,ROUND(DAYS360(ValDat,RC1,0)/30,0)-R8C+MEP-MNR),0,1,1))) -> 0 | M60: =IF(RC1="","",IF(OR(R8C<=ROUND(DAYS360(ValDat,RC1,0)/30,0),R8C>ROUND(DAYS360(ExpDat,RC1,0)/30,0)),0,OFFSET(R45C,MAX(-MNR,ROUND(DAYS360(ValDat,RC1,0)/30,0)-R8C+MEP-MNR),0,1,1))) -> 0 | N60: =IF(RC1="","",IF(OR(R8C<=ROUND(DAYS360(ValDat,RC1,0)/30,0),R8C>ROUND(DAYS360(ExpDat,RC1,0)/30,0)),0,OFFSET(R45C,MAX(-MNR,ROUND(DAYS360(ValDat,RC1,0)/30,0)-R8C+MEP-MNR),0,1,1))) -> 0 | O60: =IF(RC1="","",IF(OR(R8C<=ROUND(DAYS360(ValDat,RC1,0)/30,0),R8C>ROUND(DAYS360(ExpDat,RC1,0)/30,0)),0,OFFSET(R45C,MAX(-MNR,ROUND(DAYS360(ValDat,RC1,0)/30,0)-R8C+MEP-MNR),0,1,1))) -> 0 | P60: =IF(RC1="","",IF(OR(R8C<=ROUND(DAYS360(ValDat,RC1,0)/30,0),R8C>ROUND(DAYS360(ExpDat,RC1,0)/30,0)),0,OFFSET(R45C,MAX(-MNR,ROUND(DAYS360(ValDat,RC1,0)/30,0)-R8C+MEP-MNR),0,1,1))) -> 0 | Q60: =IF(RC1="","",IF(OR(R8C<=ROUND(DAYS360(ValDat,RC1,0)/30,0),R8C>ROUND(DAYS360(ExpDat,RC1,0)/30,0)),0,OFFSET(R45C,MAX(-MNR,ROUND(DAYS360(ValDat,RC1,0)/30,0)-R8C+MEP-MNR),0,1,1))) -> 0 | R60: =IF(RC1="","",IF(OR(R8C<=ROUND(DAYS360(ValDat,RC1,0)/30,0),R8C>ROUND(DAYS360(ExpDat,RC1,0)/30,0)),0,OFFSET(R45C,MAX(-MNR,ROUND(DAYS360(ValDat,RC1,0)/30,0)-R8C+MEP-MNR),0,1,1))) -> 0 | S60: =IF(RC1="","",IF(OR(R8C<=ROUND(DAYS360(ValDat,RC1,0)/30,0),R8C>ROUND(DAYS360(ExpDat,RC1,0)/30,0)),0,OFFSET(R45C,MAX(-MNR,ROUND(DAYS360(ValDat,RC1,0)/30,0)-R8C+MEP-MNR),0,1,1))) -> 0 | T60: =IF(RC1="","",IF(OR(R8C<=ROUND(DAYS360(ValDat,RC1,0)/30,0),R8C>ROUND(DAYS360(ExpDat,RC1,0)/30,0)),0,OFFSET(R45C,MAX(-MNR,ROUND(DAYS360(ValDat,RC1,0)/30,0)-R8C+MEP-MNR),0,1,1))) -> 0 | U60: =IF(RC1="","",IF(OR(R8C<=ROUND(DAYS360(ValDat,RC1,0)/30,0),R8C>ROUND(DAYS360(ExpDat,RC1,0)/30,0)),0,OFFSET(R45C,MAX(-MNR,ROUND(DAYS360(ValDat,RC1,0)/30,0)-R8C+MEP-MNR),0,1,1))) -> 0 | V60: =IF(RC1="","",IF(OR(R8C<=ROUND(DAYS360(ValDat,RC1,0)/30,0),R8C>ROUND(DAYS360(ExpDat,RC1,0)/30,0)),0,OFFSET(R45C,MAX(-MNR,ROUND(DAYS360(ValDat,RC1,0)/30,0)-R8C+MEP-MNR),0,1,1))) -> 0 | W60: =IF(RC1="","",IF(OR(R8C<=ROUND(DAYS360(ValDat,RC1,0)/30,0),R8C>ROUND(DAYS360(ExpDat,RC1,0)/30,0)),0,OFFSET(R45C,MAX(-MNR,ROUND(DAYS360(ValDat,RC1,0)/30,0)-R8C+MEP-MNR),0,1,1))) -> 0 | X60: =IF(RC1="","",IF(OR(R8C<=ROUND(DAYS360(ValDat,RC1,0)/30,0),R8C>ROUND(DAYS360(ExpDat,RC1,0)/30,0)),0,OFFSET(R45C,MAX(-MNR,ROUND(DAYS360(ValDat,RC1,0)/30,0)-R8C+MEP-MNR),0,1,1))) -> 0 | Y60: =IF(RC1="","",IF(OR(R8C<=ROUND(DAYS360(ValDat,RC1,0)/30,0),R8C>ROUND(DAYS360(ExpDat,RC1,0)/30,0)),0,OFFSET(R45C,MAX(-MNR,ROUND(DAYS360(ValDat,RC1,0)/30,0)-R8C+MEP-MNR),0,1,1))) -> 0 | Z60: =IF(RC1="","",IF(OR(R8C<=ROUND(DAYS360(ValDat,RC1,0)/30,0),R8C>ROUND(DAYS360(ExpDat,RC1,0)/30,0)),0,OFFSET(R45C,MAX(-MNR,ROUND(DAYS360(ValDat,RC1,0)/30,0)-R8C+MEP-MNR),0,1,1))) -> 0 | AA60: =IF(RC1="","",IF(OR(R8C<=ROUND(DAYS360(ValDat,RC1,0)/30,0),R8C>ROUND(DAYS360(ExpDat,RC1,0)/30,0)),0,OFFSET(R45C,MAX(-MNR,ROUND(DAYS360(ValDat,RC1,0)/30,0)-R8C+MEP-MNR),0,1,1))) -> 0 | AB60: =IF(RC1="","",IF(OR(R8C<=ROUND(DAYS360(ValDat,RC1,0)/30,0),R8C>ROUND(DAYS360(ExpDat,RC1,0)/30,0)),0,OFFSET(R45C,MAX(-MNR,ROUND(DAYS360(ValDat,RC1,0)/30,0)-R8C+MEP-MNR),0,1,1))) -> 0 | AC60: =IF(RC1="","",IF(OR(R8C<=ROUND(DAYS360(ValDat,RC1,0)/30,0),R8C>ROUND(DAYS360(ExpDat,RC1,0)/30,0)),0,OFFSET(R45C,MAX(-MNR,ROUND(DAYS360(ValDat,RC1,0)/30,0)-R8C+MEP-MNR),0,1,1))) -> 0 | AD60: =IF(RC1="","",IF(OR(R8C<=ROUND(DAYS360(ValDat,RC1,0)/30,0),R8C>ROUND(DAYS360(ExpDat,RC1,0)/30,0)),0,OFFSET(R45C,MAX(-MNR,ROUND(DAYS360(ValDat,RC1,0)/30,0)-R8C+MEP-MNR),0,1,1))) -> 0 | AE60: =IF(RC1="","",IF(OR(R8C<=ROUND(DAYS360(ValDat,RC1,0)/30,0),R8C>ROUND(DAYS360(ExpDat,RC1,0)/30,0)),0,OFFSET(R45C,MAX(-MNR,ROUND(DAYS360(ValDat,RC1,0)/30,0)-R8C+MEP-MNR),0,1,1))) -> 0 | AF60: =IF(RC1="","",IF(OR(R8C<=ROUND(DAYS360(ValDat,RC1,0)/30,0),R8C>ROUND(DAYS360(ExpDat,RC1,0)/30,0)),0,OFFSET(R45C,MAX(-MNR,ROUND(DAYS360(ValDat,RC1,0)/30,0)-R8C+MEP-MNR),0,1,1))) -> 0 | AG60: =IF(RC1="","",IF(OR(R8C<=ROUND(DAYS360(ValDat,RC1,0)/30,0),R8C>ROUND(DAYS360(ExpDat,RC1,0)/30,0)),0,OFFSET(R45C,MAX(-MNR,ROUND(DAYS360(ValDat,RC1,0)/30,0)-R8C+MEP-MNR),0,1,1))) -> 0 | AH60: =IF(RC1="","",IF(OR(R8C<=ROUND(DAYS360(ValDat,RC1,0)/30,0),R8C>ROUND(DAYS360(ExpDat,RC1,0)/30,0)),0,OFFSET(R45C,MAX(-MNR,ROUND(DAYS360(ValDat,RC1,0)/30,0)-R8C+MEP-MNR),0,1,1))) -> 0 | AI60: =IF(RC1="","",IF(OR(R8C<=ROUND(DAYS360(ValDat,RC1,0)/30,0),R8C>ROUND(DAYS360(ExpDat,RC1,0)/30,0)),0,OFFSET(R45C,MAX(-MNR,ROUND(DAYS360(ValDat,RC1,0)/30,0)-R8C+MEP-MNR),0,1,1))) -> 0 | AJ60: =IF(RC1="","",IF(OR(R8C<=ROUND(DAYS360(ValDat,RC1,0)/30,0),R8C>ROUND(DAYS360(ExpDat,RC1,0)/30,0)),0,OFFSET(R45C,MAX(-MNR,ROUND(DAYS360(ValDat,RC1,0)/30,0)-R8C+MEP-MNR),0,1,1))) -> 0 | AK60: =IF(RC1="","",IF(OR(R8C<=ROUND(DAYS360(ValDat,RC1,0)/30,0),R8C>ROUND(DAYS360(ExpDat,RC1,0)/30,0)),0,OFFSET(R45C,MAX(-MNR,ROUND(DAYS360(ValDat,RC1,0)/30,0)-R8C+MEP-MNR),0,1,1))) -> 0 | AL60: =IF(RC1="","",IF(OR(R8C<=ROUND(DAYS360(ValDat,RC1,0)/30,0),R8C>ROUND(DAYS360(ExpDat,RC1,0)/30,0)),0,OFFSET(R45C,MAX(-MNR,ROUND(DAYS360(ValDat,RC1,0)/30,0)-R8C+MEP-MNR),0,1,1))) -> 0 | AM60: =IF(RC1="","",IF(OR(R8C<=ROUND(DAYS360(ValDat,RC1,0)/30,0),R8C>ROUND(DAYS360(ExpDat,RC1,0)/30,0)),0,OFFSET(R45C,MAX(-MNR,ROUND(DAYS360(ValDat,RC1,0)/30,0)-R8C+MEP-MNR),0,1,1))) -> 0 | AN60: =IF(RC1="","",IF(OR(R8C<=ROUND(DAYS360(ValDat,RC1,0)/30,0),R8C>ROUND(DAYS360(ExpDat,RC1,0)/30,0)),0,OFFSET(R45C,MAX(-MNR,ROUND(DAYS360(ValDat,RC1,0)/30,0)-R8C+MEP-MNR),0,1,1))) -> 0 | AO60: =IF(RC1="","",IF(OR(R8C<=ROUND(DAYS360(ValDat,RC1,0)/30,0),R8C>ROUND(DAYS360(ExpDat,RC1,0)/30,0)),0,OFFSET(R45C,MAX(-MNR,ROUND(DAYS360(ValDat,RC1,0)/30,0)-R8C+MEP-MNR),0,1,1))) -> 0
A61: =IF(R[-1]C="","",IF(EOMONTH(R[-1]C,0)+1>RunDat,"",EOMONTH(R[-1]C,0)+1)) -> 1998-11-01T00:00:00.000 | D61: =IF(RC1="","",SUM(RC[2]:RC[37])) -> 216906 | F61: =IF(RC1="","",IF(OR(R8C<=ROUND(DAYS360(ValDat,RC1,0)/30,0),R8C>ROUND(DAYS360(ExpDat,RC1,0)/30,0)),0,OFFSET(R45C,MAX(-MNR,ROUND(DAYS360(ValDat,RC1,0)/30,0)-R8C+MEP-MNR),0,1,1))) -> 40479 | G61: =IF(RC1="","",IF(OR(R8C<=ROUND(DAYS360(ValDat,RC1,0)/30,0),R8C>ROUND(DAYS360(ExpDat,RC1,0)/30,0)),0,OFFSET(R45C,MAX(-MNR,ROUND(DAYS360(ValDat,RC1,0)/30,0)-R8C+MEP-MNR),0,1,1))) -> 176427 | H61: =IF(RC1="","",IF(OR(R8C<=ROUND(DAYS360(ValDat,RC1,0)/30,0),R8C>ROUND(DAYS360(ExpDat,RC1,0)/30,0)),0,OFFSET(R45C,MAX(-MNR,ROUND(DAYS360(ValDat,RC1,0)/30,0)-R8C+MEP-MNR),0,1,1))) -> 0 | I61: =IF(RC1="","",IF(OR(R8C<=ROUND(DAYS360(ValDat,RC1,0)/30,0),R8C>ROUND(DAYS360(ExpDat,RC1,0)/30,0)),0,OFFSET(R45C,MAX(-MNR,ROUND(DAYS360(ValDat,RC1,0)/30,0)-R8C+MEP-MNR),0,1,1))) -> 0 | J61: =IF(RC1="","",IF(OR(R8C<=ROUND(DAYS360(ValDat,RC1,0)/30,0),R8C>ROUND(DAYS360(ExpDat,RC1,0)/30,0)),0,OFFSET(R45C,MAX(-MNR,ROUND(DAYS360(ValDat,RC1,0)/30,0)-R8C+MEP-MNR),0,1,1))) -> 0 | K61: =IF(RC1="","",IF(OR(R8C<=ROUND(DAYS360(ValDat,RC1,0)/30,0),R8C>ROUND(DAYS360(ExpDat,RC1,0)/30,0)),0,OFFSET(R45C,MAX(-MNR,ROUND(DAYS360(ValDat,RC1,0)/30,0)-R8C+MEP-MNR),0,1,1))) -> 0 | L61: =IF(RC1="","",IF(OR(R8C<=ROUND(DAYS360(ValDat,RC1,0)/30,0),R8C>ROUND(DAYS360(ExpDat,RC1,0)/30,0)),0,OFFSET(R45C,MAX(-MNR,ROUND(DAYS360(ValDat,RC1,0)/30,0)-R8C+MEP-MNR),0,1,1))) -> 0 | M61: =IF(RC1="","",IF(OR(R8C<=ROUND(DAYS360(ValDat,RC1,0)/30,0),R8C>ROUND(DAYS360(ExpDat,RC1,0)/30,0)),0,OFFSET(R45C,MAX(-MNR,ROUND(DAYS360(ValDat,RC1,0)/30,0)-R8C+MEP-MNR),0,1,1))) -> 0 | N61: =IF(RC1="","",IF(OR(R8C<=ROUND(DAYS360(ValDat,RC1,0)/30,0),R8C>ROUND(DAYS360(ExpDat,RC1,0)/30,0)),0,OFFSET(R45C,MAX(-MNR,ROUND(DAYS360(ValDat,RC1,0)/30,0)-R8C+MEP-MNR),0,1,1))) -> 0 | O61: =IF(RC1="","",IF(OR(R8C<=ROUND(DAYS360(ValDat,RC1,0)/30,0),R8C>ROUND(DAYS360(ExpDat,RC1,0)/30,0)),0,OFFSET(R45C,MAX(-MNR,ROUND(DAYS360(ValDat,RC1,0)/30,0)-R8C+MEP-MNR),0,1,1))) -> 0 | P61: =IF(RC1="","",IF(OR(R8C<=ROUND(DAYS360(ValDat,RC1,0)/30,0),R8C>ROUND(DAYS360(ExpDat,RC1,0)/30,0)),0,OFFSET(R45C,MAX(-MNR,ROUND(DAYS360(ValDat,RC1,0)/30,0)-R8C+MEP-MNR),0,1,1))) -> 0 | Q61: =IF(RC1="","",IF(OR(R8C<=ROUND(DAYS360(ValDat,RC1,0)/30,0),R8C>ROUND(DAYS360(ExpDat,RC1,0)/30,0)),0,OFFSET(R45C,MAX(-MNR,ROUND(DAYS360(ValDat,RC1,0)/30,0)-R8C+MEP-MNR),0,1,1))) -> 0 | R61: =IF(RC1="","",IF(OR(R8C<=ROUND(DAYS360(ValDat,RC1,0)/30,0),R8C>ROUND(DAYS360(ExpDat,RC1,0)/30,0)),0,OFFSET(R45C,MAX(-MNR,ROUND(DAYS360(ValDat,RC1,0)/30,0)-R8C+MEP-MNR),0,1,1))) -> 0 | S61: =IF(RC1="","",IF(OR(R8C<=ROUND(DAYS360(ValDat,RC1,0)/30,0),R8C>ROUND(DAYS360(ExpDat,RC1,0)/30,0)),0,OFFSET(R45C,MAX(-MNR,ROUND(DAYS360(ValDat,RC1,0)/30,0)-R8C+MEP-MNR),0,1,1))) -> 0 | T61: =IF(RC1="","",IF(OR(R8C<=ROUND(DAYS360(ValDat,RC1,0)/30,0),R8C>ROUND(DAYS360(ExpDat,RC1,0)/30,0)),0,OFFSET(R45C,MAX(-MNR,ROUND(DAYS360(ValDat,RC1,0)/30,0)-R8C+MEP-MNR),0,1,1))) -> 0 | U61: =IF(RC1="","",IF(OR(R8C<=ROUND(DAYS360(ValDat,RC1,0)/30,0),R8C>ROUND(DAYS360(ExpDat,RC1,0)/30,0)),0,OFFSET(R45C,MAX(-MNR,ROUND(DAYS360(ValDat,RC1,0)/30,0)-R8C+MEP-MNR),0,1,1))) -> 0 | V61: =IF(RC1="","",IF(OR(R8C<=ROUND(DAYS360(ValDat,RC1,0)/30,0),R8C>ROUND(DAYS360(ExpDat,RC1,0)/30,0)),0,OFFSET(R45C,MAX(-MNR,ROUND(DAYS360(ValDat,RC1,0)/30,0)-R8C+MEP-MNR),0,1,1))) -> 0 | W61: =IF(RC1="","",IF(OR(R8C<=ROUND(DAYS360(ValDat,RC1,0)/30,0),R8C>ROUND(DAYS360(ExpDat,RC1,0)/30,0)),0,OFFSET(R45C,MAX(-MNR,ROUND(DAYS360(ValDat,RC1,0)/30,0)-R8C+MEP-MNR),0,1,1))) -> 0 | X61: =IF(RC1="","",IF(OR(R8C<=ROUND(DAYS360(ValDat,RC1,0)/30,0),R8C>ROUND(DAYS360(ExpDat,RC1,0)/30,0)),0,OFFSET(R45C,MAX(-MNR,ROUND(DAYS360(ValDat,RC1,0)/30,0)-R8C+MEP-MNR),0,1,1))) -> 0 | Y61: =IF(RC1="","",IF(OR(R8C<=ROUND(DAYS360(ValDat,RC1,0)/30,0),R8C>ROUND(DAYS360(ExpDat,RC1,0)/30,0)),0,OFFSET(R45C,MAX(-MNR,ROUND(DAYS360(ValDat,RC1,0)/30,0)-R8C+MEP-MNR),0,1,1))) -> 0 | Z61: =IF(RC1="","",IF(OR(R8C<=ROUND(DAYS360(ValDat,RC1,0)/30,0),R8C>ROUND(DAYS360(ExpDat,RC1,0)/30,0)),0,OFFSET(R45C,MAX(-MNR,ROUND(DAYS360(ValDat,RC1,0)/30,0)-R8C+MEP-MNR),0,1,1))) -> 0 | AA61: =IF(RC1="","",IF(OR(R8C<=ROUND(DAYS360(ValDat,RC1,0)/30,0),R8C>ROUND(DAYS360(ExpDat,RC1,0)/30,0)),0,OFFSET(R45C,MAX(-MNR,ROUND(DAYS360(ValDat,RC1,0)/30,0)-R8C+MEP-MNR),0,1,1))) -> 0 | AB61: =IF(RC1="","",IF(OR(R8C<=ROUND(DAYS360(ValDat,RC1,0)/30,0),R8C>ROUND(DAYS360(ExpDat,RC1,0)/30,0)),0,OFFSET(R45C,MAX(-MNR,ROUND(DAYS360(ValDat,RC1,0)/30,0)-R8C+MEP-MNR),0,1,1))) -> 0 | AC61: =IF(RC1="","",IF(OR(R8C<=ROUND(DAYS360(ValDat,RC1,0)/30,0),R8C>ROUND(DAYS360(ExpDat,RC1,0)/30,0)),0,OFFSET(R45C,MAX(-MNR,ROUND(DAYS360(ValDat,RC1,0)/30,0)-R8C+MEP-MNR),0,1,1))) -> 0 | AD61: =IF(RC1="","",IF(OR(R8C<=ROUND(DAYS360(ValDat,RC1,0)/30,0),R8C>ROUND(DAYS360(ExpDat,RC1,0)/30,0)),0,OFFSET(R45C,MAX(-MNR,ROUND(DAYS360(ValDat,RC1,0)/30,0)-R8C+MEP-MNR),0,1,1))) -> 0 | AE61: =IF(RC1="","",IF(OR(R8C<=ROUND(DAYS360(ValDat,RC1,0)/30,0),R8C>ROUND(DAYS360(ExpDat,RC1,0)/30,0)),0,OFFSET(R45C,MAX(-MNR,ROUND(DAYS360(ValDat,RC1,0)/30,0)-R8C+MEP-MNR),0,1,1))) -> 0 | AF61: =IF(RC1="","",IF(OR(R8C<=ROUND(DAYS360(ValDat,RC1,0)/30,0),R8C>ROUND(DAYS360(ExpDat,RC1,0)/30,0)),0,OFFSET(R45C,MAX(-MNR,ROUND(DAYS360(ValDat,RC1,0)/30,0)-R8C+MEP-MNR),0,1,1))) -> 0 | AG61: =IF(RC1="","",IF(OR(R8C<=ROUND(DAYS360(ValDat,RC1,0)/30,0),R8C>ROUND(DAYS360(ExpDat,RC1,0)/30,0)),0,OFFSET(R45C,MAX(-MNR,ROUND(DAYS360(ValDat,RC1,0)/30,0)-R8C+MEP-MNR),0,1,1))) -> 0 | AH61: =IF(RC1="","",IF(OR(R8C<=ROUND(DAYS360(ValDat,RC1,0)/30,0),R8C>ROUND(DAYS360(ExpDat,RC1,0)/30,0)),0,OFFSET(R45C,MAX(-MNR,ROUND(DAYS360(ValDat,RC1,0)/30,0)-R8C+MEP-MNR),0,1,1))) -> 0 | AI61: =IF(RC1="","",IF(OR(R8C<=ROUND(DAYS360(ValDat,RC1,0)/30,0),R8C>ROUND(DAYS360(ExpDat,RC1,0)/30,0)),0,OFFSET(R45C,MAX(-MNR,ROUND(DAYS360(ValDat,RC1,0)/30,0)-R8C+MEP-MNR),0,1,1))) -> 0 | AJ61: =IF(RC1="","",IF(OR(R8C<=ROUND(DAYS360(ValDat,RC1,0)/30,0),R8C>ROUND(DAYS360(ExpDat,RC1,0)/30,0)),0,OFFSET(R45C,MAX(-MNR,ROUND(DAYS360(ValDat,RC1,0)/30,0)-R8C+MEP-MNR),0,1,1))) -> 0 | AK61: =IF(RC1="","",IF(OR(R8C<=ROUND(DAYS360(ValDat,RC1,0)/30,0),R8C>ROUND(DAYS360(ExpDat,RC1,0)/30,0)),0,OFFSET(R45C,MAX(-MNR,ROUND(DAYS360(ValDat,RC1,0)/30,0)-R8C+MEP-MNR),0,1,1))) -> 0 | AL61: =IF(RC1="","",IF(OR(R8C<=ROUND(DAYS360(ValDat,RC1,0)/30,0),R8C>ROUND(DAYS360(ExpDat,RC1,0)/30,0)),0,OFFSET(R45C,MAX(-MNR,ROUND(DAYS360(ValDat,RC1,0)/30,0)-R8C+MEP-MNR),0,1,1))) -> 0 | AM61: =IF(RC1="","",IF(OR(R8C<=ROUND(DAYS360(ValDat,RC1,0)/30,0),R8C>ROUND(DAYS360(ExpDat,RC1,0)/30,0)),0,OFFSET(R45C,MAX(-MNR,ROUND(DAYS360(ValDat,RC1,0)/30,0)-R8C+MEP-MNR),0,1,1))) -> 0 | AN61: =IF(RC1="","",IF(OR(R8C<=ROUND(DAYS360(ValDat,RC1,0)/30,0),R8C>ROUND(DAYS360(ExpDat,RC1,0)/30,0)),0,OFFSET(R45C,MAX(-MNR,ROUND(DAYS360(ValDat,RC1,0)/30,0)-R8C+MEP-MNR),0,1,1))) -> 0 | AO61: =IF(RC1="","",IF(OR(R8C<=ROUND(DAYS360(ValDat,RC1,0)/30,0),R8C>ROUND(DAYS360(ExpDat,RC1,0)/30,0)),0,OFFSET(R45C,MAX(-MNR,ROUND(DAYS360(ValDat,RC1,0)/30,0)-R8C+MEP-MNR),0,1,1))) -> 0
A62: =IF(R[-1]C="","",IF(EOMONTH(R[-1]C,0)+1>RunDat,"",EOMONTH(R[-1]C,0)+1)) -> 1998-12-01T00:00:00.000 | D62: =IF(RC1="","",SUM(RC[2]:RC[37])) -> 199817 | F62: =IF(RC1="","",IF(OR(R8C<=ROUND(DAYS360(ValDat,RC1,0)/30,0),R8C>ROUND(DAYS360(ExpDat,RC1,0)/30,0)),0,OFFSET(R45C,MAX(-MNR,ROUND(DAYS360(ValDat,RC1,0)/30,0)-R8C+MEP-MNR),0,1,1))) -> 15320 | G62: =IF(RC1="","",IF(OR(R8C<=ROUND(DAYS360(ValDat,RC1,0)/30,0),R8C>ROUND(DAYS360(ExpDat,RC1,0)/30,0)),0,OFFSET(R45C,MAX(-MNR,ROUND(DAYS360(ValDat,RC1,0)/30,0)-R8C+MEP-MNR),0,1,1))) -> 159677 | H62: =IF(RC1="","",IF(OR(R8C<=ROUND(DAYS360(ValDat,RC1,0)/30,0),R8C>ROUND(DAYS360(ExpDat,RC1,0)/30,0)),0,OFFSET(R45C,MAX(-MNR,ROUND(DAYS360(ValDat,RC1,0)/30,0)-R8C+MEP-MNR),0,1,1))) -> 24820 | I62: =IF(RC1="","",IF(OR(R8C<=ROUND(DAYS360(ValDat,RC1,0)/30,0),R8C>ROUND(DAYS360(ExpDat,RC1,0)/30,0)),0,OFFSET(R45C,MAX(-MNR,ROUND(DAYS360(ValDat,RC1,0)/30,0)-R8C+MEP-MNR),0,1,1))) -> 0 | J62: =IF(RC1="","",IF(OR(R8C<=ROUND(DAYS360(ValDat,RC1,0)/30,0),R8C>ROUND(DAYS360(ExpDat,RC1,0)/30,0)),0,OFFSET(R45C,MAX(-MNR,ROUND(DAYS360(ValDat,RC1,0)/30,0)-R8C+MEP-MNR),0,1,1))) -> 0 | K62: =IF(RC1="","",IF(OR(R8C<=ROUND(DAYS360(ValDat,RC1,0)/30,0),R8C>ROUND(DAYS360(ExpDat,RC1,0)/30,0)),0,OFFSET(R45C,MAX(-MNR,ROUND(DAYS360(ValDat,RC1,0)/30,0)-R8C+MEP-MNR),0,1,1))) -> 0 | L62: =IF(RC1="","",IF(OR(R8C<=ROUND(DAYS360(ValDat,RC1,0)/30,0),R8C>ROUND(DAYS360(ExpDat,RC1,0)/30,0)),0,OFFSET(R45C,MAX(-MNR,ROUND(DAYS360(ValDat,RC1,0)/30,0)-R8C+MEP-MNR),0,1,1))) -> 0 | M62: =IF(RC1="","",IF(OR(R8C<=ROUND(DAYS360(ValDat,RC1,0)/30,0),R8C>ROUND(DAYS360(ExpDat,RC1,0)/30,0)),0,OFFSET(R45C,MAX(-MNR,ROUND(DAYS360(ValDat,RC1,0)/30,0)-R8C+MEP-MNR),0,1,1))) -> 0 | N62: =IF(RC1="","",IF(OR(R8C<=ROUND(DAYS360(ValDat,RC1,0)/30,0),R8C>ROUND(DAYS360(ExpDat,RC1,0)/30,0)),0,OFFSET(R45C,MAX(-MNR,ROUND(DAYS360(ValDat,RC1,0)/30,0)-R8C+MEP-MNR),0,1,1))) -> 0 | O62: =IF(RC1="","",IF(OR(R8C<=ROUND(DAYS360(ValDat,RC1,0)/30,0),R8C>ROUND(DAYS360(ExpDat,RC1,0)/30,0)),0,OFFSET(R45C,MAX(-MNR,ROUND(DAYS360(ValDat,RC1,0)/30,0)-R8C+MEP-MNR),0,1,1))) -> 0 | P62: =IF(RC1="","",IF(OR(R8C<=ROUND(DAYS360(ValDat,RC1,0)/30,0),R8C>ROUND(DAYS360(ExpDat,RC1,0)/30,0)),0,OFFSET(R45C,MAX(-MNR,ROUND(DAYS360(ValDat,RC1,0)/30,0)-R8C+MEP-MNR),0,1,1))) -> 0 | Q62: =IF(RC1="","",IF(OR(R8C<=ROUND(DAYS360(ValDat,RC1,0)/30,0),R8C>ROUND(DAYS360(ExpDat,RC1,0)/30,0)),0,OFFSET(R45C,MAX(-MNR,ROUND(DAYS360(ValDat,RC1,0)/30,0)-R8C+MEP-MNR),0,1,1))) -> 0 | R62: =IF(RC1="","",IF(OR(R8C<=ROUND(DAYS360(ValDat,RC1,0)/30,0),R8C>ROUND(DAYS360(ExpDat,RC1,0)/30,0)),0,OFFSET(R45C,MAX(-MNR,ROUND(DAYS360(ValDat,RC1,0)/30,0)-R8C+MEP-MNR),0,1,1))) -> 0 | S62: =IF(RC1="","",IF(OR(R8C<=ROUND(DAYS360(ValDat,RC1,0)/30,0),R8C>ROUND(DAYS360(ExpDat,RC1,0)/30,0)),0,OFFSET(R45C,MAX(-MNR,ROUND(DAYS360(ValDat,RC1,0)/30,0)-R8C+MEP-MNR),0,1,1))) -> 0 | T62: =IF(RC1="","",IF(OR(R8C<=ROUND(DAYS360(ValDat,RC1,0)/30,0),R8C>ROUND(DAYS360(ExpDat,RC1,0)/30,0)),0,OFFSET(R45C,MAX(-MNR,ROUND(DAYS360(ValDat,RC1,0)/30,0)-R8C+MEP-MNR),0,1,1))) -> 0 | U62: =IF(RC1="","",IF(OR(R8C<=ROUND(DAYS360(ValDat,RC1,0)/30,0),R8C>ROUND(DAYS360(ExpDat,RC1,0)/30,0)),0,OFFSET(R45C,MAX(-MNR,ROUND(DAYS360(ValDat,RC1,0)/30,0)-R8C+MEP-MNR),0,1,1))) -> 0 | V62: =IF(RC1="","",IF(OR(R8C<=ROUND(DAYS360(ValDat,RC1,0)/30,0),R8C>ROUND(DAYS360(ExpDat,RC1,0)/30,0)),0,OFFSET(R45C,MAX(-MNR,ROUND(DAYS360(ValDat,RC1,0)/30,0)-R8C+MEP-MNR),0,1,1))) -> 0 | W62: =IF(RC1="","",IF(OR(R8C<=ROUND(DAYS360(ValDat,RC1,0)/30,0),R8C>ROUND(DAYS360(ExpDat,RC1,0)/30,0)),0,OFFSET(R45C,MAX(-MNR,ROUND(DAYS360(ValDat,RC1,0)/30,0)-R8C+MEP-MNR),0,1,1))) -> 0 | X62: =IF(RC1="","",IF(OR(R8C<=ROUND(DAYS360(ValDat,RC1,0)/30,0),R8C>ROUND(DAYS360(ExpDat,RC1,0)/30,0)),0,OFFSET(R45C,MAX(-MNR,ROUND(DAYS360(ValDat,RC1,0)/30,0)-R8C+MEP-MNR),0,1,1))) -> 0 | Y62: =IF(RC1="","",IF(OR(R8C<=ROUND(DAYS360(ValDat,RC1,0)/30,0),R8C>ROUND(DAYS360(ExpDat,RC1,0)/30,0)),0,OFFSET(R45C,MAX(-MNR,ROUND(DAYS360(ValDat,RC1,0)/30,0)-R8C+MEP-MNR),0,1,1))) -> 0 | Z62: =IF(RC1="","",IF(OR(R8C<=ROUND(DAYS360(ValDat,RC1,0)/30,0),R8C>ROUND(DAYS360(ExpDat,RC1,0)/30,0)),0,OFFSET(R45C,MAX(-MNR,ROUND(DAYS360(ValDat,RC1,0)/30,0)-R8C+MEP-MNR),0,1,1))) -> 0 | AA62: =IF(RC1="","",IF(OR(R8C<=ROUND(DAYS360(ValDat,RC1,0)/30,0),R8C>ROUND(DAYS360(ExpDat,RC1,0)/30,0)),0,OFFSET(R45C,MAX(-MNR,ROUND(DAYS360(ValDat,RC1,0)/30,0)-R8C+MEP-MNR),0,1,1))) -> 0 | AB62: =IF(RC1="","",IF(OR(R8C<=ROUND(DAYS360(ValDat,RC1,0)/30,0),R8C>ROUND(DAYS360(ExpDat,RC1,0)/30,0)),0,OFFSET(R45C,MAX(-MNR,ROUND(DAYS360(ValDat,RC1,0)/30,0)-R8C+MEP-MNR),0,1,1))) -> 0 | AC62: =IF(RC1="","",IF(OR(R8C<=ROUND(DAYS360(ValDat,RC1,0)/30,0),R8C>ROUND(DAYS360(ExpDat,RC1,0)/30,0)),0,OFFSET(R45C,MAX(-MNR,ROUND(DAYS360(ValDat,RC1,0)/30,0)-R8C+MEP-MNR),0,1,1))) -> 0 | AD62: =IF(RC1="","",IF(OR(R8C<=ROUND(DAYS360(ValDat,RC1,0)/30,0),R8C>ROUND(DAYS360(ExpDat,RC1,0)/30,0)),0,OFFSET(R45C,MAX(-MNR,ROUND(DAYS360(ValDat,RC1,0)/30,0)-R8C+MEP-MNR),0,1,1))) -> 0 | AE62: =IF(RC1="","",IF(OR(R8C<=ROUND(DAYS360(ValDat,RC1,0)/30,0),R8C>ROUND(DAYS360(ExpDat,RC1,0)/30,0)),0,OFFSET(R45C,MAX(-MNR,ROUND(DAYS360(ValDat,RC1,0)/30,0)-R8C+MEP-MNR),0,1,1))) -> 0 | AF62: =IF(RC1="","",IF(OR(R8C<=ROUND(DAYS360(ValDat,RC1,0)/30,0),R8C>ROUND(DAYS360(ExpDat,RC1,0)/30,0)),0,OFFSET(R45C,MAX(-MNR,ROUND(DAYS360(ValDat,RC1,0)/30,0)-R8C+MEP-MNR),0,1,1))) -> 0 | AG62: =IF(RC1="","",IF(OR(R8C<=ROUND(DAYS360(ValDat,RC1,0)/30,0),R8C>ROUND(DAYS360(ExpDat,RC1,0)/30,0)),0,OFFSET(R45C,MAX(-MNR,ROUND(DAYS360(ValDat,RC1,0)/30,0)-R8C+MEP-MNR),0,1,1))) -> 0 | AH62: =IF(RC1="","",IF(OR(R8C<=ROUND(DAYS360(ValDat,RC1,0)/30,0),R8C>ROUND(DAYS360(ExpDat,RC1,0)/30,0)),0,OFFSET(R45C,MAX(-MNR,ROUND(DAYS360(ValDat,RC1,0)/30,0)-R8C+MEP-MNR),0,1,1))) -> 0 | AI62: =IF(RC1="","",IF(OR(R8C<=ROUND(DAYS360(ValDat,RC1,0)/30,0),R8C>ROUND(DAYS360(ExpDat,RC1,0)/30,0)),0,OFFSET(R45C,MAX(-MNR,ROUND(DAYS360(ValDat,RC1,0)/30,0)-R8C+MEP-MNR),0,1,1))) -> 0 | AJ62: =IF(RC1="","",IF(OR(R8C<=ROUND(DAYS360(ValDat,RC1,0)/30,0),R8C>ROUND(DAYS360(ExpDat,RC1,0)/30,0)),0,OFFSET(R45C,MAX(-MNR,ROUND(DAYS360(ValDat,RC1,0)/30,0)-R8C+MEP-MNR),0,1,1))) -> 0 | AK62: =IF(RC1="","",IF(OR(R8C<=ROUND(DAYS360(ValDat,RC1,0)/30,0),R8C>ROUND(DAYS360(ExpDat,RC1,0)/30,0)),0,OFFSET(R45C,MAX(-MNR,ROUND(DAYS360(ValDat,RC1,0)/30,0)-R8C+MEP-MNR),0,1,1))) -> 0 | AL62: =IF(RC1="","",IF(OR(R8C<=ROUND(DAYS360(ValDat,RC1,0)/30,0),R8C>ROUND(DAYS360(ExpDat,RC1,0)/30,0)),0,OFFSET(R45C,MAX(-MNR,ROUND(DAYS360(ValDat,RC1,0)/30,0)-R8C+MEP-MNR),0,1,1))) -> 0 | AM62: =IF(RC1="","",IF(OR(R8C<=ROUND(DAYS360(ValDat,RC1,0)/30,0),R8C>ROUND(DAYS360(ExpDat,RC1,0)/30,0)),0,OFFSET(R45C,MAX(-MNR,ROUND(DAYS360(ValDat,RC1,0)/30,0)-R8C+MEP-MNR),0,1,1))) -> 0 | AN62: =IF(RC1="","",IF(OR(R8C<=ROUND(DAYS360(ValDat,RC1,0)/30,0),R8C>ROUND(DAYS360(ExpDat,RC1,0)/30,0)),0,OFFSET(R45C,MAX(-MNR,ROUND(DAYS360(ValDat,RC1,0)/30,0)-R8C+MEP-MNR),0,1,1))) -> 0 | AO62: =IF(RC1="","",IF(OR(R8C<=ROUND(DAYS360(ValDat,RC1,0)/30,0),R8C>ROUND(DAYS360(ExpDat,RC1,0)/30,0)),0,OFFSET(R45C,MAX(-MNR,ROUND(DAYS360(ValDat,RC1,0)/30,0)-R8C+MEP-MNR),0,1,1))) -> 0
A63: =IF(R[-1]C="","",IF(EOMONTH(R[-1]C,0)+1>RunDat,"",EOMONTH(R[-1]C,0)+1)) -> 1999-01-01T00:00:00.000 | D63: =IF(RC1="","",SUM(RC[2]:RC[37])) -> 185807 | F63: =IF(RC1="","",IF(OR(R8C<=ROUND(DAYS360(ValDat,RC1,0)/30,0),R8C>ROUND(DAYS360(ExpDat,RC1,0)/30,0)),0,OFFSET(R45C,MAX(-MNR,ROUND(DAYS360(ValDat,RC1,0)/30,0)-R8C+MEP-MNR),0,1,1))) -> 55099 | G63: =IF(RC1="","",IF(OR(R8C<=ROUND(DAYS360(ValDat,RC1,0)/30,0),R8C>ROUND(DAYS360(ExpDat,RC1,0)/30,0)),0,OFFSET(R45C,MAX(-MNR,ROUND(DAYS360(ValDat,RC1,0)/30,0)-R8C+MEP-MNR),0,1,1))) -> 109280 | H63: =IF(RC1="","",IF(OR(R8C<=ROUND(DAYS360(ValDat,RC1,0)/30,0),R8C>ROUND(DAYS360(ExpDat,RC1,0)/30,0)),0,OFFSET(R45C,MAX(-MNR,ROUND(DAYS360(ValDat,RC1,0)/30,0)-R8C+MEP-MNR),0,1,1))) -> 21428 | I63: =IF(RC1="","",IF(OR(R8C<=ROUND(DAYS360(ValDat,RC1,0)/30,0),R8C>ROUND(DAYS360(ExpDat,RC1,0)/30,0)),0,OFFSET(R45C,MAX(-MNR,ROUND(DAYS360(ValDat,RC1,0)/30,0)-R8C+MEP-MNR),0,1,1))) -> 0 | J63: =IF(RC1="","",IF(OR(R8C<=ROUND(DAYS360(ValDat,RC1,0)/30,0),R8C>ROUND(DAYS360(ExpDat,RC1,0)/30,0)),0,OFFSET(R45C,MAX(-MNR,ROUND(DAYS360(ValDat,RC1,0)/30,0)-R8C+MEP-MNR),0,1,1))) -> 0 | K63: =IF(RC1="","",IF(OR(R8C<=ROUND(DAYS360(ValDat,RC1,0)/30,0),R8C>ROUND(DAYS360(ExpDat,RC1,0)/30,0)),0,OFFSET(R45C,MAX(-MNR,ROUND(DAYS360(ValDat,RC1,0)/30,0)-R8C+MEP-MNR),0,1,1))) -> 0 | L63: =IF(RC1="","",IF(OR(R8C<=ROUND(DAYS360(ValDat,RC1,0)/30,0),R8C>ROUND(DAYS360(ExpDat,RC1,0)/30,0)),0,OFFSET(R45C,MAX(-MNR,ROUND(DAYS360(ValDat,RC1,0)/30,0)-R8C+MEP-MNR),0,1,1))) -> 0 | M63: =IF(RC1="","",IF(OR(R8C<=ROUND(DAYS360(ValDat,RC1,0)/30,0),R8C>ROUND(DAYS360(ExpDat,RC1,0)/30,0)),0,OFFSET(R45C,MAX(-MNR,ROUND(DAYS360(ValDat,RC1,0)/30,0)-R8C+MEP-MNR),0,1,1))) -> 0 | N63: =IF(RC1="","",IF(OR(R8C<=ROUND(DAYS360(ValDat,RC1,0)/30,0),R8C>ROUND(DAYS360(ExpDat,RC1,0)/30,0)),0,OFFSET(R45C,MAX(-MNR,ROUND(DAYS360(ValDat,RC1,0)/30,0)-R8C+MEP-MNR),0,1,1))) -> 0 | O63: =IF(RC1="","",IF(OR(R8C<=ROUND(DAYS360(ValDat,RC1,0)/30,0),R8C>ROUND(DAYS360(ExpDat,RC1,0)/30,0)),0,OFFSET(R45C,MAX(-MNR,ROUND(DAYS360(ValDat,RC1,0)/30,0)-R8C+MEP-MNR),0,1,1))) -> 0 | P63: =IF(RC1="","",IF(OR(R8C<=ROUND(DAYS360(ValDat,RC1,0)/30,0),R8C>ROUND(DAYS360(ExpDat,RC1,0)/30,0)),0,OFFSET(R45C,MAX(-MNR,ROUND(DAYS360(ValDat,RC1,0)/30,0)-R8C+MEP-MNR),0,1,1))) -> 0 | Q63: =IF(RC1="","",IF(OR(R8C<=ROUND(DAYS360(ValDat,RC1,0)/30,0),R8C>ROUND(DAYS360(ExpDat,RC1,0)/30,0)),0,OFFSET(R45C,MAX(-MNR,ROUND(DAYS360(ValDat,RC1,0)/30,0)-R8C+MEP-MNR),0,1,1))) -> 0 | R63: =IF(RC1="","",IF(OR(R8C<=ROUND(DAYS360(ValDat,RC1,0)/30,0),R8C>ROUND(DAYS360(ExpDat,RC1,0)/30,0)),0,OFFSET(R45C,MAX(-MNR,ROUND(DAYS360(ValDat,RC1,0)/30,0)-R8C+MEP-MNR),0,1,1))) -> 0 | S63: =IF(RC1="","",IF(OR(R8C<=ROUND(DAYS360(ValDat,RC1,0)/30,0),R8C>ROUND(DAYS360(ExpDat,RC1,0)/30,0)),0,OFFSET(R45C,MAX(-MNR,ROUND(DAYS360(ValDat,RC1,0)/30,0)-R8C+MEP-MNR),0,1,1))) -> 0 | T63: =IF(RC1="","",IF(OR(R8C<=ROUND(DAYS360(ValDat,RC1,0)/30,0),R8C>ROUND(DAYS360(ExpDat,RC1,0)/30,0)),0,OFFSET(R45C,MAX(-MNR,ROUND(DAYS360(ValDat,RC1,0)/30,0)-R8C+MEP-MNR),0,1,1))) -> 0 | U63: =IF(RC1="","",IF(OR(R8C<=ROUND(DAYS360(ValDat,RC1,0)/30,0),R8C>ROUND(DAYS360(ExpDat,RC1,0)/30,0)),0,OFFSET(R45C,MAX(-MNR,ROUND(DAYS360(ValDat,RC1,0)/30,0)-R8C+MEP-MNR),0,1,1))) -> 0 | V63: =IF(RC1="","",IF(OR(R8C<=ROUND(DAYS360(ValDat,RC1,0)/30,0),R8C>ROUND(DAYS360(ExpDat,RC1,0)/30,0)),0,OFFSET(R45C,MAX(-MNR,ROUND(DAYS360(ValDat,RC1,0)/30,0)-R8C+MEP-MNR),0,1,1))) -> 0 | W63: =IF(RC1="","",IF(OR(R8C<=ROUND(DAYS360(ValDat,RC1,0)/30,0),R8C>ROUND(DAYS360(ExpDat,RC1,0)/30,0)),0,OFFSET(R45C,MAX(-MNR,ROUND(DAYS360(ValDat,RC1,0)/30,0)-R8C+MEP-MNR),0,1,1))) -> 0 | X63: =IF(RC1="","",IF(OR(R8C<=ROUND(DAYS360(ValDat,RC1,0)/30,0),R8C>ROUND(DAYS360(ExpDat,RC1,0)/30,0)),0,OFFSET(R45C,MAX(-MNR,ROUND(DAYS360(ValDat,RC1,0)/30,0)-R8C+MEP-MNR),0,1,1))) -> 0 | Y63: =IF(RC1="","",IF(OR(R8C<=ROUND(DAYS360(ValDat,RC1,0)/30,0),R8C>ROUND(DAYS360(ExpDat,RC1,0)/30,0)),0,OFFSET(R45C,MAX(-MNR,ROUND(DAYS360(ValDat,RC1,0)/30,0)-R8C+MEP-MNR),0,1,1))) -> 0 | Z63: =IF(RC1="","",IF(OR(R8C<=ROUND(DAYS360(ValDat,RC1,0)/30,0),R8C>ROUND(DAYS360(ExpDat,RC1,0)/30,0)),0,OFFSET(R45C,MAX(-MNR,ROUND(DAYS360(ValDat,RC1,0)/30,0)-R8C+MEP-MNR),0,1,1))) -> 0 | AA63: =IF(RC1="","",IF(OR(R8C<=ROUND(DAYS360(ValDat,RC1,0)/30,0),R8C>ROUND(DAYS360(ExpDat,RC1,0)/30,0)),0,OFFSET(R45C,MAX(-MNR,ROUND(DAYS360(ValDat,RC1,0)/30,0)-R8C+MEP-MNR),0,1,1))) -> 0 | AB63: =IF(RC1="","",IF(OR(R8C<=ROUND(DAYS360(ValDat,RC1,0)/30,0),R8C>ROUND(DAYS360(ExpDat,RC1,0)/30,0)),0,OFFSET(R45C,MAX(-MNR,ROUND(DAYS360(ValDat,RC1,0)/30,0)-R8C+MEP-MNR),0,1,1))) -> 0 | AC63: =IF(RC1="","",IF(OR(R8C<=ROUND(DAYS360(ValDat,RC1,0)/30,0),R8C>ROUND(DAYS360(ExpDat,RC1,0)/30,0)),0,OFFSET(R45C,MAX(-MNR,ROUND(DAYS360(ValDat,RC1,0)/30,0)-R8C+MEP-MNR),0,1,1))) -> 0 | AD63: =IF(RC1="","",IF(OR(R8C<=ROUND(DAYS360(ValDat,RC1,0)/30,0),R8C>ROUND(DAYS360(ExpDat,RC1,0)/30,0)),0,OFFSET(R45C,MAX(-MNR,ROUND(DAYS360(ValDat,RC1,0)/30,0)-R8C+MEP-MNR),0,1,1))) -> 0 | AE63: =IF(RC1="","",IF(OR(R8C<=ROUND(DAYS360(ValDat,RC1,0)/30,0),R8C>ROUND(DAYS360(ExpDat,RC1,0)/30,0)),0,OFFSET(R45C,MAX(-MNR,ROUND(DAYS360(ValDat,RC1,0)/30,0)-R8C+MEP-MNR),0,1,1))) -> 0 | AF63: =IF(RC1="","",IF(OR(R8C<=ROUND(DAYS360(ValDat,RC1,0)/30,0),R8C>ROUND(DAYS360(ExpDat,RC1,0)/30,0)),0,OFFSET(R45C,MAX(-MNR,ROUND(DAYS360(ValDat,RC1,0)/30,0)-R8C+MEP-MNR),0,1,1))) -> 0 | AG63: =IF(RC1="","",IF(OR(R8C<=ROUND(DAYS360(ValDat,RC1,0)/30,0),R8C>ROUND(DAYS360(ExpDat,RC1,0)/30,0)),0,OFFSET(R45C,MAX(-MNR,ROUND(DAYS360(ValDat,RC1,0)/30,0)-R8C+MEP-MNR),0,1,1))) -> 0 | AH63: =IF(RC1="","",IF(OR(R8C<=ROUND(DAYS360(ValDat,RC1,0)/30,0),R8C>ROUND(DAYS360(ExpDat,RC1,0)/30,0)),0,OFFSET(R45C,MAX(-MNR,ROUND(DAYS360(ValDat,RC1,0)/30,0)-R8C+MEP-MNR),0,1,1))) -> 0 | AI63: =IF(RC1="","",IF(OR(R8C<=ROUND(DAYS360(ValDat,RC1,0)/30,0),R8C>ROUND(DAYS360(ExpDat,RC1,0)/30,0)),0,OFFSET(R45C,MAX(-MNR,ROUND(DAYS360(ValDat,RC1,0)/30,0)-R8C+MEP-MNR),0,1,1))) -> 0 | AJ63: =IF(RC1="","",IF(OR(R8C<=ROUND(DAYS360(ValDat,RC1,0)/30,0),R8C>ROUND(DAYS360(ExpDat,RC1,0)/30,0)),0,OFFSET(R45C,MAX(-MNR,ROUND(DAYS360(ValDat,RC1,0)/30,0)-R8C+MEP-MNR),0,1,1))) -> 0 | AK63: =IF(RC1="","",IF(OR(R8C<=ROUND(DAYS360(ValDat,RC1,0)/30,0),R8C>ROUND(DAYS360(ExpDat,RC1,0)/30,0)),0,OFFSET(R45C,MAX(-MNR,ROUND(DAYS360(ValDat,RC1,0)/30,0)-R8C+MEP-MNR),0,1,1))) -> 0 | AL63: =IF(RC1="","",IF(OR(R8C<=ROUND(DAYS360(ValDat,RC1,0)/30,0),R8C>ROUND(DAYS360(ExpDat,RC1,0)/30,0)),0,OFFSET(R45C,MAX(-MNR,ROUND(DAYS360(ValDat,RC1,0)/30,0)-R8C+MEP-MNR),0,1,1))) -> 0 | AM63: =IF(RC1="","",IF(OR(R8C<=ROUND(DAYS360(ValDat,RC1,0)/30,0),R8C>ROUND(DAYS360(ExpDat,RC1,0)/30,0)),0,OFFSET(R45C,MAX(-MNR,ROUND(DAYS360(ValDat,RC1,0)/30,0)-R8C+MEP-MNR),0,1,1))) -> 0 | AN63: =IF(RC1="","",IF(OR(R8C<=ROUND(DAYS360(ValDat,RC1,0)/30,0),R8C>ROUND(DAYS360(ExpDat,RC1,0)/30,0)),0,OFFSET(R45C,MAX(-MNR,ROUND(DAYS360(ValDat,RC1,0)/30,0)-R8C+MEP-MNR),0,1,1))) -> 0 | AO63: =IF(RC1="","",IF(OR(R8C<=ROUND(DAYS360(ValDat,RC1,0)/30,0),R8C>ROUND(DAYS360(ExpDat,RC1,0)/30,0)),0,OFFSET(R45C,MAX(-MNR,ROUND(DAYS360(ValDat,RC1,0)/30,0)-R8C+MEP-MNR),0,1,1))) -> 0
A64: =IF(R[-1]C="","",IF(EOMONTH(R[-1]C,0)+1>RunDat,"",EOMONTH(R[-1]C,0)+1)) -> 1999-02-01T00:00:00.000 | D64: =IF(RC1="","",SUM(RC[2]:RC[37])) -> 144004 | F64: =IF(RC1="","",IF(OR(R8C<=ROUND(DAYS360(ValDat,RC1,0)/30,0),R8C>ROUND(DAYS360(ExpDat,RC1,0)/30,0)),0,OFFSET(R45C,MAX(-MNR,ROUND(DAYS360(ValDat,RC1,0)/30,0)-R8C+MEP-MNR),0,1,1))) -> 724 | G64: =IF(RC1="","",IF(OR(R8C<=ROUND(DAYS360(ValDat,RC1,0)/30,0),R8C>ROUND(DAYS360(ExpDat,RC1,0)/30,0)),0,OFFSET(R45C,MAX(-MNR,ROUND(DAYS360(ValDat,RC1,0)/30,0)-R8C+MEP-MNR),0,1,1))) -> 78962 | H64: =IF(RC1="","",IF(OR(R8C<=ROUND(DAYS360(ValDat,RC1,0)/30,0),R8C>ROUND(DAYS360(ExpDat,RC1,0)/30,0)),0,OFFSET(R45C,MAX(-MNR,ROUND(DAYS360(ValDat,RC1,0)/30,0)-R8C+MEP-MNR),0,1,1))) -> 64318 | I64: =IF(RC1="","",IF(OR(R8C<=ROUND(DAYS360(ValDat,RC1,0)/30,0),R8C>ROUND(DAYS360(ExpDat,RC1,0)/30,0)),0,OFFSET(R45C,MAX(-MNR,ROUND(DAYS360(ValDat,RC1,0)/30,0)-R8C+MEP-MNR),0,1,1))) -> 0 | J64: =IF(RC1="","",IF(OR(R8C<=ROUND(DAYS360(ValDat,RC1,0)/30,0),R8C>ROUND(DAYS360(ExpDat,RC1,0)/30,0)),0,OFFSET(R45C,MAX(-MNR,ROUND(DAYS360(ValDat,RC1,0)/30,0)-R8C+MEP-MNR),0,1,1))) -> 0 | K64: =IF(RC1="","",IF(OR(R8C<=ROUND(DAYS360(ValDat,RC1,0)/30,0),R8C>ROUND(DAYS360(ExpDat,RC1,0)/30,0)),0,OFFSET(R45C,MAX(-MNR,ROUND(DAYS360(ValDat,RC1,0)/30,0)-R8C+MEP-MNR),0,1,1))) -> 0 | L64: =IF(RC1="","",IF(OR(R8C<=ROUND(DAYS360(ValDat,RC1,0)/30,0),R8C>ROUND(DAYS360(ExpDat,RC1,0)/30,0)),0,OFFSET(R45C,MAX(-MNR,ROUND(DAYS360(ValDat,RC1,0)/30,0)-R8C+MEP-MNR),0,1,1))) -> 0 | M64: =IF(RC1="","",IF(OR(R8C<=ROUND(DAYS360(ValDat,RC1,0)/30,0),R8C>ROUND(DAYS360(ExpDat,RC1,0)/30,0)),0,OFFSET(R45C,MAX(-MNR,ROUND(DAYS360(ValDat,RC1,0)/30,0)-R8C+MEP-MNR),0,1,1))) -> 0 | N64: =IF(RC1="","",IF(OR(R8C<=ROUND(DAYS360(ValDat,RC1,0)/30,0),R8C>ROUND(DAYS360(ExpDat,RC1,0)/30,0)),0,OFFSET(R45C,MAX(-MNR,ROUND(DAYS360(ValDat,RC1,0)/30,0)-R8C+MEP-MNR),0,1,1))) -> 0 | O64: =IF(RC1="","",IF(OR(R8C<=ROUND(DAYS360(ValDat,RC1,0)/30,0),R8C>ROUND(DAYS360(ExpDat,RC1,0)/30,0)),0,OFFSET(R45C,MAX(-MNR,ROUND(DAYS360(ValDat,RC1,0)/30,0)-R8C+MEP-MNR),0,1,1))) -> 0 | P64: =IF(RC1="","",IF(OR(R8C<=ROUND(DAYS360(ValDat,RC1,0)/30,0),R8C>ROUND(DAYS360(ExpDat,RC1,0)/30,0)),0,OFFSET(R45C,MAX(-MNR,ROUND(DAYS360(ValDat,RC1,0)/30,0)-R8C+MEP-MNR),0,1,1))) -> 0 | Q64: =IF(RC1="","",IF(OR(R8C<=ROUND(DAYS360(ValDat,RC1,0)/30,0),R8C>ROUND(DAYS360(ExpDat,RC1,0)/30,0)),0,OFFSET(R45C,MAX(-MNR,ROUND(DAYS360(ValDat,RC1,0)/30,0)-R8C+MEP-MNR),0,1,1))) -> 0 | R64: =IF(RC1="","",IF(OR(R8C<=ROUND(DAYS360(ValDat,RC1,0)/30,0),R8C>ROUND(DAYS360(ExpDat,RC1,0)/30,0)),0,OFFSET(R45C,MAX(-MNR,ROUND(DAYS360(ValDat,RC1,0)/30,0)-R8C+MEP-MNR),0,1,1))) -> 0 | S64: =IF(RC1="","",IF(OR(R8C<=ROUND(DAYS360(ValDat,RC1,0)/30,0),R8C>ROUND(DAYS360(ExpDat,RC1,0)/30,0)),0,OFFSET(R45C,MAX(-MNR,ROUND(DAYS360(ValDat,RC1,0)/30,0)-R8C+MEP-MNR),0,1,1))) -> 0 | T64: =IF(RC1="","",IF(OR(R8C<=ROUND(DAYS360(ValDat,RC1,0)/30,0),R8C>ROUND(DAYS360(ExpDat,RC1,0)/30,0)),0,OFFSET(R45C,MAX(-MNR,ROUND(DAYS360(ValDat,RC1,0)/30,0)-R8C+MEP-MNR),0,1,1))) -> 0 | U64: =IF(RC1="","",IF(OR(R8C<=ROUND(DAYS360(ValDat,RC1,0)/30,0),R8C>ROUND(DAYS360(ExpDat,RC1,0)/30,0)),0,OFFSET(R45C,MAX(-MNR,ROUND(DAYS360(ValDat,RC1,0)/30,0)-R8C+MEP-MNR),0,1,1))) -> 0 | V64: =IF(RC1="","",IF(OR(R8C<=ROUND(DAYS360(ValDat,RC1,0)/30,0),R8C>ROUND(DAYS360(ExpDat,RC1,0)/30,0)),0,OFFSET(R45C,MAX(-MNR,ROUND(DAYS360(ValDat,RC1,0)/30,0)-R8C+MEP-MNR),0,1,1))) -> 0 | W64: =IF(RC1="","",IF(OR(R8C<=ROUND(DAYS360(ValDat,RC1,0)/30,0),R8C>ROUND(DAYS360(ExpDat,RC1,0)/30,0)),0,OFFSET(R45C,MAX(-MNR,ROUND(DAYS360(ValDat,RC1,0)/30,0)-R8C+MEP-MNR),0,1,1))) -> 0 | X64: =IF(RC1="","",IF(OR(R8C<=ROUND(DAYS360(ValDat,RC1,0)/30,0),R8C>ROUND(DAYS360(ExpDat,RC1,0)/30,0)),0,OFFSET(R45C,MAX(-MNR,ROUND(DAYS360(ValDat,RC1,0)/30,0)-R8C+MEP-MNR),0,1,1))) -> 0 | Y64: =IF(RC1="","",IF(OR(R8C<=ROUND(DAYS360(ValDat,RC1,0)/30,0),R8C>ROUND(DAYS360(ExpDat,RC1,0)/30,0)),0,OFFSET(R45C,MAX(-MNR,ROUND(DAYS360(ValDat,RC1,0)/30,0)-R8C+MEP-MNR),0,1,1))) -> 0 | Z64: =IF(RC1="","",IF(OR(R8C<=ROUND(DAYS360(ValDat,RC1,0)/30,0),R8C>ROUND(DAYS360(ExpDat,RC1,0)/30,0)),0,OFFSET(R45C,MAX(-MNR,ROUND(DAYS360(ValDat,RC1,0)/30,0)-R8C+MEP-MNR),0,1,1))) -> 0 | AA64: =IF(RC1="","",IF(OR(R8C<=ROUND(DAYS360(ValDat,RC1,0)/30,0),R8C>ROUND(DAYS360(ExpDat,RC1,0)/30,0)),0,OFFSET(R45C,MAX(-MNR,ROUND(DAYS360(ValDat,RC1,0)/30,0)-R8C+MEP-MNR),0,1,1))) -> 0 | AB64: =IF(RC1="","",IF(OR(R8C<=ROUND(DAYS360(ValDat,RC1,0)/30,0),R8C>ROUND(DAYS360(ExpDat,RC1,0)/30,0)),0,OFFSET(R45C,MAX(-MNR,ROUND(DAYS360(ValDat,RC1,0)/30,0)-R8C+MEP-MNR),0,1,1))) -> 0 | AC64: =IF(RC1="","",IF(OR(R8C<=ROUND(DAYS360(ValDat,RC1,0)/30,0),R8C>ROUND(DAYS360(ExpDat,RC1,0)/30,0)),0,OFFSET(R45C,MAX(-MNR,ROUND(DAYS360(ValDat,RC1,0)/30,0)-R8C+MEP-MNR),0,1,1))) -> 0 | AD64: =IF(RC1="","",IF(OR(R8C<=ROUND(DAYS360(ValDat,RC1,0)/30,0),R8C>ROUND(DAYS360(ExpDat,RC1,0)/30,0)),0,OFFSET(R45C,MAX(-MNR,ROUND(DAYS360(ValDat,RC1,0)/30,0)-R8C+MEP-MNR),0,1,1))) -> 0 | AE64: =IF(RC1="","",IF(OR(R8C<=ROUND(DAYS360(ValDat,RC1,0)/30,0),R8C>ROUND(DAYS360(ExpDat,RC1,0)/30,0)),0,OFFSET(R45C,MAX(-MNR,ROUND(DAYS360(ValDat,RC1,0)/30,0)-R8C+MEP-MNR),0,1,1))) -> 0 | AF64: =IF(RC1="","",IF(OR(R8C<=ROUND(DAYS360(ValDat,RC1,0)/30,0),R8C>ROUND(DAYS360(ExpDat,RC1,0)/30,0)),0,OFFSET(R45C,MAX(-MNR,ROUND(DAYS360(ValDat,RC1,0)/30,0)-R8C+MEP-MNR),0,1,1))) -> 0 | AG64: =IF(RC1="","",IF(OR(R8C<=ROUND(DAYS360(ValDat,RC1,0)/30,0),R8C>ROUND(DAYS360(ExpDat,RC1,0)/30,0)),0,OFFSET(R45C,MAX(-MNR,ROUND(DAYS360(ValDat,RC1,0)/30,0)-R8C+MEP-MNR),0,1,1))) -> 0 | AH64: =IF(RC1="","",IF(OR(R8C<=ROUND(DAYS360(ValDat,RC1,0)/30,0),R8C>ROUND(DAYS360(ExpDat,RC1,0)/30,0)),0,OFFSET(R45C,MAX(-MNR,ROUND(DAYS360(ValDat,RC1,0)/30,0)-R8C+MEP-MNR),0,1,1))) -> 0 | AI64: =IF(RC1="","",IF(OR(R8C<=ROUND(DAYS360(ValDat,RC1,0)/30,0),R8C>ROUND(DAYS360(ExpDat,RC1,0)/30,0)),0,OFFSET(R45C,MAX(-MNR,ROUND(DAYS360(ValDat,RC1,0)/30,0)-R8C+MEP-MNR),0,1,1))) -> 0 | AJ64: =IF(RC1="","",IF(OR(R8C<=ROUND(DAYS360(ValDat,RC1,0)/30,0),R8C>ROUND(DAYS360(ExpDat,RC1,0)/30,0)),0,OFFSET(R45C,MAX(-MNR,ROUND(DAYS360(ValDat,RC1,0)/30,0)-R8C+MEP-MNR),0,1,1))) -> 0 | AK64: =IF(RC1="","",IF(OR(R8C<=ROUND(DAYS360(ValDat,RC1,0)/30,0),R8C>ROUND(DAYS360(ExpDat,RC1,0)/30,0)),0,OFFSET(R45C,MAX(-MNR,ROUND(DAYS360(ValDat,RC1,0)/30,0)-R8C+MEP-MNR),0,1,1))) -> 0 | AL64: =IF(RC1="","",IF(OR(R8C<=ROUND(DAYS360(ValDat,RC1,0)/30,0),R8C>ROUND(DAYS360(ExpDat,RC1,0)/30,0)),0,OFFSET(R45C,MAX(-MNR,ROUND(DAYS360(ValDat,RC1,0)/30,0)-R8C+MEP-MNR),0,1,1))) -> 0 | AM64: =IF(RC1="","",IF(OR(R8C<=ROUND(DAYS360(ValDat,RC1,0)/30,0),R8C>ROUND(DAYS360(ExpDat,RC1,0)/30,0)),0,OFFSET(R45C,MAX(-MNR,ROUND(DAYS360(ValDat,RC1,0)/30,0)-R8C+MEP-MNR),0,1,1))) -> 0 | AN64: =IF(RC1="","",IF(OR(R8C<=ROUND(DAYS360(ValDat,RC1,0)/30,0),R8C>ROUND(DAYS360(ExpDat,RC1,0)/30,0)),0,OFFSET(R45C,MAX(-MNR,ROUND(DAYS360(ValDat,RC1,0)/30,0)-R8C+MEP-MNR),0,1,1))) -> 0 | AO64: =IF(RC1="","",IF(OR(R8C<=ROUND(DAYS360(ValDat,RC1,0)/30,0),R8C>ROUND(DAYS360(ExpDat,RC1,0)/30,0)),0,OFFSET(R45C,MAX(-MNR,ROUND(DAYS360(ValDat,RC1,0)/30,0)-R8C+MEP-MNR),0,1,1))) -> 0
A65: =IF(R[-1]C="","",IF(EOMONTH(R[-1]C,0)+1>RunDat,"",EOMONTH(R[-1]C,0)+1)) -> 1999-03-01T00:00:00.000 | D65: =IF(RC1="","",SUM(RC[2]:RC[37])) -> 162948 | F65: =IF(RC1="","",IF(OR(R8C<=ROUND(DAYS360(ValDat,RC1,0)/30,0),R8C>ROUND(DAYS360(ExpDat,RC1,0)/30,0)),0,OFFSET(R45C,MAX(-MNR,ROUND(DAYS360(ValDat,RC1,0)/30,0)-R8C+MEP-MNR),0,1,1))) -> 22541 | G65: =IF(RC1="","",IF(OR(R8C<=ROUND(DAYS360(ValDat,RC1,0)/30,0),R8C>ROUND(DAYS360(ExpDat,RC1,0)/30,0)),0,OFFSET(R45C,MAX(-MNR,ROUND(DAYS360(ValDat,RC1,0)/30,0)-R8C+MEP-MNR),0,1,1))) -> 73514 | H65: =IF(RC1="","",IF(OR(R8C<=ROUND(DAYS360(ValDat,RC1,0)/30,0),R8C>ROUND(DAYS360(ExpDat,RC1,0)/30,0)),0,OFFSET(R45C,MAX(-MNR,ROUND(DAYS360(ValDat,RC1,0)/30,0)-R8C+MEP-MNR),0,1,1))) -> 58105 | I65: =IF(RC1="","",IF(OR(R8C<=ROUND(DAYS360(ValDat,RC1,0)/30,0),R8C>ROUND(DAYS360(ExpDat,RC1,0)/30,0)),0,OFFSET(R45C,MAX(-MNR,ROUND(DAYS360(ValDat,RC1,0)/30,0)-R8C+MEP-MNR),0,1,1))) -> 8788 | J65: =IF(RC1="","",IF(OR(R8C<=ROUND(DAYS360(ValDat,RC1,0)/30,0),R8C>ROUND(DAYS360(ExpDat,RC1,0)/30,0)),0,OFFSET(R45C,MAX(-MNR,ROUND(DAYS360(ValDat,RC1,0)/30,0)-R8C+MEP-MNR),0,1,1))) -> 0 | K65: =IF(RC1="","",IF(OR(R8C<=ROUND(DAYS360(ValDat,RC1,0)/30,0),R8C>ROUND(DAYS360(ExpDat,RC1,0)/30,0)),0,OFFSET(R45C,MAX(-MNR,ROUND(DAYS360(ValDat,RC1,0)/30,0)-R8C+MEP-MNR),0,1,1))) -> 0 | L65: =IF(RC1="","",IF(OR(R8C<=ROUND(DAYS360(ValDat,RC1,0)/30,0),R8C>ROUND(DAYS360(ExpDat,RC1,0)/30,0)),0,OFFSET(R45C,MAX(-MNR,ROUND(DAYS360(ValDat,RC1,0)/30,0)-R8C+MEP-MNR),0,1,1))) -> 0 | M65: =IF(RC1="","",IF(OR(R8C<=ROUND(DAYS360(ValDat,RC1,0)/30,0),R8C>ROUND(DAYS360(ExpDat,RC1,0)/30,0)),0,OFFSET(R45C,MAX(-MNR,ROUND(DAYS360(ValDat,RC1,0)/30,0)-R8C+MEP-MNR),0,1,1))) -> 0 | N65: =IF(RC1="","",IF(OR(R8C<=ROUND(DAYS360(ValDat,RC1,0)/30,0),R8C>ROUND(DAYS360(ExpDat,RC1,0)/30,0)),0,OFFSET(R45C,MAX(-MNR,ROUND(DAYS360(ValDat,RC1,0)/30,0)-R8C+MEP-MNR),0,1,1))) -> 0 | O65: =IF(RC1="","",IF(OR(R8C<=ROUND(DAYS360(ValDat,RC1,0)/30,0),R8C>ROUND(DAYS360(ExpDat,RC1,0)/30,0)),0,OFFSET(R45C,MAX(-MNR,ROUND(DAYS360(ValDat,RC1,0)/30,0)-R8C+MEP-MNR),0,1,1))) -> 0 | P65: =IF(RC1="","",IF(OR(R8C<=ROUND(DAYS360(ValDat,RC1,0)/30,0),R8C>ROUND(DAYS360(ExpDat,RC1,0)/30,0)),0,OFFSET(R45C,MAX(-MNR,ROUND(DAYS360(ValDat,RC1,0)/30,0)-R8C+MEP-MNR),0,1,1))) -> 0 | Q65: =IF(RC1="","",IF(OR(R8C<=ROUND(DAYS360(ValDat,RC1,0)/30,0),R8C>ROUND(DAYS360(ExpDat,RC1,0)/30,0)),0,OFFSET(R45C,MAX(-MNR,ROUND(DAYS360(ValDat,RC1,0)/30,0)-R8C+MEP-MNR),0,1,1))) -> 0 | R65: =IF(RC1="","",IF(OR(R8C<=ROUND(DAYS360(ValDat,RC1,0)/30,0),R8C>ROUND(DAYS360(ExpDat,RC1,0)/30,0)),0,OFFSET(R45C,MAX(-MNR,ROUND(DAYS360(ValDat,RC1,0)/30,0)-R8C+MEP-MNR),0,1,1))) -> 0 | S65: =IF(RC1="","",IF(OR(R8C<=ROUND(DAYS360(ValDat,RC1,0)/30,0),R8C>ROUND(DAYS360(ExpDat,RC1,0)/30,0)),0,OFFSET(R45C,MAX(-MNR,ROUND(DAYS360(ValDat,RC1,0)/30,0)-R8C+MEP-MNR),0,1,1))) -> 0 | T65: =IF(RC1="","",IF(OR(R8C<=ROUND(DAYS360(ValDat,RC1,0)/30,0),R8C>ROUND(DAYS360(ExpDat,RC1,0)/30,0)),0,OFFSET(R45C,MAX(-MNR,ROUND(DAYS360(ValDat,RC1,0)/30,0)-R8C+MEP-MNR),0,1,1))) -> 0 | U65: =IF(RC1="","",IF(OR(R8C<=ROUND(DAYS360(ValDat,RC1,0)/30,0),R8C>ROUND(DAYS360(ExpDat,RC1,0)/30,0)),0,OFFSET(R45C,MAX(-MNR,ROUND(DAYS360(ValDat,RC1,0)/30,0)-R8C+MEP-MNR),0,1,1))) -> 0 | V65: =IF(RC1="","",IF(OR(R8C<=ROUND(DAYS360(ValDat,RC1,0)/30,0),R8C>ROUND(DAYS360(ExpDat,RC1,0)/30,0)),0,OFFSET(R45C,MAX(-MNR,ROUND(DAYS360(ValDat,RC1,0)/30,0)-R8C+MEP-MNR),0,1,1))) -> 0 | W65: =IF(RC1="","",IF(OR(R8C<=ROUND(DAYS360(ValDat,RC1,0)/30,0),R8C>ROUND(DAYS360(ExpDat,RC1,0)/30,0)),0,OFFSET(R45C,MAX(-MNR,ROUND(DAYS360(ValDat,RC1,0)/30,0)-R8C+MEP-MNR),0,1,1))) -> 0 | X65: =IF(RC1="","",IF(OR(R8C<=ROUND(DAYS360(ValDat,RC1,0)/30,0),R8C>ROUND(DAYS360(ExpDat,RC1,0)/30,0)),0,OFFSET(R45C,MAX(-MNR,ROUND(DAYS360(ValDat,RC1,0)/30,0)-R8C+MEP-MNR),0,1,1))) -> 0 | Y65: =IF(RC1="","",IF(OR(R8C<=ROUND(DAYS360(ValDat,RC1,0)/30,0),R8C>ROUND(DAYS360(ExpDat,RC1,0)/30,0)),0,OFFSET(R45C,MAX(-MNR,ROUND(DAYS360(ValDat,RC1,0)/30,0)-R8C+MEP-MNR),0,1,1))) -> 0 | Z65: =IF(RC1="","",IF(OR(R8C<=ROUND(DAYS360(ValDat,RC1,0)/30,0),R8C>ROUND(DAYS360(ExpDat,RC1,0)/30,0)),0,OFFSET(R45C,MAX(-MNR,ROUND(DAYS360(ValDat,RC1,0)/30,0)-R8C+MEP-MNR),0,1,1))) -> 0 | AA65: =IF(RC1="","",IF(OR(R8C<=ROUND(DAYS360(ValDat,RC1,0)/30,0),R8C>ROUND(DAYS360(ExpDat,RC1,0)/30,0)),0,OFFSET(R45C,MAX(-MNR,ROUND(DAYS360(ValDat,RC1,0)/30,0)-R8C+MEP-MNR),0,1,1))) -> 0 | AB65: =IF(RC1="","",IF(OR(R8C<=ROUND(DAYS360(ValDat,RC1,0)/30,0),R8C>ROUND(DAYS360(ExpDat,RC1,0)/30,0)),0,OFFSET(R45C,MAX(-MNR,ROUND(DAYS360(ValDat,RC1,0)/30,0)-R8C+MEP-MNR),0,1,1))) -> 0 | AC65: =IF(RC1="","",IF(OR(R8C<=ROUND(DAYS360(ValDat,RC1,0)/30,0),R8C>ROUND(DAYS360(ExpDat,RC1,0)/30,0)),0,OFFSET(R45C,MAX(-MNR,ROUND(DAYS360(ValDat,RC1,0)/30,0)-R8C+MEP-MNR),0,1,1))) -> 0 | AD65: =IF(RC1="","",IF(OR(R8C<=ROUND(DAYS360(ValDat,RC1,0)/30,0),R8C>ROUND(DAYS360(ExpDat,RC1,0)/30,0)),0,OFFSET(R45C,MAX(-MNR,ROUND(DAYS360(ValDat,RC1,0)/30,0)-R8C+MEP-MNR),0,1,1))) -> 0 | AE65: =IF(RC1="","",IF(OR(R8C<=ROUND(DAYS360(ValDat,RC1,0)/30,0),R8C>ROUND(DAYS360(ExpDat,RC1,0)/30,0)),0,OFFSET(R45C,MAX(-MNR,ROUND(DAYS360(ValDat,RC1,0)/30,0)-R8C+MEP-MNR),0,1,1))) -> 0 | AF65: =IF(RC1="","",IF(OR(R8C<=ROUND(DAYS360(ValDat,RC1,0)/30,0),R8C>ROUND(DAYS360(ExpDat,RC1,0)/30,0)),0,OFFSET(R45C,MAX(-MNR,ROUND(DAYS360(ValDat,RC1,0)/30,0)-R8C+MEP-MNR),0,1,1))) -> 0 | AG65: =IF(RC1="","",IF(OR(R8C<=ROUND(DAYS360(ValDat,RC1,0)/30,0),R8C>ROUND(DAYS360(ExpDat,RC1,0)/30,0)),0,OFFSET(R45C,MAX(-MNR,ROUND(DAYS360(ValDat,RC1,0)/30,0)-R8C+MEP-MNR),0,1,1))) -> 0 | AH65: =IF(RC1="","",IF(OR(R8C<=ROUND(DAYS360(ValDat,RC1,0)/30,0),R8C>ROUND(DAYS360(ExpDat,RC1,0)/30,0)),0,OFFSET(R45C,MAX(-MNR,ROUND(DAYS360(ValDat,RC1,0)/30,0)-R8C+MEP-MNR),0,1,1))) -> 0 | AI65: =IF(RC1="","",IF(OR(R8C<=ROUND(DAYS360(ValDat,RC1,0)/30,0),R8C>ROUND(DAYS360(ExpDat,RC1,0)/30,0)),0,OFFSET(R45C,MAX(-MNR,ROUND(DAYS360(ValDat,RC1,0)/30,0)-R8C+MEP-MNR),0,1,1))) -> 0 | AJ65: =IF(RC1="","",IF(OR(R8C<=ROUND(DAYS360(ValDat,RC1,0)/30,0),R8C>ROUND(DAYS360(ExpDat,RC1,0)/30,0)),0,OFFSET(R45C,MAX(-MNR,ROUND(DAYS360(ValDat,RC1,0)/30,0)-R8C+MEP-MNR),0,1,1))) -> 0 | AK65: =IF(RC1="","",IF(OR(R8C<=ROUND(DAYS360(ValDat,RC1,0)/30,0),R8C>ROUND(DAYS360(ExpDat,RC1,0)/30,0)),0,OFFSET(R45C,MAX(-MNR,ROUND(DAYS360(ValDat,RC1,0)/30,0)-R8C+MEP-MNR),0,1,1))) -> 0 | AL65: =IF(RC1="","",IF(OR(R8C<=ROUND(DAYS360(ValDat,RC1,0)/30,0),R8C>ROUND(DAYS360(ExpDat,RC1,0)/30,0)),0,OFFSET(R45C,MAX(-MNR,ROUND(DAYS360(ValDat,RC1,0)/30,0)-R8C+MEP-MNR),0,1,1))) -> 0 | AM65: =IF(RC1="","",IF(OR(R8C<=ROUND(DAYS360(ValDat,RC1,0)/30,0),R8C>ROUND(DAYS360(ExpDat,RC1,0)/30,0)),0,OFFSET(R45C,MAX(-MNR,ROUND(DAYS360(ValDat,RC1,0)/30,0)-R8C+MEP-MNR),0,1,1))) -> 0 | AN65: =IF(RC1="","",IF(OR(R8C<=ROUND(DAYS360(ValDat,RC1,0)/30,0),R8C>ROUND(DAYS360(ExpDat,RC1,0)/30,0)),0,OFFSET(R45C,MAX(-MNR,ROUND(DAYS360(ValDat,RC1,0)/30,0)-R8C+MEP-MNR),0,1,1))) -> 0 | AO65: =IF(RC1="","",IF(OR(R8C<=ROUND(DAYS360(ValDat,RC1,0)/30,0),R8C>ROUND(DAYS360(ExpDat,RC1,0)/30,0)),0,OFFSET(R45C,MAX(-MNR,ROUND(DAYS360(ValDat,RC1,0)/30,0)-R8C+MEP-MNR),0,1,1))) -> 0
A66: =IF(R[-1]C="","",IF(EOMONTH(R[-1]C,0)+1>RunDat,"",EOMONTH(R[-1]C,0)+1)) -> 1999-04-01T00:00:00.000 | D66: =IF(RC1="","",SUM(RC[2]:RC[37])) -> 243415 | F66: =IF(RC1="","",IF(OR(R8C<=ROUND(DAYS360(ValDat,RC1,0)/30,0),R8C>ROUND(DAYS360(ExpDat,RC1,0)/30,0)),0,OFFSET(R45C,MAX(-MNR,ROUND(DAYS360(ValDat,RC1,0)/30,0)-R8C+MEP-MNR),0,1,1))) -> 13576 | G66: =IF(RC1="","",IF(OR(R8C<=ROUND(DAYS360(ValDat,RC1,0)/30,0),R8C>ROUND(DAYS360(ExpDat,RC1,0)/30,0)),0,OFFSET(R45C,MAX(-MNR,ROUND(DAYS360(ValDat,RC1,0)/30,0)-R8C+MEP-MNR),0,1,1))) -> 122603 | H66: =IF(RC1="","",IF(OR(R8C<=ROUND(DAYS360(ValDat,RC1,0)/30,0),R8C>ROUND(DAYS360(ExpDat,RC1,0)/30,0)),0,OFFSET(R45C,MAX(-MNR,ROUND(DAYS360(ValDat,RC1,0)/30,0)-R8C+MEP-MNR),0,1,1))) -> 100846 | I66: =IF(RC1="","",IF(OR(R8C<=ROUND(DAYS360(ValDat,RC1,0)/30,0),R8C>ROUND(DAYS360(ExpDat,RC1,0)/30,0)),0,OFFSET(R45C,MAX(-MNR,ROUND(DAYS360(ValDat,RC1,0)/30,0)-R8C+MEP-MNR),0,1,1))) -> 5540 | J66: =IF(RC1="","",IF(OR(R8C<=ROUND(DAYS360(ValDat,RC1,0)/30,0),R8C>ROUND(DAYS360(ExpDat,RC1,0)/30,0)),0,OFFSET(R45C,MAX(-MNR,ROUND(DAYS360(ValDat,RC1,0)/30,0)-R8C+MEP-MNR),0,1,1))) -> 850 | K66: =IF(RC1="","",IF(OR(R8C<=ROUND(DAYS360(ValDat,RC1,0)/30,0),R8C>ROUND(DAYS360(ExpDat,RC1,0)/30,0)),0,OFFSET(R45C,MAX(-MNR,ROUND(DAYS360(ValDat,RC1,0)/30,0)-R8C+MEP-MNR),0,1,1))) -> 0 | L66: =IF(RC1="","",IF(OR(R8C<=ROUND(DAYS360(ValDat,RC1,0)/30,0),R8C>ROUND(DAYS360(ExpDat,RC1,0)/30,0)),0,OFFSET(R45C,MAX(-MNR,ROUND(DAYS360(ValDat,RC1,0)/30,0)-R8C+MEP-MNR),0,1,1))) -> 0 | M66: =IF(RC1="","",IF(OR(R8C<=ROUND(DAYS360(ValDat,RC1,0)/30,0),R8C>ROUND(DAYS360(ExpDat,RC1,0)/30,0)),0,OFFSET(R45C,MAX(-MNR,ROUND(DAYS360(ValDat,RC1,0)/30,0)-R8C+MEP-MNR),0,1,1))) -> 0 | N66: =IF(RC1="","",IF(OR(R8C<=ROUND(DAYS360(ValDat,RC1,0)/30,0),R8C>ROUND(DAYS360(ExpDat,RC1,0)/30,0)),0,OFFSET(R45C,MAX(-MNR,ROUND(DAYS360(ValDat,RC1,0)/30,0)-R8C+MEP-MNR),0,1,1))) -> 0 | O66: =IF(RC1="","",IF(OR(R8C<=ROUND(DAYS360(ValDat,RC1,0)/30,0),R8C>ROUND(DAYS360(ExpDat,RC1,0)/30,0)),0,OFFSET(R45C,MAX(-MNR,ROUND(DAYS360(ValDat,RC1,0)/30,0)-R8C+MEP-MNR),0,1,1))) -> 0 | P66: =IF(RC1="","",IF(OR(R8C<=ROUND(DAYS360(ValDat,RC1,0)/30,0),R8C>ROUND(DAYS360(ExpDat,RC1,0)/30,0)),0,OFFSET(R45C,MAX(-MNR,ROUND(DAYS360(ValDat,RC1,0)/30,0)-R8C+MEP-MNR),0,1,1))) -> 0 | Q66: =IF(RC1="","",IF(OR(R8C<=ROUND(DAYS360(ValDat,RC1,0)/30,0),R8C>ROUND(DAYS360(ExpDat,RC1,0)/30,0)),0,OFFSET(R45C,MAX(-MNR,ROUND(DAYS360(ValDat,RC1,0)/30,0)-R8C+MEP-MNR),0,1,1))) -> 0 | R66: =IF(RC1="","",IF(OR(R8C<=ROUND(DAYS360(ValDat,RC1,0)/30,0),R8C>ROUND(DAYS360(ExpDat,RC1,0)/30,0)),0,OFFSET(R45C,MAX(-MNR,ROUND(DAYS360(ValDat,RC1,0)/30,0)-R8C+MEP-MNR),0,1,1))) -> 0 | S66: =IF(RC1="","",IF(OR(R8C<=ROUND(DAYS360(ValDat,RC1,0)/30,0),R8C>ROUND(DAYS360(ExpDat,RC1,0)/30,0)),0,OFFSET(R45C,MAX(-MNR,ROUND(DAYS360(ValDat,RC1,0)/30,0)-R8C+MEP-MNR),0,1,1))) -> 0 | T66: =IF(RC1="","",IF(OR(R8C<=ROUND(DAYS360(ValDat,RC1,0)/30,0),R8C>ROUND(DAYS360(ExpDat,RC1,0)/30,0)),0,OFFSET(R45C,MAX(-MNR,ROUND(DAYS360(ValDat,RC1,0)/30,0)-R8C+MEP-MNR),0,1,1))) -> 0 | U66: =IF(RC1="","",IF(OR(R8C<=ROUND(DAYS360(ValDat,RC1,0)/30,0),R8C>ROUND(DAYS360(ExpDat,RC1,0)/30,0)),0,OFFSET(R45C,MAX(-MNR,ROUND(DAYS360(ValDat,RC1,0)/30,0)-R8C+MEP-MNR),0,1,1))) -> 0 | V66: =IF(RC1="","",IF(OR(R8C<=ROUND(DAYS360(ValDat,RC1,0)/30,0),R8C>ROUND(DAYS360(ExpDat,RC1,0)/30,0)),0,OFFSET(R45C,MAX(-MNR,ROUND(DAYS360(ValDat,RC1,0)/30,0)-R8C+MEP-MNR),0,1,1))) -> 0 | W66: =IF(RC1="","",IF(OR(R8C<=ROUND(DAYS360(ValDat,RC1,0)/30,0),R8C>ROUND(DAYS360(ExpDat,RC1,0)/30,0)),0,OFFSET(R45C,MAX(-MNR,ROUND(DAYS360(ValDat,RC1,0)/30,0)-R8C+MEP-MNR),0,1,1))) -> 0 | X66: =IF(RC1="","",IF(OR(R8C<=ROUND(DAYS360(ValDat,RC1,0)/30,0),R8C>ROUND(DAYS360(ExpDat,RC1,0)/30,0)),0,OFFSET(R45C,MAX(-MNR,ROUND(DAYS360(ValDat,RC1,0)/30,0)-R8C+MEP-MNR),0,1,1))) -> 0 | Y66: =IF(RC1="","",IF(OR(R8C<=ROUND(DAYS360(ValDat,RC1,0)/30,0),R8C>ROUND(DAYS360(ExpDat,RC1,0)/30,0)),0,OFFSET(R45C,MAX(-MNR,ROUND(DAYS360(ValDat,RC1,0)/30,0)-R8C+MEP-MNR),0,1,1))) -> 0 | Z66: =IF(RC1="","",IF(OR(R8C<=ROUND(DAYS360(ValDat,RC1,0)/30,0),R8C>ROUND(DAYS360(ExpDat,RC1,0)/30,0)),0,OFFSET(R45C,MAX(-MNR,ROUND(DAYS360(ValDat,RC1,0)/30,0)-R8C+MEP-MNR),0,1,1))) -> 0 | AA66: =IF(RC1="","",IF(OR(R8C<=ROUND(DAYS360(ValDat,RC1,0)/30,0),R8C>ROUND(DAYS360(ExpDat,RC1,0)/30,0)),0,OFFSET(R45C,MAX(-MNR,ROUND(DAYS360(ValDat,RC1,0)/30,0)-R8C+MEP-MNR),0,1,1))) -> 0 | AB66: =IF(RC1="","",IF(OR(R8C<=ROUND(DAYS360(ValDat,RC1,0)/30,0),R8C>ROUND(DAYS360(ExpDat,RC1,0)/30,0)),0,OFFSET(R45C,MAX(-MNR,ROUND(DAYS360(ValDat,RC1,0)/30,0)-R8C+MEP-MNR),0,1,1))) -> 0 | AC66: =IF(RC1="","",IF(OR(R8C<=ROUND(DAYS360(ValDat,RC1,0)/30,0),R8C>ROUND(DAYS360(ExpDat,RC1,0)/30,0)),0,OFFSET(R45C,MAX(-MNR,ROUND(DAYS360(ValDat,RC1,0)/30,0)-R8C+MEP-MNR),0,1,1))) -> 0 | AD66: =IF(RC1="","",IF(OR(R8C<=ROUND(DAYS360(ValDat,RC1,0)/30,0),R8C>ROUND(DAYS360(ExpDat,RC1,0)/30,0)),0,OFFSET(R45C,MAX(-MNR,ROUND(DAYS360(ValDat,RC1,0)/30,0)-R8C+MEP-MNR),0,1,1))) -> 0 | AE66: =IF(RC1="","",IF(OR(R8C<=ROUND(DAYS360(ValDat,RC1,0)/30,0),R8C>ROUND(DAYS360(ExpDat,RC1,0)/30,0)),0,OFFSET(R45C,MAX(-MNR,ROUND(DAYS360(ValDat,RC1,0)/30,0)-R8C+MEP-MNR),0,1,1))) -> 0 | AF66: =IF(RC1="","",IF(OR(R8C<=ROUND(DAYS360(ValDat,RC1,0)/30,0),R8C>ROUND(DAYS360(ExpDat,RC1,0)/30,0)),0,OFFSET(R45C,MAX(-MNR,ROUND(DAYS360(ValDat,RC1,0)/30,0)-R8C+MEP-MNR),0,1,1))) -> 0 | AG66: =IF(RC1="","",IF(OR(R8C<=ROUND(DAYS360(ValDat,RC1,0)/30,0),R8C>ROUND(DAYS360(ExpDat,RC1,0)/30,0)),0,OFFSET(R45C,MAX(-MNR,ROUND(DAYS360(ValDat,RC1,0)/30,0)-R8C+MEP-MNR),0,1,1))) -> 0 | AH66: =IF(RC1="","",IF(OR(R8C<=ROUND(DAYS360(ValDat,RC1,0)/30,0),R8C>ROUND(DAYS360(ExpDat,RC1,0)/30,0)),0,OFFSET(R45C,MAX(-MNR,ROUND(DAYS360(ValDat,RC1,0)/30,0)-R8C+MEP-MNR),0,1,1))) -> 0 | AI66: =IF(RC1="","",IF(OR(R8C<=ROUND(DAYS360(ValDat,RC1,0)/30,0),R8C>ROUND(DAYS360(ExpDat,RC1,0)/30,0)),0,OFFSET(R45C,MAX(-MNR,ROUND(DAYS360(ValDat,RC1,0)/30,0)-R8C+MEP-MNR),0,1,1))) -> 0 | AJ66: =IF(RC1="","",IF(OR(R8C<=ROUND(DAYS360(ValDat,RC1,0)/30,0),R8C>ROUND(DAYS360(ExpDat,RC1,0)/30,0)),0,OFFSET(R45C,MAX(-MNR,ROUND(DAYS360(ValDat,RC1,0)/30,0)-R8C+MEP-MNR),0,1,1))) -> 0 | AK66: =IF(RC1="","",IF(OR(R8C<=ROUND(DAYS360(ValDat,RC1,0)/30,0),R8C>ROUND(DAYS360(ExpDat,RC1,0)/30,0)),0,OFFSET(R45C,MAX(-MNR,ROUND(DAYS360(ValDat,RC1,0)/30,0)-R8C+MEP-MNR),0,1,1))) -> 0 | AL66: =IF(RC1="","",IF(OR(R8C<=ROUND(DAYS360(ValDat,RC1,0)/30,0),R8C>ROUND(DAYS360(ExpDat,RC1,0)/30,0)),0,OFFSET(R45C,MAX(-MNR,ROUND(DAYS360(ValDat,RC1,0)/30,0)-R8C+MEP-MNR),0,1,1))) -> 0 | AM66: =IF(RC1="","",IF(OR(R8C<=ROUND(DAYS360(ValDat,RC1,0)/30,0),R8C>ROUND(DAYS360(ExpDat,RC1,0)/30,0)),0,OFFSET(R45C,MAX(-MNR,ROUND(DAYS360(ValDat,RC1,0)/30,0)-R8C+MEP-MNR),0,1,1))) -> 0 | AN66: =IF(RC1="","",IF(OR(R8C<=ROUND(DAYS360(ValDat,RC1,0)/30,0),R8C>ROUND(DAYS360(ExpDat,RC1,0)/30,0)),0,OFFSET(R45C,MAX(-MNR,ROUND(DAYS360(ValDat,RC1,0)/30,0)-R8C+MEP-MNR),0,1,1))) -> 0 | AO66: =IF(RC1="","",IF(OR(R8C<=ROUND(DAYS360(ValDat,RC1,0)/30,0),R8C>ROUND(DAYS360(ExpDat,RC1,0)/30,0)),0,OFFSET(R45C,MAX(-MNR,ROUND(DAYS360(ValDat,RC1,0)/30,0)-R8C+MEP-MNR),0,1,1))) -> 0
A67: =IF(R[-1]C="","",IF(EOMONTH(R[-1]C,0)+1>RunDat,"",EOMONTH(R[-1]C,0)+1)) -> 1999-05-01T00:00:00.000 | D67: =IF(RC1="","",SUM(RC[2]:RC[37])) -> 169481 | F67: =IF(RC1="","",IF(OR(R8C<=ROUND(DAYS360(ValDat,RC1,0)/30,0),R8C>ROUND(DAYS360(ExpDat,RC1,0)/30,0)),0,OFFSET(R45C,MAX(-MNR,ROUND(DAYS360(ValDat,RC1,0)/30,0)-R8C+MEP-MNR),0,1,1))) -> 33308 | G67: =IF(RC1="","",IF(OR(R8C<=ROUND(DAYS360(ValDat,RC1,0)/30,0),R8C>ROUND(DAYS360(ExpDat,RC1,0)/30,0)),0,OFFSET(R45C,MAX(-MNR,ROUND(DAYS360(ValDat,RC1,0)/30,0)-R8C+MEP-MNR),0,1,1))) -> 98490 | H67: =IF(RC1="","",IF(OR(R8C<=ROUND(DAYS360(ValDat,RC1,0)/30,0),R8C>ROUND(DAYS360(ExpDat,RC1,0)/30,0)),0,OFFSET(R45C,MAX(-MNR,ROUND(DAYS360(ValDat,RC1,0)/30,0)-R8C+MEP-MNR),0,1,1))) -> 33881 | I67: =IF(RC1="","",IF(OR(R8C<=ROUND(DAYS360(ValDat,RC1,0)/30,0),R8C>ROUND(DAYS360(ExpDat,RC1,0)/30,0)),0,OFFSET(R45C,MAX(-MNR,ROUND(DAYS360(ValDat,RC1,0)/30,0)-R8C+MEP-MNR),0,1,1))) -> 2952 | J67: =IF(RC1="","",IF(OR(R8C<=ROUND(DAYS360(ValDat,RC1,0)/30,0),R8C>ROUND(DAYS360(ExpDat,RC1,0)/30,0)),0,OFFSET(R45C,MAX(-MNR,ROUND(DAYS360(ValDat,RC1,0)/30,0)-R8C+MEP-MNR),0,1,1))) -> 850 | K67: =IF(RC1="","",IF(OR(R8C<=ROUND(DAYS360(ValDat,RC1,0)/30,0),R8C>ROUND(DAYS360(ExpDat,RC1,0)/30,0)),0,OFFSET(R45C,MAX(-MNR,ROUND(DAYS360(ValDat,RC1,0)/30,0)-R8C+MEP-MNR),0,1,1))) -> 0 | L67: =IF(RC1="","",IF(OR(R8C<=ROUND(DAYS360(ValDat,RC1,0)/30,0),R8C>ROUND(DAYS360(ExpDat,RC1,0)/30,0)),0,OFFSET(R45C,MAX(-MNR,ROUND(DAYS360(ValDat,RC1,0)/30,0)-R8C+MEP-MNR),0,1,1))) -> 0 | M67: =IF(RC1="","",IF(OR(R8C<=ROUND(DAYS360(ValDat,RC1,0)/30,0),R8C>ROUND(DAYS360(ExpDat,RC1,0)/30,0)),0,OFFSET(R45C,MAX(-MNR,ROUND(DAYS360(ValDat,RC1,0)/30,0)-R8C+MEP-MNR),0,1,1))) -> 0 | N67: =IF(RC1="","",IF(OR(R8C<=ROUND(DAYS360(ValDat,RC1,0)/30,0),R8C>ROUND(DAYS360(ExpDat,RC1,0)/30,0)),0,OFFSET(R45C,MAX(-MNR,ROUND(DAYS360(ValDat,RC1,0)/30,0)-R8C+MEP-MNR),0,1,1))) -> 0 | O67: =IF(RC1="","",IF(OR(R8C<=ROUND(DAYS360(ValDat,RC1,0)/30,0),R8C>ROUND(DAYS360(ExpDat,RC1,0)/30,0)),0,OFFSET(R45C,MAX(-MNR,ROUND(DAYS360(ValDat,RC1,0)/30,0)-R8C+MEP-MNR),0,1,1))) -> 0 | P67: =IF(RC1="","",IF(OR(R8C<=ROUND(DAYS360(ValDat,RC1,0)/30,0),R8C>ROUND(DAYS360(ExpDat,RC1,0)/30,0)),0,OFFSET(R45C,MAX(-MNR,ROUND(DAYS360(ValDat,RC1,0)/30,0)-R8C+MEP-MNR),0,1,1))) -> 0 | Q67: =IF(RC1="","",IF(OR(R8C<=ROUND(DAYS360(ValDat,RC1,0)/30,0),R8C>ROUND(DAYS360(ExpDat,RC1,0)/30,0)),0,OFFSET(R45C,MAX(-MNR,ROUND(DAYS360(ValDat,RC1,0)/30,0)-R8C+MEP-MNR),0,1,1))) -> 0 | R67: =IF(RC1="","",IF(OR(R8C<=ROUND(DAYS360(ValDat,RC1,0)/30,0),R8C>ROUND(DAYS360(ExpDat,RC1,0)/30,0)),0,OFFSET(R45C,MAX(-MNR,ROUND(DAYS360(ValDat,RC1,0)/30,0)-R8C+MEP-MNR),0,1,1))) -> 0 | S67: =IF(RC1="","",IF(OR(R8C<=ROUND(DAYS360(ValDat,RC1,0)/30,0),R8C>ROUND(DAYS360(ExpDat,RC1,0)/30,0)),0,OFFSET(R45C,MAX(-MNR,ROUND(DAYS360(ValDat,RC1,0)/30,0)-R8C+MEP-MNR),0,1,1))) -> 0 | T67: =IF(RC1="","",IF(OR(R8C<=ROUND(DAYS360(ValDat,RC1,0)/30,0),R8C>ROUND(DAYS360(ExpDat,RC1,0)/30,0)),0,OFFSET(R45C,MAX(-MNR,ROUND(DAYS360(ValDat,RC1,0)/30,0)-R8C+MEP-MNR),0,1,1))) -> 0 | U67: =IF(RC1="","",IF(OR(R8C<=ROUND(DAYS360(ValDat,RC1,0)/30,0),R8C>ROUND(DAYS360(ExpDat,RC1,0)/30,0)),0,OFFSET(R45C,MAX(-MNR,ROUND(DAYS360(ValDat,RC1,0)/30,0)-R8C+MEP-MNR),0,1,1))) -> 0 | V67: =IF(RC1="","",IF(OR(R8C<=ROUND(DAYS360(ValDat,RC1,0)/30,0),R8C>ROUND(DAYS360(ExpDat,RC1,0)/30,0)),0,OFFSET(R45C,MAX(-MNR,ROUND(DAYS360(ValDat,RC1,0)/30,0)-R8C+MEP-MNR),0,1,1))) -> 0 | W67: =IF(RC1="","",IF(OR(R8C<=ROUND(DAYS360(ValDat,RC1,0)/30,0),R8C>ROUND(DAYS360(ExpDat,RC1,0)/30,0)),0,OFFSET(R45C,MAX(-MNR,ROUND(DAYS360(ValDat,RC1,0)/30,0)-R8C+MEP-MNR),0,1,1))) -> 0 | X67: =IF(RC1="","",IF(OR(R8C<=ROUND(DAYS360(ValDat,RC1,0)/30,0),R8C>ROUND(DAYS360(ExpDat,RC1,0)/30,0)),0,OFFSET(R45C,MAX(-MNR,ROUND(DAYS360(ValDat,RC1,0)/30,0)-R8C+MEP-MNR),0,1,1))) -> 0 | Y67: =IF(RC1="","",IF(OR(R8C<=ROUND(DAYS360(ValDat,RC1,0)/30,0),R8C>ROUND(DAYS360(ExpDat,RC1,0)/30,0)),0,OFFSET(R45C,MAX(-MNR,ROUND(DAYS360(ValDat,RC1,0)/30,0)-R8C+MEP-MNR),0,1,1))) -> 0 | Z67: =IF(RC1="","",IF(OR(R8C<=ROUND(DAYS360(ValDat,RC1,0)/30,0),R8C>ROUND(DAYS360(ExpDat,RC1,0)/30,0)),0,OFFSET(R45C,MAX(-MNR,ROUND(DAYS360(ValDat,RC1,0)/30,0)-R8C+MEP-MNR),0,1,1))) -> 0 | AA67: =IF(RC1="","",IF(OR(R8C<=ROUND(DAYS360(ValDat,RC1,0)/30,0),R8C>ROUND(DAYS360(ExpDat,RC1,0)/30,0)),0,OFFSET(R45C,MAX(-MNR,ROUND(DAYS360(ValDat,RC1,0)/30,0)-R8C+MEP-MNR),0,1,1))) -> 0 | AB67: =IF(RC1="","",IF(OR(R8C<=ROUND(DAYS360(ValDat,RC1,0)/30,0),R8C>ROUND(DAYS360(ExpDat,RC1,0)/30,0)),0,OFFSET(R45C,MAX(-MNR,ROUND(DAYS360(ValDat,RC1,0)/30,0)-R8C+MEP-MNR),0,1,1))) -> 0 | AC67: =IF(RC1="","",IF(OR(R8C<=ROUND(DAYS360(ValDat,RC1,0)/30,0),R8C>ROUND(DAYS360(ExpDat,RC1,0)/30,0)),0,OFFSET(R45C,MAX(-MNR,ROUND(DAYS360(ValDat,RC1,0)/30,0)-R8C+MEP-MNR),0,1,1))) -> 0 | AD67: =IF(RC1="","",IF(OR(R8C<=ROUND(DAYS360(ValDat,RC1,0)/30,0),R8C>ROUND(DAYS360(ExpDat,RC1,0)/30,0)),0,OFFSET(R45C,MAX(-MNR,ROUND(DAYS360(ValDat,RC1,0)/30,0)-R8C+MEP-MNR),0,1,1))) -> 0 | AE67: =IF(RC1="","",IF(OR(R8C<=ROUND(DAYS360(ValDat,RC1,0)/30,0),R8C>ROUND(DAYS360(ExpDat,RC1,0)/30,0)),0,OFFSET(R45C,MAX(-MNR,ROUND(DAYS360(ValDat,RC1,0)/30,0)-R8C+MEP-MNR),0,1,1))) -> 0 | AF67: =IF(RC1="","",IF(OR(R8C<=ROUND(DAYS360(ValDat,RC1,0)/30,0),R8C>ROUND(DAYS360(ExpDat,RC1,0)/30,0)),0,OFFSET(R45C,MAX(-MNR,ROUND(DAYS360(ValDat,RC1,0)/30,0)-R8C+MEP-MNR),0,1,1))) -> 0 | AG67: =IF(RC1="","",IF(OR(R8C<=ROUND(DAYS360(ValDat,RC1,0)/30,0),R8C>ROUND(DAYS360(ExpDat,RC1,0)/30,0)),0,OFFSET(R45C,MAX(-MNR,ROUND(DAYS360(ValDat,RC1,0)/30,0)-R8C+MEP-MNR),0,1,1))) -> 0 | AH67: =IF(RC1="","",IF(OR(R8C<=ROUND(DAYS360(ValDat,RC1,0)/30,0),R8C>ROUND(DAYS360(ExpDat,RC1,0)/30,0)),0,OFFSET(R45C,MAX(-MNR,ROUND(DAYS360(ValDat,RC1,0)/30,0)-R8C+MEP-MNR),0,1,1))) -> 0 | AI67: =IF(RC1="","",IF(OR(R8C<=ROUND(DAYS360(ValDat,RC1,0)/30,0),R8C>ROUND(DAYS360(ExpDat,RC1,0)/30,0)),0,OFFSET(R45C,MAX(-MNR,ROUND(DAYS360(ValDat,RC1,0)/30,0)-R8C+MEP-MNR),0,1,1))) -> 0 | AJ67: =IF(RC1="","",IF(OR(R8C<=ROUND(DAYS360(ValDat,RC1,0)/30,0),R8C>ROUND(DAYS360(ExpDat,RC1,0)/30,0)),0,OFFSET(R45C,MAX(-MNR,ROUND(DAYS360(ValDat,RC1,0)/30,0)-R8C+MEP-MNR),0,1,1))) -> 0 | AK67: =IF(RC1="","",IF(OR(R8C<=ROUND(DAYS360(ValDat,RC1,0)/30,0),R8C>ROUND(DAYS360(ExpDat,RC1,0)/30,0)),0,OFFSET(R45C,MAX(-MNR,ROUND(DAYS360(ValDat,RC1,0)/30,0)-R8C+MEP-MNR),0,1,1))) -> 0 | AL67: =IF(RC1="","",IF(OR(R8C<=ROUND(DAYS360(ValDat,RC1,0)/30,0),R8C>ROUND(DAYS360(ExpDat,RC1,0)/30,0)),0,OFFSET(R45C,MAX(-MNR,ROUND(DAYS360(ValDat,RC1,0)/30,0)-R8C+MEP-MNR),0,1,1))) -> 0 | AM67: =IF(RC1="","",IF(OR(R8C<=ROUND(DAYS360(ValDat,RC1,0)/30,0),R8C>ROUND(DAYS360(ExpDat,RC1,0)/30,0)),0,OFFSET(R45C,MAX(-MNR,ROUND(DAYS360(ValDat,RC1,0)/30,0)-R8C+MEP-MNR),0,1,1))) -> 0 | AN67: =IF(RC1="","",IF(OR(R8C<=ROUND(DAYS360(ValDat,RC1,0)/30,0),R8C>ROUND(DAYS360(ExpDat,RC1,0)/30,0)),0,OFFSET(R45C,MAX(-MNR,ROUND(DAYS360(ValDat,RC1,0)/30,0)-R8C+MEP-MNR),0,1,1))) -> 0 | AO67: =IF(RC1="","",IF(OR(R8C<=ROUND(DAYS360(ValDat,RC1,0)/30,0),R8C>ROUND(DAYS360(ExpDat,RC1,0)/30,0)),0,OFFSET(R45C,MAX(-MNR,ROUND(DAYS360(ValDat,RC1,0)/30,0)-R8C+MEP-MNR),0,1,1))) -> 0
A68: =IF(R[-1]C="","",IF(EOMONTH(R[-1]C,0)+1>RunDat,"",EOMONTH(R[-1]C,0)+1)) -> 1999-06-01T00:00:00.000 | D68: =IF(RC1="","",SUM(RC[2]:RC[37])) -> 193309 | F68: =IF(RC1="","",IF(OR(R8C<=ROUND(DAYS360(ValDat,RC1,0)/30,0),R8C>ROUND(DAYS360(ExpDat,RC1,0)/30,0)),0,OFFSET(R45C,MAX(-MNR,ROUND(DAYS360(ValDat,RC1,0)/30,0)-R8C+MEP-MNR),0,1,1))) -> 6555 | G68: =IF(RC1="","",IF(OR(R8C<=ROUND(DAYS360(ValDat,RC1,0)/30,0),R8C>ROUND(DAYS360(ExpDat,RC1,0)/30,0)),0,OFFSET(R45C,MAX(-MNR,ROUND(DAYS360(ValDat,RC1,0)/30,0)-R8C+MEP-MNR),0,1,1))) -> 90083 | H68: =IF(RC1="","",IF(OR(R8C<=ROUND(DAYS360(ValDat,RC1,0)/30,0),R8C>ROUND(DAYS360(ExpDat,RC1,0)/30,0)),0,OFFSET(R45C,MAX(-MNR,ROUND(DAYS360(ValDat,RC1,0)/30,0)-R8C+MEP-MNR),0,1,1))) -> 88390 | I68: =IF(RC1="","",IF(OR(R8C<=ROUND(DAYS360(ValDat,RC1,0)/30,0),R8C>ROUND(DAYS360(ExpDat,RC1,0)/30,0)),0,OFFSET(R45C,MAX(-MNR,ROUND(DAYS360(ValDat,RC1,0)/30,0)-R8C+MEP-MNR),0,1,1))) -> 1847 | J68: =IF(RC1="","",IF(OR(R8C<=ROUND(DAYS360(ValDat,RC1,0)/30,0),R8C>ROUND(DAYS360(ExpDat,RC1,0)/30,0)),0,OFFSET(R45C,MAX(-MNR,ROUND(DAYS360(ValDat,RC1,0)/30,0)-R8C+MEP-MNR),0,1,1))) -> 6434 | K68: =IF(RC1="","",IF(OR(R8C<=ROUND(DAYS360(ValDat,RC1,0)/30,0),R8C>ROUND(DAYS360(ExpDat,RC1,0)/30,0)),0,OFFSET(R45C,MAX(-MNR,ROUND(DAYS360(ValDat,RC1,0)/30,0)-R8C+MEP-MNR),0,1,1))) -> 0 | L68: =IF(RC1="","",IF(OR(R8C<=ROUND(DAYS360(ValDat,RC1,0)/30,0),R8C>ROUND(DAYS360(ExpDat,RC1,0)/30,0)),0,OFFSET(R45C,MAX(-MNR,ROUND(DAYS360(ValDat,RC1,0)/30,0)-R8C+MEP-MNR),0,1,1))) -> 0 | M68: =IF(RC1="","",IF(OR(R8C<=ROUND(DAYS360(ValDat,RC1,0)/30,0),R8C>ROUND(DAYS360(ExpDat,RC1,0)/30,0)),0,OFFSET(R45C,MAX(-MNR,ROUND(DAYS360(ValDat,RC1,0)/30,0)-R8C+MEP-MNR),0,1,1))) -> 0 | N68: =IF(RC1="","",IF(OR(R8C<=ROUND(DAYS360(ValDat,RC1,0)/30,0),R8C>ROUND(DAYS360(ExpDat,RC1,0)/30,0)),0,OFFSET(R45C,MAX(-MNR,ROUND(DAYS360(ValDat,RC1,0)/30,0)-R8C+MEP-MNR),0,1,1))) -> 0 | O68: =IF(RC1="","",IF(OR(R8C<=ROUND(DAYS360(ValDat,RC1,0)/30,0),R8C>ROUND(DAYS360(ExpDat,RC1,0)/30,0)),0,OFFSET(R45C,MAX(-MNR,ROUND(DAYS360(ValDat,RC1,0)/30,0)-R8C+MEP-MNR),0,1,1))) -> 0 | P68: =IF(RC1="","",IF(OR(R8C<=ROUND(DAYS360(ValDat,RC1,0)/30,0),R8C>ROUND(DAYS360(ExpDat,RC1,0)/30,0)),0,OFFSET(R45C,MAX(-MNR,ROUND(DAYS360(ValDat,RC1,0)/30,0)-R8C+MEP-MNR),0,1,1))) -> 0 | Q68: =IF(RC1="","",IF(OR(R8C<=ROUND(DAYS360(ValDat,RC1,0)/30,0),R8C>ROUND(DAYS360(ExpDat,RC1,0)/30,0)),0,OFFSET(R45C,MAX(-MNR,ROUND(DAYS360(ValDat,RC1,0)/30,0)-R8C+MEP-MNR),0,1,1))) -> 0 | R68: =IF(RC1="","",IF(OR(R8C<=ROUND(DAYS360(ValDat,RC1,0)/30,0),R8C>ROUND(DAYS360(ExpDat,RC1,0)/30,0)),0,OFFSET(R45C,MAX(-MNR,ROUND(DAYS360(ValDat,RC1,0)/30,0)-R8C+MEP-MNR),0,1,1))) -> 0 | S68: =IF(RC1="","",IF(OR(R8C<=ROUND(DAYS360(ValDat,RC1,0)/30,0),R8C>ROUND(DAYS360(ExpDat,RC1,0)/30,0)),0,OFFSET(R45C,MAX(-MNR,ROUND(DAYS360(ValDat,RC1,0)/30,0)-R8C+MEP-MNR),0,1,1))) -> 0 | T68: =IF(RC1="","",IF(OR(R8C<=ROUND(DAYS360(ValDat,RC1,0)/30,0),R8C>ROUND(DAYS360(ExpDat,RC1,0)/30,0)),0,OFFSET(R45C,MAX(-MNR,ROUND(DAYS360(ValDat,RC1,0)/30,0)-R8C+MEP-MNR),0,1,1))) -> 0 | U68: =IF(RC1="","",IF(OR(R8C<=ROUND(DAYS360(ValDat,RC1,0)/30,0),R8C>ROUND(DAYS360(ExpDat,RC1,0)/30,0)),0,OFFSET(R45C,MAX(-MNR,ROUND(DAYS360(ValDat,RC1,0)/30,0)-R8C+MEP-MNR),0,1,1))) -> 0 | V68: =IF(RC1="","",IF(OR(R8C<=ROUND(DAYS360(ValDat,RC1,0)/30,0),R8C>ROUND(DAYS360(ExpDat,RC1,0)/30,0)),0,OFFSET(R45C,MAX(-MNR,ROUND(DAYS360(ValDat,RC1,0)/30,0)-R8C+MEP-MNR),0,1,1))) -> 0 | W68: =IF(RC1="","",IF(OR(R8C<=ROUND(DAYS360(ValDat,RC1,0)/30,0),R8C>ROUND(DAYS360(ExpDat,RC1,0)/30,0)),0,OFFSET(R45C,MAX(-MNR,ROUND(DAYS360(ValDat,RC1,0)/30,0)-R8C+MEP-MNR),0,1,1))) -> 0 | X68: =IF(RC1="","",IF(OR(R8C<=ROUND(DAYS360(ValDat,RC1,0)/30,0),R8C>ROUND(DAYS360(ExpDat,RC1,0)/30,0)),0,OFFSET(R45C,MAX(-MNR,ROUND(DAYS360(ValDat,RC1,0)/30,0)-R8C+MEP-MNR),0,1,1))) -> 0 | Y68: =IF(RC1="","",IF(OR(R8C<=ROUND(DAYS360(ValDat,RC1,0)/30,0),R8C>ROUND(DAYS360(ExpDat,RC1,0)/30,0)),0,OFFSET(R45C,MAX(-MNR,ROUND(DAYS360(ValDat,RC1,0)/30,0)-R8C+MEP-MNR),0,1,1))) -> 0 | Z68: =IF(RC1="","",IF(OR(R8C<=ROUND(DAYS360(ValDat,RC1,0)/30,0),R8C>ROUND(DAYS360(ExpDat,RC1,0)/30,0)),0,OFFSET(R45C,MAX(-MNR,ROUND(DAYS360(ValDat,RC1,0)/30,0)-R8C+MEP-MNR),0,1,1))) -> 0 | AA68: =IF(RC1="","",IF(OR(R8C<=ROUND(DAYS360(ValDat,RC1,0)/30,0),R8C>ROUND(DAYS360(ExpDat,RC1,0)/30,0)),0,OFFSET(R45C,MAX(-MNR,ROUND(DAYS360(ValDat,RC1,0)/30,0)-R8C+MEP-MNR),0,1,1))) -> 0 | AB68: =IF(RC1="","",IF(OR(R8C<=ROUND(DAYS360(ValDat,RC1,0)/30,0),R8C>ROUND(DAYS360(ExpDat,RC1,0)/30,0)),0,OFFSET(R45C,MAX(-MNR,ROUND(DAYS360(ValDat,RC1,0)/30,0)-R8C+MEP-MNR),0,1,1))) -> 0 | AC68: =IF(RC1="","",IF(OR(R8C<=ROUND(DAYS360(ValDat,RC1,0)/30,0),R8C>ROUND(DAYS360(ExpDat,RC1,0)/30,0)),0,OFFSET(R45C,MAX(-MNR,ROUND(DAYS360(ValDat,RC1,0)/30,0)-R8C+MEP-MNR),0,1,1))) -> 0 | AD68: =IF(RC1="","",IF(OR(R8C<=ROUND(DAYS360(ValDat,RC1,0)/30,0),R8C>ROUND(DAYS360(ExpDat,RC1,0)/30,0)),0,OFFSET(R45C,MAX(-MNR,ROUND(DAYS360(ValDat,RC1,0)/30,0)-R8C+MEP-MNR),0,1,1))) -> 0 | AE68: =IF(RC1="","",IF(OR(R8C<=ROUND(DAYS360(ValDat,RC1,0)/30,0),R8C>ROUND(DAYS360(ExpDat,RC1,0)/30,0)),0,OFFSET(R45C,MAX(-MNR,ROUND(DAYS360(ValDat,RC1,0)/30,0)-R8C+MEP-MNR),0,1,1))) -> 0 | AF68: =IF(RC1="","",IF(OR(R8C<=ROUND(DAYS360(ValDat,RC1,0)/30,0),R8C>ROUND(DAYS360(ExpDat,RC1,0)/30,0)),0,OFFSET(R45C,MAX(-MNR,ROUND(DAYS360(ValDat,RC1,0)/30,0)-R8C+MEP-MNR),0,1,1))) -> 0 | AG68: =IF(RC1="","",IF(OR(R8C<=ROUND(DAYS360(ValDat,RC1,0)/30,0),R8C>ROUND(DAYS360(ExpDat,RC1,0)/30,0)),0,OFFSET(R45C,MAX(-MNR,ROUND(DAYS360(ValDat,RC1,0)/30,0)-R8C+MEP-MNR),0,1,1))) -> 0 | AH68: =IF(RC1="","",IF(OR(R8C<=ROUND(DAYS360(ValDat,RC1,0)/30,0),R8C>ROUND(DAYS360(ExpDat,RC1,0)/30,0)),0,OFFSET(R45C,MAX(-MNR,ROUND(DAYS360(ValDat,RC1,0)/30,0)-R8C+MEP-MNR),0,1,1))) -> 0 | AI68: =IF(RC1="","",IF(OR(R8C<=ROUND(DAYS360(ValDat,RC1,0)/30,0),R8C>ROUND(DAYS360(ExpDat,RC1,0)/30,0)),0,OFFSET(R45C,MAX(-MNR,ROUND(DAYS360(ValDat,RC1,0)/30,0)-R8C+MEP-MNR),0,1,1))) -> 0 | AJ68: =IF(RC1="","",IF(OR(R8C<=ROUND(DAYS360(ValDat,RC1,0)/30,0),R8C>ROUND(DAYS360(ExpDat,RC1,0)/30,0)),0,OFFSET(R45C,MAX(-MNR,ROUND(DAYS360(ValDat,RC1,0)/30,0)-R8C+MEP-MNR),0,1,1))) -> 0 | AK68: =IF(RC1="","",IF(OR(R8C<=ROUND(DAYS360(ValDat,RC1,0)/30,0),R8C>ROUND(DAYS360(ExpDat,RC1,0)/30,0)),0,OFFSET(R45C,MAX(-MNR,ROUND(DAYS360(ValDat,RC1,0)/30,0)-R8C+MEP-MNR),0,1,1))) -> 0 | AL68: =IF(RC1="","",IF(OR(R8C<=ROUND(DAYS360(ValDat,RC1,0)/30,0),R8C>ROUND(DAYS360(ExpDat,RC1,0)/30,0)),0,OFFSET(R45C,MAX(-MNR,ROUND(DAYS360(ValDat,RC1,0)/30,0)-R8C+MEP-MNR),0,1,1))) -> 0 | AM68: =IF(RC1="","",IF(OR(R8C<=ROUND(DAYS360(ValDat,RC1,0)/30,0),R8C>ROUND(DAYS360(ExpDat,RC1,0)/30,0)),0,OFFSET(R45C,MAX(-MNR,ROUND(DAYS360(ValDat,RC1,0)/30,0)-R8C+MEP-MNR),0,1,1))) -> 0 | AN68: =IF(RC1="","",IF(OR(R8C<=ROUND(DAYS360(ValDat,RC1,0)/30,0),R8C>ROUND(DAYS360(ExpDat,RC1,0)/30,0)),0,OFFSET(R45C,MAX(-MNR,ROUND(DAYS360(ValDat,RC1,0)/30,0)-R8C+MEP-MNR),0,1,1))) -> 0 | AO68: =IF(RC1="","",IF(OR(R8C<=ROUND(DAYS360(ValDat,RC1,0)/30,0),R8C>ROUND(DAYS360(ExpDat,RC1,0)/30,0)),0,OFFSET(R45C,MAX(-MNR,ROUND(DAYS360(ValDat,RC1,0)/30,0)-R8C+MEP-MNR),0,1,1))) -> 0
A69: =IF(R[-1]C="","",IF(EOMONTH(R[-1]C,0)+1>RunDat,"",EOMONTH(R[-1]C,0)+1)) -> 1999-07-01T00:00:00.000 | D69: =IF(RC1="","",SUM(RC[2]:RC[37])) -> 325214 | F69: =IF(RC1="","",IF(OR(R8C<=ROUND(DAYS360(ValDat,RC1,0)/30,0),R8C>ROUND(DAYS360(ExpDat,RC1,0)/30,0)),0,OFFSET(R45C,MAX(-MNR,ROUND(DAYS360(ValDat,RC1,0)/30,0)-R8C+MEP-MNR),0,1,1))) -> 57812 | G69: =IF(RC1="","",IF(OR(R8C<=ROUND(DAYS360(ValDat,RC1,0)/30,0),R8C>ROUND(DAYS360(ExpDat,RC1,0)/30,0)),0,OFFSET(R45C,MAX(-MNR,ROUND(DAYS360(ValDat,RC1,0)/30,0)-R8C+MEP-MNR),0,1,1))) -> 111208 | H69: =IF(RC1="","",IF(OR(R8C<=ROUND(DAYS360(ValDat,RC1,0)/30,0),R8C>ROUND(DAYS360(ExpDat,RC1,0)/30,0)),0,OFFSET(R45C,MAX(-MNR,ROUND(DAYS360(ValDat,RC1,0)/30,0)-R8C+MEP-MNR),0,1,1))) -> 107509 | I69: =IF(RC1="","",IF(OR(R8C<=ROUND(DAYS360(ValDat,RC1,0)/30,0),R8C>ROUND(DAYS360(ExpDat,RC1,0)/30,0)),0,OFFSET(R45C,MAX(-MNR,ROUND(DAYS360(ValDat,RC1,0)/30,0)-R8C+MEP-MNR),0,1,1))) -> 43589 | J69: =IF(RC1="","",IF(OR(R8C<=ROUND(DAYS360(ValDat,RC1,0)/30,0),R8C>ROUND(DAYS360(ExpDat,RC1,0)/30,0)),0,OFFSET(R45C,MAX(-MNR,ROUND(DAYS360(ValDat,RC1,0)/30,0)-R8C+MEP-MNR),0,1,1))) -> 3742 | K69: =IF(RC1="","",IF(OR(R8C<=ROUND(DAYS360(ValDat,RC1,0)/30,0),R8C>ROUND(DAYS360(ExpDat,RC1,0)/30,0)),0,OFFSET(R45C,MAX(-MNR,ROUND(DAYS360(ValDat,RC1,0)/30,0)-R8C+MEP-MNR),0,1,1))) -> 1354 | L69: =IF(RC1="","",IF(OR(R8C<=ROUND(DAYS360(ValDat,RC1,0)/30,0),R8C>ROUND(DAYS360(ExpDat,RC1,0)/30,0)),0,OFFSET(R45C,MAX(-MNR,ROUND(DAYS360(ValDat,RC1,0)/30,0)-R8C+MEP-MNR),0,1,1))) -> 0 | M69: =IF(RC1="","",IF(OR(R8C<=ROUND(DAYS360(ValDat,RC1,0)/30,0),R8C>ROUND(DAYS360(ExpDat,RC1,0)/30,0)),0,OFFSET(R45C,MAX(-MNR,ROUND(DAYS360(ValDat,RC1,0)/30,0)-R8C+MEP-MNR),0,1,1))) -> 0 | N69: =IF(RC1="","",IF(OR(R8C<=ROUND(DAYS360(ValDat,RC1,0)/30,0),R8C>ROUND(DAYS360(ExpDat,RC1,0)/30,0)),0,OFFSET(R45C,MAX(-MNR,ROUND(DAYS360(ValDat,RC1,0)/30,0)-R8C+MEP-MNR),0,1,1))) -> 0 | O69: =IF(RC1="","",IF(OR(R8C<=ROUND(DAYS360(ValDat,RC1,0)/30,0),R8C>ROUND(DAYS360(ExpDat,RC1,0)/30,0)),0,OFFSET(R45C,MAX(-MNR,ROUND(DAYS360(ValDat,RC1,0)/30,0)-R8C+MEP-MNR),0,1,1))) -> 0 | P69: =IF(RC1="","",IF(OR(R8C<=ROUND(DAYS360(ValDat,RC1,0)/30,0),R8C>ROUND(DAYS360(ExpDat,RC1,0)/30,0)),0,OFFSET(R45C,MAX(-MNR,ROUND(DAYS360(ValDat,RC1,0)/30,0)-R8C+MEP-MNR),0,1,1))) -> 0 | Q69: =IF(RC1="","",IF(OR(R8C<=ROUND(DAYS360(ValDat,RC1,0)/30,0),R8C>ROUND(DAYS360(ExpDat,RC1,0)/30,0)),0,OFFSET(R45C,MAX(-MNR,ROUND(DAYS360(ValDat,RC1,0)/30,0)-R8C+MEP-MNR),0,1,1))) -> 0 | R69: =IF(RC1="","",IF(OR(R8C<=ROUND(DAYS360(ValDat,RC1,0)/30,0),R8C>ROUND(DAYS360(ExpDat,RC1,0)/30,0)),0,OFFSET(R45C,MAX(-MNR,ROUND(DAYS360(ValDat,RC1,0)/30,0)-R8C+MEP-MNR),0,1,1))) -> 0 | S69: =IF(RC1="","",IF(OR(R8C<=ROUND(DAYS360(ValDat,RC1,0)/30,0),R8C>ROUND(DAYS360(ExpDat,RC1,0)/30,0)),0,OFFSET(R45C,MAX(-MNR,ROUND(DAYS360(ValDat,RC1,0)/30,0)-R8C+MEP-MNR),0,1,1))) -> 0 | T69: =IF(RC1="","",IF(OR(R8C<=ROUND(DAYS360(ValDat,RC1,0)/30,0),R8C>ROUND(DAYS360(ExpDat,RC1,0)/30,0)),0,OFFSET(R45C,MAX(-MNR,ROUND(DAYS360(ValDat,RC1,0)/30,0)-R8C+MEP-MNR),0,1,1))) -> 0 | U69: =IF(RC1="","",IF(OR(R8C<=ROUND(DAYS360(ValDat,RC1,0)/30,0),R8C>ROUND(DAYS360(ExpDat,RC1,0)/30,0)),0,OFFSET(R45C,MAX(-MNR,ROUND(DAYS360(ValDat,RC1,0)/30,0)-R8C+MEP-MNR),0,1,1))) -> 0 | V69: =IF(RC1="","",IF(OR(R8C<=ROUND(DAYS360(ValDat,RC1,0)/30,0),R8C>ROUND(DAYS360(ExpDat,RC1,0)/30,0)),0,OFFSET(R45C,MAX(-MNR,ROUND(DAYS360(ValDat,RC1,0)/30,0)-R8C+MEP-MNR),0,1,1))) -> 0 | W69: =IF(RC1="","",IF(OR(R8C<=ROUND(DAYS360(ValDat,RC1,0)/30,0),R8C>ROUND(DAYS360(ExpDat,RC1,0)/30,0)),0,OFFSET(R45C,MAX(-MNR,ROUND(DAYS360(ValDat,RC1,0)/30,0)-R8C+MEP-MNR),0,1,1))) -> 0 | X69: =IF(RC1="","",IF(OR(R8C<=ROUND(DAYS360(ValDat,RC1,0)/30,0),R8C>ROUND(DAYS360(ExpDat,RC1,0)/30,0)),0,OFFSET(R45C,MAX(-MNR,ROUND(DAYS360(ValDat,RC1,0)/30,0)-R8C+MEP-MNR),0,1,1))) -> 0 | Y69: =IF(RC1="","",IF(OR(R8C<=ROUND(DAYS360(ValDat,RC1,0)/30,0),R8C>ROUND(DAYS360(ExpDat,RC1,0)/30,0)),0,OFFSET(R45C,MAX(-MNR,ROUND(DAYS360(ValDat,RC1,0)/30,0)-R8C+MEP-MNR),0,1,1))) -> 0 | Z69: =IF(RC1="","",IF(OR(R8C<=ROUND(DAYS360(ValDat,RC1,0)/30,0),R8C>ROUND(DAYS360(ExpDat,RC1,0)/30,0)),0,OFFSET(R45C,MAX(-MNR,ROUND(DAYS360(ValDat,RC1,0)/30,0)-R8C+MEP-MNR),0,1,1))) -> 0 | AA69: =IF(RC1="","",IF(OR(R8C<=ROUND(DAYS360(ValDat,RC1,0)/30,0),R8C>ROUND(DAYS360(ExpDat,RC1,0)/30,0)),0,OFFSET(R45C,MAX(-MNR,ROUND(DAYS360(ValDat,RC1,0)/30,0)-R8C+MEP-MNR),0,1,1))) -> 0 | AB69: =IF(RC1="","",IF(OR(R8C<=ROUND(DAYS360(ValDat,RC1,0)/30,0),R8C>ROUND(DAYS360(ExpDat,RC1,0)/30,0)),0,OFFSET(R45C,MAX(-MNR,ROUND(DAYS360(ValDat,RC1,0)/30,0)-R8C+MEP-MNR),0,1,1))) -> 0 | AC69: =IF(RC1="","",IF(OR(R8C<=ROUND(DAYS360(ValDat,RC1,0)/30,0),R8C>ROUND(DAYS360(ExpDat,RC1,0)/30,0)),0,OFFSET(R45C,MAX(-MNR,ROUND(DAYS360(ValDat,RC1,0)/30,0)-R8C+MEP-MNR),0,1,1))) -> 0 | AD69: =IF(RC1="","",IF(OR(R8C<=ROUND(DAYS360(ValDat,RC1,0)/30,0),R8C>ROUND(DAYS360(ExpDat,RC1,0)/30,0)),0,OFFSET(R45C,MAX(-MNR,ROUND(DAYS360(ValDat,RC1,0)/30,0)-R8C+MEP-MNR),0,1,1))) -> 0 | AE69: =IF(RC1="","",IF(OR(R8C<=ROUND(DAYS360(ValDat,RC1,0)/30,0),R8C>ROUND(DAYS360(ExpDat,RC1,0)/30,0)),0,OFFSET(R45C,MAX(-MNR,ROUND(DAYS360(ValDat,RC1,0)/30,0)-R8C+MEP-MNR),0,1,1))) -> 0 | AF69: =IF(RC1="","",IF(OR(R8C<=ROUND(DAYS360(ValDat,RC1,0)/30,0),R8C>ROUND(DAYS360(ExpDat,RC1,0)/30,0)),0,OFFSET(R45C,MAX(-MNR,ROUND(DAYS360(ValDat,RC1,0)/30,0)-R8C+MEP-MNR),0,1,1))) -> 0 | AG69: =IF(RC1="","",IF(OR(R8C<=ROUND(DAYS360(ValDat,RC1,0)/30,0),R8C>ROUND(DAYS360(ExpDat,RC1,0)/30,0)),0,OFFSET(R45C,MAX(-MNR,ROUND(DAYS360(ValDat,RC1,0)/30,0)-R8C+MEP-MNR),0,1,1))) -> 0 | AH69: =IF(RC1="","",IF(OR(R8C<=ROUND(DAYS360(ValDat,RC1,0)/30,0),R8C>ROUND(DAYS360(ExpDat,RC1,0)/30,0)),0,OFFSET(R45C,MAX(-MNR,ROUND(DAYS360(ValDat,RC1,0)/30,0)-R8C+MEP-MNR),0,1,1))) -> 0 | AI69: =IF(RC1="","",IF(OR(R8C<=ROUND(DAYS360(ValDat,RC1,0)/30,0),R8C>ROUND(DAYS360(ExpDat,RC1,0)/30,0)),0,OFFSET(R45C,MAX(-MNR,ROUND(DAYS360(ValDat,RC1,0)/30,0)-R8C+MEP-MNR),0,1,1))) -> 0 | AJ69: =IF(RC1="","",IF(OR(R8C<=ROUND(DAYS360(ValDat,RC1,0)/30,0),R8C>ROUND(DAYS360(ExpDat,RC1,0)/30,0)),0,OFFSET(R45C,MAX(-MNR,ROUND(DAYS360(ValDat,RC1,0)/30,0)-R8C+MEP-MNR),0,1,1))) -> 0 | AK69: =IF(RC1="","",IF(OR(R8C<=ROUND(DAYS360(ValDat,RC1,0)/30,0),R8C>ROUND(DAYS360(ExpDat,RC1,0)/30,0)),0,OFFSET(R45C,MAX(-MNR,ROUND(DAYS360(ValDat,RC1,0)/30,0)-R8C+MEP-MNR),0,1,1))) -> 0 | AL69: =IF(RC1="","",IF(OR(R8C<=ROUND(DAYS360(ValDat,RC1,0)/30,0),R8C>ROUND(DAYS360(ExpDat,RC1,0)/30,0)),0,OFFSET(R45C,MAX(-MNR,ROUND(DAYS360(ValDat,RC1,0)/30,0)-R8C+MEP-MNR),0,1,1))) -> 0 | AM69: =IF(RC1="","",IF(OR(R8C<=ROUND(DAYS360(ValDat,RC1,0)/30,0),R8C>ROUND(DAYS360(ExpDat,RC1,0)/30,0)),0,OFFSET(R45C,MAX(-MNR,ROUND(DAYS360(ValDat,RC1,0)/30,0)-R8C+MEP-MNR),0,1,1))) -> 0 | AN69: =IF(RC1="","",IF(OR(R8C<=ROUND(DAYS360(ValDat,RC1,0)/30,0),R8C>ROUND(DAYS360(ExpDat,RC1,0)/30,0)),0,OFFSET(R45C,MAX(-MNR,ROUND(DAYS360(ValDat,RC1,0)/30,0)-R8C+MEP-MNR),0,1,1))) -> 0 | AO69: =IF(RC1="","",IF(OR(R8C<=ROUND(DAYS360(ValDat,RC1,0)/30,0),R8C>ROUND(DAYS360(ExpDat,RC1,0)/30,0)),0,OFFSET(R45C,MAX(-MNR,ROUND(DAYS360(ValDat,RC1,0)/30,0)-R8C+MEP-MNR),0,1,1))) -> 0
A70: =IF(R[-1]C="","",IF(EOMONTH(R[-1]C,0)+1>RunDat,"",EOMONTH(R[-1]C,0)+1)) -> 1999-08-01T00:00:00.000 | D70: =IF(RC1="","",SUM(RC[2]:RC[37])) -> 155277 | F70: =IF(RC1="","",IF(OR(R8C<=ROUND(DAYS360(ValDat,RC1,0)/30,0),R8C>ROUND(DAYS360(ExpDat,RC1,0)/30,0)),0,OFFSET(R45C,MAX(-MNR,ROUND(DAYS360(ValDat,RC1,0)/30,0)-R8C+MEP-MNR),0,1,1))) -> 17973 | G70: =IF(RC1="","",IF(OR(R8C<=ROUND(DAYS360(ValDat,RC1,0)/30,0),R8C>ROUND(DAYS360(ExpDat,RC1,0)/30,0)),0,OFFSET(R45C,MAX(-MNR,ROUND(DAYS360(ValDat,RC1,0)/30,0)-R8C+MEP-MNR),0,1,1))) -> 73515 | H70: =IF(RC1="","",IF(OR(R8C<=ROUND(DAYS360(ValDat,RC1,0)/30,0),R8C>ROUND(DAYS360(ExpDat,RC1,0)/30,0)),0,OFFSET(R45C,MAX(-MNR,ROUND(DAYS360(ValDat,RC1,0)/30,0)-R8C+MEP-MNR),0,1,1))) -> 44850 | I70: =IF(RC1="","",IF(OR(R8C<=ROUND(DAYS360(ValDat,RC1,0)/30,0),R8C>ROUND(DAYS360(ExpDat,RC1,0)/30,0)),0,OFFSET(R45C,MAX(-MNR,ROUND(DAYS360(ValDat,RC1,0)/30,0)-R8C+MEP-MNR),0,1,1))) -> 13397 | J70: =IF(RC1="","",IF(OR(R8C<=ROUND(DAYS360(ValDat,RC1,0)/30,0),R8C>ROUND(DAYS360(ExpDat,RC1,0)/30,0)),0,OFFSET(R45C,MAX(-MNR,ROUND(DAYS360(ValDat,RC1,0)/30,0)-R8C+MEP-MNR),0,1,1))) -> 3662 | K70: =IF(RC1="","",IF(OR(R8C<=ROUND(DAYS360(ValDat,RC1,0)/30,0),R8C>ROUND(DAYS360(ExpDat,RC1,0)/30,0)),0,OFFSET(R45C,MAX(-MNR,ROUND(DAYS360(ValDat,RC1,0)/30,0)-R8C+MEP-MNR),0,1,1))) -> 1210 | L70: =IF(RC1="","",IF(OR(R8C<=ROUND(DAYS360(ValDat,RC1,0)/30,0),R8C>ROUND(DAYS360(ExpDat,RC1,0)/30,0)),0,OFFSET(R45C,MAX(-MNR,ROUND(DAYS360(ValDat,RC1,0)/30,0)-R8C+MEP-MNR),0,1,1))) -> 670 | M70: =IF(RC1="","",IF(OR(R8C<=ROUND(DAYS360(ValDat,RC1,0)/30,0),R8C>ROUND(DAYS360(ExpDat,RC1,0)/30,0)),0,OFFSET(R45C,MAX(-MNR,ROUND(DAYS360(ValDat,RC1,0)/30,0)-R8C+MEP-MNR),0,1,1))) -> 0 | N70: =IF(RC1="","",IF(OR(R8C<=ROUND(DAYS360(ValDat,RC1,0)/30,0),R8C>ROUND(DAYS360(ExpDat,RC1,0)/30,0)),0,OFFSET(R45C,MAX(-MNR,ROUND(DAYS360(ValDat,RC1,0)/30,0)-R8C+MEP-MNR),0,1,1))) -> 0 | O70: =IF(RC1="","",IF(OR(R8C<=ROUND(DAYS360(ValDat,RC1,0)/30,0),R8C>ROUND(DAYS360(ExpDat,RC1,0)/30,0)),0,OFFSET(R45C,MAX(-MNR,ROUND(DAYS360(ValDat,RC1,0)/30,0)-R8C+MEP-MNR),0,1,1))) -> 0 | P70: =IF(RC1="","",IF(OR(R8C<=ROUND(DAYS360(ValDat,RC1,0)/30,0),R8C>ROUND(DAYS360(ExpDat,RC1,0)/30,0)),0,OFFSET(R45C,MAX(-MNR,ROUND(DAYS360(ValDat,RC1,0)/30,0)-R8C+MEP-MNR),0,1,1))) -> 0 | Q70: =IF(RC1="","",IF(OR(R8C<=ROUND(DAYS360(ValDat,RC1,0)/30,0),R8C>ROUND(DAYS360(ExpDat,RC1,0)/30,0)),0,OFFSET(R45C,MAX(-MNR,ROUND(DAYS360(ValDat,RC1,0)/30,0)-R8C+MEP-MNR),0,1,1))) -> 0 | R70: =IF(RC1="","",IF(OR(R8C<=ROUND(DAYS360(ValDat,RC1,0)/30,0),R8C>ROUND(DAYS360(ExpDat,RC1,0)/30,0)),0,OFFSET(R45C,MAX(-MNR,ROUND(DAYS360(ValDat,RC1,0)/30,0)-R8C+MEP-MNR),0,1,1))) -> 0 | S70: =IF(RC1="","",IF(OR(R8C<=ROUND(DAYS360(ValDat,RC1,0)/30,0),R8C>ROUND(DAYS360(ExpDat,RC1,0)/30,0)),0,OFFSET(R45C,MAX(-MNR,ROUND(DAYS360(ValDat,RC1,0)/30,0)-R8C+MEP-MNR),0,1,1))) -> 0 | T70: =IF(RC1="","",IF(OR(R8C<=ROUND(DAYS360(ValDat,RC1,0)/30,0),R8C>ROUND(DAYS360(ExpDat,RC1,0)/30,0)),0,OFFSET(R45C,MAX(-MNR,ROUND(DAYS360(ValDat,RC1,0)/30,0)-R8C+MEP-MNR),0,1,1))) -> 0 | U70: =IF(RC1="","",IF(OR(R8C<=ROUND(DAYS360(ValDat,RC1,0)/30,0),R8C>ROUND(DAYS360(ExpDat,RC1,0)/30,0)),0,OFFSET(R45C,MAX(-MNR,ROUND(DAYS360(ValDat,RC1,0)/30,0)-R8C+MEP-MNR),0,1,1))) -> 0 | V70: =IF(RC1="","",IF(OR(R8C<=ROUND(DAYS360(ValDat,RC1,0)/30,0),R8C>ROUND(DAYS360(ExpDat,RC1,0)/30,0)),0,OFFSET(R45C,MAX(-MNR,ROUND(DAYS360(ValDat,RC1,0)/30,0)-R8C+MEP-MNR),0,1,1))) -> 0 | W70: =IF(RC1="","",IF(OR(R8C<=ROUND(DAYS360(ValDat,RC1,0)/30,0),R8C>ROUND(DAYS360(ExpDat,RC1,0)/30,0)),0,OFFSET(R45C,MAX(-MNR,ROUND(DAYS360(ValDat,RC1,0)/30,0)-R8C+MEP-MNR),0,1,1))) -> 0 | X70: =IF(RC1="","",IF(OR(R8C<=ROUND(DAYS360(ValDat,RC1,0)/30,0),R8C>ROUND(DAYS360(ExpDat,RC1,0)/30,0)),0,OFFSET(R45C,MAX(-MNR,ROUND(DAYS360(ValDat,RC1,0)/30,0)-R8C+MEP-MNR),0,1,1))) -> 0 | Y70: =IF(RC1="","",IF(OR(R8C<=ROUND(DAYS360(ValDat,RC1,0)/30,0),R8C>ROUND(DAYS360(ExpDat,RC1,0)/30,0)),0,OFFSET(R45C,MAX(-MNR,ROUND(DAYS360(ValDat,RC1,0)/30,0)-R8C+MEP-MNR),0,1,1))) -> 0 | Z70: =IF(RC1="","",IF(OR(R8C<=ROUND(DAYS360(ValDat,RC1,0)/30,0),R8C>ROUND(DAYS360(ExpDat,RC1,0)/30,0)),0,OFFSET(R45C,MAX(-MNR,ROUND(DAYS360(ValDat,RC1,0)/30,0)-R8C+MEP-MNR),0,1,1))) -> 0 | AA70: =IF(RC1="","",IF(OR(R8C<=ROUND(DAYS360(ValDat,RC1,0)/30,0),R8C>ROUND(DAYS360(ExpDat,RC1,0)/30,0)),0,OFFSET(R45C,MAX(-MNR,ROUND(DAYS360(ValDat,RC1,0)/30,0)-R8C+MEP-MNR),0,1,1))) -> 0 | AB70: =IF(RC1="","",IF(OR(R8C<=ROUND(DAYS360(ValDat,RC1,0)/30,0),R8C>ROUND(DAYS360(ExpDat,RC1,0)/30,0)),0,OFFSET(R45C,MAX(-MNR,ROUND(DAYS360(ValDat,RC1,0)/30,0)-R8C+MEP-MNR),0,1,1))) -> 0 | AC70: =IF(RC1="","",IF(OR(R8C<=ROUND(DAYS360(ValDat,RC1,0)/30,0),R8C>ROUND(DAYS360(ExpDat,RC1,0)/30,0)),0,OFFSET(R45C,MAX(-MNR,ROUND(DAYS360(ValDat,RC1,0)/30,0)-R8C+MEP-MNR),0,1,1))) -> 0 | AD70: =IF(RC1="","",IF(OR(R8C<=ROUND(DAYS360(ValDat,RC1,0)/30,0),R8C>ROUND(DAYS360(ExpDat,RC1,0)/30,0)),0,OFFSET(R45C,MAX(-MNR,ROUND(DAYS360(ValDat,RC1,0)/30,0)-R8C+MEP-MNR),0,1,1))) -> 0 | AE70: =IF(RC1="","",IF(OR(R8C<=ROUND(DAYS360(ValDat,RC1,0)/30,0),R8C>ROUND(DAYS360(ExpDat,RC1,0)/30,0)),0,OFFSET(R45C,MAX(-MNR,ROUND(DAYS360(ValDat,RC1,0)/30,0)-R8C+MEP-MNR),0,1,1))) -> 0 | AF70: =IF(RC1="","",IF(OR(R8C<=ROUND(DAYS360(ValDat,RC1,0)/30,0),R8C>ROUND(DAYS360(ExpDat,RC1,0)/30,0)),0,OFFSET(R45C,MAX(-MNR,ROUND(DAYS360(ValDat,RC1,0)/30,0)-R8C+MEP-MNR),0,1,1))) -> 0 | AG70: =IF(RC1="","",IF(OR(R8C<=ROUND(DAYS360(ValDat,RC1,0)/30,0),R8C>ROUND(DAYS360(ExpDat,RC1,0)/30,0)),0,OFFSET(R45C,MAX(-MNR,ROUND(DAYS360(ValDat,RC1,0)/30,0)-R8C+MEP-MNR),0,1,1))) -> 0 | AH70: =IF(RC1="","",IF(OR(R8C<=ROUND(DAYS360(ValDat,RC1,0)/30,0),R8C>ROUND(DAYS360(ExpDat,RC1,0)/30,0)),0,OFFSET(R45C,MAX(-MNR,ROUND(DAYS360(ValDat,RC1,0)/30,0)-R8C+MEP-MNR),0,1,1))) -> 0 | AI70: =IF(RC1="","",IF(OR(R8C<=ROUND(DAYS360(ValDat,RC1,0)/30,0),R8C>ROUND(DAYS360(ExpDat,RC1,0)/30,0)),0,OFFSET(R45C,MAX(-MNR,ROUND(DAYS360(ValDat,RC1,0)/30,0)-R8C+MEP-MNR),0,1,1))) -> 0 | AJ70: =IF(RC1="","",IF(OR(R8C<=ROUND(DAYS360(ValDat,RC1,0)/30,0),R8C>ROUND(DAYS360(ExpDat,RC1,0)/30,0)),0,OFFSET(R45C,MAX(-MNR,ROUND(DAYS360(ValDat,RC1,0)/30,0)-R8C+MEP-MNR),0,1,1))) -> 0 | AK70: =IF(RC1="","",IF(OR(R8C<=ROUND(DAYS360(ValDat,RC1,0)/30,0),R8C>ROUND(DAYS360(ExpDat,RC1,0)/30,0)),0,OFFSET(R45C,MAX(-MNR,ROUND(DAYS360(ValDat,RC1,0)/30,0)-R8C+MEP-MNR),0,1,1))) -> 0 | AL70: =IF(RC1="","",IF(OR(R8C<=ROUND(DAYS360(ValDat,RC1,0)/30,0),R8C>ROUND(DAYS360(ExpDat,RC1,0)/30,0)),0,OFFSET(R45C,MAX(-MNR,ROUND(DAYS360(ValDat,RC1,0)/30,0)-R8C+MEP-MNR),0,1,1))) -> 0 | AM70: =IF(RC1="","",IF(OR(R8C<=ROUND(DAYS360(ValDat,RC1,0)/30,0),R8C>ROUND(DAYS360(ExpDat,RC1,0)/30,0)),0,OFFSET(R45C,MAX(-MNR,ROUND(DAYS360(ValDat,RC1,0)/30,0)-R8C+MEP-MNR),0,1,1))) -> 0 | AN70: =IF(RC1="","",IF(OR(R8C<=ROUND(DAYS360(ValDat,RC1,0)/30,0),R8C>ROUND(DAYS360(ExpDat,RC1,0)/30,0)),0,OFFSET(R45C,MAX(-MNR,ROUND(DAYS360(ValDat,RC1,0)/30,0)-R8C+MEP-MNR),0,1,1))) -> 0 | AO70: =IF(RC1="","",IF(OR(R8C<=ROUND(DAYS360(ValDat,RC1,0)/30,0),R8C>ROUND(DAYS360(ExpDat,RC1,0)/30,0)),0,OFFSET(R45C,MAX(-MNR,ROUND(DAYS360(ValDat,RC1,0)/30,0)-R8C+MEP-MNR),0,1,1))) -> 0
A71: =IF(R[-1]C="","",IF(EOMONTH(R[-1]C,0)+1>RunDat,"",EOMONTH(R[-1]C,0)+1)) -> 1999-09-01T00:00:00.000 | D71: =IF(RC1="","",SUM(RC[2]:RC[37])) -> 207559 | F71: =IF(RC1="","",IF(OR(R8C<=ROUND(DAYS360(ValDat,RC1,0)/30,0),R8C>ROUND(DAYS360(ExpDat,RC1,0)/30,0)),0,OFFSET(R45C,MAX(-MNR,ROUND(DAYS360(ValDat,RC1,0)/30,0)-R8C+MEP-MNR),0,1,1))) -> 35600 | G71: =IF(RC1="","",IF(OR(R8C<=ROUND(DAYS360(ValDat,RC1,0)/30,0),R8C>ROUND(DAYS360(ExpDat,RC1,0)/30,0)),0,OFFSET(R45C,MAX(-MNR,ROUND(DAYS360(ValDat,RC1,0)/30,0)-R8C+MEP-MNR),0,1,1))) -> 92380 | H71: =IF(RC1="","",IF(OR(R8C<=ROUND(DAYS360(ValDat,RC1,0)/30,0),R8C>ROUND(DAYS360(ExpDat,RC1,0)/30,0)),0,OFFSET(R45C,MAX(-MNR,ROUND(DAYS360(ValDat,RC1,0)/30,0)-R8C+MEP-MNR),0,1,1))) -> 57928 | I71: =IF(RC1="","",IF(OR(R8C<=ROUND(DAYS360(ValDat,RC1,0)/30,0),R8C>ROUND(DAYS360(ExpDat,RC1,0)/30,0)),0,OFFSET(R45C,MAX(-MNR,ROUND(DAYS360(ValDat,RC1,0)/30,0)-R8C+MEP-MNR),0,1,1))) -> 15516 | J71: =IF(RC1="","",IF(OR(R8C<=ROUND(DAYS360(ValDat,RC1,0)/30,0),R8C>ROUND(DAYS360(ExpDat,RC1,0)/30,0)),0,OFFSET(R45C,MAX(-MNR,ROUND(DAYS360(ValDat,RC1,0)/30,0)-R8C+MEP-MNR),0,1,1))) -> 3572 | K71: =IF(RC1="","",IF(OR(R8C<=ROUND(DAYS360(ValDat,RC1,0)/30,0),R8C>ROUND(DAYS360(ExpDat,RC1,0)/30,0)),0,OFFSET(R45C,MAX(-MNR,ROUND(DAYS360(ValDat,RC1,0)/30,0)-R8C+MEP-MNR),0,1,1))) -> 1893 | L71: =IF(RC1="","",IF(OR(R8C<=ROUND(DAYS360(ValDat,RC1,0)/30,0),R8C>ROUND(DAYS360(ExpDat,RC1,0)/30,0)),0,OFFSET(R45C,MAX(-MNR,ROUND(DAYS360(ValDat,RC1,0)/30,0)-R8C+MEP-MNR),0,1,1))) -> 670 | M71: =IF(RC1="","",IF(OR(R8C<=ROUND(DAYS360(ValDat,RC1,0)/30,0),R8C>ROUND(DAYS360(ExpDat,RC1,0)/30,0)),0,OFFSET(R45C,MAX(-MNR,ROUND(DAYS360(ValDat,RC1,0)/30,0)-R8C+MEP-MNR),0,1,1))) -> 0 | N71: =IF(RC1="","",IF(OR(R8C<=ROUND(DAYS360(ValDat,RC1,0)/30,0),R8C>ROUND(DAYS360(ExpDat,RC1,0)/30,0)),0,OFFSET(R45C,MAX(-MNR,ROUND(DAYS360(ValDat,RC1,0)/30,0)-R8C+MEP-MNR),0,1,1))) -> 0 | O71: =IF(RC1="","",IF(OR(R8C<=ROUND(DAYS360(ValDat,RC1,0)/30,0),R8C>ROUND(DAYS360(ExpDat,RC1,0)/30,0)),0,OFFSET(R45C,MAX(-MNR,ROUND(DAYS360(ValDat,RC1,0)/30,0)-R8C+MEP-MNR),0,1,1))) -> 0 | P71: =IF(RC1="","",IF(OR(R8C<=ROUND(DAYS360(ValDat,RC1,0)/30,0),R8C>ROUND(DAYS360(ExpDat,RC1,0)/30,0)),0,OFFSET(R45C,MAX(-MNR,ROUND(DAYS360(ValDat,RC1,0)/30,0)-R8C+MEP-MNR),0,1,1))) -> 0 | Q71: =IF(RC1="","",IF(OR(R8C<=ROUND(DAYS360(ValDat,RC1,0)/30,0),R8C>ROUND(DAYS360(ExpDat,RC1,0)/30,0)),0,OFFSET(R45C,MAX(-MNR,ROUND(DAYS360(ValDat,RC1,0)/30,0)-R8C+MEP-MNR),0,1,1))) -> 0 | R71: =IF(RC1="","",IF(OR(R8C<=ROUND(DAYS360(ValDat,RC1,0)/30,0),R8C>ROUND(DAYS360(ExpDat,RC1,0)/30,0)),0,OFFSET(R45C,MAX(-MNR,ROUND(DAYS360(ValDat,RC1,0)/30,0)-R8C+MEP-MNR),0,1,1))) -> 0 | S71: =IF(RC1="","",IF(OR(R8C<=ROUND(DAYS360(ValDat,RC1,0)/30,0),R8C>ROUND(DAYS360(ExpDat,RC1,0)/30,0)),0,OFFSET(R45C,MAX(-MNR,ROUND(DAYS360(ValDat,RC1,0)/30,0)-R8C+MEP-MNR),0,1,1))) -> 0 | T71: =IF(RC1="","",IF(OR(R8C<=ROUND(DAYS360(ValDat,RC1,0)/30,0),R8C>ROUND(DAYS360(ExpDat,RC1,0)/30,0)),0,OFFSET(R45C,MAX(-MNR,ROUND(DAYS360(ValDat,RC1,0)/30,0)-R8C+MEP-MNR),0,1,1))) -> 0 | U71: =IF(RC1="","",IF(OR(R8C<=ROUND(DAYS360(ValDat,RC1,0)/30,0),R8C>ROUND(DAYS360(ExpDat,RC1,0)/30,0)),0,OFFSET(R45C,MAX(-MNR,ROUND(DAYS360(ValDat,RC1,0)/30,0)-R8C+MEP-MNR),0,1,1))) -> 0 | V71: =IF(RC1="","",IF(OR(R8C<=ROUND(DAYS360(ValDat,RC1,0)/30,0),R8C>ROUND(DAYS360(ExpDat,RC1,0)/30,0)),0,OFFSET(R45C,MAX(-MNR,ROUND(DAYS360(ValDat,RC1,0)/30,0)-R8C+MEP-MNR),0,1,1))) -> 0 | W71: =IF(RC1="","",IF(OR(R8C<=ROUND(DAYS360(ValDat,RC1,0)/30,0),R8C>ROUND(DAYS360(ExpDat,RC1,0)/30,0)),0,OFFSET(R45C,MAX(-MNR,ROUND(DAYS360(ValDat,RC1,0)/30,0)-R8C+MEP-MNR),0,1,1))) -> 0 | X71: =IF(RC1="","",IF(OR(R8C<=ROUND(DAYS360(ValDat,RC1,0)/30,0),R8C>ROUND(DAYS360(ExpDat,RC1,0)/30,0)),0,OFFSET(R45C,MAX(-MNR,ROUND(DAYS360(ValDat,RC1,0)/30,0)-R8C+MEP-MNR),0,1,1))) -> 0 | Y71: =IF(RC1="","",IF(OR(R8C<=ROUND(DAYS360(ValDat,RC1,0)/30,0),R8C>ROUND(DAYS360(ExpDat,RC1,0)/30,0)),0,OFFSET(R45C,MAX(-MNR,ROUND(DAYS360(ValDat,RC1,0)/30,0)-R8C+MEP-MNR),0,1,1))) -> 0 | Z71: =IF(RC1="","",IF(OR(R8C<=ROUND(DAYS360(ValDat,RC1,0)/30,0),R8C>ROUND(DAYS360(ExpDat,RC1,0)/30,0)),0,OFFSET(R45C,MAX(-MNR,ROUND(DAYS360(ValDat,RC1,0)/30,0)-R8C+MEP-MNR),0,1,1))) -> 0 | AA71: =IF(RC1="","",IF(OR(R8C<=ROUND(DAYS360(ValDat,RC1,0)/30,0),R8C>ROUND(DAYS360(ExpDat,RC1,0)/30,0)),0,OFFSET(R45C,MAX(-MNR,ROUND(DAYS360(ValDat,RC1,0)/30,0)-R8C+MEP-MNR),0,1,1))) -> 0 | AB71: =IF(RC1="","",IF(OR(R8C<=ROUND(DAYS360(ValDat,RC1,0)/30,0),R8C>ROUND(DAYS360(ExpDat,RC1,0)/30,0)),0,OFFSET(R45C,MAX(-MNR,ROUND(DAYS360(ValDat,RC1,0)/30,0)-R8C+MEP-MNR),0,1,1))) -> 0 | AC71: =IF(RC1="","",IF(OR(R8C<=ROUND(DAYS360(ValDat,RC1,0)/30,0),R8C>ROUND(DAYS360(ExpDat,RC1,0)/30,0)),0,OFFSET(R45C,MAX(-MNR,ROUND(DAYS360(ValDat,RC1,0)/30,0)-R8C+MEP-MNR),0,1,1))) -> 0 | AD71: =IF(RC1="","",IF(OR(R8C<=ROUND(DAYS360(ValDat,RC1,0)/30,0),R8C>ROUND(DAYS360(ExpDat,RC1,0)/30,0)),0,OFFSET(R45C,MAX(-MNR,ROUND(DAYS360(ValDat,RC1,0)/30,0)-R8C+MEP-MNR),0,1,1))) -> 0 | AE71: =IF(RC1="","",IF(OR(R8C<=ROUND(DAYS360(ValDat,RC1,0)/30,0),R8C>ROUND(DAYS360(ExpDat,RC1,0)/30,0)),0,OFFSET(R45C,MAX(-MNR,ROUND(DAYS360(ValDat,RC1,0)/30,0)-R8C+MEP-MNR),0,1,1))) -> 0 | AF71: =IF(RC1="","",IF(OR(R8C<=ROUND(DAYS360(ValDat,RC1,0)/30,0),R8C>ROUND(DAYS360(ExpDat,RC1,0)/30,0)),0,OFFSET(R45C,MAX(-MNR,ROUND(DAYS360(ValDat,RC1,0)/30,0)-R8C+MEP-MNR),0,1,1))) -> 0 | AG71: =IF(RC1="","",IF(OR(R8C<=ROUND(DAYS360(ValDat,RC1,0)/30,0),R8C>ROUND(DAYS360(ExpDat,RC1,0)/30,0)),0,OFFSET(R45C,MAX(-MNR,ROUND(DAYS360(ValDat,RC1,0)/30,0)-R8C+MEP-MNR),0,1,1))) -> 0 | AH71: =IF(RC1="","",IF(OR(R8C<=ROUND(DAYS360(ValDat,RC1,0)/30,0),R8C>ROUND(DAYS360(ExpDat,RC1,0)/30,0)),0,OFFSET(R45C,MAX(-MNR,ROUND(DAYS360(ValDat,RC1,0)/30,0)-R8C+MEP-MNR),0,1,1))) -> 0 | AI71: =IF(RC1="","",IF(OR(R8C<=ROUND(DAYS360(ValDat,RC1,0)/30,0),R8C>ROUND(DAYS360(ExpDat,RC1,0)/30,0)),0,OFFSET(R45C,MAX(-MNR,ROUND(DAYS360(ValDat,RC1,0)/30,0)-R8C+MEP-MNR),0,1,1))) -> 0 | AJ71: =IF(RC1="","",IF(OR(R8C<=ROUND(DAYS360(ValDat,RC1,0)/30,0),R8C>ROUND(DAYS360(ExpDat,RC1,0)/30,0)),0,OFFSET(R45C,MAX(-MNR,ROUND(DAYS360(ValDat,RC1,0)/30,0)-R8C+MEP-MNR),0,1,1))) -> 0 | AK71: =IF(RC1="","",IF(OR(R8C<=ROUND(DAYS360(ValDat,RC1,0)/30,0),R8C>ROUND(DAYS360(ExpDat,RC1,0)/30,0)),0,OFFSET(R45C,MAX(-MNR,ROUND(DAYS360(ValDat,RC1,0)/30,0)-R8C+MEP-MNR),0,1,1))) -> 0 | AL71: =IF(RC1="","",IF(OR(R8C<=ROUND(DAYS360(ValDat,RC1,0)/30,0),R8C>ROUND(DAYS360(ExpDat,RC1,0)/30,0)),0,OFFSET(R45C,MAX(-MNR,ROUND(DAYS360(ValDat,RC1,0)/30,0)-R8C+MEP-MNR),0,1,1))) -> 0 | AM71: =IF(RC1="","",IF(OR(R8C<=ROUND(DAYS360(ValDat,RC1,0)/30,0),R8C>ROUND(DAYS360(ExpDat,RC1,0)/30,0)),0,OFFSET(R45C,MAX(-MNR,ROUND(DAYS360(ValDat,RC1,0)/30,0)-R8C+MEP-MNR),0,1,1))) -> 0 | AN71: =IF(RC1="","",IF(OR(R8C<=ROUND(DAYS360(ValDat,RC1,0)/30,0),R8C>ROUND(DAYS360(ExpDat,RC1,0)/30,0)),0,OFFSET(R45C,MAX(-MNR,ROUND(DAYS360(ValDat,RC1,0)/30,0)-R8C+MEP-MNR),0,1,1))) -> 0 | AO71: =IF(RC1="","",IF(OR(R8C<=ROUND(DAYS360(ValDat,RC1,0)/30,0),R8C>ROUND(DAYS360(ExpDat,RC1,0)/30,0)),0,OFFSET(R45C,MAX(-MNR,ROUND(DAYS360(ValDat,RC1,0)/30,0)-R8C+MEP-MNR),0,1,1))) -> 0
A72: =IF(R[-1]C="","",IF(EOMONTH(R[-1]C,0)+1>RunDat,"",EOMONTH(R[-1]C,0)+1)) -> 1999-10-01T00:00:00.000 | D72: =IF(RC1="","",SUM(RC[2]:RC[37])) -> 160501 | F72: =IF(RC1="","",IF(OR(R8C<=ROUND(DAYS360(ValDat,RC1,0)/30,0),R8C>ROUND(DAYS360(ExpDat,RC1,0)/30,0)),0,OFFSET(R45C,MAX(-MNR,ROUND(DAYS360(ValDat,RC1,0)/30,0)-R8C+MEP-MNR),0,1,1))) -> 9177 | G72: =IF(RC1="","",IF(OR(R8C<=ROUND(DAYS360(ValDat,RC1,0)/30,0),R8C>ROUND(DAYS360(ExpDat,RC1,0)/30,0)),0,OFFSET(R45C,MAX(-MNR,ROUND(DAYS360(ValDat,RC1,0)/30,0)-R8C+MEP-MNR),0,1,1))) -> 88108 | H72: =IF(RC1="","",IF(OR(R8C<=ROUND(DAYS360(ValDat,RC1,0)/30,0),R8C>ROUND(DAYS360(ExpDat,RC1,0)/30,0)),0,OFFSET(R45C,MAX(-MNR,ROUND(DAYS360(ValDat,RC1,0)/30,0)-R8C+MEP-MNR),0,1,1))) -> 33087 | I72: =IF(RC1="","",IF(OR(R8C<=ROUND(DAYS360(ValDat,RC1,0)/30,0),R8C>ROUND(DAYS360(ExpDat,RC1,0)/30,0)),0,OFFSET(R45C,MAX(-MNR,ROUND(DAYS360(ValDat,RC1,0)/30,0)-R8C+MEP-MNR),0,1,1))) -> 10474 | J72: =IF(RC1="","",IF(OR(R8C<=ROUND(DAYS360(ValDat,RC1,0)/30,0),R8C>ROUND(DAYS360(ExpDat,RC1,0)/30,0)),0,OFFSET(R45C,MAX(-MNR,ROUND(DAYS360(ValDat,RC1,0)/30,0)-R8C+MEP-MNR),0,1,1))) -> 14096 | K72: =IF(RC1="","",IF(OR(R8C<=ROUND(DAYS360(ValDat,RC1,0)/30,0),R8C>ROUND(DAYS360(ExpDat,RC1,0)/30,0)),0,OFFSET(R45C,MAX(-MNR,ROUND(DAYS360(ValDat,RC1,0)/30,0)-R8C+MEP-MNR),0,1,1))) -> 3399 | L72: =IF(RC1="","",IF(OR(R8C<=ROUND(DAYS360(ValDat,RC1,0)/30,0),R8C>ROUND(DAYS360(ExpDat,RC1,0)/30,0)),0,OFFSET(R45C,MAX(-MNR,ROUND(DAYS360(ValDat,RC1,0)/30,0)-R8C+MEP-MNR),0,1,1))) -> 2160 | M72: =IF(RC1="","",IF(OR(R8C<=ROUND(DAYS360(ValDat,RC1,0)/30,0),R8C>ROUND(DAYS360(ExpDat,RC1,0)/30,0)),0,OFFSET(R45C,MAX(-MNR,ROUND(DAYS360(ValDat,RC1,0)/30,0)-R8C+MEP-MNR),0,1,1))) -> 0 | N72: =IF(RC1="","",IF(OR(R8C<=ROUND(DAYS360(ValDat,RC1,0)/30,0),R8C>ROUND(DAYS360(ExpDat,RC1,0)/30,0)),0,OFFSET(R45C,MAX(-MNR,ROUND(DAYS360(ValDat,RC1,0)/30,0)-R8C+MEP-MNR),0,1,1))) -> 0 | O72: =IF(RC1="","",IF(OR(R8C<=ROUND(DAYS360(ValDat,RC1,0)/30,0),R8C>ROUND(DAYS360(ExpDat,RC1,0)/30,0)),0,OFFSET(R45C,MAX(-MNR,ROUND(DAYS360(ValDat,RC1,0)/30,0)-R8C+MEP-MNR),0,1,1))) -> 0 | P72: =IF(RC1="","",IF(OR(R8C<=ROUND(DAYS360(ValDat,RC1,0)/30,0),R8C>ROUND(DAYS360(ExpDat,RC1,0)/30,0)),0,OFFSET(R45C,MAX(-MNR,ROUND(DAYS360(ValDat,RC1,0)/30,0)-R8C+MEP-MNR),0,1,1))) -> 0 | Q72: =IF(RC1="","",IF(OR(R8C<=ROUND(DAYS360(ValDat,RC1,0)/30,0),R8C>ROUND(DAYS360(ExpDat,RC1,0)/30,0)),0,OFFSET(R45C,MAX(-MNR,ROUND(DAYS360(ValDat,RC1,0)/30,0)-R8C+MEP-MNR),0,1,1))) -> 0 | R72: =IF(RC1="","",IF(OR(R8C<=ROUND(DAYS360(ValDat,RC1,0)/30,0),R8C>ROUND(DAYS360(ExpDat,RC1,0)/30,0)),0,OFFSET(R45C,MAX(-MNR,ROUND(DAYS360(ValDat,RC1,0)/30,0)-R8C+MEP-MNR),0,1,1))) -> 0 | S72: =IF(RC1="","",IF(OR(R8C<=ROUND(DAYS360(ValDat,RC1,0)/30,0),R8C>ROUND(DAYS360(ExpDat,RC1,0)/30,0)),0,OFFSET(R45C,MAX(-MNR,ROUND(DAYS360(ValDat,RC1,0)/30,0)-R8C+MEP-MNR),0,1,1))) -> 0 | T72: =IF(RC1="","",IF(OR(R8C<=ROUND(DAYS360(ValDat,RC1,0)/30,0),R8C>ROUND(DAYS360(ExpDat,RC1,0)/30,0)),0,OFFSET(R45C,MAX(-MNR,ROUND(DAYS360(ValDat,RC1,0)/30,0)-R8C+MEP-MNR),0,1,1))) -> 0 | U72: =IF(RC1="","",IF(OR(R8C<=ROUND(DAYS360(ValDat,RC1,0)/30,0),R8C>ROUND(DAYS360(ExpDat,RC1,0)/30,0)),0,OFFSET(R45C,MAX(-MNR,ROUND(DAYS360(ValDat,RC1,0)/30,0)-R8C+MEP-MNR),0,1,1))) -> 0 | V72: =IF(RC1="","",IF(OR(R8C<=ROUND(DAYS360(ValDat,RC1,0)/30,0),R8C>ROUND(DAYS360(ExpDat,RC1,0)/30,0)),0,OFFSET(R45C,MAX(-MNR,ROUND(DAYS360(ValDat,RC1,0)/30,0)-R8C+MEP-MNR),0,1,1))) -> 0 | W72: =IF(RC1="","",IF(OR(R8C<=ROUND(DAYS360(ValDat,RC1,0)/30,0),R8C>ROUND(DAYS360(ExpDat,RC1,0)/30,0)),0,OFFSET(R45C,MAX(-MNR,ROUND(DAYS360(ValDat,RC1,0)/30,0)-R8C+MEP-MNR),0,1,1))) -> 0 | X72: =IF(RC1="","",IF(OR(R8C<=ROUND(DAYS360(ValDat,RC1,0)/30,0),R8C>ROUND(DAYS360(ExpDat,RC1,0)/30,0)),0,OFFSET(R45C,MAX(-MNR,ROUND(DAYS360(ValDat,RC1,0)/30,0)-R8C+MEP-MNR),0,1,1))) -> 0 | Y72: =IF(RC1="","",IF(OR(R8C<=ROUND(DAYS360(ValDat,RC1,0)/30,0),R8C>ROUND(DAYS360(ExpDat,RC1,0)/30,0)),0,OFFSET(R45C,MAX(-MNR,ROUND(DAYS360(ValDat,RC1,0)/30,0)-R8C+MEP-MNR),0,1,1))) -> 0 | Z72: =IF(RC1="","",IF(OR(R8C<=ROUND(DAYS360(ValDat,RC1,0)/30,0),R8C>ROUND(DAYS360(ExpDat,RC1,0)/30,0)),0,OFFSET(R45C,MAX(-MNR,ROUND(DAYS360(ValDat,RC1,0)/30,0)-R8C+MEP-MNR),0,1,1))) -> 0 | AA72: =IF(RC1="","",IF(OR(R8C<=ROUND(DAYS360(ValDat,RC1,0)/30,0),R8C>ROUND(DAYS360(ExpDat,RC1,0)/30,0)),0,OFFSET(R45C,MAX(-MNR,ROUND(DAYS360(ValDat,RC1,0)/30,0)-R8C+MEP-MNR),0,1,1))) -> 0 | AB72: =IF(RC1="","",IF(OR(R8C<=ROUND(DAYS360(ValDat,RC1,0)/30,0),R8C>ROUND(DAYS360(ExpDat,RC1,0)/30,0)),0,OFFSET(R45C,MAX(-MNR,ROUND(DAYS360(ValDat,RC1,0)/30,0)-R8C+MEP-MNR),0,1,1))) -> 0 | AC72: =IF(RC1="","",IF(OR(R8C<=ROUND(DAYS360(ValDat,RC1,0)/30,0),R8C>ROUND(DAYS360(ExpDat,RC1,0)/30,0)),0,OFFSET(R45C,MAX(-MNR,ROUND(DAYS360(ValDat,RC1,0)/30,0)-R8C+MEP-MNR),0,1,1))) -> 0 | AD72: =IF(RC1="","",IF(OR(R8C<=ROUND(DAYS360(ValDat,RC1,0)/30,0),R8C>ROUND(DAYS360(ExpDat,RC1,0)/30,0)),0,OFFSET(R45C,MAX(-MNR,ROUND(DAYS360(ValDat,RC1,0)/30,0)-R8C+MEP-MNR),0,1,1))) -> 0 | AE72: =IF(RC1="","",IF(OR(R8C<=ROUND(DAYS360(ValDat,RC1,0)/30,0),R8C>ROUND(DAYS360(ExpDat,RC1,0)/30,0)),0,OFFSET(R45C,MAX(-MNR,ROUND(DAYS360(ValDat,RC1,0)/30,0)-R8C+MEP-MNR),0,1,1))) -> 0 | AF72: =IF(RC1="","",IF(OR(R8C<=ROUND(DAYS360(ValDat,RC1,0)/30,0),R8C>ROUND(DAYS360(ExpDat,RC1,0)/30,0)),0,OFFSET(R45C,MAX(-MNR,ROUND(DAYS360(ValDat,RC1,0)/30,0)-R8C+MEP-MNR),0,1,1))) -> 0 | AG72: =IF(RC1="","",IF(OR(R8C<=ROUND(DAYS360(ValDat,RC1,0)/30,0),R8C>ROUND(DAYS360(ExpDat,RC1,0)/30,0)),0,OFFSET(R45C,MAX(-MNR,ROUND(DAYS360(ValDat,RC1,0)/30,0)-R8C+MEP-MNR),0,1,1))) -> 0 | AH72: =IF(RC1="","",IF(OR(R8C<=ROUND(DAYS360(ValDat,RC1,0)/30,0),R8C>ROUND(DAYS360(ExpDat,RC1,0)/30,0)),0,OFFSET(R45C,MAX(-MNR,ROUND(DAYS360(ValDat,RC1,0)/30,0)-R8C+MEP-MNR),0,1,1))) -> 0 | AI72: =IF(RC1="","",IF(OR(R8C<=ROUND(DAYS360(ValDat,RC1,0)/30,0),R8C>ROUND(DAYS360(ExpDat,RC1,0)/30,0)),0,OFFSET(R45C,MAX(-MNR,ROUND(DAYS360(ValDat,RC1,0)/30,0)-R8C+MEP-MNR),0,1,1))) -> 0 | AJ72: =IF(RC1="","",IF(OR(R8C<=ROUND(DAYS360(ValDat,RC1,0)/30,0),R8C>ROUND(DAYS360(ExpDat,RC1,0)/30,0)),0,OFFSET(R45C,MAX(-MNR,ROUND(DAYS360(ValDat,RC1,0)/30,0)-R8C+MEP-MNR),0,1,1))) -> 0 | AK72: =IF(RC1="","",IF(OR(R8C<=ROUND(DAYS360(ValDat,RC1,0)/30,0),R8C>ROUND(DAYS360(ExpDat,RC1,0)/30,0)),0,OFFSET(R45C,MAX(-MNR,ROUND(DAYS360(ValDat,RC1,0)/30,0)-R8C+MEP-MNR),0,1,1))) -> 0 | AL72: =IF(RC1="","",IF(OR(R8C<=ROUND(DAYS360(ValDat,RC1,0)/30,0),R8C>ROUND(DAYS360(ExpDat,RC1,0)/30,0)),0,OFFSET(R45C,MAX(-MNR,ROUND(DAYS360(ValDat,RC1,0)/30,0)-R8C+MEP-MNR),0,1,1))) -> 0 | AM72: =IF(RC1="","",IF(OR(R8C<=ROUND(DAYS360(ValDat,RC1,0)/30,0),R8C>ROUND(DAYS360(ExpDat,RC1,0)/30,0)),0,OFFSET(R45C,MAX(-MNR,ROUND(DAYS360(ValDat,RC1,0)/30,0)-R8C+MEP-MNR),0,1,1))) -> 0 | AN72: =IF(RC1="","",IF(OR(R8C<=ROUND(DAYS360(ValDat,RC1,0)/30,0),R8C>ROUND(DAYS360(ExpDat,RC1,0)/30,0)),0,OFFSET(R45C,MAX(-MNR,ROUND(DAYS360(ValDat,RC1,0)/30,0)-R8C+MEP-MNR),0,1,1))) -> 0 | AO72: =IF(RC1="","",IF(OR(R8C<=ROUND(DAYS360(ValDat,RC1,0)/30,0),R8C>ROUND(DAYS360(ExpDat,RC1,0)/30,0)),0,OFFSET(R45C,MAX(-MNR,ROUND(DAYS360(ValDat,RC1,0)/30,0)-R8C+MEP-MNR),0,1,1))) -> 0
A73: =IF(R[-1]C="","",IF(EOMONTH(R[-1]C,0)+1>RunDat,"",EOMONTH(R[-1]C,0)+1)) -> 1999-11-01T00:00:00.000 | D73: =IF(RC1="","",SUM(RC[2]:RC[37])) -> 157261 | F73: =IF(RC1="","",IF(OR(R8C<=ROUND(DAYS360(ValDat,RC1,0)/30,0),R8C>ROUND(DAYS360(ExpDat,RC1,0)/30,0)),0,OFFSET(R45C,MAX(-MNR,ROUND(DAYS360(ValDat,RC1,0)/30,0)-R8C+MEP-MNR),0,1,1))) -> 21566 | G73: =IF(RC1="","",IF(OR(R8C<=ROUND(DAYS360(ValDat,RC1,0)/30,0),R8C>ROUND(DAYS360(ExpDat,RC1,0)/30,0)),0,OFFSET(R45C,MAX(-MNR,ROUND(DAYS360(ValDat,RC1,0)/30,0)-R8C+MEP-MNR),0,1,1))) -> 52091 | H73: =IF(RC1="","",IF(OR(R8C<=ROUND(DAYS360(ValDat,RC1,0)/30,0),R8C>ROUND(DAYS360(ExpDat,RC1,0)/30,0)),0,OFFSET(R45C,MAX(-MNR,ROUND(DAYS360(ValDat,RC1,0)/30,0)-R8C+MEP-MNR),0,1,1))) -> 29728 | I73: =IF(RC1="","",IF(OR(R8C<=ROUND(DAYS360(ValDat,RC1,0)/30,0),R8C>ROUND(DAYS360(ExpDat,RC1,0)/30,0)),0,OFFSET(R45C,MAX(-MNR,ROUND(DAYS360(ValDat,RC1,0)/30,0)-R8C+MEP-MNR),0,1,1))) -> 19224 | J73: =IF(RC1="","",IF(OR(R8C<=ROUND(DAYS360(ValDat,RC1,0)/30,0),R8C>ROUND(DAYS360(ExpDat,RC1,0)/30,0)),0,OFFSET(R45C,MAX(-MNR,ROUND(DAYS360(ValDat,RC1,0)/30,0)-R8C+MEP-MNR),0,1,1))) -> 13276 | K73: =IF(RC1="","",IF(OR(R8C<=ROUND(DAYS360(ValDat,RC1,0)/30,0),R8C>ROUND(DAYS360(ExpDat,RC1,0)/30,0)),0,OFFSET(R45C,MAX(-MNR,ROUND(DAYS360(ValDat,RC1,0)/30,0)-R8C+MEP-MNR),0,1,1))) -> 20812 | L73: =IF(RC1="","",IF(OR(R8C<=ROUND(DAYS360(ValDat,RC1,0)/30,0),R8C>ROUND(DAYS360(ExpDat,RC1,0)/30,0)),0,OFFSET(R45C,MAX(-MNR,ROUND(DAYS360(ValDat,RC1,0)/30,0)-R8C+MEP-MNR),0,1,1))) -> 492 | M73: =IF(RC1="","",IF(OR(R8C<=ROUND(DAYS360(ValDat,RC1,0)/30,0),R8C>ROUND(DAYS360(ExpDat,RC1,0)/30,0)),0,OFFSET(R45C,MAX(-MNR,ROUND(DAYS360(ValDat,RC1,0)/30,0)-R8C+MEP-MNR),0,1,1))) -> 72 | N73: =IF(RC1="","",IF(OR(R8C<=ROUND(DAYS360(ValDat,RC1,0)/30,0),R8C>ROUND(DAYS360(ExpDat,RC1,0)/30,0)),0,OFFSET(R45C,MAX(-MNR,ROUND(DAYS360(ValDat,RC1,0)/30,0)-R8C+MEP-MNR),0,1,1))) -> 0 | O73: =IF(RC1="","",IF(OR(R8C<=ROUND(DAYS360(ValDat,RC1,0)/30,0),R8C>ROUND(DAYS360(ExpDat,RC1,0)/30,0)),0,OFFSET(R45C,MAX(-MNR,ROUND(DAYS360(ValDat,RC1,0)/30,0)-R8C+MEP-MNR),0,1,1))) -> 0 | P73: =IF(RC1="","",IF(OR(R8C<=ROUND(DAYS360(ValDat,RC1,0)/30,0),R8C>ROUND(DAYS360(ExpDat,RC1,0)/30,0)),0,OFFSET(R45C,MAX(-MNR,ROUND(DAYS360(ValDat,RC1,0)/30,0)-R8C+MEP-MNR),0,1,1))) -> 0 | Q73: =IF(RC1="","",IF(OR(R8C<=ROUND(DAYS360(ValDat,RC1,0)/30,0),R8C>ROUND(DAYS360(ExpDat,RC1,0)/30,0)),0,OFFSET(R45C,MAX(-MNR,ROUND(DAYS360(ValDat,RC1,0)/30,0)-R8C+MEP-MNR),0,1,1))) -> 0 | R73: =IF(RC1="","",IF(OR(R8C<=ROUND(DAYS360(ValDat,RC1,0)/30,0),R8C>ROUND(DAYS360(ExpDat,RC1,0)/30,0)),0,OFFSET(R45C,MAX(-MNR,ROUND(DAYS360(ValDat,RC1,0)/30,0)-R8C+MEP-MNR),0,1,1))) -> 0 | S73: =IF(RC1="","",IF(OR(R8C<=ROUND(DAYS360(ValDat,RC1,0)/30,0),R8C>ROUND(DAYS360(ExpDat,RC1,0)/30,0)),0,OFFSET(R45C,MAX(-MNR,ROUND(DAYS360(ValDat,RC1,0)/30,0)-R8C+MEP-MNR),0,1,1))) -> 0 | T73: =IF(RC1="","",IF(OR(R8C<=ROUND(DAYS360(ValDat,RC1,0)/30,0),R8C>ROUND(DAYS360(ExpDat,RC1,0)/30,0)),0,OFFSET(R45C,MAX(-MNR,ROUND(DAYS360(ValDat,RC1,0)/30,0)-R8C+MEP-MNR),0,1,1))) -> 0 | U73: =IF(RC1="","",IF(OR(R8C<=ROUND(DAYS360(ValDat,RC1,0)/30,0),R8C>ROUND(DAYS360(ExpDat,RC1,0)/30,0)),0,OFFSET(R45C,MAX(-MNR,ROUND(DAYS360(ValDat,RC1,0)/30,0)-R8C+MEP-MNR),0,1,1))) -> 0 | V73: =IF(RC1="","",IF(OR(R8C<=ROUND(DAYS360(ValDat,RC1,0)/30,0),R8C>ROUND(DAYS360(ExpDat,RC1,0)/30,0)),0,OFFSET(R45C,MAX(-MNR,ROUND(DAYS360(ValDat,RC1,0)/30,0)-R8C+MEP-MNR),0,1,1))) -> 0 | W73: =IF(RC1="","",IF(OR(R8C<=ROUND(DAYS360(ValDat,RC1,0)/30,0),R8C>ROUND(DAYS360(ExpDat,RC1,0)/30,0)),0,OFFSET(R45C,MAX(-MNR,ROUND(DAYS360(ValDat,RC1,0)/30,0)-R8C+MEP-MNR),0,1,1))) -> 0 | X73: =IF(RC1="","",IF(OR(R8C<=ROUND(DAYS360(ValDat,RC1,0)/30,0),R8C>ROUND(DAYS360(ExpDat,RC1,0)/30,0)),0,OFFSET(R45C,MAX(-MNR,ROUND(DAYS360(ValDat,RC1,0)/30,0)-R8C+MEP-MNR),0,1,1))) -> 0 | Y73: =IF(RC1="","",IF(OR(R8C<=ROUND(DAYS360(ValDat,RC1,0)/30,0),R8C>ROUND(DAYS360(ExpDat,RC1,0)/30,0)),0,OFFSET(R45C,MAX(-MNR,ROUND(DAYS360(ValDat,RC1,0)/30,0)-R8C+MEP-MNR),0,1,1))) -> 0 | Z73: =IF(RC1="","",IF(OR(R8C<=ROUND(DAYS360(ValDat,RC1,0)/30,0),R8C>ROUND(DAYS360(ExpDat,RC1,0)/30,0)),0,OFFSET(R45C,MAX(-MNR,ROUND(DAYS360(ValDat,RC1,0)/30,0)-R8C+MEP-MNR),0,1,1))) -> 0 | AA73: =IF(RC1="","",IF(OR(R8C<=ROUND(DAYS360(ValDat,RC1,0)/30,0),R8C>ROUND(DAYS360(ExpDat,RC1,0)/30,0)),0,OFFSET(R45C,MAX(-MNR,ROUND(DAYS360(ValDat,RC1,0)/30,0)-R8C+MEP-MNR),0,1,1))) -> 0 | AB73: =IF(RC1="","",IF(OR(R8C<=ROUND(DAYS360(ValDat,RC1,0)/30,0),R8C>ROUND(DAYS360(ExpDat,RC1,0)/30,0)),0,OFFSET(R45C,MAX(-MNR,ROUND(DAYS360(ValDat,RC1,0)/30,0)-R8C+MEP-MNR),0,1,1))) -> 0 | AC73: =IF(RC1="","",IF(OR(R8C<=ROUND(DAYS360(ValDat,RC1,0)/30,0),R8C>ROUND(DAYS360(ExpDat,RC1,0)/30,0)),0,OFFSET(R45C,MAX(-MNR,ROUND(DAYS360(ValDat,RC1,0)/30,0)-R8C+MEP-MNR),0,1,1))) -> 0 | AD73: =IF(RC1="","",IF(OR(R8C<=ROUND(DAYS360(ValDat,RC1,0)/30,0),R8C>ROUND(DAYS360(ExpDat,RC1,0)/30,0)),0,OFFSET(R45C,MAX(-MNR,ROUND(DAYS360(ValDat,RC1,0)/30,0)-R8C+MEP-MNR),0,1,1))) -> 0 | AE73: =IF(RC1="","",IF(OR(R8C<=ROUND(DAYS360(ValDat,RC1,0)/30,0),R8C>ROUND(DAYS360(ExpDat,RC1,0)/30,0)),0,OFFSET(R45C,MAX(-MNR,ROUND(DAYS360(ValDat,RC1,0)/30,0)-R8C+MEP-MNR),0,1,1))) -> 0 | AF73: =IF(RC1="","",IF(OR(R8C<=ROUND(DAYS360(ValDat,RC1,0)/30,0),R8C>ROUND(DAYS360(ExpDat,RC1,0)/30,0)),0,OFFSET(R45C,MAX(-MNR,ROUND(DAYS360(ValDat,RC1,0)/30,0)-R8C+MEP-MNR),0,1,1))) -> 0 | AG73: =IF(RC1="","",IF(OR(R8C<=ROUND(DAYS360(ValDat,RC1,0)/30,0),R8C>ROUND(DAYS360(ExpDat,RC1,0)/30,0)),0,OFFSET(R45C,MAX(-MNR,ROUND(DAYS360(ValDat,RC1,0)/30,0)-R8C+MEP-MNR),0,1,1))) -> 0 | AH73: =IF(RC1="","",IF(OR(R8C<=ROUND(DAYS360(ValDat,RC1,0)/30,0),R8C>ROUND(DAYS360(ExpDat,RC1,0)/30,0)),0,OFFSET(R45C,MAX(-MNR,ROUND(DAYS360(ValDat,RC1,0)/30,0)-R8C+MEP-MNR),0,1,1))) -> 0 | AI73: =IF(RC1="","",IF(OR(R8C<=ROUND(DAYS360(ValDat,RC1,0)/30,0),R8C>ROUND(DAYS360(ExpDat,RC1,0)/30,0)),0,OFFSET(R45C,MAX(-MNR,ROUND(DAYS360(ValDat,RC1,0)/30,0)-R8C+MEP-MNR),0,1,1))) -> 0 | AJ73: =IF(RC1="","",IF(OR(R8C<=ROUND(DAYS360(ValDat,RC1,0)/30,0),R8C>ROUND(DAYS360(ExpDat,RC1,0)/30,0)),0,OFFSET(R45C,MAX(-MNR,ROUND(DAYS360(ValDat,RC1,0)/30,0)-R8C+MEP-MNR),0,1,1))) -> 0 | AK73: =IF(RC1="","",IF(OR(R8C<=ROUND(DAYS360(ValDat,RC1,0)/30,0),R8C>ROUND(DAYS360(ExpDat,RC1,0)/30,0)),0,OFFSET(R45C,MAX(-MNR,ROUND(DAYS360(ValDat,RC1,0)/30,0)-R8C+MEP-MNR),0,1,1))) -> 0 | AL73: =IF(RC1="","",IF(OR(R8C<=ROUND(DAYS360(ValDat,RC1,0)/30,0),R8C>ROUND(DAYS360(ExpDat,RC1,0)/30,0)),0,OFFSET(R45C,MAX(-MNR,ROUND(DAYS360(ValDat,RC1,0)/30,0)-R8C+MEP-MNR),0,1,1))) -> 0 | AM73: =IF(RC1="","",IF(OR(R8C<=ROUND(DAYS360(ValDat,RC1,0)/30,0),R8C>ROUND(DAYS360(ExpDat,RC1,0)/30,0)),0,OFFSET(R45C,MAX(-MNR,ROUND(DAYS360(ValDat,RC1,0)/30,0)-R8C+MEP-MNR),0,1,1))) -> 0 | AN73: =IF(RC1="","",IF(OR(R8C<=ROUND(DAYS360(ValDat,RC1,0)/30,0),R8C>ROUND(DAYS360(ExpDat,RC1,0)/30,0)),0,OFFSET(R45C,MAX(-MNR,ROUND(DAYS360(ValDat,RC1,0)/30,0)-R8C+MEP-MNR),0,1,1))) -> 0 | AO73: =IF(RC1="","",IF(OR(R8C<=ROUND(DAYS360(ValDat,RC1,0)/30,0),R8C>ROUND(DAYS360(ExpDat,RC1,0)/30,0)),0,OFFSET(R45C,MAX(-MNR,ROUND(DAYS360(ValDat,RC1,0)/30,0)-R8C+MEP-MNR),0,1,1))) -> 0
A74: =IF(R[-1]C="","",IF(EOMONTH(R[-1]C,0)+1>RunDat,"",EOMONTH(R[-1]C,0)+1)) -> 1999-12-01T00:00:00.000 | D74: =IF(RC1="","",SUM(RC[2]:RC[37])) -> 81345 | F74: =IF(RC1="","",IF(OR(R8C<=ROUND(DAYS360(ValDat,RC1,0)/30,0),R8C>ROUND(DAYS360(ExpDat,RC1,0)/30,0)),0,OFFSET(R45C,MAX(-MNR,ROUND(DAYS360(ValDat,RC1,0)/30,0)-R8C+MEP-MNR),0,1,1))) -> 9334 | G74: =IF(RC1="","",IF(OR(R8C<=ROUND(DAYS360(ValDat,RC1,0)/30,0),R8C>ROUND(DAYS360(ExpDat,RC1,0)/30,0)),0,OFFSET(R45C,MAX(-MNR,ROUND(DAYS360(ValDat,RC1,0)/30,0)-R8C+MEP-MNR),0,1,1))) -> 44918 | H74: =IF(RC1="","",IF(OR(R8C<=ROUND(DAYS360(ValDat,RC1,0)/30,0),R8C>ROUND(DAYS360(ExpDat,RC1,0)/30,0)),0,OFFSET(R45C,MAX(-MNR,ROUND(DAYS360(ValDat,RC1,0)/30,0)-R8C+MEP-MNR),0,1,1))) -> 8840 | I74: =IF(RC1="","",IF(OR(R8C<=ROUND(DAYS360(ValDat,RC1,0)/30,0),R8C>ROUND(DAYS360(ExpDat,RC1,0)/30,0)),0,OFFSET(R45C,MAX(-MNR,ROUND(DAYS360(ValDat,RC1,0)/30,0)-R8C+MEP-MNR),0,1,1))) -> 10188 | J74: =IF(RC1="","",IF(OR(R8C<=ROUND(DAYS360(ValDat,RC1,0)/30,0),R8C>ROUND(DAYS360(ExpDat,RC1,0)/30,0)),0,OFFSET(R45C,MAX(-MNR,ROUND(DAYS360(ValDat,RC1,0)/30,0)-R8C+MEP-MNR),0,1,1))) -> 2579 | K74: =IF(RC1="","",IF(OR(R8C<=ROUND(DAYS360(ValDat,RC1,0)/30,0),R8C>ROUND(DAYS360(ExpDat,RC1,0)/30,0)),0,OFFSET(R45C,MAX(-MNR,ROUND(DAYS360(ValDat,RC1,0)/30,0)-R8C+MEP-MNR),0,1,1))) -> 141 | L74: =IF(RC1="","",IF(OR(R8C<=ROUND(DAYS360(ValDat,RC1,0)/30,0),R8C>ROUND(DAYS360(ExpDat,RC1,0)/30,0)),0,OFFSET(R45C,MAX(-MNR,ROUND(DAYS360(ValDat,RC1,0)/30,0)-R8C+MEP-MNR),0,1,1))) -> 1119 | M74: =IF(RC1="","",IF(OR(R8C<=ROUND(DAYS360(ValDat,RC1,0)/30,0),R8C>ROUND(DAYS360(ExpDat,RC1,0)/30,0)),0,OFFSET(R45C,MAX(-MNR,ROUND(DAYS360(ValDat,RC1,0)/30,0)-R8C+MEP-MNR),0,1,1))) -> 72 | N74: =IF(RC1="","",IF(OR(R8C<=ROUND(DAYS360(ValDat,RC1,0)/30,0),R8C>ROUND(DAYS360(ExpDat,RC1,0)/30,0)),0,OFFSET(R45C,MAX(-MNR,ROUND(DAYS360(ValDat,RC1,0)/30,0)-R8C+MEP-MNR),0,1,1))) -> 4154 | O74: =IF(RC1="","",IF(OR(R8C<=ROUND(DAYS360(ValDat,RC1,0)/30,0),R8C>ROUND(DAYS360(ExpDat,RC1,0)/30,0)),0,OFFSET(R45C,MAX(-MNR,ROUND(DAYS360(ValDat,RC1,0)/30,0)-R8C+MEP-MNR),0,1,1))) -> 0 | P74: =IF(RC1="","",IF(OR(R8C<=ROUND(DAYS360(ValDat,RC1,0)/30,0),R8C>ROUND(DAYS360(ExpDat,RC1,0)/30,0)),0,OFFSET(R45C,MAX(-MNR,ROUND(DAYS360(ValDat,RC1,0)/30,0)-R8C+MEP-MNR),0,1,1))) -> 0 | Q74: =IF(RC1="","",IF(OR(R8C<=ROUND(DAYS360(ValDat,RC1,0)/30,0),R8C>ROUND(DAYS360(ExpDat,RC1,0)/30,0)),0,OFFSET(R45C,MAX(-MNR,ROUND(DAYS360(ValDat,RC1,0)/30,0)-R8C+MEP-MNR),0,1,1))) -> 0 | R74: =IF(RC1="","",IF(OR(R8C<=ROUND(DAYS360(ValDat,RC1,0)/30,0),R8C>ROUND(DAYS360(ExpDat,RC1,0)/30,0)),0,OFFSET(R45C,MAX(-MNR,ROUND(DAYS360(ValDat,RC1,0)/30,0)-R8C+MEP-MNR),0,1,1))) -> 0 | S74: =IF(RC1="","",IF(OR(R8C<=ROUND(DAYS360(ValDat,RC1,0)/30,0),R8C>ROUND(DAYS360(ExpDat,RC1,0)/30,0)),0,OFFSET(R45C,MAX(-MNR,ROUND(DAYS360(ValDat,RC1,0)/30,0)-R8C+MEP-MNR),0,1,1))) -> 0 | T74: =IF(RC1="","",IF(OR(R8C<=ROUND(DAYS360(ValDat,RC1,0)/30,0),R8C>ROUND(DAYS360(ExpDat,RC1,0)/30,0)),0,OFFSET(R45C,MAX(-MNR,ROUND(DAYS360(ValDat,RC1,0)/30,0)-R8C+MEP-MNR),0,1,1))) -> 0 | U74: =IF(RC1="","",IF(OR(R8C<=ROUND(DAYS360(ValDat,RC1,0)/30,0),R8C>ROUND(DAYS360(ExpDat,RC1,0)/30,0)),0,OFFSET(R45C,MAX(-MNR,ROUND(DAYS360(ValDat,RC1,0)/30,0)-R8C+MEP-MNR),0,1,1))) -> 0 | V74: =IF(RC1="","",IF(OR(R8C<=ROUND(DAYS360(ValDat,RC1,0)/30,0),R8C>ROUND(DAYS360(ExpDat,RC1,0)/30,0)),0,OFFSET(R45C,MAX(-MNR,ROUND(DAYS360(ValDat,RC1,0)/30,0)-R8C+MEP-MNR),0,1,1))) -> 0 | W74: =IF(RC1="","",IF(OR(R8C<=ROUND(DAYS360(ValDat,RC1,0)/30,0),R8C>ROUND(DAYS360(ExpDat,RC1,0)/30,0)),0,OFFSET(R45C,MAX(-MNR,ROUND(DAYS360(ValDat,RC1,0)/30,0)-R8C+MEP-MNR),0,1,1))) -> 0 | X74: =IF(RC1="","",IF(OR(R8C<=ROUND(DAYS360(ValDat,RC1,0)/30,0),R8C>ROUND(DAYS360(ExpDat,RC1,0)/30,0)),0,OFFSET(R45C,MAX(-MNR,ROUND(DAYS360(ValDat,RC1,0)/30,0)-R8C+MEP-MNR),0,1,1))) -> 0 | Y74: =IF(RC1="","",IF(OR(R8C<=ROUND(DAYS360(ValDat,RC1,0)/30,0),R8C>ROUND(DAYS360(ExpDat,RC1,0)/30,0)),0,OFFSET(R45C,MAX(-MNR,ROUND(DAYS360(ValDat,RC1,0)/30,0)-R8C+MEP-MNR),0,1,1))) -> 0 | Z74: =IF(RC1="","",IF(OR(R8C<=ROUND(DAYS360(ValDat,RC1,0)/30,0),R8C>ROUND(DAYS360(ExpDat,RC1,0)/30,0)),0,OFFSET(R45C,MAX(-MNR,ROUND(DAYS360(ValDat,RC1,0)/30,0)-R8C+MEP-MNR),0,1,1))) -> 0 | AA74: =IF(RC1="","",IF(OR(R8C<=ROUND(DAYS360(ValDat,RC1,0)/30,0),R8C>ROUND(DAYS360(ExpDat,RC1,0)/30,0)),0,OFFSET(R45C,MAX(-MNR,ROUND(DAYS360(ValDat,RC1,0)/30,0)-R8C+MEP-MNR),0,1,1))) -> 0 | AB74: =IF(RC1="","",IF(OR(R8C<=ROUND(DAYS360(ValDat,RC1,0)/30,0),R8C>ROUND(DAYS360(ExpDat,RC1,0)/30,0)),0,OFFSET(R45C,MAX(-MNR,ROUND(DAYS360(ValDat,RC1,0)/30,0)-R8C+MEP-MNR),0,1,1))) -> 0 | AC74: =IF(RC1="","",IF(OR(R8C<=ROUND(DAYS360(ValDat,RC1,0)/30,0),R8C>ROUND(DAYS360(ExpDat,RC1,0)/30,0)),0,OFFSET(R45C,MAX(-MNR,ROUND(DAYS360(ValDat,RC1,0)/30,0)-R8C+MEP-MNR),0,1,1))) -> 0 | AD74: =IF(RC1="","",IF(OR(R8C<=ROUND(DAYS360(ValDat,RC1,0)/30,0),R8C>ROUND(DAYS360(ExpDat,RC1,0)/30,0)),0,OFFSET(R45C,MAX(-MNR,ROUND(DAYS360(ValDat,RC1,0)/30,0)-R8C+MEP-MNR),0,1,1))) -> 0 | AE74: =IF(RC1="","",IF(OR(R8C<=ROUND(DAYS360(ValDat,RC1,0)/30,0),R8C>ROUND(DAYS360(ExpDat,RC1,0)/30,0)),0,OFFSET(R45C,MAX(-MNR,ROUND(DAYS360(ValDat,RC1,0)/30,0)-R8C+MEP-MNR),0,1,1))) -> 0 | AF74: =IF(RC1="","",IF(OR(R8C<=ROUND(DAYS360(ValDat,RC1,0)/30,0),R8C>ROUND(DAYS360(ExpDat,RC1,0)/30,0)),0,OFFSET(R45C,MAX(-MNR,ROUND(DAYS360(ValDat,RC1,0)/30,0)-R8C+MEP-MNR),0,1,1))) -> 0 | AG74: =IF(RC1="","",IF(OR(R8C<=ROUND(DAYS360(ValDat,RC1,0)/30,0),R8C>ROUND(DAYS360(ExpDat,RC1,0)/30,0)),0,OFFSET(R45C,MAX(-MNR,ROUND(DAYS360(ValDat,RC1,0)/30,0)-R8C+MEP-MNR),0,1,1))) -> 0 | AH74: =IF(RC1="","",IF(OR(R8C<=ROUND(DAYS360(ValDat,RC1,0)/30,0),R8C>ROUND(DAYS360(ExpDat,RC1,0)/30,0)),0,OFFSET(R45C,MAX(-MNR,ROUND(DAYS360(ValDat,RC1,0)/30,0)-R8C+MEP-MNR),0,1,1))) -> 0 | AI74: =IF(RC1="","",IF(OR(R8C<=ROUND(DAYS360(ValDat,RC1,0)/30,0),R8C>ROUND(DAYS360(ExpDat,RC1,0)/30,0)),0,OFFSET(R45C,MAX(-MNR,ROUND(DAYS360(ValDat,RC1,0)/30,0)-R8C+MEP-MNR),0,1,1))) -> 0 | AJ74: =IF(RC1="","",IF(OR(R8C<=ROUND(DAYS360(ValDat,RC1,0)/30,0),R8C>ROUND(DAYS360(ExpDat,RC1,0)/30,0)),0,OFFSET(R45C,MAX(-MNR,ROUND(DAYS360(ValDat,RC1,0)/30,0)-R8C+MEP-MNR),0,1,1))) -> 0 | AK74: =IF(RC1="","",IF(OR(R8C<=ROUND(DAYS360(ValDat,RC1,0)/30,0),R8C>ROUND(DAYS360(ExpDat,RC1,0)/30,0)),0,OFFSET(R45C,MAX(-MNR,ROUND(DAYS360(ValDat,RC1,0)/30,0)-R8C+MEP-MNR),0,1,1))) -> 0 | AL74: =IF(RC1="","",IF(OR(R8C<=ROUND(DAYS360(ValDat,RC1,0)/30,0),R8C>ROUND(DAYS360(ExpDat,RC1,0)/30,0)),0,OFFSET(R45C,MAX(-MNR,ROUND(DAYS360(ValDat,RC1,0)/30,0)-R8C+MEP-MNR),0,1,1))) -> 0 | AM74: =IF(RC1="","",IF(OR(R8C<=ROUND(DAYS360(ValDat,RC1,0)/30,0),R8C>ROUND(DAYS360(ExpDat,RC1,0)/30,0)),0,OFFSET(R45C,MAX(-MNR,ROUND(DAYS360(ValDat,RC1,0)/30,0)-R8C+MEP-MNR),0,1,1))) -> 0 | AN74: =IF(RC1="","",IF(OR(R8C<=ROUND(DAYS360(ValDat,RC1,0)/30,0),R8C>ROUND(DAYS360(ExpDat,RC1,0)/30,0)),0,OFFSET(R45C,MAX(-MNR,ROUND(DAYS360(ValDat,RC1,0)/30,0)-R8C+MEP-MNR),0,1,1))) -> 0 | AO74: =IF(RC1="","",IF(OR(R8C<=ROUND(DAYS360(ValDat,RC1,0)/30,0),R8C>ROUND(DAYS360(ExpDat,RC1,0)/30,0)),0,OFFSET(R45C,MAX(-MNR,ROUND(DAYS360(ValDat,RC1,0)/30,0)-R8C+MEP-MNR),0,1,1))) -> 0
A75: =IF(R[-1]C="","",IF(EOMONTH(R[-1]C,0)+1>RunDat,"",EOMONTH(R[-1]C,0)+1)) -> 2000-01-01T00:00:00.000 | D75: =IF(RC1="","",SUM(RC[2]:RC[37])) -> 166835 | F75: =IF(RC1="","",IF(OR(R8C<=ROUND(DAYS360(ValDat,RC1,0)/30,0),R8C>ROUND(DAYS360(ExpDat,RC1,0)/30,0)),0,OFFSET(R45C,MAX(-MNR,ROUND(DAYS360(ValDat,RC1,0)/30,0)-R8C+MEP-MNR),0,1,1))) -> 51587 | G75: =IF(RC1="","",IF(OR(R8C<=ROUND(DAYS360(ValDat,RC1,0)/30,0),R8C>ROUND(DAYS360(ExpDat,RC1,0)/30,0)),0,OFFSET(R45C,MAX(-MNR,ROUND(DAYS360(ValDat,RC1,0)/30,0)-R8C+MEP-MNR),0,1,1))) -> 90775 | H75: =IF(RC1="","",IF(OR(R8C<=ROUND(DAYS360(ValDat,RC1,0)/30,0),R8C>ROUND(DAYS360(ExpDat,RC1,0)/30,0)),0,OFFSET(R45C,MAX(-MNR,ROUND(DAYS360(ValDat,RC1,0)/30,0)-R8C+MEP-MNR),0,1,1))) -> 5794 | I75: =IF(RC1="","",IF(OR(R8C<=ROUND(DAYS360(ValDat,RC1,0)/30,0),R8C>ROUND(DAYS360(ExpDat,RC1,0)/30,0)),0,OFFSET(R45C,MAX(-MNR,ROUND(DAYS360(ValDat,RC1,0)/30,0)-R8C+MEP-MNR),0,1,1))) -> 4870 | J75: =IF(RC1="","",IF(OR(R8C<=ROUND(DAYS360(ValDat,RC1,0)/30,0),R8C>ROUND(DAYS360(ExpDat,RC1,0)/30,0)),0,OFFSET(R45C,MAX(-MNR,ROUND(DAYS360(ValDat,RC1,0)/30,0)-R8C+MEP-MNR),0,1,1))) -> 5698 | K75: =IF(RC1="","",IF(OR(R8C<=ROUND(DAYS360(ValDat,RC1,0)/30,0),R8C>ROUND(DAYS360(ExpDat,RC1,0)/30,0)),0,OFFSET(R45C,MAX(-MNR,ROUND(DAYS360(ValDat,RC1,0)/30,0)-R8C+MEP-MNR),0,1,1))) -> 2463 | L75: =IF(RC1="","",IF(OR(R8C<=ROUND(DAYS360(ValDat,RC1,0)/30,0),R8C>ROUND(DAYS360(ExpDat,RC1,0)/30,0)),0,OFFSET(R45C,MAX(-MNR,ROUND(DAYS360(ValDat,RC1,0)/30,0)-R8C+MEP-MNR),0,1,1))) -> 1010 | M75: =IF(RC1="","",IF(OR(R8C<=ROUND(DAYS360(ValDat,RC1,0)/30,0),R8C>ROUND(DAYS360(ExpDat,RC1,0)/30,0)),0,OFFSET(R45C,MAX(-MNR,ROUND(DAYS360(ValDat,RC1,0)/30,0)-R8C+MEP-MNR),0,1,1))) -> 484 | N75: =IF(RC1="","",IF(OR(R8C<=ROUND(DAYS360(ValDat,RC1,0)/30,0),R8C>ROUND(DAYS360(ExpDat,RC1,0)/30,0)),0,OFFSET(R45C,MAX(-MNR,ROUND(DAYS360(ValDat,RC1,0)/30,0)-R8C+MEP-MNR),0,1,1))) -> 4154 | O75: =IF(RC1="","",IF(OR(R8C<=ROUND(DAYS360(ValDat,RC1,0)/30,0),R8C>ROUND(DAYS360(ExpDat,RC1,0)/30,0)),0,OFFSET(R45C,MAX(-MNR,ROUND(DAYS360(ValDat,RC1,0)/30,0)-R8C+MEP-MNR),0,1,1))) -> 0 | P75: =IF(RC1="","",IF(OR(R8C<=ROUND(DAYS360(ValDat,RC1,0)/30,0),R8C>ROUND(DAYS360(ExpDat,RC1,0)/30,0)),0,OFFSET(R45C,MAX(-MNR,ROUND(DAYS360(ValDat,RC1,0)/30,0)-R8C+MEP-MNR),0,1,1))) -> 0 | Q75: =IF(RC1="","",IF(OR(R8C<=ROUND(DAYS360(ValDat,RC1,0)/30,0),R8C>ROUND(DAYS360(ExpDat,RC1,0)/30,0)),0,OFFSET(R45C,MAX(-MNR,ROUND(DAYS360(ValDat,RC1,0)/30,0)-R8C+MEP-MNR),0,1,1))) -> 0 | R75: =IF(RC1="","",IF(OR(R8C<=ROUND(DAYS360(ValDat,RC1,0)/30,0),R8C>ROUND(DAYS360(ExpDat,RC1,0)/30,0)),0,OFFSET(R45C,MAX(-MNR,ROUND(DAYS360(ValDat,RC1,0)/30,0)-R8C+MEP-MNR),0,1,1))) -> 0 | S75: =IF(RC1="","",IF(OR(R8C<=ROUND(DAYS360(ValDat,RC1,0)/30,0),R8C>ROUND(DAYS360(ExpDat,RC1,0)/30,0)),0,OFFSET(R45C,MAX(-MNR,ROUND(DAYS360(ValDat,RC1,0)/30,0)-R8C+MEP-MNR),0,1,1))) -> 0 | T75: =IF(RC1="","",IF(OR(R8C<=ROUND(DAYS360(ValDat,RC1,0)/30,0),R8C>ROUND(DAYS360(ExpDat,RC1,0)/30,0)),0,OFFSET(R45C,MAX(-MNR,ROUND(DAYS360(ValDat,RC1,0)/30,0)-R8C+MEP-MNR),0,1,1))) -> 0 | U75: =IF(RC1="","",IF(OR(R8C<=ROUND(DAYS360(ValDat,RC1,0)/30,0),R8C>ROUND(DAYS360(ExpDat,RC1,0)/30,0)),0,OFFSET(R45C,MAX(-MNR,ROUND(DAYS360(ValDat,RC1,0)/30,0)-R8C+MEP-MNR),0,1,1))) -> 0 | V75: =IF(RC1="","",IF(OR(R8C<=ROUND(DAYS360(ValDat,RC1,0)/30,0),R8C>ROUND(DAYS360(ExpDat,RC1,0)/30,0)),0,OFFSET(R45C,MAX(-MNR,ROUND(DAYS360(ValDat,RC1,0)/30,0)-R8C+MEP-MNR),0,1,1))) -> 0 | W75: =IF(RC1="","",IF(OR(R8C<=ROUND(DAYS360(ValDat,RC1,0)/30,0),R8C>ROUND(DAYS360(ExpDat,RC1,0)/30,0)),0,OFFSET(R45C,MAX(-MNR,ROUND(DAYS360(ValDat,RC1,0)/30,0)-R8C+MEP-MNR),0,1,1))) -> 0 | X75: =IF(RC1="","",IF(OR(R8C<=ROUND(DAYS360(ValDat,RC1,0)/30,0),R8C>ROUND(DAYS360(ExpDat,RC1,0)/30,0)),0,OFFSET(R45C,MAX(-MNR,ROUND(DAYS360(ValDat,RC1,0)/30,0)-R8C+MEP-MNR),0,1,1))) -> 0 | Y75: =IF(RC1="","",IF(OR(R8C<=ROUND(DAYS360(ValDat,RC1,0)/30,0),R8C>ROUND(DAYS360(ExpDat,RC1,0)/30,0)),0,OFFSET(R45C,MAX(-MNR,ROUND(DAYS360(ValDat,RC1,0)/30,0)-R8C+MEP-MNR),0,1,1))) -> 0 | Z75: =IF(RC1="","",IF(OR(R8C<=ROUND(DAYS360(ValDat,RC1,0)/30,0),R8C>ROUND(DAYS360(ExpDat,RC1,0)/30,0)),0,OFFSET(R45C,MAX(-MNR,ROUND(DAYS360(ValDat,RC1,0)/30,0)-R8C+MEP-MNR),0,1,1))) -> 0 | AA75: =IF(RC1="","",IF(OR(R8C<=ROUND(DAYS360(ValDat,RC1,0)/30,0),R8C>ROUND(DAYS360(ExpDat,RC1,0)/30,0)),0,OFFSET(R45C,MAX(-MNR,ROUND(DAYS360(ValDat,RC1,0)/30,0)-R8C+MEP-MNR),0,1,1))) -> 0 | AB75: =IF(RC1="","",IF(OR(R8C<=ROUND(DAYS360(ValDat,RC1,0)/30,0),R8C>ROUND(DAYS360(ExpDat,RC1,0)/30,0)),0,OFFSET(R45C,MAX(-MNR,ROUND(DAYS360(ValDat,RC1,0)/30,0)-R8C+MEP-MNR),0,1,1))) -> 0 | AC75: =IF(RC1="","",IF(OR(R8C<=ROUND(DAYS360(ValDat,RC1,0)/30,0),R8C>ROUND(DAYS360(ExpDat,RC1,0)/30,0)),0,OFFSET(R45C,MAX(-MNR,ROUND(DAYS360(ValDat,RC1,0)/30,0)-R8C+MEP-MNR),0,1,1))) -> 0 | AD75: =IF(RC1="","",IF(OR(R8C<=ROUND(DAYS360(ValDat,RC1,0)/30,0),R8C>ROUND(DAYS360(ExpDat,RC1,0)/30,0)),0,OFFSET(R45C,MAX(-MNR,ROUND(DAYS360(ValDat,RC1,0)/30,0)-R8C+MEP-MNR),0,1,1))) -> 0 | AE75: =IF(RC1="","",IF(OR(R8C<=ROUND(DAYS360(ValDat,RC1,0)/30,0),R8C>ROUND(DAYS360(ExpDat,RC1,0)/30,0)),0,OFFSET(R45C,MAX(-MNR,ROUND(DAYS360(ValDat,RC1,0)/30,0)-R8C+MEP-MNR),0,1,1))) -> 0 | AF75: =IF(RC1="","",IF(OR(R8C<=ROUND(DAYS360(ValDat,RC1,0)/30,0),R8C>ROUND(DAYS360(ExpDat,RC1,0)/30,0)),0,OFFSET(R45C,MAX(-MNR,ROUND(DAYS360(ValDat,RC1,0)/30,0)-R8C+MEP-MNR),0,1,1))) -> 0 | AG75: =IF(RC1="","",IF(OR(R8C<=ROUND(DAYS360(ValDat,RC1,0)/30,0),R8C>ROUND(DAYS360(ExpDat,RC1,0)/30,0)),0,OFFSET(R45C,MAX(-MNR,ROUND(DAYS360(ValDat,RC1,0)/30,0)-R8C+MEP-MNR),0,1,1))) -> 0 | AH75: =IF(RC1="","",IF(OR(R8C<=ROUND(DAYS360(ValDat,RC1,0)/30,0),R8C>ROUND(DAYS360(ExpDat,RC1,0)/30,0)),0,OFFSET(R45C,MAX(-MNR,ROUND(DAYS360(ValDat,RC1,0)/30,0)-R8C+MEP-MNR),0,1,1))) -> 0 | AI75: =IF(RC1="","",IF(OR(R8C<=ROUND(DAYS360(ValDat,RC1,0)/30,0),R8C>ROUND(DAYS360(ExpDat,RC1,0)/30,0)),0,OFFSET(R45C,MAX(-MNR,ROUND(DAYS360(ValDat,RC1,0)/30,0)-R8C+MEP-MNR),0,1,1))) -> 0 | AJ75: =IF(RC1="","",IF(OR(R8C<=ROUND(DAYS360(ValDat,RC1,0)/30,0),R8C>ROUND(DAYS360(ExpDat,RC1,0)/30,0)),0,OFFSET(R45C,MAX(-MNR,ROUND(DAYS360(ValDat,RC1,0)/30,0)-R8C+MEP-MNR),0,1,1))) -> 0 | AK75: =IF(RC1="","",IF(OR(R8C<=ROUND(DAYS360(ValDat,RC1,0)/30,0),R8C>ROUND(DAYS360(ExpDat,RC1,0)/30,0)),0,OFFSET(R45C,MAX(-MNR,ROUND(DAYS360(ValDat,RC1,0)/30,0)-R8C+MEP-MNR),0,1,1))) -> 0 | AL75: =IF(RC1="","",IF(OR(R8C<=ROUND(DAYS360(ValDat,RC1,0)/30,0),R8C>ROUND(DAYS360(ExpDat,RC1,0)/30,0)),0,OFFSET(R45C,MAX(-MNR,ROUND(DAYS360(ValDat,RC1,0)/30,0)-R8C+MEP-MNR),0,1,1))) -> 0 | AM75: =IF(RC1="","",IF(OR(R8C<=ROUND(DAYS360(ValDat,RC1,0)/30,0),R8C>ROUND(DAYS360(ExpDat,RC1,0)/30,0)),0,OFFSET(R45C,MAX(-MNR,ROUND(DAYS360(ValDat,RC1,0)/30,0)-R8C+MEP-MNR),0,1,1))) -> 0 | AN75: =IF(RC1="","",IF(OR(R8C<=ROUND(DAYS360(ValDat,RC1,0)/30,0),R8C>ROUND(DAYS360(ExpDat,RC1,0)/30,0)),0,OFFSET(R45C,MAX(-MNR,ROUND(DAYS360(ValDat,RC1,0)/30,0)-R8C+MEP-MNR),0,1,1))) -> 0 | AO75: =IF(RC1="","",IF(OR(R8C<=ROUND(DAYS360(ValDat,RC1,0)/30,0),R8C>ROUND(DAYS360(ExpDat,RC1,0)/30,0)),0,OFFSET(R45C,MAX(-MNR,ROUND(DAYS360(ValDat,RC1,0)/30,0)-R8C+MEP-MNR),0,1,1))) -> 0
A76: =IF(R[-1]C="","",IF(EOMONTH(R[-1]C,0)+1>RunDat,"",EOMONTH(R[-1]C,0)+1)) -> 2000-02-01T00:00:00.000 | D76: =IF(RC1="","",SUM(RC[2]:RC[37])) -> 288985 | F76: =IF(RC1="","",IF(OR(R8C<=ROUND(DAYS360(ValDat,RC1,0)/30,0),R8C>ROUND(DAYS360(ExpDat,RC1,0)/30,0)),0,OFFSET(R45C,MAX(-MNR,ROUND(DAYS360(ValDat,RC1,0)/30,0)-R8C+MEP-MNR),0,1,1))) -> 8561 | G76: =IF(RC1="","",IF(OR(R8C<=ROUND(DAYS360(ValDat,RC1,0)/30,0),R8C>ROUND(DAYS360(ExpDat,RC1,0)/30,0)),0,OFFSET(R45C,MAX(-MNR,ROUND(DAYS360(ValDat,RC1,0)/30,0)-R8C+MEP-MNR),0,1,1))) -> 137822 | H76: =IF(RC1="","",IF(OR(R8C<=ROUND(DAYS360(ValDat,RC1,0)/30,0),R8C>ROUND(DAYS360(ExpDat,RC1,0)/30,0)),0,OFFSET(R45C,MAX(-MNR,ROUND(DAYS360(ValDat,RC1,0)/30,0)-R8C+MEP-MNR),0,1,1))) -> 92161 | I76: =IF(RC1="","",IF(OR(R8C<=ROUND(DAYS360(ValDat,RC1,0)/30,0),R8C>ROUND(DAYS360(ExpDat,RC1,0)/30,0)),0,OFFSET(R45C,MAX(-MNR,ROUND(DAYS360(ValDat,RC1,0)/30,0)-R8C+MEP-MNR),0,1,1))) -> 3493 | J76: =IF(RC1="","",IF(OR(R8C<=ROUND(DAYS360(ValDat,RC1,0)/30,0),R8C>ROUND(DAYS360(ExpDat,RC1,0)/30,0)),0,OFFSET(R45C,MAX(-MNR,ROUND(DAYS360(ValDat,RC1,0)/30,0)-R8C+MEP-MNR),0,1,1))) -> 4827 | K76: =IF(RC1="","",IF(OR(R8C<=ROUND(DAYS360(ValDat,RC1,0)/30,0),R8C>ROUND(DAYS360(ExpDat,RC1,0)/30,0)),0,OFFSET(R45C,MAX(-MNR,ROUND(DAYS360(ValDat,RC1,0)/30,0)-R8C+MEP-MNR),0,1,1))) -> 1709 | L76: =IF(RC1="","",IF(OR(R8C<=ROUND(DAYS360(ValDat,RC1,0)/30,0),R8C>ROUND(DAYS360(ExpDat,RC1,0)/30,0)),0,OFFSET(R45C,MAX(-MNR,ROUND(DAYS360(ValDat,RC1,0)/30,0)-R8C+MEP-MNR),0,1,1))) -> 34006 | M76: =IF(RC1="","",IF(OR(R8C<=ROUND(DAYS360(ValDat,RC1,0)/30,0),R8C>ROUND(DAYS360(ExpDat,RC1,0)/30,0)),0,OFFSET(R45C,MAX(-MNR,ROUND(DAYS360(ValDat,RC1,0)/30,0)-R8C+MEP-MNR),0,1,1))) -> 484 | N76: =IF(RC1="","",IF(OR(R8C<=ROUND(DAYS360(ValDat,RC1,0)/30,0),R8C>ROUND(DAYS360(ExpDat,RC1,0)/30,0)),0,OFFSET(R45C,MAX(-MNR,ROUND(DAYS360(ValDat,RC1,0)/30,0)-R8C+MEP-MNR),0,1,1))) -> 5922 | O76: =IF(RC1="","",IF(OR(R8C<=ROUND(DAYS360(ValDat,RC1,0)/30,0),R8C>ROUND(DAYS360(ExpDat,RC1,0)/30,0)),0,OFFSET(R45C,MAX(-MNR,ROUND(DAYS360(ValDat,RC1,0)/30,0)-R8C+MEP-MNR),0,1,1))) -> 0 | P76: =IF(RC1="","",IF(OR(R8C<=ROUND(DAYS360(ValDat,RC1,0)/30,0),R8C>ROUND(DAYS360(ExpDat,RC1,0)/30,0)),0,OFFSET(R45C,MAX(-MNR,ROUND(DAYS360(ValDat,RC1,0)/30,0)-R8C+MEP-MNR),0,1,1))) -> 0 | Q76: =IF(RC1="","",IF(OR(R8C<=ROUND(DAYS360(ValDat,RC1,0)/30,0),R8C>ROUND(DAYS360(ExpDat,RC1,0)/30,0)),0,OFFSET(R45C,MAX(-MNR,ROUND(DAYS360(ValDat,RC1,0)/30,0)-R8C+MEP-MNR),0,1,1))) -> 0 | R76: =IF(RC1="","",IF(OR(R8C<=ROUND(DAYS360(ValDat,RC1,0)/30,0),R8C>ROUND(DAYS360(ExpDat,RC1,0)/30,0)),0,OFFSET(R45C,MAX(-MNR,ROUND(DAYS360(ValDat,RC1,0)/30,0)-R8C+MEP-MNR),0,1,1))) -> 0 | S76: =IF(RC1="","",IF(OR(R8C<=ROUND(DAYS360(ValDat,RC1,0)/30,0),R8C>ROUND(DAYS360(ExpDat,RC1,0)/30,0)),0,OFFSET(R45C,MAX(-MNR,ROUND(DAYS360(ValDat,RC1,0)/30,0)-R8C+MEP-MNR),0,1,1))) -> 0 | T76: =IF(RC1="","",IF(OR(R8C<=ROUND(DAYS360(ValDat,RC1,0)/30,0),R8C>ROUND(DAYS360(ExpDat,RC1,0)/30,0)),0,OFFSET(R45C,MAX(-MNR,ROUND(DAYS360(ValDat,RC1,0)/30,0)-R8C+MEP-MNR),0,1,1))) -> 0 | U76: =IF(RC1="","",IF(OR(R8C<=ROUND(DAYS360(ValDat,RC1,0)/30,0),R8C>ROUND(DAYS360(ExpDat,RC1,0)/30,0)),0,OFFSET(R45C,MAX(-MNR,ROUND(DAYS360(ValDat,RC1,0)/30,0)-R8C+MEP-MNR),0,1,1))) -> 0 | V76: =IF(RC1="","",IF(OR(R8C<=ROUND(DAYS360(ValDat,RC1,0)/30,0),R8C>ROUND(DAYS360(ExpDat,RC1,0)/30,0)),0,OFFSET(R45C,MAX(-MNR,ROUND(DAYS360(ValDat,RC1,0)/30,0)-R8C+MEP-MNR),0,1,1))) -> 0 | W76: =IF(RC1="","",IF(OR(R8C<=ROUND(DAYS360(ValDat,RC1,0)/30,0),R8C>ROUND(DAYS360(ExpDat,RC1,0)/30,0)),0,OFFSET(R45C,MAX(-MNR,ROUND(DAYS360(ValDat,RC1,0)/30,0)-R8C+MEP-MNR),0,1,1))) -> 0 | X76: =IF(RC1="","",IF(OR(R8C<=ROUND(DAYS360(ValDat,RC1,0)/30,0),R8C>ROUND(DAYS360(ExpDat,RC1,0)/30,0)),0,OFFSET(R45C,MAX(-MNR,ROUND(DAYS360(ValDat,RC1,0)/30,0)-R8C+MEP-MNR),0,1,1))) -> 0 | Y76: =IF(RC1="","",IF(OR(R8C<=ROUND(DAYS360(ValDat,RC1,0)/30,0),R8C>ROUND(DAYS360(ExpDat,RC1,0)/30,0)),0,OFFSET(R45C,MAX(-MNR,ROUND(DAYS360(ValDat,RC1,0)/30,0)-R8C+MEP-MNR),0,1,1))) -> 0 | Z76: =IF(RC1="","",IF(OR(R8C<=ROUND(DAYS360(ValDat,RC1,0)/30,0),R8C>ROUND(DAYS360(ExpDat,RC1,0)/30,0)),0,OFFSET(R45C,MAX(-MNR,ROUND(DAYS360(ValDat,RC1,0)/30,0)-R8C+MEP-MNR),0,1,1))) -> 0 | AA76: =IF(RC1="","",IF(OR(R8C<=ROUND(DAYS360(ValDat,RC1,0)/30,0),R8C>ROUND(DAYS360(ExpDat,RC1,0)/30,0)),0,OFFSET(R45C,MAX(-MNR,ROUND(DAYS360(ValDat,RC1,0)/30,0)-R8C+MEP-MNR),0,1,1))) -> 0 | AB76: =IF(RC1="","",IF(OR(R8C<=ROUND(DAYS360(ValDat,RC1,0)/30,0),R8C>ROUND(DAYS360(ExpDat,RC1,0)/30,0)),0,OFFSET(R45C,MAX(-MNR,ROUND(DAYS360(ValDat,RC1,0)/30,0)-R8C+MEP-MNR),0,1,1))) -> 0 | AC76: =IF(RC1="","",IF(OR(R8C<=ROUND(DAYS360(ValDat,RC1,0)/30,0),R8C>ROUND(DAYS360(ExpDat,RC1,0)/30,0)),0,OFFSET(R45C,MAX(-MNR,ROUND(DAYS360(ValDat,RC1,0)/30,0)-R8C+MEP-MNR),0,1,1))) -> 0 | AD76: =IF(RC1="","",IF(OR(R8C<=ROUND(DAYS360(ValDat,RC1,0)/30,0),R8C>ROUND(DAYS360(ExpDat,RC1,0)/30,0)),0,OFFSET(R45C,MAX(-MNR,ROUND(DAYS360(ValDat,RC1,0)/30,0)-R8C+MEP-MNR),0,1,1))) -> 0 | AE76: =IF(RC1="","",IF(OR(R8C<=ROUND(DAYS360(ValDat,RC1,0)/30,0),R8C>ROUND(DAYS360(ExpDat,RC1,0)/30,0)),0,OFFSET(R45C,MAX(-MNR,ROUND(DAYS360(ValDat,RC1,0)/30,0)-R8C+MEP-MNR),0,1,1))) -> 0 | AF76: =IF(RC1="","",IF(OR(R8C<=ROUND(DAYS360(ValDat,RC1,0)/30,0),R8C>ROUND(DAYS360(ExpDat,RC1,0)/30,0)),0,OFFSET(R45C,MAX(-MNR,ROUND(DAYS360(ValDat,RC1,0)/30,0)-R8C+MEP-MNR),0,1,1))) -> 0 | AG76: =IF(RC1="","",IF(OR(R8C<=ROUND(DAYS360(ValDat,RC1,0)/30,0),R8C>ROUND(DAYS360(ExpDat,RC1,0)/30,0)),0,OFFSET(R45C,MAX(-MNR,ROUND(DAYS360(ValDat,RC1,0)/30,0)-R8C+MEP-MNR),0,1,1))) -> 0 | AH76: =IF(RC1="","",IF(OR(R8C<=ROUND(DAYS360(ValDat,RC1,0)/30,0),R8C>ROUND(DAYS360(ExpDat,RC1,0)/30,0)),0,OFFSET(R45C,MAX(-MNR,ROUND(DAYS360(ValDat,RC1,0)/30,0)-R8C+MEP-MNR),0,1,1))) -> 0 | AI76: =IF(RC1="","",IF(OR(R8C<=ROUND(DAYS360(ValDat,RC1,0)/30,0),R8C>ROUND(DAYS360(ExpDat,RC1,0)/30,0)),0,OFFSET(R45C,MAX(-MNR,ROUND(DAYS360(ValDat,RC1,0)/30,0)-R8C+MEP-MNR),0,1,1))) -> 0 | AJ76: =IF(RC1="","",IF(OR(R8C<=ROUND(DAYS360(ValDat,RC1,0)/30,0),R8C>ROUND(DAYS360(ExpDat,RC1,0)/30,0)),0,OFFSET(R45C,MAX(-MNR,ROUND(DAYS360(ValDat,RC1,0)/30,0)-R8C+MEP-MNR),0,1,1))) -> 0 | AK76: =IF(RC1="","",IF(OR(R8C<=ROUND(DAYS360(ValDat,RC1,0)/30,0),R8C>ROUND(DAYS360(ExpDat,RC1,0)/30,0)),0,OFFSET(R45C,MAX(-MNR,ROUND(DAYS360(ValDat,RC1,0)/30,0)-R8C+MEP-MNR),0,1,1))) -> 0 | AL76: =IF(RC1="","",IF(OR(R8C<=ROUND(DAYS360(ValDat,RC1,0)/30,0),R8C>ROUND(DAYS360(ExpDat,RC1,0)/30,0)),0,OFFSET(R45C,MAX(-MNR,ROUND(DAYS360(ValDat,RC1,0)/30,0)-R8C+MEP-MNR),0,1,1))) -> 0 | AM76: =IF(RC1="","",IF(OR(R8C<=ROUND(DAYS360(ValDat,RC1,0)/30,0),R8C>ROUND(DAYS360(ExpDat,RC1,0)/30,0)),0,OFFSET(R45C,MAX(-MNR,ROUND(DAYS360(ValDat,RC1,0)/30,0)-R8C+MEP-MNR),0,1,1))) -> 0 | AN76: =IF(RC1="","",IF(OR(R8C<=ROUND(DAYS360(ValDat,RC1,0)/30,0),R8C>ROUND(DAYS360(ExpDat,RC1,0)/30,0)),0,OFFSET(R45C,MAX(-MNR,ROUND(DAYS360(ValDat,RC1,0)/30,0)-R8C+MEP-MNR),0,1,1))) -> 0 | AO76: =IF(RC1="","",IF(OR(R8C<=ROUND(DAYS360(ValDat,RC1,0)/30,0),R8C>ROUND(DAYS360(ExpDat,RC1,0)/30,0)),0,OFFSET(R45C,MAX(-MNR,ROUND(DAYS360(ValDat,RC1,0)/30,0)-R8C+MEP-MNR),0,1,1))) -> 0
A77: =IF(R[-1]C="","",IF(EOMONTH(R[-1]C,0)+1>RunDat,"",EOMONTH(R[-1]C,0)+1)) -> 2000-03-01T00:00:00.000 | D77: =IF(RC1="","",SUM(RC[2]:RC[37])) -> 157814 | F77: =IF(RC1="","",IF(OR(R8C<=ROUND(DAYS360(ValDat,RC1,0)/30,0),R8C>ROUND(DAYS360(ExpDat,RC1,0)/30,0)),0,OFFSET(R45C,MAX(-MNR,ROUND(DAYS360(ValDat,RC1,0)/30,0)-R8C+MEP-MNR),0,1,1))) -> 24902 | G77: =IF(RC1="","",IF(OR(R8C<=ROUND(DAYS360(ValDat,RC1,0)/30,0),R8C>ROUND(DAYS360(ExpDat,RC1,0)/30,0)),0,OFFSET(R45C,MAX(-MNR,ROUND(DAYS360(ValDat,RC1,0)/30,0)-R8C+MEP-MNR),0,1,1))) -> 60370 | H77: =IF(RC1="","",IF(OR(R8C<=ROUND(DAYS360(ValDat,RC1,0)/30,0),R8C>ROUND(DAYS360(ExpDat,RC1,0)/30,0)),0,OFFSET(R45C,MAX(-MNR,ROUND(DAYS360(ValDat,RC1,0)/30,0)-R8C+MEP-MNR),0,1,1))) -> 7018 | I77: =IF(RC1="","",IF(OR(R8C<=ROUND(DAYS360(ValDat,RC1,0)/30,0),R8C>ROUND(DAYS360(ExpDat,RC1,0)/30,0)),0,OFFSET(R45C,MAX(-MNR,ROUND(DAYS360(ValDat,RC1,0)/30,0)-R8C+MEP-MNR),0,1,1))) -> 12514 | J77: =IF(RC1="","",IF(OR(R8C<=ROUND(DAYS360(ValDat,RC1,0)/30,0),R8C>ROUND(DAYS360(ExpDat,RC1,0)/30,0)),0,OFFSET(R45C,MAX(-MNR,ROUND(DAYS360(ValDat,RC1,0)/30,0)-R8C+MEP-MNR),0,1,1))) -> 4941 | K77: =IF(RC1="","",IF(OR(R8C<=ROUND(DAYS360(ValDat,RC1,0)/30,0),R8C>ROUND(DAYS360(ExpDat,RC1,0)/30,0)),0,OFFSET(R45C,MAX(-MNR,ROUND(DAYS360(ValDat,RC1,0)/30,0)-R8C+MEP-MNR),0,1,1))) -> 13323 | L77: =IF(RC1="","",IF(OR(R8C<=ROUND(DAYS360(ValDat,RC1,0)/30,0),R8C>ROUND(DAYS360(ExpDat,RC1,0)/30,0)),0,OFFSET(R45C,MAX(-MNR,ROUND(DAYS360(ValDat,RC1,0)/30,0)-R8C+MEP-MNR),0,1,1))) -> 30681 | M77: =IF(RC1="","",IF(OR(R8C<=ROUND(DAYS360(ValDat,RC1,0)/30,0),R8C>ROUND(DAYS360(ExpDat,RC1,0)/30,0)),0,OFFSET(R45C,MAX(-MNR,ROUND(DAYS360(ValDat,RC1,0)/30,0)-R8C+MEP-MNR),0,1,1))) -> -80 | N77: =IF(RC1="","",IF(OR(R8C<=ROUND(DAYS360(ValDat,RC1,0)/30,0),R8C>ROUND(DAYS360(ExpDat,RC1,0)/30,0)),0,OFFSET(R45C,MAX(-MNR,ROUND(DAYS360(ValDat,RC1,0)/30,0)-R8C+MEP-MNR),0,1,1))) -> 6162 | O77: =IF(RC1="","",IF(OR(R8C<=ROUND(DAYS360(ValDat,RC1,0)/30,0),R8C>ROUND(DAYS360(ExpDat,RC1,0)/30,0)),0,OFFSET(R45C,MAX(-MNR,ROUND(DAYS360(ValDat,RC1,0)/30,0)-R8C+MEP-MNR),0,1,1))) -> -2017 | P77: =IF(RC1="","",IF(OR(R8C<=ROUND(DAYS360(ValDat,RC1,0)/30,0),R8C>ROUND(DAYS360(ExpDat,RC1,0)/30,0)),0,OFFSET(R45C,MAX(-MNR,ROUND(DAYS360(ValDat,RC1,0)/30,0)-R8C+MEP-MNR),0,1,1))) -> 0 | Q77: =IF(RC1="","",IF(OR(R8C<=ROUND(DAYS360(ValDat,RC1,0)/30,0),R8C>ROUND(DAYS360(ExpDat,RC1,0)/30,0)),0,OFFSET(R45C,MAX(-MNR,ROUND(DAYS360(ValDat,RC1,0)/30,0)-R8C+MEP-MNR),0,1,1))) -> 0 | R77: =IF(RC1="","",IF(OR(R8C<=ROUND(DAYS360(ValDat,RC1,0)/30,0),R8C>ROUND(DAYS360(ExpDat,RC1,0)/30,0)),0,OFFSET(R45C,MAX(-MNR,ROUND(DAYS360(ValDat,RC1,0)/30,0)-R8C+MEP-MNR),0,1,1))) -> 0 | S77: =IF(RC1="","",IF(OR(R8C<=ROUND(DAYS360(ValDat,RC1,0)/30,0),R8C>ROUND(DAYS360(ExpDat,RC1,0)/30,0)),0,OFFSET(R45C,MAX(-MNR,ROUND(DAYS360(ValDat,RC1,0)/30,0)-R8C+MEP-MNR),0,1,1))) -> 0 | T77: =IF(RC1="","",IF(OR(R8C<=ROUND(DAYS360(ValDat,RC1,0)/30,0),R8C>ROUND(DAYS360(ExpDat,RC1,0)/30,0)),0,OFFSET(R45C,MAX(-MNR,ROUND(DAYS360(ValDat,RC1,0)/30,0)-R8C+MEP-MNR),0,1,1))) -> 0 | U77: =IF(RC1="","",IF(OR(R8C<=ROUND(DAYS360(ValDat,RC1,0)/30,0),R8C>ROUND(DAYS360(ExpDat,RC1,0)/30,0)),0,OFFSET(R45C,MAX(-MNR,ROUND(DAYS360(ValDat,RC1,0)/30,0)-R8C+MEP-MNR),0,1,1))) -> 0 | V77: =IF(RC1="","",IF(OR(R8C<=ROUND(DAYS360(ValDat,RC1,0)/30,0),R8C>ROUND(DAYS360(ExpDat,RC1,0)/30,0)),0,OFFSET(R45C,MAX(-MNR,ROUND(DAYS360(ValDat,RC1,0)/30,0)-R8C+MEP-MNR),0,1,1))) -> 0 | W77: =IF(RC1="","",IF(OR(R8C<=ROUND(DAYS360(ValDat,RC1,0)/30,0),R8C>ROUND(DAYS360(ExpDat,RC1,0)/30,0)),0,OFFSET(R45C,MAX(-MNR,ROUND(DAYS360(ValDat,RC1,0)/30,0)-R8C+MEP-MNR),0,1,1))) -> 0 | X77: =IF(RC1="","",IF(OR(R8C<=ROUND(DAYS360(ValDat,RC1,0)/30,0),R8C>ROUND(DAYS360(ExpDat,RC1,0)/30,0)),0,OFFSET(R45C,MAX(-MNR,ROUND(DAYS360(ValDat,RC1,0)/30,0)-R8C+MEP-MNR),0,1,1))) -> 0 | Y77: =IF(RC1="","",IF(OR(R8C<=ROUND(DAYS360(ValDat,RC1,0)/30,0),R8C>ROUND(DAYS360(ExpDat,RC1,0)/30,0)),0,OFFSET(R45C,MAX(-MNR,ROUND(DAYS360(ValDat,RC1,0)/30,0)-R8C+MEP-MNR),0,1,1))) -> 0 | Z77: =IF(RC1="","",IF(OR(R8C<=ROUND(DAYS360(ValDat,RC1,0)/30,0),R8C>ROUND(DAYS360(ExpDat,RC1,0)/30,0)),0,OFFSET(R45C,MAX(-MNR,ROUND(DAYS360(ValDat,RC1,0)/30,0)-R8C+MEP-MNR),0,1,1))) -> 0 | AA77: =IF(RC1="","",IF(OR(R8C<=ROUND(DAYS360(ValDat,RC1,0)/30,0),R8C>ROUND(DAYS360(ExpDat,RC1,0)/30,0)),0,OFFSET(R45C,MAX(-MNR,ROUND(DAYS360(ValDat,RC1,0)/30,0)-R8C+MEP-MNR),0,1,1))) -> 0 | AB77: =IF(RC1="","",IF(OR(R8C<=ROUND(DAYS360(ValDat,RC1,0)/30,0),R8C>ROUND(DAYS360(ExpDat,RC1,0)/30,0)),0,OFFSET(R45C,MAX(-MNR,ROUND(DAYS360(ValDat,RC1,0)/30,0)-R8C+MEP-MNR),0,1,1))) -> 0 | AC77: =IF(RC1="","",IF(OR(R8C<=ROUND(DAYS360(ValDat,RC1,0)/30,0),R8C>ROUND(DAYS360(ExpDat,RC1,0)/30,0)),0,OFFSET(R45C,MAX(-MNR,ROUND(DAYS360(ValDat,RC1,0)/30,0)-R8C+MEP-MNR),0,1,1))) -> 0 | AD77: =IF(RC1="","",IF(OR(R8C<=ROUND(DAYS360(ValDat,RC1,0)/30,0),R8C>ROUND(DAYS360(ExpDat,RC1,0)/30,0)),0,OFFSET(R45C,MAX(-MNR,ROUND(DAYS360(ValDat,RC1,0)/30,0)-R8C+MEP-MNR),0,1,1))) -> 0 | AE77: =IF(RC1="","",IF(OR(R8C<=ROUND(DAYS360(ValDat,RC1,0)/30,0),R8C>ROUND(DAYS360(ExpDat,RC1,0)/30,0)),0,OFFSET(R45C,MAX(-MNR,ROUND(DAYS360(ValDat,RC1,0)/30,0)-R8C+MEP-MNR),0,1,1))) -> 0 | AF77: =IF(RC1="","",IF(OR(R8C<=ROUND(DAYS360(ValDat,RC1,0)/30,0),R8C>ROUND(DAYS360(ExpDat,RC1,0)/30,0)),0,OFFSET(R45C,MAX(-MNR,ROUND(DAYS360(ValDat,RC1,0)/30,0)-R8C+MEP-MNR),0,1,1))) -> 0 | AG77: =IF(RC1="","",IF(OR(R8C<=ROUND(DAYS360(ValDat,RC1,0)/30,0),R8C>ROUND(DAYS360(ExpDat,RC1,0)/30,0)),0,OFFSET(R45C,MAX(-MNR,ROUND(DAYS360(ValDat,RC1,0)/30,0)-R8C+MEP-MNR),0,1,1))) -> 0 | AH77: =IF(RC1="","",IF(OR(R8C<=ROUND(DAYS360(ValDat,RC1,0)/30,0),R8C>ROUND(DAYS360(ExpDat,RC1,0)/30,0)),0,OFFSET(R45C,MAX(-MNR,ROUND(DAYS360(ValDat,RC1,0)/30,0)-R8C+MEP-MNR),0,1,1))) -> 0 | AI77: =IF(RC1="","",IF(OR(R8C<=ROUND(DAYS360(ValDat,RC1,0)/30,0),R8C>ROUND(DAYS360(ExpDat,RC1,0)/30,0)),0,OFFSET(R45C,MAX(-MNR,ROUND(DAYS360(ValDat,RC1,0)/30,0)-R8C+MEP-MNR),0,1,1))) -> 0 | AJ77: =IF(RC1="","",IF(OR(R8C<=ROUND(DAYS360(ValDat,RC1,0)/30,0),R8C>ROUND(DAYS360(ExpDat,RC1,0)/30,0)),0,OFFSET(R45C,MAX(-MNR,ROUND(DAYS360(ValDat,RC1,0)/30,0)-R8C+MEP-MNR),0,1,1))) -> 0 | AK77: =IF(RC1="","",IF(OR(R8C<=ROUND(DAYS360(ValDat,RC1,0)/30,0),R8C>ROUND(DAYS360(ExpDat,RC1,0)/30,0)),0,OFFSET(R45C,MAX(-MNR,ROUND(DAYS360(ValDat,RC1,0)/30,0)-R8C+MEP-MNR),0,1,1))) -> 0 | AL77: =IF(RC1="","",IF(OR(R8C<=ROUND(DAYS360(ValDat,RC1,0)/30,0),R8C>ROUND(DAYS360(ExpDat,RC1,0)/30,0)),0,OFFSET(R45C,MAX(-MNR,ROUND(DAYS360(ValDat,RC1,0)/30,0)-R8C+MEP-MNR),0,1,1))) -> 0 | AM77: =IF(RC1="","",IF(OR(R8C<=ROUND(DAYS360(ValDat,RC1,0)/30,0),R8C>ROUND(DAYS360(ExpDat,RC1,0)/30,0)),0,OFFSET(R45C,MAX(-MNR,ROUND(DAYS360(ValDat,RC1,0)/30,0)-R8C+MEP-MNR),0,1,1))) -> 0 | AN77: =IF(RC1="","",IF(OR(R8C<=ROUND(DAYS360(ValDat,RC1,0)/30,0),R8C>ROUND(DAYS360(ExpDat,RC1,0)/30,0)),0,OFFSET(R45C,MAX(-MNR,ROUND(DAYS360(ValDat,RC1,0)/30,0)-R8C+MEP-MNR),0,1,1))) -> 0 | AO77: =IF(RC1="","",IF(OR(R8C<=ROUND(DAYS360(ValDat,RC1,0)/30,0),R8C>ROUND(DAYS360(ExpDat,RC1,0)/30,0)),0,OFFSET(R45C,MAX(-MNR,ROUND(DAYS360(ValDat,RC1,0)/30,0)-R8C+MEP-MNR),0,1,1))) -> 0
A78: =IF(R[-1]C="","",IF(EOMONTH(R[-1]C,0)+1>RunDat,"",EOMONTH(R[-1]C,0)+1)) -> 2000-04-01T00:00:00.000 | D78: =IF(RC1="","",SUM(RC[2]:RC[37])) -> 266552 | F78: =IF(RC1="","",IF(OR(R8C<=ROUND(DAYS360(ValDat,RC1,0)/30,0),R8C>ROUND(DAYS360(ExpDat,RC1,0)/30,0)),0,OFFSET(R45C,MAX(-MNR,ROUND(DAYS360(ValDat,RC1,0)/30,0)-R8C+MEP-MNR),0,1,1))) -> 5744 | G78: =IF(RC1="","",IF(OR(R8C<=ROUND(DAYS360(ValDat,RC1,0)/30,0),R8C>ROUND(DAYS360(ExpDat,RC1,0)/30,0)),0,OFFSET(R45C,MAX(-MNR,ROUND(DAYS360(ValDat,RC1,0)/30,0)-R8C+MEP-MNR),0,1,1))) -> 72373 | H78: =IF(RC1="","",IF(OR(R8C<=ROUND(DAYS360(ValDat,RC1,0)/30,0),R8C>ROUND(DAYS360(ExpDat,RC1,0)/30,0)),0,OFFSET(R45C,MAX(-MNR,ROUND(DAYS360(ValDat,RC1,0)/30,0)-R8C+MEP-MNR),0,1,1))) -> 167781 | I78: =IF(RC1="","",IF(OR(R8C<=ROUND(DAYS360(ValDat,RC1,0)/30,0),R8C>ROUND(DAYS360(ExpDat,RC1,0)/30,0)),0,OFFSET(R45C,MAX(-MNR,ROUND(DAYS360(ValDat,RC1,0)/30,0)-R8C+MEP-MNR),0,1,1))) -> 12343 | J78: =IF(RC1="","",IF(OR(R8C<=ROUND(DAYS360(ValDat,RC1,0)/30,0),R8C>ROUND(DAYS360(ExpDat,RC1,0)/30,0)),0,OFFSET(R45C,MAX(-MNR,ROUND(DAYS360(ValDat,RC1,0)/30,0)-R8C+MEP-MNR),0,1,1))) -> 4501 | K78: =IF(RC1="","",IF(OR(R8C<=ROUND(DAYS360(ValDat,RC1,0)/30,0),R8C>ROUND(DAYS360(ExpDat,RC1,0)/30,0)),0,OFFSET(R45C,MAX(-MNR,ROUND(DAYS360(ValDat,RC1,0)/30,0)-R8C+MEP-MNR),0,1,1))) -> 13013 | L78: =IF(RC1="","",IF(OR(R8C<=ROUND(DAYS360(ValDat,RC1,0)/30,0),R8C>ROUND(DAYS360(ExpDat,RC1,0)/30,0)),0,OFFSET(R45C,MAX(-MNR,ROUND(DAYS360(ValDat,RC1,0)/30,0)-R8C+MEP-MNR),0,1,1))) -> -7175 | M78: =IF(RC1="","",IF(OR(R8C<=ROUND(DAYS360(ValDat,RC1,0)/30,0),R8C>ROUND(DAYS360(ExpDat,RC1,0)/30,0)),0,OFFSET(R45C,MAX(-MNR,ROUND(DAYS360(ValDat,RC1,0)/30,0)-R8C+MEP-MNR),0,1,1))) -> -80 | N78: =IF(RC1="","",IF(OR(R8C<=ROUND(DAYS360(ValDat,RC1,0)/30,0),R8C>ROUND(DAYS360(ExpDat,RC1,0)/30,0)),0,OFFSET(R45C,MAX(-MNR,ROUND(DAYS360(ValDat,RC1,0)/30,0)-R8C+MEP-MNR),0,1,1))) -> 309 | O78: =IF(RC1="","",IF(OR(R8C<=ROUND(DAYS360(ValDat,RC1,0)/30,0),R8C>ROUND(DAYS360(ExpDat,RC1,0)/30,0)),0,OFFSET(R45C,MAX(-MNR,ROUND(DAYS360(ValDat,RC1,0)/30,0)-R8C+MEP-MNR),0,1,1))) -> -2257 | P78: =IF(RC1="","",IF(OR(R8C<=ROUND(DAYS360(ValDat,RC1,0)/30,0),R8C>ROUND(DAYS360(ExpDat,RC1,0)/30,0)),0,OFFSET(R45C,MAX(-MNR,ROUND(DAYS360(ValDat,RC1,0)/30,0)-R8C+MEP-MNR),0,1,1))) -> 0 | Q78: =IF(RC1="","",IF(OR(R8C<=ROUND(DAYS360(ValDat,RC1,0)/30,0),R8C>ROUND(DAYS360(ExpDat,RC1,0)/30,0)),0,OFFSET(R45C,MAX(-MNR,ROUND(DAYS360(ValDat,RC1,0)/30,0)-R8C+MEP-MNR),0,1,1))) -> 0 | R78: =IF(RC1="","",IF(OR(R8C<=ROUND(DAYS360(ValDat,RC1,0)/30,0),R8C>ROUND(DAYS360(ExpDat,RC1,0)/30,0)),0,OFFSET(R45C,MAX(-MNR,ROUND(DAYS360(ValDat,RC1,0)/30,0)-R8C+MEP-MNR),0,1,1))) -> 0 | S78: =IF(RC1="","",IF(OR(R8C<=ROUND(DAYS360(ValDat,RC1,0)/30,0),R8C>ROUND(DAYS360(ExpDat,RC1,0)/30,0)),0,OFFSET(R45C,MAX(-MNR,ROUND(DAYS360(ValDat,RC1,0)/30,0)-R8C+MEP-MNR),0,1,1))) -> 0 | T78: =IF(RC1="","",IF(OR(R8C<=ROUND(DAYS360(ValDat,RC1,0)/30,0),R8C>ROUND(DAYS360(ExpDat,RC1,0)/30,0)),0,OFFSET(R45C,MAX(-MNR,ROUND(DAYS360(ValDat,RC1,0)/30,0)-R8C+MEP-MNR),0,1,1))) -> 0 | U78: =IF(RC1="","",IF(OR(R8C<=ROUND(DAYS360(ValDat,RC1,0)/30,0),R8C>ROUND(DAYS360(ExpDat,RC1,0)/30,0)),0,OFFSET(R45C,MAX(-MNR,ROUND(DAYS360(ValDat,RC1,0)/30,0)-R8C+MEP-MNR),0,1,1))) -> 0 | V78: =IF(RC1="","",IF(OR(R8C<=ROUND(DAYS360(ValDat,RC1,0)/30,0),R8C>ROUND(DAYS360(ExpDat,RC1,0)/30,0)),0,OFFSET(R45C,MAX(-MNR,ROUND(DAYS360(ValDat,RC1,0)/30,0)-R8C+MEP-MNR),0,1,1))) -> 0 | W78: =IF(RC1="","",IF(OR(R8C<=ROUND(DAYS360(ValDat,RC1,0)/30,0),R8C>ROUND(DAYS360(ExpDat,RC1,0)/30,0)),0,OFFSET(R45C,MAX(-MNR,ROUND(DAYS360(ValDat,RC1,0)/30,0)-R8C+MEP-MNR),0,1,1))) -> 0 | X78: =IF(RC1="","",IF(OR(R8C<=ROUND(DAYS360(ValDat,RC1,0)/30,0),R8C>ROUND(DAYS360(ExpDat,RC1,0)/30,0)),0,OFFSET(R45C,MAX(-MNR,ROUND(DAYS360(ValDat,RC1,0)/30,0)-R8C+MEP-MNR),0,1,1))) -> 0 | Y78: =IF(RC1="","",IF(OR(R8C<=ROUND(DAYS360(ValDat,RC1,0)/30,0),R8C>ROUND(DAYS360(ExpDat,RC1,0)/30,0)),0,OFFSET(R45C,MAX(-MNR,ROUND(DAYS360(ValDat,RC1,0)/30,0)-R8C+MEP-MNR),0,1,1))) -> 0 | Z78: =IF(RC1="","",IF(OR(R8C<=ROUND(DAYS360(ValDat,RC1,0)/30,0),R8C>ROUND(DAYS360(ExpDat,RC1,0)/30,0)),0,OFFSET(R45C,MAX(-MNR,ROUND(DAYS360(ValDat,RC1,0)/30,0)-R8C+MEP-MNR),0,1,1))) -> 0 | AA78: =IF(RC1="","",IF(OR(R8C<=ROUND(DAYS360(ValDat,RC1,0)/30,0),R8C>ROUND(DAYS360(ExpDat,RC1,0)/30,0)),0,OFFSET(R45C,MAX(-MNR,ROUND(DAYS360(ValDat,RC1,0)/30,0)-R8C+MEP-MNR),0,1,1))) -> 0 | AB78: =IF(RC1="","",IF(OR(R8C<=ROUND(DAYS360(ValDat,RC1,0)/30,0),R8C>ROUND(DAYS360(ExpDat,RC1,0)/30,0)),0,OFFSET(R45C,MAX(-MNR,ROUND(DAYS360(ValDat,RC1,0)/30,0)-R8C+MEP-MNR),0,1,1))) -> 0 | AC78: =IF(RC1="","",IF(OR(R8C<=ROUND(DAYS360(ValDat,RC1,0)/30,0),R8C>ROUND(DAYS360(ExpDat,RC1,0)/30,0)),0,OFFSET(R45C,MAX(-MNR,ROUND(DAYS360(ValDat,RC1,0)/30,0)-R8C+MEP-MNR),0,1,1))) -> 0 | AD78: =IF(RC1="","",IF(OR(R8C<=ROUND(DAYS360(ValDat,RC1,0)/30,0),R8C>ROUND(DAYS360(ExpDat,RC1,0)/30,0)),0,OFFSET(R45C,MAX(-MNR,ROUND(DAYS360(ValDat,RC1,0)/30,0)-R8C+MEP-MNR),0,1,1))) -> 0 | AE78: =IF(RC1="","",IF(OR(R8C<=ROUND(DAYS360(ValDat,RC1,0)/30,0),R8C>ROUND(DAYS360(ExpDat,RC1,0)/30,0)),0,OFFSET(R45C,MAX(-MNR,ROUND(DAYS360(ValDat,RC1,0)/30,0)-R8C+MEP-MNR),0,1,1))) -> 0 | AF78: =IF(RC1="","",IF(OR(R8C<=ROUND(DAYS360(ValDat,RC1,0)/30,0),R8C>ROUND(DAYS360(ExpDat,RC1,0)/30,0)),0,OFFSET(R45C,MAX(-MNR,ROUND(DAYS360(ValDat,RC1,0)/30,0)-R8C+MEP-MNR),0,1,1))) -> 0 | AG78: =IF(RC1="","",IF(OR(R8C<=ROUND(DAYS360(ValDat,RC1,0)/30,0),R8C>ROUND(DAYS360(ExpDat,RC1,0)/30,0)),0,OFFSET(R45C,MAX(-MNR,ROUND(DAYS360(ValDat,RC1,0)/30,0)-R8C+MEP-MNR),0,1,1))) -> 0 | AH78: =IF(RC1="","",IF(OR(R8C<=ROUND(DAYS360(ValDat,RC1,0)/30,0),R8C>ROUND(DAYS360(ExpDat,RC1,0)/30,0)),0,OFFSET(R45C,MAX(-MNR,ROUND(DAYS360(ValDat,RC1,0)/30,0)-R8C+MEP-MNR),0,1,1))) -> 0 | AI78: =IF(RC1="","",IF(OR(R8C<=ROUND(DAYS360(ValDat,RC1,0)/30,0),R8C>ROUND(DAYS360(ExpDat,RC1,0)/30,0)),0,OFFSET(R45C,MAX(-MNR,ROUND(DAYS360(ValDat,RC1,0)/30,0)-R8C+MEP-MNR),0,1,1))) -> 0 | AJ78: =IF(RC1="","",IF(OR(R8C<=ROUND(DAYS360(ValDat,RC1,0)/30,0),R8C>ROUND(DAYS360(ExpDat,RC1,0)/30,0)),0,OFFSET(R45C,MAX(-MNR,ROUND(DAYS360(ValDat,RC1,0)/30,0)-R8C+MEP-MNR),0,1,1))) -> 0 | AK78: =IF(RC1="","",IF(OR(R8C<=ROUND(DAYS360(ValDat,RC1,0)/30,0),R8C>ROUND(DAYS360(ExpDat,RC1,0)/30,0)),0,OFFSET(R45C,MAX(-MNR,ROUND(DAYS360(ValDat,RC1,0)/30,0)-R8C+MEP-MNR),0,1,1))) -> 0 | AL78: =IF(RC1="","",IF(OR(R8C<=ROUND(DAYS360(ValDat,RC1,0)/30,0),R8C>ROUND(DAYS360(ExpDat,RC1,0)/30,0)),0,OFFSET(R45C,MAX(-MNR,ROUND(DAYS360(ValDat,RC1,0)/30,0)-R8C+MEP-MNR),0,1,1))) -> 0 | AM78: =IF(RC1="","",IF(OR(R8C<=ROUND(DAYS360(ValDat,RC1,0)/30,0),R8C>ROUND(DAYS360(ExpDat,RC1,0)/30,0)),0,OFFSET(R45C,MAX(-MNR,ROUND(DAYS360(ValDat,RC1,0)/30,0)-R8C+MEP-MNR),0,1,1))) -> 0 | AN78: =IF(RC1="","",IF(OR(R8C<=ROUND(DAYS360(ValDat,RC1,0)/30,0),R8C>ROUND(DAYS360(ExpDat,RC1,0)/30,0)),0,OFFSET(R45C,MAX(-MNR,ROUND(DAYS360(ValDat,RC1,0)/30,0)-R8C+MEP-MNR),0,1,1))) -> 0 | AO78: =IF(RC1="","",IF(OR(R8C<=ROUND(DAYS360(ValDat,RC1,0)/30,0),R8C>ROUND(DAYS360(ExpDat,RC1,0)/30,0)),0,OFFSET(R45C,MAX(-MNR,ROUND(DAYS360(ValDat,RC1,0)/30,0)-R8C+MEP-MNR),0,1,1))) -> 0
A79: =IF(R[-1]C="","",IF(EOMONTH(R[-1]C,0)+1>RunDat,"",EOMONTH(R[-1]C,0)+1)) -> 2000-05-01T00:00:00.000 | D79: =IF(RC1="","",SUM(RC[2]:RC[37])) -> 289221 | F79: =IF(RC1="","",IF(OR(R8C<=ROUND(DAYS360(ValDat,RC1,0)/30,0),R8C>ROUND(DAYS360(ExpDat,RC1,0)/30,0)),0,OFFSET(R45C,MAX(-MNR,ROUND(DAYS360(ValDat,RC1,0)/30,0)-R8C+MEP-MNR),0,1,1))) -> 33042 | G79: =IF(RC1="","",IF(OR(R8C<=ROUND(DAYS360(ValDat,RC1,0)/30,0),R8C>ROUND(DAYS360(ExpDat,RC1,0)/30,0)),0,OFFSET(R45C,MAX(-MNR,ROUND(DAYS360(ValDat,RC1,0)/30,0)-R8C+MEP-MNR),0,1,1))) -> 88812 | H79: =IF(RC1="","",IF(OR(R8C<=ROUND(DAYS360(ValDat,RC1,0)/30,0),R8C>ROUND(DAYS360(ExpDat,RC1,0)/30,0)),0,OFFSET(R45C,MAX(-MNR,ROUND(DAYS360(ValDat,RC1,0)/30,0)-R8C+MEP-MNR),0,1,1))) -> 149464 | I79: =IF(RC1="","",IF(OR(R8C<=ROUND(DAYS360(ValDat,RC1,0)/30,0),R8C>ROUND(DAYS360(ExpDat,RC1,0)/30,0)),0,OFFSET(R45C,MAX(-MNR,ROUND(DAYS360(ValDat,RC1,0)/30,0)-R8C+MEP-MNR),0,1,1))) -> 11758 | J79: =IF(RC1="","",IF(OR(R8C<=ROUND(DAYS360(ValDat,RC1,0)/30,0),R8C>ROUND(DAYS360(ExpDat,RC1,0)/30,0)),0,OFFSET(R45C,MAX(-MNR,ROUND(DAYS360(ValDat,RC1,0)/30,0)-R8C+MEP-MNR),0,1,1))) -> 1008 | K79: =IF(RC1="","",IF(OR(R8C<=ROUND(DAYS360(ValDat,RC1,0)/30,0),R8C>ROUND(DAYS360(ExpDat,RC1,0)/30,0)),0,OFFSET(R45C,MAX(-MNR,ROUND(DAYS360(ValDat,RC1,0)/30,0)-R8C+MEP-MNR),0,1,1))) -> 3851 | L79: =IF(RC1="","",IF(OR(R8C<=ROUND(DAYS360(ValDat,RC1,0)/30,0),R8C>ROUND(DAYS360(ExpDat,RC1,0)/30,0)),0,OFFSET(R45C,MAX(-MNR,ROUND(DAYS360(ValDat,RC1,0)/30,0)-R8C+MEP-MNR),0,1,1))) -> -7298 | M79: =IF(RC1="","",IF(OR(R8C<=ROUND(DAYS360(ValDat,RC1,0)/30,0),R8C>ROUND(DAYS360(ExpDat,RC1,0)/30,0)),0,OFFSET(R45C,MAX(-MNR,ROUND(DAYS360(ValDat,RC1,0)/30,0)-R8C+MEP-MNR),0,1,1))) -> 1423 | N79: =IF(RC1="","",IF(OR(R8C<=ROUND(DAYS360(ValDat,RC1,0)/30,0),R8C>ROUND(DAYS360(ExpDat,RC1,0)/30,0)),0,OFFSET(R45C,MAX(-MNR,ROUND(DAYS360(ValDat,RC1,0)/30,0)-R8C+MEP-MNR),0,1,1))) -> 3589 | O79: =IF(RC1="","",IF(OR(R8C<=ROUND(DAYS360(ValDat,RC1,0)/30,0),R8C>ROUND(DAYS360(ExpDat,RC1,0)/30,0)),0,OFFSET(R45C,MAX(-MNR,ROUND(DAYS360(ValDat,RC1,0)/30,0)-R8C+MEP-MNR),0,1,1))) -> 3572 | P79: =IF(RC1="","",IF(OR(R8C<=ROUND(DAYS360(ValDat,RC1,0)/30,0),R8C>ROUND(DAYS360(ExpDat,RC1,0)/30,0)),0,OFFSET(R45C,MAX(-MNR,ROUND(DAYS360(ValDat,RC1,0)/30,0)-R8C+MEP-MNR),0,1,1))) -> 0 | Q79: =IF(RC1="","",IF(OR(R8C<=ROUND(DAYS360(ValDat,RC1,0)/30,0),R8C>ROUND(DAYS360(ExpDat,RC1,0)/30,0)),0,OFFSET(R45C,MAX(-MNR,ROUND(DAYS360(ValDat,RC1,0)/30,0)-R8C+MEP-MNR),0,1,1))) -> 0 | R79: =IF(RC1="","",IF(OR(R8C<=ROUND(DAYS360(ValDat,RC1,0)/30,0),R8C>ROUND(DAYS360(ExpDat,RC1,0)/30,0)),0,OFFSET(R45C,MAX(-MNR,ROUND(DAYS360(ValDat,RC1,0)/30,0)-R8C+MEP-MNR),0,1,1))) -> 0 | S79: =IF(RC1="","",IF(OR(R8C<=ROUND(DAYS360(ValDat,RC1,0)/30,0),R8C>ROUND(DAYS360(ExpDat,RC1,0)/30,0)),0,OFFSET(R45C,MAX(-MNR,ROUND(DAYS360(ValDat,RC1,0)/30,0)-R8C+MEP-MNR),0,1,1))) -> 0 | T79: =IF(RC1="","",IF(OR(R8C<=ROUND(DAYS360(ValDat,RC1,0)/30,0),R8C>ROUND(DAYS360(ExpDat,RC1,0)/30,0)),0,OFFSET(R45C,MAX(-MNR,ROUND(DAYS360(ValDat,RC1,0)/30,0)-R8C+MEP-MNR),0,1,1))) -> 0 | U79: =IF(RC1="","",IF(OR(R8C<=ROUND(DAYS360(ValDat,RC1,0)/30,0),R8C>ROUND(DAYS360(ExpDat,RC1,0)/30,0)),0,OFFSET(R45C,MAX(-MNR,ROUND(DAYS360(ValDat,RC1,0)/30,0)-R8C+MEP-MNR),0,1,1))) -> 0 | V79: =IF(RC1="","",IF(OR(R8C<=ROUND(DAYS360(ValDat,RC1,0)/30,0),R8C>ROUND(DAYS360(ExpDat,RC1,0)/30,0)),0,OFFSET(R45C,MAX(-MNR,ROUND(DAYS360(ValDat,RC1,0)/30,0)-R8C+MEP-MNR),0,1,1))) -> 0 | W79: =IF(RC1="","",IF(OR(R8C<=ROUND(DAYS360(ValDat,RC1,0)/30,0),R8C>ROUND(DAYS360(ExpDat,RC1,0)/30,0)),0,OFFSET(R45C,MAX(-MNR,ROUND(DAYS360(ValDat,RC1,0)/30,0)-R8C+MEP-MNR),0,1,1))) -> 0 | X79: =IF(RC1="","",IF(OR(R8C<=ROUND(DAYS360(ValDat,RC1,0)/30,0),R8C>ROUND(DAYS360(ExpDat,RC1,0)/30,0)),0,OFFSET(R45C,MAX(-MNR,ROUND(DAYS360(ValDat,RC1,0)/30,0)-R8C+MEP-MNR),0,1,1))) -> 0 | Y79: =IF(RC1="","",IF(OR(R8C<=ROUND(DAYS360(ValDat,RC1,0)/30,0),R8C>ROUND(DAYS360(ExpDat,RC1,0)/30,0)),0,OFFSET(R45C,MAX(-MNR,ROUND(DAYS360(ValDat,RC1,0)/30,0)-R8C+MEP-MNR),0,1,1))) -> 0 | Z79: =IF(RC1="","",IF(OR(R8C<=ROUND(DAYS360(ValDat,RC1,0)/30,0),R8C>ROUND(DAYS360(ExpDat,RC1,0)/30,0)),0,OFFSET(R45C,MAX(-MNR,ROUND(DAYS360(ValDat,RC1,0)/30,0)-R8C+MEP-MNR),0,1,1))) -> 0 | AA79: =IF(RC1="","",IF(OR(R8C<=ROUND(DAYS360(ValDat,RC1,0)/30,0),R8C>ROUND(DAYS360(ExpDat,RC1,0)/30,0)),0,OFFSET(R45C,MAX(-MNR,ROUND(DAYS360(ValDat,RC1,0)/30,0)-R8C+MEP-MNR),0,1,1))) -> 0 | AB79: =IF(RC1="","",IF(OR(R8C<=ROUND(DAYS360(ValDat,RC1,0)/30,0),R8C>ROUND(DAYS360(ExpDat,RC1,0)/30,0)),0,OFFSET(R45C,MAX(-MNR,ROUND(DAYS360(ValDat,RC1,0)/30,0)-R8C+MEP-MNR),0,1,1))) -> 0 | AC79: =IF(RC1="","",IF(OR(R8C<=ROUND(DAYS360(ValDat,RC1,0)/30,0),R8C>ROUND(DAYS360(ExpDat,RC1,0)/30,0)),0,OFFSET(R45C,MAX(-MNR,ROUND(DAYS360(ValDat,RC1,0)/30,0)-R8C+MEP-MNR),0,1,1))) -> 0 | AD79: =IF(RC1="","",IF(OR(R8C<=ROUND(DAYS360(ValDat,RC1,0)/30,0),R8C>ROUND(DAYS360(ExpDat,RC1,0)/30,0)),0,OFFSET(R45C,MAX(-MNR,ROUND(DAYS360(ValDat,RC1,0)/30,0)-R8C+MEP-MNR),0,1,1))) -> 0 | AE79: =IF(RC1="","",IF(OR(R8C<=ROUND(DAYS360(ValDat,RC1,0)/30,0),R8C>ROUND(DAYS360(ExpDat,RC1,0)/30,0)),0,OFFSET(R45C,MAX(-MNR,ROUND(DAYS360(ValDat,RC1,0)/30,0)-R8C+MEP-MNR),0,1,1))) -> 0 | AF79: =IF(RC1="","",IF(OR(R8C<=ROUND(DAYS360(ValDat,RC1,0)/30,0),R8C>ROUND(DAYS360(ExpDat,RC1,0)/30,0)),0,OFFSET(R45C,MAX(-MNR,ROUND(DAYS360(ValDat,RC1,0)/30,0)-R8C+MEP-MNR),0,1,1))) -> 0 | AG79: =IF(RC1="","",IF(OR(R8C<=ROUND(DAYS360(ValDat,RC1,0)/30,0),R8C>ROUND(DAYS360(ExpDat,RC1,0)/30,0)),0,OFFSET(R45C,MAX(-MNR,ROUND(DAYS360(ValDat,RC1,0)/30,0)-R8C+MEP-MNR),0,1,1))) -> 0 | AH79: =IF(RC1="","",IF(OR(R8C<=ROUND(DAYS360(ValDat,RC1,0)/30,0),R8C>ROUND(DAYS360(ExpDat,RC1,0)/30,0)),0,OFFSET(R45C,MAX(-MNR,ROUND(DAYS360(ValDat,RC1,0)/30,0)-R8C+MEP-MNR),0,1,1))) -> 0 | AI79: =IF(RC1="","",IF(OR(R8C<=ROUND(DAYS360(ValDat,RC1,0)/30,0),R8C>ROUND(DAYS360(ExpDat,RC1,0)/30,0)),0,OFFSET(R45C,MAX(-MNR,ROUND(DAYS360(ValDat,RC1,0)/30,0)-R8C+MEP-MNR),0,1,1))) -> 0 | AJ79: =IF(RC1="","",IF(OR(R8C<=ROUND(DAYS360(ValDat,RC1,0)/30,0),R8C>ROUND(DAYS360(ExpDat,RC1,0)/30,0)),0,OFFSET(R45C,MAX(-MNR,ROUND(DAYS360(ValDat,RC1,0)/30,0)-R8C+MEP-MNR),0,1,1))) -> 0 | AK79: =IF(RC1="","",IF(OR(R8C<=ROUND(DAYS360(ValDat,RC1,0)/30,0),R8C>ROUND(DAYS360(ExpDat,RC1,0)/30,0)),0,OFFSET(R45C,MAX(-MNR,ROUND(DAYS360(ValDat,RC1,0)/30,0)-R8C+MEP-MNR),0,1,1))) -> 0 | AL79: =IF(RC1="","",IF(OR(R8C<=ROUND(DAYS360(ValDat,RC1,0)/30,0),R8C>ROUND(DAYS360(ExpDat,RC1,0)/30,0)),0,OFFSET(R45C,MAX(-MNR,ROUND(DAYS360(ValDat,RC1,0)/30,0)-R8C+MEP-MNR),0,1,1))) -> 0 | AM79: =IF(RC1="","",IF(OR(R8C<=ROUND(DAYS360(ValDat,RC1,0)/30,0),R8C>ROUND(DAYS360(ExpDat,RC1,0)/30,0)),0,OFFSET(R45C,MAX(-MNR,ROUND(DAYS360(ValDat,RC1,0)/30,0)-R8C+MEP-MNR),0,1,1))) -> 0 | AN79: =IF(RC1="","",IF(OR(R8C<=ROUND(DAYS360(ValDat,RC1,0)/30,0),R8C>ROUND(DAYS360(ExpDat,RC1,0)/30,0)),0,OFFSET(R45C,MAX(-MNR,ROUND(DAYS360(ValDat,RC1,0)/30,0)-R8C+MEP-MNR),0,1,1))) -> 0 | AO79: =IF(RC1="","",IF(OR(R8C<=ROUND(DAYS360(ValDat,RC1,0)/30,0),R8C>ROUND(DAYS360(ExpDat,RC1,0)/30,0)),0,OFFSET(R45C,MAX(-MNR,ROUND(DAYS360(ValDat,RC1,0)/30,0)-R8C+MEP-MNR),0,1,1))) -> 0
A80: =IF(R[-1]C="","",IF(EOMONTH(R[-1]C,0)+1>RunDat,"",EOMONTH(R[-1]C,0)+1)) -> 2000-06-01T00:00:00.000 | D80: =IF(RC1="","",SUM(RC[2]:RC[37])) -> 239050 | F80: =IF(RC1="","",IF(OR(R8C<=ROUND(DAYS360(ValDat,RC1,0)/30,0),R8C>ROUND(DAYS360(ExpDat,RC1,0)/30,0)),0,OFFSET(R45C,MAX(-MNR,ROUND(DAYS360(ValDat,RC1,0)/30,0)-R8C+MEP-MNR),0,1,1))) -> 9146 | G80: =IF(RC1="","",IF(OR(R8C<=ROUND(DAYS360(ValDat,RC1,0)/30,0),R8C>ROUND(DAYS360(ExpDat,RC1,0)/30,0)),0,OFFSET(R45C,MAX(-MNR,ROUND(DAYS360(ValDat,RC1,0)/30,0)-R8C+MEP-MNR),0,1,1))) -> 115076 | H80: =IF(RC1="","",IF(OR(R8C<=ROUND(DAYS360(ValDat,RC1,0)/30,0),R8C>ROUND(DAYS360(ExpDat,RC1,0)/30,0)),0,OFFSET(R45C,MAX(-MNR,ROUND(DAYS360(ValDat,RC1,0)/30,0)-R8C+MEP-MNR),0,1,1))) -> 73915 | I80: =IF(RC1="","",IF(OR(R8C<=ROUND(DAYS360(ValDat,RC1,0)/30,0),R8C>ROUND(DAYS360(ExpDat,RC1,0)/30,0)),0,OFFSET(R45C,MAX(-MNR,ROUND(DAYS360(ValDat,RC1,0)/30,0)-R8C+MEP-MNR),0,1,1))) -> 8997 | J80: =IF(RC1="","",IF(OR(R8C<=ROUND(DAYS360(ValDat,RC1,0)/30,0),R8C>ROUND(DAYS360(ExpDat,RC1,0)/30,0)),0,OFFSET(R45C,MAX(-MNR,ROUND(DAYS360(ValDat,RC1,0)/30,0)-R8C+MEP-MNR),0,1,1))) -> 26014 | K80: =IF(RC1="","",IF(OR(R8C<=ROUND(DAYS360(ValDat,RC1,0)/30,0),R8C>ROUND(DAYS360(ExpDat,RC1,0)/30,0)),0,OFFSET(R45C,MAX(-MNR,ROUND(DAYS360(ValDat,RC1,0)/30,0)-R8C+MEP-MNR),0,1,1))) -> 3609 | L80: =IF(RC1="","",IF(OR(R8C<=ROUND(DAYS360(ValDat,RC1,0)/30,0),R8C>ROUND(DAYS360(ExpDat,RC1,0)/30,0)),0,OFFSET(R45C,MAX(-MNR,ROUND(DAYS360(ValDat,RC1,0)/30,0)-R8C+MEP-MNR),0,1,1))) -> 655 | M80: =IF(RC1="","",IF(OR(R8C<=ROUND(DAYS360(ValDat,RC1,0)/30,0),R8C>ROUND(DAYS360(ExpDat,RC1,0)/30,0)),0,OFFSET(R45C,MAX(-MNR,ROUND(DAYS360(ValDat,RC1,0)/30,0)-R8C+MEP-MNR),0,1,1))) -> 949 | N80: =IF(RC1="","",IF(OR(R8C<=ROUND(DAYS360(ValDat,RC1,0)/30,0),R8C>ROUND(DAYS360(ExpDat,RC1,0)/30,0)),0,OFFSET(R45C,MAX(-MNR,ROUND(DAYS360(ValDat,RC1,0)/30,0)-R8C+MEP-MNR),0,1,1))) -> 384 | O80: =IF(RC1="","",IF(OR(R8C<=ROUND(DAYS360(ValDat,RC1,0)/30,0),R8C>ROUND(DAYS360(ExpDat,RC1,0)/30,0)),0,OFFSET(R45C,MAX(-MNR,ROUND(DAYS360(ValDat,RC1,0)/30,0)-R8C+MEP-MNR),0,1,1))) -> 292 | P80: =IF(RC1="","",IF(OR(R8C<=ROUND(DAYS360(ValDat,RC1,0)/30,0),R8C>ROUND(DAYS360(ExpDat,RC1,0)/30,0)),0,OFFSET(R45C,MAX(-MNR,ROUND(DAYS360(ValDat,RC1,0)/30,0)-R8C+MEP-MNR),0,1,1))) -> 13 | Q80: =IF(RC1="","",IF(OR(R8C<=ROUND(DAYS360(ValDat,RC1,0)/30,0),R8C>ROUND(DAYS360(ExpDat,RC1,0)/30,0)),0,OFFSET(R45C,MAX(-MNR,ROUND(DAYS360(ValDat,RC1,0)/30,0)-R8C+MEP-MNR),0,1,1))) -> 0 | R80: =IF(RC1="","",IF(OR(R8C<=ROUND(DAYS360(ValDat,RC1,0)/30,0),R8C>ROUND(DAYS360(ExpDat,RC1,0)/30,0)),0,OFFSET(R45C,MAX(-MNR,ROUND(DAYS360(ValDat,RC1,0)/30,0)-R8C+MEP-MNR),0,1,1))) -> 0 | S80: =IF(RC1="","",IF(OR(R8C<=ROUND(DAYS360(ValDat,RC1,0)/30,0),R8C>ROUND(DAYS360(ExpDat,RC1,0)/30,0)),0,OFFSET(R45C,MAX(-MNR,ROUND(DAYS360(ValDat,RC1,0)/30,0)-R8C+MEP-MNR),0,1,1))) -> 0 | T80: =IF(RC1="","",IF(OR(R8C<=ROUND(DAYS360(ValDat,RC1,0)/30,0),R8C>ROUND(DAYS360(ExpDat,RC1,0)/30,0)),0,OFFSET(R45C,MAX(-MNR,ROUND(DAYS360(ValDat,RC1,0)/30,0)-R8C+MEP-MNR),0,1,1))) -> 0 | U80: =IF(RC1="","",IF(OR(R8C<=ROUND(DAYS360(ValDat,RC1,0)/30,0),R8C>ROUND(DAYS360(ExpDat,RC1,0)/30,0)),0,OFFSET(R45C,MAX(-MNR,ROUND(DAYS360(ValDat,RC1,0)/30,0)-R8C+MEP-MNR),0,1,1))) -> 0 | V80: =IF(RC1="","",IF(OR(R8C<=ROUND(DAYS360(ValDat,RC1,0)/30,0),R8C>ROUND(DAYS360(ExpDat,RC1,0)/30,0)),0,OFFSET(R45C,MAX(-MNR,ROUND(DAYS360(ValDat,RC1,0)/30,0)-R8C+MEP-MNR),0,1,1))) -> 0 | W80: =IF(RC1="","",IF(OR(R8C<=ROUND(DAYS360(ValDat,RC1,0)/30,0),R8C>ROUND(DAYS360(ExpDat,RC1,0)/30,0)),0,OFFSET(R45C,MAX(-MNR,ROUND(DAYS360(ValDat,RC1,0)/30,0)-R8C+MEP-MNR),0,1,1))) -> 0 | X80: =IF(RC1="","",IF(OR(R8C<=ROUND(DAYS360(ValDat,RC1,0)/30,0),R8C>ROUND(DAYS360(ExpDat,RC1,0)/30,0)),0,OFFSET(R45C,MAX(-MNR,ROUND(DAYS360(ValDat,RC1,0)/30,0)-R8C+MEP-MNR),0,1,1))) -> 0 | Y80: =IF(RC1="","",IF(OR(R8C<=ROUND(DAYS360(ValDat,RC1,0)/30,0),R8C>ROUND(DAYS360(ExpDat,RC1,0)/30,0)),0,OFFSET(R45C,MAX(-MNR,ROUND(DAYS360(ValDat,RC1,0)/30,0)-R8C+MEP-MNR),0,1,1))) -> 0 | Z80: =IF(RC1="","",IF(OR(R8C<=ROUND(DAYS360(ValDat,RC1,0)/30,0),R8C>ROUND(DAYS360(ExpDat,RC1,0)/30,0)),0,OFFSET(R45C,MAX(-MNR,ROUND(DAYS360(ValDat,RC1,0)/30,0)-R8C+MEP-MNR),0,1,1))) -> 0 | AA80: =IF(RC1="","",IF(OR(R8C<=ROUND(DAYS360(ValDat,RC1,0)/30,0),R8C>ROUND(DAYS360(ExpDat,RC1,0)/30,0)),0,OFFSET(R45C,MAX(-MNR,ROUND(DAYS360(ValDat,RC1,0)/30,0)-R8C+MEP-MNR),0,1,1))) -> 0 | AB80: =IF(RC1="","",IF(OR(R8C<=ROUND(DAYS360(ValDat,RC1,0)/30,0),R8C>ROUND(DAYS360(ExpDat,RC1,0)/30,0)),0,OFFSET(R45C,MAX(-MNR,ROUND(DAYS360(ValDat,RC1,0)/30,0)-R8C+MEP-MNR),0,1,1))) -> 0 | AC80: =IF(RC1="","",IF(OR(R8C<=ROUND(DAYS360(ValDat,RC1,0)/30,0),R8C>ROUND(DAYS360(ExpDat,RC1,0)/30,0)),0,OFFSET(R45C,MAX(-MNR,ROUND(DAYS360(ValDat,RC1,0)/30,0)-R8C+MEP-MNR),0,1,1))) -> 0 | AD80: =IF(RC1="","",IF(OR(R8C<=ROUND(DAYS360(ValDat,RC1,0)/30,0),R8C>ROUND(DAYS360(ExpDat,RC1,0)/30,0)),0,OFFSET(R45C,MAX(-MNR,ROUND(DAYS360(ValDat,RC1,0)/30,0)-R8C+MEP-MNR),0,1,1))) -> 0 | AE80: =IF(RC1="","",IF(OR(R8C<=ROUND(DAYS360(ValDat,RC1,0)/30,0),R8C>ROUND(DAYS360(ExpDat,RC1,0)/30,0)),0,OFFSET(R45C,MAX(-MNR,ROUND(DAYS360(ValDat,RC1,0)/30,0)-R8C+MEP-MNR),0,1,1))) -> 0 | AF80: =IF(RC1="","",IF(OR(R8C<=ROUND(DAYS360(ValDat,RC1,0)/30,0),R8C>ROUND(DAYS360(ExpDat,RC1,0)/30,0)),0,OFFSET(R45C,MAX(-MNR,ROUND(DAYS360(ValDat,RC1,0)/30,0)-R8C+MEP-MNR),0,1,1))) -> 0 | AG80: =IF(RC1="","",IF(OR(R8C<=ROUND(DAYS360(ValDat,RC1,0)/30,0),R8C>ROUND(DAYS360(ExpDat,RC1,0)/30,0)),0,OFFSET(R45C,MAX(-MNR,ROUND(DAYS360(ValDat,RC1,0)/30,0)-R8C+MEP-MNR),0,1,1))) -> 0 | AH80: =IF(RC1="","",IF(OR(R8C<=ROUND(DAYS360(ValDat,RC1,0)/30,0),R8C>ROUND(DAYS360(ExpDat,RC1,0)/30,0)),0,OFFSET(R45C,MAX(-MNR,ROUND(DAYS360(ValDat,RC1,0)/30,0)-R8C+MEP-MNR),0,1,1))) -> 0 | AI80: =IF(RC1="","",IF(OR(R8C<=ROUND(DAYS360(ValDat,RC1,0)/30,0),R8C>ROUND(DAYS360(ExpDat,RC1,0)/30,0)),0,OFFSET(R45C,MAX(-MNR,ROUND(DAYS360(ValDat,RC1,0)/30,0)-R8C+MEP-MNR),0,1,1))) -> 0 | AJ80: =IF(RC1="","",IF(OR(R8C<=ROUND(DAYS360(ValDat,RC1,0)/30,0),R8C>ROUND(DAYS360(ExpDat,RC1,0)/30,0)),0,OFFSET(R45C,MAX(-MNR,ROUND(DAYS360(ValDat,RC1,0)/30,0)-R8C+MEP-MNR),0,1,1))) -> 0 | AK80: =IF(RC1="","",IF(OR(R8C<=ROUND(DAYS360(ValDat,RC1,0)/30,0),R8C>ROUND(DAYS360(ExpDat,RC1,0)/30,0)),0,OFFSET(R45C,MAX(-MNR,ROUND(DAYS360(ValDat,RC1,0)/30,0)-R8C+MEP-MNR),0,1,1))) -> 0 | AL80: =IF(RC1="","",IF(OR(R8C<=ROUND(DAYS360(ValDat,RC1,0)/30,0),R8C>ROUND(DAYS360(ExpDat,RC1,0)/30,0)),0,OFFSET(R45C,MAX(-MNR,ROUND(DAYS360(ValDat,RC1,0)/30,0)-R8C+MEP-MNR),0,1,1))) -> 0 | AM80: =IF(RC1="","",IF(OR(R8C<=ROUND(DAYS360(ValDat,RC1,0)/30,0),R8C>ROUND(DAYS360(ExpDat,RC1,0)/30,0)),0,OFFSET(R45C,MAX(-MNR,ROUND(DAYS360(ValDat,RC1,0)/30,0)-R8C+MEP-MNR),0,1,1))) -> 0 | AN80: =IF(RC1="","",IF(OR(R8C<=ROUND(DAYS360(ValDat,RC1,0)/30,0),R8C>ROUND(DAYS360(ExpDat,RC1,0)/30,0)),0,OFFSET(R45C,MAX(-MNR,ROUND(DAYS360(ValDat,RC1,0)/30,0)-R8C+MEP-MNR),0,1,1))) -> 0 | AO80: =IF(RC1="","",IF(OR(R8C<=ROUND(DAYS360(ValDat,RC1,0)/30,0),R8C>ROUND(DAYS360(ExpDat,RC1,0)/30,0)),0,OFFSET(R45C,MAX(-MNR,ROUND(DAYS360(ValDat,RC1,0)/30,0)-R8C+MEP-MNR),0,1,1))) -> 0
A81: =IF(R[-1]C="","",IF(EOMONTH(R[-1]C,0)+1>RunDat,"",EOMONTH(R[-1]C,0)+1)) -> 2000-07-01T00:00:00.000 | D81: =IF(RC1="","",SUM(RC[2]:RC[37])) -> 276239 | F81: =IF(RC1="","",IF(OR(R8C<=ROUND(DAYS360(ValDat,RC1,0)/30,0),R8C>ROUND(DAYS360(ExpDat,RC1,0)/30,0)),0,OFFSET(R45C,MAX(-MNR,ROUND(DAYS360(ValDat,RC1,0)/30,0)-R8C+MEP-MNR),0,1,1))) -> 95821 | G81: =IF(RC1="","",IF(OR(R8C<=ROUND(DAYS360(ValDat,RC1,0)/30,0),R8C>ROUND(DAYS360(ExpDat,RC1,0)/30,0)),0,OFFSET(R45C,MAX(-MNR,ROUND(DAYS360(ValDat,RC1,0)/30,0)-R8C+MEP-MNR),0,1,1))) -> 126060 | H81: =IF(RC1="","",IF(OR(R8C<=ROUND(DAYS360(ValDat,RC1,0)/30,0),R8C>ROUND(DAYS360(ExpDat,RC1,0)/30,0)),0,OFFSET(R45C,MAX(-MNR,ROUND(DAYS360(ValDat,RC1,0)/30,0)-R8C+MEP-MNR),0,1,1))) -> 22022 | I81: =IF(RC1="","",IF(OR(R8C<=ROUND(DAYS360(ValDat,RC1,0)/30,0),R8C>ROUND(DAYS360(ExpDat,RC1,0)/30,0)),0,OFFSET(R45C,MAX(-MNR,ROUND(DAYS360(ValDat,RC1,0)/30,0)-R8C+MEP-MNR),0,1,1))) -> 6913 | J81: =IF(RC1="","",IF(OR(R8C<=ROUND(DAYS360(ValDat,RC1,0)/30,0),R8C>ROUND(DAYS360(ExpDat,RC1,0)/30,0)),0,OFFSET(R45C,MAX(-MNR,ROUND(DAYS360(ValDat,RC1,0)/30,0)-R8C+MEP-MNR),0,1,1))) -> 19057 | K81: =IF(RC1="","",IF(OR(R8C<=ROUND(DAYS360(ValDat,RC1,0)/30,0),R8C>ROUND(DAYS360(ExpDat,RC1,0)/30,0)),0,OFFSET(R45C,MAX(-MNR,ROUND(DAYS360(ValDat,RC1,0)/30,0)-R8C+MEP-MNR),0,1,1))) -> 2620 | L81: =IF(RC1="","",IF(OR(R8C<=ROUND(DAYS360(ValDat,RC1,0)/30,0),R8C>ROUND(DAYS360(ExpDat,RC1,0)/30,0)),0,OFFSET(R45C,MAX(-MNR,ROUND(DAYS360(ValDat,RC1,0)/30,0)-R8C+MEP-MNR),0,1,1))) -> 703 | M81: =IF(RC1="","",IF(OR(R8C<=ROUND(DAYS360(ValDat,RC1,0)/30,0),R8C>ROUND(DAYS360(ExpDat,RC1,0)/30,0)),0,OFFSET(R45C,MAX(-MNR,ROUND(DAYS360(ValDat,RC1,0)/30,0)-R8C+MEP-MNR),0,1,1))) -> 828 | N81: =IF(RC1="","",IF(OR(R8C<=ROUND(DAYS360(ValDat,RC1,0)/30,0),R8C>ROUND(DAYS360(ExpDat,RC1,0)/30,0)),0,OFFSET(R45C,MAX(-MNR,ROUND(DAYS360(ValDat,RC1,0)/30,0)-R8C+MEP-MNR),0,1,1))) -> 492 | O81: =IF(RC1="","",IF(OR(R8C<=ROUND(DAYS360(ValDat,RC1,0)/30,0),R8C>ROUND(DAYS360(ExpDat,RC1,0)/30,0)),0,OFFSET(R45C,MAX(-MNR,ROUND(DAYS360(ValDat,RC1,0)/30,0)-R8C+MEP-MNR),0,1,1))) -> 278 | P81: =IF(RC1="","",IF(OR(R8C<=ROUND(DAYS360(ValDat,RC1,0)/30,0),R8C>ROUND(DAYS360(ExpDat,RC1,0)/30,0)),0,OFFSET(R45C,MAX(-MNR,ROUND(DAYS360(ValDat,RC1,0)/30,0)-R8C+MEP-MNR),0,1,1))) -> 13 | Q81: =IF(RC1="","",IF(OR(R8C<=ROUND(DAYS360(ValDat,RC1,0)/30,0),R8C>ROUND(DAYS360(ExpDat,RC1,0)/30,0)),0,OFFSET(R45C,MAX(-MNR,ROUND(DAYS360(ValDat,RC1,0)/30,0)-R8C+MEP-MNR),0,1,1))) -> 1432 | R81: =IF(RC1="","",IF(OR(R8C<=ROUND(DAYS360(ValDat,RC1,0)/30,0),R8C>ROUND(DAYS360(ExpDat,RC1,0)/30,0)),0,OFFSET(R45C,MAX(-MNR,ROUND(DAYS360(ValDat,RC1,0)/30,0)-R8C+MEP-MNR),0,1,1))) -> 0 | S81: =IF(RC1="","",IF(OR(R8C<=ROUND(DAYS360(ValDat,RC1,0)/30,0),R8C>ROUND(DAYS360(ExpDat,RC1,0)/30,0)),0,OFFSET(R45C,MAX(-MNR,ROUND(DAYS360(ValDat,RC1,0)/30,0)-R8C+MEP-MNR),0,1,1))) -> 0 | T81: =IF(RC1="","",IF(OR(R8C<=ROUND(DAYS360(ValDat,RC1,0)/30,0),R8C>ROUND(DAYS360(ExpDat,RC1,0)/30,0)),0,OFFSET(R45C,MAX(-MNR,ROUND(DAYS360(ValDat,RC1,0)/30,0)-R8C+MEP-MNR),0,1,1))) -> 0 | U81: =IF(RC1="","",IF(OR(R8C<=ROUND(DAYS360(ValDat,RC1,0)/30,0),R8C>ROUND(DAYS360(ExpDat,RC1,0)/30,0)),0,OFFSET(R45C,MAX(-MNR,ROUND(DAYS360(ValDat,RC1,0)/30,0)-R8C+MEP-MNR),0,1,1))) -> 0 | V81: =IF(RC1="","",IF(OR(R8C<=ROUND(DAYS360(ValDat,RC1,0)/30,0),R8C>ROUND(DAYS360(ExpDat,RC1,0)/30,0)),0,OFFSET(R45C,MAX(-MNR,ROUND(DAYS360(ValDat,RC1,0)/30,0)-R8C+MEP-MNR),0,1,1))) -> 0 | W81: =IF(RC1="","",IF(OR(R8C<=ROUND(DAYS360(ValDat,RC1,0)/30,0),R8C>ROUND(DAYS360(ExpDat,RC1,0)/30,0)),0,OFFSET(R45C,MAX(-MNR,ROUND(DAYS360(ValDat,RC1,0)/30,0)-R8C+MEP-MNR),0,1,1))) -> 0 | X81: =IF(RC1="","",IF(OR(R8C<=ROUND(DAYS360(ValDat,RC1,0)/30,0),R8C>ROUND(DAYS360(ExpDat,RC1,0)/30,0)),0,OFFSET(R45C,MAX(-MNR,ROUND(DAYS360(ValDat,RC1,0)/30,0)-R8C+MEP-MNR),0,1,1))) -> 0 | Y81: =IF(RC1="","",IF(OR(R8C<=ROUND(DAYS360(ValDat,RC1,0)/30,0),R8C>ROUND(DAYS360(ExpDat,RC1,0)/30,0)),0,OFFSET(R45C,MAX(-MNR,ROUND(DAYS360(ValDat,RC1,0)/30,0)-R8C+MEP-MNR),0,1,1))) -> 0 | Z81: =IF(RC1="","",IF(OR(R8C<=ROUND(DAYS360(ValDat,RC1,0)/30,0),R8C>ROUND(DAYS360(ExpDat,RC1,0)/30,0)),0,OFFSET(R45C,MAX(-MNR,ROUND(DAYS360(ValDat,RC1,0)/30,0)-R8C+MEP-MNR),0,1,1))) -> 0 | AA81: =IF(RC1="","",IF(OR(R8C<=ROUND(DAYS360(ValDat,RC1,0)/30,0),R8C>ROUND(DAYS360(ExpDat,RC1,0)/30,0)),0,OFFSET(R45C,MAX(-MNR,ROUND(DAYS360(ValDat,RC1,0)/30,0)-R8C+MEP-MNR),0,1,1))) -> 0 | AB81: =IF(RC1="","",IF(OR(R8C<=ROUND(DAYS360(ValDat,RC1,0)/30,0),R8C>ROUND(DAYS360(ExpDat,RC1,0)/30,0)),0,OFFSET(R45C,MAX(-MNR,ROUND(DAYS360(ValDat,RC1,0)/30,0)-R8C+MEP-MNR),0,1,1))) -> 0 | AC81: =IF(RC1="","",IF(OR(R8C<=ROUND(DAYS360(ValDat,RC1,0)/30,0),R8C>ROUND(DAYS360(ExpDat,RC1,0)/30,0)),0,OFFSET(R45C,MAX(-MNR,ROUND(DAYS360(ValDat,RC1,0)/30,0)-R8C+MEP-MNR),0,1,1))) -> 0 | AD81: =IF(RC1="","",IF(OR(R8C<=ROUND(DAYS360(ValDat,RC1,0)/30,0),R8C>ROUND(DAYS360(ExpDat,RC1,0)/30,0)),0,OFFSET(R45C,MAX(-MNR,ROUND(DAYS360(ValDat,RC1,0)/30,0)-R8C+MEP-MNR),0,1,1))) -> 0 | AE81: =IF(RC1="","",IF(OR(R8C<=ROUND(DAYS360(ValDat,RC1,0)/30,0),R8C>ROUND(DAYS360(ExpDat,RC1,0)/30,0)),0,OFFSET(R45C,MAX(-MNR,ROUND(DAYS360(ValDat,RC1,0)/30,0)-R8C+MEP-MNR),0,1,1))) -> 0 | AF81: =IF(RC1="","",IF(OR(R8C<=ROUND(DAYS360(ValDat,RC1,0)/30,0),R8C>ROUND(DAYS360(ExpDat,RC1,0)/30,0)),0,OFFSET(R45C,MAX(-MNR,ROUND(DAYS360(ValDat,RC1,0)/30,0)-R8C+MEP-MNR),0,1,1))) -> 0 | AG81: =IF(RC1="","",IF(OR(R8C<=ROUND(DAYS360(ValDat,RC1,0)/30,0),R8C>ROUND(DAYS360(ExpDat,RC1,0)/30,0)),0,OFFSET(R45C,MAX(-MNR,ROUND(DAYS360(ValDat,RC1,0)/30,0)-R8C+MEP-MNR),0,1,1))) -> 0 | AH81: =IF(RC1="","",IF(OR(R8C<=ROUND(DAYS360(ValDat,RC1,0)/30,0),R8C>ROUND(DAYS360(ExpDat,RC1,0)/30,0)),0,OFFSET(R45C,MAX(-MNR,ROUND(DAYS360(ValDat,RC1,0)/30,0)-R8C+MEP-MNR),0,1,1))) -> 0 | AI81: =IF(RC1="","",IF(OR(R8C<=ROUND(DAYS360(ValDat,RC1,0)/30,0),R8C>ROUND(DAYS360(ExpDat,RC1,0)/30,0)),0,OFFSET(R45C,MAX(-MNR,ROUND(DAYS360(ValDat,RC1,0)/30,0)-R8C+MEP-MNR),0,1,1))) -> 0 | AJ81: =IF(RC1="","",IF(OR(R8C<=ROUND(DAYS360(ValDat,RC1,0)/30,0),R8C>ROUND(DAYS360(ExpDat,RC1,0)/30,0)),0,OFFSET(R45C,MAX(-MNR,ROUND(DAYS360(ValDat,RC1,0)/30,0)-R8C+MEP-MNR),0,1,1))) -> 0 | AK81: =IF(RC1="","",IF(OR(R8C<=ROUND(DAYS360(ValDat,RC1,0)/30,0),R8C>ROUND(DAYS360(ExpDat,RC1,0)/30,0)),0,OFFSET(R45C,MAX(-MNR,ROUND(DAYS360(ValDat,RC1,0)/30,0)-R8C+MEP-MNR),0,1,1))) -> 0 | AL81: =IF(RC1="","",IF(OR(R8C<=ROUND(DAYS360(ValDat,RC1,0)/30,0),R8C>ROUND(DAYS360(ExpDat,RC1,0)/30,0)),0,OFFSET(R45C,MAX(-MNR,ROUND(DAYS360(ValDat,RC1,0)/30,0)-R8C+MEP-MNR),0,1,1))) -> 0 | AM81: =IF(RC1="","",IF(OR(R8C<=ROUND(DAYS360(ValDat,RC1,0)/30,0),R8C>ROUND(DAYS360(ExpDat,RC1,0)/30,0)),0,OFFSET(R45C,MAX(-MNR,ROUND(DAYS360(ValDat,RC1,0)/30,0)-R8C+MEP-MNR),0,1,1))) -> 0 | AN81: =IF(RC1="","",IF(OR(R8C<=ROUND(DAYS360(ValDat,RC1,0)/30,0),R8C>ROUND(DAYS360(ExpDat,RC1,0)/30,0)),0,OFFSET(R45C,MAX(-MNR,ROUND(DAYS360(ValDat,RC1,0)/30,0)-R8C+MEP-MNR),0,1,1))) -> 0 | AO81: =IF(RC1="","",IF(OR(R8C<=ROUND(DAYS360(ValDat,RC1,0)/30,0),R8C>ROUND(DAYS360(ExpDat,RC1,0)/30,0)),0,OFFSET(R45C,MAX(-MNR,ROUND(DAYS360(ValDat,RC1,0)/30,0)-R8C+MEP-MNR),0,1,1))) -> 0
A82: =IF(R[-1]C="","",IF(EOMONTH(R[-1]C,0)+1>RunDat,"",EOMONTH(R[-1]C,0)+1)) -> 2000-08-01T00:00:00.000 | D82: =IF(RC1="","",SUM(RC[2]:RC[37])) -> 303902 | F82: =IF(RC1="","",IF(OR(R8C<=ROUND(DAYS360(ValDat,RC1,0)/30,0),R8C>ROUND(DAYS360(ExpDat,RC1,0)/30,0)),0,OFFSET(R45C,MAX(-MNR,ROUND(DAYS360(ValDat,RC1,0)/30,0)-R8C+MEP-MNR),0,1,1))) -> 9415 | G82: =IF(RC1="","",IF(OR(R8C<=ROUND(DAYS360(ValDat,RC1,0)/30,0),R8C>ROUND(DAYS360(ExpDat,RC1,0)/30,0)),0,OFFSET(R45C,MAX(-MNR,ROUND(DAYS360(ValDat,RC1,0)/30,0)-R8C+MEP-MNR),0,1,1))) -> 139851 | H82: =IF(RC1="","",IF(OR(R8C<=ROUND(DAYS360(ValDat,RC1,0)/30,0),R8C>ROUND(DAYS360(ExpDat,RC1,0)/30,0)),0,OFFSET(R45C,MAX(-MNR,ROUND(DAYS360(ValDat,RC1,0)/30,0)-R8C+MEP-MNR),0,1,1))) -> 101785 | I82: =IF(RC1="","",IF(OR(R8C<=ROUND(DAYS360(ValDat,RC1,0)/30,0),R8C>ROUND(DAYS360(ExpDat,RC1,0)/30,0)),0,OFFSET(R45C,MAX(-MNR,ROUND(DAYS360(ValDat,RC1,0)/30,0)-R8C+MEP-MNR),0,1,1))) -> 7991 | J82: =IF(RC1="","",IF(OR(R8C<=ROUND(DAYS360(ValDat,RC1,0)/30,0),R8C>ROUND(DAYS360(ExpDat,RC1,0)/30,0)),0,OFFSET(R45C,MAX(-MNR,ROUND(DAYS360(ValDat,RC1,0)/30,0)-R8C+MEP-MNR),0,1,1))) -> 10480 | K82: =IF(RC1="","",IF(OR(R8C<=ROUND(DAYS360(ValDat,RC1,0)/30,0),R8C>ROUND(DAYS360(ExpDat,RC1,0)/30,0)),0,OFFSET(R45C,MAX(-MNR,ROUND(DAYS360(ValDat,RC1,0)/30,0)-R8C+MEP-MNR),0,1,1))) -> 2477 | L82: =IF(RC1="","",IF(OR(R8C<=ROUND(DAYS360(ValDat,RC1,0)/30,0),R8C>ROUND(DAYS360(ExpDat,RC1,0)/30,0)),0,OFFSET(R45C,MAX(-MNR,ROUND(DAYS360(ValDat,RC1,0)/30,0)-R8C+MEP-MNR),0,1,1))) -> 22338 | M82: =IF(RC1="","",IF(OR(R8C<=ROUND(DAYS360(ValDat,RC1,0)/30,0),R8C>ROUND(DAYS360(ExpDat,RC1,0)/30,0)),0,OFFSET(R45C,MAX(-MNR,ROUND(DAYS360(ValDat,RC1,0)/30,0)-R8C+MEP-MNR),0,1,1))) -> 732 | N82: =IF(RC1="","",IF(OR(R8C<=ROUND(DAYS360(ValDat,RC1,0)/30,0),R8C>ROUND(DAYS360(ExpDat,RC1,0)/30,0)),0,OFFSET(R45C,MAX(-MNR,ROUND(DAYS360(ValDat,RC1,0)/30,0)-R8C+MEP-MNR),0,1,1))) -> 203 | O82: =IF(RC1="","",IF(OR(R8C<=ROUND(DAYS360(ValDat,RC1,0)/30,0),R8C>ROUND(DAYS360(ExpDat,RC1,0)/30,0)),0,OFFSET(R45C,MAX(-MNR,ROUND(DAYS360(ValDat,RC1,0)/30,0)-R8C+MEP-MNR),0,1,1))) -> 213 | P82: =IF(RC1="","",IF(OR(R8C<=ROUND(DAYS360(ValDat,RC1,0)/30,0),R8C>ROUND(DAYS360(ExpDat,RC1,0)/30,0)),0,OFFSET(R45C,MAX(-MNR,ROUND(DAYS360(ValDat,RC1,0)/30,0)-R8C+MEP-MNR),0,1,1))) -> 6985 | Q82: =IF(RC1="","",IF(OR(R8C<=ROUND(DAYS360(ValDat,RC1,0)/30,0),R8C>ROUND(DAYS360(ExpDat,RC1,0)/30,0)),0,OFFSET(R45C,MAX(-MNR,ROUND(DAYS360(ValDat,RC1,0)/30,0)-R8C+MEP-MNR),0,1,1))) -> 1432 | R82: =IF(RC1="","",IF(OR(R8C<=ROUND(DAYS360(ValDat,RC1,0)/30,0),R8C>ROUND(DAYS360(ExpDat,RC1,0)/30,0)),0,OFFSET(R45C,MAX(-MNR,ROUND(DAYS360(ValDat,RC1,0)/30,0)-R8C+MEP-MNR),0,1,1))) -> 0 | S82: =IF(RC1="","",IF(OR(R8C<=ROUND(DAYS360(ValDat,RC1,0)/30,0),R8C>ROUND(DAYS360(ExpDat,RC1,0)/30,0)),0,OFFSET(R45C,MAX(-MNR,ROUND(DAYS360(ValDat,RC1,0)/30,0)-R8C+MEP-MNR),0,1,1))) -> 0 | T82: =IF(RC1="","",IF(OR(R8C<=ROUND(DAYS360(ValDat,RC1,0)/30,0),R8C>ROUND(DAYS360(ExpDat,RC1,0)/30,0)),0,OFFSET(R45C,MAX(-MNR,ROUND(DAYS360(ValDat,RC1,0)/30,0)-R8C+MEP-MNR),0,1,1))) -> 0 | U82: =IF(RC1="","",IF(OR(R8C<=ROUND(DAYS360(ValDat,RC1,0)/30,0),R8C>ROUND(DAYS360(ExpDat,RC1,0)/30,0)),0,OFFSET(R45C,MAX(-MNR,ROUND(DAYS360(ValDat,RC1,0)/30,0)-R8C+MEP-MNR),0,1,1))) -> 0 | V82: =IF(RC1="","",IF(OR(R8C<=ROUND(DAYS360(ValDat,RC1,0)/30,0),R8C>ROUND(DAYS360(ExpDat,RC1,0)/30,0)),0,OFFSET(R45C,MAX(-MNR,ROUND(DAYS360(ValDat,RC1,0)/30,0)-R8C+MEP-MNR),0,1,1))) -> 0 | W82: =IF(RC1="","",IF(OR(R8C<=ROUND(DAYS360(ValDat,RC1,0)/30,0),R8C>ROUND(DAYS360(ExpDat,RC1,0)/30,0)),0,OFFSET(R45C,MAX(-MNR,ROUND(DAYS360(ValDat,RC1,0)/30,0)-R8C+MEP-MNR),0,1,1))) -> 0 | X82: =IF(RC1="","",IF(OR(R8C<=ROUND(DAYS360(ValDat,RC1,0)/30,0),R8C>ROUND(DAYS360(ExpDat,RC1,0)/30,0)),0,OFFSET(R45C,MAX(-MNR,ROUND(DAYS360(ValDat,RC1,0)/30,0)-R8C+MEP-MNR),0,1,1))) -> 0 | Y82: =IF(RC1="","",IF(OR(R8C<=ROUND(DAYS360(ValDat,RC1,0)/30,0),R8C>ROUND(DAYS360(ExpDat,RC1,0)/30,0)),0,OFFSET(R45C,MAX(-MNR,ROUND(DAYS360(ValDat,RC1,0)/30,0)-R8C+MEP-MNR),0,1,1))) -> 0 | Z82: =IF(RC1="","",IF(OR(R8C<=ROUND(DAYS360(ValDat,RC1,0)/30,0),R8C>ROUND(DAYS360(ExpDat,RC1,0)/30,0)),0,OFFSET(R45C,MAX(-MNR,ROUND(DAYS360(ValDat,RC1,0)/30,0)-R8C+MEP-MNR),0,1,1))) -> 0 | AA82: =IF(RC1="","",IF(OR(R8C<=ROUND(DAYS360(ValDat,RC1,0)/30,0),R8C>ROUND(DAYS360(ExpDat,RC1,0)/30,0)),0,OFFSET(R45C,MAX(-MNR,ROUND(DAYS360(ValDat,RC1,0)/30,0)-R8C+MEP-MNR),0,1,1))) -> 0 | AB82: =IF(RC1="","",IF(OR(R8C<=ROUND(DAYS360(ValDat,RC1,0)/30,0),R8C>ROUND(DAYS360(ExpDat,RC1,0)/30,0)),0,OFFSET(R45C,MAX(-MNR,ROUND(DAYS360(ValDat,RC1,0)/30,0)-R8C+MEP-MNR),0,1,1))) -> 0 | AC82: =IF(RC1="","",IF(OR(R8C<=ROUND(DAYS360(ValDat,RC1,0)/30,0),R8C>ROUND(DAYS360(ExpDat,RC1,0)/30,0)),0,OFFSET(R45C,MAX(-MNR,ROUND(DAYS360(ValDat,RC1,0)/30,0)-R8C+MEP-MNR),0,1,1))) -> 0 | AD82: =IF(RC1="","",IF(OR(R8C<=ROUND(DAYS360(ValDat,RC1,0)/30,0),R8C>ROUND(DAYS360(ExpDat,RC1,0)/30,0)),0,OFFSET(R45C,MAX(-MNR,ROUND(DAYS360(ValDat,RC1,0)/30,0)-R8C+MEP-MNR),0,1,1))) -> 0 | AE82: =IF(RC1="","",IF(OR(R8C<=ROUND(DAYS360(ValDat,RC1,0)/30,0),R8C>ROUND(DAYS360(ExpDat,RC1,0)/30,0)),0,OFFSET(R45C,MAX(-MNR,ROUND(DAYS360(ValDat,RC1,0)/30,0)-R8C+MEP-MNR),0,1,1))) -> 0 | AF82: =IF(RC1="","",IF(OR(R8C<=ROUND(DAYS360(ValDat,RC1,0)/30,0),R8C>ROUND(DAYS360(ExpDat,RC1,0)/30,0)),0,OFFSET(R45C,MAX(-MNR,ROUND(DAYS360(ValDat,RC1,0)/30,0)-R8C+MEP-MNR),0,1,1))) -> 0 | AG82: =IF(RC1="","",IF(OR(R8C<=ROUND(DAYS360(ValDat,RC1,0)/30,0),R8C>ROUND(DAYS360(ExpDat,RC1,0)/30,0)),0,OFFSET(R45C,MAX(-MNR,ROUND(DAYS360(ValDat,RC1,0)/30,0)-R8C+MEP-MNR),0,1,1))) -> 0 | AH82: =IF(RC1="","",IF(OR(R8C<=ROUND(DAYS360(ValDat,RC1,0)/30,0),R8C>ROUND(DAYS360(ExpDat,RC1,0)/30,0)),0,OFFSET(R45C,MAX(-MNR,ROUND(DAYS360(ValDat,RC1,0)/30,0)-R8C+MEP-MNR),0,1,1))) -> 0 | AI82: =IF(RC1="","",IF(OR(R8C<=ROUND(DAYS360(ValDat,RC1,0)/30,0),R8C>ROUND(DAYS360(ExpDat,RC1,0)/30,0)),0,OFFSET(R45C,MAX(-MNR,ROUND(DAYS360(ValDat,RC1,0)/30,0)-R8C+MEP-MNR),0,1,1))) -> 0 | AJ82: =IF(RC1="","",IF(OR(R8C<=ROUND(DAYS360(ValDat,RC1,0)/30,0),R8C>ROUND(DAYS360(ExpDat,RC1,0)/30,0)),0,OFFSET(R45C,MAX(-MNR,ROUND(DAYS360(ValDat,RC1,0)/30,0)-R8C+MEP-MNR),0,1,1))) -> 0 | AK82: =IF(RC1="","",IF(OR(R8C<=ROUND(DAYS360(ValDat,RC1,0)/30,0),R8C>ROUND(DAYS360(ExpDat,RC1,0)/30,0)),0,OFFSET(R45C,MAX(-MNR,ROUND(DAYS360(ValDat,RC1,0)/30,0)-R8C+MEP-MNR),0,1,1))) -> 0 | AL82: =IF(RC1="","",IF(OR(R8C<=ROUND(DAYS360(ValDat,RC1,0)/30,0),R8C>ROUND(DAYS360(ExpDat,RC1,0)/30,0)),0,OFFSET(R45C,MAX(-MNR,ROUND(DAYS360(ValDat,RC1,0)/30,0)-R8C+MEP-MNR),0,1,1))) -> 0 | AM82: =IF(RC1="","",IF(OR(R8C<=ROUND(DAYS360(ValDat,RC1,0)/30,0),R8C>ROUND(DAYS360(ExpDat,RC1,0)/30,0)),0,OFFSET(R45C,MAX(-MNR,ROUND(DAYS360(ValDat,RC1,0)/30,0)-R8C+MEP-MNR),0,1,1))) -> 0 | AN82: =IF(RC1="","",IF(OR(R8C<=ROUND(DAYS360(ValDat,RC1,0)/30,0),R8C>ROUND(DAYS360(ExpDat,RC1,0)/30,0)),0,OFFSET(R45C,MAX(-MNR,ROUND(DAYS360(ValDat,RC1,0)/30,0)-R8C+MEP-MNR),0,1,1))) -> 0 | AO82: =IF(RC1="","",IF(OR(R8C<=ROUND(DAYS360(ValDat,RC1,0)/30,0),R8C>ROUND(DAYS360(ExpDat,RC1,0)/30,0)),0,OFFSET(R45C,MAX(-MNR,ROUND(DAYS360(ValDat,RC1,0)/30,0)-R8C+MEP-MNR),0,1,1))) -> 0
A83: =IF(R[-1]C="","",IF(EOMONTH(R[-1]C,0)+1>RunDat,"",EOMONTH(R[-1]C,0)+1)) -> 2000-09-01T00:00:00.000 | D83: =IF(RC1="","",SUM(RC[2]:RC[37])) -> 175175 | F83: =IF(RC1="","",IF(OR(R8C<=ROUND(DAYS360(ValDat,RC1,0)/30,0),R8C>ROUND(DAYS360(ExpDat,RC1,0)/30,0)),0,OFFSET(R45C,MAX(-MNR,ROUND(DAYS360(ValDat,RC1,0)/30,0)-R8C+MEP-MNR),0,1,1))) -> 31473 | G83: =IF(RC1="","",IF(OR(R8C<=ROUND(DAYS360(ValDat,RC1,0)/30,0),R8C>ROUND(DAYS360(ExpDat,RC1,0)/30,0)),0,OFFSET(R45C,MAX(-MNR,ROUND(DAYS360(ValDat,RC1,0)/30,0)-R8C+MEP-MNR),0,1,1))) -> 48503 | H83: =IF(RC1="","",IF(OR(R8C<=ROUND(DAYS360(ValDat,RC1,0)/30,0),R8C>ROUND(DAYS360(ExpDat,RC1,0)/30,0)),0,OFFSET(R45C,MAX(-MNR,ROUND(DAYS360(ValDat,RC1,0)/30,0)-R8C+MEP-MNR),0,1,1))) -> 32541 | I83: =IF(RC1="","",IF(OR(R8C<=ROUND(DAYS360(ValDat,RC1,0)/30,0),R8C>ROUND(DAYS360(ExpDat,RC1,0)/30,0)),0,OFFSET(R45C,MAX(-MNR,ROUND(DAYS360(ValDat,RC1,0)/30,0)-R8C+MEP-MNR),0,1,1))) -> 23437 | J83: =IF(RC1="","",IF(OR(R8C<=ROUND(DAYS360(ValDat,RC1,0)/30,0),R8C>ROUND(DAYS360(ExpDat,RC1,0)/30,0)),0,OFFSET(R45C,MAX(-MNR,ROUND(DAYS360(ValDat,RC1,0)/30,0)-R8C+MEP-MNR),0,1,1))) -> 8209 | K83: =IF(RC1="","",IF(OR(R8C<=ROUND(DAYS360(ValDat,RC1,0)/30,0),R8C>ROUND(DAYS360(ExpDat,RC1,0)/30,0)),0,OFFSET(R45C,MAX(-MNR,ROUND(DAYS360(ValDat,RC1,0)/30,0)-R8C+MEP-MNR),0,1,1))) -> -259 | L83: =IF(RC1="","",IF(OR(R8C<=ROUND(DAYS360(ValDat,RC1,0)/30,0),R8C>ROUND(DAYS360(ExpDat,RC1,0)/30,0)),0,OFFSET(R45C,MAX(-MNR,ROUND(DAYS360(ValDat,RC1,0)/30,0)-R8C+MEP-MNR),0,1,1))) -> 22318 | M83: =IF(RC1="","",IF(OR(R8C<=ROUND(DAYS360(ValDat,RC1,0)/30,0),R8C>ROUND(DAYS360(ExpDat,RC1,0)/30,0)),0,OFFSET(R45C,MAX(-MNR,ROUND(DAYS360(ValDat,RC1,0)/30,0)-R8C+MEP-MNR),0,1,1))) -> -1676 | N83: =IF(RC1="","",IF(OR(R8C<=ROUND(DAYS360(ValDat,RC1,0)/30,0),R8C>ROUND(DAYS360(ExpDat,RC1,0)/30,0)),0,OFFSET(R45C,MAX(-MNR,ROUND(DAYS360(ValDat,RC1,0)/30,0)-R8C+MEP-MNR),0,1,1))) -> 127 | O83: =IF(RC1="","",IF(OR(R8C<=ROUND(DAYS360(ValDat,RC1,0)/30,0),R8C>ROUND(DAYS360(ExpDat,RC1,0)/30,0)),0,OFFSET(R45C,MAX(-MNR,ROUND(DAYS360(ValDat,RC1,0)/30,0)-R8C+MEP-MNR),0,1,1))) -> 3333 | P83: =IF(RC1="","",IF(OR(R8C<=ROUND(DAYS360(ValDat,RC1,0)/30,0),R8C>ROUND(DAYS360(ExpDat,RC1,0)/30,0)),0,OFFSET(R45C,MAX(-MNR,ROUND(DAYS360(ValDat,RC1,0)/30,0)-R8C+MEP-MNR),0,1,1))) -> 6942 | Q83: =IF(RC1="","",IF(OR(R8C<=ROUND(DAYS360(ValDat,RC1,0)/30,0),R8C>ROUND(DAYS360(ExpDat,RC1,0)/30,0)),0,OFFSET(R45C,MAX(-MNR,ROUND(DAYS360(ValDat,RC1,0)/30,0)-R8C+MEP-MNR),0,1,1))) -> 227 | R83: =IF(RC1="","",IF(OR(R8C<=ROUND(DAYS360(ValDat,RC1,0)/30,0),R8C>ROUND(DAYS360(ExpDat,RC1,0)/30,0)),0,OFFSET(R45C,MAX(-MNR,ROUND(DAYS360(ValDat,RC1,0)/30,0)-R8C+MEP-MNR),0,1,1))) -> 0 | S83: =IF(RC1="","",IF(OR(R8C<=ROUND(DAYS360(ValDat,RC1,0)/30,0),R8C>ROUND(DAYS360(ExpDat,RC1,0)/30,0)),0,OFFSET(R45C,MAX(-MNR,ROUND(DAYS360(ValDat,RC1,0)/30,0)-R8C+MEP-MNR),0,1,1))) -> 0 | T83: =IF(RC1="","",IF(OR(R8C<=ROUND(DAYS360(ValDat,RC1,0)/30,0),R8C>ROUND(DAYS360(ExpDat,RC1,0)/30,0)),0,OFFSET(R45C,MAX(-MNR,ROUND(DAYS360(ValDat,RC1,0)/30,0)-R8C+MEP-MNR),0,1,1))) -> 0 | U83: =IF(RC1="","",IF(OR(R8C<=ROUND(DAYS360(ValDat,RC1,0)/30,0),R8C>ROUND(DAYS360(ExpDat,RC1,0)/30,0)),0,OFFSET(R45C,MAX(-MNR,ROUND(DAYS360(ValDat,RC1,0)/30,0)-R8C+MEP-MNR),0,1,1))) -> 0 | V83: =IF(RC1="","",IF(OR(R8C<=ROUND(DAYS360(ValDat,RC1,0)/30,0),R8C>ROUND(DAYS360(ExpDat,RC1,0)/30,0)),0,OFFSET(R45C,MAX(-MNR,ROUND(DAYS360(ValDat,RC1,0)/30,0)-R8C+MEP-MNR),0,1,1))) -> 0 | W83: =IF(RC1="","",IF(OR(R8C<=ROUND(DAYS360(ValDat,RC1,0)/30,0),R8C>ROUND(DAYS360(ExpDat,RC1,0)/30,0)),0,OFFSET(R45C,MAX(-MNR,ROUND(DAYS360(ValDat,RC1,0)/30,0)-R8C+MEP-MNR),0,1,1))) -> 0 | X83: =IF(RC1="","",IF(OR(R8C<=ROUND(DAYS360(ValDat,RC1,0)/30,0),R8C>ROUND(DAYS360(ExpDat,RC1,0)/30,0)),0,OFFSET(R45C,MAX(-MNR,ROUND(DAYS360(ValDat,RC1,0)/30,0)-R8C+MEP-MNR),0,1,1))) -> 0 | Y83: =IF(RC1="","",IF(OR(R8C<=ROUND(DAYS360(ValDat,RC1,0)/30,0),R8C>ROUND(DAYS360(ExpDat,RC1,0)/30,0)),0,OFFSET(R45C,MAX(-MNR,ROUND(DAYS360(ValDat,RC1,0)/30,0)-R8C+MEP-MNR),0,1,1))) -> 0 | Z83: =IF(RC1="","",IF(OR(R8C<=ROUND(DAYS360(ValDat,RC1,0)/30,0),R8C>ROUND(DAYS360(ExpDat,RC1,0)/30,0)),0,OFFSET(R45C,MAX(-MNR,ROUND(DAYS360(ValDat,RC1,0)/30,0)-R8C+MEP-MNR),0,1,1))) -> 0 | AA83: =IF(RC1="","",IF(OR(R8C<=ROUND(DAYS360(ValDat,RC1,0)/30,0),R8C>ROUND(DAYS360(ExpDat,RC1,0)/30,0)),0,OFFSET(R45C,MAX(-MNR,ROUND(DAYS360(ValDat,RC1,0)/30,0)-R8C+MEP-MNR),0,1,1))) -> 0 | AB83: =IF(RC1="","",IF(OR(R8C<=ROUND(DAYS360(ValDat,RC1,0)/30,0),R8C>ROUND(DAYS360(ExpDat,RC1,0)/30,0)),0,OFFSET(R45C,MAX(-MNR,ROUND(DAYS360(ValDat,RC1,0)/30,0)-R8C+MEP-MNR),0,1,1))) -> 0 | AC83: =IF(RC1="","",IF(OR(R8C<=ROUND(DAYS360(ValDat,RC1,0)/30,0),R8C>ROUND(DAYS360(ExpDat,RC1,0)/30,0)),0,OFFSET(R45C,MAX(-MNR,ROUND(DAYS360(ValDat,RC1,0)/30,0)-R8C+MEP-MNR),0,1,1))) -> 0 | AD83: =IF(RC1="","",IF(OR(R8C<=ROUND(DAYS360(ValDat,RC1,0)/30,0),R8C>ROUND(DAYS360(ExpDat,RC1,0)/30,0)),0,OFFSET(R45C,MAX(-MNR,ROUND(DAYS360(ValDat,RC1,0)/30,0)-R8C+MEP-MNR),0,1,1))) -> 0 | AE83: =IF(RC1="","",IF(OR(R8C<=ROUND(DAYS360(ValDat,RC1,0)/30,0),R8C>ROUND(DAYS360(ExpDat,RC1,0)/30,0)),0,OFFSET(R45C,MAX(-MNR,ROUND(DAYS360(ValDat,RC1,0)/30,0)-R8C+MEP-MNR),0,1,1))) -> 0 | AF83: =IF(RC1="","",IF(OR(R8C<=ROUND(DAYS360(ValDat,RC1,0)/30,0),R8C>ROUND(DAYS360(ExpDat,RC1,0)/30,0)),0,OFFSET(R45C,MAX(-MNR,ROUND(DAYS360(ValDat,RC1,0)/30,0)-R8C+MEP-MNR),0,1,1))) -> 0 | AG83: =IF(RC1="","",IF(OR(R8C<=ROUND(DAYS360(ValDat,RC1,0)/30,0),R8C>ROUND(DAYS360(ExpDat,RC1,0)/30,0)),0,OFFSET(R45C,MAX(-MNR,ROUND(DAYS360(ValDat,RC1,0)/30,0)-R8C+MEP-MNR),0,1,1))) -> 0 | AH83: =IF(RC1="","",IF(OR(R8C<=ROUND(DAYS360(ValDat,RC1,0)/30,0),R8C>ROUND(DAYS360(ExpDat,RC1,0)/30,0)),0,OFFSET(R45C,MAX(-MNR,ROUND(DAYS360(ValDat,RC1,0)/30,0)-R8C+MEP-MNR),0,1,1))) -> 0 | AI83: =IF(RC1="","",IF(OR(R8C<=ROUND(DAYS360(ValDat,RC1,0)/30,0),R8C>ROUND(DAYS360(ExpDat,RC1,0)/30,0)),0,OFFSET(R45C,MAX(-MNR,ROUND(DAYS360(ValDat,RC1,0)/30,0)-R8C+MEP-MNR),0,1,1))) -> 0 | AJ83: =IF(RC1="","",IF(OR(R8C<=ROUND(DAYS360(ValDat,RC1,0)/30,0),R8C>ROUND(DAYS360(ExpDat,RC1,0)/30,0)),0,OFFSET(R45C,MAX(-MNR,ROUND(DAYS360(ValDat,RC1,0)/30,0)-R8C+MEP-MNR),0,1,1))) -> 0 | AK83: =IF(RC1="","",IF(OR(R8C<=ROUND(DAYS360(ValDat,RC1,0)/30,0),R8C>ROUND(DAYS360(ExpDat,RC1,0)/30,0)),0,OFFSET(R45C,MAX(-MNR,ROUND(DAYS360(ValDat,RC1,0)/30,0)-R8C+MEP-MNR),0,1,1))) -> 0 | AL83: =IF(RC1="","",IF(OR(R8C<=ROUND(DAYS360(ValDat,RC1,0)/30,0),R8C>ROUND(DAYS360(ExpDat,RC1,0)/30,0)),0,OFFSET(R45C,MAX(-MNR,ROUND(DAYS360(ValDat,RC1,0)/30,0)-R8C+MEP-MNR),0,1,1))) -> 0 | AM83: =IF(RC1="","",IF(OR(R8C<=ROUND(DAYS360(ValDat,RC1,0)/30,0),R8C>ROUND(DAYS360(ExpDat,RC1,0)/30,0)),0,OFFSET(R45C,MAX(-MNR,ROUND(DAYS360(ValDat,RC1,0)/30,0)-R8C+MEP-MNR),0,1,1))) -> 0 | AN83: =IF(RC1="","",IF(OR(R8C<=ROUND(DAYS360(ValDat,RC1,0)/30,0),R8C>ROUND(DAYS360(ExpDat,RC1,0)/30,0)),0,OFFSET(R45C,MAX(-MNR,ROUND(DAYS360(ValDat,RC1,0)/30,0)-R8C+MEP-MNR),0,1,1))) -> 0 | AO83: =IF(RC1="","",IF(OR(R8C<=ROUND(DAYS360(ValDat,RC1,0)/30,0),R8C>ROUND(DAYS360(ExpDat,RC1,0)/30,0)),0,OFFSET(R45C,MAX(-MNR,ROUND(DAYS360(ValDat,RC1,0)/30,0)-R8C+MEP-MNR),0,1,1))) -> 0
A84: =IF(R[-1]C="","",IF(EOMONTH(R[-1]C,0)+1>RunDat,"",EOMONTH(R[-1]C,0)+1)) -> 2000-10-01T00:00:00.000 | D84: =IF(RC1="","",SUM(RC[2]:RC[37])) -> 340628 | F84: =IF(RC1="","",IF(OR(R8C<=ROUND(DAYS360(ValDat,RC1,0)/30,0),R8C>ROUND(DAYS360(ExpDat,RC1,0)/30,0)),0,OFFSET(R45C,MAX(-MNR,ROUND(DAYS360(ValDat,RC1,0)/30,0)-R8C+MEP-MNR),0,1,1))) -> 4419 | G84: =IF(RC1="","",IF(OR(R8C<=ROUND(DAYS360(ValDat,RC1,0)/30,0),R8C>ROUND(DAYS360(ExpDat,RC1,0)/30,0)),0,OFFSET(R45C,MAX(-MNR,ROUND(DAYS360(ValDat,RC1,0)/30,0)-R8C+MEP-MNR),0,1,1))) -> 178666 | H84: =IF(RC1="","",IF(OR(R8C<=ROUND(DAYS360(ValDat,RC1,0)/30,0),R8C>ROUND(DAYS360(ExpDat,RC1,0)/30,0)),0,OFFSET(R45C,MAX(-MNR,ROUND(DAYS360(ValDat,RC1,0)/30,0)-R8C+MEP-MNR),0,1,1))) -> 127444 | I84: =IF(RC1="","",IF(OR(R8C<=ROUND(DAYS360(ValDat,RC1,0)/30,0),R8C>ROUND(DAYS360(ExpDat,RC1,0)/30,0)),0,OFFSET(R45C,MAX(-MNR,ROUND(DAYS360(ValDat,RC1,0)/30,0)-R8C+MEP-MNR),0,1,1))) -> 7864 | J84: =IF(RC1="","",IF(OR(R8C<=ROUND(DAYS360(ValDat,RC1,0)/30,0),R8C>ROUND(DAYS360(ExpDat,RC1,0)/30,0)),0,OFFSET(R45C,MAX(-MNR,ROUND(DAYS360(ValDat,RC1,0)/30,0)-R8C+MEP-MNR),0,1,1))) -> 14176 | K84: =IF(RC1="","",IF(OR(R8C<=ROUND(DAYS360(ValDat,RC1,0)/30,0),R8C>ROUND(DAYS360(ExpDat,RC1,0)/30,0)),0,OFFSET(R45C,MAX(-MNR,ROUND(DAYS360(ValDat,RC1,0)/30,0)-R8C+MEP-MNR),0,1,1))) -> -471 | L84: =IF(RC1="","",IF(OR(R8C<=ROUND(DAYS360(ValDat,RC1,0)/30,0),R8C>ROUND(DAYS360(ExpDat,RC1,0)/30,0)),0,OFFSET(R45C,MAX(-MNR,ROUND(DAYS360(ValDat,RC1,0)/30,0)-R8C+MEP-MNR),0,1,1))) -> 5261 | M84: =IF(RC1="","",IF(OR(R8C<=ROUND(DAYS360(ValDat,RC1,0)/30,0),R8C>ROUND(DAYS360(ExpDat,RC1,0)/30,0)),0,OFFSET(R45C,MAX(-MNR,ROUND(DAYS360(ValDat,RC1,0)/30,0)-R8C+MEP-MNR),0,1,1))) -> -1662 | N84: =IF(RC1="","",IF(OR(R8C<=ROUND(DAYS360(ValDat,RC1,0)/30,0),R8C>ROUND(DAYS360(ExpDat,RC1,0)/30,0)),0,OFFSET(R45C,MAX(-MNR,ROUND(DAYS360(ValDat,RC1,0)/30,0)-R8C+MEP-MNR),0,1,1))) -> 677 | O84: =IF(RC1="","",IF(OR(R8C<=ROUND(DAYS360(ValDat,RC1,0)/30,0),R8C>ROUND(DAYS360(ExpDat,RC1,0)/30,0)),0,OFFSET(R45C,MAX(-MNR,ROUND(DAYS360(ValDat,RC1,0)/30,0)-R8C+MEP-MNR),0,1,1))) -> 3206 | P84: =IF(RC1="","",IF(OR(R8C<=ROUND(DAYS360(ValDat,RC1,0)/30,0),R8C>ROUND(DAYS360(ExpDat,RC1,0)/30,0)),0,OFFSET(R45C,MAX(-MNR,ROUND(DAYS360(ValDat,RC1,0)/30,0)-R8C+MEP-MNR),0,1,1))) -> 581 | Q84: =IF(RC1="","",IF(OR(R8C<=ROUND(DAYS360(ValDat,RC1,0)/30,0),R8C>ROUND(DAYS360(ExpDat,RC1,0)/30,0)),0,OFFSET(R45C,MAX(-MNR,ROUND(DAYS360(ValDat,RC1,0)/30,0)-R8C+MEP-MNR),0,1,1))) -> 227 | R84: =IF(RC1="","",IF(OR(R8C<=ROUND(DAYS360(ValDat,RC1,0)/30,0),R8C>ROUND(DAYS360(ExpDat,RC1,0)/30,0)),0,OFFSET(R45C,MAX(-MNR,ROUND(DAYS360(ValDat,RC1,0)/30,0)-R8C+MEP-MNR),0,1,1))) -> 240 | S84: =IF(RC1="","",IF(OR(R8C<=ROUND(DAYS360(ValDat,RC1,0)/30,0),R8C>ROUND(DAYS360(ExpDat,RC1,0)/30,0)),0,OFFSET(R45C,MAX(-MNR,ROUND(DAYS360(ValDat,RC1,0)/30,0)-R8C+MEP-MNR),0,1,1))) -> 0 | T84: =IF(RC1="","",IF(OR(R8C<=ROUND(DAYS360(ValDat,RC1,0)/30,0),R8C>ROUND(DAYS360(ExpDat,RC1,0)/30,0)),0,OFFSET(R45C,MAX(-MNR,ROUND(DAYS360(ValDat,RC1,0)/30,0)-R8C+MEP-MNR),0,1,1))) -> 0 | U84: =IF(RC1="","",IF(OR(R8C<=ROUND(DAYS360(ValDat,RC1,0)/30,0),R8C>ROUND(DAYS360(ExpDat,RC1,0)/30,0)),0,OFFSET(R45C,MAX(-MNR,ROUND(DAYS360(ValDat,RC1,0)/30,0)-R8C+MEP-MNR),0,1,1))) -> 0 | V84: =IF(RC1="","",IF(OR(R8C<=ROUND(DAYS360(ValDat,RC1,0)/30,0),R8C>ROUND(DAYS360(ExpDat,RC1,0)/30,0)),0,OFFSET(R45C,MAX(-MNR,ROUND(DAYS360(ValDat,RC1,0)/30,0)-R8C+MEP-MNR),0,1,1))) -> 0 | W84: =IF(RC1="","",IF(OR(R8C<=ROUND(DAYS360(ValDat,RC1,0)/30,0),R8C>ROUND(DAYS360(ExpDat,RC1,0)/30,0)),0,OFFSET(R45C,MAX(-MNR,ROUND(DAYS360(ValDat,RC1,0)/30,0)-R8C+MEP-MNR),0,1,1))) -> 0 | X84: =IF(RC1="","",IF(OR(R8C<=ROUND(DAYS360(ValDat,RC1,0)/30,0),R8C>ROUND(DAYS360(ExpDat,RC1,0)/30,0)),0,OFFSET(R45C,MAX(-MNR,ROUND(DAYS360(ValDat,RC1,0)/30,0)-R8C+MEP-MNR),0,1,1))) -> 0 | Y84: =IF(RC1="","",IF(OR(R8C<=ROUND(DAYS360(ValDat,RC1,0)/30,0),R8C>ROUND(DAYS360(ExpDat,RC1,0)/30,0)),0,OFFSET(R45C,MAX(-MNR,ROUND(DAYS360(ValDat,RC1,0)/30,0)-R8C+MEP-MNR),0,1,1))) -> 0 | Z84: =IF(RC1="","",IF(OR(R8C<=ROUND(DAYS360(ValDat,RC1,0)/30,0),R8C>ROUND(DAYS360(ExpDat,RC1,0)/30,0)),0,OFFSET(R45C,MAX(-MNR,ROUND(DAYS360(ValDat,RC1,0)/30,0)-R8C+MEP-MNR),0,1,1))) -> 0 | AA84: =IF(RC1="","",IF(OR(R8C<=ROUND(DAYS360(ValDat,RC1,0)/30,0),R8C>ROUND(DAYS360(ExpDat,RC1,0)/30,0)),0,OFFSET(R45C,MAX(-MNR,ROUND(DAYS360(ValDat,RC1,0)/30,0)-R8C+MEP-MNR),0,1,1))) -> 0 | AB84: =IF(RC1="","",IF(OR(R8C<=ROUND(DAYS360(ValDat,RC1,0)/30,0),R8C>ROUND(DAYS360(ExpDat,RC1,0)/30,0)),0,OFFSET(R45C,MAX(-MNR,ROUND(DAYS360(ValDat,RC1,0)/30,0)-R8C+MEP-MNR),0,1,1))) -> 0 | AC84: =IF(RC1="","",IF(OR(R8C<=ROUND(DAYS360(ValDat,RC1,0)/30,0),R8C>ROUND(DAYS360(ExpDat,RC1,0)/30,0)),0,OFFSET(R45C,MAX(-MNR,ROUND(DAYS360(ValDat,RC1,0)/30,0)-R8C+MEP-MNR),0,1,1))) -> 0 | AD84: =IF(RC1="","",IF(OR(R8C<=ROUND(DAYS360(ValDat,RC1,0)/30,0),R8C>ROUND(DAYS360(ExpDat,RC1,0)/30,0)),0,OFFSET(R45C,MAX(-MNR,ROUND(DAYS360(ValDat,RC1,0)/30,0)-R8C+MEP-MNR),0,1,1))) -> 0 | AE84: =IF(RC1="","",IF(OR(R8C<=ROUND(DAYS360(ValDat,RC1,0)/30,0),R8C>ROUND(DAYS360(ExpDat,RC1,0)/30,0)),0,OFFSET(R45C,MAX(-MNR,ROUND(DAYS360(ValDat,RC1,0)/30,0)-R8C+MEP-MNR),0,1,1))) -> 0 | AF84: =IF(RC1="","",IF(OR(R8C<=ROUND(DAYS360(ValDat,RC1,0)/30,0),R8C>ROUND(DAYS360(ExpDat,RC1,0)/30,0)),0,OFFSET(R45C,MAX(-MNR,ROUND(DAYS360(ValDat,RC1,0)/30,0)-R8C+MEP-MNR),0,1,1))) -> 0 | AG84: =IF(RC1="","",IF(OR(R8C<=ROUND(DAYS360(ValDat,RC1,0)/30,0),R8C>ROUND(DAYS360(ExpDat,RC1,0)/30,0)),0,OFFSET(R45C,MAX(-MNR,ROUND(DAYS360(ValDat,RC1,0)/30,0)-R8C+MEP-MNR),0,1,1))) -> 0 | AH84: =IF(RC1="","",IF(OR(R8C<=ROUND(DAYS360(ValDat,RC1,0)/30,0),R8C>ROUND(DAYS360(ExpDat,RC1,0)/30,0)),0,OFFSET(R45C,MAX(-MNR,ROUND(DAYS360(ValDat,RC1,0)/30,0)-R8C+MEP-MNR),0,1,1))) -> 0 | AI84: =IF(RC1="","",IF(OR(R8C<=ROUND(DAYS360(ValDat,RC1,0)/30,0),R8C>ROUND(DAYS360(ExpDat,RC1,0)/30,0)),0,OFFSET(R45C,MAX(-MNR,ROUND(DAYS360(ValDat,RC1,0)/30,0)-R8C+MEP-MNR),0,1,1))) -> 0 | AJ84: =IF(RC1="","",IF(OR(R8C<=ROUND(DAYS360(ValDat,RC1,0)/30,0),R8C>ROUND(DAYS360(ExpDat,RC1,0)/30,0)),0,OFFSET(R45C,MAX(-MNR,ROUND(DAYS360(ValDat,RC1,0)/30,0)-R8C+MEP-MNR),0,1,1))) -> 0 | AK84: =IF(RC1="","",IF(OR(R8C<=ROUND(DAYS360(ValDat,RC1,0)/30,0),R8C>ROUND(DAYS360(ExpDat,RC1,0)/30,0)),0,OFFSET(R45C,MAX(-MNR,ROUND(DAYS360(ValDat,RC1,0)/30,0)-R8C+MEP-MNR),0,1,1))) -> 0 | AL84: =IF(RC1="","",IF(OR(R8C<=ROUND(DAYS360(ValDat,RC1,0)/30,0),R8C>ROUND(DAYS360(ExpDat,RC1,0)/30,0)),0,OFFSET(R45C,MAX(-MNR,ROUND(DAYS360(ValDat,RC1,0)/30,0)-R8C+MEP-MNR),0,1,1))) -> 0 | AM84: =IF(RC1="","",IF(OR(R8C<=ROUND(DAYS360(ValDat,RC1,0)/30,0),R8C>ROUND(DAYS360(ExpDat,RC1,0)/30,0)),0,OFFSET(R45C,MAX(-MNR,ROUND(DAYS360(ValDat,RC1,0)/30,0)-R8C+MEP-MNR),0,1,1))) -> 0 | AN84: =IF(RC1="","",IF(OR(R8C<=ROUND(DAYS360(ValDat,RC1,0)/30,0),R8C>ROUND(DAYS360(ExpDat,RC1,0)/30,0)),0,OFFSET(R45C,MAX(-MNR,ROUND(DAYS360(ValDat,RC1,0)/30,0)-R8C+MEP-MNR),0,1,1))) -> 0 | AO84: =IF(RC1="","",IF(OR(R8C<=ROUND(DAYS360(ValDat,RC1,0)/30,0),R8C>ROUND(DAYS360(ExpDat,RC1,0)/30,0)),0,OFFSET(R45C,MAX(-MNR,ROUND(DAYS360(ValDat,RC1,0)/30,0)-R8C+MEP-MNR),0,1,1))) -> 0
A85: =IF(R[-1]C="","",IF(EOMONTH(R[-1]C,0)+1>RunDat,"",EOMONTH(R[-1]C,0)+1)) -> 2000-11-01T00:00:00.000 | D85: =IF(RC1="","",SUM(RC[2]:RC[37])) -> 111845 | F85: =IF(RC1="","",IF(OR(R8C<=ROUND(DAYS360(ValDat,RC1,0)/30,0),R8C>ROUND(DAYS360(ExpDat,RC1,0)/30,0)),0,OFFSET(R45C,MAX(-MNR,ROUND(DAYS360(ValDat,RC1,0)/30,0)-R8C+MEP-MNR),0,1,1))) -> 31361 | G85: =IF(RC1="","",IF(OR(R8C<=ROUND(DAYS360(ValDat,RC1,0)/30,0),R8C>ROUND(DAYS360(ExpDat,RC1,0)/30,0)),0,OFFSET(R45C,MAX(-MNR,ROUND(DAYS360(ValDat,RC1,0)/30,0)-R8C+MEP-MNR),0,1,1))) -> 34068 | H85: =IF(RC1="","",IF(OR(R8C<=ROUND(DAYS360(ValDat,RC1,0)/30,0),R8C>ROUND(DAYS360(ExpDat,RC1,0)/30,0)),0,OFFSET(R45C,MAX(-MNR,ROUND(DAYS360(ValDat,RC1,0)/30,0)-R8C+MEP-MNR),0,1,1))) -> 9928 | I85: =IF(RC1="","",IF(OR(R8C<=ROUND(DAYS360(ValDat,RC1,0)/30,0),R8C>ROUND(DAYS360(ExpDat,RC1,0)/30,0)),0,OFFSET(R45C,MAX(-MNR,ROUND(DAYS360(ValDat,RC1,0)/30,0)-R8C+MEP-MNR),0,1,1))) -> 9062 | J85: =IF(RC1="","",IF(OR(R8C<=ROUND(DAYS360(ValDat,RC1,0)/30,0),R8C>ROUND(DAYS360(ExpDat,RC1,0)/30,0)),0,OFFSET(R45C,MAX(-MNR,ROUND(DAYS360(ValDat,RC1,0)/30,0)-R8C+MEP-MNR),0,1,1))) -> 8316 | K85: =IF(RC1="","",IF(OR(R8C<=ROUND(DAYS360(ValDat,RC1,0)/30,0),R8C>ROUND(DAYS360(ExpDat,RC1,0)/30,0)),0,OFFSET(R45C,MAX(-MNR,ROUND(DAYS360(ValDat,RC1,0)/30,0)-R8C+MEP-MNR),0,1,1))) -> 11759 | L85: =IF(RC1="","",IF(OR(R8C<=ROUND(DAYS360(ValDat,RC1,0)/30,0),R8C>ROUND(DAYS360(ExpDat,RC1,0)/30,0)),0,OFFSET(R45C,MAX(-MNR,ROUND(DAYS360(ValDat,RC1,0)/30,0)-R8C+MEP-MNR),0,1,1))) -> 4997 | M85: =IF(RC1="","",IF(OR(R8C<=ROUND(DAYS360(ValDat,RC1,0)/30,0),R8C>ROUND(DAYS360(ExpDat,RC1,0)/30,0)),0,OFFSET(R45C,MAX(-MNR,ROUND(DAYS360(ValDat,RC1,0)/30,0)-R8C+MEP-MNR),0,1,1))) -> 430 | N85: =IF(RC1="","",IF(OR(R8C<=ROUND(DAYS360(ValDat,RC1,0)/30,0),R8C>ROUND(DAYS360(ExpDat,RC1,0)/30,0)),0,OFFSET(R45C,MAX(-MNR,ROUND(DAYS360(ValDat,RC1,0)/30,0)-R8C+MEP-MNR),0,1,1))) -> 677 | O85: =IF(RC1="","",IF(OR(R8C<=ROUND(DAYS360(ValDat,RC1,0)/30,0),R8C>ROUND(DAYS360(ExpDat,RC1,0)/30,0)),0,OFFSET(R45C,MAX(-MNR,ROUND(DAYS360(ValDat,RC1,0)/30,0)-R8C+MEP-MNR),0,1,1))) -> 280 | P85: =IF(RC1="","",IF(OR(R8C<=ROUND(DAYS360(ValDat,RC1,0)/30,0),R8C>ROUND(DAYS360(ExpDat,RC1,0)/30,0)),0,OFFSET(R45C,MAX(-MNR,ROUND(DAYS360(ValDat,RC1,0)/30,0)-R8C+MEP-MNR),0,1,1))) -> 581 | Q85: =IF(RC1="","",IF(OR(R8C<=ROUND(DAYS360(ValDat,RC1,0)/30,0),R8C>ROUND(DAYS360(ExpDat,RC1,0)/30,0)),0,OFFSET(R45C,MAX(-MNR,ROUND(DAYS360(ValDat,RC1,0)/30,0)-R8C+MEP-MNR),0,1,1))) -> 90 | R85: =IF(RC1="","",IF(OR(R8C<=ROUND(DAYS360(ValDat,RC1,0)/30,0),R8C>ROUND(DAYS360(ExpDat,RC1,0)/30,0)),0,OFFSET(R45C,MAX(-MNR,ROUND(DAYS360(ValDat,RC1,0)/30,0)-R8C+MEP-MNR),0,1,1))) -> 240 | S85: =IF(RC1="","",IF(OR(R8C<=ROUND(DAYS360(ValDat,RC1,0)/30,0),R8C>ROUND(DAYS360(ExpDat,RC1,0)/30,0)),0,OFFSET(R45C,MAX(-MNR,ROUND(DAYS360(ValDat,RC1,0)/30,0)-R8C+MEP-MNR),0,1,1))) -> 56 | T85: =IF(RC1="","",IF(OR(R8C<=ROUND(DAYS360(ValDat,RC1,0)/30,0),R8C>ROUND(DAYS360(ExpDat,RC1,0)/30,0)),0,OFFSET(R45C,MAX(-MNR,ROUND(DAYS360(ValDat,RC1,0)/30,0)-R8C+MEP-MNR),0,1,1))) -> 0 | U85: =IF(RC1="","",IF(OR(R8C<=ROUND(DAYS360(ValDat,RC1,0)/30,0),R8C>ROUND(DAYS360(ExpDat,RC1,0)/30,0)),0,OFFSET(R45C,MAX(-MNR,ROUND(DAYS360(ValDat,RC1,0)/30,0)-R8C+MEP-MNR),0,1,1))) -> 0 | V85: =IF(RC1="","",IF(OR(R8C<=ROUND(DAYS360(ValDat,RC1,0)/30,0),R8C>ROUND(DAYS360(ExpDat,RC1,0)/30,0)),0,OFFSET(R45C,MAX(-MNR,ROUND(DAYS360(ValDat,RC1,0)/30,0)-R8C+MEP-MNR),0,1,1))) -> 0 | W85: =IF(RC1="","",IF(OR(R8C<=ROUND(DAYS360(ValDat,RC1,0)/30,0),R8C>ROUND(DAYS360(ExpDat,RC1,0)/30,0)),0,OFFSET(R45C,MAX(-MNR,ROUND(DAYS360(ValDat,RC1,0)/30,0)-R8C+MEP-MNR),0,1,1))) -> 0 | X85: =IF(RC1="","",IF(OR(R8C<=ROUND(DAYS360(ValDat,RC1,0)/30,0),R8C>ROUND(DAYS360(ExpDat,RC1,0)/30,0)),0,OFFSET(R45C,MAX(-MNR,ROUND(DAYS360(ValDat,RC1,0)/30,0)-R8C+MEP-MNR),0,1,1))) -> 0 | Y85: =IF(RC1="","",IF(OR(R8C<=ROUND(DAYS360(ValDat,RC1,0)/30,0),R8C>ROUND(DAYS360(ExpDat,RC1,0)/30,0)),0,OFFSET(R45C,MAX(-MNR,ROUND(DAYS360(ValDat,RC1,0)/30,0)-R8C+MEP-MNR),0,1,1))) -> 0 | Z85: =IF(RC1="","",IF(OR(R8C<=ROUND(DAYS360(ValDat,RC1,0)/30,0),R8C>ROUND(DAYS360(ExpDat,RC1,0)/30,0)),0,OFFSET(R45C,MAX(-MNR,ROUND(DAYS360(ValDat,RC1,0)/30,0)-R8C+MEP-MNR),0,1,1))) -> 0 | AA85: =IF(RC1="","",IF(OR(R8C<=ROUND(DAYS360(ValDat,RC1,0)/30,0),R8C>ROUND(DAYS360(ExpDat,RC1,0)/30,0)),0,OFFSET(R45C,MAX(-MNR,ROUND(DAYS360(ValDat,RC1,0)/30,0)-R8C+MEP-MNR),0,1,1))) -> 0 | AB85: =IF(RC1="","",IF(OR(R8C<=ROUND(DAYS360(ValDat,RC1,0)/30,0),R8C>ROUND(DAYS360(ExpDat,RC1,0)/30,0)),0,OFFSET(R45C,MAX(-MNR,ROUND(DAYS360(ValDat,RC1,0)/30,0)-R8C+MEP-MNR),0,1,1))) -> 0 | AC85: =IF(RC1="","",IF(OR(R8C<=ROUND(DAYS360(ValDat,RC1,0)/30,0),R8C>ROUND(DAYS360(ExpDat,RC1,0)/30,0)),0,OFFSET(R45C,MAX(-MNR,ROUND(DAYS360(ValDat,RC1,0)/30,0)-R8C+MEP-MNR),0,1,1))) -> 0 | AD85: =IF(RC1="","",IF(OR(R8C<=ROUND(DAYS360(ValDat,RC1,0)/30,0),R8C>ROUND(DAYS360(ExpDat,RC1,0)/30,0)),0,OFFSET(R45C,MAX(-MNR,ROUND(DAYS360(ValDat,RC1,0)/30,0)-R8C+MEP-MNR),0,1,1))) -> 0 | AE85: =IF(RC1="","",IF(OR(R8C<=ROUND(DAYS360(ValDat,RC1,0)/30,0),R8C>ROUND(DAYS360(ExpDat,RC1,0)/30,0)),0,OFFSET(R45C,MAX(-MNR,ROUND(DAYS360(ValDat,RC1,0)/30,0)-R8C+MEP-MNR),0,1,1))) -> 0 | AF85: =IF(RC1="","",IF(OR(R8C<=ROUND(DAYS360(ValDat,RC1,0)/30,0),R8C>ROUND(DAYS360(ExpDat,RC1,0)/30,0)),0,OFFSET(R45C,MAX(-MNR,ROUND(DAYS360(ValDat,RC1,0)/30,0)-R8C+MEP-MNR),0,1,1))) -> 0 | AG85: =IF(RC1="","",IF(OR(R8C<=ROUND(DAYS360(ValDat,RC1,0)/30,0),R8C>ROUND(DAYS360(ExpDat,RC1,0)/30,0)),0,OFFSET(R45C,MAX(-MNR,ROUND(DAYS360(ValDat,RC1,0)/30,0)-R8C+MEP-MNR),0,1,1))) -> 0 | AH85: =IF(RC1="","",IF(OR(R8C<=ROUND(DAYS360(ValDat,RC1,0)/30,0),R8C>ROUND(DAYS360(ExpDat,RC1,0)/30,0)),0,OFFSET(R45C,MAX(-MNR,ROUND(DAYS360(ValDat,RC1,0)/30,0)-R8C+MEP-MNR),0,1,1))) -> 0 | AI85: =IF(RC1="","",IF(OR(R8C<=ROUND(DAYS360(ValDat,RC1,0)/30,0),R8C>ROUND(DAYS360(ExpDat,RC1,0)/30,0)),0,OFFSET(R45C,MAX(-MNR,ROUND(DAYS360(ValDat,RC1,0)/30,0)-R8C+MEP-MNR),0,1,1))) -> 0 | AJ85: =IF(RC1="","",IF(OR(R8C<=ROUND(DAYS360(ValDat,RC1,0)/30,0),R8C>ROUND(DAYS360(ExpDat,RC1,0)/30,0)),0,OFFSET(R45C,MAX(-MNR,ROUND(DAYS360(ValDat,RC1,0)/30,0)-R8C+MEP-MNR),0,1,1))) -> 0 | AK85: =IF(RC1="","",IF(OR(R8C<=ROUND(DAYS360(ValDat,RC1,0)/30,0),R8C>ROUND(DAYS360(ExpDat,RC1,0)/30,0)),0,OFFSET(R45C,MAX(-MNR,ROUND(DAYS360(ValDat,RC1,0)/30,0)-R8C+MEP-MNR),0,1,1))) -> 0 | AL85: =IF(RC1="","",IF(OR(R8C<=ROUND(DAYS360(ValDat,RC1,0)/30,0),R8C>ROUND(DAYS360(ExpDat,RC1,0)/30,0)),0,OFFSET(R45C,MAX(-MNR,ROUND(DAYS360(ValDat,RC1,0)/30,0)-R8C+MEP-MNR),0,1,1))) -> 0 | AM85: =IF(RC1="","",IF(OR(R8C<=ROUND(DAYS360(ValDat,RC1,0)/30,0),R8C>ROUND(DAYS360(ExpDat,RC1,0)/30,0)),0,OFFSET(R45C,MAX(-MNR,ROUND(DAYS360(ValDat,RC1,0)/30,0)-R8C+MEP-MNR),0,1,1))) -> 0 | AN85: =IF(RC1="","",IF(OR(R8C<=ROUND(DAYS360(ValDat,RC1,0)/30,0),R8C>ROUND(DAYS360(ExpDat,RC1,0)/30,0)),0,OFFSET(R45C,MAX(-MNR,ROUND(DAYS360(ValDat,RC1,0)/30,0)-R8C+MEP-MNR),0,1,1))) -> 0 | AO85: =IF(RC1="","",IF(OR(R8C<=ROUND(DAYS360(ValDat,RC1,0)/30,0),R8C>ROUND(DAYS360(ExpDat,RC1,0)/30,0)),0,OFFSET(R45C,MAX(-MNR,ROUND(DAYS360(ValDat,RC1,0)/30,0)-R8C+MEP-MNR),0,1,1))) -> 0
A86: =IF(R[-1]C="","",IF(EOMONTH(R[-1]C,0)+1>RunDat,"",EOMONTH(R[-1]C,0)+1)) -> 2000-12-01T00:00:00.000 | D86: =IF(RC1="","",SUM(RC[2]:RC[37])) -> 178569 | F86: =IF(RC1="","",IF(OR(R8C<=ROUND(DAYS360(ValDat,RC1,0)/30,0),R8C>ROUND(DAYS360(ExpDat,RC1,0)/30,0)),0,OFFSET(R45C,MAX(-MNR,ROUND(DAYS360(ValDat,RC1,0)/30,0)-R8C+MEP-MNR),0,1,1))) -> 1804 | G86: =IF(RC1="","",IF(OR(R8C<=ROUND(DAYS360(ValDat,RC1,0)/30,0),R8C>ROUND(DAYS360(ExpDat,RC1,0)/30,0)),0,OFFSET(R45C,MAX(-MNR,ROUND(DAYS360(ValDat,RC1,0)/30,0)-R8C+MEP-MNR),0,1,1))) -> 76026 | H86: =IF(RC1="","",IF(OR(R8C<=ROUND(DAYS360(ValDat,RC1,0)/30,0),R8C>ROUND(DAYS360(ExpDat,RC1,0)/30,0)),0,OFFSET(R45C,MAX(-MNR,ROUND(DAYS360(ValDat,RC1,0)/30,0)-R8C+MEP-MNR),0,1,1))) -> 91527 | I86: =IF(RC1="","",IF(OR(R8C<=ROUND(DAYS360(ValDat,RC1,0)/30,0),R8C>ROUND(DAYS360(ExpDat,RC1,0)/30,0)),0,OFFSET(R45C,MAX(-MNR,ROUND(DAYS360(ValDat,RC1,0)/30,0)-R8C+MEP-MNR),0,1,1))) -> -5630 | J86: =IF(RC1="","",IF(OR(R8C<=ROUND(DAYS360(ValDat,RC1,0)/30,0),R8C>ROUND(DAYS360(ExpDat,RC1,0)/30,0)),0,OFFSET(R45C,MAX(-MNR,ROUND(DAYS360(ValDat,RC1,0)/30,0)-R8C+MEP-MNR),0,1,1))) -> 2904 | K86: =IF(RC1="","",IF(OR(R8C<=ROUND(DAYS360(ValDat,RC1,0)/30,0),R8C>ROUND(DAYS360(ExpDat,RC1,0)/30,0)),0,OFFSET(R45C,MAX(-MNR,ROUND(DAYS360(ValDat,RC1,0)/30,0)-R8C+MEP-MNR),0,1,1))) -> 2179 | L86: =IF(RC1="","",IF(OR(R8C<=ROUND(DAYS360(ValDat,RC1,0)/30,0),R8C>ROUND(DAYS360(ExpDat,RC1,0)/30,0)),0,OFFSET(R45C,MAX(-MNR,ROUND(DAYS360(ValDat,RC1,0)/30,0)-R8C+MEP-MNR),0,1,1))) -> 7297 | M86: =IF(RC1="","",IF(OR(R8C<=ROUND(DAYS360(ValDat,RC1,0)/30,0),R8C>ROUND(DAYS360(ExpDat,RC1,0)/30,0)),0,OFFSET(R45C,MAX(-MNR,ROUND(DAYS360(ValDat,RC1,0)/30,0)-R8C+MEP-MNR),0,1,1))) -> 430 | N86: =IF(RC1="","",IF(OR(R8C<=ROUND(DAYS360(ValDat,RC1,0)/30,0),R8C>ROUND(DAYS360(ExpDat,RC1,0)/30,0)),0,OFFSET(R45C,MAX(-MNR,ROUND(DAYS360(ValDat,RC1,0)/30,0)-R8C+MEP-MNR),0,1,1))) -> 116 | O86: =IF(RC1="","",IF(OR(R8C<=ROUND(DAYS360(ValDat,RC1,0)/30,0),R8C>ROUND(DAYS360(ExpDat,RC1,0)/30,0)),0,OFFSET(R45C,MAX(-MNR,ROUND(DAYS360(ValDat,RC1,0)/30,0)-R8C+MEP-MNR),0,1,1))) -> 779 | P86: =IF(RC1="","",IF(OR(R8C<=ROUND(DAYS360(ValDat,RC1,0)/30,0),R8C>ROUND(DAYS360(ExpDat,RC1,0)/30,0)),0,OFFSET(R45C,MAX(-MNR,ROUND(DAYS360(ValDat,RC1,0)/30,0)-R8C+MEP-MNR),0,1,1))) -> 799 | Q86: =IF(RC1="","",IF(OR(R8C<=ROUND(DAYS360(ValDat,RC1,0)/30,0),R8C>ROUND(DAYS360(ExpDat,RC1,0)/30,0)),0,OFFSET(R45C,MAX(-MNR,ROUND(DAYS360(ValDat,RC1,0)/30,0)-R8C+MEP-MNR),0,1,1))) -> 115 | R86: =IF(RC1="","",IF(OR(R8C<=ROUND(DAYS360(ValDat,RC1,0)/30,0),R8C>ROUND(DAYS360(ExpDat,RC1,0)/30,0)),0,OFFSET(R45C,MAX(-MNR,ROUND(DAYS360(ValDat,RC1,0)/30,0)-R8C+MEP-MNR),0,1,1))) -> 167 | S86: =IF(RC1="","",IF(OR(R8C<=ROUND(DAYS360(ValDat,RC1,0)/30,0),R8C>ROUND(DAYS360(ExpDat,RC1,0)/30,0)),0,OFFSET(R45C,MAX(-MNR,ROUND(DAYS360(ValDat,RC1,0)/30,0)-R8C+MEP-MNR),0,1,1))) -> 56 | T86: =IF(RC1="","",IF(OR(R8C<=ROUND(DAYS360(ValDat,RC1,0)/30,0),R8C>ROUND(DAYS360(ExpDat,RC1,0)/30,0)),0,OFFSET(R45C,MAX(-MNR,ROUND(DAYS360(ValDat,RC1,0)/30,0)-R8C+MEP-MNR),0,1,1))) -> 0 | U86: =IF(RC1="","",IF(OR(R8C<=ROUND(DAYS360(ValDat,RC1,0)/30,0),R8C>ROUND(DAYS360(ExpDat,RC1,0)/30,0)),0,OFFSET(R45C,MAX(-MNR,ROUND(DAYS360(ValDat,RC1,0)/30,0)-R8C+MEP-MNR),0,1,1))) -> 0 | V86: =IF(RC1="","",IF(OR(R8C<=ROUND(DAYS360(ValDat,RC1,0)/30,0),R8C>ROUND(DAYS360(ExpDat,RC1,0)/30,0)),0,OFFSET(R45C,MAX(-MNR,ROUND(DAYS360(ValDat,RC1,0)/30,0)-R8C+MEP-MNR),0,1,1))) -> 0 | W86: =IF(RC1="","",IF(OR(R8C<=ROUND(DAYS360(ValDat,RC1,0)/30,0),R8C>ROUND(DAYS360(ExpDat,RC1,0)/30,0)),0,OFFSET(R45C,MAX(-MNR,ROUND(DAYS360(ValDat,RC1,0)/30,0)-R8C+MEP-MNR),0,1,1))) -> 0 | X86: =IF(RC1="","",IF(OR(R8C<=ROUND(DAYS360(ValDat,RC1,0)/30,0),R8C>ROUND(DAYS360(ExpDat,RC1,0)/30,0)),0,OFFSET(R45C,MAX(-MNR,ROUND(DAYS360(ValDat,RC1,0)/30,0)-R8C+MEP-MNR),0,1,1))) -> 0 | Y86: =IF(RC1="","",IF(OR(R8C<=ROUND(DAYS360(ValDat,RC1,0)/30,0),R8C>ROUND(DAYS360(ExpDat,RC1,0)/30,0)),0,OFFSET(R45C,MAX(-MNR,ROUND(DAYS360(ValDat,RC1,0)/30,0)-R8C+MEP-MNR),0,1,1))) -> 0 | Z86: =IF(RC1="","",IF(OR(R8C<=ROUND(DAYS360(ValDat,RC1,0)/30,0),R8C>ROUND(DAYS360(ExpDat,RC1,0)/30,0)),0,OFFSET(R45C,MAX(-MNR,ROUND(DAYS360(ValDat,RC1,0)/30,0)-R8C+MEP-MNR),0,1,1))) -> 0 | AA86: =IF(RC1="","",IF(OR(R8C<=ROUND(DAYS360(ValDat,RC1,0)/30,0),R8C>ROUND(DAYS360(ExpDat,RC1,0)/30,0)),0,OFFSET(R45C,MAX(-MNR,ROUND(DAYS360(ValDat,RC1,0)/30,0)-R8C+MEP-MNR),0,1,1))) -> 0 | AB86: =IF(RC1="","",IF(OR(R8C<=ROUND(DAYS360(ValDat,RC1,0)/30,0),R8C>ROUND(DAYS360(ExpDat,RC1,0)/30,0)),0,OFFSET(R45C,MAX(-MNR,ROUND(DAYS360(ValDat,RC1,0)/30,0)-R8C+MEP-MNR),0,1,1))) -> 0 | AC86: =IF(RC1="","",IF(OR(R8C<=ROUND(DAYS360(ValDat,RC1,0)/30,0),R8C>ROUND(DAYS360(ExpDat,RC1,0)/30,0)),0,OFFSET(R45C,MAX(-MNR,ROUND(DAYS360(ValDat,RC1,0)/30,0)-R8C+MEP-MNR),0,1,1))) -> 0 | AD86: =IF(RC1="","",IF(OR(R8C<=ROUND(DAYS360(ValDat,RC1,0)/30,0),R8C>ROUND(DAYS360(ExpDat,RC1,0)/30,0)),0,OFFSET(R45C,MAX(-MNR,ROUND(DAYS360(ValDat,RC1,0)/30,0)-R8C+MEP-MNR),0,1,1))) -> 0 | AE86: =IF(RC1="","",IF(OR(R8C<=ROUND(DAYS360(ValDat,RC1,0)/30,0),R8C>ROUND(DAYS360(ExpDat,RC1,0)/30,0)),0,OFFSET(R45C,MAX(-MNR,ROUND(DAYS360(ValDat,RC1,0)/30,0)-R8C+MEP-MNR),0,1,1))) -> 0 | AF86: =IF(RC1="","",IF(OR(R8C<=ROUND(DAYS360(ValDat,RC1,0)/30,0),R8C>ROUND(DAYS360(ExpDat,RC1,0)/30,0)),0,OFFSET(R45C,MAX(-MNR,ROUND(DAYS360(ValDat,RC1,0)/30,0)-R8C+MEP-MNR),0,1,1))) -> 0 | AG86: =IF(RC1="","",IF(OR(R8C<=ROUND(DAYS360(ValDat,RC1,0)/30,0),R8C>ROUND(DAYS360(ExpDat,RC1,0)/30,0)),0,OFFSET(R45C,MAX(-MNR,ROUND(DAYS360(ValDat,RC1,0)/30,0)-R8C+MEP-MNR),0,1,1))) -> 0 | AH86: =IF(RC1="","",IF(OR(R8C<=ROUND(DAYS360(ValDat,RC1,0)/30,0),R8C>ROUND(DAYS360(ExpDat,RC1,0)/30,0)),0,OFFSET(R45C,MAX(-MNR,ROUND(DAYS360(ValDat,RC1,0)/30,0)-R8C+MEP-MNR),0,1,1))) -> 0 | AI86: =IF(RC1="","",IF(OR(R8C<=ROUND(DAYS360(ValDat,RC1,0)/30,0),R8C>ROUND(DAYS360(ExpDat,RC1,0)/30,0)),0,OFFSET(R45C,MAX(-MNR,ROUND(DAYS360(ValDat,RC1,0)/30,0)-R8C+MEP-MNR),0,1,1))) -> 0 | AJ86: =IF(RC1="","",IF(OR(R8C<=ROUND(DAYS360(ValDat,RC1,0)/30,0),R8C>ROUND(DAYS360(ExpDat,RC1,0)/30,0)),0,OFFSET(R45C,MAX(-MNR,ROUND(DAYS360(ValDat,RC1,0)/30,0)-R8C+MEP-MNR),0,1,1))) -> 0 | AK86: =IF(RC1="","",IF(OR(R8C<=ROUND(DAYS360(ValDat,RC1,0)/30,0),R8C>ROUND(DAYS360(ExpDat,RC1,0)/30,0)),0,OFFSET(R45C,MAX(-MNR,ROUND(DAYS360(ValDat,RC1,0)/30,0)-R8C+MEP-MNR),0,1,1))) -> 0 | AL86: =IF(RC1="","",IF(OR(R8C<=ROUND(DAYS360(ValDat,RC1,0)/30,0),R8C>ROUND(DAYS360(ExpDat,RC1,0)/30,0)),0,OFFSET(R45C,MAX(-MNR,ROUND(DAYS360(ValDat,RC1,0)/30,0)-R8C+MEP-MNR),0,1,1))) -> 0 | AM86: =IF(RC1="","",IF(OR(R8C<=ROUND(DAYS360(ValDat,RC1,0)/30,0),R8C>ROUND(DAYS360(ExpDat,RC1,0)/30,0)),0,OFFSET(R45C,MAX(-MNR,ROUND(DAYS360(ValDat,RC1,0)/30,0)-R8C+MEP-MNR),0,1,1))) -> 0 | AN86: =IF(RC1="","",IF(OR(R8C<=ROUND(DAYS360(ValDat,RC1,0)/30,0),R8C>ROUND(DAYS360(ExpDat,RC1,0)/30,0)),0,OFFSET(R45C,MAX(-MNR,ROUND(DAYS360(ValDat,RC1,0)/30,0)-R8C+MEP-MNR),0,1,1))) -> 0 | AO86: =IF(RC1="","",IF(OR(R8C<=ROUND(DAYS360(ValDat,RC1,0)/30,0),R8C>ROUND(DAYS360(ExpDat,RC1,0)/30,0)),0,OFFSET(R45C,MAX(-MNR,ROUND(DAYS360(ValDat,RC1,0)/30,0)-R8C+MEP-MNR),0,1,1))) -> 0
A87: =IF(R[-1]C="","",IF(EOMONTH(R[-1]C,0)+1>RunDat,"",EOMONTH(R[-1]C,0)+1)) -> 2001-01-01T00:00:00.000 | D87: =IF(RC1="","",SUM(RC[2]:RC[37])) -> 209740 | F87: =IF(RC1="","",IF(OR(R8C<=ROUND(DAYS360(ValDat,RC1,0)/30,0),R8C>ROUND(DAYS360(ExpDat,RC1,0)/30,0)),0,OFFSET(R45C,MAX(-MNR,ROUND(DAYS360(ValDat,RC1,0)/30,0)-R8C+MEP-MNR),0,1,1))) -> 19993 | G87: =IF(RC1="","",IF(OR(R8C<=ROUND(DAYS360(ValDat,RC1,0)/30,0),R8C>ROUND(DAYS360(ExpDat,RC1,0)/30,0)),0,OFFSET(R45C,MAX(-MNR,ROUND(DAYS360(ValDat,RC1,0)/30,0)-R8C+MEP-MNR),0,1,1))) -> 66303 | H87: =IF(RC1="","",IF(OR(R8C<=ROUND(DAYS360(ValDat,RC1,0)/30,0),R8C>ROUND(DAYS360(ExpDat,RC1,0)/30,0)),0,OFFSET(R45C,MAX(-MNR,ROUND(DAYS360(ValDat,RC1,0)/30,0)-R8C+MEP-MNR),0,1,1))) -> 56350 | I87: =IF(RC1="","",IF(OR(R8C<=ROUND(DAYS360(ValDat,RC1,0)/30,0),R8C>ROUND(DAYS360(ExpDat,RC1,0)/30,0)),0,OFFSET(R45C,MAX(-MNR,ROUND(DAYS360(ValDat,RC1,0)/30,0)-R8C+MEP-MNR),0,1,1))) -> 34631 | J87: =IF(RC1="","",IF(OR(R8C<=ROUND(DAYS360(ValDat,RC1,0)/30,0),R8C>ROUND(DAYS360(ExpDat,RC1,0)/30,0)),0,OFFSET(R45C,MAX(-MNR,ROUND(DAYS360(ValDat,RC1,0)/30,0)-R8C+MEP-MNR),0,1,1))) -> 1840 | K87: =IF(RC1="","",IF(OR(R8C<=ROUND(DAYS360(ValDat,RC1,0)/30,0),R8C>ROUND(DAYS360(ExpDat,RC1,0)/30,0)),0,OFFSET(R45C,MAX(-MNR,ROUND(DAYS360(ValDat,RC1,0)/30,0)-R8C+MEP-MNR),0,1,1))) -> 14411 | L87: =IF(RC1="","",IF(OR(R8C<=ROUND(DAYS360(ValDat,RC1,0)/30,0),R8C>ROUND(DAYS360(ExpDat,RC1,0)/30,0)),0,OFFSET(R45C,MAX(-MNR,ROUND(DAYS360(ValDat,RC1,0)/30,0)-R8C+MEP-MNR),0,1,1))) -> 7260 | M87: =IF(RC1="","",IF(OR(R8C<=ROUND(DAYS360(ValDat,RC1,0)/30,0),R8C>ROUND(DAYS360(ExpDat,RC1,0)/30,0)),0,OFFSET(R45C,MAX(-MNR,ROUND(DAYS360(ValDat,RC1,0)/30,0)-R8C+MEP-MNR),0,1,1))) -> 472 | N87: =IF(RC1="","",IF(OR(R8C<=ROUND(DAYS360(ValDat,RC1,0)/30,0),R8C>ROUND(DAYS360(ExpDat,RC1,0)/30,0)),0,OFFSET(R45C,MAX(-MNR,ROUND(DAYS360(ValDat,RC1,0)/30,0)-R8C+MEP-MNR),0,1,1))) -> 116 | O87: =IF(RC1="","",IF(OR(R8C<=ROUND(DAYS360(ValDat,RC1,0)/30,0),R8C>ROUND(DAYS360(ExpDat,RC1,0)/30,0)),0,OFFSET(R45C,MAX(-MNR,ROUND(DAYS360(ValDat,RC1,0)/30,0)-R8C+MEP-MNR),0,1,1))) -> 1600 | P87: =IF(RC1="","",IF(OR(R8C<=ROUND(DAYS360(ValDat,RC1,0)/30,0),R8C>ROUND(DAYS360(ExpDat,RC1,0)/30,0)),0,OFFSET(R45C,MAX(-MNR,ROUND(DAYS360(ValDat,RC1,0)/30,0)-R8C+MEP-MNR),0,1,1))) -> 195 | Q87: =IF(RC1="","",IF(OR(R8C<=ROUND(DAYS360(ValDat,RC1,0)/30,0),R8C>ROUND(DAYS360(ExpDat,RC1,0)/30,0)),0,OFFSET(R45C,MAX(-MNR,ROUND(DAYS360(ValDat,RC1,0)/30,0)-R8C+MEP-MNR),0,1,1))) -> 6427 | R87: =IF(RC1="","",IF(OR(R8C<=ROUND(DAYS360(ValDat,RC1,0)/30,0),R8C>ROUND(DAYS360(ExpDat,RC1,0)/30,0)),0,OFFSET(R45C,MAX(-MNR,ROUND(DAYS360(ValDat,RC1,0)/30,0)-R8C+MEP-MNR),0,1,1))) -> 142 | S87: =IF(RC1="","",IF(OR(R8C<=ROUND(DAYS360(ValDat,RC1,0)/30,0),R8C>ROUND(DAYS360(ExpDat,RC1,0)/30,0)),0,OFFSET(R45C,MAX(-MNR,ROUND(DAYS360(ValDat,RC1,0)/30,0)-R8C+MEP-MNR),0,1,1))) -> 0 | T87: =IF(RC1="","",IF(OR(R8C<=ROUND(DAYS360(ValDat,RC1,0)/30,0),R8C>ROUND(DAYS360(ExpDat,RC1,0)/30,0)),0,OFFSET(R45C,MAX(-MNR,ROUND(DAYS360(ValDat,RC1,0)/30,0)-R8C+MEP-MNR),0,1,1))) -> 0 | U87: =IF(RC1="","",IF(OR(R8C<=ROUND(DAYS360(ValDat,RC1,0)/30,0),R8C>ROUND(DAYS360(ExpDat,RC1,0)/30,0)),0,OFFSET(R45C,MAX(-MNR,ROUND(DAYS360(ValDat,RC1,0)/30,0)-R8C+MEP-MNR),0,1,1))) -> 0 | V87: =IF(RC1="","",IF(OR(R8C<=ROUND(DAYS360(ValDat,RC1,0)/30,0),R8C>ROUND(DAYS360(ExpDat,RC1,0)/30,0)),0,OFFSET(R45C,MAX(-MNR,ROUND(DAYS360(ValDat,RC1,0)/30,0)-R8C+MEP-MNR),0,1,1))) -> 0 | W87: =IF(RC1="","",IF(OR(R8C<=ROUND(DAYS360(ValDat,RC1,0)/30,0),R8C>ROUND(DAYS360(ExpDat,RC1,0)/30,0)),0,OFFSET(R45C,MAX(-MNR,ROUND(DAYS360(ValDat,RC1,0)/30,0)-R8C+MEP-MNR),0,1,1))) -> 0 | X87: =IF(RC1="","",IF(OR(R8C<=ROUND(DAYS360(ValDat,RC1,0)/30,0),R8C>ROUND(DAYS360(ExpDat,RC1,0)/30,0)),0,OFFSET(R45C,MAX(-MNR,ROUND(DAYS360(ValDat,RC1,0)/30,0)-R8C+MEP-MNR),0,1,1))) -> 0 | Y87: =IF(RC1="","",IF(OR(R8C<=ROUND(DAYS360(ValDat,RC1,0)/30,0),R8C>ROUND(DAYS360(ExpDat,RC1,0)/30,0)),0,OFFSET(R45C,MAX(-MNR,ROUND(DAYS360(ValDat,RC1,0)/30,0)-R8C+MEP-MNR),0,1,1))) -> 0 | Z87: =IF(RC1="","",IF(OR(R8C<=ROUND(DAYS360(ValDat,RC1,0)/30,0),R8C>ROUND(DAYS360(ExpDat,RC1,0)/30,0)),0,OFFSET(R45C,MAX(-MNR,ROUND(DAYS360(ValDat,RC1,0)/30,0)-R8C+MEP-MNR),0,1,1))) -> 0 | AA87: =IF(RC1="","",IF(OR(R8C<=ROUND(DAYS360(ValDat,RC1,0)/30,0),R8C>ROUND(DAYS360(ExpDat,RC1,0)/30,0)),0,OFFSET(R45C,MAX(-MNR,ROUND(DAYS360(ValDat,RC1,0)/30,0)-R8C+MEP-MNR),0,1,1))) -> 0 | AB87: =IF(RC1="","",IF(OR(R8C<=ROUND(DAYS360(ValDat,RC1,0)/30,0),R8C>ROUND(DAYS360(ExpDat,RC1,0)/30,0)),0,OFFSET(R45C,MAX(-MNR,ROUND(DAYS360(ValDat,RC1,0)/30,0)-R8C+MEP-MNR),0,1,1))) -> 0 | AC87: =IF(RC1="","",IF(OR(R8C<=ROUND(DAYS360(ValDat,RC1,0)/30,0),R8C>ROUND(DAYS360(ExpDat,RC1,0)/30,0)),0,OFFSET(R45C,MAX(-MNR,ROUND(DAYS360(ValDat,RC1,0)/30,0)-R8C+MEP-MNR),0,1,1))) -> 0 | AD87: =IF(RC1="","",IF(OR(R8C<=ROUND(DAYS360(ValDat,RC1,0)/30,0),R8C>ROUND(DAYS360(ExpDat,RC1,0)/30,0)),0,OFFSET(R45C,MAX(-MNR,ROUND(DAYS360(ValDat,RC1,0)/30,0)-R8C+MEP-MNR),0,1,1))) -> 0 | AE87: =IF(RC1="","",IF(OR(R8C<=ROUND(DAYS360(ValDat,RC1,0)/30,0),R8C>ROUND(DAYS360(ExpDat,RC1,0)/30,0)),0,OFFSET(R45C,MAX(-MNR,ROUND(DAYS360(ValDat,RC1,0)/30,0)-R8C+MEP-MNR),0,1,1))) -> 0 | AF87: =IF(RC1="","",IF(OR(R8C<=ROUND(DAYS360(ValDat,RC1,0)/30,0),R8C>ROUND(DAYS360(ExpDat,RC1,0)/30,0)),0,OFFSET(R45C,MAX(-MNR,ROUND(DAYS360(ValDat,RC1,0)/30,0)-R8C+MEP-MNR),0,1,1))) -> 0 | AG87: =IF(RC1="","",IF(OR(R8C<=ROUND(DAYS360(ValDat,RC1,0)/30,0),R8C>ROUND(DAYS360(ExpDat,RC1,0)/30,0)),0,OFFSET(R45C,MAX(-MNR,ROUND(DAYS360(ValDat,RC1,0)/30,0)-R8C+MEP-MNR),0,1,1))) -> 0 | AH87: =IF(RC1="","",IF(OR(R8C<=ROUND(DAYS360(ValDat,RC1,0)/30,0),R8C>ROUND(DAYS360(ExpDat,RC1,0)/30,0)),0,OFFSET(R45C,MAX(-MNR,ROUND(DAYS360(ValDat,RC1,0)/30,0)-R8C+MEP-MNR),0,1,1))) -> 0 | AI87: =IF(RC1="","",IF(OR(R8C<=ROUND(DAYS360(ValDat,RC1,0)/30,0),R8C>ROUND(DAYS360(ExpDat,RC1,0)/30,0)),0,OFFSET(R45C,MAX(-MNR,ROUND(DAYS360(ValDat,RC1,0)/30,0)-R8C+MEP-MNR),0,1,1))) -> 0 | AJ87: =IF(RC1="","",IF(OR(R8C<=ROUND(DAYS360(ValDat,RC1,0)/30,0),R8C>ROUND(DAYS360(ExpDat,RC1,0)/30,0)),0,OFFSET(R45C,MAX(-MNR,ROUND(DAYS360(ValDat,RC1,0)/30,0)-R8C+MEP-MNR),0,1,1))) -> 0 | AK87: =IF(RC1="","",IF(OR(R8C<=ROUND(DAYS360(ValDat,RC1,0)/30,0),R8C>ROUND(DAYS360(ExpDat,RC1,0)/30,0)),0,OFFSET(R45C,MAX(-MNR,ROUND(DAYS360(ValDat,RC1,0)/30,0)-R8C+MEP-MNR),0,1,1))) -> 0 | AL87: =IF(RC1="","",IF(OR(R8C<=ROUND(DAYS360(ValDat,RC1,0)/30,0),R8C>ROUND(DAYS360(ExpDat,RC1,0)/30,0)),0,OFFSET(R45C,MAX(-MNR,ROUND(DAYS360(ValDat,RC1,0)/30,0)-R8C+MEP-MNR),0,1,1))) -> 0 | AM87: =IF(RC1="","",IF(OR(R8C<=ROUND(DAYS360(ValDat,RC1,0)/30,0),R8C>ROUND(DAYS360(ExpDat,RC1,0)/30,0)),0,OFFSET(R45C,MAX(-MNR,ROUND(DAYS360(ValDat,RC1,0)/30,0)-R8C+MEP-MNR),0,1,1))) -> 0 | AN87: =IF(RC1="","",IF(OR(R8C<=ROUND(DAYS360(ValDat,RC1,0)/30,0),R8C>ROUND(DAYS360(ExpDat,RC1,0)/30,0)),0,OFFSET(R45C,MAX(-MNR,ROUND(DAYS360(ValDat,RC1,0)/30,0)-R8C+MEP-MNR),0,1,1))) -> 0 | AO87: =IF(RC1="","",IF(OR(R8C<=ROUND(DAYS360(ValDat,RC1,0)/30,0),R8C>ROUND(DAYS360(ExpDat,RC1,0)/30,0)),0,OFFSET(R45C,MAX(-MNR,ROUND(DAYS360(ValDat,RC1,0)/30,0)-R8C+MEP-MNR),0,1,1))) -> 0
A88: =IF(R[-1]C="","",IF(EOMONTH(R[-1]C,0)+1>RunDat,"",EOMONTH(R[-1]C,0)+1)) -> 2001-02-01T00:00:00.000 | D88: =IF(RC1="","",SUM(RC[2]:RC[37])) -> 159131 | F88: =IF(RC1="","",IF(OR(R8C<=ROUND(DAYS360(ValDat,RC1,0)/30,0),R8C>ROUND(DAYS360(ExpDat,RC1,0)/30,0)),0,OFFSET(R45C,MAX(-MNR,ROUND(DAYS360(ValDat,RC1,0)/30,0)-R8C+MEP-MNR),0,1,1))) -> 240 | G88: =IF(RC1="","",IF(OR(R8C<=ROUND(DAYS360(ValDat,RC1,0)/30,0),R8C>ROUND(DAYS360(ExpDat,RC1,0)/30,0)),0,OFFSET(R45C,MAX(-MNR,ROUND(DAYS360(ValDat,RC1,0)/30,0)-R8C+MEP-MNR),0,1,1))) -> 59964 | H88: =IF(RC1="","",IF(OR(R8C<=ROUND(DAYS360(ValDat,RC1,0)/30,0),R8C>ROUND(DAYS360(ExpDat,RC1,0)/30,0)),0,OFFSET(R45C,MAX(-MNR,ROUND(DAYS360(ValDat,RC1,0)/30,0)-R8C+MEP-MNR),0,1,1))) -> 37667 | I88: =IF(RC1="","",IF(OR(R8C<=ROUND(DAYS360(ValDat,RC1,0)/30,0),R8C>ROUND(DAYS360(ExpDat,RC1,0)/30,0)),0,OFFSET(R45C,MAX(-MNR,ROUND(DAYS360(ValDat,RC1,0)/30,0)-R8C+MEP-MNR),0,1,1))) -> 6484 | J88: =IF(RC1="","",IF(OR(R8C<=ROUND(DAYS360(ValDat,RC1,0)/30,0),R8C>ROUND(DAYS360(ExpDat,RC1,0)/30,0)),0,OFFSET(R45C,MAX(-MNR,ROUND(DAYS360(ValDat,RC1,0)/30,0)-R8C+MEP-MNR),0,1,1))) -> 9161 | K88: =IF(RC1="","",IF(OR(R8C<=ROUND(DAYS360(ValDat,RC1,0)/30,0),R8C>ROUND(DAYS360(ExpDat,RC1,0)/30,0)),0,OFFSET(R45C,MAX(-MNR,ROUND(DAYS360(ValDat,RC1,0)/30,0)-R8C+MEP-MNR),0,1,1))) -> 934 | L88: =IF(RC1="","",IF(OR(R8C<=ROUND(DAYS360(ValDat,RC1,0)/30,0),R8C>ROUND(DAYS360(ExpDat,RC1,0)/30,0)),0,OFFSET(R45C,MAX(-MNR,ROUND(DAYS360(ValDat,RC1,0)/30,0)-R8C+MEP-MNR),0,1,1))) -> 14223 | M88: =IF(RC1="","",IF(OR(R8C<=ROUND(DAYS360(ValDat,RC1,0)/30,0),R8C>ROUND(DAYS360(ExpDat,RC1,0)/30,0)),0,OFFSET(R45C,MAX(-MNR,ROUND(DAYS360(ValDat,RC1,0)/30,0)-R8C+MEP-MNR),0,1,1))) -> 300 | N88: =IF(RC1="","",IF(OR(R8C<=ROUND(DAYS360(ValDat,RC1,0)/30,0),R8C>ROUND(DAYS360(ExpDat,RC1,0)/30,0)),0,OFFSET(R45C,MAX(-MNR,ROUND(DAYS360(ValDat,RC1,0)/30,0)-R8C+MEP-MNR),0,1,1))) -> 32 | O88: =IF(RC1="","",IF(OR(R8C<=ROUND(DAYS360(ValDat,RC1,0)/30,0),R8C>ROUND(DAYS360(ExpDat,RC1,0)/30,0)),0,OFFSET(R45C,MAX(-MNR,ROUND(DAYS360(ValDat,RC1,0)/30,0)-R8C+MEP-MNR),0,1,1))) -> 1712 | P88: =IF(RC1="","",IF(OR(R8C<=ROUND(DAYS360(ValDat,RC1,0)/30,0),R8C>ROUND(DAYS360(ExpDat,RC1,0)/30,0)),0,OFFSET(R45C,MAX(-MNR,ROUND(DAYS360(ValDat,RC1,0)/30,0)-R8C+MEP-MNR),0,1,1))) -> 112 | Q88: =IF(RC1="","",IF(OR(R8C<=ROUND(DAYS360(ValDat,RC1,0)/30,0),R8C>ROUND(DAYS360(ExpDat,RC1,0)/30,0)),0,OFFSET(R45C,MAX(-MNR,ROUND(DAYS360(ValDat,RC1,0)/30,0)-R8C+MEP-MNR),0,1,1))) -> 16998 | R88: =IF(RC1="","",IF(OR(R8C<=ROUND(DAYS360(ValDat,RC1,0)/30,0),R8C>ROUND(DAYS360(ExpDat,RC1,0)/30,0)),0,OFFSET(R45C,MAX(-MNR,ROUND(DAYS360(ValDat,RC1,0)/30,0)-R8C+MEP-MNR),0,1,1))) -> 11304 | S88: =IF(RC1="","",IF(OR(R8C<=ROUND(DAYS360(ValDat,RC1,0)/30,0),R8C>ROUND(DAYS360(ExpDat,RC1,0)/30,0)),0,OFFSET(R45C,MAX(-MNR,ROUND(DAYS360(ValDat,RC1,0)/30,0)-R8C+MEP-MNR),0,1,1))) -> 0 | T88: =IF(RC1="","",IF(OR(R8C<=ROUND(DAYS360(ValDat,RC1,0)/30,0),R8C>ROUND(DAYS360(ExpDat,RC1,0)/30,0)),0,OFFSET(R45C,MAX(-MNR,ROUND(DAYS360(ValDat,RC1,0)/30,0)-R8C+MEP-MNR),0,1,1))) -> 0 | U88: =IF(RC1="","",IF(OR(R8C<=ROUND(DAYS360(ValDat,RC1,0)/30,0),R8C>ROUND(DAYS360(ExpDat,RC1,0)/30,0)),0,OFFSET(R45C,MAX(-MNR,ROUND(DAYS360(ValDat,RC1,0)/30,0)-R8C+MEP-MNR),0,1,1))) -> 0 | V88: =IF(RC1="","",IF(OR(R8C<=ROUND(DAYS360(ValDat,RC1,0)/30,0),R8C>ROUND(DAYS360(ExpDat,RC1,0)/30,0)),0,OFFSET(R45C,MAX(-MNR,ROUND(DAYS360(ValDat,RC1,0)/30,0)-R8C+MEP-MNR),0,1,1))) -> 0 | W88: =IF(RC1="","",IF(OR(R8C<=ROUND(DAYS360(ValDat,RC1,0)/30,0),R8C>ROUND(DAYS360(ExpDat,RC1,0)/30,0)),0,OFFSET(R45C,MAX(-MNR,ROUND(DAYS360(ValDat,RC1,0)/30,0)-R8C+MEP-MNR),0,1,1))) -> 0 | X88: =IF(RC1="","",IF(OR(R8C<=ROUND(DAYS360(ValDat,RC1,0)/30,0),R8C>ROUND(DAYS360(ExpDat,RC1,0)/30,0)),0,OFFSET(R45C,MAX(-MNR,ROUND(DAYS360(ValDat,RC1,0)/30,0)-R8C+MEP-MNR),0,1,1))) -> 0 | Y88: =IF(RC1="","",IF(OR(R8C<=ROUND(DAYS360(ValDat,RC1,0)/30,0),R8C>ROUND(DAYS360(ExpDat,RC1,0)/30,0)),0,OFFSET(R45C,MAX(-MNR,ROUND(DAYS360(ValDat,RC1,0)/30,0)-R8C+MEP-MNR),0,1,1))) -> 0 | Z88: =IF(RC1="","",IF(OR(R8C<=ROUND(DAYS360(ValDat,RC1,0)/30,0),R8C>ROUND(DAYS360(ExpDat,RC1,0)/30,0)),0,OFFSET(R45C,MAX(-MNR,ROUND(DAYS360(ValDat,RC1,0)/30,0)-R8C+MEP-MNR),0,1,1))) -> 0 | AA88: =IF(RC1="","",IF(OR(R8C<=ROUND(DAYS360(ValDat,RC1,0)/30,0),R8C>ROUND(DAYS360(ExpDat,RC1,0)/30,0)),0,OFFSET(R45C,MAX(-MNR,ROUND(DAYS360(ValDat,RC1,0)/30,0)-R8C+MEP-MNR),0,1,1))) -> 0 | AB88: =IF(RC1="","",IF(OR(R8C<=ROUND(DAYS360(ValDat,RC1,0)/30,0),R8C>ROUND(DAYS360(ExpDat,RC1,0)/30,0)),0,OFFSET(R45C,MAX(-MNR,ROUND(DAYS360(ValDat,RC1,0)/30,0)-R8C+MEP-MNR),0,1,1))) -> 0 | AC88: =IF(RC1="","",IF(OR(R8C<=ROUND(DAYS360(ValDat,RC1,0)/30,0),R8C>ROUND(DAYS360(ExpDat,RC1,0)/30,0)),0,OFFSET(R45C,MAX(-MNR,ROUND(DAYS360(ValDat,RC1,0)/30,0)-R8C+MEP-MNR),0,1,1))) -> 0 | AD88: =IF(RC1="","",IF(OR(R8C<=ROUND(DAYS360(ValDat,RC1,0)/30,0),R8C>ROUND(DAYS360(ExpDat,RC1,0)/30,0)),0,OFFSET(R45C,MAX(-MNR,ROUND(DAYS360(ValDat,RC1,0)/30,0)-R8C+MEP-MNR),0,1,1))) -> 0 | AE88: =IF(RC1="","",IF(OR(R8C<=ROUND(DAYS360(ValDat,RC1,0)/30,0),R8C>ROUND(DAYS360(ExpDat,RC1,0)/30,0)),0,OFFSET(R45C,MAX(-MNR,ROUND(DAYS360(ValDat,RC1,0)/30,0)-R8C+MEP-MNR),0,1,1))) -> 0 | AF88: =IF(RC1="","",IF(OR(R8C<=ROUND(DAYS360(ValDat,RC1,0)/30,0),R8C>ROUND(DAYS360(ExpDat,RC1,0)/30,0)),0,OFFSET(R45C,MAX(-MNR,ROUND(DAYS360(ValDat,RC1,0)/30,0)-R8C+MEP-MNR),0,1,1))) -> 0 | AG88: =IF(RC1="","",IF(OR(R8C<=ROUND(DAYS360(ValDat,RC1,0)/30,0),R8C>ROUND(DAYS360(ExpDat,RC1,0)/30,0)),0,OFFSET(R45C,MAX(-MNR,ROUND(DAYS360(ValDat,RC1,0)/30,0)-R8C+MEP-MNR),0,1,1))) -> 0 | AH88: =IF(RC1="","",IF(OR(R8C<=ROUND(DAYS360(ValDat,RC1,0)/30,0),R8C>ROUND(DAYS360(ExpDat,RC1,0)/30,0)),0,OFFSET(R45C,MAX(-MNR,ROUND(DAYS360(ValDat,RC1,0)/30,0)-R8C+MEP-MNR),0,1,1))) -> 0 | AI88: =IF(RC1="","",IF(OR(R8C<=ROUND(DAYS360(ValDat,RC1,0)/30,0),R8C>ROUND(DAYS360(ExpDat,RC1,0)/30,0)),0,OFFSET(R45C,MAX(-MNR,ROUND(DAYS360(ValDat,RC1,0)/30,0)-R8C+MEP-MNR),0,1,1))) -> 0 | AJ88: =IF(RC1="","",IF(OR(R8C<=ROUND(DAYS360(ValDat,RC1,0)/30,0),R8C>ROUND(DAYS360(ExpDat,RC1,0)/30,0)),0,OFFSET(R45C,MAX(-MNR,ROUND(DAYS360(ValDat,RC1,0)/30,0)-R8C+MEP-MNR),0,1,1))) -> 0 | AK88: =IF(RC1="","",IF(OR(R8C<=ROUND(DAYS360(ValDat,RC1,0)/30,0),R8C>ROUND(DAYS360(ExpDat,RC1,0)/30,0)),0,OFFSET(R45C,MAX(-MNR,ROUND(DAYS360(ValDat,RC1,0)/30,0)-R8C+MEP-MNR),0,1,1))) -> 0 | AL88: =IF(RC1="","",IF(OR(R8C<=ROUND(DAYS360(ValDat,RC1,0)/30,0),R8C>ROUND(DAYS360(ExpDat,RC1,0)/30,0)),0,OFFSET(R45C,MAX(-MNR,ROUND(DAYS360(ValDat,RC1,0)/30,0)-R8C+MEP-MNR),0,1,1))) -> 0 | AM88: =IF(RC1="","",IF(OR(R8C<=ROUND(DAYS360(ValDat,RC1,0)/30,0),R8C>ROUND(DAYS360(ExpDat,RC1,0)/30,0)),0,OFFSET(R45C,MAX(-MNR,ROUND(DAYS360(ValDat,RC1,0)/30,0)-R8C+MEP-MNR),0,1,1))) -> 0 | AN88: =IF(RC1="","",IF(OR(R8C<=ROUND(DAYS360(ValDat,RC1,0)/30,0),R8C>ROUND(DAYS360(ExpDat,RC1,0)/30,0)),0,OFFSET(R45C,MAX(-MNR,ROUND(DAYS360(ValDat,RC1,0)/30,0)-R8C+MEP-MNR),0,1,1))) -> 0 | AO88: =IF(RC1="","",IF(OR(R8C<=ROUND(DAYS360(ValDat,RC1,0)/30,0),R8C>ROUND(DAYS360(ExpDat,RC1,0)/30,0)),0,OFFSET(R45C,MAX(-MNR,ROUND(DAYS360(ValDat,RC1,0)/30,0)-R8C+MEP-MNR),0,1,1))) -> 0
A89: =IF(R[-1]C="","",IF(EOMONTH(R[-1]C,0)+1>RunDat,"",EOMONTH(R[-1]C,0)+1)) -> 2001-03-01T00:00:00.000 | D89: =IF(RC1="","",SUM(RC[2]:RC[37])) -> 103237 | F89: =IF(RC1="","",IF(OR(R8C<=ROUND(DAYS360(ValDat,RC1,0)/30,0),R8C>ROUND(DAYS360(ExpDat,RC1,0)/30,0)),0,OFFSET(R45C,MAX(-MNR,ROUND(DAYS360(ValDat,RC1,0)/30,0)-R8C+MEP-MNR),0,1,1))) -> 9046 | G89: =IF(RC1="","",IF(OR(R8C<=ROUND(DAYS360(ValDat,RC1,0)/30,0),R8C>ROUND(DAYS360(ExpDat,RC1,0)/30,0)),0,OFFSET(R45C,MAX(-MNR,ROUND(DAYS360(ValDat,RC1,0)/30,0)-R8C+MEP-MNR),0,1,1))) -> 15910 | H89: =IF(RC1="","",IF(OR(R8C<=ROUND(DAYS360(ValDat,RC1,0)/30,0),R8C>ROUND(DAYS360(ExpDat,RC1,0)/30,0)),0,OFFSET(R45C,MAX(-MNR,ROUND(DAYS360(ValDat,RC1,0)/30,0)-R8C+MEP-MNR),0,1,1))) -> 35539 | I89: =IF(RC1="","",IF(OR(R8C<=ROUND(DAYS360(ValDat,RC1,0)/30,0),R8C>ROUND(DAYS360(ExpDat,RC1,0)/30,0)),0,OFFSET(R45C,MAX(-MNR,ROUND(DAYS360(ValDat,RC1,0)/30,0)-R8C+MEP-MNR),0,1,1))) -> 17053 | J89: =IF(RC1="","",IF(OR(R8C<=ROUND(DAYS360(ValDat,RC1,0)/30,0),R8C>ROUND(DAYS360(ExpDat,RC1,0)/30,0)),0,OFFSET(R45C,MAX(-MNR,ROUND(DAYS360(ValDat,RC1,0)/30,0)-R8C+MEP-MNR),0,1,1))) -> 7803 | K89: =IF(RC1="","",IF(OR(R8C<=ROUND(DAYS360(ValDat,RC1,0)/30,0),R8C>ROUND(DAYS360(ExpDat,RC1,0)/30,0)),0,OFFSET(R45C,MAX(-MNR,ROUND(DAYS360(ValDat,RC1,0)/30,0)-R8C+MEP-MNR),0,1,1))) -> 5596 | L89: =IF(RC1="","",IF(OR(R8C<=ROUND(DAYS360(ValDat,RC1,0)/30,0),R8C>ROUND(DAYS360(ExpDat,RC1,0)/30,0)),0,OFFSET(R45C,MAX(-MNR,ROUND(DAYS360(ValDat,RC1,0)/30,0)-R8C+MEP-MNR),0,1,1))) -> 13701 | M89: =IF(RC1="","",IF(OR(R8C<=ROUND(DAYS360(ValDat,RC1,0)/30,0),R8C>ROUND(DAYS360(ExpDat,RC1,0)/30,0)),0,OFFSET(R45C,MAX(-MNR,ROUND(DAYS360(ValDat,RC1,0)/30,0)-R8C+MEP-MNR),0,1,1))) -> -3390 | N89: =IF(RC1="","",IF(OR(R8C<=ROUND(DAYS360(ValDat,RC1,0)/30,0),R8C>ROUND(DAYS360(ExpDat,RC1,0)/30,0)),0,OFFSET(R45C,MAX(-MNR,ROUND(DAYS360(ValDat,RC1,0)/30,0)-R8C+MEP-MNR),0,1,1))) -> 32 | O89: =IF(RC1="","",IF(OR(R8C<=ROUND(DAYS360(ValDat,RC1,0)/30,0),R8C>ROUND(DAYS360(ExpDat,RC1,0)/30,0)),0,OFFSET(R45C,MAX(-MNR,ROUND(DAYS360(ValDat,RC1,0)/30,0)-R8C+MEP-MNR),0,1,1))) -> 239 | P89: =IF(RC1="","",IF(OR(R8C<=ROUND(DAYS360(ValDat,RC1,0)/30,0),R8C>ROUND(DAYS360(ExpDat,RC1,0)/30,0)),0,OFFSET(R45C,MAX(-MNR,ROUND(DAYS360(ValDat,RC1,0)/30,0)-R8C+MEP-MNR),0,1,1))) -> 166 | Q89: =IF(RC1="","",IF(OR(R8C<=ROUND(DAYS360(ValDat,RC1,0)/30,0),R8C>ROUND(DAYS360(ExpDat,RC1,0)/30,0)),0,OFFSET(R45C,MAX(-MNR,ROUND(DAYS360(ValDat,RC1,0)/30,0)-R8C+MEP-MNR),0,1,1))) -> 166 | R89: =IF(RC1="","",IF(OR(R8C<=ROUND(DAYS360(ValDat,RC1,0)/30,0),R8C>ROUND(DAYS360(ExpDat,RC1,0)/30,0)),0,OFFSET(R45C,MAX(-MNR,ROUND(DAYS360(ValDat,RC1,0)/30,0)-R8C+MEP-MNR),0,1,1))) -> 678 | S89: =IF(RC1="","",IF(OR(R8C<=ROUND(DAYS360(ValDat,RC1,0)/30,0),R8C>ROUND(DAYS360(ExpDat,RC1,0)/30,0)),0,OFFSET(R45C,MAX(-MNR,ROUND(DAYS360(ValDat,RC1,0)/30,0)-R8C+MEP-MNR),0,1,1))) -> 519 | T89: =IF(RC1="","",IF(OR(R8C<=ROUND(DAYS360(ValDat,RC1,0)/30,0),R8C>ROUND(DAYS360(ExpDat,RC1,0)/30,0)),0,OFFSET(R45C,MAX(-MNR,ROUND(DAYS360(ValDat,RC1,0)/30,0)-R8C+MEP-MNR),0,1,1))) -> 0 | U89: =IF(RC1="","",IF(OR(R8C<=ROUND(DAYS360(ValDat,RC1,0)/30,0),R8C>ROUND(DAYS360(ExpDat,RC1,0)/30,0)),0,OFFSET(R45C,MAX(-MNR,ROUND(DAYS360(ValDat,RC1,0)/30,0)-R8C+MEP-MNR),0,1,1))) -> 179 | V89: =IF(RC1="","",IF(OR(R8C<=ROUND(DAYS360(ValDat,RC1,0)/30,0),R8C>ROUND(DAYS360(ExpDat,RC1,0)/30,0)),0,OFFSET(R45C,MAX(-MNR,ROUND(DAYS360(ValDat,RC1,0)/30,0)-R8C+MEP-MNR),0,1,1))) -> 0 | W89: =IF(RC1="","",IF(OR(R8C<=ROUND(DAYS360(ValDat,RC1,0)/30,0),R8C>ROUND(DAYS360(ExpDat,RC1,0)/30,0)),0,OFFSET(R45C,MAX(-MNR,ROUND(DAYS360(ValDat,RC1,0)/30,0)-R8C+MEP-MNR),0,1,1))) -> 0 | X89: =IF(RC1="","",IF(OR(R8C<=ROUND(DAYS360(ValDat,RC1,0)/30,0),R8C>ROUND(DAYS360(ExpDat,RC1,0)/30,0)),0,OFFSET(R45C,MAX(-MNR,ROUND(DAYS360(ValDat,RC1,0)/30,0)-R8C+MEP-MNR),0,1,1))) -> 0 | Y89: =IF(RC1="","",IF(OR(R8C<=ROUND(DAYS360(ValDat,RC1,0)/30,0),R8C>ROUND(DAYS360(ExpDat,RC1,0)/30,0)),0,OFFSET(R45C,MAX(-MNR,ROUND(DAYS360(ValDat,RC1,0)/30,0)-R8C+MEP-MNR),0,1,1))) -> 0 | Z89: =IF(RC1="","",IF(OR(R8C<=ROUND(DAYS360(ValDat,RC1,0)/30,0),R8C>ROUND(DAYS360(ExpDat,RC1,0)/30,0)),0,OFFSET(R45C,MAX(-MNR,ROUND(DAYS360(ValDat,RC1,0)/30,0)-R8C+MEP-MNR),0,1,1))) -> 0 | AA89: =IF(RC1="","",IF(OR(R8C<=ROUND(DAYS360(ValDat,RC1,0)/30,0),R8C>ROUND(DAYS360(ExpDat,RC1,0)/30,0)),0,OFFSET(R45C,MAX(-MNR,ROUND(DAYS360(ValDat,RC1,0)/30,0)-R8C+MEP-MNR),0,1,1))) -> 0 | AB89: =IF(RC1="","",IF(OR(R8C<=ROUND(DAYS360(ValDat,RC1,0)/30,0),R8C>ROUND(DAYS360(ExpDat,RC1,0)/30,0)),0,OFFSET(R45C,MAX(-MNR,ROUND(DAYS360(ValDat,RC1,0)/30,0)-R8C+MEP-MNR),0,1,1))) -> 0 | AC89: =IF(RC1="","",IF(OR(R8C<=ROUND(DAYS360(ValDat,RC1,0)/30,0),R8C>ROUND(DAYS360(ExpDat,RC1,0)/30,0)),0,OFFSET(R45C,MAX(-MNR,ROUND(DAYS360(ValDat,RC1,0)/30,0)-R8C+MEP-MNR),0,1,1))) -> 0 | AD89: =IF(RC1="","",IF(OR(R8C<=ROUND(DAYS360(ValDat,RC1,0)/30,0),R8C>ROUND(DAYS360(ExpDat,RC1,0)/30,0)),0,OFFSET(R45C,MAX(-MNR,ROUND(DAYS360(ValDat,RC1,0)/30,0)-R8C+MEP-MNR),0,1,1))) -> 0 | AE89: =IF(RC1="","",IF(OR(R8C<=ROUND(DAYS360(ValDat,RC1,0)/30,0),R8C>ROUND(DAYS360(ExpDat,RC1,0)/30,0)),0,OFFSET(R45C,MAX(-MNR,ROUND(DAYS360(ValDat,RC1,0)/30,0)-R8C+MEP-MNR),0,1,1))) -> 0 | AF89: =IF(RC1="","",IF(OR(R8C<=ROUND(DAYS360(ValDat,RC1,0)/30,0),R8C>ROUND(DAYS360(ExpDat,RC1,0)/30,0)),0,OFFSET(R45C,MAX(-MNR,ROUND(DAYS360(ValDat,RC1,0)/30,0)-R8C+MEP-MNR),0,1,1))) -> 0 | AG89: =IF(RC1="","",IF(OR(R8C<=ROUND(DAYS360(ValDat,RC1,0)/30,0),R8C>ROUND(DAYS360(ExpDat,RC1,0)/30,0)),0,OFFSET(R45C,MAX(-MNR,ROUND(DAYS360(ValDat,RC1,0)/30,0)-R8C+MEP-MNR),0,1,1))) -> 0 | AH89: =IF(RC1="","",IF(OR(R8C<=ROUND(DAYS360(ValDat,RC1,0)/30,0),R8C>ROUND(DAYS360(ExpDat,RC1,0)/30,0)),0,OFFSET(R45C,MAX(-MNR,ROUND(DAYS360(ValDat,RC1,0)/30,0)-R8C+MEP-MNR),0,1,1))) -> 0 | AI89: =IF(RC1="","",IF(OR(R8C<=ROUND(DAYS360(ValDat,RC1,0)/30,0),R8C>ROUND(DAYS360(ExpDat,RC1,0)/30,0)),0,OFFSET(R45C,MAX(-MNR,ROUND(DAYS360(ValDat,RC1,0)/30,0)-R8C+MEP-MNR),0,1,1))) -> 0 | AJ89: =IF(RC1="","",IF(OR(R8C<=ROUND(DAYS360(ValDat,RC1,0)/30,0),R8C>ROUND(DAYS360(ExpDat,RC1,0)/30,0)),0,OFFSET(R45C,MAX(-MNR,ROUND(DAYS360(ValDat,RC1,0)/30,0)-R8C+MEP-MNR),0,1,1))) -> 0 | AK89: =IF(RC1="","",IF(OR(R8C<=ROUND(DAYS360(ValDat,RC1,0)/30,0),R8C>ROUND(DAYS360(ExpDat,RC1,0)/30,0)),0,OFFSET(R45C,MAX(-MNR,ROUND(DAYS360(ValDat,RC1,0)/30,0)-R8C+MEP-MNR),0,1,1))) -> 0 | AL89: =IF(RC1="","",IF(OR(R8C<=ROUND(DAYS360(ValDat,RC1,0)/30,0),R8C>ROUND(DAYS360(ExpDat,RC1,0)/30,0)),0,OFFSET(R45C,MAX(-MNR,ROUND(DAYS360(ValDat,RC1,0)/30,0)-R8C+MEP-MNR),0,1,1))) -> 0 | AM89: =IF(RC1="","",IF(OR(R8C<=ROUND(DAYS360(ValDat,RC1,0)/30,0),R8C>ROUND(DAYS360(ExpDat,RC1,0)/30,0)),0,OFFSET(R45C,MAX(-MNR,ROUND(DAYS360(ValDat,RC1,0)/30,0)-R8C+MEP-MNR),0,1,1))) -> 0 | AN89: =IF(RC1="","",IF(OR(R8C<=ROUND(DAYS360(ValDat,RC1,0)/30,0),R8C>ROUND(DAYS360(ExpDat,RC1,0)/30,0)),0,OFFSET(R45C,MAX(-MNR,ROUND(DAYS360(ValDat,RC1,0)/30,0)-R8C+MEP-MNR),0,1,1))) -> 0 | AO89: =IF(RC1="","",IF(OR(R8C<=ROUND(DAYS360(ValDat,RC1,0)/30,0),R8C>ROUND(DAYS360(ExpDat,RC1,0)/30,0)),0,OFFSET(R45C,MAX(-MNR,ROUND(DAYS360(ValDat,RC1,0)/30,0)-R8C+MEP-MNR),0,1,1))) -> 0
A90: =IF(R[-1]C="","",IF(EOMONTH(R[-1]C,0)+1>RunDat,"",EOMONTH(R[-1]C,0)+1)) -> 2001-04-01T00:00:00.000 | D90: =IF(RC1="","",SUM(RC[2]:RC[37])) -> 104668 | F90: =IF(RC1="","",IF(OR(R8C<=ROUND(DAYS360(ValDat,RC1,0)/30,0),R8C>ROUND(DAYS360(ExpDat,RC1,0)/30,0)),0,OFFSET(R45C,MAX(-MNR,ROUND(DAYS360(ValDat,RC1,0)/30,0)-R8C+MEP-MNR),0,1,1))) -> 753 | G90: =IF(RC1="","",IF(OR(R8C<=ROUND(DAYS360(ValDat,RC1,0)/30,0),R8C>ROUND(DAYS360(ExpDat,RC1,0)/30,0)),0,OFFSET(R45C,MAX(-MNR,ROUND(DAYS360(ValDat,RC1,0)/30,0)-R8C+MEP-MNR),0,1,1))) -> 43493 | H90: =IF(RC1="","",IF(OR(R8C<=ROUND(DAYS360(ValDat,RC1,0)/30,0),R8C>ROUND(DAYS360(ExpDat,RC1,0)/30,0)),0,OFFSET(R45C,MAX(-MNR,ROUND(DAYS360(ValDat,RC1,0)/30,0)-R8C+MEP-MNR),0,1,1))) -> 39608 | I90: =IF(RC1="","",IF(OR(R8C<=ROUND(DAYS360(ValDat,RC1,0)/30,0),R8C>ROUND(DAYS360(ExpDat,RC1,0)/30,0)),0,OFFSET(R45C,MAX(-MNR,ROUND(DAYS360(ValDat,RC1,0)/30,0)-R8C+MEP-MNR),0,1,1))) -> 9556 | J90: =IF(RC1="","",IF(OR(R8C<=ROUND(DAYS360(ValDat,RC1,0)/30,0),R8C>ROUND(DAYS360(ExpDat,RC1,0)/30,0)),0,OFFSET(R45C,MAX(-MNR,ROUND(DAYS360(ValDat,RC1,0)/30,0)-R8C+MEP-MNR),0,1,1))) -> 2170 | K90: =IF(RC1="","",IF(OR(R8C<=ROUND(DAYS360(ValDat,RC1,0)/30,0),R8C>ROUND(DAYS360(ExpDat,RC1,0)/30,0)),0,OFFSET(R45C,MAX(-MNR,ROUND(DAYS360(ValDat,RC1,0)/30,0)-R8C+MEP-MNR),0,1,1))) -> 5412 | L90: =IF(RC1="","",IF(OR(R8C<=ROUND(DAYS360(ValDat,RC1,0)/30,0),R8C>ROUND(DAYS360(ExpDat,RC1,0)/30,0)),0,OFFSET(R45C,MAX(-MNR,ROUND(DAYS360(ValDat,RC1,0)/30,0)-R8C+MEP-MNR),0,1,1))) -> 4375 | M90: =IF(RC1="","",IF(OR(R8C<=ROUND(DAYS360(ValDat,RC1,0)/30,0),R8C>ROUND(DAYS360(ExpDat,RC1,0)/30,0)),0,OFFSET(R45C,MAX(-MNR,ROUND(DAYS360(ValDat,RC1,0)/30,0)-R8C+MEP-MNR),0,1,1))) -> -3004 | N90: =IF(RC1="","",IF(OR(R8C<=ROUND(DAYS360(ValDat,RC1,0)/30,0),R8C>ROUND(DAYS360(ExpDat,RC1,0)/30,0)),0,OFFSET(R45C,MAX(-MNR,ROUND(DAYS360(ValDat,RC1,0)/30,0)-R8C+MEP-MNR),0,1,1))) -> 662 | O90: =IF(RC1="","",IF(OR(R8C<=ROUND(DAYS360(ValDat,RC1,0)/30,0),R8C>ROUND(DAYS360(ExpDat,RC1,0)/30,0)),0,OFFSET(R45C,MAX(-MNR,ROUND(DAYS360(ValDat,RC1,0)/30,0)-R8C+MEP-MNR),0,1,1))) -> 239 | P90: =IF(RC1="","",IF(OR(R8C<=ROUND(DAYS360(ValDat,RC1,0)/30,0),R8C>ROUND(DAYS360(ExpDat,RC1,0)/30,0)),0,OFFSET(R45C,MAX(-MNR,ROUND(DAYS360(ValDat,RC1,0)/30,0)-R8C+MEP-MNR),0,1,1))) -> 124 | Q90: =IF(RC1="","",IF(OR(R8C<=ROUND(DAYS360(ValDat,RC1,0)/30,0),R8C>ROUND(DAYS360(ExpDat,RC1,0)/30,0)),0,OFFSET(R45C,MAX(-MNR,ROUND(DAYS360(ValDat,RC1,0)/30,0)-R8C+MEP-MNR),0,1,1))) -> 0 | R90: =IF(RC1="","",IF(OR(R8C<=ROUND(DAYS360(ValDat,RC1,0)/30,0),R8C>ROUND(DAYS360(ExpDat,RC1,0)/30,0)),0,OFFSET(R45C,MAX(-MNR,ROUND(DAYS360(ValDat,RC1,0)/30,0)-R8C+MEP-MNR),0,1,1))) -> 152 | S90: =IF(RC1="","",IF(OR(R8C<=ROUND(DAYS360(ValDat,RC1,0)/30,0),R8C>ROUND(DAYS360(ExpDat,RC1,0)/30,0)),0,OFFSET(R45C,MAX(-MNR,ROUND(DAYS360(ValDat,RC1,0)/30,0)-R8C+MEP-MNR),0,1,1))) -> 538 | T90: =IF(RC1="","",IF(OR(R8C<=ROUND(DAYS360(ValDat,RC1,0)/30,0),R8C>ROUND(DAYS360(ExpDat,RC1,0)/30,0)),0,OFFSET(R45C,MAX(-MNR,ROUND(DAYS360(ValDat,RC1,0)/30,0)-R8C+MEP-MNR),0,1,1))) -> 19 | U90: =IF(RC1="","",IF(OR(R8C<=ROUND(DAYS360(ValDat,RC1,0)/30,0),R8C>ROUND(DAYS360(ExpDat,RC1,0)/30,0)),0,OFFSET(R45C,MAX(-MNR,ROUND(DAYS360(ValDat,RC1,0)/30,0)-R8C+MEP-MNR),0,1,1))) -> 375 | V90: =IF(RC1="","",IF(OR(R8C<=ROUND(DAYS360(ValDat,RC1,0)/30,0),R8C>ROUND(DAYS360(ExpDat,RC1,0)/30,0)),0,OFFSET(R45C,MAX(-MNR,ROUND(DAYS360(ValDat,RC1,0)/30,0)-R8C+MEP-MNR),0,1,1))) -> 196 | W90: =IF(RC1="","",IF(OR(R8C<=ROUND(DAYS360(ValDat,RC1,0)/30,0),R8C>ROUND(DAYS360(ExpDat,RC1,0)/30,0)),0,OFFSET(R45C,MAX(-MNR,ROUND(DAYS360(ValDat,RC1,0)/30,0)-R8C+MEP-MNR),0,1,1))) -> 0 | X90: =IF(RC1="","",IF(OR(R8C<=ROUND(DAYS360(ValDat,RC1,0)/30,0),R8C>ROUND(DAYS360(ExpDat,RC1,0)/30,0)),0,OFFSET(R45C,MAX(-MNR,ROUND(DAYS360(ValDat,RC1,0)/30,0)-R8C+MEP-MNR),0,1,1))) -> 0 | Y90: =IF(RC1="","",IF(OR(R8C<=ROUND(DAYS360(ValDat,RC1,0)/30,0),R8C>ROUND(DAYS360(ExpDat,RC1,0)/30,0)),0,OFFSET(R45C,MAX(-MNR,ROUND(DAYS360(ValDat,RC1,0)/30,0)-R8C+MEP-MNR),0,1,1))) -> 0 | Z90: =IF(RC1="","",IF(OR(R8C<=ROUND(DAYS360(ValDat,RC1,0)/30,0),R8C>ROUND(DAYS360(ExpDat,RC1,0)/30,0)),0,OFFSET(R45C,MAX(-MNR,ROUND(DAYS360(ValDat,RC1,0)/30,0)-R8C+MEP-MNR),0,1,1))) -> 0 | AA90: =IF(RC1="","",IF(OR(R8C<=ROUND(DAYS360(ValDat,RC1,0)/30,0),R8C>ROUND(DAYS360(ExpDat,RC1,0)/30,0)),0,OFFSET(R45C,MAX(-MNR,ROUND(DAYS360(ValDat,RC1,0)/30,0)-R8C+MEP-MNR),0,1,1))) -> 0 | AB90: =IF(RC1="","",IF(OR(R8C<=ROUND(DAYS360(ValDat,RC1,0)/30,0),R8C>ROUND(DAYS360(ExpDat,RC1,0)/30,0)),0,OFFSET(R45C,MAX(-MNR,ROUND(DAYS360(ValDat,RC1,0)/30,0)-R8C+MEP-MNR),0,1,1))) -> 0 | AC90: =IF(RC1="","",IF(OR(R8C<=ROUND(DAYS360(ValDat,RC1,0)/30,0),R8C>ROUND(DAYS360(ExpDat,RC1,0)/30,0)),0,OFFSET(R45C,MAX(-MNR,ROUND(DAYS360(ValDat,RC1,0)/30,0)-R8C+MEP-MNR),0,1,1))) -> 0 | AD90: =IF(RC1="","",IF(OR(R8C<=ROUND(DAYS360(ValDat,RC1,0)/30,0),R8C>ROUND(DAYS360(ExpDat,RC1,0)/30,0)),0,OFFSET(R45C,MAX(-MNR,ROUND(DAYS360(ValDat,RC1,0)/30,0)-R8C+MEP-MNR),0,1,1))) -> 0 | AE90: =IF(RC1="","",IF(OR(R8C<=ROUND(DAYS360(ValDat,RC1,0)/30,0),R8C>ROUND(DAYS360(ExpDat,RC1,0)/30,0)),0,OFFSET(R45C,MAX(-MNR,ROUND(DAYS360(ValDat,RC1,0)/30,0)-R8C+MEP-MNR),0,1,1))) -> 0 | AF90: =IF(RC1="","",IF(OR(R8C<=ROUND(DAYS360(ValDat,RC1,0)/30,0),R8C>ROUND(DAYS360(ExpDat,RC1,0)/30,0)),0,OFFSET(R45C,MAX(-MNR,ROUND(DAYS360(ValDat,RC1,0)/30,0)-R8C+MEP-MNR),0,1,1))) -> 0 | AG90: =IF(RC1="","",IF(OR(R8C<=ROUND(DAYS360(ValDat,RC1,0)/30,0),R8C>ROUND(DAYS360(ExpDat,RC1,0)/30,0)),0,OFFSET(R45C,MAX(-MNR,ROUND(DAYS360(ValDat,RC1,0)/30,0)-R8C+MEP-MNR),0,1,1))) -> 0 | AH90: =IF(RC1="","",IF(OR(R8C<=ROUND(DAYS360(ValDat,RC1,0)/30,0),R8C>ROUND(DAYS360(ExpDat,RC1,0)/30,0)),0,OFFSET(R45C,MAX(-MNR,ROUND(DAYS360(ValDat,RC1,0)/30,0)-R8C+MEP-MNR),0,1,1))) -> 0 | AI90: =IF(RC1="","",IF(OR(R8C<=ROUND(DAYS360(ValDat,RC1,0)/30,0),R8C>ROUND(DAYS360(ExpDat,RC1,0)/30,0)),0,OFFSET(R45C,MAX(-MNR,ROUND(DAYS360(ValDat,RC1,0)/30,0)-R8C+MEP-MNR),0,1,1))) -> 0 | AJ90: =IF(RC1="","",IF(OR(R8C<=ROUND(DAYS360(ValDat,RC1,0)/30,0),R8C>ROUND(DAYS360(ExpDat,RC1,0)/30,0)),0,OFFSET(R45C,MAX(-MNR,ROUND(DAYS360(ValDat,RC1,0)/30,0)-R8C+MEP-MNR),0,1,1))) -> 0 | AK90: =IF(RC1="","",IF(OR(R8C<=ROUND(DAYS360(ValDat,RC1,0)/30,0),R8C>ROUND(DAYS360(ExpDat,RC1,0)/30,0)),0,OFFSET(R45C,MAX(-MNR,ROUND(DAYS360(ValDat,RC1,0)/30,0)-R8C+MEP-MNR),0,1,1))) -> 0 | AL90: =IF(RC1="","",IF(OR(R8C<=ROUND(DAYS360(ValDat,RC1,0)/30,0),R8C>ROUND(DAYS360(ExpDat,RC1,0)/30,0)),0,OFFSET(R45C,MAX(-MNR,ROUND(DAYS360(ValDat,RC1,0)/30,0)-R8C+MEP-MNR),0,1,1))) -> 0 | AM90: =IF(RC1="","",IF(OR(R8C<=ROUND(DAYS360(ValDat,RC1,0)/30,0),R8C>ROUND(DAYS360(ExpDat,RC1,0)/30,0)),0,OFFSET(R45C,MAX(-MNR,ROUND(DAYS360(ValDat,RC1,0)/30,0)-R8C+MEP-MNR),0,1,1))) -> 0 | AN90: =IF(RC1="","",IF(OR(R8C<=ROUND(DAYS360(ValDat,RC1,0)/30,0),R8C>ROUND(DAYS360(ExpDat,RC1,0)/30,0)),0,OFFSET(R45C,MAX(-MNR,ROUND(DAYS360(ValDat,RC1,0)/30,0)-R8C+MEP-MNR),0,1,1))) -> 0 | AO90: =IF(RC1="","",IF(OR(R8C<=ROUND(DAYS360(ValDat,RC1,0)/30,0),R8C>ROUND(DAYS360(ExpDat,RC1,0)/30,0)),0,OFFSET(R45C,MAX(-MNR,ROUND(DAYS360(ValDat,RC1,0)/30,0)-R8C+MEP-MNR),0,1,1))) -> 0
A91: =IF(R[-1]C="","",IF(EOMONTH(R[-1]C,0)+1>RunDat,"",EOMONTH(R[-1]C,0)+1)) -> 2001-05-01T00:00:00.000 | D91: =IF(RC1="","",SUM(RC[2]:RC[37])) -> 75719 | F91: =IF(RC1="","",IF(OR(R8C<=ROUND(DAYS360(ValDat,RC1,0)/30,0),R8C>ROUND(DAYS360(ExpDat,RC1,0)/30,0)),0,OFFSET(R45C,MAX(-MNR,ROUND(DAYS360(ValDat,RC1,0)/30,0)-R8C+MEP-MNR),0,1,1))) -> 12673 | G91: =IF(RC1="","",IF(OR(R8C<=ROUND(DAYS360(ValDat,RC1,0)/30,0),R8C>ROUND(DAYS360(ExpDat,RC1,0)/30,0)),0,OFFSET(R45C,MAX(-MNR,ROUND(DAYS360(ValDat,RC1,0)/30,0)-R8C+MEP-MNR),0,1,1))) -> 13772 | H91: =IF(RC1="","",IF(OR(R8C<=ROUND(DAYS360(ValDat,RC1,0)/30,0),R8C>ROUND(DAYS360(ExpDat,RC1,0)/30,0)),0,OFFSET(R45C,MAX(-MNR,ROUND(DAYS360(ValDat,RC1,0)/30,0)-R8C+MEP-MNR),0,1,1))) -> 7571 | I91: =IF(RC1="","",IF(OR(R8C<=ROUND(DAYS360(ValDat,RC1,0)/30,0),R8C>ROUND(DAYS360(ExpDat,RC1,0)/30,0)),0,OFFSET(R45C,MAX(-MNR,ROUND(DAYS360(ValDat,RC1,0)/30,0)-R8C+MEP-MNR),0,1,1))) -> 6673 | J91: =IF(RC1="","",IF(OR(R8C<=ROUND(DAYS360(ValDat,RC1,0)/30,0),R8C>ROUND(DAYS360(ExpDat,RC1,0)/30,0)),0,OFFSET(R45C,MAX(-MNR,ROUND(DAYS360(ValDat,RC1,0)/30,0)-R8C+MEP-MNR),0,1,1))) -> 13627 | K91: =IF(RC1="","",IF(OR(R8C<=ROUND(DAYS360(ValDat,RC1,0)/30,0),R8C>ROUND(DAYS360(ExpDat,RC1,0)/30,0)),0,OFFSET(R45C,MAX(-MNR,ROUND(DAYS360(ValDat,RC1,0)/30,0)-R8C+MEP-MNR),0,1,1))) -> 13856 | L91: =IF(RC1="","",IF(OR(R8C<=ROUND(DAYS360(ValDat,RC1,0)/30,0),R8C>ROUND(DAYS360(ExpDat,RC1,0)/30,0)),0,OFFSET(R45C,MAX(-MNR,ROUND(DAYS360(ValDat,RC1,0)/30,0)-R8C+MEP-MNR),0,1,1))) -> 341 | M91: =IF(RC1="","",IF(OR(R8C<=ROUND(DAYS360(ValDat,RC1,0)/30,0),R8C>ROUND(DAYS360(ExpDat,RC1,0)/30,0)),0,OFFSET(R45C,MAX(-MNR,ROUND(DAYS360(ValDat,RC1,0)/30,0)-R8C+MEP-MNR),0,1,1))) -> 412 | N91: =IF(RC1="","",IF(OR(R8C<=ROUND(DAYS360(ValDat,RC1,0)/30,0),R8C>ROUND(DAYS360(ExpDat,RC1,0)/30,0)),0,OFFSET(R45C,MAX(-MNR,ROUND(DAYS360(ValDat,RC1,0)/30,0)-R8C+MEP-MNR),0,1,1))) -> 306 | O91: =IF(RC1="","",IF(OR(R8C<=ROUND(DAYS360(ValDat,RC1,0)/30,0),R8C>ROUND(DAYS360(ExpDat,RC1,0)/30,0)),0,OFFSET(R45C,MAX(-MNR,ROUND(DAYS360(ValDat,RC1,0)/30,0)-R8C+MEP-MNR),0,1,1))) -> 6212 | P91: =IF(RC1="","",IF(OR(R8C<=ROUND(DAYS360(ValDat,RC1,0)/30,0),R8C>ROUND(DAYS360(ExpDat,RC1,0)/30,0)),0,OFFSET(R45C,MAX(-MNR,ROUND(DAYS360(ValDat,RC1,0)/30,0)-R8C+MEP-MNR),0,1,1))) -> 124 | Q91: =IF(RC1="","",IF(OR(R8C<=ROUND(DAYS360(ValDat,RC1,0)/30,0),R8C>ROUND(DAYS360(ExpDat,RC1,0)/30,0)),0,OFFSET(R45C,MAX(-MNR,ROUND(DAYS360(ValDat,RC1,0)/30,0)-R8C+MEP-MNR),0,1,1))) -> 0 | R91: =IF(RC1="","",IF(OR(R8C<=ROUND(DAYS360(ValDat,RC1,0)/30,0),R8C>ROUND(DAYS360(ExpDat,RC1,0)/30,0)),0,OFFSET(R45C,MAX(-MNR,ROUND(DAYS360(ValDat,RC1,0)/30,0)-R8C+MEP-MNR),0,1,1))) -> 152 | S91: =IF(RC1="","",IF(OR(R8C<=ROUND(DAYS360(ValDat,RC1,0)/30,0),R8C>ROUND(DAYS360(ExpDat,RC1,0)/30,0)),0,OFFSET(R45C,MAX(-MNR,ROUND(DAYS360(ValDat,RC1,0)/30,0)-R8C+MEP-MNR),0,1,1))) -> 0 | T91: =IF(RC1="","",IF(OR(R8C<=ROUND(DAYS360(ValDat,RC1,0)/30,0),R8C>ROUND(DAYS360(ExpDat,RC1,0)/30,0)),0,OFFSET(R45C,MAX(-MNR,ROUND(DAYS360(ValDat,RC1,0)/30,0)-R8C+MEP-MNR),0,1,1))) -> 0 | U91: =IF(RC1="","",IF(OR(R8C<=ROUND(DAYS360(ValDat,RC1,0)/30,0),R8C>ROUND(DAYS360(ExpDat,RC1,0)/30,0)),0,OFFSET(R45C,MAX(-MNR,ROUND(DAYS360(ValDat,RC1,0)/30,0)-R8C+MEP-MNR),0,1,1))) -> 0 | V91: =IF(RC1="","",IF(OR(R8C<=ROUND(DAYS360(ValDat,RC1,0)/30,0),R8C>ROUND(DAYS360(ExpDat,RC1,0)/30,0)),0,OFFSET(R45C,MAX(-MNR,ROUND(DAYS360(ValDat,RC1,0)/30,0)-R8C+MEP-MNR),0,1,1))) -> 0 | W91: =IF(RC1="","",IF(OR(R8C<=ROUND(DAYS360(ValDat,RC1,0)/30,0),R8C>ROUND(DAYS360(ExpDat,RC1,0)/30,0)),0,OFFSET(R45C,MAX(-MNR,ROUND(DAYS360(ValDat,RC1,0)/30,0)-R8C+MEP-MNR),0,1,1))) -> 0 | X91: =IF(RC1="","",IF(OR(R8C<=ROUND(DAYS360(ValDat,RC1,0)/30,0),R8C>ROUND(DAYS360(ExpDat,RC1,0)/30,0)),0,OFFSET(R45C,MAX(-MNR,ROUND(DAYS360(ValDat,RC1,0)/30,0)-R8C+MEP-MNR),0,1,1))) -> 0 | Y91: =IF(RC1="","",IF(OR(R8C<=ROUND(DAYS360(ValDat,RC1,0)/30,0),R8C>ROUND(DAYS360(ExpDat,RC1,0)/30,0)),0,OFFSET(R45C,MAX(-MNR,ROUND(DAYS360(ValDat,RC1,0)/30,0)-R8C+MEP-MNR),0,1,1))) -> 0 | Z91: =IF(RC1="","",IF(OR(R8C<=ROUND(DAYS360(ValDat,RC1,0)/30,0),R8C>ROUND(DAYS360(ExpDat,RC1,0)/30,0)),0,OFFSET(R45C,MAX(-MNR,ROUND(DAYS360(ValDat,RC1,0)/30,0)-R8C+MEP-MNR),0,1,1))) -> 0 | AA91: =IF(RC1="","",IF(OR(R8C<=ROUND(DAYS360(ValDat,RC1,0)/30,0),R8C>ROUND(DAYS360(ExpDat,RC1,0)/30,0)),0,OFFSET(R45C,MAX(-MNR,ROUND(DAYS360(ValDat,RC1,0)/30,0)-R8C+MEP-MNR),0,1,1))) -> 0 | AB91: =IF(RC1="","",IF(OR(R8C<=ROUND(DAYS360(ValDat,RC1,0)/30,0),R8C>ROUND(DAYS360(ExpDat,RC1,0)/30,0)),0,OFFSET(R45C,MAX(-MNR,ROUND(DAYS360(ValDat,RC1,0)/30,0)-R8C+MEP-MNR),0,1,1))) -> 0 | AC91: =IF(RC1="","",IF(OR(R8C<=ROUND(DAYS360(ValDat,RC1,0)/30,0),R8C>ROUND(DAYS360(ExpDat,RC1,0)/30,0)),0,OFFSET(R45C,MAX(-MNR,ROUND(DAYS360(ValDat,RC1,0)/30,0)-R8C+MEP-MNR),0,1,1))) -> 0 | AD91: =IF(RC1="","",IF(OR(R8C<=ROUND(DAYS360(ValDat,RC1,0)/30,0),R8C>ROUND(DAYS360(ExpDat,RC1,0)/30,0)),0,OFFSET(R45C,MAX(-MNR,ROUND(DAYS360(ValDat,RC1,0)/30,0)-R8C+MEP-MNR),0,1,1))) -> 0 | AE91: =IF(RC1="","",IF(OR(R8C<=ROUND(DAYS360(ValDat,RC1,0)/30,0),R8C>ROUND(DAYS360(ExpDat,RC1,0)/30,0)),0,OFFSET(R45C,MAX(-MNR,ROUND(DAYS360(ValDat,RC1,0)/30,0)-R8C+MEP-MNR),0,1,1))) -> 0 | AF91: =IF(RC1="","",IF(OR(R8C<=ROUND(DAYS360(ValDat,RC1,0)/30,0),R8C>ROUND(DAYS360(ExpDat,RC1,0)/30,0)),0,OFFSET(R45C,MAX(-MNR,ROUND(DAYS360(ValDat,RC1,0)/30,0)-R8C+MEP-MNR),0,1,1))) -> 0 | AG91: =IF(RC1="","",IF(OR(R8C<=ROUND(DAYS360(ValDat,RC1,0)/30,0),R8C>ROUND(DAYS360(ExpDat,RC1,0)/30,0)),0,OFFSET(R45C,MAX(-MNR,ROUND(DAYS360(ValDat,RC1,0)/30,0)-R8C+MEP-MNR),0,1,1))) -> 0 | AH91: =IF(RC1="","",IF(OR(R8C<=ROUND(DAYS360(ValDat,RC1,0)/30,0),R8C>ROUND(DAYS360(ExpDat,RC1,0)/30,0)),0,OFFSET(R45C,MAX(-MNR,ROUND(DAYS360(ValDat,RC1,0)/30,0)-R8C+MEP-MNR),0,1,1))) -> 0 | AI91: =IF(RC1="","",IF(OR(R8C<=ROUND(DAYS360(ValDat,RC1,0)/30,0),R8C>ROUND(DAYS360(ExpDat,RC1,0)/30,0)),0,OFFSET(R45C,MAX(-MNR,ROUND(DAYS360(ValDat,RC1,0)/30,0)-R8C+MEP-MNR),0,1,1))) -> 0 | AJ91: =IF(RC1="","",IF(OR(R8C<=ROUND(DAYS360(ValDat,RC1,0)/30,0),R8C>ROUND(DAYS360(ExpDat,RC1,0)/30,0)),0,OFFSET(R45C,MAX(-MNR,ROUND(DAYS360(ValDat,RC1,0)/30,0)-R8C+MEP-MNR),0,1,1))) -> 0 | AK91: =IF(RC1="","",IF(OR(R8C<=ROUND(DAYS360(ValDat,RC1,0)/30,0),R8C>ROUND(DAYS360(ExpDat,RC1,0)/30,0)),0,OFFSET(R45C,MAX(-MNR,ROUND(DAYS360(ValDat,RC1,0)/30,0)-R8C+MEP-MNR),0,1,1))) -> 0 | AL91: =IF(RC1="","",IF(OR(R8C<=ROUND(DAYS360(ValDat,RC1,0)/30,0),R8C>ROUND(DAYS360(ExpDat,RC1,0)/30,0)),0,OFFSET(R45C,MAX(-MNR,ROUND(DAYS360(ValDat,RC1,0)/30,0)-R8C+MEP-MNR),0,1,1))) -> 0 | AM91: =IF(RC1="","",IF(OR(R8C<=ROUND(DAYS360(ValDat,RC1,0)/30,0),R8C>ROUND(DAYS360(ExpDat,RC1,0)/30,0)),0,OFFSET(R45C,MAX(-MNR,ROUND(DAYS360(ValDat,RC1,0)/30,0)-R8C+MEP-MNR),0,1,1))) -> 0 | AN91: =IF(RC1="","",IF(OR(R8C<=ROUND(DAYS360(ValDat,RC1,0)/30,0),R8C>ROUND(DAYS360(ExpDat,RC1,0)/30,0)),0,OFFSET(R45C,MAX(-MNR,ROUND(DAYS360(ValDat,RC1,0)/30,0)-R8C+MEP-MNR),0,1,1))) -> 0 | AO91: =IF(RC1="","",IF(OR(R8C<=ROUND(DAYS360(ValDat,RC1,0)/30,0),R8C>ROUND(DAYS360(ExpDat,RC1,0)/30,0)),0,OFFSET(R45C,MAX(-MNR,ROUND(DAYS360(ValDat,RC1,0)/30,0)-R8C+MEP-MNR),0,1,1))) -> 0
A92: =IF(R[-1]C="","",IF(EOMONTH(R[-1]C,0)+1>RunDat,"",EOMONTH(R[-1]C,0)+1)) -> 2001-06-01T00:00:00.000 | D92: =IF(RC1="","",SUM(RC[2]:RC[37])) -> 48861 | F92: =IF(RC1="","",IF(OR(R8C<=ROUND(DAYS360(ValDat,RC1,0)/30,0),R8C>ROUND(DAYS360(ExpDat,RC1,0)/30,0)),0,OFFSET(R45C,MAX(-MNR,ROUND(DAYS360(ValDat,RC1,0)/30,0)-R8C+MEP-MNR),0,1,1))) -> 0 | G92: =IF(RC1="","",IF(OR(R8C<=ROUND(DAYS360(ValDat,RC1,0)/30,0),R8C>ROUND(DAYS360(ExpDat,RC1,0)/30,0)),0,OFFSET(R45C,MAX(-MNR,ROUND(DAYS360(ValDat,RC1,0)/30,0)-R8C+MEP-MNR),0,1,1))) -> 20961 | H92: =IF(RC1="","",IF(OR(R8C<=ROUND(DAYS360(ValDat,RC1,0)/30,0),R8C>ROUND(DAYS360(ExpDat,RC1,0)/30,0)),0,OFFSET(R45C,MAX(-MNR,ROUND(DAYS360(ValDat,RC1,0)/30,0)-R8C+MEP-MNR),0,1,1))) -> 13968 | I92: =IF(RC1="","",IF(OR(R8C<=ROUND(DAYS360(ValDat,RC1,0)/30,0),R8C>ROUND(DAYS360(ExpDat,RC1,0)/30,0)),0,OFFSET(R45C,MAX(-MNR,ROUND(DAYS360(ValDat,RC1,0)/30,0)-R8C+MEP-MNR),0,1,1))) -> 5995 | J92: =IF(RC1="","",IF(OR(R8C<=ROUND(DAYS360(ValDat,RC1,0)/30,0),R8C>ROUND(DAYS360(ExpDat,RC1,0)/30,0)),0,OFFSET(R45C,MAX(-MNR,ROUND(DAYS360(ValDat,RC1,0)/30,0)-R8C+MEP-MNR),0,1,1))) -> 2288 | K92: =IF(RC1="","",IF(OR(R8C<=ROUND(DAYS360(ValDat,RC1,0)/30,0),R8C>ROUND(DAYS360(ExpDat,RC1,0)/30,0)),0,OFFSET(R45C,MAX(-MNR,ROUND(DAYS360(ValDat,RC1,0)/30,0)-R8C+MEP-MNR),0,1,1))) -> 342 | L92: =IF(RC1="","",IF(OR(R8C<=ROUND(DAYS360(ValDat,RC1,0)/30,0),R8C>ROUND(DAYS360(ExpDat,RC1,0)/30,0)),0,OFFSET(R45C,MAX(-MNR,ROUND(DAYS360(ValDat,RC1,0)/30,0)-R8C+MEP-MNR),0,1,1))) -> 1103 | M92: =IF(RC1="","",IF(OR(R8C<=ROUND(DAYS360(ValDat,RC1,0)/30,0),R8C>ROUND(DAYS360(ExpDat,RC1,0)/30,0)),0,OFFSET(R45C,MAX(-MNR,ROUND(DAYS360(ValDat,RC1,0)/30,0)-R8C+MEP-MNR),0,1,1))) -> 1097 | N92: =IF(RC1="","",IF(OR(R8C<=ROUND(DAYS360(ValDat,RC1,0)/30,0),R8C>ROUND(DAYS360(ExpDat,RC1,0)/30,0)),0,OFFSET(R45C,MAX(-MNR,ROUND(DAYS360(ValDat,RC1,0)/30,0)-R8C+MEP-MNR),0,1,1))) -> 1128 | O92: =IF(RC1="","",IF(OR(R8C<=ROUND(DAYS360(ValDat,RC1,0)/30,0),R8C>ROUND(DAYS360(ExpDat,RC1,0)/30,0)),0,OFFSET(R45C,MAX(-MNR,ROUND(DAYS360(ValDat,RC1,0)/30,0)-R8C+MEP-MNR),0,1,1))) -> 1265 | P92: =IF(RC1="","",IF(OR(R8C<=ROUND(DAYS360(ValDat,RC1,0)/30,0),R8C>ROUND(DAYS360(ExpDat,RC1,0)/30,0)),0,OFFSET(R45C,MAX(-MNR,ROUND(DAYS360(ValDat,RC1,0)/30,0)-R8C+MEP-MNR),0,1,1))) -> 33 | Q92: =IF(RC1="","",IF(OR(R8C<=ROUND(DAYS360(ValDat,RC1,0)/30,0),R8C>ROUND(DAYS360(ExpDat,RC1,0)/30,0)),0,OFFSET(R45C,MAX(-MNR,ROUND(DAYS360(ValDat,RC1,0)/30,0)-R8C+MEP-MNR),0,1,1))) -> 211 | R92: =IF(RC1="","",IF(OR(R8C<=ROUND(DAYS360(ValDat,RC1,0)/30,0),R8C>ROUND(DAYS360(ExpDat,RC1,0)/30,0)),0,OFFSET(R45C,MAX(-MNR,ROUND(DAYS360(ValDat,RC1,0)/30,0)-R8C+MEP-MNR),0,1,1))) -> 7 | S92: =IF(RC1="","",IF(OR(R8C<=ROUND(DAYS360(ValDat,RC1,0)/30,0),R8C>ROUND(DAYS360(ExpDat,RC1,0)/30,0)),0,OFFSET(R45C,MAX(-MNR,ROUND(DAYS360(ValDat,RC1,0)/30,0)-R8C+MEP-MNR),0,1,1))) -> 0 | T92: =IF(RC1="","",IF(OR(R8C<=ROUND(DAYS360(ValDat,RC1,0)/30,0),R8C>ROUND(DAYS360(ExpDat,RC1,0)/30,0)),0,OFFSET(R45C,MAX(-MNR,ROUND(DAYS360(ValDat,RC1,0)/30,0)-R8C+MEP-MNR),0,1,1))) -> 282 | U92: =IF(RC1="","",IF(OR(R8C<=ROUND(DAYS360(ValDat,RC1,0)/30,0),R8C>ROUND(DAYS360(ExpDat,RC1,0)/30,0)),0,OFFSET(R45C,MAX(-MNR,ROUND(DAYS360(ValDat,RC1,0)/30,0)-R8C+MEP-MNR),0,1,1))) -> 84 | V92: =IF(RC1="","",IF(OR(R8C<=ROUND(DAYS360(ValDat,RC1,0)/30,0),R8C>ROUND(DAYS360(ExpDat,RC1,0)/30,0)),0,OFFSET(R45C,MAX(-MNR,ROUND(DAYS360(ValDat,RC1,0)/30,0)-R8C+MEP-MNR),0,1,1))) -> 97 | W92: =IF(RC1="","",IF(OR(R8C<=ROUND(DAYS360(ValDat,RC1,0)/30,0),R8C>ROUND(DAYS360(ExpDat,RC1,0)/30,0)),0,OFFSET(R45C,MAX(-MNR,ROUND(DAYS360(ValDat,RC1,0)/30,0)-R8C+MEP-MNR),0,1,1))) -> 0 | X92: =IF(RC1="","",IF(OR(R8C<=ROUND(DAYS360(ValDat,RC1,0)/30,0),R8C>ROUND(DAYS360(ExpDat,RC1,0)/30,0)),0,OFFSET(R45C,MAX(-MNR,ROUND(DAYS360(ValDat,RC1,0)/30,0)-R8C+MEP-MNR),0,1,1))) -> 0 | Y92: =IF(RC1="","",IF(OR(R8C<=ROUND(DAYS360(ValDat,RC1,0)/30,0),R8C>ROUND(DAYS360(ExpDat,RC1,0)/30,0)),0,OFFSET(R45C,MAX(-MNR,ROUND(DAYS360(ValDat,RC1,0)/30,0)-R8C+MEP-MNR),0,1,1))) -> 0 | Z92: =IF(RC1="","",IF(OR(R8C<=ROUND(DAYS360(ValDat,RC1,0)/30,0),R8C>ROUND(DAYS360(ExpDat,RC1,0)/30,0)),0,OFFSET(R45C,MAX(-MNR,ROUND(DAYS360(ValDat,RC1,0)/30,0)-R8C+MEP-MNR),0,1,1))) -> 0 | AA92: =IF(RC1="","",IF(OR(R8C<=ROUND(DAYS360(ValDat,RC1,0)/30,0),R8C>ROUND(DAYS360(ExpDat,RC1,0)/30,0)),0,OFFSET(R45C,MAX(-MNR,ROUND(DAYS360(ValDat,RC1,0)/30,0)-R8C+MEP-MNR),0,1,1))) -> 0 | AB92: =IF(RC1="","",IF(OR(R8C<=ROUND(DAYS360(ValDat,RC1,0)/30,0),R8C>ROUND(DAYS360(ExpDat,RC1,0)/30,0)),0,OFFSET(R45C,MAX(-MNR,ROUND(DAYS360(ValDat,RC1,0)/30,0)-R8C+MEP-MNR),0,1,1))) -> 0 | AC92: =IF(RC1="","",IF(OR(R8C<=ROUND(DAYS360(ValDat,RC1,0)/30,0),R8C>ROUND(DAYS360(ExpDat,RC1,0)/30,0)),0,OFFSET(R45C,MAX(-MNR,ROUND(DAYS360(ValDat,RC1,0)/30,0)-R8C+MEP-MNR),0,1,1))) -> 0 | AD92: =IF(RC1="","",IF(OR(R8C<=ROUND(DAYS360(ValDat,RC1,0)/30,0),R8C>ROUND(DAYS360(ExpDat,RC1,0)/30,0)),0,OFFSET(R45C,MAX(-MNR,ROUND(DAYS360(ValDat,RC1,0)/30,0)-R8C+MEP-MNR),0,1,1))) -> 0 | AE92: =IF(RC1="","",IF(OR(R8C<=ROUND(DAYS360(ValDat,RC1,0)/30,0),R8C>ROUND(DAYS360(ExpDat,RC1,0)/30,0)),0,OFFSET(R45C,MAX(-MNR,ROUND(DAYS360(ValDat,RC1,0)/30,0)-R8C+MEP-MNR),0,1,1))) -> 0 | AF92: =IF(RC1="","",IF(OR(R8C<=ROUND(DAYS360(ValDat,RC1,0)/30,0),R8C>ROUND(DAYS360(ExpDat,RC1,0)/30,0)),0,OFFSET(R45C,MAX(-MNR,ROUND(DAYS360(ValDat,RC1,0)/30,0)-R8C+MEP-MNR),0,1,1))) -> 0 | AG92: =IF(RC1="","",IF(OR(R8C<=ROUND(DAYS360(ValDat,RC1,0)/30,0),R8C>ROUND(DAYS360(ExpDat,RC1,0)/30,0)),0,OFFSET(R45C,MAX(-MNR,ROUND(DAYS360(ValDat,RC1,0)/30,0)-R8C+MEP-MNR),0,1,1))) -> 0 | AH92: =IF(RC1="","",IF(OR(R8C<=ROUND(DAYS360(ValDat,RC1,0)/30,0),R8C>ROUND(DAYS360(ExpDat,RC1,0)/30,0)),0,OFFSET(R45C,MAX(-MNR,ROUND(DAYS360(ValDat,RC1,0)/30,0)-R8C+MEP-MNR),0,1,1))) -> 0 | AI92: =IF(RC1="","",IF(OR(R8C<=ROUND(DAYS360(ValDat,RC1,0)/30,0),R8C>ROUND(DAYS360(ExpDat,RC1,0)/30,0)),0,OFFSET(R45C,MAX(-MNR,ROUND(DAYS360(ValDat,RC1,0)/30,0)-R8C+MEP-MNR),0,1,1))) -> 0 | AJ92: =IF(RC1="","",IF(OR(R8C<=ROUND(DAYS360(ValDat,RC1,0)/30,0),R8C>ROUND(DAYS360(ExpDat,RC1,0)/30,0)),0,OFFSET(R45C,MAX(-MNR,ROUND(DAYS360(ValDat,RC1,0)/30,0)-R8C+MEP-MNR),0,1,1))) -> 0 | AK92: =IF(RC1="","",IF(OR(R8C<=ROUND(DAYS360(ValDat,RC1,0)/30,0),R8C>ROUND(DAYS360(ExpDat,RC1,0)/30,0)),0,OFFSET(R45C,MAX(-MNR,ROUND(DAYS360(ValDat,RC1,0)/30,0)-R8C+MEP-MNR),0,1,1))) -> 0 | AL92: =IF(RC1="","",IF(OR(R8C<=ROUND(DAYS360(ValDat,RC1,0)/30,0),R8C>ROUND(DAYS360(ExpDat,RC1,0)/30,0)),0,OFFSET(R45C,MAX(-MNR,ROUND(DAYS360(ValDat,RC1,0)/30,0)-R8C+MEP-MNR),0,1,1))) -> 0 | AM92: =IF(RC1="","",IF(OR(R8C<=ROUND(DAYS360(ValDat,RC1,0)/30,0),R8C>ROUND(DAYS360(ExpDat,RC1,0)/30,0)),0,OFFSET(R45C,MAX(-MNR,ROUND(DAYS360(ValDat,RC1,0)/30,0)-R8C+MEP-MNR),0,1,1))) -> 0 | AN92: =IF(RC1="","",IF(OR(R8C<=ROUND(DAYS360(ValDat,RC1,0)/30,0),R8C>ROUND(DAYS360(ExpDat,RC1,0)/30,0)),0,OFFSET(R45C,MAX(-MNR,ROUND(DAYS360(ValDat,RC1,0)/30,0)-R8C+MEP-MNR),0,1,1))) -> 0 | AO92: =IF(RC1="","",IF(OR(R8C<=ROUND(DAYS360(ValDat,RC1,0)/30,0),R8C>ROUND(DAYS360(ExpDat,RC1,0)/30,0)),0,OFFSET(R45C,MAX(-MNR,ROUND(DAYS360(ValDat,RC1,0)/30,0)-R8C+MEP-MNR),0,1,1))) -> 0
A93: =IF(R[-1]C="","",IF(EOMONTH(R[-1]C,0)+1>RunDat,"",EOMONTH(R[-1]C,0)+1)) -> 2001-07-01T00:00:00.000 | D93: =IF(RC1="","",SUM(RC[2]:RC[37])) -> 33348 | F93: =IF(RC1="","",IF(OR(R8C<=ROUND(DAYS360(ValDat,RC1,0)/30,0),R8C>ROUND(DAYS360(ExpDat,RC1,0)/30,0)),0,OFFSET(R45C,MAX(-MNR,ROUND(DAYS360(ValDat,RC1,0)/30,0)-R8C+MEP-MNR),0,1,1))) -> 0 | G93: =IF(RC1="","",IF(OR(R8C<=ROUND(DAYS360(ValDat,RC1,0)/30,0),R8C>ROUND(DAYS360(ExpDat,RC1,0)/30,0)),0,OFFSET(R45C,MAX(-MNR,ROUND(DAYS360(ValDat,RC1,0)/30,0)-R8C+MEP-MNR),0,1,1))) -> 0 | H93: =IF(RC1="","",IF(OR(R8C<=ROUND(DAYS360(ValDat,RC1,0)/30,0),R8C>ROUND(DAYS360(ExpDat,RC1,0)/30,0)),0,OFFSET(R45C,MAX(-MNR,ROUND(DAYS360(ValDat,RC1,0)/30,0)-R8C+MEP-MNR),0,1,1))) -> 6855 | I93: =IF(RC1="","",IF(OR(R8C<=ROUND(DAYS360(ValDat,RC1,0)/30,0),R8C>ROUND(DAYS360(ExpDat,RC1,0)/30,0)),0,OFFSET(R45C,MAX(-MNR,ROUND(DAYS360(ValDat,RC1,0)/30,0)-R8C+MEP-MNR),0,1,1))) -> 12573 | J93: =IF(RC1="","",IF(OR(R8C<=ROUND(DAYS360(ValDat,RC1,0)/30,0),R8C>ROUND(DAYS360(ExpDat,RC1,0)/30,0)),0,OFFSET(R45C,MAX(-MNR,ROUND(DAYS360(ValDat,RC1,0)/30,0)-R8C+MEP-MNR),0,1,1))) -> 3715 | K93: =IF(RC1="","",IF(OR(R8C<=ROUND(DAYS360(ValDat,RC1,0)/30,0),R8C>ROUND(DAYS360(ExpDat,RC1,0)/30,0)),0,OFFSET(R45C,MAX(-MNR,ROUND(DAYS360(ValDat,RC1,0)/30,0)-R8C+MEP-MNR),0,1,1))) -> 4935 | L93: =IF(RC1="","",IF(OR(R8C<=ROUND(DAYS360(ValDat,RC1,0)/30,0),R8C>ROUND(DAYS360(ExpDat,RC1,0)/30,0)),0,OFFSET(R45C,MAX(-MNR,ROUND(DAYS360(ValDat,RC1,0)/30,0)-R8C+MEP-MNR),0,1,1))) -> 1024 | M93: =IF(RC1="","",IF(OR(R8C<=ROUND(DAYS360(ValDat,RC1,0)/30,0),R8C>ROUND(DAYS360(ExpDat,RC1,0)/30,0)),0,OFFSET(R45C,MAX(-MNR,ROUND(DAYS360(ValDat,RC1,0)/30,0)-R8C+MEP-MNR),0,1,1))) -> 1737 | N93: =IF(RC1="","",IF(OR(R8C<=ROUND(DAYS360(ValDat,RC1,0)/30,0),R8C>ROUND(DAYS360(ExpDat,RC1,0)/30,0)),0,OFFSET(R45C,MAX(-MNR,ROUND(DAYS360(ValDat,RC1,0)/30,0)-R8C+MEP-MNR),0,1,1))) -> 517 | O93: =IF(RC1="","",IF(OR(R8C<=ROUND(DAYS360(ValDat,RC1,0)/30,0),R8C>ROUND(DAYS360(ExpDat,RC1,0)/30,0)),0,OFFSET(R45C,MAX(-MNR,ROUND(DAYS360(ValDat,RC1,0)/30,0)-R8C+MEP-MNR),0,1,1))) -> 1357 | P93: =IF(RC1="","",IF(OR(R8C<=ROUND(DAYS360(ValDat,RC1,0)/30,0),R8C>ROUND(DAYS360(ExpDat,RC1,0)/30,0)),0,OFFSET(R45C,MAX(-MNR,ROUND(DAYS360(ValDat,RC1,0)/30,0)-R8C+MEP-MNR),0,1,1))) -> 0 | Q93: =IF(RC1="","",IF(OR(R8C<=ROUND(DAYS360(ValDat,RC1,0)/30,0),R8C>ROUND(DAYS360(ExpDat,RC1,0)/30,0)),0,OFFSET(R45C,MAX(-MNR,ROUND(DAYS360(ValDat,RC1,0)/30,0)-R8C+MEP-MNR),0,1,1))) -> 0 | R93: =IF(RC1="","",IF(OR(R8C<=ROUND(DAYS360(ValDat,RC1,0)/30,0),R8C>ROUND(DAYS360(ExpDat,RC1,0)/30,0)),0,OFFSET(R45C,MAX(-MNR,ROUND(DAYS360(ValDat,RC1,0)/30,0)-R8C+MEP-MNR),0,1,1))) -> -204 | S93: =IF(RC1="","",IF(OR(R8C<=ROUND(DAYS360(ValDat,RC1,0)/30,0),R8C>ROUND(DAYS360(ExpDat,RC1,0)/30,0)),0,OFFSET(R45C,MAX(-MNR,ROUND(DAYS360(ValDat,RC1,0)/30,0)-R8C+MEP-MNR),0,1,1))) -> 460 | T93: =IF(RC1="","",IF(OR(R8C<=ROUND(DAYS360(ValDat,RC1,0)/30,0),R8C>ROUND(DAYS360(ExpDat,RC1,0)/30,0)),0,OFFSET(R45C,MAX(-MNR,ROUND(DAYS360(ValDat,RC1,0)/30,0)-R8C+MEP-MNR),0,1,1))) -> 282 | U93: =IF(RC1="","",IF(OR(R8C<=ROUND(DAYS360(ValDat,RC1,0)/30,0),R8C>ROUND(DAYS360(ExpDat,RC1,0)/30,0)),0,OFFSET(R45C,MAX(-MNR,ROUND(DAYS360(ValDat,RC1,0)/30,0)-R8C+MEP-MNR),0,1,1))) -> 75 | V93: =IF(RC1="","",IF(OR(R8C<=ROUND(DAYS360(ValDat,RC1,0)/30,0),R8C>ROUND(DAYS360(ExpDat,RC1,0)/30,0)),0,OFFSET(R45C,MAX(-MNR,ROUND(DAYS360(ValDat,RC1,0)/30,0)-R8C+MEP-MNR),0,1,1))) -> 13 | W93: =IF(RC1="","",IF(OR(R8C<=ROUND(DAYS360(ValDat,RC1,0)/30,0),R8C>ROUND(DAYS360(ExpDat,RC1,0)/30,0)),0,OFFSET(R45C,MAX(-MNR,ROUND(DAYS360(ValDat,RC1,0)/30,0)-R8C+MEP-MNR),0,1,1))) -> 9 | X93: =IF(RC1="","",IF(OR(R8C<=ROUND(DAYS360(ValDat,RC1,0)/30,0),R8C>ROUND(DAYS360(ExpDat,RC1,0)/30,0)),0,OFFSET(R45C,MAX(-MNR,ROUND(DAYS360(ValDat,RC1,0)/30,0)-R8C+MEP-MNR),0,1,1))) -> 0 | Y93: =IF(RC1="","",IF(OR(R8C<=ROUND(DAYS360(ValDat,RC1,0)/30,0),R8C>ROUND(DAYS360(ExpDat,RC1,0)/30,0)),0,OFFSET(R45C,MAX(-MNR,ROUND(DAYS360(ValDat,RC1,0)/30,0)-R8C+MEP-MNR),0,1,1))) -> 0 | Z93: =IF(RC1="","",IF(OR(R8C<=ROUND(DAYS360(ValDat,RC1,0)/30,0),R8C>ROUND(DAYS360(ExpDat,RC1,0)/30,0)),0,OFFSET(R45C,MAX(-MNR,ROUND(DAYS360(ValDat,RC1,0)/30,0)-R8C+MEP-MNR),0,1,1))) -> 0 | AA93: =IF(RC1="","",IF(OR(R8C<=ROUND(DAYS360(ValDat,RC1,0)/30,0),R8C>ROUND(DAYS360(ExpDat,RC1,0)/30,0)),0,OFFSET(R45C,MAX(-MNR,ROUND(DAYS360(ValDat,RC1,0)/30,0)-R8C+MEP-MNR),0,1,1))) -> 0 | AB93: =IF(RC1="","",IF(OR(R8C<=ROUND(DAYS360(ValDat,RC1,0)/30,0),R8C>ROUND(DAYS360(ExpDat,RC1,0)/30,0)),0,OFFSET(R45C,MAX(-MNR,ROUND(DAYS360(ValDat,RC1,0)/30,0)-R8C+MEP-MNR),0,1,1))) -> 0 | AC93: =IF(RC1="","",IF(OR(R8C<=ROUND(DAYS360(ValDat,RC1,0)/30,0),R8C>ROUND(DAYS360(ExpDat,RC1,0)/30,0)),0,OFFSET(R45C,MAX(-MNR,ROUND(DAYS360(ValDat,RC1,0)/30,0)-R8C+MEP-MNR),0,1,1))) -> 0 | AD93: =IF(RC1="","",IF(OR(R8C<=ROUND(DAYS360(ValDat,RC1,0)/30,0),R8C>ROUND(DAYS360(ExpDat,RC1,0)/30,0)),0,OFFSET(R45C,MAX(-MNR,ROUND(DAYS360(ValDat,RC1,0)/30,0)-R8C+MEP-MNR),0,1,1))) -> 0 | AE93: =IF(RC1="","",IF(OR(R8C<=ROUND(DAYS360(ValDat,RC1,0)/30,0),R8C>ROUND(DAYS360(ExpDat,RC1,0)/30,0)),0,OFFSET(R45C,MAX(-MNR,ROUND(DAYS360(ValDat,RC1,0)/30,0)-R8C+MEP-MNR),0,1,1))) -> 0 | AF93: =IF(RC1="","",IF(OR(R8C<=ROUND(DAYS360(ValDat,RC1,0)/30,0),R8C>ROUND(DAYS360(ExpDat,RC1,0)/30,0)),0,OFFSET(R45C,MAX(-MNR,ROUND(DAYS360(ValDat,RC1,0)/30,0)-R8C+MEP-MNR),0,1,1))) -> 0 | AG93: =IF(RC1="","",IF(OR(R8C<=ROUND(DAYS360(ValDat,RC1,0)/30,0),R8C>ROUND(DAYS360(ExpDat,RC1,0)/30,0)),0,OFFSET(R45C,MAX(-MNR,ROUND(DAYS360(ValDat,RC1,0)/30,0)-R8C+MEP-MNR),0,1,1))) -> 0 | AH93: =IF(RC1="","",IF(OR(R8C<=ROUND(DAYS360(ValDat,RC1,0)/30,0),R8C>ROUND(DAYS360(ExpDat,RC1,0)/30,0)),0,OFFSET(R45C,MAX(-MNR,ROUND(DAYS360(ValDat,RC1,0)/30,0)-R8C+MEP-MNR),0,1,1))) -> 0 | AI93: =IF(RC1="","",IF(OR(R8C<=ROUND(DAYS360(ValDat,RC1,0)/30,0),R8C>ROUND(DAYS360(ExpDat,RC1,0)/30,0)),0,OFFSET(R45C,MAX(-MNR,ROUND(DAYS360(ValDat,RC1,0)/30,0)-R8C+MEP-MNR),0,1,1))) -> 0 | AJ93: =IF(RC1="","",IF(OR(R8C<=ROUND(DAYS360(ValDat,RC1,0)/30,0),R8C>ROUND(DAYS360(ExpDat,RC1,0)/30,0)),0,OFFSET(R45C,MAX(-MNR,ROUND(DAYS360(ValDat,RC1,0)/30,0)-R8C+MEP-MNR),0,1,1))) -> 0 | AK93: =IF(RC1="","",IF(OR(R8C<=ROUND(DAYS360(ValDat,RC1,0)/30,0),R8C>ROUND(DAYS360(ExpDat,RC1,0)/30,0)),0,OFFSET(R45C,MAX(-MNR,ROUND(DAYS360(ValDat,RC1,0)/30,0)-R8C+MEP-MNR),0,1,1))) -> 0 | AL93: =IF(RC1="","",IF(OR(R8C<=ROUND(DAYS360(ValDat,RC1,0)/30,0),R8C>ROUND(DAYS360(ExpDat,RC1,0)/30,0)),0,OFFSET(R45C,MAX(-MNR,ROUND(DAYS360(ValDat,RC1,0)/30,0)-R8C+MEP-MNR),0,1,1))) -> 0 | AM93: =IF(RC1="","",IF(OR(R8C<=ROUND(DAYS360(ValDat,RC1,0)/30,0),R8C>ROUND(DAYS360(ExpDat,RC1,0)/30,0)),0,OFFSET(R45C,MAX(-MNR,ROUND(DAYS360(ValDat,RC1,0)/30,0)-R8C+MEP-MNR),0,1,1))) -> 0 | AN93: =IF(RC1="","",IF(OR(R8C<=ROUND(DAYS360(ValDat,RC1,0)/30,0),R8C>ROUND(DAYS360(ExpDat,RC1,0)/30,0)),0,OFFSET(R45C,MAX(-MNR,ROUND(DAYS360(ValDat,RC1,0)/30,0)-R8C+MEP-MNR),0,1,1))) -> 0 | AO93: =IF(RC1="","",IF(OR(R8C<=ROUND(DAYS360(ValDat,RC1,0)/30,0),R8C>ROUND(DAYS360(ExpDat,RC1,0)/30,0)),0,OFFSET(R45C,MAX(-MNR,ROUND(DAYS360(ValDat,RC1,0)/30,0)-R8C+MEP-MNR),0,1,1))) -> 0
A94: =IF(R[-1]C="","",IF(EOMONTH(R[-1]C,0)+1>RunDat,"",EOMONTH(R[-1]C,0)+1)) ->  | D94: =IF(RC1="","",SUM(RC[2]:RC[37])) ->  | F94: =IF(RC1="","",IF(OR(R8C<=ROUND(DAYS360(ValDat,RC1,0)/30,0),R8C>ROUND(DAYS360(ExpDat,RC1,0)/30,0)),0,OFFSET(R45C,MAX(-MNR,ROUND(DAYS360(ValDat,RC1,0)/30,0)-R8C+MEP-MNR),0,1,1))) ->  | G94: =IF(RC1="","",IF(OR(R8C<=ROUND(DAYS360(ValDat,RC1,0)/30,0),R8C>ROUND(DAYS360(ExpDat,RC1,0)/30,0)),0,OFFSET(R45C,MAX(-MNR,ROUND(DAYS360(ValDat,RC1,0)/30,0)-R8C+MEP-MNR),0,1,1))) ->  | H94: =IF(RC1="","",IF(OR(R8C<=ROUND(DAYS360(ValDat,RC1,0)/30,0),R8C>ROUND(DAYS360(ExpDat,RC1,0)/30,0)),0,OFFSET(R45C,MAX(-MNR,ROUND(DAYS360(ValDat,RC1,0)/30,0)-R8C+MEP-MNR),0,1,1))) ->  | I94: =IF(RC1="","",IF(OR(R8C<=ROUND(DAYS360(ValDat,RC1,0)/30,0),R8C>ROUND(DAYS360(ExpDat,RC1,0)/30,0)),0,OFFSET(R45C,MAX(-MNR,ROUND(DAYS360(ValDat,RC1,0)/30,0)-R8C+MEP-MNR),0,1,1))) ->  | J94: =IF(RC1="","",IF(OR(R8C<=ROUND(DAYS360(ValDat,RC1,0)/30,0),R8C>ROUND(DAYS360(ExpDat,RC1,0)/30,0)),0,OFFSET(R45C,MAX(-MNR,ROUND(DAYS360(ValDat,RC1,0)/30,0)-R8C+MEP-MNR),0,1,1))) ->  | K94: =IF(RC1="","",IF(OR(R8C<=ROUND(DAYS360(ValDat,RC1,0)/30,0),R8C>ROUND(DAYS360(ExpDat,RC1,0)/30,0)),0,OFFSET(R45C,MAX(-MNR,ROUND(DAYS360(ValDat,RC1,0)/30,0)-R8C+MEP-MNR),0,1,1))) ->  | L94: =IF(RC1="","",IF(OR(R8C<=ROUND(DAYS360(ValDat,RC1,0)/30,0),R8C>ROUND(DAYS360(ExpDat,RC1,0)/30,0)),0,OFFSET(R45C,MAX(-MNR,ROUND(DAYS360(ValDat,RC1,0)/30,0)-R8C+MEP-MNR),0,1,1))) ->  | M94: =IF(RC1="","",IF(OR(R8C<=ROUND(DAYS360(ValDat,RC1,0)/30,0),R8C>ROUND(DAYS360(ExpDat,RC1,0)/30,0)),0,OFFSET(R45C,MAX(-MNR,ROUND(DAYS360(ValDat,RC1,0)/30,0)-R8C+MEP-MNR),0,1,1))) ->  | N94: =IF(RC1="","",IF(OR(R8C<=ROUND(DAYS360(ValDat,RC1,0)/30,0),R8C>ROUND(DAYS360(ExpDat,RC1,0)/30,0)),0,OFFSET(R45C,MAX(-MNR,ROUND(DAYS360(ValDat,RC1,0)/30,0)-R8C+MEP-MNR),0,1,1))) ->  | O94: =IF(RC1="","",IF(OR(R8C<=ROUND(DAYS360(ValDat,RC1,0)/30,0),R8C>ROUND(DAYS360(ExpDat,RC1,0)/30,0)),0,OFFSET(R45C,MAX(-MNR,ROUND(DAYS360(ValDat,RC1,0)/30,0)-R8C+MEP-MNR),0,1,1))) ->  | P94: =IF(RC1="","",IF(OR(R8C<=ROUND(DAYS360(ValDat,RC1,0)/30,0),R8C>ROUND(DAYS360(ExpDat,RC1,0)/30,0)),0,OFFSET(R45C,MAX(-MNR,ROUND(DAYS360(ValDat,RC1,0)/30,0)-R8C+MEP-MNR),0,1,1))) ->  | Q94: =IF(RC1="","",IF(OR(R8C<=ROUND(DAYS360(ValDat,RC1,0)/30,0),R8C>ROUND(DAYS360(ExpDat,RC1,0)/30,0)),0,OFFSET(R45C,MAX(-MNR,ROUND(DAYS360(ValDat,RC1,0)/30,0)-R8C+MEP-MNR),0,1,1))) ->  | R94: =IF(RC1="","",IF(OR(R8C<=ROUND(DAYS360(ValDat,RC1,0)/30,0),R8C>ROUND(DAYS360(ExpDat,RC1,0)/30,0)),0,OFFSET(R45C,MAX(-MNR,ROUND(DAYS360(ValDat,RC1,0)/30,0)-R8C+MEP-MNR),0,1,1))) ->  | S94: =IF(RC1="","",IF(OR(R8C<=ROUND(DAYS360(ValDat,RC1,0)/30,0),R8C>ROUND(DAYS360(ExpDat,RC1,0)/30,0)),0,OFFSET(R45C,MAX(-MNR,ROUND(DAYS360(ValDat,RC1,0)/30,0)-R8C+MEP-MNR),0,1,1))) ->  | T94: =IF(RC1="","",IF(OR(R8C<=ROUND(DAYS360(ValDat,RC1,0)/30,0),R8C>ROUND(DAYS360(ExpDat,RC1,0)/30,0)),0,OFFSET(R45C,MAX(-MNR,ROUND(DAYS360(ValDat,RC1,0)/30,0)-R8C+MEP-MNR),0,1,1))) ->  | U94: =IF(RC1="","",IF(OR(R8C<=ROUND(DAYS360(ValDat,RC1,0)/30,0),R8C>ROUND(DAYS360(ExpDat,RC1,0)/30,0)),0,OFFSET(R45C,MAX(-MNR,ROUND(DAYS360(ValDat,RC1,0)/30,0)-R8C+MEP-MNR),0,1,1))) ->  | V94: =IF(RC1="","",IF(OR(R8C<=ROUND(DAYS360(ValDat,RC1,0)/30,0),R8C>ROUND(DAYS360(ExpDat,RC1,0)/30,0)),0,OFFSET(R45C,MAX(-MNR,ROUND(DAYS360(ValDat,RC1,0)/30,0)-R8C+MEP-MNR),0,1,1))) ->  | W94: =IF(RC1="","",IF(OR(R8C<=ROUND(DAYS360(ValDat,RC1,0)/30,0),R8C>ROUND(DAYS360(ExpDat,RC1,0)/30,0)),0,OFFSET(R45C,MAX(-MNR,ROUND(DAYS360(ValDat,RC1,0)/30,0)-R8C+MEP-MNR),0,1,1))) ->  | X94: =IF(RC1="","",IF(OR(R8C<=ROUND(DAYS360(ValDat,RC1,0)/30,0),R8C>ROUND(DAYS360(ExpDat,RC1,0)/30,0)),0,OFFSET(R45C,MAX(-MNR,ROUND(DAYS360(ValDat,RC1,0)/30,0)-R8C+MEP-MNR),0,1,1))) ->  | Y94: =IF(RC1="","",IF(OR(R8C<=ROUND(DAYS360(ValDat,RC1,0)/30,0),R8C>ROUND(DAYS360(ExpDat,RC1,0)/30,0)),0,OFFSET(R45C,MAX(-MNR,ROUND(DAYS360(ValDat,RC1,0)/30,0)-R8C+MEP-MNR),0,1,1))) ->  | Z94: =IF(RC1="","",IF(OR(R8C<=ROUND(DAYS360(ValDat,RC1,0)/30,0),R8C>ROUND(DAYS360(ExpDat,RC1,0)/30,0)),0,OFFSET(R45C,MAX(-MNR,ROUND(DAYS360(ValDat,RC1,0)/30,0)-R8C+MEP-MNR),0,1,1))) ->  | AA94: =IF(RC1="","",IF(OR(R8C<=ROUND(DAYS360(ValDat,RC1,0)/30,0),R8C>ROUND(DAYS360(ExpDat,RC1,0)/30,0)),0,OFFSET(R45C,MAX(-MNR,ROUND(DAYS360(ValDat,RC1,0)/30,0)-R8C+MEP-MNR),0,1,1))) ->  | AB94: =IF(RC1="","",IF(OR(R8C<=ROUND(DAYS360(ValDat,RC1,0)/30,0),R8C>ROUND(DAYS360(ExpDat,RC1,0)/30,0)),0,OFFSET(R45C,MAX(-MNR,ROUND(DAYS360(ValDat,RC1,0)/30,0)-R8C+MEP-MNR),0,1,1))) ->  | AC94: =IF(RC1="","",IF(OR(R8C<=ROUND(DAYS360(ValDat,RC1,0)/30,0),R8C>ROUND(DAYS360(ExpDat,RC1,0)/30,0)),0,OFFSET(R45C,MAX(-MNR,ROUND(DAYS360(ValDat,RC1,0)/30,0)-R8C+MEP-MNR),0,1,1))) ->  | AD94: =IF(RC1="","",IF(OR(R8C<=ROUND(DAYS360(ValDat,RC1,0)/30,0),R8C>ROUND(DAYS360(ExpDat,RC1,0)/30,0)),0,OFFSET(R45C,MAX(-MNR,ROUND(DAYS360(ValDat,RC1,0)/30,0)-R8C+MEP-MNR),0,1,1))) ->  | AE94: =IF(RC1="","",IF(OR(R8C<=ROUND(DAYS360(ValDat,RC1,0)/30,0),R8C>ROUND(DAYS360(ExpDat,RC1,0)/30,0)),0,OFFSET(R45C,MAX(-MNR,ROUND(DAYS360(ValDat,RC1,0)/30,0)-R8C+MEP-MNR),0,1,1))) ->  | AF94: =IF(RC1="","",IF(OR(R8C<=ROUND(DAYS360(ValDat,RC1,0)/30,0),R8C>ROUND(DAYS360(ExpDat,RC1,0)/30,0)),0,OFFSET(R45C,MAX(-MNR,ROUND(DAYS360(ValDat,RC1,0)/30,0)-R8C+MEP-MNR),0,1,1))) ->  | AG94: =IF(RC1="","",IF(OR(R8C<=ROUND(DAYS360(ValDat,RC1,0)/30,0),R8C>ROUND(DAYS360(ExpDat,RC1,0)/30,0)),0,OFFSET(R45C,MAX(-MNR,ROUND(DAYS360(ValDat,RC1,0)/30,0)-R8C+MEP-MNR),0,1,1))) ->  | AH94: =IF(RC1="","",IF(OR(R8C<=ROUND(DAYS360(ValDat,RC1,0)/30,0),R8C>ROUND(DAYS360(ExpDat,RC1,0)/30,0)),0,OFFSET(R45C,MAX(-MNR,ROUND(DAYS360(ValDat,RC1,0)/30,0)-R8C+MEP-MNR),0,1,1))) ->  | AI94: =IF(RC1="","",IF(OR(R8C<=ROUND(DAYS360(ValDat,RC1,0)/30,0),R8C>ROUND(DAYS360(ExpDat,RC1,0)/30,0)),0,OFFSET(R45C,MAX(-MNR,ROUND(DAYS360(ValDat,RC1,0)/30,0)-R8C+MEP-MNR),0,1,1))) ->  | AJ94: =IF(RC1="","",IF(OR(R8C<=ROUND(DAYS360(ValDat,RC1,0)/30,0),R8C>ROUND(DAYS360(ExpDat,RC1,0)/30,0)),0,OFFSET(R45C,MAX(-MNR,ROUND(DAYS360(ValDat,RC1,0)/30,0)-R8C+MEP-MNR),0,1,1))) ->  | AK94: =IF(RC1="","",IF(OR(R8C<=ROUND(DAYS360(ValDat,RC1,0)/30,0),R8C>ROUND(DAYS360(ExpDat,RC1,0)/30,0)),0,OFFSET(R45C,MAX(-MNR,ROUND(DAYS360(ValDat,RC1,0)/30,0)-R8C+MEP-MNR),0,1,1))) ->  | AL94: =IF(RC1="","",IF(OR(R8C<=ROUND(DAYS360(ValDat,RC1,0)/30,0),R8C>ROUND(DAYS360(ExpDat,RC1,0)/30,0)),0,OFFSET(R45C,MAX(-MNR,ROUND(DAYS360(ValDat,RC1,0)/30,0)-R8C+MEP-MNR),0,1,1))) ->  | AM94: =IF(RC1="","",IF(OR(R8C<=ROUND(DAYS360(ValDat,RC1,0)/30,0),R8C>ROUND(DAYS360(ExpDat,RC1,0)/30,0)),0,OFFSET(R45C,MAX(-MNR,ROUND(DAYS360(ValDat,RC1,0)/30,0)-R8C+MEP-MNR),0,1,1))) ->  | AN94: =IF(RC1="","",IF(OR(R8C<=ROUND(DAYS360(ValDat,RC1,0)/30,0),R8C>ROUND(DAYS360(ExpDat,RC1,0)/30,0)),0,OFFSET(R45C,MAX(-MNR,ROUND(DAYS360(ValDat,RC1,0)/30,0)-R8C+MEP-MNR),0,1,1))) ->  | AO94: =IF(RC1="","",IF(OR(R8C<=ROUND(DAYS360(ValDat,RC1,0)/30,0),R8C>ROUND(DAYS360(ExpDat,RC1,0)/30,0)),0,OFFSET(R45C,MAX(-MNR,ROUND(DAYS360(ValDat,RC1,0)/30,0)-R8C+MEP-MNR),0,1,1))) -> 
A95: =IF(R[-1]C="","",IF(EOMONTH(R[-1]C,0)+1>RunDat,"",EOMONTH(R[-1]C,0)+1)) ->  | D95: =IF(RC1="","",SUM(RC[2]:RC[37])) ->  | F95: =IF(RC1="","",IF(OR(R8C<=ROUND(DAYS360(ValDat,RC1,0)/30,0),R8C>ROUND(DAYS360(ExpDat,RC1,0)/30,0)),0,OFFSET(R45C,MAX(-MNR,ROUND(DAYS360(ValDat,RC1,0)/30,0)-R8C+MEP-MNR),0,1,1))) ->  | G95: =IF(RC1="","",IF(OR(R8C<=ROUND(DAYS360(ValDat,RC1,0)/30,0),R8C>ROUND(DAYS360(ExpDat,RC1,0)/30,0)),0,OFFSET(R45C,MAX(-MNR,ROUND(DAYS360(ValDat,RC1,0)/30,0)-R8C+MEP-MNR),0,1,1))) ->  | H95: =IF(RC1="","",IF(OR(R8C<=ROUND(DAYS360(ValDat,RC1,0)/30,0),R8C>ROUND(DAYS360(ExpDat,RC1,0)/30,0)),0,OFFSET(R45C,MAX(-MNR,ROUND(DAYS360(ValDat,RC1,0)/30,0)-R8C+MEP-MNR),0,1,1))) ->  | I95: =IF(RC1="","",IF(OR(R8C<=ROUND(DAYS360(ValDat,RC1,0)/30,0),R8C>ROUND(DAYS360(ExpDat,RC1,0)/30,0)),0,OFFSET(R45C,MAX(-MNR,ROUND(DAYS360(ValDat,RC1,0)/30,0)-R8C+MEP-MNR),0,1,1))) ->  | J95: =IF(RC1="","",IF(OR(R8C<=ROUND(DAYS360(ValDat,RC1,0)/30,0),R8C>ROUND(DAYS360(ExpDat,RC1,0)/30,0)),0,OFFSET(R45C,MAX(-MNR,ROUND(DAYS360(ValDat,RC1,0)/30,0)-R8C+MEP-MNR),0,1,1))) ->  | K95: =IF(RC1="","",IF(OR(R8C<=ROUND(DAYS360(ValDat,RC1,0)/30,0),R8C>ROUND(DAYS360(ExpDat,RC1,0)/30,0)),0,OFFSET(R45C,MAX(-MNR,ROUND(DAYS360(ValDat,RC1,0)/30,0)-R8C+MEP-MNR),0,1,1))) ->  | L95: =IF(RC1="","",IF(OR(R8C<=ROUND(DAYS360(ValDat,RC1,0)/30,0),R8C>ROUND(DAYS360(ExpDat,RC1,0)/30,0)),0,OFFSET(R45C,MAX(-MNR,ROUND(DAYS360(ValDat,RC1,0)/30,0)-R8C+MEP-MNR),0,1,1))) ->  | M95: =IF(RC1="","",IF(OR(R8C<=ROUND(DAYS360(ValDat,RC1,0)/30,0),R8C>ROUND(DAYS360(ExpDat,RC1,0)/30,0)),0,OFFSET(R45C,MAX(-MNR,ROUND(DAYS360(ValDat,RC1,0)/30,0)-R8C+MEP-MNR),0,1,1))) ->  | N95: =IF(RC1="","",IF(OR(R8C<=ROUND(DAYS360(ValDat,RC1,0)/30,0),R8C>ROUND(DAYS360(ExpDat,RC1,0)/30,0)),0,OFFSET(R45C,MAX(-MNR,ROUND(DAYS360(ValDat,RC1,0)/30,0)-R8C+MEP-MNR),0,1,1))) ->  | O95: =IF(RC1="","",IF(OR(R8C<=ROUND(DAYS360(ValDat,RC1,0)/30,0),R8C>ROUND(DAYS360(ExpDat,RC1,0)/30,0)),0,OFFSET(R45C,MAX(-MNR,ROUND(DAYS360(ValDat,RC1,0)/30,0)-R8C+MEP-MNR),0,1,1))) ->  | P95: =IF(RC1="","",IF(OR(R8C<=ROUND(DAYS360(ValDat,RC1,0)/30,0),R8C>ROUND(DAYS360(ExpDat,RC1,0)/30,0)),0,OFFSET(R45C,MAX(-MNR,ROUND(DAYS360(ValDat,RC1,0)/30,0)-R8C+MEP-MNR),0,1,1))) ->  | Q95: =IF(RC1="","",IF(OR(R8C<=ROUND(DAYS360(ValDat,RC1,0)/30,0),R8C>ROUND(DAYS360(ExpDat,RC1,0)/30,0)),0,OFFSET(R45C,MAX(-MNR,ROUND(DAYS360(ValDat,RC1,0)/30,0)-R8C+MEP-MNR),0,1,1))) ->  | R95: =IF(RC1="","",IF(OR(R8C<=ROUND(DAYS360(ValDat,RC1,0)/30,0),R8C>ROUND(DAYS360(ExpDat,RC1,0)/30,0)),0,OFFSET(R45C,MAX(-MNR,ROUND(DAYS360(ValDat,RC1,0)/30,0)-R8C+MEP-MNR),0,1,1))) ->  | S95: =IF(RC1="","",IF(OR(R8C<=ROUND(DAYS360(ValDat,RC1,0)/30,0),R8C>ROUND(DAYS360(ExpDat,RC1,0)/30,0)),0,OFFSET(R45C,MAX(-MNR,ROUND(DAYS360(ValDat,RC1,0)/30,0)-R8C+MEP-MNR),0,1,1))) ->  | T95: =IF(RC1="","",IF(OR(R8C<=ROUND(DAYS360(ValDat,RC1,0)/30,0),R8C>ROUND(DAYS360(ExpDat,RC1,0)/30,0)),0,OFFSET(R45C,MAX(-MNR,ROUND(DAYS360(ValDat,RC1,0)/30,0)-R8C+MEP-MNR),0,1,1))) ->  | U95: =IF(RC1="","",IF(OR(R8C<=ROUND(DAYS360(ValDat,RC1,0)/30,0),R8C>ROUND(DAYS360(ExpDat,RC1,0)/30,0)),0,OFFSET(R45C,MAX(-MNR,ROUND(DAYS360(ValDat,RC1,0)/30,0)-R8C+MEP-MNR),0,1,1))) ->  | V95: =IF(RC1="","",IF(OR(R8C<=ROUND(DAYS360(ValDat,RC1,0)/30,0),R8C>ROUND(DAYS360(ExpDat,RC1,0)/30,0)),0,OFFSET(R45C,MAX(-MNR,ROUND(DAYS360(ValDat,RC1,0)/30,0)-R8C+MEP-MNR),0,1,1))) ->  | W95: =IF(RC1="","",IF(OR(R8C<=ROUND(DAYS360(ValDat,RC1,0)/30,0),R8C>ROUND(DAYS360(ExpDat,RC1,0)/30,0)),0,OFFSET(R45C,MAX(-MNR,ROUND(DAYS360(ValDat,RC1,0)/30,0)-R8C+MEP-MNR),0,1,1))) ->  | X95: =IF(RC1="","",IF(OR(R8C<=ROUND(DAYS360(ValDat,RC1,0)/30,0),R8C>ROUND(DAYS360(ExpDat,RC1,0)/30,0)),0,OFFSET(R45C,MAX(-MNR,ROUND(DAYS360(ValDat,RC1,0)/30,0)-R8C+MEP-MNR),0,1,1))) ->  | Y95: =IF(RC1="","",IF(OR(R8C<=ROUND(DAYS360(ValDat,RC1,0)/30,0),R8C>ROUND(DAYS360(ExpDat,RC1,0)/30,0)),0,OFFSET(R45C,MAX(-MNR,ROUND(DAYS360(ValDat,RC1,0)/30,0)-R8C+MEP-MNR),0,1,1))) ->  | Z95: =IF(RC1="","",IF(OR(R8C<=ROUND(DAYS360(ValDat,RC1,0)/30,0),R8C>ROUND(DAYS360(ExpDat,RC1,0)/30,0)),0,OFFSET(R45C,MAX(-MNR,ROUND(DAYS360(ValDat,RC1,0)/30,0)-R8C+MEP-MNR),0,1,1))) ->  | AA95: =IF(RC1="","",IF(OR(R8C<=ROUND(DAYS360(ValDat,RC1,0)/30,0),R8C>ROUND(DAYS360(ExpDat,RC1,0)/30,0)),0,OFFSET(R45C,MAX(-MNR,ROUND(DAYS360(ValDat,RC1,0)/30,0)-R8C+MEP-MNR),0,1,1))) ->  | AB95: =IF(RC1="","",IF(OR(R8C<=ROUND(DAYS360(ValDat,RC1,0)/30,0),R8C>ROUND(DAYS360(ExpDat,RC1,0)/30,0)),0,OFFSET(R45C,MAX(-MNR,ROUND(DAYS360(ValDat,RC1,0)/30,0)-R8C+MEP-MNR),0,1,1))) ->  | AC95: =IF(RC1="","",IF(OR(R8C<=ROUND(DAYS360(ValDat,RC1,0)/30,0),R8C>ROUND(DAYS360(ExpDat,RC1,0)/30,0)),0,OFFSET(R45C,MAX(-MNR,ROUND(DAYS360(ValDat,RC1,0)/30,0)-R8C+MEP-MNR),0,1,1))) ->  | AD95: =IF(RC1="","",IF(OR(R8C<=ROUND(DAYS360(ValDat,RC1,0)/30,0),R8C>ROUND(DAYS360(ExpDat,RC1,0)/30,0)),0,OFFSET(R45C,MAX(-MNR,ROUND(DAYS360(ValDat,RC1,0)/30,0)-R8C+MEP-MNR),0,1,1))) ->  | AE95: =IF(RC1="","",IF(OR(R8C<=ROUND(DAYS360(ValDat,RC1,0)/30,0),R8C>ROUND(DAYS360(ExpDat,RC1,0)/30,0)),0,OFFSET(R45C,MAX(-MNR,ROUND(DAYS360(ValDat,RC1,0)/30,0)-R8C+MEP-MNR),0,1,1))) ->  | AF95: =IF(RC1="","",IF(OR(R8C<=ROUND(DAYS360(ValDat,RC1,0)/30,0),R8C>ROUND(DAYS360(ExpDat,RC1,0)/30,0)),0,OFFSET(R45C,MAX(-MNR,ROUND(DAYS360(ValDat,RC1,0)/30,0)-R8C+MEP-MNR),0,1,1))) ->  | AG95: =IF(RC1="","",IF(OR(R8C<=ROUND(DAYS360(ValDat,RC1,0)/30,0),R8C>ROUND(DAYS360(ExpDat,RC1,0)/30,0)),0,OFFSET(R45C,MAX(-MNR,ROUND(DAYS360(ValDat,RC1,0)/30,0)-R8C+MEP-MNR),0,1,1))) ->  | AH95: =IF(RC1="","",IF(OR(R8C<=ROUND(DAYS360(ValDat,RC1,0)/30,0),R8C>ROUND(DAYS360(ExpDat,RC1,0)/30,0)),0,OFFSET(R45C,MAX(-MNR,ROUND(DAYS360(ValDat,RC1,0)/30,0)-R8C+MEP-MNR),0,1,1))) ->  | AI95: =IF(RC1="","",IF(OR(R8C<=ROUND(DAYS360(ValDat,RC1,0)/30,0),R8C>ROUND(DAYS360(ExpDat,RC1,0)/30,0)),0,OFFSET(R45C,MAX(-MNR,ROUND(DAYS360(ValDat,RC1,0)/30,0)-R8C+MEP-MNR),0,1,1))) ->  | AJ95: =IF(RC1="","",IF(OR(R8C<=ROUND(DAYS360(ValDat,RC1,0)/30,0),R8C>ROUND(DAYS360(ExpDat,RC1,0)/30,0)),0,OFFSET(R45C,MAX(-MNR,ROUND(DAYS360(ValDat,RC1,0)/30,0)-R8C+MEP-MNR),0,1,1))) ->  | AK95: =IF(RC1="","",IF(OR(R8C<=ROUND(DAYS360(ValDat,RC1,0)/30,0),R8C>ROUND(DAYS360(ExpDat,RC1,0)/30,0)),0,OFFSET(R45C,MAX(-MNR,ROUND(DAYS360(ValDat,RC1,0)/30,0)-R8C+MEP-MNR),0,1,1))) ->  | AL95: =IF(RC1="","",IF(OR(R8C<=ROUND(DAYS360(ValDat,RC1,0)/30,0),R8C>ROUND(DAYS360(ExpDat,RC1,0)/30,0)),0,OFFSET(R45C,MAX(-MNR,ROUND(DAYS360(ValDat,RC1,0)/30,0)-R8C+MEP-MNR),0,1,1))) ->  | AM95: =IF(RC1="","",IF(OR(R8C<=ROUND(DAYS360(ValDat,RC1,0)/30,0),R8C>ROUND(DAYS360(ExpDat,RC1,0)/30,0)),0,OFFSET(R45C,MAX(-MNR,ROUND(DAYS360(ValDat,RC1,0)/30,0)-R8C+MEP-MNR),0,1,1))) ->  | AN95: =IF(RC1="","",IF(OR(R8C<=ROUND(DAYS360(ValDat,RC1,0)/30,0),R8C>ROUND(DAYS360(ExpDat,RC1,0)/30,0)),0,OFFSET(R45C,MAX(-MNR,ROUND(DAYS360(ValDat,RC1,0)/30,0)-R8C+MEP-MNR),0,1,1))) ->  | AO95: =IF(RC1="","",IF(OR(R8C<=ROUND(DAYS360(ValDat,RC1,0)/30,0),R8C>ROUND(DAYS360(ExpDat,RC1,0)/30,0)),0,OFFSET(R45C,MAX(-MNR,ROUND(DAYS360(ValDat,RC1,0)/30,0)-R8C+MEP-MNR),0,1,1))) -> 
A96: =IF(R[-1]C="","",IF(EOMONTH(R[-1]C,0)+1>RunDat,"",EOMONTH(R[-1]C,0)+1)) ->  | D96: =IF(RC1="","",SUM(RC[2]:RC[37])) ->  | F96: =IF(RC1="","",IF(OR(R8C<=ROUND(DAYS360(ValDat,RC1,0)/30,0),R8C>ROUND(DAYS360(ExpDat,RC1,0)/30,0)),0,OFFSET(R45C,MAX(-MNR,ROUND(DAYS360(ValDat,RC1,0)/30,0)-R8C+MEP-MNR),0,1,1))) ->  | G96: =IF(RC1="","",IF(OR(R8C<=ROUND(DAYS360(ValDat,RC1,0)/30,0),R8C>ROUND(DAYS360(ExpDat,RC1,0)/30,0)),0,OFFSET(R45C,MAX(-MNR,ROUND(DAYS360(ValDat,RC1,0)/30,0)-R8C+MEP-MNR),0,1,1))) ->  | H96: =IF(RC1="","",IF(OR(R8C<=ROUND(DAYS360(ValDat,RC1,0)/30,0),R8C>ROUND(DAYS360(ExpDat,RC1,0)/30,0)),0,OFFSET(R45C,MAX(-MNR,ROUND(DAYS360(ValDat,RC1,0)/30,0)-R8C+MEP-MNR),0,1,1))) ->  | I96: =IF(RC1="","",IF(OR(R8C<=ROUND(DAYS360(ValDat,RC1,0)/30,0),R8C>ROUND(DAYS360(ExpDat,RC1,0)/30,0)),0,OFFSET(R45C,MAX(-MNR,ROUND(DAYS360(ValDat,RC1,0)/30,0)-R8C+MEP-MNR),0,1,1))) ->  | J96: =IF(RC1="","",IF(OR(R8C<=ROUND(DAYS360(ValDat,RC1,0)/30,0),R8C>ROUND(DAYS360(ExpDat,RC1,0)/30,0)),0,OFFSET(R45C,MAX(-MNR,ROUND(DAYS360(ValDat,RC1,0)/30,0)-R8C+MEP-MNR),0,1,1))) ->  | K96: =IF(RC1="","",IF(OR(R8C<=ROUND(DAYS360(ValDat,RC1,0)/30,0),R8C>ROUND(DAYS360(ExpDat,RC1,0)/30,0)),0,OFFSET(R45C,MAX(-MNR,ROUND(DAYS360(ValDat,RC1,0)/30,0)-R8C+MEP-MNR),0,1,1))) ->  | L96: =IF(RC1="","",IF(OR(R8C<=ROUND(DAYS360(ValDat,RC1,0)/30,0),R8C>ROUND(DAYS360(ExpDat,RC1,0)/30,0)),0,OFFSET(R45C,MAX(-MNR,ROUND(DAYS360(ValDat,RC1,0)/30,0)-R8C+MEP-MNR),0,1,1))) ->  | M96: =IF(RC1="","",IF(OR(R8C<=ROUND(DAYS360(ValDat,RC1,0)/30,0),R8C>ROUND(DAYS360(ExpDat,RC1,0)/30,0)),0,OFFSET(R45C,MAX(-MNR,ROUND(DAYS360(ValDat,RC1,0)/30,0)-R8C+MEP-MNR),0,1,1))) ->  | N96: =IF(RC1="","",IF(OR(R8C<=ROUND(DAYS360(ValDat,RC1,0)/30,0),R8C>ROUND(DAYS360(ExpDat,RC1,0)/30,0)),0,OFFSET(R45C,MAX(-MNR,ROUND(DAYS360(ValDat,RC1,0)/30,0)-R8C+MEP-MNR),0,1,1))) ->  | O96: =IF(RC1="","",IF(OR(R8C<=ROUND(DAYS360(ValDat,RC1,0)/30,0),R8C>ROUND(DAYS360(ExpDat,RC1,0)/30,0)),0,OFFSET(R45C,MAX(-MNR,ROUND(DAYS360(ValDat,RC1,0)/30,0)-R8C+MEP-MNR),0,1,1))) ->  | P96: =IF(RC1="","",IF(OR(R8C<=ROUND(DAYS360(ValDat,RC1,0)/30,0),R8C>ROUND(DAYS360(ExpDat,RC1,0)/30,0)),0,OFFSET(R45C,MAX(-MNR,ROUND(DAYS360(ValDat,RC1,0)/30,0)-R8C+MEP-MNR),0,1,1))) ->  | Q96: =IF(RC1="","",IF(OR(R8C<=ROUND(DAYS360(ValDat,RC1,0)/30,0),R8C>ROUND(DAYS360(ExpDat,RC1,0)/30,0)),0,OFFSET(R45C,MAX(-MNR,ROUND(DAYS360(ValDat,RC1,0)/30,0)-R8C+MEP-MNR),0,1,1))) ->  | R96: =IF(RC1="","",IF(OR(R8C<=ROUND(DAYS360(ValDat,RC1,0)/30,0),R8C>ROUND(DAYS360(ExpDat,RC1,0)/30,0)),0,OFFSET(R45C,MAX(-MNR,ROUND(DAYS360(ValDat,RC1,0)/30,0)-R8C+MEP-MNR),0,1,1))) ->  | S96: =IF(RC1="","",IF(OR(R8C<=ROUND(DAYS360(ValDat,RC1,0)/30,0),R8C>ROUND(DAYS360(ExpDat,RC1,0)/30,0)),0,OFFSET(R45C,MAX(-MNR,ROUND(DAYS360(ValDat,RC1,0)/30,0)-R8C+MEP-MNR),0,1,1))) ->  | T96: =IF(RC1="","",IF(OR(R8C<=ROUND(DAYS360(ValDat,RC1,0)/30,0),R8C>ROUND(DAYS360(ExpDat,RC1,0)/30,0)),0,OFFSET(R45C,MAX(-MNR,ROUND(DAYS360(ValDat,RC1,0)/30,0)-R8C+MEP-MNR),0,1,1))) ->  | U96: =IF(RC1="","",IF(OR(R8C<=ROUND(DAYS360(ValDat,RC1,0)/30,0),R8C>ROUND(DAYS360(ExpDat,RC1,0)/30,0)),0,OFFSET(R45C,MAX(-MNR,ROUND(DAYS360(ValDat,RC1,0)/30,0)-R8C+MEP-MNR),0,1,1))) ->  | V96: =IF(RC1="","",IF(OR(R8C<=ROUND(DAYS360(ValDat,RC1,0)/30,0),R8C>ROUND(DAYS360(ExpDat,RC1,0)/30,0)),0,OFFSET(R45C,MAX(-MNR,ROUND(DAYS360(ValDat,RC1,0)/30,0)-R8C+MEP-MNR),0,1,1))) ->  | W96: =IF(RC1="","",IF(OR(R8C<=ROUND(DAYS360(ValDat,RC1,0)/30,0),R8C>ROUND(DAYS360(ExpDat,RC1,0)/30,0)),0,OFFSET(R45C,MAX(-MNR,ROUND(DAYS360(ValDat,RC1,0)/30,0)-R8C+MEP-MNR),0,1,1))) ->  | X96: =IF(RC1="","",IF(OR(R8C<=ROUND(DAYS360(ValDat,RC1,0)/30,0),R8C>ROUND(DAYS360(ExpDat,RC1,0)/30,0)),0,OFFSET(R45C,MAX(-MNR,ROUND(DAYS360(ValDat,RC1,0)/30,0)-R8C+MEP-MNR),0,1,1))) ->  | Y96: =IF(RC1="","",IF(OR(R8C<=ROUND(DAYS360(ValDat,RC1,0)/30,0),R8C>ROUND(DAYS360(ExpDat,RC1,0)/30,0)),0,OFFSET(R45C,MAX(-MNR,ROUND(DAYS360(ValDat,RC1,0)/30,0)-R8C+MEP-MNR),0,1,1))) ->  | Z96: =IF(RC1="","",IF(OR(R8C<=ROUND(DAYS360(ValDat,RC1,0)/30,0),R8C>ROUND(DAYS360(ExpDat,RC1,0)/30,0)),0,OFFSET(R45C,MAX(-MNR,ROUND(DAYS360(ValDat,RC1,0)/30,0)-R8C+MEP-MNR),0,1,1))) ->  | AA96: =IF(RC1="","",IF(OR(R8C<=ROUND(DAYS360(ValDat,RC1,0)/30,0),R8C>ROUND(DAYS360(ExpDat,RC1,0)/30,0)),0,OFFSET(R45C,MAX(-MNR,ROUND(DAYS360(ValDat,RC1,0)/30,0)-R8C+MEP-MNR),0,1,1))) ->  | AB96: =IF(RC1="","",IF(OR(R8C<=ROUND(DAYS360(ValDat,RC1,0)/30,0),R8C>ROUND(DAYS360(ExpDat,RC1,0)/30,0)),0,OFFSET(R45C,MAX(-MNR,ROUND(DAYS360(ValDat,RC1,0)/30,0)-R8C+MEP-MNR),0,1,1))) ->  | AC96: =IF(RC1="","",IF(OR(R8C<=ROUND(DAYS360(ValDat,RC1,0)/30,0),R8C>ROUND(DAYS360(ExpDat,RC1,0)/30,0)),0,OFFSET(R45C,MAX(-MNR,ROUND(DAYS360(ValDat,RC1,0)/30,0)-R8C+MEP-MNR),0,1,1))) ->  | AD96: =IF(RC1="","",IF(OR(R8C<=ROUND(DAYS360(ValDat,RC1,0)/30,0),R8C>ROUND(DAYS360(ExpDat,RC1,0)/30,0)),0,OFFSET(R45C,MAX(-MNR,ROUND(DAYS360(ValDat,RC1,0)/30,0)-R8C+MEP-MNR),0,1,1))) ->  | AE96: =IF(RC1="","",IF(OR(R8C<=ROUND(DAYS360(ValDat,RC1,0)/30,0),R8C>ROUND(DAYS360(ExpDat,RC1,0)/30,0)),0,OFFSET(R45C,MAX(-MNR,ROUND(DAYS360(ValDat,RC1,0)/30,0)-R8C+MEP-MNR),0,1,1))) ->  | AF96: =IF(RC1="","",IF(OR(R8C<=ROUND(DAYS360(ValDat,RC1,0)/30,0),R8C>ROUND(DAYS360(ExpDat,RC1,0)/30,0)),0,OFFSET(R45C,MAX(-MNR,ROUND(DAYS360(ValDat,RC1,0)/30,0)-R8C+MEP-MNR),0,1,1))) ->  | AG96: =IF(RC1="","",IF(OR(R8C<=ROUND(DAYS360(ValDat,RC1,0)/30,0),R8C>ROUND(DAYS360(ExpDat,RC1,0)/30,0)),0,OFFSET(R45C,MAX(-MNR,ROUND(DAYS360(ValDat,RC1,0)/30,0)-R8C+MEP-MNR),0,1,1))) ->  | AH96: =IF(RC1="","",IF(OR(R8C<=ROUND(DAYS360(ValDat,RC1,0)/30,0),R8C>ROUND(DAYS360(ExpDat,RC1,0)/30,0)),0,OFFSET(R45C,MAX(-MNR,ROUND(DAYS360(ValDat,RC1,0)/30,0)-R8C+MEP-MNR),0,1,1))) ->  | AI96: =IF(RC1="","",IF(OR(R8C<=ROUND(DAYS360(ValDat,RC1,0)/30,0),R8C>ROUND(DAYS360(ExpDat,RC1,0)/30,0)),0,OFFSET(R45C,MAX(-MNR,ROUND(DAYS360(ValDat,RC1,0)/30,0)-R8C+MEP-MNR),0,1,1))) ->  | AJ96: =IF(RC1="","",IF(OR(R8C<=ROUND(DAYS360(ValDat,RC1,0)/30,0),R8C>ROUND(DAYS360(ExpDat,RC1,0)/30,0)),0,OFFSET(R45C,MAX(-MNR,ROUND(DAYS360(ValDat,RC1,0)/30,0)-R8C+MEP-MNR),0,1,1))) ->  | AK96: =IF(RC1="","",IF(OR(R8C<=ROUND(DAYS360(ValDat,RC1,0)/30,0),R8C>ROUND(DAYS360(ExpDat,RC1,0)/30,0)),0,OFFSET(R45C,MAX(-MNR,ROUND(DAYS360(ValDat,RC1,0)/30,0)-R8C+MEP-MNR),0,1,1))) ->  | AL96: =IF(RC1="","",IF(OR(R8C<=ROUND(DAYS360(ValDat,RC1,0)/30,0),R8C>ROUND(DAYS360(ExpDat,RC1,0)/30,0)),0,OFFSET(R45C,MAX(-MNR,ROUND(DAYS360(ValDat,RC1,0)/30,0)-R8C+MEP-MNR),0,1,1))) ->  | AM96: =IF(RC1="","",IF(OR(R8C<=ROUND(DAYS360(ValDat,RC1,0)/30,0),R8C>ROUND(DAYS360(ExpDat,RC1,0)/30,0)),0,OFFSET(R45C,MAX(-MNR,ROUND(DAYS360(ValDat,RC1,0)/30,0)-R8C+MEP-MNR),0,1,1))) ->  | AN96: =IF(RC1="","",IF(OR(R8C<=ROUND(DAYS360(ValDat,RC1,0)/30,0),R8C>ROUND(DAYS360(ExpDat,RC1,0)/30,0)),0,OFFSET(R45C,MAX(-MNR,ROUND(DAYS360(ValDat,RC1,0)/30,0)-R8C+MEP-MNR),0,1,1))) ->  | AO96: =IF(RC1="","",IF(OR(R8C<=ROUND(DAYS360(ValDat,RC1,0)/30,0),R8C>ROUND(DAYS360(ExpDat,RC1,0)/30,0)),0,OFFSET(R45C,MAX(-MNR,ROUND(DAYS360(ValDat,RC1,0)/30,0)-R8C+MEP-MNR),0,1,1))) -> 
A97: =IF(R[-1]C="","",IF(EOMONTH(R[-1]C,0)+1>RunDat,"",EOMONTH(R[-1]C,0)+1)) ->  | D97: =IF(RC1="","",SUM(RC[2]:RC[37])) ->  | F97: =IF(RC1="","",IF(OR(R8C<=ROUND(DAYS360(ValDat,RC1,0)/30,0),R8C>ROUND(DAYS360(ExpDat,RC1,0)/30,0)),0,OFFSET(R45C,MAX(-MNR,ROUND(DAYS360(ValDat,RC1,0)/30,0)-R8C+MEP-MNR),0,1,1))) ->  | G97: =IF(RC1="","",IF(OR(R8C<=ROUND(DAYS360(ValDat,RC1,0)/30,0),R8C>ROUND(DAYS360(ExpDat,RC1,0)/30,0)),0,OFFSET(R45C,MAX(-MNR,ROUND(DAYS360(ValDat,RC1,0)/30,0)-R8C+MEP-MNR),0,1,1))) ->  | H97: =IF(RC1="","",IF(OR(R8C<=ROUND(DAYS360(ValDat,RC1,0)/30,0),R8C>ROUND(DAYS360(ExpDat,RC1,0)/30,0)),0,OFFSET(R45C,MAX(-MNR,ROUND(DAYS360(ValDat,RC1,0)/30,0)-R8C+MEP-MNR),0,1,1))) ->  | I97: =IF(RC1="","",IF(OR(R8C<=ROUND(DAYS360(ValDat,RC1,0)/30,0),R8C>ROUND(DAYS360(ExpDat,RC1,0)/30,0)),0,OFFSET(R45C,MAX(-MNR,ROUND(DAYS360(ValDat,RC1,0)/30,0)-R8C+MEP-MNR),0,1,1))) ->  | J97: =IF(RC1="","",IF(OR(R8C<=ROUND(DAYS360(ValDat,RC1,0)/30,0),R8C>ROUND(DAYS360(ExpDat,RC1,0)/30,0)),0,OFFSET(R45C,MAX(-MNR,ROUND(DAYS360(ValDat,RC1,0)/30,0)-R8C+MEP-MNR),0,1,1))) ->  | K97: =IF(RC1="","",IF(OR(R8C<=ROUND(DAYS360(ValDat,RC1,0)/30,0),R8C>ROUND(DAYS360(ExpDat,RC1,0)/30,0)),0,OFFSET(R45C,MAX(-MNR,ROUND(DAYS360(ValDat,RC1,0)/30,0)-R8C+MEP-MNR),0,1,1))) ->  | L97: =IF(RC1="","",IF(OR(R8C<=ROUND(DAYS360(ValDat,RC1,0)/30,0),R8C>ROUND(DAYS360(ExpDat,RC1,0)/30,0)),0,OFFSET(R45C,MAX(-MNR,ROUND(DAYS360(ValDat,RC1,0)/30,0)-R8C+MEP-MNR),0,1,1))) ->  | M97: =IF(RC1="","",IF(OR(R8C<=ROUND(DAYS360(ValDat,RC1,0)/30,0),R8C>ROUND(DAYS360(ExpDat,RC1,0)/30,0)),0,OFFSET(R45C,MAX(-MNR,ROUND(DAYS360(ValDat,RC1,0)/30,0)-R8C+MEP-MNR),0,1,1))) ->  | N97: =IF(RC1="","",IF(OR(R8C<=ROUND(DAYS360(ValDat,RC1,0)/30,0),R8C>ROUND(DAYS360(ExpDat,RC1,0)/30,0)),0,OFFSET(R45C,MAX(-MNR,ROUND(DAYS360(ValDat,RC1,0)/30,0)-R8C+MEP-MNR),0,1,1))) ->  | O97: =IF(RC1="","",IF(OR(R8C<=ROUND(DAYS360(ValDat,RC1,0)/30,0),R8C>ROUND(DAYS360(ExpDat,RC1,0)/30,0)),0,OFFSET(R45C,MAX(-MNR,ROUND(DAYS360(ValDat,RC1,0)/30,0)-R8C+MEP-MNR),0,1,1))) ->  | P97: =IF(RC1="","",IF(OR(R8C<=ROUND(DAYS360(ValDat,RC1,0)/30,0),R8C>ROUND(DAYS360(ExpDat,RC1,0)/30,0)),0,OFFSET(R45C,MAX(-MNR,ROUND(DAYS360(ValDat,RC1,0)/30,0)-R8C+MEP-MNR),0,1,1))) ->  | Q97: =IF(RC1="","",IF(OR(R8C<=ROUND(DAYS360(ValDat,RC1,0)/30,0),R8C>ROUND(DAYS360(ExpDat,RC1,0)/30,0)),0,OFFSET(R45C,MAX(-MNR,ROUND(DAYS360(ValDat,RC1,0)/30,0)-R8C+MEP-MNR),0,1,1))) ->  | R97: =IF(RC1="","",IF(OR(R8C<=ROUND(DAYS360(ValDat,RC1,0)/30,0),R8C>ROUND(DAYS360(ExpDat,RC1,0)/30,0)),0,OFFSET(R45C,MAX(-MNR,ROUND(DAYS360(ValDat,RC1,0)/30,0)-R8C+MEP-MNR),0,1,1))) ->  | S97: =IF(RC1="","",IF(OR(R8C<=ROUND(DAYS360(ValDat,RC1,0)/30,0),R8C>ROUND(DAYS360(ExpDat,RC1,0)/30,0)),0,OFFSET(R45C,MAX(-MNR,ROUND(DAYS360(ValDat,RC1,0)/30,0)-R8C+MEP-MNR),0,1,1))) ->  | T97: =IF(RC1="","",IF(OR(R8C<=ROUND(DAYS360(ValDat,RC1,0)/30,0),R8C>ROUND(DAYS360(ExpDat,RC1,0)/30,0)),0,OFFSET(R45C,MAX(-MNR,ROUND(DAYS360(ValDat,RC1,0)/30,0)-R8C+MEP-MNR),0,1,1))) ->  | U97: =IF(RC1="","",IF(OR(R8C<=ROUND(DAYS360(ValDat,RC1,0)/30,0),R8C>ROUND(DAYS360(ExpDat,RC1,0)/30,0)),0,OFFSET(R45C,MAX(-MNR,ROUND(DAYS360(ValDat,RC1,0)/30,0)-R8C+MEP-MNR),0,1,1))) ->  | V97: =IF(RC1="","",IF(OR(R8C<=ROUND(DAYS360(ValDat,RC1,0)/30,0),R8C>ROUND(DAYS360(ExpDat,RC1,0)/30,0)),0,OFFSET(R45C,MAX(-MNR,ROUND(DAYS360(ValDat,RC1,0)/30,0)-R8C+MEP-MNR),0,1,1))) ->  | W97: =IF(RC1="","",IF(OR(R8C<=ROUND(DAYS360(ValDat,RC1,0)/30,0),R8C>ROUND(DAYS360(ExpDat,RC1,0)/30,0)),0,OFFSET(R45C,MAX(-MNR,ROUND(DAYS360(ValDat,RC1,0)/30,0)-R8C+MEP-MNR),0,1,1))) ->  | X97: =IF(RC1="","",IF(OR(R8C<=ROUND(DAYS360(ValDat,RC1,0)/30,0),R8C>ROUND(DAYS360(ExpDat,RC1,0)/30,0)),0,OFFSET(R45C,MAX(-MNR,ROUND(DAYS360(ValDat,RC1,0)/30,0)-R8C+MEP-MNR),0,1,1))) ->  | Y97: =IF(RC1="","",IF(OR(R8C<=ROUND(DAYS360(ValDat,RC1,0)/30,0),R8C>ROUND(DAYS360(ExpDat,RC1,0)/30,0)),0,OFFSET(R45C,MAX(-MNR,ROUND(DAYS360(ValDat,RC1,0)/30,0)-R8C+MEP-MNR),0,1,1))) ->  | Z97: =IF(RC1="","",IF(OR(R8C<=ROUND(DAYS360(ValDat,RC1,0)/30,0),R8C>ROUND(DAYS360(ExpDat,RC1,0)/30,0)),0,OFFSET(R45C,MAX(-MNR,ROUND(DAYS360(ValDat,RC1,0)/30,0)-R8C+MEP-MNR),0,1,1))) ->  | AA97: =IF(RC1="","",IF(OR(R8C<=ROUND(DAYS360(ValDat,RC1,0)/30,0),R8C>ROUND(DAYS360(ExpDat,RC1,0)/30,0)),0,OFFSET(R45C,MAX(-MNR,ROUND(DAYS360(ValDat,RC1,0)/30,0)-R8C+MEP-MNR),0,1,1))) ->  | AB97: =IF(RC1="","",IF(OR(R8C<=ROUND(DAYS360(ValDat,RC1,0)/30,0),R8C>ROUND(DAYS360(ExpDat,RC1,0)/30,0)),0,OFFSET(R45C,MAX(-MNR,ROUND(DAYS360(ValDat,RC1,0)/30,0)-R8C+MEP-MNR),0,1,1))) ->  | AC97: =IF(RC1="","",IF(OR(R8C<=ROUND(DAYS360(ValDat,RC1,0)/30,0),R8C>ROUND(DAYS360(ExpDat,RC1,0)/30,0)),0,OFFSET(R45C,MAX(-MNR,ROUND(DAYS360(ValDat,RC1,0)/30,0)-R8C+MEP-MNR),0,1,1))) ->  | AD97: =IF(RC1="","",IF(OR(R8C<=ROUND(DAYS360(ValDat,RC1,0)/30,0),R8C>ROUND(DAYS360(ExpDat,RC1,0)/30,0)),0,OFFSET(R45C,MAX(-MNR,ROUND(DAYS360(ValDat,RC1,0)/30,0)-R8C+MEP-MNR),0,1,1))) ->  | AE97: =IF(RC1="","",IF(OR(R8C<=ROUND(DAYS360(ValDat,RC1,0)/30,0),R8C>ROUND(DAYS360(ExpDat,RC1,0)/30,0)),0,OFFSET(R45C,MAX(-MNR,ROUND(DAYS360(ValDat,RC1,0)/30,0)-R8C+MEP-MNR),0,1,1))) ->  | AF97: =IF(RC1="","",IF(OR(R8C<=ROUND(DAYS360(ValDat,RC1,0)/30,0),R8C>ROUND(DAYS360(ExpDat,RC1,0)/30,0)),0,OFFSET(R45C,MAX(-MNR,ROUND(DAYS360(ValDat,RC1,0)/30,0)-R8C+MEP-MNR),0,1,1))) ->  | AG97: =IF(RC1="","",IF(OR(R8C<=ROUND(DAYS360(ValDat,RC1,0)/30,0),R8C>ROUND(DAYS360(ExpDat,RC1,0)/30,0)),0,OFFSET(R45C,MAX(-MNR,ROUND(DAYS360(ValDat,RC1,0)/30,0)-R8C+MEP-MNR),0,1,1))) ->  | AH97: =IF(RC1="","",IF(OR(R8C<=ROUND(DAYS360(ValDat,RC1,0)/30,0),R8C>ROUND(DAYS360(ExpDat,RC1,0)/30,0)),0,OFFSET(R45C,MAX(-MNR,ROUND(DAYS360(ValDat,RC1,0)/30,0)-R8C+MEP-MNR),0,1,1))) ->  | AI97: =IF(RC1="","",IF(OR(R8C<=ROUND(DAYS360(ValDat,RC1,0)/30,0),R8C>ROUND(DAYS360(ExpDat,RC1,0)/30,0)),0,OFFSET(R45C,MAX(-MNR,ROUND(DAYS360(ValDat,RC1,0)/30,0)-R8C+MEP-MNR),0,1,1))) ->  | AJ97: =IF(RC1="","",IF(OR(R8C<=ROUND(DAYS360(ValDat,RC1,0)/30,0),R8C>ROUND(DAYS360(ExpDat,RC1,0)/30,0)),0,OFFSET(R45C,MAX(-MNR,ROUND(DAYS360(ValDat,RC1,0)/30,0)-R8C+MEP-MNR),0,1,1))) ->  | AK97: =IF(RC1="","",IF(OR(R8C<=ROUND(DAYS360(ValDat,RC1,0)/30,0),R8C>ROUND(DAYS360(ExpDat,RC1,0)/30,0)),0,OFFSET(R45C,MAX(-MNR,ROUND(DAYS360(ValDat,RC1,0)/30,0)-R8C+MEP-MNR),0,1,1))) ->  | AL97: =IF(RC1="","",IF(OR(R8C<=ROUND(DAYS360(ValDat,RC1,0)/30,0),R8C>ROUND(DAYS360(ExpDat,RC1,0)/30,0)),0,OFFSET(R45C,MAX(-MNR,ROUND(DAYS360(ValDat,RC1,0)/30,0)-R8C+MEP-MNR),0,1,1))) ->  | AM97: =IF(RC1="","",IF(OR(R8C<=ROUND(DAYS360(ValDat,RC1,0)/30,0),R8C>ROUND(DAYS360(ExpDat,RC1,0)/30,0)),0,OFFSET(R45C,MAX(-MNR,ROUND(DAYS360(ValDat,RC1,0)/30,0)-R8C+MEP-MNR),0,1,1))) ->  | AN97: =IF(RC1="","",IF(OR(R8C<=ROUND(DAYS360(ValDat,RC1,0)/30,0),R8C>ROUND(DAYS360(ExpDat,RC1,0)/30,0)),0,OFFSET(R45C,MAX(-MNR,ROUND(DAYS360(ValDat,RC1,0)/30,0)-R8C+MEP-MNR),0,1,1))) ->  | AO97: =IF(RC1="","",IF(OR(R8C<=ROUND(DAYS360(ValDat,RC1,0)/30,0),R8C>ROUND(DAYS360(ExpDat,RC1,0)/30,0)),0,OFFSET(R45C,MAX(-MNR,ROUND(DAYS360(ValDat,RC1,0)/30,0)-R8C+MEP-MNR),0,1,1))) -> 
A98: =IF(R[-1]C="","",IF(EOMONTH(R[-1]C,0)+1>RunDat,"",EOMONTH(R[-1]C,0)+1)) ->  | D98: =IF(RC1="","",SUM(RC[2]:RC[37])) ->  | F98: =IF(RC1="","",IF(OR(R8C<=ROUND(DAYS360(ValDat,RC1,0)/30,0),R8C>ROUND(DAYS360(ExpDat,RC1,0)/30,0)),0,OFFSET(R45C,MAX(-MNR,ROUND(DAYS360(ValDat,RC1,0)/30,0)-R8C+MEP-MNR),0,1,1))) ->  | G98: =IF(RC1="","",IF(OR(R8C<=ROUND(DAYS360(ValDat,RC1,0)/30,0),R8C>ROUND(DAYS360(ExpDat,RC1,0)/30,0)),0,OFFSET(R45C,MAX(-MNR,ROUND(DAYS360(ValDat,RC1,0)/30,0)-R8C+MEP-MNR),0,1,1))) ->  | H98: =IF(RC1="","",IF(OR(R8C<=ROUND(DAYS360(ValDat,RC1,0)/30,0),R8C>ROUND(DAYS360(ExpDat,RC1,0)/30,0)),0,OFFSET(R45C,MAX(-MNR,ROUND(DAYS360(ValDat,RC1,0)/30,0)-R8C+MEP-MNR),0,1,1))) ->  | I98: =IF(RC1="","",IF(OR(R8C<=ROUND(DAYS360(ValDat,RC1,0)/30,0),R8C>ROUND(DAYS360(ExpDat,RC1,0)/30,0)),0,OFFSET(R45C,MAX(-MNR,ROUND(DAYS360(ValDat,RC1,0)/30,0)-R8C+MEP-MNR),0,1,1))) ->  | J98: =IF(RC1="","",IF(OR(R8C<=ROUND(DAYS360(ValDat,RC1,0)/30,0),R8C>ROUND(DAYS360(ExpDat,RC1,0)/30,0)),0,OFFSET(R45C,MAX(-MNR,ROUND(DAYS360(ValDat,RC1,0)/30,0)-R8C+MEP-MNR),0,1,1))) ->  | K98: =IF(RC1="","",IF(OR(R8C<=ROUND(DAYS360(ValDat,RC1,0)/30,0),R8C>ROUND(DAYS360(ExpDat,RC1,0)/30,0)),0,OFFSET(R45C,MAX(-MNR,ROUND(DAYS360(ValDat,RC1,0)/30,0)-R8C+MEP-MNR),0,1,1))) ->  | L98: =IF(RC1="","",IF(OR(R8C<=ROUND(DAYS360(ValDat,RC1,0)/30,0),R8C>ROUND(DAYS360(ExpDat,RC1,0)/30,0)),0,OFFSET(R45C,MAX(-MNR,ROUND(DAYS360(ValDat,RC1,0)/30,0)-R8C+MEP-MNR),0,1,1))) ->  | M98: =IF(RC1="","",IF(OR(R8C<=ROUND(DAYS360(ValDat,RC1,0)/30,0),R8C>ROUND(DAYS360(ExpDat,RC1,0)/30,0)),0,OFFSET(R45C,MAX(-MNR,ROUND(DAYS360(ValDat,RC1,0)/30,0)-R8C+MEP-MNR),0,1,1))) ->  | N98: =IF(RC1="","",IF(OR(R8C<=ROUND(DAYS360(ValDat,RC1,0)/30,0),R8C>ROUND(DAYS360(ExpDat,RC1,0)/30,0)),0,OFFSET(R45C,MAX(-MNR,ROUND(DAYS360(ValDat,RC1,0)/30,0)-R8C+MEP-MNR),0,1,1))) ->  | O98: =IF(RC1="","",IF(OR(R8C<=ROUND(DAYS360(ValDat,RC1,0)/30,0),R8C>ROUND(DAYS360(ExpDat,RC1,0)/30,0)),0,OFFSET(R45C,MAX(-MNR,ROUND(DAYS360(ValDat,RC1,0)/30,0)-R8C+MEP-MNR),0,1,1))) ->  | P98: =IF(RC1="","",IF(OR(R8C<=ROUND(DAYS360(ValDat,RC1,0)/30,0),R8C>ROUND(DAYS360(ExpDat,RC1,0)/30,0)),0,OFFSET(R45C,MAX(-MNR,ROUND(DAYS360(ValDat,RC1,0)/30,0)-R8C+MEP-MNR),0,1,1))) ->  | Q98: =IF(RC1="","",IF(OR(R8C<=ROUND(DAYS360(ValDat,RC1,0)/30,0),R8C>ROUND(DAYS360(ExpDat,RC1,0)/30,0)),0,OFFSET(R45C,MAX(-MNR,ROUND(DAYS360(ValDat,RC1,0)/30,0)-R8C+MEP-MNR),0,1,1))) ->  | R98: =IF(RC1="","",IF(OR(R8C<=ROUND(DAYS360(ValDat,RC1,0)/30,0),R8C>ROUND(DAYS360(ExpDat,RC1,0)/30,0)),0,OFFSET(R45C,MAX(-MNR,ROUND(DAYS360(ValDat,RC1,0)/30,0)-R8C+MEP-MNR),0,1,1))) ->  | S98: =IF(RC1="","",IF(OR(R8C<=ROUND(DAYS360(ValDat,RC1,0)/30,0),R8C>ROUND(DAYS360(ExpDat,RC1,0)/30,0)),0,OFFSET(R45C,MAX(-MNR,ROUND(DAYS360(ValDat,RC1,0)/30,0)-R8C+MEP-MNR),0,1,1))) ->  | T98: =IF(RC1="","",IF(OR(R8C<=ROUND(DAYS360(ValDat,RC1,0)/30,0),R8C>ROUND(DAYS360(ExpDat,RC1,0)/30,0)),0,OFFSET(R45C,MAX(-MNR,ROUND(DAYS360(ValDat,RC1,0)/30,0)-R8C+MEP-MNR),0,1,1))) ->  | U98: =IF(RC1="","",IF(OR(R8C<=ROUND(DAYS360(ValDat,RC1,0)/30,0),R8C>ROUND(DAYS360(ExpDat,RC1,0)/30,0)),0,OFFSET(R45C,MAX(-MNR,ROUND(DAYS360(ValDat,RC1,0)/30,0)-R8C+MEP-MNR),0,1,1))) ->  | V98: =IF(RC1="","",IF(OR(R8C<=ROUND(DAYS360(ValDat,RC1,0)/30,0),R8C>ROUND(DAYS360(ExpDat,RC1,0)/30,0)),0,OFFSET(R45C,MAX(-MNR,ROUND(DAYS360(ValDat,RC1,0)/30,0)-R8C+MEP-MNR),0,1,1))) ->  | W98: =IF(RC1="","",IF(OR(R8C<=ROUND(DAYS360(ValDat,RC1,0)/30,0),R8C>ROUND(DAYS360(ExpDat,RC1,0)/30,0)),0,OFFSET(R45C,MAX(-MNR,ROUND(DAYS360(ValDat,RC1,0)/30,0)-R8C+MEP-MNR),0,1,1))) ->  | X98: =IF(RC1="","",IF(OR(R8C<=ROUND(DAYS360(ValDat,RC1,0)/30,0),R8C>ROUND(DAYS360(ExpDat,RC1,0)/30,0)),0,OFFSET(R45C,MAX(-MNR,ROUND(DAYS360(ValDat,RC1,0)/30,0)-R8C+MEP-MNR),0,1,1))) ->  | Y98: =IF(RC1="","",IF(OR(R8C<=ROUND(DAYS360(ValDat,RC1,0)/30,0),R8C>ROUND(DAYS360(ExpDat,RC1,0)/30,0)),0,OFFSET(R45C,MAX(-MNR,ROUND(DAYS360(ValDat,RC1,0)/30,0)-R8C+MEP-MNR),0,1,1))) ->  | Z98: =IF(RC1="","",IF(OR(R8C<=ROUND(DAYS360(ValDat,RC1,0)/30,0),R8C>ROUND(DAYS360(ExpDat,RC1,0)/30,0)),0,OFFSET(R45C,MAX(-MNR,ROUND(DAYS360(ValDat,RC1,0)/30,0)-R8C+MEP-MNR),0,1,1))) ->  | AA98: =IF(RC1="","",IF(OR(R8C<=ROUND(DAYS360(ValDat,RC1,0)/30,0),R8C>ROUND(DAYS360(ExpDat,RC1,0)/30,0)),0,OFFSET(R45C,MAX(-MNR,ROUND(DAYS360(ValDat,RC1,0)/30,0)-R8C+MEP-MNR),0,1,1))) ->  | AB98: =IF(RC1="","",IF(OR(R8C<=ROUND(DAYS360(ValDat,RC1,0)/30,0),R8C>ROUND(DAYS360(ExpDat,RC1,0)/30,0)),0,OFFSET(R45C,MAX(-MNR,ROUND(DAYS360(ValDat,RC1,0)/30,0)-R8C+MEP-MNR),0,1,1))) ->  | AC98: =IF(RC1="","",IF(OR(R8C<=ROUND(DAYS360(ValDat,RC1,0)/30,0),R8C>ROUND(DAYS360(ExpDat,RC1,0)/30,0)),0,OFFSET(R45C,MAX(-MNR,ROUND(DAYS360(ValDat,RC1,0)/30,0)-R8C+MEP-MNR),0,1,1))) ->  | AD98: =IF(RC1="","",IF(OR(R8C<=ROUND(DAYS360(ValDat,RC1,0)/30,0),R8C>ROUND(DAYS360(ExpDat,RC1,0)/30,0)),0,OFFSET(R45C,MAX(-MNR,ROUND(DAYS360(ValDat,RC1,0)/30,0)-R8C+MEP-MNR),0,1,1))) ->  | AE98: =IF(RC1="","",IF(OR(R8C<=ROUND(DAYS360(ValDat,RC1,0)/30,0),R8C>ROUND(DAYS360(ExpDat,RC1,0)/30,0)),0,OFFSET(R45C,MAX(-MNR,ROUND(DAYS360(ValDat,RC1,0)/30,0)-R8C+MEP-MNR),0,1,1))) ->  | AF98: =IF(RC1="","",IF(OR(R8C<=ROUND(DAYS360(ValDat,RC1,0)/30,0),R8C>ROUND(DAYS360(ExpDat,RC1,0)/30,0)),0,OFFSET(R45C,MAX(-MNR,ROUND(DAYS360(ValDat,RC1,0)/30,0)-R8C+MEP-MNR),0,1,1))) ->  | AG98: =IF(RC1="","",IF(OR(R8C<=ROUND(DAYS360(ValDat,RC1,0)/30,0),R8C>ROUND(DAYS360(ExpDat,RC1,0)/30,0)),0,OFFSET(R45C,MAX(-MNR,ROUND(DAYS360(ValDat,RC1,0)/30,0)-R8C+MEP-MNR),0,1,1))) ->  | AH98: =IF(RC1="","",IF(OR(R8C<=ROUND(DAYS360(ValDat,RC1,0)/30,0),R8C>ROUND(DAYS360(ExpDat,RC1,0)/30,0)),0,OFFSET(R45C,MAX(-MNR,ROUND(DAYS360(ValDat,RC1,0)/30,0)-R8C+MEP-MNR),0,1,1))) ->  | AI98: =IF(RC1="","",IF(OR(R8C<=ROUND(DAYS360(ValDat,RC1,0)/30,0),R8C>ROUND(DAYS360(ExpDat,RC1,0)/30,0)),0,OFFSET(R45C,MAX(-MNR,ROUND(DAYS360(ValDat,RC1,0)/30,0)-R8C+MEP-MNR),0,1,1))) ->  | AJ98: =IF(RC1="","",IF(OR(R8C<=ROUND(DAYS360(ValDat,RC1,0)/30,0),R8C>ROUND(DAYS360(ExpDat,RC1,0)/30,0)),0,OFFSET(R45C,MAX(-MNR,ROUND(DAYS360(ValDat,RC1,0)/30,0)-R8C+MEP-MNR),0,1,1))) ->  | AK98: =IF(RC1="","",IF(OR(R8C<=ROUND(DAYS360(ValDat,RC1,0)/30,0),R8C>ROUND(DAYS360(ExpDat,RC1,0)/30,0)),0,OFFSET(R45C,MAX(-MNR,ROUND(DAYS360(ValDat,RC1,0)/30,0)-R8C+MEP-MNR),0,1,1))) ->  | AL98: =IF(RC1="","",IF(OR(R8C<=ROUND(DAYS360(ValDat,RC1,0)/30,0),R8C>ROUND(DAYS360(ExpDat,RC1,0)/30,0)),0,OFFSET(R45C,MAX(-MNR,ROUND(DAYS360(ValDat,RC1,0)/30,0)-R8C+MEP-MNR),0,1,1))) ->  | AM98: =IF(RC1="","",IF(OR(R8C<=ROUND(DAYS360(ValDat,RC1,0)/30,0),R8C>ROUND(DAYS360(ExpDat,RC1,0)/30,0)),0,OFFSET(R45C,MAX(-MNR,ROUND(DAYS360(ValDat,RC1,0)/30,0)-R8C+MEP-MNR),0,1,1))) ->  | AN98: =IF(RC1="","",IF(OR(R8C<=ROUND(DAYS360(ValDat,RC1,0)/30,0),R8C>ROUND(DAYS360(ExpDat,RC1,0)/30,0)),0,OFFSET(R45C,MAX(-MNR,ROUND(DAYS360(ValDat,RC1,0)/30,0)-R8C+MEP-MNR),0,1,1))) ->  | AO98: =IF(RC1="","",IF(OR(R8C<=ROUND(DAYS360(ValDat,RC1,0)/30,0),R8C>ROUND(DAYS360(ExpDat,RC1,0)/30,0)),0,OFFSET(R45C,MAX(-MNR,ROUND(DAYS360(ValDat,RC1,0)/30,0)-R8C+MEP-MNR),0,1,1))) -> 
A99: =IF(R[-1]C="","",IF(EOMONTH(R[-1]C,0)+1>RunDat,"",EOMONTH(R[-1]C,0)+1)) ->  | D99: =IF(RC1="","",SUM(RC[2]:RC[37])) ->  | F99: =IF(RC1="","",IF(OR(R8C<=ROUND(DAYS360(ValDat,RC1,0)/30,0),R8C>ROUND(DAYS360(ExpDat,RC1,0)/30,0)),0,OFFSET(R45C,MAX(-MNR,ROUND(DAYS360(ValDat,RC1,0)/30,0)-R8C+MEP-MNR),0,1,1))) ->  | G99: =IF(RC1="","",IF(OR(R8C<=ROUND(DAYS360(ValDat,RC1,0)/30,0),R8C>ROUND(DAYS360(ExpDat,RC1,0)/30,0)),0,OFFSET(R45C,MAX(-MNR,ROUND(DAYS360(ValDat,RC1,0)/30,0)-R8C+MEP-MNR),0,1,1))) ->  | H99: =IF(RC1="","",IF(OR(R8C<=ROUND(DAYS360(ValDat,RC1,0)/30,0),R8C>ROUND(DAYS360(ExpDat,RC1,0)/30,0)),0,OFFSET(R45C,MAX(-MNR,ROUND(DAYS360(ValDat,RC1,0)/30,0)-R8C+MEP-MNR),0,1,1))) ->  | I99: =IF(RC1="","",IF(OR(R8C<=ROUND(DAYS360(ValDat,RC1,0)/30,0),R8C>ROUND(DAYS360(ExpDat,RC1,0)/30,0)),0,OFFSET(R45C,MAX(-MNR,ROUND(DAYS360(ValDat,RC1,0)/30,0)-R8C+MEP-MNR),0,1,1))) ->  | J99: =IF(RC1="","",IF(OR(R8C<=ROUND(DAYS360(ValDat,RC1,0)/30,0),R8C>ROUND(DAYS360(ExpDat,RC1,0)/30,0)),0,OFFSET(R45C,MAX(-MNR,ROUND(DAYS360(ValDat,RC1,0)/30,0)-R8C+MEP-MNR),0,1,1))) ->  | K99: =IF(RC1="","",IF(OR(R8C<=ROUND(DAYS360(ValDat,RC1,0)/30,0),R8C>ROUND(DAYS360(ExpDat,RC1,0)/30,0)),0,OFFSET(R45C,MAX(-MNR,ROUND(DAYS360(ValDat,RC1,0)/30,0)-R8C+MEP-MNR),0,1,1))) ->  | L99: =IF(RC1="","",IF(OR(R8C<=ROUND(DAYS360(ValDat,RC1,0)/30,0),R8C>ROUND(DAYS360(ExpDat,RC1,0)/30,0)),0,OFFSET(R45C,MAX(-MNR,ROUND(DAYS360(ValDat,RC1,0)/30,0)-R8C+MEP-MNR),0,1,1))) ->  | M99: =IF(RC1="","",IF(OR(R8C<=ROUND(DAYS360(ValDat,RC1,0)/30,0),R8C>ROUND(DAYS360(ExpDat,RC1,0)/30,0)),0,OFFSET(R45C,MAX(-MNR,ROUND(DAYS360(ValDat,RC1,0)/30,0)-R8C+MEP-MNR),0,1,1))) ->  | N99: =IF(RC1="","",IF(OR(R8C<=ROUND(DAYS360(ValDat,RC1,0)/30,0),R8C>ROUND(DAYS360(ExpDat,RC1,0)/30,0)),0,OFFSET(R45C,MAX(-MNR,ROUND(DAYS360(ValDat,RC1,0)/30,0)-R8C+MEP-MNR),0,1,1))) ->  | O99: =IF(RC1="","",IF(OR(R8C<=ROUND(DAYS360(ValDat,RC1,0)/30,0),R8C>ROUND(DAYS360(ExpDat,RC1,0)/30,0)),0,OFFSET(R45C,MAX(-MNR,ROUND(DAYS360(ValDat,RC1,0)/30,0)-R8C+MEP-MNR),0,1,1))) ->  | P99: =IF(RC1="","",IF(OR(R8C<=ROUND(DAYS360(ValDat,RC1,0)/30,0),R8C>ROUND(DAYS360(ExpDat,RC1,0)/30,0)),0,OFFSET(R45C,MAX(-MNR,ROUND(DAYS360(ValDat,RC1,0)/30,0)-R8C+MEP-MNR),0,1,1))) ->  | Q99: =IF(RC1="","",IF(OR(R8C<=ROUND(DAYS360(ValDat,RC1,0)/30,0),R8C>ROUND(DAYS360(ExpDat,RC1,0)/30,0)),0,OFFSET(R45C,MAX(-MNR,ROUND(DAYS360(ValDat,RC1,0)/30,0)-R8C+MEP-MNR),0,1,1))) ->  | R99: =IF(RC1="","",IF(OR(R8C<=ROUND(DAYS360(ValDat,RC1,0)/30,0),R8C>ROUND(DAYS360(ExpDat,RC1,0)/30,0)),0,OFFSET(R45C,MAX(-MNR,ROUND(DAYS360(ValDat,RC1,0)/30,0)-R8C+MEP-MNR),0,1,1))) ->  | S99: =IF(RC1="","",IF(OR(R8C<=ROUND(DAYS360(ValDat,RC1,0)/30,0),R8C>ROUND(DAYS360(ExpDat,RC1,0)/30,0)),0,OFFSET(R45C,MAX(-MNR,ROUND(DAYS360(ValDat,RC1,0)/30,0)-R8C+MEP-MNR),0,1,1))) ->  | T99: =IF(RC1="","",IF(OR(R8C<=ROUND(DAYS360(ValDat,RC1,0)/30,0),R8C>ROUND(DAYS360(ExpDat,RC1,0)/30,0)),0,OFFSET(R45C,MAX(-MNR,ROUND(DAYS360(ValDat,RC1,0)/30,0)-R8C+MEP-MNR),0,1,1))) ->  | U99: =IF(RC1="","",IF(OR(R8C<=ROUND(DAYS360(ValDat,RC1,0)/30,0),R8C>ROUND(DAYS360(ExpDat,RC1,0)/30,0)),0,OFFSET(R45C,MAX(-MNR,ROUND(DAYS360(ValDat,RC1,0)/30,0)-R8C+MEP-MNR),0,1,1))) ->  | V99: =IF(RC1="","",IF(OR(R8C<=ROUND(DAYS360(ValDat,RC1,0)/30,0),R8C>ROUND(DAYS360(ExpDat,RC1,0)/30,0)),0,OFFSET(R45C,MAX(-MNR,ROUND(DAYS360(ValDat,RC1,0)/30,0)-R8C+MEP-MNR),0,1,1))) ->  | W99: =IF(RC1="","",IF(OR(R8C<=ROUND(DAYS360(ValDat,RC1,0)/30,0),R8C>ROUND(DAYS360(ExpDat,RC1,0)/30,0)),0,OFFSET(R45C,MAX(-MNR,ROUND(DAYS360(ValDat,RC1,0)/30,0)-R8C+MEP-MNR),0,1,1))) ->  | X99: =IF(RC1="","",IF(OR(R8C<=ROUND(DAYS360(ValDat,RC1,0)/30,0),R8C>ROUND(DAYS360(ExpDat,RC1,0)/30,0)),0,OFFSET(R45C,MAX(-MNR,ROUND(DAYS360(ValDat,RC1,0)/30,0)-R8C+MEP-MNR),0,1,1))) ->  | Y99: =IF(RC1="","",IF(OR(R8C<=ROUND(DAYS360(ValDat,RC1,0)/30,0),R8C>ROUND(DAYS360(ExpDat,RC1,0)/30,0)),0,OFFSET(R45C,MAX(-MNR,ROUND(DAYS360(ValDat,RC1,0)/30,0)-R8C+MEP-MNR),0,1,1))) ->  | Z99: =IF(RC1="","",IF(OR(R8C<=ROUND(DAYS360(ValDat,RC1,0)/30,0),R8C>ROUND(DAYS360(ExpDat,RC1,0)/30,0)),0,OFFSET(R45C,MAX(-MNR,ROUND(DAYS360(ValDat,RC1,0)/30,0)-R8C+MEP-MNR),0,1,1))) ->  | AA99: =IF(RC1="","",IF(OR(R8C<=ROUND(DAYS360(ValDat,RC1,0)/30,0),R8C>ROUND(DAYS360(ExpDat,RC1,0)/30,0)),0,OFFSET(R45C,MAX(-MNR,ROUND(DAYS360(ValDat,RC1,0)/30,0)-R8C+MEP-MNR),0,1,1))) ->  | AB99: =IF(RC1="","",IF(OR(R8C<=ROUND(DAYS360(ValDat,RC1,0)/30,0),R8C>ROUND(DAYS360(ExpDat,RC1,0)/30,0)),0,OFFSET(R45C,MAX(-MNR,ROUND(DAYS360(ValDat,RC1,0)/30,0)-R8C+MEP-MNR),0,1,1))) ->  | AC99: =IF(RC1="","",IF(OR(R8C<=ROUND(DAYS360(ValDat,RC1,0)/30,0),R8C>ROUND(DAYS360(ExpDat,RC1,0)/30,0)),0,OFFSET(R45C,MAX(-MNR,ROUND(DAYS360(ValDat,RC1,0)/30,0)-R8C+MEP-MNR),0,1,1))) ->  | AD99: =IF(RC1="","",IF(OR(R8C<=ROUND(DAYS360(ValDat,RC1,0)/30,0),R8C>ROUND(DAYS360(ExpDat,RC1,0)/30,0)),0,OFFSET(R45C,MAX(-MNR,ROUND(DAYS360(ValDat,RC1,0)/30,0)-R8C+MEP-MNR),0,1,1))) ->  | AE99: =IF(RC1="","",IF(OR(R8C<=ROUND(DAYS360(ValDat,RC1,0)/30,0),R8C>ROUND(DAYS360(ExpDat,RC1,0)/30,0)),0,OFFSET(R45C,MAX(-MNR,ROUND(DAYS360(ValDat,RC1,0)/30,0)-R8C+MEP-MNR),0,1,1))) ->  | AF99: =IF(RC1="","",IF(OR(R8C<=ROUND(DAYS360(ValDat,RC1,0)/30,0),R8C>ROUND(DAYS360(ExpDat,RC1,0)/30,0)),0,OFFSET(R45C,MAX(-MNR,ROUND(DAYS360(ValDat,RC1,0)/30,0)-R8C+MEP-MNR),0,1,1))) ->  | AG99: =IF(RC1="","",IF(OR(R8C<=ROUND(DAYS360(ValDat,RC1,0)/30,0),R8C>ROUND(DAYS360(ExpDat,RC1,0)/30,0)),0,OFFSET(R45C,MAX(-MNR,ROUND(DAYS360(ValDat,RC1,0)/30,0)-R8C+MEP-MNR),0,1,1))) ->  | AH99: =IF(RC1="","",IF(OR(R8C<=ROUND(DAYS360(ValDat,RC1,0)/30,0),R8C>ROUND(DAYS360(ExpDat,RC1,0)/30,0)),0,OFFSET(R45C,MAX(-MNR,ROUND(DAYS360(ValDat,RC1,0)/30,0)-R8C+MEP-MNR),0,1,1))) ->  | AI99: =IF(RC1="","",IF(OR(R8C<=ROUND(DAYS360(ValDat,RC1,0)/30,0),R8C>ROUND(DAYS360(ExpDat,RC1,0)/30,0)),0,OFFSET(R45C,MAX(-MNR,ROUND(DAYS360(ValDat,RC1,0)/30,0)-R8C+MEP-MNR),0,1,1))) ->  | AJ99: =IF(RC1="","",IF(OR(R8C<=ROUND(DAYS360(ValDat,RC1,0)/30,0),R8C>ROUND(DAYS360(ExpDat,RC1,0)/30,0)),0,OFFSET(R45C,MAX(-MNR,ROUND(DAYS360(ValDat,RC1,0)/30,0)-R8C+MEP-MNR),0,1,1))) ->  | AK99: =IF(RC1="","",IF(OR(R8C<=ROUND(DAYS360(ValDat,RC1,0)/30,0),R8C>ROUND(DAYS360(ExpDat,RC1,0)/30,0)),0,OFFSET(R45C,MAX(-MNR,ROUND(DAYS360(ValDat,RC1,0)/30,0)-R8C+MEP-MNR),0,1,1))) ->  | AL99: =IF(RC1="","",IF(OR(R8C<=ROUND(DAYS360(ValDat,RC1,0)/30,0),R8C>ROUND(DAYS360(ExpDat,RC1,0)/30,0)),0,OFFSET(R45C,MAX(-MNR,ROUND(DAYS360(ValDat,RC1,0)/30,0)-R8C+MEP-MNR),0,1,1))) ->  | AM99: =IF(RC1="","",IF(OR(R8C<=ROUND(DAYS360(ValDat,RC1,0)/30,0),R8C>ROUND(DAYS360(ExpDat,RC1,0)/30,0)),0,OFFSET(R45C,MAX(-MNR,ROUND(DAYS360(ValDat,RC1,0)/30,0)-R8C+MEP-MNR),0,1,1))) ->  | AN99: =IF(RC1="","",IF(OR(R8C<=ROUND(DAYS360(ValDat,RC1,0)/30,0),R8C>ROUND(DAYS360(ExpDat,RC1,0)/30,0)),0,OFFSET(R45C,MAX(-MNR,ROUND(DAYS360(ValDat,RC1,0)/30,0)-R8C+MEP-MNR),0,1,1))) ->  | AO99: =IF(RC1="","",IF(OR(R8C<=ROUND(DAYS360(ValDat,RC1,0)/30,0),R8C>ROUND(DAYS360(ExpDat,RC1,0)/30,0)),0,OFFSET(R45C,MAX(-MNR,ROUND(DAYS360(ValDat,RC1,0)/30,0)-R8C+MEP-MNR),0,1,1))) -> 
A100: =IF(R[-1]C="","",IF(EOMONTH(R[-1]C,0)+1>RunDat,"",EOMONTH(R[-1]C,0)+1)) ->  | D100: =IF(RC1="","",SUM(RC[2]:RC[37])) ->  | F100: =IF(RC1="","",IF(OR(R8C<=ROUND(DAYS360(ValDat,RC1,0)/30,0),R8C>ROUND(DAYS360(ExpDat,RC1,0)/30,0)),0,OFFSET(R45C,MAX(-MNR,ROUND(DAYS360(ValDat,RC1,0)/30,0)-R8C+MEP-MNR),0,1,1))) ->  | G100: =IF(RC1="","",IF(OR(R8C<=ROUND(DAYS360(ValDat,RC1,0)/30,0),R8C>ROUND(DAYS360(ExpDat,RC1,0)/30,0)),0,OFFSET(R45C,MAX(-MNR,ROUND(DAYS360(ValDat,RC1,0)/30,0)-R8C+MEP-MNR),0,1,1))) ->  | H100: =IF(RC1="","",IF(OR(R8C<=ROUND(DAYS360(ValDat,RC1,0)/30,0),R8C>ROUND(DAYS360(ExpDat,RC1,0)/30,0)),0,OFFSET(R45C,MAX(-MNR,ROUND(DAYS360(ValDat,RC1,0)/30,0)-R8C+MEP-MNR),0,1,1))) ->  | I100: =IF(RC1="","",IF(OR(R8C<=ROUND(DAYS360(ValDat,RC1,0)/30,0),R8C>ROUND(DAYS360(ExpDat,RC1,0)/30,0)),0,OFFSET(R45C,MAX(-MNR,ROUND(DAYS360(ValDat,RC1,0)/30,0)-R8C+MEP-MNR),0,1,1))) ->  | J100: =IF(RC1="","",IF(OR(R8C<=ROUND(DAYS360(ValDat,RC1,0)/30,0),R8C>ROUND(DAYS360(ExpDat,RC1,0)/30,0)),0,OFFSET(R45C,MAX(-MNR,ROUND(DAYS360(ValDat,RC1,0)/30,0)-R8C+MEP-MNR),0,1,1))) ->  | K100: =IF(RC1="","",IF(OR(R8C<=ROUND(DAYS360(ValDat,RC1,0)/30,0),R8C>ROUND(DAYS360(ExpDat,RC1,0)/30,0)),0,OFFSET(R45C,MAX(-MNR,ROUND(DAYS360(ValDat,RC1,0)/30,0)-R8C+MEP-MNR),0,1,1))) ->  | L100: =IF(RC1="","",IF(OR(R8C<=ROUND(DAYS360(ValDat,RC1,0)/30,0),R8C>ROUND(DAYS360(ExpDat,RC1,0)/30,0)),0,OFFSET(R45C,MAX(-MNR,ROUND(DAYS360(ValDat,RC1,0)/30,0)-R8C+MEP-MNR),0,1,1))) ->  | M100: =IF(RC1="","",IF(OR(R8C<=ROUND(DAYS360(ValDat,RC1,0)/30,0),R8C>ROUND(DAYS360(ExpDat,RC1,0)/30,0)),0,OFFSET(R45C,MAX(-MNR,ROUND(DAYS360(ValDat,RC1,0)/30,0)-R8C+MEP-MNR),0,1,1))) ->  | N100: =IF(RC1="","",IF(OR(R8C<=ROUND(DAYS360(ValDat,RC1,0)/30,0),R8C>ROUND(DAYS360(ExpDat,RC1,0)/30,0)),0,OFFSET(R45C,MAX(-MNR,ROUND(DAYS360(ValDat,RC1,0)/30,0)-R8C+MEP-MNR),0,1,1))) ->  | O100: =IF(RC1="","",IF(OR(R8C<=ROUND(DAYS360(ValDat,RC1,0)/30,0),R8C>ROUND(DAYS360(ExpDat,RC1,0)/30,0)),0,OFFSET(R45C,MAX(-MNR,ROUND(DAYS360(ValDat,RC1,0)/30,0)-R8C+MEP-MNR),0,1,1))) ->  | P100: =IF(RC1="","",IF(OR(R8C<=ROUND(DAYS360(ValDat,RC1,0)/30,0),R8C>ROUND(DAYS360(ExpDat,RC1,0)/30,0)),0,OFFSET(R45C,MAX(-MNR,ROUND(DAYS360(ValDat,RC1,0)/30,0)-R8C+MEP-MNR),0,1,1))) ->  | Q100: =IF(RC1="","",IF(OR(R8C<=ROUND(DAYS360(ValDat,RC1,0)/30,0),R8C>ROUND(DAYS360(ExpDat,RC1,0)/30,0)),0,OFFSET(R45C,MAX(-MNR,ROUND(DAYS360(ValDat,RC1,0)/30,0)-R8C+MEP-MNR),0,1,1))) ->  | R100: =IF(RC1="","",IF(OR(R8C<=ROUND(DAYS360(ValDat,RC1,0)/30,0),R8C>ROUND(DAYS360(ExpDat,RC1,0)/30,0)),0,OFFSET(R45C,MAX(-MNR,ROUND(DAYS360(ValDat,RC1,0)/30,0)-R8C+MEP-MNR),0,1,1))) ->  | S100: =IF(RC1="","",IF(OR(R8C<=ROUND(DAYS360(ValDat,RC1,0)/30,0),R8C>ROUND(DAYS360(ExpDat,RC1,0)/30,0)),0,OFFSET(R45C,MAX(-MNR,ROUND(DAYS360(ValDat,RC1,0)/30,0)-R8C+MEP-MNR),0,1,1))) ->  | T100: =IF(RC1="","",IF(OR(R8C<=ROUND(DAYS360(ValDat,RC1,0)/30,0),R8C>ROUND(DAYS360(ExpDat,RC1,0)/30,0)),0,OFFSET(R45C,MAX(-MNR,ROUND(DAYS360(ValDat,RC1,0)/30,0)-R8C+MEP-MNR),0,1,1))) ->  | U100: =IF(RC1="","",IF(OR(R8C<=ROUND(DAYS360(ValDat,RC1,0)/30,0),R8C>ROUND(DAYS360(ExpDat,RC1,0)/30,0)),0,OFFSET(R45C,MAX(-MNR,ROUND(DAYS360(ValDat,RC1,0)/30,0)-R8C+MEP-MNR),0,1,1))) ->  | V100: =IF(RC1="","",IF(OR(R8C<=ROUND(DAYS360(ValDat,RC1,0)/30,0),R8C>ROUND(DAYS360(ExpDat,RC1,0)/30,0)),0,OFFSET(R45C,MAX(-MNR,ROUND(DAYS360(ValDat,RC1,0)/30,0)-R8C+MEP-MNR),0,1,1))) ->  | W100: =IF(RC1="","",IF(OR(R8C<=ROUND(DAYS360(ValDat,RC1,0)/30,0),R8C>ROUND(DAYS360(ExpDat,RC1,0)/30,0)),0,OFFSET(R45C,MAX(-MNR,ROUND(DAYS360(ValDat,RC1,0)/30,0)-R8C+MEP-MNR),0,1,1))) ->  | X100: =IF(RC1="","",IF(OR(R8C<=ROUND(DAYS360(ValDat,RC1,0)/30,0),R8C>ROUND(DAYS360(ExpDat,RC1,0)/30,0)),0,OFFSET(R45C,MAX(-MNR,ROUND(DAYS360(ValDat,RC1,0)/30,0)-R8C+MEP-MNR),0,1,1))) ->  | Y100: =IF(RC1="","",IF(OR(R8C<=ROUND(DAYS360(ValDat,RC1,0)/30,0),R8C>ROUND(DAYS360(ExpDat,RC1,0)/30,0)),0,OFFSET(R45C,MAX(-MNR,ROUND(DAYS360(ValDat,RC1,0)/30,0)-R8C+MEP-MNR),0,1,1))) ->  | Z100: =IF(RC1="","",IF(OR(R8C<=ROUND(DAYS360(ValDat,RC1,0)/30,0),R8C>ROUND(DAYS360(ExpDat,RC1,0)/30,0)),0,OFFSET(R45C,MAX(-MNR,ROUND(DAYS360(ValDat,RC1,0)/30,0)-R8C+MEP-MNR),0,1,1))) ->  | AA100: =IF(RC1="","",IF(OR(R8C<=ROUND(DAYS360(ValDat,RC1,0)/30,0),R8C>ROUND(DAYS360(ExpDat,RC1,0)/30,0)),0,OFFSET(R45C,MAX(-MNR,ROUND(DAYS360(ValDat,RC1,0)/30,0)-R8C+MEP-MNR),0,1,1))) ->  | AB100: =IF(RC1="","",IF(OR(R8C<=ROUND(DAYS360(ValDat,RC1,0)/30,0),R8C>ROUND(DAYS360(ExpDat,RC1,0)/30,0)),0,OFFSET(R45C,MAX(-MNR,ROUND(DAYS360(ValDat,RC1,0)/30,0)-R8C+MEP-MNR),0,1,1))) ->  | AC100: =IF(RC1="","",IF(OR(R8C<=ROUND(DAYS360(ValDat,RC1,0)/30,0),R8C>ROUND(DAYS360(ExpDat,RC1,0)/30,0)),0,OFFSET(R45C,MAX(-MNR,ROUND(DAYS360(ValDat,RC1,0)/30,0)-R8C+MEP-MNR),0,1,1))) ->  | AD100: =IF(RC1="","",IF(OR(R8C<=ROUND(DAYS360(ValDat,RC1,0)/30,0),R8C>ROUND(DAYS360(ExpDat,RC1,0)/30,0)),0,OFFSET(R45C,MAX(-MNR,ROUND(DAYS360(ValDat,RC1,0)/30,0)-R8C+MEP-MNR),0,1,1))) ->  | AE100: =IF(RC1="","",IF(OR(R8C<=ROUND(DAYS360(ValDat,RC1,0)/30,0),R8C>ROUND(DAYS360(ExpDat,RC1,0)/30,0)),0,OFFSET(R45C,MAX(-MNR,ROUND(DAYS360(ValDat,RC1,0)/30,0)-R8C+MEP-MNR),0,1,1))) ->  | AF100: =IF(RC1="","",IF(OR(R8C<=ROUND(DAYS360(ValDat,RC1,0)/30,0),R8C>ROUND(DAYS360(ExpDat,RC1,0)/30,0)),0,OFFSET(R45C,MAX(-MNR,ROUND(DAYS360(ValDat,RC1,0)/30,0)-R8C+MEP-MNR),0,1,1))) ->  | AG100: =IF(RC1="","",IF(OR(R8C<=ROUND(DAYS360(ValDat,RC1,0)/30,0),R8C>ROUND(DAYS360(ExpDat,RC1,0)/30,0)),0,OFFSET(R45C,MAX(-MNR,ROUND(DAYS360(ValDat,RC1,0)/30,0)-R8C+MEP-MNR),0,1,1))) ->  | AH100: =IF(RC1="","",IF(OR(R8C<=ROUND(DAYS360(ValDat,RC1,0)/30,0),R8C>ROUND(DAYS360(ExpDat,RC1,0)/30,0)),0,OFFSET(R45C,MAX(-MNR,ROUND(DAYS360(ValDat,RC1,0)/30,0)-R8C+MEP-MNR),0,1,1))) ->  | AI100: =IF(RC1="","",IF(OR(R8C<=ROUND(DAYS360(ValDat,RC1,0)/30,0),R8C>ROUND(DAYS360(ExpDat,RC1,0)/30,0)),0,OFFSET(R45C,MAX(-MNR,ROUND(DAYS360(ValDat,RC1,0)/30,0)-R8C+MEP-MNR),0,1,1))) ->  | AJ100: =IF(RC1="","",IF(OR(R8C<=ROUND(DAYS360(ValDat,RC1,0)/30,0),R8C>ROUND(DAYS360(ExpDat,RC1,0)/30,0)),0,OFFSET(R45C,MAX(-MNR,ROUND(DAYS360(ValDat,RC1,0)/30,0)-R8C+MEP-MNR),0,1,1))) ->  | AK100: =IF(RC1="","",IF(OR(R8C<=ROUND(DAYS360(ValDat,RC1,0)/30,0),R8C>ROUND(DAYS360(ExpDat,RC1,0)/30,0)),0,OFFSET(R45C,MAX(-MNR,ROUND(DAYS360(ValDat,RC1,0)/30,0)-R8C+MEP-MNR),0,1,1))) ->  | AL100: =IF(RC1="","",IF(OR(R8C<=ROUND(DAYS360(ValDat,RC1,0)/30,0),R8C>ROUND(DAYS360(ExpDat,RC1,0)/30,0)),0,OFFSET(R45C,MAX(-MNR,ROUND(DAYS360(ValDat,RC1,0)/30,0)-R8C+MEP-MNR),0,1,1))) ->  | AM100: =IF(RC1="","",IF(OR(R8C<=ROUND(DAYS360(ValDat,RC1,0)/30,0),R8C>ROUND(DAYS360(ExpDat,RC1,0)/30,0)),0,OFFSET(R45C,MAX(-MNR,ROUND(DAYS360(ValDat,RC1,0)/30,0)-R8C+MEP-MNR),0,1,1))) ->  | AN100: =IF(RC1="","",IF(OR(R8C<=ROUND(DAYS360(ValDat,RC1,0)/30,0),R8C>ROUND(DAYS360(ExpDat,RC1,0)/30,0)),0,OFFSET(R45C,MAX(-MNR,ROUND(DAYS360(ValDat,RC1,0)/30,0)-R8C+MEP-MNR),0,1,1))) ->  | AO100: =IF(RC1="","",IF(OR(R8C<=ROUND(DAYS360(ValDat,RC1,0)/30,0),R8C>ROUND(DAYS360(ExpDat,RC1,0)/30,0)),0,OFFSET(R45C,MAX(-MNR,ROUND(DAYS360(ValDat,RC1,0)/30,0)-R8C+MEP-MNR),0,1,1))) -> 
A101: =IF(R[-1]C="","",IF(EOMONTH(R[-1]C,0)+1>RunDat,"",EOMONTH(R[-1]C,0)+1)) ->  | D101: =IF(RC1="","",SUM(RC[2]:RC[37])) ->  | F101: =IF(RC1="","",IF(OR(R8C<=ROUND(DAYS360(ValDat,RC1,0)/30,0),R8C>ROUND(DAYS360(ExpDat,RC1,0)/30,0)),0,OFFSET(R45C,MAX(-MNR,ROUND(DAYS360(ValDat,RC1,0)/30,0)-R8C+MEP-MNR),0,1,1))) ->  | G101: =IF(RC1="","",IF(OR(R8C<=ROUND(DAYS360(ValDat,RC1,0)/30,0),R8C>ROUND(DAYS360(ExpDat,RC1,0)/30,0)),0,OFFSET(R45C,MAX(-MNR,ROUND(DAYS360(ValDat,RC1,0)/30,0)-R8C+MEP-MNR),0,1,1))) ->  | H101: =IF(RC1="","",IF(OR(R8C<=ROUND(DAYS360(ValDat,RC1,0)/30,0),R8C>ROUND(DAYS360(ExpDat,RC1,0)/30,0)),0,OFFSET(R45C,MAX(-MNR,ROUND(DAYS360(ValDat,RC1,0)/30,0)-R8C+MEP-MNR),0,1,1))) ->  | I101: =IF(RC1="","",IF(OR(R8C<=ROUND(DAYS360(ValDat,RC1,0)/30,0),R8C>ROUND(DAYS360(ExpDat,RC1,0)/30,0)),0,OFFSET(R45C,MAX(-MNR,ROUND(DAYS360(ValDat,RC1,0)/30,0)-R8C+MEP-MNR),0,1,1))) ->  | J101: =IF(RC1="","",IF(OR(R8C<=ROUND(DAYS360(ValDat,RC1,0)/30,0),R8C>ROUND(DAYS360(ExpDat,RC1,0)/30,0)),0,OFFSET(R45C,MAX(-MNR,ROUND(DAYS360(ValDat,RC1,0)/30,0)-R8C+MEP-MNR),0,1,1))) ->  | K101: =IF(RC1="","",IF(OR(R8C<=ROUND(DAYS360(ValDat,RC1,0)/30,0),R8C>ROUND(DAYS360(ExpDat,RC1,0)/30,0)),0,OFFSET(R45C,MAX(-MNR,ROUND(DAYS360(ValDat,RC1,0)/30,0)-R8C+MEP-MNR),0,1,1))) ->  | L101: =IF(RC1="","",IF(OR(R8C<=ROUND(DAYS360(ValDat,RC1,0)/30,0),R8C>ROUND(DAYS360(ExpDat,RC1,0)/30,0)),0,OFFSET(R45C,MAX(-MNR,ROUND(DAYS360(ValDat,RC1,0)/30,0)-R8C+MEP-MNR),0,1,1))) ->  | M101: =IF(RC1="","",IF(OR(R8C<=ROUND(DAYS360(ValDat,RC1,0)/30,0),R8C>ROUND(DAYS360(ExpDat,RC1,0)/30,0)),0,OFFSET(R45C,MAX(-MNR,ROUND(DAYS360(ValDat,RC1,0)/30,0)-R8C+MEP-MNR),0,1,1))) ->  | N101: =IF(RC1="","",IF(OR(R8C<=ROUND(DAYS360(ValDat,RC1,0)/30,0),R8C>ROUND(DAYS360(ExpDat,RC1,0)/30,0)),0,OFFSET(R45C,MAX(-MNR,ROUND(DAYS360(ValDat,RC1,0)/30,0)-R8C+MEP-MNR),0,1,1))) ->  | O101: =IF(RC1="","",IF(OR(R8C<=ROUND(DAYS360(ValDat,RC1,0)/30,0),R8C>ROUND(DAYS360(ExpDat,RC1,0)/30,0)),0,OFFSET(R45C,MAX(-MNR,ROUND(DAYS360(ValDat,RC1,0)/30,0)-R8C+MEP-MNR),0,1,1))) ->  | P101: =IF(RC1="","",IF(OR(R8C<=ROUND(DAYS360(ValDat,RC1,0)/30,0),R8C>ROUND(DAYS360(ExpDat,RC1,0)/30,0)),0,OFFSET(R45C,MAX(-MNR,ROUND(DAYS360(ValDat,RC1,0)/30,0)-R8C+MEP-MNR),0,1,1))) ->  | Q101: =IF(RC1="","",IF(OR(R8C<=ROUND(DAYS360(ValDat,RC1,0)/30,0),R8C>ROUND(DAYS360(ExpDat,RC1,0)/30,0)),0,OFFSET(R45C,MAX(-MNR,ROUND(DAYS360(ValDat,RC1,0)/30,0)-R8C+MEP-MNR),0,1,1))) ->  | R101: =IF(RC1="","",IF(OR(R8C<=ROUND(DAYS360(ValDat,RC1,0)/30,0),R8C>ROUND(DAYS360(ExpDat,RC1,0)/30,0)),0,OFFSET(R45C,MAX(-MNR,ROUND(DAYS360(ValDat,RC1,0)/30,0)-R8C+MEP-MNR),0,1,1))) ->  | S101: =IF(RC1="","",IF(OR(R8C<=ROUND(DAYS360(ValDat,RC1,0)/30,0),R8C>ROUND(DAYS360(ExpDat,RC1,0)/30,0)),0,OFFSET(R45C,MAX(-MNR,ROUND(DAYS360(ValDat,RC1,0)/30,0)-R8C+MEP-MNR),0,1,1))) ->  | T101: =IF(RC1="","",IF(OR(R8C<=ROUND(DAYS360(ValDat,RC1,0)/30,0),R8C>ROUND(DAYS360(ExpDat,RC1,0)/30,0)),0,OFFSET(R45C,MAX(-MNR,ROUND(DAYS360(ValDat,RC1,0)/30,0)-R8C+MEP-MNR),0,1,1))) ->  | U101: =IF(RC1="","",IF(OR(R8C<=ROUND(DAYS360(ValDat,RC1,0)/30,0),R8C>ROUND(DAYS360(ExpDat,RC1,0)/30,0)),0,OFFSET(R45C,MAX(-MNR,ROUND(DAYS360(ValDat,RC1,0)/30,0)-R8C+MEP-MNR),0,1,1))) ->  | V101: =IF(RC1="","",IF(OR(R8C<=ROUND(DAYS360(ValDat,RC1,0)/30,0),R8C>ROUND(DAYS360(ExpDat,RC1,0)/30,0)),0,OFFSET(R45C,MAX(-MNR,ROUND(DAYS360(ValDat,RC1,0)/30,0)-R8C+MEP-MNR),0,1,1))) ->  | W101: =IF(RC1="","",IF(OR(R8C<=ROUND(DAYS360(ValDat,RC1,0)/30,0),R8C>ROUND(DAYS360(ExpDat,RC1,0)/30,0)),0,OFFSET(R45C,MAX(-MNR,ROUND(DAYS360(ValDat,RC1,0)/30,0)-R8C+MEP-MNR),0,1,1))) ->  | X101: =IF(RC1="","",IF(OR(R8C<=ROUND(DAYS360(ValDat,RC1,0)/30,0),R8C>ROUND(DAYS360(ExpDat,RC1,0)/30,0)),0,OFFSET(R45C,MAX(-MNR,ROUND(DAYS360(ValDat,RC1,0)/30,0)-R8C+MEP-MNR),0,1,1))) ->  | Y101: =IF(RC1="","",IF(OR(R8C<=ROUND(DAYS360(ValDat,RC1,0)/30,0),R8C>ROUND(DAYS360(ExpDat,RC1,0)/30,0)),0,OFFSET(R45C,MAX(-MNR,ROUND(DAYS360(ValDat,RC1,0)/30,0)-R8C+MEP-MNR),0,1,1))) ->  | Z101: =IF(RC1="","",IF(OR(R8C<=ROUND(DAYS360(ValDat,RC1,0)/30,0),R8C>ROUND(DAYS360(ExpDat,RC1,0)/30,0)),0,OFFSET(R45C,MAX(-MNR,ROUND(DAYS360(ValDat,RC1,0)/30,0)-R8C+MEP-MNR),0,1,1))) ->  | AA101: =IF(RC1="","",IF(OR(R8C<=ROUND(DAYS360(ValDat,RC1,0)/30,0),R8C>ROUND(DAYS360(ExpDat,RC1,0)/30,0)),0,OFFSET(R45C,MAX(-MNR,ROUND(DAYS360(ValDat,RC1,0)/30,0)-R8C+MEP-MNR),0,1,1))) ->  | AB101: =IF(RC1="","",IF(OR(R8C<=ROUND(DAYS360(ValDat,RC1,0)/30,0),R8C>ROUND(DAYS360(ExpDat,RC1,0)/30,0)),0,OFFSET(R45C,MAX(-MNR,ROUND(DAYS360(ValDat,RC1,0)/30,0)-R8C+MEP-MNR),0,1,1))) ->  | AC101: =IF(RC1="","",IF(OR(R8C<=ROUND(DAYS360(ValDat,RC1,0)/30,0),R8C>ROUND(DAYS360(ExpDat,RC1,0)/30,0)),0,OFFSET(R45C,MAX(-MNR,ROUND(DAYS360(ValDat,RC1,0)/30,0)-R8C+MEP-MNR),0,1,1))) ->  | AD101: =IF(RC1="","",IF(OR(R8C<=ROUND(DAYS360(ValDat,RC1,0)/30,0),R8C>ROUND(DAYS360(ExpDat,RC1,0)/30,0)),0,OFFSET(R45C,MAX(-MNR,ROUND(DAYS360(ValDat,RC1,0)/30,0)-R8C+MEP-MNR),0,1,1))) ->  | AE101: =IF(RC1="","",IF(OR(R8C<=ROUND(DAYS360(ValDat,RC1,0)/30,0),R8C>ROUND(DAYS360(ExpDat,RC1,0)/30,0)),0,OFFSET(R45C,MAX(-MNR,ROUND(DAYS360(ValDat,RC1,0)/30,0)-R8C+MEP-MNR),0,1,1))) ->  | AF101: =IF(RC1="","",IF(OR(R8C<=ROUND(DAYS360(ValDat,RC1,0)/30,0),R8C>ROUND(DAYS360(ExpDat,RC1,0)/30,0)),0,OFFSET(R45C,MAX(-MNR,ROUND(DAYS360(ValDat,RC1,0)/30,0)-R8C+MEP-MNR),0,1,1))) ->  | AG101: =IF(RC1="","",IF(OR(R8C<=ROUND(DAYS360(ValDat,RC1,0)/30,0),R8C>ROUND(DAYS360(ExpDat,RC1,0)/30,0)),0,OFFSET(R45C,MAX(-MNR,ROUND(DAYS360(ValDat,RC1,0)/30,0)-R8C+MEP-MNR),0,1,1))) ->  | AH101: =IF(RC1="","",IF(OR(R8C<=ROUND(DAYS360(ValDat,RC1,0)/30,0),R8C>ROUND(DAYS360(ExpDat,RC1,0)/30,0)),0,OFFSET(R45C,MAX(-MNR,ROUND(DAYS360(ValDat,RC1,0)/30,0)-R8C+MEP-MNR),0,1,1))) ->  | AI101: =IF(RC1="","",IF(OR(R8C<=ROUND(DAYS360(ValDat,RC1,0)/30,0),R8C>ROUND(DAYS360(ExpDat,RC1,0)/30,0)),0,OFFSET(R45C,MAX(-MNR,ROUND(DAYS360(ValDat,RC1,0)/30,0)-R8C+MEP-MNR),0,1,1))) ->  | AJ101: =IF(RC1="","",IF(OR(R8C<=ROUND(DAYS360(ValDat,RC1,0)/30,0),R8C>ROUND(DAYS360(ExpDat,RC1,0)/30,0)),0,OFFSET(R45C,MAX(-MNR,ROUND(DAYS360(ValDat,RC1,0)/30,0)-R8C+MEP-MNR),0,1,1))) ->  | AK101: =IF(RC1="","",IF(OR(R8C<=ROUND(DAYS360(ValDat,RC1,0)/30,0),R8C>ROUND(DAYS360(ExpDat,RC1,0)/30,0)),0,OFFSET(R45C,MAX(-MNR,ROUND(DAYS360(ValDat,RC1,0)/30,0)-R8C+MEP-MNR),0,1,1))) ->  | AL101: =IF(RC1="","",IF(OR(R8C<=ROUND(DAYS360(ValDat,RC1,0)/30,0),R8C>ROUND(DAYS360(ExpDat,RC1,0)/30,0)),0,OFFSET(R45C,MAX(-MNR,ROUND(DAYS360(ValDat,RC1,0)/30,0)-R8C+MEP-MNR),0,1,1))) ->  | AM101: =IF(RC1="","",IF(OR(R8C<=ROUND(DAYS360(ValDat,RC1,0)/30,0),R8C>ROUND(DAYS360(ExpDat,RC1,0)/30,0)),0,OFFSET(R45C,MAX(-MNR,ROUND(DAYS360(ValDat,RC1,0)/30,0)-R8C+MEP-MNR),0,1,1))) ->  | AN101: =IF(RC1="","",IF(OR(R8C<=ROUND(DAYS360(ValDat,RC1,0)/30,0),R8C>ROUND(DAYS360(ExpDat,RC1,0)/30,0)),0,OFFSET(R45C,MAX(-MNR,ROUND(DAYS360(ValDat,RC1,0)/30,0)-R8C+MEP-MNR),0,1,1))) ->  | AO101: =IF(RC1="","",IF(OR(R8C<=ROUND(DAYS360(ValDat,RC1,0)/30,0),R8C>ROUND(DAYS360(ExpDat,RC1,0)/30,0)),0,OFFSET(R45C,MAX(-MNR,ROUND(DAYS360(ValDat,RC1,0)/30,0)-R8C+MEP-MNR),0,1,1))) -> 
A102: =IF(R[-1]C="","",IF(EOMONTH(R[-1]C,0)+1>RunDat,"",EOMONTH(R[-1]C,0)+1)) ->  | D102: =IF(RC1="","",SUM(RC[2]:RC[37])) ->  | F102: =IF(RC1="","",IF(OR(R8C<=ROUND(DAYS360(ValDat,RC1,0)/30,0),R8C>ROUND(DAYS360(ExpDat,RC1,0)/30,0)),0,OFFSET(R45C,MAX(-MNR,ROUND(DAYS360(ValDat,RC1,0)/30,0)-R8C+MEP-MNR),0,1,1))) ->  | G102: =IF(RC1="","",IF(OR(R8C<=ROUND(DAYS360(ValDat,RC1,0)/30,0),R8C>ROUND(DAYS360(ExpDat,RC1,0)/30,0)),0,OFFSET(R45C,MAX(-MNR,ROUND(DAYS360(ValDat,RC1,0)/30,0)-R8C+MEP-MNR),0,1,1))) ->  | H102: =IF(RC1="","",IF(OR(R8C<=ROUND(DAYS360(ValDat,RC1,0)/30,0),R8C>ROUND(DAYS360(ExpDat,RC1,0)/30,0)),0,OFFSET(R45C,MAX(-MNR,ROUND(DAYS360(ValDat,RC1,0)/30,0)-R8C+MEP-MNR),0,1,1))) ->  | I102: =IF(RC1="","",IF(OR(R8C<=ROUND(DAYS360(ValDat,RC1,0)/30,0),R8C>ROUND(DAYS360(ExpDat,RC1,0)/30,0)),0,OFFSET(R45C,MAX(-MNR,ROUND(DAYS360(ValDat,RC1,0)/30,0)-R8C+MEP-MNR),0,1,1))) ->  | J102: =IF(RC1="","",IF(OR(R8C<=ROUND(DAYS360(ValDat,RC1,0)/30,0),R8C>ROUND(DAYS360(ExpDat,RC1,0)/30,0)),0,OFFSET(R45C,MAX(-MNR,ROUND(DAYS360(ValDat,RC1,0)/30,0)-R8C+MEP-MNR),0,1,1))) ->  | K102: =IF(RC1="","",IF(OR(R8C<=ROUND(DAYS360(ValDat,RC1,0)/30,0),R8C>ROUND(DAYS360(ExpDat,RC1,0)/30,0)),0,OFFSET(R45C,MAX(-MNR,ROUND(DAYS360(ValDat,RC1,0)/30,0)-R8C+MEP-MNR),0,1,1))) ->  | L102: =IF(RC1="","",IF(OR(R8C<=ROUND(DAYS360(ValDat,RC1,0)/30,0),R8C>ROUND(DAYS360(ExpDat,RC1,0)/30,0)),0,OFFSET(R45C,MAX(-MNR,ROUND(DAYS360(ValDat,RC1,0)/30,0)-R8C+MEP-MNR),0,1,1))) ->  | M102: =IF(RC1="","",IF(OR(R8C<=ROUND(DAYS360(ValDat,RC1,0)/30,0),R8C>ROUND(DAYS360(ExpDat,RC1,0)/30,0)),0,OFFSET(R45C,MAX(-MNR,ROUND(DAYS360(ValDat,RC1,0)/30,0)-R8C+MEP-MNR),0,1,1))) ->  | N102: =IF(RC1="","",IF(OR(R8C<=ROUND(DAYS360(ValDat,RC1,0)/30,0),R8C>ROUND(DAYS360(ExpDat,RC1,0)/30,0)),0,OFFSET(R45C,MAX(-MNR,ROUND(DAYS360(ValDat,RC1,0)/30,0)-R8C+MEP-MNR),0,1,1))) ->  | O102: =IF(RC1="","",IF(OR(R8C<=ROUND(DAYS360(ValDat,RC1,0)/30,0),R8C>ROUND(DAYS360(ExpDat,RC1,0)/30,0)),0,OFFSET(R45C,MAX(-MNR,ROUND(DAYS360(ValDat,RC1,0)/30,0)-R8C+MEP-MNR),0,1,1))) ->  | P102: =IF(RC1="","",IF(OR(R8C<=ROUND(DAYS360(ValDat,RC1,0)/30,0),R8C>ROUND(DAYS360(ExpDat,RC1,0)/30,0)),0,OFFSET(R45C,MAX(-MNR,ROUND(DAYS360(ValDat,RC1,0)/30,0)-R8C+MEP-MNR),0,1,1))) ->  | Q102: =IF(RC1="","",IF(OR(R8C<=ROUND(DAYS360(ValDat,RC1,0)/30,0),R8C>ROUND(DAYS360(ExpDat,RC1,0)/30,0)),0,OFFSET(R45C,MAX(-MNR,ROUND(DAYS360(ValDat,RC1,0)/30,0)-R8C+MEP-MNR),0,1,1))) ->  | R102: =IF(RC1="","",IF(OR(R8C<=ROUND(DAYS360(ValDat,RC1,0)/30,0),R8C>ROUND(DAYS360(ExpDat,RC1,0)/30,0)),0,OFFSET(R45C,MAX(-MNR,ROUND(DAYS360(ValDat,RC1,0)/30,0)-R8C+MEP-MNR),0,1,1))) ->  | S102: =IF(RC1="","",IF(OR(R8C<=ROUND(DAYS360(ValDat,RC1,0)/30,0),R8C>ROUND(DAYS360(ExpDat,RC1,0)/30,0)),0,OFFSET(R45C,MAX(-MNR,ROUND(DAYS360(ValDat,RC1,0)/30,0)-R8C+MEP-MNR),0,1,1))) ->  | T102: =IF(RC1="","",IF(OR(R8C<=ROUND(DAYS360(ValDat,RC1,0)/30,0),R8C>ROUND(DAYS360(ExpDat,RC1,0)/30,0)),0,OFFSET(R45C,MAX(-MNR,ROUND(DAYS360(ValDat,RC1,0)/30,0)-R8C+MEP-MNR),0,1,1))) ->  | U102: =IF(RC1="","",IF(OR(R8C<=ROUND(DAYS360(ValDat,RC1,0)/30,0),R8C>ROUND(DAYS360(ExpDat,RC1,0)/30,0)),0,OFFSET(R45C,MAX(-MNR,ROUND(DAYS360(ValDat,RC1,0)/30,0)-R8C+MEP-MNR),0,1,1))) ->  | V102: =IF(RC1="","",IF(OR(R8C<=ROUND(DAYS360(ValDat,RC1,0)/30,0),R8C>ROUND(DAYS360(ExpDat,RC1,0)/30,0)),0,OFFSET(R45C,MAX(-MNR,ROUND(DAYS360(ValDat,RC1,0)/30,0)-R8C+MEP-MNR),0,1,1))) ->  | W102: =IF(RC1="","",IF(OR(R8C<=ROUND(DAYS360(ValDat,RC1,0)/30,0),R8C>ROUND(DAYS360(ExpDat,RC1,0)/30,0)),0,OFFSET(R45C,MAX(-MNR,ROUND(DAYS360(ValDat,RC1,0)/30,0)-R8C+MEP-MNR),0,1,1))) ->  | X102: =IF(RC1="","",IF(OR(R8C<=ROUND(DAYS360(ValDat,RC1,0)/30,0),R8C>ROUND(DAYS360(ExpDat,RC1,0)/30,0)),0,OFFSET(R45C,MAX(-MNR,ROUND(DAYS360(ValDat,RC1,0)/30,0)-R8C+MEP-MNR),0,1,1))) ->  | Y102: =IF(RC1="","",IF(OR(R8C<=ROUND(DAYS360(ValDat,RC1,0)/30,0),R8C>ROUND(DAYS360(ExpDat,RC1,0)/30,0)),0,OFFSET(R45C,MAX(-MNR,ROUND(DAYS360(ValDat,RC1,0)/30,0)-R8C+MEP-MNR),0,1,1))) ->  | Z102: =IF(RC1="","",IF(OR(R8C<=ROUND(DAYS360(ValDat,RC1,0)/30,0),R8C>ROUND(DAYS360(ExpDat,RC1,0)/30,0)),0,OFFSET(R45C,MAX(-MNR,ROUND(DAYS360(ValDat,RC1,0)/30,0)-R8C+MEP-MNR),0,1,1))) ->  | AA102: =IF(RC1="","",IF(OR(R8C<=ROUND(DAYS360(ValDat,RC1,0)/30,0),R8C>ROUND(DAYS360(ExpDat,RC1,0)/30,0)),0,OFFSET(R45C,MAX(-MNR,ROUND(DAYS360(ValDat,RC1,0)/30,0)-R8C+MEP-MNR),0,1,1))) ->  | AB102: =IF(RC1="","",IF(OR(R8C<=ROUND(DAYS360(ValDat,RC1,0)/30,0),R8C>ROUND(DAYS360(ExpDat,RC1,0)/30,0)),0,OFFSET(R45C,MAX(-MNR,ROUND(DAYS360(ValDat,RC1,0)/30,0)-R8C+MEP-MNR),0,1,1))) ->  | AC102: =IF(RC1="","",IF(OR(R8C<=ROUND(DAYS360(ValDat,RC1,0)/30,0),R8C>ROUND(DAYS360(ExpDat,RC1,0)/30,0)),0,OFFSET(R45C,MAX(-MNR,ROUND(DAYS360(ValDat,RC1,0)/30,0)-R8C+MEP-MNR),0,1,1))) ->  | AD102: =IF(RC1="","",IF(OR(R8C<=ROUND(DAYS360(ValDat,RC1,0)/30,0),R8C>ROUND(DAYS360(ExpDat,RC1,0)/30,0)),0,OFFSET(R45C,MAX(-MNR,ROUND(DAYS360(ValDat,RC1,0)/30,0)-R8C+MEP-MNR),0,1,1))) ->  | AE102: =IF(RC1="","",IF(OR(R8C<=ROUND(DAYS360(ValDat,RC1,0)/30,0),R8C>ROUND(DAYS360(ExpDat,RC1,0)/30,0)),0,OFFSET(R45C,MAX(-MNR,ROUND(DAYS360(ValDat,RC1,0)/30,0)-R8C+MEP-MNR),0,1,1))) ->  | AF102: =IF(RC1="","",IF(OR(R8C<=ROUND(DAYS360(ValDat,RC1,0)/30,0),R8C>ROUND(DAYS360(ExpDat,RC1,0)/30,0)),0,OFFSET(R45C,MAX(-MNR,ROUND(DAYS360(ValDat,RC1,0)/30,0)-R8C+MEP-MNR),0,1,1))) ->  | AG102: =IF(RC1="","",IF(OR(R8C<=ROUND(DAYS360(ValDat,RC1,0)/30,0),R8C>ROUND(DAYS360(ExpDat,RC1,0)/30,0)),0,OFFSET(R45C,MAX(-MNR,ROUND(DAYS360(ValDat,RC1,0)/30,0)-R8C+MEP-MNR),0,1,1))) ->  | AH102: =IF(RC1="","",IF(OR(R8C<=ROUND(DAYS360(ValDat,RC1,0)/30,0),R8C>ROUND(DAYS360(ExpDat,RC1,0)/30,0)),0,OFFSET(R45C,MAX(-MNR,ROUND(DAYS360(ValDat,RC1,0)/30,0)-R8C+MEP-MNR),0,1,1))) ->  | AI102: =IF(RC1="","",IF(OR(R8C<=ROUND(DAYS360(ValDat,RC1,0)/30,0),R8C>ROUND(DAYS360(ExpDat,RC1,0)/30,0)),0,OFFSET(R45C,MAX(-MNR,ROUND(DAYS360(ValDat,RC1,0)/30,0)-R8C+MEP-MNR),0,1,1))) ->  | AJ102: =IF(RC1="","",IF(OR(R8C<=ROUND(DAYS360(ValDat,RC1,0)/30,0),R8C>ROUND(DAYS360(ExpDat,RC1,0)/30,0)),0,OFFSET(R45C,MAX(-MNR,ROUND(DAYS360(ValDat,RC1,0)/30,0)-R8C+MEP-MNR),0,1,1))) ->  | AK102: =IF(RC1="","",IF(OR(R8C<=ROUND(DAYS360(ValDat,RC1,0)/30,0),R8C>ROUND(DAYS360(ExpDat,RC1,0)/30,0)),0,OFFSET(R45C,MAX(-MNR,ROUND(DAYS360(ValDat,RC1,0)/30,0)-R8C+MEP-MNR),0,1,1))) ->  | AL102: =IF(RC1="","",IF(OR(R8C<=ROUND(DAYS360(ValDat,RC1,0)/30,0),R8C>ROUND(DAYS360(ExpDat,RC1,0)/30,0)),0,OFFSET(R45C,MAX(-MNR,ROUND(DAYS360(ValDat,RC1,0)/30,0)-R8C+MEP-MNR),0,1,1))) ->  | AM102: =IF(RC1="","",IF(OR(R8C<=ROUND(DAYS360(ValDat,RC1,0)/30,0),R8C>ROUND(DAYS360(ExpDat,RC1,0)/30,0)),0,OFFSET(R45C,MAX(-MNR,ROUND(DAYS360(ValDat,RC1,0)/30,0)-R8C+MEP-MNR),0,1,1))) ->  | AN102: =IF(RC1="","",IF(OR(R8C<=ROUND(DAYS360(ValDat,RC1,0)/30,0),R8C>ROUND(DAYS360(ExpDat,RC1,0)/30,0)),0,OFFSET(R45C,MAX(-MNR,ROUND(DAYS360(ValDat,RC1,0)/30,0)-R8C+MEP-MNR),0,1,1))) ->  | AO102: =IF(RC1="","",IF(OR(R8C<=ROUND(DAYS360(ValDat,RC1,0)/30,0),R8C>ROUND(DAYS360(ExpDat,RC1,0)/30,0)),0,OFFSET(R45C,MAX(-MNR,ROUND(DAYS360(ValDat,RC1,0)/30,0)-R8C+MEP-MNR),0,1,1))) -> 
A103: =IF(R[-1]C="","",IF(EOMONTH(R[-1]C,0)+1>RunDat,"",EOMONTH(R[-1]C,0)+1)) ->  | D103: =IF(RC1="","",SUM(RC[2]:RC[37])) ->  | F103: =IF(RC1="","",IF(OR(R8C<=ROUND(DAYS360(ValDat,RC1,0)/30,0),R8C>ROUND(DAYS360(ExpDat,RC1,0)/30,0)),0,OFFSET(R45C,MAX(-MNR,ROUND(DAYS360(ValDat,RC1,0)/30,0)-R8C+MEP-MNR),0,1,1))) ->  | G103: =IF(RC1="","",IF(OR(R8C<=ROUND(DAYS360(ValDat,RC1,0)/30,0),R8C>ROUND(DAYS360(ExpDat,RC1,0)/30,0)),0,OFFSET(R45C,MAX(-MNR,ROUND(DAYS360(ValDat,RC1,0)/30,0)-R8C+MEP-MNR),0,1,1))) ->  | H103: =IF(RC1="","",IF(OR(R8C<=ROUND(DAYS360(ValDat,RC1,0)/30,0),R8C>ROUND(DAYS360(ExpDat,RC1,0)/30,0)),0,OFFSET(R45C,MAX(-MNR,ROUND(DAYS360(ValDat,RC1,0)/30,0)-R8C+MEP-MNR),0,1,1))) ->  | I103: =IF(RC1="","",IF(OR(R8C<=ROUND(DAYS360(ValDat,RC1,0)/30,0),R8C>ROUND(DAYS360(ExpDat,RC1,0)/30,0)),0,OFFSET(R45C,MAX(-MNR,ROUND(DAYS360(ValDat,RC1,0)/30,0)-R8C+MEP-MNR),0,1,1))) ->  | J103: =IF(RC1="","",IF(OR(R8C<=ROUND(DAYS360(ValDat,RC1,0)/30,0),R8C>ROUND(DAYS360(ExpDat,RC1,0)/30,0)),0,OFFSET(R45C,MAX(-MNR,ROUND(DAYS360(ValDat,RC1,0)/30,0)-R8C+MEP-MNR),0,1,1))) ->  | K103: =IF(RC1="","",IF(OR(R8C<=ROUND(DAYS360(ValDat,RC1,0)/30,0),R8C>ROUND(DAYS360(ExpDat,RC1,0)/30,0)),0,OFFSET(R45C,MAX(-MNR,ROUND(DAYS360(ValDat,RC1,0)/30,0)-R8C+MEP-MNR),0,1,1))) ->  | L103: =IF(RC1="","",IF(OR(R8C<=ROUND(DAYS360(ValDat,RC1,0)/30,0),R8C>ROUND(DAYS360(ExpDat,RC1,0)/30,0)),0,OFFSET(R45C,MAX(-MNR,ROUND(DAYS360(ValDat,RC1,0)/30,0)-R8C+MEP-MNR),0,1,1))) ->  | M103: =IF(RC1="","",IF(OR(R8C<=ROUND(DAYS360(ValDat,RC1,0)/30,0),R8C>ROUND(DAYS360(ExpDat,RC1,0)/30,0)),0,OFFSET(R45C,MAX(-MNR,ROUND(DAYS360(ValDat,RC1,0)/30,0)-R8C+MEP-MNR),0,1,1))) ->  | N103: =IF(RC1="","",IF(OR(R8C<=ROUND(DAYS360(ValDat,RC1,0)/30,0),R8C>ROUND(DAYS360(ExpDat,RC1,0)/30,0)),0,OFFSET(R45C,MAX(-MNR,ROUND(DAYS360(ValDat,RC1,0)/30,0)-R8C+MEP-MNR),0,1,1))) ->  | O103: =IF(RC1="","",IF(OR(R8C<=ROUND(DAYS360(ValDat,RC1,0)/30,0),R8C>ROUND(DAYS360(ExpDat,RC1,0)/30,0)),0,OFFSET(R45C,MAX(-MNR,ROUND(DAYS360(ValDat,RC1,0)/30,0)-R8C+MEP-MNR),0,1,1))) ->  | P103: =IF(RC1="","",IF(OR(R8C<=ROUND(DAYS360(ValDat,RC1,0)/30,0),R8C>ROUND(DAYS360(ExpDat,RC1,0)/30,0)),0,OFFSET(R45C,MAX(-MNR,ROUND(DAYS360(ValDat,RC1,0)/30,0)-R8C+MEP-MNR),0,1,1))) ->  | Q103: =IF(RC1="","",IF(OR(R8C<=ROUND(DAYS360(ValDat,RC1,0)/30,0),R8C>ROUND(DAYS360(ExpDat,RC1,0)/30,0)),0,OFFSET(R45C,MAX(-MNR,ROUND(DAYS360(ValDat,RC1,0)/30,0)-R8C+MEP-MNR),0,1,1))) ->  | R103: =IF(RC1="","",IF(OR(R8C<=ROUND(DAYS360(ValDat,RC1,0)/30,0),R8C>ROUND(DAYS360(ExpDat,RC1,0)/30,0)),0,OFFSET(R45C,MAX(-MNR,ROUND(DAYS360(ValDat,RC1,0)/30,0)-R8C+MEP-MNR),0,1,1))) ->  | S103: =IF(RC1="","",IF(OR(R8C<=ROUND(DAYS360(ValDat,RC1,0)/30,0),R8C>ROUND(DAYS360(ExpDat,RC1,0)/30,0)),0,OFFSET(R45C,MAX(-MNR,ROUND(DAYS360(ValDat,RC1,0)/30,0)-R8C+MEP-MNR),0,1,1))) ->  | T103: =IF(RC1="","",IF(OR(R8C<=ROUND(DAYS360(ValDat,RC1,0)/30,0),R8C>ROUND(DAYS360(ExpDat,RC1,0)/30,0)),0,OFFSET(R45C,MAX(-MNR,ROUND(DAYS360(ValDat,RC1,0)/30,0)-R8C+MEP-MNR),0,1,1))) ->  | U103: =IF(RC1="","",IF(OR(R8C<=ROUND(DAYS360(ValDat,RC1,0)/30,0),R8C>ROUND(DAYS360(ExpDat,RC1,0)/30,0)),0,OFFSET(R45C,MAX(-MNR,ROUND(DAYS360(ValDat,RC1,0)/30,0)-R8C+MEP-MNR),0,1,1))) ->  | V103: =IF(RC1="","",IF(OR(R8C<=ROUND(DAYS360(ValDat,RC1,0)/30,0),R8C>ROUND(DAYS360(ExpDat,RC1,0)/30,0)),0,OFFSET(R45C,MAX(-MNR,ROUND(DAYS360(ValDat,RC1,0)/30,0)-R8C+MEP-MNR),0,1,1))) ->  | W103: =IF(RC1="","",IF(OR(R8C<=ROUND(DAYS360(ValDat,RC1,0)/30,0),R8C>ROUND(DAYS360(ExpDat,RC1,0)/30,0)),0,OFFSET(R45C,MAX(-MNR,ROUND(DAYS360(ValDat,RC1,0)/30,0)-R8C+MEP-MNR),0,1,1))) ->  | X103: =IF(RC1="","",IF(OR(R8C<=ROUND(DAYS360(ValDat,RC1,0)/30,0),R8C>ROUND(DAYS360(ExpDat,RC1,0)/30,0)),0,OFFSET(R45C,MAX(-MNR,ROUND(DAYS360(ValDat,RC1,0)/30,0)-R8C+MEP-MNR),0,1,1))) ->  | Y103: =IF(RC1="","",IF(OR(R8C<=ROUND(DAYS360(ValDat,RC1,0)/30,0),R8C>ROUND(DAYS360(ExpDat,RC1,0)/30,0)),0,OFFSET(R45C,MAX(-MNR,ROUND(DAYS360(ValDat,RC1,0)/30,0)-R8C+MEP-MNR),0,1,1))) ->  | Z103: =IF(RC1="","",IF(OR(R8C<=ROUND(DAYS360(ValDat,RC1,0)/30,0),R8C>ROUND(DAYS360(ExpDat,RC1,0)/30,0)),0,OFFSET(R45C,MAX(-MNR,ROUND(DAYS360(ValDat,RC1,0)/30,0)-R8C+MEP-MNR),0,1,1))) ->  | AA103: =IF(RC1="","",IF(OR(R8C<=ROUND(DAYS360(ValDat,RC1,0)/30,0),R8C>ROUND(DAYS360(ExpDat,RC1,0)/30,0)),0,OFFSET(R45C,MAX(-MNR,ROUND(DAYS360(ValDat,RC1,0)/30,0)-R8C+MEP-MNR),0,1,1))) ->  | AB103: =IF(RC1="","",IF(OR(R8C<=ROUND(DAYS360(ValDat,RC1,0)/30,0),R8C>ROUND(DAYS360(ExpDat,RC1,0)/30,0)),0,OFFSET(R45C,MAX(-MNR,ROUND(DAYS360(ValDat,RC1,0)/30,0)-R8C+MEP-MNR),0,1,1))) ->  | AC103: =IF(RC1="","",IF(OR(R8C<=ROUND(DAYS360(ValDat,RC1,0)/30,0),R8C>ROUND(DAYS360(ExpDat,RC1,0)/30,0)),0,OFFSET(R45C,MAX(-MNR,ROUND(DAYS360(ValDat,RC1,0)/30,0)-R8C+MEP-MNR),0,1,1))) ->  | AD103: =IF(RC1="","",IF(OR(R8C<=ROUND(DAYS360(ValDat,RC1,0)/30,0),R8C>ROUND(DAYS360(ExpDat,RC1,0)/30,0)),0,OFFSET(R45C,MAX(-MNR,ROUND(DAYS360(ValDat,RC1,0)/30,0)-R8C+MEP-MNR),0,1,1))) ->  | AE103: =IF(RC1="","",IF(OR(R8C<=ROUND(DAYS360(ValDat,RC1,0)/30,0),R8C>ROUND(DAYS360(ExpDat,RC1,0)/30,0)),0,OFFSET(R45C,MAX(-MNR,ROUND(DAYS360(ValDat,RC1,0)/30,0)-R8C+MEP-MNR),0,1,1))) ->  | AF103: =IF(RC1="","",IF(OR(R8C<=ROUND(DAYS360(ValDat,RC1,0)/30,0),R8C>ROUND(DAYS360(ExpDat,RC1,0)/30,0)),0,OFFSET(R45C,MAX(-MNR,ROUND(DAYS360(ValDat,RC1,0)/30,0)-R8C+MEP-MNR),0,1,1))) ->  | AG103: =IF(RC1="","",IF(OR(R8C<=ROUND(DAYS360(ValDat,RC1,0)/30,0),R8C>ROUND(DAYS360(ExpDat,RC1,0)/30,0)),0,OFFSET(R45C,MAX(-MNR,ROUND(DAYS360(ValDat,RC1,0)/30,0)-R8C+MEP-MNR),0,1,1))) ->  | AH103: =IF(RC1="","",IF(OR(R8C<=ROUND(DAYS360(ValDat,RC1,0)/30,0),R8C>ROUND(DAYS360(ExpDat,RC1,0)/30,0)),0,OFFSET(R45C,MAX(-MNR,ROUND(DAYS360(ValDat,RC1,0)/30,0)-R8C+MEP-MNR),0,1,1))) ->  | AI103: =IF(RC1="","",IF(OR(R8C<=ROUND(DAYS360(ValDat,RC1,0)/30,0),R8C>ROUND(DAYS360(ExpDat,RC1,0)/30,0)),0,OFFSET(R45C,MAX(-MNR,ROUND(DAYS360(ValDat,RC1,0)/30,0)-R8C+MEP-MNR),0,1,1))) ->  | AJ103: =IF(RC1="","",IF(OR(R8C<=ROUND(DAYS360(ValDat,RC1,0)/30,0),R8C>ROUND(DAYS360(ExpDat,RC1,0)/30,0)),0,OFFSET(R45C,MAX(-MNR,ROUND(DAYS360(ValDat,RC1,0)/30,0)-R8C+MEP-MNR),0,1,1))) ->  | AK103: =IF(RC1="","",IF(OR(R8C<=ROUND(DAYS360(ValDat,RC1,0)/30,0),R8C>ROUND(DAYS360(ExpDat,RC1,0)/30,0)),0,OFFSET(R45C,MAX(-MNR,ROUND(DAYS360(ValDat,RC1,0)/30,0)-R8C+MEP-MNR),0,1,1))) ->  | AL103: =IF(RC1="","",IF(OR(R8C<=ROUND(DAYS360(ValDat,RC1,0)/30,0),R8C>ROUND(DAYS360(ExpDat,RC1,0)/30,0)),0,OFFSET(R45C,MAX(-MNR,ROUND(DAYS360(ValDat,RC1,0)/30,0)-R8C+MEP-MNR),0,1,1))) ->  | AM103: =IF(RC1="","",IF(OR(R8C<=ROUND(DAYS360(ValDat,RC1,0)/30,0),R8C>ROUND(DAYS360(ExpDat,RC1,0)/30,0)),0,OFFSET(R45C,MAX(-MNR,ROUND(DAYS360(ValDat,RC1,0)/30,0)-R8C+MEP-MNR),0,1,1))) ->  | AN103: =IF(RC1="","",IF(OR(R8C<=ROUND(DAYS360(ValDat,RC1,0)/30,0),R8C>ROUND(DAYS360(ExpDat,RC1,0)/30,0)),0,OFFSET(R45C,MAX(-MNR,ROUND(DAYS360(ValDat,RC1,0)/30,0)-R8C+MEP-MNR),0,1,1))) ->  | AO103: =IF(RC1="","",IF(OR(R8C<=ROUND(DAYS360(ValDat,RC1,0)/30,0),R8C>ROUND(DAYS360(ExpDat,RC1,0)/30,0)),0,OFFSET(R45C,MAX(-MNR,ROUND(DAYS360(ValDat,RC1,0)/30,0)-R8C+MEP-MNR),0,1,1))) -> 
A104: =IF(R[-1]C="","",IF(EOMONTH(R[-1]C,0)+1>RunDat,"",EOMONTH(R[-1]C,0)+1)) ->  | D104: =IF(RC1="","",SUM(RC[2]:RC[37])) ->  | F104: =IF(RC1="","",IF(OR(R8C<=ROUND(DAYS360(ValDat,RC1,0)/30,0),R8C>ROUND(DAYS360(ExpDat,RC1,0)/30,0)),0,OFFSET(R45C,MAX(-MNR,ROUND(DAYS360(ValDat,RC1,0)/30,0)-R8C+MEP-MNR),0,1,1))) ->  | G104: =IF(RC1="","",IF(OR(R8C<=ROUND(DAYS360(ValDat,RC1,0)/30,0),R8C>ROUND(DAYS360(ExpDat,RC1,0)/30,0)),0,OFFSET(R45C,MAX(-MNR,ROUND(DAYS360(ValDat,RC1,0)/30,0)-R8C+MEP-MNR),0,1,1))) ->  | H104: =IF(RC1="","",IF(OR(R8C<=ROUND(DAYS360(ValDat,RC1,0)/30,0),R8C>ROUND(DAYS360(ExpDat,RC1,0)/30,0)),0,OFFSET(R45C,MAX(-MNR,ROUND(DAYS360(ValDat,RC1,0)/30,0)-R8C+MEP-MNR),0,1,1))) ->  | I104: =IF(RC1="","",IF(OR(R8C<=ROUND(DAYS360(ValDat,RC1,0)/30,0),R8C>ROUND(DAYS360(ExpDat,RC1,0)/30,0)),0,OFFSET(R45C,MAX(-MNR,ROUND(DAYS360(ValDat,RC1,0)/30,0)-R8C+MEP-MNR),0,1,1))) ->  | J104: =IF(RC1="","",IF(OR(R8C<=ROUND(DAYS360(ValDat,RC1,0)/30,0),R8C>ROUND(DAYS360(ExpDat,RC1,0)/30,0)),0,OFFSET(R45C,MAX(-MNR,ROUND(DAYS360(ValDat,RC1,0)/30,0)-R8C+MEP-MNR),0,1,1))) ->  | K104: =IF(RC1="","",IF(OR(R8C<=ROUND(DAYS360(ValDat,RC1,0)/30,0),R8C>ROUND(DAYS360(ExpDat,RC1,0)/30,0)),0,OFFSET(R45C,MAX(-MNR,ROUND(DAYS360(ValDat,RC1,0)/30,0)-R8C+MEP-MNR),0,1,1))) ->  | L104: =IF(RC1="","",IF(OR(R8C<=ROUND(DAYS360(ValDat,RC1,0)/30,0),R8C>ROUND(DAYS360(ExpDat,RC1,0)/30,0)),0,OFFSET(R45C,MAX(-MNR,ROUND(DAYS360(ValDat,RC1,0)/30,0)-R8C+MEP-MNR),0,1,1))) ->  | M104: =IF(RC1="","",IF(OR(R8C<=ROUND(DAYS360(ValDat,RC1,0)/30,0),R8C>ROUND(DAYS360(ExpDat,RC1,0)/30,0)),0,OFFSET(R45C,MAX(-MNR,ROUND(DAYS360(ValDat,RC1,0)/30,0)-R8C+MEP-MNR),0,1,1))) ->  | N104: =IF(RC1="","",IF(OR(R8C<=ROUND(DAYS360(ValDat,RC1,0)/30,0),R8C>ROUND(DAYS360(ExpDat,RC1,0)/30,0)),0,OFFSET(R45C,MAX(-MNR,ROUND(DAYS360(ValDat,RC1,0)/30,0)-R8C+MEP-MNR),0,1,1))) ->  | O104: =IF(RC1="","",IF(OR(R8C<=ROUND(DAYS360(ValDat,RC1,0)/30,0),R8C>ROUND(DAYS360(ExpDat,RC1,0)/30,0)),0,OFFSET(R45C,MAX(-MNR,ROUND(DAYS360(ValDat,RC1,0)/30,0)-R8C+MEP-MNR),0,1,1))) ->  | P104: =IF(RC1="","",IF(OR(R8C<=ROUND(DAYS360(ValDat,RC1,0)/30,0),R8C>ROUND(DAYS360(ExpDat,RC1,0)/30,0)),0,OFFSET(R45C,MAX(-MNR,ROUND(DAYS360(ValDat,RC1,0)/30,0)-R8C+MEP-MNR),0,1,1))) ->  | Q104: =IF(RC1="","",IF(OR(R8C<=ROUND(DAYS360(ValDat,RC1,0)/30,0),R8C>ROUND(DAYS360(ExpDat,RC1,0)/30,0)),0,OFFSET(R45C,MAX(-MNR,ROUND(DAYS360(ValDat,RC1,0)/30,0)-R8C+MEP-MNR),0,1,1))) ->  | R104: =IF(RC1="","",IF(OR(R8C<=ROUND(DAYS360(ValDat,RC1,0)/30,0),R8C>ROUND(DAYS360(ExpDat,RC1,0)/30,0)),0,OFFSET(R45C,MAX(-MNR,ROUND(DAYS360(ValDat,RC1,0)/30,0)-R8C+MEP-MNR),0,1,1))) ->  | S104: =IF(RC1="","",IF(OR(R8C<=ROUND(DAYS360(ValDat,RC1,0)/30,0),R8C>ROUND(DAYS360(ExpDat,RC1,0)/30,0)),0,OFFSET(R45C,MAX(-MNR,ROUND(DAYS360(ValDat,RC1,0)/30,0)-R8C+MEP-MNR),0,1,1))) ->  | T104: =IF(RC1="","",IF(OR(R8C<=ROUND(DAYS360(ValDat,RC1,0)/30,0),R8C>ROUND(DAYS360(ExpDat,RC1,0)/30,0)),0,OFFSET(R45C,MAX(-MNR,ROUND(DAYS360(ValDat,RC1,0)/30,0)-R8C+MEP-MNR),0,1,1))) ->  | U104: =IF(RC1="","",IF(OR(R8C<=ROUND(DAYS360(ValDat,RC1,0)/30,0),R8C>ROUND(DAYS360(ExpDat,RC1,0)/30,0)),0,OFFSET(R45C,MAX(-MNR,ROUND(DAYS360(ValDat,RC1,0)/30,0)-R8C+MEP-MNR),0,1,1))) ->  | V104: =IF(RC1="","",IF(OR(R8C<=ROUND(DAYS360(ValDat,RC1,0)/30,0),R8C>ROUND(DAYS360(ExpDat,RC1,0)/30,0)),0,OFFSET(R45C,MAX(-MNR,ROUND(DAYS360(ValDat,RC1,0)/30,0)-R8C+MEP-MNR),0,1,1))) ->  | W104: =IF(RC1="","",IF(OR(R8C<=ROUND(DAYS360(ValDat,RC1,0)/30,0),R8C>ROUND(DAYS360(ExpDat,RC1,0)/30,0)),0,OFFSET(R45C,MAX(-MNR,ROUND(DAYS360(ValDat,RC1,0)/30,0)-R8C+MEP-MNR),0,1,1))) ->  | X104: =IF(RC1="","",IF(OR(R8C<=ROUND(DAYS360(ValDat,RC1,0)/30,0),R8C>ROUND(DAYS360(ExpDat,RC1,0)/30,0)),0,OFFSET(R45C,MAX(-MNR,ROUND(DAYS360(ValDat,RC1,0)/30,0)-R8C+MEP-MNR),0,1,1))) ->  | Y104: =IF(RC1="","",IF(OR(R8C<=ROUND(DAYS360(ValDat,RC1,0)/30,0),R8C>ROUND(DAYS360(ExpDat,RC1,0)/30,0)),0,OFFSET(R45C,MAX(-MNR,ROUND(DAYS360(ValDat,RC1,0)/30,0)-R8C+MEP-MNR),0,1,1))) ->  | Z104: =IF(RC1="","",IF(OR(R8C<=ROUND(DAYS360(ValDat,RC1,0)/30,0),R8C>ROUND(DAYS360(ExpDat,RC1,0)/30,0)),0,OFFSET(R45C,MAX(-MNR,ROUND(DAYS360(ValDat,RC1,0)/30,0)-R8C+MEP-MNR),0,1,1))) ->  | AA104: =IF(RC1="","",IF(OR(R8C<=ROUND(DAYS360(ValDat,RC1,0)/30,0),R8C>ROUND(DAYS360(ExpDat,RC1,0)/30,0)),0,OFFSET(R45C,MAX(-MNR,ROUND(DAYS360(ValDat,RC1,0)/30,0)-R8C+MEP-MNR),0,1,1))) ->  | AB104: =IF(RC1="","",IF(OR(R8C<=ROUND(DAYS360(ValDat,RC1,0)/30,0),R8C>ROUND(DAYS360(ExpDat,RC1,0)/30,0)),0,OFFSET(R45C,MAX(-MNR,ROUND(DAYS360(ValDat,RC1,0)/30,0)-R8C+MEP-MNR),0,1,1))) ->  | AC104: =IF(RC1="","",IF(OR(R8C<=ROUND(DAYS360(ValDat,RC1,0)/30,0),R8C>ROUND(DAYS360(ExpDat,RC1,0)/30,0)),0,OFFSET(R45C,MAX(-MNR,ROUND(DAYS360(ValDat,RC1,0)/30,0)-R8C+MEP-MNR),0,1,1))) ->  | AD104: =IF(RC1="","",IF(OR(R8C<=ROUND(DAYS360(ValDat,RC1,0)/30,0),R8C>ROUND(DAYS360(ExpDat,RC1,0)/30,0)),0,OFFSET(R45C,MAX(-MNR,ROUND(DAYS360(ValDat,RC1,0)/30,0)-R8C+MEP-MNR),0,1,1))) ->  | AE104: =IF(RC1="","",IF(OR(R8C<=ROUND(DAYS360(ValDat,RC1,0)/30,0),R8C>ROUND(DAYS360(ExpDat,RC1,0)/30,0)),0,OFFSET(R45C,MAX(-MNR,ROUND(DAYS360(ValDat,RC1,0)/30,0)-R8C+MEP-MNR),0,1,1))) ->  | AF104: =IF(RC1="","",IF(OR(R8C<=ROUND(DAYS360(ValDat,RC1,0)/30,0),R8C>ROUND(DAYS360(ExpDat,RC1,0)/30,0)),0,OFFSET(R45C,MAX(-MNR,ROUND(DAYS360(ValDat,RC1,0)/30,0)-R8C+MEP-MNR),0,1,1))) ->  | AG104: =IF(RC1="","",IF(OR(R8C<=ROUND(DAYS360(ValDat,RC1,0)/30,0),R8C>ROUND(DAYS360(ExpDat,RC1,0)/30,0)),0,OFFSET(R45C,MAX(-MNR,ROUND(DAYS360(ValDat,RC1,0)/30,0)-R8C+MEP-MNR),0,1,1))) ->  | AH104: =IF(RC1="","",IF(OR(R8C<=ROUND(DAYS360(ValDat,RC1,0)/30,0),R8C>ROUND(DAYS360(ExpDat,RC1,0)/30,0)),0,OFFSET(R45C,MAX(-MNR,ROUND(DAYS360(ValDat,RC1,0)/30,0)-R8C+MEP-MNR),0,1,1))) ->  | AI104: =IF(RC1="","",IF(OR(R8C<=ROUND(DAYS360(ValDat,RC1,0)/30,0),R8C>ROUND(DAYS360(ExpDat,RC1,0)/30,0)),0,OFFSET(R45C,MAX(-MNR,ROUND(DAYS360(ValDat,RC1,0)/30,0)-R8C+MEP-MNR),0,1,1))) ->  | AJ104: =IF(RC1="","",IF(OR(R8C<=ROUND(DAYS360(ValDat,RC1,0)/30,0),R8C>ROUND(DAYS360(ExpDat,RC1,0)/30,0)),0,OFFSET(R45C,MAX(-MNR,ROUND(DAYS360(ValDat,RC1,0)/30,0)-R8C+MEP-MNR),0,1,1))) ->  | AK104: =IF(RC1="","",IF(OR(R8C<=ROUND(DAYS360(ValDat,RC1,0)/30,0),R8C>ROUND(DAYS360(ExpDat,RC1,0)/30,0)),0,OFFSET(R45C,MAX(-MNR,ROUND(DAYS360(ValDat,RC1,0)/30,0)-R8C+MEP-MNR),0,1,1))) ->  | AL104: =IF(RC1="","",IF(OR(R8C<=ROUND(DAYS360(ValDat,RC1,0)/30,0),R8C>ROUND(DAYS360(ExpDat,RC1,0)/30,0)),0,OFFSET(R45C,MAX(-MNR,ROUND(DAYS360(ValDat,RC1,0)/30,0)-R8C+MEP-MNR),0,1,1))) ->  | AM104: =IF(RC1="","",IF(OR(R8C<=ROUND(DAYS360(ValDat,RC1,0)/30,0),R8C>ROUND(DAYS360(ExpDat,RC1,0)/30,0)),0,OFFSET(R45C,MAX(-MNR,ROUND(DAYS360(ValDat,RC1,0)/30,0)-R8C+MEP-MNR),0,1,1))) ->  | AN104: =IF(RC1="","",IF(OR(R8C<=ROUND(DAYS360(ValDat,RC1,0)/30,0),R8C>ROUND(DAYS360(ExpDat,RC1,0)/30,0)),0,OFFSET(R45C,MAX(-MNR,ROUND(DAYS360(ValDat,RC1,0)/30,0)-R8C+MEP-MNR),0,1,1))) ->  | AO104: =IF(RC1="","",IF(OR(R8C<=ROUND(DAYS360(ValDat,RC1,0)/30,0),R8C>ROUND(DAYS360(ExpDat,RC1,0)/30,0)),0,OFFSET(R45C,MAX(-MNR,ROUND(DAYS360(ValDat,RC1,0)/30,0)-R8C+MEP-MNR),0,1,1))) -> 
A105: =IF(R[-1]C="","",IF(EOMONTH(R[-1]C,0)+1>RunDat,"",EOMONTH(R[-1]C,0)+1)) ->  | D105: =IF(RC1="","",SUM(RC[2]:RC[37])) ->  | F105: =IF(RC1="","",IF(OR(R8C<=ROUND(DAYS360(ValDat,RC1,0)/30,0),R8C>ROUND(DAYS360(ExpDat,RC1,0)/30,0)),0,OFFSET(R45C,MAX(-MNR,ROUND(DAYS360(ValDat,RC1,0)/30,0)-R8C+MEP-MNR),0,1,1))) ->  | G105: =IF(RC1="","",IF(OR(R8C<=ROUND(DAYS360(ValDat,RC1,0)/30,0),R8C>ROUND(DAYS360(ExpDat,RC1,0)/30,0)),0,OFFSET(R45C,MAX(-MNR,ROUND(DAYS360(ValDat,RC1,0)/30,0)-R8C+MEP-MNR),0,1,1))) ->  | H105: =IF(RC1="","",IF(OR(R8C<=ROUND(DAYS360(ValDat,RC1,0)/30,0),R8C>ROUND(DAYS360(ExpDat,RC1,0)/30,0)),0,OFFSET(R45C,MAX(-MNR,ROUND(DAYS360(ValDat,RC1,0)/30,0)-R8C+MEP-MNR),0,1,1))) ->  | I105: =IF(RC1="","",IF(OR(R8C<=ROUND(DAYS360(ValDat,RC1,0)/30,0),R8C>ROUND(DAYS360(ExpDat,RC1,0)/30,0)),0,OFFSET(R45C,MAX(-MNR,ROUND(DAYS360(ValDat,RC1,0)/30,0)-R8C+MEP-MNR),0,1,1))) ->  | J105: =IF(RC1="","",IF(OR(R8C<=ROUND(DAYS360(ValDat,RC1,0)/30,0),R8C>ROUND(DAYS360(ExpDat,RC1,0)/30,0)),0,OFFSET(R45C,MAX(-MNR,ROUND(DAYS360(ValDat,RC1,0)/30,0)-R8C+MEP-MNR),0,1,1))) ->  | K105: =IF(RC1="","",IF(OR(R8C<=ROUND(DAYS360(ValDat,RC1,0)/30,0),R8C>ROUND(DAYS360(ExpDat,RC1,0)/30,0)),0,OFFSET(R45C,MAX(-MNR,ROUND(DAYS360(ValDat,RC1,0)/30,0)-R8C+MEP-MNR),0,1,1))) ->  | L105: =IF(RC1="","",IF(OR(R8C<=ROUND(DAYS360(ValDat,RC1,0)/30,0),R8C>ROUND(DAYS360(ExpDat,RC1,0)/30,0)),0,OFFSET(R45C,MAX(-MNR,ROUND(DAYS360(ValDat,RC1,0)/30,0)-R8C+MEP-MNR),0,1,1))) ->  | M105: =IF(RC1="","",IF(OR(R8C<=ROUND(DAYS360(ValDat,RC1,0)/30,0),R8C>ROUND(DAYS360(ExpDat,RC1,0)/30,0)),0,OFFSET(R45C,MAX(-MNR,ROUND(DAYS360(ValDat,RC1,0)/30,0)-R8C+MEP-MNR),0,1,1))) ->  | N105: =IF(RC1="","",IF(OR(R8C<=ROUND(DAYS360(ValDat,RC1,0)/30,0),R8C>ROUND(DAYS360(ExpDat,RC1,0)/30,0)),0,OFFSET(R45C,MAX(-MNR,ROUND(DAYS360(ValDat,RC1,0)/30,0)-R8C+MEP-MNR),0,1,1))) ->  | O105: =IF(RC1="","",IF(OR(R8C<=ROUND(DAYS360(ValDat,RC1,0)/30,0),R8C>ROUND(DAYS360(ExpDat,RC1,0)/30,0)),0,OFFSET(R45C,MAX(-MNR,ROUND(DAYS360(ValDat,RC1,0)/30,0)-R8C+MEP-MNR),0,1,1))) ->  | P105: =IF(RC1="","",IF(OR(R8C<=ROUND(DAYS360(ValDat,RC1,0)/30,0),R8C>ROUND(DAYS360(ExpDat,RC1,0)/30,0)),0,OFFSET(R45C,MAX(-MNR,ROUND(DAYS360(ValDat,RC1,0)/30,0)-R8C+MEP-MNR),0,1,1))) ->  | Q105: =IF(RC1="","",IF(OR(R8C<=ROUND(DAYS360(ValDat,RC1,0)/30,0),R8C>ROUND(DAYS360(ExpDat,RC1,0)/30,0)),0,OFFSET(R45C,MAX(-MNR,ROUND(DAYS360(ValDat,RC1,0)/30,0)-R8C+MEP-MNR),0,1,1))) ->  | R105: =IF(RC1="","",IF(OR(R8C<=ROUND(DAYS360(ValDat,RC1,0)/30,0),R8C>ROUND(DAYS360(ExpDat,RC1,0)/30,0)),0,OFFSET(R45C,MAX(-MNR,ROUND(DAYS360(ValDat,RC1,0)/30,0)-R8C+MEP-MNR),0,1,1))) ->  | S105: =IF(RC1="","",IF(OR(R8C<=ROUND(DAYS360(ValDat,RC1,0)/30,0),R8C>ROUND(DAYS360(ExpDat,RC1,0)/30,0)),0,OFFSET(R45C,MAX(-MNR,ROUND(DAYS360(ValDat,RC1,0)/30,0)-R8C+MEP-MNR),0,1,1))) ->  | T105: =IF(RC1="","",IF(OR(R8C<=ROUND(DAYS360(ValDat,RC1,0)/30,0),R8C>ROUND(DAYS360(ExpDat,RC1,0)/30,0)),0,OFFSET(R45C,MAX(-MNR,ROUND(DAYS360(ValDat,RC1,0)/30,0)-R8C+MEP-MNR),0,1,1))) ->  | U105: =IF(RC1="","",IF(OR(R8C<=ROUND(DAYS360(ValDat,RC1,0)/30,0),R8C>ROUND(DAYS360(ExpDat,RC1,0)/30,0)),0,OFFSET(R45C,MAX(-MNR,ROUND(DAYS360(ValDat,RC1,0)/30,0)-R8C+MEP-MNR),0,1,1))) ->  | V105: =IF(RC1="","",IF(OR(R8C<=ROUND(DAYS360(ValDat,RC1,0)/30,0),R8C>ROUND(DAYS360(ExpDat,RC1,0)/30,0)),0,OFFSET(R45C,MAX(-MNR,ROUND(DAYS360(ValDat,RC1,0)/30,0)-R8C+MEP-MNR),0,1,1))) ->  | W105: =IF(RC1="","",IF(OR(R8C<=ROUND(DAYS360(ValDat,RC1,0)/30,0),R8C>ROUND(DAYS360(ExpDat,RC1,0)/30,0)),0,OFFSET(R45C,MAX(-MNR,ROUND(DAYS360(ValDat,RC1,0)/30,0)-R8C+MEP-MNR),0,1,1))) ->  | X105: =IF(RC1="","",IF(OR(R8C<=ROUND(DAYS360(ValDat,RC1,0)/30,0),R8C>ROUND(DAYS360(ExpDat,RC1,0)/30,0)),0,OFFSET(R45C,MAX(-MNR,ROUND(DAYS360(ValDat,RC1,0)/30,0)-R8C+MEP-MNR),0,1,1))) ->  | Y105: =IF(RC1="","",IF(OR(R8C<=ROUND(DAYS360(ValDat,RC1,0)/30,0),R8C>ROUND(DAYS360(ExpDat,RC1,0)/30,0)),0,OFFSET(R45C,MAX(-MNR,ROUND(DAYS360(ValDat,RC1,0)/30,0)-R8C+MEP-MNR),0,1,1))) ->  | Z105: =IF(RC1="","",IF(OR(R8C<=ROUND(DAYS360(ValDat,RC1,0)/30,0),R8C>ROUND(DAYS360(ExpDat,RC1,0)/30,0)),0,OFFSET(R45C,MAX(-MNR,ROUND(DAYS360(ValDat,RC1,0)/30,0)-R8C+MEP-MNR),0,1,1))) ->  | AA105: =IF(RC1="","",IF(OR(R8C<=ROUND(DAYS360(ValDat,RC1,0)/30,0),R8C>ROUND(DAYS360(ExpDat,RC1,0)/30,0)),0,OFFSET(R45C,MAX(-MNR,ROUND(DAYS360(ValDat,RC1,0)/30,0)-R8C+MEP-MNR),0,1,1))) ->  | AB105: =IF(RC1="","",IF(OR(R8C<=ROUND(DAYS360(ValDat,RC1,0)/30,0),R8C>ROUND(DAYS360(ExpDat,RC1,0)/30,0)),0,OFFSET(R45C,MAX(-MNR,ROUND(DAYS360(ValDat,RC1,0)/30,0)-R8C+MEP-MNR),0,1,1))) ->  | AC105: =IF(RC1="","",IF(OR(R8C<=ROUND(DAYS360(ValDat,RC1,0)/30,0),R8C>ROUND(DAYS360(ExpDat,RC1,0)/30,0)),0,OFFSET(R45C,MAX(-MNR,ROUND(DAYS360(ValDat,RC1,0)/30,0)-R8C+MEP-MNR),0,1,1))) ->  | AD105: =IF(RC1="","",IF(OR(R8C<=ROUND(DAYS360(ValDat,RC1,0)/30,0),R8C>ROUND(DAYS360(ExpDat,RC1,0)/30,0)),0,OFFSET(R45C,MAX(-MNR,ROUND(DAYS360(ValDat,RC1,0)/30,0)-R8C+MEP-MNR),0,1,1))) ->  | AE105: =IF(RC1="","",IF(OR(R8C<=ROUND(DAYS360(ValDat,RC1,0)/30,0),R8C>ROUND(DAYS360(ExpDat,RC1,0)/30,0)),0,OFFSET(R45C,MAX(-MNR,ROUND(DAYS360(ValDat,RC1,0)/30,0)-R8C+MEP-MNR),0,1,1))) ->  | AF105: =IF(RC1="","",IF(OR(R8C<=ROUND(DAYS360(ValDat,RC1,0)/30,0),R8C>ROUND(DAYS360(ExpDat,RC1,0)/30,0)),0,OFFSET(R45C,MAX(-MNR,ROUND(DAYS360(ValDat,RC1,0)/30,0)-R8C+MEP-MNR),0,1,1))) ->  | AG105: =IF(RC1="","",IF(OR(R8C<=ROUND(DAYS360(ValDat,RC1,0)/30,0),R8C>ROUND(DAYS360(ExpDat,RC1,0)/30,0)),0,OFFSET(R45C,MAX(-MNR,ROUND(DAYS360(ValDat,RC1,0)/30,0)-R8C+MEP-MNR),0,1,1))) ->  | AH105: =IF(RC1="","",IF(OR(R8C<=ROUND(DAYS360(ValDat,RC1,0)/30,0),R8C>ROUND(DAYS360(ExpDat,RC1,0)/30,0)),0,OFFSET(R45C,MAX(-MNR,ROUND(DAYS360(ValDat,RC1,0)/30,0)-R8C+MEP-MNR),0,1,1))) ->  | AI105: =IF(RC1="","",IF(OR(R8C<=ROUND(DAYS360(ValDat,RC1,0)/30,0),R8C>ROUND(DAYS360(ExpDat,RC1,0)/30,0)),0,OFFSET(R45C,MAX(-MNR,ROUND(DAYS360(ValDat,RC1,0)/30,0)-R8C+MEP-MNR),0,1,1))) ->  | AJ105: =IF(RC1="","",IF(OR(R8C<=ROUND(DAYS360(ValDat,RC1,0)/30,0),R8C>ROUND(DAYS360(ExpDat,RC1,0)/30,0)),0,OFFSET(R45C,MAX(-MNR,ROUND(DAYS360(ValDat,RC1,0)/30,0)-R8C+MEP-MNR),0,1,1))) ->  | AK105: =IF(RC1="","",IF(OR(R8C<=ROUND(DAYS360(ValDat,RC1,0)/30,0),R8C>ROUND(DAYS360(ExpDat,RC1,0)/30,0)),0,OFFSET(R45C,MAX(-MNR,ROUND(DAYS360(ValDat,RC1,0)/30,0)-R8C+MEP-MNR),0,1,1))) ->  | AL105: =IF(RC1="","",IF(OR(R8C<=ROUND(DAYS360(ValDat,RC1,0)/30,0),R8C>ROUND(DAYS360(ExpDat,RC1,0)/30,0)),0,OFFSET(R45C,MAX(-MNR,ROUND(DAYS360(ValDat,RC1,0)/30,0)-R8C+MEP-MNR),0,1,1))) ->  | AM105: =IF(RC1="","",IF(OR(R8C<=ROUND(DAYS360(ValDat,RC1,0)/30,0),R8C>ROUND(DAYS360(ExpDat,RC1,0)/30,0)),0,OFFSET(R45C,MAX(-MNR,ROUND(DAYS360(ValDat,RC1,0)/30,0)-R8C+MEP-MNR),0,1,1))) ->  | AN105: =IF(RC1="","",IF(OR(R8C<=ROUND(DAYS360(ValDat,RC1,0)/30,0),R8C>ROUND(DAYS360(ExpDat,RC1,0)/30,0)),0,OFFSET(R45C,MAX(-MNR,ROUND(DAYS360(ValDat,RC1,0)/30,0)-R8C+MEP-MNR),0,1,1))) ->  | AO105: =IF(RC1="","",IF(OR(R8C<=ROUND(DAYS360(ValDat,RC1,0)/30,0),R8C>ROUND(DAYS360(ExpDat,RC1,0)/30,0)),0,OFFSET(R45C,MAX(-MNR,ROUND(DAYS360(ValDat,RC1,0)/30,0)-R8C+MEP-MNR),0,1,1))) -> 

Sheet: IncurredClaims
A1: =title1&" - Block Claim Liability" -> BLOCK CLAIM LIABILITY REPORT - Block Claim Liability
A2: =title2 -> The Millennium-2000 Sample Life Insurance Company
A3: =title3 -> Arvind
A4: =title4 -> Experience Period: 01-Aug-1998 to 31-Jul-2001. Runout Date: 31-Jul-2001
B6: CALCULATION OF ESTIMATED INCURRED CLAIMS
B7: Completion Factor Method (CFM) | E7: Projection Method (PM) | I7: Blended Method (BM)
A8: Incurred Month | B8: ="Incurred and "&IF(Basis="ibnp","Paid Claims","Reported Claims") -> Incurred and Reported Claims | C8: Completion Factor | D8: Total Estimated Incurred Claims | E8: Trend Factor | F8: Trended Claim Cost | G8: Exposure | H8: Total Estimated Incurred Claims | I8: Blending Factor | J8: Total Estimated Incurred Claims | K8: Final Completion Factor | L8: Cumulative Estimated Incurred Claims
A9: =ExpDat -> 1998-08-01T00:00:00.000 | B9: =IF(RC1="","",VLOOKUP(RC1,LinearIncLag,4,FALSE)) -> 99219 | C9: =IF(RC1="","",INDEX(CmpFac,MIN(MEP,MRO+ROUND(DAYS360(RC1,ValDat,0)/30,0)))) -> 1 | D9: =IF(RC1="","",IF(RC[-1]=0,0,RC[-2]/RC[-1])) -> 99219 | E9: =IF(RC1="","",IF(VLOOKUP(RC1,TrendFacDump,2,FALSE)=0,0,VLOOKUP(EOMONTH(ValDat,-1)+1,TrendFacDump,2,FALSE)/VLOOKUP(RC1,TrendFacDump,2,FALSE))) -> 1.1852554225435581 | F9: =IF(RC1="","",IF(OR(RC[-5]=ExpDat,RC[-1]=0),0,IF(SUM(OFFSET(RC[4],-MIN(ANC,ROUND(DAYS360(ExpDat,RC[-5],0)/30,0)),0,MIN(ANC,ROUND(DAYS360(ExpDat,RC[-5],0)/30,0)),1))=0,0,(VLOOKUP(R[-1]C1,ClmCosts,6,FALSE)/RC[-1])*SUMPRODUCT(OFFSET(RC[-1],-MIN(ANC,ROUND(DAYS360(ExpDat,RC[-5],0)/30,0)),0,MIN(ANC,ROUND(DAYS360(ExpDat,RC[-5],0)/30,0)),1),OFFSET(RC[4],-MIN(ANC,ROUND(DAYS360(ExpDat,RC[-5],0)/30,0)),0,MIN(ANC,ROUND(DAYS360(ExpDat,RC[-5],0)/30,0)),1))/SUM(OFFSET(RC[4],-MIN(ANC,ROUND(DAYS360(ExpDat,RC[-5],0)/30,0)),0,MIN(ANC,ROUND(DAYS360(ExpDat,RC[-5],0)/30,0)),1))))) -> 0 | G9: =IF(RC1="","",VLOOKUP(RC1,ExpDump,7,FALSE)) -> 2576.1559999999999 | H9: =IF(RC1="","",IF(RC1=ExpDat,RC[-4],RC[-2]*RC[-1])) -> 99219 | I9: =RC[-6] -> 1 | J9: =IF(RC1="","",RC[-6]*RC[-1]+RC[-2]*(1-RC[-1])) -> 99219 | K9: =IF(RC1="","",IF(RC[-1]=0,0,RC[-9]/RC[-1])) -> 1 | L9: =IF(RC1="","",SUM(R9C[-2]:RC[-2])) -> 99219
A10: =IF(R[-1]C1="","",IF(DATE(YEAR(R[-1]C),MONTH(R[-1]C)+1,1)>ValDat,"",DATE(YEAR(R[-1]C),MONTH(R[-1]C)+1,1))) -> 1998-09-01T00:00:00.000 | B10: =IF(RC1="","",VLOOKUP(RC1,LinearIncLag,4,FALSE)) -> 99219 | C10: =IF(RC1="","",INDEX(CmpFac,MIN(MEP,MRO+ROUND(DAYS360(RC1,ValDat,0)/30,0)))) -> 1 | D10: =IF(RC1="","",IF(RC[-1]=0,0,RC[-2]/RC[-1])) -> 99219 | E10: =IF(RC1="","",IF(VLOOKUP(RC1,TrendFacDump,2,FALSE)=0,0,VLOOKUP(EOMONTH(ValDat,-1)+1,TrendFacDump,2,FALSE)/VLOOKUP(RC1,TrendFacDump,2,FALSE))) -> 1.1795234725171031 | F10: =IF(RC1="","",IF(OR(RC[-5]=ExpDat,RC[-1]=0),0,IF(SUM(OFFSET(RC[4],-MIN(ANC,ROUND(DAYS360(ExpDat,RC[-5],0)/30,0)),0,MIN(ANC,ROUND(DAYS360(ExpDat,RC[-5],0)/30,0)),1))=0,0,(VLOOKUP(R[-1]C1,ClmCosts,6,FALSE)/RC[-1])*SUMPRODUCT(OFFSET(RC[-1],-MIN(ANC,ROUND(DAYS360(ExpDat,RC[-5],0)/30,0)),0,MIN(ANC,ROUND(DAYS360(ExpDat,RC[-5],0)/30,0)),1),OFFSET(RC[4],-MIN(ANC,ROUND(DAYS360(ExpDat,RC[-5],0)/30,0)),0,MIN(ANC,ROUND(DAYS360(ExpDat,RC[-5],0)/30,0)),1))/SUM(OFFSET(RC[4],-MIN(ANC,ROUND(DAYS360(ExpDat,RC[-5],0)/30,0)),0,MIN(ANC,ROUND(DAYS360(ExpDat,RC[-5],0)/30,0)),1))))) -> 38.701522507508997 | G10: =IF(RC1="","",VLOOKUP(RC1,ExpDump,7,FALSE)) -> 2663.7669999999998 | H10: =IF(RC1="","",IF(RC1=ExpDat,RC[-4],RC[-2]*RC[-1])) -> 103091.83850525972 | I10: =RC[-6] -> 1 | J10: =IF(RC1="","",RC[-6]*RC[-1]+RC[-2]*(1-RC[-1])) -> 99219 | K10: =IF(RC1="","",IF(RC[-1]=0,0,RC[-9]/RC[-1])) -> 1 | L10: =IF(RC1="","",SUM(R9C[-2]:RC[-2])) -> 198438
A11: =IF(R[-1]C1="","",IF(DATE(YEAR(R[-1]C),MONTH(R[-1]C)+1,1)>ValDat,"",DATE(YEAR(R[-1]C),MONTH(R[-1]C)+1,1))) -> 1998-10-01T00:00:00.000 | B11: =IF(RC1="","",VLOOKUP(RC1,LinearIncLag,4,FALSE)) -> 292014 | C11: =IF(RC1="","",INDEX(CmpFac,MIN(MEP,MRO+ROUND(DAYS360(RC1,ValDat,0)/30,0)))) -> 1 | D11: =IF(RC1="","",IF(RC[-1]=0,0,RC[-2]/RC[-1])) -> 292014 | E11: =IF(RC1="","",IF(VLOOKUP(RC1,TrendFacDump,2,FALSE)=0,0,VLOOKUP(EOMONTH(ValDat,-1)+1,TrendFacDump,2,FALSE)/VLOOKUP(RC1,TrendFacDump,2,FALSE))) -> 1.1738466956215519 | F11: =IF(RC1="","",IF(OR(RC[-5]=ExpDat,RC[-1]=0),0,IF(SUM(OFFSET(RC[4],-MIN(ANC,ROUND(DAYS360(ExpDat,RC[-5],0)/30,0)),0,MIN(ANC,ROUND(DAYS360(ExpDat,RC[-5],0)/30,0)),1))=0,0,(VLOOKUP(R[-1]C1,ClmCosts,6,FALSE)/RC[-1])*SUMPRODUCT(OFFSET(RC[-1],-MIN(ANC,ROUND(DAYS360(ExpDat,RC[-5],0)/30,0)),0,MIN(ANC,ROUND(DAYS360(ExpDat,RC[-5],0)/30,0)),1),OFFSET(RC[4],-MIN(ANC,ROUND(DAYS360(ExpDat,RC[-5],0)/30,0)),0,MIN(ANC,ROUND(DAYS360(ExpDat,RC[-5],0)/30,0)),1))/SUM(OFFSET(RC[4],-MIN(ANC,ROUND(DAYS360(ExpDat,RC[-5],0)/30,0)),0,MIN(ANC,ROUND(DAYS360(ExpDat,RC[-5],0)/30,0)),1))))) -> 38.146008348849655 | G11: =IF(RC1="","",VLOOKUP(RC1,ExpDump,7,FALSE)) -> 2728.2080000000001 | H11: =IF(RC1="","",IF(RC1=ExpDat,RC[-4],RC[-2]*RC[-1])) -> 104070.24514539842 | I11: =RC[-6] -> 1 | J11: =IF(RC1="","",RC[-6]*RC[-1]+RC[-2]*(1-RC[-1])) -> 292014 | K11: =IF(RC1="","",IF(RC[-1]=0,0,RC[-9]/RC[-1])) -> 1 | L11: =IF(RC1="","",SUM(R9C[-2]:RC[-2])) -> 490452
A12: =IF(R[-1]C1="","",IF(DATE(YEAR(R[-1]C),MONTH(R[-1]C)+1,1)>ValDat,"",DATE(YEAR(R[-1]C),MONTH(R[-1]C)+1,1))) -> 1998-11-01T00:00:00.000 | B12: =IF(RC1="","",VLOOKUP(RC1,LinearIncLag,4,FALSE)) -> 292014 | C12: =IF(RC1="","",INDEX(CmpFac,MIN(MEP,MRO+ROUND(DAYS360(RC1,ValDat,0)/30,0)))) -> 1 | D12: =IF(RC1="","",IF(RC[-1]=0,0,RC[-2]/RC[-1])) -> 292014 | E12: =IF(RC1="","",IF(VLOOKUP(RC1,TrendFacDump,2,FALSE)=0,0,VLOOKUP(EOMONTH(ValDat,-1)+1,TrendFacDump,2,FALSE)/VLOOKUP(RC1,TrendFacDump,2,FALSE))) -> 1.1680878402055834 | F12: =IF(RC1="","",IF(OR(RC[-5]=ExpDat,RC[-1]=0),0,IF(SUM(OFFSET(RC[4],-MIN(ANC,ROUND(DAYS360(ExpDat,RC[-5],0)/30,0)),0,MIN(ANC,ROUND(DAYS360(ExpDat,RC[-5],0)/30,0)),1))=0,0,(VLOOKUP(R[-1]C1,ClmCosts,6,FALSE)/RC[-1])*SUMPRODUCT(OFFSET(RC[-1],-MIN(ANC,ROUND(DAYS360(ExpDat,RC[-5],0)/30,0)),0,MIN(ANC,ROUND(DAYS360(ExpDat,RC[-5],0)/30,0)),1),OFFSET(RC[4],-MIN(ANC,ROUND(DAYS360(ExpDat,RC[-5],0)/30,0)),0,MIN(ANC,ROUND(DAYS360(ExpDat,RC[-5],0)/30,0)),1))/SUM(OFFSET(RC[4],-MIN(ANC,ROUND(DAYS360(ExpDat,RC[-5],0)/30,0)),0,MIN(ANC,ROUND(DAYS360(ExpDat,RC[-5],0)/30,0)),1))))) -> 62.037292221126783 | G12: =IF(RC1="","",VLOOKUP(RC1,ExpDump,7,FALSE)) -> 2780.7539999999999 | H12: =IF(RC1="","",IF(RC1=ExpDat,RC[-4],RC[-2]*RC[-1])) -> 172510.44849306718 | I12: =RC[-6] -> 1 | J12: =IF(RC1="","",RC[-6]*RC[-1]+RC[-2]*(1-RC[-1])) -> 292014 | K12: =IF(RC1="","",IF(RC[-1]=0,0,RC[-9]/RC[-1])) -> 1 | L12: =IF(RC1="","",SUM(R9C[-2]:RC[-2])) -> 782466
A13: =IF(R[-1]C1="","",IF(DATE(YEAR(R[-1]C),MONTH(R[-1]C)+1,1)>ValDat,"",DATE(YEAR(R[-1]C),MONTH(R[-1]C)+1,1))) -> 1998-12-01T00:00:00.000 | B13: =IF(RC1="","",VLOOKUP(RC1,LinearIncLag,4,FALSE)) -> 109763 | C13: =IF(RC1="","",INDEX(CmpFac,MIN(MEP,MRO+ROUND(DAYS360(RC1,ValDat,0)/30,0)))) -> 1 | D13: =IF(RC1="","",IF(RC[-1]=0,0,RC[-2]/RC[-1])) -> 109763 | E13: =IF(RC1="","",IF(VLOOKUP(RC1,TrendFacDump,2,FALSE)=0,0,VLOOKUP(EOMONTH(ValDat,-1)+1,TrendFacDump,2,FALSE)/VLOOKUP(RC1,TrendFacDump,2,FALSE))) -> 1.1623852144600721 | F13: =IF(RC1="","",IF(OR(RC[-5]=ExpDat,RC[-1]=0),0,IF(SUM(OFFSET(RC[4],-MIN(ANC,ROUND(DAYS360(ExpDat,RC[-5],0)/30,0)),0,MIN(ANC,ROUND(DAYS360(ExpDat,RC[-5],0)/30,0)),1))=0,0,(VLOOKUP(R[-1]C1,ClmCosts,6,FALSE)/RC[-1])*SUMPRODUCT(OFFSET(RC[-1],-MIN(ANC,ROUND(DAYS360(ExpDat,RC[-5],0)/30,0)),0,MIN(ANC,ROUND(DAYS360(ExpDat,RC[-5],0)/30,0)),1),OFFSET(RC[4],-MIN(ANC,ROUND(DAYS360(ExpDat,RC[-5],0)/30,0)),0,MIN(ANC,ROUND(DAYS360(ExpDat,RC[-5],0)/30,0)),1))/SUM(OFFSET(RC[4],-MIN(ANC,ROUND(DAYS360(ExpDat,RC[-5],0)/30,0)),0,MIN(ANC,ROUND(DAYS360(ExpDat,RC[-5],0)/30,0)),1))))) -> 73.513951234188696 | G13: =IF(RC1="","",VLOOKUP(RC1,ExpDump,7,FALSE)) -> 2826.4589999999998 | H13: =IF(RC1="","",IF(RC1=ExpDat,RC[-4],RC[-2]*RC[-1])) -> 207784.16909143372 | I13: =RC[-6] -> 1 | J13: =IF(RC1="","",RC[-6]*RC[-1]+RC[-2]*(1-RC[-1])) -> 109763 | K13: =IF(RC1="","",IF(RC[-1]=0,0,RC[-9]/RC[-1])) -> 1 | L13: =IF(RC1="","",SUM(R9C[-2]:RC[-2])) -> 892229
A14: =IF(R[-1]C1="","",IF(DATE(YEAR(R[-1]C),MONTH(R[-1]C)+1,1)>ValDat,"",DATE(YEAR(R[-1]C),MONTH(R[-1]C)+1,1))) -> 1999-01-01T00:00:00.000 | B14: =IF(RC1="","",VLOOKUP(RC1,LinearIncLag,4,FALSE)) -> 109763 | C14: =IF(RC1="","",INDEX(CmpFac,MIN(MEP,MRO+ROUND(DAYS360(RC1,ValDat,0)/30,0)))) -> 1 | D14: =IF(RC1="","",IF(RC[-1]=0,0,RC[-2]/RC[-1])) -> 109763 | E14: =IF(RC1="","",IF(VLOOKUP(RC1,TrendFacDump,2,FALSE)=0,0,VLOOKUP(EOMONTH(ValDat,-1)+1,TrendFacDump,2,FALSE)/VLOOKUP(RC1,TrendFacDump,2,FALSE))) -> 1.1568718186024989 | F14: =IF(RC1="","",IF(OR(RC[-5]=ExpDat,RC[-1]=0),0,IF(SUM(OFFSET(RC[4],-MIN(ANC,ROUND(DAYS360(ExpDat,RC[-5],0)/30,0)),0,MIN(ANC,ROUND(DAYS360(ExpDat,RC[-5],0)/30,0)),1))=0,0,(VLOOKUP(R[-1]C1,ClmCosts,6,FALSE)/RC[-1])*SUMPRODUCT(OFFSET(RC[-1],-MIN(ANC,ROUND(DAYS360(ExpDat,RC[-5],0)/30,0)),0,MIN(ANC,ROUND(DAYS360(ExpDat,RC[-5],0)/30,0)),1),OFFSET(RC[4],-MIN(ANC,ROUND(DAYS360(ExpDat,RC[-5],0)/30,0)),0,MIN(ANC,ROUND(DAYS360(ExpDat,RC[-5],0)/30,0)),1))/SUM(OFFSET(RC[4],-MIN(ANC,ROUND(DAYS360(ExpDat,RC[-5],0)/30,0)),0,MIN(ANC,ROUND(DAYS360(ExpDat,RC[-5],0)/30,0)),1))))) -> 66.609361758768003 | G14: =IF(RC1="","",VLOOKUP(RC1,ExpDump,7,FALSE)) -> 2835.0619999999999 | H14: =IF(RC1="","",IF(RC1=ExpDat,RC[-4],RC[-2]*RC[-1])) -> 188841.67036653633 | I14: =RC[-6] -> 1 | J14: =IF(RC1="","",RC[-6]*RC[-1]+RC[-2]*(1-RC[-1])) -> 109763 | K14: =IF(RC1="","",IF(RC[-1]=0,0,RC[-9]/RC[-1])) -> 1 | L14: =IF(RC1="","",SUM(R9C[-2]:RC[-2])) -> 1001992
A15: =IF(R[-1]C1="","",IF(DATE(YEAR(R[-1]C),MONTH(R[-1]C)+1,1)>ValDat,"",DATE(YEAR(R[-1]C),MONTH(R[-1]C)+1,1))) -> 1999-02-01T00:00:00.000 | B15: =IF(RC1="","",VLOOKUP(RC1,LinearIncLag,4,FALSE)) -> 164681 | C15: =IF(RC1="","",INDEX(CmpFac,MIN(MEP,MRO+ROUND(DAYS360(RC1,ValDat,0)/30,0)))) -> 1 | D15: =IF(RC1="","",IF(RC[-1]=0,0,RC[-2]/RC[-1])) -> 164681 | E15: =IF(RC1="","",IF(VLOOKUP(RC1,TrendFacDump,2,FALSE)=0,0,VLOOKUP(EOMONTH(ValDat,-1)+1,TrendFacDump,2,FALSE)/VLOOKUP(RC1,TrendFacDump,2,FALSE))) -> 1.1512779184895232 | F15: =IF(RC1="","",IF(OR(RC[-5]=ExpDat,RC[-1]=0),0,IF(SUM(OFFSET(RC[4],-MIN(ANC,ROUND(DAYS360(ExpDat,RC[-5],0)/30,0)),0,MIN(ANC,ROUND(DAYS360(ExpDat,RC[-5],0)/30,0)),1))=0,0,(VLOOKUP(R[-1]C1,ClmCosts,6,FALSE)/RC[-1])*SUMPRODUCT(OFFSET(RC[-1],-MIN(ANC,ROUND(DAYS360(ExpDat,RC[-5],0)/30,0)),0,MIN(ANC,ROUND(DAYS360(ExpDat,RC[-5],0)/30,0)),1),OFFSET(RC[4],-MIN(ANC,ROUND(DAYS360(ExpDat,RC[-5],0)/30,0)),0,MIN(ANC,ROUND(DAYS360(ExpDat,RC[-5],0)/30,0)),1))/SUM(OFFSET(RC[4],-MIN(ANC,ROUND(DAYS360(ExpDat,RC[-5],0)/30,0)),0,MIN(ANC,ROUND(DAYS360(ExpDat,RC[-5],0)/30,0)),1))))) -> 62.090780938949834 | G15: =IF(RC1="","",VLOOKUP(RC1,ExpDump,7,FALSE)) -> 2816.6260000000002 | H15: =IF(RC1="","",IF(RC1=ExpDat,RC[-4],RC[-2]*RC[-1])) -> 174886.50795295052 | I15: =RC[-6] -> 1 | J15: =IF(RC1="","",RC[-6]*RC[-1]+RC[-2]*(1-RC[-1])) -> 164681 | K15: =IF(RC1="","",IF(RC[-1]=0,0,RC[-9]/RC[-1])) -> 1 | L15: =IF(RC1="","",SUM(R9C[-2]:RC[-2])) -> 1166673
A16: =IF(R[-1]C1="","",IF(DATE(YEAR(R[-1]C),MONTH(R[-1]C)+1,1)>ValDat,"",DATE(YEAR(R[-1]C),MONTH(R[-1]C)+1,1))) -> 1999-03-01T00:00:00.000 | B16: =IF(RC1="","",VLOOKUP(RC1,LinearIncLag,4,FALSE)) -> 164681 | C16: =IF(RC1="","",INDEX(CmpFac,MIN(MEP,MRO+ROUND(DAYS360(RC1,ValDat,0)/30,0)))) -> 1 | D16: =IF(RC1="","",IF(RC[-1]=0,0,RC[-2]/RC[-1])) -> 164681 | E16: =IF(RC1="","",IF(VLOOKUP(RC1,TrendFacDump,2,FALSE)=0,0,VLOOKUP(EOMONTH(ValDat,-1)+1,TrendFacDump,2,FALSE)/VLOOKUP(RC1,TrendFacDump,2,FALSE))) -> 1.1456065986940085 | F16: =IF(RC1="","",IF(OR(RC[-5]=ExpDat,RC[-1]=0),0,IF(SUM(OFFSET(RC[4],-MIN(ANC,ROUND(DAYS360(ExpDat,RC[-5],0)/30,0)),0,MIN(ANC,ROUND(DAYS360(ExpDat,RC[-5],0)/30,0)),1))=0,0,(VLOOKUP(R[-1]C1,ClmCosts,6,FALSE)/RC[-1])*SUMPRODUCT(OFFSET(RC[-1],-MIN(ANC,ROUND(DAYS360(ExpDat,RC[-5],0)/30,0)),0,MIN(ANC,ROUND(DAYS360(ExpDat,RC[-5],0)/30,0)),1),OFFSET(RC[4],-MIN(ANC,ROUND(DAYS360(ExpDat,RC[-5],0)/30,0)),0,MIN(ANC,ROUND(DAYS360(ExpDat,RC[-5],0)/30,0)),1))/SUM(OFFSET(RC[4],-MIN(ANC,ROUND(DAYS360(ExpDat,RC[-5],0)/30,0)),0,MIN(ANC,ROUND(DAYS360(ExpDat,RC[-5],0)/30,0)),1))))) -> 61.864743806419426 | G16: =IF(RC1="","",VLOOKUP(RC1,ExpDump,7,FALSE)) -> 2829.576 | H16: =IF(RC1="","",IF(RC1=ExpDat,RC[-4],RC[-2]*RC[-1])) -> 175050.99432079305 | I16: =RC[-6] -> 1 | J16: =IF(RC1="","",RC[-6]*RC[-1]+RC[-2]*(1-RC[-1])) -> 164681 | K16: =IF(RC1="","",IF(RC[-1]=0,0,RC[-9]/RC[-1])) -> 1 | L16: =IF(RC1="","",SUM(R9C[-2]:RC[-2])) -> 1331354
A17: =IF(R[-1]C1="","",IF(DATE(YEAR(R[-1]C),MONTH(R[-1]C)+1,1)>ValDat,"",DATE(YEAR(R[-1]C),MONTH(R[-1]C)+1,1))) -> 1999-04-01T00:00:00.000 | B17: =IF(RC1="","",VLOOKUP(RC1,LinearIncLag,4,FALSE)) -> 171773 | C17: =IF(RC1="","",INDEX(CmpFac,MIN(MEP,MRO+ROUND(DAYS360(RC1,ValDat,0)/30,0)))) -> 1 | D17: =IF(RC1="","",IF(RC[-1]=0,0,RC[-2]/RC[-1])) -> 171773 | E17: =IF(RC1="","",IF(VLOOKUP(RC1,TrendFacDump,2,FALSE)=0,0,VLOOKUP(EOMONTH(ValDat,-1)+1,TrendFacDump,2,FALSE)/VLOOKUP(RC1,TrendFacDump,2,FALSE))) -> 1.1401208528103979 | F17: =IF(RC1="","",IF(OR(RC[-5]=ExpDat,RC[-1]=0),0,IF(SUM(OFFSET(RC[4],-MIN(ANC,ROUND(DAYS360(ExpDat,RC[-5],0)/30,0)),0,MIN(ANC,ROUND(DAYS360(ExpDat,RC[-5],0)/30,0)),1))=0,0,(VLOOKUP(R[-1]C1,ClmCosts,6,FALSE)/RC[-1])*SUMPRODUCT(OFFSET(RC[-1],-MIN(ANC,ROUND(DAYS360(ExpDat,RC[-5],0)/30,0)),0,MIN(ANC,ROUND(DAYS360(ExpDat,RC[-5],0)/30,0)),1),OFFSET(RC[4],-MIN(ANC,ROUND(DAYS360(ExpDat,RC[-5],0)/30,0)),0,MIN(ANC,ROUND(DAYS360(ExpDat,RC[-5],0)/30,0)),1))/SUM(OFFSET(RC[4],-MIN(ANC,ROUND(DAYS360(ExpDat,RC[-5],0)/30,0)),0,MIN(ANC,ROUND(DAYS360(ExpDat,RC[-5],0)/30,0)),1))))) -> 61.689993176279295 | G17: =IF(RC1="","",VLOOKUP(RC1,ExpDump,7,FALSE)) -> 2910.3670000000002 | H17: =IF(RC1="","",IF(RC1=ExpDat,RC[-4],RC[-2]*RC[-1])) -> 179540.52037046844 | I17: =RC[-6] -> 1 | J17: =IF(RC1="","",RC[-6]*RC[-1]+RC[-2]*(1-RC[-1])) -> 171773 | K17: =IF(RC1="","",IF(RC[-1]=0,0,RC[-9]/RC[-1])) -> 1 | L17: =IF(RC1="","",SUM(R9C[-2]:RC[-2])) -> 1503127
A18: =IF(R[-1]C1="","",IF(DATE(YEAR(R[-1]C),MONTH(R[-1]C)+1,1)>ValDat,"",DATE(YEAR(R[-1]C),MONTH(R[-1]C)+1,1))) -> 1999-05-01T00:00:00.000 | B18: =IF(RC1="","",VLOOKUP(RC1,LinearIncLag,4,FALSE)) -> 171773 | C18: =IF(RC1="","",INDEX(CmpFac,MIN(MEP,MRO+ROUND(DAYS360(RC1,ValDat,0)/30,0)))) -> 1 | D18: =IF(RC1="","",IF(RC[-1]=0,0,RC[-2]/RC[-1])) -> 171773 | E18: =IF(RC1="","",IF(VLOOKUP(RC1,TrendFacDump,2,FALSE)=0,0,VLOOKUP(EOMONTH(ValDat,-1)+1,TrendFacDump,2,FALSE)/VLOOKUP(RC1,TrendFacDump,2,FALSE))) -> 1.1345586566825505 | F18: =IF(RC1="","",IF(OR(RC[-5]=ExpDat,RC[-1]=0),0,IF(SUM(OFFSET(RC[4],-MIN(ANC,ROUND(DAYS360(ExpDat,RC[-5],0)/30,0)),0,MIN(ANC,ROUND(DAYS360(ExpDat,RC[-5],0)/30,0)),1))=0,0,(VLOOKUP(R[-1]C1,ClmCosts,6,FALSE)/RC[-1])*SUMPRODUCT(OFFSET(RC[-1],-MIN(ANC,ROUND(DAYS360(ExpDat,RC[-5],0)/30,0)),0,MIN(ANC,ROUND(DAYS360(ExpDat,RC[-5],0)/30,0)),1),OFFSET(RC[4],-MIN(ANC,ROUND(DAYS360(ExpDat,RC[-5],0)/30,0)),0,MIN(ANC,ROUND(DAYS360(ExpDat,RC[-5],0)/30,0)),1))/SUM(OFFSET(RC[4],-MIN(ANC,ROUND(DAYS360(ExpDat,RC[-5],0)/30,0)),0,MIN(ANC,ROUND(DAYS360(ExpDat,RC[-5],0)/30,0)),1))))) -> 61.6797925559041 | G18: =IF(RC1="","",VLOOKUP(RC1,ExpDump,7,FALSE)) -> 2874.0259999999998 | H18: =IF(RC1="","",IF(RC1=ExpDat,RC[-4],RC[-2]*RC[-1])) -> 177269.32748027483 | I18: =RC[-6] -> 1 | J18: =IF(RC1="","",RC[-6]*RC[-1]+RC[-2]*(1-RC[-1])) -> 171773 | K18: =IF(RC1="","",IF(RC[-1]=0,0,RC[-9]/RC[-1])) -> 1 | L18: =IF(RC1="","",SUM(R9C[-2]:RC[-2])) -> 1674900
A19: =IF(R[-1]C1="","",IF(DATE(YEAR(R[-1]C),MONTH(R[-1]C)+1,1)>ValDat,"",DATE(YEAR(R[-1]C),MONTH(R[-1]C)+1,1))) -> 1999-06-01T00:00:00.000 | B19: =IF(RC1="","",VLOOKUP(RC1,LinearIncLag,4,FALSE)) -> 294045 | C19: =IF(RC1="","",INDEX(CmpFac,MIN(MEP,MRO+ROUND(DAYS360(RC1,ValDat,0)/30,0)))) -> 1 | D19: =IF(RC1="","",IF(RC[-1]=0,0,RC[-2]/RC[-1])) -> 294045 | E19: =IF(RC1="","",IF(VLOOKUP(RC1,TrendFacDump,2,FALSE)=0,0,VLOOKUP(EOMONTH(ValDat,-1)+1,TrendFacDump,2,FALSE)/VLOOKUP(RC1,TrendFacDump,2,FALSE))) -> 1.1290504685559444 | F19: =IF(RC1="","",IF(OR(RC[-5]=ExpDat,RC[-1]=0),0,IF(SUM(OFFSET(RC[4],-MIN(ANC,ROUND(DAYS360(ExpDat,RC[-5],0)/30,0)),0,MIN(ANC,ROUND(DAYS360(ExpDat,RC[-5],0)/30,0)),1))=0,0,(VLOOKUP(R[-1]C1,ClmCosts,6,FALSE)/RC[-1])*SUMPRODUCT(OFFSET(RC[-1],-MIN(ANC,ROUND(DAYS360(ExpDat,RC[-5],0)/30,0)),0,MIN(ANC,ROUND(DAYS360(ExpDat,RC[-5],0)/30,0)),1),OFFSET(RC[4],-MIN(ANC,ROUND(DAYS360(ExpDat,RC[-5],0)/30,0)),0,MIN(ANC,ROUND(DAYS360(ExpDat,RC[-5],0)/30,0)),1))/SUM(OFFSET(RC[4],-MIN(ANC,ROUND(DAYS360(ExpDat,RC[-5],0)/30,0)),0,MIN(ANC,ROUND(DAYS360(ExpDat,RC[-5],0)/30,0)),1))))) -> 61.782322145126813 | G19: =IF(RC1="","",VLOOKUP(RC1,ExpDump,7,FALSE)) -> 2840.922 | H19: =IF(RC1="","",IF(RC1=ExpDat,RC[-4],RC[-2]*RC[-1])) -> 175518.75819317796 | I19: =RC[-6] -> 1 | J19: =IF(RC1="","",RC[-6]*RC[-1]+RC[-2]*(1-RC[-1])) -> 294045 | K19: =IF(RC1="","",IF(RC[-1]=0,0,RC[-9]/RC[-1])) -> 1 | L19: =IF(RC1="","",SUM(R9C[-2]:RC[-2])) -> 1968945
A20: =IF(R[-1]C1="","",IF(DATE(YEAR(R[-1]C),MONTH(R[-1]C)+1,1)>ValDat,"",DATE(YEAR(R[-1]C),MONTH(R[-1]C)+1,1))) -> 1999-07-01T00:00:00.000 | B20: =IF(RC1="","",VLOOKUP(RC1,LinearIncLag,4,FALSE)) -> 294045 | C20: =IF(RC1="","",INDEX(CmpFac,MIN(MEP,MRO+ROUND(DAYS360(RC1,ValDat,0)/30,0)))) -> 1 | D20: =IF(RC1="","",IF(RC[-1]=0,0,RC[-2]/RC[-1])) -> 294045 | E20: =IF(RC1="","",IF(VLOOKUP(RC1,TrendFacDump,2,FALSE)=0,0,VLOOKUP(EOMONTH(ValDat,-1)+1,TrendFacDump,2,FALSE)/VLOOKUP(RC1,TrendFacDump,2,FALSE))) -> 1.1235955056179776 | F20: =IF(RC1="","",IF(OR(RC[-5]=ExpDat,RC[-1]=0),0,IF(SUM(OFFSET(RC[4],-MIN(ANC,ROUND(DAYS360(ExpDat,RC[-5],0)/30,0)),0,MIN(ANC,ROUND(DAYS360(ExpDat,RC[-5],0)/30,0)),1))=0,0,(VLOOKUP(R[-1]C1,ClmCosts,6,FALSE)/RC[-1])*SUMPRODUCT(OFFSET(RC[-1],-MIN(ANC,ROUND(DAYS360(ExpDat,RC[-5],0)/30,0)),0,MIN(ANC,ROUND(DAYS360(ExpDat,RC[-5],0)/30,0)),1),OFFSET(RC[4],-MIN(ANC,ROUND(DAYS360(ExpDat,RC[-5],0)/30,0)),0,MIN(ANC,ROUND(DAYS360(ExpDat,RC[-5],0)/30,0)),1))/SUM(OFFSET(RC[4],-MIN(ANC,ROUND(DAYS360(ExpDat,RC[-5],0)/30,0)),0,MIN(ANC,ROUND(DAYS360(ExpDat,RC[-5],0)/30,0)),1))))) -> 65.964089362155207 | G20: =IF(RC1="","",VLOOKUP(RC1,ExpDump,7,FALSE)) -> 2830.386 | H20: =IF(RC1="","",IF(RC1=ExpDat,RC[-4],RC[-2]*RC[-1])) -> 186703.83503339303 | I20: =RC[-6] -> 1 | J20: =IF(RC1="","",RC[-6]*RC[-1]+RC[-2]*(1-RC[-1])) -> 294045 | K20: =IF(RC1="","",IF(RC[-1]=0,0,RC[-9]/RC[-1])) -> 1 | L20: =IF(RC1="","",SUM(R9C[-2]:RC[-2])) -> 2262990
A21: =IF(R[-1]C1="","",IF(DATE(YEAR(R[-1]C),MONTH(R[-1]C)+1,1)>ValDat,"",DATE(YEAR(R[-1]C),MONTH(R[-1]C)+1,1))) -> 1999-08-01T00:00:00.000 | B21: =IF(RC1="","",VLOOKUP(RC1,LinearIncLag,4,FALSE)) -> 111076 | C21: =IF(RC1="","",INDEX(CmpFac,MIN(MEP,MRO+ROUND(DAYS360(RC1,ValDat,0)/30,0)))) -> 1 | D21: =IF(RC1="","",IF(RC[-1]=0,0,RC[-2]/RC[-1])) -> 111076 | E21: =IF(RC1="","",IF(VLOOKUP(RC1,TrendFacDump,2,FALSE)=0,0,VLOOKUP(EOMONTH(ValDat,-1)+1,TrendFacDump,2,FALSE)/VLOOKUP(RC1,TrendFacDump,2,FALSE))) -> 1.1181930001118192 | F21: =IF(RC1="","",IF(OR(RC[-5]=ExpDat,RC[-1]=0),0,IF(SUM(OFFSET(RC[4],-MIN(ANC,ROUND(DAYS360(ExpDat,RC[-5],0)/30,0)),0,MIN(ANC,ROUND(DAYS360(ExpDat,RC[-5],0)/30,0)),1))=0,0,(VLOOKUP(R[-1]C1,ClmCosts,6,FALSE)/RC[-1])*SUMPRODUCT(OFFSET(RC[-1],-MIN(ANC,ROUND(DAYS360(ExpDat,RC[-5],0)/30,0)),0,MIN(ANC,ROUND(DAYS360(ExpDat,RC[-5],0)/30,0)),1),OFFSET(RC[4],-MIN(ANC,ROUND(DAYS360(ExpDat,RC[-5],0)/30,0)),0,MIN(ANC,ROUND(DAYS360(ExpDat,RC[-5],0)/30,0)),1))/SUM(OFFSET(RC[4],-MIN(ANC,ROUND(DAYS360(ExpDat,RC[-5],0)/30,0)),0,MIN(ANC,ROUND(DAYS360(ExpDat,RC[-5],0)/30,0)),1))))) -> 69.501304591655156 | G21: =IF(RC1="","",VLOOKUP(RC1,ExpDump,7,FALSE)) -> 2957.8130000000001 | H21: =IF(RC1="","",IF(RC1=ExpDat,RC[-4],RC[-2]*RC[-1])) -> 205571.86223815731 | I21: =RC[-6] -> 1 | J21: =IF(RC1="","",RC[-6]*RC[-1]+RC[-2]*(1-RC[-1])) -> 111076 | K21: =IF(RC1="","",IF(RC[-1]=0,0,RC[-9]/RC[-1])) -> 1 | L21: =IF(RC1="","",SUM(R9C[-2]:RC[-2])) -> 2374066
A22: =IF(R[-1]C1="","",IF(DATE(YEAR(R[-1]C),MONTH(R[-1]C)+1,1)>ValDat,"",DATE(YEAR(R[-1]C),MONTH(R[-1]C)+1,1))) -> 1999-09-01T00:00:00.000 | B22: =IF(RC1="","",VLOOKUP(RC1,LinearIncLag,4,FALSE)) -> 111076 | C22: =IF(RC1="","",INDEX(CmpFac,MIN(MEP,MRO+ROUND(DAYS360(RC1,ValDat,0)/30,0)))) -> 1 | D22: =IF(RC1="","",IF(RC[-1]=0,0,RC[-2]/RC[-1])) -> 111076 | E22: =IF(RC1="","",IF(VLOOKUP(RC1,TrendFacDump,2,FALSE)=0,0,VLOOKUP(EOMONTH(ValDat,-1)+1,TrendFacDump,2,FALSE)/VLOOKUP(RC1,TrendFacDump,2,FALSE))) -> 1.1127183709803048 | F22: =IF(RC1="","",IF(OR(RC[-5]=ExpDat,RC[-1]=0),0,IF(SUM(OFFSET(RC[4],-MIN(ANC,ROUND(DAYS360(ExpDat,RC[-5],0)/30,0)),0,MIN(ANC,ROUND(DAYS360(ExpDat,RC[-5],0)/30,0)),1))=0,0,(VLOOKUP(R[-1]C1,ClmCosts,6,FALSE)/RC[-1])*SUMPRODUCT(OFFSET(RC[-1],-MIN(ANC,ROUND(DAYS360(ExpDat,RC[-5],0)/30,0)),0,MIN(ANC,ROUND(DAYS360(ExpDat,RC[-5],0)/30,0)),1),OFFSET(RC[4],-MIN(ANC,ROUND(DAYS360(ExpDat,RC[-5],0)/30,0)),0,MIN(ANC,ROUND(DAYS360(ExpDat,RC[-5],0)/30,0)),1))/SUM(OFFSET(RC[4],-MIN(ANC,ROUND(DAYS360(ExpDat,RC[-5],0)/30,0)),0,MIN(ANC,ROUND(DAYS360(ExpDat,RC[-5],0)/30,0)),1))))) -> 69.23191671411054 | G22: =IF(RC1="","",VLOOKUP(RC1,ExpDump,7,FALSE)) -> 2973.8850000000002 | H22: =IF(RC1="","",IF(RC1=ExpDat,RC[-4],RC[-2]*RC[-1])) -> 205887.75863734263 | I22: =RC[-6] -> 1 | J22: =IF(RC1="","",RC[-6]*RC[-1]+RC[-2]*(1-RC[-1])) -> 111076 | K22: =IF(RC1="","",IF(RC[-1]=0,0,RC[-9]/RC[-1])) -> 1 | L22: =IF(RC1="","",SUM(R9C[-2]:RC[-2])) -> 2485142
A23: =IF(R[-1]C1="","",IF(DATE(YEAR(R[-1]C),MONTH(R[-1]C)+1,1)>ValDat,"",DATE(YEAR(R[-1]C),MONTH(R[-1]C)+1,1))) -> 1999-10-01T00:00:00.000 | B23: =IF(RC1="","",VLOOKUP(RC1,LinearIncLag,4,FALSE)) -> 171436 | C23: =IF(RC1="","",INDEX(CmpFac,MIN(MEP,MRO+ROUND(DAYS360(RC1,ValDat,0)/30,0)))) -> 1 | D23: =IF(RC1="","",IF(RC[-1]=0,0,RC[-2]/RC[-1])) -> 171436 | E23: =IF(RC1="","",IF(VLOOKUP(RC1,TrendFacDump,2,FALSE)=0,0,VLOOKUP(EOMONTH(ValDat,-1)+1,TrendFacDump,2,FALSE)/VLOOKUP(RC1,TrendFacDump,2,FALSE))) -> 1.107297087808659 | F23: =IF(RC1="","",IF(OR(RC[-5]=ExpDat,RC[-1]=0),0,IF(SUM(OFFSET(RC[4],-MIN(ANC,ROUND(DAYS360(ExpDat,RC[-5],0)/30,0)),0,MIN(ANC,ROUND(DAYS360(ExpDat,RC[-5],0)/30,0)),1))=0,0,(VLOOKUP(R[-1]C1,ClmCosts,6,FALSE)/RC[-1])*SUMPRODUCT(OFFSET(RC[-1],-MIN(ANC,ROUND(DAYS360(ExpDat,RC[-5],0)/30,0)),0,MIN(ANC,ROUND(DAYS360(ExpDat,RC[-5],0)/30,0)),1),OFFSET(RC[4],-MIN(ANC,ROUND(DAYS360(ExpDat,RC[-5],0)/30,0)),0,MIN(ANC,ROUND(DAYS360(ExpDat,RC[-5],0)/30,0)),1))/SUM(OFFSET(RC[4],-MIN(ANC,ROUND(DAYS360(ExpDat,RC[-5],0)/30,0)),0,MIN(ANC,ROUND(DAYS360(ExpDat,RC[-5],0)/30,0)),1))))) -> 69.113437494942261 | G23: =IF(RC1="","",VLOOKUP(RC1,ExpDump,7,FALSE)) -> 2943.35 | H23: =IF(RC1="","",IF(RC1=ExpDat,RC[-4],RC[-2]*RC[-1])) -> 203425.03625073831 | I23: =RC[-6] -> 1 | J23: =IF(RC1="","",RC[-6]*RC[-1]+RC[-2]*(1-RC[-1])) -> 171436 | K23: =IF(RC1="","",IF(RC[-1]=0,0,RC[-9]/RC[-1])) -> 1 | L23: =IF(RC1="","",SUM(R9C[-2]:RC[-2])) -> 2656578
A24: =IF(R[-1]C1="","",IF(DATE(YEAR(R[-1]C),MONTH(R[-1]C)+1,1)>ValDat,"",DATE(YEAR(R[-1]C),MONTH(R[-1]C)+1,1))) -> 1999-11-01T00:00:00.000 | B24: =IF(RC1="","",VLOOKUP(RC1,LinearIncLag,4,FALSE)) -> 171436 | C24: =IF(RC1="","",INDEX(CmpFac,MIN(MEP,MRO+ROUND(DAYS360(RC1,ValDat,0)/30,0)))) -> 1 | D24: =IF(RC1="","",IF(RC[-1]=0,0,RC[-2]/RC[-1])) -> 171436 | E24: =IF(RC1="","",IF(VLOOKUP(RC1,TrendFacDump,2,FALSE)=0,0,VLOOKUP(EOMONTH(ValDat,-1)+1,TrendFacDump,2,FALSE)/VLOOKUP(RC1,TrendFacDump,2,FALSE))) -> 1.1019283746556474 | F24: =IF(RC1="","",IF(OR(RC[-5]=ExpDat,RC[-1]=0),0,IF(SUM(OFFSET(RC[4],-MIN(ANC,ROUND(DAYS360(ExpDat,RC[-5],0)/30,0)),0,MIN(ANC,ROUND(DAYS360(ExpDat,RC[-5],0)/30,0)),1))=0,0,(VLOOKUP(R[-1]C1,ClmCosts,6,FALSE)/RC[-1])*SUMPRODUCT(OFFSET(RC[-1],-MIN(ANC,ROUND(DAYS360(ExpDat,RC[-5],0)/30,0)),0,MIN(ANC,ROUND(DAYS360(ExpDat,RC[-5],0)/30,0)),1),OFFSET(RC[4],-MIN(ANC,ROUND(DAYS360(ExpDat,RC[-5],0)/30,0)),0,MIN(ANC,ROUND(DAYS360(ExpDat,RC[-5],0)/30,0)),1))/SUM(OFFSET(RC[4],-MIN(ANC,ROUND(DAYS360(ExpDat,RC[-5],0)/30,0)),0,MIN(ANC,ROUND(DAYS360(ExpDat,RC[-5],0)/30,0)),1))))) -> 64.983390444563 | G24: =IF(RC1="","",VLOOKUP(RC1,ExpDump,7,FALSE)) -> 3014.0830000000001 | H24: =IF(RC1="","",IF(RC1=ExpDat,RC[-4],RC[-2]*RC[-1])) -> 195865.33242131979 | I24: =RC[-6] -> 1 | J24: =IF(RC1="","",RC[-6]*RC[-1]+RC[-2]*(1-RC[-1])) -> 171436 | K24: =IF(RC1="","",IF(RC[-1]=0,0,RC[-9]/RC[-1])) -> 1 | L24: =IF(RC1="","",SUM(R9C[-2]:RC[-2])) -> 2828014
A25: =IF(R[-1]C1="","",IF(DATE(YEAR(R[-1]C),MONTH(R[-1]C)+1,1)>ValDat,"",DATE(YEAR(R[-1]C),MONTH(R[-1]C)+1,1))) -> 1999-12-01T00:00:00.000 | B25: =IF(RC1="","",VLOOKUP(RC1,LinearIncLag,4,FALSE)) -> 111538 | C25: =IF(RC1="","",INDEX(CmpFac,MIN(MEP,MRO+ROUND(DAYS360(RC1,ValDat,0)/30,0)))) -> 1 | D25: =IF(RC1="","",IF(RC[-1]=0,0,RC[-2]/RC[-1])) -> 111538 | E25: =IF(RC1="","",IF(VLOOKUP(RC1,TrendFacDump,2,FALSE)=0,0,VLOOKUP(EOMONTH(ValDat,-1)+1,TrendFacDump,2,FALSE)/VLOOKUP(RC1,TrendFacDump,2,FALSE))) -> 1.096611470555982 | F25: =IF(RC1="","",IF(OR(RC[-5]=ExpDat,RC[-1]=0),0,IF(SUM(OFFSET(RC[4],-MIN(ANC,ROUND(DAYS360(ExpDat,RC[-5],0)/30,0)),0,MIN(ANC,ROUND(DAYS360(ExpDat,RC[-5],0)/30,0)),1))=0,0,(VLOOKUP(R[-1]C1,ClmCosts,6,FALSE)/RC[-1])*SUMPRODUCT(OFFSET(RC[-1],-MIN(ANC,ROUND(DAYS360(ExpDat,RC[-5],0)/30,0)),0,MIN(ANC,ROUND(DAYS360(ExpDat,RC[-5],0)/30,0)),1),OFFSET(RC[4],-MIN(ANC,ROUND(DAYS360(ExpDat,RC[-5],0)/30,0)),0,MIN(ANC,ROUND(DAYS360(ExpDat,RC[-5],0)/30,0)),1))/SUM(OFFSET(RC[4],-MIN(ANC,ROUND(DAYS360(ExpDat,RC[-5],0)/30,0)),0,MIN(ANC,ROUND(DAYS360(ExpDat,RC[-5],0)/30,0)),1))))) -> 60.85388040409071 | G25: =IF(RC1="","",VLOOKUP(RC1,ExpDump,7,FALSE)) -> 3018.721 | H25: =IF(RC1="","",IF(RC1=ExpDat,RC[-4],RC[-2]*RC[-1])) -> 183700.88670731711 | I25: =RC[-6] -> 1 | J25: =IF(RC1="","",RC[-6]*RC[-1]+RC[-2]*(1-RC[-1])) -> 111538 | K25: =IF(RC1="","",IF(RC[-1]=0,0,RC[-9]/RC[-1])) -> 1 | L25: =IF(RC1="","",SUM(R9C[-2]:RC[-2])) -> 2939552
A26: =IF(R[-1]C1="","",IF(DATE(YEAR(R[-1]C),MONTH(R[-1]C)+1,1)>ValDat,"",DATE(YEAR(R[-1]C),MONTH(R[-1]C)+1,1))) -> 2000-01-01T00:00:00.000 | B26: =IF(RC1="","",VLOOKUP(RC1,LinearIncLag,4,FALSE)) -> 111538 | C26: =IF(RC1="","",INDEX(CmpFac,MIN(MEP,MRO+ROUND(DAYS360(RC1,ValDat,0)/30,0)))) -> 1 | D26: =IF(RC1="","",IF(RC[-1]=0,0,RC[-2]/RC[-1])) -> 111538 | E26: =IF(RC1="","",IF(VLOOKUP(RC1,TrendFacDump,2,FALSE)=0,0,VLOOKUP(EOMONTH(ValDat,-1)+1,TrendFacDump,2,FALSE)/VLOOKUP(RC1,TrendFacDump,2,FALSE))) -> 1.0913456291607553 | F26: =IF(RC1="","",IF(OR(RC[-5]=ExpDat,RC[-1]=0),0,IF(SUM(OFFSET(RC[4],-MIN(ANC,ROUND(DAYS360(ExpDat,RC[-5],0)/30,0)),0,MIN(ANC,ROUND(DAYS360(ExpDat,RC[-5],0)/30,0)),1))=0,0,(VLOOKUP(R[-1]C1,ClmCosts,6,FALSE)/RC[-1])*SUMPRODUCT(OFFSET(RC[-1],-MIN(ANC,ROUND(DAYS360(ExpDat,RC[-5],0)/30,0)),0,MIN(ANC,ROUND(DAYS360(ExpDat,RC[-5],0)/30,0)),1),OFFSET(RC[4],-MIN(ANC,ROUND(DAYS360(ExpDat,RC[-5],0)/30,0)),0,MIN(ANC,ROUND(DAYS360(ExpDat,RC[-5],0)/30,0)),1))/SUM(OFFSET(RC[4],-MIN(ANC,ROUND(DAYS360(ExpDat,RC[-5],0)/30,0)),0,MIN(ANC,ROUND(DAYS360(ExpDat,RC[-5],0)/30,0)),1))))) -> 60.671451536197452 | G26: =IF(RC1="","",VLOOKUP(RC1,ExpDump,7,FALSE)) -> 3003.3229999999999 | H26: =IF(RC1="","",IF(RC1=ExpDat,RC[-4],RC[-2]*RC[-1])) -> 182215.96584204712 | I26: =RC[-6] -> 1 | J26: =IF(RC1="","",RC[-6]*RC[-1]+RC[-2]*(1-RC[-1])) -> 111538 | K26: =IF(RC1="","",IF(RC[-1]=0,0,RC[-9]/RC[-1])) -> 1 | L26: =IF(RC1="","",SUM(R9C[-2]:RC[-2])) -> 3051090
A27: =IF(R[-1]C1="","",IF(DATE(YEAR(R[-1]C),MONTH(R[-1]C)+1,1)>ValDat,"",DATE(YEAR(R[-1]C),MONTH(R[-1]C)+1,1))) -> 2000-02-01T00:00:00.000 | B27: =IF(RC1="","",VLOOKUP(RC1,LinearIncLag,4,FALSE)) -> 211563 | C27: =IF(RC1="","",INDEX(CmpFac,MIN(MEP,MRO+ROUND(DAYS360(RC1,ValDat,0)/30,0)))) -> 1 | D27: =IF(RC1="","",IF(RC[-1]=0,0,RC[-2]/RC[-1])) -> 211563 | E27: =IF(RC1="","",IF(VLOOKUP(RC1,TrendFacDump,2,FALSE)=0,0,VLOOKUP(EOMONTH(ValDat,-1)+1,TrendFacDump,2,FALSE)/VLOOKUP(RC1,TrendFacDump,2,FALSE))) -> 1.0860121633362294 | F27: =IF(RC1="","",IF(OR(RC[-5]=ExpDat,RC[-1]=0),0,IF(SUM(OFFSET(RC[4],-MIN(ANC,ROUND(DAYS360(ExpDat,RC[-5],0)/30,0)),0,MIN(ANC,ROUND(DAYS360(ExpDat,RC[-5],0)/30,0)),1))=0,0,(VLOOKUP(R[-1]C1,ClmCosts,6,FALSE)/RC[-1])*SUMPRODUCT(OFFSET(RC[-1],-MIN(ANC,ROUND(DAYS360(ExpDat,RC[-5],0)/30,0)),0,MIN(ANC,ROUND(DAYS360(ExpDat,RC[-5],0)/30,0)),1),OFFSET(RC[4],-MIN(ANC,ROUND(DAYS360(ExpDat,RC[-5],0)/30,0)),0,MIN(ANC,ROUND(DAYS360(ExpDat,RC[-5],0)/30,0)),1))/SUM(OFFSET(RC[4],-MIN(ANC,ROUND(DAYS360(ExpDat,RC[-5],0)/30,0)),0,MIN(ANC,ROUND(DAYS360(ExpDat,RC[-5],0)/30,0)),1))))) -> 60.538208539908226 | G27: =IF(RC1="","",VLOOKUP(RC1,ExpDump,7,FALSE)) -> 3006.0590000000002 | H27: =IF(RC1="","",IF(RC1=ExpDat,RC[-4],RC[-2]*RC[-1])) -> 181981.42662526798 | I27: =RC[-6] -> 1 | J27: =IF(RC1="","",RC[-6]*RC[-1]+RC[-2]*(1-RC[-1])) -> 211563 | K27: =IF(RC1="","",IF(RC[-1]=0,0,RC[-9]/RC[-1])) -> 1 | L27: =IF(RC1="","",SUM(R9C[-2]:RC[-2])) -> 3262653
A28: =IF(R[-1]C1="","",IF(DATE(YEAR(R[-1]C),MONTH(R[-1]C)+1,1)>ValDat,"",DATE(YEAR(R[-1]C),MONTH(R[-1]C)+1,1))) -> 2000-03-01T00:00:00.000 | B28: =IF(RC1="","",VLOOKUP(RC1,LinearIncLag,4,FALSE)) -> 211563 | C28: =IF(RC1="","",INDEX(CmpFac,MIN(MEP,MRO+ROUND(DAYS360(RC1,ValDat,0)/30,0)))) -> 0.99965000000000004 | D28: =IF(RC1="","",IF(RC[-1]=0,0,RC[-2]/RC[-1])) -> 211637.07297554144 | E28: =IF(RC1="","",IF(VLOOKUP(RC1,TrendFacDump,2,FALSE)=0,0,VLOOKUP(EOMONTH(ValDat,-1)+1,TrendFacDump,2,FALSE)/VLOOKUP(RC1,TrendFacDump,2,FALSE))) -> 1.0808473843493298 | F28: =IF(RC1="","",IF(OR(RC[-5]=ExpDat,RC[-1]=0),0,IF(SUM(OFFSET(RC[4],-MIN(ANC,ROUND(DAYS360(ExpDat,RC[-5],0)/30,0)),0,MIN(ANC,ROUND(DAYS360(ExpDat,RC[-5],0)/30,0)),1))=0,0,(VLOOKUP(R[-1]C1,ClmCosts,6,FALSE)/RC[-1])*SUMPRODUCT(OFFSET(RC[-1],-MIN(ANC,ROUND(DAYS360(ExpDat,RC[-5],0)/30,0)),0,MIN(ANC,ROUND(DAYS360(ExpDat,RC[-5],0)/30,0)),1),OFFSET(RC[4],-MIN(ANC,ROUND(DAYS360(ExpDat,RC[-5],0)/30,0)),0,MIN(ANC,ROUND(DAYS360(ExpDat,RC[-5],0)/30,0)),1))/SUM(OFFSET(RC[4],-MIN(ANC,ROUND(DAYS360(ExpDat,RC[-5],0)/30,0)),0,MIN(ANC,ROUND(DAYS360(ExpDat,RC[-5],0)/30,0)),1))))) -> 61.555822327270612 | G28: =IF(RC1="","",VLOOKUP(RC1,ExpDump,7,FALSE)) -> 3001.39 | H28: =IF(RC1="","",IF(RC1=ExpDat,RC[-4],RC[-2]*RC[-1])) -> 184753.02957484673 | I28: =RC[-6] -> 0.99965000000000004 | J28: =IF(RC1="","",RC[-6]*RC[-1]+RC[-2]*(1-RC[-1])) -> 211627.66356035118 | K28: =IF(RC1="","",IF(RC[-1]=0,0,RC[-9]/RC[-1])) -> 0.9996944465611759 | L28: =IF(RC1="","",SUM(R9C[-2]:RC[-2])) -> 3474280.6635603514
A29: =IF(R[-1]C1="","",IF(DATE(YEAR(R[-1]C),MONTH(R[-1]C)+1,1)>ValDat,"",DATE(YEAR(R[-1]C),MONTH(R[-1]C)+1,1))) -> 2000-04-01T00:00:00.000 | B29: =IF(RC1="","",VLOOKUP(RC1,LinearIncLag,4,FALSE)) -> 183194 | C29: =IF(RC1="","",INDEX(CmpFac,MIN(MEP,MRO+ROUND(DAYS360(RC1,ValDat,0)/30,0)))) -> 0.99873999999999996 | D29: =IF(RC1="","",IF(RC[-1]=0,0,RC[-2]/RC[-1])) -> 183425.11564571361 | E29: =IF(RC1="","",IF(VLOOKUP(RC1,TrendFacDump,2,FALSE)=0,0,VLOOKUP(EOMONTH(ValDat,-1)+1,TrendFacDump,2,FALSE)/VLOOKUP(RC1,TrendFacDump,2,FALSE))) -> 1.0755001075500108 | F29: =IF(RC1="","",IF(OR(RC[-5]=ExpDat,RC[-1]=0),0,IF(SUM(OFFSET(RC[4],-MIN(ANC,ROUND(DAYS360(ExpDat,RC[-5],0)/30,0)),0,MIN(ANC,ROUND(DAYS360(ExpDat,RC[-5],0)/30,0)),1))=0,0,(VLOOKUP(R[-1]C1,ClmCosts,6,FALSE)/RC[-1])*SUMPRODUCT(OFFSET(RC[-1],-MIN(ANC,ROUND(DAYS360(ExpDat,RC[-5],0)/30,0)),0,MIN(ANC,ROUND(DAYS360(ExpDat,RC[-5],0)/30,0)),1),OFFSET(RC[4],-MIN(ANC,ROUND(DAYS360(ExpDat,RC[-5],0)/30,0)),0,MIN(ANC,ROUND(DAYS360(ExpDat,RC[-5],0)/30,0)),1))/SUM(OFFSET(RC[4],-MIN(ANC,ROUND(DAYS360(ExpDat,RC[-5],0)/30,0)),0,MIN(ANC,ROUND(DAYS360(ExpDat,RC[-5],0)/30,0)),1))))) -> 62.614829724387519 | G29: =IF(RC1="","",VLOOKUP(RC1,ExpDump,7,FALSE)) -> 3027.8040000000001 | H29: =IF(RC1="","",IF(RC1=ExpDat,RC[-4],RC[-2]*RC[-1])) -> 189585.43189881943 | I29: =RC[-6] -> 0.99873999999999996 | J29: =IF(RC1="","",RC[-6]*RC[-1]+RC[-2]*(1-RC[-1])) -> 183432.87764419251 | K29: =IF(RC1="","",IF(RC[-1]=0,0,RC[-9]/RC[-1])) -> 0.99869773811946694 | L29: =IF(RC1="","",SUM(R9C[-2]:RC[-2])) -> 3657713.5412045438
A30: =IF(R[-1]C1="","",IF(DATE(YEAR(R[-1]C),MONTH(R[-1]C)+1,1)>ValDat,"",DATE(YEAR(R[-1]C),MONTH(R[-1]C)+1,1))) -> 2000-05-01T00:00:00.000 | B30: =IF(RC1="","",VLOOKUP(RC1,LinearIncLag,4,FALSE)) -> 183194 | C30: =IF(RC1="","",INDEX(CmpFac,MIN(MEP,MRO+ROUND(DAYS360(RC1,ValDat,0)/30,0)))) -> 0.99492000000000003 | D30: =IF(RC1="","",IF(RC[-1]=0,0,RC[-2]/RC[-1])) -> 184129.37723636071 | E30: =IF(RC1="","",IF(VLOOKUP(RC1,TrendFacDump,2,FALSE)=0,0,VLOOKUP(EOMONTH(ValDat,-1)+1,TrendFacDump,2,FALSE)/VLOOKUP(RC1,TrendFacDump,2,FALSE))) -> 1.0703200256876806 | F30: =IF(RC1="","",IF(OR(RC[-5]=ExpDat,RC[-1]=0),0,IF(SUM(OFFSET(RC[4],-MIN(ANC,ROUND(DAYS360(ExpDat,RC[-5],0)/30,0)),0,MIN(ANC,ROUND(DAYS360(ExpDat,RC[-5],0)/30,0)),1))=0,0,(VLOOKUP(R[-1]C1,ClmCosts,6,FALSE)/RC[-1])*SUMPRODUCT(OFFSET(RC[-1],-MIN(ANC,ROUND(DAYS360(ExpDat,RC[-5],0)/30,0)),0,MIN(ANC,ROUND(DAYS360(ExpDat,RC[-5],0)/30,0)),1),OFFSET(RC[4],-MIN(ANC,ROUND(DAYS360(ExpDat,RC[-5],0)/30,0)),0,MIN(ANC,ROUND(DAYS360(ExpDat,RC[-5],0)/30,0)),1))/SUM(OFFSET(RC[4],-MIN(ANC,ROUND(DAYS360(ExpDat,RC[-5],0)/30,0)),0,MIN(ANC,ROUND(DAYS360(ExpDat,RC[-5],0)/30,0)),1))))) -> 62.747593740791643 | G30: =IF(RC1="","",VLOOKUP(RC1,ExpDump,7,FALSE)) -> 3053.259 | H30: =IF(RC1="","",IF(RC1=ExpDat,RC[-4],RC[-2]*RC[-1])) -> 191584.65531741575 | I30: =RC[-6] -> 0.99492000000000003 | J30: =IF(RC1="","",RC[-6]*RC[-1]+RC[-2]*(1-RC[-1])) -> 184167.25004901248 | K30: =IF(RC1="","",IF(RC[-1]=0,0,RC[-9]/RC[-1])) -> 0.99471540108920853 | L30: =IF(RC1="","",SUM(R9C[-2]:RC[-2])) -> 3841880.7912535565
A31: =IF(R[-1]C1="","",IF(DATE(YEAR(R[-1]C),MONTH(R[-1]C)+1,1)>ValDat,"",DATE(YEAR(R[-1]C),MONTH(R[-1]C)+1,1))) -> 2000-06-01T00:00:00.000 | B31: =IF(RC1="","",VLOOKUP(RC1,LinearIncLag,4,FALSE)) -> 329297 | C31: =IF(RC1="","",INDEX(CmpFac,MIN(MEP,MRO+ROUND(DAYS360(RC1,ValDat,0)/30,0)))) -> 0.99492000000000003 | D31: =IF(RC1="","",IF(RC[-1]=0,0,RC[-2]/RC[-1])) -> 330978.37012021069 | E31: =IF(RC1="","",IF(VLOOKUP(RC1,TrendFacDump,2,FALSE)=0,0,VLOOKUP(EOMONTH(ValDat,-1)+1,TrendFacDump,2,FALSE)/VLOOKUP(RC1,TrendFacDump,2,FALSE))) -> 1.0651896037494675 | F31: =IF(RC1="","",IF(OR(RC[-5]=ExpDat,RC[-1]=0),0,IF(SUM(OFFSET(RC[4],-MIN(ANC,ROUND(DAYS360(ExpDat,RC[-5],0)/30,0)),0,MIN(ANC,ROUND(DAYS360(ExpDat,RC[-5],0)/30,0)),1))=0,0,(VLOOKUP(R[-1]C1,ClmCosts,6,FALSE)/RC[-1])*SUMPRODUCT(OFFSET(RC[-1],-MIN(ANC,ROUND(DAYS360(ExpDat,RC[-5],0)/30,0)),0,MIN(ANC,ROUND(DAYS360(ExpDat,RC[-5],0)/30,0)),1),OFFSET(RC[4],-MIN(ANC,ROUND(DAYS360(ExpDat,RC[-5],0)/30,0)),0,MIN(ANC,ROUND(DAYS360(ExpDat,RC[-5],0)/30,0)),1))/SUM(OFFSET(RC[4],-MIN(ANC,ROUND(DAYS360(ExpDat,RC[-5],0)/30,0)),0,MIN(ANC,ROUND(DAYS360(ExpDat,RC[-5],0)/30,0)),1))))) -> 62.791738143572296 | G31: =IF(RC1="","",VLOOKUP(RC1,ExpDump,7,FALSE)) -> 3019.4940000000001 | H31: =IF(RC1="","",IF(RC1=ExpDat,RC[-4],RC[-2]*RC[-1])) -> 189599.27657408771 | I31: =RC[-6] -> 0.99492000000000003 | J31: =IF(RC1="","",RC[-6]*RC[-1]+RC[-2]*(1-RC[-1])) -> 330260.16432499635 | K31: =IF(RC1="","",IF(RC[-1]=0,0,RC[-9]/RC[-1])) -> 0.99708361943389412 | L31: =IF(RC1="","",SUM(R9C[-2]:RC[-2])) -> 4172140.955578553
A32: =IF(R[-1]C1="","",IF(DATE(YEAR(R[-1]C),MONTH(R[-1]C)+1,1)>ValDat,"",DATE(YEAR(R[-1]C),MONTH(R[-1]C)+1,1))) -> 2000-07-01T00:00:00.000 | B32: =IF(RC1="","",VLOOKUP(RC1,LinearIncLag,4,FALSE)) -> 329297 | C32: =IF(RC1="","",INDEX(CmpFac,MIN(MEP,MRO+ROUND(DAYS360(RC1,ValDat,0)/30,0)))) -> 0.99492000000000003 | D32: =IF(RC1="","",IF(RC[-1]=0,0,RC[-2]/RC[-1])) -> 330978.37012021069 | E32: =IF(RC1="","",IF(VLOOKUP(RC1,TrendFacDump,2,FALSE)=0,0,VLOOKUP(EOMONTH(ValDat,-1)+1,TrendFacDump,2,FALSE)/VLOOKUP(RC1,TrendFacDump,2,FALSE))) -> 1.0599957600169598 | F32: =IF(RC1="","",IF(OR(RC[-5]=ExpDat,RC[-1]=0),0,IF(SUM(OFFSET(RC[4],-MIN(ANC,ROUND(DAYS360(ExpDat,RC[-5],0)/30,0)),0,MIN(ANC,ROUND(DAYS360(ExpDat,RC[-5],0)/30,0)),1))=0,0,(VLOOKUP(R[-1]C1,ClmCosts,6,FALSE)/RC[-1])*SUMPRODUCT(OFFSET(RC[-1],-MIN(ANC,ROUND(DAYS360(ExpDat,RC[-5],0)/30,0)),0,MIN(ANC,ROUND(DAYS360(ExpDat,RC[-5],0)/30,0)),1),OFFSET(RC[4],-MIN(ANC,ROUND(DAYS360(ExpDat,RC[-5],0)/30,0)),0,MIN(ANC,ROUND(DAYS360(ExpDat,RC[-5],0)/30,0)),1))/SUM(OFFSET(RC[4],-MIN(ANC,ROUND(DAYS360(ExpDat,RC[-5],0)/30,0)),0,MIN(ANC,ROUND(DAYS360(ExpDat,RC[-5],0)/30,0)),1))))) -> 63.306098078231798 | G32: =IF(RC1="","",VLOOKUP(RC1,ExpDump,7,FALSE)) -> 3006.0659999999998 | H32: =IF(RC1="","",IF(RC1=ExpDat,RC[-4],RC[-2]*RC[-1])) -> 190302.30902563795 | I32: =RC[-6] -> 0.99492000000000003 | J32: =IF(RC1="","",RC[-6]*RC[-1]+RC[-2]*(1-RC[-1])) -> 330263.73572985025 | K32: =IF(RC1="","",IF(RC[-1]=0,0,RC[-9]/RC[-1])) -> 0.99707283717446649 | L32: =IF(RC1="","",SUM(R9C[-2]:RC[-2])) -> 4502404.6913084034
A33: =IF(R[-1]C1="","",IF(DATE(YEAR(R[-1]C),MONTH(R[-1]C)+1,1)>ValDat,"",DATE(YEAR(R[-1]C),MONTH(R[-1]C)+1,1))) -> 2000-08-01T00:00:00.000 | B33: =IF(RC1="","",VLOOKUP(RC1,LinearIncLag,4,FALSE)) -> 281510 | C33: =IF(RC1="","",INDEX(CmpFac,MIN(MEP,MRO+ROUND(DAYS360(RC1,ValDat,0)/30,0)))) -> 0.99492000000000003 | D33: =IF(RC1="","",IF(RC[-1]=0,0,RC[-2]/RC[-1])) -> 282947.37265307765 | E33: =IF(RC1="","",IF(VLOOKUP(RC1,TrendFacDump,2,FALSE)=0,0,VLOOKUP(EOMONTH(ValDat,-1)+1,TrendFacDump,2,FALSE)/VLOOKUP(RC1,TrendFacDump,2,FALSE))) -> 1.0548523206751055 | F33: =IF(RC1="","",IF(OR(RC[-5]=ExpDat,RC[-1]=0),0,IF(SUM(OFFSET(RC[4],-MIN(ANC,ROUND(DAYS360(ExpDat,RC[-5],0)/30,0)),0,MIN(ANC,ROUND(DAYS360(ExpDat,RC[-5],0)/30,0)),1))=0,0,(VLOOKUP(R[-1]C1,ClmCosts,6,FALSE)/RC[-1])*SUMPRODUCT(OFFSET(RC[-1],-MIN(ANC,ROUND(DAYS360(ExpDat,RC[-5],0)/30,0)),0,MIN(ANC,ROUND(DAYS360(ExpDat,RC[-5],0)/30,0)),1),OFFSET(RC[4],-MIN(ANC,ROUND(DAYS360(ExpDat,RC[-5],0)/30,0)),0,MIN(ANC,ROUND(DAYS360(ExpDat,RC[-5],0)/30,0)),1))/SUM(OFFSET(RC[4],-MIN(ANC,ROUND(DAYS360(ExpDat,RC[-5],0)/30,0)),0,MIN(ANC,ROUND(DAYS360(ExpDat,RC[-5],0)/30,0)),1))))) -> 63.822708444199804 | G33: =IF(RC1="","",VLOOKUP(RC1,ExpDump,7,FALSE)) -> 2987.3629999999998 | H33: =IF(RC1="","",IF(RC1=ExpDat,RC[-4],RC[-2]*RC[-1])) -> 190661.59776599004 | I33: =RC[-6] -> 0.99492000000000003 | J33: =IF(RC1="","",RC[-6]*RC[-1]+RC[-2]*(1-RC[-1])) -> 282478.56091665121 | K33: =IF(RC1="","",IF(RC[-1]=0,0,RC[-9]/RC[-1])) -> 0.99657120556863432 | L33: =IF(RC1="","",SUM(R9C[-2]:RC[-2])) -> 4784883.2522250544
A34: =IF(R[-1]C1="","",IF(DATE(YEAR(R[-1]C),MONTH(R[-1]C)+1,1)>ValDat,"",DATE(YEAR(R[-1]C),MONTH(R[-1]C)+1,1))) -> 2000-09-01T00:00:00.000 | B34: =IF(RC1="","",VLOOKUP(RC1,LinearIncLag,4,FALSE)) -> 281510 | C34: =IF(RC1="","",INDEX(CmpFac,MIN(MEP,MRO+ROUND(DAYS360(RC1,ValDat,0)/30,0)))) -> 0.99331999999999998 | D34: =IF(RC1="","",IF(RC[-1]=0,0,RC[-2]/RC[-1])) -> 283403.1329279588 | E34: =IF(RC1="","",IF(VLOOKUP(RC1,TrendFacDump,2,FALSE)=0,0,VLOOKUP(EOMONTH(ValDat,-1)+1,TrendFacDump,2,FALSE)/VLOOKUP(RC1,TrendFacDump,2,FALSE))) -> 1.0497585555322275 | F34: =IF(RC1="","",IF(OR(RC[-5]=ExpDat,RC[-1]=0),0,IF(SUM(OFFSET(RC[4],-MIN(ANC,ROUND(DAYS360(ExpDat,RC[-5],0)/30,0)),0,MIN(ANC,ROUND(DAYS360(ExpDat,RC[-5],0)/30,0)),1))=0,0,(VLOOKUP(R[-1]C1,ClmCosts,6,FALSE)/RC[-1])*SUMPRODUCT(OFFSET(RC[-1],-MIN(ANC,ROUND(DAYS360(ExpDat,RC[-5],0)/30,0)),0,MIN(ANC,ROUND(DAYS360(ExpDat,RC[-5],0)/30,0)),1),OFFSET(RC[4],-MIN(ANC,ROUND(DAYS360(ExpDat,RC[-5],0)/30,0)),0,MIN(ANC,ROUND(DAYS360(ExpDat,RC[-5],0)/30,0)),1))/SUM(OFFSET(RC[4],-MIN(ANC,ROUND(DAYS360(ExpDat,RC[-5],0)/30,0)),0,MIN(ANC,ROUND(DAYS360(ExpDat,RC[-5],0)/30,0)),1))))) -> 68.670960819872803 | G34: =IF(RC1="","",VLOOKUP(RC1,ExpDump,7,FALSE)) -> 2953.335 | H34: =IF(RC1="","",IF(RC1=ExpDat,RC[-4],RC[-2]*RC[-1])) -> 202808.35207295904 | I34: =RC[-6] -> 0.99331999999999998 | J34: =IF(RC1="","",RC[-6]*RC[-1]+RC[-2]*(1-RC[-1])) -> 282864.75979184738 | K34: =IF(RC1="","",IF(RC[-1]=0,0,RC[-9]/RC[-1])) -> 0.99521057415266467 | L34: =IF(RC1="","",SUM(R9C[-2]:RC[-2])) -> 5067748.0120169017
A35: =IF(R[-1]C1="","",IF(DATE(YEAR(R[-1]C),MONTH(R[-1]C)+1,1)>ValDat,"",DATE(YEAR(R[-1]C),MONTH(R[-1]C)+1,1))) -> 2000-10-01T00:00:00.000 | B35: =IF(RC1="","",VLOOKUP(RC1,LinearIncLag,4,FALSE)) -> 183309 | C35: =IF(RC1="","",INDEX(CmpFac,MIN(MEP,MRO+ROUND(DAYS360(RC1,ValDat,0)/30,0)))) -> 0.99184000000000005 | D35: =IF(RC1="","",IF(RC[-1]=0,0,RC[-2]/RC[-1])) -> 184817.10759799965 | E35: =IF(RC1="","",IF(VLOOKUP(RC1,TrendFacDump,2,FALSE)=0,0,VLOOKUP(EOMONTH(ValDat,-1)+1,TrendFacDump,2,FALSE)/VLOOKUP(RC1,TrendFacDump,2,FALSE))) -> 1.0447137484329294 | F35: =IF(RC1="","",IF(OR(RC[-5]=ExpDat,RC[-1]=0),0,IF(SUM(OFFSET(RC[4],-MIN(ANC,ROUND(DAYS360(ExpDat,RC[-5],0)/30,0)),0,MIN(ANC,ROUND(DAYS360(ExpDat,RC[-5],0)/30,0)),1))=0,0,(VLOOKUP(R[-1]C1,ClmCosts,6,FALSE)/RC[-1])*SUMPRODUCT(OFFSET(RC[-1],-MIN(ANC,ROUND(DAYS360(ExpDat,RC[-5],0)/30,0)),0,MIN(ANC,ROUND(DAYS360(ExpDat,RC[-5],0)/30,0)),1),OFFSET(RC[4],-MIN(ANC,ROUND(DAYS360(ExpDat,RC[-5],0)/30,0)),0,MIN(ANC,ROUND(DAYS360(ExpDat,RC[-5],0)/30,0)),1))/SUM(OFFSET(RC[4],-MIN(ANC,ROUND(DAYS360(ExpDat,RC[-5],0)/30,0)),0,MIN(ANC,ROUND(DAYS360(ExpDat,RC[-5],0)/30,0)),1))))) -> 73.646544705086754 | G35: =IF(RC1="","",VLOOKUP(RC1,ExpDump,7,FALSE)) -> 2927.2660000000001 | H35: =IF(RC1="","",IF(RC1=ExpDat,RC[-4],RC[-2]*RC[-1])) -> 215583.02633268049 | I35: =RC[-6] -> 0.99184000000000005 | J35: =IF(RC1="","",RC[-6]*RC[-1]+RC[-2]*(1-RC[-1])) -> 185068.15749487467 | K35: =IF(RC1="","",IF(RC[-1]=0,0,RC[-9]/RC[-1])) -> 0.99049454255833613 | L35: =IF(RC1="","",SUM(R9C[-2]:RC[-2])) -> 5252816.1695117764
A36: =IF(R[-1]C1="","",IF(DATE(YEAR(R[-1]C),MONTH(R[-1]C)+1,1)>ValDat,"",DATE(YEAR(R[-1]C),MONTH(R[-1]C)+1,1))) -> 2000-11-01T00:00:00.000 | B36: =IF(RC1="","",VLOOKUP(RC1,LinearIncLag,4,FALSE)) -> 183309 | C36: =IF(RC1="","",INDEX(CmpFac,MIN(MEP,MRO+ROUND(DAYS360(RC1,ValDat,0)/30,0)))) -> 0.99061999999999995 | D36: =IF(RC1="","",IF(RC[-1]=0,0,RC[-2]/RC[-1])) -> 185044.71946861563 | E36: =IF(RC1="","",IF(VLOOKUP(RC1,TrendFacDump,2,FALSE)=0,0,VLOOKUP(EOMONTH(ValDat,-1)+1,TrendFacDump,2,FALSE)/VLOOKUP(RC1,TrendFacDump,2,FALSE))) -> 1.0396091069757771 | F36: =IF(RC1="","",IF(OR(RC[-5]=ExpDat,RC[-1]=0),0,IF(SUM(OFFSET(RC[4],-MIN(ANC,ROUND(DAYS360(ExpDat,RC[-5],0)/30,0)),0,MIN(ANC,ROUND(DAYS360(ExpDat,RC[-5],0)/30,0)),1))=0,0,(VLOOKUP(R[-1]C1,ClmCosts,6,FALSE)/RC[-1])*SUMPRODUCT(OFFSET(RC[-1],-MIN(ANC,ROUND(DAYS360(ExpDat,RC[-5],0)/30,0)),0,MIN(ANC,ROUND(DAYS360(ExpDat,RC[-5],0)/30,0)),1),OFFSET(RC[4],-MIN(ANC,ROUND(DAYS360(ExpDat,RC[-5],0)/30,0)),0,MIN(ANC,ROUND(DAYS360(ExpDat,RC[-5],0)/30,0)),1))/SUM(OFFSET(RC[4],-MIN(ANC,ROUND(DAYS360(ExpDat,RC[-5],0)/30,0)),0,MIN(ANC,ROUND(DAYS360(ExpDat,RC[-5],0)/30,0)),1))))) -> 74.135018281932744 | G36: =IF(RC1="","",VLOOKUP(RC1,ExpDump,7,FALSE)) -> 2897.2249999999999 | H36: =IF(RC1="","",IF(RC1=ExpDat,RC[-4],RC[-2]*RC[-1])) -> 214785.82834187258 | I36: =RC[-6] -> 0.99061999999999995 | J36: =IF(RC1="","",RC[-6]*RC[-1]+RC[-2]*(1-RC[-1])) -> 185323.69106984677 | K36: =IF(RC1="","",IF(RC[-1]=0,0,RC[-9]/RC[-1])) -> 0.9891287991394071 | L36: =IF(RC1="","",SUM(R9C[-2]:RC[-2])) -> 5438139.8605816234
A37: =IF(R[-1]C1="","",IF(DATE(YEAR(R[-1]C),MONTH(R[-1]C)+1,1)>ValDat,"",DATE(YEAR(R[-1]C),MONTH(R[-1]C)+1,1))) -> 2000-12-01T00:00:00.000 | B37: =IF(RC1="","",VLOOKUP(RC1,LinearIncLag,4,FALSE)) -> 83695 | C37: =IF(RC1="","",INDEX(CmpFac,MIN(MEP,MRO+ROUND(DAYS360(RC1,ValDat,0)/30,0)))) -> 0.98426999999999998 | D37: =IF(RC1="","",IF(RC[-1]=0,0,RC[-2]/RC[-1])) -> 85032.562203460431 | E37: =IF(RC1="","",IF(VLOOKUP(RC1,TrendFacDump,2,FALSE)=0,0,VLOOKUP(EOMONTH(ValDat,-1)+1,TrendFacDump,2,FALSE)/VLOOKUP(RC1,TrendFacDump,2,FALSE))) -> 1.0345541071798054 | F37: =IF(RC1="","",IF(OR(RC[-5]=ExpDat,RC[-1]=0),0,IF(SUM(OFFSET(RC[4],-MIN(ANC,ROUND(DAYS360(ExpDat,RC[-5],0)/30,0)),0,MIN(ANC,ROUND(DAYS360(ExpDat,RC[-5],0)/30,0)),1))=0,0,(VLOOKUP(R[-1]C1,ClmCosts,6,FALSE)/RC[-1])*SUMPRODUCT(OFFSET(RC[-1],-MIN(ANC,ROUND(DAYS360(ExpDat,RC[-5],0)/30,0)),0,MIN(ANC,ROUND(DAYS360(ExpDat,RC[-5],0)/30,0)),1),OFFSET(RC[4],-MIN(ANC,ROUND(DAYS360(ExpDat,RC[-5],0)/30,0)),0,MIN(ANC,ROUND(DAYS360(ExpDat,RC[-5],0)/30,0)),1))/SUM(OFFSET(RC[4],-MIN(ANC,ROUND(DAYS360(ExpDat,RC[-5],0)/30,0)),0,MIN(ANC,ROUND(DAYS360(ExpDat,RC[-5],0)/30,0)),1))))) -> 74.840813163964512 | G37: =IF(RC1="","",VLOOKUP(RC1,ExpDump,7,FALSE)) -> 2887.18 | H37: =IF(RC1="","",IF(RC1=ExpDat,RC[-4],RC[-2]*RC[-1])) -> 216078.89895073505 | I37: =RC[-6] -> 0.98426999999999998 | J37: =IF(RC1="","",RC[-6]*RC[-1]+RC[-2]*(1-RC[-1])) -> 87093.921080495071 | K37: =IF(RC1="","",IF(RC[-1]=0,0,RC[-9]/RC[-1])) -> 0.96097407214731234 | L37: =IF(RC1="","",SUM(R9C[-2]:RC[-2])) -> 5525233.7816621186
A38: =IF(R[-1]C1="","",IF(DATE(YEAR(R[-1]C),MONTH(R[-1]C)+1,1)>ValDat,"",DATE(YEAR(R[-1]C),MONTH(R[-1]C)+1,1))) -> 2001-01-01T00:00:00.000 | B38: =IF(RC1="","",VLOOKUP(RC1,LinearIncLag,4,FALSE)) -> 83695 | C38: =IF(RC1="","",INDEX(CmpFac,MIN(MEP,MRO+ROUND(DAYS360(RC1,ValDat,0)/30,0)))) -> 0.95501999999999998 | D38: =IF(RC1="","",IF(RC[-1]=0,0,RC[-2]/RC[-1])) -> 87636.908127578485 | E38: =IF(RC1="","",IF(VLOOKUP(RC1,TrendFacDump,2,FALSE)=0,0,VLOOKUP(EOMONTH(ValDat,-1)+1,TrendFacDump,2,FALSE)/VLOOKUP(RC1,TrendFacDump,2,FALSE))) -> 1.0295480284155256 | F38: =IF(RC1="","",IF(OR(RC[-5]=ExpDat,RC[-1]=0),0,IF(SUM(OFFSET(RC[4],-MIN(ANC,ROUND(DAYS360(ExpDat,RC[-5],0)/30,0)),0,MIN(ANC,ROUND(DAYS360(ExpDat,RC[-5],0)/30,0)),1))=0,0,(VLOOKUP(R[-1]C1,ClmCosts,6,FALSE)/RC[-1])*SUMPRODUCT(OFFSET(RC[-1],-MIN(ANC,ROUND(DAYS360(ExpDat,RC[-5],0)/30,0)),0,MIN(ANC,ROUND(DAYS360(ExpDat,RC[-5],0)/30,0)),1),OFFSET(RC[4],-MIN(ANC,ROUND(DAYS360(ExpDat,RC[-5],0)/30,0)),0,MIN(ANC,ROUND(DAYS360(ExpDat,RC[-5],0)/30,0)),1))/SUM(OFFSET(RC[4],-MIN(ANC,ROUND(DAYS360(ExpDat,RC[-5],0)/30,0)),0,MIN(ANC,ROUND(DAYS360(ExpDat,RC[-5],0)/30,0)),1))))) -> 74.60662963457132 | G38: =IF(RC1="","",VLOOKUP(RC1,ExpDump,7,FALSE)) -> 2887.8029999999999 | H38: =IF(RC1="","",IF(RC1=ExpDat,RC[-4],RC[-2]*RC[-1])) -> 215449.24887860395 | I38: =RC[-6] -> 0.95501999999999998 | J38: =IF(RC1="","",RC[-6]*RC[-1]+RC[-2]*(1-RC[-1])) -> 93385.907214559615 | K38: =IF(RC1="","",IF(RC[-1]=0,0,RC[-9]/RC[-1])) -> 0.89622730555806263 | L38: =IF(RC1="","",SUM(R9C[-2]:RC[-2])) -> 5618619.6888766782
A39: =IF(R[-1]C1="","",IF(DATE(YEAR(R[-1]C),MONTH(R[-1]C)+1,1)>ValDat,"",DATE(YEAR(R[-1]C),MONTH(R[-1]C)+1,1))) -> 2001-02-01T00:00:00.000 | B39: =IF(RC1="","",VLOOKUP(RC1,LinearIncLag,4,FALSE)) -> 140421 | C39: =IF(RC1="","",INDEX(CmpFac,MIN(MEP,MRO+ROUND(DAYS360(RC1,ValDat,0)/30,0)))) -> 0.92320000000000002 | D39: =IF(RC1="","",IF(RC[-1]=0,0,RC[-2]/RC[-1])) -> 152102.46967071056 | E39: =IF(RC1="","",IF(VLOOKUP(RC1,TrendFacDump,2,FALSE)=0,0,VLOOKUP(EOMONTH(ValDat,-1)+1,TrendFacDump,2,FALSE)/VLOOKUP(RC1,TrendFacDump,2,FALSE))) -> 1.0245901639344261 | F39: =IF(RC1="","",IF(OR(RC[-5]=ExpDat,RC[-1]=0),0,IF(SUM(OFFSET(RC[4],-MIN(ANC,ROUND(DAYS360(ExpDat,RC[-5],0)/30,0)),0,MIN(ANC,ROUND(DAYS360(ExpDat,RC[-5],0)/30,0)),1))=0,0,(VLOOKUP(R[-1]C1,ClmCosts,6,FALSE)/RC[-1])*SUMPRODUCT(OFFSET(RC[-1],-MIN(ANC,ROUND(DAYS360(ExpDat,RC[-5],0)/30,0)),0,MIN(ANC,ROUND(DAYS360(ExpDat,RC[-5],0)/30,0)),1),OFFSET(RC[4],-MIN(ANC,ROUND(DAYS360(ExpDat,RC[-5],0)/30,0)),0,MIN(ANC,ROUND(DAYS360(ExpDat,RC[-5],0)/30,0)),1))/SUM(OFFSET(RC[4],-MIN(ANC,ROUND(DAYS360(ExpDat,RC[-5],0)/30,0)),0,MIN(ANC,ROUND(DAYS360(ExpDat,RC[-5],0)/30,0)),1))))) -> 74.510276359989405 | G39: =IF(RC1="","",VLOOKUP(RC1,ExpDump,7,FALSE)) -> 2887.0279999999998 | H39: =IF(RC1="","",IF(RC1=ExpDat,RC[-4],RC[-2]*RC[-1])) -> 215113.25413902747 | I39: =RC[-6] -> 0.92320000000000002 | J39: =IF(RC1="","",RC[-6]*RC[-1]+RC[-2]*(1-RC[-1])) -> 156941.69791787729 | K39: =IF(RC1="","",IF(RC[-1]=0,0,RC[-9]/RC[-1])) -> 0.89473353393613686 | L39: =IF(RC1="","",SUM(R9C[-2]:RC[-2])) -> 5775561.3867945559
A40: =IF(R[-1]C1="","",IF(DATE(YEAR(R[-1]C),MONTH(R[-1]C)+1,1)>ValDat,"",DATE(YEAR(R[-1]C),MONTH(R[-1]C)+1,1))) -> 2001-03-01T00:00:00.000 | B40: =IF(RC1="","",VLOOKUP(RC1,LinearIncLag,4,FALSE)) -> 140421 | C40: =IF(RC1="","",INDEX(CmpFac,MIN(MEP,MRO+ROUND(DAYS360(RC1,ValDat,0)/30,0)))) -> 0.8931 | D40: =IF(RC1="","",IF(RC[-1]=0,0,RC[-2]/RC[-1])) -> 157228.75377897211 | E40: =IF(RC1="","",IF(VLOOKUP(RC1,TrendFacDump,2,FALSE)=0,0,VLOOKUP(EOMONTH(ValDat,-1)+1,TrendFacDump,2,FALSE)/VLOOKUP(RC1,TrendFacDump,2,FALSE))) -> 1.0195758564437194 | F40: =IF(RC1="","",IF(OR(RC[-5]=ExpDat,RC[-1]=0),0,IF(SUM(OFFSET(RC[4],-MIN(ANC,ROUND(DAYS360(ExpDat,RC[-5],0)/30,0)),0,MIN(ANC,ROUND(DAYS360(ExpDat,RC[-5],0)/30,0)),1))=0,0,(VLOOKUP(R[-1]C1,ClmCosts,6,FALSE)/RC[-1])*SUMPRODUCT(OFFSET(RC[-1],-MIN(ANC,ROUND(DAYS360(ExpDat,RC[-5],0)/30,0)),0,MIN(ANC,ROUND(DAYS360(ExpDat,RC[-5],0)/30,0)),1),OFFSET(RC[4],-MIN(ANC,ROUND(DAYS360(ExpDat,RC[-5],0)/30,0)),0,MIN(ANC,ROUND(DAYS360(ExpDat,RC[-5],0)/30,0)),1))/SUM(OFFSET(RC[4],-MIN(ANC,ROUND(DAYS360(ExpDat,RC[-5],0)/30,0)),0,MIN(ANC,ROUND(DAYS360(ExpDat,RC[-5],0)/30,0)),1))))) -> 73.224207206854558 | G40: =IF(RC1="","",VLOOKUP(RC1,ExpDump,7,FALSE)) -> 2848.3409999999999 | H40: =IF(RC1="","",IF(RC1=ExpDat,RC[-4],RC[-2]*RC[-1])) -> 208567.5115797793 | I40: =RC[-6] -> 0.8931 | J40: =IF(RC1="","",RC[-6]*RC[-1]+RC[-2]*(1-RC[-1])) -> 162716.8669878784 | K40: =IF(RC1="","",IF(RC[-1]=0,0,RC[-9]/RC[-1])) -> 0.86297753023022916 | L40: =IF(RC1="","",SUM(R9C[-2]:RC[-2])) -> 5938278.2537824344
A41: =IF(R[-1]C1="","",IF(DATE(YEAR(R[-1]C),MONTH(R[-1]C)+1,1)>ValDat,"",DATE(YEAR(R[-1]C),MONTH(R[-1]C)+1,1))) -> 2001-04-01T00:00:00.000 | B41: =IF(RC1="","",VLOOKUP(RC1,LinearIncLag,4,FALSE)) -> 122179 | C41: =IF(RC1="","",INDEX(CmpFac,MIN(MEP,MRO+ROUND(DAYS360(RC1,ValDat,0)/30,0)))) -> 0.82328999999999997 | D41: =IF(RC1="","",IF(RC[-1]=0,0,RC[-2]/RC[-1])) -> 148403.35726171822 | E41: =IF(RC1="","",IF(VLOOKUP(RC1,TrendFacDump,2,FALSE)=0,0,VLOOKUP(EOMONTH(ValDat,-1)+1,TrendFacDump,2,FALSE)/VLOOKUP(RC1,TrendFacDump,2,FALSE))) -> 1.0147133434804667 | F41: =IF(RC1="","",IF(OR(RC[-5]=ExpDat,RC[-1]=0),0,IF(SUM(OFFSET(RC[4],-MIN(ANC,ROUND(DAYS360(ExpDat,RC[-5],0)/30,0)),0,MIN(ANC,ROUND(DAYS360(ExpDat,RC[-5],0)/30,0)),1))=0,0,(VLOOKUP(R[-1]C1,ClmCosts,6,FALSE)/RC[-1])*SUMPRODUCT(OFFSET(RC[-1],-MIN(ANC,ROUND(DAYS360(ExpDat,RC[-5],0)/30,0)),0,MIN(ANC,ROUND(DAYS360(ExpDat,RC[-5],0)/30,0)),1),OFFSET(RC[4],-MIN(ANC,ROUND(DAYS360(ExpDat,RC[-5],0)/30,0)),0,MIN(ANC,ROUND(DAYS360(ExpDat,RC[-5],0)/30,0)),1))/SUM(OFFSET(RC[4],-MIN(ANC,ROUND(DAYS360(ExpDat,RC[-5],0)/30,0)),0,MIN(ANC,ROUND(DAYS360(ExpDat,RC[-5],0)/30,0)),1))))) -> 72.143209559614647 | G41: =IF(RC1="","",VLOOKUP(RC1,ExpDump,7,FALSE)) -> 2809.8719999999998 | H41: =IF(RC1="","",IF(RC1=ExpDat,RC[-4],RC[-2]*RC[-1])) -> 202713.18453169352 | I41: =RC[-6] -> 0.82328999999999997 | J41: =IF(RC1="","",RC[-6]*RC[-1]+RC[-2]*(1-RC[-1])) -> 158000.44683859556 | K41: =IF(RC1="","",IF(RC[-1]=0,0,RC[-9]/RC[-1])) -> 0.77328262321189034 | L41: =IF(RC1="","",SUM(R9C[-2]:RC[-2])) -> 6096278.7006210303
A42: =IF(R[-1]C1="","",IF(DATE(YEAR(R[-1]C),MONTH(R[-1]C)+1,1)>ValDat,"",DATE(YEAR(R[-1]C),MONTH(R[-1]C)+1,1))) -> 2001-05-01T00:00:00.000 | B42: =IF(RC1="","",VLOOKUP(RC1,LinearIncLag,4,FALSE)) -> 122179 | C42: =IF(RC1="","",INDEX(CmpFac,MIN(MEP,MRO+ROUND(DAYS360(RC1,ValDat,0)/30,0)))) -> 0.53695999999999999 | D42: =IF(RC1="","",IF(RC[-1]=0,0,RC[-2]/RC[-1])) -> 227538.36412395709 | E42: =IF(RC1="","",IF(VLOOKUP(RC1,TrendFacDump,2,FALSE)=0,0,VLOOKUP(EOMONTH(ValDat,-1)+1,TrendFacDump,2,FALSE)/VLOOKUP(RC1,TrendFacDump,2,FALSE))) -> 1.0097950116126426 | F42: =IF(RC1="","",IF(OR(RC[-5]=ExpDat,RC[-1]=0),0,IF(SUM(OFFSET(RC[4],-MIN(ANC,ROUND(DAYS360(ExpDat,RC[-5],0)/30,0)),0,MIN(ANC,ROUND(DAYS360(ExpDat,RC[-5],0)/30,0)),1))=0,0,(VLOOKUP(R[-1]C1,ClmCosts,6,FALSE)/RC[-1])*SUMPRODUCT(OFFSET(RC[-1],-MIN(ANC,ROUND(DAYS360(ExpDat,RC[-5],0)/30,0)),0,MIN(ANC,ROUND(DAYS360(ExpDat,RC[-5],0)/30,0)),1),OFFSET(RC[4],-MIN(ANC,ROUND(DAYS360(ExpDat,RC[-5],0)/30,0)),0,MIN(ANC,ROUND(DAYS360(ExpDat,RC[-5],0)/30,0)),1))/SUM(OFFSET(RC[4],-MIN(ANC,ROUND(DAYS360(ExpDat,RC[-5],0)/30,0)),0,MIN(ANC,ROUND(DAYS360(ExpDat,RC[-5],0)/30,0)),1))))) -> 71.903094820911519 | G42: =IF(RC1="","",VLOOKUP(RC1,ExpDump,7,FALSE)) -> 2815.6109999999999 | H42: =IF(RC1="","",IF(RC1=ExpDat,RC[-4],RC[-2]*RC[-1])) -> 202451.14471180149 | I42: =RC[-6] -> 0.53695999999999999 | J42: =IF(RC1="","",RC[-6]*RC[-1]+RC[-2]*(1-RC[-1])) -> 215921.97804735258 | K42: =IF(RC1="","",IF(RC[-1]=0,0,RC[-9]/RC[-1])) -> 0.56584790999462609 | L42: =IF(RC1="","",SUM(R9C[-2]:RC[-2])) -> 6312200.6786683826
A43: =IF(R[-1]C1="","",IF(DATE(YEAR(R[-1]C),MONTH(R[-1]C)+1,1)>ValDat,"",DATE(YEAR(R[-1]C),MONTH(R[-1]C)+1,1))) -> 2001-06-01T00:00:00.000 | B43: =IF(RC1="","",VLOOKUP(RC1,LinearIncLag,4,FALSE)) -> 0 | C43: =IF(RC1="","",INDEX(CmpFac,MIN(MEP,MRO+ROUND(DAYS360(RC1,ValDat,0)/30,0)))) -> 0.30663000000000001 | D43: =IF(RC1="","",IF(RC[-1]=0,0,RC[-2]/RC[-1])) -> 0 | E43: =IF(RC1="","",IF(VLOOKUP(RC1,TrendFacDump,2,FALSE)=0,0,VLOOKUP(EOMONTH(ValDat,-1)+1,TrendFacDump,2,FALSE)/VLOOKUP(RC1,TrendFacDump,2,FALSE))) -> 1.004823151125402 | F43: =IF(RC1="","",IF(OR(RC[-5]=ExpDat,RC[-1]=0),0,IF(SUM(OFFSET(RC[4],-MIN(ANC,ROUND(DAYS360(ExpDat,RC[-5],0)/30,0)),0,MIN(ANC,ROUND(DAYS360(ExpDat,RC[-5],0)/30,0)),1))=0,0,(VLOOKUP(R[-1]C1,ClmCosts,6,FALSE)/RC[-1])*SUMPRODUCT(OFFSET(RC[-1],-MIN(ANC,ROUND(DAYS360(ExpDat,RC[-5],0)/30,0)),0,MIN(ANC,ROUND(DAYS360(ExpDat,RC[-5],0)/30,0)),1),OFFSET(RC[4],-MIN(ANC,ROUND(DAYS360(ExpDat,RC[-5],0)/30,0)),0,MIN(ANC,ROUND(DAYS360(ExpDat,RC[-5],0)/30,0)),1))/SUM(OFFSET(RC[4],-MIN(ANC,ROUND(DAYS360(ExpDat,RC[-5],0)/30,0)),0,MIN(ANC,ROUND(DAYS360(ExpDat,RC[-5],0)/30,0)),1))))) -> 73.346604224102165 | G43: =IF(RC1="","",VLOOKUP(RC1,ExpDump,7,FALSE)) -> 2810.5160000000001 | H43: =IF(RC1="","",IF(RC1=ExpDat,RC[-4],RC[-2]*RC[-1])) -> 206141.80471750672 | I43: =RC[-6] -> 0.30663000000000001 | J43: =IF(RC1="","",RC[-6]*RC[-1]+RC[-2]*(1-RC[-1])) -> 142932.54313697765 | K43: =IF(RC1="","",IF(RC[-1]=0,0,RC[-9]/RC[-1])) -> 0 | L43: =IF(RC1="","",SUM(R9C[-2]:RC[-2])) -> 6455133.2218053602
A44: =IF(R[-1]C1="","",IF(DATE(YEAR(R[-1]C),MONTH(R[-1]C)+1,1)>ValDat,"",DATE(YEAR(R[-1]C),MONTH(R[-1]C)+1,1))) -> 2001-07-01T00:00:00.000 | B44: =IF(RC1="","",VLOOKUP(RC1,LinearIncLag,4,FALSE)) -> 0 | C44: =IF(RC1="","",INDEX(CmpFac,MIN(MEP,MRO+ROUND(DAYS360(RC1,ValDat,0)/30,0)))) -> 5.2269999999999997E-2 | D44: =IF(RC1="","",IF(RC[-1]=0,0,RC[-2]/RC[-1])) -> 0 | E44: =IF(RC1="","",IF(VLOOKUP(RC1,TrendFacDump,2,FALSE)=0,0,VLOOKUP(EOMONTH(ValDat,-1)+1,TrendFacDump,2,FALSE)/VLOOKUP(RC1,TrendFacDump,2,FALSE))) -> 1 | F44: =IF(RC1="","",IF(OR(RC[-5]=ExpDat,RC[-1]=0),0,IF(SUM(OFFSET(RC[4],-MIN(ANC,ROUND(DAYS360(ExpDat,RC[-5],0)/30,0)),0,MIN(ANC,ROUND(DAYS360(ExpDat,RC[-5],0)/30,0)),1))=0,0,(VLOOKUP(R[-1]C1,ClmCosts,6,FALSE)/RC[-1])*SUMPRODUCT(OFFSET(RC[-1],-MIN(ANC,ROUND(DAYS360(ExpDat,RC[-5],0)/30,0)),0,MIN(ANC,ROUND(DAYS360(ExpDat,RC[-5],0)/30,0)),1),OFFSET(RC[4],-MIN(ANC,ROUND(DAYS360(ExpDat,RC[-5],0)/30,0)),0,MIN(ANC,ROUND(DAYS360(ExpDat,RC[-5],0)/30,0)),1))/SUM(OFFSET(RC[4],-MIN(ANC,ROUND(DAYS360(ExpDat,RC[-5],0)/30,0)),0,MIN(ANC,ROUND(DAYS360(ExpDat,RC[-5],0)/30,0)),1))))) -> 68.147966714098658 | G44: =IF(RC1="","",VLOOKUP(RC1,ExpDump,7,FALSE)) -> 2830.0740000000001 | H44: =IF(RC1="","",IF(RC1=ExpDat,RC[-4],RC[-2]*RC[-1])) -> 192863.78875043604 | I44: =RC[-6] -> 5.2269999999999997E-2 | J44: =IF(RC1="","",RC[-6]*RC[-1]+RC[-2]*(1-RC[-1])) -> 182782.79851245074 | K44: =IF(RC1="","",IF(RC[-1]=0,0,RC[-9]/RC[-1])) -> 0 | L44: =IF(RC1="","",SUM(R9C[-2]:RC[-2])) -> 6637916.0203178106
B45: =SUM(R[-36]C:R[-1]C) -> 6121426 | D45: =SUM(R[-36]C:R[-1]C) -> 6297956.0539120855 | G45: =SUM(R[-36]C:R[-1]C) -> 104079.17000000001 | H45: =SUM(R[-36]C:R[-1]C) -> 6732177.9268388357 | J45: =SUM(R[-36]C:R[-1]C) -> 6637916.0203178106 | K45: =IF(RC[-1]=0,0,RC[-9]/RC[-1]) -> 0.9221909378279417

Sheet: ClaimCost
A1: =title1&" - Claim Cost" -> BLOCK CLAIM LIABILITY REPORT - Claim Cost
A2: The Millennium-2000 Sample Life Insurance Company
A3: Arvind
A4: Experience Period: 01-Aug-1998 to 31-Jul-2001. Runout Date: 31-Jul-2001
D7: Average Claim Cost
A8: Incurred Month | B8: Exposure | C8: Incurred and Paid Claims | D8: Monthly | E8: Cumulative | F8: ="Last "&ANC&" Months" -> Last 12 Months
A9: =ExpDat -> 1998-08-01T00:00:00.000 | B9: =IF(RC1="","",VLOOKUP(RC1,ExpDump,7,FALSE)) -> 2576.1559999999999 | C9: =IF(RC1="","",VLOOKUP(RC1,LinearIncLag,2,FALSE)) -> 50333 | D9: =IF(RC1="","",IF(RC[-2]=0,0,VLOOKUP(RC1,CalcIncClms,10,FALSE)/RC[-2])) -> 38.514360155207996 | E9: =IF(RC1="","",IF(SUM(R9C[-3]:RC[-3])=0,0,VLOOKUP(RC1,CalcIncClms,12,FALSE)/SUM(R9C[-3]:RC[-3]))) -> 38.514360155207996 | F9: =IF(RC1="","",IF(SUM(OFFSET(R[1]C[-4],-MIN(ANC,1+ROUND(DAYS360(ExpDat,RC1,0)/30,0)),0,MIN(ANC,1+ROUND(DAYS360(ExpDat,RC1,0)/30,0)),1))=0,0,SUM(OFFSET(IncurredClaims!R[1]C[4],-MIN(ANC,1+ROUND(DAYS360(ExpDat,RC1,0)/30,0)),0,MIN(ANC,1+ROUND(DAYS360(ExpDat,RC1,0)/30,0)),1))/SUM(OFFSET(R[1]C[-4],-MIN(ANC,1+ROUND(DAYS360(ExpDat,RC1,0)/30,0)),0,MIN(ANC,1+ROUND(DAYS360(ExpDat,RC1,0)/30,0)),1)))) -> 38.514360155207996
A10: =IF(R[-1]C1="","",IF(DATE(YEAR(R[-1]C),MONTH(R[-1]C)+1,1)>ValDat,"",DATE(YEAR(R[-1]C),MONTH(R[-1]C)+1,1))) -> 1998-09-01T00:00:00.000 | B10: =IF(RC1="","",VLOOKUP(RC1,ExpDump,7,FALSE)) -> 2663.7669999999998 | C10: =IF(RC1="","",VLOOKUP(RC1,LinearIncLag,2,FALSE)) -> 50333 | D10: =IF(RC1="","",IF(RC[-2]=0,0,VLOOKUP(RC1,CalcIncClms,10,FALSE)/RC[-2])) -> 37.247627138559793 | E10: =IF(RC1="","",IF(SUM(R9C[-3]:RC[-3])=0,0,VLOOKUP(RC1,CalcIncClms,12,FALSE)/SUM(R9C[-3]:RC[-3]))) -> 37.870403820819504 | F10: =IF(RC1="","",IF(SUM(OFFSET(R[1]C[-4],-MIN(ANC,1+ROUND(DAYS360(ExpDat,RC1,0)/30,0)),0,MIN(ANC,1+ROUND(DAYS360(ExpDat,RC1,0)/30,0)),1))=0,0,SUM(OFFSET(IncurredClaims!R[1]C[4],-MIN(ANC,1+ROUND(DAYS360(ExpDat,RC1,0)/30,0)),0,MIN(ANC,1+ROUND(DAYS360(ExpDat,RC1,0)/30,0)),1))/SUM(OFFSET(R[1]C[-4],-MIN(ANC,1+ROUND(DAYS360(ExpDat,RC1,0)/30,0)),0,MIN(ANC,1+ROUND(DAYS360(ExpDat,RC1,0)/30,0)),1)))) -> 37.870403820819504
A11: =IF(R[-1]C1="","",IF(DATE(YEAR(R[-1]C),MONTH(R[-1]C)+1,1)>ValDat,"",DATE(YEAR(R[-1]C),MONTH(R[-1]C)+1,1))) -> 1998-10-01T00:00:00.000 | B11: =IF(RC1="","",VLOOKUP(RC1,ExpDump,7,FALSE)) -> 2728.2080000000001 | C11: =IF(RC1="","",VLOOKUP(RC1,LinearIncLag,2,FALSE)) -> 221584 | D11: =IF(RC1="","",IF(RC[-2]=0,0,VLOOKUP(RC1,CalcIncClms,10,FALSE)/RC[-2])) -> 107.03509409839718 | E11: =IF(RC1="","",IF(SUM(R9C[-3]:RC[-3])=0,0,VLOOKUP(RC1,CalcIncClms,12,FALSE)/SUM(R9C[-3]:RC[-3]))) -> 61.551698886476643 | F11: =IF(RC1="","",IF(SUM(OFFSET(R[1]C[-4],-MIN(ANC,1+ROUND(DAYS360(ExpDat,RC1,0)/30,0)),0,MIN(ANC,1+ROUND(DAYS360(ExpDat,RC1,0)/30,0)),1))=0,0,SUM(OFFSET(IncurredClaims!R[1]C[4],-MIN(ANC,1+ROUND(DAYS360(ExpDat,RC1,0)/30,0)),0,MIN(ANC,1+ROUND(DAYS360(ExpDat,RC1,0)/30,0)),1))/SUM(OFFSET(R[1]C[-4],-MIN(ANC,1+ROUND(DAYS360(ExpDat,RC1,0)/30,0)),0,MIN(ANC,1+ROUND(DAYS360(ExpDat,RC1,0)/30,0)),1)))) -> 61.551698886476643
A12: =IF(R[-1]C1="","",IF(DATE(YEAR(R[-1]C),MONTH(R[-1]C)+1,1)>ValDat,"",DATE(YEAR(R[-1]C),MONTH(R[-1]C)+1,1))) -> 1998-11-01T00:00:00.000 | B12: =IF(RC1="","",VLOOKUP(RC1,ExpDump,7,FALSE)) -> 2780.7539999999999 | C12: =IF(RC1="","",VLOOKUP(RC1,LinearIncLag,2,FALSE)) -> 221584 | D12: =IF(RC1="","",IF(RC[-2]=0,0,VLOOKUP(RC1,CalcIncClms,10,FALSE)/RC[-2])) -> 105.01252537980706 | E12: =IF(RC1="","",IF(SUM(R9C[-3]:RC[-3])=0,0,VLOOKUP(RC1,CalcIncClms,12,FALSE)/SUM(R9C[-3]:RC[-3]))) -> 72.795085257680228 | F12: =IF(RC1="","",IF(SUM(OFFSET(R[1]C[-4],-MIN(ANC,1+ROUND(DAYS360(ExpDat,RC1,0)/30,0)),0,MIN(ANC,1+ROUND(DAYS360(ExpDat,RC1,0)/30,0)),1))=0,0,SUM(OFFSET(IncurredClaims!R[1]C[4],-MIN(ANC,1+ROUND(DAYS360(ExpDat,RC1,0)/30,0)),0,MIN(ANC,1+ROUND(DAYS360(ExpDat,RC1,0)/30,0)),1))/SUM(OFFSET(R[1]C[-4],-MIN(ANC,1+ROUND(DAYS360(ExpDat,RC1,0)/30,0)),0,MIN(ANC,1+ROUND(DAYS360(ExpDat,RC1,0)/30,0)),1)))) -> 72.795085257680228
A13: =IF(R[-1]C1="","",IF(DATE(YEAR(R[-1]C),MONTH(R[-1]C)+1,1)>ValDat,"",DATE(YEAR(R[-1]C),MONTH(R[-1]C)+1,1))) -> 1998-12-01T00:00:00.000 | B13: =IF(RC1="","",VLOOKUP(RC1,ExpDump,7,FALSE)) -> 2826.4589999999998 | C13: =IF(RC1="","",VLOOKUP(RC1,LinearIncLag,2,FALSE)) -> 198556 | D13: =IF(RC1="","",IF(RC[-2]=0,0,VLOOKUP(RC1,CalcIncClms,10,FALSE)/RC[-2])) -> 38.834103024314167 | E13: =IF(RC1="","",IF(SUM(R9C[-3]:RC[-3])=0,0,VLOOKUP(RC1,CalcIncClms,12,FALSE)/SUM(R9C[-3]:RC[-3]))) -> 65.724227688079225 | F13: =IF(RC1="","",IF(SUM(OFFSET(R[1]C[-4],-MIN(ANC,1+ROUND(DAYS360(ExpDat,RC1,0)/30,0)),0,MIN(ANC,1+ROUND(DAYS360(ExpDat,RC1,0)/30,0)),1))=0,0,SUM(OFFSET(IncurredClaims!R[1]C[4],-MIN(ANC,1+ROUND(DAYS360(ExpDat,RC1,0)/30,0)),0,MIN(ANC,1+ROUND(DAYS360(ExpDat,RC1,0)/30,0)),1))/SUM(OFFSET(R[1]C[-4],-MIN(ANC,1+ROUND(DAYS360(ExpDat,RC1,0)/30,0)),0,MIN(ANC,1+ROUND(DAYS360(ExpDat,RC1,0)/30,0)),1)))) -> 65.724227688079225
A14: =IF(R[-1]C1="","",IF(DATE(YEAR(R[-1]C),MONTH(R[-1]C)+1,1)>ValDat,"",DATE(YEAR(R[-1]C),MONTH(R[-1]C)+1,1))) -> 1999-01-01T00:00:00.000 | B14: =IF(RC1="","",VLOOKUP(RC1,ExpDump,7,FALSE)) -> 2835.0619999999999 | C14: =IF(RC1="","",VLOOKUP(RC1,LinearIncLag,2,FALSE)) -> 198556 | D14: =IF(RC1="","",IF(RC[-2]=0,0,VLOOKUP(RC1,CalcIncClms,10,FALSE)/RC[-2])) -> 38.716260878950798 | E14: =IF(RC1="","",IF(SUM(R9C[-3]:RC[-3])=0,0,VLOOKUP(RC1,CalcIncClms,12,FALSE)/SUM(R9C[-3]:RC[-3]))) -> 61.058330915152268 | F14: =IF(RC1="","",IF(SUM(OFFSET(R[1]C[-4],-MIN(ANC,1+ROUND(DAYS360(ExpDat,RC1,0)/30,0)),0,MIN(ANC,1+ROUND(DAYS360(ExpDat,RC1,0)/30,0)),1))=0,0,SUM(OFFSET(IncurredClaims!R[1]C[4],-MIN(ANC,1+ROUND(DAYS360(ExpDat,RC1,0)/30,0)),0,MIN(ANC,1+ROUND(DAYS360(ExpDat,RC1,0)/30,0)),1))/SUM(OFFSET(R[1]C[-4],-MIN(ANC,1+ROUND(DAYS360(ExpDat,RC1,0)/30,0)),0,MIN(ANC,1+ROUND(DAYS360(ExpDat,RC1,0)/30,0)),1)))) -> 61.058330915152268
A15: =IF(R[-1]C1="","",IF(DATE(YEAR(R[-1]C),MONTH(R[-1]C)+1,1)>ValDat,"",DATE(YEAR(R[-1]C),MONTH(R[-1]C)+1,1))) -> 1999-02-01T00:00:00.000 | B15: =IF(RC1="","",VLOOKUP(RC1,ExpDump,7,FALSE)) -> 2816.6260000000002 | C15: =IF(RC1="","",VLOOKUP(RC1,LinearIncLag,2,FALSE)) -> 186494 | D15: =IF(RC1="","",IF(RC[-2]=0,0,VLOOKUP(RC1,CalcIncClms,10,FALSE)/RC[-2])) -> 58.467471364675319 | E15: =IF(RC1="","",IF(SUM(R9C[-3]:RC[-3])=0,0,VLOOKUP(RC1,CalcIncClms,12,FALSE)/SUM(R9C[-3]:RC[-3]))) -> 60.678788072958959 | F15: =IF(RC1="","",IF(SUM(OFFSET(R[1]C[-4],-MIN(ANC,1+ROUND(DAYS360(ExpDat,RC1,0)/30,0)),0,MIN(ANC,1+ROUND(DAYS360(ExpDat,RC1,0)/30,0)),1))=0,0,SUM(OFFSET(IncurredClaims!R[1]C[4],-MIN(ANC,1+ROUND(DAYS360(ExpDat,RC1,0)/30,0)),0,MIN(ANC,1+ROUND(DAYS360(ExpDat,RC1,0)/30,0)),1))/SUM(OFFSET(R[1]C[-4],-MIN(ANC,1+ROUND(DAYS360(ExpDat,RC1,0)/30,0)),0,MIN(ANC,1+ROUND(DAYS360(ExpDat,RC1,0)/30,0)),1)))) -> 60.678788072958959
A16: =IF(R[-1]C1="","",IF(DATE(YEAR(R[-1]C),MONTH(R[-1]C)+1,1)>ValDat,"",DATE(YEAR(R[-1]C),MONTH(R[-1]C)+1,1))) -> 1999-03-01T00:00:00.000 | B16: =IF(RC1="","",VLOOKUP(RC1,ExpDump,7,FALSE)) -> 2829.576 | C16: =IF(RC1="","",VLOOKUP(RC1,LinearIncLag,2,FALSE)) -> 186494 | D16: =IF(RC1="","",IF(RC[-2]=0,0,VLOOKUP(RC1,CalcIncClms,10,FALSE)/RC[-2])) -> 58.199885777939876 | E16: =IF(RC1="","",IF(SUM(R9C[-3]:RC[-3])=0,0,VLOOKUP(RC1,CalcIncClms,12,FALSE)/SUM(R9C[-3]:RC[-3]))) -> 60.360777142160764 | F16: =IF(RC1="","",IF(SUM(OFFSET(R[1]C[-4],-MIN(ANC,1+ROUND(DAYS360(ExpDat,RC1,0)/30,0)),0,MIN(ANC,1+ROUND(DAYS360(ExpDat,RC1,0)/30,0)),1))=0,0,SUM(OFFSET(IncurredClaims!R[1]C[4],-MIN(ANC,1+ROUND(DAYS360(ExpDat,RC1,0)/30,0)),0,MIN(ANC,1+ROUND(DAYS360(ExpDat,RC1,0)/30,0)),1))/SUM(OFFSET(R[1]C[-4],-MIN(ANC,1+ROUND(DAYS360(ExpDat,RC1,0)/30,0)),0,MIN(ANC,1+ROUND(DAYS360(ExpDat,RC1,0)/30,0)),1)))) -> 60.360777142160764
A17: =IF(R[-1]C1="","",IF(DATE(YEAR(R[-1]C),MONTH(R[-1]C)+1,1)>ValDat,"",DATE(YEAR(R[-1]C),MONTH(R[-1]C)+1,1))) -> 1999-04-01T00:00:00.000 | B17: =IF(RC1="","",VLOOKUP(RC1,ExpDump,7,FALSE)) -> 2910.3670000000002 | C17: =IF(RC1="","",VLOOKUP(RC1,LinearIncLag,2,FALSE)) -> 255986 | D17: =IF(RC1="","",IF(RC[-2]=0,0,VLOOKUP(RC1,CalcIncClms,10,FALSE)/RC[-2])) -> 59.021078784909257 | E17: =IF(RC1="","",IF(SUM(R9C[-3]:RC[-3])=0,0,VLOOKUP(RC1,CalcIncClms,12,FALSE)/SUM(R9C[-3]:RC[-3]))) -> 60.204610290193351 | F17: =IF(RC1="","",IF(SUM(OFFSET(R[1]C[-4],-MIN(ANC,1+ROUND(DAYS360(ExpDat,RC1,0)/30,0)),0,MIN(ANC,1+ROUND(DAYS360(ExpDat,RC1,0)/30,0)),1))=0,0,SUM(OFFSET(IncurredClaims!R[1]C[4],-MIN(ANC,1+ROUND(DAYS360(ExpDat,RC1,0)/30,0)),0,MIN(ANC,1+ROUND(DAYS360(ExpDat,RC1,0)/30,0)),1))/SUM(OFFSET(R[1]C[-4],-MIN(ANC,1+ROUND(DAYS360(ExpDat,RC1,0)/30,0)),0,MIN(ANC,1+ROUND(DAYS360(ExpDat,RC1,0)/30,0)),1)))) -> 60.204610290193351
A18: =IF(R[-1]C1="","",IF(DATE(YEAR(R[-1]C),MONTH(R[-1]C)+1,1)>ValDat,"",DATE(YEAR(R[-1]C),MONTH(R[-1]C)+1,1))) -> 1999-05-01T00:00:00.000 | B18: =IF(RC1="","",VLOOKUP(RC1,ExpDump,7,FALSE)) -> 2874.0259999999998 | C18: =IF(RC1="","",VLOOKUP(RC1,LinearIncLag,2,FALSE)) -> 255986 | D18: =IF(RC1="","",IF(RC[-2]=0,0,VLOOKUP(RC1,CalcIncClms,10,FALSE)/RC[-2])) -> 59.767378583213933 | E18: =IF(RC1="","",IF(SUM(R9C[-3]:RC[-3])=0,0,VLOOKUP(RC1,CalcIncClms,12,FALSE)/SUM(R9C[-3]:RC[-3]))) -> 60.159474869456034 | F18: =IF(RC1="","",IF(SUM(OFFSET(R[1]C[-4],-MIN(ANC,1+ROUND(DAYS360(ExpDat,RC1,0)/30,0)),0,MIN(ANC,1+ROUND(DAYS360(ExpDat,RC1,0)/30,0)),1))=0,0,SUM(OFFSET(IncurredClaims!R[1]C[4],-MIN(ANC,1+ROUND(DAYS360(ExpDat,RC1,0)/30,0)),0,MIN(ANC,1+ROUND(DAYS360(ExpDat,RC1,0)/30,0)),1))/SUM(OFFSET(R[1]C[-4],-MIN(ANC,1+ROUND(DAYS360(ExpDat,RC1,0)/30,0)),0,MIN(ANC,1+ROUND(DAYS360(ExpDat,RC1,0)/30,0)),1)))) -> 60.159474869456034
A19: =IF(R[-1]C1="","",IF(DATE(YEAR(R[-1]C),MONTH(R[-1]C)+1,1)>ValDat,"",DATE(YEAR(R[-1]C),MONTH(R[-1]C)+1,1))) -> 1999-06-01T00:00:00.000 | B19: =IF(RC1="","",VLOOKUP(RC1,ExpDump,7,FALSE)) -> 2840.922 | C19: =IF(RC1="","",VLOOKUP(RC1,LinearIncLag,2,FALSE)) -> 218545 | D19: =IF(RC1="","",IF(RC[-2]=0,0,VLOOKUP(RC1,CalcIncClms,10,FALSE)/RC[-2])) -> 103.50336968068817 | E19: =IF(RC1="","",IF(SUM(R9C[-3]:RC[-3])=0,0,VLOOKUP(RC1,CalcIncClms,12,FALSE)/SUM(R9C[-3]:RC[-3]))) -> 64.172802988913062 | F19: =IF(RC1="","",IF(SUM(OFFSET(R[1]C[-4],-MIN(ANC,1+ROUND(DAYS360(ExpDat,RC1,0)/30,0)),0,MIN(ANC,1+ROUND(DAYS360(ExpDat,RC1,0)/30,0)),1))=0,0,SUM(OFFSET(IncurredClaims!R[1]C[4],-MIN(ANC,1+ROUND(DAYS360(ExpDat,RC1,0)/30,0)),0,MIN(ANC,1+ROUND(DAYS360(ExpDat,RC1,0)/30,0)),1))/SUM(OFFSET(R[1]C[-4],-MIN(ANC,1+ROUND(DAYS360(ExpDat,RC1,0)/30,0)),0,MIN(ANC,1+ROUND(DAYS360(ExpDat,RC1,0)/30,0)),1)))) -> 64.172802988913062
A20: =IF(R[-1]C1="","",IF(DATE(YEAR(R[-1]C),MONTH(R[-1]C)+1,1)>ValDat,"",DATE(YEAR(R[-1]C),MONTH(R[-1]C)+1,1))) -> 1999-07-01T00:00:00.000 | B20: =IF(RC1="","",VLOOKUP(RC1,ExpDump,7,FALSE)) -> 2830.386 | C20: =IF(RC1="","",VLOOKUP(RC1,LinearIncLag,2,FALSE)) -> 218545 | D20: =IF(RC1="","",IF(RC[-2]=0,0,VLOOKUP(RC1,CalcIncClms,10,FALSE)/RC[-2])) -> 103.88865688284213 | E20: =IF(RC1="","",IF(SUM(R9C[-3]:RC[-3])=0,0,VLOOKUP(RC1,CalcIncClms,12,FALSE)/SUM(R9C[-3]:RC[-3]))) -> 67.527128614145937 | F20: =IF(RC1="","",IF(SUM(OFFSET(R[1]C[-4],-MIN(ANC,1+ROUND(DAYS360(ExpDat,RC1,0)/30,0)),0,MIN(ANC,1+ROUND(DAYS360(ExpDat,RC1,0)/30,0)),1))=0,0,SUM(OFFSET(IncurredClaims!R[1]C[4],-MIN(ANC,1+ROUND(DAYS360(ExpDat,RC1,0)/30,0)),0,MIN(ANC,1+ROUND(DAYS360(ExpDat,RC1,0)/30,0)),1))/SUM(OFFSET(R[1]C[-4],-MIN(ANC,1+ROUND(DAYS360(ExpDat,RC1,0)/30,0)),0,MIN(ANC,1+ROUND(DAYS360(ExpDat,RC1,0)/30,0)),1)))) -> 67.527128614145937
A21: =IF(R[-1]C1="","",IF(DATE(YEAR(R[-1]C),MONTH(R[-1]C)+1,1)>ValDat,"",DATE(YEAR(R[-1]C),MONTH(R[-1]C)+1,1))) -> 1999-08-01T00:00:00.000 | B21: =IF(RC1="","",VLOOKUP(RC1,ExpDump,7,FALSE)) -> 2957.8130000000001 | C21: =IF(RC1="","",VLOOKUP(RC1,LinearIncLag,2,FALSE)) -> 206958 | D21: =IF(RC1="","",IF(RC[-2]=0,0,VLOOKUP(RC1,CalcIncClms,10,FALSE)/RC[-2])) -> 37.553422072321673 | E21: =IF(RC1="","",IF(SUM(R9C[-3]:RC[-3])=0,0,VLOOKUP(RC1,CalcIncClms,12,FALSE)/SUM(R9C[-3]:RC[-3]))) -> 65.096190245812735 | F21: =IF(RC1="","",IF(SUM(OFFSET(R[1]C[-4],-MIN(ANC,1+ROUND(DAYS360(ExpDat,RC1,0)/30,0)),0,MIN(ANC,1+ROUND(DAYS360(ExpDat,RC1,0)/30,0)),1))=0,0,SUM(OFFSET(IncurredClaims!R[1]C[4],-MIN(ANC,1+ROUND(DAYS360(ExpDat,RC1,0)/30,0)),0,MIN(ANC,1+ROUND(DAYS360(ExpDat,RC1,0)/30,0)),1))/SUM(OFFSET(R[1]C[-4],-MIN(ANC,1+ROUND(DAYS360(ExpDat,RC1,0)/30,0)),0,MIN(ANC,1+ROUND(DAYS360(ExpDat,RC1,0)/30,0)),1)))) -> 67.116577623285508
A22: =IF(R[-1]C1="","",IF(DATE(YEAR(R[-1]C),MONTH(R[-1]C)+1,1)>ValDat,"",DATE(YEAR(R[-1]C),MONTH(R[-1]C)+1,1))) -> 1999-09-01T00:00:00.000 | B22: =IF(RC1="","",VLOOKUP(RC1,ExpDump,7,FALSE)) -> 2973.8850000000002 | C22: =IF(RC1="","",VLOOKUP(RC1,LinearIncLag,2,FALSE)) -> 206958 | D22: =IF(RC1="","",IF(RC[-2]=0,0,VLOOKUP(RC1,CalcIncClms,10,FALSE)/RC[-2])) -> 37.350469167435861 | E22: =IF(RC1="","",IF(SUM(R9C[-3]:RC[-3])=0,0,VLOOKUP(RC1,CalcIncClms,12,FALSE)/SUM(R9C[-3]:RC[-3]))) -> 63.004298726546729 | F22: =IF(RC1="","",IF(SUM(OFFSET(R[1]C[-4],-MIN(ANC,1+ROUND(DAYS360(ExpDat,RC1,0)/30,0)),0,MIN(ANC,1+ROUND(DAYS360(ExpDat,RC1,0)/30,0)),1))=0,0,SUM(OFFSET(IncurredClaims!R[1]C[4],-MIN(ANC,1+ROUND(DAYS360(ExpDat,RC1,0)/30,0)),0,MIN(ANC,1+ROUND(DAYS360(ExpDat,RC1,0)/30,0)),1))/SUM(OFFSET(R[1]C[-4],-MIN(ANC,1+ROUND(DAYS360(ExpDat,RC1,0)/30,0)),0,MIN(ANC,1+ROUND(DAYS360(ExpDat,RC1,0)/30,0)),1)))) -> 66.854706590008377
A23: =IF(R[-1]C1="","",IF(DATE(YEAR(R[-1]C),MONTH(R[-1]C)+1,1)>ValDat,"",DATE(YEAR(R[-1]C),MONTH(R[-1]C)+1,1))) -> 1999-10-01T00:00:00.000 | B23: =IF(RC1="","",VLOOKUP(RC1,ExpDump,7,FALSE)) -> 2943.35 | C23: =IF(RC1="","",VLOOKUP(RC1,LinearIncLag,2,FALSE)) -> 95546 | D23: =IF(RC1="","",IF(RC[-2]=0,0,VLOOKUP(RC1,CalcIncClms,10,FALSE)/RC[-2])) -> 58.245196799565122 | E23: =IF(RC1="","",IF(SUM(R9C[-3]:RC[-3])=0,0,VLOOKUP(RC1,CalcIncClms,12,FALSE)/SUM(R9C[-3]:RC[-3]))) -> 62.673829840346031 | F23: =IF(RC1="","",IF(SUM(OFFSET(R[1]C[-4],-MIN(ANC,1+ROUND(DAYS360(ExpDat,RC1,0)/30,0)),0,MIN(ANC,1+ROUND(DAYS360(ExpDat,RC1,0)/30,0)),1))=0,0,SUM(OFFSET(IncurredClaims!R[1]C[4],-MIN(ANC,1+ROUND(DAYS360(ExpDat,RC1,0)/30,0)),0,MIN(ANC,1+ROUND(DAYS360(ExpDat,RC1,0)/30,0)),1))/SUM(OFFSET(R[1]C[-4],-MIN(ANC,1+ROUND(DAYS360(ExpDat,RC1,0)/30,0)),0,MIN(ANC,1+ROUND(DAYS360(ExpDat,RC1,0)/30,0)),1)))) -> 62.933605770216921
A24: =IF(R[-1]C1="","",IF(DATE(YEAR(R[-1]C),MONTH(R[-1]C)+1,1)>ValDat,"",DATE(YEAR(R[-1]C),MONTH(R[-1]C)+1,1))) -> 1999-11-01T00:00:00.000 | B24: =IF(RC1="","",VLOOKUP(RC1,ExpDump,7,FALSE)) -> 3014.0830000000001 | C24: =IF(RC1="","",VLOOKUP(RC1,LinearIncLag,2,FALSE)) -> 95546 | D24: =IF(RC1="","",IF(RC[-2]=0,0,VLOOKUP(RC1,CalcIncClms,10,FALSE)/RC[-2])) -> 56.878327504584313 | E24: =IF(RC1="","",IF(SUM(R9C[-3]:RC[-3])=0,0,VLOOKUP(RC1,CalcIncClms,12,FALSE)/SUM(R9C[-3]:RC[-3]))) -> 62.289081579791308 | F24: =IF(RC1="","",IF(SUM(OFFSET(R[1]C[-4],-MIN(ANC,1+ROUND(DAYS360(ExpDat,RC1,0)/30,0)),0,MIN(ANC,1+ROUND(DAYS360(ExpDat,RC1,0)/30,0)),1))=0,0,SUM(OFFSET(IncurredClaims!R[1]C[4],-MIN(ANC,1+ROUND(DAYS360(ExpDat,RC1,0)/30,0)),0,MIN(ANC,1+ROUND(DAYS360(ExpDat,RC1,0)/30,0)),1))/SUM(OFFSET(R[1]C[-4],-MIN(ANC,1+ROUND(DAYS360(ExpDat,RC1,0)/30,0)),0,MIN(ANC,1+ROUND(DAYS360(ExpDat,RC1,0)/30,0)),1)))) -> 59.030221581063792
A25: =IF(R[-1]C1="","",IF(DATE(YEAR(R[-1]C),MONTH(R[-1]C)+1,1)>ValDat,"",DATE(YEAR(R[-1]C),MONTH(R[-1]C)+1,1))) -> 1999-12-01T00:00:00.000 | B25: =IF(RC1="","",VLOOKUP(RC1,ExpDump,7,FALSE)) -> 3018.721 | C25: =IF(RC1="","",VLOOKUP(RC1,LinearIncLag,2,FALSE)) -> 219368 | D25: =IF(RC1="","",IF(RC[-2]=0,0,VLOOKUP(RC1,CalcIncClms,10,FALSE)/RC[-2])) -> 36.948760749999749 | E25: =IF(RC1="","",IF(SUM(R9C[-3]:RC[-3])=0,0,VLOOKUP(RC1,CalcIncClms,12,FALSE)/SUM(R9C[-3]:RC[-3]))) -> 60.709257038612499 | F25: =IF(RC1="","",IF(SUM(OFFSET(R[1]C[-4],-MIN(ANC,1+ROUND(DAYS360(ExpDat,RC1,0)/30,0)),0,MIN(ANC,1+ROUND(DAYS360(ExpDat,RC1,0)/30,0)),1))=0,0,SUM(OFFSET(IncurredClaims!R[1]C[4],-MIN(ANC,1+ROUND(DAYS360(ExpDat,RC1,0)/30,0)),0,MIN(ANC,1+ROUND(DAYS360(ExpDat,RC1,0)/30,0)),1))/SUM(OFFSET(R[1]C[-4],-MIN(ANC,1+ROUND(DAYS360(ExpDat,RC1,0)/30,0)),0,MIN(ANC,1+ROUND(DAYS360(ExpDat,RC1,0)/30,0)),1)))) -> 58.755452783695212
A26: =IF(R[-1]C1="","",IF(DATE(YEAR(R[-1]C),MONTH(R[-1]C)+1,1)>ValDat,"",DATE(YEAR(R[-1]C),MONTH(R[-1]C)+1,1))) -> 2000-01-01T00:00:00.000 | B26: =IF(RC1="","",VLOOKUP(RC1,ExpDump,7,FALSE)) -> 3003.3229999999999 | C26: =IF(RC1="","",VLOOKUP(RC1,LinearIncLag,2,FALSE)) -> 219368 | D26: =IF(RC1="","",IF(RC[-2]=0,0,VLOOKUP(RC1,CalcIncClms,10,FALSE)/RC[-2])) -> 37.138196590909473 | E26: =IF(RC1="","",IF(SUM(R9C[-3]:RC[-3])=0,0,VLOOKUP(RC1,CalcIncClms,12,FALSE)/SUM(R9C[-3]:RC[-3]))) -> 59.332619314552872 | F26: =IF(RC1="","",IF(SUM(OFFSET(R[1]C[-4],-MIN(ANC,1+ROUND(DAYS360(ExpDat,RC1,0)/30,0)),0,MIN(ANC,1+ROUND(DAYS360(ExpDat,RC1,0)/30,0)),1))=0,0,SUM(OFFSET(IncurredClaims!R[1]C[4],-MIN(ANC,1+ROUND(DAYS360(ExpDat,RC1,0)/30,0)),0,MIN(ANC,1+ROUND(DAYS360(ExpDat,RC1,0)/30,0)),1))/SUM(OFFSET(R[1]C[-4],-MIN(ANC,1+ROUND(DAYS360(ExpDat,RC1,0)/30,0)),0,MIN(ANC,1+ROUND(DAYS360(ExpDat,RC1,0)/30,0)),1)))) -> 58.523789310954037
A27: =IF(R[-1]C1="","",IF(DATE(YEAR(R[-1]C),MONTH(R[-1]C)+1,1)>ValDat,"",DATE(YEAR(R[-1]C),MONTH(R[-1]C)+1,1))) -> 2000-02-01T00:00:00.000 | B27: =IF(RC1="","",VLOOKUP(RC1,ExpDump,7,FALSE)) -> 3006.0590000000002 | C27: =IF(RC1="","",VLOOKUP(RC1,LinearIncLag,2,FALSE)) -> 318121 | D27: =IF(RC1="","",IF(RC[-2]=0,0,VLOOKUP(RC1,CalcIncClms,10,FALSE)/RC[-2])) -> 70.37885816612382 | E27: =IF(RC1="","",IF(SUM(R9C[-3]:RC[-3])=0,0,VLOOKUP(RC1,CalcIncClms,12,FALSE)/SUM(R9C[-3]:RC[-3]))) -> 59.942685904968933 | F27: =IF(RC1="","",IF(SUM(OFFSET(R[1]C[-4],-MIN(ANC,1+ROUND(DAYS360(ExpDat,RC1,0)/30,0)),0,MIN(ANC,1+ROUND(DAYS360(ExpDat,RC1,0)/30,0)),1))=0,0,SUM(OFFSET(IncurredClaims!R[1]C[4],-MIN(ANC,1+ROUND(DAYS360(ExpDat,RC1,0)/30,0)),0,MIN(ANC,1+ROUND(DAYS360(ExpDat,RC1,0)/30,0)),1))/SUM(OFFSET(R[1]C[-4],-MIN(ANC,1+ROUND(DAYS360(ExpDat,RC1,0)/30,0)),0,MIN(ANC,1+ROUND(DAYS360(ExpDat,RC1,0)/30,0)),1)))) -> 59.540639018619999
A28: =IF(R[-1]C1="","",IF(DATE(YEAR(R[-1]C),MONTH(R[-1]C)+1,1)>ValDat,"",DATE(YEAR(R[-1]C),MONTH(R[-1]C)+1,1))) -> 2000-03-01T00:00:00.000 | B28: =IF(RC1="","",VLOOKUP(RC1,ExpDump,7,FALSE)) -> 3001.39 | C28: =IF(RC1="","",VLOOKUP(RC1,LinearIncLag,2,FALSE)) -> 318121 | D28: =IF(RC1="","",IF(RC[-2]=0,0,VLOOKUP(RC1,CalcIncClms,10,FALSE)/RC[-2])) -> 70.509884940094821 | E28: =IF(RC1="","",IF(SUM(R9C[-3]:RC[-3])=0,0,VLOOKUP(RC1,CalcIncClms,12,FALSE)/SUM(R9C[-3]:RC[-3]))) -> 60.494936823686146 | F28: =IF(RC1="","",IF(SUM(OFFSET(R[1]C[-4],-MIN(ANC,1+ROUND(DAYS360(ExpDat,RC1,0)/30,0)),0,MIN(ANC,1+ROUND(DAYS360(ExpDat,RC1,0)/30,0)),1))=0,0,SUM(OFFSET(IncurredClaims!R[1]C[4],-MIN(ANC,1+ROUND(DAYS360(ExpDat,RC1,0)/30,0)),0,MIN(ANC,1+ROUND(DAYS360(ExpDat,RC1,0)/30,0)),1))/SUM(OFFSET(R[1]C[-4],-MIN(ANC,1+ROUND(DAYS360(ExpDat,RC1,0)/30,0)),0,MIN(ANC,1+ROUND(DAYS360(ExpDat,RC1,0)/30,0)),1)))) -> 60.578588101973708
A29: =IF(R[-1]C1="","",IF(DATE(YEAR(R[-1]C),MONTH(R[-1]C)+1,1)>ValDat,"",DATE(YEAR(R[-1]C),MONTH(R[-1]C)+1,1))) -> 2000-04-01T00:00:00.000 | B29: =IF(RC1="","",VLOOKUP(RC1,ExpDump,7,FALSE)) -> 3027.8040000000001 | C29: =IF(RC1="","",VLOOKUP(RC1,LinearIncLag,2,FALSE)) -> 194291 | D29: =IF(RC1="","",IF(RC[-2]=0,0,VLOOKUP(RC1,CalcIncClms,10,FALSE)/RC[-2])) -> 60.582811055204537 | E29: =IF(RC1="","",IF(SUM(R9C[-3]:RC[-3])=0,0,VLOOKUP(RC1,CalcIncClms,12,FALSE)/SUM(R9C[-3]:RC[-3]))) -> 60.499337609459893 | F29: =IF(RC1="","",IF(SUM(OFFSET(R[1]C[-4],-MIN(ANC,1+ROUND(DAYS360(ExpDat,RC1,0)/30,0)),0,MIN(ANC,1+ROUND(DAYS360(ExpDat,RC1,0)/30,0)),1))=0,0,SUM(OFFSET(IncurredClaims!R[1]C[4],-MIN(ANC,1+ROUND(DAYS360(ExpDat,RC1,0)/30,0)),0,MIN(ANC,1+ROUND(DAYS360(ExpDat,RC1,0)/30,0)),1))/SUM(OFFSET(R[1]C[-4],-MIN(ANC,1+ROUND(DAYS360(ExpDat,RC1,0)/30,0)),0,MIN(ANC,1+ROUND(DAYS360(ExpDat,RC1,0)/30,0)),1)))) -> 60.706665992084126
A30: =IF(R[-1]C1="","",IF(DATE(YEAR(R[-1]C),MONTH(R[-1]C)+1,1)>ValDat,"",DATE(YEAR(R[-1]C),MONTH(R[-1]C)+1,1))) -> 2000-05-01T00:00:00.000 | B30: =IF(RC1="","",VLOOKUP(RC1,ExpDump,7,FALSE)) -> 3053.259 | C30: =IF(RC1="","",VLOOKUP(RC1,LinearIncLag,2,FALSE)) -> 194291 | D30: =IF(RC1="","",IF(RC[-2]=0,0,VLOOKUP(RC1,CalcIncClms,10,FALSE)/RC[-2])) -> 60.318253397111896 | E30: =IF(RC1="","",IF(SUM(R9C[-3]:RC[-3])=0,0,VLOOKUP(RC1,CalcIncClms,12,FALSE)/SUM(R9C[-3]:RC[-3]))) -> 60.490632214637955 | F30: =IF(RC1="","",IF(SUM(OFFSET(R[1]C[-4],-MIN(ANC,1+ROUND(DAYS360(ExpDat,RC1,0)/30,0)),0,MIN(ANC,1+ROUND(DAYS360(ExpDat,RC1,0)/30,0)),1))=0,0,SUM(OFFSET(IncurredClaims!R[1]C[4],-MIN(ANC,1+ROUND(DAYS360(ExpDat,RC1,0)/30,0)),0,MIN(ANC,1+ROUND(DAYS360(ExpDat,RC1,0)/30,0)),1))/SUM(OFFSET(R[1]C[-4],-MIN(ANC,1+ROUND(DAYS360(ExpDat,RC1,0)/30,0)),0,MIN(ANC,1+ROUND(DAYS360(ExpDat,RC1,0)/30,0)),1)))) -> 60.749098567437095
A31: =IF(R[-1]C1="","",IF(DATE(YEAR(R[-1]C),MONTH(R[-1]C)+1,1)>ValDat,"",DATE(YEAR(R[-1]C),MONTH(R[-1]C)+1,1))) -> 2000-06-01T00:00:00.000 | B31: =IF(RC1="","",VLOOKUP(RC1,ExpDump,7,FALSE)) -> 3019.4940000000001 | C31: =IF(RC1="","",VLOOKUP(RC1,LinearIncLag,2,FALSE)) -> 295608 | D31: =IF(RC1="","",IF(RC[-2]=0,0,VLOOKUP(RC1,CalcIncClms,10,FALSE)/RC[-2])) -> 109.37599621823932 | E31: =IF(RC1="","",IF(SUM(R9C[-3]:RC[-3])=0,0,VLOOKUP(RC1,CalcIncClms,12,FALSE)/SUM(R9C[-3]:RC[-3]))) -> 62.709266778461654 | F31: =IF(RC1="","",IF(SUM(OFFSET(R[1]C[-4],-MIN(ANC,1+ROUND(DAYS360(ExpDat,RC1,0)/30,0)),0,MIN(ANC,1+ROUND(DAYS360(ExpDat,RC1,0)/30,0)),1))=0,0,SUM(OFFSET(IncurredClaims!R[1]C[4],-MIN(ANC,1+ROUND(DAYS360(ExpDat,RC1,0)/30,0)),0,MIN(ANC,1+ROUND(DAYS360(ExpDat,RC1,0)/30,0)),1))/SUM(OFFSET(R[1]C[-4],-MIN(ANC,1+ROUND(DAYS360(ExpDat,RC1,0)/30,0)),0,MIN(ANC,1+ROUND(DAYS360(ExpDat,RC1,0)/30,0)),1)))) -> 61.456696410825614
A32: =IF(R[-1]C1="","",IF(DATE(YEAR(R[-1]C),MONTH(R[-1]C)+1,1)>ValDat,"",DATE(YEAR(R[-1]C),MONTH(R[-1]C)+1,1))) -> 2000-07-01T00:00:00.000 | B32: =IF(RC1="","",VLOOKUP(RC1,ExpDump,7,FALSE)) -> 3006.0659999999998 | C32: =IF(RC1="","",VLOOKUP(RC1,LinearIncLag,2,FALSE)) -> 295608 | D32: =IF(RC1="","",IF(RC[-2]=0,0,VLOOKUP(RC1,CalcIncClms,10,FALSE)/RC[-2])) -> 109.86576333648372 | E32: =IF(RC1="","",IF(SUM(R9C[-3]:RC[-3])=0,0,VLOOKUP(RC1,CalcIncClms,12,FALSE)/SUM(R9C[-3]:RC[-3]))) -> 64.74781327241935 | F32: =IF(RC1="","",IF(SUM(OFFSET(R[1]C[-4],-MIN(ANC,1+ROUND(DAYS360(ExpDat,RC1,0)/30,0)),0,MIN(ANC,1+ROUND(DAYS360(ExpDat,RC1,0)/30,0)),1))=0,0,SUM(OFFSET(IncurredClaims!R[1]C[4],-MIN(ANC,1+ROUND(DAYS360(ExpDat,RC1,0)/30,0)),0,MIN(ANC,1+ROUND(DAYS360(ExpDat,RC1,0)/30,0)),1))/SUM(OFFSET(R[1]C[-4],-MIN(ANC,1+ROUND(DAYS360(ExpDat,RC1,0)/30,0)),0,MIN(ANC,1+ROUND(DAYS360(ExpDat,RC1,0)/30,0)),1)))) -> 62.16236883284666
A33: =IF(R[-1]C1="","",IF(DATE(YEAR(R[-1]C),MONTH(R[-1]C)+1,1)>ValDat,"",DATE(YEAR(R[-1]C),MONTH(R[-1]C)+1,1))) -> 2000-08-01T00:00:00.000 | B33: =IF(RC1="","",VLOOKUP(RC1,ExpDump,7,FALSE)) -> 2987.3629999999998 | C33: =IF(RC1="","",VLOOKUP(RC1,LinearIncLag,2,FALSE)) -> 230602 | D33: =IF(RC1="","",IF(RC[-2]=0,0,VLOOKUP(RC1,CalcIncClms,10,FALSE)/RC[-2])) -> 94.557829402269235 | E33: =IF(RC1="","",IF(SUM(R9C[-3]:RC[-3])=0,0,VLOOKUP(RC1,CalcIncClms,12,FALSE)/SUM(R9C[-3]:RC[-3]))) -> 65.975713150745534 | F33: =IF(RC1="","",IF(SUM(OFFSET(R[1]C[-4],-MIN(ANC,1+ROUND(DAYS360(ExpDat,RC1,0)/30,0)),0,MIN(ANC,1+ROUND(DAYS360(ExpDat,RC1,0)/30,0)),1))=0,0,SUM(OFFSET(IncurredClaims!R[1]C[4],-MIN(ANC,1+ROUND(DAYS360(ExpDat,RC1,0)/30,0)),0,MIN(ANC,1+ROUND(DAYS360(ExpDat,RC1,0)/30,0)),1))/SUM(OFFSET(R[1]C[-4],-MIN(ANC,1+ROUND(DAYS360(ExpDat,RC1,0)/30,0)),0,MIN(ANC,1+ROUND(DAYS360(ExpDat,RC1,0)/30,0)),1)))) -> 66.865367518919982
A34: =IF(R[-1]C1="","",IF(DATE(YEAR(R[-1]C),MONTH(R[-1]C)+1,1)>ValDat,"",DATE(YEAR(R[-1]C),MONTH(R[-1]C)+1,1))) -> 2000-09-01T00:00:00.000 | B34: =IF(RC1="","",VLOOKUP(RC1,ExpDump,7,FALSE)) -> 2953.335 | C34: =IF(RC1="","",VLOOKUP(RC1,LinearIncLag,2,FALSE)) -> 230602 | D34: =IF(RC1="","",IF(RC[-2]=0,0,VLOOKUP(RC1,CalcIncClms,10,FALSE)/RC[-2])) -> 95.778081318864054 | E34: =IF(RC1="","",IF(SUM(R9C[-3]:RC[-3])=0,0,VLOOKUP(RC1,CalcIncClms,12,FALSE)/SUM(R9C[-3]:RC[-3]))) -> 67.141828850689919 | F34: =IF(RC1="","",IF(SUM(OFFSET(R[1]C[-4],-MIN(ANC,1+ROUND(DAYS360(ExpDat,RC1,0)/30,0)),0,MIN(ANC,1+ROUND(DAYS360(ExpDat,RC1,0)/30,0)),1))=0,0,SUM(OFFSET(IncurredClaims!R[1]C[4],-MIN(ANC,1+ROUND(DAYS360(ExpDat,RC1,0)/30,0)),0,MIN(ANC,1+ROUND(DAYS360(ExpDat,RC1,0)/30,0)),1))/SUM(OFFSET(R[1]C[-4],-MIN(ANC,1+ROUND(DAYS360(ExpDat,RC1,0)/30,0)),0,MIN(ANC,1+ROUND(DAYS360(ExpDat,RC1,0)/30,0)),1)))) -> 71.670874987810933
A35: =IF(R[-1]C1="","",IF(DATE(YEAR(R[-1]C),MONTH(R[-1]C)+1,1)>ValDat,"",DATE(YEAR(R[-1]C),MONTH(R[-1]C)+1,1))) -> 2000-10-01T00:00:00.000 | B35: =IF(RC1="","",VLOOKUP(RC1,ExpDump,7,FALSE)) -> 2927.2660000000001 | C35: =IF(RC1="","",VLOOKUP(RC1,LinearIncLag,2,FALSE)) -> 186976 | D35: =IF(RC1="","",IF(RC[-2]=0,0,VLOOKUP(RC1,CalcIncClms,10,FALSE)/RC[-2])) -> 63.222186673460719 | E35: =IF(RC1="","",IF(SUM(R9C[-3]:RC[-3])=0,0,VLOOKUP(RC1,CalcIncClms,12,FALSE)/SUM(R9C[-3]:RC[-3]))) -> 66.995489214430009 | F35: =IF(RC1="","",IF(SUM(OFFSET(R[1]C[-4],-MIN(ANC,1+ROUND(DAYS360(ExpDat,RC1,0)/30,0)),0,MIN(ANC,1+ROUND(DAYS360(ExpDat,RC1,0)/30,0)),1))=0,0,SUM(OFFSET(IncurredClaims!R[1]C[4],-MIN(ANC,1+ROUND(DAYS360(ExpDat,RC1,0)/30,0)),0,MIN(ANC,1+ROUND(DAYS360(ExpDat,RC1,0)/30,0)),1))/SUM(OFFSET(R[1]C[-4],-MIN(ANC,1+ROUND(DAYS360(ExpDat,RC1,0)/30,0)),0,MIN(ANC,1+ROUND(DAYS360(ExpDat,RC1,0)/30,0)),1)))) -> 72.081359882561884
A36: =IF(R[-1]C1="","",IF(DATE(YEAR(R[-1]C),MONTH(R[-1]C)+1,1)>ValDat,"",DATE(YEAR(R[-1]C),MONTH(R[-1]C)+1,1))) -> 2000-11-01T00:00:00.000 | B36: =IF(RC1="","",VLOOKUP(RC1,ExpDump,7,FALSE)) -> 2897.2249999999999 | C36: =IF(RC1="","",VLOOKUP(RC1,LinearIncLag,2,FALSE)) -> 186976 | D36: =IF(RC1="","",IF(RC[-2]=0,0,VLOOKUP(RC1,CalcIncClms,10,FALSE)/RC[-2])) -> 63.965929836255995 | E36: =IF(RC1="","",IF(SUM(R9C[-3]:RC[-3])=0,0,VLOOKUP(RC1,CalcIncClms,12,FALSE)/SUM(R9C[-3]:RC[-3]))) -> 66.887530803315713 | F36: =IF(RC1="","",IF(SUM(OFFSET(R[1]C[-4],-MIN(ANC,1+ROUND(DAYS360(ExpDat,RC1,0)/30,0)),0,MIN(ANC,1+ROUND(DAYS360(ExpDat,RC1,0)/30,0)),1))=0,0,SUM(OFFSET(IncurredClaims!R[1]C[4],-MIN(ANC,1+ROUND(DAYS360(ExpDat,RC1,0)/30,0)),0,MIN(ANC,1+ROUND(DAYS360(ExpDat,RC1,0)/30,0)),1))/SUM(OFFSET(R[1]C[-4],-MIN(ANC,1+ROUND(DAYS360(ExpDat,RC1,0)/30,0)),0,MIN(ANC,1+ROUND(DAYS360(ExpDat,RC1,0)/30,0)),1)))) -> 72.702812908378235
A37: =IF(R[-1]C1="","",IF(DATE(YEAR(R[-1]C),MONTH(R[-1]C)+1,1)>ValDat,"",DATE(YEAR(R[-1]C),MONTH(R[-1]C)+1,1))) -> 2000-12-01T00:00:00.000 | B37: =IF(RC1="","",VLOOKUP(RC1,ExpDump,7,FALSE)) -> 2887.18 | C37: =IF(RC1="","",VLOOKUP(RC1,LinearIncLag,2,FALSE)) -> 146038 | D37: =IF(RC1="","",IF(RC[-2]=0,0,VLOOKUP(RC1,CalcIncClms,10,FALSE)/RC[-2])) -> 30.165739954036489 | E37: =IF(RC1="","",IF(SUM(R9C[-3]:RC[-3])=0,0,VLOOKUP(RC1,CalcIncClms,12,FALSE)/SUM(R9C[-3]:RC[-3]))) -> 65.628206482689208 | F37: =IF(RC1="","",IF(SUM(OFFSET(R[1]C[-4],-MIN(ANC,1+ROUND(DAYS360(ExpDat,RC1,0)/30,0)),0,MIN(ANC,1+ROUND(DAYS360(ExpDat,RC1,0)/30,0)),1))=0,0,SUM(OFFSET(IncurredClaims!R[1]C[4],-MIN(ANC,1+ROUND(DAYS360(ExpDat,RC1,0)/30,0)),0,MIN(ANC,1+ROUND(DAYS360(ExpDat,RC1,0)/30,0)),1))/SUM(OFFSET(R[1]C[-4],-MIN(ANC,1+ROUND(DAYS360(ExpDat,RC1,0)/30,0)),0,MIN(ANC,1+ROUND(DAYS360(ExpDat,RC1,0)/30,0)),1)))) -> 72.286800149481522
A38: =IF(R[-1]C1="","",IF(DATE(YEAR(R[-1]C),MONTH(R[-1]C)+1,1)>ValDat,"",DATE(YEAR(R[-1]C),MONTH(R[-1]C)+1,1))) -> 2001-01-01T00:00:00.000 | B38: =IF(RC1="","",VLOOKUP(RC1,ExpDump,7,FALSE)) -> 2887.8029999999999 | C38: =IF(RC1="","",VLOOKUP(RC1,LinearIncLag,2,FALSE)) -> 146038 | D38: =IF(RC1="","",IF(RC[-2]=0,0,VLOOKUP(RC1,CalcIncClms,10,FALSE)/RC[-2])) -> 32.338046332994189 | E38: =IF(RC1="","",IF(SUM(R9C[-3]:RC[-3])=0,0,VLOOKUP(RC1,CalcIncClms,12,FALSE)/SUM(R9C[-3]:RC[-3]))) -> 64.524187963157217 | F38: =IF(RC1="","",IF(SUM(OFFSET(R[1]C[-4],-MIN(ANC,1+ROUND(DAYS360(ExpDat,RC1,0)/30,0)),0,MIN(ANC,1+ROUND(DAYS360(ExpDat,RC1,0)/30,0)),1))=0,0,SUM(OFFSET(IncurredClaims!R[1]C[4],-MIN(ANC,1+ROUND(DAYS360(ExpDat,RC1,0)/30,0)),0,MIN(ANC,1+ROUND(DAYS360(ExpDat,RC1,0)/30,0)),1))/SUM(OFFSET(R[1]C[-4],-MIN(ANC,1+ROUND(DAYS360(ExpDat,RC1,0)/30,0)),0,MIN(ANC,1+ROUND(DAYS360(ExpDat,RC1,0)/30,0)),1)))) -> 72.011895382683704
A39: =IF(R[-1]C1="","",IF(DATE(YEAR(R[-1]C),MONTH(R[-1]C)+1,1)>ValDat,"",DATE(YEAR(R[-1]C),MONTH(R[-1]C)+1,1))) -> 2001-02-01T00:00:00.000 | B39: =IF(RC1="","",VLOOKUP(RC1,ExpDump,7,FALSE)) -> 2887.0279999999998 | C39: =IF(RC1="","",VLOOKUP(RC1,LinearIncLag,2,FALSE)) -> 82703 | D39: =IF(RC1="","",IF(RC[-2]=0,0,VLOOKUP(RC1,CalcIncClms,10,FALSE)/RC[-2])) -> 54.360989196459926 | E39: =IF(RC1="","",IF(SUM(R9C[-3]:RC[-3])=0,0,VLOOKUP(RC1,CalcIncClms,12,FALSE)/SUM(R9C[-3]:RC[-3]))) -> 64.198044251846312 | F39: =IF(RC1="","",IF(SUM(OFFSET(R[1]C[-4],-MIN(ANC,1+ROUND(DAYS360(ExpDat,RC1,0)/30,0)),0,MIN(ANC,1+ROUND(DAYS360(ExpDat,RC1,0)/30,0)),1))=0,0,SUM(OFFSET(IncurredClaims!R[1]C[4],-MIN(ANC,1+ROUND(DAYS360(ExpDat,RC1,0)/30,0)),0,MIN(ANC,1+ROUND(DAYS360(ExpDat,RC1,0)/30,0)),1))/SUM(OFFSET(R[1]C[-4],-MIN(ANC,1+ROUND(DAYS360(ExpDat,RC1,0)/30,0)),0,MIN(ANC,1+ROUND(DAYS360(ExpDat,RC1,0)/30,0)),1)))) -> 70.716007437314516
A40: =IF(R[-1]C1="","",IF(DATE(YEAR(R[-1]C),MONTH(R[-1]C)+1,1)>ValDat,"",DATE(YEAR(R[-1]C),MONTH(R[-1]C)+1,1))) -> 2001-03-01T00:00:00.000 | B40: =IF(RC1="","",VLOOKUP(RC1,ExpDump,7,FALSE)) -> 2848.3409999999999 | C40: =IF(RC1="","",VLOOKUP(RC1,LinearIncLag,2,FALSE)) -> 82703 | D40: =IF(RC1="","",IF(RC[-2]=0,0,VLOOKUP(RC1,CalcIncClms,10,FALSE)/RC[-2])) -> 57.126891403760439 | E40: =IF(RC1="","",IF(SUM(R9C[-3]:RC[-3])=0,0,VLOOKUP(RC1,CalcIncClms,12,FALSE)/SUM(R9C[-3]:RC[-3]))) -> 63.981037652287732 | F40: =IF(RC1="","",IF(SUM(OFFSET(R[1]C[-4],-MIN(ANC,1+ROUND(DAYS360(ExpDat,RC1,0)/30,0)),0,MIN(ANC,1+ROUND(DAYS360(ExpDat,RC1,0)/30,0)),1))=0,0,SUM(OFFSET(IncurredClaims!R[1]C[4],-MIN(ANC,1+ROUND(DAYS360(ExpDat,RC1,0)/30,0)),0,MIN(ANC,1+ROUND(DAYS360(ExpDat,RC1,0)/30,0)),1))/SUM(OFFSET(R[1]C[-4],-MIN(ANC,1+ROUND(DAYS360(ExpDat,RC1,0)/30,0)),0,MIN(ANC,1+ROUND(DAYS360(ExpDat,RC1,0)/30,0)),1)))) -> 69.639539012426766
A41: =IF(R[-1]C1="","",IF(DATE(YEAR(R[-1]C),MONTH(R[-1]C)+1,1)>ValDat,"",DATE(YEAR(R[-1]C),MONTH(R[-1]C)+1,1))) -> 2001-04-01T00:00:00.000 | B41: =IF(RC1="","",VLOOKUP(RC1,ExpDump,7,FALSE)) -> 2809.8719999999998 | C41: =IF(RC1="","",VLOOKUP(RC1,LinearIncLag,2,FALSE)) -> 52143 | D41: =IF(RC1="","",IF(RC[-2]=0,0,VLOOKUP(RC1,CalcIncClms,10,FALSE)/RC[-2])) -> 56.230478412751744 | E41: =IF(RC1="","",IF(SUM(R9C[-3]:RC[-3])=0,0,VLOOKUP(RC1,CalcIncClms,12,FALSE)/SUM(R9C[-3]:RC[-3]))) -> 63.753288193980147 | F41: =IF(RC1="","",IF(SUM(OFFSET(R[1]C[-4],-MIN(ANC,1+ROUND(DAYS360(ExpDat,RC1,0)/30,0)),0,MIN(ANC,1+ROUND(DAYS360(ExpDat,RC1,0)/30,0)),1))=0,0,SUM(OFFSET(IncurredClaims!R[1]C[4],-MIN(ANC,1+ROUND(DAYS360(ExpDat,RC1,0)/30,0)),0,MIN(ANC,1+ROUND(DAYS360(ExpDat,RC1,0)/30,0)),1))/SUM(OFFSET(R[1]C[-4],-MIN(ANC,1+ROUND(DAYS360(ExpDat,RC1,0)/30,0)),0,MIN(ANC,1+ROUND(DAYS360(ExpDat,RC1,0)/30,0)),1)))) -> 69.347886210524535
A42: =IF(R[-1]C1="","",IF(DATE(YEAR(R[-1]C),MONTH(R[-1]C)+1,1)>ValDat,"",DATE(YEAR(R[-1]C),MONTH(R[-1]C)+1,1))) -> 2001-05-01T00:00:00.000 | B42: =IF(RC1="","",VLOOKUP(RC1,ExpDump,7,FALSE)) -> 2815.6109999999999 | C42: =IF(RC1="","",VLOOKUP(RC1,LinearIncLag,2,FALSE)) -> 52143 | D42: =IF(RC1="","",IF(RC[-2]=0,0,VLOOKUP(RC1,CalcIncClms,10,FALSE)/RC[-2])) -> 76.687432336126179 | E42: =IF(RC1="","",IF(SUM(R9C[-3]:RC[-3])=0,0,VLOOKUP(RC1,CalcIncClms,12,FALSE)/SUM(R9C[-3]:RC[-3]))) -> 64.123239878799367 | F42: =IF(RC1="","",IF(SUM(OFFSET(R[1]C[-4],-MIN(ANC,1+ROUND(DAYS360(ExpDat,RC1,0)/30,0)),0,MIN(ANC,1+ROUND(DAYS360(ExpDat,RC1,0)/30,0)),1))=0,0,SUM(OFFSET(IncurredClaims!R[1]C[4],-MIN(ANC,1+ROUND(DAYS360(ExpDat,RC1,0)/30,0)),0,MIN(ANC,1+ROUND(DAYS360(ExpDat,RC1,0)/30,0)),1))/SUM(OFFSET(R[1]C[-4],-MIN(ANC,1+ROUND(DAYS360(ExpDat,RC1,0)/30,0)),0,MIN(ANC,1+ROUND(DAYS360(ExpDat,RC1,0)/30,0)),1)))) -> 70.728929213770968
A43: =IF(R[-1]C1="","",IF(DATE(YEAR(R[-1]C),MONTH(R[-1]C)+1,1)>ValDat,"",DATE(YEAR(R[-1]C),MONTH(R[-1]C)+1,1))) -> 2001-06-01T00:00:00.000 | B43: =IF(RC1="","",VLOOKUP(RC1,ExpDump,7,FALSE)) -> 2810.5160000000001 | C43: =IF(RC1="","",VLOOKUP(RC1,LinearIncLag,2,FALSE)) -> 0 | D43: =IF(RC1="","",IF(RC[-2]=0,0,VLOOKUP(RC1,CalcIncClms,10,FALSE)/RC[-2])) -> 50.856334970865724 | E43: =IF(RC1="","",IF(SUM(R9C[-3]:RC[-3])=0,0,VLOOKUP(RC1,CalcIncClms,12,FALSE)/SUM(R9C[-3]:RC[-3]))) -> 63.7549714202422 | F43: =IF(RC1="","",IF(SUM(OFFSET(R[1]C[-4],-MIN(ANC,1+ROUND(DAYS360(ExpDat,RC1,0)/30,0)),0,MIN(ANC,1+ROUND(DAYS360(ExpDat,RC1,0)/30,0)),1))=0,0,SUM(OFFSET(IncurredClaims!R[1]C[4],-MIN(ANC,1+ROUND(DAYS360(ExpDat,RC1,0)/30,0)),0,MIN(ANC,1+ROUND(DAYS360(ExpDat,RC1,0)/30,0)),1))/SUM(OFFSET(R[1]C[-4],-MIN(ANC,1+ROUND(DAYS360(ExpDat,RC1,0)/30,0)),0,MIN(ANC,1+ROUND(DAYS360(ExpDat,RC1,0)/30,0)),1)))) -> 65.758919731585365
A44: =IF(R[-1]C1="","",IF(DATE(YEAR(R[-1]C),MONTH(R[-1]C)+1,1)>ValDat,"",DATE(YEAR(R[-1]C),MONTH(R[-1]C)+1,1))) -> 2001-07-01T00:00:00.000 | B44: =IF(RC1="","",VLOOKUP(RC1,ExpDump,7,FALSE)) -> 2830.0740000000001 | C44: =IF(RC1="","",VLOOKUP(RC1,LinearIncLag,2,FALSE)) -> 0 | D44: =IF(RC1="","",IF(RC[-2]=0,0,VLOOKUP(RC1,CalcIncClms,10,FALSE)/RC[-2])) -> 64.585872493952721 | E44: =IF(RC1="","",IF(SUM(R9C[-3]:RC[-3])=0,0,VLOOKUP(RC1,CalcIncClms,12,FALSE)/SUM(R9C[-3]:RC[-3]))) -> 63.777564908692199 | F44: =IF(RC1="","",IF(SUM(OFFSET(R[1]C[-4],-MIN(ANC,1+ROUND(DAYS360(ExpDat,RC1,0)/30,0)),0,MIN(ANC,1+ROUND(DAYS360(ExpDat,RC1,0)/30,0)),1))=0,0,SUM(OFFSET(IncurredClaims!R[1]C[4],-MIN(ANC,1+ROUND(DAYS360(ExpDat,RC1,0)/30,0)),0,MIN(ANC,1+ROUND(DAYS360(ExpDat,RC1,0)/30,0)),1))/SUM(OFFSET(R[1]C[-4],-MIN(ANC,1+ROUND(DAYS360(ExpDat,RC1,0)/30,0)),0,MIN(ANC,1+ROUND(DAYS360(ExpDat,RC1,0)/30,0)),1)))) -> 61.824306444088201
B45: =OFFSET(RC,MEP-MNR-1,0,1) -> 2830.0740000000001 | F45: =OFFSET(RC,MEP-MNR-1,0,1) -> 61.824306444088201
A49: SUMMARY:
B50: ITEM DESCRIPTION | I50: VALUE
B51: ="(A) Average monthly claim cost over last "&ANC&" months  …………………………………………………….." -> (A) Average monthly claim cost over last 12 months …………………………………………………….. | I51: =R[-6]C[-3] -> 61.824306444088201
B52: ="(B) Average trend during the last "&ANC&" months, weighted by Estimated Incurred Claims  ………………………." -> (B) Average trend during the last 12 months, weighted by Estimated Incurred Claims ………………………. | I52: =IF(SUM(OFFSET(IncurredClaims!R[-7]C[1],MEP-MNR-ANC,0,ANC,1))=0,0,SUMPRODUCT(OFFSET(IncurredClaims!R[-7]C[1],MEP-MNR-ANC,0,ANC,1),OFFSET(IncurredClaims!R[-7]C[-4],MEP-MNR-ANC,0,ANC,1))/SUM(OFFSET(IncurredClaims!R[-7]C[1],MEP-MNR-ANC,0,ANC,1))) -> 1.0295608677723642
B53: (C) Valuation Month Exposure …………………………………………………………………………………………………. | I53: =VLOOKUP((DATE(YEAR(ValDat),MONTH(ValDat),1)),ExpDump,7,FALSE) -> 2830.0740000000001
B54: (D) Full Month Weighted Lives* …………………………………………………………………………………………………. | I54: =VLOOKUP(DATE(YEAR(ValDat),MONTH(ValDat),1),ExpDump,5,FALSE) -> 2533.4630000000002
B55: (E) Fractional Month Weighted Lives* ……………………………………………………………………………. | I55: =VLOOKUP(DATE(YEAR(ValDat),MONTH(ValDat),1),ExpDump,6,FALSE) -> 2572.7950000000001
B56: (F) Full Month Estimated Incurred Claims (A * B * C * D / E) ………………………………………………… | I56: =IF(R[-1]C=0,0,R[-5]C*R[-4]C*R[-3]C*R[-2]C/R[-1]C) -> 177385.63817773169
B57: (G) Current Monthly Premium (Sum of premium on active lives on the Valuation Date) …………………………………………………………………………………………………. | I57: =Premium -> 332970
B58: (H) Adjusted Loss Ratio on Valuation Date (F/G) …………………………………………………………………………………………………. | I58: =IF(R[-1]C=0,0,R[-2]C/R[-1]C) -> 0.532737598515577
A60: * Items (D) and (E) adjust the Exposure in line (C) to put it on a full month basis as is the Current Premium in Line G.

Sheet: Liabilities
A1: =title1&" - Liabilities" -> BLOCK CLAIM LIABILITY REPORT - Liabilities
A2: =title2 -> The Millennium-2000 Sample Life Insurance Company
A3: =title3 -> Arvind
A4: =title4 -> Experience Period: 01-Aug-1998 to 31-Jul-2001. Runout Date: 31-Jul-2001
B7: ="INCURRED BUT NOT "&IF(Basis="ibnp","PAID","REPORTED")&" LIABILITY" -> INCURRED BUT NOT REPORTED LIABILITY | D7: PENDING CLAIM LIABILITY | F7: TOTAL LIABILITY
A8: Incurred Month | B8: ="Remaining "&UPPER(Basis)&" as of Runout Date" -> Remaining IBNR as of Runout Date | C8: ="Restated* "&UPPER(Basis)&" as of the End of Each Incurred Month" -> Restated* IBNR as of the End of Each Incurred Month | D8: Remaining Pending Claims as of Runout Date | E8: Restated* PendClms as of the End of Each Incurred Month | F8: Remaining as of Runout Date | G8: Restated* as of the Date of Each Incurred Month | H8: Percent of Total that is Pending on the Remaining Liability
A9: =ExpDat -> 1998-08-01T00:00:00.000 | B9: =IF(RC1="","",VLOOKUP(RC1,CalcIncClms,12,FALSE)-VLOOKUP(RC1,LinearIncLag,5,FALSE)) -> 0 | C9: =IF(RC1="","",VLOOKUP(RC1,CalcIncClms,12,FALSE)-VLOOKUP(RC1,LinearRepLag,5,FALSE)) -> 74072 | D9: =IF(RC1="","",VLOOKUP(RC1,LinearIncLag,5,FALSE)-VLOOKUP(RC1,LinearIncLag,3,FALSE)) -> 48886 | E9: =IF(RC1="","",VLOOKUP(RC1,TriRepLag,5,FALSE)-VLOOKUP(RC1,TriPaidLag,5,FALSE)) -> -25186 | F9: =IF(RC1="","",VLOOKUP(RC1,CalcIncClms,12,FALSE)-VLOOKUP(RC1,LinearIncLag,3,FALSE)) -> 48886 | G9: =IF(RC1="","",VLOOKUP(RC1,CalcIncClms,12,FALSE)-VLOOKUP(RC1,LinearRepLag,5,FALSE)+VLOOKUP(RC1,TriRepLag,5,FALSE)-VLOOKUP(RC1,TriPaidLag,5,FALSE)) -> 48886 | H9: =IF(RC1="","",IF(RC[-1]=0,"",RC[-3]/RC[-1])) -> -0.51519862537331751
A10: =IF(R[-1]C1="","",IF(DATE(YEAR(R[-1]C),MONTH(R[-1]C)+1,1)>ValDat,"",DATE(YEAR(R[-1]C),MONTH(R[-1]C)+1,1))) -> 1998-09-01T00:00:00.000 | B10: =IF(RC1="","",VLOOKUP(RC1,CalcIncClms,12,FALSE)-VLOOKUP(RC1,LinearIncLag,5,FALSE)) -> 0 | C10: =IF(RC1="","",VLOOKUP(RC1,CalcIncClms,12,FALSE)-VLOOKUP(RC1,LinearRepLag,5,FALSE)) -> 67966 | D10: =IF(RC1="","",VLOOKUP(RC1,LinearIncLag,5,FALSE)-VLOOKUP(RC1,LinearIncLag,3,FALSE)) -> 97772 | E10: =IF(RC1="","",VLOOKUP(RC1,TriRepLag,5,FALSE)-VLOOKUP(RC1,TriPaidLag,5,FALSE)) -> 29806 | F10: =IF(RC1="","",VLOOKUP(RC1,CalcIncClms,12,FALSE)-VLOOKUP(RC1,LinearIncLag,3,FALSE)) -> 97772 | G10: =IF(RC1="","",VLOOKUP(RC1,CalcIncClms,12,FALSE)-VLOOKUP(RC1,LinearRepLag,5,FALSE)+VLOOKUP(RC1,TriRepLag,5,FALSE)-VLOOKUP(RC1,TriPaidLag,5,FALSE)) -> 97772 | H10: =IF(RC1="","",IF(RC[-1]=0,"",RC[-3]/RC[-1])) -> 0.30485210489710757
A11: =IF(R[-1]C1="","",IF(DATE(YEAR(R[-1]C),MONTH(R[-1]C)+1,1)>ValDat,"",DATE(YEAR(R[-1]C),MONTH(R[-1]C)+1,1))) -> 1998-10-01T00:00:00.000 | B11: =IF(RC1="","",VLOOKUP(RC1,CalcIncClms,12,FALSE)-VLOOKUP(RC1,LinearIncLag,5,FALSE)) -> 0 | C11: =IF(RC1="","",VLOOKUP(RC1,CalcIncClms,12,FALSE)-VLOOKUP(RC1,LinearRepLag,5,FALSE)) -> 261828 | D11: =IF(RC1="","",VLOOKUP(RC1,LinearIncLag,5,FALSE)-VLOOKUP(RC1,LinearIncLag,3,FALSE)) -> 168202 | E11: =IF(RC1="","",VLOOKUP(RC1,TriRepLag,5,FALSE)-VLOOKUP(RC1,TriPaidLag,5,FALSE)) -> 107621 | F11: =IF(RC1="","",VLOOKUP(RC1,CalcIncClms,12,FALSE)-VLOOKUP(RC1,LinearIncLag,3,FALSE)) -> 168202 | G11: =IF(RC1="","",VLOOKUP(RC1,CalcIncClms,12,FALSE)-VLOOKUP(RC1,LinearRepLag,5,FALSE)+VLOOKUP(RC1,TriRepLag,5,FALSE)-VLOOKUP(RC1,TriPaidLag,5,FALSE)) -> 369449 | H11: =IF(RC1="","",IF(RC[-1]=0,"",RC[-3]/RC[-1])) -> 0.2913013704191918
A12: =IF(R[-1]C1="","",IF(DATE(YEAR(R[-1]C),MONTH(R[-1]C)+1,1)>ValDat,"",DATE(YEAR(R[-1]C),MONTH(R[-1]C)+1,1))) -> 1998-11-01T00:00:00.000 | B12: =IF(RC1="","",VLOOKUP(RC1,CalcIncClms,12,FALSE)-VLOOKUP(RC1,LinearIncLag,5,FALSE)) -> 0 | C12: =IF(RC1="","",VLOOKUP(RC1,CalcIncClms,12,FALSE)-VLOOKUP(RC1,LinearRepLag,5,FALSE)) -> 346069 | D12: =IF(RC1="","",VLOOKUP(RC1,LinearIncLag,5,FALSE)-VLOOKUP(RC1,LinearIncLag,3,FALSE)) -> 238632 | E12: =IF(RC1="","",VLOOKUP(RC1,TriRepLag,5,FALSE)-VLOOKUP(RC1,TriPaidLag,5,FALSE)) -> 98488 | F12: =IF(RC1="","",VLOOKUP(RC1,CalcIncClms,12,FALSE)-VLOOKUP(RC1,LinearIncLag,3,FALSE)) -> 238632 | G12: =IF(RC1="","",VLOOKUP(RC1,CalcIncClms,12,FALSE)-VLOOKUP(RC1,LinearRepLag,5,FALSE)+VLOOKUP(RC1,TriRepLag,5,FALSE)-VLOOKUP(RC1,TriPaidLag,5,FALSE)) -> 444557 | H12: =IF(RC1="","",IF(RC[-1]=0,"",RC[-3]/RC[-1])) -> 0.22154189451521403
A13: =IF(R[-1]C1="","",IF(DATE(YEAR(R[-1]C),MONTH(R[-1]C)+1,1)>ValDat,"",DATE(YEAR(R[-1]C),MONTH(R[-1]C)+1,1))) -> 1998-12-01T00:00:00.000 | B13: =IF(RC1="","",VLOOKUP(RC1,CalcIncClms,12,FALSE)-VLOOKUP(RC1,LinearIncLag,5,FALSE)) -> 0 | C13: =IF(RC1="","",VLOOKUP(RC1,CalcIncClms,12,FALSE)-VLOOKUP(RC1,LinearRepLag,5,FALSE)) -> 254956 | D13: =IF(RC1="","",VLOOKUP(RC1,LinearIncLag,5,FALSE)-VLOOKUP(RC1,LinearIncLag,3,FALSE)) -> 149839 | E13: =IF(RC1="","",VLOOKUP(RC1,TriRepLag,5,FALSE)-VLOOKUP(RC1,TriPaidLag,5,FALSE)) -> 99547 | F13: =IF(RC1="","",VLOOKUP(RC1,CalcIncClms,12,FALSE)-VLOOKUP(RC1,LinearIncLag,3,FALSE)) -> 149839 | G13: =IF(RC1="","",VLOOKUP(RC1,CalcIncClms,12,FALSE)-VLOOKUP(RC1,LinearRepLag,5,FALSE)+VLOOKUP(RC1,TriRepLag,5,FALSE)-VLOOKUP(RC1,TriPaidLag,5,FALSE)) -> 354503 | H13: =IF(RC1="","",IF(RC[-1]=0,"",RC[-3]/RC[-1])) -> 0.28080721460749275
A14: =IF(R[-1]C1="","",IF(DATE(YEAR(R[-1]C),MONTH(R[-1]C)+1,1)>ValDat,"",DATE(YEAR(R[-1]C),MONTH(R[-1]C)+1,1))) -> 1999-01-01T00:00:00.000 | B14: =IF(RC1="","",VLOOKUP(RC1,CalcIncClms,12,FALSE)-VLOOKUP(RC1,LinearIncLag,5,FALSE)) -> 0 | C14: =IF(RC1="","",VLOOKUP(RC1,CalcIncClms,12,FALSE)-VLOOKUP(RC1,LinearRepLag,5,FALSE)) -> 176528 | D14: =IF(RC1="","",VLOOKUP(RC1,LinearIncLag,5,FALSE)-VLOOKUP(RC1,LinearIncLag,3,FALSE)) -> 61046 | E14: =IF(RC1="","",VLOOKUP(RC1,TriRepLag,5,FALSE)-VLOOKUP(RC1,TriPaidLag,5,FALSE)) -> 101931 | F14: =IF(RC1="","",VLOOKUP(RC1,CalcIncClms,12,FALSE)-VLOOKUP(RC1,LinearIncLag,3,FALSE)) -> 61046 | G14: =IF(RC1="","",VLOOKUP(RC1,CalcIncClms,12,FALSE)-VLOOKUP(RC1,LinearRepLag,5,FALSE)+VLOOKUP(RC1,TriRepLag,5,FALSE)-VLOOKUP(RC1,TriPaidLag,5,FALSE)) -> 278459 | H14: =IF(RC1="","",IF(RC[-1]=0,"",RC[-3]/RC[-1])) -> 0.36605388944153361
A15: =IF(R[-1]C1="","",IF(DATE(YEAR(R[-1]C),MONTH(R[-1]C)+1,1)>ValDat,"",DATE(YEAR(R[-1]C),MONTH(R[-1]C)+1,1))) -> 1999-02-01T00:00:00.000 | B15: =IF(RC1="","",VLOOKUP(RC1,CalcIncClms,12,FALSE)-VLOOKUP(RC1,LinearIncLag,5,FALSE)) -> 0 | C15: =IF(RC1="","",VLOOKUP(RC1,CalcIncClms,12,FALSE)-VLOOKUP(RC1,LinearRepLag,5,FALSE)) -> 220663 | D15: =IF(RC1="","",VLOOKUP(RC1,LinearIncLag,5,FALSE)-VLOOKUP(RC1,LinearIncLag,3,FALSE)) -> 39233 | E15: =IF(RC1="","",VLOOKUP(RC1,TriRepLag,5,FALSE)-VLOOKUP(RC1,TriPaidLag,5,FALSE)) -> 78473 | F15: =IF(RC1="","",VLOOKUP(RC1,CalcIncClms,12,FALSE)-VLOOKUP(RC1,LinearIncLag,3,FALSE)) -> 39233 | G15: =IF(RC1="","",VLOOKUP(RC1,CalcIncClms,12,FALSE)-VLOOKUP(RC1,LinearRepLag,5,FALSE)+VLOOKUP(RC1,TriRepLag,5,FALSE)-VLOOKUP(RC1,TriPaidLag,5,FALSE)) -> 299136 | H15: =IF(RC1="","",IF(RC[-1]=0,"",RC[-3]/RC[-1])) -> 0.2623321833547283
A16: =IF(R[-1]C1="","",IF(DATE(YEAR(R[-1]C),MONTH(R[-1]C)+1,1)>ValDat,"",DATE(YEAR(R[-1]C),MONTH(R[-1]C)+1,1))) -> 1999-03-01T00:00:00.000 | B16: =IF(RC1="","",VLOOKUP(RC1,CalcIncClms,12,FALSE)-VLOOKUP(RC1,LinearIncLag,5,FALSE)) -> 0 | C16: =IF(RC1="","",VLOOKUP(RC1,CalcIncClms,12,FALSE)-VLOOKUP(RC1,LinearRepLag,5,FALSE)) -> 196757 | D16: =IF(RC1="","",VLOOKUP(RC1,LinearIncLag,5,FALSE)-VLOOKUP(RC1,LinearIncLag,3,FALSE)) -> 17420 | E16: =IF(RC1="","",VLOOKUP(RC1,TriRepLag,5,FALSE)-VLOOKUP(RC1,TriPaidLag,5,FALSE)) -> 104112 | F16: =IF(RC1="","",VLOOKUP(RC1,CalcIncClms,12,FALSE)-VLOOKUP(RC1,LinearIncLag,3,FALSE)) -> 17420 | G16: =IF(RC1="","",VLOOKUP(RC1,CalcIncClms,12,FALSE)-VLOOKUP(RC1,LinearRepLag,5,FALSE)+VLOOKUP(RC1,TriRepLag,5,FALSE)-VLOOKUP(RC1,TriPaidLag,5,FALSE)) -> 300869 | H16: =IF(RC1="","",IF(RC[-1]=0,"",RC[-3]/RC[-1])) -> 0.3460376442903722
A17: =IF(R[-1]C1="","",IF(DATE(YEAR(R[-1]C),MONTH(R[-1]C)+1,1)>ValDat,"",DATE(YEAR(R[-1]C),MONTH(R[-1]C)+1,1))) -> 1999-04-01T00:00:00.000 | B17: =IF(RC1="","",VLOOKUP(RC1,CalcIncClms,12,FALSE)-VLOOKUP(RC1,LinearIncLag,5,FALSE)) -> 0 | C17: =IF(RC1="","",VLOOKUP(RC1,CalcIncClms,12,FALSE)-VLOOKUP(RC1,LinearRepLag,5,FALSE)) -> 227752 | D17: =IF(RC1="","",VLOOKUP(RC1,LinearIncLag,5,FALSE)-VLOOKUP(RC1,LinearIncLag,3,FALSE)) -> -66793 | E17: =IF(RC1="","",VLOOKUP(RC1,TriRepLag,5,FALSE)-VLOOKUP(RC1,TriPaidLag,5,FALSE)) -> 1475 | F17: =IF(RC1="","",VLOOKUP(RC1,CalcIncClms,12,FALSE)-VLOOKUP(RC1,LinearIncLag,3,FALSE)) -> -66793 | G17: =IF(RC1="","",VLOOKUP(RC1,CalcIncClms,12,FALSE)-VLOOKUP(RC1,LinearRepLag,5,FALSE)+VLOOKUP(RC1,TriRepLag,5,FALSE)-VLOOKUP(RC1,TriPaidLag,5,FALSE)) -> 229227 | H17: =IF(RC1="","",IF(RC[-1]=0,"",RC[-3]/RC[-1])) -> 6.434669563358592E-3
A18: =IF(R[-1]C1="","",IF(DATE(YEAR(R[-1]C),MONTH(R[-1]C)+1,1)>ValDat,"",DATE(YEAR(R[-1]C),MONTH(R[-1]C)+1,1))) -> 1999-05-01T00:00:00.000 | B18: =IF(RC1="","",VLOOKUP(RC1,CalcIncClms,12,FALSE)-VLOOKUP(RC1,LinearIncLag,5,FALSE)) -> 0 | C18: =IF(RC1="","",VLOOKUP(RC1,CalcIncClms,12,FALSE)-VLOOKUP(RC1,LinearRepLag,5,FALSE)) -> 265396 | D18: =IF(RC1="","",VLOOKUP(RC1,LinearIncLag,5,FALSE)-VLOOKUP(RC1,LinearIncLag,3,FALSE)) -> -151006 | E18: =IF(RC1="","",VLOOKUP(RC1,TriRepLag,5,FALSE)-VLOOKUP(RC1,TriPaidLag,5,FALSE)) -> -33877 | F18: =IF(RC1="","",VLOOKUP(RC1,CalcIncClms,12,FALSE)-VLOOKUP(RC1,LinearIncLag,3,FALSE)) -> -151006 | G18: =IF(RC1="","",VLOOKUP(RC1,CalcIncClms,12,FALSE)-VLOOKUP(RC1,LinearRepLag,5,FALSE)+VLOOKUP(RC1,TriRepLag,5,FALSE)-VLOOKUP(RC1,TriPaidLag,5,FALSE)) -> 231519 | H18: =IF(RC1="","",IF(RC[-1]=0,"",RC[-3]/RC[-1])) -> -0.14632492365637378
A19: =IF(R[-1]C1="","",IF(DATE(YEAR(R[-1]C),MONTH(R[-1]C)+1,1)>ValDat,"",DATE(YEAR(R[-1]C),MONTH(R[-1]C)+1,1))) -> 1999-06-01T00:00:00.000 | B19: =IF(RC1="","",VLOOKUP(RC1,CalcIncClms,12,FALSE)-VLOOKUP(RC1,LinearIncLag,5,FALSE)) -> 0 | C19: =IF(RC1="","",VLOOKUP(RC1,CalcIncClms,12,FALSE)-VLOOKUP(RC1,LinearRepLag,5,FALSE)) -> 424321 | D19: =IF(RC1="","",VLOOKUP(RC1,LinearIncLag,5,FALSE)-VLOOKUP(RC1,LinearIncLag,3,FALSE)) -> -75506 | E19: =IF(RC1="","",VLOOKUP(RC1,TriRepLag,5,FALSE)-VLOOKUP(RC1,TriPaidLag,5,FALSE)) -> -92066 | F19: =IF(RC1="","",VLOOKUP(RC1,CalcIncClms,12,FALSE)-VLOOKUP(RC1,LinearIncLag,3,FALSE)) -> -75506 | G19: =IF(RC1="","",VLOOKUP(RC1,CalcIncClms,12,FALSE)-VLOOKUP(RC1,LinearRepLag,5,FALSE)+VLOOKUP(RC1,TriRepLag,5,FALSE)-VLOOKUP(RC1,TriPaidLag,5,FALSE)) -> 332255 | H19: =IF(RC1="","",IF(RC[-1]=0,"",RC[-3]/RC[-1])) -> -0.2770944003852463
A20: =IF(R[-1]C1="","",IF(DATE(YEAR(R[-1]C),MONTH(R[-1]C)+1,1)>ValDat,"",DATE(YEAR(R[-1]C),MONTH(R[-1]C)+1,1))) -> 1999-07-01T00:00:00.000 | B20: =IF(RC1="","",VLOOKUP(RC1,CalcIncClms,12,FALSE)-VLOOKUP(RC1,LinearIncLag,5,FALSE)) -> 0 | C20: =IF(RC1="","",VLOOKUP(RC1,CalcIncClms,12,FALSE)-VLOOKUP(RC1,LinearRepLag,5,FALSE)) -> 400428 | D20: =IF(RC1="","",VLOOKUP(RC1,LinearIncLag,5,FALSE)-VLOOKUP(RC1,LinearIncLag,3,FALSE)) -> -6 | E20: =IF(RC1="","",VLOOKUP(RC1,TriRepLag,5,FALSE)-VLOOKUP(RC1,TriPaidLag,5,FALSE)) -> -99342 | F20: =IF(RC1="","",VLOOKUP(RC1,CalcIncClms,12,FALSE)-VLOOKUP(RC1,LinearIncLag,3,FALSE)) -> -6 | G20: =IF(RC1="","",VLOOKUP(RC1,CalcIncClms,12,FALSE)-VLOOKUP(RC1,LinearRepLag,5,FALSE)+VLOOKUP(RC1,TriRepLag,5,FALSE)-VLOOKUP(RC1,TriPaidLag,5,FALSE)) -> 301086 | H20: =IF(RC1="","",IF(RC[-1]=0,"",RC[-3]/RC[-1])) -> -0.32994559693908054
A21: =IF(R[-1]C1="","",IF(DATE(YEAR(R[-1]C),MONTH(R[-1]C)+1,1)>ValDat,"",DATE(YEAR(R[-1]C),MONTH(R[-1]C)+1,1))) -> 1999-08-01T00:00:00.000 | B21: =IF(RC1="","",VLOOKUP(RC1,CalcIncClms,12,FALSE)-VLOOKUP(RC1,LinearIncLag,5,FALSE)) -> 0 | C21: =IF(RC1="","",VLOOKUP(RC1,CalcIncClms,12,FALSE)-VLOOKUP(RC1,LinearRepLag,5,FALSE)) -> 308189 | D21: =IF(RC1="","",VLOOKUP(RC1,LinearIncLag,5,FALSE)-VLOOKUP(RC1,LinearIncLag,3,FALSE)) -> -95888 | E21: =IF(RC1="","",VLOOKUP(RC1,TriRepLag,5,FALSE)-VLOOKUP(RC1,TriPaidLag,5,FALSE)) -> -51304 | F21: =IF(RC1="","",VLOOKUP(RC1,CalcIncClms,12,FALSE)-VLOOKUP(RC1,LinearIncLag,3,FALSE)) -> -95888 | G21: =IF(RC1="","",VLOOKUP(RC1,CalcIncClms,12,FALSE)-VLOOKUP(RC1,LinearRepLag,5,FALSE)+VLOOKUP(RC1,TriRepLag,5,FALSE)-VLOOKUP(RC1,TriPaidLag,5,FALSE)) -> 256885 | H21: =IF(RC1="","",IF(RC[-1]=0,"",RC[-3]/RC[-1])) -> -0.19971582614788719
A22: =IF(R[-1]C1="","",IF(DATE(YEAR(R[-1]C),MONTH(R[-1]C)+1,1)>ValDat,"",DATE(YEAR(R[-1]C),MONTH(R[-1]C)+1,1))) -> 1999-09-01T00:00:00.000 | B22: =IF(RC1="","",VLOOKUP(RC1,CalcIncClms,12,FALSE)-VLOOKUP(RC1,LinearIncLag,5,FALSE)) -> 0 | C22: =IF(RC1="","",VLOOKUP(RC1,CalcIncClms,12,FALSE)-VLOOKUP(RC1,LinearRepLag,5,FALSE)) -> 299565 | D22: =IF(RC1="","",VLOOKUP(RC1,LinearIncLag,5,FALSE)-VLOOKUP(RC1,LinearIncLag,3,FALSE)) -> -191770 | E22: =IF(RC1="","",VLOOKUP(RC1,TriRepLag,5,FALSE)-VLOOKUP(RC1,TriPaidLag,5,FALSE)) -> -139163 | F22: =IF(RC1="","",VLOOKUP(RC1,CalcIncClms,12,FALSE)-VLOOKUP(RC1,LinearIncLag,3,FALSE)) -> -191770 | G22: =IF(RC1="","",VLOOKUP(RC1,CalcIncClms,12,FALSE)-VLOOKUP(RC1,LinearRepLag,5,FALSE)+VLOOKUP(RC1,TriRepLag,5,FALSE)-VLOOKUP(RC1,TriPaidLag,5,FALSE)) -> 160402 | H22: =IF(RC1="","",IF(RC[-1]=0,"",RC[-3]/RC[-1])) -> -0.8675889328063241
A23: =IF(R[-1]C1="","",IF(DATE(YEAR(R[-1]C),MONTH(R[-1]C)+1,1)>ValDat,"",DATE(YEAR(R[-1]C),MONTH(R[-1]C)+1,1))) -> 1999-10-01T00:00:00.000 | B23: =IF(RC1="","",VLOOKUP(RC1,CalcIncClms,12,FALSE)-VLOOKUP(RC1,LinearIncLag,5,FALSE)) -> 0 | C23: =IF(RC1="","",VLOOKUP(RC1,CalcIncClms,12,FALSE)-VLOOKUP(RC1,LinearRepLag,5,FALSE)) -> 324696 | D23: =IF(RC1="","",VLOOKUP(RC1,LinearIncLag,5,FALSE)-VLOOKUP(RC1,LinearIncLag,3,FALSE)) -> -115880 | E23: =IF(RC1="","",VLOOKUP(RC1,TriRepLag,5,FALSE)-VLOOKUP(RC1,TriPaidLag,5,FALSE)) -> -153359 | F23: =IF(RC1="","",VLOOKUP(RC1,CalcIncClms,12,FALSE)-VLOOKUP(RC1,LinearIncLag,3,FALSE)) -> -115880 | G23: =IF(RC1="","",VLOOKUP(RC1,CalcIncClms,12,FALSE)-VLOOKUP(RC1,LinearRepLag,5,FALSE)+VLOOKUP(RC1,TriRepLag,5,FALSE)-VLOOKUP(RC1,TriPaidLag,5,FALSE)) -> 171337 | H23: =IF(RC1="","",IF(RC[-1]=0,"",RC[-3]/RC[-1])) -> -0.89507228444527454
A24: =IF(R[-1]C1="","",IF(DATE(YEAR(R[-1]C),MONTH(R[-1]C)+1,1)>ValDat,"",DATE(YEAR(R[-1]C),MONTH(R[-1]C)+1,1))) -> 1999-11-01T00:00:00.000 | B24: =IF(RC1="","",VLOOKUP(RC1,CalcIncClms,12,FALSE)-VLOOKUP(RC1,LinearIncLag,5,FALSE)) -> 0 | C24: =IF(RC1="","",VLOOKUP(RC1,CalcIncClms,12,FALSE)-VLOOKUP(RC1,LinearRepLag,5,FALSE)) -> 328231 | D24: =IF(RC1="","",VLOOKUP(RC1,LinearIncLag,5,FALSE)-VLOOKUP(RC1,LinearIncLag,3,FALSE)) -> -39990 | E24: =IF(RC1="","",VLOOKUP(RC1,TriRepLag,5,FALSE)-VLOOKUP(RC1,TriPaidLag,5,FALSE)) -> -142719 | F24: =IF(RC1="","",VLOOKUP(RC1,CalcIncClms,12,FALSE)-VLOOKUP(RC1,LinearIncLag,3,FALSE)) -> -39990 | G24: =IF(RC1="","",VLOOKUP(RC1,CalcIncClms,12,FALSE)-VLOOKUP(RC1,LinearRepLag,5,FALSE)+VLOOKUP(RC1,TriRepLag,5,FALSE)-VLOOKUP(RC1,TriPaidLag,5,FALSE)) -> 185512 | H24: =IF(RC1="","",IF(RC[-1]=0,"",RC[-3]/RC[-1])) -> -0.76932489542455473
A25: =IF(R[-1]C1="","",IF(DATE(YEAR(R[-1]C),MONTH(R[-1]C)+1,1)>ValDat,"",DATE(YEAR(R[-1]C),MONTH(R[-1]C)+1,1))) -> 1999-12-01T00:00:00.000 | B25: =IF(RC1="","",VLOOKUP(RC1,CalcIncClms,12,FALSE)-VLOOKUP(RC1,LinearIncLag,5,FALSE)) -> 0 | C25: =IF(RC1="","",VLOOKUP(RC1,CalcIncClms,12,FALSE)-VLOOKUP(RC1,LinearRepLag,5,FALSE)) -> 240904 | D25: =IF(RC1="","",VLOOKUP(RC1,LinearIncLag,5,FALSE)-VLOOKUP(RC1,LinearIncLag,3,FALSE)) -> -147820 | E25: =IF(RC1="","",VLOOKUP(RC1,TriRepLag,5,FALSE)-VLOOKUP(RC1,TriPaidLag,5,FALSE)) -> -25199 | F25: =IF(RC1="","",VLOOKUP(RC1,CalcIncClms,12,FALSE)-VLOOKUP(RC1,LinearIncLag,3,FALSE)) -> -147820 | G25: =IF(RC1="","",VLOOKUP(RC1,CalcIncClms,12,FALSE)-VLOOKUP(RC1,LinearRepLag,5,FALSE)+VLOOKUP(RC1,TriRepLag,5,FALSE)-VLOOKUP(RC1,TriPaidLag,5,FALSE)) -> 215705 | H25: =IF(RC1="","",IF(RC[-1]=0,"",RC[-3]/RC[-1])) -> -0.1168215850351174
A26: =IF(R[-1]C1="","",IF(DATE(YEAR(R[-1]C),MONTH(R[-1]C)+1,1)>ValDat,"",DATE(YEAR(R[-1]C),MONTH(R[-1]C)+1,1))) -> 2000-01-01T00:00:00.000 | B26: =IF(RC1="","",VLOOKUP(RC1,CalcIncClms,12,FALSE)-VLOOKUP(RC1,LinearIncLag,5,FALSE)) -> 0 | C26: =IF(RC1="","",VLOOKUP(RC1,CalcIncClms,12,FALSE)-VLOOKUP(RC1,LinearRepLag,5,FALSE)) -> 250986 | D26: =IF(RC1="","",VLOOKUP(RC1,LinearIncLag,5,FALSE)-VLOOKUP(RC1,LinearIncLag,3,FALSE)) -> -255650 | E26: =IF(RC1="","",VLOOKUP(RC1,TriRepLag,5,FALSE)-VLOOKUP(RC1,TriPaidLag,5,FALSE)) -> -90578 | F26: =IF(RC1="","",VLOOKUP(RC1,CalcIncClms,12,FALSE)-VLOOKUP(RC1,LinearIncLag,3,FALSE)) -> -255650 | G26: =IF(RC1="","",VLOOKUP(RC1,CalcIncClms,12,FALSE)-VLOOKUP(RC1,LinearRepLag,5,FALSE)+VLOOKUP(RC1,TriRepLag,5,FALSE)-VLOOKUP(RC1,TriPaidLag,5,FALSE)) -> 160408 | H26: =IF(RC1="","",IF(RC[-1]=0,"",RC[-3]/RC[-1])) -> -0.56467258490848338
A27: =IF(R[-1]C1="","",IF(DATE(YEAR(R[-1]C),MONTH(R[-1]C)+1,1)>ValDat,"",DATE(YEAR(R[-1]C),MONTH(R[-1]C)+1,1))) -> 2000-02-01T00:00:00.000 | B27: =IF(RC1="","",VLOOKUP(RC1,CalcIncClms,12,FALSE)-VLOOKUP(RC1,LinearIncLag,5,FALSE)) -> 0 | C27: =IF(RC1="","",VLOOKUP(RC1,CalcIncClms,12,FALSE)-VLOOKUP(RC1,LinearRepLag,5,FALSE)) -> 342811 | D27: =IF(RC1="","",VLOOKUP(RC1,LinearIncLag,5,FALSE)-VLOOKUP(RC1,LinearIncLag,3,FALSE)) -> -362208 | E27: =IF(RC1="","",VLOOKUP(RC1,TriRepLag,5,FALSE)-VLOOKUP(RC1,TriPaidLag,5,FALSE)) -> -259825 | F27: =IF(RC1="","",VLOOKUP(RC1,CalcIncClms,12,FALSE)-VLOOKUP(RC1,LinearIncLag,3,FALSE)) -> -362208 | G27: =IF(RC1="","",VLOOKUP(RC1,CalcIncClms,12,FALSE)-VLOOKUP(RC1,LinearRepLag,5,FALSE)+VLOOKUP(RC1,TriRepLag,5,FALSE)-VLOOKUP(RC1,TriPaidLag,5,FALSE)) -> 82986 | H27: =IF(RC1="","",IF(RC[-1]=0,"",RC[-3]/RC[-1])) -> -3.1309497987612369
A28: =IF(R[-1]C1="","",IF(DATE(YEAR(R[-1]C),MONTH(R[-1]C)+1,1)>ValDat,"",DATE(YEAR(R[-1]C),MONTH(R[-1]C)+1,1))) -> 2000-03-01T00:00:00.000 | B28: =IF(RC1="","",VLOOKUP(RC1,CalcIncClms,12,FALSE)-VLOOKUP(RC1,LinearIncLag,5,FALSE)) -> 64.663560351356864 | C28: =IF(RC1="","",VLOOKUP(RC1,CalcIncClms,12,FALSE)-VLOOKUP(RC1,LinearRepLag,5,FALSE)) -> 320583.66356035136 | D28: =IF(RC1="","",VLOOKUP(RC1,LinearIncLag,5,FALSE)-VLOOKUP(RC1,LinearIncLag,3,FALSE)) -> -468766 | E28: =IF(RC1="","",VLOOKUP(RC1,TriRepLag,5,FALSE)-VLOOKUP(RC1,TriPaidLag,5,FALSE)) -> -183784 | F28: =IF(RC1="","",VLOOKUP(RC1,CalcIncClms,12,FALSE)-VLOOKUP(RC1,LinearIncLag,3,FALSE)) -> -468701.33643964864 | G28: =IF(RC1="","",VLOOKUP(RC1,CalcIncClms,12,FALSE)-VLOOKUP(RC1,LinearRepLag,5,FALSE)+VLOOKUP(RC1,TriRepLag,5,FALSE)-VLOOKUP(RC1,TriPaidLag,5,FALSE)) -> 136799.66356035136 | H28: =IF(RC1="","",IF(RC[-1]=0,"",RC[-3]/RC[-1])) -> -1.3434535964258476
A29: =IF(R[-1]C1="","",IF(DATE(YEAR(R[-1]C),MONTH(R[-1]C)+1,1)>ValDat,"",DATE(YEAR(R[-1]C),MONTH(R[-1]C)+1,1))) -> 2000-04-01T00:00:00.000 | B29: =IF(RC1="","",VLOOKUP(RC1,CalcIncClms,12,FALSE)-VLOOKUP(RC1,LinearIncLag,5,FALSE)) -> 303.54120454378426 | C29: =IF(RC1="","",VLOOKUP(RC1,CalcIncClms,12,FALSE)-VLOOKUP(RC1,LinearRepLag,5,FALSE)) -> 306233.54120454378 | D29: =IF(RC1="","",VLOOKUP(RC1,LinearIncLag,5,FALSE)-VLOOKUP(RC1,LinearIncLag,3,FALSE)) -> -479863 | E29: =IF(RC1="","",VLOOKUP(RC1,TriRepLag,5,FALSE)-VLOOKUP(RC1,TriPaidLag,5,FALSE)) -> -252553 | F29: =IF(RC1="","",VLOOKUP(RC1,CalcIncClms,12,FALSE)-VLOOKUP(RC1,LinearIncLag,3,FALSE)) -> -479559.45879545622 | G29: =IF(RC1="","",VLOOKUP(RC1,CalcIncClms,12,FALSE)-VLOOKUP(RC1,LinearRepLag,5,FALSE)+VLOOKUP(RC1,TriRepLag,5,FALSE)-VLOOKUP(RC1,TriPaidLag,5,FALSE)) -> 53680.541204543784 | H29: =IF(RC1="","",IF(RC[-1]=0,"",RC[-3]/RC[-1])) -> -4.7047401969677365
A30: =IF(R[-1]C1="","",IF(DATE(YEAR(R[-1]C),MONTH(R[-1]C)+1,1)>ValDat,"",DATE(YEAR(R[-1]C),MONTH(R[-1]C)+1,1))) -> 2000-05-01T00:00:00.000 | B30: =IF(RC1="","",VLOOKUP(RC1,CalcIncClms,12,FALSE)-VLOOKUP(RC1,LinearIncLag,5,FALSE)) -> 1276.7912535564974 | C30: =IF(RC1="","",VLOOKUP(RC1,CalcIncClms,12,FALSE)-VLOOKUP(RC1,LinearRepLag,5,FALSE)) -> 277402.7912535565 | D30: =IF(RC1="","",VLOOKUP(RC1,LinearIncLag,5,FALSE)-VLOOKUP(RC1,LinearIncLag,3,FALSE)) -> -490960 | E30: =IF(RC1="","",VLOOKUP(RC1,TriRepLag,5,FALSE)-VLOOKUP(RC1,TriPaidLag,5,FALSE)) -> -328776 | F30: =IF(RC1="","",VLOOKUP(RC1,CalcIncClms,12,FALSE)-VLOOKUP(RC1,LinearIncLag,3,FALSE)) -> -489683.2087464435 | G30: =IF(RC1="","",VLOOKUP(RC1,CalcIncClms,12,FALSE)-VLOOKUP(RC1,LinearRepLag,5,FALSE)+VLOOKUP(RC1,TriRepLag,5,FALSE)-VLOOKUP(RC1,TriPaidLag,5,FALSE)) -> -51373.208746443503 | H30: =IF(RC1="","",IF(RC[-1]=0,"",RC[-3]/RC[-1])) -> 6.3997559822027021
A31: =IF(R[-1]C1="","",IF(DATE(YEAR(R[-1]C),MONTH(R[-1]C)+1,1)>ValDat,"",DATE(YEAR(R[-1]C),MONTH(R[-1]C)+1,1))) -> 2000-06-01T00:00:00.000 | B31: =IF(RC1="","",VLOOKUP(RC1,CalcIncClms,12,FALSE)-VLOOKUP(RC1,LinearIncLag,5,FALSE)) -> 2239.9555785530247 | C31: =IF(RC1="","",VLOOKUP(RC1,CalcIncClms,12,FALSE)-VLOOKUP(RC1,LinearRepLag,5,FALSE)) -> 495003.95557855302 | D31: =IF(RC1="","",VLOOKUP(RC1,LinearIncLag,5,FALSE)-VLOOKUP(RC1,LinearIncLag,3,FALSE)) -> -457271 | E31: =IF(RC1="","",VLOOKUP(RC1,TriRepLag,5,FALSE)-VLOOKUP(RC1,TriPaidLag,5,FALSE)) -> -455167 | F31: =IF(RC1="","",VLOOKUP(RC1,CalcIncClms,12,FALSE)-VLOOKUP(RC1,LinearIncLag,3,FALSE)) -> -455031.04442144698 | G31: =IF(RC1="","",VLOOKUP(RC1,CalcIncClms,12,FALSE)-VLOOKUP(RC1,LinearRepLag,5,FALSE)+VLOOKUP(RC1,TriRepLag,5,FALSE)-VLOOKUP(RC1,TriPaidLag,5,FALSE)) -> 39836.955578553025 | H31: =IF(RC1="","",IF(RC[-1]=0,"",RC[-3]/RC[-1])) -> -11.425747610217677
A32: =IF(R[-1]C1="","",IF(DATE(YEAR(R[-1]C),MONTH(R[-1]C)+1,1)>ValDat,"",DATE(YEAR(R[-1]C),MONTH(R[-1]C)+1,1))) -> 2000-07-01T00:00:00.000 | B32: =IF(RC1="","",VLOOKUP(RC1,CalcIncClms,12,FALSE)-VLOOKUP(RC1,LinearIncLag,5,FALSE)) -> 3206.6913084033877 | C32: =IF(RC1="","",VLOOKUP(RC1,CalcIncClms,12,FALSE)-VLOOKUP(RC1,LinearRepLag,5,FALSE)) -> 654725.69130840339 | D32: =IF(RC1="","",VLOOKUP(RC1,LinearIncLag,5,FALSE)-VLOOKUP(RC1,LinearIncLag,3,FALSE)) -> -423582 | E32: =IF(RC1="","",VLOOKUP(RC1,TriRepLag,5,FALSE)-VLOOKUP(RC1,TriPaidLag,5,FALSE)) -> -560864 | F32: =IF(RC1="","",VLOOKUP(RC1,CalcIncClms,12,FALSE)-VLOOKUP(RC1,LinearIncLag,3,FALSE)) -> -420375.30869159661 | G32: =IF(RC1="","",VLOOKUP(RC1,CalcIncClms,12,FALSE)-VLOOKUP(RC1,LinearRepLag,5,FALSE)+VLOOKUP(RC1,TriRepLag,5,FALSE)-VLOOKUP(RC1,TriPaidLag,5,FALSE)) -> 93861.691308403388 | H32: =IF(RC1="","",IF(RC[-1]=0,"",RC[-3]/RC[-1])) -> -5.9754303612232711
A33: =IF(R[-1]C1="","",IF(DATE(YEAR(R[-1]C),MONTH(R[-1]C)+1,1)>ValDat,"",DATE(YEAR(R[-1]C),MONTH(R[-1]C)+1,1))) -> 2000-08-01T00:00:00.000 | B33: =IF(RC1="","",VLOOKUP(RC1,CalcIncClms,12,FALSE)-VLOOKUP(RC1,LinearIncLag,5,FALSE)) -> 4175.252225054428 | C33: =IF(RC1="","",VLOOKUP(RC1,CalcIncClms,12,FALSE)-VLOOKUP(RC1,LinearRepLag,5,FALSE)) -> 693593.25222505443 | D33: =IF(RC1="","",VLOOKUP(RC1,LinearIncLag,5,FALSE)-VLOOKUP(RC1,LinearIncLag,3,FALSE)) -> -372674 | E33: =IF(RC1="","",VLOOKUP(RC1,TriRepLag,5,FALSE)-VLOOKUP(RC1,TriPaidLag,5,FALSE)) -> -621155 | F33: =IF(RC1="","",VLOOKUP(RC1,CalcIncClms,12,FALSE)-VLOOKUP(RC1,LinearIncLag,3,FALSE)) -> -368498.74777494557 | G33: =IF(RC1="","",VLOOKUP(RC1,CalcIncClms,12,FALSE)-VLOOKUP(RC1,LinearRepLag,5,FALSE)+VLOOKUP(RC1,TriRepLag,5,FALSE)-VLOOKUP(RC1,TriPaidLag,5,FALSE)) -> 72438.252225054428 | H33: =IF(RC1="","",IF(RC[-1]=0,"",RC[-3]/RC[-1])) -> -8.5749584083029458
A34: =IF(R[-1]C1="","",IF(DATE(YEAR(R[-1]C),MONTH(R[-1]C)+1,1)>ValDat,"",DATE(YEAR(R[-1]C),MONTH(R[-1]C)+1,1))) -> 2000-09-01T00:00:00.000 | B34: =IF(RC1="","",VLOOKUP(RC1,CalcIncClms,12,FALSE)-VLOOKUP(RC1,LinearIncLag,5,FALSE)) -> 5530.0120169017464 | C34: =IF(RC1="","",VLOOKUP(RC1,CalcIncClms,12,FALSE)-VLOOKUP(RC1,LinearRepLag,5,FALSE)) -> 681309.01201690175 | D34: =IF(RC1="","",VLOOKUP(RC1,LinearIncLag,5,FALSE)-VLOOKUP(RC1,LinearIncLag,3,FALSE)) -> -321766 | E34: =IF(RC1="","",VLOOKUP(RC1,TriRepLag,5,FALSE)-VLOOKUP(RC1,TriPaidLag,5,FALSE)) -> -501181 | F34: =IF(RC1="","",VLOOKUP(RC1,CalcIncClms,12,FALSE)-VLOOKUP(RC1,LinearIncLag,3,FALSE)) -> -316235.98798309825 | G34: =IF(RC1="","",VLOOKUP(RC1,CalcIncClms,12,FALSE)-VLOOKUP(RC1,LinearRepLag,5,FALSE)+VLOOKUP(RC1,TriRepLag,5,FALSE)-VLOOKUP(RC1,TriPaidLag,5,FALSE)) -> 180128.01201690175 | H34: =IF(RC1="","",IF(RC[-1]=0,"",RC[-3]/RC[-1])) -> -2.7823601359291814
A35: =IF(R[-1]C1="","",IF(DATE(YEAR(R[-1]C),MONTH(R[-1]C)+1,1)>ValDat,"",DATE(YEAR(R[-1]C),MONTH(R[-1]C)+1,1))) -> 2000-10-01T00:00:00.000 | B35: =IF(RC1="","",VLOOKUP(RC1,CalcIncClms,12,FALSE)-VLOOKUP(RC1,LinearIncLag,5,FALSE)) -> 7289.1695117764175 | C35: =IF(RC1="","",VLOOKUP(RC1,CalcIncClms,12,FALSE)-VLOOKUP(RC1,LinearRepLag,5,FALSE)) -> 521389.16951177642 | D35: =IF(RC1="","",VLOOKUP(RC1,LinearIncLag,5,FALSE)-VLOOKUP(RC1,LinearIncLag,3,FALSE)) -> -325433 | E35: =IF(RC1="","",VLOOKUP(RC1,TriRepLag,5,FALSE)-VLOOKUP(RC1,TriPaidLag,5,FALSE)) -> -496821 | F35: =IF(RC1="","",VLOOKUP(RC1,CalcIncClms,12,FALSE)-VLOOKUP(RC1,LinearIncLag,3,FALSE)) -> -318143.83048822358 | G35: =IF(RC1="","",VLOOKUP(RC1,CalcIncClms,12,FALSE)-VLOOKUP(RC1,LinearRepLag,5,FALSE)+VLOOKUP(RC1,TriRepLag,5,FALSE)-VLOOKUP(RC1,TriPaidLag,5,FALSE)) -> 24568.169511776417 | H35: =IF(RC1="","",IF(RC[-1]=0,"",RC[-3]/RC[-1])) -> -20.222141489289857
A36: =IF(R[-1]C1="","",IF(DATE(YEAR(R[-1]C),MONTH(R[-1]C)+1,1)>ValDat,"",DATE(YEAR(R[-1]C),MONTH(R[-1]C)+1,1))) -> 2000-11-01T00:00:00.000 | B36: =IF(RC1="","",VLOOKUP(RC1,CalcIncClms,12,FALSE)-VLOOKUP(RC1,LinearIncLag,5,FALSE)) -> 9303.8605816233903 | C36: =IF(RC1="","",VLOOKUP(RC1,CalcIncClms,12,FALSE)-VLOOKUP(RC1,LinearRepLag,5,FALSE)) -> 504367.86058162339 | D36: =IF(RC1="","",VLOOKUP(RC1,LinearIncLag,5,FALSE)-VLOOKUP(RC1,LinearIncLag,3,FALSE)) -> -329100 | E36: =IF(RC1="","",VLOOKUP(RC1,TriRepLag,5,FALSE)-VLOOKUP(RC1,TriPaidLag,5,FALSE)) -> -406321 | F36: =IF(RC1="","",VLOOKUP(RC1,CalcIncClms,12,FALSE)-VLOOKUP(RC1,LinearIncLag,3,FALSE)) -> -319796.13941837661 | G36: =IF(RC1="","",VLOOKUP(RC1,CalcIncClms,12,FALSE)-VLOOKUP(RC1,LinearRepLag,5,FALSE)+VLOOKUP(RC1,TriRepLag,5,FALSE)-VLOOKUP(RC1,TriPaidLag,5,FALSE)) -> 98046.86058162339 | H36: =IF(RC1="","",IF(RC[-1]=0,"",RC[-3]/RC[-1])) -> -4.1441510476690926
A37: =IF(R[-1]C1="","",IF(DATE(YEAR(R[-1]C),MONTH(R[-1]C)+1,1)>ValDat,"",DATE(YEAR(R[-1]C),MONTH(R[-1]C)+1,1))) -> 2000-12-01T00:00:00.000 | B37: =IF(RC1="","",VLOOKUP(RC1,CalcIncClms,12,FALSE)-VLOOKUP(RC1,LinearIncLag,5,FALSE)) -> 12702.781662118621 | C37: =IF(RC1="","",VLOOKUP(RC1,CalcIncClms,12,FALSE)-VLOOKUP(RC1,LinearRepLag,5,FALSE)) -> 374978.78166211862 | D37: =IF(RC1="","",VLOOKUP(RC1,LinearIncLag,5,FALSE)-VLOOKUP(RC1,LinearIncLag,3,FALSE)) -> -391443 | E37: =IF(RC1="","",VLOOKUP(RC1,TriRepLag,5,FALSE)-VLOOKUP(RC1,TriPaidLag,5,FALSE)) -> -368407 | F37: =IF(RC1="","",VLOOKUP(RC1,CalcIncClms,12,FALSE)-VLOOKUP(RC1,LinearIncLag,3,FALSE)) -> -378740.21833788138 | G37: =IF(RC1="","",VLOOKUP(RC1,CalcIncClms,12,FALSE)-VLOOKUP(RC1,LinearRepLag,5,FALSE)+VLOOKUP(RC1,TriRepLag,5,FALSE)-VLOOKUP(RC1,TriPaidLag,5,FALSE)) -> 6571.7816621186212 | H37: =IF(RC1="","",IF(RC[-1]=0,"",RC[-3]/RC[-1])) -> -56.058922669873418
A38: =IF(R[-1]C1="","",IF(DATE(YEAR(R[-1]C),MONTH(R[-1]C)+1,1)>ValDat,"",DATE(YEAR(R[-1]C),MONTH(R[-1]C)+1,1))) -> 2001-01-01T00:00:00.000 | B38: =IF(RC1="","",VLOOKUP(RC1,CalcIncClms,12,FALSE)-VLOOKUP(RC1,LinearIncLag,5,FALSE)) -> 22393.688876678236 | C38: =IF(RC1="","",VLOOKUP(RC1,CalcIncClms,12,FALSE)-VLOOKUP(RC1,LinearRepLag,5,FALSE)) -> 301566.68887667824 | D38: =IF(RC1="","",VLOOKUP(RC1,LinearIncLag,5,FALSE)-VLOOKUP(RC1,LinearIncLag,3,FALSE)) -> -453786 | E38: =IF(RC1="","",VLOOKUP(RC1,TriRepLag,5,FALSE)-VLOOKUP(RC1,TriPaidLag,5,FALSE)) -> -411349 | F38: =IF(RC1="","",VLOOKUP(RC1,CalcIncClms,12,FALSE)-VLOOKUP(RC1,LinearIncLag,3,FALSE)) -> -431392.31112332176 | G38: =IF(RC1="","",VLOOKUP(RC1,CalcIncClms,12,FALSE)-VLOOKUP(RC1,LinearRepLag,5,FALSE)+VLOOKUP(RC1,TriRepLag,5,FALSE)-VLOOKUP(RC1,TriPaidLag,5,FALSE)) -> -109782.31112332176 | H38: =IF(RC1="","",IF(RC[-1]=0,"",RC[-3]/RC[-1])) -> 3.7469515424749922
A39: =IF(R[-1]C1="","",IF(DATE(YEAR(R[-1]C),MONTH(R[-1]C)+1,1)>ValDat,"",DATE(YEAR(R[-1]C),MONTH(R[-1]C)+1,1))) -> 2001-02-01T00:00:00.000 | B39: =IF(RC1="","",VLOOKUP(RC1,CalcIncClms,12,FALSE)-VLOOKUP(RC1,LinearIncLag,5,FALSE)) -> 38914.386794555932 | C39: =IF(RC1="","",VLOOKUP(RC1,CalcIncClms,12,FALSE)-VLOOKUP(RC1,LinearRepLag,5,FALSE)) -> 321787.38679455593 | D39: =IF(RC1="","",VLOOKUP(RC1,LinearIncLag,5,FALSE)-VLOOKUP(RC1,LinearIncLag,3,FALSE)) -> -396068 | E39: =IF(RC1="","",VLOOKUP(RC1,TriRepLag,5,FALSE)-VLOOKUP(RC1,TriPaidLag,5,FALSE)) -> -433759 | F39: =IF(RC1="","",VLOOKUP(RC1,CalcIncClms,12,FALSE)-VLOOKUP(RC1,LinearIncLag,3,FALSE)) -> -357153.61320544407 | G39: =IF(RC1="","",VLOOKUP(RC1,CalcIncClms,12,FALSE)-VLOOKUP(RC1,LinearRepLag,5,FALSE)+VLOOKUP(RC1,TriRepLag,5,FALSE)-VLOOKUP(RC1,TriPaidLag,5,FALSE)) -> -111971.61320544407 | H39: =IF(RC1="","",IF(RC[-1]=0,"",RC[-3]/RC[-1])) -> 3.8738300501587362
A40: =IF(R[-1]C1="","",IF(DATE(YEAR(R[-1]C),MONTH(R[-1]C)+1,1)>ValDat,"",DATE(YEAR(R[-1]C),MONTH(R[-1]C)+1,1))) -> 2001-03-01T00:00:00.000 | B40: =IF(RC1="","",VLOOKUP(RC1,CalcIncClms,12,FALSE)-VLOOKUP(RC1,LinearIncLag,5,FALSE)) -> 61210.253782434389 | C40: =IF(RC1="","",VLOOKUP(RC1,CalcIncClms,12,FALSE)-VLOOKUP(RC1,LinearRepLag,5,FALSE)) -> 406085.25378243439 | D40: =IF(RC1="","",VLOOKUP(RC1,LinearIncLag,5,FALSE)-VLOOKUP(RC1,LinearIncLag,3,FALSE)) -> -338350 | E40: =IF(RC1="","",VLOOKUP(RC1,TriRepLag,5,FALSE)-VLOOKUP(RC1,TriPaidLag,5,FALSE)) -> -458577 | F40: =IF(RC1="","",VLOOKUP(RC1,CalcIncClms,12,FALSE)-VLOOKUP(RC1,LinearIncLag,3,FALSE)) -> -277139.74621756561 | G40: =IF(RC1="","",VLOOKUP(RC1,CalcIncClms,12,FALSE)-VLOOKUP(RC1,LinearRepLag,5,FALSE)+VLOOKUP(RC1,TriRepLag,5,FALSE)-VLOOKUP(RC1,TriPaidLag,5,FALSE)) -> -52491.746217565611 | H40: =IF(RC1="","",IF(RC[-1]=0,"",RC[-3]/RC[-1])) -> 8.7361734566670552
A41: =IF(R[-1]C1="","",IF(DATE(YEAR(R[-1]C),MONTH(R[-1]C)+1,1)>ValDat,"",DATE(YEAR(R[-1]C),MONTH(R[-1]C)+1,1))) -> 2001-04-01T00:00:00.000 | B41: =IF(RC1="","",VLOOKUP(RC1,CalcIncClms,12,FALSE)-VLOOKUP(RC1,LinearIncLag,5,FALSE)) -> 97031.700621030293 | C41: =IF(RC1="","",VLOOKUP(RC1,CalcIncClms,12,FALSE)-VLOOKUP(RC1,LinearRepLag,5,FALSE)) -> 449815.70062103029 | D41: =IF(RC1="","",VLOOKUP(RC1,LinearIncLag,5,FALSE)-VLOOKUP(RC1,LinearIncLag,3,FALSE)) -> -268314 | E41: =IF(RC1="","",VLOOKUP(RC1,TriRepLag,5,FALSE)-VLOOKUP(RC1,TriPaidLag,5,FALSE)) -> -448975 | F41: =IF(RC1="","",VLOOKUP(RC1,CalcIncClms,12,FALSE)-VLOOKUP(RC1,LinearIncLag,3,FALSE)) -> -171282.29937896971 | G41: =IF(RC1="","",VLOOKUP(RC1,CalcIncClms,12,FALSE)-VLOOKUP(RC1,LinearRepLag,5,FALSE)+VLOOKUP(RC1,TriRepLag,5,FALSE)-VLOOKUP(RC1,TriPaidLag,5,FALSE)) -> 840.70062103029341 | H41: =IF(RC1="","",IF(RC[-1]=0,"",RC[-3]/RC[-1])) -> -534.04861227504887
A42: =IF(R[-1]C1="","",IF(DATE(YEAR(R[-1]C),MONTH(R[-1]C)+1,1)>ValDat,"",DATE(YEAR(R[-1]C),MONTH(R[-1]C)+1,1))) -> 2001-05-01T00:00:00.000 | B42: =IF(RC1="","",VLOOKUP(RC1,CalcIncClms,12,FALSE)-VLOOKUP(RC1,LinearIncLag,5,FALSE)) -> 190774.67866838258 | C42: =IF(RC1="","",VLOOKUP(RC1,CalcIncClms,12,FALSE)-VLOOKUP(RC1,LinearRepLag,5,FALSE)) -> 524486.67866838258 | D42: =IF(RC1="","",VLOOKUP(RC1,LinearIncLag,5,FALSE)-VLOOKUP(RC1,LinearIncLag,3,FALSE)) -> -198278 | E42: =IF(RC1="","",VLOOKUP(RC1,TriRepLag,5,FALSE)-VLOOKUP(RC1,TriPaidLag,5,FALSE)) -> -383443 | F42: =IF(RC1="","",VLOOKUP(RC1,CalcIncClms,12,FALSE)-VLOOKUP(RC1,LinearIncLag,3,FALSE)) -> -7503.3213316174224 | G42: =IF(RC1="","",VLOOKUP(RC1,CalcIncClms,12,FALSE)-VLOOKUP(RC1,LinearRepLag,5,FALSE)+VLOOKUP(RC1,TriRepLag,5,FALSE)-VLOOKUP(RC1,TriPaidLag,5,FALSE)) -> 141043.67866838258 | H42: =IF(RC1="","",IF(RC[-1]=0,"",RC[-3]/RC[-1])) -> -2.7186117351741728
A43: =IF(R[-1]C1="","",IF(DATE(YEAR(R[-1]C),MONTH(R[-1]C)+1,1)>ValDat,"",DATE(YEAR(R[-1]C),MONTH(R[-1]C)+1,1))) -> 2001-06-01T00:00:00.000 | B43: =IF(RC1="","",VLOOKUP(RC1,CalcIncClms,12,FALSE)-VLOOKUP(RC1,LinearIncLag,5,FALSE)) -> 333707.22180536017 | C43: =IF(RC1="","",VLOOKUP(RC1,CalcIncClms,12,FALSE)-VLOOKUP(RC1,LinearRepLag,5,FALSE)) -> 492342.22180536017 | D43: =IF(RC1="","",VLOOKUP(RC1,LinearIncLag,5,FALSE)-VLOOKUP(RC1,LinearIncLag,3,FALSE)) -> -198278 | E43: =IF(RC1="","",VLOOKUP(RC1,TriRepLag,5,FALSE)-VLOOKUP(RC1,TriPaidLag,5,FALSE)) -> -257227 | F43: =IF(RC1="","",VLOOKUP(RC1,CalcIncClms,12,FALSE)-VLOOKUP(RC1,LinearIncLag,3,FALSE)) -> 135429.22180536017 | G43: =IF(RC1="","",VLOOKUP(RC1,CalcIncClms,12,FALSE)-VLOOKUP(RC1,LinearRepLag,5,FALSE)+VLOOKUP(RC1,TriRepLag,5,FALSE)-VLOOKUP(RC1,TriPaidLag,5,FALSE)) -> 235115.22180536017 | H43: =IF(RC1="","",IF(RC[-1]=0,"",RC[-3]/RC[-1])) -> -1.0940465616171167
A44: =IF(R[-1]C1="","",IF(DATE(YEAR(R[-1]C),MONTH(R[-1]C)+1,1)>ValDat,"",DATE(YEAR(R[-1]C),MONTH(R[-1]C)+1,1))) -> 2001-07-01T00:00:00.000 | B44: =IF(RC1="","",VLOOKUP(RC1,CalcIncClms,12,FALSE)-VLOOKUP(RC1,LinearIncLag,5,FALSE)) -> 516490.02031781059 | C44: =IF(RC1="","",VLOOKUP(RC1,CalcIncClms,12,FALSE)-VLOOKUP(RC1,LinearRepLag,5,FALSE)) -> 617033.02031781059 | D44: =IF(RC1="","",VLOOKUP(RC1,LinearIncLag,5,FALSE)-VLOOKUP(RC1,LinearIncLag,3,FALSE)) -> -198278 | E44: =IF(RC1="","",VLOOKUP(RC1,TriRepLag,5,FALSE)-VLOOKUP(RC1,TriPaidLag,5,FALSE)) -> -232483 | F44: =IF(RC1="","",VLOOKUP(RC1,CalcIncClms,12,FALSE)-VLOOKUP(RC1,LinearIncLag,3,FALSE)) -> 318212.02031781059 | G44: =IF(RC1="","",VLOOKUP(RC1,CalcIncClms,12,FALSE)-VLOOKUP(RC1,LinearRepLag,5,FALSE)+VLOOKUP(RC1,TriRepLag,5,FALSE)-VLOOKUP(RC1,TriPaidLag,5,FALSE)) -> 384550.02031781059 | H44: =IF(RC1="","",IF(RC[-1]=0,"",RC[-3]/RC[-1])) -> -0.60455854301571721
B45: =OFFSET(RC,MEP-MNR-1,0,1) -> 516490.02031781059 | D45: =OFFSET(RC,MEP-MNR-1,0,1) -> -198278 | F45: =OFFSET(RC,MEP-MNR-1,0,1) -> 318212.02031781059 | G45: =OFFSET(RC,MEP-MNR-1,0,1) -> 384550.02031781059
A48: SUMMARY:
B49: ITEM DESCRIPTION | F49: VALUE
B50: (A) Estimated Incurred Claims …………………………………………………………………………………………………. | F50: =TotalIncurredClaims -> 6637916.0203178106
B51: (B) Incurred and Reported Claims …………………………………………………………………………………………………. | F51: =TotalIncRepClms -> 6121426
B52: (C) Incurred Paid Claims …………………………………………………………………………………………………. | F52: =TotalIncPaidClms -> 6319704
B53: ="(D) Incurred But Not "&IF(Basis="ibnp","Paid (IBNP)","Reported (IBNR)")&" Claim Liability = (A - B)  …………………………………………………………………………………………………." -> (D) Incurred But Not Reported (IBNR) Claim Liability = (A - B) …………………………………………………………………………………………………. | F53: =TotalIncurredClaims-TotalIncRepClms -> 516490.02031781059
B54: ="         Trended "&IF(Basis="ibnp","IBNP","IBNR")&" (for further allocation purposes only)  …………………………………………………………………………………………………." -> Trended IBNR (for further allocation purposes only) …………………………………………………………………………………………………. | F54: =SUMPRODUCT(IncurredClaims!R9C[4]:R[-10]C[4],IncurredClaims!R9C[-1]:R[-10]C[-1])-SUMPRODUCT(IncurredClaims!R9C[-4]:R[-10]C[-4],IncurredClaims!R9C[-1]:R[-10]C[-1]) -> 520362.66145624034
B55: (E) Pending Claim Liability = (A - C - D) …………………………………………………………………………………………………. | F55: =TotalIncurredClaims-TotalIncPaidClms-IBNR -> -198278
B56: (F) Claim Liability Remaining as of Runout Date = (D + E) …………………………………………………………………………………………………. | F56: =IBNR+PendingClms -> 318212.02031781059
B57: (G) Restated Claim Liability as of Valuation Date …………………………………………………………………………………………………. | F57: =R[-12]C[1] -> 384550.02031781059
A61: * Use restated liabilities to validate liabilities estimated on prior valuation dates

Sheet: IntDiscAdjExp
A1: =title1&" - Interest Discount and Adjudication Expense" -> BLOCK CLAIM LIABILITY REPORT - Interest Discount and Adjudication Expense
A2: The Millennium-2000 Sample Life Insurance Company
A3: Arvind
A4: Experience Period: 01-Aug-1998 to 31-Jul-2001. Runout Date: 31-Jul-2001
A8: Incurred Month | B8: Duration | C8: Claim Liability Factors | D8: ="Monthly Discount Factors at  "&TEXT(DisRat,"###.##%") -> Monthly Discount Factors at 4.% | E8: Present Value of Discount Factors
A9: =ExpDat -> 1998-08-01T00:00:00.000 | B9: =IF(RC1="","",ROUND(DAYS360(RC1,ValDat,0)/30,0)) -> 36 | C9: =IF(RC1="","",1-INDEX(PaidCmpFac,1,RC2)) -> 0 | D9: =IF(RC1="","",(1+DisRat)^-((RC[-2]-0.5)/12)) -> 0.89045034102608889 | E9: =IF(RC1="","",RC[-2]*RC[-1]) -> 0
A10: =IF(R[-1]C1="","",IF(DATE(YEAR(R[-1]C),MONTH(R[-1]C)+1,1)>ValDat,"",DATE(YEAR(R[-1]C),MONTH(R[-1]C)+1,1))) -> 1998-09-01T00:00:00.000 | B10: =IF(RC1="","",ROUND(DAYS360(RC1,ValDat,0)/30,0)) -> 35 | C10: =IF(RC1="","",1-INDEX(PaidCmpFac,1,RC2)) -> 0 | D10: =IF(RC1="","",(1+DisRat)^-((RC[-2]-0.5)/12)) -> 0.89336544373157867 | E10: =IF(RC1="","",RC[-2]*RC[-1]) -> 0
A11: =IF(R[-1]C1="","",IF(DATE(YEAR(R[-1]C),MONTH(R[-1]C)+1,1)>ValDat,"",DATE(YEAR(R[-1]C),MONTH(R[-1]C)+1,1))) -> 1998-10-01T00:00:00.000 | B11: =IF(RC1="","",ROUND(DAYS360(RC1,ValDat,0)/30,0)) -> 34 | C11: =IF(RC1="","",1-INDEX(PaidCmpFac,1,RC2)) -> 0 | D11: =IF(RC1="","",(1+DisRat)^-((RC[-2]-0.5)/12)) -> 0.89629008972476443 | E11: =IF(RC1="","",RC[-2]*RC[-1]) -> 0
A12: =IF(R[-1]C1="","",IF(DATE(YEAR(R[-1]C),MONTH(R[-1]C)+1,1)>ValDat,"",DATE(YEAR(R[-1]C),MONTH(R[-1]C)+1,1))) -> 1998-11-01T00:00:00.000 | B12: =IF(RC1="","",ROUND(DAYS360(RC1,ValDat,0)/30,0)) -> 33 | C12: =IF(RC1="","",1-INDEX(PaidCmpFac,1,RC2)) -> 0 | D12: =IF(RC1="","",(1+DisRat)^-((RC[-2]-0.5)/12)) -> 0.89922431024788707 | E12: =IF(RC1="","",RC[-2]*RC[-1]) -> 0
A13: =IF(R[-1]C1="","",IF(DATE(YEAR(R[-1]C),MONTH(R[-1]C)+1,1)>ValDat,"",DATE(YEAR(R[-1]C),MONTH(R[-1]C)+1,1))) -> 1998-12-01T00:00:00.000 | B13: =IF(RC1="","",ROUND(DAYS360(RC1,ValDat,0)/30,0)) -> 32 | C13: =IF(RC1="","",1-INDEX(PaidCmpFac,1,RC2)) -> 0 | D13: =IF(RC1="","",(1+DisRat)^-((RC[-2]-0.5)/12)) -> 0.90216813664546591 | E13: =IF(RC1="","",RC[-2]*RC[-1]) -> 0
A14: =IF(R[-1]C1="","",IF(DATE(YEAR(R[-1]C),MONTH(R[-1]C)+1,1)>ValDat,"",DATE(YEAR(R[-1]C),MONTH(R[-1]C)+1,1))) -> 1999-01-01T00:00:00.000 | B14: =IF(RC1="","",ROUND(DAYS360(RC1,ValDat,0)/30,0)) -> 31 | C14: =IF(RC1="","",1-INDEX(PaidCmpFac,1,RC2)) -> 0 | D14: =IF(RC1="","",(1+DisRat)^-((RC[-2]-0.5)/12)) -> 0.90512160036463429 | E14: =IF(RC1="","",RC[-2]*RC[-1]) -> 0
A15: =IF(R[-1]C1="","",IF(DATE(YEAR(R[-1]C),MONTH(R[-1]C)+1,1)>ValDat,"",DATE(YEAR(R[-1]C),MONTH(R[-1]C)+1,1))) -> 1999-02-01T00:00:00.000 | B15: =IF(RC1="","",ROUND(DAYS360(RC1,ValDat,0)/30,0)) -> 30 | C15: =IF(RC1="","",1-INDEX(PaidCmpFac,1,RC2)) -> 0 | D15: =IF(RC1="","",(1+DisRat)^-((RC[-2]-0.5)/12)) -> 0.90808473295547554 | E15: =IF(RC1="","",RC[-2]*RC[-1]) -> 0
A16: =IF(R[-1]C1="","",IF(DATE(YEAR(R[-1]C),MONTH(R[-1]C)+1,1)>ValDat,"",DATE(YEAR(R[-1]C),MONTH(R[-1]C)+1,1))) -> 1999-03-01T00:00:00.000 | B16: =IF(RC1="","",ROUND(DAYS360(RC1,ValDat,0)/30,0)) -> 29 | C16: =IF(RC1="","",1-INDEX(PaidCmpFac,1,RC2)) -> 0 | D16: =IF(RC1="","",(1+DisRat)^-((RC[-2]-0.5)/12)) -> 0.91105756607135935 | E16: =IF(RC1="","",RC[-2]*RC[-1]) -> 0
A17: =IF(R[-1]C1="","",IF(DATE(YEAR(R[-1]C),MONTH(R[-1]C)+1,1)>ValDat,"",DATE(YEAR(R[-1]C),MONTH(R[-1]C)+1,1))) -> 1999-04-01T00:00:00.000 | B17: =IF(RC1="","",ROUND(DAYS360(RC1,ValDat,0)/30,0)) -> 28 | C17: =IF(RC1="","",1-INDEX(PaidCmpFac,1,RC2)) -> 0 | D17: =IF(RC1="","",(1+DisRat)^-((RC[-2]-0.5)/12)) -> 0.91404013146928031 | E17: =IF(RC1="","",RC[-2]*RC[-1]) -> 0
A18: =IF(R[-1]C1="","",IF(DATE(YEAR(R[-1]C),MONTH(R[-1]C)+1,1)>ValDat,"",DATE(YEAR(R[-1]C),MONTH(R[-1]C)+1,1))) -> 1999-05-01T00:00:00.000 | B18: =IF(RC1="","",ROUND(DAYS360(RC1,ValDat,0)/30,0)) -> 27 | C18: =IF(RC1="","",1-INDEX(PaidCmpFac,1,RC2)) -> 0 | D18: =IF(RC1="","",(1+DisRat)^-((RC[-2]-0.5)/12)) -> 0.91703246101019775 | E18: =IF(RC1="","",RC[-2]*RC[-1]) -> 0
A19: =IF(R[-1]C1="","",IF(DATE(YEAR(R[-1]C),MONTH(R[-1]C)+1,1)>ValDat,"",DATE(YEAR(R[-1]C),MONTH(R[-1]C)+1,1))) -> 1999-06-01T00:00:00.000 | B19: =IF(RC1="","",ROUND(DAYS360(RC1,ValDat,0)/30,0)) -> 26 | C19: =IF(RC1="","",1-INDEX(PaidCmpFac,1,RC2)) -> 0 | D19: =IF(RC1="","",(1+DisRat)^-((RC[-2]-0.5)/12)) -> 0.92003458665937443 | E19: =IF(RC1="","",RC[-2]*RC[-1]) -> 0
A20: =IF(R[-1]C1="","",IF(DATE(YEAR(R[-1]C),MONTH(R[-1]C)+1,1)>ValDat,"",DATE(YEAR(R[-1]C),MONTH(R[-1]C)+1,1))) -> 1999-07-01T00:00:00.000 | B20: =IF(RC1="","",ROUND(DAYS360(RC1,ValDat,0)/30,0)) -> 25 | C20: =IF(RC1="","",1-INDEX(PaidCmpFac,1,RC2)) -> 0 | D20: =IF(RC1="","",(1+DisRat)^-((RC[-2]-0.5)/12)) -> 0.92304654048672019 | E20: =IF(RC1="","",RC[-2]*RC[-1]) -> 0
A21: =IF(R[-1]C1="","",IF(DATE(YEAR(R[-1]C),MONTH(R[-1]C)+1,1)>ValDat,"",DATE(YEAR(R[-1]C),MONTH(R[-1]C)+1,1))) -> 1999-08-01T00:00:00.000 | B21: =IF(RC1="","",ROUND(DAYS360(RC1,ValDat,0)/30,0)) -> 24 | C21: =IF(RC1="","",1-INDEX(PaidCmpFac,1,RC2)) -> 0 | D21: =IF(RC1="","",(1+DisRat)^-((RC[-2]-0.5)/12)) -> 0.92606835466713266 | E21: =IF(RC1="","",RC[-2]*RC[-1]) -> 0
A22: =IF(R[-1]C1="","",IF(DATE(YEAR(R[-1]C),MONTH(R[-1]C)+1,1)>ValDat,"",DATE(YEAR(R[-1]C),MONTH(R[-1]C)+1,1))) -> 1999-09-01T00:00:00.000 | B22: =IF(RC1="","",ROUND(DAYS360(RC1,ValDat,0)/30,0)) -> 23 | C22: =IF(RC1="","",1-INDEX(PaidCmpFac,1,RC2)) -> 0 | D22: =IF(RC1="","",(1+DisRat)^-((RC[-2]-0.5)/12)) -> 0.92910006148084179 | E22: =IF(RC1="","",RC[-2]*RC[-1]) -> 0
A23: =IF(R[-1]C1="","",IF(DATE(YEAR(R[-1]C),MONTH(R[-1]C)+1,1)>ValDat,"",DATE(YEAR(R[-1]C),MONTH(R[-1]C)+1,1))) -> 1999-10-01T00:00:00.000 | B23: =IF(RC1="","",ROUND(DAYS360(RC1,ValDat,0)/30,0)) -> 22 | C23: =IF(RC1="","",1-INDEX(PaidCmpFac,1,RC2)) -> 0 | D23: =IF(RC1="","",(1+DisRat)^-((RC[-2]-0.5)/12)) -> 0.93214169331375507 | E23: =IF(RC1="","",RC[-2]*RC[-1]) -> 0
A24: =IF(R[-1]C1="","",IF(DATE(YEAR(R[-1]C),MONTH(R[-1]C)+1,1)>ValDat,"",DATE(YEAR(R[-1]C),MONTH(R[-1]C)+1,1))) -> 1999-11-01T00:00:00.000 | B24: =IF(RC1="","",ROUND(DAYS360(RC1,ValDat,0)/30,0)) -> 21 | C24: =IF(RC1="","",1-INDEX(PaidCmpFac,1,RC2)) -> 0 | D24: =IF(RC1="","",(1+DisRat)^-((RC[-2]-0.5)/12)) -> 0.93519328265780244 | E24: =IF(RC1="","",RC[-2]*RC[-1]) -> 0
A25: =IF(R[-1]C1="","",IF(DATE(YEAR(R[-1]C),MONTH(R[-1]C)+1,1)>ValDat,"",DATE(YEAR(R[-1]C),MONTH(R[-1]C)+1,1))) -> 1999-12-01T00:00:00.000 | B25: =IF(RC1="","",ROUND(DAYS360(RC1,ValDat,0)/30,0)) -> 20 | C25: =IF(RC1="","",1-INDEX(PaidCmpFac,1,RC2)) -> 0 | D25: =IF(RC1="","",(1+DisRat)^-((RC[-2]-0.5)/12)) -> 0.93825486211128462 | E25: =IF(RC1="","",RC[-2]*RC[-1]) -> 0
A26: =IF(R[-1]C1="","",IF(DATE(YEAR(R[-1]C),MONTH(R[-1]C)+1,1)>ValDat,"",DATE(YEAR(R[-1]C),MONTH(R[-1]C)+1,1))) -> 2000-01-01T00:00:00.000 | B26: =IF(RC1="","",ROUND(DAYS360(RC1,ValDat,0)/30,0)) -> 19 | C26: =IF(RC1="","",1-INDEX(PaidCmpFac,1,RC2)) -> 0 | D26: =IF(RC1="","",(1+DisRat)^-((RC[-2]-0.5)/12)) -> 0.94132646437921963 | E26: =IF(RC1="","",RC[-2]*RC[-1]) -> 0
A27: =IF(R[-1]C1="","",IF(DATE(YEAR(R[-1]C),MONTH(R[-1]C)+1,1)>ValDat,"",DATE(YEAR(R[-1]C),MONTH(R[-1]C)+1,1))) -> 2000-02-01T00:00:00.000 | B27: =IF(RC1="","",ROUND(DAYS360(RC1,ValDat,0)/30,0)) -> 18 | C27: =IF(RC1="","",1-INDEX(PaidCmpFac,1,RC2)) -> 0 | D27: =IF(RC1="","",(1+DisRat)^-((RC[-2]-0.5)/12)) -> 0.94440812227369464 | E27: =IF(RC1="","",RC[-2]*RC[-1]) -> 0
A28: =IF(R[-1]C1="","",IF(DATE(YEAR(R[-1]C),MONTH(R[-1]C)+1,1)>ValDat,"",DATE(YEAR(R[-1]C),MONTH(R[-1]C)+1,1))) -> 2000-03-01T00:00:00.000 | B28: =IF(RC1="","",ROUND(DAYS360(RC1,ValDat,0)/30,0)) -> 17 | C28: =IF(RC1="","",1-INDEX(PaidCmpFac,1,RC2)) -> 2.9999999999974492E-5 | D28: =IF(RC1="","",(1+DisRat)^-((RC[-2]-0.5)/12)) -> 0.94749986871421366 | E28: =IF(RC1="","",RC[-2]*RC[-1]) -> 2.842499606140224E-5
A29: =IF(R[-1]C1="","",IF(DATE(YEAR(R[-1]C),MONTH(R[-1]C)+1,1)>ValDat,"",DATE(YEAR(R[-1]C),MONTH(R[-1]C)+1,1))) -> 2000-04-01T00:00:00.000 | B29: =IF(RC1="","",ROUND(DAYS360(RC1,ValDat,0)/30,0)) -> 16 | C29: =IF(RC1="","",1-INDEX(PaidCmpFac,1,RC2)) -> 1.2100000000000444E-3 | D29: =IF(RC1="","",(1+DisRat)^-((RC[-2]-0.5)/12)) -> 0.9506017367280517 | E29: =IF(RC1="","",RC[-2]*RC[-1]) -> 1.1502281014409848E-3
A30: =IF(R[-1]C1="","",IF(DATE(YEAR(R[-1]C),MONTH(R[-1]C)+1,1)>ValDat,"",DATE(YEAR(R[-1]C),MONTH(R[-1]C)+1,1))) -> 2000-05-01T00:00:00.000 | B30: =IF(RC1="","",ROUND(DAYS360(RC1,ValDat,0)/30,0)) -> 15 | C30: =IF(RC1="","",1-INDEX(PaidCmpFac,1,RC2)) -> 3.2600000000000406E-3 | D30: =IF(RC1="","",(1+DisRat)^-((RC[-2]-0.5)/12)) -> 0.95371375945060555 | E30: =IF(RC1="","",RC[-2]*RC[-1]) -> 3.109106855809013E-3
A31: =IF(R[-1]C1="","",IF(DATE(YEAR(R[-1]C),MONTH(R[-1]C)+1,1)>ValDat,"",DATE(YEAR(R[-1]C),MONTH(R[-1]C)+1,1))) -> 2000-06-01T00:00:00.000 | B31: =IF(RC1="","",ROUND(DAYS360(RC1,ValDat,0)/30,0)) -> 14 | C31: =IF(RC1="","",1-INDEX(PaidCmpFac,1,RC2)) -> 5.4600000000000204E-3 | D31: =IF(RC1="","",(1+DisRat)^-((RC[-2]-0.5)/12)) -> 0.9568359701257495 | E31: =IF(RC1="","",RC[-2]*RC[-1]) -> 5.2243243968866119E-3
A32: =IF(R[-1]C1="","",IF(DATE(YEAR(R[-1]C),MONTH(R[-1]C)+1,1)>ValDat,"",DATE(YEAR(R[-1]C),MONTH(R[-1]C)+1,1))) -> 2000-07-01T00:00:00.000 | B32: =IF(RC1="","",ROUND(DAYS360(RC1,ValDat,0)/30,0)) -> 13 | C32: =IF(RC1="","",1-INDEX(PaidCmpFac,1,RC2)) -> 9.220000000000006E-3 | D32: =IF(RC1="","",(1+DisRat)^-((RC[-2]-0.5)/12)) -> 0.95996840210618894 | E32: =IF(RC1="","",RC[-2]*RC[-1]) -> 8.8509086674190673E-3
A33: =IF(R[-1]C1="","",IF(DATE(YEAR(R[-1]C),MONTH(R[-1]C)+1,1)>ValDat,"",DATE(YEAR(R[-1]C),MONTH(R[-1]C)+1,1))) -> 2000-08-01T00:00:00.000 | B33: =IF(RC1="","",ROUND(DAYS360(RC1,ValDat,0)/30,0)) -> 12 | C33: =IF(RC1="","",1-INDEX(PaidCmpFac,1,RC2)) -> 9.6300000000000274E-3 | D33: =IF(RC1="","",(1+DisRat)^-((RC[-2]-0.5)/12)) -> 0.96311108885381791 | E33: =IF(RC1="","",RC[-2]*RC[-1]) -> 9.2747597856622926E-3
A34: =IF(R[-1]C1="","",IF(DATE(YEAR(R[-1]C),MONTH(R[-1]C)+1,1)>ValDat,"",DATE(YEAR(R[-1]C),MONTH(R[-1]C)+1,1))) -> 2000-09-01T00:00:00.000 | B34: =IF(RC1="","",ROUND(DAYS360(RC1,ValDat,0)/30,0)) -> 11 | C34: =IF(RC1="","",1-INDEX(PaidCmpFac,1,RC2)) -> 1.0419999999999985E-2 | D34: =IF(RC1="","",(1+DisRat)^-((RC[-2]-0.5)/12)) -> 0.96626406394007547 | E34: =IF(RC1="","",RC[-2]*RC[-1]) -> 1.0068471546255571E-2
A35: =IF(R[-1]C1="","",IF(DATE(YEAR(R[-1]C),MONTH(R[-1]C)+1,1)>ValDat,"",DATE(YEAR(R[-1]C),MONTH(R[-1]C)+1,1))) -> 2000-10-01T00:00:00.000 | B35: =IF(RC1="","",ROUND(DAYS360(RC1,ValDat,0)/30,0)) -> 10 | C35: =IF(RC1="","",1-INDEX(PaidCmpFac,1,RC2)) -> 1.1480000000000046E-2 | D35: =IF(RC1="","",(1+DisRat)^-((RC[-2]-0.5)/12)) -> 0.96942736104630534 | E35: =IF(RC1="","",RC[-2]*RC[-1]) -> 1.112902610481163E-2
A36: =IF(R[-1]C1="","",IF(DATE(YEAR(R[-1]C),MONTH(R[-1]C)+1,1)>ValDat,"",DATE(YEAR(R[-1]C),MONTH(R[-1]C)+1,1))) -> 2000-11-01T00:00:00.000 | B36: =IF(RC1="","",ROUND(DAYS360(RC1,ValDat,0)/30,0)) -> 9 | C36: =IF(RC1="","",1-INDEX(PaidCmpFac,1,RC2)) -> 4.5640000000000014E-2 | D36: =IF(RC1="","",(1+DisRat)^-((RC[-2]-0.5)/12)) -> 0.97260101396411469 | E36: =IF(RC1="","",RC[-2]*RC[-1]) -> 4.4389510277322207E-2
A37: =IF(R[-1]C1="","",IF(DATE(YEAR(R[-1]C),MONTH(R[-1]C)+1,1)>ValDat,"",DATE(YEAR(R[-1]C),MONTH(R[-1]C)+1,1))) -> 2000-12-01T00:00:00.000 | B37: =IF(RC1="","",ROUND(DAYS360(RC1,ValDat,0)/30,0)) -> 8 | C37: =IF(RC1="","",1-INDEX(PaidCmpFac,1,RC2)) -> 5.5520000000000014E-2 | D37: =IF(RC1="","",(1+DisRat)^-((RC[-2]-0.5)/12)) -> 0.975785056595736 | E37: =IF(RC1="","",RC[-2]*RC[-1]) -> 5.4175586342195277E-2
A38: =IF(R[-1]C1="","",IF(DATE(YEAR(R[-1]C),MONTH(R[-1]C)+1,1)>ValDat,"",DATE(YEAR(R[-1]C),MONTH(R[-1]C)+1,1))) -> 2001-01-01T00:00:00.000 | B38: =IF(RC1="","",ROUND(DAYS360(RC1,ValDat,0)/30,0)) -> 7 | C38: =IF(RC1="","",1-INDEX(PaidCmpFac,1,RC2)) -> 5.6300000000000017E-2 | D38: =IF(RC1="","",(1+DisRat)^-((RC[-2]-0.5)/12)) -> 0.9789795229543885 | E38: =IF(RC1="","",RC[-2]*RC[-1]) -> 5.5116547142332092E-2
A39: =IF(R[-1]C1="","",IF(DATE(YEAR(R[-1]C),MONTH(R[-1]C)+1,1)>ValDat,"",DATE(YEAR(R[-1]C),MONTH(R[-1]C)+1,1))) -> 2001-02-01T00:00:00.000 | B39: =IF(RC1="","",ROUND(DAYS360(RC1,ValDat,0)/30,0)) -> 6 | C39: =IF(RC1="","",1-INDEX(PaidCmpFac,1,RC2)) -> 8.2370000000000054E-2 | D39: =IF(RC1="","",(1+DisRat)^-((RC[-2]-0.5)/12)) -> 0.98218444716464237 | E39: =IF(RC1="","",RC[-2]*RC[-1]) -> 8.0902532912951644E-2
A40: =IF(R[-1]C1="","",IF(DATE(YEAR(R[-1]C),MONTH(R[-1]C)+1,1)>ValDat,"",DATE(YEAR(R[-1]C),MONTH(R[-1]C)+1,1))) -> 2001-03-01T00:00:00.000 | B40: =IF(RC1="","",ROUND(DAYS360(RC1,ValDat,0)/30,0)) -> 5 | C40: =IF(RC1="","",1-INDEX(PaidCmpFac,1,RC2)) -> 0.17557999999999996 | D40: =IF(RC1="","",(1+DisRat)^-((RC[-2]-0.5)/12)) -> 0.9853998634627823 | E40: =IF(RC1="","",RC[-2]*RC[-1]) -> 0.17301650802679527
A41: =IF(R[-1]C1="","",IF(DATE(YEAR(R[-1]C),MONTH(R[-1]C)+1,1)>ValDat,"",DATE(YEAR(R[-1]C),MONTH(R[-1]C)+1,1))) -> 2001-04-01T00:00:00.000 | B41: =IF(RC1="","",ROUND(DAYS360(RC1,ValDat,0)/30,0)) -> 4 | C41: =IF(RC1="","",1-INDEX(PaidCmpFac,1,RC2)) -> 0.25826000000000005 | D41: =IF(RC1="","",(1+DisRat)^-((RC[-2]-0.5)/12)) -> 0.98862580619717366 | E41: =IF(RC1="","",RC[-2]*RC[-1]) -> 0.25532250070848211
A42: =IF(R[-1]C1="","",IF(DATE(YEAR(R[-1]C),MONTH(R[-1]C)+1,1)>ValDat,"",DATE(YEAR(R[-1]C),MONTH(R[-1]C)+1,1))) -> 2001-05-01T00:00:00.000 | B42: =IF(RC1="","",ROUND(DAYS360(RC1,ValDat,0)/30,0)) -> 3 | C42: =IF(RC1="","",1-INDEX(PaidCmpFac,1,RC2)) -> 0.39029999999999998 | D42: =IF(RC1="","",(1+DisRat)^-((RC[-2]-0.5)/12)) -> 0.99186230982862988 | E42: =IF(RC1="","",RC[-2]*RC[-1]) -> 0.38712385952611422
A43: =IF(R[-1]C1="","",IF(DATE(YEAR(R[-1]C),MONTH(R[-1]C)+1,1)>ValDat,"",DATE(YEAR(R[-1]C),MONTH(R[-1]C)+1,1))) -> 2001-06-01T00:00:00.000 | B43: =IF(RC1="","",ROUND(DAYS360(RC1,ValDat,0)/30,0)) -> 2 | C43: =IF(RC1="","",1-INDEX(PaidCmpFac,1,RC2)) -> 0.64972000000000008 | D43: =IF(RC1="","",(1+DisRat)^-((RC[-2]-0.5)/12)) -> 0.99510940893077959 | E43: =IF(RC1="","",RC[-2]*RC[-1]) -> 0.64654248517050616
A44: =IF(R[-1]C1="","",IF(DATE(YEAR(R[-1]C),MONTH(R[-1]C)+1,1)>ValDat,"",DATE(YEAR(R[-1]C),MONTH(R[-1]C)+1,1))) -> 2001-07-01T00:00:00.000 | B44: =IF(RC1="","",ROUND(DAYS360(RC1,ValDat,0)/30,0)) -> 1 | C44: =IF(RC1="","",1-INDEX(PaidCmpFac,1,RC2)) -> 0.94887999999999995 | D44: =IF(RC1="","",(1+DisRat)^-((RC[-2]-0.5)/12)) -> 0.99836713819043665 | E44: =IF(RC1="","",RC[-2]*RC[-1]) -> 0.9473306100861415
C45: =SUM(R[-36]C:R[-1]C) -> 2.7132800000000001 | E45: =SUM(R[-36]C:R[-1]C) -> 2.6927553906471871
A47: SUMMARY:
B48: ITEM DESCRIPTION | E48: VALUE
B49: (C) Claim Liability Average Discount Factor (B / A) …………………………………………………….. | E49: =IF(R[-4]C[-2]=0,0,R[-4]C/R[-4]C[-2]) -> 0.9924354989706875
B50: (D) Interest Discount Factor (1 - C) ………………………………………………………………………… | E50: =1-R[-1]C -> 7.5645010293124981E-3
B51: (E) Restated Claim Liability (from 'Liabilities" sheet) …………………………………………………………………. | E51: =Restated -> 384550.02031781059
B52: (F) Interest Discount (D * E)………………………………………………………………………… | E52: =R[-2]C*R[-1]C -> 2908.9290245162201
B53: (G) Adjudication Expense Factor …………………………………………………………………….. | E53: =AEFac -> 0.02
B54: (H) Adjudication Expense Liability (E * G)……………………………………………………. | E54: =R[-3]C*R[-1]C -> 7691.0004063562119
B55: (I) Adjusted Total Claim Liability (E - F + H)……………………………………………………. | E55: =R[-4]C-R[-3]C+R[-1]C -> 389332.09169965063

Sheet: WeightedNCC0
A1: =title1&" - Weighted NCC0" -> BLOCK CLAIM LIABILITY REPORT - Weighted NCC0
A2: The Millennium-2000 Sample Life Insurance Company
A3: Arvind
A4: Experience Period: 01-Aug-1998 to 31-Jul-2001. Runout Date: 31-Jul-2001
A8: Incurred Month | B8: Weighting Factor | C8: Trend Factor | D8: Untrended Estimated Incurred Claims | E8: Exposure | F8: Weighted and Trended Incurred Claims | G8: Weighted Exposure
A9: =ExpDat -> 1998-08-01T00:00:00.000 | B9: =IF(RC1="","",VLOOKUP(RC1,NccFacDump,2,FALSE)) -> 1 | C9: =IF(RC1="","",VLOOKUP(EOMONTH(ValDat,-1)+1,TrendFacDump,2,FALSE)/VLOOKUP(RC[-2],TrendFacDump,2,FALSE)) -> 1.1852554225435581 | D9: =IF(RC1="","",VLOOKUP(RC1,CalcIncClms,10,FALSE)) -> 99219 | E9: =IF(RC1="","",VLOOKUP(RC1,ExpDump,7,FALSE)) -> 2576.1559999999999 | F9: =IF(RC1="","",RC[-2]*RC[-4]*RC[-3]) -> 117599.85776934928 | G9: =IF(RC1="","",RC[-2]*RC[-5]) -> 2576.1559999999999
A10: =IF(R[-1]C1="","",IF(DATE(YEAR(R[-1]C),MONTH(R[-1]C)+1,1)>ValDat,"",DATE(YEAR(R[-1]C),MONTH(R[-1]C)+1,1))) -> 1998-09-01T00:00:00.000 | B10: =IF(RC1="","",VLOOKUP(RC1,NccFacDump,2,FALSE)) -> 1 | C10: =IF(RC1="","",VLOOKUP(EOMONTH(ValDat,-1)+1,TrendFacDump,2,FALSE)/VLOOKUP(RC[-2],TrendFacDump,2,FALSE)) -> 1.1795234725171031 | D10: =IF(RC1="","",VLOOKUP(RC1,CalcIncClms,10,FALSE)) -> 99219 | E10: =IF(RC1="","",VLOOKUP(RC1,ExpDump,7,FALSE)) -> 2663.7669999999998 | F10: =IF(RC1="","",RC[-2]*RC[-4]*RC[-3]) -> 117031.13941967445 | G10: =IF(RC1="","",RC[-2]*RC[-5]) -> 2663.7669999999998
A11: =IF(R[-1]C1="","",IF(DATE(YEAR(R[-1]C),MONTH(R[-1]C)+1,1)>ValDat,"",DATE(YEAR(R[-1]C),MONTH(R[-1]C)+1,1))) -> 1998-10-01T00:00:00.000 | B11: =IF(RC1="","",VLOOKUP(RC1,NccFacDump,2,FALSE)) -> 1 | C11: =IF(RC1="","",VLOOKUP(EOMONTH(ValDat,-1)+1,TrendFacDump,2,FALSE)/VLOOKUP(RC[-2],TrendFacDump,2,FALSE)) -> 1.1738466956215519 | D11: =IF(RC1="","",VLOOKUP(RC1,CalcIncClms,10,FALSE)) -> 292014 | E11: =IF(RC1="","",VLOOKUP(RC1,ExpDump,7,FALSE)) -> 2728.2080000000001 | F11: =IF(RC1="","",RC[-2]*RC[-4]*RC[-3]) -> 342779.66897523182 | G11: =IF(RC1="","",RC[-2]*RC[-5]) -> 2728.2080000000001
A12: =IF(R[-1]C1="","",IF(DATE(YEAR(R[-1]C),MONTH(R[-1]C)+1,1)>ValDat,"",DATE(YEAR(R[-1]C),MONTH(R[-1]C)+1,1))) -> 1998-11-01T00:00:00.000 | B12: =IF(RC1="","",VLOOKUP(RC1,NccFacDump,2,FALSE)) -> 1 | C12: =IF(RC1="","",VLOOKUP(EOMONTH(ValDat,-1)+1,TrendFacDump,2,FALSE)/VLOOKUP(RC[-2],TrendFacDump,2,FALSE)) -> 1.1680878402055834 | D12: =IF(RC1="","",VLOOKUP(RC1,CalcIncClms,10,FALSE)) -> 292014 | E12: =IF(RC1="","",VLOOKUP(RC1,ExpDump,7,FALSE)) -> 2780.7539999999999 | F12: =IF(RC1="","",RC[-2]*RC[-4]*RC[-3]) -> 341098.00256979326 | G12: =IF(RC1="","",RC[-2]*RC[-5]) -> 2780.7539999999999
A13: =IF(R[-1]C1="","",IF(DATE(YEAR(R[-1]C),MONTH(R[-1]C)+1,1)>ValDat,"",DATE(YEAR(R[-1]C),MONTH(R[-1]C)+1,1))) -> 1998-12-01T00:00:00.000 | B13: =IF(RC1="","",VLOOKUP(RC1,NccFacDump,2,FALSE)) -> 1 | C13: =IF(RC1="","",VLOOKUP(EOMONTH(ValDat,-1)+1,TrendFacDump,2,FALSE)/VLOOKUP(RC[-2],TrendFacDump,2,FALSE)) -> 1.1623852144600721 | D13: =IF(RC1="","",VLOOKUP(RC1,CalcIncClms,10,FALSE)) -> 109763 | E13: =IF(RC1="","",VLOOKUP(RC1,ExpDump,7,FALSE)) -> 2826.4589999999998 | F13: =IF(RC1="","",RC[-2]*RC[-4]*RC[-3]) -> 127586.8882947809 | G13: =IF(RC1="","",RC[-2]*RC[-5]) -> 2826.4589999999998
A14: =IF(R[-1]C1="","",IF(DATE(YEAR(R[-1]C),MONTH(R[-1]C)+1,1)>ValDat,"",DATE(YEAR(R[-1]C),MONTH(R[-1]C)+1,1))) -> 1999-01-01T00:00:00.000 | B14: =IF(RC1="","",VLOOKUP(RC1,NccFacDump,2,FALSE)) -> 1 | C14: =IF(RC1="","",VLOOKUP(EOMONTH(ValDat,-1)+1,TrendFacDump,2,FALSE)/VLOOKUP(RC[-2],TrendFacDump,2,FALSE)) -> 1.1568718186024989 | D14: =IF(RC1="","",VLOOKUP(RC1,CalcIncClms,10,FALSE)) -> 109763 | E14: =IF(RC1="","",VLOOKUP(RC1,ExpDump,7,FALSE)) -> 2835.0619999999999 | F14: =IF(RC1="","",RC[-2]*RC[-4]*RC[-3]) -> 126981.72142526608 | G14: =IF(RC1="","",RC[-2]*RC[-5]) -> 2835.0619999999999
A15: =IF(R[-1]C1="","",IF(DATE(YEAR(R[-1]C),MONTH(R[-1]C)+1,1)>ValDat,"",DATE(YEAR(R[-1]C),MONTH(R[-1]C)+1,1))) -> 1999-02-01T00:00:00.000 | B15: =IF(RC1="","",VLOOKUP(RC1,NccFacDump,2,FALSE)) -> 1 | C15: =IF(RC1="","",VLOOKUP(EOMONTH(ValDat,-1)+1,TrendFacDump,2,FALSE)/VLOOKUP(RC[-2],TrendFacDump,2,FALSE)) -> 1.1512779184895232 | D15: =IF(RC1="","",VLOOKUP(RC1,CalcIncClms,10,FALSE)) -> 164681 | E15: =IF(RC1="","",VLOOKUP(RC1,ExpDump,7,FALSE)) -> 2816.6260000000002 | F15: =IF(RC1="","",RC[-2]*RC[-4]*RC[-3]) -> 189593.59889477317 | G15: =IF(RC1="","",RC[-2]*RC[-5]) -> 2816.6260000000002
A16: =IF(R[-1]C1="","",IF(DATE(YEAR(R[-1]C),MONTH(R[-1]C)+1,1)>ValDat,"",DATE(YEAR(R[-1]C),MONTH(R[-1]C)+1,1))) -> 1999-03-01T00:00:00.000 | B16: =IF(RC1="","",VLOOKUP(RC1,NccFacDump,2,FALSE)) -> 1 | C16: =IF(RC1="","",VLOOKUP(EOMONTH(ValDat,-1)+1,TrendFacDump,2,FALSE)/VLOOKUP(RC[-2],TrendFacDump,2,FALSE)) -> 1.1456065986940085 | D16: =IF(RC1="","",VLOOKUP(RC1,CalcIncClms,10,FALSE)) -> 164681 | E16: =IF(RC1="","",VLOOKUP(RC1,ExpDump,7,FALSE)) -> 2829.576 | F16: =IF(RC1="","",RC[-2]*RC[-4]*RC[-3]) -> 188659.64027952802 | G16: =IF(RC1="","",RC[-2]*RC[-5]) -> 2829.576
A17: =IF(R[-1]C1="","",IF(DATE(YEAR(R[-1]C),MONTH(R[-1]C)+1,1)>ValDat,"",DATE(YEAR(R[-1]C),MONTH(R[-1]C)+1,1))) -> 1999-04-01T00:00:00.000 | B17: =IF(RC1="","",VLOOKUP(RC1,NccFacDump,2,FALSE)) -> 1 | C17: =IF(RC1="","",VLOOKUP(EOMONTH(ValDat,-1)+1,TrendFacDump,2,FALSE)/VLOOKUP(RC[-2],TrendFacDump,2,FALSE)) -> 1.1401208528103979 | D17: =IF(RC1="","",VLOOKUP(RC1,CalcIncClms,10,FALSE)) -> 171773 | E17: =IF(RC1="","",VLOOKUP(RC1,ExpDump,7,FALSE)) -> 2910.3670000000002 | F17: =IF(RC1="","",RC[-2]*RC[-4]*RC[-3]) -> 195841.97924980047 | G17: =IF(RC1="","",RC[-2]*RC[-5]) -> 2910.3670000000002
A18: =IF(R[-1]C1="","",IF(DATE(YEAR(R[-1]C),MONTH(R[-1]C)+1,1)>ValDat,"",DATE(YEAR(R[-1]C),MONTH(R[-1]C)+1,1))) -> 1999-05-01T00:00:00.000 | B18: =IF(RC1="","",VLOOKUP(RC1,NccFacDump,2,FALSE)) -> 1 | C18: =IF(RC1="","",VLOOKUP(EOMONTH(ValDat,-1)+1,TrendFacDump,2,FALSE)/VLOOKUP(RC[-2],TrendFacDump,2,FALSE)) -> 1.1345586566825505 | D18: =IF(RC1="","",VLOOKUP(RC1,CalcIncClms,10,FALSE)) -> 171773 | E18: =IF(RC1="","",VLOOKUP(RC1,ExpDump,7,FALSE)) -> 2874.0259999999998 | F18: =IF(RC1="","",RC[-2]*RC[-4]*RC[-3]) -> 194886.54413433175 | G18: =IF(RC1="","",RC[-2]*RC[-5]) -> 2874.0259999999998
A19: =IF(R[-1]C1="","",IF(DATE(YEAR(R[-1]C),MONTH(R[-1]C)+1,1)>ValDat,"",DATE(YEAR(R[-1]C),MONTH(R[-1]C)+1,1))) -> 1999-06-01T00:00:00.000 | B19: =IF(RC1="","",VLOOKUP(RC1,NccFacDump,2,FALSE)) -> 1 | C19: =IF(RC1="","",VLOOKUP(EOMONTH(ValDat,-1)+1,TrendFacDump,2,FALSE)/VLOOKUP(RC[-2],TrendFacDump,2,FALSE)) -> 1.1290504685559444 | D19: =IF(RC1="","",VLOOKUP(RC1,CalcIncClms,10,FALSE)) -> 294045 | E19: =IF(RC1="","",VLOOKUP(RC1,ExpDump,7,FALSE)) -> 2840.922 | F19: =IF(RC1="","",RC[-2]*RC[-4]*RC[-3]) -> 331991.64502653264 | G19: =IF(RC1="","",RC[-2]*RC[-5]) -> 2840.922
A20: =IF(R[-1]C1="","",IF(DATE(YEAR(R[-1]C),MONTH(R[-1]C)+1,1)>ValDat,"",DATE(YEAR(R[-1]C),MONTH(R[-1]C)+1,1))) -> 1999-07-01T00:00:00.000 | B20: =IF(RC1="","",VLOOKUP(RC1,NccFacDump,2,FALSE)) -> 1 | C20: =IF(RC1="","",VLOOKUP(EOMONTH(ValDat,-1)+1,TrendFacDump,2,FALSE)/VLOOKUP(RC[-2],TrendFacDump,2,FALSE)) -> 1.1235955056179776 | D20: =IF(RC1="","",VLOOKUP(RC1,CalcIncClms,10,FALSE)) -> 294045 | E20: =IF(RC1="","",VLOOKUP(RC1,ExpDump,7,FALSE)) -> 2830.386 | F20: =IF(RC1="","",RC[-2]*RC[-4]*RC[-3]) -> 330387.64044943824 | G20: =IF(RC1="","",RC[-2]*RC[-5]) -> 2830.386
A21: =IF(R[-1]C1="","",IF(DATE(YEAR(R[-1]C),MONTH(R[-1]C)+1,1)>ValDat,"",DATE(YEAR(R[-1]C),MONTH(R[-1]C)+1,1))) -> 1999-08-01T00:00:00.000 | B21: =IF(RC1="","",VLOOKUP(RC1,NccFacDump,2,FALSE)) -> 1 | C21: =IF(RC1="","",VLOOKUP(EOMONTH(ValDat,-1)+1,TrendFacDump,2,FALSE)/VLOOKUP(RC[-2],TrendFacDump,2,FALSE)) -> 1.1181930001118192 | D21: =IF(RC1="","",VLOOKUP(RC1,CalcIncClms,10,FALSE)) -> 111076 | E21: =IF(RC1="","",VLOOKUP(RC1,ExpDump,7,FALSE)) -> 2957.8130000000001 | F21: =IF(RC1="","",RC[-2]*RC[-4]*RC[-3]) -> 124204.40568042043 | G21: =IF(RC1="","",RC[-2]*RC[-5]) -> 2957.8130000000001
A22: =IF(R[-1]C1="","",IF(DATE(YEAR(R[-1]C),MONTH(R[-1]C)+1,1)>ValDat,"",DATE(YEAR(R[-1]C),MONTH(R[-1]C)+1,1))) -> 1999-09-01T00:00:00.000 | B22: =IF(RC1="","",VLOOKUP(RC1,NccFacDump,2,FALSE)) -> 1 | C22: =IF(RC1="","",VLOOKUP(EOMONTH(ValDat,-1)+1,TrendFacDump,2,FALSE)/VLOOKUP(RC[-2],TrendFacDump,2,FALSE)) -> 1.1127183709803048 | D22: =IF(RC1="","",VLOOKUP(RC1,CalcIncClms,10,FALSE)) -> 111076 | E22: =IF(RC1="","",VLOOKUP(RC1,ExpDump,7,FALSE)) -> 2973.8850000000002 | F22: =IF(RC1="","",RC[-2]*RC[-4]*RC[-3]) -> 123596.30577500834 | G22: =IF(RC1="","",RC[-2]*RC[-5]) -> 2973.8850000000002
A23: =IF(R[-1]C1="","",IF(DATE(YEAR(R[-1]C),MONTH(R[-1]C)+1,1)>ValDat,"",DATE(YEAR(R[-1]C),MONTH(R[-1]C)+1,1))) -> 1999-10-01T00:00:00.000 | B23: =IF(RC1="","",VLOOKUP(RC1,NccFacDump,2,FALSE)) -> 1 | C23: =IF(RC1="","",VLOOKUP(EOMONTH(ValDat,-1)+1,TrendFacDump,2,FALSE)/VLOOKUP(RC[-2],TrendFacDump,2,FALSE)) -> 1.107297087808659 | D23: =IF(RC1="","",VLOOKUP(RC1,CalcIncClms,10,FALSE)) -> 171436 | E23: =IF(RC1="","",VLOOKUP(RC1,ExpDump,7,FALSE)) -> 2943.35 | F23: =IF(RC1="","",RC[-2]*RC[-4]*RC[-3]) -> 189830.58354556526 | G23: =IF(RC1="","",RC[-2]*RC[-5]) -> 2943.35
A24: =IF(R[-1]C1="","",IF(DATE(YEAR(R[-1]C),MONTH(R[-1]C)+1,1)>ValDat,"",DATE(YEAR(R[-1]C),MONTH(R[-1]C)+1,1))) -> 1999-11-01T00:00:00.000 | B24: =IF(RC1="","",VLOOKUP(RC1,NccFacDump,2,FALSE)) -> 1 | C24: =IF(RC1="","",VLOOKUP(EOMONTH(ValDat,-1)+1,TrendFacDump,2,FALSE)/VLOOKUP(RC[-2],TrendFacDump,2,FALSE)) -> 1.1019283746556474 | D24: =IF(RC1="","",VLOOKUP(RC1,CalcIncClms,10,FALSE)) -> 171436 | E24: =IF(RC1="","",VLOOKUP(RC1,ExpDump,7,FALSE)) -> 3014.0830000000001 | F24: =IF(RC1="","",RC[-2]*RC[-4]*RC[-3]) -> 188910.19283746558 | G24: =IF(RC1="","",RC[-2]*RC[-5]) -> 3014.0830000000001
A25: =IF(R[-1]C1="","",IF(DATE(YEAR(R[-1]C),MONTH(R[-1]C)+1,1)>ValDat,"",DATE(YEAR(R[-1]C),MONTH(R[-1]C)+1,1))) -> 1999-12-01T00:00:00.000 | B25: =IF(RC1="","",VLOOKUP(RC1,NccFacDump,2,FALSE)) -> 1 | C25: =IF(RC1="","",VLOOKUP(EOMONTH(ValDat,-1)+1,TrendFacDump,2,FALSE)/VLOOKUP(RC[-2],TrendFacDump,2,FALSE)) -> 1.096611470555982 | D25: =IF(RC1="","",VLOOKUP(RC1,CalcIncClms,10,FALSE)) -> 111538 | E25: =IF(RC1="","",VLOOKUP(RC1,ExpDump,7,FALSE)) -> 3018.721 | F25: =IF(RC1="","",RC[-2]*RC[-4]*RC[-3]) -> 122313.85020287312 | G25: =IF(RC1="","",RC[-2]*RC[-5]) -> 3018.721
A26: =IF(R[-1]C1="","",IF(DATE(YEAR(R[-1]C),MONTH(R[-1]C)+1,1)>ValDat,"",DATE(YEAR(R[-1]C),MONTH(R[-1]C)+1,1))) -> 2000-01-01T00:00:00.000 | B26: =IF(RC1="","",VLOOKUP(RC1,NccFacDump,2,FALSE)) -> 1 | C26: =IF(RC1="","",VLOOKUP(EOMONTH(ValDat,-1)+1,TrendFacDump,2,FALSE)/VLOOKUP(RC[-2],TrendFacDump,2,FALSE)) -> 1.0913456291607553 | D26: =IF(RC1="","",VLOOKUP(RC1,CalcIncClms,10,FALSE)) -> 111538 | E26: =IF(RC1="","",VLOOKUP(RC1,ExpDump,7,FALSE)) -> 3003.3229999999999 | F26: =IF(RC1="","",RC[-2]*RC[-4]*RC[-3]) -> 121726.50878533232 | G26: =IF(RC1="","",RC[-2]*RC[-5]) -> 3003.3229999999999
A27: =IF(R[-1]C1="","",IF(DATE(YEAR(R[-1]C),MONTH(R[-1]C)+1,1)>ValDat,"",DATE(YEAR(R[-1]C),MONTH(R[-1]C)+1,1))) -> 2000-02-01T00:00:00.000 | B27: =IF(RC1="","",VLOOKUP(RC1,NccFacDump,2,FALSE)) -> 1 | C27: =IF(RC1="","",VLOOKUP(EOMONTH(ValDat,-1)+1,TrendFacDump,2,FALSE)/VLOOKUP(RC[-2],TrendFacDump,2,FALSE)) -> 1.0860121633362294 | D27: =IF(RC1="","",VLOOKUP(RC1,CalcIncClms,10,FALSE)) -> 211563 | E27: =IF(RC1="","",VLOOKUP(RC1,ExpDump,7,FALSE)) -> 3006.0590000000002 | F27: =IF(RC1="","",RC[-2]*RC[-4]*RC[-3]) -> 229759.9913119027 | G27: =IF(RC1="","",RC[-2]*RC[-5]) -> 3006.0590000000002
A28: =IF(R[-1]C1="","",IF(DATE(YEAR(R[-1]C),MONTH(R[-1]C)+1,1)>ValDat,"",DATE(YEAR(R[-1]C),MONTH(R[-1]C)+1,1))) -> 2000-03-01T00:00:00.000 | B28: =IF(RC1="","",VLOOKUP(RC1,NccFacDump,2,FALSE)) -> 1 | C28: =IF(RC1="","",VLOOKUP(EOMONTH(ValDat,-1)+1,TrendFacDump,2,FALSE)/VLOOKUP(RC[-2],TrendFacDump,2,FALSE)) -> 1.0808473843493298 | D28: =IF(RC1="","",VLOOKUP(RC1,CalcIncClms,10,FALSE)) -> 211627.66356035118 | E28: =IF(RC1="","",VLOOKUP(RC1,ExpDump,7,FALSE)) -> 3001.39 | F28: =IF(RC1="","",RC[-2]*RC[-4]*RC[-3]) -> 228737.20661516555 | G28: =IF(RC1="","",RC[-2]*RC[-5]) -> 3001.39
A29: =IF(R[-1]C1="","",IF(DATE(YEAR(R[-1]C),MONTH(R[-1]C)+1,1)>ValDat,"",DATE(YEAR(R[-1]C),MONTH(R[-1]C)+1,1))) -> 2000-04-01T00:00:00.000 | B29: =IF(RC1="","",VLOOKUP(RC1,NccFacDump,2,FALSE)) -> 1 | C29: =IF(RC1="","",VLOOKUP(EOMONTH(ValDat,-1)+1,TrendFacDump,2,FALSE)/VLOOKUP(RC[-2],TrendFacDump,2,FALSE)) -> 1.0755001075500108 | D29: =IF(RC1="","",VLOOKUP(RC1,CalcIncClms,10,FALSE)) -> 183432.87764419251 | E29: =IF(RC1="","",VLOOKUP(RC1,ExpDump,7,FALSE)) -> 3027.8040000000001 | F29: =IF(RC1="","",RC[-2]*RC[-4]*RC[-3]) -> 197282.07963453702 | G29: =IF(RC1="","",RC[-2]*RC[-5]) -> 3027.8040000000001
A30: =IF(R[-1]C1="","",IF(DATE(YEAR(R[-1]C),MONTH(R[-1]C)+1,1)>ValDat,"",DATE(YEAR(R[-1]C),MONTH(R[-1]C)+1,1))) -> 2000-05-01T00:00:00.000 | B30: =IF(RC1="","",VLOOKUP(RC1,NccFacDump,2,FALSE)) -> 1 | C30: =IF(RC1="","",VLOOKUP(EOMONTH(ValDat,-1)+1,TrendFacDump,2,FALSE)/VLOOKUP(RC[-2],TrendFacDump,2,FALSE)) -> 1.0703200256876806 | D30: =IF(RC1="","",VLOOKUP(RC1,CalcIncClms,10,FALSE)) -> 184167.25004901248 | E30: =IF(RC1="","",VLOOKUP(RC1,ExpDump,7,FALSE)) -> 3053.259 | F30: =IF(RC1="","",RC[-2]*RC[-4]*RC[-3]) -> 197117.89580328853 | G30: =IF(RC1="","",RC[-2]*RC[-5]) -> 3053.259
A31: =IF(R[-1]C1="","",IF(DATE(YEAR(R[-1]C),MONTH(R[-1]C)+1,1)>ValDat,"",DATE(YEAR(R[-1]C),MONTH(R[-1]C)+1,1))) -> 2000-06-01T00:00:00.000 | B31: =IF(RC1="","",VLOOKUP(RC1,NccFacDump,2,FALSE)) -> 1 | C31: =IF(RC1="","",VLOOKUP(EOMONTH(ValDat,-1)+1,TrendFacDump,2,FALSE)/VLOOKUP(RC[-2],TrendFacDump,2,FALSE)) -> 1.0651896037494675 | D31: =IF(RC1="","",VLOOKUP(RC1,CalcIncClms,10,FALSE)) -> 330260.16432499635 | E31: =IF(RC1="","",VLOOKUP(RC1,ExpDump,7,FALSE)) -> 3019.4940000000001 | F31: =IF(RC1="","",RC[-2]*RC[-4]*RC[-3]) -> 351789.69357157691 | G31: =IF(RC1="","",RC[-2]*RC[-5]) -> 3019.4940000000001
A32: =IF(R[-1]C1="","",IF(DATE(YEAR(R[-1]C),MONTH(R[-1]C)+1,1)>ValDat,"",DATE(YEAR(R[-1]C),MONTH(R[-1]C)+1,1))) -> 2000-07-01T00:00:00.000 | B32: =IF(RC1="","",VLOOKUP(RC1,NccFacDump,2,FALSE)) -> 1 | C32: =IF(RC1="","",VLOOKUP(EOMONTH(ValDat,-1)+1,TrendFacDump,2,FALSE)/VLOOKUP(RC[-2],TrendFacDump,2,FALSE)) -> 1.0599957600169598 | D32: =IF(RC1="","",VLOOKUP(RC1,CalcIncClms,10,FALSE)) -> 330263.73572985025 | E32: =IF(RC1="","",VLOOKUP(RC1,ExpDump,7,FALSE)) -> 3006.0659999999998 | F32: =IF(RC1="","",RC[-2]*RC[-4]*RC[-3]) -> 350078.15956100298 | G32: =IF(RC1="","",RC[-2]*RC[-5]) -> 3006.0659999999998
A33: =IF(R[-1]C1="","",IF(DATE(YEAR(R[-1]C),MONTH(R[-1]C)+1,1)>ValDat,"",DATE(YEAR(R[-1]C),MONTH(R[-1]C)+1,1))) -> 2000-08-01T00:00:00.000 | B33: =IF(RC1="","",VLOOKUP(RC1,NccFacDump,2,FALSE)) -> 1 | C33: =IF(RC1="","",VLOOKUP(EOMONTH(ValDat,-1)+1,TrendFacDump,2,FALSE)/VLOOKUP(RC[-2],TrendFacDump,2,FALSE)) -> 1.0548523206751055 | D33: =IF(RC1="","",VLOOKUP(RC1,CalcIncClms,10,FALSE)) -> 282478.56091665121 | E33: =IF(RC1="","",VLOOKUP(RC1,ExpDump,7,FALSE)) -> 2987.3629999999998 | F33: =IF(RC1="","",RC[-2]*RC[-4]*RC[-3]) -> 297973.16552389367 | G33: =IF(RC1="","",RC[-2]*RC[-5]) -> 2987.3629999999998
A34: =IF(R[-1]C1="","",IF(DATE(YEAR(R[-1]C),MONTH(R[-1]C)+1,1)>ValDat,"",DATE(YEAR(R[-1]C),MONTH(R[-1]C)+1,1))) -> 2000-09-01T00:00:00.000 | B34: =IF(RC1="","",VLOOKUP(RC1,NccFacDump,2,FALSE)) -> 1 | C34: =IF(RC1="","",VLOOKUP(EOMONTH(ValDat,-1)+1,TrendFacDump,2,FALSE)/VLOOKUP(RC[-2],TrendFacDump,2,FALSE)) -> 1.0497585555322275 | D34: =IF(RC1="","",VLOOKUP(RC1,CalcIncClms,10,FALSE)) -> 282864.75979184738 | E34: =IF(RC1="","",VLOOKUP(RC1,ExpDump,7,FALSE)) -> 2953.335 | F34: =IF(RC1="","",RC[-2]*RC[-4]*RC[-3]) -> 296939.70165006019 | G34: =IF(RC1="","",RC[-2]*RC[-5]) -> 2953.335
A35: =IF(R[-1]C1="","",IF(DATE(YEAR(R[-1]C),MONTH(R[-1]C)+1,1)>ValDat,"",DATE(YEAR(R[-1]C),MONTH(R[-1]C)+1,1))) -> 2000-10-01T00:00:00.000 | B35: =IF(RC1="","",VLOOKUP(RC1,NccFacDump,2,FALSE)) -> 1 | C35: =IF(RC1="","",VLOOKUP(EOMONTH(ValDat,-1)+1,TrendFacDump,2,FALSE)/VLOOKUP(RC[-2],TrendFacDump,2,FALSE)) -> 1.0447137484329294 | D35: =IF(RC1="","",VLOOKUP(RC1,CalcIncClms,10,FALSE)) -> 185068.15749487467 | E35: =IF(RC1="","",VLOOKUP(RC1,ExpDump,7,FALSE)) -> 2927.2660000000001 | F35: =IF(RC1="","",RC[-2]*RC[-4]*RC[-3]) -> 193343.24853204624 | G35: =IF(RC1="","",RC[-2]*RC[-5]) -> 2927.2660000000001
A36: =IF(R[-1]C1="","",IF(DATE(YEAR(R[-1]C),MONTH(R[-1]C)+1,1)>ValDat,"",DATE(YEAR(R[-1]C),MONTH(R[-1]C)+1,1))) -> 2000-11-01T00:00:00.000 | B36: =IF(RC1="","",VLOOKUP(RC1,NccFacDump,2,FALSE)) -> 1 | C36: =IF(RC1="","",VLOOKUP(EOMONTH(ValDat,-1)+1,TrendFacDump,2,FALSE)/VLOOKUP(RC[-2],TrendFacDump,2,FALSE)) -> 1.0396091069757771 | D36: =IF(RC1="","",VLOOKUP(RC1,CalcIncClms,10,FALSE)) -> 185323.69106984677 | E36: =IF(RC1="","",VLOOKUP(RC1,ExpDump,7,FALSE)) -> 2897.2249999999999 | F36: =IF(RC1="","",RC[-2]*RC[-4]*RC[-3]) -> 192664.1969745782 | G36: =IF(RC1="","",RC[-2]*RC[-5]) -> 2897.2249999999999
A37: =IF(R[-1]C1="","",IF(DATE(YEAR(R[-1]C),MONTH(R[-1]C)+1,1)>ValDat,"",DATE(YEAR(R[-1]C),MONTH(R[-1]C)+1,1))) -> 2000-12-01T00:00:00.000 | B37: =IF(RC1="","",VLOOKUP(RC1,NccFacDump,2,FALSE)) -> 1 | C37: =IF(RC1="","",VLOOKUP(EOMONTH(ValDat,-1)+1,TrendFacDump,2,FALSE)/VLOOKUP(RC[-2],TrendFacDump,2,FALSE)) -> 1.0345541071798054 | D37: =IF(RC1="","",VLOOKUP(RC1,CalcIncClms,10,FALSE)) -> 87093.921080495071 | E37: =IF(RC1="","",VLOOKUP(RC1,ExpDump,7,FALSE)) -> 2887.18 | F37: =IF(RC1="","",RC[-2]*RC[-4]*RC[-3]) -> 90103.373764220014 | G37: =IF(RC1="","",RC[-2]*RC[-5]) -> 2887.18
A38: =IF(R[-1]C1="","",IF(DATE(YEAR(R[-1]C),MONTH(R[-1]C)+1,1)>ValDat,"",DATE(YEAR(R[-1]C),MONTH(R[-1]C)+1,1))) -> 2001-01-01T00:00:00.000 | B38: =IF(RC1="","",VLOOKUP(RC1,NccFacDump,2,FALSE)) -> 1 | C38: =IF(RC1="","",VLOOKUP(EOMONTH(ValDat,-1)+1,TrendFacDump,2,FALSE)/VLOOKUP(RC[-2],TrendFacDump,2,FALSE)) -> 1.0295480284155256 | D38: =IF(RC1="","",VLOOKUP(RC1,CalcIncClms,10,FALSE)) -> 93385.907214559615 | E38: =IF(RC1="","",VLOOKUP(RC1,ExpDump,7,FALSE)) -> 2887.8029999999999 | F38: =IF(RC1="","",RC[-2]*RC[-4]*RC[-3]) -> 96145.276654545058 | G38: =IF(RC1="","",RC[-2]*RC[-5]) -> 2887.8029999999999
A39: =IF(R[-1]C1="","",IF(DATE(YEAR(R[-1]C),MONTH(R[-1]C)+1,1)>ValDat,"",DATE(YEAR(R[-1]C),MONTH(R[-1]C)+1,1))) -> 2001-02-01T00:00:00.000 | B39: =IF(RC1="","",VLOOKUP(RC1,NccFacDump,2,FALSE)) -> 1 | C39: =IF(RC1="","",VLOOKUP(EOMONTH(ValDat,-1)+1,TrendFacDump,2,FALSE)/VLOOKUP(RC[-2],TrendFacDump,2,FALSE)) -> 1.0245901639344261 | D39: =IF(RC1="","",VLOOKUP(RC1,CalcIncClms,10,FALSE)) -> 156941.69791787729 | E39: =IF(RC1="","",VLOOKUP(RC1,ExpDump,7,FALSE)) -> 2887.0279999999998 | F39: =IF(RC1="","",RC[-2]*RC[-4]*RC[-3]) -> 160800.91999782508 | G39: =IF(RC1="","",RC[-2]*RC[-5]) -> 2887.0279999999998
A40: =IF(R[-1]C1="","",IF(DATE(YEAR(R[-1]C),MONTH(R[-1]C)+1,1)>ValDat,"",DATE(YEAR(R[-1]C),MONTH(R[-1]C)+1,1))) -> 2001-03-01T00:00:00.000 | B40: =IF(RC1="","",VLOOKUP(RC1,NccFacDump,2,FALSE)) -> 1 | C40: =IF(RC1="","",VLOOKUP(EOMONTH(ValDat,-1)+1,TrendFacDump,2,FALSE)/VLOOKUP(RC[-2],TrendFacDump,2,FALSE)) -> 1.0195758564437194 | D40: =IF(RC1="","",VLOOKUP(RC1,CalcIncClms,10,FALSE)) -> 162716.8669878784 | E40: =IF(RC1="","",VLOOKUP(RC1,ExpDump,7,FALSE)) -> 2848.3409999999999 | F40: =IF(RC1="","",RC[-2]*RC[-4]*RC[-3]) -> 165902.18901700489 | G40: =IF(RC1="","",RC[-2]*RC[-5]) -> 2848.3409999999999
A41: =IF(R[-1]C1="","",IF(DATE(YEAR(R[-1]C),MONTH(R[-1]C)+1,1)>ValDat,"",DATE(YEAR(R[-1]C),MONTH(R[-1]C)+1,1))) -> 2001-04-01T00:00:00.000 | B41: =IF(RC1="","",VLOOKUP(RC1,NccFacDump,2,FALSE)) -> 1 | C41: =IF(RC1="","",VLOOKUP(EOMONTH(ValDat,-1)+1,TrendFacDump,2,FALSE)/VLOOKUP(RC[-2],TrendFacDump,2,FALSE)) -> 1.0147133434804667 | D41: =IF(RC1="","",VLOOKUP(RC1,CalcIncClms,10,FALSE)) -> 158000.44683859556 | E41: =IF(RC1="","",VLOOKUP(RC1,ExpDump,7,FALSE)) -> 2809.8719999999998 | F41: =IF(RC1="","",RC[-2]*RC[-4]*RC[-3]) -> 160325.16168299902 | G41: =IF(RC1="","",RC[-2]*RC[-5]) -> 2809.8719999999998
A42: =IF(R[-1]C1="","",IF(DATE(YEAR(R[-1]C),MONTH(R[-1]C)+1,1)>ValDat,"",DATE(YEAR(R[-1]C),MONTH(R[-1]C)+1,1))) -> 2001-05-01T00:00:00.000 | B42: =IF(RC1="","",VLOOKUP(RC1,NccFacDump,2,FALSE)) -> 1 | C42: =IF(RC1="","",VLOOKUP(EOMONTH(ValDat,-1)+1,TrendFacDump,2,FALSE)/VLOOKUP(RC[-2],TrendFacDump,2,FALSE)) -> 1.0097950116126426 | D42: =IF(RC1="","",VLOOKUP(RC1,CalcIncClms,10,FALSE)) -> 215921.97804735258 | E42: =IF(RC1="","",VLOOKUP(RC1,ExpDump,7,FALSE)) -> 2815.6109999999999 | F42: =IF(RC1="","",RC[-2]*RC[-4]*RC[-3]) -> 218036.93632975116 | G42: =IF(RC1="","",RC[-2]*RC[-5]) -> 2815.6109999999999
A43: =IF(R[-1]C1="","",IF(DATE(YEAR(R[-1]C),MONTH(R[-1]C)+1,1)>ValDat,"",DATE(YEAR(R[-1]C),MONTH(R[-1]C)+1,1))) -> 2001-06-01T00:00:00.000 | B43: =IF(RC1="","",VLOOKUP(RC1,NccFacDump,2,FALSE)) -> 1 | C43: =IF(RC1="","",VLOOKUP(EOMONTH(ValDat,-1)+1,TrendFacDump,2,FALSE)/VLOOKUP(RC[-2],TrendFacDump,2,FALSE)) -> 1.004823151125402 | D43: =IF(RC1="","",VLOOKUP(RC1,CalcIncClms,10,FALSE)) -> 142932.54313697765 | E43: =IF(RC1="","",VLOOKUP(RC1,ExpDump,7,FALSE)) -> 2810.5160000000001 | F43: =IF(RC1="","",RC[-2]*RC[-4]*RC[-3]) -> 143621.92839326532 | G43: =IF(RC1="","",RC[-2]*RC[-5]) -> 2810.5160000000001
A44: =IF(R[-1]C1="","",IF(DATE(YEAR(R[-1]C),MONTH(R[-1]C)+1,1)>ValDat,"",DATE(YEAR(R[-1]C),MONTH(R[-1]C)+1,1))) -> 2001-07-01T00:00:00.000 | B44: =IF(RC1="","",VLOOKUP(RC1,NccFacDump,2,FALSE)) -> 1 | C44: =IF(RC1="","",VLOOKUP(EOMONTH(ValDat,-1)+1,TrendFacDump,2,FALSE)/VLOOKUP(RC[-2],TrendFacDump,2,FALSE)) -> 1 | D44: =IF(RC1="","",VLOOKUP(RC1,CalcIncClms,10,FALSE)) -> 182782.79851245074 | E44: =IF(RC1="","",VLOOKUP(RC1,ExpDump,7,FALSE)) -> 2830.0740000000001 | F44: =IF(RC1="","",RC[-2]*RC[-4]*RC[-3]) -> 182782.79851245074 | G44: =IF(RC1="","",RC[-2]*RC[-5]) -> 2830.0740000000001
F45: =SUM(R[-36]C:R[-1]C) -> 7228424.0968452776 | G45: =SUM(R[-36]C:R[-1]C) -> 104079.17000000001
A47: SUMMARY:
B48: ITEM DESCRIPTION | F48: VALUE
B49: (A) Total Weighted and Trended Incurred Claims ………………………. | F49: =R[-4]C -> 7228424.0968452776
B50: (B) Total Weighted Exposure …………………………………………….. | F50: =R[-5]C[1] -> 104079.17000000001
B51: (C) Weighted NCC0 (A/B) …………………………………………………. | F51: =R[-6]C/R[-6]C[1] -> 69.451208122098564

Sheet: Output
A1: =title1&" - Output Tab" -> BLOCK CLAIM LIABILITY REPORT - Output Tab
A2: =title2 -> The Millennium-2000 Sample Life Insurance Company
A3: =title3 -> Arvind
A4: =title4 -> Experience Period: 01-Aug-1998 to 31-Jul-2001. Runout Date: 31-Jul-2001
A6: Incurred Month | B6: Desc | C6: Values
A7: Weighted | B7: NCCO for ExpPeriod | C7: =WeightedNCC0 -> 69.451208122098564
A8: Trended | B8: =UPPER(Basis)&" for ExpPeriod" -> IBNR for ExpPeriod | C8: =TrendedIBNR -> 520362.66145624034
A9: =IF(R[1]C1="","",IF(DATE(YEAR(R[1]C),MONTH(R[1]C)-1,1)<ExpDat,"",DATE(YEAR(R[1]C),MONTH(R[1]C)-1,1))) -> 1998-08-01T00:00:00.000 | B9: CompFac for Lag35 | C9: =IF(RC1="","",INDEX(CmpFac,1+MIN(MEP,ROUND(DAYS360(RC1,DATE(YEAR(ValDat),MONTH(ValDat),1),0)/30,0)))) -> 1
A10: =IF(R[1]C1="","",IF(DATE(YEAR(R[1]C),MONTH(R[1]C)-1,1)<ExpDat,"",DATE(YEAR(R[1]C),MONTH(R[1]C)-1,1))) -> 1998-09-01T00:00:00.000 | B10: CompFac for Lag34 | C10: =IF(RC1="","",INDEX(CmpFac,1+MIN(MEP,ROUND(DAYS360(RC1,ValDat,0)/30,0)))) -> 1
A11: =IF(R[1]C1="","",IF(DATE(YEAR(R[1]C),MONTH(R[1]C)-1,1)<ExpDat,"",DATE(YEAR(R[1]C),MONTH(R[1]C)-1,1))) -> 1998-10-01T00:00:00.000 | B11: CompFac for Lag33 | C11: =IF(RC1="","",INDEX(CmpFac,1+MIN(MEP,ROUND(DAYS360(RC1,ValDat,0)/30,0)))) -> 1
A12: =IF(R[1]C1="","",IF(DATE(YEAR(R[1]C),MONTH(R[1]C)-1,1)<ExpDat,"",DATE(YEAR(R[1]C),MONTH(R[1]C)-1,1))) -> 1998-11-01T00:00:00.000 | B12: CompFac for Lag32 | C12: =IF(RC1="","",INDEX(CmpFac,1+MIN(MEP,ROUND(DAYS360(RC1,ValDat,0)/30,0)))) -> 1
A13: =IF(R[1]C1="","",IF(DATE(YEAR(R[1]C),MONTH(R[1]C)-1,1)<ExpDat,"",DATE(YEAR(R[1]C),MONTH(R[1]C)-1,1))) -> 1998-12-01T00:00:00.000 | B13: CompFac for Lag31 | C13: =IF(RC1="","",INDEX(CmpFac,1+MIN(MEP,ROUND(DAYS360(RC1,ValDat,0)/30,0)))) -> 1
A14: =IF(R[1]C1="","",IF(DATE(YEAR(R[1]C),MONTH(R[1]C)-1,1)<ExpDat,"",DATE(YEAR(R[1]C),MONTH(R[1]C)-1,1))) -> 1999-01-01T00:00:00.000 | B14: CompFac for Lag30 | C14: =IF(RC1="","",INDEX(CmpFac,1+MIN(MEP,ROUND(DAYS360(RC1,ValDat,0)/30,0)))) -> 1
A15: =IF(R[1]C1="","",IF(DATE(YEAR(R[1]C),MONTH(R[1]C)-1,1)<ExpDat,"",DATE(YEAR(R[1]C),MONTH(R[1]C)-1,1))) -> 1999-02-01T00:00:00.000 | B15: CompFac for Lag29 | C15: =IF(RC1="","",INDEX(CmpFac,1+MIN(MEP,ROUND(DAYS360(RC1,ValDat,0)/30,0)))) -> 1
A16: =IF(R[1]C1="","",IF(DATE(YEAR(R[1]C),MONTH(R[1]C)-1,1)<ExpDat,"",DATE(YEAR(R[1]C),MONTH(R[1]C)-1,1))) -> 1999-03-01T00:00:00.000 | B16: CompFac for Lag28 | C16: =IF(RC1="","",INDEX(CmpFac,1+MIN(MEP,ROUND(DAYS360(RC1,ValDat,0)/30,0)))) -> 1
A17: =IF(R[1]C1="","",IF(DATE(YEAR(R[1]C),MONTH(R[1]C)-1,1)<ExpDat,"",DATE(YEAR(R[1]C),MONTH(R[1]C)-1,1))) -> 1999-04-01T00:00:00.000 | B17: CompFac for Lag27 | C17: =IF(RC1="","",INDEX(CmpFac,1+MIN(MEP,ROUND(DAYS360(RC1,ValDat,0)/30,0)))) -> 1
A18: =IF(R[1]C1="","",IF(DATE(YEAR(R[1]C),MONTH(R[1]C)-1,1)<ExpDat,"",DATE(YEAR(R[1]C),MONTH(R[1]C)-1,1))) -> 1999-05-01T00:00:00.000 | B18: CompFac for Lag26 | C18: =IF(RC1="","",INDEX(CmpFac,1+MIN(MEP,ROUND(DAYS360(RC1,ValDat,0)/30,0)))) -> 1
A19: =IF(R[1]C1="","",IF(DATE(YEAR(R[1]C),MONTH(R[1]C)-1,1)<ExpDat,"",DATE(YEAR(R[1]C),MONTH(R[1]C)-1,1))) -> 1999-06-01T00:00:00.000 | B19: CompFac for Lag25 | C19: =IF(RC1="","",INDEX(CmpFac,1+MIN(MEP,ROUND(DAYS360(RC1,ValDat,0)/30,0)))) -> 1
A20: =IF(R[1]C1="","",IF(DATE(YEAR(R[1]C),MONTH(R[1]C)-1,1)<ExpDat,"",DATE(YEAR(R[1]C),MONTH(R[1]C)-1,1))) -> 1999-07-01T00:00:00.000 | B20: CompFac for Lag24 | C20: =IF(RC1="","",INDEX(CmpFac,1+MIN(MEP,ROUND(DAYS360(RC1,ValDat,0)/30,0)))) -> 1
A21: =IF(R[1]C1="","",IF(DATE(YEAR(R[1]C),MONTH(R[1]C)-1,1)<ExpDat,"",DATE(YEAR(R[1]C),MONTH(R[1]C)-1,1))) -> 1999-08-01T00:00:00.000 | B21: CompFac for Lag23 | C21: =IF(RC1="","",INDEX(CmpFac,1+MIN(MEP,ROUND(DAYS360(RC1,ValDat,0)/30,0)))) -> 1
A22: =IF(R[1]C1="","",IF(DATE(YEAR(R[1]C),MONTH(R[1]C)-1,1)<ExpDat,"",DATE(YEAR(R[1]C),MONTH(R[1]C)-1,1))) -> 1999-09-01T00:00:00.000 | B22: CompFac for Lag22 | C22: =IF(RC1="","",INDEX(CmpFac,1+MIN(MEP,ROUND(DAYS360(RC1,ValDat,0)/30,0)))) -> 1
A23: =IF(R[1]C1="","",IF(DATE(YEAR(R[1]C),MONTH(R[1]C)-1,1)<ExpDat,"",DATE(YEAR(R[1]C),MONTH(R[1]C)-1,1))) -> 1999-10-01T00:00:00.000 | B23: CompFac for Lag21 | C23: =IF(RC1="","",INDEX(CmpFac,1+MIN(MEP,ROUND(DAYS360(RC1,ValDat,0)/30,0)))) -> 1
A24: =IF(R[1]C1="","",IF(DATE(YEAR(R[1]C),MONTH(R[1]C)-1,1)<ExpDat,"",DATE(YEAR(R[1]C),MONTH(R[1]C)-1,1))) -> 1999-11-01T00:00:00.000 | B24: CompFac for Lag20 | C24: =IF(RC1="","",INDEX(CmpFac,1+MIN(MEP,ROUND(DAYS360(RC1,ValDat,0)/30,0)))) -> 1
A25: =IF(R[1]C1="","",IF(DATE(YEAR(R[1]C),MONTH(R[1]C)-1,1)<ExpDat,"",DATE(YEAR(R[1]C),MONTH(R[1]C)-1,1))) -> 1999-12-01T00:00:00.000 | B25: CompFac for Lag19 | C25: =IF(RC1="","",INDEX(CmpFac,1+MIN(MEP,ROUND(DAYS360(RC1,ValDat,0)/30,0)))) -> 1
A26: =IF(R[1]C1="","",IF(DATE(YEAR(R[1]C),MONTH(R[1]C)-1,1)<ExpDat,"",DATE(YEAR(R[1]C),MONTH(R[1]C)-1,1))) -> 2000-01-01T00:00:00.000 | B26: CompFac for Lag18 | C26: =IF(RC1="","",INDEX(CmpFac,1+MIN(MEP,ROUND(DAYS360(RC1,ValDat,0)/30,0)))) -> 1
A27: =IF(R[1]C1="","",IF(DATE(YEAR(R[1]C),MONTH(R[1]C)-1,1)<ExpDat,"",DATE(YEAR(R[1]C),MONTH(R[1]C)-1,1))) -> 2000-02-01T00:00:00.000 | B27: CompFac for Lag17 | C27: =IF(RC1="","",INDEX(CmpFac,1+MIN(MEP,ROUND(DAYS360(RC1,ValDat,0)/30,0)))) -> 1
A28: =IF(R[1]C1="","",IF(DATE(YEAR(R[1]C),MONTH(R[1]C)-1,1)<ExpDat,"",DATE(YEAR(R[1]C),MONTH(R[1]C)-1,1))) -> 2000-03-01T00:00:00.000 | B28: CompFac for Lag16 | C28: =IF(RC1="","",INDEX(CmpFac,1+MIN(MEP,ROUND(DAYS360(RC1,ValDat,0)/30,0)))) -> 1
A29: =IF(R[1]C1="","",IF(DATE(YEAR(R[1]C),MONTH(R[1]C)-1,1)<ExpDat,"",DATE(YEAR(R[1]C),MONTH(R[1]C)-1,1))) -> 2000-04-01T00:00:00.000 | B29: CompFac for Lag15 | C29: =IF(RC1="","",INDEX(CmpFac,1+MIN(MEP,ROUND(DAYS360(RC1,ValDat,0)/30,0)))) -> 0.99965000000000004
A30: =IF(R[1]C1="","",IF(DATE(YEAR(R[1]C),MONTH(R[1]C)-1,1)<ExpDat,"",DATE(YEAR(R[1]C),MONTH(R[1]C)-1,1))) -> 2000-05-01T00:00:00.000 | B30: CompFac for Lag14 | C30: =IF(RC1="","",INDEX(CmpFac,1+MIN(MEP,ROUND(DAYS360(RC1,ValDat,0)/30,0)))) -> 0.99873999999999996
A31: =IF(R[1]C1="","",IF(DATE(YEAR(R[1]C),MONTH(R[1]C)-1,1)<ExpDat,"",DATE(YEAR(R[1]C),MONTH(R[1]C)-1,1))) -> 2000-06-01T00:00:00.000 | B31: CompFac for Lag13 | C31: =IF(RC1="","",INDEX(CmpFac,1+MIN(MEP,ROUND(DAYS360(RC1,ValDat,0)/30,0)))) -> 0.99492000000000003
A32: =IF(R[1]C1="","",IF(DATE(YEAR(R[1]C),MONTH(R[1]C)-1,1)<ExpDat,"",DATE(YEAR(R[1]C),MONTH(R[1]C)-1,1))) -> 2000-07-01T00:00:00.000 | B32: CompFac for Lag12 | C32: =IF(RC1="","",INDEX(CmpFac,1+MIN(MEP,ROUND(DAYS360(RC1,ValDat,0)/30,0)))) -> 0.99492000000000003
A33: =IF(R[1]C1="","",IF(DATE(YEAR(R[1]C),MONTH(R[1]C)-1,1)<ExpDat,"",DATE(YEAR(R[1]C),MONTH(R[1]C)-1,1))) -> 2000-08-01T00:00:00.000 | B33: CompFac for Lag11 | C33: =IF(RC1="","",INDEX(CmpFac,1+MIN(MEP,ROUND(DAYS360(RC1,ValDat,0)/30,0)))) -> 0.99492000000000003
A34: =IF(R[1]C1="","",IF(DATE(YEAR(R[1]C),MONTH(R[1]C)-1,1)<ExpDat,"",DATE(YEAR(R[1]C),MONTH(R[1]C)-1,1))) -> 2000-09-01T00:00:00.000 | B34: CompFac for Lag10 | C34: =IF(RC1="","",INDEX(CmpFac,1+MIN(MEP,ROUND(DAYS360(RC1,ValDat,0)/30,0)))) -> 0.99492000000000003
A35: =IF(R[1]C1="","",IF(DATE(YEAR(R[1]C),MONTH(R[1]C)-1,1)<ExpDat,"",DATE(YEAR(R[1]C),MONTH(R[1]C)-1,1))) -> 2000-10-01T00:00:00.000 | B35: CompFac for Lag9 | C35: =IF(RC1="","",INDEX(CmpFac,1+MIN(MEP,ROUND(DAYS360(RC1,ValDat,0)/30,0)))) -> 0.99331999999999998
A36: =IF(R[1]C1="","",IF(DATE(YEAR(R[1]C),MONTH(R[1]C)-1,1)<ExpDat,"",DATE(YEAR(R[1]C),MONTH(R[1]C)-1,1))) -> 2000-11-01T00:00:00.000 | B36: CompFac for Lag8 | C36: =IF(RC1="","",INDEX(CmpFac,1+MIN(MEP,ROUND(DAYS360(RC1,ValDat,0)/30,0)))) -> 0.99184000000000005
A37: =IF(R[1]C1="","",IF(DATE(YEAR(R[1]C),MONTH(R[1]C)-1,1)<ExpDat,"",DATE(YEAR(R[1]C),MONTH(R[1]C)-1,1))) -> 2000-12-01T00:00:00.000 | B37: CompFac for Lag7 | C37: =IF(RC1="","",INDEX(CmpFac,1+MIN(MEP,ROUND(DAYS360(RC1,ValDat,0)/30,0)))) -> 0.99061999999999995
A38: =IF(R[1]C1="","",IF(DATE(YEAR(R[1]C),MONTH(R[1]C)-1,1)<ExpDat,"",DATE(YEAR(R[1]C),MONTH(R[1]C)-1,1))) -> 2001-01-01T00:00:00.000 | B38: CompFac for Lag6 | C38: =IF(RC1="","",INDEX(CmpFac,1+MIN(MEP,ROUND(DAYS360(RC1,ValDat,0)/30,0)))) -> 0.98426999999999998
A39: =IF(R[1]C1="","",IF(DATE(YEAR(R[1]C),MONTH(R[1]C)-1,1)<ExpDat,"",DATE(YEAR(R[1]C),MONTH(R[1]C)-1,1))) -> 2001-02-01T00:00:00.000 | B39: CompFac for Lag5 | C39: =IF(RC1="","",INDEX(CmpFac,1+MIN(MEP,ROUND(DAYS360(RC1,ValDat,0)/30,0)))) -> 0.95501999999999998
A40: =IF(R[1]C1="","",IF(DATE(YEAR(R[1]C),MONTH(R[1]C)-1,1)<ExpDat,"",DATE(YEAR(R[1]C),MONTH(R[1]C)-1,1))) -> 2001-03-01T00:00:00.000 | B40: CompFac for Lag4 | C40: =IF(RC1="","",INDEX(CmpFac,1+MIN(MEP,ROUND(DAYS360(RC1,ValDat,0)/30,0)))) -> 0.92320000000000002
A41: =IF(R[1]C1="","",IF(DATE(YEAR(R[1]C),MONTH(R[1]C)-1,1)<ExpDat,"",DATE(YEAR(R[1]C),MONTH(R[1]C)-1,1))) -> 2001-04-01T00:00:00.000 | B41: CompFac for Lag3 | C41: =IF(RC1="","",INDEX(CmpFac,1+MIN(MEP,ROUND(DAYS360(RC1,ValDat,0)/30,0)))) -> 0.8931
A42: =IF(R[1]C1="","",IF(DATE(YEAR(R[1]C),MONTH(R[1]C)-1,1)<ExpDat,"",DATE(YEAR(R[1]C),MONTH(R[1]C)-1,1))) -> 2001-05-01T00:00:00.000 | B42: CompFac for Lag2 | C42: =IF(RC1="","",INDEX(CmpFac,1+MIN(MEP,ROUND(DAYS360(RC1,ValDat,0)/30,0)))) -> 0.82328999999999997
A43: =IF(R[1]C1="","",IF(DATE(YEAR(R[1]C),MONTH(R[1]C)-1,1)<ExpDat,"",DATE(YEAR(R[1]C),MONTH(R[1]C)-1,1))) -> 2001-06-01T00:00:00.000 | B43: CompFac for Lag1 | C43: =IF(RC1="","",INDEX(CmpFac,1+MIN(MEP,ROUND(DAYS360(RC1,ValDat,0)/30,0)))) -> 0.53695999999999999
A44: =ValDat -> 2001-07-31T00:00:00.000 | B44: CompFac for Lag0 | C44: =IF(RC1="","",INDEX(CmpFac,1+MIN(MEP,ROUND(DAYS360(RC1,ValDat,0)/30,0)))) -> 5.2269999999999997E-2

Sheet: csv
A1: OBJECTID | B1: SRNO | C1: NAME | D1: VALUE | E1: REFDATE
A2: 1 | B2: 1 | C2: ='general dump'!R70C1 -> 6196 | D2: =Output!R[5]C[-1] -> 69.451208122098564
A3: 2 | B3: 2 | C3: ='general dump'!R70C1 -> 6196 | D3: =Output!R[5]C[-1] -> 520362.66145624034
A4: 3 | B4: 3 | C4: ='general dump'!R70C1 -> 6196 | D4: =Output!R[5]C[-1] -> 1 | E4: =Output!R[5]C[-4] -> 1998-08-01T00:00:00.000
A5: 4 | B5: 4 | C5: ='general dump'!R70C1 -> 6196 | D5: =Output!R[5]C[-1] -> 1 | E5: =Output!R[5]C[-4] -> 1998-09-01T00:00:00.000
A6: 5 | B6: 5 | C6: ='general dump'!R70C1 -> 6196 | D6: =Output!R[5]C[-1] -> 1 | E6: =Output!R[5]C[-4] -> 1998-10-01T00:00:00.000
A7: 6 | B7: 6 | C7: ='general dump'!R70C1 -> 6196 | D7: =Output!R[5]C[-1] -> 1 | E7: =Output!R[5]C[-4] -> 1998-11-01T00:00:00.000
A8: 7 | B8: 7 | C8: ='general dump'!R70C1 -> 6196 | D8: =Output!R[5]C[-1] -> 1 | E8: =Output!R[5]C[-4] -> 1998-12-01T00:00:00.000
A9: 8 | B9: 8 | C9: ='general dump'!R70C1 -> 6196 | D9: =Output!R[5]C[-1] -> 1 | E9: =Output!R[5]C[-4] -> 1999-01-01T00:00:00.000
A10: 9 | B10: 9 | C10: ='general dump'!R70C1 -> 6196 | D10: =Output!R[5]C[-1] -> 1 | E10: =Output!R[5]C[-4] -> 1999-02-01T00:00:00.000
A11: 10 | B11: 10 | C11: ='general dump'!R70C1 -> 6196 | D11: =Output!R[5]C[-1] -> 1 | E11: =Output!R[5]C[-4] -> 1999-03-01T00:00:00.000
A12: 11 | B12: 11 | C12: ='general dump'!R70C1 -> 6196 | D12: =Output!R[5]C[-1] -> 1 | E12: =Output!R[5]C[-4] -> 1999-04-01T00:00:00.000
A13: 12 | B13: 12 | C13: ='general dump'!R70C1 -> 6196 | D13: =Output!R[5]C[-1] -> 1 | E13: =Output!R[5]C[-4] -> 1999-05-01T00:00:00.000
A14: 13 | B14: 13 | C14: ='general dump'!R70C1 -> 6196 | D14: =Output!R[5]C[-1] -> 1 | E14: =Output!R[5]C[-4] -> 1999-06-01T00:00:00.000
A15: 14 | B15: 14 | C15: ='general dump'!R70C1 -> 6196 | D15: =Output!R[5]C[-1] -> 1 | E15: =Output!R[5]C[-4] -> 1999-07-01T00:00:00.000
A16: 15 | B16: 15 | C16: ='general dump'!R70C1 -> 6196 | D16: =Output!R[5]C[-1] -> 1 | E16: =Output!R[5]C[-4] -> 1999-08-01T00:00:00.000
A17: 16 | B17: 16 | C17: ='general dump'!R70C1 -> 6196 | D17: =Output!R[5]C[-1] -> 1 | E17: =Output!R[5]C[-4] -> 1999-09-01T00:00:00.000
A18: 17 | B18: 17 | C18: ='general dump'!R70C1 -> 6196 | D18: =Output!R[5]C[-1] -> 1 | E18: =Output!R[5]C[-4] -> 1999-10-01T00:00:00.000
A19: 18 | B19: 18 | C19: ='general dump'!R70C1 -> 6196 | D19: =Output!R[5]C[-1] -> 1 | E19: =Output!R[5]C[-4] -> 1999-11-01T00:00:00.000
A20: 19 | B20: 19 | C20: ='general dump'!R70C1 -> 6196 | D20: =Output!R[5]C[-1] -> 1 | E20: =Output!R[5]C[-4] -> 1999-12-01T00:00:00.000
A21: 20 | B21: 20 | C21: ='general dump'!R70C1 -> 6196 | D21: =Output!R[5]C[-1] -> 1 | E21: =Output!R[5]C[-4] -> 2000-01-01T00:00:00.000
A22: 21 | B22: 21 | C22: ='general dump'!R70C1 -> 6196 | D22: =Output!R[5]C[-1] -> 1 | E22: =Output!R[5]C[-4] -> 2000-02-01T00:00:00.000
A23: 22 | B23: 22 | C23: ='general dump'!R70C1 -> 6196 | D23: =Output!R[5]C[-1] -> 1 | E23: =Output!R[5]C[-4] -> 2000-03-01T00:00:00.000
A24: 23 | B24: 23 | C24: ='general dump'!R70C1 -> 6196 | D24: =Output!R[5]C[-1] -> 0.99965000000000004 | E24: =Output!R[5]C[-4] -> 2000-04-01T00:00:00.000
A25: 24 | B25: 24 | C25: ='general dump'!R70C1 -> 6196 | D25: =Output!R[5]C[-1] -> 0.99873999999999996 | E25: =Output!R[5]C[-4] -> 2000-05-01T00:00:00.000
A26: 25 | B26: 25 | C26: ='general dump'!R70C1 -> 6196 | D26: =Output!R[5]C[-1] -> 0.99492000000000003 | E26: =Output!R[5]C[-4] -> 2000-06-01T00:00:00.000
A27: 26 | B27: 26 | C27: ='general dump'!R70C1 -> 6196 | D27: =Output!R[5]C[-1] -> 0.99492000000000003 | E27: =Output!R[5]C[-4] -> 2000-07-01T00:00:00.000
A28: 27 | B28: 27 | C28: ='general dump'!R70C1 -> 6196 | D28: =Output!R[5]C[-1] -> 0.99492000000000003 | E28: =Output!R[5]C[-4] -> 2000-08-01T00:00:00.000
A29: 28 | B29: 28 | C29: ='general dump'!R70C1 -> 6196 | D29: =Output!R[5]C[-1] -> 0.99492000000000003 | E29: =Output!R[5]C[-4] -> 2000-09-01T00:00:00.000
A30: 29 | B30: 29 | C30: ='general dump'!R70C1 -> 6196 | D30: =Output!R[5]C[-1] -> 0.99331999999999998 | E30: =Output!R[5]C[-4] -> 2000-10-01T00:00:00.000
A31: 30 | B31: 30 | C31: ='general dump'!R70C1 -> 6196 | D31: =Output!R[5]C[-1] -> 0.99184000000000005 | E31: =Output!R[5]C[-4] -> 2000-11-01T00:00:00.000
A32: 31 | B32: 31 | C32: ='general dump'!R70C1 -> 6196 | D32: =Output!R[5]C[-1] -> 0.99061999999999995 | E32: =Output!R[5]C[-4] -> 2000-12-01T00:00:00.000
A33: 32 | B33: 32 | C33: ='general dump'!R70C1 -> 6196 | D33: =Output!R[5]C[-1] -> 0.98426999999999998 | E33: =Output!R[5]C[-4] -> 2001-01-01T00:00:00.000
A34: 33 | B34: 33 | C34: ='general dump'!R70C1 -> 6196 | D34: =Output!R[5]C[-1] -> 0.95501999999999998 | E34: =Output!R[5]C[-4] -> 2001-02-01T00:00:00.000
A35: 34 | B35: 34 | C35: ='general dump'!R70C1 -> 6196 | D35: =Output!R[5]C[-1] -> 0.92320000000000002 | E35: =Output!R[5]C[-4] -> 2001-03-01T00:00:00.000
A36: 35 | B36: 35 | C36: ='general dump'!R70C1 -> 6196 | D36: =Output!R[5]C[-1] -> 0.8931 | E36: =Output!R[5]C[-4] -> 2001-04-01T00:00:00.000
A37: 36 | B37: 36 | C37: ='general dump'!R70C1 -> 6196 | D37: =Output!R[5]C[-1] -> 0.82328999999999997 | E37: =Output!R[5]C[-4] -> 2001-05-01T00:00:00.000
A38: 37 | B38: 37 | C38: ='general dump'!R70C1 -> 6196 | D38: =Output!R[5]C[-1] -> 0.53695999999999999 | E38: =Output!R[5]C[-4] -> 2001-06-01T00:00:00.000
A39: 38 | B39: 38 | C39: ='general dump'!R70C1 -> 6196 | D39: =Output!R[5]C[-1] -> 5.2269999999999997E-2 | E39: =Output!R[5]C[-4] -> 2001-07-31T00:00:00.000