Sheet: Sheet1
A1: Department: | B1: Name | C1: Payment | D1: Bonus | E1: Total | F1: Department: | I1: Payment | J1: Bonus | K1: Total
A2: IT | B2: Elsa | C2: 1500 | D2: 0.15 | E2: =RC[-2]*(1+RC[-1]) -> 1724.9999999999998 | F2: IT | G2: Employee: | H2: Natali | I2: 1200 | J2: 0.1 | K2: =RC[-2]*(1+RC[-1]) -> 1320
B3: Oleg | C3: 2300 | D3: 0.25 | E3: =RC[-2]*(1+RC[-1]) -> 2875 | G3: Employee: | H3: Helen | I3: 1100 | J3: 0.2 | K3: =RC[-2]*(1+RC[-1]) -> 1320
B4: Neil | C4: 2500 | D4: 0 | E4: =RC[-2]*(1+RC[-1]) -> 2500 | G4: Employee: | H4: Olga | I4: 1150 | J4: 0 | K4: =RC[-2]*(1+RC[-1]) -> 1150
B5: Maria | C5: 1700 | D5: 0.15 | E5: =RC[-2]*(1+RC[-1]) -> 1954.9999999999998
B6: John | C6: 2800 | D6: 0.2 | E6: =RC[-2]*(1+RC[-1]) -> 3360
B7: Totals: | C7: =SUM(R[-5]C:R[-1]C) -> 10800 | E7: =SUM(R[-5]C:R[-1]C) -> 12415