Sheet: Sheet1
A1: Employees
A2: Name | B2: Payment | C2: Bonus | D2: Total | E2: Department
A3: John | B3: 1800 | C3: 0.2 | D3: =RC[-2]*(1+RC[-1]) -> 2160 | E3: IT
A4: Neil | B4: 2300 | C4: 0.25 | D4: =RC[-2]*(1+RC[-1]) -> 2875 | E4: IT
A5: Denise | B5: 2400 | C5: 0.2 | D5: =RC[-2]*(1+RC[-1]) -> 2880 | E5: BA
A6: Oleg | B6: 1500 | C6: 0.25 | D6: =RC[-2]*(1+RC[-1]) -> 1875 | E6: IT
A7: LeAnn | B7: 2200 | C7: 0.1 | D7: =RC[-2]*(1+RC[-1]) -> 2420 | E7: BA
A8: Cat | B8: 1900 | C8: 0.1 | D8: =RC[-2]*(1+RC[-1]) -> 2090 | E8: HR
A9: Keith | B9: 1800 | C9: 0.2 | D9: =RC[-2]*(1+RC[-1]) -> 2160 | E9: HR
A10: Natali | B10: 1700 | C10: 0.15 | D10: =RC[-2]*(1+RC[-1]) -> 1954.9999999999998 | E10: BA
A11: Olga | B11: 1400 | C11: 0.15 | D11: =RC[-2]*(1+RC[-1]) -> 1609.9999999999998 | E11: HR
A12: Maria | B12: 2400 | C12: 0.1 | D12: =RC[-2]*(1+RC[-1]) -> 2640 | E12: IT
A13: Elsa | B13: 3000 | C13: 0.3 | D13: =RC[-2]*(1+RC[-1]) -> 3900 | E13: IT
A14: Helen | B14: 2100 | C14: 0.05 | D14: =RC[-2]*(1+RC[-1]) -> 2205 | E14: HR
A15: Totals: | D15: =SUM(R[-12]C:R[-1]C) -> 28770
A16: SQL grouping test
A17: Department: BA
A18: Employees
A19: Name | B19: Payment | C19: Bonus | D19: Total
A20: Denise | B20: 2400 | C20: 0.2 | D20: =RC[-2]*(1+RC[-1]) -> 2880
A21: LeAnn | B21: 2200 | C21: 0.1 | D21: =RC[-2]*(1+RC[-1]) -> 2420
A22: Natali | B22: 1700 | C22: 0.15 | D22: =RC[-2]*(1+RC[-1]) -> 1954.9999999999998
A23: Totals: | D23: =SUM(R[-3]C:R[-1]C) -> 7255
A24: Department: HR
A25: Employees
A26: Name | B26: Payment | C26: Bonus | D26: Total
A27: Cat | B27: 1900 | C27: 0.1 | D27: =RC[-2]*(1+RC[-1]) -> 2090
A28: Keith | B28: 1800 | C28: 0.2 | D28: =RC[-2]*(1+RC[-1]) -> 2160
A29: Olga | B29: 1400 | C29: 0.15 | D29: =RC[-2]*(1+RC[-1]) -> 1609.9999999999998
A30: Helen | B30: 2100 | C30: 0.05 | D30: =RC[-2]*(1+RC[-1]) -> 2205
A31: Totals: | D31: =SUM(R[-4]C:R[-1]C) -> 8065
A32: Department: IT
A33: Employees
A34: Name | B34: Payment | C34: Bonus | D34: Total
A35: John | B35: 1800 | C35: 0.2 | D35: =RC[-2]*(1+RC[-1]) -> 2160
A36: Neil | B36: 2300 | C36: 0.25 | D36: =RC[-2]*(1+RC[-1]) -> 2875
A37: Oleg | B37: 1500 | C37: 0.25 | D37: =RC[-2]*(1+RC[-1]) -> 1875
A38: Maria | B38: 2400 | C38: 0.1 | D38: =RC[-2]*(1+RC[-1]) -> 2640
A39: Elsa | B39: 3000 | C39: 0.3 | D39: =RC[-2]*(1+RC[-1]) -> 3900
A40: Totals: | D40: =SUM(R[-5]C:R[-1]C) -> 13450
A41: SQL subqueries test
A42: Department: IT
A43: Employees
A44: Name | B44: Payment | C44: Bonus | D44: Total
A45: Elsa | B45: 3000 | C45: 0.3 | D45: =RC[-2]*(1+RC[-1]) -> 3900
A46: Oleg | B46: 1500 | C46: 0.25 | D46: =RC[-2]*(1+RC[-1]) -> 1875
A47: Neil | B47: 2300 | C47: 0.25 | D47: =RC[-2]*(1+RC[-1]) -> 2875
A48: Maria | B48: 2400 | C48: 0.1 | D48: =RC[-2]*(1+RC[-1]) -> 2640
A49: John | B49: 1800 | C49: 0.2 | D49: =RC[-2]*(1+RC[-1]) -> 2160
A50: Totals: | D50: =SUM(R[-5]C:R[-1]C) -> 13450
A51: Department: HR
A52: Employees
A53: Name | B53: Payment | C53: Bonus | D53: Total
A54: Olga | B54: 1400 | C54: 0.15 | D54: =RC[-2]*(1+RC[-1]) -> 1609.9999999999998
A55: Helen | B55: 2100 | C55: 0.05 | D55: =RC[-2]*(1+RC[-1]) -> 2205
A56: Keith | B56: 1800 | C56: 0.2 | D56: =RC[-2]*(1+RC[-1]) -> 2160
A57: Cat | B57: 1900 | C57: 0.1 | D57: =RC[-2]*(1+RC[-1]) -> 2090
A58: Totals: | D58: =SUM(R[-4]C:R[-1]C) -> 8065
A59: Department: BA
A60: Employees
A61: Name | B61: Payment | C61: Bonus | D61: Total
A62: Denise | B62: 2400 | C62: 0.2 | D62: =RC[-2]*(1+RC[-1]) -> 2880
A63: LeAnn | B63: 2200 | C63: 0.1 | D63: =RC[-2]*(1+RC[-1]) -> 2420
A64: Natali | B64: 1700 | C64: 0.15 | D64: =RC[-2]*(1+RC[-1]) -> 1954.9999999999998
A65: Totals: | D65: =SUM(R[-3]C:R[-1]C) -> 7255
A66: Grand Total | D66: =SUM(R[-16]C,R[-8]C,R[-1]C) -> 28770