Sheet: Sheet1
A1: =0 -> 0
A2: Department | B2: IT | F2: =0 -> 0
A4: Employees
A5: Name | B5: Age | C5: Payment | D5: Bonus | E5: Total
A6: Elsa | B6: 28 years | C6: 1500 | D6: 0.15 | E6: =RC[-2]*(1+RC[-1]) -> 1724.9999999999998
A7: Oleg | B7: 32 years | C7: 2300 | D7: 0.25 | E7: =RC[-2]*(1+RC[-1]) -> 2875
A8: Neil | B8: 34 years | C8: 2500 | D8: 0 | E8: =RC[-2]*(1+RC[-1]) -> 2500
A9: Maria | B9: 34 years | C9: 1700 | D9: 0.15 | E9: =RC[-2]*(1+RC[-1]) -> 1954.9999999999998
A10: John | B10: 35 years | C10: 2800 | D10: 0.2 | E10: =RC[-2]*(1+RC[-1]) -> 3360
E11: =SUM(R[-5]C:R[-1]C) -> 12415