Sheet: Sheet1
A1: Department | B1: IT
A2: Chief
A3: Name | B3: Age | C3: Payment | D3: Bonus
A4: Derek | B4: 35 | C4: 3000 | D4: 0.3
A6: Employees
A7: Name | B7: Age | C7: Payment | D7: Bonus | E7: Total
A8: Elsa | B8: 28 | C8: 1500 | D8: 0.15 | E8: =RC[-2]*(1+RC[-1]) -> 1724.9999999999998
A9: Oleg | B9: 32 | C9: 2300 | D9: 0.25 | E9: =RC[-2]*(1+RC[-1]) -> 2875
A10: Neil | B10: 34 | C10: 2500 | D10: 0 | E10: =RC[-2]*(1+RC[-1]) -> 2500
A11: Maria | B11: 34 | C11: 1700 | D11: 0.15 | E11: =RC[-2]*(1+RC[-1]) -> 1954.9999999999998
A12: John | B12: 35 | C12: 2800 | D12: 0.2 | E12: =RC[-2]*(1+RC[-1]) -> 3360
A13: Total | E13: =SUM(R[-5]C:R[-1]C) -> 12415
A14: Department | B14: HR
A15: Chief
A16: Name | B16: Age | C16: Payment | D16: Bonus
A17: Betsy | B17: 37 | C17: 2200 | D17: 0.3
A19: Employees
A20: Name | B20: Age | C20: Payment | D20: Bonus | E20: Total
A21: Olga | B21: 26 | C21: 1400 | D21: 0.2 | E21: =RC[-2]*(1+RC[-1]) -> 1680
A22: Helen | B22: 30 | C22: 2100 | D22: 0.1 | E22: =RC[-2]*(1+RC[-1]) -> 2310
A23: Keith | B23: 24 | C23: 1800 | D23: 0.15 | E23: =RC[-2]*(1+RC[-1]) -> 2070
A24: Cat | B24: 34 | C24: 1900 | D24: 0.15 | E24: =RC[-2]*(1+RC[-1]) -> 2185
A25: Total | E25: =SUM(R[-4]C:R[-1]C) -> 8245
A26: Department | B26: BA
A27: Chief
A28: Name | B28: Age | C28: Payment | D28: Bonus
A29: Wendy | B29: 35 | C29: 2900 | D29: 0.35
A31: Employees
A32: Name | B32: Age | C32: Payment | D32: Bonus | E32: Total
A33: Denise | B33: 30 | C33: 2400 | D33: 0.2 | E33: =RC[-2]*(1+RC[-1]) -> 2880
A34: LeAnn | B34: 32 | C34: 2200 | D34: 0.15 | E34: =RC[-2]*(1+RC[-1]) -> 2530
A35: Natali | B35: 28 | C35: 2600 | D35: 0.1 | E35: =RC[-2]*(1+RC[-1]) -> 2860.0000000000005
A36: Martha | B36: 33 | C36: 2150 | D36: 0.25 | E36: =RC[-2]*(1+RC[-1]) -> 2687.5
A37: Total | E37: =SUM(R[-4]C:R[-1]C) -> 10957.5
A38: Grand Total | E38: =SUM(R[-25]C,R[-13]C,R[-1]C) -> 31617.5