Sheet: data
A1: x | B1: y
A2: 0 | B2: =SIN(RC[-1]/PI()) -> 0
A3: 1 | B3: =SIN(RC[-1]/PI()) -> 0.31296179620778664
A4: 2 | B4: =SIN(RC[-1]/PI()) -> 0.59448076852482212
A5: 3 | B5: =SIN(RC[-1]/PI()) -> 0.81627310858942137
A6: 4 | B6: =SIN(RC[-1]/PI()) -> 0.95605565732762954
A7: 5 | B7: =SIN(RC[-1]/PI()) -> 0.99978466206345629
A8: 6 | B8: =SIN(RC[-1]/PI()) -> 0.94306673225694737
A9: 7 | B9: =SIN(RC[-1]/PI()) -> 0.79160023716583128
A10: 8 | B10: =SIN(RC[-1]/PI()) -> 0.56060279883921404

Sheet: moredata
A1: month | B1: count
A2: january | B2: 18
A3: february | B3: 10
A4: march | B4: 15
A5: april | B5: 11
A6: may | B6: 17
A7: june | B7: 20
A8: july | B8: 12
A9: august | B9: 5
A10: september | B10: 14