Sheet: Sheet1
B1: Nothing
A2: 12345 | B2: No Formula
A3: =12345 -> 12345 | B3: Value
A4: =R[-2]C+R[-1]C -> 24690 | B4: Simple Equation
A5: =SUM(R[-3]C:R[-1]C) -> 49380 | B5: Alt Equation
A6: Shared Forumla
A7: =R[-3]C*2 -> 49380 | B7: =R[-3]C*2 -> #VALUE! | C7: =R[-3]C*2 -> 0 | D7: =R[-3]C*2 -> 0 | E7: =R[-3]C*2 -> 0
A9: Array Formula
A10: 1 | B10: 11 | C10: =SUM(RC[-2]:R[4]C[-2]*RC[-1]:R[4]C[-1]) -> 605
A11: 2 | B11: 22 | C11: 605
A12: 3 | B12: 33 | C12: 605
A13: 4 | B13: 44 | C13: 605
A14: 5 | B14: 55 | C14: 605